{"full-text-retrieval-response": {
    "scopus-eid": "2-s2.0-85148944157",
    "originalText": "serial JL 271089 291210 291731 291800 291881 31 Energy and Buildings ENERGYBUILDINGS 2023-02-21 2023-02-21 2023-02-24 2023-02-24 2023-09-28T18:56:15 1-s2.0-S0378778823001275 S0378-7788(23)00127-5 S0378778823001275 10.1016/j.enbuild.2023.112897 S300 S300.2 FULL-TEXT 1-s2.0-S0378778823X0005X 2024-04-16T11:25:38.724698Z 0 0 20230415 2023 2023-02-21T16:18:36.48429Z articleinfo articlenumber articletitlenorm authfirstinitialnorm authfirstsurnamenorm cid cids contenttype copyright crossmark dateloaded dateloadedtxt datesearch datesort dateupdated dco docsubtype doctype doi eid ewtransactionid hubeid indexeddate issn issnnorm itemstage itemtransactionid itemweight openaccess openarchive pg pgfirst pii piinorm pubdatestart pubdatetxt pubyr sectiontitle sortorder srctitle srctitlenorm srctype ssids alllist content subj subheadings suppl tomb volfirst volissue volumelist webpdf webpdfpagecount yearnav figure table body mmlmath acknowledge affil articletitle auth authfirstini authfull authkeywords authlast nomenclature primabst ref 0378-7788 03787788 true 285 285 C Volume 285 32 112897 112897 112897 20230415 15 April 2023 2023-04-15 2023 Research Articles article fla © 2023 Elsevier B.V. All rights reserved. AUTONOMOUSPRECONDITIONINGIMPROVEDPERSONALIZATIONINSHAREDWORKSPACESTHROUGHDATADRIVENPREDICTIVECONTROL RAZANAQVI S Nomenclature 1 Introduction 2 Literature Review 3 Problem Formulation 3.1 Data-Driven Learning Model 3.2 RLSE 3.3 TEPP 3.3.1 Phase I \u2013 Time-Bound Pre-Conditioning of the Test-Bed 3.3.1.1 TEPP-ASC 3.3.1.2 TEPP-FOC 3.3.2 Phase II \u2013 Satisfying Individual Temperature Requirements 4 Performance Evaluation 4.1 Test-Bed Layout 4.2 Test Scenarios 4.3 Performance Benchmarks 4.3.1 c-MPC 4.3.2 v-MPC 4.3.3 RBB 4.4 Evaluation Results - Phase I 4.4.1 Using TEPP-ASC 4.4.2 Using TEPP-FOC 4.4.3 Using c-MPC 4.4.4 Using v-MPC 4.5 Evaluation Results - Phase II 5 Conclusion Acknowledgement References AZAR 2012 506 518 E GUPTA 2016 142 152 S AGHEMO 2013 147 161 C DRGONA 2020 190 232 J SMARRA 2018 1252 1272 F TARIQ 2019 531 535 Z EXPERIMENTALEVALUATIONDATADRIVENPREDICTIVEINDOORTHERMALMANAGEMENTINPROCEEDINGSTENTHACMINTERNATIONALCONFERENCEFUTUREENERGYSYSTEMS LI 2021 111174 Y ARJUNAN 2022 111869 P BACHER 2011 1511 1522 P MA 2012 44 64 Y MACARULLA 2017 511 519 M LEI 2022 111944 L LEE 2022 112067 H JOE 2022 111898 J YU 2021 407 419 L FUX 2014 811 817 S JOE 2019 65 77 J LIU 2006 148 161 S ARYAL 2021 7089 7100 A KALAIMANI 2020 129 157 R BOYER 1996 207 214 H JIANG 2004 403 416 J RAZANAQVIX2023X112897 RAZANAQVIX2023X112897XS CHU_NSF publishAcceptedManuscriptIndexable http://www.elsevier.com/open-access/userlicense/1.0/ 2024-02-24T00:00:00.000Z http://creativecommons.org/licenses/by-nc-nd/4.0/ © 2023 Elsevier B.V. All rights reserved. 2023-03-03T10:31:58.078Z http://vtw.elsevier.com/data/voc/AddOnTypes/50.7/aggregated-refined National Science Foundation 1827546 NSF National Science Foundation http://data.elsevier.com/vocabulary/SciValFunders/100000001 http://sws.geonames.org/6252001/ This work was supported by the National Science Foundation through Award No. 1827546. https://doi.org/10.15223/policy-017 https://doi.org/10.15223/policy-037 https://doi.org/10.15223/policy-012 https://doi.org/10.15223/policy-029 https://doi.org/10.15223/policy-004 item S0378-7788(23)00127-5 S0378778823001275 1-s2.0-S0378778823001275 10.1016/j.enbuild.2023.112897 271089 2023-09-28T18:06:38.484804Z 2023-04-15 1-s2.0-S0378778823001275-main.pdf https://s3-eu-west-1.amazonaws.com/prod-ucs-content-store-eu-west/content/pii:S0378778823001275/MAIN/application/pdf/7836b56b8bffaca71126b46dd3be9977/main.pdf main.pdf pdf true 1411903 MAIN 13 1-s2.0-S0378778823001275-main_1.png https://s3-eu-west-1.amazonaws.com/prod-ucs-content-store-eu-west/content/pii:S0378778823001275/PREVIEW/image/png/86c55761f14e5e40998b0e86fcecd720/main_1.png main_1.png png 60600 849 656 IMAGE-WEB-PDF 1 1-s2.0-S0378778823001275-fx1.jpg https://s3-eu-west-1.amazonaws.com/prod-ucs-content-store-eu-west/content/pii:S0378778823001275/fx1/DOWNSAMPLED/image/jpeg/2a056a1fbbca011826773a5c486b2dee/fx1.jpg fx1 fx1.jpg jpg 75185 525 667 IMAGE-DOWNSAMPLED 1-s2.0-S0378778823001275-fx2.jpg https://s3-eu-west-1.amazonaws.com/prod-ucs-content-store-eu-west/content/pii:S0378778823001275/fx2/DOWNSAMPLED/image/jpeg/23d874758d6a346c92776567d1f9a34b/fx2.jpg fx2 fx2.jpg jpg 30318 184 667 IMAGE-DOWNSAMPLED 1-s2.0-S0378778823001275-gr1.jpg https://s3-eu-west-1.amazonaws.com/prod-ucs-content-store-eu-west/content/pii:S0378778823001275/gr1/HIGHRES/image/jpeg/7cd995e5cd096cd11b9e53b8cc62259a/gr1.jpg gr1 gr1.jpg jpg 18138 203 373 IMAGE-DOWNSAMPLED 1-s2.0-S0378778823001275-gr2.jpg https://s3-eu-west-1.amazonaws.com/prod-ucs-content-store-eu-west/content/pii:S0378778823001275/gr2/DOWNSAMPLED/image/jpeg/22d17e3d50cfad6144711cbc94c0fef9/gr2.jpg gr2 gr2.jpg jpg 29207 169 640 IMAGE-DOWNSAMPLED 1-s2.0-S0378778823001275-gr3.jpg https://s3-eu-west-1.amazonaws.com/prod-ucs-content-store-eu-west/content/pii:S0378778823001275/gr3/DOWNSAMPLED/image/jpeg/719c1bda5f561d89a8f5c6edcfe2ac8f/gr3.jpg gr3 gr3.jpg jpg 43712 235 686 IMAGE-DOWNSAMPLED 1-s2.0-S0378778823001275-gr4.jpg https://s3-eu-west-1.amazonaws.com/prod-ucs-content-store-eu-west/content/pii:S0378778823001275/gr4/THUMBNAIL/image/jpeg/4a8bd34d03236102ea6177206bf57f35/gr4.jpg gr4 gr4.jpg jpg 103999 518 711 IMAGE-DOWNSAMPLED 1-s2.0-S0378778823001275-gr5.jpg https://s3-eu-west-1.amazonaws.com/prod-ucs-content-store-eu-west/content/pii:S0378778823001275/gr5/THUMBNAIL/image/jpeg/50e67683dd8d9ed9b1045600a96721d3/gr5.jpg gr5 gr5.jpg jpg 58507 244 669 IMAGE-DOWNSAMPLED 1-s2.0-S0378778823001275-gr6.jpg https://s3-eu-west-1.amazonaws.com/prod-ucs-content-store-eu-west/content/pii:S0378778823001275/gr6/DOWNSAMPLED/image/jpeg/cde2814e99ada0c6c2bcf0cb9df419de/gr6.jpg gr6 gr6.jpg jpg 26897 299 364 IMAGE-DOWNSAMPLED 1-s2.0-S0378778823001275-fx1.sml https://s3-eu-west-1.amazonaws.com/prod-ucs-content-store-eu-west/content/pii:S0378778823001275/fx1/THUMBNAIL/image/gif/1c99c5f9dcbc5daeb9c67af66be8fc7e/fx1.sml fx1 fx1.sml sml 7993 164 208 IMAGE-THUMBNAIL 1-s2.0-S0378778823001275-fx2.sml https://s3-eu-west-1.amazonaws.com/prod-ucs-content-store-eu-west/content/pii:S0378778823001275/fx2/THUMBNAIL/image/gif/7bd3f0d09d8ee172e9d8e81633a7e48b/fx2.sml fx2 fx2.sml sml 4042 60 219 IMAGE-THUMBNAIL 1-s2.0-S0378778823001275-gr1.sml https://s3-eu-west-1.amazonaws.com/prod-ucs-content-store-eu-west/content/pii:S0378778823001275/gr1/THUMBNAIL/image/gif/dae9a31a7fdab6b47c2a20018d5a8660/gr1.sml gr1 gr1.sml sml 4587 119 219 IMAGE-THUMBNAIL 1-s2.0-S0378778823001275-gr2.sml https://s3-eu-west-1.amazonaws.com/prod-ucs-content-store-eu-west/content/pii:S0378778823001275/gr2/HIGHRES/image/gif/ec02fb52c22c88d04f3934b70424b450/gr2.sml gr2 gr2.sml sml 6858 58 219 IMAGE-THUMBNAIL 1-s2.0-S0378778823001275-gr3.sml https://s3-eu-west-1.amazonaws.com/prod-ucs-content-store-eu-west/content/pii:S0378778823001275/gr3/THUMBNAIL/image/gif/24be88074a4a77226cebb4695061b5ac/gr3.sml gr3 gr3.sml sml 5503 75 219 IMAGE-THUMBNAIL 1-s2.0-S0378778823001275-gr4.sml https://s3-eu-west-1.amazonaws.com/prod-ucs-content-store-eu-west/content/pii:S0378778823001275/gr4/THUMBNAIL/image/gif/92cff10c2e1e0c6043d29c087a2c72ff/gr4.sml gr4 gr4.sml sml 11639 160 219 IMAGE-THUMBNAIL 1-s2.0-S0378778823001275-gr5.sml https://s3-eu-west-1.amazonaws.com/prod-ucs-content-store-eu-west/content/pii:S0378778823001275/gr5/THUMBNAIL/image/gif/0f1ac13831271cc3dcde970627437726/gr5.sml gr5 gr5.sml sml 6527 80 219 IMAGE-THUMBNAIL 1-s2.0-S0378778823001275-gr6.sml https://s3-eu-west-1.amazonaws.com/prod-ucs-content-store-eu-west/content/pii:S0378778823001275/gr6/HIGHRES/image/gif/2485f0eedab9736302c64049166c4eb9/gr6.sml gr6 gr6.sml sml 7612 163 199 IMAGE-THUMBNAIL 1-s2.0-S0378778823001275-fx1_lrg.jpg https://s3-eu-west-1.amazonaws.com/prod-ucs-content-store-eu-west/content/pii:S0378778823001275/HIGHRES/image/jpeg/4ba848fa2a11cef3fbbef0cc995b662f/fx1_lrg.jpg fx1 fx1_lrg.jpg jpg 612328 2324 2953 IMAGE-HIGH-RES 1-s2.0-S0378778823001275-fx2_lrg.jpg https://s3-eu-west-1.amazonaws.com/prod-ucs-content-store-eu-west/content/pii:S0378778823001275/HIGHRES/image/jpeg/c466af3b83572d1323082e0c05a977f1/fx2_lrg.jpg fx2 fx2_lrg.jpg jpg 249509 814 2953 IMAGE-HIGH-RES 1-s2.0-S0378778823001275-gr1_lrg.jpg https://s3-eu-west-1.amazonaws.com/prod-ucs-content-store-eu-west/content/pii:S0378778823001275/HIGHRES/image/jpeg/6287d5db60359f3148051e268e68a53b/gr1_lrg.jpg gr1 gr1_lrg.jpg jpg 110450 900 1654 IMAGE-HIGH-RES 1-s2.0-S0378778823001275-gr2_lrg.jpg https://s3-eu-west-1.amazonaws.com/prod-ucs-content-store-eu-west/content/pii:S0378778823001275/HIGHRES/image/jpeg/d05b881d71dcb72943964cdf410e2f45/gr2_lrg.jpg gr2 gr2_lrg.jpg jpg 190782 748 2835 IMAGE-HIGH-RES 1-s2.0-S0378778823001275-gr3_lrg.jpg https://s3-eu-west-1.amazonaws.com/prod-ucs-content-store-eu-west/content/pii:S0378778823001275/HIGHRES/image/jpeg/e518936441e1602f429085f58b26f84c/gr3_lrg.jpg gr3 gr3_lrg.jpg jpg 369611 1039 3037 IMAGE-HIGH-RES 1-s2.0-S0378778823001275-gr4_lrg.jpg https://s3-eu-west-1.amazonaws.com/prod-ucs-content-store-eu-west/content/pii:S0378778823001275/HIGHRES/image/jpeg/cd695f7c55e278b863c7b1275ed0ca4c/gr4_lrg.jpg gr4 gr4_lrg.jpg jpg 852995 2295 3150 IMAGE-HIGH-RES 1-s2.0-S0378778823001275-gr5_lrg.jpg https://s3-eu-west-1.amazonaws.com/prod-ucs-content-store-eu-west/content/pii:S0378778823001275/HIGHRES/image/jpeg/5f7067b18ae588efeef8dd3091c6d115/gr5_lrg.jpg gr5 gr5_lrg.jpg jpg 465839 1079 2962 IMAGE-HIGH-RES 1-s2.0-S0378778823001275-gr6_lrg.jpg https://s3-eu-west-1.amazonaws.com/prod-ucs-content-store-eu-west/content/pii:S0378778823001275/HIGHRES/image/jpeg/658e28c3a53efec9d93f0b7e0b8816b2/gr6_lrg.jpg gr6 gr6_lrg.jpg jpg 202212 1326 1614 IMAGE-HIGH-RES 1-s2.0-S0378778823001275-si1.svg https://s3-eu-west-1.amazonaws.com/prod-ucs-content-store-eu-west/content/pii:S0378778823001275/STRIPIN/image/svg+xml/60082f95b54a6917002f05f3d7995164/si1.svg si1 si1.svg svg 6039 ALTIMG 1-s2.0-S0378778823001275-si10.svg https://s3-eu-west-1.amazonaws.com/prod-ucs-content-store-eu-west/content/pii:S0378778823001275/STRIPIN/image/svg+xml/500ebcbfbd8ee7bc72e5d5f12616c422/si10.svg si10 si10.svg svg 1541 ALTIMG 1-s2.0-S0378778823001275-si100.svg https://s3-eu-west-1.amazonaws.com/prod-ucs-content-store-eu-west/content/pii:S0378778823001275/STRIPIN/image/svg+xml/51acbda2098a3161118343475bffcf5e/si100.svg si100 si100.svg svg 5721 ALTIMG 1-s2.0-S0378778823001275-si101.svg https://s3-eu-west-1.amazonaws.com/prod-ucs-content-store-eu-west/content/pii:S0378778823001275/STRIPIN/image/svg+xml/9f6937792085e597ca0e090296950751/si101.svg si101 si101.svg svg 2568 ALTIMG 1-s2.0-S0378778823001275-si102.svg https://s3-eu-west-1.amazonaws.com/prod-ucs-content-store-eu-west/content/pii:S0378778823001275/STRIPIN/image/svg+xml/49ab6c57d95d3bbbf855e858ca927618/si102.svg si102 si102.svg svg 2671 ALTIMG 1-s2.0-S0378778823001275-si103.svg https://s3-eu-west-1.amazonaws.com/prod-ucs-content-store-eu-west/content/pii:S0378778823001275/STRIPIN/image/svg+xml/cee853a6dbe91df0cbebad02b28e8e4e/si103.svg si103 si103.svg svg 9303 ALTIMG 1-s2.0-S0378778823001275-si104.svg https://s3-eu-west-1.amazonaws.com/prod-ucs-content-store-eu-west/content/pii:S0378778823001275/STRIPIN/image/svg+xml/44d5c17603104c0709b52fedd7f66030/si104.svg si104 si104.svg svg 6251 ALTIMG 1-s2.0-S0378778823001275-si105.svg https://s3-eu-west-1.amazonaws.com/prod-ucs-content-store-eu-west/content/pii:S0378778823001275/STRIPIN/image/svg+xml/5fd2f3f61a9cabb41a86158d7b718d91/si105.svg si105 si105.svg svg 25070 ALTIMG 1-s2.0-S0378778823001275-si106.svg https://s3-eu-west-1.amazonaws.com/prod-ucs-content-store-eu-west/content/pii:S0378778823001275/STRIPIN/image/svg+xml/bdb8235ccb4d5823a633a1596b237a46/si106.svg si106 si106.svg svg 4468 ALTIMG 1-s2.0-S0378778823001275-si107.svg https://s3-eu-west-1.amazonaws.com/prod-ucs-content-store-eu-west/content/pii:S0378778823001275/STRIPIN/image/svg+xml/2f155819976af85f5b09a1dc951e9cf8/si107.svg si107 si107.svg svg 12644 ALTIMG 1-s2.0-S0378778823001275-si108.svg https://s3-eu-west-1.amazonaws.com/prod-ucs-content-store-eu-west/content/pii:S0378778823001275/STRIPIN/image/svg+xml/8853637a932771e7223199820674a049/si108.svg si108 si108.svg svg 26437 ALTIMG 1-s2.0-S0378778823001275-si109.svg https://s3-eu-west-1.amazonaws.com/prod-ucs-content-store-eu-west/content/pii:S0378778823001275/STRIPIN/image/svg+xml/9f869382f554217a4928c806c697f7ca/si109.svg si109 si109.svg svg 3363 ALTIMG 1-s2.0-S0378778823001275-si11.svg https://s3-eu-west-1.amazonaws.com/prod-ucs-content-store-eu-west/content/pii:S0378778823001275/STRIPIN/image/svg+xml/0a86d3bbcd91b96501c3b28ab2fb54dc/si11.svg si11 si11.svg svg 2337 ALTIMG 1-s2.0-S0378778823001275-si110.svg https://s3-eu-west-1.amazonaws.com/prod-ucs-content-store-eu-west/content/pii:S0378778823001275/STRIPIN/image/svg+xml/4cf9b62c936f1c745e0dc78e0be990e1/si110.svg si110 si110.svg svg 3363 ALTIMG 1-s2.0-S0378778823001275-si111.svg https://s3-eu-west-1.amazonaws.com/prod-ucs-content-store-eu-west/content/pii:S0378778823001275/STRIPIN/image/svg+xml/9b42f98ae1e65748cce9c16ba550d49b/si111.svg si111 si111.svg svg 6055 ALTIMG 1-s2.0-S0378778823001275-si112.svg https://s3-eu-west-1.amazonaws.com/prod-ucs-content-store-eu-west/content/pii:S0378778823001275/STRIPIN/image/svg+xml/21fb05cc9669e170dc6f7ece0157f245/si112.svg si112 si112.svg svg 2395 ALTIMG 1-s2.0-S0378778823001275-si113.svg https://s3-eu-west-1.amazonaws.com/prod-ucs-content-store-eu-west/content/pii:S0378778823001275/STRIPIN/image/svg+xml/4bc797adc6dbf01c45e88a80343bde4e/si113.svg si113 si113.svg svg 7456 ALTIMG 1-s2.0-S0378778823001275-si114.svg https://s3-eu-west-1.amazonaws.com/prod-ucs-content-store-eu-west/content/pii:S0378778823001275/STRIPIN/image/svg+xml/4ebd4d1d89105d4d878f13516347af87/si114.svg si114 si114.svg svg 4278 ALTIMG 1-s2.0-S0378778823001275-si115.svg https://s3-eu-west-1.amazonaws.com/prod-ucs-content-store-eu-west/content/pii:S0378778823001275/STRIPIN/image/svg+xml/1b924cd4cc58d8c56e5c115ef6a38e9c/si115.svg si115 si115.svg svg 20745 ALTIMG 1-s2.0-S0378778823001275-si116.svg https://s3-eu-west-1.amazonaws.com/prod-ucs-content-store-eu-west/content/pii:S0378778823001275/STRIPIN/image/svg+xml/57173b1f197cf3d5ef6e75733a76a047/si116.svg si116 si116.svg svg 1202 ALTIMG 1-s2.0-S0378778823001275-si117.svg https://s3-eu-west-1.amazonaws.com/prod-ucs-content-store-eu-west/content/pii:S0378778823001275/STRIPIN/image/svg+xml/716433145947030c4a6f37f87f28aae8/si117.svg si117 si117.svg svg 2060 ALTIMG 1-s2.0-S0378778823001275-si118.svg https://s3-eu-west-1.amazonaws.com/prod-ucs-content-store-eu-west/content/pii:S0378778823001275/STRIPIN/image/svg+xml/056586ac887011a377139ac3b8651f16/si118.svg si118 si118.svg svg 1542 ALTIMG 1-s2.0-S0378778823001275-si119.svg https://s3-eu-west-1.amazonaws.com/prod-ucs-content-store-eu-west/content/pii:S0378778823001275/STRIPIN/image/svg+xml/e5ca9d843449e2473ae5339e86ec1d94/si119.svg si119 si119.svg svg 1542 ALTIMG 1-s2.0-S0378778823001275-si12.svg https://s3-eu-west-1.amazonaws.com/prod-ucs-content-store-eu-west/content/pii:S0378778823001275/STRIPIN/image/svg+xml/271703e118978266aae271e3fc63da59/si12.svg si12 si12.svg svg 1541 ALTIMG 1-s2.0-S0378778823001275-si120.svg https://s3-eu-west-1.amazonaws.com/prod-ucs-content-store-eu-west/content/pii:S0378778823001275/STRIPIN/image/svg+xml/7c07ced70f2bb92cfcbdf79eab8220c8/si120.svg si120 si120.svg svg 2043 ALTIMG 1-s2.0-S0378778823001275-si121.svg https://s3-eu-west-1.amazonaws.com/prod-ucs-content-store-eu-west/content/pii:S0378778823001275/STRIPIN/image/svg+xml/d1fca5019364949747f493d1fc5322ca/si121.svg si121 si121.svg svg 1202 ALTIMG 1-s2.0-S0378778823001275-si122.svg https://s3-eu-west-1.amazonaws.com/prod-ucs-content-store-eu-west/content/pii:S0378778823001275/STRIPIN/image/svg+xml/3689c0e9de8e68f06f6cc3aa3559f720/si122.svg si122 si122.svg svg 2060 ALTIMG 1-s2.0-S0378778823001275-si123.svg https://s3-eu-west-1.amazonaws.com/prod-ucs-content-store-eu-west/content/pii:S0378778823001275/STRIPIN/image/svg+xml/50c7c708f476a04a68e8debd76fd0baf/si123.svg si123 si123.svg svg 1538 ALTIMG 1-s2.0-S0378778823001275-si124.svg https://s3-eu-west-1.amazonaws.com/prod-ucs-content-store-eu-west/content/pii:S0378778823001275/STRIPIN/image/svg+xml/fe1533481502136b7107fb20f0325712/si124.svg si124 si124.svg svg 1542 ALTIMG 1-s2.0-S0378778823001275-si125.svg https://s3-eu-west-1.amazonaws.com/prod-ucs-content-store-eu-west/content/pii:S0378778823001275/STRIPIN/image/svg+xml/1f9673cb426e7396ec14ebf579fd6bfa/si125.svg si125 si125.svg svg 1202 ALTIMG 1-s2.0-S0378778823001275-si126.svg https://s3-eu-west-1.amazonaws.com/prod-ucs-content-store-eu-west/content/pii:S0378778823001275/STRIPIN/image/svg+xml/db08695be1cc36d6ecc7b8a8b3fa1709/si126.svg si126 si126.svg svg 2060 ALTIMG 1-s2.0-S0378778823001275-si127.svg https://s3-eu-west-1.amazonaws.com/prod-ucs-content-store-eu-west/content/pii:S0378778823001275/STRIPIN/image/svg+xml/96e119cf70e3c83f86945b6fef28fffb/si127.svg si127 si127.svg svg 8557 ALTIMG 1-s2.0-S0378778823001275-si128.svg https://s3-eu-west-1.amazonaws.com/prod-ucs-content-store-eu-west/content/pii:S0378778823001275/STRIPIN/image/svg+xml/49799f2ecac69420ae6ee401d8692f73/si128.svg si128 si128.svg svg 1542 ALTIMG 1-s2.0-S0378778823001275-si129.svg https://s3-eu-west-1.amazonaws.com/prod-ucs-content-store-eu-west/content/pii:S0378778823001275/STRIPIN/image/svg+xml/65122bcd10a4f6c2e6949a5ab449adc1/si129.svg si129 si129.svg svg 2353 ALTIMG 1-s2.0-S0378778823001275-si13.svg https://s3-eu-west-1.amazonaws.com/prod-ucs-content-store-eu-west/content/pii:S0378778823001275/STRIPIN/image/svg+xml/811d598d550b1e9bfedec4b4717e8f7f/si13.svg si13 si13.svg svg 4275 ALTIMG 1-s2.0-S0378778823001275-si130.svg https://s3-eu-west-1.amazonaws.com/prod-ucs-content-store-eu-west/content/pii:S0378778823001275/STRIPIN/image/svg+xml/27c7c7924194900c8ecce8e6f4a73a9c/si130.svg si130 si130.svg svg 1538 ALTIMG 1-s2.0-S0378778823001275-si131.svg https://s3-eu-west-1.amazonaws.com/prod-ucs-content-store-eu-west/content/pii:S0378778823001275/STRIPIN/image/svg+xml/996138fe1c8d6f7a8c2093107cec949a/si131.svg si131 si131.svg svg 3363 ALTIMG 1-s2.0-S0378778823001275-si132.svg https://s3-eu-west-1.amazonaws.com/prod-ucs-content-store-eu-west/content/pii:S0378778823001275/STRIPIN/image/svg+xml/4104a57aa78a95803669d8012e9cfcf9/si132.svg si132 si132.svg svg 4570 ALTIMG 1-s2.0-S0378778823001275-si133.svg https://s3-eu-west-1.amazonaws.com/prod-ucs-content-store-eu-west/content/pii:S0378778823001275/STRIPIN/image/svg+xml/0284b8c397fafd1b7a8dc1cf8bd0c571/si133.svg si133 si133.svg svg 30945 ALTIMG 1-s2.0-S0378778823001275-si134.svg https://s3-eu-west-1.amazonaws.com/prod-ucs-content-store-eu-west/content/pii:S0378778823001275/STRIPIN/image/svg+xml/e9aa93abe068890950a450d622bc4aca/si134.svg si134 si134.svg svg 2462 ALTIMG 1-s2.0-S0378778823001275-si135.svg https://s3-eu-west-1.amazonaws.com/prod-ucs-content-store-eu-west/content/pii:S0378778823001275/STRIPIN/image/svg+xml/04cc4998faea2b8b8fdf06e8efb4d734/si135.svg si135 si135.svg svg 2080 ALTIMG 1-s2.0-S0378778823001275-si136.svg https://s3-eu-west-1.amazonaws.com/prod-ucs-content-store-eu-west/content/pii:S0378778823001275/STRIPIN/image/svg+xml/e6da8782619c9c3c98fe74ba6319c793/si136.svg si136 si136.svg svg 2468 ALTIMG 1-s2.0-S0378778823001275-si137.svg https://s3-eu-west-1.amazonaws.com/prod-ucs-content-store-eu-west/content/pii:S0378778823001275/STRIPIN/image/svg+xml/1ef49d633f60f496c2e1b6ebac32ce21/si137.svg si137 si137.svg svg 2468 ALTIMG 1-s2.0-S0378778823001275-si138.svg https://s3-eu-west-1.amazonaws.com/prod-ucs-content-store-eu-west/content/pii:S0378778823001275/STRIPIN/image/svg+xml/85ae9d0dfe5a6da40031dc77909a0c08/si138.svg si138 si138.svg svg 2080 ALTIMG 1-s2.0-S0378778823001275-si139.svg https://s3-eu-west-1.amazonaws.com/prod-ucs-content-store-eu-west/content/pii:S0378778823001275/STRIPIN/image/svg+xml/389bc21c2ef1564a88caaeff63493b73/si139.svg si139 si139.svg svg 2468 ALTIMG 1-s2.0-S0378778823001275-si14.svg https://s3-eu-west-1.amazonaws.com/prod-ucs-content-store-eu-west/content/pii:S0378778823001275/STRIPIN/image/svg+xml/dd1a47b90802e176c91f60ea543e783c/si14.svg si14 si14.svg svg 2337 ALTIMG 1-s2.0-S0378778823001275-si140.svg https://s3-eu-west-1.amazonaws.com/prod-ucs-content-store-eu-west/content/pii:S0378778823001275/STRIPIN/image/svg+xml/0e883725e03635945b3058b594987fc9/si140.svg si140 si140.svg svg 1924 ALTIMG 1-s2.0-S0378778823001275-si141.svg https://s3-eu-west-1.amazonaws.com/prod-ucs-content-store-eu-west/content/pii:S0378778823001275/STRIPIN/image/svg+xml/44643aad072a46d34acec99066ca2a38/si141.svg si141 si141.svg svg 2399 ALTIMG 1-s2.0-S0378778823001275-si142.svg https://s3-eu-west-1.amazonaws.com/prod-ucs-content-store-eu-west/content/pii:S0378778823001275/STRIPIN/image/svg+xml/2459a93d2102a41422b0bbb85b71e3e3/si142.svg si142 si142.svg svg 1538 ALTIMG 1-s2.0-S0378778823001275-si143.svg https://s3-eu-west-1.amazonaws.com/prod-ucs-content-store-eu-west/content/pii:S0378778823001275/STRIPIN/image/svg+xml/2feb8eea5f6ea27217a7b17549b16d20/si143.svg si143 si143.svg svg 3937 ALTIMG 1-s2.0-S0378778823001275-si144.svg https://s3-eu-west-1.amazonaws.com/prod-ucs-content-store-eu-west/content/pii:S0378778823001275/STRIPIN/image/svg+xml/dc00d2b621f37f871d52503455a2aacd/si144.svg si144 si144.svg svg 35490 ALTIMG 1-s2.0-S0378778823001275-si145.svg https://s3-eu-west-1.amazonaws.com/prod-ucs-content-store-eu-west/content/pii:S0378778823001275/STRIPIN/image/svg+xml/d153a9551ed9e45f9568b05a906a2a22/si145.svg si145 si145.svg svg 4915 ALTIMG 1-s2.0-S0378778823001275-si146.svg https://s3-eu-west-1.amazonaws.com/prod-ucs-content-store-eu-west/content/pii:S0378778823001275/STRIPIN/image/svg+xml/204c6aa32baf08d8355acc8c156eafac/si146.svg si146 si146.svg svg 1758 ALTIMG 1-s2.0-S0378778823001275-si147.svg https://s3-eu-west-1.amazonaws.com/prod-ucs-content-store-eu-west/content/pii:S0378778823001275/STRIPIN/image/svg+xml/29c44062acfd8fc405e8197a6ebcf95e/si147.svg si147 si147.svg svg 1542 ALTIMG 1-s2.0-S0378778823001275-si148.svg https://s3-eu-west-1.amazonaws.com/prod-ucs-content-store-eu-west/content/pii:S0378778823001275/STRIPIN/image/svg+xml/be35406cf2430c6bee1593da6c167960/si148.svg si148 si148.svg svg 2934 ALTIMG 1-s2.0-S0378778823001275-si149.svg https://s3-eu-west-1.amazonaws.com/prod-ucs-content-store-eu-west/content/pii:S0378778823001275/STRIPIN/image/svg+xml/f71dcd37787e23ecda83c078fb8ab859/si149.svg si149 si149.svg svg 1758 ALTIMG 1-s2.0-S0378778823001275-si15.svg https://s3-eu-west-1.amazonaws.com/prod-ucs-content-store-eu-west/content/pii:S0378778823001275/STRIPIN/image/svg+xml/18a8aeb5ad730c731c1c7d5cd6aff3a9/si15.svg si15 si15.svg svg 1541 ALTIMG 1-s2.0-S0378778823001275-si150.svg https://s3-eu-west-1.amazonaws.com/prod-ucs-content-store-eu-west/content/pii:S0378778823001275/STRIPIN/image/svg+xml/a95d86811e5e3fdb5b763ad3d62e1264/si150.svg si150 si150.svg svg 15883 ALTIMG 1-s2.0-S0378778823001275-si151.svg https://s3-eu-west-1.amazonaws.com/prod-ucs-content-store-eu-west/content/pii:S0378778823001275/STRIPIN/image/svg+xml/06be863da29d135bbe85aee57d078fb6/si151.svg si151 si151.svg svg 2679 ALTIMG 1-s2.0-S0378778823001275-si152.svg https://s3-eu-west-1.amazonaws.com/prod-ucs-content-store-eu-west/content/pii:S0378778823001275/STRIPIN/image/svg+xml/ab173e64dafa084bd6eaf335a84aeee4/si152.svg si152 si152.svg svg 1758 ALTIMG 1-s2.0-S0378778823001275-si153.svg https://s3-eu-west-1.amazonaws.com/prod-ucs-content-store-eu-west/content/pii:S0378778823001275/STRIPIN/image/svg+xml/b99a2f2e615fbdd596221e20b2f4908e/si153.svg si153 si153.svg svg 1758 ALTIMG 1-s2.0-S0378778823001275-si154.svg https://s3-eu-west-1.amazonaws.com/prod-ucs-content-store-eu-west/content/pii:S0378778823001275/STRIPIN/image/svg+xml/2941888c89cfce76c86516fa38e6d79d/si154.svg si154 si154.svg svg 1758 ALTIMG 1-s2.0-S0378778823001275-si155.svg https://s3-eu-west-1.amazonaws.com/prod-ucs-content-store-eu-west/content/pii:S0378778823001275/STRIPIN/image/svg+xml/8c51df1eccf22bff8078a0cd2fe5930a/si155.svg si155 si155.svg svg 6135 ALTIMG 1-s2.0-S0378778823001275-si156.svg https://s3-eu-west-1.amazonaws.com/prod-ucs-content-store-eu-west/content/pii:S0378778823001275/STRIPIN/image/svg+xml/0c8973dadf30cab7ff74a29b019799e6/si156.svg si156 si156.svg svg 1542 ALTIMG 1-s2.0-S0378778823001275-si157.svg https://s3-eu-west-1.amazonaws.com/prod-ucs-content-store-eu-west/content/pii:S0378778823001275/STRIPIN/image/svg+xml/60baa20fbd698f2449c7c3177e2a0bb9/si157.svg si157 si157.svg svg 1542 ALTIMG 1-s2.0-S0378778823001275-si158.svg https://s3-eu-west-1.amazonaws.com/prod-ucs-content-store-eu-west/content/pii:S0378778823001275/STRIPIN/image/svg+xml/34634a9a77e2caf1f93fc423b6ab1c61/si158.svg si158 si158.svg svg 1514 ALTIMG 1-s2.0-S0378778823001275-si159.svg https://s3-eu-west-1.amazonaws.com/prod-ucs-content-store-eu-west/content/pii:S0378778823001275/STRIPIN/image/svg+xml/887f3f6412b4494189171ea9588d401c/si159.svg si159 si159.svg svg 1202 ALTIMG 1-s2.0-S0378778823001275-si16.svg https://s3-eu-west-1.amazonaws.com/prod-ucs-content-store-eu-west/content/pii:S0378778823001275/STRIPIN/image/svg+xml/154479b81022809cb168c86461925968/si16.svg si16 si16.svg svg 12333 ALTIMG 1-s2.0-S0378778823001275-si160.svg https://s3-eu-west-1.amazonaws.com/prod-ucs-content-store-eu-west/content/pii:S0378778823001275/STRIPIN/image/svg+xml/806caa06c097c8961b69b15debdc925a/si160.svg si160 si160.svg svg 2060 ALTIMG 1-s2.0-S0378778823001275-si161.svg https://s3-eu-west-1.amazonaws.com/prod-ucs-content-store-eu-west/content/pii:S0378778823001275/STRIPIN/image/svg+xml/e0568564899b098289f3a1397bcff5f3/si161.svg si161 si161.svg svg 5875 ALTIMG 1-s2.0-S0378778823001275-si162.svg https://s3-eu-west-1.amazonaws.com/prod-ucs-content-store-eu-west/content/pii:S0378778823001275/STRIPIN/image/svg+xml/f092eb5f5a4333a5105d7a665d020fcf/si162.svg si162 si162.svg svg 10347 ALTIMG 1-s2.0-S0378778823001275-si163.svg https://s3-eu-west-1.amazonaws.com/prod-ucs-content-store-eu-west/content/pii:S0378778823001275/STRIPIN/image/svg+xml/315b38bdab8967573ad0b77dfbce8594/si163.svg si163 si163.svg svg 1542 ALTIMG 1-s2.0-S0378778823001275-si164.svg https://s3-eu-west-1.amazonaws.com/prod-ucs-content-store-eu-west/content/pii:S0378778823001275/STRIPIN/image/svg+xml/21f50664fe2fbfe730af5592d9f123b2/si164.svg si164 si164.svg svg 1542 ALTIMG 1-s2.0-S0378778823001275-si165.svg https://s3-eu-west-1.amazonaws.com/prod-ucs-content-store-eu-west/content/pii:S0378778823001275/STRIPIN/image/svg+xml/03a9dfa7f30fdb83b813669b9e6a8617/si165.svg si165 si165.svg svg 1514 ALTIMG 1-s2.0-S0378778823001275-si166.svg https://s3-eu-west-1.amazonaws.com/prod-ucs-content-store-eu-west/content/pii:S0378778823001275/STRIPIN/image/svg+xml/0399985d0399e0f633076db7219d0b7f/si166.svg si166 si166.svg svg 6041 ALTIMG 1-s2.0-S0378778823001275-si167.svg https://s3-eu-west-1.amazonaws.com/prod-ucs-content-store-eu-west/content/pii:S0378778823001275/STRIPIN/image/svg+xml/a13594b408b6e3630a5f6ff52fa6766e/si167.svg si167 si167.svg svg 1542 ALTIMG 1-s2.0-S0378778823001275-si168.svg https://s3-eu-west-1.amazonaws.com/prod-ucs-content-store-eu-west/content/pii:S0378778823001275/STRIPIN/image/svg+xml/2aea661f6363b0f794c3f6ff52666d56/si168.svg si168 si168.svg svg 1542 ALTIMG 1-s2.0-S0378778823001275-si169.svg https://s3-eu-west-1.amazonaws.com/prod-ucs-content-store-eu-west/content/pii:S0378778823001275/STRIPIN/image/svg+xml/d9b0d0acc2e09fbaa722e30e56301010/si169.svg si169 si169.svg svg 6041 ALTIMG 1-s2.0-S0378778823001275-si17.svg https://s3-eu-west-1.amazonaws.com/prod-ucs-content-store-eu-west/content/pii:S0378778823001275/STRIPIN/image/svg+xml/d058ef85756999d9efd7de76eed5d823/si17.svg si17 si17.svg svg 1749 ALTIMG 1-s2.0-S0378778823001275-si170.svg https://s3-eu-west-1.amazonaws.com/prod-ucs-content-store-eu-west/content/pii:S0378778823001275/STRIPIN/image/svg+xml/9dbeb13498f167485331a313fae94e1e/si170.svg si170 si170.svg svg 1542 ALTIMG 1-s2.0-S0378778823001275-si171.svg https://s3-eu-west-1.amazonaws.com/prod-ucs-content-store-eu-west/content/pii:S0378778823001275/STRIPIN/image/svg+xml/7185e967e51eabea0a64704d0bce9cc5/si171.svg si171 si171.svg svg 1202 ALTIMG 1-s2.0-S0378778823001275-si172.svg https://s3-eu-west-1.amazonaws.com/prod-ucs-content-store-eu-west/content/pii:S0378778823001275/STRIPIN/image/svg+xml/45dbbaba57156c590daa64b199fc430a/si172.svg si172 si172.svg svg 2060 ALTIMG 1-s2.0-S0378778823001275-si173.svg https://s3-eu-west-1.amazonaws.com/prod-ucs-content-store-eu-west/content/pii:S0378778823001275/STRIPIN/image/svg+xml/b724b852cc5a041f30331bc707db7f3f/si173.svg si173 si173.svg svg 1542 ALTIMG 1-s2.0-S0378778823001275-si174.svg https://s3-eu-west-1.amazonaws.com/prod-ucs-content-store-eu-west/content/pii:S0378778823001275/STRIPIN/image/svg+xml/090f2f856454532cedc8ff0a905383b6/si174.svg si174 si174.svg svg 3755 ALTIMG 1-s2.0-S0378778823001275-si175.svg https://s3-eu-west-1.amazonaws.com/prod-ucs-content-store-eu-west/content/pii:S0378778823001275/STRIPIN/image/svg+xml/66291235f3935cd6365a0b884cbd0430/si175.svg si175 si175.svg svg 6041 ALTIMG 1-s2.0-S0378778823001275-si176.svg https://s3-eu-west-1.amazonaws.com/prod-ucs-content-store-eu-west/content/pii:S0378778823001275/STRIPIN/image/svg+xml/065e2770020236d01fc47b71439462a9/si176.svg si176 si176.svg svg 5193 ALTIMG 1-s2.0-S0378778823001275-si177.svg https://s3-eu-west-1.amazonaws.com/prod-ucs-content-store-eu-west/content/pii:S0378778823001275/STRIPIN/image/svg+xml/b7a160f96043eb5186cc51e2b7fa4ff8/si177.svg si177 si177.svg svg 1542 ALTIMG 1-s2.0-S0378778823001275-si178.svg https://s3-eu-west-1.amazonaws.com/prod-ucs-content-store-eu-west/content/pii:S0378778823001275/STRIPIN/image/svg+xml/fc18d4857e2f1619bb227ee9515804d3/si178.svg si178 si178.svg svg 6041 ALTIMG 1-s2.0-S0378778823001275-si179.svg https://s3-eu-west-1.amazonaws.com/prod-ucs-content-store-eu-west/content/pii:S0378778823001275/STRIPIN/image/svg+xml/4055c9ad4e48056d8c4cc53e51fa4a1b/si179.svg si179 si179.svg svg 1542 ALTIMG 1-s2.0-S0378778823001275-si18.svg https://s3-eu-west-1.amazonaws.com/prod-ucs-content-store-eu-west/content/pii:S0378778823001275/STRIPIN/image/svg+xml/800b864c88bec15da29c7fa021847557/si18.svg si18 si18.svg svg 1645 ALTIMG 1-s2.0-S0378778823001275-si180.svg https://s3-eu-west-1.amazonaws.com/prod-ucs-content-store-eu-west/content/pii:S0378778823001275/STRIPIN/image/svg+xml/6a725165b92edd0d0c10dad3f8539e35/si180.svg si180 si180.svg svg 1542 ALTIMG 1-s2.0-S0378778823001275-si181.svg https://s3-eu-west-1.amazonaws.com/prod-ucs-content-store-eu-west/content/pii:S0378778823001275/STRIPIN/image/svg+xml/781d6ca31da4d3baeb245c14db0ff42e/si181.svg si181 si181.svg svg 8327 ALTIMG 1-s2.0-S0378778823001275-si182.svg https://s3-eu-west-1.amazonaws.com/prod-ucs-content-store-eu-west/content/pii:S0378778823001275/STRIPIN/image/svg+xml/789d1bf7370094319448a9ebdf555a50/si182.svg si182 si182.svg svg 6041 ALTIMG 1-s2.0-S0378778823001275-si183.svg https://s3-eu-west-1.amazonaws.com/prod-ucs-content-store-eu-west/content/pii:S0378778823001275/STRIPIN/image/svg+xml/36a3b20af7e95244b217eda72a2d1bbf/si183.svg si183 si183.svg svg 3775 ALTIMG 1-s2.0-S0378778823001275-si184.svg https://s3-eu-west-1.amazonaws.com/prod-ucs-content-store-eu-west/content/pii:S0378778823001275/STRIPIN/image/svg+xml/b42f567fa3608375fc2f8dd706b94c5b/si184.svg si184 si184.svg svg 4957 ALTIMG 1-s2.0-S0378778823001275-si185.svg https://s3-eu-west-1.amazonaws.com/prod-ucs-content-store-eu-west/content/pii:S0378778823001275/STRIPIN/image/svg+xml/f4e37287c12da3bbf8a3c1d0d48e7946/si185.svg si185 si185.svg svg 1542 ALTIMG 1-s2.0-S0378778823001275-si186.svg https://s3-eu-west-1.amazonaws.com/prod-ucs-content-store-eu-west/content/pii:S0378778823001275/STRIPIN/image/svg+xml/f0e3124a6169c9d88836f2cc1e6df56d/si186.svg si186 si186.svg svg 13260 ALTIMG 1-s2.0-S0378778823001275-si187.svg https://s3-eu-west-1.amazonaws.com/prod-ucs-content-store-eu-west/content/pii:S0378778823001275/STRIPIN/image/svg+xml/8165af954be393f41375d0e83d4228bc/si187.svg si187 si187.svg svg 2338 ALTIMG 1-s2.0-S0378778823001275-si188.svg https://s3-eu-west-1.amazonaws.com/prod-ucs-content-store-eu-west/content/pii:S0378778823001275/STRIPIN/image/svg+xml/0fb9c88fd6ec4ee20fd6c1794ef343f0/si188.svg si188 si188.svg svg 3234 ALTIMG 1-s2.0-S0378778823001275-si189.svg https://s3-eu-west-1.amazonaws.com/prod-ucs-content-store-eu-west/content/pii:S0378778823001275/STRIPIN/image/svg+xml/9dfb58cec018b800714bc3e4b44890b1/si189.svg si189 si189.svg svg 2060 ALTIMG 1-s2.0-S0378778823001275-si19.svg https://s3-eu-west-1.amazonaws.com/prod-ucs-content-store-eu-west/content/pii:S0378778823001275/STRIPIN/image/svg+xml/787a511de2d30d0dcc3b7d6fd45a4076/si19.svg si19 si19.svg svg 1670 ALTIMG 1-s2.0-S0378778823001275-si190.svg https://s3-eu-west-1.amazonaws.com/prod-ucs-content-store-eu-west/content/pii:S0378778823001275/STRIPIN/image/svg+xml/fb7589b6aa0854c0745aad5c0f27d6b8/si190.svg si190 si190.svg svg 1758 ALTIMG 1-s2.0-S0378778823001275-si191.svg https://s3-eu-west-1.amazonaws.com/prod-ucs-content-store-eu-west/content/pii:S0378778823001275/STRIPIN/image/svg+xml/dd3d967aa14a66df01bd83d352b6092f/si191.svg si191 si191.svg svg 1542 ALTIMG 1-s2.0-S0378778823001275-si192.svg https://s3-eu-west-1.amazonaws.com/prod-ucs-content-store-eu-west/content/pii:S0378778823001275/STRIPIN/image/svg+xml/6142896bc36ddf41aaeeea606cf3a5ec/si192.svg si192 si192.svg svg 1542 ALTIMG 1-s2.0-S0378778823001275-si193.svg https://s3-eu-west-1.amazonaws.com/prod-ucs-content-store-eu-west/content/pii:S0378778823001275/STRIPIN/image/svg+xml/3190be0c2893f7253ae770c751f0fe90/si193.svg si193 si193.svg svg 2338 ALTIMG 1-s2.0-S0378778823001275-si194.svg https://s3-eu-west-1.amazonaws.com/prod-ucs-content-store-eu-west/content/pii:S0378778823001275/STRIPIN/image/svg+xml/b3a75bfcea801c1ef85fb6f9090a47aa/si194.svg si194 si194.svg svg 1538 ALTIMG 1-s2.0-S0378778823001275-si195.svg https://s3-eu-west-1.amazonaws.com/prod-ucs-content-store-eu-west/content/pii:S0378778823001275/STRIPIN/image/svg+xml/d5c06390f45986e6bc8f5ac126b8087a/si195.svg si195 si195.svg svg 1538 ALTIMG 1-s2.0-S0378778823001275-si196.svg https://s3-eu-west-1.amazonaws.com/prod-ucs-content-store-eu-west/content/pii:S0378778823001275/STRIPIN/image/svg+xml/c1a18fa4ba929d42b3367b6feb25a980/si196.svg si196 si196.svg svg 1538 ALTIMG 1-s2.0-S0378778823001275-si197.svg https://s3-eu-west-1.amazonaws.com/prod-ucs-content-store-eu-west/content/pii:S0378778823001275/STRIPIN/image/svg+xml/8d4232f0ff38e3a6a9ec967332ea41cf/si197.svg si197 si197.svg svg 4570 ALTIMG 1-s2.0-S0378778823001275-si198.svg https://s3-eu-west-1.amazonaws.com/prod-ucs-content-store-eu-west/content/pii:S0378778823001275/STRIPIN/image/svg+xml/6fbb1c5ee7360ead9c65658a79ac02cc/si198.svg si198 si198.svg svg 2338 ALTIMG 1-s2.0-S0378778823001275-si199.svg https://s3-eu-west-1.amazonaws.com/prod-ucs-content-store-eu-west/content/pii:S0378778823001275/STRIPIN/image/svg+xml/c1fccdfa82ed05f0385ee028f40b97a8/si199.svg si199 si199.svg svg 1542 ALTIMG 1-s2.0-S0378778823001275-si2.svg https://s3-eu-west-1.amazonaws.com/prod-ucs-content-store-eu-west/content/pii:S0378778823001275/STRIPIN/image/svg+xml/db867b2decbfbd80e189fece5b386e18/si2.svg si2 si2.svg svg 2336 ALTIMG 1-s2.0-S0378778823001275-si20.svg https://s3-eu-west-1.amazonaws.com/prod-ucs-content-store-eu-west/content/pii:S0378778823001275/STRIPIN/image/svg+xml/1d58fe7ccf6bcb66928c6302708d63f4/si20.svg si20 si20.svg svg 1265 ALTIMG 1-s2.0-S0378778823001275-si200.svg https://s3-eu-west-1.amazonaws.com/prod-ucs-content-store-eu-west/content/pii:S0378778823001275/STRIPIN/image/svg+xml/c7da8690bc363b261dca747384bee093/si200.svg si200 si200.svg svg 3946 ALTIMG 1-s2.0-S0378778823001275-si201.svg https://s3-eu-west-1.amazonaws.com/prod-ucs-content-store-eu-west/content/pii:S0378778823001275/STRIPIN/image/svg+xml/30f8c29f61c39f27235f72f510194482/si201.svg si201 si201.svg svg 4277 ALTIMG 1-s2.0-S0378778823001275-si202.svg https://s3-eu-west-1.amazonaws.com/prod-ucs-content-store-eu-west/content/pii:S0378778823001275/STRIPIN/image/svg+xml/569b000a7fe2909a3ec14a7800852b75/si202.svg si202 si202.svg svg 1543 ALTIMG 1-s2.0-S0378778823001275-si203.svg https://s3-eu-west-1.amazonaws.com/prod-ucs-content-store-eu-west/content/pii:S0378778823001275/STRIPIN/image/svg+xml/a14cca9d06fad347d7f63771ec8ed99e/si203.svg si203 si203.svg svg 1543 ALTIMG 1-s2.0-S0378778823001275-si204.svg https://s3-eu-west-1.amazonaws.com/prod-ucs-content-store-eu-west/content/pii:S0378778823001275/STRIPIN/image/svg+xml/f6d38574554d3386cbbdec60ca26cfdd/si204.svg si204 si204.svg svg 1543 ALTIMG 1-s2.0-S0378778823001275-si205.svg https://s3-eu-west-1.amazonaws.com/prod-ucs-content-store-eu-west/content/pii:S0378778823001275/STRIPIN/image/svg+xml/e62e5321c2d51ba27f6b4c99f56fd03e/si205.svg si205 si205.svg svg 3947 ALTIMG 1-s2.0-S0378778823001275-si206.svg https://s3-eu-west-1.amazonaws.com/prod-ucs-content-store-eu-west/content/pii:S0378778823001275/STRIPIN/image/svg+xml/e41a61c4b080cf51a134973f50cd0876/si206.svg si206 si206.svg svg 5600 ALTIMG 1-s2.0-S0378778823001275-si207.svg https://s3-eu-west-1.amazonaws.com/prod-ucs-content-store-eu-west/content/pii:S0378778823001275/STRIPIN/image/svg+xml/ed13f6523747f93a1305ec7cfedd9f3e/si207.svg si207 si207.svg svg 5465 ALTIMG 1-s2.0-S0378778823001275-si208.svg https://s3-eu-west-1.amazonaws.com/prod-ucs-content-store-eu-west/content/pii:S0378778823001275/STRIPIN/image/svg+xml/11498aed5560a7a220fb459aac64af59/si208.svg si208 si208.svg svg 4277 ALTIMG 1-s2.0-S0378778823001275-si209.svg https://s3-eu-west-1.amazonaws.com/prod-ucs-content-store-eu-west/content/pii:S0378778823001275/STRIPIN/image/svg+xml/21018c1f4b207172d6edc3256abd6d76/si209.svg si209 si209.svg svg 3947 ALTIMG 1-s2.0-S0378778823001275-si21.svg https://s3-eu-west-1.amazonaws.com/prod-ucs-content-store-eu-west/content/pii:S0378778823001275/STRIPIN/image/svg+xml/950c71547bf021fecf073a014f1f263b/si21.svg si21 si21.svg svg 1630 ALTIMG 1-s2.0-S0378778823001275-si210.svg https://s3-eu-west-1.amazonaws.com/prod-ucs-content-store-eu-west/content/pii:S0378778823001275/STRIPIN/image/svg+xml/1681a858d37a330dc25b1eef1d8d3a48/si210.svg si210 si210.svg svg 4277 ALTIMG 1-s2.0-S0378778823001275-si211.svg https://s3-eu-west-1.amazonaws.com/prod-ucs-content-store-eu-west/content/pii:S0378778823001275/STRIPIN/image/svg+xml/651008a563111f7bb0c38f3d7eec7971/si211.svg si211 si211.svg svg 4910 ALTIMG 1-s2.0-S0378778823001275-si212.svg https://s3-eu-west-1.amazonaws.com/prod-ucs-content-store-eu-west/content/pii:S0378778823001275/STRIPIN/image/svg+xml/280ba47d306778cbc56045a0b645583d/si212.svg si212 si212.svg svg 6042 ALTIMG 1-s2.0-S0378778823001275-si213.svg https://s3-eu-west-1.amazonaws.com/prod-ucs-content-store-eu-west/content/pii:S0378778823001275/STRIPIN/image/svg+xml/9c8404133eca05fae4e409edf7e5a0cf/si213.svg si213 si213.svg svg 1543 ALTIMG 1-s2.0-S0378778823001275-si214.svg https://s3-eu-west-1.amazonaws.com/prod-ucs-content-store-eu-west/content/pii:S0378778823001275/STRIPIN/image/svg+xml/7f5859bc896a877028bf0226a3055df0/si214.svg si214 si214.svg svg 3947 ALTIMG 1-s2.0-S0378778823001275-si215.svg https://s3-eu-west-1.amazonaws.com/prod-ucs-content-store-eu-west/content/pii:S0378778823001275/STRIPIN/image/svg+xml/7185b3b4e1120bd324ae6b8e360a0c54/si215.svg si215 si215.svg svg 1543 ALTIMG 1-s2.0-S0378778823001275-si216.svg https://s3-eu-west-1.amazonaws.com/prod-ucs-content-store-eu-west/content/pii:S0378778823001275/STRIPIN/image/svg+xml/dc40bbb1effdd8c2fb9d4f9d01ed1ba4/si216.svg si216 si216.svg svg 3134 ALTIMG 1-s2.0-S0378778823001275-si217.svg https://s3-eu-west-1.amazonaws.com/prod-ucs-content-store-eu-west/content/pii:S0378778823001275/STRIPIN/image/svg+xml/43e851d509f4fec4ee7688d3130a1bd6/si217.svg si217 si217.svg svg 1543 ALTIMG 1-s2.0-S0378778823001275-si218.svg https://s3-eu-west-1.amazonaws.com/prod-ucs-content-store-eu-west/content/pii:S0378778823001275/STRIPIN/image/svg+xml/bed6a82a4ee73b22db5cbf909b239748/si218.svg si218 si218.svg svg 850 ALTIMG 1-s2.0-S0378778823001275-si219.svg https://s3-eu-west-1.amazonaws.com/prod-ucs-content-store-eu-west/content/pii:S0378778823001275/STRIPIN/image/svg+xml/0e4caf2e1fd5e447e5427ed90ce90a1e/si219.svg si219 si219.svg svg 2081 ALTIMG 1-s2.0-S0378778823001275-si22.svg https://s3-eu-west-1.amazonaws.com/prod-ucs-content-store-eu-west/content/pii:S0378778823001275/STRIPIN/image/svg+xml/050fc06262be2d64843e4804e214151f/si22.svg si22 si22.svg svg 1013 ALTIMG 1-s2.0-S0378778823001275-si220.svg https://s3-eu-west-1.amazonaws.com/prod-ucs-content-store-eu-west/content/pii:S0378778823001275/STRIPIN/image/svg+xml/f32ba626b8b327d0a9e002abc1c536b8/si220.svg si220 si220.svg svg 850 ALTIMG 1-s2.0-S0378778823001275-si221.svg https://s3-eu-west-1.amazonaws.com/prod-ucs-content-store-eu-west/content/pii:S0378778823001275/STRIPIN/image/svg+xml/86386fbcd6399fc1c7f2ced2b47f0d40/si221.svg si221 si221.svg svg 7725 ALTIMG 1-s2.0-S0378778823001275-si222.svg https://s3-eu-west-1.amazonaws.com/prod-ucs-content-store-eu-west/content/pii:S0378778823001275/STRIPIN/image/svg+xml/9075f0fd546a4a8cccdb0da25d645bf3/si222.svg si222 si222.svg svg 1543 ALTIMG 1-s2.0-S0378778823001275-si223.svg https://s3-eu-west-1.amazonaws.com/prod-ucs-content-store-eu-west/content/pii:S0378778823001275/STRIPIN/image/svg+xml/f8d327429b8a2518012fe425631ec069/si223.svg si223 si223.svg svg 850 ALTIMG 1-s2.0-S0378778823001275-si224.svg https://s3-eu-west-1.amazonaws.com/prod-ucs-content-store-eu-west/content/pii:S0378778823001275/STRIPIN/image/svg+xml/def10be60c147f6cffd17e6df184ecb1/si224.svg si224 si224.svg svg 12335 ALTIMG 1-s2.0-S0378778823001275-si225.svg https://s3-eu-west-1.amazonaws.com/prod-ucs-content-store-eu-west/content/pii:S0378778823001275/STRIPIN/image/svg+xml/730a5a899140a1dc4b55006a2872d9ef/si225.svg si225 si225.svg svg 4910 ALTIMG 1-s2.0-S0378778823001275-si226.svg https://s3-eu-west-1.amazonaws.com/prod-ucs-content-store-eu-west/content/pii:S0378778823001275/STRIPIN/image/svg+xml/b32b98ba73c2457c3eed82c39c23d45a/si226.svg si226 si226.svg svg 2469 ALTIMG 1-s2.0-S0378778823001275-si227.svg https://s3-eu-west-1.amazonaws.com/prod-ucs-content-store-eu-west/content/pii:S0378778823001275/STRIPIN/image/svg+xml/e1f5540721940fe7fb022a8d9a17fb92/si227.svg si227 si227.svg svg 6042 ALTIMG 1-s2.0-S0378778823001275-si228.svg https://s3-eu-west-1.amazonaws.com/prod-ucs-content-store-eu-west/content/pii:S0378778823001275/STRIPIN/image/svg+xml/145fd7f9721eaaa6da5ea05e40e0fb3c/si228.svg si228 si228.svg svg 3691 ALTIMG 1-s2.0-S0378778823001275-si229.svg https://s3-eu-west-1.amazonaws.com/prod-ucs-content-store-eu-west/content/pii:S0378778823001275/STRIPIN/image/svg+xml/905a6272659ee55f02f4e51faad1aa14/si229.svg si229 si229.svg svg 4367 ALTIMG 1-s2.0-S0378778823001275-si23.svg https://s3-eu-west-1.amazonaws.com/prod-ucs-content-store-eu-west/content/pii:S0378778823001275/STRIPIN/image/svg+xml/ba9e516f6d9a829f9ebf094c3bdef6cc/si23.svg si23 si23.svg svg 1750 ALTIMG 1-s2.0-S0378778823001275-si230.svg https://s3-eu-west-1.amazonaws.com/prod-ucs-content-store-eu-west/content/pii:S0378778823001275/STRIPIN/image/svg+xml/93c848f76b2cdcf8d35c920f89ec6fdb/si230.svg si230 si230.svg svg 15013 ALTIMG 1-s2.0-S0378778823001275-si231.svg https://s3-eu-west-1.amazonaws.com/prod-ucs-content-store-eu-west/content/pii:S0378778823001275/STRIPIN/image/svg+xml/b8370157c1073a847764c652e8c4824e/si231.svg si231 si231.svg svg 6042 ALTIMG 1-s2.0-S0378778823001275-si232.svg https://s3-eu-west-1.amazonaws.com/prod-ucs-content-store-eu-west/content/pii:S0378778823001275/STRIPIN/image/svg+xml/969bb158df44463a22f7f687cc4d93e4/si232.svg si232 si232.svg svg 2737 ALTIMG 1-s2.0-S0378778823001275-si233.svg https://s3-eu-west-1.amazonaws.com/prod-ucs-content-store-eu-west/content/pii:S0378778823001275/STRIPIN/image/svg+xml/c31230201d167d03d7468053293a0ee8/si233.svg si233 si233.svg svg 6042 ALTIMG 1-s2.0-S0378778823001275-si234.svg https://s3-eu-west-1.amazonaws.com/prod-ucs-content-store-eu-west/content/pii:S0378778823001275/STRIPIN/image/svg+xml/da8979f66545d602128e26733acf2779/si234.svg si234 si234.svg svg 3691 ALTIMG 1-s2.0-S0378778823001275-si235.svg https://s3-eu-west-1.amazonaws.com/prod-ucs-content-store-eu-west/content/pii:S0378778823001275/STRIPIN/image/svg+xml/2a6309337f9afebf28c232753c7b98c1/si235.svg si235 si235.svg svg 4367 ALTIMG 1-s2.0-S0378778823001275-si236.svg https://s3-eu-west-1.amazonaws.com/prod-ucs-content-store-eu-west/content/pii:S0378778823001275/STRIPIN/image/svg+xml/b3350ce7930a6c3786d91c3e9d643890/si236.svg si236 si236.svg svg 1417 ALTIMG 1-s2.0-S0378778823001275-si237.svg https://s3-eu-west-1.amazonaws.com/prod-ucs-content-store-eu-west/content/pii:S0378778823001275/STRIPIN/image/svg+xml/dd284dcca581bbaa2bf68f247837918b/si237.svg si237 si237.svg svg 2070 ALTIMG 1-s2.0-S0378778823001275-si238.svg https://s3-eu-west-1.amazonaws.com/prod-ucs-content-store-eu-west/content/pii:S0378778823001275/STRIPIN/image/svg+xml/d664675e35b2f0921fab553a515f1d99/si238.svg si238 si238.svg svg 2469 ALTIMG 1-s2.0-S0378778823001275-si239.svg https://s3-eu-west-1.amazonaws.com/prod-ucs-content-store-eu-west/content/pii:S0378778823001275/STRIPIN/image/svg+xml/769d99e3d1b48d1b9c8e95f234eafe5e/si239.svg si239 si239.svg svg 2469 ALTIMG 1-s2.0-S0378778823001275-si24.svg https://s3-eu-west-1.amazonaws.com/prod-ucs-content-store-eu-west/content/pii:S0378778823001275/STRIPIN/image/svg+xml/effa79ecd25830820b70832ae83b9f1e/si24.svg si24 si24.svg svg 5523 ALTIMG 1-s2.0-S0378778823001275-si25.svg https://s3-eu-west-1.amazonaws.com/prod-ucs-content-store-eu-west/content/pii:S0378778823001275/STRIPIN/image/svg+xml/c28db0c89361243c589e701f7619638a/si25.svg si25 si25.svg svg 1630 ALTIMG 1-s2.0-S0378778823001275-si26.svg https://s3-eu-west-1.amazonaws.com/prod-ucs-content-store-eu-west/content/pii:S0378778823001275/STRIPIN/image/svg+xml/5333db1f6467183c0617a1e3946e654e/si26.svg si26 si26.svg svg 1750 ALTIMG 1-s2.0-S0378778823001275-si27.svg https://s3-eu-west-1.amazonaws.com/prod-ucs-content-store-eu-west/content/pii:S0378778823001275/STRIPIN/image/svg+xml/38c7d570a26f99ed0b5544b01c2eed96/si27.svg si27 si27.svg svg 1750 ALTIMG 1-s2.0-S0378778823001275-si28.svg https://s3-eu-west-1.amazonaws.com/prod-ucs-content-store-eu-west/content/pii:S0378778823001275/STRIPIN/image/svg+xml/b64e1ae1331be276b81ce04f5c257e62/si28.svg si28 si28.svg svg 5442 ALTIMG 1-s2.0-S0378778823001275-si29.svg https://s3-eu-west-1.amazonaws.com/prod-ucs-content-store-eu-west/content/pii:S0378778823001275/STRIPIN/image/svg+xml/68e77b49bdda0e41de3000990d404543/si29.svg si29 si29.svg svg 1671 ALTIMG 1-s2.0-S0378778823001275-si3.svg https://s3-eu-west-1.amazonaws.com/prod-ucs-content-store-eu-west/content/pii:S0378778823001275/STRIPIN/image/svg+xml/501283168e455a6858d67eb84be52fd2/si3.svg si3 si3.svg svg 2735 ALTIMG 1-s2.0-S0378778823001275-si30.svg https://s3-eu-west-1.amazonaws.com/prod-ucs-content-store-eu-west/content/pii:S0378778823001275/STRIPIN/image/svg+xml/d673d900d4f647984e584f8b84c781f6/si30.svg si30 si30.svg svg 1750 ALTIMG 1-s2.0-S0378778823001275-si31.svg https://s3-eu-west-1.amazonaws.com/prod-ucs-content-store-eu-west/content/pii:S0378778823001275/STRIPIN/image/svg+xml/682b6085cd196de1b233235044c0f9da/si31.svg si31 si31.svg svg 1202 ALTIMG 1-s2.0-S0378778823001275-si32.svg https://s3-eu-west-1.amazonaws.com/prod-ucs-content-store-eu-west/content/pii:S0378778823001275/STRIPIN/image/svg+xml/bd8e2283bf9a3087380610a3c67e843f/si32.svg si32 si32.svg svg 2528 ALTIMG 1-s2.0-S0378778823001275-si33.svg https://s3-eu-west-1.amazonaws.com/prod-ucs-content-store-eu-west/content/pii:S0378778823001275/STRIPIN/image/svg+xml/6789a9f64609d66d80473e8d01d17ee2/si33.svg si33 si33.svg svg 1514 ALTIMG 1-s2.0-S0378778823001275-si34.svg https://s3-eu-west-1.amazonaws.com/prod-ucs-content-store-eu-west/content/pii:S0378778823001275/STRIPIN/image/svg+xml/efefb7e7e37a57f986f1ba8afa42f5de/si34.svg si34 si34.svg svg 4955 ALTIMG 1-s2.0-S0378778823001275-si35.svg https://s3-eu-west-1.amazonaws.com/prod-ucs-content-store-eu-west/content/pii:S0378778823001275/STRIPIN/image/svg+xml/fa66b6a3f41eeaa3c29ec70cb93bc722/si35.svg si35 si35.svg svg 2060 ALTIMG 1-s2.0-S0378778823001275-si36.svg https://s3-eu-west-1.amazonaws.com/prod-ucs-content-store-eu-west/content/pii:S0378778823001275/STRIPIN/image/svg+xml/f399f59893b85b5675bc8cc4bec3b07f/si36.svg si36 si36.svg svg 3288 ALTIMG 1-s2.0-S0378778823001275-si37.svg https://s3-eu-west-1.amazonaws.com/prod-ucs-content-store-eu-west/content/pii:S0378778823001275/STRIPIN/image/svg+xml/630ca0d2420c2bd3cc4444faa2471085/si37.svg si37 si37.svg svg 1512 ALTIMG 1-s2.0-S0378778823001275-si38.svg https://s3-eu-west-1.amazonaws.com/prod-ucs-content-store-eu-west/content/pii:S0378778823001275/STRIPIN/image/svg+xml/ece04e8e903b0375de2ee09ef2a59dc2/si38.svg si38 si38.svg svg 3043 ALTIMG 1-s2.0-S0378778823001275-si39.svg https://s3-eu-west-1.amazonaws.com/prod-ucs-content-store-eu-west/content/pii:S0378778823001275/STRIPIN/image/svg+xml/a5c72db3cf327232b2b92a7bb52f257a/si39.svg si39 si39.svg svg 1671 ALTIMG 1-s2.0-S0378778823001275-si4.svg https://s3-eu-west-1.amazonaws.com/prod-ucs-content-store-eu-west/content/pii:S0378778823001275/STRIPIN/image/svg+xml/10d009044927494efa840f3b32540c03/si4.svg si4 si4.svg svg 6040 ALTIMG 1-s2.0-S0378778823001275-si40.svg https://s3-eu-west-1.amazonaws.com/prod-ucs-content-store-eu-west/content/pii:S0378778823001275/STRIPIN/image/svg+xml/a991434d487ef3dbd987a8eea7552e98/si40.svg si40 si40.svg svg 1542 ALTIMG 1-s2.0-S0378778823001275-si41.svg https://s3-eu-west-1.amazonaws.com/prod-ucs-content-store-eu-west/content/pii:S0378778823001275/STRIPIN/image/svg+xml/5008b64cdc74dc9bc0f4ee410075e623/si41.svg si41 si41.svg svg 1538 ALTIMG 1-s2.0-S0378778823001275-si42.svg https://s3-eu-west-1.amazonaws.com/prod-ucs-content-store-eu-west/content/pii:S0378778823001275/STRIPIN/image/svg+xml/e4fedfb35b03047c99683f6671e54b5e/si42.svg si42 si42.svg svg 1750 ALTIMG 1-s2.0-S0378778823001275-si43.svg https://s3-eu-west-1.amazonaws.com/prod-ucs-content-store-eu-west/content/pii:S0378778823001275/STRIPIN/image/svg+xml/83368009274a13ac66118665d29639be/si43.svg si43 si43.svg svg 2080 ALTIMG 1-s2.0-S0378778823001275-si44.svg https://s3-eu-west-1.amazonaws.com/prod-ucs-content-store-eu-west/content/pii:S0378778823001275/STRIPIN/image/svg+xml/a0786ecd08bc55ad144d4d84edfc1e42/si44.svg si44 si44.svg svg 1630 ALTIMG 1-s2.0-S0378778823001275-si45.svg https://s3-eu-west-1.amazonaws.com/prod-ucs-content-store-eu-west/content/pii:S0378778823001275/STRIPIN/image/svg+xml/57563181f9d1e10ca9f049f6cfb4e3bb/si45.svg si45 si45.svg svg 1758 ALTIMG 1-s2.0-S0378778823001275-si46.svg https://s3-eu-west-1.amazonaws.com/prod-ucs-content-store-eu-west/content/pii:S0378778823001275/STRIPIN/image/svg+xml/ac01be20362738d8236864eeb16c11dc/si46.svg si46 si46.svg svg 2679 ALTIMG 1-s2.0-S0378778823001275-si47.svg https://s3-eu-west-1.amazonaws.com/prod-ucs-content-store-eu-west/content/pii:S0378778823001275/STRIPIN/image/svg+xml/a115180502ff82637d73f7a078438511/si47.svg si47 si47.svg svg 1758 ALTIMG 1-s2.0-S0378778823001275-si48.svg https://s3-eu-west-1.amazonaws.com/prod-ucs-content-store-eu-west/content/pii:S0378778823001275/STRIPIN/image/svg+xml/a921bf9f93add4a8c359539911bb90b4/si48.svg si48 si48.svg svg 1277 ALTIMG 1-s2.0-S0378778823001275-si49.svg https://s3-eu-west-1.amazonaws.com/prod-ucs-content-store-eu-west/content/pii:S0378778823001275/STRIPIN/image/svg+xml/0e79642f42f09886b80c135665961922/si49.svg si49 si49.svg svg 2338 ALTIMG 1-s2.0-S0378778823001275-si5.svg https://s3-eu-west-1.amazonaws.com/prod-ucs-content-store-eu-west/content/pii:S0378778823001275/STRIPIN/image/svg+xml/2b0bba6c64d5ab637c0c3ed8e1768fc1/si5.svg si5 si5.svg svg 2735 ALTIMG 1-s2.0-S0378778823001275-si50.svg https://s3-eu-west-1.amazonaws.com/prod-ucs-content-store-eu-west/content/pii:S0378778823001275/STRIPIN/image/svg+xml/e137213b5cb11547bd89bab4181537e3/si50.svg si50 si50.svg svg 2736 ALTIMG 1-s2.0-S0378778823001275-si51.svg https://s3-eu-west-1.amazonaws.com/prod-ucs-content-store-eu-west/content/pii:S0378778823001275/STRIPIN/image/svg+xml/68543ee1a67fe713c599bdde09ccc69c/si51.svg si51 si51.svg svg 1538 ALTIMG 1-s2.0-S0378778823001275-si52.svg https://s3-eu-west-1.amazonaws.com/prod-ucs-content-store-eu-west/content/pii:S0378778823001275/STRIPIN/image/svg+xml/80e4c0aa43c5c40ec6061fa3ff293d48/si52.svg si52 si52.svg svg 1538 ALTIMG 1-s2.0-S0378778823001275-si53.svg https://s3-eu-west-1.amazonaws.com/prod-ucs-content-store-eu-west/content/pii:S0378778823001275/STRIPIN/image/svg+xml/56e3f0d96a4825f0b9c693ac37b8c18f/si53.svg si53 si53.svg svg 12109 ALTIMG 1-s2.0-S0378778823001275-si54.svg https://s3-eu-west-1.amazonaws.com/prod-ucs-content-store-eu-west/content/pii:S0378778823001275/STRIPIN/image/svg+xml/a66c6b1a4d6410c00a07cbe263876e83/si54.svg si54 si54.svg svg 8614 ALTIMG 1-s2.0-S0378778823001275-si55.svg https://s3-eu-west-1.amazonaws.com/prod-ucs-content-store-eu-west/content/pii:S0378778823001275/STRIPIN/image/svg+xml/b0336d6c3378d3cbadf6060058bb97f7/si55.svg si55 si55.svg svg 10229 ALTIMG 1-s2.0-S0378778823001275-si56.svg https://s3-eu-west-1.amazonaws.com/prod-ucs-content-store-eu-west/content/pii:S0378778823001275/STRIPIN/image/svg+xml/c882601a4e6e872a9fc1e8388767ef97/si56.svg si56 si56.svg svg 8238 ALTIMG 1-s2.0-S0378778823001275-si57.svg https://s3-eu-west-1.amazonaws.com/prod-ucs-content-store-eu-west/content/pii:S0378778823001275/STRIPIN/image/svg+xml/75614ffbe2437ea57a9f518dfe18f924/si57.svg si57 si57.svg svg 1202 ALTIMG 1-s2.0-S0378778823001275-si58.svg https://s3-eu-west-1.amazonaws.com/prod-ucs-content-store-eu-west/content/pii:S0378778823001275/STRIPIN/image/svg+xml/6fad667287e53ca923e5924369b7bbc2/si58.svg si58 si58.svg svg 2060 ALTIMG 1-s2.0-S0378778823001275-si59.svg https://s3-eu-west-1.amazonaws.com/prod-ucs-content-store-eu-west/content/pii:S0378778823001275/STRIPIN/image/svg+xml/1d742f0646205017d071c57b00804e46/si59.svg si59 si59.svg svg 1514 ALTIMG 1-s2.0-S0378778823001275-si6.svg https://s3-eu-west-1.amazonaws.com/prod-ucs-content-store-eu-west/content/pii:S0378778823001275/STRIPIN/image/svg+xml/f29daffc71c6c92323f754a49e758a5a/si6.svg si6 si6.svg svg 2337 ALTIMG 1-s2.0-S0378778823001275-si60.svg https://s3-eu-west-1.amazonaws.com/prod-ucs-content-store-eu-west/content/pii:S0378778823001275/STRIPIN/image/svg+xml/e6a963af0345696ae35d64c6905bd77a/si60.svg si60 si60.svg svg 2060 ALTIMG 1-s2.0-S0378778823001275-si61.svg https://s3-eu-west-1.amazonaws.com/prod-ucs-content-store-eu-west/content/pii:S0378778823001275/STRIPIN/image/svg+xml/14b8da8cc424a33bf295eb396d8cb54a/si61.svg si61 si61.svg svg 1202 ALTIMG 1-s2.0-S0378778823001275-si62.svg https://s3-eu-west-1.amazonaws.com/prod-ucs-content-store-eu-west/content/pii:S0378778823001275/STRIPIN/image/svg+xml/3bb1b4a62c7397f046cd5b5dd641f5e5/si62.svg si62 si62.svg svg 2060 ALTIMG 1-s2.0-S0378778823001275-si63.svg https://s3-eu-west-1.amazonaws.com/prod-ucs-content-store-eu-west/content/pii:S0378778823001275/STRIPIN/image/svg+xml/261c5e8598f44d80afd191c1d05e9e67/si63.svg si63 si63.svg svg 1538 ALTIMG 1-s2.0-S0378778823001275-si64.svg https://s3-eu-west-1.amazonaws.com/prod-ucs-content-store-eu-west/content/pii:S0378778823001275/STRIPIN/image/svg+xml/942690c8188193e70a50f0d0e75a6efd/si64.svg si64 si64.svg svg 1202 ALTIMG 1-s2.0-S0378778823001275-si65.svg https://s3-eu-west-1.amazonaws.com/prod-ucs-content-store-eu-west/content/pii:S0378778823001275/STRIPIN/image/svg+xml/17f6fabd88e03ba7a78c8ebbd24bb15f/si65.svg si65 si65.svg svg 2060 ALTIMG 1-s2.0-S0378778823001275-si66.svg https://s3-eu-west-1.amazonaws.com/prod-ucs-content-store-eu-west/content/pii:S0378778823001275/STRIPIN/image/svg+xml/7172dbfa738a19dd70439f11f9188423/si66.svg si66 si66.svg svg 1514 ALTIMG 1-s2.0-S0378778823001275-si67.svg https://s3-eu-west-1.amazonaws.com/prod-ucs-content-store-eu-west/content/pii:S0378778823001275/STRIPIN/image/svg+xml/3647ad29ad8ca594da171cac11b5ff57/si67.svg si67 si67.svg svg 1514 ALTIMG 1-s2.0-S0378778823001275-si68.svg https://s3-eu-west-1.amazonaws.com/prod-ucs-content-store-eu-west/content/pii:S0378778823001275/STRIPIN/image/svg+xml/7954a97fbc8b561776b219cc76ba9cc8/si68.svg si68 si68.svg svg 20496 ALTIMG 1-s2.0-S0378778823001275-si69.svg https://s3-eu-west-1.amazonaws.com/prod-ucs-content-store-eu-west/content/pii:S0378778823001275/STRIPIN/image/svg+xml/21a3139baa286de3102823d569a69347/si69.svg si69 si69.svg svg 2896 ALTIMG 1-s2.0-S0378778823001275-si7.svg https://s3-eu-west-1.amazonaws.com/prod-ucs-content-store-eu-west/content/pii:S0378778823001275/STRIPIN/image/svg+xml/d6d07dbed131e3e7b6ae246863ce0eea/si7.svg si7 si7.svg svg 1541 ALTIMG 1-s2.0-S0378778823001275-si70.svg https://s3-eu-west-1.amazonaws.com/prod-ucs-content-store-eu-west/content/pii:S0378778823001275/STRIPIN/image/svg+xml/31a91ace5fe1ec2a7347b3c028c14696/si70.svg si70 si70.svg svg 1457 ALTIMG 1-s2.0-S0378778823001275-si71.svg https://s3-eu-west-1.amazonaws.com/prod-ucs-content-store-eu-west/content/pii:S0378778823001275/STRIPIN/image/svg+xml/9334f4bd96008d26632a3d551a1c5f0b/si71.svg si71 si71.svg svg 5254 ALTIMG 1-s2.0-S0378778823001275-si72.svg https://s3-eu-west-1.amazonaws.com/prod-ucs-content-store-eu-west/content/pii:S0378778823001275/STRIPIN/image/svg+xml/9a3e142bdafa71affffcfff7cc152d62/si72.svg si72 si72.svg svg 6184 ALTIMG 1-s2.0-S0378778823001275-si73.svg https://s3-eu-west-1.amazonaws.com/prod-ucs-content-store-eu-west/content/pii:S0378778823001275/STRIPIN/image/svg+xml/6d3d8cd7d6b93c0465c1cb02529ae425/si73.svg si73 si73.svg svg 4953 ALTIMG 1-s2.0-S0378778823001275-si74.svg https://s3-eu-west-1.amazonaws.com/prod-ucs-content-store-eu-west/content/pii:S0378778823001275/STRIPIN/image/svg+xml/7fc4bd75b6b28f1c490d8b176ec10f4d/si74.svg si74 si74.svg svg 3291 ALTIMG 1-s2.0-S0378778823001275-si75.svg https://s3-eu-west-1.amazonaws.com/prod-ucs-content-store-eu-west/content/pii:S0378778823001275/STRIPIN/image/svg+xml/a506877d07b39d96865df80fc0edad74/si75.svg si75 si75.svg svg 1202 ALTIMG 1-s2.0-S0378778823001275-si76.svg https://s3-eu-west-1.amazonaws.com/prod-ucs-content-store-eu-west/content/pii:S0378778823001275/STRIPIN/image/svg+xml/93b74e6ae6ea6094b92813ac2da133cd/si76.svg si76 si76.svg svg 2060 ALTIMG 1-s2.0-S0378778823001275-si77.svg https://s3-eu-west-1.amazonaws.com/prod-ucs-content-store-eu-west/content/pii:S0378778823001275/STRIPIN/image/svg+xml/b8ebb4254da9603c1d40a5de44cd82ff/si77.svg si77 si77.svg svg 3715 ALTIMG 1-s2.0-S0378778823001275-si78.svg https://s3-eu-west-1.amazonaws.com/prod-ucs-content-store-eu-west/content/pii:S0378778823001275/STRIPIN/image/svg+xml/bfaae546eb237bad01be05e2e2a7439b/si78.svg si78 si78.svg svg 1514 ALTIMG 1-s2.0-S0378778823001275-si79.svg https://s3-eu-west-1.amazonaws.com/prod-ucs-content-store-eu-west/content/pii:S0378778823001275/STRIPIN/image/svg+xml/054475e0bca9474132dc04b9815b453c/si79.svg si79 si79.svg svg 1514 ALTIMG 1-s2.0-S0378778823001275-si8.svg https://s3-eu-west-1.amazonaws.com/prod-ucs-content-store-eu-west/content/pii:S0378778823001275/STRIPIN/image/svg+xml/b5890f16e9e0929ef9b9b5f285c1ce79/si8.svg si8 si8.svg svg 3945 ALTIMG 1-s2.0-S0378778823001275-si80.svg https://s3-eu-west-1.amazonaws.com/prod-ucs-content-store-eu-west/content/pii:S0378778823001275/STRIPIN/image/svg+xml/973044499bd103f353c1e4b1500ef148/si80.svg si80 si80.svg svg 1514 ALTIMG 1-s2.0-S0378778823001275-si81.svg https://s3-eu-west-1.amazonaws.com/prod-ucs-content-store-eu-west/content/pii:S0378778823001275/STRIPIN/image/svg+xml/a7edfde5223ae6f5911202fb898312d4/si81.svg si81 si81.svg svg 1542 ALTIMG 1-s2.0-S0378778823001275-si82.svg https://s3-eu-west-1.amazonaws.com/prod-ucs-content-store-eu-west/content/pii:S0378778823001275/STRIPIN/image/svg+xml/f1fdbdd12a14a946ab6f22e32cd0dc96/si82.svg si82 si82.svg svg 1542 ALTIMG 1-s2.0-S0378778823001275-si83.svg https://s3-eu-west-1.amazonaws.com/prod-ucs-content-store-eu-west/content/pii:S0378778823001275/STRIPIN/image/svg+xml/c058cfc484b6acac8c0c3e29044afaf0/si83.svg si83 si83.svg svg 1542 ALTIMG 1-s2.0-S0378778823001275-si84.svg https://s3-eu-west-1.amazonaws.com/prod-ucs-content-store-eu-west/content/pii:S0378778823001275/STRIPIN/image/svg+xml/92d501aacbada499134cd84f4830b2bf/si84.svg si84 si84.svg svg 10024 ALTIMG 1-s2.0-S0378778823001275-si85.svg https://s3-eu-west-1.amazonaws.com/prod-ucs-content-store-eu-west/content/pii:S0378778823001275/STRIPIN/image/svg+xml/bc27af81d68bd00b896dbc5dd0435e2b/si85.svg si85 si85.svg svg 5157 ALTIMG 1-s2.0-S0378778823001275-si86.svg https://s3-eu-west-1.amazonaws.com/prod-ucs-content-store-eu-west/content/pii:S0378778823001275/STRIPIN/image/svg+xml/627e7444b88001b410821a4b7fb63dea/si86.svg si86 si86.svg svg 6724 ALTIMG 1-s2.0-S0378778823001275-si87.svg https://s3-eu-west-1.amazonaws.com/prod-ucs-content-store-eu-west/content/pii:S0378778823001275/STRIPIN/image/svg+xml/82e49e0edaf5703dcaf1f6e2e1222544/si87.svg si87 si87.svg svg 6724 ALTIMG 1-s2.0-S0378778823001275-si88.svg https://s3-eu-west-1.amazonaws.com/prod-ucs-content-store-eu-west/content/pii:S0378778823001275/STRIPIN/image/svg+xml/482e10cb8725e3ef406af9206529ba20/si88.svg si88 si88.svg svg 1514 ALTIMG 1-s2.0-S0378778823001275-si89.svg https://s3-eu-west-1.amazonaws.com/prod-ucs-content-store-eu-west/content/pii:S0378778823001275/STRIPIN/image/svg+xml/a7465943ff49442f5d742dcf2cc267a0/si89.svg si89 si89.svg svg 3449 ALTIMG 1-s2.0-S0378778823001275-si9.svg https://s3-eu-west-1.amazonaws.com/prod-ucs-content-store-eu-west/content/pii:S0378778823001275/STRIPIN/image/svg+xml/cd385ceb8ff6f9b8b113565cc3b57d74/si9.svg si9 si9.svg svg 2337 ALTIMG 1-s2.0-S0378778823001275-si90.svg https://s3-eu-west-1.amazonaws.com/prod-ucs-content-store-eu-west/content/pii:S0378778823001275/STRIPIN/image/svg+xml/138aea8811d7e660be049f01d6bbb064/si90.svg si90 si90.svg svg 3449 ALTIMG 1-s2.0-S0378778823001275-si91.svg https://s3-eu-west-1.amazonaws.com/prod-ucs-content-store-eu-west/content/pii:S0378778823001275/STRIPIN/image/svg+xml/aeba2de6d77322953ba9d15084cb6a48/si91.svg si91 si91.svg svg 16711 ALTIMG 1-s2.0-S0378778823001275-si92.svg https://s3-eu-west-1.amazonaws.com/prod-ucs-content-store-eu-west/content/pii:S0378778823001275/STRIPIN/image/svg+xml/95c9efef3ecdf850543d4d5fecfaad17/si92.svg si92 si92.svg svg 25058 ALTIMG 1-s2.0-S0378778823001275-si93.svg https://s3-eu-west-1.amazonaws.com/prod-ucs-content-store-eu-west/content/pii:S0378778823001275/STRIPIN/image/svg+xml/038d0a2dc1c5f8e733511fbd2cc125f9/si93.svg si93 si93.svg svg 21860 ALTIMG 1-s2.0-S0378778823001275-si94.svg https://s3-eu-west-1.amazonaws.com/prod-ucs-content-store-eu-west/content/pii:S0378778823001275/STRIPIN/image/svg+xml/f5630a15c54793130b1c720d48e87fbc/si94.svg si94 si94.svg svg 3043 ALTIMG 1-s2.0-S0378778823001275-si95.svg https://s3-eu-west-1.amazonaws.com/prod-ucs-content-store-eu-west/content/pii:S0378778823001275/STRIPIN/image/svg+xml/d4a83f5a8c76281ee7d0c1819de9d403/si95.svg si95 si95.svg svg 4955 ALTIMG 1-s2.0-S0378778823001275-si96.svg https://s3-eu-west-1.amazonaws.com/prod-ucs-content-store-eu-west/content/pii:S0378778823001275/STRIPIN/image/svg+xml/77ca577d4a910c41eb1dea29498c96db/si96.svg si96 si96.svg svg 1512 ALTIMG 1-s2.0-S0378778823001275-si97.svg https://s3-eu-west-1.amazonaws.com/prod-ucs-content-store-eu-west/content/pii:S0378778823001275/STRIPIN/image/svg+xml/d2d9dbd4ae1c6890aec2428ede46af98/si97.svg si97 si97.svg svg 7130 ALTIMG 1-s2.0-S0378778823001275-si98.svg https://s3-eu-west-1.amazonaws.com/prod-ucs-content-store-eu-west/content/pii:S0378778823001275/STRIPIN/image/svg+xml/f6c5fe8da99973f8069a4fd492df5a3d/si98.svg si98 si98.svg svg 3043 ALTIMG 1-s2.0-S0378778823001275-si99.svg https://s3-eu-west-1.amazonaws.com/prod-ucs-content-store-eu-west/content/pii:S0378778823001275/STRIPIN/image/svg+xml/27dbe00c663cc0a3437c4329b125c742/si99.svg si99 si99.svg svg 10679 ALTIMG 1-s2.0-S0378778823001275-am.pdf https://s3-eu-west-1.amazonaws.com/prod-ucs-content-store-eu-west/content/egi:10DF3JCL152/MAIN/application/pdf/b7bec5b6a54d5d7b76dfc56198e31464/am.pdf am am.pdf pdf false 1858415 AAM-PDF ENB 112897 112897 S0378-7788(23)00127-5 10.1016/j.enbuild.2023.112897 Elsevier B.V. Fig. 1 HVAC operations in Phases I and II. Fig. 2 The physical test-bed used for experimental evaluation. Fig. 3 Trajectory of mean temperature and heating/cooling input dynamics for ASC when T ̲ = 23 ° C . Fig. 4 Simulation results for FOC, c-MPC and v-MPC. Fig. 5 Experimental results for Phase II. Fig. 6 Simulation results for the trajectory of the mean temperature and the temperature readings recorded at sensors 4 and 5 for Phases I and II. Table 1 Values of Φ 1 for Phase I. Control Strategy 20°C 21°C 22°C 23°C ASC 1323 367.4 158.8 635.0 FOC 2078 736.8 287.6 976.1 c-MPC 5849 5018 3262 3173 v-MPC 3155 3092 3117 3563 Table 2 Execution time of a single iteration. Control Strategy Execution Time (s) ASC 0.023 FOC 1.67 c-MPC 8.59 v-MPC 8.61 RBB 0.030 Table 3 Values of Φ t with T ̲ = 23 ° C . Control Strategy for Phase I Φ t ASC 2040 FOC 2598 c-MPC 4467 v-MPC 4882 Table 4 Values of Φ 1 and deviation from T ̲ of the mean temperature at the end of the 60 min for the RBB when x = 5 . 20°C 21°C 22°C 23°C Φ 1 735 735 1587 1587 Deviation from T ̲ 1.3549 0.2469 0.5139 −0.1171 Table 5 Values of Φ 1 and deviation from T ̲ of the mean temperature at the end of the 60 min for the RBB when x = 10 . 20°C 21°C 22°C 23°C Φ 1 1102.5 1102.5 1954.5 2380.5 Deviation from T ̲ 1.0008 −0.0945 1.3032 0.6537 Table 6 Mean thermal discomfort experienced when nominal temperatures T ̲ ∈ 20 , 20.5 , 21 , 21.5 , 22 ° C are maintained during the scheduled activity compared to the situation where temperature personalization is implemented. 20°C 20.5°C 21°C 21.5°C 22°C %age difference from the thermal discomfort for Phase II 38.1 13.1 13.5 52.2 105.6 Autonomous pre-conditioning and improved personalization in shared workspaces through data-driven predictive control Syed Ahsan Raza Naqvi \u204e Koushik Kar Sandipan Mishra Rensselaer Polytechnic Institute, USA Rensselaer Polytechnic Institute USA Rensselaer Polytechnic Institute, USA \u204e Corresponding author. This paper studies the problem of indoor zone temperature control in shared workspaces equipped with heterogeneous heating and cooling sources with the goal of increased energy savings and environment personalization. Shared workspaces typically witness distinct, pre-scheduled intervals when they are occupied or are unoccupied. In this work, we develop indoor climate control strategies for each of these intervals. For the interval when the workspace is unoccupied, we propose multiple time-bound control strategies for pre-conditioning the workspace in preparation for a scheduled activity (Phase I). For the interval when the workspace is occupied, we propose a separate control strategy which enhances the thermal comfort of the occupants by harnessing the spatial differentiation of the thermal environment to satisfy the different temperature preferences of the individuals (Phase II). Utilizing a physical test-bed and data-driven model learning, we show that our proposed pre-conditioning strategies in Phase I are less computationally expensive than conventional model predictive control (MPC). For Phase II, we use a low complexity quadratic program to minimize the thermal discomfort experienced by individuals based on their temperature preferences. The experimental results show that for Phase I, the proposed control policies can save a significant amount of energy and achieve the desired mean temperature in the space fairly accurately. We further note that for Phase II, the control scheme can achieve a significant spatial differentiation in temperature towards satisfying the occupants\u2019 thermal preferences. Keywords Energy efficiency Indoor climate control HVAC Environment personalization MPC Data availability Data will be made available on request. Nomenclature HVAC Heating, ventilation and air conditioning AHU Air handling unit NN Neural network RLSE Recursive least squares estimation TEPP Two phase pre-conditioning and environment personalization ASC Adaptive switching control FOC Fixed end point optimal control c-MPC Vanilla model predictive control with constant weights v-MPC Vanilla model predictive control with variable weights PCS Personal comfort system RBB Rule-based baseline k Index for a single, discrete time instance. K Total number of time instances for Phase I. j Index for an individual heating/cooling input. J Total number of heating/cooling inputs considered in this work. i Index for an individual temperature sensor. I Total number of temperature sensors considered in this work. T[ k ] Column vector, with element Y i [ k ] , which denotes the temperature readings at sensor i at time k . U[ k ] Column vector, with element U j [ k ] , which denotes the input signal to the HVAC input j at time k . A Column vector, with element A i , which maps the effect of the temperature readings in the preceding time instance on to those in the next time instance. B Matrix, with element B i , j , which maps the effect of the HVAC input on to the changes in temperature readings at each sensor. W ̂ Column vector, with element W ^ i , which captures the effect of the ambient temperature and unmodeled dynamics. d Vector of scalar multipliers, with element d j , which captures the efficacy of HVAC input j for the same % valve opening. T ̲ Nominal temperature for pre-conditioning. μ Duration of each time instance k in minutes. Δ i Desired temperature at sensor i . α Weighting parameter for v-MPC. α 0 Starting value of α for v-MPC. r Rate of updating weights for v-MPC. Φ 1 Metric for capturing the energy consumption for Phase I. Φ t Metric for capturing the total energy consumption for Phases I and II. 1 Introduction It has been estimated that nearly 75% of all US electricity is consumed within buildings [1], with heating, ventilation and air conditioning (HVAC) systems accounting for approximately 30% of the total energy consumed by the commercial building sector [2]. Therefore, optimizing indoor thermal management operations in buildings could significantly reduce power demand, thereby curtailing the operation of power stations running on fossil fuels. Shared workspaces, such as conference rooms, are generally occupied for only a part of the work day, according to a pre-determined schedule. The sporadic nature of occupancy means that implementing a business-as-usual approach for heating or cooling such workspaces is inefficient. Instead, HVAC operations can be scaled down when these spaces are unoccupied, only to be ramped up to achieve a nominal temperature when a scheduled activity is imminent. The increasing desire for personal comfort and wellness among building occupants means that HVAC systems must strive to attain a greater degree of environment personalization in indoor spaces. Recent studies [3] posit that obtaining the occupants\u2019 thermal preferences is a suitable means for achieving personalized comfort in the workplace. In the presence of the occupants\u2019 temperature preferences, as stated in [4], mapping these demands to the operation of the HVAC system is challenging because the different zones in the shared space may be thermally correlated, and it may not be possible to satisfy the preferences of all occupants simultaneously. Indoor climate control strategies in buildings can broadly be categorized into rule-based and optimal control-based techniques. Rule-based strategies employ simple algorithms to achieve temperature control and buildings making them popular among building operators, in spite of them offering limited energy savings [5]. In contrast, optimal control-based strategies, such as model predictive control (MPC), determine optimal control inputs that minimize a given objective objective over a time horizon [6]. Given an adequate thermal dynamics model of the building and a reasonably accurate forecast for the ambient conditions, MPC can cause a building\u2019s HVAC to act in an anticipatory fashion to help minimize the system cost over the optimization horizon. However, the performance of MPC in temperature management in a building is contingent upon the fidelity of the thermal dynamics model. Moreover, for MPC to be adopted in buildings, practitioners may have to acquire additional expertise and on-site computational resources for this purpose. In this work, we address some of these hurdles to the modernization of building energy management systems by developing alternate control strategies that have a significantly lower computational complexity than conventional MPC. The development of high fidelity thermal dynamic models for buildings is hindered primarily by three factors [7]: the gap between the behavior of the model and the building being considered, the seasonal dependence of the model, and the fact that such models are often building-specific. In this work, we hope to demonstrate to the reader that simple, linear models for characterizing thermal dynamics of indoor spaces can be sufficient to achieve the desired indoor climate control objectives. Furthermore, we present an interplay of simple online estimation and predictive control techniques to ensure that control signals to the HVAC system remain robust to seasonal changes in ambient conditions. Although, a significant body of past research work has studied the use of MPC in building energy management systems, there is a need to design control frameworks to achieve efficient, time-bound, pre-conditioning of a workspace, in addition to satisfying individual thermal preferences. Therefore, this paper develops control strategies that combine data-driven learning with predictive control to improve efficiency as well as to achieve personalization in indoor spaces. In this paper, we consider an instrumented test-bed which can be taken to represent a typical shared workspace. The workspace is equipped with heterogeneous heating/cooling inputs each with distinct thermal output. On a typical day, shared workspaces are sporadically occupied according to pre-determined schedules. A naïve approach to indoor climate control in this situation would involve the use of a single control approach which is agnostic to the occupancy patterns in the space. In contrast, this work develops separate control strategies, which use a data-driven, thermal dynamics model, for space heating and cooling operations to achieve multiple indoor conditioning objectives applicable to varying occupancy patterns in a shared workspace. Specifically, we consider two separate intervals where a shared workspace remains unoccupied prior to hosting a scheduled event, such as a work meeting. Phase I (pre-conditioning phase) considers the first interval when the workspace is unoccupied. Here, we propose efficient, time-bound pre-conditioning control strategies for a shared workspace. We further show that our proposed strategies are less computationally taxing than conventional MPC. Phase II (environment personalization phase) of our approach considers the subsequent interval when the scheduled event is underway and the workspace is occupied. The attendees are assumed to have their own temperature preferences. Here, we propose a separate control strategy which enhances the thermal comfort of the occupants by harnessing the spatial differentiation of the thermal environment to satisfy the different individual temperature preferences (within known bounds). In the context of indoor climate control, our contributions are: \u2022 We identify the need for developing separate, occupancy-based control strategies for HVAC operations in shared workspaces. To this end, we develop an autonomous, robust and low-complexity indoor pre-conditioning mechanism for indoor spaces, called adaptive switching control (ASC), which only ramps up HVAC operations when a scheduled activity is imminent to achieve an adequate, nominal indoor temperature. Once the workspace is occupied, we employ a low complexity, quadratic programming-based approach for satisfying the temperature preferences of the occupants. \u2022 The ASC strategy does not rely on optimization solvers, making it computationally less expensive and easier to scale as compared to MPC-based approaches. Unlike [8], we have also shown that, in addition to using ASC, the time-bound pre-conditioning operation can be solved by casting it as a fixed end point optimal control (FOC) problem. \u2022 We implement the ASC in both simulation and on a physical test-bed and compare its performance to that of FOC and variants of the conventional MPC approach. We have shown that in addition to it being quicker to solve in real-time, ASC and FOC consume less energy as compared to the MPC-based approaches studied herein. \u2022 We show how, for an indoor space without plug load measurement and with heterogeneous heating/cooling inputs, the linear, grey-box model characterizing the thermal dynamics can be manipulated to derive a metric for capturing the power consumption of each of the inputs, which can also be used to formulate the objective functions for the MPC-based strategies used for pre-conditioning the workspace. \u2022 To the best of our knowledge, this work is the first interplay of recursive least squares estimation (RLSE) and predictive control techniques for indoor spaces with heterogeneous HVAC inputs. RLSE requires significantly less computational resources for building model identification as compared to reinforcement learning. \u2022 We show how a low complexity optimal control framework, which can be solved in closed form, can be used to exploit spatial differences in the impact of the heterogeneous heating/cooling inputs in an indoor space to satisfy disparate thermal preferences (within known bounds) when the workspace is occupied. This paper is organized as follows: Section 2 provides a review of relevant literature and an account of our contributions to the state-of-the-art. Section 3 provides an overview of the data-driven thermal model of the workspace, and formulates the proposed control policies as optimization problems. Section 4 presents experimental and simulation results and their analysis. Finally, Section 5 summarizes the findings of this paper. Further details on the methodology and results presented herein may be found in a detailed technical report available online [9]. 2 Literature Review The building system models considered in the literature can broadly be categorized into three classes: white-box [10], black-box [11] and grey-box. The grey-box model is a hybrid of the white- and black-box model in that it is more physically intuitive than the black-box model and yet is much simpler than the white-box model. Past work, such as [12], has used grey box models to characterize building thermal dynamics. Our work uses a linear, grey-box model for this purpose as well. However, unlike [12], we not only develop a data-driven model to capture indoor thermal dynamics but also deploy predictive control strategies on a physical test-bed. A significant body of past research work has studied the use of predictive control in tandem with data-driven learning in building energy management systems. The authors in [13] used a physics-based thermal model of an indoor space. Using a standard MPC formulation, the authors then proceeded to minimize the total energy and peak power consumption while keeping the space temperature within prescribed bounds. Subsequently, a stochastic MPC approach was presented to minimize the expected energy costs for temperature regulation within certain bounds. The work in [14] determined the optimal time to turn on the boiler in a building to achieve the desired temperature by a certain given time. The paper used the historical data representing two heating scenarios to develop a neural network (NN) for predictive control to achieve the desired indoor temperatures. The paper relied on offline learning which used the time required to achieve the temperature set-point as the output and the average indoor temperature, the ambient temperature and the water heating system temperature as inputs. Owing to the static nature of the training, the model was not robust to variations in outdoor winter temperatures. In [15], the authors first developed a mathematical model for the thermal dynamics of a multi-zone building. As this model was unable to capture the effect of the variable air volume (VAV) box air damper on the zonal temperature, a radial basis function (RBF) NN was used to characterize this relationship. The authors implemented control in a VAV HVAC system by first determining predictions for zonal temperatures at each time-step using RBF-NN. Using the deviation of the predicted temperatures from the set-point, the authors determined the air damper opening for minimizing this deviation. The paper implemented the proposed control approach in simulations. Unlike our work, [15] did not implement its predictive control strategy on a physical test-bed, nor did it consider heterogeneous heating/cooling inputs in individual zones. In [16], the authors used an autoregressive with exogenous inputs (ARX) model for predicting indoor temperature models. The model was trained offline on synthesized data-sets. The authors used an MPC framework in conjunction with the ARX prediction model to implement temperature control in simulations. In [17], the authors considered an indoor space equipped with an under-floor air distribution (UFAD) system for temperature control. The paper used data collected from a real test-bed to train a grey-box model for predicting indoor temperature. The authors compared the performance of an MPC framework with a feedback control approach for indoor temperature management. The authors in [18], as well as those in the references cited in [19], employed deep reinforcement learning to implement HVAC control in buildings. It is noteworthy that papers [13\u201318] primarily relied on simulation studies to evaluate the performance of their proposed data-driven learning control strategies. In contrast, our work performs both simulation and experimental studies. Furthermore, our work is aimed to serve buildings with limited computational power, which would be inadequate in implementing the deep learning strategies that have hitherto been discussed. Some work in the domain of building climate control has involved the implementation of data-driven learning control approaches in physical spaces. In this context, the authors in [8] used data-driven learning and predictive control to efficiently pre-cool/pre-heat an indoor space based on an occupancy schedule. The authors in [20] used semi-parametric regression to map temperature changes in discrete time to HVAC inputs and employed a learning-based MPC to estimate the occupancy heating load and to adjust the control action accordingly. It is noteworthy that [20] considered only a single type of HVAC input, the air handling unit (AHU), while our work simultaneously utilizes the operation of multiple heterogeneous HVAC elements, i.e., AHUs and radiators to achieve the desired objectives. It must be noted that the authors in [8,20] implemented predictive control using static, time-independent models for characterizing building thermal dynamics, which required retraining to account for seasonal changes in the ambient conditions. Furthermore, unlike [8], we achieve pre-conditioning of the test-bed using a simpler control approach which has been shown to have significantly lower time complexity than MPC. In order for indoor thermal management control policies to be robust to changes in ambient conditions, the thermal model for the physical space should be estimated in both offline and online settings. For instance, the authors in [21,22] performed offline estimation of the parameters of the thermal model of an indoor space using Kalman filtering. Several papers in the domain of online estimation of thermal model parameters have also used reinforcement learning for this purpose [23,24]. In [23], for instance, the authors used the behavior of the on-site building automation system to be an expert demonstration for reinforcement learning in the context of indoor thermal management. Another technique, the RLSE has also been used in literature for estimating the thermal model due to its low sensitivity to outliers [25]. In this work, we use RLSE for online estimation of the thermal model. Using an online estimator alongside an optimal control framework may require significant computational resources which are generally unavailable in most buildings. Therefore, there is a need to not only perform time-complexity studies of online predictive control strategies but also to reduce the computational complexity of such approaches. Researchers in the domain of indoor climate control in buildings have previously explored the prospects of achieving temperature personalization in shared spaces by introducing personal comfort systems (PCSs) to satisfy the occupants\u2019 temperature preferences, under varying levels of automation. In [26], the authors used leg warmers as PCSs and studied their impact on the occupants\u2019 vital signs. It was shown experimentally that these PCSs could help maintain the occupants\u2019 key physiological indicators within healthy limits in winters. Similarly, in [27] occupants were provided with wearable face and neck cooling fans as PCSs to achieve their temperature preferences during summers. The work done in both [26,27] ascertained the impact on the occupants under fixed, pre-set operational settings of the PCSs. As such, these papers did not automate the process of temperature personalization for the occupants. However, in [28], the authors used machine learning techniques, alongside an experimental setup to determine the occupants\u2019 temperature preferences and implemented temperature personalization under varying degrees of automation. It is noteworthy that the work done in [26\u201328] only focused on operating the PCSs and stopped short of developing strategies for coordinating central HVAC and PCS operations. In contrast, the authors in [29] used physics-based thermal models and the occupancy patterns of indoor spaces to develop an optimization framework for a PCS-aware central HVAC system. The performance of the proposed strategy was evaluated through simulations only. In [30], the authors showed experimentally how an adjustable thermostat and a space heater may be used to meet the temperature requirements of two occupants in shared workspace. Finally, the authors in [31] used deep reinforcement learning to develop a model-free approach for optimizing energy consumption and achieving temperature personalization in a simulated indoor space which consisted of a central HVAC system along with PCSs at the occupants\u2019 work desks. In contrast to past work in the domain of temperature personalization, our work develops a low-complexity approach for satisfying occupant temperature preferences without incurring the overhead of installing PCSs at each of the occupants\u2019 locations. Instead, we have evaluated our personalization approach using the existing heating/cooling inputs available in the test-bed. These inputs are located at fixed positions in the test-bed\u2019s walls and ceiling. Therefore, unlike [26\u201331], we have achieved temperature personalization without employing the highly localized PCSs considered in related literature. Moreover, the work in [29\u201331] achieved temperature personalization for workspaces where the occupants were effectively siloed from the impact of the neighboring PCSs. In contrast, our test-bed is an \u2018open\u2019 indoor space where the temperatures experienced by individual occupants are correlated with each other and are dependent on the operation of all the heating/cooling inputs in the space. Furthermore, unlike [31] which uses deep reinforcement learning, we use a linear grey-box model for characterizing temperature dynamics to develop a low-complexity personalization strategy which is suitable for buildings with limited computational resources at their disposal. 3 Problem Formulation We consider a typical shared workspace which is equipped with heterogeneous heating and cooling sources. This indoor space is instrumented with temperature sensors at various locations. The daily activities in such shared spaces typically follow a fixed schedule, such as the timings for work meetings. Therefore, these workspaces may be occupied or unoccupied depending on the time of the day. A simple control strategy for managing indoor temperature in such spaces would involve the use of a single control approach which is agnostic to the occupancy patterns in a shared workspace. Instead, in this section, we propose a two phase pre-conditioning and environment personalization (TEPP) approach which develops separate control strategies for space heating and cooling operations to achieve multiple indoor conditioning objectives depending on the status of the occupancy in a shared workspace. Specifically, we consider two separate intervals where a shared workspace remains unoccupied prior to hosting a scheduled event, such as a work meeting. During the first interval, the workspace is unoccupied and our control strategies, as part of Phase I of our indoor climate control approach, aim to efficiently achieve a nominal temperature value by the end of a given deadline, K (see Fig. 1 ). Phase II of our approach considers the subsequent interval when the scheduled event is underway and the workspace is occupied. The attendees are assumed to have their own, disparate preferences for the temperature in the workspace. We propose a control strategy which enhances the thermal comfort of the occupants by exploiting the spatial differentiation of the thermal environment to satisfy the temperature preferences of multiple attendees (within known bounds). The objective of Phase II is also pictorially represented in Fig. 1. This work uses a data-driven learning model to characterize the thermal dynamics in the test-bed. We will now present a description of this model and show how it can be made robust to seasonal changes in outdoor air temperatures. 3.1 Data-Driven Learning Model Taking the R-C model in [32] as a motivation, we use the grey-box model employed in [8] which uses past temperature readings and input signals to the HVAC system to predict future temperature readings at individual sensors in the test-bed. We discretize the time horizon into K time instances. Each time instance k has duration μ minutes. Furthermore, the formulation assumes that the heating or cooling input remains constant for μ minutes. In this work, we consider the following model to characterize the temperature dynamics in the shared workspace: (1) T [ k + 1 ] = AT [ k ] + BU [ k ] + W ̂ , where T [ k ] ∈ R I × 1 is the vector of temperature measurements at I sensors at time k , U [ k ] ∈ R J × 1 , with element U j [ k ] ∈ [ 0 , U \u203e ] , is a vector of input signals (representing % valve opening in our test-bed) to the J heating and cooling elements of the HVAC system, and column vectors A and W ̂ , and matrix B , need to be estimated through learning. The bias, W ̂ , captures the effect of the ambient temperature and unmodeled dynamics such as heat from human bodies, the server and workstations, solar gains etc. Details of the derivation of this data-driven model may be found in [8]. It is noteworthy that matrix A and column vector W ̂ in (1) are greatly dependent on ambient conditions and have to be re-estimated periodically. Needless to say, repeating the 24-h training periodically to re-estimate these parameters is both computationally burdensome and operationally infeasible. Therefore, for building HVAC control strategies to be truly robust to changes in the ambient conditions, these parameters need to be re-estimated on-the-fly. In this work, we use RLSE [33,34] that uses successive temperature readings obtained μ minutes apart, for the online estimation of A and W ̂ for all experimental studies performed in this paper. Matrix B maps the effect of individual HVAC elements on to the changes in temperature readings. Therefore, it can be taken to be independent of the ambient conditions. Hence, in all the control approaches described subsequently in this paper, we use the estimate of B as obtained from a single, 24-h training run. We will now provide a brief overview of the RLSE approach used in this work for estimating the thermal parameters of an indoor space. 3.2 RLSE RLSE is a variant of linear regression which estimates system model parameters by using a forgetting factor which allocate greater weight to the more recently collected data values. This approach aims to minimize the following cost function [35]: (2) V ( θ ̂ , m \u2032 ) = 1 2 ∑ m = 1 m \u2032 λ m \u2032 - m ( y ( m ) - ϕ T ( m ) θ ̂ ( m \u2032 ) ) 2 , where m \u2032 is the total number of collected samples, λ is the forgetting factor, θ ̂ ( m \u2032 ) is the estimate of the ground truth at m \u2032 , ϕ ( · ) is the matrix of coefficients for the linear model, and y ( m ) is the ground truth. In our work, ϕ ( · ) is taken to be a concatenation of vectors A and W ̂ , and y ( · ) represents the instantaneous temperature readings collected from the sensors in the test-bed. In the context of online estimation of thermal parameters of an indoor space, RLSE can be helpful in estimating, with low time complexity, the relationship between successive temperature readings as well as the dependency of instantaneous temperature on unmodeled heat gains for applications such as indoor space pre-conditioning, where there is limited HVAC operation expected in the near-term. As will be seen subsequently in this paper, the experiments conducted in this work showed that estimates obtained from RLSE using only a limited number of samples resulted in the objectives of the pre-conditioning control strategies being met. This low complexity re-estimation approach has helped make our proposed approach impervious to changes in ambient conditions on a diurnal and seasonal basis. However, the estimation of matrix B (which by its nature is minimally dependent on ambient conditions) requires the perturbation of multiple HVAC inputs. Such perturbation is energy inefficient during routine building operations, especially for space pre-conditioning applications. Therefore, the RLSE may not be the most adequate approach for estimating B . Instead, this work obtained a sufficiently rich data-set after perturbing the test-bed with different combinations of HVAC inputs over the course of 24 h to estimated matrix B using standard linear regression techniques. Given the thermal model of the test-bed in (1), we now proceed to formulating the HVAC control strategies for the TEPP approach. 3.3 TEPP This subsection presents the control strategies for each of the two phases of the proposed TEPP approach. We begin by laying out the control strategies for Phase I. 3.3.1 Phase I \u2013 Time-Bound Pre-Conditioning of the Test-Bed A previously unoccupied indoor space might need to be pre-cooled or pre-heated to a nominal temperature, T ̲ , in preparation for some scheduled activity, e.g. a work-related meeting. In this case, prematurely heating or cooling the space to T ̲ would be inefficient. On the other hand, waiting to ramp up the heating or cooling operations until the start of the activity would cause significant thermal discomfort to the occupants. Therefore, in order to save energy, it is vital that HVAC operations are controlled such that the average temperature in the space reaches close to T ̲ immediately before the scheduled activity. This condition may be expressed as, (3) ∑ i = 1 I T i [ K ] I = T ̲ , where K represents the time at which the scheduled activity begins and T i [ K ] is the temperature measurement at sensor i at that time. The purpose of the time-bound pre-conditioning of the test-bed is to achieve a nominal temperature in the test-bed by the time a scheduled activity starts with minimum power consumption. Developing control strategies for such operations requires knowledge of the instantaneous power consumption of the HVAC inputs, which we denote by f ( U [ k ] ) . Therefore, in the absence of plug-in meters measuring the exact power consumption of each HVAC input in the test-bed, f ( U [ k ] ) would need to be estimated as described next. From (1), we notice that the knowledge of the power consumption of the HVAC elements relative to each other is embedded as scalar multipliers in B which we hope to extract and use to determine U ^ j , the maximum allowable valve opening for HVAC element j, normalized to lie between 0% and 100%. The greater the value for U ^ j , the greater the power rating of element j and, hence, the greater the change in zone temperature per unit change in valve positions. In order to capture the relative power consumption of each HVAC element, we consider the product, (4) BU [ k ] = ∑ i = 1 I ∑ j = 1 J B i , j · U j [ k ] , where B = B i , j , ∀ i ∈ Z ∩ 1 , ⋯ , I , j ∈ Z ∩ 1 , ⋯ , J , B ∈ R I × J . We can further express this product as, (5) BU [ k ] = B ̃ U ̃ [ k ] , B ̃ = B i , j d j = B ∼ i , j , U ̃ [ k ] = U j [ k ] · d j = U ∼ j , where d j is a constant. Note that element B i , j denotes the change in temperature observed at sensor i brought about by a unit change of the valve opening of HVAC input j. We take d to be a vector such that d ∈ R J × 1 , with element d j such that B i , j d j ∈ [ 0 , 1 ] . Here, d j 1 > d j 2 implies that for the same % valve opening, j 1 can effect a greater change in temperature in the workspace than j 2 . Therefore, in the absence of plug-in meters measuring the exact power consumption of each HVAC input, U j [ k ] · d j = U ∼ j [ k ] can provide a representative value for power consumption. Furthermore, to ensure that U ∼ j [ k ] lies within the prescribed operational range, we will consider, (6) U ̂ [ k ] = U ∼ j [ k ] max ( d ) , U ^ j [ k ] ∈ 0 , U \u203e · d j max ( d ) , ∀ j , where U ̂ [ k ] is taken to be the vector of controllable inputs for our proposed control strategies which will be presented later in this section. Therefore, the temperature dynamics in the test-bed can now be given by, (7) T [ k + 1 ] = AT [ k ] + B ̃ U ̂ [ k ] + W ̂ . Finally, the efficient, time-bound, pre-conditioning operation in Phase I can be expressed in the form of the following optimization problem: min . U ̂ [ . ] ∑ k = 1 K - 1 ∑ j = 1 J U ^ j [ k ] , s . t . ( 3 ) , ( 7 ) . ( P 1 ) In this work, we propose two approaches for achieving energy efficient pre-conditioning of a shared workspace: the ASC and FOC. We will now provide an exposition of these two pre-conditioning control strategies considered in this work. 3.3.1.1 TEPP-ASC We aim to develop an approach for time-bound pre-conditioning of the test-bed which is not only adaptive but also computationally less burdensome. We refer to our first approach as ASC. It utilizes the underlying properties of the linear framework in ( P 1 ) for this pre-conditioning operation to determine the time instance at which the cooling/heating inputs need to be engaged to achieve a nominal temperature by the end of a given deadline. The framework ( P 1 ) is a linear programming problem. Hence, its solution, U ̂ ∗ [ k ] ∀ k , with elements, U ^ j ∗ [ k ] ∀ j , k , lies at the vertices of the feasible region [36]. This implies that in the optimal solution, the valves for each HVAC element can either be completely closed or fully open (or to the extent permissible). For a sufficiently small value of μ , U ^ j ∗ [ k ] ∈ 0 , U \u203e · d j max ( d ) . This observation reduces the pre-conditioning problem to one that determines. \u2022 whether the test-bed needs to be cooled or heated by the end of time period K, and \u2022 the instance when the valve openings for the HVAC element are set to the maximum value. Estimates for A and W ̂ along with (7) may be used to determine the trajectory of the temperature readings up till time K when none of the HVAC inputs are switched on. Depending on whether the final value in this trajectory is greater/less than T ̲ , the ASC determines if cooling/heating operations will be required to pre-condition the test-bed. The trajectory of the mean temperature in the test-bed when the heating/cooling inputs are at their maximum values for all k may be obtained by back-solving (7) for a desired T ̲ . The point of intersection of the two trajectories, k ̲ , is an estimate of the time instance when the appropriate heating/cooling inputs need to be engaged to approximately achieve (3). These trajectories are re-calculated when A and W ̂ are re-estimated every μ minutes. Once the instance in time represented by the intersection of the two trajectories is reached, the relevant HVAC elements are switched on. If the mean temperature over-shoots (in the case of pre-heating) or under-shoots (in the case of pre-cooling) from T ̲ , the trajectories of the mean temperature with and without the intervention of an HVAC element are obtained again using the most recent estimates of A and W ̂ to allow the system to correct course and bring ∑ i = 1 I T i [ K ] I closer to T ̲ . This approach is summarized in Algorithm1. Algorithm 1: TEPP-ASC 3.3.1.2 TEPP-FOC This approach achieves time-bound pre-conditioning by solving the linear, fixed end-point problem ( P 1 ) using a mathematical solver. Given a deadline K, an FOC-based approach [37] is used to determine the signals to the HVAC inputs. After every μ minutes, this control strategy uses the sensor readings and the instantaneous HVAC inputs to solve ( P 1 ) . However, at each instance k, the problem is solved over a shrinking horizon of ( K - k ) . This approach is summarized in Algorithm2. Algorithm 2: TEPP-FOC 3.3.2 Phase II \u2013 Satisfying Individual Temperature Requirements Next, we develop a protocol for the indoor environment\u2019s HVAC operations for the case when it is already occupied and the workers are seated at known locations. Individuals at each of these positions may have different temperature preferences. We present a control mechanism that aims to enhance wellness for all occupants by minimizing their thermal discomfort. We can minimize the individuals\u2019 thermal discomfort by optimizing the following objective: min . U [ . ] ∑ k = 1 K \u2032 ∑ i = 1 I ( T i [ k ] - Δ i ) 2 , ∀ i ∈ 1 \u2026 I , s . t . ( 1 ) , ( P 2 ) where K \u2032 represents the size of the optimization window. Δ i is the desired temperature at sensor i\u2019s location, which is determined based on the occupants\u2019 preferences and their locations relative to the sensor. Observing (7), it may be noted that ( P 2 ) is a low complexity quadratic program which can be solved explicitly in closed form. Owing to the limited number of sensors in the test-bed, ( P 2 ) assumes that the sensor which is located closest to an occupant accurately gives the temperature experienced by that occupant. Unlike the policy for pre-conditioning, we aim to minimize the occupants\u2019 thermal discomfort as quickly as possible. Ideally, our control policy for meeting individual thermal requirements should also prevent significant overshoots or undershoots about Δ i . Therefore, at each time instance k, ( P 2 ) is solved by updating the starting temperature and heating/cooling input values every μ ¯ minutes where μ ¯ < μ . 4 Performance Evaluation 4.1 Test-Bed Layout Fig. 2 a shows the layout of the test-bed used for our experiments. The room is equipped with three controllable heating sources and one cooling source. The heating sources include two radiators, that are attached to the test-bed\u2019s walls, and an AHU in the ceiling. The cooling operation takes place through a separate AHU in the ceiling. Furthermore, the test-bed is instrumented with five wall-mounted temperature sensors located at various locations. The test-bed was equipped with Raspberry Pi-based panels where occupants could declare their temperature preferences, with the test-bed tracking the location of the occupants through the use of time-of-flight sensors. 4.2 Test Scenarios The experimental evaluation of the dynamical model in (7) and our proposed HVAC control strategies considers two contiguous time intervals. The first interval, Phase I (pre-conditioning phase), takes the shared workspace to be unoccupied and requires time-bound pre-conditioning of the shared space in anticipation of a scheduled work activity. The second interval, Phase II (environment personalization phase), considers the situation when the workspace is occupied and where occupants at two locations in the shared space have two different temperature preferences. In view of the test-bed having a significant thermal inertia, μ was chosen to be five minutes for training the model in (7). The duration of Phase I was taken to be 60 min, i.e., K = 12 . 4.3 Performance Benchmarks This work considers three baseline approaches. The first two use a standard MPC framework with some slight differences. We term the first of these baselines as vanilla MPC with constant weights (c-MPC), and the second as vanilla MPC with variable weights (v-MPC). Unlike the proposed TEPP approach, these vanilla MPC strategies can be used for both pre-conditioning as well as for HVAC operations during a scheduled activity with some minor modifications. The third baseline considered herein is the rule-based baseline (RBB). We will now provide brief descriptions of these baseline approaches. 4.3.1 c-MPC This approach minimizes the weighted sum of the total energy consumed for pre-conditioning the test-bed and the deviation of the temperature from the desired value at individual sensors, expressed as, min U ̂ [ . ] . ∑ k = 1 2 K - 1 α ∑ i = 1 I ( T i [ k ] - T ̲ ) 2 + ( 1 - α ) ∑ i = 1 I ∑ j = 1 J U ^ j [ k ] s . t . ( 7 ) , ( P 3 ) where 0 ⩽ α ⩽ 1 . Unlike FOC, the vanilla MPC approach incorporates the thermal discomfort term in the objective, causing the α parameter to be re-tuned for different values of T ̲ . Furthermore, vanilla MPC has a prediction window of a fixed length, K, unlike FOC. 4.3.2 v-MPC This approach uses the same objective as in ( P 3 ). However, it considers α to be a function of time for pre-conditioning operations. Specifically, we take α [ k + 1 ] = min α [ k ] + r 1 - α 0 K , 1 , where α 0 is the value of α at the beginning of the pre-conditioning operation and the constant r determines how quickly α approaches 1. Taking α to be linearly varying (unlike the case for c-MPC) can help ensure that the heating/cooling inputs in the test-bed are engaged closer to the pre-conditioning deadline, thereby saving energy. 4.3.3 RBB This approach presents a naïve pre-conditioning strategy where the valve openings of the required heating/cooling inputs are set to the maximum possible value x minutes before the scheduled activity commences, i.e., at ( K μ - x ) minutes. Prior to this instance, these valves are completely shut. Upon achieving T ̲ , this baseline approach maintains the mean temperature close to this level using hysteretic control. The RBB approach can result in non-trivial deviations from T ̲ and is highly dependent on the starting temperatures in the indoor space. 4.4 Evaluation Results - Phase I This subsection presents the results for pre-conditioning the test-bed using the ASC, FOC and the vanilla MPC approaches. Each approach uses the same matrix B that was estimated offline by performing linear regression on a data-set obtained by randomly perturbing each of the four HVAC inputs over the course of a 24-h period. The matrix A and the column vector W ̂ were continually re-estimated by RLSE using the temperature readings up till that particular instance. The re-estimations were aimed at determining the thermal characteristics of the test-bed on a particular day without any influence from the heating/cooling elements in the room. As given by the expression for U ^ j [ k ] in Section 3, the maximum values of the control signals to the AHU heat, AHU cool, North radiator and East radiator are given by the vector, [ 100 , 73.5 , 17.9 , 40.8 ] . We will now present the dynamics of the mean temperature readings in the test-bed for different values of T ̲ for our proposed control strategies implemented over a 60-min horizon for Phase I. For each value of T ̲ , we include plots for (i) the simulated trajectory of the mean temperature in the test-bed, and (ii) the change in the control signals to the heating/cooling elements over the 60-min period. Additionally, we also include the experimental results for the trajectory of the temperature and the change in the control signals for the ASC approach. The simulations results presented herein have been obtained from MATLAB routines that implement ASC, FOC, c-MPC and v-MPC using the linear state space model in (7). The matrix B used in the simulations is the same as the one used for obtaining the experimental results. We also include tabulated comparisons of the energy consumption for the pre-conditioning strategies studied here as well as the time taken to execute each of them for a single time step. 4.4.1 Using TEPP-ASC Fig. 3 a shows the evolution of the mean temperature in the test-bed obtained from simulation and experimental results for ASC when T ̲ = 23 ° C . Fig. 3b shows the control signals to the HVAC elements to achieve this T ̲ during experimental runs on the test-bed. Finally, Fig. 3c shows the status of the HVAC elements as recorded in simulations. It may be seen that for the value of T ̲ considered here under experimental settings, ASC successfully achieved the desired mean temperature in the test-bed by the end of the 60-min deadline to within 0.2°C. Furthermore, Fig. 3 show that the proposed ASC strategy achieved the desired temperature for T ̲ = 23 ° C by the deadline without any course correction, i.e., the relevant HVAC inputs, once engaged, did not need to be switched off before the completion of the hour. This result demonstrates that the discrete, linear model in (7) is able to satisfactorily capture the relationship between the HVAC operations and the change in temperature. 4.4.2 Using TEPP-FOC Here we use the FOC approach to achieve a desired average temperature while minimizing power consumption. Fig. 4 a shows the simulated results for pre-conditioning the test-bed for all values of T ̲ . These results have been obtained using the matrix A and column vector W ̂ estimated during the experimental runs of the ASC strategy for the corresponding values of T ̲ . We will now compare the simulated HVAC operation for ASC (Fig. 3c) with that of FOC. As evident from the trajectories of the mean temperatures in Fig. 4a (e.g. beyond the 55 th minute for T ̲ = 23 ° C , see Fig. 4(d)), it may be seen that the heating/cooling elements are engaged at approximately similar instances in time for both ASC and FOC. As the FOC solves a convex optimization problem, therefore, the ASC strategy can be conservatively stated to be a near-optimal power minimization strategy for Phase I. 4.4.3 Using c-MPC This approach solves the optimization framework for vanilla MPC as presented in Section 3. Specifically, it uses a fixed value of α = 0.99999 . Consequently, as seen in Fig. 4b, for each value of T ̲ , this approach achieves the desired temperature much before the 60-min deadline and subsequently maintains the average temperature close to this value. Fig. 4(e) shows the heating/cooling inputs for this strategy when T ̲ = 23 ° C . Unlike the plots in Figs. 3c and 4(d), it may be seen here that c-MPC engages multiple HVAC inputs much earlier than is necessary to achieve T ̲ . Consequently, c-MPC can be significantly inefficient as compared to ASC and FOC unless the weights in the optimization framework are suitably tuned for each value of T ̲ . The ASC and FOC approaches do not require such tuning for their use in Phase I. 4.4.4 Using v-MPC Here, we take α 0 = 0.99 , r = 2 . The simulated trajectories of mean temperatures in the test-bed for v-MPC are presented in Fig. 4(c). The heating/cooling inputs employed by this strategy when T ̲ = 23 ° C are given in Fig. 4(f). It may be seen from Figs. 4(c) and 4(f) that this approach restricts the use of heating/cooling inputs till the instance when α ≈ 1 , which, in this series of simulations, occurs just after the 30-min mark. Beyond this point in time, U ^ j [ · ] takes greater values than before to reduce the squared difference between the instantaneous average temperature in the test-bed and T ̲ . Table 1 records the values of Φ 1 = ∑ j = 1 J ∑ k = 1 K U ^ j [ k ] for all control strategies studied in this paper. In the absence of explicit power measurements for each HVAC input in the test-bed, we take Φ 1 to be an alternate metric for capturing the energy consumption of each of the control strategies for Phase I. All values in Table 1 have been obtained from simulations using identical A , B and W ̂ for each control strategy to ensure a fair comparison. The table shows that c-MPC and v-MPC consumed significantly greater energy than ASC and FOC did. This observation can be attributed to the framework used for vanilla MPC. Here, α needs to be re-tuned for each T ̲ , to achieve a mean temperature close to T ̲ only at the end of the 60-min deadline. No such re-tuning is required for ASC and FOC, thereby simplifying the pre-conditioning operations for the building operator. It may be observed from Table 1 that although ASC and FOC solve the same optimization problem, the Φ 1 values for ASC are consistently lower than those for FOC. This is because the solution to the optimization problem for FOC is determined at intervals of length μ minutes. This means that the control signals to each heating/cooling input remain constant for μ minutes. In contrast, ASC determines the switching instance (which may not be a multiple of μ ) for the HVAC inputs by determining the point of intersection of the trajectories of the mean temperature in the test-bed when all HVAC inputs are switched off and when all relevant HVAC inputs are engaged, to solve the pre-conditioning problem in Phase I. Table 2 shows the time taken to run the four control strategies in a single iteration. It may be seen that ASC offers superior run-time performance as compared to FOC and the vanilla MPC approaches. This is because ASC uses an analytical approach for solving the pre-conditioning problem for Phase I, unlike the other control strategies presented previously, which use mathematical solvers (which are more computationally intensive) to obtain their respective solutions. The execution times for the vanilla MPC strategies are significantly higher than those for ASC and FOC. This is because the prediction horizon for the vanilla MPC strategies is K instances long, whereas this duration is ( K - k ) instances long for FOC. Table 4 records the values of Φ 1 and the deviation of the mean temperature in the indoor space from T ̲ at the end of Phase I for the RBB approach when x = 5 . Table 5 records these values for the case when x = 10 . It may be seen that the energy consumed by ASC and FOC (see Table 1) is significantly lower for most values of T ̲ as compared to those for RBB. Furthermore, while ASC and FOC were seen to achieve T ̲ at the end of Phase I, RBB exhibited significant deviations from this nominal temperature as it necessarily engaged the heating/cooling inputs x minutes before the pre-conditioning deadline, following which it implemented hysteretic control to maintain the mean temperature in the indoor space within a specified range. It may further be seen from Table 4, that the deviation of the mean temperature from T ̲ for x = 5 under cooling operation (i.e., when T ̲ = 20 ° C and T ̲ = 21 ° C ) was greater than the corresponding values for RBB with x = 10 . This is because the indoor space being studied was equipped with a single cooling input. Therefore, 5 min were insufficient to pre-cool the space to the desired temperatures. In contrast, RBB with x = 5 performed better than RBB with x = 10 , both in terms of energy consumption and temperature deviation, when the indoor space needed to be heated up to T ̲ = 22 ° C and T ̲ = 23 ° C . This is due to the fact that RBB engages all three heating inputs in the indoor space. Operating these inputs 10 min prior to the scheduled activity is not only energy inefficient, but also a cause of significant overshoots from T ̲ (see Table 5). On the other hand, using RBB with x = 5 for heating operations resulted in significantly lower deviations from T ̲ . Therefore, it is noteworthy that the parameter x in the RBB approach needs to be continually tuned depending on the pre-conditioning requirements of the indoor space. It follows that the RBB\u2019s performance is greatly dependent on the temperatures in the indoor space at time k = 1 as well as on the building thermal dynamics. It may be observed that the achievable comfort metrics under heating/cooling operations using the RBB approach, as seen in Tables 4 and 5 exhibit a great deal of variability. This indicates that strategies using data-driven learning and optimal control, such as those proposed in this study, are better equipped than rule-based approaches to achieve robust, time-bound pre-conditioning in indoor spaces. Therefore, it makes sense to incorporate data-driven learning to implement pre-conditioning in shared workspaces. 4.5 Evaluation Results - Phase II Next, we consider Phase II or the environment personalization phase. This phase considers the situation where the test-bed\u2019s HVAC has achieved the desired T ̲ by the beginning of this meeting. Here, we consider that the individuals requesting different temperature set-points are seated close to sensor 5 and either sensor 1 or sensor 2 in the test-bed (see Fig. 2a). We assume that the temperatures recorded by each of these sensors are the temperatures experienced by the nearest occupants. Figs. 5a, 5b and 5 c depict how the HVAC operations determined using (P2) can successfully achieve a spatial temperature differentiation of up to 1°C for heating and cooling operations at different locations within the test-bed, independent of the starting temperatures. It may be observed in Fig. 5a that it takes longer to cool the test-bed to the desired temperatures, as the test-bed is equipped with three heating elements and only one cooling element. Our results indicate that our control policy can achieve, within reasonable bounds, disparate temperatures in the same indoor space, thereby \u2018personalizing\u2019 the workspace. In the absence of clear demarcations of workstations for individual occupants, such as cubicles, in the indoor space considered in this work, the temperatures recorded at different locations are highly correlated with each other. Moreover, they are impacted, to varying degrees, by each of the heating/cooling inputs in the indoor space. Therefore, our proposed personalization approach was seen to perform at its best when two different temperature preferences were provided to the building energy management system. However, for the sake of completion, we now study the case where occupants request five different temperature preferences. We define Δ to be the vector of temperature preferences, with element Δ i , such that Δ = [ 20 , 20.5 , 21 , 21.5 , 22 ] . We compare the performance of the temperature personalization control framework presented in this work with a baseline approach which maintains the mean temperature in the indoor space close to nominal temperature, T ̲ , achieved at the end of Phase I while a scheduled activity is underway in the shared space. Table 6 records the %age difference of the thermal discomfort when the aforementioned baseline approach is used, with respect to the thermal discomfort when our proposed personalization approach is implemented to satisfy the temperature preferences in Δ . The table records results for T ̲ ∈ 20 , 20.5 , 21 , 21.5 , 22 ° C . It may be observed that our personalization approach resulted in a significantly lower thermal discomfort than was the case with the baseline approach. Specifically, our personalization approach resulted in an average instantaneous thermal discomfort of 0.43°C. In contrast, this value for the baseline approach when T ̲ = 22 ° C was 0.88°C. Therefore, despite the limitations of our test-bed, which resulted in the temperature readings at different locations in the space to be highly correlated, using our temperature personalization framework in ( P 2 ) could still be beneficial to the occupants\u2019 well-being, even when five different temperature preferences are provided to the building energy management system. We now consolidate our control strategies for Phases I and II and present simulation results for a real-life application. Here, we consider two hour-long intervals, each representing Phases I and II. For Phase I, we take T ̲ = 23 ° C . In Phase II, the participants are assumed to be seated close to sensors 4 and 5 having temperature preferences of 24 ° C and 25 ° C , respectively. Table 3 presents the values of Φ t = ∑ j = 1 J ∑ k = 1 2 K U ^ j [ k ] , which represent the total energy consumed for both Phases I and II. It may be observed that the values generally follow a trend similar to the one seen in Table 1 for T ̲ = 23 ° C . Since the control strategy for Phase II is identical in each case, the value of Φ t for each of the pre-conditioning strategies increases by roughly the same amount from the corresponding entries in Table 1. Slight differences in this increase can be attributed to the disparate valve positions as well as the temperatures at each sensor at the end of Phase I for each the four pre-conditioning strategies. Fig. 6 presents the trajectories of the temperature readings for Phases I and II when ASC is used for pre-conditioning the space to T ̲ = 23 ° C under simulated conditions. The occupants are assumed to be seated close to sensors 4 and 5 having temperature preferences of 24 ° C and 25 ° C . It may be seen that our proposed quadratic programming-based approach for Phase II successfully achieves temperature differentiation in the indoor space. Furthermore, the temperatures at each of the locations in the indoor space reached close to the respective values of Δ 4 and Δ 5 early on in Phase II, thereby reducing the occupants\u2019 thermal discomfort. 5 Conclusion In this paper, we used a linear, discrete formulation to model the temperature evolution in an indoor space as a function of the heating and cooling inputs, exogenous heat gains and past zone temperatures. Aided by this data-driven learning model, we developed control policies for heterogeneous HVAC elements that operate in tandem to: (i) achieve time-bound pre-conditioning of workspaces and (ii) create spatial differentiation in the thermal environment based on the occupants\u2019 individual preferences. The proposed energy efficient pre-conditioning techniques may be applied to classrooms, meeting spaces or any indoor space whose occupancy schedule can be well-estimated in advance. Specifically, we developed an alternate pre-conditioning approach (ASC) which was tailored for indoor spaces with limited computational resources. Our results showed that data-driven modeling, coupled with our proposed predictive control formulations, can not only make building operations more efficient, but also result in increased personalization in situations where an indoor space is shared by occupants with temperature preferences. The personalization approach proposed in this work assumed that the occupants were located close to the temperature sensors in the test-bed. An alternative to this assumption could involve taking the temperature experienced by an occupant to be a function of their distance from each sensor and estimating it to be the weighted average of the five sensor readings. However, following preliminary tests, we noted minimal benefits of adopting such an approach. Therefore, the temperature personalization framework considered in this work approximated an occupants\u2019 position to that of its closest sensor. In order to further enhance occupant comfort, the temperature personalization approach, as represented by ( P 2 ), could be extended by incorporating occupant feedback to update the set-point requirements at different locations in the test-bed. This could involve gathering qualitative feedback from occupants requesting more heating/cooling, such as that proposed in [4], thereby providing finer adjustments to the solutions obtained from ( P 2 ). This extension has been left as future work. The achievable personalization observed through the experiments performed as part of this work was limited to about 1°C owing to the test-bed being an open space, which caused the temperature at different locations in the indoor space to be highly correlated. The introduction of cubicles to the test-bed would not only better replicate the setup of a shared workspace but also allow increase the achievable temperature differentiation in the space. Declaration of Competing Interest The authors declare that they have no known competing financial interests or personal relationships that could have appeared to influence the work reported in this paper. Acknowledgement This work was supported by the National Science Foundation through Award No. 1827546. References [1] B. Goetzler, M. Guernsey, T. Kassuga, J. Young, T. Savidge, A. Bouza, M. Neukomm, and K. Sawyer, Grid-Interactive Efficient Buildings Technical Report Series: Heating, Ventilation, and Air Conditioning (HVAC); Water Heating; Appliances; and Refrigeration, National Renewable Energy Laboratory (NREL), Golden, CO (United States), Tech. Rep., Dec. 2019. [Online]. Available: http://www.osti.gov/servlets/purl/1577967/. B. Goetzler, M. Guernsey, T. Kassuga, J. Young, T. Savidge, A. Bouza, M. Neukomm, and K. Sawyer, Grid-Interactive Efficient Buildings Technical Report Series: Heating, Ventilation, and Air Conditioning (HVAC); Water Heating; Appliances; and Refrigeration, National Renewable Energy Laboratory (NREL), Golden, CO (United States), Tech. Rep., Dec. 2019. [Online]. Available: http://www.osti.gov/servlets/purl/1577967/ [2] W. Goetzler, R. Shandross, J. Young, O. Petritchenko, D. Ringo, and S. McClive, Energy Savings Potential and RD&D Opportunities for Commercial Building HVAC Systems, EERE Publication and Product Library, Tech. Rep., Dec. 2017. [Online]. Available: http://www.osti.gov/servlets/purl/1419622/. W. Goetzler, R. Shandross, J. Young, O. Petritchenko, D. Ringo, and S. McClive, Energy Savings Potential and RD&D Opportunities for Commercial Building HVAC Systems, EERE Publication and Product Library, Tech. Rep., Dec. 2017. [Online]. Available: http://www.osti.gov/servlets/purl/1419622/ [3] E. Azar C. Menassa Agent-Based Modeling of Occupants and Their Impact on Energy Use in Commercial Buildings Journal of Computing in Civil Engineering 26 4 Jul. 2012 506 518 E. Azar and C. Menassa, Agent-Based Modeling of Occupants and Their Impact on Energy Use in Commercial Buildings, Journal of Computing in Civil Engineering, vol. 26, no. 4, pp. 506\u2013518, Jul. 2012. [4] S. Gupta S. Atkinson I. O\u2019Boyle J. Drogo K. Kar S. Mishra J. Wen BEES: Real-time occupant feedback and environmental learning framework for collaborative thermal management in multi-zone, multi-occupant buildings Energy and Buildings 125 Aug. 2016 142 152 S. Gupta, S. Atkinson, I. O\u2019Boyle, J. Drogo, K. Kar, S. Mishra, and J. Wen, BEES: Real-time occupant feedback and environmental learning framework for collaborative thermal management in multi-zone, multi-occupant buildings, Energy and Buildings, vol. 125, pp. 142\u2013152, Aug. 2016. [5] C. Aghemo J. Virgone G. Fracastoro A. Pellegrino L. Blaso J. Savoyat K. Johannes Management and monitoring of public buildings through ICT based systems: Control rules for energy saving with lighting and hvac services Frontiers of Architectural Research 2 2 2013 147 161 C. Aghemo, J. Virgone, G. Fracastoro, A. Pellegrino, L. Blaso, J. Savoyat, and K. Johannes, Management and monitoring of public buildings through ICT based systems: Control rules for energy saving with lighting and hvac services, Frontiers of Architectural Research, vol. 2, no. 2, pp. 147\u2013161, 2013. [6] J. Drgoňa J. Arroyo I. Cupeiro Figueroa D. Blum K. Arendt D. Kim E.P. Ollé J. Oravec M. Wetter D.L. Vrabie L. Helsen All you need to know about model predictive control for buildings Annual Reviews in Control 50 2020 190 232 J. Drgoňa, J. Arroyo, I. Cupeiro Figueroa, D. Blum, K. Arendt, D. Kim, E.P. Ollé, J. Oravec, M. Wetter, D.L. Vrabie, and L. Helsen, All you need to know about model predictive control for buildings, Annual Reviews in Control, vol. 50, pp. 190\u2013232, 2020. [7] F. Smarra A. Jain T. de Rubeis D. Ambrosini A. D\u2019Innocenzo R. Mangharam Data-driven model predictive control using random forests for building energy optimization and climate control Applied Energy 226 2018 1252 1272 F. Smarra, A. Jain, T. de Rubeis, D. Ambrosini, A. D\u2019Innocenzo, and R. Mangharam, Data-driven model predictive control using random forests for building energy optimization and climate control, Applied Energy, vol. 226, pp. 1252\u20131272, 2018. [8] Z. Tariq T. Imam K. Kar S. Mishra Experimental Evaluation of Data-Driven Predictive Indoor Thermal Management, in Proceedings of the Tenth ACM International Conference on Future Energy Systems Jun. 2019 ACM New York, NY, USA 531 535 Z. Tariq, T. Imam, K. Kar, and S. Mishra, Experimental Evaluation of Data-Driven Predictive Indoor Thermal Management, in Proceedings of the Tenth ACM International Conference on Future Energy Systems. New York, NY, USA: ACM, Jun. 2019, pp. 531\u2013535. [9] https://app.box.com/s/5s8yyj6e4y0461zvuxb8odtl1uak8838, [Online; accessed Dec. 22, 2022]. https://app.box.com/s/5s8yyj6e4y0461zvuxb8odtl1uak8838, [Online; accessed Dec. 22, 2022]. [10] Y. Li Z. O\u2019Neill L. Zhang J. Chen P. Im J. DeGraw Grey-box modeling and application for building energy simulations - a critical review Renewable and Sustainable Energy Reviews 146 2021 111174 Y. Li, Z. O\u2019Neill, L. Zhang, J. Chen, P. Im, and J. DeGraw, Grey-box modeling and application for building energy simulations - a critical review, Renewable and Sustainable Energy Reviews, vol. 146, p. 111174, 2021. [11] P. Arjunan K. Poolla C. Miller BEEM: Data-driven building energy benchmarking for Singapore Energy and Buildings 260 2022 111869 P. Arjunan, K. Poolla, and C. Miller, BEEM: Data-driven building energy benchmarking for Singapore, Energy and Buildings, vol. 260, p. 111869, 2022. [12] P. Bacher H. Madsen Identifying suitable models for the heat dynamics of buildings Energy and Buildings 43 7 2011 1511 1522 P. Bacher and H. Madsen, Identifying suitable models for the heat dynamics of buildings, Energy and Buildings, vol. 43, no. 7, pp. 1511\u20131522, 2011. [13] Y. Ma A. Kelman A. Daly F. Borrelli Predictive Control for Energy Efficient Buildings with Thermal Storage: Modeling Stimulation, and Experiments, IEEE Control Systems 32 1 Feb. 2012 44 64 Y. Ma, A. Kelman, A. Daly, and F. Borrelli, Predictive Control for Energy Efficient Buildings with Thermal Storage: Modeling, Stimulation, and Experiments, IEEE Control Systems, vol. 32, no. 1, pp. 44\u201364, Feb. 2012. [14] M. Macarulla M. Casals N. Forcada M. Gangolells Implementation of predictive control in a commercial building energy management system using neural networks Energy and Buildings 151 2017 511 519 M. Macarulla, M. Casals, N. Forcada, and M. Gangolells, Implementation of predictive control in a commercial building energy management system using neural networks, Energy and Buildings, vol. 151, pp. 511\u2013519, 2017. [15] L. Lei W. Liu Predictive control of multi-zone variable air volume air-conditioning system based on radial basis function neural network Energy and Buildings 261 2022 111944 L. Lei and W. Liu, Predictive control of multi-zone variable air volume air-conditioning system based on radial basis function neural network, Energy and Buildings, vol. 261, p. 111944, 2022. [16] H. Lee Y. Heo Simplified data-driven models for model predictive control of residential buildings Energy and Buildings 265 2022 112067 H. Lee and Y. Heo, Simplified data-driven models for model predictive control of residential buildings, Energy and Buildings, vol. 265, p. 112067, 2022. [17] J. Joe Investigation on pre-cooling potential of UFAD via model-based predictive control Energy and Buildings 259 2022 111898 J. Joe, Investigation on pre-cooling potential of UFAD via model-based predictive control, Energy and Buildings, vol. 259, p. 111898, 2022. [18] L. Yu Y. Sun Z. Xu C. Shen D. Yue T. Jiang X. Guan Multi-agent deep reinforcement learning for hvac control in commercial buildings IEEE Transactions on Smart Grid 12 1 2021 407 419 L. Yu, Y. Sun, Z. Xu, C. Shen, D. Yue, T. Jiang, and X. Guan, Multi-agent deep reinforcement learning for hvac control in commercial buildings, IEEE Transactions on Smart Grid, vol. 12, no. 1, pp. 407\u2013419, 2021. [19] L. Yu, S. Qin, M. Zhang, C. Shen, T. Jiang, and X. Guan, A review of deep reinforcement learning for smart building energy management, IEEE Internet of Things Journal, vol. 8, no. 15, pp. 12 046\u201312 063, 2021. L. Yu, S. Qin, M. Zhang, C. Shen, T. Jiang, and X. Guan, A review of deep reinforcement learning for smart building energy management, IEEE Internet of Things Journal, vol. 8, no. 15, pp. 12046\u201312063, 2021. [20] A. Aswani, N. Master, J. Taneja, V. Smith, A. Krioukov, D. Culler, and C. Tomlin, Identifying models of HVAC systems using semiparametric regression, in 2012 American Control Conference (ACC). IEEE, Jun. 2012, pp. 3675\u20133680. A. Aswani, N. Master, J. Taneja, V. Smith, A. Krioukov, D. Culler, and C. Tomlin, Identifying models of HVAC systems using semiparametric regression, in 2012 American Control Conference (ACC). IEEE, Jun. 2012, pp. 3675\u20133680. [21] S. Fux A. Ashouri M. Benz L. Guzzella EKF based self-adaptive thermal model for a passive house Energy and Buildings 68 Jan. 2014 811 817 S. Fux, A. Ashouri, M. Benz, and L. Guzzella, EKF based self-adaptive thermal model for a passive house, Energy and Buildings, vol. 68, pp. 811\u2013817, Jan. 2014. [22] J. Joe P. Karava A model predictive control strategy to optimize the performance of radiant floor heating and cooling systems in office buildings Applied Energy 245 2019 65 77 J. Joe and P. Karava, A model predictive control strategy to optimize the performance of radiant floor heating and cooling systems in office buildings, Applied Energy, vol. 245, pp. 65\u201377, 2019. [23] B. Chen, Z. Cai, and M. Bergés, Gnu-RL: A precocial reinforcement learning solution for building HVAC control using a Differentiable MPC policy, in Proceedings of the 6th ACM International Conference on Systems for Energy-Efficient Buildings, Cities, and Transportation. New York, NY, USA: ACM, Nov. 2019, pp. 316\u2013325. B. Chen, Z. Cai, and M. Bergés, Gnu-RL: A precocial reinforcement learning solution for building HVAC control using a Differentiable MPC policy, in Proceedings of the 6th ACM International Conference on Systems for Energy-Efficient Buildings, Cities, and Transportation. New York, NY, USA: ACM, Nov. 2019, pp. 316\u2013325. [24] S. Liu G. Henze Experimental analysis of simulated reinforcement learning control for active and passive building thermal storage inventory Energy and Buildings 38 2 Feb. 2006 148 161 S. Liu and G. Henze, Experimental analysis of simulated reinforcement learning control for active and passive building thermal storage inventory, Energy and Buildings, vol. 38, no. 2, pp. 148\u2013161, Feb. 2006. [25] D. Kim, K. Lee, S. Yoo, J. Kim, and M. Lim, Thermal Model Parameter Estimation for HVAC Facility using Recursive Least Square Method, in Proceedings of the 2016 International Conference on Mechanics, Materials and Structural Engineering. Paris, France: Atlantis Press, 2016. [Online]. Available: http://www.atlantis-press.com/php/paper-details.php?id=25854571. D. Kim, K. Lee, S. Yoo, J. Kim, and M. Lim, Thermal Model Parameter Estimation for HVAC Facility using Recursive Least Square Method, in Proceedings of the 2016 International Conference on Mechanics, Materials and Structural Engineering. Paris, France: Atlantis Press, 2016. [Online]. Available: http://www.atlantis-press.com/php/paper-details.php?id=25854571 [26] H. Wang, J. Wang, W. Li, and S. Liang, Experimental study on a radiant leg warmer to improve thermal comfort of office workers in winter, Building and Environment, vol. 207, p. 108461, 2022. [Online]. Available: https://www.sciencedirect.com/science/article/pii/S036013232100857X. H. Wang, J. Wang, W. Li, and S. Liang, Experimental study on a radiant leg warmer to improve thermal comfort of office workers in winter, Building and Environment, vol. 207, p. 108461, 2022. [Online]. Available: https://www.sciencedirect.com/science/article/pii/S036013232100857X [27] B. Yang, T.-H. Lei, P. Yang, K. Liu, and F. Wang, On the use of wearable face and neck cooling fans to improve occupant thermal comfort in warm indoor environments, Energies, vol. 14, no. 23, 2021. [Online]. Available: https://www.mdpi.com/1996-1073/14/23/8077. B. Yang, T.-H. Lei, P. Yang, K. Liu, and F. Wang, On the use of wearable face and neck cooling fans to improve occupant thermal comfort in warm indoor environments, Energies, vol. 14, no. 23, 2021. [Online]. Available: https://www.mdpi.com/1996-1073/14/23/8077 [28] A. Aryal B. Becerik-Gerber G.M. Lucas S.C. Roll Intelligent agents to improve thermal satisfaction by controlling personal comfort systems under different levels of automation IEEE Internet of Things Journal 8 8 2021 7089 7100 A. Aryal, B. Becerik-Gerber, G.M. Lucas, and S.C. Roll, Intelligent agents to improve thermal satisfaction by controlling personal comfort systems under different levels of automation, IEEE Internet of Things Journal, vol. 8, no. 8, pp. 7089\u20137100, 2021. [29] R. Kalaimani M. Jain S. Keshav C. Rosenberg On the interaction between personal comfort systems and centralized hvac systems in office buildings Advances in Building Energy Research 14 1 2020 129 157 R. Kalaimani, M. Jain, S. Keshav, and C. Rosenberg, On the interaction between personal comfort systems and centralized hvac systems in office buildings, Advances in Building Energy Research, vol. 14, no. 1, pp. 129\u2013157, 2020. [30] Y. He, N. Li, J. Lu, N. Li, Q. Deng, C. Tan, and J. Yan, Meeting thermal needs of occupants in shared space with an adjustable thermostat and local heating in winter: An experimental study, Energy and Buildings, vol. 236, p. 110776, 2021. [Online]. Available: https://www.sciencedirect.com/science/article/pii/S0378778821000608. Y. He, N. Li, J. Lu, N. Li, Q. Deng, C. Tan, and J. Yan, Meeting thermal needs of occupants in shared space with an adjustable thermostat and local heating in winter: An experimental study, Energy and Buildings, vol. 236, p. 110776, 2021. [Online]. Available: https://www.sciencedirect.com/science/article/pii/S0378778821000608 [31] L. Yu, Z. Xu, T. Zhang, X. Guan, and D. Yue, Energy-efficient personalized thermal comfort control in office buildings based on multi-agent deep reinforcement learning, Building and Environment, vol. 223, p. 109458, 2022. [Online]. Available: https://www.sciencedirect.com/science/article/pii/S0360132322006898. L. Yu, Z. Xu, T. Zhang, X. Guan, and D. Yue, Energy-efficient personalized thermal comfort control in office buildings based on multi-agent deep reinforcement learning, Building and Environment, vol. 223, p. 109458, 2022. [Online]. Available: https://www.sciencedirect.com/science/article/pii/S0360132322006898 [32] H. Boyer J. Chabriat B. Grondin-Perez C. Tourrand J. Brau Thermal building simulation and computer generation of nodal models Building and Environment 31 3 May 1996 207 214 H. Boyer, J. Chabriat, B. Grondin-Perez, C. Tourrand, and J. Brau, Thermal building simulation and computer generation of nodal models, Building and Environment, vol. 31, no. 3, pp. 207\u2013214, May 1996. [33] Recursive Least Squares Parameter Estimation for Linear Steady State and Dynamic Models, https://cse.sc.edu/ gatzke/cache/edgar-recursive-estimation.pdf, [Online; accessed May 16, 2021]. Recursive Least Squares Parameter Estimation for Linear Steady State and Dynamic Models, https://cse.sc.edu/ gatzke/cache/edgar-recursive-estimation.pdf, [Online; accessed May 16, 2021]. [34] J. Jiang Y. Zhang A revisit to block and recursive least squares for parameter estimation Computers & Electrical Engineering 30 5 2004 403 416 J. Jiang and Y. Zhang, A revisit to block and recursive least squares for parameter estimation, Computers & Electrical Engineering, vol. 30, no. 5, pp. 403\u2013416, 2004. [35] Recursive Least Squares with Forgetting for Online Estimation of Vehicle Mass and Road Grade: Theory and Experiments, http://www-personal.umich.edu/ annastef/papers_Long_ctrl/JournalPaperMassGrade_Final.pdf, [Online; accessed Jan. 28, 2023]. Recursive Least Squares with Forgetting for Online Estimation of Vehicle Mass and Road Grade: Theory and Experiments, http://www-personal.umich.edu/ annastef/papers_Long_ctrl/JournalPaperMassGrade_Final.pdf, [Online; accessed Jan. 28, 2023]. [36] Geometry and visualizations of linear programs, https://ocw.mit.edu/courses/sloan-school-of-management/15-053-optimization-methods-in-management-science-spring-2013/lecture-notes/MIT15_053S13_lec3.pdf, 2013, [Online; accessed May 16, 2021]. Geometry and visualizations of linear programs, https://ocw.mit.edu/courses/sloan-school-of-management/15-053-optimization-methods-in-management-science-spring-2013/lecture-notes/MIT15_053S13_lec3.pdf, 2013, [Online; accessed May 16, 2021]. [37] J. Skaf, S. Boyd, and A. Zeevi, Shrinking-horizon dynamic programming, International Journal of Robust and Nonlinear Control, vol. 20, no. 17, pp. 1993\u20132002, Nov. 2010. [Online]. Available: http://doi.wiley.com/10.1002/rnc.1566. J. Skaf, S. Boyd, and A. Zeevi, Shrinking-horizon dynamic programming, International Journal of Robust and Nonlinear Control, vol. 20, no. 17, pp. 1993\u20132002, Nov. 2010. [Online]. Available: http://doi.wiley.com/10.1002/rnc.1566",
    "scopus-id": "85148944157",
    "coredata": {
        "eid": "1-s2.0-S0378778823001275",
        "dc:description": "This paper studies the problem of indoor zone temperature control in shared workspaces equipped with heterogeneous heating and cooling sources with the goal of increased energy savings and environment personalization. Shared workspaces typically witness distinct, pre-scheduled intervals when they are occupied or are unoccupied. In this work, we develop indoor climate control strategies for each of these intervals. For the interval when the workspace is unoccupied, we propose multiple time-bound control strategies for pre-conditioning the workspace in preparation for a scheduled activity (Phase I). For the interval when the workspace is occupied, we propose a separate control strategy which enhances the thermal comfort of the occupants by harnessing the spatial differentiation of the thermal environment to satisfy the different temperature preferences of the individuals (Phase II). Utilizing a physical test-bed and data-driven model learning, we show that our proposed pre-conditioning strategies in Phase I are less computationally expensive than conventional model predictive control (MPC). For Phase II, we use a low complexity quadratic program to minimize the thermal discomfort experienced by individuals based on their temperature preferences. The experimental results show that for Phase I, the proposed control policies can save a significant amount of energy and achieve the desired mean temperature in the space fairly accurately. We further note that for Phase II, the control scheme can achieve a significant spatial differentiation in temperature towards satisfying the occupants\u2019 thermal preferences.",
        "openArchiveArticle": "false",
        "prism:coverDate": "2023-04-15",
        "openaccessUserLicense": null,
        "prism:aggregationType": "Journal",
        "prism:url": "https://api.elsevier.com/content/article/pii/S0378778823001275",
        "dc:creator": [
            {
                "@_fa": "true",
                "$": "Raza Naqvi, Syed Ahsan"
            },
            {
                "@_fa": "true",
                "$": "Kar, Koushik"
            },
            {
                "@_fa": "true",
                "$": "Mishra, Sandipan"
            }
        ],
        "link": [
            {
                "@_fa": "true",
                "@rel": "self",
                "@href": "https://api.elsevier.com/content/article/pii/S0378778823001275"
            },
            {
                "@_fa": "true",
                "@rel": "scidir",
                "@href": "https://www.sciencedirect.com/science/article/pii/S0378778823001275"
            }
        ],
        "dc:format": "application/json",
        "openaccessType": null,
        "pii": "S0378-7788(23)00127-5",
        "prism:volume": "285",
        "articleNumber": "112897",
        "prism:publisher": "Elsevier B.V.",
        "dc:title": "Autonomous pre-conditioning and improved personalization in shared workspaces through data-driven predictive control",
        "prism:copyright": "© 2023 Elsevier B.V. All rights reserved.",
        "openaccess": "0",
        "prism:issn": "03787788",
        "dcterms:subject": [
            {
                "@_fa": "true",
                "$": "Energy efficiency"
            },
            {
                "@_fa": "true",
                "$": "Indoor climate control"
            },
            {
                "@_fa": "true",
                "$": "HVAC"
            },
            {
                "@_fa": "true",
                "$": "Environment personalization"
            },
            {
                "@_fa": "true",
                "$": "MPC"
            }
        ],
        "openaccessArticle": "false",
        "prism:publicationName": "Energy and Buildings",
        "openaccessSponsorType": null,
        "prism:pageRange": "112897",
        "pubType": "fla",
        "prism:coverDisplayDate": "15 April 2023",
        "prism:doi": "10.1016/j.enbuild.2023.112897",
        "prism:startingPage": "112897",
        "dc:identifier": "doi:10.1016/j.enbuild.2023.112897",
        "openaccessSponsorName": null
    },
    "objects": {"object": [
        {
            "@category": "standard",
            "@height": "525",
            "@width": "667",
            "@_fa": "true",
            "$": "https://api.elsevier.com/content/object/eid/1-s2.0-S0378778823001275-fx1.jpg?httpAccept=%2A%2F%2A",
            "@multimediatype": "JPEG image file",
            "@type": "IMAGE-DOWNSAMPLED",
            "@size": "75185",
            "@ref": "fx1",
            "@mimetype": "image/jpeg"
        },
        {
            "@category": "standard",
            "@height": "184",
            "@width": "667",
            "@_fa": "true",
            "$": "https://api.elsevier.com/content/object/eid/1-s2.0-S0378778823001275-fx2.jpg?httpAccept=%2A%2F%2A",
            "@multimediatype": "JPEG image file",
            "@type": "IMAGE-DOWNSAMPLED",
            "@size": "30318",
            "@ref": "fx2",
            "@mimetype": "image/jpeg"
        },
        {
            "@category": "standard",
            "@height": "203",
            "@width": "373",
            "@_fa": "true",
            "$": "https://api.elsevier.com/content/object/eid/1-s2.0-S0378778823001275-gr1.jpg?httpAccept=%2A%2F%2A",
            "@multimediatype": "JPEG image file",
            "@type": "IMAGE-DOWNSAMPLED",
            "@size": "18138",
            "@ref": "gr1",
            "@mimetype": "image/jpeg"
        },
        {
            "@category": "standard",
            "@height": "169",
            "@width": "640",
            "@_fa": "true",
            "$": "https://api.elsevier.com/content/object/eid/1-s2.0-S0378778823001275-gr2.jpg?httpAccept=%2A%2F%2A",
            "@multimediatype": "JPEG image file",
            "@type": "IMAGE-DOWNSAMPLED",
            "@size": "29207",
            "@ref": "gr2",
            "@mimetype": "image/jpeg"
        },
        {
            "@category": "standard",
            "@height": "235",
            "@width": "686",
            "@_fa": "true",
            "$": "https://api.elsevier.com/content/object/eid/1-s2.0-S0378778823001275-gr3.jpg?httpAccept=%2A%2F%2A",
            "@multimediatype": "JPEG image file",
            "@type": "IMAGE-DOWNSAMPLED",
            "@size": "43712",
            "@ref": "gr3",
            "@mimetype": "image/jpeg"
        },
        {
            "@category": "standard",
            "@height": "518",
            "@width": "711",
            "@_fa": "true",
            "$": "https://api.elsevier.com/content/object/eid/1-s2.0-S0378778823001275-gr4.jpg?httpAccept=%2A%2F%2A",
            "@multimediatype": "JPEG image file",
            "@type": "IMAGE-DOWNSAMPLED",
            "@size": "103999",
            "@ref": "gr4",
            "@mimetype": "image/jpeg"
        },
        {
            "@category": "standard",
            "@height": "244",
            "@width": "669",
            "@_fa": "true",
            "$": "https://api.elsevier.com/content/object/eid/1-s2.0-S0378778823001275-gr5.jpg?httpAccept=%2A%2F%2A",
            "@multimediatype": "JPEG image file",
            "@type": "IMAGE-DOWNSAMPLED",
            "@size": "58507",
            "@ref": "gr5",
            "@mimetype": "image/jpeg"
        },
        {
            "@category": "standard",
            "@height": "299",
            "@width": "364",
            "@_fa": "true",
            "$": "https://api.elsevier.com/content/object/eid/1-s2.0-S0378778823001275-gr6.jpg?httpAccept=%2A%2F%2A",
            "@multimediatype": "JPEG image file",
            "@type": "IMAGE-DOWNSAMPLED",
            "@size": "26897",
            "@ref": "gr6",
            "@mimetype": "image/jpeg"
        },
        {
            "@category": "thumbnail",
            "@height": "164",
            "@width": "208",
            "@_fa": "true",
            "$": "https://api.elsevier.com/content/object/eid/1-s2.0-S0378778823001275-fx1.sml?httpAccept=%2A%2F%2A",
            "@multimediatype": "GIF image file",
            "@type": "IMAGE-THUMBNAIL",
            "@size": "7993",
            "@ref": "fx1",
            "@mimetype": "image/gif"
        },
        {
            "@category": "thumbnail",
            "@height": "60",
            "@width": "219",
            "@_fa": "true",
            "$": "https://api.elsevier.com/content/object/eid/1-s2.0-S0378778823001275-fx2.sml?httpAccept=%2A%2F%2A",
            "@multimediatype": "GIF image file",
            "@type": "IMAGE-THUMBNAIL",
            "@size": "4042",
            "@ref": "fx2",
            "@mimetype": "image/gif"
        },
        {
            "@category": "thumbnail",
            "@height": "119",
            "@width": "219",
            "@_fa": "true",
            "$": "https://api.elsevier.com/content/object/eid/1-s2.0-S0378778823001275-gr1.sml?httpAccept=%2A%2F%2A",
            "@multimediatype": "GIF image file",
            "@type": "IMAGE-THUMBNAIL",
            "@size": "4587",
            "@ref": "gr1",
            "@mimetype": "image/gif"
        },
        {
            "@category": "thumbnail",
            "@height": "58",
            "@width": "219",
            "@_fa": "true",
            "$": "https://api.elsevier.com/content/object/eid/1-s2.0-S0378778823001275-gr2.sml?httpAccept=%2A%2F%2A",
            "@multimediatype": "GIF image file",
            "@type": "IMAGE-THUMBNAIL",
            "@size": "6858",
            "@ref": "gr2",
            "@mimetype": "image/gif"
        },
        {
            "@category": "thumbnail",
            "@height": "75",
            "@width": "219",
            "@_fa": "true",
            "$": "https://api.elsevier.com/content/object/eid/1-s2.0-S0378778823001275-gr3.sml?httpAccept=%2A%2F%2A",
            "@multimediatype": "GIF image file",
            "@type": "IMAGE-THUMBNAIL",
            "@size": "5503",
            "@ref": "gr3",
            "@mimetype": "image/gif"
        },
        {
            "@category": "thumbnail",
            "@height": "160",
            "@width": "219",
            "@_fa": "true",
            "$": "https://api.elsevier.com/content/object/eid/1-s2.0-S0378778823001275-gr4.sml?httpAccept=%2A%2F%2A",
            "@multimediatype": "GIF image file",
            "@type": "IMAGE-THUMBNAIL",
            "@size": "11639",
            "@ref": "gr4",
            "@mimetype": "image/gif"
        },
        {
            "@category": "thumbnail",
            "@height": "80",
            "@width": "219",
            "@_fa": "true",
            "$": "https://api.elsevier.com/content/object/eid/1-s2.0-S0378778823001275-gr5.sml?httpAccept=%2A%2F%2A",
            "@multimediatype": "GIF image file",
            "@type": "IMAGE-THUMBNAIL",
            "@size": "6527",
            "@ref": "gr5",
            "@mimetype": "image/gif"
        },
        {
            "@category": "thumbnail",
            "@height": "163",
            "@width": "199",
            "@_fa": "true",
            "$": "https://api.elsevier.com/content/object/eid/1-s2.0-S0378778823001275-gr6.sml?httpAccept=%2A%2F%2A",
            "@multimediatype": "GIF image file",
            "@type": "IMAGE-THUMBNAIL",
            "@size": "7612",
            "@ref": "gr6",
            "@mimetype": "image/gif"
        },
        {
            "@category": "high",
            "@height": "2324",
            "@width": "2953",
            "@_fa": "true",
            "$": "https://api.elsevier.com/content/object/eid/1-s2.0-S0378778823001275-fx1_lrg.jpg?httpAccept=%2A%2F%2A",
            "@multimediatype": "JPEG image file",
            "@type": "IMAGE-HIGH-RES",
            "@size": "612328",
            "@ref": "fx1",
            "@mimetype": "image/jpeg"
        },
        {
            "@category": "high",
            "@height": "814",
            "@width": "2953",
            "@_fa": "true",
            "$": "https://api.elsevier.com/content/object/eid/1-s2.0-S0378778823001275-fx2_lrg.jpg?httpAccept=%2A%2F%2A",
            "@multimediatype": "JPEG image file",
            "@type": "IMAGE-HIGH-RES",
            "@size": "249509",
            "@ref": "fx2",
            "@mimetype": "image/jpeg"
        },
        {
            "@category": "high",
            "@height": "900",
            "@width": "1654",
            "@_fa": "true",
            "$": "https://api.elsevier.com/content/object/eid/1-s2.0-S0378778823001275-gr1_lrg.jpg?httpAccept=%2A%2F%2A",
            "@multimediatype": "JPEG image file",
            "@type": "IMAGE-HIGH-RES",
            "@size": "110450",
            "@ref": "gr1",
            "@mimetype": "image/jpeg"
        },
        {
            "@category": "high",
            "@height": "748",
            "@width": "2835",
            "@_fa": "true",
            "$": "https://api.elsevier.com/content/object/eid/1-s2.0-S0378778823001275-gr2_lrg.jpg?httpAccept=%2A%2F%2A",
            "@multimediatype": "JPEG image file",
            "@type": "IMAGE-HIGH-RES",
            "@size": "190782",
            "@ref": "gr2",
            "@mimetype": "image/jpeg"
        },
        {
            "@category": "high",
            "@height": "1039",
            "@width": "3037",
            "@_fa": "true",
            "$": "https://api.elsevier.com/content/object/eid/1-s2.0-S0378778823001275-gr3_lrg.jpg?httpAccept=%2A%2F%2A",
            "@multimediatype": "JPEG image file",
            "@type": "IMAGE-HIGH-RES",
            "@size": "369611",
            "@ref": "gr3",
            "@mimetype": "image/jpeg"
        },
        {
            "@category": "high",
            "@height": "2295",
            "@width": "3150",
            "@_fa": "true",
            "$": "https://api.elsevier.com/content/object/eid/1-s2.0-S0378778823001275-gr4_lrg.jpg?httpAccept=%2A%2F%2A",
            "@multimediatype": "JPEG image file",
            "@type": "IMAGE-HIGH-RES",
            "@size": "852995",
            "@ref": "gr4",
            "@mimetype": "image/jpeg"
        },
        {
            "@category": "high",
            "@height": "1079",
            "@width": "2962",
            "@_fa": "true",
            "$": "https://api.elsevier.com/content/object/eid/1-s2.0-S0378778823001275-gr5_lrg.jpg?httpAccept=%2A%2F%2A",
            "@multimediatype": "JPEG image file",
            "@type": "IMAGE-HIGH-RES",
            "@size": "465839",
            "@ref": "gr5",
            "@mimetype": "image/jpeg"
        },
        {
            "@category": "high",
            "@height": "1326",
            "@width": "1614",
            "@_fa": "true",
            "$": "https://api.elsevier.com/content/object/eid/1-s2.0-S0378778823001275-gr6_lrg.jpg?httpAccept=%2A%2F%2A",
            "@multimediatype": "JPEG image file",
            "@type": "IMAGE-HIGH-RES",
            "@size": "202212",
            "@ref": "gr6",
            "@mimetype": "image/jpeg"
        },
        {
            "@category": "thumbnail",
            "@_fa": "true",
            "$": "https://api.elsevier.com/content/object/eid/1-s2.0-S0378778823001275-si1.svg?httpAccept=%2A%2F%2A",
            "@multimediatype": "Scalable Vector Graphics file",
            "@type": "ALTIMG",
            "@size": "6039",
            "@ref": "si1",
            "@mimetype": "image/svg+xml"
        },
        {
            "@category": "thumbnail",
            "@_fa": "true",
            "$": "https://api.elsevier.com/content/object/eid/1-s2.0-S0378778823001275-si10.svg?httpAccept=%2A%2F%2A",
            "@multimediatype": "Scalable Vector Graphics file",
            "@type": "ALTIMG",
            "@size": "1541",
            "@ref": "si10",
            "@mimetype": "image/svg+xml"
        },
        {
            "@category": "thumbnail",
            "@_fa": "true",
            "$": "https://api.elsevier.com/content/object/eid/1-s2.0-S0378778823001275-si100.svg?httpAccept=%2A%2F%2A",
            "@multimediatype": "Scalable Vector Graphics file",
            "@type": "ALTIMG",
            "@size": "5721",
            "@ref": "si100",
            "@mimetype": "image/svg+xml"
        },
        {
            "@category": "thumbnail",
            "@_fa": "true",
            "$": "https://api.elsevier.com/content/object/eid/1-s2.0-S0378778823001275-si101.svg?httpAccept=%2A%2F%2A",
            "@multimediatype": "Scalable Vector Graphics file",
            "@type": "ALTIMG",
            "@size": "2568",
            "@ref": "si101",
            "@mimetype": "image/svg+xml"
        },
        {
            "@category": "thumbnail",
            "@_fa": "true",
            "$": "https://api.elsevier.com/content/object/eid/1-s2.0-S0378778823001275-si102.svg?httpAccept=%2A%2F%2A",
            "@multimediatype": "Scalable Vector Graphics file",
            "@type": "ALTIMG",
            "@size": "2671",
            "@ref": "si102",
            "@mimetype": "image/svg+xml"
        },
        {
            "@category": "thumbnail",
            "@_fa": "true",
            "$": "https://api.elsevier.com/content/object/eid/1-s2.0-S0378778823001275-si103.svg?httpAccept=%2A%2F%2A",
            "@multimediatype": "Scalable Vector Graphics file",
            "@type": "ALTIMG",
            "@size": "9303",
            "@ref": "si103",
            "@mimetype": "image/svg+xml"
        },
        {
            "@category": "thumbnail",
            "@_fa": "true",
            "$": "https://api.elsevier.com/content/object/eid/1-s2.0-S0378778823001275-si104.svg?httpAccept=%2A%2F%2A",
            "@multimediatype": "Scalable Vector Graphics file",
            "@type": "ALTIMG",
            "@size": "6251",
            "@ref": "si104",
            "@mimetype": "image/svg+xml"
        },
        {
            "@category": "thumbnail",
            "@_fa": "true",
            "$": "https://api.elsevier.com/content/object/eid/1-s2.0-S0378778823001275-si105.svg?httpAccept=%2A%2F%2A",
            "@multimediatype": "Scalable Vector Graphics file",
            "@type": "ALTIMG",
            "@size": "25070",
            "@ref": "si105",
            "@mimetype": "image/svg+xml"
        },
        {
            "@category": "thumbnail",
            "@_fa": "true",
            "$": "https://api.elsevier.com/content/object/eid/1-s2.0-S0378778823001275-si106.svg?httpAccept=%2A%2F%2A",
            "@multimediatype": "Scalable Vector Graphics file",
            "@type": "ALTIMG",
            "@size": "4468",
            "@ref": "si106",
            "@mimetype": "image/svg+xml"
        },
        {
            "@category": "thumbnail",
            "@_fa": "true",
            "$": "https://api.elsevier.com/content/object/eid/1-s2.0-S0378778823001275-si107.svg?httpAccept=%2A%2F%2A",
            "@multimediatype": "Scalable Vector Graphics file",
            "@type": "ALTIMG",
            "@size": "12644",
            "@ref": "si107",
            "@mimetype": "image/svg+xml"
        },
        {
            "@category": "thumbnail",
            "@_fa": "true",
            "$": "https://api.elsevier.com/content/object/eid/1-s2.0-S0378778823001275-si108.svg?httpAccept=%2A%2F%2A",
            "@multimediatype": "Scalable Vector Graphics file",
            "@type": "ALTIMG",
            "@size": "26437",
            "@ref": "si108",
            "@mimetype": "image/svg+xml"
        },
        {
            "@category": "thumbnail",
            "@_fa": "true",
            "$": "https://api.elsevier.com/content/object/eid/1-s2.0-S0378778823001275-si109.svg?httpAccept=%2A%2F%2A",
            "@multimediatype": "Scalable Vector Graphics file",
            "@type": "ALTIMG",
            "@size": "3363",
            "@ref": "si109",
            "@mimetype": "image/svg+xml"
        },
        {
            "@category": "thumbnail",
            "@_fa": "true",
            "$": "https://api.elsevier.com/content/object/eid/1-s2.0-S0378778823001275-si11.svg?httpAccept=%2A%2F%2A",
            "@multimediatype": "Scalable Vector Graphics file",
            "@type": "ALTIMG",
            "@size": "2337",
            "@ref": "si11",
            "@mimetype": "image/svg+xml"
        },
        {
            "@category": "thumbnail",
            "@_fa": "true",
            "$": "https://api.elsevier.com/content/object/eid/1-s2.0-S0378778823001275-si110.svg?httpAccept=%2A%2F%2A",
            "@multimediatype": "Scalable Vector Graphics file",
            "@type": "ALTIMG",
            "@size": "3363",
            "@ref": "si110",
            "@mimetype": "image/svg+xml"
        },
        {
            "@category": "thumbnail",
            "@_fa": "true",
            "$": "https://api.elsevier.com/content/object/eid/1-s2.0-S0378778823001275-si111.svg?httpAccept=%2A%2F%2A",
            "@multimediatype": "Scalable Vector Graphics file",
            "@type": "ALTIMG",
            "@size": "6055",
            "@ref": "si111",
            "@mimetype": "image/svg+xml"
        },
        {
            "@category": "thumbnail",
            "@_fa": "true",
            "$": "https://api.elsevier.com/content/object/eid/1-s2.0-S0378778823001275-si112.svg?httpAccept=%2A%2F%2A",
            "@multimediatype": "Scalable Vector Graphics file",
            "@type": "ALTIMG",
            "@size": "2395",
            "@ref": "si112",
            "@mimetype": "image/svg+xml"
        },
        {
            "@category": "thumbnail",
            "@_fa": "true",
            "$": "https://api.elsevier.com/content/object/eid/1-s2.0-S0378778823001275-si113.svg?httpAccept=%2A%2F%2A",
            "@multimediatype": "Scalable Vector Graphics file",
            "@type": "ALTIMG",
            "@size": "7456",
            "@ref": "si113",
            "@mimetype": "image/svg+xml"
        },
        {
            "@category": "thumbnail",
            "@_fa": "true",
            "$": "https://api.elsevier.com/content/object/eid/1-s2.0-S0378778823001275-si114.svg?httpAccept=%2A%2F%2A",
            "@multimediatype": "Scalable Vector Graphics file",
            "@type": "ALTIMG",
            "@size": "4278",
            "@ref": "si114",
            "@mimetype": "image/svg+xml"
        },
        {
            "@category": "thumbnail",
            "@_fa": "true",
            "$": "https://api.elsevier.com/content/object/eid/1-s2.0-S0378778823001275-si115.svg?httpAccept=%2A%2F%2A",
            "@multimediatype": "Scalable Vector Graphics file",
            "@type": "ALTIMG",
            "@size": "20745",
            "@ref": "si115",
            "@mimetype": "image/svg+xml"
        },
        {
            "@category": "thumbnail",
            "@_fa": "true",
            "$": "https://api.elsevier.com/content/object/eid/1-s2.0-S0378778823001275-si116.svg?httpAccept=%2A%2F%2A",
            "@multimediatype": "Scalable Vector Graphics file",
            "@type": "ALTIMG",
            "@size": "1202",
            "@ref": "si116",
            "@mimetype": "image/svg+xml"
        },
        {
            "@category": "thumbnail",
            "@_fa": "true",
            "$": "https://api.elsevier.com/content/object/eid/1-s2.0-S0378778823001275-si117.svg?httpAccept=%2A%2F%2A",
            "@multimediatype": "Scalable Vector Graphics file",
            "@type": "ALTIMG",
            "@size": "2060",
            "@ref": "si117",
            "@mimetype": "image/svg+xml"
        },
        {
            "@category": "thumbnail",
            "@_fa": "true",
            "$": "https://api.elsevier.com/content/object/eid/1-s2.0-S0378778823001275-si118.svg?httpAccept=%2A%2F%2A",
            "@multimediatype": "Scalable Vector Graphics file",
            "@type": "ALTIMG",
            "@size": "1542",
            "@ref": "si118",
            "@mimetype": "image/svg+xml"
        },
        {
            "@category": "thumbnail",
            "@_fa": "true",
            "$": "https://api.elsevier.com/content/object/eid/1-s2.0-S0378778823001275-si119.svg?httpAccept=%2A%2F%2A",
            "@multimediatype": "Scalable Vector Graphics file",
            "@type": "ALTIMG",
            "@size": "1542",
            "@ref": "si119",
            "@mimetype": "image/svg+xml"
        },
        {
            "@category": "thumbnail",
            "@_fa": "true",
            "$": "https://api.elsevier.com/content/object/eid/1-s2.0-S0378778823001275-si12.svg?httpAccept=%2A%2F%2A",
            "@multimediatype": "Scalable Vector Graphics file",
            "@type": "ALTIMG",
            "@size": "1541",
            "@ref": "si12",
            "@mimetype": "image/svg+xml"
        },
        {
            "@category": "thumbnail",
            "@_fa": "true",
            "$": "https://api.elsevier.com/content/object/eid/1-s2.0-S0378778823001275-si120.svg?httpAccept=%2A%2F%2A",
            "@multimediatype": "Scalable Vector Graphics file",
            "@type": "ALTIMG",
            "@size": "2043",
            "@ref": "si120",
            "@mimetype": "image/svg+xml"
        },
        {
            "@category": "thumbnail",
            "@_fa": "true",
            "$": "https://api.elsevier.com/content/object/eid/1-s2.0-S0378778823001275-si121.svg?httpAccept=%2A%2F%2A",
            "@multimediatype": "Scalable Vector Graphics file",
            "@type": "ALTIMG",
            "@size": "1202",
            "@ref": "si121",
            "@mimetype": "image/svg+xml"
        },
        {
            "@category": "thumbnail",
            "@_fa": "true",
            "$": "https://api.elsevier.com/content/object/eid/1-s2.0-S0378778823001275-si122.svg?httpAccept=%2A%2F%2A",
            "@multimediatype": "Scalable Vector Graphics file",
            "@type": "ALTIMG",
            "@size": "2060",
            "@ref": "si122",
            "@mimetype": "image/svg+xml"
        },
        {
            "@category": "thumbnail",
            "@_fa": "true",
            "$": "https://api.elsevier.com/content/object/eid/1-s2.0-S0378778823001275-si123.svg?httpAccept=%2A%2F%2A",
            "@multimediatype": "Scalable Vector Graphics file",
            "@type": "ALTIMG",
            "@size": "1538",
            "@ref": "si123",
            "@mimetype": "image/svg+xml"
        },
        {
            "@category": "thumbnail",
            "@_fa": "true",
            "$": "https://api.elsevier.com/content/object/eid/1-s2.0-S0378778823001275-si124.svg?httpAccept=%2A%2F%2A",
            "@multimediatype": "Scalable Vector Graphics file",
            "@type": "ALTIMG",
            "@size": "1542",
            "@ref": "si124",
            "@mimetype": "image/svg+xml"
        },
        {
            "@category": "thumbnail",
            "@_fa": "true",
            "$": "https://api.elsevier.com/content/object/eid/1-s2.0-S0378778823001275-si125.svg?httpAccept=%2A%2F%2A",
            "@multimediatype": "Scalable Vector Graphics file",
            "@type": "ALTIMG",
            "@size": "1202",
            "@ref": "si125",
            "@mimetype": "image/svg+xml"
        },
        {
            "@category": "thumbnail",
            "@_fa": "true",
            "$": "https://api.elsevier.com/content/object/eid/1-s2.0-S0378778823001275-si126.svg?httpAccept=%2A%2F%2A",
            "@multimediatype": "Scalable Vector Graphics file",
            "@type": "ALTIMG",
            "@size": "2060",
            "@ref": "si126",
            "@mimetype": "image/svg+xml"
        },
        {
            "@category": "thumbnail",
            "@_fa": "true",
            "$": "https://api.elsevier.com/content/object/eid/1-s2.0-S0378778823001275-si127.svg?httpAccept=%2A%2F%2A",
            "@multimediatype": "Scalable Vector Graphics file",
            "@type": "ALTIMG",
            "@size": "8557",
            "@ref": "si127",
            "@mimetype": "image/svg+xml"
        },
        {
            "@category": "thumbnail",
            "@_fa": "true",
            "$": "https://api.elsevier.com/content/object/eid/1-s2.0-S0378778823001275-si128.svg?httpAccept=%2A%2F%2A",
            "@multimediatype": "Scalable Vector Graphics file",
            "@type": "ALTIMG",
            "@size": "1542",
            "@ref": "si128",
            "@mimetype": "image/svg+xml"
        },
        {
            "@category": "thumbnail",
            "@_fa": "true",
            "$": "https://api.elsevier.com/content/object/eid/1-s2.0-S0378778823001275-si129.svg?httpAccept=%2A%2F%2A",
            "@multimediatype": "Scalable Vector Graphics file",
            "@type": "ALTIMG",
            "@size": "2353",
            "@ref": "si129",
            "@mimetype": "image/svg+xml"
        },
        {
            "@category": "thumbnail",
            "@_fa": "true",
            "$": "https://api.elsevier.com/content/object/eid/1-s2.0-S0378778823001275-si13.svg?httpAccept=%2A%2F%2A",
            "@multimediatype": "Scalable Vector Graphics file",
            "@type": "ALTIMG",
            "@size": "4275",
            "@ref": "si13",
            "@mimetype": "image/svg+xml"
        },
        {
            "@category": "thumbnail",
            "@_fa": "true",
            "$": "https://api.elsevier.com/content/object/eid/1-s2.0-S0378778823001275-si130.svg?httpAccept=%2A%2F%2A",
            "@multimediatype": "Scalable Vector Graphics file",
            "@type": "ALTIMG",
            "@size": "1538",
            "@ref": "si130",
            "@mimetype": "image/svg+xml"
        },
        {
            "@category": "thumbnail",
            "@_fa": "true",
            "$": "https://api.elsevier.com/content/object/eid/1-s2.0-S0378778823001275-si131.svg?httpAccept=%2A%2F%2A",
            "@multimediatype": "Scalable Vector Graphics file",
            "@type": "ALTIMG",
            "@size": "3363",
            "@ref": "si131",
            "@mimetype": "image/svg+xml"
        },
        {
            "@category": "thumbnail",
            "@_fa": "true",
            "$": "https://api.elsevier.com/content/object/eid/1-s2.0-S0378778823001275-si132.svg?httpAccept=%2A%2F%2A",
            "@multimediatype": "Scalable Vector Graphics file",
            "@type": "ALTIMG",
            "@size": "4570",
            "@ref": "si132",
            "@mimetype": "image/svg+xml"
        },
        {
            "@category": "thumbnail",
            "@_fa": "true",
            "$": "https://api.elsevier.com/content/object/eid/1-s2.0-S0378778823001275-si133.svg?httpAccept=%2A%2F%2A",
            "@multimediatype": "Scalable Vector Graphics file",
            "@type": "ALTIMG",
            "@size": "30945",
            "@ref": "si133",
            "@mimetype": "image/svg+xml"
        },
        {
            "@category": "thumbnail",
            "@_fa": "true",
            "$": "https://api.elsevier.com/content/object/eid/1-s2.0-S0378778823001275-si134.svg?httpAccept=%2A%2F%2A",
            "@multimediatype": "Scalable Vector Graphics file",
            "@type": "ALTIMG",
            "@size": "2462",
            "@ref": "si134",
            "@mimetype": "image/svg+xml"
        },
        {
            "@category": "thumbnail",
            "@_fa": "true",
            "$": "https://api.elsevier.com/content/object/eid/1-s2.0-S0378778823001275-si135.svg?httpAccept=%2A%2F%2A",
            "@multimediatype": "Scalable Vector Graphics file",
            "@type": "ALTIMG",
            "@size": "2080",
            "@ref": "si135",
            "@mimetype": "image/svg+xml"
        },
        {
            "@category": "thumbnail",
            "@_fa": "true",
            "$": "https://api.elsevier.com/content/object/eid/1-s2.0-S0378778823001275-si136.svg?httpAccept=%2A%2F%2A",
            "@multimediatype": "Scalable Vector Graphics file",
            "@type": "ALTIMG",
            "@size": "2468",
            "@ref": "si136",
            "@mimetype": "image/svg+xml"
        },
        {
            "@category": "thumbnail",
            "@_fa": "true",
            "$": "https://api.elsevier.com/content/object/eid/1-s2.0-S0378778823001275-si137.svg?httpAccept=%2A%2F%2A",
            "@multimediatype": "Scalable Vector Graphics file",
            "@type": "ALTIMG",
            "@size": "2468",
            "@ref": "si137",
            "@mimetype": "image/svg+xml"
        },
        {
            "@category": "thumbnail",
            "@_fa": "true",
            "$": "https://api.elsevier.com/content/object/eid/1-s2.0-S0378778823001275-si138.svg?httpAccept=%2A%2F%2A",
            "@multimediatype": "Scalable Vector Graphics file",
            "@type": "ALTIMG",
            "@size": "2080",
            "@ref": "si138",
            "@mimetype": "image/svg+xml"
        },
        {
            "@category": "thumbnail",
            "@_fa": "true",
            "$": "https://api.elsevier.com/content/object/eid/1-s2.0-S0378778823001275-si139.svg?httpAccept=%2A%2F%2A",
            "@multimediatype": "Scalable Vector Graphics file",
            "@type": "ALTIMG",
            "@size": "2468",
            "@ref": "si139",
            "@mimetype": "image/svg+xml"
        },
        {
            "@category": "thumbnail",
            "@_fa": "true",
            "$": "https://api.elsevier.com/content/object/eid/1-s2.0-S0378778823001275-si14.svg?httpAccept=%2A%2F%2A",
            "@multimediatype": "Scalable Vector Graphics file",
            "@type": "ALTIMG",
            "@size": "2337",
            "@ref": "si14",
            "@mimetype": "image/svg+xml"
        },
        {
            "@category": "thumbnail",
            "@_fa": "true",
            "$": "https://api.elsevier.com/content/object/eid/1-s2.0-S0378778823001275-si140.svg?httpAccept=%2A%2F%2A",
            "@multimediatype": "Scalable Vector Graphics file",
            "@type": "ALTIMG",
            "@size": "1924",
            "@ref": "si140",
            "@mimetype": "image/svg+xml"
        },
        {
            "@category": "thumbnail",
            "@_fa": "true",
            "$": "https://api.elsevier.com/content/object/eid/1-s2.0-S0378778823001275-si141.svg?httpAccept=%2A%2F%2A",
            "@multimediatype": "Scalable Vector Graphics file",
            "@type": "ALTIMG",
            "@size": "2399",
            "@ref": "si141",
            "@mimetype": "image/svg+xml"
        },
        {
            "@category": "thumbnail",
            "@_fa": "true",
            "$": "https://api.elsevier.com/content/object/eid/1-s2.0-S0378778823001275-si142.svg?httpAccept=%2A%2F%2A",
            "@multimediatype": "Scalable Vector Graphics file",
            "@type": "ALTIMG",
            "@size": "1538",
            "@ref": "si142",
            "@mimetype": "image/svg+xml"
        },
        {
            "@category": "thumbnail",
            "@_fa": "true",
            "$": "https://api.elsevier.com/content/object/eid/1-s2.0-S0378778823001275-si143.svg?httpAccept=%2A%2F%2A",
            "@multimediatype": "Scalable Vector Graphics file",
            "@type": "ALTIMG",
            "@size": "3937",
            "@ref": "si143",
            "@mimetype": "image/svg+xml"
        },
        {
            "@category": "thumbnail",
            "@_fa": "true",
            "$": "https://api.elsevier.com/content/object/eid/1-s2.0-S0378778823001275-si144.svg?httpAccept=%2A%2F%2A",
            "@multimediatype": "Scalable Vector Graphics file",
            "@type": "ALTIMG",
            "@size": "35490",
            "@ref": "si144",
            "@mimetype": "image/svg+xml"
        },
        {
            "@category": "thumbnail",
            "@_fa": "true",
            "$": "https://api.elsevier.com/content/object/eid/1-s2.0-S0378778823001275-si145.svg?httpAccept=%2A%2F%2A",
            "@multimediatype": "Scalable Vector Graphics file",
            "@type": "ALTIMG",
            "@size": "4915",
            "@ref": "si145",
            "@mimetype": "image/svg+xml"
        },
        {
            "@category": "thumbnail",
            "@_fa": "true",
            "$": "https://api.elsevier.com/content/object/eid/1-s2.0-S0378778823001275-si146.svg?httpAccept=%2A%2F%2A",
            "@multimediatype": "Scalable Vector Graphics file",
            "@type": "ALTIMG",
            "@size": "1758",
            "@ref": "si146",
            "@mimetype": "image/svg+xml"
        },
        {
            "@category": "thumbnail",
            "@_fa": "true",
            "$": "https://api.elsevier.com/content/object/eid/1-s2.0-S0378778823001275-si147.svg?httpAccept=%2A%2F%2A",
            "@multimediatype": "Scalable Vector Graphics file",
            "@type": "ALTIMG",
            "@size": "1542",
            "@ref": "si147",
            "@mimetype": "image/svg+xml"
        },
        {
            "@category": "thumbnail",
            "@_fa": "true",
            "$": "https://api.elsevier.com/content/object/eid/1-s2.0-S0378778823001275-si148.svg?httpAccept=%2A%2F%2A",
            "@multimediatype": "Scalable Vector Graphics file",
            "@type": "ALTIMG",
            "@size": "2934",
            "@ref": "si148",
            "@mimetype": "image/svg+xml"
        },
        {
            "@category": "thumbnail",
            "@_fa": "true",
            "$": "https://api.elsevier.com/content/object/eid/1-s2.0-S0378778823001275-si149.svg?httpAccept=%2A%2F%2A",
            "@multimediatype": "Scalable Vector Graphics file",
            "@type": "ALTIMG",
            "@size": "1758",
            "@ref": "si149",
            "@mimetype": "image/svg+xml"
        },
        {
            "@category": "thumbnail",
            "@_fa": "true",
            "$": "https://api.elsevier.com/content/object/eid/1-s2.0-S0378778823001275-si15.svg?httpAccept=%2A%2F%2A",
            "@multimediatype": "Scalable Vector Graphics file",
            "@type": "ALTIMG",
            "@size": "1541",
            "@ref": "si15",
            "@mimetype": "image/svg+xml"
        },
        {
            "@category": "thumbnail",
            "@_fa": "true",
            "$": "https://api.elsevier.com/content/object/eid/1-s2.0-S0378778823001275-si150.svg?httpAccept=%2A%2F%2A",
            "@multimediatype": "Scalable Vector Graphics file",
            "@type": "ALTIMG",
            "@size": "15883",
            "@ref": "si150",
            "@mimetype": "image/svg+xml"
        },
        {
            "@category": "thumbnail",
            "@_fa": "true",
            "$": "https://api.elsevier.com/content/object/eid/1-s2.0-S0378778823001275-si151.svg?httpAccept=%2A%2F%2A",
            "@multimediatype": "Scalable Vector Graphics file",
            "@type": "ALTIMG",
            "@size": "2679",
            "@ref": "si151",
            "@mimetype": "image/svg+xml"
        },
        {
            "@category": "thumbnail",
            "@_fa": "true",
            "$": "https://api.elsevier.com/content/object/eid/1-s2.0-S0378778823001275-si152.svg?httpAccept=%2A%2F%2A",
            "@multimediatype": "Scalable Vector Graphics file",
            "@type": "ALTIMG",
            "@size": "1758",
            "@ref": "si152",
            "@mimetype": "image/svg+xml"
        },
        {
            "@category": "thumbnail",
            "@_fa": "true",
            "$": "https://api.elsevier.com/content/object/eid/1-s2.0-S0378778823001275-si153.svg?httpAccept=%2A%2F%2A",
            "@multimediatype": "Scalable Vector Graphics file",
            "@type": "ALTIMG",
            "@size": "1758",
            "@ref": "si153",
            "@mimetype": "image/svg+xml"
        },
        {
            "@category": "thumbnail",
            "@_fa": "true",
            "$": "https://api.elsevier.com/content/object/eid/1-s2.0-S0378778823001275-si154.svg?httpAccept=%2A%2F%2A",
            "@multimediatype": "Scalable Vector Graphics file",
            "@type": "ALTIMG",
            "@size": "1758",
            "@ref": "si154",
            "@mimetype": "image/svg+xml"
        },
        {
            "@category": "thumbnail",
            "@_fa": "true",
            "$": "https://api.elsevier.com/content/object/eid/1-s2.0-S0378778823001275-si155.svg?httpAccept=%2A%2F%2A",
            "@multimediatype": "Scalable Vector Graphics file",
            "@type": "ALTIMG",
            "@size": "6135",
            "@ref": "si155",
            "@mimetype": "image/svg+xml"
        },
        {
            "@category": "thumbnail",
            "@_fa": "true",
            "$": "https://api.elsevier.com/content/object/eid/1-s2.0-S0378778823001275-si156.svg?httpAccept=%2A%2F%2A",
            "@multimediatype": "Scalable Vector Graphics file",
            "@type": "ALTIMG",
            "@size": "1542",
            "@ref": "si156",
            "@mimetype": "image/svg+xml"
        },
        {
            "@category": "thumbnail",
            "@_fa": "true",
            "$": "https://api.elsevier.com/content/object/eid/1-s2.0-S0378778823001275-si157.svg?httpAccept=%2A%2F%2A",
            "@multimediatype": "Scalable Vector Graphics file",
            "@type": "ALTIMG",
            "@size": "1542",
            "@ref": "si157",
            "@mimetype": "image/svg+xml"
        },
        {
            "@category": "thumbnail",
            "@_fa": "true",
            "$": "https://api.elsevier.com/content/object/eid/1-s2.0-S0378778823001275-si158.svg?httpAccept=%2A%2F%2A",
            "@multimediatype": "Scalable Vector Graphics file",
            "@type": "ALTIMG",
            "@size": "1514",
            "@ref": "si158",
            "@mimetype": "image/svg+xml"
        },
        {
            "@category": "thumbnail",
            "@_fa": "true",
            "$": "https://api.elsevier.com/content/object/eid/1-s2.0-S0378778823001275-si159.svg?httpAccept=%2A%2F%2A",
            "@multimediatype": "Scalable Vector Graphics file",
            "@type": "ALTIMG",
            "@size": "1202",
            "@ref": "si159",
            "@mimetype": "image/svg+xml"
        },
        {
            "@category": "thumbnail",
            "@_fa": "true",
            "$": "https://api.elsevier.com/content/object/eid/1-s2.0-S0378778823001275-si16.svg?httpAccept=%2A%2F%2A",
            "@multimediatype": "Scalable Vector Graphics file",
            "@type": "ALTIMG",
            "@size": "12333",
            "@ref": "si16",
            "@mimetype": "image/svg+xml"
        },
        {
            "@category": "thumbnail",
            "@_fa": "true",
            "$": "https://api.elsevier.com/content/object/eid/1-s2.0-S0378778823001275-si160.svg?httpAccept=%2A%2F%2A",
            "@multimediatype": "Scalable Vector Graphics file",
            "@type": "ALTIMG",
            "@size": "2060",
            "@ref": "si160",
            "@mimetype": "image/svg+xml"
        },
        {
            "@category": "thumbnail",
            "@_fa": "true",
            "$": "https://api.elsevier.com/content/object/eid/1-s2.0-S0378778823001275-si161.svg?httpAccept=%2A%2F%2A",
            "@multimediatype": "Scalable Vector Graphics file",
            "@type": "ALTIMG",
            "@size": "5875",
            "@ref": "si161",
            "@mimetype": "image/svg+xml"
        },
        {
            "@category": "thumbnail",
            "@_fa": "true",
            "$": "https://api.elsevier.com/content/object/eid/1-s2.0-S0378778823001275-si162.svg?httpAccept=%2A%2F%2A",
            "@multimediatype": "Scalable Vector Graphics file",
            "@type": "ALTIMG",
            "@size": "10347",
            "@ref": "si162",
            "@mimetype": "image/svg+xml"
        },
        {
            "@category": "thumbnail",
            "@_fa": "true",
            "$": "https://api.elsevier.com/content/object/eid/1-s2.0-S0378778823001275-si163.svg?httpAccept=%2A%2F%2A",
            "@multimediatype": "Scalable Vector Graphics file",
            "@type": "ALTIMG",
            "@size": "1542",
            "@ref": "si163",
            "@mimetype": "image/svg+xml"
        },
        {
            "@category": "thumbnail",
            "@_fa": "true",
            "$": "https://api.elsevier.com/content/object/eid/1-s2.0-S0378778823001275-si164.svg?httpAccept=%2A%2F%2A",
            "@multimediatype": "Scalable Vector Graphics file",
            "@type": "ALTIMG",
            "@size": "1542",
            "@ref": "si164",
            "@mimetype": "image/svg+xml"
        },
        {
            "@category": "thumbnail",
            "@_fa": "true",
            "$": "https://api.elsevier.com/content/object/eid/1-s2.0-S0378778823001275-si165.svg?httpAccept=%2A%2F%2A",
            "@multimediatype": "Scalable Vector Graphics file",
            "@type": "ALTIMG",
            "@size": "1514",
            "@ref": "si165",
            "@mimetype": "image/svg+xml"
        },
        {
            "@category": "thumbnail",
            "@_fa": "true",
            "$": "https://api.elsevier.com/content/object/eid/1-s2.0-S0378778823001275-si166.svg?httpAccept=%2A%2F%2A",
            "@multimediatype": "Scalable Vector Graphics file",
            "@type": "ALTIMG",
            "@size": "6041",
            "@ref": "si166",
            "@mimetype": "image/svg+xml"
        },
        {
            "@category": "thumbnail",
            "@_fa": "true",
            "$": "https://api.elsevier.com/content/object/eid/1-s2.0-S0378778823001275-si167.svg?httpAccept=%2A%2F%2A",
            "@multimediatype": "Scalable Vector Graphics file",
            "@type": "ALTIMG",
            "@size": "1542",
            "@ref": "si167",
            "@mimetype": "image/svg+xml"
        },
        {
            "@category": "thumbnail",
            "@_fa": "true",
            "$": "https://api.elsevier.com/content/object/eid/1-s2.0-S0378778823001275-si168.svg?httpAccept=%2A%2F%2A",
            "@multimediatype": "Scalable Vector Graphics file",
            "@type": "ALTIMG",
            "@size": "1542",
            "@ref": "si168",
            "@mimetype": "image/svg+xml"
        },
        {
            "@category": "thumbnail",
            "@_fa": "true",
            "$": "https://api.elsevier.com/content/object/eid/1-s2.0-S0378778823001275-si169.svg?httpAccept=%2A%2F%2A",
            "@multimediatype": "Scalable Vector Graphics file",
            "@type": "ALTIMG",
            "@size": "6041",
            "@ref": "si169",
            "@mimetype": "image/svg+xml"
        },
        {
            "@category": "thumbnail",
            "@_fa": "true",
            "$": "https://api.elsevier.com/content/object/eid/1-s2.0-S0378778823001275-si17.svg?httpAccept=%2A%2F%2A",
            "@multimediatype": "Scalable Vector Graphics file",
            "@type": "ALTIMG",
            "@size": "1749",
            "@ref": "si17",
            "@mimetype": "image/svg+xml"
        },
        {
            "@category": "thumbnail",
            "@_fa": "true",
            "$": "https://api.elsevier.com/content/object/eid/1-s2.0-S0378778823001275-si170.svg?httpAccept=%2A%2F%2A",
            "@multimediatype": "Scalable Vector Graphics file",
            "@type": "ALTIMG",
            "@size": "1542",
            "@ref": "si170",
            "@mimetype": "image/svg+xml"
        },
        {
            "@category": "thumbnail",
            "@_fa": "true",
            "$": "https://api.elsevier.com/content/object/eid/1-s2.0-S0378778823001275-si171.svg?httpAccept=%2A%2F%2A",
            "@multimediatype": "Scalable Vector Graphics file",
            "@type": "ALTIMG",
            "@size": "1202",
            "@ref": "si171",
            "@mimetype": "image/svg+xml"
        },
        {
            "@category": "thumbnail",
            "@_fa": "true",
            "$": "https://api.elsevier.com/content/object/eid/1-s2.0-S0378778823001275-si172.svg?httpAccept=%2A%2F%2A",
            "@multimediatype": "Scalable Vector Graphics file",
            "@type": "ALTIMG",
            "@size": "2060",
            "@ref": "si172",
            "@mimetype": "image/svg+xml"
        },
        {
            "@category": "thumbnail",
            "@_fa": "true",
            "$": "https://api.elsevier.com/content/object/eid/1-s2.0-S0378778823001275-si173.svg?httpAccept=%2A%2F%2A",
            "@multimediatype": "Scalable Vector Graphics file",
            "@type": "ALTIMG",
            "@size": "1542",
            "@ref": "si173",
            "@mimetype": "image/svg+xml"
        },
        {
            "@category": "thumbnail",
            "@_fa": "true",
            "$": "https://api.elsevier.com/content/object/eid/1-s2.0-S0378778823001275-si174.svg?httpAccept=%2A%2F%2A",
            "@multimediatype": "Scalable Vector Graphics file",
            "@type": "ALTIMG",
            "@size": "3755",
            "@ref": "si174",
            "@mimetype": "image/svg+xml"
        },
        {
            "@category": "thumbnail",
            "@_fa": "true",
            "$": "https://api.elsevier.com/content/object/eid/1-s2.0-S0378778823001275-si175.svg?httpAccept=%2A%2F%2A",
            "@multimediatype": "Scalable Vector Graphics file",
            "@type": "ALTIMG",
            "@size": "6041",
            "@ref": "si175",
            "@mimetype": "image/svg+xml"
        },
        {
            "@category": "thumbnail",
            "@_fa": "true",
            "$": "https://api.elsevier.com/content/object/eid/1-s2.0-S0378778823001275-si176.svg?httpAccept=%2A%2F%2A",
            "@multimediatype": "Scalable Vector Graphics file",
            "@type": "ALTIMG",
            "@size": "5193",
            "@ref": "si176",
            "@mimetype": "image/svg+xml"
        },
        {
            "@category": "thumbnail",
            "@_fa": "true",
            "$": "https://api.elsevier.com/content/object/eid/1-s2.0-S0378778823001275-si177.svg?httpAccept=%2A%2F%2A",
            "@multimediatype": "Scalable Vector Graphics file",
            "@type": "ALTIMG",
            "@size": "1542",
            "@ref": "si177",
            "@mimetype": "image/svg+xml"
        },
        {
            "@category": "thumbnail",
            "@_fa": "true",
            "$": "https://api.elsevier.com/content/object/eid/1-s2.0-S0378778823001275-si178.svg?httpAccept=%2A%2F%2A",
            "@multimediatype": "Scalable Vector Graphics file",
            "@type": "ALTIMG",
            "@size": "6041",
            "@ref": "si178",
            "@mimetype": "image/svg+xml"
        },
        {
            "@category": "thumbnail",
            "@_fa": "true",
            "$": "https://api.elsevier.com/content/object/eid/1-s2.0-S0378778823001275-si179.svg?httpAccept=%2A%2F%2A",
            "@multimediatype": "Scalable Vector Graphics file",
            "@type": "ALTIMG",
            "@size": "1542",
            "@ref": "si179",
            "@mimetype": "image/svg+xml"
        },
        {
            "@category": "thumbnail",
            "@_fa": "true",
            "$": "https://api.elsevier.com/content/object/eid/1-s2.0-S0378778823001275-si18.svg?httpAccept=%2A%2F%2A",
            "@multimediatype": "Scalable Vector Graphics file",
            "@type": "ALTIMG",
            "@size": "1645",
            "@ref": "si18",
            "@mimetype": "image/svg+xml"
        },
        {
            "@category": "thumbnail",
            "@_fa": "true",
            "$": "https://api.elsevier.com/content/object/eid/1-s2.0-S0378778823001275-si180.svg?httpAccept=%2A%2F%2A",
            "@multimediatype": "Scalable Vector Graphics file",
            "@type": "ALTIMG",
            "@size": "1542",
            "@ref": "si180",
            "@mimetype": "image/svg+xml"
        },
        {
            "@category": "thumbnail",
            "@_fa": "true",
            "$": "https://api.elsevier.com/content/object/eid/1-s2.0-S0378778823001275-si181.svg?httpAccept=%2A%2F%2A",
            "@multimediatype": "Scalable Vector Graphics file",
            "@type": "ALTIMG",
            "@size": "8327",
            "@ref": "si181",
            "@mimetype": "image/svg+xml"
        },
        {
            "@category": "thumbnail",
            "@_fa": "true",
            "$": "https://api.elsevier.com/content/object/eid/1-s2.0-S0378778823001275-si182.svg?httpAccept=%2A%2F%2A",
            "@multimediatype": "Scalable Vector Graphics file",
            "@type": "ALTIMG",
            "@size": "6041",
            "@ref": "si182",
            "@mimetype": "image/svg+xml"
        },
        {
            "@category": "thumbnail",
            "@_fa": "true",
            "$": "https://api.elsevier.com/content/object/eid/1-s2.0-S0378778823001275-si183.svg?httpAccept=%2A%2F%2A",
            "@multimediatype": "Scalable Vector Graphics file",
            "@type": "ALTIMG",
            "@size": "3775",
            "@ref": "si183",
            "@mimetype": "image/svg+xml"
        },
        {
            "@category": "thumbnail",
            "@_fa": "true",
            "$": "https://api.elsevier.com/content/object/eid/1-s2.0-S0378778823001275-si184.svg?httpAccept=%2A%2F%2A",
            "@multimediatype": "Scalable Vector Graphics file",
            "@type": "ALTIMG",
            "@size": "4957",
            "@ref": "si184",
            "@mimetype": "image/svg+xml"
        },
        {
            "@category": "thumbnail",
            "@_fa": "true",
            "$": "https://api.elsevier.com/content/object/eid/1-s2.0-S0378778823001275-si185.svg?httpAccept=%2A%2F%2A",
            "@multimediatype": "Scalable Vector Graphics file",
            "@type": "ALTIMG",
            "@size": "1542",
            "@ref": "si185",
            "@mimetype": "image/svg+xml"
        },
        {
            "@category": "thumbnail",
            "@_fa": "true",
            "$": "https://api.elsevier.com/content/object/eid/1-s2.0-S0378778823001275-si186.svg?httpAccept=%2A%2F%2A",
            "@multimediatype": "Scalable Vector Graphics file",
            "@type": "ALTIMG",
            "@size": "13260",
            "@ref": "si186",
            "@mimetype": "image/svg+xml"
        },
        {
            "@category": "thumbnail",
            "@_fa": "true",
            "$": "https://api.elsevier.com/content/object/eid/1-s2.0-S0378778823001275-si187.svg?httpAccept=%2A%2F%2A",
            "@multimediatype": "Scalable Vector Graphics file",
            "@type": "ALTIMG",
            "@size": "2338",
            "@ref": "si187",
            "@mimetype": "image/svg+xml"
        },
        {
            "@category": "thumbnail",
            "@_fa": "true",
            "$": "https://api.elsevier.com/content/object/eid/1-s2.0-S0378778823001275-si188.svg?httpAccept=%2A%2F%2A",
            "@multimediatype": "Scalable Vector Graphics file",
            "@type": "ALTIMG",
            "@size": "3234",
            "@ref": "si188",
            "@mimetype": "image/svg+xml"
        },
        {
            "@category": "thumbnail",
            "@_fa": "true",
            "$": "https://api.elsevier.com/content/object/eid/1-s2.0-S0378778823001275-si189.svg?httpAccept=%2A%2F%2A",
            "@multimediatype": "Scalable Vector Graphics file",
            "@type": "ALTIMG",
            "@size": "2060",
            "@ref": "si189",
            "@mimetype": "image/svg+xml"
        },
        {
            "@category": "thumbnail",
            "@_fa": "true",
            "$": "https://api.elsevier.com/content/object/eid/1-s2.0-S0378778823001275-si19.svg?httpAccept=%2A%2F%2A",
            "@multimediatype": "Scalable Vector Graphics file",
            "@type": "ALTIMG",
            "@size": "1670",
            "@ref": "si19",
            "@mimetype": "image/svg+xml"
        },
        {
            "@category": "thumbnail",
            "@_fa": "true",
            "$": "https://api.elsevier.com/content/object/eid/1-s2.0-S0378778823001275-si190.svg?httpAccept=%2A%2F%2A",
            "@multimediatype": "Scalable Vector Graphics file",
            "@type": "ALTIMG",
            "@size": "1758",
            "@ref": "si190",
            "@mimetype": "image/svg+xml"
        },
        {
            "@category": "thumbnail",
            "@_fa": "true",
            "$": "https://api.elsevier.com/content/object/eid/1-s2.0-S0378778823001275-si191.svg?httpAccept=%2A%2F%2A",
            "@multimediatype": "Scalable Vector Graphics file",
            "@type": "ALTIMG",
            "@size": "1542",
            "@ref": "si191",
            "@mimetype": "image/svg+xml"
        },
        {
            "@category": "thumbnail",
            "@_fa": "true",
            "$": "https://api.elsevier.com/content/object/eid/1-s2.0-S0378778823001275-si192.svg?httpAccept=%2A%2F%2A",
            "@multimediatype": "Scalable Vector Graphics file",
            "@type": "ALTIMG",
            "@size": "1542",
            "@ref": "si192",
            "@mimetype": "image/svg+xml"
        },
        {
            "@category": "thumbnail",
            "@_fa": "true",
            "$": "https://api.elsevier.com/content/object/eid/1-s2.0-S0378778823001275-si193.svg?httpAccept=%2A%2F%2A",
            "@multimediatype": "Scalable Vector Graphics file",
            "@type": "ALTIMG",
            "@size": "2338",
            "@ref": "si193",
            "@mimetype": "image/svg+xml"
        },
        {
            "@category": "thumbnail",
            "@_fa": "true",
            "$": "https://api.elsevier.com/content/object/eid/1-s2.0-S0378778823001275-si194.svg?httpAccept=%2A%2F%2A",
            "@multimediatype": "Scalable Vector Graphics file",
            "@type": "ALTIMG",
            "@size": "1538",
            "@ref": "si194",
            "@mimetype": "image/svg+xml"
        },
        {
            "@category": "thumbnail",
            "@_fa": "true",
            "$": "https://api.elsevier.com/content/object/eid/1-s2.0-S0378778823001275-si195.svg?httpAccept=%2A%2F%2A",
            "@multimediatype": "Scalable Vector Graphics file",
            "@type": "ALTIMG",
            "@size": "1538",
            "@ref": "si195",
            "@mimetype": "image/svg+xml"
        },
        {
            "@category": "thumbnail",
            "@_fa": "true",
            "$": "https://api.elsevier.com/content/object/eid/1-s2.0-S0378778823001275-si196.svg?httpAccept=%2A%2F%2A",
            "@multimediatype": "Scalable Vector Graphics file",
            "@type": "ALTIMG",
            "@size": "1538",
            "@ref": "si196",
            "@mimetype": "image/svg+xml"
        },
        {
            "@category": "thumbnail",
            "@_fa": "true",
            "$": "https://api.elsevier.com/content/object/eid/1-s2.0-S0378778823001275-si197.svg?httpAccept=%2A%2F%2A",
            "@multimediatype": "Scalable Vector Graphics file",
            "@type": "ALTIMG",
            "@size": "4570",
            "@ref": "si197",
            "@mimetype": "image/svg+xml"
        },
        {
            "@category": "thumbnail",
            "@_fa": "true",
            "$": "https://api.elsevier.com/content/object/eid/1-s2.0-S0378778823001275-si198.svg?httpAccept=%2A%2F%2A",
            "@multimediatype": "Scalable Vector Graphics file",
            "@type": "ALTIMG",
            "@size": "2338",
            "@ref": "si198",
            "@mimetype": "image/svg+xml"
        },
        {
            "@category": "thumbnail",
            "@_fa": "true",
            "$": "https://api.elsevier.com/content/object/eid/1-s2.0-S0378778823001275-si199.svg?httpAccept=%2A%2F%2A",
            "@multimediatype": "Scalable Vector Graphics file",
            "@type": "ALTIMG",
            "@size": "1542",
            "@ref": "si199",
            "@mimetype": "image/svg+xml"
        },
        {
            "@category": "thumbnail",
            "@_fa": "true",
            "$": "https://api.elsevier.com/content/object/eid/1-s2.0-S0378778823001275-si2.svg?httpAccept=%2A%2F%2A",
            "@multimediatype": "Scalable Vector Graphics file",
            "@type": "ALTIMG",
            "@size": "2336",
            "@ref": "si2",
            "@mimetype": "image/svg+xml"
        },
        {
            "@category": "thumbnail",
            "@_fa": "true",
            "$": "https://api.elsevier.com/content/object/eid/1-s2.0-S0378778823001275-si20.svg?httpAccept=%2A%2F%2A",
            "@multimediatype": "Scalable Vector Graphics file",
            "@type": "ALTIMG",
            "@size": "1265",
            "@ref": "si20",
            "@mimetype": "image/svg+xml"
        },
        {
            "@category": "thumbnail",
            "@_fa": "true",
            "$": "https://api.elsevier.com/content/object/eid/1-s2.0-S0378778823001275-si200.svg?httpAccept=%2A%2F%2A",
            "@multimediatype": "Scalable Vector Graphics file",
            "@type": "ALTIMG",
            "@size": "3946",
            "@ref": "si200",
            "@mimetype": "image/svg+xml"
        },
        {
            "@category": "thumbnail",
            "@_fa": "true",
            "$": "https://api.elsevier.com/content/object/eid/1-s2.0-S0378778823001275-si201.svg?httpAccept=%2A%2F%2A",
            "@multimediatype": "Scalable Vector Graphics file",
            "@type": "ALTIMG",
            "@size": "4277",
            "@ref": "si201",
            "@mimetype": "image/svg+xml"
        },
        {
            "@category": "thumbnail",
            "@_fa": "true",
            "$": "https://api.elsevier.com/content/object/eid/1-s2.0-S0378778823001275-si202.svg?httpAccept=%2A%2F%2A",
            "@multimediatype": "Scalable Vector Graphics file",
            "@type": "ALTIMG",
            "@size": "1543",
            "@ref": "si202",
            "@mimetype": "image/svg+xml"
        },
        {
            "@category": "thumbnail",
            "@_fa": "true",
            "$": "https://api.elsevier.com/content/object/eid/1-s2.0-S0378778823001275-si203.svg?httpAccept=%2A%2F%2A",
            "@multimediatype": "Scalable Vector Graphics file",
            "@type": "ALTIMG",
            "@size": "1543",
            "@ref": "si203",
            "@mimetype": "image/svg+xml"
        },
        {
            "@category": "thumbnail",
            "@_fa": "true",
            "$": "https://api.elsevier.com/content/object/eid/1-s2.0-S0378778823001275-si204.svg?httpAccept=%2A%2F%2A",
            "@multimediatype": "Scalable Vector Graphics file",
            "@type": "ALTIMG",
            "@size": "1543",
            "@ref": "si204",
            "@mimetype": "image/svg+xml"
        },
        {
            "@category": "thumbnail",
            "@_fa": "true",
            "$": "https://api.elsevier.com/content/object/eid/1-s2.0-S0378778823001275-si205.svg?httpAccept=%2A%2F%2A",
            "@multimediatype": "Scalable Vector Graphics file",
            "@type": "ALTIMG",
            "@size": "3947",
            "@ref": "si205",
            "@mimetype": "image/svg+xml"
        },
        {
            "@category": "thumbnail",
            "@_fa": "true",
            "$": "https://api.elsevier.com/content/object/eid/1-s2.0-S0378778823001275-si206.svg?httpAccept=%2A%2F%2A",
            "@multimediatype": "Scalable Vector Graphics file",
            "@type": "ALTIMG",
            "@size": "5600",
            "@ref": "si206",
            "@mimetype": "image/svg+xml"
        },
        {
            "@category": "thumbnail",
            "@_fa": "true",
            "$": "https://api.elsevier.com/content/object/eid/1-s2.0-S0378778823001275-si207.svg?httpAccept=%2A%2F%2A",
            "@multimediatype": "Scalable Vector Graphics file",
            "@type": "ALTIMG",
            "@size": "5465",
            "@ref": "si207",
            "@mimetype": "image/svg+xml"
        },
        {
            "@category": "thumbnail",
            "@_fa": "true",
            "$": "https://api.elsevier.com/content/object/eid/1-s2.0-S0378778823001275-si208.svg?httpAccept=%2A%2F%2A",
            "@multimediatype": "Scalable Vector Graphics file",
            "@type": "ALTIMG",
            "@size": "4277",
            "@ref": "si208",
            "@mimetype": "image/svg+xml"
        },
        {
            "@category": "thumbnail",
            "@_fa": "true",
            "$": "https://api.elsevier.com/content/object/eid/1-s2.0-S0378778823001275-si209.svg?httpAccept=%2A%2F%2A",
            "@multimediatype": "Scalable Vector Graphics file",
            "@type": "ALTIMG",
            "@size": "3947",
            "@ref": "si209",
            "@mimetype": "image/svg+xml"
        },
        {
            "@category": "thumbnail",
            "@_fa": "true",
            "$": "https://api.elsevier.com/content/object/eid/1-s2.0-S0378778823001275-si21.svg?httpAccept=%2A%2F%2A",
            "@multimediatype": "Scalable Vector Graphics file",
            "@type": "ALTIMG",
            "@size": "1630",
            "@ref": "si21",
            "@mimetype": "image/svg+xml"
        },
        {
            "@category": "thumbnail",
            "@_fa": "true",
            "$": "https://api.elsevier.com/content/object/eid/1-s2.0-S0378778823001275-si210.svg?httpAccept=%2A%2F%2A",
            "@multimediatype": "Scalable Vector Graphics file",
            "@type": "ALTIMG",
            "@size": "4277",
            "@ref": "si210",
            "@mimetype": "image/svg+xml"
        },
        {
            "@category": "thumbnail",
            "@_fa": "true",
            "$": "https://api.elsevier.com/content/object/eid/1-s2.0-S0378778823001275-si211.svg?httpAccept=%2A%2F%2A",
            "@multimediatype": "Scalable Vector Graphics file",
            "@type": "ALTIMG",
            "@size": "4910",
            "@ref": "si211",
            "@mimetype": "image/svg+xml"
        },
        {
            "@category": "thumbnail",
            "@_fa": "true",
            "$": "https://api.elsevier.com/content/object/eid/1-s2.0-S0378778823001275-si212.svg?httpAccept=%2A%2F%2A",
            "@multimediatype": "Scalable Vector Graphics file",
            "@type": "ALTIMG",
            "@size": "6042",
            "@ref": "si212",
            "@mimetype": "image/svg+xml"
        },
        {
            "@category": "thumbnail",
            "@_fa": "true",
            "$": "https://api.elsevier.com/content/object/eid/1-s2.0-S0378778823001275-si213.svg?httpAccept=%2A%2F%2A",
            "@multimediatype": "Scalable Vector Graphics file",
            "@type": "ALTIMG",
            "@size": "1543",
            "@ref": "si213",
            "@mimetype": "image/svg+xml"
        },
        {
            "@category": "thumbnail",
            "@_fa": "true",
            "$": "https://api.elsevier.com/content/object/eid/1-s2.0-S0378778823001275-si214.svg?httpAccept=%2A%2F%2A",
            "@multimediatype": "Scalable Vector Graphics file",
            "@type": "ALTIMG",
            "@size": "3947",
            "@ref": "si214",
            "@mimetype": "image/svg+xml"
        },
        {
            "@category": "thumbnail",
            "@_fa": "true",
            "$": "https://api.elsevier.com/content/object/eid/1-s2.0-S0378778823001275-si215.svg?httpAccept=%2A%2F%2A",
            "@multimediatype": "Scalable Vector Graphics file",
            "@type": "ALTIMG",
            "@size": "1543",
            "@ref": "si215",
            "@mimetype": "image/svg+xml"
        },
        {
            "@category": "thumbnail",
            "@_fa": "true",
            "$": "https://api.elsevier.com/content/object/eid/1-s2.0-S0378778823001275-si216.svg?httpAccept=%2A%2F%2A",
            "@multimediatype": "Scalable Vector Graphics file",
            "@type": "ALTIMG",
            "@size": "3134",
            "@ref": "si216",
            "@mimetype": "image/svg+xml"
        },
        {
            "@category": "thumbnail",
            "@_fa": "true",
            "$": "https://api.elsevier.com/content/object/eid/1-s2.0-S0378778823001275-si217.svg?httpAccept=%2A%2F%2A",
            "@multimediatype": "Scalable Vector Graphics file",
            "@type": "ALTIMG",
            "@size": "1543",
            "@ref": "si217",
            "@mimetype": "image/svg+xml"
        },
        {
            "@category": "thumbnail",
            "@_fa": "true",
            "$": "https://api.elsevier.com/content/object/eid/1-s2.0-S0378778823001275-si218.svg?httpAccept=%2A%2F%2A",
            "@multimediatype": "Scalable Vector Graphics file",
            "@type": "ALTIMG",
            "@size": "850",
            "@ref": "si218",
            "@mimetype": "image/svg+xml"
        },
        {
            "@category": "thumbnail",
            "@_fa": "true",
            "$": "https://api.elsevier.com/content/object/eid/1-s2.0-S0378778823001275-si219.svg?httpAccept=%2A%2F%2A",
            "@multimediatype": "Scalable Vector Graphics file",
            "@type": "ALTIMG",
            "@size": "2081",
            "@ref": "si219",
            "@mimetype": "image/svg+xml"
        },
        {
            "@category": "thumbnail",
            "@_fa": "true",
            "$": "https://api.elsevier.com/content/object/eid/1-s2.0-S0378778823001275-si22.svg?httpAccept=%2A%2F%2A",
            "@multimediatype": "Scalable Vector Graphics file",
            "@type": "ALTIMG",
            "@size": "1013",
            "@ref": "si22",
            "@mimetype": "image/svg+xml"
        },
        {
            "@category": "thumbnail",
            "@_fa": "true",
            "$": "https://api.elsevier.com/content/object/eid/1-s2.0-S0378778823001275-si220.svg?httpAccept=%2A%2F%2A",
            "@multimediatype": "Scalable Vector Graphics file",
            "@type": "ALTIMG",
            "@size": "850",
            "@ref": "si220",
            "@mimetype": "image/svg+xml"
        },
        {
            "@category": "thumbnail",
            "@_fa": "true",
            "$": "https://api.elsevier.com/content/object/eid/1-s2.0-S0378778823001275-si221.svg?httpAccept=%2A%2F%2A",
            "@multimediatype": "Scalable Vector Graphics file",
            "@type": "ALTIMG",
            "@size": "7725",
            "@ref": "si221",
            "@mimetype": "image/svg+xml"
        },
        {
            "@category": "thumbnail",
            "@_fa": "true",
            "$": "https://api.elsevier.com/content/object/eid/1-s2.0-S0378778823001275-si222.svg?httpAccept=%2A%2F%2A",
            "@multimediatype": "Scalable Vector Graphics file",
            "@type": "ALTIMG",
            "@size": "1543",
            "@ref": "si222",
            "@mimetype": "image/svg+xml"
        },
        {
            "@category": "thumbnail",
            "@_fa": "true",
            "$": "https://api.elsevier.com/content/object/eid/1-s2.0-S0378778823001275-si223.svg?httpAccept=%2A%2F%2A",
            "@multimediatype": "Scalable Vector Graphics file",
            "@type": "ALTIMG",
            "@size": "850",
            "@ref": "si223",
            "@mimetype": "image/svg+xml"
        },
        {
            "@category": "thumbnail",
            "@_fa": "true",
            "$": "https://api.elsevier.com/content/object/eid/1-s2.0-S0378778823001275-si224.svg?httpAccept=%2A%2F%2A",
            "@multimediatype": "Scalable Vector Graphics file",
            "@type": "ALTIMG",
            "@size": "12335",
            "@ref": "si224",
            "@mimetype": "image/svg+xml"
        },
        {
            "@category": "thumbnail",
            "@_fa": "true",
            "$": "https://api.elsevier.com/content/object/eid/1-s2.0-S0378778823001275-si225.svg?httpAccept=%2A%2F%2A",
            "@multimediatype": "Scalable Vector Graphics file",
            "@type": "ALTIMG",
            "@size": "4910",
            "@ref": "si225",
            "@mimetype": "image/svg+xml"
        },
        {
            "@category": "thumbnail",
            "@_fa": "true",
            "$": "https://api.elsevier.com/content/object/eid/1-s2.0-S0378778823001275-si226.svg?httpAccept=%2A%2F%2A",
            "@multimediatype": "Scalable Vector Graphics file",
            "@type": "ALTIMG",
            "@size": "2469",
            "@ref": "si226",
            "@mimetype": "image/svg+xml"
        },
        {
            "@category": "thumbnail",
            "@_fa": "true",
            "$": "https://api.elsevier.com/content/object/eid/1-s2.0-S0378778823001275-si227.svg?httpAccept=%2A%2F%2A",
            "@multimediatype": "Scalable Vector Graphics file",
            "@type": "ALTIMG",
            "@size": "6042",
            "@ref": "si227",
            "@mimetype": "image/svg+xml"
        },
        {
            "@category": "thumbnail",
            "@_fa": "true",
            "$": "https://api.elsevier.com/content/object/eid/1-s2.0-S0378778823001275-si228.svg?httpAccept=%2A%2F%2A",
            "@multimediatype": "Scalable Vector Graphics file",
            "@type": "ALTIMG",
            "@size": "3691",
            "@ref": "si228",
            "@mimetype": "image/svg+xml"
        },
        {
            "@category": "thumbnail",
            "@_fa": "true",
            "$": "https://api.elsevier.com/content/object/eid/1-s2.0-S0378778823001275-si229.svg?httpAccept=%2A%2F%2A",
            "@multimediatype": "Scalable Vector Graphics file",
            "@type": "ALTIMG",
            "@size": "4367",
            "@ref": "si229",
            "@mimetype": "image/svg+xml"
        },
        {
            "@category": "thumbnail",
            "@_fa": "true",
            "$": "https://api.elsevier.com/content/object/eid/1-s2.0-S0378778823001275-si23.svg?httpAccept=%2A%2F%2A",
            "@multimediatype": "Scalable Vector Graphics file",
            "@type": "ALTIMG",
            "@size": "1750",
            "@ref": "si23",
            "@mimetype": "image/svg+xml"
        },
        {
            "@category": "thumbnail",
            "@_fa": "true",
            "$": "https://api.elsevier.com/content/object/eid/1-s2.0-S0378778823001275-si230.svg?httpAccept=%2A%2F%2A",
            "@multimediatype": "Scalable Vector Graphics file",
            "@type": "ALTIMG",
            "@size": "15013",
            "@ref": "si230",
            "@mimetype": "image/svg+xml"
        },
        {
            "@category": "thumbnail",
            "@_fa": "true",
            "$": "https://api.elsevier.com/content/object/eid/1-s2.0-S0378778823001275-si231.svg?httpAccept=%2A%2F%2A",
            "@multimediatype": "Scalable Vector Graphics file",
            "@type": "ALTIMG",
            "@size": "6042",
            "@ref": "si231",
            "@mimetype": "image/svg+xml"
        },
        {
            "@category": "thumbnail",
            "@_fa": "true",
            "$": "https://api.elsevier.com/content/object/eid/1-s2.0-S0378778823001275-si232.svg?httpAccept=%2A%2F%2A",
            "@multimediatype": "Scalable Vector Graphics file",
            "@type": "ALTIMG",
            "@size": "2737",
            "@ref": "si232",
            "@mimetype": "image/svg+xml"
        },
        {
            "@category": "thumbnail",
            "@_fa": "true",
            "$": "https://api.elsevier.com/content/object/eid/1-s2.0-S0378778823001275-si233.svg?httpAccept=%2A%2F%2A",
            "@multimediatype": "Scalable Vector Graphics file",
            "@type": "ALTIMG",
            "@size": "6042",
            "@ref": "si233",
            "@mimetype": "image/svg+xml"
        },
        {
            "@category": "thumbnail",
            "@_fa": "true",
            "$": "https://api.elsevier.com/content/object/eid/1-s2.0-S0378778823001275-si234.svg?httpAccept=%2A%2F%2A",
            "@multimediatype": "Scalable Vector Graphics file",
            "@type": "ALTIMG",
            "@size": "3691",
            "@ref": "si234",
            "@mimetype": "image/svg+xml"
        },
        {
            "@category": "thumbnail",
            "@_fa": "true",
            "$": "https://api.elsevier.com/content/object/eid/1-s2.0-S0378778823001275-si235.svg?httpAccept=%2A%2F%2A",
            "@multimediatype": "Scalable Vector Graphics file",
            "@type": "ALTIMG",
            "@size": "4367",
            "@ref": "si235",
            "@mimetype": "image/svg+xml"
        },
        {
            "@category": "thumbnail",
            "@_fa": "true",
            "$": "https://api.elsevier.com/content/object/eid/1-s2.0-S0378778823001275-si236.svg?httpAccept=%2A%2F%2A",
            "@multimediatype": "Scalable Vector Graphics file",
            "@type": "ALTIMG",
            "@size": "1417",
            "@ref": "si236",
            "@mimetype": "image/svg+xml"
        },
        {
            "@category": "thumbnail",
            "@_fa": "true",
            "$": "https://api.elsevier.com/content/object/eid/1-s2.0-S0378778823001275-si237.svg?httpAccept=%2A%2F%2A",
            "@multimediatype": "Scalable Vector Graphics file",
            "@type": "ALTIMG",
            "@size": "2070",
            "@ref": "si237",
            "@mimetype": "image/svg+xml"
        },
        {
            "@category": "thumbnail",
            "@_fa": "true",
            "$": "https://api.elsevier.com/content/object/eid/1-s2.0-S0378778823001275-si238.svg?httpAccept=%2A%2F%2A",
            "@multimediatype": "Scalable Vector Graphics file",
            "@type": "ALTIMG",
            "@size": "2469",
            "@ref": "si238",
            "@mimetype": "image/svg+xml"
        },
        {
            "@category": "thumbnail",
            "@_fa": "true",
            "$": "https://api.elsevier.com/content/object/eid/1-s2.0-S0378778823001275-si239.svg?httpAccept=%2A%2F%2A",
            "@multimediatype": "Scalable Vector Graphics file",
            "@type": "ALTIMG",
            "@size": "2469",
            "@ref": "si239",
            "@mimetype": "image/svg+xml"
        },
        {
            "@category": "thumbnail",
            "@_fa": "true",
            "$": "https://api.elsevier.com/content/object/eid/1-s2.0-S0378778823001275-si24.svg?httpAccept=%2A%2F%2A",
            "@multimediatype": "Scalable Vector Graphics file",
            "@type": "ALTIMG",
            "@size": "5523",
            "@ref": "si24",
            "@mimetype": "image/svg+xml"
        },
        {
            "@category": "thumbnail",
            "@_fa": "true",
            "$": "https://api.elsevier.com/content/object/eid/1-s2.0-S0378778823001275-si25.svg?httpAccept=%2A%2F%2A",
            "@multimediatype": "Scalable Vector Graphics file",
            "@type": "ALTIMG",
            "@size": "1630",
            "@ref": "si25",
            "@mimetype": "image/svg+xml"
        },
        {
            "@category": "thumbnail",
            "@_fa": "true",
            "$": "https://api.elsevier.com/content/object/eid/1-s2.0-S0378778823001275-si26.svg?httpAccept=%2A%2F%2A",
            "@multimediatype": "Scalable Vector Graphics file",
            "@type": "ALTIMG",
            "@size": "1750",
            "@ref": "si26",
            "@mimetype": "image/svg+xml"
        },
        {
            "@category": "thumbnail",
            "@_fa": "true",
            "$": "https://api.elsevier.com/content/object/eid/1-s2.0-S0378778823001275-si27.svg?httpAccept=%2A%2F%2A",
            "@multimediatype": "Scalable Vector Graphics file",
            "@type": "ALTIMG",
            "@size": "1750",
            "@ref": "si27",
            "@mimetype": "image/svg+xml"
        },
        {
            "@category": "thumbnail",
            "@_fa": "true",
            "$": "https://api.elsevier.com/content/object/eid/1-s2.0-S0378778823001275-si28.svg?httpAccept=%2A%2F%2A",
            "@multimediatype": "Scalable Vector Graphics file",
            "@type": "ALTIMG",
            "@size": "5442",
            "@ref": "si28",
            "@mimetype": "image/svg+xml"
        },
        {
            "@category": "thumbnail",
            "@_fa": "true",
            "$": "https://api.elsevier.com/content/object/eid/1-s2.0-S0378778823001275-si29.svg?httpAccept=%2A%2F%2A",
            "@multimediatype": "Scalable Vector Graphics file",
            "@type": "ALTIMG",
            "@size": "1671",
            "@ref": "si29",
            "@mimetype": "image/svg+xml"
        },
        {
            "@category": "thumbnail",
            "@_fa": "true",
            "$": "https://api.elsevier.com/content/object/eid/1-s2.0-S0378778823001275-si3.svg?httpAccept=%2A%2F%2A",
            "@multimediatype": "Scalable Vector Graphics file",
            "@type": "ALTIMG",
            "@size": "2735",
            "@ref": "si3",
            "@mimetype": "image/svg+xml"
        },
        {
            "@category": "thumbnail",
            "@_fa": "true",
            "$": "https://api.elsevier.com/content/object/eid/1-s2.0-S0378778823001275-si30.svg?httpAccept=%2A%2F%2A",
            "@multimediatype": "Scalable Vector Graphics file",
            "@type": "ALTIMG",
            "@size": "1750",
            "@ref": "si30",
            "@mimetype": "image/svg+xml"
        },
        {
            "@category": "thumbnail",
            "@_fa": "true",
            "$": "https://api.elsevier.com/content/object/eid/1-s2.0-S0378778823001275-si31.svg?httpAccept=%2A%2F%2A",
            "@multimediatype": "Scalable Vector Graphics file",
            "@type": "ALTIMG",
            "@size": "1202",
            "@ref": "si31",
            "@mimetype": "image/svg+xml"
        },
        {
            "@category": "thumbnail",
            "@_fa": "true",
            "$": "https://api.elsevier.com/content/object/eid/1-s2.0-S0378778823001275-si32.svg?httpAccept=%2A%2F%2A",
            "@multimediatype": "Scalable Vector Graphics file",
            "@type": "ALTIMG",
            "@size": "2528",
            "@ref": "si32",
            "@mimetype": "image/svg+xml"
        },
        {
            "@category": "thumbnail",
            "@_fa": "true",
            "$": "https://api.elsevier.com/content/object/eid/1-s2.0-S0378778823001275-si33.svg?httpAccept=%2A%2F%2A",
            "@multimediatype": "Scalable Vector Graphics file",
            "@type": "ALTIMG",
            "@size": "1514",
            "@ref": "si33",
            "@mimetype": "image/svg+xml"
        },
        {
            "@category": "thumbnail",
            "@_fa": "true",
            "$": "https://api.elsevier.com/content/object/eid/1-s2.0-S0378778823001275-si34.svg?httpAccept=%2A%2F%2A",
            "@multimediatype": "Scalable Vector Graphics file",
            "@type": "ALTIMG",
            "@size": "4955",
            "@ref": "si34",
            "@mimetype": "image/svg+xml"
        },
        {
            "@category": "thumbnail",
            "@_fa": "true",
            "$": "https://api.elsevier.com/content/object/eid/1-s2.0-S0378778823001275-si35.svg?httpAccept=%2A%2F%2A",
            "@multimediatype": "Scalable Vector Graphics file",
            "@type": "ALTIMG",
            "@size": "2060",
            "@ref": "si35",
            "@mimetype": "image/svg+xml"
        },
        {
            "@category": "thumbnail",
            "@_fa": "true",
            "$": "https://api.elsevier.com/content/object/eid/1-s2.0-S0378778823001275-si36.svg?httpAccept=%2A%2F%2A",
            "@multimediatype": "Scalable Vector Graphics file",
            "@type": "ALTIMG",
            "@size": "3288",
            "@ref": "si36",
            "@mimetype": "image/svg+xml"
        },
        {
            "@category": "thumbnail",
            "@_fa": "true",
            "$": "https://api.elsevier.com/content/object/eid/1-s2.0-S0378778823001275-si37.svg?httpAccept=%2A%2F%2A",
            "@multimediatype": "Scalable Vector Graphics file",
            "@type": "ALTIMG",
            "@size": "1512",
            "@ref": "si37",
            "@mimetype": "image/svg+xml"
        },
        {
            "@category": "thumbnail",
            "@_fa": "true",
            "$": "https://api.elsevier.com/content/object/eid/1-s2.0-S0378778823001275-si38.svg?httpAccept=%2A%2F%2A",
            "@multimediatype": "Scalable Vector Graphics file",
            "@type": "ALTIMG",
            "@size": "3043",
            "@ref": "si38",
            "@mimetype": "image/svg+xml"
        },
        {
            "@category": "thumbnail",
            "@_fa": "true",
            "$": "https://api.elsevier.com/content/object/eid/1-s2.0-S0378778823001275-si39.svg?httpAccept=%2A%2F%2A",
            "@multimediatype": "Scalable Vector Graphics file",
            "@type": "ALTIMG",
            "@size": "1671",
            "@ref": "si39",
            "@mimetype": "image/svg+xml"
        },
        {
            "@category": "thumbnail",
            "@_fa": "true",
            "$": "https://api.elsevier.com/content/object/eid/1-s2.0-S0378778823001275-si4.svg?httpAccept=%2A%2F%2A",
            "@multimediatype": "Scalable Vector Graphics file",
            "@type": "ALTIMG",
            "@size": "6040",
            "@ref": "si4",
            "@mimetype": "image/svg+xml"
        },
        {
            "@category": "thumbnail",
            "@_fa": "true",
            "$": "https://api.elsevier.com/content/object/eid/1-s2.0-S0378778823001275-si40.svg?httpAccept=%2A%2F%2A",
            "@multimediatype": "Scalable Vector Graphics file",
            "@type": "ALTIMG",
            "@size": "1542",
            "@ref": "si40",
            "@mimetype": "image/svg+xml"
        },
        {
            "@category": "thumbnail",
            "@_fa": "true",
            "$": "https://api.elsevier.com/content/object/eid/1-s2.0-S0378778823001275-si41.svg?httpAccept=%2A%2F%2A",
            "@multimediatype": "Scalable Vector Graphics file",
            "@type": "ALTIMG",
            "@size": "1538",
            "@ref": "si41",
            "@mimetype": "image/svg+xml"
        },
        {
            "@category": "thumbnail",
            "@_fa": "true",
            "$": "https://api.elsevier.com/content/object/eid/1-s2.0-S0378778823001275-si42.svg?httpAccept=%2A%2F%2A",
            "@multimediatype": "Scalable Vector Graphics file",
            "@type": "ALTIMG",
            "@size": "1750",
            "@ref": "si42",
            "@mimetype": "image/svg+xml"
        },
        {
            "@category": "thumbnail",
            "@_fa": "true",
            "$": "https://api.elsevier.com/content/object/eid/1-s2.0-S0378778823001275-si43.svg?httpAccept=%2A%2F%2A",
            "@multimediatype": "Scalable Vector Graphics file",
            "@type": "ALTIMG",
            "@size": "2080",
            "@ref": "si43",
            "@mimetype": "image/svg+xml"
        },
        {
            "@category": "thumbnail",
            "@_fa": "true",
            "$": "https://api.elsevier.com/content/object/eid/1-s2.0-S0378778823001275-si44.svg?httpAccept=%2A%2F%2A",
            "@multimediatype": "Scalable Vector Graphics file",
            "@type": "ALTIMG",
            "@size": "1630",
            "@ref": "si44",
            "@mimetype": "image/svg+xml"
        },
        {
            "@category": "thumbnail",
            "@_fa": "true",
            "$": "https://api.elsevier.com/content/object/eid/1-s2.0-S0378778823001275-si45.svg?httpAccept=%2A%2F%2A",
            "@multimediatype": "Scalable Vector Graphics file",
            "@type": "ALTIMG",
            "@size": "1758",
            "@ref": "si45",
            "@mimetype": "image/svg+xml"
        },
        {
            "@category": "thumbnail",
            "@_fa": "true",
            "$": "https://api.elsevier.com/content/object/eid/1-s2.0-S0378778823001275-si46.svg?httpAccept=%2A%2F%2A",
            "@multimediatype": "Scalable Vector Graphics file",
            "@type": "ALTIMG",
            "@size": "2679",
            "@ref": "si46",
            "@mimetype": "image/svg+xml"
        },
        {
            "@category": "thumbnail",
            "@_fa": "true",
            "$": "https://api.elsevier.com/content/object/eid/1-s2.0-S0378778823001275-si47.svg?httpAccept=%2A%2F%2A",
            "@multimediatype": "Scalable Vector Graphics file",
            "@type": "ALTIMG",
            "@size": "1758",
            "@ref": "si47",
            "@mimetype": "image/svg+xml"
        },
        {
            "@category": "thumbnail",
            "@_fa": "true",
            "$": "https://api.elsevier.com/content/object/eid/1-s2.0-S0378778823001275-si48.svg?httpAccept=%2A%2F%2A",
            "@multimediatype": "Scalable Vector Graphics file",
            "@type": "ALTIMG",
            "@size": "1277",
            "@ref": "si48",
            "@mimetype": "image/svg+xml"
        },
        {
            "@category": "thumbnail",
            "@_fa": "true",
            "$": "https://api.elsevier.com/content/object/eid/1-s2.0-S0378778823001275-si49.svg?httpAccept=%2A%2F%2A",
            "@multimediatype": "Scalable Vector Graphics file",
            "@type": "ALTIMG",
            "@size": "2338",
            "@ref": "si49",
            "@mimetype": "image/svg+xml"
        },
        {
            "@category": "thumbnail",
            "@_fa": "true",
            "$": "https://api.elsevier.com/content/object/eid/1-s2.0-S0378778823001275-si5.svg?httpAccept=%2A%2F%2A",
            "@multimediatype": "Scalable Vector Graphics file",
            "@type": "ALTIMG",
            "@size": "2735",
            "@ref": "si5",
            "@mimetype": "image/svg+xml"
        },
        {
            "@category": "thumbnail",
            "@_fa": "true",
            "$": "https://api.elsevier.com/content/object/eid/1-s2.0-S0378778823001275-si50.svg?httpAccept=%2A%2F%2A",
            "@multimediatype": "Scalable Vector Graphics file",
            "@type": "ALTIMG",
            "@size": "2736",
            "@ref": "si50",
            "@mimetype": "image/svg+xml"
        },
        {
            "@category": "thumbnail",
            "@_fa": "true",
            "$": "https://api.elsevier.com/content/object/eid/1-s2.0-S0378778823001275-si51.svg?httpAccept=%2A%2F%2A",
            "@multimediatype": "Scalable Vector Graphics file",
            "@type": "ALTIMG",
            "@size": "1538",
            "@ref": "si51",
            "@mimetype": "image/svg+xml"
        },
        {
            "@category": "thumbnail",
            "@_fa": "true",
            "$": "https://api.elsevier.com/content/object/eid/1-s2.0-S0378778823001275-si52.svg?httpAccept=%2A%2F%2A",
            "@multimediatype": "Scalable Vector Graphics file",
            "@type": "ALTIMG",
            "@size": "1538",
            "@ref": "si52",
            "@mimetype": "image/svg+xml"
        },
        {
            "@category": "thumbnail",
            "@_fa": "true",
            "$": "https://api.elsevier.com/content/object/eid/1-s2.0-S0378778823001275-si53.svg?httpAccept=%2A%2F%2A",
            "@multimediatype": "Scalable Vector Graphics file",
            "@type": "ALTIMG",
            "@size": "12109",
            "@ref": "si53",
            "@mimetype": "image/svg+xml"
        },
        {
            "@category": "thumbnail",
            "@_fa": "true",
            "$": "https://api.elsevier.com/content/object/eid/1-s2.0-S0378778823001275-si54.svg?httpAccept=%2A%2F%2A",
            "@multimediatype": "Scalable Vector Graphics file",
            "@type": "ALTIMG",
            "@size": "8614",
            "@ref": "si54",
            "@mimetype": "image/svg+xml"
        },
        {
            "@category": "thumbnail",
            "@_fa": "true",
            "$": "https://api.elsevier.com/content/object/eid/1-s2.0-S0378778823001275-si55.svg?httpAccept=%2A%2F%2A",
            "@multimediatype": "Scalable Vector Graphics file",
            "@type": "ALTIMG",
            "@size": "10229",
            "@ref": "si55",
            "@mimetype": "image/svg+xml"
        },
        {
            "@category": "thumbnail",
            "@_fa": "true",
            "$": "https://api.elsevier.com/content/object/eid/1-s2.0-S0378778823001275-si56.svg?httpAccept=%2A%2F%2A",
            "@multimediatype": "Scalable Vector Graphics file",
            "@type": "ALTIMG",
            "@size": "8238",
            "@ref": "si56",
            "@mimetype": "image/svg+xml"
        },
        {
            "@category": "thumbnail",
            "@_fa": "true",
            "$": "https://api.elsevier.com/content/object/eid/1-s2.0-S0378778823001275-si57.svg?httpAccept=%2A%2F%2A",
            "@multimediatype": "Scalable Vector Graphics file",
            "@type": "ALTIMG",
            "@size": "1202",
            "@ref": "si57",
            "@mimetype": "image/svg+xml"
        },
        {
            "@category": "thumbnail",
            "@_fa": "true",
            "$": "https://api.elsevier.com/content/object/eid/1-s2.0-S0378778823001275-si58.svg?httpAccept=%2A%2F%2A",
            "@multimediatype": "Scalable Vector Graphics file",
            "@type": "ALTIMG",
            "@size": "2060",
            "@ref": "si58",
            "@mimetype": "image/svg+xml"
        },
        {
            "@category": "thumbnail",
            "@_fa": "true",
            "$": "https://api.elsevier.com/content/object/eid/1-s2.0-S0378778823001275-si59.svg?httpAccept=%2A%2F%2A",
            "@multimediatype": "Scalable Vector Graphics file",
            "@type": "ALTIMG",
            "@size": "1514",
            "@ref": "si59",
            "@mimetype": "image/svg+xml"
        },
        {
            "@category": "thumbnail",
            "@_fa": "true",
            "$": "https://api.elsevier.com/content/object/eid/1-s2.0-S0378778823001275-si6.svg?httpAccept=%2A%2F%2A",
            "@multimediatype": "Scalable Vector Graphics file",
            "@type": "ALTIMG",
            "@size": "2337",
            "@ref": "si6",
            "@mimetype": "image/svg+xml"
        },
        {
            "@category": "thumbnail",
            "@_fa": "true",
            "$": "https://api.elsevier.com/content/object/eid/1-s2.0-S0378778823001275-si60.svg?httpAccept=%2A%2F%2A",
            "@multimediatype": "Scalable Vector Graphics file",
            "@type": "ALTIMG",
            "@size": "2060",
            "@ref": "si60",
            "@mimetype": "image/svg+xml"
        },
        {
            "@category": "thumbnail",
            "@_fa": "true",
            "$": "https://api.elsevier.com/content/object/eid/1-s2.0-S0378778823001275-si61.svg?httpAccept=%2A%2F%2A",
            "@multimediatype": "Scalable Vector Graphics file",
            "@type": "ALTIMG",
            "@size": "1202",
            "@ref": "si61",
            "@mimetype": "image/svg+xml"
        },
        {
            "@category": "thumbnail",
            "@_fa": "true",
            "$": "https://api.elsevier.com/content/object/eid/1-s2.0-S0378778823001275-si62.svg?httpAccept=%2A%2F%2A",
            "@multimediatype": "Scalable Vector Graphics file",
            "@type": "ALTIMG",
            "@size": "2060",
            "@ref": "si62",
            "@mimetype": "image/svg+xml"
        },
        {
            "@category": "thumbnail",
            "@_fa": "true",
            "$": "https://api.elsevier.com/content/object/eid/1-s2.0-S0378778823001275-si63.svg?httpAccept=%2A%2F%2A",
            "@multimediatype": "Scalable Vector Graphics file",
            "@type": "ALTIMG",
            "@size": "1538",
            "@ref": "si63",
            "@mimetype": "image/svg+xml"
        },
        {
            "@category": "thumbnail",
            "@_fa": "true",
            "$": "https://api.elsevier.com/content/object/eid/1-s2.0-S0378778823001275-si64.svg?httpAccept=%2A%2F%2A",
            "@multimediatype": "Scalable Vector Graphics file",
            "@type": "ALTIMG",
            "@size": "1202",
            "@ref": "si64",
            "@mimetype": "image/svg+xml"
        },
        {
            "@category": "thumbnail",
            "@_fa": "true",
            "$": "https://api.elsevier.com/content/object/eid/1-s2.0-S0378778823001275-si65.svg?httpAccept=%2A%2F%2A",
            "@multimediatype": "Scalable Vector Graphics file",
            "@type": "ALTIMG",
            "@size": "2060",
            "@ref": "si65",
            "@mimetype": "image/svg+xml"
        },
        {
            "@category": "thumbnail",
            "@_fa": "true",
            "$": "https://api.elsevier.com/content/object/eid/1-s2.0-S0378778823001275-si66.svg?httpAccept=%2A%2F%2A",
            "@multimediatype": "Scalable Vector Graphics file",
            "@type": "ALTIMG",
            "@size": "1514",
            "@ref": "si66",
            "@mimetype": "image/svg+xml"
        },
        {
            "@category": "thumbnail",
            "@_fa": "true",
            "$": "https://api.elsevier.com/content/object/eid/1-s2.0-S0378778823001275-si67.svg?httpAccept=%2A%2F%2A",
            "@multimediatype": "Scalable Vector Graphics file",
            "@type": "ALTIMG",
            "@size": "1514",
            "@ref": "si67",
            "@mimetype": "image/svg+xml"
        },
        {
            "@category": "thumbnail",
            "@_fa": "true",
            "$": "https://api.elsevier.com/content/object/eid/1-s2.0-S0378778823001275-si68.svg?httpAccept=%2A%2F%2A",
            "@multimediatype": "Scalable Vector Graphics file",
            "@type": "ALTIMG",
            "@size": "20496",
            "@ref": "si68",
            "@mimetype": "image/svg+xml"
        },
        {
            "@category": "thumbnail",
            "@_fa": "true",
            "$": "https://api.elsevier.com/content/object/eid/1-s2.0-S0378778823001275-si69.svg?httpAccept=%2A%2F%2A",
            "@multimediatype": "Scalable Vector Graphics file",
            "@type": "ALTIMG",
            "@size": "2896",
            "@ref": "si69",
            "@mimetype": "image/svg+xml"
        },
        {
            "@category": "thumbnail",
            "@_fa": "true",
            "$": "https://api.elsevier.com/content/object/eid/1-s2.0-S0378778823001275-si7.svg?httpAccept=%2A%2F%2A",
            "@multimediatype": "Scalable Vector Graphics file",
            "@type": "ALTIMG",
            "@size": "1541",
            "@ref": "si7",
            "@mimetype": "image/svg+xml"
        },
        {
            "@category": "thumbnail",
            "@_fa": "true",
            "$": "https://api.elsevier.com/content/object/eid/1-s2.0-S0378778823001275-si70.svg?httpAccept=%2A%2F%2A",
            "@multimediatype": "Scalable Vector Graphics file",
            "@type": "ALTIMG",
            "@size": "1457",
            "@ref": "si70",
            "@mimetype": "image/svg+xml"
        },
        {
            "@category": "thumbnail",
            "@_fa": "true",
            "$": "https://api.elsevier.com/content/object/eid/1-s2.0-S0378778823001275-si71.svg?httpAccept=%2A%2F%2A",
            "@multimediatype": "Scalable Vector Graphics file",
            "@type": "ALTIMG",
            "@size": "5254",
            "@ref": "si71",
            "@mimetype": "image/svg+xml"
        },
        {
            "@category": "thumbnail",
            "@_fa": "true",
            "$": "https://api.elsevier.com/content/object/eid/1-s2.0-S0378778823001275-si72.svg?httpAccept=%2A%2F%2A",
            "@multimediatype": "Scalable Vector Graphics file",
            "@type": "ALTIMG",
            "@size": "6184",
            "@ref": "si72",
            "@mimetype": "image/svg+xml"
        },
        {
            "@category": "thumbnail",
            "@_fa": "true",
            "$": "https://api.elsevier.com/content/object/eid/1-s2.0-S0378778823001275-si73.svg?httpAccept=%2A%2F%2A",
            "@multimediatype": "Scalable Vector Graphics file",
            "@type": "ALTIMG",
            "@size": "4953",
            "@ref": "si73",
            "@mimetype": "image/svg+xml"
        },
        {
            "@category": "thumbnail",
            "@_fa": "true",
            "$": "https://api.elsevier.com/content/object/eid/1-s2.0-S0378778823001275-si74.svg?httpAccept=%2A%2F%2A",
            "@multimediatype": "Scalable Vector Graphics file",
            "@type": "ALTIMG",
            "@size": "3291",
            "@ref": "si74",
            "@mimetype": "image/svg+xml"
        },
        {
            "@category": "thumbnail",
            "@_fa": "true",
            "$": "https://api.elsevier.com/content/object/eid/1-s2.0-S0378778823001275-si75.svg?httpAccept=%2A%2F%2A",
            "@multimediatype": "Scalable Vector Graphics file",
            "@type": "ALTIMG",
            "@size": "1202",
            "@ref": "si75",
            "@mimetype": "image/svg+xml"
        },
        {
            "@category": "thumbnail",
            "@_fa": "true",
            "$": "https://api.elsevier.com/content/object/eid/1-s2.0-S0378778823001275-si76.svg?httpAccept=%2A%2F%2A",
            "@multimediatype": "Scalable Vector Graphics file",
            "@type": "ALTIMG",
            "@size": "2060",
            "@ref": "si76",
            "@mimetype": "image/svg+xml"
        },
        {
            "@category": "thumbnail",
            "@_fa": "true",
            "$": "https://api.elsevier.com/content/object/eid/1-s2.0-S0378778823001275-si77.svg?httpAccept=%2A%2F%2A",
            "@multimediatype": "Scalable Vector Graphics file",
            "@type": "ALTIMG",
            "@size": "3715",
            "@ref": "si77",
            "@mimetype": "image/svg+xml"
        },
        {
            "@category": "thumbnail",
            "@_fa": "true",
            "$": "https://api.elsevier.com/content/object/eid/1-s2.0-S0378778823001275-si78.svg?httpAccept=%2A%2F%2A",
            "@multimediatype": "Scalable Vector Graphics file",
            "@type": "ALTIMG",
            "@size": "1514",
            "@ref": "si78",
            "@mimetype": "image/svg+xml"
        },
        {
            "@category": "thumbnail",
            "@_fa": "true",
            "$": "https://api.elsevier.com/content/object/eid/1-s2.0-S0378778823001275-si79.svg?httpAccept=%2A%2F%2A",
            "@multimediatype": "Scalable Vector Graphics file",
            "@type": "ALTIMG",
            "@size": "1514",
            "@ref": "si79",
            "@mimetype": "image/svg+xml"
        },
        {
            "@category": "thumbnail",
            "@_fa": "true",
            "$": "https://api.elsevier.com/content/object/eid/1-s2.0-S0378778823001275-si8.svg?httpAccept=%2A%2F%2A",
            "@multimediatype": "Scalable Vector Graphics file",
            "@type": "ALTIMG",
            "@size": "3945",
            "@ref": "si8",
            "@mimetype": "image/svg+xml"
        },
        {
            "@category": "thumbnail",
            "@_fa": "true",
            "$": "https://api.elsevier.com/content/object/eid/1-s2.0-S0378778823001275-si80.svg?httpAccept=%2A%2F%2A",
            "@multimediatype": "Scalable Vector Graphics file",
            "@type": "ALTIMG",
            "@size": "1514",
            "@ref": "si80",
            "@mimetype": "image/svg+xml"
        },
        {
            "@category": "thumbnail",
            "@_fa": "true",
            "$": "https://api.elsevier.com/content/object/eid/1-s2.0-S0378778823001275-si81.svg?httpAccept=%2A%2F%2A",
            "@multimediatype": "Scalable Vector Graphics file",
            "@type": "ALTIMG",
            "@size": "1542",
            "@ref": "si81",
            "@mimetype": "image/svg+xml"
        },
        {
            "@category": "thumbnail",
            "@_fa": "true",
            "$": "https://api.elsevier.com/content/object/eid/1-s2.0-S0378778823001275-si82.svg?httpAccept=%2A%2F%2A",
            "@multimediatype": "Scalable Vector Graphics file",
            "@type": "ALTIMG",
            "@size": "1542",
            "@ref": "si82",
            "@mimetype": "image/svg+xml"
        },
        {
            "@category": "thumbnail",
            "@_fa": "true",
            "$": "https://api.elsevier.com/content/object/eid/1-s2.0-S0378778823001275-si83.svg?httpAccept=%2A%2F%2A",
            "@multimediatype": "Scalable Vector Graphics file",
            "@type": "ALTIMG",
            "@size": "1542",
            "@ref": "si83",
            "@mimetype": "image/svg+xml"
        },
        {
            "@category": "thumbnail",
            "@_fa": "true",
            "$": "https://api.elsevier.com/content/object/eid/1-s2.0-S0378778823001275-si84.svg?httpAccept=%2A%2F%2A",
            "@multimediatype": "Scalable Vector Graphics file",
            "@type": "ALTIMG",
            "@size": "10024",
            "@ref": "si84",
            "@mimetype": "image/svg+xml"
        },
        {
            "@category": "thumbnail",
            "@_fa": "true",
            "$": "https://api.elsevier.com/content/object/eid/1-s2.0-S0378778823001275-si85.svg?httpAccept=%2A%2F%2A",
            "@multimediatype": "Scalable Vector Graphics file",
            "@type": "ALTIMG",
            "@size": "5157",
            "@ref": "si85",
            "@mimetype": "image/svg+xml"
        },
        {
            "@category": "thumbnail",
            "@_fa": "true",
            "$": "https://api.elsevier.com/content/object/eid/1-s2.0-S0378778823001275-si86.svg?httpAccept=%2A%2F%2A",
            "@multimediatype": "Scalable Vector Graphics file",
            "@type": "ALTIMG",
            "@size": "6724",
            "@ref": "si86",
            "@mimetype": "image/svg+xml"
        },
        {
            "@category": "thumbnail",
            "@_fa": "true",
            "$": "https://api.elsevier.com/content/object/eid/1-s2.0-S0378778823001275-si87.svg?httpAccept=%2A%2F%2A",
            "@multimediatype": "Scalable Vector Graphics file",
            "@type": "ALTIMG",
            "@size": "6724",
            "@ref": "si87",
            "@mimetype": "image/svg+xml"
        },
        {
            "@category": "thumbnail",
            "@_fa": "true",
            "$": "https://api.elsevier.com/content/object/eid/1-s2.0-S0378778823001275-si88.svg?httpAccept=%2A%2F%2A",
            "@multimediatype": "Scalable Vector Graphics file",
            "@type": "ALTIMG",
            "@size": "1514",
            "@ref": "si88",
            "@mimetype": "image/svg+xml"
        },
        {
            "@category": "thumbnail",
            "@_fa": "true",
            "$": "https://api.elsevier.com/content/object/eid/1-s2.0-S0378778823001275-si89.svg?httpAccept=%2A%2F%2A",
            "@multimediatype": "Scalable Vector Graphics file",
            "@type": "ALTIMG",
            "@size": "3449",
            "@ref": "si89",
            "@mimetype": "image/svg+xml"
        },
        {
            "@category": "thumbnail",
            "@_fa": "true",
            "$": "https://api.elsevier.com/content/object/eid/1-s2.0-S0378778823001275-si9.svg?httpAccept=%2A%2F%2A",
            "@multimediatype": "Scalable Vector Graphics file",
            "@type": "ALTIMG",
            "@size": "2337",
            "@ref": "si9",
            "@mimetype": "image/svg+xml"
        },
        {
            "@category": "thumbnail",
            "@_fa": "true",
            "$": "https://api.elsevier.com/content/object/eid/1-s2.0-S0378778823001275-si90.svg?httpAccept=%2A%2F%2A",
            "@multimediatype": "Scalable Vector Graphics file",
            "@type": "ALTIMG",
            "@size": "3449",
            "@ref": "si90",
            "@mimetype": "image/svg+xml"
        },
        {
            "@category": "thumbnail",
            "@_fa": "true",
            "$": "https://api.elsevier.com/content/object/eid/1-s2.0-S0378778823001275-si91.svg?httpAccept=%2A%2F%2A",
            "@multimediatype": "Scalable Vector Graphics file",
            "@type": "ALTIMG",
            "@size": "16711",
            "@ref": "si91",
            "@mimetype": "image/svg+xml"
        },
        {
            "@category": "thumbnail",
            "@_fa": "true",
            "$": "https://api.elsevier.com/content/object/eid/1-s2.0-S0378778823001275-si92.svg?httpAccept=%2A%2F%2A",
            "@multimediatype": "Scalable Vector Graphics file",
            "@type": "ALTIMG",
            "@size": "25058",
            "@ref": "si92",
            "@mimetype": "image/svg+xml"
        },
        {
            "@category": "thumbnail",
            "@_fa": "true",
            "$": "https://api.elsevier.com/content/object/eid/1-s2.0-S0378778823001275-si93.svg?httpAccept=%2A%2F%2A",
            "@multimediatype": "Scalable Vector Graphics file",
            "@type": "ALTIMG",
            "@size": "21860",
            "@ref": "si93",
            "@mimetype": "image/svg+xml"
        },
        {
            "@category": "thumbnail",
            "@_fa": "true",
            "$": "https://api.elsevier.com/content/object/eid/1-s2.0-S0378778823001275-si94.svg?httpAccept=%2A%2F%2A",
            "@multimediatype": "Scalable Vector Graphics file",
            "@type": "ALTIMG",
            "@size": "3043",
            "@ref": "si94",
            "@mimetype": "image/svg+xml"
        },
        {
            "@category": "thumbnail",
            "@_fa": "true",
            "$": "https://api.elsevier.com/content/object/eid/1-s2.0-S0378778823001275-si95.svg?httpAccept=%2A%2F%2A",
            "@multimediatype": "Scalable Vector Graphics file",
            "@type": "ALTIMG",
            "@size": "4955",
            "@ref": "si95",
            "@mimetype": "image/svg+xml"
        },
        {
            "@category": "thumbnail",
            "@_fa": "true",
            "$": "https://api.elsevier.com/content/object/eid/1-s2.0-S0378778823001275-si96.svg?httpAccept=%2A%2F%2A",
            "@multimediatype": "Scalable Vector Graphics file",
            "@type": "ALTIMG",
            "@size": "1512",
            "@ref": "si96",
            "@mimetype": "image/svg+xml"
        },
        {
            "@category": "thumbnail",
            "@_fa": "true",
            "$": "https://api.elsevier.com/content/object/eid/1-s2.0-S0378778823001275-si97.svg?httpAccept=%2A%2F%2A",
            "@multimediatype": "Scalable Vector Graphics file",
            "@type": "ALTIMG",
            "@size": "7130",
            "@ref": "si97",
            "@mimetype": "image/svg+xml"
        },
        {
            "@category": "thumbnail",
            "@_fa": "true",
            "$": "https://api.elsevier.com/content/object/eid/1-s2.0-S0378778823001275-si98.svg?httpAccept=%2A%2F%2A",
            "@multimediatype": "Scalable Vector Graphics file",
            "@type": "ALTIMG",
            "@size": "3043",
            "@ref": "si98",
            "@mimetype": "image/svg+xml"
        },
        {
            "@category": "thumbnail",
            "@_fa": "true",
            "$": "https://api.elsevier.com/content/object/eid/1-s2.0-S0378778823001275-si99.svg?httpAccept=%2A%2F%2A",
            "@multimediatype": "Scalable Vector Graphics file",
            "@type": "ALTIMG",
            "@size": "10679",
            "@ref": "si99",
            "@mimetype": "image/svg+xml"
        },
        {
            "@category": "standard",
            "@_fa": "true",
            "$": "https://api.elsevier.com/content/object/eid/1-s2.0-S0378778823001275-am.pdf?httpAccept=%2A%2F%2A",
            "@multimediatype": "Acrobat PDF file",
            "@type": "AAM-PDF",
            "@size": "1858415",
            "@ref": "am",
            "@mimetype": "application/pdf"
        }
    ]},
    "link": {
        "@rel": "abstract",
        "@href": "https://api.elsevier.com/content/abstract/scopus_id/85148944157"
    }
}}