{"full-text-retrieval-response": {
    "scopus-eid": "2-s2.0-85140720871",
    "originalText": "serial JL 271434 291210 291731 291800 291881 31 Building and Environment BUILDINGENVIRONMENT 2022-09-29 2022-09-29 2022-10-19 2022-10-19 2023-03-20T15:02:08 1-s2.0-S036013232200868X S0360-1323(22)00868-X S036013232200868X 10.1016/j.buildenv.2022.109638 S300 S300.1 FULL-TEXT 1-s2.0-S0360132322X00164 2023-03-20T15:44:13.419663Z 0 0 20221201 20221231 2022 2022-09-29T03:52:43.171817Z articleinfo articlenumber articletitlenorm authfirstinitialnorm authfirstsurnamenorm cid cids contenttype copyright crossmark dateloaded dateloadedtxt datesearch datesort dateupdated dco docsubtype doctype doi eid ewtransactionid hubeid indexeddate issn issnnorm itemstage itemtransactionid itemweight openaccess openarchive pg pgfirst pii piinorm pubdateend pubdatestart pubdatetxt pubyr sectiontitle sortorder srctitle srctitlenorm srctype ssids alllist content subj subheadings suppl tomb volfirst volissue volumelist webpdf webpdfpagecount yearnav figure table body mmlmath acknowledge affil articletitle auth authfirstini authfull authkeywords authlast grantnumber grantsponsor highlightsabst nomenclature orcid primabst ref 0360-1323 03601323 true 226 226 C Volume 226 51 109638 109638 109638 202212 December 2022 2022-12-01 2022-12-31 2022 Research Papers article fla © 2022 Elsevier Ltd. All rights reserved. OCCUPANCYEQUIVALENTOPERATIVETEMPERATURECONTROLFORENERGYSAVINGOPERATIONDIRECTELECTRICLOWCAPACITYHEATINGSYSTEMS SCHMITT L Nomenclature 1 Introduction 2 Analysis model 2.1 Heating fabric model 2.2 Convective heat exchange 2.3 Radiative heat exchange 2.4 Mean radiant temperature model 2.5 Experimental model validation 2.5.1 Heating fabric validation 2.5.2 Room model validation 3 Control method 3.1 Control loop 3.2 Model based control algorithm 4 Results 4.1 Sensitivity analysis 5 Discussion 6 Conclusions and outlook CRediT authorship contribution statement Acknowledgments References AST 1989 H ENERGETISCHEBEURTEILUNGVONWARMWASSERHEIZANLAGENDURCHRECHNERISCHEBETRIEBSSIMULATION KNORR 2010 M ZURFUNKTIONELLENENERGETISCHENUNDWARMEPHYSIOLOGISCHENBEWERTUNGDERINTERMITTIERENDENBETRIEBSWEISEVONHEIZUNGSANLAGEN ERICKSON 2009 V PROCEEDINGSFIRSTACMWORKSHOPEMBEDDEDSENSINGSYSTEMSFORENERGYEFFICIENCYINBUILDINGSBUILDSYS09 ENERGYEFFICIENTBUILDINGENVIRONMENTCONTROLSTRATEGIESUSINGREALTIMEOCCUPANCYMEASUREMENTS HEIDER 2020 J POTENZIALVONINFRAROTHEIZSYSTEMENFURHOCHEFFIZIENTEWOHNGEBAUDE BOMANN 2015 130 139 T ESRAFILIANNAJAFABADI 2021 107810 M IYENGAR 2019 1 29 S PENG 2017 145 160 Y SCOTT 2011 J PROCEEDINGS13THINTERNATIONALCONFERENCEUBIQUITOUSCOMPUTINGUBICOMP11 PREHEATCONTROLLINGHOMEHEATINGUSINGOCCUPANCYPREDICTION BALAJI 2013 B PROCEEDINGS11THACMCONFERENCEEMBEDDEDNETWORKEDSENSORSYSTEMSSENSYS13 SENTINEL KLEIMINGER 2015 W OCCUPANCYSENSINGPREDICTIONFORAUTOMATEDENERGYSAVINGS KLEIMINGER 2014 493 505 W WORNER 2013 D PROCEEDINGS5THACMWORKSHOPEMBEDDEDSYSTEMSFORENERGYEFFICIENTBUILDINGS OCCUPANCYBASEDHEATINGCONTROLFORRESIDENTIALBUILDINGSUSINGENVIRONMENTALSENSORS SCHAUB 2020 22 25 M HLHVOL4 VERGLEICHDESNUTZUNGSGRADSVONREAKTIONSSCHNELLENDIREKTELEKTRISCHENWARMEUBERGABEFORMENMITKONVENTIONELLENRAUMHEIZSYSTEMEN SIMONE 2007 A OPERATIVETEMPERATURECONTROLRADIANTSURFACEHEATINGCOOLINGSYSTEMS REVEL 2012 035005 G WETTER 2013 253 270 M DMUELLER 2016 3 9 L BAUSIM2016 AIXLIBOPENSOURCEMODELICALIBRARYWITHINIEAEBCANNEX60FRAMEWORK KHALIFA 2001 491 504 A CHURCHILL 1975 1323 1329 S ALAMDARI 1983 106 112 F MODEST 2013 M RADIATIVEHEATTRANSFER DECARVALHO 2007 A BUILDINGSIMULATION2007 NUMERICALMETHODFORCALCULATINGVIEWFACTORBETWEENTWOSURFACES 1998 ISO7726ERGONOMICSTHERMALENVIRONMENTINSTRUMENTSFORMEASURINGPHYSICALQUANTITIES ZHANG 2003 H HUMANTHERMALSENSATIONCOMFORTINTRANSIENTNONUNIFORMTHERMALENVIRONMENTS WETTERDIENST 2017 D ORTSGENAUETESTREFERENZJAHRETRYVONDEUTSCHLANDFURMITTLEREUNDEXTREMEWITTERUNGSVERHALTNISSE HAMELS 2021 2165 S SCHMITTX2022X109638 SCHMITTX2022X109638XL 2024-10-19T00:00:00.000Z 2024-10-19T00:00:00.000Z http://creativecommons.org/licenses/by-nc-nd/4.0/ © 2022 Elsevier Ltd. All rights reserved. 2022-11-02T08:15:22.834Z http://vtw.elsevier.com/data/voc/AddOnTypes/50.7/aggregated-refined https://doi.org/10.15223/policy-017 https://doi.org/10.15223/policy-037 https://doi.org/10.15223/policy-012 https://doi.org/10.15223/policy-029 https://doi.org/10.15223/policy-004 item S0360-1323(22)00868-X S036013232200868X 1-s2.0-S036013232200868X 10.1016/j.buildenv.2022.109638 271434 2023-03-20T15:44:13.419663Z 2022-12-01 2022-12-31 1-s2.0-S036013232200868X-main.pdf https://s3-eu-west-1.amazonaws.com/prod-ucs-content-store-eu-west/content/pii:S036013232200868X/MAIN/application/pdf/eb9ae60bc2ece030c605eb3a69296c72/main.pdf main.pdf pdf true 2552168 MAIN 11 1-s2.0-S036013232200868X-main_1.png https://s3-eu-west-1.amazonaws.com/prod-ucs-content-store-eu-west/content/pii:S036013232200868X/PREVIEW/image/png/a44146a033c665f5b107600f03d8532f/main_1.png main_1.png png 60440 849 656 IMAGE-WEB-PDF 1 1-s2.0-S036013232200868X-gr10.jpg https://s3-eu-west-1.amazonaws.com/prod-ucs-content-store-eu-west/content/pii:S036013232200868X/gr10/DOWNSAMPLED/image/jpeg/b395ed30249b7f5894f22b2d79b20fd0/gr10.jpg gr10 gr10.jpg jpg 26792 255 569 IMAGE-DOWNSAMPLED 1-s2.0-S036013232200868X-gr14.jpg https://s3-eu-west-1.amazonaws.com/prod-ucs-content-store-eu-west/content/pii:S036013232200868X/gr14/DOWNSAMPLED/image/jpeg/5ec30b364dfc6e906c31151f7389be46/gr14.jpg gr14 gr14.jpg jpg 84437 525 373 IMAGE-DOWNSAMPLED 1-s2.0-S036013232200868X-gr13.jpg https://s3-eu-west-1.amazonaws.com/prod-ucs-content-store-eu-west/content/pii:S036013232200868X/gr13/DOWNSAMPLED/image/jpeg/39462daab9819f4462d101032ff62e35/gr13.jpg gr13 gr13.jpg jpg 98911 514 783 IMAGE-DOWNSAMPLED 1-s2.0-S036013232200868X-gr12.jpg https://s3-eu-west-1.amazonaws.com/prod-ucs-content-store-eu-west/content/pii:S036013232200868X/gr12/DOWNSAMPLED/image/jpeg/b3e4c558ddf3aaaa85c088100a67eedb/gr12.jpg gr12 gr12.jpg jpg 33585 381 378 IMAGE-DOWNSAMPLED 1-s2.0-S036013232200868X-gr11.jpg https://s3-eu-west-1.amazonaws.com/prod-ucs-content-store-eu-west/content/pii:S036013232200868X/gr11/DOWNSAMPLED/image/jpeg/ea3abbe2177e9f14dc91712069ae7a7f/gr11.jpg gr11 gr11.jpg jpg 28450 278 386 IMAGE-DOWNSAMPLED 1-s2.0-S036013232200868X-gr9.jpg https://s3-eu-west-1.amazonaws.com/prod-ucs-content-store-eu-west/content/pii:S036013232200868X/gr9/DOWNSAMPLED/image/jpeg/413ffeca00afd1b1564a40540aa47409/gr9.jpg gr9 gr9.jpg jpg 58643 484 369 IMAGE-DOWNSAMPLED 1-s2.0-S036013232200868X-gr8.jpg https://s3-eu-west-1.amazonaws.com/prod-ucs-content-store-eu-west/content/pii:S036013232200868X/gr8/DOWNSAMPLED/image/jpeg/95e56e8a36e035718a3a0e82026b6f35/gr8.jpg gr8 gr8.jpg jpg 34295 218 375 IMAGE-DOWNSAMPLED 1-s2.0-S036013232200868X-gr7.jpg https://s3-eu-west-1.amazonaws.com/prod-ucs-content-store-eu-west/content/pii:S036013232200868X/gr7/DOWNSAMPLED/image/jpeg/279a560b3d508a321387bb36bbf04ab3/gr7.jpg gr7 gr7.jpg jpg 42114 287 369 IMAGE-DOWNSAMPLED 1-s2.0-S036013232200868X-gr6.jpg https://s3-eu-west-1.amazonaws.com/prod-ucs-content-store-eu-west/content/pii:S036013232200868X/gr6/DOWNSAMPLED/image/jpeg/e0935cce14988787a1ab1fcd86f0e1e1/gr6.jpg gr6 gr6.jpg jpg 23744 294 388 IMAGE-DOWNSAMPLED 1-s2.0-S036013232200868X-gr5.jpg https://s3-eu-west-1.amazonaws.com/prod-ucs-content-store-eu-west/content/pii:S036013232200868X/gr5/DOWNSAMPLED/image/jpeg/5a96d888663a3c0ece0ce2d0c5693e2c/gr5.jpg gr5 gr5.jpg jpg 50074 337 612 IMAGE-DOWNSAMPLED 1-s2.0-S036013232200868X-gr4.jpg https://s3-eu-west-1.amazonaws.com/prod-ucs-content-store-eu-west/content/pii:S036013232200868X/gr4/DOWNSAMPLED/image/jpeg/a813002f6a6c666ab1f0f094c6846d23/gr4.jpg gr4 gr4.jpg jpg 72631 617 701 IMAGE-DOWNSAMPLED 1-s2.0-S036013232200868X-gr3.jpg https://s3-eu-west-1.amazonaws.com/prod-ucs-content-store-eu-west/content/pii:S036013232200868X/gr3/DOWNSAMPLED/image/jpeg/c3c928f133982ae1909fa4731b91f43a/gr3.jpg gr3 gr3.jpg jpg 30706 273 571 IMAGE-DOWNSAMPLED 1-s2.0-S036013232200868X-gr2.jpg https://s3-eu-west-1.amazonaws.com/prod-ucs-content-store-eu-west/content/pii:S036013232200868X/gr2/DOWNSAMPLED/image/jpeg/a976bf26556e3606b89923dc12d93af7/gr2.jpg gr2 gr2.jpg jpg 103979 235 327 IMAGE-DOWNSAMPLED 1-s2.0-S036013232200868X-gr1.jpg https://s3-eu-west-1.amazonaws.com/prod-ucs-content-store-eu-west/content/pii:S036013232200868X/gr1/DOWNSAMPLED/image/jpeg/d827b5ecd27f7548a65ab02975417fe5/gr1.jpg gr1 gr1.jpg jpg 36372 272 294 IMAGE-DOWNSAMPLED 1-s2.0-S036013232200868X-gr10.sml https://s3-eu-west-1.amazonaws.com/prod-ucs-content-store-eu-west/content/pii:S036013232200868X/gr10/THUMBNAIL/image/gif/c162e60d65f4beff358d42ce934c8f75/gr10.sml gr10 gr10.sml sml 11092 98 219 IMAGE-THUMBNAIL 1-s2.0-S036013232200868X-gr14.sml https://s3-eu-west-1.amazonaws.com/prod-ucs-content-store-eu-west/content/pii:S036013232200868X/gr14/THUMBNAIL/image/gif/ce78f77462ce6f75e4f66986f1e4eff2/gr14.sml gr14 gr14.sml sml 22193 163 116 IMAGE-THUMBNAIL 1-s2.0-S036013232200868X-gr13.sml https://s3-eu-west-1.amazonaws.com/prod-ucs-content-store-eu-west/content/pii:S036013232200868X/gr13/THUMBNAIL/image/gif/f3e9994ea81c3ebac9f2df1d64bda0c6/gr13.sml gr13 gr13.sml sml 17369 144 219 IMAGE-THUMBNAIL 1-s2.0-S036013232200868X-gr12.sml https://s3-eu-west-1.amazonaws.com/prod-ucs-content-store-eu-west/content/pii:S036013232200868X/gr12/THUMBNAIL/image/gif/cc58b0d6654197613aa645ed7350c3cd/gr12.sml gr12 gr12.sml sml 13853 164 163 IMAGE-THUMBNAIL 1-s2.0-S036013232200868X-gr11.sml https://s3-eu-west-1.amazonaws.com/prod-ucs-content-store-eu-west/content/pii:S036013232200868X/gr11/THUMBNAIL/image/gif/7790400a946475f35922637050c3a784/gr11.sml gr11 gr11.sml sml 12477 158 219 IMAGE-THUMBNAIL 1-s2.0-S036013232200868X-gr9.sml https://s3-eu-west-1.amazonaws.com/prod-ucs-content-store-eu-west/content/pii:S036013232200868X/gr9/THUMBNAIL/image/gif/2e804ad568cc1b3a985ce5fc6217098f/gr9.sml gr9 gr9.sml sml 16109 164 125 IMAGE-THUMBNAIL 1-s2.0-S036013232200868X-gr8.sml https://s3-eu-west-1.amazonaws.com/prod-ucs-content-store-eu-west/content/pii:S036013232200868X/gr8/THUMBNAIL/image/gif/b723ac4c20d3cfc4287dea6fac37b2c0/gr8.sml gr8 gr8.sml sml 19022 127 219 IMAGE-THUMBNAIL 1-s2.0-S036013232200868X-gr7.sml https://s3-eu-west-1.amazonaws.com/prod-ucs-content-store-eu-west/content/pii:S036013232200868X/gr7/THUMBNAIL/image/gif/144d0c538a500a16b0377f72c004242c/gr7.sml gr7 gr7.sml sml 17184 164 211 IMAGE-THUMBNAIL 1-s2.0-S036013232200868X-gr6.sml https://s3-eu-west-1.amazonaws.com/prod-ucs-content-store-eu-west/content/pii:S036013232200868X/gr6/THUMBNAIL/image/gif/668d647f312980cbe8456a178e9ede25/gr6.sml gr6 gr6.sml sml 11908 164 217 IMAGE-THUMBNAIL 1-s2.0-S036013232200868X-gr5.sml https://s3-eu-west-1.amazonaws.com/prod-ucs-content-store-eu-west/content/pii:S036013232200868X/gr5/THUMBNAIL/image/gif/eff3c8b686c6d45c1870f44e1b56d63c/gr5.sml gr5 gr5.sml sml 11991 120 219 IMAGE-THUMBNAIL 1-s2.0-S036013232200868X-gr4.sml https://s3-eu-west-1.amazonaws.com/prod-ucs-content-store-eu-west/content/pii:S036013232200868X/gr4/THUMBNAIL/image/gif/3ab603453c8111c9c572810b88e0c178/gr4.sml gr4 gr4.sml sml 15952 164 186 IMAGE-THUMBNAIL 1-s2.0-S036013232200868X-gr3.sml https://s3-eu-west-1.amazonaws.com/prod-ucs-content-store-eu-west/content/pii:S036013232200868X/gr3/THUMBNAIL/image/gif/ef991ffad34402e9b1aba5b64ae477d0/gr3.sml gr3 gr3.sml sml 11403 105 219 IMAGE-THUMBNAIL 1-s2.0-S036013232200868X-gr2.sml https://s3-eu-west-1.amazonaws.com/prod-ucs-content-store-eu-west/content/pii:S036013232200868X/gr2/THUMBNAIL/image/gif/64f69f821bace0f26544555de9be29c2/gr2.sml gr2 gr2.sml sml 98116 157 219 IMAGE-THUMBNAIL 1-s2.0-S036013232200868X-gr1.sml https://s3-eu-west-1.amazonaws.com/prod-ucs-content-store-eu-west/content/pii:S036013232200868X/gr1/THUMBNAIL/image/gif/1a402cfd1bb3a468af9585439959d833/gr1.sml gr1 gr1.sml sml 17222 164 177 IMAGE-THUMBNAIL 1-s2.0-S036013232200868X-gr10_lrg.jpg https://s3-eu-west-1.amazonaws.com/prod-ucs-content-store-eu-west/content/pii:S036013232200868X/HIGHRES/image/jpeg/f82af09585e52647d35e756c9fd48c63/gr10_lrg.jpg gr10 gr10_lrg.jpg jpg 132733 1130 2521 IMAGE-HIGH-RES 1-s2.0-S036013232200868X-gr14_lrg.jpg https://s3-eu-west-1.amazonaws.com/prod-ucs-content-store-eu-west/content/pii:S036013232200868X/HIGHRES/image/jpeg/d22039e6756a4b0a3b9835dc16c18091/gr14_lrg.jpg gr14 gr14_lrg.jpg jpg 658772 2324 1652 IMAGE-HIGH-RES 1-s2.0-S036013232200868X-gr13_lrg.jpg https://s3-eu-west-1.amazonaws.com/prod-ucs-content-store-eu-west/content/pii:S036013232200868X/HIGHRES/image/jpeg/7237cd8ddd6e5204767579cc4228f4a1/gr13_lrg.jpg gr13 gr13_lrg.jpg jpg 699447 2277 3469 IMAGE-HIGH-RES 1-s2.0-S036013232200868X-gr12_lrg.jpg https://s3-eu-west-1.amazonaws.com/prod-ucs-content-store-eu-west/content/pii:S036013232200868X/HIGHRES/image/jpeg/216c15b014c6ee6fe14078fe5423f37f/gr12_lrg.jpg gr12 gr12_lrg.jpg jpg 163183 1686 1674 IMAGE-HIGH-RES 1-s2.0-S036013232200868X-gr11_lrg.jpg https://s3-eu-west-1.amazonaws.com/prod-ucs-content-store-eu-west/content/pii:S036013232200868X/HIGHRES/image/jpeg/ebc6b5b2396d6276f6e9b8cb60eb45c3/gr11_lrg.jpg gr11 gr11_lrg.jpg jpg 119011 1232 1711 IMAGE-HIGH-RES 1-s2.0-S036013232200868X-gr9_lrg.jpg https://s3-eu-west-1.amazonaws.com/prod-ucs-content-store-eu-west/content/pii:S036013232200868X/HIGHRES/image/jpeg/21414d5249c2c69ec65b284872d0adb5/gr9_lrg.jpg gr9 gr9_lrg.jpg jpg 378764 2142 1634 IMAGE-HIGH-RES 1-s2.0-S036013232200868X-gr8_lrg.jpg https://s3-eu-west-1.amazonaws.com/prod-ucs-content-store-eu-west/content/pii:S036013232200868X/HIGHRES/image/jpeg/be1ca979b8e2d429b8805d829a9539b3/gr8_lrg.jpg gr8 gr8_lrg.jpg jpg 189659 964 1661 IMAGE-HIGH-RES 1-s2.0-S036013232200868X-gr7_lrg.jpg https://s3-eu-west-1.amazonaws.com/prod-ucs-content-store-eu-west/content/pii:S036013232200868X/HIGHRES/image/jpeg/45207ff89b110f7de40a61a79c97f842/gr7_lrg.jpg gr7 gr7_lrg.jpg jpg 231367 1270 1634 IMAGE-HIGH-RES 1-s2.0-S036013232200868X-gr6_lrg.jpg https://s3-eu-west-1.amazonaws.com/prod-ucs-content-store-eu-west/content/pii:S036013232200868X/HIGHRES/image/jpeg/afaa1303e4d7d7c6fea25163167c2c85/gr6_lrg.jpg gr6 gr6_lrg.jpg jpg 108172 1299 1717 IMAGE-HIGH-RES 1-s2.0-S036013232200868X-gr5_lrg.jpg https://s3-eu-west-1.amazonaws.com/prod-ucs-content-store-eu-west/content/pii:S036013232200868X/HIGHRES/image/jpeg/53ba9ec4243b0cf8125d8288597ead85/gr5_lrg.jpg gr5 gr5_lrg.jpg jpg 310045 1490 2709 IMAGE-HIGH-RES 1-s2.0-S036013232200868X-gr4_lrg.jpg https://s3-eu-west-1.amazonaws.com/prod-ucs-content-store-eu-west/content/pii:S036013232200868X/HIGHRES/image/jpeg/17f1d6994e41c16422c8046e10853e53/gr4_lrg.jpg gr4 gr4_lrg.jpg jpg 449332 2732 3106 IMAGE-HIGH-RES 1-s2.0-S036013232200868X-gr3_lrg.jpg https://s3-eu-west-1.amazonaws.com/prod-ucs-content-store-eu-west/content/pii:S036013232200868X/HIGHRES/image/jpeg/3843260560112121dbb26d174bf84bac/gr3_lrg.jpg gr3 gr3_lrg.jpg jpg 156322 1209 2528 IMAGE-HIGH-RES 1-s2.0-S036013232200868X-gr2_lrg.jpg https://s3-eu-west-1.amazonaws.com/prod-ucs-content-store-eu-west/content/pii:S036013232200868X/HIGHRES/image/jpeg/32728c49906e2421c4abbdbad0dd70c6/gr2_lrg.jpg gr2 gr2_lrg.jpg jpg 597989 1039 1448 IMAGE-HIGH-RES 1-s2.0-S036013232200868X-gr1_lrg.jpg https://s3-eu-west-1.amazonaws.com/prod-ucs-content-store-eu-west/content/pii:S036013232200868X/HIGHRES/image/jpeg/8564285ff3eb7f86be09e82370ec6f3e/gr1_lrg.jpg gr1 gr1_lrg.jpg jpg 157877 1204 1302 IMAGE-HIGH-RES 1-s2.0-S036013232200868X-si10.svg https://s3-eu-west-1.amazonaws.com/prod-ucs-content-store-eu-west/content/pii:S036013232200868X/image/svg+xml/5c275ab7a1513ca345ef95237d6c70b6/si10.svg si10 si10.svg svg 1200 ALTIMG 1-s2.0-S036013232200868X-si101.svg https://s3-eu-west-1.amazonaws.com/prod-ucs-content-store-eu-west/content/pii:S036013232200868X/image/svg+xml/0444ce0eb96531c0724e21c3d6e3e90f/si101.svg si101 si101.svg svg 6588 ALTIMG 1-s2.0-S036013232200868X-si102.svg https://s3-eu-west-1.amazonaws.com/prod-ucs-content-store-eu-west/content/pii:S036013232200868X/image/svg+xml/c619d35550e99b445179ae8544edd2a7/si102.svg si102 si102.svg svg 5402 ALTIMG 1-s2.0-S036013232200868X-si103.svg https://s3-eu-west-1.amazonaws.com/prod-ucs-content-store-eu-west/content/pii:S036013232200868X/image/svg+xml/f30d19e8fb7f56f3a0f539d00d755ab5/si103.svg si103 si103.svg svg 15150 ALTIMG 1-s2.0-S036013232200868X-si104.svg https://s3-eu-west-1.amazonaws.com/prod-ucs-content-store-eu-west/content/pii:S036013232200868X/image/svg+xml/01a2ac0714caf782bff4eaf0564691dc/si104.svg si104 si104.svg svg 4544 ALTIMG 1-s2.0-S036013232200868X-si106.svg https://s3-eu-west-1.amazonaws.com/prod-ucs-content-store-eu-west/content/pii:S036013232200868X/image/svg+xml/5acfac22d0c641fd44ac91790d2b6872/si106.svg si106 si106.svg svg 1305 ALTIMG 1-s2.0-S036013232200868X-si108.svg https://s3-eu-west-1.amazonaws.com/prod-ucs-content-store-eu-west/content/pii:S036013232200868X/image/svg+xml/25142735643ae344f4d6f6890d86aee7/si108.svg si108 si108.svg svg 15160 ALTIMG 1-s2.0-S036013232200868X-si11.svg https://s3-eu-west-1.amazonaws.com/prod-ucs-content-store-eu-west/content/pii:S036013232200868X/image/svg+xml/5602346b74e3dce9009c8664635ef1e7/si11.svg si11 si11.svg svg 1089 ALTIMG 1-s2.0-S036013232200868X-si116.svg https://s3-eu-west-1.amazonaws.com/prod-ucs-content-store-eu-west/content/pii:S036013232200868X/image/svg+xml/1eab9ccb1bedee72e6ab23b8bbc26d1f/si116.svg si116 si116.svg svg 19983 ALTIMG 1-s2.0-S036013232200868X-si117.svg https://s3-eu-west-1.amazonaws.com/prod-ucs-content-store-eu-west/content/pii:S036013232200868X/image/svg+xml/c322cc95be1100c47d8b5c83f85abc23/si117.svg si117 si117.svg svg 19629 ALTIMG 1-s2.0-S036013232200868X-si118.svg https://s3-eu-west-1.amazonaws.com/prod-ucs-content-store-eu-west/content/pii:S036013232200868X/image/svg+xml/e4c27b912a9d06a4721bbdad2ce56cda/si118.svg si118 si118.svg svg 1918 ALTIMG 1-s2.0-S036013232200868X-si119.svg https://s3-eu-west-1.amazonaws.com/prod-ucs-content-store-eu-west/content/pii:S036013232200868X/image/svg+xml/b8b1bf63c4b4344b74f16821d2dd5067/si119.svg si119 si119.svg svg 32731 ALTIMG 1-s2.0-S036013232200868X-si12.svg https://s3-eu-west-1.amazonaws.com/prod-ucs-content-store-eu-west/content/pii:S036013232200868X/image/svg+xml/7b74145362becc9a785de6bfbcb9ae59/si12.svg si12 si12.svg svg 1027 ALTIMG 1-s2.0-S036013232200868X-si120.svg https://s3-eu-west-1.amazonaws.com/prod-ucs-content-store-eu-west/content/pii:S036013232200868X/image/svg+xml/3600cf8c028cc09c06953525570696f2/si120.svg si120 si120.svg svg 2285 ALTIMG 1-s2.0-S036013232200868X-si121.svg https://s3-eu-west-1.amazonaws.com/prod-ucs-content-store-eu-west/content/pii:S036013232200868X/image/svg+xml/fbd95c06007032d14ffca8bea91832ae/si121.svg si121 si121.svg svg 2250 ALTIMG 1-s2.0-S036013232200868X-si122.svg https://s3-eu-west-1.amazonaws.com/prod-ucs-content-store-eu-west/content/pii:S036013232200868X/image/svg+xml/1b89fca5bee8942655f8515a03e083b6/si122.svg si122 si122.svg svg 3214 ALTIMG 1-s2.0-S036013232200868X-si123.svg https://s3-eu-west-1.amazonaws.com/prod-ucs-content-store-eu-west/content/pii:S036013232200868X/image/svg+xml/f675d7f3325d77aff428ae38c090f8ab/si123.svg si123 si123.svg svg 3178 ALTIMG 1-s2.0-S036013232200868X-si126.svg https://s3-eu-west-1.amazonaws.com/prod-ucs-content-store-eu-west/content/pii:S036013232200868X/image/svg+xml/c5a3771a530ac9b4aca2652c702394e5/si126.svg si126 si126.svg svg 3541 ALTIMG 1-s2.0-S036013232200868X-si127.svg https://s3-eu-west-1.amazonaws.com/prod-ucs-content-store-eu-west/content/pii:S036013232200868X/image/svg+xml/0633abb17ab7799a1c77048c493300cc/si127.svg si127 si127.svg svg 2587 ALTIMG 1-s2.0-S036013232200868X-si128.svg https://s3-eu-west-1.amazonaws.com/prod-ucs-content-store-eu-west/content/pii:S036013232200868X/image/svg+xml/b63446df5f8b0a8f11c78ffbe040d05c/si128.svg si128 si128.svg svg 2552 ALTIMG 1-s2.0-S036013232200868X-si129.svg https://s3-eu-west-1.amazonaws.com/prod-ucs-content-store-eu-west/content/pii:S036013232200868X/image/svg+xml/95319617195477f896b6159284b8aa80/si129.svg si129 si129.svg svg 14195 ALTIMG 1-s2.0-S036013232200868X-si130.svg https://s3-eu-west-1.amazonaws.com/prod-ucs-content-store-eu-west/content/pii:S036013232200868X/image/svg+xml/6920cf78937f49d966281fa1eb663bd0/si130.svg si130 si130.svg svg 2697 ALTIMG 1-s2.0-S036013232200868X-si132.svg https://s3-eu-west-1.amazonaws.com/prod-ucs-content-store-eu-west/content/pii:S036013232200868X/image/svg+xml/2fc1f1817c41e0584ca507196d571e87/si132.svg si132 si132.svg svg 3156 ALTIMG 1-s2.0-S036013232200868X-si133.svg https://s3-eu-west-1.amazonaws.com/prod-ucs-content-store-eu-west/content/pii:S036013232200868X/image/svg+xml/65eefaf9ada82ec0bc85a9a4285de38a/si133.svg si133 si133.svg svg 8416 ALTIMG 1-s2.0-S036013232200868X-si135.svg https://s3-eu-west-1.amazonaws.com/prod-ucs-content-store-eu-west/content/pii:S036013232200868X/image/svg+xml/b841fde104b52659d364bd926e3db9ac/si135.svg si135 si135.svg svg 16332 ALTIMG 1-s2.0-S036013232200868X-si136.svg https://s3-eu-west-1.amazonaws.com/prod-ucs-content-store-eu-west/content/pii:S036013232200868X/image/svg+xml/2198d5f7270f14fddefcf32b6e2848f9/si136.svg si136 si136.svg svg 15901 ALTIMG 1-s2.0-S036013232200868X-si137.svg https://s3-eu-west-1.amazonaws.com/prod-ucs-content-store-eu-west/content/pii:S036013232200868X/image/svg+xml/5c952bfe290ccb3d9252d905c54c5070/si137.svg si137 si137.svg svg 790 ALTIMG 1-s2.0-S036013232200868X-si14.svg https://s3-eu-west-1.amazonaws.com/prod-ucs-content-store-eu-west/content/pii:S036013232200868X/image/svg+xml/8d26cf3af80b17db4cb767d05733c28b/si14.svg si14 si14.svg svg 1871 ALTIMG 1-s2.0-S036013232200868X-si144.svg https://s3-eu-west-1.amazonaws.com/prod-ucs-content-store-eu-west/content/pii:S036013232200868X/image/svg+xml/776ceef5a0572c771a04c81c0bd2473c/si144.svg si144 si144.svg svg 2118 ALTIMG 1-s2.0-S036013232200868X-si147.svg https://s3-eu-west-1.amazonaws.com/prod-ucs-content-store-eu-west/content/pii:S036013232200868X/image/svg+xml/32fdb52ffc3663c238c3d1e7f48f8af9/si147.svg si147 si147.svg svg 6181 ALTIMG 1-s2.0-S036013232200868X-si148.svg https://s3-eu-west-1.amazonaws.com/prod-ucs-content-store-eu-west/content/pii:S036013232200868X/image/svg+xml/5acacfad597de92ba0bab49c157cd498/si148.svg si148 si148.svg svg 4265 ALTIMG 1-s2.0-S036013232200868X-si15.svg https://s3-eu-west-1.amazonaws.com/prod-ucs-content-store-eu-west/content/pii:S036013232200868X/image/svg+xml/6038f771c60e280598b5779a21005932/si15.svg si15 si15.svg svg 1924 ALTIMG 1-s2.0-S036013232200868X-si151.svg https://s3-eu-west-1.amazonaws.com/prod-ucs-content-store-eu-west/content/pii:S036013232200868X/image/svg+xml/8e335502a3ec2e379013163f06cf2f23/si151.svg si151 si151.svg svg 3034 ALTIMG 1-s2.0-S036013232200868X-si152.svg https://s3-eu-west-1.amazonaws.com/prod-ucs-content-store-eu-west/content/pii:S036013232200868X/image/svg+xml/4dca5b14ca8e028de753d95c3aa76fa3/si152.svg si152 si152.svg svg 4447 ALTIMG 1-s2.0-S036013232200868X-si153.svg https://s3-eu-west-1.amazonaws.com/prod-ucs-content-store-eu-west/content/pii:S036013232200868X/image/svg+xml/668fdb37be170e6231960a417cfd44a9/si153.svg si153 si153.svg svg 1743 ALTIMG 1-s2.0-S036013232200868X-si154.svg https://s3-eu-west-1.amazonaws.com/prod-ucs-content-store-eu-west/content/pii:S036013232200868X/image/svg+xml/66934344534c9b086d74c4c8c5863f08/si154.svg si154 si154.svg svg 4160 ALTIMG 1-s2.0-S036013232200868X-si156.svg https://s3-eu-west-1.amazonaws.com/prod-ucs-content-store-eu-west/content/pii:S036013232200868X/image/svg+xml/19ef6e4df0a006901c49e7ee81597205/si156.svg si156 si156.svg svg 7881 ALTIMG 1-s2.0-S036013232200868X-si157.svg https://s3-eu-west-1.amazonaws.com/prod-ucs-content-store-eu-west/content/pii:S036013232200868X/image/svg+xml/4675c0aace6eda580d19ad80ba5b1b32/si157.svg si157 si157.svg svg 5071 ALTIMG 1-s2.0-S036013232200868X-si158.svg https://s3-eu-west-1.amazonaws.com/prod-ucs-content-store-eu-west/content/pii:S036013232200868X/image/svg+xml/c67edd25f0d1216c07991a986cf470d3/si158.svg si158 si158.svg svg 4661 ALTIMG 1-s2.0-S036013232200868X-si16.svg https://s3-eu-west-1.amazonaws.com/prod-ucs-content-store-eu-west/content/pii:S036013232200868X/image/svg+xml/8443f801f621987acefe5ca0d94c8d35/si16.svg si16 si16.svg svg 2281 ALTIMG 1-s2.0-S036013232200868X-si160.svg https://s3-eu-west-1.amazonaws.com/prod-ucs-content-store-eu-west/content/pii:S036013232200868X/image/svg+xml/8246188c39e034ef08ad35bf852cd317/si160.svg si160 si160.svg svg 4221 ALTIMG 1-s2.0-S036013232200868X-si161.svg https://s3-eu-west-1.amazonaws.com/prod-ucs-content-store-eu-west/content/pii:S036013232200868X/image/svg+xml/64bb1a3676d90b88621233e348b9833d/si161.svg si161 si161.svg svg 7752 ALTIMG 1-s2.0-S036013232200868X-si162.svg https://s3-eu-west-1.amazonaws.com/prod-ucs-content-store-eu-west/content/pii:S036013232200868X/image/svg+xml/770b8615b45d181a7eaaf1e89e584ff8/si162.svg si162 si162.svg svg 4089 ALTIMG 1-s2.0-S036013232200868X-si163.svg https://s3-eu-west-1.amazonaws.com/prod-ucs-content-store-eu-west/content/pii:S036013232200868X/image/svg+xml/01e29d98b945fed985fabc45b2bd1a43/si163.svg si163 si163.svg svg 5338 ALTIMG 1-s2.0-S036013232200868X-si166.svg https://s3-eu-west-1.amazonaws.com/prod-ucs-content-store-eu-west/content/pii:S036013232200868X/image/svg+xml/09578080cfa4bd9a2677a73f6d151d52/si166.svg si166 si166.svg svg 3957 ALTIMG 1-s2.0-S036013232200868X-si167.svg https://s3-eu-west-1.amazonaws.com/prod-ucs-content-store-eu-west/content/pii:S036013232200868X/image/svg+xml/1e4cf3bde32eacf64b216cbddc6782cf/si167.svg si167 si167.svg svg 42614 ALTIMG 1-s2.0-S036013232200868X-si17.svg https://s3-eu-west-1.amazonaws.com/prod-ucs-content-store-eu-west/content/pii:S036013232200868X/image/svg+xml/09a83dc57b4e7a8ed881ce5a710a9fb0/si17.svg si17 si17.svg svg 2627 ALTIMG 1-s2.0-S036013232200868X-si170.svg https://s3-eu-west-1.amazonaws.com/prod-ucs-content-store-eu-west/content/pii:S036013232200868X/image/svg+xml/5fdd17004c207ef30bcb9cfdddea8799/si170.svg si170 si170.svg svg 6610 ALTIMG 1-s2.0-S036013232200868X-si172.svg https://s3-eu-west-1.amazonaws.com/prod-ucs-content-store-eu-west/content/pii:S036013232200868X/image/svg+xml/25d32eeb4c039f7238a5d51a3685086a/si172.svg si172 si172.svg svg 2247 ALTIMG 1-s2.0-S036013232200868X-si173.svg https://s3-eu-west-1.amazonaws.com/prod-ucs-content-store-eu-west/content/pii:S036013232200868X/image/svg+xml/d774347e49c0682ff8abd3a4836a41ff/si173.svg si173 si173.svg svg 4146 ALTIMG 1-s2.0-S036013232200868X-si174.svg https://s3-eu-west-1.amazonaws.com/prod-ucs-content-store-eu-west/content/pii:S036013232200868X/image/svg+xml/6a323dc2303ec8d553507000a3cc72a0/si174.svg si174 si174.svg svg 2363 ALTIMG 1-s2.0-S036013232200868X-si175.svg https://s3-eu-west-1.amazonaws.com/prod-ucs-content-store-eu-west/content/pii:S036013232200868X/image/svg+xml/12a2dba531126a62e3da52bd7843a29d/si175.svg si175 si175.svg svg 2643 ALTIMG 1-s2.0-S036013232200868X-si178.svg https://s3-eu-west-1.amazonaws.com/prod-ucs-content-store-eu-west/content/pii:S036013232200868X/image/svg+xml/a7c2caf065c604dc6cfd4735784d3f67/si178.svg si178 si178.svg svg 9362 ALTIMG 1-s2.0-S036013232200868X-si18.svg https://s3-eu-west-1.amazonaws.com/prod-ucs-content-store-eu-west/content/pii:S036013232200868X/image/svg+xml/925d751c2213f245f2f7167f8f3490f2/si18.svg si18 si18.svg svg 2246 ALTIMG 1-s2.0-S036013232200868X-si182.svg https://s3-eu-west-1.amazonaws.com/prod-ucs-content-store-eu-west/content/pii:S036013232200868X/image/svg+xml/a49e68d9741d51d78f8f25c6127c204d/si182.svg si182 si182.svg svg 6452 ALTIMG 1-s2.0-S036013232200868X-si185.svg https://s3-eu-west-1.amazonaws.com/prod-ucs-content-store-eu-west/content/pii:S036013232200868X/image/svg+xml/fd74f715ebbc7ae86c36a79f7695f84b/si185.svg si185 si185.svg svg 3753 ALTIMG 1-s2.0-S036013232200868X-si188.svg https://s3-eu-west-1.amazonaws.com/prod-ucs-content-store-eu-west/content/pii:S036013232200868X/image/svg+xml/4775c82c6a17c606dc99fa421c9d8dab/si188.svg si188 si188.svg svg 28962 ALTIMG 1-s2.0-S036013232200868X-si19.svg https://s3-eu-west-1.amazonaws.com/prod-ucs-content-store-eu-west/content/pii:S036013232200868X/image/svg+xml/050a73499ff293b0e010a315999c4d1c/si19.svg si19 si19.svg svg 2672 ALTIMG 1-s2.0-S036013232200868X-si191.svg https://s3-eu-west-1.amazonaws.com/prod-ucs-content-store-eu-west/content/pii:S036013232200868X/image/svg+xml/3bc4d9de0f22c44b0841be0bf85aad04/si191.svg si191 si191.svg svg 6469 ALTIMG 1-s2.0-S036013232200868X-si192.svg https://s3-eu-west-1.amazonaws.com/prod-ucs-content-store-eu-west/content/pii:S036013232200868X/image/svg+xml/cee90895aea37bd138409373654be17c/si192.svg si192 si192.svg svg 5977 ALTIMG 1-s2.0-S036013232200868X-si193.svg https://s3-eu-west-1.amazonaws.com/prod-ucs-content-store-eu-west/content/pii:S036013232200868X/image/svg+xml/bcc9c1285d694a8fec859badfc943728/si193.svg si193 si193.svg svg 6218 ALTIMG 1-s2.0-S036013232200868X-si194.svg https://s3-eu-west-1.amazonaws.com/prod-ucs-content-store-eu-west/content/pii:S036013232200868X/image/svg+xml/002fb6194830e510a0d1139235c8d1ab/si194.svg si194 si194.svg svg 2294 ALTIMG 1-s2.0-S036013232200868X-si198.svg https://s3-eu-west-1.amazonaws.com/prod-ucs-content-store-eu-west/content/pii:S036013232200868X/image/svg+xml/c6b683e860dc36c732a26fbe69216394/si198.svg si198 si198.svg svg 4949 ALTIMG 1-s2.0-S036013232200868X-si199.svg https://s3-eu-west-1.amazonaws.com/prod-ucs-content-store-eu-west/content/pii:S036013232200868X/image/svg+xml/3e20a81c39fd9279a7853c97253f9ea5/si199.svg si199 si199.svg svg 3225 ALTIMG 1-s2.0-S036013232200868X-si20.svg https://s3-eu-west-1.amazonaws.com/prod-ucs-content-store-eu-west/content/pii:S036013232200868X/image/svg+xml/8bac809f15f614ab39f2cf24cb89e6f9/si20.svg si20 si20.svg svg 2138 ALTIMG 1-s2.0-S036013232200868X-si21.svg https://s3-eu-west-1.amazonaws.com/prod-ucs-content-store-eu-west/content/pii:S036013232200868X/image/svg+xml/c2e02a2480e367b788776d271dd88c7d/si21.svg si21 si21.svg svg 1688 ALTIMG 1-s2.0-S036013232200868X-si22.svg https://s3-eu-west-1.amazonaws.com/prod-ucs-content-store-eu-west/content/pii:S036013232200868X/image/svg+xml/312ce260ba70630ad1c6d2252a1919e7/si22.svg si22 si22.svg svg 1211 ALTIMG 1-s2.0-S036013232200868X-si23.svg https://s3-eu-west-1.amazonaws.com/prod-ucs-content-store-eu-west/content/pii:S036013232200868X/image/svg+xml/d5724b4c821b5cfb6785a5fd963a6e32/si23.svg si23 si23.svg svg 1233 ALTIMG 1-s2.0-S036013232200868X-si24.svg https://s3-eu-west-1.amazonaws.com/prod-ucs-content-store-eu-west/content/pii:S036013232200868X/image/svg+xml/34bd33917a0f6aa3ba20d25f65e68e2d/si24.svg si24 si24.svg svg 1623 ALTIMG 1-s2.0-S036013232200868X-si25.svg https://s3-eu-west-1.amazonaws.com/prod-ucs-content-store-eu-west/content/pii:S036013232200868X/image/svg+xml/dc5270d21c5042e85afabc08b9a2894e/si25.svg si25 si25.svg svg 1784 ALTIMG 1-s2.0-S036013232200868X-si26.svg https://s3-eu-west-1.amazonaws.com/prod-ucs-content-store-eu-west/content/pii:S036013232200868X/image/svg+xml/d2356a1b09cf7e2c60526f502b80208c/si26.svg si26 si26.svg svg 1553 ALTIMG 1-s2.0-S036013232200868X-si27.svg https://s3-eu-west-1.amazonaws.com/prod-ucs-content-store-eu-west/content/pii:S036013232200868X/image/svg+xml/c8af763b666cf110480e4ad01c235c4f/si27.svg si27 si27.svg svg 1069 ALTIMG 1-s2.0-S036013232200868X-si28.svg https://s3-eu-west-1.amazonaws.com/prod-ucs-content-store-eu-west/content/pii:S036013232200868X/image/svg+xml/c6f8cb69f9bc22624509e0445c543fb5/si28.svg si28 si28.svg svg 1175 ALTIMG 1-s2.0-S036013232200868X-si29.svg https://s3-eu-west-1.amazonaws.com/prod-ucs-content-store-eu-west/content/pii:S036013232200868X/image/svg+xml/c0406ab6c349626d4df0d6c2df74e6cc/si29.svg si29 si29.svg svg 1587 ALTIMG 1-s2.0-S036013232200868X-si3.svg https://s3-eu-west-1.amazonaws.com/prod-ucs-content-store-eu-west/content/pii:S036013232200868X/image/svg+xml/92a3593195f3aae19eec4e9b72c2425f/si3.svg si3 si3.svg svg 1392 ALTIMG 1-s2.0-S036013232200868X-si30.svg https://s3-eu-west-1.amazonaws.com/prod-ucs-content-store-eu-west/content/pii:S036013232200868X/image/svg+xml/e2bd948a626bc906ae74c0ae7d4defc0/si30.svg si30 si30.svg svg 1426 ALTIMG 1-s2.0-S036013232200868X-si31.svg https://s3-eu-west-1.amazonaws.com/prod-ucs-content-store-eu-west/content/pii:S036013232200868X/image/svg+xml/6cf5f8c6e38ac05387a0950a538f2ea5/si31.svg si31 si31.svg svg 1531 ALTIMG 1-s2.0-S036013232200868X-si32.svg https://s3-eu-west-1.amazonaws.com/prod-ucs-content-store-eu-west/content/pii:S036013232200868X/image/svg+xml/d0245261a672ddf3a34578ddb021ebe1/si32.svg si32 si32.svg svg 1133 ALTIMG 1-s2.0-S036013232200868X-si33.svg https://s3-eu-west-1.amazonaws.com/prod-ucs-content-store-eu-west/content/pii:S036013232200868X/image/svg+xml/de56c8b949350eb07bcf1a365441ecdc/si33.svg si33 si33.svg svg 1094 ALTIMG 1-s2.0-S036013232200868X-si34.svg https://s3-eu-west-1.amazonaws.com/prod-ucs-content-store-eu-west/content/pii:S036013232200868X/image/svg+xml/7fd4e024ae37c4352a648d7ce393e495/si34.svg si34 si34.svg svg 1414 ALTIMG 1-s2.0-S036013232200868X-si35.svg https://s3-eu-west-1.amazonaws.com/prod-ucs-content-store-eu-west/content/pii:S036013232200868X/image/svg+xml/9364ece09177765726afddaf998e8579/si35.svg si35 si35.svg svg 1338 ALTIMG 1-s2.0-S036013232200868X-si36.svg https://s3-eu-west-1.amazonaws.com/prod-ucs-content-store-eu-west/content/pii:S036013232200868X/image/svg+xml/2e80c79592bf8fac58d9fdd11384a1c3/si36.svg si36 si36.svg svg 764 ALTIMG 1-s2.0-S036013232200868X-si39.svg https://s3-eu-west-1.amazonaws.com/prod-ucs-content-store-eu-west/content/pii:S036013232200868X/image/svg+xml/0834db1e4f4e90cd2c85bca51ff446ca/si39.svg si39 si39.svg svg 4431 ALTIMG 1-s2.0-S036013232200868X-si4.svg https://s3-eu-west-1.amazonaws.com/prod-ucs-content-store-eu-west/content/pii:S036013232200868X/image/svg+xml/8c7a036fc03ddf1143791db8ce9a4767/si4.svg si4 si4.svg svg 1687 ALTIMG 1-s2.0-S036013232200868X-si40.svg https://s3-eu-west-1.amazonaws.com/prod-ucs-content-store-eu-west/content/pii:S036013232200868X/image/svg+xml/ffcac2069d7bf63e71def9f526ba06c8/si40.svg si40 si40.svg svg 5950 ALTIMG 1-s2.0-S036013232200868X-si41.svg https://s3-eu-west-1.amazonaws.com/prod-ucs-content-store-eu-west/content/pii:S036013232200868X/image/svg+xml/081d258301efa2416707baf865e186a7/si41.svg si41 si41.svg svg 2779 ALTIMG 1-s2.0-S036013232200868X-si42.svg https://s3-eu-west-1.amazonaws.com/prod-ucs-content-store-eu-west/content/pii:S036013232200868X/image/svg+xml/e6cde82f92b1a9e861ab0598b1a0c1cb/si42.svg si42 si42.svg svg 2006 ALTIMG 1-s2.0-S036013232200868X-si43.svg https://s3-eu-west-1.amazonaws.com/prod-ucs-content-store-eu-west/content/pii:S036013232200868X/image/svg+xml/14a3904ce568cd69a23ac664781a7f90/si43.svg si43 si43.svg svg 2521 ALTIMG 1-s2.0-S036013232200868X-si44.svg https://s3-eu-west-1.amazonaws.com/prod-ucs-content-store-eu-west/content/pii:S036013232200868X/image/svg+xml/80b41db9beab864a3ca136a68c7779e7/si44.svg si44 si44.svg svg 2581 ALTIMG 1-s2.0-S036013232200868X-si45.svg https://s3-eu-west-1.amazonaws.com/prod-ucs-content-store-eu-west/content/pii:S036013232200868X/image/svg+xml/770d2f271e2720532bedffc19daad2b8/si45.svg si45 si45.svg svg 2865 ALTIMG 1-s2.0-S036013232200868X-si46.svg https://s3-eu-west-1.amazonaws.com/prod-ucs-content-store-eu-west/content/pii:S036013232200868X/image/svg+xml/b2554138f3f63823083a6dd0ae587c9e/si46.svg si46 si46.svg svg 5328 ALTIMG 1-s2.0-S036013232200868X-si47.svg https://s3-eu-west-1.amazonaws.com/prod-ucs-content-store-eu-west/content/pii:S036013232200868X/image/svg+xml/fdd6f79a24d4a2a44c8698816a2433fc/si47.svg si47 si47.svg svg 1173 ALTIMG 1-s2.0-S036013232200868X-si48.svg https://s3-eu-west-1.amazonaws.com/prod-ucs-content-store-eu-west/content/pii:S036013232200868X/image/svg+xml/77fb82cc127fc12722e45eb7f7c95d1c/si48.svg si48 si48.svg svg 3000 ALTIMG 1-s2.0-S036013232200868X-si49.svg https://s3-eu-west-1.amazonaws.com/prod-ucs-content-store-eu-west/content/pii:S036013232200868X/image/svg+xml/ddcda27b1e767373d56672642efc896d/si49.svg si49 si49.svg svg 1148 ALTIMG 1-s2.0-S036013232200868X-si5.svg https://s3-eu-west-1.amazonaws.com/prod-ucs-content-store-eu-west/content/pii:S036013232200868X/image/svg+xml/0d011b9a20bcf0cebb33f88312d21569/si5.svg si5 si5.svg svg 1241 ALTIMG 1-s2.0-S036013232200868X-si50.svg https://s3-eu-west-1.amazonaws.com/prod-ucs-content-store-eu-west/content/pii:S036013232200868X/image/svg+xml/326df1da18f8c90c0164665e798e614a/si50.svg si50 si50.svg svg 2363 ALTIMG 1-s2.0-S036013232200868X-si51.svg https://s3-eu-west-1.amazonaws.com/prod-ucs-content-store-eu-west/content/pii:S036013232200868X/image/svg+xml/0a12b0c1f6331c395d4955c7e8016fdc/si51.svg si51 si51.svg svg 6142 ALTIMG 1-s2.0-S036013232200868X-si53.svg https://s3-eu-west-1.amazonaws.com/prod-ucs-content-store-eu-west/content/pii:S036013232200868X/image/svg+xml/638a82718667c62db74b0e41fe432ed4/si53.svg si53 si53.svg svg 5885 ALTIMG 1-s2.0-S036013232200868X-si54.svg https://s3-eu-west-1.amazonaws.com/prod-ucs-content-store-eu-west/content/pii:S036013232200868X/image/svg+xml/ff41077c9e5d169347b211d5db0db725/si54.svg si54 si54.svg svg 4731 ALTIMG 1-s2.0-S036013232200868X-si55.svg https://s3-eu-west-1.amazonaws.com/prod-ucs-content-store-eu-west/content/pii:S036013232200868X/image/svg+xml/ec8f5142603aaba3d0464de18f108896/si55.svg si55 si55.svg svg 5523 ALTIMG 1-s2.0-S036013232200868X-si56.svg https://s3-eu-west-1.amazonaws.com/prod-ucs-content-store-eu-west/content/pii:S036013232200868X/image/svg+xml/0f2b6c70a630f2f968cbf200129f1762/si56.svg si56 si56.svg svg 9240 ALTIMG 1-s2.0-S036013232200868X-si58.svg https://s3-eu-west-1.amazonaws.com/prod-ucs-content-store-eu-west/content/pii:S036013232200868X/image/svg+xml/792d6d5a743b5a628a7012907cdd834a/si58.svg si58 si58.svg svg 3324 ALTIMG 1-s2.0-S036013232200868X-si59.svg https://s3-eu-west-1.amazonaws.com/prod-ucs-content-store-eu-west/content/pii:S036013232200868X/image/svg+xml/47159f1a65664301d98de7dfa67e1545/si59.svg si59 si59.svg svg 10040 ALTIMG 1-s2.0-S036013232200868X-si64.svg https://s3-eu-west-1.amazonaws.com/prod-ucs-content-store-eu-west/content/pii:S036013232200868X/image/svg+xml/e3ff38c8481a762775314cd830e02173/si64.svg si64 si64.svg svg 10128 ALTIMG 1-s2.0-S036013232200868X-si66.svg https://s3-eu-west-1.amazonaws.com/prod-ucs-content-store-eu-west/content/pii:S036013232200868X/image/svg+xml/2856a14b9361f8d7755d40221820fe9d/si66.svg si66 si66.svg svg 8454 ALTIMG 1-s2.0-S036013232200868X-si7.svg https://s3-eu-west-1.amazonaws.com/prod-ucs-content-store-eu-west/content/pii:S036013232200868X/image/svg+xml/840bd9d3ef3f97b9a6bf48b2b2e74ed4/si7.svg si7 si7.svg svg 1227 ALTIMG 1-s2.0-S036013232200868X-si71.svg https://s3-eu-west-1.amazonaws.com/prod-ucs-content-store-eu-west/content/pii:S036013232200868X/image/svg+xml/6d7b224660a9abec2660f48ad3c97163/si71.svg si71 si71.svg svg 39904 ALTIMG 1-s2.0-S036013232200868X-si77.svg https://s3-eu-west-1.amazonaws.com/prod-ucs-content-store-eu-west/content/pii:S036013232200868X/image/svg+xml/b97e7fa52d5a5c67d8f4281dfc6c7752/si77.svg si77 si77.svg svg 22294 ALTIMG 1-s2.0-S036013232200868X-si78.svg https://s3-eu-west-1.amazonaws.com/prod-ucs-content-store-eu-west/content/pii:S036013232200868X/image/svg+xml/30af5c612abe076b06e1aa38e670292b/si78.svg si78 si78.svg svg 3205 ALTIMG 1-s2.0-S036013232200868X-si8.svg https://s3-eu-west-1.amazonaws.com/prod-ucs-content-store-eu-west/content/pii:S036013232200868X/image/svg+xml/c24cdf5ba03bbf44eca48ef8a9ee7e4c/si8.svg si8 si8.svg svg 853 ALTIMG 1-s2.0-S036013232200868X-si81.svg https://s3-eu-west-1.amazonaws.com/prod-ucs-content-store-eu-west/content/pii:S036013232200868X/image/svg+xml/8d60f3dfbff539cda79c572313fdc6db/si81.svg si81 si81.svg svg 3253 ALTIMG 1-s2.0-S036013232200868X-si84.svg https://s3-eu-west-1.amazonaws.com/prod-ucs-content-store-eu-west/content/pii:S036013232200868X/image/svg+xml/8dbe11f27ee7471e635c7e7c1dc84362/si84.svg si84 si84.svg svg 5064 ALTIMG 1-s2.0-S036013232200868X-si85.svg https://s3-eu-west-1.amazonaws.com/prod-ucs-content-store-eu-west/content/pii:S036013232200868X/image/svg+xml/8fef297645d05994a2ed7ea4d3c4945b/si85.svg si85 si85.svg svg 2708 ALTIMG 1-s2.0-S036013232200868X-si87.svg https://s3-eu-west-1.amazonaws.com/prod-ucs-content-store-eu-west/content/pii:S036013232200868X/image/svg+xml/dee9bdda7bb68a780d978b7b93573fb9/si87.svg si87 si87.svg svg 25196 ALTIMG 1-s2.0-S036013232200868X-si88.svg https://s3-eu-west-1.amazonaws.com/prod-ucs-content-store-eu-west/content/pii:S036013232200868X/image/svg+xml/7b59f8a7c9737bf624d1eb0b003971d4/si88.svg si88 si88.svg svg 14439 ALTIMG 1-s2.0-S036013232200868X-si89.svg https://s3-eu-west-1.amazonaws.com/prod-ucs-content-store-eu-west/content/pii:S036013232200868X/image/svg+xml/466593c0894fc765fba8a982782c9fb0/si89.svg si89 si89.svg svg 4936 ALTIMG 1-s2.0-S036013232200868X-si9.svg https://s3-eu-west-1.amazonaws.com/prod-ucs-content-store-eu-west/content/pii:S036013232200868X/image/svg+xml/420add3449e88c64c09e0821f6852f82/si9.svg si9 si9.svg svg 1566 ALTIMG 1-s2.0-S036013232200868X-si90.svg https://s3-eu-west-1.amazonaws.com/prod-ucs-content-store-eu-west/content/pii:S036013232200868X/image/svg+xml/6b6e7dc1d5f13ffb55e841fa1dc1ce4b/si90.svg si90 si90.svg svg 9224 ALTIMG 1-s2.0-S036013232200868X-si93.svg https://s3-eu-west-1.amazonaws.com/prod-ucs-content-store-eu-west/content/pii:S036013232200868X/image/svg+xml/1481596e9384a3ee5fb8ed62eb811a58/si93.svg si93 si93.svg svg 5993 ALTIMG 1-s2.0-S036013232200868X-si94.svg https://s3-eu-west-1.amazonaws.com/prod-ucs-content-store-eu-west/content/pii:S036013232200868X/image/svg+xml/20fa2d989e0343554f9f8fe5ec71995b/si94.svg si94 si94.svg svg 6137 ALTIMG 1-s2.0-S036013232200868X-si95.svg https://s3-eu-west-1.amazonaws.com/prod-ucs-content-store-eu-west/content/pii:S036013232200868X/image/svg+xml/99a2c37dca24e9574f39c1971132458a/si95.svg si95 si95.svg svg 16926 ALTIMG 1-s2.0-S036013232200868X-si99.svg https://s3-eu-west-1.amazonaws.com/prod-ucs-content-store-eu-west/content/pii:S036013232200868X/image/svg+xml/e4e0650129dc5063fa1df602fe82426c/si99.svg si99 si99.svg svg 1303 ALTIMG 1-s2.0-S036013232200868X-am.pdf https://s3-eu-west-1.amazonaws.com/prod-ucs-content-store-eu-west/content/egi:1028ST8M8C4/MAIN/application/pdf/54dea676d0526ff056f1f73df6eddab4/am.pdf am am.pdf pdf false 11372887 AAM-PDF BAE 109638 109638 S0360-1323(22)00868-X 10.1016/j.buildenv.2022.109638 Elsevier Ltd Fig. 1 Experimental setup. Fig. 2 PTC heating fabric with a dimension of 1m × 1.5m and nominal power of 200Wm−2. Fig. 3 Room model with component capacities C com , boundary temperatures T bound , air volume capacity C a , outdoor temperature T o , models for convective and radiative heat transfer h c and h r and a heat resistance model for air exchange with the outdoor environment R n . Fig. 4 Thermo-physical characteristics (Conduction resistance R cond , emissivity ϵ , heating power Q ̇ h and total energy transmittance τ ) and dimensions (in mm) of the room\u2019s components. Fig. 5 Thermo-electric heating fabric model with connections to the rear component, air volume and surfaces in the field of view. Fig. 6 View factor from A i to A j . n i → and n j → : normalized normal vectors of A i and A j , r k l → : Direction vector from center of area of Δ A i to center of area of Δ A j . Fig. 7 Validation of the simulated heating-up process of a heating fabric by measurements in an experimental test room identical to Fig. 1. Fig. 8 Multi-directional, infrared radiation sensor. Fig. 9 Validation of the simulation model by an alternating setpoint operation in an experimental test room identical to Fig. 1. Fig. 10 Control loop. Fig. 11 Simplified model of the controlled system for temporal efficiency optimized control by setpoint variation. Fig. 12 Algorithm for optimizing the setback temperature in unoccupied periods. Fig. 13 Operative temperature setpoint variation for two days depending on the occupancy state and permitting a maximum heating-up time of 5min. Fig. 14 (Smoothed) outdoor temperature T o , wind speed ν Wind and solar irradiance Q ̇ S profiles of Berlin, Cologne and Flensburg [29]. Table 1 Measurement uncertainties after calibrations. Sensor Reference Uncertainty Thermocouple (Type K, NiCr-Ni) 5°C ± 0.28 K 20°C ± 0.18 K 55°C ± 0.44 K Electrical power (Manson HCS 3404) 18W ± 0.3 W 113W ± 1 W 600W ± 3.4 W Mean radiant temperature (Melexis MLX90614ESF-BAA) \u2013 ± 0.5 K a a Valid for object temperatures from 0°C to 60°C and air temperatures from 0°C to 50°C. Table 2 Energy savings due to setpoint variations compared to schedule-based heating operation in a period of one year. Parameter Boundary condition Energy savings in % Type of use Office room, PO = 6 hd−1 (reference) 16 Hotel room, PO = 11 hd−1 7 Living room, PO = 18 hd−1 6 Location Flensburg 17 Berlin (reference) 16 Cologne 21 Air exchange rate 0.5h−1(reference) 16 1h−1 9 1.5h− 1 5 Maximum permissible heating-up time 2min 6 5min(reference) 16 10min 26 20min 30 Effective specific heat capacity 20Whm−2 K−1 16 30Whm−2 K−1(reference) 16 130Whm−2 K−1 17 Occupancy-equivalent, operative temperature control for an energy-saving operation of direct electric, low-capacity heating systems Lukas Schmitt Conceptualization Methodology Software Investigation Data curation Formal analysis Writing \u2013 original draft Writing \u2013 review & editing Visualization \u204e Michael Schaub Investigation Validation Funding acquisition Stefan Brandt Supervision Martin Kriegel Supervision Technische Universität Berlin, Hermann-Rietschel-Institut, Marchstraße 4, 10587 Berlin, Germany Technische Universität Berlin, Hermann-Rietschel-Institut Marchstraße 4 Berlin 10587 Germany Technische Universität Berlin, Hermann-Rietschel-Institut, Marchstraße 4, 10587 Berlin, Germany \u204e Corresponding author. Conventional heat supply systems for indoor environments merely show annual efficiencies of net energy usage for room heating of 70% to 80% due to an inertia-related oversupply in unoccupied periods. In this study, a new method for increasing this efficiency is introduced. Low-capacity, direct electric heating systems are used to realize an occupancy-equivalent heating concept which only heats the room during occupancy. Using a fast-responding infrared sensor, these heating systems can be controlled by operative temperature, preventing significant oversupplies whilst rapidly heating up a space. A model-based algorithm enables a setback of the room temperature in unoccupied periods while guaranteeing a predefined temperature in the beginning of occupied periods. Thus, the control algorithm enables a utility-equivalent heating operation compared to a non-setback operation. During a first parameter study, net energy savings of up to 21% could be realized due to the new control method compared to a conventional schedule-based operation. The reheating factor of the heat supply system is identified as the main indicator affecting the energy saving potential in occasionally occupied rooms. Keywords Operative temperature control Occupancy-equivalent heating Direct electric heating Radiative heating Heat transfer Data availability Data will be made available on request. Nomenclature Greek symbols α Temperature coefficient (K−1) β Thermal expansion coefficient (K−1) χ Regression coefficient (\u2013) ϵ Emissivity (\u2013) λ Heat conductivity (Wm−1 K−1) ν Kinematic viscosity (Pas) Φ View factor (\u2013) φ Angle (°) ρ Reflectivity (\u2013) σ Stefan\u2013Boltzmann constant (Wm−2 K−4) τ Total energy transmittance (\u2013) Latin symbols Q ̇ Heat flux (W) q ̇ Heat flux density (Wm−2) Gr Grashof number (\u2013) Nu Nusselt number (\u2013) Pr Prandtl number (\u2013) Ra Rayleigh number (\u2013) n → Normal vector (m) r → Direction vector (m) A Area (m2) C Thermal capacity (JK−1) d Diameter (m) g Gravitational acceleration (ms−2) h Heat transfer coefficient (Wm−2 K−1) I Current (A) L Characteristic length (m) n Air exchange rate (\u2013) P Perimeter (m) R Resistance (m2 KW−1) T Temperature (K) t Time (s) U Voltage (V) v Velocity (ms−1) Subscripts a Air ad Adjacent bound Boundary c Convective com Component cond Conduction h Heated hyd Hydraulic in Incoming Int Internal l Local m Measured o Outdoor op Operative out Outgoing PMV Predicted Mean Vote PO Occupied period PU Unoccupied period r Radiative S Solar set Setpoint sim Simulated surf Surface 1 Introduction Conventional heat supply systems like radiators or floor heating show annual efficiencies of net energy usage for room heating of only 70 to 80% due to an inertia-related oversupply in non-usage periods [1\u20133] and thus represent a major energy weakness compared to the technically sophisticated heat generators. As these heat supply systems cannot be controlled immediately, rooms are also heated in (short-term) unoccupied periods. While evaluating heating operation in unoccupied rooms as heat loss, a low-capacity heating system which can increase and decrease the room temperature instantly, shows potential for significantly improving the efficiency of net energy usage for room heating. As the adequacy of hot water based heating systems in nearly zero-energy buildings is highly discussed [4,5], there is a demand for energy-efficient, occupancy-equivalent solutions operating material-saving, direct electric heating systems. Occupancy-based room heating concepts have been analyzed in previous research [6]. The related control strategies are based on user-defined schedules (e.g. Iyengar et al. [7]), occupancy detection and monitoring (e.g. Peng et al. [8]) or combinations of both (e.g. Scott et al. [9]). Thereby, predictive control strategies show high potentials for energy savings by optimizing the heating operation in occupied and unoccupied periods [8]. Nevertheless, it must be noted that the energy saving potential strongly depends on the occupancy prediction accuracy. Balaji et al. [10] reported energy savings of 17.8% due to a reactive, occupancy-based control. However, the setback temperature during unoccupied periods is user-defined and not yet optimized. When resorting to conventional heat supply systems, the proposed, predictive and reactive control methods still cannot be used for an occupancy-equivalent room heating. The thermal inertia of the applied heat supply systems are too high for realizing fast-response heating-up processes [11]. Algorithms to predict occupancy- or schedule-based operations to start heat supply systems premature to occupied periods are still indispensable [12,13]. Schaub et al. [14] showed the energy saving potential using direct electric, low-capacity heating fabrics for intermittent occupancy by reducing the room temperature in unoccupied periods instantly. Although the proposed control method reveals a high potential, a comparison to a schedule-based operation is ineligible due to disparate utility levels (of thermal comfort) in the beginning of occupied periods. Consequently, this paper aims for a control strategy for direct electric, low-capacity heating fabrics exploiting all mentioned potentials in common and reducing the energy demand for room heating. The system shall respond quickly to short-term heat gains or losses and shall be set to an energy saving mode during unoccupied periods. Compared to a non-setback operation, a utility-equivalent, heating operation is focused. In comparison to the control concepts mentioned above, an occupancy-optimized heating concept is implemented without the need of preheating the room premature to occupied periods. As radiative heat transfer constitutes the major heat transfer process for direct electric surface heating systems, the operative temperature is used as a controlled variable. Besides a more precise description of the thermal comfort, a real-time measurement of the operative temperature allows accelerated heating-up processes of radiative heating systems. Sensors for an appropriate, practical measurement of the operative temperature (or additional consideration of the mean radiant temperature) have already been demonstrated in previous works [15,16] but do not fulfill the requirements of long- and real-time measurement capabilities at once. As conventional sensor systems (e.g. globe thermometers) cannot prevent a temporal oversupply (caused by the sensor\u2019s induced dead time), an adequate, robust measurement is newly introduced in this study. The control method is developed in a simulation model allowing for reproducible boundary conditions comparing different use cases. Therefore, the generic room setup in Fig. 1 is designed as RC model and introduced in Section 2. Section 3 presents the proposed control method. 2 Analysis model The development of the control method and further energetic analyses are performed in the generic room setup in Fig. 1. The room with dimensions 5.8 × 3.98 × 3.03 m3 is equipped with six low-capacity PTC heating fabrics (Fig. 2). Considering the characteristic material properties and heat transfer mechanisms of surface heating systems and construction components, the generic room setup in Fig. 1 is designed as an RC model (Fig. 3) and implemented in Python and Modelica. Herein, components describe walls, windows, lighting, doors, heating fabrics and combinations of those. Corresponding, already validated models are adopted from Modelica Buildings library [17] and AixLib [18] library. Exact locations, dimensions and thermo-physical characteristics of all components are listed in Fig. 4. As being of central relevance for our investigation, the heating fabric model (Section 2.1), the convective heat exchange model (Section 2.2), the radiative heat exchange model (Section 2.3) and the simulation model for the mean radiant temperature sensor (Section 2.4) are explained in detail. Section 2.5 finally shows a validation of the developed models in an experimental setup identical to Fig. 1. 2.1 Heating fabric model The heating fabric (Fig. 2) is described as an RC model in Fig. 5. A thermal model connects the heating fabric capacity C h to the rear wall capacity C com,h as well as to the room air capacity C a and the other surfaces in the field of view C com,i . Conduction resistances R com and R surf are obtained by experimental surveys. While R surf ≪ R com , R com mainly results from a thermal decoupling from the rear wall by a 2mm expanded polystyrene insulation layer directing the heat transfer primarily into the room. Thus, heating-up processes can be performed independently from the rear wall\u2019s thermal capacity and the building construction can still be used as a heat reservoir for daily cyclical loading and unloading, enabling a summer heat protection. An electric model determines the heat flux corresponding to the specific PTC behavior. The PTC resistance R ( T ) is a material property and individual for different heating fabrics. It is determined with data gained from a heating-up process by exponential regression. Eq. (1) is applied. (1) R ( T ) = R 0 ⋅ e α ( T − T 0 ) Herein, α defines the temperature coefficient. The converted heat flux Q ̇ h can be calculated by Eq. (2) considering the voltage U or the current I . (2) Q ̇ h = U I = I 2 R ( T ) = U 2 R ( T ) 2.2 Convective heat exchange The convective heat transfer between surfaces and the air volume of the room is determined using heat transfer coefficients h c and is calculated as (3) h c = Nu ⋅ λ L , where Nu is the Nusselt number, λ the thermal conductivity and L the length of the flow path. Thereby, Nu can be determined using empirical approximation equations considering the corresponding boundary conditions [19]. Nusselt numbers for convective heat transfer at planar, vertical plates with approximately homogeneous temperature distributions and a dominating natural convection are calculated as (4) Nu = 0 . 68 + 0 . 67 ⋅ Ra 1 4 1 + 0 . 492 Pr 9 16 4 9 , 0 ≤ Ra < 1 0 9 0 . 825 + 0 . 387 ⋅ Ra 1 6 1 + 0 . 492 Pr 9 16 8 27 2 , Ra ≥ 1 0 9 according to Churchill and Chu [20]. Herein, Ra defines the Rayleigh number and Pr the Prandtl number. Ra can be calculated using (5) Ra L = Gr L ⋅ Pr = g β a ( T surf − T a ) L 3 ν 2 ⋅ Pr and depends on the Grashof number Gr L and Pr . Thereby, Gr L is determined considering the thermal expansion coefficient β a and the kinematic viscosity ν of the room air, the length of the flow path L as well as surface and air temperatures T surf and T a . Empirical approximation equations for natural convection at horizontal plates are determined in Alamdari and Hammond [21]. h c is calculated using (6) h c = 1 . 4 Δ T d hyd 1 4 6 + 1 . 63 Δ T 1 3 6 1 6 for upward heat flows and (7) h c = 0 . 6 Δ T d hyd 2 1 5 for downward heat flows. Herein d hyd describes the hydraulic diameter calculated as (8) d hyd = 4 ⋅ A P , considering the surface area A and the perimeter P . 2.3 Radiative heat exchange Radiation exchange is modeled with a surface-to-surface radiation model presuming the room air as non-participating medium [22]. According to Minkina and Dudzik [23] this assumption is valid if distances between two arbitrary surfaces exchanging radiation do not exceed 10m. Presuming only opaque surfaces, the outgoing heat flux density q ̇ out , i of an arbitrary surface i ∈ [ 1 , \u2026 , N ] can be expressed as (9) q ̇ out , i = ϵ i σ T i 4 + ρ i q ̇ in , i = ϵ i σ T i 4 + ( 1 − ϵ i ) q ̇ in , i , where ϵ , ρ and T describe the emissivity, the reflectivity and the absolute temperature of surface i . σ defines the Stefan-Boltzmann constant. Considering the reciprocal relation Φ i → j A i = Φ j → i A j , the incoming heat flux density q ̇ in , i can be expressed as (10) q ̇ in , i = ∑ j = 1 N Φ i → j q ̇ out , j , where Φ i → j defines the view factor from surface i to surface j . Subsequently, radiation balance for surface i is expressed by Eq. (11). (11) q ̇ i = q ̇ out , i − q ̇ in , i = ϵ i 1 − ϵ i ( σ T i 4 − q ̇ out , i ) The equation system is solved with Python. For every pair of surfaces exchanging radiation, view factors are calculated initially to reduce computation effort. A Riemann sum is used to approximate Eq. (12a) by (12b) enabling a numerical solution [24]. Thereby, n i → and n j → describe normalized normal vectors of A i and A j , r k l → defines the direction vector from the center of area Δ A i to the center of area Δ A j . All components are visualized in Fig. 6. (12a) Φ i → j = 1 A i π ∫ A i ∫ A j cos φ i cos φ j r 2 d A j d A i (12b) ≈ − 1 A i π ∑ k = 1 m ∑ l = 1 m ( r k l → ⋅ n i → ) ( r l k → ⋅ n j → ) \u2016 r k l → \u2016 4 Δ A j Δ A i Choosing a high value for m , the approximation error can be determined to 0.27% for the view factor calculation in the experimental test room in Fig. 1. Following the calculation of the convective heat transfer, a radiative heat transfer coefficient can be defined as (13) h r , i ↔ j = Φ i → j q ̇ out , i − q ̇ out , j T i − T j ︸ related to A i = Φ j → i q ̇ out , j − q ̇ out , i T j − T i ︸ related to A j . 2.4 Mean radiant temperature model According to Fanger [25], the mean radiant temperature can be expressed as (14) T r 4 = 1 σ ∑ i = 1 N q ̇ out , i Φ i where Φ i describes the view factor from a measurement point to a surface i . Eq. (14) can be simplified to Eq. (15) if high emissivities ( ≥ 0 , 9 ) predominate. A comparison of both methods only revealed non-significant deviations in the validation experiments. (15) T r 4 = ∑ i = 1 N T i 4 Φ i Φ i can be calculated using Eq. (16). Equivalent to Eq. (12), a Riemann sum is used for a numerical approximation. (16a) Φ i = 1 4 π ∫ A i cos φ r 2 d A i (16b) ≈ 1 4 π ∑ i = 1 m ( r i → ⋅ n → ) \u2016 r i → \u2016 3 Δ A i 2.5 Experimental model validation The model validation takes place in an experimental test room identical to Fig. 1. A separate climate chamber with a constant temperature of -10°C connects to the test room\u2019s entire outer wall (containing the windows) and enables transmission heat losses. In addition, ventilation heat losses are generated by a swirl diffuser in the center of the ceiling. During the validation experiments, the room is supplied with a constant air volume flow of 35m3 h−1 and a temperature of -1°C. The entire experimental setup is located in an enclosing test hall. The enclosing air temperature is controlled to 20°C by mixed ventilation. The experimental model validation is conducted in a two-step procedure. In a first step, the heating fabric model is validated comparing the simulated and the measured thermal behavior in a heating-up process. Secondly, the room model is validated comparing the thermal model behavior and the real room behavior in a dynamic experiment. 2.5.1 Heating fabric validation The heating-up process for validation purposes is illustrated in Fig. 7. Herein, the heating fabric reaches a peak power of approx. 420W. The measurements show good agreement with the simulation results. The maximum surface temperature deviation of the simulation is 0.9K after 1h and can be explained by uncertainties in the estimation of the rear wall layers\u2019 heat conductivities and capacities as well as measurement uncertainties. The latter are listed in Table 1. 2.5.2 Room model validation The room model validation is conducted applying a mean radiant temperature ( T r ) control in the room. The multi-directional infrared sensor in Fig. 8 was constructed to measure T r in adequate time intervals. Five single IR temperature sensors of type Melexis MLX90614ESF-BAA are used to catch the mean radiant temperatures of the different room directions. With a minimal overlap in fields of view, 90.8% of the room surface can be detected by the sensor combination. The mean radiant room temperature is calculated as the arithmetic mean of all single sensors. The sensor is installed in the center of the ceiling. In addition, the air temperature ( T a ) in the center of the room is measured by a thermocouple (Type K, NiCr-Ni). For validation purposes, the mean radiant temperature is alternately varied between 17°C and 20°C at intervals of 4h. The procedure is performed until the controlled system\u2019s response replicates periodically. Fig. 9 shows the validation results. The heating fabrics reach mean peak powers of approx. 400W resulting in an overall peak power of approx. 2400W. Compared to conventional heat supply systems (radiators and floor heating), the heating-up process of the room is primarily driven by the increasing surface temperatures of the heating fabrics. These heating fabrics show a lower thermal inertia than the room air volume resulting in a faster increase of the mean radiant temperature compared to the air temperature. Mean radiant temperature and air temperature show acceptable agreement during heating-up and temperature drop phases. Simulated ( T r,sim ) and measured ( T r,m ) mean radiant temperatures both follow a characteristic behavior, i.e. an instant drop of approx. 0.4K after the setpoint reduction and a fast increase after the setpoint increase. Within the ongoing temperature drop phase, a diverging drift, resulting in a maximum deviation of 0.6K between T r,sim and T r,m , can be observed. The deviation in the recorded temperatures can be explained by deviations between the real infrared sensor from Fig. 8 and the ideal sensor model resulting from Eq. (15). The non-ideal detection of heating fabrics near the room corners results in a lower mean radiant temperature in the experimental setup. Despite the deviation in absolute values, the validation experiment shows sufficient agreement between the simulated and measured (stationary and transient) thermal behavior of the room and the heating system. Consequently, the model is stated as adequately describing the relevant physics. 3 Control method This article proposes a new control method for direct electric surface heating systems showing an equal utility level compared to a schedule-based operation. Section 3.1 illustrates the structure of the implemented control loop and Section 3.2 explains the control loop elements\u2019 underlying models. 3.1 Control loop Heating fabrics are controlled using the electric voltage (respectively power) as the manipulated variable. With consideration of Eqs. (1) and (2), the control signal is linearized for achieving better control quality. Due to a P T 2 behavior of the controlled system, a PI controller is chosen. Despite slightly differing material parameters, control parameters K P = 10 and T I = 15s (obtained by Ziegler et al. [26]) show similar results for every heating fabric. Optimizing the control parameters by minimizing the time for reaching the setpoint, the mean radiant temperature overshoot could be limited in typical usage cases to 0.5K (Fig. 9). Switching the controlled variable to operative temperature does not affect the control performance since the air temperature signal shows higher inertia than the mean radiant temperature signal. A precise calculation of the operative temperature is defined in ISO 7726 [27] and requires an additional measurement of the local air velocity v a,l . Since a sufficiently accurate measurement of v a,l is not economical in most practical applications, the operative temperature is defined as (17) T op = T a + T r 2 . Following ISO 7726 [27] and considering typical room conditions using surface heating systems ( | T r − T a | ≤ 4°C and v a,l ≤ 0.6ms−1), the maximum measurement error is 0.4K. Since the setpoint temperature can be freely adjusted in case of thermal discomfort, the calculation method is stated as sufficiently accurate. Solar ( Q ̇ S ) and internal ( Q ̇ Int ) heat gains, as well as transmission ( Q ̇ ( T ad , T o ) ) and ventilation ( Q ̇ ( n ) ) heat gains and losses are considered as disturbance variables. The control loop is schematically illustrated in Fig. 10. 3.2 Model based control algorithm Energy savings in unoccupied periods (PU) are realized by reducing the setpoint temperature and thus heat losses to the outdoor environment. The system-specific setpoint temperature in unoccupied periods is chosen such that the setpoint temperature in occupied periods (PO) is reached during a predefined, maximum permissible heating-up time t max . If t max is smaller than the acclimatization time of a human being, the setpoint variation control algorithm shows the same thermal comfort (utility) level as a schedule-based operation. As the subjective perception and thermoregulation response depends on several individual, physiological parameters [28], the control method allows an arbitrary definition of t max . The setpoint temperature T set is defined by Eq. (18). (18) T set = T set,PO , in occupied periods T set,PU = f ( T set,PO , n , T ad , T o , t max ) , in unoccupied periods T set,PU is determined using the simplified room model in Fig. 11. The room envelope is divided into two capacities describing the heated ( C h ) and unheated ( C u ) envelope. R ad and R o define the conductive and transfer resistances from the inner surface to the adjacent rooms and the outdoor environment. R n describes a heat resistance model for air exchange with the outdoor environment. C h and C u are estimated using characteristic room parameters. Differing from Eq. (15), the mean radiant temperature is adapted to the simplified model and defined as (19) T r 4 = Φ T h 4 + ( 1 − Φ ) T u 4 . The measurement point is located in the center of the room. The view factor Φ can be estimated from the area proportions of the heated and unheated surface of the room envelope. For each dynamic boundary condition in unoccupied periods, an optimal setback temperature T set,PU exists. Thereby, a setback temperature is optimal if the operative temperature can be restored exactly within t max in the worst-case scenario. The worst case scenario is represented by the stationary, thermal state of the room in setback mode. In this case, all thermal capacities of the room are discharged to a minimum and the maximum energy is required to reach the occupied state\u2019s setpoint temperature T set,PO again. Fig. 12 shows the iterative algorithm for determining T set,PU for each boundary condition. t describes the particular heating-up time in every iteration step. The specified algorithm and the parameterized model in Fig. 11 are modeled in the Python programming language and can be directly integrated into the control software. Due to the high computing power required for optimization in each time step, setback temperatures for a specific room depending on the dynamic boundary conditions (temperatures of the adjacent rooms T ad and the outdoor environment T o as well as the air exchange rate n ) are evaluated preliminary to the control process. Using the model in Fig. 11 and applying the algorithm in Fig. 12 a setback temperature dataset for different combinations of dynamic boundary conditions can be obtained. Applying a multivariate, linear regression analysis, a setpoint function can be determined according to Eq. (20). (20) T set,PU , t max = min χ 0 + χ 1 n ( T set,PO − T o ) + χ 2 ( T set,PO − T ad ) T set,PO The regression parameters χ 0 = 20 . 8142 , χ 1 = 0 . 0213 and χ 2 = 0 . 0195 are evaluated for the test room in Fig. 1. For boundary temperatures ranging from -20°C to 20°C and air exchange rates ranging from 0.5 to 1, the regression quality R 2 of the determined function is 0.9762. 4 Results Fig. 13 shows a control attempt with the implemented setpoint variation in occupied and unoccupied periods during an 48h time period with predefined boundary conditions. A maximum heating-up time of 5 min and a setpoint temperature of 22°C is set for occupied periods. The outside temperature fluctuates daily between 0°C and 10°C. The temperature of the adjacent rooms varies between 18°C and 22°C. The example demonstrates the functionality of the new proposed control method. During the unoccupied periods, the operative temperature can be reduced by up to 1K. Variations of the outdoor and adjacent room temperature show only marginal impacts on the optimized setpoint temperature. T set,PO is reached exactly 5 min after the start of the first occupied period. 4.1 Sensitivity analysis Potentials for saving energy using the proposed control method are evaluated in a sensitivity analysis. Thereby, parameter variations can be obtained by Table 2. Boundary conditions marked as reference condition hold while one parameter is varied discretely during the specified values. T set,PO is set to 22°C. Weather conditions for the specified locations can be found in Fig. 14. Energy savings due to the proposed control method are presented relative to a schedule-based heating operation in a period of one year. Table 2 shows increasing energy savings if occupied periods appear in smaller proportions. This observation is immediately plausible, since setback periods are longer. Performing the heating operation at night (hotel room) enables less energy savings compared to a daytime operation (office room). This can be explained by lower outdoor temperatures and consequently higher setback temperatures at night. Varying the test room\u2019s location, weather conditions in Cologne appear most favorable for energy savings. Due to higher outdoor temperatures and less convective heat losses because of lower average wind speeds, the control algorithm enables lower setback temperatures in unoccupied periods during the heating period. Analogously, higher air exchange rates increase heat losses due to ventilation and reduce the reheating factor (quotient of total heating power and room\u2019s heat losses). Consequently, lower air exchange rates enable lower setback temperatures in unoccupied periods and enlarge energy savings. The effective specific heat capacity of the room construction does not significantly affect the energy saving potential as the heat capacity of the heating fabrics is such low that heating-up processes occur independently from the unheated room surfaces\u2019 temperatures. Enlarging the heating system\u2019s thermal capacity up to a critical point can enable the unheated room surfaces\u2019 impact on the speed of heating-up processes and thereby reduce the energy saving potential. Varying the maximum permissible heating-up time most significantly affects the energy demand. By increasing the maximum permissible heating-up time, setback temperatures are reduced analogously by the control algorithm. It should be noted that energy savings are compared at different utility levels if the maximum permissible heating-up time is larger than a human being\u2019s acclimatization time. 5 Discussion As the control method enlarges energy savings in occasionally occupied rooms, the heating system recommends itself for usage in office or meeting rooms which are not occupied permanently. Additionally, the proposed heating system is very suitable for rooms which only have to be heated by demand (e.g. hotel rooms). Enabling a non-scheduled possibility to realize an occupancy-based room conditioning, the control method offers a robust alternative to stochastic occupancy models (e.g. Peng et al. [8]). An operative temperature control allows a more precise evaluation of the thermal comfort in indoor environments for heating systems with dominating radiative heat transfer. The developed multi-directional infrared sensor (Fig. 8) is able to measure the operative temperature in combination with a common air temperature sensor. Besides delivering a sufficient measurement precision, the sensor also enables real-time operation. Occupancy can be detected by a set of simple motion sensors observing the whole room or an additional evaluation routine of the sensor data itself. While the new sensor can be mounted at the ceiling, it does not pose an obstacle in the room and also offers architectural advantages compared to conventional globe thermometers. As direct electric heating systems still suffer from high primary energy factors if the operation is dependent on the public electricity grid [30], usage of the heating system is particularly suitable in low-energy buildings. If the complete electricity for heating purposes is provided by renewable generators (e.g. photovoltaic systems), the system enables new alternatives for green heating concepts. Without decentralized renewable generators and storages, a large-scale deployment of the presented, fast-responding heating system causes new challenges for the load management in the public electricity grid. A combination of the fast-response, direct electric heating system with a more inert heating system appears particularly interesting, e.g. as a cost-effective supplement in existing buildings. This would allow the more inert heating system to cover a base load to minimize peak loads and grid load fluctuations caused by the direct electric, low-capacity heating system. 6 Conclusions and outlook Section 4 shows the principal functionality of the newly developed control method. In a demonstrating example, operative temperature could be reduced by up to 1K in unoccupied periods enabling energy savings due to lower temperature differences to the outdoor environment. Thereby, a fast-responding infrared sensor is introduced which allows for adequate, dynamic measurement of the operative temperature. An experiment validates its suitability. In a second step, a sensitivity analysis identifies suitable use cases as well as limits of the proposed method. Depending on the boundary conditions, energy savings of up to 21% could be realized due to the new control method compared to a conventional schedule-based operation. Based on the results, the reheating factor is identified as the main indicator affecting the energy saving potential. The higher the reheating factor, the lower the setback temperature which can be selected during unoccupied periods. The heat capacity of the building construction does not show a significant effect in fast heating-up processes if the heating fabrics are thermally decoupled from the rear wall by an insulation layer. Compared to a conventional air temperature control system, the additional measurement of the mean radiant temperature significantly improves the thermal comfort estimation. A further measurement of the humidity and an estimation of the local air velocity, the activity level and the thermal resistance of the clothing can enable a PMV-based control system [25]. Further research will address an evaluation of the presented control method and heating system in comparison to conventional hot water based heating systems in different usage scenarios. Additionally, a geometrical and dimensional variation of the heating fabrics will be analyzed to find optimal layout solutions for direct electric heating systems using the optimized control method. Besides the temporal optimization, further steps will also include local heating concepts exploiting the surface heating system\u2019s ability to predominantly heat specific areas in large rooms. CRediT authorship contribution statement Lukas Schmitt: Conceptualization, Methodology, Software, Investigation, Data curation, Formal analysis, Writing \u2013 original draft, Writing \u2013 review & editing, Visualization. Michael Schaub: Investigation, Validation, Funding acquisition. Stefan Brandt: Supervision, Project administration. Martin Kriegel: Supervision, Resources, Project administration, Funding acquisition. Declaration of Competing Interest The authors declare the following financial interests/personal relationships which may be considered as potential competing interests: Martin Kriegel reports equipment, drugs, or supplies was provided by Jahn GmbH & Co. KG and Browatech GmbH & Co. KG. Martin Kriegel reports financial support was provided by Vattenfall Energy Solutions GmbH. Acknowledgments This work is financially supported by Forschungsinitiative Zukunft Bau of the Federal Institute for Research on Building, Urban Affairs and Spatial Development, Germany (SWD-10.08.18.7\u201318.14) and Vattenfall Energy Solutions GmbH, Germany . The heating fabrics were provided by Jahn GmbH Co. KG and Browatech GmbH & Co. KG. The support is gratefully acknowledged. References [1] Ast H. Energetische Beurteilung von Warmwasserheizanlagen durch rechnerische Betriebssimulation (Ph.D. thesis) 1989 Universität Stuttgart H. Ast, Energetische beurteilung von warmwasserheizanlagen durch rechnerische betriebssimulation, Ph.D. thesis, Universität Stuttgart (1989). [2] Knorr M. Zur funktionellen, energetischen und wärmephysiologischen Bewertung der intermittierenden Betriebsweise von Heizungsanlagen (Ph.D. thesis) 2010 TU Dresden M. Knorr, Zur funktionellen, energetischen und wärmephysiologischen bewertung der intermittierenden betriebsweise von heizungsanlagen, Ph.D. thesis, TU Dresden (2010). [3] Erickson V.L. Lin Y. Kamthe A. Brahme R. Surana A. Cerpa A.E. Sohn M.D. Narayanan S. Energy efficient building environment control strategies using real-time occupancy measurements Proceedings of the First ACM Workshop on Embedded Sensing Systems for Energy-Efficiency in Buildings - BuildSys \u201909 2009 ACM Press 10.1145/1810279.1810284 V. L. Erickson, Y. Lin, A. Kamthe, R. Brahme, A. Surana, A. E. Cerpa, M. D. Sohn, S. Narayanan, Energy efficient building environment control strategies using real-time occupancy measurements, in: Proceedings of the First ACM Workshop on Embedded Sensing Systems for Energy-Efficiency in Buildings - BuildSys 09, ACM Press, 2009. doi:10.1145/1810279.1810284. [4] Heider J. Conrad N. Stark T. Abdulganiev A. Kosack P. Wagner A. Potenzial von Infrarot-Heizsystemen für hocheffiziente Wohngebäude 2020 Fraunhofer IRB T. S. A. P. K. A.-K. W. Jan Heider, Nicole Conrad, Potenzial von Infrarot-Heizsystemenfür hocheffiziente Wohngebäude, Fraunhofer IRB, 2020. [5] Boßmann T. Elsland R. Klingler A.-L. Catenazzi G. Jakob M. Assessing the optimal use of electric heating systems for integrating renewable energy sources Energy Procedia 83 2015 130 139 10.1016/j.egypro.2015.12.203 T. Bomann, R. Elsland, A.-L. Klingler, G. Catenazzi, M. Jakob, Assessing the optimal use of electric heating systems for integrating renewable energy sources, Energy Procedia 83 (2015) 130\u2013139. doi:10.1016/j.egypro.2015.12.203. [6] Esrafilian-Najafabadi M. Haghighat F. Occupancy-based HVAC control systems in buildings: A state-of-the-art review Build. Environ. 197 2021 107810 10.1016/j.buildenv.2021.107810 M. Esrafilian-Najafabadi, F. Haghighat, Occupancy-based HVAC control systems in buildings: A state-of-the-art review, Building and Environment 197 (2021) 107810. doi:10.1016/j.buildenv.2021.107810. [7] Iyengar S. Kalra S. Ghosh A. Irwin D. Shenoy P. Marlin B. Inferring smart schedules for dumb thermostats ACM Trans. Cyber-Phys. Syst. 3 2 2019 1 29 10.1145/3226031 S. Iyengar, S. Kalra, A. Ghosh, D. Irwin, P. Shenoy, B. Marlin, Inferring smart schedules for dumb thermostats, ACM Transactions on Cyber-Physical Systems 3 (2) (2019) 1\u201329. doi:10.1145/3226031. [8] Peng Y. Rysanek A. Nagy Z. Schlüter A. Occupancy learning-based demand-driven cooling control for office spaces Build. Environ. 122 2017 145 160 10.1016/j.buildenv.2017.06.010 Y. Peng, A. Rysanek, Z. Nagy, A. Schlüter, Occupancy learning-based demand-driven cooling control for office spaces, Building and Environment 122 (2017) 145\u2013160. doi:10.1016/j.buildenv.2017.06.010. [9] Scott J. Brush A.B. Krumm J. Meyers B. Hazas M. Hodges S. Villar N. Preheat: controlling home heating using occupancy prediction Proceedings of the 13th International Conference on Ubiquitous Computing - UbiComp \u201911 2011 ACM Press 10.1145/2030112.2030151 J. Scott, A. B. Brush, J. Krumm, B. Meyers, M. Hazas, S. Hodges, N. Villar, PreHeat: controlling home heating using occupancy prediction, in: Proceedings of the 13th international conference on Ubiquitous computing - UbiComp 11, ACM Press, 2011. doi:10.1145/2030112.2030151. [10] Balaji B. Xu J. Nwokafor A. Gupta R. Agarwal Y. Sentinel Proceedings of the 11th ACM Conference on Embedded Networked Sensor Systems - SenSys \u201913 2013 ACM Press 10.1145/2517351.2517370 B. Balaji, J. Xu, A. Nwokafor, R. Gupta, Y. Agarwal, Sentinel, in: Proceedings of the 11th ACM Conference on Embedded Networked Sensor Systems - SenSys 13, ACM Press, 2013. doi:10.1145/2517351.2517370. [11] Kleiminger Willhelm Occupancy Sensing and Prediction for Automated Energy Savings (Ph.D. thesis) 2015 10.3929/ETHZ-A-010450096 Kleiminger, Willhelm, Occupancy sensing and prediction for automated energy savings, Ph.D. thesis (2015). doi:10.3929/ETHZ-A-010450096. [12] Kleiminger W. Mattern F. Santini S. Predicting household occupancy for smart heating control: A comparative performance analysis of state-of-the-art approaches Energy Build. 85 2014 493 505 10.1016/j.enbuild.2014.09.046 W. Kleiminger, F. Mattern, S. Santini, Predicting household occupancy for smart heating control: A comparative performance analysis of state-of-the-art approaches, Energy and Buildings 85 (2014) 493\u2013505. doi:10.1016/j.enbuild.2014.09.046. [13] Wörner D. von Bomhard T. Wortmann F. Occupancy-based heating control for residential buildings using environmental sensors Proceedings of the 5th ACM Workshop on Embedded Systems for Energy-Efficient Buildings 2013 ACM 10.1145/2528282.2528313 D. Wörner, T. von Bomhard, F. Wortmann, Occupancy-based heating control for residential buildings using environmental sensors, in: Proceedings of the 5th ACM Workshop on Embedded Systems For Energy-Efficient Buildings, ACM, 2013. doi:10.1145/2528282.2528313. [14] Schaub M. Schmitt L. Kriegel M. Vergleich des nutzungsgrads von reaktionsschnellen, direktelektrischen wärmeübergabeformen mit konventionellen raumheizsystemen HLH, Vol. 4 2020 22 25 M. Schaub, L. Schmitt, M. Kriegel, Vergleich des nutzungsgrads von reaktionsschnellen, direktelektrischen wärmeübergabeformen mit konventionellen raumheizsystemen, HLH 4 (2020) 22\u201325. [15] Simone A. Babiak J. Bullo M. Landkilde G. Olesen B. Operative temperature control of radiant surface heating and cooling systems 2007 A. Simone, J. Babiak, M. Bullo, G. Landkilde, B. Olesen, Operative temperature control of radiant surface heating and cooling systems, 2007. [16] Revel G.M. Sabbatini E. Arnesano M. Development and experimental evaluation of a thermography measurement system for real-time monitoring of comfort and heat rate exchange in the built environment Meas. Sci. Technol. 23 3 2012 035005 10.1088/0957-0233/23/3/035005 G. M. Revel, E. Sabbatini, M. Arnesano, Development and experimental evaluation of a thermography measurement system for real-time monitoring of comfort and heat rate exchange in the built environment, Measurement Science and Technology 23 (3) (2012) 035005. doi:10.1088/0957-0233/23/3/035005. [17] Wetter M. Zuo W. Nouidui T.S. Pang X. Modelica buildings library J. Build. Perform. Simul. 7 4 2013 253 270 10.1080/19401493.2013.765506 M. Wetter, W. Zuo, T. S. Nouidui, X. Pang, Modelica buildings library, Journal of Building Performance Simulation 7 (4) (2013) 253\u2013270. doi:10.1080/19401493.2013.765506. [18] D. Mueller L.M. C. A W. M. Fuchs R.P. Aixlib - an open-source modelica library within the iea-ebc annex 60 framework BauSIM 2016 2016 3 9 D. Mueller, L. M., C. A., M. Fuchs, R. P., Aixlib - an open-source modelica library within the iea-ebc annex 60 framework, in: BauSIM 2016, 2016, p. 3\u20139. [19] Khalifa A.-J.N. Natural convective heat transfer coefficient \u2013 a review Energy Convers. Manage. 42 4 2001 491 504 10.1016/s0196-8904(00)00042-x A.-J. N. Khalifa, Natural convective heat transfer coefficient a review, Energy Conversion and Management 42 (4) (2001) 491\u2013504. doi:10.1016/s0196-8904(00)00042-x. [20] Churchill S.W. Chu H.H. Correlating equations for laminar and turbulent free convection from a vertical plate Int. J. Heat Mass Transfer 18 11 1975 1323 1329 10.1016/0017-9310(75)90243-4 S. W. Churchill, H. H. Chu, Correlating equations for laminar and turbulent free convection from a vertical plate, International Journal of Heat and Mass Transfer 18 (11) (1975) 1323\u20131329. doi:10.1016/0017-9310(75)90243-4. [21] Alamdari F. Hammond G.P. Improved data correlations for buoyancy-driven convection in rooms Build. Serv. Eng. Res. Technol. 4 3 1983 106 112 10.1177/014362448300400304 F. Alamdari, G. P. Hammond, Improved data correlations for buoyancy-driven convection in rooms, Building Services Engineering Research and Technology 4 (3) (1983) 106\u2013112. doi:10.1177/014362448300400304. [22] Modest M.F. Radiative Heat Transfer 2013 Elsevier LTD Oxford URL https://www.ebook.de/de/product/19724908/michael_f_modest_radiative_heat_transfer.html M. F. Modest, Radiative Heat Transfer, Elsevier LTD, Oxford, 2013. https://www.ebook.de/de/product/19724908/michaelfmodestradiativeheattransfer.html [23] W. Minkina, S. Dudzik, Infrared Thermography: Errors and Uncertainties, Chichester, West Sussex, U.K and Hoboken, NJ, 2009, http://dx.doi.org/10.1002/9780470682234, URL. W. Minkina, S. Dudzik, Infrared thermography: Errors and uncertainties, Chichester, West Sussex, U.K and Hoboken, NJ, 2009. doi:10.1002/9780470682234. http://site.ebrary.com/lib/alltitles/docDetail.action?docID=10344060 [24] de Carvalho A. Dobrowolski L. Giacomet B. Mendes N. Numerical method for calculating view factor between two surfaces Building Simulation 2007 2007 A. de Carvalho, L. Dobrowolski, B. Giacomet, N. Mendes, Numerical method for calculating view factor between two surfaces, in: Building Simulation 2007, 2007. [25] P.O. Fanger, Thermal Comfort: Analysis and Applications in Environmental Engineering, New York, 1972. P. O. Fanger, Thermal comfort: Analysis and applications in environmental engineering, New York, 1972. [26] J.G. Ziegler, N.B. Nichols, et al. Optimum settings for automatic controllers, Trans. ASME 64 (11). [27] ISO 7726, ergonomics of the thermal environment \u2014 instruments for measuring physical quantities 1998 ISO 7726, Ergonomics of the thermal environment \u2014 instruments for measuring physical quantities (Nov. 1998). [28] Zhang H. Human Thermal Sensation and Comfort in Transient and Non-Uniform Thermal Environments 2003 University of California Berkeley H. Zhang, Human thermal sensation and comfort in transient and non-uniform thermal environments, University of California, Berkeley, 2003. [29] Wetterdienst Deutscher Ortsgenaue testreferenzjahre (try) von deutschland für mittlere und extreme witterungsverhältnisse 2017 Deutscher Wetterdienst, Ortsgenaue testreferenzjahre (try) von deutschland für mittlere und extreme witterungsverhältnisse (2017). [30] Hamels S. CO2 intensities and primary energy factors in the future european electricity system Energies 14 8 2021 2165 10.3390/en14082165 S. Hamels, Co2 intensities and primary energy factors in the future european electricity system, Energies 14 (8) (2021) 2165. doi:https://doi.org/10.3390/en14082165.",
    "scopus-id": "85140720871",
    "coredata": {
        "eid": "1-s2.0-S036013232200868X",
        "dc:description": "Conventional heat supply systems for indoor environments merely show annual efficiencies of net energy usage for room heating of 70% to 80% due to an inertia-related oversupply in unoccupied periods. In this study, a new method for increasing this efficiency is introduced. Low-capacity, direct electric heating systems are used to realize an occupancy-equivalent heating concept which only heats the room during occupancy. Using a fast-responding infrared sensor, these heating systems can be controlled by operative temperature, preventing significant oversupplies whilst rapidly heating up a space. A model-based algorithm enables a setback of the room temperature in unoccupied periods while guaranteeing a predefined temperature in the beginning of occupied periods. Thus, the control algorithm enables a utility-equivalent heating operation compared to a non-setback operation. During a first parameter study, net energy savings of up to 21% could be realized due to the new control method compared to a conventional schedule-based operation. The reheating factor of the heat supply system is identified as the main indicator affecting the energy saving potential in occasionally occupied rooms.",
        "openArchiveArticle": "false",
        "prism:coverDate": "2022-12-31",
        "openaccessUserLicense": null,
        "prism:aggregationType": "Journal",
        "prism:url": "https://api.elsevier.com/content/article/pii/S036013232200868X",
        "dc:creator": [
            {
                "@_fa": "true",
                "$": "Schmitt, Lukas"
            },
            {
                "@_fa": "true",
                "$": "Schaub, Michael"
            },
            {
                "@_fa": "true",
                "$": "Brandt, Stefan"
            },
            {
                "@_fa": "true",
                "$": "Kriegel, Martin"
            }
        ],
        "link": [
            {
                "@_fa": "true",
                "@rel": "self",
                "@href": "https://api.elsevier.com/content/article/pii/S036013232200868X"
            },
            {
                "@_fa": "true",
                "@rel": "scidir",
                "@href": "https://www.sciencedirect.com/science/article/pii/S036013232200868X"
            }
        ],
        "dc:format": "application/json",
        "openaccessType": null,
        "pii": "S0360-1323(22)00868-X",
        "prism:volume": "226",
        "articleNumber": "109638",
        "prism:publisher": "Elsevier Ltd.",
        "dc:title": "Occupancy-equivalent, operative temperature control for an energy-saving operation of direct electric, low-capacity heating systems",
        "prism:copyright": "© 2022 Elsevier Ltd. All rights reserved.",
        "openaccess": "0",
        "prism:issn": "03601323",
        "dcterms:subject": [
            {
                "@_fa": "true",
                "$": "Operative temperature control"
            },
            {
                "@_fa": "true",
                "$": "Occupancy-equivalent heating"
            },
            {
                "@_fa": "true",
                "$": "Direct electric heating"
            },
            {
                "@_fa": "true",
                "$": "Radiative heating"
            },
            {
                "@_fa": "true",
                "$": "Heat transfer"
            }
        ],
        "openaccessArticle": "false",
        "prism:publicationName": "Building and Environment",
        "openaccessSponsorType": null,
        "prism:pageRange": "109638",
        "pubType": "fla",
        "prism:coverDisplayDate": "December 2022",
        "prism:doi": "10.1016/j.buildenv.2022.109638",
        "prism:startingPage": "109638",
        "dc:identifier": "doi:10.1016/j.buildenv.2022.109638",
        "openaccessSponsorName": null
    },
    "objects": {"object": [
        {
            "@category": "standard",
            "@height": "255",
            "@width": "569",
            "@_fa": "true",
            "$": "https://api.elsevier.com/content/object/eid/1-s2.0-S036013232200868X-gr10.jpg?httpAccept=%2A%2F%2A",
            "@multimediatype": "JPEG image file",
            "@type": "IMAGE-DOWNSAMPLED",
            "@size": "26792",
            "@ref": "gr10",
            "@mimetype": "image/jpeg"
        },
        {
            "@category": "standard",
            "@height": "525",
            "@width": "373",
            "@_fa": "true",
            "$": "https://api.elsevier.com/content/object/eid/1-s2.0-S036013232200868X-gr14.jpg?httpAccept=%2A%2F%2A",
            "@multimediatype": "JPEG image file",
            "@type": "IMAGE-DOWNSAMPLED",
            "@size": "84437",
            "@ref": "gr14",
            "@mimetype": "image/jpeg"
        },
        {
            "@category": "standard",
            "@height": "514",
            "@width": "783",
            "@_fa": "true",
            "$": "https://api.elsevier.com/content/object/eid/1-s2.0-S036013232200868X-gr13.jpg?httpAccept=%2A%2F%2A",
            "@multimediatype": "JPEG image file",
            "@type": "IMAGE-DOWNSAMPLED",
            "@size": "98911",
            "@ref": "gr13",
            "@mimetype": "image/jpeg"
        },
        {
            "@category": "standard",
            "@height": "381",
            "@width": "378",
            "@_fa": "true",
            "$": "https://api.elsevier.com/content/object/eid/1-s2.0-S036013232200868X-gr12.jpg?httpAccept=%2A%2F%2A",
            "@multimediatype": "JPEG image file",
            "@type": "IMAGE-DOWNSAMPLED",
            "@size": "33585",
            "@ref": "gr12",
            "@mimetype": "image/jpeg"
        },
        {
            "@category": "standard",
            "@height": "278",
            "@width": "386",
            "@_fa": "true",
            "$": "https://api.elsevier.com/content/object/eid/1-s2.0-S036013232200868X-gr11.jpg?httpAccept=%2A%2F%2A",
            "@multimediatype": "JPEG image file",
            "@type": "IMAGE-DOWNSAMPLED",
            "@size": "28450",
            "@ref": "gr11",
            "@mimetype": "image/jpeg"
        },
        {
            "@category": "standard",
            "@height": "484",
            "@width": "369",
            "@_fa": "true",
            "$": "https://api.elsevier.com/content/object/eid/1-s2.0-S036013232200868X-gr9.jpg?httpAccept=%2A%2F%2A",
            "@multimediatype": "JPEG image file",
            "@type": "IMAGE-DOWNSAMPLED",
            "@size": "58643",
            "@ref": "gr9",
            "@mimetype": "image/jpeg"
        },
        {
            "@category": "standard",
            "@height": "218",
            "@width": "375",
            "@_fa": "true",
            "$": "https://api.elsevier.com/content/object/eid/1-s2.0-S036013232200868X-gr8.jpg?httpAccept=%2A%2F%2A",
            "@multimediatype": "JPEG image file",
            "@type": "IMAGE-DOWNSAMPLED",
            "@size": "34295",
            "@ref": "gr8",
            "@mimetype": "image/jpeg"
        },
        {
            "@category": "standard",
            "@height": "287",
            "@width": "369",
            "@_fa": "true",
            "$": "https://api.elsevier.com/content/object/eid/1-s2.0-S036013232200868X-gr7.jpg?httpAccept=%2A%2F%2A",
            "@multimediatype": "JPEG image file",
            "@type": "IMAGE-DOWNSAMPLED",
            "@size": "42114",
            "@ref": "gr7",
            "@mimetype": "image/jpeg"
        },
        {
            "@category": "standard",
            "@height": "294",
            "@width": "388",
            "@_fa": "true",
            "$": "https://api.elsevier.com/content/object/eid/1-s2.0-S036013232200868X-gr6.jpg?httpAccept=%2A%2F%2A",
            "@multimediatype": "JPEG image file",
            "@type": "IMAGE-DOWNSAMPLED",
            "@size": "23744",
            "@ref": "gr6",
            "@mimetype": "image/jpeg"
        },
        {
            "@category": "standard",
            "@height": "337",
            "@width": "612",
            "@_fa": "true",
            "$": "https://api.elsevier.com/content/object/eid/1-s2.0-S036013232200868X-gr5.jpg?httpAccept=%2A%2F%2A",
            "@multimediatype": "JPEG image file",
            "@type": "IMAGE-DOWNSAMPLED",
            "@size": "50074",
            "@ref": "gr5",
            "@mimetype": "image/jpeg"
        },
        {
            "@category": "standard",
            "@height": "617",
            "@width": "701",
            "@_fa": "true",
            "$": "https://api.elsevier.com/content/object/eid/1-s2.0-S036013232200868X-gr4.jpg?httpAccept=%2A%2F%2A",
            "@multimediatype": "JPEG image file",
            "@type": "IMAGE-DOWNSAMPLED",
            "@size": "72631",
            "@ref": "gr4",
            "@mimetype": "image/jpeg"
        },
        {
            "@category": "standard",
            "@height": "273",
            "@width": "571",
            "@_fa": "true",
            "$": "https://api.elsevier.com/content/object/eid/1-s2.0-S036013232200868X-gr3.jpg?httpAccept=%2A%2F%2A",
            "@multimediatype": "JPEG image file",
            "@type": "IMAGE-DOWNSAMPLED",
            "@size": "30706",
            "@ref": "gr3",
            "@mimetype": "image/jpeg"
        },
        {
            "@category": "standard",
            "@height": "235",
            "@width": "327",
            "@_fa": "true",
            "$": "https://api.elsevier.com/content/object/eid/1-s2.0-S036013232200868X-gr2.jpg?httpAccept=%2A%2F%2A",
            "@multimediatype": "JPEG image file",
            "@type": "IMAGE-DOWNSAMPLED",
            "@size": "103979",
            "@ref": "gr2",
            "@mimetype": "image/jpeg"
        },
        {
            "@category": "standard",
            "@height": "272",
            "@width": "294",
            "@_fa": "true",
            "$": "https://api.elsevier.com/content/object/eid/1-s2.0-S036013232200868X-gr1.jpg?httpAccept=%2A%2F%2A",
            "@multimediatype": "JPEG image file",
            "@type": "IMAGE-DOWNSAMPLED",
            "@size": "36372",
            "@ref": "gr1",
            "@mimetype": "image/jpeg"
        },
        {
            "@category": "thumbnail",
            "@height": "98",
            "@width": "219",
            "@_fa": "true",
            "$": "https://api.elsevier.com/content/object/eid/1-s2.0-S036013232200868X-gr10.sml?httpAccept=%2A%2F%2A",
            "@multimediatype": "GIF image file",
            "@type": "IMAGE-THUMBNAIL",
            "@size": "11092",
            "@ref": "gr10",
            "@mimetype": "image/gif"
        },
        {
            "@category": "thumbnail",
            "@height": "163",
            "@width": "116",
            "@_fa": "true",
            "$": "https://api.elsevier.com/content/object/eid/1-s2.0-S036013232200868X-gr14.sml?httpAccept=%2A%2F%2A",
            "@multimediatype": "GIF image file",
            "@type": "IMAGE-THUMBNAIL",
            "@size": "22193",
            "@ref": "gr14",
            "@mimetype": "image/gif"
        },
        {
            "@category": "thumbnail",
            "@height": "144",
            "@width": "219",
            "@_fa": "true",
            "$": "https://api.elsevier.com/content/object/eid/1-s2.0-S036013232200868X-gr13.sml?httpAccept=%2A%2F%2A",
            "@multimediatype": "GIF image file",
            "@type": "IMAGE-THUMBNAIL",
            "@size": "17369",
            "@ref": "gr13",
            "@mimetype": "image/gif"
        },
        {
            "@category": "thumbnail",
            "@height": "164",
            "@width": "163",
            "@_fa": "true",
            "$": "https://api.elsevier.com/content/object/eid/1-s2.0-S036013232200868X-gr12.sml?httpAccept=%2A%2F%2A",
            "@multimediatype": "GIF image file",
            "@type": "IMAGE-THUMBNAIL",
            "@size": "13853",
            "@ref": "gr12",
            "@mimetype": "image/gif"
        },
        {
            "@category": "thumbnail",
            "@height": "158",
            "@width": "219",
            "@_fa": "true",
            "$": "https://api.elsevier.com/content/object/eid/1-s2.0-S036013232200868X-gr11.sml?httpAccept=%2A%2F%2A",
            "@multimediatype": "GIF image file",
            "@type": "IMAGE-THUMBNAIL",
            "@size": "12477",
            "@ref": "gr11",
            "@mimetype": "image/gif"
        },
        {
            "@category": "thumbnail",
            "@height": "164",
            "@width": "125",
            "@_fa": "true",
            "$": "https://api.elsevier.com/content/object/eid/1-s2.0-S036013232200868X-gr9.sml?httpAccept=%2A%2F%2A",
            "@multimediatype": "GIF image file",
            "@type": "IMAGE-THUMBNAIL",
            "@size": "16109",
            "@ref": "gr9",
            "@mimetype": "image/gif"
        },
        {
            "@category": "thumbnail",
            "@height": "127",
            "@width": "219",
            "@_fa": "true",
            "$": "https://api.elsevier.com/content/object/eid/1-s2.0-S036013232200868X-gr8.sml?httpAccept=%2A%2F%2A",
            "@multimediatype": "GIF image file",
            "@type": "IMAGE-THUMBNAIL",
            "@size": "19022",
            "@ref": "gr8",
            "@mimetype": "image/gif"
        },
        {
            "@category": "thumbnail",
            "@height": "164",
            "@width": "211",
            "@_fa": "true",
            "$": "https://api.elsevier.com/content/object/eid/1-s2.0-S036013232200868X-gr7.sml?httpAccept=%2A%2F%2A",
            "@multimediatype": "GIF image file",
            "@type": "IMAGE-THUMBNAIL",
            "@size": "17184",
            "@ref": "gr7",
            "@mimetype": "image/gif"
        },
        {
            "@category": "thumbnail",
            "@height": "164",
            "@width": "217",
            "@_fa": "true",
            "$": "https://api.elsevier.com/content/object/eid/1-s2.0-S036013232200868X-gr6.sml?httpAccept=%2A%2F%2A",
            "@multimediatype": "GIF image file",
            "@type": "IMAGE-THUMBNAIL",
            "@size": "11908",
            "@ref": "gr6",
            "@mimetype": "image/gif"
        },
        {
            "@category": "thumbnail",
            "@height": "120",
            "@width": "219",
            "@_fa": "true",
            "$": "https://api.elsevier.com/content/object/eid/1-s2.0-S036013232200868X-gr5.sml?httpAccept=%2A%2F%2A",
            "@multimediatype": "GIF image file",
            "@type": "IMAGE-THUMBNAIL",
            "@size": "11991",
            "@ref": "gr5",
            "@mimetype": "image/gif"
        },
        {
            "@category": "thumbnail",
            "@height": "164",
            "@width": "186",
            "@_fa": "true",
            "$": "https://api.elsevier.com/content/object/eid/1-s2.0-S036013232200868X-gr4.sml?httpAccept=%2A%2F%2A",
            "@multimediatype": "GIF image file",
            "@type": "IMAGE-THUMBNAIL",
            "@size": "15952",
            "@ref": "gr4",
            "@mimetype": "image/gif"
        },
        {
            "@category": "thumbnail",
            "@height": "105",
            "@width": "219",
            "@_fa": "true",
            "$": "https://api.elsevier.com/content/object/eid/1-s2.0-S036013232200868X-gr3.sml?httpAccept=%2A%2F%2A",
            "@multimediatype": "GIF image file",
            "@type": "IMAGE-THUMBNAIL",
            "@size": "11403",
            "@ref": "gr3",
            "@mimetype": "image/gif"
        },
        {
            "@category": "thumbnail",
            "@height": "157",
            "@width": "219",
            "@_fa": "true",
            "$": "https://api.elsevier.com/content/object/eid/1-s2.0-S036013232200868X-gr2.sml?httpAccept=%2A%2F%2A",
            "@multimediatype": "GIF image file",
            "@type": "IMAGE-THUMBNAIL",
            "@size": "98116",
            "@ref": "gr2",
            "@mimetype": "image/gif"
        },
        {
            "@category": "thumbnail",
            "@height": "164",
            "@width": "177",
            "@_fa": "true",
            "$": "https://api.elsevier.com/content/object/eid/1-s2.0-S036013232200868X-gr1.sml?httpAccept=%2A%2F%2A",
            "@multimediatype": "GIF image file",
            "@type": "IMAGE-THUMBNAIL",
            "@size": "17222",
            "@ref": "gr1",
            "@mimetype": "image/gif"
        },
        {
            "@category": "high",
            "@height": "1130",
            "@width": "2521",
            "@_fa": "true",
            "$": "https://api.elsevier.com/content/object/eid/1-s2.0-S036013232200868X-gr10_lrg.jpg?httpAccept=%2A%2F%2A",
            "@multimediatype": "JPEG image file",
            "@type": "IMAGE-HIGH-RES",
            "@size": "132733",
            "@ref": "gr10",
            "@mimetype": "image/jpeg"
        },
        {
            "@category": "high",
            "@height": "2324",
            "@width": "1652",
            "@_fa": "true",
            "$": "https://api.elsevier.com/content/object/eid/1-s2.0-S036013232200868X-gr14_lrg.jpg?httpAccept=%2A%2F%2A",
            "@multimediatype": "JPEG image file",
            "@type": "IMAGE-HIGH-RES",
            "@size": "658772",
            "@ref": "gr14",
            "@mimetype": "image/jpeg"
        },
        {
            "@category": "high",
            "@height": "2277",
            "@width": "3469",
            "@_fa": "true",
            "$": "https://api.elsevier.com/content/object/eid/1-s2.0-S036013232200868X-gr13_lrg.jpg?httpAccept=%2A%2F%2A",
            "@multimediatype": "JPEG image file",
            "@type": "IMAGE-HIGH-RES",
            "@size": "699447",
            "@ref": "gr13",
            "@mimetype": "image/jpeg"
        },
        {
            "@category": "high",
            "@height": "1686",
            "@width": "1674",
            "@_fa": "true",
            "$": "https://api.elsevier.com/content/object/eid/1-s2.0-S036013232200868X-gr12_lrg.jpg?httpAccept=%2A%2F%2A",
            "@multimediatype": "JPEG image file",
            "@type": "IMAGE-HIGH-RES",
            "@size": "163183",
            "@ref": "gr12",
            "@mimetype": "image/jpeg"
        },
        {
            "@category": "high",
            "@height": "1232",
            "@width": "1711",
            "@_fa": "true",
            "$": "https://api.elsevier.com/content/object/eid/1-s2.0-S036013232200868X-gr11_lrg.jpg?httpAccept=%2A%2F%2A",
            "@multimediatype": "JPEG image file",
            "@type": "IMAGE-HIGH-RES",
            "@size": "119011",
            "@ref": "gr11",
            "@mimetype": "image/jpeg"
        },
        {
            "@category": "high",
            "@height": "2142",
            "@width": "1634",
            "@_fa": "true",
            "$": "https://api.elsevier.com/content/object/eid/1-s2.0-S036013232200868X-gr9_lrg.jpg?httpAccept=%2A%2F%2A",
            "@multimediatype": "JPEG image file",
            "@type": "IMAGE-HIGH-RES",
            "@size": "378764",
            "@ref": "gr9",
            "@mimetype": "image/jpeg"
        },
        {
            "@category": "high",
            "@height": "964",
            "@width": "1661",
            "@_fa": "true",
            "$": "https://api.elsevier.com/content/object/eid/1-s2.0-S036013232200868X-gr8_lrg.jpg?httpAccept=%2A%2F%2A",
            "@multimediatype": "JPEG image file",
            "@type": "IMAGE-HIGH-RES",
            "@size": "189659",
            "@ref": "gr8",
            "@mimetype": "image/jpeg"
        },
        {
            "@category": "high",
            "@height": "1270",
            "@width": "1634",
            "@_fa": "true",
            "$": "https://api.elsevier.com/content/object/eid/1-s2.0-S036013232200868X-gr7_lrg.jpg?httpAccept=%2A%2F%2A",
            "@multimediatype": "JPEG image file",
            "@type": "IMAGE-HIGH-RES",
            "@size": "231367",
            "@ref": "gr7",
            "@mimetype": "image/jpeg"
        },
        {
            "@category": "high",
            "@height": "1299",
            "@width": "1717",
            "@_fa": "true",
            "$": "https://api.elsevier.com/content/object/eid/1-s2.0-S036013232200868X-gr6_lrg.jpg?httpAccept=%2A%2F%2A",
            "@multimediatype": "JPEG image file",
            "@type": "IMAGE-HIGH-RES",
            "@size": "108172",
            "@ref": "gr6",
            "@mimetype": "image/jpeg"
        },
        {
            "@category": "high",
            "@height": "1490",
            "@width": "2709",
            "@_fa": "true",
            "$": "https://api.elsevier.com/content/object/eid/1-s2.0-S036013232200868X-gr5_lrg.jpg?httpAccept=%2A%2F%2A",
            "@multimediatype": "JPEG image file",
            "@type": "IMAGE-HIGH-RES",
            "@size": "310045",
            "@ref": "gr5",
            "@mimetype": "image/jpeg"
        },
        {
            "@category": "high",
            "@height": "2732",
            "@width": "3106",
            "@_fa": "true",
            "$": "https://api.elsevier.com/content/object/eid/1-s2.0-S036013232200868X-gr4_lrg.jpg?httpAccept=%2A%2F%2A",
            "@multimediatype": "JPEG image file",
            "@type": "IMAGE-HIGH-RES",
            "@size": "449332",
            "@ref": "gr4",
            "@mimetype": "image/jpeg"
        },
        {
            "@category": "high",
            "@height": "1209",
            "@width": "2528",
            "@_fa": "true",
            "$": "https://api.elsevier.com/content/object/eid/1-s2.0-S036013232200868X-gr3_lrg.jpg?httpAccept=%2A%2F%2A",
            "@multimediatype": "JPEG image file",
            "@type": "IMAGE-HIGH-RES",
            "@size": "156322",
            "@ref": "gr3",
            "@mimetype": "image/jpeg"
        },
        {
            "@category": "high",
            "@height": "1039",
            "@width": "1448",
            "@_fa": "true",
            "$": "https://api.elsevier.com/content/object/eid/1-s2.0-S036013232200868X-gr2_lrg.jpg?httpAccept=%2A%2F%2A",
            "@multimediatype": "JPEG image file",
            "@type": "IMAGE-HIGH-RES",
            "@size": "597989",
            "@ref": "gr2",
            "@mimetype": "image/jpeg"
        },
        {
            "@category": "high",
            "@height": "1204",
            "@width": "1302",
            "@_fa": "true",
            "$": "https://api.elsevier.com/content/object/eid/1-s2.0-S036013232200868X-gr1_lrg.jpg?httpAccept=%2A%2F%2A",
            "@multimediatype": "JPEG image file",
            "@type": "IMAGE-HIGH-RES",
            "@size": "157877",
            "@ref": "gr1",
            "@mimetype": "image/jpeg"
        },
        {
            "@category": "thumbnail",
            "@_fa": "true",
            "$": "https://api.elsevier.com/content/object/eid/1-s2.0-S036013232200868X-si10.svg?httpAccept=%2A%2F%2A",
            "@multimediatype": "Scalable Vector Graphics file",
            "@type": "ALTIMG",
            "@size": "1200",
            "@ref": "si10",
            "@mimetype": "image/svg+xml"
        },
        {
            "@category": "thumbnail",
            "@_fa": "true",
            "$": "https://api.elsevier.com/content/object/eid/1-s2.0-S036013232200868X-si101.svg?httpAccept=%2A%2F%2A",
            "@multimediatype": "Scalable Vector Graphics file",
            "@type": "ALTIMG",
            "@size": "6588",
            "@ref": "si101",
            "@mimetype": "image/svg+xml"
        },
        {
            "@category": "thumbnail",
            "@_fa": "true",
            "$": "https://api.elsevier.com/content/object/eid/1-s2.0-S036013232200868X-si102.svg?httpAccept=%2A%2F%2A",
            "@multimediatype": "Scalable Vector Graphics file",
            "@type": "ALTIMG",
            "@size": "5402",
            "@ref": "si102",
            "@mimetype": "image/svg+xml"
        },
        {
            "@category": "thumbnail",
            "@_fa": "true",
            "$": "https://api.elsevier.com/content/object/eid/1-s2.0-S036013232200868X-si103.svg?httpAccept=%2A%2F%2A",
            "@multimediatype": "Scalable Vector Graphics file",
            "@type": "ALTIMG",
            "@size": "15150",
            "@ref": "si103",
            "@mimetype": "image/svg+xml"
        },
        {
            "@category": "thumbnail",
            "@_fa": "true",
            "$": "https://api.elsevier.com/content/object/eid/1-s2.0-S036013232200868X-si104.svg?httpAccept=%2A%2F%2A",
            "@multimediatype": "Scalable Vector Graphics file",
            "@type": "ALTIMG",
            "@size": "4544",
            "@ref": "si104",
            "@mimetype": "image/svg+xml"
        },
        {
            "@category": "thumbnail",
            "@_fa": "true",
            "$": "https://api.elsevier.com/content/object/eid/1-s2.0-S036013232200868X-si106.svg?httpAccept=%2A%2F%2A",
            "@multimediatype": "Scalable Vector Graphics file",
            "@type": "ALTIMG",
            "@size": "1305",
            "@ref": "si106",
            "@mimetype": "image/svg+xml"
        },
        {
            "@category": "thumbnail",
            "@_fa": "true",
            "$": "https://api.elsevier.com/content/object/eid/1-s2.0-S036013232200868X-si108.svg?httpAccept=%2A%2F%2A",
            "@multimediatype": "Scalable Vector Graphics file",
            "@type": "ALTIMG",
            "@size": "15160",
            "@ref": "si108",
            "@mimetype": "image/svg+xml"
        },
        {
            "@category": "thumbnail",
            "@_fa": "true",
            "$": "https://api.elsevier.com/content/object/eid/1-s2.0-S036013232200868X-si11.svg?httpAccept=%2A%2F%2A",
            "@multimediatype": "Scalable Vector Graphics file",
            "@type": "ALTIMG",
            "@size": "1089",
            "@ref": "si11",
            "@mimetype": "image/svg+xml"
        },
        {
            "@category": "thumbnail",
            "@_fa": "true",
            "$": "https://api.elsevier.com/content/object/eid/1-s2.0-S036013232200868X-si116.svg?httpAccept=%2A%2F%2A",
            "@multimediatype": "Scalable Vector Graphics file",
            "@type": "ALTIMG",
            "@size": "19983",
            "@ref": "si116",
            "@mimetype": "image/svg+xml"
        },
        {
            "@category": "thumbnail",
            "@_fa": "true",
            "$": "https://api.elsevier.com/content/object/eid/1-s2.0-S036013232200868X-si117.svg?httpAccept=%2A%2F%2A",
            "@multimediatype": "Scalable Vector Graphics file",
            "@type": "ALTIMG",
            "@size": "19629",
            "@ref": "si117",
            "@mimetype": "image/svg+xml"
        },
        {
            "@category": "thumbnail",
            "@_fa": "true",
            "$": "https://api.elsevier.com/content/object/eid/1-s2.0-S036013232200868X-si118.svg?httpAccept=%2A%2F%2A",
            "@multimediatype": "Scalable Vector Graphics file",
            "@type": "ALTIMG",
            "@size": "1918",
            "@ref": "si118",
            "@mimetype": "image/svg+xml"
        },
        {
            "@category": "thumbnail",
            "@_fa": "true",
            "$": "https://api.elsevier.com/content/object/eid/1-s2.0-S036013232200868X-si119.svg?httpAccept=%2A%2F%2A",
            "@multimediatype": "Scalable Vector Graphics file",
            "@type": "ALTIMG",
            "@size": "32731",
            "@ref": "si119",
            "@mimetype": "image/svg+xml"
        },
        {
            "@category": "thumbnail",
            "@_fa": "true",
            "$": "https://api.elsevier.com/content/object/eid/1-s2.0-S036013232200868X-si12.svg?httpAccept=%2A%2F%2A",
            "@multimediatype": "Scalable Vector Graphics file",
            "@type": "ALTIMG",
            "@size": "1027",
            "@ref": "si12",
            "@mimetype": "image/svg+xml"
        },
        {
            "@category": "thumbnail",
            "@_fa": "true",
            "$": "https://api.elsevier.com/content/object/eid/1-s2.0-S036013232200868X-si120.svg?httpAccept=%2A%2F%2A",
            "@multimediatype": "Scalable Vector Graphics file",
            "@type": "ALTIMG",
            "@size": "2285",
            "@ref": "si120",
            "@mimetype": "image/svg+xml"
        },
        {
            "@category": "thumbnail",
            "@_fa": "true",
            "$": "https://api.elsevier.com/content/object/eid/1-s2.0-S036013232200868X-si121.svg?httpAccept=%2A%2F%2A",
            "@multimediatype": "Scalable Vector Graphics file",
            "@type": "ALTIMG",
            "@size": "2250",
            "@ref": "si121",
            "@mimetype": "image/svg+xml"
        },
        {
            "@category": "thumbnail",
            "@_fa": "true",
            "$": "https://api.elsevier.com/content/object/eid/1-s2.0-S036013232200868X-si122.svg?httpAccept=%2A%2F%2A",
            "@multimediatype": "Scalable Vector Graphics file",
            "@type": "ALTIMG",
            "@size": "3214",
            "@ref": "si122",
            "@mimetype": "image/svg+xml"
        },
        {
            "@category": "thumbnail",
            "@_fa": "true",
            "$": "https://api.elsevier.com/content/object/eid/1-s2.0-S036013232200868X-si123.svg?httpAccept=%2A%2F%2A",
            "@multimediatype": "Scalable Vector Graphics file",
            "@type": "ALTIMG",
            "@size": "3178",
            "@ref": "si123",
            "@mimetype": "image/svg+xml"
        },
        {
            "@category": "thumbnail",
            "@_fa": "true",
            "$": "https://api.elsevier.com/content/object/eid/1-s2.0-S036013232200868X-si126.svg?httpAccept=%2A%2F%2A",
            "@multimediatype": "Scalable Vector Graphics file",
            "@type": "ALTIMG",
            "@size": "3541",
            "@ref": "si126",
            "@mimetype": "image/svg+xml"
        },
        {
            "@category": "thumbnail",
            "@_fa": "true",
            "$": "https://api.elsevier.com/content/object/eid/1-s2.0-S036013232200868X-si127.svg?httpAccept=%2A%2F%2A",
            "@multimediatype": "Scalable Vector Graphics file",
            "@type": "ALTIMG",
            "@size": "2587",
            "@ref": "si127",
            "@mimetype": "image/svg+xml"
        },
        {
            "@category": "thumbnail",
            "@_fa": "true",
            "$": "https://api.elsevier.com/content/object/eid/1-s2.0-S036013232200868X-si128.svg?httpAccept=%2A%2F%2A",
            "@multimediatype": "Scalable Vector Graphics file",
            "@type": "ALTIMG",
            "@size": "2552",
            "@ref": "si128",
            "@mimetype": "image/svg+xml"
        },
        {
            "@category": "thumbnail",
            "@_fa": "true",
            "$": "https://api.elsevier.com/content/object/eid/1-s2.0-S036013232200868X-si129.svg?httpAccept=%2A%2F%2A",
            "@multimediatype": "Scalable Vector Graphics file",
            "@type": "ALTIMG",
            "@size": "14195",
            "@ref": "si129",
            "@mimetype": "image/svg+xml"
        },
        {
            "@category": "thumbnail",
            "@_fa": "true",
            "$": "https://api.elsevier.com/content/object/eid/1-s2.0-S036013232200868X-si130.svg?httpAccept=%2A%2F%2A",
            "@multimediatype": "Scalable Vector Graphics file",
            "@type": "ALTIMG",
            "@size": "2697",
            "@ref": "si130",
            "@mimetype": "image/svg+xml"
        },
        {
            "@category": "thumbnail",
            "@_fa": "true",
            "$": "https://api.elsevier.com/content/object/eid/1-s2.0-S036013232200868X-si132.svg?httpAccept=%2A%2F%2A",
            "@multimediatype": "Scalable Vector Graphics file",
            "@type": "ALTIMG",
            "@size": "3156",
            "@ref": "si132",
            "@mimetype": "image/svg+xml"
        },
        {
            "@category": "thumbnail",
            "@_fa": "true",
            "$": "https://api.elsevier.com/content/object/eid/1-s2.0-S036013232200868X-si133.svg?httpAccept=%2A%2F%2A",
            "@multimediatype": "Scalable Vector Graphics file",
            "@type": "ALTIMG",
            "@size": "8416",
            "@ref": "si133",
            "@mimetype": "image/svg+xml"
        },
        {
            "@category": "thumbnail",
            "@_fa": "true",
            "$": "https://api.elsevier.com/content/object/eid/1-s2.0-S036013232200868X-si135.svg?httpAccept=%2A%2F%2A",
            "@multimediatype": "Scalable Vector Graphics file",
            "@type": "ALTIMG",
            "@size": "16332",
            "@ref": "si135",
            "@mimetype": "image/svg+xml"
        },
        {
            "@category": "thumbnail",
            "@_fa": "true",
            "$": "https://api.elsevier.com/content/object/eid/1-s2.0-S036013232200868X-si136.svg?httpAccept=%2A%2F%2A",
            "@multimediatype": "Scalable Vector Graphics file",
            "@type": "ALTIMG",
            "@size": "15901",
            "@ref": "si136",
            "@mimetype": "image/svg+xml"
        },
        {
            "@category": "thumbnail",
            "@_fa": "true",
            "$": "https://api.elsevier.com/content/object/eid/1-s2.0-S036013232200868X-si137.svg?httpAccept=%2A%2F%2A",
            "@multimediatype": "Scalable Vector Graphics file",
            "@type": "ALTIMG",
            "@size": "790",
            "@ref": "si137",
            "@mimetype": "image/svg+xml"
        },
        {
            "@category": "thumbnail",
            "@_fa": "true",
            "$": "https://api.elsevier.com/content/object/eid/1-s2.0-S036013232200868X-si14.svg?httpAccept=%2A%2F%2A",
            "@multimediatype": "Scalable Vector Graphics file",
            "@type": "ALTIMG",
            "@size": "1871",
            "@ref": "si14",
            "@mimetype": "image/svg+xml"
        },
        {
            "@category": "thumbnail",
            "@_fa": "true",
            "$": "https://api.elsevier.com/content/object/eid/1-s2.0-S036013232200868X-si144.svg?httpAccept=%2A%2F%2A",
            "@multimediatype": "Scalable Vector Graphics file",
            "@type": "ALTIMG",
            "@size": "2118",
            "@ref": "si144",
            "@mimetype": "image/svg+xml"
        },
        {
            "@category": "thumbnail",
            "@_fa": "true",
            "$": "https://api.elsevier.com/content/object/eid/1-s2.0-S036013232200868X-si147.svg?httpAccept=%2A%2F%2A",
            "@multimediatype": "Scalable Vector Graphics file",
            "@type": "ALTIMG",
            "@size": "6181",
            "@ref": "si147",
            "@mimetype": "image/svg+xml"
        },
        {
            "@category": "thumbnail",
            "@_fa": "true",
            "$": "https://api.elsevier.com/content/object/eid/1-s2.0-S036013232200868X-si148.svg?httpAccept=%2A%2F%2A",
            "@multimediatype": "Scalable Vector Graphics file",
            "@type": "ALTIMG",
            "@size": "4265",
            "@ref": "si148",
            "@mimetype": "image/svg+xml"
        },
        {
            "@category": "thumbnail",
            "@_fa": "true",
            "$": "https://api.elsevier.com/content/object/eid/1-s2.0-S036013232200868X-si15.svg?httpAccept=%2A%2F%2A",
            "@multimediatype": "Scalable Vector Graphics file",
            "@type": "ALTIMG",
            "@size": "1924",
            "@ref": "si15",
            "@mimetype": "image/svg+xml"
        },
        {
            "@category": "thumbnail",
            "@_fa": "true",
            "$": "https://api.elsevier.com/content/object/eid/1-s2.0-S036013232200868X-si151.svg?httpAccept=%2A%2F%2A",
            "@multimediatype": "Scalable Vector Graphics file",
            "@type": "ALTIMG",
            "@size": "3034",
            "@ref": "si151",
            "@mimetype": "image/svg+xml"
        },
        {
            "@category": "thumbnail",
            "@_fa": "true",
            "$": "https://api.elsevier.com/content/object/eid/1-s2.0-S036013232200868X-si152.svg?httpAccept=%2A%2F%2A",
            "@multimediatype": "Scalable Vector Graphics file",
            "@type": "ALTIMG",
            "@size": "4447",
            "@ref": "si152",
            "@mimetype": "image/svg+xml"
        },
        {
            "@category": "thumbnail",
            "@_fa": "true",
            "$": "https://api.elsevier.com/content/object/eid/1-s2.0-S036013232200868X-si153.svg?httpAccept=%2A%2F%2A",
            "@multimediatype": "Scalable Vector Graphics file",
            "@type": "ALTIMG",
            "@size": "1743",
            "@ref": "si153",
            "@mimetype": "image/svg+xml"
        },
        {
            "@category": "thumbnail",
            "@_fa": "true",
            "$": "https://api.elsevier.com/content/object/eid/1-s2.0-S036013232200868X-si154.svg?httpAccept=%2A%2F%2A",
            "@multimediatype": "Scalable Vector Graphics file",
            "@type": "ALTIMG",
            "@size": "4160",
            "@ref": "si154",
            "@mimetype": "image/svg+xml"
        },
        {
            "@category": "thumbnail",
            "@_fa": "true",
            "$": "https://api.elsevier.com/content/object/eid/1-s2.0-S036013232200868X-si156.svg?httpAccept=%2A%2F%2A",
            "@multimediatype": "Scalable Vector Graphics file",
            "@type": "ALTIMG",
            "@size": "7881",
            "@ref": "si156",
            "@mimetype": "image/svg+xml"
        },
        {
            "@category": "thumbnail",
            "@_fa": "true",
            "$": "https://api.elsevier.com/content/object/eid/1-s2.0-S036013232200868X-si157.svg?httpAccept=%2A%2F%2A",
            "@multimediatype": "Scalable Vector Graphics file",
            "@type": "ALTIMG",
            "@size": "5071",
            "@ref": "si157",
            "@mimetype": "image/svg+xml"
        },
        {
            "@category": "thumbnail",
            "@_fa": "true",
            "$": "https://api.elsevier.com/content/object/eid/1-s2.0-S036013232200868X-si158.svg?httpAccept=%2A%2F%2A",
            "@multimediatype": "Scalable Vector Graphics file",
            "@type": "ALTIMG",
            "@size": "4661",
            "@ref": "si158",
            "@mimetype": "image/svg+xml"
        },
        {
            "@category": "thumbnail",
            "@_fa": "true",
            "$": "https://api.elsevier.com/content/object/eid/1-s2.0-S036013232200868X-si16.svg?httpAccept=%2A%2F%2A",
            "@multimediatype": "Scalable Vector Graphics file",
            "@type": "ALTIMG",
            "@size": "2281",
            "@ref": "si16",
            "@mimetype": "image/svg+xml"
        },
        {
            "@category": "thumbnail",
            "@_fa": "true",
            "$": "https://api.elsevier.com/content/object/eid/1-s2.0-S036013232200868X-si160.svg?httpAccept=%2A%2F%2A",
            "@multimediatype": "Scalable Vector Graphics file",
            "@type": "ALTIMG",
            "@size": "4221",
            "@ref": "si160",
            "@mimetype": "image/svg+xml"
        },
        {
            "@category": "thumbnail",
            "@_fa": "true",
            "$": "https://api.elsevier.com/content/object/eid/1-s2.0-S036013232200868X-si161.svg?httpAccept=%2A%2F%2A",
            "@multimediatype": "Scalable Vector Graphics file",
            "@type": "ALTIMG",
            "@size": "7752",
            "@ref": "si161",
            "@mimetype": "image/svg+xml"
        },
        {
            "@category": "thumbnail",
            "@_fa": "true",
            "$": "https://api.elsevier.com/content/object/eid/1-s2.0-S036013232200868X-si162.svg?httpAccept=%2A%2F%2A",
            "@multimediatype": "Scalable Vector Graphics file",
            "@type": "ALTIMG",
            "@size": "4089",
            "@ref": "si162",
            "@mimetype": "image/svg+xml"
        },
        {
            "@category": "thumbnail",
            "@_fa": "true",
            "$": "https://api.elsevier.com/content/object/eid/1-s2.0-S036013232200868X-si163.svg?httpAccept=%2A%2F%2A",
            "@multimediatype": "Scalable Vector Graphics file",
            "@type": "ALTIMG",
            "@size": "5338",
            "@ref": "si163",
            "@mimetype": "image/svg+xml"
        },
        {
            "@category": "thumbnail",
            "@_fa": "true",
            "$": "https://api.elsevier.com/content/object/eid/1-s2.0-S036013232200868X-si166.svg?httpAccept=%2A%2F%2A",
            "@multimediatype": "Scalable Vector Graphics file",
            "@type": "ALTIMG",
            "@size": "3957",
            "@ref": "si166",
            "@mimetype": "image/svg+xml"
        },
        {
            "@category": "thumbnail",
            "@_fa": "true",
            "$": "https://api.elsevier.com/content/object/eid/1-s2.0-S036013232200868X-si167.svg?httpAccept=%2A%2F%2A",
            "@multimediatype": "Scalable Vector Graphics file",
            "@type": "ALTIMG",
            "@size": "42614",
            "@ref": "si167",
            "@mimetype": "image/svg+xml"
        },
        {
            "@category": "thumbnail",
            "@_fa": "true",
            "$": "https://api.elsevier.com/content/object/eid/1-s2.0-S036013232200868X-si17.svg?httpAccept=%2A%2F%2A",
            "@multimediatype": "Scalable Vector Graphics file",
            "@type": "ALTIMG",
            "@size": "2627",
            "@ref": "si17",
            "@mimetype": "image/svg+xml"
        },
        {
            "@category": "thumbnail",
            "@_fa": "true",
            "$": "https://api.elsevier.com/content/object/eid/1-s2.0-S036013232200868X-si170.svg?httpAccept=%2A%2F%2A",
            "@multimediatype": "Scalable Vector Graphics file",
            "@type": "ALTIMG",
            "@size": "6610",
            "@ref": "si170",
            "@mimetype": "image/svg+xml"
        },
        {
            "@category": "thumbnail",
            "@_fa": "true",
            "$": "https://api.elsevier.com/content/object/eid/1-s2.0-S036013232200868X-si172.svg?httpAccept=%2A%2F%2A",
            "@multimediatype": "Scalable Vector Graphics file",
            "@type": "ALTIMG",
            "@size": "2247",
            "@ref": "si172",
            "@mimetype": "image/svg+xml"
        },
        {
            "@category": "thumbnail",
            "@_fa": "true",
            "$": "https://api.elsevier.com/content/object/eid/1-s2.0-S036013232200868X-si173.svg?httpAccept=%2A%2F%2A",
            "@multimediatype": "Scalable Vector Graphics file",
            "@type": "ALTIMG",
            "@size": "4146",
            "@ref": "si173",
            "@mimetype": "image/svg+xml"
        },
        {
            "@category": "thumbnail",
            "@_fa": "true",
            "$": "https://api.elsevier.com/content/object/eid/1-s2.0-S036013232200868X-si174.svg?httpAccept=%2A%2F%2A",
            "@multimediatype": "Scalable Vector Graphics file",
            "@type": "ALTIMG",
            "@size": "2363",
            "@ref": "si174",
            "@mimetype": "image/svg+xml"
        },
        {
            "@category": "thumbnail",
            "@_fa": "true",
            "$": "https://api.elsevier.com/content/object/eid/1-s2.0-S036013232200868X-si175.svg?httpAccept=%2A%2F%2A",
            "@multimediatype": "Scalable Vector Graphics file",
            "@type": "ALTIMG",
            "@size": "2643",
            "@ref": "si175",
            "@mimetype": "image/svg+xml"
        },
        {
            "@category": "thumbnail",
            "@_fa": "true",
            "$": "https://api.elsevier.com/content/object/eid/1-s2.0-S036013232200868X-si178.svg?httpAccept=%2A%2F%2A",
            "@multimediatype": "Scalable Vector Graphics file",
            "@type": "ALTIMG",
            "@size": "9362",
            "@ref": "si178",
            "@mimetype": "image/svg+xml"
        },
        {
            "@category": "thumbnail",
            "@_fa": "true",
            "$": "https://api.elsevier.com/content/object/eid/1-s2.0-S036013232200868X-si18.svg?httpAccept=%2A%2F%2A",
            "@multimediatype": "Scalable Vector Graphics file",
            "@type": "ALTIMG",
            "@size": "2246",
            "@ref": "si18",
            "@mimetype": "image/svg+xml"
        },
        {
            "@category": "thumbnail",
            "@_fa": "true",
            "$": "https://api.elsevier.com/content/object/eid/1-s2.0-S036013232200868X-si182.svg?httpAccept=%2A%2F%2A",
            "@multimediatype": "Scalable Vector Graphics file",
            "@type": "ALTIMG",
            "@size": "6452",
            "@ref": "si182",
            "@mimetype": "image/svg+xml"
        },
        {
            "@category": "thumbnail",
            "@_fa": "true",
            "$": "https://api.elsevier.com/content/object/eid/1-s2.0-S036013232200868X-si185.svg?httpAccept=%2A%2F%2A",
            "@multimediatype": "Scalable Vector Graphics file",
            "@type": "ALTIMG",
            "@size": "3753",
            "@ref": "si185",
            "@mimetype": "image/svg+xml"
        },
        {
            "@category": "thumbnail",
            "@_fa": "true",
            "$": "https://api.elsevier.com/content/object/eid/1-s2.0-S036013232200868X-si188.svg?httpAccept=%2A%2F%2A",
            "@multimediatype": "Scalable Vector Graphics file",
            "@type": "ALTIMG",
            "@size": "28962",
            "@ref": "si188",
            "@mimetype": "image/svg+xml"
        },
        {
            "@category": "thumbnail",
            "@_fa": "true",
            "$": "https://api.elsevier.com/content/object/eid/1-s2.0-S036013232200868X-si19.svg?httpAccept=%2A%2F%2A",
            "@multimediatype": "Scalable Vector Graphics file",
            "@type": "ALTIMG",
            "@size": "2672",
            "@ref": "si19",
            "@mimetype": "image/svg+xml"
        },
        {
            "@category": "thumbnail",
            "@_fa": "true",
            "$": "https://api.elsevier.com/content/object/eid/1-s2.0-S036013232200868X-si191.svg?httpAccept=%2A%2F%2A",
            "@multimediatype": "Scalable Vector Graphics file",
            "@type": "ALTIMG",
            "@size": "6469",
            "@ref": "si191",
            "@mimetype": "image/svg+xml"
        },
        {
            "@category": "thumbnail",
            "@_fa": "true",
            "$": "https://api.elsevier.com/content/object/eid/1-s2.0-S036013232200868X-si192.svg?httpAccept=%2A%2F%2A",
            "@multimediatype": "Scalable Vector Graphics file",
            "@type": "ALTIMG",
            "@size": "5977",
            "@ref": "si192",
            "@mimetype": "image/svg+xml"
        },
        {
            "@category": "thumbnail",
            "@_fa": "true",
            "$": "https://api.elsevier.com/content/object/eid/1-s2.0-S036013232200868X-si193.svg?httpAccept=%2A%2F%2A",
            "@multimediatype": "Scalable Vector Graphics file",
            "@type": "ALTIMG",
            "@size": "6218",
            "@ref": "si193",
            "@mimetype": "image/svg+xml"
        },
        {
            "@category": "thumbnail",
            "@_fa": "true",
            "$": "https://api.elsevier.com/content/object/eid/1-s2.0-S036013232200868X-si194.svg?httpAccept=%2A%2F%2A",
            "@multimediatype": "Scalable Vector Graphics file",
            "@type": "ALTIMG",
            "@size": "2294",
            "@ref": "si194",
            "@mimetype": "image/svg+xml"
        },
        {
            "@category": "thumbnail",
            "@_fa": "true",
            "$": "https://api.elsevier.com/content/object/eid/1-s2.0-S036013232200868X-si198.svg?httpAccept=%2A%2F%2A",
            "@multimediatype": "Scalable Vector Graphics file",
            "@type": "ALTIMG",
            "@size": "4949",
            "@ref": "si198",
            "@mimetype": "image/svg+xml"
        },
        {
            "@category": "thumbnail",
            "@_fa": "true",
            "$": "https://api.elsevier.com/content/object/eid/1-s2.0-S036013232200868X-si199.svg?httpAccept=%2A%2F%2A",
            "@multimediatype": "Scalable Vector Graphics file",
            "@type": "ALTIMG",
            "@size": "3225",
            "@ref": "si199",
            "@mimetype": "image/svg+xml"
        },
        {
            "@category": "thumbnail",
            "@_fa": "true",
            "$": "https://api.elsevier.com/content/object/eid/1-s2.0-S036013232200868X-si20.svg?httpAccept=%2A%2F%2A",
            "@multimediatype": "Scalable Vector Graphics file",
            "@type": "ALTIMG",
            "@size": "2138",
            "@ref": "si20",
            "@mimetype": "image/svg+xml"
        },
        {
            "@category": "thumbnail",
            "@_fa": "true",
            "$": "https://api.elsevier.com/content/object/eid/1-s2.0-S036013232200868X-si21.svg?httpAccept=%2A%2F%2A",
            "@multimediatype": "Scalable Vector Graphics file",
            "@type": "ALTIMG",
            "@size": "1688",
            "@ref": "si21",
            "@mimetype": "image/svg+xml"
        },
        {
            "@category": "thumbnail",
            "@_fa": "true",
            "$": "https://api.elsevier.com/content/object/eid/1-s2.0-S036013232200868X-si22.svg?httpAccept=%2A%2F%2A",
            "@multimediatype": "Scalable Vector Graphics file",
            "@type": "ALTIMG",
            "@size": "1211",
            "@ref": "si22",
            "@mimetype": "image/svg+xml"
        },
        {
            "@category": "thumbnail",
            "@_fa": "true",
            "$": "https://api.elsevier.com/content/object/eid/1-s2.0-S036013232200868X-si23.svg?httpAccept=%2A%2F%2A",
            "@multimediatype": "Scalable Vector Graphics file",
            "@type": "ALTIMG",
            "@size": "1233",
            "@ref": "si23",
            "@mimetype": "image/svg+xml"
        },
        {
            "@category": "thumbnail",
            "@_fa": "true",
            "$": "https://api.elsevier.com/content/object/eid/1-s2.0-S036013232200868X-si24.svg?httpAccept=%2A%2F%2A",
            "@multimediatype": "Scalable Vector Graphics file",
            "@type": "ALTIMG",
            "@size": "1623",
            "@ref": "si24",
            "@mimetype": "image/svg+xml"
        },
        {
            "@category": "thumbnail",
            "@_fa": "true",
            "$": "https://api.elsevier.com/content/object/eid/1-s2.0-S036013232200868X-si25.svg?httpAccept=%2A%2F%2A",
            "@multimediatype": "Scalable Vector Graphics file",
            "@type": "ALTIMG",
            "@size": "1784",
            "@ref": "si25",
            "@mimetype": "image/svg+xml"
        },
        {
            "@category": "thumbnail",
            "@_fa": "true",
            "$": "https://api.elsevier.com/content/object/eid/1-s2.0-S036013232200868X-si26.svg?httpAccept=%2A%2F%2A",
            "@multimediatype": "Scalable Vector Graphics file",
            "@type": "ALTIMG",
            "@size": "1553",
            "@ref": "si26",
            "@mimetype": "image/svg+xml"
        },
        {
            "@category": "thumbnail",
            "@_fa": "true",
            "$": "https://api.elsevier.com/content/object/eid/1-s2.0-S036013232200868X-si27.svg?httpAccept=%2A%2F%2A",
            "@multimediatype": "Scalable Vector Graphics file",
            "@type": "ALTIMG",
            "@size": "1069",
            "@ref": "si27",
            "@mimetype": "image/svg+xml"
        },
        {
            "@category": "thumbnail",
            "@_fa": "true",
            "$": "https://api.elsevier.com/content/object/eid/1-s2.0-S036013232200868X-si28.svg?httpAccept=%2A%2F%2A",
            "@multimediatype": "Scalable Vector Graphics file",
            "@type": "ALTIMG",
            "@size": "1175",
            "@ref": "si28",
            "@mimetype": "image/svg+xml"
        },
        {
            "@category": "thumbnail",
            "@_fa": "true",
            "$": "https://api.elsevier.com/content/object/eid/1-s2.0-S036013232200868X-si29.svg?httpAccept=%2A%2F%2A",
            "@multimediatype": "Scalable Vector Graphics file",
            "@type": "ALTIMG",
            "@size": "1587",
            "@ref": "si29",
            "@mimetype": "image/svg+xml"
        },
        {
            "@category": "thumbnail",
            "@_fa": "true",
            "$": "https://api.elsevier.com/content/object/eid/1-s2.0-S036013232200868X-si3.svg?httpAccept=%2A%2F%2A",
            "@multimediatype": "Scalable Vector Graphics file",
            "@type": "ALTIMG",
            "@size": "1392",
            "@ref": "si3",
            "@mimetype": "image/svg+xml"
        },
        {
            "@category": "thumbnail",
            "@_fa": "true",
            "$": "https://api.elsevier.com/content/object/eid/1-s2.0-S036013232200868X-si30.svg?httpAccept=%2A%2F%2A",
            "@multimediatype": "Scalable Vector Graphics file",
            "@type": "ALTIMG",
            "@size": "1426",
            "@ref": "si30",
            "@mimetype": "image/svg+xml"
        },
        {
            "@category": "thumbnail",
            "@_fa": "true",
            "$": "https://api.elsevier.com/content/object/eid/1-s2.0-S036013232200868X-si31.svg?httpAccept=%2A%2F%2A",
            "@multimediatype": "Scalable Vector Graphics file",
            "@type": "ALTIMG",
            "@size": "1531",
            "@ref": "si31",
            "@mimetype": "image/svg+xml"
        },
        {
            "@category": "thumbnail",
            "@_fa": "true",
            "$": "https://api.elsevier.com/content/object/eid/1-s2.0-S036013232200868X-si32.svg?httpAccept=%2A%2F%2A",
            "@multimediatype": "Scalable Vector Graphics file",
            "@type": "ALTIMG",
            "@size": "1133",
            "@ref": "si32",
            "@mimetype": "image/svg+xml"
        },
        {
            "@category": "thumbnail",
            "@_fa": "true",
            "$": "https://api.elsevier.com/content/object/eid/1-s2.0-S036013232200868X-si33.svg?httpAccept=%2A%2F%2A",
            "@multimediatype": "Scalable Vector Graphics file",
            "@type": "ALTIMG",
            "@size": "1094",
            "@ref": "si33",
            "@mimetype": "image/svg+xml"
        },
        {
            "@category": "thumbnail",
            "@_fa": "true",
            "$": "https://api.elsevier.com/content/object/eid/1-s2.0-S036013232200868X-si34.svg?httpAccept=%2A%2F%2A",
            "@multimediatype": "Scalable Vector Graphics file",
            "@type": "ALTIMG",
            "@size": "1414",
            "@ref": "si34",
            "@mimetype": "image/svg+xml"
        },
        {
            "@category": "thumbnail",
            "@_fa": "true",
            "$": "https://api.elsevier.com/content/object/eid/1-s2.0-S036013232200868X-si35.svg?httpAccept=%2A%2F%2A",
            "@multimediatype": "Scalable Vector Graphics file",
            "@type": "ALTIMG",
            "@size": "1338",
            "@ref": "si35",
            "@mimetype": "image/svg+xml"
        },
        {
            "@category": "thumbnail",
            "@_fa": "true",
            "$": "https://api.elsevier.com/content/object/eid/1-s2.0-S036013232200868X-si36.svg?httpAccept=%2A%2F%2A",
            "@multimediatype": "Scalable Vector Graphics file",
            "@type": "ALTIMG",
            "@size": "764",
            "@ref": "si36",
            "@mimetype": "image/svg+xml"
        },
        {
            "@category": "thumbnail",
            "@_fa": "true",
            "$": "https://api.elsevier.com/content/object/eid/1-s2.0-S036013232200868X-si39.svg?httpAccept=%2A%2F%2A",
            "@multimediatype": "Scalable Vector Graphics file",
            "@type": "ALTIMG",
            "@size": "4431",
            "@ref": "si39",
            "@mimetype": "image/svg+xml"
        },
        {
            "@category": "thumbnail",
            "@_fa": "true",
            "$": "https://api.elsevier.com/content/object/eid/1-s2.0-S036013232200868X-si4.svg?httpAccept=%2A%2F%2A",
            "@multimediatype": "Scalable Vector Graphics file",
            "@type": "ALTIMG",
            "@size": "1687",
            "@ref": "si4",
            "@mimetype": "image/svg+xml"
        },
        {
            "@category": "thumbnail",
            "@_fa": "true",
            "$": "https://api.elsevier.com/content/object/eid/1-s2.0-S036013232200868X-si40.svg?httpAccept=%2A%2F%2A",
            "@multimediatype": "Scalable Vector Graphics file",
            "@type": "ALTIMG",
            "@size": "5950",
            "@ref": "si40",
            "@mimetype": "image/svg+xml"
        },
        {
            "@category": "thumbnail",
            "@_fa": "true",
            "$": "https://api.elsevier.com/content/object/eid/1-s2.0-S036013232200868X-si41.svg?httpAccept=%2A%2F%2A",
            "@multimediatype": "Scalable Vector Graphics file",
            "@type": "ALTIMG",
            "@size": "2779",
            "@ref": "si41",
            "@mimetype": "image/svg+xml"
        },
        {
            "@category": "thumbnail",
            "@_fa": "true",
            "$": "https://api.elsevier.com/content/object/eid/1-s2.0-S036013232200868X-si42.svg?httpAccept=%2A%2F%2A",
            "@multimediatype": "Scalable Vector Graphics file",
            "@type": "ALTIMG",
            "@size": "2006",
            "@ref": "si42",
            "@mimetype": "image/svg+xml"
        },
        {
            "@category": "thumbnail",
            "@_fa": "true",
            "$": "https://api.elsevier.com/content/object/eid/1-s2.0-S036013232200868X-si43.svg?httpAccept=%2A%2F%2A",
            "@multimediatype": "Scalable Vector Graphics file",
            "@type": "ALTIMG",
            "@size": "2521",
            "@ref": "si43",
            "@mimetype": "image/svg+xml"
        },
        {
            "@category": "thumbnail",
            "@_fa": "true",
            "$": "https://api.elsevier.com/content/object/eid/1-s2.0-S036013232200868X-si44.svg?httpAccept=%2A%2F%2A",
            "@multimediatype": "Scalable Vector Graphics file",
            "@type": "ALTIMG",
            "@size": "2581",
            "@ref": "si44",
            "@mimetype": "image/svg+xml"
        },
        {
            "@category": "thumbnail",
            "@_fa": "true",
            "$": "https://api.elsevier.com/content/object/eid/1-s2.0-S036013232200868X-si45.svg?httpAccept=%2A%2F%2A",
            "@multimediatype": "Scalable Vector Graphics file",
            "@type": "ALTIMG",
            "@size": "2865",
            "@ref": "si45",
            "@mimetype": "image/svg+xml"
        },
        {
            "@category": "thumbnail",
            "@_fa": "true",
            "$": "https://api.elsevier.com/content/object/eid/1-s2.0-S036013232200868X-si46.svg?httpAccept=%2A%2F%2A",
            "@multimediatype": "Scalable Vector Graphics file",
            "@type": "ALTIMG",
            "@size": "5328",
            "@ref": "si46",
            "@mimetype": "image/svg+xml"
        },
        {
            "@category": "thumbnail",
            "@_fa": "true",
            "$": "https://api.elsevier.com/content/object/eid/1-s2.0-S036013232200868X-si47.svg?httpAccept=%2A%2F%2A",
            "@multimediatype": "Scalable Vector Graphics file",
            "@type": "ALTIMG",
            "@size": "1173",
            "@ref": "si47",
            "@mimetype": "image/svg+xml"
        },
        {
            "@category": "thumbnail",
            "@_fa": "true",
            "$": "https://api.elsevier.com/content/object/eid/1-s2.0-S036013232200868X-si48.svg?httpAccept=%2A%2F%2A",
            "@multimediatype": "Scalable Vector Graphics file",
            "@type": "ALTIMG",
            "@size": "3000",
            "@ref": "si48",
            "@mimetype": "image/svg+xml"
        },
        {
            "@category": "thumbnail",
            "@_fa": "true",
            "$": "https://api.elsevier.com/content/object/eid/1-s2.0-S036013232200868X-si49.svg?httpAccept=%2A%2F%2A",
            "@multimediatype": "Scalable Vector Graphics file",
            "@type": "ALTIMG",
            "@size": "1148",
            "@ref": "si49",
            "@mimetype": "image/svg+xml"
        },
        {
            "@category": "thumbnail",
            "@_fa": "true",
            "$": "https://api.elsevier.com/content/object/eid/1-s2.0-S036013232200868X-si5.svg?httpAccept=%2A%2F%2A",
            "@multimediatype": "Scalable Vector Graphics file",
            "@type": "ALTIMG",
            "@size": "1241",
            "@ref": "si5",
            "@mimetype": "image/svg+xml"
        },
        {
            "@category": "thumbnail",
            "@_fa": "true",
            "$": "https://api.elsevier.com/content/object/eid/1-s2.0-S036013232200868X-si50.svg?httpAccept=%2A%2F%2A",
            "@multimediatype": "Scalable Vector Graphics file",
            "@type": "ALTIMG",
            "@size": "2363",
            "@ref": "si50",
            "@mimetype": "image/svg+xml"
        },
        {
            "@category": "thumbnail",
            "@_fa": "true",
            "$": "https://api.elsevier.com/content/object/eid/1-s2.0-S036013232200868X-si51.svg?httpAccept=%2A%2F%2A",
            "@multimediatype": "Scalable Vector Graphics file",
            "@type": "ALTIMG",
            "@size": "6142",
            "@ref": "si51",
            "@mimetype": "image/svg+xml"
        },
        {
            "@category": "thumbnail",
            "@_fa": "true",
            "$": "https://api.elsevier.com/content/object/eid/1-s2.0-S036013232200868X-si53.svg?httpAccept=%2A%2F%2A",
            "@multimediatype": "Scalable Vector Graphics file",
            "@type": "ALTIMG",
            "@size": "5885",
            "@ref": "si53",
            "@mimetype": "image/svg+xml"
        },
        {
            "@category": "thumbnail",
            "@_fa": "true",
            "$": "https://api.elsevier.com/content/object/eid/1-s2.0-S036013232200868X-si54.svg?httpAccept=%2A%2F%2A",
            "@multimediatype": "Scalable Vector Graphics file",
            "@type": "ALTIMG",
            "@size": "4731",
            "@ref": "si54",
            "@mimetype": "image/svg+xml"
        },
        {
            "@category": "thumbnail",
            "@_fa": "true",
            "$": "https://api.elsevier.com/content/object/eid/1-s2.0-S036013232200868X-si55.svg?httpAccept=%2A%2F%2A",
            "@multimediatype": "Scalable Vector Graphics file",
            "@type": "ALTIMG",
            "@size": "5523",
            "@ref": "si55",
            "@mimetype": "image/svg+xml"
        },
        {
            "@category": "thumbnail",
            "@_fa": "true",
            "$": "https://api.elsevier.com/content/object/eid/1-s2.0-S036013232200868X-si56.svg?httpAccept=%2A%2F%2A",
            "@multimediatype": "Scalable Vector Graphics file",
            "@type": "ALTIMG",
            "@size": "9240",
            "@ref": "si56",
            "@mimetype": "image/svg+xml"
        },
        {
            "@category": "thumbnail",
            "@_fa": "true",
            "$": "https://api.elsevier.com/content/object/eid/1-s2.0-S036013232200868X-si58.svg?httpAccept=%2A%2F%2A",
            "@multimediatype": "Scalable Vector Graphics file",
            "@type": "ALTIMG",
            "@size": "3324",
            "@ref": "si58",
            "@mimetype": "image/svg+xml"
        },
        {
            "@category": "thumbnail",
            "@_fa": "true",
            "$": "https://api.elsevier.com/content/object/eid/1-s2.0-S036013232200868X-si59.svg?httpAccept=%2A%2F%2A",
            "@multimediatype": "Scalable Vector Graphics file",
            "@type": "ALTIMG",
            "@size": "10040",
            "@ref": "si59",
            "@mimetype": "image/svg+xml"
        },
        {
            "@category": "thumbnail",
            "@_fa": "true",
            "$": "https://api.elsevier.com/content/object/eid/1-s2.0-S036013232200868X-si64.svg?httpAccept=%2A%2F%2A",
            "@multimediatype": "Scalable Vector Graphics file",
            "@type": "ALTIMG",
            "@size": "10128",
            "@ref": "si64",
            "@mimetype": "image/svg+xml"
        },
        {
            "@category": "thumbnail",
            "@_fa": "true",
            "$": "https://api.elsevier.com/content/object/eid/1-s2.0-S036013232200868X-si66.svg?httpAccept=%2A%2F%2A",
            "@multimediatype": "Scalable Vector Graphics file",
            "@type": "ALTIMG",
            "@size": "8454",
            "@ref": "si66",
            "@mimetype": "image/svg+xml"
        },
        {
            "@category": "thumbnail",
            "@_fa": "true",
            "$": "https://api.elsevier.com/content/object/eid/1-s2.0-S036013232200868X-si7.svg?httpAccept=%2A%2F%2A",
            "@multimediatype": "Scalable Vector Graphics file",
            "@type": "ALTIMG",
            "@size": "1227",
            "@ref": "si7",
            "@mimetype": "image/svg+xml"
        },
        {
            "@category": "thumbnail",
            "@_fa": "true",
            "$": "https://api.elsevier.com/content/object/eid/1-s2.0-S036013232200868X-si71.svg?httpAccept=%2A%2F%2A",
            "@multimediatype": "Scalable Vector Graphics file",
            "@type": "ALTIMG",
            "@size": "39904",
            "@ref": "si71",
            "@mimetype": "image/svg+xml"
        },
        {
            "@category": "thumbnail",
            "@_fa": "true",
            "$": "https://api.elsevier.com/content/object/eid/1-s2.0-S036013232200868X-si77.svg?httpAccept=%2A%2F%2A",
            "@multimediatype": "Scalable Vector Graphics file",
            "@type": "ALTIMG",
            "@size": "22294",
            "@ref": "si77",
            "@mimetype": "image/svg+xml"
        },
        {
            "@category": "thumbnail",
            "@_fa": "true",
            "$": "https://api.elsevier.com/content/object/eid/1-s2.0-S036013232200868X-si78.svg?httpAccept=%2A%2F%2A",
            "@multimediatype": "Scalable Vector Graphics file",
            "@type": "ALTIMG",
            "@size": "3205",
            "@ref": "si78",
            "@mimetype": "image/svg+xml"
        },
        {
            "@category": "thumbnail",
            "@_fa": "true",
            "$": "https://api.elsevier.com/content/object/eid/1-s2.0-S036013232200868X-si8.svg?httpAccept=%2A%2F%2A",
            "@multimediatype": "Scalable Vector Graphics file",
            "@type": "ALTIMG",
            "@size": "853",
            "@ref": "si8",
            "@mimetype": "image/svg+xml"
        },
        {
            "@category": "thumbnail",
            "@_fa": "true",
            "$": "https://api.elsevier.com/content/object/eid/1-s2.0-S036013232200868X-si81.svg?httpAccept=%2A%2F%2A",
            "@multimediatype": "Scalable Vector Graphics file",
            "@type": "ALTIMG",
            "@size": "3253",
            "@ref": "si81",
            "@mimetype": "image/svg+xml"
        },
        {
            "@category": "thumbnail",
            "@_fa": "true",
            "$": "https://api.elsevier.com/content/object/eid/1-s2.0-S036013232200868X-si84.svg?httpAccept=%2A%2F%2A",
            "@multimediatype": "Scalable Vector Graphics file",
            "@type": "ALTIMG",
            "@size": "5064",
            "@ref": "si84",
            "@mimetype": "image/svg+xml"
        },
        {
            "@category": "thumbnail",
            "@_fa": "true",
            "$": "https://api.elsevier.com/content/object/eid/1-s2.0-S036013232200868X-si85.svg?httpAccept=%2A%2F%2A",
            "@multimediatype": "Scalable Vector Graphics file",
            "@type": "ALTIMG",
            "@size": "2708",
            "@ref": "si85",
            "@mimetype": "image/svg+xml"
        },
        {
            "@category": "thumbnail",
            "@_fa": "true",
            "$": "https://api.elsevier.com/content/object/eid/1-s2.0-S036013232200868X-si87.svg?httpAccept=%2A%2F%2A",
            "@multimediatype": "Scalable Vector Graphics file",
            "@type": "ALTIMG",
            "@size": "25196",
            "@ref": "si87",
            "@mimetype": "image/svg+xml"
        },
        {
            "@category": "thumbnail",
            "@_fa": "true",
            "$": "https://api.elsevier.com/content/object/eid/1-s2.0-S036013232200868X-si88.svg?httpAccept=%2A%2F%2A",
            "@multimediatype": "Scalable Vector Graphics file",
            "@type": "ALTIMG",
            "@size": "14439",
            "@ref": "si88",
            "@mimetype": "image/svg+xml"
        },
        {
            "@category": "thumbnail",
            "@_fa": "true",
            "$": "https://api.elsevier.com/content/object/eid/1-s2.0-S036013232200868X-si89.svg?httpAccept=%2A%2F%2A",
            "@multimediatype": "Scalable Vector Graphics file",
            "@type": "ALTIMG",
            "@size": "4936",
            "@ref": "si89",
            "@mimetype": "image/svg+xml"
        },
        {
            "@category": "thumbnail",
            "@_fa": "true",
            "$": "https://api.elsevier.com/content/object/eid/1-s2.0-S036013232200868X-si9.svg?httpAccept=%2A%2F%2A",
            "@multimediatype": "Scalable Vector Graphics file",
            "@type": "ALTIMG",
            "@size": "1566",
            "@ref": "si9",
            "@mimetype": "image/svg+xml"
        },
        {
            "@category": "thumbnail",
            "@_fa": "true",
            "$": "https://api.elsevier.com/content/object/eid/1-s2.0-S036013232200868X-si90.svg?httpAccept=%2A%2F%2A",
            "@multimediatype": "Scalable Vector Graphics file",
            "@type": "ALTIMG",
            "@size": "9224",
            "@ref": "si90",
            "@mimetype": "image/svg+xml"
        },
        {
            "@category": "thumbnail",
            "@_fa": "true",
            "$": "https://api.elsevier.com/content/object/eid/1-s2.0-S036013232200868X-si93.svg?httpAccept=%2A%2F%2A",
            "@multimediatype": "Scalable Vector Graphics file",
            "@type": "ALTIMG",
            "@size": "5993",
            "@ref": "si93",
            "@mimetype": "image/svg+xml"
        },
        {
            "@category": "thumbnail",
            "@_fa": "true",
            "$": "https://api.elsevier.com/content/object/eid/1-s2.0-S036013232200868X-si94.svg?httpAccept=%2A%2F%2A",
            "@multimediatype": "Scalable Vector Graphics file",
            "@type": "ALTIMG",
            "@size": "6137",
            "@ref": "si94",
            "@mimetype": "image/svg+xml"
        },
        {
            "@category": "thumbnail",
            "@_fa": "true",
            "$": "https://api.elsevier.com/content/object/eid/1-s2.0-S036013232200868X-si95.svg?httpAccept=%2A%2F%2A",
            "@multimediatype": "Scalable Vector Graphics file",
            "@type": "ALTIMG",
            "@size": "16926",
            "@ref": "si95",
            "@mimetype": "image/svg+xml"
        },
        {
            "@category": "thumbnail",
            "@_fa": "true",
            "$": "https://api.elsevier.com/content/object/eid/1-s2.0-S036013232200868X-si99.svg?httpAccept=%2A%2F%2A",
            "@multimediatype": "Scalable Vector Graphics file",
            "@type": "ALTIMG",
            "@size": "1303",
            "@ref": "si99",
            "@mimetype": "image/svg+xml"
        },
        {
            "@category": "standard",
            "@_fa": "true",
            "$": "https://api.elsevier.com/content/object/eid/1-s2.0-S036013232200868X-am.pdf?httpAccept=%2A%2F%2A",
            "@multimediatype": "Acrobat PDF file",
            "@type": "AAM-PDF",
            "@size": "11372887",
            "@ref": "am",
            "@mimetype": "application/pdf"
        }
    ]},
    "link": {
        "@rel": "abstract",
        "@href": "https://api.elsevier.com/content/abstract/scopus_id/85140720871"
    }
}}