{"full-text-retrieval-response": {
    "scopus-eid": "2-s2.0-85090222840",
    "originalText": "serial JL 271090 291210 291702 291711 291731 291877 291878 31 Energy ENERGY 2020-08-25 2020-08-25 2020-09-06 2020-09-06 2020-11-24T18:56:19 1-s2.0-S0360544220315644 S0360-5442(20)31564-4 S0360544220315644 10.1016/j.energy.2020.118456 S300 S300.1 FULL-TEXT 1-s2.0-S0360544220X00193 2020-11-24T21:52:03.011886Z 0 0 20201201 2020 2020-08-25T04:21:43.074098Z articleinfo articlenumber articletitlenorm authfirstinitialnorm authfirstsurnamenorm cid cids contenttype copyright crossmark dateloaded dateloadedtxt datesearch datesort dateupdated dco docsubtype doctype doi eid ewtransactionid hubeid indexeddate issn issnnorm itemstage itemtransactionid itemweight openaccess openarchive pg pgfirst pii piinorm pubdatestart pubdatetxt pubyr sectiontitle sortorder srctitle srctitlenorm srctype ssids alllist content subj subheadings suppl tomb volfirst volissue volumelist webpdf webpdfpagecount yearnav figure table body mmlmath acknowledge affil articletitle auth authfirstini authfull authkeywords authlast footnotes grantsponsor grantsponsorid highlightsabst nomenclature primabst ref 0360-5442 03605442 true 212 212 C Volume 212 23 118456 118456 118456 20201201 1 December 2020 2020-12-01 2020 Full Length Articles article fla © 2020 Elsevier Ltd. All rights reserved. CENTRALIZEDMODELPREDICTIVECONTROLSTRATEGYFORTHERMALCOMFORTRESIDENTIALENERGYMANAGEMENT SEAL S List of symbols 1 Introduction 2 Objectives 3 The case study house 3.1 Heating systems 3.2 PV panels (PV), home battery (HB) and grid (G): sizing and specifications 3.2.1 Solar panels 3.2.2 Home battery 4 Control-oriented model identification and validation 5 Uncertainties in the disturbance inputs: weather inputs and internal gains 5.1 Forecast and actual dataset for outdoor temperature 5.2 Forecast and actual dataset for solar radiation on the PV and shortwave solar heat gain through windows 5.3 Forecast and actual dataset for ground temperature and internal heat gain 6 Problem formulation and methodology 6.1 Comfort bounds and setpoint temperature 6.2 Simulation parameters 6.2.1 Time-of-use (ToU) rates and feed-in-tariff (FiT) 6.3 Description of the optimization variables 7 Case study scenarios and objective function 7.1 Base case scenario 7.1.1 Case I: bidirectional grid connection with an incentive for selling power to the grid 8 Results and discussion 8.1 Comfort performance 8.2 Heating energy distribution 8.3 Use of renewable solar energy and battery storage unit 9 Conclusion CRediT authorship contribution statement Acknowledgment References AFRAM 2014 343 355 A THEORYAPPLICATIONSHVACCONTROLSYSTEMSAREVIEWMODELPREDICTIVECONTROLMPCBUILDINGENVIRONMENT BELTRAMI 2015 014009 H BOODI 2019 5801 5806 A IECON201945THANNUALCONFERENCEIEEEINDUSTRIALELECTRONICSSOCIETY MODELPREDICTIVECONTROLBASEDTHERMALCOMFORTENERGYOPTIMIZATION CANDANEDO 2018 J 5THINTERNATIONALHIGHPERFORMANCEBUILDINGSCONFERENCE PRELIMINARYASSESSMENTAWEATHERFORECASTTOOLFORBUILDINGOPERATION CHEN 2013 1401 1410 C DUFFIE 2013 J SOLARENGINEERINGTHERMALPROCESSES SAGE E FILLIARD 2009 2266 2273 B ELEVENTHINTERNATIONALIBPSACONFERENCEGLASGOW PERFORMANCEEVALUATIONAIRTOAIRHEATPUMPCOUPLEDTEMPERATEAIRSOURCESINTEGRATEDADWELLING GABSI 2018 156 161 F INTERNATIONALCONFERENCESMARTGRIDCLEANENERGYTECHNOLOGIESICSGCE HYGROTHERMALMODELINGMPCBASEDCONTROLFORENERGYCOMFORTMANAGEMENTINBUILDINGS GRUNE 2011 174 L NONLINEARMODELPREDICTIVECONTROL NONLINEARMODELPREDICTIVECONTROL HASSAN 2017 422 441 A HESDOCUMENTATION 2017 2017 KEGEL 2014 M 9THSYSTEMSIMULATIONINBUILDINGSCONFERENCE INTEGRATIONEVALUATIONINNOVATIVERENEWABLEENERGYTECHNOLOGIESINACANADIANMIDRISEAPARTMENT MATHWORKS 2020 CONSTRAINEDNONLINEAROPTIMIZATIONALGORITHMS MAZZEO 2018 688 708 D MERAL 2011 2176 2184 M MITSUBISHIELECTRIC MITSUBISHIELECTRIC RUANO 2016 145 158 A SEAL 2019 S MODELPREDICTIVECONTROLELECTRICBUILDINGENERGYHEATINGSYSTEMS SEAL 2019 1419 1436 S 2012 TRNSYS17MAINDOCUMENTATION STELPRO STEPHENSON 1967 D POWERWALL T SEALX2020X118456 SEALX2020X118456XS 2022-09-06T00:00:00.000Z 2022-09-06T00:00:00.000Z http://creativecommons.org/licenses/by-nc-nd/4.0/ © 2020 Elsevier Ltd. All rights reserved. 2020-08-26T18:57:02.242Z http://vtw.elsevier.com/data/voc/AddOnTypes/50.7/eoas NSERC Natural Sciences and Engineering Research Council of Canada http://data.elsevier.com/vocabulary/SciValFunders/501100000038 http://sws.geonames.org/6251999 item S0360-5442(20)31564-4 S0360544220315644 1-s2.0-S0360544220315644 10.1016/j.energy.2020.118456 271090 2020-11-24T21:52:03.011886Z 2020-12-01 1-s2.0-S0360544220315644-main.pdf https://s3-eu-west-1.amazonaws.com/prod-ucs-content-store-eu-west/content/pii:S0360544220315644/MAIN/application/pdf/b7f4ccff6f03a96f478af6b178cd3bdf/main.pdf main.pdf pdf true 2138315 MAIN 13 1-s2.0-S0360544220315644-main_1.png https://s3-eu-west-1.amazonaws.com/prod-ucs-content-store-eu-west/content/pii:S0360544220315644/PREVIEW/image/png/fe28b62f59ff14d1847ee3e9bb37599b/main_1.png main_1.png png 57258 849 656 IMAGE-WEB-PDF 1 1-s2.0-S0360544220315644-gr3.jpg https://s3-eu-west-1.amazonaws.com/prod-ucs-content-store-eu-west/content/pii:S0360544220315644/gr3/DOWNSAMPLED/image/jpeg/3a825de8052cb87e6361392811467521/gr3.jpg gr3 gr3.jpg jpg 13877 138 386 IMAGE-DOWNSAMPLED 1-s2.0-S0360544220315644-gr1.jpg https://s3-eu-west-1.amazonaws.com/prod-ucs-content-store-eu-west/content/pii:S0360544220315644/gr1/DOWNSAMPLED/image/jpeg/b5c6d1b88d75a7777127d63f44e6f088/gr1.jpg gr1 gr1.jpg jpg 35534 373 389 IMAGE-DOWNSAMPLED 1-s2.0-S0360544220315644-gr10.jpg https://s3-eu-west-1.amazonaws.com/prod-ucs-content-store-eu-west/content/pii:S0360544220315644/gr10/DOWNSAMPLED/image/jpeg/8270c372519a6caf3737016072ba7e82/gr10.jpg gr10 gr10.jpg jpg 29719 316 388 IMAGE-DOWNSAMPLED 1-s2.0-S0360544220315644-gr11.jpg https://s3-eu-west-1.amazonaws.com/prod-ucs-content-store-eu-west/content/pii:S0360544220315644/gr11/DOWNSAMPLED/image/jpeg/e15cf70ba668f5debb857cbbfeaf4d5e/gr11.jpg gr11 gr11.jpg jpg 23643 170 388 IMAGE-DOWNSAMPLED 1-s2.0-S0360544220315644-gr6.jpg https://s3-eu-west-1.amazonaws.com/prod-ucs-content-store-eu-west/content/pii:S0360544220315644/gr6/DOWNSAMPLED/image/jpeg/291b06b544797babd57e9f1f165ae5e1/gr6.jpg gr6 gr6.jpg jpg 77907 621 689 IMAGE-DOWNSAMPLED 1-s2.0-S0360544220315644-gr7.jpg https://s3-eu-west-1.amazonaws.com/prod-ucs-content-store-eu-west/content/pii:S0360544220315644/gr7/DOWNSAMPLED/image/jpeg/09b76ac345ea47c6cd954770d0fafb39/gr7.jpg gr7 gr7.jpg jpg 86927 378 691 IMAGE-DOWNSAMPLED 1-s2.0-S0360544220315644-gr4.jpg https://s3-eu-west-1.amazonaws.com/prod-ucs-content-store-eu-west/content/pii:S0360544220315644/gr4/DOWNSAMPLED/image/jpeg/5137239bd277c92eee59326529a43480/gr4.jpg gr4 gr4.jpg jpg 16101 220 388 IMAGE-DOWNSAMPLED 1-s2.0-S0360544220315644-gr12.jpg https://s3-eu-west-1.amazonaws.com/prod-ucs-content-store-eu-west/content/pii:S0360544220315644/gr12/DOWNSAMPLED/image/jpeg/59924bdc3c3d9dbd2c1f647be06260c5/gr12.jpg gr12 gr12.jpg jpg 31693 175 388 IMAGE-DOWNSAMPLED 1-s2.0-S0360544220315644-gr2.jpg https://s3-eu-west-1.amazonaws.com/prod-ucs-content-store-eu-west/content/pii:S0360544220315644/gr2/DOWNSAMPLED/image/jpeg/467cb21f3297e0cd98866b248cd8d86a/gr2.jpg gr2 gr2.jpg jpg 11365 151 389 IMAGE-DOWNSAMPLED 1-s2.0-S0360544220315644-gr5.jpg https://s3-eu-west-1.amazonaws.com/prod-ucs-content-store-eu-west/content/pii:S0360544220315644/gr5/DOWNSAMPLED/image/jpeg/d4619bac78c4e8fa6ef7ccb61f544f52/gr5.jpg gr5 gr5.jpg jpg 39968 287 691 IMAGE-DOWNSAMPLED 1-s2.0-S0360544220315644-gr8.jpg https://s3-eu-west-1.amazonaws.com/prod-ucs-content-store-eu-west/content/pii:S0360544220315644/gr8/DOWNSAMPLED/image/jpeg/f64575b5e76cae263c2698f04f3c5f7f/gr8.jpg gr8 gr8.jpg jpg 52601 343 691 IMAGE-DOWNSAMPLED 1-s2.0-S0360544220315644-gr9.jpg https://s3-eu-west-1.amazonaws.com/prod-ucs-content-store-eu-west/content/pii:S0360544220315644/gr9/DOWNSAMPLED/image/jpeg/52a31416a63e1b4a0c02fc352b4a379f/gr9.jpg gr9 gr9.jpg jpg 34102 172 388 IMAGE-DOWNSAMPLED 1-s2.0-S0360544220315644-gr3.sml https://s3-eu-west-1.amazonaws.com/prod-ucs-content-store-eu-west/content/pii:S0360544220315644/gr3/THUMBNAIL/image/gif/d2c7597a977514e6b9a38b41ac7c4ed8/gr3.sml gr3 gr3.sml sml 3651 78 219 IMAGE-THUMBNAIL 1-s2.0-S0360544220315644-gr1.sml https://s3-eu-west-1.amazonaws.com/prod-ucs-content-store-eu-west/content/pii:S0360544220315644/gr1/THUMBNAIL/image/gif/56cbc235d611463d196093668a695a41/gr1.sml gr1 gr1.sml sml 10226 164 171 IMAGE-THUMBNAIL 1-s2.0-S0360544220315644-gr10.sml https://s3-eu-west-1.amazonaws.com/prod-ucs-content-store-eu-west/content/pii:S0360544220315644/gr10/THUMBNAIL/image/gif/02116936deed602f4c4666cd5d9f02b7/gr10.sml gr10 gr10.sml sml 6933 164 201 IMAGE-THUMBNAIL 1-s2.0-S0360544220315644-gr11.sml https://s3-eu-west-1.amazonaws.com/prod-ucs-content-store-eu-west/content/pii:S0360544220315644/gr11/THUMBNAIL/image/gif/f5b94079d3ab6330409d8d56a80b8e67/gr11.sml gr11 gr11.sml sml 6058 96 219 IMAGE-THUMBNAIL 1-s2.0-S0360544220315644-gr6.sml https://s3-eu-west-1.amazonaws.com/prod-ucs-content-store-eu-west/content/pii:S0360544220315644/gr6/THUMBNAIL/image/gif/5967c454135e3afaf17ae661edcdbaeb/gr6.sml gr6 gr6.sml sml 9781 164 182 IMAGE-THUMBNAIL 1-s2.0-S0360544220315644-gr7.sml https://s3-eu-west-1.amazonaws.com/prod-ucs-content-store-eu-west/content/pii:S0360544220315644/gr7/THUMBNAIL/image/gif/ee94e22f87f96c2758ff622c7af9cdb6/gr7.sml gr7 gr7.sml sml 9543 120 219 IMAGE-THUMBNAIL 1-s2.0-S0360544220315644-gr4.sml https://s3-eu-west-1.amazonaws.com/prod-ucs-content-store-eu-west/content/pii:S0360544220315644/gr4/THUMBNAIL/image/gif/97434f1ea2885fc6788073f96993912a/gr4.sml gr4 gr4.sml sml 4915 124 219 IMAGE-THUMBNAIL 1-s2.0-S0360544220315644-gr12.sml https://s3-eu-west-1.amazonaws.com/prod-ucs-content-store-eu-west/content/pii:S0360544220315644/gr12/THUMBNAIL/image/gif/281cd0a240fc13cb462fbb28c316ddf3/gr12.sml gr12 gr12.sml sml 8733 99 219 IMAGE-THUMBNAIL 1-s2.0-S0360544220315644-gr2.sml https://s3-eu-west-1.amazonaws.com/prod-ucs-content-store-eu-west/content/pii:S0360544220315644/gr2/THUMBNAIL/image/gif/e3addb715898c050867f07847e382b7d/gr2.sml gr2 gr2.sml sml 3334 85 219 IMAGE-THUMBNAIL 1-s2.0-S0360544220315644-gr5.sml https://s3-eu-west-1.amazonaws.com/prod-ucs-content-store-eu-west/content/pii:S0360544220315644/gr5/THUMBNAIL/image/gif/1035903edfbddfd4a2a14808fd61cbf7/gr5.sml gr5 gr5.sml sml 6666 91 219 IMAGE-THUMBNAIL 1-s2.0-S0360544220315644-gr8.sml https://s3-eu-west-1.amazonaws.com/prod-ucs-content-store-eu-west/content/pii:S0360544220315644/gr8/THUMBNAIL/image/gif/82d80753c8c87a4e54665d3c6c0de727/gr8.sml gr8 gr8.sml sml 6948 109 219 IMAGE-THUMBNAIL 1-s2.0-S0360544220315644-gr9.sml https://s3-eu-west-1.amazonaws.com/prod-ucs-content-store-eu-west/content/pii:S0360544220315644/gr9/THUMBNAIL/image/gif/d3d00b11e37053a11b165e6a2a9801fd/gr9.sml gr9 gr9.sml sml 10532 97 219 IMAGE-THUMBNAIL 1-s2.0-S0360544220315644-gr3_lrg.jpg https://s3-eu-west-1.amazonaws.com/prod-ucs-content-store-eu-west/content/pii:S0360544220315644/gr3/HIGHRES/image/jpeg/cbdefe641fcf2a136d1eaa32fa78fe3b/gr3_lrg.jpg gr3 gr3_lrg.jpg jpg 94768 613 1712 IMAGE-HIGH-RES 1-s2.0-S0360544220315644-gr1_lrg.jpg https://s3-eu-west-1.amazonaws.com/prod-ucs-content-store-eu-west/content/pii:S0360544220315644/gr1/HIGHRES/image/jpeg/3a43c5bee9ab7c2be0e97cc01c5cc729/gr1_lrg.jpg gr1 gr1_lrg.jpg jpg 242088 1651 1722 IMAGE-HIGH-RES 1-s2.0-S0360544220315644-gr10_lrg.jpg https://s3-eu-west-1.amazonaws.com/prod-ucs-content-store-eu-west/content/pii:S0360544220315644/gr10/HIGHRES/image/jpeg/4e323d3dd796896bc0130308c8612b9b/gr10_lrg.jpg gr10 gr10_lrg.jpg jpg 211345 1401 1721 IMAGE-HIGH-RES 1-s2.0-S0360544220315644-gr11_lrg.jpg https://s3-eu-west-1.amazonaws.com/prod-ucs-content-store-eu-west/content/pii:S0360544220315644/gr11/HIGHRES/image/jpeg/a561871fac4301d686c94b84acaf2e4f/gr11_lrg.jpg gr11 gr11_lrg.jpg jpg 145991 753 1721 IMAGE-HIGH-RES 1-s2.0-S0360544220315644-gr6_lrg.jpg https://s3-eu-west-1.amazonaws.com/prod-ucs-content-store-eu-west/content/pii:S0360544220315644/gr6/HIGHRES/image/jpeg/ba5d31b95721c92ddfd8ef09bb128f19/gr6_lrg.jpg gr6 gr6_lrg.jpg jpg 597027 2750 3050 IMAGE-HIGH-RES 1-s2.0-S0360544220315644-gr7_lrg.jpg https://s3-eu-west-1.amazonaws.com/prod-ucs-content-store-eu-west/content/pii:S0360544220315644/gr7/HIGHRES/image/jpeg/f4127a7aaa8c4ff23253c0b9d3b5df40/gr7_lrg.jpg gr7 gr7_lrg.jpg jpg 645998 1675 3059 IMAGE-HIGH-RES 1-s2.0-S0360544220315644-gr4_lrg.jpg https://s3-eu-west-1.amazonaws.com/prod-ucs-content-store-eu-west/content/pii:S0360544220315644/gr4/HIGHRES/image/jpeg/21e0797cdf44d1ced8ee6bf9ef00059c/gr4_lrg.jpg gr4 gr4_lrg.jpg jpg 108865 977 1721 IMAGE-HIGH-RES 1-s2.0-S0360544220315644-gr12_lrg.jpg https://s3-eu-west-1.amazonaws.com/prod-ucs-content-store-eu-west/content/pii:S0360544220315644/gr12/HIGHRES/image/jpeg/aa9bff6334fcf50ae380f678fba0c06f/gr12_lrg.jpg gr12 gr12_lrg.jpg jpg 206405 777 1721 IMAGE-HIGH-RES 1-s2.0-S0360544220315644-gr2_lrg.jpg https://s3-eu-west-1.amazonaws.com/prod-ucs-content-store-eu-west/content/pii:S0360544220315644/gr2/HIGHRES/image/jpeg/4aa9c3b79b7a638ac27924bfdd85ee27/gr2_lrg.jpg gr2 gr2_lrg.jpg jpg 77861 670 1722 IMAGE-HIGH-RES 1-s2.0-S0360544220315644-gr5_lrg.jpg https://s3-eu-west-1.amazonaws.com/prod-ucs-content-store-eu-west/content/pii:S0360544220315644/gr5/HIGHRES/image/jpeg/73a5030c8f45ba4360952c8f57b7e45b/gr5_lrg.jpg gr5 gr5_lrg.jpg jpg 270088 1270 3060 IMAGE-HIGH-RES 1-s2.0-S0360544220315644-gr8_lrg.jpg https://s3-eu-west-1.amazonaws.com/prod-ucs-content-store-eu-west/content/pii:S0360544220315644/gr8/HIGHRES/image/jpeg/daac290803bc7cbd5bd16080b868f2b1/gr8_lrg.jpg gr8 gr8_lrg.jpg jpg 333051 1519 3061 IMAGE-HIGH-RES 1-s2.0-S0360544220315644-gr9_lrg.jpg https://s3-eu-west-1.amazonaws.com/prod-ucs-content-store-eu-west/content/pii:S0360544220315644/gr9/HIGHRES/image/jpeg/2d42fb88cdf52a3f355f59097935c5de/gr9_lrg.jpg gr9 gr9_lrg.jpg jpg 264396 761 1721 IMAGE-HIGH-RES 1-s2.0-S0360544220315644-si51.svg https://s3-eu-west-1.amazonaws.com/prod-ucs-content-store-eu-west/content/pii:S0360544220315644/STRIPIN/image/svg+xml/c892efa70804e80c712576b6b8202f30/si51.svg si51 si51.svg svg 7824 ALTIMG 1-s2.0-S0360544220315644-si9.svg https://s3-eu-west-1.amazonaws.com/prod-ucs-content-store-eu-west/content/pii:S0360544220315644/STRIPIN/image/svg+xml/738c82cc64c63e59ac6f0f81cb737beb/si9.svg si9 si9.svg svg 9324 ALTIMG 1-s2.0-S0360544220315644-si105.svg https://s3-eu-west-1.amazonaws.com/prod-ucs-content-store-eu-west/content/pii:S0360544220315644/STRIPIN/image/svg+xml/bd3e3548a32a988e7541a00c94871318/si105.svg si105 si105.svg svg 13903 ALTIMG 1-s2.0-S0360544220315644-si86.svg https://s3-eu-west-1.amazonaws.com/prod-ucs-content-store-eu-west/content/pii:S0360544220315644/STRIPIN/image/svg+xml/a42e0d6a9e7f1b74c50dd1832a5ccd5e/si86.svg si86 si86.svg svg 7095 ALTIMG 1-s2.0-S0360544220315644-si27.svg https://s3-eu-west-1.amazonaws.com/prod-ucs-content-store-eu-west/content/pii:S0360544220315644/STRIPIN/image/svg+xml/5fa0e5ef1dcc2460daf6aefc591bf41b/si27.svg si27 si27.svg svg 13977 ALTIMG 1-s2.0-S0360544220315644-si75.svg https://s3-eu-west-1.amazonaws.com/prod-ucs-content-store-eu-west/content/pii:S0360544220315644/STRIPIN/image/svg+xml/86eb0efd4bc1a6cfaaa300125d8e5735/si75.svg si75 si75.svg svg 5670 ALTIMG 1-s2.0-S0360544220315644-si98.svg https://s3-eu-west-1.amazonaws.com/prod-ucs-content-store-eu-west/content/pii:S0360544220315644/STRIPIN/image/svg+xml/912a5aeba21874517be52ec25ee5e8a4/si98.svg si98 si98.svg svg 3176 ALTIMG 1-s2.0-S0360544220315644-si60.svg https://s3-eu-west-1.amazonaws.com/prod-ucs-content-store-eu-west/content/pii:S0360544220315644/STRIPIN/image/svg+xml/b45923e6150122c27636e1b15aed8180/si60.svg si60 si60.svg svg 6311 ALTIMG 1-s2.0-S0360544220315644-si83.svg https://s3-eu-west-1.amazonaws.com/prod-ucs-content-store-eu-west/content/pii:S0360544220315644/STRIPIN/image/svg+xml/6eba9b1b637752cd05f078fff3979ce1/si83.svg si83 si83.svg svg 2789 ALTIMG 1-s2.0-S0360544220315644-si46.svg https://s3-eu-west-1.amazonaws.com/prod-ucs-content-store-eu-west/content/pii:S0360544220315644/STRIPIN/image/svg+xml/cdeaa61e078435acee8abf218d2b01f1/si46.svg si46 si46.svg svg 10100 ALTIMG 1-s2.0-S0360544220315644-si6.svg https://s3-eu-west-1.amazonaws.com/prod-ucs-content-store-eu-west/content/pii:S0360544220315644/STRIPIN/image/svg+xml/ea9eb2fa50f6c172c5e972020b9ca2ee/si6.svg si6 si6.svg svg 13193 ALTIMG 1-s2.0-S0360544220315644-si42.svg https://s3-eu-west-1.amazonaws.com/prod-ucs-content-store-eu-west/content/pii:S0360544220315644/STRIPIN/image/svg+xml/f6af2d9fe18edb7761370b658d638c4d/si42.svg si42 si42.svg svg 3935 ALTIMG 1-s2.0-S0360544220315644-si15.svg https://s3-eu-west-1.amazonaws.com/prod-ucs-content-store-eu-west/content/pii:S0360544220315644/STRIPIN/image/svg+xml/35c3be354bf2b7954e82c02360d3b1aa/si15.svg si15 si15.svg svg 4150 ALTIMG 1-s2.0-S0360544220315644-si16.svg https://s3-eu-west-1.amazonaws.com/prod-ucs-content-store-eu-west/content/pii:S0360544220315644/STRIPIN/image/svg+xml/1fc105b098058fed6e994889072f366d/si16.svg si16 si16.svg svg 3931 ALTIMG 1-s2.0-S0360544220315644-si142.svg https://s3-eu-west-1.amazonaws.com/prod-ucs-content-store-eu-west/content/pii:S0360544220315644/STRIPIN/image/svg+xml/43c6d629b7f22cf962694151861119ce/si142.svg si142 si142.svg svg 122914 ALTIMG 1-s2.0-S0360544220315644-si157.svg https://s3-eu-west-1.amazonaws.com/prod-ucs-content-store-eu-west/content/pii:S0360544220315644/STRIPIN/image/svg+xml/00ad81876215289466c2b8529dabe0cc/si157.svg si157 si157.svg svg 18968 ALTIMG 1-s2.0-S0360544220315644-si81.svg https://s3-eu-west-1.amazonaws.com/prod-ucs-content-store-eu-west/content/pii:S0360544220315644/STRIPIN/image/svg+xml/3c504e2d97daf66a81b84c2efe21b300/si81.svg si81 si81.svg svg 6533 ALTIMG 1-s2.0-S0360544220315644-si138.svg https://s3-eu-west-1.amazonaws.com/prod-ucs-content-store-eu-west/content/pii:S0360544220315644/STRIPIN/image/svg+xml/41bd4da52023f438111fb14142a6b54b/si138.svg si138 si138.svg svg 25296 ALTIMG 1-s2.0-S0360544220315644-si5.svg https://s3-eu-west-1.amazonaws.com/prod-ucs-content-store-eu-west/content/pii:S0360544220315644/STRIPIN/image/svg+xml/d6ec837afef21ad2dc6855b251fbb313/si5.svg si5 si5.svg svg 3821 ALTIMG 1-s2.0-S0360544220315644-si95.svg https://s3-eu-west-1.amazonaws.com/prod-ucs-content-store-eu-west/content/pii:S0360544220315644/STRIPIN/image/svg+xml/ffe7fc70252996e26487ba64b0e519e9/si95.svg si95 si95.svg svg 5092 ALTIMG 1-s2.0-S0360544220315644-si65.svg https://s3-eu-west-1.amazonaws.com/prod-ucs-content-store-eu-west/content/pii:S0360544220315644/STRIPIN/image/svg+xml/7b4c313ba043a840c07459188be56aed/si65.svg si65 si65.svg svg 8426 ALTIMG 1-s2.0-S0360544220315644-si125.svg https://s3-eu-west-1.amazonaws.com/prod-ucs-content-store-eu-west/content/pii:S0360544220315644/STRIPIN/image/svg+xml/ad5b33eb8d143aff2a11e2c798a6d75d/si125.svg si125 si125.svg svg 17388 ALTIMG 1-s2.0-S0360544220315644-si97.svg https://s3-eu-west-1.amazonaws.com/prod-ucs-content-store-eu-west/content/pii:S0360544220315644/STRIPIN/image/svg+xml/cb81945dab52902c8580f8a019414d42/si97.svg si97 si97.svg svg 3153 ALTIMG 1-s2.0-S0360544220315644-si148.svg https://s3-eu-west-1.amazonaws.com/prod-ucs-content-store-eu-west/content/pii:S0360544220315644/STRIPIN/image/svg+xml/09d386583a64187b598c4b45ecdd3cbc/si148.svg si148 si148.svg svg 25798 ALTIMG 1-s2.0-S0360544220315644-si2.svg https://s3-eu-west-1.amazonaws.com/prod-ucs-content-store-eu-west/content/pii:S0360544220315644/STRIPIN/image/svg+xml/ecd165588a95ec230779fbb5ab17eaaf/si2.svg si2 si2.svg svg 17772 ALTIMG 1-s2.0-S0360544220315644-si140.svg https://s3-eu-west-1.amazonaws.com/prod-ucs-content-store-eu-west/content/pii:S0360544220315644/STRIPIN/image/svg+xml/c8a4ce39a507bfcf920f84d821542710/si140.svg si140 si140.svg svg 19064 ALTIMG 1-s2.0-S0360544220315644-si143.svg https://s3-eu-west-1.amazonaws.com/prod-ucs-content-store-eu-west/content/pii:S0360544220315644/STRIPIN/image/svg+xml/224545ddf122dfe12a2c9ac95ff3052b/si143.svg si143 si143.svg svg 16353 ALTIMG 1-s2.0-S0360544220315644-si63.svg https://s3-eu-west-1.amazonaws.com/prod-ucs-content-store-eu-west/content/pii:S0360544220315644/STRIPIN/image/svg+xml/9ab0fc639651625788fcc8b081b0e5b8/si63.svg si63 si63.svg svg 7564 ALTIMG 1-s2.0-S0360544220315644-si55.svg https://s3-eu-west-1.amazonaws.com/prod-ucs-content-store-eu-west/content/pii:S0360544220315644/STRIPIN/image/svg+xml/a8bad427343f74a70d72c6155602c546/si55.svg si55 si55.svg svg 7032 ALTIMG 1-s2.0-S0360544220315644-si20.svg https://s3-eu-west-1.amazonaws.com/prod-ucs-content-store-eu-west/content/pii:S0360544220315644/STRIPIN/image/svg+xml/e27df054ec109d2a3997ca85456e4b2a/si20.svg si20 si20.svg svg 3833 ALTIMG 1-s2.0-S0360544220315644-si74.svg https://s3-eu-west-1.amazonaws.com/prod-ucs-content-store-eu-west/content/pii:S0360544220315644/STRIPIN/image/svg+xml/992f3637a4efc004c717a591e2bac7c3/si74.svg si74 si74.svg svg 4704 ALTIMG 1-s2.0-S0360544220315644-si150.svg https://s3-eu-west-1.amazonaws.com/prod-ucs-content-store-eu-west/content/pii:S0360544220315644/STRIPIN/image/svg+xml/1a56c06e03a18932ee46616bc0df2c9e/si150.svg si150 si150.svg svg 24663 ALTIMG 1-s2.0-S0360544220315644-si68.svg https://s3-eu-west-1.amazonaws.com/prod-ucs-content-store-eu-west/content/pii:S0360544220315644/STRIPIN/image/svg+xml/e95edfffc3eb31aa25abff591d019d4d/si68.svg si68 si68.svg svg 7375 ALTIMG 1-s2.0-S0360544220315644-si92.svg https://s3-eu-west-1.amazonaws.com/prod-ucs-content-store-eu-west/content/pii:S0360544220315644/STRIPIN/image/svg+xml/336e2c71cdab957c734b3ccf3725e89a/si92.svg si92 si92.svg svg 47133 ALTIMG 1-s2.0-S0360544220315644-si67.svg https://s3-eu-west-1.amazonaws.com/prod-ucs-content-store-eu-west/content/pii:S0360544220315644/STRIPIN/image/svg+xml/7a4517f80d9d1eb387742b2865b105c4/si67.svg si67 si67.svg svg 2750 ALTIMG 1-s2.0-S0360544220315644-si34.svg https://s3-eu-west-1.amazonaws.com/prod-ucs-content-store-eu-west/content/pii:S0360544220315644/STRIPIN/image/svg+xml/bf8782da64327f28d4a2be4f08a152d3/si34.svg si34 si34.svg svg 6880 ALTIMG 1-s2.0-S0360544220315644-si48.svg https://s3-eu-west-1.amazonaws.com/prod-ucs-content-store-eu-west/content/pii:S0360544220315644/STRIPIN/image/svg+xml/1297a3961643c9bc19234a2351ed322b/si48.svg si48 si48.svg svg 7350 ALTIMG 1-s2.0-S0360544220315644-si160.svg https://s3-eu-west-1.amazonaws.com/prod-ucs-content-store-eu-west/content/pii:S0360544220315644/STRIPIN/image/svg+xml/fb715196912f3ccd4b4d1aaaad330df8/si160.svg si160 si160.svg svg 7763 ALTIMG 1-s2.0-S0360544220315644-si1.svg https://s3-eu-west-1.amazonaws.com/prod-ucs-content-store-eu-west/content/pii:S0360544220315644/STRIPIN/image/svg+xml/18856f1fea470b4aa50b07487a4edfa5/si1.svg si1 si1.svg svg 15239 ALTIMG 1-s2.0-S0360544220315644-si4.svg https://s3-eu-west-1.amazonaws.com/prod-ucs-content-store-eu-west/content/pii:S0360544220315644/STRIPIN/image/svg+xml/11e8c3ca921c691f2526a28770febf7c/si4.svg si4 si4.svg svg 13629 ALTIMG 1-s2.0-S0360544220315644-si73.svg https://s3-eu-west-1.amazonaws.com/prod-ucs-content-store-eu-west/content/pii:S0360544220315644/STRIPIN/image/svg+xml/9f71c725e86ae27a00fd2ece2b944af5/si73.svg si73 si73.svg svg 9749 ALTIMG 1-s2.0-S0360544220315644-si132.svg https://s3-eu-west-1.amazonaws.com/prod-ucs-content-store-eu-west/content/pii:S0360544220315644/STRIPIN/image/svg+xml/59ba7506213be92fc1a7eb26ff79e4d3/si132.svg si132 si132.svg svg 17939 ALTIMG 1-s2.0-S0360544220315644-si66.svg https://s3-eu-west-1.amazonaws.com/prod-ucs-content-store-eu-west/content/pii:S0360544220315644/STRIPIN/image/svg+xml/50b8c9f009e335ae10fa5978c88e85b1/si66.svg si66 si66.svg svg 7833 ALTIMG 1-s2.0-S0360544220315644-si3.svg https://s3-eu-west-1.amazonaws.com/prod-ucs-content-store-eu-west/content/pii:S0360544220315644/STRIPIN/image/svg+xml/47f5556ed4ed0c438075394e817dcee3/si3.svg si3 si3.svg svg 4701 ALTIMG 1-s2.0-S0360544220315644-si135.svg https://s3-eu-west-1.amazonaws.com/prod-ucs-content-store-eu-west/content/pii:S0360544220315644/STRIPIN/image/svg+xml/c27c594a2f7b35bedce1c81da4d01f95/si135.svg si135 si135.svg svg 34782 ALTIMG 1-s2.0-S0360544220315644-si104.svg https://s3-eu-west-1.amazonaws.com/prod-ucs-content-store-eu-west/content/pii:S0360544220315644/STRIPIN/image/svg+xml/1b8a3cc54e1705f2d1390e5c6e7d2cb5/si104.svg si104 si104.svg svg 13178 ALTIMG 1-s2.0-S0360544220315644-si61.svg https://s3-eu-west-1.amazonaws.com/prod-ucs-content-store-eu-west/content/pii:S0360544220315644/STRIPIN/image/svg+xml/42d0a955f9572c02b514d848302bd0e8/si61.svg si61 si61.svg svg 6316 ALTIMG 1-s2.0-S0360544220315644-si89.svg https://s3-eu-west-1.amazonaws.com/prod-ucs-content-store-eu-west/content/pii:S0360544220315644/STRIPIN/image/svg+xml/c6514f54c6524b82766a4d0b76282d59/si89.svg si89 si89.svg svg 25625 ALTIMG 1-s2.0-S0360544220315644-si84.svg https://s3-eu-west-1.amazonaws.com/prod-ucs-content-store-eu-west/content/pii:S0360544220315644/STRIPIN/image/svg+xml/2761ee90c9b48b48b0e5ec8393e79491/si84.svg si84 si84.svg svg 7584 ALTIMG 1-s2.0-S0360544220315644-si26.svg https://s3-eu-west-1.amazonaws.com/prod-ucs-content-store-eu-west/content/pii:S0360544220315644/STRIPIN/image/svg+xml/eb83babd839f673845a6206974533601/si26.svg si26 si26.svg svg 13141 ALTIMG 1-s2.0-S0360544220315644-si37.svg https://s3-eu-west-1.amazonaws.com/prod-ucs-content-store-eu-west/content/pii:S0360544220315644/STRIPIN/image/svg+xml/1051fa341c0723e79ccbc01fda918164/si37.svg si37 si37.svg svg 7509 ALTIMG 1-s2.0-S0360544220315644-si167.svg https://s3-eu-west-1.amazonaws.com/prod-ucs-content-store-eu-west/content/pii:S0360544220315644/STRIPIN/image/svg+xml/d051b1313e03607de0f0ff780136c690/si167.svg si167 si167.svg svg 6045 ALTIMG 1-s2.0-S0360544220315644-si156.svg https://s3-eu-west-1.amazonaws.com/prod-ucs-content-store-eu-west/content/pii:S0360544220315644/STRIPIN/image/svg+xml/79c57323de40c7a72680abe6c803b4f5/si156.svg si156 si156.svg svg 18858 ALTIMG 1-s2.0-S0360544220315644-si162.svg https://s3-eu-west-1.amazonaws.com/prod-ucs-content-store-eu-west/content/pii:S0360544220315644/STRIPIN/image/svg+xml/bdba54d522b0910c1f02f46293244669/si162.svg si162 si162.svg svg 3886 ALTIMG 1-s2.0-S0360544220315644-si45.svg https://s3-eu-west-1.amazonaws.com/prod-ucs-content-store-eu-west/content/pii:S0360544220315644/STRIPIN/image/svg+xml/77275c4b452f5205999920cd150daaeb/si45.svg si45 si45.svg svg 6595 ALTIMG 1-s2.0-S0360544220315644-si90.svg https://s3-eu-west-1.amazonaws.com/prod-ucs-content-store-eu-west/content/pii:S0360544220315644/STRIPIN/image/svg+xml/9f360918b046835eaf12c12c6fbb9018/si90.svg si90 si90.svg svg 64155 ALTIMG 1-s2.0-S0360544220315644-si62.svg https://s3-eu-west-1.amazonaws.com/prod-ucs-content-store-eu-west/content/pii:S0360544220315644/STRIPIN/image/svg+xml/33ad18664c5193ad6fab2512c102d669/si62.svg si62 si62.svg svg 3707 ALTIMG 1-s2.0-S0360544220315644-si49.svg https://s3-eu-west-1.amazonaws.com/prod-ucs-content-store-eu-west/content/pii:S0360544220315644/STRIPIN/image/svg+xml/9d10c03def72f8b2581aa854b97814cd/si49.svg si49 si49.svg svg 3891 ALTIMG 1-s2.0-S0360544220315644-si120.svg https://s3-eu-west-1.amazonaws.com/prod-ucs-content-store-eu-west/content/pii:S0360544220315644/STRIPIN/image/svg+xml/de494e46092beb02e575cb8d629929ad/si120.svg si120 si120.svg svg 7094 ALTIMG 1-s2.0-S0360544220315644-si107.svg https://s3-eu-west-1.amazonaws.com/prod-ucs-content-store-eu-west/content/pii:S0360544220315644/STRIPIN/image/svg+xml/105b21966a2ff7e904ae38e8d3b5240c/si107.svg si107 si107.svg svg 5118 ALTIMG 1-s2.0-S0360544220315644-si96.svg https://s3-eu-west-1.amazonaws.com/prod-ucs-content-store-eu-west/content/pii:S0360544220315644/STRIPIN/image/svg+xml/40d48c5f9bd2f858dd1735e1177f5e2c/si96.svg si96 si96.svg svg 20366 ALTIMG 1-s2.0-S0360544220315644-si31.svg https://s3-eu-west-1.amazonaws.com/prod-ucs-content-store-eu-west/content/pii:S0360544220315644/STRIPIN/image/svg+xml/753a8d5b9d884015987b65d064addd9e/si31.svg si31 si31.svg svg 3932 ALTIMG 1-s2.0-S0360544220315644-si69.svg https://s3-eu-west-1.amazonaws.com/prod-ucs-content-store-eu-west/content/pii:S0360544220315644/STRIPIN/image/svg+xml/5442465fd832cd31174d8db3d651da0a/si69.svg si69 si69.svg svg 3032 ALTIMG 1-s2.0-S0360544220315644-si87.svg https://s3-eu-west-1.amazonaws.com/prod-ucs-content-store-eu-west/content/pii:S0360544220315644/STRIPIN/image/svg+xml/5361a06011ff76a3019186dfdf2643e3/si87.svg si87 si87.svg svg 4030 ALTIMG 1-s2.0-S0360544220315644-si78.svg https://s3-eu-west-1.amazonaws.com/prod-ucs-content-store-eu-west/content/pii:S0360544220315644/STRIPIN/image/svg+xml/07668a4ba5cfbf802cf1627e715fb6f2/si78.svg si78 si78.svg svg 7126 ALTIMG 1-s2.0-S0360544220315644-si33.svg https://s3-eu-west-1.amazonaws.com/prod-ucs-content-store-eu-west/content/pii:S0360544220315644/STRIPIN/image/svg+xml/c66ee80903bdbc9372b5d72dc1113d3c/si33.svg si33 si33.svg svg 7896 ALTIMG 1-s2.0-S0360544220315644-si123.svg https://s3-eu-west-1.amazonaws.com/prod-ucs-content-store-eu-west/content/pii:S0360544220315644/STRIPIN/image/svg+xml/fc2734a35ae7b706d0992320aad4adcb/si123.svg si123 si123.svg svg 3846 ALTIMG 1-s2.0-S0360544220315644-si161.svg https://s3-eu-west-1.amazonaws.com/prod-ucs-content-store-eu-west/content/pii:S0360544220315644/STRIPIN/image/svg+xml/c4976bc5f1121ae6f6afda63cfd54fde/si161.svg si161 si161.svg svg 3664 ALTIMG 1-s2.0-S0360544220315644-si101.svg https://s3-eu-west-1.amazonaws.com/prod-ucs-content-store-eu-west/content/pii:S0360544220315644/STRIPIN/image/svg+xml/9b8989606d4d1718f5cf5edf6a52c1d7/si101.svg si101 si101.svg svg 36310 ALTIMG 1-s2.0-S0360544220315644-si38.svg https://s3-eu-west-1.amazonaws.com/prod-ucs-content-store-eu-west/content/pii:S0360544220315644/STRIPIN/image/svg+xml/7041408d5bba34bba70922bbb605374c/si38.svg si38 si38.svg svg 15420 ALTIMG 1-s2.0-S0360544220315644-si128.svg https://s3-eu-west-1.amazonaws.com/prod-ucs-content-store-eu-west/content/pii:S0360544220315644/STRIPIN/image/svg+xml/8ece8d08ec6b1d54b5d83e85195604d1/si128.svg si128 si128.svg svg 35158 ALTIMG 1-s2.0-S0360544220315644-si29.svg https://s3-eu-west-1.amazonaws.com/prod-ucs-content-store-eu-west/content/pii:S0360544220315644/STRIPIN/image/svg+xml/5b2189ed0ec31c6297e8e56e9b26edfa/si29.svg si29 si29.svg svg 2628 ALTIMG 1-s2.0-S0360544220315644-si72.svg https://s3-eu-west-1.amazonaws.com/prod-ucs-content-store-eu-west/content/pii:S0360544220315644/STRIPIN/image/svg+xml/c13cb875984f27a3817f686df4daaa44/si72.svg si72 si72.svg svg 3885 ALTIMG 1-s2.0-S0360544220315644-si57.svg https://s3-eu-west-1.amazonaws.com/prod-ucs-content-store-eu-west/content/pii:S0360544220315644/STRIPIN/image/svg+xml/8f5aedbc7fb581545d4120a39335f627/si57.svg si57 si57.svg svg 6904 ALTIMG 1-s2.0-S0360544220315644-si59.svg https://s3-eu-west-1.amazonaws.com/prod-ucs-content-store-eu-west/content/pii:S0360544220315644/STRIPIN/image/svg+xml/1e9f6a9a30bcd9dcdb49bef46f4db8e5/si59.svg si59 si59.svg svg 6316 ALTIMG 1-s2.0-S0360544220315644-si13.svg https://s3-eu-west-1.amazonaws.com/prod-ucs-content-store-eu-west/content/pii:S0360544220315644/STRIPIN/image/svg+xml/73c4777d8ff366936cd52ebb4a0b14a1/si13.svg si13 si13.svg svg 4423 ALTIMG 1-s2.0-S0360544220315644-si139.svg https://s3-eu-west-1.amazonaws.com/prod-ucs-content-store-eu-west/content/pii:S0360544220315644/STRIPIN/image/svg+xml/b1e4539021fb4dd0c90b90bab5a34666/si139.svg si139 si139.svg svg 20323 ALTIMG 1-s2.0-S0360544220315644-si146.svg https://s3-eu-west-1.amazonaws.com/prod-ucs-content-store-eu-west/content/pii:S0360544220315644/STRIPIN/image/svg+xml/56f939219d967371817b15b69052e320/si146.svg si146 si146.svg svg 10554 ALTIMG 1-s2.0-S0360544220315644-si43.svg https://s3-eu-west-1.amazonaws.com/prod-ucs-content-store-eu-west/content/pii:S0360544220315644/STRIPIN/image/svg+xml/58cac428758e328078ab450d292515d1/si43.svg si43 si43.svg svg 6211 ALTIMG 1-s2.0-S0360544220315644-si28.svg https://s3-eu-west-1.amazonaws.com/prod-ucs-content-store-eu-west/content/pii:S0360544220315644/STRIPIN/image/svg+xml/849e7393e5201c0c90f669ae1cec27b6/si28.svg si28 si28.svg svg 6180 ALTIMG 1-s2.0-S0360544220315644-si85.svg https://s3-eu-west-1.amazonaws.com/prod-ucs-content-store-eu-west/content/pii:S0360544220315644/STRIPIN/image/svg+xml/550794493d8d38c4fc500cf820b8642b/si85.svg si85 si85.svg svg 34316 ALTIMG 1-s2.0-S0360544220315644-si93.svg https://s3-eu-west-1.amazonaws.com/prod-ucs-content-store-eu-west/content/pii:S0360544220315644/STRIPIN/image/svg+xml/4f121f7bfc56db4569254d665176c0ed/si93.svg si93 si93.svg svg 30924 ALTIMG 1-s2.0-S0360544220315644-si91.svg https://s3-eu-west-1.amazonaws.com/prod-ucs-content-store-eu-west/content/pii:S0360544220315644/STRIPIN/image/svg+xml/712952961689e8f7b3798751fecaa50b/si91.svg si91 si91.svg svg 8627 ALTIMG 1-s2.0-S0360544220315644-si114.svg https://s3-eu-west-1.amazonaws.com/prod-ucs-content-store-eu-west/content/pii:S0360544220315644/STRIPIN/image/svg+xml/35407aa8a305941084b8e164fa7409da/si114.svg si114 si114.svg svg 4073 ALTIMG 1-s2.0-S0360544220315644-si100.svg https://s3-eu-west-1.amazonaws.com/prod-ucs-content-store-eu-west/content/pii:S0360544220315644/STRIPIN/image/svg+xml/6de3f8dbb3ca1ccb5181c8cf0010f4e8/si100.svg si100 si100.svg svg 10573 ALTIMG 1-s2.0-S0360544220315644-si159.svg https://s3-eu-west-1.amazonaws.com/prod-ucs-content-store-eu-west/content/pii:S0360544220315644/STRIPIN/image/svg+xml/2fda96ca65387ef4ba5f46e659d60b90/si159.svg si159 si159.svg svg 6943 ALTIMG 1-s2.0-S0360544220315644-si71.svg https://s3-eu-west-1.amazonaws.com/prod-ucs-content-store-eu-west/content/pii:S0360544220315644/STRIPIN/image/svg+xml/7022da180a5326983f743bda3ae76f69/si71.svg si71 si71.svg svg 3656 ALTIMG 1-s2.0-S0360544220315644-si122.svg https://s3-eu-west-1.amazonaws.com/prod-ucs-content-store-eu-west/content/pii:S0360544220315644/STRIPIN/image/svg+xml/ad396cbe0e0106edf4ee3bf9663f484e/si122.svg si122 si122.svg svg 4918 ALTIMG 1-s2.0-S0360544220315644-si22.svg https://s3-eu-west-1.amazonaws.com/prod-ucs-content-store-eu-west/content/pii:S0360544220315644/STRIPIN/image/svg+xml/01790941f9da9603d67ff81b9209b48d/si22.svg si22 si22.svg svg 2352 ALTIMG 1-s2.0-S0360544220315644-si130.svg https://s3-eu-west-1.amazonaws.com/prod-ucs-content-store-eu-west/content/pii:S0360544220315644/STRIPIN/image/svg+xml/b7bdc30c8827e154acec01f7998aba28/si130.svg si130 si130.svg svg 4556 ALTIMG 1-s2.0-S0360544220315644-si108.svg https://s3-eu-west-1.amazonaws.com/prod-ucs-content-store-eu-west/content/pii:S0360544220315644/STRIPIN/image/svg+xml/4498159fbd34fa6c207d16ab03859e11/si108.svg si108 si108.svg svg 4505 ALTIMG 1-s2.0-S0360544220315644-si153.svg https://s3-eu-west-1.amazonaws.com/prod-ucs-content-store-eu-west/content/pii:S0360544220315644/STRIPIN/image/svg+xml/9a3aacf0f98a89a8fda9e2ab55630bd9/si153.svg si153 si153.svg svg 10917 ALTIMG 1-s2.0-S0360544220315644-si14.svg https://s3-eu-west-1.amazonaws.com/prod-ucs-content-store-eu-west/content/pii:S0360544220315644/STRIPIN/image/svg+xml/ba4761b5b277eb405f088f1061547111/si14.svg si14 si14.svg svg 3435 ALTIMG 1-s2.0-S0360544220315644-si58.svg https://s3-eu-west-1.amazonaws.com/prod-ucs-content-store-eu-west/content/pii:S0360544220315644/STRIPIN/image/svg+xml/5ddb009db5d113312176065992c20d20/si58.svg si58 si58.svg svg 6442 ALTIMG 1-s2.0-S0360544220315644-si23.svg https://s3-eu-west-1.amazonaws.com/prod-ucs-content-store-eu-west/content/pii:S0360544220315644/STRIPIN/image/svg+xml/9070c897ced2ca18ccc4deca239bb700/si23.svg si23 si23.svg svg 8754 ALTIMG 1-s2.0-S0360544220315644-si121.svg https://s3-eu-west-1.amazonaws.com/prod-ucs-content-store-eu-west/content/pii:S0360544220315644/STRIPIN/image/svg+xml/612982a04d82e89ea9cfc679d68a4c01/si121.svg si121 si121.svg svg 6504 ALTIMG 1-s2.0-S0360544220315644-si116.svg https://s3-eu-west-1.amazonaws.com/prod-ucs-content-store-eu-west/content/pii:S0360544220315644/STRIPIN/image/svg+xml/3563cfdca9e96e9dedd0e416ef7f73ce/si116.svg si116 si116.svg svg 6349 ALTIMG 1-s2.0-S0360544220315644-si144.svg https://s3-eu-west-1.amazonaws.com/prod-ucs-content-store-eu-west/content/pii:S0360544220315644/STRIPIN/image/svg+xml/fa2687b17c57a47043d8dfbfa0076c23/si144.svg si144 si144.svg svg 27186 ALTIMG 1-s2.0-S0360544220315644-si47.svg https://s3-eu-west-1.amazonaws.com/prod-ucs-content-store-eu-west/content/pii:S0360544220315644/STRIPIN/image/svg+xml/d9a3559d6605a871b6c134bea35c9e53/si47.svg si47 si47.svg svg 5522 ALTIMG 1-s2.0-S0360544220315644-si166.svg https://s3-eu-west-1.amazonaws.com/prod-ucs-content-store-eu-west/content/pii:S0360544220315644/STRIPIN/image/svg+xml/66fa1879fb7ae6458d7255536e2b52bc/si166.svg si166 si166.svg svg 15349 ALTIMG 1-s2.0-S0360544220315644-si113.svg https://s3-eu-west-1.amazonaws.com/prod-ucs-content-store-eu-west/content/pii:S0360544220315644/STRIPIN/image/svg+xml/86cc34056210dcb74df5ca4e23b2727d/si113.svg si113 si113.svg svg 6446 ALTIMG 1-s2.0-S0360544220315644-si117.svg https://s3-eu-west-1.amazonaws.com/prod-ucs-content-store-eu-west/content/pii:S0360544220315644/STRIPIN/image/svg+xml/e22376cb0581d4261c9855bd2da869ce/si117.svg si117 si117.svg svg 6945 ALTIMG 1-s2.0-S0360544220315644-si82.svg https://s3-eu-west-1.amazonaws.com/prod-ucs-content-store-eu-west/content/pii:S0360544220315644/STRIPIN/image/svg+xml/b88576f55bddb5f6ae929680499259dd/si82.svg si82 si82.svg svg 6538 ALTIMG 1-s2.0-S0360544220315644-si129.svg https://s3-eu-west-1.amazonaws.com/prod-ucs-content-store-eu-west/content/pii:S0360544220315644/STRIPIN/image/svg+xml/aef5e292932a49da4557099d9823922f/si129.svg si129 si129.svg svg 4118 ALTIMG 1-s2.0-S0360544220315644-si88.svg https://s3-eu-west-1.amazonaws.com/prod-ucs-content-store-eu-west/content/pii:S0360544220315644/STRIPIN/image/svg+xml/32be985b053558f67724380e63cdda37/si88.svg si88 si88.svg svg 44072 ALTIMG 1-s2.0-S0360544220315644-si134.svg https://s3-eu-west-1.amazonaws.com/prod-ucs-content-store-eu-west/content/pii:S0360544220315644/STRIPIN/image/svg+xml/703ffdd4ccf77317fde5cf6c9b863787/si134.svg si134 si134.svg svg 23709 ALTIMG 1-s2.0-S0360544220315644-si10.svg https://s3-eu-west-1.amazonaws.com/prod-ucs-content-store-eu-west/content/pii:S0360544220315644/STRIPIN/image/svg+xml/7da7b45b7e221c5a50db454e1e902c7a/si10.svg si10 si10.svg svg 8675 ALTIMG 1-s2.0-S0360544220315644-si102.svg https://s3-eu-west-1.amazonaws.com/prod-ucs-content-store-eu-west/content/pii:S0360544220315644/STRIPIN/image/svg+xml/03f555bf2b8e2cbefb60d9cb261e4f20/si102.svg si102 si102.svg svg 23736 ALTIMG 1-s2.0-S0360544220315644-si40.svg https://s3-eu-west-1.amazonaws.com/prod-ucs-content-store-eu-west/content/pii:S0360544220315644/STRIPIN/image/svg+xml/21c2a1e63d70e1e46d3e1eb3756a111b/si40.svg si40 si40.svg svg 6530 ALTIMG 1-s2.0-S0360544220315644-si115.svg https://s3-eu-west-1.amazonaws.com/prod-ucs-content-store-eu-west/content/pii:S0360544220315644/STRIPIN/image/svg+xml/144e157fcac8051cb03074da4aeb0036/si115.svg si115 si115.svg svg 5887 ALTIMG 1-s2.0-S0360544220315644-si36.svg https://s3-eu-west-1.amazonaws.com/prod-ucs-content-store-eu-west/content/pii:S0360544220315644/STRIPIN/image/svg+xml/f2708247c2c83da95e31de9547eb1245/si36.svg si36 si36.svg svg 5966 ALTIMG 1-s2.0-S0360544220315644-si152.svg https://s3-eu-west-1.amazonaws.com/prod-ucs-content-store-eu-west/content/pii:S0360544220315644/STRIPIN/image/svg+xml/37e54cec54eaa013b1b91ac3c3e9f488/si152.svg si152 si152.svg svg 7032 ALTIMG 1-s2.0-S0360544220315644-si17.svg https://s3-eu-west-1.amazonaws.com/prod-ucs-content-store-eu-west/content/pii:S0360544220315644/STRIPIN/image/svg+xml/283a21c2d423913c9d7d7e578b42fe00/si17.svg si17 si17.svg svg 4053 ALTIMG 1-s2.0-S0360544220315644-si158.svg https://s3-eu-west-1.amazonaws.com/prod-ucs-content-store-eu-west/content/pii:S0360544220315644/STRIPIN/image/svg+xml/757f9a1ac977d610d780ba8e19d75be7/si158.svg si158 si158.svg svg 5882 ALTIMG 1-s2.0-S0360544220315644-si21.svg https://s3-eu-west-1.amazonaws.com/prod-ucs-content-store-eu-west/content/pii:S0360544220315644/STRIPIN/image/svg+xml/e308d1a5d3ea71977ff0e7e5a52b050e/si21.svg si21 si21.svg svg 3340 ALTIMG 1-s2.0-S0360544220315644-si118.svg https://s3-eu-west-1.amazonaws.com/prod-ucs-content-store-eu-west/content/pii:S0360544220315644/STRIPIN/image/svg+xml/32779f1c6af8c39c0689e0bef0f21147/si118.svg si118 si118.svg svg 3953 ALTIMG 1-s2.0-S0360544220315644-si119.svg https://s3-eu-west-1.amazonaws.com/prod-ucs-content-store-eu-west/content/pii:S0360544220315644/STRIPIN/image/svg+xml/5466d5490cf6efa8cca8156172362f1f/si119.svg si119 si119.svg svg 11647 ALTIMG 1-s2.0-S0360544220315644-si12.svg https://s3-eu-west-1.amazonaws.com/prod-ucs-content-store-eu-west/content/pii:S0360544220315644/STRIPIN/image/svg+xml/d847220ae937b20f74f6633db0d27881/si12.svg si12 si12.svg svg 8435 ALTIMG 1-s2.0-S0360544220315644-si32.svg https://s3-eu-west-1.amazonaws.com/prod-ucs-content-store-eu-west/content/pii:S0360544220315644/STRIPIN/image/svg+xml/88ce43713433b6fd0ea31545ca54ff6a/si32.svg si32 si32.svg svg 6399 ALTIMG 1-s2.0-S0360544220315644-si64.svg https://s3-eu-west-1.amazonaws.com/prod-ucs-content-store-eu-west/content/pii:S0360544220315644/STRIPIN/image/svg+xml/1b8b0e50a50694ae935feb978bc5fbb9/si64.svg si64 si64.svg svg 6393 ALTIMG 1-s2.0-S0360544220315644-si109.svg https://s3-eu-west-1.amazonaws.com/prod-ucs-content-store-eu-west/content/pii:S0360544220315644/STRIPIN/image/svg+xml/dbc67f926b46d4d86720ffa02e8958e8/si109.svg si109 si109.svg svg 5290 ALTIMG 1-s2.0-S0360544220315644-si7.svg https://s3-eu-west-1.amazonaws.com/prod-ucs-content-store-eu-west/content/pii:S0360544220315644/STRIPIN/image/svg+xml/f41a2f3d1c37422fc9d354750ba67a2e/si7.svg si7 si7.svg svg 12544 ALTIMG 1-s2.0-S0360544220315644-si106.svg https://s3-eu-west-1.amazonaws.com/prod-ucs-content-store-eu-west/content/pii:S0360544220315644/STRIPIN/image/svg+xml/7557dbebbdadd29801a25b4556c54929/si106.svg si106 si106.svg svg 4494 ALTIMG 1-s2.0-S0360544220315644-si79.svg https://s3-eu-west-1.amazonaws.com/prod-ucs-content-store-eu-west/content/pii:S0360544220315644/STRIPIN/image/svg+xml/95980be4eda60a4666c21ab9e24f8a0b/si79.svg si79 si79.svg svg 6664 ALTIMG 1-s2.0-S0360544220315644-si110.svg https://s3-eu-west-1.amazonaws.com/prod-ucs-content-store-eu-west/content/pii:S0360544220315644/STRIPIN/image/svg+xml/eb37128f9e58ad6f0d8e64605cf03d4a/si110.svg si110 si110.svg svg 5140 ALTIMG 1-s2.0-S0360544220315644-si164.svg https://s3-eu-west-1.amazonaws.com/prod-ucs-content-store-eu-west/content/pii:S0360544220315644/STRIPIN/image/svg+xml/a6e7e3d755ff62081d9e8b40a3da8d01/si164.svg si164 si164.svg svg 5529 ALTIMG 1-s2.0-S0360544220315644-si44.svg https://s3-eu-west-1.amazonaws.com/prod-ucs-content-store-eu-west/content/pii:S0360544220315644/STRIPIN/image/svg+xml/c38057c107413e40a1893651d1295632/si44.svg si44 si44.svg svg 4208 ALTIMG 1-s2.0-S0360544220315644-si168.svg https://s3-eu-west-1.amazonaws.com/prod-ucs-content-store-eu-west/content/pii:S0360544220315644/STRIPIN/image/svg+xml/49929dd7ff90319863309b6a7ab68f31/si168.svg si168 si168.svg svg 4219 ALTIMG 1-s2.0-S0360544220315644-si136.svg https://s3-eu-west-1.amazonaws.com/prod-ucs-content-store-eu-west/content/pii:S0360544220315644/STRIPIN/image/svg+xml/2e99bd8d97b0e104d895776b9a9162ae/si136.svg si136 si136.svg svg 18340 ALTIMG 1-s2.0-S0360544220315644-si76.svg https://s3-eu-west-1.amazonaws.com/prod-ucs-content-store-eu-west/content/pii:S0360544220315644/STRIPIN/image/svg+xml/ac3f64fbcf5c943c70575754c2f3dca3/si76.svg si76 si76.svg svg 7254 ALTIMG 1-s2.0-S0360544220315644-si163.svg https://s3-eu-west-1.amazonaws.com/prod-ucs-content-store-eu-west/content/pii:S0360544220315644/STRIPIN/image/svg+xml/7ffad46a6a46a7127487891c41724446/si163.svg si163 si163.svg svg 5309 ALTIMG 1-s2.0-S0360544220315644-si154.svg https://s3-eu-west-1.amazonaws.com/prod-ucs-content-store-eu-west/content/pii:S0360544220315644/STRIPIN/image/svg+xml/6f27781127f88496d473995b6a53cd70/si154.svg si154 si154.svg svg 2628 ALTIMG 1-s2.0-S0360544220315644-si94.svg https://s3-eu-west-1.amazonaws.com/prod-ucs-content-store-eu-west/content/pii:S0360544220315644/STRIPIN/image/svg+xml/359a3a42502f94e2038c327953f9e96d/si94.svg si94 si94.svg svg 8104 ALTIMG 1-s2.0-S0360544220315644-si133.svg https://s3-eu-west-1.amazonaws.com/prod-ucs-content-store-eu-west/content/pii:S0360544220315644/STRIPIN/image/svg+xml/5b9eb92013a1acdb74d3bcf69f065059/si133.svg si133 si133.svg svg 29481 ALTIMG 1-s2.0-S0360544220315644-si19.svg https://s3-eu-west-1.amazonaws.com/prod-ucs-content-store-eu-west/content/pii:S0360544220315644/STRIPIN/image/svg+xml/9b83450c5c4554561122aa976ff63b9e/si19.svg si19 si19.svg svg 4055 ALTIMG 1-s2.0-S0360544220315644-si41.svg https://s3-eu-west-1.amazonaws.com/prod-ucs-content-store-eu-west/content/pii:S0360544220315644/STRIPIN/image/svg+xml/2695b76c400051422566f2c97628d277/si41.svg si41 si41.svg svg 14261 ALTIMG 1-s2.0-S0360544220315644-si8.svg https://s3-eu-west-1.amazonaws.com/prod-ucs-content-store-eu-west/content/pii:S0360544220315644/STRIPIN/image/svg+xml/205388438cdb8d24f8857d032e6bf4de/si8.svg si8 si8.svg svg 7991 ALTIMG 1-s2.0-S0360544220315644-si103.svg https://s3-eu-west-1.amazonaws.com/prod-ucs-content-store-eu-west/content/pii:S0360544220315644/STRIPIN/image/svg+xml/8bf739797a4a72d2237e5a0493d3240f/si103.svg si103 si103.svg svg 22173 ALTIMG 1-s2.0-S0360544220315644-si30.svg https://s3-eu-west-1.amazonaws.com/prod-ucs-content-store-eu-west/content/pii:S0360544220315644/STRIPIN/image/svg+xml/ace8d37a27cb25c4e0946bdae279aad1/si30.svg si30 si30.svg svg 7310 ALTIMG 1-s2.0-S0360544220315644-si39.svg https://s3-eu-west-1.amazonaws.com/prod-ucs-content-store-eu-west/content/pii:S0360544220315644/STRIPIN/image/svg+xml/1df33a68b9ee0774d0c50c2f9c4b1f73/si39.svg si39 si39.svg svg 3031 ALTIMG 1-s2.0-S0360544220315644-si145.svg https://s3-eu-west-1.amazonaws.com/prod-ucs-content-store-eu-west/content/pii:S0360544220315644/STRIPIN/image/svg+xml/314e238821f434179bea7882bb04c6a2/si145.svg si145 si145.svg svg 16543 ALTIMG 1-s2.0-S0360544220315644-si112.svg https://s3-eu-west-1.amazonaws.com/prod-ucs-content-store-eu-west/content/pii:S0360544220315644/STRIPIN/image/svg+xml/201107ead95915bf1ef6f7fb469117ed/si112.svg si112 si112.svg svg 42350 ALTIMG 1-s2.0-S0360544220315644-si54.svg https://s3-eu-west-1.amazonaws.com/prod-ucs-content-store-eu-west/content/pii:S0360544220315644/STRIPIN/image/svg+xml/2b30bbac06f24334ea5e52807ba57f0e/si54.svg si54 si54.svg svg 5938 ALTIMG 1-s2.0-S0360544220315644-si165.svg https://s3-eu-west-1.amazonaws.com/prod-ucs-content-store-eu-west/content/pii:S0360544220315644/STRIPIN/image/svg+xml/04880008e80ec324134e5859e3416988/si165.svg si165 si165.svg svg 5839 ALTIMG 1-s2.0-S0360544220315644-si24.svg https://s3-eu-west-1.amazonaws.com/prod-ucs-content-store-eu-west/content/pii:S0360544220315644/STRIPIN/image/svg+xml/e37a1d96f8796cff5ab8160303907c92/si24.svg si24 si24.svg svg 3268 ALTIMG 1-s2.0-S0360544220315644-si53.svg https://s3-eu-west-1.amazonaws.com/prod-ucs-content-store-eu-west/content/pii:S0360544220315644/STRIPIN/image/svg+xml/d1db7f069f8c3f4dc5d294e4fe0c9578/si53.svg si53 si53.svg svg 13228 ALTIMG 1-s2.0-S0360544220315644-si147.svg https://s3-eu-west-1.amazonaws.com/prod-ucs-content-store-eu-west/content/pii:S0360544220315644/STRIPIN/image/svg+xml/f40f1479a7e8bd2205fde5270179b6b9/si147.svg si147 si147.svg svg 20850 ALTIMG 1-s2.0-S0360544220315644-si99.svg https://s3-eu-west-1.amazonaws.com/prod-ucs-content-store-eu-west/content/pii:S0360544220315644/STRIPIN/image/svg+xml/a9837f631a32c584dc4ec51a5a3c1497/si99.svg si99 si99.svg svg 12181 ALTIMG 1-s2.0-S0360544220315644-si137.svg https://s3-eu-west-1.amazonaws.com/prod-ucs-content-store-eu-west/content/pii:S0360544220315644/STRIPIN/image/svg+xml/51a1fef0b0270894d0bbb8ce93e400d4/si137.svg si137 si137.svg svg 41114 ALTIMG 1-s2.0-S0360544220315644-si124.svg https://s3-eu-west-1.amazonaws.com/prod-ucs-content-store-eu-west/content/pii:S0360544220315644/STRIPIN/image/svg+xml/cdceb4f04516cc7173ba0ff6128bf82c/si124.svg si124 si124.svg svg 4534 ALTIMG 1-s2.0-S0360544220315644-si35.svg https://s3-eu-west-1.amazonaws.com/prod-ucs-content-store-eu-west/content/pii:S0360544220315644/STRIPIN/image/svg+xml/7e6148bbf8aed31298dff41c3e9dae21/si35.svg si35 si35.svg svg 5518 ALTIMG 1-s2.0-S0360544220315644-si80.svg https://s3-eu-west-1.amazonaws.com/prod-ucs-content-store-eu-west/content/pii:S0360544220315644/STRIPIN/image/svg+xml/04b92c9fec403e33b2de9fa5d16017b8/si80.svg si80 si80.svg svg 6538 ALTIMG 1-s2.0-S0360544220315644-si141.svg https://s3-eu-west-1.amazonaws.com/prod-ucs-content-store-eu-west/content/pii:S0360544220315644/STRIPIN/image/svg+xml/cad731acdeb5f4bcc4155d9681b18ae0/si141.svg si141 si141.svg svg 15433 ALTIMG 1-s2.0-S0360544220315644-si155.svg https://s3-eu-west-1.amazonaws.com/prod-ucs-content-store-eu-west/content/pii:S0360544220315644/STRIPIN/image/svg+xml/8f7150ab8b6e225e545fdda7e87ac336/si155.svg si155 si155.svg svg 5884 ALTIMG 1-s2.0-S0360544220315644-si149.svg https://s3-eu-west-1.amazonaws.com/prod-ucs-content-store-eu-west/content/pii:S0360544220315644/STRIPIN/image/svg+xml/f67cff4142277a3d91e578d8a39ef2ee/si149.svg si149 si149.svg svg 15260 ALTIMG 1-s2.0-S0360544220315644-si18.svg https://s3-eu-west-1.amazonaws.com/prod-ucs-content-store-eu-west/content/pii:S0360544220315644/STRIPIN/image/svg+xml/5958bb0e02ef75b93deec1d79f252ff0/si18.svg si18 si18.svg svg 5691 ALTIMG 1-s2.0-S0360544220315644-si56.svg https://s3-eu-west-1.amazonaws.com/prod-ucs-content-store-eu-west/content/pii:S0360544220315644/STRIPIN/image/svg+xml/537c35fca4dabb93957030d18f42fd48/si56.svg si56 si56.svg svg 7037 ALTIMG 1-s2.0-S0360544220315644-si50.svg https://s3-eu-west-1.amazonaws.com/prod-ucs-content-store-eu-west/content/pii:S0360544220315644/STRIPIN/image/svg+xml/7aa42f3006aab19c6f6dd5960a4b3a3e/si50.svg si50 si50.svg svg 4086 ALTIMG 1-s2.0-S0360544220315644-si25.svg https://s3-eu-west-1.amazonaws.com/prod-ucs-content-store-eu-west/content/pii:S0360544220315644/STRIPIN/image/svg+xml/108c0edbff16604f6c3729c71801f2ec/si25.svg si25 si25.svg svg 7385 ALTIMG 1-s2.0-S0360544220315644-si11.svg https://s3-eu-west-1.amazonaws.com/prod-ucs-content-store-eu-west/content/pii:S0360544220315644/STRIPIN/image/svg+xml/e66eb70a95b8d8777ebcebf49327fa0e/si11.svg si11 si11.svg svg 11143 ALTIMG 1-s2.0-S0360544220315644-si111.svg https://s3-eu-west-1.amazonaws.com/prod-ucs-content-store-eu-west/content/pii:S0360544220315644/STRIPIN/image/svg+xml/3ff308fcca1f499a96e630b686bec523/si111.svg si111 si111.svg svg 4707 ALTIMG 1-s2.0-S0360544220315644-si127.svg https://s3-eu-west-1.amazonaws.com/prod-ucs-content-store-eu-west/content/pii:S0360544220315644/STRIPIN/image/svg+xml/1748fa65a43571fc947291c570bc8b56/si127.svg si127 si127.svg svg 19206 ALTIMG 1-s2.0-S0360544220315644-si131.svg https://s3-eu-west-1.amazonaws.com/prod-ucs-content-store-eu-west/content/pii:S0360544220315644/STRIPIN/image/svg+xml/37be0e55f11aee21189a65fb651d04a6/si131.svg si131 si131.svg svg 4612 ALTIMG 1-s2.0-S0360544220315644-si77.svg https://s3-eu-west-1.amazonaws.com/prod-ucs-content-store-eu-west/content/pii:S0360544220315644/STRIPIN/image/svg+xml/1901879c071bb442a207b670519a6667/si77.svg si77 si77.svg svg 7259 ALTIMG 1-s2.0-S0360544220315644-si52.svg https://s3-eu-west-1.amazonaws.com/prod-ucs-content-store-eu-west/content/pii:S0360544220315644/STRIPIN/image/svg+xml/7d56de47df8d4a316719424d5ea0b986/si52.svg si52 si52.svg svg 7978 ALTIMG 1-s2.0-S0360544220315644-si70.svg https://s3-eu-west-1.amazonaws.com/prod-ucs-content-store-eu-west/content/pii:S0360544220315644/STRIPIN/image/svg+xml/db1ebb928cb19d5d09661903cb3ac749/si70.svg si70 si70.svg svg 6204 ALTIMG 1-s2.0-S0360544220315644-si126.svg https://s3-eu-west-1.amazonaws.com/prod-ucs-content-store-eu-west/content/pii:S0360544220315644/STRIPIN/image/svg+xml/3deae3fc77879d08e32f7483c41c1fb0/si126.svg si126 si126.svg svg 12974 ALTIMG 1-s2.0-S0360544220315644-am.pdf https://s3-eu-west-1.amazonaws.com/prod-ucs-content-store-eu-west/content/egi:10CB62CWZV3/MAIN/application/pdf/5dd0dd8c64aac6e0d1f96a523348593c/am.pdf am am.pdf pdf false 2217668 AAM-PDF EGY 118456 118456 S0360-5442(20)31564-4 10.1016/j.energy.2020.118456 Elsevier Ltd Fig. 1 Schematic diagram of the house with designated zones. Fig. 1 Fig. 2 Daily electrical load. Fig. 2 Fig. 3 Identified system model. Fig. 3 Fig. 4 Setpoint temperature and bounds on the indoor operative temperature. Fig. 4 Fig. 5 Winter Time-of-Use rates [24] and Feed-in-Tariff (FiT). Fig. 5 Fig. 6 Rule based energy flow diagram for the base case scenario with PV and home battery. Fig. 6 Fig. 7 Operative temperature ( T o p ) profile for the primary bedroom (B1) for the three simulation scenarios along with the real-time and 1 h-ahead forecast dataset for outdoor temperature, T e x t and solar heat gain q S G , for 5 consecutive days as an example. Fig. 7 Fig. 8 Cumulative percentage showing Time-in-Target performance of the MPC, to maintain the operative temperatures, T o p within the comfort bounds, for the 7-day simulation period. Fig. 8 Fig. 9 Example of HP and BB heating pattern: heating for zone B1 in Case I for a 5-day simulation period. Fig. 9 Fig. 10 Daily average HP and BB heating energy delivered to the house and corresponding electricity consumption for the two case study scenarios during the 7-day simulation period. Fig. 10 Fig. 11 Daily average energy flow from PV, home battery and the grid during the 7-day simulation period. Fig. 11 Fig. 12 State of charge (SOC) of the battery for 5 consecutive days, corresponding to Fig. 7. Fig. 12 Table 1 House envelope and RFH construction specifications. Table 1 House Layout Parameters Zones Specifications Floor area B1 18.00 m2 B2 15.75 m2 LK 37.50 m2 Height All 3.048 m Window area B1\u2013S 5.49 m2 B1-E 4.80 m2 B2-E 4.29 m2 B2\u2013N 5.49 m2 LK-N 3.75 m2 LK-W 9.15 m2 LK-S 6.10 m2 House Envelope Parameters Specifications Roof RSI a 6.897 m2K/W (R39) External Wall RSI 3.003 m2K/W (R17) Internal Wall RSI 0.513 m2K/W (R3) Slab RSI 0.319 m2K/W (R2) Window U-value 1.570 W/m2K Infiltration 2.5 A C H 50 a RSI: Thermal resistance in SI units. Table 2 Power ratings for electrical appliances. Table 2 Appliances Rated Power (W) Heat gain (%) Clothes washer 1780 85 Dryer 5300 15 Dishwasher 890 65 Refrigerator 720 100 Oven 2200 50 Table 3 Specifications for heating and cooling units. (2a) P L R O U = { Q H P demand Q H P rated , Q H P demand < = Q H P rated 1 , otherwise (2b) Q H P OU = Q H P rated × P L R O U (2c) P H P OU = { P H P rated × ( 0.124 + 1.124 × P L R O U ) , P L R O U > = 0.4 P H P rated × ( 0.0109 + 0.9863 × P L R O U − 2.3784 × P L R O U 2 + 4.8146 × P L R O U 3 ) otherwise Table 3 Parameters Zones Rating Outdoor Unit Total heating capacity \u2013 45000 (BTU/h) [21] Electric power (heating) \u2013 7200 W COP at - 8.33 ° C ( 17 ° F ) \u2013 2.85 Indoor Units Total heating capacity B1, B2 8700 (BTU/h) [22,23] Electric power (heating) B1, B2 545 W Heat air flow B1, B2 225 CFM COP at - 8.33 ° C ( 17 ° F ) \u2013 3.14 Total heating capacity LK 13600 (BTU/h) Electric power (heating) LK 950 W Heat air flow LK 454 CFM COP at - 8.33 ° C ( 17 ° F ) \u2013 2.10 Baseboards Heating capacity B1 2.25 kW [29] B2 2.00 kW LK 4.25 kW Table 4 Specifications for the solar panels. Table 4 Parameters Rating Solar panels Total surface area 32.7 m2 [7,32] Reference PV efficiency 14.88% Reference temperature 25 ° C Absorptance 0.855 Table 5 Specifications for the home battery. (5) E B ( k + 1 ) = { E B ( k ) + P B × η B × Δ k , P B > 0 , charging , P B < 0 , discharging (6) S O C B ( k ) = E B ( k ) × 100 E B m a x (7) S O C B m i n ≤ S O C B ( k ) ≤ S O C B m a x Table 5 Parameters Rating Home battery Nominal AC voltage 120/240 V [31] Grid frequency 60 Hz Rated energy 14 kWh Useable energy, E B m a x 13.5 kWh Rated power 5 kW Table 6 Relative solar heat gain factors with respect to the heat gain on South façade. Table 6 Time North East South West Time AM PM 8 0.053 1.474 1 0.053 4 9 0.066 0.940 1 0.066 3 10 0.067 0.565 1 0.067 2 11 0.070 0.240 1 0.070 1 12 0.067 0.075 1 0.075 12 Table 7 Summary of control variables for cost and comfort optimization for a house with PV panels and home battery. Table 7 Variable Range Initial guess Unit Count Description P L R I N [0, 1] 0.2 \u2013 3 Part load ratio for each HP indoor fan unit. F B B [0, 1] 0.1 % 3 Fraction of the rated baseboard heat input, q B B r a t e d , for each zone, as listed in Table 3. P B [-5, 5] 0 kW 1 Charging and discharging power for the home battery. F P V → H [0, 1] 0.3 % 1 Fraction of P P V supplied from the PV to the house. F B → H [0, 1] 0.6 % 1 Fraction of P B supplied from the home battery to the house. Table 8 Daily average energy cost for 7-day simulation period. Table 8 Base case Case I Average daily electricity buying cost (C$) 2.52 2.45 Revenue from selling electricity (C$) \u2013 0.27 Net daily average expense (C$) 2.52 2.18 Centralized model predictive control strategy for thermal comfort and residential energy management Sayani Seal Conceptualization Formal analysis Investigation Methodology Software Writing - original draft a ∗ Benoit Boulet Conceptualization Supervision Visualization Writing - review & editing a Vahid R. Dehkordi Supervision Writing - review & editing b a McGill University, Montreal, Quebec, Canada McGill University Montreal Quebec Canada McGill University, Montreal, Quebec, Canada b NRCan-CanmetENERGY, Varennes, Quebec, Canada NRCan-CanmetENERGY Varennes Quebec Canada NRCan-CanmetENERGY, Varennes, Quebec, Canada ∗ Corresponding author. A novel implementation strategy of a centralized model predictive control (MPC) is proposed for a zone based comfort and energy management in a residential building. A photovoltaic (PV) solar system and a stationary home battery unit are considered. A heat pump (HP) is used as the primary heating unit. The electric baseboards (BB) are used as a supplementary system. The MPC controls the HP and BB power inputs for comfort management, as well as the energy flow among the PV, the battery and the bidirectional grid system. Variable Time-of-Use (ToU) rates are considered for the energy cost calculation and Feed-in-Tariff (FiT) is considered for selling energy to the grid. A 13.5% reduction in the energy cost is achieved with the centralized MPC as compared to a rule based energy management strategy. The solar energy generation and battery storage contribute to approximately 31% saving. Keywords Centralized model predictive control (MPC) Home energy management Solar panels Home battery List of symbols Q H P demand Total HP heating capacity demand (kW) P L R I N demand i Indoor fan unit PLR for the i t h zone Q I N rated i Rated heating capacity of the indoor fan unit for the i t h zone (kW) Z Total number of zones. Here, z = 3 Q H P rated Rated heating capacity of the HP outdoor unit (kW) P H P rated Rated power consumption by the HP outdoor unit (kW) P L R O U Effective PLR for the HP outdoor unit Q H P O U Effective heating capacity of the HP outdoor unit (kW) P H P O U Effective power consumption by the HP outdoor unit (kW) F capacity Heating capacity factor for the HP indoor units P L R I N i Effective PLR for the indoor fan unit in the i t h zone P P V Total solar power generation (kW) S I Total solar irradiance (W/m2) A P V Total surface area of the PV panels (m2) η P V Efficiency of the PV panels η R I Efficiency of the Regulator - Inverter unit ( τ α ) n Transmittance - absorptance product of the PV cover for solar radiation at a normal angle E B Stored energy in the home battery at a given time step (kWh) P B Amount of power sent to or drawn from the home battery (kW) η B Home battery efficiency = 95% Δ k Time interval = T s / 3600 (h) T s Simulation time step (s) S O C B SOC of the home battery at a given time step (%) S O C B min Minimum allowable SOC for the home battery S O C B max Maximum allowable SOC for the home battery T e x t Outdoor temperature ( ° C ) q S G , z Solar gain (kW) for z t h zone q I G , z Internal thermal gains (kW) for z t h zone T g n d Ground temperature ( ° C ) q H P , z Power inputs for the multi-split heat pump unit (kW) for z t h zone q B B , z Power inputs for the baseboards (kW) for z t h zone T o p , z Operative temperature ( ° C ) for z t h zone T a i r , z Air temperature ( ° C ) for z t h zone Q s o l f a c t o r The relative solar heat gain factor A w Total window area G-value The solar energy transmittance of the windows Δ q ¯ S G Base Gaussian noise vector for solar heat gain per unit area due South (W/m2) Q ¯ s o l n o i s e Net solar heat gain noise vector on a given façade (W) ( ⋅ ) i Parameter for the i t h zone T ¯ o p i Indoor operative temperature ( ° C ) T ¯ u b i Upper bound on T ¯ o p i ( ° C ) T ¯ l b i Lower bound on T ¯ o p i ( ° C ) T ¯ s e t i Setpoint temperature ( ° C ) P B B Power consumption by the baseboards (kW) q B B Heating capacity of the baseboards (kW) P l o a d Load demand including HVAC (kW) P H P OU Effective power consumption (kW) by the outdoor unit of the multi-split heat pump system, as given in (2c) (kW) P H P IN,fan Total fan power for indoor units of the multi-split system = 30 W, for each zone P e l e c Power consumption by electrical appliances as indicated in Fig. 2 (kW) P P V Power generated by the PV (kW) P B Power delivered (or consumed) during discharging (or charging) (kW) P P V → H Power delivered from PV to house (kW) P P V → B Power delivered from PV to home battery (kW) P P V → G Power delivered from PV to grid (kW) P B → H Power delivered from home battery to house (kW) P B → G Power delivered from home battery to grid (kW) P G → H Power delivered from grid to house (kW) P G → B Power delivered from grid to home battery (kW) Z No. of zones in the house L Length of P H c ¯ b u y Time-of-Use rates (¢/kWh) c ¯ s e l l Feed-In Tariff (¢/kWh) w 1,2,3,4,5 Weights on the different penalty Δ S O C B Change in the state of charge of the battery at each time step (kWh) w 1 Weight on c b u y w 2 Weight on c s e l l w 3 Weight on Δ S O C B w 4 i Weights on the deviation from T b o u n d for i t h zone w 5 i Weights on the deviation from T s e t for i t h zone E P V → H Energy delivered from PV to house (kWh) E P V → B Energy delivered from PV to home battery (kWh) E P V → G Energy delivered from PV to grid (kWh) E B → H Energy delivered from home battery to house (kWh) E B → G Energy delivered from home battery to grid (kWh) E G → H Energy delivered from grid to house (kWh) E G → B Energy delivered from grid to home battery (kWh) 1 Introduction The heating system is an integral part of the heating, ventilation and air-conditioning (HVAC) system that constitutes the major part of the residential electrical load. But the non-thermal electrical loads, such as, daily hot water requirement, electrical appliances, lighting, also add to the net residential electricity consumption. In this article, an inclusive control strategy for overall energy and comfort management of a residential building is presented considering renewable energy generation and storage. The benefits of a grid connected PV generation system coupled with a battery storage unit is studied in Ref. [13] based on different electricity rates, feed-in tariff (FiT) incentive and battery storage unit cost. In Ref. [5], a finite-horizon MPC control is used as a building energy management controller for optimal scheduling of thermostatically controlled heating-cooling units. For the non-thermal units, the MPC minimizes the electricity expense by controlling the ON/OFF status of the appliances and thereby optimizing the delay between the occupants\u2019 requests of using an appliance and its availability, based on variable electricity rates. For the thermal appliance scheduling, predicted mean vote (PMV) index is used as an indicator of occupants\u2019 comfort. The allowable PMV range in Ref. [5] is used as an optimization constraint. A similar PMV index based comfort constraint is used in MPC building energy cost optimization in Ref. [25]. Another MPC based strategy for hygrothermal comfort and energy management in an office building is presented in Ref. [9]. The objective function includes penalties on operative temperature and humidity setpoint deviations along with energy cost. In Ref. [3] the MPC objective function uses a penalty on the comfort optimization based on a flexible comfort range defined by slack variables corresponding to acceptable temperature bounds. However, no energy cost penalty is considered. While focusing on a similar objective of achieving desired comfort at a reduced energy cost, the goal of this paper is to introduce a single centralized MPC that not only maintains the indoor operative temperature within a given range, but also simultaneously optimizes the timing and amount of energy flow during the charging-discharging of the home battery, the utilization of the renewable and/or grid based energy to reduce the energy cost. Unlike the comfort optimization constraint presented in Ref. [5,25], the choice of an hourly variable schedule of an allowable temperature range, gives the MPC the necessary flexibility in achieving a trade off between the heating power inputs and the total electrical energy cost for the thermal and non-thermal appliances used in the house. In several earlier studies the performance benefits of an MPC over a classical rule based ON/OFF controller and PID controllers have been presented [1]. In this article, the contribution is focused on the performance of the MPC in an amalgamated comfort and energy management optimization scenario, hence the base case presented in this study has an MPC driven comfort and energy cost optimization with a rule based control for the energy management. In the following, the objective is presented in Section 2. A description of the case study house and its heating systems and energy network arrangements are given in Section 3, where in Section 4 the control-oriented house model is presented. The disturbance inputs used in this simulation study and the optimization problem formulation are presented in Section 5 and Section 6, respectively. Two case study scenarios are described in Section 7 and the optimization results are presented in Section 8. Finally, Section 9 summarizes the work presented in this article. 2 Objectives The building energy management system (BEMS) presented in this article includes an on-site solar energy generation system and a battery storage facility. A bidirectional grid connection is considered. The BEMS is centrally controlled by the MPC which performs a multi-variable optimization, with a single objective function, to efficiently manage the renewable energy usage, charging and discharging of the battery and heating load distribution to maintain the indoor operative temperature within given comfort bounds with a reduced heating energy consumption. The proposed approach contributes in combining two major building control engineering research focuses, namely the HVAC control for comfort management with low operative cost and energy management for building electricity consumption. A TRNSYS-MATLAB co-simulation is used for this comfort and energy management case studies. Here, the TRNSYS house is treated as an alternative to the actual physical house. The MPC, coded in MATLAB, uses a simplified linear model of the TRNSYS house for temperature predictions and control. A similar co-simulation arrangement is described in detail in Refs. [26,27]. 3 The case study house The layout of the single-storey house is created using Google SketchUp and TRNSYS. This TRNSYS model is used as an alternative to the real physical building [26,27]. The house has two bedrooms and a living-dining space with an open kitchen. The construction specifications are presented in Table 1 . The PV panels are installed on a South facing roof inclined at an angle of 45 ° . The rated power draws for the electrical appliances are shown in Table 2 . The percentages of convective heat gains [14] from different appliances, contributing to the net internal gain, are also indicated in the Table. Fig. 2 represents an estimated total daily electrical energy consumption used in the simulation. It includes the lighting, scheduled loads of the electrical appliances, the energy requirement for daily hot water usage, the heat recovery ventilator unit and the PV regulator - inverter unit. 3.1 Heating systems An air-to-air heat pump (HP) driven multi-split system 1 1 The TRNSYS heat pump outdoor and indoor-fan units (Type 221 and 222) are designed by Mr. Justin Tamasauskas as per the specifications given in Table 3 (Email: justin.tamasauskas@canada.ca) is used as the primary heating unit. The unit consists of an outdoor unit and three separate indoor fan units for the three zones. An electric baseboard (BB) heater is also available as a secondary heating unit for each zone. The HP heating performance depends on the outdoor temperature and may have lower coefficient of performance (COP) during the very cold days, hence for better reliability of the heating system the electric baseboards are used as the secondary units. The specifications are given in Table 3 . The required part-load ration (PLR) for each indoor fan unit of the multi-split system, given by P L R I N demand i , is optimized separately by the MPC. The total demanded heating capacity, Q H P demand is given by (1). (1) Q H P demand = ∑ i = 1 z ( P L R I N demand i × Q I N rated i ) where. Q H P demand Total HP heating capacity demand (kW). P L R I N demand i Indoor fan unit PLR for the i t h zone. Q I N rated i Rated heating capacity of the indoor fan unit for the i t h zone (kW). Z Total number of zones. Here, z = 3 . The PLR of the outdoor unit, however, is adjusted based on the Q H P demand and the available rated heating capacity of the outdoor unit, Q H P rated (kW). The Q H P rated and the electric power consumption, P H P rated (kW) of the outdoor unit are functions of the indoor and outdoor temperature as given in Ref. [21]. PLR, effective heating capacity and electric power consumption of the outdoor unit are given by the set of equations in (2).where. Q H P rated Rated heating capacity of the HP outdoor unit (kW). P H P rated Rated power consumption by the HP outdoor unit (kW). P L R O U Effective PLR for the HP outdoor unit. Q H P OU Effective heating capacity of the HP outdoor unit (kW). P H P OU Effective power consumption by the HP outdoor unit (kW). The relation between P L R O U and P H P OU is adopted from the articles [8,17]. The PLR of the indoor units are then adjusted by a heating capacity factor, F capacity , given by (3a). The effective PLR for the indoor units are given by P L R I N i in (3b), for each zone. (3a) F capacity = { 1 , Q H P demand < = Q H P rated Q H P rated Q H P demand , otherwise (3b) P L R I N i = P L R I N demand i × F capacity where. F capacity Heating capacity factor for the HP indoor units. P L R I N i Effective PLR for the indoor fan unit in the i t h zone. Equations (1)\u2013(3) ensure that the total heating capacity of the individual fan units never exceeds the rated capacity of the outdoor unit of the multi-split system. The MPC only optimizes the P L R I N demand i as the control variable. P L R O U is a function of P L R I N demand i as given by eqs. (1) and (2a). The efficiency of the baseboards are assumed to be 100%. The heat pump driven multi-split systems have a lower installation cost and a faster response time. Since no thermal storage is considered here, when the heat pump is operating at a lower COP, the MPC utilizes the baseboards to provide the heating energy required to maintain the indoor operative temperature within the desired range. 3.2 PV panels (PV), home battery (HB) and grid (G): sizing and specifications The specifications for the PV panels, home battery and the bidirectional grid connection are discussed in the following. 3.2.1 Solar panels A simple glazed PV panel, (TRNSYS Type 562d module) is used to estimate the solar power generation using the solar radiation data given by the TMY2 weather file. The default specifications for the said PV module in TRNSYS remained unchanged, as shown in Table 4 , except the surface area. It is estimated to be 32.7 m 2 , assuming the average size of the PV system to be 6 kW [7]. The performance of the PV panel depends on the ambient conditions e.g., solar irradiance level, ambient temperature, wind speed, dirt/dust etc. [20] as well as the reference PV efficiency, the reference and actual temperatures the solar cell, total reference and actual incident solar radiation [32]. Since, an estimation of the generated power, based on a given weather condition, suffices the requirements of this particular study, a simplified model given by (4) is used for the simulation. (4) P P V = η P V × S I × A P V × ( τ α ) n × η R I where. P P V Total solar power generation (kW). S I Total solar irradiance (W/m2). A P V Total surface area of the PV panels (m2). η P V Efficiency of the PV panels. η R I Efficiency of the Regulator - Inverter unit. ( τ α ) n Transmittance - absorptance product of the PV cover for solar radiation at a normal angle. The efficiency of the regulator-inverter unit is set to 78%, equal to the default value of Type 48 module in TRNSYS [28]. The data for solar irradiance ( S I ) and the PV efficiency ( η P V ) are recorded from TRNSYS for the TMY2 - Toronto weather data. The normal solar transmittance ( τ n ) of the glass cover value is set to 0.86. Assuming the absorption factor, in Table 4, as the normal absorption factor ( α n ), the ( τ α ) n is approximated as ( τ α ) n = 1.01 × τ n × α n = 0.74 [6]. With this approximations of the PV panel parameter specifications, the power generation simulated by the model in (4) generates comparable results with respect to that of the Type 562d module in TRNSYS. It is worth mentioning that the simulation of the PV panels, is performed entirely within the MATLAB environment and the Type 562d for PV panels and Type 48 for the regulator-inverter module in TRNSYS are only used to derive the simplified model and its validation. 3.2.2 Home battery The specifications for the home battery is given in Table 5 . Except for the base case simulation scenario where for a rule based control strategy the minimum allowable state of charge (SOC) is restricted to 50%, in general, the SOC is allowed to vary between 10% and 90%. The SOC of the home battery is calculated in a discrete time frame at every simulation time step [19]. The update equations are given by eqs. (5) and (6).where. E B Stored energy in the home battery at a given time step (kWh). P B Amount of power sent to or drawn from the home battery (kW). η B Home battery efficiency = 95%. Δ k Time interval = T s / 3600 (h). T s Simulation time step (s). S O C B SOC of the home battery at a given time step (%). S O C B m i n Minimum allowable SOC for the home battery. S O C B m a x Maximum allowable SOC for the home battery. 4 Control-oriented model identification and validation The control-oriented MATLAB models for the three zones, namely, the primary bedroom, secondary bedroom and the living-kitchen area (Fig. 1 ) are identified separately as linear time-invariant (LTI) state space sub-blocks as shown in Fig. 3 . System inputs: \u2022 External uncontrolled or disturbance inputs: \u2013 T e x t : Outdoor temperature ( ° C ). \u2013 q S G , z : Solar gain (kW) for z t h zone. \u2013 q I G , z : Internal thermal gains (kW) for z t h zone. \u2013 T g n d : Ground temperature ( ° C ). \u2022 Heating inputs: \u2013 q H P , z : Power inputs for the multi-split heat pump unit (kW) for z t h zone. \u2013 q B B , z : Power inputs for the baseboards (kW) for z t h zone. Open loop system identification is used to generate the simplified LTI house model. The MPC uses this control-oriented model to predict the system outputs during the heating season and accordingly optimizes the control inputs. Periodic pulse waves of 50% duty cycle, having amplitudes equal to the rated HP and BB heating capacity (Table 3) are supplied to respective zones for the system identification. System outputs: \u2022 T o p , z : Operative temperature ( ° C ) for z t h zone. \u2022 T a i r , z : Air temperature ( ° C ) for z t h zone. For system identification, the TMY2 Toronto weather data from January to the middle of March is used. The model validation is performed with the weather dataset for the same location, from the middle of March to the end of April. Distribution of the validation errors for the different zones vary within ± 2 ° C for close to 70% of the time. 5 Uncertainties in the disturbance inputs: weather inputs and internal gains The standard TRNSYS TMY2 dataset for Toronto is used as the actual or real-time data. The noise vectors are generated for every hour as recommended in Ref. [4] and linear interpolation is used between successive data points to generate a noise vector that matches the simulation time step of 3.75 min. These noise vectors are then added to the TMY2 dataset to generate the forecast data. 5.1 Forecast and actual dataset for outdoor temperature As suggested in Ref. [4], two vectors of normally distributed random variables are considered to be representing, respectively, the 6 h-ahead and the 1 h-ahead forecast noise for the outdoor temperature, T e x t . The mean and standard deviation of the prediction error considered for the 6 h-ahead forecast are 0.04 ° C and 2.2 ° C respectively. For the 1 h-ahead forecast, the prediction accuracy is assumed to be improved with a narrower standard deviation of 1.2 ° C . 5.2 Forecast and actual dataset for solar radiation on the PV and shortwave solar heat gain through windows 1 h, 6 h and 48 h-ahead forecasts for solar radiation are studied in Ref. [4] based on available weather dataset from Environment Canada. In the article, an estimated forecast error is defined by Gaussian noise with mean of 17 W/m2 and standard deviation of 167 W/m2 for the 6 h-ahead predictions. The 1 h-ahead prediction, is a Gaussian noise with the same mean but a smaller standard deviation of 100 W/m2. These are the prediction estimations for the solar radiation due 45 ° South and hence it is suitable for the solar radiation on the installed PV panels [4]. To generate the forecast error for the indoor solar heat gain due to the shortwave radiation through the windows, Gaussian noises with similar mean and standard deviation are used as the base for the 6 h and 1 h-ahead predictions. These base noise vectors are then weighted by the following three factors: Q s o l f a c t o r The relative solar heat gain factors [30], for the vertical façades at the different orientation of the building and at a different time of the day, with respect to South façade. A w Total window area (Table 1) on each façade corresponding to a zone (m2). G-value The solar energy transmittance of the windows. The G-value of the window glass is assumed to be 0.376. The Winter (corresponding to January 21 s t ) solar heat gain factors at 43 ° N latitude for Toronto, are considered as given in Ref. [30]. These factors are normalized with respect to the heat gain on the South façade and are listed in Table 6 . The Gaussian noise generated for the indoor solar heat gain on a given façade is given by the equation: (8) Q ¯ s o l n o i s e = Δ q ¯ S G × G − value × A w × Q s o l f a c t o r where. Δ q ¯ S G Base Gaussian noise vector for solar heat gain per unit area due South (W/m2). Q ¯ s o l n o i s e Net solar heat gain noise vector on a given façade (W). The solar heat gain noise, Q ¯ s o l n o i s e is generated separately for each façade of the house using (8), and then the total noise for each zone is added to the real-time data to generate the forecast to be used by the MPC. 5.3 Forecast and actual dataset for ground temperature and internal heat gain The variation in the ground surface temperature is ± 0.5 ° C [2]. Gaussian noise of 0 ° C mean and 0.17 ° C standard deviation is generated which gives the required range of prediction error for the ground temperature, T g n d . The internal heat gain is considered to be generated by the occupants, lights and electrical equipment. The schedules for occupancy and electricity usage for lights and appliances are pre-scheduled in the TRNSYS house. Hence, a Gaussian percentage deviation with zero mean and an approximate maximum deviation of ± 30 % is considered. 6 Problem formulation and methodology The goal here is to combine the control mechanism of two major building operations. The comfort goal focuses on meeting a predefined temperature range while reducing in the energy cost. Optimal usage of the heating units, thus, becomes an integral part of the comfort optimization. Judicious utilization of the energy efficient heat pump and benefiting from the off-peak ToU rates during the day by utilizing the energy storage unit, prove to be the two key factors implemented by the MPC for the comfort optimization [26,27]. The self-generated electricity from the roof-top PV panels can be used instantaneously to supply loads or can be stored in the home battery for future usage in a cost-effective way. The heating system is considered as a part of the house electricity load and thus the heating control system and the energy management system are intertwined to study a more centralized control scenario. The base case scenario includes an MPC controlled heating system and a rule based energy management system. 6.1 Comfort bounds and setpoint temperature The upper ( T u b ) and lower ( T l b ) acceptable temperature bounds and the setpoint trajectory ( T s e t ) are shown in Fig. 4 . In similar experiments presented in Ref. [26,27], it has been identified that, in absence of T s e t MPC is often prone to overheating while trying to achieve a suitable trade-off between cost and comfort, specially in the absence of forced cooling. To reduce this effect, the deviation of the operative temperature, T o p from T s e t is penalized in the objective function in addition to penalizing the deviation from the bounds. The temperature profile for T s e t is tunable and is chosen to maintain approximately the average of the upper and lower bounds and encourage a gradual transition from the night to the day-time comfort requirements. The penalty on comfort violation used in the MPC optimization is defined in eqs. (9) and (10). Two different non-negative tracking errors are taken into consideration. The e ¯ b o u n d i : R L × R L × R L → R L measures the deviation of T o p from the upper and lower temperature bounds (10). The e ¯ s e t i : R L × R L → R L in (9), on the other hand, is the absolute measure of the distance of T o p from T s e t . (9) e ¯ s e t i ( T ¯ o p i , T ¯ s e t i ) = | T ¯ o p i − T ¯ s e t i | (10) e ¯ b o u n d i ( T ¯ o p i , T ¯ l b i , T ¯ u b i ) = { T ¯ o p i − T ¯ u b i , T ¯ o p i > T ¯ u b i 0 , T ¯ l b i ≤ T ¯ o p i ≤ T ¯ u b i T ¯ l b i − T ¯ o p i , T ¯ o p i < T ¯ l b i where. ( ⋅ ) i Parameter for the i t h zone. T ¯ o p i Indoor operative temperature ( ° C ) . T ¯ u b i Upper bound on T ¯ o p i ( ° C ) . T ¯ l b i Lower bound on T ¯ o p i ( ° C ) . T ¯ s e t i Setpoint temperature ( ° C ) . 6.2 Simulation parameters A multistep MPC feedback strategy [12] is used here. Based on similar previous experiments conducted in Ref. [26,27], the simulation time step, prediction horizon (PH) and control horizon (CH) are chosen to be T s = 3.75 min, P H = 8 h and C H = 15 min, respectively. Since C H = 15 min, the first four optimized control values are implemented before the MPC performs the subsequent optimization. The MATLAB coded MPC uses a standard constrained optimization function fmincon from the MATLAB Optimization Toolbox. Particularly, the Active-Set algorithm is used here [18]. 6.2.1 Time-of-use (ToU) rates and feed-in-tariff (FiT) The Ontario ToU electricity rates [24], are used to estimate the energy cost as shown in Fig. 5 . The same rates are used as the Feed-in-Tariff (FiT) while considering an incentive for selling to the grid. As described in Ref. [16], currently, a flat average price reduction is implemented for different KWh slabs. Here, for the simulation purposes, the FiT is chosen identical to the ToU rates. 6.3 Description of the optimization variables The power flow equations, as functions of the optimization variables (Table 7 ), are given by the set of equations in (11). (11a) P B B = q B B = q B B r a t e d × F B B , (11b) P l o a d = P H P OU + P H P IN , fan + P B B + P e l e c (11c) P P V → H = { P P V × F P V → H , P l o a d ≥ P P V → H × F P V → H P l o a d , P l o a d < P P V × F P V → H (11d) P P V → B = { P P V × ( 1 − F P V → H ) , P B > 0 and P B ≥ P P V × ( 1 − F P V → H ) ; P B , P B > 0 and P B < P P V × ( 1 − F P V → H ) ; 0 , P B < 0 (11e) P P V → G = P P V − ( P P V → H + P P V → B ) , P P V > ( P P V → H + P P V → B ) (11f) P B → H = { − P B × F B → H , P B < 0 and ( P l o a d − P P V → H ) ≥ − P B × F B → H ; P l o a d − P P V → H , P B < 0 and ( P l o a d − P P V → H ) < − P B × F B → H ; 0 , P B > 0 (11g) F B → H = P B → H / − P B , updating F B → H (11h) P B → G = { − P B × ( 1 − F B → H ) , P B < 0 0 , P B > 0 (11i) P G → H = P l o a d − P P V → H − P B → H (11j) P G → B = P B − P P V → B , P B > 0 ; P B > P P V → B where, (12) min P L R ¯ I N , F ¯ B B , P ¯ B , F ¯ P V → H , F ¯ B → H [ w 1 . c ¯ b u y T . ( P ¯ G → H + P ¯ G → B ) − w 2 . c ¯ s e l l T . ( P ¯ P V → G + P ¯ B → G ) ︸ J cost + w 3 . ∑ k = 2 L Δ S O C B ( k ) + ∑ i = 1 z w 4 i . | | e ¯ b o u n d i ( T ¯ o p i , T ¯ l b , T ¯ u b ) | | 2 + ∑ i = 1 z w 5 i . ∑ k = 1 L e ¯ s e t i , k ( T ¯ o p i , k , T ¯ s e t k ) ︸ J comfort ] where. P L R ¯ I N , F ¯ B B ∈ R L × z ; P ¯ B , F ¯ P V → H , F ¯ B → H , c ¯ b u y , c ¯ s e l l ∈ R L ; P ¯ G → H , P ¯ G → B , P ¯ P V → G , P ¯ B → G ∈ R L ; i = 1 , \u2026 , z ; k = 1 , \u2026 , L ; e ¯ b o u n d i , T ¯ o p i , T ¯ l b , T ¯ u b ∈ R L ; e ¯ s e t i , j , T ¯ o p i , j , T ¯ s e t j , w 1,2,3 , w 4,5 i ∈ R Δ S O C B ( k ) = | S O C B ( k − 1 ) − S O C B ( k ) | ; S O C B min ≤ S O C B ( k ) ≤ S O C B m a x P B B Power consumption by the baseboards (kW). q B B Heating capacity of the baseboards (kW). P l o a d Load demand including HVAC (kW). P H P OU Effective power consumption (kW) by the outdoor unit of the multi-split heat pump system, as given in (2c) (kW). P H P IN , fan Total fan power for indoor units of the multi-split system = 30 W, for each zone. P e l e c Power consumption by electrical appliances as indicated in Fig. 2 (kW). P P V Power generated by the PV (kW). P B Power delivered (or consumed) during discharging (or charging) (kW). P P V → H Power delivered from PV to house (kW). P P V → B Power delivered from PV to home battery (kW). P P V → G Power delivered from PV to grid (kW). P B → H Power delivered from home battery to house (kW). P B → G Power delivered from home battery to grid (kW). P G → H Power delivered from grid to house (kW). P G → B Power delivered from grid to home battery (kW). P B is considered to be positive during charging, negative during discharging and zero for the neutral state. 95% home battery efficiency is considered to calculate the battery operations. 7 Case study scenarios and objective function The MPC objective function is given in (12). Here. z No. of zones in the house. L Length of P H . c ¯ b u y Time-of-Use rates (¢/kWh). c ¯ s e l l Feed-In Tariff (¢/kWh). w 1,2,3,4,5 Weights on the different penalty. Δ S O C B Change in the state of charge of the battery at each time step (kWh). The cost term, J cost gives the total energy cost corresponding to the net energy consumption from the grid over a given prediction horizon P H . The grid supplies the load demand from the house and charges the battery as needed. The timing and amount of power delivered from the grid is controlled by the MPC, by optimizing the variables F P V → H and F B → H as given in (11). The comfort term, J comfort in (12) includes the l 2 -norm of the deviation of T o p from the upper and lower temperature bounds and the absolute error of deviation from the setpoint as defined by eqs. (9) and (10). The weights on the cost and comfort terms ( w 1 , \u2026 , w 5 ), for respective zones, are used to scale the components of the objective function having different units and thus adjust the performance of the MPC controller. These weights are tunable parameters and the choices are based on user preference to achieve better trade-off between energy cost and comfort. Since this is a multivariable control optimization and a single objective function is used to optimize the MPC performance for the three zones simultaneously, the weights set priority on the goals to achieve the desired performance. The weights are specified as follows: w 1 Weight on c b u y . w 2 Weight on c s e l l . w 3 Weight on Δ S O C B . w 4 i Weights on the deviation from T b o u n d for i t h zone. w 5 i Weights on the deviation from T s e t for i t h zone. 7.1 Base case scenario An MPC controlled comfort management system is considered in the base case scenario along with a rule based energy management strategy described in the flowchart in Fig. 6 . The assumptions for the controller strategy for the base case scenario are as follows: \u2022 The power inputs to the heating units, i.e., P L R I N , F B B and P B , specifically the battery discharge power P B discharge only are controlled by the MPC. \u2022 The power consumptions by the HP and BB heating units are optimized based on the variable ToU rates. \u2022 A minimum 50% battery SOC is always maintained for emergency usage, i.e., S O C B m i n = 50 % . \u2022 Grid energy flow is bidirectional. Excess PV generated electricity can be fed back to the grid but without any incentive. The flowchart in Fig. 6 shows the energy flow diagram to and from PV, home battery, house and grid, for a single time step during the optimization in the base case scenario. The energy flow is primarily rule based. 7.1.1 Case I: bidirectional grid connection with an incentive for selling power to the grid This scenario considers bidirectional communication with the power grid. A two-way grid connection is available. A Feed-in-Tariff (FiT) same as the ToU rates (Section 6.2.1) is used. Same CH and PH are used here, as mentioned in 6.2. Based on similar experiments [26] the tunable weights defined in (12) are chosen as follows: w 1 = 1.5; w 2 = 1; w 3 = 5; w 4 1,2,3 = 3.2, same for all zones. w 5 1,2,3 = {0.08, 0.05, 0.08}, for the primary and secondary bedroom, and the living room respectively. 8 Results and discussion The performances of the MPC, for the above mentioned scenarios are analyzed for a 7-day simulation period. The simulation is run for 8 consecutive days during the first week of January and the first day is considered as a warm-up day. The TRNSYS-MATLAB co-simulation used for this study takes approximately 3 days in real-time to simulate 8 simulation days on an Intel Core-i7 processor with 8 GB RAM. Though computationally time-expensive, the controller is real-time implementable. But the extended simulation time restricts the choice of a longer simulation interval. In the following, the two case study scenarios are compared based on three performance criteria as discussed in the following. 8.1 Comfort performance Fig. 7 shows the operative temperature plots for the base case and Case I. Five consecutive days of simulation results are shown in the figure, as an example, for the primary bedroom (B1). The 1 h-ahead forecast and real-time outdoor temperature and respective solar heat gain for B1 are also indicated. The MPCs perform somewhat similarly, in maintaining the T o p within the specified limit, in both the cases. This is also reflected by the Time-in-Target performance in Fig. 8 , where the histogram of the deviations of T o p , in each case, is indicated for the entire 7-day simulation period. The temperature plot in Fig. 7, on the 4 t h day, shows a deviation of close to 2 ° C resulting from the significant dissimilarity in the forecast prediction for the solar heat gain. The MPC heats the zone considering a lower heat gain, which eventually results in overheating due to the solar radiation. Since no forced cooling is available, it takes a while before the T o p lower to reach the desired limit. Similarly, insufficient heating also results from over-prediction of the solar heat gain in the zone, as can be seen on the 2 n d or the 3 r d day. Here, the horizontal axis indicates the additional margin from either the upper or lower temperature bound defining the new target range. For example, the 0.5 ° C margin covers the range: T l b − 0.5 ≤ T o p ≤ T u b + 0.5 The Time-in-Target shown in Fig. 8, is based on the deviation from the upper and lower temperature bounds only. The e s e t defined in (9) with reference to the T s e t in Fig. 4, is used in the objective function to induce a penalty on the overheating effect, but no related penalty is considered in calculating the Time-in-Target performance. Above 85% of the time, the T o p in each zone, is maintained within a ± 0.5 ° C deviation margin, with a maximum deviation of close to ± 1 ° C . The secondary bedroom (B2), because of its North-East orientation (Fig. 1), has less solar heat gain than the primary bedroom (B1) and the living-kitchen (LK). Hence, the MPC maintains the T o p of zone B2, closer to the upper temperature bound in order to achieve a trade-off between the heating energy cost and the comfort performance. This leads to respectively 30% and 50% reduction in the Time-in-Target performance, as compared to the zones B1 and LK. However, the MPC performance in zone B2 matches with the other two zones while comparing with respect to the range of ± 0.5 ° C deviation margin. 8.2 Heating energy distribution The distribution of the heating energy between the HP and the BB heating units are also similar for the two scenarios. Fig. 9 shows a sample heating pattern in the Case I scenario for zone B1. The HP is used as the primary heating system since the average COP of the HP is 3.26 as compared to unity in case of the BB. HP preheats the zone to take advantage of the off-peak ToU rates, specially during the night. The HP net electricity consumptions are shown in Fig. 10 . Since 100% efficiency of the BB is assumed in general, the heat delivered by the BB is identical to its electricity consumption. The differences in the amounts of heating energy usage by the house in the two cases are minimal. The base case uses more BB heating. Based on the average heating energy delivered by the HP and BB, the average daily per unit cost of electricity for BB usage is approximately 20% more than that of HP usage for both the cases. 8.3 Use of renewable solar energy and battery storage unit The daily average energy flows from different sources to sinks are shown in Fig. 11 . Here, the labels on the horizontal axis are given by. E P V → H Energy delivered from PV to house (kWh). E P V → B Energy delivered from PV to home battery (kWh). E P V → G Energy delivered from PV to grid (kWh). E B → H Energy delivered from home battery to house (kWh). E B → G Energy delivered from home battery to grid (kWh). E G → H Energy delivered from grid to house (kWh). E G → B Energy delivered from grid to home battery (kWh). The rule based simulation scenario presented in the base case (Section 7.1), drives the PV generated energy to charge the battery in the morning as a priority. The battery is mostly used to deliver energy to the house at night and the MPC controls the amount of discharge. In comparison to the base case, the centralized MPC strategy in Case I, utilizes a larger share of the PV generated electricity to supply the instantaneous load demand of the house. E P V → H for the base is close to 66% less than Case I. Whereas, the rule based control in the base case utilizes the PV generated power mostly to charge the battery. The E P V → B in Case I is 78% less than the base case. The variation in S O C B is plotted in Fig. 12 . S O C B is maintained within 50%\u201390% for the base case. The battery charging is more flexible and may vary between 10% and 90% for Case I. 50% SOC level was considered as the initial condition at the first day of the 8-day simulation period, including the warm-up day. Here, the MPC charging strategy follows a general pattern of \u2018two-phase\u2019 charging. Initially, utilizing the off-peak prices at the start of the day, the battery is charged to supply the energy demand during the day-time on-peak period. In the second phase, the battery is charged using solar energy and supplies the demand during the second on-peak period in the evening. The first day, indicated in Fig. 12, is a weekend and the ToU rate off-peak throughout the day. As indicated in Fig. 7, the day is also cloudy. The MPC decides to minimally charge the battery to maintain the 10% SOC. Overall, to achieve the objective of minimizing the energy cost, the MPC tends to utilize approximately 10%\u201350% of the battery capacity and charges the battery only sufficiently to reduce the grid energy during the peak ToU periods. In general, the usage of grid energy is more in Case I, where the effect of the extra energy cost for buying energy from the grid is balanced by selling energy back to the grid. The average daily electricity costs are listed in Table 8 . The minimum is achieved in Case I, where a FiT is implemented for selling energy to the grid. In Case I, the simultaneous comfort and BEMS MPC optimization achieve a 13.5% reduction in the energy cost as compared to the base case. A simple case of MPC optimization for comfort management (without any BEMS control) is also simulated in TRNSYS as a reference to estimate the benefit of the centralized MPC controlled comfort and energy management system. Neither PV generation nor battery storage is considered in this case. The average daily cost achieved here is 3.16 C$, which is close to 31% more than Case I. 9 Conclusion In an effort to design a centralized system to control different components of the HVAC and BEMS systems simultaneously, a novel predictive control strategy is proposed in this article. By optimizing a single multi-objective cost function, the MPC maintains the operative temperature within a ± 0.5 ° C deviation margin from the predefined comfort bounds for over 85% of the simulation duration in each zone and achieves a 31% reduction in the daily average energy cost as compared to the grid-only building energy supply. The installation cost for the PV and the battery are not considered for these case studies. The multi-split air-to-air heat pump has a fast response time and maintains an average COP of 3.26 during the simulation period. Thus, the heat pump, along with the baseboard as a secondary heating unit builds an efficient and heating unit with low operative cost. The MPC controlled comfort and energy management system uses the PV generated solar energy to supply close to 10% of the total heating demand of the house, thereby saving approximately 198 gCO2 emission daily, considering 32 gCO2/kWh GHG emission factor for Ontario [15]. The reduction in the daily energy cost with respect to the grid based energy supply system indicates long term benefits in terms of cost minimization, leading to a cleaner environment. In this paper, the objective function optimizes energy cost and comfort. A modification in the objective function by incorporating a penalty on the GHG emission may achieve a further reduction in the CO2 emission. Specially in case of a mixed source energy generation scenario as in Ontario [10], a penalty on the GHG emission may play an effective contribution in achieving a reduction in the carbon footprint. However, for a greener grid scenario as in Quebec where more than 99% [11] of the total electricity generation is based on renewables, a cost-based objective function might be better appreciated. In summary, the MPC optimization method presented in this paper can be customized to incorporate various related control objectives to achieve user specific goals. CRediT authorship contribution statement Sayani Seal: Conceptualization, Formal analysis, Investigation, Methodology, Software, Writing - original draft. Benoit Boulet: Conceptualization, Supervision, Visualization, Writing - review & editing. Vahid R. Dehkordi: Supervision, Writing - review & editing. Declaration of competing interest The authors declare that they have no known competing financial interests or personal relationships that could have appeared to influence the work reported in this paper. Acknowledgment The authors would like to thank Natural Sciences and Engineering Research Council of Canada (NSERC) and Natural Resources Canada (NRCan) for funding this project. We convey our sincere thanks to Mr. Justin Tamasauskas from CanmetENERGY, NRCan, Varennes, for his contributions in developing the TRNSYS building model. References [1] A. Afram F. Janabi-Sharifi Theory and applications of HVAC control systems - a review of model predictive control (MPC). Building and Environment vol. 72 2014 343 355 10.1016/j.buildenv.2013.11.016 http://www.sciencedirect.com/science/article/pii/S0360132313003363 Afram, A., Janabi-Sharifi, F., 2014. Theory and applications of HVAC control systems - a review of model predictive control (MPC). Building and Environment vol. 72, 343 - 355. URL: http://www.sciencedirect.com/science/article/pii/S0360132313003363, doi:https://doi.org/10.1016/j.buildenv.2013.11.016. [2] H. Beltrami G.S. Matharoo J.E. Smerdon Ground surface temperature and continental heat gain: uncertainties from underground Environ Res Lett 10 2015 014009 Beltrami, H., Matharoo, G.S., Smerdon, J.E., 2015. Ground surface temperature and continental heat gain: uncertainties from underground. Environ Res Lett 10, 014009. [3] 14-17 Oct A. Boodi K. Beddiar Y. Amirat M. Benbouzid Model predictive control-based thermal comfort and energy optimization IECON 2019-45th annual conference of the IEEE industrial electronics society 2019 IEEE Lisbon, Portugal, Portugal 5801 5806 Boodi, A., Beddiar, K., Amirat, Y., Benbouzid, M., 14-17 Oct. 2019. Model predictive control-based thermal comfort and energy optimization, in: IECON 2019-45th annual conference of the IEEE industrial electronics society, Lisbon, Portugal, Portugal, IEEE. pp. 5801-5806. [4] J.A. Candanedo J.M. Hardy É. Saloux R. Platon V. Raissi-Dehkordi A. Côté July 9-12 Preliminary assessment of a weather forecast tool for building operation 5th international high performance buildings conference 2018 [Purdue, USA] Candanedo, J.A., Hardy, J.M., Saloux, E., Platon, R., Raissi-Dehkordi, V., Cote, A., July 9-12, 2018. Preliminary assessment of a weather forecast tool for building operation, in: 5th international high performance buildings conference, [Purdue, USA]. [5] C. Chen J. Wang Y. Heo S. Kishore MPC-based appliance scheduling for residential building energy management controller IEEE Transactions on Smart Grid 4 2013 1401 1410 Chen, C., Wang, J., Heo, Y., Kishore, S., 2013. MPC-based appliance scheduling for residential building energy management controller. IEEE Transactions on Smart Grid 4, 1401-1410. [6] J.A. Duffie W.A. Beckman Solar engineering of thermal processes 2013 John Wiley & Sons New York Duffie, J.A., Beckman, W.A., 2013. Solar engineering of thermal processes. New York: John Wiley & Sons. [7] Energy Sage Size and weight of solar panels https://news.energysage.com/average-solar-panel-size-weight/ Energy Sage, . Size and weight of solar panels. https://news.energysage.com/average-solar-panel-size-weight/. [Accessed on 16-12-2018]. [8] B. Filliard A. Guiavarch B. Peuportier July 27-30 Performance evaluation of an air-to-air heat pump coupled with temperate air-sources integrated into a dwelling Eleventh international IBPSA conference glasgow 2009 2266 2273 Scotland Filliard, B., Guiavarch, A., Peuportier, B., July 27-30, 2009. Performance evaluation of an air-to-air heat pump coupled with temperate air-sources integrated into a dwelling, in: Eleventh international IBPSA conference glasgow, Scotland, pp. 2266-2273. [9] 29 May - 1 June 2018 F. Gabsi F. Hamelin N. Sauer Hygrothermal modeling and mpc-based control for energy and comfort management in buildings international conference on smart grid and clean energy technologies (ICSGCE) 2018 IEEE Kajang, Malaysia 156 161 Gabsi, F., Hamelin, F., Sauer, N., 29 May - 1 June 2018. Hygrothermal modeling and mpc-based control for energy and comfort management in buildings, in: 2018 international conference on smart grid and clean energy technologies (ICSGCE), Kajang, Malaysia, IEEE. pp. 156-161. [10] Government of Canada, a. Canada energy regulator: provincial and territorial energy profiles - Ontario https://www.cer-rec.gc.ca/nrg/ntgrtd/mrkt/nrgsstmprfls/on-eng.html Government of Canada, a. Canada energy regulator: provincial and territorial energy profiles - Ontario. https://www.cer-rec.gc.ca/nrg/ntgrtd/mrkt/nrgsstmprfls/on-eng.html. [Accessed on 21-11-2019]. [11] Government of Canada, b. Canada energy regulator: provincial and territorial energy profiles - Quebec https://www.cer-rec.gc.ca/nrg/ntgrtd/mrkt/nrgsstmprfls/qc-eng.html Government of Canada, b. Canada energy regulator: provincial and territorial energy profiles - Quebec. https://www.cer-rec.gc.ca/nrg/ntgrtd/mrkt/nrgsstmprfls/qc-eng.html. [Accessed on 21-11-2019]. [12] L. Grüne J. Pannek Nonlinear model predictive control Nonlinear model predictive control 2011 Springer-Verlag London Limited 174 Grune, L., Pannek, J., 2011. Nonlinear model predictive control, in: Nonlinear model predictive control. Springer-Verlag London Limited, p. 174. [13] A.S. Hassan L. Cipcigan N. Jenkins Optimal battery storage operation for PV systems with tariff incentives Appl Energy 203 2017 422 441 10.1016/j.apenergy.2017.06.043 http://www.sciencedirect.com/science/article/pii/S030626191730778X Hassan, A.S., Cipcigan, L., Jenkins, N., 2017. Optimal battery storage operation for PV systems with tariff incentives. Appl Energy 203, 422 - 441. URL: http://www.sciencedirect.com/science/article/pii/S030626191730778X, doi:https://doi.org/10.1016/j.apenergy.2017.06.043. [14] Hes Documentation Home energy saver & score: engineering documentation, internal gains Accessed on 03-12-2018 http://hes-documentation.lbl.gov/cal culation-methodology/calculation-of-energy-consumption/heating-a nd-cooling-calculation/internal-gains Hes Documentation, . Home energy saver & score: engineering documentation, internal gains. http://hes-documentation.lbl.gov/cal culation-methodology/calculation-of-energy-consumption/heating-a nd-cooling-calculation/internal-gains [Accessed on 03-12-2018]. [15] IESO Conservation framework mid-term review - webinar #3 : IESO response to stakeholder feedback September 7 2017 2017 http://www.ieso.ca/-/media/files/ieso/document-library/engage/cf/cf-20170921-response-to-feedback.pdf?la=en IESO, 2017. Conservation framework mid-term review - webinar #3 : IESO response to stakeholder feedback, September 7, 2017. http://www.ieso.ca/-/media/files/ieso/document-library/engage/cf/cf-20170921-response-to-feedback.pdf?la=en. [Accessed on 21-12-2017]. [16] Ieso : feed-in tariff program. FIT 5 contract offer summary http://www.ieso.ca/-/media/Files/IESO/Document-Library/FIT/archive/FIT-5-Contract-Offers-Summary.pdf?la=en Ieso : feed-in tariff program. FIT 5 contract offer summary. http://www.ieso.ca/-/media/Files/IESO/Document-Library/FIT/archive/FIT-5-Contract-Offers-Summary.pdf?la=en. [Accessed on 22-09-2018]. [17] M. Kegel J. Tamasauskas R. Sunye Integration and evaluation of innovative and renewable energy technologies in a Canadian Mid-rise Apartment 9th system simulation in buildings conference 2014 [paper] Kegel, M., Tamasauskas, J., Sunye, R., 2014. Integration and evaluation of innovative and renewable energy technologies in a Canadian Mid-rise Apartment, in: 9th system simulation in buildings conference, [paper]. [18] MathWorks Constrained nonlinear optimization algorithms 2020 https://www.mathworks.com/help/optim/ug/constrained-nonlinear-optimization-algorithms.html MathWorks, R2020a. Constrained nonlinear optimization algorithms. https://www.mathworks.com/help/optim/ug/constrained-nonlinear-optimization-algorithms.html. [Accessed on 20-05-2020]. [19] D. Mazzeo G. Oliveti C. Baglivo P.M. Congedo Energy reliability-constrained method for the multi-objective optimization of a photovoltaic-wind hybrid system with battery storage Energy 156 2018 688 708 Mazzeo, D., Oliveti, G., Baglivo, C., Congedo, P.M., 2018. Energy reliability-constrained method for the multi-objective optimization of a photovoltaic-wind hybrid system with battery storage. Energy 156, 688-708. [20] M.E. Meral F. Dincer A review of the factors affecting operation and efficiency of photovoltaic based electricity generation systems Renew Sustain Energy Rev 15 2011 2176 2184 Meral, M.E., Dincer, F., 2011. A review of the factors affecting operation and efficiency of photovoltaic based electricity generation systems. Renew Sustain Energy Rev 15, 2176-2184. [21] Mitsubishi Electric Cooling Heating R410a outdoor unit - mxz-4C36NAHZ http://meus1.mylinkdrive.com/item/MXZ-4C36NAHZ.html Mitsubishi Electric : Cooling & Heating, . R410a outdoor unit - mxz-4C36NAHZ. http://meus1.mylinkdrive.com/item/MXZ-4C36NAHZ.html. [Accessed on 16-12-2018]. [22] Mitsubishi electric: cooling & heating, a. R410a indoor wall-mounted unit - MSZ-fh06na http://meus1.mylinkdrive.com/item/MSZ-FH06NA.html Mitsubishi electric: cooling & heating, a. R410a indoor wall-mounted unit - MSZ-fh06na. http://meus1.mylinkdrive.com/item/MSZ-FH06NA.html [Accessed on 16-12-2018]. [23] Mitsubishi Electric Cooling b Heating R410a indoor wall-mounted unit - msz-fh12na http://meus1.mylinkdrive.com/item/MSZ-FH12NA.html Mitsubishi Electric: Cooling & Heating, b. R410a indoor wall-mounted unit - msz-fh12na. http://meus1.mylinkdrive.com/item/MSZ-FH12NA.html [Accessed on 16-12-2018]. [24] Ontario Energy Board Electricity rates & prices https://www.oeb.ca/rates-and-your-bill/electricity-rates Ontario Energy Board, . Electricity rates & prices. https://www.oeb.ca/rates-and-your-bill/electricity-rates. [Accessed on 24-06-2018]. [25] A.E. Ruano S. Pesteh S. Silva H. Duarte G. Mestre P.M. Ferreira H.R. Khosravani R. Horta The imbpc hvac system: a complete mbpc solution for existing hvac systems Energy Build 120 2016 145 158 Ruano, A.E., Pesteh, S., Silva, S., Duarte, H., Mestre, G., Ferreira, P.M., Khosravani, H.R., Horta, R., 2016. The imbpc hvac system: a complete mbpc solution for existing hvac systems. Energy Build 120, 145-158. [26] S. Seal August Model predictive control of electric building energy and heating systems Ph.D. thesis 2019 McGill University https://escholarship.mcgill.ca/concern/theses/9306t361t Seal, S., August 2019. Model predictive control of electric building energy and heating systems. Ph.D. thesis. McGill University. URL: https://escholarship.mcgill.ca/concern/theses/9306t361t. [27] S. Seal V.R. Dehkordi B. Boulet Coordination of radiant floor and baseboard heating systems: sequential and simultaneous MPC schemes Science and Technology for the Built Environment 25 2019 1419 1436 10.1080/23744731.2019.1626166 Seal, S., Dehkordi, V.R., Boulet, B., 2019. Coordination of radiant floor and baseboard heating systems: sequential and simultaneous MPC schemes. Science and Technology for the Built Environment 25, 1419-1436. URL: https://doi.org/:10.1080/23744731.2019.1626166, arXiv:https://doi.org/10.1080/23744731.2019.1626166. [28] Solar Energy Laboratory Univ. of Wisconsin-Madison TRNSYS 17 main documentation ume 04 2012 LLC Madison, Wisconsin Mathematical Reference. TRNSYS 17: Thermal Energy System Specialists Solar Energy Laboratory, Univ. of Wisconsin-Madison, 2012. TRNSYS 17 main documentation, Volume 04: Mathematical Reference. TRNSYS 17: Thermal Energy System Specialists, LLC. Madison, Wisconsin. [29] Stelpro Stelpro electric baseboard https://www.stelpro.com/en-CA/electric-baseboard Stelpro. Stelpro electric baseboard. https://www.stelpro.com/en-CA/electric-baseboard. [Accessed on 16-12-2018]. [30] D.G. Stephenson March Tables of solar altitude, azimuth, intensity and heat gain factors for latitudes from 43 to 55 degrees North. Technical report National Research Council of Canada. Division of Building Research 1967 10.4224/20378809 Stephenson, D.G., March 1967. Tables of solar altitude, azimuth, intensity and heat gain factors for latitudes from 43 to 55 degrees North. Technical report. National Research Council of Canada. Division of Building Research. URL: https://doi.org/10.4224/20378809. [31] Tesla Powerwall Powerwall performance and mechanical specifications https://www.tesla.com/sites/default/files/pdfs/powerwall/Powerwall/%202_AC_Datasheet_en_northamerica.pdf Tesla Powerwall, . Powerwall performance and mechanical specifications. https://www.tesla.com/sites/default/files/pdfs/powerwall/Powerwall∖%202_AC_Datasheet_en_northamerica.pdf. [Accessed on 21-04-2019]. [32] TESSLibs 17: component libraries for the TRNSYS simulation environment, 2013. vol. 03: Electrical Library Mathematical Reference. TESS - Thermal Energy Systems Specialists. Madison, Wisconsin. TESSLibs 17: component libraries for the TRNSYS simulation environment, 2013. vol. 03: Electrical Library Mathematical Reference. TESS - Thermal Energy Systems Specialists. Madison, Wisconsin.",
    "scopus-id": "85090222840",
    "coredata": {
        "eid": "1-s2.0-S0360544220315644",
        "dc:description": "A novel implementation strategy of a centralized model predictive control (MPC) is proposed for a zone based comfort and energy management in a residential building. A photovoltaic (PV) solar system and a stationary home battery unit are considered. A heat pump (HP) is used as the primary heating unit. The electric baseboards (BB) are used as a supplementary system. The MPC controls the HP and BB power inputs for comfort management, as well as the energy flow among the PV, the battery and the bidirectional grid system. Variable Time-of-Use (ToU) rates are considered for the energy cost calculation and Feed-in-Tariff (FiT) is considered for selling energy to the grid. A 13.5% reduction in the energy cost is achieved with the centralized MPC as compared to a rule based energy management strategy. The solar energy generation and battery storage contribute to approximately 31% saving.",
        "openArchiveArticle": "false",
        "prism:coverDate": "2020-12-01",
        "openaccessUserLicense": null,
        "prism:aggregationType": "Journal",
        "prism:url": "https://api.elsevier.com/content/article/pii/S0360544220315644",
        "dc:creator": [
            {
                "@_fa": "true",
                "$": "Seal, Sayani"
            },
            {
                "@_fa": "true",
                "$": "Boulet, Benoit"
            },
            {
                "@_fa": "true",
                "$": "Dehkordi, Vahid R."
            }
        ],
        "link": [
            {
                "@_fa": "true",
                "@rel": "self",
                "@href": "https://api.elsevier.com/content/article/pii/S0360544220315644"
            },
            {
                "@_fa": "true",
                "@rel": "scidir",
                "@href": "https://www.sciencedirect.com/science/article/pii/S0360544220315644"
            }
        ],
        "dc:format": "application/json",
        "openaccessType": null,
        "pii": "S0360-5442(20)31564-4",
        "prism:volume": "212",
        "articleNumber": "118456",
        "prism:publisher": "Elsevier Ltd.",
        "dc:title": "Centralized model predictive control strategy for thermal comfort and residential energy management",
        "prism:copyright": "© 2020 Elsevier Ltd. All rights reserved.",
        "openaccess": "0",
        "prism:issn": "03605442",
        "dcterms:subject": [
            {
                "@_fa": "true",
                "$": "Centralized model predictive control (MPC)"
            },
            {
                "@_fa": "true",
                "$": "Home energy management"
            },
            {
                "@_fa": "true",
                "$": "Solar panels"
            },
            {
                "@_fa": "true",
                "$": "Home battery"
            }
        ],
        "openaccessArticle": "false",
        "prism:publicationName": "Energy",
        "openaccessSponsorType": null,
        "prism:pageRange": "118456",
        "pubType": "fla",
        "prism:coverDisplayDate": "1 December 2020",
        "prism:doi": "10.1016/j.energy.2020.118456",
        "prism:startingPage": "118456",
        "dc:identifier": "doi:10.1016/j.energy.2020.118456",
        "openaccessSponsorName": null
    },
    "objects": {"object": [
        {
            "@category": "standard",
            "@height": "138",
            "@width": "386",
            "@_fa": "true",
            "$": "https://api.elsevier.com/content/object/eid/1-s2.0-S0360544220315644-gr3.jpg?httpAccept=%2A%2F%2A",
            "@multimediatype": "JPEG image file",
            "@type": "IMAGE-DOWNSAMPLED",
            "@size": "13877",
            "@ref": "gr3",
            "@mimetype": "image/jpeg"
        },
        {
            "@category": "standard",
            "@height": "373",
            "@width": "389",
            "@_fa": "true",
            "$": "https://api.elsevier.com/content/object/eid/1-s2.0-S0360544220315644-gr1.jpg?httpAccept=%2A%2F%2A",
            "@multimediatype": "JPEG image file",
            "@type": "IMAGE-DOWNSAMPLED",
            "@size": "35534",
            "@ref": "gr1",
            "@mimetype": "image/jpeg"
        },
        {
            "@category": "standard",
            "@height": "316",
            "@width": "388",
            "@_fa": "true",
            "$": "https://api.elsevier.com/content/object/eid/1-s2.0-S0360544220315644-gr10.jpg?httpAccept=%2A%2F%2A",
            "@multimediatype": "JPEG image file",
            "@type": "IMAGE-DOWNSAMPLED",
            "@size": "29719",
            "@ref": "gr10",
            "@mimetype": "image/jpeg"
        },
        {
            "@category": "standard",
            "@height": "170",
            "@width": "388",
            "@_fa": "true",
            "$": "https://api.elsevier.com/content/object/eid/1-s2.0-S0360544220315644-gr11.jpg?httpAccept=%2A%2F%2A",
            "@multimediatype": "JPEG image file",
            "@type": "IMAGE-DOWNSAMPLED",
            "@size": "23643",
            "@ref": "gr11",
            "@mimetype": "image/jpeg"
        },
        {
            "@category": "standard",
            "@height": "621",
            "@width": "689",
            "@_fa": "true",
            "$": "https://api.elsevier.com/content/object/eid/1-s2.0-S0360544220315644-gr6.jpg?httpAccept=%2A%2F%2A",
            "@multimediatype": "JPEG image file",
            "@type": "IMAGE-DOWNSAMPLED",
            "@size": "77907",
            "@ref": "gr6",
            "@mimetype": "image/jpeg"
        },
        {
            "@category": "standard",
            "@height": "378",
            "@width": "691",
            "@_fa": "true",
            "$": "https://api.elsevier.com/content/object/eid/1-s2.0-S0360544220315644-gr7.jpg?httpAccept=%2A%2F%2A",
            "@multimediatype": "JPEG image file",
            "@type": "IMAGE-DOWNSAMPLED",
            "@size": "86927",
            "@ref": "gr7",
            "@mimetype": "image/jpeg"
        },
        {
            "@category": "standard",
            "@height": "220",
            "@width": "388",
            "@_fa": "true",
            "$": "https://api.elsevier.com/content/object/eid/1-s2.0-S0360544220315644-gr4.jpg?httpAccept=%2A%2F%2A",
            "@multimediatype": "JPEG image file",
            "@type": "IMAGE-DOWNSAMPLED",
            "@size": "16101",
            "@ref": "gr4",
            "@mimetype": "image/jpeg"
        },
        {
            "@category": "standard",
            "@height": "175",
            "@width": "388",
            "@_fa": "true",
            "$": "https://api.elsevier.com/content/object/eid/1-s2.0-S0360544220315644-gr12.jpg?httpAccept=%2A%2F%2A",
            "@multimediatype": "JPEG image file",
            "@type": "IMAGE-DOWNSAMPLED",
            "@size": "31693",
            "@ref": "gr12",
            "@mimetype": "image/jpeg"
        },
        {
            "@category": "standard",
            "@height": "151",
            "@width": "389",
            "@_fa": "true",
            "$": "https://api.elsevier.com/content/object/eid/1-s2.0-S0360544220315644-gr2.jpg?httpAccept=%2A%2F%2A",
            "@multimediatype": "JPEG image file",
            "@type": "IMAGE-DOWNSAMPLED",
            "@size": "11365",
            "@ref": "gr2",
            "@mimetype": "image/jpeg"
        },
        {
            "@category": "standard",
            "@height": "287",
            "@width": "691",
            "@_fa": "true",
            "$": "https://api.elsevier.com/content/object/eid/1-s2.0-S0360544220315644-gr5.jpg?httpAccept=%2A%2F%2A",
            "@multimediatype": "JPEG image file",
            "@type": "IMAGE-DOWNSAMPLED",
            "@size": "39968",
            "@ref": "gr5",
            "@mimetype": "image/jpeg"
        },
        {
            "@category": "standard",
            "@height": "343",
            "@width": "691",
            "@_fa": "true",
            "$": "https://api.elsevier.com/content/object/eid/1-s2.0-S0360544220315644-gr8.jpg?httpAccept=%2A%2F%2A",
            "@multimediatype": "JPEG image file",
            "@type": "IMAGE-DOWNSAMPLED",
            "@size": "52601",
            "@ref": "gr8",
            "@mimetype": "image/jpeg"
        },
        {
            "@category": "standard",
            "@height": "172",
            "@width": "388",
            "@_fa": "true",
            "$": "https://api.elsevier.com/content/object/eid/1-s2.0-S0360544220315644-gr9.jpg?httpAccept=%2A%2F%2A",
            "@multimediatype": "JPEG image file",
            "@type": "IMAGE-DOWNSAMPLED",
            "@size": "34102",
            "@ref": "gr9",
            "@mimetype": "image/jpeg"
        },
        {
            "@category": "thumbnail",
            "@height": "78",
            "@width": "219",
            "@_fa": "true",
            "$": "https://api.elsevier.com/content/object/eid/1-s2.0-S0360544220315644-gr3.sml?httpAccept=%2A%2F%2A",
            "@multimediatype": "GIF image file",
            "@type": "IMAGE-THUMBNAIL",
            "@size": "3651",
            "@ref": "gr3",
            "@mimetype": "image/gif"
        },
        {
            "@category": "thumbnail",
            "@height": "164",
            "@width": "171",
            "@_fa": "true",
            "$": "https://api.elsevier.com/content/object/eid/1-s2.0-S0360544220315644-gr1.sml?httpAccept=%2A%2F%2A",
            "@multimediatype": "GIF image file",
            "@type": "IMAGE-THUMBNAIL",
            "@size": "10226",
            "@ref": "gr1",
            "@mimetype": "image/gif"
        },
        {
            "@category": "thumbnail",
            "@height": "164",
            "@width": "201",
            "@_fa": "true",
            "$": "https://api.elsevier.com/content/object/eid/1-s2.0-S0360544220315644-gr10.sml?httpAccept=%2A%2F%2A",
            "@multimediatype": "GIF image file",
            "@type": "IMAGE-THUMBNAIL",
            "@size": "6933",
            "@ref": "gr10",
            "@mimetype": "image/gif"
        },
        {
            "@category": "thumbnail",
            "@height": "96",
            "@width": "219",
            "@_fa": "true",
            "$": "https://api.elsevier.com/content/object/eid/1-s2.0-S0360544220315644-gr11.sml?httpAccept=%2A%2F%2A",
            "@multimediatype": "GIF image file",
            "@type": "IMAGE-THUMBNAIL",
            "@size": "6058",
            "@ref": "gr11",
            "@mimetype": "image/gif"
        },
        {
            "@category": "thumbnail",
            "@height": "164",
            "@width": "182",
            "@_fa": "true",
            "$": "https://api.elsevier.com/content/object/eid/1-s2.0-S0360544220315644-gr6.sml?httpAccept=%2A%2F%2A",
            "@multimediatype": "GIF image file",
            "@type": "IMAGE-THUMBNAIL",
            "@size": "9781",
            "@ref": "gr6",
            "@mimetype": "image/gif"
        },
        {
            "@category": "thumbnail",
            "@height": "120",
            "@width": "219",
            "@_fa": "true",
            "$": "https://api.elsevier.com/content/object/eid/1-s2.0-S0360544220315644-gr7.sml?httpAccept=%2A%2F%2A",
            "@multimediatype": "GIF image file",
            "@type": "IMAGE-THUMBNAIL",
            "@size": "9543",
            "@ref": "gr7",
            "@mimetype": "image/gif"
        },
        {
            "@category": "thumbnail",
            "@height": "124",
            "@width": "219",
            "@_fa": "true",
            "$": "https://api.elsevier.com/content/object/eid/1-s2.0-S0360544220315644-gr4.sml?httpAccept=%2A%2F%2A",
            "@multimediatype": "GIF image file",
            "@type": "IMAGE-THUMBNAIL",
            "@size": "4915",
            "@ref": "gr4",
            "@mimetype": "image/gif"
        },
        {
            "@category": "thumbnail",
            "@height": "99",
            "@width": "219",
            "@_fa": "true",
            "$": "https://api.elsevier.com/content/object/eid/1-s2.0-S0360544220315644-gr12.sml?httpAccept=%2A%2F%2A",
            "@multimediatype": "GIF image file",
            "@type": "IMAGE-THUMBNAIL",
            "@size": "8733",
            "@ref": "gr12",
            "@mimetype": "image/gif"
        },
        {
            "@category": "thumbnail",
            "@height": "85",
            "@width": "219",
            "@_fa": "true",
            "$": "https://api.elsevier.com/content/object/eid/1-s2.0-S0360544220315644-gr2.sml?httpAccept=%2A%2F%2A",
            "@multimediatype": "GIF image file",
            "@type": "IMAGE-THUMBNAIL",
            "@size": "3334",
            "@ref": "gr2",
            "@mimetype": "image/gif"
        },
        {
            "@category": "thumbnail",
            "@height": "91",
            "@width": "219",
            "@_fa": "true",
            "$": "https://api.elsevier.com/content/object/eid/1-s2.0-S0360544220315644-gr5.sml?httpAccept=%2A%2F%2A",
            "@multimediatype": "GIF image file",
            "@type": "IMAGE-THUMBNAIL",
            "@size": "6666",
            "@ref": "gr5",
            "@mimetype": "image/gif"
        },
        {
            "@category": "thumbnail",
            "@height": "109",
            "@width": "219",
            "@_fa": "true",
            "$": "https://api.elsevier.com/content/object/eid/1-s2.0-S0360544220315644-gr8.sml?httpAccept=%2A%2F%2A",
            "@multimediatype": "GIF image file",
            "@type": "IMAGE-THUMBNAIL",
            "@size": "6948",
            "@ref": "gr8",
            "@mimetype": "image/gif"
        },
        {
            "@category": "thumbnail",
            "@height": "97",
            "@width": "219",
            "@_fa": "true",
            "$": "https://api.elsevier.com/content/object/eid/1-s2.0-S0360544220315644-gr9.sml?httpAccept=%2A%2F%2A",
            "@multimediatype": "GIF image file",
            "@type": "IMAGE-THUMBNAIL",
            "@size": "10532",
            "@ref": "gr9",
            "@mimetype": "image/gif"
        },
        {
            "@category": "high",
            "@height": "613",
            "@width": "1712",
            "@_fa": "true",
            "$": "https://api.elsevier.com/content/object/eid/1-s2.0-S0360544220315644-gr3_lrg.jpg?httpAccept=%2A%2F%2A",
            "@multimediatype": "JPEG image file",
            "@type": "IMAGE-HIGH-RES",
            "@size": "94768",
            "@ref": "gr3",
            "@mimetype": "image/jpeg"
        },
        {
            "@category": "high",
            "@height": "1651",
            "@width": "1722",
            "@_fa": "true",
            "$": "https://api.elsevier.com/content/object/eid/1-s2.0-S0360544220315644-gr1_lrg.jpg?httpAccept=%2A%2F%2A",
            "@multimediatype": "JPEG image file",
            "@type": "IMAGE-HIGH-RES",
            "@size": "242088",
            "@ref": "gr1",
            "@mimetype": "image/jpeg"
        },
        {
            "@category": "high",
            "@height": "1401",
            "@width": "1721",
            "@_fa": "true",
            "$": "https://api.elsevier.com/content/object/eid/1-s2.0-S0360544220315644-gr10_lrg.jpg?httpAccept=%2A%2F%2A",
            "@multimediatype": "JPEG image file",
            "@type": "IMAGE-HIGH-RES",
            "@size": "211345",
            "@ref": "gr10",
            "@mimetype": "image/jpeg"
        },
        {
            "@category": "high",
            "@height": "753",
            "@width": "1721",
            "@_fa": "true",
            "$": "https://api.elsevier.com/content/object/eid/1-s2.0-S0360544220315644-gr11_lrg.jpg?httpAccept=%2A%2F%2A",
            "@multimediatype": "JPEG image file",
            "@type": "IMAGE-HIGH-RES",
            "@size": "145991",
            "@ref": "gr11",
            "@mimetype": "image/jpeg"
        },
        {
            "@category": "high",
            "@height": "2750",
            "@width": "3050",
            "@_fa": "true",
            "$": "https://api.elsevier.com/content/object/eid/1-s2.0-S0360544220315644-gr6_lrg.jpg?httpAccept=%2A%2F%2A",
            "@multimediatype": "JPEG image file",
            "@type": "IMAGE-HIGH-RES",
            "@size": "597027",
            "@ref": "gr6",
            "@mimetype": "image/jpeg"
        },
        {
            "@category": "high",
            "@height": "1675",
            "@width": "3059",
            "@_fa": "true",
            "$": "https://api.elsevier.com/content/object/eid/1-s2.0-S0360544220315644-gr7_lrg.jpg?httpAccept=%2A%2F%2A",
            "@multimediatype": "JPEG image file",
            "@type": "IMAGE-HIGH-RES",
            "@size": "645998",
            "@ref": "gr7",
            "@mimetype": "image/jpeg"
        },
        {
            "@category": "high",
            "@height": "977",
            "@width": "1721",
            "@_fa": "true",
            "$": "https://api.elsevier.com/content/object/eid/1-s2.0-S0360544220315644-gr4_lrg.jpg?httpAccept=%2A%2F%2A",
            "@multimediatype": "JPEG image file",
            "@type": "IMAGE-HIGH-RES",
            "@size": "108865",
            "@ref": "gr4",
            "@mimetype": "image/jpeg"
        },
        {
            "@category": "high",
            "@height": "777",
            "@width": "1721",
            "@_fa": "true",
            "$": "https://api.elsevier.com/content/object/eid/1-s2.0-S0360544220315644-gr12_lrg.jpg?httpAccept=%2A%2F%2A",
            "@multimediatype": "JPEG image file",
            "@type": "IMAGE-HIGH-RES",
            "@size": "206405",
            "@ref": "gr12",
            "@mimetype": "image/jpeg"
        },
        {
            "@category": "high",
            "@height": "670",
            "@width": "1722",
            "@_fa": "true",
            "$": "https://api.elsevier.com/content/object/eid/1-s2.0-S0360544220315644-gr2_lrg.jpg?httpAccept=%2A%2F%2A",
            "@multimediatype": "JPEG image file",
            "@type": "IMAGE-HIGH-RES",
            "@size": "77861",
            "@ref": "gr2",
            "@mimetype": "image/jpeg"
        },
        {
            "@category": "high",
            "@height": "1270",
            "@width": "3060",
            "@_fa": "true",
            "$": "https://api.elsevier.com/content/object/eid/1-s2.0-S0360544220315644-gr5_lrg.jpg?httpAccept=%2A%2F%2A",
            "@multimediatype": "JPEG image file",
            "@type": "IMAGE-HIGH-RES",
            "@size": "270088",
            "@ref": "gr5",
            "@mimetype": "image/jpeg"
        },
        {
            "@category": "high",
            "@height": "1519",
            "@width": "3061",
            "@_fa": "true",
            "$": "https://api.elsevier.com/content/object/eid/1-s2.0-S0360544220315644-gr8_lrg.jpg?httpAccept=%2A%2F%2A",
            "@multimediatype": "JPEG image file",
            "@type": "IMAGE-HIGH-RES",
            "@size": "333051",
            "@ref": "gr8",
            "@mimetype": "image/jpeg"
        },
        {
            "@category": "high",
            "@height": "761",
            "@width": "1721",
            "@_fa": "true",
            "$": "https://api.elsevier.com/content/object/eid/1-s2.0-S0360544220315644-gr9_lrg.jpg?httpAccept=%2A%2F%2A",
            "@multimediatype": "JPEG image file",
            "@type": "IMAGE-HIGH-RES",
            "@size": "264396",
            "@ref": "gr9",
            "@mimetype": "image/jpeg"
        },
        {
            "@category": "thumbnail",
            "@_fa": "true",
            "$": "https://api.elsevier.com/content/object/eid/1-s2.0-S0360544220315644-si51.svg?httpAccept=%2A%2F%2A",
            "@multimediatype": "Scalable Vector Graphics file",
            "@type": "ALTIMG",
            "@size": "7824",
            "@ref": "si51",
            "@mimetype": "image/svg+xml"
        },
        {
            "@category": "thumbnail",
            "@_fa": "true",
            "$": "https://api.elsevier.com/content/object/eid/1-s2.0-S0360544220315644-si9.svg?httpAccept=%2A%2F%2A",
            "@multimediatype": "Scalable Vector Graphics file",
            "@type": "ALTIMG",
            "@size": "9324",
            "@ref": "si9",
            "@mimetype": "image/svg+xml"
        },
        {
            "@category": "thumbnail",
            "@_fa": "true",
            "$": "https://api.elsevier.com/content/object/eid/1-s2.0-S0360544220315644-si105.svg?httpAccept=%2A%2F%2A",
            "@multimediatype": "Scalable Vector Graphics file",
            "@type": "ALTIMG",
            "@size": "13903",
            "@ref": "si105",
            "@mimetype": "image/svg+xml"
        },
        {
            "@category": "thumbnail",
            "@_fa": "true",
            "$": "https://api.elsevier.com/content/object/eid/1-s2.0-S0360544220315644-si86.svg?httpAccept=%2A%2F%2A",
            "@multimediatype": "Scalable Vector Graphics file",
            "@type": "ALTIMG",
            "@size": "7095",
            "@ref": "si86",
            "@mimetype": "image/svg+xml"
        },
        {
            "@category": "thumbnail",
            "@_fa": "true",
            "$": "https://api.elsevier.com/content/object/eid/1-s2.0-S0360544220315644-si27.svg?httpAccept=%2A%2F%2A",
            "@multimediatype": "Scalable Vector Graphics file",
            "@type": "ALTIMG",
            "@size": "13977",
            "@ref": "si27",
            "@mimetype": "image/svg+xml"
        },
        {
            "@category": "thumbnail",
            "@_fa": "true",
            "$": "https://api.elsevier.com/content/object/eid/1-s2.0-S0360544220315644-si75.svg?httpAccept=%2A%2F%2A",
            "@multimediatype": "Scalable Vector Graphics file",
            "@type": "ALTIMG",
            "@size": "5670",
            "@ref": "si75",
            "@mimetype": "image/svg+xml"
        },
        {
            "@category": "thumbnail",
            "@_fa": "true",
            "$": "https://api.elsevier.com/content/object/eid/1-s2.0-S0360544220315644-si98.svg?httpAccept=%2A%2F%2A",
            "@multimediatype": "Scalable Vector Graphics file",
            "@type": "ALTIMG",
            "@size": "3176",
            "@ref": "si98",
            "@mimetype": "image/svg+xml"
        },
        {
            "@category": "thumbnail",
            "@_fa": "true",
            "$": "https://api.elsevier.com/content/object/eid/1-s2.0-S0360544220315644-si60.svg?httpAccept=%2A%2F%2A",
            "@multimediatype": "Scalable Vector Graphics file",
            "@type": "ALTIMG",
            "@size": "6311",
            "@ref": "si60",
            "@mimetype": "image/svg+xml"
        },
        {
            "@category": "thumbnail",
            "@_fa": "true",
            "$": "https://api.elsevier.com/content/object/eid/1-s2.0-S0360544220315644-si83.svg?httpAccept=%2A%2F%2A",
            "@multimediatype": "Scalable Vector Graphics file",
            "@type": "ALTIMG",
            "@size": "2789",
            "@ref": "si83",
            "@mimetype": "image/svg+xml"
        },
        {
            "@category": "thumbnail",
            "@_fa": "true",
            "$": "https://api.elsevier.com/content/object/eid/1-s2.0-S0360544220315644-si46.svg?httpAccept=%2A%2F%2A",
            "@multimediatype": "Scalable Vector Graphics file",
            "@type": "ALTIMG",
            "@size": "10100",
            "@ref": "si46",
            "@mimetype": "image/svg+xml"
        },
        {
            "@category": "thumbnail",
            "@_fa": "true",
            "$": "https://api.elsevier.com/content/object/eid/1-s2.0-S0360544220315644-si6.svg?httpAccept=%2A%2F%2A",
            "@multimediatype": "Scalable Vector Graphics file",
            "@type": "ALTIMG",
            "@size": "13193",
            "@ref": "si6",
            "@mimetype": "image/svg+xml"
        },
        {
            "@category": "thumbnail",
            "@_fa": "true",
            "$": "https://api.elsevier.com/content/object/eid/1-s2.0-S0360544220315644-si42.svg?httpAccept=%2A%2F%2A",
            "@multimediatype": "Scalable Vector Graphics file",
            "@type": "ALTIMG",
            "@size": "3935",
            "@ref": "si42",
            "@mimetype": "image/svg+xml"
        },
        {
            "@category": "thumbnail",
            "@_fa": "true",
            "$": "https://api.elsevier.com/content/object/eid/1-s2.0-S0360544220315644-si15.svg?httpAccept=%2A%2F%2A",
            "@multimediatype": "Scalable Vector Graphics file",
            "@type": "ALTIMG",
            "@size": "4150",
            "@ref": "si15",
            "@mimetype": "image/svg+xml"
        },
        {
            "@category": "thumbnail",
            "@_fa": "true",
            "$": "https://api.elsevier.com/content/object/eid/1-s2.0-S0360544220315644-si16.svg?httpAccept=%2A%2F%2A",
            "@multimediatype": "Scalable Vector Graphics file",
            "@type": "ALTIMG",
            "@size": "3931",
            "@ref": "si16",
            "@mimetype": "image/svg+xml"
        },
        {
            "@category": "thumbnail",
            "@_fa": "true",
            "$": "https://api.elsevier.com/content/object/eid/1-s2.0-S0360544220315644-si142.svg?httpAccept=%2A%2F%2A",
            "@multimediatype": "Scalable Vector Graphics file",
            "@type": "ALTIMG",
            "@size": "122914",
            "@ref": "si142",
            "@mimetype": "image/svg+xml"
        },
        {
            "@category": "thumbnail",
            "@_fa": "true",
            "$": "https://api.elsevier.com/content/object/eid/1-s2.0-S0360544220315644-si157.svg?httpAccept=%2A%2F%2A",
            "@multimediatype": "Scalable Vector Graphics file",
            "@type": "ALTIMG",
            "@size": "18968",
            "@ref": "si157",
            "@mimetype": "image/svg+xml"
        },
        {
            "@category": "thumbnail",
            "@_fa": "true",
            "$": "https://api.elsevier.com/content/object/eid/1-s2.0-S0360544220315644-si81.svg?httpAccept=%2A%2F%2A",
            "@multimediatype": "Scalable Vector Graphics file",
            "@type": "ALTIMG",
            "@size": "6533",
            "@ref": "si81",
            "@mimetype": "image/svg+xml"
        },
        {
            "@category": "thumbnail",
            "@_fa": "true",
            "$": "https://api.elsevier.com/content/object/eid/1-s2.0-S0360544220315644-si138.svg?httpAccept=%2A%2F%2A",
            "@multimediatype": "Scalable Vector Graphics file",
            "@type": "ALTIMG",
            "@size": "25296",
            "@ref": "si138",
            "@mimetype": "image/svg+xml"
        },
        {
            "@category": "thumbnail",
            "@_fa": "true",
            "$": "https://api.elsevier.com/content/object/eid/1-s2.0-S0360544220315644-si5.svg?httpAccept=%2A%2F%2A",
            "@multimediatype": "Scalable Vector Graphics file",
            "@type": "ALTIMG",
            "@size": "3821",
            "@ref": "si5",
            "@mimetype": "image/svg+xml"
        },
        {
            "@category": "thumbnail",
            "@_fa": "true",
            "$": "https://api.elsevier.com/content/object/eid/1-s2.0-S0360544220315644-si95.svg?httpAccept=%2A%2F%2A",
            "@multimediatype": "Scalable Vector Graphics file",
            "@type": "ALTIMG",
            "@size": "5092",
            "@ref": "si95",
            "@mimetype": "image/svg+xml"
        },
        {
            "@category": "thumbnail",
            "@_fa": "true",
            "$": "https://api.elsevier.com/content/object/eid/1-s2.0-S0360544220315644-si65.svg?httpAccept=%2A%2F%2A",
            "@multimediatype": "Scalable Vector Graphics file",
            "@type": "ALTIMG",
            "@size": "8426",
            "@ref": "si65",
            "@mimetype": "image/svg+xml"
        },
        {
            "@category": "thumbnail",
            "@_fa": "true",
            "$": "https://api.elsevier.com/content/object/eid/1-s2.0-S0360544220315644-si125.svg?httpAccept=%2A%2F%2A",
            "@multimediatype": "Scalable Vector Graphics file",
            "@type": "ALTIMG",
            "@size": "17388",
            "@ref": "si125",
            "@mimetype": "image/svg+xml"
        },
        {
            "@category": "thumbnail",
            "@_fa": "true",
            "$": "https://api.elsevier.com/content/object/eid/1-s2.0-S0360544220315644-si97.svg?httpAccept=%2A%2F%2A",
            "@multimediatype": "Scalable Vector Graphics file",
            "@type": "ALTIMG",
            "@size": "3153",
            "@ref": "si97",
            "@mimetype": "image/svg+xml"
        },
        {
            "@category": "thumbnail",
            "@_fa": "true",
            "$": "https://api.elsevier.com/content/object/eid/1-s2.0-S0360544220315644-si148.svg?httpAccept=%2A%2F%2A",
            "@multimediatype": "Scalable Vector Graphics file",
            "@type": "ALTIMG",
            "@size": "25798",
            "@ref": "si148",
            "@mimetype": "image/svg+xml"
        },
        {
            "@category": "thumbnail",
            "@_fa": "true",
            "$": "https://api.elsevier.com/content/object/eid/1-s2.0-S0360544220315644-si2.svg?httpAccept=%2A%2F%2A",
            "@multimediatype": "Scalable Vector Graphics file",
            "@type": "ALTIMG",
            "@size": "17772",
            "@ref": "si2",
            "@mimetype": "image/svg+xml"
        },
        {
            "@category": "thumbnail",
            "@_fa": "true",
            "$": "https://api.elsevier.com/content/object/eid/1-s2.0-S0360544220315644-si140.svg?httpAccept=%2A%2F%2A",
            "@multimediatype": "Scalable Vector Graphics file",
            "@type": "ALTIMG",
            "@size": "19064",
            "@ref": "si140",
            "@mimetype": "image/svg+xml"
        },
        {
            "@category": "thumbnail",
            "@_fa": "true",
            "$": "https://api.elsevier.com/content/object/eid/1-s2.0-S0360544220315644-si143.svg?httpAccept=%2A%2F%2A",
            "@multimediatype": "Scalable Vector Graphics file",
            "@type": "ALTIMG",
            "@size": "16353",
            "@ref": "si143",
            "@mimetype": "image/svg+xml"
        },
        {
            "@category": "thumbnail",
            "@_fa": "true",
            "$": "https://api.elsevier.com/content/object/eid/1-s2.0-S0360544220315644-si63.svg?httpAccept=%2A%2F%2A",
            "@multimediatype": "Scalable Vector Graphics file",
            "@type": "ALTIMG",
            "@size": "7564",
            "@ref": "si63",
            "@mimetype": "image/svg+xml"
        },
        {
            "@category": "thumbnail",
            "@_fa": "true",
            "$": "https://api.elsevier.com/content/object/eid/1-s2.0-S0360544220315644-si55.svg?httpAccept=%2A%2F%2A",
            "@multimediatype": "Scalable Vector Graphics file",
            "@type": "ALTIMG",
            "@size": "7032",
            "@ref": "si55",
            "@mimetype": "image/svg+xml"
        },
        {
            "@category": "thumbnail",
            "@_fa": "true",
            "$": "https://api.elsevier.com/content/object/eid/1-s2.0-S0360544220315644-si20.svg?httpAccept=%2A%2F%2A",
            "@multimediatype": "Scalable Vector Graphics file",
            "@type": "ALTIMG",
            "@size": "3833",
            "@ref": "si20",
            "@mimetype": "image/svg+xml"
        },
        {
            "@category": "thumbnail",
            "@_fa": "true",
            "$": "https://api.elsevier.com/content/object/eid/1-s2.0-S0360544220315644-si74.svg?httpAccept=%2A%2F%2A",
            "@multimediatype": "Scalable Vector Graphics file",
            "@type": "ALTIMG",
            "@size": "4704",
            "@ref": "si74",
            "@mimetype": "image/svg+xml"
        },
        {
            "@category": "thumbnail",
            "@_fa": "true",
            "$": "https://api.elsevier.com/content/object/eid/1-s2.0-S0360544220315644-si150.svg?httpAccept=%2A%2F%2A",
            "@multimediatype": "Scalable Vector Graphics file",
            "@type": "ALTIMG",
            "@size": "24663",
            "@ref": "si150",
            "@mimetype": "image/svg+xml"
        },
        {
            "@category": "thumbnail",
            "@_fa": "true",
            "$": "https://api.elsevier.com/content/object/eid/1-s2.0-S0360544220315644-si68.svg?httpAccept=%2A%2F%2A",
            "@multimediatype": "Scalable Vector Graphics file",
            "@type": "ALTIMG",
            "@size": "7375",
            "@ref": "si68",
            "@mimetype": "image/svg+xml"
        },
        {
            "@category": "thumbnail",
            "@_fa": "true",
            "$": "https://api.elsevier.com/content/object/eid/1-s2.0-S0360544220315644-si92.svg?httpAccept=%2A%2F%2A",
            "@multimediatype": "Scalable Vector Graphics file",
            "@type": "ALTIMG",
            "@size": "47133",
            "@ref": "si92",
            "@mimetype": "image/svg+xml"
        },
        {
            "@category": "thumbnail",
            "@_fa": "true",
            "$": "https://api.elsevier.com/content/object/eid/1-s2.0-S0360544220315644-si67.svg?httpAccept=%2A%2F%2A",
            "@multimediatype": "Scalable Vector Graphics file",
            "@type": "ALTIMG",
            "@size": "2750",
            "@ref": "si67",
            "@mimetype": "image/svg+xml"
        },
        {
            "@category": "thumbnail",
            "@_fa": "true",
            "$": "https://api.elsevier.com/content/object/eid/1-s2.0-S0360544220315644-si34.svg?httpAccept=%2A%2F%2A",
            "@multimediatype": "Scalable Vector Graphics file",
            "@type": "ALTIMG",
            "@size": "6880",
            "@ref": "si34",
            "@mimetype": "image/svg+xml"
        },
        {
            "@category": "thumbnail",
            "@_fa": "true",
            "$": "https://api.elsevier.com/content/object/eid/1-s2.0-S0360544220315644-si48.svg?httpAccept=%2A%2F%2A",
            "@multimediatype": "Scalable Vector Graphics file",
            "@type": "ALTIMG",
            "@size": "7350",
            "@ref": "si48",
            "@mimetype": "image/svg+xml"
        },
        {
            "@category": "thumbnail",
            "@_fa": "true",
            "$": "https://api.elsevier.com/content/object/eid/1-s2.0-S0360544220315644-si160.svg?httpAccept=%2A%2F%2A",
            "@multimediatype": "Scalable Vector Graphics file",
            "@type": "ALTIMG",
            "@size": "7763",
            "@ref": "si160",
            "@mimetype": "image/svg+xml"
        },
        {
            "@category": "thumbnail",
            "@_fa": "true",
            "$": "https://api.elsevier.com/content/object/eid/1-s2.0-S0360544220315644-si1.svg?httpAccept=%2A%2F%2A",
            "@multimediatype": "Scalable Vector Graphics file",
            "@type": "ALTIMG",
            "@size": "15239",
            "@ref": "si1",
            "@mimetype": "image/svg+xml"
        },
        {
            "@category": "thumbnail",
            "@_fa": "true",
            "$": "https://api.elsevier.com/content/object/eid/1-s2.0-S0360544220315644-si4.svg?httpAccept=%2A%2F%2A",
            "@multimediatype": "Scalable Vector Graphics file",
            "@type": "ALTIMG",
            "@size": "13629",
            "@ref": "si4",
            "@mimetype": "image/svg+xml"
        },
        {
            "@category": "thumbnail",
            "@_fa": "true",
            "$": "https://api.elsevier.com/content/object/eid/1-s2.0-S0360544220315644-si73.svg?httpAccept=%2A%2F%2A",
            "@multimediatype": "Scalable Vector Graphics file",
            "@type": "ALTIMG",
            "@size": "9749",
            "@ref": "si73",
            "@mimetype": "image/svg+xml"
        },
        {
            "@category": "thumbnail",
            "@_fa": "true",
            "$": "https://api.elsevier.com/content/object/eid/1-s2.0-S0360544220315644-si132.svg?httpAccept=%2A%2F%2A",
            "@multimediatype": "Scalable Vector Graphics file",
            "@type": "ALTIMG",
            "@size": "17939",
            "@ref": "si132",
            "@mimetype": "image/svg+xml"
        },
        {
            "@category": "thumbnail",
            "@_fa": "true",
            "$": "https://api.elsevier.com/content/object/eid/1-s2.0-S0360544220315644-si66.svg?httpAccept=%2A%2F%2A",
            "@multimediatype": "Scalable Vector Graphics file",
            "@type": "ALTIMG",
            "@size": "7833",
            "@ref": "si66",
            "@mimetype": "image/svg+xml"
        },
        {
            "@category": "thumbnail",
            "@_fa": "true",
            "$": "https://api.elsevier.com/content/object/eid/1-s2.0-S0360544220315644-si3.svg?httpAccept=%2A%2F%2A",
            "@multimediatype": "Scalable Vector Graphics file",
            "@type": "ALTIMG",
            "@size": "4701",
            "@ref": "si3",
            "@mimetype": "image/svg+xml"
        },
        {
            "@category": "thumbnail",
            "@_fa": "true",
            "$": "https://api.elsevier.com/content/object/eid/1-s2.0-S0360544220315644-si135.svg?httpAccept=%2A%2F%2A",
            "@multimediatype": "Scalable Vector Graphics file",
            "@type": "ALTIMG",
            "@size": "34782",
            "@ref": "si135",
            "@mimetype": "image/svg+xml"
        },
        {
            "@category": "thumbnail",
            "@_fa": "true",
            "$": "https://api.elsevier.com/content/object/eid/1-s2.0-S0360544220315644-si104.svg?httpAccept=%2A%2F%2A",
            "@multimediatype": "Scalable Vector Graphics file",
            "@type": "ALTIMG",
            "@size": "13178",
            "@ref": "si104",
            "@mimetype": "image/svg+xml"
        },
        {
            "@category": "thumbnail",
            "@_fa": "true",
            "$": "https://api.elsevier.com/content/object/eid/1-s2.0-S0360544220315644-si61.svg?httpAccept=%2A%2F%2A",
            "@multimediatype": "Scalable Vector Graphics file",
            "@type": "ALTIMG",
            "@size": "6316",
            "@ref": "si61",
            "@mimetype": "image/svg+xml"
        },
        {
            "@category": "thumbnail",
            "@_fa": "true",
            "$": "https://api.elsevier.com/content/object/eid/1-s2.0-S0360544220315644-si89.svg?httpAccept=%2A%2F%2A",
            "@multimediatype": "Scalable Vector Graphics file",
            "@type": "ALTIMG",
            "@size": "25625",
            "@ref": "si89",
            "@mimetype": "image/svg+xml"
        },
        {
            "@category": "thumbnail",
            "@_fa": "true",
            "$": "https://api.elsevier.com/content/object/eid/1-s2.0-S0360544220315644-si84.svg?httpAccept=%2A%2F%2A",
            "@multimediatype": "Scalable Vector Graphics file",
            "@type": "ALTIMG",
            "@size": "7584",
            "@ref": "si84",
            "@mimetype": "image/svg+xml"
        },
        {
            "@category": "thumbnail",
            "@_fa": "true",
            "$": "https://api.elsevier.com/content/object/eid/1-s2.0-S0360544220315644-si26.svg?httpAccept=%2A%2F%2A",
            "@multimediatype": "Scalable Vector Graphics file",
            "@type": "ALTIMG",
            "@size": "13141",
            "@ref": "si26",
            "@mimetype": "image/svg+xml"
        },
        {
            "@category": "thumbnail",
            "@_fa": "true",
            "$": "https://api.elsevier.com/content/object/eid/1-s2.0-S0360544220315644-si37.svg?httpAccept=%2A%2F%2A",
            "@multimediatype": "Scalable Vector Graphics file",
            "@type": "ALTIMG",
            "@size": "7509",
            "@ref": "si37",
            "@mimetype": "image/svg+xml"
        },
        {
            "@category": "thumbnail",
            "@_fa": "true",
            "$": "https://api.elsevier.com/content/object/eid/1-s2.0-S0360544220315644-si167.svg?httpAccept=%2A%2F%2A",
            "@multimediatype": "Scalable Vector Graphics file",
            "@type": "ALTIMG",
            "@size": "6045",
            "@ref": "si167",
            "@mimetype": "image/svg+xml"
        },
        {
            "@category": "thumbnail",
            "@_fa": "true",
            "$": "https://api.elsevier.com/content/object/eid/1-s2.0-S0360544220315644-si156.svg?httpAccept=%2A%2F%2A",
            "@multimediatype": "Scalable Vector Graphics file",
            "@type": "ALTIMG",
            "@size": "18858",
            "@ref": "si156",
            "@mimetype": "image/svg+xml"
        },
        {
            "@category": "thumbnail",
            "@_fa": "true",
            "$": "https://api.elsevier.com/content/object/eid/1-s2.0-S0360544220315644-si162.svg?httpAccept=%2A%2F%2A",
            "@multimediatype": "Scalable Vector Graphics file",
            "@type": "ALTIMG",
            "@size": "3886",
            "@ref": "si162",
            "@mimetype": "image/svg+xml"
        },
        {
            "@category": "thumbnail",
            "@_fa": "true",
            "$": "https://api.elsevier.com/content/object/eid/1-s2.0-S0360544220315644-si45.svg?httpAccept=%2A%2F%2A",
            "@multimediatype": "Scalable Vector Graphics file",
            "@type": "ALTIMG",
            "@size": "6595",
            "@ref": "si45",
            "@mimetype": "image/svg+xml"
        },
        {
            "@category": "thumbnail",
            "@_fa": "true",
            "$": "https://api.elsevier.com/content/object/eid/1-s2.0-S0360544220315644-si90.svg?httpAccept=%2A%2F%2A",
            "@multimediatype": "Scalable Vector Graphics file",
            "@type": "ALTIMG",
            "@size": "64155",
            "@ref": "si90",
            "@mimetype": "image/svg+xml"
        },
        {
            "@category": "thumbnail",
            "@_fa": "true",
            "$": "https://api.elsevier.com/content/object/eid/1-s2.0-S0360544220315644-si62.svg?httpAccept=%2A%2F%2A",
            "@multimediatype": "Scalable Vector Graphics file",
            "@type": "ALTIMG",
            "@size": "3707",
            "@ref": "si62",
            "@mimetype": "image/svg+xml"
        },
        {
            "@category": "thumbnail",
            "@_fa": "true",
            "$": "https://api.elsevier.com/content/object/eid/1-s2.0-S0360544220315644-si49.svg?httpAccept=%2A%2F%2A",
            "@multimediatype": "Scalable Vector Graphics file",
            "@type": "ALTIMG",
            "@size": "3891",
            "@ref": "si49",
            "@mimetype": "image/svg+xml"
        },
        {
            "@category": "thumbnail",
            "@_fa": "true",
            "$": "https://api.elsevier.com/content/object/eid/1-s2.0-S0360544220315644-si120.svg?httpAccept=%2A%2F%2A",
            "@multimediatype": "Scalable Vector Graphics file",
            "@type": "ALTIMG",
            "@size": "7094",
            "@ref": "si120",
            "@mimetype": "image/svg+xml"
        },
        {
            "@category": "thumbnail",
            "@_fa": "true",
            "$": "https://api.elsevier.com/content/object/eid/1-s2.0-S0360544220315644-si107.svg?httpAccept=%2A%2F%2A",
            "@multimediatype": "Scalable Vector Graphics file",
            "@type": "ALTIMG",
            "@size": "5118",
            "@ref": "si107",
            "@mimetype": "image/svg+xml"
        },
        {
            "@category": "thumbnail",
            "@_fa": "true",
            "$": "https://api.elsevier.com/content/object/eid/1-s2.0-S0360544220315644-si96.svg?httpAccept=%2A%2F%2A",
            "@multimediatype": "Scalable Vector Graphics file",
            "@type": "ALTIMG",
            "@size": "20366",
            "@ref": "si96",
            "@mimetype": "image/svg+xml"
        },
        {
            "@category": "thumbnail",
            "@_fa": "true",
            "$": "https://api.elsevier.com/content/object/eid/1-s2.0-S0360544220315644-si31.svg?httpAccept=%2A%2F%2A",
            "@multimediatype": "Scalable Vector Graphics file",
            "@type": "ALTIMG",
            "@size": "3932",
            "@ref": "si31",
            "@mimetype": "image/svg+xml"
        },
        {
            "@category": "thumbnail",
            "@_fa": "true",
            "$": "https://api.elsevier.com/content/object/eid/1-s2.0-S0360544220315644-si69.svg?httpAccept=%2A%2F%2A",
            "@multimediatype": "Scalable Vector Graphics file",
            "@type": "ALTIMG",
            "@size": "3032",
            "@ref": "si69",
            "@mimetype": "image/svg+xml"
        },
        {
            "@category": "thumbnail",
            "@_fa": "true",
            "$": "https://api.elsevier.com/content/object/eid/1-s2.0-S0360544220315644-si87.svg?httpAccept=%2A%2F%2A",
            "@multimediatype": "Scalable Vector Graphics file",
            "@type": "ALTIMG",
            "@size": "4030",
            "@ref": "si87",
            "@mimetype": "image/svg+xml"
        },
        {
            "@category": "thumbnail",
            "@_fa": "true",
            "$": "https://api.elsevier.com/content/object/eid/1-s2.0-S0360544220315644-si78.svg?httpAccept=%2A%2F%2A",
            "@multimediatype": "Scalable Vector Graphics file",
            "@type": "ALTIMG",
            "@size": "7126",
            "@ref": "si78",
            "@mimetype": "image/svg+xml"
        },
        {
            "@category": "thumbnail",
            "@_fa": "true",
            "$": "https://api.elsevier.com/content/object/eid/1-s2.0-S0360544220315644-si33.svg?httpAccept=%2A%2F%2A",
            "@multimediatype": "Scalable Vector Graphics file",
            "@type": "ALTIMG",
            "@size": "7896",
            "@ref": "si33",
            "@mimetype": "image/svg+xml"
        },
        {
            "@category": "thumbnail",
            "@_fa": "true",
            "$": "https://api.elsevier.com/content/object/eid/1-s2.0-S0360544220315644-si123.svg?httpAccept=%2A%2F%2A",
            "@multimediatype": "Scalable Vector Graphics file",
            "@type": "ALTIMG",
            "@size": "3846",
            "@ref": "si123",
            "@mimetype": "image/svg+xml"
        },
        {
            "@category": "thumbnail",
            "@_fa": "true",
            "$": "https://api.elsevier.com/content/object/eid/1-s2.0-S0360544220315644-si161.svg?httpAccept=%2A%2F%2A",
            "@multimediatype": "Scalable Vector Graphics file",
            "@type": "ALTIMG",
            "@size": "3664",
            "@ref": "si161",
            "@mimetype": "image/svg+xml"
        },
        {
            "@category": "thumbnail",
            "@_fa": "true",
            "$": "https://api.elsevier.com/content/object/eid/1-s2.0-S0360544220315644-si101.svg?httpAccept=%2A%2F%2A",
            "@multimediatype": "Scalable Vector Graphics file",
            "@type": "ALTIMG",
            "@size": "36310",
            "@ref": "si101",
            "@mimetype": "image/svg+xml"
        },
        {
            "@category": "thumbnail",
            "@_fa": "true",
            "$": "https://api.elsevier.com/content/object/eid/1-s2.0-S0360544220315644-si38.svg?httpAccept=%2A%2F%2A",
            "@multimediatype": "Scalable Vector Graphics file",
            "@type": "ALTIMG",
            "@size": "15420",
            "@ref": "si38",
            "@mimetype": "image/svg+xml"
        },
        {
            "@category": "thumbnail",
            "@_fa": "true",
            "$": "https://api.elsevier.com/content/object/eid/1-s2.0-S0360544220315644-si128.svg?httpAccept=%2A%2F%2A",
            "@multimediatype": "Scalable Vector Graphics file",
            "@type": "ALTIMG",
            "@size": "35158",
            "@ref": "si128",
            "@mimetype": "image/svg+xml"
        },
        {
            "@category": "thumbnail",
            "@_fa": "true",
            "$": "https://api.elsevier.com/content/object/eid/1-s2.0-S0360544220315644-si29.svg?httpAccept=%2A%2F%2A",
            "@multimediatype": "Scalable Vector Graphics file",
            "@type": "ALTIMG",
            "@size": "2628",
            "@ref": "si29",
            "@mimetype": "image/svg+xml"
        },
        {
            "@category": "thumbnail",
            "@_fa": "true",
            "$": "https://api.elsevier.com/content/object/eid/1-s2.0-S0360544220315644-si72.svg?httpAccept=%2A%2F%2A",
            "@multimediatype": "Scalable Vector Graphics file",
            "@type": "ALTIMG",
            "@size": "3885",
            "@ref": "si72",
            "@mimetype": "image/svg+xml"
        },
        {
            "@category": "thumbnail",
            "@_fa": "true",
            "$": "https://api.elsevier.com/content/object/eid/1-s2.0-S0360544220315644-si57.svg?httpAccept=%2A%2F%2A",
            "@multimediatype": "Scalable Vector Graphics file",
            "@type": "ALTIMG",
            "@size": "6904",
            "@ref": "si57",
            "@mimetype": "image/svg+xml"
        },
        {
            "@category": "thumbnail",
            "@_fa": "true",
            "$": "https://api.elsevier.com/content/object/eid/1-s2.0-S0360544220315644-si59.svg?httpAccept=%2A%2F%2A",
            "@multimediatype": "Scalable Vector Graphics file",
            "@type": "ALTIMG",
            "@size": "6316",
            "@ref": "si59",
            "@mimetype": "image/svg+xml"
        },
        {
            "@category": "thumbnail",
            "@_fa": "true",
            "$": "https://api.elsevier.com/content/object/eid/1-s2.0-S0360544220315644-si13.svg?httpAccept=%2A%2F%2A",
            "@multimediatype": "Scalable Vector Graphics file",
            "@type": "ALTIMG",
            "@size": "4423",
            "@ref": "si13",
            "@mimetype": "image/svg+xml"
        },
        {
            "@category": "thumbnail",
            "@_fa": "true",
            "$": "https://api.elsevier.com/content/object/eid/1-s2.0-S0360544220315644-si139.svg?httpAccept=%2A%2F%2A",
            "@multimediatype": "Scalable Vector Graphics file",
            "@type": "ALTIMG",
            "@size": "20323",
            "@ref": "si139",
            "@mimetype": "image/svg+xml"
        },
        {
            "@category": "thumbnail",
            "@_fa": "true",
            "$": "https://api.elsevier.com/content/object/eid/1-s2.0-S0360544220315644-si146.svg?httpAccept=%2A%2F%2A",
            "@multimediatype": "Scalable Vector Graphics file",
            "@type": "ALTIMG",
            "@size": "10554",
            "@ref": "si146",
            "@mimetype": "image/svg+xml"
        },
        {
            "@category": "thumbnail",
            "@_fa": "true",
            "$": "https://api.elsevier.com/content/object/eid/1-s2.0-S0360544220315644-si43.svg?httpAccept=%2A%2F%2A",
            "@multimediatype": "Scalable Vector Graphics file",
            "@type": "ALTIMG",
            "@size": "6211",
            "@ref": "si43",
            "@mimetype": "image/svg+xml"
        },
        {
            "@category": "thumbnail",
            "@_fa": "true",
            "$": "https://api.elsevier.com/content/object/eid/1-s2.0-S0360544220315644-si28.svg?httpAccept=%2A%2F%2A",
            "@multimediatype": "Scalable Vector Graphics file",
            "@type": "ALTIMG",
            "@size": "6180",
            "@ref": "si28",
            "@mimetype": "image/svg+xml"
        },
        {
            "@category": "thumbnail",
            "@_fa": "true",
            "$": "https://api.elsevier.com/content/object/eid/1-s2.0-S0360544220315644-si85.svg?httpAccept=%2A%2F%2A",
            "@multimediatype": "Scalable Vector Graphics file",
            "@type": "ALTIMG",
            "@size": "34316",
            "@ref": "si85",
            "@mimetype": "image/svg+xml"
        },
        {
            "@category": "thumbnail",
            "@_fa": "true",
            "$": "https://api.elsevier.com/content/object/eid/1-s2.0-S0360544220315644-si93.svg?httpAccept=%2A%2F%2A",
            "@multimediatype": "Scalable Vector Graphics file",
            "@type": "ALTIMG",
            "@size": "30924",
            "@ref": "si93",
            "@mimetype": "image/svg+xml"
        },
        {
            "@category": "thumbnail",
            "@_fa": "true",
            "$": "https://api.elsevier.com/content/object/eid/1-s2.0-S0360544220315644-si91.svg?httpAccept=%2A%2F%2A",
            "@multimediatype": "Scalable Vector Graphics file",
            "@type": "ALTIMG",
            "@size": "8627",
            "@ref": "si91",
            "@mimetype": "image/svg+xml"
        },
        {
            "@category": "thumbnail",
            "@_fa": "true",
            "$": "https://api.elsevier.com/content/object/eid/1-s2.0-S0360544220315644-si114.svg?httpAccept=%2A%2F%2A",
            "@multimediatype": "Scalable Vector Graphics file",
            "@type": "ALTIMG",
            "@size": "4073",
            "@ref": "si114",
            "@mimetype": "image/svg+xml"
        },
        {
            "@category": "thumbnail",
            "@_fa": "true",
            "$": "https://api.elsevier.com/content/object/eid/1-s2.0-S0360544220315644-si100.svg?httpAccept=%2A%2F%2A",
            "@multimediatype": "Scalable Vector Graphics file",
            "@type": "ALTIMG",
            "@size": "10573",
            "@ref": "si100",
            "@mimetype": "image/svg+xml"
        },
        {
            "@category": "thumbnail",
            "@_fa": "true",
            "$": "https://api.elsevier.com/content/object/eid/1-s2.0-S0360544220315644-si159.svg?httpAccept=%2A%2F%2A",
            "@multimediatype": "Scalable Vector Graphics file",
            "@type": "ALTIMG",
            "@size": "6943",
            "@ref": "si159",
            "@mimetype": "image/svg+xml"
        },
        {
            "@category": "thumbnail",
            "@_fa": "true",
            "$": "https://api.elsevier.com/content/object/eid/1-s2.0-S0360544220315644-si71.svg?httpAccept=%2A%2F%2A",
            "@multimediatype": "Scalable Vector Graphics file",
            "@type": "ALTIMG",
            "@size": "3656",
            "@ref": "si71",
            "@mimetype": "image/svg+xml"
        },
        {
            "@category": "thumbnail",
            "@_fa": "true",
            "$": "https://api.elsevier.com/content/object/eid/1-s2.0-S0360544220315644-si122.svg?httpAccept=%2A%2F%2A",
            "@multimediatype": "Scalable Vector Graphics file",
            "@type": "ALTIMG",
            "@size": "4918",
            "@ref": "si122",
            "@mimetype": "image/svg+xml"
        },
        {
            "@category": "thumbnail",
            "@_fa": "true",
            "$": "https://api.elsevier.com/content/object/eid/1-s2.0-S0360544220315644-si22.svg?httpAccept=%2A%2F%2A",
            "@multimediatype": "Scalable Vector Graphics file",
            "@type": "ALTIMG",
            "@size": "2352",
            "@ref": "si22",
            "@mimetype": "image/svg+xml"
        },
        {
            "@category": "thumbnail",
            "@_fa": "true",
            "$": "https://api.elsevier.com/content/object/eid/1-s2.0-S0360544220315644-si130.svg?httpAccept=%2A%2F%2A",
            "@multimediatype": "Scalable Vector Graphics file",
            "@type": "ALTIMG",
            "@size": "4556",
            "@ref": "si130",
            "@mimetype": "image/svg+xml"
        },
        {
            "@category": "thumbnail",
            "@_fa": "true",
            "$": "https://api.elsevier.com/content/object/eid/1-s2.0-S0360544220315644-si108.svg?httpAccept=%2A%2F%2A",
            "@multimediatype": "Scalable Vector Graphics file",
            "@type": "ALTIMG",
            "@size": "4505",
            "@ref": "si108",
            "@mimetype": "image/svg+xml"
        },
        {
            "@category": "thumbnail",
            "@_fa": "true",
            "$": "https://api.elsevier.com/content/object/eid/1-s2.0-S0360544220315644-si153.svg?httpAccept=%2A%2F%2A",
            "@multimediatype": "Scalable Vector Graphics file",
            "@type": "ALTIMG",
            "@size": "10917",
            "@ref": "si153",
            "@mimetype": "image/svg+xml"
        },
        {
            "@category": "thumbnail",
            "@_fa": "true",
            "$": "https://api.elsevier.com/content/object/eid/1-s2.0-S0360544220315644-si14.svg?httpAccept=%2A%2F%2A",
            "@multimediatype": "Scalable Vector Graphics file",
            "@type": "ALTIMG",
            "@size": "3435",
            "@ref": "si14",
            "@mimetype": "image/svg+xml"
        },
        {
            "@category": "thumbnail",
            "@_fa": "true",
            "$": "https://api.elsevier.com/content/object/eid/1-s2.0-S0360544220315644-si58.svg?httpAccept=%2A%2F%2A",
            "@multimediatype": "Scalable Vector Graphics file",
            "@type": "ALTIMG",
            "@size": "6442",
            "@ref": "si58",
            "@mimetype": "image/svg+xml"
        },
        {
            "@category": "thumbnail",
            "@_fa": "true",
            "$": "https://api.elsevier.com/content/object/eid/1-s2.0-S0360544220315644-si23.svg?httpAccept=%2A%2F%2A",
            "@multimediatype": "Scalable Vector Graphics file",
            "@type": "ALTIMG",
            "@size": "8754",
            "@ref": "si23",
            "@mimetype": "image/svg+xml"
        },
        {
            "@category": "thumbnail",
            "@_fa": "true",
            "$": "https://api.elsevier.com/content/object/eid/1-s2.0-S0360544220315644-si121.svg?httpAccept=%2A%2F%2A",
            "@multimediatype": "Scalable Vector Graphics file",
            "@type": "ALTIMG",
            "@size": "6504",
            "@ref": "si121",
            "@mimetype": "image/svg+xml"
        },
        {
            "@category": "thumbnail",
            "@_fa": "true",
            "$": "https://api.elsevier.com/content/object/eid/1-s2.0-S0360544220315644-si116.svg?httpAccept=%2A%2F%2A",
            "@multimediatype": "Scalable Vector Graphics file",
            "@type": "ALTIMG",
            "@size": "6349",
            "@ref": "si116",
            "@mimetype": "image/svg+xml"
        },
        {
            "@category": "thumbnail",
            "@_fa": "true",
            "$": "https://api.elsevier.com/content/object/eid/1-s2.0-S0360544220315644-si144.svg?httpAccept=%2A%2F%2A",
            "@multimediatype": "Scalable Vector Graphics file",
            "@type": "ALTIMG",
            "@size": "27186",
            "@ref": "si144",
            "@mimetype": "image/svg+xml"
        },
        {
            "@category": "thumbnail",
            "@_fa": "true",
            "$": "https://api.elsevier.com/content/object/eid/1-s2.0-S0360544220315644-si47.svg?httpAccept=%2A%2F%2A",
            "@multimediatype": "Scalable Vector Graphics file",
            "@type": "ALTIMG",
            "@size": "5522",
            "@ref": "si47",
            "@mimetype": "image/svg+xml"
        },
        {
            "@category": "thumbnail",
            "@_fa": "true",
            "$": "https://api.elsevier.com/content/object/eid/1-s2.0-S0360544220315644-si166.svg?httpAccept=%2A%2F%2A",
            "@multimediatype": "Scalable Vector Graphics file",
            "@type": "ALTIMG",
            "@size": "15349",
            "@ref": "si166",
            "@mimetype": "image/svg+xml"
        },
        {
            "@category": "thumbnail",
            "@_fa": "true",
            "$": "https://api.elsevier.com/content/object/eid/1-s2.0-S0360544220315644-si113.svg?httpAccept=%2A%2F%2A",
            "@multimediatype": "Scalable Vector Graphics file",
            "@type": "ALTIMG",
            "@size": "6446",
            "@ref": "si113",
            "@mimetype": "image/svg+xml"
        },
        {
            "@category": "thumbnail",
            "@_fa": "true",
            "$": "https://api.elsevier.com/content/object/eid/1-s2.0-S0360544220315644-si117.svg?httpAccept=%2A%2F%2A",
            "@multimediatype": "Scalable Vector Graphics file",
            "@type": "ALTIMG",
            "@size": "6945",
            "@ref": "si117",
            "@mimetype": "image/svg+xml"
        },
        {
            "@category": "thumbnail",
            "@_fa": "true",
            "$": "https://api.elsevier.com/content/object/eid/1-s2.0-S0360544220315644-si82.svg?httpAccept=%2A%2F%2A",
            "@multimediatype": "Scalable Vector Graphics file",
            "@type": "ALTIMG",
            "@size": "6538",
            "@ref": "si82",
            "@mimetype": "image/svg+xml"
        },
        {
            "@category": "thumbnail",
            "@_fa": "true",
            "$": "https://api.elsevier.com/content/object/eid/1-s2.0-S0360544220315644-si129.svg?httpAccept=%2A%2F%2A",
            "@multimediatype": "Scalable Vector Graphics file",
            "@type": "ALTIMG",
            "@size": "4118",
            "@ref": "si129",
            "@mimetype": "image/svg+xml"
        },
        {
            "@category": "thumbnail",
            "@_fa": "true",
            "$": "https://api.elsevier.com/content/object/eid/1-s2.0-S0360544220315644-si88.svg?httpAccept=%2A%2F%2A",
            "@multimediatype": "Scalable Vector Graphics file",
            "@type": "ALTIMG",
            "@size": "44072",
            "@ref": "si88",
            "@mimetype": "image/svg+xml"
        },
        {
            "@category": "thumbnail",
            "@_fa": "true",
            "$": "https://api.elsevier.com/content/object/eid/1-s2.0-S0360544220315644-si134.svg?httpAccept=%2A%2F%2A",
            "@multimediatype": "Scalable Vector Graphics file",
            "@type": "ALTIMG",
            "@size": "23709",
            "@ref": "si134",
            "@mimetype": "image/svg+xml"
        },
        {
            "@category": "thumbnail",
            "@_fa": "true",
            "$": "https://api.elsevier.com/content/object/eid/1-s2.0-S0360544220315644-si10.svg?httpAccept=%2A%2F%2A",
            "@multimediatype": "Scalable Vector Graphics file",
            "@type": "ALTIMG",
            "@size": "8675",
            "@ref": "si10",
            "@mimetype": "image/svg+xml"
        },
        {
            "@category": "thumbnail",
            "@_fa": "true",
            "$": "https://api.elsevier.com/content/object/eid/1-s2.0-S0360544220315644-si102.svg?httpAccept=%2A%2F%2A",
            "@multimediatype": "Scalable Vector Graphics file",
            "@type": "ALTIMG",
            "@size": "23736",
            "@ref": "si102",
            "@mimetype": "image/svg+xml"
        },
        {
            "@category": "thumbnail",
            "@_fa": "true",
            "$": "https://api.elsevier.com/content/object/eid/1-s2.0-S0360544220315644-si40.svg?httpAccept=%2A%2F%2A",
            "@multimediatype": "Scalable Vector Graphics file",
            "@type": "ALTIMG",
            "@size": "6530",
            "@ref": "si40",
            "@mimetype": "image/svg+xml"
        },
        {
            "@category": "thumbnail",
            "@_fa": "true",
            "$": "https://api.elsevier.com/content/object/eid/1-s2.0-S0360544220315644-si115.svg?httpAccept=%2A%2F%2A",
            "@multimediatype": "Scalable Vector Graphics file",
            "@type": "ALTIMG",
            "@size": "5887",
            "@ref": "si115",
            "@mimetype": "image/svg+xml"
        },
        {
            "@category": "thumbnail",
            "@_fa": "true",
            "$": "https://api.elsevier.com/content/object/eid/1-s2.0-S0360544220315644-si36.svg?httpAccept=%2A%2F%2A",
            "@multimediatype": "Scalable Vector Graphics file",
            "@type": "ALTIMG",
            "@size": "5966",
            "@ref": "si36",
            "@mimetype": "image/svg+xml"
        },
        {
            "@category": "thumbnail",
            "@_fa": "true",
            "$": "https://api.elsevier.com/content/object/eid/1-s2.0-S0360544220315644-si152.svg?httpAccept=%2A%2F%2A",
            "@multimediatype": "Scalable Vector Graphics file",
            "@type": "ALTIMG",
            "@size": "7032",
            "@ref": "si152",
            "@mimetype": "image/svg+xml"
        },
        {
            "@category": "thumbnail",
            "@_fa": "true",
            "$": "https://api.elsevier.com/content/object/eid/1-s2.0-S0360544220315644-si17.svg?httpAccept=%2A%2F%2A",
            "@multimediatype": "Scalable Vector Graphics file",
            "@type": "ALTIMG",
            "@size": "4053",
            "@ref": "si17",
            "@mimetype": "image/svg+xml"
        },
        {
            "@category": "thumbnail",
            "@_fa": "true",
            "$": "https://api.elsevier.com/content/object/eid/1-s2.0-S0360544220315644-si158.svg?httpAccept=%2A%2F%2A",
            "@multimediatype": "Scalable Vector Graphics file",
            "@type": "ALTIMG",
            "@size": "5882",
            "@ref": "si158",
            "@mimetype": "image/svg+xml"
        },
        {
            "@category": "thumbnail",
            "@_fa": "true",
            "$": "https://api.elsevier.com/content/object/eid/1-s2.0-S0360544220315644-si21.svg?httpAccept=%2A%2F%2A",
            "@multimediatype": "Scalable Vector Graphics file",
            "@type": "ALTIMG",
            "@size": "3340",
            "@ref": "si21",
            "@mimetype": "image/svg+xml"
        },
        {
            "@category": "thumbnail",
            "@_fa": "true",
            "$": "https://api.elsevier.com/content/object/eid/1-s2.0-S0360544220315644-si118.svg?httpAccept=%2A%2F%2A",
            "@multimediatype": "Scalable Vector Graphics file",
            "@type": "ALTIMG",
            "@size": "3953",
            "@ref": "si118",
            "@mimetype": "image/svg+xml"
        },
        {
            "@category": "thumbnail",
            "@_fa": "true",
            "$": "https://api.elsevier.com/content/object/eid/1-s2.0-S0360544220315644-si119.svg?httpAccept=%2A%2F%2A",
            "@multimediatype": "Scalable Vector Graphics file",
            "@type": "ALTIMG",
            "@size": "11647",
            "@ref": "si119",
            "@mimetype": "image/svg+xml"
        },
        {
            "@category": "thumbnail",
            "@_fa": "true",
            "$": "https://api.elsevier.com/content/object/eid/1-s2.0-S0360544220315644-si12.svg?httpAccept=%2A%2F%2A",
            "@multimediatype": "Scalable Vector Graphics file",
            "@type": "ALTIMG",
            "@size": "8435",
            "@ref": "si12",
            "@mimetype": "image/svg+xml"
        },
        {
            "@category": "thumbnail",
            "@_fa": "true",
            "$": "https://api.elsevier.com/content/object/eid/1-s2.0-S0360544220315644-si32.svg?httpAccept=%2A%2F%2A",
            "@multimediatype": "Scalable Vector Graphics file",
            "@type": "ALTIMG",
            "@size": "6399",
            "@ref": "si32",
            "@mimetype": "image/svg+xml"
        },
        {
            "@category": "thumbnail",
            "@_fa": "true",
            "$": "https://api.elsevier.com/content/object/eid/1-s2.0-S0360544220315644-si64.svg?httpAccept=%2A%2F%2A",
            "@multimediatype": "Scalable Vector Graphics file",
            "@type": "ALTIMG",
            "@size": "6393",
            "@ref": "si64",
            "@mimetype": "image/svg+xml"
        },
        {
            "@category": "thumbnail",
            "@_fa": "true",
            "$": "https://api.elsevier.com/content/object/eid/1-s2.0-S0360544220315644-si109.svg?httpAccept=%2A%2F%2A",
            "@multimediatype": "Scalable Vector Graphics file",
            "@type": "ALTIMG",
            "@size": "5290",
            "@ref": "si109",
            "@mimetype": "image/svg+xml"
        },
        {
            "@category": "thumbnail",
            "@_fa": "true",
            "$": "https://api.elsevier.com/content/object/eid/1-s2.0-S0360544220315644-si7.svg?httpAccept=%2A%2F%2A",
            "@multimediatype": "Scalable Vector Graphics file",
            "@type": "ALTIMG",
            "@size": "12544",
            "@ref": "si7",
            "@mimetype": "image/svg+xml"
        },
        {
            "@category": "thumbnail",
            "@_fa": "true",
            "$": "https://api.elsevier.com/content/object/eid/1-s2.0-S0360544220315644-si106.svg?httpAccept=%2A%2F%2A",
            "@multimediatype": "Scalable Vector Graphics file",
            "@type": "ALTIMG",
            "@size": "4494",
            "@ref": "si106",
            "@mimetype": "image/svg+xml"
        },
        {
            "@category": "thumbnail",
            "@_fa": "true",
            "$": "https://api.elsevier.com/content/object/eid/1-s2.0-S0360544220315644-si79.svg?httpAccept=%2A%2F%2A",
            "@multimediatype": "Scalable Vector Graphics file",
            "@type": "ALTIMG",
            "@size": "6664",
            "@ref": "si79",
            "@mimetype": "image/svg+xml"
        },
        {
            "@category": "thumbnail",
            "@_fa": "true",
            "$": "https://api.elsevier.com/content/object/eid/1-s2.0-S0360544220315644-si110.svg?httpAccept=%2A%2F%2A",
            "@multimediatype": "Scalable Vector Graphics file",
            "@type": "ALTIMG",
            "@size": "5140",
            "@ref": "si110",
            "@mimetype": "image/svg+xml"
        },
        {
            "@category": "thumbnail",
            "@_fa": "true",
            "$": "https://api.elsevier.com/content/object/eid/1-s2.0-S0360544220315644-si164.svg?httpAccept=%2A%2F%2A",
            "@multimediatype": "Scalable Vector Graphics file",
            "@type": "ALTIMG",
            "@size": "5529",
            "@ref": "si164",
            "@mimetype": "image/svg+xml"
        },
        {
            "@category": "thumbnail",
            "@_fa": "true",
            "$": "https://api.elsevier.com/content/object/eid/1-s2.0-S0360544220315644-si44.svg?httpAccept=%2A%2F%2A",
            "@multimediatype": "Scalable Vector Graphics file",
            "@type": "ALTIMG",
            "@size": "4208",
            "@ref": "si44",
            "@mimetype": "image/svg+xml"
        },
        {
            "@category": "thumbnail",
            "@_fa": "true",
            "$": "https://api.elsevier.com/content/object/eid/1-s2.0-S0360544220315644-si168.svg?httpAccept=%2A%2F%2A",
            "@multimediatype": "Scalable Vector Graphics file",
            "@type": "ALTIMG",
            "@size": "4219",
            "@ref": "si168",
            "@mimetype": "image/svg+xml"
        },
        {
            "@category": "thumbnail",
            "@_fa": "true",
            "$": "https://api.elsevier.com/content/object/eid/1-s2.0-S0360544220315644-si136.svg?httpAccept=%2A%2F%2A",
            "@multimediatype": "Scalable Vector Graphics file",
            "@type": "ALTIMG",
            "@size": "18340",
            "@ref": "si136",
            "@mimetype": "image/svg+xml"
        },
        {
            "@category": "thumbnail",
            "@_fa": "true",
            "$": "https://api.elsevier.com/content/object/eid/1-s2.0-S0360544220315644-si76.svg?httpAccept=%2A%2F%2A",
            "@multimediatype": "Scalable Vector Graphics file",
            "@type": "ALTIMG",
            "@size": "7254",
            "@ref": "si76",
            "@mimetype": "image/svg+xml"
        },
        {
            "@category": "thumbnail",
            "@_fa": "true",
            "$": "https://api.elsevier.com/content/object/eid/1-s2.0-S0360544220315644-si163.svg?httpAccept=%2A%2F%2A",
            "@multimediatype": "Scalable Vector Graphics file",
            "@type": "ALTIMG",
            "@size": "5309",
            "@ref": "si163",
            "@mimetype": "image/svg+xml"
        },
        {
            "@category": "thumbnail",
            "@_fa": "true",
            "$": "https://api.elsevier.com/content/object/eid/1-s2.0-S0360544220315644-si154.svg?httpAccept=%2A%2F%2A",
            "@multimediatype": "Scalable Vector Graphics file",
            "@type": "ALTIMG",
            "@size": "2628",
            "@ref": "si154",
            "@mimetype": "image/svg+xml"
        },
        {
            "@category": "thumbnail",
            "@_fa": "true",
            "$": "https://api.elsevier.com/content/object/eid/1-s2.0-S0360544220315644-si94.svg?httpAccept=%2A%2F%2A",
            "@multimediatype": "Scalable Vector Graphics file",
            "@type": "ALTIMG",
            "@size": "8104",
            "@ref": "si94",
            "@mimetype": "image/svg+xml"
        },
        {
            "@category": "thumbnail",
            "@_fa": "true",
            "$": "https://api.elsevier.com/content/object/eid/1-s2.0-S0360544220315644-si133.svg?httpAccept=%2A%2F%2A",
            "@multimediatype": "Scalable Vector Graphics file",
            "@type": "ALTIMG",
            "@size": "29481",
            "@ref": "si133",
            "@mimetype": "image/svg+xml"
        },
        {
            "@category": "thumbnail",
            "@_fa": "true",
            "$": "https://api.elsevier.com/content/object/eid/1-s2.0-S0360544220315644-si19.svg?httpAccept=%2A%2F%2A",
            "@multimediatype": "Scalable Vector Graphics file",
            "@type": "ALTIMG",
            "@size": "4055",
            "@ref": "si19",
            "@mimetype": "image/svg+xml"
        },
        {
            "@category": "thumbnail",
            "@_fa": "true",
            "$": "https://api.elsevier.com/content/object/eid/1-s2.0-S0360544220315644-si41.svg?httpAccept=%2A%2F%2A",
            "@multimediatype": "Scalable Vector Graphics file",
            "@type": "ALTIMG",
            "@size": "14261",
            "@ref": "si41",
            "@mimetype": "image/svg+xml"
        },
        {
            "@category": "thumbnail",
            "@_fa": "true",
            "$": "https://api.elsevier.com/content/object/eid/1-s2.0-S0360544220315644-si8.svg?httpAccept=%2A%2F%2A",
            "@multimediatype": "Scalable Vector Graphics file",
            "@type": "ALTIMG",
            "@size": "7991",
            "@ref": "si8",
            "@mimetype": "image/svg+xml"
        },
        {
            "@category": "thumbnail",
            "@_fa": "true",
            "$": "https://api.elsevier.com/content/object/eid/1-s2.0-S0360544220315644-si103.svg?httpAccept=%2A%2F%2A",
            "@multimediatype": "Scalable Vector Graphics file",
            "@type": "ALTIMG",
            "@size": "22173",
            "@ref": "si103",
            "@mimetype": "image/svg+xml"
        },
        {
            "@category": "thumbnail",
            "@_fa": "true",
            "$": "https://api.elsevier.com/content/object/eid/1-s2.0-S0360544220315644-si30.svg?httpAccept=%2A%2F%2A",
            "@multimediatype": "Scalable Vector Graphics file",
            "@type": "ALTIMG",
            "@size": "7310",
            "@ref": "si30",
            "@mimetype": "image/svg+xml"
        },
        {
            "@category": "thumbnail",
            "@_fa": "true",
            "$": "https://api.elsevier.com/content/object/eid/1-s2.0-S0360544220315644-si39.svg?httpAccept=%2A%2F%2A",
            "@multimediatype": "Scalable Vector Graphics file",
            "@type": "ALTIMG",
            "@size": "3031",
            "@ref": "si39",
            "@mimetype": "image/svg+xml"
        },
        {
            "@category": "thumbnail",
            "@_fa": "true",
            "$": "https://api.elsevier.com/content/object/eid/1-s2.0-S0360544220315644-si145.svg?httpAccept=%2A%2F%2A",
            "@multimediatype": "Scalable Vector Graphics file",
            "@type": "ALTIMG",
            "@size": "16543",
            "@ref": "si145",
            "@mimetype": "image/svg+xml"
        },
        {
            "@category": "thumbnail",
            "@_fa": "true",
            "$": "https://api.elsevier.com/content/object/eid/1-s2.0-S0360544220315644-si112.svg?httpAccept=%2A%2F%2A",
            "@multimediatype": "Scalable Vector Graphics file",
            "@type": "ALTIMG",
            "@size": "42350",
            "@ref": "si112",
            "@mimetype": "image/svg+xml"
        },
        {
            "@category": "thumbnail",
            "@_fa": "true",
            "$": "https://api.elsevier.com/content/object/eid/1-s2.0-S0360544220315644-si54.svg?httpAccept=%2A%2F%2A",
            "@multimediatype": "Scalable Vector Graphics file",
            "@type": "ALTIMG",
            "@size": "5938",
            "@ref": "si54",
            "@mimetype": "image/svg+xml"
        },
        {
            "@category": "thumbnail",
            "@_fa": "true",
            "$": "https://api.elsevier.com/content/object/eid/1-s2.0-S0360544220315644-si165.svg?httpAccept=%2A%2F%2A",
            "@multimediatype": "Scalable Vector Graphics file",
            "@type": "ALTIMG",
            "@size": "5839",
            "@ref": "si165",
            "@mimetype": "image/svg+xml"
        },
        {
            "@category": "thumbnail",
            "@_fa": "true",
            "$": "https://api.elsevier.com/content/object/eid/1-s2.0-S0360544220315644-si24.svg?httpAccept=%2A%2F%2A",
            "@multimediatype": "Scalable Vector Graphics file",
            "@type": "ALTIMG",
            "@size": "3268",
            "@ref": "si24",
            "@mimetype": "image/svg+xml"
        },
        {
            "@category": "thumbnail",
            "@_fa": "true",
            "$": "https://api.elsevier.com/content/object/eid/1-s2.0-S0360544220315644-si53.svg?httpAccept=%2A%2F%2A",
            "@multimediatype": "Scalable Vector Graphics file",
            "@type": "ALTIMG",
            "@size": "13228",
            "@ref": "si53",
            "@mimetype": "image/svg+xml"
        },
        {
            "@category": "thumbnail",
            "@_fa": "true",
            "$": "https://api.elsevier.com/content/object/eid/1-s2.0-S0360544220315644-si147.svg?httpAccept=%2A%2F%2A",
            "@multimediatype": "Scalable Vector Graphics file",
            "@type": "ALTIMG",
            "@size": "20850",
            "@ref": "si147",
            "@mimetype": "image/svg+xml"
        },
        {
            "@category": "thumbnail",
            "@_fa": "true",
            "$": "https://api.elsevier.com/content/object/eid/1-s2.0-S0360544220315644-si99.svg?httpAccept=%2A%2F%2A",
            "@multimediatype": "Scalable Vector Graphics file",
            "@type": "ALTIMG",
            "@size": "12181",
            "@ref": "si99",
            "@mimetype": "image/svg+xml"
        },
        {
            "@category": "thumbnail",
            "@_fa": "true",
            "$": "https://api.elsevier.com/content/object/eid/1-s2.0-S0360544220315644-si137.svg?httpAccept=%2A%2F%2A",
            "@multimediatype": "Scalable Vector Graphics file",
            "@type": "ALTIMG",
            "@size": "41114",
            "@ref": "si137",
            "@mimetype": "image/svg+xml"
        },
        {
            "@category": "thumbnail",
            "@_fa": "true",
            "$": "https://api.elsevier.com/content/object/eid/1-s2.0-S0360544220315644-si124.svg?httpAccept=%2A%2F%2A",
            "@multimediatype": "Scalable Vector Graphics file",
            "@type": "ALTIMG",
            "@size": "4534",
            "@ref": "si124",
            "@mimetype": "image/svg+xml"
        },
        {
            "@category": "thumbnail",
            "@_fa": "true",
            "$": "https://api.elsevier.com/content/object/eid/1-s2.0-S0360544220315644-si35.svg?httpAccept=%2A%2F%2A",
            "@multimediatype": "Scalable Vector Graphics file",
            "@type": "ALTIMG",
            "@size": "5518",
            "@ref": "si35",
            "@mimetype": "image/svg+xml"
        },
        {
            "@category": "thumbnail",
            "@_fa": "true",
            "$": "https://api.elsevier.com/content/object/eid/1-s2.0-S0360544220315644-si80.svg?httpAccept=%2A%2F%2A",
            "@multimediatype": "Scalable Vector Graphics file",
            "@type": "ALTIMG",
            "@size": "6538",
            "@ref": "si80",
            "@mimetype": "image/svg+xml"
        },
        {
            "@category": "thumbnail",
            "@_fa": "true",
            "$": "https://api.elsevier.com/content/object/eid/1-s2.0-S0360544220315644-si141.svg?httpAccept=%2A%2F%2A",
            "@multimediatype": "Scalable Vector Graphics file",
            "@type": "ALTIMG",
            "@size": "15433",
            "@ref": "si141",
            "@mimetype": "image/svg+xml"
        },
        {
            "@category": "thumbnail",
            "@_fa": "true",
            "$": "https://api.elsevier.com/content/object/eid/1-s2.0-S0360544220315644-si155.svg?httpAccept=%2A%2F%2A",
            "@multimediatype": "Scalable Vector Graphics file",
            "@type": "ALTIMG",
            "@size": "5884",
            "@ref": "si155",
            "@mimetype": "image/svg+xml"
        },
        {
            "@category": "thumbnail",
            "@_fa": "true",
            "$": "https://api.elsevier.com/content/object/eid/1-s2.0-S0360544220315644-si149.svg?httpAccept=%2A%2F%2A",
            "@multimediatype": "Scalable Vector Graphics file",
            "@type": "ALTIMG",
            "@size": "15260",
            "@ref": "si149",
            "@mimetype": "image/svg+xml"
        },
        {
            "@category": "thumbnail",
            "@_fa": "true",
            "$": "https://api.elsevier.com/content/object/eid/1-s2.0-S0360544220315644-si18.svg?httpAccept=%2A%2F%2A",
            "@multimediatype": "Scalable Vector Graphics file",
            "@type": "ALTIMG",
            "@size": "5691",
            "@ref": "si18",
            "@mimetype": "image/svg+xml"
        },
        {
            "@category": "thumbnail",
            "@_fa": "true",
            "$": "https://api.elsevier.com/content/object/eid/1-s2.0-S0360544220315644-si56.svg?httpAccept=%2A%2F%2A",
            "@multimediatype": "Scalable Vector Graphics file",
            "@type": "ALTIMG",
            "@size": "7037",
            "@ref": "si56",
            "@mimetype": "image/svg+xml"
        },
        {
            "@category": "thumbnail",
            "@_fa": "true",
            "$": "https://api.elsevier.com/content/object/eid/1-s2.0-S0360544220315644-si50.svg?httpAccept=%2A%2F%2A",
            "@multimediatype": "Scalable Vector Graphics file",
            "@type": "ALTIMG",
            "@size": "4086",
            "@ref": "si50",
            "@mimetype": "image/svg+xml"
        },
        {
            "@category": "thumbnail",
            "@_fa": "true",
            "$": "https://api.elsevier.com/content/object/eid/1-s2.0-S0360544220315644-si25.svg?httpAccept=%2A%2F%2A",
            "@multimediatype": "Scalable Vector Graphics file",
            "@type": "ALTIMG",
            "@size": "7385",
            "@ref": "si25",
            "@mimetype": "image/svg+xml"
        },
        {
            "@category": "thumbnail",
            "@_fa": "true",
            "$": "https://api.elsevier.com/content/object/eid/1-s2.0-S0360544220315644-si11.svg?httpAccept=%2A%2F%2A",
            "@multimediatype": "Scalable Vector Graphics file",
            "@type": "ALTIMG",
            "@size": "11143",
            "@ref": "si11",
            "@mimetype": "image/svg+xml"
        },
        {
            "@category": "thumbnail",
            "@_fa": "true",
            "$": "https://api.elsevier.com/content/object/eid/1-s2.0-S0360544220315644-si111.svg?httpAccept=%2A%2F%2A",
            "@multimediatype": "Scalable Vector Graphics file",
            "@type": "ALTIMG",
            "@size": "4707",
            "@ref": "si111",
            "@mimetype": "image/svg+xml"
        },
        {
            "@category": "thumbnail",
            "@_fa": "true",
            "$": "https://api.elsevier.com/content/object/eid/1-s2.0-S0360544220315644-si127.svg?httpAccept=%2A%2F%2A",
            "@multimediatype": "Scalable Vector Graphics file",
            "@type": "ALTIMG",
            "@size": "19206",
            "@ref": "si127",
            "@mimetype": "image/svg+xml"
        },
        {
            "@category": "thumbnail",
            "@_fa": "true",
            "$": "https://api.elsevier.com/content/object/eid/1-s2.0-S0360544220315644-si131.svg?httpAccept=%2A%2F%2A",
            "@multimediatype": "Scalable Vector Graphics file",
            "@type": "ALTIMG",
            "@size": "4612",
            "@ref": "si131",
            "@mimetype": "image/svg+xml"
        },
        {
            "@category": "thumbnail",
            "@_fa": "true",
            "$": "https://api.elsevier.com/content/object/eid/1-s2.0-S0360544220315644-si77.svg?httpAccept=%2A%2F%2A",
            "@multimediatype": "Scalable Vector Graphics file",
            "@type": "ALTIMG",
            "@size": "7259",
            "@ref": "si77",
            "@mimetype": "image/svg+xml"
        },
        {
            "@category": "thumbnail",
            "@_fa": "true",
            "$": "https://api.elsevier.com/content/object/eid/1-s2.0-S0360544220315644-si52.svg?httpAccept=%2A%2F%2A",
            "@multimediatype": "Scalable Vector Graphics file",
            "@type": "ALTIMG",
            "@size": "7978",
            "@ref": "si52",
            "@mimetype": "image/svg+xml"
        },
        {
            "@category": "thumbnail",
            "@_fa": "true",
            "$": "https://api.elsevier.com/content/object/eid/1-s2.0-S0360544220315644-si70.svg?httpAccept=%2A%2F%2A",
            "@multimediatype": "Scalable Vector Graphics file",
            "@type": "ALTIMG",
            "@size": "6204",
            "@ref": "si70",
            "@mimetype": "image/svg+xml"
        },
        {
            "@category": "thumbnail",
            "@_fa": "true",
            "$": "https://api.elsevier.com/content/object/eid/1-s2.0-S0360544220315644-si126.svg?httpAccept=%2A%2F%2A",
            "@multimediatype": "Scalable Vector Graphics file",
            "@type": "ALTIMG",
            "@size": "12974",
            "@ref": "si126",
            "@mimetype": "image/svg+xml"
        },
        {
            "@category": "standard",
            "@_fa": "true",
            "$": "https://api.elsevier.com/content/object/eid/1-s2.0-S0360544220315644-am.pdf?httpAccept=%2A%2F%2A",
            "@multimediatype": "Acrobat PDF file",
            "@type": "AAM-PDF",
            "@size": "2217668",
            "@ref": "am",
            "@mimetype": "application/pdf"
        }
    ]},
    "link": {
        "@rel": "abstract",
        "@href": "https://api.elsevier.com/content/abstract/scopus_id/85090222840"
    }
}}