{"full-text-retrieval-response": {
    "scopus-eid": "2-s2.0-85161294567",
    "originalText": "serial JL 271434 291210 291731 291800 291881 31 Building and Environment BUILDINGENVIRONMENT 2023-06-02 2023-06-02 2023-06-07 2023-06-07 2023-08-31T15:00:30 1-s2.0-S0360132323004948 S0360-1323(23)00494-8 S0360132323004948 10.1016/j.buildenv.2023.110467 S300 S300.1 FULL-TEXT 1-s2.0-S0360132323X00134 2023-08-31T14:26:58.821466Z 0 0 20230801 2023 2023-06-03T00:46:18.123023Z articleinfo articlenumber articletitlenorm authfirstinitialnorm authfirstsurnamenorm cid cids contenttype copyright crossmark dateloaded dateloadedtxt datesearch datesort dateupdated dco docsubtype doctype doi eid ewtransactionid hubeid indexeddate issn issnnorm itemstage itemtransactionid itemweight openaccess openarchive pg pgfirst pii piinorm pubdatestart pubdatetxt pubyr sectiontitle sortorder srctitle srctitlenorm srctype ssids alllist content subj subheadings suppl tomb volfirst volissue volumelist webpdf webpdfpagecount yearnav figure table body mmlmath affil appendices articletitle auth authfirstini authfull authkeywords authlast highlightsabst primabst ref 0360-1323 03601323 true 241 241 C Volume 241 12 110467 110467 110467 20230801 1 August 2023 2023-08-01 2023 Research Papers article fla © 2023 Elsevier Ltd. All rights reserved. RESEARCHOPTIMALCONTROLHVACSYSTEMUSINGSWARMINTELLIGENCEALGORITHMS MIAO Y 1 Introduction 1.1 Research background 1.2 Literature reviews 1.2.1 Energy-saving control of HVAC system 1.2.2 Swarm intelligence algorithm 1.3 The overview of this paper 2 Comprehensive performance of the focused swarm intelligence algorithms 2.1 The focused swarm intelligence algorithms 2.2 Test functions 2.3 Performance on test functions 2.3.1 Parameter setting 2.3.2 Convergency analysis 2.3.3 Performance and analysis 3 Case study 3.1 Models and objective function 3.1.1 Model for chiller 3.1.2 Model for cooling/chilled water pump 3.1.3 Model for cooling tower 3.1.4 System model and boundary conditions 3.2 Results and discussions 3.2.1 Performance on target function 3.2.2 Typical day analysis 4 Conclusion CRediT authorship contribution statement Appendix PSO： AFSA ABC WPS GWO CSA WOA SSA2017 SBO SSA2020 References FU 2021 723 733 L YAN 2016 154 168 Z WAHID 2020 4363 F WANG 2021 110929 Z IMRAN 2022 111762 N SOLANO 2021 269 277 J FARAHNAK 2015 203 219 M LI 2022 109322 Z ZHAO 2023 110025 W CHEN 2018 11 Y OPTIMALCONTROLHVACWINDOWSYSTEMSFORNATURALVENTILATIONTHROUGHREINFORCEMENTLEARNING DERAUTLINDELAROY 2023 110019 E POROWSKI 2019 461 496 M XIONG 2020 11 W SU 2021 117383 B SHI 2019 109513 W SONG 2022 119831 M AKGUC 2022 104631 A SCHITO 2020 107018 E DEARAUJOPASSOS 2023 116573 L LU 2021 107491 Q SUN 2021 17 F YE 2016 1 6 Y 2016IEEEINDUSTRYAPPLICATIONSSOCIETYANNUALMEETING AMULTILAYEROPTIMALCHILLEROPERATIONMANAGEMENTFRAMEWORK DEYMIDASHTEBAYAZ 2019 114133 M CONSIDINE 2022 108726 B WANG 2022 117809 W KELVINWIJAYA 2022 101512 T ALAVY 2020 109697 M RAMAN 2022 119752 N WANG 2022 109104 J AFROZ 2022 108681 Z WEERASURIYA 2021 107855 A WANG 2019 54 65 S KUSIAK 2011 5935 5943 A ZHOU 2020 120082 G LI 2022 108533 L YU 2017 2273 2280 M YELISETTI 2022 105062 S DENG 2023 120621 Z ZHANG 2019 101714 T CHEN 2023 110020 A KUMAR 2019 101601 S KENNEDY 1995 1942 1948 J PROCEEDINGSICNN95INTERNATIONALCONFERENCENEURALNETWORKS PARTICLESWARMOPTIMIZATION XIAOLEI 2002 32 38 L AMETHODBASEDANIMALCOMMUNEOPTIMUMMODELARTIFICIALFISHALGORITHM KARABOGA 2005 D IDEABASEDHONEYBEESWARMFORNUMERICALOPTIMIZATIONTECHNICALREPORTTR06 YANG 2007 462 467 C 2007INTERNATIONALCONFERENCEINTELLIGENTPERVASIVECOMPUTING ALGORITHMMARRIAGEINHONEYBEESOPTIMIZATIONBASEDWOLFPACKSEARCH MIRJALILI 2014 46 61 S ASKARZADEH 2016 1 12 A MIRJALILI 2016 51 67 S MIRJALILI 2017 163 191 S SAMAREHMOOSAVI 2017 1 15 S XUE 2020 22 34 J WEI 2015 294 306 X LU 2020 25 52 H SIMIONESCU 2020 365 398 P MIAOX2023X110467 MIAOX2023X110467XY 2025-06-07T00:00:00.000Z 2025-06-07T00:00:00.000Z http://creativecommons.org/licenses/by-nc-nd/4.0/ © 2023 Elsevier Ltd. All rights reserved. https://doi.org/10.15223/policy-017 https://doi.org/10.15223/policy-037 https://doi.org/10.15223/policy-012 https://doi.org/10.15223/policy-029 https://doi.org/10.15223/policy-004 item S0360-1323(23)00494-8 S0360132323004948 1-s2.0-S0360132323004948 10.1016/j.buildenv.2023.110467 271434 2023-08-31T14:26:58.821466Z 2023-08-01 1-s2.0-S0360132323004948-main.pdf https://s3-eu-west-1.amazonaws.com/prod-ucs-content-store-eu-west/content/pii:S0360132323004948/MAIN/application/pdf/cb1ee38d2776f29b791d68e62bf860dc/main.pdf main.pdf pdf true 4219152 MAIN 20 1-s2.0-S0360132323004948-main_1.png https://s3-eu-west-1.amazonaws.com/prod-ucs-content-store-eu-west/content/pii:S0360132323004948/PREVIEW/image/png/58c2432f225206dd735095e3927bd578/main_1.png main_1.png png 57070 849 656 IMAGE-WEB-PDF 1 1-s2.0-S0360132323004948-gr5.jpg https://s3-eu-west-1.amazonaws.com/prod-ucs-content-store-eu-west/content/pii:S0360132323004948/gr5/DOWNSAMPLED/image/jpeg/1eadb5a3b975780fdc2698f9ef135d0b/gr5.jpg gr5 gr5.jpg jpg 93622 152 388 IMAGE-DOWNSAMPLED 1-s2.0-S0360132323004948-gr4.jpg https://s3-eu-west-1.amazonaws.com/prod-ucs-content-store-eu-west/content/pii:S0360132323004948/gr4/DOWNSAMPLED/image/jpeg/88830d21a15db7fe32b390dd05820fd3/gr4.jpg gr4 gr4.jpg jpg 93616 229 386 IMAGE-DOWNSAMPLED 1-s2.0-S0360132323004948-gr7.jpg https://s3-eu-west-1.amazonaws.com/prod-ucs-content-store-eu-west/content/pii:S0360132323004948/gr7/DOWNSAMPLED/image/jpeg/219cb769eb6871cc4afd1631b2e87e8d/gr7.jpg gr7 gr7.jpg jpg 70826 440 533 IMAGE-DOWNSAMPLED 1-s2.0-S0360132323004948-gr6.jpg https://s3-eu-west-1.amazonaws.com/prod-ucs-content-store-eu-west/content/pii:S0360132323004948/gr6/DOWNSAMPLED/image/jpeg/1bf8fd8bccd735c55d35a0cab28be292/gr6.jpg gr6 gr6.jpg jpg 113968 187 689 IMAGE-DOWNSAMPLED 1-s2.0-S0360132323004948-gr1.jpg https://s3-eu-west-1.amazonaws.com/prod-ucs-content-store-eu-west/content/pii:S0360132323004948/gr1/DOWNSAMPLED/image/jpeg/1de443c50cbcf4358047b4c0f4554161/gr1.jpg gr1 gr1.jpg jpg 102511 220 535 IMAGE-DOWNSAMPLED 1-s2.0-S0360132323004948-gr10.jpg https://s3-eu-west-1.amazonaws.com/prod-ucs-content-store-eu-west/content/pii:S0360132323004948/gr10/DOWNSAMPLED/image/jpeg/eb5d06df00535d81210200f15175cbd0/gr10.jpg gr10 gr10.jpg jpg 138932 423 689 IMAGE-DOWNSAMPLED 1-s2.0-S0360132323004948-gr3.jpg https://s3-eu-west-1.amazonaws.com/prod-ucs-content-store-eu-west/content/pii:S0360132323004948/gr3/DOWNSAMPLED/image/jpeg/cbf33f4bfe9b50aa18825cf302246beb/gr3.jpg gr3 gr3.jpg jpg 259232 1021 554 IMAGE-DOWNSAMPLED 1-s2.0-S0360132323004948-gr2.jpg https://s3-eu-west-1.amazonaws.com/prod-ucs-content-store-eu-west/content/pii:S0360132323004948/gr2/DOWNSAMPLED/image/jpeg/34a5f70e112ef26c89bf20fcc8074bc4/gr2.jpg gr2 gr2.jpg jpg 33642 461 386 IMAGE-DOWNSAMPLED 1-s2.0-S0360132323004948-gr13.jpg https://s3-eu-west-1.amazonaws.com/prod-ucs-content-store-eu-west/content/pii:S0360132323004948/gr13/DOWNSAMPLED/image/jpeg/73d293ec11fb0b7d512354681ad7fff9/gr13.jpg gr13 gr13.jpg jpg 124223 353 533 IMAGE-DOWNSAMPLED 1-s2.0-S0360132323004948-gr12.jpg https://s3-eu-west-1.amazonaws.com/prod-ucs-content-store-eu-west/content/pii:S0360132323004948/gr12/DOWNSAMPLED/image/jpeg/5c8caf3136999a1e5231c2f860bfbab7/gr12.jpg gr12 gr12.jpg jpg 137697 327 533 IMAGE-DOWNSAMPLED 1-s2.0-S0360132323004948-gr11.jpg https://s3-eu-west-1.amazonaws.com/prod-ucs-content-store-eu-west/content/pii:S0360132323004948/gr11/DOWNSAMPLED/image/jpeg/55ed65c04c5a7937ac6e35305775f6b1/gr11.jpg gr11 gr11.jpg jpg 115429 358 533 IMAGE-DOWNSAMPLED 1-s2.0-S0360132323004948-gr9.jpg https://s3-eu-west-1.amazonaws.com/prod-ucs-content-store-eu-west/content/pii:S0360132323004948/gr9/DOWNSAMPLED/image/jpeg/289c340952312569f633fbb0f9f82bc7/gr9.jpg gr9 gr9.jpg jpg 108252 191 689 IMAGE-DOWNSAMPLED 1-s2.0-S0360132323004948-gr8.jpg https://s3-eu-west-1.amazonaws.com/prod-ucs-content-store-eu-west/content/pii:S0360132323004948/gr8/DOWNSAMPLED/image/jpeg/24f41afdcf97b091f6c1c4341d1e8fff/gr8.jpg gr8 gr8.jpg jpg 62158 435 533 IMAGE-DOWNSAMPLED 1-s2.0-S0360132323004948-gr5.sml https://s3-eu-west-1.amazonaws.com/prod-ucs-content-store-eu-west/content/pii:S0360132323004948/gr5/THUMBNAIL/image/gif/935b91f777addd05f1070436bd960a16/gr5.sml gr5 gr5.sml sml 73411 86 219 IMAGE-THUMBNAIL 1-s2.0-S0360132323004948-gr4.sml https://s3-eu-west-1.amazonaws.com/prod-ucs-content-store-eu-west/content/pii:S0360132323004948/gr4/THUMBNAIL/image/gif/b662a47c6d935b83a6404431ae01216e/gr4.sml gr4 gr4.sml sml 71842 130 219 IMAGE-THUMBNAIL 1-s2.0-S0360132323004948-gr7.sml https://s3-eu-west-1.amazonaws.com/prod-ucs-content-store-eu-west/content/pii:S0360132323004948/gr7/THUMBNAIL/image/gif/4a3e20d2266aaf139a0217b02d9da86b/gr7.sml gr7 gr7.sml sml 17652 164 199 IMAGE-THUMBNAIL 1-s2.0-S0360132323004948-gr6.sml https://s3-eu-west-1.amazonaws.com/prod-ucs-content-store-eu-west/content/pii:S0360132323004948/gr6/THUMBNAIL/image/gif/f04fb45436c47fce4ef4c5700e7d0e55/gr6.sml gr6 gr6.sml sml 71001 60 219 IMAGE-THUMBNAIL 1-s2.0-S0360132323004948-gr1.sml https://s3-eu-west-1.amazonaws.com/prod-ucs-content-store-eu-west/content/pii:S0360132323004948/gr1/THUMBNAIL/image/gif/de365c3ff94390ff29af1503efb55419/gr1.sml gr1 gr1.sml sml 70416 90 219 IMAGE-THUMBNAIL 1-s2.0-S0360132323004948-gr10.sml https://s3-eu-west-1.amazonaws.com/prod-ucs-content-store-eu-west/content/pii:S0360132323004948/gr10/THUMBNAIL/image/gif/fd69bce3e7bd907ebf2e4a8c49e8e835/gr10.sml gr10 gr10.sml sml 73464 134 219 IMAGE-THUMBNAIL 1-s2.0-S0360132323004948-gr3.sml https://s3-eu-west-1.amazonaws.com/prod-ucs-content-store-eu-west/content/pii:S0360132323004948/gr3/THUMBNAIL/image/gif/91bb25e511830b10b81e04c60e065848/gr3.sml gr3 gr3.sml sml 76054 164 89 IMAGE-THUMBNAIL 1-s2.0-S0360132323004948-gr2.sml https://s3-eu-west-1.amazonaws.com/prod-ucs-content-store-eu-west/content/pii:S0360132323004948/gr2/THUMBNAIL/image/gif/2bbfec70f7142def6e284938f4235d30/gr2.sml gr2 gr2.sml sml 10399 164 137 IMAGE-THUMBNAIL 1-s2.0-S0360132323004948-gr13.sml https://s3-eu-west-1.amazonaws.com/prod-ucs-content-store-eu-west/content/pii:S0360132323004948/gr13/THUMBNAIL/image/gif/5ee272557188753fa42f64005ebfb666/gr13.sml gr13 gr13.sml sml 74930 145 219 IMAGE-THUMBNAIL 1-s2.0-S0360132323004948-gr12.sml https://s3-eu-west-1.amazonaws.com/prod-ucs-content-store-eu-west/content/pii:S0360132323004948/gr12/THUMBNAIL/image/gif/aafa7b9b51d8b08d25007a3e221e3e8e/gr12.sml gr12 gr12.sml sml 79341 134 219 IMAGE-THUMBNAIL 1-s2.0-S0360132323004948-gr11.sml https://s3-eu-west-1.amazonaws.com/prod-ucs-content-store-eu-west/content/pii:S0360132323004948/gr11/THUMBNAIL/image/gif/741f5067ac52ec18b4a7e939cebe7d3a/gr11.sml gr11 gr11.sml sml 73696 147 219 IMAGE-THUMBNAIL 1-s2.0-S0360132323004948-gr9.sml https://s3-eu-west-1.amazonaws.com/prod-ucs-content-store-eu-west/content/pii:S0360132323004948/gr9/THUMBNAIL/image/gif/e3e6e434db5f8de635148519bd605f71/gr9.sml gr9 gr9.sml sml 69531 61 219 IMAGE-THUMBNAIL 1-s2.0-S0360132323004948-gr8.sml https://s3-eu-west-1.amazonaws.com/prod-ucs-content-store-eu-west/content/pii:S0360132323004948/gr8/THUMBNAIL/image/gif/c4401d7326a855d2a4934697c7770457/gr8.sml gr8 gr8.sml sml 16207 164 201 IMAGE-THUMBNAIL 1-s2.0-S0360132323004948-gr5_lrg.jpg https://s3-eu-west-1.amazonaws.com/prod-ucs-content-store-eu-west/content/pii:S0360132323004948/HIGHRES/image/jpeg/3cc7654234f233a219f5b8f034ce75ae/gr5_lrg.jpg gr5 gr5_lrg.jpg jpg 220093 675 1721 IMAGE-HIGH-RES 1-s2.0-S0360132323004948-gr4_lrg.jpg https://s3-eu-west-1.amazonaws.com/prod-ucs-content-store-eu-west/content/pii:S0360132323004948/HIGHRES/image/jpeg/91dea6365a24a146f6a5556639ea6fe7/gr4_lrg.jpg gr4 gr4_lrg.jpg jpg 224317 1014 1712 IMAGE-HIGH-RES 1-s2.0-S0360132323004948-gr7_lrg.jpg https://s3-eu-west-1.amazonaws.com/prod-ucs-content-store-eu-west/content/pii:S0360132323004948/HIGHRES/image/jpeg/e4d18db280f53feaa8229e2d11efa246/gr7_lrg.jpg gr7 gr7_lrg.jpg jpg 425453 1949 2362 IMAGE-HIGH-RES 1-s2.0-S0360132323004948-gr6_lrg.jpg https://s3-eu-west-1.amazonaws.com/prod-ucs-content-store-eu-west/content/pii:S0360132323004948/HIGHRES/image/jpeg/3b7fe398b18256825c23947400027525/gr6_lrg.jpg gr6 gr6_lrg.jpg jpg 427936 830 3050 IMAGE-HIGH-RES 1-s2.0-S0360132323004948-gr1_lrg.jpg https://s3-eu-west-1.amazonaws.com/prod-ucs-content-store-eu-west/content/pii:S0360132323004948/HIGHRES/image/jpeg/501ee6ee907e9dca3c6d7f423ac2c2b7/gr1_lrg.jpg gr1 gr1_lrg.jpg jpg 326616 975 2370 IMAGE-HIGH-RES 1-s2.0-S0360132323004948-gr10_lrg.jpg https://s3-eu-west-1.amazonaws.com/prod-ucs-content-store-eu-west/content/pii:S0360132323004948/HIGHRES/image/jpeg/6e017a48f751bd76867c55e7367da199/gr10_lrg.jpg gr10 gr10_lrg.jpg jpg 607975 1872 3050 IMAGE-HIGH-RES 1-s2.0-S0360132323004948-gr3_lrg.jpg https://s3-eu-west-1.amazonaws.com/prod-ucs-content-store-eu-west/content/pii:S0360132323004948/HIGHRES/image/jpeg/22da646546146e03d876a10aa1771ac9/gr3_lrg.jpg gr3 gr3_lrg.jpg jpg 1634890 4520 2452 IMAGE-HIGH-RES 1-s2.0-S0360132323004948-gr2_lrg.jpg https://s3-eu-west-1.amazonaws.com/prod-ucs-content-store-eu-west/content/pii:S0360132323004948/HIGHRES/image/jpeg/61c96d3db09faa4f86da344bc40b436f/gr2_lrg.jpg gr2 gr2_lrg.jpg jpg 185958 2046 1712 IMAGE-HIGH-RES 1-s2.0-S0360132323004948-gr13_lrg.jpg https://s3-eu-west-1.amazonaws.com/prod-ucs-content-store-eu-west/content/pii:S0360132323004948/HIGHRES/image/jpeg/a7005b9259f63cbadf4b060368142666/gr13_lrg.jpg gr13 gr13_lrg.jpg jpg 426979 1566 2362 IMAGE-HIGH-RES 1-s2.0-S0360132323004948-gr12_lrg.jpg https://s3-eu-west-1.amazonaws.com/prod-ucs-content-store-eu-west/content/pii:S0360132323004948/HIGHRES/image/jpeg/d73cf70ee20ffc648043e1f25db5136b/gr12_lrg.jpg gr12 gr12_lrg.jpg jpg 533816 1449 2362 IMAGE-HIGH-RES 1-s2.0-S0360132323004948-gr11_lrg.jpg https://s3-eu-west-1.amazonaws.com/prod-ucs-content-store-eu-west/content/pii:S0360132323004948/HIGHRES/image/jpeg/3a1a5b0cc344561f1cd76f2116f973d6/gr11_lrg.jpg gr11 gr11_lrg.jpg jpg 380696 1587 2362 IMAGE-HIGH-RES 1-s2.0-S0360132323004948-gr9_lrg.jpg https://s3-eu-west-1.amazonaws.com/prod-ucs-content-store-eu-west/content/pii:S0360132323004948/HIGHRES/image/jpeg/3374342114cf028e330883ebd1c5e31e/gr9_lrg.jpg gr9 gr9_lrg.jpg jpg 380494 845 3050 IMAGE-HIGH-RES 1-s2.0-S0360132323004948-gr8_lrg.jpg https://s3-eu-west-1.amazonaws.com/prod-ucs-content-store-eu-west/content/pii:S0360132323004948/HIGHRES/image/jpeg/efcf67a831f69187922c62ce214ba405/gr8_lrg.jpg gr8 gr8_lrg.jpg jpg 363759 1927 2362 IMAGE-HIGH-RES 1-s2.0-S0360132323004948-si134.svg https://s3-eu-west-1.amazonaws.com/prod-ucs-content-store-eu-west/content/pii:S0360132323004948/image/svg+xml/1eae40cd3a7f57999fdf249de39ce372/si134.svg si134 si134.svg svg 69539 ALTIMG 1-s2.0-S0360132323004948-si191.svg https://s3-eu-west-1.amazonaws.com/prod-ucs-content-store-eu-west/content/pii:S0360132323004948/image/svg+xml/1e6883f8b73497c626afa14f3cf09ff7/si191.svg si191 si191.svg svg 187529 ALTIMG 1-s2.0-S0360132323004948-si40.svg https://s3-eu-west-1.amazonaws.com/prod-ucs-content-store-eu-west/content/pii:S0360132323004948/image/svg+xml/b03fdba499a0b861970fc0228aeda41f/si40.svg si40 si40.svg svg 54592 ALTIMG 1-s2.0-S0360132323004948-si26.svg https://s3-eu-west-1.amazonaws.com/prod-ucs-content-store-eu-west/content/pii:S0360132323004948/image/svg+xml/59a4ff9dff5a78ca5634d58e36564142/si26.svg si26 si26.svg svg 87538 ALTIMG 1-s2.0-S0360132323004948-si54.svg https://s3-eu-west-1.amazonaws.com/prod-ucs-content-store-eu-west/content/pii:S0360132323004948/image/svg+xml/afe2716c7f18f366a2d20b85be1cbc11/si54.svg si54 si54.svg svg 11050 ALTIMG 1-s2.0-S0360132323004948-si102.svg https://s3-eu-west-1.amazonaws.com/prod-ucs-content-store-eu-west/content/pii:S0360132323004948/image/svg+xml/ff7378eaa40168144f9887c575434949/si102.svg si102 si102.svg svg 8843 ALTIMG 1-s2.0-S0360132323004948-si192.svg https://s3-eu-west-1.amazonaws.com/prod-ucs-content-store-eu-west/content/pii:S0360132323004948/image/svg+xml/13710f1db3fdf6102e369b5d87b5e672/si192.svg si192 si192.svg svg 26702 ALTIMG 1-s2.0-S0360132323004948-si11.svg https://s3-eu-west-1.amazonaws.com/prod-ucs-content-store-eu-west/content/pii:S0360132323004948/image/svg+xml/ad925c81ad580831ad2563b7bf8d3ed3/si11.svg si11 si11.svg svg 66250 ALTIMG 1-s2.0-S0360132323004948-si85.svg https://s3-eu-west-1.amazonaws.com/prod-ucs-content-store-eu-west/content/pii:S0360132323004948/image/svg+xml/c5bd5b97e40bafb453e69ba437b61bea/si85.svg si85 si85.svg svg 18560 ALTIMG 1-s2.0-S0360132323004948-si88.svg https://s3-eu-west-1.amazonaws.com/prod-ucs-content-store-eu-west/content/pii:S0360132323004948/image/svg+xml/4f391efaa11256a74abdaf3465bf06c0/si88.svg si88 si88.svg svg 16385 ALTIMG 1-s2.0-S0360132323004948-si99.svg https://s3-eu-west-1.amazonaws.com/prod-ucs-content-store-eu-west/content/pii:S0360132323004948/image/svg+xml/a3220aab3c2ca6f90881b5756dc607ba/si99.svg si99 si99.svg svg 27700 ALTIMG 1-s2.0-S0360132323004948-si42.svg https://s3-eu-west-1.amazonaws.com/prod-ucs-content-store-eu-west/content/pii:S0360132323004948/image/svg+xml/45fd5aef1970a03e08306b1529b7a182/si42.svg si42 si42.svg svg 15643 ALTIMG 1-s2.0-S0360132323004948-si113.svg https://s3-eu-west-1.amazonaws.com/prod-ucs-content-store-eu-west/content/pii:S0360132323004948/image/svg+xml/c74d366d4101fcb6c0370b0bb548447d/si113.svg si113 si113.svg svg 126921 ALTIMG 1-s2.0-S0360132323004948-si94.svg https://s3-eu-west-1.amazonaws.com/prod-ucs-content-store-eu-west/content/pii:S0360132323004948/image/svg+xml/84f13e1c0c4e16f0216d6c422563e280/si94.svg si94 si94.svg svg 27058 ALTIMG 1-s2.0-S0360132323004948-si115.svg https://s3-eu-west-1.amazonaws.com/prod-ucs-content-store-eu-west/content/pii:S0360132323004948/image/svg+xml/11760630f2414c455692a6969f3df8b0/si115.svg si115 si115.svg svg 12687 ALTIMG 1-s2.0-S0360132323004948-si100.svg https://s3-eu-west-1.amazonaws.com/prod-ucs-content-store-eu-west/content/pii:S0360132323004948/image/svg+xml/54f1a0277d8dfd28f11a2041ea915984/si100.svg si100 si100.svg svg 102891 ALTIMG 1-s2.0-S0360132323004948-si34.svg https://s3-eu-west-1.amazonaws.com/prod-ucs-content-store-eu-west/content/pii:S0360132323004948/image/svg+xml/792c2ed52439a15e8beb8d48ce9a4a83/si34.svg si34 si34.svg svg 18602 ALTIMG 1-s2.0-S0360132323004948-si172.svg https://s3-eu-west-1.amazonaws.com/prod-ucs-content-store-eu-west/content/pii:S0360132323004948/image/svg+xml/cbf566687ba16ed64f97c6f6f7b140b4/si172.svg si172 si172.svg svg 35355 ALTIMG 1-s2.0-S0360132323004948-si142.svg https://s3-eu-west-1.amazonaws.com/prod-ucs-content-store-eu-west/content/pii:S0360132323004948/image/svg+xml/465f6b986d792e02a9c1194638e214b5/si142.svg si142 si142.svg svg 7085 ALTIMG 1-s2.0-S0360132323004948-si182.svg https://s3-eu-west-1.amazonaws.com/prod-ucs-content-store-eu-west/content/pii:S0360132323004948/image/svg+xml/a92e6c827c6c2df3e8ca2f284da0fb63/si182.svg si182 si182.svg svg 13925 ALTIMG 1-s2.0-S0360132323004948-si105.svg https://s3-eu-west-1.amazonaws.com/prod-ucs-content-store-eu-west/content/pii:S0360132323004948/image/svg+xml/27dc8e854269e7bfec39f755e5fa2ffa/si105.svg si105 si105.svg svg 6633 ALTIMG 1-s2.0-S0360132323004948-si61.svg https://s3-eu-west-1.amazonaws.com/prod-ucs-content-store-eu-west/content/pii:S0360132323004948/image/svg+xml/1f6b3168ecaad4c998b1c052255907a4/si61.svg si61 si61.svg svg 15030 ALTIMG 1-s2.0-S0360132323004948-si139.svg https://s3-eu-west-1.amazonaws.com/prod-ucs-content-store-eu-west/content/pii:S0360132323004948/image/svg+xml/d1bd8cdf22702d574ac3204a5fe453c0/si139.svg si139 si139.svg svg 24123 ALTIMG 1-s2.0-S0360132323004948-si124.svg https://s3-eu-west-1.amazonaws.com/prod-ucs-content-store-eu-west/content/pii:S0360132323004948/image/svg+xml/dd6bde3e79c59ea5d1f0a76638f33ece/si124.svg si124 si124.svg svg 10307 ALTIMG 1-s2.0-S0360132323004948-si63.svg https://s3-eu-west-1.amazonaws.com/prod-ucs-content-store-eu-west/content/pii:S0360132323004948/image/svg+xml/a2165b27c149597e785571ebfb01becd/si63.svg si63 si63.svg svg 10614 ALTIMG 1-s2.0-S0360132323004948-si104.svg https://s3-eu-west-1.amazonaws.com/prod-ucs-content-store-eu-west/content/pii:S0360132323004948/image/svg+xml/dd3c95e0daa6301ee06591365b2b9cb2/si104.svg si104 si104.svg svg 8264 ALTIMG 1-s2.0-S0360132323004948-si55.svg https://s3-eu-west-1.amazonaws.com/prod-ucs-content-store-eu-west/content/pii:S0360132323004948/image/svg+xml/01f83c6f69415ffdcad744e53ef92c5c/si55.svg si55 si55.svg svg 82117 ALTIMG 1-s2.0-S0360132323004948-si32.svg https://s3-eu-west-1.amazonaws.com/prod-ucs-content-store-eu-west/content/pii:S0360132323004948/image/svg+xml/7d95e63adea915ca244c513aaac61025/si32.svg si32 si32.svg svg 18428 ALTIMG 1-s2.0-S0360132323004948-si37.svg https://s3-eu-west-1.amazonaws.com/prod-ucs-content-store-eu-west/content/pii:S0360132323004948/image/svg+xml/101019f9d10254e32a3d9a61dc154aa4/si37.svg si37 si37.svg svg 14989 ALTIMG 1-s2.0-S0360132323004948-si73.svg https://s3-eu-west-1.amazonaws.com/prod-ucs-content-store-eu-west/content/pii:S0360132323004948/image/svg+xml/d90edb7c9ddb2b73a4107e594950da23/si73.svg si73 si73.svg svg 62064 ALTIMG 1-s2.0-S0360132323004948-si180.svg https://s3-eu-west-1.amazonaws.com/prod-ucs-content-store-eu-west/content/pii:S0360132323004948/image/svg+xml/ebc4d15ade9bfdaa9dcc50dda444483d/si180.svg si180 si180.svg svg 4704 ALTIMG 1-s2.0-S0360132323004948-si190.svg https://s3-eu-west-1.amazonaws.com/prod-ucs-content-store-eu-west/content/pii:S0360132323004948/image/svg+xml/923a58ca32885761ec82882302545e2e/si190.svg si190 si190.svg svg 23430 ALTIMG 1-s2.0-S0360132323004948-si198.svg https://s3-eu-west-1.amazonaws.com/prod-ucs-content-store-eu-west/content/pii:S0360132323004948/image/svg+xml/56cf434305883cdfe01fa19eda817105/si198.svg si198 si198.svg svg 152819 ALTIMG 1-s2.0-S0360132323004948-si140.svg https://s3-eu-west-1.amazonaws.com/prod-ucs-content-store-eu-west/content/pii:S0360132323004948/image/svg+xml/bf348762f742232cc784657245e51c3b/si140.svg si140 si140.svg svg 58320 ALTIMG 1-s2.0-S0360132323004948-si107.svg https://s3-eu-west-1.amazonaws.com/prod-ucs-content-store-eu-west/content/pii:S0360132323004948/image/svg+xml/ffa7d82032377b6a99e31b9f8cfe9840/si107.svg si107 si107.svg svg 91247 ALTIMG 1-s2.0-S0360132323004948-si156.svg https://s3-eu-west-1.amazonaws.com/prod-ucs-content-store-eu-west/content/pii:S0360132323004948/image/svg+xml/5e6125ec5d02ed5cb810a22d7908d873/si156.svg si156 si156.svg svg 129015 ALTIMG 1-s2.0-S0360132323004948-si183.svg https://s3-eu-west-1.amazonaws.com/prod-ucs-content-store-eu-west/content/pii:S0360132323004948/image/svg+xml/cd15db81f30ffd1e9c8b904f3a2e3d3b/si183.svg si183 si183.svg svg 33898 ALTIMG 1-s2.0-S0360132323004948-si44.svg https://s3-eu-west-1.amazonaws.com/prod-ucs-content-store-eu-west/content/pii:S0360132323004948/image/svg+xml/9f0c759f6a19144225e387885da81a83/si44.svg si44 si44.svg svg 55353 ALTIMG 1-s2.0-S0360132323004948-si146.svg https://s3-eu-west-1.amazonaws.com/prod-ucs-content-store-eu-west/content/pii:S0360132323004948/image/svg+xml/a4e7d7ea96e1986d7e3db1d2808f41d3/si146.svg si146 si146.svg svg 53019 ALTIMG 1-s2.0-S0360132323004948-si138.svg https://s3-eu-west-1.amazonaws.com/prod-ucs-content-store-eu-west/content/pii:S0360132323004948/image/svg+xml/79967c271b1188cde85529c8fecaebc0/si138.svg si138 si138.svg svg 18884 ALTIMG 1-s2.0-S0360132323004948-si56.svg https://s3-eu-west-1.amazonaws.com/prod-ucs-content-store-eu-west/content/pii:S0360132323004948/image/svg+xml/b977e2e3c23981ffb6594def73ab92b1/si56.svg si56 si56.svg svg 18299 ALTIMG 1-s2.0-S0360132323004948-si20.svg https://s3-eu-west-1.amazonaws.com/prod-ucs-content-store-eu-west/content/pii:S0360132323004948/image/svg+xml/ce05ca084c243df7c445c396558ee7c3/si20.svg si20 si20.svg svg 4350 ALTIMG 1-s2.0-S0360132323004948-si193.svg https://s3-eu-west-1.amazonaws.com/prod-ucs-content-store-eu-west/content/pii:S0360132323004948/image/svg+xml/c859901d7090ca4baa166e7593747631/si193.svg si193 si193.svg svg 5422 ALTIMG 1-s2.0-S0360132323004948-si9.svg https://s3-eu-west-1.amazonaws.com/prod-ucs-content-store-eu-west/content/pii:S0360132323004948/image/svg+xml/c0c9df94116b508cf8211f7115064d30/si9.svg si9 si9.svg svg 79616 ALTIMG 1-s2.0-S0360132323004948-si110.svg https://s3-eu-west-1.amazonaws.com/prod-ucs-content-store-eu-west/content/pii:S0360132323004948/image/svg+xml/e9664254eb9e17bde9cae6b0646f5a30/si110.svg si110 si110.svg svg 20785 ALTIMG 1-s2.0-S0360132323004948-si177.svg https://s3-eu-west-1.amazonaws.com/prod-ucs-content-store-eu-west/content/pii:S0360132323004948/image/svg+xml/b65fed9e652a78738d3ed06f9b655bc6/si177.svg si177 si177.svg svg 5559 ALTIMG 1-s2.0-S0360132323004948-si106.svg https://s3-eu-west-1.amazonaws.com/prod-ucs-content-store-eu-west/content/pii:S0360132323004948/image/svg+xml/8d8a2df156a39e4d8e1132cdeda20da6/si106.svg si106 si106.svg svg 8675 ALTIMG 1-s2.0-S0360132323004948-si114.svg https://s3-eu-west-1.amazonaws.com/prod-ucs-content-store-eu-west/content/pii:S0360132323004948/image/svg+xml/98e95c8b2888d9b5a3b3efc0bf723888/si114.svg si114 si114.svg svg 10254 ALTIMG 1-s2.0-S0360132323004948-si101.svg https://s3-eu-west-1.amazonaws.com/prod-ucs-content-store-eu-west/content/pii:S0360132323004948/image/svg+xml/0a122b11ba7a4b583392d78929a41f77/si101.svg si101 si101.svg svg 88117 ALTIMG 1-s2.0-S0360132323004948-si178.svg https://s3-eu-west-1.amazonaws.com/prod-ucs-content-store-eu-west/content/pii:S0360132323004948/image/svg+xml/454091c0f5780ec44ababb8637e993a0/si178.svg si178 si178.svg svg 42049 ALTIMG 1-s2.0-S0360132323004948-si186.svg https://s3-eu-west-1.amazonaws.com/prod-ucs-content-store-eu-west/content/pii:S0360132323004948/image/svg+xml/673986ea3311a9aee5c17e989d9703ba/si186.svg si186 si186.svg svg 29272 ALTIMG 1-s2.0-S0360132323004948-si67.svg https://s3-eu-west-1.amazonaws.com/prod-ucs-content-store-eu-west/content/pii:S0360132323004948/image/svg+xml/3db6a8d8e84d327131c7365696b98607/si67.svg si67 si67.svg svg 30216 ALTIMG 1-s2.0-S0360132323004948-si1.svg https://s3-eu-west-1.amazonaws.com/prod-ucs-content-store-eu-west/content/pii:S0360132323004948/image/svg+xml/e15c82694afb10416a00119da16818ae/si1.svg si1 si1.svg svg 37710 ALTIMG 1-s2.0-S0360132323004948-si97.svg https://s3-eu-west-1.amazonaws.com/prod-ucs-content-store-eu-west/content/pii:S0360132323004948/image/svg+xml/380da603587e731817f5bbcaecc5c3b2/si97.svg si97 si97.svg svg 14573 ALTIMG 1-s2.0-S0360132323004948-si15.svg https://s3-eu-west-1.amazonaws.com/prod-ucs-content-store-eu-west/content/pii:S0360132323004948/image/svg+xml/39ef197d310edf34ae5fec1b7a30f4fb/si15.svg si15 si15.svg svg 78600 ALTIMG 1-s2.0-S0360132323004948-si160.svg https://s3-eu-west-1.amazonaws.com/prod-ucs-content-store-eu-west/content/pii:S0360132323004948/image/svg+xml/3b5abafcf91a1b2871b6244274f8bdc7/si160.svg si160 si160.svg svg 24881 ALTIMG 1-s2.0-S0360132323004948-si8.svg https://s3-eu-west-1.amazonaws.com/prod-ucs-content-store-eu-west/content/pii:S0360132323004948/image/svg+xml/4e050711a86718f31d4cbab98202bdb6/si8.svg si8 si8.svg svg 15492 ALTIMG 1-s2.0-S0360132323004948-si118.svg https://s3-eu-west-1.amazonaws.com/prod-ucs-content-store-eu-west/content/pii:S0360132323004948/image/svg+xml/b84a7b8565b7115a530c0430fc18fd98/si118.svg si118 si118.svg svg 30433 ALTIMG 1-s2.0-S0360132323004948-si45.svg https://s3-eu-west-1.amazonaws.com/prod-ucs-content-store-eu-west/content/pii:S0360132323004948/image/svg+xml/7587051084151f8ab110db5a3ca41cdd/si45.svg si45 si45.svg svg 24849 ALTIMG 1-s2.0-S0360132323004948-si131.svg https://s3-eu-west-1.amazonaws.com/prod-ucs-content-store-eu-west/content/pii:S0360132323004948/image/svg+xml/b00022ae1b2c5c53795e3fd77855b480/si131.svg si131 si131.svg svg 13627 ALTIMG 1-s2.0-S0360132323004948-si122.svg https://s3-eu-west-1.amazonaws.com/prod-ucs-content-store-eu-west/content/pii:S0360132323004948/image/svg+xml/3cdcb4bc09117b7bc1e76a0eb05f2d7f/si122.svg si122 si122.svg svg 13459 ALTIMG 1-s2.0-S0360132323004948-si64.svg https://s3-eu-west-1.amazonaws.com/prod-ucs-content-store-eu-west/content/pii:S0360132323004948/image/svg+xml/c85aa7ebd01665c0ecfb5e3b296b1dac/si64.svg si64 si64.svg svg 7433 ALTIMG 1-s2.0-S0360132323004948-si187.svg https://s3-eu-west-1.amazonaws.com/prod-ucs-content-store-eu-west/content/pii:S0360132323004948/image/svg+xml/621178a558255f1881363bbe8e0d816d/si187.svg si187 si187.svg svg 136360 ALTIMG 1-s2.0-S0360132323004948-si89.svg https://s3-eu-west-1.amazonaws.com/prod-ucs-content-store-eu-west/content/pii:S0360132323004948/image/svg+xml/d6500c7d034eb1e568b5079b1d06d390/si89.svg si89 si89.svg svg 18018 ALTIMG 1-s2.0-S0360132323004948-si81.svg https://s3-eu-west-1.amazonaws.com/prod-ucs-content-store-eu-west/content/pii:S0360132323004948/image/svg+xml/b9ca24ec5f5cdc7d37cf0ef9e2f163b5/si81.svg si81 si81.svg svg 71295 ALTIMG 1-s2.0-S0360132323004948-si129.svg https://s3-eu-west-1.amazonaws.com/prod-ucs-content-store-eu-west/content/pii:S0360132323004948/image/svg+xml/575c9eb61c16ade20b2ddd333562ac1c/si129.svg si129 si129.svg svg 13267 ALTIMG 1-s2.0-S0360132323004948-si152.svg https://s3-eu-west-1.amazonaws.com/prod-ucs-content-store-eu-west/content/pii:S0360132323004948/image/svg+xml/632867ef88ab7f5f228dd1efb6d53532/si152.svg si152 si152.svg svg 50110 ALTIMG 1-s2.0-S0360132323004948-si3.svg https://s3-eu-west-1.amazonaws.com/prod-ucs-content-store-eu-west/content/pii:S0360132323004948/image/svg+xml/a4947be3a8448bbea09a87a19bc531ff/si3.svg si3 si3.svg svg 34610 ALTIMG 1-s2.0-S0360132323004948-si173.svg https://s3-eu-west-1.amazonaws.com/prod-ucs-content-store-eu-west/content/pii:S0360132323004948/image/svg+xml/738ede70caff21efd7f0bb943953bb93/si173.svg si173 si173.svg svg 10678 ALTIMG 1-s2.0-S0360132323004948-si196.svg https://s3-eu-west-1.amazonaws.com/prod-ucs-content-store-eu-west/content/pii:S0360132323004948/image/svg+xml/e22cc13f790dc478d0cce2d54243a327/si196.svg si196 si196.svg svg 10364 ALTIMG 1-s2.0-S0360132323004948-si120.svg https://s3-eu-west-1.amazonaws.com/prod-ucs-content-store-eu-west/content/pii:S0360132323004948/image/svg+xml/4cb0eaa80fe647cbc63d2a56239c58d2/si120.svg si120 si120.svg svg 165739 ALTIMG 1-s2.0-S0360132323004948-si123.svg https://s3-eu-west-1.amazonaws.com/prod-ucs-content-store-eu-west/content/pii:S0360132323004948/image/svg+xml/15eff3c34e85294d1dfecdc777f77e89/si123.svg si123 si123.svg svg 8408 ALTIMG 1-s2.0-S0360132323004948-si79.svg https://s3-eu-west-1.amazonaws.com/prod-ucs-content-store-eu-west/content/pii:S0360132323004948/image/svg+xml/b23e2bbafce6e47bbe5a272fdb6594ae/si79.svg si79 si79.svg svg 30199 ALTIMG 1-s2.0-S0360132323004948-si28.svg https://s3-eu-west-1.amazonaws.com/prod-ucs-content-store-eu-west/content/pii:S0360132323004948/image/svg+xml/46a4a6a99957ad9b4e6ef26c9bc49a40/si28.svg si28 si28.svg svg 51572 ALTIMG 1-s2.0-S0360132323004948-si103.svg https://s3-eu-west-1.amazonaws.com/prod-ucs-content-store-eu-west/content/pii:S0360132323004948/image/svg+xml/30f22041cd9fd96a47734844be385fa4/si103.svg si103 si103.svg svg 6222 ALTIMG 1-s2.0-S0360132323004948-si96.svg https://s3-eu-west-1.amazonaws.com/prod-ucs-content-store-eu-west/content/pii:S0360132323004948/image/svg+xml/d2e4aceaa2b85bda118afb97612faa5a/si96.svg si96 si96.svg svg 55610 ALTIMG 1-s2.0-S0360132323004948-si13.svg https://s3-eu-west-1.amazonaws.com/prod-ucs-content-store-eu-west/content/pii:S0360132323004948/image/svg+xml/20987267b7990138b86abd2d3da92e9e/si13.svg si13 si13.svg svg 87348 ALTIMG 1-s2.0-S0360132323004948-si161.svg https://s3-eu-west-1.amazonaws.com/prod-ucs-content-store-eu-west/content/pii:S0360132323004948/image/svg+xml/05a2f2c55fb2d2986f600b6a24dedac5/si161.svg si161 si161.svg svg 14789 ALTIMG 1-s2.0-S0360132323004948-si78.svg https://s3-eu-west-1.amazonaws.com/prod-ucs-content-store-eu-west/content/pii:S0360132323004948/image/svg+xml/0a9bc9222d44f71134b71d5c32eeb524/si78.svg si78 si78.svg svg 24440 ALTIMG 1-s2.0-S0360132323004948-si17.svg https://s3-eu-west-1.amazonaws.com/prod-ucs-content-store-eu-west/content/pii:S0360132323004948/image/svg+xml/1fdaa0b85d6a1339ffbc952fac6c3600/si17.svg si17 si17.svg svg 88546 ALTIMG 1-s2.0-S0360132323004948-si72.svg https://s3-eu-west-1.amazonaws.com/prod-ucs-content-store-eu-west/content/pii:S0360132323004948/image/svg+xml/96f2712362b05dc79226da4e3dcc4af4/si72.svg si72 si72.svg svg 27813 ALTIMG 1-s2.0-S0360132323004948-si66.svg https://s3-eu-west-1.amazonaws.com/prod-ucs-content-store-eu-west/content/pii:S0360132323004948/image/svg+xml/9c223984ea3321256db54a0dba62939d/si66.svg si66 si66.svg svg 59123 ALTIMG 1-s2.0-S0360132323004948-si116.svg https://s3-eu-west-1.amazonaws.com/prod-ucs-content-store-eu-west/content/pii:S0360132323004948/image/svg+xml/9aee7e69ecd9c58d3fcd097a66220f9c/si116.svg si116 si116.svg svg 42070 ALTIMG 1-s2.0-S0360132323004948-si5.svg https://s3-eu-west-1.amazonaws.com/prod-ucs-content-store-eu-west/content/pii:S0360132323004948/image/svg+xml/22f57094487706f62451aaeba008c033/si5.svg si5 si5.svg svg 38241 ALTIMG 1-s2.0-S0360132323004948-si93.svg https://s3-eu-west-1.amazonaws.com/prod-ucs-content-store-eu-west/content/pii:S0360132323004948/image/svg+xml/6111248bd12bee36d1650c8764dc880b/si93.svg si93 si93.svg svg 25093 ALTIMG 1-s2.0-S0360132323004948-si157.svg https://s3-eu-west-1.amazonaws.com/prod-ucs-content-store-eu-west/content/pii:S0360132323004948/image/svg+xml/e1f33658ffd0f8ca806d2856f8481681/si157.svg si157 si157.svg svg 24689 ALTIMG 1-s2.0-S0360132323004948-si87.svg https://s3-eu-west-1.amazonaws.com/prod-ucs-content-store-eu-west/content/pii:S0360132323004948/image/svg+xml/c761367061f26f5479aa7709679d4a11/si87.svg si87 si87.svg svg 15786 ALTIMG 1-s2.0-S0360132323004948-si25.svg https://s3-eu-west-1.amazonaws.com/prod-ucs-content-store-eu-west/content/pii:S0360132323004948/image/svg+xml/71e7065a4324cf09eb9e6cf4490bc5e4/si25.svg si25 si25.svg svg 9632 ALTIMG 1-s2.0-S0360132323004948-si33.svg https://s3-eu-west-1.amazonaws.com/prod-ucs-content-store-eu-west/content/pii:S0360132323004948/image/svg+xml/e4b982a498e458cd318e6e3ad867fdd9/si33.svg si33 si33.svg svg 24970 ALTIMG 1-s2.0-S0360132323004948-si70.svg https://s3-eu-west-1.amazonaws.com/prod-ucs-content-store-eu-west/content/pii:S0360132323004948/image/svg+xml/ca3984e85a2eee00cde8f957fdc05b95/si70.svg si70 si70.svg svg 18692 ALTIMG 1-s2.0-S0360132323004948-si71.svg https://s3-eu-west-1.amazonaws.com/prod-ucs-content-store-eu-west/content/pii:S0360132323004948/image/svg+xml/7564f623956a68fa7f58690dd77edf54/si71.svg si71 si71.svg svg 9086 ALTIMG 1-s2.0-S0360132323004948-si149.svg https://s3-eu-west-1.amazonaws.com/prod-ucs-content-store-eu-west/content/pii:S0360132323004948/image/svg+xml/18cc466d07c38d2d13d9c34fd3f0d90c/si149.svg si149 si149.svg svg 8960 ALTIMG 1-s2.0-S0360132323004948-si135.svg https://s3-eu-west-1.amazonaws.com/prod-ucs-content-store-eu-west/content/pii:S0360132323004948/image/svg+xml/d43271b964b229878a84a9b5bad299a5/si135.svg si135 si135.svg svg 9624 ALTIMG 1-s2.0-S0360132323004948-si184.svg https://s3-eu-west-1.amazonaws.com/prod-ucs-content-store-eu-west/content/pii:S0360132323004948/image/svg+xml/8e1ffc9bc3358bb26660ad3dc1ba917c/si184.svg si184 si184.svg svg 9431 ALTIMG 1-s2.0-S0360132323004948-si80.svg https://s3-eu-west-1.amazonaws.com/prod-ucs-content-store-eu-west/content/pii:S0360132323004948/image/svg+xml/a8084ee24c90a3e1c4185f4282da228e/si80.svg si80 si80.svg svg 69035 ALTIMG 1-s2.0-S0360132323004948-si62.svg https://s3-eu-west-1.amazonaws.com/prod-ucs-content-store-eu-west/content/pii:S0360132323004948/image/svg+xml/40acddf13977783f3f8d7a0aaafe758a/si62.svg si62 si62.svg svg 17861 ALTIMG 1-s2.0-S0360132323004948-si167.svg https://s3-eu-west-1.amazonaws.com/prod-ucs-content-store-eu-west/content/pii:S0360132323004948/image/svg+xml/b0e5e8479f40596585bc6deff514bf36/si167.svg si167 si167.svg svg 75448 ALTIMG 1-s2.0-S0360132323004948-si194.svg https://s3-eu-west-1.amazonaws.com/prod-ucs-content-store-eu-west/content/pii:S0360132323004948/image/svg+xml/ce243aa4a7015bb17a9e3142e0f187cd/si194.svg si194 si194.svg svg 17709 ALTIMG 1-s2.0-S0360132323004948-si169.svg https://s3-eu-west-1.amazonaws.com/prod-ucs-content-store-eu-west/content/pii:S0360132323004948/image/svg+xml/5e980b42c9823e44659270a33b666f11/si169.svg si169 si169.svg svg 30052 ALTIMG 1-s2.0-S0360132323004948-si12.svg https://s3-eu-west-1.amazonaws.com/prod-ucs-content-store-eu-west/content/pii:S0360132323004948/image/svg+xml/d4b68ffacbd6923aecf79a1e5fcda033/si12.svg si12 si12.svg svg 20637 ALTIMG 1-s2.0-S0360132323004948-si98.svg https://s3-eu-west-1.amazonaws.com/prod-ucs-content-store-eu-west/content/pii:S0360132323004948/image/svg+xml/66b14c165d002be1c9d970a4c84dc126/si98.svg si98 si98.svg svg 36942 ALTIMG 1-s2.0-S0360132323004948-si145.svg https://s3-eu-west-1.amazonaws.com/prod-ucs-content-store-eu-west/content/pii:S0360132323004948/image/svg+xml/004df2fac1fd62d2e8e969867c619c62/si145.svg si145 si145.svg svg 15398 ALTIMG 1-s2.0-S0360132323004948-si151.svg https://s3-eu-west-1.amazonaws.com/prod-ucs-content-store-eu-west/content/pii:S0360132323004948/image/svg+xml/5eb52de493bc05c405d91f4cc0efc834/si151.svg si151 si151.svg svg 51047 ALTIMG 1-s2.0-S0360132323004948-si57.svg https://s3-eu-west-1.amazonaws.com/prod-ucs-content-store-eu-west/content/pii:S0360132323004948/image/svg+xml/8b87b631c0a2f75a2e1aea06ba53e20c/si57.svg si57 si57.svg svg 21021 ALTIMG 1-s2.0-S0360132323004948-si68.svg https://s3-eu-west-1.amazonaws.com/prod-ucs-content-store-eu-west/content/pii:S0360132323004948/image/svg+xml/7a327ce78eabb23e16ee40577f51114b/si68.svg si68 si68.svg svg 7762 ALTIMG 1-s2.0-S0360132323004948-si159.svg https://s3-eu-west-1.amazonaws.com/prod-ucs-content-store-eu-west/content/pii:S0360132323004948/image/svg+xml/9b52ceb1acd296ded755f7f6daa4c6de/si159.svg si159 si159.svg svg 48632 ALTIMG 1-s2.0-S0360132323004948-si95.svg https://s3-eu-west-1.amazonaws.com/prod-ucs-content-store-eu-west/content/pii:S0360132323004948/image/svg+xml/f1331fe0dbe32681d6ba55f09d3986ef/si95.svg si95 si95.svg svg 46414 ALTIMG 1-s2.0-S0360132323004948-si38.svg https://s3-eu-west-1.amazonaws.com/prod-ucs-content-store-eu-west/content/pii:S0360132323004948/image/svg+xml/447eac5a9bbe64baebd1f321273fa95e/si38.svg si38 si38.svg svg 15531 ALTIMG 1-s2.0-S0360132323004948-si174.svg https://s3-eu-west-1.amazonaws.com/prod-ucs-content-store-eu-west/content/pii:S0360132323004948/image/svg+xml/c14af895cab7b67a6bf7e0eb2e2a3401/si174.svg si174 si174.svg svg 10903 ALTIMG 1-s2.0-S0360132323004948-si83.svg https://s3-eu-west-1.amazonaws.com/prod-ucs-content-store-eu-west/content/pii:S0360132323004948/image/svg+xml/3e4aba644f039b13346e0489078a2974/si83.svg si83 si83.svg svg 11094 ALTIMG 1-s2.0-S0360132323004948-si76.svg https://s3-eu-west-1.amazonaws.com/prod-ucs-content-store-eu-west/content/pii:S0360132323004948/image/svg+xml/c4528523594d8b170248631da263e554/si76.svg si76 si76.svg svg 4675 ALTIMG 1-s2.0-S0360132323004948-si163.svg https://s3-eu-west-1.amazonaws.com/prod-ucs-content-store-eu-west/content/pii:S0360132323004948/image/svg+xml/b53dcfafd4dc795a8a93c1c9d69f1061/si163.svg si163 si163.svg svg 78054 ALTIMG 1-s2.0-S0360132323004948-si47.svg https://s3-eu-west-1.amazonaws.com/prod-ucs-content-store-eu-west/content/pii:S0360132323004948/image/svg+xml/ae20ceb15d06724d0e86b24e4193937c/si47.svg si47 si47.svg svg 7898 ALTIMG 1-s2.0-S0360132323004948-si27.svg https://s3-eu-west-1.amazonaws.com/prod-ucs-content-store-eu-west/content/pii:S0360132323004948/image/svg+xml/6f50bbcb62ca1df8f46c1bf9aad80f9e/si27.svg si27 si27.svg svg 90645 ALTIMG 1-s2.0-S0360132323004948-si49.svg https://s3-eu-west-1.amazonaws.com/prod-ucs-content-store-eu-west/content/pii:S0360132323004948/image/svg+xml/edc15594008c51c51f0d42af52523a3f/si49.svg si49 si49.svg svg 12952 ALTIMG 1-s2.0-S0360132323004948-si185.svg https://s3-eu-west-1.amazonaws.com/prod-ucs-content-store-eu-west/content/pii:S0360132323004948/image/svg+xml/e41c8781c8909363f573b9138f75a0ef/si185.svg si185 si185.svg svg 23543 ALTIMG 1-s2.0-S0360132323004948-si176.svg https://s3-eu-west-1.amazonaws.com/prod-ucs-content-store-eu-west/content/pii:S0360132323004948/image/svg+xml/239d9f58a6780839c68c8525341fb91d/si176.svg si176 si176.svg svg 52769 ALTIMG 1-s2.0-S0360132323004948-si126.svg https://s3-eu-west-1.amazonaws.com/prod-ucs-content-store-eu-west/content/pii:S0360132323004948/image/svg+xml/d471d9e05bc9cad2c3d7c1ce0089bfcb/si126.svg si126 si126.svg svg 60532 ALTIMG 1-s2.0-S0360132323004948-si24.svg https://s3-eu-west-1.amazonaws.com/prod-ucs-content-store-eu-west/content/pii:S0360132323004948/image/svg+xml/fb4a9228a575c55ac31c9d36761c4196/si24.svg si24 si24.svg svg 7590 ALTIMG 1-s2.0-S0360132323004948-si22.svg https://s3-eu-west-1.amazonaws.com/prod-ucs-content-store-eu-west/content/pii:S0360132323004948/image/svg+xml/812f1e72d6f07a4ce8e5490a61058cbb/si22.svg si22 si22.svg svg 7082 ALTIMG 1-s2.0-S0360132323004948-si158.svg https://s3-eu-west-1.amazonaws.com/prod-ucs-content-store-eu-west/content/pii:S0360132323004948/image/svg+xml/fdc936dbfb6689b6e12e29a23b5747cd/si158.svg si158 si158.svg svg 64266 ALTIMG 1-s2.0-S0360132323004948-si21.svg https://s3-eu-west-1.amazonaws.com/prod-ucs-content-store-eu-west/content/pii:S0360132323004948/image/svg+xml/dd401cbbc2aa7a53a88fe93a69317551/si21.svg si21 si21.svg svg 8402 ALTIMG 1-s2.0-S0360132323004948-si148.svg https://s3-eu-west-1.amazonaws.com/prod-ucs-content-store-eu-west/content/pii:S0360132323004948/image/svg+xml/0ccae995155a9a07db74536a3839d7dd/si148.svg si148 si148.svg svg 15456 ALTIMG 1-s2.0-S0360132323004948-si10.svg https://s3-eu-west-1.amazonaws.com/prod-ucs-content-store-eu-west/content/pii:S0360132323004948/image/svg+xml/7a149aeadd08539d840adbd99524a53d/si10.svg si10 si10.svg svg 17653 ALTIMG 1-s2.0-S0360132323004948-si108.svg https://s3-eu-west-1.amazonaws.com/prod-ucs-content-store-eu-west/content/pii:S0360132323004948/image/svg+xml/2acf4c66f739ed8bd0993708e47f14a7/si108.svg si108 si108.svg svg 26004 ALTIMG 1-s2.0-S0360132323004948-si52.svg https://s3-eu-west-1.amazonaws.com/prod-ucs-content-store-eu-west/content/pii:S0360132323004948/image/svg+xml/1840be33732d86dbda0cffc9e1935626/si52.svg si52 si52.svg svg 10311 ALTIMG 1-s2.0-S0360132323004948-si74.svg https://s3-eu-west-1.amazonaws.com/prod-ucs-content-store-eu-west/content/pii:S0360132323004948/image/svg+xml/8511405d4cb49d359b4c9c9f6be27ad7/si74.svg si74 si74.svg svg 166099 ALTIMG 1-s2.0-S0360132323004948-si82.svg https://s3-eu-west-1.amazonaws.com/prod-ucs-content-store-eu-west/content/pii:S0360132323004948/image/svg+xml/ab7544f7c004ca1958ba7c084a6fad18/si82.svg si82 si82.svg svg 47945 ALTIMG 1-s2.0-S0360132323004948-si188.svg https://s3-eu-west-1.amazonaws.com/prod-ucs-content-store-eu-west/content/pii:S0360132323004948/image/svg+xml/d32363e883b668ff38411dad574fd9b5/si188.svg si188 si188.svg svg 30201 ALTIMG 1-s2.0-S0360132323004948-si162.svg https://s3-eu-west-1.amazonaws.com/prod-ucs-content-store-eu-west/content/pii:S0360132323004948/image/svg+xml/9ba2c11a171dcf1811cdef79de797445/si162.svg si162 si162.svg svg 13075 ALTIMG 1-s2.0-S0360132323004948-si132.svg https://s3-eu-west-1.amazonaws.com/prod-ucs-content-store-eu-west/content/pii:S0360132323004948/image/svg+xml/7b5d5c7b009e8827f0c855c8fcfa4fc2/si132.svg si132 si132.svg svg 50111 ALTIMG 1-s2.0-S0360132323004948-si197.svg https://s3-eu-west-1.amazonaws.com/prod-ucs-content-store-eu-west/content/pii:S0360132323004948/image/svg+xml/c03889eb733c468a2127480f4def9581/si197.svg si197 si197.svg svg 11695 ALTIMG 1-s2.0-S0360132323004948-si19.svg https://s3-eu-west-1.amazonaws.com/prod-ucs-content-store-eu-west/content/pii:S0360132323004948/image/svg+xml/f494087d4d781b3249bce4bffaaf3bc3/si19.svg si19 si19.svg svg 69000 ALTIMG 1-s2.0-S0360132323004948-si35.svg https://s3-eu-west-1.amazonaws.com/prod-ucs-content-store-eu-west/content/pii:S0360132323004948/image/svg+xml/a8ead157c8e2b0d3e6f0ad01f1bec483/si35.svg si35 si35.svg svg 21707 ALTIMG 1-s2.0-S0360132323004948-si143.svg https://s3-eu-west-1.amazonaws.com/prod-ucs-content-store-eu-west/content/pii:S0360132323004948/image/svg+xml/06f4d4e4a734972f21b13d6d07bbdfd8/si143.svg si143 si143.svg svg 4908 ALTIMG 1-s2.0-S0360132323004948-si165.svg https://s3-eu-west-1.amazonaws.com/prod-ucs-content-store-eu-west/content/pii:S0360132323004948/image/svg+xml/3dba607048ce79b3cd6244537fbbf4b4/si165.svg si165 si165.svg svg 40605 ALTIMG 1-s2.0-S0360132323004948-si36.svg https://s3-eu-west-1.amazonaws.com/prod-ucs-content-store-eu-west/content/pii:S0360132323004948/image/svg+xml/3846b1c9d862fa0ea5e871613a669efe/si36.svg si36 si36.svg svg 22248 ALTIMG 1-s2.0-S0360132323004948-si137.svg https://s3-eu-west-1.amazonaws.com/prod-ucs-content-store-eu-west/content/pii:S0360132323004948/image/svg+xml/94ffce9ec31db006443391533d20eba9/si137.svg si137 si137.svg svg 73692 ALTIMG 1-s2.0-S0360132323004948-si75.svg https://s3-eu-west-1.amazonaws.com/prod-ucs-content-store-eu-west/content/pii:S0360132323004948/image/svg+xml/6c4837e71fc44c7c1f344cbd66903102/si75.svg si75 si75.svg svg 25125 ALTIMG 1-s2.0-S0360132323004948-si117.svg https://s3-eu-west-1.amazonaws.com/prod-ucs-content-store-eu-west/content/pii:S0360132323004948/image/svg+xml/bec59d6568ad7cf154477029d8b36ace/si117.svg si117 si117.svg svg 137758 ALTIMG 1-s2.0-S0360132323004948-si51.svg https://s3-eu-west-1.amazonaws.com/prod-ucs-content-store-eu-west/content/pii:S0360132323004948/image/svg+xml/8d617ee405fad3079fcb9c6143b448ad/si51.svg si51 si51.svg svg 52739 ALTIMG 1-s2.0-S0360132323004948-si171.svg https://s3-eu-west-1.amazonaws.com/prod-ucs-content-store-eu-west/content/pii:S0360132323004948/image/svg+xml/6fdb31d840a76749427247a0595e4c2b/si171.svg si171 si171.svg svg 17233 ALTIMG 1-s2.0-S0360132323004948-si58.svg https://s3-eu-west-1.amazonaws.com/prod-ucs-content-store-eu-west/content/pii:S0360132323004948/image/svg+xml/66bbb2632edf4c3456b51687bf996776/si58.svg si58 si58.svg svg 25570 ALTIMG 1-s2.0-S0360132323004948-si16.svg https://s3-eu-west-1.amazonaws.com/prod-ucs-content-store-eu-west/content/pii:S0360132323004948/image/svg+xml/3ba8b6926680700b459c26317bb2f967/si16.svg si16 si16.svg svg 26617 ALTIMG 1-s2.0-S0360132323004948-si144.svg https://s3-eu-west-1.amazonaws.com/prod-ucs-content-store-eu-west/content/pii:S0360132323004948/image/svg+xml/67d971bdbaa41dc31a91fbacdfc9e0c4/si144.svg si144 si144.svg svg 4798 ALTIMG 1-s2.0-S0360132323004948-si14.svg https://s3-eu-west-1.amazonaws.com/prod-ucs-content-store-eu-west/content/pii:S0360132323004948/image/svg+xml/1aa050bceb22127b969baefc294d58ad/si14.svg si14 si14.svg svg 17361 ALTIMG 1-s2.0-S0360132323004948-si4.svg https://s3-eu-west-1.amazonaws.com/prod-ucs-content-store-eu-west/content/pii:S0360132323004948/image/svg+xml/decd1247483981171c5be50b3cf2e0b2/si4.svg si4 si4.svg svg 39953 ALTIMG 1-s2.0-S0360132323004948-si41.svg https://s3-eu-west-1.amazonaws.com/prod-ucs-content-store-eu-west/content/pii:S0360132323004948/image/svg+xml/ef135f25bfd68f270616e8cce8aebaae/si41.svg si41 si41.svg svg 10570 ALTIMG 1-s2.0-S0360132323004948-si86.svg https://s3-eu-west-1.amazonaws.com/prod-ucs-content-store-eu-west/content/pii:S0360132323004948/image/svg+xml/50eb55db5ffe877f02a0de12af0ff6df/si86.svg si86 si86.svg svg 8933 ALTIMG 1-s2.0-S0360132323004948-si111.svg https://s3-eu-west-1.amazonaws.com/prod-ucs-content-store-eu-west/content/pii:S0360132323004948/image/svg+xml/7dde26f8b398963007f63fa012c3027d/si111.svg si111 si111.svg svg 40413 ALTIMG 1-s2.0-S0360132323004948-si147.svg https://s3-eu-west-1.amazonaws.com/prod-ucs-content-store-eu-west/content/pii:S0360132323004948/image/svg+xml/367d269b9035b71483f43a6dc131218c/si147.svg si147 si147.svg svg 2704 ALTIMG 1-s2.0-S0360132323004948-si18.svg https://s3-eu-west-1.amazonaws.com/prod-ucs-content-store-eu-west/content/pii:S0360132323004948/image/svg+xml/b1cd8f00813d9a392e6b4bcfe3a45468/si18.svg si18 si18.svg svg 19366 ALTIMG 1-s2.0-S0360132323004948-si189.svg https://s3-eu-west-1.amazonaws.com/prod-ucs-content-store-eu-west/content/pii:S0360132323004948/image/svg+xml/16413a4bbb8e13c0a4eb843eb80783ab/si189.svg si189 si189.svg svg 10750 ALTIMG 1-s2.0-S0360132323004948-si141.svg https://s3-eu-west-1.amazonaws.com/prod-ucs-content-store-eu-west/content/pii:S0360132323004948/image/svg+xml/a95b32883b0673cabf9391d80c92e97a/si141.svg si141 si141.svg svg 4505 ALTIMG 1-s2.0-S0360132323004948-si155.svg https://s3-eu-west-1.amazonaws.com/prod-ucs-content-store-eu-west/content/pii:S0360132323004948/image/svg+xml/c315ea1b6f748b79d981ce16ce77f858/si155.svg si155 si155.svg svg 9064 ALTIMG 1-s2.0-S0360132323004948-si59.svg https://s3-eu-west-1.amazonaws.com/prod-ucs-content-store-eu-west/content/pii:S0360132323004948/image/svg+xml/cebcccb971364b23ab230990b7666297/si59.svg si59 si59.svg svg 11727 ALTIMG 1-s2.0-S0360132323004948-si60.svg https://s3-eu-west-1.amazonaws.com/prod-ucs-content-store-eu-west/content/pii:S0360132323004948/image/svg+xml/6bc787abbb72caf932b20c5f8cd48e02/si60.svg si60 si60.svg svg 18933 ALTIMG 1-s2.0-S0360132323004948-si195.svg https://s3-eu-west-1.amazonaws.com/prod-ucs-content-store-eu-west/content/pii:S0360132323004948/image/svg+xml/f3a178149508d2653b187d387fce8ae0/si195.svg si195 si195.svg svg 9830 ALTIMG 1-s2.0-S0360132323004948-si39.svg https://s3-eu-west-1.amazonaws.com/prod-ucs-content-store-eu-west/content/pii:S0360132323004948/image/svg+xml/9d9861042114f594f683a73c3c9b731a/si39.svg si39 si39.svg svg 17619 ALTIMG 1-s2.0-S0360132323004948-si179.svg https://s3-eu-west-1.amazonaws.com/prod-ucs-content-store-eu-west/content/pii:S0360132323004948/image/svg+xml/3c337ac910a01e6c45cb079b34bce8bc/si179.svg si179 si179.svg svg 11025 ALTIMG 1-s2.0-S0360132323004948-si154.svg https://s3-eu-west-1.amazonaws.com/prod-ucs-content-store-eu-west/content/pii:S0360132323004948/image/svg+xml/2b64e5edc531bcea6bb54b11674d7841/si154.svg si154 si154.svg svg 34050 ALTIMG 1-s2.0-S0360132323004948-si92.svg https://s3-eu-west-1.amazonaws.com/prod-ucs-content-store-eu-west/content/pii:S0360132323004948/image/svg+xml/2207565bc27d061886a67a73a2d5c043/si92.svg si92 si92.svg svg 31494 ALTIMG 1-s2.0-S0360132323004948-si29.svg https://s3-eu-west-1.amazonaws.com/prod-ucs-content-store-eu-west/content/pii:S0360132323004948/image/svg+xml/00a1e38ab414d1b01394f197ec0d4f86/si29.svg si29 si29.svg svg 52114 ALTIMG 1-s2.0-S0360132323004948-si30.svg https://s3-eu-west-1.amazonaws.com/prod-ucs-content-store-eu-west/content/pii:S0360132323004948/image/svg+xml/75aa79b2f4f7b5a880a67c058228697d/si30.svg si30 si30.svg svg 24429 ALTIMG 1-s2.0-S0360132323004948-si48.svg https://s3-eu-west-1.amazonaws.com/prod-ucs-content-store-eu-west/content/pii:S0360132323004948/image/svg+xml/9f3b5be6511cfe2799d11ed8d73dd8be/si48.svg si48 si48.svg svg 9940 ALTIMG 1-s2.0-S0360132323004948-si23.svg https://s3-eu-west-1.amazonaws.com/prod-ucs-content-store-eu-west/content/pii:S0360132323004948/image/svg+xml/27dcee04ee6bf975f731ba4580e76ab2/si23.svg si23 si23.svg svg 8944 ALTIMG 1-s2.0-S0360132323004948-si65.svg https://s3-eu-west-1.amazonaws.com/prod-ucs-content-store-eu-west/content/pii:S0360132323004948/image/svg+xml/b60d26617299432d3ccc28ff06e3999f/si65.svg si65 si65.svg svg 71596 ALTIMG 1-s2.0-S0360132323004948-si84.svg https://s3-eu-west-1.amazonaws.com/prod-ucs-content-store-eu-west/content/pii:S0360132323004948/image/svg+xml/9d9c3ce47a69e057615c06ee86ae410b/si84.svg si84 si84.svg svg 10965 ALTIMG 1-s2.0-S0360132323004948-si127.svg https://s3-eu-west-1.amazonaws.com/prod-ucs-content-store-eu-west/content/pii:S0360132323004948/image/svg+xml/8ee17565f4746e98471e47f624bcb43d/si127.svg si127 si127.svg svg 11299 ALTIMG 1-s2.0-S0360132323004948-si121.svg https://s3-eu-west-1.amazonaws.com/prod-ucs-content-store-eu-west/content/pii:S0360132323004948/image/svg+xml/24c7c6c46962209bab2fefd74f9990e0/si121.svg si121 si121.svg svg 81013 ALTIMG 1-s2.0-S0360132323004948-si170.svg https://s3-eu-west-1.amazonaws.com/prod-ucs-content-store-eu-west/content/pii:S0360132323004948/image/svg+xml/2aca70f1c86e0ae2a8574941b89a5f45/si170.svg si170 si170.svg svg 21253 ALTIMG 1-s2.0-S0360132323004948-si136.svg https://s3-eu-west-1.amazonaws.com/prod-ucs-content-store-eu-west/content/pii:S0360132323004948/image/svg+xml/0653a53d58f2a57dd903d433a4a0f390/si136.svg si136 si136.svg svg 25914 ALTIMG 1-s2.0-S0360132323004948-si133.svg https://s3-eu-west-1.amazonaws.com/prod-ucs-content-store-eu-west/content/pii:S0360132323004948/image/svg+xml/67cc80b358647164d0f8dea597b386c6/si133.svg si133 si133.svg svg 58839 ALTIMG 1-s2.0-S0360132323004948-si181.svg https://s3-eu-west-1.amazonaws.com/prod-ucs-content-store-eu-west/content/pii:S0360132323004948/image/svg+xml/f954db2c491b7699ffe8869efa1167da/si181.svg si181 si181.svg svg 22987 ALTIMG 1-s2.0-S0360132323004948-si69.svg https://s3-eu-west-1.amazonaws.com/prod-ucs-content-store-eu-west/content/pii:S0360132323004948/image/svg+xml/7844d48eb5c17f9fc099073e2cfa8a1a/si69.svg si69 si69.svg svg 9804 ALTIMG 1-s2.0-S0360132323004948-si43.svg https://s3-eu-west-1.amazonaws.com/prod-ucs-content-store-eu-west/content/pii:S0360132323004948/image/svg+xml/92be785b24e6e1346bc3699f15780cbd/si43.svg si43 si43.svg svg 64033 ALTIMG 1-s2.0-S0360132323004948-si166.svg https://s3-eu-west-1.amazonaws.com/prod-ucs-content-store-eu-west/content/pii:S0360132323004948/image/svg+xml/19d47fce60cae3a973a0af02f5e7220a/si166.svg si166 si166.svg svg 56877 ALTIMG 1-s2.0-S0360132323004948-si130.svg https://s3-eu-west-1.amazonaws.com/prod-ucs-content-store-eu-west/content/pii:S0360132323004948/image/svg+xml/ad3ec52de8349bcf4b816c64803558c6/si130.svg si130 si130.svg svg 39962 ALTIMG 1-s2.0-S0360132323004948-si31.svg https://s3-eu-west-1.amazonaws.com/prod-ucs-content-store-eu-west/content/pii:S0360132323004948/image/svg+xml/24eed2b5443b2c14feaf66abca909848/si31.svg si31 si31.svg svg 18060 ALTIMG 1-s2.0-S0360132323004948-si91.svg https://s3-eu-west-1.amazonaws.com/prod-ucs-content-store-eu-west/content/pii:S0360132323004948/image/svg+xml/d138d88696bbafa2249e54af509ab0d1/si91.svg si91 si91.svg svg 26947 ALTIMG 1-s2.0-S0360132323004948-si168.svg https://s3-eu-west-1.amazonaws.com/prod-ucs-content-store-eu-west/content/pii:S0360132323004948/image/svg+xml/21bde0a45016eb7b773307ae0ff6c7d5/si168.svg si168 si168.svg svg 81058 ALTIMG 1-s2.0-S0360132323004948-si77.svg https://s3-eu-west-1.amazonaws.com/prod-ucs-content-store-eu-west/content/pii:S0360132323004948/image/svg+xml/9812abee61480bc301de84b2c3876bbd/si77.svg si77 si77.svg svg 10822 ALTIMG 1-s2.0-S0360132323004948-si150.svg https://s3-eu-west-1.amazonaws.com/prod-ucs-content-store-eu-west/content/pii:S0360132323004948/image/svg+xml/4667be2f40ec5c3bfd3e5c12a175c338/si150.svg si150 si150.svg svg 42549 ALTIMG 1-s2.0-S0360132323004948-si46.svg https://s3-eu-west-1.amazonaws.com/prod-ucs-content-store-eu-west/content/pii:S0360132323004948/image/svg+xml/16a58ae1836bf6c0393eec81eddbdfdb/si46.svg si46 si46.svg svg 9803 ALTIMG 1-s2.0-S0360132323004948-si175.svg https://s3-eu-west-1.amazonaws.com/prod-ucs-content-store-eu-west/content/pii:S0360132323004948/image/svg+xml/77c3f5f721f1a2dbe0df0906f2e53d3d/si175.svg si175 si175.svg svg 44085 ALTIMG 1-s2.0-S0360132323004948-si2.svg https://s3-eu-west-1.amazonaws.com/prod-ucs-content-store-eu-west/content/pii:S0360132323004948/image/svg+xml/6e0d141e35bbd3423a0665de4c398e23/si2.svg si2 si2.svg svg 15239 ALTIMG 1-s2.0-S0360132323004948-si128.svg https://s3-eu-west-1.amazonaws.com/prod-ucs-content-store-eu-west/content/pii:S0360132323004948/image/svg+xml/67858d99fdd597cb4674fcb3b96bfd1f/si128.svg si128 si128.svg svg 16668 ALTIMG 1-s2.0-S0360132323004948-si119.svg https://s3-eu-west-1.amazonaws.com/prod-ucs-content-store-eu-west/content/pii:S0360132323004948/image/svg+xml/a28ed436877097ea8f81ca3a2aef577d/si119.svg si119 si119.svg svg 59828 ALTIMG 1-s2.0-S0360132323004948-si112.svg https://s3-eu-west-1.amazonaws.com/prod-ucs-content-store-eu-west/content/pii:S0360132323004948/image/svg+xml/2e6016740129a1bc8d22868b2d7661cf/si112.svg si112 si112.svg svg 88104 ALTIMG 1-s2.0-S0360132323004948-si90.svg https://s3-eu-west-1.amazonaws.com/prod-ucs-content-store-eu-west/content/pii:S0360132323004948/image/svg+xml/f613c1d74df61864a0bc98aaeb13a4a2/si90.svg si90 si90.svg svg 10234 ALTIMG 1-s2.0-S0360132323004948-si109.svg https://s3-eu-west-1.amazonaws.com/prod-ucs-content-store-eu-west/content/pii:S0360132323004948/image/svg+xml/718c32627eb48046524907687ab3c866/si109.svg si109 si109.svg svg 41604 ALTIMG 1-s2.0-S0360132323004948-si50.svg https://s3-eu-west-1.amazonaws.com/prod-ucs-content-store-eu-west/content/pii:S0360132323004948/image/svg+xml/352775931444367da79aa9a20c9ba336/si50.svg si50 si50.svg svg 25393 ALTIMG 1-s2.0-S0360132323004948-si6.svg https://s3-eu-west-1.amazonaws.com/prod-ucs-content-store-eu-west/content/pii:S0360132323004948/image/svg+xml/5dd3fa6be4d61a8c67935210a8e7ff7d/si6.svg si6 si6.svg svg 47075 ALTIMG 1-s2.0-S0360132323004948-si7.svg https://s3-eu-west-1.amazonaws.com/prod-ucs-content-store-eu-west/content/pii:S0360132323004948/image/svg+xml/427416f867c4551310c728a1eb6969a3/si7.svg si7 si7.svg svg 52587 ALTIMG 1-s2.0-S0360132323004948-si153.svg https://s3-eu-west-1.amazonaws.com/prod-ucs-content-store-eu-west/content/pii:S0360132323004948/image/svg+xml/f0d9332a9cc4ec0883a771995d44f218/si153.svg si153 si153.svg svg 6504 ALTIMG 1-s2.0-S0360132323004948-si53.svg https://s3-eu-west-1.amazonaws.com/prod-ucs-content-store-eu-west/content/pii:S0360132323004948/image/svg+xml/f18ea24440746843e7eba35e20ca27db/si53.svg si53 si53.svg svg 27815 ALTIMG 1-s2.0-S0360132323004948-si125.svg https://s3-eu-west-1.amazonaws.com/prod-ucs-content-store-eu-west/content/pii:S0360132323004948/image/svg+xml/d28e8e7903c3521d27669cad988b7d64/si125.svg si125 si125.svg svg 14081 ALTIMG 1-s2.0-S0360132323004948-si164.svg https://s3-eu-west-1.amazonaws.com/prod-ucs-content-store-eu-west/content/pii:S0360132323004948/image/svg+xml/2dcab6e7a07c3133dc49a8d7016af8c9/si164.svg si164 si164.svg svg 48680 ALTIMG 1-s2.0-S0360132323004948-am.pdf https://s3-eu-west-1.amazonaws.com/prod-ucs-content-store-eu-west/content/egi:10MW60P1LB1/MAIN/application/pdf/d0d86271f38533ed89ea90ffe6a41935/am.pdf am am.pdf pdf false 883888 AAM-PDF BAE 110467 110467 S0360-1323(23)00494-8 10.1016/j.buildenv.2023.110467 Elsevier Ltd Fig. 1 The structure of this paper. Fig. 1 Fig. 2 Basic steps of swarm intelligence algorithm. Fig. 2 Fig. 3 Convergence curves of the swarm intelligence algorithms. Fig. 3 Fig. 4 The total score of the swarm intelligence algorithms. Fig. 4 Fig. 5 Schematic diagram of the HVAC system composition. Fig. 5 Fig. 6 The real COP and predicted COP of chillers. Fig. 6 Fig. 7 Fitting curves of the chilled water pumps. Fig. 7 Fig. 8 Fitting curves of the cooling water pumps. Fig. 8 Fig. 9 The actual outlet water temperature and predicted outlet water temperature of cooling tower. Fig. 9 Fig. 10 Flow chart for calculating the energy consumption of the system. Fig. 10 Fig. 11 Weather conditions on the typical day. Fig. 11 Fig. 12 Cooling load, actual energy consumption, and optimized energy consumption on the typical day. Fig. 12 Fig. 13 The optimal chilled water outlet temperature and cooling water flow on the typical day. Fig. 13 Table 1 The swarm intelligence algorithms focused in this paper. Table 1 Algorithm Abbreviation Year particle swarm optimization [42] PSO 1995 artificial fish swarm algorithm [43] AFSA 2002 artificial bee colony algorithm [44] ABC 2005 wolf pack search algorithm [45] WPS 2007 gray wolf optimizer [46] GWO 2014 crow search algorithm [47] CSA 2016 whale optimization algorithm [48] WOA 2016 salp swarm algorithm [49] SSA2017 2017 satin bowerbird optimizer [50] SBO 2017 sparrow search algorithm [51] SSA2020 2020 *To distinguish the sparrow search algorithm from the salp swarm algorithm, the proposed year is selected as a suffix. Table 2 Test functions and the characteristics. Table 2 Function ID Name Formula Domain Characteristics F1 Sphere f ( x ) = ∑ i = 1 n x i 2 [ − 10,10 ] n Unimodal and separable F2 Step f ( x ) = ∑ i = 1 n | x i | [ − 10,10 ] n Unimodal and separable F3 Quartic f ( x ) = ∑ i = 1 n i x i 4 [ − 10,10 ] n Unimodal and separable F4 Schwefel 2.22 f ( x ) = ∑ i = 1 n | x i | + ∏ i n | x i | [ − 10,10 ] n Unimodal and no-separable F5 Schwefel 1.2 f ( x ) = ∑ i = 1 n ( ∑ j = 1 i x j ) 2 [ − 10,10 ] n Unimodal and no-separable F6 Rosenbrock f ( x ) = ∑ i = 1 n − 1 [ 100 ( x i + 1 − x i 2 ) 2 + ( x i − 1 ) 2 ] 2 [ − 100,100 ] n Unimodal and no-separable F7 Schwefel f ( x ) = ∑ i = 1 n ( − x i sin ( | x i | ) ) + 418.9829 n [ − 500,500 ] n Multimodal and separable F8 Rastrigin f ( x ) = ∑ i = 1 n ( x i 2 − 10 cos ( 2 π x i ) + 10 ) [ − 5.12,5.12 ] n Multimodal and separable F9 Ackley f ( x ) = − 20 e − 0.2 1 n ∑ i = 1 n x i 2 − e 1 n ∑ i = 1 n cos ( 2 π x i ) + 20 + e [ − 20,20 ] n Multimodal and no-separable F10 Griewank f ( x ) = 1 4000 ∑ i = 1 n x i 2 − ∏ i = 1 n cos ( x i i ) + 1 [ − 100,100 ] n Multimodal and no-separable * x = ( x 1 , x 2 , \u2026 x n ) . Table 3 Parameter setting of the swarm intelligence algorithms. Table 3 Algorithm Parameter Value PSO w 0.8 c1 0.5 c2 0.5 AFSA max try number 100 step 0.5 visual 0.3 q 0.98 delta 0.5 ABC max trials 600 WPS step 0.5 GWO a 2 CSA ap 0.1 WOA spiral parameter 1 SSA2017 proportion of leaders 0.5 SBO alpha 0.94 z 0.02 mutate rate 0.05 SSA2020 P-percent 0.2 D-percent 0.1 Table 4 Performance indexes of algorithms on different test functions. Table 4 F1 F2 F3 F4 F5 MCT (s) MF VF MCT (s) MF VF MCT (s) MF VF MCT (s) MF VF MCT (s) MF VF PSO 1.90E+01 4.00E+00 3.84E+02 1.84E+01 8.18E-03 7.36E+02 2.14E+01 3.60E+03 1.15E+08 1.52E+02 1.98E+01 1.68E+02 3.65E+04 1.27E+02 1.17E+04 AFSA 1.57E+02 6.18E-02 1.12E-04 1.70E+02 7.28E+00 9.13E-05 1.87E+02 5.58E-03 3.01E-06 7.02E+02 5.55E+04 4.87E+10 8.72E+02 7.01E+00 1.72E+01 ABC 1.07E+02 5.29E-08 6.55E-15 1.08E+02 6.95E-04 1.78E-15 1.11E+02 5.56E-14 1.59E-26 1.11E+02 5.37E-04 5.12E-08 1.84E+02 3.69E+01 1.58E+02 WPS 2.90E+01 3.59E-02 6.91E-06 3.02E+01 8.61E-01 1.28E-05 3.41E+01 1.56E-04 8.61E-10 3.31E+01 8.27E-01 1.42E-03 1.52E+02 4.34E-02 1.81E-05 GWO 5.92E+02 1.45E+00 2.68E-02 5.90E+02 5.51E+00 3.46E-02 6.00E+02 2.23E+00 4.04E-01 6.06E+02 5.23E+00 1.01E-01 7.22E+02 3.85E+00 4.97E-01 CSA 4.71E+01 3.42E+00 2.38E+00 4.82E+01 6.03E+00 2.23E+00 5.21E+01 1.38E+02 5.54E+03 5.09E+01 7.60E+00 4.07E+00 1.65E+02 2.94E+02 2.63E+03 WOA 4.38E+02 5.09E+00 2.94E+00 4.39E+02 1.24E+01 4.90E+00 4.65E+02 6.81E+01 3.26E+03 4.61E+02 1.48E+02 9.82E+04 5.77E+02 3.09E+02 3.04E+03 SSA2017 4.71E+02 2.41E-05 3.38E-11 4.72E+02 1.80E+00 5.75E-11 4.83E+02 5.57E-07 1.19E-12 4.85E+02 1.95E+00 1.68E+00 6.03E+02 8.46E+00 1.43E+01 SBO 8.36E+03 9.03E-05 8.35E-10 3.81E+04 2.21E-02 6.24E-10 7.30E+03 1.24E-08 4.77E-17 6.36E+03 2.83E-02 2.24E-05 9.97E+03 3.76E-01 4.97E-02 SSA2020 3.98E+01 4.29E+00 5.97E+02 4.12E+01 1.04E+00 1.62E-02 4.52E+01 2.02E-01 1.65E+00 4.40E+01 5.70E-01 5.09E-01 1.65E+02 8.60E+01 9.87E+04 F6 F7 F8 F9 F10 MCT (s) MF VF MCT (s) MF VF MCT (s) MF VF MCT (s) MF VF MCT (s) MF VF PSO 5.69E+01 6.03E+06 5.64E+14 6.07E+01 3.95E+03 4.66E+05 7.48E+01 1.25E+02 1.14E+03 6.90E+01 3.98E+00 1.16E+01 1.94E+02 3.05E-01 6.80E-01 AFSA 3.99E+02 1.40E+03 1.43E+07 4.09E+02 8.88E+03 3.43E+05 9.21E+03 1.92E+02 8.84E+02 5.17E+03 1.69E+01 1.58E-01 5.25E+02 1.19E+01 1.23E+00 ABC 1.40E+02 3.49E+02 1.40E+05 2.54E+02 6.40E+01 7.99E+03 2.74E+02 3.09E-04 1.39E-07 2.55E+02 1.29E-03 3.37E-07 2.57E+02 1.59E-02 4.16E-04 WPS 7.10E+01 1.75E+01 1.31E+04 7.02E+01 5.71E+03 1.00E+06 8.75E+01 2.56E+01 5.84E+01 7.89E+01 2.02E+01 3.28E-04 8.81E+01 6.36E-01 9.55E-03 GWO 6.42E+02 3.26E+03 2.58E+07 6.41E+02 1.02E+04 1.36E+05 6.45E+02 1.98E+02 3.05E+02 6.55E+02 2.10E+00 1.07E-02 6.63E+02 8.57E-02 4.30E-04 CSA 8.39E+01 1.12E+07 1.66E+14 8.38E+01 5.41E+03 1.22E+06 1.01E+02 2.28E+02 1.69E+02 9.20E+01 4.24E+00 1.87E-01 1.00E+02 1.08E+00 1.14E-03 WOA 4.96E+02 4.40E+06 9.17E+13 5.03E+02 1.59E+02 2.80E+05 5.02E+02 2.25E+02 1.06E+03 5.11E+02 4.72E+00 6.42E-01 5.18E+02 7.20E-01 3.16E-02 SSA2017 5.28E+02 7.04E+02 2.66E+06 5.38E+02 4.60E+03 5.24E+05 5.43E+02 4.31E+01 1.66E+02 5.57E+02 2.85E+00 8.16E-01 5.54E+02 9.73E-03 1.16E-04 SBO 7.14E+03 4.76E-01 1.50E+00 1.22E+04 9.45E+03 4.38E+05 1.12E+04 1.68E+01 4.61E+01 9.94E+03 3.68E-02 2.31E-03 8.70E+03 1.11E-02 1.83E-04 SSA2020 8.11E+01 2.28E+00 2.23E+02 8.28E+01 5.70E+03 2.51E+06 1.01E+02 3.87E+01 1.93E+03 9.16E+01 1.82E+01 4.83E-01 1.00E+02 6.89E+00 3.40E+00 Table 5 The score of the swarm intelligence algorithms on test functions. Table 5 F1 F2 F3 F4 F5 MCT MF VF MCT MF VF MCT MF VF MCT MF VF MCT MF VF PSO 10 3 2 10 1 1 10 1 1 6 3 3 1 3 2 AFSA 5 6 6 5 5 6 5 6 6 2 1 1 3 7 6 ABC 6 10 10 6 10 10 6 10 10 7 10 10 7 5 5 WPS 9 7 7 9 7 7 9 7 7 10 7 8 10 10 10 GWO 2 5 5 2 4 4 2 4 5 3 5 7 4 8 8 CSA 7 4 4 7 3 3 7 2 2 8 4 4 8 2 4 WOA 4 1 3 4 2 2 4 3 3 5 2 2 6 1 3 SSA2017 3 9 9 3 9 9 3 8 8 4 6 5 5 6 7 SBO 1 8 8 1 8 8 1 9 9 1 9 9 2 9 9 SSA2020 8 2 1 8 6 5 8 5 4 9 8 6 8 4 1 F6 F7 F8 F9 F10 MCT MF VF MCT MF VF MCT MF VF MCT MF VF MCT MF VF PSO 10 2 1 10 8 5 10 5 2 10 6 1 7 6 3 AFSA 5 5 5 5 3 7 2 4 4 2 3 6 4 1 2 ABC 6 7 7 6 10 10 6 10 10 6 10 10 6 8 8 WPS 9 8 8 9 4 3 9 8 8 9 1 9 10 5 5 GWO 2 4 4 2 1 9 3 3 5 3 8 7 2 7 7 CSA 7 1 2 7 6 2 7 1 6 7 5 5 8 3 6 WOA 4 3 3 4 9 8 5 2 3 5 4 3 5 4 4 SSA2017 3 6 6 3 7 4 4 6 7 4 7 2 3 10 10 SBO 1 10 10 1 2 6 1 9 9 1 9 8 1 9 9 SSA2020 8 9 9 8 5 1 7 7 1 8 2 4 8 2 1 Table 6 Equipment parameters. Table 6 Equipment type parameters quantity note Chiller Rated cooling capacity 755 kW, rated power 147.8 kw 3 Chilled water pump Rated flow 120 m 3 / h , rated power 22 kw 4 one standby Cooling water pump Rated flow 200 m 3 / h , rated power 30 kw 4 one standby Cooling Tower Rated flow 250 m 3 / h , rated power 7.5 kw 3 Table 7 The model parameters of the chillers. Table 7 a 1 a 2 Chiller 1 2.31 2.41 Chiller 2 0.379 0.381 Chiller 3 1.76 1.85 Table 8 The model parameters of the pumps. Table 8 b 0 b 1 b 2 Cooling water pump 1 0.001672 −0.2468 12.8766 Cooling water pump 2 0.001808 −0.2916 15.9470 Cooling water pump 3 0.001404 −0.1793 8.3015 Cooling water pump 4 0.001493 −0.2135 11.4189 Chilled water pump 1 0.003974 −0.3820 12.2331 Chilled water pump 2 0.003229 −0.2688 8.2529 Chilled water pump 3 0.004061 −0.3885 12.3248 Chilled water pump 4 0.003009 −0.2168 5.7655 Table 9 The model parameters of the cooling towers. Table 9 f 1 f 2 Cooling Tower 1 0.187 0.377 Cooling Tower 2 0.190 0.411 Cooling Tower 3 0.177 0.310 Table 10 Boundary condition of the HVAC system. Table 10 parameter Lower boundary condition Upper boundary condition t w , e , L 5 ° C 14 ° C Δ t w , e 1 ° C 5 ° C t w , c , L 28 ° C 38 ° C Δ t w , c 1 ° C 7 ° C G w , e 60 m 3 / h 360 m 3 / h G w , c 100 m 3 / h 600 m 3 / h Table 11 The environmental conditions and fundamental parameters of the cases. Table 11 Chiller 1 Chiller 2 Chiller 3 Ambient temperature (°C) Ambient humidity Cooling load (kW) actual power (kW) predicted power (kW) Prediction error a∗ b∗ a∗ b∗ a∗ b∗ Case 1 7.6 153.9 / / / / 28.4 86.1 324.57 121.37 119.52 1.52% Case 2 / / / / 8.2 146.2 33.7 63.8 580.86 191.75 202.2 5.45% Case 3 8.1 134.6 7.8 151.3 / / 34.3 72.6 1194.29 454.66 440.34 3.15% Case 4 7.4 136.7 6.9 151.3 7.3 134.5 35 74.2 2031.68 678.82 690.11 1.67% a∗ Optimal chilled water outlet temperature (°C). b∗ Optimal cooling water flow ( m 3 / h ). Table 12 The performance on target functions. Table 12 case Results PSO AFSA ABC WPA GWO CSA WOA SSA2017 SBO SSA2020 case 1 Time(s) 69.65 569.69 138.97 2658.06 73.29 71.07 73.98 67.63 74.56 75.25 mean power(kW) 92.61 92.62 92.61 92.61 92.75 92.61 92.61 92.61 93.12 92.61 Variance 0.0000 0.0003 0.0000 0.0000 0.0003 0.0000 0.0000 0.0000 0.0023 0.0000 case 2 Time(s) 76.76 589.81 141.63 2863.61 79.07 69.69 99.31 74.01 75.71 77.02 mean power(kW) 171.54 171.64 171.54 171.54 171.89 171.54 171.54 171.54 174.1 171.54 Variance 0.0000 0.0002 0.0000 0.0000 0.0006 0.0000 0.0000 0.0000 0.0152 0.0000 case 3 Time(s) 101.85 909.56 204.96 3767.82 112.43 104.02 113.28 108.60 113.71 114.09 mean power(kW) 352.55 357.21 346.52 355.23 351.62 353.89 378.40 356.65 383.87 352.37 Variance 3.52 130.41 0.00 90.24 2.28 61.83 42.12 26.01 0.15 2.31 case 4 Time(s) 119.48 856.38 203.01 3459.10 117.54 108.80 148.82 102.81 111.64 122.80 mean power(kW) 535.14 592.37 519.65 563.42 593.08 534.13 526.55 524.59 615.99 544.34 Variance 3.04 178.64 0.00 151.03 151.81 66.16 1.08 1.79 0.22 9.45 Research on optimal control of HVAC system using swarm intelligence algorithms Yurun Miao Writing \u2013 review & editing Writing \u2013 original draft Validation Software Methodology Investigation Formal analysis Data curation Conceptualization Ye Yao Writing \u2013 review & editing Methodology ∗ Xiaoxi Hong Writing \u2013 review & editing Methodology Lei Xiong Writing \u2013 review & editing Software Methodology Investigation Fuqing Zhang Writing \u2013 review & editing Wanting Chen Writing \u2013 review & editing Institute of Refrigeration and Cryogenics, School of Mechanical Engineering, Shanghai Jiao Tong University, 800 Dongchuan Rd., Shanghai, 200240, China Institute of Refrigeration and Cryogenics School of Mechanical Engineering Shanghai Jiao Tong University 800 Dongchuan Rd. Shanghai 200240 China Institute of Refrigeration and Cryogenics, School of Mechanical Engineering, Shanghai Jiao Tong University, 800 Dongchuan Rd., Shanghai, 200240, China ∗ Corresponding author. Energy conservation in buildings is of vital importance for solving the problem of global warming and energy scarcity in today's world. In this paper, we discuss the optimal control methods of the heating, ventilation, and air-conditioning (HVAC) system using swarm intelligence algorithms to reduce energy consumption of buildings. The performances of ten optimization algorithms are compared. The results on test functions manifest the artificial bee colony algorithm (ABC) exhibits the best performance among the focused optimization algorithms. Taking a real HVAC system as an example, the holistic energy models of equipment in the HVAC system are established and validated. Then, the focused algorithms are used for the optimal control of a real HVAC system aiming at energy conservation. The simulated results based on 24-h real operation data show that the energy-saving ratio through by the ABC can reach 24.07% on average. The work in this study will contribute to the building energy conservation and carbon neutral development in the future. Keywords HVAC system Swarm intelligence algorithm Energy conversation Optimal control Data availability Data will be made available on request. 1 Introduction 1.1 Research background Climate change, characterized by global warming, has caused increasing concern among the public about reducing energy consumption and protecting the environment [1] [\u2013] [3]. Buildings account for over one-third of global energy consumption and produce more than 40% of total carbon dioxide emissions [4]. Building energy conservation is a global trend in development [5]. Reducing the energy consumption of buildings is crucial for achieving the goal of sustainable cities and communities. The HVAC system is a major contributor to building energy consumption, accounting for 40\u201360% of a building's total energy use [6]. Optimizing the operation of HVAC systems can greatly reduce a building's energy consumption throughout its lifetime and contribute to energy savings and carbon reduction [7]. 1.2 Literature reviews 1.2.1 Energy-saving control of HVAC system For the optimal control of the HVAC system, a lot of meaningful research work has been done by previous researchers. Some established the holistic model of the system and optimized it in terms of energy saving or energy saving together with thermal comfort. With a more in-depth study of the system and advances in control technology, more and more optimization methods have been developed. Li et al. [8] proposed an agent-based distributed holistic optimization framework and presented a series of data-oriented optimization models that cater to the needs of an increasingly extensive monitoring network. Zhao et al. [9] proposed an air ventilation strategy for the energy-saving control of air-side free cooling. Chen et al. [10] investigated a reinforcement learning control strategy to minimize energy consumption and thermal discomfort in HVAC systems. Roy et al. [11] compared several machine learning classifier in the field of windows-opening detection, which aids in optimizing operational loads. Porowski [12] proposed an energy-saving optimization method based on the holistic HVAC system for the energy optimization selection. The results indicate potential reductions in annual primary energy demand of 4.4\u20136.5% for thermodynamic processing, and 2.5\u20134.3% for the combined transfer and thermodynamic processing of air. Xiong et al. [13] proposed a semi-physical model to describe the static characteristics of typical HVAC systems. A genetic algorithm was applied to find the best operating point of the HAVC system to minimize power consumption within indoor temperature constraints. They developed a method to evaluate the energy-saving potential of HVAC systems while considering the measurement uncertainties of operational data. Su et al. [14] investigated the impacts of delays in the distributed optimal control of HVAC system. In the study conducted by Shi et al. [15], a method was proposed to assess the energy-saving capacity of HVAC system, considering measurement uncertainties inherent in the operational data. Song et al. [16] proposed a novel two-stage scheduling method for the precise and private regulation of HVAC systems. This approach employed a distributed framework to enhance the accuracy and privacy of HVAC regulation. Akgüç et al. [17] proposed sophisticated transformation measures aimed at enhancing the energy efficiency of HVAC system. The findings demonstrated that in high-rise residential buildings, the implementation of a decentralized heat recovery fan system in conjunction with a demand control ventilation strategy will result in a yearly reduction of 39% in energy consumption. Schito et al. [18] conducted a multi-objective optimization study of the HVAC control system in museums, focusing on balancing the comfort of tourists, energy consumption of the building, and preservation of the integrity of artworks. Passos et al. [19] established an HVAC system model that includes sunshade, skylight, and heat pump components, and applied nonlinear optimization to determine the optimal operating parameters in an effort to reduce building energy consumption. Zeng et al. [20] employed Bayesian algorithm to reduce the calculation time of model predictive control (MPC) optimization based on HVAC system model and avoid local optimal value. Researchers have examined the physical characteristics of a specific component in the HVAC system to achieve local energy saving by optimizing its operating conditions. Sun et al. [21] applied the equilibrium optimization (EO) algorithm in solving optimal chiller loading (OCL) problem. By comparing several traditional algorithms, they found that the EO algorithm performed well in solving OCL problems on simulation experiments. Ye et al. [22] proposed a multi-layer optimal operation and management framework of water chillers that was used to operate multiple chillers and reduce system operation costs while meeting the cooling load. Deymi-Dashtebayaz et al. [23] studied the simultaneous use of economizer for air source heat pumps in a data center. Considine [24] designed a new air handing unit (AHU) inlet using numerical calculation method to reduce the system energy consumption. Wang et al. [25] built a chiller (AHU) model for energy-saving control, and an MPC strategy was proposed. Wijaya et al. [26] proposed a method that integrates Artificial Neural Network (ANN) and Genetic Algorithm (GA) to optimize the flow of the chilled water pump in order to enhance the efficiency of the building cooling system. Alavy et al. [27] found that the filter used in HVAC systems equipped with electronically commutated motor (ECM) fans exhibits a higher unit power consumption efficiency compared to those equipped with permanent split capacitor (PSC) motor fans. Raman et al. [28] established the coil model of the HVAC system, and studied the control effect and energy saving potential of MPC under different weather conditions. Wang et al. [29] proposed a sequential event-driven optimization (SEDO) strategy for the decoupling control of pipeline network in the HVAC system, which showed 4.03% energy reduction compared to the traditional strategy. The literature reviewed highlights the diverse optimization techniques utilized to reduce energy consumption in HVAC systems. While researchers have focused on optimizing the energy efficiency of the entire system or specific components, these studies still have certain limitations. Specifically, research on energy-saving optimization control of HVAC systems under multivariate conditions is insufficient. Swarm intelligence algorithms, however, present significant advantages in addressing this issue. 1.2.2 Swarm intelligence algorithm The swarm intelligence algorithm has been wildly applied in the field of optimal control of HVAC system. Zakia Afroz et al. [30] used NARX to develop a real-time prediction model for various indoor environmental parameters and HVAC energy consumption. With this model, particle swarm optimization algorithm (PSO) was applied to provide optimal control settings for HVAC system. Without compromising indoor comfort, the energy saving rate could reach 7.8%.A.U.Weerasuriya et al. [31] evaluated four optimization algorithms and three decision-making techniques for multi-objective-based optimization for a lift-up building design. A novel sensor fault detection and self-correction method based on decentralized network structure was proposed by Wang el.al [32]. to address the actual engineering problems. With this method, a revised decentralized genetic algorithm (DGA) was proposed, which can locate the faulty sensor and eliminate measurement error efficiently. Andrew Kusiak et al. [33] used neural network to establish a prediction model of HVAC system, and developed a strength multi-objective particle swarm optimization algorithm (S-MOPSO) algorithm to obtain the optimal solution. This method reduces the energy consumption of the HVAC system while maintaining indoor thermal comfort. Based on a database, Zhou et al. [34] used the Multi-Layer Perceptron (MLP) neural network to establish the load forecasting model of HVAC system. The ABC and the PSO are used to optimize the parameters of the model. Li et al. [35] introduced a revised PSO algorithm based on the computational fluid dynamics (CFD) model. This new algorithm offered advantages in terms of both low computational cost and high optimization performance. Yu et al. [36] established a model of an HVAC system incorporating a double-circuit cooling coil and proposed a method based on PSO for optimizing the flow and temperature of the chilled water. Yelisetti et al. [37] established a mathematical model for calculating the energy consumption cost of residential buildings. They utilized various optimization algorithms based on swarm intelligence to optimize different building parameters and evaluated the effectiveness and performance of each algorithm. Deng et al. [38] presented a novel optimization solution utilizing Quantum Annealing for MPC of Rooftop Units (RTU), characterized by a faster calculation speed and improved accuracy. Zhang et al. [39] compared ANN and GA in the regulation of indoor air quality, with the proposed indexes that effectively demonstrate the influence of pollutant distribution on the well-being of the occupants. Chen et al. [40] used two swarm intelligence algorithms to locate the pollutant sources of unknown height in an unventilated indoor environment. Kumar et al. [41] used a hybrid model based on PSO and extreme learning machine (ELM) to predict the indoor temperature and energy consumption of the HVAC system. The aforementioned literature review emphasizes the utilization of swarm intelligence algorithms to optimize HVAC systems. Various algorithms, including the PSO, the S-MOPSO, and the ABC, have been employed in conjunction with mathematical models and neural networks to accomplish energy conservation, fault detection, and load prediction. Despite several accomplishments, there remain certain research gaps. Certain classical swarm intelligence algorithms have yet to be applied to HVAC systems, and a comparison among different swarm intelligence algorithms has not been performed. 1.3 The overview of this paper Based on the analysis of the current state of research concerning the optimal control of the HVAC system, previous researchers have done significant work. The swarm intelligence algorithm has been applied in building modelling and optimizing control. While many optimization algorithms have been applied to the optimal control of the HVAC systems, there is a lack of research that compares the performance of different swarm intelligence algorithms for optimizing HVAC systems with regard to energy savings. By conducting a comparative analysis of the optimization effects of different algorithms on test functions and applying these algorithms to a comprehensive model of an HVAC system, the present study endeavors to address this research gap. The structure of this paper is presented in Fig. 1 .The main contributions of this paper are as follows: 1) The performances of ten types of swarm intelligence optimization algorithms on the test function are evaluated in terms of optimization ability, stability and efficiency. To facilitate a fair comparison, a weighted comparison method is proposed and used to compare the algorithms. 2) The performances of ten optimization algorithms in the holistic energy consumption model under different conditions is discussed, and the ABC is applied simulatively to a HVAC system for typical daily analysis to verify its energy saving potential. 2 Comprehensive performance of the focused swarm intelligence algorithms 2.1 The focused swarm intelligence algorithms The swarm intelligence algorithm involves a series of steps, including the initialization of particles, the update of particles, the evaluation of particles, the determination of whether termination conditions have been met, and the termination or continuation of the cycle, as illustrated in Fig. 2 . Initializing particles refers to the process of distributing particles within a specified range in order to approximate the desired solution, using predetermined distribution rules. Updating particles involves using prescribed rules to modify the position of particles based on their own historical fitness values and interactions with other particles. Evaluating particles involves assessing the fitness of each particle using a chosen method, such as an objective function. The cycle will be terminated and the particle with the highest fitness will be output as the desired solution if the specified termination conditions are met. If the termination conditions are not met, the cycle will continue. Based on different objects of imitation, a lot of swarm intelligence algorithms have been developed. The algorithms discussed in this paper are listed in Table 1 , including classical methods such as the PSO, the AFSA as well as the newer algorithms the SBO and the SSA2020. Some of the optimization algorithms have simple rules that govern their behavior, for example the PSO. Other algorithms employ a population-based approach, wherein the population is divided into different categories with different behaviors, for instance the ABC, the WPS, the GWO, the SBO, and the SSA2020. Additionally, some algorithms employ a strategy wherein individuals are allowed to choose different behaviors randomly or according to certain rules, such as the AFSA, the CSA, the SSA2017, the WOA. Details about these algorithms can be found in the appendix. 2.2 Test functions The optimization control problem for HVAC systems possesses characteristics of high dimensionality and multiple local optima [37,52]. Therefore, the performance of optimization algorithms for HVAC system optimization problems is validated by comparing their performance on test functions that exhibit these properties. Test functions are also a commonly used method for validating the properties of optimization algorithms [53,54]. To fully investigate the performance of the optimization algorithms, unimodal, multimodal, separable, and no-separable test functions are used. Test functions and their characteristics are shown in Table 2 . 2.3 Performance on test functions 2.3.1 Parameter setting In swarm intelligence algorithms, the number of individuals and the maximum number of iterations are significant parameters. To ensure consistent evaluation criteria when comparing different algorithms, the number of individuals in the population and the maximum number of iterations are set to 50 and 500, respectively. The test functions have a dimensionality of 30. The parameter settings of these optimization algorithms are determined in terms of their best performance, adopting the common settings in applications or the settings that have been proven to be more effective. The model parameters of algorithms are shown in Table 3 . 2.3.2 Convergency analysis Fig. 3 presents the convergence curves of the focused algorithms on various test functions. The x-axis represents the number of iterations of the optimization algorithm, and the y-axis represents the minimum value that the optimization algorithm has found. The convergence curves suggest that most of the algorithms perform well on the simple unimodal and separable test functions F1\u2013F6. However, some of the algorithms struggle to locate the optimal solution on the multimodal functions F7\u2013F10, which have multiple extreme points. Among all the algorithms, the ABC shows a strong ability for optimization. It achieves the best results on six test functions and performed well on the others. In particular, on the complex multimodal functions F7, F8 and F9, the ABC is the only algorithm that is able to quickly locate the optimal solution. It can be inferred from the convergence curve that the main advantage of the ABC algorithm is its ability to converge faster in the early stages and avoid getting trapped in local optima. As a result, it outperforms the other algorithms on the complex multimodal functions F7, F8 and F9, being the only one capable of quickly locating the optimal solution. 2.3.3 Performance and analysis Fifty repeated simulation experiments of the optimization algorithm are carried out for each test function. To evaluate the comprehensive performance of the algorithms, three indexes, e.g., convergence time, fitness and stability, are suggested. Totally fifty times of tests have been made. The mean convergence time (MCT) and mean fitness (MF) of each algorithm are obtained based on the results of all the tests. The stability of the algorithm could be indicated by the variances of fitness (VF) of all the tests. The test results are given in Table 4 . It can be seen from Table 4 that the PSO converged in the shortest time. This may due to the simplicity of its iteration rules. In addition, the solution time of the WPS, the CSA, and the WPS is also shorter than that of the other algorithms, demonstrating their efficiency. The SBO took significantly longer to reach convergence, which may be attributed to the repeated random steps when updating the location of each individual. The performance of the algorithms on high-dimensional test functions varied. Among the ten objective functions, the ABC demonstrated the best performance on most test functions, outperforming the other swarm intelligence algorithms included in the comparison. The SBO, the SSA2017, and the WPA algorithms also performed well on some functions. The variance between the results indicates the stability of the algorithm. The algorithm with the higher MF also has the higher VF, possibly due to the large fitness when optimization fails. To evaluate the comprehensive performance of the algorithms, a scoring system is used based on the sorted results of each performance index. The performance scores of the ten algorithms are presented in Table 5 , where the algorithm with the highest value is assigned a score of 1 point, followed by 2 points for the second highest value, and so on. In engineering applications, time requirements for algorithms are often of the lower priority compared to accuracy and stability. Therefore, a weighting system is developed based on actual engineering experience to incorporate these factors into the total score for each algorithm. The weight for MCT is set to 0.2, and the weight for MF and VF is set to 0.4. The total score for each algorithm is calculated by adding the scores on the test functions, with a maximum possible score of 100 points. As shown in Fig. 4 , the ABC achieves the highest score, while the WOA, PSO, and CSA algorithms showed poor performance. (1) S c o r e = ∑ 1 10 0.2 × s c o r e ( M C T ) + 0.4 × s c o r e ( M F ) + 0.4 × s c o r e ( V F ) Through analyzing the performance of the focused optimization algorithms on test functions, the ABC has been found more suitable for optimization problems in HVAC systems. This is mainly attributed to the ABC algorithm's capability of conserving computational resources by only maintaining the quantity and distribution of particles, rather than maintaining particle velocity and other information. Additionally, the algorithm effectively exploits global information to prevent falling into local optima. To validate this point, an energy consumption model based on a real HVAC system was established to verify the performance of the swarm intelligence algorithm. 3 Case study This section provides a detailed description of the steps involved in developing, establishing, and validating the model for the HVAC system studied, which is installed in a hotel located in Quzhou, Zhejiang, China. The system consists of three chillers, four chilled water pumps, four cooling water pumps, and three cooling towers, as illustrated in Fig. 5 and Table 6 . The chilled water pumps are connected in parallel, while the cooling water pumps are connected in series with the cooling towers and chillers. Only one of the two cooling water pumps connected to the first chiller is operational. The water flow and temperature of each part are collected by corresponding sensors. During normal operation of the HVAC system, one cooling water pump and one chilled water pump are kept in a standby state. The standby cooling water pump is the one connected to the first chiller, and the cooling water pumps are arranged in a series configuration with the cooling towers and chillers. 3.1 Models and objective function In order to accurately model the HVAC system, it is imperative to establish models for the coefficient of performance (COP) of the chillers, the models of water pumps, and the models of cooling towers. The necessary data for this task are collected from the Quzhou hotel. 90% of the data used to establish the model, while the remaining 10% are employed for validation. 3.1.1 Model for chiller The chiller's coefficient of performance can be expressed as: (2) C O P = r ( t c + 273.15 t e + 273.15 − 1 ) r + a 1 ⋅ t c + 273.15 t e + 273.15 − a 2 where, r is the load rate of the chiller, t c is the condensation temperature ( ° C ), t e is the evaporation temperature ( ° C ), a 1 and a 2 are parameters to be determined. (3) t c = t w , c , E + Q c c w G w , c ( 1 − e − U A c c w G w , c ) (4) t e = t w , e , E − Q e c w G w , e ( 1 − e − U A e c w G w , e ) (5) Q c = c w G w , c ( t w , c , E − t w , c , L ) (6) Q e = c w G w , e ( t w , e , E − t w , e , L ) t c and t e are determined by inlet water temperature and heat exchange condition of the condenser and evaporator of chiller. t c is determined by the outlet temperature of cooling water t w , c , E ( ° C ) and cooling water flow rate G w , c ( k g / s ). t e is determined by the inlet temperature of chilled water t w , e , E ( ° C ) and chilled water flow rate G w , e ( k g / s ). t w , c , L ( ° C ) is the outlet temperature of cooling water, t w , e , L ( ° C ) is the outlet water of chilled water. U A c and U A e are the total heat transfer coefficient of the condenser and evaporator ( W / ° C ). The power of chiller is a function with cooling load, outlet temperature of chilled water, and cooling water flow rate as input parameter: (7) P c h i l l e r = Q e C O P Q e is cooling load ( k W ),calculated according to the chilled water flow and the supply and return water temperature difference at the previous time: (8) Q e T = c w G w , e T − 1 ( t w , e , E T − 1 − t w , e , L T − 1 ) Based on the historical data of water chillers, a 1 and a 2 of the 3 chillers are fitted respectively. The fitting results are shown in Table 7 . With the chiller model, the COP of the chiller under different work conditions are predicted and compared with the COP of the actual operation. In Fig. 6 , the abscissa represents the predicted COP and the ordinate represents the actual COP. The red line and bule line represent the error range of ±5%. It is illustrated that the models have good fit results for the chiller, and the deviation of 73.45% of the fitting results are below 5%. 3.1.2 Model for cooling/chilled water pump The power and flow of the pump are fitted by the following formula: (9) P p u m p = b 0 G w 2 + b 1 G w + b 2 Where, P p u m p is the power of pump, b 0 、 b 1 、 b 2 are obtained by fitting the field data of water pump with the least square method, G w is the water flow ( m 3 / h ). The chilled water pumps are connected in parallel, and the mean temperature t m e a n （ ° C ） can be calculated according to the following formula: (10) t m e a n = ∑ G w i t w i ∑ G w i Where c w is the specific heat capacity of water ( J / ( ° C ⋅ k g ) ), t w is water temperature ( ° C ). For the pumps, the historical data generated by the actual operation is applied for modeling, and their coefficients are listed in Table 8 . With the model, it is possible to use the pump flow rate to calculate the pump power. The fitting curves of the chilled pumps and the cooling pumps are illustrated in Fig. 7 and Fig. 8 . 3.1.3 Model for cooling tower Temperature difference before and after the cooling water passes through the cooling tower: (11) t w , L = t w , E − η t o w e r G a ( h s a − h a ) c w G w Where t w , L is the temperature of the outlet water of the cooling tower, t w , E is the temperature of the inlet water of the cooling tower, η t o w e r is the efficiency of the cooling tower, G a is the air volume of the cooling tower fan ( k g / h ), G w is the cooling tower water flow ( k g / h ), h s a is the enthalpy of saturated wet air at the cooling water inlet of cooling tower ( k J / k g ), h a is the wet air value under ambient temperature and humidity ( k J / k g ), which is calculated with air temperature t ( ° C ) and air humidity hu ( % ). For cooling towers in the system: (12) η t o w e r = 1 − e − N T U ( 1 − m ) 1 − m ⋅ e − N T U ( 1 − m ) (13) N T U = f 1 ( G w G a ) f 2 (14) m = G a c a G w c w Where f 1 and f 2 is the cooling tower-related coefficient, N T U is number of transfer unit, c a is the specific heat capacity of air ( J / ( k g ⋅ ° C ) ), c w is the specific heat capacity of water ( J / ( k g ⋅ ° C ) ). For the cooling towers of the system, based on the data generated by operation, the fitting results are presented in the Table 9 . Using the fitted coefficients, the actual operating parameters of the cooling tower are substituted into the corresponding model and compared with the measured values (see Table 10). The results, shown in Fig. 9 , indicate that the cooling tower model has good quality, as the temperature deviation is generally within ±0.5 °C. In this figure, each point represents a prediction, with the X-coordinate representing the predicted cooling water outlet temperature and the Y-coordinate representing the actual cooling water outlet temperature. The cooling tower fans in this system operate at a fixed frequency, such that the real-time power of each cooling tower is always equal to its rated power. (15) P c o o l i n g t o w e r = P c o o l i n g t o w e r _ r a t e d 3.1.4 System model and boundary conditions Based on the models of the above components, the energy consumption model of the whole system is established, which is represented by the following objective function: (16) F o b j = P s y s t e m = ∑ P c h i l l e r i + ∑ P c h i l l e d _ w a t e r _ p u m p j + ∑ P c o o l i n g _ w a t e r _ p u m p k + ∑ P c o o l i n g t o w e r l = F ( Q L o a d , t , h u , G w , c , t w , e , L ) In this function, cooling load Q L o a d , temperature t , humidity h u are input parameters consistent with actual conditions, while G w , c and T w , e , L are the parameters to be adjusted. When these parameters are determined, other required physical quantities are obtained according to the conservation of mass and the conservation of energy. P c h i l l e r could be calculated by Equations (2) and (7). P c h i l l e d _ w a t e r _ p u m p and P c o o l i n g _ w a t e r _ p u m p could be calculated with Equation (9). P c o o l i n g t o w e r could be calculated with Equation (15). The goal of the optimization algorithm is to find the appropriate G w , c and T w , e , L that minimize the energy consumption of the system. The system energy consumption calculation process is illustrated in Fig. 10 . After sensing the parameters Q L o a d , t , and h u , the current chilled water inlet temperature and the set chilled water output temperature are utilized to calculate the chilled water flow, power consumption, and chiller evaporation temperature t e . The cooling water flow, power consumption, and cooling tower energy consumption are calculated based on the current cooling water flow rate. The chiller power consumption is obtained by iterating the calculation of the evaporation temperature computed from the circulating cold water flow rate and determining the condensation temperature. Finally, the power consumption of the entire system is obtained along with the current parameter settings. The initial strategy for this system did not involve optimization and instead relied on a fixed-point strategy that maintained the chilled water outlet temperature at 7 °C while operating the chilled water and cooling water pumps at full flow rate, which corresponds to 50Hz. The cooling load is distributed evenly among the operational chillers. Considering the safe use restrictions of the actual equipment, the boundary conditions of some important parameters are set as follows: 3.2 Results and discussions 3.2.1 Performance on target function With the holistic model of the HVAC system available, the ten swarm intelligence algorithms are applied to minimize power consumption with optimal operating parameters. The effectiveness of these algorithms is verified through four cases. The baseline for each case is the fixed-point strategy, and the experimental conditions are based on actual operating data from the system. The optimal control points for each case including chilled water outlet temperature environmental temperature and cooling water flow are presented as a* and b* in Table 11 . The ambient temperature, ambient humidity, cooling load, actual power, predicted power, and prediction error are also presented in Table 11. Each algorithm run 10 times for each case. The total time consumed, mean power, and the variance of the results are listed in the Table 12 . The model developed in section 3.1 demonstrates strong predictive ability for the holistic energy consumption of the system, with the prediction error mostly below 5%, and the largest error being 5.45%. The optimal chilled water outlet temperature is higher than the fixed point of 7 °C, and the optimal cooling water flow is 23.05%\u201332.7% lower than the fixed point of 200 m 3 / h . It strikes a balance between increasing the evaporating temperature to reduce the energy consumption of the chiller and decreasing the flow rate to reduce the energy consumption of the water pump while lowering the condensing temperature. It can be observed that almost all of the ten swarm intelligence algorithms successfully identified the control points that minimize energy consumption for cases 1 and 2, with energy-saving rate of 22.5% and 10.5%. This may be attributed to the simple structure of the single unit with only two parameters. The AFSA, the GWO and the SBO may occasionally fail in optimization, resulting in a higher mean power and variance. SBO exhibits slightly inferior performance in both optimization capability and stability. For cases 3 and 4, as multiple chillers with local optimal control points are involved, the differences between algorithms are highlighted. It can be seen that different swarm intelligence algorithms were able to reduce energy consumption in the system compared to the original control strategy, although there were variations in energy-saving performance. The ABC algorithm achieved the best energy-saving effect in both cases, with energy-saving rates of 21.3% and 24.7%, indicating that it reaches the global optimal control point in each experiment. Among the algorithms, the CSA, the SSA2017, and the PSO have better results in terms of total time consumed for the three cases. The time spent by the algorithms is generally acceptable, with the exception of AFSA and WPA. Comparing cases 1, 2 with cases 3, 4, it can be observed that as the load increases, multiple chillers were turned on, which presented certain challenges for the optimization process. 3.2.2 Typical day analysis To investigate the energy-saving potential of the ABC in the HVAC system, data from a typical day of operation at the Quzhou hotel is used. Fig. 11 shows the ambient temperature and humidity over a 24-h period. The meteorological conditions on this day are representative of the typical summer climate in Quzhou, with high temperatures and low humidity during the day and low temperatures and high humidity at night. The ABC is applied to optimize the HVAC system on a typical day, and the results are shown in Fig. 12 . The air conditioning system at the hotel operates 24 h per day. The variation in the cooling load follows the changes in meteorological conditions, with a high load during the day and a low load at night. The optimization algorithm demonstrated a good energy-saving effect, with a potential energy-saving rate of 20%\u201330%. When the temperature is high throughout the day and the load is high, the energy-saving rate reached 27%. At night, when the cooling load was low, the energy-saving rate is around 20%. There is variance in energy-saving rate with difference cooling load. A possible explanation is that when the cooling load is low, the large flow rate and the small temperature difference of unoptimized condition is more serious, bringing additional energy waste. For the whole day, the energy-saving rate is 24.07%. The system COP for this typical day is 3.67 with optimal control, 2.78 with fixed-point control. The optimized chilled water outlet temperature and cooling water flow rate for the typical day are presented in the Fig. 13 . Compared to the original fixed frequency control strategy, the average chilled water outlet temperature is 0.95 °C higher than the fixed value, while the cooling water flow rate is 42.9 m 3 / h lower than the fixed value. This has resulted in an increased COP of the chiller and reduced energy consumption of the water pump, thus improving the overall system efficiency. 4 Conclusion This study applied ten swarm intelligence-based algorithms to investigate their potential for energy-saving optimization control in an HVAC system. A holistic model of an HVAC system in Quzhou, China is developed and validated using field data. Models for each component of the system, including the chillers, pumps, and cooling towers, are also obtained and verified. The performance of the algorithms is evaluated using ten test functions with different characteristics. A weighted algorithm is proposed based on practical engineering experience, and the results indicated that the Artificial Bee Colony algorithm (ABC) performed the best on the test functions after the weighted calculation of each index. When applied to the holistic model, the ABC achieved the highest energy-saving rate and lowest variance across four cases. On a typical day analysis, the total energy-saving rate of the ABC is 24.07%. In future work, we plan to improve the accuracy of the HVAC system model by refining the modeling method and improving the quality of the data. The aim is to investigate the use of more advanced swarm intelligence algorithms for energy-saving optimization control in HVAC systems and to apply these algorithms in real control settings. CRediT authorship contribution statement Yurun Miao: Writing \u2013 review & editing, Writing \u2013 original draft, Validation, Software, Methodology, Investigation, Formal analysis, Data curation, Conceptualization. Ye Yao: Writing \u2013 review & editing, Methodology. Xiaoxi Hong: Writing \u2013 review & editing, Methodology. Lei Xiong: Writing \u2013 review & editing, Software, Methodology, Investigation. Fuqing Zhang: Writing \u2013 review & editing. Wanting Chen: Writing \u2013 review & editing. Declaration of competing interest The authors declare that they have no known competing financial interests or personal relationships that could have appeared to influence the work reported in this paper. Appendix PSO： The PSO simulates the foraging behavior of birds to solve the optimal solution of single-mode or multi-mode problems. This is a classical swarm intelligence algorithm. In the algorithm, each particle represents a candidate solution. By constantly moving with its historical optimal position and the global optimal position, the optimal solution of the objective function within the parameter range is searched. Its basic steps are as follows: Step 1: Initializes particles in parameter space. For the r-dimensional problem, each particle has R components, which represents the position of the particle in the parameter space. The position of particles can be generated randomly or according to a specific distribution. The number of particles is an optional parameter in the algorithm. For a particle swarm containing N particles, it can be described by the following formula: X = { x 1 , x 2 , x 3 , ⋯ , x N } x i = ( x i 1 , x i 2 , x i 3 , ⋯ , x i r ) , i = 1,2,3 , ⋯ , N Step 2: Evaluate particles. The fitness can be obtained by substituting the position of each example into the objective function f ( x ) . Each particle has a historical optimal position p h i s t o r y , and all particles have a global optimal position p g l o b a l . p h i s t o r y i = { p h i s t o r y i , f ( p h i s t o r y i ) ≤ f ( x i ) x i , f ( p h i s t o r y i ) > f ( x i ) , i = 1,2,3 , ⋯ , N p g l o b a l = x i , i f f ( x i ) = min ( f ( x 1 ) , f ( x 2 ) , f ( x 3 ) , ⋯ , f ( x n ) ) Step 3: Update particles. According to the historical optimal value p h i s t o r y of the particles and the global optimal value p g l o b a l , and the parameters set by the algorithm, the particles are given a moving speed v t to update the position of the particles. c 1 and c 2 is the acceleration factor, determining the speed at which a particle approach p h i s t o r y and p g l o b a l . r 1 and r 2 are random numbers satisfying uniform distribution [0,1]. v i t + 1 = v i t + c 1 r 1 ( p h i s t o r y i , t − x i t ) + c 2 r 2 ( p g l o b a l t − x i t ) x i t + 1 = x i t + v i t + 1 Step 4: Evaluate whether the termination conditions are met. Termination conditions generally include reaching the maximum number of iterations or not significantly improving the solution within a certain number of iterations. If the termination condition is reached, the optimal solution is output; otherwise, proceed to step 2. AFSA The AFSA simulates the foraging behavior of fish groups to achieve optimization according to the characteristic that the place with the largest number of fish in the water area is the place with the largest amount of nutrients in the water area. The algorithm mainly uses the three basic behaviors of fish: foraging, crowding and tail chasing. It uses the top-down optimization mode to start from constructing the bottom behavior of the individual, and through the local optimization of each individual in the fish school, to achieve the purpose of highlighting the global optimal value in the group. Step 1: Initialize settings, including the population size N, the initial position of every artificial fish, the visual field of artificial fish V i s u a l f i l e d , step size S t e p , crowding factor δ and repetition times t r y n u m b e r . Step 2: Calculate the fitness value of each individual in the initial fish school, and assign the optimal artificial fish state and its value to the bulletin board. Step 3: For each fish, the objective function is utilized to calculate the results of the following four behaviors: foraging, clustering, tail chasing, and random. Perform the behavior in which the result is the best. Foraging behavior: The artificial fish randomly selects a state in its field of vision and compares its fitness with its position to judge whether it is moving forward. If there is no advance, continue to randomly select and compare in the field of view, unless try number is reached. X j = X i + V i s u a l f i l e d * R a n d o m X i t + 1 = X i t + X j − X i t \u2016 X j − X i t \u2016 * S t e p * R a n d o m , i f f ( X j ) < f ( X i ) Clustering behavior: The artificial fish searches the number of partners η f and the center position X c in the current field of view. If f ( X c ) ∙ η f < δ ∙ f ( X i ) , it indicates that the center position of the partner is in good condition and not too crowded. Then move one step towards the center position of the partner. X i t + 1 = X i t + X c − X i t \u2016 X c − X i t \u2016 * S t e p * R a n d o m , i f f ( X c ) ∙ η f < δ ∙ f ( X i ) Tail chasing behavior: The artificial fish explores the optimal position X v b e s t of the neighboring fish and the number of partners η f in V i s u a l f i l e d . If f ( X v b e s t ) ∙ η f < δ ∙ f ( X i ) , the current position moves to the optimal neighbor fish. X i t + 1 = X i t + X v b e s t − X i t \u2016 X v b e s t − X i t \u2016 * S t e p * R a n d o m , i f f ( X v b e s t ) ∙ η f < δ ∙ f ( X i ) Random behavior: This is default behavior of foraging behavior, which means that artificial fish move randomly in the field of vision. X i t + 1 = X i t + S t e p * R a n d o m Step 4: After each running action, the currently found optimal value will be updated. If the iteration end condition is met, the cycle will end and the optimal value of the current record will be output; otherwise, continue. ABC The standard ABC divides the artificial bee colony into three categories: employed bee, onlooker bee, and scout bee by simulating the honey-collecting mechanism of the actual bee. The goal of the whole colony is to find the largest nectar source. In the standard ABC, bees use the previous honey source information to find new honey sources and share the honey source information with observation bees; Observe the bees waiting in the hive and look for new honey sources according to the information shared by the bees; The task of detecting bees is to find a new valuable source of honey. They randomly look for a source of honey near the hive. Step 1: Initialization. Within the range of parameter selection, randomly generate food sources equal to the number of scout bees. Each food source corresponds to a solution vector of the optimization problem. x m is a solution vector, l i and u i are Upper and lower limits of the i t h dimension. x m i = l i + r a n d ( 0,1 ) ∙ ( u i − l i ) Step 2: Employed Bees Phase. Employed bees look for food sources with more nectar near the food sources in their memory, and assess the fitness of new food source. v m is the position of the new food source, φ m i is a random number within the range [−a, a], x k is a food source randomly selected within their memory. v m i = x m i + φ m i ( x m i − x k i ) Step 3: Onlooker Bees Phase. Onlooker Bees follow employed bees according to the fitness of the latter. For employed bees, the higher the fitness, the greater the probability of being followed. For each food source, the probability of being followed p m can be calculated by the following formula: p m = f ( x m ) ∑ m = 1 N f ( x m ) Therefore, food sources with higher fitness will attract more onlookers. Step 4: Scout Bees Phase. Employed bees that have not been promoted since a certain number of iterations will become scout bees. They will abandon their original food source and find a new solution. Step 5: Record the global optimal solution and judge whether the termination condition is met, so as to judge whether to enter the cycle or output the optimal solution. WPS The wolf swarm algorithm solves the optimization problem by initializing the wolf swarm, competing for the wolf king, calling from the wolf king, besieging prey, and updating the wolf swarm. The steps of the wolf swarm algorithm are as follows: Step 1: Initialization. Let the scale of the artificial wolf pack be N, the dimension of the search space be D, and the spatial position of the ith artificial wolf can be expressed as: X i = ( x i 1 , x i 2 , x i 3 , ⋯ , x i D ) , 1 ≤ i ≤ N x i d = x min + r a n d * ( x max − x min ) Step 2: Competition for the wolf king. Select Q artificial wolves with the best moderate value (the best position) as competitors. The artificial wolf searches around them. Whenever the fitness value of the searched position is higher than the original position, it updates its current position. Each wolf repeated the search until the maximum number of searches was reached. After the search, the wolf king has the highest location fitness. The best (Q-1) artificial wolf other than the wolf king is regarded as a probe wolf. The wolf wanders around at random. Step 3: The wolf king starts the calling behavior by howling and calls up the surrounding K fierce wolves to move closer to the position of the head wolf. g t is the position of the wolf king, the fierce wolf move step length is s t e p m , then the position of the fierce wolf i at the t+1 iteration in the d-dimensional variable space is expressed as: x i t + 1 = x i t + s t e p m * ( g t − x i t ) | g t − x i t | During the fierce wolf's attack, if the position of the fierce wolf i is better than that of the wolf king, the wolf king will make a calling behavior, otherwise continue to attack until the distance from the head wolf is less than the set distance. Step 4: Besieging prey. The fierce wolf close to the prey and the probe wolf are combined to besiege the prey, and the position of the head wolf closest to the prey is regarded as the moving position of the prey. Let the position of the prey in the d-dimensional space be G d k , fierce wolf attack step length is s t e p a ,the siege behavior of wolves can be expressed as: x i t + 1 = x i t + λ ∙ s t e p a ∙ | G t − x i t | Step 5: Remove u artificial wolves with the worst objective function in the algorithm, and then randomly generate u new artificial wolves. Judge whether the termination conditions are met. GWO The algorithm is an optimization search method inspired by the predatory activities of gray wolves. It includes the steps of the gray wolf's social hierarchy, tracking, encircling, and attacking prey. The specific steps are as follows. Step 1: Initialize the population and build the gray wolf social hierarchy model. Calculate the fitness of each individual in the population, and mark the 3 Gy wolves with the best fitness as α , β , δ , and the rest as ω . The optimization process of the GWO is mainly guided by the best three solutions ( α , β , δ ) in each generation of the population. Step 2: Encircling Prey. The gray wolf will gradually approach the prey and surround it when preying on it. The mathematical model of this behavior is as follows: X t + 1 = X t − ( 2 a ∘ r 1 − a ) ∘ ( 2 r 2 ∘ X p t − X t ) r 1 and r 2 are random vectors in [0, 1]. ∘ is the hadamard product operator. In the whole iteration process, a decreases linearly from 2 to 0. X p is the position of the prey and X is the position of the wolf. Step 3: Hunting. To simulate the search behavior of gray wolves, it is assumed that α , β , δ have a strong ability to identify the location of potential prey. Therefore, during each iteration, the best 3 Gy wolves in the current population are retained, and then the positions of other gray wolves are updated according to their position information. X t + 1 = X 1 + X 2 + X 3 3 X 1 = X α − A 1 ∘ D α , X 2 = X β − A 2 ∘ D β , X 3 = X δ − A 3 ∘ D δ D α = C 1 ∘ X α − X , D β = C 2 ∘ X β − X , D δ = C 3 ∘ X δ − X , X is the position vector, and D is the distance victor. Step 4: Judge whether the termination condition is reached. If not, continue hunting. CSA One of the intelligent behaviors of crows is that they hide their surplus food in a specific hiding place and recall the location of food when necessary. In addition, crows have greedy habit. They will follow other crows to find their hiding places. If a crow finds a hiding place for other crows, it will steal the hidden food. The Crow search algorithm imitates the crow's behavior of hiding and eating to solve the optimization problem. Its basic steps are as follows: Step 1: Initialization. Define decision variables: the number of crows N , the maximum number of iterations i t e r max , flight distance f l , and perception probability AP. Step 2: Initialize crow's position and memory. N crows are randomly distributed in a d-dimensional search space. In the first iteration, it is assumed that crows hide their food in the initial position. Step 3: Update crow position. In each iteration, crow i will randomly select a crow j to track. If crow i is not detected, it flies to the hiding place of crow j; Otherwise, crow i will fly one step at random. x i t + 1 = { x i t + r i ⋅ f l i t ⋅ ( m j t − x i t ) , r j ≥ A P j t a r a n d o m p o s i t i o n , o t h e r w i s e If the new position adaptation value of crow I is higher, it will fly to the new position, otherwise, it will stay in its original position. Step 4: Update the fitness value of each crow's new position and check whether the termination conditions are met. WOA The WOA simulates the unique search method and hunting mechanism of humpback whales, mainly including three important stages: hunting prey, bubble net hunting, and hunting prey. The position of each humpback whale in the WOA represents a potential solution. By constantly updating the position of the whale in the solution space, the global optimal solution is finally obtained. Step 1: Set the number of whales N and the maximum number of iterations T max of the algorithm, and initialize the position information. Step 2: Calculate the fitness of each whale, find the current optimal whale position. Judging whether to prey on the bubble net according to the random number p. The strategies for updating the predator location of bubble net are as follows: X t + 1 = | X t * − X t | ∙ e b l ∙ cos ( 2 π l ) + X t That is, whales approach their prey in a logarithmic spiral and search continuously during their journey. Step 3: If no bubble net predation is carried out in step 2, judge whether to carry out hunting and predation according to the value of A. If the absolute value of the coefficient vector a is less than 1, the prey is surrounded. X t + 1 = X t − A ∙ ( 2 r 2 ∙ X p t − X t ) A = 2 a × r 1 − a Otherwise, the prey will be randomly searched globally: Step 4: At the end of position update, calculate the fitness of each whale and compare it with the position of the previously reserved optimal whale. If it is better than that, replace it with a new optimal solution. Judge whether the termination conditions are met. SSA2017 The salp swarm algorithm simulates the group behavior of the slaps chain, in which leaders explore the holistic situation while followers fully explore the local area, so that the chain has strong global exploration and local development ability. Step 1: Initialization. Suppose all salps are randomly distributed in the solution space. According to the fitness value, the swarm of salps is sorted, and the position of the salp with the best fitness is set as the current food position. Step 2: Update position. Rank the remaining n-1 individuals according to their fitness. The first half with the highest fitness is set as leader and the rest as followers. X d is the position of the leader, F d is the position of the food source, the leader position is updated according to the following formula: X d = { F d + c 1 ( ( u b − l b ) c 2 + l b ) , c 3 ≥ 0.5 F d − c 1 ( ( u b − l b ) c 2 + l b ) , c 3 < 0.5 The follower position is updated according to the following formula: X i t + 1 = X i t + X i − 1 t − X i t 2 Step 3: Update the food sources and slaps\u2019 position repeatedly until the termination conditions are met. Take global optimal value as output. SBO Satin bowerbird optimizer is a swarm intelligence algorithm that simulates the courtship behavior of adult male satin bowerbirds in nature. Mature males spend most of their time building courtship pavilions to attract females. In addition, male birds' probability of success in courtship is increased by stealing materials from other males. According to the living habits of satin bowerbird, the SBO algorithm is divided into the following steps: Step 1:Random generation of initial swarm. In d-dimensional space, n birds are randomly generated. For each individual, its initial position can be described by the following formula: X i = ( X i 1 , X i 2 , X i 3 , ⋯ , X i d ) Step 2: Calculate the fitness value of each individual, and then calculate the proportion of this fitness value in the total population fitness value, indicating the probability that the individual will be selected in the selection process. P r o b i = f i t i ∑ n = 1 N f i t n f i t i = { 1 1 + f ( x i ) , f ( x i ) ≥ 0 1 + | f ( x i ) | , f ( x i ) < 0 Step 3: Update. According to historical experience and information sharing mechanisms, the male bird will constantly adjust the location of the courtship Pavilion. x i k t + 1 = x i k t + λ k ( ( x j k + x g l o b a l , k 2 ) − x i k t ) λ k = α 1 + P j x i k t is the k-dimensional component of the ith individual of the tth generation. x j k is the k-dimensional component of the currently searched optimal position, which is determined by roulette selection mechanism. x g l o b a l , k is the k-dimensional component of the current optimal position of the entire population. λ k is step factor, which is calculated with maximum threshold for step size α and probability of target location being selected P j . Step 4: Individual variation At the end of the algorithm cycle, the individual randomly mutates with a certain probability to simulate the process of male stealing materials. x i k t + 1 ∼ N ( x i k t , σ 2 ) σ = z ( v a r max − v a r min ) z is the scaling factor and v a r max , v a r min is the upper and lower limits of the variable x i . Step 5: The old population and the population obtained from variation are combined to form a combined population, and the cost function values of all individuals in the combined population are sorted from small to large. The individual with the smallest function value is retained, and the remaining individuals are eliminated. At this time, if the termination conditions are met, the best position and its corresponding optimal value are output, otherwise, the iteration is continued. SSA2020 The sparrow search algorithm is mainly inspired by the sparrows' foraging behavior and anti-predation behavior. The algorithm divides sparrows into producers and scroungers, and both of them have the ability to detect predators. Once the predator is detected, an early warning signal will be sent. When the warning signal is large enough, the sparrow will fly to the safe area at random. Producers and scroungers determine their identities according to their fitness values, and they can convert to each other while maintaining the same proportion. Step 1: Initialization. Sparrows are randomly distributed in the solution space and are divided into producers and scroungers according to fitness. Step 2: Update producer location. i is the current iteration, X i , j t is the value of the j t h dimension of the ith sparrow at iteration t . i t e r max is the largest number of iterations. α is random number in ( 0,1 ] . R 2 ∈ [ 0,1 ] and S T ∈ [ 0.5,1.0 ] represent the alarm value and the safety threshold respectively. Q is a random number. L is a vector that each component is 1. For the producer, update the position according to the following formula: X i , j t + 1 = { X i , j t ∙ e − i α ⋅ i t e r max , i f R 2 < S T X i , j t + Q ⋅ L , i f R 2 ≥ S T Step 3: Update scroungers location. As for the scroungers, when they find that the producers have found good food, they will immediately compete for food. X p is the position of the producer. X w o r s t is the current global worst position. A is a 1 × d matrix that each element inside is randomly 1 or -1, and A + = A T ( A A T ) − 1 . For the scrounger, update the position according to the following formula: X i , j t + 1 = { Q ∙ e − X w o r s t t − X i , j t α ⋅ i t e r max , i f i > n 2 X P t + 1 + | X i , j t − X P t + 1 | ∙ A + ∙ L , O t h e r w i s e Step 4: In case of danger, the sparrow will move to a safe place in the following ways. X b e s t is the current global optimal location. β is the step size control parameter, K ∈ [ − 1,1 ] is a random number. f i is the fitness value of the present sparrow. f g and f w are the current global best and worst fitness values, respectively. ε is a small constant to avoid zero-division-error. These sparrows, which are aware of the danger, update the position according to the following formula: X i , j t + 1 = { X b e s t t + β | X i , j t − X b e s t t | , i f f i > f g X i , j t + K ∙ ( | X i , j t − X b e s t t | ( f i − f w ) + ε ) , i f f i = f g Step 5: Obtain the current optimal position and judge whether the conditions are met. References [1] L. Fu Y. Cao S.-Y. Kuang H. Guo Index for climate change adaptation in China and its application Adv. Clim. Change Res. 12 5 Oct. 2021 723 733 10.1016/j.accre.2021.06.006 L. Fu, Y. Cao, S.-Y. Kuang, and H. Guo, \u201cIndex for climate change adaptation in China and its application,\u201d Advances in Climate Change Research, vol. 12, no. 5, pp. 723-733, Oct. 2021, doi: 10.1016/j.accre.2021.06.006. [2] Z.-W. Yan J. Wang J.-J. Xia J.-M. Feng Review of recent studies of the climatic effects of urbanization in China Adv. Clim. Change Res. 7 3 Sep. 2016 154 168 10.1016/j.accre.2016.09.003 Z.-W. Yan, J. Wang, J.-J. Xia, and J.-M. Feng, \u201cReview of recent studies of the climatic effects of urbanization in China,\u201d Advances in Climate Change Research, vol. 7, no. 3, pp. 154-168, Sep. 2016, doi: 10.1016/j.accre.2016.09.003. [3] F. Wahid M. Fayaz A. Aljarbouh M. Mir M. Aamir Imran Energy consumption optimization and user comfort maximization in smart buildings using a hybrid of the firefly and genetic algorithms Energies 13 17 Aug. 2020 4363 10.3390/en13174363 F. Wahid, M. Fayaz, A. Aljarbouh, M. Mir, M. Aamir, and Imran, \u201cEnergy Consumption Optimization and User Comfort Maximization in Smart Buildings Using a Hybrid of the Firefly and Genetic Algorithms,\u201d Energies, vol. 13, no. 17, p. 4363, Aug. 2020, doi: 10.3390/en13174363. [4] Z. Wang J. Liu Y. Zhang H. Yuan R. Zhang R.S. Srinivasan Practical issues in implementing machine-learning models for building energy efficiency: moving beyond obstacles Renew. Sustain. Energy Rev. 143 Jun. 2021 110929 10.1016/j.rser.2021.110929 Z. Wang, J. Liu, Y. Zhang, H. Yuan, R. Zhang, and R. S. Srinivasan, \u201cPractical issues in implementing machine-learning models for building energy efficiency: Moving beyond obstacles,\u201d Renewable and Sustainable Energy Reviews, vol. 143, p. 110929, Jun. 2021, doi: 10.1016/j.rser.2021.110929. [5] N. Iqbal Imran D.H. Kim IoT task management mechanism based on predictive optimization for efficient energy consumption in smart residential buildings Energy Build. 257 Feb. 2022 111762 10.1016/j.enbuild.2021.111762 Imran, N. Iqbal, and D. H. Kim, \u201cIoT Task Management Mechanism Based on Predictive Optimization for Efficient Energy Consumption in Smart Residential Buildings,\u201d Energy and Buildings, vol. 257, p. 111762, Feb. 2022, doi: 10.1016/j.enbuild.2021.111762. [6] J.C. Solano E. Caamaño-Martín L. Olivieri D. Almeida-Galárraga HVAC systems and thermal comfort in buildings climate control: an experimental case study Energy Rep. 7 Sep. 2021 269 277 10.1016/j.egyr.2021.06.045 J. C. Solano, E. Caamano-Martin, L. Olivieri, and D. Almeida-Galarraga, \u201cHVAC systems and thermal comfort in buildings climate control: An experimental case study,\u201d Energy Reports, vol. 7, pp. 269-277, Sep. 2021, doi: 10.1016/j.egyr.2021.06.045. [7] M. Farahnak M. Farzaneh-Gord M. Deymi-Dashtebayaz F. Dashti Optimal sizing of power generation unit capacity in ICE-driven CCHP systems for various residential building sizes Appl. Energy 158 Nov. 2015 203 219 10.1016/j.apenergy.2015.08.050 M. Farahnak, M. Farzaneh-Gord, M. Deymi-Dashtebayaz, and F. Dashti, \u201cOptimal sizing of power generation unit capacity in ICE-driven CCHP systems for various residential building sizes,\u201d Applied Energy, vol. 158, pp. 203-219, Nov. 2015, doi: 10.1016/j.apenergy.2015.08.050. [8] Z. Li J. Zhang Data-oriented distributed overall optimization for large-scale HVAC systems with dynamic supply capability and distributed demand response Build. Environ. Jun. 2022 109322 10.1016/j.buildenv.2022.109322 Z. Li and J. Zhang, \u201cData-oriented distributed overall optimization for large-scale HVAC systems with dynamic supply capability and distributed demand response,\u201d Building and Environment, p. 109322, Jun. 2022, doi: 10.1016/j.buildenv.2022.109322. [9] W. Zhao H. Li S. Wang Energy differential-based optimal outdoor air ventilation strategy for high-tech cleanrooms concerning free cooling and its performance evaluation Build. Environ. 231 Mar. 2023 110025 10.1016/j.buildenv.2023.110025 W. Zhao, H. Li, and S. Wang, \u201cEnergy differential-based optimal outdoor air ventilation strategy for high-tech cleanrooms concerning free cooling and its performance evaluation,\u201d Building and Environment, vol. 231, p. 110025, Mar. 2023, doi: 10.1016/j.buildenv.2023.110025. [10] Y. Chen Optimal Control of HVAC and Window Systems for Natural Ventilation through Reinforcement Learning 2018 11 Y. Chen, \u201cOptimal control of HVAC and window systems for natural ventilation through reinforcement learning,\u201d p. 11, 2018. [11] E. de Rautlin de la Roy T. Recht A. Zemmari P. Bourreau L. Mora Deep learning models for building window-openings detection in heating season Build. Environ. 231 Mar. 2023 110019 10.1016/j.buildenv.2023.110019 E. de Rautlin de la Roy, T. Recht, A. Zemmari, P. Bourreau, and L. Mora, \u201cDeep learning models for building window-openings detection in heating season,\u201d Building and Environment, vol. 231, p. 110019, Mar. 2023, doi: 10.1016/j.buildenv.2023.110019. [12] M. Porowski Energy optimization of HVAC system from a holistic perspective: operating theater application Energy Convers. Manag. 182 Feb. 2019 461 496 10.1016/j.enconman.2018.12.003 M. Porowski, \u201cEnergy optimization of HVAC system from a holistic perspective: Operating theater application,\u201d Energy Conversion and Management, vol. 182, pp. 461-496, Feb. 2019, doi: 10.1016/j.enconman.2018.12.003. [13] W. Xiong J. Wang A semi-physical static model for optimizing power consumption of HVAC systems Control Eng. Pract. 2020 11 W. Xiong and J. Wang, \u201cA semi-physical static model for optimizing power consumption of HVAC systems,\u201d Control Engineering Practice, p. 11, 2020. [14] B. Su S. Wang W. Li Impacts of uncertain information delays on distributed real-time optimal controls for building HVAC systems deployed on IoT-enabled field control networks Appl. Energy 300 Oct. 2021 117383 10.1016/j.apenergy.2021.117383 B. Su, S. Wang, and W. Li, \u201cImpacts of uncertain information delays on distributed real-time optimal controls for building HVAC systems deployed on IoT-enabled field control networks,\u201d Applied Energy, vol. 300, p. 117383, Oct. 2021, doi: 10.1016/j.apenergy.2021.117383. [15] W. Shi X. Jin Y. Wang Evaluation of energy saving potential of HVAC system by operation data with uncertainties Energy Build. 204 Dec. 2019 109513 10.1016/j.enbuild.2019.109513 W. Shi, X. Jin, and Y. Wang, \u201cEvaluation of energy saving potential of HVAC system by operation data with uncertainties,\u201d Energy and Buildings, vol. 204, p. 109513, Dec. 2019, doi: 10.1016/j.enbuild.2019.109513. [16] M. Song C. Gao S. Ma J. Meng K. Chen Distributed scheduling of HVACs based on transactive energy and ADMM Appl. Energy 325 Nov. 2022 119831 10.1016/j.apenergy.2022.119831 M. Song, C. Gao, S. Ma, J. Meng, and K. Chen, \u201cDistributed scheduling of HVACs based on transactive energy and ADMM,\u201d Applied Energy, vol. 325, p. 119831, Nov. 2022, doi: 10.1016/j.apenergy.2022.119831. [17] A. Akgüç A.Z. Yılmaz Determining HVAC system retrofit measures to improve cost-optimum energy efficiency level of high-rise residential buildings J. Build. Eng. 54 Aug. 2022 104631 10.1016/j.jobe.2022.104631 A. Akguc and A. Z. Yilmaz, \u201cDetermining HVAC system retrofit measures to improve cost-optimum energy efficiency level of high-rise residential buildings,\u201d Journal of Building Engineering, vol. 54, p. 104631, Aug. 2022, doi: 10.1016/j.jobe.2022.104631. [18] E. Schito P. Conti L. Urbanucci D. Testi Multi-objective optimization of HVAC control in museum environment for artwork preservation, visitors' thermal comfort and energy efficiency Build. Environ. 180 Aug. 2020 107018 10.1016/j.buildenv.2020.107018 E. Schito, P. Conti, L. Urbanucci, and D. Testi, \u201cMulti-objective optimization of HVAC control in museum environment for artwork preservation, visitors\u2019 thermal comfort and energy efficiency,\u201d Building and Environment, vol. 180, p. 107018, Aug. 2020, doi: 10.1016/j.buildenv.2020.107018. [19] L.A. de Araujo Passos P. van den Engel S. Baldi B. De Schutter Dynamic optimization for minimal HVAC demand with latent heat storage, heat recovery, natural ventilation, and solar shadings Energy Convers. Manag. 276 Jan. 2023 116573 10.1016/j.enconman.2022.116573 L. A. de Araujo Passos, P. van den Engel, S. Baldi, and B. De Schutter, \u201cDynamic optimization for minimal HVAC demand with latent heat storage, heat recovery, natural ventilation, and solar shadings,\u201d Energy Conversion and Management, vol. 276, p. 116573, Jan. 2023, doi: 10.1016/j.enconman.2022.116573. [20] Q. Lu L.D. González R. Kumar V.M. Zavala Bayesian optimization with reference models: a case study in MPC for HVAC central plants Comput. Chem. Eng. 154 Nov. 2021 107491 10.1016/j.compchemeng.2021.107491 Q. Lu, L. D. Gonzalez, R. Kumar, and V. M. Zavala, \u201cBayesian optimization with reference models: A case study in MPC for HVAC central plants,\u201d Computers & Chemical Engineering, vol. 154, p. 107491, Nov. 2021, doi: 10.1016/j.compchemeng.2021.107491. [21] F. Sun J. Yu A. Zhao M. Zhou Optimizing multi-chiller dispatch in HVAC system using equilibrium optimization algorithm Energy Rep. 2021 17 F. Sun, J. Yu, A. Zhao, and M. Zhou, \u201cOptimizing multi-chiller dispatch in HVAC system using equilibrium optimization algorithm,\u201d Energy Reports, p. 17, 2021. [22] Y. Ye R. Sharma F. Guo A multi-layer optimal chiller operation management framework 2016 IEEE Industry Applications Society Annual Meeting 2016 1 6 10.1109/IAS.2016.7731815 Y. Ye, R. Sharma, and F. Guo, \u201cA multi-layer optimal chiller operation management framework,\u201d in 2016 IEEE Industry Applications Society Annual Meeting, 2016, pp. 1-6. doi: 10.1109/IAS.2016.7731815. [23] M. Deymi-Dashtebayaz S. Valipour Namanlo A. Arabkoohsar Simultaneous use of air-side and water-side economizers with the air source heat pump in a data center for cooling and heating production Appl. Therm. Eng. 161 Oct. 2019 114133 10.1016/j.applthermaleng.2019.114133 M. Deymi-Dashtebayaz, S. Valipour Namanlo, and A. Arabkoohsar, \u201cSimultaneous use of air-side and water-side economizers with the air source heat pump in a data center for cooling and heating production,\u201d Applied Thermal Engineering, vol. 161, p. 114133, Oct. 2019, doi: 10.1016/j.applthermaleng.2019.114133. [24] B. Considine A. McNabola P. Kumar J. Gallagher A numerical analysis of particulate matter control technology integrated with HVAC system inlet design and implications on energy consumption Build. Environ. 211 Mar. 2022 108726 10.1016/j.buildenv.2021.108726 B. Considine, A. McNabola, P. Kumar, and J. Gallagher, \u201cA numerical analysis of particulate matter control technology integrated with HVAC system inlet design and implications on energy consumption,\u201d Building and Environment, vol. 211, p. 108726, Mar. 2022, doi: 10.1016/j.buildenv.2021.108726. [25] W. Wang Q. Zhou C. Pan F. Cao Energy-efficient operation of a complete Chiller-air handing unit system via model predictive control Appl. Therm. Eng. 201 Jan. 2022 117809 10.1016/j.applthermaleng.2021.117809 W. Wang, Q. Zhou, C. Pan, and F. Cao, \u201cEnergy-efficient operation of a complete Chiller-air handing unit system via model predictive control,\u201d Applied Thermal Engineering, vol. 201, p. 117809, Jan. 2022, doi: 10.1016/j.applthermaleng.2021.117809. [26] T. Kelvin Wijaya Sholahudin M. Idrus Alhamid K. Saito N. Nasruddin Dynamic optimization of chilled water pump operation to reduce HVAC energy consumption Therm. Sci. Eng. Prog. 36 Dec. 2022 101512 10.1016/j.tsep.2022.101512 T. Kelvin Wijaya, Sholahudin, M. Idrus Alhamid, K. Saito, and N. Nasruddin, \u201cDynamic optimization of chilled water pump operation to reduce HVAC energy consumption,\u201d Thermal Science and Engineering Progress, vol. 36, p. 101512, Dec. 2022, doi: 10.1016/j.tsep.2022.101512. [27] M. Alavy T. Li J.A. Siegel Energy use in residential buildings: analyses of high-efficiency filters and HVAC fans Energy Build. 209 Feb. 2020 109697 10.1016/j.enbuild.2019.109697 M. Alavy, T. Li, and J. A. Siegel, \u201cEnergy use in residential buildings: Analyses of high-efficiency filters and HVAC fans,\u201d Energy and Buildings, vol. 209, p. 109697, Feb. 2020, doi: 10.1016/j.enbuild.2019.109697. [28] N.S. Raman B. Chen P. Barooah On energy-efficient HVAC operation with Model Predictive Control: a multiple climate zone study Appl. Energy 324 Oct. 2022 119752 10.1016/j.apenergy.2022.119752 N. S. Raman, B. Chen, and P. Barooah, \u201cOn energy-efficient HVAC operation with Model Predictive Control: A multiple climate zone study,\u201d Applied Energy, vol. 324, p. 119752, Oct. 2022, doi: 10.1016/j.apenergy.2022.119752. [29] J. Wang T. Zhao Event-driven online decoupling control mechanism for the variable flow rate HVAC system based on the medium response properties Build. Environ. 218 Jun. 2022 109104 10.1016/j.buildenv.2022.109104 J. Wang and T. Zhao, \u201cEvent-driven online decoupling control mechanism for the variable flow rate HVAC system based on the medium response properties,\u201d Building and Environment, vol. 218, p. 109104, Jun. 2022, doi: 10.1016/j.buildenv.2022.109104. [30] Z. Afroz G.M. Shafiullah T. Urmee M.A. Shoeb G. Higgins Predictive modelling and optimization of HVAC systems using neural network and particle swarm optimization algorithm Build. Environ. 209 Feb. 2022 108681 10.1016/j.buildenv.2021.108681 Z. Afroz, G. M. Shafiullah, T. Urmee, M. A. Shoeb, and G. Higgins, \u201cPredictive modelling and optimization of HVAC systems using neural network and particle swarm optimization algorithm,\u201d Building and Environment, vol. 209, p. 108681, Feb. 2022, doi: 10.1016/j.buildenv.2021.108681. [31] A.U. Weerasuriya X. Zhang J. Wang B. Lu K.T. Tse C.-H. Liu Performance evaluation of population-based metaheuristic algorithms and decision-making for multi-objective optimization of building design Build. Environ. 198 Jul. 2021 107855 10.1016/j.buildenv.2021.107855 A. U. Weerasuriya, X. Zhang, J. Wang, B. Lu, K. T. Tse, and C.-H. Liu, \u201cPerformance evaluation of population-based metaheuristic algorithms and decision-making for multi-objective optimization of building design,\u201d Building and Environment, vol. 198, p. 107855, Jul. 2021, doi: 10.1016/j.buildenv.2021.107855. [32] S. Wang J. Xing Z. Jiang Y. Dai A novel sensors fault detection and self-correction method for HVAC systems using decentralized swarm intelligence algorithm Int. J. Refrig. 106 Oct. 2019 54 65 10.1016/j.ijrefrig.2019.06.007 S. Wang, J. Xing, Z. Jiang, and Y. Dai, \u201cA novel sensors fault detection and self-correction method for HVAC systems using decentralized swarm intelligence algorithm,\u201d International Journal of Refrigeration, vol. 106, pp. 54-65, Oct. 2019, doi: 10.1016/j.ijrefrig.2019.06.007. [33] A. Kusiak G. Xu F. Tang Optimization of an HVAC system with a strength multi-objective particle-swarm algorithm Energy 36 10 Oct. 2011 5935 5943 10.1016/j.energy.2011.08.024 A. Kusiak, G. Xu, and F. Tang, \u201cOptimization of an HVAC system with a strength multi-objective particle-swarm algorithm,\u201d Energy, vol. 36, no. 10, pp. 5935-5943, Oct. 2011, doi: 10.1016/j.energy.2011.08.024. [34] G. Zhou H. Moayedi M. Bahiraei Z. Lyu Employing artificial bee colony and particle swarm techniques for optimizing a neural network in prediction of heating and cooling loads of residential buildings J. Clean. Prod. 254 May 2020 120082 10.1016/j.jclepro.2020.120082 G. Zhou, H. Moayedi, M. Bahiraei, and Z. Lyu, \u201cEmploying artificial bee colony and particle swarm techniques for optimizing a neural network in prediction of heating and cooling loads of residential buildings,\u201d Journal of Cleaner Production, vol. 254, p. 120082, May 2020, doi: 10.1016/j.jclepro.2020.120082. [35] L. Li Y. Zhang J.C.H. Fung H. Qu A.K.H. Lau A coupled computational fluid dynamics and back-propagation neural network-based particle swarm optimizer algorithm for predicting and optimizing indoor air quality Build. Environ. 207 Jan. 2022 108533 10.1016/j.buildenv.2021.108533 L. Li, Y. Zhang, J. C. H. Fung, H. Qu, and A. K. H. Lau, \u201cA coupled computational fluid dynamics and back-propagation neural network-based particle swarm optimizer algorithm for predicting and optimizing indoor air quality,\u201d Building and Environment, vol. 207, p. 108533, Jan. 2022, doi: 10.1016/j.buildenv.2021.108533. [36] M. Yu Q. Chen X. Zhang Y. Zhao Y. Wang Y. Zheng An optimum control method for HVAC systems with double circuit cooling coil using particle swarm optimization algorithm Procedia Eng. 205 Jan. 2017 2273 2280 10.1016/j.proeng.2017.10.078 M. Yu, Q. Chen, X. Zhang, Y. Zhao, Y. Wang, and Y. Zheng, \u201cAn Optimum Control Method for HVAC Systems with Double Circuit Cooling Coil Using Particle Swarm Optimization Algorithm,\u201d Procedia Engineering, vol. 205, pp. 2273-2280, Jan. 2017, doi: 10.1016/j.proeng.2017.10.078. [37] S. Yelisetti V.K. Saini R. Kumar R. Lamba A. Saxena Optimal energy management system for residential buildings considering the time of use price with swarm intelligence algorithms J. Build. Eng. 59 Nov. 2022 105062 10.1016/j.jobe.2022.105062 S. Yelisetti, V. K. Saini, R. Kumar, R. Lamba, and A. Saxena, \u201cOptimal energy management system for residential buildings considering the time of use price with swarm intelligence algorithms,\u201d Journal of Building Engineering, vol. 59, p. 105062, Nov. 2022, doi: 10.1016/j.jobe.2022.105062. [38] Z. Deng X. Wang B. Dong Quantum computing for future real-time building HVAC controls Appl. Energy 334 Mar. 2023 120621 10.1016/j.apenergy.2022.120621 Z. Deng, X. Wang, and B. Dong, \u201cQuantum computing for future real-time building HVAC controls,\u201d Applied Energy, vol. 334, p. 120621, Mar. 2023, doi: 10.1016/j.apenergy.2022.120621. [39] T. Zhang X. Li Q. Zhao Y. Rao Control of a novel synthetical index for the local indoor air quality by the artificial neural network and genetic algorithm Sustain. Cities Soc. 51 Nov. 2019 101714 10.1016/j.scs.2019.101714 T. Zhang, X. Li, Q. Zhao, and Y. Rao, \u201cControl of a novel synthetical index for the local indoor air quality by the artificial neural network and genetic algorithm,\u201d Sustainable Cities and Society, vol. 51, p. 101714, Nov. 2019, doi: 10.1016/j.scs.2019.101714. [40] A. Chen Experimental study on 3D source localization in indoor environments with weak airflow based on two bionic swarm intelligence algorithms Build. Environ. 230 Feb. 2023 110020 10.1016/j.buildenv.2023.110020 A. Chen et al., \u201cExperimental study on 3D source localization in indoor environments with weak airflow based on two bionic swarm intelligence algorithms,\u201d Building and Environment, vol. 230, p. 110020, Feb. 2023, doi: 10.1016/j.buildenv.2023.110020. [41] S. Kumar S.K. Pal R. Singh A novel hybrid model based on particle swarm optimisation and extreme learning machine for short-term temperature prediction using ambient sensors Sustain. Cities Soc. 49 Aug. 2019 101601 10.1016/j.scs.2019.101601 S. Kumar, S. K. Pal, and R. Singh, \u201cA novel hybrid model based on particle swarm optimisation and extreme learning machine for short-term temperature prediction using ambient sensors,\u201d Sustainable Cities and Society, vol. 49, p. 101601, Aug. 2019, doi: 10.1016/j.scs.2019.101601. [42] J. Kennedy R. Eberhart Particle swarm optimization Proceedings of ICNN\u201995 - International Conference on Neural Networks 1995 IEEE Perth, WA, Australia 1942 1948 10.1109/ICNN.1995.488968 J. Kennedy and R. Eberhart, \u201cParticle swarm optimization,\u201d in Proceedings of ICNN\u201995 - International Conference on Neural Networks, Perth, WA, Australia: IEEE, 1995, pp. 1942-1948. doi: 10.1109/ICNN.1995.488968. [43] L. Xiaolei Q. Jixing S. Zhijiang A Method Based on Animal Commune Optimum Model: Artificial Fish Algorithm 2002 Systems Engineering-Theory & Practice 32 38 L. Xiaolei, Q. Jixing, and S. Zhijiang, \u201cA method based on animal commune optimum model: artificial fish algorithm,\u201d Systems Engineering-Theory & Practice, pp. 32-38, 2002. [44] D. Karaboga An Idea Based on Honey Bee Swarm for Numerical Optimization,\u201d Technical Report-Tr06 and others 2005 Erciyes university, engineering faculty, computer \u2026 D. Karaboga and others, \u201cAn idea based on honey bee swarm for numerical optimization,\u201d Technical report-tr06, Erciyes university, engineering faculty, computer \u2026, 2005. [45] C. Yang X. Tu J. Chen Algorithm of marriage in honey bees optimization based on the wolf pack search The 2007 International Conference on Intelligent Pervasive Computing 2007 IPC 2007) 462 467 10.1109/IPC.2007.104 C. Yang, X. Tu, and J. Chen, \u201cAlgorithm of Marriage in Honey Bees Optimization Based on the Wolf Pack Search,\u201d in The 2007 International Conference on Intelligent Pervasive Computing (IPC 2007), 2007, pp. 462-467. doi: 10.1109/IPC.2007.104. [46] S. Mirjalili S.M. Mirjalili A. Lewis Grey wolf optimizer Adv. Eng. Software 69 Mar. 2014 46 61 10.1016/j.advengsoft.2013.12.007 S. Mirjalili, S. M. Mirjalili, and A. Lewis, \u201cGrey Wolf Optimizer,\u201d Advances in Engineering Software, vol. 69, pp. 46-61, Mar. 2014, doi: 10.1016/j.advengsoft.2013.12.007. [47] A. Askarzadeh A novel metaheuristic method for solving constrained engineering optimization problems: crow search algorithm Comput. Struct. 169 Jun. 2016 1 12 10.1016/j.compstruc.2016.03.001 A. Askarzadeh, \u201cA novel metaheuristic method for solving constrained engineering optimization problems: Crow search algorithm,\u201d Computers & Structures, vol. 169, pp. 1-12, Jun. 2016, doi: 10.1016/j.compstruc.2016.03.001. [48] S. Mirjalili A. Lewis The whale optimization algorithm Adv. Eng. Software 95 May 2016 51 67 10.1016/j.advengsoft.2016.01.008 S. Mirjalili and A. Lewis, \u201cThe Whale Optimization Algorithm,\u201d Advances in Engineering Software, vol. 95, pp. 51-67, May 2016, doi: 10.1016/j.advengsoft.2016.01.008. [49] S. Mirjalili A.H. Gandomi S.Z. Mirjalili S. Saremi H. Faris S.M. Mirjalili Salp Swarm Algorithm: a bio-inspired optimizer for engineering design problems Adv. Eng. Software 114 Dec. 2017 163 191 10.1016/j.advengsoft.2017.07.002 S. Mirjalili, A. H. Gandomi, S. Z. Mirjalili, S. Saremi, H. Faris, and S. M. Mirjalili, \u201cSalp Swarm Algorithm: A bio-inspired optimizer for engineering design problems,\u201d Advances in Engineering Software, vol. 114, pp. 163-191, Dec. 2017, doi: 10.1016/j.advengsoft.2017.07.002. [50] S.H. Samareh Moosavi V. Khatibi Bardsiri Satin bowerbird optimizer: a new optimization algorithm to optimize ANFIS for software development effort estimation Eng. Appl. Artif. Intell. 60 Apr. 2017 1 15 10.1016/j.engappai.2017.01.006 S. H. Samareh Moosavi and V. Khatibi Bardsiri, \u201cSatin bowerbird optimizer: A new optimization algorithm to optimize ANFIS for software development effort estimation,\u201d Engineering Applications of Artificial Intelligence, vol. 60, pp. 1-15, Apr. 2017, doi: 10.1016/j.engappai.2017.01.006. [51] J. Xue B. Shen A novel swarm intelligence optimization approach: sparrow search algorithm Systems Science & Control Engineering 8 1 Jan. 2020 22 34 10.1080/21642583.2019.1708830 J. Xue and B. Shen, \u201cA novel swarm intelligence optimization approach: sparrow search algorithm,\u201d Systems Science & Control Engineering, vol. 8, no. 1, pp. 22-34, Jan. 2020, doi: 10.1080/21642583.2019.1708830. [52] X. Wei A. Kusiak M. Li F. Tang Y. Zeng Multi-objective optimization of the HVAC (heating, ventilation, and air conditioning) system performance Energy 83 Apr. 2015 294 306 10.1016/j.energy.2015.02.024 X. Wei, A. Kusiak, M. Li, F. Tang, and Y. Zeng, \u201cMulti-objective optimization of the HVAC (heating, ventilation, and air conditioning) system performance,\u201d Energy, vol. 83, pp. 294-306, Apr. 2015, doi: 10.1016/j.energy.2015.02.024. [53] H. Lu Y. Liu S. Cheng Y. Shi Adaptive online data-driven closed-loop parameter control strategy for swarm intelligence algorithm Inf. Sci. 536 Oct. 2020 25 52 10.1016/j.ins.2020.05.016 H. Lu, Y. Liu, S. Cheng, and Y. Shi, \u201cAdaptive online data-driven closed-loop parameter control strategy for swarm intelligence algorithm,\u201d Information Sciences, vol. 536, pp. 25-52, Oct. 2020, doi: 10.1016/j.ins.2020.05.016. [54] P.A. Simionescu A collection of bivariate nonlinear optimisation test problems with graphical representations Int. J. Math. Model. Numer. Optim. 10 4 Jan. 2020 365 398 10.1504/IJMMNO.2020.110704 P. A. Simionescu, \u201cA collection of bivariate nonlinear optimisation test problems with graphical representations,\u201d International Journal of Mathematical Modelling and Numerical Optimisation, vol. 10, no. 4, pp. 365-398, Jan. 2020, doi: 10.1504/IJMMNO.2020.110704.",
    "scopus-id": "85161294567",
    "coredata": {
        "eid": "1-s2.0-S0360132323004948",
        "dc:description": "Energy conservation in buildings is of vital importance for solving the problem of global warming and energy scarcity in today's world. In this paper, we discuss the optimal control methods of the heating, ventilation, and air-conditioning (HVAC) system using swarm intelligence algorithms to reduce energy consumption of buildings. The performances of ten optimization algorithms are compared. The results on test functions manifest the artificial bee colony algorithm (ABC) exhibits the best performance among the focused optimization algorithms. Taking a real HVAC system as an example, the holistic energy models of equipment in the HVAC system are established and validated. Then, the focused algorithms are used for the optimal control of a real HVAC system aiming at energy conservation. The simulated results based on 24-h real operation data show that the energy-saving ratio through by the ABC can reach 24.07% on average. The work in this study will contribute to the building energy conservation and carbon neutral development in the future.",
        "openArchiveArticle": "false",
        "prism:coverDate": "2023-08-01",
        "openaccessUserLicense": null,
        "prism:aggregationType": "Journal",
        "prism:url": "https://api.elsevier.com/content/article/pii/S0360132323004948",
        "dc:creator": [
            {
                "@_fa": "true",
                "$": "Miao, Yurun"
            },
            {
                "@_fa": "true",
                "$": "Yao, Ye"
            },
            {
                "@_fa": "true",
                "$": "Hong, Xiaoxi"
            },
            {
                "@_fa": "true",
                "$": "Xiong, Lei"
            },
            {
                "@_fa": "true",
                "$": "Zhang, Fuqing"
            },
            {
                "@_fa": "true",
                "$": "Chen, Wanting"
            }
        ],
        "link": [
            {
                "@_fa": "true",
                "@rel": "self",
                "@href": "https://api.elsevier.com/content/article/pii/S0360132323004948"
            },
            {
                "@_fa": "true",
                "@rel": "scidir",
                "@href": "https://www.sciencedirect.com/science/article/pii/S0360132323004948"
            }
        ],
        "dc:format": "application/json",
        "openaccessType": null,
        "pii": "S0360-1323(23)00494-8",
        "prism:volume": "241",
        "articleNumber": "110467",
        "prism:publisher": "Elsevier Ltd.",
        "dc:title": "Research on optimal control of HVAC system using swarm intelligence algorithms",
        "prism:copyright": "© 2023 Elsevier Ltd. All rights reserved.",
        "openaccess": "0",
        "prism:issn": "03601323",
        "dcterms:subject": [
            {
                "@_fa": "true",
                "$": "HVAC system"
            },
            {
                "@_fa": "true",
                "$": "Swarm intelligence algorithm"
            },
            {
                "@_fa": "true",
                "$": "Energy conversation"
            },
            {
                "@_fa": "true",
                "$": "Optimal control"
            }
        ],
        "openaccessArticle": "false",
        "prism:publicationName": "Building and Environment",
        "openaccessSponsorType": null,
        "prism:pageRange": "110467",
        "pubType": "fla",
        "prism:coverDisplayDate": "1 August 2023",
        "prism:doi": "10.1016/j.buildenv.2023.110467",
        "prism:startingPage": "110467",
        "dc:identifier": "doi:10.1016/j.buildenv.2023.110467",
        "openaccessSponsorName": null
    },
    "objects": {"object": [
        {
            "@category": "standard",
            "@height": "152",
            "@width": "388",
            "@_fa": "true",
            "$": "https://api.elsevier.com/content/object/eid/1-s2.0-S0360132323004948-gr5.jpg?httpAccept=%2A%2F%2A",
            "@multimediatype": "JPEG image file",
            "@type": "IMAGE-DOWNSAMPLED",
            "@size": "93622",
            "@ref": "gr5",
            "@mimetype": "image/jpeg"
        },
        {
            "@category": "standard",
            "@height": "229",
            "@width": "386",
            "@_fa": "true",
            "$": "https://api.elsevier.com/content/object/eid/1-s2.0-S0360132323004948-gr4.jpg?httpAccept=%2A%2F%2A",
            "@multimediatype": "JPEG image file",
            "@type": "IMAGE-DOWNSAMPLED",
            "@size": "93616",
            "@ref": "gr4",
            "@mimetype": "image/jpeg"
        },
        {
            "@category": "standard",
            "@height": "440",
            "@width": "533",
            "@_fa": "true",
            "$": "https://api.elsevier.com/content/object/eid/1-s2.0-S0360132323004948-gr7.jpg?httpAccept=%2A%2F%2A",
            "@multimediatype": "JPEG image file",
            "@type": "IMAGE-DOWNSAMPLED",
            "@size": "70826",
            "@ref": "gr7",
            "@mimetype": "image/jpeg"
        },
        {
            "@category": "standard",
            "@height": "187",
            "@width": "689",
            "@_fa": "true",
            "$": "https://api.elsevier.com/content/object/eid/1-s2.0-S0360132323004948-gr6.jpg?httpAccept=%2A%2F%2A",
            "@multimediatype": "JPEG image file",
            "@type": "IMAGE-DOWNSAMPLED",
            "@size": "113968",
            "@ref": "gr6",
            "@mimetype": "image/jpeg"
        },
        {
            "@category": "standard",
            "@height": "220",
            "@width": "535",
            "@_fa": "true",
            "$": "https://api.elsevier.com/content/object/eid/1-s2.0-S0360132323004948-gr1.jpg?httpAccept=%2A%2F%2A",
            "@multimediatype": "JPEG image file",
            "@type": "IMAGE-DOWNSAMPLED",
            "@size": "102511",
            "@ref": "gr1",
            "@mimetype": "image/jpeg"
        },
        {
            "@category": "standard",
            "@height": "423",
            "@width": "689",
            "@_fa": "true",
            "$": "https://api.elsevier.com/content/object/eid/1-s2.0-S0360132323004948-gr10.jpg?httpAccept=%2A%2F%2A",
            "@multimediatype": "JPEG image file",
            "@type": "IMAGE-DOWNSAMPLED",
            "@size": "138932",
            "@ref": "gr10",
            "@mimetype": "image/jpeg"
        },
        {
            "@category": "standard",
            "@height": "1021",
            "@width": "554",
            "@_fa": "true",
            "$": "https://api.elsevier.com/content/object/eid/1-s2.0-S0360132323004948-gr3.jpg?httpAccept=%2A%2F%2A",
            "@multimediatype": "JPEG image file",
            "@type": "IMAGE-DOWNSAMPLED",
            "@size": "259232",
            "@ref": "gr3",
            "@mimetype": "image/jpeg"
        },
        {
            "@category": "standard",
            "@height": "461",
            "@width": "386",
            "@_fa": "true",
            "$": "https://api.elsevier.com/content/object/eid/1-s2.0-S0360132323004948-gr2.jpg?httpAccept=%2A%2F%2A",
            "@multimediatype": "JPEG image file",
            "@type": "IMAGE-DOWNSAMPLED",
            "@size": "33642",
            "@ref": "gr2",
            "@mimetype": "image/jpeg"
        },
        {
            "@category": "standard",
            "@height": "353",
            "@width": "533",
            "@_fa": "true",
            "$": "https://api.elsevier.com/content/object/eid/1-s2.0-S0360132323004948-gr13.jpg?httpAccept=%2A%2F%2A",
            "@multimediatype": "JPEG image file",
            "@type": "IMAGE-DOWNSAMPLED",
            "@size": "124223",
            "@ref": "gr13",
            "@mimetype": "image/jpeg"
        },
        {
            "@category": "standard",
            "@height": "327",
            "@width": "533",
            "@_fa": "true",
            "$": "https://api.elsevier.com/content/object/eid/1-s2.0-S0360132323004948-gr12.jpg?httpAccept=%2A%2F%2A",
            "@multimediatype": "JPEG image file",
            "@type": "IMAGE-DOWNSAMPLED",
            "@size": "137697",
            "@ref": "gr12",
            "@mimetype": "image/jpeg"
        },
        {
            "@category": "standard",
            "@height": "358",
            "@width": "533",
            "@_fa": "true",
            "$": "https://api.elsevier.com/content/object/eid/1-s2.0-S0360132323004948-gr11.jpg?httpAccept=%2A%2F%2A",
            "@multimediatype": "JPEG image file",
            "@type": "IMAGE-DOWNSAMPLED",
            "@size": "115429",
            "@ref": "gr11",
            "@mimetype": "image/jpeg"
        },
        {
            "@category": "standard",
            "@height": "191",
            "@width": "689",
            "@_fa": "true",
            "$": "https://api.elsevier.com/content/object/eid/1-s2.0-S0360132323004948-gr9.jpg?httpAccept=%2A%2F%2A",
            "@multimediatype": "JPEG image file",
            "@type": "IMAGE-DOWNSAMPLED",
            "@size": "108252",
            "@ref": "gr9",
            "@mimetype": "image/jpeg"
        },
        {
            "@category": "standard",
            "@height": "435",
            "@width": "533",
            "@_fa": "true",
            "$": "https://api.elsevier.com/content/object/eid/1-s2.0-S0360132323004948-gr8.jpg?httpAccept=%2A%2F%2A",
            "@multimediatype": "JPEG image file",
            "@type": "IMAGE-DOWNSAMPLED",
            "@size": "62158",
            "@ref": "gr8",
            "@mimetype": "image/jpeg"
        },
        {
            "@category": "thumbnail",
            "@height": "86",
            "@width": "219",
            "@_fa": "true",
            "$": "https://api.elsevier.com/content/object/eid/1-s2.0-S0360132323004948-gr5.sml?httpAccept=%2A%2F%2A",
            "@multimediatype": "GIF image file",
            "@type": "IMAGE-THUMBNAIL",
            "@size": "73411",
            "@ref": "gr5",
            "@mimetype": "image/gif"
        },
        {
            "@category": "thumbnail",
            "@height": "130",
            "@width": "219",
            "@_fa": "true",
            "$": "https://api.elsevier.com/content/object/eid/1-s2.0-S0360132323004948-gr4.sml?httpAccept=%2A%2F%2A",
            "@multimediatype": "GIF image file",
            "@type": "IMAGE-THUMBNAIL",
            "@size": "71842",
            "@ref": "gr4",
            "@mimetype": "image/gif"
        },
        {
            "@category": "thumbnail",
            "@height": "164",
            "@width": "199",
            "@_fa": "true",
            "$": "https://api.elsevier.com/content/object/eid/1-s2.0-S0360132323004948-gr7.sml?httpAccept=%2A%2F%2A",
            "@multimediatype": "GIF image file",
            "@type": "IMAGE-THUMBNAIL",
            "@size": "17652",
            "@ref": "gr7",
            "@mimetype": "image/gif"
        },
        {
            "@category": "thumbnail",
            "@height": "60",
            "@width": "219",
            "@_fa": "true",
            "$": "https://api.elsevier.com/content/object/eid/1-s2.0-S0360132323004948-gr6.sml?httpAccept=%2A%2F%2A",
            "@multimediatype": "GIF image file",
            "@type": "IMAGE-THUMBNAIL",
            "@size": "71001",
            "@ref": "gr6",
            "@mimetype": "image/gif"
        },
        {
            "@category": "thumbnail",
            "@height": "90",
            "@width": "219",
            "@_fa": "true",
            "$": "https://api.elsevier.com/content/object/eid/1-s2.0-S0360132323004948-gr1.sml?httpAccept=%2A%2F%2A",
            "@multimediatype": "GIF image file",
            "@type": "IMAGE-THUMBNAIL",
            "@size": "70416",
            "@ref": "gr1",
            "@mimetype": "image/gif"
        },
        {
            "@category": "thumbnail",
            "@height": "134",
            "@width": "219",
            "@_fa": "true",
            "$": "https://api.elsevier.com/content/object/eid/1-s2.0-S0360132323004948-gr10.sml?httpAccept=%2A%2F%2A",
            "@multimediatype": "GIF image file",
            "@type": "IMAGE-THUMBNAIL",
            "@size": "73464",
            "@ref": "gr10",
            "@mimetype": "image/gif"
        },
        {
            "@category": "thumbnail",
            "@height": "164",
            "@width": "89",
            "@_fa": "true",
            "$": "https://api.elsevier.com/content/object/eid/1-s2.0-S0360132323004948-gr3.sml?httpAccept=%2A%2F%2A",
            "@multimediatype": "GIF image file",
            "@type": "IMAGE-THUMBNAIL",
            "@size": "76054",
            "@ref": "gr3",
            "@mimetype": "image/gif"
        },
        {
            "@category": "thumbnail",
            "@height": "164",
            "@width": "137",
            "@_fa": "true",
            "$": "https://api.elsevier.com/content/object/eid/1-s2.0-S0360132323004948-gr2.sml?httpAccept=%2A%2F%2A",
            "@multimediatype": "GIF image file",
            "@type": "IMAGE-THUMBNAIL",
            "@size": "10399",
            "@ref": "gr2",
            "@mimetype": "image/gif"
        },
        {
            "@category": "thumbnail",
            "@height": "145",
            "@width": "219",
            "@_fa": "true",
            "$": "https://api.elsevier.com/content/object/eid/1-s2.0-S0360132323004948-gr13.sml?httpAccept=%2A%2F%2A",
            "@multimediatype": "GIF image file",
            "@type": "IMAGE-THUMBNAIL",
            "@size": "74930",
            "@ref": "gr13",
            "@mimetype": "image/gif"
        },
        {
            "@category": "thumbnail",
            "@height": "134",
            "@width": "219",
            "@_fa": "true",
            "$": "https://api.elsevier.com/content/object/eid/1-s2.0-S0360132323004948-gr12.sml?httpAccept=%2A%2F%2A",
            "@multimediatype": "GIF image file",
            "@type": "IMAGE-THUMBNAIL",
            "@size": "79341",
            "@ref": "gr12",
            "@mimetype": "image/gif"
        },
        {
            "@category": "thumbnail",
            "@height": "147",
            "@width": "219",
            "@_fa": "true",
            "$": "https://api.elsevier.com/content/object/eid/1-s2.0-S0360132323004948-gr11.sml?httpAccept=%2A%2F%2A",
            "@multimediatype": "GIF image file",
            "@type": "IMAGE-THUMBNAIL",
            "@size": "73696",
            "@ref": "gr11",
            "@mimetype": "image/gif"
        },
        {
            "@category": "thumbnail",
            "@height": "61",
            "@width": "219",
            "@_fa": "true",
            "$": "https://api.elsevier.com/content/object/eid/1-s2.0-S0360132323004948-gr9.sml?httpAccept=%2A%2F%2A",
            "@multimediatype": "GIF image file",
            "@type": "IMAGE-THUMBNAIL",
            "@size": "69531",
            "@ref": "gr9",
            "@mimetype": "image/gif"
        },
        {
            "@category": "thumbnail",
            "@height": "164",
            "@width": "201",
            "@_fa": "true",
            "$": "https://api.elsevier.com/content/object/eid/1-s2.0-S0360132323004948-gr8.sml?httpAccept=%2A%2F%2A",
            "@multimediatype": "GIF image file",
            "@type": "IMAGE-THUMBNAIL",
            "@size": "16207",
            "@ref": "gr8",
            "@mimetype": "image/gif"
        },
        {
            "@category": "high",
            "@height": "675",
            "@width": "1721",
            "@_fa": "true",
            "$": "https://api.elsevier.com/content/object/eid/1-s2.0-S0360132323004948-gr5_lrg.jpg?httpAccept=%2A%2F%2A",
            "@multimediatype": "JPEG image file",
            "@type": "IMAGE-HIGH-RES",
            "@size": "220093",
            "@ref": "gr5",
            "@mimetype": "image/jpeg"
        },
        {
            "@category": "high",
            "@height": "1014",
            "@width": "1712",
            "@_fa": "true",
            "$": "https://api.elsevier.com/content/object/eid/1-s2.0-S0360132323004948-gr4_lrg.jpg?httpAccept=%2A%2F%2A",
            "@multimediatype": "JPEG image file",
            "@type": "IMAGE-HIGH-RES",
            "@size": "224317",
            "@ref": "gr4",
            "@mimetype": "image/jpeg"
        },
        {
            "@category": "high",
            "@height": "1949",
            "@width": "2362",
            "@_fa": "true",
            "$": "https://api.elsevier.com/content/object/eid/1-s2.0-S0360132323004948-gr7_lrg.jpg?httpAccept=%2A%2F%2A",
            "@multimediatype": "JPEG image file",
            "@type": "IMAGE-HIGH-RES",
            "@size": "425453",
            "@ref": "gr7",
            "@mimetype": "image/jpeg"
        },
        {
            "@category": "high",
            "@height": "830",
            "@width": "3050",
            "@_fa": "true",
            "$": "https://api.elsevier.com/content/object/eid/1-s2.0-S0360132323004948-gr6_lrg.jpg?httpAccept=%2A%2F%2A",
            "@multimediatype": "JPEG image file",
            "@type": "IMAGE-HIGH-RES",
            "@size": "427936",
            "@ref": "gr6",
            "@mimetype": "image/jpeg"
        },
        {
            "@category": "high",
            "@height": "975",
            "@width": "2370",
            "@_fa": "true",
            "$": "https://api.elsevier.com/content/object/eid/1-s2.0-S0360132323004948-gr1_lrg.jpg?httpAccept=%2A%2F%2A",
            "@multimediatype": "JPEG image file",
            "@type": "IMAGE-HIGH-RES",
            "@size": "326616",
            "@ref": "gr1",
            "@mimetype": "image/jpeg"
        },
        {
            "@category": "high",
            "@height": "1872",
            "@width": "3050",
            "@_fa": "true",
            "$": "https://api.elsevier.com/content/object/eid/1-s2.0-S0360132323004948-gr10_lrg.jpg?httpAccept=%2A%2F%2A",
            "@multimediatype": "JPEG image file",
            "@type": "IMAGE-HIGH-RES",
            "@size": "607975",
            "@ref": "gr10",
            "@mimetype": "image/jpeg"
        },
        {
            "@category": "high",
            "@height": "4520",
            "@width": "2452",
            "@_fa": "true",
            "$": "https://api.elsevier.com/content/object/eid/1-s2.0-S0360132323004948-gr3_lrg.jpg?httpAccept=%2A%2F%2A",
            "@multimediatype": "JPEG image file",
            "@type": "IMAGE-HIGH-RES",
            "@size": "1634890",
            "@ref": "gr3",
            "@mimetype": "image/jpeg"
        },
        {
            "@category": "high",
            "@height": "2046",
            "@width": "1712",
            "@_fa": "true",
            "$": "https://api.elsevier.com/content/object/eid/1-s2.0-S0360132323004948-gr2_lrg.jpg?httpAccept=%2A%2F%2A",
            "@multimediatype": "JPEG image file",
            "@type": "IMAGE-HIGH-RES",
            "@size": "185958",
            "@ref": "gr2",
            "@mimetype": "image/jpeg"
        },
        {
            "@category": "high",
            "@height": "1566",
            "@width": "2362",
            "@_fa": "true",
            "$": "https://api.elsevier.com/content/object/eid/1-s2.0-S0360132323004948-gr13_lrg.jpg?httpAccept=%2A%2F%2A",
            "@multimediatype": "JPEG image file",
            "@type": "IMAGE-HIGH-RES",
            "@size": "426979",
            "@ref": "gr13",
            "@mimetype": "image/jpeg"
        },
        {
            "@category": "high",
            "@height": "1449",
            "@width": "2362",
            "@_fa": "true",
            "$": "https://api.elsevier.com/content/object/eid/1-s2.0-S0360132323004948-gr12_lrg.jpg?httpAccept=%2A%2F%2A",
            "@multimediatype": "JPEG image file",
            "@type": "IMAGE-HIGH-RES",
            "@size": "533816",
            "@ref": "gr12",
            "@mimetype": "image/jpeg"
        },
        {
            "@category": "high",
            "@height": "1587",
            "@width": "2362",
            "@_fa": "true",
            "$": "https://api.elsevier.com/content/object/eid/1-s2.0-S0360132323004948-gr11_lrg.jpg?httpAccept=%2A%2F%2A",
            "@multimediatype": "JPEG image file",
            "@type": "IMAGE-HIGH-RES",
            "@size": "380696",
            "@ref": "gr11",
            "@mimetype": "image/jpeg"
        },
        {
            "@category": "high",
            "@height": "845",
            "@width": "3050",
            "@_fa": "true",
            "$": "https://api.elsevier.com/content/object/eid/1-s2.0-S0360132323004948-gr9_lrg.jpg?httpAccept=%2A%2F%2A",
            "@multimediatype": "JPEG image file",
            "@type": "IMAGE-HIGH-RES",
            "@size": "380494",
            "@ref": "gr9",
            "@mimetype": "image/jpeg"
        },
        {
            "@category": "high",
            "@height": "1927",
            "@width": "2362",
            "@_fa": "true",
            "$": "https://api.elsevier.com/content/object/eid/1-s2.0-S0360132323004948-gr8_lrg.jpg?httpAccept=%2A%2F%2A",
            "@multimediatype": "JPEG image file",
            "@type": "IMAGE-HIGH-RES",
            "@size": "363759",
            "@ref": "gr8",
            "@mimetype": "image/jpeg"
        },
        {
            "@category": "thumbnail",
            "@_fa": "true",
            "$": "https://api.elsevier.com/content/object/eid/1-s2.0-S0360132323004948-si134.svg?httpAccept=%2A%2F%2A",
            "@multimediatype": "Scalable Vector Graphics file",
            "@type": "ALTIMG",
            "@size": "69539",
            "@ref": "si134",
            "@mimetype": "image/svg+xml"
        },
        {
            "@category": "thumbnail",
            "@_fa": "true",
            "$": "https://api.elsevier.com/content/object/eid/1-s2.0-S0360132323004948-si191.svg?httpAccept=%2A%2F%2A",
            "@multimediatype": "Scalable Vector Graphics file",
            "@type": "ALTIMG",
            "@size": "187529",
            "@ref": "si191",
            "@mimetype": "image/svg+xml"
        },
        {
            "@category": "thumbnail",
            "@_fa": "true",
            "$": "https://api.elsevier.com/content/object/eid/1-s2.0-S0360132323004948-si40.svg?httpAccept=%2A%2F%2A",
            "@multimediatype": "Scalable Vector Graphics file",
            "@type": "ALTIMG",
            "@size": "54592",
            "@ref": "si40",
            "@mimetype": "image/svg+xml"
        },
        {
            "@category": "thumbnail",
            "@_fa": "true",
            "$": "https://api.elsevier.com/content/object/eid/1-s2.0-S0360132323004948-si26.svg?httpAccept=%2A%2F%2A",
            "@multimediatype": "Scalable Vector Graphics file",
            "@type": "ALTIMG",
            "@size": "87538",
            "@ref": "si26",
            "@mimetype": "image/svg+xml"
        },
        {
            "@category": "thumbnail",
            "@_fa": "true",
            "$": "https://api.elsevier.com/content/object/eid/1-s2.0-S0360132323004948-si54.svg?httpAccept=%2A%2F%2A",
            "@multimediatype": "Scalable Vector Graphics file",
            "@type": "ALTIMG",
            "@size": "11050",
            "@ref": "si54",
            "@mimetype": "image/svg+xml"
        },
        {
            "@category": "thumbnail",
            "@_fa": "true",
            "$": "https://api.elsevier.com/content/object/eid/1-s2.0-S0360132323004948-si102.svg?httpAccept=%2A%2F%2A",
            "@multimediatype": "Scalable Vector Graphics file",
            "@type": "ALTIMG",
            "@size": "8843",
            "@ref": "si102",
            "@mimetype": "image/svg+xml"
        },
        {
            "@category": "thumbnail",
            "@_fa": "true",
            "$": "https://api.elsevier.com/content/object/eid/1-s2.0-S0360132323004948-si192.svg?httpAccept=%2A%2F%2A",
            "@multimediatype": "Scalable Vector Graphics file",
            "@type": "ALTIMG",
            "@size": "26702",
            "@ref": "si192",
            "@mimetype": "image/svg+xml"
        },
        {
            "@category": "thumbnail",
            "@_fa": "true",
            "$": "https://api.elsevier.com/content/object/eid/1-s2.0-S0360132323004948-si11.svg?httpAccept=%2A%2F%2A",
            "@multimediatype": "Scalable Vector Graphics file",
            "@type": "ALTIMG",
            "@size": "66250",
            "@ref": "si11",
            "@mimetype": "image/svg+xml"
        },
        {
            "@category": "thumbnail",
            "@_fa": "true",
            "$": "https://api.elsevier.com/content/object/eid/1-s2.0-S0360132323004948-si85.svg?httpAccept=%2A%2F%2A",
            "@multimediatype": "Scalable Vector Graphics file",
            "@type": "ALTIMG",
            "@size": "18560",
            "@ref": "si85",
            "@mimetype": "image/svg+xml"
        },
        {
            "@category": "thumbnail",
            "@_fa": "true",
            "$": "https://api.elsevier.com/content/object/eid/1-s2.0-S0360132323004948-si88.svg?httpAccept=%2A%2F%2A",
            "@multimediatype": "Scalable Vector Graphics file",
            "@type": "ALTIMG",
            "@size": "16385",
            "@ref": "si88",
            "@mimetype": "image/svg+xml"
        },
        {
            "@category": "thumbnail",
            "@_fa": "true",
            "$": "https://api.elsevier.com/content/object/eid/1-s2.0-S0360132323004948-si99.svg?httpAccept=%2A%2F%2A",
            "@multimediatype": "Scalable Vector Graphics file",
            "@type": "ALTIMG",
            "@size": "27700",
            "@ref": "si99",
            "@mimetype": "image/svg+xml"
        },
        {
            "@category": "thumbnail",
            "@_fa": "true",
            "$": "https://api.elsevier.com/content/object/eid/1-s2.0-S0360132323004948-si42.svg?httpAccept=%2A%2F%2A",
            "@multimediatype": "Scalable Vector Graphics file",
            "@type": "ALTIMG",
            "@size": "15643",
            "@ref": "si42",
            "@mimetype": "image/svg+xml"
        },
        {
            "@category": "thumbnail",
            "@_fa": "true",
            "$": "https://api.elsevier.com/content/object/eid/1-s2.0-S0360132323004948-si113.svg?httpAccept=%2A%2F%2A",
            "@multimediatype": "Scalable Vector Graphics file",
            "@type": "ALTIMG",
            "@size": "126921",
            "@ref": "si113",
            "@mimetype": "image/svg+xml"
        },
        {
            "@category": "thumbnail",
            "@_fa": "true",
            "$": "https://api.elsevier.com/content/object/eid/1-s2.0-S0360132323004948-si94.svg?httpAccept=%2A%2F%2A",
            "@multimediatype": "Scalable Vector Graphics file",
            "@type": "ALTIMG",
            "@size": "27058",
            "@ref": "si94",
            "@mimetype": "image/svg+xml"
        },
        {
            "@category": "thumbnail",
            "@_fa": "true",
            "$": "https://api.elsevier.com/content/object/eid/1-s2.0-S0360132323004948-si115.svg?httpAccept=%2A%2F%2A",
            "@multimediatype": "Scalable Vector Graphics file",
            "@type": "ALTIMG",
            "@size": "12687",
            "@ref": "si115",
            "@mimetype": "image/svg+xml"
        },
        {
            "@category": "thumbnail",
            "@_fa": "true",
            "$": "https://api.elsevier.com/content/object/eid/1-s2.0-S0360132323004948-si100.svg?httpAccept=%2A%2F%2A",
            "@multimediatype": "Scalable Vector Graphics file",
            "@type": "ALTIMG",
            "@size": "102891",
            "@ref": "si100",
            "@mimetype": "image/svg+xml"
        },
        {
            "@category": "thumbnail",
            "@_fa": "true",
            "$": "https://api.elsevier.com/content/object/eid/1-s2.0-S0360132323004948-si34.svg?httpAccept=%2A%2F%2A",
            "@multimediatype": "Scalable Vector Graphics file",
            "@type": "ALTIMG",
            "@size": "18602",
            "@ref": "si34",
            "@mimetype": "image/svg+xml"
        },
        {
            "@category": "thumbnail",
            "@_fa": "true",
            "$": "https://api.elsevier.com/content/object/eid/1-s2.0-S0360132323004948-si172.svg?httpAccept=%2A%2F%2A",
            "@multimediatype": "Scalable Vector Graphics file",
            "@type": "ALTIMG",
            "@size": "35355",
            "@ref": "si172",
            "@mimetype": "image/svg+xml"
        },
        {
            "@category": "thumbnail",
            "@_fa": "true",
            "$": "https://api.elsevier.com/content/object/eid/1-s2.0-S0360132323004948-si142.svg?httpAccept=%2A%2F%2A",
            "@multimediatype": "Scalable Vector Graphics file",
            "@type": "ALTIMG",
            "@size": "7085",
            "@ref": "si142",
            "@mimetype": "image/svg+xml"
        },
        {
            "@category": "thumbnail",
            "@_fa": "true",
            "$": "https://api.elsevier.com/content/object/eid/1-s2.0-S0360132323004948-si182.svg?httpAccept=%2A%2F%2A",
            "@multimediatype": "Scalable Vector Graphics file",
            "@type": "ALTIMG",
            "@size": "13925",
            "@ref": "si182",
            "@mimetype": "image/svg+xml"
        },
        {
            "@category": "thumbnail",
            "@_fa": "true",
            "$": "https://api.elsevier.com/content/object/eid/1-s2.0-S0360132323004948-si105.svg?httpAccept=%2A%2F%2A",
            "@multimediatype": "Scalable Vector Graphics file",
            "@type": "ALTIMG",
            "@size": "6633",
            "@ref": "si105",
            "@mimetype": "image/svg+xml"
        },
        {
            "@category": "thumbnail",
            "@_fa": "true",
            "$": "https://api.elsevier.com/content/object/eid/1-s2.0-S0360132323004948-si61.svg?httpAccept=%2A%2F%2A",
            "@multimediatype": "Scalable Vector Graphics file",
            "@type": "ALTIMG",
            "@size": "15030",
            "@ref": "si61",
            "@mimetype": "image/svg+xml"
        },
        {
            "@category": "thumbnail",
            "@_fa": "true",
            "$": "https://api.elsevier.com/content/object/eid/1-s2.0-S0360132323004948-si139.svg?httpAccept=%2A%2F%2A",
            "@multimediatype": "Scalable Vector Graphics file",
            "@type": "ALTIMG",
            "@size": "24123",
            "@ref": "si139",
            "@mimetype": "image/svg+xml"
        },
        {
            "@category": "thumbnail",
            "@_fa": "true",
            "$": "https://api.elsevier.com/content/object/eid/1-s2.0-S0360132323004948-si124.svg?httpAccept=%2A%2F%2A",
            "@multimediatype": "Scalable Vector Graphics file",
            "@type": "ALTIMG",
            "@size": "10307",
            "@ref": "si124",
            "@mimetype": "image/svg+xml"
        },
        {
            "@category": "thumbnail",
            "@_fa": "true",
            "$": "https://api.elsevier.com/content/object/eid/1-s2.0-S0360132323004948-si63.svg?httpAccept=%2A%2F%2A",
            "@multimediatype": "Scalable Vector Graphics file",
            "@type": "ALTIMG",
            "@size": "10614",
            "@ref": "si63",
            "@mimetype": "image/svg+xml"
        },
        {
            "@category": "thumbnail",
            "@_fa": "true",
            "$": "https://api.elsevier.com/content/object/eid/1-s2.0-S0360132323004948-si104.svg?httpAccept=%2A%2F%2A",
            "@multimediatype": "Scalable Vector Graphics file",
            "@type": "ALTIMG",
            "@size": "8264",
            "@ref": "si104",
            "@mimetype": "image/svg+xml"
        },
        {
            "@category": "thumbnail",
            "@_fa": "true",
            "$": "https://api.elsevier.com/content/object/eid/1-s2.0-S0360132323004948-si55.svg?httpAccept=%2A%2F%2A",
            "@multimediatype": "Scalable Vector Graphics file",
            "@type": "ALTIMG",
            "@size": "82117",
            "@ref": "si55",
            "@mimetype": "image/svg+xml"
        },
        {
            "@category": "thumbnail",
            "@_fa": "true",
            "$": "https://api.elsevier.com/content/object/eid/1-s2.0-S0360132323004948-si32.svg?httpAccept=%2A%2F%2A",
            "@multimediatype": "Scalable Vector Graphics file",
            "@type": "ALTIMG",
            "@size": "18428",
            "@ref": "si32",
            "@mimetype": "image/svg+xml"
        },
        {
            "@category": "thumbnail",
            "@_fa": "true",
            "$": "https://api.elsevier.com/content/object/eid/1-s2.0-S0360132323004948-si37.svg?httpAccept=%2A%2F%2A",
            "@multimediatype": "Scalable Vector Graphics file",
            "@type": "ALTIMG",
            "@size": "14989",
            "@ref": "si37",
            "@mimetype": "image/svg+xml"
        },
        {
            "@category": "thumbnail",
            "@_fa": "true",
            "$": "https://api.elsevier.com/content/object/eid/1-s2.0-S0360132323004948-si73.svg?httpAccept=%2A%2F%2A",
            "@multimediatype": "Scalable Vector Graphics file",
            "@type": "ALTIMG",
            "@size": "62064",
            "@ref": "si73",
            "@mimetype": "image/svg+xml"
        },
        {
            "@category": "thumbnail",
            "@_fa": "true",
            "$": "https://api.elsevier.com/content/object/eid/1-s2.0-S0360132323004948-si180.svg?httpAccept=%2A%2F%2A",
            "@multimediatype": "Scalable Vector Graphics file",
            "@type": "ALTIMG",
            "@size": "4704",
            "@ref": "si180",
            "@mimetype": "image/svg+xml"
        },
        {
            "@category": "thumbnail",
            "@_fa": "true",
            "$": "https://api.elsevier.com/content/object/eid/1-s2.0-S0360132323004948-si190.svg?httpAccept=%2A%2F%2A",
            "@multimediatype": "Scalable Vector Graphics file",
            "@type": "ALTIMG",
            "@size": "23430",
            "@ref": "si190",
            "@mimetype": "image/svg+xml"
        },
        {
            "@category": "thumbnail",
            "@_fa": "true",
            "$": "https://api.elsevier.com/content/object/eid/1-s2.0-S0360132323004948-si198.svg?httpAccept=%2A%2F%2A",
            "@multimediatype": "Scalable Vector Graphics file",
            "@type": "ALTIMG",
            "@size": "152819",
            "@ref": "si198",
            "@mimetype": "image/svg+xml"
        },
        {
            "@category": "thumbnail",
            "@_fa": "true",
            "$": "https://api.elsevier.com/content/object/eid/1-s2.0-S0360132323004948-si140.svg?httpAccept=%2A%2F%2A",
            "@multimediatype": "Scalable Vector Graphics file",
            "@type": "ALTIMG",
            "@size": "58320",
            "@ref": "si140",
            "@mimetype": "image/svg+xml"
        },
        {
            "@category": "thumbnail",
            "@_fa": "true",
            "$": "https://api.elsevier.com/content/object/eid/1-s2.0-S0360132323004948-si107.svg?httpAccept=%2A%2F%2A",
            "@multimediatype": "Scalable Vector Graphics file",
            "@type": "ALTIMG",
            "@size": "91247",
            "@ref": "si107",
            "@mimetype": "image/svg+xml"
        },
        {
            "@category": "thumbnail",
            "@_fa": "true",
            "$": "https://api.elsevier.com/content/object/eid/1-s2.0-S0360132323004948-si156.svg?httpAccept=%2A%2F%2A",
            "@multimediatype": "Scalable Vector Graphics file",
            "@type": "ALTIMG",
            "@size": "129015",
            "@ref": "si156",
            "@mimetype": "image/svg+xml"
        },
        {
            "@category": "thumbnail",
            "@_fa": "true",
            "$": "https://api.elsevier.com/content/object/eid/1-s2.0-S0360132323004948-si183.svg?httpAccept=%2A%2F%2A",
            "@multimediatype": "Scalable Vector Graphics file",
            "@type": "ALTIMG",
            "@size": "33898",
            "@ref": "si183",
            "@mimetype": "image/svg+xml"
        },
        {
            "@category": "thumbnail",
            "@_fa": "true",
            "$": "https://api.elsevier.com/content/object/eid/1-s2.0-S0360132323004948-si44.svg?httpAccept=%2A%2F%2A",
            "@multimediatype": "Scalable Vector Graphics file",
            "@type": "ALTIMG",
            "@size": "55353",
            "@ref": "si44",
            "@mimetype": "image/svg+xml"
        },
        {
            "@category": "thumbnail",
            "@_fa": "true",
            "$": "https://api.elsevier.com/content/object/eid/1-s2.0-S0360132323004948-si146.svg?httpAccept=%2A%2F%2A",
            "@multimediatype": "Scalable Vector Graphics file",
            "@type": "ALTIMG",
            "@size": "53019",
            "@ref": "si146",
            "@mimetype": "image/svg+xml"
        },
        {
            "@category": "thumbnail",
            "@_fa": "true",
            "$": "https://api.elsevier.com/content/object/eid/1-s2.0-S0360132323004948-si138.svg?httpAccept=%2A%2F%2A",
            "@multimediatype": "Scalable Vector Graphics file",
            "@type": "ALTIMG",
            "@size": "18884",
            "@ref": "si138",
            "@mimetype": "image/svg+xml"
        },
        {
            "@category": "thumbnail",
            "@_fa": "true",
            "$": "https://api.elsevier.com/content/object/eid/1-s2.0-S0360132323004948-si56.svg?httpAccept=%2A%2F%2A",
            "@multimediatype": "Scalable Vector Graphics file",
            "@type": "ALTIMG",
            "@size": "18299",
            "@ref": "si56",
            "@mimetype": "image/svg+xml"
        },
        {
            "@category": "thumbnail",
            "@_fa": "true",
            "$": "https://api.elsevier.com/content/object/eid/1-s2.0-S0360132323004948-si20.svg?httpAccept=%2A%2F%2A",
            "@multimediatype": "Scalable Vector Graphics file",
            "@type": "ALTIMG",
            "@size": "4350",
            "@ref": "si20",
            "@mimetype": "image/svg+xml"
        },
        {
            "@category": "thumbnail",
            "@_fa": "true",
            "$": "https://api.elsevier.com/content/object/eid/1-s2.0-S0360132323004948-si193.svg?httpAccept=%2A%2F%2A",
            "@multimediatype": "Scalable Vector Graphics file",
            "@type": "ALTIMG",
            "@size": "5422",
            "@ref": "si193",
            "@mimetype": "image/svg+xml"
        },
        {
            "@category": "thumbnail",
            "@_fa": "true",
            "$": "https://api.elsevier.com/content/object/eid/1-s2.0-S0360132323004948-si9.svg?httpAccept=%2A%2F%2A",
            "@multimediatype": "Scalable Vector Graphics file",
            "@type": "ALTIMG",
            "@size": "79616",
            "@ref": "si9",
            "@mimetype": "image/svg+xml"
        },
        {
            "@category": "thumbnail",
            "@_fa": "true",
            "$": "https://api.elsevier.com/content/object/eid/1-s2.0-S0360132323004948-si110.svg?httpAccept=%2A%2F%2A",
            "@multimediatype": "Scalable Vector Graphics file",
            "@type": "ALTIMG",
            "@size": "20785",
            "@ref": "si110",
            "@mimetype": "image/svg+xml"
        },
        {
            "@category": "thumbnail",
            "@_fa": "true",
            "$": "https://api.elsevier.com/content/object/eid/1-s2.0-S0360132323004948-si177.svg?httpAccept=%2A%2F%2A",
            "@multimediatype": "Scalable Vector Graphics file",
            "@type": "ALTIMG",
            "@size": "5559",
            "@ref": "si177",
            "@mimetype": "image/svg+xml"
        },
        {
            "@category": "thumbnail",
            "@_fa": "true",
            "$": "https://api.elsevier.com/content/object/eid/1-s2.0-S0360132323004948-si106.svg?httpAccept=%2A%2F%2A",
            "@multimediatype": "Scalable Vector Graphics file",
            "@type": "ALTIMG",
            "@size": "8675",
            "@ref": "si106",
            "@mimetype": "image/svg+xml"
        },
        {
            "@category": "thumbnail",
            "@_fa": "true",
            "$": "https://api.elsevier.com/content/object/eid/1-s2.0-S0360132323004948-si114.svg?httpAccept=%2A%2F%2A",
            "@multimediatype": "Scalable Vector Graphics file",
            "@type": "ALTIMG",
            "@size": "10254",
            "@ref": "si114",
            "@mimetype": "image/svg+xml"
        },
        {
            "@category": "thumbnail",
            "@_fa": "true",
            "$": "https://api.elsevier.com/content/object/eid/1-s2.0-S0360132323004948-si101.svg?httpAccept=%2A%2F%2A",
            "@multimediatype": "Scalable Vector Graphics file",
            "@type": "ALTIMG",
            "@size": "88117",
            "@ref": "si101",
            "@mimetype": "image/svg+xml"
        },
        {
            "@category": "thumbnail",
            "@_fa": "true",
            "$": "https://api.elsevier.com/content/object/eid/1-s2.0-S0360132323004948-si178.svg?httpAccept=%2A%2F%2A",
            "@multimediatype": "Scalable Vector Graphics file",
            "@type": "ALTIMG",
            "@size": "42049",
            "@ref": "si178",
            "@mimetype": "image/svg+xml"
        },
        {
            "@category": "thumbnail",
            "@_fa": "true",
            "$": "https://api.elsevier.com/content/object/eid/1-s2.0-S0360132323004948-si186.svg?httpAccept=%2A%2F%2A",
            "@multimediatype": "Scalable Vector Graphics file",
            "@type": "ALTIMG",
            "@size": "29272",
            "@ref": "si186",
            "@mimetype": "image/svg+xml"
        },
        {
            "@category": "thumbnail",
            "@_fa": "true",
            "$": "https://api.elsevier.com/content/object/eid/1-s2.0-S0360132323004948-si67.svg?httpAccept=%2A%2F%2A",
            "@multimediatype": "Scalable Vector Graphics file",
            "@type": "ALTIMG",
            "@size": "30216",
            "@ref": "si67",
            "@mimetype": "image/svg+xml"
        },
        {
            "@category": "thumbnail",
            "@_fa": "true",
            "$": "https://api.elsevier.com/content/object/eid/1-s2.0-S0360132323004948-si1.svg?httpAccept=%2A%2F%2A",
            "@multimediatype": "Scalable Vector Graphics file",
            "@type": "ALTIMG",
            "@size": "37710",
            "@ref": "si1",
            "@mimetype": "image/svg+xml"
        },
        {
            "@category": "thumbnail",
            "@_fa": "true",
            "$": "https://api.elsevier.com/content/object/eid/1-s2.0-S0360132323004948-si97.svg?httpAccept=%2A%2F%2A",
            "@multimediatype": "Scalable Vector Graphics file",
            "@type": "ALTIMG",
            "@size": "14573",
            "@ref": "si97",
            "@mimetype": "image/svg+xml"
        },
        {
            "@category": "thumbnail",
            "@_fa": "true",
            "$": "https://api.elsevier.com/content/object/eid/1-s2.0-S0360132323004948-si15.svg?httpAccept=%2A%2F%2A",
            "@multimediatype": "Scalable Vector Graphics file",
            "@type": "ALTIMG",
            "@size": "78600",
            "@ref": "si15",
            "@mimetype": "image/svg+xml"
        },
        {
            "@category": "thumbnail",
            "@_fa": "true",
            "$": "https://api.elsevier.com/content/object/eid/1-s2.0-S0360132323004948-si160.svg?httpAccept=%2A%2F%2A",
            "@multimediatype": "Scalable Vector Graphics file",
            "@type": "ALTIMG",
            "@size": "24881",
            "@ref": "si160",
            "@mimetype": "image/svg+xml"
        },
        {
            "@category": "thumbnail",
            "@_fa": "true",
            "$": "https://api.elsevier.com/content/object/eid/1-s2.0-S0360132323004948-si8.svg?httpAccept=%2A%2F%2A",
            "@multimediatype": "Scalable Vector Graphics file",
            "@type": "ALTIMG",
            "@size": "15492",
            "@ref": "si8",
            "@mimetype": "image/svg+xml"
        },
        {
            "@category": "thumbnail",
            "@_fa": "true",
            "$": "https://api.elsevier.com/content/object/eid/1-s2.0-S0360132323004948-si118.svg?httpAccept=%2A%2F%2A",
            "@multimediatype": "Scalable Vector Graphics file",
            "@type": "ALTIMG",
            "@size": "30433",
            "@ref": "si118",
            "@mimetype": "image/svg+xml"
        },
        {
            "@category": "thumbnail",
            "@_fa": "true",
            "$": "https://api.elsevier.com/content/object/eid/1-s2.0-S0360132323004948-si45.svg?httpAccept=%2A%2F%2A",
            "@multimediatype": "Scalable Vector Graphics file",
            "@type": "ALTIMG",
            "@size": "24849",
            "@ref": "si45",
            "@mimetype": "image/svg+xml"
        },
        {
            "@category": "thumbnail",
            "@_fa": "true",
            "$": "https://api.elsevier.com/content/object/eid/1-s2.0-S0360132323004948-si131.svg?httpAccept=%2A%2F%2A",
            "@multimediatype": "Scalable Vector Graphics file",
            "@type": "ALTIMG",
            "@size": "13627",
            "@ref": "si131",
            "@mimetype": "image/svg+xml"
        },
        {
            "@category": "thumbnail",
            "@_fa": "true",
            "$": "https://api.elsevier.com/content/object/eid/1-s2.0-S0360132323004948-si122.svg?httpAccept=%2A%2F%2A",
            "@multimediatype": "Scalable Vector Graphics file",
            "@type": "ALTIMG",
            "@size": "13459",
            "@ref": "si122",
            "@mimetype": "image/svg+xml"
        },
        {
            "@category": "thumbnail",
            "@_fa": "true",
            "$": "https://api.elsevier.com/content/object/eid/1-s2.0-S0360132323004948-si64.svg?httpAccept=%2A%2F%2A",
            "@multimediatype": "Scalable Vector Graphics file",
            "@type": "ALTIMG",
            "@size": "7433",
            "@ref": "si64",
            "@mimetype": "image/svg+xml"
        },
        {
            "@category": "thumbnail",
            "@_fa": "true",
            "$": "https://api.elsevier.com/content/object/eid/1-s2.0-S0360132323004948-si187.svg?httpAccept=%2A%2F%2A",
            "@multimediatype": "Scalable Vector Graphics file",
            "@type": "ALTIMG",
            "@size": "136360",
            "@ref": "si187",
            "@mimetype": "image/svg+xml"
        },
        {
            "@category": "thumbnail",
            "@_fa": "true",
            "$": "https://api.elsevier.com/content/object/eid/1-s2.0-S0360132323004948-si89.svg?httpAccept=%2A%2F%2A",
            "@multimediatype": "Scalable Vector Graphics file",
            "@type": "ALTIMG",
            "@size": "18018",
            "@ref": "si89",
            "@mimetype": "image/svg+xml"
        },
        {
            "@category": "thumbnail",
            "@_fa": "true",
            "$": "https://api.elsevier.com/content/object/eid/1-s2.0-S0360132323004948-si81.svg?httpAccept=%2A%2F%2A",
            "@multimediatype": "Scalable Vector Graphics file",
            "@type": "ALTIMG",
            "@size": "71295",
            "@ref": "si81",
            "@mimetype": "image/svg+xml"
        },
        {
            "@category": "thumbnail",
            "@_fa": "true",
            "$": "https://api.elsevier.com/content/object/eid/1-s2.0-S0360132323004948-si129.svg?httpAccept=%2A%2F%2A",
            "@multimediatype": "Scalable Vector Graphics file",
            "@type": "ALTIMG",
            "@size": "13267",
            "@ref": "si129",
            "@mimetype": "image/svg+xml"
        },
        {
            "@category": "thumbnail",
            "@_fa": "true",
            "$": "https://api.elsevier.com/content/object/eid/1-s2.0-S0360132323004948-si152.svg?httpAccept=%2A%2F%2A",
            "@multimediatype": "Scalable Vector Graphics file",
            "@type": "ALTIMG",
            "@size": "50110",
            "@ref": "si152",
            "@mimetype": "image/svg+xml"
        },
        {
            "@category": "thumbnail",
            "@_fa": "true",
            "$": "https://api.elsevier.com/content/object/eid/1-s2.0-S0360132323004948-si3.svg?httpAccept=%2A%2F%2A",
            "@multimediatype": "Scalable Vector Graphics file",
            "@type": "ALTIMG",
            "@size": "34610",
            "@ref": "si3",
            "@mimetype": "image/svg+xml"
        },
        {
            "@category": "thumbnail",
            "@_fa": "true",
            "$": "https://api.elsevier.com/content/object/eid/1-s2.0-S0360132323004948-si173.svg?httpAccept=%2A%2F%2A",
            "@multimediatype": "Scalable Vector Graphics file",
            "@type": "ALTIMG",
            "@size": "10678",
            "@ref": "si173",
            "@mimetype": "image/svg+xml"
        },
        {
            "@category": "thumbnail",
            "@_fa": "true",
            "$": "https://api.elsevier.com/content/object/eid/1-s2.0-S0360132323004948-si196.svg?httpAccept=%2A%2F%2A",
            "@multimediatype": "Scalable Vector Graphics file",
            "@type": "ALTIMG",
            "@size": "10364",
            "@ref": "si196",
            "@mimetype": "image/svg+xml"
        },
        {
            "@category": "thumbnail",
            "@_fa": "true",
            "$": "https://api.elsevier.com/content/object/eid/1-s2.0-S0360132323004948-si120.svg?httpAccept=%2A%2F%2A",
            "@multimediatype": "Scalable Vector Graphics file",
            "@type": "ALTIMG",
            "@size": "165739",
            "@ref": "si120",
            "@mimetype": "image/svg+xml"
        },
        {
            "@category": "thumbnail",
            "@_fa": "true",
            "$": "https://api.elsevier.com/content/object/eid/1-s2.0-S0360132323004948-si123.svg?httpAccept=%2A%2F%2A",
            "@multimediatype": "Scalable Vector Graphics file",
            "@type": "ALTIMG",
            "@size": "8408",
            "@ref": "si123",
            "@mimetype": "image/svg+xml"
        },
        {
            "@category": "thumbnail",
            "@_fa": "true",
            "$": "https://api.elsevier.com/content/object/eid/1-s2.0-S0360132323004948-si79.svg?httpAccept=%2A%2F%2A",
            "@multimediatype": "Scalable Vector Graphics file",
            "@type": "ALTIMG",
            "@size": "30199",
            "@ref": "si79",
            "@mimetype": "image/svg+xml"
        },
        {
            "@category": "thumbnail",
            "@_fa": "true",
            "$": "https://api.elsevier.com/content/object/eid/1-s2.0-S0360132323004948-si28.svg?httpAccept=%2A%2F%2A",
            "@multimediatype": "Scalable Vector Graphics file",
            "@type": "ALTIMG",
            "@size": "51572",
            "@ref": "si28",
            "@mimetype": "image/svg+xml"
        },
        {
            "@category": "thumbnail",
            "@_fa": "true",
            "$": "https://api.elsevier.com/content/object/eid/1-s2.0-S0360132323004948-si103.svg?httpAccept=%2A%2F%2A",
            "@multimediatype": "Scalable Vector Graphics file",
            "@type": "ALTIMG",
            "@size": "6222",
            "@ref": "si103",
            "@mimetype": "image/svg+xml"
        },
        {
            "@category": "thumbnail",
            "@_fa": "true",
            "$": "https://api.elsevier.com/content/object/eid/1-s2.0-S0360132323004948-si96.svg?httpAccept=%2A%2F%2A",
            "@multimediatype": "Scalable Vector Graphics file",
            "@type": "ALTIMG",
            "@size": "55610",
            "@ref": "si96",
            "@mimetype": "image/svg+xml"
        },
        {
            "@category": "thumbnail",
            "@_fa": "true",
            "$": "https://api.elsevier.com/content/object/eid/1-s2.0-S0360132323004948-si13.svg?httpAccept=%2A%2F%2A",
            "@multimediatype": "Scalable Vector Graphics file",
            "@type": "ALTIMG",
            "@size": "87348",
            "@ref": "si13",
            "@mimetype": "image/svg+xml"
        },
        {
            "@category": "thumbnail",
            "@_fa": "true",
            "$": "https://api.elsevier.com/content/object/eid/1-s2.0-S0360132323004948-si161.svg?httpAccept=%2A%2F%2A",
            "@multimediatype": "Scalable Vector Graphics file",
            "@type": "ALTIMG",
            "@size": "14789",
            "@ref": "si161",
            "@mimetype": "image/svg+xml"
        },
        {
            "@category": "thumbnail",
            "@_fa": "true",
            "$": "https://api.elsevier.com/content/object/eid/1-s2.0-S0360132323004948-si78.svg?httpAccept=%2A%2F%2A",
            "@multimediatype": "Scalable Vector Graphics file",
            "@type": "ALTIMG",
            "@size": "24440",
            "@ref": "si78",
            "@mimetype": "image/svg+xml"
        },
        {
            "@category": "thumbnail",
            "@_fa": "true",
            "$": "https://api.elsevier.com/content/object/eid/1-s2.0-S0360132323004948-si17.svg?httpAccept=%2A%2F%2A",
            "@multimediatype": "Scalable Vector Graphics file",
            "@type": "ALTIMG",
            "@size": "88546",
            "@ref": "si17",
            "@mimetype": "image/svg+xml"
        },
        {
            "@category": "thumbnail",
            "@_fa": "true",
            "$": "https://api.elsevier.com/content/object/eid/1-s2.0-S0360132323004948-si72.svg?httpAccept=%2A%2F%2A",
            "@multimediatype": "Scalable Vector Graphics file",
            "@type": "ALTIMG",
            "@size": "27813",
            "@ref": "si72",
            "@mimetype": "image/svg+xml"
        },
        {
            "@category": "thumbnail",
            "@_fa": "true",
            "$": "https://api.elsevier.com/content/object/eid/1-s2.0-S0360132323004948-si66.svg?httpAccept=%2A%2F%2A",
            "@multimediatype": "Scalable Vector Graphics file",
            "@type": "ALTIMG",
            "@size": "59123",
            "@ref": "si66",
            "@mimetype": "image/svg+xml"
        },
        {
            "@category": "thumbnail",
            "@_fa": "true",
            "$": "https://api.elsevier.com/content/object/eid/1-s2.0-S0360132323004948-si116.svg?httpAccept=%2A%2F%2A",
            "@multimediatype": "Scalable Vector Graphics file",
            "@type": "ALTIMG",
            "@size": "42070",
            "@ref": "si116",
            "@mimetype": "image/svg+xml"
        },
        {
            "@category": "thumbnail",
            "@_fa": "true",
            "$": "https://api.elsevier.com/content/object/eid/1-s2.0-S0360132323004948-si5.svg?httpAccept=%2A%2F%2A",
            "@multimediatype": "Scalable Vector Graphics file",
            "@type": "ALTIMG",
            "@size": "38241",
            "@ref": "si5",
            "@mimetype": "image/svg+xml"
        },
        {
            "@category": "thumbnail",
            "@_fa": "true",
            "$": "https://api.elsevier.com/content/object/eid/1-s2.0-S0360132323004948-si93.svg?httpAccept=%2A%2F%2A",
            "@multimediatype": "Scalable Vector Graphics file",
            "@type": "ALTIMG",
            "@size": "25093",
            "@ref": "si93",
            "@mimetype": "image/svg+xml"
        },
        {
            "@category": "thumbnail",
            "@_fa": "true",
            "$": "https://api.elsevier.com/content/object/eid/1-s2.0-S0360132323004948-si157.svg?httpAccept=%2A%2F%2A",
            "@multimediatype": "Scalable Vector Graphics file",
            "@type": "ALTIMG",
            "@size": "24689",
            "@ref": "si157",
            "@mimetype": "image/svg+xml"
        },
        {
            "@category": "thumbnail",
            "@_fa": "true",
            "$": "https://api.elsevier.com/content/object/eid/1-s2.0-S0360132323004948-si87.svg?httpAccept=%2A%2F%2A",
            "@multimediatype": "Scalable Vector Graphics file",
            "@type": "ALTIMG",
            "@size": "15786",
            "@ref": "si87",
            "@mimetype": "image/svg+xml"
        },
        {
            "@category": "thumbnail",
            "@_fa": "true",
            "$": "https://api.elsevier.com/content/object/eid/1-s2.0-S0360132323004948-si25.svg?httpAccept=%2A%2F%2A",
            "@multimediatype": "Scalable Vector Graphics file",
            "@type": "ALTIMG",
            "@size": "9632",
            "@ref": "si25",
            "@mimetype": "image/svg+xml"
        },
        {
            "@category": "thumbnail",
            "@_fa": "true",
            "$": "https://api.elsevier.com/content/object/eid/1-s2.0-S0360132323004948-si33.svg?httpAccept=%2A%2F%2A",
            "@multimediatype": "Scalable Vector Graphics file",
            "@type": "ALTIMG",
            "@size": "24970",
            "@ref": "si33",
            "@mimetype": "image/svg+xml"
        },
        {
            "@category": "thumbnail",
            "@_fa": "true",
            "$": "https://api.elsevier.com/content/object/eid/1-s2.0-S0360132323004948-si70.svg?httpAccept=%2A%2F%2A",
            "@multimediatype": "Scalable Vector Graphics file",
            "@type": "ALTIMG",
            "@size": "18692",
            "@ref": "si70",
            "@mimetype": "image/svg+xml"
        },
        {
            "@category": "thumbnail",
            "@_fa": "true",
            "$": "https://api.elsevier.com/content/object/eid/1-s2.0-S0360132323004948-si71.svg?httpAccept=%2A%2F%2A",
            "@multimediatype": "Scalable Vector Graphics file",
            "@type": "ALTIMG",
            "@size": "9086",
            "@ref": "si71",
            "@mimetype": "image/svg+xml"
        },
        {
            "@category": "thumbnail",
            "@_fa": "true",
            "$": "https://api.elsevier.com/content/object/eid/1-s2.0-S0360132323004948-si149.svg?httpAccept=%2A%2F%2A",
            "@multimediatype": "Scalable Vector Graphics file",
            "@type": "ALTIMG",
            "@size": "8960",
            "@ref": "si149",
            "@mimetype": "image/svg+xml"
        },
        {
            "@category": "thumbnail",
            "@_fa": "true",
            "$": "https://api.elsevier.com/content/object/eid/1-s2.0-S0360132323004948-si135.svg?httpAccept=%2A%2F%2A",
            "@multimediatype": "Scalable Vector Graphics file",
            "@type": "ALTIMG",
            "@size": "9624",
            "@ref": "si135",
            "@mimetype": "image/svg+xml"
        },
        {
            "@category": "thumbnail",
            "@_fa": "true",
            "$": "https://api.elsevier.com/content/object/eid/1-s2.0-S0360132323004948-si184.svg?httpAccept=%2A%2F%2A",
            "@multimediatype": "Scalable Vector Graphics file",
            "@type": "ALTIMG",
            "@size": "9431",
            "@ref": "si184",
            "@mimetype": "image/svg+xml"
        },
        {
            "@category": "thumbnail",
            "@_fa": "true",
            "$": "https://api.elsevier.com/content/object/eid/1-s2.0-S0360132323004948-si80.svg?httpAccept=%2A%2F%2A",
            "@multimediatype": "Scalable Vector Graphics file",
            "@type": "ALTIMG",
            "@size": "69035",
            "@ref": "si80",
            "@mimetype": "image/svg+xml"
        },
        {
            "@category": "thumbnail",
            "@_fa": "true",
            "$": "https://api.elsevier.com/content/object/eid/1-s2.0-S0360132323004948-si62.svg?httpAccept=%2A%2F%2A",
            "@multimediatype": "Scalable Vector Graphics file",
            "@type": "ALTIMG",
            "@size": "17861",
            "@ref": "si62",
            "@mimetype": "image/svg+xml"
        },
        {
            "@category": "thumbnail",
            "@_fa": "true",
            "$": "https://api.elsevier.com/content/object/eid/1-s2.0-S0360132323004948-si167.svg?httpAccept=%2A%2F%2A",
            "@multimediatype": "Scalable Vector Graphics file",
            "@type": "ALTIMG",
            "@size": "75448",
            "@ref": "si167",
            "@mimetype": "image/svg+xml"
        },
        {
            "@category": "thumbnail",
            "@_fa": "true",
            "$": "https://api.elsevier.com/content/object/eid/1-s2.0-S0360132323004948-si194.svg?httpAccept=%2A%2F%2A",
            "@multimediatype": "Scalable Vector Graphics file",
            "@type": "ALTIMG",
            "@size": "17709",
            "@ref": "si194",
            "@mimetype": "image/svg+xml"
        },
        {
            "@category": "thumbnail",
            "@_fa": "true",
            "$": "https://api.elsevier.com/content/object/eid/1-s2.0-S0360132323004948-si169.svg?httpAccept=%2A%2F%2A",
            "@multimediatype": "Scalable Vector Graphics file",
            "@type": "ALTIMG",
            "@size": "30052",
            "@ref": "si169",
            "@mimetype": "image/svg+xml"
        },
        {
            "@category": "thumbnail",
            "@_fa": "true",
            "$": "https://api.elsevier.com/content/object/eid/1-s2.0-S0360132323004948-si12.svg?httpAccept=%2A%2F%2A",
            "@multimediatype": "Scalable Vector Graphics file",
            "@type": "ALTIMG",
            "@size": "20637",
            "@ref": "si12",
            "@mimetype": "image/svg+xml"
        },
        {
            "@category": "thumbnail",
            "@_fa": "true",
            "$": "https://api.elsevier.com/content/object/eid/1-s2.0-S0360132323004948-si98.svg?httpAccept=%2A%2F%2A",
            "@multimediatype": "Scalable Vector Graphics file",
            "@type": "ALTIMG",
            "@size": "36942",
            "@ref": "si98",
            "@mimetype": "image/svg+xml"
        },
        {
            "@category": "thumbnail",
            "@_fa": "true",
            "$": "https://api.elsevier.com/content/object/eid/1-s2.0-S0360132323004948-si145.svg?httpAccept=%2A%2F%2A",
            "@multimediatype": "Scalable Vector Graphics file",
            "@type": "ALTIMG",
            "@size": "15398",
            "@ref": "si145",
            "@mimetype": "image/svg+xml"
        },
        {
            "@category": "thumbnail",
            "@_fa": "true",
            "$": "https://api.elsevier.com/content/object/eid/1-s2.0-S0360132323004948-si151.svg?httpAccept=%2A%2F%2A",
            "@multimediatype": "Scalable Vector Graphics file",
            "@type": "ALTIMG",
            "@size": "51047",
            "@ref": "si151",
            "@mimetype": "image/svg+xml"
        },
        {
            "@category": "thumbnail",
            "@_fa": "true",
            "$": "https://api.elsevier.com/content/object/eid/1-s2.0-S0360132323004948-si57.svg?httpAccept=%2A%2F%2A",
            "@multimediatype": "Scalable Vector Graphics file",
            "@type": "ALTIMG",
            "@size": "21021",
            "@ref": "si57",
            "@mimetype": "image/svg+xml"
        },
        {
            "@category": "thumbnail",
            "@_fa": "true",
            "$": "https://api.elsevier.com/content/object/eid/1-s2.0-S0360132323004948-si68.svg?httpAccept=%2A%2F%2A",
            "@multimediatype": "Scalable Vector Graphics file",
            "@type": "ALTIMG",
            "@size": "7762",
            "@ref": "si68",
            "@mimetype": "image/svg+xml"
        },
        {
            "@category": "thumbnail",
            "@_fa": "true",
            "$": "https://api.elsevier.com/content/object/eid/1-s2.0-S0360132323004948-si159.svg?httpAccept=%2A%2F%2A",
            "@multimediatype": "Scalable Vector Graphics file",
            "@type": "ALTIMG",
            "@size": "48632",
            "@ref": "si159",
            "@mimetype": "image/svg+xml"
        },
        {
            "@category": "thumbnail",
            "@_fa": "true",
            "$": "https://api.elsevier.com/content/object/eid/1-s2.0-S0360132323004948-si95.svg?httpAccept=%2A%2F%2A",
            "@multimediatype": "Scalable Vector Graphics file",
            "@type": "ALTIMG",
            "@size": "46414",
            "@ref": "si95",
            "@mimetype": "image/svg+xml"
        },
        {
            "@category": "thumbnail",
            "@_fa": "true",
            "$": "https://api.elsevier.com/content/object/eid/1-s2.0-S0360132323004948-si38.svg?httpAccept=%2A%2F%2A",
            "@multimediatype": "Scalable Vector Graphics file",
            "@type": "ALTIMG",
            "@size": "15531",
            "@ref": "si38",
            "@mimetype": "image/svg+xml"
        },
        {
            "@category": "thumbnail",
            "@_fa": "true",
            "$": "https://api.elsevier.com/content/object/eid/1-s2.0-S0360132323004948-si174.svg?httpAccept=%2A%2F%2A",
            "@multimediatype": "Scalable Vector Graphics file",
            "@type": "ALTIMG",
            "@size": "10903",
            "@ref": "si174",
            "@mimetype": "image/svg+xml"
        },
        {
            "@category": "thumbnail",
            "@_fa": "true",
            "$": "https://api.elsevier.com/content/object/eid/1-s2.0-S0360132323004948-si83.svg?httpAccept=%2A%2F%2A",
            "@multimediatype": "Scalable Vector Graphics file",
            "@type": "ALTIMG",
            "@size": "11094",
            "@ref": "si83",
            "@mimetype": "image/svg+xml"
        },
        {
            "@category": "thumbnail",
            "@_fa": "true",
            "$": "https://api.elsevier.com/content/object/eid/1-s2.0-S0360132323004948-si76.svg?httpAccept=%2A%2F%2A",
            "@multimediatype": "Scalable Vector Graphics file",
            "@type": "ALTIMG",
            "@size": "4675",
            "@ref": "si76",
            "@mimetype": "image/svg+xml"
        },
        {
            "@category": "thumbnail",
            "@_fa": "true",
            "$": "https://api.elsevier.com/content/object/eid/1-s2.0-S0360132323004948-si163.svg?httpAccept=%2A%2F%2A",
            "@multimediatype": "Scalable Vector Graphics file",
            "@type": "ALTIMG",
            "@size": "78054",
            "@ref": "si163",
            "@mimetype": "image/svg+xml"
        },
        {
            "@category": "thumbnail",
            "@_fa": "true",
            "$": "https://api.elsevier.com/content/object/eid/1-s2.0-S0360132323004948-si47.svg?httpAccept=%2A%2F%2A",
            "@multimediatype": "Scalable Vector Graphics file",
            "@type": "ALTIMG",
            "@size": "7898",
            "@ref": "si47",
            "@mimetype": "image/svg+xml"
        },
        {
            "@category": "thumbnail",
            "@_fa": "true",
            "$": "https://api.elsevier.com/content/object/eid/1-s2.0-S0360132323004948-si27.svg?httpAccept=%2A%2F%2A",
            "@multimediatype": "Scalable Vector Graphics file",
            "@type": "ALTIMG",
            "@size": "90645",
            "@ref": "si27",
            "@mimetype": "image/svg+xml"
        },
        {
            "@category": "thumbnail",
            "@_fa": "true",
            "$": "https://api.elsevier.com/content/object/eid/1-s2.0-S0360132323004948-si49.svg?httpAccept=%2A%2F%2A",
            "@multimediatype": "Scalable Vector Graphics file",
            "@type": "ALTIMG",
            "@size": "12952",
            "@ref": "si49",
            "@mimetype": "image/svg+xml"
        },
        {
            "@category": "thumbnail",
            "@_fa": "true",
            "$": "https://api.elsevier.com/content/object/eid/1-s2.0-S0360132323004948-si185.svg?httpAccept=%2A%2F%2A",
            "@multimediatype": "Scalable Vector Graphics file",
            "@type": "ALTIMG",
            "@size": "23543",
            "@ref": "si185",
            "@mimetype": "image/svg+xml"
        },
        {
            "@category": "thumbnail",
            "@_fa": "true",
            "$": "https://api.elsevier.com/content/object/eid/1-s2.0-S0360132323004948-si176.svg?httpAccept=%2A%2F%2A",
            "@multimediatype": "Scalable Vector Graphics file",
            "@type": "ALTIMG",
            "@size": "52769",
            "@ref": "si176",
            "@mimetype": "image/svg+xml"
        },
        {
            "@category": "thumbnail",
            "@_fa": "true",
            "$": "https://api.elsevier.com/content/object/eid/1-s2.0-S0360132323004948-si126.svg?httpAccept=%2A%2F%2A",
            "@multimediatype": "Scalable Vector Graphics file",
            "@type": "ALTIMG",
            "@size": "60532",
            "@ref": "si126",
            "@mimetype": "image/svg+xml"
        },
        {
            "@category": "thumbnail",
            "@_fa": "true",
            "$": "https://api.elsevier.com/content/object/eid/1-s2.0-S0360132323004948-si24.svg?httpAccept=%2A%2F%2A",
            "@multimediatype": "Scalable Vector Graphics file",
            "@type": "ALTIMG",
            "@size": "7590",
            "@ref": "si24",
            "@mimetype": "image/svg+xml"
        },
        {
            "@category": "thumbnail",
            "@_fa": "true",
            "$": "https://api.elsevier.com/content/object/eid/1-s2.0-S0360132323004948-si22.svg?httpAccept=%2A%2F%2A",
            "@multimediatype": "Scalable Vector Graphics file",
            "@type": "ALTIMG",
            "@size": "7082",
            "@ref": "si22",
            "@mimetype": "image/svg+xml"
        },
        {
            "@category": "thumbnail",
            "@_fa": "true",
            "$": "https://api.elsevier.com/content/object/eid/1-s2.0-S0360132323004948-si158.svg?httpAccept=%2A%2F%2A",
            "@multimediatype": "Scalable Vector Graphics file",
            "@type": "ALTIMG",
            "@size": "64266",
            "@ref": "si158",
            "@mimetype": "image/svg+xml"
        },
        {
            "@category": "thumbnail",
            "@_fa": "true",
            "$": "https://api.elsevier.com/content/object/eid/1-s2.0-S0360132323004948-si21.svg?httpAccept=%2A%2F%2A",
            "@multimediatype": "Scalable Vector Graphics file",
            "@type": "ALTIMG",
            "@size": "8402",
            "@ref": "si21",
            "@mimetype": "image/svg+xml"
        },
        {
            "@category": "thumbnail",
            "@_fa": "true",
            "$": "https://api.elsevier.com/content/object/eid/1-s2.0-S0360132323004948-si148.svg?httpAccept=%2A%2F%2A",
            "@multimediatype": "Scalable Vector Graphics file",
            "@type": "ALTIMG",
            "@size": "15456",
            "@ref": "si148",
            "@mimetype": "image/svg+xml"
        },
        {
            "@category": "thumbnail",
            "@_fa": "true",
            "$": "https://api.elsevier.com/content/object/eid/1-s2.0-S0360132323004948-si10.svg?httpAccept=%2A%2F%2A",
            "@multimediatype": "Scalable Vector Graphics file",
            "@type": "ALTIMG",
            "@size": "17653",
            "@ref": "si10",
            "@mimetype": "image/svg+xml"
        },
        {
            "@category": "thumbnail",
            "@_fa": "true",
            "$": "https://api.elsevier.com/content/object/eid/1-s2.0-S0360132323004948-si108.svg?httpAccept=%2A%2F%2A",
            "@multimediatype": "Scalable Vector Graphics file",
            "@type": "ALTIMG",
            "@size": "26004",
            "@ref": "si108",
            "@mimetype": "image/svg+xml"
        },
        {
            "@category": "thumbnail",
            "@_fa": "true",
            "$": "https://api.elsevier.com/content/object/eid/1-s2.0-S0360132323004948-si52.svg?httpAccept=%2A%2F%2A",
            "@multimediatype": "Scalable Vector Graphics file",
            "@type": "ALTIMG",
            "@size": "10311",
            "@ref": "si52",
            "@mimetype": "image/svg+xml"
        },
        {
            "@category": "thumbnail",
            "@_fa": "true",
            "$": "https://api.elsevier.com/content/object/eid/1-s2.0-S0360132323004948-si74.svg?httpAccept=%2A%2F%2A",
            "@multimediatype": "Scalable Vector Graphics file",
            "@type": "ALTIMG",
            "@size": "166099",
            "@ref": "si74",
            "@mimetype": "image/svg+xml"
        },
        {
            "@category": "thumbnail",
            "@_fa": "true",
            "$": "https://api.elsevier.com/content/object/eid/1-s2.0-S0360132323004948-si82.svg?httpAccept=%2A%2F%2A",
            "@multimediatype": "Scalable Vector Graphics file",
            "@type": "ALTIMG",
            "@size": "47945",
            "@ref": "si82",
            "@mimetype": "image/svg+xml"
        },
        {
            "@category": "thumbnail",
            "@_fa": "true",
            "$": "https://api.elsevier.com/content/object/eid/1-s2.0-S0360132323004948-si188.svg?httpAccept=%2A%2F%2A",
            "@multimediatype": "Scalable Vector Graphics file",
            "@type": "ALTIMG",
            "@size": "30201",
            "@ref": "si188",
            "@mimetype": "image/svg+xml"
        },
        {
            "@category": "thumbnail",
            "@_fa": "true",
            "$": "https://api.elsevier.com/content/object/eid/1-s2.0-S0360132323004948-si162.svg?httpAccept=%2A%2F%2A",
            "@multimediatype": "Scalable Vector Graphics file",
            "@type": "ALTIMG",
            "@size": "13075",
            "@ref": "si162",
            "@mimetype": "image/svg+xml"
        },
        {
            "@category": "thumbnail",
            "@_fa": "true",
            "$": "https://api.elsevier.com/content/object/eid/1-s2.0-S0360132323004948-si132.svg?httpAccept=%2A%2F%2A",
            "@multimediatype": "Scalable Vector Graphics file",
            "@type": "ALTIMG",
            "@size": "50111",
            "@ref": "si132",
            "@mimetype": "image/svg+xml"
        },
        {
            "@category": "thumbnail",
            "@_fa": "true",
            "$": "https://api.elsevier.com/content/object/eid/1-s2.0-S0360132323004948-si197.svg?httpAccept=%2A%2F%2A",
            "@multimediatype": "Scalable Vector Graphics file",
            "@type": "ALTIMG",
            "@size": "11695",
            "@ref": "si197",
            "@mimetype": "image/svg+xml"
        },
        {
            "@category": "thumbnail",
            "@_fa": "true",
            "$": "https://api.elsevier.com/content/object/eid/1-s2.0-S0360132323004948-si19.svg?httpAccept=%2A%2F%2A",
            "@multimediatype": "Scalable Vector Graphics file",
            "@type": "ALTIMG",
            "@size": "69000",
            "@ref": "si19",
            "@mimetype": "image/svg+xml"
        },
        {
            "@category": "thumbnail",
            "@_fa": "true",
            "$": "https://api.elsevier.com/content/object/eid/1-s2.0-S0360132323004948-si35.svg?httpAccept=%2A%2F%2A",
            "@multimediatype": "Scalable Vector Graphics file",
            "@type": "ALTIMG",
            "@size": "21707",
            "@ref": "si35",
            "@mimetype": "image/svg+xml"
        },
        {
            "@category": "thumbnail",
            "@_fa": "true",
            "$": "https://api.elsevier.com/content/object/eid/1-s2.0-S0360132323004948-si143.svg?httpAccept=%2A%2F%2A",
            "@multimediatype": "Scalable Vector Graphics file",
            "@type": "ALTIMG",
            "@size": "4908",
            "@ref": "si143",
            "@mimetype": "image/svg+xml"
        },
        {
            "@category": "thumbnail",
            "@_fa": "true",
            "$": "https://api.elsevier.com/content/object/eid/1-s2.0-S0360132323004948-si165.svg?httpAccept=%2A%2F%2A",
            "@multimediatype": "Scalable Vector Graphics file",
            "@type": "ALTIMG",
            "@size": "40605",
            "@ref": "si165",
            "@mimetype": "image/svg+xml"
        },
        {
            "@category": "thumbnail",
            "@_fa": "true",
            "$": "https://api.elsevier.com/content/object/eid/1-s2.0-S0360132323004948-si36.svg?httpAccept=%2A%2F%2A",
            "@multimediatype": "Scalable Vector Graphics file",
            "@type": "ALTIMG",
            "@size": "22248",
            "@ref": "si36",
            "@mimetype": "image/svg+xml"
        },
        {
            "@category": "thumbnail",
            "@_fa": "true",
            "$": "https://api.elsevier.com/content/object/eid/1-s2.0-S0360132323004948-si137.svg?httpAccept=%2A%2F%2A",
            "@multimediatype": "Scalable Vector Graphics file",
            "@type": "ALTIMG",
            "@size": "73692",
            "@ref": "si137",
            "@mimetype": "image/svg+xml"
        },
        {
            "@category": "thumbnail",
            "@_fa": "true",
            "$": "https://api.elsevier.com/content/object/eid/1-s2.0-S0360132323004948-si75.svg?httpAccept=%2A%2F%2A",
            "@multimediatype": "Scalable Vector Graphics file",
            "@type": "ALTIMG",
            "@size": "25125",
            "@ref": "si75",
            "@mimetype": "image/svg+xml"
        },
        {
            "@category": "thumbnail",
            "@_fa": "true",
            "$": "https://api.elsevier.com/content/object/eid/1-s2.0-S0360132323004948-si117.svg?httpAccept=%2A%2F%2A",
            "@multimediatype": "Scalable Vector Graphics file",
            "@type": "ALTIMG",
            "@size": "137758",
            "@ref": "si117",
            "@mimetype": "image/svg+xml"
        },
        {
            "@category": "thumbnail",
            "@_fa": "true",
            "$": "https://api.elsevier.com/content/object/eid/1-s2.0-S0360132323004948-si51.svg?httpAccept=%2A%2F%2A",
            "@multimediatype": "Scalable Vector Graphics file",
            "@type": "ALTIMG",
            "@size": "52739",
            "@ref": "si51",
            "@mimetype": "image/svg+xml"
        },
        {
            "@category": "thumbnail",
            "@_fa": "true",
            "$": "https://api.elsevier.com/content/object/eid/1-s2.0-S0360132323004948-si171.svg?httpAccept=%2A%2F%2A",
            "@multimediatype": "Scalable Vector Graphics file",
            "@type": "ALTIMG",
            "@size": "17233",
            "@ref": "si171",
            "@mimetype": "image/svg+xml"
        },
        {
            "@category": "thumbnail",
            "@_fa": "true",
            "$": "https://api.elsevier.com/content/object/eid/1-s2.0-S0360132323004948-si58.svg?httpAccept=%2A%2F%2A",
            "@multimediatype": "Scalable Vector Graphics file",
            "@type": "ALTIMG",
            "@size": "25570",
            "@ref": "si58",
            "@mimetype": "image/svg+xml"
        },
        {
            "@category": "thumbnail",
            "@_fa": "true",
            "$": "https://api.elsevier.com/content/object/eid/1-s2.0-S0360132323004948-si16.svg?httpAccept=%2A%2F%2A",
            "@multimediatype": "Scalable Vector Graphics file",
            "@type": "ALTIMG",
            "@size": "26617",
            "@ref": "si16",
            "@mimetype": "image/svg+xml"
        },
        {
            "@category": "thumbnail",
            "@_fa": "true",
            "$": "https://api.elsevier.com/content/object/eid/1-s2.0-S0360132323004948-si144.svg?httpAccept=%2A%2F%2A",
            "@multimediatype": "Scalable Vector Graphics file",
            "@type": "ALTIMG",
            "@size": "4798",
            "@ref": "si144",
            "@mimetype": "image/svg+xml"
        },
        {
            "@category": "thumbnail",
            "@_fa": "true",
            "$": "https://api.elsevier.com/content/object/eid/1-s2.0-S0360132323004948-si14.svg?httpAccept=%2A%2F%2A",
            "@multimediatype": "Scalable Vector Graphics file",
            "@type": "ALTIMG",
            "@size": "17361",
            "@ref": "si14",
            "@mimetype": "image/svg+xml"
        },
        {
            "@category": "thumbnail",
            "@_fa": "true",
            "$": "https://api.elsevier.com/content/object/eid/1-s2.0-S0360132323004948-si4.svg?httpAccept=%2A%2F%2A",
            "@multimediatype": "Scalable Vector Graphics file",
            "@type": "ALTIMG",
            "@size": "39953",
            "@ref": "si4",
            "@mimetype": "image/svg+xml"
        },
        {
            "@category": "thumbnail",
            "@_fa": "true",
            "$": "https://api.elsevier.com/content/object/eid/1-s2.0-S0360132323004948-si41.svg?httpAccept=%2A%2F%2A",
            "@multimediatype": "Scalable Vector Graphics file",
            "@type": "ALTIMG",
            "@size": "10570",
            "@ref": "si41",
            "@mimetype": "image/svg+xml"
        },
        {
            "@category": "thumbnail",
            "@_fa": "true",
            "$": "https://api.elsevier.com/content/object/eid/1-s2.0-S0360132323004948-si86.svg?httpAccept=%2A%2F%2A",
            "@multimediatype": "Scalable Vector Graphics file",
            "@type": "ALTIMG",
            "@size": "8933",
            "@ref": "si86",
            "@mimetype": "image/svg+xml"
        },
        {
            "@category": "thumbnail",
            "@_fa": "true",
            "$": "https://api.elsevier.com/content/object/eid/1-s2.0-S0360132323004948-si111.svg?httpAccept=%2A%2F%2A",
            "@multimediatype": "Scalable Vector Graphics file",
            "@type": "ALTIMG",
            "@size": "40413",
            "@ref": "si111",
            "@mimetype": "image/svg+xml"
        },
        {
            "@category": "thumbnail",
            "@_fa": "true",
            "$": "https://api.elsevier.com/content/object/eid/1-s2.0-S0360132323004948-si147.svg?httpAccept=%2A%2F%2A",
            "@multimediatype": "Scalable Vector Graphics file",
            "@type": "ALTIMG",
            "@size": "2704",
            "@ref": "si147",
            "@mimetype": "image/svg+xml"
        },
        {
            "@category": "thumbnail",
            "@_fa": "true",
            "$": "https://api.elsevier.com/content/object/eid/1-s2.0-S0360132323004948-si18.svg?httpAccept=%2A%2F%2A",
            "@multimediatype": "Scalable Vector Graphics file",
            "@type": "ALTIMG",
            "@size": "19366",
            "@ref": "si18",
            "@mimetype": "image/svg+xml"
        },
        {
            "@category": "thumbnail",
            "@_fa": "true",
            "$": "https://api.elsevier.com/content/object/eid/1-s2.0-S0360132323004948-si189.svg?httpAccept=%2A%2F%2A",
            "@multimediatype": "Scalable Vector Graphics file",
            "@type": "ALTIMG",
            "@size": "10750",
            "@ref": "si189",
            "@mimetype": "image/svg+xml"
        },
        {
            "@category": "thumbnail",
            "@_fa": "true",
            "$": "https://api.elsevier.com/content/object/eid/1-s2.0-S0360132323004948-si141.svg?httpAccept=%2A%2F%2A",
            "@multimediatype": "Scalable Vector Graphics file",
            "@type": "ALTIMG",
            "@size": "4505",
            "@ref": "si141",
            "@mimetype": "image/svg+xml"
        },
        {
            "@category": "thumbnail",
            "@_fa": "true",
            "$": "https://api.elsevier.com/content/object/eid/1-s2.0-S0360132323004948-si155.svg?httpAccept=%2A%2F%2A",
            "@multimediatype": "Scalable Vector Graphics file",
            "@type": "ALTIMG",
            "@size": "9064",
            "@ref": "si155",
            "@mimetype": "image/svg+xml"
        },
        {
            "@category": "thumbnail",
            "@_fa": "true",
            "$": "https://api.elsevier.com/content/object/eid/1-s2.0-S0360132323004948-si59.svg?httpAccept=%2A%2F%2A",
            "@multimediatype": "Scalable Vector Graphics file",
            "@type": "ALTIMG",
            "@size": "11727",
            "@ref": "si59",
            "@mimetype": "image/svg+xml"
        },
        {
            "@category": "thumbnail",
            "@_fa": "true",
            "$": "https://api.elsevier.com/content/object/eid/1-s2.0-S0360132323004948-si60.svg?httpAccept=%2A%2F%2A",
            "@multimediatype": "Scalable Vector Graphics file",
            "@type": "ALTIMG",
            "@size": "18933",
            "@ref": "si60",
            "@mimetype": "image/svg+xml"
        },
        {
            "@category": "thumbnail",
            "@_fa": "true",
            "$": "https://api.elsevier.com/content/object/eid/1-s2.0-S0360132323004948-si195.svg?httpAccept=%2A%2F%2A",
            "@multimediatype": "Scalable Vector Graphics file",
            "@type": "ALTIMG",
            "@size": "9830",
            "@ref": "si195",
            "@mimetype": "image/svg+xml"
        },
        {
            "@category": "thumbnail",
            "@_fa": "true",
            "$": "https://api.elsevier.com/content/object/eid/1-s2.0-S0360132323004948-si39.svg?httpAccept=%2A%2F%2A",
            "@multimediatype": "Scalable Vector Graphics file",
            "@type": "ALTIMG",
            "@size": "17619",
            "@ref": "si39",
            "@mimetype": "image/svg+xml"
        },
        {
            "@category": "thumbnail",
            "@_fa": "true",
            "$": "https://api.elsevier.com/content/object/eid/1-s2.0-S0360132323004948-si179.svg?httpAccept=%2A%2F%2A",
            "@multimediatype": "Scalable Vector Graphics file",
            "@type": "ALTIMG",
            "@size": "11025",
            "@ref": "si179",
            "@mimetype": "image/svg+xml"
        },
        {
            "@category": "thumbnail",
            "@_fa": "true",
            "$": "https://api.elsevier.com/content/object/eid/1-s2.0-S0360132323004948-si154.svg?httpAccept=%2A%2F%2A",
            "@multimediatype": "Scalable Vector Graphics file",
            "@type": "ALTIMG",
            "@size": "34050",
            "@ref": "si154",
            "@mimetype": "image/svg+xml"
        },
        {
            "@category": "thumbnail",
            "@_fa": "true",
            "$": "https://api.elsevier.com/content/object/eid/1-s2.0-S0360132323004948-si92.svg?httpAccept=%2A%2F%2A",
            "@multimediatype": "Scalable Vector Graphics file",
            "@type": "ALTIMG",
            "@size": "31494",
            "@ref": "si92",
            "@mimetype": "image/svg+xml"
        },
        {
            "@category": "thumbnail",
            "@_fa": "true",
            "$": "https://api.elsevier.com/content/object/eid/1-s2.0-S0360132323004948-si29.svg?httpAccept=%2A%2F%2A",
            "@multimediatype": "Scalable Vector Graphics file",
            "@type": "ALTIMG",
            "@size": "52114",
            "@ref": "si29",
            "@mimetype": "image/svg+xml"
        },
        {
            "@category": "thumbnail",
            "@_fa": "true",
            "$": "https://api.elsevier.com/content/object/eid/1-s2.0-S0360132323004948-si30.svg?httpAccept=%2A%2F%2A",
            "@multimediatype": "Scalable Vector Graphics file",
            "@type": "ALTIMG",
            "@size": "24429",
            "@ref": "si30",
            "@mimetype": "image/svg+xml"
        },
        {
            "@category": "thumbnail",
            "@_fa": "true",
            "$": "https://api.elsevier.com/content/object/eid/1-s2.0-S0360132323004948-si48.svg?httpAccept=%2A%2F%2A",
            "@multimediatype": "Scalable Vector Graphics file",
            "@type": "ALTIMG",
            "@size": "9940",
            "@ref": "si48",
            "@mimetype": "image/svg+xml"
        },
        {
            "@category": "thumbnail",
            "@_fa": "true",
            "$": "https://api.elsevier.com/content/object/eid/1-s2.0-S0360132323004948-si23.svg?httpAccept=%2A%2F%2A",
            "@multimediatype": "Scalable Vector Graphics file",
            "@type": "ALTIMG",
            "@size": "8944",
            "@ref": "si23",
            "@mimetype": "image/svg+xml"
        },
        {
            "@category": "thumbnail",
            "@_fa": "true",
            "$": "https://api.elsevier.com/content/object/eid/1-s2.0-S0360132323004948-si65.svg?httpAccept=%2A%2F%2A",
            "@multimediatype": "Scalable Vector Graphics file",
            "@type": "ALTIMG",
            "@size": "71596",
            "@ref": "si65",
            "@mimetype": "image/svg+xml"
        },
        {
            "@category": "thumbnail",
            "@_fa": "true",
            "$": "https://api.elsevier.com/content/object/eid/1-s2.0-S0360132323004948-si84.svg?httpAccept=%2A%2F%2A",
            "@multimediatype": "Scalable Vector Graphics file",
            "@type": "ALTIMG",
            "@size": "10965",
            "@ref": "si84",
            "@mimetype": "image/svg+xml"
        },
        {
            "@category": "thumbnail",
            "@_fa": "true",
            "$": "https://api.elsevier.com/content/object/eid/1-s2.0-S0360132323004948-si127.svg?httpAccept=%2A%2F%2A",
            "@multimediatype": "Scalable Vector Graphics file",
            "@type": "ALTIMG",
            "@size": "11299",
            "@ref": "si127",
            "@mimetype": "image/svg+xml"
        },
        {
            "@category": "thumbnail",
            "@_fa": "true",
            "$": "https://api.elsevier.com/content/object/eid/1-s2.0-S0360132323004948-si121.svg?httpAccept=%2A%2F%2A",
            "@multimediatype": "Scalable Vector Graphics file",
            "@type": "ALTIMG",
            "@size": "81013",
            "@ref": "si121",
            "@mimetype": "image/svg+xml"
        },
        {
            "@category": "thumbnail",
            "@_fa": "true",
            "$": "https://api.elsevier.com/content/object/eid/1-s2.0-S0360132323004948-si170.svg?httpAccept=%2A%2F%2A",
            "@multimediatype": "Scalable Vector Graphics file",
            "@type": "ALTIMG",
            "@size": "21253",
            "@ref": "si170",
            "@mimetype": "image/svg+xml"
        },
        {
            "@category": "thumbnail",
            "@_fa": "true",
            "$": "https://api.elsevier.com/content/object/eid/1-s2.0-S0360132323004948-si136.svg?httpAccept=%2A%2F%2A",
            "@multimediatype": "Scalable Vector Graphics file",
            "@type": "ALTIMG",
            "@size": "25914",
            "@ref": "si136",
            "@mimetype": "image/svg+xml"
        },
        {
            "@category": "thumbnail",
            "@_fa": "true",
            "$": "https://api.elsevier.com/content/object/eid/1-s2.0-S0360132323004948-si133.svg?httpAccept=%2A%2F%2A",
            "@multimediatype": "Scalable Vector Graphics file",
            "@type": "ALTIMG",
            "@size": "58839",
            "@ref": "si133",
            "@mimetype": "image/svg+xml"
        },
        {
            "@category": "thumbnail",
            "@_fa": "true",
            "$": "https://api.elsevier.com/content/object/eid/1-s2.0-S0360132323004948-si181.svg?httpAccept=%2A%2F%2A",
            "@multimediatype": "Scalable Vector Graphics file",
            "@type": "ALTIMG",
            "@size": "22987",
            "@ref": "si181",
            "@mimetype": "image/svg+xml"
        },
        {
            "@category": "thumbnail",
            "@_fa": "true",
            "$": "https://api.elsevier.com/content/object/eid/1-s2.0-S0360132323004948-si69.svg?httpAccept=%2A%2F%2A",
            "@multimediatype": "Scalable Vector Graphics file",
            "@type": "ALTIMG",
            "@size": "9804",
            "@ref": "si69",
            "@mimetype": "image/svg+xml"
        },
        {
            "@category": "thumbnail",
            "@_fa": "true",
            "$": "https://api.elsevier.com/content/object/eid/1-s2.0-S0360132323004948-si43.svg?httpAccept=%2A%2F%2A",
            "@multimediatype": "Scalable Vector Graphics file",
            "@type": "ALTIMG",
            "@size": "64033",
            "@ref": "si43",
            "@mimetype": "image/svg+xml"
        },
        {
            "@category": "thumbnail",
            "@_fa": "true",
            "$": "https://api.elsevier.com/content/object/eid/1-s2.0-S0360132323004948-si166.svg?httpAccept=%2A%2F%2A",
            "@multimediatype": "Scalable Vector Graphics file",
            "@type": "ALTIMG",
            "@size": "56877",
            "@ref": "si166",
            "@mimetype": "image/svg+xml"
        },
        {
            "@category": "thumbnail",
            "@_fa": "true",
            "$": "https://api.elsevier.com/content/object/eid/1-s2.0-S0360132323004948-si130.svg?httpAccept=%2A%2F%2A",
            "@multimediatype": "Scalable Vector Graphics file",
            "@type": "ALTIMG",
            "@size": "39962",
            "@ref": "si130",
            "@mimetype": "image/svg+xml"
        },
        {
            "@category": "thumbnail",
            "@_fa": "true",
            "$": "https://api.elsevier.com/content/object/eid/1-s2.0-S0360132323004948-si31.svg?httpAccept=%2A%2F%2A",
            "@multimediatype": "Scalable Vector Graphics file",
            "@type": "ALTIMG",
            "@size": "18060",
            "@ref": "si31",
            "@mimetype": "image/svg+xml"
        },
        {
            "@category": "thumbnail",
            "@_fa": "true",
            "$": "https://api.elsevier.com/content/object/eid/1-s2.0-S0360132323004948-si91.svg?httpAccept=%2A%2F%2A",
            "@multimediatype": "Scalable Vector Graphics file",
            "@type": "ALTIMG",
            "@size": "26947",
            "@ref": "si91",
            "@mimetype": "image/svg+xml"
        },
        {
            "@category": "thumbnail",
            "@_fa": "true",
            "$": "https://api.elsevier.com/content/object/eid/1-s2.0-S0360132323004948-si168.svg?httpAccept=%2A%2F%2A",
            "@multimediatype": "Scalable Vector Graphics file",
            "@type": "ALTIMG",
            "@size": "81058",
            "@ref": "si168",
            "@mimetype": "image/svg+xml"
        },
        {
            "@category": "thumbnail",
            "@_fa": "true",
            "$": "https://api.elsevier.com/content/object/eid/1-s2.0-S0360132323004948-si77.svg?httpAccept=%2A%2F%2A",
            "@multimediatype": "Scalable Vector Graphics file",
            "@type": "ALTIMG",
            "@size": "10822",
            "@ref": "si77",
            "@mimetype": "image/svg+xml"
        },
        {
            "@category": "thumbnail",
            "@_fa": "true",
            "$": "https://api.elsevier.com/content/object/eid/1-s2.0-S0360132323004948-si150.svg?httpAccept=%2A%2F%2A",
            "@multimediatype": "Scalable Vector Graphics file",
            "@type": "ALTIMG",
            "@size": "42549",
            "@ref": "si150",
            "@mimetype": "image/svg+xml"
        },
        {
            "@category": "thumbnail",
            "@_fa": "true",
            "$": "https://api.elsevier.com/content/object/eid/1-s2.0-S0360132323004948-si46.svg?httpAccept=%2A%2F%2A",
            "@multimediatype": "Scalable Vector Graphics file",
            "@type": "ALTIMG",
            "@size": "9803",
            "@ref": "si46",
            "@mimetype": "image/svg+xml"
        },
        {
            "@category": "thumbnail",
            "@_fa": "true",
            "$": "https://api.elsevier.com/content/object/eid/1-s2.0-S0360132323004948-si175.svg?httpAccept=%2A%2F%2A",
            "@multimediatype": "Scalable Vector Graphics file",
            "@type": "ALTIMG",
            "@size": "44085",
            "@ref": "si175",
            "@mimetype": "image/svg+xml"
        },
        {
            "@category": "thumbnail",
            "@_fa": "true",
            "$": "https://api.elsevier.com/content/object/eid/1-s2.0-S0360132323004948-si2.svg?httpAccept=%2A%2F%2A",
            "@multimediatype": "Scalable Vector Graphics file",
            "@type": "ALTIMG",
            "@size": "15239",
            "@ref": "si2",
            "@mimetype": "image/svg+xml"
        },
        {
            "@category": "thumbnail",
            "@_fa": "true",
            "$": "https://api.elsevier.com/content/object/eid/1-s2.0-S0360132323004948-si128.svg?httpAccept=%2A%2F%2A",
            "@multimediatype": "Scalable Vector Graphics file",
            "@type": "ALTIMG",
            "@size": "16668",
            "@ref": "si128",
            "@mimetype": "image/svg+xml"
        },
        {
            "@category": "thumbnail",
            "@_fa": "true",
            "$": "https://api.elsevier.com/content/object/eid/1-s2.0-S0360132323004948-si119.svg?httpAccept=%2A%2F%2A",
            "@multimediatype": "Scalable Vector Graphics file",
            "@type": "ALTIMG",
            "@size": "59828",
            "@ref": "si119",
            "@mimetype": "image/svg+xml"
        },
        {
            "@category": "thumbnail",
            "@_fa": "true",
            "$": "https://api.elsevier.com/content/object/eid/1-s2.0-S0360132323004948-si112.svg?httpAccept=%2A%2F%2A",
            "@multimediatype": "Scalable Vector Graphics file",
            "@type": "ALTIMG",
            "@size": "88104",
            "@ref": "si112",
            "@mimetype": "image/svg+xml"
        },
        {
            "@category": "thumbnail",
            "@_fa": "true",
            "$": "https://api.elsevier.com/content/object/eid/1-s2.0-S0360132323004948-si90.svg?httpAccept=%2A%2F%2A",
            "@multimediatype": "Scalable Vector Graphics file",
            "@type": "ALTIMG",
            "@size": "10234",
            "@ref": "si90",
            "@mimetype": "image/svg+xml"
        },
        {
            "@category": "thumbnail",
            "@_fa": "true",
            "$": "https://api.elsevier.com/content/object/eid/1-s2.0-S0360132323004948-si109.svg?httpAccept=%2A%2F%2A",
            "@multimediatype": "Scalable Vector Graphics file",
            "@type": "ALTIMG",
            "@size": "41604",
            "@ref": "si109",
            "@mimetype": "image/svg+xml"
        },
        {
            "@category": "thumbnail",
            "@_fa": "true",
            "$": "https://api.elsevier.com/content/object/eid/1-s2.0-S0360132323004948-si50.svg?httpAccept=%2A%2F%2A",
            "@multimediatype": "Scalable Vector Graphics file",
            "@type": "ALTIMG",
            "@size": "25393",
            "@ref": "si50",
            "@mimetype": "image/svg+xml"
        },
        {
            "@category": "thumbnail",
            "@_fa": "true",
            "$": "https://api.elsevier.com/content/object/eid/1-s2.0-S0360132323004948-si6.svg?httpAccept=%2A%2F%2A",
            "@multimediatype": "Scalable Vector Graphics file",
            "@type": "ALTIMG",
            "@size": "47075",
            "@ref": "si6",
            "@mimetype": "image/svg+xml"
        },
        {
            "@category": "thumbnail",
            "@_fa": "true",
            "$": "https://api.elsevier.com/content/object/eid/1-s2.0-S0360132323004948-si7.svg?httpAccept=%2A%2F%2A",
            "@multimediatype": "Scalable Vector Graphics file",
            "@type": "ALTIMG",
            "@size": "52587",
            "@ref": "si7",
            "@mimetype": "image/svg+xml"
        },
        {
            "@category": "thumbnail",
            "@_fa": "true",
            "$": "https://api.elsevier.com/content/object/eid/1-s2.0-S0360132323004948-si153.svg?httpAccept=%2A%2F%2A",
            "@multimediatype": "Scalable Vector Graphics file",
            "@type": "ALTIMG",
            "@size": "6504",
            "@ref": "si153",
            "@mimetype": "image/svg+xml"
        },
        {
            "@category": "thumbnail",
            "@_fa": "true",
            "$": "https://api.elsevier.com/content/object/eid/1-s2.0-S0360132323004948-si53.svg?httpAccept=%2A%2F%2A",
            "@multimediatype": "Scalable Vector Graphics file",
            "@type": "ALTIMG",
            "@size": "27815",
            "@ref": "si53",
            "@mimetype": "image/svg+xml"
        },
        {
            "@category": "thumbnail",
            "@_fa": "true",
            "$": "https://api.elsevier.com/content/object/eid/1-s2.0-S0360132323004948-si125.svg?httpAccept=%2A%2F%2A",
            "@multimediatype": "Scalable Vector Graphics file",
            "@type": "ALTIMG",
            "@size": "14081",
            "@ref": "si125",
            "@mimetype": "image/svg+xml"
        },
        {
            "@category": "thumbnail",
            "@_fa": "true",
            "$": "https://api.elsevier.com/content/object/eid/1-s2.0-S0360132323004948-si164.svg?httpAccept=%2A%2F%2A",
            "@multimediatype": "Scalable Vector Graphics file",
            "@type": "ALTIMG",
            "@size": "48680",
            "@ref": "si164",
            "@mimetype": "image/svg+xml"
        },
        {
            "@category": "standard",
            "@_fa": "true",
            "$": "https://api.elsevier.com/content/object/eid/1-s2.0-S0360132323004948-am.pdf?httpAccept=%2A%2F%2A",
            "@multimediatype": "Acrobat PDF file",
            "@type": "AAM-PDF",
            "@size": "883888",
            "@ref": "am",
            "@mimetype": "application/pdf"
        }
    ]},
    "link": {
        "@rel": "abstract",
        "@href": "https://api.elsevier.com/content/abstract/scopus_id/85161294567"
    }
}}