{"full-text-retrieval-response": {
    "scopus-eid": "2-s2.0-85183786230",
    "originalText": "serial JL 271429 291210 291702 291731 291787 291877 291878 291881 31 90 Applied Energy APPLIEDENERGY 2024-01-09 2024-01-09 2024-01-09 2024-01-09 2024-03-01T16:33:00 1-s2.0-S0306261923018573 S0306-2619(23)01857-3 S0306261923018573 10.1016/j.apenergy.2023.122493 S300 S300.1 FULL-TEXT 1-s2.0-S0306261923X00282 2024-03-01T20:09:47.725743Z 0 0 20240315 2024 2024-01-09T06:58:44.480559Z absattachment articleinfo articlenumber articletitlenorm authfirstinitialnorm authfirstsurnamenorm cid cids contenttype copyright crossmark dateloaded dateloadedtxt datesearch datesort dateupdated dco docsubtype doctype doi eid ewtransactionid fundingbodyid hubeid indexeddate issn issnnorm itemstage itemtransactionid itemweight oauserlicense openaccess openarchive pg pgfirst pii piinorm pubdatestart pubdatetxt pubyr sectiontitle sortorder sponsoredaccesstype srctitle srctitlenorm srctype ssids alllist content oa subj subheadings suppl tomb volfirst volissue volumelist webpdf webpdfpagecount yearnav figure table body mmlmath acknowledge affil articletitle auth authfirstini authfull authkeywords authlast footnotes grantnumber grantsponsor grantsponsorid highlightsabst nomenclature orcid primabst ref specialabst 0306-2619 03062619 UNLIMITED SWISS2021 true 358 358 C Volume 358 92 122493 122493 122493 20240315 15 March 2024 2024-03-15 2024 Special section: AI in Carbon Emission article fla © 2024 The Authors. Published by Elsevier Ltd. DATADRIVENADAPTIVEBUILDINGTHERMALCONTROLLERTUNINGCONSTRAINTSAPRIMALDUALCONTEXTUALBAYESIANOPTIMIZATIONAPPROACH XU W Nomenclature 1 Introduction 2 Problem statement 3 Methodology 3.1 Preliminaries 3.2 PDCBO 3.3 Theoretical guarantees 4 Implementations and results 4.1 Implementation details 4.2 State-of-the-art baselines 4.3 Discomfort constrained energy minimization 4.3.1 Adaptivity gain compared to static parameters 4.3.2 Comparison with SafeOPT and CEI 4.3.3 Impact of discomfort threshold 4.3.4 Discomfort threshold tracking 4.4 Energy constrained discomfort minimization 5 Conclusion and discussion CRediT authorship contribution statement Acknowledgments References BOODI 2018 2604 A OLDEWURTEL 2012 15 27 F XIAO 2023 121165 T GAO 2023 121106 Y SVETOZAREVIC 2022 118127 B LEI 2022 119742 Y YANG 2015 577 586 L CORACI 2023 120598 D SHEN 2022 118724 R SALSBURY 2005 90 100 T STLUKA 2018 11 43 P INTELLIGENTBUILDINGCONTROLSYSTEMS ARCHITECTURESALGORITHMSFORBUILDINGAUTOMATIONANINDUSTRYVIEW FIDUCIOSO 2019 5850 5856 M PROCEEDINGSTWENTYEIGHTHINTERNATIONALJOINTCONFERENCEARTIFICIALINTELLIGENCE SAFECONTEXTUALBAYESIANOPTIMIZATIONFORSUSTAINABLEROOMTEMPERATUREPIDCONTROLTUNING YAN 2023 K SHEN 2023 120575 Y YAN 2022 109735 H DIAKAKI 2010 5483 5496 C CHANTRELLE 2011 1386 1394 F NGUYEN 2014 1043 1058 A XU 2022 5288 5293 W 2022AMERICANCONTROLCONFERENCE VABOVIOLATIONAWAREBAYESIANOPTIMIZATIONFORCLOSEDLOOPCONTROLPERFORMANCEOPTIMIZATIONUNMODELEDCONSTRAINTS XU 2023 W VIOLATIONAWARECONTEXTUALBAYESIANOPTIMIZATIONFORCONTROLLERPERFORMANCEOPTIMIZATIONUNMODELEDCONSTRAINTS JONES 1998 455 492 D XU 2022 W LOWERBOUNDSWORSTCASECOMPLEXITYEFFICIENTGLOBALOPTIMIZATION LI 2014 517 537 X ZHAN 2022 112278 S CHAKRABARTY 2021 111460 A BHATTACHARYA 2021 111077 A XU 2023 W JIANG 2022 118244 B LISICKI 2016 1404 1417 M GELBART 2014 250 259 M PROC30THCONFUNCERTAINTYINARTIFINTELL BAYESIANOPTIMIZATIONUNKNOWNCONSTRAINTS GARDNER 2014 937 945 J PROCINTCONFMACHLEARN BAYESIANOPTIMIZATIONINEQUALITYCONSTRAINTS XU 2023 W 2023IEEE62NDCONFERENCEDECISIONCONTROL PRIMALDUALCONTEXTUALBAYESIANOPTIMIZATIONFORCONTROLSYSTEMONLINEOPTIMIZATIONTIMEAVERAGECONSTRAINTS TALEGHANI 2013 201 215 M RASMUSSEN 2003 63 71 C SUMMERSCHOOLMACHINELEARNING GAUSSIANPROCESSESINMACHINELEARNING WILLIAMS 2006 C GAUSSIANPROCESSESFORMACHINELEARNINGVOL2 FRAZIER 2018 P ATUTORIALBAYESIANOPTIMIZATION SRINIVAS 2012 3250 3265 N NOCEDAL 1999 J NUMERICALOPTIMIZATION DINATALE 2022 119806 L DINATALE 2023 121071 L EWZ 2023 L CURRENTTARIFFSFORCITYZURICH GPY 2012 L GPYAGAUSSIANPROCESSFRAMEWORKINPYTHON WANG 2018 181 193 Z XU 2023 W BAYESIANOPTIMIZATIONEXPENSIVENESTEDGREYBOXFUNCTIONS XUX2024X122493 XUX2024X122493XW Full 2024-01-09T09:19:44Z FundingBody Swiss institutions 2021 http://creativecommons.org/licenses/by-nc-nd/4.0/ 2026-01-09T00:00:00.000Z 2026-01-09T00:00:00.000Z http://creativecommons.org/licenses/by-nc-nd/4.0/ This is an open access article under the CC BY-NC-ND license. © 2024 The Authors. Published by Elsevier Ltd. 2024-02-06T06:25:40.303Z http://vtw.elsevier.com/data/voc/AddOnTypes/50.7/aggregated-refined Swiss Data Science Center C20-13 Swiss National Science Foundation SNF Schweizerischer Nationalfonds zur Förderung der Wissenschaftlichen Forschung http://data.elsevier.com/vocabulary/SciValFunders/501100001711 http://sws.geonames.org/2658434/ This research was supported by the Swiss National Science Foundation, Switzerland under NCCR Automation, grant agreement 51NF40_180545 , and in part by the Swiss Data Science Center, Switzerland , grant agreement C20-13 . item S0306-2619(23)01857-3 S0306261923018573 1-s2.0-S0306261923018573 10.1016/j.apenergy.2023.122493 271429 2024-03-01T20:09:47.725743Z 2024-03-15 UNLIMITED SWISS2021 1-s2.0-S0306261923018573-main.pdf https://s3-eu-west-1.amazonaws.com/prod-ucs-content-store-eu-west/content/pii:S0306261923018573/MAIN/application/pdf/5df4e9b73093f96da1966b83641825d2/main.pdf main.pdf pdf true 1857954 MAIN 13 1-s2.0-S0306261923018573-main_1.png https://s3-eu-west-1.amazonaws.com/prod-ucs-content-store-eu-west/content/pii:S0306261923018573/PREVIEW/image/png/fa323a8a3c024cef50baf6b953da1afd/main_1.png main_1.png png 45499 849 656 IMAGE-WEB-PDF 1 1-s2.0-S0306261923018573-gr2.jpg https://s3-eu-west-1.amazonaws.com/prod-ucs-content-store-eu-west/content/pii:S0306261923018573/gr2/DOWNSAMPLED/image/jpeg/6593c03d4e511acf11fa8d5966a0f799/gr2.jpg gr2 gr2.jpg jpg 65700 250 349 IMAGE-DOWNSAMPLED 1-s2.0-S0306261923018573-ga1.jpg https://s3-eu-west-1.amazonaws.com/prod-ucs-content-store-eu-west/content/pii:S0306261923018573/ga1/DOWNSAMPLED/image/jpeg/63b80ffc58a3e9364c5b738b25d593c3/ga1.jpg ga1 true ga1.jpg jpg 85425 174 301 IMAGE-DOWNSAMPLED 1-s2.0-S0306261923018573-gr3.jpg https://s3-eu-west-1.amazonaws.com/prod-ucs-content-store-eu-west/content/pii:S0306261923018573/gr3/DOWNSAMPLED/image/jpeg/0c5498bb148476464210180a0197dab1/gr3.jpg gr3 gr3.jpg jpg 88988 468 320 IMAGE-DOWNSAMPLED 1-s2.0-S0306261923018573-gr10.jpg https://s3-eu-west-1.amazonaws.com/prod-ucs-content-store-eu-west/content/pii:S0306261923018573/gr10/DOWNSAMPLED/image/jpeg/cd66874d32b4c8ab2ba15d25c37dd5a9/gr10.jpg gr10 gr10.jpg jpg 79711 388 367 IMAGE-DOWNSAMPLED 1-s2.0-S0306261923018573-gr4.jpg https://s3-eu-west-1.amazonaws.com/prod-ucs-content-store-eu-west/content/pii:S0306261923018573/gr4/DOWNSAMPLED/image/jpeg/0b3e4d57ee0984ce3cb64f72e0df951c/gr4.jpg gr4 gr4.jpg jpg 108128 718 342 IMAGE-DOWNSAMPLED 1-s2.0-S0306261923018573-gr5.jpg https://s3-eu-west-1.amazonaws.com/prod-ucs-content-store-eu-west/content/pii:S0306261923018573/gr5/DOWNSAMPLED/image/jpeg/61365236312382b9a6acdc7b0fb24f84/gr5.jpg gr5 gr5.jpg jpg 164010 669 627 IMAGE-DOWNSAMPLED 1-s2.0-S0306261923018573-gr6.jpg https://s3-eu-west-1.amazonaws.com/prod-ucs-content-store-eu-west/content/pii:S0306261923018573/gr6/DOWNSAMPLED/image/jpeg/ab9ca495d15892d9dd28c6d37dffcf68/gr6.jpg gr6 gr6.jpg jpg 87053 420 365 IMAGE-DOWNSAMPLED 1-s2.0-S0306261923018573-gr7.jpg https://s3-eu-west-1.amazonaws.com/prod-ucs-content-store-eu-west/content/pii:S0306261923018573/gr7/DOWNSAMPLED/image/jpeg/1b77670878b0b7573991403b13fd5404/gr7.jpg gr7 gr7.jpg jpg 66180 500 338 IMAGE-DOWNSAMPLED 1-s2.0-S0306261923018573-gr8.jpg https://s3-eu-west-1.amazonaws.com/prod-ucs-content-store-eu-west/content/pii:S0306261923018573/gr8/DOWNSAMPLED/image/jpeg/3c8b353db0227a03c06e5af5dc6f12c0/gr8.jpg gr8 gr8.jpg jpg 105335 479 700 IMAGE-DOWNSAMPLED 1-s2.0-S0306261923018573-gr9.jpg https://s3-eu-west-1.amazonaws.com/prod-ucs-content-store-eu-west/content/pii:S0306261923018573/gr9/DOWNSAMPLED/image/jpeg/0c7ea99cc4e6584666be8772004b62a6/gr9.jpg gr9 gr9.jpg jpg 146872 654 642 IMAGE-DOWNSAMPLED 1-s2.0-S0306261923018573-fx1001.jpg https://s3-eu-west-1.amazonaws.com/prod-ucs-content-store-eu-west/content/pii:S0306261923018573/fx1001/DOWNSAMPLED/image/jpeg/17a67ea58449823447fae311126691f4/fx1001.jpg fx1001 fx1001.jpg jpg 101526 191 817 IMAGE-DOWNSAMPLED 1-s2.0-S0306261923018573-gr1.jpg https://s3-eu-west-1.amazonaws.com/prod-ucs-content-store-eu-west/content/pii:S0306261923018573/gr1/DOWNSAMPLED/image/jpeg/22b26d81d679f2d388c274f135bf9d26/gr1.jpg gr1 gr1.jpg jpg 123742 404 699 IMAGE-DOWNSAMPLED 1-s2.0-S0306261923018573-gr2.sml https://s3-eu-west-1.amazonaws.com/prod-ucs-content-store-eu-west/content/pii:S0306261923018573/gr2/THUMBNAIL/image/gif/689949bccdcff2f753f393bdf6033d66/gr2.sml gr2 gr2.sml sml 39414 157 219 IMAGE-THUMBNAIL 1-s2.0-S0306261923018573-ga1.sml https://s3-eu-west-1.amazonaws.com/prod-ucs-content-store-eu-west/content/pii:S0306261923018573/ga1/THUMBNAIL/image/gif/7a1fb117ce5bdaac74a6d0e45f6e3941/ga1.sml ga1 true ga1.sml sml 75298 127 219 IMAGE-THUMBNAIL 1-s2.0-S0306261923018573-gr3.sml https://s3-eu-west-1.amazonaws.com/prod-ucs-content-store-eu-west/content/pii:S0306261923018573/gr3/THUMBNAIL/image/gif/4c0e9cdaf7827f0a785657f05d633990/gr3.sml gr3 gr3.sml sml 21337 164 112 IMAGE-THUMBNAIL 1-s2.0-S0306261923018573-gr10.sml https://s3-eu-west-1.amazonaws.com/prod-ucs-content-store-eu-west/content/pii:S0306261923018573/gr10/THUMBNAIL/image/gif/491ba201df443cb5e047220a73c16074/gr10.sml gr10 gr10.sml sml 24223 164 155 IMAGE-THUMBNAIL 1-s2.0-S0306261923018573-gr4.sml https://s3-eu-west-1.amazonaws.com/prod-ucs-content-store-eu-west/content/pii:S0306261923018573/gr4/THUMBNAIL/image/gif/1b48fd678d364f8f3bffe0f20b9aad27/gr4.sml gr4 gr4.sml sml 15648 164 78 IMAGE-THUMBNAIL 1-s2.0-S0306261923018573-gr5.sml https://s3-eu-west-1.amazonaws.com/prod-ucs-content-store-eu-west/content/pii:S0306261923018573/gr5/THUMBNAIL/image/gif/5ecdbea0d42702b8ee50c0f6636eb39c/gr5.sml gr5 gr5.sml sml 23930 164 154 IMAGE-THUMBNAIL 1-s2.0-S0306261923018573-gr6.sml https://s3-eu-west-1.amazonaws.com/prod-ucs-content-store-eu-west/content/pii:S0306261923018573/gr6/THUMBNAIL/image/gif/5fbda87926f6335dd6ab821920609aab/gr6.sml gr6 gr6.sml sml 24565 163 142 IMAGE-THUMBNAIL 1-s2.0-S0306261923018573-gr7.sml https://s3-eu-west-1.amazonaws.com/prod-ucs-content-store-eu-west/content/pii:S0306261923018573/gr7/THUMBNAIL/image/gif/cb0c60360ba5168710350eb48d6c9378/gr7.sml gr7 gr7.sml sml 16442 163 110 IMAGE-THUMBNAIL 1-s2.0-S0306261923018573-gr8.sml https://s3-eu-west-1.amazonaws.com/prod-ucs-content-store-eu-west/content/pii:S0306261923018573/gr8/THUMBNAIL/image/gif/c74da730c027f34590a04ecf6c2c60eb/gr8.sml gr8 gr8.sml sml 20212 150 219 IMAGE-THUMBNAIL 1-s2.0-S0306261923018573-gr9.sml https://s3-eu-west-1.amazonaws.com/prod-ucs-content-store-eu-west/content/pii:S0306261923018573/gr9/THUMBNAIL/image/gif/60c51e6590db1468dbded52bbbfef100/gr9.sml gr9 gr9.sml sml 23569 164 161 IMAGE-THUMBNAIL 1-s2.0-S0306261923018573-fx1001.sml https://s3-eu-west-1.amazonaws.com/prod-ucs-content-store-eu-west/content/pii:S0306261923018573/fx1001/THUMBNAIL/image/gif/8f0ffc0d8f8efbe41e1aeee7343fdc6f/fx1001.sml fx1001 fx1001.sml sml 68682 51 219 IMAGE-THUMBNAIL 1-s2.0-S0306261923018573-gr1.sml https://s3-eu-west-1.amazonaws.com/prod-ucs-content-store-eu-west/content/pii:S0306261923018573/gr1/THUMBNAIL/image/gif/18f82b978bf90f583992002993b145b7/gr1.sml gr1 gr1.sml sml 74951 127 219 IMAGE-THUMBNAIL 1-s2.0-S0306261923018573-gr2_lrg.jpg https://s3-eu-west-1.amazonaws.com/prod-ucs-content-store-eu-west/content/pii:S0306261923018573/HIGHRES/image/jpeg/73254d79313cc0ad06e00e9de5af2ba3/gr2_lrg.jpg gr2 gr2_lrg.jpg jpg 515954 1109 1546 IMAGE-HIGH-RES 1-s2.0-S0306261923018573-ga1_lrg.jpg https://s3-eu-west-1.amazonaws.com/prod-ucs-content-store-eu-west/content/pii:S0306261923018573/HIGHRES/image/jpeg/b08462b86061a94c374ce0ab7c234d47/ga1_lrg.jpg ga1 true ga1_lrg.jpg jpg 206305 771 1333 IMAGE-HIGH-RES 1-s2.0-S0306261923018573-gr3_lrg.jpg https://s3-eu-west-1.amazonaws.com/prod-ucs-content-store-eu-west/content/pii:S0306261923018573/HIGHRES/image/jpeg/468e11799cc5437ae27fbda5f4522e64/gr3_lrg.jpg gr3 gr3_lrg.jpg jpg 563346 2072 1416 IMAGE-HIGH-RES 1-s2.0-S0306261923018573-gr10_lrg.jpg https://s3-eu-west-1.amazonaws.com/prod-ucs-content-store-eu-west/content/pii:S0306261923018573/HIGHRES/image/jpeg/927f7e137218cef3de25f32c236839e5/gr10_lrg.jpg gr10 gr10_lrg.jpg jpg 415076 1717 1625 IMAGE-HIGH-RES 1-s2.0-S0306261923018573-gr4_lrg.jpg https://s3-eu-west-1.amazonaws.com/prod-ucs-content-store-eu-west/content/pii:S0306261923018573/HIGHRES/image/jpeg/17e8c50bd2cb796e802b551d1b927abe/gr4_lrg.jpg gr4 gr4_lrg.jpg jpg 655781 3178 1514 IMAGE-HIGH-RES 1-s2.0-S0306261923018573-gr5_lrg.jpg https://s3-eu-west-1.amazonaws.com/prod-ucs-content-store-eu-west/content/pii:S0306261923018573/HIGHRES/image/jpeg/bef04a859dd951d17c25e216802e51dd/gr5_lrg.jpg gr5 gr5_lrg.jpg jpg 1060281 2959 2775 IMAGE-HIGH-RES 1-s2.0-S0306261923018573-gr6_lrg.jpg https://s3-eu-west-1.amazonaws.com/prod-ucs-content-store-eu-west/content/pii:S0306261923018573/HIGHRES/image/jpeg/a562b617cf86350bb40d7c58d5f07467/gr6_lrg.jpg gr6 gr6_lrg.jpg jpg 520598 1862 1619 IMAGE-HIGH-RES 1-s2.0-S0306261923018573-gr7_lrg.jpg https://s3-eu-west-1.amazonaws.com/prod-ucs-content-store-eu-west/content/pii:S0306261923018573/HIGHRES/image/jpeg/f8763551cdacb303faafa8605624242a/gr7_lrg.jpg gr7 gr7_lrg.jpg jpg 368762 2217 1498 IMAGE-HIGH-RES 1-s2.0-S0306261923018573-gr8_lrg.jpg https://s3-eu-west-1.amazonaws.com/prod-ucs-content-store-eu-west/content/pii:S0306261923018573/HIGHRES/image/jpeg/666a2f0f9027d2c0a07f3f13226611bf/gr8_lrg.jpg gr8 gr8_lrg.jpg jpg 657249 2122 3100 IMAGE-HIGH-RES 1-s2.0-S0306261923018573-gr9_lrg.jpg https://s3-eu-west-1.amazonaws.com/prod-ucs-content-store-eu-west/content/pii:S0306261923018573/HIGHRES/image/jpeg/939271e0d69bfcd5b5fa26d1a29c585e/gr9_lrg.jpg gr9 gr9_lrg.jpg jpg 934772 2899 2845 IMAGE-HIGH-RES 1-s2.0-S0306261923018573-fx1001_lrg.jpg https://s3-eu-west-1.amazonaws.com/prod-ucs-content-store-eu-west/content/pii:S0306261923018573/HIGHRES/image/jpeg/bc504ece65370e9d493ce3b19e030239/fx1001_lrg.jpg fx1001 fx1001_lrg.jpg jpg 322512 847 3618 IMAGE-HIGH-RES 1-s2.0-S0306261923018573-gr1_lrg.jpg https://s3-eu-west-1.amazonaws.com/prod-ucs-content-store-eu-west/content/pii:S0306261923018573/HIGHRES/image/jpeg/37ef0c6aa3a89089099593288a5ddfe3/gr1_lrg.jpg gr1 gr1_lrg.jpg jpg 539999 1790 3096 IMAGE-HIGH-RES 1-s2.0-S0306261923018573-si1.svg https://s3-eu-west-1.amazonaws.com/prod-ucs-content-store-eu-west/content/pii:S0306261923018573/image/svg+xml/568b284b10023b65732d6764e291b593/si1.svg si1 si1.svg svg 1587 ALTIMG 1-s2.0-S0306261923018573-si100.svg https://s3-eu-west-1.amazonaws.com/prod-ucs-content-store-eu-west/content/pii:S0306261923018573/image/svg+xml/2de9713325006e68dc44c70ff38b1052/si100.svg si100 si100.svg svg 27578 ALTIMG 1-s2.0-S0306261923018573-si101.svg https://s3-eu-west-1.amazonaws.com/prod-ucs-content-store-eu-west/content/pii:S0306261923018573/image/svg+xml/0c92e9ce231be3115d2dd365d0f8d5be/si101.svg si101 si101.svg svg 4242 ALTIMG 1-s2.0-S0306261923018573-si102.svg https://s3-eu-west-1.amazonaws.com/prod-ucs-content-store-eu-west/content/pii:S0306261923018573/image/svg+xml/091d13942eea11dd3b0215c84efcb7cb/si102.svg si102 si102.svg svg 8857 ALTIMG 1-s2.0-S0306261923018573-si103.svg https://s3-eu-west-1.amazonaws.com/prod-ucs-content-store-eu-west/content/pii:S0306261923018573/image/svg+xml/2a52fdf31550a8599fe95fda46d19424/si103.svg si103 si103.svg svg 1351 ALTIMG 1-s2.0-S0306261923018573-si104.svg https://s3-eu-west-1.amazonaws.com/prod-ucs-content-store-eu-west/content/pii:S0306261923018573/image/svg+xml/681859fcbb9d2399d0c3876b12a4be44/si104.svg si104 si104.svg svg 8878 ALTIMG 1-s2.0-S0306261923018573-si105.svg https://s3-eu-west-1.amazonaws.com/prod-ucs-content-store-eu-west/content/pii:S0306261923018573/image/svg+xml/468ac8378c3e690d497f23b6b54dddd9/si105.svg si105 si105.svg svg 10704 ALTIMG 1-s2.0-S0306261923018573-si106.svg https://s3-eu-west-1.amazonaws.com/prod-ucs-content-store-eu-west/content/pii:S0306261923018573/image/svg+xml/adc41b352c99deab2e01d5259066b318/si106.svg si106 si106.svg svg 13874 ALTIMG 1-s2.0-S0306261923018573-si107.svg https://s3-eu-west-1.amazonaws.com/prod-ucs-content-store-eu-west/content/pii:S0306261923018573/image/svg+xml/da215d0df3b38512d77401bf1b3fed37/si107.svg si107 si107.svg svg 13443 ALTIMG 1-s2.0-S0306261923018573-si11.svg https://s3-eu-west-1.amazonaws.com/prod-ucs-content-store-eu-west/content/pii:S0306261923018573/image/svg+xml/adb9a058a823905cd7b4715d15a39ef9/si11.svg si11 si11.svg svg 1200 ALTIMG 1-s2.0-S0306261923018573-si115.svg https://s3-eu-west-1.amazonaws.com/prod-ucs-content-store-eu-west/content/pii:S0306261923018573/image/svg+xml/4bd78c1c0401afa2c2761769a1f21692/si115.svg si115 si115.svg svg 29304 ALTIMG 1-s2.0-S0306261923018573-si116.svg https://s3-eu-west-1.amazonaws.com/prod-ucs-content-store-eu-west/content/pii:S0306261923018573/image/svg+xml/7d5dc488584384eaa590b7008a7d484d/si116.svg si116 si116.svg svg 6112 ALTIMG 1-s2.0-S0306261923018573-si119.svg https://s3-eu-west-1.amazonaws.com/prod-ucs-content-store-eu-west/content/pii:S0306261923018573/image/svg+xml/165aeb18914000a048731cbde4dd51a1/si119.svg si119 si119.svg svg 18955 ALTIMG 1-s2.0-S0306261923018573-si12.svg https://s3-eu-west-1.amazonaws.com/prod-ucs-content-store-eu-west/content/pii:S0306261923018573/image/svg+xml/90461725bc6a8d58135994e98d7682f4/si12.svg si12 si12.svg svg 1286 ALTIMG 1-s2.0-S0306261923018573-si120.svg https://s3-eu-west-1.amazonaws.com/prod-ucs-content-store-eu-west/content/pii:S0306261923018573/image/svg+xml/d4f15d99f60ab60fe18aff20f619cc07/si120.svg si120 si120.svg svg 18225 ALTIMG 1-s2.0-S0306261923018573-si121.svg https://s3-eu-west-1.amazonaws.com/prod-ucs-content-store-eu-west/content/pii:S0306261923018573/image/svg+xml/ce54098870baced37fcdca0a678956c5/si121.svg si121 si121.svg svg 11194 ALTIMG 1-s2.0-S0306261923018573-si124.svg https://s3-eu-west-1.amazonaws.com/prod-ucs-content-store-eu-west/content/pii:S0306261923018573/image/svg+xml/a9e4281eb58aa4be6203491c9d450d11/si124.svg si124 si124.svg svg 13070 ALTIMG 1-s2.0-S0306261923018573-si125.svg https://s3-eu-west-1.amazonaws.com/prod-ucs-content-store-eu-west/content/pii:S0306261923018573/image/svg+xml/2b63fc7e9f959edbca9c8745139461df/si125.svg si125 si125.svg svg 4535 ALTIMG 1-s2.0-S0306261923018573-si126.svg https://s3-eu-west-1.amazonaws.com/prod-ucs-content-store-eu-west/content/pii:S0306261923018573/image/svg+xml/ebe34f08feba12dfb65cf0c01d0e7873/si126.svg si126 si126.svg svg 2993 ALTIMG 1-s2.0-S0306261923018573-si127.svg https://s3-eu-west-1.amazonaws.com/prod-ucs-content-store-eu-west/content/pii:S0306261923018573/image/svg+xml/97be0586ae212a0fd303314a2e6dd592/si127.svg si127 si127.svg svg 16410 ALTIMG 1-s2.0-S0306261923018573-si128.svg https://s3-eu-west-1.amazonaws.com/prod-ucs-content-store-eu-west/content/pii:S0306261923018573/image/svg+xml/ae7c3a80a25c18765eea228f419c42ca/si128.svg si128 si128.svg svg 17467 ALTIMG 1-s2.0-S0306261923018573-si13.svg https://s3-eu-west-1.amazonaws.com/prod-ucs-content-store-eu-west/content/pii:S0306261923018573/image/svg+xml/7d9c7c1056761310721f91e6d1ed8b23/si13.svg si13 si13.svg svg 4670 ALTIMG 1-s2.0-S0306261923018573-si133.svg https://s3-eu-west-1.amazonaws.com/prod-ucs-content-store-eu-west/content/pii:S0306261923018573/image/svg+xml/2d2627d44e2fee85b3b80f44aaaec809/si133.svg si133 si133.svg svg 11812 ALTIMG 1-s2.0-S0306261923018573-si134.svg https://s3-eu-west-1.amazonaws.com/prod-ucs-content-store-eu-west/content/pii:S0306261923018573/image/svg+xml/3f33a883842f6b91f3fa0b784b71f9eb/si134.svg si134 si134.svg svg 1252 ALTIMG 1-s2.0-S0306261923018573-si135.svg https://s3-eu-west-1.amazonaws.com/prod-ucs-content-store-eu-west/content/pii:S0306261923018573/image/svg+xml/e8c5935033c7e52d9d962a69b55934a4/si135.svg si135 si135.svg svg 15403 ALTIMG 1-s2.0-S0306261923018573-si138.svg https://s3-eu-west-1.amazonaws.com/prod-ucs-content-store-eu-west/content/pii:S0306261923018573/image/svg+xml/47bfc2ed13eee3752d99cfd6bed7c67b/si138.svg si138 si138.svg svg 1518 ALTIMG 1-s2.0-S0306261923018573-si14.svg https://s3-eu-west-1.amazonaws.com/prod-ucs-content-store-eu-west/content/pii:S0306261923018573/image/svg+xml/d47cb1b8e08e7c5158b468cc2623cca6/si14.svg si14 si14.svg svg 5221 ALTIMG 1-s2.0-S0306261923018573-si140.svg https://s3-eu-west-1.amazonaws.com/prod-ucs-content-store-eu-west/content/pii:S0306261923018573/image/svg+xml/5ca745b71a81ba8bfc9876dd19e04585/si140.svg si140 si140.svg svg 2574 ALTIMG 1-s2.0-S0306261923018573-si143.svg https://s3-eu-west-1.amazonaws.com/prod-ucs-content-store-eu-west/content/pii:S0306261923018573/image/svg+xml/420ddaf05026fcd68e5cea18da424aad/si143.svg si143 si143.svg svg 4550 ALTIMG 1-s2.0-S0306261923018573-si147.svg https://s3-eu-west-1.amazonaws.com/prod-ucs-content-store-eu-west/content/pii:S0306261923018573/image/svg+xml/591469bc49ef9a8c9219b7cda2d59946/si147.svg si147 si147.svg svg 21484 ALTIMG 1-s2.0-S0306261923018573-si148.svg https://s3-eu-west-1.amazonaws.com/prod-ucs-content-store-eu-west/content/pii:S0306261923018573/image/svg+xml/f6a4a6ccf7fb5f638a95425cf3fe03af/si148.svg si148 si148.svg svg 6204 ALTIMG 1-s2.0-S0306261923018573-si15.svg https://s3-eu-west-1.amazonaws.com/prod-ucs-content-store-eu-west/content/pii:S0306261923018573/image/svg+xml/bf120144734396e7aa5f6c68233fa5f6/si15.svg si15 si15.svg svg 3130 ALTIMG 1-s2.0-S0306261923018573-si150.svg https://s3-eu-west-1.amazonaws.com/prod-ucs-content-store-eu-west/content/pii:S0306261923018573/image/svg+xml/c497d16c30bb1d08be10beb32310248d/si150.svg si150 si150.svg svg 3076 ALTIMG 1-s2.0-S0306261923018573-si151.svg https://s3-eu-west-1.amazonaws.com/prod-ucs-content-store-eu-west/content/pii:S0306261923018573/image/svg+xml/4143c686cd3af9b51659d68c3f8397fa/si151.svg si151 si151.svg svg 3649 ALTIMG 1-s2.0-S0306261923018573-si154.svg https://s3-eu-west-1.amazonaws.com/prod-ucs-content-store-eu-west/content/pii:S0306261923018573/image/svg+xml/e8523f68c416ad9b666c28d952576061/si154.svg si154 si154.svg svg 15027 ALTIMG 1-s2.0-S0306261923018573-si155.svg https://s3-eu-west-1.amazonaws.com/prod-ucs-content-store-eu-west/content/pii:S0306261923018573/image/svg+xml/a1528b704146d7b328cd7984f26fb14f/si155.svg si155 si155.svg svg 9431 ALTIMG 1-s2.0-S0306261923018573-si157.svg https://s3-eu-west-1.amazonaws.com/prod-ucs-content-store-eu-west/content/pii:S0306261923018573/image/svg+xml/1e677e3bfddd9066d7428b92f802f704/si157.svg si157 si157.svg svg 10183 ALTIMG 1-s2.0-S0306261923018573-si158.svg https://s3-eu-west-1.amazonaws.com/prod-ucs-content-store-eu-west/content/pii:S0306261923018573/image/svg+xml/287a717193a2b5d5bd69f387a5b2b583/si158.svg si158 si158.svg svg 26194 ALTIMG 1-s2.0-S0306261923018573-si160.svg https://s3-eu-west-1.amazonaws.com/prod-ucs-content-store-eu-west/content/pii:S0306261923018573/image/svg+xml/d9665eaf8a53bbf3958944ddca706af3/si160.svg si160 si160.svg svg 2227 ALTIMG 1-s2.0-S0306261923018573-si161.svg https://s3-eu-west-1.amazonaws.com/prod-ucs-content-store-eu-west/content/pii:S0306261923018573/image/svg+xml/ee60c86189cadd4df5253b49dcaefc74/si161.svg si161 si161.svg svg 1303 ALTIMG 1-s2.0-S0306261923018573-si162.svg https://s3-eu-west-1.amazonaws.com/prod-ucs-content-store-eu-west/content/pii:S0306261923018573/image/svg+xml/723bb301ccc93903e0e4857c8332d362/si162.svg si162 si162.svg svg 1615 ALTIMG 1-s2.0-S0306261923018573-si163.svg https://s3-eu-west-1.amazonaws.com/prod-ucs-content-store-eu-west/content/pii:S0306261923018573/image/svg+xml/2ff508399a7ef5fe1b5fb869c813fabd/si163.svg si163 si163.svg svg 2569 ALTIMG 1-s2.0-S0306261923018573-si164.svg https://s3-eu-west-1.amazonaws.com/prod-ucs-content-store-eu-west/content/pii:S0306261923018573/image/svg+xml/5b7124911176fec6f699bc3e03558460/si164.svg si164 si164.svg svg 5763 ALTIMG 1-s2.0-S0306261923018573-si166.svg https://s3-eu-west-1.amazonaws.com/prod-ucs-content-store-eu-west/content/pii:S0306261923018573/image/svg+xml/06bb83fb16655ba8c011663525920d19/si166.svg si166 si166.svg svg 1021 ALTIMG 1-s2.0-S0306261923018573-si167.svg https://s3-eu-west-1.amazonaws.com/prod-ucs-content-store-eu-west/content/pii:S0306261923018573/image/svg+xml/0aadfe618b3c57c1b367d911ab1c2b53/si167.svg si167 si167.svg svg 6342 ALTIMG 1-s2.0-S0306261923018573-si168.svg https://s3-eu-west-1.amazonaws.com/prod-ucs-content-store-eu-west/content/pii:S0306261923018573/image/svg+xml/c5f8b81b787efc94e55fdccca520444d/si168.svg si168 si168.svg svg 1231 ALTIMG 1-s2.0-S0306261923018573-si169.svg https://s3-eu-west-1.amazonaws.com/prod-ucs-content-store-eu-west/content/pii:S0306261923018573/image/svg+xml/d07f3954702a71fbbb01a29c6b743de6/si169.svg si169 si169.svg svg 1783 ALTIMG 1-s2.0-S0306261923018573-si17.svg https://s3-eu-west-1.amazonaws.com/prod-ucs-content-store-eu-west/content/pii:S0306261923018573/image/svg+xml/b4b31e8d95c9a9d4dc4b606f183c047c/si17.svg si17 si17.svg svg 3592 ALTIMG 1-s2.0-S0306261923018573-si170.svg https://s3-eu-west-1.amazonaws.com/prod-ucs-content-store-eu-west/content/pii:S0306261923018573/image/svg+xml/0da50d103a7ca9bab6efd7fa15734d40/si170.svg si170 si170.svg svg 3390 ALTIMG 1-s2.0-S0306261923018573-si171.svg https://s3-eu-west-1.amazonaws.com/prod-ucs-content-store-eu-west/content/pii:S0306261923018573/image/svg+xml/3a81fac67342025b1a24f2f27b7ae31d/si171.svg si171 si171.svg svg 3287 ALTIMG 1-s2.0-S0306261923018573-si172.svg https://s3-eu-west-1.amazonaws.com/prod-ucs-content-store-eu-west/content/pii:S0306261923018573/image/svg+xml/c71c718c0730ff53dfbaef089ca1a47a/si172.svg si172 si172.svg svg 4016 ALTIMG 1-s2.0-S0306261923018573-si176.svg https://s3-eu-west-1.amazonaws.com/prod-ucs-content-store-eu-west/content/pii:S0306261923018573/image/svg+xml/1b785505048d6babb41f5a5f0054892b/si176.svg si176 si176.svg svg 2233 ALTIMG 1-s2.0-S0306261923018573-si177.svg https://s3-eu-west-1.amazonaws.com/prod-ucs-content-store-eu-west/content/pii:S0306261923018573/image/svg+xml/ce3f1fef9c6d41d121fc60d8b72ee097/si177.svg si177 si177.svg svg 6122 ALTIMG 1-s2.0-S0306261923018573-si178.svg https://s3-eu-west-1.amazonaws.com/prod-ucs-content-store-eu-west/content/pii:S0306261923018573/image/svg+xml/6e4dbe260ea62a23c57f248a374b4b2a/si178.svg si178 si178.svg svg 4688 ALTIMG 1-s2.0-S0306261923018573-si179.svg https://s3-eu-west-1.amazonaws.com/prod-ucs-content-store-eu-west/content/pii:S0306261923018573/image/svg+xml/748a46aa6eb9c85a5e2cc9f0f32f3569/si179.svg si179 si179.svg svg 6516 ALTIMG 1-s2.0-S0306261923018573-si180.svg https://s3-eu-west-1.amazonaws.com/prod-ucs-content-store-eu-west/content/pii:S0306261923018573/image/svg+xml/27f4d6f80cbcd6cb83a289ea0ea1adef/si180.svg si180 si180.svg svg 4038 ALTIMG 1-s2.0-S0306261923018573-si181.svg https://s3-eu-west-1.amazonaws.com/prod-ucs-content-store-eu-west/content/pii:S0306261923018573/image/svg+xml/69e2fe9307db1f28bfece393e8616737/si181.svg si181 si181.svg svg 2773 ALTIMG 1-s2.0-S0306261923018573-si182.svg https://s3-eu-west-1.amazonaws.com/prod-ucs-content-store-eu-west/content/pii:S0306261923018573/image/svg+xml/7b07111f354f9cb54a42824c246c79be/si182.svg si182 si182.svg svg 2494 ALTIMG 1-s2.0-S0306261923018573-si183.svg https://s3-eu-west-1.amazonaws.com/prod-ucs-content-store-eu-west/content/pii:S0306261923018573/image/svg+xml/c4e53d9c6403f35e2863b2a17c492350/si183.svg si183 si183.svg svg 1266 ALTIMG 1-s2.0-S0306261923018573-si184.svg https://s3-eu-west-1.amazonaws.com/prod-ucs-content-store-eu-west/content/pii:S0306261923018573/image/svg+xml/a29d4a3912ae20f6ed616bde57cd52e9/si184.svg si184 si184.svg svg 3859 ALTIMG 1-s2.0-S0306261923018573-si187.svg https://s3-eu-west-1.amazonaws.com/prod-ucs-content-store-eu-west/content/pii:S0306261923018573/image/svg+xml/164a516fda882871fa9e21f06ad4cd0b/si187.svg si187 si187.svg svg 7041 ALTIMG 1-s2.0-S0306261923018573-si188.svg https://s3-eu-west-1.amazonaws.com/prod-ucs-content-store-eu-west/content/pii:S0306261923018573/image/svg+xml/5f29c8e04ffb8a70dbc249ac006832f1/si188.svg si188 si188.svg svg 6808 ALTIMG 1-s2.0-S0306261923018573-si189.svg https://s3-eu-west-1.amazonaws.com/prod-ucs-content-store-eu-west/content/pii:S0306261923018573/image/svg+xml/e24f3598b82abf1dd5ae0f2c3df58d01/si189.svg si189 si189.svg svg 3624 ALTIMG 1-s2.0-S0306261923018573-si19.svg https://s3-eu-west-1.amazonaws.com/prod-ucs-content-store-eu-west/content/pii:S0306261923018573/image/svg+xml/9d0dd7c941e7df459d38cb87f67d1702/si19.svg si19 si19.svg svg 2050 ALTIMG 1-s2.0-S0306261923018573-si190.svg https://s3-eu-west-1.amazonaws.com/prod-ucs-content-store-eu-west/content/pii:S0306261923018573/image/svg+xml/063667e268b70c8c4f262e727e9932bd/si190.svg si190 si190.svg svg 3694 ALTIMG 1-s2.0-S0306261923018573-si191.svg https://s3-eu-west-1.amazonaws.com/prod-ucs-content-store-eu-west/content/pii:S0306261923018573/image/svg+xml/f3bce358231b3adcaa17b61da98dc48f/si191.svg si191 si191.svg svg 4140 ALTIMG 1-s2.0-S0306261923018573-si192.svg https://s3-eu-west-1.amazonaws.com/prod-ucs-content-store-eu-west/content/pii:S0306261923018573/image/svg+xml/cf0311be5d1c98585e89bcb34e74f8b7/si192.svg si192 si192.svg svg 7526 ALTIMG 1-s2.0-S0306261923018573-si193.svg https://s3-eu-west-1.amazonaws.com/prod-ucs-content-store-eu-west/content/pii:S0306261923018573/image/svg+xml/1ba55241bd66a5a7ac34a949295ac3e6/si193.svg si193 si193.svg svg 7293 ALTIMG 1-s2.0-S0306261923018573-si194.svg https://s3-eu-west-1.amazonaws.com/prod-ucs-content-store-eu-west/content/pii:S0306261923018573/image/svg+xml/6cea6d3ac69bafbfc177afae90d8bf70/si194.svg si194 si194.svg svg 7396 ALTIMG 1-s2.0-S0306261923018573-si195.svg https://s3-eu-west-1.amazonaws.com/prod-ucs-content-store-eu-west/content/pii:S0306261923018573/image/svg+xml/c018642f4a197720578064b6a299706c/si195.svg si195 si195.svg svg 1986 ALTIMG 1-s2.0-S0306261923018573-si196.svg https://s3-eu-west-1.amazonaws.com/prod-ucs-content-store-eu-west/content/pii:S0306261923018573/image/svg+xml/2c0b62262f5ca7d691a53b390c152f4e/si196.svg si196 si196.svg svg 2544 ALTIMG 1-s2.0-S0306261923018573-si197.svg https://s3-eu-west-1.amazonaws.com/prod-ucs-content-store-eu-west/content/pii:S0306261923018573/image/svg+xml/c970f9d836991a53b288793ada07389c/si197.svg si197 si197.svg svg 904 ALTIMG 1-s2.0-S0306261923018573-si2.svg https://s3-eu-west-1.amazonaws.com/prod-ucs-content-store-eu-west/content/pii:S0306261923018573/image/svg+xml/4c450f0f4314444c142306f0d15ff8f4/si2.svg si2 si2.svg svg 2768 ALTIMG 1-s2.0-S0306261923018573-si20.svg https://s3-eu-west-1.amazonaws.com/prod-ucs-content-store-eu-west/content/pii:S0306261923018573/image/svg+xml/91fdea3c371e9cd15477aedf2fff7f55/si20.svg si20 si20.svg svg 1881 ALTIMG 1-s2.0-S0306261923018573-si202.svg https://s3-eu-west-1.amazonaws.com/prod-ucs-content-store-eu-west/content/pii:S0306261923018573/image/svg+xml/718403506b14e85753433343fe63fd45/si202.svg si202 si202.svg svg 4245 ALTIMG 1-s2.0-S0306261923018573-si204.svg https://s3-eu-west-1.amazonaws.com/prod-ucs-content-store-eu-west/content/pii:S0306261923018573/image/svg+xml/c6259619b1c61c7472313dde5e278baa/si204.svg si204 si204.svg svg 43078 ALTIMG 1-s2.0-S0306261923018573-si208.svg https://s3-eu-west-1.amazonaws.com/prod-ucs-content-store-eu-west/content/pii:S0306261923018573/image/svg+xml/08681a8533e84e709cf3309381de48e3/si208.svg si208 si208.svg svg 1093 ALTIMG 1-s2.0-S0306261923018573-si209.svg https://s3-eu-west-1.amazonaws.com/prod-ucs-content-store-eu-west/content/pii:S0306261923018573/image/svg+xml/5cf669f6f5808a4a262f200edfa586d1/si209.svg si209 si209.svg svg 3648 ALTIMG 1-s2.0-S0306261923018573-si21.svg https://s3-eu-west-1.amazonaws.com/prod-ucs-content-store-eu-west/content/pii:S0306261923018573/image/svg+xml/286a1fc2633af1d81d780be196bab331/si21.svg si21 si21.svg svg 2512 ALTIMG 1-s2.0-S0306261923018573-si213.svg https://s3-eu-west-1.amazonaws.com/prod-ucs-content-store-eu-west/content/pii:S0306261923018573/image/svg+xml/fca63823c358d845dd5745670c0067ec/si213.svg si213 si213.svg svg 1455 ALTIMG 1-s2.0-S0306261923018573-si214.svg https://s3-eu-west-1.amazonaws.com/prod-ucs-content-store-eu-west/content/pii:S0306261923018573/image/svg+xml/cd5be9de2317cf404971da4650c201fe/si214.svg si214 si214.svg svg 2137 ALTIMG 1-s2.0-S0306261923018573-si22.svg https://s3-eu-west-1.amazonaws.com/prod-ucs-content-store-eu-west/content/pii:S0306261923018573/image/svg+xml/03f3dce1155de9b00755e1377e68d9e1/si22.svg si22 si22.svg svg 2340 ALTIMG 1-s2.0-S0306261923018573-si220.svg https://s3-eu-west-1.amazonaws.com/prod-ucs-content-store-eu-west/content/pii:S0306261923018573/image/svg+xml/901f8c3623fbe9ed3297ffb2aa0e121c/si220.svg si220 si220.svg svg 6796 ALTIMG 1-s2.0-S0306261923018573-si221.svg https://s3-eu-west-1.amazonaws.com/prod-ucs-content-store-eu-west/content/pii:S0306261923018573/image/svg+xml/ecfff50ae0d2de2aaef9189c6d1726cc/si221.svg si221 si221.svg svg 5290 ALTIMG 1-s2.0-S0306261923018573-si222.svg https://s3-eu-west-1.amazonaws.com/prod-ucs-content-store-eu-west/content/pii:S0306261923018573/image/svg+xml/33fadb4440e1113b26c214ccd2795483/si222.svg si222 si222.svg svg 4510 ALTIMG 1-s2.0-S0306261923018573-si23.svg https://s3-eu-west-1.amazonaws.com/prod-ucs-content-store-eu-west/content/pii:S0306261923018573/image/svg+xml/ab8857bfc56a46d529d0b32e399126f3/si23.svg si23 si23.svg svg 3047 ALTIMG 1-s2.0-S0306261923018573-si232.svg https://s3-eu-west-1.amazonaws.com/prod-ucs-content-store-eu-west/content/pii:S0306261923018573/image/svg+xml/dc930dd77cd667cd893729eaaecab463/si232.svg si232 si232.svg svg 6351 ALTIMG 1-s2.0-S0306261923018573-si233.svg https://s3-eu-west-1.amazonaws.com/prod-ucs-content-store-eu-west/content/pii:S0306261923018573/image/svg+xml/fabf110c606e166df0798e1574ee9744/si233.svg si233 si233.svg svg 6067 ALTIMG 1-s2.0-S0306261923018573-si24.svg https://s3-eu-west-1.amazonaws.com/prod-ucs-content-store-eu-west/content/pii:S0306261923018573/image/svg+xml/fbc5d443605a77d1e8c7d6282f4579fe/si24.svg si24 si24.svg svg 26473 ALTIMG 1-s2.0-S0306261923018573-si25.svg https://s3-eu-west-1.amazonaws.com/prod-ucs-content-store-eu-west/content/pii:S0306261923018573/image/svg+xml/b1d29c4899c2a3d4caebc0ffcb024cb4/si25.svg si25 si25.svg svg 6745 ALTIMG 1-s2.0-S0306261923018573-si28.svg https://s3-eu-west-1.amazonaws.com/prod-ucs-content-store-eu-west/content/pii:S0306261923018573/image/svg+xml/f6664af5516f95669a1e619e9e43447b/si28.svg si28 si28.svg svg 3403 ALTIMG 1-s2.0-S0306261923018573-si30.svg https://s3-eu-west-1.amazonaws.com/prod-ucs-content-store-eu-west/content/pii:S0306261923018573/image/svg+xml/1a0195532c4aa3499e4a99c16b87dc54/si30.svg si30 si30.svg svg 2887 ALTIMG 1-s2.0-S0306261923018573-si32.svg https://s3-eu-west-1.amazonaws.com/prod-ucs-content-store-eu-west/content/pii:S0306261923018573/image/svg+xml/7e090fa66e0367ca7b97b94131a7e7cf/si32.svg si32 si32.svg svg 13900 ALTIMG 1-s2.0-S0306261923018573-si33.svg https://s3-eu-west-1.amazonaws.com/prod-ucs-content-store-eu-west/content/pii:S0306261923018573/image/svg+xml/c8ed3005864b229456351d5d32d6e8ad/si33.svg si33 si33.svg svg 2948 ALTIMG 1-s2.0-S0306261923018573-si34.svg https://s3-eu-west-1.amazonaws.com/prod-ucs-content-store-eu-west/content/pii:S0306261923018573/image/svg+xml/a06bdcf77631d7b0b0cc3d9969c93027/si34.svg si34 si34.svg svg 16053 ALTIMG 1-s2.0-S0306261923018573-si36.svg https://s3-eu-west-1.amazonaws.com/prod-ucs-content-store-eu-west/content/pii:S0306261923018573/image/svg+xml/edaa150cb5a2b65d133f4eb7f57f891d/si36.svg si36 si36.svg svg 4017 ALTIMG 1-s2.0-S0306261923018573-si37.svg https://s3-eu-west-1.amazonaws.com/prod-ucs-content-store-eu-west/content/pii:S0306261923018573/image/svg+xml/a12e0b91b3bcc36dc981339cfcf3c82b/si37.svg si37 si37.svg svg 3355 ALTIMG 1-s2.0-S0306261923018573-si38.svg https://s3-eu-west-1.amazonaws.com/prod-ucs-content-store-eu-west/content/pii:S0306261923018573/image/svg+xml/167ffa58660f76ef6638d6206924abb8/si38.svg si38 si38.svg svg 8969 ALTIMG 1-s2.0-S0306261923018573-si4.svg https://s3-eu-west-1.amazonaws.com/prod-ucs-content-store-eu-west/content/pii:S0306261923018573/image/svg+xml/f9022f66d77e330e27ce3f044adecffd/si4.svg si4 si4.svg svg 2534 ALTIMG 1-s2.0-S0306261923018573-si40.svg https://s3-eu-west-1.amazonaws.com/prod-ucs-content-store-eu-west/content/pii:S0306261923018573/image/svg+xml/43881fb71a1b83cf0ec3f94db79ca19c/si40.svg si40 si40.svg svg 9799 ALTIMG 1-s2.0-S0306261923018573-si42.svg https://s3-eu-west-1.amazonaws.com/prod-ucs-content-store-eu-west/content/pii:S0306261923018573/image/svg+xml/e19142003ebf37bb7f85ced4bdd40dce/si42.svg si42 si42.svg svg 1174 ALTIMG 1-s2.0-S0306261923018573-si43.svg https://s3-eu-west-1.amazonaws.com/prod-ucs-content-store-eu-west/content/pii:S0306261923018573/image/svg+xml/193ffe4845ae22d0e5581e292616c6c8/si43.svg si43 si43.svg svg 14341 ALTIMG 1-s2.0-S0306261923018573-si46.svg https://s3-eu-west-1.amazonaws.com/prod-ucs-content-store-eu-west/content/pii:S0306261923018573/image/svg+xml/079771f99b3823990e58405dbb83ed54/si46.svg si46 si46.svg svg 18664 ALTIMG 1-s2.0-S0306261923018573-si47.svg https://s3-eu-west-1.amazonaws.com/prod-ucs-content-store-eu-west/content/pii:S0306261923018573/image/svg+xml/f4744c7ed890c8f1251f4d5383cbf5fe/si47.svg si47 si47.svg svg 1128 ALTIMG 1-s2.0-S0306261923018573-si50.svg https://s3-eu-west-1.amazonaws.com/prod-ucs-content-store-eu-west/content/pii:S0306261923018573/image/svg+xml/b84bd1099e96d023f906c4a7461bc3b8/si50.svg si50 si50.svg svg 4579 ALTIMG 1-s2.0-S0306261923018573-si51.svg https://s3-eu-west-1.amazonaws.com/prod-ucs-content-store-eu-west/content/pii:S0306261923018573/image/svg+xml/82d5d111df81ec0f84cec6b967e707e5/si51.svg si51 si51.svg svg 3508 ALTIMG 1-s2.0-S0306261923018573-si52.svg https://s3-eu-west-1.amazonaws.com/prod-ucs-content-store-eu-west/content/pii:S0306261923018573/image/svg+xml/cc78196d1abd89492b720224225df6df/si52.svg si52 si52.svg svg 5680 ALTIMG 1-s2.0-S0306261923018573-si53.svg https://s3-eu-west-1.amazonaws.com/prod-ucs-content-store-eu-west/content/pii:S0306261923018573/image/svg+xml/4a7b05190fbe51ca583e367f920bb818/si53.svg si53 si53.svg svg 1230 ALTIMG 1-s2.0-S0306261923018573-si55.svg https://s3-eu-west-1.amazonaws.com/prod-ucs-content-store-eu-west/content/pii:S0306261923018573/image/svg+xml/271bf8f1026d57cc0fbe9334f3f9aeaa/si55.svg si55 si55.svg svg 2583 ALTIMG 1-s2.0-S0306261923018573-si6.svg https://s3-eu-west-1.amazonaws.com/prod-ucs-content-store-eu-west/content/pii:S0306261923018573/image/svg+xml/7612549af3d755028e70ba1e6d284558/si6.svg si6 si6.svg svg 4052 ALTIMG 1-s2.0-S0306261923018573-si61.svg https://s3-eu-west-1.amazonaws.com/prod-ucs-content-store-eu-west/content/pii:S0306261923018573/image/svg+xml/65374fcec99b4d4aac790623d0719c68/si61.svg si61 si61.svg svg 20466 ALTIMG 1-s2.0-S0306261923018573-si62.svg https://s3-eu-west-1.amazonaws.com/prod-ucs-content-store-eu-west/content/pii:S0306261923018573/image/svg+xml/2de8f9bc21c852ac91b0ad4b82ceb864/si62.svg si62 si62.svg svg 10935 ALTIMG 1-s2.0-S0306261923018573-si63.svg https://s3-eu-west-1.amazonaws.com/prod-ucs-content-store-eu-west/content/pii:S0306261923018573/image/svg+xml/371e110c95641b78347595037e37017b/si63.svg si63 si63.svg svg 41395 ALTIMG 1-s2.0-S0306261923018573-si69.svg https://s3-eu-west-1.amazonaws.com/prod-ucs-content-store-eu-west/content/pii:S0306261923018573/image/svg+xml/2f166fcca954660735dcba585fdf7651/si69.svg si69 si69.svg svg 18714 ALTIMG 1-s2.0-S0306261923018573-si7.svg https://s3-eu-west-1.amazonaws.com/prod-ucs-content-store-eu-west/content/pii:S0306261923018573/image/svg+xml/7d64b53733974e4b2a4112c0eea2c8fb/si7.svg si7 si7.svg svg 15887 ALTIMG 1-s2.0-S0306261923018573-si71.svg https://s3-eu-west-1.amazonaws.com/prod-ucs-content-store-eu-west/content/pii:S0306261923018573/image/svg+xml/689a8b520e099e507f80630ff51ec524/si71.svg si71 si71.svg svg 31801 ALTIMG 1-s2.0-S0306261923018573-si72.svg https://s3-eu-west-1.amazonaws.com/prod-ucs-content-store-eu-west/content/pii:S0306261923018573/image/svg+xml/e76c212cf6e909b8c5a7976ab876ded6/si72.svg si72 si72.svg svg 15581 ALTIMG 1-s2.0-S0306261923018573-si73.svg https://s3-eu-west-1.amazonaws.com/prod-ucs-content-store-eu-west/content/pii:S0306261923018573/image/svg+xml/3f824f3df0f749d33d6a7360dd5e111a/si73.svg si73 si73.svg svg 3224 ALTIMG 1-s2.0-S0306261923018573-si80.svg https://s3-eu-west-1.amazonaws.com/prod-ucs-content-store-eu-west/content/pii:S0306261923018573/image/svg+xml/2af965f65364361480a61ed852849387/si80.svg si80 si80.svg svg 9781 ALTIMG 1-s2.0-S0306261923018573-si81.svg https://s3-eu-west-1.amazonaws.com/prod-ucs-content-store-eu-west/content/pii:S0306261923018573/image/svg+xml/07ad0c5dd00efa04f2d2caa2f9d30c7c/si81.svg si81 si81.svg svg 10556 ALTIMG 1-s2.0-S0306261923018573-si83.svg https://s3-eu-west-1.amazonaws.com/prod-ucs-content-store-eu-west/content/pii:S0306261923018573/image/svg+xml/2c5f665dee90fc206d2b9e8387eb662e/si83.svg si83 si83.svg svg 8117 ALTIMG 1-s2.0-S0306261923018573-si84.svg https://s3-eu-west-1.amazonaws.com/prod-ucs-content-store-eu-west/content/pii:S0306261923018573/image/svg+xml/8d4fc3da102b6289672bb869ff909305/si84.svg si84 si84.svg svg 2326 ALTIMG 1-s2.0-S0306261923018573-si85.svg https://s3-eu-west-1.amazonaws.com/prod-ucs-content-store-eu-west/content/pii:S0306261923018573/image/svg+xml/aeeb69b37959318d661dddcd8e044e97/si85.svg si85 si85.svg svg 4559 ALTIMG 1-s2.0-S0306261923018573-si87.svg https://s3-eu-west-1.amazonaws.com/prod-ucs-content-store-eu-west/content/pii:S0306261923018573/image/svg+xml/745ad1a70103fb014875d19c4fddd52b/si87.svg si87 si87.svg svg 8547 ALTIMG 1-s2.0-S0306261923018573-si88.svg https://s3-eu-west-1.amazonaws.com/prod-ucs-content-store-eu-west/content/pii:S0306261923018573/image/svg+xml/3e26907d672a3becf357e170a1702a0a/si88.svg si88 si88.svg svg 9121 ALTIMG 1-s2.0-S0306261923018573-si9.svg https://s3-eu-west-1.amazonaws.com/prod-ucs-content-store-eu-west/content/pii:S0306261923018573/image/svg+xml/a45352d04de46f9ee2a61e2ac00e0ea4/si9.svg si9 si9.svg svg 2404 ALTIMG 1-s2.0-S0306261923018573-si90.svg https://s3-eu-west-1.amazonaws.com/prod-ucs-content-store-eu-west/content/pii:S0306261923018573/image/svg+xml/9abd7e56f9fc8646aa7c6098d35aa4ac/si90.svg si90 si90.svg svg 2511 ALTIMG 1-s2.0-S0306261923018573-si91.svg https://s3-eu-west-1.amazonaws.com/prod-ucs-content-store-eu-west/content/pii:S0306261923018573/image/svg+xml/c06b5bf30db43b6478195a0ccf633b61/si91.svg si91 si91.svg svg 12065 ALTIMG 1-s2.0-S0306261923018573-si92.svg https://s3-eu-west-1.amazonaws.com/prod-ucs-content-store-eu-west/content/pii:S0306261923018573/image/svg+xml/7f610ed7ee4af7e18de121be93d33303/si92.svg si92 si92.svg svg 27774 ALTIMG 1-s2.0-S0306261923018573-si93.svg https://s3-eu-west-1.amazonaws.com/prod-ucs-content-store-eu-west/content/pii:S0306261923018573/image/svg+xml/f696828110b065547d2a7fbe251be439/si93.svg si93 si93.svg svg 1474 ALTIMG 1-s2.0-S0306261923018573-si99.svg https://s3-eu-west-1.amazonaws.com/prod-ucs-content-store-eu-west/content/pii:S0306261923018573/image/svg+xml/c33c6917c534e850c881828733c51477/si99.svg si99 si99.svg svg 12547 ALTIMG 1-s2.0-S0306261923018573-am.pdf https://s3-eu-west-1.amazonaws.com/prod-ucs-content-store-eu-west/content/egi:1076LLQ0G24/MAIN/application/pdf/905295a0dffeda98bc036706ddd5325f/am.pdf am am.pdf pdf false 1085549 AAM-PDF APEN 122493 122493 S0306-2619(23)01857-3 10.1016/j.apenergy.2023.122493 The Authors Fig. 1 Overview of the proposed controller tuning method. On each day, we get the average temperature and average solar irradiation prediction from given weather forecasts. With the forecasted contexts and the Gaussian process surrogate model, PDCBO selects a new set of optimized controller parameters to run the black-box building simulator or conduct a physical experiment. We then collect the new discomfort and energy consumption data and update their GP posteriors. At the same time, we update the dual variables with the constraints information. Fig. 2 NEST building, Duebendorf, with the UMAR unit in white circle. © Zooey Braun, Stuttgart. Fig. 3 Comparison of energy consumption and discomfort with respect to the average ambient temperature. In this set of results, static parameters consumes 25 . 5 k W h energy, with 8 . 1 K h discomfort on average. In contrast, PDCBO has a lower energy consumption of 20 . 9 k W h , with much smaller thermal discomfort of 4 . 1 K h . Fig. 4 PDCBO samples of switching time, proportional gain K p , and integral gain K i with respect to ambient average temperature. Both the proportional gain and integral gain are normalized against a base value so that they are unitless. Fig. 5 Average energy consumption E n avg and discomfort D n avg per day with discomfort threshold as 5 K h , 10 K h and 15 K h per day. Note that the day-time energy consumption is doubled to reflect the real-world energy tariff. Fig. 6 Three-day sample trajectories of the room temperature and heating power. Here, CEI chooses some parameters that simply stops heating during the daytime to save energy, which causes severe discomfort. Fig. 7 Sensitivity analysis to show the impact of different discomfort thresholds on the final average energy consumption ( E 300 avg as defined in Eq. (6a)) and the final average discomfort per day ( D 300 avg as defined in Eq. (6b)) over 300 days. Note that the daytime energy consumption is doubled here to reflect the real-world electricity price tariff.. Fig. 8 Discomfort tracking results. (a) Average energy and discomfort per day with time-varying discomfort threshold. The average on day t is taken from day τ 0 ( t ) to t , where τ 0 ( t ) is the day when the discomfort threshold on day t starts. (b)(c)(d) Average ambient temperature/energy consumption/discomfort during the four periods with different discomfort thresholds. Standard deviations are represented as the black lines.. Fig. 9 Average energy consumption and discomfort with limited average energy consumption budget as 9 kWh , 12 kWh and 15 kWh per day shown in dashed red. Fig. 10 Sample trajectories of room temperature and the corresponding heating power with limited average energy consumption budget as 9 kWh , 12 kWh and 15 kWh per day. Table 1 The choice of hyperparameters for squared exponential kernel, where the heating start time is in the unit of minute. σ SE 2 Lengthscale in P (log-scale) Lengthscale in I (log-scale) Lengthscale in daytime setpoint Lengthscale in heating start time J 56.7 5.9 3.1 2.7 1290.6 g 546.1 6.0 8.8 5.2 1188.0 Table 2 Average energy consumption with different discomfort thresholds, where the saving percentage represents the saving of energy consumption as compared to SafeOPT method. Discomfort threshold (Kh) 5 10 15 SafeOPT (kWh) 20.1 20.1 20.0 CEI (kWh) 19.3 19.2 19.1 Saving percentage ( % ) 4.1 4.2 4.6 PDCBO (kWh) 20.0 19.7 19.4 Saving percentage ( % ) 0.6 1.9 3.2 Table 3 Average discomfort with different discomfort thresholds, where violation percentage is defined as max Average discomfort − Discomfort threshold Discomfort threshold , 0 over 300 days. Discomfort threshold (Kh) 5 10 15 SafeOPT (Kh) 2.5 2.6 2.6 Violation percentage ( % ) 0 0 0 CEI (Kh) 17.3 18.2 17.8 Violation percentage ( % ) 246.9 82.3 18.4 PDCBO (kWh) 6.4 9.5 14.0 Violation percentage ( % ) 28 0 0 Table 4 Average energy consumption with different energy budgets, where the violation percentage represents the violation of energy consumption as compared to the energy budgets. Energy budget (kWh) 9 12 15 SafeOPT (kWh) 8 × 10 − 5 8 × 10 − 5 8 × 10 − 5 Violation percentage ( % ) 0 0 0 CEI (kWh) 22.7 22.7 21.9 Violation percentage ( % ) 152.2 89.3 46.3 PDCBO (kWh) 9.8 11.4 14.1 Violation percentage ( % ) 8.7 0 0 Table 5 Average discomfort with different energy budgets, where reduction percentage is defined as the percentage of discomfort reduction as compared to SafeOPT. Energy budget (kWh) 9 12 15 SafeOPT (Kh) 31.3 31.3 31.3 CEI (Kh) 4.2 3.9 4.2 Reduction percentage ( % ) 86.7 87.5 86.5 PDCBO (Kh) 16.8 14.8 11.6 Reduction percentage ( % ) 46.5 52.9 62.8 Data-driven adaptive building thermal controller tuning with constraints: A primal\u2013dual contextual Bayesian optimization approach Wenjie Xu Conceptualization Methodology Software Validation Formal analysis Data curation Visualization Writing \u2013 original draft a b \u204e Bratislav Svetozarevic Conceptualization Methodology Writing \u2013 review & editing Supervision a Loris Di Natale Software Validation Data curation Visualization Writing \u2013 review & editing a b Philipp Heer Funding acquisition a Colin N. Jones Conceptualization Methodology Writing \u2013 review & editing Supervision b a Urban Energy Systems Laboratory, Swiss Federal Laboratories for Materials Science and Technology (Empa), 8600 Dübendorf, Switzerland Urban Energy Systems Laboratory, Swiss Federal Laboratories for Materials Science and Technology (Empa), 8600 Dübendorf Switzerland Urban Energy Systems Laboratory, Swiss Federal Laboratories for Materials Science and Technology (Empa), 8600 Dübendorf, Switzerland b Laboratoire d\u2019Automatique, Swiss Federal Institute of Technology Lausanne (EPFL), 1015 Lausanne, Switzerland Laboratoire d\u2019Automatique, Swiss Federal Institute of Technology Lausanne (EPFL) Lausanne 1015 Switzerland Laboratoire d\u2019Automatique, Swiss Federal Institute of Technology Lausanne (EPFL), 1015 Lausanne, Switzerland \u204e Corresponding author at: Laboratoire d\u2019Automatique, Swiss Federal Institute of Technology Lausanne (EPFL), 1015 Lausanne, Switzerland. Laboratoire d\u2019Automatique, Swiss Federal Institute of Technology Lausanne (EPFL) Lausanne 1015 Switzerland We study the problem of tuning the parameters of a room temperature controller to minimize its energy consumption, subject to the constraint that the daily cumulative thermal discomfort of the occupants is below a given threshold. We formulate it as an online constrained black-box optimization problem where, on each day, we observe some relevant environmental context and adaptively select the controller parameters. In this paper, we propose to use a data-driven Primal-Dual Contextual Bayesian Optimization (PDCBO) approach to solve this problem. In a simulation case study on a single room, we apply our algorithm to tune the parameters of a Proportional Integral (PI) heating controller and the pre-heating time. Our results show that PDCBO can save up to 4.7% energy consumption compared to other state-of-the-art Bayesian optimization-based methods while keeping the daily thermal discomfort below the given tolerable threshold on average. Additionally, PDCBO can automatically track time-varying tolerable thresholds while existing methods fail to do so. We then study an alternative constrained tuning problem where we aim to minimize the thermal discomfort with a given energy budget. With this formulation, PDCBO reduces the average discomfort by up to 63% compared to state-of-the-art safe optimization methods while keeping the average daily energy consumption below the required threshold. Graphical abstract Keywords Building thermal control Controller tuning Bayesian optimization Contextual model Primal\u2013dual method Data availability I have shared a public link to the code/data. Nomenclature Symbols n Index of day E n Energy consumption on day n D n Discomfort on day n D thr Discomfort threshold T n ambient Forecasted average ambient temperature on day n I n Forecasted average solar irradiation on day n θ Controller parameters z Contextual variables J ( θ , z ) The energy consumption model function g ( θ , z ) The discomfort model function ν n J Noise in the energy consumption on day n ν n g Noise in the discomfort on day n σ J Standard deviation for ν J σ g Standard deviation for ν g H n ( E τ , D τ , T τ ambient , I τ , T τ init , θ τ ) τ = 1 n − 1 T n init Initial room temperature on day n t Time in a day u ( t ) Normalized heating power at time t T ( t ) Zone temperature at time t T setpoint Setpoint temperature e ( t ) Temperature error T setpoint − T ( t ) at time t K p Proportional gain of PI controller K i Integral gain of PI controller T min ( t ) Comfort range lower bound at time t T max ( t ) Comfort range upper bound at time t ϵ Constant drift in the PDCBO algorithm Abbreviations PDCBO Primal\u2013dual Contextual Bayesian Optimization GP Gaussian process PI Proportional-Integral 1 Introduction With the increasing challenge of climate change, the high energy usage in the building sector calls for the development of energy-efficient control solutions. On the other hand, it is also critical to meet the comfort requirement of the occupants [1]. While advanced control methods have been developed (e.g., model predictive control [2\u20134] and reinforcement learning [5\u20139]) to optimize the energy consumption and/or the comfort of the occupants, simple rule-based controllers (e.g., bang\u2013bang or Proportional Integral Derivative PID controllers) still dominate the current practice [5]. The parameters of these controllers are typically set manually by building engineers and kept fixed for the life of the building. However, these hand-tuned simple rule-based controllers have two main limitations in practice. The first limitation is sub-optimality. It is generally hard to explicitly model the effect of given control parameters on the performance (the energy consumption and thermal comfort of the occupants) to optimize them. That is, the mapping from building control parameters to closed-loop performance typically behaves like a black-box. Consequently, manually tuned controllers usually operate suboptimally [10,11], potentially incurring excessively high discomfort or energy consumption. The other limitation is non-adaptivity. Given the influence of external factors, typically the weather conditions, an optimal building control policy should intuitively be able to adapt to environmental changes. Previous works indeed indicated that adaptive controller parameters can bring significant energy savings (e.g., in [12]). However, the parameters of rule-based controllers are conventionally set during commissioning and then kept fixed. Meanwhile, with more and more ubiquitous sensing technology [13], we can monitor the operations of buildings online. By collecting the temperature and heating power trajectories, building control performance, including energy consumption and occupant comfort, can be evaluated on each day. Based on the above observations, it is of great practical interest to be able to adaptively tune building controller parameters to optimize their online performance. Since we are interested in minimizing both the energy consumption and the thermal discomfort of the occupants, tuning these parameters is a multi-objective problem. Furthermore, the two objectives are often in contradiction, with improved thermal comfort typically coming at the cost of additional energy consumption, making the tuning procedure challenging in general. Existing research in the multi-objective building optimization literature often uses a weighted sum of discomfort and energy consumption as the performance target when designing or learning building controllers, e.g. in [2,5,14\u201316]. However, with such a formulation, there is no systematic way of choosing the weighting factor between the two objectives. Random weights may lead to undesirable consequences, such as intolerable discomfort for the occupants or excessive energy usage with very marginal comfort improvement. Some research used Pareto optimization [17\u201319], where a set of trade-off optimal solutions \u2014 on the Pareto front \u2014 are derived. However, this approach is typically sample inefficient, since a good approximation of a Pareto front takes a significant number of Pareto optimal points. Furthermore, Pareto optimization typically does not consider the performance during the optimization process and as such cannot be deployed to tune the parameters of real-world building systems online, where the online performance during tuning also needs to be guaranteed. We refer the reader to [20] for a detailed review of simulation-based optimization methods applied to building performance analysis. In this work, we formulate the building controller tuning problem as an online constrained optimization problem, where one metric \u2014 the energy consumption or the thermal discomfort \u2014 is set as the objective and the other as the constraint. This is more desirable than the weighted-sum formulation since the optimal solution of a constrained problem always respects the constraints and the preference towards comfort or energy saving can be easily personalized by modifying the constraints. On each day, we solve an online problem to get a new set of controller parameters and apply them to the building. However, solving this constrained problem poses several new challenges. Constraint violation management. It is generally difficult, if even possible, to strictly satisfy the comfort or energy constraints at all times since the effect of the control parameters on the energy consumption or the thermal comfort is hard to predict accurately. However, thanks to the soft nature of these constraints, some violations are acceptable in practice. Interestingly, short-term constraint violations can be beneficial to efficiently identify the optimal set of parameters, as shown in previous works [21,22]. Despite the benefits of short-term constraint violation, we still want to ensure constraint satisfaction in the long term. Cumulative constraint satisfaction. While the thermal comfort of the occupants has to be monitored every day, an energy consumption constraint only makes sense when it is accumulated over certain periods. That is to say, despite tuning the parameters of the controller every day, we want the cumulative energy consumption to be small during a season or a year, for example, rather than on each day. Indeed, it is expected that the system has to consume more energy on cold days than on warm ones to optimize the comfort of the occupants. Time-varying constraint tracking. Due to changes in energy prices or occupant behaviors, the preference for energy saving or comfort may change. Existing learning-based methods (e.g., [5]) may need to train a controller from scratch again, which can be very time-consuming and data-intensive. It is desired that the tuning algorithm can respond to such changes of preference rapidly. Bayesian optimization (BO), as a sample-efficient method to optimize black-box functions [23,24] by constructing a stochastic surrogate model, is a promising method to solve the building controller tuning problem. Specifically, to address the energy consumption modeling problem for building control [25], we use Gaussian process to learn the black-box mapping from control parameters to the closed-loop energy consumption and discomfort due to its high sample efficiency. BO has already been applied to many different energy systems (including building) optimization problems, such as model calibration [26,27], chiller plant controller tuning [28], process control [29], battery charging [30], and turbine design [31]. However, existing applications of Bayesian optimization-based methods either have no constraint consideration at all or cannot guarantee long-term constraint feasibility. Therefore, they are not readily applicable to address all the aforementioned constraint challenges. In addition, environmental disturbances such as ambient temperature and solar irradiation need to be incorporated since energy consumption and occupants\u2019 comfort also highly depend on them. One of the most popular constrained BO methods, Constrained Expected Improvement (CEI) [32,33], encodes the constraint information in the acquisition function. This method is however not able to guarantee the satisfaction of the desired constraints. To deal with hard safety-critical constraints, Safe BO restricts the sampling inside a safe set where feasibility is guaranteed with high probability [34]. More recently, [35] proposed a primal\u2013dual algorithm to solve the constrained Bayesian optimization problem, with theoretical bounds on the cumulative regret and soft violation. As an extension to handle time-varying disturbances, Primal Dual Contextual Bayesian Optimization (PDCBO) was recently developed by us [36]. In this paper, we propose to use the PDCBO method to automatically and adaptively tune the parameters of a Proportional Integral (PI) controller, the daytime setpoint temperature, and the pre-heating time for building thermal control with time-varying ambient conditions. PDCBO has been shown to asymptotically achieve the optimal performance while satisfying constraints on average by adapting to the time-varying environmental changes, which are modeled as contexts in [36]. Specifically, our contributions are: 1. The adaptive building controller tuning problem is modeled as an online constrained black-box optimization problem and is then solved with PDCBO method. 2. Simulation results show that PDCBO can simultaneously optimize the energy consumption and keep the discomfort level below a user-defined upper bound on average in the long term, contrary to other state-of-the-art constrained BO methods. 3. When the discomfort threshold is time-varying, PDCBO is again the only method able to rapidly adapt to the threshold changes and track the constraints well. This highlights the capability of PDCBO to automatically explore the allowable discomfort level in order to reduce energy consumption. 4. When we instead aim to minimize the discomfort subject to the daily average energy consumption being within a given budget, simulation results show that PDCBO [36] reduces the average discomfort by about 63% compared to other safe BO method. 2 Problem statement We consider an online constrained building controller tuning problem where the parameters are modified each day. Controller structure We consider a PI controller to govern the heating of a room, which is currently a common practice in building automation systems. The control law is given as, u ( t ) = K p e ( t ) + K i ∫ 0 t e ( τ ) d τ , where K p is the proportional gain, K i is the integral gain, e ( t ) ≔ T setpoint ( t ) − T ( t ) is the difference between the temperature setpoint and the measured temperature T at time t , and u ( t ) (after truncated to the interval [0, 1]) is the control input. In our case, the latter represents the heating power of the room. To incorporate the different thermal requirements during daytime and nighttime \u2014 e.g., to leverage the fact that the building is vacant at night \u2014, we adopt a lower setpoint during the night than at daytime. Tuning variables Our tuning variables include the proportional and integral gains of the PI controller, and the daytime setpoint temperature. To incorporate pre-heating behaviors, we also include the switching time from nighttime mode to daytime mode as a tuning variable. On the other hand, we fix the nighttime setpoint to 22 . 5 ° C , which is inside the comfort range of 20 ° C to 23 . 5 ° C in ASHRAE 55-1992 [37] and thus a reasonable choice, and the switching time from daytime mode to nighttime mode at 6 PM, which is a typical end-of-work time. We use θ to denote the tuning parameter, which is the concatenation of all tuning variables. Contextual variables We consider the most critical environmental factors, namely the forecasted average daily ambient temperature and ambient solar irradiation, as contextual inputs of PDCBO. We also include the initial temperature at the start of each day (midnight) as an additional contextual variable. We use z n to denote the concatenated contextual variables on the day n . Since the true average ambient temperature and solar irradiation cannot be obtained before selecting the new control parameters in reality, we can use the forecast average ambient temperature T n ambient and forecast average solar irradiation I n , on each day n . The initial room temperature T n init is also measured. The contextual variables are given as z n = ( T n ambient , I n , T n init ) . Discomfort quantification Similar to what is done in many existing learning-based building control works (e.g., [5]), we define and quantify the discomfort of the occupants as the cumulative temperature deviations from the potentially time-varying comfortable temperature range [ T min ( t ) , T max ( t ) ] : c discomfort ( T , t ) = 0 , if T min ( t ) ≤ T ≤ T max ( t ) , T − T max ( t ) , if T > T max ( t ) , T min ( t ) − T , if T < T min ( t ) , We use D n to denote the cumulative discomfort on day n , namely the integration of c discomfort over day n : (1) D n = ∫ day n c discomfort ( T ( t ) , t ) d t . Similarly, we compute the energy consumption over a day as: (2) E n = ∫ day n p ( t ) d t , where p ( t ) is the power at time t , which is proportional to u ( t ) . Since both E n and D n are unknown functions of θ and z n corrupted by noise, we introduce Gaussian processes to model them as follows: (3a) E n = J ( θ n , z n ) + ν n J , (3b) D n = g ( θ n , z n ) + ν n g , where J is assumed to be sampled from the Gaussian process GP ( μ J , k J ( ⋅ , ⋅ ) ) with prior mean μ J and prior covariance k J ( ⋅ , ⋅ ) and g is constructed similarly. Furthermore, ν n J ∼ N ( 0 , σ J 2 ) and ν n g ∼ N ( 0 , σ g 2 ) are independent identically distributed Gaussian noises. Constrained optimization problem. On the day n , we aim to adaptively select a set of parameters θ n by solving the following online constrained optimization problem, (4a) min θ ∈ Θ J ( θ , z n ) , (4b) subject to: g ( θ , z n ) ≤ D thr , where Θ is the set of candidate control parameters (e.g., a hyperbox) and D thr is the maximum amount of allowed comfort violations. Both the objective and the constraint are unknown black-box functions of the control parameter θ and the contextual variable z , which need to be learned online during a period. Alternatively, we get the energy-constrained discomfort minimization formulation by setting g to be the objective and J to be below a threshold in the constraint as shown in Eq. (5b). (5a) min θ ∈ Θ g ( θ , z n ) , (5b) subject to: J ( θ , z n ) ≤ E thr , where E thr is the energy budget. Performance metric. Although the problem (4b) is formulated as an online problem with instantaneous objective and constraints, we measure the performance of the algorithm using the whole closed-loop trajectory { ( θ n , z n ) } n = 1 N . Overall, the metric is the cumulative objective function during a period N , that is ∑ n = 1 N J ( θ n , z n ) , while respecting the constraints g ( θ n , z n ) ≤ D thr on average . To compare the performance of each algorithm, we introduce two running average metrics, (6a) E n avg ≔ 1 n ∑ k = 1 n E k , (6b) D n avg ≔ 1 n ∑ k = 1 n D k . 3 Methodology Fig. 1 demonstrates an overview of the proposed methodology. On each day n , we collect the contextual information z n and use the algorithm detailed in the following sections to choose θ n . We then run the simulation for the next day with this set of parameters and calculate E n and D n using the power input and temperature trajectories obtained from simulation or real-world operation. We then update the Gaussian Processes (GPs) with the new data, obtain the context of the next day, and sample new control parameters. In this paper, we update the control parameters only once per day, since thermal processes in buildings, such as room temperature evolutions, typically have slow dynamics. That is to say, the step response from heating input to room temperature change typically takes a long time, in the scale of hours. A cycle of the temperature evolution is fully finished within one day and the impact of the controller parameters can be seen after one day. However, if we update the control parameters more frequently (e.g., per hour), the temperature may not have settled and the real performance of the current set of controller parameters cannot be well measured. Therefore, we decided to adjust the controller parameter only once per day in this paper. Nevertheless, the methodology to be presented can be easily adapted to the scenario where the parameters are updated more frequently (e.g., once per 12 hours). Note that, given the online setting, this methodology could also directly be applied to a real building, bypassing the need for simulation studies. In this section, we will focus on the Prob. (4b). The same algorithm can be similarly applied to Prob. (5b). 3.1 Preliminaries Gaussian process regression We learn J and g using GP regression, which is a sample-efficient method to approximate nonlinear functions. Denoting the set of historical data H n ≔ ( E τ , D τ , T τ ambient , I τ , T τ init , θ τ ) τ = 1 n − 1 and x ≔ ( θ , z ) , we can derive the posterior distribution of J on day n as a Gaussian random variable with mean and variance given as [38] (7a) μ J ( x | H n ) = k J ⊤ ( x , x 1 : n − 1 ) ( K J + σ J 2 I ) − 1 Δ y J + μ J ( x ) , (7b) σ J 2 ( x | H n ) = k J ( x , x ) − k J ⊤ ( x , x 1 : n − 1 ) ( K J + σ J 2 I ) − 1 k J ( x 1 : n − 1 , x ) , where Δ y J = E 1 : n − 1 − μ J ( x 1 : n − 1 ) . The posterior Gaussian distribution of g can be similarly derived. We refer the readers to [39] for more details on Gaussian process regression. Bayesian optimization (BO) Bayesian optimization is a derivative-free black-box optimization method (see [40]) which iteratively 1. Samples a point to evaluate the black-box function; 2. Uses all the historical samples to construct a surrogate model of the black-box function with GPs. 3. Finds a new sample that is promising to improve the objective by solving an auxiliary problem constructed with the surrogate model. For unconstrained Bayesian optimization, a popular way to construct this auxiliary problem in step 3 is minimizing the lower confidence bound [41] 1 1 Note that the work [41] uses the upper confidence bound instead of the lower one since they consider the problem of maximizing J instead of minimizing it. of the objective, which is defined as (8) μ J ( x | H n ) − β n 1 / 2 σ J ( x | H n ) , where β n 1 / 2 is a positive weighting coefficient that balances exploitation and exploration. The larger β n is, the more likely points with large posterior variance \u2014 i.e., uncertainty \u2014 will be sampled. 3.2 PDCBO PDCBO is based on the lower confidence bounds constructed from the posterior distribution of the energy consumption and thermal discomfort: (9a) J ̲ n ( θ , z n ) = μ J ( θ , z n | H n ) − β n 1 / 2 σ J ( θ , z n | H n ) , (9b) g ̲ n ( θ , z n ) = μ g ( θ , z n | H n ) − β n 1 / 2 σ g ( θ , z n | H n ) , where z n is the observed context at step n and β n 1 / 2 is the positive coefficient which balances the tradeoff between exploitation and exploration, where exploitation is captured by the posterior mean and the exploration is captured by the posterior standard deviation. Note that while [36] proposed a rigorous way to select β n \u2014 which increases at each time step \u2014 it can typically be set to be a constant in practice. We then relax the constraint in the problem (4b) and write out the corresponding Lagrangian: (10) L ( θ , z n , λ ) = J ( θ , z n ) + λ g ( θ , z n ) , where λ is the corresponding dual variable. Following classical ideas from the constrained optimization literature [42], we consider the corresponding max\u2013min problem, (11) max λ min θ L ( θ , z n , λ ) . Since both J and g are black-box functions, we use (9b) to approximate them and solve the inner minimization problem. For the outer maximization problem, on the other hand, we apply a standard dual ascent step, as detailed in Algorithm 1, where η is the step size and ϵ is a small constant shift. In sharp contrast to existing weighted-sum formulations in model predictive control [2] or reinforcement learning [5] based building control methods, where the weight is static, the weight λ n in Alg. 1 is adaptively adjusted each day according to the measurements of the constrained metric. Intuitively, if the constraint threshold is violated during one day, the weighting factor will be increased to penalize the constraint more in the next step. Such adaptivity of the weight leads to the automatic balance of energy consumption and discomfort. In the dual update, we also add a constant drift ϵ to prevent the dual variable from being too small, which would mean the optimization problem does not consider any constraint anymore and might incur severe violations. In this paper, we solve the auxiliary problem in the primal-update step in line 4 with a grid search algorithm over the set Θ . This is feasible since we are dealing with low dimensions \u2014 θ ∈ R 4 \u2014, and evaluating both lower confidence bound functions is computationally inexpensive. 3.3 Theoretical guarantees We now restate theoretical guarantees for the performance of Algorithm 1, as shown in [36]. Theorem 1 Theorem 6.1, [36] For kernels with sublinear maximum information gain term (see [41] ) and sufficiently large N , by properly setting η and ϵ as shown in [36] , we have, (12) ∑ n = 1 N J ( θ n , z n ) − J ( θ ∗ ( z n ) , z n ) = O ( γ N J + γ N g ) N , where θ ∗ ( z n ) is the optimal solution of the Prob. (4b) with contextual variable z n , γ N J ( γ N g , resp.) is the maximum information gain, which measures the complexity of the unknown black-box function J ( g , resp.) [41] . And, (13) ∑ n = 1 N g ( θ n , z n ) N ≤ D thr . Theorem 1 guarantees that the cumulative gap between the parameters selected by our algorithm and the ground truth time-varying optimal parameters is upper bounded by O ( ( γ N J + γ N g ) N ) . Furthermore, the threshold constraint on g is satisfied on average as shown in (13). We refer the interested reader to the theoretical paper [36] for more details. Specifically, for the commonly used squared exponential (SE) prior covariance functions, the cumulative suboptimality bound reduces to O ( ( log N ) d + 1 N ) [41], which is sublinear. Therefore, the average suboptimality converges to zero, i.e., PDCBO achieves asymptotic optimality on average. Specific to the building application considered in this paper, Theorem 1 highlights that PDCBO can asymptotically achieve the optimal building control performance while satisfying constraints on average. 4 Implementations and results In this section, we present some implementation details, state-of-the-art baselines, and then provide simulation results, comparing the performance of PDCBO, state-of-the-art constrained BO methods, and fixed control parameters. We consider both the discomfort-constrained energy minimization problem and the energy-constrained discomfort minimization problem. 4.1 Implementation details Building simulator In this work, we consider the control of the temperature of a single room located in the \u2018Urban Mining and Recycling\u2019 (UMAR) unit, pictured in Fig. 2. It is equipped with radiant heating/cooling panels, where hot/cold water is circulated when a valve is opened. We use a digital twin of the room, based on a Physically Consistent Neural Network (PCNN) [43], as our simulator for evaluation. Despite relying on Neural Networks (NNs), PCNNs respect the underlying physical laws by design while simultaneously achieving state-of-the-art modeling accuracy. In our case, the physical consistency ensures that heating a room increases its temperature, as expected, in contrast to what might happen with classical NNs [44]. This ensures our algorithm does not pick up spurious behaviors due to modeling inconsistencies. On the other hand, PCNNs attain superior prediction accuracy compared to classical physically consistent models [43,44]. Choice of parameters All the GPs use a squared exponential kernel, a common choice in BO applications (e.g., [21]): (14) k ( x , y ) = σ SE 2 exp − ∑ i = 1 d x i − y i l i 2 , where σ SE 2 captures the variation of the function to be modeled, l i is the lengthscale that captures the variation rate in the i th input variable, and d is the dimension of the input variable. We selected those hyperparameters as shown in Table 1 by doing maximum likelihood estimation (MLE) over an initial set of building operational data [39]. Concerning the parameters specific to PDCBO, we manually tried different values and set the dual update step size η = 1 and the lower confidence bound weight β t 1 / 2 = 3 , which works well in this application. In this case study, ϵ is manually set to be 0 , which does not significantly impact the constraint violations for this particular application. Generation of contexts The initial temperature of the room is an internal state of the simulator. Ambient temperature and solar irradiation are from the real-world weather dataset recorded at the NEST building of Empa in Zurich. In this paper, we use perfect forecast information, i.e., the true average daily ambient temperature and solar irradiation of the next day, as contextual inputs. When deploying our method online to the real world, however, real-world temperature and solar irradiation forecasts could be used. Comfort range and energy price We adopt a much tighter comfort range ( 21 ° C to 24 ° C during the nighttime and 23 ° C to 24 ° C during the daytime) than the recommended comfort ranges [37] (e.g., 20 ° C to 23 . 5 ° C in ASHRAE 55-1992). Therefore, we allow larger cumulative temperature deviation to capture different levels of comfort requirements. To incorporate time-varying electricity prices, we penalize the day-time energy consumption twice, which approximately matches the real-world electricity tariff data [45]. Simulation In our experiments, 300 days are simulated to compare the performance of each controller during the heating season. Since the building needs to be cooled rather than heated over the summer and due to data missing issue, the days in our simulation may not be consecutive \u2014 we artificially stitch non-consecutive days together, using the last simulated room temperature of the previous day as initial value for the next one. Note that control parameters need to be continuously adapted due to the time-varying contexts. So we use these running average metrics during the tuning process, instead of choosing one fixed solution over the whole running horizon. The algorithms are implemented in python and we used GPy [46] to implement GPs. The code and data can be accessed on https://gitlab.nccr-automation.ch/wenjie.cuhk/pdcbo_room_temperature_controller_tuning. 4.2 State-of-the-art baselines We compare PDCBO with two other state-of-the-art Bayesian optimization algorithms: SafeOPT [12] and CEI [32]. Both baseline algorithms also use Gaussian process to learn the mapping from the control parameters to the daily energy/discomfort. SafeOPT SafeOPT aims to not violate the constraints during the whole sampling process and thus is very cautious. In each step, SafeOPT constructs a posterior safe set, which contains the points that are feasible with high probability (or equivalently, with upper confidence bound smaller or equal to zero). Then the algorithm samples a point inside the safe set that either expands the boundary of the safe set or can improve the objective, based on some criterion that balances exploration and exploitation. CEI In each step, CEI selects the sample that maximizes the acquisition function of Constrained Expected Improvement, which is defined as the multiplication of the expectation of improvement with respect to the best feasible solution sampled so far and the probability that the point is feasible. CEI algorithm encodes the constraint implicitly in the acquisition function but does not explicitly consider feasibility. Therefore, CEI algorithm can be very aggressive and may violate the constraints severely. Extension to Contextual Setting For fair comparison purposes, we extend both SafeOPT and CEI to the contextual settings. Specifically, similarly to the procedure described in Section 2 (Eqs. (4b) and (5b)) and Section 3.2 (Eq. (7b)), we augment the input space of the Gaussian processes with contextual variables for both SafeOPT and CEI. In each step, we derive the GP posterior distribution conditioned on the current observed contextual variables and apply the same algorithms of SafeOPT or CEI under non-contextual settings. Comparisons Intuitively, SafeOPT is overly cautious by strictly restricting the sampling process in a safe set while CEI is overly aggressive without explicit consideration of feasibility. In contrast, our PDCBO is neither too cautious nor too aggressive by dynamically adjusting the dual variables according to the constraints. 4.3 Discomfort constrained energy minimization 4.3.1 Adaptivity gain compared to static parameters To demonstrate how adaptivity of control parameters benefits the energy saving and discomfort reduction, Fig. 3 shows samples of the daily energy consumption and thermal discomfort of the PDCBO algorithm with discomfort threshold 9 Kh. Remarkably, our method simultaneously reduces the energy consumption by 17.9% and the discomfort by 48.9% on average in this example. To account for the fact that more energy is naturally needed to maintain the indoor temperature in a reasonable range when the ambient temperature is lower, we plot both metrics against the mean ambient temperature in a day. For comparison purposes, we also plotted samples corresponding to fixed controller parameters that are manually set by experience. For better visualization, we also plot the linear regression results for both sets of samples. It can be seen that PDCBO can reduce both the energy consumption and the discomfort compared to static parameters. Interestingly, in the low ambient temperature regime ( ≤ 10 ° C ), the discomfort reduction is more significant while in the high ambient temperature regime, the energy reduction is more significant. This matches our intuition that uncareful heating (e.g., not enough heating power) is more likely to lead to severe discomfort on cold days and thus, there is more room for discomfort reduction on cold days. Meanwhile, on warm days, overheating can be an issue with static control parameters and thus there is more room for energy reduction. To understand how the parameters are chosen by PDCBO, the coefficients K p and K i and the switching time from nighttime setpoint to daytime setpoint are also plotted against the average ambient temperature in Fig. 4. There is a trend to switch the setpoint earlier when the ambient temperature is low, which matches our intuition that pre-heating is needed to avoid low temperatures during working hours on cold days. Interestingly, in the low-temperature regime, PDCBO tends to favor parameters with small P and large I, contrary to the high-temperature regime. Intuitively, low ambient temperatures have a large \u2018cooling\u2019 effect on the room and, therefore, a large integral term is needed to accelerate the heating towards the set-point to reduce discomfort and also cancel out the severe offset caused by low ambient temperature. On the contrary, in the high ambient temperature regime, the ambient effect is less severe and small integral term can be adopted to avoid the overshoot and save energy. Meanwhile, a large proportional term can help reduce the offset issue in the high ambient temperature regime. Remarkably, such an adaptation policy is automatically found by our PDCBO algorithm. 4.3.2 Comparison with SafeOPT and CEI Fig. 5 shows the daily running average energy consumption and thermal discomfort obtained by the three methods over 300 days with three different discomfort thresholds D t h r = 5 , 10 , or 15 K h per day, where 1 K h represents 1 Kelvin temperature deviation from comfortable range for 1 hour. As can be seen, PDCBO can keep the average discomfort below the user-defined threshold in the long-term (except minor violation when the threshold is as small as 5 K h ), contrary to CEI, which incurs severe comfort violations (up to more than 240%). On the other hand, PDCBO can achieve significant energy savings compared to SafeOPT. Indeed, our method uses the allowed maximum discomfort budget and exploits it to achieve more energy savings. The saving percentages increase when the allowed discomfort budget increases. In sharp contrast, SafeOPT is overly cautious and cannot achieve all the potential energy savings given the allowed discomfort threshold. Tables 2 and 3 give the concrete final average statistics over the 300 days. Fig. 6 gives three-day sample trajectories of the temperature and the heating power after running for 70 days, with discomfort threshold at 5 Kh. This confirms that SafeOPT is very cautious and does not explore the energy saving potential of lowering the temperature setpoints. On the other hand, CEI samples parameters aggressively, leading to large thermal discomfort. As a good compromise, PDCBO identifies control parameters that can simultaneously reduce the energy consumption and manage the discomfort well. 4.3.3 Impact of discomfort threshold To visualize the impact of different thermal comfort thresholds, Fig. 7 presents the average daily energy consumption and comfort violations (i.e., the cumulative temperature violations from a comfort range) obtained by the three methods with a threshold changing from 5 Kh to 25 Kh. Note that the absolute value of the cumulative temperature deviation highly depends on the comfort range adopted. As given in Section 4.1, the comfort range we adopt is tighter than the standard range. Therefore, we can set the threshold of discomfort (quantified by cumulative temperature deviation) to be from a larger range to capture diversified comfort requirements. We also note that PDCBO consistently respects the discomfort threshold constraints in all cases in the long-term (except the minor violation when the discomfort threshold is 5 Kh) while simultaneously leveraging the increasing allowed discomfort budget to reduce the energy consumption. Compared to SafeOPT, PDCBO saves up to 4.7% energy, as we increase the discomfort threshold to 25 Kh. Meanwhile, when the discomfort threshold is small, CEI uses less energy than PDCBO but at the cost of severe comfort violations (Table 3), which can be strongly undesired by room occupants. Tables 2 and 3 give the concrete numbers of discomfort and energy consumption, together with violation/saving percentages. It can be seen that when the discomfort threshold takes the value 15 K h , CEI significantly violates the discomfort threshold constraints by about 18.4%, while our PDCBO achieves 3.2% energy saving as compared to SafeOPT method with discomfort below the threshold on average. However, when a large thermal discomfort is tolerable \u2014 when the constraint is easier to meet at 25 Kh \u2014, CEI can perform slightly better than PDCBO. Remarkably, the average discomfort incurred by PDCBO significantly increases with larger discomfort thresholds D thr while the average energy consumption decreases, demonstrating that our method can efficiently exploit the increased allowed thermal discomfort to save more energy. Such adaptivity to different requirements for comfort is critical since the occupants\u2019 preference for thermal comfort [47] and energy consumption can be diverse in practice. On the contrary, the other two baseline methods are either too cautious (SafeOPT) or overly aggressive (CEI) and cannot adapt to different discomfort thresholds properly. 4.3.4 Discomfort threshold tracking We now consider the scenario where the discomfort threshold is time-varying, which can happen in practice. For example, when occupants change, new occupants may be willing to trade off more temperature deviations for more energy savings, or vice versa. Fig. 8(a) shows the evolution of the average energy consumption and thermal discomfort with a time-varying discomfort threshold. The discomfort threshold is changed on days 75, 150, and 225. Every time the threshold changes, we reinitialize the calculation of the running average for the discomfort and energy consumption. However, we keep the algorithm continuously running, only modifying the constraint. For reference, Fig. 8(b) depicts the average ambient temperature during the four periods with different discomfort thresholds. We observe that periods 1 and 3, as well as periods 2 and 4, have similar ambient temperatures. Consequently, we focus our analysis on comparing periods 3 and 1 and between periods 4 and 2, respectively. Interestingly, PDCBO closely tracks the change of discomfort threshold (Fig. 8(a), right) and exploits the more and more allowable temperature deviations to gradually reduce energy consumption, (comparing period 3 to 1 or period 4 to 2 in Fig. 8(c)). The high energy consumption in period 1 is due to two reasons. First, it has a much lower ambient temperature than in period 2 and period 4. Second, it has the lowest discomfort threshold, which requires more heating. Also note that the energy increase in period 3 (from about day 150 to day 225) as compared to period 2 is due to the decrease of ambient temperature (see Fig. 8(b)). In contrast and similarly to what was observed in the previous sections, the CEI method is overly aggressive and fails to respect the time-varying discomfort threshold most of the time. SafeOPT, on the contrary, is overly cautious and fails to exploit the time-varying discomfort threshold to reduce the energy consumption. When the discomfort threshold changes, we reset the running averages of energy consumption and discomfort. And due to the sudden change of discomfort threshold, the dual variable has a sudden jump, which can lead to the severe change of the instantaneous energy consumption/discomfort, reflected in some spikes of these two reset running average metrics. 4.4 Energy constrained discomfort minimization In this section, we consider the regime where energy consumption is limited to a low budget due to, for example, the energy crisis [48], and the pressure of achieving carbon-neutrality targets on time [49], and we want to maximize the comfort of the occupants with this limited budget. As compared to Problem (4b), it is more relevant to bound the average energy consumption for energy constraint (which directly relates to the electricity bill) during a period. Fig. 9 shows the evolution of E n a v g and D n a v g for the three analyzed methods. Tables 4 and 5 show the concrete statistics of energy consumption (with budget violation percentage) and discomfort (with discomfort reduction percentage). It can be observed that PDCBO manages to keep the average energy consumption below the predefined energy consumption threshold in the long term for different energy budget constraints except minor violation when the energy budget is as low as 9 kWh.. In sharp contrast, CEI fails to respect the energy budget constraint and can incur an average energy consumption that is more than twice the prescribed energy budget in the long term. On the other hand, the budgeted energy consumption is well exploited by PDCBO to efficiently reduce the discomfort by respectively 46%, 53%, and 63%, for the three different energy budgets compared to the overly cautious SafeOPT method that tries to keep strictly low energy consumption all the time, which essentially turns off the heating. To understand the impact of the energy budget, Fig. 10 shows sampled temperature trajectories (after running for about 200 days) of PDCBO with three different thresholds. It can be observed that as we gradually increase the budget, the trajectories become better and better and incurs less and less discomfort. 5 Conclusion and discussion In this paper, we presented a data-driven primal\u2013dual contextual Bayesian optimization (PDCBO) approach to automatically tuning the parameters of a PI controller, the daytime setpoint of the temperature, and the pre-heating time to minimize the energy consumption of a room subject to a thermal discomfort constraint, or minimize the discomfort subject to an energy budget constraint. We showcased how PDCBO is able to simultaneously adapt to the time-varying ambient conditions and optimize the objective while satisfying constraints on average. When minimizing the energy consumption subject to a thermal discomfort constraint, s imulation results show that PDCBO can decrease the energy consumption by up to 4.7% compared to state-of-the-art safe Bayesian optimization methods while keeping the average discomfort below the given tolerable threshold. Additionally, it can automatically track time-varying tolerable thresholds. On the other hand, the other two constrained Bayesian optimization methods are either too cautious (SafeOPT) or overly aggressive (CEI) and cannot adapt to different discomfort thresholds properly. When we instead optimize the thermal comfort of the occupants subject to a limited energy budget, PDCBO could reduce the average discomfort by up to 63% compared to SafeOPT, with an average energy consumption below the given budget. On the other hand, although it achieves lower discomfort, CEI severely violates the energy budget constraint. One promising direction to further increase the sample efficiency of BO controller tuning could be to exploit the grey-box nature of the energy/discomfort functions (see Eqs. (1) and (2), which are integrations of a black-box function) to accelerate the tuning of a building controller. Another direction is considering multi-zone building controller tuning, where the layout and geometrical information of the zones may be exploited to improve the tuning efficiency using the recently proposed grey-box BO method [50]. CRediT authorship contribution statement Wenjie Xu: Conceptualization, Methodology, Software, Validation, Formal analysis, Data curation, Visualization, Writing \u2013 original draft. Bratislav Svetozarevic: Conceptualization, Methodology, Writing \u2013 review & editing, Supervision. Loris Di Natale: Software, Validation, Data curation, Visualization, Writing \u2013 review & editing. Philipp Heer: Writing \u2013 review & editing Resources, Funding acquisition. Colin N. Jones: Conceptualization, Methodology, Writing \u2013 review & editing, Supervision. Declaration of competing interest The authors declare that they have no known competing financial interests or personal relationships that could have appeared to influence the work reported in this paper. Acknowledgments This research was supported by the Swiss National Science Foundation, Switzerland under NCCR Automation, grant agreement 51NF40_180545, and in part by the Swiss Data Science Center, Switzerland , grant agreement C20-13. References [1] Boodi A. Beddiar K. Benamour M. Amirat Y. Benbouzid M. Intelligent systems for building energy and occupant comfort optimization: A state of the art review and recommendations Energies 11 2018 2604 A. Boodi, K. Beddiar, M. Benamour, Y. Amirat, M. Benbouzid, Intelligent systems for building energy and occupant comfort optimization: A state of the art review and recommendations, Energies 11 (2018) 2604. [2] Oldewurtel F. Parisio A. Jones C.N. Gyalistras D. Gwerder M. Stauch V. Use of model predictive control and weather forecasts for energy efficient building climate control Energy Build 45 2012 15 27 F. Oldewurtel, A. Parisio, C. N. Jones, D. Gyalistras, M. Gwerder, V. Stauch, B. Lehmann, M. Morari, Use of model predictive control and weather forecasts for energy efficient building climate control, Energy and Buildings 45 (2012) 15\u201327. [3] Xiao T. You F. Building thermal modeling and model predictive control with physically consistent deep learning for decarbonization and energy optimization Appl Energy 342 2023 121165 T. Xiao, F. You, Building thermal modeling and model predictive control with physically consistent deep learning for decarbonization and energy optimization, Applied Energy 342 (2023) 121165. [4] Gao Y. Miyata S. Akashi Y. Energy saving and indoor temperature control for an office building using tube-based robust model predictive control Appl Energy 341 2023 121106 Y. Gao, S. Miyata, Y. Akashi, Energy saving and indoor temperature control for an office building using tube-based robust model predictive control, Applied Energy 341 (2023) 121106. [5] Svetozarevic B. Baumann C. Muntwiler S. Di Natale L. Zeilinger M.N. Heer P. Data-driven control of room temperature and bidirectional EV charging using deep reinforcement learning: Simulations and experiments Appl Energy 307 2022 118127 B. Svetozarevic, C. Baumann, S. Muntwiler, L. Di Natale, M. N. Zeilinger, P. Heer, Data-driven control of room temperature and bidirectional EV charging using deep reinforcement learning: Simulations and experiments, Applied Energy 307 (2022) 118127. [6] Lei Y. Zhan S. Ono E. Peng Y. Zhang Z. Hasama T. A practical deep reinforcement learning framework for multivariate occupant-centric control in buildings Appl Energy 324 2022 119742 Y. Lei, S. Zhan, E. Ono, Y. Peng, Z. Zhang, T. Hasama, A. Chong, A practical deep reinforcement learning framework for multivariate occupant-centric control in buildings, Applied Energy 324 (2022) 119742. [7] Yang L. Nagy Z. Goffin P. Schlueter A. Reinforcement learning for optimal control of low exergy buildings Appl Energy 156 2015 577 586 L. Yang, Z. Nagy, P. Goffin, A. Schlueter, Reinforcement learning for optimal control of low exergy buildings, Applied Energy 156 (2015) 577\u2013586. [8] Coraci D. Brandi S. Hong T. Capozzoli A. Online transfer learning strategy for enhancing the scalability and deployment of deep reinforcement learning control in smart buildings Appl Energy 333 2023 120598 D. Coraci, S. Brandi, T. Hong, A. Capozzoli, Online transfer learning strategy for enhancing the scalability and deployment of deep reinforcement learning control in smart buildings, Applied Energy 333 (2023) 120598. [9] Shen R. Zhong S. Wen X. An Q. Zheng R. Li Y. Multi-agent deep reinforcement learning optimization framework for building energy system with renewable energy Appl Energy 312 2022 118724 R. Shen, S. Zhong, X. Wen, Q. An, R. Zheng, Y. Li, J. Zhao, Multi-agent deep reinforcement learning optimization framework for building energy system with renewable energy, Applied Energy 312 (2022) 118724. [10] Salsbury T.I. A survey of control technologies in the building automation industry IFAC Proc Vol 38 2005 90 100 T. I. Salsbury, A survey of control technologies in the building automation industry, IFAC Proceedings Volumes 38 (2005) 90\u2013100. [11] Stluka P. Parthasarathy G. Gabel S. Samad T. Architectures and algorithms for building automation\u2014An industry view Intelligent building control systems 2018 Springer 11 43 P. Stluka, G. Parthasarathy, S. Gabel, T. Samad, Architectures and algorithms for building automation\u2014an industry view, in: Intelligent Building Control Systems, Springer, 2018, pp. 11\u201343. [12] Fiducioso M. Curi S. Schumacher B. Gwerder M. Krause A. Safe contextual Bayesian optimization for sustainable room temperature PID control tuning Proceedings of the twenty-eighth international joint conference on artificial intelligence 2019 International Joint Conferences on Artificial Intelligence 5850 5856 M. Fiducioso, S. Curi, B. Schumacher, M. Gwerder, A. Krause, Safe contextual Bayesian optimization for sustainable room temperature PID control tuning, in: Proceedings of the Twenty-Eighth International Joint Conference on Artificial Intelligence, International Joint Conferences on Artificial Intelligence, pp. 5850\u20135856. [13] Yan K. Zhou X. Yang B. AI and IoT applications of smart buildings and smart environment design, construction and maintenance Build Environ 229 2023 K. Yan, X. Zhou, B. Yang, AI and IoT applications of smart buildings and smart environment design, construction and maintenance, 2023. [14] Chen B, Cai Z, Bergés M. GNU-RL: A precocial reinforcement learning solution for building HVAC control using a differentiable MPC policy. In: Proceedings of the 6th ACM international conference on systems for energy-efficient buildings, cities, and transportation. 2019, p. 316\u201325. [15] Shen Y. Pan Y. BIM-supported automatic energy performance analysis for green building design using explainable machine learning and multi-objective optimization Appl Energy 333 2023 120575 Y. Shen, Y. Pan, BIM-supported automatic energy performance analysis for green building design using explainable machine learning and multi-objective optimization, Applied Energy 333 (2023) 120575. [16] Yan H. Ji G. Yan K. Data-driven prediction and optimization of residential building performance in Singapore considering the impact of climate change Build Environ 226 2022 109735 H. Yan, G. Ji, K. Yan, Data-driven prediction and optimization of residential building performance in Singapore considering the impact of climate change, Building and Environment 226 (2022) 109735. [17] Jin Q, Overend M. Facade renovation for a public building based on a whole-life value approach. In: Proceedings of building simulation and optimisation conference, Loughborough, UK. 2012, p. 378e85. [18] Diakaki C. Grigoroudis E. Kabelis N. Kolokotsa D. Kalaitzakis K. Stavrakakis G. A multi-objective decision model for the improvement of energy efficiency in buildings Energy 35 2010 5483 5496 C. Diakaki, E. Grigoroudis, N. Kabelis, D. Kolokotsa, K. Kalaitzakis, G. Stavrakakis, A multi-objective decision model for the improvement of energy efficiency in buildings, Energy 35 (2010) 5483\u20135496. [19] Chantrelle F.P. Lahmidi H. Keilholz W. El Mankibi M. Michel P. Development of a multicriteria tool for optimizing the renovation of buildings Appl Energy 88 2011 1386 1394 F. P. Chantrelle, H. Lahmidi, W. Keilholz, M. El Mankibi, P. Michel, Development of a multicriteria tool for optimizing the renovation of buildings, Applied Energy 88 (2011) 1386\u20131394. [20] Nguyen A.-T. Reiter S. Rigo P. A review on simulation-based optimization methods applied to building performance analysis Appl Energy 113 2014 1043 1058 A.-T. Nguyen, S. Reiter, P. Rigo, A review on simulation-based optimization methods applied to building performance analysis, Applied Energy 113 (2014) 1043\u20131058. [21] Xu W. Jones C.N. Svetozarevic B. Laughman C.R. Chakrabarty A. VABO: Violation-aware Bayesian optimization for closed-loop control performance optimization with unmodeled constraints 2022 American control conference 2022 IEEE 5288 5293 W. Xu, C. N. Jones, B. Svetozarevic, C. R. Laughman, A. Chakrabarty, VABO: Violation-Aware Bayesian Optimization for closed-loop control performance optimization with unmodeled constraints, in: 2022 American Control Conference (ACC), IEEE, pp. 5288\u20135293. [22] Xu W. Jones C.N. Svetozarevic B. Laughman C.R. Chakrabarty A. Violation-aware contextual Bayesian optimization for controller performance optimization with unmodeled constraints 2023 arXiv preprint arXiv:2301.12099 W. Xu, C. N. Jones, B. Svetozarevic, C. R. Laughman, A. Chakrabarty, Violation-aware contextual Bayesian optimization for controller performance optimization with unmodeled constraints, arXiv preprint arXiv:2301.12099 (2023). [23] Jones D.R. Schonlau M. Welch W.J. Efficient global optimization of expensive black-box functions J Global Optim 13 1998 455 492 D. R. Jones, M. Schonlau, W. J. Welch, Efficient global optimization of expensive black-box functions, J. Global Optim. 13 (1998) 455\u2013492. [24] Xu W. Jiang Y. Maddalena E.T. Jones C.N. Lower bounds on the worst-case complexity of efficient global optimization 2022 arXiv preprint arXiv:2209.09655 W. Xu, Y. Jiang, E. T. Maddalena, C. N. Jones, Lower bounds on the worst-case complexity of efficient global optimization, arXiv preprint arXiv:2209.09655 (2022). [25] Li X. Wen J. Review of building energy modeling for control and operation Renew Sustain Energy Rev 37 2014 517 537 X. Li, J. Wen, Review of building energy modeling for control and operation, Renewable and Sustainable Energy Reviews 37 (2014) 517\u2013537. [26] Zhan S. Wichern G. Laughman C. Chong A. Chakrabarty A. Calibrating building simulation models using multi-source datasets and meta-learned Bayesian optimization Energy Build 270 2022 112278 S. Zhan, G. Wichern, C. Laughman, A. Chong, A. Chakrabarty, Calibrating building simulation models using multi-source datasets and meta-learned Bayesian optimization, Energy and Buildings 270 (2022) 112278. [27] Chakrabarty A. Maddalena E. Qiao H. Laughman C. Scalable Bayesian optimization for model calibration: Case study on coupled building and HVAC dynamics Energy Build 253 2021 111460 A. Chakrabarty, E. Maddalena, H. Qiao, C. Laughman, Scalable Bayesian optimization for model calibration: Case study on coupled building and HVAC dynamics, Energy and Buildings 253 (2021) 111460. [28] Bhattacharya A. Vasisht S. Adetola V. Huang S. Sharma H. Vrabie D.L. Control co-design of commercial building chiller plant using Bayesian optimization Energy Build 246 2021 111077 A. Bhattacharya, S. Vasisht, V. Adetola, S. Huang, H. Sharma, D. L. Vrabie, Control co-design of commercial building chiller plant using Bayesian optimization, Energy and Buildings 246 (2021) 111077. [29] Xu W. Jiang Y. Svetozarevic B. Jones C. CONFIG: Constrained efficient global optimization for closed-loop control system optimization with unmodeled constraints IFAC-PapersOnLine 2023 W. Xu, Y. Jiang, B. Svetozarevic, C. Jones, CONFIG: Constrained efficient global optimization for closed-loop control system optimization with unmodeled constraints, IFAC-PapersOnLine (2023). [30] Jiang B. Berliner M.D. Lai K. Asinger P.A. Zhao H. Herring P.K. Fast charging design for lithium-ion batteries via Bayesian optimization Appl Energy 307 2022 118244 B. Jiang, M. D. Berliner, K. Lai, P. A. Asinger, H. Zhao, P. K. Herring, M. Z. Bazant, R. D. Braatz, Fast charging design for lithium-ion batteries via Bayesian optimization, Applied Energy 307 (2022) 118244. [31] Lisicki M. Lubitz W. Taylor G.W. Optimal design and operation of archimedes screw turbines using Bayesian optimization Appl Energy 183 2016 1404 1417 M. Lisicki, W. Lubitz, G. W. Taylor, Optimal design and operation of archimedes screw turbines using Bayesian optimization, Applied Energy 183 (2016) 1404\u20131417. [32] Gelbart M.A. Snoek J. Adams R.P. Bayesian optimization with unknown constraints Proc. of the 30th conf. on uncertainty in artif. intell UAI \u201914 2014 AUAI Press Arlington, Virginia, USA 250 259 M. A. Gelbart, J. Snoek, R. P. Adams, Bayesian optimization with unknown constraints, in: Proc. of the 30th Conf. on Uncertainty in Artif. Intell., UAI\u201914, AUAI Press, Arlington, Virginia, USA, 2014, p. 250\u2013259. [33] Gardner J.R. Kusner M.J. Xu Z.E. Weinberger K.Q. Cunningham J.P. Bayesian optimization with inequality constraints Proc. of the int. conf. on mach. learn vol. 2014 2014 937 945 J. R. Gardner, M. J. Kusner, Z. E. Xu, K. Q. Weinberger, J. P. Cunningham, Bayesian optimization with inequality constraints., in: Proc. of the Int. Conf. on Mach. Learn., volume 2014, pp. 937\u2013945. [34] Sui Y, Gotovos A, Burdick J, Krause A. Safe exploration for optimization with Gaussian processes. In: Proc. of the int. conf. on mach. learn. 2015, p. 997\u20131005. [35] Zhou X, Ji B. On Kernelized Multi-Armed Bandits with Constraints. In: Advances in neural information processing systems. [36] Xu W. Jiang Y. Svetozarevic B. Jones C.N. Primal-dual contextual Bayesian optimization for control system online optimization with time-average constraints 2023 IEEE 62nd conference on decision and control 2023 IEEE W. Xu, Y. Jiang, B. Svetozarevic, C. N. Jones, Primal\u2013dual contextual Bayesian optimization for control system online optimization with time-average constraints, in: 2023 IEEE 62nd Conference on Decision and Control (CDC), IEEE. [37] Taleghani M. Tenpierik M. Kurvers S. Van Den Dobbelsteen A. A review into thermal comfort in buildings Renew Sustain Energy Rev 26 2013 201 215 M. Taleghani, M. Tenpierik, S. Kurvers, A. Van Den Dobbelsteen, A review into thermal comfort in buildings, Renewable and Sustainable Energy Reviews 26 (2013) 201\u2013215. [38] Rasmussen C.E. Gaussian processes in machine learning Summer school on machine learning 2003 Springer 63 71 C. E. Rasmussen, Gaussian processes in machine learning, in: Summer school on machine learning, Springer, pp. 63\u201371. [39] Williams C.K.I. Rasmussen C.E. Gaussian processes for machine learning, vol. 2 2006 MIT press Cambridge MA C. K. Williams, C. E. Rasmussen, Gaussian processes for machine learning, volume 2, MIT press Cambridge, MA, 2006. [40] Frazier P.I. A tutorial on Bayesian optimization 2018 arXiv preprint arXiv:1807.02811 P. I. Frazier, A tutorial on Bayesian optimization, arXiv preprint arXiv:1807.02811 (2018). [41] Srinivas N. Krause A. Kakade S.M. Seeger M.W. Information-theoretic regret bounds for Gaussian process optimization in the bandit setting IEEE Trans Inform Theory 58 2012 3250 3265 N. Srinivas, A. Krause, S. M. Kakade, M. W. Seeger, Information-theoretic regret bounds for Gaussian process optimization in the bandit setting, IEEE Transactions on Information Theory 58 (2012) 3250\u20133265. [42] Nocedal J. Wright S.J. Numerical optimization 1999 Springer J. Nocedal, S. J. Wright, Numerical optimization, Springer, 1999. [43] Di Natale L. Svetozarevic B. Heer P. Jones C.N. Physically consistent neural networks for building thermal modeling: Theory and analysis Appl Energy 325 2022 119806 L. Di Natale, B. Svetozarevic, P. Heer, C. N. Jones, Physically consistent neural networks for building thermal modeling: theory and analysis, Applied Energy 325 (2022) 119806. [44] Di Natale L. Svetozarevic B. Heer P. Jones C.N. Towards scalable physically consistent neural networks: An application to data-driven multi-zone thermal building models Appl Energy 340 2023 121071 L. Di Natale, B. Svetozarevic, P. Heer, C. N. Jones, Towards scalable physically consistent neural networks: An application to data-driven multi-zone thermal building models, Applied Energy 340 (2023) 121071. [45] EWZ L. Current tariffs for the city of zurich 2023 https://www.ewz.ch/en/private-customers/electricity/tariffs/overview-of-tariff.html EWZ, Current tariffs for the city of Zurich, https://www.ewz.ch/en/private-customers/electricity/tariffs/overview-of-tariff.html, since 2023. [46] GPy L. GPy: A Gaussian process framework in python 2012 http://github.com/SheffieldML/GPy GPy, GPy: A Gaussian process framework in python, http://github.com/SheffieldML/GPy, since 2012. [47] Wang Z. de Dear R. Luo M. Lin B. He Y. Ghahramani A. Individual difference in thermal comfort: A literature review Build Environ 138 2018 181 193 Z. Wang, R. de Dear, M. Luo, B. Lin, Y. He, A. Ghahramani, Y. Zhu, Individual difference in thermal comfort: A literature review, Building and Environment 138 (2018) 181\u2013193. [48] 2022, https://www.energypriceindex.com/price-data. [49] 2022, https://www.un.org/en/climatechange/net-zero-coalition. [50] Xu W. Jiang Y. Svetozarevic B. Jones C.N. Bayesian optimization of expensive nested grey-box functions 2023 arXiv preprint arXiv:2306.05150 W. Xu, Y. Jiang, B. Svetozarevic, C. N. Jones, Bayesian optimization of expensive nested grey-box functions, arXiv preprint arXiv:2306.05150 (2023).",
    "scopus-id": "85183786230",
    "coredata": {
        "eid": "1-s2.0-S0306261923018573",
        "dc:description": "We study the problem of tuning the parameters of a room temperature controller to minimize its energy consumption, subject to the constraint that the daily cumulative thermal discomfort of the occupants is below a given threshold. We formulate it as an online constrained black-box optimization problem where, on each day, we observe some relevant environmental context and adaptively select the controller parameters. In this paper, we propose to use a data-driven Primal-Dual Contextual Bayesian Optimization (PDCBO) approach to solve this problem. In a simulation case study on a single room, we apply our algorithm to tune the parameters of a Proportional Integral (PI) heating controller and the pre-heating time. Our results show that PDCBO can save up to 4.7% energy consumption compared to other state-of-the-art Bayesian optimization-based methods while keeping the daily thermal discomfort below the given tolerable threshold on average. Additionally, PDCBO can automatically track time-varying tolerable thresholds while existing methods fail to do so. We then study an alternative constrained tuning problem where we aim to minimize the thermal discomfort with a given energy budget. With this formulation, PDCBO reduces the average discomfort by up to 63% compared to state-of-the-art safe optimization methods while keeping the average daily energy consumption below the required threshold.",
        "openArchiveArticle": "false",
        "prism:coverDate": "2024-03-15",
        "openaccessUserLicense": "http://creativecommons.org/licenses/by-nc-nd/4.0/",
        "prism:aggregationType": "Journal",
        "prism:url": "https://api.elsevier.com/content/article/pii/S0306261923018573",
        "dc:creator": [
            {
                "@_fa": "true",
                "$": "Xu, Wenjie"
            },
            {
                "@_fa": "true",
                "$": "Svetozarevic, Bratislav"
            },
            {
                "@_fa": "true",
                "$": "Di Natale, Loris"
            },
            {
                "@_fa": "true",
                "$": "Heer, Philipp"
            },
            {
                "@_fa": "true",
                "$": "Jones, Colin N."
            }
        ],
        "link": [
            {
                "@_fa": "true",
                "@rel": "self",
                "@href": "https://api.elsevier.com/content/article/pii/S0306261923018573"
            },
            {
                "@_fa": "true",
                "@rel": "scidir",
                "@href": "https://www.sciencedirect.com/science/article/pii/S0306261923018573"
            }
        ],
        "dc:format": "application/json",
        "openaccessType": "Full",
        "pii": "S0306-2619(23)01857-3",
        "prism:volume": "358",
        "articleNumber": "122493",
        "prism:publisher": "The Authors. Published by Elsevier Ltd.",
        "dc:title": "Data-driven adaptive building thermal controller tuning with constraints: A primal\u2013dual contextual Bayesian optimization approach",
        "prism:copyright": "© 2024 The Authors. Published by Elsevier Ltd.",
        "openaccess": "1",
        "prism:issn": "03062619",
        "dcterms:subject": [
            {
                "@_fa": "true",
                "$": "Building thermal control"
            },
            {
                "@_fa": "true",
                "$": "Controller tuning"
            },
            {
                "@_fa": "true",
                "$": "Bayesian optimization"
            },
            {
                "@_fa": "true",
                "$": "Contextual model"
            },
            {
                "@_fa": "true",
                "$": "Primal\u2013dual method"
            }
        ],
        "openaccessArticle": "true",
        "prism:publicationName": "Applied Energy",
        "openaccessSponsorType": "FundingBody",
        "prism:pageRange": "122493",
        "pubType": "fla",
        "prism:coverDisplayDate": "15 March 2024",
        "prism:doi": "10.1016/j.apenergy.2023.122493",
        "prism:startingPage": "122493",
        "dc:identifier": "doi:10.1016/j.apenergy.2023.122493",
        "openaccessSponsorName": "Swiss institutions 2021"
    },
    "objects": {"object": [
        {
            "@category": "standard",
            "@height": "250",
            "@width": "349",
            "@_fa": "true",
            "$": "https://api.elsevier.com/content/object/eid/1-s2.0-S0306261923018573-gr2.jpg?httpAccept=%2A%2F%2A",
            "@multimediatype": "JPEG image file",
            "@type": "IMAGE-DOWNSAMPLED",
            "@size": "65700",
            "@ref": "gr2",
            "@mimetype": "image/jpeg"
        },
        {
            "@category": "standard",
            "@height": "174",
            "@width": "301",
            "@_fa": "true",
            "$": "https://api.elsevier.com/content/object/eid/1-s2.0-S0306261923018573-ga1.jpg?httpAccept=%2A%2F%2A",
            "@multimediatype": "JPEG image file",
            "@type": "IMAGE-DOWNSAMPLED",
            "@size": "85425",
            "@ref": "ga1",
            "@mimetype": "image/jpeg"
        },
        {
            "@category": "standard",
            "@height": "468",
            "@width": "320",
            "@_fa": "true",
            "$": "https://api.elsevier.com/content/object/eid/1-s2.0-S0306261923018573-gr3.jpg?httpAccept=%2A%2F%2A",
            "@multimediatype": "JPEG image file",
            "@type": "IMAGE-DOWNSAMPLED",
            "@size": "88988",
            "@ref": "gr3",
            "@mimetype": "image/jpeg"
        },
        {
            "@category": "standard",
            "@height": "388",
            "@width": "367",
            "@_fa": "true",
            "$": "https://api.elsevier.com/content/object/eid/1-s2.0-S0306261923018573-gr10.jpg?httpAccept=%2A%2F%2A",
            "@multimediatype": "JPEG image file",
            "@type": "IMAGE-DOWNSAMPLED",
            "@size": "79711",
            "@ref": "gr10",
            "@mimetype": "image/jpeg"
        },
        {
            "@category": "standard",
            "@height": "718",
            "@width": "342",
            "@_fa": "true",
            "$": "https://api.elsevier.com/content/object/eid/1-s2.0-S0306261923018573-gr4.jpg?httpAccept=%2A%2F%2A",
            "@multimediatype": "JPEG image file",
            "@type": "IMAGE-DOWNSAMPLED",
            "@size": "108128",
            "@ref": "gr4",
            "@mimetype": "image/jpeg"
        },
        {
            "@category": "standard",
            "@height": "669",
            "@width": "627",
            "@_fa": "true",
            "$": "https://api.elsevier.com/content/object/eid/1-s2.0-S0306261923018573-gr5.jpg?httpAccept=%2A%2F%2A",
            "@multimediatype": "JPEG image file",
            "@type": "IMAGE-DOWNSAMPLED",
            "@size": "164010",
            "@ref": "gr5",
            "@mimetype": "image/jpeg"
        },
        {
            "@category": "standard",
            "@height": "420",
            "@width": "365",
            "@_fa": "true",
            "$": "https://api.elsevier.com/content/object/eid/1-s2.0-S0306261923018573-gr6.jpg?httpAccept=%2A%2F%2A",
            "@multimediatype": "JPEG image file",
            "@type": "IMAGE-DOWNSAMPLED",
            "@size": "87053",
            "@ref": "gr6",
            "@mimetype": "image/jpeg"
        },
        {
            "@category": "standard",
            "@height": "500",
            "@width": "338",
            "@_fa": "true",
            "$": "https://api.elsevier.com/content/object/eid/1-s2.0-S0306261923018573-gr7.jpg?httpAccept=%2A%2F%2A",
            "@multimediatype": "JPEG image file",
            "@type": "IMAGE-DOWNSAMPLED",
            "@size": "66180",
            "@ref": "gr7",
            "@mimetype": "image/jpeg"
        },
        {
            "@category": "standard",
            "@height": "479",
            "@width": "700",
            "@_fa": "true",
            "$": "https://api.elsevier.com/content/object/eid/1-s2.0-S0306261923018573-gr8.jpg?httpAccept=%2A%2F%2A",
            "@multimediatype": "JPEG image file",
            "@type": "IMAGE-DOWNSAMPLED",
            "@size": "105335",
            "@ref": "gr8",
            "@mimetype": "image/jpeg"
        },
        {
            "@category": "standard",
            "@height": "654",
            "@width": "642",
            "@_fa": "true",
            "$": "https://api.elsevier.com/content/object/eid/1-s2.0-S0306261923018573-gr9.jpg?httpAccept=%2A%2F%2A",
            "@multimediatype": "JPEG image file",
            "@type": "IMAGE-DOWNSAMPLED",
            "@size": "146872",
            "@ref": "gr9",
            "@mimetype": "image/jpeg"
        },
        {
            "@category": "standard",
            "@height": "191",
            "@width": "817",
            "@_fa": "true",
            "$": "https://api.elsevier.com/content/object/eid/1-s2.0-S0306261923018573-fx1001.jpg?httpAccept=%2A%2F%2A",
            "@multimediatype": "JPEG image file",
            "@type": "IMAGE-DOWNSAMPLED",
            "@size": "101526",
            "@ref": "fx1001",
            "@mimetype": "image/jpeg"
        },
        {
            "@category": "standard",
            "@height": "404",
            "@width": "699",
            "@_fa": "true",
            "$": "https://api.elsevier.com/content/object/eid/1-s2.0-S0306261923018573-gr1.jpg?httpAccept=%2A%2F%2A",
            "@multimediatype": "JPEG image file",
            "@type": "IMAGE-DOWNSAMPLED",
            "@size": "123742",
            "@ref": "gr1",
            "@mimetype": "image/jpeg"
        },
        {
            "@category": "thumbnail",
            "@height": "157",
            "@width": "219",
            "@_fa": "true",
            "$": "https://api.elsevier.com/content/object/eid/1-s2.0-S0306261923018573-gr2.sml?httpAccept=%2A%2F%2A",
            "@multimediatype": "GIF image file",
            "@type": "IMAGE-THUMBNAIL",
            "@size": "39414",
            "@ref": "gr2",
            "@mimetype": "image/gif"
        },
        {
            "@category": "thumbnail",
            "@height": "127",
            "@width": "219",
            "@_fa": "true",
            "$": "https://api.elsevier.com/content/object/eid/1-s2.0-S0306261923018573-ga1.sml?httpAccept=%2A%2F%2A",
            "@multimediatype": "GIF image file",
            "@type": "IMAGE-THUMBNAIL",
            "@size": "75298",
            "@ref": "ga1",
            "@mimetype": "image/gif"
        },
        {
            "@category": "thumbnail",
            "@height": "164",
            "@width": "112",
            "@_fa": "true",
            "$": "https://api.elsevier.com/content/object/eid/1-s2.0-S0306261923018573-gr3.sml?httpAccept=%2A%2F%2A",
            "@multimediatype": "GIF image file",
            "@type": "IMAGE-THUMBNAIL",
            "@size": "21337",
            "@ref": "gr3",
            "@mimetype": "image/gif"
        },
        {
            "@category": "thumbnail",
            "@height": "164",
            "@width": "155",
            "@_fa": "true",
            "$": "https://api.elsevier.com/content/object/eid/1-s2.0-S0306261923018573-gr10.sml?httpAccept=%2A%2F%2A",
            "@multimediatype": "GIF image file",
            "@type": "IMAGE-THUMBNAIL",
            "@size": "24223",
            "@ref": "gr10",
            "@mimetype": "image/gif"
        },
        {
            "@category": "thumbnail",
            "@height": "164",
            "@width": "78",
            "@_fa": "true",
            "$": "https://api.elsevier.com/content/object/eid/1-s2.0-S0306261923018573-gr4.sml?httpAccept=%2A%2F%2A",
            "@multimediatype": "GIF image file",
            "@type": "IMAGE-THUMBNAIL",
            "@size": "15648",
            "@ref": "gr4",
            "@mimetype": "image/gif"
        },
        {
            "@category": "thumbnail",
            "@height": "164",
            "@width": "154",
            "@_fa": "true",
            "$": "https://api.elsevier.com/content/object/eid/1-s2.0-S0306261923018573-gr5.sml?httpAccept=%2A%2F%2A",
            "@multimediatype": "GIF image file",
            "@type": "IMAGE-THUMBNAIL",
            "@size": "23930",
            "@ref": "gr5",
            "@mimetype": "image/gif"
        },
        {
            "@category": "thumbnail",
            "@height": "163",
            "@width": "142",
            "@_fa": "true",
            "$": "https://api.elsevier.com/content/object/eid/1-s2.0-S0306261923018573-gr6.sml?httpAccept=%2A%2F%2A",
            "@multimediatype": "GIF image file",
            "@type": "IMAGE-THUMBNAIL",
            "@size": "24565",
            "@ref": "gr6",
            "@mimetype": "image/gif"
        },
        {
            "@category": "thumbnail",
            "@height": "163",
            "@width": "110",
            "@_fa": "true",
            "$": "https://api.elsevier.com/content/object/eid/1-s2.0-S0306261923018573-gr7.sml?httpAccept=%2A%2F%2A",
            "@multimediatype": "GIF image file",
            "@type": "IMAGE-THUMBNAIL",
            "@size": "16442",
            "@ref": "gr7",
            "@mimetype": "image/gif"
        },
        {
            "@category": "thumbnail",
            "@height": "150",
            "@width": "219",
            "@_fa": "true",
            "$": "https://api.elsevier.com/content/object/eid/1-s2.0-S0306261923018573-gr8.sml?httpAccept=%2A%2F%2A",
            "@multimediatype": "GIF image file",
            "@type": "IMAGE-THUMBNAIL",
            "@size": "20212",
            "@ref": "gr8",
            "@mimetype": "image/gif"
        },
        {
            "@category": "thumbnail",
            "@height": "164",
            "@width": "161",
            "@_fa": "true",
            "$": "https://api.elsevier.com/content/object/eid/1-s2.0-S0306261923018573-gr9.sml?httpAccept=%2A%2F%2A",
            "@multimediatype": "GIF image file",
            "@type": "IMAGE-THUMBNAIL",
            "@size": "23569",
            "@ref": "gr9",
            "@mimetype": "image/gif"
        },
        {
            "@category": "thumbnail",
            "@height": "51",
            "@width": "219",
            "@_fa": "true",
            "$": "https://api.elsevier.com/content/object/eid/1-s2.0-S0306261923018573-fx1001.sml?httpAccept=%2A%2F%2A",
            "@multimediatype": "GIF image file",
            "@type": "IMAGE-THUMBNAIL",
            "@size": "68682",
            "@ref": "fx1001",
            "@mimetype": "image/gif"
        },
        {
            "@category": "thumbnail",
            "@height": "127",
            "@width": "219",
            "@_fa": "true",
            "$": "https://api.elsevier.com/content/object/eid/1-s2.0-S0306261923018573-gr1.sml?httpAccept=%2A%2F%2A",
            "@multimediatype": "GIF image file",
            "@type": "IMAGE-THUMBNAIL",
            "@size": "74951",
            "@ref": "gr1",
            "@mimetype": "image/gif"
        },
        {
            "@category": "high",
            "@height": "1109",
            "@width": "1546",
            "@_fa": "true",
            "$": "https://api.elsevier.com/content/object/eid/1-s2.0-S0306261923018573-gr2_lrg.jpg?httpAccept=%2A%2F%2A",
            "@multimediatype": "JPEG image file",
            "@type": "IMAGE-HIGH-RES",
            "@size": "515954",
            "@ref": "gr2",
            "@mimetype": "image/jpeg"
        },
        {
            "@category": "high",
            "@height": "771",
            "@width": "1333",
            "@_fa": "true",
            "$": "https://api.elsevier.com/content/object/eid/1-s2.0-S0306261923018573-ga1_lrg.jpg?httpAccept=%2A%2F%2A",
            "@multimediatype": "JPEG image file",
            "@type": "IMAGE-HIGH-RES",
            "@size": "206305",
            "@ref": "ga1",
            "@mimetype": "image/jpeg"
        },
        {
            "@category": "high",
            "@height": "2072",
            "@width": "1416",
            "@_fa": "true",
            "$": "https://api.elsevier.com/content/object/eid/1-s2.0-S0306261923018573-gr3_lrg.jpg?httpAccept=%2A%2F%2A",
            "@multimediatype": "JPEG image file",
            "@type": "IMAGE-HIGH-RES",
            "@size": "563346",
            "@ref": "gr3",
            "@mimetype": "image/jpeg"
        },
        {
            "@category": "high",
            "@height": "1717",
            "@width": "1625",
            "@_fa": "true",
            "$": "https://api.elsevier.com/content/object/eid/1-s2.0-S0306261923018573-gr10_lrg.jpg?httpAccept=%2A%2F%2A",
            "@multimediatype": "JPEG image file",
            "@type": "IMAGE-HIGH-RES",
            "@size": "415076",
            "@ref": "gr10",
            "@mimetype": "image/jpeg"
        },
        {
            "@category": "high",
            "@height": "3178",
            "@width": "1514",
            "@_fa": "true",
            "$": "https://api.elsevier.com/content/object/eid/1-s2.0-S0306261923018573-gr4_lrg.jpg?httpAccept=%2A%2F%2A",
            "@multimediatype": "JPEG image file",
            "@type": "IMAGE-HIGH-RES",
            "@size": "655781",
            "@ref": "gr4",
            "@mimetype": "image/jpeg"
        },
        {
            "@category": "high",
            "@height": "2959",
            "@width": "2775",
            "@_fa": "true",
            "$": "https://api.elsevier.com/content/object/eid/1-s2.0-S0306261923018573-gr5_lrg.jpg?httpAccept=%2A%2F%2A",
            "@multimediatype": "JPEG image file",
            "@type": "IMAGE-HIGH-RES",
            "@size": "1060281",
            "@ref": "gr5",
            "@mimetype": "image/jpeg"
        },
        {
            "@category": "high",
            "@height": "1862",
            "@width": "1619",
            "@_fa": "true",
            "$": "https://api.elsevier.com/content/object/eid/1-s2.0-S0306261923018573-gr6_lrg.jpg?httpAccept=%2A%2F%2A",
            "@multimediatype": "JPEG image file",
            "@type": "IMAGE-HIGH-RES",
            "@size": "520598",
            "@ref": "gr6",
            "@mimetype": "image/jpeg"
        },
        {
            "@category": "high",
            "@height": "2217",
            "@width": "1498",
            "@_fa": "true",
            "$": "https://api.elsevier.com/content/object/eid/1-s2.0-S0306261923018573-gr7_lrg.jpg?httpAccept=%2A%2F%2A",
            "@multimediatype": "JPEG image file",
            "@type": "IMAGE-HIGH-RES",
            "@size": "368762",
            "@ref": "gr7",
            "@mimetype": "image/jpeg"
        },
        {
            "@category": "high",
            "@height": "2122",
            "@width": "3100",
            "@_fa": "true",
            "$": "https://api.elsevier.com/content/object/eid/1-s2.0-S0306261923018573-gr8_lrg.jpg?httpAccept=%2A%2F%2A",
            "@multimediatype": "JPEG image file",
            "@type": "IMAGE-HIGH-RES",
            "@size": "657249",
            "@ref": "gr8",
            "@mimetype": "image/jpeg"
        },
        {
            "@category": "high",
            "@height": "2899",
            "@width": "2845",
            "@_fa": "true",
            "$": "https://api.elsevier.com/content/object/eid/1-s2.0-S0306261923018573-gr9_lrg.jpg?httpAccept=%2A%2F%2A",
            "@multimediatype": "JPEG image file",
            "@type": "IMAGE-HIGH-RES",
            "@size": "934772",
            "@ref": "gr9",
            "@mimetype": "image/jpeg"
        },
        {
            "@category": "high",
            "@height": "847",
            "@width": "3618",
            "@_fa": "true",
            "$": "https://api.elsevier.com/content/object/eid/1-s2.0-S0306261923018573-fx1001_lrg.jpg?httpAccept=%2A%2F%2A",
            "@multimediatype": "JPEG image file",
            "@type": "IMAGE-HIGH-RES",
            "@size": "322512",
            "@ref": "fx1001",
            "@mimetype": "image/jpeg"
        },
        {
            "@category": "high",
            "@height": "1790",
            "@width": "3096",
            "@_fa": "true",
            "$": "https://api.elsevier.com/content/object/eid/1-s2.0-S0306261923018573-gr1_lrg.jpg?httpAccept=%2A%2F%2A",
            "@multimediatype": "JPEG image file",
            "@type": "IMAGE-HIGH-RES",
            "@size": "539999",
            "@ref": "gr1",
            "@mimetype": "image/jpeg"
        },
        {
            "@category": "thumbnail",
            "@_fa": "true",
            "$": "https://api.elsevier.com/content/object/eid/1-s2.0-S0306261923018573-si1.svg?httpAccept=%2A%2F%2A",
            "@multimediatype": "Scalable Vector Graphics file",
            "@type": "ALTIMG",
            "@size": "1587",
            "@ref": "si1",
            "@mimetype": "image/svg+xml"
        },
        {
            "@category": "thumbnail",
            "@_fa": "true",
            "$": "https://api.elsevier.com/content/object/eid/1-s2.0-S0306261923018573-si100.svg?httpAccept=%2A%2F%2A",
            "@multimediatype": "Scalable Vector Graphics file",
            "@type": "ALTIMG",
            "@size": "27578",
            "@ref": "si100",
            "@mimetype": "image/svg+xml"
        },
        {
            "@category": "thumbnail",
            "@_fa": "true",
            "$": "https://api.elsevier.com/content/object/eid/1-s2.0-S0306261923018573-si101.svg?httpAccept=%2A%2F%2A",
            "@multimediatype": "Scalable Vector Graphics file",
            "@type": "ALTIMG",
            "@size": "4242",
            "@ref": "si101",
            "@mimetype": "image/svg+xml"
        },
        {
            "@category": "thumbnail",
            "@_fa": "true",
            "$": "https://api.elsevier.com/content/object/eid/1-s2.0-S0306261923018573-si102.svg?httpAccept=%2A%2F%2A",
            "@multimediatype": "Scalable Vector Graphics file",
            "@type": "ALTIMG",
            "@size": "8857",
            "@ref": "si102",
            "@mimetype": "image/svg+xml"
        },
        {
            "@category": "thumbnail",
            "@_fa": "true",
            "$": "https://api.elsevier.com/content/object/eid/1-s2.0-S0306261923018573-si103.svg?httpAccept=%2A%2F%2A",
            "@multimediatype": "Scalable Vector Graphics file",
            "@type": "ALTIMG",
            "@size": "1351",
            "@ref": "si103",
            "@mimetype": "image/svg+xml"
        },
        {
            "@category": "thumbnail",
            "@_fa": "true",
            "$": "https://api.elsevier.com/content/object/eid/1-s2.0-S0306261923018573-si104.svg?httpAccept=%2A%2F%2A",
            "@multimediatype": "Scalable Vector Graphics file",
            "@type": "ALTIMG",
            "@size": "8878",
            "@ref": "si104",
            "@mimetype": "image/svg+xml"
        },
        {
            "@category": "thumbnail",
            "@_fa": "true",
            "$": "https://api.elsevier.com/content/object/eid/1-s2.0-S0306261923018573-si105.svg?httpAccept=%2A%2F%2A",
            "@multimediatype": "Scalable Vector Graphics file",
            "@type": "ALTIMG",
            "@size": "10704",
            "@ref": "si105",
            "@mimetype": "image/svg+xml"
        },
        {
            "@category": "thumbnail",
            "@_fa": "true",
            "$": "https://api.elsevier.com/content/object/eid/1-s2.0-S0306261923018573-si106.svg?httpAccept=%2A%2F%2A",
            "@multimediatype": "Scalable Vector Graphics file",
            "@type": "ALTIMG",
            "@size": "13874",
            "@ref": "si106",
            "@mimetype": "image/svg+xml"
        },
        {
            "@category": "thumbnail",
            "@_fa": "true",
            "$": "https://api.elsevier.com/content/object/eid/1-s2.0-S0306261923018573-si107.svg?httpAccept=%2A%2F%2A",
            "@multimediatype": "Scalable Vector Graphics file",
            "@type": "ALTIMG",
            "@size": "13443",
            "@ref": "si107",
            "@mimetype": "image/svg+xml"
        },
        {
            "@category": "thumbnail",
            "@_fa": "true",
            "$": "https://api.elsevier.com/content/object/eid/1-s2.0-S0306261923018573-si11.svg?httpAccept=%2A%2F%2A",
            "@multimediatype": "Scalable Vector Graphics file",
            "@type": "ALTIMG",
            "@size": "1200",
            "@ref": "si11",
            "@mimetype": "image/svg+xml"
        },
        {
            "@category": "thumbnail",
            "@_fa": "true",
            "$": "https://api.elsevier.com/content/object/eid/1-s2.0-S0306261923018573-si115.svg?httpAccept=%2A%2F%2A",
            "@multimediatype": "Scalable Vector Graphics file",
            "@type": "ALTIMG",
            "@size": "29304",
            "@ref": "si115",
            "@mimetype": "image/svg+xml"
        },
        {
            "@category": "thumbnail",
            "@_fa": "true",
            "$": "https://api.elsevier.com/content/object/eid/1-s2.0-S0306261923018573-si116.svg?httpAccept=%2A%2F%2A",
            "@multimediatype": "Scalable Vector Graphics file",
            "@type": "ALTIMG",
            "@size": "6112",
            "@ref": "si116",
            "@mimetype": "image/svg+xml"
        },
        {
            "@category": "thumbnail",
            "@_fa": "true",
            "$": "https://api.elsevier.com/content/object/eid/1-s2.0-S0306261923018573-si119.svg?httpAccept=%2A%2F%2A",
            "@multimediatype": "Scalable Vector Graphics file",
            "@type": "ALTIMG",
            "@size": "18955",
            "@ref": "si119",
            "@mimetype": "image/svg+xml"
        },
        {
            "@category": "thumbnail",
            "@_fa": "true",
            "$": "https://api.elsevier.com/content/object/eid/1-s2.0-S0306261923018573-si12.svg?httpAccept=%2A%2F%2A",
            "@multimediatype": "Scalable Vector Graphics file",
            "@type": "ALTIMG",
            "@size": "1286",
            "@ref": "si12",
            "@mimetype": "image/svg+xml"
        },
        {
            "@category": "thumbnail",
            "@_fa": "true",
            "$": "https://api.elsevier.com/content/object/eid/1-s2.0-S0306261923018573-si120.svg?httpAccept=%2A%2F%2A",
            "@multimediatype": "Scalable Vector Graphics file",
            "@type": "ALTIMG",
            "@size": "18225",
            "@ref": "si120",
            "@mimetype": "image/svg+xml"
        },
        {
            "@category": "thumbnail",
            "@_fa": "true",
            "$": "https://api.elsevier.com/content/object/eid/1-s2.0-S0306261923018573-si121.svg?httpAccept=%2A%2F%2A",
            "@multimediatype": "Scalable Vector Graphics file",
            "@type": "ALTIMG",
            "@size": "11194",
            "@ref": "si121",
            "@mimetype": "image/svg+xml"
        },
        {
            "@category": "thumbnail",
            "@_fa": "true",
            "$": "https://api.elsevier.com/content/object/eid/1-s2.0-S0306261923018573-si124.svg?httpAccept=%2A%2F%2A",
            "@multimediatype": "Scalable Vector Graphics file",
            "@type": "ALTIMG",
            "@size": "13070",
            "@ref": "si124",
            "@mimetype": "image/svg+xml"
        },
        {
            "@category": "thumbnail",
            "@_fa": "true",
            "$": "https://api.elsevier.com/content/object/eid/1-s2.0-S0306261923018573-si125.svg?httpAccept=%2A%2F%2A",
            "@multimediatype": "Scalable Vector Graphics file",
            "@type": "ALTIMG",
            "@size": "4535",
            "@ref": "si125",
            "@mimetype": "image/svg+xml"
        },
        {
            "@category": "thumbnail",
            "@_fa": "true",
            "$": "https://api.elsevier.com/content/object/eid/1-s2.0-S0306261923018573-si126.svg?httpAccept=%2A%2F%2A",
            "@multimediatype": "Scalable Vector Graphics file",
            "@type": "ALTIMG",
            "@size": "2993",
            "@ref": "si126",
            "@mimetype": "image/svg+xml"
        },
        {
            "@category": "thumbnail",
            "@_fa": "true",
            "$": "https://api.elsevier.com/content/object/eid/1-s2.0-S0306261923018573-si127.svg?httpAccept=%2A%2F%2A",
            "@multimediatype": "Scalable Vector Graphics file",
            "@type": "ALTIMG",
            "@size": "16410",
            "@ref": "si127",
            "@mimetype": "image/svg+xml"
        },
        {
            "@category": "thumbnail",
            "@_fa": "true",
            "$": "https://api.elsevier.com/content/object/eid/1-s2.0-S0306261923018573-si128.svg?httpAccept=%2A%2F%2A",
            "@multimediatype": "Scalable Vector Graphics file",
            "@type": "ALTIMG",
            "@size": "17467",
            "@ref": "si128",
            "@mimetype": "image/svg+xml"
        },
        {
            "@category": "thumbnail",
            "@_fa": "true",
            "$": "https://api.elsevier.com/content/object/eid/1-s2.0-S0306261923018573-si13.svg?httpAccept=%2A%2F%2A",
            "@multimediatype": "Scalable Vector Graphics file",
            "@type": "ALTIMG",
            "@size": "4670",
            "@ref": "si13",
            "@mimetype": "image/svg+xml"
        },
        {
            "@category": "thumbnail",
            "@_fa": "true",
            "$": "https://api.elsevier.com/content/object/eid/1-s2.0-S0306261923018573-si133.svg?httpAccept=%2A%2F%2A",
            "@multimediatype": "Scalable Vector Graphics file",
            "@type": "ALTIMG",
            "@size": "11812",
            "@ref": "si133",
            "@mimetype": "image/svg+xml"
        },
        {
            "@category": "thumbnail",
            "@_fa": "true",
            "$": "https://api.elsevier.com/content/object/eid/1-s2.0-S0306261923018573-si134.svg?httpAccept=%2A%2F%2A",
            "@multimediatype": "Scalable Vector Graphics file",
            "@type": "ALTIMG",
            "@size": "1252",
            "@ref": "si134",
            "@mimetype": "image/svg+xml"
        },
        {
            "@category": "thumbnail",
            "@_fa": "true",
            "$": "https://api.elsevier.com/content/object/eid/1-s2.0-S0306261923018573-si135.svg?httpAccept=%2A%2F%2A",
            "@multimediatype": "Scalable Vector Graphics file",
            "@type": "ALTIMG",
            "@size": "15403",
            "@ref": "si135",
            "@mimetype": "image/svg+xml"
        },
        {
            "@category": "thumbnail",
            "@_fa": "true",
            "$": "https://api.elsevier.com/content/object/eid/1-s2.0-S0306261923018573-si138.svg?httpAccept=%2A%2F%2A",
            "@multimediatype": "Scalable Vector Graphics file",
            "@type": "ALTIMG",
            "@size": "1518",
            "@ref": "si138",
            "@mimetype": "image/svg+xml"
        },
        {
            "@category": "thumbnail",
            "@_fa": "true",
            "$": "https://api.elsevier.com/content/object/eid/1-s2.0-S0306261923018573-si14.svg?httpAccept=%2A%2F%2A",
            "@multimediatype": "Scalable Vector Graphics file",
            "@type": "ALTIMG",
            "@size": "5221",
            "@ref": "si14",
            "@mimetype": "image/svg+xml"
        },
        {
            "@category": "thumbnail",
            "@_fa": "true",
            "$": "https://api.elsevier.com/content/object/eid/1-s2.0-S0306261923018573-si140.svg?httpAccept=%2A%2F%2A",
            "@multimediatype": "Scalable Vector Graphics file",
            "@type": "ALTIMG",
            "@size": "2574",
            "@ref": "si140",
            "@mimetype": "image/svg+xml"
        },
        {
            "@category": "thumbnail",
            "@_fa": "true",
            "$": "https://api.elsevier.com/content/object/eid/1-s2.0-S0306261923018573-si143.svg?httpAccept=%2A%2F%2A",
            "@multimediatype": "Scalable Vector Graphics file",
            "@type": "ALTIMG",
            "@size": "4550",
            "@ref": "si143",
            "@mimetype": "image/svg+xml"
        },
        {
            "@category": "thumbnail",
            "@_fa": "true",
            "$": "https://api.elsevier.com/content/object/eid/1-s2.0-S0306261923018573-si147.svg?httpAccept=%2A%2F%2A",
            "@multimediatype": "Scalable Vector Graphics file",
            "@type": "ALTIMG",
            "@size": "21484",
            "@ref": "si147",
            "@mimetype": "image/svg+xml"
        },
        {
            "@category": "thumbnail",
            "@_fa": "true",
            "$": "https://api.elsevier.com/content/object/eid/1-s2.0-S0306261923018573-si148.svg?httpAccept=%2A%2F%2A",
            "@multimediatype": "Scalable Vector Graphics file",
            "@type": "ALTIMG",
            "@size": "6204",
            "@ref": "si148",
            "@mimetype": "image/svg+xml"
        },
        {
            "@category": "thumbnail",
            "@_fa": "true",
            "$": "https://api.elsevier.com/content/object/eid/1-s2.0-S0306261923018573-si15.svg?httpAccept=%2A%2F%2A",
            "@multimediatype": "Scalable Vector Graphics file",
            "@type": "ALTIMG",
            "@size": "3130",
            "@ref": "si15",
            "@mimetype": "image/svg+xml"
        },
        {
            "@category": "thumbnail",
            "@_fa": "true",
            "$": "https://api.elsevier.com/content/object/eid/1-s2.0-S0306261923018573-si150.svg?httpAccept=%2A%2F%2A",
            "@multimediatype": "Scalable Vector Graphics file",
            "@type": "ALTIMG",
            "@size": "3076",
            "@ref": "si150",
            "@mimetype": "image/svg+xml"
        },
        {
            "@category": "thumbnail",
            "@_fa": "true",
            "$": "https://api.elsevier.com/content/object/eid/1-s2.0-S0306261923018573-si151.svg?httpAccept=%2A%2F%2A",
            "@multimediatype": "Scalable Vector Graphics file",
            "@type": "ALTIMG",
            "@size": "3649",
            "@ref": "si151",
            "@mimetype": "image/svg+xml"
        },
        {
            "@category": "thumbnail",
            "@_fa": "true",
            "$": "https://api.elsevier.com/content/object/eid/1-s2.0-S0306261923018573-si154.svg?httpAccept=%2A%2F%2A",
            "@multimediatype": "Scalable Vector Graphics file",
            "@type": "ALTIMG",
            "@size": "15027",
            "@ref": "si154",
            "@mimetype": "image/svg+xml"
        },
        {
            "@category": "thumbnail",
            "@_fa": "true",
            "$": "https://api.elsevier.com/content/object/eid/1-s2.0-S0306261923018573-si155.svg?httpAccept=%2A%2F%2A",
            "@multimediatype": "Scalable Vector Graphics file",
            "@type": "ALTIMG",
            "@size": "9431",
            "@ref": "si155",
            "@mimetype": "image/svg+xml"
        },
        {
            "@category": "thumbnail",
            "@_fa": "true",
            "$": "https://api.elsevier.com/content/object/eid/1-s2.0-S0306261923018573-si157.svg?httpAccept=%2A%2F%2A",
            "@multimediatype": "Scalable Vector Graphics file",
            "@type": "ALTIMG",
            "@size": "10183",
            "@ref": "si157",
            "@mimetype": "image/svg+xml"
        },
        {
            "@category": "thumbnail",
            "@_fa": "true",
            "$": "https://api.elsevier.com/content/object/eid/1-s2.0-S0306261923018573-si158.svg?httpAccept=%2A%2F%2A",
            "@multimediatype": "Scalable Vector Graphics file",
            "@type": "ALTIMG",
            "@size": "26194",
            "@ref": "si158",
            "@mimetype": "image/svg+xml"
        },
        {
            "@category": "thumbnail",
            "@_fa": "true",
            "$": "https://api.elsevier.com/content/object/eid/1-s2.0-S0306261923018573-si160.svg?httpAccept=%2A%2F%2A",
            "@multimediatype": "Scalable Vector Graphics file",
            "@type": "ALTIMG",
            "@size": "2227",
            "@ref": "si160",
            "@mimetype": "image/svg+xml"
        },
        {
            "@category": "thumbnail",
            "@_fa": "true",
            "$": "https://api.elsevier.com/content/object/eid/1-s2.0-S0306261923018573-si161.svg?httpAccept=%2A%2F%2A",
            "@multimediatype": "Scalable Vector Graphics file",
            "@type": "ALTIMG",
            "@size": "1303",
            "@ref": "si161",
            "@mimetype": "image/svg+xml"
        },
        {
            "@category": "thumbnail",
            "@_fa": "true",
            "$": "https://api.elsevier.com/content/object/eid/1-s2.0-S0306261923018573-si162.svg?httpAccept=%2A%2F%2A",
            "@multimediatype": "Scalable Vector Graphics file",
            "@type": "ALTIMG",
            "@size": "1615",
            "@ref": "si162",
            "@mimetype": "image/svg+xml"
        },
        {
            "@category": "thumbnail",
            "@_fa": "true",
            "$": "https://api.elsevier.com/content/object/eid/1-s2.0-S0306261923018573-si163.svg?httpAccept=%2A%2F%2A",
            "@multimediatype": "Scalable Vector Graphics file",
            "@type": "ALTIMG",
            "@size": "2569",
            "@ref": "si163",
            "@mimetype": "image/svg+xml"
        },
        {
            "@category": "thumbnail",
            "@_fa": "true",
            "$": "https://api.elsevier.com/content/object/eid/1-s2.0-S0306261923018573-si164.svg?httpAccept=%2A%2F%2A",
            "@multimediatype": "Scalable Vector Graphics file",
            "@type": "ALTIMG",
            "@size": "5763",
            "@ref": "si164",
            "@mimetype": "image/svg+xml"
        },
        {
            "@category": "thumbnail",
            "@_fa": "true",
            "$": "https://api.elsevier.com/content/object/eid/1-s2.0-S0306261923018573-si166.svg?httpAccept=%2A%2F%2A",
            "@multimediatype": "Scalable Vector Graphics file",
            "@type": "ALTIMG",
            "@size": "1021",
            "@ref": "si166",
            "@mimetype": "image/svg+xml"
        },
        {
            "@category": "thumbnail",
            "@_fa": "true",
            "$": "https://api.elsevier.com/content/object/eid/1-s2.0-S0306261923018573-si167.svg?httpAccept=%2A%2F%2A",
            "@multimediatype": "Scalable Vector Graphics file",
            "@type": "ALTIMG",
            "@size": "6342",
            "@ref": "si167",
            "@mimetype": "image/svg+xml"
        },
        {
            "@category": "thumbnail",
            "@_fa": "true",
            "$": "https://api.elsevier.com/content/object/eid/1-s2.0-S0306261923018573-si168.svg?httpAccept=%2A%2F%2A",
            "@multimediatype": "Scalable Vector Graphics file",
            "@type": "ALTIMG",
            "@size": "1231",
            "@ref": "si168",
            "@mimetype": "image/svg+xml"
        },
        {
            "@category": "thumbnail",
            "@_fa": "true",
            "$": "https://api.elsevier.com/content/object/eid/1-s2.0-S0306261923018573-si169.svg?httpAccept=%2A%2F%2A",
            "@multimediatype": "Scalable Vector Graphics file",
            "@type": "ALTIMG",
            "@size": "1783",
            "@ref": "si169",
            "@mimetype": "image/svg+xml"
        },
        {
            "@category": "thumbnail",
            "@_fa": "true",
            "$": "https://api.elsevier.com/content/object/eid/1-s2.0-S0306261923018573-si17.svg?httpAccept=%2A%2F%2A",
            "@multimediatype": "Scalable Vector Graphics file",
            "@type": "ALTIMG",
            "@size": "3592",
            "@ref": "si17",
            "@mimetype": "image/svg+xml"
        },
        {
            "@category": "thumbnail",
            "@_fa": "true",
            "$": "https://api.elsevier.com/content/object/eid/1-s2.0-S0306261923018573-si170.svg?httpAccept=%2A%2F%2A",
            "@multimediatype": "Scalable Vector Graphics file",
            "@type": "ALTIMG",
            "@size": "3390",
            "@ref": "si170",
            "@mimetype": "image/svg+xml"
        },
        {
            "@category": "thumbnail",
            "@_fa": "true",
            "$": "https://api.elsevier.com/content/object/eid/1-s2.0-S0306261923018573-si171.svg?httpAccept=%2A%2F%2A",
            "@multimediatype": "Scalable Vector Graphics file",
            "@type": "ALTIMG",
            "@size": "3287",
            "@ref": "si171",
            "@mimetype": "image/svg+xml"
        },
        {
            "@category": "thumbnail",
            "@_fa": "true",
            "$": "https://api.elsevier.com/content/object/eid/1-s2.0-S0306261923018573-si172.svg?httpAccept=%2A%2F%2A",
            "@multimediatype": "Scalable Vector Graphics file",
            "@type": "ALTIMG",
            "@size": "4016",
            "@ref": "si172",
            "@mimetype": "image/svg+xml"
        },
        {
            "@category": "thumbnail",
            "@_fa": "true",
            "$": "https://api.elsevier.com/content/object/eid/1-s2.0-S0306261923018573-si176.svg?httpAccept=%2A%2F%2A",
            "@multimediatype": "Scalable Vector Graphics file",
            "@type": "ALTIMG",
            "@size": "2233",
            "@ref": "si176",
            "@mimetype": "image/svg+xml"
        },
        {
            "@category": "thumbnail",
            "@_fa": "true",
            "$": "https://api.elsevier.com/content/object/eid/1-s2.0-S0306261923018573-si177.svg?httpAccept=%2A%2F%2A",
            "@multimediatype": "Scalable Vector Graphics file",
            "@type": "ALTIMG",
            "@size": "6122",
            "@ref": "si177",
            "@mimetype": "image/svg+xml"
        },
        {
            "@category": "thumbnail",
            "@_fa": "true",
            "$": "https://api.elsevier.com/content/object/eid/1-s2.0-S0306261923018573-si178.svg?httpAccept=%2A%2F%2A",
            "@multimediatype": "Scalable Vector Graphics file",
            "@type": "ALTIMG",
            "@size": "4688",
            "@ref": "si178",
            "@mimetype": "image/svg+xml"
        },
        {
            "@category": "thumbnail",
            "@_fa": "true",
            "$": "https://api.elsevier.com/content/object/eid/1-s2.0-S0306261923018573-si179.svg?httpAccept=%2A%2F%2A",
            "@multimediatype": "Scalable Vector Graphics file",
            "@type": "ALTIMG",
            "@size": "6516",
            "@ref": "si179",
            "@mimetype": "image/svg+xml"
        },
        {
            "@category": "thumbnail",
            "@_fa": "true",
            "$": "https://api.elsevier.com/content/object/eid/1-s2.0-S0306261923018573-si180.svg?httpAccept=%2A%2F%2A",
            "@multimediatype": "Scalable Vector Graphics file",
            "@type": "ALTIMG",
            "@size": "4038",
            "@ref": "si180",
            "@mimetype": "image/svg+xml"
        },
        {
            "@category": "thumbnail",
            "@_fa": "true",
            "$": "https://api.elsevier.com/content/object/eid/1-s2.0-S0306261923018573-si181.svg?httpAccept=%2A%2F%2A",
            "@multimediatype": "Scalable Vector Graphics file",
            "@type": "ALTIMG",
            "@size": "2773",
            "@ref": "si181",
            "@mimetype": "image/svg+xml"
        },
        {
            "@category": "thumbnail",
            "@_fa": "true",
            "$": "https://api.elsevier.com/content/object/eid/1-s2.0-S0306261923018573-si182.svg?httpAccept=%2A%2F%2A",
            "@multimediatype": "Scalable Vector Graphics file",
            "@type": "ALTIMG",
            "@size": "2494",
            "@ref": "si182",
            "@mimetype": "image/svg+xml"
        },
        {
            "@category": "thumbnail",
            "@_fa": "true",
            "$": "https://api.elsevier.com/content/object/eid/1-s2.0-S0306261923018573-si183.svg?httpAccept=%2A%2F%2A",
            "@multimediatype": "Scalable Vector Graphics file",
            "@type": "ALTIMG",
            "@size": "1266",
            "@ref": "si183",
            "@mimetype": "image/svg+xml"
        },
        {
            "@category": "thumbnail",
            "@_fa": "true",
            "$": "https://api.elsevier.com/content/object/eid/1-s2.0-S0306261923018573-si184.svg?httpAccept=%2A%2F%2A",
            "@multimediatype": "Scalable Vector Graphics file",
            "@type": "ALTIMG",
            "@size": "3859",
            "@ref": "si184",
            "@mimetype": "image/svg+xml"
        },
        {
            "@category": "thumbnail",
            "@_fa": "true",
            "$": "https://api.elsevier.com/content/object/eid/1-s2.0-S0306261923018573-si187.svg?httpAccept=%2A%2F%2A",
            "@multimediatype": "Scalable Vector Graphics file",
            "@type": "ALTIMG",
            "@size": "7041",
            "@ref": "si187",
            "@mimetype": "image/svg+xml"
        },
        {
            "@category": "thumbnail",
            "@_fa": "true",
            "$": "https://api.elsevier.com/content/object/eid/1-s2.0-S0306261923018573-si188.svg?httpAccept=%2A%2F%2A",
            "@multimediatype": "Scalable Vector Graphics file",
            "@type": "ALTIMG",
            "@size": "6808",
            "@ref": "si188",
            "@mimetype": "image/svg+xml"
        },
        {
            "@category": "thumbnail",
            "@_fa": "true",
            "$": "https://api.elsevier.com/content/object/eid/1-s2.0-S0306261923018573-si189.svg?httpAccept=%2A%2F%2A",
            "@multimediatype": "Scalable Vector Graphics file",
            "@type": "ALTIMG",
            "@size": "3624",
            "@ref": "si189",
            "@mimetype": "image/svg+xml"
        },
        {
            "@category": "thumbnail",
            "@_fa": "true",
            "$": "https://api.elsevier.com/content/object/eid/1-s2.0-S0306261923018573-si19.svg?httpAccept=%2A%2F%2A",
            "@multimediatype": "Scalable Vector Graphics file",
            "@type": "ALTIMG",
            "@size": "2050",
            "@ref": "si19",
            "@mimetype": "image/svg+xml"
        },
        {
            "@category": "thumbnail",
            "@_fa": "true",
            "$": "https://api.elsevier.com/content/object/eid/1-s2.0-S0306261923018573-si190.svg?httpAccept=%2A%2F%2A",
            "@multimediatype": "Scalable Vector Graphics file",
            "@type": "ALTIMG",
            "@size": "3694",
            "@ref": "si190",
            "@mimetype": "image/svg+xml"
        },
        {
            "@category": "thumbnail",
            "@_fa": "true",
            "$": "https://api.elsevier.com/content/object/eid/1-s2.0-S0306261923018573-si191.svg?httpAccept=%2A%2F%2A",
            "@multimediatype": "Scalable Vector Graphics file",
            "@type": "ALTIMG",
            "@size": "4140",
            "@ref": "si191",
            "@mimetype": "image/svg+xml"
        },
        {
            "@category": "thumbnail",
            "@_fa": "true",
            "$": "https://api.elsevier.com/content/object/eid/1-s2.0-S0306261923018573-si192.svg?httpAccept=%2A%2F%2A",
            "@multimediatype": "Scalable Vector Graphics file",
            "@type": "ALTIMG",
            "@size": "7526",
            "@ref": "si192",
            "@mimetype": "image/svg+xml"
        },
        {
            "@category": "thumbnail",
            "@_fa": "true",
            "$": "https://api.elsevier.com/content/object/eid/1-s2.0-S0306261923018573-si193.svg?httpAccept=%2A%2F%2A",
            "@multimediatype": "Scalable Vector Graphics file",
            "@type": "ALTIMG",
            "@size": "7293",
            "@ref": "si193",
            "@mimetype": "image/svg+xml"
        },
        {
            "@category": "thumbnail",
            "@_fa": "true",
            "$": "https://api.elsevier.com/content/object/eid/1-s2.0-S0306261923018573-si194.svg?httpAccept=%2A%2F%2A",
            "@multimediatype": "Scalable Vector Graphics file",
            "@type": "ALTIMG",
            "@size": "7396",
            "@ref": "si194",
            "@mimetype": "image/svg+xml"
        },
        {
            "@category": "thumbnail",
            "@_fa": "true",
            "$": "https://api.elsevier.com/content/object/eid/1-s2.0-S0306261923018573-si195.svg?httpAccept=%2A%2F%2A",
            "@multimediatype": "Scalable Vector Graphics file",
            "@type": "ALTIMG",
            "@size": "1986",
            "@ref": "si195",
            "@mimetype": "image/svg+xml"
        },
        {
            "@category": "thumbnail",
            "@_fa": "true",
            "$": "https://api.elsevier.com/content/object/eid/1-s2.0-S0306261923018573-si196.svg?httpAccept=%2A%2F%2A",
            "@multimediatype": "Scalable Vector Graphics file",
            "@type": "ALTIMG",
            "@size": "2544",
            "@ref": "si196",
            "@mimetype": "image/svg+xml"
        },
        {
            "@category": "thumbnail",
            "@_fa": "true",
            "$": "https://api.elsevier.com/content/object/eid/1-s2.0-S0306261923018573-si197.svg?httpAccept=%2A%2F%2A",
            "@multimediatype": "Scalable Vector Graphics file",
            "@type": "ALTIMG",
            "@size": "904",
            "@ref": "si197",
            "@mimetype": "image/svg+xml"
        },
        {
            "@category": "thumbnail",
            "@_fa": "true",
            "$": "https://api.elsevier.com/content/object/eid/1-s2.0-S0306261923018573-si2.svg?httpAccept=%2A%2F%2A",
            "@multimediatype": "Scalable Vector Graphics file",
            "@type": "ALTIMG",
            "@size": "2768",
            "@ref": "si2",
            "@mimetype": "image/svg+xml"
        },
        {
            "@category": "thumbnail",
            "@_fa": "true",
            "$": "https://api.elsevier.com/content/object/eid/1-s2.0-S0306261923018573-si20.svg?httpAccept=%2A%2F%2A",
            "@multimediatype": "Scalable Vector Graphics file",
            "@type": "ALTIMG",
            "@size": "1881",
            "@ref": "si20",
            "@mimetype": "image/svg+xml"
        },
        {
            "@category": "thumbnail",
            "@_fa": "true",
            "$": "https://api.elsevier.com/content/object/eid/1-s2.0-S0306261923018573-si202.svg?httpAccept=%2A%2F%2A",
            "@multimediatype": "Scalable Vector Graphics file",
            "@type": "ALTIMG",
            "@size": "4245",
            "@ref": "si202",
            "@mimetype": "image/svg+xml"
        },
        {
            "@category": "thumbnail",
            "@_fa": "true",
            "$": "https://api.elsevier.com/content/object/eid/1-s2.0-S0306261923018573-si204.svg?httpAccept=%2A%2F%2A",
            "@multimediatype": "Scalable Vector Graphics file",
            "@type": "ALTIMG",
            "@size": "43078",
            "@ref": "si204",
            "@mimetype": "image/svg+xml"
        },
        {
            "@category": "thumbnail",
            "@_fa": "true",
            "$": "https://api.elsevier.com/content/object/eid/1-s2.0-S0306261923018573-si208.svg?httpAccept=%2A%2F%2A",
            "@multimediatype": "Scalable Vector Graphics file",
            "@type": "ALTIMG",
            "@size": "1093",
            "@ref": "si208",
            "@mimetype": "image/svg+xml"
        },
        {
            "@category": "thumbnail",
            "@_fa": "true",
            "$": "https://api.elsevier.com/content/object/eid/1-s2.0-S0306261923018573-si209.svg?httpAccept=%2A%2F%2A",
            "@multimediatype": "Scalable Vector Graphics file",
            "@type": "ALTIMG",
            "@size": "3648",
            "@ref": "si209",
            "@mimetype": "image/svg+xml"
        },
        {
            "@category": "thumbnail",
            "@_fa": "true",
            "$": "https://api.elsevier.com/content/object/eid/1-s2.0-S0306261923018573-si21.svg?httpAccept=%2A%2F%2A",
            "@multimediatype": "Scalable Vector Graphics file",
            "@type": "ALTIMG",
            "@size": "2512",
            "@ref": "si21",
            "@mimetype": "image/svg+xml"
        },
        {
            "@category": "thumbnail",
            "@_fa": "true",
            "$": "https://api.elsevier.com/content/object/eid/1-s2.0-S0306261923018573-si213.svg?httpAccept=%2A%2F%2A",
            "@multimediatype": "Scalable Vector Graphics file",
            "@type": "ALTIMG",
            "@size": "1455",
            "@ref": "si213",
            "@mimetype": "image/svg+xml"
        },
        {
            "@category": "thumbnail",
            "@_fa": "true",
            "$": "https://api.elsevier.com/content/object/eid/1-s2.0-S0306261923018573-si214.svg?httpAccept=%2A%2F%2A",
            "@multimediatype": "Scalable Vector Graphics file",
            "@type": "ALTIMG",
            "@size": "2137",
            "@ref": "si214",
            "@mimetype": "image/svg+xml"
        },
        {
            "@category": "thumbnail",
            "@_fa": "true",
            "$": "https://api.elsevier.com/content/object/eid/1-s2.0-S0306261923018573-si22.svg?httpAccept=%2A%2F%2A",
            "@multimediatype": "Scalable Vector Graphics file",
            "@type": "ALTIMG",
            "@size": "2340",
            "@ref": "si22",
            "@mimetype": "image/svg+xml"
        },
        {
            "@category": "thumbnail",
            "@_fa": "true",
            "$": "https://api.elsevier.com/content/object/eid/1-s2.0-S0306261923018573-si220.svg?httpAccept=%2A%2F%2A",
            "@multimediatype": "Scalable Vector Graphics file",
            "@type": "ALTIMG",
            "@size": "6796",
            "@ref": "si220",
            "@mimetype": "image/svg+xml"
        },
        {
            "@category": "thumbnail",
            "@_fa": "true",
            "$": "https://api.elsevier.com/content/object/eid/1-s2.0-S0306261923018573-si221.svg?httpAccept=%2A%2F%2A",
            "@multimediatype": "Scalable Vector Graphics file",
            "@type": "ALTIMG",
            "@size": "5290",
            "@ref": "si221",
            "@mimetype": "image/svg+xml"
        },
        {
            "@category": "thumbnail",
            "@_fa": "true",
            "$": "https://api.elsevier.com/content/object/eid/1-s2.0-S0306261923018573-si222.svg?httpAccept=%2A%2F%2A",
            "@multimediatype": "Scalable Vector Graphics file",
            "@type": "ALTIMG",
            "@size": "4510",
            "@ref": "si222",
            "@mimetype": "image/svg+xml"
        },
        {
            "@category": "thumbnail",
            "@_fa": "true",
            "$": "https://api.elsevier.com/content/object/eid/1-s2.0-S0306261923018573-si23.svg?httpAccept=%2A%2F%2A",
            "@multimediatype": "Scalable Vector Graphics file",
            "@type": "ALTIMG",
            "@size": "3047",
            "@ref": "si23",
            "@mimetype": "image/svg+xml"
        },
        {
            "@category": "thumbnail",
            "@_fa": "true",
            "$": "https://api.elsevier.com/content/object/eid/1-s2.0-S0306261923018573-si232.svg?httpAccept=%2A%2F%2A",
            "@multimediatype": "Scalable Vector Graphics file",
            "@type": "ALTIMG",
            "@size": "6351",
            "@ref": "si232",
            "@mimetype": "image/svg+xml"
        },
        {
            "@category": "thumbnail",
            "@_fa": "true",
            "$": "https://api.elsevier.com/content/object/eid/1-s2.0-S0306261923018573-si233.svg?httpAccept=%2A%2F%2A",
            "@multimediatype": "Scalable Vector Graphics file",
            "@type": "ALTIMG",
            "@size": "6067",
            "@ref": "si233",
            "@mimetype": "image/svg+xml"
        },
        {
            "@category": "thumbnail",
            "@_fa": "true",
            "$": "https://api.elsevier.com/content/object/eid/1-s2.0-S0306261923018573-si24.svg?httpAccept=%2A%2F%2A",
            "@multimediatype": "Scalable Vector Graphics file",
            "@type": "ALTIMG",
            "@size": "26473",
            "@ref": "si24",
            "@mimetype": "image/svg+xml"
        },
        {
            "@category": "thumbnail",
            "@_fa": "true",
            "$": "https://api.elsevier.com/content/object/eid/1-s2.0-S0306261923018573-si25.svg?httpAccept=%2A%2F%2A",
            "@multimediatype": "Scalable Vector Graphics file",
            "@type": "ALTIMG",
            "@size": "6745",
            "@ref": "si25",
            "@mimetype": "image/svg+xml"
        },
        {
            "@category": "thumbnail",
            "@_fa": "true",
            "$": "https://api.elsevier.com/content/object/eid/1-s2.0-S0306261923018573-si28.svg?httpAccept=%2A%2F%2A",
            "@multimediatype": "Scalable Vector Graphics file",
            "@type": "ALTIMG",
            "@size": "3403",
            "@ref": "si28",
            "@mimetype": "image/svg+xml"
        },
        {
            "@category": "thumbnail",
            "@_fa": "true",
            "$": "https://api.elsevier.com/content/object/eid/1-s2.0-S0306261923018573-si30.svg?httpAccept=%2A%2F%2A",
            "@multimediatype": "Scalable Vector Graphics file",
            "@type": "ALTIMG",
            "@size": "2887",
            "@ref": "si30",
            "@mimetype": "image/svg+xml"
        },
        {
            "@category": "thumbnail",
            "@_fa": "true",
            "$": "https://api.elsevier.com/content/object/eid/1-s2.0-S0306261923018573-si32.svg?httpAccept=%2A%2F%2A",
            "@multimediatype": "Scalable Vector Graphics file",
            "@type": "ALTIMG",
            "@size": "13900",
            "@ref": "si32",
            "@mimetype": "image/svg+xml"
        },
        {
            "@category": "thumbnail",
            "@_fa": "true",
            "$": "https://api.elsevier.com/content/object/eid/1-s2.0-S0306261923018573-si33.svg?httpAccept=%2A%2F%2A",
            "@multimediatype": "Scalable Vector Graphics file",
            "@type": "ALTIMG",
            "@size": "2948",
            "@ref": "si33",
            "@mimetype": "image/svg+xml"
        },
        {
            "@category": "thumbnail",
            "@_fa": "true",
            "$": "https://api.elsevier.com/content/object/eid/1-s2.0-S0306261923018573-si34.svg?httpAccept=%2A%2F%2A",
            "@multimediatype": "Scalable Vector Graphics file",
            "@type": "ALTIMG",
            "@size": "16053",
            "@ref": "si34",
            "@mimetype": "image/svg+xml"
        },
        {
            "@category": "thumbnail",
            "@_fa": "true",
            "$": "https://api.elsevier.com/content/object/eid/1-s2.0-S0306261923018573-si36.svg?httpAccept=%2A%2F%2A",
            "@multimediatype": "Scalable Vector Graphics file",
            "@type": "ALTIMG",
            "@size": "4017",
            "@ref": "si36",
            "@mimetype": "image/svg+xml"
        },
        {
            "@category": "thumbnail",
            "@_fa": "true",
            "$": "https://api.elsevier.com/content/object/eid/1-s2.0-S0306261923018573-si37.svg?httpAccept=%2A%2F%2A",
            "@multimediatype": "Scalable Vector Graphics file",
            "@type": "ALTIMG",
            "@size": "3355",
            "@ref": "si37",
            "@mimetype": "image/svg+xml"
        },
        {
            "@category": "thumbnail",
            "@_fa": "true",
            "$": "https://api.elsevier.com/content/object/eid/1-s2.0-S0306261923018573-si38.svg?httpAccept=%2A%2F%2A",
            "@multimediatype": "Scalable Vector Graphics file",
            "@type": "ALTIMG",
            "@size": "8969",
            "@ref": "si38",
            "@mimetype": "image/svg+xml"
        },
        {
            "@category": "thumbnail",
            "@_fa": "true",
            "$": "https://api.elsevier.com/content/object/eid/1-s2.0-S0306261923018573-si4.svg?httpAccept=%2A%2F%2A",
            "@multimediatype": "Scalable Vector Graphics file",
            "@type": "ALTIMG",
            "@size": "2534",
            "@ref": "si4",
            "@mimetype": "image/svg+xml"
        },
        {
            "@category": "thumbnail",
            "@_fa": "true",
            "$": "https://api.elsevier.com/content/object/eid/1-s2.0-S0306261923018573-si40.svg?httpAccept=%2A%2F%2A",
            "@multimediatype": "Scalable Vector Graphics file",
            "@type": "ALTIMG",
            "@size": "9799",
            "@ref": "si40",
            "@mimetype": "image/svg+xml"
        },
        {
            "@category": "thumbnail",
            "@_fa": "true",
            "$": "https://api.elsevier.com/content/object/eid/1-s2.0-S0306261923018573-si42.svg?httpAccept=%2A%2F%2A",
            "@multimediatype": "Scalable Vector Graphics file",
            "@type": "ALTIMG",
            "@size": "1174",
            "@ref": "si42",
            "@mimetype": "image/svg+xml"
        },
        {
            "@category": "thumbnail",
            "@_fa": "true",
            "$": "https://api.elsevier.com/content/object/eid/1-s2.0-S0306261923018573-si43.svg?httpAccept=%2A%2F%2A",
            "@multimediatype": "Scalable Vector Graphics file",
            "@type": "ALTIMG",
            "@size": "14341",
            "@ref": "si43",
            "@mimetype": "image/svg+xml"
        },
        {
            "@category": "thumbnail",
            "@_fa": "true",
            "$": "https://api.elsevier.com/content/object/eid/1-s2.0-S0306261923018573-si46.svg?httpAccept=%2A%2F%2A",
            "@multimediatype": "Scalable Vector Graphics file",
            "@type": "ALTIMG",
            "@size": "18664",
            "@ref": "si46",
            "@mimetype": "image/svg+xml"
        },
        {
            "@category": "thumbnail",
            "@_fa": "true",
            "$": "https://api.elsevier.com/content/object/eid/1-s2.0-S0306261923018573-si47.svg?httpAccept=%2A%2F%2A",
            "@multimediatype": "Scalable Vector Graphics file",
            "@type": "ALTIMG",
            "@size": "1128",
            "@ref": "si47",
            "@mimetype": "image/svg+xml"
        },
        {
            "@category": "thumbnail",
            "@_fa": "true",
            "$": "https://api.elsevier.com/content/object/eid/1-s2.0-S0306261923018573-si50.svg?httpAccept=%2A%2F%2A",
            "@multimediatype": "Scalable Vector Graphics file",
            "@type": "ALTIMG",
            "@size": "4579",
            "@ref": "si50",
            "@mimetype": "image/svg+xml"
        },
        {
            "@category": "thumbnail",
            "@_fa": "true",
            "$": "https://api.elsevier.com/content/object/eid/1-s2.0-S0306261923018573-si51.svg?httpAccept=%2A%2F%2A",
            "@multimediatype": "Scalable Vector Graphics file",
            "@type": "ALTIMG",
            "@size": "3508",
            "@ref": "si51",
            "@mimetype": "image/svg+xml"
        },
        {
            "@category": "thumbnail",
            "@_fa": "true",
            "$": "https://api.elsevier.com/content/object/eid/1-s2.0-S0306261923018573-si52.svg?httpAccept=%2A%2F%2A",
            "@multimediatype": "Scalable Vector Graphics file",
            "@type": "ALTIMG",
            "@size": "5680",
            "@ref": "si52",
            "@mimetype": "image/svg+xml"
        },
        {
            "@category": "thumbnail",
            "@_fa": "true",
            "$": "https://api.elsevier.com/content/object/eid/1-s2.0-S0306261923018573-si53.svg?httpAccept=%2A%2F%2A",
            "@multimediatype": "Scalable Vector Graphics file",
            "@type": "ALTIMG",
            "@size": "1230",
            "@ref": "si53",
            "@mimetype": "image/svg+xml"
        },
        {
            "@category": "thumbnail",
            "@_fa": "true",
            "$": "https://api.elsevier.com/content/object/eid/1-s2.0-S0306261923018573-si55.svg?httpAccept=%2A%2F%2A",
            "@multimediatype": "Scalable Vector Graphics file",
            "@type": "ALTIMG",
            "@size": "2583",
            "@ref": "si55",
            "@mimetype": "image/svg+xml"
        },
        {
            "@category": "thumbnail",
            "@_fa": "true",
            "$": "https://api.elsevier.com/content/object/eid/1-s2.0-S0306261923018573-si6.svg?httpAccept=%2A%2F%2A",
            "@multimediatype": "Scalable Vector Graphics file",
            "@type": "ALTIMG",
            "@size": "4052",
            "@ref": "si6",
            "@mimetype": "image/svg+xml"
        },
        {
            "@category": "thumbnail",
            "@_fa": "true",
            "$": "https://api.elsevier.com/content/object/eid/1-s2.0-S0306261923018573-si61.svg?httpAccept=%2A%2F%2A",
            "@multimediatype": "Scalable Vector Graphics file",
            "@type": "ALTIMG",
            "@size": "20466",
            "@ref": "si61",
            "@mimetype": "image/svg+xml"
        },
        {
            "@category": "thumbnail",
            "@_fa": "true",
            "$": "https://api.elsevier.com/content/object/eid/1-s2.0-S0306261923018573-si62.svg?httpAccept=%2A%2F%2A",
            "@multimediatype": "Scalable Vector Graphics file",
            "@type": "ALTIMG",
            "@size": "10935",
            "@ref": "si62",
            "@mimetype": "image/svg+xml"
        },
        {
            "@category": "thumbnail",
            "@_fa": "true",
            "$": "https://api.elsevier.com/content/object/eid/1-s2.0-S0306261923018573-si63.svg?httpAccept=%2A%2F%2A",
            "@multimediatype": "Scalable Vector Graphics file",
            "@type": "ALTIMG",
            "@size": "41395",
            "@ref": "si63",
            "@mimetype": "image/svg+xml"
        },
        {
            "@category": "thumbnail",
            "@_fa": "true",
            "$": "https://api.elsevier.com/content/object/eid/1-s2.0-S0306261923018573-si69.svg?httpAccept=%2A%2F%2A",
            "@multimediatype": "Scalable Vector Graphics file",
            "@type": "ALTIMG",
            "@size": "18714",
            "@ref": "si69",
            "@mimetype": "image/svg+xml"
        },
        {
            "@category": "thumbnail",
            "@_fa": "true",
            "$": "https://api.elsevier.com/content/object/eid/1-s2.0-S0306261923018573-si7.svg?httpAccept=%2A%2F%2A",
            "@multimediatype": "Scalable Vector Graphics file",
            "@type": "ALTIMG",
            "@size": "15887",
            "@ref": "si7",
            "@mimetype": "image/svg+xml"
        },
        {
            "@category": "thumbnail",
            "@_fa": "true",
            "$": "https://api.elsevier.com/content/object/eid/1-s2.0-S0306261923018573-si71.svg?httpAccept=%2A%2F%2A",
            "@multimediatype": "Scalable Vector Graphics file",
            "@type": "ALTIMG",
            "@size": "31801",
            "@ref": "si71",
            "@mimetype": "image/svg+xml"
        },
        {
            "@category": "thumbnail",
            "@_fa": "true",
            "$": "https://api.elsevier.com/content/object/eid/1-s2.0-S0306261923018573-si72.svg?httpAccept=%2A%2F%2A",
            "@multimediatype": "Scalable Vector Graphics file",
            "@type": "ALTIMG",
            "@size": "15581",
            "@ref": "si72",
            "@mimetype": "image/svg+xml"
        },
        {
            "@category": "thumbnail",
            "@_fa": "true",
            "$": "https://api.elsevier.com/content/object/eid/1-s2.0-S0306261923018573-si73.svg?httpAccept=%2A%2F%2A",
            "@multimediatype": "Scalable Vector Graphics file",
            "@type": "ALTIMG",
            "@size": "3224",
            "@ref": "si73",
            "@mimetype": "image/svg+xml"
        },
        {
            "@category": "thumbnail",
            "@_fa": "true",
            "$": "https://api.elsevier.com/content/object/eid/1-s2.0-S0306261923018573-si80.svg?httpAccept=%2A%2F%2A",
            "@multimediatype": "Scalable Vector Graphics file",
            "@type": "ALTIMG",
            "@size": "9781",
            "@ref": "si80",
            "@mimetype": "image/svg+xml"
        },
        {
            "@category": "thumbnail",
            "@_fa": "true",
            "$": "https://api.elsevier.com/content/object/eid/1-s2.0-S0306261923018573-si81.svg?httpAccept=%2A%2F%2A",
            "@multimediatype": "Scalable Vector Graphics file",
            "@type": "ALTIMG",
            "@size": "10556",
            "@ref": "si81",
            "@mimetype": "image/svg+xml"
        },
        {
            "@category": "thumbnail",
            "@_fa": "true",
            "$": "https://api.elsevier.com/content/object/eid/1-s2.0-S0306261923018573-si83.svg?httpAccept=%2A%2F%2A",
            "@multimediatype": "Scalable Vector Graphics file",
            "@type": "ALTIMG",
            "@size": "8117",
            "@ref": "si83",
            "@mimetype": "image/svg+xml"
        },
        {
            "@category": "thumbnail",
            "@_fa": "true",
            "$": "https://api.elsevier.com/content/object/eid/1-s2.0-S0306261923018573-si84.svg?httpAccept=%2A%2F%2A",
            "@multimediatype": "Scalable Vector Graphics file",
            "@type": "ALTIMG",
            "@size": "2326",
            "@ref": "si84",
            "@mimetype": "image/svg+xml"
        },
        {
            "@category": "thumbnail",
            "@_fa": "true",
            "$": "https://api.elsevier.com/content/object/eid/1-s2.0-S0306261923018573-si85.svg?httpAccept=%2A%2F%2A",
            "@multimediatype": "Scalable Vector Graphics file",
            "@type": "ALTIMG",
            "@size": "4559",
            "@ref": "si85",
            "@mimetype": "image/svg+xml"
        },
        {
            "@category": "thumbnail",
            "@_fa": "true",
            "$": "https://api.elsevier.com/content/object/eid/1-s2.0-S0306261923018573-si87.svg?httpAccept=%2A%2F%2A",
            "@multimediatype": "Scalable Vector Graphics file",
            "@type": "ALTIMG",
            "@size": "8547",
            "@ref": "si87",
            "@mimetype": "image/svg+xml"
        },
        {
            "@category": "thumbnail",
            "@_fa": "true",
            "$": "https://api.elsevier.com/content/object/eid/1-s2.0-S0306261923018573-si88.svg?httpAccept=%2A%2F%2A",
            "@multimediatype": "Scalable Vector Graphics file",
            "@type": "ALTIMG",
            "@size": "9121",
            "@ref": "si88",
            "@mimetype": "image/svg+xml"
        },
        {
            "@category": "thumbnail",
            "@_fa": "true",
            "$": "https://api.elsevier.com/content/object/eid/1-s2.0-S0306261923018573-si9.svg?httpAccept=%2A%2F%2A",
            "@multimediatype": "Scalable Vector Graphics file",
            "@type": "ALTIMG",
            "@size": "2404",
            "@ref": "si9",
            "@mimetype": "image/svg+xml"
        },
        {
            "@category": "thumbnail",
            "@_fa": "true",
            "$": "https://api.elsevier.com/content/object/eid/1-s2.0-S0306261923018573-si90.svg?httpAccept=%2A%2F%2A",
            "@multimediatype": "Scalable Vector Graphics file",
            "@type": "ALTIMG",
            "@size": "2511",
            "@ref": "si90",
            "@mimetype": "image/svg+xml"
        },
        {
            "@category": "thumbnail",
            "@_fa": "true",
            "$": "https://api.elsevier.com/content/object/eid/1-s2.0-S0306261923018573-si91.svg?httpAccept=%2A%2F%2A",
            "@multimediatype": "Scalable Vector Graphics file",
            "@type": "ALTIMG",
            "@size": "12065",
            "@ref": "si91",
            "@mimetype": "image/svg+xml"
        },
        {
            "@category": "thumbnail",
            "@_fa": "true",
            "$": "https://api.elsevier.com/content/object/eid/1-s2.0-S0306261923018573-si92.svg?httpAccept=%2A%2F%2A",
            "@multimediatype": "Scalable Vector Graphics file",
            "@type": "ALTIMG",
            "@size": "27774",
            "@ref": "si92",
            "@mimetype": "image/svg+xml"
        },
        {
            "@category": "thumbnail",
            "@_fa": "true",
            "$": "https://api.elsevier.com/content/object/eid/1-s2.0-S0306261923018573-si93.svg?httpAccept=%2A%2F%2A",
            "@multimediatype": "Scalable Vector Graphics file",
            "@type": "ALTIMG",
            "@size": "1474",
            "@ref": "si93",
            "@mimetype": "image/svg+xml"
        },
        {
            "@category": "thumbnail",
            "@_fa": "true",
            "$": "https://api.elsevier.com/content/object/eid/1-s2.0-S0306261923018573-si99.svg?httpAccept=%2A%2F%2A",
            "@multimediatype": "Scalable Vector Graphics file",
            "@type": "ALTIMG",
            "@size": "12547",
            "@ref": "si99",
            "@mimetype": "image/svg+xml"
        },
        {
            "@category": "standard",
            "@_fa": "true",
            "$": "https://api.elsevier.com/content/object/eid/1-s2.0-S0306261923018573-am.pdf?httpAccept=%2A%2F%2A",
            "@multimediatype": "Acrobat PDF file",
            "@type": "AAM-PDF",
            "@size": "1085549",
            "@ref": "am",
            "@mimetype": "application/pdf"
        }
    ]},
    "link": {
        "@rel": "abstract",
        "@href": "https://api.elsevier.com/content/abstract/scopus_id/85183786230"
    }
}}