{"full-text-retrieval-response": {
    "scopus-eid": "2-s2.0-85203423462",
    "originalText": "serial JL 312002 291210 291862 291881 31 90 Journal of Building Engineering JOURNALBUILDINGENGINEERING 2024-09-10 2024-09-10 2024-09-12 2024-09-12 2025-02-26T23:56:40 1-s2.0-S2352710224022629 S2352-7102(24)02262-9 S2352710224022629 10.1016/j.jobe.2024.110694 S300 S300.1 FULL-TEXT 1-s2.0-S2352710224X00145 2025-02-27T07:00:30.775522Z 0 0 20241115 2024 2024-09-10T03:36:05.503408Z articleinfo articlenumber articletitlenorm authfirstinitialnorm authfirstsurnamenorm cid cids contenttype copyright crossmark dateloaded dateloadedtxt datesearch datesort dateupdated dco docsubtype doctype doi eid ewtransactionid fundingbodyid hubeid indexeddate issn issnnorm itemstage itemtransactionid itemweight oauserlicense openaccess openarchive pg pgfirst pii piinorm pubdatestart pubdatetxt pubyr sortorder sponsoredaccesstype srctitle srctitlenorm srctype ssids alllist content oa subj subheadings suppl tomb volfirst volissue volumelist webpdf webpdfpagecount yearnav figure table body mmlmath affil appendices articletitle auth authfirstini authfull authkeywords authlast highlightsabst nomenclature orcid primabst ref 2352-7102 23527102 UNLIMITED DEN21 true 97 97 C Volume 97 14 110694 110694 110694 20241115 15 November 2024 2024-11-15 2024 article fla © 2024 The Authors. Published by Elsevier Ltd. AHEATMEASUREMENTFREESTRATEGYFORECONOMICMODELPREDICTIVECONTROLHYDRONICRADIATORS KNUDSEN M Nomenclature 1 Introduction 2 Method 2.1 Baseline EMPC 2.2 EMPC with proxy heat measurement 2.3 Virtual test setup 2.3.1 Case-study EnergyPlus room 2.3.2 Radiator thermostat model 2.3.3 Simulation tests 3 Results 3.1 System identification 3.2 EMPC performance 3.3 Radiator exponent uncertainty 3.4 Water flow and return temperature analysis 4 Discussion 5 Conclusion CRediT authorship contribution statement Appendix A Model Matrices Heat-based Model Proxy-based Model References CAI 2018 506 518 H VANHOUDT 2018 1317 1327 D LEDREAU 2016 991 1002 J DOMINKOVIC 2018 949 966 D HEDEGAARD 2019 181 204 R PETERSEN 2020 S INCLUDINGBUILDINGENERGYFLEXIBILITYASSETINSYSTEMWIDEDISTRICTHEATINGOPTIMIZATIONMODELS HALVGAARD 2012 R ECONOMICMODELPREDICTIVECONTROLFORBUILDINGCLIMATECONTROLINASMARTGRIDINNOVATIVESMARTGRIDTECHNOLOGIESIEEEPES KNUDSEN 2016 196 204 M PEDERSEN 2019 T FINCK 2019 365 379 C FINCK 2020 114671 C ZONG 2017 1476 1486 Y KNUDSEN 2021 M KILLIAN 2016 403 412 M HEDEGAARD 2018 206 216 R STURZENEGGER 2016 1 12 D PRIVARA 2013 8 22 S ATAM 2016 86 111 E AMATO 2023 V KRISTENSEN 2021 1106002 M LINDELOF 2015 292 302 D CONINCK 2016 290 298 R THILKER 2022 C LEARNINGSEXPERIMENTSMPCFORHEATINGOLDERSCHOOLBUILDINGINBUILDSIMNORDIC2022 PEDERSEN 2017 158 166 T WANG 2019 106204 J OLDEWURTEL 2012 15 27 F BACHER 2011 1511 1522 P YU 2022 108832 X WEI 2024 122750 Z AMATO 2013 112759 V BUNNING 2022 118491 F DRGONA 2020 190 232 J LJUNG 1999 L 2014 DSADSDSEN4422RADIATORSCONVECTORS2150NORDHAVNDANISHSTANDARDSASSOCIATION MARCHESI 2019 R 2023 ENERGYPLUSVERSION2210DOCUMENTATIONINPUTOUTPUTREFERENCEDEPARTMENTENERGY 2023 ENERGYPLUSVERSION2210 KNUDSENX2024X110694 KNUDSENX2024X110694XM Full 2024-09-11T14:55:06Z FundingBody Denmark institutions 2021 http://creativecommons.org/licenses/by/4.0/ 2026-09-12T00:00:00.000Z 2026-09-12T00:00:00.000Z http://creativecommons.org/licenses/by-nc-nd/4.0/ This is an open access article under the CC BY license. © 2024 The Authors. Published by Elsevier Ltd. item S2352-7102(24)02262-9 S2352710224022629 1-s2.0-S2352710224022629 10.1016/j.jobe.2024.110694 312002 2025-02-27T07:00:30.775522Z 2024-11-15 UNLIMITED DEN21 1-s2.0-S2352710224022629-main.pdf https://s3-eu-west-1.amazonaws.com/prod-ucs-content-store-eu-west/content/pii:S2352710224022629/MAIN/application/pdf/d5498894bc5ba9dae51427d69056b812/main.pdf main.pdf pdf true 7412059 MAIN 15 1-s2.0-S2352710224022629-main_1.png https://s3-eu-west-1.amazonaws.com/prod-ucs-content-store-eu-west/content/pii:S2352710224022629/PREVIEW/image/png/76a649c5b752390b40ae7dba5862a555/main_1.png main_1.png png 42409 849 656 IMAGE-WEB-PDF 1 1-s2.0-S2352710224022629-gr10.jpg https://s3-eu-west-1.amazonaws.com/prod-ucs-content-store-eu-west/content/pii:S2352710224022629/gr10/DOWNSAMPLED/image/jpeg/40547e091a9302568d8e1da93a00bdb2/gr10.jpg gr10 gr10.jpg jpg 90482 227 344 IMAGE-DOWNSAMPLED 1-s2.0-S2352710224022629-gr9.jpg https://s3-eu-west-1.amazonaws.com/prod-ucs-content-store-eu-west/content/pii:S2352710224022629/gr9/DOWNSAMPLED/image/jpeg/50bb5d40a3346506a1ec1ba5cd3b3e25/gr9.jpg gr9 gr9.jpg jpg 141330 408 624 IMAGE-DOWNSAMPLED 1-s2.0-S2352710224022629-gr5.jpg https://s3-eu-west-1.amazonaws.com/prod-ucs-content-store-eu-west/content/pii:S2352710224022629/gr5/DOWNSAMPLED/image/jpeg/b9ccb4b0f5999f11b48e7eeda55930a7/gr5.jpg gr5 gr5.jpg jpg 229256 611 624 IMAGE-DOWNSAMPLED 1-s2.0-S2352710224022629-gr6.jpg https://s3-eu-west-1.amazonaws.com/prod-ucs-content-store-eu-west/content/pii:S2352710224022629/gr6/DOWNSAMPLED/image/jpeg/57599ba40f09536913a3244ae4d893c1/gr6.jpg gr6 gr6.jpg jpg 191240 509 624 IMAGE-DOWNSAMPLED 1-s2.0-S2352710224022629-gr7.jpg https://s3-eu-west-1.amazonaws.com/prod-ucs-content-store-eu-west/content/pii:S2352710224022629/gr7/DOWNSAMPLED/image/jpeg/0a2e4a079e145ff81b6de0a39e4e9cec/gr7.jpg gr7 gr7.jpg jpg 89420 203 344 IMAGE-DOWNSAMPLED 1-s2.0-S2352710224022629-gr8.jpg https://s3-eu-west-1.amazonaws.com/prod-ucs-content-store-eu-west/content/pii:S2352710224022629/gr8/DOWNSAMPLED/image/jpeg/d3f1d8fbe70537cfdfb0b5a326a04946/gr8.jpg gr8 gr8.jpg jpg 144173 407 624 IMAGE-DOWNSAMPLED 1-s2.0-S2352710224022629-gr1.jpg https://s3-eu-west-1.amazonaws.com/prod-ucs-content-store-eu-west/content/pii:S2352710224022629/gr1/DOWNSAMPLED/image/jpeg/4132f4aa7737f434e99d0a84dd726f21/gr1.jpg gr1 gr1.jpg jpg 98430 255 624 IMAGE-DOWNSAMPLED 1-s2.0-S2352710224022629-gr2.jpg https://s3-eu-west-1.amazonaws.com/prod-ucs-content-store-eu-west/content/pii:S2352710224022629/gr2/DOWNSAMPLED/image/jpeg/63c3a3f580165b74d0495cb2392b7d3c/gr2.jpg gr2 gr2.jpg jpg 27895 290 491 IMAGE-DOWNSAMPLED 1-s2.0-S2352710224022629-gr3.jpg https://s3-eu-west-1.amazonaws.com/prod-ucs-content-store-eu-west/content/pii:S2352710224022629/gr3/DOWNSAMPLED/image/jpeg/2f79b461737dea84427283de57c7cd35/gr3.jpg gr3 gr3.jpg jpg 88570 270 491 IMAGE-DOWNSAMPLED 1-s2.0-S2352710224022629-gr4.jpg https://s3-eu-west-1.amazonaws.com/prod-ucs-content-store-eu-west/content/pii:S2352710224022629/gr4/DOWNSAMPLED/image/jpeg/5fcaa1f430afcdfa20906218525efe9c/gr4.jpg gr4 gr4.jpg jpg 194944 483 624 IMAGE-DOWNSAMPLED 1-s2.0-S2352710224022629-gr10.sml https://s3-eu-west-1.amazonaws.com/prod-ucs-content-store-eu-west/content/pii:S2352710224022629/gr10/THUMBNAIL/image/gif/cf27b4faf782815a9188e702a7e4c8f8/gr10.sml gr10 gr10.sml sml 72294 145 219 IMAGE-THUMBNAIL 1-s2.0-S2352710224022629-gr9.sml https://s3-eu-west-1.amazonaws.com/prod-ucs-content-store-eu-west/content/pii:S2352710224022629/gr9/THUMBNAIL/image/gif/e9879a6a01487e1ac97bee37e3818ae5/gr9.sml gr9 gr9.sml sml 74539 143 219 IMAGE-THUMBNAIL 1-s2.0-S2352710224022629-gr5.sml https://s3-eu-west-1.amazonaws.com/prod-ucs-content-store-eu-west/content/pii:S2352710224022629/gr5/THUMBNAIL/image/gif/d81a0ae6f447ecc41ca4635697eac203/gr5.sml gr5 gr5.sml sml 84352 164 167 IMAGE-THUMBNAIL 1-s2.0-S2352710224022629-gr6.sml https://s3-eu-west-1.amazonaws.com/prod-ucs-content-store-eu-west/content/pii:S2352710224022629/gr6/THUMBNAIL/image/gif/c500af9f339ca46d74d2b470cf504704/gr6.sml gr6 gr6.sml sml 82308 164 201 IMAGE-THUMBNAIL 1-s2.0-S2352710224022629-gr7.sml https://s3-eu-west-1.amazonaws.com/prod-ucs-content-store-eu-west/content/pii:S2352710224022629/gr7/THUMBNAIL/image/gif/fd76e5119b637464552a2a3fb87b4084/gr7.sml gr7 gr7.sml sml 71406 129 219 IMAGE-THUMBNAIL 1-s2.0-S2352710224022629-gr8.sml https://s3-eu-west-1.amazonaws.com/prod-ucs-content-store-eu-west/content/pii:S2352710224022629/gr8/THUMBNAIL/image/gif/7f4eb9e95761976d34c25dbb1d05141a/gr8.sml gr8 gr8.sml sml 75555 143 219 IMAGE-THUMBNAIL 1-s2.0-S2352710224022629-gr1.sml https://s3-eu-west-1.amazonaws.com/prod-ucs-content-store-eu-west/content/pii:S2352710224022629/gr1/THUMBNAIL/image/gif/253b690d0d21c987a75ea548b61dd45c/gr1.sml gr1 gr1.sml sml 70248 90 219 IMAGE-THUMBNAIL 1-s2.0-S2352710224022629-gr2.sml https://s3-eu-west-1.amazonaws.com/prod-ucs-content-store-eu-west/content/pii:S2352710224022629/gr2/THUMBNAIL/image/gif/6776a663547e11f74f3cd5243528f58e/gr2.sml gr2 gr2.sml sml 10045 129 219 IMAGE-THUMBNAIL 1-s2.0-S2352710224022629-gr3.sml https://s3-eu-west-1.amazonaws.com/prod-ucs-content-store-eu-west/content/pii:S2352710224023039/gr3/THUMBNAIL/image/gif/7a4cdb403c318c099d61b51d3566cf02/gr3.sml gr3 gr3.sml sml 70084 120 219 IMAGE-THUMBNAIL 1-s2.0-S2352710224022629-gr4.sml https://s3-eu-west-1.amazonaws.com/prod-ucs-content-store-eu-west/content/pii:S2352710224023039/gr4/THUMBNAIL/image/gif/9e96ce590199235fd4fe67a4e553de65/gr4.sml gr4 gr4.sml sml 83777 164 212 IMAGE-THUMBNAIL 1-s2.0-S2352710224022629-gr10_lrg.jpg https://s3-eu-west-1.amazonaws.com/prod-ucs-content-store-eu-west/content/pii:S2352710224022629/HIGHRES/image/jpeg/6b6bb128f0f1c55564b2bf0890d34488/gr10_lrg.jpg gr10 gr10_lrg.jpg jpg 206641 1007 1524 IMAGE-HIGH-RES 1-s2.0-S2352710224022629-gr9_lrg.jpg https://s3-eu-west-1.amazonaws.com/prod-ucs-content-store-eu-west/content/pii:S2352710224022629/HIGHRES/image/jpeg/9c34b8a6c7fdbd198aac812db37fc966/gr9_lrg.jpg gr9 gr9_lrg.jpg jpg 734067 1807 2764 IMAGE-HIGH-RES 1-s2.0-S2352710224022629-gr5_lrg.jpg https://s3-eu-west-1.amazonaws.com/prod-ucs-content-store-eu-west/content/pii:S2352710224022629/HIGHRES/image/jpeg/f59379f01da641872b28d74a1611f5e7/gr5_lrg.jpg gr5 gr5_lrg.jpg jpg 1183261 2708 2764 IMAGE-HIGH-RES 1-s2.0-S2352710224022629-gr6_lrg.jpg https://s3-eu-west-1.amazonaws.com/prod-ucs-content-store-eu-west/content/pii:S2352710224022629/HIGHRES/image/jpeg/d46a39bed77bb962555fa1b0262ed68f/gr6_lrg.jpg gr6 gr6_lrg.jpg jpg 928838 2253 2764 IMAGE-HIGH-RES 1-s2.0-S2352710224022629-gr7_lrg.jpg https://s3-eu-west-1.amazonaws.com/prod-ucs-content-store-eu-west/content/pii:S2352710224022629/HIGHRES/image/jpeg/b98f12407d9da06f36c025e4fd179e97/gr7_lrg.jpg gr7 gr7_lrg.jpg jpg 216200 901 1524 IMAGE-HIGH-RES 1-s2.0-S2352710224022629-gr8_lrg.jpg https://s3-eu-west-1.amazonaws.com/prod-ucs-content-store-eu-west/content/pii:S2352710224022629/HIGHRES/image/jpeg/48c9fde165b27e6b760fe2b6c869733a/gr8_lrg.jpg gr8 gr8_lrg.jpg jpg 736029 1805 2764 IMAGE-HIGH-RES 1-s2.0-S2352710224022629-gr1_lrg.jpg https://s3-eu-west-1.amazonaws.com/prod-ucs-content-store-eu-west/content/pii:S2352710224022629/HIGHRES/image/jpeg/3d0312d1a75e2a79d79f18487d0c4b2e/gr1_lrg.jpg gr1 gr1_lrg.jpg jpg 264843 1131 2764 IMAGE-HIGH-RES 1-s2.0-S2352710224022629-gr2_lrg.jpg https://s3-eu-west-1.amazonaws.com/prod-ucs-content-store-eu-west/content/pii:S2352710224022629/HIGHRES/image/jpeg/04600a6158a13496d55656972ab26c26/gr2_lrg.jpg gr2 gr2_lrg.jpg jpg 145261 1282 2174 IMAGE-HIGH-RES 1-s2.0-S2352710224022629-gr3_lrg.jpg https://s3-eu-west-1.amazonaws.com/prod-ucs-content-store-eu-west/content/pii:S2352710224023039/HIGHRES/image/jpeg/7c261dcdae9c35b240ac3dc3e6e2ade7/gr3_lrg.jpg gr3 gr3_lrg.jpg jpg 201829 1195 2173 IMAGE-HIGH-RES 1-s2.0-S2352710224022629-gr4_lrg.jpg https://s3-eu-west-1.amazonaws.com/prod-ucs-content-store-eu-west/content/pii:S2352710224023039/HIGHRES/image/jpeg/6a53a3a32552ca1eb19e612d6a468a7c/gr4_lrg.jpg gr4 gr4_lrg.jpg jpg 944368 2139 2764 IMAGE-HIGH-RES 1-s2.0-S2352710224022629-si134.svg https://s3-eu-west-1.amazonaws.com/prod-ucs-content-store-eu-west/content/pii:S2352710224022629/image/svg+xml/41e1d7c9d77a45b72ec52d3b58810b13/si134.svg si134 si134.svg svg 38213 ALTIMG 1-s2.0-S2352710224022629-si40.svg https://s3-eu-west-1.amazonaws.com/prod-ucs-content-store-eu-west/content/pii:S2352710224022629/image/svg+xml/168efa83645e6dc8afe00de71b831bfd/si40.svg si40 si40.svg svg 87191 ALTIMG 1-s2.0-S2352710224022629-si26.svg https://s3-eu-west-1.amazonaws.com/prod-ucs-content-store-eu-west/content/pii:S2352710224022629/image/svg+xml/c7adb7b7a82318051c0e236df9d6fb2e/si26.svg si26 si26.svg svg 14089 ALTIMG 1-s2.0-S2352710224022629-si54.svg https://s3-eu-west-1.amazonaws.com/prod-ucs-content-store-eu-west/content/pii:S2352710224022629/image/svg+xml/b129f26d2626c41cd75d80691e505bfc/si54.svg si54 si54.svg svg 17703 ALTIMG 1-s2.0-S2352710224022629-si102.svg https://s3-eu-west-1.amazonaws.com/prod-ucs-content-store-eu-west/content/pii:S2352710224022629/image/svg+xml/3a3ffa3e609b0560b5cec8669fc97498/si102.svg si102 si102.svg svg 78859 ALTIMG 1-s2.0-S2352710224022629-si11.svg https://s3-eu-west-1.amazonaws.com/prod-ucs-content-store-eu-west/content/pii:S2352710224022629/image/svg+xml/4492f038a4c8efedceb57065ad23f459/si11.svg si11 si11.svg svg 20468 ALTIMG 1-s2.0-S2352710224022629-si85.svg https://s3-eu-west-1.amazonaws.com/prod-ucs-content-store-eu-west/content/pii:S2352710224022629/image/svg+xml/64fa41c2ef21a31ec92c2b01a6cb1b7e/si85.svg si85 si85.svg svg 62230 ALTIMG 1-s2.0-S2352710224022629-si88.svg https://s3-eu-west-1.amazonaws.com/prod-ucs-content-store-eu-west/content/pii:S2352710224022629/image/svg+xml/6eef011fa5c923def1f47044b6fb89c4/si88.svg si88 si88.svg svg 24514 ALTIMG 1-s2.0-S2352710224022629-si99.svg https://s3-eu-west-1.amazonaws.com/prod-ucs-content-store-eu-west/content/pii:S2352710224022629/image/svg+xml/1a2a33f4e2aa7e8f332f244affa10c7d/si99.svg si99 si99.svg svg 17672 ALTIMG 1-s2.0-S2352710224022629-si42.svg https://s3-eu-west-1.amazonaws.com/prod-ucs-content-store-eu-west/content/pii:S2352710224022629/image/svg+xml/17493f581917fe3cb76071a36dae11b3/si42.svg si42 si42.svg svg 42186 ALTIMG 1-s2.0-S2352710224022629-si113.svg https://s3-eu-west-1.amazonaws.com/prod-ucs-content-store-eu-west/content/pii:S2352710224022629/image/svg+xml/826941a0a5d387a3dcdab3d21003f710/si113.svg si113 si113.svg svg 92813 ALTIMG 1-s2.0-S2352710224022629-si94.svg https://s3-eu-west-1.amazonaws.com/prod-ucs-content-store-eu-west/content/pii:S2352710224022629/image/svg+xml/2b789f3c58a09d6e46af2126f27e4862/si94.svg si94 si94.svg svg 19768 ALTIMG 1-s2.0-S2352710224022629-si115.svg https://s3-eu-west-1.amazonaws.com/prod-ucs-content-store-eu-west/content/pii:S2352710224022629/image/svg+xml/2712b225c448c31784df11e9b8c7c08a/si115.svg si115 si115.svg svg 34297 ALTIMG 1-s2.0-S2352710224022629-si100.svg https://s3-eu-west-1.amazonaws.com/prod-ucs-content-store-eu-west/content/pii:S2352710224022629/image/svg+xml/32569337e3b821b304c19c6beee59ff9/si100.svg si100 si100.svg svg 12945 ALTIMG 1-s2.0-S2352710224022629-si34.svg https://s3-eu-west-1.amazonaws.com/prod-ucs-content-store-eu-west/content/pii:S2352710224022629/image/svg+xml/b88c622bec29cb120649975e2aa56ad3/si34.svg si34 si34.svg svg 5751 ALTIMG 1-s2.0-S2352710224022629-si142.svg https://s3-eu-west-1.amazonaws.com/prod-ucs-content-store-eu-west/content/pii:S2352710224022629/image/svg+xml/7a9f49e386026858662074f17e39ab65/si142.svg si142 si142.svg svg 31447 ALTIMG 1-s2.0-S2352710224022629-si105.svg https://s3-eu-west-1.amazonaws.com/prod-ucs-content-store-eu-west/content/pii:S2352710224022629/image/svg+xml/d75dcd9e10ac8dff770d46c46995e0dd/si105.svg si105 si105.svg svg 25448 ALTIMG 1-s2.0-S2352710224022629-si61.svg https://s3-eu-west-1.amazonaws.com/prod-ucs-content-store-eu-west/content/pii:S2352710224022629/image/svg+xml/94683805c43499c50456418badb5f63e/si61.svg si61 si61.svg svg 28031 ALTIMG 1-s2.0-S2352710224022629-si139.svg https://s3-eu-west-1.amazonaws.com/prod-ucs-content-store-eu-west/content/pii:S2352710224022629/image/svg+xml/f392219372c517fcb5811f2e4b63dcee/si139.svg si139 si139.svg svg 91916 ALTIMG 1-s2.0-S2352710224022629-si124.svg https://s3-eu-west-1.amazonaws.com/prod-ucs-content-store-eu-west/content/pii:S2352710224022629/image/svg+xml/1c9f831dad1be132731c2dbc5d2b2336/si124.svg si124 si124.svg svg 21501 ALTIMG 1-s2.0-S2352710224022629-si63.svg https://s3-eu-west-1.amazonaws.com/prod-ucs-content-store-eu-west/content/pii:S2352710224022629/image/svg+xml/e10a8321dae1bb83ad309c9baba57b54/si63.svg si63 si63.svg svg 30129 ALTIMG 1-s2.0-S2352710224022629-si104.svg https://s3-eu-west-1.amazonaws.com/prod-ucs-content-store-eu-west/content/pii:S2352710224022629/image/svg+xml/b9ecba82b2854400d49fe3b5a6031d62/si104.svg si104 si104.svg svg 22789 ALTIMG 1-s2.0-S2352710224022629-si55.svg https://s3-eu-west-1.amazonaws.com/prod-ucs-content-store-eu-west/content/pii:S2352710224022629/image/svg+xml/e4c5b2a728e71be9411b397c61451e57/si55.svg si55 si55.svg svg 24377 ALTIMG 1-s2.0-S2352710224022629-si32.svg https://s3-eu-west-1.amazonaws.com/prod-ucs-content-store-eu-west/content/pii:S2352710224022629/image/svg+xml/1d6a48c8e58de7284f8a73b4e229ab28/si32.svg si32 si32.svg svg 4461 ALTIMG 1-s2.0-S2352710224022629-si37.svg https://s3-eu-west-1.amazonaws.com/prod-ucs-content-store-eu-west/content/pii:S2352710224022629/image/svg+xml/c3c1694c77e0a73cac437d086d18c5a2/si37.svg si37 si37.svg svg 7850 ALTIMG 1-s2.0-S2352710224022629-si73.svg https://s3-eu-west-1.amazonaws.com/prod-ucs-content-store-eu-west/content/pii:S2352710224022629/image/svg+xml/dc4fdbe4410b62b5bdb6e3790d099b8a/si73.svg si73 si73.svg svg 13874 ALTIMG 1-s2.0-S2352710224022629-si140.svg https://s3-eu-west-1.amazonaws.com/prod-ucs-content-store-eu-west/content/pii:S2352710224022629/image/svg+xml/63cc48c8a1b1fc8d4fc259c96b3792a3/si140.svg si140 si140.svg svg 22236 ALTIMG 1-s2.0-S2352710224022629-si107.svg https://s3-eu-west-1.amazonaws.com/prod-ucs-content-store-eu-west/content/pii:S2352710224022629/image/svg+xml/61271a52698fd744326e56babfd0e2b2/si107.svg si107 si107.svg svg 11411 ALTIMG 1-s2.0-S2352710224022629-si156.svg https://s3-eu-west-1.amazonaws.com/prod-ucs-content-store-eu-west/content/pii:S2352710224022629/image/svg+xml/e9a4c6dd4572b16d23e4e3f82578d0d1/si156.svg si156 si156.svg svg 12665 ALTIMG 1-s2.0-S2352710224022629-si44.svg https://s3-eu-west-1.amazonaws.com/prod-ucs-content-store-eu-west/content/pii:S2352710224022629/image/svg+xml/1818c63044634465023d86ca7edbbc99/si44.svg si44 si44.svg svg 60095 ALTIMG 1-s2.0-S2352710224022629-si146.svg https://s3-eu-west-1.amazonaws.com/prod-ucs-content-store-eu-west/content/pii:S2352710224022629/image/svg+xml/c948585e8fd35235562721dee80a6ffe/si146.svg si146 si146.svg svg 40014 ALTIMG 1-s2.0-S2352710224022629-si138.svg https://s3-eu-west-1.amazonaws.com/prod-ucs-content-store-eu-west/content/pii:S2352710224022629/image/svg+xml/032ba67f8f10c450bb46f5b4a701b44a/si138.svg si138 si138.svg svg 34052 ALTIMG 1-s2.0-S2352710224022629-si56.svg https://s3-eu-west-1.amazonaws.com/prod-ucs-content-store-eu-west/content/pii:S2352710224022629/image/svg+xml/b502ff06a5de9260563acf7933918973/si56.svg si56 si56.svg svg 17226 ALTIMG 1-s2.0-S2352710224022629-si20.svg https://s3-eu-west-1.amazonaws.com/prod-ucs-content-store-eu-west/content/pii:S2352710224022629/image/svg+xml/6dd7f4ef8a62155ef7dfe35a0ad0d0d7/si20.svg si20 si20.svg svg 4504 ALTIMG 1-s2.0-S2352710224022629-si9.svg https://s3-eu-west-1.amazonaws.com/prod-ucs-content-store-eu-west/content/pii:S2352710224022629/image/svg+xml/692f055c6d843724de1e7d9b14d729be/si9.svg si9 si9.svg svg 30843 ALTIMG 1-s2.0-S2352710224022629-si110.svg https://s3-eu-west-1.amazonaws.com/prod-ucs-content-store-eu-west/content/pii:S2352710224022629/image/svg+xml/dd8ef4198631387af3deef4fd884f7f3/si110.svg si110 si110.svg svg 6381 ALTIMG 1-s2.0-S2352710224022629-si106.svg https://s3-eu-west-1.amazonaws.com/prod-ucs-content-store-eu-west/content/pii:S2352710224022629/image/svg+xml/6385c2808f9e50b65b2e5de7316e08eb/si106.svg si106 si106.svg svg 123651 ALTIMG 1-s2.0-S2352710224022629-si114.svg https://s3-eu-west-1.amazonaws.com/prod-ucs-content-store-eu-west/content/pii:S2352710224022629/image/svg+xml/d2b6a730c6e2c141b4632047278b1ccd/si114.svg si114 si114.svg svg 30279 ALTIMG 1-s2.0-S2352710224022629-si101.svg https://s3-eu-west-1.amazonaws.com/prod-ucs-content-store-eu-west/content/pii:S2352710224022629/image/svg+xml/774ff641f235ca3133cdb92d62926604/si101.svg si101 si101.svg svg 4549 ALTIMG 1-s2.0-S2352710224022629-si67.svg https://s3-eu-west-1.amazonaws.com/prod-ucs-content-store-eu-west/content/pii:S2352710224022629/image/svg+xml/69dc96dac824023da6b77bcbd3d402b9/si67.svg si67 si67.svg svg 15413 ALTIMG 1-s2.0-S2352710224022629-si1.svg https://s3-eu-west-1.amazonaws.com/prod-ucs-content-store-eu-west/content/pii:S2352710224022629/image/svg+xml/6764342e07d9b705481fdad4589a0e83/si1.svg si1 si1.svg svg 7185 ALTIMG 1-s2.0-S2352710224022629-si97.svg https://s3-eu-west-1.amazonaws.com/prod-ucs-content-store-eu-west/content/pii:S2352710224022629/image/svg+xml/305be5ff09795e94d2c22c759cf3e886/si97.svg si97 si97.svg svg 34162 ALTIMG 1-s2.0-S2352710224022629-si15.svg https://s3-eu-west-1.amazonaws.com/prod-ucs-content-store-eu-west/content/pii:S2352710224022629/image/svg+xml/10ab614ad82efd79017d7a16560a1aee/si15.svg si15 si15.svg svg 23014 ALTIMG 1-s2.0-S2352710224022629-si8.svg https://s3-eu-west-1.amazonaws.com/prod-ucs-content-store-eu-west/content/pii:S2352710224022629/image/svg+xml/41081e3724e967aebff7e20ccb7c1954/si8.svg si8 si8.svg svg 35118 ALTIMG 1-s2.0-S2352710224022629-si118.svg https://s3-eu-west-1.amazonaws.com/prod-ucs-content-store-eu-west/content/pii:S2352710224022629/image/svg+xml/999820e8dc4fd25c288c73732b7b726c/si118.svg si118 si118.svg svg 49194 ALTIMG 1-s2.0-S2352710224022629-si45.svg https://s3-eu-west-1.amazonaws.com/prod-ucs-content-store-eu-west/content/pii:S2352710224022629/image/svg+xml/45cb64852f630b7943c93f08c7da655b/si45.svg si45 si45.svg svg 62892 ALTIMG 1-s2.0-S2352710224022629-si131.svg https://s3-eu-west-1.amazonaws.com/prod-ucs-content-store-eu-west/content/pii:S2352710224022629/image/svg+xml/bb92d3fee46b31eefb4e26958bc0aed6/si131.svg si131 si131.svg svg 14556 ALTIMG 1-s2.0-S2352710224022629-si122.svg https://s3-eu-west-1.amazonaws.com/prod-ucs-content-store-eu-west/content/pii:S2352710224022629/image/svg+xml/b0803849f1c38cf88ea4833a06f45269/si122.svg si122 si122.svg svg 16149 ALTIMG 1-s2.0-S2352710224022629-si64.svg https://s3-eu-west-1.amazonaws.com/prod-ucs-content-store-eu-west/content/pii:S2352710224022629/image/svg+xml/ef0d5d9a1fce9abf03ac9bb313bde260/si64.svg si64 si64.svg svg 29158 ALTIMG 1-s2.0-S2352710224022629-si89.svg https://s3-eu-west-1.amazonaws.com/prod-ucs-content-store-eu-west/content/pii:S2352710224022629/image/svg+xml/ecbb5dcc9e521f96ffea5c4a197bbf92/si89.svg si89 si89.svg svg 29659 ALTIMG 1-s2.0-S2352710224022629-si81.svg https://s3-eu-west-1.amazonaws.com/prod-ucs-content-store-eu-west/content/pii:S2352710224022629/image/svg+xml/256db1bfcd9deb747b5e0a26934d03a1/si81.svg si81 si81.svg svg 54334 ALTIMG 1-s2.0-S2352710224022629-si129.svg https://s3-eu-west-1.amazonaws.com/prod-ucs-content-store-eu-west/content/pii:S2352710224022629/image/svg+xml/7a84ee4517502452c4794f53fecb23da/si129.svg si129 si129.svg svg 36636 ALTIMG 1-s2.0-S2352710224022629-si152.svg https://s3-eu-west-1.amazonaws.com/prod-ucs-content-store-eu-west/content/pii:S2352710224022629/image/svg+xml/9d0fda72247b09516e6df9d40386e8d2/si152.svg si152 si152.svg svg 28098 ALTIMG 1-s2.0-S2352710224022629-si3.svg https://s3-eu-west-1.amazonaws.com/prod-ucs-content-store-eu-west/content/pii:S2352710224022629/image/svg+xml/b963858eca7d2c35542a8f90503ee9b1/si3.svg si3 si3.svg svg 12299 ALTIMG 1-s2.0-S2352710224022629-si120.svg https://s3-eu-west-1.amazonaws.com/prod-ucs-content-store-eu-west/content/pii:S2352710224022629/image/svg+xml/cf6bcce0c6851b219af35992cf5111d7/si120.svg si120 si120.svg svg 13085 ALTIMG 1-s2.0-S2352710224022629-si123.svg https://s3-eu-west-1.amazonaws.com/prod-ucs-content-store-eu-west/content/pii:S2352710224022629/image/svg+xml/e903a251f0d852dae9c8cee6befa4b95/si123.svg si123 si123.svg svg 33659 ALTIMG 1-s2.0-S2352710224022629-si79.svg https://s3-eu-west-1.amazonaws.com/prod-ucs-content-store-eu-west/content/pii:S2352710224022629/image/svg+xml/7b6de1be2472ff11a2caf2788c03986d/si79.svg si79 si79.svg svg 22606 ALTIMG 1-s2.0-S2352710224022629-si28.svg https://s3-eu-west-1.amazonaws.com/prod-ucs-content-store-eu-west/content/pii:S2352710224022629/image/svg+xml/af6d9af02ef6252c55ef8f3a7ea0fb37/si28.svg si28 si28.svg svg 6522 ALTIMG 1-s2.0-S2352710224022629-si103.svg https://s3-eu-west-1.amazonaws.com/prod-ucs-content-store-eu-west/content/pii:S2352710224022629/image/svg+xml/e0b73ad3582e31d14d1a12cd784ce77c/si103.svg si103 si103.svg svg 36467 ALTIMG 1-s2.0-S2352710224022629-si96.svg https://s3-eu-west-1.amazonaws.com/prod-ucs-content-store-eu-west/content/pii:S2352710224022629/image/svg+xml/29d0750889322f4db578f968b1302dd1/si96.svg si96 si96.svg svg 7122 ALTIMG 1-s2.0-S2352710224022629-si13.svg https://s3-eu-west-1.amazonaws.com/prod-ucs-content-store-eu-west/content/pii:S2352710224022629/image/svg+xml/02e6140fd860ee735a77769307f81ceb/si13.svg si13 si13.svg svg 21350 ALTIMG 1-s2.0-S2352710224022629-si78.svg https://s3-eu-west-1.amazonaws.com/prod-ucs-content-store-eu-west/content/pii:S2352710224022629/image/svg+xml/9faa3e03b455a68481da4eeb4db01c7b/si78.svg si78 si78.svg svg 78897 ALTIMG 1-s2.0-S2352710224022629-si17.svg https://s3-eu-west-1.amazonaws.com/prod-ucs-content-store-eu-west/content/pii:S2352710224022629/image/svg+xml/fcae0e5138ee05dc6d543bdf7338e58e/si17.svg si17 si17.svg svg 5866 ALTIMG 1-s2.0-S2352710224022629-si72.svg https://s3-eu-west-1.amazonaws.com/prod-ucs-content-store-eu-west/content/pii:S2352710224022629/image/svg+xml/c108cf913544e0092cd1b4f0a1eb7cc3/si72.svg si72 si72.svg svg 34351 ALTIMG 1-s2.0-S2352710224022629-si66.svg https://s3-eu-west-1.amazonaws.com/prod-ucs-content-store-eu-west/content/pii:S2352710224022629/image/svg+xml/17a738461e2674682c846d408cec57cd/si66.svg si66 si66.svg svg 13463 ALTIMG 1-s2.0-S2352710224022629-si116.svg https://s3-eu-west-1.amazonaws.com/prod-ucs-content-store-eu-west/content/pii:S2352710224022629/image/svg+xml/94cceeabcd495e6e5b8d22a4afecce38/si116.svg si116 si116.svg svg 21799 ALTIMG 1-s2.0-S2352710224022629-si5.svg https://s3-eu-west-1.amazonaws.com/prod-ucs-content-store-eu-west/content/pii:S2352710224022629/image/svg+xml/37540adb288d1d7ee4b7d3bded349340/si5.svg si5 si5.svg svg 11718 ALTIMG 1-s2.0-S2352710224022629-si93.svg https://s3-eu-west-1.amazonaws.com/prod-ucs-content-store-eu-west/content/pii:S2352710224022629/image/svg+xml/68cc8ea2755e0b5295d68187642e0c9c/si93.svg si93 si93.svg svg 42924 ALTIMG 1-s2.0-S2352710224022629-si157.svg https://s3-eu-west-1.amazonaws.com/prod-ucs-content-store-eu-west/content/pii:S2352710224022629/image/svg+xml/83fb01d7eb29e65be5b357c9c364cd95/si157.svg si157 si157.svg svg 20386 ALTIMG 1-s2.0-S2352710224022629-si87.svg https://s3-eu-west-1.amazonaws.com/prod-ucs-content-store-eu-west/content/pii:S2352710224022629/image/svg+xml/6e11ea6c4676cbcc0b3a4ba9a01df936/si87.svg si87 si87.svg svg 143008 ALTIMG 1-s2.0-S2352710224022629-si25.svg https://s3-eu-west-1.amazonaws.com/prod-ucs-content-store-eu-west/content/pii:S2352710224022629/image/svg+xml/e0dee5e2ecc8427507cc373ba039aa54/si25.svg si25 si25.svg svg 16077 ALTIMG 1-s2.0-S2352710224022629-si33.svg https://s3-eu-west-1.amazonaws.com/prod-ucs-content-store-eu-west/content/pii:S2352710224022629/image/svg+xml/e085e8418a054aba37f29679a9db5519/si33.svg si33 si33.svg svg 6356 ALTIMG 1-s2.0-S2352710224022629-si70.svg https://s3-eu-west-1.amazonaws.com/prod-ucs-content-store-eu-west/content/pii:S2352710224022629/image/svg+xml/4c07508b6de2c699798b003c66ab1f91/si70.svg si70 si70.svg svg 93729 ALTIMG 1-s2.0-S2352710224022629-si71.svg https://s3-eu-west-1.amazonaws.com/prod-ucs-content-store-eu-west/content/pii:S2352710224022629/image/svg+xml/ec5fc025ada92cc86f95e809ffd1728a/si71.svg si71 si71.svg svg 9793 ALTIMG 1-s2.0-S2352710224022629-si149.svg https://s3-eu-west-1.amazonaws.com/prod-ucs-content-store-eu-west/content/pii:S2352710224022629/image/svg+xml/1ca3bf869e8bb403c4458a9c01153ab7/si149.svg si149 si149.svg svg 35688 ALTIMG 1-s2.0-S2352710224022629-si135.svg https://s3-eu-west-1.amazonaws.com/prod-ucs-content-store-eu-west/content/pii:S2352710224022629/image/svg+xml/93c0b309741f8297024045b4537ab706/si135.svg si135 si135.svg svg 30552 ALTIMG 1-s2.0-S2352710224022629-si80.svg https://s3-eu-west-1.amazonaws.com/prod-ucs-content-store-eu-west/content/pii:S2352710224022629/image/svg+xml/4dae4f9c17954dc1cec19f355ea3febb/si80.svg si80 si80.svg svg 33235 ALTIMG 1-s2.0-S2352710224022629-si62.svg https://s3-eu-west-1.amazonaws.com/prod-ucs-content-store-eu-west/content/pii:S2352710224022629/image/svg+xml/3dfa6c655fc8ab2314ff11dac432cf74/si62.svg si62 si62.svg svg 30757 ALTIMG 1-s2.0-S2352710224022629-si12.svg https://s3-eu-west-1.amazonaws.com/prod-ucs-content-store-eu-west/content/pii:S2352710224022629/image/svg+xml/6818c3ff65bcd937e66a72e0150bb4c6/si12.svg si12 si12.svg svg 32626 ALTIMG 1-s2.0-S2352710224022629-si98.svg https://s3-eu-west-1.amazonaws.com/prod-ucs-content-store-eu-west/content/pii:S2352710224022629/image/svg+xml/77bf393acaed69730b9b318b59222902/si98.svg si98 si98.svg svg 9561 ALTIMG 1-s2.0-S2352710224022629-si145.svg https://s3-eu-west-1.amazonaws.com/prod-ucs-content-store-eu-west/content/pii:S2352710224022629/image/svg+xml/d89e75b80f7f2f032d13901d8b111f3e/si145.svg si145 si145.svg svg 41149 ALTIMG 1-s2.0-S2352710224022629-si151.svg https://s3-eu-west-1.amazonaws.com/prod-ucs-content-store-eu-west/content/pii:S2352710224022629/image/svg+xml/d01ea82b88f0a13b300752cc3eebb797/si151.svg si151 si151.svg svg 48367 ALTIMG 1-s2.0-S2352710224022629-si57.svg https://s3-eu-west-1.amazonaws.com/prod-ucs-content-store-eu-west/content/pii:S2352710224022629/image/svg+xml/f50ba2c294407e48ed291075028fbb10/si57.svg si57 si57.svg svg 14068 ALTIMG 1-s2.0-S2352710224022629-si68.svg https://s3-eu-west-1.amazonaws.com/prod-ucs-content-store-eu-west/content/pii:S2352710224022629/image/svg+xml/8e03fb9804728874457c96de3c9fd2b5/si68.svg si68 si68.svg svg 14234 ALTIMG 1-s2.0-S2352710224022629-si159.svg https://s3-eu-west-1.amazonaws.com/prod-ucs-content-store-eu-west/content/pii:S2352710224022629/image/svg+xml/e52aad57f0b489f5d314086a924c6621/si159.svg si159 si159.svg svg 18428 ALTIMG 1-s2.0-S2352710224022629-si95.svg https://s3-eu-west-1.amazonaws.com/prod-ucs-content-store-eu-west/content/pii:S2352710224022629/image/svg+xml/f4cf723047b837bab870a4f7f99333d2/si95.svg si95 si95.svg svg 22425 ALTIMG 1-s2.0-S2352710224022629-si38.svg https://s3-eu-west-1.amazonaws.com/prod-ucs-content-store-eu-west/content/pii:S2352710224022629/image/svg+xml/3810cad4dc0deb39af774eb5bc4e94ea/si38.svg si38 si38.svg svg 9209 ALTIMG 1-s2.0-S2352710224022629-si83.svg https://s3-eu-west-1.amazonaws.com/prod-ucs-content-store-eu-west/content/pii:S2352710224022629/image/svg+xml/22367cc06342c8277ef98675f742ece4/si83.svg si83 si83.svg svg 75773 ALTIMG 1-s2.0-S2352710224022629-si76.svg https://s3-eu-west-1.amazonaws.com/prod-ucs-content-store-eu-west/content/pii:S2352710224022629/image/svg+xml/33f93a339a1065533a876758f03c3749/si76.svg si76 si76.svg svg 9190 ALTIMG 1-s2.0-S2352710224022629-si47.svg https://s3-eu-west-1.amazonaws.com/prod-ucs-content-store-eu-west/content/pii:S2352710224022629/image/svg+xml/ec73f82758bd1fd9a4f2cd9bfe0fada0/si47.svg si47 si47.svg svg 13548 ALTIMG 1-s2.0-S2352710224022629-si27.svg https://s3-eu-west-1.amazonaws.com/prod-ucs-content-store-eu-west/content/pii:S2352710224022629/image/svg+xml/8c32f4c0f211e3a372f641bdcfb893b0/si27.svg si27 si27.svg svg 3940 ALTIMG 1-s2.0-S2352710224022629-si49.svg https://s3-eu-west-1.amazonaws.com/prod-ucs-content-store-eu-west/content/pii:S2352710224022629/image/svg+xml/26bb4088af6402dd3f8525bdc38053ab/si49.svg si49 si49.svg svg 33474 ALTIMG 1-s2.0-S2352710224022629-si126.svg https://s3-eu-west-1.amazonaws.com/prod-ucs-content-store-eu-west/content/pii:S2352710224022629/image/svg+xml/22987910a1807a77083734310477f3bc/si126.svg si126 si126.svg svg 15151 ALTIMG 1-s2.0-S2352710224022629-si24.svg https://s3-eu-west-1.amazonaws.com/prod-ucs-content-store-eu-west/content/pii:S2352710224022629/image/svg+xml/3cd4ef3a1782efa545e7b8027d1aa4e4/si24.svg si24 si24.svg svg 6504 ALTIMG 1-s2.0-S2352710224022629-si22.svg https://s3-eu-west-1.amazonaws.com/prod-ucs-content-store-eu-west/content/pii:S2352710224022629/image/svg+xml/fb22e5cd8242b2e116d2419bd68e0b8f/si22.svg si22 si22.svg svg 9936 ALTIMG 1-s2.0-S2352710224022629-si158.svg https://s3-eu-west-1.amazonaws.com/prod-ucs-content-store-eu-west/content/pii:S2352710224022629/image/svg+xml/3b4f36d6d78f4b32a05e5b4706f2191e/si158.svg si158 si158.svg svg 22038 ALTIMG 1-s2.0-S2352710224022629-si21.svg https://s3-eu-west-1.amazonaws.com/prod-ucs-content-store-eu-west/content/pii:S2352710224022629/image/svg+xml/88ac649adcaba2fd3e2afab61b9acf32/si21.svg si21 si21.svg svg 13381 ALTIMG 1-s2.0-S2352710224022629-si148.svg https://s3-eu-west-1.amazonaws.com/prod-ucs-content-store-eu-west/content/pii:S2352710224022629/image/svg+xml/ed8b0093dde5862359f41839e4c0ac7a/si148.svg si148 si148.svg svg 44490 ALTIMG 1-s2.0-S2352710224022629-si10.svg https://s3-eu-west-1.amazonaws.com/prod-ucs-content-store-eu-west/content/pii:S2352710224022629/image/svg+xml/2bd2efbce6c04ce4ecc4411b16dc992a/si10.svg si10 si10.svg svg 7018 ALTIMG 1-s2.0-S2352710224022629-si108.svg https://s3-eu-west-1.amazonaws.com/prod-ucs-content-store-eu-west/content/pii:S2352710224022629/image/svg+xml/e2904fc76b4729c9e8ffafc1e4bedd76/si108.svg si108 si108.svg svg 18034 ALTIMG 1-s2.0-S2352710224022629-si52.svg https://s3-eu-west-1.amazonaws.com/prod-ucs-content-store-eu-west/content/pii:S2352710224022629/image/svg+xml/ba4f171d53058a6f50428e53b27a51ac/si52.svg si52 si52.svg svg 8804 ALTIMG 1-s2.0-S2352710224022629-si74.svg https://s3-eu-west-1.amazonaws.com/prod-ucs-content-store-eu-west/content/pii:S2352710224022629/image/svg+xml/b870c147116a1cc2136144fcbfeee71e/si74.svg si74 si74.svg svg 41916 ALTIMG 1-s2.0-S2352710224022629-si82.svg https://s3-eu-west-1.amazonaws.com/prod-ucs-content-store-eu-west/content/pii:S2352710224022629/image/svg+xml/b056ef4b1fd87164cb104739f9f577eb/si82.svg si82 si82.svg svg 81693 ALTIMG 1-s2.0-S2352710224022629-si132.svg https://s3-eu-west-1.amazonaws.com/prod-ucs-content-store-eu-west/content/pii:S2352710224022629/image/svg+xml/3ad072baff05d43578bdb19041e56806/si132.svg si132 si132.svg svg 16387 ALTIMG 1-s2.0-S2352710224022629-si19.svg https://s3-eu-west-1.amazonaws.com/prod-ucs-content-store-eu-west/content/pii:S2352710224022629/image/svg+xml/ecd3a745b8ff51b337d512255d14c355/si19.svg si19 si19.svg svg 4361 ALTIMG 1-s2.0-S2352710224022629-si35.svg https://s3-eu-west-1.amazonaws.com/prod-ucs-content-store-eu-west/content/pii:S2352710224022629/image/svg+xml/a6ef46f02f68fcd047a5f4508aa8085a/si35.svg si35 si35.svg svg 6728 ALTIMG 1-s2.0-S2352710224022629-si143.svg https://s3-eu-west-1.amazonaws.com/prod-ucs-content-store-eu-west/content/pii:S2352710224022629/image/svg+xml/fb1a29b29da31369dacd27309181ad0f/si143.svg si143 si143.svg svg 49408 ALTIMG 1-s2.0-S2352710224022629-si36.svg https://s3-eu-west-1.amazonaws.com/prod-ucs-content-store-eu-west/content/pii:S2352710224022629/image/svg+xml/f5c981fe7b0637a2f96d0b8bb01e3327/si36.svg si36 si36.svg svg 11931 ALTIMG 1-s2.0-S2352710224022629-si137.svg https://s3-eu-west-1.amazonaws.com/prod-ucs-content-store-eu-west/content/pii:S2352710224022629/image/svg+xml/11c4f8b1e6f16b05963db06dfad28d7a/si137.svg si137 si137.svg svg 31191 ALTIMG 1-s2.0-S2352710224022629-si75.svg https://s3-eu-west-1.amazonaws.com/prod-ucs-content-store-eu-west/content/pii:S2352710224022629/image/svg+xml/06c7cb9519d0ea13768c9d57fdd7a4c3/si75.svg si75 si75.svg svg 11602 ALTIMG 1-s2.0-S2352710224022629-si117.svg https://s3-eu-west-1.amazonaws.com/prod-ucs-content-store-eu-west/content/pii:S2352710224022629/image/svg+xml/1323fce87369bed4055a575e9cfe7376/si117.svg si117 si117.svg svg 51889 ALTIMG 1-s2.0-S2352710224022629-si51.svg https://s3-eu-west-1.amazonaws.com/prod-ucs-content-store-eu-west/content/pii:S2352710224022629/image/svg+xml/410c0307908a776535f7be7403d77e19/si51.svg si51 si51.svg svg 13916 ALTIMG 1-s2.0-S2352710224022629-si58.svg https://s3-eu-west-1.amazonaws.com/prod-ucs-content-store-eu-west/content/pii:S2352710224022629/image/svg+xml/222bc593ff96842b9e7b9ceb1e7b6d72/si58.svg si58 si58.svg svg 15185 ALTIMG 1-s2.0-S2352710224022629-si16.svg https://s3-eu-west-1.amazonaws.com/prod-ucs-content-store-eu-west/content/pii:S2352710224022629/image/svg+xml/e0ec18be5783020c3bb7afca86333afa/si16.svg si16 si16.svg svg 8537 ALTIMG 1-s2.0-S2352710224022629-si144.svg https://s3-eu-west-1.amazonaws.com/prod-ucs-content-store-eu-west/content/pii:S2352710224022629/image/svg+xml/cce5ef358d880d246e1e211a9dcc4799/si144.svg si144 si144.svg svg 14014 ALTIMG 1-s2.0-S2352710224022629-si14.svg https://s3-eu-west-1.amazonaws.com/prod-ucs-content-store-eu-west/content/pii:S2352710224022629/image/svg+xml/4bb54df9c0d26040652f85276f5fc2f4/si14.svg si14 si14.svg svg 17547 ALTIMG 1-s2.0-S2352710224022629-si4.svg https://s3-eu-west-1.amazonaws.com/prod-ucs-content-store-eu-west/content/pii:S2352710224022629/image/svg+xml/92ee49eb4bce309b68289ac5a0fafa7c/si4.svg si4 si4.svg svg 12770 ALTIMG 1-s2.0-S2352710224022629-si41.svg https://s3-eu-west-1.amazonaws.com/prod-ucs-content-store-eu-west/content/pii:S2352710224022629/image/svg+xml/eb33817018e502832511f33376a6e8f2/si41.svg si41 si41.svg svg 70654 ALTIMG 1-s2.0-S2352710224022629-si86.svg https://s3-eu-west-1.amazonaws.com/prod-ucs-content-store-eu-west/content/pii:S2352710224022629/image/svg+xml/139412bd24e7a4360ee906be6865d61f/si86.svg si86 si86.svg svg 41002 ALTIMG 1-s2.0-S2352710224022629-si111.svg https://s3-eu-west-1.amazonaws.com/prod-ucs-content-store-eu-west/content/pii:S2352710224022629/image/svg+xml/63d25b751572be0780ef73279d877d78/si111.svg si111 si111.svg svg 5484 ALTIMG 1-s2.0-S2352710224022629-si147.svg https://s3-eu-west-1.amazonaws.com/prod-ucs-content-store-eu-west/content/pii:S2352710224022629/image/svg+xml/3873e951118b327d1c98e23ee27bec8b/si147.svg si147 si147.svg svg 37808 ALTIMG 1-s2.0-S2352710224022629-si18.svg https://s3-eu-west-1.amazonaws.com/prod-ucs-content-store-eu-west/content/pii:S2352710224022629/image/svg+xml/8753cbb1be0a6b2d4818bfc9db27367f/si18.svg si18 si18.svg svg 10436 ALTIMG 1-s2.0-S2352710224022629-si141.svg https://s3-eu-west-1.amazonaws.com/prod-ucs-content-store-eu-west/content/pii:S2352710224022629/image/svg+xml/77df848beaaa18061e48b1a5cdb7f0fc/si141.svg si141 si141.svg svg 39351 ALTIMG 1-s2.0-S2352710224022629-si155.svg https://s3-eu-west-1.amazonaws.com/prod-ucs-content-store-eu-west/content/pii:S2352710224022629/image/svg+xml/71c20ac68878a59483ccf184950dc0a5/si155.svg si155 si155.svg svg 33427 ALTIMG 1-s2.0-S2352710224022629-si59.svg https://s3-eu-west-1.amazonaws.com/prod-ucs-content-store-eu-west/content/pii:S2352710224022629/image/svg+xml/a823e722632473c59e628d78c2a0f4d5/si59.svg si59 si59.svg svg 11402 ALTIMG 1-s2.0-S2352710224022629-si60.svg https://s3-eu-west-1.amazonaws.com/prod-ucs-content-store-eu-west/content/pii:S2352710224022629/image/svg+xml/52ca7bfb24e1d695be870ca88e03c219/si60.svg si60 si60.svg svg 14619 ALTIMG 1-s2.0-S2352710224022629-si39.svg https://s3-eu-west-1.amazonaws.com/prod-ucs-content-store-eu-west/content/pii:S2352710224022629/image/svg+xml/5c347f850d390e80dceab3e80c24474e/si39.svg si39 si39.svg svg 5133 ALTIMG 1-s2.0-S2352710224022629-si154.svg https://s3-eu-west-1.amazonaws.com/prod-ucs-content-store-eu-west/content/pii:S2352710224022629/image/svg+xml/99b082b53aca073301f3c2189b726f0f/si154.svg si154 si154.svg svg 33332 ALTIMG 1-s2.0-S2352710224022629-si92.svg https://s3-eu-west-1.amazonaws.com/prod-ucs-content-store-eu-west/content/pii:S2352710224022629/image/svg+xml/9d0e07c64570911d793a703d9b157a40/si92.svg si92 si92.svg svg 37804 ALTIMG 1-s2.0-S2352710224022629-si29.svg https://s3-eu-west-1.amazonaws.com/prod-ucs-content-store-eu-west/content/pii:S2352710224022629/image/svg+xml/424d190d7c8012ca899a5ea8d76b194f/si29.svg si29 si29.svg svg 8474 ALTIMG 1-s2.0-S2352710224022629-si30.svg https://s3-eu-west-1.amazonaws.com/prod-ucs-content-store-eu-west/content/pii:S2352710224022629/image/svg+xml/23759f71f0c67c2dfeea886bfe77e665/si30.svg si30 si30.svg svg 5803 ALTIMG 1-s2.0-S2352710224022629-si48.svg https://s3-eu-west-1.amazonaws.com/prod-ucs-content-store-eu-west/content/pii:S2352710224022629/image/svg+xml/0752acb33b0cf104e195d8f6f998af73/si48.svg si48 si48.svg svg 21960 ALTIMG 1-s2.0-S2352710224022629-si23.svg https://s3-eu-west-1.amazonaws.com/prod-ucs-content-store-eu-west/content/pii:S2352710224022629/image/svg+xml/3f31e8b57e8e43d6ecf9892b3de00c67/si23.svg si23 si23.svg svg 11348 ALTIMG 1-s2.0-S2352710224022629-si65.svg https://s3-eu-west-1.amazonaws.com/prod-ucs-content-store-eu-west/content/pii:S2352710224022629/image/svg+xml/3d09ce53b5626933088fc0c47c22d724/si65.svg si65 si65.svg svg 33238 ALTIMG 1-s2.0-S2352710224022629-si84.svg https://s3-eu-west-1.amazonaws.com/prod-ucs-content-store-eu-west/content/pii:S2352710224022629/image/svg+xml/da6ce04e1f1972275119fc5eb8bae59d/si84.svg si84 si84.svg svg 47874 ALTIMG 1-s2.0-S2352710224022629-si127.svg https://s3-eu-west-1.amazonaws.com/prod-ucs-content-store-eu-west/content/pii:S2352710224022629/image/svg+xml/131b20eca8cabe8ec926683bf0f7f001/si127.svg si127 si127.svg svg 9049 ALTIMG 1-s2.0-S2352710224022629-si121.svg https://s3-eu-west-1.amazonaws.com/prod-ucs-content-store-eu-west/content/pii:S2352710224022629/image/svg+xml/7d59098b27734a4258b19db156ac5c73/si121.svg si121 si121.svg svg 5576 ALTIMG 1-s2.0-S2352710224022629-si136.svg https://s3-eu-west-1.amazonaws.com/prod-ucs-content-store-eu-west/content/pii:S2352710224022629/image/svg+xml/205965f30b68b7646922fd90eb95f8f1/si136.svg si136 si136.svg svg 35075 ALTIMG 1-s2.0-S2352710224022629-si133.svg https://s3-eu-west-1.amazonaws.com/prod-ucs-content-store-eu-west/content/pii:S2352710224022629/image/svg+xml/5ac4845b78ce036b04db7b26542aea51/si133.svg si133 si133.svg svg 38584 ALTIMG 1-s2.0-S2352710224022629-si69.svg https://s3-eu-west-1.amazonaws.com/prod-ucs-content-store-eu-west/content/pii:S2352710224022629/image/svg+xml/7bbd27a7f88df3fe288686a2bc90bc5c/si69.svg si69 si69.svg svg 14010 ALTIMG 1-s2.0-S2352710224022629-si43.svg https://s3-eu-west-1.amazonaws.com/prod-ucs-content-store-eu-west/content/pii:S2352710224022629/image/svg+xml/330fce1d6ec5bc010c6ac043b12bc3e0/si43.svg si43 si43.svg svg 48366 ALTIMG 1-s2.0-S2352710224022629-si130.svg https://s3-eu-west-1.amazonaws.com/prod-ucs-content-store-eu-west/content/pii:S2352710224022629/image/svg+xml/b66de30d06f6c74f0604cfce82c02b4b/si130.svg si130 si130.svg svg 10794 ALTIMG 1-s2.0-S2352710224022629-si31.svg https://s3-eu-west-1.amazonaws.com/prod-ucs-content-store-eu-west/content/pii:S2352710224022629/image/svg+xml/85ba17989eb53d4a71362e7ec2d4a124/si31.svg si31 si31.svg svg 6092 ALTIMG 1-s2.0-S2352710224022629-si91.svg https://s3-eu-west-1.amazonaws.com/prod-ucs-content-store-eu-west/content/pii:S2352710224022629/image/svg+xml/8777194dc730fb7c71a6d5ac0b1728f8/si91.svg si91 si91.svg svg 23499 ALTIMG 1-s2.0-S2352710224022629-si77.svg https://s3-eu-west-1.amazonaws.com/prod-ucs-content-store-eu-west/content/pii:S2352710224022629/image/svg+xml/740cf2ea0ac27afa4243dba89cec47f4/si77.svg si77 si77.svg svg 27473 ALTIMG 1-s2.0-S2352710224022629-si150.svg https://s3-eu-west-1.amazonaws.com/prod-ucs-content-store-eu-west/content/pii:S2352710224022629/image/svg+xml/ec8674906d827ac3de3f7836d55dfd6e/si150.svg si150 si150.svg svg 19312 ALTIMG 1-s2.0-S2352710224022629-si46.svg https://s3-eu-west-1.amazonaws.com/prod-ucs-content-store-eu-west/content/pii:S2352710224022629/image/svg+xml/fa232ac733af762f4e3f0bd206b4c31d/si46.svg si46 si46.svg svg 17070 ALTIMG 1-s2.0-S2352710224022629-si2.svg https://s3-eu-west-1.amazonaws.com/prod-ucs-content-store-eu-west/content/pii:S2352710224022629/image/svg+xml/dfc28b7c78beb2bfa00f3581d294b179/si2.svg si2 si2.svg svg 4699 ALTIMG 1-s2.0-S2352710224022629-si128.svg https://s3-eu-west-1.amazonaws.com/prod-ucs-content-store-eu-west/content/pii:S2352710224022629/image/svg+xml/e73a4900258c8d9dae3d6f5c6d9db006/si128.svg si128 si128.svg svg 44931 ALTIMG 1-s2.0-S2352710224022629-si119.svg https://s3-eu-west-1.amazonaws.com/prod-ucs-content-store-eu-west/content/pii:S2352710224022629/image/svg+xml/d2ff231107ddd9928085832f7c4ea1bb/si119.svg si119 si119.svg svg 63761 ALTIMG 1-s2.0-S2352710224022629-si112.svg https://s3-eu-west-1.amazonaws.com/prod-ucs-content-store-eu-west/content/pii:S2352710224022629/image/svg+xml/8144f877f67cfcd1b267750085eff378/si112.svg si112 si112.svg svg 73006 ALTIMG 1-s2.0-S2352710224022629-si90.svg https://s3-eu-west-1.amazonaws.com/prod-ucs-content-store-eu-west/content/pii:S2352710224022629/image/svg+xml/f8412d5ffd4e07f82d62b310ff3af282/si90.svg si90 si90.svg svg 30049 ALTIMG 1-s2.0-S2352710224022629-si109.svg https://s3-eu-west-1.amazonaws.com/prod-ucs-content-store-eu-west/content/pii:S2352710224022629/image/svg+xml/08a3ee4b3fa99ff52eb681ac107ace70/si109.svg si109 si109.svg svg 14759 ALTIMG 1-s2.0-S2352710224022629-si50.svg https://s3-eu-west-1.amazonaws.com/prod-ucs-content-store-eu-west/content/pii:S2352710224022629/image/svg+xml/e6949a811b4480ecfebcbc8b673ab49f/si50.svg si50 si50.svg svg 19530 ALTIMG 1-s2.0-S2352710224022629-si6.svg https://s3-eu-west-1.amazonaws.com/prod-ucs-content-store-eu-west/content/pii:S2352710224022629/image/svg+xml/e7f5165122dfdc7d076cd98b28b8fee6/si6.svg si6 si6.svg svg 12293 ALTIMG 1-s2.0-S2352710224022629-si7.svg https://s3-eu-west-1.amazonaws.com/prod-ucs-content-store-eu-west/content/pii:S2352710224022629/image/svg+xml/44419baff583abe3b8763fc652a1ad17/si7.svg si7 si7.svg svg 37983 ALTIMG 1-s2.0-S2352710224022629-si153.svg https://s3-eu-west-1.amazonaws.com/prod-ucs-content-store-eu-west/content/pii:S2352710224022629/image/svg+xml/c7e243ecf3c6db1985d582bbe027a551/si153.svg si153 si153.svg svg 6172 ALTIMG 1-s2.0-S2352710224022629-si53.svg https://s3-eu-west-1.amazonaws.com/prod-ucs-content-store-eu-west/content/pii:S2352710224022629/image/svg+xml/14cf7222a63bc0d5a7a1c414db9d5d7e/si53.svg si53 si53.svg svg 10846 ALTIMG 1-s2.0-S2352710224022629-si125.svg https://s3-eu-west-1.amazonaws.com/prod-ucs-content-store-eu-west/content/pii:S2352710224022629/image/svg+xml/8f48812219370436ba2c3ae4ece004aa/si125.svg si125 si125.svg svg 22239 ALTIMG 1-s2.0-S2352710224022629-am.pdf https://s3-eu-west-1.amazonaws.com/prod-ucs-content-store-eu-west/content/egi:1015GDH20N4/MAIN/application/pdf/107253f376eca9e085b633d8ff2df045/am.pdf am am.pdf pdf false 1562042 AAM-PDF JOBE 110694 110694 S2352-7102(24)02262-9 10.1016/j.jobe.2024.110694 Fig. 1 Co-simulation flowchart illustrating the data interactions within the virtual environment. Fig. 1 Fig. 2 Geometry of the EnergyPlus room model, showcasing the layout with an east-facing window. Fig. 2 Fig. 3 Dynamic radiator model segmented into N S horizontal sections, accompanied by inlet and outlet pipes, and the thermostatic radiator valve. Fig. 3 Fig. 4 Data generated for use in system identification: Setpoints and room temperature (top), heat power consumption versus proxy input (middle), and external temperature and solar radiation (bottom). Fig. 4 Fig. 5 Predictions of models based on heat power ( Q ˙ h ) and proxy input ( u p ) compared to the actual EnergyPlus room temperature. (a) One-step ahead predictions and (b) 24-step ahead predictions with fit percentages. Fig. 5 Fig. 6 Top: Indoor temperatures for the proxy-based EMPC (red), Baseline EMPC (blue), and PI (black). Temperature constraints are marked by green lines at 20 °C and 22.5 °C. Middle: Purchased district heating by the proxy-based EMPC (red), the baseline EMPC (blue), and PI (black) against time-of-use prices (green). Bottom: Outdoor temperature (black) and solar radiation intensities (red). Fig. 6 Fig. 7 Variation of costs and fit percentages with respect to radiator exponent. The point at radiator exponent = 1.3 is highlighted as the true value. Costs are shown in blue on the left y-axis, while fit percentages are represented in red on the right y-axis. Fig. 7 Fig. 8 Top: Water mass flow for the baseline (constant setpoint) and EMPC without an upper limit on u p . Bottom: Radiator surface temperatures of Sections 1, 10, and 20 for the baseline (solid) EMPC (dashed). Fig. 8 Fig. 9 Top: Water mass flow for the baseline (constant setpoint) and EMPC with an u p ≤ 55 . Bottom: Radiator surface temperatures of Sections 1, 10, and 20 for the baseline (solid) and EMPC (dashed). Fig. 9 Fig. 10 Trade-off between u p , max and changes in cost and weighted return temperature relative to a constant setpoint reference. The secondary x-axis indicates corresponding maximum return temperature T r e t u r n , max . The dotted green vertical line indicates the radiators true u p , max . Fig. 10 Table 1 Constructions and material properties utilized in the room model. Table 1 Material Thickness Conductivity Density Specific Heat (Starting outside) [m] [W/(m·K)] [kg/m3] [J/(kg·K)] External Walls Concrete (HW) 0.15 1.95 2240 900 Insulation 0.1 0.03 43 1210 Brick 0.1 0.89 1920 790 Internal Walls Gypsum 0.019 0.16 800 1090 Insulation 0.1 0.03 43 1210 Gypsum 0.019 0.16 800 1090 Floor Insulation 0.05 0.03 43 1210 Concrete (HW) 0.2 1.95 2240 900 Ceiling Concrete (LW) 0.1 0.53 1280 840 Insulation 0.1 0.03 43 1210 Acoustic tile 0.019 0.06 368 590 Window Clear glass 0.003 \u2013 \u2013 \u2013 Air gap 0.012 \u2013 \u2013 \u2013 Clear glass 0.003 \u2013 \u2013 \u2013 Table 2 Simulation specific parameter values for the radiator model. Table 2 Parameter Value Unit N S 20 \u2013 T r o o m , N o m 20 °C T i n , N o m 70 °C T o u t , N o m 30 °C U ∙ A 10.7 W / K β R , N o m 0.3 \u2013 C R a d 65 k J / K m ˙ w , max 0.0126 k g / s n 1.3 \u2013 A heat-measurement-free strategy for Economic Model Predictive Control of hydronic radiators Michael Dahl Knudsen Writing \u2013 original draft Visualization Validation Methodology Investigation Formal analysis Data curation Conceptualization \u204e Massimo Fiorentini Writing \u2013 review & editing Steffen Petersen Writing \u2013 review & editing Department of Civil and Architectural Engineering, Aarhus University, Aarhus, Denmark Department of Civil and Architectural Engineering Aarhus University Aarhus Denmark Department of Civil and Architectural Engineering, Aarhus University, Aarhus, Denmark \u204e Corresponding author. Cost-efficient measurement of room-level heat output from hydronic radiators is a major barrier to large-scale implementation of Economic Model Predictive Control (EMPC) in residential space heating for demand-side management. This paper therefore presents a novel EMPC strategy for hydronic radiators that relies on measurements of radiator pipe temperatures as a proxy for the radiator heat output, thus eliminating the need for costly flow-based meters at each radiator in a building. Simulation-based experiments indicate that the proposed proxy-based EMPC matches the performance of its heat-based counterpart. The proxy-based EMPC achieved a 16.6 % cost reduction compared to the heat-based EMPC's 16.8 %, with no comfort violations in both cases. Furthermore, the strategy shows resilience towards uncertainties in the user-estimated radiator exponent and maximum heating capacity. The proposed EMPC scheme also allows system operators to fine-tune the balance between cost savings and return temperatures using the proxy's upper limit. The findings presented in this paper suggest that the proposed proxy-based EMPC scheme provides a practical pathway for broader applications of EMPC in hydronic-based space heating with the prospect of unlocking significant load shifting potential, cost savings for end-users, and enhanced efficiency in individual and collective energy systems. Keywords Economic model predictive control Hydronic radiators Co-simulations Load-shifting Room-level heating Data availability Data will be made available on request. Nomenclature Abbreviations EMPC economic model predictive control LTI linear time-invariant PID proportional-integral-derivate PI proportional-integral COP coefficient of performance PEM prediction error minimization Symbols k EMPC time index (hours) i EnergyPlus simulation time index (minutes) u p proxy input [°Cn] Q ˙ h heat power consumed by radiator [W] Q ˙ e heat power emitted (convection and radiation) from the radiator to the room [W] Q ˙ s solar irradiation [W] Q ˙ r a d i a t i o n radiative heat power [W] Q ˙ c o n v e c t i o n convective heat power [W] Q s t o r e d stored energy [J] T temperature of radiator section j [°C] T r o o m room air temperature [°C] T r o o m s e t radiator thermostat setpoint [°C] T e x t external air temperature [°C] Δ T lg logarithmic temperature difference [°C] C R a d heat capacity of radiator (meat and water) [J/K] m ˙ mass flow [kg/s] n radiator exponent c p specific heat capacity of water [J/(kg K)] v valve opening status [%] α radiator constant [W·K−n] β R radiative fraction [−] β C convective fraction [−] N s number of discretization sections in the radiator [−] N number of timesteps in the prediction horizon [−] K p proportional gain [−] K i integral gain c cost of district heating [DKK/kWh] x state vector x ˆ state vector estimate u input vector d disturbance vector e prediction error (innovation) y output vector A state matrix B input matrix B p input matrix (proxy-based) E disturbance matrix K Kalman gain C output matrix Subscripts nom nominal (standard conditions) w water j radiator section in inlet out outlet 1 Introduction Research in Economic Model Predictive Control (EMPC) of space heating systems in residential buildings has indicated that the building thermal mass can be exploited for load shifting in district heating systems [1\u20136] and in the operation of domestic heat pumps [7]. EMPC of space heating in residential buildings should be managed on room level to maximize the load shifting potential while ensuring thermal comfort for the residents. This is also the suggested approach in several simulation-based studies, see e.g. Refs. [7\u20139] to mention a few, and in experimental studies [10\u201313]. However, while EMPC on room level has demonstrated load shifting potential, its transition from academic research to large-scale practical application in buildings encounters several barriers. A major barrier according to Killian and Kozek [14] and Knudsen et al. [13] is to come up with cost-effective concepts for room-based EMPC. Additional capital costs for the realization of EMPC should thus be minimized like in Hedegaard et al. [15] who introduced an EMPC concept where the need for investing in equipment for local weather data measurements was eliminated. There have also been several research-based efforts to minimize the capital cost for obtaining a control model fit for EMPC \u2013 a process that is a time-consuming (and thus expensive) part of implementing an EMPC in practice [16\u201318]. Recently, Knudsen et al. [13] demonstrated experimentally that sufficient predictive performance can be obtained by training a linear black-box model thus reducing the modeling effort. However, there are still several practical barriers to the cost-efficient realization of EMPC at room level in residential buildings; the paper by Amato et al. [19] provides an extensive list of barriers identified in a recent field experiment. A critical barrier to the realization of a room-level EMPC is obtaining the measurement of the space heating output from individual radiators, especially in a cost-efficient way. This is critical as a room-level EMPC relies on measurements of the heat output in the room to identify the parameters of a control model, and to update state estimates during operation. The state-of-the-art for large-scale measurement of heat consumption in residential buildings is metering on building level using 1 m that measures the total heat consumption for space heating, domestic hot water preparation, and heat losses [20]. Real buildings are rarely equipped with more than a central heat meter which is likely why many studies on EMPC for heating systems treat the building as one fully-mixed thermal zone [13,21\u201323]. In simulation-based studies of room-level EMPC, the practical challenge of obtaining heat output at room-level is conveniently ignored [8,9,15,24\u201326]. Some experimental studies turn to electric heaters which offer simple equipment for measurements of heat output [27\u201329] but this is not a solution for buildings heated by hydronic radiators. In the case of hydronic radiators, it is possible to install dedicated meters for each radiator; however, this is not feasible due to capital and maintenance costs. To elaborate, heat meters for individual radiators present several practical challenges. 1) High initial costs: Heat meters typically cost several hundred euros per unit, making their installation across multiple rooms in a building a significant investment. 2) Installation complexity: Retrofitting existing radiators with heat meters requires modifications to the piping system, which can be invasive and time-consuming. 3) Calibration needs. To ensure accurate readings, heat meters require periodic calibration. This is particularly crucial for clamp-on ultrasonic-based meters, which are often used in retrofit applications. 4) Infrastructure limitations: Off-the-shelf heat meters are generally not battery-operated, necessitating connection to the building's electrical system. Furthermore, they often lack built-in wireless data transmission capabilities, complicating data collection and management. Amato et al. [30] suggested a novel dual-zone EMPC concept that avoided investments in additional heat meters for EMPC of space heating in single-family homes with a hydronic radiator system. However, while this approach might work for some residential buildings, it is not generally applicable for homes with several distinct thermal zones. Zong et al. [12] used a control strategy where radiator valves were either fully open or fully closed. Thus, the heat output at room level is known if the radiator heat output at a fully open valve position is known. However, in real-world hydronic systems, the heat output at a fully open valve is rarely known a priori, and this local heat output in a larger hydronic heating system may even vary over time due to varying supply temperature and pressure conditions. Bünning et al. [31] utilized information on valve opening status to approximate heat consumption assuming a linear and constant relationship between valve opening and heat power. However, this may not be a practical approach as most valves do not have a linear characteristic, and the characteristic in real buildings is often not constant due to varying pressure and supply temperature, see e.g. Amato et al. [21]. The above review makes it evident that there is a lack of cost-efficient measurement of room-level heat output from hydronic radiators which is a major barrier to large-scale implementation of EMPC for residential space heating. This paper presents a proposal for a novel method to obtain information about the real-time heat output from an individual hydronic radiator, based on the radiator's pipes temperature measurements as a proxy for heat input, and its implementation within an EMPC formulation. This approach offers a more scalable solution compared to more expensive flow-based heat measurements. The paper is structured as follows. The method section describes a proposed proxy-based EMPC, its underlying theory, and a virtual setup for a proof-of-concept simulation. This is followed by a section featuring results which subsequently are discussed and concluded upon. 2 Method 2.1 Baseline EMPC A typical model predictive control framework for operating building energy systems is notably versatile, accommodating a wide array of optimization formulations [14,32]. In the context of EMPC where minimizing energy costs is the objective, a linear programming approach is often both convenient and effective for describing the optimization problem: (1) J = min Q ˙ h ∑ k = 0 N − 1 c k Q ˙ h k This is subject to the following constraints: (1.a) x ( k + 1 ) = A x ( k ) + B Q ˙ h ( k ) + E d ( k ) + K e ( k ) (1.b) T r o o m ( k ) = C x ( k ) (1.c) 0 ≤ Q ˙ h ( k ) ≤ Q ˙ h , max ( k ) (1.d) T r o o m , min ( k + 1 ) ≤ T r o o m ( k + 1 ) ≤ T r o o m , max ( k + 1 ) (1.e) Δ T r o o m , min ( k + 1 ) ] ≤ Δ T r o o m ( k + 1 ) ≤ Δ T r o o m , max ( k + 1 ) (1.f) x ( 0 ) = x ˆ ( 0 ) The objective function in equation (1) minimizes the cumulative cost of space heating over the prediction horizon N , where c ( k ) represents a time-varying heating cost and Q ˙ h ( k ) denotes the heating power at a time step k = { 0 , 1 , \u2026 , N − 1 } . Constraints (1.a) and (1.b) are the state and output equations of a discrete-time state-space model in its innovations form which represent the thermal behavior of the building. The state vector x ∈ R ² represents the internal states of the second-order black box model. In this study, we employed the Prediction Error Minimization (PEM) method for system identification [33]. The PEM method estimates all model parameters, including the A, B, C, E, and Kalman gain K, by iteratively minimizing the squared difference between the model's one-step ahead predictions and the actual system outputs. We used the canonical controllable form for the state-space model, where the C matrix is structured as C = [ 1 0 ] . This formulation allows us to interpret the first state x 1 as the room temperature. The second state x 2 , while not directly mappable to a specific physical quantity, captures additional dynamics of the thermal system. Together, these two states provide a reduced-order representation of the room's thermal behavior. The input vector u represents control actions, which in this study was the radiator heat power ( Q ˙ h ) . The disturbance vector d accounts for uncontrollable external factors, which in this study was outdoor air temperature ( T e x t ) and solar irradiance ( Q ˙ s ) . The observable output y is the room air temperature ( T r o o m ). The innovation term e is the output prediction error which is used to correct the model predictions. In the optimization problem, e ( k ) can only be known up to the current time step ( k = 0 ) , as future prediction errors are unknown. Therefore, e ( 0 ) is set to the current known value, while e ( k ) is assumed to be zero for all future time steps ( k ≥ 1 ) . This assumption of zero for future innovations is justified because the expected value of the innovation term is zero, which follows from the properties of the system identification process. Specifically, techniques like PEM yield models where prediction errors have zero mean for the training data, making zero the best estimate for future, unknown innovations. The system dynamics are encapsulated in the following matrices. \u2022 A ∈ R 2 x 2 describes the evolution of states without external inputs \u2022 B ∈ R 2 x 1 maps the influence of control actions on the states \u2022 E ∈ R 2 x 2 links disturbances to state changes \u2022 C ∈ R 1 x 2 correlates states to observable outputs \u2022 K ∈ R 2 x 1 (Kalman gain) refines state predictions based on the innovation While these matrices can be derived from physical principles (white-box modeling), this approach is often impractical. Instead, a data-driven approach using empirical time series of system inputs ( u , d ) and outputs ( y ) is typically employed. This method results in either grey-box models, which incorporate prior knowledge of the physical configuration, or black-box models that represent purely empirical input-output relationships. Constraints (1.c) define the operational limits for the radiator's heat output. Constraints (1.d) and (1.e) specify the acceptable room temperature bounds and rate-of-change, respectively. Although not shown in the mathematical program for simplicity, slack variables are introduced in our implementation to transform these into soft constraints, ensuring solution feasibility. Constraint (1.f) establishes the initial state at the beginning of the prediction horizon, aligning the model with real-world dynamics based on current measurements. Since x ( 0 ) is not directly measurable, a state estimate, x ˆ ( 0 ) is derived from the previous state estimate x ˆ ( − 1 ) and recent measurements ( k = − 1 ) of Q ˙ h and d : (2) x ˆ ( 0 ) = A x ˆ ( − 1 ) + B Q ˙ h ( − 1 ) + E d ( − 1 ) + K ( T r o o m ( − 1 ) − C x ˆ ( − 1 ) ) Implementing this heat-based EMPC for room-level control requires heat measurements at the room-level: historical heat output is essential for constructing the thermal room model, and real-time heat measurements are necessary to continuously updating the state estimate ( x ˆ ) . Furthermore, knowledge of the maximum radiator heat output ( Q ˙ h , max ) is assumed, which presents a significant challenge due to its dependency on variable conditions such as supply temperature and system pressure. 2.2 EMPC with proxy heat measurement Given the cost and the impracticalities of conducting flow-based heat measurements for individual radiators, it is proposed to introduce the use of a proxy variable based on radiator pipe temperatures. Temperature sensors are relatively inexpensive and non-intrusive compared to flow-based heat measurement devices, providing a potentially more scalable alternative for practical implementation. The proposed proxy variable ( u p ) leverages the steady-state heat output formula for a radiator, as detailed in Ref. [34]: (3) Q ˙ r = α Δ T n = α u p Here, Q ˙ r denotes the heat power emitted from the radiator including both convection and radiation. The constant α is influenced by the size of the radiator while the radiator exponent n usually ranging from 1.1 to 1.4 reflects the balance between the radiation and convection components [35]. The term Δ T represents the temperature difference between the mean water temperature within the radiator and the room temperature. The last equality posits u p = Δ T n as the proposed proxy variable, where Δ T can be calculated using the logarithmic mean temperature difference: (4) Δ T lg = T i n − T o u t ln ( T i n − T r o o m T o u t − T r o o m ) To employ Δ T lg n as a proxy for radiator heat consumption, it is necessary to acquire the inlet and outlet temperatures ( T i n , T o u t ) , alongside the room temperature ( T r o o m ) and the radiator exponent n . Assuming room temperature measurements are already available, the inlet and outlet temperatures can be deduced from the surface temperatures of the radiator inlet and outlet pipes. With the proxy defined in Equation (4), the heat-based optimization in equations 1-1.f can be recast terms of u p . In Equation (5), B p maps the proxy input u p to the states and replaced the original B mapping Q ˙ h to the states: (5) B Q ˙ h [ k ] = B α u p [ k ] = B p u p [ k ] The new optimization can be obtained by simply replacing Q ˙ h with u p in the objective function in equation (6), omitting α as it is a constant not affecting the solution. Constraint (6.a) is also adjusted accordingly: (6) J = min u p ∑ k = 0 N − 1 c k u p k subject to the following constraints: (6.a) x ( k + 1 ) = A x ( k ) + B p u p ( k ) + E d ( k ) + K e ( k ) (6.b) T r o o m ( k ) = C x ( k ) (6.c) 0 ≤ u p ( k ) ≤ u p , max ( k ) (6.d) T r o o m , min ( k + 1 ) ≤ T r o o m ( k + 1 ) ≤ T r o o m , max ( k + 1 ) (6.e) Δ T r o o m , min ( k + 1 ) ≤ Δ T r o o m ( k + 1 ) ≤ Δ T r o o m , max ( k + 1 ) (6.f) x ( 0 ) = x ˆ ( 0 ) The upper limit on u p in the proxy-based MPC can be derived by choosing a maximum return temperature ( T o u t , max ) and assuming specific inlet and room temperatures: (7) u p , max = Δ T lg , max 1.3 = ( T i n − T o u t , max ln ( T i n − T r o o m T o u t , max − T r o o m ) ) 1.3 The proxy-based optimization thus offers a convenient way to approximate the input constraints and at the same time it provides a means to control the maximum return temperature. This is a distinct benefit of this novel formulation of the optimization problem as many district heating companies penalize return temperatures exceeding a specific maximum value. Finally, the initial state estimate must also be determined using the proxy input, which is done by replacing the term B Q ˙ h ( − 1 ) in Formula (2) with B p u p ( − 1 ) . The solution to the proxy-based optimization problem is a sequence of proxy inputs over the prediction horizon. However, the optimal proxy inputs are never applied directly; instead, the first optimal proxy input is used to predict the optimal room temperature T r o o m * ( 1 ) in the next time step, and then this temperature is applied as setpoint for the radiator thermostat, T r o o m s e t . 2.3 Virtual test setup The performance of the proposed proxy-based EMPC framework was evaluated within a virtual environment where a dynamic multi-layered hydronic radiator was modeled in Python and integrated with an EnergyPlus room model as illustrated in Fig. 1 . The EnergyPlus Python API [36,37] was used to enable co-simulation. The EnergyPlus model captured the thermal dynamics of a thermal zone (room), specifically determining the air temperature ( T r o o m ) by accounting for the convective ( Q ˙ c o n v e c t i o n ) and radiative ( Q ˙ r a d i a t i o n ) heat outputs from the radiator. The EMPC informed by the inlet ( T i n ) and outlet temperatures ( T o u t ) of the radiator along with T r o o m and forecasts of solar radiation ( Q ˙ s ) , external temperature ( T e x t ) , and energy prices ( c ) , computed the optimal room air temperature and applied it as set point ( T r o o m s e t ) for the radiator thermostat. A Proportional-Integral (PI) regulated the radiator valve opening ( U ) to adjust the water mass flow ( m ˙ w ) , thereby tracking the setpoint. An hourly time step was used throughout all experiments. The following sections provide further details on the individual parts of the co-simulation setup in Fig. 1. 2.3.1 Case-study EnergyPlus room The geometry of the room used as a case-study is illustrated in Fig. 2 . The window facing the outdoors is situated on the east-facing wall. The south-facing wall is also facing the outdoors; all other surfaces were modeled as internal partitions facing rooms maintained at a constant temperature of 21 °C. Construction layers and material properties are detailed in Table 1 . A constant infiltration rate of 0.3 h−1 was used in this model. The climatic data employed for the simulations was a typical meteorological year for Copenhagen, Denmark (DNK_Copenhagen.061800_IWEC.epw). We purposefully excluded occupancy-related disturbances to isolate and evaluate the EMPC's performance without confounding variables. This approach allows a clear comparison between the traditional and the proxy-based EMPC Radiator Model. A detailed model representing the thermal dynamics of the radiator is needed to evaluate the performance of the proposed method. EnergyPlus only offers a static radiator model, so the multi-layered dynamic radiator model by Pedersen et al. [9] was employed in this study. Fig. 3 shows how this model of a radiator is segmented into N S horizontal sections connected in series and each segment has a heat balance, leading to an N S -dimensional system of differential equations. Thermographic studies validate this approach, supporting nearly uniform horizontal sections for the radiator [9]. For a given section j , the heat balance is expressed as: (8) d Q s t o r e d , j d t = Q ˙ i n , j − Q ˙ o u t , j Where Q s t o r e d , j is the heat stored in section j , and Q ˙ i n , j and Q ˙ o u t , j represent the power fluxes into and out of that section. The behavior of each section is further elaborated as: (9) C R a d 1 N S d T j d t = c p , w m ˙ w T j − 1 − T j − U A N S T j − T r o o m n Here, T j is the temperature in the j'th section, C R a d is the combined heat capacity of the water and radiator material, c p , w is the specific heat capacity of the water, m ˙ w is the mass flow rate, n is the radiator exponent, U is the radiator's heat transfer coefficient and A is the surface area. To find the temperatures in each section, we integrated the system of differential equations using the Runge-Kutta method (RK45). The total radiator heat power, Q ˙ r , was obtained by summing up the contribution from all sections: (10) Q ˙ r = U A N S ∑ j = 1 N S T j − T r o o m n The split fraction between convection and radiation was determined according to Ref. [9]: (11) β R = β R , N o m T r o o m + Δ T lg 4 − T r o o m 4 T r o o m + Δ T lg , N o m 4 − T r o o m 4 Δ T lg Δ T lg , N o m n Where β R , N o m denotes the radiative fraction under standard conditions, Δ T lg and Δ T lg , N o m represents the logarithmic mean temperature difference under current and standard conditions, respectively. Given β R , the convection fraction is β C = 1 − β R , leading to the respective powers: (12) Q ˙ r a d i a t i o n = β R Q ˙ r (13) Q ˙ c o n v e c t i o n = β C Q ˙ r In this study, the nominal heat capacity of the simulated radiator was set to 892 W. This capacity is sufficient to maintain the indoor temperature at the setpoint during the dimensioning outdoor temperature, with an additional 15 % capacity. This oversize is common practice to be on the safe side. Table 2 lists the specific parameter values. The integration of the radiator's radiant and convective power outputs from this radiator model into the EnergyPlus model was done via an \u2018ElectricEquipment\u2019 object, reflecting that the convective heat affects the room air directly, while the radiative heat impacts the surfaces. 2.3.2 Radiator thermostat model A discrete Proportional-Integral (PI) controller, shown in Equation (14), was implemented to enable the radiator to track the temperature set point, T r o o m s e t , determined by the EMPC. (14) u ( i ) = K p e ( i ) + K i ∑ i = 1 n t e ( i ) Δ t Unlike the EMPC, the PI controller operates at a timestep of 60s. To avoid a buildup of the integral term an anti-windup mechanism stopped the integration when saturation was reached. The control signal u ( i ) adjusted the radiator valve opening, where u ( i ) = 0 denoted a fully closed valve, and u ( i ) = 1 represented a fully open valve, allowing maximum water flow, m ˙ w , max . For this study, the controller parameters were set to K p = 2 and K i = 0.01 . 2.3.3 Simulation tests The virtual test setup was used to perform a range of performance tests of the proposed proxy-based EMPC. The first set of experiments had the purpose of evaluating its predictive performance and the EMPC performance. First, the virtual test setup system was excited using an hourly pseudo-random setpoints between 20 °C and 23.5 °C and with a maximum of one-degree change per hour to create data suitable for system identification. Then, models were trained on the heat power ( Q ˙ h ) and the proxy input ( u p ) , respectively, and their performance was compared the measured room temperature. The performance of the two models were then evaluated in an EMPC experiment. In real-world settings, the precise value of the radiator exponent ( n ) might be unknown; however, this value is needed to compute the proxy input. Simulations for a range of n -values around the true value were therefore conducted to assess the robustness of the proxy-based method against inaccuracies in the estimation of n . An experiment featuring the variability of water flow and return temperature using the proposed proxy-based EMPC was also conducted as such variability may result in unwanted problems like wear and tear of the radiator valve, audible noise, fluctuating radiator surface temperatures which might cause discomfort, and elevated return temperature which can compromise district heating system efficiency and lead to customer penalties. 3 Results 3.1 System identification Fig. 4 depicts data from the experiment that generated data for system identification. Fig. 5 compares the room temperature predictions from the models trained on the heat power ( Q ˙ h ) and the proxy input ( u p ) , respectively, to the measured room temperature. The top plot shows one-step ahead predictions, reflecting short-term accuracy, while the bottom plot offers 24-step ahead predictions, emphasizing long-term forecasting. The Q ˙ h -based model have high fit percentages for both the short (92.6 %) and long-term (90.0 %) predictions. In contrast, the u p -based model yields more moderate fits of 75.5 % and 72.5 %. The identified matrices (A, B, E, C, and K) for both the heat-based and proxy-based models are provided in Appendix A. While system stability was not explicitly enforced as a constraint in the data-driven identification process, a subsequent analysis of eigenvalues confirms that the open-loop system (A) is stable for both models, which aligns with the expected behavior of building thermal dynamics. Furthermore, the estimator dynamics (characterized by A-KC) are also stable for both models. Specifically, all eigenvalues of both A and A-KC have magnitudes less than 1, satisfying the stability criterion for discrete-time systems. 3.2 EMPC performance The results from simulations of the Baseline EMPC and the proxy-based EMPC were compared against a PI-controller tracking a constant 20 °C room temperature. The simulation period was after the system identification period. Fig. 6 shows the results of this comparison. The top plot shows indoor temperatures for the proxy-based EMPC (red), the Baseline EMPC (blue), and the PI controller (black). The green horizontal lines indicate the temperature constraints. The middle plot shows the corresponding heat consumption alongside the district heating price (green), while the bottom plot shows the outdoor temperature and solar radiation. Both EMPC strategies adhere to the temperature constraints ( 20 °C ≤ T r o o m ≤ 22.5 °C ) and the rate-of-change constraints ( − 1 °C ≤ Δ T r o o m ≤ 1 °C ) . They exhibit similar load-shifting behavior with pronounced preheating during low-cost nighttime periods. However, the Baseline EMPC also uniquely preheats slightly before evening peaks. Compared to the PI controller, the Baseline EMPC increased energy consumption by 8 % but reduced costs by 16.8 %. The proxy-based EMPC led to a 7 % rise in energy use but achieved a 16.6 % cost reduction which is on par with the Baseline EMPC despite the lower fit percentage of the proxy-based model. It is noted that the nominal heat capacity of the radiator (892 W) was never utilized, despite the upper bound on the heat power or proxy input being set to infinite. This is because the temperature rate-of-change constraint activates first, effectively limiting the applicable heat input. 3.3 Radiator exponent uncertainty Fig. 7 displays the cost savings and model fit (based on simulation errors) from the experiment featuring simulations of the proxy-based method using different estimations of n . The results indicate consistent EMPC performance for n between 1.0 and 1.5 suggesting that the proxy-based method is resilient within this interval. 3.4 Water flow and return temperature analysis Fig. 8 depicts the radiator water flow and temperatures in the inlet ( j = 1 ) , midpoint ( j = 10 ) and outlet ( J = 20 ) sections of the radiator as defined in Fig. 3 when operated using the proposed proxy-based EMPC and a constant setpoint (baseline). While the baseline maintains a steady water flow, the EMPC exhibits more dynamic fluctuations due to the low-level controller adjusting to changing setpoints which potentially could lead to the problems mentioned in section 2.1.4. To address these problems, we explored the effects of setting an upper limit on u p . Experiments up until now did not include an upper limit on u p (i.e., u p , max = ∞ ) but relied on the rate-of-change constraint to prevent the EMPC from ever wanting to use inputs exceeding what the radiator model could support. Fig. 9 showcases the system behavior with u p , max ≤ 55 corresponding to a maximum outlet temperature of 27 °C (assuming T i n = 70 °C and T r o o m = 20 °C in Equation (7)). The system stabilizes more swiftly at a reduced flow despite rapid initial flow changes resulting in a lower average return temperature. However, it is worth noting that limiting u p , max alone does not completely eliminate the EMPC-induced water flow fluctuations. To achieve this, adjustments to the low-level PI-controller would be required which is left for future works. A flow-weighted return temperature was calculated to quantify the impact of applying different input constraints ( u p , max ) : (15) T 20 , w e i g h t e d = ∑ i T 20 i m ˙ w i ∑ i m ˙ w i where T 20 ( i ) is the outlet temperature at the i'th simulation time step (every 60 s). Fig. 10 illustrates the balance between u p , max and the trade-off between cost and flow-weighted return temperature: As u p , max increased, the cost was reduced \u2013 but the weighted return temperature increased. Note that if cost minimization is the sole objective, an unbounded u p , max can be chosen even though there is an actual limit to how much the radiator can heat. However, this limit is never used if a reasonable temperature rate-of-change constraint is implemented to respect thermal comfort. This realization simplifies practical implementation significantly as the maximum radiator capacity does not need to be known. 4 Discussion The simulation-based experiments yielded several interesting results. For system identification, the proxy-based model showed reduced prediction accuracy compared to the heat-based model. This drop likely stems from approximation errors during transient periods, as the proxy input is a steady-state approximation of emitted heat. However, this decrease in prediction accuracy was not reflected in the EMPC performance, where the cost savings and comfort of the proxy-based EMPC are on par with the heat-based EMPC. Furthermore, the results demonstrated that setting the upper bound on heat and proxy input to infinity did not compromise performance. This was because the temperature rate-of-change constraint was always activated before the maximum heat input could be applied. This approach assumes that the radiator is slightly oversized (in our study, the radiator is 15 % oversized), which means that a 1-degree change per hour is achieved before the maximum capacity is applied. However, if a faster temperature change is allowed, this method might not work optimally, though such rapid changes are not recommended for occupant comfort. Alternatively, u p , max could be calculated based on a user-chosen maximum return temperature using the relationship in Equation (7). This approach reduces the upper bound on u p , max below the maximum capacity to manage the maximum return temperature more directly. For future works, the following areas seems worth exploring. \u2022 Real-world Implementation: A pilot study in actual residential settings would provide insights into the practical challenges and benefits of implementing the proxy-based EMPC. \u2022 Optimizing PID for EMPC: Investigating modifications to Proportional-Integral-Derivative (PID) controllers, ensuring better integration with EMPC applications. \u2022 Broadening the scope: The proposed concept could be adapted for other heating systems, like floor heating, and could \u2013 with some modifications \u2013 also be applied in systems where a heat pump is the heat source. \u2022 Multi-objective optimization: The adaptability of buildings to varying operational needs of the district heating system can be further enhanced by e.g. incorporating time-varying costs for return temperatures. It is acknowledged that occupancy can significantly impact practical applications, but addressing these effects goes beyond the scope of this study, which focuses on the core efficiency of the proxy-based approach. Future research will need to develop strategies to handle such variables and to fully realize the potential of EMPC in real-world scenarios. 5 Conclusion A room-level EMPC strategy for hydronic radiators that relies on measurements of radiator pipe temperatures as a proxy for the radiator heat output was proposed. This proxy-based EMPC performs on par with power-based EMPC and is therefore a cost-efficient alternative to a power-based EMPC which would require installation of a flow-based heat meter at each radiator in a building. The proxy-based approach also proved resilient to uncertainties regarding the radiator exponent and maximum heating capacity. Furthermore, the definition of the proxy-based EMPC provides system operators with a straightforward mechanism to balance the trade-off between cost savings and return temperatures through a user-specified maximum proxy input. Given the current state of development, the proposed proxy-based EMPC seems like a promising step towards a more practical and widespread application of EMPC for hydronic space-heating that could activate a significant demand response resource, offering cost-savings to the end-users and promoting a more efficient operation of the overall energy system. CRediT authorship contribution statement Michael Dahl Knudsen: Writing \u2013 original draft, Visualization, Validation, Methodology, Investigation, Formal analysis, Data curation, Conceptualization. Massimo Fiorentini: Writing \u2013 review & editing. Steffen Petersen: Writing \u2013 review & editing. Declaration of competing interest The authors declare that they have no known competing financial interests or personal relationships that could have appeared to influence the work reported in this paper. Appendix A Model Matrices This appendix presents the identified matrices for both the heat-based and proxy-based models. Heat-based Model A = [ 0 1 − 0.579253 1.577514 ] B = [ 0.002474 0.001502 ] E = [ 0.041678 0.000635 0.025804 0.000460 ] C = [ 1 , 0 ] K = [ 0.330262 0.197913 ] Proxy-based Model A = [ 0 1 − 0.235639 1.232394 ] B = [ 0.045003 0.011825 ] E = [ 0.071589 0.000590 0.019880 0.000330 ] C = [ 1 , 0 ] K = [ 0.488420 0.110261 ] References [1] H. Cai C. Ziras S. You R. Li K. Honeré H.W. Bindner \"Demand side management in urban district heating networks,\" Applied Energy, 230 2018 506 518 H. Cai, C. Ziras, S. You, R. Li, K. Honere and H. W. Bindner, \"Demand side management in urban district heating networks,\" Applied Energy, vol. 230, pp. 506-518, 2018. [2] D. Vanhoudt B. Claessens R. Salenbien J. Desmedt \"An active control strategy for district heating networks and the effect of different thermal energy storage configurations,\" Energy and Buildings, 158 2018 1317 1327 D. Vanhoudt, B. Claessens, R. Salenbien and J. Desmedt, \"An active control strategy for district heating networks and the effect of different thermal energy storage configurations,\" Energy and Buildings, vol. 158, pp. 1317-1327, 2018. [3] J. Le Dréau P. Heiselberg \"Energy flexibility of residential buildings using short term heat storage in the thermal mass,\" Energy 111 2016 991 1002 J. Le Dreau and P. Heiselberg, \"Energy flexibility of residential buildings using short term heat storage in the thermal mass,\" Energy, vol. 111, pp. 991-1002, 2016. [4] D.F. Dominković P. Gianniou M. Münster A. Heller C. Rode \"Utilizing thermal building mass for storage in district heating systems: combined building level simulations and system level optimization,\" Energy, 153 2018 949 966 D. F. Dominkovic, P. Gianniou, M. Munster, A. Heller and C. Rode, \"Utilizing thermal building mass for storage in district heating systems: Combined building level simulations and system level optimization,\" Energy, vol. 153, pp. 949-966, 2018. [5] R.E. Hedegaard M.H. Kristensen T.H. Pedersen A. Brun S. Petersen \"Bottom-up modelling methodology for urban-scale analysis of residential space heating demand response,\" Applied Energy, 242 2019 181 204 R. E. Hedegaard, M. H. Kristensen, T. H. Pedersen, A. Brun and S. Petersen, \"Bottom-up modelling methodology for urban-scale analysis of residential space heating demand response,\" Applied Energy, vol. 242, pp. 181-204, 2019. [6] S. Petersen R.E. Hedegaard J. Tougaard T. Mølbak Including Building Energy Flexibility as an Asset in System-wide District Heating Optimization Models 2020 S. Petersen, R. E. Hedegaard, J. Tougaard and T. Moelbak, \"Including building energy flexibility as an asset in system-wide district heating optimization models,\" 2020. [7] R. Halvgaard N.K. Poulsen H. Madsen J.B. Jørgensen \"Economic Model Predictive Control for Building Climate Control in a Smart Grid,\" Innovative Smart Grid Technologies, IEEE PES 2012 R. Halvgaard, N. K. Poulsen, H. Madsen and J. B. Joergensen, \"Economic Model Predictive Control for building climate control in a Smart Grid,\" Innovative Smart Grid Technologies, IEEE PES, 2012. [8] M.D. Knudsen S. Petersen \"Demand response potential of model predictive control of space heating based on price and carbon dioxide intensity signals,\" Energy and Buildings, 125 2016 196 204 M. D. Knudsen and S. Petersen, \"Demand response potential of model predictive control of space heating based on price and carbon dioxide intensity signals,\" Energy and Buildings, vol. 125, p. 196-204, 2016. [9] T.H. Pedersen R.E. Hedegaard K.F. Kristensen B. Gadgaard S. Petersen \"The effect of including hydronic radiator dynamics in model predictive control of space heating,\" Energy and Buildings, vol. 183, pp. 772\u2013784 15 January 2019 T. H. Pedersen, R. E. Hedegaard, K. F. Kristensen, B. Gadgaard and S. Petersen, \"The effect of including hydronic radiator dynamics in model predictive control of space heating,\" Energy and Buildings, vol. 183, pp. 772-784, 15 January 2019. [10] C. Finck R. Li W. Zeiler \"Economic model predictive control for demand flexibility of a residential building,\" Energy, 176 2019 365 379 C. Finck, R. Li and W. Zeiler, \"Economic model predictive control for demand flexibility of a residential building,\" Energy, vol. 176, pp. 365-379, 2019. [11] C. Finck R. Li W. Zeiler \"Optimal control of demand flexibility under real-time pricing for heating systems in buildings: a real-life demonstration,\" Applied Energy, 263 2020 114671 C. Finck, R. Li and W. Zeiler, \"Optimal control of demand flexibility under real-time pricing for heating systems in buildings: A real-life demonstration,\" Applied Energy, vol. 263, p. 114671, 2020. [12] Y. Zong G.M. Böning R.M. Santos S. You J. Hu X. Han \"Challenges of implementing economic model predictive control strategy for buildings interacting with smart energy systems,\" Applied Thermal Engineering, 114 2017 1476 1486 Y. Zong, G. M. Boning, R. M. Santos, S. You, J. Hu and X. Han, \"Challenges of implementing economic model predictive control strategy for buildings interacting with smart energy systems,\" Applied Thermal Engineering, vol. 114, pp. 1476-1486, 2017. [13] M.D. Knudsen L. Georges K.S. Skeie S. Petersen \"Experimental test of a black-box economic model predictive control for residential space heating,\" Applied Energy, vol. 298, p. 117227 15 September 2021 M. D. Knudsen, L. Georges, K. S. Skeie and S. Petersen, \"Experimental test of a black-box economic model predictive control for residential space heating,\" Applied Energy, vol. 298, p. 117227, 15 September 2021. [14] M. Killian M. Kozek \"Ten questions concerning model predictive control for energy efficient buildings,\" Building and Environment, 105 2016 403 412 M. Killian and M. Kozek, \"Ten questions concerning model predictive control for energy efficient buildings,\" Building and Environment, vol. 105, pp. 403-412, 2016. [15] R. Hedegaard T. Pedersen M. Knudsen S. Petersen \"Towards practical model predictive control of residential space heating: eliminating the need for weather measurements,\" Energy and Buildings, 170 2018 206 216 R. Hedegaard, T. Pedersen, M. Knudsen and S. Petersen, \"Towards practical model predictive control of residential space heating: Eliminating the need for weather measurements,\" Energy and Buildings, vol. 170, pp. 206-216, 2018. [16] D. Sturzenegger D. Gyalistras M. Morari R. Smith \"Model predictive climate control of a Swiss office building: implementation, results, and cost\u2013benefit analysis,\" IEEE transactions on control systems technology, vol 24, no 1 2016 1 12 D. Sturzenegger, D. Gyalistras, M. Morari and R. Smith, \"Model Predictive Climate Control of a Swiss Office Building: Implementation, Results, and Cost-Benefit Analysis,\" IEEE Transactions on Control Systems Technology, vol. 24, no. 1, pp. 1-12, 2016. [17] S. Prívara J. Cigler Z. Váňa F. Oldewurtel C. Sagerschnig E. Žáčeková \"Building modeling as a crucial part for building predictive control,\" Energy and Buildings, 56 2013 8 22 S. Privara, J. Cigler, Z. Vana, F. Oldewurtel, C. Sagerschnig and E. Zacekova, \"Building modeling as a crucial part for building predictive control,\" Energy and Buildings, vol. 56, pp. 8-22, 2013. [18] E. Atam L. Helsen \"Control-Oriented thermal modeling of multizone buildings: methods and issues: intelligent control of a building system,\" IEEE control systems magazine, vol 36, no 3 2016 86 111 E. Atam and L. Helsen, \"Control-Oriented Thermal Modeling of Multizone Buildings: Methods and Issues: Intelligent Control of a Building System,\" IEEE Control Systems Magazine, vol. 36, no. 3, pp. 86-111, 2016. [19] V. Amato R. Hedegaard M. Knudsen S. Petersen \"Room-level load shifting of space heating in a single-family house \u2013 a field experiment,\" Energy and Buildings, vol. 281, p. 112750 15 February 2023 V. Amato, R. Hedegaard, M. Knudsen and S. Petersen, \"Room-level load shifting of space heating in a single-family house - A field experiment,\" Energy and Buildings, vol. 281, p. 112750, 15 February 2023. [20] M. Kristensen P. Petersen \"District heating energy efficiency of Danish building typologies,\" Energy and Buildings, 231 2021 1106002 M. Kristensen and P. Petersen, \"District heating energy efficiency of Danish building typologies,\" Energy and Buildings, vol. 231, p. 1106002, 2021. [21] D. Lindelöf H. Afshari M. Alisafaee J. Biswas M. Caban X. Mocellin J. Viaene \"Field tests of an adaptive, model-predictive heating controller for residential buildings,\" Energy and Buildings, 99 2015 292 302 D. Lindelof, H. Afshari, M. Alisafaee, J. Biswas, M. Caban, X. Mocellin and J. Viaene, \"Field tests of an adaptive, model-predictive heating controller for residential buildings,\" Energy and Buildings, vol. 99, pp. 292-302, 2015. [22] R. Coninck L. Helsen \"Practical implementation and evaluation of model predictive control for an office building in Brussels,\" Energy and Buildings, 111 2016 290 298 R. Coninck and L. Helsen, \"Practical implementation and evaluation of model predictive control for an office building in Brussels,\" Energy and Buildings, vol. 111, pp. 290-298, 2016. [23] C.A. Thilker P. Bacher H. Madsen \"Learnings from Experiments with MPC for Heating of Older School Building,\" in BuildSim Nordic 2022 2022 C. A. Thilker, P. Bacher and H. Madsen, \"Learnings from experiments with MPC for heating of older school building,\" in BuildSim Nordic 2022, 2022. [24] T.H. Pedersen R.E. Hedegaard S. Petersen \"Space heating demand response potential of retrofitted residential apartment blocks,\" Energy and Buildings, 141 2017 158 166 T. H. Pedersen, R. E. Hedegaard and S. Petersen, \"Space heating demand response potential of retrofitted residential apartment blocks,\" Energy and Buildings, vol. 141, p. 158-166, 2017. [25] J. Wang S. Li H. Chen Y. Yuan Y. Huang \"Data-driven model predictive control for building climate control: three case studies on different buildings,\" Building and Environment, 160 2019 106204 J. Wang, S. Li, H. Chen, Y. Yuan and Y. Huang, \"Data-driven model predictive control for building climate control: Three case studies on different buildings,\" Building and Environment, vol. 160, p. 106204, 2019. [26] F. Oldewurtel A. Parisio C.N. Jones D. Gyalistras M. Gwerder V. Stauch B. Lehmann M. Morari \"Use of model predictive control and weather forecasts for energy efficient building climate control,\" Energy and Buildings, 45 2012 15 27 F. Oldewurtel, A. Parisio, C. N. Jones, D. Gyalistras, M. Gwerder, V. Stauch, B. Lehmann and M. Morari, \"Use of model predictive control and weather forecasts for energy efficient building climate control,\" Energy and Buildings, vol. 45, pp. 15-27, 2012. [27] P. Bacher H. Madsen \"Identifying suitable models for the heat dynamics of buildings,\" Energy and Buildings, vol 43, no 7 2011 1511 1522 P. Bacher and H. Madsen, \"Identifying suitable models for the heat dynamics of buildings,\" Energy and Buildings, vol. 43, no. 7, pp. 1511-1522, 2011. [28] X. Yu K.S. Skeie M.D. Knudsen Z. Ren L. Imsland L. Georges \"Influence of data pre-processing and sensor dynamics on grey-box models for space-heating: analysis using field measurements,\" BuildingandEnvironment, 212 2022 108832 X. Yu, K. S. Skeie, M. D. Knudsen, Z. Ren, L. Imsland and L. Georges, \"Influence of data pre-processing and sensor dynamics on grey-box models for space-heating: Analysis using field measurements,\" BuildingandEnvironment, vol. 212, p. 108832, 2022. [29] Z. Wei J.K. Calautit \"Field experiment testing of a low-cost model predictive controller (MPC) for building heating systems and analysis of phase change material (PCM) integration,\" Applied Energy, 360 2024 122750 Z. Wei and J. K. Calautit, \"Field experiment testing of a low-cost model predictive controller (MPC) for building heating systems and analysis of phase change material (PCM) integration,\" Applied Energy, vol. 360, p. 122750, 2024. [30] V. Amato M. Knudsen S. Petersen \"Dual-zone economic model predictive control of residential space heating for demand response using a single heat meter,\" Energy and Buildings, 281 2013 112759 V. Amato, M. Knudsen and S. Petersen, \"Dual-zone economic model predictive control of residential space heating for demand response using a single heat meter,\" Energy and Buildings, vol. 281, p. 112759, 2013. [31] F. Bünning B. Huber A. Schalbetter A. Aboudonia M H. d. Badyn, P. Heer, R. S. Smith and J. Lygeros, \"Physics-informed linear regression is competitive with two Machine Learning methods in residential building MPC,\" Applied Energy, 310 2022 118491 F Bunning, B Huber, A Schalbetter, A Aboudonia M. H. d. Badyn, P. Heer, R. S. Smith and J. Lygeros, \"Physics-informed linear regression is competitive with two Machine Learning methods in residential building MPC,\" Applied Energy, vol. 310, p. 118491, 2022. [32] J. Drgoňa J. Arroyo I.C. Figueroa D. Blum K. Arendt D. Kim E.P. Ollé J. Oravec M. Wetter D.L. Vrabie L. Helsen \"All you need to know about model predictive control for buildings,\" All you need to know about model predictive control for buildings, 50 2020 190 232 J. Drgona, J. Arroyo, I. C. Figueroa, D. Blum, K. Arendt, D. Kim, E. P. Olle, J. Oravec, M. Wetter, D. L. Vrabie and L. Helsen, \"All you need to know about model predictive control for buildings,\" All you need to know about model predictive control for buildings, vol. 50, pp. 190-232, 2020. [33] L. Ljung System identification - theory for the user, 2nd Edition, pp. 199 Prentice Hall PTR 1999 L. Ljung, System Identification - Theory for the user, Prentice Hall PTR, 1999. [34] D. S. A. (DS), DS/EN 442-2. Radiators and Convectors, 2150 Nordhavn: Danish Standards Association 2014 D. S. A. (DS), DS/EN 442-2. Radiators and convectors, 2150 Nordhavn: Danish Standards Association, 2014. [35] R. Marchesi F. Rinaldi C. Tarini F. Arpino G. Cortellessa M. Dell'Isola G. Ficco \"Experimental analysis of radiators\u2019 thermal output for heat accounting,\" Thermal Science, 23 2019 10.2298/TSCI170301168M 2 R. Marchesi, F. Rinaldi, C. Tarini, F. Arpino, G. Cortellessa, M. Dell'Isola and G. Ficco, \"Experimental analysis of radiators\u2019 thermal output for heat accounting,\" Thermal Science, vol. 23, no. 2, p. https://doi.org/10.2298/TSCI170301168M, 2019. [36] EnergyPlus Version 22.1.0 Documentation, Input Output Reference, U.S. Department of Energy 2023 EnergyPlus Version 22.1.0 Documentation, Input Output Reference, U.S. Department of Energy, 2023. [37] EnergyPlus Version 22.1.0 2023 EnergyPlus Version 22.1.0, 2023.",
    "scopus-id": "85203423462",
    "coredata": {
        "eid": "1-s2.0-S2352710224022629",
        "dc:description": "Cost-efficient measurement of room-level heat output from hydronic radiators is a major barrier to large-scale implementation of Economic Model Predictive Control (EMPC) in residential space heating for demand-side management. This paper therefore presents a novel EMPC strategy for hydronic radiators that relies on measurements of radiator pipe temperatures as a proxy for the radiator heat output, thus eliminating the need for costly flow-based meters at each radiator in a building. Simulation-based experiments indicate that the proposed proxy-based EMPC matches the performance of its heat-based counterpart. The proxy-based EMPC achieved a 16.6 % cost reduction compared to the heat-based EMPC's 16.8 %, with no comfort violations in both cases. Furthermore, the strategy shows resilience towards uncertainties in the user-estimated radiator exponent and maximum heating capacity. The proposed EMPC scheme also allows system operators to fine-tune the balance between cost savings and return temperatures using the proxy's upper limit. The findings presented in this paper suggest that the proposed proxy-based EMPC scheme provides a practical pathway for broader applications of EMPC in hydronic-based space heating with the prospect of unlocking significant load shifting potential, cost savings for end-users, and enhanced efficiency in individual and collective energy systems.",
        "openArchiveArticle": "false",
        "prism:coverDate": "2024-11-15",
        "openaccessUserLicense": "http://creativecommons.org/licenses/by/4.0/",
        "prism:aggregationType": "Journal",
        "prism:url": "https://api.elsevier.com/content/article/pii/S2352710224022629",
        "dc:creator": [
            {
                "@_fa": "true",
                "$": "Knudsen, Michael Dahl"
            },
            {
                "@_fa": "true",
                "$": "Fiorentini, Massimo"
            },
            {
                "@_fa": "true",
                "$": "Petersen, Steffen"
            }
        ],
        "link": [
            {
                "@_fa": "true",
                "@rel": "self",
                "@href": "https://api.elsevier.com/content/article/pii/S2352710224022629"
            },
            {
                "@_fa": "true",
                "@rel": "scidir",
                "@href": "https://www.sciencedirect.com/science/article/pii/S2352710224022629"
            }
        ],
        "dc:format": "application/json",
        "openaccessType": "Full",
        "pii": "S2352-7102(24)02262-9",
        "prism:volume": "97",
        "articleNumber": "110694",
        "prism:publisher": "The Authors. Published by Elsevier Ltd.",
        "dc:title": "A heat-measurement-free strategy for Economic Model Predictive Control of hydronic radiators",
        "prism:copyright": "© 2024 The Authors. Published by Elsevier Ltd.",
        "openaccess": "1",
        "prism:issn": "23527102",
        "dcterms:subject": [
            {
                "@_fa": "true",
                "$": "Economic model predictive control"
            },
            {
                "@_fa": "true",
                "$": "Hydronic radiators"
            },
            {
                "@_fa": "true",
                "$": "Co-simulations"
            },
            {
                "@_fa": "true",
                "$": "Load-shifting"
            },
            {
                "@_fa": "true",
                "$": "Room-level heating"
            }
        ],
        "openaccessArticle": "true",
        "prism:publicationName": "Journal of Building Engineering",
        "openaccessSponsorType": "FundingBody",
        "prism:pageRange": "110694",
        "pubType": "fla",
        "prism:coverDisplayDate": "15 November 2024",
        "prism:doi": "10.1016/j.jobe.2024.110694",
        "prism:startingPage": "110694",
        "dc:identifier": "doi:10.1016/j.jobe.2024.110694",
        "openaccessSponsorName": "Denmark institutions 2021"
    },
    "objects": {"object": [
        {
            "@category": "standard",
            "@height": "227",
            "@width": "344",
            "@_fa": "true",
            "$": "https://api.elsevier.com/content/object/eid/1-s2.0-S2352710224022629-gr10.jpg?httpAccept=%2A%2F%2A",
            "@multimediatype": "JPEG image file",
            "@type": "IMAGE-DOWNSAMPLED",
            "@size": "90482",
            "@ref": "gr10",
            "@mimetype": "image/jpeg"
        },
        {
            "@category": "standard",
            "@height": "408",
            "@width": "624",
            "@_fa": "true",
            "$": "https://api.elsevier.com/content/object/eid/1-s2.0-S2352710224022629-gr9.jpg?httpAccept=%2A%2F%2A",
            "@multimediatype": "JPEG image file",
            "@type": "IMAGE-DOWNSAMPLED",
            "@size": "141330",
            "@ref": "gr9",
            "@mimetype": "image/jpeg"
        },
        {
            "@category": "standard",
            "@height": "611",
            "@width": "624",
            "@_fa": "true",
            "$": "https://api.elsevier.com/content/object/eid/1-s2.0-S2352710224022629-gr5.jpg?httpAccept=%2A%2F%2A",
            "@multimediatype": "JPEG image file",
            "@type": "IMAGE-DOWNSAMPLED",
            "@size": "229256",
            "@ref": "gr5",
            "@mimetype": "image/jpeg"
        },
        {
            "@category": "standard",
            "@height": "509",
            "@width": "624",
            "@_fa": "true",
            "$": "https://api.elsevier.com/content/object/eid/1-s2.0-S2352710224022629-gr6.jpg?httpAccept=%2A%2F%2A",
            "@multimediatype": "JPEG image file",
            "@type": "IMAGE-DOWNSAMPLED",
            "@size": "191240",
            "@ref": "gr6",
            "@mimetype": "image/jpeg"
        },
        {
            "@category": "standard",
            "@height": "203",
            "@width": "344",
            "@_fa": "true",
            "$": "https://api.elsevier.com/content/object/eid/1-s2.0-S2352710224022629-gr7.jpg?httpAccept=%2A%2F%2A",
            "@multimediatype": "JPEG image file",
            "@type": "IMAGE-DOWNSAMPLED",
            "@size": "89420",
            "@ref": "gr7",
            "@mimetype": "image/jpeg"
        },
        {
            "@category": "standard",
            "@height": "407",
            "@width": "624",
            "@_fa": "true",
            "$": "https://api.elsevier.com/content/object/eid/1-s2.0-S2352710224022629-gr8.jpg?httpAccept=%2A%2F%2A",
            "@multimediatype": "JPEG image file",
            "@type": "IMAGE-DOWNSAMPLED",
            "@size": "144173",
            "@ref": "gr8",
            "@mimetype": "image/jpeg"
        },
        {
            "@category": "standard",
            "@height": "255",
            "@width": "624",
            "@_fa": "true",
            "$": "https://api.elsevier.com/content/object/eid/1-s2.0-S2352710224022629-gr1.jpg?httpAccept=%2A%2F%2A",
            "@multimediatype": "JPEG image file",
            "@type": "IMAGE-DOWNSAMPLED",
            "@size": "98430",
            "@ref": "gr1",
            "@mimetype": "image/jpeg"
        },
        {
            "@category": "standard",
            "@height": "290",
            "@width": "491",
            "@_fa": "true",
            "$": "https://api.elsevier.com/content/object/eid/1-s2.0-S2352710224022629-gr2.jpg?httpAccept=%2A%2F%2A",
            "@multimediatype": "JPEG image file",
            "@type": "IMAGE-DOWNSAMPLED",
            "@size": "27895",
            "@ref": "gr2",
            "@mimetype": "image/jpeg"
        },
        {
            "@category": "standard",
            "@height": "270",
            "@width": "491",
            "@_fa": "true",
            "$": "https://api.elsevier.com/content/object/eid/1-s2.0-S2352710224022629-gr3.jpg?httpAccept=%2A%2F%2A",
            "@multimediatype": "JPEG image file",
            "@type": "IMAGE-DOWNSAMPLED",
            "@size": "88570",
            "@ref": "gr3",
            "@mimetype": "image/jpeg"
        },
        {
            "@category": "standard",
            "@height": "483",
            "@width": "624",
            "@_fa": "true",
            "$": "https://api.elsevier.com/content/object/eid/1-s2.0-S2352710224022629-gr4.jpg?httpAccept=%2A%2F%2A",
            "@multimediatype": "JPEG image file",
            "@type": "IMAGE-DOWNSAMPLED",
            "@size": "194944",
            "@ref": "gr4",
            "@mimetype": "image/jpeg"
        },
        {
            "@category": "thumbnail",
            "@height": "145",
            "@width": "219",
            "@_fa": "true",
            "$": "https://api.elsevier.com/content/object/eid/1-s2.0-S2352710224022629-gr10.sml?httpAccept=%2A%2F%2A",
            "@multimediatype": "GIF image file",
            "@type": "IMAGE-THUMBNAIL",
            "@size": "72294",
            "@ref": "gr10",
            "@mimetype": "image/gif"
        },
        {
            "@category": "thumbnail",
            "@height": "143",
            "@width": "219",
            "@_fa": "true",
            "$": "https://api.elsevier.com/content/object/eid/1-s2.0-S2352710224022629-gr9.sml?httpAccept=%2A%2F%2A",
            "@multimediatype": "GIF image file",
            "@type": "IMAGE-THUMBNAIL",
            "@size": "74539",
            "@ref": "gr9",
            "@mimetype": "image/gif"
        },
        {
            "@category": "thumbnail",
            "@height": "164",
            "@width": "167",
            "@_fa": "true",
            "$": "https://api.elsevier.com/content/object/eid/1-s2.0-S2352710224022629-gr5.sml?httpAccept=%2A%2F%2A",
            "@multimediatype": "GIF image file",
            "@type": "IMAGE-THUMBNAIL",
            "@size": "84352",
            "@ref": "gr5",
            "@mimetype": "image/gif"
        },
        {
            "@category": "thumbnail",
            "@height": "164",
            "@width": "201",
            "@_fa": "true",
            "$": "https://api.elsevier.com/content/object/eid/1-s2.0-S2352710224022629-gr6.sml?httpAccept=%2A%2F%2A",
            "@multimediatype": "GIF image file",
            "@type": "IMAGE-THUMBNAIL",
            "@size": "82308",
            "@ref": "gr6",
            "@mimetype": "image/gif"
        },
        {
            "@category": "thumbnail",
            "@height": "129",
            "@width": "219",
            "@_fa": "true",
            "$": "https://api.elsevier.com/content/object/eid/1-s2.0-S2352710224022629-gr7.sml?httpAccept=%2A%2F%2A",
            "@multimediatype": "GIF image file",
            "@type": "IMAGE-THUMBNAIL",
            "@size": "71406",
            "@ref": "gr7",
            "@mimetype": "image/gif"
        },
        {
            "@category": "thumbnail",
            "@height": "143",
            "@width": "219",
            "@_fa": "true",
            "$": "https://api.elsevier.com/content/object/eid/1-s2.0-S2352710224022629-gr8.sml?httpAccept=%2A%2F%2A",
            "@multimediatype": "GIF image file",
            "@type": "IMAGE-THUMBNAIL",
            "@size": "75555",
            "@ref": "gr8",
            "@mimetype": "image/gif"
        },
        {
            "@category": "thumbnail",
            "@height": "90",
            "@width": "219",
            "@_fa": "true",
            "$": "https://api.elsevier.com/content/object/eid/1-s2.0-S2352710224022629-gr1.sml?httpAccept=%2A%2F%2A",
            "@multimediatype": "GIF image file",
            "@type": "IMAGE-THUMBNAIL",
            "@size": "70248",
            "@ref": "gr1",
            "@mimetype": "image/gif"
        },
        {
            "@category": "thumbnail",
            "@height": "129",
            "@width": "219",
            "@_fa": "true",
            "$": "https://api.elsevier.com/content/object/eid/1-s2.0-S2352710224022629-gr2.sml?httpAccept=%2A%2F%2A",
            "@multimediatype": "GIF image file",
            "@type": "IMAGE-THUMBNAIL",
            "@size": "10045",
            "@ref": "gr2",
            "@mimetype": "image/gif"
        },
        {
            "@category": "thumbnail",
            "@height": "120",
            "@width": "219",
            "@_fa": "true",
            "$": "https://api.elsevier.com/content/object/eid/1-s2.0-S2352710224022629-gr3.sml?httpAccept=%2A%2F%2A",
            "@multimediatype": "GIF image file",
            "@type": "IMAGE-THUMBNAIL",
            "@size": "70084",
            "@ref": "gr3",
            "@mimetype": "image/gif"
        },
        {
            "@category": "thumbnail",
            "@height": "164",
            "@width": "212",
            "@_fa": "true",
            "$": "https://api.elsevier.com/content/object/eid/1-s2.0-S2352710224022629-gr4.sml?httpAccept=%2A%2F%2A",
            "@multimediatype": "GIF image file",
            "@type": "IMAGE-THUMBNAIL",
            "@size": "83777",
            "@ref": "gr4",
            "@mimetype": "image/gif"
        },
        {
            "@category": "high",
            "@height": "1007",
            "@width": "1524",
            "@_fa": "true",
            "$": "https://api.elsevier.com/content/object/eid/1-s2.0-S2352710224022629-gr10_lrg.jpg?httpAccept=%2A%2F%2A",
            "@multimediatype": "JPEG image file",
            "@type": "IMAGE-HIGH-RES",
            "@size": "206641",
            "@ref": "gr10",
            "@mimetype": "image/jpeg"
        },
        {
            "@category": "high",
            "@height": "1807",
            "@width": "2764",
            "@_fa": "true",
            "$": "https://api.elsevier.com/content/object/eid/1-s2.0-S2352710224022629-gr9_lrg.jpg?httpAccept=%2A%2F%2A",
            "@multimediatype": "JPEG image file",
            "@type": "IMAGE-HIGH-RES",
            "@size": "734067",
            "@ref": "gr9",
            "@mimetype": "image/jpeg"
        },
        {
            "@category": "high",
            "@height": "2708",
            "@width": "2764",
            "@_fa": "true",
            "$": "https://api.elsevier.com/content/object/eid/1-s2.0-S2352710224022629-gr5_lrg.jpg?httpAccept=%2A%2F%2A",
            "@multimediatype": "JPEG image file",
            "@type": "IMAGE-HIGH-RES",
            "@size": "1183261",
            "@ref": "gr5",
            "@mimetype": "image/jpeg"
        },
        {
            "@category": "high",
            "@height": "2253",
            "@width": "2764",
            "@_fa": "true",
            "$": "https://api.elsevier.com/content/object/eid/1-s2.0-S2352710224022629-gr6_lrg.jpg?httpAccept=%2A%2F%2A",
            "@multimediatype": "JPEG image file",
            "@type": "IMAGE-HIGH-RES",
            "@size": "928838",
            "@ref": "gr6",
            "@mimetype": "image/jpeg"
        },
        {
            "@category": "high",
            "@height": "901",
            "@width": "1524",
            "@_fa": "true",
            "$": "https://api.elsevier.com/content/object/eid/1-s2.0-S2352710224022629-gr7_lrg.jpg?httpAccept=%2A%2F%2A",
            "@multimediatype": "JPEG image file",
            "@type": "IMAGE-HIGH-RES",
            "@size": "216200",
            "@ref": "gr7",
            "@mimetype": "image/jpeg"
        },
        {
            "@category": "high",
            "@height": "1805",
            "@width": "2764",
            "@_fa": "true",
            "$": "https://api.elsevier.com/content/object/eid/1-s2.0-S2352710224022629-gr8_lrg.jpg?httpAccept=%2A%2F%2A",
            "@multimediatype": "JPEG image file",
            "@type": "IMAGE-HIGH-RES",
            "@size": "736029",
            "@ref": "gr8",
            "@mimetype": "image/jpeg"
        },
        {
            "@category": "high",
            "@height": "1131",
            "@width": "2764",
            "@_fa": "true",
            "$": "https://api.elsevier.com/content/object/eid/1-s2.0-S2352710224022629-gr1_lrg.jpg?httpAccept=%2A%2F%2A",
            "@multimediatype": "JPEG image file",
            "@type": "IMAGE-HIGH-RES",
            "@size": "264843",
            "@ref": "gr1",
            "@mimetype": "image/jpeg"
        },
        {
            "@category": "high",
            "@height": "1282",
            "@width": "2174",
            "@_fa": "true",
            "$": "https://api.elsevier.com/content/object/eid/1-s2.0-S2352710224022629-gr2_lrg.jpg?httpAccept=%2A%2F%2A",
            "@multimediatype": "JPEG image file",
            "@type": "IMAGE-HIGH-RES",
            "@size": "145261",
            "@ref": "gr2",
            "@mimetype": "image/jpeg"
        },
        {
            "@category": "high",
            "@height": "1195",
            "@width": "2173",
            "@_fa": "true",
            "$": "https://api.elsevier.com/content/object/eid/1-s2.0-S2352710224022629-gr3_lrg.jpg?httpAccept=%2A%2F%2A",
            "@multimediatype": "JPEG image file",
            "@type": "IMAGE-HIGH-RES",
            "@size": "201829",
            "@ref": "gr3",
            "@mimetype": "image/jpeg"
        },
        {
            "@category": "high",
            "@height": "2139",
            "@width": "2764",
            "@_fa": "true",
            "$": "https://api.elsevier.com/content/object/eid/1-s2.0-S2352710224022629-gr4_lrg.jpg?httpAccept=%2A%2F%2A",
            "@multimediatype": "JPEG image file",
            "@type": "IMAGE-HIGH-RES",
            "@size": "944368",
            "@ref": "gr4",
            "@mimetype": "image/jpeg"
        },
        {
            "@category": "thumbnail",
            "@_fa": "true",
            "$": "https://api.elsevier.com/content/object/eid/1-s2.0-S2352710224022629-si134.svg?httpAccept=%2A%2F%2A",
            "@multimediatype": "Scalable Vector Graphics file",
            "@type": "ALTIMG",
            "@size": "38213",
            "@ref": "si134",
            "@mimetype": "image/svg+xml"
        },
        {
            "@category": "thumbnail",
            "@_fa": "true",
            "$": "https://api.elsevier.com/content/object/eid/1-s2.0-S2352710224022629-si40.svg?httpAccept=%2A%2F%2A",
            "@multimediatype": "Scalable Vector Graphics file",
            "@type": "ALTIMG",
            "@size": "87191",
            "@ref": "si40",
            "@mimetype": "image/svg+xml"
        },
        {
            "@category": "thumbnail",
            "@_fa": "true",
            "$": "https://api.elsevier.com/content/object/eid/1-s2.0-S2352710224022629-si26.svg?httpAccept=%2A%2F%2A",
            "@multimediatype": "Scalable Vector Graphics file",
            "@type": "ALTIMG",
            "@size": "14089",
            "@ref": "si26",
            "@mimetype": "image/svg+xml"
        },
        {
            "@category": "thumbnail",
            "@_fa": "true",
            "$": "https://api.elsevier.com/content/object/eid/1-s2.0-S2352710224022629-si54.svg?httpAccept=%2A%2F%2A",
            "@multimediatype": "Scalable Vector Graphics file",
            "@type": "ALTIMG",
            "@size": "17703",
            "@ref": "si54",
            "@mimetype": "image/svg+xml"
        },
        {
            "@category": "thumbnail",
            "@_fa": "true",
            "$": "https://api.elsevier.com/content/object/eid/1-s2.0-S2352710224022629-si102.svg?httpAccept=%2A%2F%2A",
            "@multimediatype": "Scalable Vector Graphics file",
            "@type": "ALTIMG",
            "@size": "78859",
            "@ref": "si102",
            "@mimetype": "image/svg+xml"
        },
        {
            "@category": "thumbnail",
            "@_fa": "true",
            "$": "https://api.elsevier.com/content/object/eid/1-s2.0-S2352710224022629-si11.svg?httpAccept=%2A%2F%2A",
            "@multimediatype": "Scalable Vector Graphics file",
            "@type": "ALTIMG",
            "@size": "20468",
            "@ref": "si11",
            "@mimetype": "image/svg+xml"
        },
        {
            "@category": "thumbnail",
            "@_fa": "true",
            "$": "https://api.elsevier.com/content/object/eid/1-s2.0-S2352710224022629-si85.svg?httpAccept=%2A%2F%2A",
            "@multimediatype": "Scalable Vector Graphics file",
            "@type": "ALTIMG",
            "@size": "62230",
            "@ref": "si85",
            "@mimetype": "image/svg+xml"
        },
        {
            "@category": "thumbnail",
            "@_fa": "true",
            "$": "https://api.elsevier.com/content/object/eid/1-s2.0-S2352710224022629-si88.svg?httpAccept=%2A%2F%2A",
            "@multimediatype": "Scalable Vector Graphics file",
            "@type": "ALTIMG",
            "@size": "24514",
            "@ref": "si88",
            "@mimetype": "image/svg+xml"
        },
        {
            "@category": "thumbnail",
            "@_fa": "true",
            "$": "https://api.elsevier.com/content/object/eid/1-s2.0-S2352710224022629-si99.svg?httpAccept=%2A%2F%2A",
            "@multimediatype": "Scalable Vector Graphics file",
            "@type": "ALTIMG",
            "@size": "17672",
            "@ref": "si99",
            "@mimetype": "image/svg+xml"
        },
        {
            "@category": "thumbnail",
            "@_fa": "true",
            "$": "https://api.elsevier.com/content/object/eid/1-s2.0-S2352710224022629-si42.svg?httpAccept=%2A%2F%2A",
            "@multimediatype": "Scalable Vector Graphics file",
            "@type": "ALTIMG",
            "@size": "42186",
            "@ref": "si42",
            "@mimetype": "image/svg+xml"
        },
        {
            "@category": "thumbnail",
            "@_fa": "true",
            "$": "https://api.elsevier.com/content/object/eid/1-s2.0-S2352710224022629-si113.svg?httpAccept=%2A%2F%2A",
            "@multimediatype": "Scalable Vector Graphics file",
            "@type": "ALTIMG",
            "@size": "92813",
            "@ref": "si113",
            "@mimetype": "image/svg+xml"
        },
        {
            "@category": "thumbnail",
            "@_fa": "true",
            "$": "https://api.elsevier.com/content/object/eid/1-s2.0-S2352710224022629-si94.svg?httpAccept=%2A%2F%2A",
            "@multimediatype": "Scalable Vector Graphics file",
            "@type": "ALTIMG",
            "@size": "19768",
            "@ref": "si94",
            "@mimetype": "image/svg+xml"
        },
        {
            "@category": "thumbnail",
            "@_fa": "true",
            "$": "https://api.elsevier.com/content/object/eid/1-s2.0-S2352710224022629-si115.svg?httpAccept=%2A%2F%2A",
            "@multimediatype": "Scalable Vector Graphics file",
            "@type": "ALTIMG",
            "@size": "34297",
            "@ref": "si115",
            "@mimetype": "image/svg+xml"
        },
        {
            "@category": "thumbnail",
            "@_fa": "true",
            "$": "https://api.elsevier.com/content/object/eid/1-s2.0-S2352710224022629-si100.svg?httpAccept=%2A%2F%2A",
            "@multimediatype": "Scalable Vector Graphics file",
            "@type": "ALTIMG",
            "@size": "12945",
            "@ref": "si100",
            "@mimetype": "image/svg+xml"
        },
        {
            "@category": "thumbnail",
            "@_fa": "true",
            "$": "https://api.elsevier.com/content/object/eid/1-s2.0-S2352710224022629-si34.svg?httpAccept=%2A%2F%2A",
            "@multimediatype": "Scalable Vector Graphics file",
            "@type": "ALTIMG",
            "@size": "5751",
            "@ref": "si34",
            "@mimetype": "image/svg+xml"
        },
        {
            "@category": "thumbnail",
            "@_fa": "true",
            "$": "https://api.elsevier.com/content/object/eid/1-s2.0-S2352710224022629-si142.svg?httpAccept=%2A%2F%2A",
            "@multimediatype": "Scalable Vector Graphics file",
            "@type": "ALTIMG",
            "@size": "31447",
            "@ref": "si142",
            "@mimetype": "image/svg+xml"
        },
        {
            "@category": "thumbnail",
            "@_fa": "true",
            "$": "https://api.elsevier.com/content/object/eid/1-s2.0-S2352710224022629-si105.svg?httpAccept=%2A%2F%2A",
            "@multimediatype": "Scalable Vector Graphics file",
            "@type": "ALTIMG",
            "@size": "25448",
            "@ref": "si105",
            "@mimetype": "image/svg+xml"
        },
        {
            "@category": "thumbnail",
            "@_fa": "true",
            "$": "https://api.elsevier.com/content/object/eid/1-s2.0-S2352710224022629-si61.svg?httpAccept=%2A%2F%2A",
            "@multimediatype": "Scalable Vector Graphics file",
            "@type": "ALTIMG",
            "@size": "28031",
            "@ref": "si61",
            "@mimetype": "image/svg+xml"
        },
        {
            "@category": "thumbnail",
            "@_fa": "true",
            "$": "https://api.elsevier.com/content/object/eid/1-s2.0-S2352710224022629-si139.svg?httpAccept=%2A%2F%2A",
            "@multimediatype": "Scalable Vector Graphics file",
            "@type": "ALTIMG",
            "@size": "91916",
            "@ref": "si139",
            "@mimetype": "image/svg+xml"
        },
        {
            "@category": "thumbnail",
            "@_fa": "true",
            "$": "https://api.elsevier.com/content/object/eid/1-s2.0-S2352710224022629-si124.svg?httpAccept=%2A%2F%2A",
            "@multimediatype": "Scalable Vector Graphics file",
            "@type": "ALTIMG",
            "@size": "21501",
            "@ref": "si124",
            "@mimetype": "image/svg+xml"
        },
        {
            "@category": "thumbnail",
            "@_fa": "true",
            "$": "https://api.elsevier.com/content/object/eid/1-s2.0-S2352710224022629-si63.svg?httpAccept=%2A%2F%2A",
            "@multimediatype": "Scalable Vector Graphics file",
            "@type": "ALTIMG",
            "@size": "30129",
            "@ref": "si63",
            "@mimetype": "image/svg+xml"
        },
        {
            "@category": "thumbnail",
            "@_fa": "true",
            "$": "https://api.elsevier.com/content/object/eid/1-s2.0-S2352710224022629-si104.svg?httpAccept=%2A%2F%2A",
            "@multimediatype": "Scalable Vector Graphics file",
            "@type": "ALTIMG",
            "@size": "22789",
            "@ref": "si104",
            "@mimetype": "image/svg+xml"
        },
        {
            "@category": "thumbnail",
            "@_fa": "true",
            "$": "https://api.elsevier.com/content/object/eid/1-s2.0-S2352710224022629-si55.svg?httpAccept=%2A%2F%2A",
            "@multimediatype": "Scalable Vector Graphics file",
            "@type": "ALTIMG",
            "@size": "24377",
            "@ref": "si55",
            "@mimetype": "image/svg+xml"
        },
        {
            "@category": "thumbnail",
            "@_fa": "true",
            "$": "https://api.elsevier.com/content/object/eid/1-s2.0-S2352710224022629-si32.svg?httpAccept=%2A%2F%2A",
            "@multimediatype": "Scalable Vector Graphics file",
            "@type": "ALTIMG",
            "@size": "4461",
            "@ref": "si32",
            "@mimetype": "image/svg+xml"
        },
        {
            "@category": "thumbnail",
            "@_fa": "true",
            "$": "https://api.elsevier.com/content/object/eid/1-s2.0-S2352710224022629-si37.svg?httpAccept=%2A%2F%2A",
            "@multimediatype": "Scalable Vector Graphics file",
            "@type": "ALTIMG",
            "@size": "7850",
            "@ref": "si37",
            "@mimetype": "image/svg+xml"
        },
        {
            "@category": "thumbnail",
            "@_fa": "true",
            "$": "https://api.elsevier.com/content/object/eid/1-s2.0-S2352710224022629-si73.svg?httpAccept=%2A%2F%2A",
            "@multimediatype": "Scalable Vector Graphics file",
            "@type": "ALTIMG",
            "@size": "13874",
            "@ref": "si73",
            "@mimetype": "image/svg+xml"
        },
        {
            "@category": "thumbnail",
            "@_fa": "true",
            "$": "https://api.elsevier.com/content/object/eid/1-s2.0-S2352710224022629-si140.svg?httpAccept=%2A%2F%2A",
            "@multimediatype": "Scalable Vector Graphics file",
            "@type": "ALTIMG",
            "@size": "22236",
            "@ref": "si140",
            "@mimetype": "image/svg+xml"
        },
        {
            "@category": "thumbnail",
            "@_fa": "true",
            "$": "https://api.elsevier.com/content/object/eid/1-s2.0-S2352710224022629-si107.svg?httpAccept=%2A%2F%2A",
            "@multimediatype": "Scalable Vector Graphics file",
            "@type": "ALTIMG",
            "@size": "11411",
            "@ref": "si107",
            "@mimetype": "image/svg+xml"
        },
        {
            "@category": "thumbnail",
            "@_fa": "true",
            "$": "https://api.elsevier.com/content/object/eid/1-s2.0-S2352710224022629-si156.svg?httpAccept=%2A%2F%2A",
            "@multimediatype": "Scalable Vector Graphics file",
            "@type": "ALTIMG",
            "@size": "12665",
            "@ref": "si156",
            "@mimetype": "image/svg+xml"
        },
        {
            "@category": "thumbnail",
            "@_fa": "true",
            "$": "https://api.elsevier.com/content/object/eid/1-s2.0-S2352710224022629-si44.svg?httpAccept=%2A%2F%2A",
            "@multimediatype": "Scalable Vector Graphics file",
            "@type": "ALTIMG",
            "@size": "60095",
            "@ref": "si44",
            "@mimetype": "image/svg+xml"
        },
        {
            "@category": "thumbnail",
            "@_fa": "true",
            "$": "https://api.elsevier.com/content/object/eid/1-s2.0-S2352710224022629-si146.svg?httpAccept=%2A%2F%2A",
            "@multimediatype": "Scalable Vector Graphics file",
            "@type": "ALTIMG",
            "@size": "40014",
            "@ref": "si146",
            "@mimetype": "image/svg+xml"
        },
        {
            "@category": "thumbnail",
            "@_fa": "true",
            "$": "https://api.elsevier.com/content/object/eid/1-s2.0-S2352710224022629-si138.svg?httpAccept=%2A%2F%2A",
            "@multimediatype": "Scalable Vector Graphics file",
            "@type": "ALTIMG",
            "@size": "34052",
            "@ref": "si138",
            "@mimetype": "image/svg+xml"
        },
        {
            "@category": "thumbnail",
            "@_fa": "true",
            "$": "https://api.elsevier.com/content/object/eid/1-s2.0-S2352710224022629-si56.svg?httpAccept=%2A%2F%2A",
            "@multimediatype": "Scalable Vector Graphics file",
            "@type": "ALTIMG",
            "@size": "17226",
            "@ref": "si56",
            "@mimetype": "image/svg+xml"
        },
        {
            "@category": "thumbnail",
            "@_fa": "true",
            "$": "https://api.elsevier.com/content/object/eid/1-s2.0-S2352710224022629-si20.svg?httpAccept=%2A%2F%2A",
            "@multimediatype": "Scalable Vector Graphics file",
            "@type": "ALTIMG",
            "@size": "4504",
            "@ref": "si20",
            "@mimetype": "image/svg+xml"
        },
        {
            "@category": "thumbnail",
            "@_fa": "true",
            "$": "https://api.elsevier.com/content/object/eid/1-s2.0-S2352710224022629-si9.svg?httpAccept=%2A%2F%2A",
            "@multimediatype": "Scalable Vector Graphics file",
            "@type": "ALTIMG",
            "@size": "30843",
            "@ref": "si9",
            "@mimetype": "image/svg+xml"
        },
        {
            "@category": "thumbnail",
            "@_fa": "true",
            "$": "https://api.elsevier.com/content/object/eid/1-s2.0-S2352710224022629-si110.svg?httpAccept=%2A%2F%2A",
            "@multimediatype": "Scalable Vector Graphics file",
            "@type": "ALTIMG",
            "@size": "6381",
            "@ref": "si110",
            "@mimetype": "image/svg+xml"
        },
        {
            "@category": "thumbnail",
            "@_fa": "true",
            "$": "https://api.elsevier.com/content/object/eid/1-s2.0-S2352710224022629-si106.svg?httpAccept=%2A%2F%2A",
            "@multimediatype": "Scalable Vector Graphics file",
            "@type": "ALTIMG",
            "@size": "123651",
            "@ref": "si106",
            "@mimetype": "image/svg+xml"
        },
        {
            "@category": "thumbnail",
            "@_fa": "true",
            "$": "https://api.elsevier.com/content/object/eid/1-s2.0-S2352710224022629-si114.svg?httpAccept=%2A%2F%2A",
            "@multimediatype": "Scalable Vector Graphics file",
            "@type": "ALTIMG",
            "@size": "30279",
            "@ref": "si114",
            "@mimetype": "image/svg+xml"
        },
        {
            "@category": "thumbnail",
            "@_fa": "true",
            "$": "https://api.elsevier.com/content/object/eid/1-s2.0-S2352710224022629-si101.svg?httpAccept=%2A%2F%2A",
            "@multimediatype": "Scalable Vector Graphics file",
            "@type": "ALTIMG",
            "@size": "4549",
            "@ref": "si101",
            "@mimetype": "image/svg+xml"
        },
        {
            "@category": "thumbnail",
            "@_fa": "true",
            "$": "https://api.elsevier.com/content/object/eid/1-s2.0-S2352710224022629-si67.svg?httpAccept=%2A%2F%2A",
            "@multimediatype": "Scalable Vector Graphics file",
            "@type": "ALTIMG",
            "@size": "15413",
            "@ref": "si67",
            "@mimetype": "image/svg+xml"
        },
        {
            "@category": "thumbnail",
            "@_fa": "true",
            "$": "https://api.elsevier.com/content/object/eid/1-s2.0-S2352710224022629-si1.svg?httpAccept=%2A%2F%2A",
            "@multimediatype": "Scalable Vector Graphics file",
            "@type": "ALTIMG",
            "@size": "7185",
            "@ref": "si1",
            "@mimetype": "image/svg+xml"
        },
        {
            "@category": "thumbnail",
            "@_fa": "true",
            "$": "https://api.elsevier.com/content/object/eid/1-s2.0-S2352710224022629-si97.svg?httpAccept=%2A%2F%2A",
            "@multimediatype": "Scalable Vector Graphics file",
            "@type": "ALTIMG",
            "@size": "34162",
            "@ref": "si97",
            "@mimetype": "image/svg+xml"
        },
        {
            "@category": "thumbnail",
            "@_fa": "true",
            "$": "https://api.elsevier.com/content/object/eid/1-s2.0-S2352710224022629-si15.svg?httpAccept=%2A%2F%2A",
            "@multimediatype": "Scalable Vector Graphics file",
            "@type": "ALTIMG",
            "@size": "23014",
            "@ref": "si15",
            "@mimetype": "image/svg+xml"
        },
        {
            "@category": "thumbnail",
            "@_fa": "true",
            "$": "https://api.elsevier.com/content/object/eid/1-s2.0-S2352710224022629-si8.svg?httpAccept=%2A%2F%2A",
            "@multimediatype": "Scalable Vector Graphics file",
            "@type": "ALTIMG",
            "@size": "35118",
            "@ref": "si8",
            "@mimetype": "image/svg+xml"
        },
        {
            "@category": "thumbnail",
            "@_fa": "true",
            "$": "https://api.elsevier.com/content/object/eid/1-s2.0-S2352710224022629-si118.svg?httpAccept=%2A%2F%2A",
            "@multimediatype": "Scalable Vector Graphics file",
            "@type": "ALTIMG",
            "@size": "49194",
            "@ref": "si118",
            "@mimetype": "image/svg+xml"
        },
        {
            "@category": "thumbnail",
            "@_fa": "true",
            "$": "https://api.elsevier.com/content/object/eid/1-s2.0-S2352710224022629-si45.svg?httpAccept=%2A%2F%2A",
            "@multimediatype": "Scalable Vector Graphics file",
            "@type": "ALTIMG",
            "@size": "62892",
            "@ref": "si45",
            "@mimetype": "image/svg+xml"
        },
        {
            "@category": "thumbnail",
            "@_fa": "true",
            "$": "https://api.elsevier.com/content/object/eid/1-s2.0-S2352710224022629-si131.svg?httpAccept=%2A%2F%2A",
            "@multimediatype": "Scalable Vector Graphics file",
            "@type": "ALTIMG",
            "@size": "14556",
            "@ref": "si131",
            "@mimetype": "image/svg+xml"
        },
        {
            "@category": "thumbnail",
            "@_fa": "true",
            "$": "https://api.elsevier.com/content/object/eid/1-s2.0-S2352710224022629-si122.svg?httpAccept=%2A%2F%2A",
            "@multimediatype": "Scalable Vector Graphics file",
            "@type": "ALTIMG",
            "@size": "16149",
            "@ref": "si122",
            "@mimetype": "image/svg+xml"
        },
        {
            "@category": "thumbnail",
            "@_fa": "true",
            "$": "https://api.elsevier.com/content/object/eid/1-s2.0-S2352710224022629-si64.svg?httpAccept=%2A%2F%2A",
            "@multimediatype": "Scalable Vector Graphics file",
            "@type": "ALTIMG",
            "@size": "29158",
            "@ref": "si64",
            "@mimetype": "image/svg+xml"
        },
        {
            "@category": "thumbnail",
            "@_fa": "true",
            "$": "https://api.elsevier.com/content/object/eid/1-s2.0-S2352710224022629-si89.svg?httpAccept=%2A%2F%2A",
            "@multimediatype": "Scalable Vector Graphics file",
            "@type": "ALTIMG",
            "@size": "29659",
            "@ref": "si89",
            "@mimetype": "image/svg+xml"
        },
        {
            "@category": "thumbnail",
            "@_fa": "true",
            "$": "https://api.elsevier.com/content/object/eid/1-s2.0-S2352710224022629-si81.svg?httpAccept=%2A%2F%2A",
            "@multimediatype": "Scalable Vector Graphics file",
            "@type": "ALTIMG",
            "@size": "54334",
            "@ref": "si81",
            "@mimetype": "image/svg+xml"
        },
        {
            "@category": "thumbnail",
            "@_fa": "true",
            "$": "https://api.elsevier.com/content/object/eid/1-s2.0-S2352710224022629-si129.svg?httpAccept=%2A%2F%2A",
            "@multimediatype": "Scalable Vector Graphics file",
            "@type": "ALTIMG",
            "@size": "36636",
            "@ref": "si129",
            "@mimetype": "image/svg+xml"
        },
        {
            "@category": "thumbnail",
            "@_fa": "true",
            "$": "https://api.elsevier.com/content/object/eid/1-s2.0-S2352710224022629-si152.svg?httpAccept=%2A%2F%2A",
            "@multimediatype": "Scalable Vector Graphics file",
            "@type": "ALTIMG",
            "@size": "28098",
            "@ref": "si152",
            "@mimetype": "image/svg+xml"
        },
        {
            "@category": "thumbnail",
            "@_fa": "true",
            "$": "https://api.elsevier.com/content/object/eid/1-s2.0-S2352710224022629-si3.svg?httpAccept=%2A%2F%2A",
            "@multimediatype": "Scalable Vector Graphics file",
            "@type": "ALTIMG",
            "@size": "12299",
            "@ref": "si3",
            "@mimetype": "image/svg+xml"
        },
        {
            "@category": "thumbnail",
            "@_fa": "true",
            "$": "https://api.elsevier.com/content/object/eid/1-s2.0-S2352710224022629-si120.svg?httpAccept=%2A%2F%2A",
            "@multimediatype": "Scalable Vector Graphics file",
            "@type": "ALTIMG",
            "@size": "13085",
            "@ref": "si120",
            "@mimetype": "image/svg+xml"
        },
        {
            "@category": "thumbnail",
            "@_fa": "true",
            "$": "https://api.elsevier.com/content/object/eid/1-s2.0-S2352710224022629-si123.svg?httpAccept=%2A%2F%2A",
            "@multimediatype": "Scalable Vector Graphics file",
            "@type": "ALTIMG",
            "@size": "33659",
            "@ref": "si123",
            "@mimetype": "image/svg+xml"
        },
        {
            "@category": "thumbnail",
            "@_fa": "true",
            "$": "https://api.elsevier.com/content/object/eid/1-s2.0-S2352710224022629-si79.svg?httpAccept=%2A%2F%2A",
            "@multimediatype": "Scalable Vector Graphics file",
            "@type": "ALTIMG",
            "@size": "22606",
            "@ref": "si79",
            "@mimetype": "image/svg+xml"
        },
        {
            "@category": "thumbnail",
            "@_fa": "true",
            "$": "https://api.elsevier.com/content/object/eid/1-s2.0-S2352710224022629-si28.svg?httpAccept=%2A%2F%2A",
            "@multimediatype": "Scalable Vector Graphics file",
            "@type": "ALTIMG",
            "@size": "6522",
            "@ref": "si28",
            "@mimetype": "image/svg+xml"
        },
        {
            "@category": "thumbnail",
            "@_fa": "true",
            "$": "https://api.elsevier.com/content/object/eid/1-s2.0-S2352710224022629-si103.svg?httpAccept=%2A%2F%2A",
            "@multimediatype": "Scalable Vector Graphics file",
            "@type": "ALTIMG",
            "@size": "36467",
            "@ref": "si103",
            "@mimetype": "image/svg+xml"
        },
        {
            "@category": "thumbnail",
            "@_fa": "true",
            "$": "https://api.elsevier.com/content/object/eid/1-s2.0-S2352710224022629-si96.svg?httpAccept=%2A%2F%2A",
            "@multimediatype": "Scalable Vector Graphics file",
            "@type": "ALTIMG",
            "@size": "7122",
            "@ref": "si96",
            "@mimetype": "image/svg+xml"
        },
        {
            "@category": "thumbnail",
            "@_fa": "true",
            "$": "https://api.elsevier.com/content/object/eid/1-s2.0-S2352710224022629-si13.svg?httpAccept=%2A%2F%2A",
            "@multimediatype": "Scalable Vector Graphics file",
            "@type": "ALTIMG",
            "@size": "21350",
            "@ref": "si13",
            "@mimetype": "image/svg+xml"
        },
        {
            "@category": "thumbnail",
            "@_fa": "true",
            "$": "https://api.elsevier.com/content/object/eid/1-s2.0-S2352710224022629-si78.svg?httpAccept=%2A%2F%2A",
            "@multimediatype": "Scalable Vector Graphics file",
            "@type": "ALTIMG",
            "@size": "78897",
            "@ref": "si78",
            "@mimetype": "image/svg+xml"
        },
        {
            "@category": "thumbnail",
            "@_fa": "true",
            "$": "https://api.elsevier.com/content/object/eid/1-s2.0-S2352710224022629-si17.svg?httpAccept=%2A%2F%2A",
            "@multimediatype": "Scalable Vector Graphics file",
            "@type": "ALTIMG",
            "@size": "5866",
            "@ref": "si17",
            "@mimetype": "image/svg+xml"
        },
        {
            "@category": "thumbnail",
            "@_fa": "true",
            "$": "https://api.elsevier.com/content/object/eid/1-s2.0-S2352710224022629-si72.svg?httpAccept=%2A%2F%2A",
            "@multimediatype": "Scalable Vector Graphics file",
            "@type": "ALTIMG",
            "@size": "34351",
            "@ref": "si72",
            "@mimetype": "image/svg+xml"
        },
        {
            "@category": "thumbnail",
            "@_fa": "true",
            "$": "https://api.elsevier.com/content/object/eid/1-s2.0-S2352710224022629-si66.svg?httpAccept=%2A%2F%2A",
            "@multimediatype": "Scalable Vector Graphics file",
            "@type": "ALTIMG",
            "@size": "13463",
            "@ref": "si66",
            "@mimetype": "image/svg+xml"
        },
        {
            "@category": "thumbnail",
            "@_fa": "true",
            "$": "https://api.elsevier.com/content/object/eid/1-s2.0-S2352710224022629-si116.svg?httpAccept=%2A%2F%2A",
            "@multimediatype": "Scalable Vector Graphics file",
            "@type": "ALTIMG",
            "@size": "21799",
            "@ref": "si116",
            "@mimetype": "image/svg+xml"
        },
        {
            "@category": "thumbnail",
            "@_fa": "true",
            "$": "https://api.elsevier.com/content/object/eid/1-s2.0-S2352710224022629-si5.svg?httpAccept=%2A%2F%2A",
            "@multimediatype": "Scalable Vector Graphics file",
            "@type": "ALTIMG",
            "@size": "11718",
            "@ref": "si5",
            "@mimetype": "image/svg+xml"
        },
        {
            "@category": "thumbnail",
            "@_fa": "true",
            "$": "https://api.elsevier.com/content/object/eid/1-s2.0-S2352710224022629-si93.svg?httpAccept=%2A%2F%2A",
            "@multimediatype": "Scalable Vector Graphics file",
            "@type": "ALTIMG",
            "@size": "42924",
            "@ref": "si93",
            "@mimetype": "image/svg+xml"
        },
        {
            "@category": "thumbnail",
            "@_fa": "true",
            "$": "https://api.elsevier.com/content/object/eid/1-s2.0-S2352710224022629-si157.svg?httpAccept=%2A%2F%2A",
            "@multimediatype": "Scalable Vector Graphics file",
            "@type": "ALTIMG",
            "@size": "20386",
            "@ref": "si157",
            "@mimetype": "image/svg+xml"
        },
        {
            "@category": "thumbnail",
            "@_fa": "true",
            "$": "https://api.elsevier.com/content/object/eid/1-s2.0-S2352710224022629-si87.svg?httpAccept=%2A%2F%2A",
            "@multimediatype": "Scalable Vector Graphics file",
            "@type": "ALTIMG",
            "@size": "143008",
            "@ref": "si87",
            "@mimetype": "image/svg+xml"
        },
        {
            "@category": "thumbnail",
            "@_fa": "true",
            "$": "https://api.elsevier.com/content/object/eid/1-s2.0-S2352710224022629-si25.svg?httpAccept=%2A%2F%2A",
            "@multimediatype": "Scalable Vector Graphics file",
            "@type": "ALTIMG",
            "@size": "16077",
            "@ref": "si25",
            "@mimetype": "image/svg+xml"
        },
        {
            "@category": "thumbnail",
            "@_fa": "true",
            "$": "https://api.elsevier.com/content/object/eid/1-s2.0-S2352710224022629-si33.svg?httpAccept=%2A%2F%2A",
            "@multimediatype": "Scalable Vector Graphics file",
            "@type": "ALTIMG",
            "@size": "6356",
            "@ref": "si33",
            "@mimetype": "image/svg+xml"
        },
        {
            "@category": "thumbnail",
            "@_fa": "true",
            "$": "https://api.elsevier.com/content/object/eid/1-s2.0-S2352710224022629-si70.svg?httpAccept=%2A%2F%2A",
            "@multimediatype": "Scalable Vector Graphics file",
            "@type": "ALTIMG",
            "@size": "93729",
            "@ref": "si70",
            "@mimetype": "image/svg+xml"
        },
        {
            "@category": "thumbnail",
            "@_fa": "true",
            "$": "https://api.elsevier.com/content/object/eid/1-s2.0-S2352710224022629-si71.svg?httpAccept=%2A%2F%2A",
            "@multimediatype": "Scalable Vector Graphics file",
            "@type": "ALTIMG",
            "@size": "9793",
            "@ref": "si71",
            "@mimetype": "image/svg+xml"
        },
        {
            "@category": "thumbnail",
            "@_fa": "true",
            "$": "https://api.elsevier.com/content/object/eid/1-s2.0-S2352710224022629-si149.svg?httpAccept=%2A%2F%2A",
            "@multimediatype": "Scalable Vector Graphics file",
            "@type": "ALTIMG",
            "@size": "35688",
            "@ref": "si149",
            "@mimetype": "image/svg+xml"
        },
        {
            "@category": "thumbnail",
            "@_fa": "true",
            "$": "https://api.elsevier.com/content/object/eid/1-s2.0-S2352710224022629-si135.svg?httpAccept=%2A%2F%2A",
            "@multimediatype": "Scalable Vector Graphics file",
            "@type": "ALTIMG",
            "@size": "30552",
            "@ref": "si135",
            "@mimetype": "image/svg+xml"
        },
        {
            "@category": "thumbnail",
            "@_fa": "true",
            "$": "https://api.elsevier.com/content/object/eid/1-s2.0-S2352710224022629-si80.svg?httpAccept=%2A%2F%2A",
            "@multimediatype": "Scalable Vector Graphics file",
            "@type": "ALTIMG",
            "@size": "33235",
            "@ref": "si80",
            "@mimetype": "image/svg+xml"
        },
        {
            "@category": "thumbnail",
            "@_fa": "true",
            "$": "https://api.elsevier.com/content/object/eid/1-s2.0-S2352710224022629-si62.svg?httpAccept=%2A%2F%2A",
            "@multimediatype": "Scalable Vector Graphics file",
            "@type": "ALTIMG",
            "@size": "30757",
            "@ref": "si62",
            "@mimetype": "image/svg+xml"
        },
        {
            "@category": "thumbnail",
            "@_fa": "true",
            "$": "https://api.elsevier.com/content/object/eid/1-s2.0-S2352710224022629-si12.svg?httpAccept=%2A%2F%2A",
            "@multimediatype": "Scalable Vector Graphics file",
            "@type": "ALTIMG",
            "@size": "32626",
            "@ref": "si12",
            "@mimetype": "image/svg+xml"
        },
        {
            "@category": "thumbnail",
            "@_fa": "true",
            "$": "https://api.elsevier.com/content/object/eid/1-s2.0-S2352710224022629-si98.svg?httpAccept=%2A%2F%2A",
            "@multimediatype": "Scalable Vector Graphics file",
            "@type": "ALTIMG",
            "@size": "9561",
            "@ref": "si98",
            "@mimetype": "image/svg+xml"
        },
        {
            "@category": "thumbnail",
            "@_fa": "true",
            "$": "https://api.elsevier.com/content/object/eid/1-s2.0-S2352710224022629-si145.svg?httpAccept=%2A%2F%2A",
            "@multimediatype": "Scalable Vector Graphics file",
            "@type": "ALTIMG",
            "@size": "41149",
            "@ref": "si145",
            "@mimetype": "image/svg+xml"
        },
        {
            "@category": "thumbnail",
            "@_fa": "true",
            "$": "https://api.elsevier.com/content/object/eid/1-s2.0-S2352710224022629-si151.svg?httpAccept=%2A%2F%2A",
            "@multimediatype": "Scalable Vector Graphics file",
            "@type": "ALTIMG",
            "@size": "48367",
            "@ref": "si151",
            "@mimetype": "image/svg+xml"
        },
        {
            "@category": "thumbnail",
            "@_fa": "true",
            "$": "https://api.elsevier.com/content/object/eid/1-s2.0-S2352710224022629-si57.svg?httpAccept=%2A%2F%2A",
            "@multimediatype": "Scalable Vector Graphics file",
            "@type": "ALTIMG",
            "@size": "14068",
            "@ref": "si57",
            "@mimetype": "image/svg+xml"
        },
        {
            "@category": "thumbnail",
            "@_fa": "true",
            "$": "https://api.elsevier.com/content/object/eid/1-s2.0-S2352710224022629-si68.svg?httpAccept=%2A%2F%2A",
            "@multimediatype": "Scalable Vector Graphics file",
            "@type": "ALTIMG",
            "@size": "14234",
            "@ref": "si68",
            "@mimetype": "image/svg+xml"
        },
        {
            "@category": "thumbnail",
            "@_fa": "true",
            "$": "https://api.elsevier.com/content/object/eid/1-s2.0-S2352710224022629-si159.svg?httpAccept=%2A%2F%2A",
            "@multimediatype": "Scalable Vector Graphics file",
            "@type": "ALTIMG",
            "@size": "18428",
            "@ref": "si159",
            "@mimetype": "image/svg+xml"
        },
        {
            "@category": "thumbnail",
            "@_fa": "true",
            "$": "https://api.elsevier.com/content/object/eid/1-s2.0-S2352710224022629-si95.svg?httpAccept=%2A%2F%2A",
            "@multimediatype": "Scalable Vector Graphics file",
            "@type": "ALTIMG",
            "@size": "22425",
            "@ref": "si95",
            "@mimetype": "image/svg+xml"
        },
        {
            "@category": "thumbnail",
            "@_fa": "true",
            "$": "https://api.elsevier.com/content/object/eid/1-s2.0-S2352710224022629-si38.svg?httpAccept=%2A%2F%2A",
            "@multimediatype": "Scalable Vector Graphics file",
            "@type": "ALTIMG",
            "@size": "9209",
            "@ref": "si38",
            "@mimetype": "image/svg+xml"
        },
        {
            "@category": "thumbnail",
            "@_fa": "true",
            "$": "https://api.elsevier.com/content/object/eid/1-s2.0-S2352710224022629-si83.svg?httpAccept=%2A%2F%2A",
            "@multimediatype": "Scalable Vector Graphics file",
            "@type": "ALTIMG",
            "@size": "75773",
            "@ref": "si83",
            "@mimetype": "image/svg+xml"
        },
        {
            "@category": "thumbnail",
            "@_fa": "true",
            "$": "https://api.elsevier.com/content/object/eid/1-s2.0-S2352710224022629-si76.svg?httpAccept=%2A%2F%2A",
            "@multimediatype": "Scalable Vector Graphics file",
            "@type": "ALTIMG",
            "@size": "9190",
            "@ref": "si76",
            "@mimetype": "image/svg+xml"
        },
        {
            "@category": "thumbnail",
            "@_fa": "true",
            "$": "https://api.elsevier.com/content/object/eid/1-s2.0-S2352710224022629-si47.svg?httpAccept=%2A%2F%2A",
            "@multimediatype": "Scalable Vector Graphics file",
            "@type": "ALTIMG",
            "@size": "13548",
            "@ref": "si47",
            "@mimetype": "image/svg+xml"
        },
        {
            "@category": "thumbnail",
            "@_fa": "true",
            "$": "https://api.elsevier.com/content/object/eid/1-s2.0-S2352710224022629-si27.svg?httpAccept=%2A%2F%2A",
            "@multimediatype": "Scalable Vector Graphics file",
            "@type": "ALTIMG",
            "@size": "3940",
            "@ref": "si27",
            "@mimetype": "image/svg+xml"
        },
        {
            "@category": "thumbnail",
            "@_fa": "true",
            "$": "https://api.elsevier.com/content/object/eid/1-s2.0-S2352710224022629-si49.svg?httpAccept=%2A%2F%2A",
            "@multimediatype": "Scalable Vector Graphics file",
            "@type": "ALTIMG",
            "@size": "33474",
            "@ref": "si49",
            "@mimetype": "image/svg+xml"
        },
        {
            "@category": "thumbnail",
            "@_fa": "true",
            "$": "https://api.elsevier.com/content/object/eid/1-s2.0-S2352710224022629-si126.svg?httpAccept=%2A%2F%2A",
            "@multimediatype": "Scalable Vector Graphics file",
            "@type": "ALTIMG",
            "@size": "15151",
            "@ref": "si126",
            "@mimetype": "image/svg+xml"
        },
        {
            "@category": "thumbnail",
            "@_fa": "true",
            "$": "https://api.elsevier.com/content/object/eid/1-s2.0-S2352710224022629-si24.svg?httpAccept=%2A%2F%2A",
            "@multimediatype": "Scalable Vector Graphics file",
            "@type": "ALTIMG",
            "@size": "6504",
            "@ref": "si24",
            "@mimetype": "image/svg+xml"
        },
        {
            "@category": "thumbnail",
            "@_fa": "true",
            "$": "https://api.elsevier.com/content/object/eid/1-s2.0-S2352710224022629-si22.svg?httpAccept=%2A%2F%2A",
            "@multimediatype": "Scalable Vector Graphics file",
            "@type": "ALTIMG",
            "@size": "9936",
            "@ref": "si22",
            "@mimetype": "image/svg+xml"
        },
        {
            "@category": "thumbnail",
            "@_fa": "true",
            "$": "https://api.elsevier.com/content/object/eid/1-s2.0-S2352710224022629-si158.svg?httpAccept=%2A%2F%2A",
            "@multimediatype": "Scalable Vector Graphics file",
            "@type": "ALTIMG",
            "@size": "22038",
            "@ref": "si158",
            "@mimetype": "image/svg+xml"
        },
        {
            "@category": "thumbnail",
            "@_fa": "true",
            "$": "https://api.elsevier.com/content/object/eid/1-s2.0-S2352710224022629-si21.svg?httpAccept=%2A%2F%2A",
            "@multimediatype": "Scalable Vector Graphics file",
            "@type": "ALTIMG",
            "@size": "13381",
            "@ref": "si21",
            "@mimetype": "image/svg+xml"
        },
        {
            "@category": "thumbnail",
            "@_fa": "true",
            "$": "https://api.elsevier.com/content/object/eid/1-s2.0-S2352710224022629-si148.svg?httpAccept=%2A%2F%2A",
            "@multimediatype": "Scalable Vector Graphics file",
            "@type": "ALTIMG",
            "@size": "44490",
            "@ref": "si148",
            "@mimetype": "image/svg+xml"
        },
        {
            "@category": "thumbnail",
            "@_fa": "true",
            "$": "https://api.elsevier.com/content/object/eid/1-s2.0-S2352710224022629-si10.svg?httpAccept=%2A%2F%2A",
            "@multimediatype": "Scalable Vector Graphics file",
            "@type": "ALTIMG",
            "@size": "7018",
            "@ref": "si10",
            "@mimetype": "image/svg+xml"
        },
        {
            "@category": "thumbnail",
            "@_fa": "true",
            "$": "https://api.elsevier.com/content/object/eid/1-s2.0-S2352710224022629-si108.svg?httpAccept=%2A%2F%2A",
            "@multimediatype": "Scalable Vector Graphics file",
            "@type": "ALTIMG",
            "@size": "18034",
            "@ref": "si108",
            "@mimetype": "image/svg+xml"
        },
        {
            "@category": "thumbnail",
            "@_fa": "true",
            "$": "https://api.elsevier.com/content/object/eid/1-s2.0-S2352710224022629-si52.svg?httpAccept=%2A%2F%2A",
            "@multimediatype": "Scalable Vector Graphics file",
            "@type": "ALTIMG",
            "@size": "8804",
            "@ref": "si52",
            "@mimetype": "image/svg+xml"
        },
        {
            "@category": "thumbnail",
            "@_fa": "true",
            "$": "https://api.elsevier.com/content/object/eid/1-s2.0-S2352710224022629-si74.svg?httpAccept=%2A%2F%2A",
            "@multimediatype": "Scalable Vector Graphics file",
            "@type": "ALTIMG",
            "@size": "41916",
            "@ref": "si74",
            "@mimetype": "image/svg+xml"
        },
        {
            "@category": "thumbnail",
            "@_fa": "true",
            "$": "https://api.elsevier.com/content/object/eid/1-s2.0-S2352710224022629-si82.svg?httpAccept=%2A%2F%2A",
            "@multimediatype": "Scalable Vector Graphics file",
            "@type": "ALTIMG",
            "@size": "81693",
            "@ref": "si82",
            "@mimetype": "image/svg+xml"
        },
        {
            "@category": "thumbnail",
            "@_fa": "true",
            "$": "https://api.elsevier.com/content/object/eid/1-s2.0-S2352710224022629-si132.svg?httpAccept=%2A%2F%2A",
            "@multimediatype": "Scalable Vector Graphics file",
            "@type": "ALTIMG",
            "@size": "16387",
            "@ref": "si132",
            "@mimetype": "image/svg+xml"
        },
        {
            "@category": "thumbnail",
            "@_fa": "true",
            "$": "https://api.elsevier.com/content/object/eid/1-s2.0-S2352710224022629-si19.svg?httpAccept=%2A%2F%2A",
            "@multimediatype": "Scalable Vector Graphics file",
            "@type": "ALTIMG",
            "@size": "4361",
            "@ref": "si19",
            "@mimetype": "image/svg+xml"
        },
        {
            "@category": "thumbnail",
            "@_fa": "true",
            "$": "https://api.elsevier.com/content/object/eid/1-s2.0-S2352710224022629-si35.svg?httpAccept=%2A%2F%2A",
            "@multimediatype": "Scalable Vector Graphics file",
            "@type": "ALTIMG",
            "@size": "6728",
            "@ref": "si35",
            "@mimetype": "image/svg+xml"
        },
        {
            "@category": "thumbnail",
            "@_fa": "true",
            "$": "https://api.elsevier.com/content/object/eid/1-s2.0-S2352710224022629-si143.svg?httpAccept=%2A%2F%2A",
            "@multimediatype": "Scalable Vector Graphics file",
            "@type": "ALTIMG",
            "@size": "49408",
            "@ref": "si143",
            "@mimetype": "image/svg+xml"
        },
        {
            "@category": "thumbnail",
            "@_fa": "true",
            "$": "https://api.elsevier.com/content/object/eid/1-s2.0-S2352710224022629-si36.svg?httpAccept=%2A%2F%2A",
            "@multimediatype": "Scalable Vector Graphics file",
            "@type": "ALTIMG",
            "@size": "11931",
            "@ref": "si36",
            "@mimetype": "image/svg+xml"
        },
        {
            "@category": "thumbnail",
            "@_fa": "true",
            "$": "https://api.elsevier.com/content/object/eid/1-s2.0-S2352710224022629-si137.svg?httpAccept=%2A%2F%2A",
            "@multimediatype": "Scalable Vector Graphics file",
            "@type": "ALTIMG",
            "@size": "31191",
            "@ref": "si137",
            "@mimetype": "image/svg+xml"
        },
        {
            "@category": "thumbnail",
            "@_fa": "true",
            "$": "https://api.elsevier.com/content/object/eid/1-s2.0-S2352710224022629-si75.svg?httpAccept=%2A%2F%2A",
            "@multimediatype": "Scalable Vector Graphics file",
            "@type": "ALTIMG",
            "@size": "11602",
            "@ref": "si75",
            "@mimetype": "image/svg+xml"
        },
        {
            "@category": "thumbnail",
            "@_fa": "true",
            "$": "https://api.elsevier.com/content/object/eid/1-s2.0-S2352710224022629-si117.svg?httpAccept=%2A%2F%2A",
            "@multimediatype": "Scalable Vector Graphics file",
            "@type": "ALTIMG",
            "@size": "51889",
            "@ref": "si117",
            "@mimetype": "image/svg+xml"
        },
        {
            "@category": "thumbnail",
            "@_fa": "true",
            "$": "https://api.elsevier.com/content/object/eid/1-s2.0-S2352710224022629-si51.svg?httpAccept=%2A%2F%2A",
            "@multimediatype": "Scalable Vector Graphics file",
            "@type": "ALTIMG",
            "@size": "13916",
            "@ref": "si51",
            "@mimetype": "image/svg+xml"
        },
        {
            "@category": "thumbnail",
            "@_fa": "true",
            "$": "https://api.elsevier.com/content/object/eid/1-s2.0-S2352710224022629-si58.svg?httpAccept=%2A%2F%2A",
            "@multimediatype": "Scalable Vector Graphics file",
            "@type": "ALTIMG",
            "@size": "15185",
            "@ref": "si58",
            "@mimetype": "image/svg+xml"
        },
        {
            "@category": "thumbnail",
            "@_fa": "true",
            "$": "https://api.elsevier.com/content/object/eid/1-s2.0-S2352710224022629-si16.svg?httpAccept=%2A%2F%2A",
            "@multimediatype": "Scalable Vector Graphics file",
            "@type": "ALTIMG",
            "@size": "8537",
            "@ref": "si16",
            "@mimetype": "image/svg+xml"
        },
        {
            "@category": "thumbnail",
            "@_fa": "true",
            "$": "https://api.elsevier.com/content/object/eid/1-s2.0-S2352710224022629-si144.svg?httpAccept=%2A%2F%2A",
            "@multimediatype": "Scalable Vector Graphics file",
            "@type": "ALTIMG",
            "@size": "14014",
            "@ref": "si144",
            "@mimetype": "image/svg+xml"
        },
        {
            "@category": "thumbnail",
            "@_fa": "true",
            "$": "https://api.elsevier.com/content/object/eid/1-s2.0-S2352710224022629-si14.svg?httpAccept=%2A%2F%2A",
            "@multimediatype": "Scalable Vector Graphics file",
            "@type": "ALTIMG",
            "@size": "17547",
            "@ref": "si14",
            "@mimetype": "image/svg+xml"
        },
        {
            "@category": "thumbnail",
            "@_fa": "true",
            "$": "https://api.elsevier.com/content/object/eid/1-s2.0-S2352710224022629-si4.svg?httpAccept=%2A%2F%2A",
            "@multimediatype": "Scalable Vector Graphics file",
            "@type": "ALTIMG",
            "@size": "12770",
            "@ref": "si4",
            "@mimetype": "image/svg+xml"
        },
        {
            "@category": "thumbnail",
            "@_fa": "true",
            "$": "https://api.elsevier.com/content/object/eid/1-s2.0-S2352710224022629-si41.svg?httpAccept=%2A%2F%2A",
            "@multimediatype": "Scalable Vector Graphics file",
            "@type": "ALTIMG",
            "@size": "70654",
            "@ref": "si41",
            "@mimetype": "image/svg+xml"
        },
        {
            "@category": "thumbnail",
            "@_fa": "true",
            "$": "https://api.elsevier.com/content/object/eid/1-s2.0-S2352710224022629-si86.svg?httpAccept=%2A%2F%2A",
            "@multimediatype": "Scalable Vector Graphics file",
            "@type": "ALTIMG",
            "@size": "41002",
            "@ref": "si86",
            "@mimetype": "image/svg+xml"
        },
        {
            "@category": "thumbnail",
            "@_fa": "true",
            "$": "https://api.elsevier.com/content/object/eid/1-s2.0-S2352710224022629-si111.svg?httpAccept=%2A%2F%2A",
            "@multimediatype": "Scalable Vector Graphics file",
            "@type": "ALTIMG",
            "@size": "5484",
            "@ref": "si111",
            "@mimetype": "image/svg+xml"
        },
        {
            "@category": "thumbnail",
            "@_fa": "true",
            "$": "https://api.elsevier.com/content/object/eid/1-s2.0-S2352710224022629-si147.svg?httpAccept=%2A%2F%2A",
            "@multimediatype": "Scalable Vector Graphics file",
            "@type": "ALTIMG",
            "@size": "37808",
            "@ref": "si147",
            "@mimetype": "image/svg+xml"
        },
        {
            "@category": "thumbnail",
            "@_fa": "true",
            "$": "https://api.elsevier.com/content/object/eid/1-s2.0-S2352710224022629-si18.svg?httpAccept=%2A%2F%2A",
            "@multimediatype": "Scalable Vector Graphics file",
            "@type": "ALTIMG",
            "@size": "10436",
            "@ref": "si18",
            "@mimetype": "image/svg+xml"
        },
        {
            "@category": "thumbnail",
            "@_fa": "true",
            "$": "https://api.elsevier.com/content/object/eid/1-s2.0-S2352710224022629-si141.svg?httpAccept=%2A%2F%2A",
            "@multimediatype": "Scalable Vector Graphics file",
            "@type": "ALTIMG",
            "@size": "39351",
            "@ref": "si141",
            "@mimetype": "image/svg+xml"
        },
        {
            "@category": "thumbnail",
            "@_fa": "true",
            "$": "https://api.elsevier.com/content/object/eid/1-s2.0-S2352710224022629-si155.svg?httpAccept=%2A%2F%2A",
            "@multimediatype": "Scalable Vector Graphics file",
            "@type": "ALTIMG",
            "@size": "33427",
            "@ref": "si155",
            "@mimetype": "image/svg+xml"
        },
        {
            "@category": "thumbnail",
            "@_fa": "true",
            "$": "https://api.elsevier.com/content/object/eid/1-s2.0-S2352710224022629-si59.svg?httpAccept=%2A%2F%2A",
            "@multimediatype": "Scalable Vector Graphics file",
            "@type": "ALTIMG",
            "@size": "11402",
            "@ref": "si59",
            "@mimetype": "image/svg+xml"
        },
        {
            "@category": "thumbnail",
            "@_fa": "true",
            "$": "https://api.elsevier.com/content/object/eid/1-s2.0-S2352710224022629-si60.svg?httpAccept=%2A%2F%2A",
            "@multimediatype": "Scalable Vector Graphics file",
            "@type": "ALTIMG",
            "@size": "14619",
            "@ref": "si60",
            "@mimetype": "image/svg+xml"
        },
        {
            "@category": "thumbnail",
            "@_fa": "true",
            "$": "https://api.elsevier.com/content/object/eid/1-s2.0-S2352710224022629-si39.svg?httpAccept=%2A%2F%2A",
            "@multimediatype": "Scalable Vector Graphics file",
            "@type": "ALTIMG",
            "@size": "5133",
            "@ref": "si39",
            "@mimetype": "image/svg+xml"
        },
        {
            "@category": "thumbnail",
            "@_fa": "true",
            "$": "https://api.elsevier.com/content/object/eid/1-s2.0-S2352710224022629-si154.svg?httpAccept=%2A%2F%2A",
            "@multimediatype": "Scalable Vector Graphics file",
            "@type": "ALTIMG",
            "@size": "33332",
            "@ref": "si154",
            "@mimetype": "image/svg+xml"
        },
        {
            "@category": "thumbnail",
            "@_fa": "true",
            "$": "https://api.elsevier.com/content/object/eid/1-s2.0-S2352710224022629-si92.svg?httpAccept=%2A%2F%2A",
            "@multimediatype": "Scalable Vector Graphics file",
            "@type": "ALTIMG",
            "@size": "37804",
            "@ref": "si92",
            "@mimetype": "image/svg+xml"
        },
        {
            "@category": "thumbnail",
            "@_fa": "true",
            "$": "https://api.elsevier.com/content/object/eid/1-s2.0-S2352710224022629-si29.svg?httpAccept=%2A%2F%2A",
            "@multimediatype": "Scalable Vector Graphics file",
            "@type": "ALTIMG",
            "@size": "8474",
            "@ref": "si29",
            "@mimetype": "image/svg+xml"
        },
        {
            "@category": "thumbnail",
            "@_fa": "true",
            "$": "https://api.elsevier.com/content/object/eid/1-s2.0-S2352710224022629-si30.svg?httpAccept=%2A%2F%2A",
            "@multimediatype": "Scalable Vector Graphics file",
            "@type": "ALTIMG",
            "@size": "5803",
            "@ref": "si30",
            "@mimetype": "image/svg+xml"
        },
        {
            "@category": "thumbnail",
            "@_fa": "true",
            "$": "https://api.elsevier.com/content/object/eid/1-s2.0-S2352710224022629-si48.svg?httpAccept=%2A%2F%2A",
            "@multimediatype": "Scalable Vector Graphics file",
            "@type": "ALTIMG",
            "@size": "21960",
            "@ref": "si48",
            "@mimetype": "image/svg+xml"
        },
        {
            "@category": "thumbnail",
            "@_fa": "true",
            "$": "https://api.elsevier.com/content/object/eid/1-s2.0-S2352710224022629-si23.svg?httpAccept=%2A%2F%2A",
            "@multimediatype": "Scalable Vector Graphics file",
            "@type": "ALTIMG",
            "@size": "11348",
            "@ref": "si23",
            "@mimetype": "image/svg+xml"
        },
        {
            "@category": "thumbnail",
            "@_fa": "true",
            "$": "https://api.elsevier.com/content/object/eid/1-s2.0-S2352710224022629-si65.svg?httpAccept=%2A%2F%2A",
            "@multimediatype": "Scalable Vector Graphics file",
            "@type": "ALTIMG",
            "@size": "33238",
            "@ref": "si65",
            "@mimetype": "image/svg+xml"
        },
        {
            "@category": "thumbnail",
            "@_fa": "true",
            "$": "https://api.elsevier.com/content/object/eid/1-s2.0-S2352710224022629-si84.svg?httpAccept=%2A%2F%2A",
            "@multimediatype": "Scalable Vector Graphics file",
            "@type": "ALTIMG",
            "@size": "47874",
            "@ref": "si84",
            "@mimetype": "image/svg+xml"
        },
        {
            "@category": "thumbnail",
            "@_fa": "true",
            "$": "https://api.elsevier.com/content/object/eid/1-s2.0-S2352710224022629-si127.svg?httpAccept=%2A%2F%2A",
            "@multimediatype": "Scalable Vector Graphics file",
            "@type": "ALTIMG",
            "@size": "9049",
            "@ref": "si127",
            "@mimetype": "image/svg+xml"
        },
        {
            "@category": "thumbnail",
            "@_fa": "true",
            "$": "https://api.elsevier.com/content/object/eid/1-s2.0-S2352710224022629-si121.svg?httpAccept=%2A%2F%2A",
            "@multimediatype": "Scalable Vector Graphics file",
            "@type": "ALTIMG",
            "@size": "5576",
            "@ref": "si121",
            "@mimetype": "image/svg+xml"
        },
        {
            "@category": "thumbnail",
            "@_fa": "true",
            "$": "https://api.elsevier.com/content/object/eid/1-s2.0-S2352710224022629-si136.svg?httpAccept=%2A%2F%2A",
            "@multimediatype": "Scalable Vector Graphics file",
            "@type": "ALTIMG",
            "@size": "35075",
            "@ref": "si136",
            "@mimetype": "image/svg+xml"
        },
        {
            "@category": "thumbnail",
            "@_fa": "true",
            "$": "https://api.elsevier.com/content/object/eid/1-s2.0-S2352710224022629-si133.svg?httpAccept=%2A%2F%2A",
            "@multimediatype": "Scalable Vector Graphics file",
            "@type": "ALTIMG",
            "@size": "38584",
            "@ref": "si133",
            "@mimetype": "image/svg+xml"
        },
        {
            "@category": "thumbnail",
            "@_fa": "true",
            "$": "https://api.elsevier.com/content/object/eid/1-s2.0-S2352710224022629-si69.svg?httpAccept=%2A%2F%2A",
            "@multimediatype": "Scalable Vector Graphics file",
            "@type": "ALTIMG",
            "@size": "14010",
            "@ref": "si69",
            "@mimetype": "image/svg+xml"
        },
        {
            "@category": "thumbnail",
            "@_fa": "true",
            "$": "https://api.elsevier.com/content/object/eid/1-s2.0-S2352710224022629-si43.svg?httpAccept=%2A%2F%2A",
            "@multimediatype": "Scalable Vector Graphics file",
            "@type": "ALTIMG",
            "@size": "48366",
            "@ref": "si43",
            "@mimetype": "image/svg+xml"
        },
        {
            "@category": "thumbnail",
            "@_fa": "true",
            "$": "https://api.elsevier.com/content/object/eid/1-s2.0-S2352710224022629-si130.svg?httpAccept=%2A%2F%2A",
            "@multimediatype": "Scalable Vector Graphics file",
            "@type": "ALTIMG",
            "@size": "10794",
            "@ref": "si130",
            "@mimetype": "image/svg+xml"
        },
        {
            "@category": "thumbnail",
            "@_fa": "true",
            "$": "https://api.elsevier.com/content/object/eid/1-s2.0-S2352710224022629-si31.svg?httpAccept=%2A%2F%2A",
            "@multimediatype": "Scalable Vector Graphics file",
            "@type": "ALTIMG",
            "@size": "6092",
            "@ref": "si31",
            "@mimetype": "image/svg+xml"
        },
        {
            "@category": "thumbnail",
            "@_fa": "true",
            "$": "https://api.elsevier.com/content/object/eid/1-s2.0-S2352710224022629-si91.svg?httpAccept=%2A%2F%2A",
            "@multimediatype": "Scalable Vector Graphics file",
            "@type": "ALTIMG",
            "@size": "23499",
            "@ref": "si91",
            "@mimetype": "image/svg+xml"
        },
        {
            "@category": "thumbnail",
            "@_fa": "true",
            "$": "https://api.elsevier.com/content/object/eid/1-s2.0-S2352710224022629-si77.svg?httpAccept=%2A%2F%2A",
            "@multimediatype": "Scalable Vector Graphics file",
            "@type": "ALTIMG",
            "@size": "27473",
            "@ref": "si77",
            "@mimetype": "image/svg+xml"
        },
        {
            "@category": "thumbnail",
            "@_fa": "true",
            "$": "https://api.elsevier.com/content/object/eid/1-s2.0-S2352710224022629-si150.svg?httpAccept=%2A%2F%2A",
            "@multimediatype": "Scalable Vector Graphics file",
            "@type": "ALTIMG",
            "@size": "19312",
            "@ref": "si150",
            "@mimetype": "image/svg+xml"
        },
        {
            "@category": "thumbnail",
            "@_fa": "true",
            "$": "https://api.elsevier.com/content/object/eid/1-s2.0-S2352710224022629-si46.svg?httpAccept=%2A%2F%2A",
            "@multimediatype": "Scalable Vector Graphics file",
            "@type": "ALTIMG",
            "@size": "17070",
            "@ref": "si46",
            "@mimetype": "image/svg+xml"
        },
        {
            "@category": "thumbnail",
            "@_fa": "true",
            "$": "https://api.elsevier.com/content/object/eid/1-s2.0-S2352710224022629-si2.svg?httpAccept=%2A%2F%2A",
            "@multimediatype": "Scalable Vector Graphics file",
            "@type": "ALTIMG",
            "@size": "4699",
            "@ref": "si2",
            "@mimetype": "image/svg+xml"
        },
        {
            "@category": "thumbnail",
            "@_fa": "true",
            "$": "https://api.elsevier.com/content/object/eid/1-s2.0-S2352710224022629-si128.svg?httpAccept=%2A%2F%2A",
            "@multimediatype": "Scalable Vector Graphics file",
            "@type": "ALTIMG",
            "@size": "44931",
            "@ref": "si128",
            "@mimetype": "image/svg+xml"
        },
        {
            "@category": "thumbnail",
            "@_fa": "true",
            "$": "https://api.elsevier.com/content/object/eid/1-s2.0-S2352710224022629-si119.svg?httpAccept=%2A%2F%2A",
            "@multimediatype": "Scalable Vector Graphics file",
            "@type": "ALTIMG",
            "@size": "63761",
            "@ref": "si119",
            "@mimetype": "image/svg+xml"
        },
        {
            "@category": "thumbnail",
            "@_fa": "true",
            "$": "https://api.elsevier.com/content/object/eid/1-s2.0-S2352710224022629-si112.svg?httpAccept=%2A%2F%2A",
            "@multimediatype": "Scalable Vector Graphics file",
            "@type": "ALTIMG",
            "@size": "73006",
            "@ref": "si112",
            "@mimetype": "image/svg+xml"
        },
        {
            "@category": "thumbnail",
            "@_fa": "true",
            "$": "https://api.elsevier.com/content/object/eid/1-s2.0-S2352710224022629-si90.svg?httpAccept=%2A%2F%2A",
            "@multimediatype": "Scalable Vector Graphics file",
            "@type": "ALTIMG",
            "@size": "30049",
            "@ref": "si90",
            "@mimetype": "image/svg+xml"
        },
        {
            "@category": "thumbnail",
            "@_fa": "true",
            "$": "https://api.elsevier.com/content/object/eid/1-s2.0-S2352710224022629-si109.svg?httpAccept=%2A%2F%2A",
            "@multimediatype": "Scalable Vector Graphics file",
            "@type": "ALTIMG",
            "@size": "14759",
            "@ref": "si109",
            "@mimetype": "image/svg+xml"
        },
        {
            "@category": "thumbnail",
            "@_fa": "true",
            "$": "https://api.elsevier.com/content/object/eid/1-s2.0-S2352710224022629-si50.svg?httpAccept=%2A%2F%2A",
            "@multimediatype": "Scalable Vector Graphics file",
            "@type": "ALTIMG",
            "@size": "19530",
            "@ref": "si50",
            "@mimetype": "image/svg+xml"
        },
        {
            "@category": "thumbnail",
            "@_fa": "true",
            "$": "https://api.elsevier.com/content/object/eid/1-s2.0-S2352710224022629-si6.svg?httpAccept=%2A%2F%2A",
            "@multimediatype": "Scalable Vector Graphics file",
            "@type": "ALTIMG",
            "@size": "12293",
            "@ref": "si6",
            "@mimetype": "image/svg+xml"
        },
        {
            "@category": "thumbnail",
            "@_fa": "true",
            "$": "https://api.elsevier.com/content/object/eid/1-s2.0-S2352710224022629-si7.svg?httpAccept=%2A%2F%2A",
            "@multimediatype": "Scalable Vector Graphics file",
            "@type": "ALTIMG",
            "@size": "37983",
            "@ref": "si7",
            "@mimetype": "image/svg+xml"
        },
        {
            "@category": "thumbnail",
            "@_fa": "true",
            "$": "https://api.elsevier.com/content/object/eid/1-s2.0-S2352710224022629-si153.svg?httpAccept=%2A%2F%2A",
            "@multimediatype": "Scalable Vector Graphics file",
            "@type": "ALTIMG",
            "@size": "6172",
            "@ref": "si153",
            "@mimetype": "image/svg+xml"
        },
        {
            "@category": "thumbnail",
            "@_fa": "true",
            "$": "https://api.elsevier.com/content/object/eid/1-s2.0-S2352710224022629-si53.svg?httpAccept=%2A%2F%2A",
            "@multimediatype": "Scalable Vector Graphics file",
            "@type": "ALTIMG",
            "@size": "10846",
            "@ref": "si53",
            "@mimetype": "image/svg+xml"
        },
        {
            "@category": "thumbnail",
            "@_fa": "true",
            "$": "https://api.elsevier.com/content/object/eid/1-s2.0-S2352710224022629-si125.svg?httpAccept=%2A%2F%2A",
            "@multimediatype": "Scalable Vector Graphics file",
            "@type": "ALTIMG",
            "@size": "22239",
            "@ref": "si125",
            "@mimetype": "image/svg+xml"
        },
        {
            "@category": "standard",
            "@_fa": "true",
            "$": "https://api.elsevier.com/content/object/eid/1-s2.0-S2352710224022629-am.pdf?httpAccept=%2A%2F%2A",
            "@multimediatype": "Acrobat PDF file",
            "@type": "AAM-PDF",
            "@size": "1562042",
            "@ref": "am",
            "@mimetype": "application/pdf"
        }
    ]},
    "link": {
        "@rel": "abstract",
        "@href": "https://api.elsevier.com/content/abstract/scopus_id/85203423462"
    }
}}