{"full-text-retrieval-response": {
    "scopus-eid": "2-s2.0-85087732872",
    "originalText": "serial JL 271429 291210 291702 291731 291787 291877 291878 291881 31 Applied Energy APPLIEDENERGY 2020-07-09 2020-07-09 2020-07-09 2020-07-09 2022-05-27T10:59:39 1-s2.0-S0306261920309399 S0306-2619(20)30939-9 S0306261920309399 10.1016/j.apenergy.2020.115427 S300 S300.1 FULL-TEXT 1-s2.0-S0306261920X0016X 2024-01-01T13:23:58.349315Z 0 0 20201015 2020 2020-07-09T23:20:00.000885Z articleinfo articlenumber articletitlenorm authfirstinitialnorm authfirstsurnamenorm cid cids contenttype copyright crossmark dateloaded dateloadedtxt datesearch datesort dateupdated dco docsubtype doctype doi eid ewtransactionid hubeid indexeddate issn issnnorm itemstage itemtransactionid itemweight openaccess openarchive pg pgfirst pii piinorm pubdatestart pubdatetxt pubyr sectiontitle sortorder srctitle srctitlenorm srctype ssids alllist content subj subheadings suppl tomb volfirst volissue volumelist webpdf webpdfpagecount yearnav figure table body mmlmath acknowledge affil appendices articletitle auth authfirstini authfull authkeywords authlast grantnumber grantsponsor highlightsabst primabst ref 0306-2619 03062619 true 276 276 C Volume 276 18 115427 115427 115427 20201015 15 October 2020 2020-10-15 2020 Research Papers article fla © 2020 Elsevier Ltd. All rights reserved. ADAPTIVEREGRESSIONMODELBASEDREALTIMEOPTIMALCONTROLCENTRALAIRCONDITIONINGSYSTEMS HUSSAIN S 1 Introduction 2 Adaptive regression model-based real-time optimal control 2.1 System description and conventional model-based real-time optimal control 2.2 Overview of the proposed real-time optimal control strategy 3 Regression model-based real-time optimal control 3.1 Regression model development 3.1.1 AHU regression model 3.1.2 Chiller regression model 3.1.3 Cooling tower regression model 3.1.4 Power calculation using the regression models 3.2 Formulation of the real-time optimal control 4 Length of the training data 5 Case studies 5.1 Simulation platform 5.2 Analysis for the length of training data 5.3 Accuracy of the performance model 5.4 Performance evaluation of the ARMRTOC strategy and discussion 6 Conclusion CRediT authorship contribution statement Acknowledgment Appendix A References KUSIAK 2010 3092 3102 A MA 2011 198 211 Z RAZMARA 2015 555 565 M DU 2016 700 714 Z BIANCHINI 2019 327 340 G WANG 2008 3 32 S REKLAITIS 1983 150 165 G ENGINEERINGOPTIMIZATIONMETHODSAPPLICATIONS AFRAM 2014 507 519 A AFROZ 2018 64 84 Z DOCHAIN 1984 621 634 D SLOTINE 1990 357 362 J NONLINEARCONTROLSYSTEMSDESIGN1989 NONLINEARPROCESSCONTROLADAPTIVEAPPROACHUSESPHYSICALMODELS LUO 1995 179 202 W NASSIF 2008 1709 1720 N BLUM 2019 410 425 D ASAD 2019 359 398 H ASAD 2016 349 359 H ASAD 2017 640 651 H WANG 2016 79 87 J QIN 1998 503 514 S GAUTIER 2001 1361 1372 M CAI 2015 986 993 J 2015AMERICANCONTROLCONFERENCEACCJULY MULTIAGENTCONTROLFORCENTRALIZEDAIRCONDITIONINGSYSTEMSSERVINGMULTIZONEBUILDINGS VELIBEYOGLU 2019 247 260 I MA 2008 Z ONLINESUPERVISORYOPTIMALCONTROLCOMPLEXBUILDINGCENTRALCHILLINGSYSTEMSDOCTORALDISSERTATION GUO 2010 2990 2994 P 20103RDINTERNATIONALCONFERENCEBIOMEDICALENGINEERINGINFORMATICSOCTOBER ENHANCEDGENETICALGORITHMSFOROPTIMIZATIONDESIGN BROYDEN 1970 76 90 C SHANNO 1970 647 656 D LEE 2007 I 413 M 2007IEEEINTERNATIONALCONFERENCEACOUSTICSSPEECHSIGNALPROCESSINGICASSP07APRIL SIMILARITYANALYSISTIMESERIESGENEEXPRESSIONUSINGDUALTREEWAVELETTRANSFORM WANG 2018 1740 1753 L HUSSAINX2020X115427 HUSSAINX2020X115427XS 2022-07-09T00:00:00.000Z 2022-07-09T00:00:00.000Z http://creativecommons.org/licenses/by-nc-nd/4.0/ © 2020 Elsevier Ltd. All rights reserved. 0 item S0306-2619(20)30939-9 S0306261920309399 1-s2.0-S0306261920309399 10.1016/j.apenergy.2020.115427 271429 2024-01-01T13:23:58.349315Z 2020-10-15 1-s2.0-S0306261920309399-main.pdf https://s3-eu-west-1.amazonaws.com/prod-ucs-content-store-eu-west/content/pii:S0306261920309399/MAIN/application/pdf/ea28f2694e9ff9e5db6b77a2402c1dfb/main.pdf main.pdf pdf true 8919084 MAIN 13 1-s2.0-S0306261920309399-main_1.png https://s3-eu-west-1.amazonaws.com/prod-ucs-content-store-eu-west/content/pii:S0306261920309399/PREVIEW/image/png/86cf78f00bdf8afb663985f3ec1adde8/main_1.png main_1.png png 48429 849 656 IMAGE-WEB-PDF 1 1-s2.0-S0306261920309399-gr7.jpg https://s3-eu-west-1.amazonaws.com/prod-ucs-content-store-eu-west/content/pii:S0306261920309399/gr7/DOWNSAMPLED/image/jpeg/47ad3d08411702177abf0ed13344e8e5/gr7.jpg gr7 gr7.jpg jpg 53979 282 622 IMAGE-DOWNSAMPLED 1-s2.0-S0306261920309399-gr6.jpg https://s3-eu-west-1.amazonaws.com/prod-ucs-content-store-eu-west/content/pii:S0306261920309399/gr6/DOWNSAMPLED/image/jpeg/961d611e1f3da182cadac5343aa6ce3a/gr6.jpg gr6 gr6.jpg jpg 41822 256 556 IMAGE-DOWNSAMPLED 1-s2.0-S0306261920309399-gr5.jpg https://s3-eu-west-1.amazonaws.com/prod-ucs-content-store-eu-west/content/pii:S0306261920309399/gr5/DOWNSAMPLED/image/jpeg/c5e9e83786002dab373ffb398f569fcd/gr5.jpg gr5 gr5.jpg jpg 60573 495 667 IMAGE-DOWNSAMPLED 1-s2.0-S0306261920309399-gr4.jpg https://s3-eu-west-1.amazonaws.com/prod-ucs-content-store-eu-west/content/pii:S0306261920309399/gr4/DOWNSAMPLED/image/jpeg/d17237c9fb271260434b65b1a96e3ddb/gr4.jpg gr4 gr4.jpg jpg 75727 352 765 IMAGE-DOWNSAMPLED 1-s2.0-S0306261920309399-gr3.jpg https://s3-eu-west-1.amazonaws.com/prod-ucs-content-store-eu-west/content/pii:S0306261920309399/gr3/DOWNSAMPLED/image/jpeg/a03e93a95fec2d75874bb1d72d21016b/gr3.jpg gr3 gr3.jpg jpg 16089 164 365 IMAGE-DOWNSAMPLED 1-s2.0-S0306261920309399-gr2.jpg https://s3-eu-west-1.amazonaws.com/prod-ucs-content-store-eu-west/content/pii:S0306261920309399/gr2/DOWNSAMPLED/image/jpeg/86b8f769555f706c2d04471a5fa89dba/gr2.jpg gr2 gr2.jpg jpg 42793 368 578 IMAGE-DOWNSAMPLED 1-s2.0-S0306261920309399-gr1.jpg https://s3-eu-west-1.amazonaws.com/prod-ucs-content-store-eu-west/content/pii:S0306261920309399/gr1/DOWNSAMPLED/image/jpeg/438e1b2043d7a9a7373558e7fe25a870/gr1.jpg gr1 gr1.jpg jpg 38583 277 667 IMAGE-DOWNSAMPLED 1-s2.0-S0306261920309399-gr10.jpg https://s3-eu-west-1.amazonaws.com/prod-ucs-content-store-eu-west/content/pii:S0306261920309399/gr10/DOWNSAMPLED/image/jpeg/c0c69abc24feb56ea99093ef532342c0/gr10.jpg gr10 gr10.jpg jpg 31386 465 364 IMAGE-DOWNSAMPLED 1-s2.0-S0306261920309399-gr11.jpg https://s3-eu-west-1.amazonaws.com/prod-ucs-content-store-eu-west/content/pii:S0306261920309399/gr11/DOWNSAMPLED/image/jpeg/8117be83828d94e54fdf5e28fb83dd25/gr11.jpg gr11 gr11.jpg jpg 69761 597 364 IMAGE-DOWNSAMPLED 1-s2.0-S0306261920309399-gr12.jpg https://s3-eu-west-1.amazonaws.com/prod-ucs-content-store-eu-west/content/pii:S0306261920309399/gr12/DOWNSAMPLED/image/jpeg/efcd5eaa6720e781ca8732b103639d30/gr12.jpg gr12 gr12.jpg jpg 76489 401 578 IMAGE-DOWNSAMPLED 1-s2.0-S0306261920309399-gr13.jpg https://s3-eu-west-1.amazonaws.com/prod-ucs-content-store-eu-west/content/pii:S0306261920309399/gr13/DOWNSAMPLED/image/jpeg/a40be7187b8ededd435b4819c4cc8ec7/gr13.jpg gr13 gr13.jpg jpg 93745 581 623 IMAGE-DOWNSAMPLED 1-s2.0-S0306261920309399-gr14.jpg https://s3-eu-west-1.amazonaws.com/prod-ucs-content-store-eu-west/content/pii:S0306261920309399/gr14/DOWNSAMPLED/image/jpeg/c460961dba69cb3d19b0ae17cc4ffad9/gr14.jpg gr14 gr14.jpg jpg 61986 365 623 IMAGE-DOWNSAMPLED 1-s2.0-S0306261920309399-gr9.jpg https://s3-eu-west-1.amazonaws.com/prod-ucs-content-store-eu-west/content/pii:S0306261920309399/gr9/DOWNSAMPLED/image/jpeg/426eb6cface66285a37c4c3ac3d5d997/gr9.jpg gr9 gr9.jpg jpg 30481 463 364 IMAGE-DOWNSAMPLED 1-s2.0-S0306261920309399-gr8.jpg https://s3-eu-west-1.amazonaws.com/prod-ucs-content-store-eu-west/content/pii:S0306261920309399/gr8/DOWNSAMPLED/image/jpeg/1944d4abc3466411175f802524896487/gr8.jpg gr8 gr8.jpg jpg 60008 437 578 IMAGE-DOWNSAMPLED 1-s2.0-S0306261920309399-gr7.sml https://s3-eu-west-1.amazonaws.com/prod-ucs-content-store-eu-west/content/pii:S0306261920309399/gr7/THUMBNAIL/image/gif/4eb295c7d6867594dfcc2796b704f0ad/gr7.sml gr7 gr7.sml sml 7671 99 219 IMAGE-THUMBNAIL 1-s2.0-S0306261920309399-gr6.sml https://s3-eu-west-1.amazonaws.com/prod-ucs-content-store-eu-west/content/pii:S0306261920309399/gr6/THUMBNAIL/image/gif/07667bf5a4c7a2f01ef27a690e8eea02/gr6.sml gr6 gr6.sml sml 8422 101 219 IMAGE-THUMBNAIL 1-s2.0-S0306261920309399-gr5.sml https://s3-eu-west-1.amazonaws.com/prod-ucs-content-store-eu-west/content/pii:S0306261920309399/gr5/THUMBNAIL/image/gif/fadac517aa4ce0bf05227ce50a948c84/gr5.sml gr5 gr5.sml sml 8058 163 219 IMAGE-THUMBNAIL 1-s2.0-S0306261920309399-gr4.sml https://s3-eu-west-1.amazonaws.com/prod-ucs-content-store-eu-west/content/pii:S0306261920309399/gr4/THUMBNAIL/image/gif/914d7db63c953f7d56ccba82ed21d775/gr4.sml gr4 gr4.sml sml 8349 101 219 IMAGE-THUMBNAIL 1-s2.0-S0306261920309399-gr3.sml https://s3-eu-west-1.amazonaws.com/prod-ucs-content-store-eu-west/content/pii:S0306261920309399/gr3/THUMBNAIL/image/gif/1e62a3e9ac2a6c4030a1c576becb8794/gr3.sml gr3 gr3.sml sml 5476 98 219 IMAGE-THUMBNAIL 1-s2.0-S0306261920309399-gr2.sml https://s3-eu-west-1.amazonaws.com/prod-ucs-content-store-eu-west/content/pii:S0306261920309399/gr2/THUMBNAIL/image/gif/326893766f2bd3e501ec316ae947701e/gr2.sml gr2 gr2.sml sml 8389 139 219 IMAGE-THUMBNAIL 1-s2.0-S0306261920309399-gr1.sml https://s3-eu-west-1.amazonaws.com/prod-ucs-content-store-eu-west/content/pii:S0306261920309399/gr1/THUMBNAIL/image/gif/2caaa72604403331e0a40afd09a12a8c/gr1.sml gr1 gr1.sml sml 5597 91 219 IMAGE-THUMBNAIL 1-s2.0-S0306261920309399-gr10.sml https://s3-eu-west-1.amazonaws.com/prod-ucs-content-store-eu-west/content/pii:S0306261920309399/gr10/THUMBNAIL/image/gif/58f9b3d0ddae37c40bf82ac897f786c9/gr10.sml gr10 gr10.sml sml 4823 164 128 IMAGE-THUMBNAIL 1-s2.0-S0306261920309399-gr11.sml https://s3-eu-west-1.amazonaws.com/prod-ucs-content-store-eu-west/content/pii:S0306261920309399/gr11/THUMBNAIL/image/gif/1ebe98bc634c65bebd2b5e20d43afb90/gr11.sml gr11 gr11.sml sml 7723 164 100 IMAGE-THUMBNAIL 1-s2.0-S0306261920309399-gr12.sml https://s3-eu-west-1.amazonaws.com/prod-ucs-content-store-eu-west/content/pii:S0306261920309399/gr12/THUMBNAIL/image/gif/4754cd8fe1cf18d8694cd17ca5cb388b/gr12.sml gr12 gr12.sml sml 13715 152 219 IMAGE-THUMBNAIL 1-s2.0-S0306261920309399-gr13.sml https://s3-eu-west-1.amazonaws.com/prod-ucs-content-store-eu-west/content/pii:S0306261920309399/gr13/THUMBNAIL/image/gif/22a42aef40dbf3cef19053d8d29a2564/gr13.sml gr13 gr13.sml sml 11404 164 176 IMAGE-THUMBNAIL 1-s2.0-S0306261920309399-gr14.sml https://s3-eu-west-1.amazonaws.com/prod-ucs-content-store-eu-west/content/pii:S0306261920309399/gr14/THUMBNAIL/image/gif/b3af6808b20ba6f4eda674c752e60df5/gr14.sml gr14 gr14.sml sml 11579 128 219 IMAGE-THUMBNAIL 1-s2.0-S0306261920309399-gr9.sml https://s3-eu-west-1.amazonaws.com/prod-ucs-content-store-eu-west/content/pii:S0306261920309399/gr9/THUMBNAIL/image/gif/973d8300197d6067cfb4ad6f78c11342/gr9.sml gr9 gr9.sml sml 5042 164 129 IMAGE-THUMBNAIL 1-s2.0-S0306261920309399-gr8.sml https://s3-eu-west-1.amazonaws.com/prod-ucs-content-store-eu-west/content/pii:S0306261920309399/gr8/THUMBNAIL/image/gif/5e8d06f090954e9bc9fb46e6b0bbbcbb/gr8.sml gr8 gr8.sml sml 9863 164 217 IMAGE-THUMBNAIL 1-s2.0-S0306261920309399-gr7_lrg.jpg https://s3-eu-west-1.amazonaws.com/prod-ucs-content-store-eu-west/content/pii:S0306261920309399/gr7/HIGHRES/image/jpeg/0b8a8861ee6d72902b128024961cc6a2/gr7_lrg.jpg gr7 gr7_lrg.jpg jpg 239915 1248 2756 IMAGE-HIGH-RES 1-s2.0-S0306261920309399-gr6_lrg.jpg https://s3-eu-west-1.amazonaws.com/prod-ucs-content-store-eu-west/content/pii:S0306261920309399/gr6/HIGHRES/image/jpeg/46af9bfec88aac71540a33c6eb8e367e/gr6_lrg.jpg gr6 gr6_lrg.jpg jpg 245592 1132 2461 IMAGE-HIGH-RES 1-s2.0-S0306261920309399-gr5_lrg.jpg https://s3-eu-west-1.amazonaws.com/prod-ucs-content-store-eu-west/content/pii:S0306261920309399/gr5/HIGHRES/image/jpeg/dbaffe00fec2c09598491f369e40a00d/gr5_lrg.jpg gr5 gr5_lrg.jpg jpg 279337 2192 2953 IMAGE-HIGH-RES 1-s2.0-S0306261920309399-gr4_lrg.jpg https://s3-eu-west-1.amazonaws.com/prod-ucs-content-store-eu-west/content/pii:S0306261920309399/gr4/HIGHRES/image/jpeg/cfc8489729c1c8f848fd49544b425fbe/gr4_lrg.jpg gr4 gr4_lrg.jpg jpg 387284 1556 3386 IMAGE-HIGH-RES 1-s2.0-S0306261920309399-gr3_lrg.jpg https://s3-eu-west-1.amazonaws.com/prod-ucs-content-store-eu-west/content/pii:S0306261920309399/gr3/HIGHRES/image/jpeg/2ecae07722788651681dcbbf216b11af/gr3_lrg.jpg gr3 gr3_lrg.jpg jpg 87467 725 1618 IMAGE-HIGH-RES 1-s2.0-S0306261920309399-gr2_lrg.jpg https://s3-eu-west-1.amazonaws.com/prod-ucs-content-store-eu-west/content/pii:S0306261920309399/gr2/HIGHRES/image/jpeg/ad350b634f34cbc7a26c2703e87b89e3/gr2_lrg.jpg gr2 gr2_lrg.jpg jpg 235818 1630 2559 IMAGE-HIGH-RES 1-s2.0-S0306261920309399-gr1_lrg.jpg https://s3-eu-west-1.amazonaws.com/prod-ucs-content-store-eu-west/content/pii:S0306261920309399/gr1/HIGHRES/image/jpeg/a274ae6aab9891512b42612a0b08d66a/gr1_lrg.jpg gr1 gr1_lrg.jpg jpg 200614 1227 2953 IMAGE-HIGH-RES 1-s2.0-S0306261920309399-gr10_lrg.jpg https://s3-eu-west-1.amazonaws.com/prod-ucs-content-store-eu-west/content/pii:S0306261920309399/gr10/HIGHRES/image/jpeg/50f9631e04eee6f0b20b5594f920550f/gr10_lrg.jpg gr10 gr10_lrg.jpg jpg 214760 2064 1614 IMAGE-HIGH-RES 1-s2.0-S0306261920309399-gr11_lrg.jpg https://s3-eu-west-1.amazonaws.com/prod-ucs-content-store-eu-west/content/pii:S0306261920309399/gr11/HIGHRES/image/jpeg/1faa4664eba9c8754f8ed9d7a0bfc08d/gr11_lrg.jpg gr11 gr11_lrg.jpg jpg 512172 2647 1615 IMAGE-HIGH-RES 1-s2.0-S0306261920309399-gr12_lrg.jpg https://s3-eu-west-1.amazonaws.com/prod-ucs-content-store-eu-west/content/pii:S0306261920309399/gr12/HIGHRES/image/jpeg/91ff323871bf239c5e2d0178aaa8e1a2/gr12_lrg.jpg gr12 gr12_lrg.jpg jpg 616028 1774 2559 IMAGE-HIGH-RES 1-s2.0-S0306261920309399-gr13_lrg.jpg https://s3-eu-west-1.amazonaws.com/prod-ucs-content-store-eu-west/content/pii:S0306261920309399/gr13/HIGHRES/image/jpeg/dd26a1cfb5ca8b58e0463a2348f0edbd/gr13_lrg.jpg gr13 gr13_lrg.jpg jpg 763722 2572 2757 IMAGE-HIGH-RES 1-s2.0-S0306261920309399-gr14_lrg.jpg https://s3-eu-west-1.amazonaws.com/prod-ucs-content-store-eu-west/content/pii:S0306261920309399/gr14/HIGHRES/image/jpeg/d77cf0dd00e6be922c6fabc81987ee72/gr14_lrg.jpg gr14 gr14_lrg.jpg jpg 521318 1614 2758 IMAGE-HIGH-RES 1-s2.0-S0306261920309399-gr9_lrg.jpg https://s3-eu-west-1.amazonaws.com/prod-ucs-content-store-eu-west/content/pii:S0306261920309399/gr9/HIGHRES/image/jpeg/16238bdb8bd50ed1bd1f725806c4d2c9/gr9_lrg.jpg gr9 gr9_lrg.jpg jpg 200387 2051 1614 IMAGE-HIGH-RES 1-s2.0-S0306261920309399-gr8_lrg.jpg https://s3-eu-west-1.amazonaws.com/prod-ucs-content-store-eu-west/content/pii:S0306261920309399/gr8/HIGHRES/image/jpeg/5647791d077bba40a68744cc84578bc9/gr8_lrg.jpg gr8 gr8_lrg.jpg jpg 430744 1936 2559 IMAGE-HIGH-RES 1-s2.0-S0306261920309399-si1.svg https://s3-eu-west-1.amazonaws.com/prod-ucs-content-store-eu-west/content/pii:S0306261920309399/STRIPIN/image/svg+xml/5b9f05bc3ea3b9e468e3f26728baaa13/si1.svg si1 si1.svg svg 4251 ALTIMG 1-s2.0-S0306261920309399-si10.svg https://s3-eu-west-1.amazonaws.com/prod-ucs-content-store-eu-west/content/pii:S0306261920309399/STRIPIN/image/svg+xml/f29f12613d717a58a7c0ee29b8735e33/si10.svg si10 si10.svg svg 8066 ALTIMG 1-s2.0-S0306261920309399-si100.svg https://s3-eu-west-1.amazonaws.com/prod-ucs-content-store-eu-west/content/pii:S0306261920309399/STRIPIN/image/svg+xml/d2709d300f42ec2539af7947eabd79e2/si100.svg si100 si100.svg svg 6765 ALTIMG 1-s2.0-S0306261920309399-si101.svg https://s3-eu-west-1.amazonaws.com/prod-ucs-content-store-eu-west/content/pii:S0306261920309399/STRIPIN/image/svg+xml/99b5a514514ff5b725ad136dc89ea2c4/si101.svg si101 si101.svg svg 18114 ALTIMG 1-s2.0-S0306261920309399-si102.svg https://s3-eu-west-1.amazonaws.com/prod-ucs-content-store-eu-west/content/pii:S0306261920309399/STRIPIN/image/svg+xml/ff73d22d81547e1ee952027c7bfb7b1a/si102.svg si102 si102.svg svg 43832 ALTIMG 1-s2.0-S0306261920309399-si103.svg https://s3-eu-west-1.amazonaws.com/prod-ucs-content-store-eu-west/content/pii:S0306261920309399/STRIPIN/image/svg+xml/75b6668d89431d376d379f39e147e00c/si103.svg si103 si103.svg svg 7363 ALTIMG 1-s2.0-S0306261920309399-si104.svg https://s3-eu-west-1.amazonaws.com/prod-ucs-content-store-eu-west/content/pii:S0306261920309399/STRIPIN/image/svg+xml/121a1a86a8575a9386d48736538f59f2/si104.svg si104 si104.svg svg 42008 ALTIMG 1-s2.0-S0306261920309399-si105.svg https://s3-eu-west-1.amazonaws.com/prod-ucs-content-store-eu-west/content/pii:S0306261920309399/STRIPIN/image/svg+xml/743dc0f3a5d0e93a9c21567363804ef5/si105.svg si105 si105.svg svg 9117 ALTIMG 1-s2.0-S0306261920309399-si106.svg https://s3-eu-west-1.amazonaws.com/prod-ucs-content-store-eu-west/content/pii:S0306261920309399/STRIPIN/image/svg+xml/bf3651c92488c7bb428d3a4b03681b00/si106.svg si106 si106.svg svg 12035 ALTIMG 1-s2.0-S0306261920309399-si107.svg https://s3-eu-west-1.amazonaws.com/prod-ucs-content-store-eu-west/content/pii:S0306261920309399/STRIPIN/image/svg+xml/cdd14a5bf9db7d21794c04344b8f4db4/si107.svg si107 si107.svg svg 7703 ALTIMG 1-s2.0-S0306261920309399-si108.svg https://s3-eu-west-1.amazonaws.com/prod-ucs-content-store-eu-west/content/pii:S0306261920309399/STRIPIN/image/svg+xml/208b52f0c53216c584eb7bbfeba370f0/si108.svg si108 si108.svg svg 3560 ALTIMG 1-s2.0-S0306261920309399-si109.svg https://s3-eu-west-1.amazonaws.com/prod-ucs-content-store-eu-west/content/pii:S0306261920309399/STRIPIN/image/svg+xml/26f48e2b93734eec408db7d4a93f3aa9/si109.svg si109 si109.svg svg 3787 ALTIMG 1-s2.0-S0306261920309399-si11.svg https://s3-eu-west-1.amazonaws.com/prod-ucs-content-store-eu-west/content/pii:S0306261920309399/STRIPIN/image/svg+xml/a27a4aa78f97410796d81153b64044a7/si11.svg si11 si11.svg svg 7658 ALTIMG 1-s2.0-S0306261920309399-si110.svg https://s3-eu-west-1.amazonaws.com/prod-ucs-content-store-eu-west/content/pii:S0306261920309399/STRIPIN/image/svg+xml/f74ef63e687a277ea0013f84e55cb20a/si110.svg si110 si110.svg svg 6323 ALTIMG 1-s2.0-S0306261920309399-si111.svg https://s3-eu-west-1.amazonaws.com/prod-ucs-content-store-eu-west/content/pii:S0306261920309399/STRIPIN/image/svg+xml/880769467146b9b365256cd1e91a24d1/si111.svg si111 si111.svg svg 3972 ALTIMG 1-s2.0-S0306261920309399-si112.svg https://s3-eu-west-1.amazonaws.com/prod-ucs-content-store-eu-west/content/pii:S0306261920309399/STRIPIN/image/svg+xml/88982729d0d4f995746fbd56df3f41f8/si112.svg si112 si112.svg svg 1709 ALTIMG 1-s2.0-S0306261920309399-si113.svg https://s3-eu-west-1.amazonaws.com/prod-ucs-content-store-eu-west/content/pii:S0306261920309399/STRIPIN/image/svg+xml/c0437931188f3c1940d9bfec821cd66b/si113.svg si113 si113.svg svg 1301 ALTIMG 1-s2.0-S0306261920309399-si114.svg https://s3-eu-west-1.amazonaws.com/prod-ucs-content-store-eu-west/content/pii:S0306261920309399/STRIPIN/image/svg+xml/020d91b4865709fb732f0229da8155df/si114.svg si114 si114.svg svg 17846 ALTIMG 1-s2.0-S0306261920309399-si115.svg https://s3-eu-west-1.amazonaws.com/prod-ucs-content-store-eu-west/content/pii:S0306261920309399/STRIPIN/image/svg+xml/a9ec293592194fd38c24751005eb4353/si115.svg si115 si115.svg svg 2466 ALTIMG 1-s2.0-S0306261920309399-si116.svg https://s3-eu-west-1.amazonaws.com/prod-ucs-content-store-eu-west/content/pii:S0306261920309399/STRIPIN/image/svg+xml/261c93bb27293403c9421f4ff89cf53f/si116.svg si116 si116.svg svg 4215 ALTIMG 1-s2.0-S0306261920309399-si117.svg https://s3-eu-west-1.amazonaws.com/prod-ucs-content-store-eu-west/content/pii:S0306261920309399/STRIPIN/image/svg+xml/fa0d61b471cfcb4b7b1d20ef481449b7/si117.svg si117 si117.svg svg 4327 ALTIMG 1-s2.0-S0306261920309399-si118.svg https://s3-eu-west-1.amazonaws.com/prod-ucs-content-store-eu-west/content/pii:S0306261920309399/STRIPIN/image/svg+xml/78cbfbc7cc3f2df3a9ff24976bc16a7a/si118.svg si118 si118.svg svg 2879 ALTIMG 1-s2.0-S0306261920309399-si119.svg https://s3-eu-west-1.amazonaws.com/prod-ucs-content-store-eu-west/content/pii:S0306261920309399/STRIPIN/image/svg+xml/ee793fc932fa9879466d63e3b74a77c4/si119.svg si119 si119.svg svg 2986 ALTIMG 1-s2.0-S0306261920309399-si12.svg https://s3-eu-west-1.amazonaws.com/prod-ucs-content-store-eu-west/content/pii:S0306261920309399/STRIPIN/image/svg+xml/59e6f0fc8b661a5b1655798b687d2c03/si12.svg si12 si12.svg svg 8289 ALTIMG 1-s2.0-S0306261920309399-si120.svg https://s3-eu-west-1.amazonaws.com/prod-ucs-content-store-eu-west/content/pii:S0306261920309399/STRIPIN/image/svg+xml/6aa69a71728efd94b3a4a67e3dc132c9/si120.svg si120 si120.svg svg 1014 ALTIMG 1-s2.0-S0306261920309399-si121.svg https://s3-eu-west-1.amazonaws.com/prod-ucs-content-store-eu-west/content/pii:S0306261920309399/STRIPIN/image/svg+xml/68ee5edda1c47282d8d0d4f3ded6809d/si121.svg si121 si121.svg svg 26122 ALTIMG 1-s2.0-S0306261920309399-si122.svg https://s3-eu-west-1.amazonaws.com/prod-ucs-content-store-eu-west/content/pii:S0306261920309399/STRIPIN/image/svg+xml/0aca50d18251ef4fea1115ee589dca15/si122.svg si122 si122.svg svg 5129 ALTIMG 1-s2.0-S0306261920309399-si123.svg https://s3-eu-west-1.amazonaws.com/prod-ucs-content-store-eu-west/content/pii:S0306261920309399/STRIPIN/image/svg+xml/4636eda3fe1caef768a4fcd5a3e5951c/si123.svg si123 si123.svg svg 5237 ALTIMG 1-s2.0-S0306261920309399-si124.svg https://s3-eu-west-1.amazonaws.com/prod-ucs-content-store-eu-west/content/pii:S0306261920309399/STRIPIN/image/svg+xml/150e1de83ee6a403aae87590c8808cbf/si124.svg si124 si124.svg svg 5002 ALTIMG 1-s2.0-S0306261920309399-si125.svg https://s3-eu-west-1.amazonaws.com/prod-ucs-content-store-eu-west/content/pii:S0306261920309399/STRIPIN/image/svg+xml/a1d81bc1594c1b7f699e392088fa1857/si125.svg si125 si125.svg svg 5118 ALTIMG 1-s2.0-S0306261920309399-si126.svg https://s3-eu-west-1.amazonaws.com/prod-ucs-content-store-eu-west/content/pii:S0306261920309399/STRIPIN/image/svg+xml/d6858d24cfb5e1d6e439251723d4b2dc/si126.svg si126 si126.svg svg 6164 ALTIMG 1-s2.0-S0306261920309399-si127.svg https://s3-eu-west-1.amazonaws.com/prod-ucs-content-store-eu-west/content/pii:S0306261920309399/STRIPIN/image/svg+xml/133d298333bd97678772cf5987b73ee9/si127.svg si127 si127.svg svg 2673 ALTIMG 1-s2.0-S0306261920309399-si128.svg https://s3-eu-west-1.amazonaws.com/prod-ucs-content-store-eu-west/content/pii:S0306261920309399/STRIPIN/image/svg+xml/97643a8f093010fa033bd2d9ad352499/si128.svg si128 si128.svg svg 12725 ALTIMG 1-s2.0-S0306261920309399-si129.svg https://s3-eu-west-1.amazonaws.com/prod-ucs-content-store-eu-west/content/pii:S0306261920309399/STRIPIN/image/svg+xml/49a4a065415887339cbc9286329e2a7c/si129.svg si129 si129.svg svg 6098 ALTIMG 1-s2.0-S0306261920309399-si13.svg https://s3-eu-west-1.amazonaws.com/prod-ucs-content-store-eu-west/content/pii:S0306261920309399/STRIPIN/image/svg+xml/13b0076c6847b327cb3de49756d4d0a4/si13.svg si13 si13.svg svg 2682 ALTIMG 1-s2.0-S0306261920309399-si130.svg https://s3-eu-west-1.amazonaws.com/prod-ucs-content-store-eu-west/content/pii:S0306261920309399/STRIPIN/image/svg+xml/c7937e74cac0a88aad8d4fc3c2d68c1a/si130.svg si130 si130.svg svg 2395 ALTIMG 1-s2.0-S0306261920309399-si131.svg https://s3-eu-west-1.amazonaws.com/prod-ucs-content-store-eu-west/content/pii:S0306261920309399/STRIPIN/image/svg+xml/b53c8a0a2e18d0ac43db8c20a24174a4/si131.svg si131 si131.svg svg 2557 ALTIMG 1-s2.0-S0306261920309399-si132.svg https://s3-eu-west-1.amazonaws.com/prod-ucs-content-store-eu-west/content/pii:S0306261920309399/STRIPIN/image/svg+xml/344f7439c6f0b072c9bebfc97f64e3a6/si132.svg si132 si132.svg svg 18335 ALTIMG 1-s2.0-S0306261920309399-si133.svg https://s3-eu-west-1.amazonaws.com/prod-ucs-content-store-eu-west/content/pii:S0306261920309399/STRIPIN/image/svg+xml/da3e9248553554fa7a997e7250342405/si133.svg si133 si133.svg svg 15210 ALTIMG 1-s2.0-S0306261920309399-si134.svg https://s3-eu-west-1.amazonaws.com/prod-ucs-content-store-eu-west/content/pii:S0306261920309399/STRIPIN/image/svg+xml/90cef326270a4a500cdc7bc9a63e1b4e/si134.svg si134 si134.svg svg 4764 ALTIMG 1-s2.0-S0306261920309399-si135.svg https://s3-eu-west-1.amazonaws.com/prod-ucs-content-store-eu-west/content/pii:S0306261920309399/STRIPIN/image/svg+xml/96aca6fb017d02e86fbb8b6f9850c775/si135.svg si135 si135.svg svg 8371 ALTIMG 1-s2.0-S0306261920309399-si136.svg https://s3-eu-west-1.amazonaws.com/prod-ucs-content-store-eu-west/content/pii:S0306261920309399/STRIPIN/image/svg+xml/1b147854b8118e79fd0f0703094ac515/si136.svg si136 si136.svg svg 12280 ALTIMG 1-s2.0-S0306261920309399-si137.svg https://s3-eu-west-1.amazonaws.com/prod-ucs-content-store-eu-west/content/pii:S0306261920309399/STRIPIN/image/svg+xml/1f4e6dbfdb1646fd3ac98707d839d456/si137.svg si137 si137.svg svg 16263 ALTIMG 1-s2.0-S0306261920309399-si138.svg https://s3-eu-west-1.amazonaws.com/prod-ucs-content-store-eu-west/content/pii:S0306261920309399/STRIPIN/image/svg+xml/97aa15024caa7655273dc918fcb0d548/si138.svg si138 si138.svg svg 7111 ALTIMG 1-s2.0-S0306261920309399-si139.svg https://s3-eu-west-1.amazonaws.com/prod-ucs-content-store-eu-west/content/pii:S0306261920309399/STRIPIN/image/svg+xml/9dc1780058e4085136605b54cac67c18/si139.svg si139 si139.svg svg 7005 ALTIMG 1-s2.0-S0306261920309399-si14.svg https://s3-eu-west-1.amazonaws.com/prod-ucs-content-store-eu-west/content/pii:S0306261920309399/STRIPIN/image/svg+xml/7eb7dbfb99b8ad4283aae9567aabba14/si14.svg si14 si14.svg svg 11860 ALTIMG 1-s2.0-S0306261920309399-si140.svg https://s3-eu-west-1.amazonaws.com/prod-ucs-content-store-eu-west/content/pii:S0306261920309399/STRIPIN/image/svg+xml/d4256631caa1ab10c321d786dfb12c2a/si140.svg si140 si140.svg svg 1026 ALTIMG 1-s2.0-S0306261920309399-si141.svg https://s3-eu-west-1.amazonaws.com/prod-ucs-content-store-eu-west/content/pii:S0306261920309399/STRIPIN/image/svg+xml/b754f3c5b95a69c80c7df272ffda42a4/si141.svg si141 si141.svg svg 6253 ALTIMG 1-s2.0-S0306261920309399-si142.svg https://s3-eu-west-1.amazonaws.com/prod-ucs-content-store-eu-west/content/pii:S0306261920309399/STRIPIN/image/svg+xml/5f753561232fe673ce192f330a68d84e/si142.svg si142 si142.svg svg 4454 ALTIMG 1-s2.0-S0306261920309399-si143.svg https://s3-eu-west-1.amazonaws.com/prod-ucs-content-store-eu-west/content/pii:S0306261920309399/STRIPIN/image/svg+xml/db9d3183b4174b36cd9483cde1eb3717/si143.svg si143 si143.svg svg 4054 ALTIMG 1-s2.0-S0306261920309399-si144.svg https://s3-eu-west-1.amazonaws.com/prod-ucs-content-store-eu-west/content/pii:S0306261920309399/STRIPIN/image/svg+xml/6ab8d51c46b0f6b5ec1883619998ff0b/si144.svg si144 si144.svg svg 4188 ALTIMG 1-s2.0-S0306261920309399-si145.svg https://s3-eu-west-1.amazonaws.com/prod-ucs-content-store-eu-west/content/pii:S0306261920309399/STRIPIN/image/svg+xml/5a53d7ea2539214b48664c6f8985922c/si145.svg si145 si145.svg svg 2592 ALTIMG 1-s2.0-S0306261920309399-si146.svg https://s3-eu-west-1.amazonaws.com/prod-ucs-content-store-eu-west/content/pii:S0306261920309399/STRIPIN/image/svg+xml/345a2964377959a17404616b75f37c84/si146.svg si146 si146.svg svg 6435 ALTIMG 1-s2.0-S0306261920309399-si147.svg https://s3-eu-west-1.amazonaws.com/prod-ucs-content-store-eu-west/content/pii:S0306261920309399/STRIPIN/image/svg+xml/9a20aa533807bd48ca4678767794ce78/si147.svg si147 si147.svg svg 2710 ALTIMG 1-s2.0-S0306261920309399-si148.svg https://s3-eu-west-1.amazonaws.com/prod-ucs-content-store-eu-west/content/pii:S0306261920309399/STRIPIN/image/svg+xml/9f045a9bd52f5f38461a1ef5d72af06b/si148.svg si148 si148.svg svg 11835 ALTIMG 1-s2.0-S0306261920309399-si149.svg https://s3-eu-west-1.amazonaws.com/prod-ucs-content-store-eu-west/content/pii:S0306261920309399/STRIPIN/image/svg+xml/7604bac1082d2ca4e81e4db9d350f75b/si149.svg si149 si149.svg svg 3270 ALTIMG 1-s2.0-S0306261920309399-si15.svg https://s3-eu-west-1.amazonaws.com/prod-ucs-content-store-eu-west/content/pii:S0306261920309399/STRIPIN/image/svg+xml/02d4d782728208749b94a5407abfebda/si15.svg si15 si15.svg svg 11528 ALTIMG 1-s2.0-S0306261920309399-si150.svg https://s3-eu-west-1.amazonaws.com/prod-ucs-content-store-eu-west/content/pii:S0306261920309399/STRIPIN/image/svg+xml/7ea4c4bb09c5633f559a19654adc7240/si150.svg si150 si150.svg svg 2465 ALTIMG 1-s2.0-S0306261920309399-si151.svg https://s3-eu-west-1.amazonaws.com/prod-ucs-content-store-eu-west/content/pii:S0306261920309399/STRIPIN/image/svg+xml/1aaaa9707ab82c6226fae1c45f9f71ad/si151.svg si151 si151.svg svg 11927 ALTIMG 1-s2.0-S0306261920309399-si152.svg https://s3-eu-west-1.amazonaws.com/prod-ucs-content-store-eu-west/content/pii:S0306261920309399/STRIPIN/image/svg+xml/27a434391a2c82dad425a2be8318b170/si152.svg si152 si152.svg svg 3207 ALTIMG 1-s2.0-S0306261920309399-si153.svg https://s3-eu-west-1.amazonaws.com/prod-ucs-content-store-eu-west/content/pii:S0306261920309399/STRIPIN/image/svg+xml/f216d091a81b5ac673c400c3ce6700fa/si153.svg si153 si153.svg svg 3089 ALTIMG 1-s2.0-S0306261920309399-si154.svg https://s3-eu-west-1.amazonaws.com/prod-ucs-content-store-eu-west/content/pii:S0306261920309399/STRIPIN/image/svg+xml/92711ccbb31ef85fa8117fe373bfac17/si154.svg si154 si154.svg svg 3395 ALTIMG 1-s2.0-S0306261920309399-si155.svg https://s3-eu-west-1.amazonaws.com/prod-ucs-content-store-eu-west/content/pii:S0306261920309399/STRIPIN/image/svg+xml/006959873c7e15fdc0368034ab62f493/si155.svg si155 si155.svg svg 3417 ALTIMG 1-s2.0-S0306261920309399-si156.svg https://s3-eu-west-1.amazonaws.com/prod-ucs-content-store-eu-west/content/pii:S0306261920309399/STRIPIN/image/svg+xml/4835850c4a3e491ef4bb0f5b92814c15/si156.svg si156 si156.svg svg 3191 ALTIMG 1-s2.0-S0306261920309399-si157.svg https://s3-eu-west-1.amazonaws.com/prod-ucs-content-store-eu-west/content/pii:S0306261920309399/STRIPIN/image/svg+xml/4c22deca76b32f4872b2e1c1532c8448/si157.svg si157 si157.svg svg 866 ALTIMG 1-s2.0-S0306261920309399-si158.svg https://s3-eu-west-1.amazonaws.com/prod-ucs-content-store-eu-west/content/pii:S0306261920309399/STRIPIN/image/svg+xml/e63812af8a156cb6d83bd1a1b8a15a78/si158.svg si158 si158.svg svg 1659 ALTIMG 1-s2.0-S0306261920309399-si159.svg https://s3-eu-west-1.amazonaws.com/prod-ucs-content-store-eu-west/content/pii:S0306261920309399/STRIPIN/image/svg+xml/333eb26c5583d13d8514df63e05f925d/si159.svg si159 si159.svg svg 16227 ALTIMG 1-s2.0-S0306261920309399-si16.svg https://s3-eu-west-1.amazonaws.com/prod-ucs-content-store-eu-west/content/pii:S0306261920309399/STRIPIN/image/svg+xml/f005cd427f15c475afdce48d30460903/si16.svg si16 si16.svg svg 13374 ALTIMG 1-s2.0-S0306261920309399-si17.svg https://s3-eu-west-1.amazonaws.com/prod-ucs-content-store-eu-west/content/pii:S0306261920309399/STRIPIN/image/svg+xml/8c7438e88490163418dc897a7b2c579a/si17.svg si17 si17.svg svg 4369 ALTIMG 1-s2.0-S0306261920309399-si18.svg https://s3-eu-west-1.amazonaws.com/prod-ucs-content-store-eu-west/content/pii:S0306261920309399/STRIPIN/image/svg+xml/c7561c5d15b536d93650f56811851f15/si18.svg si18 si18.svg svg 10060 ALTIMG 1-s2.0-S0306261920309399-si19.svg https://s3-eu-west-1.amazonaws.com/prod-ucs-content-store-eu-west/content/pii:S0306261920309399/STRIPIN/image/svg+xml/7bf9ffede9867a8d4e7e6feb57b2cc63/si19.svg si19 si19.svg svg 4573 ALTIMG 1-s2.0-S0306261920309399-si2.svg https://s3-eu-west-1.amazonaws.com/prod-ucs-content-store-eu-west/content/pii:S0306261920309399/STRIPIN/image/svg+xml/5658816305060c91e9b4a39c6655df47/si2.svg si2 si2.svg svg 1407 ALTIMG 1-s2.0-S0306261920309399-si20.svg https://s3-eu-west-1.amazonaws.com/prod-ucs-content-store-eu-west/content/pii:S0306261920309399/STRIPIN/image/svg+xml/4efc2a9b23c3450979e99468f8db5e43/si20.svg si20 si20.svg svg 6363 ALTIMG 1-s2.0-S0306261920309399-si21.svg https://s3-eu-west-1.amazonaws.com/prod-ucs-content-store-eu-west/content/pii:S0306261920309399/STRIPIN/image/svg+xml/2ae355fa0df31e10cc0a2606a72f122c/si21.svg si21 si21.svg svg 2998 ALTIMG 1-s2.0-S0306261920309399-si22.svg https://s3-eu-west-1.amazonaws.com/prod-ucs-content-store-eu-west/content/pii:S0306261920309399/STRIPIN/image/svg+xml/33af9f211683f88d2a2454139f17ccec/si22.svg si22 si22.svg svg 9282 ALTIMG 1-s2.0-S0306261920309399-si23.svg https://s3-eu-west-1.amazonaws.com/prod-ucs-content-store-eu-west/content/pii:S0306261920309399/STRIPIN/image/svg+xml/414b4bf4d62763807575252c749a0e0d/si23.svg si23 si23.svg svg 5271 ALTIMG 1-s2.0-S0306261920309399-si24.svg https://s3-eu-west-1.amazonaws.com/prod-ucs-content-store-eu-west/content/pii:S0306261920309399/STRIPIN/image/svg+xml/5b049415b9eceb81952b06c0ff18f810/si24.svg si24 si24.svg svg 6653 ALTIMG 1-s2.0-S0306261920309399-si25.svg https://s3-eu-west-1.amazonaws.com/prod-ucs-content-store-eu-west/content/pii:S0306261920309399/STRIPIN/image/svg+xml/62944f70604f04cb90619e81f51b15c0/si25.svg si25 si25.svg svg 3737 ALTIMG 1-s2.0-S0306261920309399-si26.svg https://s3-eu-west-1.amazonaws.com/prod-ucs-content-store-eu-west/content/pii:S0306261920309399/STRIPIN/image/svg+xml/91a9357c71ce5df69ab925001ca249ed/si26.svg si26 si26.svg svg 781 ALTIMG 1-s2.0-S0306261920309399-si27.svg https://s3-eu-west-1.amazonaws.com/prod-ucs-content-store-eu-west/content/pii:S0306261920309399/STRIPIN/image/svg+xml/4c8a6af0be2ea4bae3f5434488e7e6e0/si27.svg si27 si27.svg svg 7255 ALTIMG 1-s2.0-S0306261920309399-si28.svg https://s3-eu-west-1.amazonaws.com/prod-ucs-content-store-eu-west/content/pii:S0306261920309399/STRIPIN/image/svg+xml/c0c4e58a20c7078067e35490cfbe0962/si28.svg si28 si28.svg svg 4799 ALTIMG 1-s2.0-S0306261920309399-si29.svg https://s3-eu-west-1.amazonaws.com/prod-ucs-content-store-eu-west/content/pii:S0306261920309399/STRIPIN/image/svg+xml/c18ce816cd0682c7124645b6a68e9052/si29.svg si29 si29.svg svg 3737 ALTIMG 1-s2.0-S0306261920309399-si3.svg https://s3-eu-west-1.amazonaws.com/prod-ucs-content-store-eu-west/content/pii:S0306261920309399/STRIPIN/image/svg+xml/8c1a60e8249761939ef3b16fa292458a/si3.svg si3 si3.svg svg 1633 ALTIMG 1-s2.0-S0306261920309399-si30.svg https://s3-eu-west-1.amazonaws.com/prod-ucs-content-store-eu-west/content/pii:S0306261920309399/STRIPIN/image/svg+xml/cd2aa6778bd713ba149d85d49e49a968/si30.svg si30 si30.svg svg 32914 ALTIMG 1-s2.0-S0306261920309399-si31.svg https://s3-eu-west-1.amazonaws.com/prod-ucs-content-store-eu-west/content/pii:S0306261920309399/STRIPIN/image/svg+xml/0bad91a26f0129a30145df7305bf48b3/si31.svg si31 si31.svg svg 13516 ALTIMG 1-s2.0-S0306261920309399-si32.svg https://s3-eu-west-1.amazonaws.com/prod-ucs-content-store-eu-west/content/pii:S0306261920309399/STRIPIN/image/svg+xml/7e3bec4c5a91ba6e1874297eef1d8b7c/si32.svg si32 si32.svg svg 12873 ALTIMG 1-s2.0-S0306261920309399-si33.svg https://s3-eu-west-1.amazonaws.com/prod-ucs-content-store-eu-west/content/pii:S0306261920309399/STRIPIN/image/svg+xml/e50b316e499eb8a1fe285416591b99fa/si33.svg si33 si33.svg svg 5628 ALTIMG 1-s2.0-S0306261920309399-si34.svg https://s3-eu-west-1.amazonaws.com/prod-ucs-content-store-eu-west/content/pii:S0306261920309399/STRIPIN/image/svg+xml/96dcdb23368ed82b3da5711d95efb504/si34.svg si34 si34.svg svg 16514 ALTIMG 1-s2.0-S0306261920309399-si35.svg https://s3-eu-west-1.amazonaws.com/prod-ucs-content-store-eu-west/content/pii:S0306261920309399/STRIPIN/image/svg+xml/0eaf1d9cd998207fc2cab24b787b6db9/si35.svg si35 si35.svg svg 3013 ALTIMG 1-s2.0-S0306261920309399-si36.svg https://s3-eu-west-1.amazonaws.com/prod-ucs-content-store-eu-west/content/pii:S0306261920309399/STRIPIN/image/svg+xml/d942dee596508c9d8a7bfd7b890cf759/si36.svg si36 si36.svg svg 1750 ALTIMG 1-s2.0-S0306261920309399-si37.svg https://s3-eu-west-1.amazonaws.com/prod-ucs-content-store-eu-west/content/pii:S0306261920309399/STRIPIN/image/svg+xml/ef98d7fdac17866f8848865c5962da94/si37.svg si37 si37.svg svg 6704 ALTIMG 1-s2.0-S0306261920309399-si38.svg https://s3-eu-west-1.amazonaws.com/prod-ucs-content-store-eu-west/content/pii:S0306261920309399/STRIPIN/image/svg+xml/11c3cb1df2d1d3c744537c3f995c6d01/si38.svg si38 si38.svg svg 1750 ALTIMG 1-s2.0-S0306261920309399-si39.svg https://s3-eu-west-1.amazonaws.com/prod-ucs-content-store-eu-west/content/pii:S0306261920309399/STRIPIN/image/svg+xml/29180b635a6918634f102bbddd0d0611/si39.svg si39 si39.svg svg 3193 ALTIMG 1-s2.0-S0306261920309399-si4.svg https://s3-eu-west-1.amazonaws.com/prod-ucs-content-store-eu-west/content/pii:S0306261920309399/STRIPIN/image/svg+xml/e0784f168f57e82ec84ed0fe52075f73/si4.svg si4 si4.svg svg 5403 ALTIMG 1-s2.0-S0306261920309399-si40.svg https://s3-eu-west-1.amazonaws.com/prod-ucs-content-store-eu-west/content/pii:S0306261920309399/STRIPIN/image/svg+xml/5d5d04892524fd7ba68d2f42b8d96caf/si40.svg si40 si40.svg svg 4343 ALTIMG 1-s2.0-S0306261920309399-si41.svg https://s3-eu-west-1.amazonaws.com/prod-ucs-content-store-eu-west/content/pii:S0306261920309399/STRIPIN/image/svg+xml/c07e407bb32c5eea077c8be1b9330c66/si41.svg si41 si41.svg svg 1541 ALTIMG 1-s2.0-S0306261920309399-si42.svg https://s3-eu-west-1.amazonaws.com/prod-ucs-content-store-eu-west/content/pii:S0306261920309399/STRIPIN/image/svg+xml/67b011612bb0093691cb863b389d32a0/si42.svg si42 si42.svg svg 1282 ALTIMG 1-s2.0-S0306261920309399-si43.svg https://s3-eu-west-1.amazonaws.com/prod-ucs-content-store-eu-west/content/pii:S0306261920309399/STRIPIN/image/svg+xml/5be7fe948647f9240348e4ada52f4c71/si43.svg si43 si43.svg svg 1109 ALTIMG 1-s2.0-S0306261920309399-si44.svg https://s3-eu-west-1.amazonaws.com/prod-ucs-content-store-eu-west/content/pii:S0306261920309399/STRIPIN/image/svg+xml/d622729310617c3547bd7bc314d4a078/si44.svg si44 si44.svg svg 8954 ALTIMG 1-s2.0-S0306261920309399-si45.svg https://s3-eu-west-1.amazonaws.com/prod-ucs-content-store-eu-west/content/pii:S0306261920309399/STRIPIN/image/svg+xml/3fdc2011b9a042250291e759bda738a6/si45.svg si45 si45.svg svg 1867 ALTIMG 1-s2.0-S0306261920309399-si46.svg https://s3-eu-west-1.amazonaws.com/prod-ucs-content-store-eu-west/content/pii:S0306261920309399/STRIPIN/image/svg+xml/b5d793986f9ce028f6dc0455adad5eaf/si46.svg si46 si46.svg svg 1525 ALTIMG 1-s2.0-S0306261920309399-si47.svg https://s3-eu-west-1.amazonaws.com/prod-ucs-content-store-eu-west/content/pii:S0306261920309399/STRIPIN/image/svg+xml/726bdee5338d93ba72d356be23215b0f/si47.svg si47 si47.svg svg 14196 ALTIMG 1-s2.0-S0306261920309399-si48.svg https://s3-eu-west-1.amazonaws.com/prod-ucs-content-store-eu-west/content/pii:S0306261920309399/STRIPIN/image/svg+xml/faffb47d53ac7e08cfe0d7df178afb13/si48.svg si48 si48.svg svg 2907 ALTIMG 1-s2.0-S0306261920309399-si49.svg https://s3-eu-west-1.amazonaws.com/prod-ucs-content-store-eu-west/content/pii:S0306261920309399/STRIPIN/image/svg+xml/6633b0973f8ebd66362736a0dd619c53/si49.svg si49 si49.svg svg 2627 ALTIMG 1-s2.0-S0306261920309399-si5.svg https://s3-eu-west-1.amazonaws.com/prod-ucs-content-store-eu-west/content/pii:S0306261920309399/STRIPIN/image/svg+xml/590ae84bfca49a325a363267a21a9dcb/si5.svg si5 si5.svg svg 7895 ALTIMG 1-s2.0-S0306261920309399-si50.svg https://s3-eu-west-1.amazonaws.com/prod-ucs-content-store-eu-west/content/pii:S0306261920309399/STRIPIN/image/svg+xml/f2f93f9c3e09c6fa05baab697d9d89a9/si50.svg si50 si50.svg svg 5402 ALTIMG 1-s2.0-S0306261920309399-si51.svg https://s3-eu-west-1.amazonaws.com/prod-ucs-content-store-eu-west/content/pii:S0306261920309399/STRIPIN/image/svg+xml/48cf9d6037e7c13fc2037d5927410091/si51.svg si51 si51.svg svg 5237 ALTIMG 1-s2.0-S0306261920309399-si52.svg https://s3-eu-west-1.amazonaws.com/prod-ucs-content-store-eu-west/content/pii:S0306261920309399/STRIPIN/image/svg+xml/df219782d1da989cb5e0472cfb14223f/si52.svg si52 si52.svg svg 18644 ALTIMG 1-s2.0-S0306261920309399-si53.svg https://s3-eu-west-1.amazonaws.com/prod-ucs-content-store-eu-west/content/pii:S0306261920309399/STRIPIN/image/svg+xml/d17273d1ad8f65c7a0543e05a1ce8512/si53.svg si53 si53.svg svg 4934 ALTIMG 1-s2.0-S0306261920309399-si54.svg https://s3-eu-west-1.amazonaws.com/prod-ucs-content-store-eu-west/content/pii:S0306261920309399/STRIPIN/image/svg+xml/bdb1a4e7ac7e37ae0bc24fdaa42e3f25/si54.svg si54 si54.svg svg 10357 ALTIMG 1-s2.0-S0306261920309399-si55.svg https://s3-eu-west-1.amazonaws.com/prod-ucs-content-store-eu-west/content/pii:S0306261920309399/STRIPIN/image/svg+xml/ddaa5a5ed2e87b9c3fb91b4f30bdf61f/si55.svg si55 si55.svg svg 3230 ALTIMG 1-s2.0-S0306261920309399-si56.svg https://s3-eu-west-1.amazonaws.com/prod-ucs-content-store-eu-west/content/pii:S0306261920309399/STRIPIN/image/svg+xml/9b1eb85bda73b90a4fc29c26000ced28/si56.svg si56 si56.svg svg 4827 ALTIMG 1-s2.0-S0306261920309399-si57.svg https://s3-eu-west-1.amazonaws.com/prod-ucs-content-store-eu-west/content/pii:S0306261920309399/STRIPIN/image/svg+xml/31e88c13f58fe0c9c9727dfc845d3e83/si57.svg si57 si57.svg svg 4270 ALTIMG 1-s2.0-S0306261920309399-si58.svg https://s3-eu-west-1.amazonaws.com/prod-ucs-content-store-eu-west/content/pii:S0306261920309399/STRIPIN/image/svg+xml/43cb797b62421d0726120fd20bb91870/si58.svg si58 si58.svg svg 12475 ALTIMG 1-s2.0-S0306261920309399-si59.svg https://s3-eu-west-1.amazonaws.com/prod-ucs-content-store-eu-west/content/pii:S0306261920309399/STRIPIN/image/svg+xml/46415ff878d81c8a2cef0bc891e4c312/si59.svg si59 si59.svg svg 4293 ALTIMG 1-s2.0-S0306261920309399-si6.svg https://s3-eu-west-1.amazonaws.com/prod-ucs-content-store-eu-west/content/pii:S0306261920309399/STRIPIN/image/svg+xml/33cdbbfe0ede8429cddddcc20f3aa9d8/si6.svg si6 si6.svg svg 8515 ALTIMG 1-s2.0-S0306261920309399-si60.svg https://s3-eu-west-1.amazonaws.com/prod-ucs-content-store-eu-west/content/pii:S0306261920309399/STRIPIN/image/svg+xml/b53478cc1f8723545e50fae6d723aaf1/si60.svg si60 si60.svg svg 5844 ALTIMG 1-s2.0-S0306261920309399-si61.svg https://s3-eu-west-1.amazonaws.com/prod-ucs-content-store-eu-west/content/pii:S0306261920309399/STRIPIN/image/svg+xml/fa7e42c6bb3e1bc656d3e732b8aa783f/si61.svg si61 si61.svg svg 5287 ALTIMG 1-s2.0-S0306261920309399-si62.svg https://s3-eu-west-1.amazonaws.com/prod-ucs-content-store-eu-west/content/pii:S0306261920309399/STRIPIN/image/svg+xml/9dca5a769b72b83ae04dc7b4f6b2758e/si62.svg si62 si62.svg svg 7107 ALTIMG 1-s2.0-S0306261920309399-si63.svg https://s3-eu-west-1.amazonaws.com/prod-ucs-content-store-eu-west/content/pii:S0306261920309399/STRIPIN/image/svg+xml/dde8d8f5e8b415d99a7ab0e3024f519b/si63.svg si63 si63.svg svg 22908 ALTIMG 1-s2.0-S0306261920309399-si64.svg https://s3-eu-west-1.amazonaws.com/prod-ucs-content-store-eu-west/content/pii:S0306261920309399/STRIPIN/image/svg+xml/ab250575786dfe6d690d044a506885d9/si64.svg si64 si64.svg svg 12572 ALTIMG 1-s2.0-S0306261920309399-si65.svg https://s3-eu-west-1.amazonaws.com/prod-ucs-content-store-eu-west/content/pii:S0306261920309399/STRIPIN/image/svg+xml/d664cee446249c93ee03a73ca58498c1/si65.svg si65 si65.svg svg 18909 ALTIMG 1-s2.0-S0306261920309399-si66.svg https://s3-eu-west-1.amazonaws.com/prod-ucs-content-store-eu-west/content/pii:S0306261920309399/STRIPIN/image/svg+xml/d94f30a18e0d9d70ef8d83c79ab1b7e9/si66.svg si66 si66.svg svg 11163 ALTIMG 1-s2.0-S0306261920309399-si67.svg https://s3-eu-west-1.amazonaws.com/prod-ucs-content-store-eu-west/content/pii:S0306261920309399/STRIPIN/image/svg+xml/5b5204734a33612706f699f4fd812e4a/si67.svg si67 si67.svg svg 7744 ALTIMG 1-s2.0-S0306261920309399-si68.svg https://s3-eu-west-1.amazonaws.com/prod-ucs-content-store-eu-west/content/pii:S0306261920309399/STRIPIN/image/svg+xml/1bcbbe0c1a5d4e32f67e1562b36f66e0/si68.svg si68 si68.svg svg 18165 ALTIMG 1-s2.0-S0306261920309399-si69.svg https://s3-eu-west-1.amazonaws.com/prod-ucs-content-store-eu-west/content/pii:S0306261920309399/STRIPIN/image/svg+xml/dc1664949f3591dac768d6fd05eb3bed/si69.svg si69 si69.svg svg 19243 ALTIMG 1-s2.0-S0306261920309399-si7.svg https://s3-eu-west-1.amazonaws.com/prod-ucs-content-store-eu-west/content/pii:S0306261920309399/STRIPIN/image/svg+xml/90a7eba5ba21b7f5a93107b5052a44f7/si7.svg si7 si7.svg svg 7715 ALTIMG 1-s2.0-S0306261920309399-si70.svg https://s3-eu-west-1.amazonaws.com/prod-ucs-content-store-eu-west/content/pii:S0306261920309399/STRIPIN/image/svg+xml/2cfd7ad74936e597a95400b6d41e38f4/si70.svg si70 si70.svg svg 11508 ALTIMG 1-s2.0-S0306261920309399-si71.svg https://s3-eu-west-1.amazonaws.com/prod-ucs-content-store-eu-west/content/pii:S0306261920309399/STRIPIN/image/svg+xml/e916ab8d97b670996e0fb50b88f1052f/si71.svg si71 si71.svg svg 7641 ALTIMG 1-s2.0-S0306261920309399-si72.svg https://s3-eu-west-1.amazonaws.com/prod-ucs-content-store-eu-west/content/pii:S0306261920309399/STRIPIN/image/svg+xml/713609ad50129937dac519db45f6dad5/si72.svg si72 si72.svg svg 6732 ALTIMG 1-s2.0-S0306261920309399-si73.svg https://s3-eu-west-1.amazonaws.com/prod-ucs-content-store-eu-west/content/pii:S0306261920309399/STRIPIN/image/svg+xml/ff09fab815a40cba7411ea8e72149877/si73.svg si73 si73.svg svg 11488 ALTIMG 1-s2.0-S0306261920309399-si74.svg https://s3-eu-west-1.amazonaws.com/prod-ucs-content-store-eu-west/content/pii:S0306261920309399/STRIPIN/image/svg+xml/b061051fafd3efb36e173bc98d756d96/si74.svg si74 si74.svg svg 28172 ALTIMG 1-s2.0-S0306261920309399-si75.svg https://s3-eu-west-1.amazonaws.com/prod-ucs-content-store-eu-west/content/pii:S0306261920309399/STRIPIN/image/svg+xml/225226311c450f7c930eb10124381188/si75.svg si75 si75.svg svg 4447 ALTIMG 1-s2.0-S0306261920309399-si76.svg https://s3-eu-west-1.amazonaws.com/prod-ucs-content-store-eu-west/content/pii:S0306261920309399/STRIPIN/image/svg+xml/9b0625bbfa7389931f679b66ff3c4881/si76.svg si76 si76.svg svg 12377 ALTIMG 1-s2.0-S0306261920309399-si77.svg https://s3-eu-west-1.amazonaws.com/prod-ucs-content-store-eu-west/content/pii:S0306261920309399/STRIPIN/image/svg+xml/42c4ab462bf49ae5f76539bdca13b12d/si77.svg si77 si77.svg svg 19493 ALTIMG 1-s2.0-S0306261920309399-si78.svg https://s3-eu-west-1.amazonaws.com/prod-ucs-content-store-eu-west/content/pii:S0306261920309399/STRIPIN/image/svg+xml/48675405202d87e2bba79819b0acf6b5/si78.svg si78 si78.svg svg 4544 ALTIMG 1-s2.0-S0306261920309399-si79.svg https://s3-eu-west-1.amazonaws.com/prod-ucs-content-store-eu-west/content/pii:S0306261920309399/STRIPIN/image/svg+xml/0f298295984b37550dfc73fbf3b0a91c/si79.svg si79 si79.svg svg 32971 ALTIMG 1-s2.0-S0306261920309399-si8.svg https://s3-eu-west-1.amazonaws.com/prod-ucs-content-store-eu-west/content/pii:S0306261920309399/STRIPIN/image/svg+xml/80f47abb7713f7d09a470aadd98a2239/si8.svg si8 si8.svg svg 7759 ALTIMG 1-s2.0-S0306261920309399-si80.svg https://s3-eu-west-1.amazonaws.com/prod-ucs-content-store-eu-west/content/pii:S0306261920309399/STRIPIN/image/svg+xml/6c8a67ff942036ccc6057329ee63dcef/si80.svg si80 si80.svg svg 6054 ALTIMG 1-s2.0-S0306261920309399-si81.svg https://s3-eu-west-1.amazonaws.com/prod-ucs-content-store-eu-west/content/pii:S0306261920309399/STRIPIN/image/svg+xml/da4529958096c88ff1430323d145f58d/si81.svg si81 si81.svg svg 17202 ALTIMG 1-s2.0-S0306261920309399-si82.svg https://s3-eu-west-1.amazonaws.com/prod-ucs-content-store-eu-west/content/pii:S0306261920309399/STRIPIN/image/svg+xml/6239d30770527452a3bba6023262bbad/si82.svg si82 si82.svg svg 5537 ALTIMG 1-s2.0-S0306261920309399-si83.svg https://s3-eu-west-1.amazonaws.com/prod-ucs-content-store-eu-west/content/pii:S0306261920309399/STRIPIN/image/svg+xml/fe36e77c6239183648b942201b6382f4/si83.svg si83 si83.svg svg 17445 ALTIMG 1-s2.0-S0306261920309399-si84.svg https://s3-eu-west-1.amazonaws.com/prod-ucs-content-store-eu-west/content/pii:S0306261920309399/STRIPIN/image/svg+xml/3efab641ae1b6f670147aa1d73d2711e/si84.svg si84 si84.svg svg 11084 ALTIMG 1-s2.0-S0306261920309399-si85.svg https://s3-eu-west-1.amazonaws.com/prod-ucs-content-store-eu-west/content/pii:S0306261920309399/STRIPIN/image/svg+xml/6e38713abf7435b55ca84cbe7c8c34ad/si85.svg si85 si85.svg svg 5526 ALTIMG 1-s2.0-S0306261920309399-si86.svg https://s3-eu-west-1.amazonaws.com/prod-ucs-content-store-eu-west/content/pii:S0306261920309399/STRIPIN/image/svg+xml/5a49e63da76afbdbd9acbdbd9a05488e/si86.svg si86 si86.svg svg 17802 ALTIMG 1-s2.0-S0306261920309399-si87.svg https://s3-eu-west-1.amazonaws.com/prod-ucs-content-store-eu-west/content/pii:S0306261920309399/STRIPIN/image/svg+xml/b4666ec36d50d89b9c65989a42ba0053/si87.svg si87 si87.svg svg 10734 ALTIMG 1-s2.0-S0306261920309399-si88.svg https://s3-eu-west-1.amazonaws.com/prod-ucs-content-store-eu-west/content/pii:S0306261920309399/STRIPIN/image/svg+xml/3331913b15dcb69d82dc01272f330926/si88.svg si88 si88.svg svg 6525 ALTIMG 1-s2.0-S0306261920309399-si89.svg https://s3-eu-west-1.amazonaws.com/prod-ucs-content-store-eu-west/content/pii:S0306261920309399/STRIPIN/image/svg+xml/1b2df9ab11ac58a655611bf1ad6eb852/si89.svg si89 si89.svg svg 26045 ALTIMG 1-s2.0-S0306261920309399-si9.svg https://s3-eu-west-1.amazonaws.com/prod-ucs-content-store-eu-west/content/pii:S0306261920309399/STRIPIN/image/svg+xml/bc66fcc998ae12c21eab71f6adead7b3/si9.svg si9 si9.svg svg 7313 ALTIMG 1-s2.0-S0306261920309399-si90.svg https://s3-eu-west-1.amazonaws.com/prod-ucs-content-store-eu-west/content/pii:S0306261920309399/STRIPIN/image/svg+xml/e90ae98665b4a2c362d17084ac771f07/si90.svg si90 si90.svg svg 11716 ALTIMG 1-s2.0-S0306261920309399-si91.svg https://s3-eu-west-1.amazonaws.com/prod-ucs-content-store-eu-west/content/pii:S0306261920309399/STRIPIN/image/svg+xml/74de682b3f9f978b946dc5365d286e25/si91.svg si91 si91.svg svg 5088 ALTIMG 1-s2.0-S0306261920309399-si92.svg https://s3-eu-west-1.amazonaws.com/prod-ucs-content-store-eu-west/content/pii:S0306261920309399/STRIPIN/image/svg+xml/f76a62b088d34fb0a223976a544bea83/si92.svg si92 si92.svg svg 3849 ALTIMG 1-s2.0-S0306261920309399-si93.svg https://s3-eu-west-1.amazonaws.com/prod-ucs-content-store-eu-west/content/pii:S0306261920309399/STRIPIN/image/svg+xml/e46015933b4d4f86cfcd8fe6781a7677/si93.svg si93 si93.svg svg 5952 ALTIMG 1-s2.0-S0306261920309399-si94.svg https://s3-eu-west-1.amazonaws.com/prod-ucs-content-store-eu-west/content/pii:S0306261920309399/STRIPIN/image/svg+xml/e353621ec0a59a50fbaaf1e154ca75bc/si94.svg si94 si94.svg svg 6836 ALTIMG 1-s2.0-S0306261920309399-si95.svg https://s3-eu-west-1.amazonaws.com/prod-ucs-content-store-eu-west/content/pii:S0306261920309399/STRIPIN/image/svg+xml/69a7890d13370bffca5f29ad56604549/si95.svg si95 si95.svg svg 4092 ALTIMG 1-s2.0-S0306261920309399-si96.svg https://s3-eu-west-1.amazonaws.com/prod-ucs-content-store-eu-west/content/pii:S0306261920309399/STRIPIN/image/svg+xml/1be78d294268d6a7230a2fbe933c56bc/si96.svg si96 si96.svg svg 5396 ALTIMG 1-s2.0-S0306261920309399-si97.svg https://s3-eu-west-1.amazonaws.com/prod-ucs-content-store-eu-west/content/pii:S0306261920309399/STRIPIN/image/svg+xml/edfefcc6980457c3d793ec9374f71b5b/si97.svg si97 si97.svg svg 16490 ALTIMG 1-s2.0-S0306261920309399-si98.svg https://s3-eu-west-1.amazonaws.com/prod-ucs-content-store-eu-west/content/pii:S0306261920309399/STRIPIN/image/svg+xml/58b4d5a7407f880405617570eaa2edcd/si98.svg si98 si98.svg svg 3497 ALTIMG 1-s2.0-S0306261920309399-si99.svg https://s3-eu-west-1.amazonaws.com/prod-ucs-content-store-eu-west/content/pii:S0306261920309399/STRIPIN/image/svg+xml/b6b8e3e444dabe48f1595578abb22493/si99.svg si99 si99.svg svg 4672 ALTIMG 1-s2.0-S0306261920309399-am.pdf am am.pdf pdf 1690992 AAM-PDF https://s3-eu-west-1.amazonaws.com/prod-ucs-content-store-eu-west/content/egi:10ZD586RHXF/MAIN/application/pdf/59140d7ecfcb3904a92b0e308b492da1/am.pdf APEN 115427 115427 S0306-2619(20)30939-9 10.1016/j.apenergy.2020.115427 Elsevier Ltd Fig. 1 Schematic diagram of a typical central air-conditioning system. Fig. 2 Schematic of the adaptive regression model-based real-time optimal control (ARMRTOC) strategy. Fig. 3 Conceptual diagram of moving window of data. Fig. 4 Segmentation of updated moving window. Fig. 5 Regression model development for a complete air-conditioning process. Fig. 6 (a) Cooling load profiles of 20 continuous days and (b) cooling load profiles of two consecutive days. Fig. 7 Similarity analysis between n th day and following (past) N days (batch size). Fig. 8 Similarity analysis of summer month using index I ' for batch size N = 1 → 11 ; Δ N = 2 . Fig. 9 I-score with respect to batch size N for the cooling load of all three months: (a) spring, (b) summer, and (c) autumn. Fig. 10 I-score with respect to batch size N for wet bulb temperatures of all three months: (a) spring, (b) summer, and (c) autumn. Fig. 11 Comparison of the actual power consumption and the estimates from the online trained performance model. Fig. 12 The load and weather profiles of three weather seasons used in TRNSYS simulation: (a) spring, (b) summer, and (c) autumn. Fig. 13 Power consumption comparison of three strategies for three weather seasons: (a) spring, (b) summer, and (c) autumn. Fig. 14 Computational load comparison between MRTOC and ARMRTOC strategies. Table 1 Summary of the parameters that need online updates. Subsystem Parameters Description Air-handling unit α ah , 0 , α ah , 1 , α ah , 2 Parameters in the fan power model α ah , 3 , α ah , 4 , α ah , 5 Parameters used to calculate the return water temperature from AHU Chiller α ch , 0 , α ch , 1 , α ch , 2 Parameters in the (secondary side) pump power model α ch , 3 , ⋯ , α ch , 8 Parameters in the chiller compressor power model Cooling tower α ct , 0 , α ct , 1 , α ct , 2 Parameters in the cooling tower fan power model Table 2 Summary of the parameters identified offline. Subsystem Parameters Description Chiller β ch , 0 , β ch , 1 , β ch , 2 Parameters in the (primary side) pump power model Cooling tower β ct , 0 , β ct , 1 , β ct , 2 Parameters in the condenser water pump power model β ct , 3 , β ct , 4 , β ct , 5 Parameters used to calculate the mass flow rate of the air out of the cooling tower Table 3 Accuracy of performance model w.r.t. RMSE/MSE and R2 value. RMSE MSE R 2 AHU fan power 15.1386 \u2013 0.9992 Chiller power 27.4369 \u2013 0.9986 Cooling tower power 17.0932 \u2013 0.9891 Secondary pump power 6.2337 0.9947 Secondary chilled water return temperature \u2013 0.0126 0.9784 Table 4 Bounds and thresholds used in the constraints \u2013 Eqs. (20)\u2013(22). Parameter name Value (°C) T _ c w s , 1 , k , T ¯ c w s , 1 , k T wb , k + 1 , 35 T _ c h w s , 1 , k , T ¯ c h w s , 1 , k 5 , 8 T _ s a , k , T ¯ s a , k 12 , 18 Δ T t h r , k 0.5 N o t e : T a w b , k is the wet bulb temperature Table 5 The fixed settings for benchmarking. T c w s , 1 (°C) T c h w s , 1 (°C) T s a (°C) Spring 26 7.5 14 Summer 30 6 15 Autumn 28 7 14.5 Table 6 Energy performance of the fixed set point, MRTOC, and ARMRTOC strategies. Fixed set point (I) MRTOC (II) ARMRTOC (III) Energy saving (I) → (II) Energy saving (II) → (III) Energy saving (I) → (III) kWh kWh kWh % % % Spring 1350024.337 1324328.609 1303051.788 1.90 1.61 3.48 Summer 2455891.665 2248136.26 2195714.253 8.46 2.33 10.59 Autumn 1892529.51 1815634.976 1780084.512 4.06 1.96 5.94 Adaptive regression model-based real-time optimal control of central air-conditioning systems Syed Asad Hussain Conceptualization Methodology Software Investigation Writing - original draft Conceptualization Methodology Software Investigation Writing - original draft a \u204e Gongsheng Huang Conceptualization Visualization Writing - review & editing a Richard Kwok Kit Yuen Supervision Project administration a Wei Wang Data curation Validation b a Department of Architecture and Civil Engineering, City University of Hong Kong, Kowloon, Hong Kong Department of Architecture and Civil Engineering City University of Hong Kong Kowloon Hong Kong Department of Architecture and Civil Engineering, City University of Hong Kong, Kowloon, Hong Kong b School of Architecture, Southeast University, Nanjing, China School of Architecture Southeast University Nanjing China School of Architecture, Southeast University, Nanjing, China \u204e Corresponding author. Model-based, real-time optimal control is an effective tool to improve the energy efficiency of central air-conditioning systems. However, its performance relies heavily on the accuracy of the system models, whereas the development of accurate models for central air-conditioning systems is not easy due to their complex dynamics and non-linearities. This study presents an adaptive regression model-based real-time optimal control strategy for central air-conditioning systems. In the proposed strategy, regression models are adopted to describe the relationship between the power consumption of the system and the variables that are optimised. Their simple structures enable a low computation load for model updating and real-time optimisation. The length of the training data (for model updating) is investigated, and a suitable length is found using a similarity check-based method. Case studies were carried out to assess the performance of the proposed strategy, and they demonstrated that (1) a week was the optimal length of the training data for the case system, (2) the proposed strategy saved energy use by 3.48\u201310.59% when compared with a benchmark system with no optimisation, and (3) the proposed method reduced the computational load by 85% when compared with a simplified physical model-based optimal control without adaptive modelling. Keywords Optimal control Data segmentation Adaptive model Energy saving Central air-conditioning system 1 Introduction Central air-conditioning (AC) systems contribute approximately 50% of the energy consumed by the building sector worldwide [1], which motivates the research and development of new technologies to reduce the energy use of these systems. As an efficient tool, real-time optimal control has been developed and practiced to reduce the energy use of AC systems\u2019 operation. For example, Kusiak et al. [2] presented a data-driven optimisation using an ensemble technique for minimising the energy use of an AC system, and Ma and Wang [3] developed a supervisory optimisation strategy for central chiller plants using adaptive simplified models and a genetic algorithm (GA). Furthermore, Razmara et al. [4] developed a model predictive control (MPC) technique using an exergy model of a building, and Du et al. [5] presented a dual benchmark-based control perfect index (CPI) to judge the operation of an airport heating ventilation and air-conditioning (HVAC) system under different control strategies. More recently, Bianchini et al. [6] presented a specialised MPC technique to optimise AC systems and the storage devices under operational and thermal comfort constraints. Optimal control can reduce energy use by identifying optimal settings for the operation of AC systems and can be realised with or without the use of system models [7]. In the framework of model-based optimal control, system models are needed to describe the relationship between energy use and the decision variables that should be optimised [8]. The efficiency of model-based optimal control relies on the accuracy of system models, as demonstrated in [3,7], thus motivating many studies on AC modelling. In the current literature, AC models can be categorised into three types, namely, physical models, grey-box models, and black-box models [9], and as elaborated in [10], each has its own strengths and weaknesses. In AC optimal control, grey-box models are always adopted because (1) compared with physical models, the structural complexity of grey-box models is significantly reduced, thus reducing the computational cost to search optimal solutions, and (2) compared with black-box models, the parameters in grey-box models have certain physical significance, enabling their feasibility for (limited) extrapolation outside the range of training data covered. However, due to the non-linearities of AC processes, it is challenging to develop grey-box models for the optimal control of AC systems that can guarantee global accuracy, even when sufficient training data are available [10]. Therefore, this paper aims to solve the model problem using an adaptive strategy rather than exploring a new form of models. Adaptive modelling has been studied since the 1980s, and it has been widely used in non-linear process control. For instance, Dochain and Bastin [11] developed a non-linear adaptive control of non-linear bacterial growth systems; Slotine and Ydstie [12] presented an adaptive control approach using physical models for stabilising the continuous stirred tank reactor; and Luo and Billings [13] presented an algorithm that provides an adaptive modelling scheme using a polynomial, non-linear, autoregressive-moving average exogenous (ARMAX) model. Adaptive modelling has gained attention in AC processes, and a few studies can be found that focus on this literature. For example, Nassif et al. [14] developed a method to online tune the model parameters of an air-side cooling system using a GA to minimise the error between measured and estimated performance data. Moreover, Blum et al. [15] studied an adaptive model identification framework for MPC and showed that when a grey-box model was used for a building thermal envelope, the data of a few previous days would produce an accurate MPC-oriented model. However, these studies [14,15] were limited to the air-side and did not consider the dynamics of a whole AC process. There are two critical issues in the development of an adaptive modelling method for a whole AC process: one is the model selection, and the other is the selection of the length of training data for model updating. In adaptive modelling, suitable models should balance the model accuracy and the computational complexity of the online updating. Since adaptive modelling aims to find an accurate model for a period rather than a generalised global one, a simple model structure should be used rather than a complex one. Asad et al. investigated this issue in their study [16], where empirical-physical models were chosen and updated using a hybrid genetic algorithm (HGA) for a whole AC process. However, the empirical-physical models were found to have a converging problem because they involve iterations in their updating. Therefore, more suitable models for the whole AC process in this regard are necessary. Furthermore, the length of the training data for model updating is relative to the model accuracy. Since adaptive modelling does not target global accuracy, smaller training data lead to a more accurate model. However, if the training data are not long enough, then the updated model may be risky for real-time optimisation if the training data present a significant difference with the operation condition under which the system is optimised. For example, Blum et al. [15] found that the use of 1-day training data significantly reduced the accuracy of the models when the models were tested over a week. This is because the load condition for an AC system could be considerably different over two consecutive days. A suitable length of training data should thus be found for the adaptive modelling of a whole AC process. This paper presents an adaptive regression model-based real-time optimal control (ARMRTOC) strategy for a whole AC process with two major contributions: one is the use of regression models for the whole AC process because of their simple structures, which enable a low computation load for model updating and system optimisation, and the other is the systematic way of finding a suitable length of training data for model updating based on a similarity check. In addition, to further improve the model accuracy and to capture important characteristics of the performance, time-series segmentation of the training data was carried out, which resulted in a piecewise accurate performance model. To demonstrate the proposed strategy, a dynamic simulation platform was constructed for a complete AC system using a TRNSYS-MATLAB co-simulator. The operating conditions were generated separately from a validated TRNSYS model of real mega grade A, a 90-floor office building in Hong Kong. The proposed ARMRTOC strategy was tested under three weather seasons \u2013 spring, summer, and autumn \u2013 and its performance was compared with conventional control strategies. This paper is organised as follows. Section 2 explains the methodology for the proposed ARMRTOC strategy, which includes synthesis of data segmentation, regression model update, and system optimisation. Then, Section 3 illustrates the development of the regression models to be used for the synthesis of the ARMRTOC strategy, and Section 4 describes the analysis to determine the optimal length of training data for the regression model update. Finally, case studies are presented in Section 5, and the conclusion is provided in Section 6. 2 Adaptive regression model-based real-time optimal control 2.1 System description and conventional model-based real-time optimal control The AC system studied in this paper is illustrated in Fig. 1 . It is a typical centralised AC system with a bypass line, consisting of a condenser water loop, a chilled water primary loop, its secondary loop, and an air loop. The air loop takes heat from zones and transfers it to the water in the chilled water secondary loop inside the air handling unit (AHU) and then to the water in the chilled water primary loop. Afterward, the heat is transferred to the refrigerant inside the evaporator of the chiller and then to the condenser water inside the condenser. The heat will be ejected to the environment through the cooling tower. In this AC system, chillers, cooling towers, pumps, and fans are the main components that require power input. Many studies have demonstrated that under a given load or operating condition, the set points of the primary chilled water supply temperature ( T chws , 1 ), the cooling water supply temperature ( T cws ), and the supply air temperature ( T sa ) significantly affect the power consumption of the whole system [17,18]. Therefore, real-time optimal control is always formulated to minimise the total power of the whole system under a given load or operating condition by identifying the optimal values of these three set points (i.e. the decision variables for the optimal control) as shown in Eqs. (1) and (2): (1) T sa ∗ , T chws , 1 ∗ , T cws ∗ = arg min T sa , T c h ws , 1 , T cws P total Subject to current load condition and operation constraints, where T sa ∗ , T chws , 1 ∗ , a n d T cws ∗ are the optimal values of the decision variables T sa , T chws , 1 , a n d T cws , and P total is the total power of the whole system, which can be written as a function of the decision variables; that is, (2) P total = f T sa , T chws , 1 , T cws The function f ∙ can be considered as a general form of the performance models of an AC system, describing the relationship between the power consumption and the decision variables. In the current literature, f ∙ can be specified to have the form of physical models, grey-box models, and black-box models. The optimal values of the decision variables are found by solving Eqs. (1) and (2) at each optimisation time (normally every 30 min), and the optimised decision variables will be sent to the AC system to improve its performance. 2.2 Overview of the proposed real-time optimal control strategy The proposed ARMRTOC strategy uses the general formulation of the real-time optimal control in Eqs. (1) and (2). However, it integrates with an adaptive regression modelling scheme, as illustrated in Fig. 2 , where the performance models are updated regularly (e.g. at the beginning of each day) by a model-updating algorithm using the data inside a moving window [19]. The moving window is adopted to incorporate new data and drop out old data since old data, as illustrated in [15], are not desirable for the AC model for adapting to the recent changes in its operating condition. The moving window is illustrated in Fig. 3 , where each block represents a day of recorded data. The length of the window (i.e. k days) describes how old data remain in the window. When a new data block of d a y k + 1 is available, the window is augmented by the new data block of d a y k + 1 , and the oldest data block \u2013 day 1 in this case \u2013 is discarded. Offline trained models are initially used by the optimal control algorithm until the window is filled up to k days. Then, the models are updated every time the window slides to accumulate a new data block of day k + 1 . In Section 4, a suitable length of the training data will be found using a similarity-checking method. By observing that the cooling load of an AC system has a daily pattern \u2013 a low load phase, a transient increasing phase, a high load phase, and a decreasing transient phase \u2013 as depicted in Fig. 4 , a time-series segmentation of data in the moving window is carried out before they are used for the model update for further enhancing model accuracy. The time-series segmentation is designed to create a precise approximation of the time-series data by reducing their dimensions while capturing basic and important characteristics. As shown in Fig. 4, the segmentation of data is carried out in two steps. First, the window of the data is divided into N 24-hour segments. Then, every 24-hour segment is further divided into four sub-segments: (1) a low load phase, from midnight to 08:00; (2) an increasing transient phase, from 08:00 to 11:00; (3) a high load phase, from 11:00 to 21:00; and (4) a decreasing transient phase, from 21:00 to 24:00. The data in each segment are used to train the same performance models but lead to different model parameter sets, indicated as the model parameter set I to IV, as depicted in Fig. 4. When the optimisation is done at a different phase, the corresponding model parameter set should be chosen and used. Regression models are used because they can provide a computationally efficient solution for both online training and optimal control due to their simple structure [7]. For online training, the regression models can be formulated as an affine function (3) Y = ϕ × θ where Y is a vector, consisting of the measured outputs; ϕ is a matrix, consisting of measured states; and θ is a vector, consisting of all the parameters that need updating. The model update is done with a weighted least squares model identification method [20] presented in Eq. (4): (4) θ = Φ ' S Φ - 1 Φ ' S y where S is the weighting function. The criterion to minimise the Euclidean norm with respect to Φ becomes (5) \u2016 ∊ \u2016 2 = ∑ i = 1 m s ii e i 2 where s ii denotes the training weight, which has decreasing positives values, assigning the highest value to the most recent data and the lowest value to the oldest data, and e i is the modelling error. 3 Regression model-based real-time optimal control 3.1 Regression model development Regression models are used in the proposed real-time optimal control strategy. Fig. 5 illustrates all the subsystems and the coupling between them in terms of input variables. The modelling of the AC system is divided into three major parts: (a) an air handling unit, (b) a chiller, and (c) a cooling tower. 3.1.1 AHU regression model According to a study by Cai et al. [21], the power P AH , f of the fan in the AHU is a function of the supply air mass flow rate m ̇ sa and the pressure rise across the fan. When a pressure-independent control is used to control the supply air pressure to be constant, the fan power P AH , f can be written as (6) P AH , f = α ah , 0 + α ah , 1 m ̇ sa + α ah , 2 m ̇ sa 2 where α ah , 0 , α ah , 1 , a n d α ah , 3 are model parameters. Given the AHU cooling load Q z , the enthalpy of the mixed air h ma and the enthalpy of the supply air h sa , m ̇ sa is calculated by (7) m ̇ sa = Q z h ma - h sa where h ma can be obtained according to the mixed air temperature T ma and humidity RH ma , and h sa can be calculated according to the supply air temperature T sa and the required humidity RH sa . Note that T sa is controlled inside the AHU by adjusting the chilled water flow rate. According to Velibeyoglu et al. [22], the chilled water return temperature T chwr , 2 is calculated by (8) T chwr , 2 = T chws , 1 + α ah , 3 + α ah , 4 m ̇ sa + α ah , 5 T ma - T sa where T chws , 1 is the set point for the secondary chilled water temperature, and a ah , 3 , a ah , 4 , a n d a ah , 5 are the model parameters. 3.1.2 Chiller regression model During the chiller operation, the components that need power input are the chilled water pump at the secondary side, the chilled water pump at the primary side, and the chiller compressor. The power of the chilled water pump at the secondary side is (9) P ch , p 2 = α ch , 0 + α ch , 1 m ̇ chw , 2 + α ch , 2 m ̇ chw , 2 2 where α ch , 0 , α ch , 1 , a n d α ch , 2 are the model parameters, and m ̇ chw , 2 is the chilled water mass flow rate at the secondary side, satisfying (10) m ̇ chw , 2 = Q z c w T chwr , 2 - T chws , 2 The power of the chilled water pump at the primary side is given by (11) P ch , p 1 = β ch , 0 + β ch , 1 m ̇ chw , 1 + β ch , 2 m ̇ chw , 1 2 where β ch , 0 , β ch , 1 , a n d β ch , 2 are the model parameters. As m ̇ chw , 1 is constant, P ch , p 1 is considered to be constant as well, which indicates that β ch , 0 , β ch , 1 , a n d β ch , 2 will not vary during the operation. The power of the compressor is given by (ASHRAE Handbook) [23] (12) P ch = α ch , 3 + α ch , 4 T cwr - T chws , 1 + α ch , 5 T cwr - T chws , 1 2 + α ch , 6 Q ch + α ch , 7 Q ch 2 + α ch , 8 T cwr - T chws , 1 Q ch where α ch , 3 , ⋯ , α ch , 8 are the model parameters, and Q ch is the cooling load of the chiller evaporation. By assuming that there is no heat loss during the transmission, and according to the law of energy conservation, Q ch satisfies (13) Q ch = Q z + P ch , p 2 + P ch , p 1 Similarly, the cooling load at the chiller condenser side satisfies Q ct = c w m ̇ cw T cwr - T cws , 2 = Q ch + P ch Therefore, T cwr satisfies (14) c w m ̇ cw T cwr - T cws , 2 = α ch , 3 + α ch , 4 T cwr - T chws , 1 + α ch , 5 T cwr - T chws , 1 2 + 1 + α ch , 6 Q ch + α ch , 7 Q ch 2 + α ch , 8 T cwr - T chws , 1 Q ch where T cws , 2 is given by the cooling tower model. 3.1.3 Cooling tower regression model In the cooling tower, T cws , 2 is given by (15) T cws , 2 = c w m ̇ ct , w T cws , 1 + P ct , p c w m ̇ ct , w where P ct , p is the power of the constant-speed pump, given by (16) P ct , p = β ct , 0 + β ct , 1 m ̇ ct , w + β ct , 2 m ̇ ct , w 2 where β ct , 0 , β ct , 1 , a n d β ct , 2 are the model parameters. As m ̇ ct , w is constant, P ct , p is constant as well, which indicates that β ct , 0 , β ct , 1 , a n d β ct , 2 should not vary during the pump operation. The cooling tower fan power is given by (17) P ct , f = α ct , 0 + α ct , 1 m ̇ ct , a + α ct , 2 m ̇ ct , a 2 where α ct , 0 , α ct , 1 , a n d α ct , 2 are the model parameters, and m ̇ ct , a is the mass flow rate of the air flowing out of the cooling tower. According to Ma and Wang\u2019s work (2008), m ̇ ct , a can be predicted by (18) m ̇ ct , a = β ct , 3 Q ct β ct , 4 m ̇ ct , w β ct , 5 T cwr - T wb β ct , 6 where β ct , 3 , β ct , 4 , a n d β ct , 5 are the model parameters. Ma and Wang\u2019s work [24] also demonstrated that these parameters are relatively stable and would not vary with a change in the operating condition. 3.1.4 Power calculation using the regression models Given the load Q z , the wet bulb temperature T awb and the constant flow rates m ̇ chw , 1 and m ̇ ct , w , with the measured T ma , RH ma , and assuming that the set points for the three loops T sa (as well as RH sa ), T chws , 1 , a n d T cws , 1 are defined, the total power of the whole system is calculated by Algorithm 1, as shown below: Algorithm 1 Calculate the total system power Step 1: Calculate m ̇ sa by Eq. (7) and P AH , f by Eq. (6). Step 2: Calculate P ch , p 1 by Eq. (11), T chwr , 2 by Eq. (8), and m ̇ chw , 2 by Eq. (10); then calculate P ch , p 2 by Eq. (9). Step 3: Calculate Q ch by Eq. (13), P ct , p by Eq. (16), T cws , 2 by Eq. (15), and T cwr by Eq. (14); then calculate P ch by Eq. (12). Step 4: Calculate m ̇ ct , a by Eq. (18), and then calculate P ct , f by Eq. (17). Step 5: Calculate the total power by P tot = P AH , f + P ch , p 1 + P ch , p 2 + P ch + P ct , f . In this algorithm, the parameters that require online updates are summarised in Table 1 . These parameters are identified using a weighted least squares method illustrated in Section 2.2. Vectorisation of the segmented data is carried out to further improve the computation time required for online parameter identification. The parameters that are identified offline are summarised in Table 2 . The parameter identification of these offline parameters was carried out using the genetic algorithms (GAs) method. The parameter identification was formulated as an optimisation task, where the objective was to minimise the modelling error. 3.2 Formulation of the real-time optimal control In the real-time optimisation, the decision variables at the current time instant ( t = k ) should be optimised under the current load condition Q z , k and the weather condition of T awb , k , where Q z , k = m ̇ ah , a , k h ma , k - h sa , k . Algorithm 1 indicates that for any defined set points for the three loops T sa ( RH sa ), T chws , 1 , and T cws , 1 , the total power can be estimated. Therefore, real-time optimisation is formulated as follows: T sa , k ∗ , T chws , 1 , k ∗ , T cws , 1 , k ∗ = arg min T sa , T c h ws , 1 , T cws , 1 P AH , f , k + P ch , p 1 , k + P ch , p 2 , k + P ch , k + P ct , p , k + P ct , f , k Note that both the chilled power pump at the primary side and the condenser water pump are constant speed pumps; they will not be affected by the variations of T sa , T chws , 1 , T chws , 2 , and T cws , 1 . Therefore, the optimisation can be simplified as (19) T sa , k ∗ , T chws , 1 , k ∗ , T cws , 1 , k ∗ = arg min T sa , T c h ws , 1 , T cws , 1 P AH , f , k + P ch , p 2 , k + P ch , k + P ct , f , k This optimisation is subject to the operational constraints given by (20) T _ cws , k ≤ T cws , k ≤ T ¯ cws , k (21) T _ chws , 1 , k ≤ T chws , 1 , k ≤ T ¯ chws , 1 , k (22) T _ sa , k ≤ T sa ≤ T ¯ sa , k Due to the non-linear nature of the models presented by Eqs. (6)\u2013(18), finding an analytic solution to the problem in Eq. (19) is difficult. In this study, the hybrid genetic algorithms (HGAs) method was used to solve Eq. (19), the optimal set point for four local control loops. The HGAs method uses the GAs method\u2019s rapid global search ability [25,16]. However, when it comes to a local search, GAs may struggle to converge and thus cannot ensure rapid optimisation time. Therefore, for the local search, a gradient-based optimisation method using a quasi-Newton algorithm [26,27] was used. The gradient-based optimisation method starts the search with the initial population from GAs, thereby ensuring faster and guaranteed convergence of the optimisation problem. To make this study complete, the pseudo-code for the proposed ARMRTOC strategy is presented in Appendix A. 4 Length of the training data The online training in this study does not aim to find a globally accurate performance model but a model that is accurate for optimisation in the next day. As illustrated in Fig. 6 a, where the cooling load profiles of 20 continuous days are given, the load profiles have large variations. On the one hand, if all of them are used to train the performance models, then the accuracy of the regression models might be reduced due to overfitting. On the other hand, if a short moving window is used, for example only one day, then there is a risk that the next day\u2019s operating conditions might have a large difference. As an example, Fig. 6b shows the load profiles of two consecutive days, which are significantly different from each other. Thus, training using only 1-day operating data could not guarantee the accuracy of the models if the training data do not represent the next-day operating condition well. A criterion is needed for specifying the moving window length to maximise the similarity between the next-day operating data and the data in the moving window. To this end, it is necessary to carry out a similarity analysis between the n th day and the following (past) N days (batch size) and select the optimal length of data for updating the performance models. To find the past number of days with the most similarity to the given day, the dual tree wavelet transform (DTWT) with structure similarity (SSIM) is used, as illustrated in Fig. 7 . Six cases were analysed for N = 1 → 11 with Δ N = 2 , for all n = 1 → L - N with Δ n = 1 , where n is the number of iterations, and L is the total length of data used for the comparison, which was set to 30 days in this study. To perform the similarity analysis, a DTWT with SSIM is used as the similarity index because it can handle data with noise, missing samples, delays, and shift invariants [28]. The similarity between the global shapes of time-series data can be extracted by comparing its DTWT coefficients. The time-series data of two days to be compared can be represented by vectors (23) x 1 = x 1 , 1 , x 1 , 2 , ⋯ , r 1 , n 1 a n d x 2 = x 2 , 1 , x 2 , 2 , ⋯ , x 2 , n 1 where n 1 is the number of sampled data points of the cooling load across time axes with a sampling rate of 1 h. In the DTWT domain, the DTWT coefficients are denoted as d x 1 and d x 2 , extracted from one fixed decomposition level of expansion of data x 1 and x 2 . The SSIM evaluation in the DTWT domain is performed to obtain similarity index I . (24) I = D T W T - S S I M = 2 μ d x 1 μ d x 2 + K 1 2 σ d x 1 d x 2 + K 2 μ d x 1 2 + μ d x 2 2 + K 1 σ d x 1 2 + σ d x 2 2 + K 2 where μ d x 1 , μ d x 2 , σ d x 1 , σ d x 2 , and σ d x 1 d x 2 are the means, standard deviations, and cross covariances for DTWT coefficients d x 1 and d x 2 , and K 2 is a small positive value to avoid instability when the denominator is close to zero. The similarity index I is calculated between the n th day and each day in batch N in the first step (i). The expected value of I for each batch of comparison between the n th day and following (past) N days can be found by Eq. (25) in Step (ii). (25) I ' ⇒ E I = ∑ i = N I i p i Considering that each outcome is equiprobable, p i = 1 / N , that is simply the arithmetic mean of I i . Steps (i)\u2013(ii) are repeated L - N times for each case by moving a day forward in each iteration, and the batch of I ' (expected value of I ) for each case accumulates in Step (iii). To further quantify the results for each case as the final step (iv), the arithmetic mean of the index I ' can be found using Eq. (26) and coined as the I-score, which can range from 0 to 1, with a higher score to signify the similarity. (26) I - s c o r e = I ' ¯ = ∑ i = 1 L - N I ' i / L - N 5 Case studies 5.1 Simulation platform A dynamic simulation platform of an AC system was built in TRNSYS [29] with the configuration shown in Fig. 1. This system had six water-cooled centrifugal chillers, each with a rated capacity of 7,230 kW. To reject the heat from the chiller condensers, 11 crossflow cooling towers were used, each with a rated flow rate of 250 l/s. Both the condenser water loop and the primary chilled water loop employed constant speed pumps, with rated flow rates of 410 l/s and 345 l/s, respectively. The secondary chilled water loop is used to deliver the chilled water to AHUs. The cooling load was generated from a mega grade A, 90-floor office building, which was located at the hub centre of Hong Kong. This building was also modelled in TRNSYS and validated in [30]. The system had four basic loops (shown in Fig. 1), including the condenser water loop, the primary chilled water loop, the secondary chilled water loop, and the supply air loop. Each loop was controlled by a PI controller to track its predefined set point. Here, the PI controller was simulated using Type 23. Furthermore, multiple chillers were used in this system, they were staged on or off according to measured cooling load during the operation, shown in Eq. (27). (27) N ch = c e i l Q ch / Q ch , c a p where c e i l ∙ is a function that rounds a number to the nearest largest integer; Q ch , c a p is the chiller rated capacity; Q ch , c a p = 7230 kW; and Q ch was the measured cooling load, given by (28) Q ch = c w m chw , 1 T chwr , 1 - T chws , 1 where m chw , 1 , T chws , 1 , and T chwr , 1 are the mass flow rate, the supply chilled water temperature, and the return chilled water temperature, respectively, at the primary side. Since the operation of the cooling towers was coupled with the chillers, the number of cooling towers was determined using Eq. (29), where coefficient γ depends on the chiller plant\u2019s configuration. (29) N ct = γ N ch 5.2 Analysis for the length of training data The similarity index I ' for the cooling load of the summer month was found using Eqs. (24) and (25) for all six cases ( N = 1 → 11 with Δ N = 2 ), as presented in Fig. 8 . It can be clearly seen from Fig. 8a, b that the small batch size N = 1 , 3 can decrease the chances of having similar load profile, and training with a small batch of data will be risky. Moreover, increasing the batch size N = 5 , 7 in Fig. 8c, d improves the chances of having similar load profile significantly. However, too large a batch size N = 9 , 11 will not improve results any further, as can be seen in Fig. 8e, f where the performance is still consistent, but the index I ' starts to decrease slowly. In this comparison batch size, N = 7 provides the most consistent results with a higher index I ' . Note that both a consistent and a higher index I ' are important, since the preference is to have a reliable data size that will provide the consistency in the performance of the performance model, while a consistent and lower index I ' will provide consistency with a more generalised model that will reduce model accuracy. The similarity analysis for the months of spring and autumn were also carried out for all six cases using Eqs. (24) and (25), and the I-scores for the cooling loads of all three months were found using Eq. (26) and are presented in Fig. 9 . It can be clearly seen for all three months that batch size N = 7 (i.e. 1-week data) provides the higher I-score, which signifies the most similarity to the following day. Similarly, the wet bulb temperature was also analysed for similarity for data selection, since it is also an input to the regression model. Fig. 10 presents the I-scores for the wet bulb temperature of all three months. Again, batch size N = 7 provides the higher I - s c o r e s . Therefore, 7 days can be selected as an optimal length of data to carry out the performance model update. In the following sections, a new strategy to update the model parameters is proposed by considering the data segmentation based on the observations that (1) the similarity of weather or load condition in a period of 7 days will be the highest, and (2) during each working or weekend day, the load profile patterns are similar. 5.3 Accuracy of the performance model To evaluate the accuracy of the performance model, it was trained and used for prediction, online in real-time. The real-time data were continually filtered using a moving average filter and buffered. The size of the moving window used in this study was 1 week, while the frequency of the model updated was 1 day, and the sampling time of the simulation platform was 1 min. The online model training thus started when the window filled up and the data segmentation and vectorisation are were completed. The model training was done with a weighted least squares model identification method: Eq. (4), using the vectorised data (i.e. a piecewise representation of data in the moving window). The trained model was used to perform one-step-ahead predictions at each sample time. Since the frequency of the updated model was 1 day, the moving window was updated every day, and the performance model was periodically updated using the processed data. The resulting estimates of the power consumption of the chiller plants, AHUs, and cooling towers, as well as the secondary chilled water return temperature, were recorded in real-time for one more week (after the first week when the moving window filled up) and compared with the actual measurements, which are presented in Fig. 11 . It can be seen that there is a good agreement between the estimates from the performance model and the actual data. To quantify the accuracy, two performance criteria were used: root-mean-square error (RMSE)/mean-square error (MSE) and the coefficient of determination ( R 2 ), as shown in Eqs. (30) and (31). It should be noted that the initial 7 days are not considered here. The RMSE and R 2 values are listed in Table 3 . The RMSE/MSEs are small, and the R 2 values are close to 1, indicating high accuracy of the performance model. (30) R 2 = 1 - ∑ y i - y ^ 2 ∑ y i - y ¯ 2 where y i is the actual value, y ^ is the estimated value, and (31) y ¯ = 1 n ∑ i = 1 n y i 5.4 Performance evaluation of the ARMRTOC strategy and discussion The overall performance of the ARMRTOC strategy was evaluated based on energy consumption and computational load. To examine the energy performance of the proposed strategy, it was tested under three weather seasons: spring, summer, and autumn. The ambient conditions for a month in spring (April), summer (July), and autumn (September) from the selected building model (i.e. mega grade A building [30]) were used in this regard. The cooling load profiles of these three months, along with dry bulb and wet bulb temperatures, are presented in Fig. 12 . The performance bounds and thresholds used in the operational constraints of Eqs. (20)\u2013(22) are listed in Table 4 . The optimisation problem in Eq. (19), subject to the system performance model Eqs. (6)\u2013(18) and operational constraints Eqs. (20)\u2013(22), was solved using the HGAs method. Moreover, the frequency used to carry out system optimisation was 1 h. For benchmarking purposes, the energy performance of the proposed ARMRTOC strategy was compared with the conventional fixed set point strategy and the conventional model-based real-time optimal control (MRTOC) strategy using a simplified physical model [31]. The settings for the fixed set point strategy for three seasons are listed in Table 5 , and Fig. 13 a illustrates the total power consumption of three strategies for July (summer). The conventional fixed set point strategy provided 2455891.665 kWh of energy consumption; the MRTOC strategy provided 2248136.26 kWh of energy consumption; and the proposed ARMRTOC strategy provided the most energy-efficient performance, with 2195714.253 kWh of energy consumption. Likewise, total power consumption for April (spring) and September (autumn) for the three strategies is presented in Fig. 13b and Fig. 13c, and the analysis of the energy consumption of these strategies with potential energy savings is presented in Table 6 . It can be seen that the proposed ARMRTOC strategy can reduce energy consumption significantly. The energy consumption for April (spring) was reduced by 3.48% compared with the fixed set point and by 1.61% compared with the MRTOC strategy. The month of July (summer) experienced a reduction in energy consumption by 10.59% compared with the fixed set point and by 2.33% compared with the MRTOC strategy, and for September (Autumn) energy consumption was reduced by 5.94% compared with the fixed set point and by 1.96% compared with the MRTO control strategy. To judge the computational load performance, the proposed ARMRTOC strategy was compared with the conventional MRTOC strategy with a simplified physical model [31]. The time required to carry out system optimisation was measured by calculating the search time required by the ARMRTOC and MRTOC strategies. The time needed to perform the model update was measured by calculating the search time required by the ARMRTOC strategy to search unknown model parameters. Fig. 14 presents the computational load for both strategies, where the online training time for the ARMRTOC strategy is highlighted in red. The proposed ARMRTOC strategy provided a much more computationally efficient performance compared to the MRTOC strategy. The ARMRTOC strategy needed 4.0684 s and 44.5998 s for online training ( t r ) and system optimization ( t o ), respectively. In contrast, the MRTOC strategy needed 344.3478 s for system optimisation ( t o ). The selection of a regression model for the ARMRTOC strategy lead to faster system optimisation, and together with the vectorisation of data, the online training of the model was also fast. The proposed ARMRTOC strategy provided an 85% reduction in computational load. The ARMRTOC strategy was tested for both accuracy and energy performance under variable load conditions in three weather seasons that included weekends (to demonstrate part-load performance), and it was able to capture and adapt to varying load conditions. Overall, the proposed ARMRTOC strategy provides reliability in decision making with manageable computational load, leading to optimal system operation and a reduction in energy use. However, one inherent problem with this strategy is that it relies on online data streaming (i.e. sensor-based measurements). In reality, sensor-based measurements are associated with measurement uncertainty, and the measurement uncertainty can reduce the performance of the ARMRTOC strategy. In the next phase of work, the measurement uncertainty associated with sensor-based measurements will be studied and quantified, and their influence on the ARMRTOC strategy will be analysed. Furthermore, a data fusion technique will be integrated into the ARMRTOC strategy to enhance its robustness. 6 Conclusion This paper presented a new adaptive regression model-based real-time optimal control strategy for complex air conditioning systems. To improve the accuracy of the performance model, the online parameter adaptation was implemented. This strategy used a regression model of the AC system, and due to the simple structure of the performance model, it was computationally efficient for both model updates and system optimisation. To capture important characteristics from data, time-series segmentation was performed, and data selection was implemented through a moving window approach to adapt to changes. The suitable length of the moving window or training data was found in a systematic manner through a similarity analysis of recorded data. Moreover, vectorisation of data was carried out before the model update to reduce the online computation time. The case study was conducted with a typical large-scale complex AC system, and a week of recorded data was found to be the most suitable length of the training data for carrying out the frequent model update. The results demonstrate that the adaptive regression model-based real-time optimal control strategy can reduce an AC system\u2019s energy consumption by 10.59% and its computational load by 85%. Thus, the proposed method might find potential application in real buildings. Due to the limitation of the experimental testbed, the proposed strategy was only evaluated on a simulation platform. Future work will focus on the experimental validation of the proposed strategy. CRediT authorship contribution statement Hussain Syed Asad: Conceptualization, Methodology, Software, Investigation, Writing - original draft. Gongsheng Huang: Conceptualization, Visualization, Writing - review & editing. Richard Kwok Kit Yuen: Supervision, Project administration. Wei Wang: Data curation, Validation. Declaration of Competing Interest The authors declare that they have no known competing financial interests or personal relationships that could have appeared to influence the work reported in this paper. Acknowledgment The work described in this paper was supported by grants from the Research Grants Council of the Hong Kong Special Administrative Region, China (Project No. 11209518, Project No. 11201215). Appendix A Algorithm Pseudo-code for proposed ARMRTOC 1. Initialisation: Perform the following steps: Input \u2013 Repeat at every sample time instant (i.e. 1 min). 1.1. Read and record the current operating condition x n of the system, which includes both system state and ambient condition. 1.2. Based on load demand, compute the number of operating chillers N ch and cooling towers N ct by Eqs. (27) and (29). 1.3. Use offline parameter α until the data window fills up. The window size was 1 week. 2. Data processing: Perform four-stage data processing. Repeat Steps 2.1\u20132.4 periodically at 00:00: 2.1. Filtration \u2013 Filter recorded data using moving average (low pass) filter. 2.2. Data selection \u2013 Update the moving window at 00:00, adding a new 24-hour data block and omitting the oldest 24-hour data block. 2.3. Time-series segmentation \u2013 Segment the updated data window into 24-hour segments; then, divide each day into another four segments: (1) a low load phase, (2) an increasing transient phase, (3) a high load phase, and (4) a decreasing the transient phase. 2.4. Vectorisation \u2013 Solve the non-linear terms of Eqs. (6), (9), (12), and (17), and arrange the data as vectors or matrices. 3. Performance model update: Repeat periodically every 24 h. 3.1. Solve Eqs. (4) and (5) to update the performance model θ ∗ . 4. Optimisation: Repeat the following steps periodically every 1 h: 4.1. Find a solution to Eq. (19) s.t. constraints defined in Eqs. (20)\u2013(22) based on the performance model Eqs. (6)\u2013(18) 4.2. Output \u2013 Update the set points d ∗ = T sa , k ∗ , T chws , 1 , k ∗ , T cws , 1 , k ∗ to the local-loop controllers. References [1] IEO. International energy outlet (IEO) energy information administration. http://www.eia.gov/forecasts/ieo/. [2] A. Kusiak M. Li F. Tang Modeling and optimization of HVAC energy consumption Appl Energy 87 10 2010 3092 3102 Kusiak, A., Li, M. and Tang, F., 2010. Modeling and optimization of HVAC energy consumption. Applied Energy, 87(10), pp.3092-3102. [3] Z. Ma S. Wang Supervisory and optimal control of central chiller plants using simplified adaptive models and genetic algorithm Appl Energy 88 1 2011 198 211 Ma, Z. and Wang, S., 2011. Supervisory and optimal control of central chiller plants using simplified adaptive models and genetic algorithm. Applied Energy, 88(1), pp.198-211. [4] M. Razmara M. Maasoumy M. Shahbakhti R.D. Robinett Optimal exergy control of building HVAC system Appl Energy 156 2015 555 565 Razmara, M., Maasoumy, M., Shahbakhti, M. and Robinett, R.D., 2015. Optimal exergy control of building HVAC system. Applied Energy, 156, pp.555-565. [5] Z. Du X. Jin X. Fang B. Fan A dual-benchmark based energy analysis method to evaluate control strategies for building HVAC systems Appl Energy 183 2016 700 714 Du, Z., Jin, X., Fang, X. and Fan, B., 2016. A dual-benchmark based energy analysis method to evaluate control strategies for building HVAC systems. Applied Energy, 183, pp.700-714. [6] G. Bianchini M. Casini D. Pepe A. Vicino G.G. Zanvettor An integrated model predictive control approach for optimal HVAC and energy storage operation in large-scale buildings Appl Energy 240 2019 327 340 Bianchini, G., Casini, M., Pepe, D., Vicino, A. and Zanvettor, G.G., 2019. An integrated model predictive control approach for optimal HVAC and energy storage operation in large-scale buildings. Applied energy, 240, pp.327-340. [7] S.W. Wang Z.J. Ma Supervisory and optimal control of building HVAC systems: a review HVAC&R Research 14 2008 3 32 Wang S.W., Ma Z.J., 2008. Supervisory and optimal control of building HVAC systems: a review. HVAC&R Research 14, Pages 3-32. [8] G.V. Reklaitis A. Ravindran K.M. Ragsdell Engineering optimization: Methods and applications 1983 Wiley New York 150 165 Reklaitis, G.V., Ravindran, A. and Ragsdell, K.M., 1983. Engineering optimization: Methods and applications (pp. 150-165). New York: Wiley. [9] A. Afram F. Janabi-Sharifi Review of modeling methods for HVAC systems Appl Therm Eng 67 1\u20132 2014 507 519 Afram, A. and Janabi-Sharifi, F., 2014. Review of modeling methods for HVAC systems. Applied Thermal Engineering, 67(1-2), pp.507-519. [10] Z. Afroz G.M. Shafiullah T. Urmee G. Higgins Modeling techniques used in building HVAC control systems: A review Renew Sustain Energy Rev 83 2018 64 84 Afroz, Z., Shafiullah, G.M., Urmee, T. and Higgins, G., 2018. Modeling techniques used in building HVAC control systems: A review. Renewable and Sustainable Energy Reviews, 83, pp.64-84. [11] D. Dochain G. Bastin Adaptive identification and control algorithms for nonlinear bacterial growth systems Automatica 20 5 1984 621 634 Dochain, D. and Bastin, G., 1984. Adaptive identification and control algorithms for nonlinear bacterial growth systems. Automatica, 20(5), pp.621-634. [12] J.J. Slotine B.E. Ydstie Nonlinear process control: an adaptive approach which uses physical models Nonlinear Control Systems Design 1989 1990 Pergamon 357 362 Slotine, J.J. and Ydstie, B.E., 1990. Nonlinear process control: an adaptive approach which uses physical models. In Nonlinear Control Systems Design 1989 (pp. 357-362). Pergamon. [13] W. Luo S.A. Billings Adaptive model selection and estimation for nonlinear systems using a sliding data window Signal Process 46 2 1995 179 202 Luo, W. and Billings, S.A., 1995. Adaptive model selection and estimation for nonlinear systems using a sliding data window. Signal Processing, 46(2), pp.179-202. [14] N. Nassif S. Moujaes M. Zaheeruddin Self-tuning dynamic models of HVAC system components Energy Build 40 9 2008 1709 1720 Nassif, N., Moujaes, S. and Zaheeruddin, M., 2008. Self-tuning dynamic models of HVAC system components. Energy and Buildings, 40(9), pp.1709-1720. [15] D.H. Blum K. Arendt L. Rivalin M.A. Piette M. Wetter C.T. Veje Practical factors of envelope model setup and their effects on the performance of model predictive control for building heating, ventilating, and air conditioning systems Appl Energy 236 2019 410 425 Blum, D.H., Arendt, K., Rivalin, L., Piette, M.A., Wetter, M. and Veje, C.T., 2019. Practical factors of envelope model setup and their effects on the performance of model predictive control for building heating, ventilating, and air conditioning systems., Applied energy, 236, pp.410-425. [16] H.S. Asad R.K.K. Yuen J. Liu J. Wang Adaptive modeling for reliability in optimal control of complex HVAC systems Build Simul 2019 359 398 Asad H.S., Yuen R.K.K., Liu J., Wang J., 2019. Adaptive modeling for reliability in optimal control of complex HVAC systems. In Building Simulation, pp. 359-398. [17] H.S. Asad R.K.K. Yuen G. Huang Degree of freedom based set-point reset scheme for HVAC real-time optimization Energy Build 128 2016 349 359 Asad H.S., Yuen, R.K.K. and Huang, G., 2016. Degree of freedom based set-point reset scheme for HVAC real-time optimization. Energy and buildings, 128, pp.349-359. [18] H.S. Asad R.K.K. Yuen G. Huang Multiplexed real-time optimization of HVAC systems with enhanced control stability Appl Energy 187 2017 640 651 Asad H.S., Yuen, R.K.K. and Huang, G., 2017. Multiplexed real-time optimization of HVAC systems with enhanced control stability. Applied Energy, 187, pp.640-651. [19] J. Wang G. Huang Y. Sun X. Liu Event-driven optimization of complex HVAC systems Energy Build 133 2016 79 87 Wang, J., Huang, G., Sun, Y. and Liu, X., 2016. Event-driven optimization of complex HVAC systems. Energy and Buildings, 133, pp.79-87. [20] S.J. Qin Recursive PLS algorithms for adaptive data modeling Comput Chem Eng 22 4\u20135 1998 503 514 Qin, S.J., 1998. Recursive PLS algorithms for adaptive data modeling. Computers & Chemical Engineering, 22(4-5), pp.503-514. [21] M. Gautier P. Poignet Extended Kalman filtering and weighted least squares dynamic identification of robot Control Eng Pract 9 12 2001 1361 1372 Gautier, M. and Poignet, P., 2001. Extended Kalman filtering and weighted least squares dynamic identification of robot. Control Engineering Practice, 9(12), pp.1361-1372. [22] J. Cai D. Kim V.K. Putta J.E. Braun J. Hu Multi-agent control for centralized air conditioning systems serving multi-zone buildings 2015 American Control Conference (ACC), July 2015 IEEE 986 993 Cai, J., Kim, D., Putta, V.K., Braun, J.E. and Hu, J., 2015, July. Multi-agent control for centralized air conditioning systems serving multi-zone buildings. In 2015 American Control Conference (ACC) (pp. 986-993). IEEE. [23] I. Velibeyoglu H. Young Noh M. Pozzi Empirical investigation of regression models for predicting system behavior in air handling units Sci Technol Built Environ 25 3 2019 247 260 Velibeyoglu, I., Young Noh, H. and Pozzi, M., 2019. Empirical investigation of regression models for predicting system behavior in air handling units. Science and Technology for the Built Environment, 25(3), pp.247-260. [24] HVAC Applications - 2015 ASHRAE Handbook, SI. Atlanta, USA: ASHRAE Inc. [25] Z. Ma Online supervisory and optimal control of complex building central chilling systems (Doctoral dissertation) 2008 The Hong Kong Polytechnic University) Ma, Z., 2008. Online supervisory and optimal control of complex building central chilling systems (Doctoral dissertation, The Hong Kong Polytechnic University). [26] P. Guo X. Wang Y. Han The enhanced genetic algorithms for the optimization design 2010 3rd International Conference on Biomedical Engineering and Informatics, October vol. 7 2010 IEEE 2990 2994 Guo, P., Wang, X. and Han, Y., 2010, October. The enhanced genetic algorithms for the optimization design. In 2010 3rd International Conference on Biomedical Engineering and Informatics (Vol. 7, pp. 2990-2994). IEEE. [27] C.G. Broyden The convergence of a class of double-rank minimization algorithms 1. General considerations IMA J Appl Math 6 1 1970 76 90 Broyden, C.G., 1970. The convergence of a class of double-rank minimization algorithms 1. general considerations. IMA Journal of Applied Mathematics, 6(1), pp.76-90. [28] D.F. Shanno Conditioning of quasi-Newton methods for function minimization Math Comput 24 111 1970 647 656 Shanno, D.F., 1970. Conditioning of quasi-Newton methods for function minimization. Mathematics of computation, 24(111), pp.647-656. [29] M.S. Lee L.Y. Liu M.Y. Chen Similarity analysis of time series gene expression using dual-tree wavelet transform 2007 IEEE International Conference on Acoustics, Speech and Signal Processing-ICASSP'07, April vol. 1 2007 IEEE I 413 Lee, M.S., Liu, L.Y. and Chen, M.Y., 2007, April. Similarity analysis of time series gene expression using dual-tree wavelet transform. In 2007 IEEE International Conference on Acoustics, Speech and Signal Processing-ICASSP'07 (Vol. 1, pp. I-413). IEEE. [30] TRNSYS, 2004, TRNSYS 16 Documentation, http://sel.me.wisc.edu/trnsys. [31] L. Wang E.W. Lee R.K. Yuen Novel dynamic forecasting model for building cooling loads combining an artificial neural network and an ensemble approach Appl Energy 228 2018 1740 1753 Wang, L., Lee, E.W. and Yuen, R.K., 2018. Novel dynamic forecasting model for building cooling loads combining an artificial neural network and an ensemble approach. Applied energy, 228, pp.1740-1753.",
    "scopus-id": "85087732872",
    "coredata": {
        "eid": "1-s2.0-S0306261920309399",
        "dc:description": "Model-based, real-time optimal control is an effective tool to improve the energy efficiency of central air-conditioning systems. However, its performance relies heavily on the accuracy of the system models, whereas the development of accurate models for central air-conditioning systems is not easy due to their complex dynamics and non-linearities. This study presents an adaptive regression model-based real-time optimal control strategy for central air-conditioning systems. In the proposed strategy, regression models are adopted to describe the relationship between the power consumption of the system and the variables that are optimised. Their simple structures enable a low computation load for model updating and real-time optimisation. The length of the training data (for model updating) is investigated, and a suitable length is found using a similarity check-based method. Case studies were carried out to assess the performance of the proposed strategy, and they demonstrated that (1) a week was the optimal length of the training data for the case system, (2) the proposed strategy saved energy use by 3.48\u201310.59% when compared with a benchmark system with no optimisation, and (3) the proposed method reduced the computational load by 85% when compared with a simplified physical model-based optimal control without adaptive modelling.",
        "openArchiveArticle": "false",
        "prism:coverDate": "2020-10-15",
        "openaccessUserLicense": null,
        "prism:aggregationType": "Journal",
        "prism:url": "https://api.elsevier.com/content/article/pii/S0306261920309399",
        "dc:creator": [
            {
                "@_fa": "true",
                "$": "Hussain, Syed Asad"
            },
            {
                "@_fa": "true",
                "$": "Huang, Gongsheng"
            },
            {
                "@_fa": "true",
                "$": "Yuen, Richard Kwok Kit"
            },
            {
                "@_fa": "true",
                "$": "Wang, Wei"
            }
        ],
        "link": [
            {
                "@_fa": "true",
                "@rel": "self",
                "@href": "https://api.elsevier.com/content/article/pii/S0306261920309399"
            },
            {
                "@_fa": "true",
                "@rel": "scidir",
                "@href": "https://www.sciencedirect.com/science/article/pii/S0306261920309399"
            }
        ],
        "dc:format": "application/json",
        "openaccessType": null,
        "pii": "S0306-2619(20)30939-9",
        "prism:volume": "276",
        "articleNumber": "115427",
        "prism:publisher": "Elsevier Ltd.",
        "dc:title": "Adaptive regression model-based real-time optimal control of central air-conditioning systems",
        "prism:copyright": "© 2020 Elsevier Ltd. All rights reserved.",
        "openaccess": "0",
        "prism:issn": "03062619",
        "dcterms:subject": [
            {
                "@_fa": "true",
                "$": "Optimal control"
            },
            {
                "@_fa": "true",
                "$": "Data segmentation"
            },
            {
                "@_fa": "true",
                "$": "Adaptive model"
            },
            {
                "@_fa": "true",
                "$": "Energy saving"
            },
            {
                "@_fa": "true",
                "$": "Central air-conditioning system"
            }
        ],
        "openaccessArticle": "false",
        "prism:publicationName": "Applied Energy",
        "openaccessSponsorType": null,
        "prism:pageRange": "115427",
        "pubType": "fla",
        "prism:coverDisplayDate": "15 October 2020",
        "prism:doi": "10.1016/j.apenergy.2020.115427",
        "prism:startingPage": "115427",
        "dc:identifier": "doi:10.1016/j.apenergy.2020.115427",
        "openaccessSponsorName": null
    },
    "objects": {"object": [
        {
            "@category": "standard",
            "@height": "282",
            "@width": "622",
            "@_fa": "true",
            "$": "https://api.elsevier.com/content/object/eid/1-s2.0-S0306261920309399-gr7.jpg?httpAccept=%2A%2F%2A",
            "@multimediatype": "JPEG image file",
            "@type": "IMAGE-DOWNSAMPLED",
            "@size": "53979",
            "@ref": "gr7",
            "@mimetype": "image/jpeg"
        },
        {
            "@category": "standard",
            "@height": "256",
            "@width": "556",
            "@_fa": "true",
            "$": "https://api.elsevier.com/content/object/eid/1-s2.0-S0306261920309399-gr6.jpg?httpAccept=%2A%2F%2A",
            "@multimediatype": "JPEG image file",
            "@type": "IMAGE-DOWNSAMPLED",
            "@size": "41822",
            "@ref": "gr6",
            "@mimetype": "image/jpeg"
        },
        {
            "@category": "standard",
            "@height": "495",
            "@width": "667",
            "@_fa": "true",
            "$": "https://api.elsevier.com/content/object/eid/1-s2.0-S0306261920309399-gr5.jpg?httpAccept=%2A%2F%2A",
            "@multimediatype": "JPEG image file",
            "@type": "IMAGE-DOWNSAMPLED",
            "@size": "60573",
            "@ref": "gr5",
            "@mimetype": "image/jpeg"
        },
        {
            "@category": "standard",
            "@height": "352",
            "@width": "765",
            "@_fa": "true",
            "$": "https://api.elsevier.com/content/object/eid/1-s2.0-S0306261920309399-gr4.jpg?httpAccept=%2A%2F%2A",
            "@multimediatype": "JPEG image file",
            "@type": "IMAGE-DOWNSAMPLED",
            "@size": "75727",
            "@ref": "gr4",
            "@mimetype": "image/jpeg"
        },
        {
            "@category": "standard",
            "@height": "164",
            "@width": "365",
            "@_fa": "true",
            "$": "https://api.elsevier.com/content/object/eid/1-s2.0-S0306261920309399-gr3.jpg?httpAccept=%2A%2F%2A",
            "@multimediatype": "JPEG image file",
            "@type": "IMAGE-DOWNSAMPLED",
            "@size": "16089",
            "@ref": "gr3",
            "@mimetype": "image/jpeg"
        },
        {
            "@category": "standard",
            "@height": "368",
            "@width": "578",
            "@_fa": "true",
            "$": "https://api.elsevier.com/content/object/eid/1-s2.0-S0306261920309399-gr2.jpg?httpAccept=%2A%2F%2A",
            "@multimediatype": "JPEG image file",
            "@type": "IMAGE-DOWNSAMPLED",
            "@size": "42793",
            "@ref": "gr2",
            "@mimetype": "image/jpeg"
        },
        {
            "@category": "standard",
            "@height": "277",
            "@width": "667",
            "@_fa": "true",
            "$": "https://api.elsevier.com/content/object/eid/1-s2.0-S0306261920309399-gr1.jpg?httpAccept=%2A%2F%2A",
            "@multimediatype": "JPEG image file",
            "@type": "IMAGE-DOWNSAMPLED",
            "@size": "38583",
            "@ref": "gr1",
            "@mimetype": "image/jpeg"
        },
        {
            "@category": "standard",
            "@height": "465",
            "@width": "364",
            "@_fa": "true",
            "$": "https://api.elsevier.com/content/object/eid/1-s2.0-S0306261920309399-gr10.jpg?httpAccept=%2A%2F%2A",
            "@multimediatype": "JPEG image file",
            "@type": "IMAGE-DOWNSAMPLED",
            "@size": "31386",
            "@ref": "gr10",
            "@mimetype": "image/jpeg"
        },
        {
            "@category": "standard",
            "@height": "597",
            "@width": "364",
            "@_fa": "true",
            "$": "https://api.elsevier.com/content/object/eid/1-s2.0-S0306261920309399-gr11.jpg?httpAccept=%2A%2F%2A",
            "@multimediatype": "JPEG image file",
            "@type": "IMAGE-DOWNSAMPLED",
            "@size": "69761",
            "@ref": "gr11",
            "@mimetype": "image/jpeg"
        },
        {
            "@category": "standard",
            "@height": "401",
            "@width": "578",
            "@_fa": "true",
            "$": "https://api.elsevier.com/content/object/eid/1-s2.0-S0306261920309399-gr12.jpg?httpAccept=%2A%2F%2A",
            "@multimediatype": "JPEG image file",
            "@type": "IMAGE-DOWNSAMPLED",
            "@size": "76489",
            "@ref": "gr12",
            "@mimetype": "image/jpeg"
        },
        {
            "@category": "standard",
            "@height": "581",
            "@width": "623",
            "@_fa": "true",
            "$": "https://api.elsevier.com/content/object/eid/1-s2.0-S0306261920309399-gr13.jpg?httpAccept=%2A%2F%2A",
            "@multimediatype": "JPEG image file",
            "@type": "IMAGE-DOWNSAMPLED",
            "@size": "93745",
            "@ref": "gr13",
            "@mimetype": "image/jpeg"
        },
        {
            "@category": "standard",
            "@height": "365",
            "@width": "623",
            "@_fa": "true",
            "$": "https://api.elsevier.com/content/object/eid/1-s2.0-S0306261920309399-gr14.jpg?httpAccept=%2A%2F%2A",
            "@multimediatype": "JPEG image file",
            "@type": "IMAGE-DOWNSAMPLED",
            "@size": "61986",
            "@ref": "gr14",
            "@mimetype": "image/jpeg"
        },
        {
            "@category": "standard",
            "@height": "463",
            "@width": "364",
            "@_fa": "true",
            "$": "https://api.elsevier.com/content/object/eid/1-s2.0-S0306261920309399-gr9.jpg?httpAccept=%2A%2F%2A",
            "@multimediatype": "JPEG image file",
            "@type": "IMAGE-DOWNSAMPLED",
            "@size": "30481",
            "@ref": "gr9",
            "@mimetype": "image/jpeg"
        },
        {
            "@category": "standard",
            "@height": "437",
            "@width": "578",
            "@_fa": "true",
            "$": "https://api.elsevier.com/content/object/eid/1-s2.0-S0306261920309399-gr8.jpg?httpAccept=%2A%2F%2A",
            "@multimediatype": "JPEG image file",
            "@type": "IMAGE-DOWNSAMPLED",
            "@size": "60008",
            "@ref": "gr8",
            "@mimetype": "image/jpeg"
        },
        {
            "@category": "thumbnail",
            "@height": "99",
            "@width": "219",
            "@_fa": "true",
            "$": "https://api.elsevier.com/content/object/eid/1-s2.0-S0306261920309399-gr7.sml?httpAccept=%2A%2F%2A",
            "@multimediatype": "GIF image file",
            "@type": "IMAGE-THUMBNAIL",
            "@size": "7671",
            "@ref": "gr7",
            "@mimetype": "image/gif"
        },
        {
            "@category": "thumbnail",
            "@height": "101",
            "@width": "219",
            "@_fa": "true",
            "$": "https://api.elsevier.com/content/object/eid/1-s2.0-S0306261920309399-gr6.sml?httpAccept=%2A%2F%2A",
            "@multimediatype": "GIF image file",
            "@type": "IMAGE-THUMBNAIL",
            "@size": "8422",
            "@ref": "gr6",
            "@mimetype": "image/gif"
        },
        {
            "@category": "thumbnail",
            "@height": "163",
            "@width": "219",
            "@_fa": "true",
            "$": "https://api.elsevier.com/content/object/eid/1-s2.0-S0306261920309399-gr5.sml?httpAccept=%2A%2F%2A",
            "@multimediatype": "GIF image file",
            "@type": "IMAGE-THUMBNAIL",
            "@size": "8058",
            "@ref": "gr5",
            "@mimetype": "image/gif"
        },
        {
            "@category": "thumbnail",
            "@height": "101",
            "@width": "219",
            "@_fa": "true",
            "$": "https://api.elsevier.com/content/object/eid/1-s2.0-S0306261920309399-gr4.sml?httpAccept=%2A%2F%2A",
            "@multimediatype": "GIF image file",
            "@type": "IMAGE-THUMBNAIL",
            "@size": "8349",
            "@ref": "gr4",
            "@mimetype": "image/gif"
        },
        {
            "@category": "thumbnail",
            "@height": "98",
            "@width": "219",
            "@_fa": "true",
            "$": "https://api.elsevier.com/content/object/eid/1-s2.0-S0306261920309399-gr3.sml?httpAccept=%2A%2F%2A",
            "@multimediatype": "GIF image file",
            "@type": "IMAGE-THUMBNAIL",
            "@size": "5476",
            "@ref": "gr3",
            "@mimetype": "image/gif"
        },
        {
            "@category": "thumbnail",
            "@height": "139",
            "@width": "219",
            "@_fa": "true",
            "$": "https://api.elsevier.com/content/object/eid/1-s2.0-S0306261920309399-gr2.sml?httpAccept=%2A%2F%2A",
            "@multimediatype": "GIF image file",
            "@type": "IMAGE-THUMBNAIL",
            "@size": "8389",
            "@ref": "gr2",
            "@mimetype": "image/gif"
        },
        {
            "@category": "thumbnail",
            "@height": "91",
            "@width": "219",
            "@_fa": "true",
            "$": "https://api.elsevier.com/content/object/eid/1-s2.0-S0306261920309399-gr1.sml?httpAccept=%2A%2F%2A",
            "@multimediatype": "GIF image file",
            "@type": "IMAGE-THUMBNAIL",
            "@size": "5597",
            "@ref": "gr1",
            "@mimetype": "image/gif"
        },
        {
            "@category": "thumbnail",
            "@height": "164",
            "@width": "128",
            "@_fa": "true",
            "$": "https://api.elsevier.com/content/object/eid/1-s2.0-S0306261920309399-gr10.sml?httpAccept=%2A%2F%2A",
            "@multimediatype": "GIF image file",
            "@type": "IMAGE-THUMBNAIL",
            "@size": "4823",
            "@ref": "gr10",
            "@mimetype": "image/gif"
        },
        {
            "@category": "thumbnail",
            "@height": "164",
            "@width": "100",
            "@_fa": "true",
            "$": "https://api.elsevier.com/content/object/eid/1-s2.0-S0306261920309399-gr11.sml?httpAccept=%2A%2F%2A",
            "@multimediatype": "GIF image file",
            "@type": "IMAGE-THUMBNAIL",
            "@size": "7723",
            "@ref": "gr11",
            "@mimetype": "image/gif"
        },
        {
            "@category": "thumbnail",
            "@height": "152",
            "@width": "219",
            "@_fa": "true",
            "$": "https://api.elsevier.com/content/object/eid/1-s2.0-S0306261920309399-gr12.sml?httpAccept=%2A%2F%2A",
            "@multimediatype": "GIF image file",
            "@type": "IMAGE-THUMBNAIL",
            "@size": "13715",
            "@ref": "gr12",
            "@mimetype": "image/gif"
        },
        {
            "@category": "thumbnail",
            "@height": "164",
            "@width": "176",
            "@_fa": "true",
            "$": "https://api.elsevier.com/content/object/eid/1-s2.0-S0306261920309399-gr13.sml?httpAccept=%2A%2F%2A",
            "@multimediatype": "GIF image file",
            "@type": "IMAGE-THUMBNAIL",
            "@size": "11404",
            "@ref": "gr13",
            "@mimetype": "image/gif"
        },
        {
            "@category": "thumbnail",
            "@height": "128",
            "@width": "219",
            "@_fa": "true",
            "$": "https://api.elsevier.com/content/object/eid/1-s2.0-S0306261920309399-gr14.sml?httpAccept=%2A%2F%2A",
            "@multimediatype": "GIF image file",
            "@type": "IMAGE-THUMBNAIL",
            "@size": "11579",
            "@ref": "gr14",
            "@mimetype": "image/gif"
        },
        {
            "@category": "thumbnail",
            "@height": "164",
            "@width": "129",
            "@_fa": "true",
            "$": "https://api.elsevier.com/content/object/eid/1-s2.0-S0306261920309399-gr9.sml?httpAccept=%2A%2F%2A",
            "@multimediatype": "GIF image file",
            "@type": "IMAGE-THUMBNAIL",
            "@size": "5042",
            "@ref": "gr9",
            "@mimetype": "image/gif"
        },
        {
            "@category": "thumbnail",
            "@height": "164",
            "@width": "217",
            "@_fa": "true",
            "$": "https://api.elsevier.com/content/object/eid/1-s2.0-S0306261920309399-gr8.sml?httpAccept=%2A%2F%2A",
            "@multimediatype": "GIF image file",
            "@type": "IMAGE-THUMBNAIL",
            "@size": "9863",
            "@ref": "gr8",
            "@mimetype": "image/gif"
        },
        {
            "@category": "high",
            "@height": "1248",
            "@width": "2756",
            "@_fa": "true",
            "$": "https://api.elsevier.com/content/object/eid/1-s2.0-S0306261920309399-gr7_lrg.jpg?httpAccept=%2A%2F%2A",
            "@multimediatype": "JPEG image file",
            "@type": "IMAGE-HIGH-RES",
            "@size": "239915",
            "@ref": "gr7",
            "@mimetype": "image/jpeg"
        },
        {
            "@category": "high",
            "@height": "1132",
            "@width": "2461",
            "@_fa": "true",
            "$": "https://api.elsevier.com/content/object/eid/1-s2.0-S0306261920309399-gr6_lrg.jpg?httpAccept=%2A%2F%2A",
            "@multimediatype": "JPEG image file",
            "@type": "IMAGE-HIGH-RES",
            "@size": "245592",
            "@ref": "gr6",
            "@mimetype": "image/jpeg"
        },
        {
            "@category": "high",
            "@height": "2192",
            "@width": "2953",
            "@_fa": "true",
            "$": "https://api.elsevier.com/content/object/eid/1-s2.0-S0306261920309399-gr5_lrg.jpg?httpAccept=%2A%2F%2A",
            "@multimediatype": "JPEG image file",
            "@type": "IMAGE-HIGH-RES",
            "@size": "279337",
            "@ref": "gr5",
            "@mimetype": "image/jpeg"
        },
        {
            "@category": "high",
            "@height": "1556",
            "@width": "3386",
            "@_fa": "true",
            "$": "https://api.elsevier.com/content/object/eid/1-s2.0-S0306261920309399-gr4_lrg.jpg?httpAccept=%2A%2F%2A",
            "@multimediatype": "JPEG image file",
            "@type": "IMAGE-HIGH-RES",
            "@size": "387284",
            "@ref": "gr4",
            "@mimetype": "image/jpeg"
        },
        {
            "@category": "high",
            "@height": "725",
            "@width": "1618",
            "@_fa": "true",
            "$": "https://api.elsevier.com/content/object/eid/1-s2.0-S0306261920309399-gr3_lrg.jpg?httpAccept=%2A%2F%2A",
            "@multimediatype": "JPEG image file",
            "@type": "IMAGE-HIGH-RES",
            "@size": "87467",
            "@ref": "gr3",
            "@mimetype": "image/jpeg"
        },
        {
            "@category": "high",
            "@height": "1630",
            "@width": "2559",
            "@_fa": "true",
            "$": "https://api.elsevier.com/content/object/eid/1-s2.0-S0306261920309399-gr2_lrg.jpg?httpAccept=%2A%2F%2A",
            "@multimediatype": "JPEG image file",
            "@type": "IMAGE-HIGH-RES",
            "@size": "235818",
            "@ref": "gr2",
            "@mimetype": "image/jpeg"
        },
        {
            "@category": "high",
            "@height": "1227",
            "@width": "2953",
            "@_fa": "true",
            "$": "https://api.elsevier.com/content/object/eid/1-s2.0-S0306261920309399-gr1_lrg.jpg?httpAccept=%2A%2F%2A",
            "@multimediatype": "JPEG image file",
            "@type": "IMAGE-HIGH-RES",
            "@size": "200614",
            "@ref": "gr1",
            "@mimetype": "image/jpeg"
        },
        {
            "@category": "high",
            "@height": "2064",
            "@width": "1614",
            "@_fa": "true",
            "$": "https://api.elsevier.com/content/object/eid/1-s2.0-S0306261920309399-gr10_lrg.jpg?httpAccept=%2A%2F%2A",
            "@multimediatype": "JPEG image file",
            "@type": "IMAGE-HIGH-RES",
            "@size": "214760",
            "@ref": "gr10",
            "@mimetype": "image/jpeg"
        },
        {
            "@category": "high",
            "@height": "2647",
            "@width": "1615",
            "@_fa": "true",
            "$": "https://api.elsevier.com/content/object/eid/1-s2.0-S0306261920309399-gr11_lrg.jpg?httpAccept=%2A%2F%2A",
            "@multimediatype": "JPEG image file",
            "@type": "IMAGE-HIGH-RES",
            "@size": "512172",
            "@ref": "gr11",
            "@mimetype": "image/jpeg"
        },
        {
            "@category": "high",
            "@height": "1774",
            "@width": "2559",
            "@_fa": "true",
            "$": "https://api.elsevier.com/content/object/eid/1-s2.0-S0306261920309399-gr12_lrg.jpg?httpAccept=%2A%2F%2A",
            "@multimediatype": "JPEG image file",
            "@type": "IMAGE-HIGH-RES",
            "@size": "616028",
            "@ref": "gr12",
            "@mimetype": "image/jpeg"
        },
        {
            "@category": "high",
            "@height": "2572",
            "@width": "2757",
            "@_fa": "true",
            "$": "https://api.elsevier.com/content/object/eid/1-s2.0-S0306261920309399-gr13_lrg.jpg?httpAccept=%2A%2F%2A",
            "@multimediatype": "JPEG image file",
            "@type": "IMAGE-HIGH-RES",
            "@size": "763722",
            "@ref": "gr13",
            "@mimetype": "image/jpeg"
        },
        {
            "@category": "high",
            "@height": "1614",
            "@width": "2758",
            "@_fa": "true",
            "$": "https://api.elsevier.com/content/object/eid/1-s2.0-S0306261920309399-gr14_lrg.jpg?httpAccept=%2A%2F%2A",
            "@multimediatype": "JPEG image file",
            "@type": "IMAGE-HIGH-RES",
            "@size": "521318",
            "@ref": "gr14",
            "@mimetype": "image/jpeg"
        },
        {
            "@category": "high",
            "@height": "2051",
            "@width": "1614",
            "@_fa": "true",
            "$": "https://api.elsevier.com/content/object/eid/1-s2.0-S0306261920309399-gr9_lrg.jpg?httpAccept=%2A%2F%2A",
            "@multimediatype": "JPEG image file",
            "@type": "IMAGE-HIGH-RES",
            "@size": "200387",
            "@ref": "gr9",
            "@mimetype": "image/jpeg"
        },
        {
            "@category": "high",
            "@height": "1936",
            "@width": "2559",
            "@_fa": "true",
            "$": "https://api.elsevier.com/content/object/eid/1-s2.0-S0306261920309399-gr8_lrg.jpg?httpAccept=%2A%2F%2A",
            "@multimediatype": "JPEG image file",
            "@type": "IMAGE-HIGH-RES",
            "@size": "430744",
            "@ref": "gr8",
            "@mimetype": "image/jpeg"
        },
        {
            "@category": "thumbnail",
            "@_fa": "true",
            "$": "https://api.elsevier.com/content/object/eid/1-s2.0-S0306261920309399-si1.svg?httpAccept=%2A%2F%2A",
            "@multimediatype": "Scalable Vector Graphics file",
            "@type": "ALTIMG",
            "@size": "4251",
            "@ref": "si1",
            "@mimetype": "image/svg+xml"
        },
        {
            "@category": "thumbnail",
            "@_fa": "true",
            "$": "https://api.elsevier.com/content/object/eid/1-s2.0-S0306261920309399-si10.svg?httpAccept=%2A%2F%2A",
            "@multimediatype": "Scalable Vector Graphics file",
            "@type": "ALTIMG",
            "@size": "8066",
            "@ref": "si10",
            "@mimetype": "image/svg+xml"
        },
        {
            "@category": "thumbnail",
            "@_fa": "true",
            "$": "https://api.elsevier.com/content/object/eid/1-s2.0-S0306261920309399-si100.svg?httpAccept=%2A%2F%2A",
            "@multimediatype": "Scalable Vector Graphics file",
            "@type": "ALTIMG",
            "@size": "6765",
            "@ref": "si100",
            "@mimetype": "image/svg+xml"
        },
        {
            "@category": "thumbnail",
            "@_fa": "true",
            "$": "https://api.elsevier.com/content/object/eid/1-s2.0-S0306261920309399-si101.svg?httpAccept=%2A%2F%2A",
            "@multimediatype": "Scalable Vector Graphics file",
            "@type": "ALTIMG",
            "@size": "18114",
            "@ref": "si101",
            "@mimetype": "image/svg+xml"
        },
        {
            "@category": "thumbnail",
            "@_fa": "true",
            "$": "https://api.elsevier.com/content/object/eid/1-s2.0-S0306261920309399-si102.svg?httpAccept=%2A%2F%2A",
            "@multimediatype": "Scalable Vector Graphics file",
            "@type": "ALTIMG",
            "@size": "43832",
            "@ref": "si102",
            "@mimetype": "image/svg+xml"
        },
        {
            "@category": "thumbnail",
            "@_fa": "true",
            "$": "https://api.elsevier.com/content/object/eid/1-s2.0-S0306261920309399-si103.svg?httpAccept=%2A%2F%2A",
            "@multimediatype": "Scalable Vector Graphics file",
            "@type": "ALTIMG",
            "@size": "7363",
            "@ref": "si103",
            "@mimetype": "image/svg+xml"
        },
        {
            "@category": "thumbnail",
            "@_fa": "true",
            "$": "https://api.elsevier.com/content/object/eid/1-s2.0-S0306261920309399-si104.svg?httpAccept=%2A%2F%2A",
            "@multimediatype": "Scalable Vector Graphics file",
            "@type": "ALTIMG",
            "@size": "42008",
            "@ref": "si104",
            "@mimetype": "image/svg+xml"
        },
        {
            "@category": "thumbnail",
            "@_fa": "true",
            "$": "https://api.elsevier.com/content/object/eid/1-s2.0-S0306261920309399-si105.svg?httpAccept=%2A%2F%2A",
            "@multimediatype": "Scalable Vector Graphics file",
            "@type": "ALTIMG",
            "@size": "9117",
            "@ref": "si105",
            "@mimetype": "image/svg+xml"
        },
        {
            "@category": "thumbnail",
            "@_fa": "true",
            "$": "https://api.elsevier.com/content/object/eid/1-s2.0-S0306261920309399-si106.svg?httpAccept=%2A%2F%2A",
            "@multimediatype": "Scalable Vector Graphics file",
            "@type": "ALTIMG",
            "@size": "12035",
            "@ref": "si106",
            "@mimetype": "image/svg+xml"
        },
        {
            "@category": "thumbnail",
            "@_fa": "true",
            "$": "https://api.elsevier.com/content/object/eid/1-s2.0-S0306261920309399-si107.svg?httpAccept=%2A%2F%2A",
            "@multimediatype": "Scalable Vector Graphics file",
            "@type": "ALTIMG",
            "@size": "7703",
            "@ref": "si107",
            "@mimetype": "image/svg+xml"
        },
        {
            "@category": "thumbnail",
            "@_fa": "true",
            "$": "https://api.elsevier.com/content/object/eid/1-s2.0-S0306261920309399-si108.svg?httpAccept=%2A%2F%2A",
            "@multimediatype": "Scalable Vector Graphics file",
            "@type": "ALTIMG",
            "@size": "3560",
            "@ref": "si108",
            "@mimetype": "image/svg+xml"
        },
        {
            "@category": "thumbnail",
            "@_fa": "true",
            "$": "https://api.elsevier.com/content/object/eid/1-s2.0-S0306261920309399-si109.svg?httpAccept=%2A%2F%2A",
            "@multimediatype": "Scalable Vector Graphics file",
            "@type": "ALTIMG",
            "@size": "3787",
            "@ref": "si109",
            "@mimetype": "image/svg+xml"
        },
        {
            "@category": "thumbnail",
            "@_fa": "true",
            "$": "https://api.elsevier.com/content/object/eid/1-s2.0-S0306261920309399-si11.svg?httpAccept=%2A%2F%2A",
            "@multimediatype": "Scalable Vector Graphics file",
            "@type": "ALTIMG",
            "@size": "7658",
            "@ref": "si11",
            "@mimetype": "image/svg+xml"
        },
        {
            "@category": "thumbnail",
            "@_fa": "true",
            "$": "https://api.elsevier.com/content/object/eid/1-s2.0-S0306261920309399-si110.svg?httpAccept=%2A%2F%2A",
            "@multimediatype": "Scalable Vector Graphics file",
            "@type": "ALTIMG",
            "@size": "6323",
            "@ref": "si110",
            "@mimetype": "image/svg+xml"
        },
        {
            "@category": "thumbnail",
            "@_fa": "true",
            "$": "https://api.elsevier.com/content/object/eid/1-s2.0-S0306261920309399-si111.svg?httpAccept=%2A%2F%2A",
            "@multimediatype": "Scalable Vector Graphics file",
            "@type": "ALTIMG",
            "@size": "3972",
            "@ref": "si111",
            "@mimetype": "image/svg+xml"
        },
        {
            "@category": "thumbnail",
            "@_fa": "true",
            "$": "https://api.elsevier.com/content/object/eid/1-s2.0-S0306261920309399-si112.svg?httpAccept=%2A%2F%2A",
            "@multimediatype": "Scalable Vector Graphics file",
            "@type": "ALTIMG",
            "@size": "1709",
            "@ref": "si112",
            "@mimetype": "image/svg+xml"
        },
        {
            "@category": "thumbnail",
            "@_fa": "true",
            "$": "https://api.elsevier.com/content/object/eid/1-s2.0-S0306261920309399-si113.svg?httpAccept=%2A%2F%2A",
            "@multimediatype": "Scalable Vector Graphics file",
            "@type": "ALTIMG",
            "@size": "1301",
            "@ref": "si113",
            "@mimetype": "image/svg+xml"
        },
        {
            "@category": "thumbnail",
            "@_fa": "true",
            "$": "https://api.elsevier.com/content/object/eid/1-s2.0-S0306261920309399-si114.svg?httpAccept=%2A%2F%2A",
            "@multimediatype": "Scalable Vector Graphics file",
            "@type": "ALTIMG",
            "@size": "17846",
            "@ref": "si114",
            "@mimetype": "image/svg+xml"
        },
        {
            "@category": "thumbnail",
            "@_fa": "true",
            "$": "https://api.elsevier.com/content/object/eid/1-s2.0-S0306261920309399-si115.svg?httpAccept=%2A%2F%2A",
            "@multimediatype": "Scalable Vector Graphics file",
            "@type": "ALTIMG",
            "@size": "2466",
            "@ref": "si115",
            "@mimetype": "image/svg+xml"
        },
        {
            "@category": "thumbnail",
            "@_fa": "true",
            "$": "https://api.elsevier.com/content/object/eid/1-s2.0-S0306261920309399-si116.svg?httpAccept=%2A%2F%2A",
            "@multimediatype": "Scalable Vector Graphics file",
            "@type": "ALTIMG",
            "@size": "4215",
            "@ref": "si116",
            "@mimetype": "image/svg+xml"
        },
        {
            "@category": "thumbnail",
            "@_fa": "true",
            "$": "https://api.elsevier.com/content/object/eid/1-s2.0-S0306261920309399-si117.svg?httpAccept=%2A%2F%2A",
            "@multimediatype": "Scalable Vector Graphics file",
            "@type": "ALTIMG",
            "@size": "4327",
            "@ref": "si117",
            "@mimetype": "image/svg+xml"
        },
        {
            "@category": "thumbnail",
            "@_fa": "true",
            "$": "https://api.elsevier.com/content/object/eid/1-s2.0-S0306261920309399-si118.svg?httpAccept=%2A%2F%2A",
            "@multimediatype": "Scalable Vector Graphics file",
            "@type": "ALTIMG",
            "@size": "2879",
            "@ref": "si118",
            "@mimetype": "image/svg+xml"
        },
        {
            "@category": "thumbnail",
            "@_fa": "true",
            "$": "https://api.elsevier.com/content/object/eid/1-s2.0-S0306261920309399-si119.svg?httpAccept=%2A%2F%2A",
            "@multimediatype": "Scalable Vector Graphics file",
            "@type": "ALTIMG",
            "@size": "2986",
            "@ref": "si119",
            "@mimetype": "image/svg+xml"
        },
        {
            "@category": "thumbnail",
            "@_fa": "true",
            "$": "https://api.elsevier.com/content/object/eid/1-s2.0-S0306261920309399-si12.svg?httpAccept=%2A%2F%2A",
            "@multimediatype": "Scalable Vector Graphics file",
            "@type": "ALTIMG",
            "@size": "8289",
            "@ref": "si12",
            "@mimetype": "image/svg+xml"
        },
        {
            "@category": "thumbnail",
            "@_fa": "true",
            "$": "https://api.elsevier.com/content/object/eid/1-s2.0-S0306261920309399-si120.svg?httpAccept=%2A%2F%2A",
            "@multimediatype": "Scalable Vector Graphics file",
            "@type": "ALTIMG",
            "@size": "1014",
            "@ref": "si120",
            "@mimetype": "image/svg+xml"
        },
        {
            "@category": "thumbnail",
            "@_fa": "true",
            "$": "https://api.elsevier.com/content/object/eid/1-s2.0-S0306261920309399-si121.svg?httpAccept=%2A%2F%2A",
            "@multimediatype": "Scalable Vector Graphics file",
            "@type": "ALTIMG",
            "@size": "26122",
            "@ref": "si121",
            "@mimetype": "image/svg+xml"
        },
        {
            "@category": "thumbnail",
            "@_fa": "true",
            "$": "https://api.elsevier.com/content/object/eid/1-s2.0-S0306261920309399-si122.svg?httpAccept=%2A%2F%2A",
            "@multimediatype": "Scalable Vector Graphics file",
            "@type": "ALTIMG",
            "@size": "5129",
            "@ref": "si122",
            "@mimetype": "image/svg+xml"
        },
        {
            "@category": "thumbnail",
            "@_fa": "true",
            "$": "https://api.elsevier.com/content/object/eid/1-s2.0-S0306261920309399-si123.svg?httpAccept=%2A%2F%2A",
            "@multimediatype": "Scalable Vector Graphics file",
            "@type": "ALTIMG",
            "@size": "5237",
            "@ref": "si123",
            "@mimetype": "image/svg+xml"
        },
        {
            "@category": "thumbnail",
            "@_fa": "true",
            "$": "https://api.elsevier.com/content/object/eid/1-s2.0-S0306261920309399-si124.svg?httpAccept=%2A%2F%2A",
            "@multimediatype": "Scalable Vector Graphics file",
            "@type": "ALTIMG",
            "@size": "5002",
            "@ref": "si124",
            "@mimetype": "image/svg+xml"
        },
        {
            "@category": "thumbnail",
            "@_fa": "true",
            "$": "https://api.elsevier.com/content/object/eid/1-s2.0-S0306261920309399-si125.svg?httpAccept=%2A%2F%2A",
            "@multimediatype": "Scalable Vector Graphics file",
            "@type": "ALTIMG",
            "@size": "5118",
            "@ref": "si125",
            "@mimetype": "image/svg+xml"
        },
        {
            "@category": "thumbnail",
            "@_fa": "true",
            "$": "https://api.elsevier.com/content/object/eid/1-s2.0-S0306261920309399-si126.svg?httpAccept=%2A%2F%2A",
            "@multimediatype": "Scalable Vector Graphics file",
            "@type": "ALTIMG",
            "@size": "6164",
            "@ref": "si126",
            "@mimetype": "image/svg+xml"
        },
        {
            "@category": "thumbnail",
            "@_fa": "true",
            "$": "https://api.elsevier.com/content/object/eid/1-s2.0-S0306261920309399-si127.svg?httpAccept=%2A%2F%2A",
            "@multimediatype": "Scalable Vector Graphics file",
            "@type": "ALTIMG",
            "@size": "2673",
            "@ref": "si127",
            "@mimetype": "image/svg+xml"
        },
        {
            "@category": "thumbnail",
            "@_fa": "true",
            "$": "https://api.elsevier.com/content/object/eid/1-s2.0-S0306261920309399-si128.svg?httpAccept=%2A%2F%2A",
            "@multimediatype": "Scalable Vector Graphics file",
            "@type": "ALTIMG",
            "@size": "12725",
            "@ref": "si128",
            "@mimetype": "image/svg+xml"
        },
        {
            "@category": "thumbnail",
            "@_fa": "true",
            "$": "https://api.elsevier.com/content/object/eid/1-s2.0-S0306261920309399-si129.svg?httpAccept=%2A%2F%2A",
            "@multimediatype": "Scalable Vector Graphics file",
            "@type": "ALTIMG",
            "@size": "6098",
            "@ref": "si129",
            "@mimetype": "image/svg+xml"
        },
        {
            "@category": "thumbnail",
            "@_fa": "true",
            "$": "https://api.elsevier.com/content/object/eid/1-s2.0-S0306261920309399-si13.svg?httpAccept=%2A%2F%2A",
            "@multimediatype": "Scalable Vector Graphics file",
            "@type": "ALTIMG",
            "@size": "2682",
            "@ref": "si13",
            "@mimetype": "image/svg+xml"
        },
        {
            "@category": "thumbnail",
            "@_fa": "true",
            "$": "https://api.elsevier.com/content/object/eid/1-s2.0-S0306261920309399-si130.svg?httpAccept=%2A%2F%2A",
            "@multimediatype": "Scalable Vector Graphics file",
            "@type": "ALTIMG",
            "@size": "2395",
            "@ref": "si130",
            "@mimetype": "image/svg+xml"
        },
        {
            "@category": "thumbnail",
            "@_fa": "true",
            "$": "https://api.elsevier.com/content/object/eid/1-s2.0-S0306261920309399-si131.svg?httpAccept=%2A%2F%2A",
            "@multimediatype": "Scalable Vector Graphics file",
            "@type": "ALTIMG",
            "@size": "2557",
            "@ref": "si131",
            "@mimetype": "image/svg+xml"
        },
        {
            "@category": "thumbnail",
            "@_fa": "true",
            "$": "https://api.elsevier.com/content/object/eid/1-s2.0-S0306261920309399-si132.svg?httpAccept=%2A%2F%2A",
            "@multimediatype": "Scalable Vector Graphics file",
            "@type": "ALTIMG",
            "@size": "18335",
            "@ref": "si132",
            "@mimetype": "image/svg+xml"
        },
        {
            "@category": "thumbnail",
            "@_fa": "true",
            "$": "https://api.elsevier.com/content/object/eid/1-s2.0-S0306261920309399-si133.svg?httpAccept=%2A%2F%2A",
            "@multimediatype": "Scalable Vector Graphics file",
            "@type": "ALTIMG",
            "@size": "15210",
            "@ref": "si133",
            "@mimetype": "image/svg+xml"
        },
        {
            "@category": "thumbnail",
            "@_fa": "true",
            "$": "https://api.elsevier.com/content/object/eid/1-s2.0-S0306261920309399-si134.svg?httpAccept=%2A%2F%2A",
            "@multimediatype": "Scalable Vector Graphics file",
            "@type": "ALTIMG",
            "@size": "4764",
            "@ref": "si134",
            "@mimetype": "image/svg+xml"
        },
        {
            "@category": "thumbnail",
            "@_fa": "true",
            "$": "https://api.elsevier.com/content/object/eid/1-s2.0-S0306261920309399-si135.svg?httpAccept=%2A%2F%2A",
            "@multimediatype": "Scalable Vector Graphics file",
            "@type": "ALTIMG",
            "@size": "8371",
            "@ref": "si135",
            "@mimetype": "image/svg+xml"
        },
        {
            "@category": "thumbnail",
            "@_fa": "true",
            "$": "https://api.elsevier.com/content/object/eid/1-s2.0-S0306261920309399-si136.svg?httpAccept=%2A%2F%2A",
            "@multimediatype": "Scalable Vector Graphics file",
            "@type": "ALTIMG",
            "@size": "12280",
            "@ref": "si136",
            "@mimetype": "image/svg+xml"
        },
        {
            "@category": "thumbnail",
            "@_fa": "true",
            "$": "https://api.elsevier.com/content/object/eid/1-s2.0-S0306261920309399-si137.svg?httpAccept=%2A%2F%2A",
            "@multimediatype": "Scalable Vector Graphics file",
            "@type": "ALTIMG",
            "@size": "16263",
            "@ref": "si137",
            "@mimetype": "image/svg+xml"
        },
        {
            "@category": "thumbnail",
            "@_fa": "true",
            "$": "https://api.elsevier.com/content/object/eid/1-s2.0-S0306261920309399-si138.svg?httpAccept=%2A%2F%2A",
            "@multimediatype": "Scalable Vector Graphics file",
            "@type": "ALTIMG",
            "@size": "7111",
            "@ref": "si138",
            "@mimetype": "image/svg+xml"
        },
        {
            "@category": "thumbnail",
            "@_fa": "true",
            "$": "https://api.elsevier.com/content/object/eid/1-s2.0-S0306261920309399-si139.svg?httpAccept=%2A%2F%2A",
            "@multimediatype": "Scalable Vector Graphics file",
            "@type": "ALTIMG",
            "@size": "7005",
            "@ref": "si139",
            "@mimetype": "image/svg+xml"
        },
        {
            "@category": "thumbnail",
            "@_fa": "true",
            "$": "https://api.elsevier.com/content/object/eid/1-s2.0-S0306261920309399-si14.svg?httpAccept=%2A%2F%2A",
            "@multimediatype": "Scalable Vector Graphics file",
            "@type": "ALTIMG",
            "@size": "11860",
            "@ref": "si14",
            "@mimetype": "image/svg+xml"
        },
        {
            "@category": "thumbnail",
            "@_fa": "true",
            "$": "https://api.elsevier.com/content/object/eid/1-s2.0-S0306261920309399-si140.svg?httpAccept=%2A%2F%2A",
            "@multimediatype": "Scalable Vector Graphics file",
            "@type": "ALTIMG",
            "@size": "1026",
            "@ref": "si140",
            "@mimetype": "image/svg+xml"
        },
        {
            "@category": "thumbnail",
            "@_fa": "true",
            "$": "https://api.elsevier.com/content/object/eid/1-s2.0-S0306261920309399-si141.svg?httpAccept=%2A%2F%2A",
            "@multimediatype": "Scalable Vector Graphics file",
            "@type": "ALTIMG",
            "@size": "6253",
            "@ref": "si141",
            "@mimetype": "image/svg+xml"
        },
        {
            "@category": "thumbnail",
            "@_fa": "true",
            "$": "https://api.elsevier.com/content/object/eid/1-s2.0-S0306261920309399-si142.svg?httpAccept=%2A%2F%2A",
            "@multimediatype": "Scalable Vector Graphics file",
            "@type": "ALTIMG",
            "@size": "4454",
            "@ref": "si142",
            "@mimetype": "image/svg+xml"
        },
        {
            "@category": "thumbnail",
            "@_fa": "true",
            "$": "https://api.elsevier.com/content/object/eid/1-s2.0-S0306261920309399-si143.svg?httpAccept=%2A%2F%2A",
            "@multimediatype": "Scalable Vector Graphics file",
            "@type": "ALTIMG",
            "@size": "4054",
            "@ref": "si143",
            "@mimetype": "image/svg+xml"
        },
        {
            "@category": "thumbnail",
            "@_fa": "true",
            "$": "https://api.elsevier.com/content/object/eid/1-s2.0-S0306261920309399-si144.svg?httpAccept=%2A%2F%2A",
            "@multimediatype": "Scalable Vector Graphics file",
            "@type": "ALTIMG",
            "@size": "4188",
            "@ref": "si144",
            "@mimetype": "image/svg+xml"
        },
        {
            "@category": "thumbnail",
            "@_fa": "true",
            "$": "https://api.elsevier.com/content/object/eid/1-s2.0-S0306261920309399-si145.svg?httpAccept=%2A%2F%2A",
            "@multimediatype": "Scalable Vector Graphics file",
            "@type": "ALTIMG",
            "@size": "2592",
            "@ref": "si145",
            "@mimetype": "image/svg+xml"
        },
        {
            "@category": "thumbnail",
            "@_fa": "true",
            "$": "https://api.elsevier.com/content/object/eid/1-s2.0-S0306261920309399-si146.svg?httpAccept=%2A%2F%2A",
            "@multimediatype": "Scalable Vector Graphics file",
            "@type": "ALTIMG",
            "@size": "6435",
            "@ref": "si146",
            "@mimetype": "image/svg+xml"
        },
        {
            "@category": "thumbnail",
            "@_fa": "true",
            "$": "https://api.elsevier.com/content/object/eid/1-s2.0-S0306261920309399-si147.svg?httpAccept=%2A%2F%2A",
            "@multimediatype": "Scalable Vector Graphics file",
            "@type": "ALTIMG",
            "@size": "2710",
            "@ref": "si147",
            "@mimetype": "image/svg+xml"
        },
        {
            "@category": "thumbnail",
            "@_fa": "true",
            "$": "https://api.elsevier.com/content/object/eid/1-s2.0-S0306261920309399-si148.svg?httpAccept=%2A%2F%2A",
            "@multimediatype": "Scalable Vector Graphics file",
            "@type": "ALTIMG",
            "@size": "11835",
            "@ref": "si148",
            "@mimetype": "image/svg+xml"
        },
        {
            "@category": "thumbnail",
            "@_fa": "true",
            "$": "https://api.elsevier.com/content/object/eid/1-s2.0-S0306261920309399-si149.svg?httpAccept=%2A%2F%2A",
            "@multimediatype": "Scalable Vector Graphics file",
            "@type": "ALTIMG",
            "@size": "3270",
            "@ref": "si149",
            "@mimetype": "image/svg+xml"
        },
        {
            "@category": "thumbnail",
            "@_fa": "true",
            "$": "https://api.elsevier.com/content/object/eid/1-s2.0-S0306261920309399-si15.svg?httpAccept=%2A%2F%2A",
            "@multimediatype": "Scalable Vector Graphics file",
            "@type": "ALTIMG",
            "@size": "11528",
            "@ref": "si15",
            "@mimetype": "image/svg+xml"
        },
        {
            "@category": "thumbnail",
            "@_fa": "true",
            "$": "https://api.elsevier.com/content/object/eid/1-s2.0-S0306261920309399-si150.svg?httpAccept=%2A%2F%2A",
            "@multimediatype": "Scalable Vector Graphics file",
            "@type": "ALTIMG",
            "@size": "2465",
            "@ref": "si150",
            "@mimetype": "image/svg+xml"
        },
        {
            "@category": "thumbnail",
            "@_fa": "true",
            "$": "https://api.elsevier.com/content/object/eid/1-s2.0-S0306261920309399-si151.svg?httpAccept=%2A%2F%2A",
            "@multimediatype": "Scalable Vector Graphics file",
            "@type": "ALTIMG",
            "@size": "11927",
            "@ref": "si151",
            "@mimetype": "image/svg+xml"
        },
        {
            "@category": "thumbnail",
            "@_fa": "true",
            "$": "https://api.elsevier.com/content/object/eid/1-s2.0-S0306261920309399-si152.svg?httpAccept=%2A%2F%2A",
            "@multimediatype": "Scalable Vector Graphics file",
            "@type": "ALTIMG",
            "@size": "3207",
            "@ref": "si152",
            "@mimetype": "image/svg+xml"
        },
        {
            "@category": "thumbnail",
            "@_fa": "true",
            "$": "https://api.elsevier.com/content/object/eid/1-s2.0-S0306261920309399-si153.svg?httpAccept=%2A%2F%2A",
            "@multimediatype": "Scalable Vector Graphics file",
            "@type": "ALTIMG",
            "@size": "3089",
            "@ref": "si153",
            "@mimetype": "image/svg+xml"
        },
        {
            "@category": "thumbnail",
            "@_fa": "true",
            "$": "https://api.elsevier.com/content/object/eid/1-s2.0-S0306261920309399-si154.svg?httpAccept=%2A%2F%2A",
            "@multimediatype": "Scalable Vector Graphics file",
            "@type": "ALTIMG",
            "@size": "3395",
            "@ref": "si154",
            "@mimetype": "image/svg+xml"
        },
        {
            "@category": "thumbnail",
            "@_fa": "true",
            "$": "https://api.elsevier.com/content/object/eid/1-s2.0-S0306261920309399-si155.svg?httpAccept=%2A%2F%2A",
            "@multimediatype": "Scalable Vector Graphics file",
            "@type": "ALTIMG",
            "@size": "3417",
            "@ref": "si155",
            "@mimetype": "image/svg+xml"
        },
        {
            "@category": "thumbnail",
            "@_fa": "true",
            "$": "https://api.elsevier.com/content/object/eid/1-s2.0-S0306261920309399-si156.svg?httpAccept=%2A%2F%2A",
            "@multimediatype": "Scalable Vector Graphics file",
            "@type": "ALTIMG",
            "@size": "3191",
            "@ref": "si156",
            "@mimetype": "image/svg+xml"
        },
        {
            "@category": "thumbnail",
            "@_fa": "true",
            "$": "https://api.elsevier.com/content/object/eid/1-s2.0-S0306261920309399-si157.svg?httpAccept=%2A%2F%2A",
            "@multimediatype": "Scalable Vector Graphics file",
            "@type": "ALTIMG",
            "@size": "866",
            "@ref": "si157",
            "@mimetype": "image/svg+xml"
        },
        {
            "@category": "thumbnail",
            "@_fa": "true",
            "$": "https://api.elsevier.com/content/object/eid/1-s2.0-S0306261920309399-si158.svg?httpAccept=%2A%2F%2A",
            "@multimediatype": "Scalable Vector Graphics file",
            "@type": "ALTIMG",
            "@size": "1659",
            "@ref": "si158",
            "@mimetype": "image/svg+xml"
        },
        {
            "@category": "thumbnail",
            "@_fa": "true",
            "$": "https://api.elsevier.com/content/object/eid/1-s2.0-S0306261920309399-si159.svg?httpAccept=%2A%2F%2A",
            "@multimediatype": "Scalable Vector Graphics file",
            "@type": "ALTIMG",
            "@size": "16227",
            "@ref": "si159",
            "@mimetype": "image/svg+xml"
        },
        {
            "@category": "thumbnail",
            "@_fa": "true",
            "$": "https://api.elsevier.com/content/object/eid/1-s2.0-S0306261920309399-si16.svg?httpAccept=%2A%2F%2A",
            "@multimediatype": "Scalable Vector Graphics file",
            "@type": "ALTIMG",
            "@size": "13374",
            "@ref": "si16",
            "@mimetype": "image/svg+xml"
        },
        {
            "@category": "thumbnail",
            "@_fa": "true",
            "$": "https://api.elsevier.com/content/object/eid/1-s2.0-S0306261920309399-si17.svg?httpAccept=%2A%2F%2A",
            "@multimediatype": "Scalable Vector Graphics file",
            "@type": "ALTIMG",
            "@size": "4369",
            "@ref": "si17",
            "@mimetype": "image/svg+xml"
        },
        {
            "@category": "thumbnail",
            "@_fa": "true",
            "$": "https://api.elsevier.com/content/object/eid/1-s2.0-S0306261920309399-si18.svg?httpAccept=%2A%2F%2A",
            "@multimediatype": "Scalable Vector Graphics file",
            "@type": "ALTIMG",
            "@size": "10060",
            "@ref": "si18",
            "@mimetype": "image/svg+xml"
        },
        {
            "@category": "thumbnail",
            "@_fa": "true",
            "$": "https://api.elsevier.com/content/object/eid/1-s2.0-S0306261920309399-si19.svg?httpAccept=%2A%2F%2A",
            "@multimediatype": "Scalable Vector Graphics file",
            "@type": "ALTIMG",
            "@size": "4573",
            "@ref": "si19",
            "@mimetype": "image/svg+xml"
        },
        {
            "@category": "thumbnail",
            "@_fa": "true",
            "$": "https://api.elsevier.com/content/object/eid/1-s2.0-S0306261920309399-si2.svg?httpAccept=%2A%2F%2A",
            "@multimediatype": "Scalable Vector Graphics file",
            "@type": "ALTIMG",
            "@size": "1407",
            "@ref": "si2",
            "@mimetype": "image/svg+xml"
        },
        {
            "@category": "thumbnail",
            "@_fa": "true",
            "$": "https://api.elsevier.com/content/object/eid/1-s2.0-S0306261920309399-si20.svg?httpAccept=%2A%2F%2A",
            "@multimediatype": "Scalable Vector Graphics file",
            "@type": "ALTIMG",
            "@size": "6363",
            "@ref": "si20",
            "@mimetype": "image/svg+xml"
        },
        {
            "@category": "thumbnail",
            "@_fa": "true",
            "$": "https://api.elsevier.com/content/object/eid/1-s2.0-S0306261920309399-si21.svg?httpAccept=%2A%2F%2A",
            "@multimediatype": "Scalable Vector Graphics file",
            "@type": "ALTIMG",
            "@size": "2998",
            "@ref": "si21",
            "@mimetype": "image/svg+xml"
        },
        {
            "@category": "thumbnail",
            "@_fa": "true",
            "$": "https://api.elsevier.com/content/object/eid/1-s2.0-S0306261920309399-si22.svg?httpAccept=%2A%2F%2A",
            "@multimediatype": "Scalable Vector Graphics file",
            "@type": "ALTIMG",
            "@size": "9282",
            "@ref": "si22",
            "@mimetype": "image/svg+xml"
        },
        {
            "@category": "thumbnail",
            "@_fa": "true",
            "$": "https://api.elsevier.com/content/object/eid/1-s2.0-S0306261920309399-si23.svg?httpAccept=%2A%2F%2A",
            "@multimediatype": "Scalable Vector Graphics file",
            "@type": "ALTIMG",
            "@size": "5271",
            "@ref": "si23",
            "@mimetype": "image/svg+xml"
        },
        {
            "@category": "thumbnail",
            "@_fa": "true",
            "$": "https://api.elsevier.com/content/object/eid/1-s2.0-S0306261920309399-si24.svg?httpAccept=%2A%2F%2A",
            "@multimediatype": "Scalable Vector Graphics file",
            "@type": "ALTIMG",
            "@size": "6653",
            "@ref": "si24",
            "@mimetype": "image/svg+xml"
        },
        {
            "@category": "thumbnail",
            "@_fa": "true",
            "$": "https://api.elsevier.com/content/object/eid/1-s2.0-S0306261920309399-si25.svg?httpAccept=%2A%2F%2A",
            "@multimediatype": "Scalable Vector Graphics file",
            "@type": "ALTIMG",
            "@size": "3737",
            "@ref": "si25",
            "@mimetype": "image/svg+xml"
        },
        {
            "@category": "thumbnail",
            "@_fa": "true",
            "$": "https://api.elsevier.com/content/object/eid/1-s2.0-S0306261920309399-si26.svg?httpAccept=%2A%2F%2A",
            "@multimediatype": "Scalable Vector Graphics file",
            "@type": "ALTIMG",
            "@size": "781",
            "@ref": "si26",
            "@mimetype": "image/svg+xml"
        },
        {
            "@category": "thumbnail",
            "@_fa": "true",
            "$": "https://api.elsevier.com/content/object/eid/1-s2.0-S0306261920309399-si27.svg?httpAccept=%2A%2F%2A",
            "@multimediatype": "Scalable Vector Graphics file",
            "@type": "ALTIMG",
            "@size": "7255",
            "@ref": "si27",
            "@mimetype": "image/svg+xml"
        },
        {
            "@category": "thumbnail",
            "@_fa": "true",
            "$": "https://api.elsevier.com/content/object/eid/1-s2.0-S0306261920309399-si28.svg?httpAccept=%2A%2F%2A",
            "@multimediatype": "Scalable Vector Graphics file",
            "@type": "ALTIMG",
            "@size": "4799",
            "@ref": "si28",
            "@mimetype": "image/svg+xml"
        },
        {
            "@category": "thumbnail",
            "@_fa": "true",
            "$": "https://api.elsevier.com/content/object/eid/1-s2.0-S0306261920309399-si29.svg?httpAccept=%2A%2F%2A",
            "@multimediatype": "Scalable Vector Graphics file",
            "@type": "ALTIMG",
            "@size": "3737",
            "@ref": "si29",
            "@mimetype": "image/svg+xml"
        },
        {
            "@category": "thumbnail",
            "@_fa": "true",
            "$": "https://api.elsevier.com/content/object/eid/1-s2.0-S0306261920309399-si3.svg?httpAccept=%2A%2F%2A",
            "@multimediatype": "Scalable Vector Graphics file",
            "@type": "ALTIMG",
            "@size": "1633",
            "@ref": "si3",
            "@mimetype": "image/svg+xml"
        },
        {
            "@category": "thumbnail",
            "@_fa": "true",
            "$": "https://api.elsevier.com/content/object/eid/1-s2.0-S0306261920309399-si30.svg?httpAccept=%2A%2F%2A",
            "@multimediatype": "Scalable Vector Graphics file",
            "@type": "ALTIMG",
            "@size": "32914",
            "@ref": "si30",
            "@mimetype": "image/svg+xml"
        },
        {
            "@category": "thumbnail",
            "@_fa": "true",
            "$": "https://api.elsevier.com/content/object/eid/1-s2.0-S0306261920309399-si31.svg?httpAccept=%2A%2F%2A",
            "@multimediatype": "Scalable Vector Graphics file",
            "@type": "ALTIMG",
            "@size": "13516",
            "@ref": "si31",
            "@mimetype": "image/svg+xml"
        },
        {
            "@category": "thumbnail",
            "@_fa": "true",
            "$": "https://api.elsevier.com/content/object/eid/1-s2.0-S0306261920309399-si32.svg?httpAccept=%2A%2F%2A",
            "@multimediatype": "Scalable Vector Graphics file",
            "@type": "ALTIMG",
            "@size": "12873",
            "@ref": "si32",
            "@mimetype": "image/svg+xml"
        },
        {
            "@category": "thumbnail",
            "@_fa": "true",
            "$": "https://api.elsevier.com/content/object/eid/1-s2.0-S0306261920309399-si33.svg?httpAccept=%2A%2F%2A",
            "@multimediatype": "Scalable Vector Graphics file",
            "@type": "ALTIMG",
            "@size": "5628",
            "@ref": "si33",
            "@mimetype": "image/svg+xml"
        },
        {
            "@category": "thumbnail",
            "@_fa": "true",
            "$": "https://api.elsevier.com/content/object/eid/1-s2.0-S0306261920309399-si34.svg?httpAccept=%2A%2F%2A",
            "@multimediatype": "Scalable Vector Graphics file",
            "@type": "ALTIMG",
            "@size": "16514",
            "@ref": "si34",
            "@mimetype": "image/svg+xml"
        },
        {
            "@category": "thumbnail",
            "@_fa": "true",
            "$": "https://api.elsevier.com/content/object/eid/1-s2.0-S0306261920309399-si35.svg?httpAccept=%2A%2F%2A",
            "@multimediatype": "Scalable Vector Graphics file",
            "@type": "ALTIMG",
            "@size": "3013",
            "@ref": "si35",
            "@mimetype": "image/svg+xml"
        },
        {
            "@category": "thumbnail",
            "@_fa": "true",
            "$": "https://api.elsevier.com/content/object/eid/1-s2.0-S0306261920309399-si36.svg?httpAccept=%2A%2F%2A",
            "@multimediatype": "Scalable Vector Graphics file",
            "@type": "ALTIMG",
            "@size": "1750",
            "@ref": "si36",
            "@mimetype": "image/svg+xml"
        },
        {
            "@category": "thumbnail",
            "@_fa": "true",
            "$": "https://api.elsevier.com/content/object/eid/1-s2.0-S0306261920309399-si37.svg?httpAccept=%2A%2F%2A",
            "@multimediatype": "Scalable Vector Graphics file",
            "@type": "ALTIMG",
            "@size": "6704",
            "@ref": "si37",
            "@mimetype": "image/svg+xml"
        },
        {
            "@category": "thumbnail",
            "@_fa": "true",
            "$": "https://api.elsevier.com/content/object/eid/1-s2.0-S0306261920309399-si38.svg?httpAccept=%2A%2F%2A",
            "@multimediatype": "Scalable Vector Graphics file",
            "@type": "ALTIMG",
            "@size": "1750",
            "@ref": "si38",
            "@mimetype": "image/svg+xml"
        },
        {
            "@category": "thumbnail",
            "@_fa": "true",
            "$": "https://api.elsevier.com/content/object/eid/1-s2.0-S0306261920309399-si39.svg?httpAccept=%2A%2F%2A",
            "@multimediatype": "Scalable Vector Graphics file",
            "@type": "ALTIMG",
            "@size": "3193",
            "@ref": "si39",
            "@mimetype": "image/svg+xml"
        },
        {
            "@category": "thumbnail",
            "@_fa": "true",
            "$": "https://api.elsevier.com/content/object/eid/1-s2.0-S0306261920309399-si4.svg?httpAccept=%2A%2F%2A",
            "@multimediatype": "Scalable Vector Graphics file",
            "@type": "ALTIMG",
            "@size": "5403",
            "@ref": "si4",
            "@mimetype": "image/svg+xml"
        },
        {
            "@category": "thumbnail",
            "@_fa": "true",
            "$": "https://api.elsevier.com/content/object/eid/1-s2.0-S0306261920309399-si40.svg?httpAccept=%2A%2F%2A",
            "@multimediatype": "Scalable Vector Graphics file",
            "@type": "ALTIMG",
            "@size": "4343",
            "@ref": "si40",
            "@mimetype": "image/svg+xml"
        },
        {
            "@category": "thumbnail",
            "@_fa": "true",
            "$": "https://api.elsevier.com/content/object/eid/1-s2.0-S0306261920309399-si41.svg?httpAccept=%2A%2F%2A",
            "@multimediatype": "Scalable Vector Graphics file",
            "@type": "ALTIMG",
            "@size": "1541",
            "@ref": "si41",
            "@mimetype": "image/svg+xml"
        },
        {
            "@category": "thumbnail",
            "@_fa": "true",
            "$": "https://api.elsevier.com/content/object/eid/1-s2.0-S0306261920309399-si42.svg?httpAccept=%2A%2F%2A",
            "@multimediatype": "Scalable Vector Graphics file",
            "@type": "ALTIMG",
            "@size": "1282",
            "@ref": "si42",
            "@mimetype": "image/svg+xml"
        },
        {
            "@category": "thumbnail",
            "@_fa": "true",
            "$": "https://api.elsevier.com/content/object/eid/1-s2.0-S0306261920309399-si43.svg?httpAccept=%2A%2F%2A",
            "@multimediatype": "Scalable Vector Graphics file",
            "@type": "ALTIMG",
            "@size": "1109",
            "@ref": "si43",
            "@mimetype": "image/svg+xml"
        },
        {
            "@category": "thumbnail",
            "@_fa": "true",
            "$": "https://api.elsevier.com/content/object/eid/1-s2.0-S0306261920309399-si44.svg?httpAccept=%2A%2F%2A",
            "@multimediatype": "Scalable Vector Graphics file",
            "@type": "ALTIMG",
            "@size": "8954",
            "@ref": "si44",
            "@mimetype": "image/svg+xml"
        },
        {
            "@category": "thumbnail",
            "@_fa": "true",
            "$": "https://api.elsevier.com/content/object/eid/1-s2.0-S0306261920309399-si45.svg?httpAccept=%2A%2F%2A",
            "@multimediatype": "Scalable Vector Graphics file",
            "@type": "ALTIMG",
            "@size": "1867",
            "@ref": "si45",
            "@mimetype": "image/svg+xml"
        },
        {
            "@category": "thumbnail",
            "@_fa": "true",
            "$": "https://api.elsevier.com/content/object/eid/1-s2.0-S0306261920309399-si46.svg?httpAccept=%2A%2F%2A",
            "@multimediatype": "Scalable Vector Graphics file",
            "@type": "ALTIMG",
            "@size": "1525",
            "@ref": "si46",
            "@mimetype": "image/svg+xml"
        },
        {
            "@category": "thumbnail",
            "@_fa": "true",
            "$": "https://api.elsevier.com/content/object/eid/1-s2.0-S0306261920309399-si47.svg?httpAccept=%2A%2F%2A",
            "@multimediatype": "Scalable Vector Graphics file",
            "@type": "ALTIMG",
            "@size": "14196",
            "@ref": "si47",
            "@mimetype": "image/svg+xml"
        },
        {
            "@category": "thumbnail",
            "@_fa": "true",
            "$": "https://api.elsevier.com/content/object/eid/1-s2.0-S0306261920309399-si48.svg?httpAccept=%2A%2F%2A",
            "@multimediatype": "Scalable Vector Graphics file",
            "@type": "ALTIMG",
            "@size": "2907",
            "@ref": "si48",
            "@mimetype": "image/svg+xml"
        },
        {
            "@category": "thumbnail",
            "@_fa": "true",
            "$": "https://api.elsevier.com/content/object/eid/1-s2.0-S0306261920309399-si49.svg?httpAccept=%2A%2F%2A",
            "@multimediatype": "Scalable Vector Graphics file",
            "@type": "ALTIMG",
            "@size": "2627",
            "@ref": "si49",
            "@mimetype": "image/svg+xml"
        },
        {
            "@category": "thumbnail",
            "@_fa": "true",
            "$": "https://api.elsevier.com/content/object/eid/1-s2.0-S0306261920309399-si5.svg?httpAccept=%2A%2F%2A",
            "@multimediatype": "Scalable Vector Graphics file",
            "@type": "ALTIMG",
            "@size": "7895",
            "@ref": "si5",
            "@mimetype": "image/svg+xml"
        },
        {
            "@category": "thumbnail",
            "@_fa": "true",
            "$": "https://api.elsevier.com/content/object/eid/1-s2.0-S0306261920309399-si50.svg?httpAccept=%2A%2F%2A",
            "@multimediatype": "Scalable Vector Graphics file",
            "@type": "ALTIMG",
            "@size": "5402",
            "@ref": "si50",
            "@mimetype": "image/svg+xml"
        },
        {
            "@category": "thumbnail",
            "@_fa": "true",
            "$": "https://api.elsevier.com/content/object/eid/1-s2.0-S0306261920309399-si51.svg?httpAccept=%2A%2F%2A",
            "@multimediatype": "Scalable Vector Graphics file",
            "@type": "ALTIMG",
            "@size": "5237",
            "@ref": "si51",
            "@mimetype": "image/svg+xml"
        },
        {
            "@category": "thumbnail",
            "@_fa": "true",
            "$": "https://api.elsevier.com/content/object/eid/1-s2.0-S0306261920309399-si52.svg?httpAccept=%2A%2F%2A",
            "@multimediatype": "Scalable Vector Graphics file",
            "@type": "ALTIMG",
            "@size": "18644",
            "@ref": "si52",
            "@mimetype": "image/svg+xml"
        },
        {
            "@category": "thumbnail",
            "@_fa": "true",
            "$": "https://api.elsevier.com/content/object/eid/1-s2.0-S0306261920309399-si53.svg?httpAccept=%2A%2F%2A",
            "@multimediatype": "Scalable Vector Graphics file",
            "@type": "ALTIMG",
            "@size": "4934",
            "@ref": "si53",
            "@mimetype": "image/svg+xml"
        },
        {
            "@category": "thumbnail",
            "@_fa": "true",
            "$": "https://api.elsevier.com/content/object/eid/1-s2.0-S0306261920309399-si54.svg?httpAccept=%2A%2F%2A",
            "@multimediatype": "Scalable Vector Graphics file",
            "@type": "ALTIMG",
            "@size": "10357",
            "@ref": "si54",
            "@mimetype": "image/svg+xml"
        },
        {
            "@category": "thumbnail",
            "@_fa": "true",
            "$": "https://api.elsevier.com/content/object/eid/1-s2.0-S0306261920309399-si55.svg?httpAccept=%2A%2F%2A",
            "@multimediatype": "Scalable Vector Graphics file",
            "@type": "ALTIMG",
            "@size": "3230",
            "@ref": "si55",
            "@mimetype": "image/svg+xml"
        },
        {
            "@category": "thumbnail",
            "@_fa": "true",
            "$": "https://api.elsevier.com/content/object/eid/1-s2.0-S0306261920309399-si56.svg?httpAccept=%2A%2F%2A",
            "@multimediatype": "Scalable Vector Graphics file",
            "@type": "ALTIMG",
            "@size": "4827",
            "@ref": "si56",
            "@mimetype": "image/svg+xml"
        },
        {
            "@category": "thumbnail",
            "@_fa": "true",
            "$": "https://api.elsevier.com/content/object/eid/1-s2.0-S0306261920309399-si57.svg?httpAccept=%2A%2F%2A",
            "@multimediatype": "Scalable Vector Graphics file",
            "@type": "ALTIMG",
            "@size": "4270",
            "@ref": "si57",
            "@mimetype": "image/svg+xml"
        },
        {
            "@category": "thumbnail",
            "@_fa": "true",
            "$": "https://api.elsevier.com/content/object/eid/1-s2.0-S0306261920309399-si58.svg?httpAccept=%2A%2F%2A",
            "@multimediatype": "Scalable Vector Graphics file",
            "@type": "ALTIMG",
            "@size": "12475",
            "@ref": "si58",
            "@mimetype": "image/svg+xml"
        },
        {
            "@category": "thumbnail",
            "@_fa": "true",
            "$": "https://api.elsevier.com/content/object/eid/1-s2.0-S0306261920309399-si59.svg?httpAccept=%2A%2F%2A",
            "@multimediatype": "Scalable Vector Graphics file",
            "@type": "ALTIMG",
            "@size": "4293",
            "@ref": "si59",
            "@mimetype": "image/svg+xml"
        },
        {
            "@category": "thumbnail",
            "@_fa": "true",
            "$": "https://api.elsevier.com/content/object/eid/1-s2.0-S0306261920309399-si6.svg?httpAccept=%2A%2F%2A",
            "@multimediatype": "Scalable Vector Graphics file",
            "@type": "ALTIMG",
            "@size": "8515",
            "@ref": "si6",
            "@mimetype": "image/svg+xml"
        },
        {
            "@category": "thumbnail",
            "@_fa": "true",
            "$": "https://api.elsevier.com/content/object/eid/1-s2.0-S0306261920309399-si60.svg?httpAccept=%2A%2F%2A",
            "@multimediatype": "Scalable Vector Graphics file",
            "@type": "ALTIMG",
            "@size": "5844",
            "@ref": "si60",
            "@mimetype": "image/svg+xml"
        },
        {
            "@category": "thumbnail",
            "@_fa": "true",
            "$": "https://api.elsevier.com/content/object/eid/1-s2.0-S0306261920309399-si61.svg?httpAccept=%2A%2F%2A",
            "@multimediatype": "Scalable Vector Graphics file",
            "@type": "ALTIMG",
            "@size": "5287",
            "@ref": "si61",
            "@mimetype": "image/svg+xml"
        },
        {
            "@category": "thumbnail",
            "@_fa": "true",
            "$": "https://api.elsevier.com/content/object/eid/1-s2.0-S0306261920309399-si62.svg?httpAccept=%2A%2F%2A",
            "@multimediatype": "Scalable Vector Graphics file",
            "@type": "ALTIMG",
            "@size": "7107",
            "@ref": "si62",
            "@mimetype": "image/svg+xml"
        },
        {
            "@category": "thumbnail",
            "@_fa": "true",
            "$": "https://api.elsevier.com/content/object/eid/1-s2.0-S0306261920309399-si63.svg?httpAccept=%2A%2F%2A",
            "@multimediatype": "Scalable Vector Graphics file",
            "@type": "ALTIMG",
            "@size": "22908",
            "@ref": "si63",
            "@mimetype": "image/svg+xml"
        },
        {
            "@category": "thumbnail",
            "@_fa": "true",
            "$": "https://api.elsevier.com/content/object/eid/1-s2.0-S0306261920309399-si64.svg?httpAccept=%2A%2F%2A",
            "@multimediatype": "Scalable Vector Graphics file",
            "@type": "ALTIMG",
            "@size": "12572",
            "@ref": "si64",
            "@mimetype": "image/svg+xml"
        },
        {
            "@category": "thumbnail",
            "@_fa": "true",
            "$": "https://api.elsevier.com/content/object/eid/1-s2.0-S0306261920309399-si65.svg?httpAccept=%2A%2F%2A",
            "@multimediatype": "Scalable Vector Graphics file",
            "@type": "ALTIMG",
            "@size": "18909",
            "@ref": "si65",
            "@mimetype": "image/svg+xml"
        },
        {
            "@category": "thumbnail",
            "@_fa": "true",
            "$": "https://api.elsevier.com/content/object/eid/1-s2.0-S0306261920309399-si66.svg?httpAccept=%2A%2F%2A",
            "@multimediatype": "Scalable Vector Graphics file",
            "@type": "ALTIMG",
            "@size": "11163",
            "@ref": "si66",
            "@mimetype": "image/svg+xml"
        },
        {
            "@category": "thumbnail",
            "@_fa": "true",
            "$": "https://api.elsevier.com/content/object/eid/1-s2.0-S0306261920309399-si67.svg?httpAccept=%2A%2F%2A",
            "@multimediatype": "Scalable Vector Graphics file",
            "@type": "ALTIMG",
            "@size": "7744",
            "@ref": "si67",
            "@mimetype": "image/svg+xml"
        },
        {
            "@category": "thumbnail",
            "@_fa": "true",
            "$": "https://api.elsevier.com/content/object/eid/1-s2.0-S0306261920309399-si68.svg?httpAccept=%2A%2F%2A",
            "@multimediatype": "Scalable Vector Graphics file",
            "@type": "ALTIMG",
            "@size": "18165",
            "@ref": "si68",
            "@mimetype": "image/svg+xml"
        },
        {
            "@category": "thumbnail",
            "@_fa": "true",
            "$": "https://api.elsevier.com/content/object/eid/1-s2.0-S0306261920309399-si69.svg?httpAccept=%2A%2F%2A",
            "@multimediatype": "Scalable Vector Graphics file",
            "@type": "ALTIMG",
            "@size": "19243",
            "@ref": "si69",
            "@mimetype": "image/svg+xml"
        },
        {
            "@category": "thumbnail",
            "@_fa": "true",
            "$": "https://api.elsevier.com/content/object/eid/1-s2.0-S0306261920309399-si7.svg?httpAccept=%2A%2F%2A",
            "@multimediatype": "Scalable Vector Graphics file",
            "@type": "ALTIMG",
            "@size": "7715",
            "@ref": "si7",
            "@mimetype": "image/svg+xml"
        },
        {
            "@category": "thumbnail",
            "@_fa": "true",
            "$": "https://api.elsevier.com/content/object/eid/1-s2.0-S0306261920309399-si70.svg?httpAccept=%2A%2F%2A",
            "@multimediatype": "Scalable Vector Graphics file",
            "@type": "ALTIMG",
            "@size": "11508",
            "@ref": "si70",
            "@mimetype": "image/svg+xml"
        },
        {
            "@category": "thumbnail",
            "@_fa": "true",
            "$": "https://api.elsevier.com/content/object/eid/1-s2.0-S0306261920309399-si71.svg?httpAccept=%2A%2F%2A",
            "@multimediatype": "Scalable Vector Graphics file",
            "@type": "ALTIMG",
            "@size": "7641",
            "@ref": "si71",
            "@mimetype": "image/svg+xml"
        },
        {
            "@category": "thumbnail",
            "@_fa": "true",
            "$": "https://api.elsevier.com/content/object/eid/1-s2.0-S0306261920309399-si72.svg?httpAccept=%2A%2F%2A",
            "@multimediatype": "Scalable Vector Graphics file",
            "@type": "ALTIMG",
            "@size": "6732",
            "@ref": "si72",
            "@mimetype": "image/svg+xml"
        },
        {
            "@category": "thumbnail",
            "@_fa": "true",
            "$": "https://api.elsevier.com/content/object/eid/1-s2.0-S0306261920309399-si73.svg?httpAccept=%2A%2F%2A",
            "@multimediatype": "Scalable Vector Graphics file",
            "@type": "ALTIMG",
            "@size": "11488",
            "@ref": "si73",
            "@mimetype": "image/svg+xml"
        },
        {
            "@category": "thumbnail",
            "@_fa": "true",
            "$": "https://api.elsevier.com/content/object/eid/1-s2.0-S0306261920309399-si74.svg?httpAccept=%2A%2F%2A",
            "@multimediatype": "Scalable Vector Graphics file",
            "@type": "ALTIMG",
            "@size": "28172",
            "@ref": "si74",
            "@mimetype": "image/svg+xml"
        },
        {
            "@category": "thumbnail",
            "@_fa": "true",
            "$": "https://api.elsevier.com/content/object/eid/1-s2.0-S0306261920309399-si75.svg?httpAccept=%2A%2F%2A",
            "@multimediatype": "Scalable Vector Graphics file",
            "@type": "ALTIMG",
            "@size": "4447",
            "@ref": "si75",
            "@mimetype": "image/svg+xml"
        },
        {
            "@category": "thumbnail",
            "@_fa": "true",
            "$": "https://api.elsevier.com/content/object/eid/1-s2.0-S0306261920309399-si76.svg?httpAccept=%2A%2F%2A",
            "@multimediatype": "Scalable Vector Graphics file",
            "@type": "ALTIMG",
            "@size": "12377",
            "@ref": "si76",
            "@mimetype": "image/svg+xml"
        },
        {
            "@category": "thumbnail",
            "@_fa": "true",
            "$": "https://api.elsevier.com/content/object/eid/1-s2.0-S0306261920309399-si77.svg?httpAccept=%2A%2F%2A",
            "@multimediatype": "Scalable Vector Graphics file",
            "@type": "ALTIMG",
            "@size": "19493",
            "@ref": "si77",
            "@mimetype": "image/svg+xml"
        },
        {
            "@category": "thumbnail",
            "@_fa": "true",
            "$": "https://api.elsevier.com/content/object/eid/1-s2.0-S0306261920309399-si78.svg?httpAccept=%2A%2F%2A",
            "@multimediatype": "Scalable Vector Graphics file",
            "@type": "ALTIMG",
            "@size": "4544",
            "@ref": "si78",
            "@mimetype": "image/svg+xml"
        },
        {
            "@category": "thumbnail",
            "@_fa": "true",
            "$": "https://api.elsevier.com/content/object/eid/1-s2.0-S0306261920309399-si79.svg?httpAccept=%2A%2F%2A",
            "@multimediatype": "Scalable Vector Graphics file",
            "@type": "ALTIMG",
            "@size": "32971",
            "@ref": "si79",
            "@mimetype": "image/svg+xml"
        },
        {
            "@category": "thumbnail",
            "@_fa": "true",
            "$": "https://api.elsevier.com/content/object/eid/1-s2.0-S0306261920309399-si8.svg?httpAccept=%2A%2F%2A",
            "@multimediatype": "Scalable Vector Graphics file",
            "@type": "ALTIMG",
            "@size": "7759",
            "@ref": "si8",
            "@mimetype": "image/svg+xml"
        },
        {
            "@category": "thumbnail",
            "@_fa": "true",
            "$": "https://api.elsevier.com/content/object/eid/1-s2.0-S0306261920309399-si80.svg?httpAccept=%2A%2F%2A",
            "@multimediatype": "Scalable Vector Graphics file",
            "@type": "ALTIMG",
            "@size": "6054",
            "@ref": "si80",
            "@mimetype": "image/svg+xml"
        },
        {
            "@category": "thumbnail",
            "@_fa": "true",
            "$": "https://api.elsevier.com/content/object/eid/1-s2.0-S0306261920309399-si81.svg?httpAccept=%2A%2F%2A",
            "@multimediatype": "Scalable Vector Graphics file",
            "@type": "ALTIMG",
            "@size": "17202",
            "@ref": "si81",
            "@mimetype": "image/svg+xml"
        },
        {
            "@category": "thumbnail",
            "@_fa": "true",
            "$": "https://api.elsevier.com/content/object/eid/1-s2.0-S0306261920309399-si82.svg?httpAccept=%2A%2F%2A",
            "@multimediatype": "Scalable Vector Graphics file",
            "@type": "ALTIMG",
            "@size": "5537",
            "@ref": "si82",
            "@mimetype": "image/svg+xml"
        },
        {
            "@category": "thumbnail",
            "@_fa": "true",
            "$": "https://api.elsevier.com/content/object/eid/1-s2.0-S0306261920309399-si83.svg?httpAccept=%2A%2F%2A",
            "@multimediatype": "Scalable Vector Graphics file",
            "@type": "ALTIMG",
            "@size": "17445",
            "@ref": "si83",
            "@mimetype": "image/svg+xml"
        },
        {
            "@category": "thumbnail",
            "@_fa": "true",
            "$": "https://api.elsevier.com/content/object/eid/1-s2.0-S0306261920309399-si84.svg?httpAccept=%2A%2F%2A",
            "@multimediatype": "Scalable Vector Graphics file",
            "@type": "ALTIMG",
            "@size": "11084",
            "@ref": "si84",
            "@mimetype": "image/svg+xml"
        },
        {
            "@category": "thumbnail",
            "@_fa": "true",
            "$": "https://api.elsevier.com/content/object/eid/1-s2.0-S0306261920309399-si85.svg?httpAccept=%2A%2F%2A",
            "@multimediatype": "Scalable Vector Graphics file",
            "@type": "ALTIMG",
            "@size": "5526",
            "@ref": "si85",
            "@mimetype": "image/svg+xml"
        },
        {
            "@category": "thumbnail",
            "@_fa": "true",
            "$": "https://api.elsevier.com/content/object/eid/1-s2.0-S0306261920309399-si86.svg?httpAccept=%2A%2F%2A",
            "@multimediatype": "Scalable Vector Graphics file",
            "@type": "ALTIMG",
            "@size": "17802",
            "@ref": "si86",
            "@mimetype": "image/svg+xml"
        },
        {
            "@category": "thumbnail",
            "@_fa": "true",
            "$": "https://api.elsevier.com/content/object/eid/1-s2.0-S0306261920309399-si87.svg?httpAccept=%2A%2F%2A",
            "@multimediatype": "Scalable Vector Graphics file",
            "@type": "ALTIMG",
            "@size": "10734",
            "@ref": "si87",
            "@mimetype": "image/svg+xml"
        },
        {
            "@category": "thumbnail",
            "@_fa": "true",
            "$": "https://api.elsevier.com/content/object/eid/1-s2.0-S0306261920309399-si88.svg?httpAccept=%2A%2F%2A",
            "@multimediatype": "Scalable Vector Graphics file",
            "@type": "ALTIMG",
            "@size": "6525",
            "@ref": "si88",
            "@mimetype": "image/svg+xml"
        },
        {
            "@category": "thumbnail",
            "@_fa": "true",
            "$": "https://api.elsevier.com/content/object/eid/1-s2.0-S0306261920309399-si89.svg?httpAccept=%2A%2F%2A",
            "@multimediatype": "Scalable Vector Graphics file",
            "@type": "ALTIMG",
            "@size": "26045",
            "@ref": "si89",
            "@mimetype": "image/svg+xml"
        },
        {
            "@category": "thumbnail",
            "@_fa": "true",
            "$": "https://api.elsevier.com/content/object/eid/1-s2.0-S0306261920309399-si9.svg?httpAccept=%2A%2F%2A",
            "@multimediatype": "Scalable Vector Graphics file",
            "@type": "ALTIMG",
            "@size": "7313",
            "@ref": "si9",
            "@mimetype": "image/svg+xml"
        },
        {
            "@category": "thumbnail",
            "@_fa": "true",
            "$": "https://api.elsevier.com/content/object/eid/1-s2.0-S0306261920309399-si90.svg?httpAccept=%2A%2F%2A",
            "@multimediatype": "Scalable Vector Graphics file",
            "@type": "ALTIMG",
            "@size": "11716",
            "@ref": "si90",
            "@mimetype": "image/svg+xml"
        },
        {
            "@category": "thumbnail",
            "@_fa": "true",
            "$": "https://api.elsevier.com/content/object/eid/1-s2.0-S0306261920309399-si91.svg?httpAccept=%2A%2F%2A",
            "@multimediatype": "Scalable Vector Graphics file",
            "@type": "ALTIMG",
            "@size": "5088",
            "@ref": "si91",
            "@mimetype": "image/svg+xml"
        },
        {
            "@category": "thumbnail",
            "@_fa": "true",
            "$": "https://api.elsevier.com/content/object/eid/1-s2.0-S0306261920309399-si92.svg?httpAccept=%2A%2F%2A",
            "@multimediatype": "Scalable Vector Graphics file",
            "@type": "ALTIMG",
            "@size": "3849",
            "@ref": "si92",
            "@mimetype": "image/svg+xml"
        },
        {
            "@category": "thumbnail",
            "@_fa": "true",
            "$": "https://api.elsevier.com/content/object/eid/1-s2.0-S0306261920309399-si93.svg?httpAccept=%2A%2F%2A",
            "@multimediatype": "Scalable Vector Graphics file",
            "@type": "ALTIMG",
            "@size": "5952",
            "@ref": "si93",
            "@mimetype": "image/svg+xml"
        },
        {
            "@category": "thumbnail",
            "@_fa": "true",
            "$": "https://api.elsevier.com/content/object/eid/1-s2.0-S0306261920309399-si94.svg?httpAccept=%2A%2F%2A",
            "@multimediatype": "Scalable Vector Graphics file",
            "@type": "ALTIMG",
            "@size": "6836",
            "@ref": "si94",
            "@mimetype": "image/svg+xml"
        },
        {
            "@category": "thumbnail",
            "@_fa": "true",
            "$": "https://api.elsevier.com/content/object/eid/1-s2.0-S0306261920309399-si95.svg?httpAccept=%2A%2F%2A",
            "@multimediatype": "Scalable Vector Graphics file",
            "@type": "ALTIMG",
            "@size": "4092",
            "@ref": "si95",
            "@mimetype": "image/svg+xml"
        },
        {
            "@category": "thumbnail",
            "@_fa": "true",
            "$": "https://api.elsevier.com/content/object/eid/1-s2.0-S0306261920309399-si96.svg?httpAccept=%2A%2F%2A",
            "@multimediatype": "Scalable Vector Graphics file",
            "@type": "ALTIMG",
            "@size": "5396",
            "@ref": "si96",
            "@mimetype": "image/svg+xml"
        },
        {
            "@category": "thumbnail",
            "@_fa": "true",
            "$": "https://api.elsevier.com/content/object/eid/1-s2.0-S0306261920309399-si97.svg?httpAccept=%2A%2F%2A",
            "@multimediatype": "Scalable Vector Graphics file",
            "@type": "ALTIMG",
            "@size": "16490",
            "@ref": "si97",
            "@mimetype": "image/svg+xml"
        },
        {
            "@category": "thumbnail",
            "@_fa": "true",
            "$": "https://api.elsevier.com/content/object/eid/1-s2.0-S0306261920309399-si98.svg?httpAccept=%2A%2F%2A",
            "@multimediatype": "Scalable Vector Graphics file",
            "@type": "ALTIMG",
            "@size": "3497",
            "@ref": "si98",
            "@mimetype": "image/svg+xml"
        },
        {
            "@category": "thumbnail",
            "@_fa": "true",
            "$": "https://api.elsevier.com/content/object/eid/1-s2.0-S0306261920309399-si99.svg?httpAccept=%2A%2F%2A",
            "@multimediatype": "Scalable Vector Graphics file",
            "@type": "ALTIMG",
            "@size": "4672",
            "@ref": "si99",
            "@mimetype": "image/svg+xml"
        },
        {
            "@category": "standard",
            "@_fa": "true",
            "$": "https://api.elsevier.com/content/object/eid/1-s2.0-S0306261920309399-am.pdf?httpAccept=%2A%2F%2A",
            "@multimediatype": "Acrobat PDF file",
            "@type": "AAM-PDF",
            "@size": "1690992",
            "@ref": "am",
            "@mimetype": "application/pdf"
        }
    ]},
    "link": {
        "@rel": "abstract",
        "@href": "https://api.elsevier.com/content/abstract/scopus_id/85087732872"
    }
}}