{"full-text-retrieval-response": {
    "scopus-eid": "2-s2.0-85208202177",
    "originalText": "serial JL 271089 291210 291731 291800 291881 31 Energy and Buildings ENERGYBUILDINGS 2024-10-26 2024-10-26 2024-11-06 2024-11-06 2024-11-22T10:59:26 1-s2.0-S0378778824010843 S0378-7788(24)01084-3 S0378778824010843 10.1016/j.enbuild.2024.114968 S300 S300.1 FULL-TEXT 1-s2.0-S0378778824X00201 2024-11-22T11:18:52.168839Z 0 0 20241215 2024 2024-10-26T01:31:31.028376Z articleinfo articlenumber articletitlenorm authfirstinitialnorm authfirstsurnamenorm cid cids contenttype copyright crossmark dateloaded dateloadedtxt datesearch datesort dateupdated dco docsubtype doctype doi eid ewtransactionid hubeid indexeddate issn issnnorm itemstage itemtransactionid itemweight openaccess openarchive pg pgfirst pii piinorm pubdatestart pubdatetxt pubyr sectiontitle sortorder srctitle srctitlenorm srctype ssids alllist content subj subheadings suppl tomb volfirst volissue volumelist webpdf webpdfpagecount yearnav figure table body mmlmath acknowledge affil articletitle auth authfirstini authfull authkeywords authlast nomenclature primabst ref 0378-7788 03787788 true 325 325 C Volume 325 23 114968 114968 114968 20241215 15 December 2024 2024-12-15 2024 Research Articles article fla © 2024 Elsevier B.V. All rights are reserved, including those for text and data mining, AI training, and similar technologies. RADIANTHEATINGSYSTEMSCONTROLINBUILDINGSVIAINVERSECONFORMABLEARTIFICIALNEURALNETWORKSOPTIMIZATIONTECHNIQUES MATA A Nomenclature 1 Introduction 2 Experimental Setup 3 Methodology 3.1 Preprocessing 3.2 ANN architecture 3.3 Conformable transfer functions 3.4 Statistical validation 3.5 Control strategy with ANNi 3.5.1 Test scenario considerations 4 Results and discussion 5 Conclusion CRediT authorship contribution statement Acknowledgments References CHEN 2023 128375 W ZHENG 2023 J BABAHARRA 2022 127293 O XU 2021 102635 Y WANG 2022 108701 M ACIKGOZ 2022 107624 O VERMA 2023 3135 3152 V SAOUD 2022 L ZHANG 2022 Z DEVARAM 2022 3366 R LOCKNER 2022 395 408 Y SOLISPEREZ 2022 44 56 J KHALIL 2014 65 70 R GARCIAMORALES 2022 102075 J AJBAR 2021 116651 W KARAKOYUN 2021 116517 Y WU 2015 285 293 X JIN 2010 2545 2552 X LI 2014 182 190 Q CHOLEWA 2013 599 606 T REYESTELLEZ 2020 23 41 E STAWICKI 2022 234 P BOUSMAHA 2022 1695 1714 R SAGHEB 2019 751 761 S INPROCEEDINGS32NDANNUALACMSYMPOSIUMUSERINTERFACESOFTWARETECHNOLOGY SWISHASHIFTINGWEIGHTINTERFACESIMULATEDHYDRODYNAMICSFORHAPTICPERCEPTIONVIRTUALFLUIDVESSELS SAGHEB 2019 213 221 S INPROCEEDINGSTHIRTEENTHINTERNATIONALCONFERENCETANGIBLEEMBEDDEDEMBODIEDINTERACTION SWISHSHIFTINGWEIGHTBASEDINTERFACESFORSIMULATEDHYDRODYNAMICSINMIXEDREALITYFLUIDVESSELS OLIMOV 2021 e6143 B ZHANG 2021 1295 1310 Y ZHAO 2017 903 917 D VERMA 2005 S ESTADISTICABASICAPARAELMANEJODEDATOSEXPERIMENTALESAPLICACIONENLAGEOQUIMICAGEOQUIMIOMETRIA FITRIANTO 2022 19 27 D CERVANTESBOBADILLA 2020 104631 M CERVANTESBOBADILLA 2021 1 14 M CONDEGUTIERREZ 2018 218 234 R NOVOADELTORO 2021 e1009263 E CARMONAARROYO 2022 23 G ZHAO 2023 M SCRUCCA 2013 1 37 L MATAX2024X114968 MATAX2024X114968XA 2026-11-06T00:00:00.000Z 2026-11-06T00:00:00.000Z http://creativecommons.org/licenses/by-nc-nd/4.0/ © 2024 Elsevier B.V. All rights are reserved, including those for text and data mining, AI training, and similar technologies. 2024-11-09T04:56:03.535Z http://vtw.elsevier.com/data/voc/AddOnTypes/50.7/aggregated-refined CONAHCYT Conahcyt Consejo Nacional de Humanidades, Ciencias y Tecnologías http://data.elsevier.com/vocabulary/SciValFunders/501100003141 http://sws.geonames.org/3996063/ The first and second authors are grateful for CONAHCYT's financial support through student scholarships. Additionally, Arianna Parrales Bahena acknowledges CONAHCYT's support through the Investigadores por M\\u00E9xico 2017 program. https://doi.org/10.15223/policy-017 https://doi.org/10.15223/policy-037 https://doi.org/10.15223/policy-012 https://doi.org/10.15223/policy-029 https://doi.org/10.15223/policy-004 item S0378-7788(24)01084-3 S0378778824010843 1-s2.0-S0378778824010843 10.1016/j.enbuild.2024.114968 271089 2024-11-22T11:18:52.168839Z 2024-12-15 1-s2.0-S0378778824010843-main.pdf https://s3-eu-west-1.amazonaws.com/prod-ucs-content-store-eu-west/content/pii:S0378778824010843/MAIN/application/pdf/1acc6a9f0015714b0e87e93f33690544/main.pdf main.pdf pdf true 8012968 MAIN 18 1-s2.0-S0378778824010843-main_1.png https://s3-eu-west-1.amazonaws.com/prod-ucs-content-store-eu-west/content/pii:S0378778824010843/PREVIEW/image/png/73e37423913259fb4772073a5701d75d/main_1.png main_1.png png 58505 849 656 IMAGE-WEB-PDF 1 1-s2.0-S0378778824010843-gr3.jpg https://s3-eu-west-1.amazonaws.com/prod-ucs-content-store-eu-west/content/pii:S0378778824010843/gr3/DOWNSAMPLED/image/jpeg/cc618c6688faea69cceb5340f68d8a4f/gr3.jpg gr3 gr3.jpg jpg 67833 506 791 IMAGE-DOWNSAMPLED 1-s2.0-S0378778824010843-gr2.jpg https://s3-eu-west-1.amazonaws.com/prod-ucs-content-store-eu-west/content/pii:S0378778824010843/gr2/DOWNSAMPLED/image/jpeg/07bc3ced918bc2b1c199c54db619f01d/gr2.jpg gr2 gr2.jpg jpg 39828 288 758 IMAGE-DOWNSAMPLED 1-s2.0-S0378778824010843-gr1.jpg https://s3-eu-west-1.amazonaws.com/prod-ucs-content-store-eu-west/content/pii:S0378778824010843/gr1/DOWNSAMPLED/image/jpeg/4e45416d998a930a33dbb3a9facea5e3/gr1.jpg gr1 gr1.jpg jpg 59217 475 533 IMAGE-DOWNSAMPLED 1-s2.0-S0378778824010843-gr10.jpg https://s3-eu-west-1.amazonaws.com/prod-ucs-content-store-eu-west/content/pii:S0378778824010843/gr10/DOWNSAMPLED/image/jpeg/d2916bd514c1bbe601a91c40ba1c3c39/gr10.jpg gr10 gr10.jpg jpg 24837 315 628 IMAGE-DOWNSAMPLED 1-s2.0-S0378778824010843-gr20.jpg https://s3-eu-west-1.amazonaws.com/prod-ucs-content-store-eu-west/content/pii:S0378778824010843/gr20/DOWNSAMPLED/image/jpeg/3ecbf9f752a1098e773593e499c10dd2/gr20.jpg gr20 gr20.jpg jpg 36577 387 628 IMAGE-DOWNSAMPLED 1-s2.0-S0378778824010843-gr9.jpg https://s3-eu-west-1.amazonaws.com/prod-ucs-content-store-eu-west/content/pii:S0378778824010843/gr9/DOWNSAMPLED/image/jpeg/920d8cfe850e2ca7a034b2144cd19ae2/gr9.jpg gr9 gr9.jpg jpg 25756 315 628 IMAGE-DOWNSAMPLED 1-s2.0-S0378778824010843-gr8.jpg https://s3-eu-west-1.amazonaws.com/prod-ucs-content-store-eu-west/content/pii:S0378778824010843/gr8/DOWNSAMPLED/image/jpeg/1606d9ea25949bc07ecafb1fd5eef80a/gr8.jpg gr8 gr8.jpg jpg 37293 253 628 IMAGE-DOWNSAMPLED 1-s2.0-S0378778824010843-gr7.jpg https://s3-eu-west-1.amazonaws.com/prod-ucs-content-store-eu-west/content/pii:S0378778824010843/gr7/DOWNSAMPLED/image/jpeg/48302da2c194d02fa2f6c66092a218f1/gr7.jpg gr7 gr7.jpg jpg 49495 435 538 IMAGE-DOWNSAMPLED 1-s2.0-S0378778824010843-gr14.jpg https://s3-eu-west-1.amazonaws.com/prod-ucs-content-store-eu-west/content/pii:S0378778824010843/gr14/DOWNSAMPLED/image/jpeg/062c50577284a4dd7f7228babca30ccf/gr14.jpg gr14 gr14.jpg jpg 36851 441 716 IMAGE-DOWNSAMPLED 1-s2.0-S0378778824010843-gr6.jpg https://s3-eu-west-1.amazonaws.com/prod-ucs-content-store-eu-west/content/pii:S0378778824010843/gr6/DOWNSAMPLED/image/jpeg/9928a57688962c0cba42d534519355c7/gr6.jpg gr6 gr6.jpg jpg 51273 517 535 IMAGE-DOWNSAMPLED 1-s2.0-S0378778824010843-gr13.jpg https://s3-eu-west-1.amazonaws.com/prod-ucs-content-store-eu-west/content/pii:S0378778824010843/gr13/DOWNSAMPLED/image/jpeg/0c69f8dc787f3750ba7e222faa6e6bf7/gr13.jpg gr13 gr13.jpg jpg 36598 447 725 IMAGE-DOWNSAMPLED 1-s2.0-S0378778824010843-gr5.jpg https://s3-eu-west-1.amazonaws.com/prod-ucs-content-store-eu-west/content/pii:S0378778824010843/gr5/DOWNSAMPLED/image/jpeg/af8aad9fa89fe8eefce049257d559d17/gr5.jpg gr5 gr5.jpg jpg 51417 530 535 IMAGE-DOWNSAMPLED 1-s2.0-S0378778824010843-gr12.jpg https://s3-eu-west-1.amazonaws.com/prod-ucs-content-store-eu-west/content/pii:S0378778824010843/gr12/DOWNSAMPLED/image/jpeg/6b28fcb8e8677b9393c3e0115776dd8d/gr12.jpg gr12 gr12.jpg jpg 38569 442 718 IMAGE-DOWNSAMPLED 1-s2.0-S0378778824010843-gr4.jpg https://s3-eu-west-1.amazonaws.com/prod-ucs-content-store-eu-west/content/pii:S0378778824010843/gr4/DOWNSAMPLED/image/jpeg/c7d8e405a3f74475ed42b42c6de9949e/gr4.jpg gr4 gr4.jpg jpg 48473 514 535 IMAGE-DOWNSAMPLED 1-s2.0-S0378778824010843-gr11.jpg https://s3-eu-west-1.amazonaws.com/prod-ucs-content-store-eu-west/content/pii:S0378778824010843/gr11/DOWNSAMPLED/image/jpeg/7e6c93d7c48bdd09e1cdaf99b7164d9b/gr11.jpg gr11 gr11.jpg jpg 26293 315 628 IMAGE-DOWNSAMPLED 1-s2.0-S0378778824010843-gr18.jpg https://s3-eu-west-1.amazonaws.com/prod-ucs-content-store-eu-west/content/pii:S0378778824010843/gr18/DOWNSAMPLED/image/jpeg/631523de1ba59685c653c00a8904bec4/gr18.jpg gr18 gr18.jpg jpg 36193 387 628 IMAGE-DOWNSAMPLED 1-s2.0-S0378778824010843-gr17.jpg https://s3-eu-west-1.amazonaws.com/prod-ucs-content-store-eu-west/content/pii:S0378778824010843/gr17/DOWNSAMPLED/image/jpeg/c2b7396db4866dfa600b3d02142f6589/gr17.jpg gr17 gr17.jpg jpg 69843 384 711 IMAGE-DOWNSAMPLED 1-s2.0-S0378778824010843-gr16.jpg https://s3-eu-west-1.amazonaws.com/prod-ucs-content-store-eu-west/content/pii:S0378778824010843/gr16/DOWNSAMPLED/image/jpeg/854c697f882f7a551a33a6162af87a76/gr16.jpg gr16 gr16.jpg jpg 70815 406 711 IMAGE-DOWNSAMPLED 1-s2.0-S0378778824010843-gr15.jpg https://s3-eu-west-1.amazonaws.com/prod-ucs-content-store-eu-west/content/pii:S0378778824010843/gr15/DOWNSAMPLED/image/jpeg/007470162d54bc61499ff2b751f0e9d6/gr15.jpg gr15 gr15.jpg jpg 74826 406 711 IMAGE-DOWNSAMPLED 1-s2.0-S0378778824010843-gr19.jpg https://s3-eu-west-1.amazonaws.com/prod-ucs-content-store-eu-west/content/pii:S0378778824010843/gr19/DOWNSAMPLED/image/jpeg/c9f9f53a70c6ba58422f9734c5e8890a/gr19.jpg gr19 gr19.jpg jpg 37275 387 628 IMAGE-DOWNSAMPLED 1-s2.0-S0378778824010843-gr3.sml https://s3-eu-west-1.amazonaws.com/prod-ucs-content-store-eu-west/content/pii:S0378778824010843/gr3/THUMBNAIL/image/gif/8b9214ab31282902f1344f3c57962bcc/gr3.sml gr3 gr3.sml sml 7694 140 219 IMAGE-THUMBNAIL 1-s2.0-S0378778824010843-gr2.sml https://s3-eu-west-1.amazonaws.com/prod-ucs-content-store-eu-west/content/pii:S0378778824010843/gr2/THUMBNAIL/image/gif/8513cdd7a9eca81ee4ab7451c2237d01/gr2.sml gr2 gr2.sml sml 5161 83 219 IMAGE-THUMBNAIL 1-s2.0-S0378778824010843-gr1.sml https://s3-eu-west-1.amazonaws.com/prod-ucs-content-store-eu-west/content/pii:S0378778824010843/gr1/THUMBNAIL/image/gif/37e5b792e852925ea4e02f7de78640f0/gr1.sml gr1 gr1.sml sml 16815 164 184 IMAGE-THUMBNAIL 1-s2.0-S0378778824010843-gr10.sml https://s3-eu-west-1.amazonaws.com/prod-ucs-content-store-eu-west/content/pii:S0378778824010843/gr10/THUMBNAIL/image/gif/f091fbb3f9834494d981f7ff6f581930/gr10.sml gr10 gr10.sml sml 3558 110 219 IMAGE-THUMBNAIL 1-s2.0-S0378778824010843-gr20.sml https://s3-eu-west-1.amazonaws.com/prod-ucs-content-store-eu-west/content/pii:S0378778824010843/gr20/THUMBNAIL/image/gif/2642255303f8f92bc0abc41015e6a86d/gr20.sml gr20 gr20.sml sml 6157 135 219 IMAGE-THUMBNAIL 1-s2.0-S0378778824010843-gr9.sml https://s3-eu-west-1.amazonaws.com/prod-ucs-content-store-eu-west/content/pii:S0378778824010843/gr9/THUMBNAIL/image/gif/feb6508fade0be8e5c28d86e4707dd7e/gr9.sml gr9 gr9.sml sml 3714 110 219 IMAGE-THUMBNAIL 1-s2.0-S0378778824010843-gr8.sml https://s3-eu-west-1.amazonaws.com/prod-ucs-content-store-eu-west/content/pii:S0378778824010843/gr8/THUMBNAIL/image/gif/383fc2f74d60a373ce139223ac45a9bb/gr8.sml gr8 gr8.sml sml 5732 88 219 IMAGE-THUMBNAIL 1-s2.0-S0378778824010843-gr7.sml https://s3-eu-west-1.amazonaws.com/prod-ucs-content-store-eu-west/content/pii:S0378778824010843/gr7/THUMBNAIL/image/gif/187911c1d33fa855879dcc252d955845/gr7.sml gr7 gr7.sml sml 6630 164 203 IMAGE-THUMBNAIL 1-s2.0-S0378778824010843-gr14.sml https://s3-eu-west-1.amazonaws.com/prod-ucs-content-store-eu-west/content/pii:S0378778824010843/gr14/THUMBNAIL/image/gif/5b4092191fb21850e8aa9949d80b68e8/gr14.sml gr14 gr14.sml sml 5682 135 219 IMAGE-THUMBNAIL 1-s2.0-S0378778824010843-gr6.sml https://s3-eu-west-1.amazonaws.com/prod-ucs-content-store-eu-west/content/pii:S0378778824010843/gr6/THUMBNAIL/image/gif/e2494f3250ee3984f17840a52182a612/gr6.sml gr6 gr6.sml sml 7459 163 169 IMAGE-THUMBNAIL 1-s2.0-S0378778824010843-gr13.sml https://s3-eu-west-1.amazonaws.com/prod-ucs-content-store-eu-west/content/pii:S0378778824010843/gr13/THUMBNAIL/image/gif/41ab1282aa81834cb57269945f104524/gr13.sml gr13 gr13.sml sml 5432 135 219 IMAGE-THUMBNAIL 1-s2.0-S0378778824010843-gr5.sml https://s3-eu-west-1.amazonaws.com/prod-ucs-content-store-eu-west/content/pii:S0378778824010843/gr5/THUMBNAIL/image/gif/f8e599f769e4d3bb0ff2df63360dfcb5/gr5.sml gr5 gr5.sml sml 7296 163 165 IMAGE-THUMBNAIL 1-s2.0-S0378778824010843-gr12.sml https://s3-eu-west-1.amazonaws.com/prod-ucs-content-store-eu-west/content/pii:S0378778824010843/gr12/THUMBNAIL/image/gif/3a0d2e675b67b3117ddeaaa41c5b1c5c/gr12.sml gr12 gr12.sml sml 5769 135 219 IMAGE-THUMBNAIL 1-s2.0-S0378778824010843-gr4.sml https://s3-eu-west-1.amazonaws.com/prod-ucs-content-store-eu-west/content/pii:S0378778824010843/gr4/THUMBNAIL/image/gif/c5ec8c7aaf0823b88a50004f41c4a79d/gr4.sml gr4 gr4.sml sml 7200 163 170 IMAGE-THUMBNAIL 1-s2.0-S0378778824010843-gr11.sml https://s3-eu-west-1.amazonaws.com/prod-ucs-content-store-eu-west/content/pii:S0378778824010843/gr11/THUMBNAIL/image/gif/07e883d199c781c69e6d4b07ae6eee5d/gr11.sml gr11 gr11.sml sml 3673 110 219 IMAGE-THUMBNAIL 1-s2.0-S0378778824010843-gr18.sml https://s3-eu-west-1.amazonaws.com/prod-ucs-content-store-eu-west/content/pii:S0378778824010843/gr18/THUMBNAIL/image/gif/3fe264c0e6f130bbc803a1080ee9768f/gr18.sml gr18 gr18.sml sml 6159 135 219 IMAGE-THUMBNAIL 1-s2.0-S0378778824010843-gr17.sml https://s3-eu-west-1.amazonaws.com/prod-ucs-content-store-eu-west/content/pii:S0378778824010843/gr17/THUMBNAIL/image/gif/2cef96a6999a8ee41c63b157dc374c3a/gr17.sml gr17 gr17.sml sml 7059 118 219 IMAGE-THUMBNAIL 1-s2.0-S0378778824010843-gr16.sml https://s3-eu-west-1.amazonaws.com/prod-ucs-content-store-eu-west/content/pii:S0378778824010843/gr16/THUMBNAIL/image/gif/bb65011d116a454799c7c65b41047233/gr16.sml gr16 gr16.sml sml 7664 125 219 IMAGE-THUMBNAIL 1-s2.0-S0378778824010843-gr15.sml https://s3-eu-west-1.amazonaws.com/prod-ucs-content-store-eu-west/content/pii:S0378778824010843/gr15/THUMBNAIL/image/gif/253ce83c7c174c938b49c66e6726a749/gr15.sml gr15 gr15.sml sml 7742 125 219 IMAGE-THUMBNAIL 1-s2.0-S0378778824010843-gr19.sml https://s3-eu-west-1.amazonaws.com/prod-ucs-content-store-eu-west/content/pii:S0378778824010843/gr19/THUMBNAIL/image/gif/bd6ead005ace100d665b80b060b22a70/gr19.sml gr19 gr19.sml sml 6484 135 219 IMAGE-THUMBNAIL 1-s2.0-S0378778824010843-gr3_lrg.jpg https://s3-eu-west-1.amazonaws.com/prod-ucs-content-store-eu-west/content/pii:S0378778824010843/HIGHRES/image/jpeg/e043cb73d9c8bbcbe72ea65917c59856/gr3_lrg.jpg gr3 gr3_lrg.jpg jpg 483020 2243 3504 IMAGE-HIGH-RES 1-s2.0-S0378778824010843-gr2_lrg.jpg https://s3-eu-west-1.amazonaws.com/prod-ucs-content-store-eu-west/content/pii:S0378778824010843/HIGHRES/image/jpeg/bac063bae3c6512f9028d6f491713487/gr2_lrg.jpg gr2 gr2_lrg.jpg jpg 208700 1278 3358 IMAGE-HIGH-RES 1-s2.0-S0378778824010843-gr1_lrg.jpg https://s3-eu-west-1.amazonaws.com/prod-ucs-content-store-eu-west/content/pii:S0378778824010843/HIGHRES/image/jpeg/12459b2a6136b22f1ab6aaa4b5753de7/gr1_lrg.jpg gr1 gr1_lrg.jpg jpg 188242 1317 1479 IMAGE-HIGH-RES 1-s2.0-S0378778824010843-gr10_lrg.jpg https://s3-eu-west-1.amazonaws.com/prod-ucs-content-store-eu-west/content/pii:S0378778824010843/HIGHRES/image/jpeg/933e494bb3129c6f14681e98e308b5ac/gr10_lrg.jpg gr10 gr10_lrg.jpg jpg 128188 1396 2781 IMAGE-HIGH-RES 1-s2.0-S0378778824010843-gr20_lrg.jpg https://s3-eu-west-1.amazonaws.com/prod-ucs-content-store-eu-west/content/pii:S0378778824010843/HIGHRES/image/jpeg/f4c6f1b9650f723df5434e577d84bc8f/gr20_lrg.jpg gr20 gr20_lrg.jpg jpg 261644 1714 2782 IMAGE-HIGH-RES 1-s2.0-S0378778824010843-gr9_lrg.jpg https://s3-eu-west-1.amazonaws.com/prod-ucs-content-store-eu-west/content/pii:S0378778824010843/HIGHRES/image/jpeg/b1a2dd94134f73e8fbd4382436e41ea5/gr9_lrg.jpg gr9 gr9_lrg.jpg jpg 134731 1396 2781 IMAGE-HIGH-RES 1-s2.0-S0378778824010843-gr8_lrg.jpg https://s3-eu-west-1.amazonaws.com/prod-ucs-content-store-eu-west/content/pii:S0378778824010843/HIGHRES/image/jpeg/e2e2f4b759a2f65659bbbe5649db20f6/gr8_lrg.jpg gr8 gr8_lrg.jpg jpg 205125 1122 2780 IMAGE-HIGH-RES 1-s2.0-S0378778824010843-gr7_lrg.jpg https://s3-eu-west-1.amazonaws.com/prod-ucs-content-store-eu-west/content/pii:S0378778824010843/HIGHRES/image/jpeg/7266a0a6fc44da60ed14d629851fb05e/gr7_lrg.jpg gr7 gr7_lrg.jpg jpg 315804 1926 2382 IMAGE-HIGH-RES 1-s2.0-S0378778824010843-gr14_lrg.jpg https://s3-eu-west-1.amazonaws.com/prod-ucs-content-store-eu-west/content/pii:S0378778824010843/HIGHRES/image/jpeg/f2143ba224576261e99eb6c9249cda2a/gr14_lrg.jpg gr14 gr14_lrg.jpg jpg 189505 1954 3171 IMAGE-HIGH-RES 1-s2.0-S0378778824010843-gr6_lrg.jpg https://s3-eu-west-1.amazonaws.com/prod-ucs-content-store-eu-west/content/pii:S0378778824010843/HIGHRES/image/jpeg/525270934bf681c5a9800394f14646b8/gr6_lrg.jpg gr6 gr6_lrg.jpg jpg 245260 2288 2368 IMAGE-HIGH-RES 1-s2.0-S0378778824010843-gr13_lrg.jpg https://s3-eu-west-1.amazonaws.com/prod-ucs-content-store-eu-west/content/pii:S0378778824010843/HIGHRES/image/jpeg/57159772f2f452df1f2926aa407da623/gr13_lrg.jpg gr13 gr13_lrg.jpg jpg 189622 1979 3212 IMAGE-HIGH-RES 1-s2.0-S0378778824010843-gr5_lrg.jpg https://s3-eu-west-1.amazonaws.com/prod-ucs-content-store-eu-west/content/pii:S0378778824010843/HIGHRES/image/jpeg/07b6b61f2053dc59908f92957709d962/gr5_lrg.jpg gr5 gr5_lrg.jpg jpg 247687 2344 2368 IMAGE-HIGH-RES 1-s2.0-S0378778824010843-gr12_lrg.jpg https://s3-eu-west-1.amazonaws.com/prod-ucs-content-store-eu-west/content/pii:S0378778824010843/HIGHRES/image/jpeg/3eff96a904f78ddcd3eb9939b47805cf/gr12_lrg.jpg gr12 gr12_lrg.jpg jpg 201993 1960 3181 IMAGE-HIGH-RES 1-s2.0-S0378778824010843-gr4_lrg.jpg https://s3-eu-west-1.amazonaws.com/prod-ucs-content-store-eu-west/content/pii:S0378778824010843/HIGHRES/image/jpeg/307f8ef5c47f71f92d469a1e39acbc2f/gr4_lrg.jpg gr4 gr4_lrg.jpg jpg 240795 2276 2368 IMAGE-HIGH-RES 1-s2.0-S0378778824010843-gr11_lrg.jpg https://s3-eu-west-1.amazonaws.com/prod-ucs-content-store-eu-west/content/pii:S0378778824010843/HIGHRES/image/jpeg/ebde0f096a5e2f917c56212695986940/gr11_lrg.jpg gr11 gr11_lrg.jpg jpg 137121 1396 2781 IMAGE-HIGH-RES 1-s2.0-S0378778824010843-gr18_lrg.jpg https://s3-eu-west-1.amazonaws.com/prod-ucs-content-store-eu-west/content/pii:S0378778824010843/HIGHRES/image/jpeg/ab54be8ef54e44edcaaefd25fd78535b/gr18_lrg.jpg gr18 gr18_lrg.jpg jpg 258056 1714 2782 IMAGE-HIGH-RES 1-s2.0-S0378778824010843-gr17_lrg.jpg https://s3-eu-west-1.amazonaws.com/prod-ucs-content-store-eu-west/content/pii:S0378778824010843/HIGHRES/image/jpeg/a8acb1b2104fac03c49abb8dbea6b2af/gr17_lrg.jpg gr17 gr17_lrg.jpg jpg 487101 1703 3150 IMAGE-HIGH-RES 1-s2.0-S0378778824010843-gr16_lrg.jpg https://s3-eu-west-1.amazonaws.com/prod-ucs-content-store-eu-west/content/pii:S0378778824010648/HIGHRES/image/jpeg/da7e1c6690558d46067382374d89517b/gr16_lrg.jpg gr16 gr16_lrg.jpg jpg 511771 1798 3150 IMAGE-HIGH-RES 1-s2.0-S0378778824010843-gr15_lrg.jpg https://s3-eu-west-1.amazonaws.com/prod-ucs-content-store-eu-west/content/pii:S0378778824010648/HIGHRES/image/jpeg/717e99372ff62e7066be5429c190bff7/gr15_lrg.jpg gr15 gr15_lrg.jpg jpg 508869 1799 3150 IMAGE-HIGH-RES 1-s2.0-S0378778824010843-gr19_lrg.jpg https://s3-eu-west-1.amazonaws.com/prod-ucs-content-store-eu-west/content/pii:S0378778824010648/HIGHRES/image/jpeg/f1d3f8813633f735a62b3539a3fd48c9/gr19_lrg.jpg gr19 gr19_lrg.jpg jpg 255931 1714 2782 IMAGE-HIGH-RES 1-s2.0-S0378778824010843-si1.svg https://s3-eu-west-1.amazonaws.com/prod-ucs-content-store-eu-west/content/pii:S0378778824010843/image/svg+xml/30b4e80100b54a8318ea76b175692024/si1.svg si1 si1.svg svg 2861 ALTIMG 1-s2.0-S0378778824010843-si10.svg https://s3-eu-west-1.amazonaws.com/prod-ucs-content-store-eu-west/content/pii:S0378778824010843/image/svg+xml/68eb3ef2c1fd16b3023b26b2a1c6e73d/si10.svg si10 si10.svg svg 2176 ALTIMG 1-s2.0-S0378778824010843-si11.svg https://s3-eu-west-1.amazonaws.com/prod-ucs-content-store-eu-west/content/pii:S0378778824010843/image/svg+xml/0afc8b007da142948de8d3a535299755/si11.svg si11 si11.svg svg 4204 ALTIMG 1-s2.0-S0378778824010843-si12.svg https://s3-eu-west-1.amazonaws.com/prod-ucs-content-store-eu-west/content/pii:S0378778824010843/image/svg+xml/3f9e6f269c78a77ecd88741793b5c8c2/si12.svg si12 si12.svg svg 4648 ALTIMG 1-s2.0-S0378778824010843-si13.svg https://s3-eu-west-1.amazonaws.com/prod-ucs-content-store-eu-west/content/pii:S0378778824010843/image/svg+xml/7fe8e0b59e3021b6d07260490a4ad911/si13.svg si13 si13.svg svg 4607 ALTIMG 1-s2.0-S0378778824010843-si14.svg https://s3-eu-west-1.amazonaws.com/prod-ucs-content-store-eu-west/content/pii:S0378778824010843/image/svg+xml/be7aab85973e1dbb1ed8630d0a2964cf/si14.svg si14 si14.svg svg 3782 ALTIMG 1-s2.0-S0378778824010843-si15.svg https://s3-eu-west-1.amazonaws.com/prod-ucs-content-store-eu-west/content/pii:S0378778824010843/image/svg+xml/a4d445dc3062597ce3c8be0e4b45b445/si15.svg si15 si15.svg svg 4980 ALTIMG 1-s2.0-S0378778824010843-si16.svg https://s3-eu-west-1.amazonaws.com/prod-ucs-content-store-eu-west/content/pii:S0378778824010843/image/svg+xml/c40cf0753074755a098c7d7912f1ae57/si16.svg si16 si16.svg svg 2945 ALTIMG 1-s2.0-S0378778824010843-si17.svg https://s3-eu-west-1.amazonaws.com/prod-ucs-content-store-eu-west/content/pii:S0378778824010843/image/svg+xml/86e7eae5cfe38b0c2899e1ce36c97447/si17.svg si17 si17.svg svg 5807 ALTIMG 1-s2.0-S0378778824010843-si18.svg https://s3-eu-west-1.amazonaws.com/prod-ucs-content-store-eu-west/content/pii:S0378778824010843/image/svg+xml/9e8f3835f9d597e63d7ed143b80a0c28/si18.svg si18 si18.svg svg 3360 ALTIMG 1-s2.0-S0378778824010843-si19.svg https://s3-eu-west-1.amazonaws.com/prod-ucs-content-store-eu-west/content/pii:S0378778824010843/image/svg+xml/20e2305e8d59a6ad222840d6c6b98d81/si19.svg si19 si19.svg svg 8048 ALTIMG 1-s2.0-S0378778824010843-si2.svg https://s3-eu-west-1.amazonaws.com/prod-ucs-content-store-eu-west/content/pii:S0378778824010843/image/svg+xml/2308396f986a358704654d02ea6d65de/si2.svg si2 si2.svg svg 4485 ALTIMG 1-s2.0-S0378778824010843-si20.svg https://s3-eu-west-1.amazonaws.com/prod-ucs-content-store-eu-west/content/pii:S0378778824010843/image/svg+xml/07cc1a20eda9192d99ed6964a4db55cd/si20.svg si20 si20.svg svg 6128 ALTIMG 1-s2.0-S0378778824010843-si21.svg https://s3-eu-west-1.amazonaws.com/prod-ucs-content-store-eu-west/content/pii:S0378778824010843/image/svg+xml/b8cc071fd21c1b153c173bd75f29fb57/si21.svg si21 si21.svg svg 7214 ALTIMG 1-s2.0-S0378778824010843-si22.svg https://s3-eu-west-1.amazonaws.com/prod-ucs-content-store-eu-west/content/pii:S0378778824010843/image/svg+xml/2c883588a1fa15e33f4688cf7e8c913e/si22.svg si22 si22.svg svg 7107 ALTIMG 1-s2.0-S0378778824010843-si23.svg https://s3-eu-west-1.amazonaws.com/prod-ucs-content-store-eu-west/content/pii:S0378778824010843/image/svg+xml/33f89f4d7de060461b0803e5cc7b036f/si23.svg si23 si23.svg svg 7885 ALTIMG 1-s2.0-S0378778824010843-si24.svg https://s3-eu-west-1.amazonaws.com/prod-ucs-content-store-eu-west/content/pii:S0378778824010843/image/svg+xml/bf1ee15b6a48dbabb7ba4017fc46d1b7/si24.svg si24 si24.svg svg 4510 ALTIMG 1-s2.0-S0378778824010843-si25.svg https://s3-eu-west-1.amazonaws.com/prod-ucs-content-store-eu-west/content/pii:S0378778824010843/image/svg+xml/9b36784d1e325d76984961417a00b03b/si25.svg si25 si25.svg svg 1638 ALTIMG 1-s2.0-S0378778824010843-si26.svg https://s3-eu-west-1.amazonaws.com/prod-ucs-content-store-eu-west/content/pii:S0378778824010843/image/svg+xml/0222f0d625e050525d88e28e7ae781cc/si26.svg si26 si26.svg svg 4289 ALTIMG 1-s2.0-S0378778824010843-si27.svg https://s3-eu-west-1.amazonaws.com/prod-ucs-content-store-eu-west/content/pii:S0378778824010843/image/svg+xml/9e993d30a686427e1e50e283d2e652b4/si27.svg si27 si27.svg svg 2252 ALTIMG 1-s2.0-S0378778824010843-si28.svg https://s3-eu-west-1.amazonaws.com/prod-ucs-content-store-eu-west/content/pii:S0378778824010843/image/svg+xml/7de9e87eea0ec98bceed3b05850d489c/si28.svg si28 si28.svg svg 1590 ALTIMG 1-s2.0-S0378778824010843-si29.svg https://s3-eu-west-1.amazonaws.com/prod-ucs-content-store-eu-west/content/pii:S0378778824010843/image/svg+xml/c3adcca0df4695ce51caec070f24446f/si29.svg si29 si29.svg svg 3795 ALTIMG 1-s2.0-S0378778824010843-si3.svg https://s3-eu-west-1.amazonaws.com/prod-ucs-content-store-eu-west/content/pii:S0378778824010843/image/svg+xml/8073d2c685841558841b308777877a05/si3.svg si3 si3.svg svg 3517 ALTIMG 1-s2.0-S0378778824010843-si30.svg https://s3-eu-west-1.amazonaws.com/prod-ucs-content-store-eu-west/content/pii:S0378778824010843/image/svg+xml/b948314fecda7a031f4637d9d56f2975/si30.svg si30 si30.svg svg 12011 ALTIMG 1-s2.0-S0378778824010843-si31.svg https://s3-eu-west-1.amazonaws.com/prod-ucs-content-store-eu-west/content/pii:S0378778824010843/image/svg+xml/0617fa2161cac5d7632a09d5ca39be2a/si31.svg si31 si31.svg svg 10829 ALTIMG 1-s2.0-S0378778824010843-si32.svg https://s3-eu-west-1.amazonaws.com/prod-ucs-content-store-eu-west/content/pii:S0378778824010843/image/svg+xml/48236cf11092806e063a703c98c42536/si32.svg si32 si32.svg svg 16216 ALTIMG 1-s2.0-S0378778824010843-si33.svg https://s3-eu-west-1.amazonaws.com/prod-ucs-content-store-eu-west/content/pii:S0378778824010843/image/svg+xml/81bbccf7e768cc8cdf087d9a9ab3ed91/si33.svg si33 si33.svg svg 21259 ALTIMG 1-s2.0-S0378778824010843-si34.svg https://s3-eu-west-1.amazonaws.com/prod-ucs-content-store-eu-west/content/pii:S0378778824010843/image/svg+xml/fa17b3faa67e150a6865df999223c2d8/si34.svg si34 si34.svg svg 3394 ALTIMG 1-s2.0-S0378778824010843-si35.svg https://s3-eu-west-1.amazonaws.com/prod-ucs-content-store-eu-west/content/pii:S0378778824010843/image/svg+xml/0461b457bee5df145a7b6f691547426b/si35.svg si35 si35.svg svg 6024 ALTIMG 1-s2.0-S0378778824010843-si36.svg https://s3-eu-west-1.amazonaws.com/prod-ucs-content-store-eu-west/content/pii:S0378778824010843/image/svg+xml/b242befbf5adaa00a76c06fddac1d499/si36.svg si36 si36.svg svg 6149 ALTIMG 1-s2.0-S0378778824010843-si37.svg https://s3-eu-west-1.amazonaws.com/prod-ucs-content-store-eu-west/content/pii:S0378778824010843/image/svg+xml/ac456d67f608f44a38ba5bc4dde99e0c/si37.svg si37 si37.svg svg 6656 ALTIMG 1-s2.0-S0378778824010843-si38.svg https://s3-eu-west-1.amazonaws.com/prod-ucs-content-store-eu-west/content/pii:S0378778824010843/image/svg+xml/3f032c4e2b5df457d9548a7d7127f5fb/si38.svg si38 si38.svg svg 6066 ALTIMG 1-s2.0-S0378778824010843-si39.svg https://s3-eu-west-1.amazonaws.com/prod-ucs-content-store-eu-west/content/pii:S0378778824010843/image/svg+xml/cb0075aba0bd72b4868a49251fefed96/si39.svg si39 si39.svg svg 6577 ALTIMG 1-s2.0-S0378778824010843-si4.svg https://s3-eu-west-1.amazonaws.com/prod-ucs-content-store-eu-west/content/pii:S0378778824010843/image/svg+xml/861a42a91d474ed7d353d0e6a0138bb1/si4.svg si4 si4.svg svg 4927 ALTIMG 1-s2.0-S0378778824010843-si40.svg https://s3-eu-west-1.amazonaws.com/prod-ucs-content-store-eu-west/content/pii:S0378778824010843/image/svg+xml/c443c4ed2b8d1254f6a31109ea04d1e7/si40.svg si40 si40.svg svg 1457 ALTIMG 1-s2.0-S0378778824010843-si41.svg https://s3-eu-west-1.amazonaws.com/prod-ucs-content-store-eu-west/content/pii:S0378778824010843/image/svg+xml/af7594f00a0ca9af6fdd8885fe678634/si41.svg si41 si41.svg svg 2204 ALTIMG 1-s2.0-S0378778824010843-si42.svg https://s3-eu-west-1.amazonaws.com/prod-ucs-content-store-eu-west/content/pii:S0378778824010843/image/svg+xml/1dd70cf065eb46f404e4419771578968/si42.svg si42 si42.svg svg 29311 ALTIMG 1-s2.0-S0378778824010843-si43.svg https://s3-eu-west-1.amazonaws.com/prod-ucs-content-store-eu-west/content/pii:S0378778824010843/image/svg+xml/bdaa8210c15d3622ee932d8213770a98/si43.svg si43 si43.svg svg 2750 ALTIMG 1-s2.0-S0378778824010843-si44.svg https://s3-eu-west-1.amazonaws.com/prod-ucs-content-store-eu-west/content/pii:S0378778824010843/image/svg+xml/92db71643a8d3b0081bf45c23ddd1671/si44.svg si44 si44.svg svg 2510 ALTIMG 1-s2.0-S0378778824010843-si45.svg https://s3-eu-west-1.amazonaws.com/prod-ucs-content-store-eu-west/content/pii:S0378778824010843/image/svg+xml/af08746693eec35da24e72d25a851a46/si45.svg si45 si45.svg svg 3271 ALTIMG 1-s2.0-S0378778824010843-si46.svg https://s3-eu-west-1.amazonaws.com/prod-ucs-content-store-eu-west/content/pii:S0378778824010843/image/svg+xml/9e535fd125f15bed2819901e4afde2c4/si46.svg si46 si46.svg svg 2858 ALTIMG 1-s2.0-S0378778824010843-si47.svg https://s3-eu-west-1.amazonaws.com/prod-ucs-content-store-eu-west/content/pii:S0378778824010843/image/svg+xml/5e885583329d76f8ea5f70325bad966c/si47.svg si47 si47.svg svg 1626 ALTIMG 1-s2.0-S0378778824010843-si48.svg https://s3-eu-west-1.amazonaws.com/prod-ucs-content-store-eu-west/content/pii:S0378778824010843/image/svg+xml/9d310b51d8c5a04358346ac0937aebfe/si48.svg si48 si48.svg svg 2389 ALTIMG 1-s2.0-S0378778824010843-si49.svg https://s3-eu-west-1.amazonaws.com/prod-ucs-content-store-eu-west/content/pii:S0378778824010843/image/svg+xml/2d0a076055a1acbf2a986ad3e6ee9b7b/si49.svg si49 si49.svg svg 2496 ALTIMG 1-s2.0-S0378778824010843-si5.svg https://s3-eu-west-1.amazonaws.com/prod-ucs-content-store-eu-west/content/pii:S0378778824010843/image/svg+xml/90766ab783bc43e0f073fa345789eda9/si5.svg si5 si5.svg svg 3517 ALTIMG 1-s2.0-S0378778824010843-si50.svg https://s3-eu-west-1.amazonaws.com/prod-ucs-content-store-eu-west/content/pii:S0378778824010843/image/svg+xml/e96ba552584ef56b46af88fff47c210a/si50.svg si50 si50.svg svg 20941 ALTIMG 1-s2.0-S0378778824010843-si51.svg https://s3-eu-west-1.amazonaws.com/prod-ucs-content-store-eu-west/content/pii:S0378778824010843/image/svg+xml/bc2f3bd9db47b34b1612accbe43fb835/si51.svg si51 si51.svg svg 23537 ALTIMG 1-s2.0-S0378778824010843-si52.svg https://s3-eu-west-1.amazonaws.com/prod-ucs-content-store-eu-west/content/pii:S0378778824010843/image/svg+xml/b3630ac3f7f77ffe05a676c1ec519fd0/si52.svg si52 si52.svg svg 26310 ALTIMG 1-s2.0-S0378778824010843-si53.svg https://s3-eu-west-1.amazonaws.com/prod-ucs-content-store-eu-west/content/pii:S0378778824010843/image/svg+xml/001e91c826358fe91caeaf0dbca3ac5e/si53.svg si53 si53.svg svg 20069 ALTIMG 1-s2.0-S0378778824010843-si54.svg https://s3-eu-west-1.amazonaws.com/prod-ucs-content-store-eu-west/content/pii:S0378778824010843/image/svg+xml/34b1b2205226cc8ba8d991c7b56285eb/si54.svg si54 si54.svg svg 22048 ALTIMG 1-s2.0-S0378778824010843-si55.svg https://s3-eu-west-1.amazonaws.com/prod-ucs-content-store-eu-west/content/pii:S0378778824010843/image/svg+xml/646e00ea720dce4ff309d7f2e595e323/si55.svg si55 si55.svg svg 39909 ALTIMG 1-s2.0-S0378778824010843-si56.svg https://s3-eu-west-1.amazonaws.com/prod-ucs-content-store-eu-west/content/pii:S0378778824010843/image/svg+xml/e68397794bce0c34329e92a69cd1e8cf/si56.svg si56 si56.svg svg 17101 ALTIMG 1-s2.0-S0378778824010843-si57.svg https://s3-eu-west-1.amazonaws.com/prod-ucs-content-store-eu-west/content/pii:S0378778824010843/image/svg+xml/c68538ed73e2ba028b570f8dbccb145f/si57.svg si57 si57.svg svg 16757 ALTIMG 1-s2.0-S0378778824010843-si58.svg https://s3-eu-west-1.amazonaws.com/prod-ucs-content-store-eu-west/content/pii:S0378778824010843/image/svg+xml/709ced074dd03e9f70b89b728723c100/si58.svg si58 si58.svg svg 24883 ALTIMG 1-s2.0-S0378778824010843-si59.svg https://s3-eu-west-1.amazonaws.com/prod-ucs-content-store-eu-west/content/pii:S0378778824010843/image/svg+xml/0b858937cab22ef9ae9d3125ea8ef759/si59.svg si59 si59.svg svg 22656 ALTIMG 1-s2.0-S0378778824010843-si6.svg https://s3-eu-west-1.amazonaws.com/prod-ucs-content-store-eu-west/content/pii:S0378778824010843/image/svg+xml/38cd49f347b95143eb41505a100b9914/si6.svg si6 si6.svg svg 3612 ALTIMG 1-s2.0-S0378778824010843-si60.svg https://s3-eu-west-1.amazonaws.com/prod-ucs-content-store-eu-west/content/pii:S0378778824010843/image/svg+xml/aabfdeee370a72afa3f6cb5a6597fe1c/si60.svg si60 si60.svg svg 27623 ALTIMG 1-s2.0-S0378778824010843-si61.svg https://s3-eu-west-1.amazonaws.com/prod-ucs-content-store-eu-west/content/pii:S0378778824010843/image/svg+xml/6539b979e3dd20e47d62c43e82d4419e/si61.svg si61 si61.svg svg 23551 ALTIMG 1-s2.0-S0378778824010843-si62.svg https://s3-eu-west-1.amazonaws.com/prod-ucs-content-store-eu-west/content/pii:S0378778824010843/image/svg+xml/90062a3b6e26280f51257ea164699b0c/si62.svg si62 si62.svg svg 26734 ALTIMG 1-s2.0-S0378778824010843-si63.svg https://s3-eu-west-1.amazonaws.com/prod-ucs-content-store-eu-west/content/pii:S0378778824010843/image/svg+xml/4ded9622d4a06ca6c287d894241eb720/si63.svg si63 si63.svg svg 14921 ALTIMG 1-s2.0-S0378778824010843-si64.svg https://s3-eu-west-1.amazonaws.com/prod-ucs-content-store-eu-west/content/pii:S0378778824010843/image/svg+xml/5e46c2711dd9ae59e73c1657752e8d34/si64.svg si64 si64.svg svg 22797 ALTIMG 1-s2.0-S0378778824010843-si65.svg https://s3-eu-west-1.amazonaws.com/prod-ucs-content-store-eu-west/content/pii:S0378778824010843/image/svg+xml/20301b54098b7bb31a46ae070fe148ce/si65.svg si65 si65.svg svg 16755 ALTIMG 1-s2.0-S0378778824010843-si66.svg https://s3-eu-west-1.amazonaws.com/prod-ucs-content-store-eu-west/content/pii:S0378778824010843/image/svg+xml/693681c4031c5cf561fba2223834a0fe/si66.svg si66 si66.svg svg 19818 ALTIMG 1-s2.0-S0378778824010843-si67.svg https://s3-eu-west-1.amazonaws.com/prod-ucs-content-store-eu-west/content/pii:S0378778824010843/image/svg+xml/f8f32afdca8a4a85d128c7b29cd370a6/si67.svg si67 si67.svg svg 16602 ALTIMG 1-s2.0-S0378778824010843-si68.svg https://s3-eu-west-1.amazonaws.com/prod-ucs-content-store-eu-west/content/pii:S0378778824010843/image/svg+xml/35eb3bc623afe2ecf809ce69e4b0e5b4/si68.svg si68 si68.svg svg 22741 ALTIMG 1-s2.0-S0378778824010843-si69.svg https://s3-eu-west-1.amazonaws.com/prod-ucs-content-store-eu-west/content/pii:S0378778824010843/image/svg+xml/0eace79e1ea9862f3339d88e736c8f69/si69.svg si69 si69.svg svg 20224 ALTIMG 1-s2.0-S0378778824010843-si7.svg https://s3-eu-west-1.amazonaws.com/prod-ucs-content-store-eu-west/content/pii:S0378778824010843/image/svg+xml/3631df8b2f7c7f38f8e4315bdb4cb576/si7.svg si7 si7.svg svg 5119 ALTIMG 1-s2.0-S0378778824010843-si70.svg https://s3-eu-west-1.amazonaws.com/prod-ucs-content-store-eu-west/content/pii:S0378778824010843/image/svg+xml/ce63720010fb0586195064a31ee76dcd/si70.svg si70 si70.svg svg 19452 ALTIMG 1-s2.0-S0378778824010843-si71.svg https://s3-eu-west-1.amazonaws.com/prod-ucs-content-store-eu-west/content/pii:S0378778824010843/image/svg+xml/0b4b860ee1a2b450463a0b2524c1915d/si71.svg si71 si71.svg svg 19541 ALTIMG 1-s2.0-S0378778824010843-si72.svg https://s3-eu-west-1.amazonaws.com/prod-ucs-content-store-eu-west/content/pii:S0378778824010843/image/svg+xml/645640c6d7275a9fc859bed5c815d0b3/si72.svg si72 si72.svg svg 6048 ALTIMG 1-s2.0-S0378778824010843-si73.svg https://s3-eu-west-1.amazonaws.com/prod-ucs-content-store-eu-west/content/pii:S0378778824010843/image/svg+xml/6e7f1f62bd57f72d381c483dddf21eac/si73.svg si73 si73.svg svg 6369 ALTIMG 1-s2.0-S0378778824010843-si74.svg https://s3-eu-west-1.amazonaws.com/prod-ucs-content-store-eu-west/content/pii:S0378778824010843/image/svg+xml/3d8f72f6e44295f819a9588b48816c94/si74.svg si74 si74.svg svg 6671 ALTIMG 1-s2.0-S0378778824010843-si75.svg https://s3-eu-west-1.amazonaws.com/prod-ucs-content-store-eu-west/content/pii:S0378778824010843/image/svg+xml/1896cf22cef478b727308b092d7c22a3/si75.svg si75 si75.svg svg 6987 ALTIMG 1-s2.0-S0378778824010843-si76.svg https://s3-eu-west-1.amazonaws.com/prod-ucs-content-store-eu-west/content/pii:S0378778824010843/image/svg+xml/d37e8ffbc2e6e80f005ad743a4eff257/si76.svg si76 si76.svg svg 68515 ALTIMG 1-s2.0-S0378778824010843-si77.svg https://s3-eu-west-1.amazonaws.com/prod-ucs-content-store-eu-west/content/pii:S0378778824010843/image/svg+xml/cee7de40ae447f4467fc82d51a7c7bb6/si77.svg si77 si77.svg svg 80914 ALTIMG 1-s2.0-S0378778824010843-si8.svg https://s3-eu-west-1.amazonaws.com/prod-ucs-content-store-eu-west/content/pii:S0378778824010843/image/svg+xml/b1c1a3cfb819927c1bf0ad4873753b74/si8.svg si8 si8.svg svg 2955 ALTIMG 1-s2.0-S0378778824010843-si9.svg https://s3-eu-west-1.amazonaws.com/prod-ucs-content-store-eu-west/content/pii:S0378778824010843/image/svg+xml/9e1de90e6a6e6323ca6f6d82e2813c5e/si9.svg si9 si9.svg svg 5959 ALTIMG ENB 114968 114968 S0378-7788(24)01084-3 10.1016/j.enbuild.2024.114968 Elsevier B.V. Fig. 1 Schematic diagram of a typical radiant floor structure. Fig. 2 Development ANN Process. Fig. 3 The behavior of conformal transfer functions. Fig. 4 Performance (R) of Models with different numbers of neurons in the hidden layer of the ANN. Fig. 5 MAPE model performance. Fig. 6 RMSE model performance. Fig. 7 Regression obtained for the 4:3:1 CTANSIG model. Fig. 8 CANNi process. Fig. 9 q t vs T in Munich. Fig. 10 q t vs T in Vancouver. Fig. 11 q t vs T in Murmansk. Fig. 12 T wm optimization in Munich. Fig. 13 T wm optimization in Vancouver. Fig. 14 T wm optimization in Murmansk. Fig. 15 T op and T wall optimization in Munich. Fig. 16 T op and T wall optimization in Vancouver. Fig. 17 T op and T wall optimization in Murmansk. Fig. 18 Optimization error in Munich. Fig. 19 Optimization error in Vancouver. Fig. 20 Optimization error in Murmansk. Table 1 RFH characteristics. Parameters Operating range Units Mass flow rate ( m f ) 0.0017 \u2013 1.994 kg s Heat resistance ( R s ) 0.0241 \u2013 0.648 m 2 K W Mean temperature ( T wm ) 8.3 \u2013 59.9 ° C Operative temperature ( T op ) 17.3 \u2013 35.65 ° C Heat flux ( q t ) 8.1 \u2013 193.9 W m 2 Table 2 Operational Ranges in literature. Source System Type T w m (°C) m f ( k g s ) R s ( m 2 K W ) T o p (°C) Karakoyun et al. [26] Heating 35 \u2013 45 0.01\u20130.04 0.03\u20130.1 18 \u2013 25 Wu et al. [27] Heating/Cooling 10 \u2013 35 0.01\u20130.08 0.03\u20130.07 20 \u2013 27 Jin et al. [28] Cooling 15 \u2013 20 0.01\u20130.05 0.04\u20130.1 24 \u2013 26 Li et al. [29] Cooling 8 \u2013 40 0.02\u20130.06 0.03\u20130.08 23 \u2013 25 Cholewa et al. [30] Heating/Cooling 8\u201335 0.02\u20130.05 0.02\u20130.06 19 \u2013 28 Verma et al. 2023 [17] Heating/Cooling 8.3 \u2013 59.9 0.0017 \u2013 1.994 0.0241 \u2013 0.648 17.3 \u2013 35.65 Table 3 Values for each test scenario. City Climate type Thermal Transmittance U W m 2 K Selected day Murmansk, Russia Polar 0.25 February 13, 2021 Vancouver, Canada Cold 0.30 December 21, 2021 Munich, Germany Temperate cold 0.35 January 11, 2021 Table 4 Results of classic models. Function Architecture R MAPE RMSE Intercept (l ± 0) Slope (S ± 1) b U p p e r b L o w e r m U p p e r m L o w e r TANSIG 4:1:1 0.93067 20.22276 0.07197 0.08578 0.00418 0.96482 0.74704 TANSIG 4:2:1 0.99060 8.08018 0.02697 0.02527 −0.00725 1.01461 0.92782 TANSIG 4:3:1 0.99606 5.34176 0.01744 0.01325 −0.00819 1.02193 0.96471 TANSIG 4:4:1 0.99872 2.24290 0.01008 0.01009 −0.00207 1.00695 0.97448 TANSIG 4:5:1 0.99674 4.23825 0.01668 0.01987 0.00059 1.00855 0.95709 LOGSIG 4:1:1 0.93051 20.30231 0.07271 0.09223 0.01379 0.92644 0.71709 LOGSIG 4:2:1 0.99039 7.92894 0.02719 0.02343 −0.00970 1.02280 0.93436 LOGSIG 4:3:1 0.99738 3.50351 0.01458 0.01630 −0.00099 1.00618 0.96003 LOGSIG 4:4:1 0.99928 1.67172 0.00760 0.00800 −0.00111 1.00472 0.98041 LOGSIG 4:5:1 0.99908 2.03641 0.00850 0.00568 −0.00475 1.01510 0.98726 SOFTPLUS 4:1:1 0.92945 19.82693 0.07265 0.08621 0.00443 0.95869 0.74041 SOFTPLUS 4:2:1 0.98896 6.17565 0.02938 0.02984 −0.00501 1.00560 0.91259 SOFTPLUS 4:3:1 0.99732 4.10409 0.01445 0.01164 −0.00607 1.01915 0.97187 SOFTPLUS 4:4:1 0.99852 1.94753 0.01082 0.01043 −0.00263 1.00651 0.97164 SOFTPLUS 4:5:1 0.99893 2.32957 0.00915 0.00504 −0.00621 1.01470 0.98468 SWISH 4:1:1 0.93571 19.75337 0.06948 0.08264 0.00416 0.96315 0.75367 SWISH 4:2:1 0.98729 9.26987 0.03158 0.02586 −0.01279 1.04167 0.93850 SWISH 4:3:1 0.99699 3.58373 0.01551 0.01550 −0.00297 1.00407 0.95478 SWISH 4:4:1 0.99890 2.73726 0.00929 0.00831 −0.00302 1.00960 0.97935 SWISH 4:5:1 0.99950 1.27538 0.00631 0.00364 −0.00398 1.00713 0.98680 ELU 4:1:1 0.94364 18.48479 0.06517 0.07853 0.00411 0.97440 0.77574 ELU 4:2:1 0.99626 4.56331 0.01700 0.01243 −0.00842 1.01923 0.96359 ELU 4:3:1 0.99778 3.35102 0.01317 0.01102 −0.00498 1.01016 0.96745 ELU 4:4:1 0.99764 3.69789 0.01366 0.01332 −0.00321 1.01173 0.96763 ELU 4:5:1 0.99795 3.33417 0.01278 0.00961 −0.00595 1.02131 0.97978 Table 5 Results of conformable models. Function Architecture R MAPE RMSE Intercept (l ± 0) Slope (S ± 1) b U p p e r b L o w e r m U p p e r m L o w e r CTANSIG 4:1:1 0.94594 15.94178 0.06383 0.06625 −0.00914 1.00733 0.80610 CTANSIG 4:2:1 0.99730 3.50128 0.01445 0.01174 −0.00596 1.01571 0.96845 CTANSIG 4:3:1 0.99924 2.10998 0.00780 0.00568 −0.00370 1.00592 0.98086 CTANSIG 4:4:1 0.99910 2.44344 0.00837 0.00672 −0.00355 1.00985 0.98244 CTANSIG 4:5:1 0.99952 1.85441 0.00622 0.00370 −0.00378 1.00633 0.98637 CLOGSIG 4:1:1 0.94592 15.90834 0.06383 0.06668 −0.00850 1.00440 0.80372 CLOGSIG 4:2:1 0.99730 3.50179 0.01445 0.01174 −0.00597 1.01572 0.96846 CLOGSIG 4:3:1 0.99893 1.47395 0.00927 0.00943 −0.00165 1.00315 0.97358 CLOGSIG 4:4:1 0.99930 1.94817 0.00748 0.00362 −0.00544 1.01073 0.98654 CLOGSIG 4:5:1 0.99963 1.10455 0.00547 0.00564 −0.00087 1.00137 0.98399 CSOFTPLUS 4:1:1 0.94734 17.38426 0.06298 0.07213 −0.00080 0.98704 0.79239 CSOFTPLUS 4:2:1 0.99677 4.35567 0.01586 0.01344 −0.00595 1.01874 0.96697 CSOFTPLUS 4:3:1 0.99921 1.60950 0.00794 0.00734 −0.00219 1.00358 0.97814 CSOFTPLUS 4:4:1 0.99930 1.89783 0.00743 0.00446 −0.00463 1.00977 0.98553 CSOFTPLUS 4:5:1 0.99949 1.53243 0.00630 0.00535 −0.00236 1.00684 0.98627 CSWISH 4:1:1 0.94761 17.08337 0.06300 0.06250 −0.01288 1.02273 0.82155 CSWISH 4:2:1 0.99448 4.25775 0.02085 0.01711 −0.00792 1.01191 0.94510 CSWISH 4:3:1 0.99852 2.06907 0.01092 0.00669 −0.00642 1.01056 0.97557 CSWISH 4:4:1 0.99959 1.44287 0.00561 0.00420 −0.00269 1.00675 0.98835 CSWISH 4:5:1 0.99959 1.02773 0.00574 0.00577 −0.00114 1.00285 0.98442 CELU 4:1:1 0.95076 15.82668 0.06098 0.06767 −0.00401 1.00252 0.81118 CELU 4:2:1 0.99598 6.33137 0.01761 0.01358 −0.00803 1.02012 0.96243 CELU 4:3:1 0.99802 2.66372 0.01243 0.01035 −0.00476 1.00985 0.96950 CELU 4:4:1 0.99807 3.25638 0.01232 0.00941 −0.00565 1.01935 0.97916 CELU 4:5:1 0.99806 3.27397 0.01243 0.01269 −0.00220 1.00536 0.96559 Table 6 Peak heat loading comparision. Climate zone Typical peak load heating ( W m 2 ) Peak load heating obtained in this study ( W m 2 ) Polar (Murmansk) 18 \u2013 22 20.6 Cold (Vancouver) 14 \u2013 18 16.3 Temperate cold (Munich) 15\u201322 18.7 Radiant heating systems control in buildings via Inverse Conformable Artificial Neural Networks and optimization techniques A.I. Mata Writing \u2013 original draft Visualization Software Methodology Investigation Formal analysis Conceptualization a J.I. Johnson Writing \u2013 review & editing Writing \u2013 original draft Software Methodology Investigation Formal analysis a A. Parrales Writing \u2013 review & editing Software Resources Formal analysis Conceptualization b \u204e J.E. Solís-Pérez Writing \u2013 review & editing Supervision Software Methodology Formal analysis Conceptualization c A. Huicochea Supervision Methodology Formal analysis Conceptualization d J.A. Hernandez Writing \u2013 review & editing Supervision Project administration Methodology Funding acquisition Conceptualization d \u204e a POSGRADO-Centro de Investigación en Ingeniería y Ciencias Aplicadas, Universidad Autónoma del Estado de Morelos, Av. Universidad 1001, Col. Chamilpa, C.P. 62209 Cuernavaca, Morelos, Mexico POSGRADO-Centro de Investigación en Ingeniería y Ciencias Aplicadas Universidad Autónoma del Estado de Morelos Av. Universidad 1001 Col. Chamilpa Cuernavaca Morelos C.P. 62209 Mexico POSGRADO-Centro de Investigación en Ingeniería y Ciencias Aplicadas, Universidad Autónoma del Estado de Morelos, Av. Universidad 1001, Col. Chamilpa, C.P. 62209 Cuernavaca, Morelos, Mexico b CONAHCyT \u2013 Centro de Investigacion en Ingeniería y Ciencias Aplicadas, Universidad Autónoma del Estado de Morelos, Av. Universidad 1001, Col. Chamilpa, C.P. 62209 Cuernavaca, Morelos, Mexico CONAHCyT \u2013 Centro de Investigacion en Ingeniería y Ciencias Aplicadas Universidad Autónoma del Estado de Morelos Av. Universidad 1001 Col. Chamilpa Cuernavaca Morelos C.P. 62209 Mexico CONAHCyT \u2013 Centro de Investigacion en Ingeniería y Ciencias Aplicadas, Universidad Autónoma del Estado de Morelos, Av. Universidad 1001, Col. Chamilpa, C.P. 62209 Cuernavaca, Morelos, Mexico c Escuela Nacional de Estudios Superiores Unidad Juriquilla, Universidad Nacional Autónoma de México, Blvd. Juriquilla 3001, 76230, Juriquilla, Querétaro, México Escuela Nacional de Estudios Superiores Unidad Juriquilla Universidad Nacional Autónoma de México Blvd. Juriquilla 3001 Juriquilla Querétaro 76230 México Escuela Nacional de Estudios Superiores Unidad Juriquilla, Universidad Nacional Autónoma de México, Blvd. Juriquilla 3001, 76230, Juriquilla, Querétaro, México d Centro de Investigación en Ingeniería y Ciencias Aplicadas (CIICAp-IICBA), Universidad Autónoma del Estado de Morelos, Av. Universidad 1001, Col. Chamilpa, C.P. 62209 Cuernavaca, Morelos, Mexico Centro de Investigación en Ingeniería y Ciencias Aplicadas (CIICAp-IICBA), Universidad Autónoma del Estado de Morelos Av. Universidad 1001 Col. Chamilpa Cuernavaca Morelos C.P. 62209 Mexico Centro de Investigación en Ingeniería y Ciencias Aplicadas (CIICAp-IICBA), Universidad Autónoma del Estado de Morelos, Av. Universidad 1001, Col. Chamilpa, C.P. 62209 Cuernavaca, Morelos, Mexico \u204e Corresponding authors. This study introduces an innovative methodology that integrates Inverse Conformable Artificial Neural Networks (CANNi) with Genetic Algorithms (GA) or Particle Swarm Optimization (PSO) to optimize thermal comfort in buildings. Emphasizing the efficacy of conformable transfer functions within CANNi, the research relies on a comprehensive dataset to forecast heat transfer across diverse climates. Notably, the methodology stands out for its meticulous model selection process, employing slope-intercept tests to ensure robust predictability (99%) and strong correlation between input and output variables. The selected model exhibits an optimal equilibrium between predictive precision and computational efficiency, reaching an R-value of 0.9992 with low RMSE (0.0078) and MAPE (2.1099). Such performance enables precise calibration of Radiant Floor Heating Systems (RFH) for enhanced comfort and marks a significant stride toward bolstering energy efficiency and sustainability within the construction sector. These findings advocate for more efficient utilization of energy resources in buildings, adeptly accommodating climatic fluctuations and enhancing the inhabitants\u2019 quality of life. Keywords Inverse conformable artificial neuronal networks Genetic algorithms Heat transfer Radiant floor Particle swarm optimization Data availability Data will be made available on request. Nomenclature ANN Artificial Neural Network ANNi Inverse Artificial Neural Network b Intercept b 1 , b 2 Matrix Bias CANN Conformable Artificial Neural Network CELU Conformable Exponential Linear Unit Function CANNi Inverse Conformable Artificial Neural Networks CLOGSIG Conformable Logarithmic Sigmoid Transfer Function CSOFTPLUS Conformable Softplus Transfer Function CSWISH Conformable Swish Transfer Function CTANSIG Conformable Hyperbolic Tangent Sigmoid Transfer Function ELU Exponential Linear Unit Function GA Genetic Algorithms LOGSIG Logarithmic Sigmoid Transfer Function m Slope MAPE Mean Absolute Percentage Error m f Mass Flow Rate PSO Particle Swam Optimization q t Heat Transfer Coefficient R Correlation Coefficient RFH Radiant Floor Heating Systems RMSE Root Mean Square Error R s Heat Resistance SOFTPLUS Softplus Transfer Function SWISH Swish Transfer Function TANSIG Hyperbolic Tangent Sigmoid Transfer Function T wm Water Mean Temperature T op Operative Temperature U Thermal Transmitance T wall Wall Temperature Greek letters λ , ξ Conformable parameters Subscripts exp experimental h hidden i input max maximum min minimum n normalized o output 1 Introduction The global energy crisis, exacerbated by Russia's invasion of Ukraine in early 2022 [1], has led to unprecedented volatility and sharp declines in energy prices, especially in the natural gas market. Natural gas accounts for over 23 % of global electricity generation [2], highlighting a significant dependency that, in the wake of recent geopolitical conflicts, has triggered a resurgence in coal usage within the power sector. This reactive shift has addressed immediate energy requirements and contributed to increased greenhouse gas emissions, further aggravating the environmental challenges confronting our world [3,4]. The residential sector ranks as the second-largest consumer of electricity, with air conditioning playing a crucial role, representing 57 % of the total consumption [5]. The distribution of energy usage for heating and cooling stands at 3.8 % and 53.4 %, respectively [6], highlighting a substantial demand for regulating indoor temperatures. Climate change has increased the need for space conditioning, and current projections do not anticipate reversing this trend [7\u20139]. This situation results in elevated operational costs and environmental impact, necessitating a comprehensive reassessment of the technologies and approaches employed for residential thermal management. Radiant Floor Heating systems (RFH) are becoming a promising choice among emerging alternatives due to their energy efficiency and capacity to deliver thermal comfort. These systems utilize the floor as a thermal source and commonly involve circulating water through tubing embedded in the floor structure [10]. To optimize the design of RFH, it's essential to understand how efficiently heat is transferred across surfaces within these systems. The heat flux is crucial in quantifying how effectively heat is transferred through different mediums. This parameter is essential for designing efficient thermal systems and predicting temperature distributions in various industrial processes and physical systems. It helps engineers and designers make informed decisions about improving such systems' performance. The heat flux of RFH can be influenced by various factors, including solar radiation, heat supply, room location, outside temperature, and the surrounding heating conditions [11,12]. Each of these elements has the potential to impact the efficiency with which the radiant floor system manages heat. It is crucial to comprehensively assess these factors to optimize system performance and effectively address energy and environmental challenges. Over the years, numerous studies have been conducted to evaluate the heat transfer capacity of RFH systems and to develop methods to improve it. However, a closer look reveals that, although these studies have made significant contributions, they also present methodological limitations that leave room for improvement. For example, Jing et al. [13] developed numerical models for different radiant heating structures using a microtube array. Although these models provided valuable information about the temperature distribution and heat transfer process, their limited experimental approach leaves questions about their applicability to different RFH configurations. Xu et al. [14] used the finite volume method to investigate heat flux involving phase change, optimizing the water supply temperature and establishing guidelines for surface temperature variation. Although this work contributes to the design of efficient RFH systems in intermittent mode, its focus on optimizing a single parameter may limit its applicability in more complex scenarios where multiple variables interact simultaneously. Wang et al. [15] proposed a calculation model for determining total heat flux ( q t ) in RFH. While the model showed superior performance compared to the standard ISO formula, significantly reducing standard deviations and improving the accuracy of q t calculations, its dependence on temperature variations along specific parameters raises questions about its robustness under changing conditions. The introduction of artificial neural networks (ANNs) in the field of heat flux has opened new possibilities for improving prediction accuracy. Acikgoz et al. [16] developed an ANN model for predicting heat transfer coefficients in a radiant floor system using a backpropagation architecture with the TANSIG transfer function. This model achieved high accuracy in predicting heat flux in RFH, with a correlation coefficient of 0.99955. However, the relatively simple structure of the model may not fully capture the complex thermal interactions in more advanced RFH. Verma et al. [17] proposed an ANN model to predict heat flow in an underfloor heating and cooling (RHC) system. Despite its high accuracy, with an R2 of 0.9984 and an MSE of 0.00055, the exclusive use of conventional transfer functions such as TANSIG and Purelin could limit its generalizability to unknown contexts, more modern, and flexible functions. The literature on mathematical modeling and deep learning highlights the importance of selecting optimal transfer functions. While TANSIG has been commonly used, other options, such as LOGSIG, SOFTPLUS, SWISH, and ELU, are gaining relevance to address specific challenges such as gradient degradation, improved model convergence, and generalization to various applications. SOFTPLUS is a smoothing of ReLU, defined as f x = I n 1 + e - x , which offers numerical stability. SWISH is defined as f x = x 1 + e - β x , a flexible activation that improves convergence. ELU (Exponential Linear Unit) is defined as f x = x , α ∙ e - x - 1 , x ≥ 0 , x < 0 . accelerating convergence and reducing gradient saturation. The choice of transfer function can substantially impact the performance of neural networks in various applications [18\u201321]. However, these investigations do not adequately address the implementation of new conformable functions derived from fractional calculus, which can offer advantages in terms of model simplification and robustness to noise. Solís-Pérez et al. [22] proposed a conformable artificial neural network (CANN) based on TANSIG and Khalil's conformable exponential function [23]. Although these models showed their ability to achieve high correlation coefficients in different experimental scenarios, their applicability in complex RFH systems has not yet been fully explored. Control-oriented optimization systems, such as Inverse Artificial Neural Networks (ANNi), have proven to be valuable tools for improving the efficiency of thermal systems. Garcia-Morales et al. [24] applied an ANNi model to control the outlet temperature in a double-tube heat exchanger, achieving superior benchmark tracking with a low RMSE of 0.2025. However, this approach has yet to be tested in more dynamic and complex applications such as RFH systems. Ajbar et al. [25] improved the thermal efficiency of a parabolic trough using ANNi in combination with genetic algorithms (GA) and particle swarm optimization (PSO). This approach proved to be effective, achieving a high correlation coefficient of 0.9511 and a low MSE of 0.0193. However, the integration of these techniques in the context of RFH systems remains an underexplored area, highlighting the need for further research. The integration of CANN with ANNi gives rise to a promising area, leading to the development of inverse conformable artificial neural networks (CANNi). This combination leverages the strengths of both approaches: CANN excels at capturing complex data relationships and is robust to noise, while ANNi models systems in reverse, transforming outputs into inputs. This integration holds great potential for addressing various application problems, offering a powerful and versatile approach. This article explores the application of CANNi as a novel approach to enhancing and expediting prediction models in heat flux in RFH. The methodology involves utilizing ANN with diverse activation functions, including traditional ones like LOGSIG and TANSIG, and modern functions like SOFTPLUS, SWISH, and ELU, along with their conformable counterparts. The objective is to capture the intricate data relationships in the construction effectively. Additionally, the study introduces the concept of Control-Oriented Optimization Systems, specifically CANNi, which leverage deep CANN learning for system control. This innovative approach aims to optimize the performance of RFH and enhance their energy efficiency. This study enhances and refines a previously established model for calculating the heat flux in RFH. Investigate how the use of CANNi can optimize and control the model. The primary contributions of this research are as follows: \u2022 Pioneering application of CANNi in the optimization of RFH systems, improving parameter prediction. \u2022 Optimization and simplification of the heat flux prediction model for RFH. \u2022 Control of the heat flux prediction model for RFH through an inversion approach. \u2022 Innovation in data management, adapting to changing conditions in real environments. 2 Experimental Setup Fig. 1 illustrates a radiant floor system that is the subject of investigation in this study. This system comprises four structural layers: a top cover layer, a screed coat, a filler layer, an insulation layer, and a heat exchanger pipe. Several vital operational characteristics define the radiant system's behavior, including the mass flow rate ( m f ), heat resistance ( R s ), mean temperature of heat transfer fluid ( T wm ) circulating inside the radiant tube, and the operative temperature ( T op ). Finally, the radiant system's heat flux ( q t ) corresponding to the specified operational parameters is selected as a performance output measure. These key variables, also illustrated in Fig. 1, play a crucial role in determining the performance of the system. It is important to note that Fig. 1 is a schematic representation of a typical RFH system. The data utilized in this study were not generated through simulations but were instead compiled and reported by Verma et al. [17], who collected experimental data from various published studies that conducted real-world experiments. Table 1 presents the system parameters and operating ranges derived from the literature [17]. On the other hand, Table 2 presents a comparison of the operational ranges across studies referenced in the literature, as outlined in source [17]. 3 Methodology As previously mentioned, ANN is a framework of interconnected neurons capable of processing and transmitting information to generate specific responses. Modeling with ANN involves four primary stages: data preprocessing, network architecture design, network training, and network performance analysis. Network architecture design, training, and performance analysis are vital components. Fig. 2 provides a visual representation of the sequence of these steps. 3.1 Preprocessing Data cleaning involves the elimination of inaccurate, duplicated, or incomplete data. Data normalization converts numerical attributes to a standardized scale, preventing variables with higher magnitudes from overshadowing those with lower magnitudes during training. Eq. (1) illustrates one frequently used data normalization method [31]. (1) x n = y max - y min ∗ x exp - x min x max - x min + y min x n is the normalized variable, x exp is the experimental variable to be normalized, x min and x max are the minimum and maximum of the input variable, and y min and y max represent the normalization range. Normalization was applied to both input and output variables, scaling them to fall within the range of 0.1 to 0.9, as defined in Eq. (1). This standardization procedure was essential for ensuring uniformity in the data and easing the training process of the ANN. Data partitioning involves splitting the dataset into subsets, typically called the training, validation, and testing sets. The training set is employed to fine-tune the parameters of the ANN using an optimization algorithm. The testing set selects the best model from several candidates based on criteria like the correlation coefficient (R). The testing set is crucial for estimating the real-world performance of the chosen model when applied to new data. This deliberate division strategy enables us to train the model, optimize its parameters, and assess its performance on unseen data, ensuring its robustness and accuracy [32]. After data preprocessing, the ANN's modeling involves determining the optimal combination of the number of layers, the number of neurons in each layer, and the transfer functions to be employed. This phase is determined empirically, iterating until an appropriate architecture is achieved. The selection of the architecture significantly impacts the model's capacity to learn and generalize from the data. 3.2 ANN architecture The general architecture of an ANN is typically divided into three sections: the input layer, the hidden layers, and the output layer. The input layer consists of neurons and variables that represent the input data. Its primary function is to capture and transmit the input data to subsequent layers. The hidden layer contains a variable number of neurons, determined through an iterative process guided by model performance. Within a neuron in the hidden neural network layer, a linear combination of the inputs weighted by their respective weights is computed, resulting in a summation. This sum is subsequently processed through a nonlinear transfer function to capture the intricate relationships between the input and output variables [33]. In the hidden layer, transfer functions produce nonlinear transformations, enabling them to address high-complexity problems effectively. Transfer functions play a crucial role in the processing and transmission of information across the layers of an ANN, thereby influencing its performance [34]. Two classical functions, LOGSIG (logarithmic sigmoid) and TANSIG (hyperbolic tangent sigmoid), have been prevalent in the literature due to their desirable properties, including their capacity to introduce nonlinearities into the model [25]. In the continuous pursuit of enhancing performance and training stability, alternative functions like SOFTPLUS, SWISH, and ELU have emerged. These functions are precious for regression or multi-class classification problems as they can effectively represent positive and negative values. While they have received comparatively less attention, they have demonstrated effectiveness in specific contexts by offering more stable gradients and enhancing convergence in deep training [35\u201342]. 3.3 Conformable transfer functions Incorporating fractional calculus into transfer functions has recently led to significant enhancements in the performance and simplification of predictive models. While the concept of implementing fractional calculus had been considered previously, it wasn't until Khalil introduced his definition of fractional derivative [43] that this implementation became viable. Consequently, this definition of fractional calculus satisfies the fundamental properties of differentiation, including the derivative of a constant, the product rule, the quotient rule, and the chain rule. This paves the way for the potential generalization of the calculation to non-integer orders. This emphasis led to the creation of conformable transfer functions, which incorporate characteristics of fractal calculus into traditional transfer functions [22]. Conformable functions like CLOGSIG, CTANSIG, CSOFTPLUS, CSWISH, and CELU offer potential advantages over their conventional counterparts, especially regarding adaptability and performance in specific contexts. Various factors drive the selection criteria for their application. Fig. 3 illustrates the behavior of conformable transfer functions when the parameters λ and ξ are arbitrarily chosen. The conventional transfer functions are obtained when λ = 1 and ξ = 1. The output layer represents the variable response. The configuration of this layer depends on the nature of the problem at hand. Suppose the problem is regression, which aims to predict a continuous value. In that case, the output layer may consist of a single neuron that employs a linear or identity function to generate the constant prediction. Finally, Eq. (2) shows the objective function of the ANN with one hidden layer. (2) Output = f o ∑ n = 1 N W o o , n f h ∑ r = 1 R W i n , r P r + b 1 n + b 2 o f o is the transfer function applied to the output layer, W o are the weights associated with the hidden layer, f h the transfer function applied to the hidden layer, W i are the weights associated with the input layer, P are the ANN's inputs, b 1 , and b 2 l are the hidden and output layer biases. 3.4 Statistical validation Statistical validation is a crucial tool for ensuring the reliability and accuracy of a machine learning model. Given the nonlinear characteristics of neural networks and the complexity of the model, employing rigorous validation techniques is of utmost importance. The Slope-Intercept test assesses the agreement between model predictions and observed values. In an ideal scenario, the projections would closely follow a 1:1 relationship with the actual values, resulting in a slope ( m ) near 1 and an intercept ( b ) is near 0. However, it's unusual for a model to achieve these ideal values precisely in practice. Therefore, an approach is taken by approximating one parameter above and one parameter below the slope and the intercept. In this way, a clear view of the model's bias and accuracy is obtained [44]. Statistical metrics are quantitative measures used to assess the extent of disparity between actual and predicted values. Numerous statistical metrics are available for evaluating the performance of ANNs, each with its strengths and limitations. Below, we will describe some of these metrics: The correlation coefficient (R) is a metric that assesses the linear relationship between two continuous variables [45]. The Root Mean Square Error (RMSE) offers an absolute measure of the discrepancy between predictions and actual values. The Mean Absolute Percentage Error (MAPE) computes the average error of a model using absolute value measurements, providing a notable advantage in terms of interpretability compared to other metrics [46]. 3.5 Control strategy with ANNi Developing ANN models represents a powerful approach for optimizing various aspects such as time, cost, and error in representing complex phenomena using operational variables. ANNi models introduce an innovative inversion approach by transforming target variables into model inputs. This inversion enables the model to receive the target variables and generate the operational variables necessary to achieve that outcome. By leveraging ANNi models, researchers can enhance their ability to manipulate and control systems efficiently to achieve specific desired outcomes [24,25,47\u201349]. To achieve the optimal application of ANNi models, it's essential to consider the following key points: \u2022 Develop an equation that faithfully represents the underlying phenomenon. \u2022 Identify and uphold context-specific variables throughout the analysis. \u2022 Strategize model inversion. \u2022 Optimize output variables for enhanced performance and accuracy. \u2022 Model simulation through scenario generation. We start with meticulously formulating the equation to delineate the captivating phenomenon. This equation is obtained by embedding the transfer function, weights, and biases acquired during CANN training into the objective function Eq. (2). This establishes a solid foundation for the model, enabling a precise representation of the underlying dynamics. Next, it's crucial to identify and keep constant context-specific variables, which, although important, need to be more generalizable. This simplifies the analysis without compromising the validity of the focus. This strategy directs optimization efforts toward manipulable operational factors critical for system improvement. The investment process starts by setting the model's equation to zero concerning the manipulable operating variables, a crucial step in identifying optimal operating points. This procedure enables direct and effective intervention in these variables, guiding them toward desired optimization goals. Subsequently, these and the objective variables are separated from the general model and become inputs in the new ANNi model. This approach fosters a clear and organized structure, streamlining simulations and simplifying optimization tasks. During the optimization phase, genetic algorithms (GA) and Particle Swam Optimization (PSO) are employed due to their remarkable capacity to navigate complex search spaces and converge to optimal solutions [50\u201355]. GA simulates the evolution of living organisms, where more fit individuals dominate over less fit ones, resembling biological evolution mechanisms such as natural selection, crossover, and mutation [56]. PSO draws inspiration from the collective behavior of birds or pelicans. Its objective is to discover the optimal solution for a problem by continuously adjusting the positions and velocities of particles within an array [57]. The inspiration behind bio-inspired optimizers enables them to thoroughly explore solution spaces, maintaining diversity and preventing premature convergence to suboptimal solutions. This capability for indiscriminate exploration, their versatility, and their ability for parallel execution position them as efficient tools for optimizing ANNi models. Ultimately, the performance of optimizers is juxtaposed with the phenomenon under examination. The simulation process for the CANNi model culminates in scenario generation, a task demanding adherence to conventional practices that must be in line with applicable standards and regulations. Adhering to established norms ensures the credibility and relevance of the generated scenarios. 3.5.1 Test scenario considerations 1 Following the standards set by Passive House [58], three cities were selected to represent different climatic conditions: polar, cold, and temperate. Based on these classifications, standard thermal transmittance (U) values for each zone were established. Using NASA's POWER tool [59], each city's coldest day of 2021 was pinpointed, organizing the data in Table 3 . Hourly temperature data for each city were collected to analyze the control system's response to significant temperature fluctuations. This methodology allows us to assess the system's efficiency across various climatic conditions and optimize its performance to enhance energy efficiency and comfort. 2. The dimensions considered for the room are as follows: 3. Width: Four meters. 4. Length: Five meters. 5. Height: Two and a half meters. 6. During the tests, specific variables related to the materials used in the radiant heating system were identified: a. M a s s f l o w m f = 0.0323 kg s b. H e a t r e s i s t a n c e R s = 0.241 m 2 k W Additionally, constants were established to ensure optimal test conditions: c. T h e r m a l c o m f o r t t e m p e r a t u r e T comf = 20 ° C d. Total area of the room w alls = 85 m 2 e. Total area of the RFH installation = 20 m 2 f. Heat gains ( T o t a l h e a t g e n e r a t e d b y p e o p l e a n d e l e c t r i c a l d e v i c e s ) = 300 W 6. Using the defined variables and constants, basic thermal balance equations were utilized: o Heat transfer via building envelope: (3) Q ¯ = U ∗ ( A t - A rf ) ∗ ( T conf - T hr ¯ ) Q = T r a n s f e r r e d h e a t ( W ) U = T o t a l t h e r m a l t r a n s m i t a n c e c o e f f i c i e n t W m 2 K A t = T o t a l a r e a o f t h e h e a t t r a n s f e r w a l l s ( m 2 ) A rf = T o t a l a r e a o f t h e R F H s y s t e m i n s t a l l a t i o n ( m 2 ) T conf = T h e r m a l c o m f o r t t e m p e r a t u r e ( K ) T hr = H o u r l y r e g i s t e r e d t e m p e r a t u r e ( K ) o Heat flux rate through RFH system installation: (4) q t = Q - Q g a i n A rf q t = R F H h e a t f l u x r a t e W m 2 Q = T r a n s f e r r e d h e a t W Q gain = H e a t g a i n s W A rf = T o t a l a r e a o f t h e R F H s y s t e m i n s t a l l a t i o n ( m 2 ) By using Eq. (3) and (4), the heat transfer rate required by the RFH system to maintain the room at the established comfort temperature of 20 °C was calculated. Subsequently, leveraging the previously identified heat flux ( m f ), heat resistance ( R s ), and heat flux rate ( q t ), an optimization was conducted using the equation of the best-performing Artificial Neural Network model. This optimization aimed to determine the optimal values for operating temperature ( T op ) and average fluid temperature ( T wm ), to ensure maximum efficiency and thermal comfort within the room. 7. The operating temperature is an important metric that reflects a person's thermal perception in a certain space. For this reason, it was chosen as a parameter to analyses the model's accuracy in terms of actual thermal sensing within the building. To do this analysis, the average of the vector of operational temperatures obtained was calculated and analyzed to see if the resulting values, obtained using optimization algorithms, accurately reflect the thermal reality experienced by the building's occupants. This approach ensures that the radiant heat system not only meets technical requirements but also provides the desired thermal comfort. 8. The surface temperature was calculated to evaluate the model's effectiveness regarding thermal comfort on the surface of the radiant floor heating system (RFH). This analysis was conducted using Eq. (5) [17], which facilitates an accurate estimation of the surface temperature and its influence on occupant comfort. This methodology ensures that the RFH surface operates within optimal parameters for user well-being, providing a thorough perspective on the system\u2019s capability to sustain a comfortable environment. (5) q t = T wall - T op R s → T wall = q t ∗ R s + T op q t = R F H h e a t f l u x r a t e ( W m 2 ) R s = H e a t r e s i s t a n c e m 2 k W T wall = W a l l t e m p e r a t u r e K T op = O p e r a t i v e T e m p e r a t u r e ( K ) 4 Results and discussion This section presents and analyzes the outcomes of experiments involving different ANN architectures in modeling the problem. MATLAB® software version 2021b was used for the ANN modeling; the optimization toolbox integrated with the software was used. Several crucial steps were undertaken in the model's development process, with data preprocessing being one of the most significant. The fundamental architecture of the ANN comprised four neurons in the input layer (represented by m f , R s , T wm , T op ) and one in the output layer ( q t ), and the number of neurons in the hidden layer was determined through empirical adjustments during the model development process. The initial set of models explored the impact of varying the number of neurons in the hidden layer from 1 to 5. These models employed conventional transfer functions like LOGSIG, TANSIG, SOFTPLUS, SWISH, and ELU. The maximum limit of five neurons in the hidden layer was selected based on prior research in the field [17]. The second group of models focused on conformable transfer functions (CLOGSIG, CTANSIG, CSOFTPLUS, CSWISH, CELU), with the number of neurons in the hidden layer ranging from 1 to 5. This investigation aimed to assess the performance of these newer transfer functions in addressing the modeling problem. Ten thousand simulations were performed for each of the 50 models generated. The training of the ANN models utilized the Levenberg-Marquardt optimization algorithm. An initial filter was applied using a slope-intercept test with a 99 % confidence level. This filter identified models with robust performance metrics (R, RMSE, MAPE) and those that accurately represented linear relationships between variables. Of the 50 models created, 44 successfully passed the slope-intercept test, with 19 using traditional transfer functions and 25 using conformable transfer functions. Tables 4 and 5 display the results obtained from the classical and conformable models, respectively. These tables include the metrics b Upper and I b Lower , representing the upper and lower approaches of the intercept, m Upper and m Lower indicating the upper and lower slope approaches. Figs. 4, 5, and 6 provide insights into the performance of each model in terms of the assessed metrics, namely R, MAPE, and RMSE. The performance of the ANN models was analyzed about the thermal characteristics of the RFH system. The conformable models demonstrated a superior ability to predict RFH performance, which is reflected in the ability of these models to accurately adjust the operating parameters required to maintain a comfortable temperature. CLOGSIG 4:5:1 and CSWISH 4:5:1, consistently outperform other models, regardless of the number of neurons. Considering the number of neurons in model selection, CTANSIG 4:3:1 emerges as the most balanced option. This model meets high correlation and prediction precision criteria and offers computational efficiency benefits due to its simplified structure. Reducing the number of neurons decreases the computational resources required for training and inference and the risk of overfitting, leading to a more robust generalization of new data. Starting with our best model, we derived an equation describing its behavior by substituting the transfer function, weights, and biases obtained during CANN training into the target function Eq. (2). Then, we simplified it through algebraic factorization to provide a more concise representation, as shown in Eq. (6). Fig. 7 illustrates the effectiveness of the predictive capability of the resulting model, highlighting how it can accurately predict the optimal operating conditions of the RFH system. (6) q t = 0.0946 1 + e 1 . 9082 ∗ - 2 ∗ 0.6535 ∗ m f - 0.0731 ∗ R s - 0.1819 ∗ T wm + 1.6947 ∗ T op - 0.4413 0.5756 + 0.1089 1 + e 2.6793 ∗ - 2 ∗ - 0.0453 ∗ m f - 0.0017 ∗ R s + 0.8740 ∗ T wm - 0.3297 ∗ T op + 0.5309 0.4702 + 0.2767 1 + e 2.8626 ∗ - 2 ∗ - 0.0302 ∗ m f - 1.1244 ∗ R s + 0.6397 ∗ T wm - 0.3449 ∗ T op + 0.3215 0.5506 + 0.1636 Given the variability of m f and R s at different sites. T op , T wm , and q t is separated from the general model and integrated into the new CANNi model, as shown in Eq. (7). The model reconfiguration significantly simplifies the optimization process, enabling the direct application of GA and PSO to determine the optimal values of T wm and T op . (7) f T wm , T op = 0.0946 1 + e 1 . 9082 ∗ - 2 ∗ 0.6535 ∗ m f - 0.0731 ∗ R s - 0.1819 ∗ T wm + 1.6947 ∗ T op - 0.4413 0.5756 + 0.1089 1 + e 2.6793 ∗ - 2 ∗ - 0.0453 ∗ m f - 0.0017 ∗ R s + 0.8740 ∗ T wm - 0.3297 ∗ T op + 0.5309 0.4702 + 0.2767 1 + e 2.8626 ∗ - 2 ∗ - 0.0302 ∗ m f - 1.1244 ∗ R s + 0.6397 ∗ T wm - 0.3449 ∗ T op + 0.3215 0.5506 + 0.1636 - q t d e s i r e d Using GA and PSO as an optimization tool effectively explored the solution space, enabling the identification of optimal combinations of T wm and T op that fulfill the specified performance criteria, considering fixed values of m f and R s and the target q t . The optimization yielded a set of operational parameters that can accurately predict the conditions necessary to attain the desired performance across different input configurations. Fig. 8 illustrates the conceptual diagram of the CANNi, emphasizing the interplay between the input variables ( T wm , T op , and q t ) and the optimization process facilitated by GA and PSO, leading to the prediction of optimal operational conditions. This diagram not only delineates the internal framework of the CANNi model but also elucidates the approach employed to optimize key variables within defined constraints. Showing how these optimizations can significantly improve the thermal performance of the RFH system under various climate scenarios. CANNi was simulated by creating scenarios that reflect typical RFH implementation in various climate zones. The considerations for scenario development were explained in the methodology section Fig. 9 to Fig. 11 present important graphs for Munich, Vancouver, and Murmansk. The \u201ca\u201c graph illustrates the actual temperature recorded on the coldest day in these cities, while the \u201cb\u201d graph indicates the amount needed to maintain a comfortable temperature of 20 °C. This analysis forms the basis for understanding energy use in cold climates, which is essential for evaluating the effectiveness of optimization techniques. This knowledge allows us to discern the energy required to maintain comfortable indoor conditions and how these demands fluctuate in response to extreme outdoor conditions. The maximum heating load required for each city, as indicated by the peak value of q t \u200b, corresponds to the lowest recorded outdoor temperature of the year. Table 6 contrasts typical heating load values for each climate type, referenced from the ASHRAE [60], with those derived in this study. The peak heating load is subject to various interrelated factors, which are not exhaustively explored in this analysis. Conventionally, peak heating loads are observed between 5 am and 6 am, coinciding with the lowest outdoor temperatures. However, in our study, the timing of the peak heating load might deviate from this norm. This deviation arises because our analysis primarily focuses on how the radiant floor heating (RFH) system responds to optimized temperature data provided by the POWER tool, rather than adhering to the typical hourly trends of decreasing outdoor temperatures. Fig. 12 to Fig. 14 presents data on the performance of GA and PSO when adjusting T wm . Although the fluid temperatures might appear somewhat low, this contrasts with Figs. 15 to 17 , which show that the adjustments to the operating temperature approach the proposed value of 20 °C, considered as the thermal comfort temperature and the Wall Temperature T wall achieved with the T wm values. In the Munich scenario (see Fig. 15), GA consistently maintains an operating temperature closer to the comfort target of 20 °C (21.5 °C) than PSO (19.9 °C). Additionally, the wall surface temperature T wall remains within the comfortable range of 20 °C to 30 °C. This observation suggests that GA excels in fine-tuning conditions to achieve an optimal thermal environment. Similarly, in the Vancouver scenario (see Fig. 16), GA sustains a slightly higher average operating temperature (21.4 °C) than PSO (19.9 °C), maintaining the T wall in the same range of comfort temperature desired, indicating that GA is more dependable in ensuring thermal comfort, particularly in warmer climates. In the Murmansk scenario (see Fig. 17), GA achieves a notably higher average operating temperature (21.7 °C) than PSO (20 °C), showcasing its capacity to adapt and efficiently respond to more severe climate conditions. Fig. 18 to Fig. 20 directly compare the errors associated with each optimizer's task of adjusting the parameters necessary to attain thermal comfort. In the Munich scenario (see Fig. 18), GA consistently exhibits lower errors throughout the day than PSO, implying greater precision in parameter adjustments for maintaining thermal comfort. Similarly, in the Vancouver scenario (see Fig. 19), error patterns resembling those observed in Munich are evident. GA consistently demonstrates lower errors, underscoring its higher efficiency and reliability in adjusting thermal comfort conditions. Despite Murmansk's icy weather conditions (see Fig. 20), GA maintains a lower error rate than PSO, showcasing its resilience and capacity to deliver accurate adjustments even in demanding environments. Fig. 9 to Fig. 20 illustrate the consistent superiority of GA over PSO across different climatic contexts. GA consistently sustains operational temperatures closer to or higher than the desired threshold and exhibits fewer errors in its execution, signifying enhanced precision and efficiency. These findings underscore the importance of selecting the appropriate optimizer for heat transfer and thermal comfort applications in buildings, especially when addressing substantial climatic variations. 5 Conclusion The study showcases the effectiveness of conformable models by emphasizing their remarkable capacity to establish correlations and reduce errors. These attributes underscore the models' robust capability to tackle the intricacies of thermal comfort. Identifying CTANSIG 4:3:1 as the optimal model underscores a harmonious balance between accuracy and computational efficiency, underscoring its pragmatic utility in temperature-controlled environment modeling. In this context, integrating optimization algorithms (such as GA and PSO) within the framework of CANNi has emerged as a potent strategy for identifying optimal thermal conditions. This approach facilitates comprehensive exploration within the solution space, showcasing the adaptability and responsiveness of these tools to evolving input parameters. Fusing CANNi models with advanced optimization techniques represents an innovative avenue for enhancing the design and performance of RFH. The model's adaptability and robustness are underscored through its simulation across diverse climate zones, including Polar, Cold, and Cold-Temperature regions. Fine-tuning the model to accommodate extreme conditions in locales like Murmansk, Vancouver, and Munich underscores its efficacy in delivering optimal thermal solutions across varied climatic contexts. This versatility underscores the model's pragmatic utility in optimizing RFH and enhancing thermal comfort. This study represents a substantial advancement in thermal engineering and sustainable construction by offering a methodology and tools for the efficient design and optimization of RFH. Integrating CANNi with optimization techniques effectively tackles contemporary challenges in regulating thermal comfort. CRediT authorship contribution statement A.I. Mata: Writing \u2013 original draft, Visualization, Software, Methodology, Investigation, Formal analysis, Conceptualization. J.I. Johnson: Writing \u2013 review & editing, Writing \u2013 original draft, Software, Methodology, Investigation, Formal analysis. A. Parrales: Writing \u2013 review & editing, Software, Resources, Formal analysis, Conceptualization. J.E. Solís-Pérez: Writing \u2013 review & editing, Supervision, Software, Methodology, Formal analysis, Conceptualization. A. Huicochea: Supervision, Methodology, Formal analysis, Conceptualization. J.A. Hernandez: Writing \u2013 review & editing, Supervision, Project administration, Methodology, Funding acquisition, Conceptualization. Declaration of competing interest The authors declare that they have no known competing financial interests or personal relationships that could have appeared to influence the work reported in this paper. Acknowledgments The first and second authors are grateful for CONAHCYT's financial support through student scholarships. Additionally, Arianna Parrales Bahena acknowledges CONAHCYT's support through the Investigadores por México 2017 program. References [1] IEA. World Energy Outlook 2022 / The global energy crisis. https://www.iea.org/reports/world-energy-outlook-2022/the-global-energy-crisis?language=es. (Accessed 23 April 2024). [2] IEA. World electricity generation mix by fuel, 1971-2019. https://www.iea.org/data-and-statistics/charts/world-electricity-generation-mix-by-fuel-1971-2019. (Accessed 23 April 2024). [3] IEA. Coal. https://www.iea.org/energy-system/fossil-fuels/coal#tracking. (Accessed 23 April 2024). [4] IEA. Annual change in generation and CO2 emissions from unabated coal-fired power plants in the Net Zero Scenario, 2015-2030. https://www.iea.org/data-and-statistics/charts/annual-change-in-generation-and-co2-emissions-from-unabated-coal-fired-power-plants-in-the-net-zero-scenario-2015-2030. (Accessed 23 April 2024). [5] IEA. Energy Statistics Data Browser. https://www.iea.org/data-and-statistics/data-tools/energy-statistics-data-browser?country=WORLD&energy=Electricity&year=2020. (Accessed 23 April 2024). [6] IEA. Shares of residential energy consumption by end use in selected IEA countries, 2019. https://www.iea.org/data-and-statistics/charts/shares-of-residential-energy-consumption-by-end-use-in-selected-iea-countries-2019. (Accessed 23 April 2024). [7] IEA. Residential space heating and water heating consumption covered by minimum energy performance standards, 2000-2022. https://www.iea.org/data-and-statistics/charts/residential-space-heating-and-water-heating-consumption-covered-by-minimum-energy-performance-standards-2000-2022. (Accessed 23 April 2024). [8] IEA. Residential space cooling consumption covered by minimum energy performance standards by region, 2000-2022. https://www.iea.org/data-and-statistics/charts/residential-space-cooling-consumption-covered-by-minimum-energy-performance-standards-by-region-2000-2022. (Accessed 23 April 2024). [9] IEA. World Energy Outlook 2022 / Outlook for electricity. https://www.iea.org/reports/world-energy-outlook-2022/outlook-for-electricity?language=es. (Accessed 23 April 2024). [10] W. Chen Y. Liu X. Liang F. Luo T. Liao S. Wang X. Gao Z. Zhang Y. Fang Experimental and numerical investigations on radiant floor heating system integrated with macro-encapsulated phase change material Energy 282 2023 128375 10.1016/j.energy.2023.128375 Chen, W., Liu, Y., Liang, X., Luo, F., Liao, T., Wang, S., Gao, X., Zhang, Z. & Fang, Y. (2023). Experimental and numerical investigations on radiant floor heating system integrated with macro-encapsulated phase change material. Energy, 282, 128375. DOI: 10.1016/j.energy.2023.128375 [11] J. Zheng T. Yu B. Lei C. Chen Experimental study on the thermal performance of radiant floor heating system with the influence of solar radiation on the local floor surface Indoor Built Environ. 1420326X221148729 2023 10.1177/1420326X22114872 Zheng, J., Yu, T., Lei, B., & Chen, C. (2023). Experimental study on the thermal performance of radiant floor heating system with the influence of solar radiation on the local floor surface. Indoor and Built Environment, 1420326X221148729. DOI: 10.1177/1420326X22114872 [12] O. Babaharra K. Choukairy S. Hamdaoui K. Khallaki S.H. Mounir Thermal behavior evaluation of a radiant floor heating system incorporates a microencapsulated phase change material Constr. Build. Mater. 330 2022 127293 10.1016/j.conbuildmat.2022.127293 Babaharra, O., Choukairy, K., Hamdaoui, S., Khallaki, K., & Mounir, S. H. (2022). Thermal behavior evaluation of a radiant floor heating system incorporates a microencapsulated phase change material. Construction and Building Materials, 330, 127293. DOI: 10.1016/j.conbuildmat.2022.127293 [13] Jing, H., Quan, Z., Dong, R., Hao, L., Liu, Y., & Zhao, Y. (2022). Performance simulation and optimization of new radiant floor heating based on micro heat pipe array. In Building Simulation (pp. 1-14). Tsinghua University Press. DOI: 10.1007/s12273-021-0834-3. [14] Y. Xu B.B. Sun L.J. Liu X.Y. Liu The numerical simulation of radiant floor cooling and heating system with double phase change energy storage and the thermal performance J. Storage Mater. 40 2021 102635 10.1016/j.est.2021.102635 Xu, Y., Sun, B. B., Liu, L. J., & Liu, X. Y. (2021). The numerical simulation of radiant floor cooling and heating system with double phase change energy storage and the thermal performance. Journal of Energy Storage, 40, 102635. DOI: 10.1016/j.est.2021.102635 [15] M. Wang P. Li W. Liu Generic mathematical formulation of the total heat transfer coefficients between heated radiant floor surfaces and rooms Build. Environ. 211 2022 108701 10.1016/j.buildenv.2021.108701 Wang, M., Li, P., & Liu, W. (2022). Generic mathematical formulation of the total heat transfer coefficients between heated radiant floor surfaces and rooms. Building and Environment, 211, 108701. DOI: 10.1016/j.buildenv.2021.108701 [16] O. Acikgoz A.B. Çolak M. Camci Y. Karakoyun A.S. Dalkilic Machine learning approach to predict the heat transfer coefficients pertaining to a radiant cooling system coupled with mixed and forced convection Int. J. Therm. Sci. 178 2022 107624 10.1016/j.ijthermalsci.2022.107624 Acikgoz, O., Çolak, A. B., Camci, M., Karakoyun, Y., & Dalkilic, A. S. (2022). Machine learning approach to predict the heat transfer coefficients pertaining to a radiant cooling system coupled with mixed and forced convection. International Journal of Thermal Sciences, 178, 107624. DOI: 10.1016/j.ijthermalsci.2022.107624 [17] V. Verma R. Nath R. Tarodiya Heat transfer prediction for radiant floor heating/cooling systems using artificial neural network (ANN) Heat Transfer 52 4 2023 3135 3152 10.1002/htj.22820 Verma, V., Nath, R., & Tarodiya, R. (2023). Heat transfer prediction for radiant floor heating/cooling systems using artificial neural network (ANN). Heat Transfer, 52(4), 3135-3152. DOI: 10.1002/htj.22820 [18] L.S. Saoud H. AlMarzouqi Forecasting Solar Irradiance using Hybrid Stationary Wavelet Transform-Quaternion Valued Neural Network with a Softplus AMSGrad Learning Algorithm IEEE International Conference on Power Systems Technology 1\u20136 2022 10.1109/POWERCON53406.2022.9929612 Saoud, L. S., & AlMarzouqi, H. (2022). Forecasting Solar Irradiance using Hybrid Stationary Wavelet Transform-Quaternion Valued Neural Network with a Softplus AMSGrad Learning Algorithm. IEEE International Conference on Power Systems Technology, 1-6. DOI: 10.1109/POWERCON53406.2022.9929612 [19] Z. Zhang J. Liu G. Liu J. Wang J. Zhang Robustness verification of swish neural networks embedded in autonomous driving systems IEEE Trans. Comput. Social Syst. 2022 10.1109/TCSS.2022.3179659 Zhang, Z., Liu, J., Liu, G., Wang, J., & Zhang, J. (2022). Robustness verification of swish neural networks embedded in autonomous driving systems. IEEE Transactions on Computational Social Systems. DOI: 10.1109/TCSS.2022.3179659 [20] R.R. Devaram D. Beraldo R. De Benedictis M. Mongiovì A. Cesta LEMON: a lightweight facial emotion recognition system for assistive robotics based on dilated residual convolutional neural networks Sensors 22 9 2022 3366 10.3390/s22093366 Devaram, R. R., Beraldo, D., De Benedictis, R., Mongiovì, M., & Cesta, A. (2022). LEMON: a lightweight facial emotion recognition system for assistive robotics based on dilated residual convolutional neural networks. Sensors, 22(9), 3366. DOI: 10.3390/s22093366 [21] Y. Lockner C. Hopmann W. Zhao Transfer learning with artificial neural networks between injection molding processes and different polymer materials J. Manuf. Process. 73 2022 395 408 10.1016/j.jmapro.2021.11.014 Lockner, Y., Hopmann, C., & Zhao, W. (2022). Transfer learning with artificial neural networks between injection molding processes and different polymer materials. Journal of Manufacturing Processes, 73, 395-408. DOI: 10.1016/j.jmapro.2021.11.014 [22] J.E. Solís-Pérez J.A. Hernández A. Parrales J.F. Gómez-Aguilar A. Huicochea Artificial neural networks with conformable transfer function for improving the performance in thermal and environmental processes Neural Netw. 152 2022 44 56 10.1016/j.neunet.2022.04.016 Solís-Pérez, J. E., Hernández, J. A., Parrales, A., Gómez-Aguilar, J. F., & Huicochea, A. (2022). Artificial neural networks with conformable transfer function for improving the performance in thermal and environmental processes. Neural Networks, 152, 44-56. DOI: 10.1016/j.neunet.2022.04.016 [23] R. Khalil M. Al Horani A. Yousef M. Sababheh A new definition of fractional derivative J. Comput. Appl. Math. 264 2014 65 70 10.1016/j.cam.2014.01.002 Khalil, R., Al Horani, M., Yousef, A., & Sababheh, M. (2014). A new definition of fractional derivative.Journal of computational and applied mathematics,264, 65-70. DOI: 10.1016/j.cam.2014.01.002 [24] J. García-Morales M. Cervantes-Bobadilla J.A. Hernández-Pérez Y.I. Saavedra-Benítez M. Adam-Medina G.V. Guerrero-Ramírez Inverse artificial neural network control design for a double tube heat exchanger Case Studies in Thermal Engineering 34 2022 102075 10.1016/j.csite.2022.102075 García-Morales, J., Cervantes-Bobadilla, M., Hernández-Pérez, J. A., Saavedra-Benítez, Y. I., Adam-Medina, M., & Guerrero-Ramírez, G. V. (2022). Inverse artificial neural network control design for a double tube heat exchanger. Case Studies in Thermal Engineering, 34, 102075. DOI: 10.1016/j.csite.2022.102075 [25] W. Ajbar A. Parrales U. Cruz-Jacobo R.A. Conde-Gutiérrez A. Bassam O.A. Jaramillo J.A. Hernández The multivariable inverse artificial neural network combined with GA and PSO to improve the performance of solar parabolic trough collector Appl. Therm. Eng. 189 2021 116651 10.1016/j.applthermaleng.2021.116651 Ajbar, W., Parrales, A., Cruz-Jacobo, U., Conde-Gutiérrez, R. A., Bassam, A., Jaramillo, O. A., & Hernández, J. A. (2021). The multivariable inverse artificial neural network combined with GA and PSO to improve the performance of solar parabolic trough collector. Applied Thermal Engineering, 189, 116651. DOI: 10.1016/j.applthermaleng.2021.116651 [26] Y. Karakoyun O. Acikgoz A. Çebi A. Koca G. Çetin A.S. Dalkilic S. Wongwises A comprehensive approach to analyze the discrepancies in heat transfer characteristics pertaining to radiant ceiling heating system Appl. Therm. Eng. 187 2021 116517 10.1016/j.applthermaleng.2020.116517 Karakoyun, Y., Acikgoz, O., Çebi, A., Koca, A., Çetin, G., Dalkilic, A. S., & Wongwises, S. (2021). A comprehensive approach to analyze the discrepancies in heat transfer characteristics pertaining to radiant ceiling heating system. Applied Thermal Engineering, 187, 116517. DOI: 10.1016/j.applthermaleng.2020.116517 [27] X. Wu J. Zhao B.W. Olesen L. Fang F. Wang A new simplified model to calculate surface temperature and heat transfer of radiant floor heating and cooling systems Energ. Buildings 105 2015 285 293 10.1016/j.enbuild.2015.07.056 Wu, X., Zhao, J., Olesen, B. W., Fang, L., & Wang, F. (2015). A new simplified model to calculate surface temperature and heat transfer of radiant floor heating and cooling systems. Energy and buildings, 105, 285-293. DOI: 10.1016/j.enbuild.2015.07.056 [28] X. Jin X. Zhang Y. Luo R. Cao Numerical simulation of radiant floor cooling system: The effects of thermal resistance of pipe and water velocity on the performance Build. Environ. 45 11 2010 2545 2552 10.1016/j.buildenv.2010.05.016 Jin, X., Zhang, X., Luo, Y., & Cao, R. (2010). Numerical simulation of radiant floor cooling system: The effects of thermal resistance of pipe and water velocity on the performance. Building and Environment, 45(11), 2545-2552. DOI: 10.1016/j.buildenv.2010.05.016 [29] Q.Q. Li C. Chen Y. Zhang J. Lin H.S. Ling Simplified thermal calculation method for floor structure in radiant floor cooling system Energ. Buildings 74 2014 182 190 10.1016/j.enbuild.2014.01.032 Li, Q. Q., Chen, C., Zhang, Y., Lin, J., & Ling, H. S. (2014). Simplified thermal calculation method for floor structure in radiant floor cooling system. Energy and Buildings, 74, 182-190. DOI: 10.1016/j.enbuild.2014.01.032 [30] T. Cholewa M. Rosiński Z. Spik M.R. Dudzińska A. Siuta-Olcha On the heat transfer coefficients between heated/cooled radiant floor and room Energ. Buildings 66 2013 599 606 10.1016/j.enbuild.2013.07.065 Cholewa, T., Rosiński, M., Spik, Z., Dudzińska, M. R., & Siuta-Olcha, A. (2013). On the heat transfer coefficients between heated/cooled radiant floor and room. Energy and Buildings, 66, 599-606. DOI: 10.1016/j.enbuild.2013.07.065 [31] E.D. Reyes-Téllez A. Parrales G.E. Ramírez-Ramos J.A. Hernández G. Urquiza M.I. Heredia F.Z. Sierra Analysis of transfer functions and normalizations in an ANN model that predicts the transport of energy in a parabolic trough solar collector Desalin. Water Treat 200 2020 23 41 10.5004/dwt.2020.26063 Reyes-Téllez, E. D., Parrales, A., Ramírez-Ramos, G. E., Hernández, J. A., Urquiza, G., Heredia, M. I., & Sierra, F. Z. (2020). Analysis of transfer functions and normalizations in an ANN model that predicts the transport of energy in a parabolic trough solar collector. Desalin. Water Treat, 200, 23-41. DOI: 10.5004/dwt.2020.26063 [32] P. Stawicki I. Volosyak cVEP Training Data Validation\u2014Towards Optimal Training Set Composition from Multi-Day Data Brain Sci. 12 2 2022 234 10.3390/brainsci12020234 Stawicki, P., & Volosyak, I. (2022). cVEP Training Data Validation\u2014Towards Optimal Training Set Composition from Multi-Day Data. Brain Sciences, 12(2), 234. DOI: 10.3390/brainsci12020234 [33] R. Bousmaha R.M. Hamou A. Amine Automatic selection of hidden neurons and weights in neural networks for data classification using hybrid particle swarm optimization, multi-verse optimization based on Lévy flight Evol. Intel. 15 3 2022 1695 1714 10.1007/s12065-021-00579-w Bousmaha, R., Hamou, R. M., & Amine, A. (2022). Automatic selection of hidden neurons and weights in neural networks for data classification using hybrid particle swarm optimization, multi-verse optimization based on Lévy flight.Evolutionary Intelligence,15(3), 1695-1714. DOI: 10.1007/s12065-021-00579-w [34] Yogitha, R., & Mathivanan, G. (2018). Performance analysis of transfer functions in an artificial neural network. In 2018 International Conference on Communication and Signal Processing (ICCSP) (pp. 0393-0397). IEEE. DOI: 10.1109/ICCSP.2018.8524387. [35] Wiemann, P. F., Kneib, T., & Hambuckers, J. (2021). Using the softplus function to construct alternative link functions in generalized linear models and beyond. arXiv preprint arXiv:2111.14207. DOI: 10.48550/arXiv.2111.14207. [36] Meili, S. (2021). Softplus Penalty Functions for Constrained Optimization. arXiv preprint arXiv:2107.04541. DOI: 10.48550/arXiv.2107.04541. [37] Iida, M., Takeishi, Y., & Takeuchi, J. I. (2022). On Fisher Information Matrix for Simple Neural Networks with Softplus Activation. In 2022 IEEE International Symposium on Information Theory (ISIT) (pp. 3001-3006). IEEE. DOI: 10.1109/ISIT50566.2022.9834516. [38] S. Sagheb F.W. Liu A. Bahremand A. Kidane R. LiKamWa SWISH: A shifting-weight interface of simulated hydrodynamics for haptic perception of virtual fluid vessels In Proceedings of the 32nd Annual ACM Symposium on User Interface Software and Technology 2019 751 761 10.1145/3332165.3347870 Sagheb, S., Liu, F. W., Bahremand, A., Kidane, A., & LiKamWa, R. (2019). SWISH: A shifting-weight interface of simulated hydrodynamics for haptic perception of virtual fluid vessels. In Proceedings of the 32nd Annual ACM Symposium on User Interface Software and Technology (pp. 751-761). DOI: 10.1145/3332165.3347870 [39] Fatima, A., & Pethe, A. (2021). NVM device-based deep inference architecture using self-gated activation functions (Swish). In Machine Vision and Augmented Intelligence\u2014Theory and Applications: Select Proceedings of MAI 2021 (pp. 33-44). Springer Singapore. DOI: 10.1007/978-981-16-5078-9_4. [40] S. Sagheb A. Bahremand R. LiKamWa B. Lahey Swish: Shifting weight-based interfaces for simulated hydrodynamics in mixed-reality fluid vessels In Proceedings of the Thirteenth International Conference on Tangible, Embedded, and Embodied Interaction 2019 213 221 10.1145/3294109.3300988 Sagheb, S., Bahremand, A., LiKamWa, R., & Lahey, B. (2019). Swish: Shifting weight-based interfaces for simulated hydrodynamics in mixed-reality fluid vessels. In Proceedings of the Thirteenth International Conference on Tangible, Embedded, and Embodied Interaction (pp. 213-221). DOI: 10.1145/3294109.3300988 [41] B. Olimov S. Karshiev E. Jang S. Din A. Paul J. Kim Weight initialization based-rectified linear unit activation function to improve the performance of a convolutional neural network model Concurrency and Computation: Practice and Experience 33 22 2021 e6143 Olimov, B., Karshiev, S., Jang, E., Din, S., Paul, A., & Kim, J. (2021). Weight initialization based\u2010rectified linear unit activation function to improve the performance of a convolutional neural network model. Concurrency and Computation: Practice and Experience, 33(22), e6143. DOI: 10.1002/cpe.6143 [42] Y.D. Zhang S.C. Satapathy D. Wu D.S. Guttery J.M. Górriz S.H. Wang Improving ductal carcinoma in situ classification by convolutional neural network with exponential linear unit and rank-based weighted pooling Complex & Intelligent Systems 7 2021 1295 1310 10.1007/s40747-020-00218-4 Zhang, Y. D., Satapathy, S. C., Wu, D., Guttery, D. S., Górriz, J. M., & Wang, S. H. (2021). Improving ductal carcinoma in situ classification by convolutional neural network with exponential linear unit and rank-based weighted pooling. Complex & Intelligent Systems, 7, 1295-1310. DOI: 10.1007/s40747-020-00218-4 [43] D. Zhao M. Luo General conformable fractional derivative and its physical interpretation Calcolo 54 2017 903 917 10.1007/s10092-017-0213-8 D. Zhao, M. Luo. (2017). General conformable fractional derivative and its physical interpretation. Calcolo 54 903\u2013917, DOI: 10.1007/s10092-017-0213-8. [44] S. Verma Estadística básica para el manejo de datos experimentales: aplicación en la geoquímica:(geoquimiometría) 2005 Universidad Nacional Autónoma de México Verma, S. (2005). Estadística básica para el manejo de datos experimentales: aplicación en la geoquímica:(geoquimiometría). Universidad Nacional Autónoma de México. [45] Kumar, K., Khatkar, M., Sharma, K., Bhakhar, R., Chaudhary, P., Sateesh, N., Ramesh, G., Chhabra, S. & Maithili, K. (2023). Optimizations of Process Parameter for Erosion Wear Using Sustainable Machine Learning Approach. In E3S Web of Conferences (Vol. 430, p. 01178). EDP Sciences. DOI: 10.1051/e3sconf/202343001178. [46] D. Fitrianto C. Sari Rancang Bangun Alat Ukur Suhu Dan Kelembaban Tanah Menggunakan Arduino Uno Dengan Perhitungan Mape (Mean Absolute Percentage Error) Pada Lahan Perkebunan. ELECTRA: Electrical Engineering Articles 3 01 2022 19 27 http://doi.org/10.25273/electra.v3i01.13642 Fitrianto, D., & Sari, C. (2022). Rancang Bangun Alat Ukur Suhu Dan Kelembaban Tanah Menggunakan Arduino Uno Dengan Perhitungan Mape (Mean Absolute Percentage Error) Pada Lahan Perkebunan. ELECTRA: Electrical Engineering Articles, 3(01), 19-27. http://doi.org/10.25273/electra.v3i01.13642 [47] Cruz-Jacobo, U., Conde-Gutiérrez, R. A., Hernández, J. A., Silva-Martínez, S., Colorado, D., Juarez-Romero, D., & Álvarez-Gallegos, A. (2022). Optimization strategy to improve the removal efficiency of commercial herbicides using a multivariable inverse artificial neural network adapted with particle swarm optimization. DOI: 10.5004/dwt.2022.28972. [48] M. Cervantes-Bobadilla J. García-Morales R.F. Escobar-Jiménez J.A. Hernández-Pérez J.F. Gómez-Aguilar V.H. Olivares-Peregrino Experimental implementation of a new control approach using an inverse neural network to on-demand hydrogen production Control Eng. Pract. 105 2020 104631 10.1007/s40430-021-02862-4 Cervantes-Bobadilla, M., García-Morales, J., Escobar-Jiménez, R. F., Hernández-Pérez, J. A., Gómez-Aguilar, J. F., & Olivares-Peregrino, V. H. (2020). Experimental implementation of a new control approach using an inverse neural network to on-demand hydrogen production. Control Engineering Practice, 105, 104631. DOI: 10.1007/s40430-021-02862-4 [49] M. Cervantes-Bobadilla J.A. Hernández-Pérez D. Juárez-Romero A. Bassam J. García-Morales A. Huicochea O.A. Jaramillo Control scheme formulation for a parabolic trough collector using inverse artificial neural networks and particle swarm optimization J. Braz. Soc. Mech. Sci. Eng. 43 2021 1 14 10.1016/j.conengprac.2020.104631 Cervantes-Bobadilla, M., Hernández-Pérez, J. A., Juárez-Romero, D., Bassam, A., García-Morales, J., Huicochea, A., & Jaramillo, O. A. (2021). Control scheme formulation for a parabolic trough collector using inverse artificial neural networks and particle swarm optimization. Journal of the Brazilian Society of Mechanical Sciences and Engineering, 43, 1-14. DOI: 10.1016/j.conengprac.2020.104631 [50] R.A. Conde-Gutiérrez U. Cruz-Jacobo A. Huicochea S.R. Casolco J.A. Hernández Optimal multivariable conditions in the operation of an absorption heat transformer with energy recycling solved by the genetic algorithm in artificial neural network inverse Appl. Soft Comput. 72 2018 218 234 10.1016/j.asoc.2018.08.008 Conde-Gutiérrez, R. A., Cruz-Jacobo, U., Huicochea, A., Casolco, S. R., & Hernández, J. A. (2018). Optimal multivariable conditions in the operation of an absorption heat transformer with energy recycling solved by the genetic algorithm in artificial neural network inverse. Applied Soft Computing, 72, 218-234. DOI: 10.1016/j.asoc.2018.08.008 [51] E.M. Novoa-del-Toro E. Mezura-Montes M. Vignes M. Térézol F. Magdinier L. Tichit A. Baudot A multi-objective genetic algorithm to find active modules in multiplex biological networks PLoS Comput. Biol. 17 8 2021 e1009263 Novoa-del-Toro, E. M., Mezura-Montes, E., Vignes, M., Térézol, M., Magdinier, F., Tichit, L., & Baudot, A. (2021). A multi-objective genetic algorithm to find active modules in multiplex biological networks. PLoS computational biology, 17(8), e1009263. DOI: 10.1371/journal.pcbi.1009263 [52] G. Carmona-Arroyo M. Quiroz-Castellanos E. Mezura-Montes Variable decomposition for large-scale constrained optimization problems using a grouping genetic algorithm Mathematical and Computational Applications 27 2 2022 23 10.3390/mca27020023 Carmona-Arroyo, G., Quiroz-Castellanos, M., & Mezura-Montes, E. (2022). Variable decomposition for large-scale constrained optimization problems using a grouping genetic algorithm. Mathematical and Computational Applications, 27(2), 23. DOI: 10.3390/mca27020023 [53] Arora, G., Chauhan, P., Asjad, M. I., Joshi, V., Emadifar, H., & Jarad, F. (2023). Particle swarm optimization for solving sine-gordan equation. DOI: 10.32604/csse.2023.032404. [54] M. Zhao H. Zhao M. Zhao Particle swarm optimization algorithm with adaptive two-population strategy IEEE Access 2023 10.1109/ACCESS.2023.3287859 Zhao, M., Zhao, H., & Zhao, M. (2023). Particle swarm optimization algorithm with adaptive two-population strategy. IEEE Access. DOI: 10.1109/ACCESS.2023.3287859 [55] Veeraiah, V., Khan, H., Kumar, A., Ahamad, S., Mahajan, A., & Gupta, A. (2022). Integration of PSO and deep learning for trend analysis of meta-verse. In 2022 2nd International Conference on Advance Computing and Innovative Technologies in Engineering (ICACITE) (pp. 713-718). IEEE. DOI: 10.1109/ICACITE53722.2022.9823883. [56] L. Scrucca GA: A package for genetic algorithms in R J. Stat. Softw. 53 2013 1 37 10.18637/jss.v053.i04 Scrucca, L. (2013). GA: A package for genetic algorithms in R. Journal of Statistical Software, 53, 1-37. DOI: 10.18637/jss.v053.i04 [57] Samala, R. K. (2023). Particle Swarm Optimization. In Swarm Intelligence-Recent Advances and Current Applications. IntechOpen. DOI: 10.5772/intechopen.107156. [58] Passive House. (2022). Criteria and Algorithms for Certified Passive House Components: Opaque construction systems. https://passiv.de/downloads/03_certification_criteria_construction_systems_en.pdf. [59] NASA. POWER | DAVe 2021. https://power.larc.nasa.gov/beta/data-access-viewer/. (Accessed 23 April 2024). [60] American Society of Heating, Refrigerating and Air-Conditioning Engineers. (2021). ASHRAE Handbook\u2014Fundamentals (SI Edition). American Society of Heating, Refrigerating and Air-Conditioning Engineers, Inc.",
    "scopus-id": "85208202177",
    "coredata": {
        "eid": "1-s2.0-S0378778824010843",
        "dc:description": "This study introduces an innovative methodology that integrates Inverse Conformable Artificial Neural Networks (CANNi) with Genetic Algorithms (GA) or Particle Swarm Optimization (PSO) to optimize thermal comfort in buildings. Emphasizing the efficacy of conformable transfer functions within CANNi, the research relies on a comprehensive dataset to forecast heat transfer across diverse climates. Notably, the methodology stands out for its meticulous model selection process, employing slope-intercept tests to ensure robust predictability (99%) and strong correlation between input and output variables. The selected model exhibits an optimal equilibrium between predictive precision and computational efficiency, reaching an R-value of 0.9992 with low RMSE (0.0078) and MAPE (2.1099). Such performance enables precise calibration of Radiant Floor Heating Systems (RFH) for enhanced comfort and marks a significant stride toward bolstering energy efficiency and sustainability within the construction sector. These findings advocate for more efficient utilization of energy resources in buildings, adeptly accommodating climatic fluctuations and enhancing the inhabitants\u2019 quality of life.",
        "openArchiveArticle": "false",
        "prism:coverDate": "2024-12-15",
        "openaccessUserLicense": null,
        "prism:aggregationType": "Journal",
        "prism:url": "https://api.elsevier.com/content/article/pii/S0378778824010843",
        "dc:creator": [
            {
                "@_fa": "true",
                "$": "Mata, A.I."
            },
            {
                "@_fa": "true",
                "$": "Johnson, J.I."
            },
            {
                "@_fa": "true",
                "$": "Parrales, A."
            },
            {
                "@_fa": "true",
                "$": "Solís-Pérez, J.E."
            },
            {
                "@_fa": "true",
                "$": "Huicochea, A."
            },
            {
                "@_fa": "true",
                "$": "Hernandez, J.A."
            }
        ],
        "link": [
            {
                "@_fa": "true",
                "@rel": "self",
                "@href": "https://api.elsevier.com/content/article/pii/S0378778824010843"
            },
            {
                "@_fa": "true",
                "@rel": "scidir",
                "@href": "https://www.sciencedirect.com/science/article/pii/S0378778824010843"
            }
        ],
        "dc:format": "application/json",
        "openaccessType": null,
        "pii": "S0378-7788(24)01084-3",
        "prism:volume": "325",
        "articleNumber": "114968",
        "prism:publisher": "Elsevier B.V. All rights are reserved, including those for text and data mining, AI training, and similar technologies.",
        "dc:title": "Radiant heating systems control in buildings via Inverse Conformable Artificial Neural Networks and optimization techniques",
        "prism:copyright": "© 2024 Elsevier B.V. All rights are reserved, including those for text and data mining, AI training, and similar technologies.",
        "openaccess": "0",
        "prism:issn": "03787788",
        "dcterms:subject": [
            {
                "@_fa": "true",
                "$": "Inverse conformable artificial neuronal networks"
            },
            {
                "@_fa": "true",
                "$": "Genetic algorithms"
            },
            {
                "@_fa": "true",
                "$": "Heat transfer"
            },
            {
                "@_fa": "true",
                "$": "Radiant floor"
            },
            {
                "@_fa": "true",
                "$": "Particle swarm optimization"
            }
        ],
        "openaccessArticle": "false",
        "prism:publicationName": "Energy and Buildings",
        "openaccessSponsorType": null,
        "prism:pageRange": "114968",
        "pubType": "fla",
        "prism:coverDisplayDate": "15 December 2024",
        "prism:doi": "10.1016/j.enbuild.2024.114968",
        "prism:startingPage": "114968",
        "dc:identifier": "doi:10.1016/j.enbuild.2024.114968",
        "openaccessSponsorName": null
    },
    "objects": {"object": [
        {
            "@category": "standard",
            "@height": "506",
            "@width": "791",
            "@_fa": "true",
            "$": "https://api.elsevier.com/content/object/eid/1-s2.0-S0378778824010843-gr3.jpg?httpAccept=%2A%2F%2A",
            "@multimediatype": "JPEG image file",
            "@type": "IMAGE-DOWNSAMPLED",
            "@size": "67833",
            "@ref": "gr3",
            "@mimetype": "image/jpeg"
        },
        {
            "@category": "standard",
            "@height": "288",
            "@width": "758",
            "@_fa": "true",
            "$": "https://api.elsevier.com/content/object/eid/1-s2.0-S0378778824010843-gr2.jpg?httpAccept=%2A%2F%2A",
            "@multimediatype": "JPEG image file",
            "@type": "IMAGE-DOWNSAMPLED",
            "@size": "39828",
            "@ref": "gr2",
            "@mimetype": "image/jpeg"
        },
        {
            "@category": "standard",
            "@height": "475",
            "@width": "533",
            "@_fa": "true",
            "$": "https://api.elsevier.com/content/object/eid/1-s2.0-S0378778824010843-gr1.jpg?httpAccept=%2A%2F%2A",
            "@multimediatype": "JPEG image file",
            "@type": "IMAGE-DOWNSAMPLED",
            "@size": "59217",
            "@ref": "gr1",
            "@mimetype": "image/jpeg"
        },
        {
            "@category": "standard",
            "@height": "315",
            "@width": "628",
            "@_fa": "true",
            "$": "https://api.elsevier.com/content/object/eid/1-s2.0-S0378778824010843-gr10.jpg?httpAccept=%2A%2F%2A",
            "@multimediatype": "JPEG image file",
            "@type": "IMAGE-DOWNSAMPLED",
            "@size": "24837",
            "@ref": "gr10",
            "@mimetype": "image/jpeg"
        },
        {
            "@category": "standard",
            "@height": "387",
            "@width": "628",
            "@_fa": "true",
            "$": "https://api.elsevier.com/content/object/eid/1-s2.0-S0378778824010843-gr20.jpg?httpAccept=%2A%2F%2A",
            "@multimediatype": "JPEG image file",
            "@type": "IMAGE-DOWNSAMPLED",
            "@size": "36577",
            "@ref": "gr20",
            "@mimetype": "image/jpeg"
        },
        {
            "@category": "standard",
            "@height": "315",
            "@width": "628",
            "@_fa": "true",
            "$": "https://api.elsevier.com/content/object/eid/1-s2.0-S0378778824010843-gr9.jpg?httpAccept=%2A%2F%2A",
            "@multimediatype": "JPEG image file",
            "@type": "IMAGE-DOWNSAMPLED",
            "@size": "25756",
            "@ref": "gr9",
            "@mimetype": "image/jpeg"
        },
        {
            "@category": "standard",
            "@height": "253",
            "@width": "628",
            "@_fa": "true",
            "$": "https://api.elsevier.com/content/object/eid/1-s2.0-S0378778824010843-gr8.jpg?httpAccept=%2A%2F%2A",
            "@multimediatype": "JPEG image file",
            "@type": "IMAGE-DOWNSAMPLED",
            "@size": "37293",
            "@ref": "gr8",
            "@mimetype": "image/jpeg"
        },
        {
            "@category": "standard",
            "@height": "435",
            "@width": "538",
            "@_fa": "true",
            "$": "https://api.elsevier.com/content/object/eid/1-s2.0-S0378778824010843-gr7.jpg?httpAccept=%2A%2F%2A",
            "@multimediatype": "JPEG image file",
            "@type": "IMAGE-DOWNSAMPLED",
            "@size": "49495",
            "@ref": "gr7",
            "@mimetype": "image/jpeg"
        },
        {
            "@category": "standard",
            "@height": "441",
            "@width": "716",
            "@_fa": "true",
            "$": "https://api.elsevier.com/content/object/eid/1-s2.0-S0378778824010843-gr14.jpg?httpAccept=%2A%2F%2A",
            "@multimediatype": "JPEG image file",
            "@type": "IMAGE-DOWNSAMPLED",
            "@size": "36851",
            "@ref": "gr14",
            "@mimetype": "image/jpeg"
        },
        {
            "@category": "standard",
            "@height": "517",
            "@width": "535",
            "@_fa": "true",
            "$": "https://api.elsevier.com/content/object/eid/1-s2.0-S0378778824010843-gr6.jpg?httpAccept=%2A%2F%2A",
            "@multimediatype": "JPEG image file",
            "@type": "IMAGE-DOWNSAMPLED",
            "@size": "51273",
            "@ref": "gr6",
            "@mimetype": "image/jpeg"
        },
        {
            "@category": "standard",
            "@height": "447",
            "@width": "725",
            "@_fa": "true",
            "$": "https://api.elsevier.com/content/object/eid/1-s2.0-S0378778824010843-gr13.jpg?httpAccept=%2A%2F%2A",
            "@multimediatype": "JPEG image file",
            "@type": "IMAGE-DOWNSAMPLED",
            "@size": "36598",
            "@ref": "gr13",
            "@mimetype": "image/jpeg"
        },
        {
            "@category": "standard",
            "@height": "530",
            "@width": "535",
            "@_fa": "true",
            "$": "https://api.elsevier.com/content/object/eid/1-s2.0-S0378778824010843-gr5.jpg?httpAccept=%2A%2F%2A",
            "@multimediatype": "JPEG image file",
            "@type": "IMAGE-DOWNSAMPLED",
            "@size": "51417",
            "@ref": "gr5",
            "@mimetype": "image/jpeg"
        },
        {
            "@category": "standard",
            "@height": "442",
            "@width": "718",
            "@_fa": "true",
            "$": "https://api.elsevier.com/content/object/eid/1-s2.0-S0378778824010843-gr12.jpg?httpAccept=%2A%2F%2A",
            "@multimediatype": "JPEG image file",
            "@type": "IMAGE-DOWNSAMPLED",
            "@size": "38569",
            "@ref": "gr12",
            "@mimetype": "image/jpeg"
        },
        {
            "@category": "standard",
            "@height": "514",
            "@width": "535",
            "@_fa": "true",
            "$": "https://api.elsevier.com/content/object/eid/1-s2.0-S0378778824010843-gr4.jpg?httpAccept=%2A%2F%2A",
            "@multimediatype": "JPEG image file",
            "@type": "IMAGE-DOWNSAMPLED",
            "@size": "48473",
            "@ref": "gr4",
            "@mimetype": "image/jpeg"
        },
        {
            "@category": "standard",
            "@height": "315",
            "@width": "628",
            "@_fa": "true",
            "$": "https://api.elsevier.com/content/object/eid/1-s2.0-S0378778824010843-gr11.jpg?httpAccept=%2A%2F%2A",
            "@multimediatype": "JPEG image file",
            "@type": "IMAGE-DOWNSAMPLED",
            "@size": "26293",
            "@ref": "gr11",
            "@mimetype": "image/jpeg"
        },
        {
            "@category": "standard",
            "@height": "387",
            "@width": "628",
            "@_fa": "true",
            "$": "https://api.elsevier.com/content/object/eid/1-s2.0-S0378778824010843-gr18.jpg?httpAccept=%2A%2F%2A",
            "@multimediatype": "JPEG image file",
            "@type": "IMAGE-DOWNSAMPLED",
            "@size": "36193",
            "@ref": "gr18",
            "@mimetype": "image/jpeg"
        },
        {
            "@category": "standard",
            "@height": "384",
            "@width": "711",
            "@_fa": "true",
            "$": "https://api.elsevier.com/content/object/eid/1-s2.0-S0378778824010843-gr17.jpg?httpAccept=%2A%2F%2A",
            "@multimediatype": "JPEG image file",
            "@type": "IMAGE-DOWNSAMPLED",
            "@size": "69843",
            "@ref": "gr17",
            "@mimetype": "image/jpeg"
        },
        {
            "@category": "standard",
            "@height": "406",
            "@width": "711",
            "@_fa": "true",
            "$": "https://api.elsevier.com/content/object/eid/1-s2.0-S0378778824010843-gr16.jpg?httpAccept=%2A%2F%2A",
            "@multimediatype": "JPEG image file",
            "@type": "IMAGE-DOWNSAMPLED",
            "@size": "70815",
            "@ref": "gr16",
            "@mimetype": "image/jpeg"
        },
        {
            "@category": "standard",
            "@height": "406",
            "@width": "711",
            "@_fa": "true",
            "$": "https://api.elsevier.com/content/object/eid/1-s2.0-S0378778824010843-gr15.jpg?httpAccept=%2A%2F%2A",
            "@multimediatype": "JPEG image file",
            "@type": "IMAGE-DOWNSAMPLED",
            "@size": "74826",
            "@ref": "gr15",
            "@mimetype": "image/jpeg"
        },
        {
            "@category": "standard",
            "@height": "387",
            "@width": "628",
            "@_fa": "true",
            "$": "https://api.elsevier.com/content/object/eid/1-s2.0-S0378778824010843-gr19.jpg?httpAccept=%2A%2F%2A",
            "@multimediatype": "JPEG image file",
            "@type": "IMAGE-DOWNSAMPLED",
            "@size": "37275",
            "@ref": "gr19",
            "@mimetype": "image/jpeg"
        },
        {
            "@category": "thumbnail",
            "@height": "140",
            "@width": "219",
            "@_fa": "true",
            "$": "https://api.elsevier.com/content/object/eid/1-s2.0-S0378778824010843-gr3.sml?httpAccept=%2A%2F%2A",
            "@multimediatype": "GIF image file",
            "@type": "IMAGE-THUMBNAIL",
            "@size": "7694",
            "@ref": "gr3",
            "@mimetype": "image/gif"
        },
        {
            "@category": "thumbnail",
            "@height": "83",
            "@width": "219",
            "@_fa": "true",
            "$": "https://api.elsevier.com/content/object/eid/1-s2.0-S0378778824010843-gr2.sml?httpAccept=%2A%2F%2A",
            "@multimediatype": "GIF image file",
            "@type": "IMAGE-THUMBNAIL",
            "@size": "5161",
            "@ref": "gr2",
            "@mimetype": "image/gif"
        },
        {
            "@category": "thumbnail",
            "@height": "164",
            "@width": "184",
            "@_fa": "true",
            "$": "https://api.elsevier.com/content/object/eid/1-s2.0-S0378778824010843-gr1.sml?httpAccept=%2A%2F%2A",
            "@multimediatype": "GIF image file",
            "@type": "IMAGE-THUMBNAIL",
            "@size": "16815",
            "@ref": "gr1",
            "@mimetype": "image/gif"
        },
        {
            "@category": "thumbnail",
            "@height": "110",
            "@width": "219",
            "@_fa": "true",
            "$": "https://api.elsevier.com/content/object/eid/1-s2.0-S0378778824010843-gr10.sml?httpAccept=%2A%2F%2A",
            "@multimediatype": "GIF image file",
            "@type": "IMAGE-THUMBNAIL",
            "@size": "3558",
            "@ref": "gr10",
            "@mimetype": "image/gif"
        },
        {
            "@category": "thumbnail",
            "@height": "135",
            "@width": "219",
            "@_fa": "true",
            "$": "https://api.elsevier.com/content/object/eid/1-s2.0-S0378778824010843-gr20.sml?httpAccept=%2A%2F%2A",
            "@multimediatype": "GIF image file",
            "@type": "IMAGE-THUMBNAIL",
            "@size": "6157",
            "@ref": "gr20",
            "@mimetype": "image/gif"
        },
        {
            "@category": "thumbnail",
            "@height": "110",
            "@width": "219",
            "@_fa": "true",
            "$": "https://api.elsevier.com/content/object/eid/1-s2.0-S0378778824010843-gr9.sml?httpAccept=%2A%2F%2A",
            "@multimediatype": "GIF image file",
            "@type": "IMAGE-THUMBNAIL",
            "@size": "3714",
            "@ref": "gr9",
            "@mimetype": "image/gif"
        },
        {
            "@category": "thumbnail",
            "@height": "88",
            "@width": "219",
            "@_fa": "true",
            "$": "https://api.elsevier.com/content/object/eid/1-s2.0-S0378778824010843-gr8.sml?httpAccept=%2A%2F%2A",
            "@multimediatype": "GIF image file",
            "@type": "IMAGE-THUMBNAIL",
            "@size": "5732",
            "@ref": "gr8",
            "@mimetype": "image/gif"
        },
        {
            "@category": "thumbnail",
            "@height": "164",
            "@width": "203",
            "@_fa": "true",
            "$": "https://api.elsevier.com/content/object/eid/1-s2.0-S0378778824010843-gr7.sml?httpAccept=%2A%2F%2A",
            "@multimediatype": "GIF image file",
            "@type": "IMAGE-THUMBNAIL",
            "@size": "6630",
            "@ref": "gr7",
            "@mimetype": "image/gif"
        },
        {
            "@category": "thumbnail",
            "@height": "135",
            "@width": "219",
            "@_fa": "true",
            "$": "https://api.elsevier.com/content/object/eid/1-s2.0-S0378778824010843-gr14.sml?httpAccept=%2A%2F%2A",
            "@multimediatype": "GIF image file",
            "@type": "IMAGE-THUMBNAIL",
            "@size": "5682",
            "@ref": "gr14",
            "@mimetype": "image/gif"
        },
        {
            "@category": "thumbnail",
            "@height": "163",
            "@width": "169",
            "@_fa": "true",
            "$": "https://api.elsevier.com/content/object/eid/1-s2.0-S0378778824010843-gr6.sml?httpAccept=%2A%2F%2A",
            "@multimediatype": "GIF image file",
            "@type": "IMAGE-THUMBNAIL",
            "@size": "7459",
            "@ref": "gr6",
            "@mimetype": "image/gif"
        },
        {
            "@category": "thumbnail",
            "@height": "135",
            "@width": "219",
            "@_fa": "true",
            "$": "https://api.elsevier.com/content/object/eid/1-s2.0-S0378778824010843-gr13.sml?httpAccept=%2A%2F%2A",
            "@multimediatype": "GIF image file",
            "@type": "IMAGE-THUMBNAIL",
            "@size": "5432",
            "@ref": "gr13",
            "@mimetype": "image/gif"
        },
        {
            "@category": "thumbnail",
            "@height": "163",
            "@width": "165",
            "@_fa": "true",
            "$": "https://api.elsevier.com/content/object/eid/1-s2.0-S0378778824010843-gr5.sml?httpAccept=%2A%2F%2A",
            "@multimediatype": "GIF image file",
            "@type": "IMAGE-THUMBNAIL",
            "@size": "7296",
            "@ref": "gr5",
            "@mimetype": "image/gif"
        },
        {
            "@category": "thumbnail",
            "@height": "135",
            "@width": "219",
            "@_fa": "true",
            "$": "https://api.elsevier.com/content/object/eid/1-s2.0-S0378778824010843-gr12.sml?httpAccept=%2A%2F%2A",
            "@multimediatype": "GIF image file",
            "@type": "IMAGE-THUMBNAIL",
            "@size": "5769",
            "@ref": "gr12",
            "@mimetype": "image/gif"
        },
        {
            "@category": "thumbnail",
            "@height": "163",
            "@width": "170",
            "@_fa": "true",
            "$": "https://api.elsevier.com/content/object/eid/1-s2.0-S0378778824010843-gr4.sml?httpAccept=%2A%2F%2A",
            "@multimediatype": "GIF image file",
            "@type": "IMAGE-THUMBNAIL",
            "@size": "7200",
            "@ref": "gr4",
            "@mimetype": "image/gif"
        },
        {
            "@category": "thumbnail",
            "@height": "110",
            "@width": "219",
            "@_fa": "true",
            "$": "https://api.elsevier.com/content/object/eid/1-s2.0-S0378778824010843-gr11.sml?httpAccept=%2A%2F%2A",
            "@multimediatype": "GIF image file",
            "@type": "IMAGE-THUMBNAIL",
            "@size": "3673",
            "@ref": "gr11",
            "@mimetype": "image/gif"
        },
        {
            "@category": "thumbnail",
            "@height": "135",
            "@width": "219",
            "@_fa": "true",
            "$": "https://api.elsevier.com/content/object/eid/1-s2.0-S0378778824010843-gr18.sml?httpAccept=%2A%2F%2A",
            "@multimediatype": "GIF image file",
            "@type": "IMAGE-THUMBNAIL",
            "@size": "6159",
            "@ref": "gr18",
            "@mimetype": "image/gif"
        },
        {
            "@category": "thumbnail",
            "@height": "118",
            "@width": "219",
            "@_fa": "true",
            "$": "https://api.elsevier.com/content/object/eid/1-s2.0-S0378778824010843-gr17.sml?httpAccept=%2A%2F%2A",
            "@multimediatype": "GIF image file",
            "@type": "IMAGE-THUMBNAIL",
            "@size": "7059",
            "@ref": "gr17",
            "@mimetype": "image/gif"
        },
        {
            "@category": "thumbnail",
            "@height": "125",
            "@width": "219",
            "@_fa": "true",
            "$": "https://api.elsevier.com/content/object/eid/1-s2.0-S0378778824010843-gr16.sml?httpAccept=%2A%2F%2A",
            "@multimediatype": "GIF image file",
            "@type": "IMAGE-THUMBNAIL",
            "@size": "7664",
            "@ref": "gr16",
            "@mimetype": "image/gif"
        },
        {
            "@category": "thumbnail",
            "@height": "125",
            "@width": "219",
            "@_fa": "true",
            "$": "https://api.elsevier.com/content/object/eid/1-s2.0-S0378778824010843-gr15.sml?httpAccept=%2A%2F%2A",
            "@multimediatype": "GIF image file",
            "@type": "IMAGE-THUMBNAIL",
            "@size": "7742",
            "@ref": "gr15",
            "@mimetype": "image/gif"
        },
        {
            "@category": "thumbnail",
            "@height": "135",
            "@width": "219",
            "@_fa": "true",
            "$": "https://api.elsevier.com/content/object/eid/1-s2.0-S0378778824010843-gr19.sml?httpAccept=%2A%2F%2A",
            "@multimediatype": "GIF image file",
            "@type": "IMAGE-THUMBNAIL",
            "@size": "6484",
            "@ref": "gr19",
            "@mimetype": "image/gif"
        },
        {
            "@category": "high",
            "@height": "2243",
            "@width": "3504",
            "@_fa": "true",
            "$": "https://api.elsevier.com/content/object/eid/1-s2.0-S0378778824010843-gr3_lrg.jpg?httpAccept=%2A%2F%2A",
            "@multimediatype": "JPEG image file",
            "@type": "IMAGE-HIGH-RES",
            "@size": "483020",
            "@ref": "gr3",
            "@mimetype": "image/jpeg"
        },
        {
            "@category": "high",
            "@height": "1278",
            "@width": "3358",
            "@_fa": "true",
            "$": "https://api.elsevier.com/content/object/eid/1-s2.0-S0378778824010843-gr2_lrg.jpg?httpAccept=%2A%2F%2A",
            "@multimediatype": "JPEG image file",
            "@type": "IMAGE-HIGH-RES",
            "@size": "208700",
            "@ref": "gr2",
            "@mimetype": "image/jpeg"
        },
        {
            "@category": "high",
            "@height": "1317",
            "@width": "1479",
            "@_fa": "true",
            "$": "https://api.elsevier.com/content/object/eid/1-s2.0-S0378778824010843-gr1_lrg.jpg?httpAccept=%2A%2F%2A",
            "@multimediatype": "JPEG image file",
            "@type": "IMAGE-HIGH-RES",
            "@size": "188242",
            "@ref": "gr1",
            "@mimetype": "image/jpeg"
        },
        {
            "@category": "high",
            "@height": "1396",
            "@width": "2781",
            "@_fa": "true",
            "$": "https://api.elsevier.com/content/object/eid/1-s2.0-S0378778824010843-gr10_lrg.jpg?httpAccept=%2A%2F%2A",
            "@multimediatype": "JPEG image file",
            "@type": "IMAGE-HIGH-RES",
            "@size": "128188",
            "@ref": "gr10",
            "@mimetype": "image/jpeg"
        },
        {
            "@category": "high",
            "@height": "1714",
            "@width": "2782",
            "@_fa": "true",
            "$": "https://api.elsevier.com/content/object/eid/1-s2.0-S0378778824010843-gr20_lrg.jpg?httpAccept=%2A%2F%2A",
            "@multimediatype": "JPEG image file",
            "@type": "IMAGE-HIGH-RES",
            "@size": "261644",
            "@ref": "gr20",
            "@mimetype": "image/jpeg"
        },
        {
            "@category": "high",
            "@height": "1396",
            "@width": "2781",
            "@_fa": "true",
            "$": "https://api.elsevier.com/content/object/eid/1-s2.0-S0378778824010843-gr9_lrg.jpg?httpAccept=%2A%2F%2A",
            "@multimediatype": "JPEG image file",
            "@type": "IMAGE-HIGH-RES",
            "@size": "134731",
            "@ref": "gr9",
            "@mimetype": "image/jpeg"
        },
        {
            "@category": "high",
            "@height": "1122",
            "@width": "2780",
            "@_fa": "true",
            "$": "https://api.elsevier.com/content/object/eid/1-s2.0-S0378778824010843-gr8_lrg.jpg?httpAccept=%2A%2F%2A",
            "@multimediatype": "JPEG image file",
            "@type": "IMAGE-HIGH-RES",
            "@size": "205125",
            "@ref": "gr8",
            "@mimetype": "image/jpeg"
        },
        {
            "@category": "high",
            "@height": "1926",
            "@width": "2382",
            "@_fa": "true",
            "$": "https://api.elsevier.com/content/object/eid/1-s2.0-S0378778824010843-gr7_lrg.jpg?httpAccept=%2A%2F%2A",
            "@multimediatype": "JPEG image file",
            "@type": "IMAGE-HIGH-RES",
            "@size": "315804",
            "@ref": "gr7",
            "@mimetype": "image/jpeg"
        },
        {
            "@category": "high",
            "@height": "1954",
            "@width": "3171",
            "@_fa": "true",
            "$": "https://api.elsevier.com/content/object/eid/1-s2.0-S0378778824010843-gr14_lrg.jpg?httpAccept=%2A%2F%2A",
            "@multimediatype": "JPEG image file",
            "@type": "IMAGE-HIGH-RES",
            "@size": "189505",
            "@ref": "gr14",
            "@mimetype": "image/jpeg"
        },
        {
            "@category": "high",
            "@height": "2288",
            "@width": "2368",
            "@_fa": "true",
            "$": "https://api.elsevier.com/content/object/eid/1-s2.0-S0378778824010843-gr6_lrg.jpg?httpAccept=%2A%2F%2A",
            "@multimediatype": "JPEG image file",
            "@type": "IMAGE-HIGH-RES",
            "@size": "245260",
            "@ref": "gr6",
            "@mimetype": "image/jpeg"
        },
        {
            "@category": "high",
            "@height": "1979",
            "@width": "3212",
            "@_fa": "true",
            "$": "https://api.elsevier.com/content/object/eid/1-s2.0-S0378778824010843-gr13_lrg.jpg?httpAccept=%2A%2F%2A",
            "@multimediatype": "JPEG image file",
            "@type": "IMAGE-HIGH-RES",
            "@size": "189622",
            "@ref": "gr13",
            "@mimetype": "image/jpeg"
        },
        {
            "@category": "high",
            "@height": "2344",
            "@width": "2368",
            "@_fa": "true",
            "$": "https://api.elsevier.com/content/object/eid/1-s2.0-S0378778824010843-gr5_lrg.jpg?httpAccept=%2A%2F%2A",
            "@multimediatype": "JPEG image file",
            "@type": "IMAGE-HIGH-RES",
            "@size": "247687",
            "@ref": "gr5",
            "@mimetype": "image/jpeg"
        },
        {
            "@category": "high",
            "@height": "1960",
            "@width": "3181",
            "@_fa": "true",
            "$": "https://api.elsevier.com/content/object/eid/1-s2.0-S0378778824010843-gr12_lrg.jpg?httpAccept=%2A%2F%2A",
            "@multimediatype": "JPEG image file",
            "@type": "IMAGE-HIGH-RES",
            "@size": "201993",
            "@ref": "gr12",
            "@mimetype": "image/jpeg"
        },
        {
            "@category": "high",
            "@height": "2276",
            "@width": "2368",
            "@_fa": "true",
            "$": "https://api.elsevier.com/content/object/eid/1-s2.0-S0378778824010843-gr4_lrg.jpg?httpAccept=%2A%2F%2A",
            "@multimediatype": "JPEG image file",
            "@type": "IMAGE-HIGH-RES",
            "@size": "240795",
            "@ref": "gr4",
            "@mimetype": "image/jpeg"
        },
        {
            "@category": "high",
            "@height": "1396",
            "@width": "2781",
            "@_fa": "true",
            "$": "https://api.elsevier.com/content/object/eid/1-s2.0-S0378778824010843-gr11_lrg.jpg?httpAccept=%2A%2F%2A",
            "@multimediatype": "JPEG image file",
            "@type": "IMAGE-HIGH-RES",
            "@size": "137121",
            "@ref": "gr11",
            "@mimetype": "image/jpeg"
        },
        {
            "@category": "high",
            "@height": "1714",
            "@width": "2782",
            "@_fa": "true",
            "$": "https://api.elsevier.com/content/object/eid/1-s2.0-S0378778824010843-gr18_lrg.jpg?httpAccept=%2A%2F%2A",
            "@multimediatype": "JPEG image file",
            "@type": "IMAGE-HIGH-RES",
            "@size": "258056",
            "@ref": "gr18",
            "@mimetype": "image/jpeg"
        },
        {
            "@category": "high",
            "@height": "1703",
            "@width": "3150",
            "@_fa": "true",
            "$": "https://api.elsevier.com/content/object/eid/1-s2.0-S0378778824010843-gr17_lrg.jpg?httpAccept=%2A%2F%2A",
            "@multimediatype": "JPEG image file",
            "@type": "IMAGE-HIGH-RES",
            "@size": "487101",
            "@ref": "gr17",
            "@mimetype": "image/jpeg"
        },
        {
            "@category": "high",
            "@height": "1798",
            "@width": "3150",
            "@_fa": "true",
            "$": "https://api.elsevier.com/content/object/eid/1-s2.0-S0378778824010843-gr16_lrg.jpg?httpAccept=%2A%2F%2A",
            "@multimediatype": "JPEG image file",
            "@type": "IMAGE-HIGH-RES",
            "@size": "511771",
            "@ref": "gr16",
            "@mimetype": "image/jpeg"
        },
        {
            "@category": "high",
            "@height": "1799",
            "@width": "3150",
            "@_fa": "true",
            "$": "https://api.elsevier.com/content/object/eid/1-s2.0-S0378778824010843-gr15_lrg.jpg?httpAccept=%2A%2F%2A",
            "@multimediatype": "JPEG image file",
            "@type": "IMAGE-HIGH-RES",
            "@size": "508869",
            "@ref": "gr15",
            "@mimetype": "image/jpeg"
        },
        {
            "@category": "high",
            "@height": "1714",
            "@width": "2782",
            "@_fa": "true",
            "$": "https://api.elsevier.com/content/object/eid/1-s2.0-S0378778824010843-gr19_lrg.jpg?httpAccept=%2A%2F%2A",
            "@multimediatype": "JPEG image file",
            "@type": "IMAGE-HIGH-RES",
            "@size": "255931",
            "@ref": "gr19",
            "@mimetype": "image/jpeg"
        },
        {
            "@category": "thumbnail",
            "@_fa": "true",
            "$": "https://api.elsevier.com/content/object/eid/1-s2.0-S0378778824010843-si1.svg?httpAccept=%2A%2F%2A",
            "@multimediatype": "Scalable Vector Graphics file",
            "@type": "ALTIMG",
            "@size": "2861",
            "@ref": "si1",
            "@mimetype": "image/svg+xml"
        },
        {
            "@category": "thumbnail",
            "@_fa": "true",
            "$": "https://api.elsevier.com/content/object/eid/1-s2.0-S0378778824010843-si10.svg?httpAccept=%2A%2F%2A",
            "@multimediatype": "Scalable Vector Graphics file",
            "@type": "ALTIMG",
            "@size": "2176",
            "@ref": "si10",
            "@mimetype": "image/svg+xml"
        },
        {
            "@category": "thumbnail",
            "@_fa": "true",
            "$": "https://api.elsevier.com/content/object/eid/1-s2.0-S0378778824010843-si11.svg?httpAccept=%2A%2F%2A",
            "@multimediatype": "Scalable Vector Graphics file",
            "@type": "ALTIMG",
            "@size": "4204",
            "@ref": "si11",
            "@mimetype": "image/svg+xml"
        },
        {
            "@category": "thumbnail",
            "@_fa": "true",
            "$": "https://api.elsevier.com/content/object/eid/1-s2.0-S0378778824010843-si12.svg?httpAccept=%2A%2F%2A",
            "@multimediatype": "Scalable Vector Graphics file",
            "@type": "ALTIMG",
            "@size": "4648",
            "@ref": "si12",
            "@mimetype": "image/svg+xml"
        },
        {
            "@category": "thumbnail",
            "@_fa": "true",
            "$": "https://api.elsevier.com/content/object/eid/1-s2.0-S0378778824010843-si13.svg?httpAccept=%2A%2F%2A",
            "@multimediatype": "Scalable Vector Graphics file",
            "@type": "ALTIMG",
            "@size": "4607",
            "@ref": "si13",
            "@mimetype": "image/svg+xml"
        },
        {
            "@category": "thumbnail",
            "@_fa": "true",
            "$": "https://api.elsevier.com/content/object/eid/1-s2.0-S0378778824010843-si14.svg?httpAccept=%2A%2F%2A",
            "@multimediatype": "Scalable Vector Graphics file",
            "@type": "ALTIMG",
            "@size": "3782",
            "@ref": "si14",
            "@mimetype": "image/svg+xml"
        },
        {
            "@category": "thumbnail",
            "@_fa": "true",
            "$": "https://api.elsevier.com/content/object/eid/1-s2.0-S0378778824010843-si15.svg?httpAccept=%2A%2F%2A",
            "@multimediatype": "Scalable Vector Graphics file",
            "@type": "ALTIMG",
            "@size": "4980",
            "@ref": "si15",
            "@mimetype": "image/svg+xml"
        },
        {
            "@category": "thumbnail",
            "@_fa": "true",
            "$": "https://api.elsevier.com/content/object/eid/1-s2.0-S0378778824010843-si16.svg?httpAccept=%2A%2F%2A",
            "@multimediatype": "Scalable Vector Graphics file",
            "@type": "ALTIMG",
            "@size": "2945",
            "@ref": "si16",
            "@mimetype": "image/svg+xml"
        },
        {
            "@category": "thumbnail",
            "@_fa": "true",
            "$": "https://api.elsevier.com/content/object/eid/1-s2.0-S0378778824010843-si17.svg?httpAccept=%2A%2F%2A",
            "@multimediatype": "Scalable Vector Graphics file",
            "@type": "ALTIMG",
            "@size": "5807",
            "@ref": "si17",
            "@mimetype": "image/svg+xml"
        },
        {
            "@category": "thumbnail",
            "@_fa": "true",
            "$": "https://api.elsevier.com/content/object/eid/1-s2.0-S0378778824010843-si18.svg?httpAccept=%2A%2F%2A",
            "@multimediatype": "Scalable Vector Graphics file",
            "@type": "ALTIMG",
            "@size": "3360",
            "@ref": "si18",
            "@mimetype": "image/svg+xml"
        },
        {
            "@category": "thumbnail",
            "@_fa": "true",
            "$": "https://api.elsevier.com/content/object/eid/1-s2.0-S0378778824010843-si19.svg?httpAccept=%2A%2F%2A",
            "@multimediatype": "Scalable Vector Graphics file",
            "@type": "ALTIMG",
            "@size": "8048",
            "@ref": "si19",
            "@mimetype": "image/svg+xml"
        },
        {
            "@category": "thumbnail",
            "@_fa": "true",
            "$": "https://api.elsevier.com/content/object/eid/1-s2.0-S0378778824010843-si2.svg?httpAccept=%2A%2F%2A",
            "@multimediatype": "Scalable Vector Graphics file",
            "@type": "ALTIMG",
            "@size": "4485",
            "@ref": "si2",
            "@mimetype": "image/svg+xml"
        },
        {
            "@category": "thumbnail",
            "@_fa": "true",
            "$": "https://api.elsevier.com/content/object/eid/1-s2.0-S0378778824010843-si20.svg?httpAccept=%2A%2F%2A",
            "@multimediatype": "Scalable Vector Graphics file",
            "@type": "ALTIMG",
            "@size": "6128",
            "@ref": "si20",
            "@mimetype": "image/svg+xml"
        },
        {
            "@category": "thumbnail",
            "@_fa": "true",
            "$": "https://api.elsevier.com/content/object/eid/1-s2.0-S0378778824010843-si21.svg?httpAccept=%2A%2F%2A",
            "@multimediatype": "Scalable Vector Graphics file",
            "@type": "ALTIMG",
            "@size": "7214",
            "@ref": "si21",
            "@mimetype": "image/svg+xml"
        },
        {
            "@category": "thumbnail",
            "@_fa": "true",
            "$": "https://api.elsevier.com/content/object/eid/1-s2.0-S0378778824010843-si22.svg?httpAccept=%2A%2F%2A",
            "@multimediatype": "Scalable Vector Graphics file",
            "@type": "ALTIMG",
            "@size": "7107",
            "@ref": "si22",
            "@mimetype": "image/svg+xml"
        },
        {
            "@category": "thumbnail",
            "@_fa": "true",
            "$": "https://api.elsevier.com/content/object/eid/1-s2.0-S0378778824010843-si23.svg?httpAccept=%2A%2F%2A",
            "@multimediatype": "Scalable Vector Graphics file",
            "@type": "ALTIMG",
            "@size": "7885",
            "@ref": "si23",
            "@mimetype": "image/svg+xml"
        },
        {
            "@category": "thumbnail",
            "@_fa": "true",
            "$": "https://api.elsevier.com/content/object/eid/1-s2.0-S0378778824010843-si24.svg?httpAccept=%2A%2F%2A",
            "@multimediatype": "Scalable Vector Graphics file",
            "@type": "ALTIMG",
            "@size": "4510",
            "@ref": "si24",
            "@mimetype": "image/svg+xml"
        },
        {
            "@category": "thumbnail",
            "@_fa": "true",
            "$": "https://api.elsevier.com/content/object/eid/1-s2.0-S0378778824010843-si25.svg?httpAccept=%2A%2F%2A",
            "@multimediatype": "Scalable Vector Graphics file",
            "@type": "ALTIMG",
            "@size": "1638",
            "@ref": "si25",
            "@mimetype": "image/svg+xml"
        },
        {
            "@category": "thumbnail",
            "@_fa": "true",
            "$": "https://api.elsevier.com/content/object/eid/1-s2.0-S0378778824010843-si26.svg?httpAccept=%2A%2F%2A",
            "@multimediatype": "Scalable Vector Graphics file",
            "@type": "ALTIMG",
            "@size": "4289",
            "@ref": "si26",
            "@mimetype": "image/svg+xml"
        },
        {
            "@category": "thumbnail",
            "@_fa": "true",
            "$": "https://api.elsevier.com/content/object/eid/1-s2.0-S0378778824010843-si27.svg?httpAccept=%2A%2F%2A",
            "@multimediatype": "Scalable Vector Graphics file",
            "@type": "ALTIMG",
            "@size": "2252",
            "@ref": "si27",
            "@mimetype": "image/svg+xml"
        },
        {
            "@category": "thumbnail",
            "@_fa": "true",
            "$": "https://api.elsevier.com/content/object/eid/1-s2.0-S0378778824010843-si28.svg?httpAccept=%2A%2F%2A",
            "@multimediatype": "Scalable Vector Graphics file",
            "@type": "ALTIMG",
            "@size": "1590",
            "@ref": "si28",
            "@mimetype": "image/svg+xml"
        },
        {
            "@category": "thumbnail",
            "@_fa": "true",
            "$": "https://api.elsevier.com/content/object/eid/1-s2.0-S0378778824010843-si29.svg?httpAccept=%2A%2F%2A",
            "@multimediatype": "Scalable Vector Graphics file",
            "@type": "ALTIMG",
            "@size": "3795",
            "@ref": "si29",
            "@mimetype": "image/svg+xml"
        },
        {
            "@category": "thumbnail",
            "@_fa": "true",
            "$": "https://api.elsevier.com/content/object/eid/1-s2.0-S0378778824010843-si3.svg?httpAccept=%2A%2F%2A",
            "@multimediatype": "Scalable Vector Graphics file",
            "@type": "ALTIMG",
            "@size": "3517",
            "@ref": "si3",
            "@mimetype": "image/svg+xml"
        },
        {
            "@category": "thumbnail",
            "@_fa": "true",
            "$": "https://api.elsevier.com/content/object/eid/1-s2.0-S0378778824010843-si30.svg?httpAccept=%2A%2F%2A",
            "@multimediatype": "Scalable Vector Graphics file",
            "@type": "ALTIMG",
            "@size": "12011",
            "@ref": "si30",
            "@mimetype": "image/svg+xml"
        },
        {
            "@category": "thumbnail",
            "@_fa": "true",
            "$": "https://api.elsevier.com/content/object/eid/1-s2.0-S0378778824010843-si31.svg?httpAccept=%2A%2F%2A",
            "@multimediatype": "Scalable Vector Graphics file",
            "@type": "ALTIMG",
            "@size": "10829",
            "@ref": "si31",
            "@mimetype": "image/svg+xml"
        },
        {
            "@category": "thumbnail",
            "@_fa": "true",
            "$": "https://api.elsevier.com/content/object/eid/1-s2.0-S0378778824010843-si32.svg?httpAccept=%2A%2F%2A",
            "@multimediatype": "Scalable Vector Graphics file",
            "@type": "ALTIMG",
            "@size": "16216",
            "@ref": "si32",
            "@mimetype": "image/svg+xml"
        },
        {
            "@category": "thumbnail",
            "@_fa": "true",
            "$": "https://api.elsevier.com/content/object/eid/1-s2.0-S0378778824010843-si33.svg?httpAccept=%2A%2F%2A",
            "@multimediatype": "Scalable Vector Graphics file",
            "@type": "ALTIMG",
            "@size": "21259",
            "@ref": "si33",
            "@mimetype": "image/svg+xml"
        },
        {
            "@category": "thumbnail",
            "@_fa": "true",
            "$": "https://api.elsevier.com/content/object/eid/1-s2.0-S0378778824010843-si34.svg?httpAccept=%2A%2F%2A",
            "@multimediatype": "Scalable Vector Graphics file",
            "@type": "ALTIMG",
            "@size": "3394",
            "@ref": "si34",
            "@mimetype": "image/svg+xml"
        },
        {
            "@category": "thumbnail",
            "@_fa": "true",
            "$": "https://api.elsevier.com/content/object/eid/1-s2.0-S0378778824010843-si35.svg?httpAccept=%2A%2F%2A",
            "@multimediatype": "Scalable Vector Graphics file",
            "@type": "ALTIMG",
            "@size": "6024",
            "@ref": "si35",
            "@mimetype": "image/svg+xml"
        },
        {
            "@category": "thumbnail",
            "@_fa": "true",
            "$": "https://api.elsevier.com/content/object/eid/1-s2.0-S0378778824010843-si36.svg?httpAccept=%2A%2F%2A",
            "@multimediatype": "Scalable Vector Graphics file",
            "@type": "ALTIMG",
            "@size": "6149",
            "@ref": "si36",
            "@mimetype": "image/svg+xml"
        },
        {
            "@category": "thumbnail",
            "@_fa": "true",
            "$": "https://api.elsevier.com/content/object/eid/1-s2.0-S0378778824010843-si37.svg?httpAccept=%2A%2F%2A",
            "@multimediatype": "Scalable Vector Graphics file",
            "@type": "ALTIMG",
            "@size": "6656",
            "@ref": "si37",
            "@mimetype": "image/svg+xml"
        },
        {
            "@category": "thumbnail",
            "@_fa": "true",
            "$": "https://api.elsevier.com/content/object/eid/1-s2.0-S0378778824010843-si38.svg?httpAccept=%2A%2F%2A",
            "@multimediatype": "Scalable Vector Graphics file",
            "@type": "ALTIMG",
            "@size": "6066",
            "@ref": "si38",
            "@mimetype": "image/svg+xml"
        },
        {
            "@category": "thumbnail",
            "@_fa": "true",
            "$": "https://api.elsevier.com/content/object/eid/1-s2.0-S0378778824010843-si39.svg?httpAccept=%2A%2F%2A",
            "@multimediatype": "Scalable Vector Graphics file",
            "@type": "ALTIMG",
            "@size": "6577",
            "@ref": "si39",
            "@mimetype": "image/svg+xml"
        },
        {
            "@category": "thumbnail",
            "@_fa": "true",
            "$": "https://api.elsevier.com/content/object/eid/1-s2.0-S0378778824010843-si4.svg?httpAccept=%2A%2F%2A",
            "@multimediatype": "Scalable Vector Graphics file",
            "@type": "ALTIMG",
            "@size": "4927",
            "@ref": "si4",
            "@mimetype": "image/svg+xml"
        },
        {
            "@category": "thumbnail",
            "@_fa": "true",
            "$": "https://api.elsevier.com/content/object/eid/1-s2.0-S0378778824010843-si40.svg?httpAccept=%2A%2F%2A",
            "@multimediatype": "Scalable Vector Graphics file",
            "@type": "ALTIMG",
            "@size": "1457",
            "@ref": "si40",
            "@mimetype": "image/svg+xml"
        },
        {
            "@category": "thumbnail",
            "@_fa": "true",
            "$": "https://api.elsevier.com/content/object/eid/1-s2.0-S0378778824010843-si41.svg?httpAccept=%2A%2F%2A",
            "@multimediatype": "Scalable Vector Graphics file",
            "@type": "ALTIMG",
            "@size": "2204",
            "@ref": "si41",
            "@mimetype": "image/svg+xml"
        },
        {
            "@category": "thumbnail",
            "@_fa": "true",
            "$": "https://api.elsevier.com/content/object/eid/1-s2.0-S0378778824010843-si42.svg?httpAccept=%2A%2F%2A",
            "@multimediatype": "Scalable Vector Graphics file",
            "@type": "ALTIMG",
            "@size": "29311",
            "@ref": "si42",
            "@mimetype": "image/svg+xml"
        },
        {
            "@category": "thumbnail",
            "@_fa": "true",
            "$": "https://api.elsevier.com/content/object/eid/1-s2.0-S0378778824010843-si43.svg?httpAccept=%2A%2F%2A",
            "@multimediatype": "Scalable Vector Graphics file",
            "@type": "ALTIMG",
            "@size": "2750",
            "@ref": "si43",
            "@mimetype": "image/svg+xml"
        },
        {
            "@category": "thumbnail",
            "@_fa": "true",
            "$": "https://api.elsevier.com/content/object/eid/1-s2.0-S0378778824010843-si44.svg?httpAccept=%2A%2F%2A",
            "@multimediatype": "Scalable Vector Graphics file",
            "@type": "ALTIMG",
            "@size": "2510",
            "@ref": "si44",
            "@mimetype": "image/svg+xml"
        },
        {
            "@category": "thumbnail",
            "@_fa": "true",
            "$": "https://api.elsevier.com/content/object/eid/1-s2.0-S0378778824010843-si45.svg?httpAccept=%2A%2F%2A",
            "@multimediatype": "Scalable Vector Graphics file",
            "@type": "ALTIMG",
            "@size": "3271",
            "@ref": "si45",
            "@mimetype": "image/svg+xml"
        },
        {
            "@category": "thumbnail",
            "@_fa": "true",
            "$": "https://api.elsevier.com/content/object/eid/1-s2.0-S0378778824010843-si46.svg?httpAccept=%2A%2F%2A",
            "@multimediatype": "Scalable Vector Graphics file",
            "@type": "ALTIMG",
            "@size": "2858",
            "@ref": "si46",
            "@mimetype": "image/svg+xml"
        },
        {
            "@category": "thumbnail",
            "@_fa": "true",
            "$": "https://api.elsevier.com/content/object/eid/1-s2.0-S0378778824010843-si47.svg?httpAccept=%2A%2F%2A",
            "@multimediatype": "Scalable Vector Graphics file",
            "@type": "ALTIMG",
            "@size": "1626",
            "@ref": "si47",
            "@mimetype": "image/svg+xml"
        },
        {
            "@category": "thumbnail",
            "@_fa": "true",
            "$": "https://api.elsevier.com/content/object/eid/1-s2.0-S0378778824010843-si48.svg?httpAccept=%2A%2F%2A",
            "@multimediatype": "Scalable Vector Graphics file",
            "@type": "ALTIMG",
            "@size": "2389",
            "@ref": "si48",
            "@mimetype": "image/svg+xml"
        },
        {
            "@category": "thumbnail",
            "@_fa": "true",
            "$": "https://api.elsevier.com/content/object/eid/1-s2.0-S0378778824010843-si49.svg?httpAccept=%2A%2F%2A",
            "@multimediatype": "Scalable Vector Graphics file",
            "@type": "ALTIMG",
            "@size": "2496",
            "@ref": "si49",
            "@mimetype": "image/svg+xml"
        },
        {
            "@category": "thumbnail",
            "@_fa": "true",
            "$": "https://api.elsevier.com/content/object/eid/1-s2.0-S0378778824010843-si5.svg?httpAccept=%2A%2F%2A",
            "@multimediatype": "Scalable Vector Graphics file",
            "@type": "ALTIMG",
            "@size": "3517",
            "@ref": "si5",
            "@mimetype": "image/svg+xml"
        },
        {
            "@category": "thumbnail",
            "@_fa": "true",
            "$": "https://api.elsevier.com/content/object/eid/1-s2.0-S0378778824010843-si50.svg?httpAccept=%2A%2F%2A",
            "@multimediatype": "Scalable Vector Graphics file",
            "@type": "ALTIMG",
            "@size": "20941",
            "@ref": "si50",
            "@mimetype": "image/svg+xml"
        },
        {
            "@category": "thumbnail",
            "@_fa": "true",
            "$": "https://api.elsevier.com/content/object/eid/1-s2.0-S0378778824010843-si51.svg?httpAccept=%2A%2F%2A",
            "@multimediatype": "Scalable Vector Graphics file",
            "@type": "ALTIMG",
            "@size": "23537",
            "@ref": "si51",
            "@mimetype": "image/svg+xml"
        },
        {
            "@category": "thumbnail",
            "@_fa": "true",
            "$": "https://api.elsevier.com/content/object/eid/1-s2.0-S0378778824010843-si52.svg?httpAccept=%2A%2F%2A",
            "@multimediatype": "Scalable Vector Graphics file",
            "@type": "ALTIMG",
            "@size": "26310",
            "@ref": "si52",
            "@mimetype": "image/svg+xml"
        },
        {
            "@category": "thumbnail",
            "@_fa": "true",
            "$": "https://api.elsevier.com/content/object/eid/1-s2.0-S0378778824010843-si53.svg?httpAccept=%2A%2F%2A",
            "@multimediatype": "Scalable Vector Graphics file",
            "@type": "ALTIMG",
            "@size": "20069",
            "@ref": "si53",
            "@mimetype": "image/svg+xml"
        },
        {
            "@category": "thumbnail",
            "@_fa": "true",
            "$": "https://api.elsevier.com/content/object/eid/1-s2.0-S0378778824010843-si54.svg?httpAccept=%2A%2F%2A",
            "@multimediatype": "Scalable Vector Graphics file",
            "@type": "ALTIMG",
            "@size": "22048",
            "@ref": "si54",
            "@mimetype": "image/svg+xml"
        },
        {
            "@category": "thumbnail",
            "@_fa": "true",
            "$": "https://api.elsevier.com/content/object/eid/1-s2.0-S0378778824010843-si55.svg?httpAccept=%2A%2F%2A",
            "@multimediatype": "Scalable Vector Graphics file",
            "@type": "ALTIMG",
            "@size": "39909",
            "@ref": "si55",
            "@mimetype": "image/svg+xml"
        },
        {
            "@category": "thumbnail",
            "@_fa": "true",
            "$": "https://api.elsevier.com/content/object/eid/1-s2.0-S0378778824010843-si56.svg?httpAccept=%2A%2F%2A",
            "@multimediatype": "Scalable Vector Graphics file",
            "@type": "ALTIMG",
            "@size": "17101",
            "@ref": "si56",
            "@mimetype": "image/svg+xml"
        },
        {
            "@category": "thumbnail",
            "@_fa": "true",
            "$": "https://api.elsevier.com/content/object/eid/1-s2.0-S0378778824010843-si57.svg?httpAccept=%2A%2F%2A",
            "@multimediatype": "Scalable Vector Graphics file",
            "@type": "ALTIMG",
            "@size": "16757",
            "@ref": "si57",
            "@mimetype": "image/svg+xml"
        },
        {
            "@category": "thumbnail",
            "@_fa": "true",
            "$": "https://api.elsevier.com/content/object/eid/1-s2.0-S0378778824010843-si58.svg?httpAccept=%2A%2F%2A",
            "@multimediatype": "Scalable Vector Graphics file",
            "@type": "ALTIMG",
            "@size": "24883",
            "@ref": "si58",
            "@mimetype": "image/svg+xml"
        },
        {
            "@category": "thumbnail",
            "@_fa": "true",
            "$": "https://api.elsevier.com/content/object/eid/1-s2.0-S0378778824010843-si59.svg?httpAccept=%2A%2F%2A",
            "@multimediatype": "Scalable Vector Graphics file",
            "@type": "ALTIMG",
            "@size": "22656",
            "@ref": "si59",
            "@mimetype": "image/svg+xml"
        },
        {
            "@category": "thumbnail",
            "@_fa": "true",
            "$": "https://api.elsevier.com/content/object/eid/1-s2.0-S0378778824010843-si6.svg?httpAccept=%2A%2F%2A",
            "@multimediatype": "Scalable Vector Graphics file",
            "@type": "ALTIMG",
            "@size": "3612",
            "@ref": "si6",
            "@mimetype": "image/svg+xml"
        },
        {
            "@category": "thumbnail",
            "@_fa": "true",
            "$": "https://api.elsevier.com/content/object/eid/1-s2.0-S0378778824010843-si60.svg?httpAccept=%2A%2F%2A",
            "@multimediatype": "Scalable Vector Graphics file",
            "@type": "ALTIMG",
            "@size": "27623",
            "@ref": "si60",
            "@mimetype": "image/svg+xml"
        },
        {
            "@category": "thumbnail",
            "@_fa": "true",
            "$": "https://api.elsevier.com/content/object/eid/1-s2.0-S0378778824010843-si61.svg?httpAccept=%2A%2F%2A",
            "@multimediatype": "Scalable Vector Graphics file",
            "@type": "ALTIMG",
            "@size": "23551",
            "@ref": "si61",
            "@mimetype": "image/svg+xml"
        },
        {
            "@category": "thumbnail",
            "@_fa": "true",
            "$": "https://api.elsevier.com/content/object/eid/1-s2.0-S0378778824010843-si62.svg?httpAccept=%2A%2F%2A",
            "@multimediatype": "Scalable Vector Graphics file",
            "@type": "ALTIMG",
            "@size": "26734",
            "@ref": "si62",
            "@mimetype": "image/svg+xml"
        },
        {
            "@category": "thumbnail",
            "@_fa": "true",
            "$": "https://api.elsevier.com/content/object/eid/1-s2.0-S0378778824010843-si63.svg?httpAccept=%2A%2F%2A",
            "@multimediatype": "Scalable Vector Graphics file",
            "@type": "ALTIMG",
            "@size": "14921",
            "@ref": "si63",
            "@mimetype": "image/svg+xml"
        },
        {
            "@category": "thumbnail",
            "@_fa": "true",
            "$": "https://api.elsevier.com/content/object/eid/1-s2.0-S0378778824010843-si64.svg?httpAccept=%2A%2F%2A",
            "@multimediatype": "Scalable Vector Graphics file",
            "@type": "ALTIMG",
            "@size": "22797",
            "@ref": "si64",
            "@mimetype": "image/svg+xml"
        },
        {
            "@category": "thumbnail",
            "@_fa": "true",
            "$": "https://api.elsevier.com/content/object/eid/1-s2.0-S0378778824010843-si65.svg?httpAccept=%2A%2F%2A",
            "@multimediatype": "Scalable Vector Graphics file",
            "@type": "ALTIMG",
            "@size": "16755",
            "@ref": "si65",
            "@mimetype": "image/svg+xml"
        },
        {
            "@category": "thumbnail",
            "@_fa": "true",
            "$": "https://api.elsevier.com/content/object/eid/1-s2.0-S0378778824010843-si66.svg?httpAccept=%2A%2F%2A",
            "@multimediatype": "Scalable Vector Graphics file",
            "@type": "ALTIMG",
            "@size": "19818",
            "@ref": "si66",
            "@mimetype": "image/svg+xml"
        },
        {
            "@category": "thumbnail",
            "@_fa": "true",
            "$": "https://api.elsevier.com/content/object/eid/1-s2.0-S0378778824010843-si67.svg?httpAccept=%2A%2F%2A",
            "@multimediatype": "Scalable Vector Graphics file",
            "@type": "ALTIMG",
            "@size": "16602",
            "@ref": "si67",
            "@mimetype": "image/svg+xml"
        },
        {
            "@category": "thumbnail",
            "@_fa": "true",
            "$": "https://api.elsevier.com/content/object/eid/1-s2.0-S0378778824010843-si68.svg?httpAccept=%2A%2F%2A",
            "@multimediatype": "Scalable Vector Graphics file",
            "@type": "ALTIMG",
            "@size": "22741",
            "@ref": "si68",
            "@mimetype": "image/svg+xml"
        },
        {
            "@category": "thumbnail",
            "@_fa": "true",
            "$": "https://api.elsevier.com/content/object/eid/1-s2.0-S0378778824010843-si69.svg?httpAccept=%2A%2F%2A",
            "@multimediatype": "Scalable Vector Graphics file",
            "@type": "ALTIMG",
            "@size": "20224",
            "@ref": "si69",
            "@mimetype": "image/svg+xml"
        },
        {
            "@category": "thumbnail",
            "@_fa": "true",
            "$": "https://api.elsevier.com/content/object/eid/1-s2.0-S0378778824010843-si7.svg?httpAccept=%2A%2F%2A",
            "@multimediatype": "Scalable Vector Graphics file",
            "@type": "ALTIMG",
            "@size": "5119",
            "@ref": "si7",
            "@mimetype": "image/svg+xml"
        },
        {
            "@category": "thumbnail",
            "@_fa": "true",
            "$": "https://api.elsevier.com/content/object/eid/1-s2.0-S0378778824010843-si70.svg?httpAccept=%2A%2F%2A",
            "@multimediatype": "Scalable Vector Graphics file",
            "@type": "ALTIMG",
            "@size": "19452",
            "@ref": "si70",
            "@mimetype": "image/svg+xml"
        },
        {
            "@category": "thumbnail",
            "@_fa": "true",
            "$": "https://api.elsevier.com/content/object/eid/1-s2.0-S0378778824010843-si71.svg?httpAccept=%2A%2F%2A",
            "@multimediatype": "Scalable Vector Graphics file",
            "@type": "ALTIMG",
            "@size": "19541",
            "@ref": "si71",
            "@mimetype": "image/svg+xml"
        },
        {
            "@category": "thumbnail",
            "@_fa": "true",
            "$": "https://api.elsevier.com/content/object/eid/1-s2.0-S0378778824010843-si72.svg?httpAccept=%2A%2F%2A",
            "@multimediatype": "Scalable Vector Graphics file",
            "@type": "ALTIMG",
            "@size": "6048",
            "@ref": "si72",
            "@mimetype": "image/svg+xml"
        },
        {
            "@category": "thumbnail",
            "@_fa": "true",
            "$": "https://api.elsevier.com/content/object/eid/1-s2.0-S0378778824010843-si73.svg?httpAccept=%2A%2F%2A",
            "@multimediatype": "Scalable Vector Graphics file",
            "@type": "ALTIMG",
            "@size": "6369",
            "@ref": "si73",
            "@mimetype": "image/svg+xml"
        },
        {
            "@category": "thumbnail",
            "@_fa": "true",
            "$": "https://api.elsevier.com/content/object/eid/1-s2.0-S0378778824010843-si74.svg?httpAccept=%2A%2F%2A",
            "@multimediatype": "Scalable Vector Graphics file",
            "@type": "ALTIMG",
            "@size": "6671",
            "@ref": "si74",
            "@mimetype": "image/svg+xml"
        },
        {
            "@category": "thumbnail",
            "@_fa": "true",
            "$": "https://api.elsevier.com/content/object/eid/1-s2.0-S0378778824010843-si75.svg?httpAccept=%2A%2F%2A",
            "@multimediatype": "Scalable Vector Graphics file",
            "@type": "ALTIMG",
            "@size": "6987",
            "@ref": "si75",
            "@mimetype": "image/svg+xml"
        },
        {
            "@category": "thumbnail",
            "@_fa": "true",
            "$": "https://api.elsevier.com/content/object/eid/1-s2.0-S0378778824010843-si76.svg?httpAccept=%2A%2F%2A",
            "@multimediatype": "Scalable Vector Graphics file",
            "@type": "ALTIMG",
            "@size": "68515",
            "@ref": "si76",
            "@mimetype": "image/svg+xml"
        },
        {
            "@category": "thumbnail",
            "@_fa": "true",
            "$": "https://api.elsevier.com/content/object/eid/1-s2.0-S0378778824010843-si77.svg?httpAccept=%2A%2F%2A",
            "@multimediatype": "Scalable Vector Graphics file",
            "@type": "ALTIMG",
            "@size": "80914",
            "@ref": "si77",
            "@mimetype": "image/svg+xml"
        },
        {
            "@category": "thumbnail",
            "@_fa": "true",
            "$": "https://api.elsevier.com/content/object/eid/1-s2.0-S0378778824010843-si8.svg?httpAccept=%2A%2F%2A",
            "@multimediatype": "Scalable Vector Graphics file",
            "@type": "ALTIMG",
            "@size": "2955",
            "@ref": "si8",
            "@mimetype": "image/svg+xml"
        },
        {
            "@category": "thumbnail",
            "@_fa": "true",
            "$": "https://api.elsevier.com/content/object/eid/1-s2.0-S0378778824010843-si9.svg?httpAccept=%2A%2F%2A",
            "@multimediatype": "Scalable Vector Graphics file",
            "@type": "ALTIMG",
            "@size": "5959",
            "@ref": "si9",
            "@mimetype": "image/svg+xml"
        }
    ]},
    "link": {
        "@rel": "abstract",
        "@href": "https://api.elsevier.com/content/abstract/scopus_id/85208202177"
    }
}}