{"full-text-retrieval-response": {
    "scopus-eid": "2-s2.0-85103561047",
    "originalText": "serial JL 271429 291210 291702 291731 291787 291877 291878 291881 31 90 Applied Energy APPLIEDENERGY 2021-04-08 2021-04-08 2021-04-08 2021-04-08 2022-08-06T14:57:55 1-s2.0-S0306261921003755 S0306-2619(21)00375-5 S0306261921003755 10.1016/j.apenergy.2021.116889 S300 S300.1 FULL-TEXT 1-s2.0-S0306261921X00098 2024-01-01T13:26:00.965548Z 0 0 20210615 2021 2021-04-08T18:24:05.010193Z absattachment articleinfo articlenumber articletitlenorm authfirstinitialnorm authfirstsurnamenorm cid cids contenttype copyright crossmark dateloaded dateloadedtxt datesearch datesort dateupdated dco docsubtype doctype doi eid ewtransactionid fundingbodyid hubeid indexeddate issn issnnorm itemstage itemtransactionid itemweight oauserlicense openaccess openarchive pg pgfirst pii piinorm pubdatestart pubdatetxt pubyr sectiontitle sortorder sponsoredaccesstype srctitle srctitlenorm srctype ssids alllist content oa subj subheadings suppl tomb volfirst volissue volumelist webpdf webpdfpagecount yearnav figure table body mmlmath acknowledge affil articletitle auth authfirstini authfull authkeywords authlast grantnumber grantsponsor highlightsabst orcid primabst ref specialabst 0306-2619 03062619 UNLIMITED NONE true 292 292 C Volume 292 16 116889 116889 116889 20210615 15 June 2021 2021-06-15 2021 Research Papers article fla © 2021 The Authors. Published by Elsevier Ltd. ADVANCEDFORECASTINGDISTURBANCEMODELLINGFORMODELPREDICTIVECONTROLSMARTENERGYSYSTEMS THILKER C 1 Introduction 1.1 Literature review 1.2 Main aim and organisation of the paper 2 Stochastic differential equations and the smart building model 2.1 Smart building model 2.1.1 System states 2.1.2 Inputs 2.2 Disturbances 3 Disturbance modelling and forecasting 3.1 The data 3.2 Weather model components 3.2.1 Cloud cover 3.2.2 Global solar radiation 3.2.3 Net radiation 3.2.4 Ambient air temperature 3.3 Combined disturbance model and forecasting scheme 4 Model predictive control 4.1 Filtering 4.2 Optimal control problem 4.2.1 Discretisation of the optimal control problem 4.3 The economic model predictive control algorithm 5 Dynamics of the smart building model 5.1 Pulse- and frequency-response analysis 5.2 Summary of the section 6 Results and discussion 6.1 Visualisation of the advanced disturbance forecasts 6.2 Simulation-based comparison of the forecasting schemes 6.2.1 Heating strategy 1: Electrical heaters 6.2.2 Heating strategy 2: Heat pump 6.2.3 Heating strategy 3: Heat pump plus electrical heaters 6.2.4 Heating strategy 4: Heat pump plus electrical heaters and coolers 6.3 Statistical results 6.4 Inclusion of meteorological forecasts 7 Conclusions CRediT authorship contribution statement Acknowledgements References BERARDI 2017 230 241 U SALAKIJ 2016 345 358 S HU 2019 316 329 M LEE 2011 415 424 J MADSEN 2004 H STATISTICSINFINANCE MOLLER 2016 189 205 J IVERSEN 2016 981 990 E BADOSA 2018 73 93 J RENEWABLEENERGYFORECASTINGRISKMANAGEMENT DAYAHEADPROBABILISTICFORECASTSOLARIRRADIANCEASTOCHASTICDIFFERENTIALEQUATIONAPPROACH IVERSEN 2014 E CANDANEDO 2011 235 256 J DECONINCK 2016 290 298 R FINCK 2019 365 379 C THIEBLEMONT 2017 485 500 H DRGONA 2020 J OLDEWURTEL 2012 15 27 F SEGARRA 2019 1309 E PANG 2020 279 289 Z DONG 2014 89 106 B FLORITA 2009 835 853 A LAGO 2018 386 405 J HATTELAND 2019 H SALESFORECASTING VEGALARA 2016 283 292 B TAYLOR 2004 225 233 C ERROUISSI 2017 2265 2277 R HUUSOM 2012 1997 2007 J HAGDRUP 2016 171 176 M RAWLINGS 2017 J MODELPREDICTIVECONTROLTHEORYCOMPUTATIONDESIGN ROSSITER 2003 J MODELBASEDPREDICTIVECONTROLAPRACTICALAPPROACH ANDERSEN 2000 13 24 K JUNG 2014 331 342 R BEMPORAD 2018 11 21 A ANDERSEN 1977 B METEOROLOGICALDATAFORDESIGNBUILDINGINSTALLATIONAREFERENCEYEARNO66 WMO 2019 B MANUALCODES THILKER 2020 C OPTIMIZATIONFORSMARTENERGYSYSTEMS MADSEN 1986 71 76 H INTERNATIONALCONFERENCESTATISTICALCLIMATOLOGYVOL3 INHOMOGENOUSMARKOVMODELSFORVARIATIONSINCLOUDCOVER MADSEN 1985 629 639 H MOLLER 2010 J STATEDEPENDENTDIFFUSIONCONSTANTDIFFUSIONINSTOCHASTICDIFFERENTIALEQUATIONSBYLAMPERTITRANSFORM BREINHOLT 2012 36 52 A KRISTENSEN 2004 225 237 N BROK 2018 430 435 N JUHL 2013 R CTSMRUSERGUIDE NIELSEN 1981 255 272 L HOLTSLAG 1983 517 529 B ANDERSEN 1984 L STOKASTISKEMODELLERAFUDETEMPERATUROGSTRALINGDANISHSTOCHASTICMODELSFORAMBIENTAIRTEMPERATURERADIATION MADSEN 1985 H STATISTICALLYDETERMINEDDYNAMICALMODELSFORCLIMATEPROCESSES THILKER 2020 C TOWARDSENERGYSMARTHOMESALGORITHMSTECHNOLOGIESAPPLICATIONS MODELPREDICTIVECONTROLBASEDSTOCHASTICDIFFERENTIALEQUATIONS MACIEJOWSKI 2002 J PREDICTIVECONTROLCONSTRAINTS JUNKER 2020 115096 R MADSEN 2015 H HANDBOOKCLEANENERGYSYSTEMSINTELLIGENTENERGYSYSTEMSVOL4 CONTROLELECTRICITYLOADSINFUTUREELECTRICENERGYSYSTEMS JUNKER 2018 175 182 R CLARKE 1976 682 699 F THILKERX2021X116889 THILKERX2021X116889XC Full 2021-04-03T19:34:18Z Author http://creativecommons.org/licenses/by/4.0/ 2023-04-08T00:00:00.000Z 2023-04-08T00:00:00.000Z http://creativecommons.org/licenses/by-nc-nd/4.0/ This is an open access article under the CC BY license. © 2021 The Authors. Published by Elsevier Ltd. 2021-06-05T07:21:33.026Z http://vtw.elsevier.com/data/voc/AddOnTypes/50.7/aggregated-refined 0 item S0306-2619(21)00375-5 S0306261921003755 1-s2.0-S0306261921003755 10.1016/j.apenergy.2021.116889 271429 2024-01-01T13:26:00.965548Z 2021-06-15 UNLIMITED NONE 1-s2.0-S0306261921003755-main.pdf https://s3-eu-west-1.amazonaws.com/prod-ucs-content-store-eu-west/content/pii:S0306261921003755/MAIN/application/pdf/beb939036937ed4beaed6763e2c65148/main.pdf main.pdf pdf true 1163824 MAIN 11 1-s2.0-S0306261921003755-main_1.png https://s3-eu-west-1.amazonaws.com/prod-ucs-content-store-eu-west/content/pii:S0306261921003755/PREVIEW/image/png/17c1c7691b76a4daaa8ae0bb075c3b6c/main_1.png main_1.png png 49216 849 656 IMAGE-WEB-PDF 1 1-s2.0-S0306261921003755-gr3.jpg https://s3-eu-west-1.amazonaws.com/prod-ucs-content-store-eu-west/content/pii:S0306261921003755/gr3/DOWNSAMPLED/image/jpeg/eedea10c8bed20bdfcfe5da596da2a63/gr3.jpg gr3 gr3.jpg jpg 81772 126 565 IMAGE-DOWNSAMPLED 1-s2.0-S0306261921003755-gr2.jpg https://s3-eu-west-1.amazonaws.com/prod-ucs-content-store-eu-west/content/pii:S0306261921003755/gr2/DOWNSAMPLED/image/jpeg/94d6943efece18dc251492aecdb74c3e/gr2.jpg gr2 gr2.jpg jpg 85208 213 364 IMAGE-DOWNSAMPLED 1-s2.0-S0306261921003755-gr5.jpg https://s3-eu-west-1.amazonaws.com/prod-ucs-content-store-eu-west/content/pii:S0306261921003755/gr5/DOWNSAMPLED/image/jpeg/3f5c62316b51d1ac8b598ce01e42443b/gr5.jpg gr5 gr5.jpg jpg 99762 228 342 IMAGE-DOWNSAMPLED 1-s2.0-S0306261921003755-gr4.jpg https://s3-eu-west-1.amazonaws.com/prod-ucs-content-store-eu-west/content/pii:S0306261921003755/gr4/DOWNSAMPLED/image/jpeg/8c869fc0531ed3b84585de3f7b47ab08/gr4.jpg gr4 gr4.jpg jpg 132577 470 364 IMAGE-DOWNSAMPLED 1-s2.0-S0306261921003755-gr7.jpg https://s3-eu-west-1.amazonaws.com/prod-ucs-content-store-eu-west/content/pii:S0306261921003755/gr7/DOWNSAMPLED/image/jpeg/cd4064483eb67733efbe9e08abc21f81/gr7.jpg gr7 gr7.jpg jpg 217357 468 696 IMAGE-DOWNSAMPLED 1-s2.0-S0306261921003755-gr6.jpg https://s3-eu-west-1.amazonaws.com/prod-ucs-content-store-eu-west/content/pii:S0306261921003755/gr6/DOWNSAMPLED/image/jpeg/8fc564e5465efe9fb558bd70f6a71b38/gr6.jpg gr6 gr6.jpg jpg 110052 185 562 IMAGE-DOWNSAMPLED 1-s2.0-S0306261921003755-gr8.jpg https://s3-eu-west-1.amazonaws.com/prod-ucs-content-store-eu-west/content/pii:S0306261921003755/gr8/DOWNSAMPLED/image/jpeg/b01059b3006e2be18658276d97a345ea/gr8.jpg gr8 gr8.jpg jpg 132613 890 275 IMAGE-DOWNSAMPLED 1-s2.0-S0306261921003755-fx1.jpg https://s3-eu-west-1.amazonaws.com/prod-ucs-content-store-eu-west/content/pii:S0306261921003755/fx1/DOWNSAMPLED/image/jpeg/8fced4aa20cedc6badbdb694ddadc2e5/fx1.jpg fx1 true fx1.jpg jpg 77192 79 301 IMAGE-DOWNSAMPLED 1-s2.0-S0306261921003755-fx1001.jpg https://s3-eu-west-1.amazonaws.com/prod-ucs-content-store-eu-west/content/pii:S0306261921003755/fx1001/DOWNSAMPLED/image/jpeg/2e35a7ae5149745b9b394f5568231a3f/fx1001.jpg fx1001 fx1001.jpg jpg 124157 357 809 IMAGE-DOWNSAMPLED 1-s2.0-S0306261921003755-gr1.jpg https://s3-eu-west-1.amazonaws.com/prod-ucs-content-store-eu-west/content/pii:S0306261921003755/gr1/DOWNSAMPLED/image/jpeg/c44ea09160f6ed2e4eb2c574cf1d55eb/gr1.jpg gr1 gr1.jpg jpg 88414 245 371 IMAGE-DOWNSAMPLED 1-s2.0-S0306261921003755-fx1002.jpg https://s3-eu-west-1.amazonaws.com/prod-ucs-content-store-eu-west/content/pii:S0306261921003755/fx1002/DOWNSAMPLED/image/jpeg/8bc3446f3a01985b1fa5fb7752bacf03/fx1002.jpg fx1002 fx1002.jpg jpg 108118 382 809 IMAGE-DOWNSAMPLED 1-s2.0-S0306261921003755-gr3.sml https://s3-eu-west-1.amazonaws.com/prod-ucs-content-store-eu-west/content/pii:S0306261921003755/gr3/THUMBNAIL/image/gif/65899ef1d42dc897bb3aaeec9a7d4074/gr3.sml gr3 gr3.sml sml 68364 49 219 IMAGE-THUMBNAIL 1-s2.0-S0306261921003755-gr2.sml https://s3-eu-west-1.amazonaws.com/prod-ucs-content-store-eu-west/content/pii:S0306261921003755/gr2/THUMBNAIL/image/gif/8896fcb4ba37b8eb9c5bf14ed959cc9d/gr2.sml gr2 gr2.sml sml 71212 128 219 IMAGE-THUMBNAIL 1-s2.0-S0306261921003755-gr5.sml https://s3-eu-west-1.amazonaws.com/prod-ucs-content-store-eu-west/content/pii:S0306261921003755/gr5/THUMBNAIL/image/gif/d668ab0a414ee9025d5a10631097dd2e/gr5.sml gr5 gr5.sml sml 77031 146 219 IMAGE-THUMBNAIL 1-s2.0-S0306261921003755-gr4.sml https://s3-eu-west-1.amazonaws.com/prod-ucs-content-store-eu-west/content/pii:S0306261921003755/gr4/THUMBNAIL/image/gif/831c4fc86d5b320e929f28b28a51893b/gr4.sml gr4 gr4.sml sml 76769 164 127 IMAGE-THUMBNAIL 1-s2.0-S0306261921003755-gr7.sml https://s3-eu-west-1.amazonaws.com/prod-ucs-content-store-eu-west/content/pii:S0306261921003755/gr7/THUMBNAIL/image/gif/3fef459fb0d5e36ec359d071a43542f3/gr7.sml gr7 gr7.sml sml 82348 147 219 IMAGE-THUMBNAIL 1-s2.0-S0306261921003755-gr6.sml https://s3-eu-west-1.amazonaws.com/prod-ucs-content-store-eu-west/content/pii:S0306261921003755/gr6/THUMBNAIL/image/gif/2efe08257c09da0ce4c41e2ffb28eefe/gr6.sml gr6 gr6.sml sml 71567 72 219 IMAGE-THUMBNAIL 1-s2.0-S0306261921003755-gr8.sml https://s3-eu-west-1.amazonaws.com/prod-ucs-content-store-eu-west/content/pii:S0306261921003755/gr8/THUMBNAIL/image/gif/d7f45b7cf8030c73b2d216d2a82fe127/gr8.sml gr8 gr8.sml sml 70116 162 50 IMAGE-THUMBNAIL 1-s2.0-S0306261921003755-fx1.sml https://s3-eu-west-1.amazonaws.com/prod-ucs-content-store-eu-west/content/pii:S0306261921003755/fx1/THUMBNAIL/image/gif/869732c4d6ddb38fa1a68c45e76516e7/fx1.sml fx1 true fx1.sml sml 69386 58 219 IMAGE-THUMBNAIL 1-s2.0-S0306261921003755-fx1001.sml https://s3-eu-west-1.amazonaws.com/prod-ucs-content-store-eu-west/content/pii:S0306261921003755/fx1001/THUMBNAIL/image/gif/3bea89c30b8bfbb8702de42d8ba45809/fx1001.sml fx1001 fx1001.sml sml 70929 97 219 IMAGE-THUMBNAIL 1-s2.0-S0306261921003755-gr1.sml https://s3-eu-west-1.amazonaws.com/prod-ucs-content-store-eu-west/content/pii:S0306261921003755/gr1/THUMBNAIL/image/gif/6b98c9eab8d5b18b1f5fb0b4f0453a05/gr1.sml gr1 gr1.sml sml 73620 145 219 IMAGE-THUMBNAIL 1-s2.0-S0306261921003755-fx1002.sml https://s3-eu-west-1.amazonaws.com/prod-ucs-content-store-eu-west/content/pii:S0306261921003755/fx1002/THUMBNAIL/image/gif/bcc8b6c827096939df23f74e2b3e2666/fx1002.sml fx1002 fx1002.sml sml 69547 103 219 IMAGE-THUMBNAIL 1-s2.0-S0306261921003755-gr3_lrg.jpg https://s3-eu-west-1.amazonaws.com/prod-ucs-content-store-eu-west/content/pii:S0306261921003755/gr3/HIGHRES/image/jpeg/362bf8e921df935feaa93830841b0c5d/gr3_lrg.jpg gr3 gr3_lrg.jpg jpg 165364 559 2500 IMAGE-HIGH-RES 1-s2.0-S0306261921003755-gr2_lrg.jpg https://s3-eu-west-1.amazonaws.com/prod-ucs-content-store-eu-west/content/pii:S0306261921003755/gr2/HIGHRES/image/jpeg/ce0fae482eaf49f5d1534a24cc83ae49/gr2_lrg.jpg gr2 gr2_lrg.jpg jpg 172975 943 1612 IMAGE-HIGH-RES 1-s2.0-S0306261921003755-gr5_lrg.jpg https://s3-eu-west-1.amazonaws.com/prod-ucs-content-store-eu-west/content/pii:S0306261921003755/gr5/HIGHRES/image/jpeg/180fe4c2815941bd0355433bebf2413e/gr5_lrg.jpg gr5 gr5_lrg.jpg jpg 252076 1008 1514 IMAGE-HIGH-RES 1-s2.0-S0306261921003755-gr4_lrg.jpg https://s3-eu-west-1.amazonaws.com/prod-ucs-content-store-eu-west/content/pii:S0306261921003755/gr4/HIGHRES/image/jpeg/61a34079c0b2f584fd371a057401bff9/gr4_lrg.jpg gr4 gr4_lrg.jpg jpg 501124 2082 1611 IMAGE-HIGH-RES 1-s2.0-S0306261921003755-gr7_lrg.jpg https://s3-eu-west-1.amazonaws.com/prod-ucs-content-store-eu-west/content/pii:S0306261921003755/gr7/HIGHRES/image/jpeg/97e5b385e36cddba0e1b4e49abe24be2/gr7_lrg.jpg gr7 gr7_lrg.jpg jpg 1198943 2075 3083 IMAGE-HIGH-RES 1-s2.0-S0306261921003755-gr6_lrg.jpg https://s3-eu-west-1.amazonaws.com/prod-ucs-content-store-eu-west/content/pii:S0306261921003755/gr6/HIGHRES/image/jpeg/464a7bcff7454c74c2c9a94ff56bde06/gr6_lrg.jpg gr6 gr6_lrg.jpg jpg 369379 821 2490 IMAGE-HIGH-RES 1-s2.0-S0306261921003755-gr8_lrg.jpg https://s3-eu-west-1.amazonaws.com/prod-ucs-content-store-eu-west/content/pii:S0306261921003755/gr8/HIGHRES/image/jpeg/e65742a1f3c0bedfbe910c6bca99bebc/gr8_lrg.jpg gr8 gr8_lrg.jpg jpg 523182 3943 1219 IMAGE-HIGH-RES 1-s2.0-S0306261921003755-fx1_lrg.jpg https://s3-eu-west-1.amazonaws.com/prod-ucs-content-store-eu-west/content/pii:S0306261921003755/fx1/HIGHRES/image/jpeg/df80c6d1b70a94d79bec9abb80a461a0/fx1_lrg.jpg fx1 true fx1_lrg.jpg jpg 134996 350 1333 IMAGE-HIGH-RES 1-s2.0-S0306261921003755-fx1001_lrg.jpg https://s3-eu-west-1.amazonaws.com/prod-ucs-content-store-eu-west/content/pii:S0306261921003755/fx1001/HIGHRES/image/jpeg/1da7d214d43713696d07b9db8f56b90e/fx1001_lrg.jpg fx1001 fx1001_lrg.jpg jpg 482970 1582 3583 IMAGE-HIGH-RES 1-s2.0-S0306261921003755-gr1_lrg.jpg https://s3-eu-west-1.amazonaws.com/prod-ucs-content-store-eu-west/content/pii:S0306261921003755/gr1/HIGHRES/image/jpeg/54fc5ebdd191fbaec927775d6622277e/gr1_lrg.jpg gr1 gr1_lrg.jpg jpg 185221 1085 1644 IMAGE-HIGH-RES 1-s2.0-S0306261921003755-fx1002_lrg.jpg https://s3-eu-west-1.amazonaws.com/prod-ucs-content-store-eu-west/content/pii:S0306261921003755/fx1002/HIGHRES/image/jpeg/760ddefcefe7ec67e2c5a17b42bc3a59/fx1002_lrg.jpg fx1002 fx1002_lrg.jpg jpg 381057 1692 3583 IMAGE-HIGH-RES 1-s2.0-S0306261921003755-si1.svg https://s3-eu-west-1.amazonaws.com/prod-ucs-content-store-eu-west/content/pii:S0306261921003755/STRIPIN/image/svg+xml/25679d160e2286899e1249308a2a2a84/si1.svg si1 si1.svg svg 18712 ALTIMG 1-s2.0-S0306261921003755-si10.svg https://s3-eu-west-1.amazonaws.com/prod-ucs-content-store-eu-west/content/pii:S0306261921003755/STRIPIN/image/svg+xml/5148f7d0c2278737e1738b5d24854d25/si10.svg si10 si10.svg svg 2786 ALTIMG 1-s2.0-S0306261921003755-si100.svg https://s3-eu-west-1.amazonaws.com/prod-ucs-content-store-eu-west/content/pii:S0306261921003755/STRIPIN/image/svg+xml/f03a55ac72ec7a1b733bb066ca0d1e92/si100.svg si100 si100.svg svg 4986 ALTIMG 1-s2.0-S0306261921003755-si102.svg https://s3-eu-west-1.amazonaws.com/prod-ucs-content-store-eu-west/content/pii:S0306261921003755/STRIPIN/image/svg+xml/309a58785bbbec4a337949cad4b9c56e/si102.svg si102 si102.svg svg 64028 ALTIMG 1-s2.0-S0306261921003755-si11.svg https://s3-eu-west-1.amazonaws.com/prod-ucs-content-store-eu-west/content/pii:S0306261921003755/STRIPIN/image/svg+xml/b6ea7c8a8200b3ffc1ac332969e26a19/si11.svg si11 si11.svg svg 3183 ALTIMG 1-s2.0-S0306261921003755-si112.svg https://s3-eu-west-1.amazonaws.com/prod-ucs-content-store-eu-west/content/pii:S0306261921003755/STRIPIN/image/svg+xml/daa0196b7d085e614c42743a9d3ed1f1/si112.svg si112 si112.svg svg 47182 ALTIMG 1-s2.0-S0306261921003755-si119.svg https://s3-eu-west-1.amazonaws.com/prod-ucs-content-store-eu-west/content/pii:S0306261921003755/STRIPIN/image/svg+xml/136ddbe484df8c8d20707f1d08fc91c7/si119.svg si119 si119.svg svg 2755 ALTIMG 1-s2.0-S0306261921003755-si12.svg https://s3-eu-west-1.amazonaws.com/prod-ucs-content-store-eu-west/content/pii:S0306261921003755/STRIPIN/image/svg+xml/2b36814814d6c8e587db1266c507c7ec/si12.svg si12 si12.svg svg 4480 ALTIMG 1-s2.0-S0306261921003755-si120.svg https://s3-eu-west-1.amazonaws.com/prod-ucs-content-store-eu-west/content/pii:S0306261921003755/STRIPIN/image/svg+xml/030d710aeec3c39c9b661a26f4823e74/si120.svg si120 si120.svg svg 2184 ALTIMG 1-s2.0-S0306261921003755-si121.svg https://s3-eu-west-1.amazonaws.com/prod-ucs-content-store-eu-west/content/pii:S0306261921003755/STRIPIN/image/svg+xml/74215926fbfa8b795f20fedd216bc1f3/si121.svg si121 si121.svg svg 3242 ALTIMG 1-s2.0-S0306261921003755-si122.svg https://s3-eu-west-1.amazonaws.com/prod-ucs-content-store-eu-west/content/pii:S0306261921003755/STRIPIN/image/svg+xml/791a4672acea6d1b70ddbf3c8be3ee8b/si122.svg si122 si122.svg svg 4124 ALTIMG 1-s2.0-S0306261921003755-si123.svg https://s3-eu-west-1.amazonaws.com/prod-ucs-content-store-eu-west/content/pii:S0306261921003755/STRIPIN/image/svg+xml/446123bb87275bd6d214e9f5de8a237c/si123.svg si123 si123.svg svg 9028 ALTIMG 1-s2.0-S0306261921003755-si124.svg https://s3-eu-west-1.amazonaws.com/prod-ucs-content-store-eu-west/content/pii:S0306261921003755/STRIPIN/image/svg+xml/700f1c6f016218455718bd3ba8e1f178/si124.svg si124 si124.svg svg 3604 ALTIMG 1-s2.0-S0306261921003755-si125.svg https://s3-eu-west-1.amazonaws.com/prod-ucs-content-store-eu-west/content/pii:S0306261921003755/STRIPIN/image/svg+xml/535f56429223713550a5ea70bbfbd6fe/si125.svg si125 si125.svg svg 3324 ALTIMG 1-s2.0-S0306261921003755-si126.svg https://s3-eu-west-1.amazonaws.com/prod-ucs-content-store-eu-west/content/pii:S0306261921003755/STRIPIN/image/svg+xml/c37792a83137a9fe18192ea52b017faa/si126.svg si126 si126.svg svg 5122 ALTIMG 1-s2.0-S0306261921003755-si127.svg https://s3-eu-west-1.amazonaws.com/prod-ucs-content-store-eu-west/content/pii:S0306261921003755/STRIPIN/image/svg+xml/7d23de04eb8c8f46fcd553b130035ea8/si127.svg si127 si127.svg svg 6058 ALTIMG 1-s2.0-S0306261921003755-si129.svg https://s3-eu-west-1.amazonaws.com/prod-ucs-content-store-eu-west/content/pii:S0306261921003755/STRIPIN/image/svg+xml/f53a259d204ec8cc28b30f0fc0229021/si129.svg si129 si129.svg svg 5595 ALTIMG 1-s2.0-S0306261921003755-si13.svg https://s3-eu-west-1.amazonaws.com/prod-ucs-content-store-eu-west/content/pii:S0306261921003755/STRIPIN/image/svg+xml/004ff72ab72ce70e255817975a3ffe92/si13.svg si13 si13.svg svg 4876 ALTIMG 1-s2.0-S0306261921003755-si130.svg https://s3-eu-west-1.amazonaws.com/prod-ucs-content-store-eu-west/content/pii:S0306261921003755/STRIPIN/image/svg+xml/b1dc24ce368580b3fa4a69eccdbb876c/si130.svg si130 si130.svg svg 10204 ALTIMG 1-s2.0-S0306261921003755-si131.svg https://s3-eu-west-1.amazonaws.com/prod-ucs-content-store-eu-west/content/pii:S0306261921003755/STRIPIN/image/svg+xml/50bce7e94283e058639c65f8dde9dbac/si131.svg si131 si131.svg svg 14427 ALTIMG 1-s2.0-S0306261921003755-si132.svg https://s3-eu-west-1.amazonaws.com/prod-ucs-content-store-eu-west/content/pii:S0306261921003755/STRIPIN/image/svg+xml/38c20759870835d9fed1be504cb5363d/si132.svg si132 si132.svg svg 2538 ALTIMG 1-s2.0-S0306261921003755-si134.svg https://s3-eu-west-1.amazonaws.com/prod-ucs-content-store-eu-west/content/pii:S0306261921003755/STRIPIN/image/svg+xml/c9bf74804da3b670fbbb4ec9cae8c739/si134.svg si134 si134.svg svg 5986 ALTIMG 1-s2.0-S0306261921003755-si135.svg https://s3-eu-west-1.amazonaws.com/prod-ucs-content-store-eu-west/content/pii:S0306261921003755/STRIPIN/image/svg+xml/c5a4ddabc4523cc490c6801788bfa310/si135.svg si135 si135.svg svg 2179 ALTIMG 1-s2.0-S0306261921003755-si136.svg https://s3-eu-west-1.amazonaws.com/prod-ucs-content-store-eu-west/content/pii:S0306261921003755/STRIPIN/image/svg+xml/412530d97c467a1a8463b63dd375312f/si136.svg si136 si136.svg svg 4929 ALTIMG 1-s2.0-S0306261921003755-si137.svg https://s3-eu-west-1.amazonaws.com/prod-ucs-content-store-eu-west/content/pii:S0306261921003755/STRIPIN/image/svg+xml/48e7a938851a73e35b827f215fe89367/si137.svg si137 si137.svg svg 4980 ALTIMG 1-s2.0-S0306261921003755-si138.svg https://s3-eu-west-1.amazonaws.com/prod-ucs-content-store-eu-west/content/pii:S0306261921003755/STRIPIN/image/svg+xml/2d03fdf2315f63cfb9adb2f44a789437/si138.svg si138 si138.svg svg 5574 ALTIMG 1-s2.0-S0306261921003755-si139.svg https://s3-eu-west-1.amazonaws.com/prod-ucs-content-store-eu-west/content/pii:S0306261921003755/STRIPIN/image/svg+xml/aa8bd2aee801a2e7de49d97fe2ce0059/si139.svg si139 si139.svg svg 13283 ALTIMG 1-s2.0-S0306261921003755-si14.svg https://s3-eu-west-1.amazonaws.com/prod-ucs-content-store-eu-west/content/pii:S0306261921003755/STRIPIN/image/svg+xml/88877ae78ebc3fa2e389ba4141875f2a/si14.svg si14 si14.svg svg 9184 ALTIMG 1-s2.0-S0306261921003755-si140.svg https://s3-eu-west-1.amazonaws.com/prod-ucs-content-store-eu-west/content/pii:S0306261921003755/STRIPIN/image/svg+xml/9a285029e9ae041ae7c11dcb271b0f76/si140.svg si140 si140.svg svg 9077 ALTIMG 1-s2.0-S0306261921003755-si141.svg https://s3-eu-west-1.amazonaws.com/prod-ucs-content-store-eu-west/content/pii:S0306261921003755/STRIPIN/image/svg+xml/734161ecfada1f5b680e664bd48704b1/si141.svg si141 si141.svg svg 15522 ALTIMG 1-s2.0-S0306261921003755-si142.svg https://s3-eu-west-1.amazonaws.com/prod-ucs-content-store-eu-west/content/pii:S0306261921003755/STRIPIN/image/svg+xml/83fac8d9e0b64672a49d897c7c620e38/si142.svg si142 si142.svg svg 8372 ALTIMG 1-s2.0-S0306261921003755-si143.svg https://s3-eu-west-1.amazonaws.com/prod-ucs-content-store-eu-west/content/pii:S0306261921003755/STRIPIN/image/svg+xml/46a84a66feecc943a70cd9404ea374ce/si143.svg si143 si143.svg svg 15272 ALTIMG 1-s2.0-S0306261921003755-si144.svg https://s3-eu-west-1.amazonaws.com/prod-ucs-content-store-eu-west/content/pii:S0306261921003755/STRIPIN/image/svg+xml/5f44102fbc6e168de2a823876772f4d8/si144.svg si144 si144.svg svg 15182 ALTIMG 1-s2.0-S0306261921003755-si145.svg https://s3-eu-west-1.amazonaws.com/prod-ucs-content-store-eu-west/content/pii:S0306261921003755/STRIPIN/image/svg+xml/c731f570084cc562fd82d327da4e9790/si145.svg si145 si145.svg svg 18306 ALTIMG 1-s2.0-S0306261921003755-si146.svg https://s3-eu-west-1.amazonaws.com/prod-ucs-content-store-eu-west/content/pii:S0306261921003755/STRIPIN/image/svg+xml/badcb3a34bfa1ca552ce7b74abb22230/si146.svg si146 si146.svg svg 2572 ALTIMG 1-s2.0-S0306261921003755-si148.svg https://s3-eu-west-1.amazonaws.com/prod-ucs-content-store-eu-west/content/pii:S0306261921003755/STRIPIN/image/svg+xml/a87d84583bf8f45c1e3bf43493d7ec78/si148.svg si148 si148.svg svg 3606 ALTIMG 1-s2.0-S0306261921003755-si149.svg https://s3-eu-west-1.amazonaws.com/prod-ucs-content-store-eu-west/content/pii:S0306261921003755/STRIPIN/image/svg+xml/813e8c736f0c5001fa9a1be6cb323079/si149.svg si149 si149.svg svg 5192 ALTIMG 1-s2.0-S0306261921003755-si15.svg https://s3-eu-west-1.amazonaws.com/prod-ucs-content-store-eu-west/content/pii:S0306261921003755/STRIPIN/image/svg+xml/ce9bc6055a94c6020e14b67114db0f21/si15.svg si15 si15.svg svg 9636 ALTIMG 1-s2.0-S0306261921003755-si150.svg https://s3-eu-west-1.amazonaws.com/prod-ucs-content-store-eu-west/content/pii:S0306261921003755/STRIPIN/image/svg+xml/c048bb5fd694b342cd5e99bebed1253a/si150.svg si150 si150.svg svg 3882 ALTIMG 1-s2.0-S0306261921003755-si151.svg https://s3-eu-west-1.amazonaws.com/prod-ucs-content-store-eu-west/content/pii:S0306261921003755/STRIPIN/image/svg+xml/631d79a2451ac1f91ee8a48853a6117c/si151.svg si151 si151.svg svg 4567 ALTIMG 1-s2.0-S0306261921003755-si152.svg https://s3-eu-west-1.amazonaws.com/prod-ucs-content-store-eu-west/content/pii:S0306261921003755/STRIPIN/image/svg+xml/332d8c4b9be7cbe200da027b2a263513/si152.svg si152 si152.svg svg 3664 ALTIMG 1-s2.0-S0306261921003755-si153.svg https://s3-eu-west-1.amazonaws.com/prod-ucs-content-store-eu-west/content/pii:S0306261921003755/STRIPIN/image/svg+xml/125cad8ef758070c5553e28b7aeae585/si153.svg si153 si153.svg svg 3381 ALTIMG 1-s2.0-S0306261921003755-si154.svg https://s3-eu-west-1.amazonaws.com/prod-ucs-content-store-eu-west/content/pii:S0306261921003755/STRIPIN/image/svg+xml/4d5cb637ec67eb0f732a196e7a01b0ff/si154.svg si154 si154.svg svg 2307 ALTIMG 1-s2.0-S0306261921003755-si155.svg https://s3-eu-west-1.amazonaws.com/prod-ucs-content-store-eu-west/content/pii:S0306261921003755/STRIPIN/image/svg+xml/328c27cad51b278c56d8b46e3d8e3e23/si155.svg si155 si155.svg svg 9793 ALTIMG 1-s2.0-S0306261921003755-si159.svg https://s3-eu-west-1.amazonaws.com/prod-ucs-content-store-eu-west/content/pii:S0306261921003755/STRIPIN/image/svg+xml/55bef0527a45d9bc4ccb2c64f1d55857/si159.svg si159 si159.svg svg 16125 ALTIMG 1-s2.0-S0306261921003755-si16.svg https://s3-eu-west-1.amazonaws.com/prod-ucs-content-store-eu-west/content/pii:S0306261921003755/STRIPIN/image/svg+xml/29aa954d3db44b8a3531569a14885fa2/si16.svg si16 si16.svg svg 11627 ALTIMG 1-s2.0-S0306261921003755-si160.svg https://s3-eu-west-1.amazonaws.com/prod-ucs-content-store-eu-west/content/pii:S0306261921003755/STRIPIN/image/svg+xml/a5655de902a438700824afa3839a7083/si160.svg si160 si160.svg svg 9113 ALTIMG 1-s2.0-S0306261921003755-si161.svg https://s3-eu-west-1.amazonaws.com/prod-ucs-content-store-eu-west/content/pii:S0306261921003755/STRIPIN/image/svg+xml/8e543ac91e411d9510ba054b6b8c87d9/si161.svg si161 si161.svg svg 8127 ALTIMG 1-s2.0-S0306261921003755-si162.svg https://s3-eu-west-1.amazonaws.com/prod-ucs-content-store-eu-west/content/pii:S0306261921003755/STRIPIN/image/svg+xml/77d56d6c41eec812193c748719a2ff6c/si162.svg si162 si162.svg svg 12994 ALTIMG 1-s2.0-S0306261921003755-si163.svg https://s3-eu-west-1.amazonaws.com/prod-ucs-content-store-eu-west/content/pii:S0306261921003755/STRIPIN/image/svg+xml/1337963e840f6e2c1686ae2b9c1b7dff/si163.svg si163 si163.svg svg 13392 ALTIMG 1-s2.0-S0306261921003755-si164.svg https://s3-eu-west-1.amazonaws.com/prod-ucs-content-store-eu-west/content/pii:S0306261921003755/STRIPIN/image/svg+xml/61fea18ebbf5d03acdf19b031f26243c/si164.svg si164 si164.svg svg 15915 ALTIMG 1-s2.0-S0306261921003755-si165.svg https://s3-eu-west-1.amazonaws.com/prod-ucs-content-store-eu-west/content/pii:S0306261921003755/STRIPIN/image/svg+xml/5df0d68be63e21eb3dc11c84f01ca86c/si165.svg si165 si165.svg svg 14939 ALTIMG 1-s2.0-S0306261921003755-si166.svg https://s3-eu-west-1.amazonaws.com/prod-ucs-content-store-eu-west/content/pii:S0306261921003755/STRIPIN/image/svg+xml/4dc1ceb8d993c453d74d039324672034/si166.svg si166 si166.svg svg 15503 ALTIMG 1-s2.0-S0306261921003755-si167.svg https://s3-eu-west-1.amazonaws.com/prod-ucs-content-store-eu-west/content/pii:S0306261921003755/STRIPIN/image/svg+xml/f2248cb388be2fa2feda75954b2c07ae/si167.svg si167 si167.svg svg 10882 ALTIMG 1-s2.0-S0306261921003755-si168.svg https://s3-eu-west-1.amazonaws.com/prod-ucs-content-store-eu-west/content/pii:S0306261921003755/STRIPIN/image/svg+xml/608c9f70ea198c06b0f3e4cf2f345960/si168.svg si168 si168.svg svg 7818 ALTIMG 1-s2.0-S0306261921003755-si169.svg https://s3-eu-west-1.amazonaws.com/prod-ucs-content-store-eu-west/content/pii:S0306261921003755/STRIPIN/image/svg+xml/006369a9038f8b2e6d9b5db978a21e9f/si169.svg si169 si169.svg svg 25199 ALTIMG 1-s2.0-S0306261921003755-si17.svg https://s3-eu-west-1.amazonaws.com/prod-ucs-content-store-eu-west/content/pii:S0306261921003755/STRIPIN/image/svg+xml/7d4a2353bd425391fb98362954e5363b/si17.svg si17 si17.svg svg 5747 ALTIMG 1-s2.0-S0306261921003755-si170.svg https://s3-eu-west-1.amazonaws.com/prod-ucs-content-store-eu-west/content/pii:S0306261921003755/STRIPIN/image/svg+xml/4d8de145f4fec2f1001c537062285898/si170.svg si170 si170.svg svg 7109 ALTIMG 1-s2.0-S0306261921003755-si171.svg https://s3-eu-west-1.amazonaws.com/prod-ucs-content-store-eu-west/content/pii:S0306261921003755/STRIPIN/image/svg+xml/a7e7103e49701c28368716a5dd2b42ba/si171.svg si171 si171.svg svg 5539 ALTIMG 1-s2.0-S0306261921003755-si172.svg https://s3-eu-west-1.amazonaws.com/prod-ucs-content-store-eu-west/content/pii:S0306261921003755/STRIPIN/image/svg+xml/e5106355d7872ca060c0ebe6c15eb208/si172.svg si172 si172.svg svg 8409 ALTIMG 1-s2.0-S0306261921003755-si173.svg https://s3-eu-west-1.amazonaws.com/prod-ucs-content-store-eu-west/content/pii:S0306261921003755/STRIPIN/image/svg+xml/762765f7e81bc0ada8e0c925694a3919/si173.svg si173 si173.svg svg 11089 ALTIMG 1-s2.0-S0306261921003755-si174.svg https://s3-eu-west-1.amazonaws.com/prod-ucs-content-store-eu-west/content/pii:S0306261921003755/STRIPIN/image/svg+xml/426ca8934c263890d7c11162ccdd4499/si174.svg si174 si174.svg svg 10080 ALTIMG 1-s2.0-S0306261921003755-si175.svg https://s3-eu-west-1.amazonaws.com/prod-ucs-content-store-eu-west/content/pii:S0306261921003755/STRIPIN/image/svg+xml/dec146c1affea05f563f90fc0644f474/si175.svg si175 si175.svg svg 9943 ALTIMG 1-s2.0-S0306261921003755-si176.svg https://s3-eu-west-1.amazonaws.com/prod-ucs-content-store-eu-west/content/pii:S0306261921003755/STRIPIN/image/svg+xml/b05e83f9eb9011db5da2d7e4ed76b434/si176.svg si176 si176.svg svg 1211 ALTIMG 1-s2.0-S0306261921003755-si177.svg https://s3-eu-west-1.amazonaws.com/prod-ucs-content-store-eu-west/content/pii:S0306261921003755/STRIPIN/image/svg+xml/a7619e69840939906b3902faa9377515/si177.svg si177 si177.svg svg 19715 ALTIMG 1-s2.0-S0306261921003755-si178.svg https://s3-eu-west-1.amazonaws.com/prod-ucs-content-store-eu-west/content/pii:S0306261921003755/STRIPIN/image/svg+xml/b8ba18824bd689aa185d7366b7fba7a4/si178.svg si178 si178.svg svg 6652 ALTIMG 1-s2.0-S0306261921003755-si179.svg https://s3-eu-west-1.amazonaws.com/prod-ucs-content-store-eu-west/content/pii:S0306261921003755/STRIPIN/image/svg+xml/69c57ba088834021c1d501471453d429/si179.svg si179 si179.svg svg 7965 ALTIMG 1-s2.0-S0306261921003755-si18.svg https://s3-eu-west-1.amazonaws.com/prod-ucs-content-store-eu-west/content/pii:S0306261921003755/STRIPIN/image/svg+xml/354f66632b49a404f094fe0e38749977/si18.svg si18 si18.svg svg 2828 ALTIMG 1-s2.0-S0306261921003755-si182.svg https://s3-eu-west-1.amazonaws.com/prod-ucs-content-store-eu-west/content/pii:S0306261921003755/STRIPIN/image/svg+xml/862abe607a3dd64ef3a12ad88fc08424/si182.svg si182 si182.svg svg 4487 ALTIMG 1-s2.0-S0306261921003755-si183.svg https://s3-eu-west-1.amazonaws.com/prod-ucs-content-store-eu-west/content/pii:S0306261921003755/STRIPIN/image/svg+xml/6a998a01a42b8d33c68a75e268a9c5a9/si183.svg si183 si183.svg svg 3261 ALTIMG 1-s2.0-S0306261921003755-si184.svg https://s3-eu-west-1.amazonaws.com/prod-ucs-content-store-eu-west/content/pii:S0306261921003755/STRIPIN/image/svg+xml/17bdeb786ee77e7d355c51ac1039ab87/si184.svg si184 si184.svg svg 5705 ALTIMG 1-s2.0-S0306261921003755-si185.svg https://s3-eu-west-1.amazonaws.com/prod-ucs-content-store-eu-west/content/pii:S0306261921003755/STRIPIN/image/svg+xml/732f9d32cf21f8d6377310cbfd2aeba9/si185.svg si185 si185.svg svg 2998 ALTIMG 1-s2.0-S0306261921003755-si186.svg https://s3-eu-west-1.amazonaws.com/prod-ucs-content-store-eu-west/content/pii:S0306261921003755/STRIPIN/image/svg+xml/166de7fb703cfe4fbd0d58f110ca6697/si186.svg si186 si186.svg svg 3021 ALTIMG 1-s2.0-S0306261921003755-si188.svg https://s3-eu-west-1.amazonaws.com/prod-ucs-content-store-eu-west/content/pii:S0306261921003755/STRIPIN/image/svg+xml/c3b1a8e6011151fb6f1e9c163fe6ae40/si188.svg si188 si188.svg svg 4581 ALTIMG 1-s2.0-S0306261921003755-si190.svg https://s3-eu-west-1.amazonaws.com/prod-ucs-content-store-eu-west/content/pii:S0306261921003755/STRIPIN/image/svg+xml/80440d0e445153b7a7f073730fb62a63/si190.svg si190 si190.svg svg 2466 ALTIMG 1-s2.0-S0306261921003755-si191.svg https://s3-eu-west-1.amazonaws.com/prod-ucs-content-store-eu-west/content/pii:S0306261921003755/STRIPIN/image/svg+xml/706650349ac9f1ddd429eeecfee6464f/si191.svg si191 si191.svg svg 6107 ALTIMG 1-s2.0-S0306261921003755-si192.svg https://s3-eu-west-1.amazonaws.com/prod-ucs-content-store-eu-west/content/pii:S0306261921003755/STRIPIN/image/svg+xml/07fe4f5147602acf716c41245b240352/si192.svg si192 si192.svg svg 4944 ALTIMG 1-s2.0-S0306261921003755-si193.svg https://s3-eu-west-1.amazonaws.com/prod-ucs-content-store-eu-west/content/pii:S0306261921003755/STRIPIN/image/svg+xml/d199d07528fa8c34db219ef9aa7f89f1/si193.svg si193 si193.svg svg 4409 ALTIMG 1-s2.0-S0306261921003755-si194.svg https://s3-eu-west-1.amazonaws.com/prod-ucs-content-store-eu-west/content/pii:S0306261921003755/STRIPIN/image/svg+xml/344cc212f4558ef8651b869e27102842/si194.svg si194 si194.svg svg 4572 ALTIMG 1-s2.0-S0306261921003755-si195.svg https://s3-eu-west-1.amazonaws.com/prod-ucs-content-store-eu-west/content/pii:S0306261921003755/STRIPIN/image/svg+xml/962d4f490f3479cd687f698c69e873ca/si195.svg si195 si195.svg svg 3691 ALTIMG 1-s2.0-S0306261921003755-si196.svg https://s3-eu-west-1.amazonaws.com/prod-ucs-content-store-eu-west/content/pii:S0306261921003755/STRIPIN/image/svg+xml/08eda1487032a605ee236fe9599b89ce/si196.svg si196 si196.svg svg 3346 ALTIMG 1-s2.0-S0306261921003755-si197.svg https://s3-eu-west-1.amazonaws.com/prod-ucs-content-store-eu-west/content/pii:S0306261921003755/STRIPIN/image/svg+xml/3ece8ac1efea74b43ffcb34ec336c92d/si197.svg si197 si197.svg svg 2589 ALTIMG 1-s2.0-S0306261921003755-si198.svg https://s3-eu-west-1.amazonaws.com/prod-ucs-content-store-eu-west/content/pii:S0306261921003755/STRIPIN/image/svg+xml/921823c91a68a6b6ba6175b86ec4a34b/si198.svg si198 si198.svg svg 16912 ALTIMG 1-s2.0-S0306261921003755-si199.svg https://s3-eu-west-1.amazonaws.com/prod-ucs-content-store-eu-west/content/pii:S0306261921003755/STRIPIN/image/svg+xml/949482170bc408cc0494e35469da7d1a/si199.svg si199 si199.svg svg 7950 ALTIMG 1-s2.0-S0306261921003755-si2.svg https://s3-eu-west-1.amazonaws.com/prod-ucs-content-store-eu-west/content/pii:S0306261921003755/STRIPIN/image/svg+xml/90a443837c5b025f5cf8e49291c1ec0d/si2.svg si2 si2.svg svg 14653 ALTIMG 1-s2.0-S0306261921003755-si200.svg https://s3-eu-west-1.amazonaws.com/prod-ucs-content-store-eu-west/content/pii:S0306261921003755/STRIPIN/image/svg+xml/46173dbd49210fb0b440bc366d1c6fc8/si200.svg si200 si200.svg svg 16125 ALTIMG 1-s2.0-S0306261921003755-si201.svg https://s3-eu-west-1.amazonaws.com/prod-ucs-content-store-eu-west/content/pii:S0306261921003755/STRIPIN/image/svg+xml/d9c43312fe8197c5f255fb780201a897/si201.svg si201 si201.svg svg 9113 ALTIMG 1-s2.0-S0306261921003755-si202.svg https://s3-eu-west-1.amazonaws.com/prod-ucs-content-store-eu-west/content/pii:S0306261921003755/STRIPIN/image/svg+xml/0b083339d29eb63738a836d352ea956f/si202.svg si202 si202.svg svg 2490 ALTIMG 1-s2.0-S0306261921003755-si203.svg https://s3-eu-west-1.amazonaws.com/prod-ucs-content-store-eu-west/content/pii:S0306261921003755/STRIPIN/image/svg+xml/c8bc707de66c1600d704a0662575be65/si203.svg si203 si203.svg svg 5148 ALTIMG 1-s2.0-S0306261921003755-si204.svg https://s3-eu-west-1.amazonaws.com/prod-ucs-content-store-eu-west/content/pii:S0306261921003755/STRIPIN/image/svg+xml/eeda9d342e2e4f99a66525598d522103/si204.svg si204 si204.svg svg 17594 ALTIMG 1-s2.0-S0306261921003755-si205.svg https://s3-eu-west-1.amazonaws.com/prod-ucs-content-store-eu-west/content/pii:S0306261921003755/STRIPIN/image/svg+xml/e722b89f2a35fa77127226bc95fe5709/si205.svg si205 si205.svg svg 14888 ALTIMG 1-s2.0-S0306261921003755-si206.svg https://s3-eu-west-1.amazonaws.com/prod-ucs-content-store-eu-west/content/pii:S0306261921003755/STRIPIN/image/svg+xml/8534d6b4b5b21e8ab477f6663a51ecf7/si206.svg si206 si206.svg svg 15453 ALTIMG 1-s2.0-S0306261921003755-si207.svg https://s3-eu-west-1.amazonaws.com/prod-ucs-content-store-eu-west/content/pii:S0306261921003755/STRIPIN/image/svg+xml/4aa5f4a72d7c61430444abf6e95e8c1e/si207.svg si207 si207.svg svg 14677 ALTIMG 1-s2.0-S0306261921003755-si208.svg https://s3-eu-west-1.amazonaws.com/prod-ucs-content-store-eu-west/content/pii:S0306261921003755/STRIPIN/image/svg+xml/b14e9c68a93680a84878d7a76aab241b/si208.svg si208 si208.svg svg 10178 ALTIMG 1-s2.0-S0306261921003755-si210.svg https://s3-eu-west-1.amazonaws.com/prod-ucs-content-store-eu-west/content/pii:S0306261921003755/STRIPIN/image/svg+xml/add27e194b924eb9b9f2522ab5f5ef73/si210.svg si210 si210.svg svg 9869 ALTIMG 1-s2.0-S0306261921003755-si212.svg https://s3-eu-west-1.amazonaws.com/prod-ucs-content-store-eu-west/content/pii:S0306261921003755/STRIPIN/image/svg+xml/e344ad1776df3d5079d2e3ff5eaaa6e1/si212.svg si212 si212.svg svg 3505 ALTIMG 1-s2.0-S0306261921003755-si214.svg https://s3-eu-west-1.amazonaws.com/prod-ucs-content-store-eu-west/content/pii:S0306261921003755/STRIPIN/image/svg+xml/b346a38e5ebdc2ba45b2364f384dd4bb/si214.svg si214 si214.svg svg 5085 ALTIMG 1-s2.0-S0306261921003755-si215.svg https://s3-eu-west-1.amazonaws.com/prod-ucs-content-store-eu-west/content/pii:S0306261921003755/STRIPIN/image/svg+xml/a4ff09bde7e5d4fc1609d305e94722a2/si215.svg si215 si215.svg svg 8217 ALTIMG 1-s2.0-S0306261921003755-si216.svg https://s3-eu-west-1.amazonaws.com/prod-ucs-content-store-eu-west/content/pii:S0306261921003755/STRIPIN/image/svg+xml/ffd32fab2f0465d4bc1800e9def3e1f8/si216.svg si216 si216.svg svg 4623 ALTIMG 1-s2.0-S0306261921003755-si218.svg https://s3-eu-west-1.amazonaws.com/prod-ucs-content-store-eu-west/content/pii:S0306261921003755/STRIPIN/image/svg+xml/748143e23a0a5c73bea4f80bd3564737/si218.svg si218 si218.svg svg 11121 ALTIMG 1-s2.0-S0306261921003755-si219.svg https://s3-eu-west-1.amazonaws.com/prod-ucs-content-store-eu-west/content/pii:S0306261921003755/STRIPIN/image/svg+xml/bcb7c93e7a584f5650a4df98ee5d80c6/si219.svg si219 si219.svg svg 3620 ALTIMG 1-s2.0-S0306261921003755-si22.svg https://s3-eu-west-1.amazonaws.com/prod-ucs-content-store-eu-west/content/pii:S0306261921003755/STRIPIN/image/svg+xml/238fe567c7a7095bd9837585649f67da/si22.svg si22 si22.svg svg 16203 ALTIMG 1-s2.0-S0306261921003755-si220.svg https://s3-eu-west-1.amazonaws.com/prod-ucs-content-store-eu-west/content/pii:S0306261921003755/STRIPIN/image/svg+xml/105c9f6b9376fdbf80d3db6469d3e1fa/si220.svg si220 si220.svg svg 4558 ALTIMG 1-s2.0-S0306261921003755-si221.svg https://s3-eu-west-1.amazonaws.com/prod-ucs-content-store-eu-west/content/pii:S0306261921003755/STRIPIN/image/svg+xml/d3a917425b5963e93e7338977a9d87ab/si221.svg si221 si221.svg svg 3228 ALTIMG 1-s2.0-S0306261921003755-si223.svg https://s3-eu-west-1.amazonaws.com/prod-ucs-content-store-eu-west/content/pii:S0306261921003755/STRIPIN/image/svg+xml/733e7cc2f33c275a32083045794d049a/si223.svg si223 si223.svg svg 6349 ALTIMG 1-s2.0-S0306261921003755-si224.svg https://s3-eu-west-1.amazonaws.com/prod-ucs-content-store-eu-west/content/pii:S0306261921003755/STRIPIN/image/svg+xml/a3992ad81b2d4d63c024948454d5fd05/si224.svg si224 si224.svg svg 8875 ALTIMG 1-s2.0-S0306261921003755-si225.svg https://s3-eu-west-1.amazonaws.com/prod-ucs-content-store-eu-west/content/pii:S0306261921003755/STRIPIN/image/svg+xml/5a481db5381312aa8d8da8e97f2a6649/si225.svg si225 si225.svg svg 8851 ALTIMG 1-s2.0-S0306261921003755-si228.svg https://s3-eu-west-1.amazonaws.com/prod-ucs-content-store-eu-west/content/pii:S0306261921003755/STRIPIN/image/svg+xml/a963a4bb86a9efbd41053a537cd834a6/si228.svg si228 si228.svg svg 2701 ALTIMG 1-s2.0-S0306261921003755-si229.svg https://s3-eu-west-1.amazonaws.com/prod-ucs-content-store-eu-west/content/pii:S0306261921003755/STRIPIN/image/svg+xml/083c5023cb0cb89fa243561c47bbd401/si229.svg si229 si229.svg svg 1442 ALTIMG 1-s2.0-S0306261921003755-si23.svg https://s3-eu-west-1.amazonaws.com/prod-ucs-content-store-eu-west/content/pii:S0306261921003755/STRIPIN/image/svg+xml/9c4bbe16ece62944ac83b9cf3a721e6d/si23.svg si23 si23.svg svg 12248 ALTIMG 1-s2.0-S0306261921003755-si230.svg https://s3-eu-west-1.amazonaws.com/prod-ucs-content-store-eu-west/content/pii:S0306261921003755/STRIPIN/image/svg+xml/20c6c849d38d9567cf042403af251316/si230.svg si230 si230.svg svg 2291 ALTIMG 1-s2.0-S0306261921003755-si231.svg https://s3-eu-west-1.amazonaws.com/prod-ucs-content-store-eu-west/content/pii:S0306261921003755/STRIPIN/image/svg+xml/bca11c817f2ad310ffe2afd18c543330/si231.svg si231 si231.svg svg 4184 ALTIMG 1-s2.0-S0306261921003755-si232.svg https://s3-eu-west-1.amazonaws.com/prod-ucs-content-store-eu-west/content/pii:S0306261921003755/STRIPIN/image/svg+xml/f2dde08247edb87cf89e8850914503a7/si232.svg si232 si232.svg svg 2465 ALTIMG 1-s2.0-S0306261921003755-si233.svg https://s3-eu-west-1.amazonaws.com/prod-ucs-content-store-eu-west/content/pii:S0306261921003755/STRIPIN/image/svg+xml/936f521e9a8e8eac97134e700a99b5dc/si233.svg si233 si233.svg svg 4210 ALTIMG 1-s2.0-S0306261921003755-si234.svg https://s3-eu-west-1.amazonaws.com/prod-ucs-content-store-eu-west/content/pii:S0306261921003755/STRIPIN/image/svg+xml/204a5af7600f6fd28f1f16486aa5a114/si234.svg si234 si234.svg svg 2685 ALTIMG 1-s2.0-S0306261921003755-si235.svg https://s3-eu-west-1.amazonaws.com/prod-ucs-content-store-eu-west/content/pii:S0306261921003755/STRIPIN/image/svg+xml/464de765a4652c8b5e49a35f103b1bb4/si235.svg si235 si235.svg svg 4933 ALTIMG 1-s2.0-S0306261921003755-si236.svg https://s3-eu-west-1.amazonaws.com/prod-ucs-content-store-eu-west/content/pii:S0306261921003755/STRIPIN/image/svg+xml/b44e1fa02424cf8ea6d562636b980a9f/si236.svg si236 si236.svg svg 2006 ALTIMG 1-s2.0-S0306261921003755-si237.svg https://s3-eu-west-1.amazonaws.com/prod-ucs-content-store-eu-west/content/pii:S0306261921003755/STRIPIN/image/svg+xml/a346f0abbb7004a39de16891dca394d9/si237.svg si237 si237.svg svg 5320 ALTIMG 1-s2.0-S0306261921003755-si24.svg https://s3-eu-west-1.amazonaws.com/prod-ucs-content-store-eu-west/content/pii:S0306261921003755/STRIPIN/image/svg+xml/b3a89ae45bbb2c3476697414da172a86/si24.svg si24 si24.svg svg 2084 ALTIMG 1-s2.0-S0306261921003755-si240.svg https://s3-eu-west-1.amazonaws.com/prod-ucs-content-store-eu-west/content/pii:S0306261921003755/STRIPIN/image/svg+xml/5b0c807a36314012416c12582f94b9fb/si240.svg si240 si240.svg svg 4646 ALTIMG 1-s2.0-S0306261921003755-si242.svg https://s3-eu-west-1.amazonaws.com/prod-ucs-content-store-eu-west/content/pii:S0306261921003755/STRIPIN/image/svg+xml/33594883bf645031428f33f30f9d7ce4/si242.svg si242 si242.svg svg 5511 ALTIMG 1-s2.0-S0306261921003755-si244.svg https://s3-eu-west-1.amazonaws.com/prod-ucs-content-store-eu-west/content/pii:S0306261921003755/STRIPIN/image/svg+xml/aac447b6ed395d0e2677470bda5c0221/si244.svg si244 si244.svg svg 5196 ALTIMG 1-s2.0-S0306261921003755-si245.svg https://s3-eu-west-1.amazonaws.com/prod-ucs-content-store-eu-west/content/pii:S0306261921003755/STRIPIN/image/svg+xml/ec4e2d05ff20b09e3cc529f5834e66fa/si245.svg si245 si245.svg svg 8532 ALTIMG 1-s2.0-S0306261921003755-si246.svg https://s3-eu-west-1.amazonaws.com/prod-ucs-content-store-eu-west/content/pii:S0306261921003755/STRIPIN/image/svg+xml/7106c684072fd3ae9132b6bb5a173361/si246.svg si246 si246.svg svg 8911 ALTIMG 1-s2.0-S0306261921003755-si247.svg https://s3-eu-west-1.amazonaws.com/prod-ucs-content-store-eu-west/content/pii:S0306261921003755/STRIPIN/image/svg+xml/a30d16590b105881b817db3d16553b51/si247.svg si247 si247.svg svg 1086 ALTIMG 1-s2.0-S0306261921003755-si248.svg https://s3-eu-west-1.amazonaws.com/prod-ucs-content-store-eu-west/content/pii:S0306261921003755/STRIPIN/image/svg+xml/900ba3cf5e0192677527a8a6c48dc496/si248.svg si248 si248.svg svg 3993 ALTIMG 1-s2.0-S0306261921003755-si25.svg https://s3-eu-west-1.amazonaws.com/prod-ucs-content-store-eu-west/content/pii:S0306261921003755/STRIPIN/image/svg+xml/0e35d2028c8320ebbae7300bdba53d21/si25.svg si25 si25.svg svg 2363 ALTIMG 1-s2.0-S0306261921003755-si26.svg https://s3-eu-west-1.amazonaws.com/prod-ucs-content-store-eu-west/content/pii:S0306261921003755/STRIPIN/image/svg+xml/267fef6fabfe0b5df55e0aa97ca4ca27/si26.svg si26 si26.svg svg 2306 ALTIMG 1-s2.0-S0306261921003755-si27.svg https://s3-eu-west-1.amazonaws.com/prod-ucs-content-store-eu-west/content/pii:S0306261921003755/STRIPIN/image/svg+xml/76b83e4b65f2d19335a077de4a5134e4/si27.svg si27 si27.svg svg 2334 ALTIMG 1-s2.0-S0306261921003755-si28.svg https://s3-eu-west-1.amazonaws.com/prod-ucs-content-store-eu-west/content/pii:S0306261921003755/STRIPIN/image/svg+xml/7d3ff39424703bb4beb707893e5e6db1/si28.svg si28 si28.svg svg 1991 ALTIMG 1-s2.0-S0306261921003755-si29.svg https://s3-eu-west-1.amazonaws.com/prod-ucs-content-store-eu-west/content/pii:S0306261921003755/STRIPIN/image/svg+xml/14a17840b57b2cfdd85780e665e2eafa/si29.svg si29 si29.svg svg 2437 ALTIMG 1-s2.0-S0306261921003755-si3.svg https://s3-eu-west-1.amazonaws.com/prod-ucs-content-store-eu-west/content/pii:S0306261921003755/STRIPIN/image/svg+xml/8a7a8371aedaf7fd639a548057a7780a/si3.svg si3 si3.svg svg 11637 ALTIMG 1-s2.0-S0306261921003755-si30.svg https://s3-eu-west-1.amazonaws.com/prod-ucs-content-store-eu-west/content/pii:S0306261921003755/STRIPIN/image/svg+xml/49a353029295cfe8c02859d98fe39202/si30.svg si30 si30.svg svg 2621 ALTIMG 1-s2.0-S0306261921003755-si31.svg https://s3-eu-west-1.amazonaws.com/prod-ucs-content-store-eu-west/content/pii:S0306261921003755/STRIPIN/image/svg+xml/c2daabfbdb28c2067d753212cac5cea9/si31.svg si31 si31.svg svg 12137 ALTIMG 1-s2.0-S0306261921003755-si32.svg https://s3-eu-west-1.amazonaws.com/prod-ucs-content-store-eu-west/content/pii:S0306261921003755/STRIPIN/image/svg+xml/976ea2f09b2a7bc9832e86508cd56119/si32.svg si32 si32.svg svg 8767 ALTIMG 1-s2.0-S0306261921003755-si33.svg https://s3-eu-west-1.amazonaws.com/prod-ucs-content-store-eu-west/content/pii:S0306261921003755/STRIPIN/image/svg+xml/d3b27d8064a24fa10963ea4ab30bd336/si33.svg si33 si33.svg svg 5624 ALTIMG 1-s2.0-S0306261921003755-si34.svg https://s3-eu-west-1.amazonaws.com/prod-ucs-content-store-eu-west/content/pii:S0306261921003755/STRIPIN/image/svg+xml/ff7d915fba000727c80e32d4ca596f7b/si34.svg si34 si34.svg svg 3838 ALTIMG 1-s2.0-S0306261921003755-si35.svg https://s3-eu-west-1.amazonaws.com/prod-ucs-content-store-eu-west/content/pii:S0306261921003755/STRIPIN/image/svg+xml/f3e047a4e37249c9d58b0718b3a1c515/si35.svg si35 si35.svg svg 8035 ALTIMG 1-s2.0-S0306261921003755-si36.svg https://s3-eu-west-1.amazonaws.com/prod-ucs-content-store-eu-west/content/pii:S0306261921003755/STRIPIN/image/svg+xml/18a7ed084addbf2bd64061e2c9d8369a/si36.svg si36 si36.svg svg 8569 ALTIMG 1-s2.0-S0306261921003755-si37.svg https://s3-eu-west-1.amazonaws.com/prod-ucs-content-store-eu-west/content/pii:S0306261921003755/STRIPIN/image/svg+xml/949e9cd591d2d5922fb6a6931f0c49e3/si37.svg si37 si37.svg svg 8959 ALTIMG 1-s2.0-S0306261921003755-si38.svg https://s3-eu-west-1.amazonaws.com/prod-ucs-content-store-eu-west/content/pii:S0306261921003755/STRIPIN/image/svg+xml/4893066d83e185e96592269ab6eb7c42/si38.svg si38 si38.svg svg 12490 ALTIMG 1-s2.0-S0306261921003755-si39.svg https://s3-eu-west-1.amazonaws.com/prod-ucs-content-store-eu-west/content/pii:S0306261921003755/STRIPIN/image/svg+xml/15004a9ff2a5812af98496db7150034f/si39.svg si39 si39.svg svg 13122 ALTIMG 1-s2.0-S0306261921003755-si4.svg https://s3-eu-west-1.amazonaws.com/prod-ucs-content-store-eu-west/content/pii:S0306261921003755/STRIPIN/image/svg+xml/8d9261884e993385cb347b05d51d65e1/si4.svg si4 si4.svg svg 11927 ALTIMG 1-s2.0-S0306261921003755-si40.svg https://s3-eu-west-1.amazonaws.com/prod-ucs-content-store-eu-west/content/pii:S0306261921003755/STRIPIN/image/svg+xml/8f4a6079ca4e10ff1651ab16f3447919/si40.svg si40 si40.svg svg 3553 ALTIMG 1-s2.0-S0306261921003755-si41.svg https://s3-eu-west-1.amazonaws.com/prod-ucs-content-store-eu-west/content/pii:S0306261921003755/STRIPIN/image/svg+xml/fd19e23bd8164629294c83bc7ae6bf31/si41.svg si41 si41.svg svg 3175 ALTIMG 1-s2.0-S0306261921003755-si43.svg https://s3-eu-west-1.amazonaws.com/prod-ucs-content-store-eu-west/content/pii:S0306261921003755/STRIPIN/image/svg+xml/641fb3c000efbfa0efa5b72cd6e0ad64/si43.svg si43 si43.svg svg 7982 ALTIMG 1-s2.0-S0306261921003755-si44.svg https://s3-eu-west-1.amazonaws.com/prod-ucs-content-store-eu-west/content/pii:S0306261921003755/STRIPIN/image/svg+xml/f0a00e8647d42411ea4c001c981f121e/si44.svg si44 si44.svg svg 1297 ALTIMG 1-s2.0-S0306261921003755-si46.svg https://s3-eu-west-1.amazonaws.com/prod-ucs-content-store-eu-west/content/pii:S0306261921003755/STRIPIN/image/svg+xml/44cc32217469d8ba948a232f3ae1ddb2/si46.svg si46 si46.svg svg 10104 ALTIMG 1-s2.0-S0306261921003755-si47.svg https://s3-eu-west-1.amazonaws.com/prod-ucs-content-store-eu-west/content/pii:S0306261921003755/STRIPIN/image/svg+xml/a7a4be1ebead341fab548644461b342c/si47.svg si47 si47.svg svg 4148 ALTIMG 1-s2.0-S0306261921003755-si48.svg https://s3-eu-west-1.amazonaws.com/prod-ucs-content-store-eu-west/content/pii:S0306261921003755/STRIPIN/image/svg+xml/2b1d63b170b601dee909131f764972a7/si48.svg si48 si48.svg svg 3065 ALTIMG 1-s2.0-S0306261921003755-si49.svg https://s3-eu-west-1.amazonaws.com/prod-ucs-content-store-eu-west/content/pii:S0306261921003755/STRIPIN/image/svg+xml/aa13307fa10f146e4eaacb61a56565c4/si49.svg si49 si49.svg svg 1296 ALTIMG 1-s2.0-S0306261921003755-si5.svg https://s3-eu-west-1.amazonaws.com/prod-ucs-content-store-eu-west/content/pii:S0306261921003755/STRIPIN/image/svg+xml/04e774cfdb6c2fe9d8006b6cb4c5ce4a/si5.svg si5 si5.svg svg 1691 ALTIMG 1-s2.0-S0306261921003755-si50.svg https://s3-eu-west-1.amazonaws.com/prod-ucs-content-store-eu-west/content/pii:S0306261921003755/STRIPIN/image/svg+xml/130672fcfcb7db92fca833c1aa64c135/si50.svg si50 si50.svg svg 2044 ALTIMG 1-s2.0-S0306261921003755-si51.svg https://s3-eu-west-1.amazonaws.com/prod-ucs-content-store-eu-west/content/pii:S0306261921003755/STRIPIN/image/svg+xml/ab32b5f2dcbb589707390f88f2cc53a8/si51.svg si51 si51.svg svg 1054 ALTIMG 1-s2.0-S0306261921003755-si52.svg https://s3-eu-west-1.amazonaws.com/prod-ucs-content-store-eu-west/content/pii:S0306261921003755/STRIPIN/image/svg+xml/1052c599d5cb1e51be0c5d6c20b3fc3e/si52.svg si52 si52.svg svg 2135 ALTIMG 1-s2.0-S0306261921003755-si54.svg https://s3-eu-west-1.amazonaws.com/prod-ucs-content-store-eu-west/content/pii:S0306261921003755/STRIPIN/image/svg+xml/d68ba2a1b99846a987b526a50f19f05b/si54.svg si54 si54.svg svg 2865 ALTIMG 1-s2.0-S0306261921003755-si56.svg https://s3-eu-west-1.amazonaws.com/prod-ucs-content-store-eu-west/content/pii:S0306261921003755/STRIPIN/image/svg+xml/dc4bf7e556b30a82d354d767803dcdd5/si56.svg si56 si56.svg svg 2360 ALTIMG 1-s2.0-S0306261921003755-si57.svg https://s3-eu-west-1.amazonaws.com/prod-ucs-content-store-eu-west/content/pii:S0306261921003755/STRIPIN/image/svg+xml/7d78460b7bfdc40d007325d98285507e/si57.svg si57 si57.svg svg 993 ALTIMG 1-s2.0-S0306261921003755-si58.svg https://s3-eu-west-1.amazonaws.com/prod-ucs-content-store-eu-west/content/pii:S0306261921003755/STRIPIN/image/svg+xml/644be762ae9d3fb05ddb71d288e8c8c1/si58.svg si58 si58.svg svg 39432 ALTIMG 1-s2.0-S0306261921003755-si59.svg https://s3-eu-west-1.amazonaws.com/prod-ucs-content-store-eu-west/content/pii:S0306261921003755/STRIPIN/image/svg+xml/9dfac9bb8e36e1e41edc3cba49384b66/si59.svg si59 si59.svg svg 16500 ALTIMG 1-s2.0-S0306261921003755-si6.svg https://s3-eu-west-1.amazonaws.com/prod-ucs-content-store-eu-west/content/pii:S0306261921003755/STRIPIN/image/svg+xml/8ccbae774615b432270564f614469a8e/si6.svg si6 si6.svg svg 1442 ALTIMG 1-s2.0-S0306261921003755-si60.svg https://s3-eu-west-1.amazonaws.com/prod-ucs-content-store-eu-west/content/pii:S0306261921003755/STRIPIN/image/svg+xml/4140efd7e57c559a2f8f556b49bca307/si60.svg si60 si60.svg svg 8334 ALTIMG 1-s2.0-S0306261921003755-si62.svg https://s3-eu-west-1.amazonaws.com/prod-ucs-content-store-eu-west/content/pii:S0306261921003755/STRIPIN/image/svg+xml/b31d6b25d7474537351bd17f8f608c65/si62.svg si62 si62.svg svg 4313 ALTIMG 1-s2.0-S0306261921003755-si63.svg https://s3-eu-west-1.amazonaws.com/prod-ucs-content-store-eu-west/content/pii:S0306261921003755/STRIPIN/image/svg+xml/6454a4e903e3e8bc8b1721f1a6d87f6c/si63.svg si63 si63.svg svg 2453 ALTIMG 1-s2.0-S0306261921003755-si64.svg https://s3-eu-west-1.amazonaws.com/prod-ucs-content-store-eu-west/content/pii:S0306261921003755/STRIPIN/image/svg+xml/bd71e38fd0549d0078eb846f97b89bc0/si64.svg si64 si64.svg svg 5134 ALTIMG 1-s2.0-S0306261921003755-si65.svg https://s3-eu-west-1.amazonaws.com/prod-ucs-content-store-eu-west/content/pii:S0306261921003755/STRIPIN/image/svg+xml/c7ac33fc23b72564b70f4823241748c8/si65.svg si65 si65.svg svg 3148 ALTIMG 1-s2.0-S0306261921003755-si67.svg https://s3-eu-west-1.amazonaws.com/prod-ucs-content-store-eu-west/content/pii:S0306261921003755/STRIPIN/image/svg+xml/aadfea4f889913e901cc47d058343f90/si67.svg si67 si67.svg svg 7822 ALTIMG 1-s2.0-S0306261921003755-si68.svg https://s3-eu-west-1.amazonaws.com/prod-ucs-content-store-eu-west/content/pii:S0306261921003755/STRIPIN/image/svg+xml/f29fb693779c334804fd7c936f906fad/si68.svg si68 si68.svg svg 6501 ALTIMG 1-s2.0-S0306261921003755-si69.svg https://s3-eu-west-1.amazonaws.com/prod-ucs-content-store-eu-west/content/pii:S0306261921003755/STRIPIN/image/svg+xml/15d71c44a9ee5837bf92ae0998f611b6/si69.svg si69 si69.svg svg 13119 ALTIMG 1-s2.0-S0306261921003755-si7.svg https://s3-eu-west-1.amazonaws.com/prod-ucs-content-store-eu-west/content/pii:S0306261921003755/STRIPIN/image/svg+xml/7c86f9ec461c0b82d5994ab6cc7dfde0/si7.svg si7 si7.svg svg 1603 ALTIMG 1-s2.0-S0306261921003755-si70.svg https://s3-eu-west-1.amazonaws.com/prod-ucs-content-store-eu-west/content/pii:S0306261921003755/STRIPIN/image/svg+xml/19557191117e1124bfa50de28785c703/si70.svg si70 si70.svg svg 2595 ALTIMG 1-s2.0-S0306261921003755-si71.svg https://s3-eu-west-1.amazonaws.com/prod-ucs-content-store-eu-west/content/pii:S0306261921003755/STRIPIN/image/svg+xml/197412e5e195f69637f86652ea2eacbb/si71.svg si71 si71.svg svg 8729 ALTIMG 1-s2.0-S0306261921003755-si74.svg https://s3-eu-west-1.amazonaws.com/prod-ucs-content-store-eu-west/content/pii:S0306261921003755/STRIPIN/image/svg+xml/4bc213dfe29cffe491b4c0fee19f7a3a/si74.svg si74 si74.svg svg 12050 ALTIMG 1-s2.0-S0306261921003755-si76.svg https://s3-eu-west-1.amazonaws.com/prod-ucs-content-store-eu-west/content/pii:S0306261921003755/STRIPIN/image/svg+xml/61d550754b1dbae689e6b61a75a0de6d/si76.svg si76 si76.svg svg 3159 ALTIMG 1-s2.0-S0306261921003755-si77.svg https://s3-eu-west-1.amazonaws.com/prod-ucs-content-store-eu-west/content/pii:S0306261921003755/STRIPIN/image/svg+xml/0065f05176eef755624fbabe2b4f07eb/si77.svg si77 si77.svg svg 26406 ALTIMG 1-s2.0-S0306261921003755-si79.svg https://s3-eu-west-1.amazonaws.com/prod-ucs-content-store-eu-west/content/pii:S0306261921003755/STRIPIN/image/svg+xml/70c7d621335960bbfafa1cf2ed29b161/si79.svg si79 si79.svg svg 2171 ALTIMG 1-s2.0-S0306261921003755-si8.svg https://s3-eu-west-1.amazonaws.com/prod-ucs-content-store-eu-west/content/pii:S0306261921003755/STRIPIN/image/svg+xml/43f2de183843d681c0f778a9aa73e853/si8.svg si8 si8.svg svg 2538 ALTIMG 1-s2.0-S0306261921003755-si80.svg https://s3-eu-west-1.amazonaws.com/prod-ucs-content-store-eu-west/content/pii:S0306261921003755/STRIPIN/image/svg+xml/63f4e5ac90b7f85f36b647828f27432c/si80.svg si80 si80.svg svg 5171 ALTIMG 1-s2.0-S0306261921003755-si81.svg https://s3-eu-west-1.amazonaws.com/prod-ucs-content-store-eu-west/content/pii:S0306261921003755/STRIPIN/image/svg+xml/af0fbfccdc86a525814604b6beedde6d/si81.svg si81 si81.svg svg 1539 ALTIMG 1-s2.0-S0306261921003755-si82.svg https://s3-eu-west-1.amazonaws.com/prod-ucs-content-store-eu-west/content/pii:S0306261921003755/STRIPIN/image/svg+xml/a9f8404bfc42924039b05726ef3c1907/si82.svg si82 si82.svg svg 16659 ALTIMG 1-s2.0-S0306261921003755-si84.svg https://s3-eu-west-1.amazonaws.com/prod-ucs-content-store-eu-west/content/pii:S0306261921003755/STRIPIN/image/svg+xml/5e7bf9dcf1c15180ca22659b40337991/si84.svg si84 si84.svg svg 2731 ALTIMG 1-s2.0-S0306261921003755-si85.svg https://s3-eu-west-1.amazonaws.com/prod-ucs-content-store-eu-west/content/pii:S0306261921003755/STRIPIN/image/svg+xml/069a6ad4805e507d69ae8d81f81d2f3b/si85.svg si85 si85.svg svg 2421 ALTIMG 1-s2.0-S0306261921003755-si87.svg https://s3-eu-west-1.amazonaws.com/prod-ucs-content-store-eu-west/content/pii:S0306261921003755/STRIPIN/image/svg+xml/6f5bb3bdb893dfeb5a5bb4ca729e17eb/si87.svg si87 si87.svg svg 17357 ALTIMG 1-s2.0-S0306261921003755-si88.svg https://s3-eu-west-1.amazonaws.com/prod-ucs-content-store-eu-west/content/pii:S0306261921003755/STRIPIN/image/svg+xml/79061092579816c19312d380c003a670/si88.svg si88 si88.svg svg 21979 ALTIMG 1-s2.0-S0306261921003755-si89.svg https://s3-eu-west-1.amazonaws.com/prod-ucs-content-store-eu-west/content/pii:S0306261921003755/STRIPIN/image/svg+xml/c1bc0775d4d71217a6377c194c6d5e30/si89.svg si89 si89.svg svg 12014 ALTIMG 1-s2.0-S0306261921003755-si9.svg https://s3-eu-west-1.amazonaws.com/prod-ucs-content-store-eu-west/content/pii:S0306261921003755/STRIPIN/image/svg+xml/dab49576fbcd5c315838d8f1282ea003/si9.svg si9 si9.svg svg 2935 ALTIMG 1-s2.0-S0306261921003755-si90.svg https://s3-eu-west-1.amazonaws.com/prod-ucs-content-store-eu-west/content/pii:S0306261921003755/STRIPIN/image/svg+xml/21c8caa453e5a7d8fd70129a4644599b/si90.svg si90 si90.svg svg 3946 ALTIMG 1-s2.0-S0306261921003755-si92.svg https://s3-eu-west-1.amazonaws.com/prod-ucs-content-store-eu-west/content/pii:S0306261921003755/STRIPIN/image/svg+xml/d83962a4feb82883869f5691f0fda0f6/si92.svg si92 si92.svg svg 3691 ALTIMG 1-s2.0-S0306261921003755-si93.svg https://s3-eu-west-1.amazonaws.com/prod-ucs-content-store-eu-west/content/pii:S0306261921003755/STRIPIN/image/svg+xml/5193e09b8d051029022830f848cbb89a/si93.svg si93 si93.svg svg 3930 ALTIMG 1-s2.0-S0306261921003755-si94.svg https://s3-eu-west-1.amazonaws.com/prod-ucs-content-store-eu-west/content/pii:S0306261921003755/STRIPIN/image/svg+xml/53901d6830fdce7a9c28b9f6408528d5/si94.svg si94 si94.svg svg 2290 ALTIMG 1-s2.0-S0306261921003755-si95.svg https://s3-eu-west-1.amazonaws.com/prod-ucs-content-store-eu-west/content/pii:S0306261921003755/STRIPIN/image/svg+xml/0a54e44020c00beda3b340e42257aa1a/si95.svg si95 si95.svg svg 2492 ALTIMG 1-s2.0-S0306261921003755-si97.svg https://s3-eu-west-1.amazonaws.com/prod-ucs-content-store-eu-west/content/pii:S0306261921003755/STRIPIN/image/svg+xml/36bdf21e128ef6d75a2667ed641b2452/si97.svg si97 si97.svg svg 2284 ALTIMG 1-s2.0-S0306261921003755-si98.svg https://s3-eu-west-1.amazonaws.com/prod-ucs-content-store-eu-west/content/pii:S0306261921003755/STRIPIN/image/svg+xml/0b57cf530f3ceb8de4a887071ca60255/si98.svg si98 si98.svg svg 2704 ALTIMG 1-s2.0-S0306261921003755-si99.svg https://s3-eu-west-1.amazonaws.com/prod-ucs-content-store-eu-west/content/pii:S0306261921003755/STRIPIN/image/svg+xml/e4e2e3aad4f3752da8984e8c9fd7b1f7/si99.svg si99 si99.svg svg 2502 ALTIMG 1-s2.0-S0306261921003755-am.pdf https://s3-eu-west-1.amazonaws.com/prod-ucs-content-store-eu-west/content/egi:107KKKR40T9/MAIN/application/pdf/8f50673916ef752419cf9fb0532ecfd8/am.pdf am am.pdf pdf false 858292 AAM-PDF APEN 116889 116889 S0306-2619(21)00375-5 10.1016/j.apenergy.2021.116889 The Authors Fig. 1 An illustration of the smart building components and their interactions. The arrows indicate the positive direction of the heat flows. Fig. 2 An illustration of the dynamical model in (12). Each box represents a state given by a temperature and heat capacity. The arrows indicate the direction in which the energy is transferred. Fig. 3 The MPC framework for the smart house control and how the disturbance modelling is incorporated. The \u201dDisturbance forecasts\u201d-box corresponds to Algorithm 1 and the \u201dMPC\u201d-box corresponds to Algorithm 2. Fig. 4 The pulse response for 15 h (top) and 90 days (bottom). The step size of the pulse is given in the legend (all from zero). Fig. 5 Bode plot showing the frequency responses of the disturbances together with the heat pump and the electrical heaters. The inputs have been normalised in order to make the response have an amplitude equal to 1 for small frequencies. Fig. 6 An example of the advanced forecasts from (13) compared to persistent forecasts. Fig. 7 A 15-day sample of the total 7 months of simulation for each heating strategy. The black dashed lines are the constraints. It shows the indoor air temperature as well as the heating inputs at the same point in the time series of disturbances. Fig. 8 Histogram of the constraint violations for each week of the 7 months of simulations. The vertical lines represents the mean value of the distribution of the forecasting strategies. Table 1 Facts about the data and how it is measured. The cloud cover unit, okta, is defined according to [37] - okta equal to zero is completely clear skies and okta equal to eight is completely overcast. Attribute Notation Unit Measurement method Cloud cover κ okta Measured once every hour Diffuse radiation I D W/m 2 Average of 6 independent observations during an hour Direct radiation I N W/m 2 Average of 6 independent observations during an hour Net radiation R n W/m 2 Average of 6 independent observations during an hour Ambient air temperature T a ∘ C Average of 6 independent observations during an hour Table 2 The constraint violations (the slack variables, s ˆ k , in the cost function in (19)) for all heating strategies for each forecasting scheme. The number in parenthesis is the p -value of a t-test between the advanced- and persistent forecasts. Constraint violation of the control simulations Heating strategy Persistent Advanced forecasts Perfect Electrical heaters, u 1 48.5 39.6 ( p = 0 . 024 ) 25.1 Heat pump, u 2 157.9 12.3 ( p = 0 . 008 ) 1.7 Heat pump plus electrical heaters, u 3 48.0 6.7 ( p = 0 . 023 ) 1.2 Heat pump plus electrical heaters and coolers, u 4 4.4 2.4 ( p = 0 . 038 ) 0 Table 3 The electricity price in EUR (the first term in the cost function in (19)) for all heating strategies for each forecasting scheme. The number in parenthesis is the p -value of a t-test between the advanced- and persistent forecasts. Electricity cost of the simulations Heating strategy Persistent Advanced forecasts Perfect Electrical heaters, u 1 303.2 302.2 ( p = 0 . 421 ) 302.0 Heat pump, u 2 117.3 110.4 ( p = 0 . 198 ) 107.7 Heat pump plus electrical heaters, u 3 113.0 108.2 ( p = 0 . 248 ) 107.5 Heat pump plus electrical heaters and coolers, u 4 117.9 108.3 ( p = 0 . 178 ) 107.5 Advanced forecasting and disturbance modelling for model predictive control of smart energy systems Christian Ankerstjerne Thilker Conceptualization Methodology Software Formal analysis Writing - original draft \u204e Henrik Madsen Conceptualization Methodology Supervision Writing - review & editing John Bagterp Jørgensen Conceptualization Methodology Supervision Writing - review & editing Technical University of Denmark, Department of Applied Mathematics and Computer Science, Asmussens Allé, Building 303B, DK-2800 Kgs. Lyngby, Denmark Technical University of Denmark, Department of Applied Mathematics and Computer Science Asmussens Allé, Building 303B, DK-2800 Kgs. Lyngby Denmark Technical University of Denmark, Department of Applied Mathematics and Computer Science, Asmussens Allé, Building 303B, DK-2800 Kgs. Lyngby, Denmark \u204e Corresponding author. We describe a method for embedding advanced weather disturbance models in model predictive control (MPC) of energy consumption and climate management in buildings. The performance of certainty-equivalent controllers such as conventional MPC for smart energy systems depends critically on accurate disturbance forecasts. Commonly, meteorological forecasts are used to supply weather predictions. However, these are generally not well suited for short-term forecasts. We show that an advanced physical and statistical description of the disturbances can provide useful short-term disturbance forecasts. We investigate the case of controlling the indoor air temperature of a simulated building using stochastic differential equations (SDEs) and certainty-equivalent MPC using the novel short-term forecasting method. A Lamperti transformation of the data and the models is an important contribution in making this SDE-based approach work. Simulation-based studies suggest that significant improvements are available for the performance of certainty-equivalent MPC based on short-term forecasts generated by the advanced disturbance model: Electricity savings of 5%\u201310% while at the same time improving the indoor climate by reducing comfort violations by up to over 90%. Graphical abstract Keywords Model predictive control Stochastic differential equations Disturbance models Smart energy systems 1 Introduction It is a well known fact that the energy consumption from buildings is high. On a global scale it is estimated that buildings consume more than 30% of the total consumed energy, and in Europe it is estimated to be more than 40% [1]. The high energy consumption creates a significant potential for energy savings by optimising the use of energy for heating and cooling in buildings, without compromising the quality of the indoor climate. Given the many opportunities of model-based control and optimisation of energy consumption in buildings, a vast body of research is available that describes the algorithms [2\u20135]. MPC has gained much success within many applications due to its simplicity, intuitive use, ability to handle multivariate and constrained systems, and the availability of algorithms and software for embedded as well as cloud computing [6]. However, most of this literature assumes that the system and disturbance models are perfect or use computationally complicated algorithms, e.g. stochastic or robust MPC, to handle uncertainties in these models. The main novelty in the present paper is a nonlinear disturbance model based on stochastic differential equations (SDEs) for embedded short-term forecasting in certainty-equivalent model predictive control (MPC) algorithms for energy and climate control in buildings. The proposed disturbance model is based on SDEs and forecasts the solar radiation and ambient air temperature. The model combines physical description of the climatic processes together with more statistical data-driven models. Beside providing accurate short-term forecasts, the model also has the advantage that it fits naturally into the MPC model framework, which is also based on SDEs. Much research suggest that SDEs are very competitive models for modelling dynamical and physical phenomena. They also inherently describe the distributions and uncertainties of processes by e.g. solving the Kolmogorov-equations. Knowledge about the uncertainty can be useful for sensitive systems that need extra operational care. SDEs have extensive applications in finance to model e.g. interest rates, security markets and yields [7]. They are also successfully applied in the area of probabilistic power production. Multiple complexity-varying SDE-models for wind power generation forecasts have been introduced and applied [8]. Furthermore, models for forecasting wind speed up to 24 h ahead using SDEs have been proposed [9]. Recent research also indicates that SDEs are well suited for probabilistic solar radiation forecasting [10,11], where first order systems proves to be sufficient. However, such models relies centrally on external long-term forecasts from supplied by external sources. Using the external forecasts, the models in turn supplies probabilistic forecasts. The model proposed here relies purely on local observations and is independent of external parties. 1.1 Literature review The inclusion of weather forecasts for building climate control has been investigated on multiple occasions in the literature [12\u201318]. In general, the predictive control schemes outperform non-predictive control forms, such as rule-based-and PID-control, due to their ability to consider future disturbances. The solar radiation is an important disturbance in rooms that are considered for temperature control [12]. The fluctuating dynamics of solar radiation and the large amount of energy it delivers, complicates the indoor temperature control in buildings with windows. These complications and uncomfortable overheating can in many cases be avoided or minimised by accounting for the prevalent solar radiation using simple transfer function or regression-based models [12,13]. MPC for buildings using models for weather forecasts reports to significantly reduce energy consumption and increase indoor comfort [14], increase flexibility indicators [15\u201317] present thorough reviews and recent applications of MPC for building climate control systems based on meteorological weather forecasts. Here, many studies consider perfect forecasts or simple sinusoidal simulations and do not take uncertainties into account. Using stochastic MPC to overcome uncertainties in the weather predictions for temperature regulation in integrated room automation, significant potential energy savings compared to rule-based control are reported [18]. Such simulation results also suggest that stochastic MPC is superior to conventional MPC for this kind of task due to its ability to account for uncertainties in forecasts. However, it remains an open questions whether these differences could be mitigated by tuning or by using better forecasts. In particular, the critical importance of also including local weather measurements for predictive control operations of modern building climate control systems has been noticed [19\u201322]. An example is to quantify the errors of the supplied meteorological weather forecast. These errors can be used to improve predictions of the heat load and enables better control performance [19]. More complex models based on neural networks has also been developed and applied for building climate control [15,20]. Results suggest that such models offer good accuracy but lacks the ability to generalise to arbitrary prediction lengths or different setups [21]. Comparisons between neural networks and simple time series models have also been carried out. Results are not one-sided as evidence of both linear time series methods and complex neural networks perform better than the other [23,24]. However, it is pointed out the potential performance gain of using such complex methods does not appear to outweigh the additional development and data acquisition efforts [22]. It is also common in the literature to use offset-free control [25\u201328]. Such approaches have the advantage that they can integrate out a constant unknown contribution of the disturbance and thereby achieve offset-free control [29]. However, the disturbances are not modelled and the integration has poor forecasting abilities for fast-changing disturbances such as the weather. The conclusion from the literature is that weather predictions in MPC offer significant potential energy savings and comfort improvement. In general, two categories of weather forecasting methods for MPC arise. The first category consists of cases that use meteorological weather forecasts. In the second category, models are developed to forecast disturbances. Here, the dominating standard is to use black-box related models that have no physical relation such as regression-based or neural network models. 1.2 Main aim and organisation of the paper The main aim of this paper is to introduce a general method for embedding forecasts and disturbance models in model-based control. We model the local weather disturbances using advanced models based on SDEs that includes physical descriptions of the climatic processes. Using these advanced forecasts in certainty equivalent MPC simulated for multiple smart building models, this paper suggests that increased performance of building climate control is available. We compare the advanced forecasts to offset-free control, a standard method for dealing with uncertainty in MPC [17,30], and to controllers using perfect forecasts. In Section 2 we introduce the mathematical notation and system framework. Section 3 proposes the continuous-time stochastic disturbance models. Section 4 introduces the MPC framework and how to incorporate the forecasts. Section 5 analyses the dynamics of the smart buildings considered in this paper. In Section 6 we present and discuss the simulation-based results, while the conclusion are provided in Section 7. 2 Stochastic differential equations and the smart building model In general, we seek a combined model for the smart building that includes a description of the disturbances. That is, we consider stochastic differential equation (SDE) models, sometimes called grey-box models, in the form (1a) d x ( t ) = f s ( x ( t ) , u ( t ) , d ( t ) ) d t + g s ( x ( t ) , u ( t ) , d ( t ) ) d ω s ( t ) , (1b) d d ( t ) = f d ( d ( t ) ) d t + g d ( d ( t ) ) d ω d ( t ) , (1c) y s ( t k ) = h s ( x ( t k ) ) + v s , k , (1d) y d ( t k ) = h d ( d ( t k ) ) + v d , k , where x , u , d are the smart building system states, the input and the disturbances respectively. f s and f d are the drift functions and g s and g d are the diffusion functions for the smart building system and disturbances. ω s ( t ) and ω d ( t ) are standard Brownian motions and v s , k ∼ N ( 0 , R s ) and v d , k ∼ N ( 0 , R d ) are the observation noises. Notice the causality between the system model and the disturbance model. The combined structure in (1) differs from the literature, where the dominating standard is to employ meteorological forecasts as described in Section 1.1 (i.e. no disturbance model). Offset-free control [30,31] is another method for dealing with non-modelled disturbances, also frequently used in the literature for smart energy systems [25\u201327]. The idea is to replace (1b) with an integrating state, d η ( t ) = B d d ω η ( t ) , that integrates and estimates the disturbances. This is limiting in two ways, however. First, the number of integrating states cannot exceed the number of independently observed system states \u2013 the system otherwise becomes unobservable. Second, the forecasts supplied by the integrators correspond to persistent forecasts, d ˆ ( t ) = d ˆ ( t k ) , t ≥ t k . We shall further assume that f s and g s in (1a) for the smart buildings are linear, and that g s is state-independent, i.e. we consider a linear model on the form (2a) f s ( x ( t ) , u ( t ) , d ( t ) ) = A c x ( t ) + B c u ( t ) + E c d ( t ) , (2b) g s ( x ( t ) , u ( t ) , d ( t ) ) = G c , where A c , B c , E c and G c are the continuous-time state evolution, input, disturbance and diffusion matrices. 2.1 Smart building model The rest of this section introduces the components of the smart building model in (1a) and (2a). 2.1.1 System states This paper considers a model of the heat dynamics of a building based on Andersen et al. [32] and Halvgaard et al. [2]. Fig. 1 shows an illustration of the smart building model components and its heat flows. The smart building model thus considers three system states: the room air temperature, T r , the floor temperature, T f , and the water temperature, T w . The smart building model states thus become (3) x ( t ) = T r ( t ) , T f ( t ) , T w ( t ) T . We usually observe only the room air temperature, i.e. the floor and water temperatures are hidden states. Furthermore, the observation equation in (1c) is linear, h s ( x ( t k ) ) = C x ( t k ) , with C = 1 , 0 , 0 T . 2.1.2 Inputs The manipulative variable for the smart building model in [2] is simply the input power (in Watt) given to the compressor of the heat pump, W h p , that is (4) u ( t ) = W h p ( t ) . As we will show, the smart building model equipped with a heat pump is governed by slow heating dynamics. A simpler model that uses electrical heaters where the heat enters the room air directly makes the room air respond to heat inputs much faster. In the results section, we compare smart building models that use different heating strategies where we combine electrical heaters and heat pumps as well as electrical coolers (e.g. an air conditioner). The heat pump, though, is more efficient (a factor 3) compared to the faster heating devices, making it an attractive heating strategy. We shall compare the following heating strategies (5a) u 1 ( t ) = W e h ( t ) , (5b) u 2 ( t ) = W h p ( t ) , (5c) u 3 ( t ) = W h p ( t ) , W e h ( t ) T , (5d) u 4 ( t ) = W h p ( t ) , W e h ( t ) , W e c ( t ) T , where W e h is the input to electrical heaters and W e c is the input to the electrical coolers. We assume that the heat from both the electrical heaters and coolers enters the room air directly and that they do not accumulate any heat themselves. We disregard the third system state, T w , for the building model that only considers electrical heaters, u 1 ( t ) = W e h ( t ) . 2.2 Disturbances As extensively reported by the literature [12,18,33], the important disturbances acting on a building are the solar radiation, ϕ , and the ambient air temperature, T a . The ambient air temperature affects the indoor air temperature through the walls and windows. The solar radiation affects the indoor air temperature by passing through the windows and heating either the room air or floor and furniture. For building climate control, the literature considers the solar radiation the most influential disturbance for short-term purposes. This is due to the large amount of energy it delivers and its considerably fast dynamics. For smart buildings with photo-voltaic cells (PVs), the solar radiation also determines the availability of harvested electricity. We shall not consider this case. Thus, the important weather disturbance states in (1) are (6) d ( t ) = T a ( t ) , ϕ ( t ) T . T a ( t ) is the ambient air temperature and ϕ ( t ) is the solar radiation on a horizontal surface. 3 Disturbance modelling and forecasting This section establishes the non-linear dynamical model for the disturbances in (1b). The behaviour of the weather in Denmark varies throughout the year. Hence, in-homogeneous- or regime models for the weather are required in the general case. To model breaks or sudden shifts in the dynamics, often seen in finance [34], jump\u2013diffusion processes can be suitable. See Bemporad et al. [35] for an introduction to a framework for fitting such models. To deal with this, we focus our attention on March and assume that the weather behaviour is constant during this month. In Denmark, March can be both warm and cold and typically with much sun and is therefore an interesting month to consider. 3.1 The data To formulate, identify and validate the statistical weather models used in this paper, we use data from two weather stations located in Værløse and Taastrup in Denmark. [36] thoroughly presents and discusses the data gathering process and setup. The data are gathered every hour for 7 consecutive years from February 1st 1967 through December 31st 1973. Table 1 gives a description of the weather elements of the data, how they are observed, and the observation frequency. 3.2 Weather model components The weather disturbance model consists of 4 components: \u2022 Cloud cover \u2022 Global solar radiation \u2022 Net radiation \u2022 Ambient air temperature The parameters for these model are available in [38] that develops, presents and discusses these models in detail. The rest of the section explains each weather model component and its importance regarding building climate control. 3.2.1 Cloud cover Important factors governing the energy levels and balances at the surface of the Earth are significantly affected by the amount of cloud cover. Global solar radiation is one such important example. The variations in global solar radiation are primarily due to absorption and reflection of energy by clouds. Other mechanisms such as the amount of water vapour, ozone, dust etc. also play a role. However, it is well known that cloud cover plays the absolute most important role. Due to the discrete cloud cover data, [39] and [40] show that a discrete state\u2013space Markov model is sufficient for modelling the cloud cover, and furthermore that a homogeneous model could be suitable. However, since we formulate the rest of the disturbance models as continuous state\u2013space models it is mathematically more convenient and consistent to choose an SDE-representation that fits into the framework of (1). We choose a non-linear, mean-reversion process of the form (7a) d κ ( t ) = θ ( κ ( t ) ) μ ( κ ( t ) ) − κ ( t ) d t ︷ drift + σ κ ( t ) ( 1 − κ ( t ) ) d ω κ ( t ) ︸ diffusion , where (7b) μ ( κ ( t ) ) = exp ( P n ( κ ( t ) ) ) 1 + exp ( P n ( κ ( t ) ) ) , (7c) θ ( κ ( t ) ) = θ ̃ κ ( t ) ( 1 − κ ( t ) ) . κ is the cloud cover state and P n ( ⋅ ) is the linear combination of Legendre polynomials till order n = 7 . The mathematical structure of the drift allows the model to have multiple stationary points. The term σ κ ( t ) ( 1 − κ ( t ) ) ensures that the diffusion goes to zero in both ends of the support and requires a transformation of the cloud cover state into the state\u2013space [ 0 , 1 ] . Thilker [38] describes how to choose this transformation. The diffusion term σ κ ( t ) ( 1 − κ ( t ) ) is dependent on the system state. Some of the difficulties and problems that are linked with a state-dependent diffusion term are [11,41,42]: \u2022 Predictions can be wrong/illegal if they go outside of the domain of the process. This can happen due to the linearisation in the continuous-discrete extended Kalman filter (CDEKF) and the numerical implementation of the differential equation solver. To apply filtering techniques in practice, a state-independent SDE is much more robust. \u2022 Simulation of the process has slower convergence rate (e.g. using the Euler\u2013Maruyama scheme) compared to a state-independent diffusion process. To overcome these problems, the Lamperti transformation offers a bijective transformation of the process into a constant diffusion process that lives in the domain of the entire real line, ψ : [ 0 , 1 ] → R . Let Z κ ( t ) = ψ ( κ ( t ) ) , then the Lamperti-transformed process has the simple form (8) d Z κ ( t ) = f ψ ( Z κ ( t ) ) d t + σ ψ d ω κ ( t ) , where f ψ is the drift function in the Lamperti domain. For an introduction to the Lamperti transformation, see e.g. [41]. In (8), the noise process is Gaussian, which makes computations such as e.g. confidence intervals easy. Estimation, prediction and simulation take place in the Lamperti domain and are subsequently transformed back into the original cloud cover domain, ψ − 1 : R → [ 0 , 1 ] . We estimate the parameters in (7) by means of the maximum likelihood method using the CDEKF [43,44]. The program CTSM-R is used to conduct these computations of the parameter estimates [45]. Also, automatic Lamperti transformation is being integrated into CTSM-R. 3.2.2 Global solar radiation The term global solar radiation covers all the short-wave radiation coming from the sun and hitting the surface of the Earth. The global radiation is typically split into two contributions; the direct, I N , and diffuse, I D , radiation. The direct radiation is all the short-wave radiation coming from the sun without hitting anything on its way. The diffuse radiation, in contrast, is all the reflected short wave radiation, e.g. from objects like dust, water vapour etc. in the atmosphere. The global solar radiation is simply the total radiation (on a horizontal plane), (9) ϕ ( t ) = I N ( t ) sin α ( t ) + I D ( t ) . To model the global solar radiation, ϕ , this paper performs non-parametric local linear regression as a function of the solar height, α ( t ) , and the cloud cover okta. The estimator is then the solution to the following weighed least squares problem (10) argmin ϕ , β ∑ i = 1 N K h ( α i , α 0 ) y i − ϕ − β ( α 0 − α i ) 2 , where ϕ is the estimator, α 0 is the given solar height and K h ( ⋅ , ⋅ ) is the Gaussian kernel function acting as the weights. We employ leave-one-out cross validation for selection of the band width, h . [38] also estimates a variance and auto correlation structure for the model in (10). 3.2.3 Net radiation It is well known that the so-called net radiation is necessary to predict the ambient air temperature. The net radiation is the net input of both short- and long-wave radiation at Earth\u2019s surface and is the main source of thermal energy to the ambient air. [46,47] explains this in more detail and also show that a static model is sufficient. [48] suggests a simple linear model that depends on the cloud cover, solar radiation and solar height (11) R n ( κ ( t ) , ϕ ( t ) , t ) = K κ + k κ ϕ ( t ) + k α ( t ) 2 + ϵ ( t ) . The subscript κ in K κ and k κ indicates the parameters\u2019 dependence on the cloud cover. That is one parameter for each cloud cover okta, κ . 3.2.4 Ambient air temperature [49] describes and explains the fundamental relationships of surface fluxes and the relationship between the net radiation and the ambient air temperature. Briefly explained, the net radiation heats the surface soil, which in turn heats up the ambient air near the surface. The time lag between the net radiation and the ambient air temperature requires a dynamical model and is well approximated by a simple second-order model Thilker et al. [50]. It is well known that larger annual temperature differences happen in the middle of large continents. However, for countries surrounded by sea, the sea highly regulates the land temperature due to the large heat capacity of water. Fig. 2 illustrates this model that has the mathematical SDE representation [49] (12a) C s d T s ( t ) = 1 R s a ( T a ( t ) − T s ( t ) ) d t + σ s d ω s ( t ) , (12b) C a d T a ( t ) = ( 1 R s a ( T s ( t ) − T a ( t ) ) + 1 R a ∞ ( T ∞ − T a ( t ) ) + R n ( t ) ) d t + σ a d ω a ( t ) , (12c) d T a ( t k ) = T a ( t k ) + v T a , k . T s ( t ) and T a ( t ) are the temperature of the surrounding sea and the land air respectively. R s a and R a ∞ are resistances against the heat flow between the states. C s and C a are the heat capacities representing the amount of heat the states contain. R n is the net radiation as in (11) and drives the process, T ∞ is a constant in- or outflow of heat to stabilise the system, ω a and ω s are standard Brownian motions and v T a , k is i.i.d. random observation noise. Again, we estimate the parameters in (12) using a maximum likelihood method and use the CDEKF to evaluate the likelihood function. 3.3 Combined disturbance model and forecasting scheme Combining the individual climate models, the combined continuous state\u2013space, stochastic-dynamic disturbance model, (1b) and (1d) in (1), gets the form: (13) Disturbance model d Z κ = f ψ ( Z κ ) d t + σ ψ d ω κ κ = ψ − 1 ( Z κ ) ϕ = I N ( κ , t ) + I D ( κ , t ) R n = R n ( κ , ϕ , t ) d T s = f T s ( T a , T s ) d t + σ s d ω s d T a = f T a ( T a , T s , R n ) d t + σ a d ω a d = T a , ϕ T Observation equation d ϕ = ϕ + v ϕ , v ϕ ∼ N i i d ( 0 , R ϕ ) d T a = T a + v T a , v T a ∼ N i i d ( 0 , R T a ) y d = d T a , d ϕ T , The model in (13) returns the important weather elements in d and the corresponding observations in y d . Since (13) is based on (non-linear) SDEs, we need to use e.g. the CDEKF to compute the certainty-equivalent forecasts. This involves numerical solutions to differential equations and requires local weather measurements as the initial conditions preferably from the building site itself. In practice though, the cloud cover is difficult to observe without specialised equipment. Due to the strong correlation between the cloud cover and solar radiation we instead estimate cloud cover at time t k , κ ˆ k | k , as the most likely to generate the observed solar radiation, d ϕ , k . Due to the one-way coupling of the SDEs in (13) between the cloud cover and air temperature models, we split the computations into separate parts described in Algorithm 1. We collect the forecasts in the sequence { d ˆ k + i | k } i = 0 N , where N ∈ N is the prediction horizon. The subscript k + i | k means that d ˆ k + i | k is an estimate of d ( t k + i ) given information up till time t k . 4 Model predictive control This paper uses linear Economic MPC (EMPC) based on SDEs. The overall aim in linear Economic MPC is to mitigate disturbances and control a linear dynamical system to meet operational constraints at minimum cost [30,51]. It minimises the cost according to a price signal that reflects the desired behaviour. The desired behaviour could be to minimise the CO 2 emission, the total electricity cost, or the total usage of electricity [52\u201354]. The MPC algorithm is depicted inside the dashed square in Fig. 3 and consists of a filter and an optimal control problem. This section provides a short introduction to the general mathematical framework of MPC based on SDEs with a particular emphasis on how to embed disturbance forecasts. 4.1 Filtering For stochastic systems or in cases where we do not observe all states, i.e. a system with hidden states, we need to use a filter to estimate the system. Due to the stochasticity, we cannot determine the system states exactly. Instead, we seek an estimate of the present system states, x ˆ k | k = E [ x ( t k ) | Y k ] , and its uncertainty, P ˆ k | k = Var x ( t k ) | Y k where Y k is the information up until time t k . Due to the discrete computational nature of computers, it is sometimes advantageous to work with a discrete-time system. For SDEs in the form (2), we perform an exact discretisation with T s = t k + 1 − t k assuming that the input and disturbance are constant within each sampling period, T s ; u ( t ) = u k and d ( t ) = d k for t ∈ [ t k , t k + 1 [ . This is also called zero-order-hold discretisation and results in the discrete time linear state space model (14a) x k + 1 = A x k + B u k + E d k + w k , (14b) y s , k = C x k + v s , k , (14c) w k ∼ N i i d ( 0 , Q s ) , v s , k ∼ N i i d ( 0 , R s ) , with A = exp ( A c T s ) , B = ∫ 0 T s exp ( A c s ) B c d s , and E = ∫ 0 T s exp ( A c s ) E c d s being matrices governing the discrete-time dynamics. Q s = ∫ 0 T s exp ( A c s ) G c G c T exp ( A c T s ) d s is the covariance of the process noise and R s is the covariance of the measurement noise. The discretisation is exact in the sense that at the discrete times t k , k ∈ N , the discrete- and continuous-time systems are identical, x k = x ( t k ) . When the system is linear and the noise is Gaussian as in (14), the Kalman filter provides an optimal estimate of the system states. Given an observation, y s , k , and a one-step prediction of the state vector, x ˆ k | k − 1 , the Kalman filter algorithm computes the optimal filtered state estimate, x ˆ k | k , and the covariance of the filtered state estimate, P ˆ k | k . 4.2 Optimal control problem The optimal control problem of MPC is based on a cost function, φ k , that is used to rank the feasible solutions and is formulated such that it promotes a desired behaviour of the system. The optimal control problem determines the optimal input sequence, which we denote with a hat { u ˆ k + i | k } i = 0 N − 1 , to the system given an estimated initial state, x ˆ k | k , and the disturbance forecast, { d ˆ k + i | k } i = 0 N . By using the disturbance forecast generated by Algorithm 1, { d ˆ k + i | k } i = 0 N , we decouple the disturbance estimation and the system state estimation. From a theoretical point of view, this is a sub-optimal estimate. But the approximation error is small with the given external sensors and it has the advantage that different parties can supply the disturbance forecast and MPC. The general optimal control problem including the disturbances is defined by the following Bolza problem [55] (15a) J ( x ˆ k | k , u ˆ k − 1 | k , { d ˆ k + i | k } i = 0 N ) = (15b) min u , s φ k , (15c) s . t . x ( t k ) = x ˆ k | k , (15d) u ( t ) = u k + i | k , t ∈ [ t k + i , t k + i + 1 [ , i ∈ N , (15e) d ( t ) = d ˆ k + i | k , t ∈ [ t k + i , t k + i + 1 [ , i ∈ N , (15f) d x ( t ) = f s ( x ( t ) , u ( t ) , d ( t ) ) d t , t ∈ T k , (15g) u min ≤ u k + i | k ≤ u max , i ∈ N , (15h) Δ u min ≤ Δ u k + i | k ≤ Δ u max , i ∈ N , (15i) c ( x ( t ) ) + s ( t ) ≥ 0 , t ∈ T k , (15j) s ( t ) ≥ 0 , t ∈ T k , where the cost function is in the form (16) φ k = ∫ t k t k + N ℓ ( x ( τ ) , u ( τ ) ) d τ + ℓ b ( x ( t k + N ) ) + ∫ t k t k + N ℓ s ( s ( τ ) ) d τ . The stage costs, ℓ ( x ( t ) , u ( t ) ) and ℓ s ( s ( t ) ) , and the cost-to-go, ℓ b ( x ( t k + N ) ) , are (17a) ℓ ( x ( t ) , u ( t ) ) = c ( t ) T u ( t ) , (17b) ℓ b ( x ( t k + N ) ) = 0 , (17c) ℓ s ( s ( t ) ) = ρ ( t ) T s ( t ) , such that the cost function, φ , becomes (18) φ k = ∫ t k t k + N c ( τ ) T u ( τ ) + ρ ( τ ) T s ( τ ) d τ , In the optimal control problem, T k = [ t k , t k + N [ is both the control and the prediction horizon. N = { 0 , 1 , \u2026 , N − 1 } . x ˆ k | k is the initial condition of the system estimated by a state estimator. { d ˆ k + i | k } i = 0 N is the sequence of advanced forecasts obtained from the disturbance model in Section 3. c ( x ( t ) ) represents the constraint functions. s ( t ) are slack variables that allow solutions outside of the desired domain and we penalise them with ℓ s ( s ( t ) ) . c ( t ) is the electricity price signal and ρ ( t ) is the slack penalty. ρ ( t ) should be large enough to make the preferred solution satisfy the constraints whenever possible. We assume that the price signal is piece-wise constant in each sampling period, c ( t ) = c k , t ∈ [ t k , t k + 1 [ . ℓ b is a cost-to-go term ranking the end-state, x ( t k + N ) . It can be very useful to include for smart buildings with batteries or EVs [3]. However, for long prediction horizons it has negligible effect on the closed-loop performance. Accordingly, we set it equal to zero which makes (15) a Lagrange problem. For the optimal control problem, we know the actual input during time [ t k − 1 , t k ] , u ˆ k − 1 | k , should it differ from the control signal u ˆ k − 1 | k − 1 . The optimal control, denoted u ˆ ( t ) , is the u ( t ) that minimises (15). 4.2.1 Discretisation of the optimal control problem In the discretisation of the optimal control problem (15), we consider the output constraints (15i)\u2013(15j) as point-wise constraints. The input, u k , is piece-wise constant. Consequently, the cost function (16) becomes (19) φ k = ∑ i = 0 N − 1 c k + i | k T u k + i | k + ∑ i = 0 N − 1 ρ k + i + 1 | k T s k + i + 1 | k . The dynamics are linear and discretised and the soft output constraints are assumed to be linear functions, i.e. c ( x k ) = H x k + b . Consequently, the optimal control problem (15) is the linear program (20a) J ( x ˆ k | k , u ˆ k − 1 | k , { d ˆ k + i | k } i = 0 N ) = (20b) min u , s φ k , (20c) s . t . (20d) x k | k = x ˆ k | k , (20e) x k + i + 1 | k = A x k + i | k + B u k + i | k + E d ˆ k + i | k , i ∈ N , (20f) u min ≤ u k + i | k ≤ u max , i ∈ N , (20g) Δ u min ≤ Δ u k + i | k ≤ Δ u max , i ∈ N , (20h) H x k + i + 1 | k + b + s k + 1 + i | k ≥ 0 , i ∈ N , (20i) s k + 1 + i | k ≥ 0 , i ∈ N . The solution to the optimal control problem is a sequence of inputs, { u ˆ k + i | k } i = 0 N − 1 , and slack variables, { s ˆ k + i + 1 | k } i = 0 N − 1 , that minimises the cost function, φ k . 4.3 The economic model predictive control algorithm Fig. 3 shows the overall MPC setup and the information flow. Algorithm 2 provides a listing of the corresponding computational steps to compute the input (manipulated variable) vector, u ˆ k | k , based on the system measurements, y s , k , the previous input u k = u ˆ k − 1 | k , the previous filtered state mean\u2013covariance pair, ( x ˆ k − 1 | k − 1 , P ˆ k − 1 | k − 1 ) , the previous filtered disturbance, d ˆ k − 1 | k − 1 , and the disturbance forecast, { d ˆ k + i | k } i = 0 N . In this work, Algorithm 1 provides the disturbance forecast. The MPC algorithm (Algorithm 2) consists of (1) a Kalman filter algorithm organised as a one-step prediction and a measurement update; and (2) an optimal control problem, which in this case is a linear program. Solution of the linear program consumes the majority of the computational time to conduct Algorithm 2. Algorithm 2 is conducted each sample time when a new measurement arrives. 5 Dynamics of the smart building model The heating system of the smart building consists of a ground sourced heat pump using a compressor that heats up water that then flows into pipes underneath the floor. This has the advantage of being energy efficient (a COP of 3 is used) due to the thermodynamic processes that extracts heat from some ambient environment, but is disadvantaged by its slow dynamics. When the heat pump is turned on, it takes a long time before the room air temperature responds. This section briefly investigates the dynamics and time/frequency responses of the heat pump model and compares it to that of the disturbances and a standard electrical heater to give an idea and overview of what effects the heat pump delivers in the settings of a smart building. 5.1 Pulse- and frequency-response analysis Fig. 4 shows the pulse response of the smart building model for the first 15 h and 90 days. The disturbances act much faster compared to the heat pump. After 3 h, the disturbance responses have already reverted back to a level of around half of their peak pulse response. The heat pump, however, has not yet heated the room by any significant amount. These large response differences between the heat pump and disturbances indicate that the heat pump might not be sufficient at all times for regulating the indoor air temperature. Fig. 4 shows that electrical heaters heat just as fast as the disturbances, and suggests that the they are much better suited for dealing with fast responses. Fig. 5 shows a bode plot of the frequency response of the heat pump and the electrical heaters compared to the disturbances. It is again clear, that the heat pump is governed by delayed dynamics for higher frequencies. The response signal for the electrical heaters is identical to those of the disturbances due to the direct input of heat into the room. 5.2 Summary of the section The considerations and results of this section suggest that without anything to provide faster heating or cooling, e.g. electrical heaters or electrical coolers, the disturbances act with too high frequencies for the heat pump to deal with. However, as the results will show, if the goal is to keep the room temperature within some relatively large range, say from 20 to 24 °C during cold months where heating is required at almost all times, the heat pump can still be suitable. Electrical heaters (or other faster heating devices) definitely make it easier to obtain good solutions \u2014 but they are not as cheap as the heat pump. 6 Results and discussion This section shows simulation-based results of the potential benefits of including the advanced disturbance model (1) in MPC. As the data we use for the true disturbances do not include meteorological forecasts, we cannot directly compare the results to that part of the literature. Instead, we compare the advanced forecasts to offset-free control. We also present control results that use perfect forecasts to give a theoretical upper bound on the performance. We use data for all years during the 7 year period of data. 6.1 Visualisation of the advanced disturbance forecasts As previously discussed, the typical offset-free control schemes in the literature supply persistent forecasts, that is (21) d ˆ k + i | k = d ˆ k | k , i = 0 , \u2026 , N . Fig. 6 shows a visual comparison of the advanced forecasts in (13) and persistent forecasts using a prediction horizon of N = 96 hours. The complex dynamics of the advanced forecasts become visible against the zero-order (constant) forecasts. 6.2 Simulation-based comparison of the forecasting schemes As Section 5 shows, the heat pump heats up the smart building in a slow manner. To diversify the results, we therefore also show the use of a smart building with faster heating units such as electrical heaters and/or coolers. The rest of the section describes and presents the control results for each heating strategy based of the smart building in Section 2. As the true disturbances, we use the weather data described in Section 3.1. All results use a slack penalty value of ρ k = 5000 , time sample T s = 1 hour, and prediction horizon N = 96 hours. We put the electricity price constant and choose it to be the mean price over 7 months of March data from Nordpool, c k = 36 . 5 [EUR/MWh]. The MPC thus minimises the amount of electricity spend and does not consider varying prices. For the simulation, we choose the temperature constraints to be T r , m i n = 20 ∘ C and T r , m a x = 24 ∘ C. Tables 2 and 3 shows the constraint violation and the total electricity price for all heating strategies respectively. Fig. 7 shows a 15-day sample of the simulations to illustrate the behavioural differences. 6.2.1 Heating strategy 1: Electrical heaters Due to the faster heating dynamics of the electrical heaters, we expect that the persistent forecasts might perform well, since the MPC can quickly respond to sudden changes of the disturbances. As expected, the differences between the control solutions in Fig. 7, are not very visible. The room air temperatures and the heat inputs from the electrical heaters are almost identical. Table 2 does show a difference in the performance as the solution using the advanced forecasts perform slightly better. The electricity prices are almost identical since the total heat needed over the 7 months is the same for both buildings and the unit price is the same. 6.2.2 Heating strategy 2: Heat pump The second heating strategy simulation uses the smart building equipped with a heat pump. We recall that the heat pump is 3 times more efficient compared to the faster heating strategies. In contrast to the electrical heaters, the heating pattern from Fig. 7 is very slow, due to the heat pump dynamics. But the solution is also cheaper due to the high efficiency of the heat pump. The difference between the persistent and advanced forecasts becomes very visible here. Due to the slow dynamics, the advanced forecasts of the disturbance dynamics matter much more in this case. Tables 2 and 3 show that the solution using advanced forecasts is both cheaper and supplies significantly better indoor climate. 6.2.3 Heating strategy 3: Heat pump plus electrical heaters Heating strategy 3 combines the (fast but expensive) electrical heaters and the (slow but cheap) heat pump. The input is therefore u = [ W c , W e h ] T . The idea is to have cheap heating from the heat pump while being able to quickly adapt using the more expensive electrical heaters. From Table 2 the persistent forecasts show large improvement compared to only using the heat pump. The improvements for the advanced forecasts are around 50% better. It is noteworthy that Table 3 indicates that the advanced forecasts supply results that are very close the perfect forecasts in terms of electricity price and at the same time improves the indoor climate conditions. Fig. 7 also indicates that the controller using the advanced forecasting scheme uses the electrical heater less often. 6.2.4 Heating strategy 4: Heat pump plus electrical heaters and coolers An extension to heating strategy 3 is to include an electrical cooling unit beside the electrical heaters to also enable cooling. The input becomes u = [ W c , W e h , W e c ] T . This has a great effect on the persistent forecasts as seen in Table 2 compared with the other strategies. It also leads to high electricity costs, which are much higher compared to the other forecasting scheme. The advanced forecasts seem overall superior and by all indications well suited for efficient temperature control while improving the comfort regulation. 6.3 Statistical results To draw statistical conclusions from the results presented in this paper, we carry out a t -test based on the following setup. We consider the constraint violation and electricity price of each week of the 7 months of simulation as an observation. This equals 7 ⋅ 4 = 28 observations for each forecasting method for each heating strategy. Fig. 8 shows the histograms of the simulation results where the vertical lines are the mean-value for each forecasting strategy. Similar histograms can be made for the electricity prices. Tables 2 and 3 show the p -values of the t-tests between the mean values of the persistent- and advanced forecasts (shown in parenthesis). The constraint violations are all strongly significant below the 95% confidence level. The cost reduction, though, does not appear significant near usual confidence levels. However, the weather is highly correlated over extended time periods, and therefore we do not effectively have 28 observations for the tests. We note that all p -values are on the right side of the distribution, which indicates that with more observations, the electricity reduction becomes significant. 6.4 Inclusion of meteorological forecasts It is important to stretch that the advanced forecasts work best for a short future time window. As pointed out by the literature, meteorological forecasts in general provide more accurate predictions beyond 4-10 h ahead compared to short-term forecasts. Assuming that meteorological forecasts are strictly better after 10 h, we can then expect even better results than presented here by using a combined short- and long-term forecasting scheme. However this needs more work to clarify the specific gains and what forecast setup is optimal. 7 Conclusions This paper proposed a method for incorporating advanced disturbance models into a system model based on stochastic differential equations for model predictive control (MPC). This approach leads to a generic method for embedding forecasting and disturbance modelling for MPC for energy systems. We illustrated the method by statistically modelling the weather and controlling the indoor air temperature for a smart building. But the method itself is much more generally applicable. We mathematically reviewed the disturbance models and even argued that transformations were necessary for some of the disturbance-elements to obtain better accuracy by the dynamical equations. We compared the advanced embedded forecasts to conventional offset-free control, which suggested significant improvements of the control performance. Results suggest electricity savings between 5%\u201310% and reduction of constraint violations of up to 90% compared to offset-free MPC. In fact, we were able to achieve results very close to the performance supplied by perfect forecasts. We also illustrated the issues of heat pumps being governed by very slow heat dynamics. Thus, by combining different heating strategies, better control performance was achieved. Nevertheless, the heat pump itself performed very well in combination with the advanced disturbance forecasts and definitely proved useful. More work is needed on how to combine advanced, short-term forecasts with long-term, meteorological forecasts, since such a setup may improve current forecasting standards. An example is to investigate the best point in time to switch from short-term to long-term predictions. CRediT authorship contribution statement Christian Ankerstjerne Thilker: Conceptualization, Methodology, Software, Formal analysis, Writing - original draft. Henrik Madsen: Conceptualization, Methodology, Supervision, Writing - review & editing. John Bagterp Jørgensen: Conceptualization, Methodology, Supervision, Writing - review & editing. Declaration of Competing Interest The authors declare that they have no known competing financial interests or personal relationships that could have appeared to influence the work reported in this paper. Acknowledgements The authors obtained funding by Sustainable plus energy neighbourhoods (syn.ikia) (H2020 No. 869918), Centre for IT-Intelligent Energy Systems (CITIES) (DSF 1305-00027B), Flexible Energy Denmark (FED) (IFD 8090-00069B), and EUDP 64017-05136. References [1] Berardi U. A cross-country comparison of the building energy consumptions and their trends Resour Conserv Recy 123 2017 230 241 U. Berardi, A cross-country comparison of the building energy consumptions and their trends, Resources, Conservation and Recycling 123 2017 230 \u2013 241,, ISSN 0921-3449. [2] Halvgaard R, Poulsen NK, Madsen H, Jørgensen JB. Economic model predictive control for building climate control in a smart grid. In: 2012 IEEE PES innovative smart grid technologies. 2012. p. 1\u20136. [3] Schlüter HA, Boiroux D, Poulsen NK, Madsen H, Jørgensen JB. Economic model predictive control for energy systems in smart homes. In: 2019 IEEE conference on control technology and applications. 2019. p. 598\u2013604. [4] Salakij S. Yu N. Paolucci S. Antsaklis P. Model-Based Predictive Control for building energy management. I: Energy modeling and optimal control Energy Build 133 2016 345 358 S. Salakij, N. Yu, S. Paolucci, P. Antsaklis, Model-Based Predictive Control for building energy management. I: Energy modeling and optimal control, Energy and Buildings 133 2016 345 \u2013 358,, ISSN 0378-7788. [5] Hu M. Xiao F. Jørgensen J.B. Li R. Price-responsive model predictive control of floor heating systems for demand response using building thermal mass Appl Therm Eng 153 2019 316 329 M. Hu, F. Xiao, J. B. Jrgensen, R. Li, Price-responsive model predictive control of floor heating systems for demand response using building thermal mass, Applied Thermal Engineering 153 2019 316 \u2013 329,, ISSN 1359-4311. [6] Lee J. Model predictive control: Review of the three decades of development Int J Control Autom Syst 9 2011 415 424 J. Lee, Model Predictive Control: Review of the Three Decades of Development, International Journal of Control, Automation and Systems 9 2011 415\u2013424,. [7] Madsen H. Nielsen J. Lindström E. Baadsgaard M. Holst J. Statistics in finance 2004 Centre for Mathematical Sciences H. Madsen, J. Nielsen, E. Lindström, M. Baadsgaard, J. Holst, Statistics in Finance, Centre for Mathematical Sciences,2004. [8] Møller J.K. Zugno M. Madsen H. Probabilistic forecasts of wind power generation by stochastic differential equation models J Forecast 35 3 2016 189 205 J. K. Møller, M. Zugno, H. Madsen, Probabilistic Forecasts of Wind Power Generation by Stochastic Differential Equation Models, Journal of Forecasting 35 (3) 2016 189\u2013205,. [9] Iversen E.B. Morales J.M. Møller J.K. Madsen H. Short-term probabilistic forecasting of wind speed using stochastic differential equations Int J Forecast 32 3 2016 981 990 E. B. Iversen, J. M. Morales, J. K. Mller, H. Madsen, Short-term probabilistic forecasting of wind speed using stochastic differential equations, International Journal of Forecasting 32 (3) 2016 981\u2013990,. [10] Badosa J. Gobet E. Grangereau M. Kim D. Day-ahead probabilistic forecast of solar irradiance: A stochastic differential equation approach Drobinski P. Mougeot M. Picard D. Plougonven R. Tankov P. Renewable energy: Forecasting and risk management 2018 Springer International Publishing Cham 73 93 J. Badosa, E. Gobet, M. Grangereau, D. Kim, Day-Ahead Probabilistic Forecast of Solar Irradiance: A Stochastic Differential Equation Approach, in: P. Drobinski, M. Mougeot, D. Picard, R. Plougonven, P. Tankov (Eds.), Renewable Energy: Forecasting and Risk Management, Springer International Publishing, Cham, 73\u201393,,2018. [11] Iversen E. Morales J. Møller J. Madsen H. Probabilistic forecasts of solar irradiance by stochastic differential equations Environmetrics 25 2014 10.1002/env.2267 E. Iversen, J. Morales, J. Mller, H. Madsen, Probabilistic Forecasts of Solar Irradiance by Stochastic Differential Equations, Environmetrics 25, 10.1002/env.2267. [12] Candanedo J. Athienitis A. Predictive control of radiant floor heating and transmitted irradiance in a room with high solar gains (ML-11-015) HVAC&R Res 17 2011 235 256 J. Candanedo, A. Athienitis, Predictive Control of Radiant Floor Heating and Transmitted Irradiance in a Room with High Solar Gains (ML-11-015), HVAC&R Research 17 2011 235\u2013256,. [13] Gabsi F, Hamelin F, Pannequin R, Chaabane M. Energy efficiency of a multizone office building: MPC-based control and simscape modelling. In: 6th international conference on smart cities and green ICT systems, SMARTGREENS. Porto, Portugal. 2017. http://dx.doi.org/10.5220/0006305002270234. [14] De Coninck R. Helsen L. Practical implementation and evaluation of model predictive control for an office building in Brussels Energy Build 111 2016 290 298 R. De Coninck, L. Helsen, Practical implementation and evaluation of model predictive control for an office building in Brussels, Energy and Buildings 111 2016 290 \u2013 298,, ISSN 0378-7788. [15] Finck C. Li R. Zeiler W. Economic model predictive control for demand flexibility of a residential building Energy 176 2019 365 379 C. Finck, R. Li, W. Zeiler, Economic model predictive control for demand flexibility of a residential building, Energy 176 2019 365 \u2013 379,, ISSN 0360-5442. [16] Thieblemont H. Haghighat F. Ooka R. Moreau A. Predictive control strategies based on weather forecast in buildings with energy storage system: A review of the state-of-the art Energy Build 153 2017 485 500 H. Thieblemont, F. Haghighat, R. Ooka, A. Moreau, Predictive control strategies based on weather forecast in buildings with energy storage system: A review of the state-of-the art, Energy and Buildings 153 2017 485 \u2013 500,, ISSN 0378-7788. [17] Drgoňa J. Arroyo J. Cupeiro Figueroa I. Blum D. Arendt K. Kim D. All you need to know about model predictive control for buildings Annu Rev Control 2020 J. Drgoa, J. Arroyo, I. Cupeiro Figueroa, D. Blum, K. Arendt, D. Kim, E. P. Ollé, J. Oravec, M. Wetter, D. L. Vrabie, L. Helsen, All you need to know about model predictive control for buildings, Annual Reviews in Control . [18] Oldewurtel F. Parisio A. Jones C.N. Gyalistras D. Gwerder M. Stauch V. Use of model predictive control and weather forecasts for energy efficient building climate control Energy Build 45 2012 15 27 F. Oldewurtel, A. Parisio, C. N. Jones, D. Gyalistras, M. Gwerder, V. Stauch, B. Lehmann, M. Morari, Use of model predictive control and weather forecasts for energy efficient building climate control, Energy and Buildings 45 2012 15 \u2013 27,, ISSN 0378-7788. [19] Segarra E.L. Du H. Ruiz G.R. Bandera C.F. Methodology for the quantification of the impact of weather forecasts in predictive simulation models Energies 12 7 2019 1309 E. L. Segarra, H. Du, G. R. Ruiz, C. F. Bandera, Methodology for the Quantification of the Impact of Weather Forecasts in Predictive Simulation Models, Energies 12 (7) 2019 1309,. [20] Pang Z. Niu F. O\u2019Neill Z. Solar radiation prediction using recurrent neural network and artificial neural network: A case study with comparisons Renew Energy 156 2020 279 289 Z. Pang, F. Niu, Z. O\u2019Neill, Solar radiation prediction using recurrent neural network and artificial neural network: A case study with comparisons, Renewable Energy 156 2020 279\u2013289,. [21] Dong B. Lam K. A real-time model predictive control for building heating and cooling systems based on the occupancy behavior pattern detection and local weather forecasting Build Simul 7 2014 89 106 B. Dong, K. Lam, A real-time model predictive control for building heating and cooling systems based on the occupancy behavior pattern detection and local weather forecasting, Building Simulation 7 2014 89\u2013106,. [22] Florita A.R. Henze G.P. Comparison of short-term weather forecasting models for model predictive control HVAC&R Res 15 5 2009 835 853 A. R. Florita, G. P. Henze, Comparison of Short-Term Weather Forecasting Models for Model Predictive Control, HVAC&R Research 15 (5) 2009 835\u2013853,. [23] Lago J. De Ridder F. De Schutter B. Forecasting spot electricity prices: Deep learning approaches and empirical comparison of traditional algorithms Appl Energy 221 2018 386 405 J. Lago, F. De Ridder, B. De Schutter, Forecasting spot electricity prices: Deep learning approaches and empirical comparison of traditional algorithms, Applied Energy 221 2018 386\u2013405,. [24] Hatteland H. Sales forecasting 2019 Technical University of Denmark H. Hatteland, Sales Forecasting,2019. [25] Vega Lara B.G. Castellanos Molina L.M. Monteagudo Yanes J.P. Rodríguez Borroto M.A. Offset-free model predictive control for an energy efficient tropical island hotel Energy Build 119 2016 283 292 B. G. Vega Lara, L. M. Castellanos Molina, J. P. Monteagudo Yanes, M. A. Rodríguez Borroto, Offset-free model predictive control for an energy efficient tropical island hotel, Energy and Buildings 119 2016 283 \u2013 292,. [26] Taylor C. Leigh P. Price L. Young P. Vranken E. Berckmans D. Proportional-integral-plus (PIP) control of ventilation rate in agricultural buildings Control Eng Pract 12 2 2004 225 233 C. Taylor, P. Leigh, L. Price, P. Young, E. Vranken, D. Berckmans, Proportional-integral-plus (PIP) control of ventilation rate in agricultural buildings, Control Engineering Practice 12 (2) 2004 225 \u2013 233,. [27] Errouissi R. Al-Durra A. Muyeen S.M. Leng S. Blaabjerg F. Offset-free direct power control of DFIG under continuous-time model predictive control IEEE Trans Power Electron 32 3 2017 2265 2277 R. Errouissi, A. Al-Durra, S. M. Muyeen, S. Leng, F. Blaabjerg, Offset-Free Direct Power Control of DFIG Under Continuous-Time Model Predictive Control, IEEE Transactions on Power Electronics 32 (3) 2017 2265\u20132277,. [28] Huusom J.K. Poulsen N.K. Jørgensen S.B. Jørgensen J.B. Tuning SISO offset-free Model Predictive Control based on ARX models J Process Control 22 10 2012 1997 2007 J. K. Huusom, N. K. Poulsen, S. B. Jrgensen, J. B. Jrgensen, Tuning SISO offset-free Model Predictive Control based on ARX models, Journal of Process Control 22 (10) 2012 1997 \u2013 2007,. [29] Hagdrup M. Boiroux D. Mahmoudi Z. Madsen H. Poulsen N.K. Poulsen B. On the significance of the noise model for the performance of a linear MPC in closed-loop operation IFAC-PapersOnLine 49 7 2016 171 176 M. Hagdrup, D. Boiroux, Z. Mahmoudi, H. Madsen, N. K. Poulsen, B. Poulsen, J. B. Jrgensen, On the significance of the noise model for the performance of a linear MPC in closed-loop operation, IFAC-PapersOnLine 49 (7) 2016 171 \u2013 176,. [30] Rawlings J. Mayne D. Diehl M. Model predictive control: Theory, computation, and design 2017 J. Rawlings, D. Mayne, M. Diehl, Model Predictive Control: Theory, Computation, and Design,2017. [31] Rossiter J.A. Model-based predictive control: a practical approach 2003 CRC Press Boca Raton, Florida J. A. Rossiter, Model-based predictive control : a practical approach, Boca Raton, [Florida] : CRC Press, ISBN 978-0-203-50396-6,2003. [32] Andersen K.K. Madsen H. Hansen L.H. Modelling the heat dynamics of a building using stochastic differential equations Energy Build 31 1 2000 13 24 K. K. Andersen, H. Madsen, L. H. Hansen, Modelling the heat dynamics of a building using stochastic differential equations, Energy and Buildings 31 (1) 2000 13 \u2013 24,. [33] Zhang Y, Hanby V. Short-term prediction of weather parameters using online weather forecasts. In: IBPSA 2007 - international building performance simulation association 2007. 2007. [34] Jung R. Maderitsch R. Structural breaks in volatility spillovers between international financial markets: Contagion or mere interdependence? J Bank Financ 47 2014 331 342 R. Jung, R. Maderitsch, Structural breaks in volatility spillovers between international financial markets: Contagion or mere interdependence?, Journal of Banking & Finance 47 2014 331\u2013342,. [35] Bemporad A. Breschi V. Piga D. Boyd S.P. Fitting jump models Automatica 96 2018 11 21 10.1016/j.automatica.2018.06.022 URL: https://www.sciencedirect.com/science/article/pii/S0005109818303145 A. Bemporad, V. Breschi, D. Piga, S. P. Boyd, Fitting jump models, Automatica 96 2018 11\u201321,, ISSN 0005-1098, https://doi.org/10.1016/j.automatica.2018.06.022, https://www.sciencedirect.com/science/article/pii/S0005109818303145. [36] Andersen B. Eidorff S. Perdersen H.L.E. Rosenørn S. Valbjørn O. Meteorological data for design of building and installation: A reference year, no. 66 Tech. rep. 1977 Thermal Insulation Laboratory Technical University of Denmark B. Andersen, S. Eidorff, H. L. E. Perdersen, S. Rosenørn, O. Valbjrn, Meteorological Data for Design of Building and Installation: A Reference Year, Tech. Rep. 66, Thermal Insulation Laboratory, technical University of Denmark,1977. [37] WMO B. Manual on codes 3rd ed. 2019 World Meteorological Organization WMO, Manual on Codes, World Meteorological Organization, 3rd edn.,2019. [38] Thilker C.A. Optimization for smart energy systems [Master\u2019s thesis] 2020 Technical University of Denmark, Department of Applied Mathematics and Computer Science C. A. Thilker, Optimization for Smart Energy Systems, Master\u2019s thesis, Technical University of Denmark, Department of Applied Mathematics and Computer Science,2020. [39] Madsen H. Thyregod P. Inhomogenous Markov models for the variations in cloud cover International conference on statistical climatology, vol. 3 1986 71 76 URL: http://imsc.pacificclimate.org/proceedings/3IMSC.pdf H. Madsen, P. Thyregod, Inhomogenous Markov Models for the Variations in Cloud Cover, International Conference on Statistical Climatology 3 1986 71\u201376,, http://imsc.pacificclimate.org/proceedings/3IMSC.pdf. [40] Madsen H. Spliid H. Thyregod P. Markov models in discrete and continuous time for hourly observations of cloud cover J. Clim Appl Meteorol 24 1985 629 639 H. Madsen, H. Spliid, P. Thyregod, Markov Models in Discrete and Continuous Time for Hourly Observations of Cloud Cover, J. of Climate and Applied Meteorology 24 1985 629\u2013639,. [41] Møller J. Madsen H. From state dependent diffusion to constant diffusion in stochastic differential equations by the lamperti transform IMM-Technical report-2010-16 2010 Technical University of Denmark, DTU Informatics, Building 321 J. Møller, H. Madsen, From State Dependent Diffusion to Constant Diffusion in Stochastic Differential Equations by the Lamperti Transform, IMM-Technical Report-2010-16, Technical University of Denmark, DTU Informatics, Building 321,2010. [42] Breinholt A. Møller J.K. Madsen H. Mikkelsen P.S. A formal statistical approach to representing uncertainty in rainfall\u2013runoff modelling with focus on residual analysis and probabilistic output evaluation \u2013 Distinguishing simulation and prediction J Hydrol 472\u2013473 2012 36 52 A. Breinholt, J. K. Mller, H. Madsen, P. S. Mikkelsen, A formal statistical approach to representing uncertainty in rainfall\u2013runoff modelling with focus on residual analysis and probabilistic output evaluation \u2013 Distinguishing simulation and prediction, Journal of Hydrology 472-473 2012 36\u201352,. [43] Kristensen N.R. Madsen H. Jørgensen S.B. Parameter estimation in stochastic grey-box models Automatica 40 2 2004 225 237 N. R. Kristensen, H. Madsen, S. B. Jrgensen, Parameter estimation in stochastic grey-box models, Automatica 40 (2) 2004 225 \u2013 237,, ISSN 0005-1098. [44] Brok N.L. Madsen H. Jørgensen J.B. Nonlinear model predictive control for stochastic differential equation systems IFAC-PapersOnLine 51 20 2018 430 435 6th IFAC Conference on Nonlinear Model Predictive Control NMPC 2018 N. L. Brok, H. Madsen, J. B. Jrgensen, Nonlinear Model Predictive Control for Stochastic Differential Equation Systems, IFAC-PapersOnLine 51 (20) 2018 430 \u2013 435,, ISSN 2405-8963, 6th IFAC Conference on Nonlinear Model Predictive Control NMPC 2018. [45] Juhl R. Kristensen N.R. Bacher P. Kloppenborg J. Madsen H. CTSM-R user guide 2013 Technical University of Denmark R. Juhl, N. R. Kristensen, P. Bacher, J. Kloppenborg, H. Madsen, CTSM-R User Guide, technical University of Denmark,2013. [46] Nielsen L.B. Prahm L.P. Berkowicz R. Conradsen K. Net incoming radiation estimated from hourly global radiation and/or cloud observations J Climatol 1 3 1981 255 272 L. B. Nielsen, L. P. Prahm, R. Berkowicz, K. Conradsen, Net incoming radiation estimated from hourly global radiation and/or cloud observations, Journal of Climatology 1 (3) 1981 255\u2013272,. [47] Holtslag B. Ulden A. A simple scheme for daytime estimates of the surface fluxes from routine weather data J Appl Meteorol 22 1983 517 529 B. Holtslag, A. Ulden, A Simple Scheme for Daytime Estimates of the Surface Fluxes from Routine Weather Data, Journal of Applied Meteorology 22 1983 517\u2013529,. [48] Andersen L.E. Stokastiske modeller af udetemperatur og stråling (Danish) [stochastic models for ambient air temperature and radiation] [Master\u2019s thesis] 1984 Technical University of Denmark L. E. Andersen, Stokastiske modeller af udetemperatur og straling̊ (Danish) [Stochastic Models for Ambient Air Temperature and Radiation], Master\u2019s thesis, Technical University of Denmark,1984. [49] Madsen H. Statistically determined dynamical models for climate processes [Ph.D. thesis] 1985 Technical University of Denmark H. Madsen, Statistically determined dynamical models for climate processes, Ph.D. thesis, Technical University of Denmark,1985. [50] Thilker C.A. Junker R.G. Bacher P. Jørgensen J.B. Madsen H. Model predictive control based on stochastic differential equations Ghiaus C. Amayri M. Ploix S. Towards energy smart homes: algorithms, technologies, and applications 2020 Springer Publication expected in 2021 C. A. Thilker, R. G. Junker, P. Bacher, J. B. Jrgensen, H. Madsen, Model predictive control based on stochastic differential equations, in: C. Ghiaus, M. Amayri, S. Ploix (Eds.), Towards Energy Smart Homes: Algorithms, technologies, and applications, Springer, publication expected in 2021,2020. [51] Maciejowski J. Predictive control with constraints 2002 Prentice Hall England J. Maciejowski, Predictive Control with Constraints., Prentice Hall, England.,2002. [52] Junker R.G. Kallesøe C.S. Real J.P. Howard B. Lopes R.A. Madsen H. Stochastic nonlinear modelling and application of price-based energy flexibility Appl Energy 275 2020 115096 R. G. Junker, C. S. Kallese, J. P. Real, B. Howard, R. A. Lopes, H. Madsen, Stochastic nonlinear modelling and application of price-based energy flexibility, Applied Energy 275 2020 115096,, ISSN 0306-2619. [53] Madsen H. Parvizi J. Halvgaard R.F. Sokoler L.E. Jørgensen J.B. Hansen L.H. Control of electricity loads in future electric energy systems Handbook of clean energy systems: intelligent energy systems, vol. 4 2015 Wiley H. Madsen, J. Parvizi, R. F. Halvgaard, L. E. Sokoler, J. B. Jørgensen, L. H. Hansen, K. B. Hilger, Control of Electricity Loads in Future Electric Energy Systems, vol. 4, Wiley,2015. [54] Junker R.G. Azar A.G. Lopes R.A. Lindberg K.B. Reynders G. Relan R. Characterizing the energy flexibility of buildings and districts Appl Energy 225 2018 175 182 R. G. Junker, A. G. Azar, R. A. Lopes, K. B. Lindberg, G. Reynders, R. Relan, H. Madsen, Characterizing the energy flexibility of buildings and districts, Applied Energy 225 2018 175 \u2013 182,. [55] Clarke F.H. The generalized problem of bolza SIAM J Control Optim 14 4 1976 682 699 F. H. Clarke, The Generalized Problem of Bolza, SIAM Journal on Control and Optimization 14 (4) 1976 682\u2013699,.",
    "scopus-id": "85103561047",
    "coredata": {
        "eid": "1-s2.0-S0306261921003755",
        "dc:description": "We describe a method for embedding advanced weather disturbance models in model predictive control (MPC) of energy consumption and climate management in buildings. The performance of certainty-equivalent controllers such as conventional MPC for smart energy systems depends critically on accurate disturbance forecasts. Commonly, meteorological forecasts are used to supply weather predictions. However, these are generally not well suited for short-term forecasts. We show that an advanced physical and statistical description of the disturbances can provide useful short-term disturbance forecasts. We investigate the case of controlling the indoor air temperature of a simulated building using stochastic differential equations (SDEs) and certainty-equivalent MPC using the novel short-term forecasting method. A Lamperti transformation of the data and the models is an important contribution in making this SDE-based approach work. Simulation-based studies suggest that significant improvements are available for the performance of certainty-equivalent MPC based on short-term forecasts generated by the advanced disturbance model: Electricity savings of 5%\u201310% while at the same time improving the indoor climate by reducing comfort violations by up to over 90%.",
        "openArchiveArticle": "false",
        "prism:coverDate": "2021-06-15",
        "openaccessUserLicense": "http://creativecommons.org/licenses/by/4.0/",
        "prism:aggregationType": "Journal",
        "prism:url": "https://api.elsevier.com/content/article/pii/S0306261921003755",
        "dc:creator": [
            {
                "@_fa": "true",
                "$": "Thilker, Christian Ankerstjerne"
            },
            {
                "@_fa": "true",
                "$": "Madsen, Henrik"
            },
            {
                "@_fa": "true",
                "$": "Jørgensen, John Bagterp"
            }
        ],
        "link": [
            {
                "@_fa": "true",
                "@rel": "self",
                "@href": "https://api.elsevier.com/content/article/pii/S0306261921003755"
            },
            {
                "@_fa": "true",
                "@rel": "scidir",
                "@href": "https://www.sciencedirect.com/science/article/pii/S0306261921003755"
            }
        ],
        "dc:format": "application/json",
        "openaccessType": "Full",
        "pii": "S0306-2619(21)00375-5",
        "prism:volume": "292",
        "articleNumber": "116889",
        "prism:publisher": "The Authors. Published by Elsevier Ltd.",
        "dc:title": "Advanced forecasting and disturbance modelling for model predictive control of smart energy systems",
        "prism:copyright": "© 2021 The Authors. Published by Elsevier Ltd.",
        "openaccess": "1",
        "prism:issn": "03062619",
        "dcterms:subject": [
            {
                "@_fa": "true",
                "$": "Model predictive control"
            },
            {
                "@_fa": "true",
                "$": "Stochastic differential equations"
            },
            {
                "@_fa": "true",
                "$": "Disturbance models"
            },
            {
                "@_fa": "true",
                "$": "Smart energy systems"
            }
        ],
        "openaccessArticle": "true",
        "prism:publicationName": "Applied Energy",
        "openaccessSponsorType": "Author",
        "prism:pageRange": "116889",
        "pubType": "fla",
        "prism:coverDisplayDate": "15 June 2021",
        "prism:doi": "10.1016/j.apenergy.2021.116889",
        "prism:startingPage": "116889",
        "dc:identifier": "doi:10.1016/j.apenergy.2021.116889",
        "openaccessSponsorName": null
    },
    "objects": {"object": [
        {
            "@category": "standard",
            "@height": "126",
            "@width": "565",
            "@_fa": "true",
            "$": "https://api.elsevier.com/content/object/eid/1-s2.0-S0306261921003755-gr3.jpg?httpAccept=%2A%2F%2A",
            "@multimediatype": "JPEG image file",
            "@type": "IMAGE-DOWNSAMPLED",
            "@size": "81772",
            "@ref": "gr3",
            "@mimetype": "image/jpeg"
        },
        {
            "@category": "standard",
            "@height": "213",
            "@width": "364",
            "@_fa": "true",
            "$": "https://api.elsevier.com/content/object/eid/1-s2.0-S0306261921003755-gr2.jpg?httpAccept=%2A%2F%2A",
            "@multimediatype": "JPEG image file",
            "@type": "IMAGE-DOWNSAMPLED",
            "@size": "85208",
            "@ref": "gr2",
            "@mimetype": "image/jpeg"
        },
        {
            "@category": "standard",
            "@height": "228",
            "@width": "342",
            "@_fa": "true",
            "$": "https://api.elsevier.com/content/object/eid/1-s2.0-S0306261921003755-gr5.jpg?httpAccept=%2A%2F%2A",
            "@multimediatype": "JPEG image file",
            "@type": "IMAGE-DOWNSAMPLED",
            "@size": "99762",
            "@ref": "gr5",
            "@mimetype": "image/jpeg"
        },
        {
            "@category": "standard",
            "@height": "470",
            "@width": "364",
            "@_fa": "true",
            "$": "https://api.elsevier.com/content/object/eid/1-s2.0-S0306261921003755-gr4.jpg?httpAccept=%2A%2F%2A",
            "@multimediatype": "JPEG image file",
            "@type": "IMAGE-DOWNSAMPLED",
            "@size": "132577",
            "@ref": "gr4",
            "@mimetype": "image/jpeg"
        },
        {
            "@category": "standard",
            "@height": "468",
            "@width": "696",
            "@_fa": "true",
            "$": "https://api.elsevier.com/content/object/eid/1-s2.0-S0306261921003755-gr7.jpg?httpAccept=%2A%2F%2A",
            "@multimediatype": "JPEG image file",
            "@type": "IMAGE-DOWNSAMPLED",
            "@size": "217357",
            "@ref": "gr7",
            "@mimetype": "image/jpeg"
        },
        {
            "@category": "standard",
            "@height": "185",
            "@width": "562",
            "@_fa": "true",
            "$": "https://api.elsevier.com/content/object/eid/1-s2.0-S0306261921003755-gr6.jpg?httpAccept=%2A%2F%2A",
            "@multimediatype": "JPEG image file",
            "@type": "IMAGE-DOWNSAMPLED",
            "@size": "110052",
            "@ref": "gr6",
            "@mimetype": "image/jpeg"
        },
        {
            "@category": "standard",
            "@height": "890",
            "@width": "275",
            "@_fa": "true",
            "$": "https://api.elsevier.com/content/object/eid/1-s2.0-S0306261921003755-gr8.jpg?httpAccept=%2A%2F%2A",
            "@multimediatype": "JPEG image file",
            "@type": "IMAGE-DOWNSAMPLED",
            "@size": "132613",
            "@ref": "gr8",
            "@mimetype": "image/jpeg"
        },
        {
            "@category": "standard",
            "@height": "79",
            "@width": "301",
            "@_fa": "true",
            "$": "https://api.elsevier.com/content/object/eid/1-s2.0-S0306261921003755-fx1.jpg?httpAccept=%2A%2F%2A",
            "@multimediatype": "JPEG image file",
            "@type": "IMAGE-DOWNSAMPLED",
            "@size": "77192",
            "@ref": "fx1",
            "@mimetype": "image/jpeg"
        },
        {
            "@category": "standard",
            "@height": "357",
            "@width": "809",
            "@_fa": "true",
            "$": "https://api.elsevier.com/content/object/eid/1-s2.0-S0306261921003755-fx1001.jpg?httpAccept=%2A%2F%2A",
            "@multimediatype": "JPEG image file",
            "@type": "IMAGE-DOWNSAMPLED",
            "@size": "124157",
            "@ref": "fx1001",
            "@mimetype": "image/jpeg"
        },
        {
            "@category": "standard",
            "@height": "245",
            "@width": "371",
            "@_fa": "true",
            "$": "https://api.elsevier.com/content/object/eid/1-s2.0-S0306261921003755-gr1.jpg?httpAccept=%2A%2F%2A",
            "@multimediatype": "JPEG image file",
            "@type": "IMAGE-DOWNSAMPLED",
            "@size": "88414",
            "@ref": "gr1",
            "@mimetype": "image/jpeg"
        },
        {
            "@category": "standard",
            "@height": "382",
            "@width": "809",
            "@_fa": "true",
            "$": "https://api.elsevier.com/content/object/eid/1-s2.0-S0306261921003755-fx1002.jpg?httpAccept=%2A%2F%2A",
            "@multimediatype": "JPEG image file",
            "@type": "IMAGE-DOWNSAMPLED",
            "@size": "108118",
            "@ref": "fx1002",
            "@mimetype": "image/jpeg"
        },
        {
            "@category": "thumbnail",
            "@height": "49",
            "@width": "219",
            "@_fa": "true",
            "$": "https://api.elsevier.com/content/object/eid/1-s2.0-S0306261921003755-gr3.sml?httpAccept=%2A%2F%2A",
            "@multimediatype": "GIF image file",
            "@type": "IMAGE-THUMBNAIL",
            "@size": "68364",
            "@ref": "gr3",
            "@mimetype": "image/gif"
        },
        {
            "@category": "thumbnail",
            "@height": "128",
            "@width": "219",
            "@_fa": "true",
            "$": "https://api.elsevier.com/content/object/eid/1-s2.0-S0306261921003755-gr2.sml?httpAccept=%2A%2F%2A",
            "@multimediatype": "GIF image file",
            "@type": "IMAGE-THUMBNAIL",
            "@size": "71212",
            "@ref": "gr2",
            "@mimetype": "image/gif"
        },
        {
            "@category": "thumbnail",
            "@height": "146",
            "@width": "219",
            "@_fa": "true",
            "$": "https://api.elsevier.com/content/object/eid/1-s2.0-S0306261921003755-gr5.sml?httpAccept=%2A%2F%2A",
            "@multimediatype": "GIF image file",
            "@type": "IMAGE-THUMBNAIL",
            "@size": "77031",
            "@ref": "gr5",
            "@mimetype": "image/gif"
        },
        {
            "@category": "thumbnail",
            "@height": "164",
            "@width": "127",
            "@_fa": "true",
            "$": "https://api.elsevier.com/content/object/eid/1-s2.0-S0306261921003755-gr4.sml?httpAccept=%2A%2F%2A",
            "@multimediatype": "GIF image file",
            "@type": "IMAGE-THUMBNAIL",
            "@size": "76769",
            "@ref": "gr4",
            "@mimetype": "image/gif"
        },
        {
            "@category": "thumbnail",
            "@height": "147",
            "@width": "219",
            "@_fa": "true",
            "$": "https://api.elsevier.com/content/object/eid/1-s2.0-S0306261921003755-gr7.sml?httpAccept=%2A%2F%2A",
            "@multimediatype": "GIF image file",
            "@type": "IMAGE-THUMBNAIL",
            "@size": "82348",
            "@ref": "gr7",
            "@mimetype": "image/gif"
        },
        {
            "@category": "thumbnail",
            "@height": "72",
            "@width": "219",
            "@_fa": "true",
            "$": "https://api.elsevier.com/content/object/eid/1-s2.0-S0306261921003755-gr6.sml?httpAccept=%2A%2F%2A",
            "@multimediatype": "GIF image file",
            "@type": "IMAGE-THUMBNAIL",
            "@size": "71567",
            "@ref": "gr6",
            "@mimetype": "image/gif"
        },
        {
            "@category": "thumbnail",
            "@height": "162",
            "@width": "50",
            "@_fa": "true",
            "$": "https://api.elsevier.com/content/object/eid/1-s2.0-S0306261921003755-gr8.sml?httpAccept=%2A%2F%2A",
            "@multimediatype": "GIF image file",
            "@type": "IMAGE-THUMBNAIL",
            "@size": "70116",
            "@ref": "gr8",
            "@mimetype": "image/gif"
        },
        {
            "@category": "thumbnail",
            "@height": "58",
            "@width": "219",
            "@_fa": "true",
            "$": "https://api.elsevier.com/content/object/eid/1-s2.0-S0306261921003755-fx1.sml?httpAccept=%2A%2F%2A",
            "@multimediatype": "GIF image file",
            "@type": "IMAGE-THUMBNAIL",
            "@size": "69386",
            "@ref": "fx1",
            "@mimetype": "image/gif"
        },
        {
            "@category": "thumbnail",
            "@height": "97",
            "@width": "219",
            "@_fa": "true",
            "$": "https://api.elsevier.com/content/object/eid/1-s2.0-S0306261921003755-fx1001.sml?httpAccept=%2A%2F%2A",
            "@multimediatype": "GIF image file",
            "@type": "IMAGE-THUMBNAIL",
            "@size": "70929",
            "@ref": "fx1001",
            "@mimetype": "image/gif"
        },
        {
            "@category": "thumbnail",
            "@height": "145",
            "@width": "219",
            "@_fa": "true",
            "$": "https://api.elsevier.com/content/object/eid/1-s2.0-S0306261921003755-gr1.sml?httpAccept=%2A%2F%2A",
            "@multimediatype": "GIF image file",
            "@type": "IMAGE-THUMBNAIL",
            "@size": "73620",
            "@ref": "gr1",
            "@mimetype": "image/gif"
        },
        {
            "@category": "thumbnail",
            "@height": "103",
            "@width": "219",
            "@_fa": "true",
            "$": "https://api.elsevier.com/content/object/eid/1-s2.0-S0306261921003755-fx1002.sml?httpAccept=%2A%2F%2A",
            "@multimediatype": "GIF image file",
            "@type": "IMAGE-THUMBNAIL",
            "@size": "69547",
            "@ref": "fx1002",
            "@mimetype": "image/gif"
        },
        {
            "@category": "high",
            "@height": "559",
            "@width": "2500",
            "@_fa": "true",
            "$": "https://api.elsevier.com/content/object/eid/1-s2.0-S0306261921003755-gr3_lrg.jpg?httpAccept=%2A%2F%2A",
            "@multimediatype": "JPEG image file",
            "@type": "IMAGE-HIGH-RES",
            "@size": "165364",
            "@ref": "gr3",
            "@mimetype": "image/jpeg"
        },
        {
            "@category": "high",
            "@height": "943",
            "@width": "1612",
            "@_fa": "true",
            "$": "https://api.elsevier.com/content/object/eid/1-s2.0-S0306261921003755-gr2_lrg.jpg?httpAccept=%2A%2F%2A",
            "@multimediatype": "JPEG image file",
            "@type": "IMAGE-HIGH-RES",
            "@size": "172975",
            "@ref": "gr2",
            "@mimetype": "image/jpeg"
        },
        {
            "@category": "high",
            "@height": "1008",
            "@width": "1514",
            "@_fa": "true",
            "$": "https://api.elsevier.com/content/object/eid/1-s2.0-S0306261921003755-gr5_lrg.jpg?httpAccept=%2A%2F%2A",
            "@multimediatype": "JPEG image file",
            "@type": "IMAGE-HIGH-RES",
            "@size": "252076",
            "@ref": "gr5",
            "@mimetype": "image/jpeg"
        },
        {
            "@category": "high",
            "@height": "2082",
            "@width": "1611",
            "@_fa": "true",
            "$": "https://api.elsevier.com/content/object/eid/1-s2.0-S0306261921003755-gr4_lrg.jpg?httpAccept=%2A%2F%2A",
            "@multimediatype": "JPEG image file",
            "@type": "IMAGE-HIGH-RES",
            "@size": "501124",
            "@ref": "gr4",
            "@mimetype": "image/jpeg"
        },
        {
            "@category": "high",
            "@height": "2075",
            "@width": "3083",
            "@_fa": "true",
            "$": "https://api.elsevier.com/content/object/eid/1-s2.0-S0306261921003755-gr7_lrg.jpg?httpAccept=%2A%2F%2A",
            "@multimediatype": "JPEG image file",
            "@type": "IMAGE-HIGH-RES",
            "@size": "1198943",
            "@ref": "gr7",
            "@mimetype": "image/jpeg"
        },
        {
            "@category": "high",
            "@height": "821",
            "@width": "2490",
            "@_fa": "true",
            "$": "https://api.elsevier.com/content/object/eid/1-s2.0-S0306261921003755-gr6_lrg.jpg?httpAccept=%2A%2F%2A",
            "@multimediatype": "JPEG image file",
            "@type": "IMAGE-HIGH-RES",
            "@size": "369379",
            "@ref": "gr6",
            "@mimetype": "image/jpeg"
        },
        {
            "@category": "high",
            "@height": "3943",
            "@width": "1219",
            "@_fa": "true",
            "$": "https://api.elsevier.com/content/object/eid/1-s2.0-S0306261921003755-gr8_lrg.jpg?httpAccept=%2A%2F%2A",
            "@multimediatype": "JPEG image file",
            "@type": "IMAGE-HIGH-RES",
            "@size": "523182",
            "@ref": "gr8",
            "@mimetype": "image/jpeg"
        },
        {
            "@category": "high",
            "@height": "350",
            "@width": "1333",
            "@_fa": "true",
            "$": "https://api.elsevier.com/content/object/eid/1-s2.0-S0306261921003755-fx1_lrg.jpg?httpAccept=%2A%2F%2A",
            "@multimediatype": "JPEG image file",
            "@type": "IMAGE-HIGH-RES",
            "@size": "134996",
            "@ref": "fx1",
            "@mimetype": "image/jpeg"
        },
        {
            "@category": "high",
            "@height": "1582",
            "@width": "3583",
            "@_fa": "true",
            "$": "https://api.elsevier.com/content/object/eid/1-s2.0-S0306261921003755-fx1001_lrg.jpg?httpAccept=%2A%2F%2A",
            "@multimediatype": "JPEG image file",
            "@type": "IMAGE-HIGH-RES",
            "@size": "482970",
            "@ref": "fx1001",
            "@mimetype": "image/jpeg"
        },
        {
            "@category": "high",
            "@height": "1085",
            "@width": "1644",
            "@_fa": "true",
            "$": "https://api.elsevier.com/content/object/eid/1-s2.0-S0306261921003755-gr1_lrg.jpg?httpAccept=%2A%2F%2A",
            "@multimediatype": "JPEG image file",
            "@type": "IMAGE-HIGH-RES",
            "@size": "185221",
            "@ref": "gr1",
            "@mimetype": "image/jpeg"
        },
        {
            "@category": "high",
            "@height": "1692",
            "@width": "3583",
            "@_fa": "true",
            "$": "https://api.elsevier.com/content/object/eid/1-s2.0-S0306261921003755-fx1002_lrg.jpg?httpAccept=%2A%2F%2A",
            "@multimediatype": "JPEG image file",
            "@type": "IMAGE-HIGH-RES",
            "@size": "381057",
            "@ref": "fx1002",
            "@mimetype": "image/jpeg"
        },
        {
            "@category": "thumbnail",
            "@_fa": "true",
            "$": "https://api.elsevier.com/content/object/eid/1-s2.0-S0306261921003755-si1.svg?httpAccept=%2A%2F%2A",
            "@multimediatype": "Scalable Vector Graphics file",
            "@type": "ALTIMG",
            "@size": "18712",
            "@ref": "si1",
            "@mimetype": "image/svg+xml"
        },
        {
            "@category": "thumbnail",
            "@_fa": "true",
            "$": "https://api.elsevier.com/content/object/eid/1-s2.0-S0306261921003755-si10.svg?httpAccept=%2A%2F%2A",
            "@multimediatype": "Scalable Vector Graphics file",
            "@type": "ALTIMG",
            "@size": "2786",
            "@ref": "si10",
            "@mimetype": "image/svg+xml"
        },
        {
            "@category": "thumbnail",
            "@_fa": "true",
            "$": "https://api.elsevier.com/content/object/eid/1-s2.0-S0306261921003755-si100.svg?httpAccept=%2A%2F%2A",
            "@multimediatype": "Scalable Vector Graphics file",
            "@type": "ALTIMG",
            "@size": "4986",
            "@ref": "si100",
            "@mimetype": "image/svg+xml"
        },
        {
            "@category": "thumbnail",
            "@_fa": "true",
            "$": "https://api.elsevier.com/content/object/eid/1-s2.0-S0306261921003755-si102.svg?httpAccept=%2A%2F%2A",
            "@multimediatype": "Scalable Vector Graphics file",
            "@type": "ALTIMG",
            "@size": "64028",
            "@ref": "si102",
            "@mimetype": "image/svg+xml"
        },
        {
            "@category": "thumbnail",
            "@_fa": "true",
            "$": "https://api.elsevier.com/content/object/eid/1-s2.0-S0306261921003755-si11.svg?httpAccept=%2A%2F%2A",
            "@multimediatype": "Scalable Vector Graphics file",
            "@type": "ALTIMG",
            "@size": "3183",
            "@ref": "si11",
            "@mimetype": "image/svg+xml"
        },
        {
            "@category": "thumbnail",
            "@_fa": "true",
            "$": "https://api.elsevier.com/content/object/eid/1-s2.0-S0306261921003755-si112.svg?httpAccept=%2A%2F%2A",
            "@multimediatype": "Scalable Vector Graphics file",
            "@type": "ALTIMG",
            "@size": "47182",
            "@ref": "si112",
            "@mimetype": "image/svg+xml"
        },
        {
            "@category": "thumbnail",
            "@_fa": "true",
            "$": "https://api.elsevier.com/content/object/eid/1-s2.0-S0306261921003755-si119.svg?httpAccept=%2A%2F%2A",
            "@multimediatype": "Scalable Vector Graphics file",
            "@type": "ALTIMG",
            "@size": "2755",
            "@ref": "si119",
            "@mimetype": "image/svg+xml"
        },
        {
            "@category": "thumbnail",
            "@_fa": "true",
            "$": "https://api.elsevier.com/content/object/eid/1-s2.0-S0306261921003755-si12.svg?httpAccept=%2A%2F%2A",
            "@multimediatype": "Scalable Vector Graphics file",
            "@type": "ALTIMG",
            "@size": "4480",
            "@ref": "si12",
            "@mimetype": "image/svg+xml"
        },
        {
            "@category": "thumbnail",
            "@_fa": "true",
            "$": "https://api.elsevier.com/content/object/eid/1-s2.0-S0306261921003755-si120.svg?httpAccept=%2A%2F%2A",
            "@multimediatype": "Scalable Vector Graphics file",
            "@type": "ALTIMG",
            "@size": "2184",
            "@ref": "si120",
            "@mimetype": "image/svg+xml"
        },
        {
            "@category": "thumbnail",
            "@_fa": "true",
            "$": "https://api.elsevier.com/content/object/eid/1-s2.0-S0306261921003755-si121.svg?httpAccept=%2A%2F%2A",
            "@multimediatype": "Scalable Vector Graphics file",
            "@type": "ALTIMG",
            "@size": "3242",
            "@ref": "si121",
            "@mimetype": "image/svg+xml"
        },
        {
            "@category": "thumbnail",
            "@_fa": "true",
            "$": "https://api.elsevier.com/content/object/eid/1-s2.0-S0306261921003755-si122.svg?httpAccept=%2A%2F%2A",
            "@multimediatype": "Scalable Vector Graphics file",
            "@type": "ALTIMG",
            "@size": "4124",
            "@ref": "si122",
            "@mimetype": "image/svg+xml"
        },
        {
            "@category": "thumbnail",
            "@_fa": "true",
            "$": "https://api.elsevier.com/content/object/eid/1-s2.0-S0306261921003755-si123.svg?httpAccept=%2A%2F%2A",
            "@multimediatype": "Scalable Vector Graphics file",
            "@type": "ALTIMG",
            "@size": "9028",
            "@ref": "si123",
            "@mimetype": "image/svg+xml"
        },
        {
            "@category": "thumbnail",
            "@_fa": "true",
            "$": "https://api.elsevier.com/content/object/eid/1-s2.0-S0306261921003755-si124.svg?httpAccept=%2A%2F%2A",
            "@multimediatype": "Scalable Vector Graphics file",
            "@type": "ALTIMG",
            "@size": "3604",
            "@ref": "si124",
            "@mimetype": "image/svg+xml"
        },
        {
            "@category": "thumbnail",
            "@_fa": "true",
            "$": "https://api.elsevier.com/content/object/eid/1-s2.0-S0306261921003755-si125.svg?httpAccept=%2A%2F%2A",
            "@multimediatype": "Scalable Vector Graphics file",
            "@type": "ALTIMG",
            "@size": "3324",
            "@ref": "si125",
            "@mimetype": "image/svg+xml"
        },
        {
            "@category": "thumbnail",
            "@_fa": "true",
            "$": "https://api.elsevier.com/content/object/eid/1-s2.0-S0306261921003755-si126.svg?httpAccept=%2A%2F%2A",
            "@multimediatype": "Scalable Vector Graphics file",
            "@type": "ALTIMG",
            "@size": "5122",
            "@ref": "si126",
            "@mimetype": "image/svg+xml"
        },
        {
            "@category": "thumbnail",
            "@_fa": "true",
            "$": "https://api.elsevier.com/content/object/eid/1-s2.0-S0306261921003755-si127.svg?httpAccept=%2A%2F%2A",
            "@multimediatype": "Scalable Vector Graphics file",
            "@type": "ALTIMG",
            "@size": "6058",
            "@ref": "si127",
            "@mimetype": "image/svg+xml"
        },
        {
            "@category": "thumbnail",
            "@_fa": "true",
            "$": "https://api.elsevier.com/content/object/eid/1-s2.0-S0306261921003755-si129.svg?httpAccept=%2A%2F%2A",
            "@multimediatype": "Scalable Vector Graphics file",
            "@type": "ALTIMG",
            "@size": "5595",
            "@ref": "si129",
            "@mimetype": "image/svg+xml"
        },
        {
            "@category": "thumbnail",
            "@_fa": "true",
            "$": "https://api.elsevier.com/content/object/eid/1-s2.0-S0306261921003755-si13.svg?httpAccept=%2A%2F%2A",
            "@multimediatype": "Scalable Vector Graphics file",
            "@type": "ALTIMG",
            "@size": "4876",
            "@ref": "si13",
            "@mimetype": "image/svg+xml"
        },
        {
            "@category": "thumbnail",
            "@_fa": "true",
            "$": "https://api.elsevier.com/content/object/eid/1-s2.0-S0306261921003755-si130.svg?httpAccept=%2A%2F%2A",
            "@multimediatype": "Scalable Vector Graphics file",
            "@type": "ALTIMG",
            "@size": "10204",
            "@ref": "si130",
            "@mimetype": "image/svg+xml"
        },
        {
            "@category": "thumbnail",
            "@_fa": "true",
            "$": "https://api.elsevier.com/content/object/eid/1-s2.0-S0306261921003755-si131.svg?httpAccept=%2A%2F%2A",
            "@multimediatype": "Scalable Vector Graphics file",
            "@type": "ALTIMG",
            "@size": "14427",
            "@ref": "si131",
            "@mimetype": "image/svg+xml"
        },
        {
            "@category": "thumbnail",
            "@_fa": "true",
            "$": "https://api.elsevier.com/content/object/eid/1-s2.0-S0306261921003755-si132.svg?httpAccept=%2A%2F%2A",
            "@multimediatype": "Scalable Vector Graphics file",
            "@type": "ALTIMG",
            "@size": "2538",
            "@ref": "si132",
            "@mimetype": "image/svg+xml"
        },
        {
            "@category": "thumbnail",
            "@_fa": "true",
            "$": "https://api.elsevier.com/content/object/eid/1-s2.0-S0306261921003755-si134.svg?httpAccept=%2A%2F%2A",
            "@multimediatype": "Scalable Vector Graphics file",
            "@type": "ALTIMG",
            "@size": "5986",
            "@ref": "si134",
            "@mimetype": "image/svg+xml"
        },
        {
            "@category": "thumbnail",
            "@_fa": "true",
            "$": "https://api.elsevier.com/content/object/eid/1-s2.0-S0306261921003755-si135.svg?httpAccept=%2A%2F%2A",
            "@multimediatype": "Scalable Vector Graphics file",
            "@type": "ALTIMG",
            "@size": "2179",
            "@ref": "si135",
            "@mimetype": "image/svg+xml"
        },
        {
            "@category": "thumbnail",
            "@_fa": "true",
            "$": "https://api.elsevier.com/content/object/eid/1-s2.0-S0306261921003755-si136.svg?httpAccept=%2A%2F%2A",
            "@multimediatype": "Scalable Vector Graphics file",
            "@type": "ALTIMG",
            "@size": "4929",
            "@ref": "si136",
            "@mimetype": "image/svg+xml"
        },
        {
            "@category": "thumbnail",
            "@_fa": "true",
            "$": "https://api.elsevier.com/content/object/eid/1-s2.0-S0306261921003755-si137.svg?httpAccept=%2A%2F%2A",
            "@multimediatype": "Scalable Vector Graphics file",
            "@type": "ALTIMG",
            "@size": "4980",
            "@ref": "si137",
            "@mimetype": "image/svg+xml"
        },
        {
            "@category": "thumbnail",
            "@_fa": "true",
            "$": "https://api.elsevier.com/content/object/eid/1-s2.0-S0306261921003755-si138.svg?httpAccept=%2A%2F%2A",
            "@multimediatype": "Scalable Vector Graphics file",
            "@type": "ALTIMG",
            "@size": "5574",
            "@ref": "si138",
            "@mimetype": "image/svg+xml"
        },
        {
            "@category": "thumbnail",
            "@_fa": "true",
            "$": "https://api.elsevier.com/content/object/eid/1-s2.0-S0306261921003755-si139.svg?httpAccept=%2A%2F%2A",
            "@multimediatype": "Scalable Vector Graphics file",
            "@type": "ALTIMG",
            "@size": "13283",
            "@ref": "si139",
            "@mimetype": "image/svg+xml"
        },
        {
            "@category": "thumbnail",
            "@_fa": "true",
            "$": "https://api.elsevier.com/content/object/eid/1-s2.0-S0306261921003755-si14.svg?httpAccept=%2A%2F%2A",
            "@multimediatype": "Scalable Vector Graphics file",
            "@type": "ALTIMG",
            "@size": "9184",
            "@ref": "si14",
            "@mimetype": "image/svg+xml"
        },
        {
            "@category": "thumbnail",
            "@_fa": "true",
            "$": "https://api.elsevier.com/content/object/eid/1-s2.0-S0306261921003755-si140.svg?httpAccept=%2A%2F%2A",
            "@multimediatype": "Scalable Vector Graphics file",
            "@type": "ALTIMG",
            "@size": "9077",
            "@ref": "si140",
            "@mimetype": "image/svg+xml"
        },
        {
            "@category": "thumbnail",
            "@_fa": "true",
            "$": "https://api.elsevier.com/content/object/eid/1-s2.0-S0306261921003755-si141.svg?httpAccept=%2A%2F%2A",
            "@multimediatype": "Scalable Vector Graphics file",
            "@type": "ALTIMG",
            "@size": "15522",
            "@ref": "si141",
            "@mimetype": "image/svg+xml"
        },
        {
            "@category": "thumbnail",
            "@_fa": "true",
            "$": "https://api.elsevier.com/content/object/eid/1-s2.0-S0306261921003755-si142.svg?httpAccept=%2A%2F%2A",
            "@multimediatype": "Scalable Vector Graphics file",
            "@type": "ALTIMG",
            "@size": "8372",
            "@ref": "si142",
            "@mimetype": "image/svg+xml"
        },
        {
            "@category": "thumbnail",
            "@_fa": "true",
            "$": "https://api.elsevier.com/content/object/eid/1-s2.0-S0306261921003755-si143.svg?httpAccept=%2A%2F%2A",
            "@multimediatype": "Scalable Vector Graphics file",
            "@type": "ALTIMG",
            "@size": "15272",
            "@ref": "si143",
            "@mimetype": "image/svg+xml"
        },
        {
            "@category": "thumbnail",
            "@_fa": "true",
            "$": "https://api.elsevier.com/content/object/eid/1-s2.0-S0306261921003755-si144.svg?httpAccept=%2A%2F%2A",
            "@multimediatype": "Scalable Vector Graphics file",
            "@type": "ALTIMG",
            "@size": "15182",
            "@ref": "si144",
            "@mimetype": "image/svg+xml"
        },
        {
            "@category": "thumbnail",
            "@_fa": "true",
            "$": "https://api.elsevier.com/content/object/eid/1-s2.0-S0306261921003755-si145.svg?httpAccept=%2A%2F%2A",
            "@multimediatype": "Scalable Vector Graphics file",
            "@type": "ALTIMG",
            "@size": "18306",
            "@ref": "si145",
            "@mimetype": "image/svg+xml"
        },
        {
            "@category": "thumbnail",
            "@_fa": "true",
            "$": "https://api.elsevier.com/content/object/eid/1-s2.0-S0306261921003755-si146.svg?httpAccept=%2A%2F%2A",
            "@multimediatype": "Scalable Vector Graphics file",
            "@type": "ALTIMG",
            "@size": "2572",
            "@ref": "si146",
            "@mimetype": "image/svg+xml"
        },
        {
            "@category": "thumbnail",
            "@_fa": "true",
            "$": "https://api.elsevier.com/content/object/eid/1-s2.0-S0306261921003755-si148.svg?httpAccept=%2A%2F%2A",
            "@multimediatype": "Scalable Vector Graphics file",
            "@type": "ALTIMG",
            "@size": "3606",
            "@ref": "si148",
            "@mimetype": "image/svg+xml"
        },
        {
            "@category": "thumbnail",
            "@_fa": "true",
            "$": "https://api.elsevier.com/content/object/eid/1-s2.0-S0306261921003755-si149.svg?httpAccept=%2A%2F%2A",
            "@multimediatype": "Scalable Vector Graphics file",
            "@type": "ALTIMG",
            "@size": "5192",
            "@ref": "si149",
            "@mimetype": "image/svg+xml"
        },
        {
            "@category": "thumbnail",
            "@_fa": "true",
            "$": "https://api.elsevier.com/content/object/eid/1-s2.0-S0306261921003755-si15.svg?httpAccept=%2A%2F%2A",
            "@multimediatype": "Scalable Vector Graphics file",
            "@type": "ALTIMG",
            "@size": "9636",
            "@ref": "si15",
            "@mimetype": "image/svg+xml"
        },
        {
            "@category": "thumbnail",
            "@_fa": "true",
            "$": "https://api.elsevier.com/content/object/eid/1-s2.0-S0306261921003755-si150.svg?httpAccept=%2A%2F%2A",
            "@multimediatype": "Scalable Vector Graphics file",
            "@type": "ALTIMG",
            "@size": "3882",
            "@ref": "si150",
            "@mimetype": "image/svg+xml"
        },
        {
            "@category": "thumbnail",
            "@_fa": "true",
            "$": "https://api.elsevier.com/content/object/eid/1-s2.0-S0306261921003755-si151.svg?httpAccept=%2A%2F%2A",
            "@multimediatype": "Scalable Vector Graphics file",
            "@type": "ALTIMG",
            "@size": "4567",
            "@ref": "si151",
            "@mimetype": "image/svg+xml"
        },
        {
            "@category": "thumbnail",
            "@_fa": "true",
            "$": "https://api.elsevier.com/content/object/eid/1-s2.0-S0306261921003755-si152.svg?httpAccept=%2A%2F%2A",
            "@multimediatype": "Scalable Vector Graphics file",
            "@type": "ALTIMG",
            "@size": "3664",
            "@ref": "si152",
            "@mimetype": "image/svg+xml"
        },
        {
            "@category": "thumbnail",
            "@_fa": "true",
            "$": "https://api.elsevier.com/content/object/eid/1-s2.0-S0306261921003755-si153.svg?httpAccept=%2A%2F%2A",
            "@multimediatype": "Scalable Vector Graphics file",
            "@type": "ALTIMG",
            "@size": "3381",
            "@ref": "si153",
            "@mimetype": "image/svg+xml"
        },
        {
            "@category": "thumbnail",
            "@_fa": "true",
            "$": "https://api.elsevier.com/content/object/eid/1-s2.0-S0306261921003755-si154.svg?httpAccept=%2A%2F%2A",
            "@multimediatype": "Scalable Vector Graphics file",
            "@type": "ALTIMG",
            "@size": "2307",
            "@ref": "si154",
            "@mimetype": "image/svg+xml"
        },
        {
            "@category": "thumbnail",
            "@_fa": "true",
            "$": "https://api.elsevier.com/content/object/eid/1-s2.0-S0306261921003755-si155.svg?httpAccept=%2A%2F%2A",
            "@multimediatype": "Scalable Vector Graphics file",
            "@type": "ALTIMG",
            "@size": "9793",
            "@ref": "si155",
            "@mimetype": "image/svg+xml"
        },
        {
            "@category": "thumbnail",
            "@_fa": "true",
            "$": "https://api.elsevier.com/content/object/eid/1-s2.0-S0306261921003755-si159.svg?httpAccept=%2A%2F%2A",
            "@multimediatype": "Scalable Vector Graphics file",
            "@type": "ALTIMG",
            "@size": "16125",
            "@ref": "si159",
            "@mimetype": "image/svg+xml"
        },
        {
            "@category": "thumbnail",
            "@_fa": "true",
            "$": "https://api.elsevier.com/content/object/eid/1-s2.0-S0306261921003755-si16.svg?httpAccept=%2A%2F%2A",
            "@multimediatype": "Scalable Vector Graphics file",
            "@type": "ALTIMG",
            "@size": "11627",
            "@ref": "si16",
            "@mimetype": "image/svg+xml"
        },
        {
            "@category": "thumbnail",
            "@_fa": "true",
            "$": "https://api.elsevier.com/content/object/eid/1-s2.0-S0306261921003755-si160.svg?httpAccept=%2A%2F%2A",
            "@multimediatype": "Scalable Vector Graphics file",
            "@type": "ALTIMG",
            "@size": "9113",
            "@ref": "si160",
            "@mimetype": "image/svg+xml"
        },
        {
            "@category": "thumbnail",
            "@_fa": "true",
            "$": "https://api.elsevier.com/content/object/eid/1-s2.0-S0306261921003755-si161.svg?httpAccept=%2A%2F%2A",
            "@multimediatype": "Scalable Vector Graphics file",
            "@type": "ALTIMG",
            "@size": "8127",
            "@ref": "si161",
            "@mimetype": "image/svg+xml"
        },
        {
            "@category": "thumbnail",
            "@_fa": "true",
            "$": "https://api.elsevier.com/content/object/eid/1-s2.0-S0306261921003755-si162.svg?httpAccept=%2A%2F%2A",
            "@multimediatype": "Scalable Vector Graphics file",
            "@type": "ALTIMG",
            "@size": "12994",
            "@ref": "si162",
            "@mimetype": "image/svg+xml"
        },
        {
            "@category": "thumbnail",
            "@_fa": "true",
            "$": "https://api.elsevier.com/content/object/eid/1-s2.0-S0306261921003755-si163.svg?httpAccept=%2A%2F%2A",
            "@multimediatype": "Scalable Vector Graphics file",
            "@type": "ALTIMG",
            "@size": "13392",
            "@ref": "si163",
            "@mimetype": "image/svg+xml"
        },
        {
            "@category": "thumbnail",
            "@_fa": "true",
            "$": "https://api.elsevier.com/content/object/eid/1-s2.0-S0306261921003755-si164.svg?httpAccept=%2A%2F%2A",
            "@multimediatype": "Scalable Vector Graphics file",
            "@type": "ALTIMG",
            "@size": "15915",
            "@ref": "si164",
            "@mimetype": "image/svg+xml"
        },
        {
            "@category": "thumbnail",
            "@_fa": "true",
            "$": "https://api.elsevier.com/content/object/eid/1-s2.0-S0306261921003755-si165.svg?httpAccept=%2A%2F%2A",
            "@multimediatype": "Scalable Vector Graphics file",
            "@type": "ALTIMG",
            "@size": "14939",
            "@ref": "si165",
            "@mimetype": "image/svg+xml"
        },
        {
            "@category": "thumbnail",
            "@_fa": "true",
            "$": "https://api.elsevier.com/content/object/eid/1-s2.0-S0306261921003755-si166.svg?httpAccept=%2A%2F%2A",
            "@multimediatype": "Scalable Vector Graphics file",
            "@type": "ALTIMG",
            "@size": "15503",
            "@ref": "si166",
            "@mimetype": "image/svg+xml"
        },
        {
            "@category": "thumbnail",
            "@_fa": "true",
            "$": "https://api.elsevier.com/content/object/eid/1-s2.0-S0306261921003755-si167.svg?httpAccept=%2A%2F%2A",
            "@multimediatype": "Scalable Vector Graphics file",
            "@type": "ALTIMG",
            "@size": "10882",
            "@ref": "si167",
            "@mimetype": "image/svg+xml"
        },
        {
            "@category": "thumbnail",
            "@_fa": "true",
            "$": "https://api.elsevier.com/content/object/eid/1-s2.0-S0306261921003755-si168.svg?httpAccept=%2A%2F%2A",
            "@multimediatype": "Scalable Vector Graphics file",
            "@type": "ALTIMG",
            "@size": "7818",
            "@ref": "si168",
            "@mimetype": "image/svg+xml"
        },
        {
            "@category": "thumbnail",
            "@_fa": "true",
            "$": "https://api.elsevier.com/content/object/eid/1-s2.0-S0306261921003755-si169.svg?httpAccept=%2A%2F%2A",
            "@multimediatype": "Scalable Vector Graphics file",
            "@type": "ALTIMG",
            "@size": "25199",
            "@ref": "si169",
            "@mimetype": "image/svg+xml"
        },
        {
            "@category": "thumbnail",
            "@_fa": "true",
            "$": "https://api.elsevier.com/content/object/eid/1-s2.0-S0306261921003755-si17.svg?httpAccept=%2A%2F%2A",
            "@multimediatype": "Scalable Vector Graphics file",
            "@type": "ALTIMG",
            "@size": "5747",
            "@ref": "si17",
            "@mimetype": "image/svg+xml"
        },
        {
            "@category": "thumbnail",
            "@_fa": "true",
            "$": "https://api.elsevier.com/content/object/eid/1-s2.0-S0306261921003755-si170.svg?httpAccept=%2A%2F%2A",
            "@multimediatype": "Scalable Vector Graphics file",
            "@type": "ALTIMG",
            "@size": "7109",
            "@ref": "si170",
            "@mimetype": "image/svg+xml"
        },
        {
            "@category": "thumbnail",
            "@_fa": "true",
            "$": "https://api.elsevier.com/content/object/eid/1-s2.0-S0306261921003755-si171.svg?httpAccept=%2A%2F%2A",
            "@multimediatype": "Scalable Vector Graphics file",
            "@type": "ALTIMG",
            "@size": "5539",
            "@ref": "si171",
            "@mimetype": "image/svg+xml"
        },
        {
            "@category": "thumbnail",
            "@_fa": "true",
            "$": "https://api.elsevier.com/content/object/eid/1-s2.0-S0306261921003755-si172.svg?httpAccept=%2A%2F%2A",
            "@multimediatype": "Scalable Vector Graphics file",
            "@type": "ALTIMG",
            "@size": "8409",
            "@ref": "si172",
            "@mimetype": "image/svg+xml"
        },
        {
            "@category": "thumbnail",
            "@_fa": "true",
            "$": "https://api.elsevier.com/content/object/eid/1-s2.0-S0306261921003755-si173.svg?httpAccept=%2A%2F%2A",
            "@multimediatype": "Scalable Vector Graphics file",
            "@type": "ALTIMG",
            "@size": "11089",
            "@ref": "si173",
            "@mimetype": "image/svg+xml"
        },
        {
            "@category": "thumbnail",
            "@_fa": "true",
            "$": "https://api.elsevier.com/content/object/eid/1-s2.0-S0306261921003755-si174.svg?httpAccept=%2A%2F%2A",
            "@multimediatype": "Scalable Vector Graphics file",
            "@type": "ALTIMG",
            "@size": "10080",
            "@ref": "si174",
            "@mimetype": "image/svg+xml"
        },
        {
            "@category": "thumbnail",
            "@_fa": "true",
            "$": "https://api.elsevier.com/content/object/eid/1-s2.0-S0306261921003755-si175.svg?httpAccept=%2A%2F%2A",
            "@multimediatype": "Scalable Vector Graphics file",
            "@type": "ALTIMG",
            "@size": "9943",
            "@ref": "si175",
            "@mimetype": "image/svg+xml"
        },
        {
            "@category": "thumbnail",
            "@_fa": "true",
            "$": "https://api.elsevier.com/content/object/eid/1-s2.0-S0306261921003755-si176.svg?httpAccept=%2A%2F%2A",
            "@multimediatype": "Scalable Vector Graphics file",
            "@type": "ALTIMG",
            "@size": "1211",
            "@ref": "si176",
            "@mimetype": "image/svg+xml"
        },
        {
            "@category": "thumbnail",
            "@_fa": "true",
            "$": "https://api.elsevier.com/content/object/eid/1-s2.0-S0306261921003755-si177.svg?httpAccept=%2A%2F%2A",
            "@multimediatype": "Scalable Vector Graphics file",
            "@type": "ALTIMG",
            "@size": "19715",
            "@ref": "si177",
            "@mimetype": "image/svg+xml"
        },
        {
            "@category": "thumbnail",
            "@_fa": "true",
            "$": "https://api.elsevier.com/content/object/eid/1-s2.0-S0306261921003755-si178.svg?httpAccept=%2A%2F%2A",
            "@multimediatype": "Scalable Vector Graphics file",
            "@type": "ALTIMG",
            "@size": "6652",
            "@ref": "si178",
            "@mimetype": "image/svg+xml"
        },
        {
            "@category": "thumbnail",
            "@_fa": "true",
            "$": "https://api.elsevier.com/content/object/eid/1-s2.0-S0306261921003755-si179.svg?httpAccept=%2A%2F%2A",
            "@multimediatype": "Scalable Vector Graphics file",
            "@type": "ALTIMG",
            "@size": "7965",
            "@ref": "si179",
            "@mimetype": "image/svg+xml"
        },
        {
            "@category": "thumbnail",
            "@_fa": "true",
            "$": "https://api.elsevier.com/content/object/eid/1-s2.0-S0306261921003755-si18.svg?httpAccept=%2A%2F%2A",
            "@multimediatype": "Scalable Vector Graphics file",
            "@type": "ALTIMG",
            "@size": "2828",
            "@ref": "si18",
            "@mimetype": "image/svg+xml"
        },
        {
            "@category": "thumbnail",
            "@_fa": "true",
            "$": "https://api.elsevier.com/content/object/eid/1-s2.0-S0306261921003755-si182.svg?httpAccept=%2A%2F%2A",
            "@multimediatype": "Scalable Vector Graphics file",
            "@type": "ALTIMG",
            "@size": "4487",
            "@ref": "si182",
            "@mimetype": "image/svg+xml"
        },
        {
            "@category": "thumbnail",
            "@_fa": "true",
            "$": "https://api.elsevier.com/content/object/eid/1-s2.0-S0306261921003755-si183.svg?httpAccept=%2A%2F%2A",
            "@multimediatype": "Scalable Vector Graphics file",
            "@type": "ALTIMG",
            "@size": "3261",
            "@ref": "si183",
            "@mimetype": "image/svg+xml"
        },
        {
            "@category": "thumbnail",
            "@_fa": "true",
            "$": "https://api.elsevier.com/content/object/eid/1-s2.0-S0306261921003755-si184.svg?httpAccept=%2A%2F%2A",
            "@multimediatype": "Scalable Vector Graphics file",
            "@type": "ALTIMG",
            "@size": "5705",
            "@ref": "si184",
            "@mimetype": "image/svg+xml"
        },
        {
            "@category": "thumbnail",
            "@_fa": "true",
            "$": "https://api.elsevier.com/content/object/eid/1-s2.0-S0306261921003755-si185.svg?httpAccept=%2A%2F%2A",
            "@multimediatype": "Scalable Vector Graphics file",
            "@type": "ALTIMG",
            "@size": "2998",
            "@ref": "si185",
            "@mimetype": "image/svg+xml"
        },
        {
            "@category": "thumbnail",
            "@_fa": "true",
            "$": "https://api.elsevier.com/content/object/eid/1-s2.0-S0306261921003755-si186.svg?httpAccept=%2A%2F%2A",
            "@multimediatype": "Scalable Vector Graphics file",
            "@type": "ALTIMG",
            "@size": "3021",
            "@ref": "si186",
            "@mimetype": "image/svg+xml"
        },
        {
            "@category": "thumbnail",
            "@_fa": "true",
            "$": "https://api.elsevier.com/content/object/eid/1-s2.0-S0306261921003755-si188.svg?httpAccept=%2A%2F%2A",
            "@multimediatype": "Scalable Vector Graphics file",
            "@type": "ALTIMG",
            "@size": "4581",
            "@ref": "si188",
            "@mimetype": "image/svg+xml"
        },
        {
            "@category": "thumbnail",
            "@_fa": "true",
            "$": "https://api.elsevier.com/content/object/eid/1-s2.0-S0306261921003755-si190.svg?httpAccept=%2A%2F%2A",
            "@multimediatype": "Scalable Vector Graphics file",
            "@type": "ALTIMG",
            "@size": "2466",
            "@ref": "si190",
            "@mimetype": "image/svg+xml"
        },
        {
            "@category": "thumbnail",
            "@_fa": "true",
            "$": "https://api.elsevier.com/content/object/eid/1-s2.0-S0306261921003755-si191.svg?httpAccept=%2A%2F%2A",
            "@multimediatype": "Scalable Vector Graphics file",
            "@type": "ALTIMG",
            "@size": "6107",
            "@ref": "si191",
            "@mimetype": "image/svg+xml"
        },
        {
            "@category": "thumbnail",
            "@_fa": "true",
            "$": "https://api.elsevier.com/content/object/eid/1-s2.0-S0306261921003755-si192.svg?httpAccept=%2A%2F%2A",
            "@multimediatype": "Scalable Vector Graphics file",
            "@type": "ALTIMG",
            "@size": "4944",
            "@ref": "si192",
            "@mimetype": "image/svg+xml"
        },
        {
            "@category": "thumbnail",
            "@_fa": "true",
            "$": "https://api.elsevier.com/content/object/eid/1-s2.0-S0306261921003755-si193.svg?httpAccept=%2A%2F%2A",
            "@multimediatype": "Scalable Vector Graphics file",
            "@type": "ALTIMG",
            "@size": "4409",
            "@ref": "si193",
            "@mimetype": "image/svg+xml"
        },
        {
            "@category": "thumbnail",
            "@_fa": "true",
            "$": "https://api.elsevier.com/content/object/eid/1-s2.0-S0306261921003755-si194.svg?httpAccept=%2A%2F%2A",
            "@multimediatype": "Scalable Vector Graphics file",
            "@type": "ALTIMG",
            "@size": "4572",
            "@ref": "si194",
            "@mimetype": "image/svg+xml"
        },
        {
            "@category": "thumbnail",
            "@_fa": "true",
            "$": "https://api.elsevier.com/content/object/eid/1-s2.0-S0306261921003755-si195.svg?httpAccept=%2A%2F%2A",
            "@multimediatype": "Scalable Vector Graphics file",
            "@type": "ALTIMG",
            "@size": "3691",
            "@ref": "si195",
            "@mimetype": "image/svg+xml"
        },
        {
            "@category": "thumbnail",
            "@_fa": "true",
            "$": "https://api.elsevier.com/content/object/eid/1-s2.0-S0306261921003755-si196.svg?httpAccept=%2A%2F%2A",
            "@multimediatype": "Scalable Vector Graphics file",
            "@type": "ALTIMG",
            "@size": "3346",
            "@ref": "si196",
            "@mimetype": "image/svg+xml"
        },
        {
            "@category": "thumbnail",
            "@_fa": "true",
            "$": "https://api.elsevier.com/content/object/eid/1-s2.0-S0306261921003755-si197.svg?httpAccept=%2A%2F%2A",
            "@multimediatype": "Scalable Vector Graphics file",
            "@type": "ALTIMG",
            "@size": "2589",
            "@ref": "si197",
            "@mimetype": "image/svg+xml"
        },
        {
            "@category": "thumbnail",
            "@_fa": "true",
            "$": "https://api.elsevier.com/content/object/eid/1-s2.0-S0306261921003755-si198.svg?httpAccept=%2A%2F%2A",
            "@multimediatype": "Scalable Vector Graphics file",
            "@type": "ALTIMG",
            "@size": "16912",
            "@ref": "si198",
            "@mimetype": "image/svg+xml"
        },
        {
            "@category": "thumbnail",
            "@_fa": "true",
            "$": "https://api.elsevier.com/content/object/eid/1-s2.0-S0306261921003755-si199.svg?httpAccept=%2A%2F%2A",
            "@multimediatype": "Scalable Vector Graphics file",
            "@type": "ALTIMG",
            "@size": "7950",
            "@ref": "si199",
            "@mimetype": "image/svg+xml"
        },
        {
            "@category": "thumbnail",
            "@_fa": "true",
            "$": "https://api.elsevier.com/content/object/eid/1-s2.0-S0306261921003755-si2.svg?httpAccept=%2A%2F%2A",
            "@multimediatype": "Scalable Vector Graphics file",
            "@type": "ALTIMG",
            "@size": "14653",
            "@ref": "si2",
            "@mimetype": "image/svg+xml"
        },
        {
            "@category": "thumbnail",
            "@_fa": "true",
            "$": "https://api.elsevier.com/content/object/eid/1-s2.0-S0306261921003755-si200.svg?httpAccept=%2A%2F%2A",
            "@multimediatype": "Scalable Vector Graphics file",
            "@type": "ALTIMG",
            "@size": "16125",
            "@ref": "si200",
            "@mimetype": "image/svg+xml"
        },
        {
            "@category": "thumbnail",
            "@_fa": "true",
            "$": "https://api.elsevier.com/content/object/eid/1-s2.0-S0306261921003755-si201.svg?httpAccept=%2A%2F%2A",
            "@multimediatype": "Scalable Vector Graphics file",
            "@type": "ALTIMG",
            "@size": "9113",
            "@ref": "si201",
            "@mimetype": "image/svg+xml"
        },
        {
            "@category": "thumbnail",
            "@_fa": "true",
            "$": "https://api.elsevier.com/content/object/eid/1-s2.0-S0306261921003755-si202.svg?httpAccept=%2A%2F%2A",
            "@multimediatype": "Scalable Vector Graphics file",
            "@type": "ALTIMG",
            "@size": "2490",
            "@ref": "si202",
            "@mimetype": "image/svg+xml"
        },
        {
            "@category": "thumbnail",
            "@_fa": "true",
            "$": "https://api.elsevier.com/content/object/eid/1-s2.0-S0306261921003755-si203.svg?httpAccept=%2A%2F%2A",
            "@multimediatype": "Scalable Vector Graphics file",
            "@type": "ALTIMG",
            "@size": "5148",
            "@ref": "si203",
            "@mimetype": "image/svg+xml"
        },
        {
            "@category": "thumbnail",
            "@_fa": "true",
            "$": "https://api.elsevier.com/content/object/eid/1-s2.0-S0306261921003755-si204.svg?httpAccept=%2A%2F%2A",
            "@multimediatype": "Scalable Vector Graphics file",
            "@type": "ALTIMG",
            "@size": "17594",
            "@ref": "si204",
            "@mimetype": "image/svg+xml"
        },
        {
            "@category": "thumbnail",
            "@_fa": "true",
            "$": "https://api.elsevier.com/content/object/eid/1-s2.0-S0306261921003755-si205.svg?httpAccept=%2A%2F%2A",
            "@multimediatype": "Scalable Vector Graphics file",
            "@type": "ALTIMG",
            "@size": "14888",
            "@ref": "si205",
            "@mimetype": "image/svg+xml"
        },
        {
            "@category": "thumbnail",
            "@_fa": "true",
            "$": "https://api.elsevier.com/content/object/eid/1-s2.0-S0306261921003755-si206.svg?httpAccept=%2A%2F%2A",
            "@multimediatype": "Scalable Vector Graphics file",
            "@type": "ALTIMG",
            "@size": "15453",
            "@ref": "si206",
            "@mimetype": "image/svg+xml"
        },
        {
            "@category": "thumbnail",
            "@_fa": "true",
            "$": "https://api.elsevier.com/content/object/eid/1-s2.0-S0306261921003755-si207.svg?httpAccept=%2A%2F%2A",
            "@multimediatype": "Scalable Vector Graphics file",
            "@type": "ALTIMG",
            "@size": "14677",
            "@ref": "si207",
            "@mimetype": "image/svg+xml"
        },
        {
            "@category": "thumbnail",
            "@_fa": "true",
            "$": "https://api.elsevier.com/content/object/eid/1-s2.0-S0306261921003755-si208.svg?httpAccept=%2A%2F%2A",
            "@multimediatype": "Scalable Vector Graphics file",
            "@type": "ALTIMG",
            "@size": "10178",
            "@ref": "si208",
            "@mimetype": "image/svg+xml"
        },
        {
            "@category": "thumbnail",
            "@_fa": "true",
            "$": "https://api.elsevier.com/content/object/eid/1-s2.0-S0306261921003755-si210.svg?httpAccept=%2A%2F%2A",
            "@multimediatype": "Scalable Vector Graphics file",
            "@type": "ALTIMG",
            "@size": "9869",
            "@ref": "si210",
            "@mimetype": "image/svg+xml"
        },
        {
            "@category": "thumbnail",
            "@_fa": "true",
            "$": "https://api.elsevier.com/content/object/eid/1-s2.0-S0306261921003755-si212.svg?httpAccept=%2A%2F%2A",
            "@multimediatype": "Scalable Vector Graphics file",
            "@type": "ALTIMG",
            "@size": "3505",
            "@ref": "si212",
            "@mimetype": "image/svg+xml"
        },
        {
            "@category": "thumbnail",
            "@_fa": "true",
            "$": "https://api.elsevier.com/content/object/eid/1-s2.0-S0306261921003755-si214.svg?httpAccept=%2A%2F%2A",
            "@multimediatype": "Scalable Vector Graphics file",
            "@type": "ALTIMG",
            "@size": "5085",
            "@ref": "si214",
            "@mimetype": "image/svg+xml"
        },
        {
            "@category": "thumbnail",
            "@_fa": "true",
            "$": "https://api.elsevier.com/content/object/eid/1-s2.0-S0306261921003755-si215.svg?httpAccept=%2A%2F%2A",
            "@multimediatype": "Scalable Vector Graphics file",
            "@type": "ALTIMG",
            "@size": "8217",
            "@ref": "si215",
            "@mimetype": "image/svg+xml"
        },
        {
            "@category": "thumbnail",
            "@_fa": "true",
            "$": "https://api.elsevier.com/content/object/eid/1-s2.0-S0306261921003755-si216.svg?httpAccept=%2A%2F%2A",
            "@multimediatype": "Scalable Vector Graphics file",
            "@type": "ALTIMG",
            "@size": "4623",
            "@ref": "si216",
            "@mimetype": "image/svg+xml"
        },
        {
            "@category": "thumbnail",
            "@_fa": "true",
            "$": "https://api.elsevier.com/content/object/eid/1-s2.0-S0306261921003755-si218.svg?httpAccept=%2A%2F%2A",
            "@multimediatype": "Scalable Vector Graphics file",
            "@type": "ALTIMG",
            "@size": "11121",
            "@ref": "si218",
            "@mimetype": "image/svg+xml"
        },
        {
            "@category": "thumbnail",
            "@_fa": "true",
            "$": "https://api.elsevier.com/content/object/eid/1-s2.0-S0306261921003755-si219.svg?httpAccept=%2A%2F%2A",
            "@multimediatype": "Scalable Vector Graphics file",
            "@type": "ALTIMG",
            "@size": "3620",
            "@ref": "si219",
            "@mimetype": "image/svg+xml"
        },
        {
            "@category": "thumbnail",
            "@_fa": "true",
            "$": "https://api.elsevier.com/content/object/eid/1-s2.0-S0306261921003755-si22.svg?httpAccept=%2A%2F%2A",
            "@multimediatype": "Scalable Vector Graphics file",
            "@type": "ALTIMG",
            "@size": "16203",
            "@ref": "si22",
            "@mimetype": "image/svg+xml"
        },
        {
            "@category": "thumbnail",
            "@_fa": "true",
            "$": "https://api.elsevier.com/content/object/eid/1-s2.0-S0306261921003755-si220.svg?httpAccept=%2A%2F%2A",
            "@multimediatype": "Scalable Vector Graphics file",
            "@type": "ALTIMG",
            "@size": "4558",
            "@ref": "si220",
            "@mimetype": "image/svg+xml"
        },
        {
            "@category": "thumbnail",
            "@_fa": "true",
            "$": "https://api.elsevier.com/content/object/eid/1-s2.0-S0306261921003755-si221.svg?httpAccept=%2A%2F%2A",
            "@multimediatype": "Scalable Vector Graphics file",
            "@type": "ALTIMG",
            "@size": "3228",
            "@ref": "si221",
            "@mimetype": "image/svg+xml"
        },
        {
            "@category": "thumbnail",
            "@_fa": "true",
            "$": "https://api.elsevier.com/content/object/eid/1-s2.0-S0306261921003755-si223.svg?httpAccept=%2A%2F%2A",
            "@multimediatype": "Scalable Vector Graphics file",
            "@type": "ALTIMG",
            "@size": "6349",
            "@ref": "si223",
            "@mimetype": "image/svg+xml"
        },
        {
            "@category": "thumbnail",
            "@_fa": "true",
            "$": "https://api.elsevier.com/content/object/eid/1-s2.0-S0306261921003755-si224.svg?httpAccept=%2A%2F%2A",
            "@multimediatype": "Scalable Vector Graphics file",
            "@type": "ALTIMG",
            "@size": "8875",
            "@ref": "si224",
            "@mimetype": "image/svg+xml"
        },
        {
            "@category": "thumbnail",
            "@_fa": "true",
            "$": "https://api.elsevier.com/content/object/eid/1-s2.0-S0306261921003755-si225.svg?httpAccept=%2A%2F%2A",
            "@multimediatype": "Scalable Vector Graphics file",
            "@type": "ALTIMG",
            "@size": "8851",
            "@ref": "si225",
            "@mimetype": "image/svg+xml"
        },
        {
            "@category": "thumbnail",
            "@_fa": "true",
            "$": "https://api.elsevier.com/content/object/eid/1-s2.0-S0306261921003755-si228.svg?httpAccept=%2A%2F%2A",
            "@multimediatype": "Scalable Vector Graphics file",
            "@type": "ALTIMG",
            "@size": "2701",
            "@ref": "si228",
            "@mimetype": "image/svg+xml"
        },
        {
            "@category": "thumbnail",
            "@_fa": "true",
            "$": "https://api.elsevier.com/content/object/eid/1-s2.0-S0306261921003755-si229.svg?httpAccept=%2A%2F%2A",
            "@multimediatype": "Scalable Vector Graphics file",
            "@type": "ALTIMG",
            "@size": "1442",
            "@ref": "si229",
            "@mimetype": "image/svg+xml"
        },
        {
            "@category": "thumbnail",
            "@_fa": "true",
            "$": "https://api.elsevier.com/content/object/eid/1-s2.0-S0306261921003755-si23.svg?httpAccept=%2A%2F%2A",
            "@multimediatype": "Scalable Vector Graphics file",
            "@type": "ALTIMG",
            "@size": "12248",
            "@ref": "si23",
            "@mimetype": "image/svg+xml"
        },
        {
            "@category": "thumbnail",
            "@_fa": "true",
            "$": "https://api.elsevier.com/content/object/eid/1-s2.0-S0306261921003755-si230.svg?httpAccept=%2A%2F%2A",
            "@multimediatype": "Scalable Vector Graphics file",
            "@type": "ALTIMG",
            "@size": "2291",
            "@ref": "si230",
            "@mimetype": "image/svg+xml"
        },
        {
            "@category": "thumbnail",
            "@_fa": "true",
            "$": "https://api.elsevier.com/content/object/eid/1-s2.0-S0306261921003755-si231.svg?httpAccept=%2A%2F%2A",
            "@multimediatype": "Scalable Vector Graphics file",
            "@type": "ALTIMG",
            "@size": "4184",
            "@ref": "si231",
            "@mimetype": "image/svg+xml"
        },
        {
            "@category": "thumbnail",
            "@_fa": "true",
            "$": "https://api.elsevier.com/content/object/eid/1-s2.0-S0306261921003755-si232.svg?httpAccept=%2A%2F%2A",
            "@multimediatype": "Scalable Vector Graphics file",
            "@type": "ALTIMG",
            "@size": "2465",
            "@ref": "si232",
            "@mimetype": "image/svg+xml"
        },
        {
            "@category": "thumbnail",
            "@_fa": "true",
            "$": "https://api.elsevier.com/content/object/eid/1-s2.0-S0306261921003755-si233.svg?httpAccept=%2A%2F%2A",
            "@multimediatype": "Scalable Vector Graphics file",
            "@type": "ALTIMG",
            "@size": "4210",
            "@ref": "si233",
            "@mimetype": "image/svg+xml"
        },
        {
            "@category": "thumbnail",
            "@_fa": "true",
            "$": "https://api.elsevier.com/content/object/eid/1-s2.0-S0306261921003755-si234.svg?httpAccept=%2A%2F%2A",
            "@multimediatype": "Scalable Vector Graphics file",
            "@type": "ALTIMG",
            "@size": "2685",
            "@ref": "si234",
            "@mimetype": "image/svg+xml"
        },
        {
            "@category": "thumbnail",
            "@_fa": "true",
            "$": "https://api.elsevier.com/content/object/eid/1-s2.0-S0306261921003755-si235.svg?httpAccept=%2A%2F%2A",
            "@multimediatype": "Scalable Vector Graphics file",
            "@type": "ALTIMG",
            "@size": "4933",
            "@ref": "si235",
            "@mimetype": "image/svg+xml"
        },
        {
            "@category": "thumbnail",
            "@_fa": "true",
            "$": "https://api.elsevier.com/content/object/eid/1-s2.0-S0306261921003755-si236.svg?httpAccept=%2A%2F%2A",
            "@multimediatype": "Scalable Vector Graphics file",
            "@type": "ALTIMG",
            "@size": "2006",
            "@ref": "si236",
            "@mimetype": "image/svg+xml"
        },
        {
            "@category": "thumbnail",
            "@_fa": "true",
            "$": "https://api.elsevier.com/content/object/eid/1-s2.0-S0306261921003755-si237.svg?httpAccept=%2A%2F%2A",
            "@multimediatype": "Scalable Vector Graphics file",
            "@type": "ALTIMG",
            "@size": "5320",
            "@ref": "si237",
            "@mimetype": "image/svg+xml"
        },
        {
            "@category": "thumbnail",
            "@_fa": "true",
            "$": "https://api.elsevier.com/content/object/eid/1-s2.0-S0306261921003755-si24.svg?httpAccept=%2A%2F%2A",
            "@multimediatype": "Scalable Vector Graphics file",
            "@type": "ALTIMG",
            "@size": "2084",
            "@ref": "si24",
            "@mimetype": "image/svg+xml"
        },
        {
            "@category": "thumbnail",
            "@_fa": "true",
            "$": "https://api.elsevier.com/content/object/eid/1-s2.0-S0306261921003755-si240.svg?httpAccept=%2A%2F%2A",
            "@multimediatype": "Scalable Vector Graphics file",
            "@type": "ALTIMG",
            "@size": "4646",
            "@ref": "si240",
            "@mimetype": "image/svg+xml"
        },
        {
            "@category": "thumbnail",
            "@_fa": "true",
            "$": "https://api.elsevier.com/content/object/eid/1-s2.0-S0306261921003755-si242.svg?httpAccept=%2A%2F%2A",
            "@multimediatype": "Scalable Vector Graphics file",
            "@type": "ALTIMG",
            "@size": "5511",
            "@ref": "si242",
            "@mimetype": "image/svg+xml"
        },
        {
            "@category": "thumbnail",
            "@_fa": "true",
            "$": "https://api.elsevier.com/content/object/eid/1-s2.0-S0306261921003755-si244.svg?httpAccept=%2A%2F%2A",
            "@multimediatype": "Scalable Vector Graphics file",
            "@type": "ALTIMG",
            "@size": "5196",
            "@ref": "si244",
            "@mimetype": "image/svg+xml"
        },
        {
            "@category": "thumbnail",
            "@_fa": "true",
            "$": "https://api.elsevier.com/content/object/eid/1-s2.0-S0306261921003755-si245.svg?httpAccept=%2A%2F%2A",
            "@multimediatype": "Scalable Vector Graphics file",
            "@type": "ALTIMG",
            "@size": "8532",
            "@ref": "si245",
            "@mimetype": "image/svg+xml"
        },
        {
            "@category": "thumbnail",
            "@_fa": "true",
            "$": "https://api.elsevier.com/content/object/eid/1-s2.0-S0306261921003755-si246.svg?httpAccept=%2A%2F%2A",
            "@multimediatype": "Scalable Vector Graphics file",
            "@type": "ALTIMG",
            "@size": "8911",
            "@ref": "si246",
            "@mimetype": "image/svg+xml"
        },
        {
            "@category": "thumbnail",
            "@_fa": "true",
            "$": "https://api.elsevier.com/content/object/eid/1-s2.0-S0306261921003755-si247.svg?httpAccept=%2A%2F%2A",
            "@multimediatype": "Scalable Vector Graphics file",
            "@type": "ALTIMG",
            "@size": "1086",
            "@ref": "si247",
            "@mimetype": "image/svg+xml"
        },
        {
            "@category": "thumbnail",
            "@_fa": "true",
            "$": "https://api.elsevier.com/content/object/eid/1-s2.0-S0306261921003755-si248.svg?httpAccept=%2A%2F%2A",
            "@multimediatype": "Scalable Vector Graphics file",
            "@type": "ALTIMG",
            "@size": "3993",
            "@ref": "si248",
            "@mimetype": "image/svg+xml"
        },
        {
            "@category": "thumbnail",
            "@_fa": "true",
            "$": "https://api.elsevier.com/content/object/eid/1-s2.0-S0306261921003755-si25.svg?httpAccept=%2A%2F%2A",
            "@multimediatype": "Scalable Vector Graphics file",
            "@type": "ALTIMG",
            "@size": "2363",
            "@ref": "si25",
            "@mimetype": "image/svg+xml"
        },
        {
            "@category": "thumbnail",
            "@_fa": "true",
            "$": "https://api.elsevier.com/content/object/eid/1-s2.0-S0306261921003755-si26.svg?httpAccept=%2A%2F%2A",
            "@multimediatype": "Scalable Vector Graphics file",
            "@type": "ALTIMG",
            "@size": "2306",
            "@ref": "si26",
            "@mimetype": "image/svg+xml"
        },
        {
            "@category": "thumbnail",
            "@_fa": "true",
            "$": "https://api.elsevier.com/content/object/eid/1-s2.0-S0306261921003755-si27.svg?httpAccept=%2A%2F%2A",
            "@multimediatype": "Scalable Vector Graphics file",
            "@type": "ALTIMG",
            "@size": "2334",
            "@ref": "si27",
            "@mimetype": "image/svg+xml"
        },
        {
            "@category": "thumbnail",
            "@_fa": "true",
            "$": "https://api.elsevier.com/content/object/eid/1-s2.0-S0306261921003755-si28.svg?httpAccept=%2A%2F%2A",
            "@multimediatype": "Scalable Vector Graphics file",
            "@type": "ALTIMG",
            "@size": "1991",
            "@ref": "si28",
            "@mimetype": "image/svg+xml"
        },
        {
            "@category": "thumbnail",
            "@_fa": "true",
            "$": "https://api.elsevier.com/content/object/eid/1-s2.0-S0306261921003755-si29.svg?httpAccept=%2A%2F%2A",
            "@multimediatype": "Scalable Vector Graphics file",
            "@type": "ALTIMG",
            "@size": "2437",
            "@ref": "si29",
            "@mimetype": "image/svg+xml"
        },
        {
            "@category": "thumbnail",
            "@_fa": "true",
            "$": "https://api.elsevier.com/content/object/eid/1-s2.0-S0306261921003755-si3.svg?httpAccept=%2A%2F%2A",
            "@multimediatype": "Scalable Vector Graphics file",
            "@type": "ALTIMG",
            "@size": "11637",
            "@ref": "si3",
            "@mimetype": "image/svg+xml"
        },
        {
            "@category": "thumbnail",
            "@_fa": "true",
            "$": "https://api.elsevier.com/content/object/eid/1-s2.0-S0306261921003755-si30.svg?httpAccept=%2A%2F%2A",
            "@multimediatype": "Scalable Vector Graphics file",
            "@type": "ALTIMG",
            "@size": "2621",
            "@ref": "si30",
            "@mimetype": "image/svg+xml"
        },
        {
            "@category": "thumbnail",
            "@_fa": "true",
            "$": "https://api.elsevier.com/content/object/eid/1-s2.0-S0306261921003755-si31.svg?httpAccept=%2A%2F%2A",
            "@multimediatype": "Scalable Vector Graphics file",
            "@type": "ALTIMG",
            "@size": "12137",
            "@ref": "si31",
            "@mimetype": "image/svg+xml"
        },
        {
            "@category": "thumbnail",
            "@_fa": "true",
            "$": "https://api.elsevier.com/content/object/eid/1-s2.0-S0306261921003755-si32.svg?httpAccept=%2A%2F%2A",
            "@multimediatype": "Scalable Vector Graphics file",
            "@type": "ALTIMG",
            "@size": "8767",
            "@ref": "si32",
            "@mimetype": "image/svg+xml"
        },
        {
            "@category": "thumbnail",
            "@_fa": "true",
            "$": "https://api.elsevier.com/content/object/eid/1-s2.0-S0306261921003755-si33.svg?httpAccept=%2A%2F%2A",
            "@multimediatype": "Scalable Vector Graphics file",
            "@type": "ALTIMG",
            "@size": "5624",
            "@ref": "si33",
            "@mimetype": "image/svg+xml"
        },
        {
            "@category": "thumbnail",
            "@_fa": "true",
            "$": "https://api.elsevier.com/content/object/eid/1-s2.0-S0306261921003755-si34.svg?httpAccept=%2A%2F%2A",
            "@multimediatype": "Scalable Vector Graphics file",
            "@type": "ALTIMG",
            "@size": "3838",
            "@ref": "si34",
            "@mimetype": "image/svg+xml"
        },
        {
            "@category": "thumbnail",
            "@_fa": "true",
            "$": "https://api.elsevier.com/content/object/eid/1-s2.0-S0306261921003755-si35.svg?httpAccept=%2A%2F%2A",
            "@multimediatype": "Scalable Vector Graphics file",
            "@type": "ALTIMG",
            "@size": "8035",
            "@ref": "si35",
            "@mimetype": "image/svg+xml"
        },
        {
            "@category": "thumbnail",
            "@_fa": "true",
            "$": "https://api.elsevier.com/content/object/eid/1-s2.0-S0306261921003755-si36.svg?httpAccept=%2A%2F%2A",
            "@multimediatype": "Scalable Vector Graphics file",
            "@type": "ALTIMG",
            "@size": "8569",
            "@ref": "si36",
            "@mimetype": "image/svg+xml"
        },
        {
            "@category": "thumbnail",
            "@_fa": "true",
            "$": "https://api.elsevier.com/content/object/eid/1-s2.0-S0306261921003755-si37.svg?httpAccept=%2A%2F%2A",
            "@multimediatype": "Scalable Vector Graphics file",
            "@type": "ALTIMG",
            "@size": "8959",
            "@ref": "si37",
            "@mimetype": "image/svg+xml"
        },
        {
            "@category": "thumbnail",
            "@_fa": "true",
            "$": "https://api.elsevier.com/content/object/eid/1-s2.0-S0306261921003755-si38.svg?httpAccept=%2A%2F%2A",
            "@multimediatype": "Scalable Vector Graphics file",
            "@type": "ALTIMG",
            "@size": "12490",
            "@ref": "si38",
            "@mimetype": "image/svg+xml"
        },
        {
            "@category": "thumbnail",
            "@_fa": "true",
            "$": "https://api.elsevier.com/content/object/eid/1-s2.0-S0306261921003755-si39.svg?httpAccept=%2A%2F%2A",
            "@multimediatype": "Scalable Vector Graphics file",
            "@type": "ALTIMG",
            "@size": "13122",
            "@ref": "si39",
            "@mimetype": "image/svg+xml"
        },
        {
            "@category": "thumbnail",
            "@_fa": "true",
            "$": "https://api.elsevier.com/content/object/eid/1-s2.0-S0306261921003755-si4.svg?httpAccept=%2A%2F%2A",
            "@multimediatype": "Scalable Vector Graphics file",
            "@type": "ALTIMG",
            "@size": "11927",
            "@ref": "si4",
            "@mimetype": "image/svg+xml"
        },
        {
            "@category": "thumbnail",
            "@_fa": "true",
            "$": "https://api.elsevier.com/content/object/eid/1-s2.0-S0306261921003755-si40.svg?httpAccept=%2A%2F%2A",
            "@multimediatype": "Scalable Vector Graphics file",
            "@type": "ALTIMG",
            "@size": "3553",
            "@ref": "si40",
            "@mimetype": "image/svg+xml"
        },
        {
            "@category": "thumbnail",
            "@_fa": "true",
            "$": "https://api.elsevier.com/content/object/eid/1-s2.0-S0306261921003755-si41.svg?httpAccept=%2A%2F%2A",
            "@multimediatype": "Scalable Vector Graphics file",
            "@type": "ALTIMG",
            "@size": "3175",
            "@ref": "si41",
            "@mimetype": "image/svg+xml"
        },
        {
            "@category": "thumbnail",
            "@_fa": "true",
            "$": "https://api.elsevier.com/content/object/eid/1-s2.0-S0306261921003755-si43.svg?httpAccept=%2A%2F%2A",
            "@multimediatype": "Scalable Vector Graphics file",
            "@type": "ALTIMG",
            "@size": "7982",
            "@ref": "si43",
            "@mimetype": "image/svg+xml"
        },
        {
            "@category": "thumbnail",
            "@_fa": "true",
            "$": "https://api.elsevier.com/content/object/eid/1-s2.0-S0306261921003755-si44.svg?httpAccept=%2A%2F%2A",
            "@multimediatype": "Scalable Vector Graphics file",
            "@type": "ALTIMG",
            "@size": "1297",
            "@ref": "si44",
            "@mimetype": "image/svg+xml"
        },
        {
            "@category": "thumbnail",
            "@_fa": "true",
            "$": "https://api.elsevier.com/content/object/eid/1-s2.0-S0306261921003755-si46.svg?httpAccept=%2A%2F%2A",
            "@multimediatype": "Scalable Vector Graphics file",
            "@type": "ALTIMG",
            "@size": "10104",
            "@ref": "si46",
            "@mimetype": "image/svg+xml"
        },
        {
            "@category": "thumbnail",
            "@_fa": "true",
            "$": "https://api.elsevier.com/content/object/eid/1-s2.0-S0306261921003755-si47.svg?httpAccept=%2A%2F%2A",
            "@multimediatype": "Scalable Vector Graphics file",
            "@type": "ALTIMG",
            "@size": "4148",
            "@ref": "si47",
            "@mimetype": "image/svg+xml"
        },
        {
            "@category": "thumbnail",
            "@_fa": "true",
            "$": "https://api.elsevier.com/content/object/eid/1-s2.0-S0306261921003755-si48.svg?httpAccept=%2A%2F%2A",
            "@multimediatype": "Scalable Vector Graphics file",
            "@type": "ALTIMG",
            "@size": "3065",
            "@ref": "si48",
            "@mimetype": "image/svg+xml"
        },
        {
            "@category": "thumbnail",
            "@_fa": "true",
            "$": "https://api.elsevier.com/content/object/eid/1-s2.0-S0306261921003755-si49.svg?httpAccept=%2A%2F%2A",
            "@multimediatype": "Scalable Vector Graphics file",
            "@type": "ALTIMG",
            "@size": "1296",
            "@ref": "si49",
            "@mimetype": "image/svg+xml"
        },
        {
            "@category": "thumbnail",
            "@_fa": "true",
            "$": "https://api.elsevier.com/content/object/eid/1-s2.0-S0306261921003755-si5.svg?httpAccept=%2A%2F%2A",
            "@multimediatype": "Scalable Vector Graphics file",
            "@type": "ALTIMG",
            "@size": "1691",
            "@ref": "si5",
            "@mimetype": "image/svg+xml"
        },
        {
            "@category": "thumbnail",
            "@_fa": "true",
            "$": "https://api.elsevier.com/content/object/eid/1-s2.0-S0306261921003755-si50.svg?httpAccept=%2A%2F%2A",
            "@multimediatype": "Scalable Vector Graphics file",
            "@type": "ALTIMG",
            "@size": "2044",
            "@ref": "si50",
            "@mimetype": "image/svg+xml"
        },
        {
            "@category": "thumbnail",
            "@_fa": "true",
            "$": "https://api.elsevier.com/content/object/eid/1-s2.0-S0306261921003755-si51.svg?httpAccept=%2A%2F%2A",
            "@multimediatype": "Scalable Vector Graphics file",
            "@type": "ALTIMG",
            "@size": "1054",
            "@ref": "si51",
            "@mimetype": "image/svg+xml"
        },
        {
            "@category": "thumbnail",
            "@_fa": "true",
            "$": "https://api.elsevier.com/content/object/eid/1-s2.0-S0306261921003755-si52.svg?httpAccept=%2A%2F%2A",
            "@multimediatype": "Scalable Vector Graphics file",
            "@type": "ALTIMG",
            "@size": "2135",
            "@ref": "si52",
            "@mimetype": "image/svg+xml"
        },
        {
            "@category": "thumbnail",
            "@_fa": "true",
            "$": "https://api.elsevier.com/content/object/eid/1-s2.0-S0306261921003755-si54.svg?httpAccept=%2A%2F%2A",
            "@multimediatype": "Scalable Vector Graphics file",
            "@type": "ALTIMG",
            "@size": "2865",
            "@ref": "si54",
            "@mimetype": "image/svg+xml"
        },
        {
            "@category": "thumbnail",
            "@_fa": "true",
            "$": "https://api.elsevier.com/content/object/eid/1-s2.0-S0306261921003755-si56.svg?httpAccept=%2A%2F%2A",
            "@multimediatype": "Scalable Vector Graphics file",
            "@type": "ALTIMG",
            "@size": "2360",
            "@ref": "si56",
            "@mimetype": "image/svg+xml"
        },
        {
            "@category": "thumbnail",
            "@_fa": "true",
            "$": "https://api.elsevier.com/content/object/eid/1-s2.0-S0306261921003755-si57.svg?httpAccept=%2A%2F%2A",
            "@multimediatype": "Scalable Vector Graphics file",
            "@type": "ALTIMG",
            "@size": "993",
            "@ref": "si57",
            "@mimetype": "image/svg+xml"
        },
        {
            "@category": "thumbnail",
            "@_fa": "true",
            "$": "https://api.elsevier.com/content/object/eid/1-s2.0-S0306261921003755-si58.svg?httpAccept=%2A%2F%2A",
            "@multimediatype": "Scalable Vector Graphics file",
            "@type": "ALTIMG",
            "@size": "39432",
            "@ref": "si58",
            "@mimetype": "image/svg+xml"
        },
        {
            "@category": "thumbnail",
            "@_fa": "true",
            "$": "https://api.elsevier.com/content/object/eid/1-s2.0-S0306261921003755-si59.svg?httpAccept=%2A%2F%2A",
            "@multimediatype": "Scalable Vector Graphics file",
            "@type": "ALTIMG",
            "@size": "16500",
            "@ref": "si59",
            "@mimetype": "image/svg+xml"
        },
        {
            "@category": "thumbnail",
            "@_fa": "true",
            "$": "https://api.elsevier.com/content/object/eid/1-s2.0-S0306261921003755-si6.svg?httpAccept=%2A%2F%2A",
            "@multimediatype": "Scalable Vector Graphics file",
            "@type": "ALTIMG",
            "@size": "1442",
            "@ref": "si6",
            "@mimetype": "image/svg+xml"
        },
        {
            "@category": "thumbnail",
            "@_fa": "true",
            "$": "https://api.elsevier.com/content/object/eid/1-s2.0-S0306261921003755-si60.svg?httpAccept=%2A%2F%2A",
            "@multimediatype": "Scalable Vector Graphics file",
            "@type": "ALTIMG",
            "@size": "8334",
            "@ref": "si60",
            "@mimetype": "image/svg+xml"
        },
        {
            "@category": "thumbnail",
            "@_fa": "true",
            "$": "https://api.elsevier.com/content/object/eid/1-s2.0-S0306261921003755-si62.svg?httpAccept=%2A%2F%2A",
            "@multimediatype": "Scalable Vector Graphics file",
            "@type": "ALTIMG",
            "@size": "4313",
            "@ref": "si62",
            "@mimetype": "image/svg+xml"
        },
        {
            "@category": "thumbnail",
            "@_fa": "true",
            "$": "https://api.elsevier.com/content/object/eid/1-s2.0-S0306261921003755-si63.svg?httpAccept=%2A%2F%2A",
            "@multimediatype": "Scalable Vector Graphics file",
            "@type": "ALTIMG",
            "@size": "2453",
            "@ref": "si63",
            "@mimetype": "image/svg+xml"
        },
        {
            "@category": "thumbnail",
            "@_fa": "true",
            "$": "https://api.elsevier.com/content/object/eid/1-s2.0-S0306261921003755-si64.svg?httpAccept=%2A%2F%2A",
            "@multimediatype": "Scalable Vector Graphics file",
            "@type": "ALTIMG",
            "@size": "5134",
            "@ref": "si64",
            "@mimetype": "image/svg+xml"
        },
        {
            "@category": "thumbnail",
            "@_fa": "true",
            "$": "https://api.elsevier.com/content/object/eid/1-s2.0-S0306261921003755-si65.svg?httpAccept=%2A%2F%2A",
            "@multimediatype": "Scalable Vector Graphics file",
            "@type": "ALTIMG",
            "@size": "3148",
            "@ref": "si65",
            "@mimetype": "image/svg+xml"
        },
        {
            "@category": "thumbnail",
            "@_fa": "true",
            "$": "https://api.elsevier.com/content/object/eid/1-s2.0-S0306261921003755-si67.svg?httpAccept=%2A%2F%2A",
            "@multimediatype": "Scalable Vector Graphics file",
            "@type": "ALTIMG",
            "@size": "7822",
            "@ref": "si67",
            "@mimetype": "image/svg+xml"
        },
        {
            "@category": "thumbnail",
            "@_fa": "true",
            "$": "https://api.elsevier.com/content/object/eid/1-s2.0-S0306261921003755-si68.svg?httpAccept=%2A%2F%2A",
            "@multimediatype": "Scalable Vector Graphics file",
            "@type": "ALTIMG",
            "@size": "6501",
            "@ref": "si68",
            "@mimetype": "image/svg+xml"
        },
        {
            "@category": "thumbnail",
            "@_fa": "true",
            "$": "https://api.elsevier.com/content/object/eid/1-s2.0-S0306261921003755-si69.svg?httpAccept=%2A%2F%2A",
            "@multimediatype": "Scalable Vector Graphics file",
            "@type": "ALTIMG",
            "@size": "13119",
            "@ref": "si69",
            "@mimetype": "image/svg+xml"
        },
        {
            "@category": "thumbnail",
            "@_fa": "true",
            "$": "https://api.elsevier.com/content/object/eid/1-s2.0-S0306261921003755-si7.svg?httpAccept=%2A%2F%2A",
            "@multimediatype": "Scalable Vector Graphics file",
            "@type": "ALTIMG",
            "@size": "1603",
            "@ref": "si7",
            "@mimetype": "image/svg+xml"
        },
        {
            "@category": "thumbnail",
            "@_fa": "true",
            "$": "https://api.elsevier.com/content/object/eid/1-s2.0-S0306261921003755-si70.svg?httpAccept=%2A%2F%2A",
            "@multimediatype": "Scalable Vector Graphics file",
            "@type": "ALTIMG",
            "@size": "2595",
            "@ref": "si70",
            "@mimetype": "image/svg+xml"
        },
        {
            "@category": "thumbnail",
            "@_fa": "true",
            "$": "https://api.elsevier.com/content/object/eid/1-s2.0-S0306261921003755-si71.svg?httpAccept=%2A%2F%2A",
            "@multimediatype": "Scalable Vector Graphics file",
            "@type": "ALTIMG",
            "@size": "8729",
            "@ref": "si71",
            "@mimetype": "image/svg+xml"
        },
        {
            "@category": "thumbnail",
            "@_fa": "true",
            "$": "https://api.elsevier.com/content/object/eid/1-s2.0-S0306261921003755-si74.svg?httpAccept=%2A%2F%2A",
            "@multimediatype": "Scalable Vector Graphics file",
            "@type": "ALTIMG",
            "@size": "12050",
            "@ref": "si74",
            "@mimetype": "image/svg+xml"
        },
        {
            "@category": "thumbnail",
            "@_fa": "true",
            "$": "https://api.elsevier.com/content/object/eid/1-s2.0-S0306261921003755-si76.svg?httpAccept=%2A%2F%2A",
            "@multimediatype": "Scalable Vector Graphics file",
            "@type": "ALTIMG",
            "@size": "3159",
            "@ref": "si76",
            "@mimetype": "image/svg+xml"
        },
        {
            "@category": "thumbnail",
            "@_fa": "true",
            "$": "https://api.elsevier.com/content/object/eid/1-s2.0-S0306261921003755-si77.svg?httpAccept=%2A%2F%2A",
            "@multimediatype": "Scalable Vector Graphics file",
            "@type": "ALTIMG",
            "@size": "26406",
            "@ref": "si77",
            "@mimetype": "image/svg+xml"
        },
        {
            "@category": "thumbnail",
            "@_fa": "true",
            "$": "https://api.elsevier.com/content/object/eid/1-s2.0-S0306261921003755-si79.svg?httpAccept=%2A%2F%2A",
            "@multimediatype": "Scalable Vector Graphics file",
            "@type": "ALTIMG",
            "@size": "2171",
            "@ref": "si79",
            "@mimetype": "image/svg+xml"
        },
        {
            "@category": "thumbnail",
            "@_fa": "true",
            "$": "https://api.elsevier.com/content/object/eid/1-s2.0-S0306261921003755-si8.svg?httpAccept=%2A%2F%2A",
            "@multimediatype": "Scalable Vector Graphics file",
            "@type": "ALTIMG",
            "@size": "2538",
            "@ref": "si8",
            "@mimetype": "image/svg+xml"
        },
        {
            "@category": "thumbnail",
            "@_fa": "true",
            "$": "https://api.elsevier.com/content/object/eid/1-s2.0-S0306261921003755-si80.svg?httpAccept=%2A%2F%2A",
            "@multimediatype": "Scalable Vector Graphics file",
            "@type": "ALTIMG",
            "@size": "5171",
            "@ref": "si80",
            "@mimetype": "image/svg+xml"
        },
        {
            "@category": "thumbnail",
            "@_fa": "true",
            "$": "https://api.elsevier.com/content/object/eid/1-s2.0-S0306261921003755-si81.svg?httpAccept=%2A%2F%2A",
            "@multimediatype": "Scalable Vector Graphics file",
            "@type": "ALTIMG",
            "@size": "1539",
            "@ref": "si81",
            "@mimetype": "image/svg+xml"
        },
        {
            "@category": "thumbnail",
            "@_fa": "true",
            "$": "https://api.elsevier.com/content/object/eid/1-s2.0-S0306261921003755-si82.svg?httpAccept=%2A%2F%2A",
            "@multimediatype": "Scalable Vector Graphics file",
            "@type": "ALTIMG",
            "@size": "16659",
            "@ref": "si82",
            "@mimetype": "image/svg+xml"
        },
        {
            "@category": "thumbnail",
            "@_fa": "true",
            "$": "https://api.elsevier.com/content/object/eid/1-s2.0-S0306261921003755-si84.svg?httpAccept=%2A%2F%2A",
            "@multimediatype": "Scalable Vector Graphics file",
            "@type": "ALTIMG",
            "@size": "2731",
            "@ref": "si84",
            "@mimetype": "image/svg+xml"
        },
        {
            "@category": "thumbnail",
            "@_fa": "true",
            "$": "https://api.elsevier.com/content/object/eid/1-s2.0-S0306261921003755-si85.svg?httpAccept=%2A%2F%2A",
            "@multimediatype": "Scalable Vector Graphics file",
            "@type": "ALTIMG",
            "@size": "2421",
            "@ref": "si85",
            "@mimetype": "image/svg+xml"
        },
        {
            "@category": "thumbnail",
            "@_fa": "true",
            "$": "https://api.elsevier.com/content/object/eid/1-s2.0-S0306261921003755-si87.svg?httpAccept=%2A%2F%2A",
            "@multimediatype": "Scalable Vector Graphics file",
            "@type": "ALTIMG",
            "@size": "17357",
            "@ref": "si87",
            "@mimetype": "image/svg+xml"
        },
        {
            "@category": "thumbnail",
            "@_fa": "true",
            "$": "https://api.elsevier.com/content/object/eid/1-s2.0-S0306261921003755-si88.svg?httpAccept=%2A%2F%2A",
            "@multimediatype": "Scalable Vector Graphics file",
            "@type": "ALTIMG",
            "@size": "21979",
            "@ref": "si88",
            "@mimetype": "image/svg+xml"
        },
        {
            "@category": "thumbnail",
            "@_fa": "true",
            "$": "https://api.elsevier.com/content/object/eid/1-s2.0-S0306261921003755-si89.svg?httpAccept=%2A%2F%2A",
            "@multimediatype": "Scalable Vector Graphics file",
            "@type": "ALTIMG",
            "@size": "12014",
            "@ref": "si89",
            "@mimetype": "image/svg+xml"
        },
        {
            "@category": "thumbnail",
            "@_fa": "true",
            "$": "https://api.elsevier.com/content/object/eid/1-s2.0-S0306261921003755-si9.svg?httpAccept=%2A%2F%2A",
            "@multimediatype": "Scalable Vector Graphics file",
            "@type": "ALTIMG",
            "@size": "2935",
            "@ref": "si9",
            "@mimetype": "image/svg+xml"
        },
        {
            "@category": "thumbnail",
            "@_fa": "true",
            "$": "https://api.elsevier.com/content/object/eid/1-s2.0-S0306261921003755-si90.svg?httpAccept=%2A%2F%2A",
            "@multimediatype": "Scalable Vector Graphics file",
            "@type": "ALTIMG",
            "@size": "3946",
            "@ref": "si90",
            "@mimetype": "image/svg+xml"
        },
        {
            "@category": "thumbnail",
            "@_fa": "true",
            "$": "https://api.elsevier.com/content/object/eid/1-s2.0-S0306261921003755-si92.svg?httpAccept=%2A%2F%2A",
            "@multimediatype": "Scalable Vector Graphics file",
            "@type": "ALTIMG",
            "@size": "3691",
            "@ref": "si92",
            "@mimetype": "image/svg+xml"
        },
        {
            "@category": "thumbnail",
            "@_fa": "true",
            "$": "https://api.elsevier.com/content/object/eid/1-s2.0-S0306261921003755-si93.svg?httpAccept=%2A%2F%2A",
            "@multimediatype": "Scalable Vector Graphics file",
            "@type": "ALTIMG",
            "@size": "3930",
            "@ref": "si93",
            "@mimetype": "image/svg+xml"
        },
        {
            "@category": "thumbnail",
            "@_fa": "true",
            "$": "https://api.elsevier.com/content/object/eid/1-s2.0-S0306261921003755-si94.svg?httpAccept=%2A%2F%2A",
            "@multimediatype": "Scalable Vector Graphics file",
            "@type": "ALTIMG",
            "@size": "2290",
            "@ref": "si94",
            "@mimetype": "image/svg+xml"
        },
        {
            "@category": "thumbnail",
            "@_fa": "true",
            "$": "https://api.elsevier.com/content/object/eid/1-s2.0-S0306261921003755-si95.svg?httpAccept=%2A%2F%2A",
            "@multimediatype": "Scalable Vector Graphics file",
            "@type": "ALTIMG",
            "@size": "2492",
            "@ref": "si95",
            "@mimetype": "image/svg+xml"
        },
        {
            "@category": "thumbnail",
            "@_fa": "true",
            "$": "https://api.elsevier.com/content/object/eid/1-s2.0-S0306261921003755-si97.svg?httpAccept=%2A%2F%2A",
            "@multimediatype": "Scalable Vector Graphics file",
            "@type": "ALTIMG",
            "@size": "2284",
            "@ref": "si97",
            "@mimetype": "image/svg+xml"
        },
        {
            "@category": "thumbnail",
            "@_fa": "true",
            "$": "https://api.elsevier.com/content/object/eid/1-s2.0-S0306261921003755-si98.svg?httpAccept=%2A%2F%2A",
            "@multimediatype": "Scalable Vector Graphics file",
            "@type": "ALTIMG",
            "@size": "2704",
            "@ref": "si98",
            "@mimetype": "image/svg+xml"
        },
        {
            "@category": "thumbnail",
            "@_fa": "true",
            "$": "https://api.elsevier.com/content/object/eid/1-s2.0-S0306261921003755-si99.svg?httpAccept=%2A%2F%2A",
            "@multimediatype": "Scalable Vector Graphics file",
            "@type": "ALTIMG",
            "@size": "2502",
            "@ref": "si99",
            "@mimetype": "image/svg+xml"
        },
        {
            "@category": "standard",
            "@_fa": "true",
            "$": "https://api.elsevier.com/content/object/eid/1-s2.0-S0306261921003755-am.pdf?httpAccept=%2A%2F%2A",
            "@multimediatype": "Acrobat PDF file",
            "@type": "AAM-PDF",
            "@size": "858292",
            "@ref": "am",
            "@mimetype": "application/pdf"
        }
    ]},
    "link": {
        "@rel": "abstract",
        "@href": "https://api.elsevier.com/content/abstract/scopus_id/85103561047"
    }
}}