{"full-text-retrieval-response": {
    "scopus-eid": "2-s2.0-85105357703",
    "originalText": "serial JL 271429 291210 291702 291731 291787 291877 291878 291881 31 Applied Energy APPLIEDENERGY 2021-04-29 2021-04-29 2021-04-29 2021-04-29 2021-05-14T22:55:53 1-s2.0-S0306261921004542 S0306-2619(21)00454-2 S0306261921004542 10.1016/j.apenergy.2021.116985 S300 S300.1 FULL-TEXT 1-s2.0-S0306261921X00116 2024-01-01T13:26:00.965548Z 0 0 20210715 2021 2021-04-29T22:08:08.751664Z articleinfo articlenumber articletitlenorm authfirstinitialnorm authfirstsurnamenorm cid cids contenttype copyright crossmark dateloaded dateloadedtxt datesearch datesort dateupdated dco docsubtype doctype doi eid ewtransactionid hubeid indexeddate issn issnnorm itemstage itemtransactionid itemweight openaccess openarchive pg pgfirst pii piinorm pubdatestart pubdatetxt pubyr sectiontitle sortorder srctitle srctitlenorm srctype ssids alllist content subj subheadings suppl tomb volfirst volissue volumelist webpdf webpdfpagecount yearnav figure table body mmlmath affil appendices articletitle auth authfirstini authfull authkeywords authlast grantnumber grantsponsor grantsponsorid nomenclature orcid primabst ref 0306-2619 03062619 true 294 294 C Volume 294 14 116985 116985 116985 20210715 15 July 2021 2021-07-15 2021 Research Papers article fla © 2021 Elsevier Ltd. All rights reserved. ALOWCOMPLEXITYDECISIONMODELFORHOMEENERGYMANAGEMENTSYSTEMS SALGADO M Nomenclature 1 Introduction 2 Methodology 2.1 First-stage problem formulation 2.1.1 Basic energy model 2.1.2 Thermal appliances 2.1.3 Uninterruptible tasks 2.1.4 Storage and deferrable appliances 2.2 Second-stage problem formulation 2.2.1 Second-stage energy model 2.2.2 Thermal appliances 2.2.3 Uninterruptible tasks 2.2.4 Storage and deferrable appliances 3 Test environment 4 Results 5 Conclusions Appendix Appliance properties References HUANG 2015 448 455 Y BARTH 2018 13 23 L OSTOVAR 2020 1 6 S 202010THSMARTGRIDCONFERENCESGC DEVELOPINGANEWFLEXIBILITYBASEDALGORITHMFORHOMEENERGYMANAGEMENTSYSTEMHEMS HARDER 2020 115784 N DECONINCK 2016 653 665 R PATERAKIS 2015 1509 1519 N WENZEL 2018 5141 5151 G GARIFI 2018 1 5 K 2018IEEEPOWERENERGYSOCIETYGENERALMEETINGPESGM STOCHASTICMODELPREDICTIVECONTROLFORDEMANDRESPONSEINAHOMEENERGYMANAGEMENTSYSTEM ALI 2020 91779 91798 S ZHANG 2016 1790 1801 D XU 2020 3201 3211 X ALFAVERH 2020 39310 39321 F SOUSA 2018 1830 1836 T 2018IEEESYMPOSIUMSERIESCOMPUTATIONALINTELLIGENCESSCI AFLEXIBILITYHOMEENERGYMANAGEMENTSYSTEMSUPPORTAGREGGATORREQUESTSINSMARTGRIDS ERDINC 2018 1 O ERDINC 2017 362 372 O HU 2017 1586 1598 J ADHIKARI 2018 166 177 R JAVAID 2017 211 227 N SHAKERI 2017 154 164 M MERDANOGLU 2020 106229 H BEAUDIN 2015 318 335 M ETXEGARAI 2018 204 208 A 201819THIEEEMEDITERRANEANELECTROTECHNICALCONFERENCEMELECON IMPACTPRICEBASEDDEMANDRESPONSEPROGRAMSFORRESIDENTIALCUSTOMERS HU 2017 3157 3167 J WU 2017 277 283 X ELKAZAZ 2020 115118 M PIPPIA 2018 3171 3176 T 2018IEEECONFERENCEDECISIONCONTROLCDC APARAMETRIZEDMODELPREDICTIVECONTROLAPPROACHFORMICROGRIDS RAIMONDICOMINESI 2018 1 13 S LUO 2019 116 126 F WU 2017 225 237 D AZNAVI 2019 1 5 S 2019IEEETRANSPORTATIONELECTRIFICATIONCONFERENCEEXPOITEC TWOSTAGEENERGYMANAGEMENTSMARTHOMESINPRESENCEINTERMITTENCIES JAVADI 2021 102792 M ARGUEZ 2010 A NOAASCLIMATENORMALS19812010 HART 2011 219 260 W HART 2017 W PYOMOOPTIMIZATIONMODELINGINPYTHON FORREST 2018 J COINORCBCVERSION299 SALGADOX2021X116985 SALGADOX2021X116985XM 2023-04-29T00:00:00.000Z 2023-04-29T00:00:00.000Z http://creativecommons.org/licenses/by-nc-nd/4.0/ © 2021 Elsevier Ltd. All rights reserved. 2021-04-30T00:09:09.829Z http://vtw.elsevier.com/data/voc/AddOnTypes/50.7/eoas CONICYT CONICYT http://data.elsevier.com/vocabulary/SciValFunders/501100002848 http://sws.geonames.org/3895114 https://doi.org/10.15223/policy-017 https://doi.org/10.15223/policy-037 https://doi.org/10.15223/policy-012 https://doi.org/10.15223/policy-029 https://doi.org/10.15223/policy-004 item S0306-2619(21)00454-2 S0306261921004542 1-s2.0-S0306261921004542 10.1016/j.apenergy.2021.116985 271429 2024-01-01T13:26:00.965548Z 2021-07-15 1-s2.0-S0306261921004542-main.pdf https://s3-eu-west-1.amazonaws.com/prod-ucs-content-store-eu-west/content/pii:S0306261921004542/MAIN/application/pdf/1fb3a8f31b97b1113621f208d3379fec/main.pdf main.pdf pdf true 2322846 MAIN 13 1-s2.0-S0306261921004542-main_1.png https://s3-eu-west-1.amazonaws.com/prod-ucs-content-store-eu-west/content/pii:S0306261921004542/PREVIEW/image/png/634259579280a2bbb5820f36e5fec5a5/main_1.png main_1.png png 59256 849 656 IMAGE-WEB-PDF 1 1-s2.0-S0306261921004542-gr4.jpg https://s3-eu-west-1.amazonaws.com/prod-ucs-content-store-eu-west/content/pii:S0306261921004542/gr4/DOWNSAMPLED/image/jpeg/e4c64558823612c01d89b73aea5b16d3/gr4.jpg gr4 gr4.jpg jpg 121472 194 624 IMAGE-DOWNSAMPLED 1-s2.0-S0306261921004542-gr3.jpg https://s3-eu-west-1.amazonaws.com/prod-ucs-content-store-eu-west/content/pii:S0306261921004542/gr3/DOWNSAMPLED/image/jpeg/dae9601d3bc60afd8213b3a778bff15d/gr3.jpg gr3 gr3.jpg jpg 172515 819 591 IMAGE-DOWNSAMPLED 1-s2.0-S0306261921004542-gr6.jpg https://s3-eu-west-1.amazonaws.com/prod-ucs-content-store-eu-west/content/pii:S0306261921004542/gr6/DOWNSAMPLED/image/jpeg/5eb8793f9e5ad4e190f2d06e9f245a30/gr6.jpg gr6 gr6.jpg jpg 134092 295 376 IMAGE-DOWNSAMPLED 1-s2.0-S0306261921004542-gr5.jpg https://s3-eu-west-1.amazonaws.com/prod-ucs-content-store-eu-west/content/pii:S0306261921004542/gr5/DOWNSAMPLED/image/jpeg/95cd9f0e484bcaeed4affbe2149bd354/gr5.jpg gr5 gr5.jpg jpg 100540 291 376 IMAGE-DOWNSAMPLED 1-s2.0-S0306261921004542-gr2.jpg https://s3-eu-west-1.amazonaws.com/prod-ucs-content-store-eu-west/content/pii:S0306261921004542/gr2/DOWNSAMPLED/image/jpeg/1bd9f145c302ceb605edcb2a1613b56d/gr2.jpg gr2 gr2.jpg jpg 130245 827 489 IMAGE-DOWNSAMPLED 1-s2.0-S0306261921004542-gr1.jpg https://s3-eu-west-1.amazonaws.com/prod-ucs-content-store-eu-west/content/pii:S0306261921004542/gr1/DOWNSAMPLED/image/jpeg/840be8497cfe5a5b695257d75f3e8b18/gr1.jpg gr1 gr1.jpg jpg 108432 211 613 IMAGE-DOWNSAMPLED 1-s2.0-S0306261921004542-gr8.jpg https://s3-eu-west-1.amazonaws.com/prod-ucs-content-store-eu-west/content/pii:S0306261921004542/gr8/DOWNSAMPLED/image/jpeg/947afc4e575c2320a0f541291a7343c9/gr8.jpg gr8 gr8.jpg jpg 127928 236 591 IMAGE-DOWNSAMPLED 1-s2.0-S0306261921004542-gr7.jpg https://s3-eu-west-1.amazonaws.com/prod-ucs-content-store-eu-west/content/pii:S0306261921004542/gr7/DOWNSAMPLED/image/jpeg/dcd199a8d6490e9c0d29317f8a3a3983/gr7.jpg gr7 gr7.jpg jpg 118395 297 376 IMAGE-DOWNSAMPLED 1-s2.0-S0306261921004542-gr4.sml https://s3-eu-west-1.amazonaws.com/prod-ucs-content-store-eu-west/content/pii:S0306261921004542/gr4/THUMBNAIL/image/gif/1ec0e70c5d596a84f57b96852ab37699/gr4.sml gr4 gr4.sml sml 74230 68 219 IMAGE-THUMBNAIL 1-s2.0-S0306261921004542-gr3.sml https://s3-eu-west-1.amazonaws.com/prod-ucs-content-store-eu-west/content/pii:S0306261921004542/gr3/THUMBNAIL/image/gif/d376a842fb7725b0260d30faf427eb1e/gr3.sml gr3 gr3.sml sml 75143 163 118 IMAGE-THUMBNAIL 1-s2.0-S0306261921004542-gr6.sml https://s3-eu-west-1.amazonaws.com/prod-ucs-content-store-eu-west/content/pii:S0306261921004542/gr6/THUMBNAIL/image/gif/1da71564ca117b8dfbe98c262eb130a4/gr6.sml gr6 gr6.sml sml 83522 164 209 IMAGE-THUMBNAIL 1-s2.0-S0306261921004542-gr5.sml https://s3-eu-west-1.amazonaws.com/prod-ucs-content-store-eu-west/content/pii:S0306261921004542/gr5/THUMBNAIL/image/gif/0e06ef2a7dc1d5fab8b1bc0226ffb9fd/gr5.sml gr5 gr5.sml sml 75076 164 212 IMAGE-THUMBNAIL 1-s2.0-S0306261921004542-gr2.sml https://s3-eu-west-1.amazonaws.com/prod-ucs-content-store-eu-west/content/pii:S0306261921004542/gr2/THUMBNAIL/image/gif/67dfa5c0c6d5b1104277c07ec5e32110/gr2.sml gr2 gr2.sml sml 70961 164 97 IMAGE-THUMBNAIL 1-s2.0-S0306261921004542-gr1.sml https://s3-eu-west-1.amazonaws.com/prod-ucs-content-store-eu-west/content/pii:S0306261921004542/gr1/THUMBNAIL/image/gif/d0aefac266d38e2f7dae31ec7fdd734a/gr1.sml gr1 gr1.sml sml 72726 75 219 IMAGE-THUMBNAIL 1-s2.0-S0306261921004542-gr8.sml https://s3-eu-west-1.amazonaws.com/prod-ucs-content-store-eu-west/content/pii:S0306261921004542/gr8/THUMBNAIL/image/gif/3f21e16f9d3ffc9fbc60967872dee9f3/gr8.sml gr8 gr8.sml sml 75171 88 219 IMAGE-THUMBNAIL 1-s2.0-S0306261921004542-gr7.sml https://s3-eu-west-1.amazonaws.com/prod-ucs-content-store-eu-west/content/pii:S0306261921004542/gr7/THUMBNAIL/image/gif/1814bc4f4fc0af4fef71f036d380d40f/gr7.sml gr7 gr7.sml sml 79435 164 207 IMAGE-THUMBNAIL 1-s2.0-S0306261921004542-gr4_lrg.jpg https://s3-eu-west-1.amazonaws.com/prod-ucs-content-store-eu-west/content/pii:S0306261921004542/gr4/HIGHRES/image/jpeg/a82b9cdc9c271f95edae70b852388f15/gr4_lrg.jpg gr4 gr4_lrg.jpg jpg 431624 861 2765 IMAGE-HIGH-RES 1-s2.0-S0306261921004542-gr3_lrg.jpg https://s3-eu-west-1.amazonaws.com/prod-ucs-content-store-eu-west/content/pii:S0306261921004542/gr3/HIGHRES/image/jpeg/5a18638e3b000acafc76e36b5a6c6354/gr3_lrg.jpg gr3 gr3_lrg.jpg jpg 828078 3626 2618 IMAGE-HIGH-RES 1-s2.0-S0306261921004542-gr6_lrg.jpg https://s3-eu-west-1.amazonaws.com/prod-ucs-content-store-eu-west/content/pii:S0306261921004542/gr6/HIGHRES/image/jpeg/28696b026545996df27547a4e3ae5132/gr6_lrg.jpg gr6 gr6_lrg.jpg jpg 474235 1307 1667 IMAGE-HIGH-RES 1-s2.0-S0306261921004542-gr5_lrg.jpg https://s3-eu-west-1.amazonaws.com/prod-ucs-content-store-eu-west/content/pii:S0306261921004542/gr5/HIGHRES/image/jpeg/4d17ff84d88c7e89d9dac455bfed6b2c/gr5_lrg.jpg gr5 gr5_lrg.jpg jpg 264984 1291 1668 IMAGE-HIGH-RES 1-s2.0-S0306261921004542-gr2_lrg.jpg https://s3-eu-west-1.amazonaws.com/prod-ucs-content-store-eu-west/content/pii:S0306261921004542/gr2/HIGHRES/image/jpeg/e08354355a5c3964bc5cea6acedd011d/gr2_lrg.jpg gr2 gr2_lrg.jpg jpg 526586 3663 2167 IMAGE-HIGH-RES 1-s2.0-S0306261921004542-gr1_lrg.jpg https://s3-eu-west-1.amazonaws.com/prod-ucs-content-store-eu-west/content/pii:S0306261921004542/gr1/HIGHRES/image/jpeg/d87b281207b67f1c5c2f6d40094e7fba/gr1_lrg.jpg gr1 gr1_lrg.jpg jpg 355684 936 2716 IMAGE-HIGH-RES 1-s2.0-S0306261921004542-gr8_lrg.jpg https://s3-eu-west-1.amazonaws.com/prod-ucs-content-store-eu-west/content/pii:S0306261921004542/gr8/HIGHRES/image/jpeg/c36e95558708d919e7dc74c998354121/gr8_lrg.jpg gr8 gr8_lrg.jpg jpg 481164 1047 2617 IMAGE-HIGH-RES 1-s2.0-S0306261921004542-gr7_lrg.jpg https://s3-eu-west-1.amazonaws.com/prod-ucs-content-store-eu-west/content/pii:S0306261921004542/gr7/HIGHRES/image/jpeg/c615bbdaaa9ea830af0e67054a71b161/gr7_lrg.jpg gr7 gr7_lrg.jpg jpg 386165 1318 1667 IMAGE-HIGH-RES 1-s2.0-S0306261921004542-si1.svg https://s3-eu-west-1.amazonaws.com/prod-ucs-content-store-eu-west/content/pii:S0306261921004542/STRIPIN/image/svg+xml/f17cfe2d96e72fc2585de33c866024bf/si1.svg si1 si1.svg svg 3799 ALTIMG 1-s2.0-S0306261921004542-si10.svg https://s3-eu-west-1.amazonaws.com/prod-ucs-content-store-eu-west/content/pii:S0306261921004542/STRIPIN/image/svg+xml/a4d94960e20ec7b208ab50b1e90d3ae1/si10.svg si10 si10.svg svg 1094 ALTIMG 1-s2.0-S0306261921004542-si100.svg https://s3-eu-west-1.amazonaws.com/prod-ucs-content-store-eu-west/content/pii:S0306261921004542/STRIPIN/image/svg+xml/bc99b20856f326bd72f9055dd5950aa4/si100.svg si100 si100.svg svg 20020 ALTIMG 1-s2.0-S0306261921004542-si101.svg https://s3-eu-west-1.amazonaws.com/prod-ucs-content-store-eu-west/content/pii:S0306261921004542/STRIPIN/image/svg+xml/f52b92eb208b12055c0911d3892e9023/si101.svg si101 si101.svg svg 15417 ALTIMG 1-s2.0-S0306261921004542-si102.svg https://s3-eu-west-1.amazonaws.com/prod-ucs-content-store-eu-west/content/pii:S0306261921004542/STRIPIN/image/svg+xml/3d715c5236148cf77a08247c169d9220/si102.svg si102 si102.svg svg 22819 ALTIMG 1-s2.0-S0306261921004542-si103.svg https://s3-eu-west-1.amazonaws.com/prod-ucs-content-store-eu-west/content/pii:S0306261921004542/STRIPIN/image/svg+xml/a04daef962c6254df1b402caee6b6264/si103.svg si103 si103.svg svg 18522 ALTIMG 1-s2.0-S0306261921004542-si104.svg https://s3-eu-west-1.amazonaws.com/prod-ucs-content-store-eu-west/content/pii:S0306261921004542/STRIPIN/image/svg+xml/70c6d1ca187a0b9089993fd5934f755c/si104.svg si104 si104.svg svg 20709 ALTIMG 1-s2.0-S0306261921004542-si105.svg https://s3-eu-west-1.amazonaws.com/prod-ucs-content-store-eu-west/content/pii:S0306261921004542/STRIPIN/image/svg+xml/a290b6fe1d2f7e1cd85e695e32c327d3/si105.svg si105 si105.svg svg 24053 ALTIMG 1-s2.0-S0306261921004542-si106.svg https://s3-eu-west-1.amazonaws.com/prod-ucs-content-store-eu-west/content/pii:S0306261921004542/STRIPIN/image/svg+xml/333550a760da3e5fe3114040b88d4dad/si106.svg si106 si106.svg svg 23916 ALTIMG 1-s2.0-S0306261921004542-si107.svg https://s3-eu-west-1.amazonaws.com/prod-ucs-content-store-eu-west/content/pii:S0306261921004542/STRIPIN/image/svg+xml/11579619b582f41f26a970b804856745/si107.svg si107 si107.svg svg 7672 ALTIMG 1-s2.0-S0306261921004542-si108.svg https://s3-eu-west-1.amazonaws.com/prod-ucs-content-store-eu-west/content/pii:S0306261921004542/STRIPIN/image/svg+xml/16e59c477cb06d5e07bffef447023e0f/si108.svg si108 si108.svg svg 2371 ALTIMG 1-s2.0-S0306261921004542-si11.svg https://s3-eu-west-1.amazonaws.com/prod-ucs-content-store-eu-west/content/pii:S0306261921004542/STRIPIN/image/svg+xml/968430eeee4e32e5bbe1cea34ca5904d/si11.svg si11 si11.svg svg 5370 ALTIMG 1-s2.0-S0306261921004542-si110.svg https://s3-eu-west-1.amazonaws.com/prod-ucs-content-store-eu-west/content/pii:S0306261921004542/STRIPIN/image/svg+xml/9089000a4f5eda9c009b2d759936018b/si110.svg si110 si110.svg svg 5461 ALTIMG 1-s2.0-S0306261921004542-si113.svg https://s3-eu-west-1.amazonaws.com/prod-ucs-content-store-eu-west/content/pii:S0306261921004542/STRIPIN/image/svg+xml/f4b7686f59f0be50b4860b1714e6c672/si113.svg si113 si113.svg svg 14303 ALTIMG 1-s2.0-S0306261921004542-si114.svg https://s3-eu-west-1.amazonaws.com/prod-ucs-content-store-eu-west/content/pii:S0306261921004542/STRIPIN/image/svg+xml/65ed296219126f5e410d217111ef6727/si114.svg si114 si114.svg svg 18960 ALTIMG 1-s2.0-S0306261921004542-si115.svg https://s3-eu-west-1.amazonaws.com/prod-ucs-content-store-eu-west/content/pii:S0306261921004542/STRIPIN/image/svg+xml/efd2bb3c311a4ae2a7d2a15367af50f8/si115.svg si115 si115.svg svg 19181 ALTIMG 1-s2.0-S0306261921004542-si116.svg https://s3-eu-west-1.amazonaws.com/prod-ucs-content-store-eu-west/content/pii:S0306261921004542/STRIPIN/image/svg+xml/43aa71baeb978b13d71104766dc08f11/si116.svg si116 si116.svg svg 16880 ALTIMG 1-s2.0-S0306261921004542-si117.svg https://s3-eu-west-1.amazonaws.com/prod-ucs-content-store-eu-west/content/pii:S0306261921004542/STRIPIN/image/svg+xml/c41231e01129beafe36ad6fd4dd64c48/si117.svg si117 si117.svg svg 16435 ALTIMG 1-s2.0-S0306261921004542-si118.svg https://s3-eu-west-1.amazonaws.com/prod-ucs-content-store-eu-west/content/pii:S0306261921004542/STRIPIN/image/svg+xml/a2d8cb14cbfe57d343409fcb3393b89e/si118.svg si118 si118.svg svg 16987 ALTIMG 1-s2.0-S0306261921004542-si119.svg https://s3-eu-west-1.amazonaws.com/prod-ucs-content-store-eu-west/content/pii:S0306261921004542/STRIPIN/image/svg+xml/b22779f840f1977251b4c7379c5bb27d/si119.svg si119 si119.svg svg 17207 ALTIMG 1-s2.0-S0306261921004542-si12.svg https://s3-eu-west-1.amazonaws.com/prod-ucs-content-store-eu-west/content/pii:S0306261921004542/STRIPIN/image/svg+xml/c8f6f7ed8384710d3844b843f9b0b4c5/si12.svg si12 si12.svg svg 7789 ALTIMG 1-s2.0-S0306261921004542-si120.svg https://s3-eu-west-1.amazonaws.com/prod-ucs-content-store-eu-west/content/pii:S0306261921004542/STRIPIN/image/svg+xml/4bb0ee32b6ca580ee8a7d7a22bfd8b7c/si120.svg si120 si120.svg svg 17714 ALTIMG 1-s2.0-S0306261921004542-si122.svg https://s3-eu-west-1.amazonaws.com/prod-ucs-content-store-eu-west/content/pii:S0306261921004542/STRIPIN/image/svg+xml/5c3419ad2ca73d703386ff8c2efef16b/si122.svg si122 si122.svg svg 11317 ALTIMG 1-s2.0-S0306261921004542-si124.svg https://s3-eu-west-1.amazonaws.com/prod-ucs-content-store-eu-west/content/pii:S0306261921004542/STRIPIN/image/svg+xml/d2108f9850f56ea3c35248c0dcbcaad4/si124.svg si124 si124.svg svg 2400 ALTIMG 1-s2.0-S0306261921004542-si125.svg https://s3-eu-west-1.amazonaws.com/prod-ucs-content-store-eu-west/content/pii:S0306261921004542/STRIPIN/image/svg+xml/cb4b19127a4eb2f84af4424fc74bf804/si125.svg si125 si125.svg svg 11888 ALTIMG 1-s2.0-S0306261921004542-si126.svg https://s3-eu-west-1.amazonaws.com/prod-ucs-content-store-eu-west/content/pii:S0306261921004542/STRIPIN/image/svg+xml/3ffb20c369545286c5d62b9492f489b3/si126.svg si126 si126.svg svg 14422 ALTIMG 1-s2.0-S0306261921004542-si127.svg https://s3-eu-west-1.amazonaws.com/prod-ucs-content-store-eu-west/content/pii:S0306261921004542/STRIPIN/image/svg+xml/d20416b98f8847a9cc13ee235a23d211/si127.svg si127 si127.svg svg 15527 ALTIMG 1-s2.0-S0306261921004542-si128.svg https://s3-eu-west-1.amazonaws.com/prod-ucs-content-store-eu-west/content/pii:S0306261921004542/STRIPIN/image/svg+xml/af96a93be5fbc996f40a2eec7631cd72/si128.svg si128 si128.svg svg 2633 ALTIMG 1-s2.0-S0306261921004542-si129.svg https://s3-eu-west-1.amazonaws.com/prod-ucs-content-store-eu-west/content/pii:S0306261921004542/STRIPIN/image/svg+xml/4e780f7b77110d286854a45cb29fcf36/si129.svg si129 si129.svg svg 3678 ALTIMG 1-s2.0-S0306261921004542-si130.svg https://s3-eu-west-1.amazonaws.com/prod-ucs-content-store-eu-west/content/pii:S0306261921004542/STRIPIN/image/svg+xml/756a4860515da9f0bf7ad69a52d9b788/si130.svg si130 si130.svg svg 6920 ALTIMG 1-s2.0-S0306261921004542-si133.svg https://s3-eu-west-1.amazonaws.com/prod-ucs-content-store-eu-west/content/pii:S0306261921004542/STRIPIN/image/svg+xml/e8b5a39ca42e29f5438f4df2b1d02411/si133.svg si133 si133.svg svg 12655 ALTIMG 1-s2.0-S0306261921004542-si134.svg https://s3-eu-west-1.amazonaws.com/prod-ucs-content-store-eu-west/content/pii:S0306261921004542/STRIPIN/image/svg+xml/df5fedb5721770b81e66ff98af9f47ff/si134.svg si134 si134.svg svg 16433 ALTIMG 1-s2.0-S0306261921004542-si135.svg https://s3-eu-west-1.amazonaws.com/prod-ucs-content-store-eu-west/content/pii:S0306261921004542/STRIPIN/image/svg+xml/7fe37049ce0ead4b128733358cfdf5a4/si135.svg si135 si135.svg svg 14281 ALTIMG 1-s2.0-S0306261921004542-si136.svg https://s3-eu-west-1.amazonaws.com/prod-ucs-content-store-eu-west/content/pii:S0306261921004542/STRIPIN/image/svg+xml/1dbcad87509d084a09606dcd759ed8bd/si136.svg si136 si136.svg svg 14510 ALTIMG 1-s2.0-S0306261921004542-si137.svg https://s3-eu-west-1.amazonaws.com/prod-ucs-content-store-eu-west/content/pii:S0306261921004542/STRIPIN/image/svg+xml/17c11dd00a63ccb126f20c1861a7cabe/si137.svg si137 si137.svg svg 3844 ALTIMG 1-s2.0-S0306261921004542-si138.svg https://s3-eu-west-1.amazonaws.com/prod-ucs-content-store-eu-west/content/pii:S0306261921004542/STRIPIN/image/svg+xml/611f23046c72ebe72d6902652fc71f03/si138.svg si138 si138.svg svg 7440 ALTIMG 1-s2.0-S0306261921004542-si139.svg https://s3-eu-west-1.amazonaws.com/prod-ucs-content-store-eu-west/content/pii:S0306261921004542/STRIPIN/image/svg+xml/791f8c34c891f3960cf74a02bc910539/si139.svg si139 si139.svg svg 17762 ALTIMG 1-s2.0-S0306261921004542-si14.svg https://s3-eu-west-1.amazonaws.com/prod-ucs-content-store-eu-west/content/pii:S0306261921004542/STRIPIN/image/svg+xml/d9b2e339c57ce9e505af947d115543da/si14.svg si14 si14.svg svg 3389 ALTIMG 1-s2.0-S0306261921004542-si140.svg https://s3-eu-west-1.amazonaws.com/prod-ucs-content-store-eu-west/content/pii:S0306261921004542/STRIPIN/image/svg+xml/5bee353142c360bdd23e7dda1c3ce428/si140.svg si140 si140.svg svg 21354 ALTIMG 1-s2.0-S0306261921004542-si141.svg https://s3-eu-west-1.amazonaws.com/prod-ucs-content-store-eu-west/content/pii:S0306261921004542/STRIPIN/image/svg+xml/606e5843936bf5b280c97f1d7f217478/si141.svg si141 si141.svg svg 27151 ALTIMG 1-s2.0-S0306261921004542-si142.svg https://s3-eu-west-1.amazonaws.com/prod-ucs-content-store-eu-west/content/pii:S0306261921004542/STRIPIN/image/svg+xml/11a946865ddb6918214b5e9d93d1f95f/si142.svg si142 si142.svg svg 24030 ALTIMG 1-s2.0-S0306261921004542-si143.svg https://s3-eu-west-1.amazonaws.com/prod-ucs-content-store-eu-west/content/pii:S0306261921004542/STRIPIN/image/svg+xml/3e56fe7096ff1e64db5be48933b732cc/si143.svg si143 si143.svg svg 23415 ALTIMG 1-s2.0-S0306261921004542-si144.svg https://s3-eu-west-1.amazonaws.com/prod-ucs-content-store-eu-west/content/pii:S0306261921004542/STRIPIN/image/svg+xml/1cdc2e75f14a9e795416e6eef360b56f/si144.svg si144 si144.svg svg 24644 ALTIMG 1-s2.0-S0306261921004542-si145.svg https://s3-eu-west-1.amazonaws.com/prod-ucs-content-store-eu-west/content/pii:S0306261921004542/STRIPIN/image/svg+xml/59ca69f66608c2a9906122641552c1e9/si145.svg si145 si145.svg svg 4347 ALTIMG 1-s2.0-S0306261921004542-si148.svg https://s3-eu-west-1.amazonaws.com/prod-ucs-content-store-eu-west/content/pii:S0306261921004542/STRIPIN/image/svg+xml/a79a1216535aa97d3d89c567fd9605c6/si148.svg si148 si148.svg svg 2429 ALTIMG 1-s2.0-S0306261921004542-si15.svg https://s3-eu-west-1.amazonaws.com/prod-ucs-content-store-eu-west/content/pii:S0306261921004542/STRIPIN/image/svg+xml/649353643b06fd14ee3e7805e7dcd5e9/si15.svg si15 si15.svg svg 5368 ALTIMG 1-s2.0-S0306261921004542-si151.svg https://s3-eu-west-1.amazonaws.com/prod-ucs-content-store-eu-west/content/pii:S0306261921004542/STRIPIN/image/svg+xml/c89377acf93540a5108c9724fd20c241/si151.svg si151 si151.svg svg 29750 ALTIMG 1-s2.0-S0306261921004542-si152.svg https://s3-eu-west-1.amazonaws.com/prod-ucs-content-store-eu-west/content/pii:S0306261921004542/STRIPIN/image/svg+xml/bc6108c3be00d63507bce0cb3844a306/si152.svg si152 si152.svg svg 24397 ALTIMG 1-s2.0-S0306261921004542-si153.svg https://s3-eu-west-1.amazonaws.com/prod-ucs-content-store-eu-west/content/pii:S0306261921004542/STRIPIN/image/svg+xml/462adfcc54a8a4dd79abaa449b8912cd/si153.svg si153 si153.svg svg 26057 ALTIMG 1-s2.0-S0306261921004542-si154.svg https://s3-eu-west-1.amazonaws.com/prod-ucs-content-store-eu-west/content/pii:S0306261921004542/STRIPIN/image/svg+xml/a7e187117e8bb0a48424f2cbda3f1e05/si154.svg si154 si154.svg svg 16471 ALTIMG 1-s2.0-S0306261921004542-si155.svg https://s3-eu-west-1.amazonaws.com/prod-ucs-content-store-eu-west/content/pii:S0306261921004542/STRIPIN/image/svg+xml/cc07af5ccdf6df91a59c08bbc43e189f/si155.svg si155 si155.svg svg 17755 ALTIMG 1-s2.0-S0306261921004542-si156.svg https://s3-eu-west-1.amazonaws.com/prod-ucs-content-store-eu-west/content/pii:S0306261921004542/STRIPIN/image/svg+xml/1667e623d9a1f20ea034828dfb2f38cf/si156.svg si156 si156.svg svg 13268 ALTIMG 1-s2.0-S0306261921004542-si157.svg https://s3-eu-west-1.amazonaws.com/prod-ucs-content-store-eu-west/content/pii:S0306261921004542/STRIPIN/image/svg+xml/6a8eae2238faf3b856ac0e74cbd26610/si157.svg si157 si157.svg svg 14875 ALTIMG 1-s2.0-S0306261921004542-si158.svg https://s3-eu-west-1.amazonaws.com/prod-ucs-content-store-eu-west/content/pii:S0306261921004542/STRIPIN/image/svg+xml/18a7fe191aa8c319e706ee1b64e8a292/si158.svg si158 si158.svg svg 23470 ALTIMG 1-s2.0-S0306261921004542-si159.svg https://s3-eu-west-1.amazonaws.com/prod-ucs-content-store-eu-west/content/pii:S0306261921004542/STRIPIN/image/svg+xml/e870fde21b8e7d50c58800821d794a6a/si159.svg si159 si159.svg svg 31769 ALTIMG 1-s2.0-S0306261921004542-si16.svg https://s3-eu-west-1.amazonaws.com/prod-ucs-content-store-eu-west/content/pii:S0306261921004542/STRIPIN/image/svg+xml/d7620df0a49d140cfbfe8bcc01d3c208/si16.svg si16 si16.svg svg 7089 ALTIMG 1-s2.0-S0306261921004542-si160.svg https://s3-eu-west-1.amazonaws.com/prod-ucs-content-store-eu-west/content/pii:S0306261921004542/STRIPIN/image/svg+xml/6a334c6ae5537ce546cbafb7e258877a/si160.svg si160 si160.svg svg 20351 ALTIMG 1-s2.0-S0306261921004542-si161.svg https://s3-eu-west-1.amazonaws.com/prod-ucs-content-store-eu-west/content/pii:S0306261921004542/STRIPIN/image/svg+xml/4ec8bca93c66523c15a5838505926f2d/si161.svg si161 si161.svg svg 22876 ALTIMG 1-s2.0-S0306261921004542-si162.svg https://s3-eu-west-1.amazonaws.com/prod-ucs-content-store-eu-west/content/pii:S0306261921004542/STRIPIN/image/svg+xml/f89ef3da3c9555b659b47d16c51e46b7/si162.svg si162 si162.svg svg 21615 ALTIMG 1-s2.0-S0306261921004542-si163.svg https://s3-eu-west-1.amazonaws.com/prod-ucs-content-store-eu-west/content/pii:S0306261921004542/STRIPIN/image/svg+xml/c3579fdbaff0a6855f9c2f8d156aa93a/si163.svg si163 si163.svg svg 5761 ALTIMG 1-s2.0-S0306261921004542-si164.svg https://s3-eu-west-1.amazonaws.com/prod-ucs-content-store-eu-west/content/pii:S0306261921004542/STRIPIN/image/svg+xml/a8810a1b09aed1a09a0152c65632e5b9/si164.svg si164 si164.svg svg 11701 ALTIMG 1-s2.0-S0306261921004542-si165.svg https://s3-eu-west-1.amazonaws.com/prod-ucs-content-store-eu-west/content/pii:S0306261921004542/STRIPIN/image/svg+xml/712465dbbc237ed84ed274bcae25e65e/si165.svg si165 si165.svg svg 3980 ALTIMG 1-s2.0-S0306261921004542-si167.svg https://s3-eu-west-1.amazonaws.com/prod-ucs-content-store-eu-west/content/pii:S0306261921004542/STRIPIN/image/svg+xml/dd5ee64d77ec524d5fb1bee45658520c/si167.svg si167 si167.svg svg 4542 ALTIMG 1-s2.0-S0306261921004542-si168.svg https://s3-eu-west-1.amazonaws.com/prod-ucs-content-store-eu-west/content/pii:S0306261921004542/STRIPIN/image/svg+xml/d9e19dd2e2b1819c3a6e0ccd7e79f666/si168.svg si168 si168.svg svg 2528 ALTIMG 1-s2.0-S0306261921004542-si171.svg https://s3-eu-west-1.amazonaws.com/prod-ucs-content-store-eu-west/content/pii:S0306261921004542/STRIPIN/image/svg+xml/6ff7bff453a1c543279ca239684c77c3/si171.svg si171 si171.svg svg 14490 ALTIMG 1-s2.0-S0306261921004542-si172.svg https://s3-eu-west-1.amazonaws.com/prod-ucs-content-store-eu-west/content/pii:S0306261921004542/STRIPIN/image/svg+xml/150810c568f02639a6d7d0458fadb686/si172.svg si172 si172.svg svg 14414 ALTIMG 1-s2.0-S0306261921004542-si173.svg https://s3-eu-west-1.amazonaws.com/prod-ucs-content-store-eu-west/content/pii:S0306261921004542/STRIPIN/image/svg+xml/d856f293a0d64b1b32e52c53a53672c8/si173.svg si173 si173.svg svg 13239 ALTIMG 1-s2.0-S0306261921004542-si174.svg https://s3-eu-west-1.amazonaws.com/prod-ucs-content-store-eu-west/content/pii:S0306261921004542/STRIPIN/image/svg+xml/96ac09d4826d734e1aed5d45498fa407/si174.svg si174 si174.svg svg 16782 ALTIMG 1-s2.0-S0306261921004542-si175.svg https://s3-eu-west-1.amazonaws.com/prod-ucs-content-store-eu-west/content/pii:S0306261921004542/STRIPIN/image/svg+xml/f0e5794fcfc527654c8aeee1be2737cf/si175.svg si175 si175.svg svg 17085 ALTIMG 1-s2.0-S0306261921004542-si176.svg https://s3-eu-west-1.amazonaws.com/prod-ucs-content-store-eu-west/content/pii:S0306261921004542/STRIPIN/image/svg+xml/a3a8d09927e6f4a0a4545dd00eb7e7c4/si176.svg si176 si176.svg svg 18560 ALTIMG 1-s2.0-S0306261921004542-si177.svg https://s3-eu-west-1.amazonaws.com/prod-ucs-content-store-eu-west/content/pii:S0306261921004542/STRIPIN/image/svg+xml/6beaf0d0ec60342314fc0957043b5692/si177.svg si177 si177.svg svg 25745 ALTIMG 1-s2.0-S0306261921004542-si178.svg https://s3-eu-west-1.amazonaws.com/prod-ucs-content-store-eu-west/content/pii:S0306261921004542/STRIPIN/image/svg+xml/8a8b04a9e572dbb688b61b3039a12972/si178.svg si178 si178.svg svg 17615 ALTIMG 1-s2.0-S0306261921004542-si179.svg https://s3-eu-west-1.amazonaws.com/prod-ucs-content-store-eu-west/content/pii:S0306261921004542/STRIPIN/image/svg+xml/813419631744f765d37ed5a2266825b2/si179.svg si179 si179.svg svg 20302 ALTIMG 1-s2.0-S0306261921004542-si18.svg https://s3-eu-west-1.amazonaws.com/prod-ucs-content-store-eu-west/content/pii:S0306261921004542/STRIPIN/image/svg+xml/1690c184b470729ee268c5671aa406cf/si18.svg si18 si18.svg svg 8169 ALTIMG 1-s2.0-S0306261921004542-si180.svg https://s3-eu-west-1.amazonaws.com/prod-ucs-content-store-eu-west/content/pii:S0306261921004542/STRIPIN/image/svg+xml/e66dfeba65b4acc70d04905041747f7f/si180.svg si180 si180.svg svg 14029 ALTIMG 1-s2.0-S0306261921004542-si181.svg https://s3-eu-west-1.amazonaws.com/prod-ucs-content-store-eu-west/content/pii:S0306261921004542/STRIPIN/image/svg+xml/b19bd08df7dde95243b9d39c9d740a87/si181.svg si181 si181.svg svg 7308 ALTIMG 1-s2.0-S0306261921004542-si183.svg https://s3-eu-west-1.amazonaws.com/prod-ucs-content-store-eu-west/content/pii:S0306261921004542/STRIPIN/image/svg+xml/a7c90085a19256c217be95dd7c1345db/si183.svg si183 si183.svg svg 5729 ALTIMG 1-s2.0-S0306261921004542-si185.svg https://s3-eu-west-1.amazonaws.com/prod-ucs-content-store-eu-west/content/pii:S0306261921004542/STRIPIN/image/svg+xml/c240053f68d5ed23dd8bee86a306891c/si185.svg si185 si185.svg svg 17805 ALTIMG 1-s2.0-S0306261921004542-si186.svg https://s3-eu-west-1.amazonaws.com/prod-ucs-content-store-eu-west/content/pii:S0306261921004542/STRIPIN/image/svg+xml/a0b140aaad27a41a7068840840629bff/si186.svg si186 si186.svg svg 15602 ALTIMG 1-s2.0-S0306261921004542-si187.svg https://s3-eu-west-1.amazonaws.com/prod-ucs-content-store-eu-west/content/pii:S0306261921004542/STRIPIN/image/svg+xml/0efdc062dd0f474279e9ab5cc5a198a1/si187.svg si187 si187.svg svg 22435 ALTIMG 1-s2.0-S0306261921004542-si188.svg https://s3-eu-west-1.amazonaws.com/prod-ucs-content-store-eu-west/content/pii:S0306261921004542/STRIPIN/image/svg+xml/ec9cba25757f992aa2a9f4f3d172fc74/si188.svg si188 si188.svg svg 15197 ALTIMG 1-s2.0-S0306261921004542-si189.svg https://s3-eu-west-1.amazonaws.com/prod-ucs-content-store-eu-west/content/pii:S0306261921004542/STRIPIN/image/svg+xml/897fb91243dd7fe6990cb7c3bbc87b54/si189.svg si189 si189.svg svg 15602 ALTIMG 1-s2.0-S0306261921004542-si19.svg https://s3-eu-west-1.amazonaws.com/prod-ucs-content-store-eu-west/content/pii:S0306261921004542/STRIPIN/image/svg+xml/430262ce6fab2298196286bed0566e94/si19.svg si19 si19.svg svg 9437 ALTIMG 1-s2.0-S0306261921004542-si190.svg https://s3-eu-west-1.amazonaws.com/prod-ucs-content-store-eu-west/content/pii:S0306261921004542/STRIPIN/image/svg+xml/1d84c2c53aabf241289ba980fb265a1b/si190.svg si190 si190.svg svg 22405 ALTIMG 1-s2.0-S0306261921004542-si191.svg https://s3-eu-west-1.amazonaws.com/prod-ucs-content-store-eu-west/content/pii:S0306261921004542/STRIPIN/image/svg+xml/5b134fa1925b063d99f7be76b3bcc7fb/si191.svg si191 si191.svg svg 21306 ALTIMG 1-s2.0-S0306261921004542-si192.svg https://s3-eu-west-1.amazonaws.com/prod-ucs-content-store-eu-west/content/pii:S0306261921004542/STRIPIN/image/svg+xml/01bc7e40798faf4905b3e94a1bbebe98/si192.svg si192 si192.svg svg 19823 ALTIMG 1-s2.0-S0306261921004542-si193.svg https://s3-eu-west-1.amazonaws.com/prod-ucs-content-store-eu-west/content/pii:S0306261921004542/STRIPIN/image/svg+xml/8a064b78981024c6169b4247b8d4fcfe/si193.svg si193 si193.svg svg 20042 ALTIMG 1-s2.0-S0306261921004542-si194.svg https://s3-eu-west-1.amazonaws.com/prod-ucs-content-store-eu-west/content/pii:S0306261921004542/STRIPIN/image/svg+xml/f1cf1b192ce912bb8f600c2416bb925f/si194.svg si194 si194.svg svg 29038 ALTIMG 1-s2.0-S0306261921004542-si195.svg https://s3-eu-west-1.amazonaws.com/prod-ucs-content-store-eu-west/content/pii:S0306261921004542/STRIPIN/image/svg+xml/0081cf5f9d509c483c932ddfd658bec3/si195.svg si195 si195.svg svg 30925 ALTIMG 1-s2.0-S0306261921004542-si196.svg https://s3-eu-west-1.amazonaws.com/prod-ucs-content-store-eu-west/content/pii:S0306261921004542/STRIPIN/image/svg+xml/0197b2529c275f0e4d8e74c925e26601/si196.svg si196 si196.svg svg 26939 ALTIMG 1-s2.0-S0306261921004542-si197.svg https://s3-eu-west-1.amazonaws.com/prod-ucs-content-store-eu-west/content/pii:S0306261921004542/STRIPIN/image/svg+xml/9c72cc3fe70b232b60c8febf26e887cf/si197.svg si197 si197.svg svg 28332 ALTIMG 1-s2.0-S0306261921004542-si198.svg https://s3-eu-west-1.amazonaws.com/prod-ucs-content-store-eu-west/content/pii:S0306261921004542/STRIPIN/image/svg+xml/78eabeabd8dcb5e384c28f55d155fcb2/si198.svg si198 si198.svg svg 23935 ALTIMG 1-s2.0-S0306261921004542-si199.svg https://s3-eu-west-1.amazonaws.com/prod-ucs-content-store-eu-west/content/pii:S0306261921004542/STRIPIN/image/svg+xml/52bb8a3bb0aad8ddacead67426cd2486/si199.svg si199 si199.svg svg 21662 ALTIMG 1-s2.0-S0306261921004542-si2.svg https://s3-eu-west-1.amazonaws.com/prod-ucs-content-store-eu-west/content/pii:S0306261921004542/STRIPIN/image/svg+xml/d03efa78e4dca793cee86884ceea67ba/si2.svg si2 si2.svg svg 3734 ALTIMG 1-s2.0-S0306261921004542-si20.svg https://s3-eu-west-1.amazonaws.com/prod-ucs-content-store-eu-west/content/pii:S0306261921004542/STRIPIN/image/svg+xml/b6d78e8f42749aa2ae2de6314a72cc6a/si20.svg si20 si20.svg svg 9206 ALTIMG 1-s2.0-S0306261921004542-si201.svg https://s3-eu-west-1.amazonaws.com/prod-ucs-content-store-eu-west/content/pii:S0306261921004542/STRIPIN/image/svg+xml/db72df178b929c90d26444bad6ca3ccf/si201.svg si201 si201.svg svg 3930 ALTIMG 1-s2.0-S0306261921004542-si202.svg https://s3-eu-west-1.amazonaws.com/prod-ucs-content-store-eu-west/content/pii:S0306261921004542/STRIPIN/image/svg+xml/268d10eed13679adc36bde3afeb5f9cc/si202.svg si202 si202.svg svg 19769 ALTIMG 1-s2.0-S0306261921004542-si203.svg https://s3-eu-west-1.amazonaws.com/prod-ucs-content-store-eu-west/content/pii:S0306261921004542/STRIPIN/image/svg+xml/3ac54d81e792ee578fc4b3cb2cb2274c/si203.svg si203 si203.svg svg 21485 ALTIMG 1-s2.0-S0306261921004542-si204.svg https://s3-eu-west-1.amazonaws.com/prod-ucs-content-store-eu-west/content/pii:S0306261921004542/STRIPIN/image/svg+xml/5351f1d40d5a75401fe75fe470e55995/si204.svg si204 si204.svg svg 24409 ALTIMG 1-s2.0-S0306261921004542-si205.svg https://s3-eu-west-1.amazonaws.com/prod-ucs-content-store-eu-west/content/pii:S0306261921004542/STRIPIN/image/svg+xml/93d270116237def45a393272bb215e09/si205.svg si205 si205.svg svg 24484 ALTIMG 1-s2.0-S0306261921004542-si206.svg https://s3-eu-west-1.amazonaws.com/prod-ucs-content-store-eu-west/content/pii:S0306261921004542/STRIPIN/image/svg+xml/ae25e7fcc1b11ad7f01ae645e4114885/si206.svg si206 si206.svg svg 24947 ALTIMG 1-s2.0-S0306261921004542-si207.svg https://s3-eu-west-1.amazonaws.com/prod-ucs-content-store-eu-west/content/pii:S0306261921004542/STRIPIN/image/svg+xml/bd92beab4567f768edfc6073d8663ebe/si207.svg si207 si207.svg svg 25022 ALTIMG 1-s2.0-S0306261921004542-si208.svg https://s3-eu-west-1.amazonaws.com/prod-ucs-content-store-eu-west/content/pii:S0306261921004542/STRIPIN/image/svg+xml/23d90cff7bc32d4979253a65c4d466b2/si208.svg si208 si208.svg svg 2096 ALTIMG 1-s2.0-S0306261921004542-si21.svg https://s3-eu-west-1.amazonaws.com/prod-ucs-content-store-eu-west/content/pii:S0306261921004542/STRIPIN/image/svg+xml/f3f3ac03f518a3ca9a81dd0dc8053428/si21.svg si21 si21.svg svg 5452 ALTIMG 1-s2.0-S0306261921004542-si211.svg https://s3-eu-west-1.amazonaws.com/prod-ucs-content-store-eu-west/content/pii:S0306261921004542/STRIPIN/image/svg+xml/17ec17de15d3d4ef9d4c9178328f5e25/si211.svg si211 si211.svg svg 2299 ALTIMG 1-s2.0-S0306261921004542-si22.svg https://s3-eu-west-1.amazonaws.com/prod-ucs-content-store-eu-west/content/pii:S0306261921004542/STRIPIN/image/svg+xml/7e6d9e0404181054c2b1b26f91b7f316/si22.svg si22 si22.svg svg 8542 ALTIMG 1-s2.0-S0306261921004542-si220.svg https://s3-eu-west-1.amazonaws.com/prod-ucs-content-store-eu-west/content/pii:S0306261921004542/STRIPIN/image/svg+xml/1aa3cedec6dcff9ae6840cf248b47838/si220.svg si220 si220.svg svg 2328 ALTIMG 1-s2.0-S0306261921004542-si221.svg https://s3-eu-west-1.amazonaws.com/prod-ucs-content-store-eu-west/content/pii:S0306261921004542/STRIPIN/image/svg+xml/7733f9804d12d131b5e5e49a41553bf5/si221.svg si221 si221.svg svg 3539 ALTIMG 1-s2.0-S0306261921004542-si223.svg https://s3-eu-west-1.amazonaws.com/prod-ucs-content-store-eu-west/content/pii:S0306261921004542/STRIPIN/image/svg+xml/8e4e1ae061c8044eb6e8067ff0422563/si223.svg si223 si223.svg svg 29825 ALTIMG 1-s2.0-S0306261921004542-si224.svg https://s3-eu-west-1.amazonaws.com/prod-ucs-content-store-eu-west/content/pii:S0306261921004542/STRIPIN/image/svg+xml/ebca256c4febd605698bb183f5fd8417/si224.svg si224 si224.svg svg 30982 ALTIMG 1-s2.0-S0306261921004542-si225.svg https://s3-eu-west-1.amazonaws.com/prod-ucs-content-store-eu-west/content/pii:S0306261921004542/STRIPIN/image/svg+xml/3c60446ab13e125d1f8e799ec193bfe0/si225.svg si225 si225.svg svg 22415 ALTIMG 1-s2.0-S0306261921004542-si226.svg https://s3-eu-west-1.amazonaws.com/prod-ucs-content-store-eu-west/content/pii:S0306261921004542/STRIPIN/image/svg+xml/af5ab5c373c68a8ec16ac15ad69bcb3f/si226.svg si226 si226.svg svg 17915 ALTIMG 1-s2.0-S0306261921004542-si227.svg https://s3-eu-west-1.amazonaws.com/prod-ucs-content-store-eu-west/content/pii:S0306261921004542/STRIPIN/image/svg+xml/be8e1e138fc40823e6ef89d50ac3f95f/si227.svg si227 si227.svg svg 5983 ALTIMG 1-s2.0-S0306261921004542-si229.svg https://s3-eu-west-1.amazonaws.com/prod-ucs-content-store-eu-west/content/pii:S0306261921004542/STRIPIN/image/svg+xml/49e5e179cf377492e17bc52ded8c38fa/si229.svg si229 si229.svg svg 6992 ALTIMG 1-s2.0-S0306261921004542-si23.svg https://s3-eu-west-1.amazonaws.com/prod-ucs-content-store-eu-west/content/pii:S0306261921004542/STRIPIN/image/svg+xml/988556f95d39de301b78757c838e998a/si23.svg si23 si23.svg svg 9789 ALTIMG 1-s2.0-S0306261921004542-si230.svg https://s3-eu-west-1.amazonaws.com/prod-ucs-content-store-eu-west/content/pii:S0306261921004542/STRIPIN/image/svg+xml/2dd57c3bc819f5f9920412631593dedc/si230.svg si230 si230.svg svg 4720 ALTIMG 1-s2.0-S0306261921004542-si231.svg https://s3-eu-west-1.amazonaws.com/prod-ucs-content-store-eu-west/content/pii:S0306261921004542/STRIPIN/image/svg+xml/c300fc2c4c506a9dd75c7bc55103c5b3/si231.svg si231 si231.svg svg 4489 ALTIMG 1-s2.0-S0306261921004542-si234.svg https://s3-eu-west-1.amazonaws.com/prod-ucs-content-store-eu-west/content/pii:S0306261921004542/STRIPIN/image/svg+xml/57d895e925a3c11e3417109f4c617763/si234.svg si234 si234.svg svg 9003 ALTIMG 1-s2.0-S0306261921004542-si237.svg https://s3-eu-west-1.amazonaws.com/prod-ucs-content-store-eu-west/content/pii:S0306261921004542/STRIPIN/image/svg+xml/e28268604b01c70bd1c47b40831dd87e/si237.svg si237 si237.svg svg 7403 ALTIMG 1-s2.0-S0306261921004542-si238.svg https://s3-eu-west-1.amazonaws.com/prod-ucs-content-store-eu-west/content/pii:S0306261921004542/STRIPIN/image/svg+xml/75e8661392233ecd1082f4a425dc1f8b/si238.svg si238 si238.svg svg 2666 ALTIMG 1-s2.0-S0306261921004542-si239.svg https://s3-eu-west-1.amazonaws.com/prod-ucs-content-store-eu-west/content/pii:S0306261921004542/STRIPIN/image/svg+xml/d03c725a4139b8ce698145a07e404203/si239.svg si239 si239.svg svg 6505 ALTIMG 1-s2.0-S0306261921004542-si24.svg https://s3-eu-west-1.amazonaws.com/prod-ucs-content-store-eu-west/content/pii:S0306261921004542/STRIPIN/image/svg+xml/a9db333e19a2c87f20c6920b20a147ca/si24.svg si24 si24.svg svg 6201 ALTIMG 1-s2.0-S0306261921004542-si246.svg https://s3-eu-west-1.amazonaws.com/prod-ucs-content-store-eu-west/content/pii:S0306261921004542/STRIPIN/image/svg+xml/19c2ae2f2310d5b125cdb86a416bc82c/si246.svg si246 si246.svg svg 3354 ALTIMG 1-s2.0-S0306261921004542-si247.svg https://s3-eu-west-1.amazonaws.com/prod-ucs-content-store-eu-west/content/pii:S0306261921004542/STRIPIN/image/svg+xml/746e06f7375f54eae880f0a421288d17/si247.svg si247 si247.svg svg 3649 ALTIMG 1-s2.0-S0306261921004542-si248.svg https://s3-eu-west-1.amazonaws.com/prod-ucs-content-store-eu-west/content/pii:S0306261921004542/STRIPIN/image/svg+xml/d118f82803703aa40123fc9df5353c83/si248.svg si248 si248.svg svg 5347 ALTIMG 1-s2.0-S0306261921004542-si249.svg https://s3-eu-west-1.amazonaws.com/prod-ucs-content-store-eu-west/content/pii:S0306261921004542/STRIPIN/image/svg+xml/6eb492147569a16a74c046feee777206/si249.svg si249 si249.svg svg 3013 ALTIMG 1-s2.0-S0306261921004542-si25.svg https://s3-eu-west-1.amazonaws.com/prod-ucs-content-store-eu-west/content/pii:S0306261921004542/STRIPIN/image/svg+xml/f83b28216006d19edac65c708b0c8934/si25.svg si25 si25.svg svg 7175 ALTIMG 1-s2.0-S0306261921004542-si250.svg https://s3-eu-west-1.amazonaws.com/prod-ucs-content-store-eu-west/content/pii:S0306261921004542/STRIPIN/image/svg+xml/d5c9e4e881a5ad4ffdf9f4b14849704d/si250.svg si250 si250.svg svg 3308 ALTIMG 1-s2.0-S0306261921004542-si252.svg https://s3-eu-west-1.amazonaws.com/prod-ucs-content-store-eu-west/content/pii:S0306261921004542/STRIPIN/image/svg+xml/1562fb4cc4acb5dd6d4ee17637ac00e3/si252.svg si252 si252.svg svg 3278 ALTIMG 1-s2.0-S0306261921004542-si27.svg https://s3-eu-west-1.amazonaws.com/prod-ucs-content-store-eu-west/content/pii:S0306261921004542/STRIPIN/image/svg+xml/f57009569a359e16c6e6e441f4d9efc8/si27.svg si27 si27.svg svg 6899 ALTIMG 1-s2.0-S0306261921004542-si28.svg https://s3-eu-west-1.amazonaws.com/prod-ucs-content-store-eu-west/content/pii:S0306261921004542/STRIPIN/image/svg+xml/17dbce5760da3b80b9b3beddb3e66faa/si28.svg si28 si28.svg svg 2739 ALTIMG 1-s2.0-S0306261921004542-si29.svg https://s3-eu-west-1.amazonaws.com/prod-ucs-content-store-eu-west/content/pii:S0306261921004542/STRIPIN/image/svg+xml/168fbdb97bade2e2af07e4bbe0cfe820/si29.svg si29 si29.svg svg 2592 ALTIMG 1-s2.0-S0306261921004542-si3.svg https://s3-eu-west-1.amazonaws.com/prod-ucs-content-store-eu-west/content/pii:S0306261921004542/STRIPIN/image/svg+xml/007ea3059aaf198c8cbfa2ad1d7fabda/si3.svg si3 si3.svg svg 3064 ALTIMG 1-s2.0-S0306261921004542-si31.svg https://s3-eu-west-1.amazonaws.com/prod-ucs-content-store-eu-west/content/pii:S0306261921004542/STRIPIN/image/svg+xml/0125ac6c6ab3b2f4a8785ca5743eb594/si31.svg si31 si31.svg svg 8840 ALTIMG 1-s2.0-S0306261921004542-si32.svg https://s3-eu-west-1.amazonaws.com/prod-ucs-content-store-eu-west/content/pii:S0306261921004542/STRIPIN/image/svg+xml/9ffbc402ee408d6e947f750f88e7c391/si32.svg si32 si32.svg svg 5660 ALTIMG 1-s2.0-S0306261921004542-si33.svg https://s3-eu-west-1.amazonaws.com/prod-ucs-content-store-eu-west/content/pii:S0306261921004542/STRIPIN/image/svg+xml/c6bde8e4fe8499b1c7436d57ad4a32fd/si33.svg si33 si33.svg svg 5186 ALTIMG 1-s2.0-S0306261921004542-si34.svg https://s3-eu-west-1.amazonaws.com/prod-ucs-content-store-eu-west/content/pii:S0306261921004542/STRIPIN/image/svg+xml/046e4d142206104090d612e5b7c07455/si34.svg si34 si34.svg svg 4149 ALTIMG 1-s2.0-S0306261921004542-si35.svg https://s3-eu-west-1.amazonaws.com/prod-ucs-content-store-eu-west/content/pii:S0306261921004542/STRIPIN/image/svg+xml/30117c15362abc1e8de995c9e227065d/si35.svg si35 si35.svg svg 6561 ALTIMG 1-s2.0-S0306261921004542-si36.svg https://s3-eu-west-1.amazonaws.com/prod-ucs-content-store-eu-west/content/pii:S0306261921004542/STRIPIN/image/svg+xml/b45a548fae032c91f7ec3eb713f55847/si36.svg si36 si36.svg svg 7003 ALTIMG 1-s2.0-S0306261921004542-si37.svg https://s3-eu-west-1.amazonaws.com/prod-ucs-content-store-eu-west/content/pii:S0306261921004542/STRIPIN/image/svg+xml/1ed5f78795f7cc1c832573374990be80/si37.svg si37 si37.svg svg 5613 ALTIMG 1-s2.0-S0306261921004542-si38.svg https://s3-eu-west-1.amazonaws.com/prod-ucs-content-store-eu-west/content/pii:S0306261921004542/STRIPIN/image/svg+xml/f4661f4e40802ebf3f4b9f0173283a51/si38.svg si38 si38.svg svg 8695 ALTIMG 1-s2.0-S0306261921004542-si39.svg https://s3-eu-west-1.amazonaws.com/prod-ucs-content-store-eu-west/content/pii:S0306261921004542/STRIPIN/image/svg+xml/58baf1664251d7555e02e0a5f4530799/si39.svg si39 si39.svg svg 2628 ALTIMG 1-s2.0-S0306261921004542-si4.svg https://s3-eu-west-1.amazonaws.com/prod-ucs-content-store-eu-west/content/pii:S0306261921004542/STRIPIN/image/svg+xml/6974640fb79c19cbab46afd7cab4845e/si4.svg si4 si4.svg svg 3458 ALTIMG 1-s2.0-S0306261921004542-si41.svg https://s3-eu-west-1.amazonaws.com/prod-ucs-content-store-eu-west/content/pii:S0306261921004542/STRIPIN/image/svg+xml/32d9bd5e684fc947fc50398728bfbf40/si41.svg si41 si41.svg svg 2481 ALTIMG 1-s2.0-S0306261921004542-si43.svg https://s3-eu-west-1.amazonaws.com/prod-ucs-content-store-eu-west/content/pii:S0306261921004542/STRIPIN/image/svg+xml/3524e27fd49728361dba2e589865574e/si43.svg si43 si43.svg svg 1887 ALTIMG 1-s2.0-S0306261921004542-si45.svg https://s3-eu-west-1.amazonaws.com/prod-ucs-content-store-eu-west/content/pii:S0306261921004542/STRIPIN/image/svg+xml/d5d14e345a7164d60fccd1ceb0d65fb4/si45.svg si45 si45.svg svg 6616 ALTIMG 1-s2.0-S0306261921004542-si46.svg https://s3-eu-west-1.amazonaws.com/prod-ucs-content-store-eu-west/content/pii:S0306261921004542/STRIPIN/image/svg+xml/509c470cc618a858aed2af825b48d9c9/si46.svg si46 si46.svg svg 6825 ALTIMG 1-s2.0-S0306261921004542-si47.svg https://s3-eu-west-1.amazonaws.com/prod-ucs-content-store-eu-west/content/pii:S0306261921004542/STRIPIN/image/svg+xml/e2c1d719015c1f5cff324b47e47521b8/si47.svg si47 si47.svg svg 6066 ALTIMG 1-s2.0-S0306261921004542-si48.svg https://s3-eu-west-1.amazonaws.com/prod-ucs-content-store-eu-west/content/pii:S0306261921004542/STRIPIN/image/svg+xml/0d010f67377a3132509a13297ce3efba/si48.svg si48 si48.svg svg 6351 ALTIMG 1-s2.0-S0306261921004542-si49.svg https://s3-eu-west-1.amazonaws.com/prod-ucs-content-store-eu-west/content/pii:S0306261921004542/STRIPIN/image/svg+xml/7e94d5bc42e3c02777ee8064dc732be0/si49.svg si49 si49.svg svg 5540 ALTIMG 1-s2.0-S0306261921004542-si5.svg https://s3-eu-west-1.amazonaws.com/prod-ucs-content-store-eu-west/content/pii:S0306261921004542/STRIPIN/image/svg+xml/77a5dff3d000f562c545e447d23c04a4/si5.svg si5 si5.svg svg 3966 ALTIMG 1-s2.0-S0306261921004542-si50.svg https://s3-eu-west-1.amazonaws.com/prod-ucs-content-store-eu-west/content/pii:S0306261921004542/STRIPIN/image/svg+xml/c03a4f1325f2240d0a529de77f8512b8/si50.svg si50 si50.svg svg 4089 ALTIMG 1-s2.0-S0306261921004542-si51.svg https://s3-eu-west-1.amazonaws.com/prod-ucs-content-store-eu-west/content/pii:S0306261921004542/STRIPIN/image/svg+xml/c1bcf18ef1c38f6c16f626af66340e61/si51.svg si51 si51.svg svg 4171 ALTIMG 1-s2.0-S0306261921004542-si52.svg https://s3-eu-west-1.amazonaws.com/prod-ucs-content-store-eu-west/content/pii:S0306261921004542/STRIPIN/image/svg+xml/6f07b04b51b8bd2e41f66ad8accbd0c8/si52.svg si52 si52.svg svg 3688 ALTIMG 1-s2.0-S0306261921004542-si53.svg https://s3-eu-west-1.amazonaws.com/prod-ucs-content-store-eu-west/content/pii:S0306261921004542/STRIPIN/image/svg+xml/02d0dff2c5d0d7734c29b753375f2681/si53.svg si53 si53.svg svg 3830 ALTIMG 1-s2.0-S0306261921004542-si54.svg https://s3-eu-west-1.amazonaws.com/prod-ucs-content-store-eu-west/content/pii:S0306261921004542/STRIPIN/image/svg+xml/af3e868948e4206d249801e056f5c073/si54.svg si54 si54.svg svg 6612 ALTIMG 1-s2.0-S0306261921004542-si55.svg https://s3-eu-west-1.amazonaws.com/prod-ucs-content-store-eu-west/content/pii:S0306261921004542/STRIPIN/image/svg+xml/decd9d78ba9ff14ade2e71a17288e44a/si55.svg si55 si55.svg svg 5943 ALTIMG 1-s2.0-S0306261921004542-si56.svg https://s3-eu-west-1.amazonaws.com/prod-ucs-content-store-eu-west/content/pii:S0306261921004542/STRIPIN/image/svg+xml/5f81a13a61eaa467cea018f3deaeb0ab/si56.svg si56 si56.svg svg 6175 ALTIMG 1-s2.0-S0306261921004542-si57.svg https://s3-eu-west-1.amazonaws.com/prod-ucs-content-store-eu-west/content/pii:S0306261921004542/STRIPIN/image/svg+xml/b467958bb29e51564cdfb622cc7afaf1/si57.svg si57 si57.svg svg 6014 ALTIMG 1-s2.0-S0306261921004542-si58.svg https://s3-eu-west-1.amazonaws.com/prod-ucs-content-store-eu-west/content/pii:S0306261921004542/STRIPIN/image/svg+xml/1b91fa1e9e690c728452fec3244753df/si58.svg si58 si58.svg svg 6299 ALTIMG 1-s2.0-S0306261921004542-si59.svg https://s3-eu-west-1.amazonaws.com/prod-ucs-content-store-eu-west/content/pii:S0306261921004542/STRIPIN/image/svg+xml/c95b40f0b915bd6dd20bbdeb172436dc/si59.svg si59 si59.svg svg 6176 ALTIMG 1-s2.0-S0306261921004542-si6.svg https://s3-eu-west-1.amazonaws.com/prod-ucs-content-store-eu-west/content/pii:S0306261921004542/STRIPIN/image/svg+xml/3f7bdbcf264f5d5b2712e0fb5b623f97/si6.svg si6 si6.svg svg 1441 ALTIMG 1-s2.0-S0306261921004542-si60.svg https://s3-eu-west-1.amazonaws.com/prod-ucs-content-store-eu-west/content/pii:S0306261921004542/STRIPIN/image/svg+xml/943e0a066eff08f7e384dcb6ac18b3b1/si60.svg si60 si60.svg svg 5167 ALTIMG 1-s2.0-S0306261921004542-si61.svg https://s3-eu-west-1.amazonaws.com/prod-ucs-content-store-eu-west/content/pii:S0306261921004542/STRIPIN/image/svg+xml/e0e83ff7e6e8437d37f49764a72a5668/si61.svg si61 si61.svg svg 6041 ALTIMG 1-s2.0-S0306261921004542-si62.svg https://s3-eu-west-1.amazonaws.com/prod-ucs-content-store-eu-west/content/pii:S0306261921004542/STRIPIN/image/svg+xml/752fbe9b59ec6127d462a97f38086d0f/si62.svg si62 si62.svg svg 4802 ALTIMG 1-s2.0-S0306261921004542-si63.svg https://s3-eu-west-1.amazonaws.com/prod-ucs-content-store-eu-west/content/pii:S0306261921004542/STRIPIN/image/svg+xml/4207cd3d463e8467afeaa4c06f2c1211/si63.svg si63 si63.svg svg 4493 ALTIMG 1-s2.0-S0306261921004542-si64.svg https://s3-eu-west-1.amazonaws.com/prod-ucs-content-store-eu-west/content/pii:S0306261921004542/STRIPIN/image/svg+xml/814632c68aef018832bbeddcd7e90093/si64.svg si64 si64.svg svg 9528 ALTIMG 1-s2.0-S0306261921004542-si65.svg https://s3-eu-west-1.amazonaws.com/prod-ucs-content-store-eu-west/content/pii:S0306261921004542/STRIPIN/image/svg+xml/b7f097a54691a8afba996be043329320/si65.svg si65 si65.svg svg 4307 ALTIMG 1-s2.0-S0306261921004542-si66.svg https://s3-eu-west-1.amazonaws.com/prod-ucs-content-store-eu-west/content/pii:S0306261921004542/STRIPIN/image/svg+xml/29d7302430059b55f897670e5728374e/si66.svg si66 si66.svg svg 3638 ALTIMG 1-s2.0-S0306261921004542-si67.svg https://s3-eu-west-1.amazonaws.com/prod-ucs-content-store-eu-west/content/pii:S0306261921004542/STRIPIN/image/svg+xml/395d93f51229a2ae2bdae92c87ceda95/si67.svg si67 si67.svg svg 4781 ALTIMG 1-s2.0-S0306261921004542-si68.svg https://s3-eu-west-1.amazonaws.com/prod-ucs-content-store-eu-west/content/pii:S0306261921004542/STRIPIN/image/svg+xml/6082180bc37e0dc3865b8bf722d9aa22/si68.svg si68 si68.svg svg 4031 ALTIMG 1-s2.0-S0306261921004542-si69.svg https://s3-eu-west-1.amazonaws.com/prod-ucs-content-store-eu-west/content/pii:S0306261921004542/STRIPIN/image/svg+xml/1319101fec7f4215061242959f7307ee/si69.svg si69 si69.svg svg 4662 ALTIMG 1-s2.0-S0306261921004542-si7.svg https://s3-eu-west-1.amazonaws.com/prod-ucs-content-store-eu-west/content/pii:S0306261921004542/STRIPIN/image/svg+xml/57084a69bce77705d23493a6f689e7eb/si7.svg si7 si7.svg svg 1651 ALTIMG 1-s2.0-S0306261921004542-si70.svg https://s3-eu-west-1.amazonaws.com/prod-ucs-content-store-eu-west/content/pii:S0306261921004542/STRIPIN/image/svg+xml/49873664769f57e8919057b39036507d/si70.svg si70 si70.svg svg 24004 ALTIMG 1-s2.0-S0306261921004542-si71.svg https://s3-eu-west-1.amazonaws.com/prod-ucs-content-store-eu-west/content/pii:S0306261921004542/STRIPIN/image/svg+xml/1309ecd55849ef67ccd5abaf33d70647/si71.svg si71 si71.svg svg 25827 ALTIMG 1-s2.0-S0306261921004542-si72.svg https://s3-eu-west-1.amazonaws.com/prod-ucs-content-store-eu-west/content/pii:S0306261921004542/STRIPIN/image/svg+xml/1748380ddc50b76cb8324207d1e890e4/si72.svg si72 si72.svg svg 25432 ALTIMG 1-s2.0-S0306261921004542-si73.svg https://s3-eu-west-1.amazonaws.com/prod-ucs-content-store-eu-west/content/pii:S0306261921004542/STRIPIN/image/svg+xml/56175094a60a835a6d5fa18a2b89e1c2/si73.svg si73 si73.svg svg 11867 ALTIMG 1-s2.0-S0306261921004542-si74.svg https://s3-eu-west-1.amazonaws.com/prod-ucs-content-store-eu-west/content/pii:S0306261921004542/STRIPIN/image/svg+xml/6a5388ef796ac6d5437cc8c09f2468f9/si74.svg si74 si74.svg svg 21786 ALTIMG 1-s2.0-S0306261921004542-si75.svg https://s3-eu-west-1.amazonaws.com/prod-ucs-content-store-eu-west/content/pii:S0306261921004542/STRIPIN/image/svg+xml/39b35625f5bf0b3f6068f2851d4cb434/si75.svg si75 si75.svg svg 29253 ALTIMG 1-s2.0-S0306261921004542-si76.svg https://s3-eu-west-1.amazonaws.com/prod-ucs-content-store-eu-west/content/pii:S0306261921004542/STRIPIN/image/svg+xml/aabedad1b68f5c79d1b3536d7de95ffd/si76.svg si76 si76.svg svg 21476 ALTIMG 1-s2.0-S0306261921004542-si77.svg https://s3-eu-west-1.amazonaws.com/prod-ucs-content-store-eu-west/content/pii:S0306261921004542/STRIPIN/image/svg+xml/3f7bb8d1a1be0d0fccc2db647228ddbe/si77.svg si77 si77.svg svg 18893 ALTIMG 1-s2.0-S0306261921004542-si78.svg https://s3-eu-west-1.amazonaws.com/prod-ucs-content-store-eu-west/content/pii:S0306261921004542/STRIPIN/image/svg+xml/2186100e8def9299c09860f4ce531686/si78.svg si78 si78.svg svg 23725 ALTIMG 1-s2.0-S0306261921004542-si79.svg https://s3-eu-west-1.amazonaws.com/prod-ucs-content-store-eu-west/content/pii:S0306261921004542/STRIPIN/image/svg+xml/883f957a7d33db5ea88b9a3d222d631a/si79.svg si79 si79.svg svg 8417 ALTIMG 1-s2.0-S0306261921004542-si8.svg https://s3-eu-west-1.amazonaws.com/prod-ucs-content-store-eu-west/content/pii:S0306261921004542/STRIPIN/image/svg+xml/9e7dbea420248341e0df22a7fb59be45/si8.svg si8 si8.svg svg 1068 ALTIMG 1-s2.0-S0306261921004542-si82.svg https://s3-eu-west-1.amazonaws.com/prod-ucs-content-store-eu-west/content/pii:S0306261921004542/STRIPIN/image/svg+xml/903948a9eeabc5e83a20ee093686ec7e/si82.svg si82 si82.svg svg 10567 ALTIMG 1-s2.0-S0306261921004542-si83.svg https://s3-eu-west-1.amazonaws.com/prod-ucs-content-store-eu-west/content/pii:S0306261921004542/STRIPIN/image/svg+xml/f6fdd0e8edbd5607c742bf768b43b45b/si83.svg si83 si83.svg svg 2834 ALTIMG 1-s2.0-S0306261921004542-si87.svg https://s3-eu-west-1.amazonaws.com/prod-ucs-content-store-eu-west/content/pii:S0306261921004542/STRIPIN/image/svg+xml/ba6f2ee398edad1380007b86a778c1b8/si87.svg si87 si87.svg svg 3777 ALTIMG 1-s2.0-S0306261921004542-si88.svg https://s3-eu-west-1.amazonaws.com/prod-ucs-content-store-eu-west/content/pii:S0306261921004542/STRIPIN/image/svg+xml/50e829f9329385fe0d4fb890a150b598/si88.svg si88 si88.svg svg 15393 ALTIMG 1-s2.0-S0306261921004542-si89.svg https://s3-eu-west-1.amazonaws.com/prod-ucs-content-store-eu-west/content/pii:S0306261921004542/STRIPIN/image/svg+xml/3fbac4ceb8e3618e6a2c989e9f28f5c9/si89.svg si89 si89.svg svg 14726 ALTIMG 1-s2.0-S0306261921004542-si9.svg https://s3-eu-west-1.amazonaws.com/prod-ucs-content-store-eu-west/content/pii:S0306261921004542/STRIPIN/image/svg+xml/dc64da7c33c2ee89b4ed28b5eece3064/si9.svg si9 si9.svg svg 1348 ALTIMG 1-s2.0-S0306261921004542-si90.svg https://s3-eu-west-1.amazonaws.com/prod-ucs-content-store-eu-west/content/pii:S0306261921004542/STRIPIN/image/svg+xml/5129f5bfdf1d422a56a403aa9ab297e7/si90.svg si90 si90.svg svg 13462 ALTIMG 1-s2.0-S0306261921004542-si91.svg https://s3-eu-west-1.amazonaws.com/prod-ucs-content-store-eu-west/content/pii:S0306261921004542/STRIPIN/image/svg+xml/a897a42fac107ac338bf20d2131eef16/si91.svg si91 si91.svg svg 17631 ALTIMG 1-s2.0-S0306261921004542-si92.svg https://s3-eu-west-1.amazonaws.com/prod-ucs-content-store-eu-west/content/pii:S0306261921004542/STRIPIN/image/svg+xml/3d94c5e319356731aa81f69c77ff4de3/si92.svg si92 si92.svg svg 18803 ALTIMG 1-s2.0-S0306261921004542-si93.svg https://s3-eu-west-1.amazonaws.com/prod-ucs-content-store-eu-west/content/pii:S0306261921004542/STRIPIN/image/svg+xml/c77a570a68ae13be5d673fd22e4c5363/si93.svg si93 si93.svg svg 18315 ALTIMG 1-s2.0-S0306261921004542-si94.svg https://s3-eu-west-1.amazonaws.com/prod-ucs-content-store-eu-west/content/pii:S0306261921004542/STRIPIN/image/svg+xml/db55cd1b8b6d190dee8c60c600397ca8/si94.svg si94 si94.svg svg 6036 ALTIMG 1-s2.0-S0306261921004542-si95.svg https://s3-eu-west-1.amazonaws.com/prod-ucs-content-store-eu-west/content/pii:S0306261921004542/STRIPIN/image/svg+xml/880b6f870108fd182a1d3fe946b85a39/si95.svg si95 si95.svg svg 6350 ALTIMG 1-s2.0-S0306261921004542-si96.svg https://s3-eu-west-1.amazonaws.com/prod-ucs-content-store-eu-west/content/pii:S0306261921004542/STRIPIN/image/svg+xml/f23883df1b51f08d89268ead13c16e58/si96.svg si96 si96.svg svg 6065 ALTIMG 1-s2.0-S0306261921004542-si97.svg https://s3-eu-west-1.amazonaws.com/prod-ucs-content-store-eu-west/content/pii:S0306261921004542/STRIPIN/image/svg+xml/7364a1cbbd9fcc6e3fd7782ed7842c5a/si97.svg si97 si97.svg svg 6045 ALTIMG 1-s2.0-S0306261921004542-si98.svg https://s3-eu-west-1.amazonaws.com/prod-ucs-content-store-eu-west/content/pii:S0306261921004542/STRIPIN/image/svg+xml/d42a48d5fed43cd9e10a965e0ea75fe6/si98.svg si98 si98.svg svg 8505 ALTIMG 1-s2.0-S0306261921004542-si99.svg https://s3-eu-west-1.amazonaws.com/prod-ucs-content-store-eu-west/content/pii:S0306261921004542/STRIPIN/image/svg+xml/27168c86e83c0b9119d82ca74c5bae0a/si99.svg si99 si99.svg svg 17028 ALTIMG 1-s2.0-S0306261921004542-am.pdf am am.pdf pdf 953934 AAM-PDF https://s3-eu-west-1.amazonaws.com/prod-ucs-content-store-eu-west/content/egi:10FPTKX9T2H/MAIN/application/pdf/35000c671fed6a1fd1b15975c32262e3/am.pdf APEN 116985 116985 S0306-2619(21)00454-2 10.1016/j.apenergy.2021.116985 Elsevier Ltd Fig. 1 Demand trajectory set received by the HEMS. In the left, color in the background indicates HEMS flexibility (green - a high flexibility requirement to the HEMS, while red consider a HEMS with low flexibility). In the right is shown how the demand trajectory set increase the number of demand curves in comparison with a reference curve generated by a direct control model. Fig. 2 Internal process flowchart for the proposed two-stage HEMS problem. Fig. 3 Test case generation flowchart. Fig. 4 Evaluated demand for 9 appliances in September 24. The demand trajectory sets, expected and real demand are shown on the left, while the appliance scheduling per hour are shown on the right. Fig. 5 Convergence time and reached GAP histogram for proposed test case. Fig. 6 Deviation from expected demand per case. Deviation on low demand area artificially increases the total deviation percentage. The allowed 10% deviation limit is represented by the dotted lines. Fig. 7 Reached GAP for HEMS second-stage problem for cases with 17 appliances plus cases with additional thermal appliances. Fig. 8 Time solve histogram for different ARM processors under standard test case (left) and three HVAC appliances case (right). Solver CBC. Table A.1 Demand profile, start and end hour for uninterruptible appliances. D. profile [W] T s t a r t [h] T e n d [h] D. profile [W] T s t a r t [h] T e n d [h] 1H-loadA 1000 0 15 1H-loadE 800 13 22 1H-loadB 1600 8 17 1H-loadF 1800 8 24 1H-loadC 2000 10 21 1H-loadG 1100 8 24 1H-loadD 2500 0 24 1H-loadH 2200 8 24 2H-loadA [464,281] 8 16 2H-loadD [1072,136] 8 18 2H-loadB [603,366] 9 18 2H-loadE [1200,1400] 0 24 2H-loadC [633,316] 8 18 3H-loadA [800,800, 427] 0 24 3H-loadB [1160,1386,426] 0 24 3H-loadC [2100,1886,1040] 0 24 4H-loadA [1973,1506,900,300] 0 24 4H-loadB [746,1400,1066,186] 0 24 4H-loadC [1280,1240,946,693] 0 24 4H-loadD [800,1173,1080,693] 0 24 5H-loadA [575,667,920,1312,1752] 0 24 5H-loadB [991,1020,1000,1055,383] 0 24 5H-loadC [1540,846,1193,1193,480] 0 24 Table A.2 Electric vehicles properties. S o E m a x e v [Wh] Charger power [W] T s t a r t [h] T e n d [h] S o E i n i e v [Wh] Tesla 50000 8000 11\u201314 21\u201324 [10000,20000,30000,40000] Leaf 30000 6600 10\u201313 21\u201324 [5000,15000,25000] Volt-A 18000 4800 8\u201313 19\u201323 [3000,9000,15000] Volt-B 16000 1800 8\u201311 19\u201323 [3000,9000,15000] Table A.3 Pool pump properties. E p p [Wh] P m a x p p [W] T s t a r t [h] T e n d [h] E p p [Wh] P m a x p p [W] T s t a r t [h] T e n d [h] Pump1 1500 500 0 24 Pump2 2000 500 0 24 Pump3 3000 750 8 24 Pump4 5000 500 0 24 Pump5 1000 500 0 24 Pump6 3000 600 8 24 Pump7 4000 500 0 24 Pump8 2000 1000 8 24 Pump9 2700 135 0 24 Table A.4 Thermal appliance properties. HVAC (left) and Fridge (right). α a c β a c P m a x α r e β r e P m a x T W [W] T W [W] AC1 0.03 0.004 1000 Fridge1 0.12 0.132 100 AC2 0.035 0.003 1000 Fridge2 0.16 0.096 150 AC3 0.07 0.003 993 Fridge3 0.10 0.067 80 AC4 0.06 0.0031 1500 Fridge4 0.13 0.117 100 AC5 0.05 0.0025 1200 Fridge5 0.15 0.1125 120 AC6 0.04 0.0027 1200 AC7 0.02 0.0030 1000 ☆ This work was supported by CONICYT/FONDECYT/11170630, CONICYT/FONDECYT/1181517, CONICYT/FONDEF/17I10161, CONICYT/FONDAP/15110019, and the Complex Engineering Systems Institute, ISCI (CONICYT PIA/BASAL AFB180003). A low-complexity decision model for home energy management systems Marcelo Salgado a Matias Negrete-Pincetic a b e \u204e Álvaro Lorca a b c Daniel Olivares d e a Department of Electrical Engineering, Pontificia Universidad Católica de Chile, Santiago, Chile Department of Electrical Engineering, Pontificia Universidad Católica de Chile Santiago Chile Department of Electrical Engineering, Pontificia Universidad Catlica de Chile, Santiago, Chile. b UC Energy Research Center, Pontificia Universidad Católica de Chile, Santiago, Chile UC Energy Research Center, Pontificia Universidad Católica de Chile Santiago Chile UC Energy Research Center, Pontificia Universidad Catlica de Chile, Santiago, Chile. c Department of Industrial and Systems Engineering, Pontificia Universidad Católica de Chile, Santiago, Chile Department of Industrial and Systems Engineering, Pontificia Universidad Católica de Chile Santiago Chile Department of Industrial and Systems Engineering, Pontificia Universidad Catlica de Chile, Santiago, Chile. d Faculty of Engineering and Sciences, Universidad Adolfo Ibañez, Santiago, Chile Faculty of Engineering and Sciences, Universidad Adolfo Ibañez Santiago Chile Faculty of Engineering and Sciences, Universidad Adolfo Ibaez, Santiago, Chile. e Institute Complex Engineering Systems (ISCI), República 695, Santiago, Chile Institute Complex Engineering Systems (ISCI) República 695 Santiago Chile Institute Complex Engineering Systems (ISCI), Repblica 695, Santiago, Chile. \u204e Corresponding author at: Department of Electrical Engineering, Pontificia Universidad Católica de Chile, Santiago, Chile. Department of Electrical Engineering, Pontificia Universidad Católica de Chile Santiago Chile A low-complexity decision model for a Home Energy Management System is proposed to follow demand trajectory sets received from a Demand Side Response aggregator. This model is designed to reduce its computational complexity and being solved by low performance processors using available Single-Board Computers as a proof of concept. To decrease the computational complexity is proposed a two-stage model, where the first stage evaluates the hourly appliance scheduling using a relaxed set of restrictions, and the second stage evaluates a reduced set of appliances in a intra-hourly interval with a detailed characterization of the scheduled appliance properties. Simulations results show the effectiveness of the proposed algorithm to follow trajectories for different sets of home appliances and operational conditions. For the studied cases, the model presents deviations in the demand for the 3.2% of the cases in the first-stage and a 12% for the second-stage model. Results show that the proposed model can schedule available appliances according to the demand aggregator requirements in a limited solving time with diverse hardware. Keywords Home energy management system Demand response Load following Demand aggregator Nomenclature Sets and Indexes Ψ a c Set of HVAC Ψ e v Set of EV\u2019s Ψ p p Set of pool pump Ψ r e Set of refrigerator Ψ u t Set of uninterruptible tasks F Freeze sub-process from HVAC appliance H Heat sub-process from HVAC appliance I Set of available HVAC set-point temperature k first-stage problem time index t Second-stage problem time index Parameters α r e , a c Refrigerator or building (HVAC) envelope, related to thermal transmittance β a c , [ H , F ] Room heating or cooling gain from energy consumption for HVAC load β r e Refrigerator cooling gain from energy consumption η e v EV charge efficiency. D k e x p Expected demand in sub-hourly model from hourly model D [ k , t ] N o C Non-controllable demand estimation. E p p Total energy consumption per day for a pool pump load E a d d e d , k − 1 r e Energy injected on refrigerator in time k-1 K f [ u t , p p , e v ] Finish time for different loads K i [ u t , p p , e v ] Start time for different loads K o p u t Total operation time of the uninterruptible load P i a c , [ H , F ] HVAC load consumption for set-point i P [ H , F ] , k a c , H P Expected HVAC consumption for hour k from hourly problem P m a x a c HVAC load maximum consumption P m a x e v EV maximum power charge. P m a x p p Pool pump nominal power P m a x r e Refrigerator maximum energy consumption r k + Maximum value from demand trajectory r k − Minimal value from demand trajectory S o E m a x e v Maximum EV battery State of Energy. S o E m i n e v Minimal EV battery State of Energy. T b a n d Allowed variation from expected temperature. T [ k , t ] O Outdoor temperature forecast T r o o m Room temperature for refrigerator load T s e t r o o m Expected room temperature for HVAC load. T s t a r t r o o m Room initial temperature for HVAC load T s t a r t r e Refrigerator internal temperature at start T s t a r t r o o m A C Room temperature for HVACV load at start Variables σ k + Demand deviation for hourly model above r k + . Continuous variable. σ k − Demand deviation below r k − . Continuous variable. σ t Demand deviation for sub-hourly model above r k + . Continuous variable. F k o p , a c HVAC heat operation in hour k. Binary variable H k o p , a c HVAC heat operation in hour k. Binary variable P F , k a c HVAC consumption on freeze mode for hour k in sub-hourly model P H , k a c HVAC consumption on heat mode for hour k in sub-hourly model P k p e a k Demand peak for hour k in sub-hourly model. p k r e Energy consumption by refrigerator load for hour model. Continuous variable. P t a c Energy consumption by HVAC loads on sub-hourly model P t H Total HEMS consumption on sub-hourly model. P t r e Energy consumption by refrigerator load in sub-hourly model P [ k , t ] e v Energy consumption by EV load t or k time-step P [ k , t ] p p Energy consumption by pool pump for t or k time-step P [ k , t ] u t Energy consumption by uninterruptible task P k , F a c Freeze process energy consumption for HVAC appliance P k , H a c Heat process energy consumption for HVAC appliance S o E k e v EV battery State of Energy. T k r o o m Room temperature in time-step k for HVAC load T [ k , t ] r e Refrigerator internal temperature in k or t time-step u k u t Start process of an uninterruptible load. Binary variable v k u t Shut-down of an uninterruptible load. Binary variable x i , t a c , [ H , F ] Heat or freeze HVAC set-point temperature at time t. Binary variable. x t e v EV operation status for t time-step. Binary variable x t p p Pool pump operation status for t time-step. Binary variable x k u t Uninterruptible load operation status. Binary variable x t r e Refrigerator compressor operation status. Binary variable 1 Introduction The advances on communication networks and a cost reduction in control systems contribute to the development of demand response (DR) schemes at the residential level. In this way, flexibility available on electricity consumers can be harnessed and become a valuable resource. A required component to exploit flexibility at the residential level is the so-called Home Energy Management System (HEMS). HEMS can be defined as a technology platform that allows to the user to monitor its energy usage, manage home appliances and local energy resources according to the customer preferences, expected non-controllable demand and external signals from a Local Service Entity (LSE) or a Demand Side Response (DSR) aggregator. A central element of the HEMS are the decision models to schedule the set of available appliances according to external information, technical restrictions and comfort requests by the users. In the rest of the paper, HEMS model will be used to specify such decision models. In order to take advantage of the appliances flexibility, it is necessary to define and model the available loads and its properties. The different home appliances can be categorized as interruptible, uninterruptible or deferrable loads [1], which indicates the capacity to displace and curtail its demand over time or if the task can be stopped and restart later. A complete overview of the load properties is presented in [2], adding specific properties as interdependent tasks, operation modes and energy drain/losses in a process. About the flexibility on households, in the work of [3] is evaluated the positive and negative flexibility to make offers to the grid. A different approach to evaluate flexibility is explored in [4,5], using first a energy models to evaluate the reference scheduling of a building and a second model with a flexibility request, the difference in the energy cost between the two models can be considered as the flexibility cost to the user, that could be used to define a minimal flexibility price. HEMS and DR literature focuses on different mechanisms to model and evaluate available appliances. In [6] is proposed a day-ahead pricing HEMS model that includes soft and hard peak power limits with a 5-minute interval to schedule Electric Vehicles (EVs), Energy Storage Systems (ESS), thermal and uninterruptible loads. Charging strategies for EVs participation in ancillary services markets with a real-time controller was developed in [7], including a Model Predictive Control (MPC) trajectory following model with tracking error in their formulation. An stochastic MPC HEMS model in discussed in [8], where the renewable energy generation and temperature forecast is evaluated using chance constraints restrictions. Even, risk-averse HEMS [9] can include CVaR expressions in their objective function to evaluate the risk of loss of load in stochastic scenarios. In [10] is proposed a mixed machine learning and MILP algorithm to model the load properties and scheduling the set of available appliances. In [11] are used data-driven methods, Q-learning and Markov chains to model uncertainty associated to energy prices and reduce electricity costs, while in [12] is used Q-learning and Fuzzy Reasoning models to take scheduling decisions according to dynamical energy prices. New models are including flexibility offers and aggregator response in their formulation, as seen in [3] where a HEMS models evaluate offers to positive and negative flexibility, [13] schedules its appliances according to a flexibility request from a DSR Aggregator. The integration of the HEMS into a DR program requires the implementation of schemes for information exchange and load control. Two main paradigms in the literature are: Direct Load Control (DLC) and Indirect Load Control (ILC). In a DLC-based scheme a central agent sends control signals to each appliance, while the HEMS monitors and implements the received signals. DLC-based models are focused on HVAC control, as seen in [14\u201317]. By contrast, in an ILC-based model the HEMS can change its demand and appliance scheduling according to price signals received from an LSE or a DSR Aggregator, where a Real-Time Price (RTP) [7,18] or a Day-Ahead Price (DAP) [6,19] can be the signal control. In [20] over 40 HEMS ILC models are presented with different objective functions and goals. Both schemes have pros and cons. In particular, DLC schemes are more reliable in terms of harnessing loads flexibility. However, it requires the use of centralized models with potential scalability issues [21]. On the other hand, ILC-based model requires a lower computational capabilities for the aggregator at expense of less certainty of the response from the loads to the price signals [22] and increase the HEMS model complexity. A third option is to consider a hybrid scheme based on a trajectory following model, decreasing the Aggregator problem complexity respect to a DLC scheme along with improving the certainty in the flexible demand response in comparison with a price signal, but increasing the computational complexity to an ILC-based problem. A similar approach is studied for a Thermostatically Controlled Load (TCL) aggregator, as reported in [23]. In addition, to reduce the computational complexity of the model an option is divide the problem into a two-stage formulation to manage different price signals or time intervals. In [24] a two-stage model to energy scheduling with RTP and DAP signals for buildings with EVs and renewable energy is discussed, related to [25] where a Hierarchical two-stage HEMS model optimizes the energy usage with a MILP model in the first-stage and the second-stage determine optimal power setting with a rule-based controller. Furthermore, a MPC single controller with two sampling rate in microgrids [26,27] decrease the problem complexity and evaluate different dynamic network effects. Reducing the computational complexity of the decision models for a HEMS to be solved in low-performance processors is relevant in order to massify its implementation. However, this has not been the main focus on the scientific literature. Usually, decision models for HEMS based on meta-heuristic and MILP formulations presents good results in high-performance processors as a Intel Xeon or Intel Core I5 Processor [11,28,29] but does not consider the implementation on low-performance processors. Moreover, in other works the test platforms are not even described [26,30] or only indicates the used method and solve time [31]. Due to the challenges and opportunities indicated previously, this paper focuses on developing the decision models for a HEMS tailored for low-performance applications. In particular, the developed models receives as an input information about demand trajectories sent by a DSR aggregator to schedule an available set of appliances according to the load and comfort restrictions. Low computational performance Single-Board Computers (SBC) are used as a study case. In particular, the main contributions of this paper are: 1 A decision model for a HEMS focused on low computational complexity which facilitates the implementation on low-cost hardware. 2 A decision model for a HEMS considering a two-stage model tailored to implementations with a high number of flexible appliances, using a demand trajectory set delivered by a DSR Aggregator to schedule appliances and ensuring a demand profile according to the received signal 3 Load models for different appliances and evaluation horizons that can interact and change its status according to their time evolution. The rest of the paper is organized as follows: Section 2 introduces the mathematical formulation for the decision models of a HEMS. Section 3 defines the test environment, data sources and appliances in the test cases. Simulations and discussion of the results with diverse SBC hardware are reported in Section 4. Finally, Section 5 provides the concluding remarks. 2 Methodology The load following formulation consists on a demand curve sent by a Demand Aggregator that the HEMS decision model can follow, changing the operational points and scheduling of the controlled appliances. A unique curve could be the optimal trajectory, assuming it is possible to quantify it, but it has practical challenges. In particular, it increases the computational complexity of the problem and requires precise information about each appliance in the household to construct an ideal optimal curve. The use of a fixed trajectory could diminish the ability of the consumer to adapt their flexibility, in short-time, to their own needs. By contrast, in the proposed model it is considered a demand trajectory set that consists on a set of allowed demand blocks per hour, as seen in Fig. 1 to extend and increase the possible set of the demand curves that the HEMS can schedule to the expected demand trajectory in comparison with a reference demand curve defined by a centralized entity, where any deviation will be penalized by the model. A DSR aggregator or a third party can modify the block size according to contractual arrangements, expected flexibility requirements, demand response services or other goals, taking advantage of the HEMS flexibility to generate additional profits or savings. This formulation also simplifies the problem faced by the aggregator in comparison with a direct control approach, by requiring only general attributes of the flexible loads to construct the trajectory demand sets for different HEMS, in accordance with the customer flexibility and preferences. In this work, the demand trajectory set will be considered as an input. In addition to the demand trajectory set, the proposed formulation considers two stages with different evaluation horizons. In the first stage, the HEMS decision model receive a demand trajectory and meteorological data to determine the offline schedule of a set of appliances for the next 24 h, at one-hour intervals. The second stage evaluate scheduled appliances in a time horizon of 2 h in order to minimize demand over the expected value and track changes in the appliances status. The first-stage problem have a simplified load model to increase the number of analyzed appliances, decreasing computational complexity of the problem and allowing the HEMS to reschedule appliances if receives a new demand trajectory. On the other hand, the second-stage problem includes a complete model of each appliance, taking advantage of a reduced set of scheduled appliances to decrease the problem complexity. In Fig. 2 is detailed each step, interaction between both stages and required data to calculate the first and second stage of the model. 2.1 First-stage problem formulation First-stage HEMS decision model evaluates and schedules a set of appliances, among which stand out thermal appliances, EV\u2019s, interruptible and uninterruptible tasks. The proposed scheduling can change according to the received demand trajectory set, the non-controllable loads and demand forecasting. Operational and comfort constraints per appliance were simplified to decrease the number of binary variables and the problem complexity. 2.1.1 Basic energy model The objective function of the first-stage model is to minimize the demand deviations from the received trajectory band r k − , r k + for a 24-hour evaluation horizon, through scheduling of a set of appliances according to the presented restrictions below (1): (1a) min p r e , P H a c , P F a c , P u t , P p p , P e v ∑ k σ k − + σ k + (1b) s.t. P k H = D k N o C + ∑ r e ∈ Ψ r e p k r e + ∑ u t ∈ Ψ u t P k u t + ∑ a c ∈ Ψ a c P k , H a c + P k , F a c + ∑ p p ∈ Ψ p p P k p p + ∑ e v ∈ Ψ e v P k e v ∀ k ∈ K (1c) r k − − σ k − ≤ P k H ≤ r k + + σ k + ∀ k ∈ K (1d) p k r e ∈ R f T k r e ( r e f r i g e r a t o r c o n s t . ) (1e) P k , H a c , P k , F a c ∈ HVAC f T k r o o m ( H V A C c o n s t . ) (1f) P k u t ∈ T f x k u t , u k u t , v k u t ( t a s k s c o n s t . ) (1g) P k p p ∈ PP f E p p ( p o o l p u m p c o n s t . ) (1h) P k e v ∈ EV f S o E k e v , P m a x e v ( E V c o n s t . ) (1i) σ k − , σ k + ≥ 0 ∀ k ∈ K Expression (1b) indicates the total energy consumption per time-step as the sum of non-controllable demand plus every controllable appliance. Eq. (1c) defines interactions between the demand trajectory and HEMS demand, including slack variables σ k − and σ k + associated with the deviation from the lower and upper demand band. Demand per load in Eq. (1b) is limited according to the set of physical and operational constrains for each appliance, as indicated in Eqs. (1d)\u2013(1h). The set of restrictions are presented in detail in Sections 2.1.2\u20132.1.4 . 2.1.2 Thermal appliances The thermal appliances depend on their previous temperature state, thermal inertia of the air mass and the external temperature to determine the evolution of the temperature in time. Unlike the reported models in the literature [8,15], the thermal model on the first stage consider a relaxed version with real and continuous variables as the decision variables. Refrigerator appliance is widely available in households and can be modeled as a thermal system limited to a minimal and maximum temperature T m i n r e , T m a x r e , where the expressions presented in Eq. (2) defines the set of restrictions R f . Expressions (2a) and (2b) characterize the temperature time evolution, where α r e and β r e correspond to thermal inertia and the compressor efficiency. This model introduce per time-step and refrigerator appliance 2 real variables ( p k r e and T k r e ), one equality restriction associated to the temperature inside the refrigerator (2a) and (2b) and 4 bounding restrictions for the temperature and the decision variable (2c) and (2d). (2a) T k r e = ( 1 − α r e ) ∗ T s t a r t r e + α r e ∗ T r o o m − β r e ∗ p k r e k = 0 , ∀ r e ∈ Ψ r e (2b) T k r e = ( 1 − α r e ) ∗ T k − 1 r e + α r e ∗ T r o o m − β r e ∗ p k r e ∀ k ∈ K − { 0 } , ∀ r e ∈ Ψ r e (2c) T m i n r e ≤ T k r e ≤ T m a x r e ∀ k ∈ K , ∀ r e ∈ Ψ r e (2d) 0 ≤ p k r e ≤ P m a x r e ∀ k ∈ K , ∀ r e ∈ Ψ r e Heating, Ventilation and Air Conditioner (HVAC) loads could be considered as an extended refrigerator with heating properties. Focusing on a Set-Point Temperature Control, a HVAC can operate in freeze or heating mode, where the power consumption depends on the selected temperature. In Eq. (3) is presented the set of restrictions HVAC f to model HVAC operation properties. Appliances can inject and extract heat from the room coupled to energy consumption ( P k a c , H and P k a c , F ), according to the temperature time evolution restrictions (3a), (3b). Room temperature will be set in Eq. (3c), where T B a n d is the temperature difference allowed from the Set-Point (1 °C). The maximum heat and freeze consumption values ( P k a c , H , P k a c , F ) cannot be higher that the HVAC nominal power (3d). (3a) T k r o o m = ( 1 − α a c ) ∗ T s t a r t r o o m + α a c ∗ T k − 1 O + β a c , H ∗ P k a c , H − β a c , F ∗ P k a c , F ∀ k = 0 , ∀ a c ∈ Ψ a c (3b) T k r o o m = ( 1 − α a c ) ∗ T k − 1 r o o m + α a c ∗ T k − 1 O + β a c , H ∗ P k a c , H − β a c , F ∗ P k a c , F ∀ k ∈ K − { 0 } , ∀ a c ∈ Ψ a c (3c) T s e t r o o m − T b a n d ≤ T k r o o m ≤ T s e t r o o m + T b a n d ∀ k ∈ K (3d) 0 ≤ P k a c , F + P k a c , H ≤ P m a x a c ∀ k ∈ K , ∀ a c ∈ Ψ a c Some erratic behavior can be seen in the model, such as inject and extract heat from the room in the same or consecutive time-steps, increasing the electric consumption to follow the desired trajectory. An option is limiting the HVAC operation according to the outdoor forecast temperature, as seen in expressions (4a) and (4b). (4a) i f T k O > T s e t r o o m : P k a c , H = 0 ∀ a c , ∀ k ∈ K (4b) i f T k O ≤ T s e t r o o m : P k a c , F = 0 ∀ a c , ∀ k ∈ K In terms of the computational complexity, the HVAC model introduces per time-step and appliance two real variables as decision variables to determinate heat and freeze power required plus a real variable associated to the room temperature, two equality restriction where the first is associated to the temperature in the room (3a) and (3b), these restrictions depend on their previous state, increasing the computational complexity) plus the second that limit the heat or freeze power to zero (4a), (4b) and 4 bounding restrictions for the temperature and the power (3c), (3d). In conclusion, if a new HVAC appliance enters in the HEMS decision model, 72 real variables and 144 restrictions are added to the problem. 2.1.3 Uninterruptible tasks Tasks that must be done in a certain time interval K i u t , K f u t and cannot be interrupted until finished can be considered as an uninterruptible task. Appliances that can be considered as these tasks could be dishwashers, electric kettles and clothes dryers. An uninterruptible task model is formulated in Eq. (5), where Eqs. (5a) and (5b) define start, finish and status of the task u t in time k . Eq. (5c) force an uninterrupted operation for at least K o p u t time-steps and works with Eq. (5d), forcing the total time operation to be equal to K o p u t time-steps, where both restrictions limits the task duration and continuity to the expected value. Finally, Eqs. (5e) and (5f) force an OFF status in time-steps out of K i u t , K f u t . (5a) x k u t = u k u t − v k u t k = 0 , ∀ u t ∈ Ψ u t (5b) x k u t − x k − 1 u t = u k u t − v k u t ∀ k ∈ K − 0 , ∀ u t ∈ Ψ u t (5c) ∑ τ = k k + K o p u t − 1 x u t , τ ≥ K o p u t u k u t ∀ u t ∈ Ψ u t , k ∈ 1 , 2 , \u2026 , K − K o p u t (5d) ∑ k = 0 K x k u t = K o p u t ∀ u t ∈ Ψ u t (5e) ∑ k = 0 K i u t x k u t = 0 ∀ u t ∈ Ψ u t (5f) ∑ K f u t + 1 K x k u t = 0 ∀ u t ∈ Ψ u t (5g) x k u t , u k u t , v k u t ∈ { 0 , 1 } ∀ k ∈ K , ∀ u t ∈ Ψ u t Eqs. (5) does not consider the energy consumption, because the demand depends of the appliance properties. If the process require a constant power the Eq. (6a) represents its consumption, but do not apply to appliances with different internal process. In these cases, a demand profile associated with the load ON status ( u k u t ) can represent demand in time. Expressions (6b) and (6c) characterize the demand profile, where (6b) indicates the demand per hour according to a profile vector P H u t = [ P 0 u t , P 1 u t , \u2026 , P h u t ] for the load u t in H time-steps, while (6c) specifies demand for remaining time. Finally, the set of restrictions T f includes the expressions presented in (5) and (6). (6a) P k u t = P u t ∗ x k u t ∀ k ∈ K (6b) P k u t = ∑ h k P k u t ∗ u k − h u t ∀ k ≤ H (6c) P k u t = ∑ h H P k u t ∗ u k − h u t ∀ k > H The increase in the problem complexity, due to the uninterrupted task model is lower in comparison with the thermal model. This formulation introduces, per time-step and appliance, three binary variables as decision variables to determinate the task operation, two equality restrictions where the first is associated with the start and end of the task (5a) and (5b) plus the second that considers the required energy (6) and a unique inequality associated to the start variable. Additionally, introduces 3 equality restrictions per appliance, regardless of the time-steps. Per each uninterruptible task, 72 binary variables and 76 restrictions are added to the problem. 2.1.4 Storage and deferrable appliances Storage systems as ESS appliances can shift energy during the day in accordance with the HEMS requirements and user preferences. If we consider only the charging properties, interruptible and deferrable tasks can be modeled as an ESS. Pool pumps and EV\u2019s are the main appliances in this category. The pool pump operation can be simplified as an appliance that can operate for a defined amount of hours per day. To model the pool pump behavior, in the Eq. (7) is presented the set of restrictions PP f . Eq. (7a) indicates the total energy required as the sum of the supplied energy per hour (decision variable P k p p ). Energy per hour is limited by (7b), while Eqs. (7c), (7d) limits the pool pump operation out of the time interval [ K i p p , K f p p ] . This model introduce per time-step and appliance one real variables ( P k p p ) and 2 bounding restrictions to limit the decision variable (7b). Additionally, it adds 3 equality restrictions per appliance associated to P k p p possible value. In total, 24 real variables and 51 restrictions are added to the problem per appliance. (7a) ∑ k = 0 K P k p p = E p p ∀ p p ∈ Ψ p p (7b) 0 ≤ P k p p ≤ P m a x p p ∀ p p ∈ Ψ p p , ∀ k ∈ K (7c) ∑ k = 0 K i p p P k p p = 0 ∀ p p ∈ Ψ p p (7d) ∑ K f p p + 1 K P k p p = 0 ∀ p p ∈ Ψ p p An electric vehicle can be modeled as an extension of the pool pump model, considering EV charger efficiency, battery State of Energy (SoE) and availability in the set of restrictions EV f presented in (8). Eq. (8a) limit EV availability to the time interval K i e v , K f e v , while Eq. (8b) and (8c) limit the power delivered. EV Battery status and charge process are defined by expressions (8d) and (8e), where (8d) defines EV SoE in the first hour where the EV is available. Finally, Eq. (8f) indicates the expected SoE at the end of charge. The constant parameter in (8f) is defined to ensure sub-hourly problem feasibility. (8a) P k e v = 0 ∀ e v ∈ Ψ e v , ∀ k ∉ K i e v , K f e v (8b) 0 ≤ P k e v ≤ P m a x e v ∀ e v ∈ Ψ e v , ∀ k ∈ K i e v , K f e v (8c) S o E m i n e v ≤ S o E k e v ≤ S o E m a x e v ∀ e v ∈ Ψ e v , ∀ k ∈ K e v s t a r t , K e v e n d (8d) S o E k e v = S o E i n i e v + η e v P k e v ∀ e v ∈ Ψ e v , k = K e v s t a r t (8e) S o E k e v = S o E k − 1 e v + η e v P k e v ∀ e v ∈ Ψ e v , ∀ k ∈ K i e v + 1 , K f e v (8f) S o E k e v ≥ 0 . 97 ∗ S o E m a x e v ∀ e v ∈ Ψ e v , k = K f e v The proposed EV formulation introduces per appliance and time-step two real variables ( P k e v and S o E k e v ), one equality restriction (8a), (8d) or (8e) and 4 bounding restrictions (8b) and (8c). An additional inequality restriction per appliance to ensure the SoE status at the end of the charge is added (8f) to sum 48 variables and 121 restrictions in the problem for each EV. 2.2 Second-stage problem formulation The second-stage model evaluates the proposed schedule and expected demand from the first stage problem to minimize the demand deviation for k and k + 1 time-step. Only the scheduled appliances in the analyzed time-step are evaluated, reducing the problem complexity. The evaluation horizon represents 2 h HEMS operation in 30 time-step, where every time-step is equivalent to 4 min, in order to respond to changes in demand or DR requirements. 2.2.1 Second-stage energy model Second-stage problem consider two different goals in the objective function. The first is evaluate the difference in the expected demand between first and second stage problem, penalizing demand values over the expected hour demand. The second goal is to penalize the maximum deviation peak for k and k + 1 hour, multiply for a weight constant. The energy model is described in Eq. (9). (9a) min P r e , P a c , P u t P p p , P e v ∑ t T σ t + 15 ∗ P k p e a k + P k + 1 p e a k (9b) s.t. P t H = D t N o C + ∑ r e ∈ Ψ r e P t r e + ∑ a c ∈ Ψ a c P t a c + ∑ u t ∈ Ψ u t P t u t + ∑ p p ∈ Ψ p p P t p p + ∑ e v ∈ Ψ e v P t e v ∀ r e , a c , u t , p p , e v (9c) P t H D k e x p ≤ 1 + σ t ∀ t ∈ 1 , T ∕ 2 (9d) P t H D k + 1 e x p ≤ 1 + σ t ∀ t ∈ T ∕ 2 + 1 , T (9e) σ t ≤ P k p e a k ∀ t ∈ 1 , T ∕ 2 (9f) σ t ≤ P k + 1 p e a k ∀ t ∈ T ∕ 2 + 1 , T (9g) P t r e ∈ R s x t r e , T t r e ( r e f r i g e r a t o r c o n s t . ) (9h) P t a c ∈ HVAC s x i , t a c , H , x i , t a c , F , T t r o o m ( H V A C c o n s t . ) (9i) P t u t ∈ T s x t u t , u t u t , v t u t , ( t a s k c o n s t . ) (9j) P t p p ∈ PP s P k p p , P k + 1 p p , x t p p ( p o o l p u m p c o n s t . ) (9k) P t e v ∈ EV s P k e v , P k + 1 e v , x t e v ( e v c o n s t . ) (9l) σ t ≥ 0 ∀ t ∈ T (9m) P k p e a k ≥ 0 ∀ k ∈ k , k + 1 Expressions (9c) and (9d) penalize demand over expected value for the k , k + 1 time-step. To avoid a demand valley in the second-stage, the model penalizes the demand peak for k , k + 1 time-step according to the expressions (9e) and (9f). Demand per load in Eq. (9b) is limited according to the set of physical and operational constraints for each appliance in the expressions (9g)\u2013(9k). The set of restrictions are presented in detail in Sections 2.2.2\u20132.2.4. 2.2.2 Thermal appliances In comparison with the first-stage formulation, the thermal appliance model considers binary variables to capture the appliance status and its operation. For refrigerator appliances, the second-stage model defines its operation according to p k R e energy value from the hourly problem. Sub-hour refrigerator behavior is modeled by the set of constraints R s presented in (10), where (10a), (10b) and (10c) evaluate and limit the temperature in the refrigerator. Additionally, Eq. (10e) and (10f) evaluate the energy required by the refrigerator according to p k r e , multiplied by a constant factor to do not force the operation, while (10d) indicates the refrigerator power consumption per time-step according to the compressor decision variable x t r e . The restriction (10f) includes the required and supplied energy in the previous hour. (10a) T t r e = ( 1 − α r e ) ∗ T s t a r t r e + α r e ∗ T r o o m − β r e ∗ x t r e t = 0 , ∀ r e ∈ Ψ r e (10b) T t r e = ( 1 − α r e ) ∗ T t − 1 r e + α r e ∗ T r o o m − β r e ∗ x t r e ∀ t ∈ T − { 0 } , ∀ r e ∈ Ψ r e (10c) T m i n r e ≤ T t r e ≤ T m a x r e ∀ t ∈ T , ∀ r e ∈ Ψ r e (10d) P t r e = P m a x r e ∗ x t r e ∀ t ∈ T , ∀ r e ∈ Ψ r e (10e) ∑ t = 0 T 2 ∗ P t r e T ≥ 0 . 8 ∗ ( p k r e + p k + 1 r e ) k = 0 , ∀ t ∈ T , ∀ r e ∈ Ψ r e (10f) ∑ t = 0 T 2 ∗ P t r e T ≥ 0 . 8 ∗ ( p k r e + p k + 1 r e + p k − 1 r e − E a d d e d , k − 1 r e ) ∀ k ≥ 0 , ∀ t ∈ T , ∀ r e ∈ Ψ r e (10g) x t r e ∈ { 0 , 1 } ∀ t ∈ T , ∀ r e ∈ Ψ r e Thermal model for HVAC appliances adds a Set-Point Temperature control to allow different operational modes, using a control signal adjustable by the DSR aggregator or the user that indicate to the HVAC appliance how to reach an specific temperature, where each temperature status is associated with a energy consumption value and a decision binary variable ( x i , t a c , H and x i , t a c , H ). Finally, HVAC set of restrictions HVAC s is presented in Eq. (11). Expressions (11a) and (11b) evaluate the temperature time evolution. Eq. (11c) limits the room temperature and Eqs. (11d), (11e) connect the temperature in the sub-hour problem with the expected temperature from first-stage. Eqs. (11f), (11g) calculate the required demand for the HVAC in k , k + 1 to compare the demand value and the expected demand with the expressions (11h) and (11i). A constant term is added in some restrictions to allow AC operation without break the problem feasibility. Finally, HVAC total energy consumption is calculated in (11k). (11a) T t r o o m = ( 1 − α a c ) ∗ T s t a r t r o o m A C + α a c ∗ T t − 1 O + β a c , H ∗ ∑ i N P i a c , H ∗ x i , t a c , H − β a c , F ∗ ∑ i N P i a c , F ∗ x i , t a c , F ∀ t = 0 , ∀ a c ∈ Ψ a c (11b) T t r o o m = ( 1 − α a c ) ∗ T t − 1 r o o m + α a c ∗ T t − 1 O + β a c , H ∗ ∑ i N P i a c , H ∗ x i , t a c , H − β a c , F ∗ ∑ i N P i a c , F ∗ x i , t a c , F ∀ t > 0 , ∀ a c ∈ Ψ a c (11c) T s e t r o o m − T b a n d ≤ T t r o o m ≤ T s e t r o o m + T b a n d ∀ t ∈ T , ∀ a c ∈ Ψ a c (11d) T k r o o m − 0 . 1 ≤ T t r o o m ≤ T k r o o m + 0 . 1 ∀ t = T 2 , ∀ a c ∈ Ψ a c (11e) T k + 1 r o o m − 0 . 1 ≤ T t r o o m ≤ T k + 1 r o o m + 0 . 1 ∀ t = T , ∀ a c ∈ Ψ a c (11f) P M , k a c = ∑ t = 1 T ∕ 2 ∑ i N 2 ∗ P i a c , M T ∗ x i , t a c , M ∀ a c , ∀ M ∈ { H , F } (11g) P M , k + 1 a c = ∑ T ∕ 2 T ∑ i N 2 ∗ P i a c , M T ∗ x i , t a c , M ∀ a c ∈ Ψ a c , ∀ M ∈ { H , F } (11h) 0 . 7 ∗ P M , k a c , H P ≤ P M , k a c ≤ 1 . 3 ∗ P M , k a c , H P ∀ a c ∈ Ψ a c , ∀ M ∈ { H , F } (11i) 0 . 7 ∗ P M , k + 1 a c , H P ≤ P M , k + 1 a c ≤ 1 . 3 ∗ P M , k + 1 a c , H P ∀ a c ∈ Ψ a c , ∀ M ∈ { H , F } (11j) P t a c = ∑ i N P i a c , H ∗ x i , t a c , H + P i a c , F ∗ x i , t a c , F ∀ t ∈ T , ∀ a c ∈ Ψ a c (11k) x i , t a c , H , x i , t a c , F ∈ { 0 , 1 } ∀ t ∈ T , ∀ i ∈ N , ∀ a c ∈ Ψ a c To avoid unexpected behavior, a new restriction set is introduced to control the Set-Point operation. First, Eq. (12a) allows only one operation mode per time-step and (12b) decides between heat or freeze mode in k , k + 1 time-step. Expressions from (12c) to (12f) limits the operation mode in the [ k , k + 1 ] hour to freeze or heat mode according to (12b). (12a) ∑ i N x i , t a c , H + ∑ i N x i , t a c , F ≤ 1 ∀ t ∈ T , ∀ a c ∈ Ψ a c (12b) H k n o p , a c = 1 − F k n o p , a c ∀ a c ∈ Ψ a c , ∀ k n ∈ { k , k + 1 } (12c) ∑ t = 1 T ∕ 2 ∑ i N x i , t a c , F ≤ 15 ∗ F k o p , a c ∀ a c ∈ Ψ a c (12d) ∑ T ∕ 2 T ∑ i N x i , t a c , F ≤ 15 ∗ F k + 1 o p , a c ∀ a c ∈ Ψ a c (12e) ∑ t = 1 T ∕ 2 ∑ i N x i , t a c , H ≤ 15 ∗ H k o p , a c ∀ a c ∈ Ψ a c (12f) ∑ T ∕ 2 T ∑ i N x i , t a c , H ≤ 15 ∗ H k + 1 o p , a c ∀ a c ∈ Ψ a c 2.2.3 Uninterruptible tasks The set of restrictions T s for uninterruptible tasks is the same set presented in the first-stage model, adapted to the second-stage evaluation horizon and time-step. Three different protocols are considered according to the time duration, assuming k as the task starting hour: \u2022 One hour or less: task operation is limited to the k hour. \u2022 Between one and two hours: The sub-hourly algorithm could take 3 possible routes. At the k − 1 hour, is evaluated only the first hour of the task. In the k hour, the task can start in k and finish in k + 1 , without additional conditions. Finally, in the k + 1 hour and previous to the decision model formulation the algorithm consider the previous operation of the task appliance and force the remaining operation on k + 1 . \u2022 Duration higher than 2 hours: the task start in the first time-step of the k hour and evaluates its operation until its end. Tasks with an operation time lower than 2 h provide a higher flexibility, even though its flexibility could produce a demand deviation. The second-stage model can modify the appliance start, so, the expected demand in k and k + 1 changes and produces a deviation from the first-stage expected demand. 2.2.4 Storage and deferrable appliances In the second-stage model, pool pumps and EV appliances need to satisfy a specific amount of energy determined by the first-stage problem, for this reason, it can be modeled by the same expressions. So, the set of restrictions PP s and EV s are expressed as a unique model in (13), where Eqs. (13a) and (13b) evaluate if the energy delivered in k , k + 1 is higher than the expected value, while (13c) calculates the energy demand per time-step. (13a) ∑ t = 1 T ∕ 2 2 ∗ P m a x p p , e v T ∗ x t p p , e v ≥ P k p p , e v ∀ p p , e v ∈ { Ψ p p , Ψ e v } (13b) ∑ T 2 + 1 T 2 ∗ P m a x p p , e v T ∗ x t p p , e v ≥ P k + 1 p p , e v ∀ p p , e v ∈ { Ψ p p , Ψ e v } (13c) P t p p , e v = P m a x p p , e v ∗ x t p p , e v ∀ p p , e v ∈ { Ψ p p , Ψ e v } (13d) x t p p , e v ∈ { 0 , 1 } ∀ t ∈ T , ∀ p p , e v ∈ { Ψ p p , Ψ e v } This formulation could exceed the P k p p , e v expected value, so it is necessary to subtract the additional energy delivered in the k time-step to P k + 1 p p , e v . 3 Test environment A test environment to simulate and evaluate the proposed HEMS decision models is built based on energy measurements data from Pecan Street Inc. Dataport 2019. The electrical consumption of 4 different homes is considered, where each household corresponds to a representative 28-day month (March, June, September and December). In total, 112 days are evaluated. If it is considered each day as a case for the first-stage, 23 cases per day are evaluated in the second-stage (2576 cases in total). Energy consumption data from Dataport includes the energy extracted from the grid and consumption from different home appliances with a 1-minute temporal granularity. A set of home appliances are modeled based on Dataport measurements. Commercial EV models are considered on the set of EVs. For the temperature forecast, historical outdoor air temperature from NOAA NCEI Climate Normals [32] is used, data station: Los Angeles Airport. The test case generation process is divided into 2 parts: Available appliances per household and the demand trajectory generation. Appliances per house have been chosen randomly. The case generation process flowchart is shown in Fig. 3, where the generated test case includes between 7 and 13 different appliances. Only a few set of properties per appliance are considered to generate the demand trajectory sets, these properties can be found in the Appendix, presented by appliance. For cases with a higher number of appliances such as a 17 task case and multiple thermal appliances case, the generation test case follow the same process and increases the number of randomized appliances. The increase in the number of appliances per case is to understand how the decision model can respond to stressful cases, evaluating the convergence and solving time. The proposed cases will be evaluated on a Raspberry Pi 3b+ (Quad-core ARM Cortex A53 processor, USD$35). To compare the computational performance of the different SBCs the standard case will be evaluated in three platforms: Raspberry Pi Zero W (Single-core ARM11 processor, USD$10), Raspberry Pi 3b+ and Nvidia Jetson Nano (Quad-core ARM Cortex A57 processor, USD$99). Prices per SBC in retail stores at January 2021 are presented as a reference. The case studies are coded on Python using Pyomo libraries [33,34]. The solver Coin-OR CBC [35] with a 0.02 MIP GAP is chose to solve MILP problems in ARM platforms. 4 Results The proposed model schedules the appliances according to the received demand trajectory set. For illustrative purposes, the demand trajectory set, scheduling, expected and second stage real demand are shown in Fig. 4 for one day in September. The expected hourly demand is calculated by the first stage of the model and the sub-hourly mean demand is the real demand per hour, where both demand curves belong to the demand trajectory set most of the time. One of the most relevant points to use demand trajectory sets as a control signal is the capacity of the HEMS to adapt its demand per hour to the requirements from the DSR aggregator, as shown in Fig. 4, the aggregator requests two significant decreases in the demand between hour 13\u201314 and 17\u201318 and the decision model schedules its appliances to fulfill this request. The proposed decision model for a HEMS offers a feasible solution to the scheduling problem in a limited time. The first-stage mean solve time for the proposed testcase is 1.64 s with a maximum time of 12.69 s (Raspberry Pi 3b+, Cortex A-53 processor, one thread). Second-stage solving time and the reached GAP are shown in Fig. 5. The convergence GAP in the second-stage problem is reached by 96.64% of the cases, whereof 95.03% of cases converges in less than 100 s. For the remaining 3.34%, the model proposes a feasible but no optimal solution. This results indicate that the model can reschedule demand under a DSR aggregator request in less than 2 min in, at least the 95% of the studied cases; allowing the DSR aggregator to potentially participate in 5-minutes ancillary services markets or modify the time-steps duration (2, 4 and 6 min) on the second-stage problem, keeping the number of time-steps. If it is compared the expected and simulated demand, in the first-stage the simulated demand exceed the allowed demand block in the 3.2% of the studied hours, with a maximum deviation of 280 Wh. In the second-stage a demand deviation over 10% from the expected demand block occurs in less than 12% of the analyzed cases. However, cases with a high deviation percentage are mainly associated with low demand hours, deforming artificially the total deviation percentage. These effects can be seen on Fig. 6, where the standard deviation does not increases with the expected demand and can be considered as an independent value. For this reason, the proposed model could have some difficulties to follow trajectories with few appliances. Additionally, the effect of the 2-hour uninterruptible tasks and the appliance start increases the demand deviations on the second-stage, those which could be avoided if the model force the task start at the beginning of the hour, losing demand peak regulation capabilities. A second option is consider the two-hour appliances with a different model that allow to the HEMS to assign a variable demand per hour, only if the sum of the two-hour demand is the required demand by the appliance. In addition, a low demand deviation in first-stage problem could be possible if the demand trajectory generator model has enough information about appliances flexibility, user behavior, weather and other events that can change the expected demand. The proposed model is sensitive to the DSR aggregator capacity to determine a feasible trajectory for every HEMS with a minimal information, so if the Aggregator provides a complex trajectory, the HEMS could schedule multiple appliances in the same time-step, increasing the demand deviation in some cases because the actual formulation does not penalizes a demand peak in the first-stage. A plausible option is change the objective function for a piece-wise function to penalize deviations according to the demand size, but the aggregator\u2019s capacity to model the appliance properties, user behavior and other attributes that can affect the final demand can difficult the use of additional penalties. From the analyzed appliances, the thermal appliances are the most computationally complex type of appliance due to the temperature dependence in each time-step and its operation decisions. Add an additional thermal appliance increases the convergence time according to the number of binary variables in the model, reducing the number of feasible cases. Fig. 7 shows the accumulated percentage of cases with additional appliances according to the reached GAP. The standard test case shows a high percentage of cases that reaches convergence (98%, Cortex A-53 processor, one thread). Adding a refrigerator or HVAC appliance decreases the expected convergence percentage in, at least a 10%, associated with the increase in the binary variables included in the thermal models. In comparison, deferrable, interruptible and uninterruptible appliances implies a minor computational complexity to the decision model. These reductions can be exposed by a special test that increases the number of non-thermal loads to 17 appliances, in comparison with the 10 appliances analyzed on average in the standard test case. Fig. 7 shows GAP differences between the proposed test case, new 17 appliances case and previous evaluated thermal cases. The convergence percentage for the 17 appliances test is slightly lower than the standard case and much better than the two refrigerator case, plus, the convergence difference is increased if it is compared with 2 and 3 HVAC appliance cases. Finally, standard testcase and 3 HVAC appliances cases are evaluated with different ARM processor and number of threads. The results obtained are available in Fig. 8. For the standard case, each processor reach at least a 95% of cases with the expected GAP, where the oldest processor Broadcom BCM2835 (ARM11) took 172 s, seven times more than Cortex A-57 (23 s) using one thread, while the BCM2837 processor (Cortex A-53) it takes 43 s. Using a 4-thread configuration, the required time to reach the 95% convergence decreases for the processors A-53 and A-57 to 21 and 10 s. In comparison, for the 3 HVAC case with a higher computational complexity only A-57 and 4-thread A-53 processor can reach convergence in the 90% of cases, whilst one-thread configuration cannot reach a reliable schedule (20% of cases cannot converge in the limited time). These results indicate that if it is considered only the computational performance, 4 cores Cortex A-57 and its higher computational performance can solve the proposed model in less time for a broader range of households. However, by considering SBC prices, the ARM11 and Cortex A-53 processors with one core are the best options for reduced appliance problems, increasing the HEMS availability with a lower cost in hardware. In conclusion, the proposed two-stage decision model offers a feasible solution to scheduling different set of appliances, even if the algorithm cannot reach the convergence GAP in the expected time. The difficulties to reach the GAP are increased in cases with more thermal appliances. Change the acceptable GAP from 2% to 10% for low performance boards with multiple thermal appliances boost the percentage of cases that reach convergence in 6.67% (Cortex A-53, one thread) and 8.85% (ARM11 processor) and decreases the solve time, but always considering that the proposed solution is sub-optimal. If the convergence GAP remains at 2% in the second-stage, a problem with multiple thermal appliances limits the SBC that can offer a reliable solution to boards with A-57 and multi-core processors. In contrast, the high percentage of cases that reach the expected GAP for the standard test case indicates that the proposed problem can be solved with low-cost commercial SBC, decreasing hardware cost and simplifying HEMS design, even if the number of non-thermal appliances is increased, a single-core SBC could be enough to model a household with a high number of appliances. Another important factor in the SBC choice is the resolution time. Previously it was proposed a change in the model to consider time-steps with different time intervals (2, 4 and 6 min). It could be possible to model the HEMS decision problem with a resolution time lower than a minute if is used an A-57 quad-core processor and even lower times according to the advance in technology over the years or the use of powerful (and expensive) processors x86-64. Processors like Broadcom BCM2711 (quad-core Cortex-A72) in Raspberry Pi 4 and Kirin 990 Series (octa-core Cortex-A76/A55) could be the next step in order to increase the implementability and accessibility of the decision models. In addition, other HEMS heuristics or merit order algorithms could be included in the HEMS platform, running in parallel with the proposed model. 5 Conclusions A decision model for a HEMS is proposed to follow demand trajectory sets received from a demand aggregator and formulated to be implemented in low performance ARM architecture processors, using available SBC as a proof of concept. The decision problem formulation enables the HEMS to divide the scheduling of the appliances, the evaluation of the demand per hour and energy parameters, decreasing the computational complexity to evaluate a 24-hour HEMS decision model with a 4-minute time-step (360 time intervals). Results show how the proposed model can follow different demand trajectories, scheduling the set of available appliances and evaluates sub-hourly demand, reaching convergence in at least 96% of the proposed cases with a single-core Cortex-A53 processor until a 99.5% on a quad-core Cortex-A57 processor. For multiple thermal appliances only high performance ARM processors can solve the proposed problem with a reliable percentage of convergence. The proposed model can follow the received demand trajectories with some deviations in the 3.2% of the cases for the first-stage and a 12% in the second-stage. Results obtained demonstrate the proposed HEMS decision models applicability on low-power hardware, increasing the availability of the deployment of HEMS at a lower cost. Future work includes the evaluation of the joint operation of a number of HEMS with an aggregator to quantify the systemic benefits of the proposed models in comparison to other schemes such as direct load control or real-time prices. Additionally, the consideration of daily demand modeling and load flexibility properties to evaluate HEMS participation in different ancillary services markets along with a DSR aggregator. Other avenue for future work includes taking into account distributed renewable generation and Energy Storage System (ESS) to supply demand or sell energy to the grid into the HEMS decision model, assuming that the DSR aggregator could work as a Virtual Power Plant (VPP). Stochastic formulations for the HEMS decision models can be extended by consider uncertainty in the non-controllable demand, forecast for thermal loads and renewable distributed generation. Appendix Appliance properties In the test environment, different home appliances were modeled from the Pecan Street Dataport database. The properties for hourly models are shown per type of appliance. In the uninterruptible loads shown in Table A.1 the demand profile presents the expected demand per hour, the start and end hour time. EV properties are shown in Table A.2.Pool pump properties are shown in Table A.3 including the required energy per hour, maximum demand per hour and the hours where the appliance can be used. Finally, in Table A.4 are presented the thermal appliances used, which are considered as electrical appliances and its properties are based on regression models from measurements. References [1] Huang Y. Tian H. Wang L. Demand response for home energy management system Int J Electr Power Energy Syst 73 2015 448 455 10.1016/j.ijepes.2015.05.032 URL http://www.sciencedirect.com/science/article/pii/S0142061515002379 Y. Huang, H. Tian, L. Wang, http://www.sciencedirect.com/science/article/pii/S0142061515002379Demand response for home energy management system, International Journal of Electrical Power & Energy Systems 73 (2015) 448\u2013455. DOI: https://doi.org/10.1016/j.ijepes.2015.05.032. URL http://www.sciencedirect.com/science/article/pii/S0142061515002379 [2] Barth L. Ludwig N. Mengelkamp E. Staudt P. A comprehensive modelling framework for demand side flexibility in smart grids Comput Sci - Res Dev 33 1 2018 13 23 10.1007/s00450-017-0343-x L. Barth, N. Ludwig, E. Mengelkamp, P. Staudt, https://doi.org/10.1007/s00450-017-0343-xA comprehensive modelling framework for demand side flexibility in smart grids, Computer Science - Research and Development 33 (1) (2018) 13\u201323. DOI: 10.1007/s00450-017-0343-x. URL https://doi.org/10.1007/s00450-017-0343-x [3] Ostovar S. Moeini-Aghtaie M. Hadi M.B. Developing a new flexibility-based algorithm for home energy management system (HEMS) 2020 10th Smart grid conference (SGC) 2020 1 6 10.1109/SGC52076.2020.9335730 S. Ostovar, M. Moeini-Aghtaie, M. B. Hadi, Developing a new flexibility-based algorithm for home energy management system (hems), in: 2020 10th Smart Grid Conference (SGC), 2020, 1\u20136. DOI: 10.1109/SGC52076.2020.9335730. [4] Harder N. Qussous R. Weidlich A. The cost of providing operational flexibility from distributed energy resources Appl Energy 279 2020 115784 10.1016/j.apenergy.2020.115784 URL https://www.sciencedirect.com/science/article/pii/S030626192031268X N. Harder, R. Qussous, A. Weidlich, https://www.sciencedirect.com/science/article/pii/S030626192031268XThe cost of providing operational flexibility from distributed energy resources, Applied Energy 279 (2020) 115784. DOI: https://doi.org/10.1016/j.apenergy.2020.115784. URL https://www.sciencedirect.com/science/article/pii/S030626192031268X [5] De Coninck R. Helsen L. Quantification of flexibility in buildings by cost curves \u2013 Methodology and application Appl Energy 162 2016 653 665 10.1016/j.apenergy.2015.10.114 URL https://www.sciencedirect.com/science/article/pii/S0306261915013501 R. De Coninck, L. Helsen, https://www.sciencedirect.com/science/article/pii/S0306261915013501Quantification of flexibility in buildings by cost curves \u2013 methodology and application, Applied Energy 162 (2016) 653\u2013665. DOI: https://doi.org/10.1016/j.apenergy.2015.10.114. URL https://www.sciencedirect.com/science/article/pii/S0306261915013501 [6] Paterakis N.G. Erdinç O. Bakirtzis A.G. ao J.P.S.C. Optimal household appliances scheduling under day-ahead pricing and load-shaping demand response strategies IEEE Trans Ind Inf 11 6 2015 1509 1519 10.1109/TII.2015.2438534 N. G. Paterakis, O. Erdinç, A. G. Bakirtzis, J. P. S. Catalão, Optimal household appliances scheduling under day-ahead pricing and load-shaping demand response strategies, IEEE Transactions on Industrial Informatics 11 (6) (2015) 1509\u20131519. DOI: 10.1109/TII.2015.2438534. [7] Wenzel G. Negrete-Pincetic M. Olivares D.E. MacDonald J. Callaway D.S. Real-time charging strategies for an electric vehicle aggregator to provide ancillary services IEEE Trans Smart Grid 9 5 2018 5141 5151 10.1109/TSG.2017.2681961 G. Wenzel, M. Negrete-Pincetic, D. E. Olivares, J. MacDonald, D. S. Callaway, Real-time charging strategies for an electric vehicle aggregator to provide ancillary services, IEEE Transactions on Smart Grid 9 (5) (2018) 5141\u20135151. DOI: 10.1109/TSG.2017.2681961. [8] Garifi K. Baker K. Touri B. Christensen D. Stochastic model predictive control for demand response in a home energy management system 2018 IEEE power energy society general meeting (PESGM) 2018 1 5 10.1109/PESGM.2018.8586485 K. Garifi, K. Baker, B. Touri, D. Christensen, Stochastic model predictive control for demand response in a home energy management system, in: 2018 IEEE Power Energy Society General Meeting (PESGM), 2018, 1\u20135. DOI: 10.1109/PESGM.2018.8586485. [9] Ali S. Malik T.N. Raza A. Risk-averse home energy management system IEEE Access 8 2020 91779 91798 10.1109/ACCESS.2020.2994462 S. Ali, T. N. Malik, A. Raza, Risk-averse home energy management system, IEEE Access 8 (2020) 91779\u201391798. DOI: 10.1109/ACCESS.2020.2994462. [10] Zhang D. Li S. Sun M. O\u2019Neill Z. An optimal and learning-based demand response and home energy management system IEEE Trans Smart Grid 7 4 2016 1790 1801 10.1109/TSG.2016.2552169 D. Zhang, S. Li, M. Sun, Z. O\u2019Neill, An optimal and learning-based demand response and home energy management system, IEEE Transactions on Smart Grid 7 (4) (2016) 1790\u20131801. DOI: 10.1109/TSG.2016.2552169. [11] Xu X. Jia Y. Xu Y. Xu Z. Chai S. Lai C.S. A multi-agent reinforcement learning-based data-driven method for home energy management IEEE Trans Smart Grid 11 4 2020 3201 3211 10.1109/TSG.2020.2971427 X. Xu, Y. Jia, Y. Xu, Z. Xu, S. Chai, C. S. Lai, A multi-agent reinforcement learning-based data-driven method for home energy management, IEEE Transactions on Smart Grid 11 (4) (2020) 3201\u20133211. DOI: 10.1109/TSG.2020.2971427. [12] Alfaverh F. Denaï M. Sun Y. Demand response strategy based on reinforcement learning and fuzzy reasoning for home energy management IEEE Access 8 2020 39310 39321 10.1109/ACCESS.2020.2974286 F. Alfaverh, M. Denaï, Y. Sun, Demand response strategy based on reinforcement learning and fuzzy reasoning for home energy management, IEEE Access 8 (2020) 39310\u201339321. DOI: 10.1109/ACCESS.2020.2974286. [13] Sousa T. Lezama F. Soares J. Ramos S. Vale Z. A flexibility home energy management system to support agreggator requests in smart grids 2018 IEEE symposium series on computational intelligence (SSCI) 2018 1830 1836 10.1109/SSCI.2018.8628918 T. Sousa, F. Lezama, J. Soares, S. Ramos, Z. Vale, A flexibility home energy management system to support agreggator requests in smart grids, in: 2018 IEEE Symposium Series on Computational Intelligence (SSCI), 2018, 1830\u20131836. DOI: 10.1109/SSCI.2018.8628918. [14] Erdinc O. Tascikaraoglu A. Paterakis N. Catalao J.P.S. Novel incentive mechanism for end-users enrolled in DLC-based demand response programs within stochastic planning context IEEE Trans Ind Electron 2018 1 10.1109/TIE.2018.2811403 O. Erdinc, A. Tascikaraoglu, N. Paterakis, J. P. S. Catalao, Novel incentive mechanism for end-users enrolled in dlc-based demand response programs within stochastic planning context, IEEE Transactions on Industrial Electronics (2018) 1\u20131DOI: DOI: 10.1109/TIE.2018.2811403. [15] Erdinç O. Taşcıkaraoğlu and N. G. Paterakis and Y. Eren and J. P. S. Catalão A. End-user comfort oriented day-ahead planning for responsive residential HVAC demand aggregation considering weather forecasts IEEE Trans Smart Grid 8 1 2017 362 372 10.1109/TSG.2016.2556619 O. Erdinç, A. Tacıkaraoğlu, N. G. Paterakis, Y. Eren, J. P. S. Catalão, End-user comfort oriented day-ahead planning for responsive residential hvac demand aggregation considering weather forecasts, IEEE Transactions on Smart Grid 8 (1) (2017) 362\u2013372. DOI: 10.1109/TSG.2016.2556619. [16] Hu J. Cao J. Yong T. Guerrero J.M. Chen M.Z.Q. Li Y. Demand response load following of source and load systems IEEE Trans Control Syst Technol 25 5 2017 1586 1598 10.1109/TCST.2016.2615087 J. Hu, J. Cao, T. Yong, J. M. Guerrero, M. Z. Q. Chen, Y. Li, Demand response load following of source and load systems, IEEE Transactions on Control Systems Technology 25 (5) (2017) 1586\u20131598. DOI: 10.1109/TCST.2016.2615087. [17] Adhikari R. Pipattanasomporn M. Rahman S. An algorithm for optimal management of aggregated HVAC power demand using smart thermostats Appl Energy 217 2018 166 177 10.1016/j.apenergy.2018.02.085 URL http://www.sciencedirect.com/science/article/pii/S0306261918302101 R. Adhikari, M. Pipattanasomporn, S. Rahman, http://www.sciencedirect.com/science/article/pii/S0306261918302101An algorithm for optimal management of aggregated hvac power demand using smart thermostats, Applied Energy 217 (2018) 166\u2013177. DOI: https://doi.org/10.1016/j.apenergy.2018.02.085. URL http://www.sciencedirect.com/science/article/pii/S0306261918302101 [18] Javaid N. Naseem M. Rasheed M.B. Mahmood D. Khan S.A. Alrajeh N. Iqbal Z. A new heuristically optimized home energy management controller for smart grid Sustainable Cities Soc 34 2017 211 227 10.1016/j.scs.2017.06.009 URL http://www.sciencedirect.com/science/article/pii/S2210670717303074 N. Javaid, M. Naseem, M. B. Rasheed, D. Mahmood, S. A. Khan, N. Alrajeh, Z. Iqbal, http://www.sciencedirect.com/science/article/pii/S2210670717303074A new heuristically optimized home energy management controller for smart grid, Sustainable Cities and Society 34 (2017) 211\u2013227. DOI: https://doi.org/10.1016/j.scs.2017.06.009. URL http://www.sciencedirect.com/science/article/pii/S2210670717303074 [19] Shakeri M. Shayestegan M. Abunima H. Reza S.S. Akhtaruzzaman M. Alamoud A. Sopian K. Amin N. An intelligent system architecture in home energy management systems (HEMS) for efficient demand response in smart grid Energy Build 138 2017 154 164 10.1016/j.enbuild.2016.12.026 URL http://www.sciencedirect.com/science/article/pii/S0378778816318369 M. Shakeri, M. Shayestegan, H. Abunima, S. S. Reza, M. Akhtaruzzaman, A. Alamoud, K. Sopian, N. Amin, http://www.sciencedirect.com/science/article/pii/S0378778816318369An intelligent system architecture in home energy management systems (hems) for efficient demand response in smart grid, Energy and Buildings 138 (2017) 154\u2013164. DOI: https://doi.org/10.1016/j.enbuild.2016.12.026. URL http://www.sciencedirect.com/science/article/pii/S0378778816318369 [20] Merdanoğlu H. Yakıcı E. Doğan O.T. Duran S. Karatas M. Finding optimal schedules in a home energy management system Electr Power Syst Res 182 2020 106229 10.1016/j.epsr.2020.106229 URL https://www.sciencedirect.com/science/article/pii/S0378779620300365 H. Merdanoğlu, E. Yakıcı, O. T. Doğan, S. Duran, M. Karatas, https://www.sciencedirect.com/science/article/pii/S0378779620300365Finding optimal schedules in a home energy management system, Electric Power Systems Research 182 (2020) 106229. DOI: https://doi.org/10.1016/j.epsr.2020.106229. URL https://www.sciencedirect.com/science/article/pii/S0378779620300365 [21] Beaudin M. Zareipour H. Home energy management systems: A review of modelling and complexity Renew Sustain Energy Rev 45 2015 318 335 10.1016/j.rser.2015.01.046 URL http://www.sciencedirect.com/science/article/pii/S1364032115000568 M. Beaudin, H. Zareipour, http://www.sciencedirect.com/science/article/pii/S1364032115000568Home energy management systems: A review of modelling and complexity, Renewable and Sustainable Energy Reviews 45 (2015) 318\u2013335. DOI: https://doi.org/10.1016/j.rser.2015.01.046. URL http://www.sciencedirect.com/science/article/pii/S1364032115000568 [22] Etxegarai A. Bereziartua A. Dañobeitia J.A. Abarrategi O. Saldaña G. Impact of price-based demand response programs for residential customers 2018 19th IEEE mediterranean electrotechnical conference (MELECON) 2018 204 208 10.1109/MELCON.2018.8379094 A. Etxegarai, A. Bereziartua, J. A. Dañobeitia, O. Abarrategi, G. Saldaña, Impact of price-based demand response programs for residential customers, in: 2018 19th IEEE Mediterranean Electrotechnical Conference (MELECON), 2018, 204\u2013208. DOI: 10.1109/MELCON.2018.8379094. [23] Hu J. Cao J. Chen M.Z.Q. Yu J. Yao J. Yang S. Yong T. Load following of multiple heterogeneous TCL aggregators by centralized control IEEE Trans Power Syst 32 4 2017 3157 3167 10.1109/TPWRS.2016.2626315 J. Hu, J. Cao, M. Z. Q. Chen, J. Yu, J. Yao, S. Yang, T. Yong, Load following of multiple heterogeneous tcl aggregators by centralized control, IEEE Transactions on Power Systems 32 (4) (2017) 3157\u20133167. DOI: 10.1109/TPWRS.2016.2626315. [24] Wu X. Hu X. Teng Y. Qian S. Cheng R. Optimal integration of a hybrid solar-battery power source into smart home nanogrid with plug-in electric vehicle J Power Sources 363 2017 277 283 10.1016/j.jpowsour.2017.07.086 URL http://www.sciencedirect.com/science/article/pii/S0378775317309771 X. Wu, X. Hu, Y. Teng, S. Qian, R. Cheng, http://www.sciencedirect.com/science/article/pii/S0378775317309771Optimal integration of a hybrid solar-battery power source into smart home nanogrid with plug-in electric vehicle, Journal of Power Sources 363 (2017) 277\u2013283. DOI: https://doi.org/10.1016/j.jpowsour.2017.07.086. URL http://www.sciencedirect.com/science/article/pii/S0378775317309771 [25] Elkazaz M. Sumner M. Naghiyev E. Pholboon S. Davies R. Thomas D. A hierarchical two-stage energy management for a home microgrid using model predictive and real-time controllers Appl Energy 269 2020 115118 10.1016/j.apenergy.2020.115118 URL https://www.sciencedirect.com/science/article/pii/S0306261920306309 M. Elkazaz, M. Sumner, E. Naghiyev, S. Pholboon, R. Davies, D. Thomas, https://www.sciencedirect.com/science/article/pii/S0306261920306309A hierarchical two-stage energy management for a home microgrid using model predictive and real-time controllers, Applied Energy 269 (2020) 115118. DOI: https://doi.org/10.1016/j.apenergy.2020.115118. URL https://www.sciencedirect.com/science/article/pii/S0306261920306309 [26] Pippia T. Sijs J. De Schutter B. A parametrized model predictive control approach for microgrids 2018 IEEE conference on decision and control (CDC) 2018 3171 3176 10.1109/CDC.2018.8619078 T. Pippia, J. Sijs, B. De Schutter, A parametrized model predictive control approach for microgrids, in: 2018 IEEE Conference on Decision and Control (CDC), 2018, 3171\u20133176. DOI: 10.1109/CDC.2018.8619078. [27] Raimondi Cominesi S. Farina M. Giulioni L. Picasso B. Scattolini R. A two-layer stochastic model predictive control scheme for microgrids IEEE Trans Control Syst Technol 26 1 2018 1 13 10.1109/TCST.2017.2657606 S. Raimondi Cominesi, M. Farina, L. Giulioni, B. Picasso, R. Scattolini, A two-layer stochastic model predictive control scheme for microgrids, IEEE Transactions on Control Systems Technology 26 (1) (2018) 1\u201313. DOI: 10.1109/TCST.2017.2657606. [28] Luo F. Ranzi G. Wan C. Xu Z. Dong Z.Y. A multistage home energy management system with residential photovoltaic penetration IEEE Trans Ind Inf 15 1 2019 116 126 10.1109/TII.2018.2871159 F. Luo, G. Ranzi, C. Wan, Z. Xu, Z. Y. Dong, A multistage home energy management system with residential photovoltaic penetration, IEEE Transactions on Industrial Informatics 15 (1) (2019) 116\u2013126. DOI: 10.1109/TII.2018.2871159. [29] Wu D. Zeng H. Lu C. Boulet B. Two-stage energy management for office buildings with workplace ev charging and renewable energy IEEE Trans Transp Electrif 3 1 2017 225 237 10.1109/TTE.2017.2659626 D. Wu, H. Zeng, C. Lu, B. Boulet, Two-stage energy management for office buildings with workplace ev charging and renewable energy, IEEE Transactions on Transportation Electrification 3 (1) (2017) 225\u2013237. DOI: 10.1109/TTE.2017.2659626. [30] Aznavi S. Fajri P. Asrari A. Khazaei J. Two-stage energy management of smart homes in presence of intermittencies 2019 IEEE transportation electrification conference and expo (ITEC) 2019 1 5 10.1109/ITEC.2019.8790479 S. Aznavi, P. Fajri, A. Asrari, J. Khazaei, Two-stage energy management of smart homes in presence of intermittencies, in: 2019 IEEE Transportation Electrification Conference and Expo (ITEC), 2019, 1\u20135. DOI: 10.1109/ITEC.2019.8790479. [31] Javadi M.S. Nezhad A.E. Nardelli P.H. Gough M. Lotfi M. Santos S. Catalão J.P. Self-scheduling model for home energy management systems considering the end-users discomfort index within price-based demand response programs Sustainable Cities Soc 68 2021 102792 10.1016/j.scs.2021.102792 URL https://www.sciencedirect.com/science/article/pii/S2210670721000846 M. S. Javadi, A. E. Nezhad, P. H. Nardelli, M. Gough, M. Lotfi, S. Santos, J. P. Catalão, https://www.sciencedirect.com/science/article/pii/S2210670721000846Self-scheduling model for home energy management systems considering the end-users discomfort index within price-based demand response programs, Sustainable Cities and Society 68 (2021) 102792. DOI: https://doi.org/10.1016/j.scs.2021.102792. URL https://www.sciencedirect.com/science/article/pii/S2210670721000846 [32] Arguez A. Durre I. Applequist S. Squires M. Vose R. Yin X. Bilotta R. [NOAA\u2019s U.S. Climate normals (1981-2010) 2010 NOAA National Centers for Environmental Information. 10.7289/V5PN93JP A. Arguez, I. Durre, S. Applequist, M. Squires, R. Vose, X. Yin, R. Bilotta, [NOAA\u2019s U.S. Climate Normals (1981-2010), NOAA National Centers for Environmental Information.DOI: DOI: 10.7289/V5PN93JP. [33] Hart W.E. Watson J.-P. Woodruff D.L. Pyomo: modeling and solving mathematical programs in Python Math Program Comput 3 3 2011 219 260 W. E. Hart, J.-P. Watson, D. L. Woodruff, Pyomo: modeling and solving mathematical programs in python, Mathematical Programming Computation 3 (3) (2011) 219\u2013260. [34] Hart W.E. Laird C.D. Watson J.-P. Woodruff D.L. Hackebeil G.A. Nicholson B.L. Siirola J.D. Pyomo optimization modeling in python 2nd ed. 2017 Springer Publishing Company, Incorporated W. E. Hart, C. D. Laird, J.-P. Watson, D. L. Woodruff, G. A. Hackebeil, B. L. Nicholson, J. D. Siirola, Pyomo Optimization Modeling in Python, 2nd Edition, Springer Publishing Company, Incorporated, 2017. [35] Forrest J. Ralphs T. Vigerske S. LouHafer D.L. Kristjansson B. jpfasano B.L. EdwinStraver J.D. Lubin M. Santos H.G. rlougee Saltzman M. coin-or/Cbc: Version 2.9.9 2018 Zenodo 10.5281/zenodo.1317566 J. Forrest, T. Ralphs, S. Vigerske, LouHafer, B. Kristjansson, jpfasano, EdwinStraver, M. Lubin, H. G. Santos, rlougee, M. Saltzman, https://doi.org/10.5281/zenodo.1317566[coin-or/cbc: Version 2.9.9] (Jul. 2018). DOI: 10.5281/zenodo.1317566. URL https://doi.org/10.5281/zenodo.1317566",
    "scopus-id": "85105357703",
    "coredata": {
        "eid": "1-s2.0-S0306261921004542",
        "dc:description": "A low-complexity decision model for a Home Energy Management System is proposed to follow demand trajectory sets received from a Demand Side Response aggregator. This model is designed to reduce its computational complexity and being solved by low performance processors using available Single-Board Computers as a proof of concept. To decrease the computational complexity is proposed a two-stage model, where the first stage evaluates the hourly appliance scheduling using a relaxed set of restrictions, and the second stage evaluates a reduced set of appliances in a intra-hourly interval with a detailed characterization of the scheduled appliance properties. Simulations results show the effectiveness of the proposed algorithm to follow trajectories for different sets of home appliances and operational conditions. For the studied cases, the model presents deviations in the demand for the 3.2% of the cases in the first-stage and a 12% for the second-stage model. Results show that the proposed model can schedule available appliances according to the demand aggregator requirements in a limited solving time with diverse hardware.",
        "openArchiveArticle": "false",
        "prism:coverDate": "2021-07-15",
        "openaccessUserLicense": null,
        "prism:aggregationType": "Journal",
        "prism:url": "https://api.elsevier.com/content/article/pii/S0306261921004542",
        "dc:creator": [
            {
                "@_fa": "true",
                "$": "Salgado, Marcelo"
            },
            {
                "@_fa": "true",
                "$": "Negrete-Pincetic, Matias"
            },
            {
                "@_fa": "true",
                "$": "Lorca, Álvaro"
            },
            {
                "@_fa": "true",
                "$": "Olivares, Daniel"
            }
        ],
        "link": [
            {
                "@_fa": "true",
                "@rel": "self",
                "@href": "https://api.elsevier.com/content/article/pii/S0306261921004542"
            },
            {
                "@_fa": "true",
                "@rel": "scidir",
                "@href": "https://www.sciencedirect.com/science/article/pii/S0306261921004542"
            }
        ],
        "dc:format": "application/json",
        "openaccessType": null,
        "pii": "S0306-2619(21)00454-2",
        "prism:volume": "294",
        "articleNumber": "116985",
        "prism:publisher": "Elsevier Ltd.",
        "dc:title": "A low-complexity decision model for home energy management systems",
        "prism:copyright": "© 2021 Elsevier Ltd. All rights reserved.",
        "openaccess": "0",
        "prism:issn": "03062619",
        "dcterms:subject": [
            {
                "@_fa": "true",
                "$": "Home energy management system"
            },
            {
                "@_fa": "true",
                "$": "Demand response"
            },
            {
                "@_fa": "true",
                "$": "Load following"
            },
            {
                "@_fa": "true",
                "$": "Demand aggregator"
            }
        ],
        "openaccessArticle": "false",
        "prism:publicationName": "Applied Energy",
        "openaccessSponsorType": null,
        "prism:pageRange": "116985",
        "pubType": "fla",
        "prism:coverDisplayDate": "15 July 2021",
        "prism:doi": "10.1016/j.apenergy.2021.116985",
        "prism:startingPage": "116985",
        "dc:identifier": "doi:10.1016/j.apenergy.2021.116985",
        "openaccessSponsorName": null
    },
    "objects": {"object": [
        {
            "@category": "standard",
            "@height": "194",
            "@width": "624",
            "@_fa": "true",
            "$": "https://api.elsevier.com/content/object/eid/1-s2.0-S0306261921004542-gr4.jpg?httpAccept=%2A%2F%2A",
            "@multimediatype": "JPEG image file",
            "@type": "IMAGE-DOWNSAMPLED",
            "@size": "121472",
            "@ref": "gr4",
            "@mimetype": "image/jpeg"
        },
        {
            "@category": "standard",
            "@height": "819",
            "@width": "591",
            "@_fa": "true",
            "$": "https://api.elsevier.com/content/object/eid/1-s2.0-S0306261921004542-gr3.jpg?httpAccept=%2A%2F%2A",
            "@multimediatype": "JPEG image file",
            "@type": "IMAGE-DOWNSAMPLED",
            "@size": "172515",
            "@ref": "gr3",
            "@mimetype": "image/jpeg"
        },
        {
            "@category": "standard",
            "@height": "295",
            "@width": "376",
            "@_fa": "true",
            "$": "https://api.elsevier.com/content/object/eid/1-s2.0-S0306261921004542-gr6.jpg?httpAccept=%2A%2F%2A",
            "@multimediatype": "JPEG image file",
            "@type": "IMAGE-DOWNSAMPLED",
            "@size": "134092",
            "@ref": "gr6",
            "@mimetype": "image/jpeg"
        },
        {
            "@category": "standard",
            "@height": "291",
            "@width": "376",
            "@_fa": "true",
            "$": "https://api.elsevier.com/content/object/eid/1-s2.0-S0306261921004542-gr5.jpg?httpAccept=%2A%2F%2A",
            "@multimediatype": "JPEG image file",
            "@type": "IMAGE-DOWNSAMPLED",
            "@size": "100540",
            "@ref": "gr5",
            "@mimetype": "image/jpeg"
        },
        {
            "@category": "standard",
            "@height": "827",
            "@width": "489",
            "@_fa": "true",
            "$": "https://api.elsevier.com/content/object/eid/1-s2.0-S0306261921004542-gr2.jpg?httpAccept=%2A%2F%2A",
            "@multimediatype": "JPEG image file",
            "@type": "IMAGE-DOWNSAMPLED",
            "@size": "130245",
            "@ref": "gr2",
            "@mimetype": "image/jpeg"
        },
        {
            "@category": "standard",
            "@height": "211",
            "@width": "613",
            "@_fa": "true",
            "$": "https://api.elsevier.com/content/object/eid/1-s2.0-S0306261921004542-gr1.jpg?httpAccept=%2A%2F%2A",
            "@multimediatype": "JPEG image file",
            "@type": "IMAGE-DOWNSAMPLED",
            "@size": "108432",
            "@ref": "gr1",
            "@mimetype": "image/jpeg"
        },
        {
            "@category": "standard",
            "@height": "236",
            "@width": "591",
            "@_fa": "true",
            "$": "https://api.elsevier.com/content/object/eid/1-s2.0-S0306261921004542-gr8.jpg?httpAccept=%2A%2F%2A",
            "@multimediatype": "JPEG image file",
            "@type": "IMAGE-DOWNSAMPLED",
            "@size": "127928",
            "@ref": "gr8",
            "@mimetype": "image/jpeg"
        },
        {
            "@category": "standard",
            "@height": "297",
            "@width": "376",
            "@_fa": "true",
            "$": "https://api.elsevier.com/content/object/eid/1-s2.0-S0306261921004542-gr7.jpg?httpAccept=%2A%2F%2A",
            "@multimediatype": "JPEG image file",
            "@type": "IMAGE-DOWNSAMPLED",
            "@size": "118395",
            "@ref": "gr7",
            "@mimetype": "image/jpeg"
        },
        {
            "@category": "thumbnail",
            "@height": "68",
            "@width": "219",
            "@_fa": "true",
            "$": "https://api.elsevier.com/content/object/eid/1-s2.0-S0306261921004542-gr4.sml?httpAccept=%2A%2F%2A",
            "@multimediatype": "GIF image file",
            "@type": "IMAGE-THUMBNAIL",
            "@size": "74230",
            "@ref": "gr4",
            "@mimetype": "image/gif"
        },
        {
            "@category": "thumbnail",
            "@height": "163",
            "@width": "118",
            "@_fa": "true",
            "$": "https://api.elsevier.com/content/object/eid/1-s2.0-S0306261921004542-gr3.sml?httpAccept=%2A%2F%2A",
            "@multimediatype": "GIF image file",
            "@type": "IMAGE-THUMBNAIL",
            "@size": "75143",
            "@ref": "gr3",
            "@mimetype": "image/gif"
        },
        {
            "@category": "thumbnail",
            "@height": "164",
            "@width": "209",
            "@_fa": "true",
            "$": "https://api.elsevier.com/content/object/eid/1-s2.0-S0306261921004542-gr6.sml?httpAccept=%2A%2F%2A",
            "@multimediatype": "GIF image file",
            "@type": "IMAGE-THUMBNAIL",
            "@size": "83522",
            "@ref": "gr6",
            "@mimetype": "image/gif"
        },
        {
            "@category": "thumbnail",
            "@height": "164",
            "@width": "212",
            "@_fa": "true",
            "$": "https://api.elsevier.com/content/object/eid/1-s2.0-S0306261921004542-gr5.sml?httpAccept=%2A%2F%2A",
            "@multimediatype": "GIF image file",
            "@type": "IMAGE-THUMBNAIL",
            "@size": "75076",
            "@ref": "gr5",
            "@mimetype": "image/gif"
        },
        {
            "@category": "thumbnail",
            "@height": "164",
            "@width": "97",
            "@_fa": "true",
            "$": "https://api.elsevier.com/content/object/eid/1-s2.0-S0306261921004542-gr2.sml?httpAccept=%2A%2F%2A",
            "@multimediatype": "GIF image file",
            "@type": "IMAGE-THUMBNAIL",
            "@size": "70961",
            "@ref": "gr2",
            "@mimetype": "image/gif"
        },
        {
            "@category": "thumbnail",
            "@height": "75",
            "@width": "219",
            "@_fa": "true",
            "$": "https://api.elsevier.com/content/object/eid/1-s2.0-S0306261921004542-gr1.sml?httpAccept=%2A%2F%2A",
            "@multimediatype": "GIF image file",
            "@type": "IMAGE-THUMBNAIL",
            "@size": "72726",
            "@ref": "gr1",
            "@mimetype": "image/gif"
        },
        {
            "@category": "thumbnail",
            "@height": "88",
            "@width": "219",
            "@_fa": "true",
            "$": "https://api.elsevier.com/content/object/eid/1-s2.0-S0306261921004542-gr8.sml?httpAccept=%2A%2F%2A",
            "@multimediatype": "GIF image file",
            "@type": "IMAGE-THUMBNAIL",
            "@size": "75171",
            "@ref": "gr8",
            "@mimetype": "image/gif"
        },
        {
            "@category": "thumbnail",
            "@height": "164",
            "@width": "207",
            "@_fa": "true",
            "$": "https://api.elsevier.com/content/object/eid/1-s2.0-S0306261921004542-gr7.sml?httpAccept=%2A%2F%2A",
            "@multimediatype": "GIF image file",
            "@type": "IMAGE-THUMBNAIL",
            "@size": "79435",
            "@ref": "gr7",
            "@mimetype": "image/gif"
        },
        {
            "@category": "high",
            "@height": "861",
            "@width": "2765",
            "@_fa": "true",
            "$": "https://api.elsevier.com/content/object/eid/1-s2.0-S0306261921004542-gr4_lrg.jpg?httpAccept=%2A%2F%2A",
            "@multimediatype": "JPEG image file",
            "@type": "IMAGE-HIGH-RES",
            "@size": "431624",
            "@ref": "gr4",
            "@mimetype": "image/jpeg"
        },
        {
            "@category": "high",
            "@height": "3626",
            "@width": "2618",
            "@_fa": "true",
            "$": "https://api.elsevier.com/content/object/eid/1-s2.0-S0306261921004542-gr3_lrg.jpg?httpAccept=%2A%2F%2A",
            "@multimediatype": "JPEG image file",
            "@type": "IMAGE-HIGH-RES",
            "@size": "828078",
            "@ref": "gr3",
            "@mimetype": "image/jpeg"
        },
        {
            "@category": "high",
            "@height": "1307",
            "@width": "1667",
            "@_fa": "true",
            "$": "https://api.elsevier.com/content/object/eid/1-s2.0-S0306261921004542-gr6_lrg.jpg?httpAccept=%2A%2F%2A",
            "@multimediatype": "JPEG image file",
            "@type": "IMAGE-HIGH-RES",
            "@size": "474235",
            "@ref": "gr6",
            "@mimetype": "image/jpeg"
        },
        {
            "@category": "high",
            "@height": "1291",
            "@width": "1668",
            "@_fa": "true",
            "$": "https://api.elsevier.com/content/object/eid/1-s2.0-S0306261921004542-gr5_lrg.jpg?httpAccept=%2A%2F%2A",
            "@multimediatype": "JPEG image file",
            "@type": "IMAGE-HIGH-RES",
            "@size": "264984",
            "@ref": "gr5",
            "@mimetype": "image/jpeg"
        },
        {
            "@category": "high",
            "@height": "3663",
            "@width": "2167",
            "@_fa": "true",
            "$": "https://api.elsevier.com/content/object/eid/1-s2.0-S0306261921004542-gr2_lrg.jpg?httpAccept=%2A%2F%2A",
            "@multimediatype": "JPEG image file",
            "@type": "IMAGE-HIGH-RES",
            "@size": "526586",
            "@ref": "gr2",
            "@mimetype": "image/jpeg"
        },
        {
            "@category": "high",
            "@height": "936",
            "@width": "2716",
            "@_fa": "true",
            "$": "https://api.elsevier.com/content/object/eid/1-s2.0-S0306261921004542-gr1_lrg.jpg?httpAccept=%2A%2F%2A",
            "@multimediatype": "JPEG image file",
            "@type": "IMAGE-HIGH-RES",
            "@size": "355684",
            "@ref": "gr1",
            "@mimetype": "image/jpeg"
        },
        {
            "@category": "high",
            "@height": "1047",
            "@width": "2617",
            "@_fa": "true",
            "$": "https://api.elsevier.com/content/object/eid/1-s2.0-S0306261921004542-gr8_lrg.jpg?httpAccept=%2A%2F%2A",
            "@multimediatype": "JPEG image file",
            "@type": "IMAGE-HIGH-RES",
            "@size": "481164",
            "@ref": "gr8",
            "@mimetype": "image/jpeg"
        },
        {
            "@category": "high",
            "@height": "1318",
            "@width": "1667",
            "@_fa": "true",
            "$": "https://api.elsevier.com/content/object/eid/1-s2.0-S0306261921004542-gr7_lrg.jpg?httpAccept=%2A%2F%2A",
            "@multimediatype": "JPEG image file",
            "@type": "IMAGE-HIGH-RES",
            "@size": "386165",
            "@ref": "gr7",
            "@mimetype": "image/jpeg"
        },
        {
            "@category": "thumbnail",
            "@_fa": "true",
            "$": "https://api.elsevier.com/content/object/eid/1-s2.0-S0306261921004542-si1.svg?httpAccept=%2A%2F%2A",
            "@multimediatype": "Scalable Vector Graphics file",
            "@type": "ALTIMG",
            "@size": "3799",
            "@ref": "si1",
            "@mimetype": "image/svg+xml"
        },
        {
            "@category": "thumbnail",
            "@_fa": "true",
            "$": "https://api.elsevier.com/content/object/eid/1-s2.0-S0306261921004542-si10.svg?httpAccept=%2A%2F%2A",
            "@multimediatype": "Scalable Vector Graphics file",
            "@type": "ALTIMG",
            "@size": "1094",
            "@ref": "si10",
            "@mimetype": "image/svg+xml"
        },
        {
            "@category": "thumbnail",
            "@_fa": "true",
            "$": "https://api.elsevier.com/content/object/eid/1-s2.0-S0306261921004542-si100.svg?httpAccept=%2A%2F%2A",
            "@multimediatype": "Scalable Vector Graphics file",
            "@type": "ALTIMG",
            "@size": "20020",
            "@ref": "si100",
            "@mimetype": "image/svg+xml"
        },
        {
            "@category": "thumbnail",
            "@_fa": "true",
            "$": "https://api.elsevier.com/content/object/eid/1-s2.0-S0306261921004542-si101.svg?httpAccept=%2A%2F%2A",
            "@multimediatype": "Scalable Vector Graphics file",
            "@type": "ALTIMG",
            "@size": "15417",
            "@ref": "si101",
            "@mimetype": "image/svg+xml"
        },
        {
            "@category": "thumbnail",
            "@_fa": "true",
            "$": "https://api.elsevier.com/content/object/eid/1-s2.0-S0306261921004542-si102.svg?httpAccept=%2A%2F%2A",
            "@multimediatype": "Scalable Vector Graphics file",
            "@type": "ALTIMG",
            "@size": "22819",
            "@ref": "si102",
            "@mimetype": "image/svg+xml"
        },
        {
            "@category": "thumbnail",
            "@_fa": "true",
            "$": "https://api.elsevier.com/content/object/eid/1-s2.0-S0306261921004542-si103.svg?httpAccept=%2A%2F%2A",
            "@multimediatype": "Scalable Vector Graphics file",
            "@type": "ALTIMG",
            "@size": "18522",
            "@ref": "si103",
            "@mimetype": "image/svg+xml"
        },
        {
            "@category": "thumbnail",
            "@_fa": "true",
            "$": "https://api.elsevier.com/content/object/eid/1-s2.0-S0306261921004542-si104.svg?httpAccept=%2A%2F%2A",
            "@multimediatype": "Scalable Vector Graphics file",
            "@type": "ALTIMG",
            "@size": "20709",
            "@ref": "si104",
            "@mimetype": "image/svg+xml"
        },
        {
            "@category": "thumbnail",
            "@_fa": "true",
            "$": "https://api.elsevier.com/content/object/eid/1-s2.0-S0306261921004542-si105.svg?httpAccept=%2A%2F%2A",
            "@multimediatype": "Scalable Vector Graphics file",
            "@type": "ALTIMG",
            "@size": "24053",
            "@ref": "si105",
            "@mimetype": "image/svg+xml"
        },
        {
            "@category": "thumbnail",
            "@_fa": "true",
            "$": "https://api.elsevier.com/content/object/eid/1-s2.0-S0306261921004542-si106.svg?httpAccept=%2A%2F%2A",
            "@multimediatype": "Scalable Vector Graphics file",
            "@type": "ALTIMG",
            "@size": "23916",
            "@ref": "si106",
            "@mimetype": "image/svg+xml"
        },
        {
            "@category": "thumbnail",
            "@_fa": "true",
            "$": "https://api.elsevier.com/content/object/eid/1-s2.0-S0306261921004542-si107.svg?httpAccept=%2A%2F%2A",
            "@multimediatype": "Scalable Vector Graphics file",
            "@type": "ALTIMG",
            "@size": "7672",
            "@ref": "si107",
            "@mimetype": "image/svg+xml"
        },
        {
            "@category": "thumbnail",
            "@_fa": "true",
            "$": "https://api.elsevier.com/content/object/eid/1-s2.0-S0306261921004542-si108.svg?httpAccept=%2A%2F%2A",
            "@multimediatype": "Scalable Vector Graphics file",
            "@type": "ALTIMG",
            "@size": "2371",
            "@ref": "si108",
            "@mimetype": "image/svg+xml"
        },
        {
            "@category": "thumbnail",
            "@_fa": "true",
            "$": "https://api.elsevier.com/content/object/eid/1-s2.0-S0306261921004542-si11.svg?httpAccept=%2A%2F%2A",
            "@multimediatype": "Scalable Vector Graphics file",
            "@type": "ALTIMG",
            "@size": "5370",
            "@ref": "si11",
            "@mimetype": "image/svg+xml"
        },
        {
            "@category": "thumbnail",
            "@_fa": "true",
            "$": "https://api.elsevier.com/content/object/eid/1-s2.0-S0306261921004542-si110.svg?httpAccept=%2A%2F%2A",
            "@multimediatype": "Scalable Vector Graphics file",
            "@type": "ALTIMG",
            "@size": "5461",
            "@ref": "si110",
            "@mimetype": "image/svg+xml"
        },
        {
            "@category": "thumbnail",
            "@_fa": "true",
            "$": "https://api.elsevier.com/content/object/eid/1-s2.0-S0306261921004542-si113.svg?httpAccept=%2A%2F%2A",
            "@multimediatype": "Scalable Vector Graphics file",
            "@type": "ALTIMG",
            "@size": "14303",
            "@ref": "si113",
            "@mimetype": "image/svg+xml"
        },
        {
            "@category": "thumbnail",
            "@_fa": "true",
            "$": "https://api.elsevier.com/content/object/eid/1-s2.0-S0306261921004542-si114.svg?httpAccept=%2A%2F%2A",
            "@multimediatype": "Scalable Vector Graphics file",
            "@type": "ALTIMG",
            "@size": "18960",
            "@ref": "si114",
            "@mimetype": "image/svg+xml"
        },
        {
            "@category": "thumbnail",
            "@_fa": "true",
            "$": "https://api.elsevier.com/content/object/eid/1-s2.0-S0306261921004542-si115.svg?httpAccept=%2A%2F%2A",
            "@multimediatype": "Scalable Vector Graphics file",
            "@type": "ALTIMG",
            "@size": "19181",
            "@ref": "si115",
            "@mimetype": "image/svg+xml"
        },
        {
            "@category": "thumbnail",
            "@_fa": "true",
            "$": "https://api.elsevier.com/content/object/eid/1-s2.0-S0306261921004542-si116.svg?httpAccept=%2A%2F%2A",
            "@multimediatype": "Scalable Vector Graphics file",
            "@type": "ALTIMG",
            "@size": "16880",
            "@ref": "si116",
            "@mimetype": "image/svg+xml"
        },
        {
            "@category": "thumbnail",
            "@_fa": "true",
            "$": "https://api.elsevier.com/content/object/eid/1-s2.0-S0306261921004542-si117.svg?httpAccept=%2A%2F%2A",
            "@multimediatype": "Scalable Vector Graphics file",
            "@type": "ALTIMG",
            "@size": "16435",
            "@ref": "si117",
            "@mimetype": "image/svg+xml"
        },
        {
            "@category": "thumbnail",
            "@_fa": "true",
            "$": "https://api.elsevier.com/content/object/eid/1-s2.0-S0306261921004542-si118.svg?httpAccept=%2A%2F%2A",
            "@multimediatype": "Scalable Vector Graphics file",
            "@type": "ALTIMG",
            "@size": "16987",
            "@ref": "si118",
            "@mimetype": "image/svg+xml"
        },
        {
            "@category": "thumbnail",
            "@_fa": "true",
            "$": "https://api.elsevier.com/content/object/eid/1-s2.0-S0306261921004542-si119.svg?httpAccept=%2A%2F%2A",
            "@multimediatype": "Scalable Vector Graphics file",
            "@type": "ALTIMG",
            "@size": "17207",
            "@ref": "si119",
            "@mimetype": "image/svg+xml"
        },
        {
            "@category": "thumbnail",
            "@_fa": "true",
            "$": "https://api.elsevier.com/content/object/eid/1-s2.0-S0306261921004542-si12.svg?httpAccept=%2A%2F%2A",
            "@multimediatype": "Scalable Vector Graphics file",
            "@type": "ALTIMG",
            "@size": "7789",
            "@ref": "si12",
            "@mimetype": "image/svg+xml"
        },
        {
            "@category": "thumbnail",
            "@_fa": "true",
            "$": "https://api.elsevier.com/content/object/eid/1-s2.0-S0306261921004542-si120.svg?httpAccept=%2A%2F%2A",
            "@multimediatype": "Scalable Vector Graphics file",
            "@type": "ALTIMG",
            "@size": "17714",
            "@ref": "si120",
            "@mimetype": "image/svg+xml"
        },
        {
            "@category": "thumbnail",
            "@_fa": "true",
            "$": "https://api.elsevier.com/content/object/eid/1-s2.0-S0306261921004542-si122.svg?httpAccept=%2A%2F%2A",
            "@multimediatype": "Scalable Vector Graphics file",
            "@type": "ALTIMG",
            "@size": "11317",
            "@ref": "si122",
            "@mimetype": "image/svg+xml"
        },
        {
            "@category": "thumbnail",
            "@_fa": "true",
            "$": "https://api.elsevier.com/content/object/eid/1-s2.0-S0306261921004542-si124.svg?httpAccept=%2A%2F%2A",
            "@multimediatype": "Scalable Vector Graphics file",
            "@type": "ALTIMG",
            "@size": "2400",
            "@ref": "si124",
            "@mimetype": "image/svg+xml"
        },
        {
            "@category": "thumbnail",
            "@_fa": "true",
            "$": "https://api.elsevier.com/content/object/eid/1-s2.0-S0306261921004542-si125.svg?httpAccept=%2A%2F%2A",
            "@multimediatype": "Scalable Vector Graphics file",
            "@type": "ALTIMG",
            "@size": "11888",
            "@ref": "si125",
            "@mimetype": "image/svg+xml"
        },
        {
            "@category": "thumbnail",
            "@_fa": "true",
            "$": "https://api.elsevier.com/content/object/eid/1-s2.0-S0306261921004542-si126.svg?httpAccept=%2A%2F%2A",
            "@multimediatype": "Scalable Vector Graphics file",
            "@type": "ALTIMG",
            "@size": "14422",
            "@ref": "si126",
            "@mimetype": "image/svg+xml"
        },
        {
            "@category": "thumbnail",
            "@_fa": "true",
            "$": "https://api.elsevier.com/content/object/eid/1-s2.0-S0306261921004542-si127.svg?httpAccept=%2A%2F%2A",
            "@multimediatype": "Scalable Vector Graphics file",
            "@type": "ALTIMG",
            "@size": "15527",
            "@ref": "si127",
            "@mimetype": "image/svg+xml"
        },
        {
            "@category": "thumbnail",
            "@_fa": "true",
            "$": "https://api.elsevier.com/content/object/eid/1-s2.0-S0306261921004542-si128.svg?httpAccept=%2A%2F%2A",
            "@multimediatype": "Scalable Vector Graphics file",
            "@type": "ALTIMG",
            "@size": "2633",
            "@ref": "si128",
            "@mimetype": "image/svg+xml"
        },
        {
            "@category": "thumbnail",
            "@_fa": "true",
            "$": "https://api.elsevier.com/content/object/eid/1-s2.0-S0306261921004542-si129.svg?httpAccept=%2A%2F%2A",
            "@multimediatype": "Scalable Vector Graphics file",
            "@type": "ALTIMG",
            "@size": "3678",
            "@ref": "si129",
            "@mimetype": "image/svg+xml"
        },
        {
            "@category": "thumbnail",
            "@_fa": "true",
            "$": "https://api.elsevier.com/content/object/eid/1-s2.0-S0306261921004542-si130.svg?httpAccept=%2A%2F%2A",
            "@multimediatype": "Scalable Vector Graphics file",
            "@type": "ALTIMG",
            "@size": "6920",
            "@ref": "si130",
            "@mimetype": "image/svg+xml"
        },
        {
            "@category": "thumbnail",
            "@_fa": "true",
            "$": "https://api.elsevier.com/content/object/eid/1-s2.0-S0306261921004542-si133.svg?httpAccept=%2A%2F%2A",
            "@multimediatype": "Scalable Vector Graphics file",
            "@type": "ALTIMG",
            "@size": "12655",
            "@ref": "si133",
            "@mimetype": "image/svg+xml"
        },
        {
            "@category": "thumbnail",
            "@_fa": "true",
            "$": "https://api.elsevier.com/content/object/eid/1-s2.0-S0306261921004542-si134.svg?httpAccept=%2A%2F%2A",
            "@multimediatype": "Scalable Vector Graphics file",
            "@type": "ALTIMG",
            "@size": "16433",
            "@ref": "si134",
            "@mimetype": "image/svg+xml"
        },
        {
            "@category": "thumbnail",
            "@_fa": "true",
            "$": "https://api.elsevier.com/content/object/eid/1-s2.0-S0306261921004542-si135.svg?httpAccept=%2A%2F%2A",
            "@multimediatype": "Scalable Vector Graphics file",
            "@type": "ALTIMG",
            "@size": "14281",
            "@ref": "si135",
            "@mimetype": "image/svg+xml"
        },
        {
            "@category": "thumbnail",
            "@_fa": "true",
            "$": "https://api.elsevier.com/content/object/eid/1-s2.0-S0306261921004542-si136.svg?httpAccept=%2A%2F%2A",
            "@multimediatype": "Scalable Vector Graphics file",
            "@type": "ALTIMG",
            "@size": "14510",
            "@ref": "si136",
            "@mimetype": "image/svg+xml"
        },
        {
            "@category": "thumbnail",
            "@_fa": "true",
            "$": "https://api.elsevier.com/content/object/eid/1-s2.0-S0306261921004542-si137.svg?httpAccept=%2A%2F%2A",
            "@multimediatype": "Scalable Vector Graphics file",
            "@type": "ALTIMG",
            "@size": "3844",
            "@ref": "si137",
            "@mimetype": "image/svg+xml"
        },
        {
            "@category": "thumbnail",
            "@_fa": "true",
            "$": "https://api.elsevier.com/content/object/eid/1-s2.0-S0306261921004542-si138.svg?httpAccept=%2A%2F%2A",
            "@multimediatype": "Scalable Vector Graphics file",
            "@type": "ALTIMG",
            "@size": "7440",
            "@ref": "si138",
            "@mimetype": "image/svg+xml"
        },
        {
            "@category": "thumbnail",
            "@_fa": "true",
            "$": "https://api.elsevier.com/content/object/eid/1-s2.0-S0306261921004542-si139.svg?httpAccept=%2A%2F%2A",
            "@multimediatype": "Scalable Vector Graphics file",
            "@type": "ALTIMG",
            "@size": "17762",
            "@ref": "si139",
            "@mimetype": "image/svg+xml"
        },
        {
            "@category": "thumbnail",
            "@_fa": "true",
            "$": "https://api.elsevier.com/content/object/eid/1-s2.0-S0306261921004542-si14.svg?httpAccept=%2A%2F%2A",
            "@multimediatype": "Scalable Vector Graphics file",
            "@type": "ALTIMG",
            "@size": "3389",
            "@ref": "si14",
            "@mimetype": "image/svg+xml"
        },
        {
            "@category": "thumbnail",
            "@_fa": "true",
            "$": "https://api.elsevier.com/content/object/eid/1-s2.0-S0306261921004542-si140.svg?httpAccept=%2A%2F%2A",
            "@multimediatype": "Scalable Vector Graphics file",
            "@type": "ALTIMG",
            "@size": "21354",
            "@ref": "si140",
            "@mimetype": "image/svg+xml"
        },
        {
            "@category": "thumbnail",
            "@_fa": "true",
            "$": "https://api.elsevier.com/content/object/eid/1-s2.0-S0306261921004542-si141.svg?httpAccept=%2A%2F%2A",
            "@multimediatype": "Scalable Vector Graphics file",
            "@type": "ALTIMG",
            "@size": "27151",
            "@ref": "si141",
            "@mimetype": "image/svg+xml"
        },
        {
            "@category": "thumbnail",
            "@_fa": "true",
            "$": "https://api.elsevier.com/content/object/eid/1-s2.0-S0306261921004542-si142.svg?httpAccept=%2A%2F%2A",
            "@multimediatype": "Scalable Vector Graphics file",
            "@type": "ALTIMG",
            "@size": "24030",
            "@ref": "si142",
            "@mimetype": "image/svg+xml"
        },
        {
            "@category": "thumbnail",
            "@_fa": "true",
            "$": "https://api.elsevier.com/content/object/eid/1-s2.0-S0306261921004542-si143.svg?httpAccept=%2A%2F%2A",
            "@multimediatype": "Scalable Vector Graphics file",
            "@type": "ALTIMG",
            "@size": "23415",
            "@ref": "si143",
            "@mimetype": "image/svg+xml"
        },
        {
            "@category": "thumbnail",
            "@_fa": "true",
            "$": "https://api.elsevier.com/content/object/eid/1-s2.0-S0306261921004542-si144.svg?httpAccept=%2A%2F%2A",
            "@multimediatype": "Scalable Vector Graphics file",
            "@type": "ALTIMG",
            "@size": "24644",
            "@ref": "si144",
            "@mimetype": "image/svg+xml"
        },
        {
            "@category": "thumbnail",
            "@_fa": "true",
            "$": "https://api.elsevier.com/content/object/eid/1-s2.0-S0306261921004542-si145.svg?httpAccept=%2A%2F%2A",
            "@multimediatype": "Scalable Vector Graphics file",
            "@type": "ALTIMG",
            "@size": "4347",
            "@ref": "si145",
            "@mimetype": "image/svg+xml"
        },
        {
            "@category": "thumbnail",
            "@_fa": "true",
            "$": "https://api.elsevier.com/content/object/eid/1-s2.0-S0306261921004542-si148.svg?httpAccept=%2A%2F%2A",
            "@multimediatype": "Scalable Vector Graphics file",
            "@type": "ALTIMG",
            "@size": "2429",
            "@ref": "si148",
            "@mimetype": "image/svg+xml"
        },
        {
            "@category": "thumbnail",
            "@_fa": "true",
            "$": "https://api.elsevier.com/content/object/eid/1-s2.0-S0306261921004542-si15.svg?httpAccept=%2A%2F%2A",
            "@multimediatype": "Scalable Vector Graphics file",
            "@type": "ALTIMG",
            "@size": "5368",
            "@ref": "si15",
            "@mimetype": "image/svg+xml"
        },
        {
            "@category": "thumbnail",
            "@_fa": "true",
            "$": "https://api.elsevier.com/content/object/eid/1-s2.0-S0306261921004542-si151.svg?httpAccept=%2A%2F%2A",
            "@multimediatype": "Scalable Vector Graphics file",
            "@type": "ALTIMG",
            "@size": "29750",
            "@ref": "si151",
            "@mimetype": "image/svg+xml"
        },
        {
            "@category": "thumbnail",
            "@_fa": "true",
            "$": "https://api.elsevier.com/content/object/eid/1-s2.0-S0306261921004542-si152.svg?httpAccept=%2A%2F%2A",
            "@multimediatype": "Scalable Vector Graphics file",
            "@type": "ALTIMG",
            "@size": "24397",
            "@ref": "si152",
            "@mimetype": "image/svg+xml"
        },
        {
            "@category": "thumbnail",
            "@_fa": "true",
            "$": "https://api.elsevier.com/content/object/eid/1-s2.0-S0306261921004542-si153.svg?httpAccept=%2A%2F%2A",
            "@multimediatype": "Scalable Vector Graphics file",
            "@type": "ALTIMG",
            "@size": "26057",
            "@ref": "si153",
            "@mimetype": "image/svg+xml"
        },
        {
            "@category": "thumbnail",
            "@_fa": "true",
            "$": "https://api.elsevier.com/content/object/eid/1-s2.0-S0306261921004542-si154.svg?httpAccept=%2A%2F%2A",
            "@multimediatype": "Scalable Vector Graphics file",
            "@type": "ALTIMG",
            "@size": "16471",
            "@ref": "si154",
            "@mimetype": "image/svg+xml"
        },
        {
            "@category": "thumbnail",
            "@_fa": "true",
            "$": "https://api.elsevier.com/content/object/eid/1-s2.0-S0306261921004542-si155.svg?httpAccept=%2A%2F%2A",
            "@multimediatype": "Scalable Vector Graphics file",
            "@type": "ALTIMG",
            "@size": "17755",
            "@ref": "si155",
            "@mimetype": "image/svg+xml"
        },
        {
            "@category": "thumbnail",
            "@_fa": "true",
            "$": "https://api.elsevier.com/content/object/eid/1-s2.0-S0306261921004542-si156.svg?httpAccept=%2A%2F%2A",
            "@multimediatype": "Scalable Vector Graphics file",
            "@type": "ALTIMG",
            "@size": "13268",
            "@ref": "si156",
            "@mimetype": "image/svg+xml"
        },
        {
            "@category": "thumbnail",
            "@_fa": "true",
            "$": "https://api.elsevier.com/content/object/eid/1-s2.0-S0306261921004542-si157.svg?httpAccept=%2A%2F%2A",
            "@multimediatype": "Scalable Vector Graphics file",
            "@type": "ALTIMG",
            "@size": "14875",
            "@ref": "si157",
            "@mimetype": "image/svg+xml"
        },
        {
            "@category": "thumbnail",
            "@_fa": "true",
            "$": "https://api.elsevier.com/content/object/eid/1-s2.0-S0306261921004542-si158.svg?httpAccept=%2A%2F%2A",
            "@multimediatype": "Scalable Vector Graphics file",
            "@type": "ALTIMG",
            "@size": "23470",
            "@ref": "si158",
            "@mimetype": "image/svg+xml"
        },
        {
            "@category": "thumbnail",
            "@_fa": "true",
            "$": "https://api.elsevier.com/content/object/eid/1-s2.0-S0306261921004542-si159.svg?httpAccept=%2A%2F%2A",
            "@multimediatype": "Scalable Vector Graphics file",
            "@type": "ALTIMG",
            "@size": "31769",
            "@ref": "si159",
            "@mimetype": "image/svg+xml"
        },
        {
            "@category": "thumbnail",
            "@_fa": "true",
            "$": "https://api.elsevier.com/content/object/eid/1-s2.0-S0306261921004542-si16.svg?httpAccept=%2A%2F%2A",
            "@multimediatype": "Scalable Vector Graphics file",
            "@type": "ALTIMG",
            "@size": "7089",
            "@ref": "si16",
            "@mimetype": "image/svg+xml"
        },
        {
            "@category": "thumbnail",
            "@_fa": "true",
            "$": "https://api.elsevier.com/content/object/eid/1-s2.0-S0306261921004542-si160.svg?httpAccept=%2A%2F%2A",
            "@multimediatype": "Scalable Vector Graphics file",
            "@type": "ALTIMG",
            "@size": "20351",
            "@ref": "si160",
            "@mimetype": "image/svg+xml"
        },
        {
            "@category": "thumbnail",
            "@_fa": "true",
            "$": "https://api.elsevier.com/content/object/eid/1-s2.0-S0306261921004542-si161.svg?httpAccept=%2A%2F%2A",
            "@multimediatype": "Scalable Vector Graphics file",
            "@type": "ALTIMG",
            "@size": "22876",
            "@ref": "si161",
            "@mimetype": "image/svg+xml"
        },
        {
            "@category": "thumbnail",
            "@_fa": "true",
            "$": "https://api.elsevier.com/content/object/eid/1-s2.0-S0306261921004542-si162.svg?httpAccept=%2A%2F%2A",
            "@multimediatype": "Scalable Vector Graphics file",
            "@type": "ALTIMG",
            "@size": "21615",
            "@ref": "si162",
            "@mimetype": "image/svg+xml"
        },
        {
            "@category": "thumbnail",
            "@_fa": "true",
            "$": "https://api.elsevier.com/content/object/eid/1-s2.0-S0306261921004542-si163.svg?httpAccept=%2A%2F%2A",
            "@multimediatype": "Scalable Vector Graphics file",
            "@type": "ALTIMG",
            "@size": "5761",
            "@ref": "si163",
            "@mimetype": "image/svg+xml"
        },
        {
            "@category": "thumbnail",
            "@_fa": "true",
            "$": "https://api.elsevier.com/content/object/eid/1-s2.0-S0306261921004542-si164.svg?httpAccept=%2A%2F%2A",
            "@multimediatype": "Scalable Vector Graphics file",
            "@type": "ALTIMG",
            "@size": "11701",
            "@ref": "si164",
            "@mimetype": "image/svg+xml"
        },
        {
            "@category": "thumbnail",
            "@_fa": "true",
            "$": "https://api.elsevier.com/content/object/eid/1-s2.0-S0306261921004542-si165.svg?httpAccept=%2A%2F%2A",
            "@multimediatype": "Scalable Vector Graphics file",
            "@type": "ALTIMG",
            "@size": "3980",
            "@ref": "si165",
            "@mimetype": "image/svg+xml"
        },
        {
            "@category": "thumbnail",
            "@_fa": "true",
            "$": "https://api.elsevier.com/content/object/eid/1-s2.0-S0306261921004542-si167.svg?httpAccept=%2A%2F%2A",
            "@multimediatype": "Scalable Vector Graphics file",
            "@type": "ALTIMG",
            "@size": "4542",
            "@ref": "si167",
            "@mimetype": "image/svg+xml"
        },
        {
            "@category": "thumbnail",
            "@_fa": "true",
            "$": "https://api.elsevier.com/content/object/eid/1-s2.0-S0306261921004542-si168.svg?httpAccept=%2A%2F%2A",
            "@multimediatype": "Scalable Vector Graphics file",
            "@type": "ALTIMG",
            "@size": "2528",
            "@ref": "si168",
            "@mimetype": "image/svg+xml"
        },
        {
            "@category": "thumbnail",
            "@_fa": "true",
            "$": "https://api.elsevier.com/content/object/eid/1-s2.0-S0306261921004542-si171.svg?httpAccept=%2A%2F%2A",
            "@multimediatype": "Scalable Vector Graphics file",
            "@type": "ALTIMG",
            "@size": "14490",
            "@ref": "si171",
            "@mimetype": "image/svg+xml"
        },
        {
            "@category": "thumbnail",
            "@_fa": "true",
            "$": "https://api.elsevier.com/content/object/eid/1-s2.0-S0306261921004542-si172.svg?httpAccept=%2A%2F%2A",
            "@multimediatype": "Scalable Vector Graphics file",
            "@type": "ALTIMG",
            "@size": "14414",
            "@ref": "si172",
            "@mimetype": "image/svg+xml"
        },
        {
            "@category": "thumbnail",
            "@_fa": "true",
            "$": "https://api.elsevier.com/content/object/eid/1-s2.0-S0306261921004542-si173.svg?httpAccept=%2A%2F%2A",
            "@multimediatype": "Scalable Vector Graphics file",
            "@type": "ALTIMG",
            "@size": "13239",
            "@ref": "si173",
            "@mimetype": "image/svg+xml"
        },
        {
            "@category": "thumbnail",
            "@_fa": "true",
            "$": "https://api.elsevier.com/content/object/eid/1-s2.0-S0306261921004542-si174.svg?httpAccept=%2A%2F%2A",
            "@multimediatype": "Scalable Vector Graphics file",
            "@type": "ALTIMG",
            "@size": "16782",
            "@ref": "si174",
            "@mimetype": "image/svg+xml"
        },
        {
            "@category": "thumbnail",
            "@_fa": "true",
            "$": "https://api.elsevier.com/content/object/eid/1-s2.0-S0306261921004542-si175.svg?httpAccept=%2A%2F%2A",
            "@multimediatype": "Scalable Vector Graphics file",
            "@type": "ALTIMG",
            "@size": "17085",
            "@ref": "si175",
            "@mimetype": "image/svg+xml"
        },
        {
            "@category": "thumbnail",
            "@_fa": "true",
            "$": "https://api.elsevier.com/content/object/eid/1-s2.0-S0306261921004542-si176.svg?httpAccept=%2A%2F%2A",
            "@multimediatype": "Scalable Vector Graphics file",
            "@type": "ALTIMG",
            "@size": "18560",
            "@ref": "si176",
            "@mimetype": "image/svg+xml"
        },
        {
            "@category": "thumbnail",
            "@_fa": "true",
            "$": "https://api.elsevier.com/content/object/eid/1-s2.0-S0306261921004542-si177.svg?httpAccept=%2A%2F%2A",
            "@multimediatype": "Scalable Vector Graphics file",
            "@type": "ALTIMG",
            "@size": "25745",
            "@ref": "si177",
            "@mimetype": "image/svg+xml"
        },
        {
            "@category": "thumbnail",
            "@_fa": "true",
            "$": "https://api.elsevier.com/content/object/eid/1-s2.0-S0306261921004542-si178.svg?httpAccept=%2A%2F%2A",
            "@multimediatype": "Scalable Vector Graphics file",
            "@type": "ALTIMG",
            "@size": "17615",
            "@ref": "si178",
            "@mimetype": "image/svg+xml"
        },
        {
            "@category": "thumbnail",
            "@_fa": "true",
            "$": "https://api.elsevier.com/content/object/eid/1-s2.0-S0306261921004542-si179.svg?httpAccept=%2A%2F%2A",
            "@multimediatype": "Scalable Vector Graphics file",
            "@type": "ALTIMG",
            "@size": "20302",
            "@ref": "si179",
            "@mimetype": "image/svg+xml"
        },
        {
            "@category": "thumbnail",
            "@_fa": "true",
            "$": "https://api.elsevier.com/content/object/eid/1-s2.0-S0306261921004542-si18.svg?httpAccept=%2A%2F%2A",
            "@multimediatype": "Scalable Vector Graphics file",
            "@type": "ALTIMG",
            "@size": "8169",
            "@ref": "si18",
            "@mimetype": "image/svg+xml"
        },
        {
            "@category": "thumbnail",
            "@_fa": "true",
            "$": "https://api.elsevier.com/content/object/eid/1-s2.0-S0306261921004542-si180.svg?httpAccept=%2A%2F%2A",
            "@multimediatype": "Scalable Vector Graphics file",
            "@type": "ALTIMG",
            "@size": "14029",
            "@ref": "si180",
            "@mimetype": "image/svg+xml"
        },
        {
            "@category": "thumbnail",
            "@_fa": "true",
            "$": "https://api.elsevier.com/content/object/eid/1-s2.0-S0306261921004542-si181.svg?httpAccept=%2A%2F%2A",
            "@multimediatype": "Scalable Vector Graphics file",
            "@type": "ALTIMG",
            "@size": "7308",
            "@ref": "si181",
            "@mimetype": "image/svg+xml"
        },
        {
            "@category": "thumbnail",
            "@_fa": "true",
            "$": "https://api.elsevier.com/content/object/eid/1-s2.0-S0306261921004542-si183.svg?httpAccept=%2A%2F%2A",
            "@multimediatype": "Scalable Vector Graphics file",
            "@type": "ALTIMG",
            "@size": "5729",
            "@ref": "si183",
            "@mimetype": "image/svg+xml"
        },
        {
            "@category": "thumbnail",
            "@_fa": "true",
            "$": "https://api.elsevier.com/content/object/eid/1-s2.0-S0306261921004542-si185.svg?httpAccept=%2A%2F%2A",
            "@multimediatype": "Scalable Vector Graphics file",
            "@type": "ALTIMG",
            "@size": "17805",
            "@ref": "si185",
            "@mimetype": "image/svg+xml"
        },
        {
            "@category": "thumbnail",
            "@_fa": "true",
            "$": "https://api.elsevier.com/content/object/eid/1-s2.0-S0306261921004542-si186.svg?httpAccept=%2A%2F%2A",
            "@multimediatype": "Scalable Vector Graphics file",
            "@type": "ALTIMG",
            "@size": "15602",
            "@ref": "si186",
            "@mimetype": "image/svg+xml"
        },
        {
            "@category": "thumbnail",
            "@_fa": "true",
            "$": "https://api.elsevier.com/content/object/eid/1-s2.0-S0306261921004542-si187.svg?httpAccept=%2A%2F%2A",
            "@multimediatype": "Scalable Vector Graphics file",
            "@type": "ALTIMG",
            "@size": "22435",
            "@ref": "si187",
            "@mimetype": "image/svg+xml"
        },
        {
            "@category": "thumbnail",
            "@_fa": "true",
            "$": "https://api.elsevier.com/content/object/eid/1-s2.0-S0306261921004542-si188.svg?httpAccept=%2A%2F%2A",
            "@multimediatype": "Scalable Vector Graphics file",
            "@type": "ALTIMG",
            "@size": "15197",
            "@ref": "si188",
            "@mimetype": "image/svg+xml"
        },
        {
            "@category": "thumbnail",
            "@_fa": "true",
            "$": "https://api.elsevier.com/content/object/eid/1-s2.0-S0306261921004542-si189.svg?httpAccept=%2A%2F%2A",
            "@multimediatype": "Scalable Vector Graphics file",
            "@type": "ALTIMG",
            "@size": "15602",
            "@ref": "si189",
            "@mimetype": "image/svg+xml"
        },
        {
            "@category": "thumbnail",
            "@_fa": "true",
            "$": "https://api.elsevier.com/content/object/eid/1-s2.0-S0306261921004542-si19.svg?httpAccept=%2A%2F%2A",
            "@multimediatype": "Scalable Vector Graphics file",
            "@type": "ALTIMG",
            "@size": "9437",
            "@ref": "si19",
            "@mimetype": "image/svg+xml"
        },
        {
            "@category": "thumbnail",
            "@_fa": "true",
            "$": "https://api.elsevier.com/content/object/eid/1-s2.0-S0306261921004542-si190.svg?httpAccept=%2A%2F%2A",
            "@multimediatype": "Scalable Vector Graphics file",
            "@type": "ALTIMG",
            "@size": "22405",
            "@ref": "si190",
            "@mimetype": "image/svg+xml"
        },
        {
            "@category": "thumbnail",
            "@_fa": "true",
            "$": "https://api.elsevier.com/content/object/eid/1-s2.0-S0306261921004542-si191.svg?httpAccept=%2A%2F%2A",
            "@multimediatype": "Scalable Vector Graphics file",
            "@type": "ALTIMG",
            "@size": "21306",
            "@ref": "si191",
            "@mimetype": "image/svg+xml"
        },
        {
            "@category": "thumbnail",
            "@_fa": "true",
            "$": "https://api.elsevier.com/content/object/eid/1-s2.0-S0306261921004542-si192.svg?httpAccept=%2A%2F%2A",
            "@multimediatype": "Scalable Vector Graphics file",
            "@type": "ALTIMG",
            "@size": "19823",
            "@ref": "si192",
            "@mimetype": "image/svg+xml"
        },
        {
            "@category": "thumbnail",
            "@_fa": "true",
            "$": "https://api.elsevier.com/content/object/eid/1-s2.0-S0306261921004542-si193.svg?httpAccept=%2A%2F%2A",
            "@multimediatype": "Scalable Vector Graphics file",
            "@type": "ALTIMG",
            "@size": "20042",
            "@ref": "si193",
            "@mimetype": "image/svg+xml"
        },
        {
            "@category": "thumbnail",
            "@_fa": "true",
            "$": "https://api.elsevier.com/content/object/eid/1-s2.0-S0306261921004542-si194.svg?httpAccept=%2A%2F%2A",
            "@multimediatype": "Scalable Vector Graphics file",
            "@type": "ALTIMG",
            "@size": "29038",
            "@ref": "si194",
            "@mimetype": "image/svg+xml"
        },
        {
            "@category": "thumbnail",
            "@_fa": "true",
            "$": "https://api.elsevier.com/content/object/eid/1-s2.0-S0306261921004542-si195.svg?httpAccept=%2A%2F%2A",
            "@multimediatype": "Scalable Vector Graphics file",
            "@type": "ALTIMG",
            "@size": "30925",
            "@ref": "si195",
            "@mimetype": "image/svg+xml"
        },
        {
            "@category": "thumbnail",
            "@_fa": "true",
            "$": "https://api.elsevier.com/content/object/eid/1-s2.0-S0306261921004542-si196.svg?httpAccept=%2A%2F%2A",
            "@multimediatype": "Scalable Vector Graphics file",
            "@type": "ALTIMG",
            "@size": "26939",
            "@ref": "si196",
            "@mimetype": "image/svg+xml"
        },
        {
            "@category": "thumbnail",
            "@_fa": "true",
            "$": "https://api.elsevier.com/content/object/eid/1-s2.0-S0306261921004542-si197.svg?httpAccept=%2A%2F%2A",
            "@multimediatype": "Scalable Vector Graphics file",
            "@type": "ALTIMG",
            "@size": "28332",
            "@ref": "si197",
            "@mimetype": "image/svg+xml"
        },
        {
            "@category": "thumbnail",
            "@_fa": "true",
            "$": "https://api.elsevier.com/content/object/eid/1-s2.0-S0306261921004542-si198.svg?httpAccept=%2A%2F%2A",
            "@multimediatype": "Scalable Vector Graphics file",
            "@type": "ALTIMG",
            "@size": "23935",
            "@ref": "si198",
            "@mimetype": "image/svg+xml"
        },
        {
            "@category": "thumbnail",
            "@_fa": "true",
            "$": "https://api.elsevier.com/content/object/eid/1-s2.0-S0306261921004542-si199.svg?httpAccept=%2A%2F%2A",
            "@multimediatype": "Scalable Vector Graphics file",
            "@type": "ALTIMG",
            "@size": "21662",
            "@ref": "si199",
            "@mimetype": "image/svg+xml"
        },
        {
            "@category": "thumbnail",
            "@_fa": "true",
            "$": "https://api.elsevier.com/content/object/eid/1-s2.0-S0306261921004542-si2.svg?httpAccept=%2A%2F%2A",
            "@multimediatype": "Scalable Vector Graphics file",
            "@type": "ALTIMG",
            "@size": "3734",
            "@ref": "si2",
            "@mimetype": "image/svg+xml"
        },
        {
            "@category": "thumbnail",
            "@_fa": "true",
            "$": "https://api.elsevier.com/content/object/eid/1-s2.0-S0306261921004542-si20.svg?httpAccept=%2A%2F%2A",
            "@multimediatype": "Scalable Vector Graphics file",
            "@type": "ALTIMG",
            "@size": "9206",
            "@ref": "si20",
            "@mimetype": "image/svg+xml"
        },
        {
            "@category": "thumbnail",
            "@_fa": "true",
            "$": "https://api.elsevier.com/content/object/eid/1-s2.0-S0306261921004542-si201.svg?httpAccept=%2A%2F%2A",
            "@multimediatype": "Scalable Vector Graphics file",
            "@type": "ALTIMG",
            "@size": "3930",
            "@ref": "si201",
            "@mimetype": "image/svg+xml"
        },
        {
            "@category": "thumbnail",
            "@_fa": "true",
            "$": "https://api.elsevier.com/content/object/eid/1-s2.0-S0306261921004542-si202.svg?httpAccept=%2A%2F%2A",
            "@multimediatype": "Scalable Vector Graphics file",
            "@type": "ALTIMG",
            "@size": "19769",
            "@ref": "si202",
            "@mimetype": "image/svg+xml"
        },
        {
            "@category": "thumbnail",
            "@_fa": "true",
            "$": "https://api.elsevier.com/content/object/eid/1-s2.0-S0306261921004542-si203.svg?httpAccept=%2A%2F%2A",
            "@multimediatype": "Scalable Vector Graphics file",
            "@type": "ALTIMG",
            "@size": "21485",
            "@ref": "si203",
            "@mimetype": "image/svg+xml"
        },
        {
            "@category": "thumbnail",
            "@_fa": "true",
            "$": "https://api.elsevier.com/content/object/eid/1-s2.0-S0306261921004542-si204.svg?httpAccept=%2A%2F%2A",
            "@multimediatype": "Scalable Vector Graphics file",
            "@type": "ALTIMG",
            "@size": "24409",
            "@ref": "si204",
            "@mimetype": "image/svg+xml"
        },
        {
            "@category": "thumbnail",
            "@_fa": "true",
            "$": "https://api.elsevier.com/content/object/eid/1-s2.0-S0306261921004542-si205.svg?httpAccept=%2A%2F%2A",
            "@multimediatype": "Scalable Vector Graphics file",
            "@type": "ALTIMG",
            "@size": "24484",
            "@ref": "si205",
            "@mimetype": "image/svg+xml"
        },
        {
            "@category": "thumbnail",
            "@_fa": "true",
            "$": "https://api.elsevier.com/content/object/eid/1-s2.0-S0306261921004542-si206.svg?httpAccept=%2A%2F%2A",
            "@multimediatype": "Scalable Vector Graphics file",
            "@type": "ALTIMG",
            "@size": "24947",
            "@ref": "si206",
            "@mimetype": "image/svg+xml"
        },
        {
            "@category": "thumbnail",
            "@_fa": "true",
            "$": "https://api.elsevier.com/content/object/eid/1-s2.0-S0306261921004542-si207.svg?httpAccept=%2A%2F%2A",
            "@multimediatype": "Scalable Vector Graphics file",
            "@type": "ALTIMG",
            "@size": "25022",
            "@ref": "si207",
            "@mimetype": "image/svg+xml"
        },
        {
            "@category": "thumbnail",
            "@_fa": "true",
            "$": "https://api.elsevier.com/content/object/eid/1-s2.0-S0306261921004542-si208.svg?httpAccept=%2A%2F%2A",
            "@multimediatype": "Scalable Vector Graphics file",
            "@type": "ALTIMG",
            "@size": "2096",
            "@ref": "si208",
            "@mimetype": "image/svg+xml"
        },
        {
            "@category": "thumbnail",
            "@_fa": "true",
            "$": "https://api.elsevier.com/content/object/eid/1-s2.0-S0306261921004542-si21.svg?httpAccept=%2A%2F%2A",
            "@multimediatype": "Scalable Vector Graphics file",
            "@type": "ALTIMG",
            "@size": "5452",
            "@ref": "si21",
            "@mimetype": "image/svg+xml"
        },
        {
            "@category": "thumbnail",
            "@_fa": "true",
            "$": "https://api.elsevier.com/content/object/eid/1-s2.0-S0306261921004542-si211.svg?httpAccept=%2A%2F%2A",
            "@multimediatype": "Scalable Vector Graphics file",
            "@type": "ALTIMG",
            "@size": "2299",
            "@ref": "si211",
            "@mimetype": "image/svg+xml"
        },
        {
            "@category": "thumbnail",
            "@_fa": "true",
            "$": "https://api.elsevier.com/content/object/eid/1-s2.0-S0306261921004542-si22.svg?httpAccept=%2A%2F%2A",
            "@multimediatype": "Scalable Vector Graphics file",
            "@type": "ALTIMG",
            "@size": "8542",
            "@ref": "si22",
            "@mimetype": "image/svg+xml"
        },
        {
            "@category": "thumbnail",
            "@_fa": "true",
            "$": "https://api.elsevier.com/content/object/eid/1-s2.0-S0306261921004542-si220.svg?httpAccept=%2A%2F%2A",
            "@multimediatype": "Scalable Vector Graphics file",
            "@type": "ALTIMG",
            "@size": "2328",
            "@ref": "si220",
            "@mimetype": "image/svg+xml"
        },
        {
            "@category": "thumbnail",
            "@_fa": "true",
            "$": "https://api.elsevier.com/content/object/eid/1-s2.0-S0306261921004542-si221.svg?httpAccept=%2A%2F%2A",
            "@multimediatype": "Scalable Vector Graphics file",
            "@type": "ALTIMG",
            "@size": "3539",
            "@ref": "si221",
            "@mimetype": "image/svg+xml"
        },
        {
            "@category": "thumbnail",
            "@_fa": "true",
            "$": "https://api.elsevier.com/content/object/eid/1-s2.0-S0306261921004542-si223.svg?httpAccept=%2A%2F%2A",
            "@multimediatype": "Scalable Vector Graphics file",
            "@type": "ALTIMG",
            "@size": "29825",
            "@ref": "si223",
            "@mimetype": "image/svg+xml"
        },
        {
            "@category": "thumbnail",
            "@_fa": "true",
            "$": "https://api.elsevier.com/content/object/eid/1-s2.0-S0306261921004542-si224.svg?httpAccept=%2A%2F%2A",
            "@multimediatype": "Scalable Vector Graphics file",
            "@type": "ALTIMG",
            "@size": "30982",
            "@ref": "si224",
            "@mimetype": "image/svg+xml"
        },
        {
            "@category": "thumbnail",
            "@_fa": "true",
            "$": "https://api.elsevier.com/content/object/eid/1-s2.0-S0306261921004542-si225.svg?httpAccept=%2A%2F%2A",
            "@multimediatype": "Scalable Vector Graphics file",
            "@type": "ALTIMG",
            "@size": "22415",
            "@ref": "si225",
            "@mimetype": "image/svg+xml"
        },
        {
            "@category": "thumbnail",
            "@_fa": "true",
            "$": "https://api.elsevier.com/content/object/eid/1-s2.0-S0306261921004542-si226.svg?httpAccept=%2A%2F%2A",
            "@multimediatype": "Scalable Vector Graphics file",
            "@type": "ALTIMG",
            "@size": "17915",
            "@ref": "si226",
            "@mimetype": "image/svg+xml"
        },
        {
            "@category": "thumbnail",
            "@_fa": "true",
            "$": "https://api.elsevier.com/content/object/eid/1-s2.0-S0306261921004542-si227.svg?httpAccept=%2A%2F%2A",
            "@multimediatype": "Scalable Vector Graphics file",
            "@type": "ALTIMG",
            "@size": "5983",
            "@ref": "si227",
            "@mimetype": "image/svg+xml"
        },
        {
            "@category": "thumbnail",
            "@_fa": "true",
            "$": "https://api.elsevier.com/content/object/eid/1-s2.0-S0306261921004542-si229.svg?httpAccept=%2A%2F%2A",
            "@multimediatype": "Scalable Vector Graphics file",
            "@type": "ALTIMG",
            "@size": "6992",
            "@ref": "si229",
            "@mimetype": "image/svg+xml"
        },
        {
            "@category": "thumbnail",
            "@_fa": "true",
            "$": "https://api.elsevier.com/content/object/eid/1-s2.0-S0306261921004542-si23.svg?httpAccept=%2A%2F%2A",
            "@multimediatype": "Scalable Vector Graphics file",
            "@type": "ALTIMG",
            "@size": "9789",
            "@ref": "si23",
            "@mimetype": "image/svg+xml"
        },
        {
            "@category": "thumbnail",
            "@_fa": "true",
            "$": "https://api.elsevier.com/content/object/eid/1-s2.0-S0306261921004542-si230.svg?httpAccept=%2A%2F%2A",
            "@multimediatype": "Scalable Vector Graphics file",
            "@type": "ALTIMG",
            "@size": "4720",
            "@ref": "si230",
            "@mimetype": "image/svg+xml"
        },
        {
            "@category": "thumbnail",
            "@_fa": "true",
            "$": "https://api.elsevier.com/content/object/eid/1-s2.0-S0306261921004542-si231.svg?httpAccept=%2A%2F%2A",
            "@multimediatype": "Scalable Vector Graphics file",
            "@type": "ALTIMG",
            "@size": "4489",
            "@ref": "si231",
            "@mimetype": "image/svg+xml"
        },
        {
            "@category": "thumbnail",
            "@_fa": "true",
            "$": "https://api.elsevier.com/content/object/eid/1-s2.0-S0306261921004542-si234.svg?httpAccept=%2A%2F%2A",
            "@multimediatype": "Scalable Vector Graphics file",
            "@type": "ALTIMG",
            "@size": "9003",
            "@ref": "si234",
            "@mimetype": "image/svg+xml"
        },
        {
            "@category": "thumbnail",
            "@_fa": "true",
            "$": "https://api.elsevier.com/content/object/eid/1-s2.0-S0306261921004542-si237.svg?httpAccept=%2A%2F%2A",
            "@multimediatype": "Scalable Vector Graphics file",
            "@type": "ALTIMG",
            "@size": "7403",
            "@ref": "si237",
            "@mimetype": "image/svg+xml"
        },
        {
            "@category": "thumbnail",
            "@_fa": "true",
            "$": "https://api.elsevier.com/content/object/eid/1-s2.0-S0306261921004542-si238.svg?httpAccept=%2A%2F%2A",
            "@multimediatype": "Scalable Vector Graphics file",
            "@type": "ALTIMG",
            "@size": "2666",
            "@ref": "si238",
            "@mimetype": "image/svg+xml"
        },
        {
            "@category": "thumbnail",
            "@_fa": "true",
            "$": "https://api.elsevier.com/content/object/eid/1-s2.0-S0306261921004542-si239.svg?httpAccept=%2A%2F%2A",
            "@multimediatype": "Scalable Vector Graphics file",
            "@type": "ALTIMG",
            "@size": "6505",
            "@ref": "si239",
            "@mimetype": "image/svg+xml"
        },
        {
            "@category": "thumbnail",
            "@_fa": "true",
            "$": "https://api.elsevier.com/content/object/eid/1-s2.0-S0306261921004542-si24.svg?httpAccept=%2A%2F%2A",
            "@multimediatype": "Scalable Vector Graphics file",
            "@type": "ALTIMG",
            "@size": "6201",
            "@ref": "si24",
            "@mimetype": "image/svg+xml"
        },
        {
            "@category": "thumbnail",
            "@_fa": "true",
            "$": "https://api.elsevier.com/content/object/eid/1-s2.0-S0306261921004542-si246.svg?httpAccept=%2A%2F%2A",
            "@multimediatype": "Scalable Vector Graphics file",
            "@type": "ALTIMG",
            "@size": "3354",
            "@ref": "si246",
            "@mimetype": "image/svg+xml"
        },
        {
            "@category": "thumbnail",
            "@_fa": "true",
            "$": "https://api.elsevier.com/content/object/eid/1-s2.0-S0306261921004542-si247.svg?httpAccept=%2A%2F%2A",
            "@multimediatype": "Scalable Vector Graphics file",
            "@type": "ALTIMG",
            "@size": "3649",
            "@ref": "si247",
            "@mimetype": "image/svg+xml"
        },
        {
            "@category": "thumbnail",
            "@_fa": "true",
            "$": "https://api.elsevier.com/content/object/eid/1-s2.0-S0306261921004542-si248.svg?httpAccept=%2A%2F%2A",
            "@multimediatype": "Scalable Vector Graphics file",
            "@type": "ALTIMG",
            "@size": "5347",
            "@ref": "si248",
            "@mimetype": "image/svg+xml"
        },
        {
            "@category": "thumbnail",
            "@_fa": "true",
            "$": "https://api.elsevier.com/content/object/eid/1-s2.0-S0306261921004542-si249.svg?httpAccept=%2A%2F%2A",
            "@multimediatype": "Scalable Vector Graphics file",
            "@type": "ALTIMG",
            "@size": "3013",
            "@ref": "si249",
            "@mimetype": "image/svg+xml"
        },
        {
            "@category": "thumbnail",
            "@_fa": "true",
            "$": "https://api.elsevier.com/content/object/eid/1-s2.0-S0306261921004542-si25.svg?httpAccept=%2A%2F%2A",
            "@multimediatype": "Scalable Vector Graphics file",
            "@type": "ALTIMG",
            "@size": "7175",
            "@ref": "si25",
            "@mimetype": "image/svg+xml"
        },
        {
            "@category": "thumbnail",
            "@_fa": "true",
            "$": "https://api.elsevier.com/content/object/eid/1-s2.0-S0306261921004542-si250.svg?httpAccept=%2A%2F%2A",
            "@multimediatype": "Scalable Vector Graphics file",
            "@type": "ALTIMG",
            "@size": "3308",
            "@ref": "si250",
            "@mimetype": "image/svg+xml"
        },
        {
            "@category": "thumbnail",
            "@_fa": "true",
            "$": "https://api.elsevier.com/content/object/eid/1-s2.0-S0306261921004542-si252.svg?httpAccept=%2A%2F%2A",
            "@multimediatype": "Scalable Vector Graphics file",
            "@type": "ALTIMG",
            "@size": "3278",
            "@ref": "si252",
            "@mimetype": "image/svg+xml"
        },
        {
            "@category": "thumbnail",
            "@_fa": "true",
            "$": "https://api.elsevier.com/content/object/eid/1-s2.0-S0306261921004542-si27.svg?httpAccept=%2A%2F%2A",
            "@multimediatype": "Scalable Vector Graphics file",
            "@type": "ALTIMG",
            "@size": "6899",
            "@ref": "si27",
            "@mimetype": "image/svg+xml"
        },
        {
            "@category": "thumbnail",
            "@_fa": "true",
            "$": "https://api.elsevier.com/content/object/eid/1-s2.0-S0306261921004542-si28.svg?httpAccept=%2A%2F%2A",
            "@multimediatype": "Scalable Vector Graphics file",
            "@type": "ALTIMG",
            "@size": "2739",
            "@ref": "si28",
            "@mimetype": "image/svg+xml"
        },
        {
            "@category": "thumbnail",
            "@_fa": "true",
            "$": "https://api.elsevier.com/content/object/eid/1-s2.0-S0306261921004542-si29.svg?httpAccept=%2A%2F%2A",
            "@multimediatype": "Scalable Vector Graphics file",
            "@type": "ALTIMG",
            "@size": "2592",
            "@ref": "si29",
            "@mimetype": "image/svg+xml"
        },
        {
            "@category": "thumbnail",
            "@_fa": "true",
            "$": "https://api.elsevier.com/content/object/eid/1-s2.0-S0306261921004542-si3.svg?httpAccept=%2A%2F%2A",
            "@multimediatype": "Scalable Vector Graphics file",
            "@type": "ALTIMG",
            "@size": "3064",
            "@ref": "si3",
            "@mimetype": "image/svg+xml"
        },
        {
            "@category": "thumbnail",
            "@_fa": "true",
            "$": "https://api.elsevier.com/content/object/eid/1-s2.0-S0306261921004542-si31.svg?httpAccept=%2A%2F%2A",
            "@multimediatype": "Scalable Vector Graphics file",
            "@type": "ALTIMG",
            "@size": "8840",
            "@ref": "si31",
            "@mimetype": "image/svg+xml"
        },
        {
            "@category": "thumbnail",
            "@_fa": "true",
            "$": "https://api.elsevier.com/content/object/eid/1-s2.0-S0306261921004542-si32.svg?httpAccept=%2A%2F%2A",
            "@multimediatype": "Scalable Vector Graphics file",
            "@type": "ALTIMG",
            "@size": "5660",
            "@ref": "si32",
            "@mimetype": "image/svg+xml"
        },
        {
            "@category": "thumbnail",
            "@_fa": "true",
            "$": "https://api.elsevier.com/content/object/eid/1-s2.0-S0306261921004542-si33.svg?httpAccept=%2A%2F%2A",
            "@multimediatype": "Scalable Vector Graphics file",
            "@type": "ALTIMG",
            "@size": "5186",
            "@ref": "si33",
            "@mimetype": "image/svg+xml"
        },
        {
            "@category": "thumbnail",
            "@_fa": "true",
            "$": "https://api.elsevier.com/content/object/eid/1-s2.0-S0306261921004542-si34.svg?httpAccept=%2A%2F%2A",
            "@multimediatype": "Scalable Vector Graphics file",
            "@type": "ALTIMG",
            "@size": "4149",
            "@ref": "si34",
            "@mimetype": "image/svg+xml"
        },
        {
            "@category": "thumbnail",
            "@_fa": "true",
            "$": "https://api.elsevier.com/content/object/eid/1-s2.0-S0306261921004542-si35.svg?httpAccept=%2A%2F%2A",
            "@multimediatype": "Scalable Vector Graphics file",
            "@type": "ALTIMG",
            "@size": "6561",
            "@ref": "si35",
            "@mimetype": "image/svg+xml"
        },
        {
            "@category": "thumbnail",
            "@_fa": "true",
            "$": "https://api.elsevier.com/content/object/eid/1-s2.0-S0306261921004542-si36.svg?httpAccept=%2A%2F%2A",
            "@multimediatype": "Scalable Vector Graphics file",
            "@type": "ALTIMG",
            "@size": "7003",
            "@ref": "si36",
            "@mimetype": "image/svg+xml"
        },
        {
            "@category": "thumbnail",
            "@_fa": "true",
            "$": "https://api.elsevier.com/content/object/eid/1-s2.0-S0306261921004542-si37.svg?httpAccept=%2A%2F%2A",
            "@multimediatype": "Scalable Vector Graphics file",
            "@type": "ALTIMG",
            "@size": "5613",
            "@ref": "si37",
            "@mimetype": "image/svg+xml"
        },
        {
            "@category": "thumbnail",
            "@_fa": "true",
            "$": "https://api.elsevier.com/content/object/eid/1-s2.0-S0306261921004542-si38.svg?httpAccept=%2A%2F%2A",
            "@multimediatype": "Scalable Vector Graphics file",
            "@type": "ALTIMG",
            "@size": "8695",
            "@ref": "si38",
            "@mimetype": "image/svg+xml"
        },
        {
            "@category": "thumbnail",
            "@_fa": "true",
            "$": "https://api.elsevier.com/content/object/eid/1-s2.0-S0306261921004542-si39.svg?httpAccept=%2A%2F%2A",
            "@multimediatype": "Scalable Vector Graphics file",
            "@type": "ALTIMG",
            "@size": "2628",
            "@ref": "si39",
            "@mimetype": "image/svg+xml"
        },
        {
            "@category": "thumbnail",
            "@_fa": "true",
            "$": "https://api.elsevier.com/content/object/eid/1-s2.0-S0306261921004542-si4.svg?httpAccept=%2A%2F%2A",
            "@multimediatype": "Scalable Vector Graphics file",
            "@type": "ALTIMG",
            "@size": "3458",
            "@ref": "si4",
            "@mimetype": "image/svg+xml"
        },
        {
            "@category": "thumbnail",
            "@_fa": "true",
            "$": "https://api.elsevier.com/content/object/eid/1-s2.0-S0306261921004542-si41.svg?httpAccept=%2A%2F%2A",
            "@multimediatype": "Scalable Vector Graphics file",
            "@type": "ALTIMG",
            "@size": "2481",
            "@ref": "si41",
            "@mimetype": "image/svg+xml"
        },
        {
            "@category": "thumbnail",
            "@_fa": "true",
            "$": "https://api.elsevier.com/content/object/eid/1-s2.0-S0306261921004542-si43.svg?httpAccept=%2A%2F%2A",
            "@multimediatype": "Scalable Vector Graphics file",
            "@type": "ALTIMG",
            "@size": "1887",
            "@ref": "si43",
            "@mimetype": "image/svg+xml"
        },
        {
            "@category": "thumbnail",
            "@_fa": "true",
            "$": "https://api.elsevier.com/content/object/eid/1-s2.0-S0306261921004542-si45.svg?httpAccept=%2A%2F%2A",
            "@multimediatype": "Scalable Vector Graphics file",
            "@type": "ALTIMG",
            "@size": "6616",
            "@ref": "si45",
            "@mimetype": "image/svg+xml"
        },
        {
            "@category": "thumbnail",
            "@_fa": "true",
            "$": "https://api.elsevier.com/content/object/eid/1-s2.0-S0306261921004542-si46.svg?httpAccept=%2A%2F%2A",
            "@multimediatype": "Scalable Vector Graphics file",
            "@type": "ALTIMG",
            "@size": "6825",
            "@ref": "si46",
            "@mimetype": "image/svg+xml"
        },
        {
            "@category": "thumbnail",
            "@_fa": "true",
            "$": "https://api.elsevier.com/content/object/eid/1-s2.0-S0306261921004542-si47.svg?httpAccept=%2A%2F%2A",
            "@multimediatype": "Scalable Vector Graphics file",
            "@type": "ALTIMG",
            "@size": "6066",
            "@ref": "si47",
            "@mimetype": "image/svg+xml"
        },
        {
            "@category": "thumbnail",
            "@_fa": "true",
            "$": "https://api.elsevier.com/content/object/eid/1-s2.0-S0306261921004542-si48.svg?httpAccept=%2A%2F%2A",
            "@multimediatype": "Scalable Vector Graphics file",
            "@type": "ALTIMG",
            "@size": "6351",
            "@ref": "si48",
            "@mimetype": "image/svg+xml"
        },
        {
            "@category": "thumbnail",
            "@_fa": "true",
            "$": "https://api.elsevier.com/content/object/eid/1-s2.0-S0306261921004542-si49.svg?httpAccept=%2A%2F%2A",
            "@multimediatype": "Scalable Vector Graphics file",
            "@type": "ALTIMG",
            "@size": "5540",
            "@ref": "si49",
            "@mimetype": "image/svg+xml"
        },
        {
            "@category": "thumbnail",
            "@_fa": "true",
            "$": "https://api.elsevier.com/content/object/eid/1-s2.0-S0306261921004542-si5.svg?httpAccept=%2A%2F%2A",
            "@multimediatype": "Scalable Vector Graphics file",
            "@type": "ALTIMG",
            "@size": "3966",
            "@ref": "si5",
            "@mimetype": "image/svg+xml"
        },
        {
            "@category": "thumbnail",
            "@_fa": "true",
            "$": "https://api.elsevier.com/content/object/eid/1-s2.0-S0306261921004542-si50.svg?httpAccept=%2A%2F%2A",
            "@multimediatype": "Scalable Vector Graphics file",
            "@type": "ALTIMG",
            "@size": "4089",
            "@ref": "si50",
            "@mimetype": "image/svg+xml"
        },
        {
            "@category": "thumbnail",
            "@_fa": "true",
            "$": "https://api.elsevier.com/content/object/eid/1-s2.0-S0306261921004542-si51.svg?httpAccept=%2A%2F%2A",
            "@multimediatype": "Scalable Vector Graphics file",
            "@type": "ALTIMG",
            "@size": "4171",
            "@ref": "si51",
            "@mimetype": "image/svg+xml"
        },
        {
            "@category": "thumbnail",
            "@_fa": "true",
            "$": "https://api.elsevier.com/content/object/eid/1-s2.0-S0306261921004542-si52.svg?httpAccept=%2A%2F%2A",
            "@multimediatype": "Scalable Vector Graphics file",
            "@type": "ALTIMG",
            "@size": "3688",
            "@ref": "si52",
            "@mimetype": "image/svg+xml"
        },
        {
            "@category": "thumbnail",
            "@_fa": "true",
            "$": "https://api.elsevier.com/content/object/eid/1-s2.0-S0306261921004542-si53.svg?httpAccept=%2A%2F%2A",
            "@multimediatype": "Scalable Vector Graphics file",
            "@type": "ALTIMG",
            "@size": "3830",
            "@ref": "si53",
            "@mimetype": "image/svg+xml"
        },
        {
            "@category": "thumbnail",
            "@_fa": "true",
            "$": "https://api.elsevier.com/content/object/eid/1-s2.0-S0306261921004542-si54.svg?httpAccept=%2A%2F%2A",
            "@multimediatype": "Scalable Vector Graphics file",
            "@type": "ALTIMG",
            "@size": "6612",
            "@ref": "si54",
            "@mimetype": "image/svg+xml"
        },
        {
            "@category": "thumbnail",
            "@_fa": "true",
            "$": "https://api.elsevier.com/content/object/eid/1-s2.0-S0306261921004542-si55.svg?httpAccept=%2A%2F%2A",
            "@multimediatype": "Scalable Vector Graphics file",
            "@type": "ALTIMG",
            "@size": "5943",
            "@ref": "si55",
            "@mimetype": "image/svg+xml"
        },
        {
            "@category": "thumbnail",
            "@_fa": "true",
            "$": "https://api.elsevier.com/content/object/eid/1-s2.0-S0306261921004542-si56.svg?httpAccept=%2A%2F%2A",
            "@multimediatype": "Scalable Vector Graphics file",
            "@type": "ALTIMG",
            "@size": "6175",
            "@ref": "si56",
            "@mimetype": "image/svg+xml"
        },
        {
            "@category": "thumbnail",
            "@_fa": "true",
            "$": "https://api.elsevier.com/content/object/eid/1-s2.0-S0306261921004542-si57.svg?httpAccept=%2A%2F%2A",
            "@multimediatype": "Scalable Vector Graphics file",
            "@type": "ALTIMG",
            "@size": "6014",
            "@ref": "si57",
            "@mimetype": "image/svg+xml"
        },
        {
            "@category": "thumbnail",
            "@_fa": "true",
            "$": "https://api.elsevier.com/content/object/eid/1-s2.0-S0306261921004542-si58.svg?httpAccept=%2A%2F%2A",
            "@multimediatype": "Scalable Vector Graphics file",
            "@type": "ALTIMG",
            "@size": "6299",
            "@ref": "si58",
            "@mimetype": "image/svg+xml"
        },
        {
            "@category": "thumbnail",
            "@_fa": "true",
            "$": "https://api.elsevier.com/content/object/eid/1-s2.0-S0306261921004542-si59.svg?httpAccept=%2A%2F%2A",
            "@multimediatype": "Scalable Vector Graphics file",
            "@type": "ALTIMG",
            "@size": "6176",
            "@ref": "si59",
            "@mimetype": "image/svg+xml"
        },
        {
            "@category": "thumbnail",
            "@_fa": "true",
            "$": "https://api.elsevier.com/content/object/eid/1-s2.0-S0306261921004542-si6.svg?httpAccept=%2A%2F%2A",
            "@multimediatype": "Scalable Vector Graphics file",
            "@type": "ALTIMG",
            "@size": "1441",
            "@ref": "si6",
            "@mimetype": "image/svg+xml"
        },
        {
            "@category": "thumbnail",
            "@_fa": "true",
            "$": "https://api.elsevier.com/content/object/eid/1-s2.0-S0306261921004542-si60.svg?httpAccept=%2A%2F%2A",
            "@multimediatype": "Scalable Vector Graphics file",
            "@type": "ALTIMG",
            "@size": "5167",
            "@ref": "si60",
            "@mimetype": "image/svg+xml"
        },
        {
            "@category": "thumbnail",
            "@_fa": "true",
            "$": "https://api.elsevier.com/content/object/eid/1-s2.0-S0306261921004542-si61.svg?httpAccept=%2A%2F%2A",
            "@multimediatype": "Scalable Vector Graphics file",
            "@type": "ALTIMG",
            "@size": "6041",
            "@ref": "si61",
            "@mimetype": "image/svg+xml"
        },
        {
            "@category": "thumbnail",
            "@_fa": "true",
            "$": "https://api.elsevier.com/content/object/eid/1-s2.0-S0306261921004542-si62.svg?httpAccept=%2A%2F%2A",
            "@multimediatype": "Scalable Vector Graphics file",
            "@type": "ALTIMG",
            "@size": "4802",
            "@ref": "si62",
            "@mimetype": "image/svg+xml"
        },
        {
            "@category": "thumbnail",
            "@_fa": "true",
            "$": "https://api.elsevier.com/content/object/eid/1-s2.0-S0306261921004542-si63.svg?httpAccept=%2A%2F%2A",
            "@multimediatype": "Scalable Vector Graphics file",
            "@type": "ALTIMG",
            "@size": "4493",
            "@ref": "si63",
            "@mimetype": "image/svg+xml"
        },
        {
            "@category": "thumbnail",
            "@_fa": "true",
            "$": "https://api.elsevier.com/content/object/eid/1-s2.0-S0306261921004542-si64.svg?httpAccept=%2A%2F%2A",
            "@multimediatype": "Scalable Vector Graphics file",
            "@type": "ALTIMG",
            "@size": "9528",
            "@ref": "si64",
            "@mimetype": "image/svg+xml"
        },
        {
            "@category": "thumbnail",
            "@_fa": "true",
            "$": "https://api.elsevier.com/content/object/eid/1-s2.0-S0306261921004542-si65.svg?httpAccept=%2A%2F%2A",
            "@multimediatype": "Scalable Vector Graphics file",
            "@type": "ALTIMG",
            "@size": "4307",
            "@ref": "si65",
            "@mimetype": "image/svg+xml"
        },
        {
            "@category": "thumbnail",
            "@_fa": "true",
            "$": "https://api.elsevier.com/content/object/eid/1-s2.0-S0306261921004542-si66.svg?httpAccept=%2A%2F%2A",
            "@multimediatype": "Scalable Vector Graphics file",
            "@type": "ALTIMG",
            "@size": "3638",
            "@ref": "si66",
            "@mimetype": "image/svg+xml"
        },
        {
            "@category": "thumbnail",
            "@_fa": "true",
            "$": "https://api.elsevier.com/content/object/eid/1-s2.0-S0306261921004542-si67.svg?httpAccept=%2A%2F%2A",
            "@multimediatype": "Scalable Vector Graphics file",
            "@type": "ALTIMG",
            "@size": "4781",
            "@ref": "si67",
            "@mimetype": "image/svg+xml"
        },
        {
            "@category": "thumbnail",
            "@_fa": "true",
            "$": "https://api.elsevier.com/content/object/eid/1-s2.0-S0306261921004542-si68.svg?httpAccept=%2A%2F%2A",
            "@multimediatype": "Scalable Vector Graphics file",
            "@type": "ALTIMG",
            "@size": "4031",
            "@ref": "si68",
            "@mimetype": "image/svg+xml"
        },
        {
            "@category": "thumbnail",
            "@_fa": "true",
            "$": "https://api.elsevier.com/content/object/eid/1-s2.0-S0306261921004542-si69.svg?httpAccept=%2A%2F%2A",
            "@multimediatype": "Scalable Vector Graphics file",
            "@type": "ALTIMG",
            "@size": "4662",
            "@ref": "si69",
            "@mimetype": "image/svg+xml"
        },
        {
            "@category": "thumbnail",
            "@_fa": "true",
            "$": "https://api.elsevier.com/content/object/eid/1-s2.0-S0306261921004542-si7.svg?httpAccept=%2A%2F%2A",
            "@multimediatype": "Scalable Vector Graphics file",
            "@type": "ALTIMG",
            "@size": "1651",
            "@ref": "si7",
            "@mimetype": "image/svg+xml"
        },
        {
            "@category": "thumbnail",
            "@_fa": "true",
            "$": "https://api.elsevier.com/content/object/eid/1-s2.0-S0306261921004542-si70.svg?httpAccept=%2A%2F%2A",
            "@multimediatype": "Scalable Vector Graphics file",
            "@type": "ALTIMG",
            "@size": "24004",
            "@ref": "si70",
            "@mimetype": "image/svg+xml"
        },
        {
            "@category": "thumbnail",
            "@_fa": "true",
            "$": "https://api.elsevier.com/content/object/eid/1-s2.0-S0306261921004542-si71.svg?httpAccept=%2A%2F%2A",
            "@multimediatype": "Scalable Vector Graphics file",
            "@type": "ALTIMG",
            "@size": "25827",
            "@ref": "si71",
            "@mimetype": "image/svg+xml"
        },
        {
            "@category": "thumbnail",
            "@_fa": "true",
            "$": "https://api.elsevier.com/content/object/eid/1-s2.0-S0306261921004542-si72.svg?httpAccept=%2A%2F%2A",
            "@multimediatype": "Scalable Vector Graphics file",
            "@type": "ALTIMG",
            "@size": "25432",
            "@ref": "si72",
            "@mimetype": "image/svg+xml"
        },
        {
            "@category": "thumbnail",
            "@_fa": "true",
            "$": "https://api.elsevier.com/content/object/eid/1-s2.0-S0306261921004542-si73.svg?httpAccept=%2A%2F%2A",
            "@multimediatype": "Scalable Vector Graphics file",
            "@type": "ALTIMG",
            "@size": "11867",
            "@ref": "si73",
            "@mimetype": "image/svg+xml"
        },
        {
            "@category": "thumbnail",
            "@_fa": "true",
            "$": "https://api.elsevier.com/content/object/eid/1-s2.0-S0306261921004542-si74.svg?httpAccept=%2A%2F%2A",
            "@multimediatype": "Scalable Vector Graphics file",
            "@type": "ALTIMG",
            "@size": "21786",
            "@ref": "si74",
            "@mimetype": "image/svg+xml"
        },
        {
            "@category": "thumbnail",
            "@_fa": "true",
            "$": "https://api.elsevier.com/content/object/eid/1-s2.0-S0306261921004542-si75.svg?httpAccept=%2A%2F%2A",
            "@multimediatype": "Scalable Vector Graphics file",
            "@type": "ALTIMG",
            "@size": "29253",
            "@ref": "si75",
            "@mimetype": "image/svg+xml"
        },
        {
            "@category": "thumbnail",
            "@_fa": "true",
            "$": "https://api.elsevier.com/content/object/eid/1-s2.0-S0306261921004542-si76.svg?httpAccept=%2A%2F%2A",
            "@multimediatype": "Scalable Vector Graphics file",
            "@type": "ALTIMG",
            "@size": "21476",
            "@ref": "si76",
            "@mimetype": "image/svg+xml"
        },
        {
            "@category": "thumbnail",
            "@_fa": "true",
            "$": "https://api.elsevier.com/content/object/eid/1-s2.0-S0306261921004542-si77.svg?httpAccept=%2A%2F%2A",
            "@multimediatype": "Scalable Vector Graphics file",
            "@type": "ALTIMG",
            "@size": "18893",
            "@ref": "si77",
            "@mimetype": "image/svg+xml"
        },
        {
            "@category": "thumbnail",
            "@_fa": "true",
            "$": "https://api.elsevier.com/content/object/eid/1-s2.0-S0306261921004542-si78.svg?httpAccept=%2A%2F%2A",
            "@multimediatype": "Scalable Vector Graphics file",
            "@type": "ALTIMG",
            "@size": "23725",
            "@ref": "si78",
            "@mimetype": "image/svg+xml"
        },
        {
            "@category": "thumbnail",
            "@_fa": "true",
            "$": "https://api.elsevier.com/content/object/eid/1-s2.0-S0306261921004542-si79.svg?httpAccept=%2A%2F%2A",
            "@multimediatype": "Scalable Vector Graphics file",
            "@type": "ALTIMG",
            "@size": "8417",
            "@ref": "si79",
            "@mimetype": "image/svg+xml"
        },
        {
            "@category": "thumbnail",
            "@_fa": "true",
            "$": "https://api.elsevier.com/content/object/eid/1-s2.0-S0306261921004542-si8.svg?httpAccept=%2A%2F%2A",
            "@multimediatype": "Scalable Vector Graphics file",
            "@type": "ALTIMG",
            "@size": "1068",
            "@ref": "si8",
            "@mimetype": "image/svg+xml"
        },
        {
            "@category": "thumbnail",
            "@_fa": "true",
            "$": "https://api.elsevier.com/content/object/eid/1-s2.0-S0306261921004542-si82.svg?httpAccept=%2A%2F%2A",
            "@multimediatype": "Scalable Vector Graphics file",
            "@type": "ALTIMG",
            "@size": "10567",
            "@ref": "si82",
            "@mimetype": "image/svg+xml"
        },
        {
            "@category": "thumbnail",
            "@_fa": "true",
            "$": "https://api.elsevier.com/content/object/eid/1-s2.0-S0306261921004542-si83.svg?httpAccept=%2A%2F%2A",
            "@multimediatype": "Scalable Vector Graphics file",
            "@type": "ALTIMG",
            "@size": "2834",
            "@ref": "si83",
            "@mimetype": "image/svg+xml"
        },
        {
            "@category": "thumbnail",
            "@_fa": "true",
            "$": "https://api.elsevier.com/content/object/eid/1-s2.0-S0306261921004542-si87.svg?httpAccept=%2A%2F%2A",
            "@multimediatype": "Scalable Vector Graphics file",
            "@type": "ALTIMG",
            "@size": "3777",
            "@ref": "si87",
            "@mimetype": "image/svg+xml"
        },
        {
            "@category": "thumbnail",
            "@_fa": "true",
            "$": "https://api.elsevier.com/content/object/eid/1-s2.0-S0306261921004542-si88.svg?httpAccept=%2A%2F%2A",
            "@multimediatype": "Scalable Vector Graphics file",
            "@type": "ALTIMG",
            "@size": "15393",
            "@ref": "si88",
            "@mimetype": "image/svg+xml"
        },
        {
            "@category": "thumbnail",
            "@_fa": "true",
            "$": "https://api.elsevier.com/content/object/eid/1-s2.0-S0306261921004542-si89.svg?httpAccept=%2A%2F%2A",
            "@multimediatype": "Scalable Vector Graphics file",
            "@type": "ALTIMG",
            "@size": "14726",
            "@ref": "si89",
            "@mimetype": "image/svg+xml"
        },
        {
            "@category": "thumbnail",
            "@_fa": "true",
            "$": "https://api.elsevier.com/content/object/eid/1-s2.0-S0306261921004542-si9.svg?httpAccept=%2A%2F%2A",
            "@multimediatype": "Scalable Vector Graphics file",
            "@type": "ALTIMG",
            "@size": "1348",
            "@ref": "si9",
            "@mimetype": "image/svg+xml"
        },
        {
            "@category": "thumbnail",
            "@_fa": "true",
            "$": "https://api.elsevier.com/content/object/eid/1-s2.0-S0306261921004542-si90.svg?httpAccept=%2A%2F%2A",
            "@multimediatype": "Scalable Vector Graphics file",
            "@type": "ALTIMG",
            "@size": "13462",
            "@ref": "si90",
            "@mimetype": "image/svg+xml"
        },
        {
            "@category": "thumbnail",
            "@_fa": "true",
            "$": "https://api.elsevier.com/content/object/eid/1-s2.0-S0306261921004542-si91.svg?httpAccept=%2A%2F%2A",
            "@multimediatype": "Scalable Vector Graphics file",
            "@type": "ALTIMG",
            "@size": "17631",
            "@ref": "si91",
            "@mimetype": "image/svg+xml"
        },
        {
            "@category": "thumbnail",
            "@_fa": "true",
            "$": "https://api.elsevier.com/content/object/eid/1-s2.0-S0306261921004542-si92.svg?httpAccept=%2A%2F%2A",
            "@multimediatype": "Scalable Vector Graphics file",
            "@type": "ALTIMG",
            "@size": "18803",
            "@ref": "si92",
            "@mimetype": "image/svg+xml"
        },
        {
            "@category": "thumbnail",
            "@_fa": "true",
            "$": "https://api.elsevier.com/content/object/eid/1-s2.0-S0306261921004542-si93.svg?httpAccept=%2A%2F%2A",
            "@multimediatype": "Scalable Vector Graphics file",
            "@type": "ALTIMG",
            "@size": "18315",
            "@ref": "si93",
            "@mimetype": "image/svg+xml"
        },
        {
            "@category": "thumbnail",
            "@_fa": "true",
            "$": "https://api.elsevier.com/content/object/eid/1-s2.0-S0306261921004542-si94.svg?httpAccept=%2A%2F%2A",
            "@multimediatype": "Scalable Vector Graphics file",
            "@type": "ALTIMG",
            "@size": "6036",
            "@ref": "si94",
            "@mimetype": "image/svg+xml"
        },
        {
            "@category": "thumbnail",
            "@_fa": "true",
            "$": "https://api.elsevier.com/content/object/eid/1-s2.0-S0306261921004542-si95.svg?httpAccept=%2A%2F%2A",
            "@multimediatype": "Scalable Vector Graphics file",
            "@type": "ALTIMG",
            "@size": "6350",
            "@ref": "si95",
            "@mimetype": "image/svg+xml"
        },
        {
            "@category": "thumbnail",
            "@_fa": "true",
            "$": "https://api.elsevier.com/content/object/eid/1-s2.0-S0306261921004542-si96.svg?httpAccept=%2A%2F%2A",
            "@multimediatype": "Scalable Vector Graphics file",
            "@type": "ALTIMG",
            "@size": "6065",
            "@ref": "si96",
            "@mimetype": "image/svg+xml"
        },
        {
            "@category": "thumbnail",
            "@_fa": "true",
            "$": "https://api.elsevier.com/content/object/eid/1-s2.0-S0306261921004542-si97.svg?httpAccept=%2A%2F%2A",
            "@multimediatype": "Scalable Vector Graphics file",
            "@type": "ALTIMG",
            "@size": "6045",
            "@ref": "si97",
            "@mimetype": "image/svg+xml"
        },
        {
            "@category": "thumbnail",
            "@_fa": "true",
            "$": "https://api.elsevier.com/content/object/eid/1-s2.0-S0306261921004542-si98.svg?httpAccept=%2A%2F%2A",
            "@multimediatype": "Scalable Vector Graphics file",
            "@type": "ALTIMG",
            "@size": "8505",
            "@ref": "si98",
            "@mimetype": "image/svg+xml"
        },
        {
            "@category": "thumbnail",
            "@_fa": "true",
            "$": "https://api.elsevier.com/content/object/eid/1-s2.0-S0306261921004542-si99.svg?httpAccept=%2A%2F%2A",
            "@multimediatype": "Scalable Vector Graphics file",
            "@type": "ALTIMG",
            "@size": "17028",
            "@ref": "si99",
            "@mimetype": "image/svg+xml"
        },
        {
            "@category": "standard",
            "@_fa": "true",
            "$": "https://api.elsevier.com/content/object/eid/1-s2.0-S0306261921004542-am.pdf?httpAccept=%2A%2F%2A",
            "@multimediatype": "Acrobat PDF file",
            "@type": "AAM-PDF",
            "@size": "953934",
            "@ref": "am",
            "@mimetype": "application/pdf"
        }
    ]},
    "link": {
        "@rel": "abstract",
        "@href": "https://api.elsevier.com/content/abstract/scopus_id/85105357703"
    }
}}