{"full-text-retrieval-response": {
    "scopus-eid": "2-s2.0-85135981736",
    "originalText": "serial JL 271429 291210 291702 291731 291787 291877 291878 291881 31 Applied Energy APPLIEDENERGY 2022-08-17 2022-08-17 2022-08-17 2022-08-17 2023-05-24T02:57:29 1-s2.0-S0306261922010509 S0306-2619(22)01050-9 S0306261922010509 10.1016/j.apenergy.2022.119770 S300 S300.1 FULL-TEXT 1-s2.0-S0306261922X00172 2024-01-01T13:30:21.133674Z 0 0 20221101 2022 2022-08-17T12:34:41.811859Z articleinfo articlenumber articletitlenorm authfirstinitialnorm authfirstsurnamenorm cid cids contenttype copyright crossmark dateloaded dateloadedtxt datesearch datesort dateupdated dco docsubtype doctype doi eid ewtransactionid hubeid indexeddate issn issnnorm itemstage itemtransactionid itemweight openaccess openarchive pg pgfirst pii piinorm pubdatestart pubdatetxt pubyr sectiontitle sortorder srctitle srctitlenorm srctype ssids alllist content subj subheadings suppl tomb volfirst volissue volumelist webpdf webpdfpagecount yearnav figure table body mmlmath acknowledge affil articletitle auth authfirstini authfull authkeywords authlast grantsponsor grantsponsorid highlightsabst nomenclature orcid primabst ref 0306-2619 03062619 true 325 325 C Volume 325 18 119770 119770 119770 20221101 1 November 2022 2022-11-01 2022 Research Papers article fla © 2022 Elsevier Ltd. All rights reserved. HOMEENERGYMANAGEMENTUNDERREALISTICUNCERTAINCONDITIONSACOMPARISONHEURISTICDETERMINISTICSTOCHASTICCONTROLMETHODS BLONSKY M Nomenclature 1 Introduction 2 Uncertainty considerations in HEMS 2.1 Forecast uncertainty 2.2 Model uncertainty 2.3 Measurement uncertainty 3 Model description 3.1 Controllable load model 3.2 HVAC and envelope 3.3 Water heater 3.4 Electric vehicle 3.5 Battery 3.6 Combined house model 3.7 Stochastic house model 3.8 Model implementation 4 Control formulation 4.1 Heuristic controls 4.2 Deterministic MPC 4.3 Stochastic MPC 5 Schedule and forecast descriptions 5.1 Weather schedule and forecast 5.2 Occupant schedule and forecast 6 Simulation results and discussion 6.1 Comparison of linear models 6.2 Deterministic MPC 6.3 Stochastic MPC 6.4 Control performance 7 Conclusions CRediT authorship contribution statement Acknowledgments References BLONSKY 2019 169 176 M HLEDIK 2019 R NATIONALPOTENTIALFORLOADFLEXIBILITY BEAUDIN 2015 318 335 M ROTH 2019 A GRIDINTERACTIVEEFFICIENTBUILDINGSTECHNICALREPORTSERIESWHOLEBUILDINGCONTROLSSENSORSMODELINGANALYTICS JIN 2017 1583 1595 X WU 2014 1282 1291 Z PAUL 2019 1566 1578 S GARIFI 2019 K IEEEPOWERENERGYSOCIETYGENERALMEETINGVOL2019AUGUS STOCHASTICHOMEENERGYMANAGEMENTSYSTEMSVARYINGCONTROLLABLERESOURCES HEIRUNG 2018 158 170 T MAASOUMY 2014 377 392 M WU 2015 H IEEEPOWERENERGYSOCIETYGENERALMEETINGVOL2015SEPTE STOCHASTICOPTIMALSCHEDULINGRESIDENTIALAPPLIANCESRENEWABLEENERGYSOURCES PEDERSEN 2018 485 498 T YOUSEFI 2019 2201 2206 M IEEEINTERNATIONALSYMPOSIUMINDUSTRIALELECTRONICSVOL2019JUNE SMARTENERGYMANAGEMENTSYSTEMFORRESIDENTIALHOMESREGARDINGUNCERTAINTIESPHOTOVOLTAICARRAYPLUGINELECTRICVEHICLE THOMAS 2018 1188 1206 D OLDEWURTEL 2012 15 27 F AZUATALAM 2019 555 570 D IWAFUNE 2015 322 329 Y MA 2015 101 116 Y ZHANG 2014 478 483 X 2014EUROPEANCONTROLCONFERENCEECC2014 SAMPLESIZERANDOMIZEDMPCFORCHANCECONSTRAINEDSYSTEMSAPPLICATIONBUILDINGCLIMATECONTROL MAASOUMY 2014 404 411 M PROCEEDINGSAMERICANCONTROLCONFERENCE SELECTINGBUILDINGPREDICTIVECONTROLBASEDMODELUNCERTAINTY RAHMANIANDEBILI 2016 M 201625THINTERNATIONALCONFERENCECOMPUTERCOMMUNICATIONSNETWORKSICCCN2016 ENERGYSCHEDULINGFORASMARTHOMEAPPLYINGSTOCHASTICMODELPREDICTIVECONTROL HU 2020 116838 M GARIFI 2018 K IEEEPOWERENERGYSOCIETYGENERALMEETINGVOL2018AUGUS STOCHASTICMODELPREDICTIVECONTROLFORDEMANDRESPONSEINAHOMEENERGYMANAGEMENTSYSTEM BLONSKY 2021 187 194 M IEEEGREENTECHNOLOGIESCONFERENCEVOL2021APRIL INCORPORATINGRESIDENTIALSMARTELECTRICVEHICLECHARGINGINHOMEENERGYMANAGEMENTSYSTEMS DOUBLEDAY 2020 52 67 K JUNG 2019 1471 1508 W APPLIEDENERGYVOL239 HUMANINTHELOOPHVACOPERATIONSAQUANTITATIVEREVIEWOCCUPANCYCOMFORTENERGYEFFICIENCYDIMENSIONS SERAFINI 2021 3186 L ELECTRONICS2021VOL10PAGE3186VOL10 MULTIHOUSEHOLDENERGYMANAGEMENTINASMARTNEIGHBORHOODINPRESENCEUNCERTAINTIESELECTRICVEHICLES AFRAM 2014 343 355 A BUILDINGENVIRONMENTVOL72 THEORYAPPLICATIONSHVACCONTROLSYSTEMSAREVIEWMODELPREDICTIVECONTROLMPC DONG 2014 89 106 B COMINESI 2018 1 13 S BLONSKY 2020 M IEEESMARTGRIDCOMMNOVEMBER TIMEOFUSEDEMANDCHARGEBATTERYCONTROLLERUSINGSTOCHASTICMODELPREDICTIVECONTROL MUNANKARMI 2021 117149 P ROTH 2016 A INNOVATIONSINBUILDINGENERGYMODELINGRESEARCHDEVELOPMENTOPPORTUNITIESREPORTFOREMERGINGTECHNOLOGIESDISCLAIMER MCKENNA 2016 445 461 E BLONSKY 2021 116732 M MAASOUMY 2013 M ASME2013DYNAMICSYSTEMSCONTROLCONFERENCEDSCC2013VOL2 ONLINESIMULTANEOUSSTATEESTIMATIONPARAMETERADAPTATIONFORBUILDINGPREDICTIVECONTROL SOFOS 2020 M INNOVATIONSINSENSORSCONTROLSFORBUILDINGENERGYMANAGEMENTRESEARCHDEVELOPMENTOPPORTUNITIESREPORTFOREMERGINGTECHNOLOGIES LAUB 1987 115 122 A KALMAN 1960 35 45 R MIRAKHORLI 2018 627 642 A WILLIAM 2018 884 F LARSON 2016 11 20 D CHEN 2021 J STOCHASTICSIMULATIONRESIDENTIALBUILDINGOCCUPANTDRIVENENERGYUSEINABOTTOMUPMODELHOUSINGSTOCK 2020 ALTERNATIVEFUELSDATACENTERELECTRICVEHICLEINFRASTRUCTUREPROJECTIONTOOLEVIPROLITEASSUMPTIONSMETHODOLOGY 2022 TIMEUSEXCELENERGY BLONSKYX2022X119770 BLONSKYX2022X119770XM https://vtw.elsevier.com/content/oragreement/10131 CHU_DOE publishAcceptedManuscriptIndexable 2023-08-17T00:00:00.000Z http://www.elsevier.com/open-access/userlicense/1.0/ 2023-08-17T00:00:00.000Z http://creativecommons.org/licenses/by-nc-nd/4.0/ © 2022 Elsevier Ltd. All rights reserved. 2022-08-22T19:00:54.639Z http://vtw.elsevier.com/data/voc/AddOnTypes/50.7/aggregated-refined item S0306-2619(22)01050-9 S0306261922010509 1-s2.0-S0306261922010509 10.1016/j.apenergy.2022.119770 271429 2024-01-01T13:30:21.133674Z 2022-11-01 1-s2.0-S0306261922010509-main.pdf https://s3-eu-west-1.amazonaws.com/prod-ucs-content-store-eu-west/content/pii:S0306261922010509/MAIN/application/pdf/53940a2840a518fde729d3dc99343bcc/main.pdf main.pdf pdf true 3034642 MAIN 12 1-s2.0-S0306261922010509-main_1.png https://s3-eu-west-1.amazonaws.com/prod-ucs-content-store-eu-west/content/pii:S0306261922010509/PREVIEW/image/png/9f0f7f4380a6f1ab0b04e3181acaf2ec/main_1.png main_1.png png 61969 849 656 IMAGE-WEB-PDF 1 1-s2.0-S0306261922010509-gr8.jpg https://s3-eu-west-1.amazonaws.com/prod-ucs-content-store-eu-west/content/pii:S0306261922010509/gr8/DOWNSAMPLED/image/jpeg/4a7ce2ee320ad951e01ce7abb76d11eb/gr8.jpg gr8 gr8.jpg jpg 86660 181 335 IMAGE-DOWNSAMPLED 1-s2.0-S0306261922010509-gr9.jpg https://s3-eu-west-1.amazonaws.com/prod-ucs-content-store-eu-west/content/pii:S0306261922010509/gr9/DOWNSAMPLED/image/jpeg/1d49267c1486f0254d3b69bc48d4a43f/gr9.jpg gr9 gr9.jpg jpg 176748 677 344 IMAGE-DOWNSAMPLED 1-s2.0-S0306261922010509-gr6.jpg https://s3-eu-west-1.amazonaws.com/prod-ucs-content-store-eu-west/content/pii:S0306261922010509/gr6/DOWNSAMPLED/image/jpeg/fb7016cb52626f3a32f65b9143905081/gr6.jpg gr6 gr6.jpg jpg 95153 267 344 IMAGE-DOWNSAMPLED 1-s2.0-S0306261922010509-gr7.jpg https://s3-eu-west-1.amazonaws.com/prod-ucs-content-store-eu-west/content/pii:S0306261922010509/gr7/DOWNSAMPLED/image/jpeg/7c0a2e25d605430c54fef5f698077691/gr7.jpg gr7 gr7.jpg jpg 111799 212 331 IMAGE-DOWNSAMPLED 1-s2.0-S0306261922010509-gr4.jpg https://s3-eu-west-1.amazonaws.com/prod-ucs-content-store-eu-west/content/pii:S0306261922010509/gr4/DOWNSAMPLED/image/jpeg/ea373a35c50cf301d1b943f08f3b1009/gr4.jpg gr4 gr4.jpg jpg 93154 241 339 IMAGE-DOWNSAMPLED 1-s2.0-S0306261922010509-gr10.jpg https://s3-eu-west-1.amazonaws.com/prod-ucs-content-store-eu-west/content/pii:S0306261922010509/gr10/DOWNSAMPLED/image/jpeg/fffbb173330d0dd115880e776e67dcff/gr10.jpg gr10 gr10.jpg jpg 121416 284 343 IMAGE-DOWNSAMPLED 1-s2.0-S0306261922010509-gr5.jpg https://s3-eu-west-1.amazonaws.com/prod-ucs-content-store-eu-west/content/pii:S0306261922010509/gr5/DOWNSAMPLED/image/jpeg/5df4d87ee43235e53ed4e9f2f3bed8d6/gr5.jpg gr5 gr5.jpg jpg 96695 254 344 IMAGE-DOWNSAMPLED 1-s2.0-S0306261922010509-gr2.jpg https://s3-eu-west-1.amazonaws.com/prod-ucs-content-store-eu-west/content/pii:S0306261922010509/gr2/DOWNSAMPLED/image/jpeg/f557eb18ea93be6d686cb7d591f1f565/gr2.jpg gr2 gr2.jpg jpg 123301 306 696 IMAGE-DOWNSAMPLED 1-s2.0-S0306261922010509-gr12.jpg https://s3-eu-west-1.amazonaws.com/prod-ucs-content-store-eu-west/content/pii:S0306261922010509/gr12/DOWNSAMPLED/image/jpeg/f08a7205b2dee267b059c6331d44d27b/gr12.jpg gr12 gr12.jpg jpg 119931 298 343 IMAGE-DOWNSAMPLED 1-s2.0-S0306261922010509-gr3.jpg https://s3-eu-west-1.amazonaws.com/prod-ucs-content-store-eu-west/content/pii:S0306261922010509/gr3/DOWNSAMPLED/image/jpeg/b2cceaf55c9125ebf577809fe5d80fca/gr3.jpg gr3 gr3.jpg jpg 118608 273 696 IMAGE-DOWNSAMPLED 1-s2.0-S0306261922010509-gr11.jpg https://s3-eu-west-1.amazonaws.com/prod-ucs-content-store-eu-west/content/pii:S0306261922010509/gr11/DOWNSAMPLED/image/jpeg/a0cb3ea28ecfb4b1bb13c81cf78ad618/gr11.jpg gr11 gr11.jpg jpg 95712 187 344 IMAGE-DOWNSAMPLED 1-s2.0-S0306261922010509-gr1.jpg https://s3-eu-west-1.amazonaws.com/prod-ucs-content-store-eu-west/content/pii:S0306261922010509/gr1/DOWNSAMPLED/image/jpeg/462709f779103978c300c6c62684222a/gr1.jpg gr1 gr1.jpg jpg 87954 147 339 IMAGE-DOWNSAMPLED 1-s2.0-S0306261922010509-gr13.jpg https://s3-eu-west-1.amazonaws.com/prod-ucs-content-store-eu-west/content/pii:S0306261922010509/gr13/DOWNSAMPLED/image/jpeg/e46fafb8eb7275607d33f08344483bdd/gr13.jpg gr13 gr13.jpg jpg 127104 342 341 IMAGE-DOWNSAMPLED 1-s2.0-S0306261922010509-gr8.sml https://s3-eu-west-1.amazonaws.com/prod-ucs-content-store-eu-west/content/pii:S0306261922010509/gr8/THUMBNAIL/image/gif/b77b83315c45dd9ec4125caa9488da76/gr8.sml gr8 gr8.sml sml 71815 118 219 IMAGE-THUMBNAIL 1-s2.0-S0306261922010509-gr9.sml https://s3-eu-west-1.amazonaws.com/prod-ucs-content-store-eu-west/content/pii:S0306261922010509/gr9/THUMBNAIL/image/gif/cd17efbc162d18af91d6732e678e1031/gr9.sml gr9 gr9.sml sml 78641 163 83 IMAGE-THUMBNAIL 1-s2.0-S0306261922010509-gr6.sml https://s3-eu-west-1.amazonaws.com/prod-ucs-content-store-eu-west/content/pii:S0306261922010509/gr6/THUMBNAIL/image/gif/8122d281bae64bacfd0b9d738e1c3ec1/gr6.sml gr6 gr6.sml sml 76134 164 211 IMAGE-THUMBNAIL 1-s2.0-S0306261922010509-gr7.sml https://s3-eu-west-1.amazonaws.com/prod-ucs-content-store-eu-west/content/pii:S0306261922010509/gr7/THUMBNAIL/image/gif/4633085fefee97e272fe31d8dd5640bf/gr7.sml gr7 gr7.sml sml 84562 140 219 IMAGE-THUMBNAIL 1-s2.0-S0306261922010509-gr4.sml https://s3-eu-west-1.amazonaws.com/prod-ucs-content-store-eu-west/content/pii:S0306261922010509/gr4/THUMBNAIL/image/gif/514ebec10f988f08179765a4bdd37ec1/gr4.sml gr4 gr4.sml sml 75308 156 219 IMAGE-THUMBNAIL 1-s2.0-S0306261922010509-gr10.sml https://s3-eu-west-1.amazonaws.com/prod-ucs-content-store-eu-west/content/pii:S0306261922010509/gr10/THUMBNAIL/image/gif/40bb4029af26931bd6feb7f7c5f3018f/gr10.sml gr10 gr10.sml sml 86962 164 198 IMAGE-THUMBNAIL 1-s2.0-S0306261922010509-gr5.sml https://s3-eu-west-1.amazonaws.com/prod-ucs-content-store-eu-west/content/pii:S0306261922010509/gr5/THUMBNAIL/image/gif/21a77903326cc31f73e5fe7ed7b5b755/gr5.sml gr5 gr5.sml sml 77912 162 219 IMAGE-THUMBNAIL 1-s2.0-S0306261922010509-gr2.sml https://s3-eu-west-1.amazonaws.com/prod-ucs-content-store-eu-west/content/pii:S0306261922010509/gr2/THUMBNAIL/image/gif/fa1fd933061126d04bfb0228ceb41ade/gr2.sml gr2 gr2.sml sml 72874 96 219 IMAGE-THUMBNAIL 1-s2.0-S0306261922010509-gr12.sml https://s3-eu-west-1.amazonaws.com/prod-ucs-content-store-eu-west/content/pii:S0306261922010509/gr12/THUMBNAIL/image/gif/d56b0b591af1bb5eb72ad58df64c8761/gr12.sml gr12 gr12.sml sml 85633 163 188 IMAGE-THUMBNAIL 1-s2.0-S0306261922010509-gr3.sml https://s3-eu-west-1.amazonaws.com/prod-ucs-content-store-eu-west/content/pii:S0306261922010509/gr3/THUMBNAIL/image/gif/64fc6220fc21444c30397aa595f1b0ad/gr3.sml gr3 gr3.sml sml 71163 86 219 IMAGE-THUMBNAIL 1-s2.0-S0306261922010509-gr11.sml https://s3-eu-west-1.amazonaws.com/prod-ucs-content-store-eu-west/content/pii:S0306261922010509/gr11/THUMBNAIL/image/gif/c30ef287a05eab67eff88ba82343544d/gr11.sml gr11 gr11.sml sml 79861 119 219 IMAGE-THUMBNAIL 1-s2.0-S0306261922010509-gr1.sml https://s3-eu-west-1.amazonaws.com/prod-ucs-content-store-eu-west/content/pii:S0306261922010509/gr1/THUMBNAIL/image/gif/c9fc5c41e168a23ac8d98c89b911d613/gr1.sml gr1 gr1.sml sml 76036 95 219 IMAGE-THUMBNAIL 1-s2.0-S0306261922010509-gr13.sml https://s3-eu-west-1.amazonaws.com/prod-ucs-content-store-eu-west/content/pii:S0306261922010509/gr13/THUMBNAIL/image/gif/62372cf98e7df6b0a17ca31e138c0853/gr13.sml gr13 gr13.sml sml 83897 164 163 IMAGE-THUMBNAIL 1-s2.0-S0306261922010509-gr8_lrg.jpg https://s3-eu-west-1.amazonaws.com/prod-ucs-content-store-eu-west/content/pii:S0306261922010509/HIGHRES/image/jpeg/d3afb6bea9232221c425e4953a8ec139/gr8_lrg.jpg gr8 gr8_lrg.jpg jpg 161556 801 1483 IMAGE-HIGH-RES 1-s2.0-S0306261922010509-gr9_lrg.jpg https://s3-eu-west-1.amazonaws.com/prod-ucs-content-store-eu-west/content/pii:S0306261922010509/HIGHRES/image/jpeg/d7ad7b8a748dadce8aa46e112eec60ed/gr9_lrg.jpg gr9 gr9_lrg.jpg jpg 809260 3001 1524 IMAGE-HIGH-RES 1-s2.0-S0306261922010509-gr6_lrg.jpg https://s3-eu-west-1.amazonaws.com/prod-ucs-content-store-eu-west/content/pii:S0306261922010509/HIGHRES/image/jpeg/fcaa5bf2a6c28cb2db7093d7f58adb39/gr6_lrg.jpg gr6 gr6_lrg.jpg jpg 219293 1182 1523 IMAGE-HIGH-RES 1-s2.0-S0306261922010509-gr7_lrg.jpg https://s3-eu-west-1.amazonaws.com/prod-ucs-content-store-eu-west/content/pii:S0306261922010509/HIGHRES/image/jpeg/bea35685abd3a3ddd910f130e5ebb394/gr7_lrg.jpg gr7 gr7_lrg.jpg jpg 340850 939 1468 IMAGE-HIGH-RES 1-s2.0-S0306261922010509-gr4_lrg.jpg https://s3-eu-west-1.amazonaws.com/prod-ucs-content-store-eu-west/content/pii:S0306261922010509/HIGHRES/image/jpeg/66038eaed863b22df718116b688064df/gr4_lrg.jpg gr4 gr4_lrg.jpg jpg 202950 1068 1500 IMAGE-HIGH-RES 1-s2.0-S0306261922010509-gr10_lrg.jpg https://s3-eu-west-1.amazonaws.com/prod-ucs-content-store-eu-west/content/pii:S0306261922010509/HIGHRES/image/jpeg/3b752e1f729742b895bbf7481432d3fa/gr10_lrg.jpg gr10 gr10_lrg.jpg jpg 402875 1256 1519 IMAGE-HIGH-RES 1-s2.0-S0306261922010509-gr5_lrg.jpg https://s3-eu-west-1.amazonaws.com/prod-ucs-content-store-eu-west/content/pii:S0306261922010509/HIGHRES/image/jpeg/4debb3ce9becf64d6cb02f7ccd14ce80/gr5_lrg.jpg gr5 gr5_lrg.jpg jpg 231969 1125 1523 IMAGE-HIGH-RES 1-s2.0-S0306261922010509-gr2_lrg.jpg https://s3-eu-west-1.amazonaws.com/prod-ucs-content-store-eu-west/content/pii:S0306261922010509/HIGHRES/image/jpeg/ade238b46b6e9c6023577b31c186e86d/gr2_lrg.jpg gr2 gr2_lrg.jpg jpg 478751 1354 3083 IMAGE-HIGH-RES 1-s2.0-S0306261922010509-gr12_lrg.jpg https://s3-eu-west-1.amazonaws.com/prod-ucs-content-store-eu-west/content/pii:S0306261922010509/HIGHRES/image/jpeg/d088a48663f5f49b65e081a33586ef6a/gr12_lrg.jpg gr12 gr12_lrg.jpg jpg 407872 1321 1519 IMAGE-HIGH-RES 1-s2.0-S0306261922010509-gr3_lrg.jpg https://s3-eu-west-1.amazonaws.com/prod-ucs-content-store-eu-west/content/pii:S0306261922010509/HIGHRES/image/jpeg/b285363fca8692c09e7b901825c089d8/gr3_lrg.jpg gr3 gr3_lrg.jpg jpg 375139 1211 3083 IMAGE-HIGH-RES 1-s2.0-S0306261922010509-gr11_lrg.jpg https://s3-eu-west-1.amazonaws.com/prod-ucs-content-store-eu-west/content/pii:S0306261922010509/HIGHRES/image/jpeg/c45b6fb584dd59a3d07319739f54c42e/gr11_lrg.jpg gr11 gr11_lrg.jpg jpg 246596 829 1524 IMAGE-HIGH-RES 1-s2.0-S0306261922010509-gr1_lrg.jpg https://s3-eu-west-1.amazonaws.com/prod-ucs-content-store-eu-west/content/pii:S0306261922010509/HIGHRES/image/jpeg/313132149bf8dd9d77f13ff5d8c2746b/gr1_lrg.jpg gr1 gr1_lrg.jpg jpg 209455 651 1504 IMAGE-HIGH-RES 1-s2.0-S0306261922010509-gr13_lrg.jpg https://s3-eu-west-1.amazonaws.com/prod-ucs-content-store-eu-west/content/pii:S0306261922010509/HIGHRES/image/jpeg/ba77e0e52d41c859453161ee7f418766/gr13_lrg.jpg gr13 gr13_lrg.jpg jpg 412379 1515 1509 IMAGE-HIGH-RES 1-s2.0-S0306261922010509-si1.svg https://s3-eu-west-1.amazonaws.com/prod-ucs-content-store-eu-west/content/pii:S0306261922010509/image/svg+xml/c56dc9cd3a09d0022b7f7fcdbb9a3ac4/si1.svg si1 si1.svg svg 2726 ALTIMG 1-s2.0-S0306261922010509-si100.svg https://s3-eu-west-1.amazonaws.com/prod-ucs-content-store-eu-west/content/pii:S0306261922010509/image/svg+xml/2233b8c38178ee35eda5879164a2dac2/si100.svg si100 si100.svg svg 2102 ALTIMG 1-s2.0-S0306261922010509-si101.svg https://s3-eu-west-1.amazonaws.com/prod-ucs-content-store-eu-west/content/pii:S0306261922010509/image/svg+xml/f55a1f9cb7fd3c18a671453891671c1b/si101.svg si101 si101.svg svg 11743 ALTIMG 1-s2.0-S0306261922010509-si103.svg https://s3-eu-west-1.amazonaws.com/prod-ucs-content-store-eu-west/content/pii:S0306261922010509/image/svg+xml/cc33044e384507ab82d96ce586a3e703/si103.svg si103 si103.svg svg 4073 ALTIMG 1-s2.0-S0306261922010509-si106.svg https://s3-eu-west-1.amazonaws.com/prod-ucs-content-store-eu-west/content/pii:S0306261922010509/image/svg+xml/06126245389ca0d67e8090af1ffa71ca/si106.svg si106 si106.svg svg 2158 ALTIMG 1-s2.0-S0306261922010509-si11.svg https://s3-eu-west-1.amazonaws.com/prod-ucs-content-store-eu-west/content/pii:S0306261922010509/image/svg+xml/6f77050fa5852ffbcf37fb940672902c/si11.svg si11 si11.svg svg 7509 ALTIMG 1-s2.0-S0306261922010509-si110.svg https://s3-eu-west-1.amazonaws.com/prod-ucs-content-store-eu-west/content/pii:S0306261922010509/image/svg+xml/1c5a6a9833bc824ee32a968a75b498db/si110.svg si110 si110.svg svg 12873 ALTIMG 1-s2.0-S0306261922010509-si117.svg https://s3-eu-west-1.amazonaws.com/prod-ucs-content-store-eu-west/content/pii:S0306261922010509/image/svg+xml/71d1b8c55601c201dc71ac0f4d43983a/si117.svg si117 si117.svg svg 14957 ALTIMG 1-s2.0-S0306261922010509-si118.svg https://s3-eu-west-1.amazonaws.com/prod-ucs-content-store-eu-west/content/pii:S0306261922010509/image/svg+xml/34a523ffc208a2f3f6445f3f24d5070d/si118.svg si118 si118.svg svg 2297 ALTIMG 1-s2.0-S0306261922010509-si120.svg https://s3-eu-west-1.amazonaws.com/prod-ucs-content-store-eu-west/content/pii:S0306261922010509/image/svg+xml/b6e587825d4781c6f15dcf5d9eab1f0c/si120.svg si120 si120.svg svg 2641 ALTIMG 1-s2.0-S0306261922010509-si122.svg https://s3-eu-west-1.amazonaws.com/prod-ucs-content-store-eu-west/content/pii:S0306261922010509/image/svg+xml/ea07955512193950a87b084588aeb9d8/si122.svg si122 si122.svg svg 1019 ALTIMG 1-s2.0-S0306261922010509-si123.svg https://s3-eu-west-1.amazonaws.com/prod-ucs-content-store-eu-west/content/pii:S0306261922010509/image/svg+xml/b3a51ade24e90b80e79256df81874d5f/si123.svg si123 si123.svg svg 6487 ALTIMG 1-s2.0-S0306261922010509-si124.svg https://s3-eu-west-1.amazonaws.com/prod-ucs-content-store-eu-west/content/pii:S0306261922010509/image/svg+xml/56b7dbf0e5e4d3918daf411105650cb7/si124.svg si124 si124.svg svg 5810 ALTIMG 1-s2.0-S0306261922010509-si125.svg https://s3-eu-west-1.amazonaws.com/prod-ucs-content-store-eu-west/content/pii:S0306261922010509/image/svg+xml/a6fc2150c8ad2828dcfb31f4b92db7fb/si125.svg si125 si125.svg svg 10596 ALTIMG 1-s2.0-S0306261922010509-si126.svg https://s3-eu-west-1.amazonaws.com/prod-ucs-content-store-eu-west/content/pii:S0306261922010509/image/svg+xml/118082f34049a1681da0329b860aaf54/si126.svg si126 si126.svg svg 22370 ALTIMG 1-s2.0-S0306261922010509-si128.svg https://s3-eu-west-1.amazonaws.com/prod-ucs-content-store-eu-west/content/pii:S0306261922010509/image/svg+xml/11e65017a0b76e0ddaea706cfac4654c/si128.svg si128 si128.svg svg 8564 ALTIMG 1-s2.0-S0306261922010509-si130.svg https://s3-eu-west-1.amazonaws.com/prod-ucs-content-store-eu-west/content/pii:S0306261922010509/image/svg+xml/710f74880220ca7876a671bd94686405/si130.svg si130 si130.svg svg 8321 ALTIMG 1-s2.0-S0306261922010509-si131.svg https://s3-eu-west-1.amazonaws.com/prod-ucs-content-store-eu-west/content/pii:S0306261922010509/image/svg+xml/b9fca81662141dc503998a247c39fe00/si131.svg si131 si131.svg svg 7609 ALTIMG 1-s2.0-S0306261922010509-si132.svg https://s3-eu-west-1.amazonaws.com/prod-ucs-content-store-eu-west/content/pii:S0306261922010509/image/svg+xml/f2f5e96f5a8d66b637f3b5d299282c83/si132.svg si132 si132.svg svg 16381 ALTIMG 1-s2.0-S0306261922010509-si136.svg https://s3-eu-west-1.amazonaws.com/prod-ucs-content-store-eu-west/content/pii:S0306261922010509/image/svg+xml/cd0f84127249aae27838abcfe2c16e1d/si136.svg si136 si136.svg svg 5747 ALTIMG 1-s2.0-S0306261922010509-si137.svg https://s3-eu-west-1.amazonaws.com/prod-ucs-content-store-eu-west/content/pii:S0306261922010509/image/svg+xml/a7589194108ea29c39e977fb70ee7d51/si137.svg si137 si137.svg svg 3376 ALTIMG 1-s2.0-S0306261922010509-si138.svg https://s3-eu-west-1.amazonaws.com/prod-ucs-content-store-eu-west/content/pii:S0306261922010509/image/svg+xml/f2b26a0c92022aaefaeb3f29b9100680/si138.svg si138 si138.svg svg 16840 ALTIMG 1-s2.0-S0306261922010509-si14.svg https://s3-eu-west-1.amazonaws.com/prod-ucs-content-store-eu-west/content/pii:S0306261922010509/image/svg+xml/b432d45c0dd211fd77894df259023f71/si14.svg si14 si14.svg svg 3508 ALTIMG 1-s2.0-S0306261922010509-si141.svg https://s3-eu-west-1.amazonaws.com/prod-ucs-content-store-eu-west/content/pii:S0306261922010509/image/svg+xml/d49a1bee6c9b15b804b4965e9c2ef01d/si141.svg si141 si141.svg svg 21221 ALTIMG 1-s2.0-S0306261922010509-si143.svg https://s3-eu-west-1.amazonaws.com/prod-ucs-content-store-eu-west/content/pii:S0306261922010509/image/svg+xml/862c979d4902a186da56d7de770a7f91/si143.svg si143 si143.svg svg 1859 ALTIMG 1-s2.0-S0306261922010509-si146.svg https://s3-eu-west-1.amazonaws.com/prod-ucs-content-store-eu-west/content/pii:S0306261922010509/image/svg+xml/0e49ff90de3f9080c5f20a0fd405e652/si146.svg si146 si146.svg svg 1100 ALTIMG 1-s2.0-S0306261922010509-si147.svg https://s3-eu-west-1.amazonaws.com/prod-ucs-content-store-eu-west/content/pii:S0306261922010509/image/svg+xml/d534ab4a9060f04624d063977d26841a/si147.svg si147 si147.svg svg 2350 ALTIMG 1-s2.0-S0306261922010509-si148.svg https://s3-eu-west-1.amazonaws.com/prod-ucs-content-store-eu-west/content/pii:S0306261922010509/image/svg+xml/6a2d915816890af77de9ba4531140b86/si148.svg si148 si148.svg svg 6227 ALTIMG 1-s2.0-S0306261922010509-si149.svg https://s3-eu-west-1.amazonaws.com/prod-ucs-content-store-eu-west/content/pii:S0306261922010509/image/svg+xml/bf1db783df09ec15455be7fe4960f1ef/si149.svg si149 si149.svg svg 5976 ALTIMG 1-s2.0-S0306261922010509-si150.svg https://s3-eu-west-1.amazonaws.com/prod-ucs-content-store-eu-west/content/pii:S0306261922010509/image/svg+xml/7b2d9a41ca81017af3847304d6655f00/si150.svg si150 si150.svg svg 11691 ALTIMG 1-s2.0-S0306261922010509-si151.svg https://s3-eu-west-1.amazonaws.com/prod-ucs-content-store-eu-west/content/pii:S0306261922010509/image/svg+xml/626fecf8f5fd553f962617d71c3dc5fb/si151.svg si151 si151.svg svg 18796 ALTIMG 1-s2.0-S0306261922010509-si152.svg https://s3-eu-west-1.amazonaws.com/prod-ucs-content-store-eu-west/content/pii:S0306261922010509/image/svg+xml/73183024713dc2958acc6647bd9d9ef8/si152.svg si152 si152.svg svg 3224 ALTIMG 1-s2.0-S0306261922010509-si154.svg https://s3-eu-west-1.amazonaws.com/prod-ucs-content-store-eu-west/content/pii:S0306261922010509/image/svg+xml/8f6ab1f2f3a69a97242caedf3be6247d/si154.svg si154 si154.svg svg 3415 ALTIMG 1-s2.0-S0306261922010509-si155.svg https://s3-eu-west-1.amazonaws.com/prod-ucs-content-store-eu-west/content/pii:S0306261922010509/image/svg+xml/074ebf357184c4b4343a2ab21eaa29b0/si155.svg si155 si155.svg svg 3350 ALTIMG 1-s2.0-S0306261922010509-si158.svg https://s3-eu-west-1.amazonaws.com/prod-ucs-content-store-eu-west/content/pii:S0306261922010509/image/svg+xml/5ce495a5aa7e337728df84e1507709f4/si158.svg si158 si158.svg svg 5158 ALTIMG 1-s2.0-S0306261922010509-si159.svg https://s3-eu-west-1.amazonaws.com/prod-ucs-content-store-eu-west/content/pii:S0306261922010509/image/svg+xml/004ccbecf149f2a616faaada7f634da8/si159.svg si159 si159.svg svg 10325 ALTIMG 1-s2.0-S0306261922010509-si16.svg https://s3-eu-west-1.amazonaws.com/prod-ucs-content-store-eu-west/content/pii:S0306261922010509/image/svg+xml/d555d260a0393d02615631131b48b8ea/si16.svg si16 si16.svg svg 1319 ALTIMG 1-s2.0-S0306261922010509-si160.svg https://s3-eu-west-1.amazonaws.com/prod-ucs-content-store-eu-west/content/pii:S0306261922010509/image/svg+xml/cc88105445e81a7a085da0a234ab78bf/si160.svg si160 si160.svg svg 15234 ALTIMG 1-s2.0-S0306261922010509-si161.svg https://s3-eu-west-1.amazonaws.com/prod-ucs-content-store-eu-west/content/pii:S0306261922010509/image/svg+xml/4ecb381b1f18f9bff977ffd1d364a504/si161.svg si161 si161.svg svg 11989 ALTIMG 1-s2.0-S0306261922010509-si162.svg https://s3-eu-west-1.amazonaws.com/prod-ucs-content-store-eu-west/content/pii:S0306261922010509/image/svg+xml/4c61073c407177832ac03f4cbb73254a/si162.svg si162 si162.svg svg 6285 ALTIMG 1-s2.0-S0306261922010509-si163.svg https://s3-eu-west-1.amazonaws.com/prod-ucs-content-store-eu-west/content/pii:S0306261922010509/image/svg+xml/2ce25a22494fb640f44d59844a548225/si163.svg si163 si163.svg svg 4173 ALTIMG 1-s2.0-S0306261922010509-si164.svg https://s3-eu-west-1.amazonaws.com/prod-ucs-content-store-eu-west/content/pii:S0306261922010509/image/svg+xml/8efe83d2bd1703600bc31baf21a09dd9/si164.svg si164 si164.svg svg 5121 ALTIMG 1-s2.0-S0306261922010509-si166.svg https://s3-eu-west-1.amazonaws.com/prod-ucs-content-store-eu-west/content/pii:S0306261922010509/image/svg+xml/a803efbc1bb041d084e6a71536f7f48d/si166.svg si166 si166.svg svg 11719 ALTIMG 1-s2.0-S0306261922010509-si167.svg https://s3-eu-west-1.amazonaws.com/prod-ucs-content-store-eu-west/content/pii:S0306261922010509/image/svg+xml/bbd38921a70f872dbc8a5c765af1ad65/si167.svg si167 si167.svg svg 6292 ALTIMG 1-s2.0-S0306261922010509-si169.svg https://s3-eu-west-1.amazonaws.com/prod-ucs-content-store-eu-west/content/pii:S0306261922010509/image/svg+xml/cd903861d89c806e4ab6f5377ade2611/si169.svg si169 si169.svg svg 14303 ALTIMG 1-s2.0-S0306261922010509-si17.svg https://s3-eu-west-1.amazonaws.com/prod-ucs-content-store-eu-west/content/pii:S0306261922010509/image/svg+xml/31191de3ac87660dae0f743085fa52c6/si17.svg si17 si17.svg svg 7125 ALTIMG 1-s2.0-S0306261922010509-si170.svg https://s3-eu-west-1.amazonaws.com/prod-ucs-content-store-eu-west/content/pii:S0306261922010509/image/svg+xml/3dff1af3d41df12813a02c12b6b5d5a0/si170.svg si170 si170.svg svg 17664 ALTIMG 1-s2.0-S0306261922010509-si171.svg https://s3-eu-west-1.amazonaws.com/prod-ucs-content-store-eu-west/content/pii:S0306261922010509/image/svg+xml/1102f4e74dcf2191a1b0ff84e02235bd/si171.svg si171 si171.svg svg 22156 ALTIMG 1-s2.0-S0306261922010509-si172.svg https://s3-eu-west-1.amazonaws.com/prod-ucs-content-store-eu-west/content/pii:S0306261922010509/image/svg+xml/a23bf7ac7ea9ec400c71016df4f47282/si172.svg si172 si172.svg svg 14148 ALTIMG 1-s2.0-S0306261922010509-si173.svg https://s3-eu-west-1.amazonaws.com/prod-ucs-content-store-eu-west/content/pii:S0306261922010509/image/svg+xml/33446a4c631f94f6273fbbbc99c13c81/si173.svg si173 si173.svg svg 23895 ALTIMG 1-s2.0-S0306261922010509-si174.svg https://s3-eu-west-1.amazonaws.com/prod-ucs-content-store-eu-west/content/pii:S0306261922010509/image/svg+xml/4d7eccb84873b28681b57516758b4c5f/si174.svg si174 si174.svg svg 1163 ALTIMG 1-s2.0-S0306261922010509-si175.svg https://s3-eu-west-1.amazonaws.com/prod-ucs-content-store-eu-west/content/pii:S0306261922010509/image/svg+xml/2cb54ed8726cb727deb6650a2e19e341/si175.svg si175 si175.svg svg 15518 ALTIMG 1-s2.0-S0306261922010509-si178.svg https://s3-eu-west-1.amazonaws.com/prod-ucs-content-store-eu-west/content/pii:S0306261922010509/image/svg+xml/7456507d4ff8d103d90aec9e5c607053/si178.svg si178 si178.svg svg 2011 ALTIMG 1-s2.0-S0306261922010509-si180.svg https://s3-eu-west-1.amazonaws.com/prod-ucs-content-store-eu-west/content/pii:S0306261922010509/image/svg+xml/24997e5e59097b621cf4de894b3c368c/si180.svg si180 si180.svg svg 12678 ALTIMG 1-s2.0-S0306261922010509-si181.svg https://s3-eu-west-1.amazonaws.com/prod-ucs-content-store-eu-west/content/pii:S0306261922010509/image/svg+xml/c90363f2a5bb4ec5e8da82cb340670ac/si181.svg si181 si181.svg svg 8634 ALTIMG 1-s2.0-S0306261922010509-si183.svg https://s3-eu-west-1.amazonaws.com/prod-ucs-content-store-eu-west/content/pii:S0306261922010509/image/svg+xml/d94fc6e92c26fe73d2243ec3a1f27518/si183.svg si183 si183.svg svg 9874 ALTIMG 1-s2.0-S0306261922010509-si184.svg https://s3-eu-west-1.amazonaws.com/prod-ucs-content-store-eu-west/content/pii:S0306261922010509/image/svg+xml/348311d9135910067ec3dda0d07c0b59/si184.svg si184 si184.svg svg 9151 ALTIMG 1-s2.0-S0306261922010509-si185.svg https://s3-eu-west-1.amazonaws.com/prod-ucs-content-store-eu-west/content/pii:S0306261922010509/image/svg+xml/aef4bbc418cb30d0e9fb88003cf31889/si185.svg si185 si185.svg svg 9256 ALTIMG 1-s2.0-S0306261922010509-si186.svg https://s3-eu-west-1.amazonaws.com/prod-ucs-content-store-eu-west/content/pii:S0306261922010509/image/svg+xml/834c3cfbde768e2a94698827829e18fc/si186.svg si186 si186.svg svg 7650 ALTIMG 1-s2.0-S0306261922010509-si187.svg https://s3-eu-west-1.amazonaws.com/prod-ucs-content-store-eu-west/content/pii:S0306261922010509/image/svg+xml/bcb4f748b421667dcfdc0482ec26998f/si187.svg si187 si187.svg svg 3977 ALTIMG 1-s2.0-S0306261922010509-si189.svg https://s3-eu-west-1.amazonaws.com/prod-ucs-content-store-eu-west/content/pii:S0306261922010509/image/svg+xml/c1b19d47a6d243f848e149d1871c2027/si189.svg si189 si189.svg svg 28056 ALTIMG 1-s2.0-S0306261922010509-si191.svg https://s3-eu-west-1.amazonaws.com/prod-ucs-content-store-eu-west/content/pii:S0306261922010509/image/svg+xml/ea074163466e58cef7a9bf99c4ee768c/si191.svg si191 si191.svg svg 11593 ALTIMG 1-s2.0-S0306261922010509-si192.svg https://s3-eu-west-1.amazonaws.com/prod-ucs-content-store-eu-west/content/pii:S0306261922010509/image/svg+xml/1233c456e1af40048a79b539eb457109/si192.svg si192 si192.svg svg 10003 ALTIMG 1-s2.0-S0306261922010509-si193.svg https://s3-eu-west-1.amazonaws.com/prod-ucs-content-store-eu-west/content/pii:S0306261922010509/image/svg+xml/001036870da2f354d62ed9c5367b5409/si193.svg si193 si193.svg svg 6752 ALTIMG 1-s2.0-S0306261922010509-si194.svg https://s3-eu-west-1.amazonaws.com/prod-ucs-content-store-eu-west/content/pii:S0306261922010509/image/svg+xml/fbf9972db29deafd97b351448e6ef341/si194.svg si194 si194.svg svg 7966 ALTIMG 1-s2.0-S0306261922010509-si195.svg https://s3-eu-west-1.amazonaws.com/prod-ucs-content-store-eu-west/content/pii:S0306261922010509/image/svg+xml/6ee841db2cb9d38969da4b3a1861a823/si195.svg si195 si195.svg svg 2531 ALTIMG 1-s2.0-S0306261922010509-si197.svg https://s3-eu-west-1.amazonaws.com/prod-ucs-content-store-eu-west/content/pii:S0306261922010509/image/svg+xml/949ca6ec50b22f4d42be676142ac54dc/si197.svg si197 si197.svg svg 12456 ALTIMG 1-s2.0-S0306261922010509-si198.svg https://s3-eu-west-1.amazonaws.com/prod-ucs-content-store-eu-west/content/pii:S0306261922010509/image/svg+xml/8d3d1501b412bca8ae0ba0b24ae3e775/si198.svg si198 si198.svg svg 13540 ALTIMG 1-s2.0-S0306261922010509-si199.svg https://s3-eu-west-1.amazonaws.com/prod-ucs-content-store-eu-west/content/pii:S0306261922010509/image/svg+xml/8ef4247846544b2157f763653f20c581/si199.svg si199 si199.svg svg 11937 ALTIMG 1-s2.0-S0306261922010509-si2.svg https://s3-eu-west-1.amazonaws.com/prod-ucs-content-store-eu-west/content/pii:S0306261922010509/image/svg+xml/0abb80d55f7743bbf8a972a3b49010a1/si2.svg si2 si2.svg svg 1343 ALTIMG 1-s2.0-S0306261922010509-si20.svg https://s3-eu-west-1.amazonaws.com/prod-ucs-content-store-eu-west/content/pii:S0306261922010509/image/svg+xml/5adf9228a9ad651788005c564fc8e666/si20.svg si20 si20.svg svg 2361 ALTIMG 1-s2.0-S0306261922010509-si201.svg https://s3-eu-west-1.amazonaws.com/prod-ucs-content-store-eu-west/content/pii:S0306261922010509/image/svg+xml/a089acc6e38283843d40fcb396f4682d/si201.svg si201 si201.svg svg 4565 ALTIMG 1-s2.0-S0306261922010509-si202.svg https://s3-eu-west-1.amazonaws.com/prod-ucs-content-store-eu-west/content/pii:S0306261922010509/image/svg+xml/69ad6028f43ebfbb5d826ddc48aedcdb/si202.svg si202 si202.svg svg 6129 ALTIMG 1-s2.0-S0306261922010509-si203.svg https://s3-eu-west-1.amazonaws.com/prod-ucs-content-store-eu-west/content/pii:S0306261922010509/image/svg+xml/03da25fe7d3f92764133339763eb8ca4/si203.svg si203 si203.svg svg 4346 ALTIMG 1-s2.0-S0306261922010509-si204.svg https://s3-eu-west-1.amazonaws.com/prod-ucs-content-store-eu-west/content/pii:S0306261922010509/image/svg+xml/c0854b01c57fb5ec56abf3b729e72508/si204.svg si204 si204.svg svg 6516 ALTIMG 1-s2.0-S0306261922010509-si206.svg https://s3-eu-west-1.amazonaws.com/prod-ucs-content-store-eu-west/content/pii:S0306261922010509/image/svg+xml/b38b49d2e15eb76f185539b430d398fa/si206.svg si206 si206.svg svg 14345 ALTIMG 1-s2.0-S0306261922010509-si207.svg https://s3-eu-west-1.amazonaws.com/prod-ucs-content-store-eu-west/content/pii:S0306261922010509/image/svg+xml/b2ad8eec107026b081296edb528c5e27/si207.svg si207 si207.svg svg 5059 ALTIMG 1-s2.0-S0306261922010509-si211.svg https://s3-eu-west-1.amazonaws.com/prod-ucs-content-store-eu-west/content/pii:S0306261922010509/image/svg+xml/ed76010d7815e42abdad6f89d679a794/si211.svg si211 si211.svg svg 3839 ALTIMG 1-s2.0-S0306261922010509-si212.svg https://s3-eu-west-1.amazonaws.com/prod-ucs-content-store-eu-west/content/pii:S0306261922010509/image/svg+xml/03265fa7ee7549a15e1afa7a10f2fb79/si212.svg si212 si212.svg svg 4812 ALTIMG 1-s2.0-S0306261922010509-si213.svg https://s3-eu-west-1.amazonaws.com/prod-ucs-content-store-eu-west/content/pii:S0306261922010509/image/svg+xml/0ac3bbd1b484ec1178ffecf7cf75a329/si213.svg si213 si213.svg svg 4326 ALTIMG 1-s2.0-S0306261922010509-si215.svg https://s3-eu-west-1.amazonaws.com/prod-ucs-content-store-eu-west/content/pii:S0306261922010509/image/svg+xml/7d82aaacf4fd20db41b9dcf2e58edb22/si215.svg si215 si215.svg svg 3652 ALTIMG 1-s2.0-S0306261922010509-si219.svg https://s3-eu-west-1.amazonaws.com/prod-ucs-content-store-eu-west/content/pii:S0306261922010509/image/svg+xml/89753177f0779eb494079ad24ea96a69/si219.svg si219 si219.svg svg 1252 ALTIMG 1-s2.0-S0306261922010509-si22.svg https://s3-eu-west-1.amazonaws.com/prod-ucs-content-store-eu-west/content/pii:S0306261922010509/image/svg+xml/1f189e703793200252e5de00387d8ff1/si22.svg si22 si22.svg svg 2617 ALTIMG 1-s2.0-S0306261922010509-si220.svg https://s3-eu-west-1.amazonaws.com/prod-ucs-content-store-eu-west/content/pii:S0306261922010509/image/svg+xml/e2c54322862462106fb81148bebe3cf2/si220.svg si220 si220.svg svg 15725 ALTIMG 1-s2.0-S0306261922010509-si224.svg https://s3-eu-west-1.amazonaws.com/prod-ucs-content-store-eu-west/content/pii:S0306261922010509/image/svg+xml/27b5c208defc582003ba8fa3656b9853/si224.svg si224 si224.svg svg 13488 ALTIMG 1-s2.0-S0306261922010509-si225.svg https://s3-eu-west-1.amazonaws.com/prod-ucs-content-store-eu-west/content/pii:S0306261922010509/image/svg+xml/0e002a814528eab3e1f0a91e05be076a/si225.svg si225 si225.svg svg 14930 ALTIMG 1-s2.0-S0306261922010509-si226.svg https://s3-eu-west-1.amazonaws.com/prod-ucs-content-store-eu-west/content/pii:S0306261922010509/image/svg+xml/180deb846ea764bf7f3817ad67166d39/si226.svg si226 si226.svg svg 12720 ALTIMG 1-s2.0-S0306261922010509-si227.svg https://s3-eu-west-1.amazonaws.com/prod-ucs-content-store-eu-west/content/pii:S0306261922010509/image/svg+xml/233c17ada948a13c42e507d485f753d0/si227.svg si227 si227.svg svg 2117 ALTIMG 1-s2.0-S0306261922010509-si228.svg https://s3-eu-west-1.amazonaws.com/prod-ucs-content-store-eu-west/content/pii:S0306261922010509/image/svg+xml/6a1a2cff3c33554f4f887cd20ed24061/si228.svg si228 si228.svg svg 13112 ALTIMG 1-s2.0-S0306261922010509-si230.svg https://s3-eu-west-1.amazonaws.com/prod-ucs-content-store-eu-west/content/pii:S0306261922010509/image/svg+xml/13c45494eebf7f3c4079a48d3199bffa/si230.svg si230 si230.svg svg 8677 ALTIMG 1-s2.0-S0306261922010509-si231.svg https://s3-eu-west-1.amazonaws.com/prod-ucs-content-store-eu-west/content/pii:S0306261922010509/image/svg+xml/131ea2d6bd271ca9b7b1853c8653e11c/si231.svg si231 si231.svg svg 5367 ALTIMG 1-s2.0-S0306261922010509-si232.svg https://s3-eu-west-1.amazonaws.com/prod-ucs-content-store-eu-west/content/pii:S0306261922010509/image/svg+xml/78364dd51304309b8cebec281ee9a70a/si232.svg si232 si232.svg svg 23780 ALTIMG 1-s2.0-S0306261922010509-si235.svg https://s3-eu-west-1.amazonaws.com/prod-ucs-content-store-eu-west/content/pii:S0306261922010509/image/svg+xml/e203ac37c930dfc9039dce4009e4ed0f/si235.svg si235 si235.svg svg 4867 ALTIMG 1-s2.0-S0306261922010509-si236.svg https://s3-eu-west-1.amazonaws.com/prod-ucs-content-store-eu-west/content/pii:S0306261922010509/image/svg+xml/a3a1fe9a3fcbd8eaf7a088cc34ad8c10/si236.svg si236 si236.svg svg 4367 ALTIMG 1-s2.0-S0306261922010509-si237.svg https://s3-eu-west-1.amazonaws.com/prod-ucs-content-store-eu-west/content/pii:S0306261922010509/image/svg+xml/07d03824d13cfd53e9573a0793d580ea/si237.svg si237 si237.svg svg 26094 ALTIMG 1-s2.0-S0306261922010509-si24.svg https://s3-eu-west-1.amazonaws.com/prod-ucs-content-store-eu-west/content/pii:S0306261922010509/image/svg+xml/f6cbf9f09e0c62df8c16a84898264164/si24.svg si24 si24.svg svg 2759 ALTIMG 1-s2.0-S0306261922010509-si242.svg https://s3-eu-west-1.amazonaws.com/prod-ucs-content-store-eu-west/content/pii:S0306261922010509/image/svg+xml/4f15da46f78d0945467bf66f51a71af2/si242.svg si242 si242.svg svg 22132 ALTIMG 1-s2.0-S0306261922010509-si243.svg https://s3-eu-west-1.amazonaws.com/prod-ucs-content-store-eu-west/content/pii:S0306261922010509/image/svg+xml/bbc2c068691ff1bbac1586c0f3b0b2d1/si243.svg si243 si243.svg svg 18655 ALTIMG 1-s2.0-S0306261922010509-si246.svg https://s3-eu-west-1.amazonaws.com/prod-ucs-content-store-eu-west/content/pii:S0306261922010509/image/svg+xml/91c77ebb7dc672302a326271630ea6c2/si246.svg si246 si246.svg svg 12560 ALTIMG 1-s2.0-S0306261922010509-si247.svg https://s3-eu-west-1.amazonaws.com/prod-ucs-content-store-eu-west/content/pii:S0306261922010509/image/svg+xml/985e3d8d4bfa4afc8086ec3472384cd9/si247.svg si247 si247.svg svg 16896 ALTIMG 1-s2.0-S0306261922010509-si248.svg https://s3-eu-west-1.amazonaws.com/prod-ucs-content-store-eu-west/content/pii:S0306261922010509/image/svg+xml/7fe661ec0553ec34c007df8c2ba3b645/si248.svg si248 si248.svg svg 6480 ALTIMG 1-s2.0-S0306261922010509-si249.svg https://s3-eu-west-1.amazonaws.com/prod-ucs-content-store-eu-west/content/pii:S0306261922010509/image/svg+xml/ad403b6abfde77d35a4345c38408a136/si249.svg si249 si249.svg svg 9330 ALTIMG 1-s2.0-S0306261922010509-si250.svg https://s3-eu-west-1.amazonaws.com/prod-ucs-content-store-eu-west/content/pii:S0306261922010509/image/svg+xml/fce0b1da2c4cae05c8a563b3fbf54a37/si250.svg si250 si250.svg svg 9281 ALTIMG 1-s2.0-S0306261922010509-si251.svg https://s3-eu-west-1.amazonaws.com/prod-ucs-content-store-eu-west/content/pii:S0306261922010509/image/svg+xml/f41b2aca3065e6333ed10dca31a92f14/si251.svg si251 si251.svg svg 7021 ALTIMG 1-s2.0-S0306261922010509-si252.svg https://s3-eu-west-1.amazonaws.com/prod-ucs-content-store-eu-west/content/pii:S0306261922010509/image/svg+xml/13cec1708a1e3b7e04991815ce0ff671/si252.svg si252 si252.svg svg 19848 ALTIMG 1-s2.0-S0306261922010509-si254.svg https://s3-eu-west-1.amazonaws.com/prod-ucs-content-store-eu-west/content/pii:S0306261922010509/image/svg+xml/eb36c44876040ee20ca3ba762db9adf3/si254.svg si254 si254.svg svg 1011 ALTIMG 1-s2.0-S0306261922010509-si255.svg https://s3-eu-west-1.amazonaws.com/prod-ucs-content-store-eu-west/content/pii:S0306261922010509/image/svg+xml/430552ae7265a98668aa9bc030b0d6f7/si255.svg si255 si255.svg svg 1007 ALTIMG 1-s2.0-S0306261922010509-si257.svg https://s3-eu-west-1.amazonaws.com/prod-ucs-content-store-eu-west/content/pii:S0306261922010509/image/svg+xml/5c995b353b75fb20ab52b254d718c099/si257.svg si257 si257.svg svg 1904 ALTIMG 1-s2.0-S0306261922010509-si259.svg https://s3-eu-west-1.amazonaws.com/prod-ucs-content-store-eu-west/content/pii:S0306261922010509/image/svg+xml/598556b228b6c64a9afd3b355db4e0a9/si259.svg si259 si259.svg svg 17430 ALTIMG 1-s2.0-S0306261922010509-si26.svg https://s3-eu-west-1.amazonaws.com/prod-ucs-content-store-eu-west/content/pii:S0306261922010509/image/svg+xml/0596e3add5b18a74fe7cfc4bd475f263/si26.svg si26 si26.svg svg 3602 ALTIMG 1-s2.0-S0306261922010509-si263.svg https://s3-eu-west-1.amazonaws.com/prod-ucs-content-store-eu-west/content/pii:S0306261922010509/image/svg+xml/ff14ac1ffe3288f5d771008f97b52b5c/si263.svg si263 si263.svg svg 5022 ALTIMG 1-s2.0-S0306261922010509-si265.svg https://s3-eu-west-1.amazonaws.com/prod-ucs-content-store-eu-west/content/pii:S0306261922010509/image/svg+xml/5f315e9c4f3f0d866f9b155f05d93c83/si265.svg si265 si265.svg svg 19326 ALTIMG 1-s2.0-S0306261922010509-si266.svg https://s3-eu-west-1.amazonaws.com/prod-ucs-content-store-eu-west/content/pii:S0306261922010509/image/svg+xml/62108f663397ed731002cdc3658064fb/si266.svg si266 si266.svg svg 19618 ALTIMG 1-s2.0-S0306261922010509-si267.svg https://s3-eu-west-1.amazonaws.com/prod-ucs-content-store-eu-west/content/pii:S0306261922010509/image/svg+xml/d052734b3a189b6cc56749d7543d832a/si267.svg si267 si267.svg svg 21582 ALTIMG 1-s2.0-S0306261922010509-si268.svg https://s3-eu-west-1.amazonaws.com/prod-ucs-content-store-eu-west/content/pii:S0306261922010509/image/svg+xml/3db045449ecccc9c6f105afc4481f793/si268.svg si268 si268.svg svg 6107 ALTIMG 1-s2.0-S0306261922010509-si269.svg https://s3-eu-west-1.amazonaws.com/prod-ucs-content-store-eu-west/content/pii:S0306261922010509/image/svg+xml/7b7fec2c23a4a06bcc80ab042af875f0/si269.svg si269 si269.svg svg 5994 ALTIMG 1-s2.0-S0306261922010509-si271.svg https://s3-eu-west-1.amazonaws.com/prod-ucs-content-store-eu-west/content/pii:S0306261922010509/image/svg+xml/3ee621b279fb4aef97cf59f9bd9c1924/si271.svg si271 si271.svg svg 12471 ALTIMG 1-s2.0-S0306261922010509-si276.svg https://s3-eu-west-1.amazonaws.com/prod-ucs-content-store-eu-west/content/pii:S0306261922010509/image/svg+xml/b5093db2db917079bb59f553e8248ead/si276.svg si276 si276.svg svg 3734 ALTIMG 1-s2.0-S0306261922010509-si278.svg https://s3-eu-west-1.amazonaws.com/prod-ucs-content-store-eu-west/content/pii:S0306261922010509/image/svg+xml/b14ea22f311071b7ef4970fc0ced808b/si278.svg si278 si278.svg svg 19704 ALTIMG 1-s2.0-S0306261922010509-si279.svg https://s3-eu-west-1.amazonaws.com/prod-ucs-content-store-eu-west/content/pii:S0306261922010509/image/svg+xml/554dfb18b9b25807bd94638ee98653f0/si279.svg si279 si279.svg svg 23879 ALTIMG 1-s2.0-S0306261922010509-si280.svg https://s3-eu-west-1.amazonaws.com/prod-ucs-content-store-eu-west/content/pii:S0306261922010509/image/svg+xml/33dc98d75c8aaa33ae6764a7614a096d/si280.svg si280 si280.svg svg 8435 ALTIMG 1-s2.0-S0306261922010509-si283.svg https://s3-eu-west-1.amazonaws.com/prod-ucs-content-store-eu-west/content/pii:S0306261922010509/image/svg+xml/f71fc1d743447ff73bcce7de1c781bf8/si283.svg si283 si283.svg svg 6643 ALTIMG 1-s2.0-S0306261922010509-si284.svg https://s3-eu-west-1.amazonaws.com/prod-ucs-content-store-eu-west/content/pii:S0306261922010509/image/svg+xml/c2c47c92900e5b361e44a7f7cd0321fb/si284.svg si284 si284.svg svg 2649 ALTIMG 1-s2.0-S0306261922010509-si285.svg https://s3-eu-west-1.amazonaws.com/prod-ucs-content-store-eu-west/content/pii:S0306261922010509/image/svg+xml/f9a5f2b8d83a2aabf23b86e529f54306/si285.svg si285 si285.svg svg 18771 ALTIMG 1-s2.0-S0306261922010509-si287.svg https://s3-eu-west-1.amazonaws.com/prod-ucs-content-store-eu-west/content/pii:S0306261922010509/image/svg+xml/3c79d0a1dbe83d63faf098afc2719da9/si287.svg si287 si287.svg svg 17696 ALTIMG 1-s2.0-S0306261922010509-si288.svg https://s3-eu-west-1.amazonaws.com/prod-ucs-content-store-eu-west/content/pii:S0306261922010509/image/svg+xml/8a368ccc25b484fe47e9c30b44514295/si288.svg si288 si288.svg svg 8791 ALTIMG 1-s2.0-S0306261922010509-si289.svg https://s3-eu-west-1.amazonaws.com/prod-ucs-content-store-eu-west/content/pii:S0306261922010509/image/svg+xml/0d1de086235d2573c89274831ee89ddd/si289.svg si289 si289.svg svg 6988 ALTIMG 1-s2.0-S0306261922010509-si29.svg https://s3-eu-west-1.amazonaws.com/prod-ucs-content-store-eu-west/content/pii:S0306261922010509/image/svg+xml/bfaa43d90ab63193b35fa9ede53f5103/si29.svg si29 si29.svg svg 2374 ALTIMG 1-s2.0-S0306261922010509-si290.svg https://s3-eu-west-1.amazonaws.com/prod-ucs-content-store-eu-west/content/pii:S0306261922010509/image/svg+xml/4949d6ac35d3d20d04ec7f1c1806dce5/si290.svg si290 si290.svg svg 3975 ALTIMG 1-s2.0-S0306261922010509-si294.svg https://s3-eu-west-1.amazonaws.com/prod-ucs-content-store-eu-west/content/pii:S0306261922010509/image/svg+xml/e1549dec9cc48537be15a19097074fe7/si294.svg si294 si294.svg svg 3213 ALTIMG 1-s2.0-S0306261922010509-si295.svg https://s3-eu-west-1.amazonaws.com/prod-ucs-content-store-eu-west/content/pii:S0306261922010509/image/svg+xml/af43586e05feeae2887d4959d235206f/si295.svg si295 si295.svg svg 2884 ALTIMG 1-s2.0-S0306261922010509-si296.svg https://s3-eu-west-1.amazonaws.com/prod-ucs-content-store-eu-west/content/pii:S0306261922010509/image/svg+xml/cfbe2ed39379baaa5474a5069cd7b5c3/si296.svg si296 si296.svg svg 6520 ALTIMG 1-s2.0-S0306261922010509-si297.svg https://s3-eu-west-1.amazonaws.com/prod-ucs-content-store-eu-west/content/pii:S0306261922010509/image/svg+xml/6fe7de0af1e7ed7029d8af0f9ab637a0/si297.svg si297 si297.svg svg 5846 ALTIMG 1-s2.0-S0306261922010509-si298.svg https://s3-eu-west-1.amazonaws.com/prod-ucs-content-store-eu-west/content/pii:S0306261922010509/image/svg+xml/c06fd0e26625cbd64fe99baf3e27dc8e/si298.svg si298 si298.svg svg 5611 ALTIMG 1-s2.0-S0306261922010509-si299.svg https://s3-eu-west-1.amazonaws.com/prod-ucs-content-store-eu-west/content/pii:S0306261922010509/image/svg+xml/044438e7f468cdc94fb07df228c636a2/si299.svg si299 si299.svg svg 5351 ALTIMG 1-s2.0-S0306261922010509-si3.svg https://s3-eu-west-1.amazonaws.com/prod-ucs-content-store-eu-west/content/pii:S0306261922010509/image/svg+xml/4e93c11a2e7abdab2528a0cde465b045/si3.svg si3 si3.svg svg 2654 ALTIMG 1-s2.0-S0306261922010509-si30.svg https://s3-eu-west-1.amazonaws.com/prod-ucs-content-store-eu-west/content/pii:S0306261922010509/image/svg+xml/f75c2bb664b89ae080d20949e9524fc0/si30.svg si30 si30.svg svg 1083 ALTIMG 1-s2.0-S0306261922010509-si300.svg https://s3-eu-west-1.amazonaws.com/prod-ucs-content-store-eu-west/content/pii:S0306261922010509/image/svg+xml/1b1462bb1b1c32b5a82fb039230f95b0/si300.svg si300 si300.svg svg 2128 ALTIMG 1-s2.0-S0306261922010509-si301.svg https://s3-eu-west-1.amazonaws.com/prod-ucs-content-store-eu-west/content/pii:S0306261922010509/image/svg+xml/7b0eac214cb8e5bbe7d2d0b431d5bd9c/si301.svg si301 si301.svg svg 7892 ALTIMG 1-s2.0-S0306261922010509-si302.svg https://s3-eu-west-1.amazonaws.com/prod-ucs-content-store-eu-west/content/pii:S0306261922010509/image/svg+xml/8d8f2304b8c5b70afa5062382307fd74/si302.svg si302 si302.svg svg 3877 ALTIMG 1-s2.0-S0306261922010509-si304.svg https://s3-eu-west-1.amazonaws.com/prod-ucs-content-store-eu-west/content/pii:S0306261922010509/image/svg+xml/9bbb96566f50856cb6c46866b02d061c/si304.svg si304 si304.svg svg 4139 ALTIMG 1-s2.0-S0306261922010509-si305.svg https://s3-eu-west-1.amazonaws.com/prod-ucs-content-store-eu-west/content/pii:S0306261922010509/image/svg+xml/82cca91ed569e7893842dbe49b2057ec/si305.svg si305 si305.svg svg 3126 ALTIMG 1-s2.0-S0306261922010509-si306.svg https://s3-eu-west-1.amazonaws.com/prod-ucs-content-store-eu-west/content/pii:S0306261922010509/image/svg+xml/dc65747108a25ce000d2d20a2830585d/si306.svg si306 si306.svg svg 6296 ALTIMG 1-s2.0-S0306261922010509-si307.svg https://s3-eu-west-1.amazonaws.com/prod-ucs-content-store-eu-west/content/pii:S0306261922010509/image/svg+xml/d59a50d0b9165d978a6b8c0fb33a79ec/si307.svg si307 si307.svg svg 5223 ALTIMG 1-s2.0-S0306261922010509-si308.svg https://s3-eu-west-1.amazonaws.com/prod-ucs-content-store-eu-west/content/pii:S0306261922010509/image/svg+xml/c1b0aa24b466dcee858661880d2ea66d/si308.svg si308 si308.svg svg 3332 ALTIMG 1-s2.0-S0306261922010509-si309.svg https://s3-eu-west-1.amazonaws.com/prod-ucs-content-store-eu-west/content/pii:S0306261922010509/image/svg+xml/5f35e0f3f5df18ba99c9a2701897c8fe/si309.svg si309 si309.svg svg 3005 ALTIMG 1-s2.0-S0306261922010509-si31.svg https://s3-eu-west-1.amazonaws.com/prod-ucs-content-store-eu-west/content/pii:S0306261922010509/image/svg+xml/e981e5ea84d1b575833b37b5a7742ec4/si31.svg si31 si31.svg svg 2273 ALTIMG 1-s2.0-S0306261922010509-si310.svg https://s3-eu-west-1.amazonaws.com/prod-ucs-content-store-eu-west/content/pii:S0306261922010509/image/svg+xml/4ae6b9dc420dd6c1fde0ea43a18a5446/si310.svg si310 si310.svg svg 4264 ALTIMG 1-s2.0-S0306261922010509-si311.svg https://s3-eu-west-1.amazonaws.com/prod-ucs-content-store-eu-west/content/pii:S0306261922010509/image/svg+xml/80da80aef01444a00d50990cc30a1434/si311.svg si311 si311.svg svg 2085 ALTIMG 1-s2.0-S0306261922010509-si312.svg https://s3-eu-west-1.amazonaws.com/prod-ucs-content-store-eu-west/content/pii:S0306261922010509/image/svg+xml/81570342df5353bf22a559d264bb92bb/si312.svg si312 si312.svg svg 3620 ALTIMG 1-s2.0-S0306261922010509-si313.svg https://s3-eu-west-1.amazonaws.com/prod-ucs-content-store-eu-west/content/pii:S0306261922010509/image/svg+xml/450a4f1124f99ab4d7d9de21b8a4139e/si313.svg si313 si313.svg svg 5851 ALTIMG 1-s2.0-S0306261922010509-si314.svg https://s3-eu-west-1.amazonaws.com/prod-ucs-content-store-eu-west/content/pii:S0306261922010509/image/svg+xml/c073a682a374a534e5334968be6c2d5a/si314.svg si314 si314.svg svg 3882 ALTIMG 1-s2.0-S0306261922010509-si318.svg https://s3-eu-west-1.amazonaws.com/prod-ucs-content-store-eu-west/content/pii:S0306261922010509/image/svg+xml/896337b2f63298a2fed58fe7e45d00cf/si318.svg si318 si318.svg svg 3147 ALTIMG 1-s2.0-S0306261922010509-si34.svg https://s3-eu-west-1.amazonaws.com/prod-ucs-content-store-eu-west/content/pii:S0306261922010509/image/svg+xml/f2a0546b7de7b51e28f0c4b867241eba/si34.svg si34 si34.svg svg 4179 ALTIMG 1-s2.0-S0306261922010509-si36.svg https://s3-eu-west-1.amazonaws.com/prod-ucs-content-store-eu-west/content/pii:S0306261922010509/image/svg+xml/bd269757e6d63896658f1281207c4a74/si36.svg si36 si36.svg svg 2317 ALTIMG 1-s2.0-S0306261922010509-si38.svg https://s3-eu-west-1.amazonaws.com/prod-ucs-content-store-eu-west/content/pii:S0306261922010509/image/svg+xml/9157e6757c17033b693f0e5b86d24b9e/si38.svg si38 si38.svg svg 4302 ALTIMG 1-s2.0-S0306261922010509-si39.svg https://s3-eu-west-1.amazonaws.com/prod-ucs-content-store-eu-west/content/pii:S0306261922010509/image/svg+xml/1e32c65ec63ec0df117061aa598d4be1/si39.svg si39 si39.svg svg 2310 ALTIMG 1-s2.0-S0306261922010509-si4.svg https://s3-eu-west-1.amazonaws.com/prod-ucs-content-store-eu-west/content/pii:S0306261922010509/image/svg+xml/7c69844a8ea7cac18d676a5f761861e8/si4.svg si4 si4.svg svg 7629 ALTIMG 1-s2.0-S0306261922010509-si41.svg https://s3-eu-west-1.amazonaws.com/prod-ucs-content-store-eu-west/content/pii:S0306261922010509/image/svg+xml/2157c0f020fc5410efd79b06d27facd0/si41.svg si41 si41.svg svg 4860 ALTIMG 1-s2.0-S0306261922010509-si42.svg https://s3-eu-west-1.amazonaws.com/prod-ucs-content-store-eu-west/content/pii:S0306261922010509/image/svg+xml/6405e48a5216ea3a9694b2818532bcbc/si42.svg si42 si42.svg svg 4680 ALTIMG 1-s2.0-S0306261922010509-si44.svg https://s3-eu-west-1.amazonaws.com/prod-ucs-content-store-eu-west/content/pii:S0306261922010509/image/svg+xml/94dd1a353ddba830a97a9257d6d68352/si44.svg si44 si44.svg svg 6309 ALTIMG 1-s2.0-S0306261922010509-si45.svg https://s3-eu-west-1.amazonaws.com/prod-ucs-content-store-eu-west/content/pii:S0306261922010509/image/svg+xml/0f2d3f25fde65c336bf446403d2aca46/si45.svg si45 si45.svg svg 6230 ALTIMG 1-s2.0-S0306261922010509-si46.svg https://s3-eu-west-1.amazonaws.com/prod-ucs-content-store-eu-west/content/pii:S0306261922010509/image/svg+xml/e9192e2a72c0dd42fcdfa2cc8ac31010/si46.svg si46 si46.svg svg 5280 ALTIMG 1-s2.0-S0306261922010509-si47.svg https://s3-eu-west-1.amazonaws.com/prod-ucs-content-store-eu-west/content/pii:S0306261922010509/image/svg+xml/e7c5b767aa0631a68e7fc7532af9c93e/si47.svg si47 si47.svg svg 4767 ALTIMG 1-s2.0-S0306261922010509-si48.svg https://s3-eu-west-1.amazonaws.com/prod-ucs-content-store-eu-west/content/pii:S0306261922010509/image/svg+xml/dd2b7033dc25f9e7b4d5c8adf7416d57/si48.svg si48 si48.svg svg 2149 ALTIMG 1-s2.0-S0306261922010509-si5.svg https://s3-eu-west-1.amazonaws.com/prod-ucs-content-store-eu-west/content/pii:S0306261922010509/image/svg+xml/b2d51f186dd097d1ba5180a4bd420c71/si5.svg si5 si5.svg svg 1511 ALTIMG 1-s2.0-S0306261922010509-si50.svg https://s3-eu-west-1.amazonaws.com/prod-ucs-content-store-eu-west/content/pii:S0306261922010509/image/svg+xml/81c04e644cd74aad42f9968baaf0a24d/si50.svg si50 si50.svg svg 5646 ALTIMG 1-s2.0-S0306261922010509-si51.svg https://s3-eu-west-1.amazonaws.com/prod-ucs-content-store-eu-west/content/pii:S0306261922010509/image/svg+xml/6ee7a2d01692f912e0217546669adfd6/si51.svg si51 si51.svg svg 4298 ALTIMG 1-s2.0-S0306261922010509-si52.svg https://s3-eu-west-1.amazonaws.com/prod-ucs-content-store-eu-west/content/pii:S0306261922010509/image/svg+xml/442aac77686ca3cdd41ea879401903ff/si52.svg si52 si52.svg svg 2700 ALTIMG 1-s2.0-S0306261922010509-si53.svg https://s3-eu-west-1.amazonaws.com/prod-ucs-content-store-eu-west/content/pii:S0306261922010509/image/svg+xml/6e6b65ee774a1a5acd98a0814896629a/si53.svg si53 si53.svg svg 7902 ALTIMG 1-s2.0-S0306261922010509-si54.svg https://s3-eu-west-1.amazonaws.com/prod-ucs-content-store-eu-west/content/pii:S0306261922010509/image/svg+xml/8d3195b5ab8f7a52278dbc09cc523dc6/si54.svg si54 si54.svg svg 1626 ALTIMG 1-s2.0-S0306261922010509-si55.svg https://s3-eu-west-1.amazonaws.com/prod-ucs-content-store-eu-west/content/pii:S0306261922010509/image/svg+xml/7a5cdd4b8e0b919d1abcc6f864aaf81a/si55.svg si55 si55.svg svg 1958 ALTIMG 1-s2.0-S0306261922010509-si56.svg https://s3-eu-west-1.amazonaws.com/prod-ucs-content-store-eu-west/content/pii:S0306261922010509/image/svg+xml/5311e3c9930ec482d977ab1d8b47af8b/si56.svg si56 si56.svg svg 2256 ALTIMG 1-s2.0-S0306261922010509-si57.svg https://s3-eu-west-1.amazonaws.com/prod-ucs-content-store-eu-west/content/pii:S0306261922010509/image/svg+xml/32feea90112e16bd4ba97b6bae12cb14/si57.svg si57 si57.svg svg 2286 ALTIMG 1-s2.0-S0306261922010509-si59.svg https://s3-eu-west-1.amazonaws.com/prod-ucs-content-store-eu-west/content/pii:S0306261922010509/image/svg+xml/04b17fb3e14bf687161fe3016a09e274/si59.svg si59 si59.svg svg 2565 ALTIMG 1-s2.0-S0306261922010509-si6.svg https://s3-eu-west-1.amazonaws.com/prod-ucs-content-store-eu-west/content/pii:S0306261922010509/image/svg+xml/ed91563cfcb677eb1106016bb95538f0/si6.svg si6 si6.svg svg 1286 ALTIMG 1-s2.0-S0306261922010509-si61.svg https://s3-eu-west-1.amazonaws.com/prod-ucs-content-store-eu-west/content/pii:S0306261922010509/image/svg+xml/4a06feaefbfd17c8b71f48eebecd11e7/si61.svg si61 si61.svg svg 2308 ALTIMG 1-s2.0-S0306261922010509-si63.svg https://s3-eu-west-1.amazonaws.com/prod-ucs-content-store-eu-west/content/pii:S0306261922010509/image/svg+xml/53c8e3d1b71547f1232570a6215bd1dd/si63.svg si63 si63.svg svg 2536 ALTIMG 1-s2.0-S0306261922010509-si65.svg https://s3-eu-west-1.amazonaws.com/prod-ucs-content-store-eu-west/content/pii:S0306261922010509/image/svg+xml/99e525a92722d1b97173e5f322891fb0/si65.svg si65 si65.svg svg 1624 ALTIMG 1-s2.0-S0306261922010509-si66.svg https://s3-eu-west-1.amazonaws.com/prod-ucs-content-store-eu-west/content/pii:S0306261922010509/image/svg+xml/f156bec6beb5fc8a49e629b603c78cba/si66.svg si66 si66.svg svg 2721 ALTIMG 1-s2.0-S0306261922010509-si7.svg https://s3-eu-west-1.amazonaws.com/prod-ucs-content-store-eu-west/content/pii:S0306261922010509/image/svg+xml/371fea1ab6ebbb7337a3f02bdfac7235/si7.svg si7 si7.svg svg 4646 ALTIMG 1-s2.0-S0306261922010509-si70.svg https://s3-eu-west-1.amazonaws.com/prod-ucs-content-store-eu-west/content/pii:S0306261922010509/image/svg+xml/688863cdd11b0f6ed5b96e5049fcb177/si70.svg si70 si70.svg svg 2395 ALTIMG 1-s2.0-S0306261922010509-si72.svg https://s3-eu-west-1.amazonaws.com/prod-ucs-content-store-eu-west/content/pii:S0306261922010509/image/svg+xml/185a7f0544a0e3c248875910fd7f219d/si72.svg si72 si72.svg svg 2358 ALTIMG 1-s2.0-S0306261922010509-si74.svg https://s3-eu-west-1.amazonaws.com/prod-ucs-content-store-eu-west/content/pii:S0306261922010509/image/svg+xml/264864079be82adde13a13caa0d8a592/si74.svg si74 si74.svg svg 4133 ALTIMG 1-s2.0-S0306261922010509-si76.svg https://s3-eu-west-1.amazonaws.com/prod-ucs-content-store-eu-west/content/pii:S0306261922010509/image/svg+xml/1082dcbdab35d7bf85e511030b214fa7/si76.svg si76 si76.svg svg 6197 ALTIMG 1-s2.0-S0306261922010509-si77.svg https://s3-eu-west-1.amazonaws.com/prod-ucs-content-store-eu-west/content/pii:S0306261922010509/image/svg+xml/b18ec2c7364336608b8a094381431713/si77.svg si77 si77.svg svg 2300 ALTIMG 1-s2.0-S0306261922010509-si79.svg https://s3-eu-west-1.amazonaws.com/prod-ucs-content-store-eu-west/content/pii:S0306261922010509/image/svg+xml/a247347687da11b4ab5c1cda6c7911d9/si79.svg si79 si79.svg svg 2768 ALTIMG 1-s2.0-S0306261922010509-si8.svg https://s3-eu-west-1.amazonaws.com/prod-ucs-content-store-eu-west/content/pii:S0306261922010509/image/svg+xml/2c75dfccc3751d04c25edfc911e6d8ce/si8.svg si8 si8.svg svg 7245 ALTIMG 1-s2.0-S0306261922010509-si81.svg https://s3-eu-west-1.amazonaws.com/prod-ucs-content-store-eu-west/content/pii:S0306261922010509/image/svg+xml/5a2efe8a8abfc2e4ae4a1e3be19ea137/si81.svg si81 si81.svg svg 2430 ALTIMG 1-s2.0-S0306261922010509-si82.svg https://s3-eu-west-1.amazonaws.com/prod-ucs-content-store-eu-west/content/pii:S0306261922010509/image/svg+xml/d01dfc5b25b01286f80403cec1d17e8d/si82.svg si82 si82.svg svg 1553 ALTIMG 1-s2.0-S0306261922010509-si83.svg https://s3-eu-west-1.amazonaws.com/prod-ucs-content-store-eu-west/content/pii:S0306261922010509/image/svg+xml/7c4fae21ce8d22b518c0cb4eb52fcc94/si83.svg si83 si83.svg svg 1069 ALTIMG 1-s2.0-S0306261922010509-si84.svg https://s3-eu-west-1.amazonaws.com/prod-ucs-content-store-eu-west/content/pii:S0306261922010509/image/svg+xml/c27e7719560bf64791a4f29c6041b2df/si84.svg si84 si84.svg svg 2305 ALTIMG 1-s2.0-S0306261922010509-si86.svg https://s3-eu-west-1.amazonaws.com/prod-ucs-content-store-eu-west/content/pii:S0306261922010509/image/svg+xml/f7d4fb0cf548b3d8e1daa59b8ed95b9d/si86.svg si86 si86.svg svg 1348 ALTIMG 1-s2.0-S0306261922010509-si88.svg https://s3-eu-west-1.amazonaws.com/prod-ucs-content-store-eu-west/content/pii:S0306261922010509/image/svg+xml/f5e759b195a12d945fb6d40b115e5728/si88.svg si88 si88.svg svg 2095 ALTIMG 1-s2.0-S0306261922010509-si89.svg https://s3-eu-west-1.amazonaws.com/prod-ucs-content-store-eu-west/content/pii:S0306261922010509/image/svg+xml/f9a6628c85ff9d8e52682eb552471a47/si89.svg si89 si89.svg svg 2882 ALTIMG 1-s2.0-S0306261922010509-si91.svg https://s3-eu-west-1.amazonaws.com/prod-ucs-content-store-eu-west/content/pii:S0306261922010509/image/svg+xml/1e86730cecfa9b416cf63b03e7a5e009/si91.svg si91 si91.svg svg 13264 ALTIMG 1-s2.0-S0306261922010509-si92.svg https://s3-eu-west-1.amazonaws.com/prod-ucs-content-store-eu-west/content/pii:S0306261922010509/image/svg+xml/7627964cc6e2ccf7367dd87d61704fc3/si92.svg si92 si92.svg svg 7363 ALTIMG 1-s2.0-S0306261922010509-si93.svg https://s3-eu-west-1.amazonaws.com/prod-ucs-content-store-eu-west/content/pii:S0306261922010509/image/svg+xml/a353b11d387df9715172809d14f240dc/si93.svg si93 si93.svg svg 2494 ALTIMG 1-s2.0-S0306261922010509-si94.svg https://s3-eu-west-1.amazonaws.com/prod-ucs-content-store-eu-west/content/pii:S0306261922010509/image/svg+xml/4feec7b7736539acfbe182a3c831a867/si94.svg si94 si94.svg svg 2485 ALTIMG 1-s2.0-S0306261922010509-si95.svg https://s3-eu-west-1.amazonaws.com/prod-ucs-content-store-eu-west/content/pii:S0306261922010509/image/svg+xml/59708659d9fb8c2f20ae4a56d5c3e5d7/si95.svg si95 si95.svg svg 2126 ALTIMG 1-s2.0-S0306261922010509-si96.svg https://s3-eu-west-1.amazonaws.com/prod-ucs-content-store-eu-west/content/pii:S0306261922010509/image/svg+xml/f88f2960ed8c76b458f4d40a9e532573/si96.svg si96 si96.svg svg 2195 ALTIMG 1-s2.0-S0306261922010509-si97.svg https://s3-eu-west-1.amazonaws.com/prod-ucs-content-store-eu-west/content/pii:S0306261922010509/image/svg+xml/220bffb1615bb4a4bcde0b8eaf9e0e09/si97.svg si97 si97.svg svg 2026 ALTIMG 1-s2.0-S0306261922010509-si98.svg https://s3-eu-west-1.amazonaws.com/prod-ucs-content-store-eu-west/content/pii:S0306261922010509/image/svg+xml/bb0230d73ab8dfe3fbdb78a44d889889/si98.svg si98 si98.svg svg 2440 ALTIMG 1-s2.0-S0306261922010509-si99.svg https://s3-eu-west-1.amazonaws.com/prod-ucs-content-store-eu-west/content/pii:S0306261922010509/image/svg+xml/ad5dbb205de0b1b564f168d552de625f/si99.svg si99 si99.svg svg 2316 ALTIMG 1-s2.0-S0306261922010509-am.pdf https://s3-eu-west-1.amazonaws.com/prod-ucs-content-store-eu-west/content/egi:10LKW2FCBGK/MAIN/application/pdf/2f776f3d00b5449ff2ebd2fd02e24a9a/am.pdf am am.pdf pdf false 1331259 AAM-PDF APEN 119770 119770 S0306-2619(22)01050-9 10.1016/j.apenergy.2022.119770 Elsevier Ltd Fig. 1 Schematic for a model predictive control algorithm. Fig. 2 A linear envelope model with infiltration and interior and exterior radiation elements. Fig. 3 Flow diagram showing the inputs and outputs of the HEMS controller and OCHRE. Fig. 4 Temperature forecast and 95% confidence interval at noon on one of the simulation days. Fig. 5 Water draw forecasts and confidence intervals at 11 AM on one of the simulation days. Fig. 6 EV driving forecasts and confidence intervals at 2 PM on one of the simulation days. Fig. 7 Simulated indoor temperature with the full and reduced-order linearized models. Fig. 8 Cooling energy consumption during on-peak hours using a constant thermostat set point and a pre-cooling control. The difference in on-peak energy consumption between the two controls is shown at the right. Fig. 9 Simulation results for the baseline heuristic control case and the DMPC case with exact forecasts. Fig. 10 Water heater simulation results for the DMPC cases with exact and ARIMAX forecasts. Fig. 11 EV SOC for the baseline heuristic case and the DMPC cases with exact and ARIMAX forecasts. Fig. 12 Water heater simulation results for the DMPC and SMPC cases with ARIMAX forecasts. Fig. 13 HVAC simulation results for the DMPC and SMPC cases with ARIMAX forecasts. Table 1 Key modeling and control parameter values. Parameter Value Parameter Value Δ T o p 10 °C n h 48 T o p , r a d 20 °C λ p o w e r $0.10\u20130.27/kWh η h v a c 3.8 λ h v a c $0.125/ ° C -h ( θ 1 − θ w m ) o p 33.1 °C λ w h $0.01/ ° C -L η w h 4.5 λ e v $1/kWh P d r i v e 0.65 kW λ p e a k $10−5/kW E e v 32.5 kWh T m ¯ 22.7 °C E b a t t 12 kWh θ 1 ̲ 46.1 °C ϵ x i (all) 20% Table 2 Control performance results for each case, including energy costs ( J p o w e r ), water heater comfort costs ( J w h ), and water heater cycles. Control Forecast J p o w e r J w h WH cycles type type ($/mo) ($/mo) (1/day) Heuristic N/A 119.4 1.1 2.0 DMPC Exact 94.6 2.4 27.9 DMPC 30-day 94.2 9.2 24.5 DMPC ARIMAX 94.2 7.6 22.3 SMPC 30-day 96.9 1.4 4.0 SMPC ARIMAX 97.0 1.0 4.2 Home energy management under realistic and uncertain conditions: A comparison of heuristic, deterministic, and stochastic control methods Michael Blonsky Conceptualization Methodology Software Validation Investigation Visualization Writing \u2013 original draft a b \u204e Killian McKenna Conceptualization Methodology Writing \u2013 review & editing Supervision a Jeff Maguire Methodology Writing \u2013 review & editing Project administration a Tyrone Vincent Conceptualization Methodology Writing \u2013 review & editing Supervision b a National Renewable Energy Laboratory, 15013 Denver West Parkway, Golden, CO 80401, USA National Renewable Energy Laboratory 15013 Denver West Parkway Golden CO 80401 USA National Renewable Energy Laboratory, 15013 Denver West Parkway, Golden, CO 80401, USA b Colorado School of Mines, 1500 Illinois St, Golden, CO 80401, USA Colorado School of Mines 1500 Illinois St Golden CO 80401 USA Colorado School of Mines, 1500 Illinois St, Golden, CO 80401, USA \u204e Corresponding author at: National Renewable Energy Laboratory, 15013 Denver West Parkway, Golden, CO 80401, USA. National Renewable Energy Laboratory 15013 Denver West Parkway Golden CO 80401 USA Home energy management systems (HEMS) have been shown to reduce energy bills and to provide grid services including peak demand reduction and demand flexibility. However, uncertainty in residential energy systems is a significant issue and can reduce the benefits of a HEMS to the homeowner or grid operator. Sources of uncertainty include weather forecasts, predictions of energy-related occupant activities (e.g., hot water draws), and parameter estimation for the building envelope and energy-consuming equipment. This paper tackles the problem of uncertainty by developing a framework that simulates HEMS in uncertain conditions and evaluates the performance of multiple control strategies. A linear, reduced-order residential building model for model predictive control applications is derived and compared to a full-order model. Stochastic model predictive control is shown to perform better than deterministic and heuristic methods when considering realistic forecasts with uncertainty. The framework can evaluate the performance of HEMS in real-world applications, which can help de-risk HEMS deployment. Keywords Home energy management systems Stochastic controls Model predictive control Residential energy modeling Distributed energy resources Data availability Data will be made available on request. Nomenclature Envelope Parameters H i Heat injected into node i (W) H s Vector of heat gains from solar radiation on each exterior surface (W) H a z , i n f Heat due to infiltration from zone a to zone z (W) H i n t Internal heat gains injected into the main indoor zone (W) H i z , r a d Heat due to radiation for node i facing zone z (W) R a z , i n f Thermal resistance due to infiltration between zones a and z (K/W) R i j Thermal resistance between nodes i and j (K/W) R i z , r a d Thermal resistance due to radiation for node i facing zone z (K/W) T a Ambient temperature ( ° C ) T g Ground temperature ( ° C ) T m Main indoor temperature ( ° C ) T s , i Surface temperature of a boundary next to node i ( ° C ) Equipment Parameters η l Efficiency of load l θ i Water temperature of node i ( ° C ) θ w m Water mains temperature ( ° C ) E l Energy capacity of load l (kWh) H w h Heat injected into the water tank (W) P l Power of load l (kW) P c h g Battery charging power (kW) P d i s Battery discharging power (kW) P d r i v e EV power discharged due to driving (kW) p d r i v e Fraction of time that the EV is driving P h o u s e Total house power (kW) p l e a v e Probability that the EV is leaving the parking space P u n c Uncontrollable load power (kW) s l State of charge of load l V d r a w Hot water flow rate (L/min) Stochastic Modeling Symbols σ x i 2 Variance of random variable x i x ̃ ∼ N ( x ˆ , Σ x ) Gaussian random vector x with mean x ˆ and variance Σ x A i State transition matrix for system i B i Controllable input matrix for system i C i Output matrix for system i G i Uncontrollable input matrix for system i K Kalman gain u i Controllable input vector for system i x i State vector for system i y i Output vector for system i z i Uncontrollable input vector for system i Other Symbols β x i z-score associated with a constraint on x i λ ˆ p o w e r Average cost of power over the forecast horizon ($/kWh) λ i Cost associated with cost term i x ¯ , x ̲ Maximum and minimum constraints on x Φ − 1 Inverse cumulative distribution function of the normal distribution h Discrete time step for MPC horizon I Identity matrix J i Cost function term i ($) k Discrete time step n h Number of steps in MPC horizon t s Time resolution of simulation (s) 1 Introduction The electric grid is experiencing an increase in both variable renewable generation resources and in electricity consumption due to the electrification of space heating and transportation [1]. These trends lead to large temporal changes in supply and demand and present new challenges in operating the power system, which increases the need for demand flexibility. The Brattle Group estimates approximately 200 GW of cost-effective demand flexibility potential in the United States by 2030, with much of the increase coming from residential loads, including smart thermostats, smart water heaters, electric vehicle (EV) chargers, and behind-the-meter batteries [2]. Each of these devices can provide demand flexibility as well as benefits to the homeowner when controlled through a home energy management system (HEMS). HEMS in the literature typically use model predictive control (MPC) to optimize energy cost and consumption while considering occupant comfort, device limitations, and other factors [3\u20135]; however, most studies use deterministic MPC (DMPC), which does not consider the uncertainty from forecasts, models, or sensor measurements. As shown in Section 2, these sources of uncertainty can all be significant and can lead to suboptimal control performance in HEMS applications. There are a few MPC methods that consider uncertainty in the control framework. Stochastic model predictive control (SMPC) \u2013 also referred to as chance-constrained optimization [3] and conditional value at risk [6,7] \u2013 considers the probability distribution of uncertain variables within the optimization framework [8,9]. Robust MPC considers extreme values for uncertain variables, which lead to improved performance in worst-case conditions but not necessarily in typical conditions [10]. Scenario-based MPC methods use an ensemble of model disturbances to quantify uncertainty [11,12]. Stochastic dynamic optimization and other multistage optimization methods optimize over a set of discrete state transitions, which can greatly increase the computational complexity of the controller [3,13]. Most papers in this research area often focus on novel control architectures and their performance benefits over existing strategies, but they pay little attention to quantifying uncertainty in their simulations or to assessing its impact on their findings. Forecast uncertainty has been considered in related fields including commercial buildings, EV fleets, and behind-the-meter battery systems [14\u201317]. In particular, many papers present control strategies for commercial building heating, ventilating, and air-conditioning (HVAC) that incorporate forecast and model uncertainty [10,18,19]. One study on commercial HVAC found that DMPC performed best at low levels of uncertainty, robust MPC performed best at intermediate levels, and heuristic controls performed best at high levels [20]. SMPC was used for a residential building with an EV and battery, but did not consider modeling uncertainty or any thermostatic loads like HVAC and water heating [21]. Another SMPC paper include these loads in the HEMS control but only considers uncertainty in weather forecasts [8]. Other HEMS control strategies consider occupancy forecasts but use simplified models with no model uncertainty [6,11]. One paper quantifies uncertainty for residential HVAC energy for an aggregation of homes but does not consider uncertainty within a single home [22]. The authors are not aware of any studies on HEMS that consider both forecast and model uncertainty for multiple flexible loads within a home. In this paper, multiple control strategies for HEMS are evaluated using a novel modeling and control framework that incorporates multiple sources of uncertainty. A heuristic control strategy that resembles standard residential building controls is used as a baseline. The framework incorporates MPC using an objective to minimize energy costs and occupant discomfort. It is run under deterministic (DMPC) conditions as well as stochastic (SMPC) conditions using the same objective and constraints. The control performance for each strategy is evaluated under various levels of uncertainty, accounting for the uncertainties addressed in Section 2. The key contributions of the paper include: \u2022 Development of a HEMS framework that incorporates uncertainties caused by errors in the prediction forecast, control model, and sensor measurements, and that includes models for HVAC equipment, water heaters, EVs, and batteries \u2022 Evaluation of heuristic, DMPC, and SMPC strategies using common forecasts methods and a high-resolution building model that can accurately simulate building dynamics for a typical building \u2022 Model reduction and linearization of radiation and infiltration for a multi-node white-box envelope model for use in MPC \u2022 A discussion on the sources of uncertainty in HEMS applications and their implications for HEMS control strategies In Section 2, the sources of uncertainty in HEMS controls using MPC are described. In Section 3, the models used for evaluating the different controls strategies are described with a focus on the linear model used within the MPC framework. In Section 4, the heuristic control strategy and formulate the DMPC and SMPC problems are summarized. In Section 5, multiple forecast techniques that are used in the MPC framework are defined. In Section 6, the performance of the different control strategies is compared. The paper concludes with a summary of findings and explorations for future work. 2 Uncertainty considerations in HEMS A literature review by Beaudin et al. finds that most studies on HEMS use an MPC framework, but most do not consider the impact of uncertainty on control performance [3]. When MPC methods are tested in a hypothetical scenario with exact forecasts, simplified system models, and little or no noise in communication signals, they are nearly always shown to be optimal strategies that perform better than heuristic or other methods; however, real systems are not so simple, and we argue that HEMS control strategies should be evaluated in conditions with realistic uncertainty levels to truly understand their value. Fig. 1 shows a schematic of an MPC algorithm and highlights the data that are likely to be stochastic. MPC requires forecasts for model inputs in the horizon window that often cannot be perfectly estimated at the controller run time. The MPC control model is not a perfect representation of the system model, causing the predicted states and outputs to deviate from the actual model states. Finally, sensor measurements from the system model can be noisy or biased. Next, we elaborate on each of these sources with a focus on HEMS applications. 2.1 Forecast uncertainty Forecasts for weather and occupant behavior likely have the largest amount of uncertainty in residential applications due to their stochastic nature. Residential energy consumption is highly dependent on both occupant activity and weather, making these forecasts critical pieces of information when optimizing for future control decisions. For example, preconditioning air to shift HVAC consumption away from a peak demand period requires knowledge of weather variables that are used to calculate HVAC loads [18,23]. Other examples include preheating a water heater before a large water draw event or charging an EV such that it is fully charged before the occupant leaves [24]. Short-term weather forecasts are often accurate for ambient temperature, but solar irradiance is more difficult to predict [25]. Occupant behavior is highly unpredictable, and good models often require data for a particular person or household [26]. Most weather variables (e.g., temperature, irradiance) are more continuous and smoother than many occupancy variables, for example, hot water draws or discrete activity changes such as plugging in an EV or turning on an oven [27]. HEMS often use a single forecast for uncontrollable loads rather than estimating consumption from each type of activity [5]. In many papers, forecast uncertainty is quantified using heuristics [8] or is not defined at all. Auto-regressive moving average models have been used to estimate uncertainty for weather variables [28\u201330] as well as for occupancy variables [31]. Other forecasting methods usually do not quantify uncertainty, for example, sophisticated weather forecasts [13,15] and Markov chain-based stochastic occupancy models [22,29]. 2.2 Model uncertainty An MPC framework requires an underlying model that represents the system, but it is often an imperfect approximation of the system. Many MPC frameworks use a linear model, which is required to use fast and convex optimization methods, including linear programming, quadratic programming, and mixed-integer linear programming methods [3,17,32]. Linear models must either simplify or ignore nonlinearities such as device efficiency, device degradation, and radiative thermal processes. Models for specific homes often lack detailed data, including envelope and equipment parameters as well as training data for black box models, which can lead to inaccurate model parameters [10,22]. Because every house is different, it can be very time consuming and costly to create an accurate model representation [33]. Another key source of uncertainty arises from the time resolution of the model and the MPC controller. Time resolutions may be constrained by the time resolution or update frequency of the forecast, by measurement or actuator update rates, or by the computational complexity of the MPC algorithm. Time resolution may also be purposefully reduced to eliminate the need to consider fast system dynamics, for example, equipment cycling behavior or high-resolution occupant activities [34,35]. Although low-resolution controllers might work well for some objectives \u2013 for example, reducing energy costs with an hourly electricity price \u2013 they are likely to reduce the performance of any objective with real-time impacts on the occupant, for example, thermal comfort or convenience associated with EV charging. 2.3 Measurement uncertainty Uncertainty can also arise from sensor measurements [4,36]. Sensor noise is not typically an issue, but sensors can have low time resolution or low precision, which leads to reduced control performance [37]. Sensors can also be biased, especially if the sensor is not directly capturing the variable of interest. For example, a thermostat located near a vent or a sunny window might report a temperature that is not accurately representing the house temperature [26]. Some sensors might also have limited communication abilities, for example, an EV charger that can only measure the EV state of charge when the vehicle is parked and plugged in. 3 Model description To simulate model uncertainty in the control framework, two models are defined for each end use: a system model and a control model for the MPC (see Fig. 3). This section describes the linearization and other techniques used to derive the MPC models. The system models are taken from OCHRE™, a residential energy model with controllable device models for each load examined in this paper. OCHRE is a white-box model that uses weather and occupancy schedules to calculate heat generation and power from each device. More details on OCHRE models can be found in [24,35]. The MPC models described in this section are derived from the OCHRE models. 3.1 Controllable load model In general, a linear model is defined for each controllable load l ∈ L in state space form: (1) x l ( k + 1 ) = A l x l ( k ) + B l u l ( k ) + G l z l ( k ) y l ( k ) = C l x l ( k ) where x l is the state vector, u l is the controllable input vector, z l is the uncontrollable input vector, y l is the output vector, and A l , B l , G l , and C l are state space system matrices. In this paper, the set of controllable loads is L = [ h v a c , w h , e v , b a t t ] corresponding to an air conditioner, water heater, electric vehicle, and battery, respectively. Each load model contains at least one state and at least one controllable input that corresponds to the load power. Most models include at least one uncontrollable input that corresponds to an uncertain variable that must be forecasted. If the output vector y l is not defined, it is assumed that y l = x l , and C l is the identity matrix. 3.2 HVAC and envelope The system model for the HVAC equipment and the building envelope is a nonlinear, white-box model created using OCHRE. It includes a linear, multi-node equivalent circuit model for conduction and convection between air zones and the boundaries between them, as well as nonlinear elements for infiltration, ventilation, and long-wave radiation. The OCHRE model also includes a thermostat controller with a deadband which sets the power based on a temperature set point. To develop a linear envelope model for the MPC, infiltration, interior long-wave radiation, and exterior long-wave radiation are linearized separately. For each heat transfer pathway, resistors are added to OCHRE\u2019s equivalent circuit model (see [35], figures 1 and 2), as shown in Fig. 2. In the figure, T a is the ambient temperature, T z is the temperature of an interior zone, T s , i is the surface temperature of boundary i , and subscripts 1, 2, and 3 correspond to boundary materials connected to either the ambient or an interior zone. For infiltration (and mechanical ventilation), a resistance R a z , i n f is added between an interior air zone and the ambient air zone. The resistance value is calculated by linearizing the heat gain at an operating point: (2) R a z , i n f = Δ T o p H a z , i n f where Δ T o p is the temperature difference between zone z and ambient at the operating point, and H a z , i n f is the infiltration and ventilation heat gains to zone i at the operating point. H a z , i n f also depends on wind speed, which must also be defined in the operating point. We use a similar approach to linearize the interior and exterior radiation. The radiation equation for the surface of boundary material i is: (3) H i z , r a d = ϵ i σ a i ( T z , r a d 4 − T s , i 4 ) where ϵ i is the emissivity of material i , a i is the area of the material i , and σ is the Stefan\u2013Boltzmann constant. For the ambient zone, we assume T z , r a d = T a , ignoring effects of the sky radiation temperature. For interior zones, T z , r a d depends on the surface temperatures of all boundaries facing the zone. Linearizing with the operating point T z , r a d = T s , i = T o p , r a d gives: (4) 1 R i z , r a d = d H i z , r a d d ( T z , r a d − T s , i ) = 4 ϵ i σ a i T o p , r a d 3 where R i z , r a d is a resistance value that accounts for radiation effects. For exterior radiation, the resistor is applied in parallel with an exterior film resistance that models the effects of convection (see Fig. 2, R a 1 , f i l m ). For interior radiation, the resistor is applied between the boundary surface and a fictional node T z , r a d representing all of the radiation within an interior zone. Using Kirchhoff\u2019s Current Law, this network topology ensures that all radiative heat within a zone sums to zero. The fictional node and all boundary surface nodes are eliminated by using the star-mesh transform to generate resistance values between each boundary surface within an interior zone. The updated envelope model is converted into a linear, discrete-time state space model with states for each interior node temperature and inputs for each exterior node temperature and each interior node heat gain (see [35] Eq. 2\u20133). OCHRE\u2019s envelope model includes many interior nodes (30\u201345 for a typical home), which can lead to slow computational speed when used within an MPC framework. Balanced truncated model reduction is used to reduce the number of states of the envelope model [38]. Before the model reduction, unused inputs and outputs are eliminated and inputs are normalized based on typical variability. The main indoor temperature is the only output, and the HVAC power is the only controllable input, i.e., y h v a c = T m and u h v a c = P h v a c . The uncontrollable inputs are z h v a c = [ T a , T g , H i n t , H s T ] T , where T g is the ground temperature, H i n t is the internal heat gains in the main zone, and H s is a vector of the heat gains from solar radiation on each exterior surface (e.g., walls, roof, attic walls), which depends on the solar irradiance and the area and absorptivity of each surface. The state vector x h v a c is an output of the model reduction algorithm and represents the temperatures of the interior zones and boundaries. Internal heat gains include heat from occupants, other equipment, and solar radiation from windows. The total heat gain to the main zone H m is a combination of the internal heat gains and the heat from the HVAC equipment. When an air conditioner is used: (5) H m ( k ) = − η h v a c P h v a c ( k ) + H i n t ( k ) where η h v a c is the HVAC coefficient of performance and is assumed to be constant. 3.3 Water heater We use OCHRE\u2019s heat pump water heater and 2-node water tank models for the system model. The 2-node tank model includes nonlinearities due to heat transfer from water draws. Similar to the HVAC model, OCHRE\u2019s water heater model uses a thermostat with deadband control that converts a temperature setpoint into an on/off power signal. The temperature setpoint can be controlled externally, but the thermostat ensures that the deadband remains within the thermal comfort region. We define a 1-node linear model for the control model that accounts for convection and conduction similarly to the envelope model described in Section 3.2. Heat injections into the tank come from water heater power and water draws: (6) H w h ( k ) = η w h P w h ( k ) + V d r a w ( k ) ρ c p ( θ w m − θ 1 ( k ) ) where η w h is the coefficient of performance of the heat pump water heater, θ 1 is the tank temperature, θ w m is the water mains temperature, V d r a w is the water draw flow rate, ρ is the density of water, and c p is the heat capacity of water. To linearize the biquadratic term for water draws, we assume constant temperature differences. We note that this formulation does not include a backup heating element for the heat pump water heater, which is included in OCHRE\u2019s model. The linear state space equation for the water heater has one state for the water tank temperature, x w h = θ 1 , and one controllable input, u w h = P w h . The uncontrollable inputs are z w h = [ V d r a w , θ a ] T , and we assume that the water mains temperature is known. 3.4 Electric vehicle OCHRE\u2019s EV model tracks EV charging but does not model battery discharging during driving [24]. To account for discharging, a term is added that decreases the EV state of charge (SOC) when the EV is driving: (7) d s e v ( k ) d t = 1 E e v ( η e v P e v ( k ) − P d r i v e p d r i v e ( k ) ) where s e v is the EV SOC, E e v is the EV energy capacity, η e v is the charge efficiency, P e v is the EV charging power, P d r i v e is the power lost while driving, and p d r i v e is the percentage of time that the EV is driving. The linear state space equation for the EV has one state for the EV SOC, x e v = s e v . The only uncontrollable input is z w h = p d r i v e . 3.5 Battery We use OCHRE\u2019s linear battery model to track the battery SOC. Due to separate charging and discharging efficiencies, the controllable input is split into two variables, i.e., u b a t t = [ P c h g , P d i s ] T , and we define P b a t t = P c h g − P d i s . The battery model has one state for the battery SOC, x b a t t = s b a t t . There are no uncontrollable inputs for the battery model, i.e., z b a t t is an empty vector. We note that A b a t t = 1 because there is no self-discharge modeled. 3.6 Combined house model The four controllable equipment models are combined in parallel to create a linear model for the house: (8) x ( k + 1 ) = A x ( k ) + B u ( k ) + G z ( k ) y ( k ) = C x ( k ) where: x = [ x h v a c T , θ 1 , s e v , s b a t t ] T u = [ P h v a c , P w h , P e v , P c h g , P d i s ] T z = [ T a , T g , H i n t , H s T , V d r a w , θ a , p d r i v e ] T y = [ T m , θ 1 , s e v , s b a t t ] T A = diag ( [ A h v a c , A w h , A e v , A b a t t ] ) and the other matrices are defined similarly to A . The whole house power is defined as: (9) P h o u s e ( k ) = ∑ l ∈ L P l ( k ) + P u n c ( k ) where P u n c is the power from all uncontrollable house loads. The uncontrollable load power is considered as an uncertain input, similar to the inputs in z . 3.7 Stochastic house model The control model in (8) can be used directly in a deterministic control framework. For SMPC, the uncontrollable inputs become random variables, and noise v ̃ is added to the outputs. The stochastic model becomes: (10) x ̃ ( k + 1 ) = A x ̃ ( k ) + B u ( k ) + G z ̃ ( k ) y ̃ ( k ) = C x ̃ ( k ) + v ̃ where: x ̃ ( k ) ∼ N ( x ˆ ( k ) , Σ x ( k ) ) z ̃ ( k ) ∼ N ( z ˆ ( k ) , Σ z ( k ) ) y ̃ ( k ) ∼ N ( y ˆ ( k ) , Σ y ( k ) ) v ̃ ∼ N ( 0 , Σ v ) are all Gaussian random vectors. The mean and variance of all the uncontrollable inputs distributions z ̃ ( k ) are based on forecast estimates (see Section 5), and we assume that there is no covariance between the inputs. The diagonals of the covariance matrices correspond to the variance of individual input or output variables, which we denote as σ x i 2 , for example, diag ( Σ y ) = [ σ T m 2 , σ θ 1 2 , σ s e v 2 , σ s b a t t 2 ] . The probability distributions of the state and output matrices are calculated using a Kalman filter [39]: (11) x ˆ ( k ) = x ˆ ( − ) ( k ) + K ( y ( − ) ( k ) − C x ˆ ( − ) ( k ) ) Σ x ( k ) = ( I − K C ) Σ x ( − ) ( k ) y ˆ ( k ) = C x ˆ ( k ) Σ y ( k ) = C Σ x ( k ) C T where y ( − ) is the most recent house status received from OCHRE, and: (12) K = Σ x ( − ) ( k ) C T ( C Σ x ( − ) ( k ) C T + Σ v ) − 1 x ˆ ( − ) ( k + 1 ) = A x ˆ ( k ) + B u ( k ) + G z ˆ ( k ) Σ x ( − ) ( k + 1 ) = A Σ x ( k ) A T + G Σ z ( k ) G T The equations above can be used directly when k is the current time. When calculating the state and output distributions in the future, y ( − ) ( k ) is unknown and we set x ˆ ( k ) = x ˆ ( − ) ( k ) . We also assume a closed-loop control strategy that accounts for past disturbances and reduces the expected uncertainty in future states. This is achieved by ignoring the Σ x ( k ) term when calculating Σ x ( − ) ( k + 1 ) . 3.8 Model implementation The implementation of the HEMS controller and OCHRE is described in Fig. 3. Before the simulation begins, forecasts are generated using time-series data from weather and occupancy schedules. Every 30 min, the HEMS controller receives the most recent house status y ( − ) ( k ) from OCHRE. It receives forecasts from a forecast generator of the form Z ( k ) = { z ( k , h ) : h ∈ [ k , k + n h − 1 ] } , where z ( k , h ) is the forecast at time h evaluated at time k , and n h is the number of steps in the MPC horizon. The HEMS controller uses an MPC optimization to solve for u ( h ) , and the control model predicts the future states x ( h + 1 ) throughout the forecast horizon. The controller sends the optimal set points y ( k + 1 ) to OCHRE, which implements the set point at 1-min resolution. This process repeats every 30 min throughout the simulation. Note that the HEMS controller sends the temperature and SOC set points y ( k + 1 ) , not the power set points u ( k ) , to OCHRE. This allows OCHRE\u2019s device controllers to determine the device power at 1-min resolution, which enables equipment cycling for the air conditioner and the water heater. Providing OCHRE with these set points reduces the effects of model and forecast uncertainty in achieving the desired set points, but it could cause the device power to deviate from the power expected by the MPC. This control signal works best for the MPC formulation in this paper; however, power set points might be more appropriate if a demand charge or a demand response event is involved and precise power controls are desired. We also note that the house status y ( − ) ( k ) includes all state variables in the deterministic case. This gives the DMPC perfect knowledge of the initial system state. In the SMPC case, the house status only includes output variables and the Kalman filter is used to estimate the states. 4 Control formulation We evaluate three types of HEMS controls: heuristic controls, DMPC, and SMPC. In this section, these three control strategies are outlined for each controllable device. All controllers operate at a 30 min time resolution. For multiple equipment types, a soft constraint is used to limit discomfort or inconvenience costs. Soft constraints were chosen to more easily compare the different control strategies and to define how to quantify the costs when constraints are violated [40]. 4.1 Heuristic controls The heuristic controls for HVAC and water heating use a thermostat control with a deadband and a precooling strategy designed around a time-of-use rate. The top of the HVAC deadband defines the comfort temperature T m ¯ that is used to evaluate all of the HVAC control strategies, with a comfort cost incurred when that threshold is exceeded. The water heater control uses a minimum comfort temperature θ 1 ̲ , which is also used to evaluate all control strategies. The heuristic controller charges the EV at its maximum power immediately upon arrival. This control strategy ensures that the EV SOC will be at its maximum possible value when the EV leaves, but it disregards the variable cost of charging at different times of day. The heuristic battery controller performs energy arbitrage based on a time-of-use rate. The battery begins charging at 10 AM and begins discharging at the start of the peak period. 4.2 Deterministic MPC The DMPC formulation uses the linear house model described in Section 3.6 to minimize energy costs and costs associated with occupant comfort and convenience. All terms in the objective function include a \u201ccost coefficient\u201d λ that normalizes the term into units of dollars. The first term defines the energy costs: (13) J p o w e r ( k ) = λ p o w e r ( k ) t s P h o u s e ( k ) where λ p o w e r is a time-varying price of electricity, and t s is the control time resolution. The objective includes occupant comfort and convenience costs for HVAC, water heating, and EV charging, which depend on air temperature, hot water temperature, and EV SOC, respectively. The EV control is designed to minimize any inconvenience associated with a low SOC at the time the EV leaves [24]. The costs are defined as: (14) J h v a c ( k ) = λ h v a c | T m ( k ) − T m ¯ | + J w h ( k ) = λ w h V d r a w | θ 1 ¯ − θ 1 ( k ) | + J e v ( k ) = λ e v ( 1 − s e v ( k ) ) p l e a v e ( k ) where λ l is a comfort cost associated with each device, p l e a v e ( k ) = p d r i v e ( k ) − p d r i v e ( k − 1 ) is the probability that the EV is leaving during time step k , and | ⋅ | + = max ( ⋅ , 0 ) . J h v a c only accounts for discomfort from hot temperatures, but a similar cost term could be included for cold temperatures. For the battery, a terminal cost term is included, which is designed to make the battery control indifferent to discharging at the end of the horizon: (15) J b a t t ( k + n h ) = − λ ˆ p o w e r ( k ) E b a t t η d i s s b a t t ( k + n h ) where λ ˆ p o w e r is the average cost of electricity over the forecast horizon, E b a t t is the battery energy capacity, and η d i s is the battery discharge efficiency. Note that this objective only considers the SOC at the end of the horizon, i.e., at time k + n h . We also include a term to smooth the power profile of each controllable device. This term can help reduce device degradation and reduce the set of optimal solutions, which improves the solver\u2019s consistency across multiple scenarios. The peak cost term is: (16) J p e a k ( k ) = λ p e a k ∑ l ∈ L max h ∈ [ k , k + n h − 1 ] | P l ( h ) | where λ p e a k is a small positive number. The DMPC objective function at current time k with n h steps in the horizon is: (17) J ( k ) = ∑ h = k k + n h − 1 ( J p o w e r ( h ) + J h v a c ( h + 1 ) + J w h ( h + 1 ) + J e v ( h + 1 ) ) + J b a t t ( k + n h ) + J p e a k ( k ) The deterministic optimization problem is defined as: (18) ( P 1 ) min u ( h ) : J ( k ) s.t. x ( h + 1 ) = A x ( h ) + B u ( h ) + G z ( h ) y ( h ) = C x ( h ) 0 ≤ u l ( h ) ≤ u l ¯ ∀ l ∈ L s b a t t ̲ ≤ s b a t t ( h + 1 ) ≤ s b a t t ¯ s e v ( h + 1 ) ≤ 1 0 ≤ P e v ( k ) ≤ P e v ¯ ( 1 − p d r i v e ( k ) ) ∀ h ∈ [ k , k + n h − 1 ] where, in general, ⋅ ¯ and ⋅ ̲ are the minimum and maximum values of a given variable. Note that there is no minimum SOC constraint for the EV because of the uncertainty due to driving loss. Because p d r i v e is either 0 or 1, the maximum EV power is constrained to zero when the EV is driving and to the maximum charging power when the EV is parked. All constraints are linear, and the objective function can be transformed into a linear function through the addition of slack variables. This makes P 1 a linear optimization problem that can be solved very quickly and guarantees a globally optimum solution. 4.3 Stochastic MPC Under stochastic conditions, all uncontrollable inputs and all outputs are assumed to be Gaussian random variables. The stochastic optimization incorporates uncertainty in these variables by using chance constraints based on a probability ϵ x i of exceeding a constraint [9]: (19) Pr ( x ̃ i ≤ x i ¯ ) ≥ 1 − ϵ x i → β x i = Φ − 1 ( 1 − ϵ x i ) where Φ − 1 is the inverse cumulative distribution function of the normal distribution, and β x i is a z-score associated with the variable x i . For soft constraints, a back-off magnitude of β x i σ x i incorporates the chance constraint in the objective function. The updated comfort costs from Eq. (14) for the SMPC formulation are: (20) J h v a c ( k ) = λ h v a c | T ˆ m ( k ) − T m ¯ + β T m σ T m ( k ) | + J w h ( k ) = λ w h V ˆ d r a w | θ 1 ¯ − θ ˆ 1 ( k ) − β θ 1 σ θ 1 ( k ) | + J e v ( k ) = λ e v ( 1 − s ˆ e v ( k ) ) ( p ˆ l e a v e ( k ) + β p l e a v e σ p l e a v e ( k ) ) where σ p l e a v e is the standard deviation of p ̃ l e a v e . The SMPC optimization problem is very similar to Problem ( P 1 ). The only changes are updating the cost terms from Eqs. (14) to (20) and using the mean values of each random variable throughout the formulation, for example, the state equation becomes: x ˆ ( h + 1 ) = A x ˆ ( h ) + B u ( h ) + G z ˆ ( h ) We note that p d r i v e is no longer a Boolean input. No back-off magnitude is used in the maximum EV SOC constraint because EV charging is fully deterministic. The battery model has no uncertain inputs, so the stochastic controls are identical to the deterministic controls for this device. 5 Schedule and forecast descriptions Forecasts were developed for uncertain inputs z , including weather data and occupancy schedules. Multiple forecasts were derived from the same underlying data, but with varying levels of complexity and accuracy. Common forecast methods from practice and from research literature were chosen, although we note that more sophisticated forecast methods can lead to forecasts with lower uncertainty. 5.1 Weather schedule and forecast All simulations were performed using measured weather data from Denver, CO. Weather data were collected in real time in July 2021 using an online application programming interface (API) [41]. The same weather API was used to get weather forecast data. The weather data and forecast were collected every 1 h, and the forecast had a duration of 48 h and a time resolution of 1 h. Weather data used in the simulation include ambient temperature, pressure, relative humidity, cloud cover, and wind speed. Cloud cover data were converted to irradiance values using a clear-sky scaling method [42,43]. The weather forecast used in this study did not provide an estimate of the uncertainty in the forecast. The temperature distribution was calculated using the difference between the actual temperature and the forecast, aggregated by the time difference between the current time k and the prediction time h , denoted Δ k = h − k : (21) T a ( b ) ( Δ k ) = 1 n k ∑ k = 1 n k T a ( f ) ( k , h ) − T a ( h ) σ T a 2 ( Δ k ) = 1 n k − 1 ∑ k = 1 n k T a ( f ) ( k , h ) − T a ( h ) − T a ( b ) ( Δ k ) 2 where T a ( f ) ( k , h ) is the forecasted temperature at time h evaluated at time k , T a ( b ) ( Δ k ) is the bias in the forecast, and n k is the number of time steps with valid data. There was valid weather and forecast data for almost every hour for the month of July. The ambient temperature distribution is: (22) T ̃ a ( k , h ) ∼ N T a ( f ) ( k , h ) − T a ( b ) ( h − k ) , σ T a 2 ( h − k ) Fig. 4 shows the temperature forecast at noon on the first simulation day, with the shaded region showing the 95% confidence interval. The bias of the temperature forecast with a time difference of less than 4 h was within 1 °C, and the standard deviation with a time difference of 1 h was 0.6 °C. The uncertainty increased for the first 3 h of the forecast and then remained stable near 2 °C. We note that this analysis covers only temporal uncertainty; there could also be spatial uncertainty because of weather differences between the weather station and the house. The solar heat gain distribution was calculated using a slightly different method to keep uncertainty low when solar irradiance is low, for example, at night. The standard deviation of global horizontal irradiance (GHI) was calculated in the same way as (21) and was used to calculate the solar heat gain standard deviation: (23) σ H s ( k , h ) = H s ( f ) ( k , h ) σ G H I ( h − k ) μ G H I ( h − k ) where H s ( f ) ( k , h ) is the forecasted solar gain vector, and μ G H I ( Δ k ) is the average forecasted GHI. The uncertainty follows a similar pattern to temperature; the standard deviation increases during the first few hours of the forecast and then remains stable near 100 W / m 2 . 5.2 Occupant schedule and forecast A single-occupant schedule was used for all simulations. The schedule was generated using the ResStock™ stochastic occupancy generator for a typical single-family home with a single occupant in Denver, CO [44]. The schedule has 1-min resolution profiles for occupancy, power usage for uncontrollable loads, and hot water draws for appliances and fixtures. The EV schedule was generated from OCHRE using parking event data from EVI-Pro [45]. Note that because the EV schedule came from a different data source, the occupancy and EV schedules do not directly match. The schedule was run using OCHRE for a full year with typical meteorological year weather data to get an annual profile of key variables to be used for forecasts. Key variables include driving status (for p d r i v e and p l e a v e ), total hot water draws, total uncontrollable load power, and internal heat gains. Uncontrollable power includes appliances, lighting, and other electrical equipment that are not modeled in the MPC framework. Internal heat gains incorporate heat gains from occupants, equipment, radiation from windows, and infiltration. Three types of forecasts were generated from the annual simulation data. All forecasts use a time resolution of 30 min and define the uncertainty of the random variable by assuming a Gaussian distribution at each time step. An exact forecast directly uses the results of the simulation as the mean and sets the standard deviation of the variable to zero. A second forecast uses a backward-looking 30-day moving horizon to estimate random variables based on the time of day. For example, the water draw at noon on July 1 is estimated using the water draw values at noon from the month of June. The sample mean and sample variance are used to define the random variable distribution at that time. A third forecast uses an autoregressive integrated moving average exogenous (ARIMAX) filter to estimate random variable distributions. The 30-day horizon forecast was used as the exogenous component. The ARIMAX filter uses an order of (2, 1, 1) for autoregressive, difference, and moving average parameters [46]. It is very difficult to measure internal gains in a real environment, and it would be impossible to use an ARIMAX forecast without data measurements. For this reason, an ARIMAX forecast for internal gains is not calculated; instead, the 30-day horizon forecast is used for the ARIMAX scenarios. Figs. 5 and 6 show the three forecast options at a single simulation time step for the water draw and EV driving variables, respectively. The figures show the mean and the 95% confidence interval for the 30-day horizon and ARIMAX forecasts. The 30-day moving horizon forecasts have negligible bias. The average standard deviations are 0.2 L/min for the water draw forecast and 0.35 for the EV state, which are both high relative to the average actual values. In the near term, the ARIMAX forecast does a better job of estimating the EV driving state and reducing its uncertainty by using current and past data in its prediction; however, the two long-term estimates perform about the same, with the ARIMAX predicting larger uncertainty. The ARIMAX method also does not significantly impact the water draw forecast, which tends to be more stochastic. 6 Simulation results and discussion Simulations were run with multiple combinations of the three control types described in Section 4 and the three forecast types described in Section 5. First, the impacts of the model reduction and linearization on the envelope model are shown. Next, the heuristic control and DMPC strategies are compared. The DMPC and SMPC are then compared under different levels of forecast uncertainty, and optimal control considerations in HEMS applications are discussed. All simulations were run with the same house model, equipment characteristics, weather data, and occupancy schedules. Scenarios without MPC were run for 14 days in July, and scenarios with MPC were run for 13 days. Key simulation parameters are shown in Table 1. The electricity price λ p o w e r was taken from Xcel Energy Colorado\u2019s summer time-of-use rate [47], which includes an off-peak rate of $0.10/kWh, a shoulder period from 1\u20133 PM at $0.19/kWh, and a peak period from 3\u20137 PM at $0.27/kWh. The values of the cost coefficients associated with occupant comfort were estimated using assumptions for a person\u2019s willingness to pay for the desired comfort metric. For example, the water heater cost coefficient assumes a $5 cost for a 50 L shower at 10 °C colder than the minimum desired temperature. 6.1 Comparison of linear models The impacts of the model reduction and linearization of radiation and infiltration are shown in Figs. 7 and 8. Fig. 7 shows the difference in the modeled indoor air temperature between the full OCHRE model and the linearized model described in Section 3. In both models, the air conditioner turns on around midday and cycles according to the deadband control with a constant set point. At night, the air conditioner turns off, and the temperature floats below the set point. During a 10- to 15-h window each night, the maximum temperature deviation between the simulations is less than 1 °C. Fig. 8 compares the air-conditioning energy consumption during the peak period under different modeling conditions to assess the impacts of linearization and model reduction. Three models \u2013 OCHRE, a full-order linear model, and the reduced-order linear model \u2013 were run with a constant HVAC set point and the heuristic precooling control. The linear models overestimate the HVAC consumption compared to the OCHRE model, and they underestimate the energy savings due to precooling controls. The reduced linear model underestimates the difference by 14%, indicating that the MPC might undervalue precooling controls. 6.2 Deterministic MPC We next compare the control performance between the baseline heuristic controls and the DMPC with an exact forecast. Although this DMPC case does not include forecast or measurement uncertainty, there is still some model uncertainty due to the model linearization and the difference in time resolution between OCHRE and the control model. Fig. 9 shows the state of each controllable equipment and the total house power for these two cases for a subset of the simulation time. The DMPC reduces total house power during the shoulder and peak periods. Both controllers adjust the HVAC set point before the peak period, but the air temperature is very similar for the rest of the day. The baseline heuristic control maintains a constant hot water set point, whereas the DMPC keeps the set point very low except when large water draws are expected during the peak period. The DMPC EV controller delays charging until after the peak period and slowly reaches full SOC right before the EV leaves. It also charges the battery more slowly than the scheduled heuristic controller. Note that the heat pump water heater temperature stays very close to the set point temperature in the DMPC control because the deadband size reduces as the set point approaches the minimum comfort temperature. Although this helps achieve low energy costs and low water discomfort, it leads to a lot of equipment cycling, which can reduce the lifetime of the equipment. Imperfect forecasts reduce the DMPC performance, particularly for the water heater controls. Fig. 10 shows the difference in water heater results from the DMPC cases with an exact forecast and the ARIMAX forecast. The ARIMAX case tends to have a lower set point temperature because the forecast expects more frequent but smaller water draws. As shown in Table 2, the forecast error leads to more discomfort due to low water temperatures, but it also slightly reduces the water heater energy cost. Both controls cycle the water heater frequently when no draws are expected. The DMPC forecasts also impact the EV controls as shown in Fig. 11. The baseline controller always charges the EV as fast a possible, and the DMPC with an exact forecast always charges the EV as slow as possible while achieving full charge before the EV leaves. The DMPC with the ARIMAX forecast often charges in between these two cases, delaying charging during the peak period but charging more quickly after that. We note that the energy cost due to EV charging was identical for all MPC cases. 6.3 Stochastic MPC Compared to the DMPC cases with imperfect forecasts, the SMPC is able to reduce hot water comfort costs as well as water heater cycling. Fig. 12 shows the water temperature for the DMPC and SMPC cases with the ARIMAX forecast. The SMPC case maintains a higher set point most of the time, leading to less water discomfort, less water heater cycling, and slightly higher energy costs. The SMPC water heater set point depends on the distribution of water draw volume for the next MPC time step. The set point temperature increases when either the mean value increases or when the variance increases. The set point also increases significantly before the peak demand periods. The SMPC led to small differences in the HVAC controls as shown in Fig. 13. Although both the DMPC and SMPC controls precool the space before the peak period, the SMPC case reduces the cooling set point by approximately 0.1 °C for the rest of the day. This has little impact on the nighttime air temperature, but it does reduce the temperature while the air conditioner is on. This leads to a small increase in energy costs and a very small decrease in air comfort as quantified by the cost J h v a c . We note that there is no change in the DMPC and SMPC controls for the EV and battery. In theory, the SMPC EV controls should be more conservative and might charge the EV sooner to ensure a low EV inconvenience cost J e v ; however, this behavior was not shown in the simulation results. 6.4 Control performance The control performance for all the simulations is shown in Table 2. The energy cost J p o w e r and water heater comfort cost J w h were the only costs from the MPC objective that significantly contributed to the overall cost. All other comfort costs were exactly zero except for J h v a c , which was no larger than $0.04/mo for some scenarios due to small temperature deviations that exceeded the comfort range. Costs were calculated using the power and states from the system model in OCHRE. The costs were aggregated over the full simulation time of 13 days and then scaled to show monthly costs. The average number of water heating (WH) heat pump cycles per day are also reported from OCHRE. We note that the electric resistance element was not turned on in any of the cases. As expected, the DMPC with the exact forecast reduces the total cost the most when considering only the objective function costs and not the water heater cycles. All MPC cases have a smaller energy cost than the heuristic case, primarily because of the delayed EV charging after the peak period. The 30-day horizon forecasts perform very similarly to the ARIMAX forecasts and had very similar control strategies. The SMPC cases outperform all other cases excluding the case with an exact forecast. Compared to the heuristic control, they significantly reduce the energy cost and slightly increase the number of water heater cycles. Compared to the DMPC cases, they have slightly higher energy costs and much lower water discomfort costs. The SMPC also had much less water heater cycling, which can reduce the equipment lifetime; while water heater cycling is not considered in the control objective, the results show this additional benefit of the SMPC. The SMPC control had the largest impact on the device with the highest uncertainty in the control variable: the water heater. Due to difficulty in forecasting water draws, the water heater model inputs and outputs had significant uncertainty, which caused a large difference between the DMPC and SMPC set points. The improvements in the SMPC performance highlights the importance of stochastic controls, especially in systems with high levels of uncertainty. There is an interesting parallel between the differences in set points between the DMPC and SMPC cases and the deadband of the heuristic control. The SMPC back-off magnitudes effectively act as a deadband that buffers the control variable from exceeding its constraints. In this sense, the SMPC algorithm combines the best features of the heuristic control and the DMPC control. In addition, the SMPC improves upon the heuristic control by varying the size of the \u201cdeadband\u201d based on the uncertainty in the control variable. We also note that the back-off magnitudes are easily adjustable by updating the risk tolerance of exceeding a constraint ϵ x i . 7 Conclusions In this paper, a framework is developed for simulating HEMS controllers that incorporates model and forecast uncertainty. The framework includes a linear, reduced-order building model that can be derived from white-box equipment and envelope parameters. Heuristic, DMPC, and SMPC strategies are evaluated, and we find that the SMPC algorithm performs best when using common forecasts methods that incorporate uncertainty. The framework can evaluate the performance of HEMS in real-world applications, which can help de-risk HEMS deployment. The simulation results are limited to a single test case and might not be generalizable for cases with different equipment parameters, weather and occupant schedules, or objective functions; however, SMPC is shown to incorporate the features of both MPC and heuristic controls and is likely to provide benefits for systems with high levels of uncertainty. There are many extensions to the modeling and control methods developed in this paper. More sophisticated forecasts are likely to reduce uncertainty and improve control performance. Many advanced control features could be incorporated, for example, quadratic or mixed-integer programming, parameter-varying models, or asynchronous controls. We also suggest further study into a combination of SMPC and heuristics to optimally set the deadband size for devices with equipment cycling. CRediT authorship contribution statement Michael Blonsky: Conceptualization, Methodology, Software, Validation, Investigation, Visualization, Writing \u2013 original draft. Killian McKenna: Conceptualization, Methodology, Writing \u2013 review & editing, Supervision. Jeff Maguire: Methodology, Writing \u2013 review & editing, Project administration. Tyrone Vincent: Conceptualization, Methodology, Writing \u2013 review & editing, Supervision. Declaration of Competing Interest The authors declare that they have no known competing financial interests or personal relationships that could have appeared to influence the work reported in this paper. Acknowledgments This work was authored by the National Renewable Energy Laboratory, operated by Alliance for Sustainable Energy, LLC, for the U.S. Department of Energy (DOE) under Contract No. DE-AC36-08GO28308. Funding provided by the U.S. Department of Energy Office of Energy Efficiency and Renewable Energy Solar Energy Technologies Office, United States . The views expressed in the article do not necessarily represent the views of the DOE or the U.S. Government. The U.S. Government retains and the publisher, by accepting the article for publication, acknowledges that the U.S. Government retains a nonexclusive, paid-up, irrevocable, worldwide license to publish or reproduce the published form of this work, or allow others to do so, for U.S. Government purposes. References [1] Blonsky M. Nagarajan A. Ghosh S. McKenna K. Veda S. Kroposki B. Potential impacts of transportation and building electrification on the grid: A review of electrification projections and their effects on grid infrastructure, operation, and planning Curr Sustain/Renew Energy Rep 6 4 2019 169 176 10.1007/s40518-019-00140-5 M. Blonsky, A. Nagarajan, S. Ghosh, K. McKenna, S. Veda, B. Kroposki, Potential Impacts of Transportation and Building Electrification on the Grid: A Review of Electrification Projections and Their Effects on Grid Infrastructure, Operation, and Planning, Current Sustainable/Renewable Energy Reports 6 (4) (2019) 169\u2013176. DOI: 10.1007/s40518-019-00140-5. [2] Hledik R. Faruqui A. Lee T. Higham J. The national potential for load flexibility Tech. rep. 2019 The Brattle Group R. Hledik, A. Faruqui, T. Lee, J. Higham, The National Potential for Load Flexibility, Tech. rep., The Brattle Group (2019). [3] Beaudin M. Zareipour H. Home energy management systems: A review of modelling and complexity Renew Sustain Energy Rev 45 2015 318 335 10.1016/j.rser.2015.01.046 M. Beaudin, H. Zareipour, Home energy management systems: A review of modelling and complexity, Renewable and Sustainable Energy Reviews 45 (2015) 318\u2013335. DOI: 10.1016/j.rser.2015.01.046. [4] Roth A. Grid-interactive efficient buildings technical report series: whole-building controls, sensors, modeling, and analytics Tech. rep. 2019 US Department of Energy, Building Technologies Office A. Roth, Grid-interactive Efficient Buildings Technical Report Series: Whole-Building Controls, Sensors, Modeling, and Analytics, Tech. rep., US Department of Energy, Building Technologies Office (2019). [5] Jin X. Baker K. Christensen D. Isley S. Foresee: A user-centric home energy management system for energy efficiency and demand response Appl Energy 205 2017 1583 1595 10.1016/j.apenergy.2017.08.166 X. Jin, K. Baker, D. Christensen, S. Isley, Foresee: A user-centric home energy management system for energy efficiency and demand response, Applied Energy 205 (2017) 1583\u20131595. DOI: 10.1016/j.apenergy.2017.08.166. [6] Wu Z. Zhou S. Li J. Zhang X.P. Real-time scheduling of residential appliances via conditional risk-at-value IEEE Trans Smart Grid 5 3 2014 1282 1291 10.1109/TSG.2014.2304961 Z. Wu, S. Zhou, J. Li, X. P. Zhang, Real-time scheduling of residential appliances via conditional risk-at-value, IEEE Transactions on Smart Grid 5 (3) (2014) 1282\u20131291. DOI: 10.1109/TSG.2014.2304961. [7] Paul S. Padhy N.P. Resilient scheduling portfolio of residential devices and plug-in electric vehicle by minimizing conditional value at risk IEEE Trans Ind Inf 15 3 2019 1566 1578 10.1109/TII.2018.2847742 S. Paul, N. P. Padhy, Resilient Scheduling Portfolio of Residential Devices and Plug-In Electric Vehicle by Minimizing Conditional Value at Risk, IEEE Transactions on Industrial Informatics 15 (3) (2019) 1566\u20131578. DOI: 10.1109/TII.2018.2847742. [8] Garifi K. Baker K. Christensen D. Touri B. Stochastic home energy management systems with varying controllable resources IEEE power and energy society general meeting, Vol. 2019-Augus 2019 IEEE Computer Society 10.1109/PESGM40551.2019.8973708 K. Garifi, K. Baker, D. Christensen, B. Touri, Stochastic Home Energy Management Systems with Varying Controllable Resources, IEEE Power and Energy Society General Meeting 2019-Augus. DOI: 10.1109/PESGM40551.2019.8973708. [9] Heirung T.A.N. Paulson J.A. O\u2019Leary J. Mesbah A. Stochastic model predictive control \u2014 how does it work? Comput Chem Eng 114 2018 158 170 10.1016/j.compchemeng.2017.10.026 T. A. N. Heirung, J. A. Paulson, J. O\u2019Leary, A. Mesbah, Stochastic model predictive control \u2014 how does it work?, Computers and Chemical Engineering 114 (2018) 158\u2013170. DOI: 10.1016/j.compchemeng.2017.10.026. [10] Maasoumy M. Razmara M. Shahbakhti M. Vincentelli A.S. Handling model uncertainty in model predictive control for energy efficient buildings Energy Build 77 2014 377 392 10.1016/j.enbuild.2014.03.057 M. Maasoumy, M. Razmara, M. Shahbakhti, A. S. Vincentelli, Handling model uncertainty in model predictive control for energy efficient buildings, Energy and Buildings 77 (2014) 377\u2013392. DOI: 10.1016/j.enbuild.2014.03.057. [11] Wu H. Pratt A. Chakraborty S. Stochastic optimal scheduling of residential appliances with renewable energy sources IEEE power and energy society general meeting, Vol. 2015-Septe 2015 IEEE Computer Society 10.1109/PESGM.2015.7286584 H. Wu, A. Pratt, S. Chakraborty, Stochastic optimal scheduling of residential appliances with renewable energy sources, IEEE Power and Energy Society General Meeting 2015-Septe. DOI: 10.1109/PESGM.2015.7286584. [12] Pedersen T.H. Petersen S. Investigating the performance of scenario-based model predictive control of space heating in residential buildings J Build Perform Simul 11 4 2018 485 498 10.1080/19401493.2017.1397196 T. H. Pedersen, S. Petersen, Investigating the performance of scenario-based model predictive control of space heating in residential buildings, Journal of Building Performance Simulation 11 (4) (2018) 485\u2013498. DOI: 10.1080/19401493.2017.1397196. [13] Yousefi M. Kianpoor N. Hajizadeh A. Soltani M. Smart energy management system for residential homes regarding uncertainties of photovoltaic array and plug-in electric vehicle IEEE international symposium on industrial electronics, Vol. 2019-June 2019 Institute of Electrical and Electronics Engineers Inc. 2201 2206 10.1109/ISIE.2019.8781471 M. Yousefi, N. Kianpoor, A. Hajizadeh, M. Soltani, Smart Energy Management System for Residential Homes Regarding Uncertainties of Photovoltaic Array and Plug-in Electric Vehicle, in: IEEE International Symposium on Industrial Electronics, 2019-June, Institute of Electrical and Electronics Engineers Inc., 2019, 2201\u20132206. DOI: 10.1109/ISIE.2019.8781471. [14] Thomas D. Deblecker O. Ioakimidis C.S. Optimal operation of an energy management system for a grid-connected smart building considering photovoltaics\u2019 uncertainty and stochastic electric vehicles\u2019 driving schedule Appl Energy 210 2018 1188 1206 10.1016/j.apenergy.2017.07.035 D. Thomas, O. Deblecker, C. S. Ioakimidis, Optimal operation of an energy management system for a grid-connected smart building considering photovoltaics\u2019 uncertainty and stochastic electric vehicles\u2019 driving schedule, Applied Energy 210 (2018) 1188\u20131206. DOI: 10.1016/j.apenergy.2017.07.035. [15] Oldewurtel F. Parisio A. Jones C.N. Gyalistras D. Gwerder M. Stauch V. Lehmann B. Morari M. Use of model predictive control and weather forecasts for energy efficient building climate control Energy Build 45 2012 15 27 10.1016/j.enbuild.2011.09.022 F. Oldewurtel, A. Parisio, C. N. Jones, D. Gyalistras, M. Gwerder, V. Stauch, B. Lehmann, M. Morari, Use of model predictive control and weather forecasts for energy efficient building climate control, Energy and Buildings 45 (2012) 15\u201327. DOI: 10.1016/j.enbuild.2011.09.022. [16] Azuatalam D. Paridari K. Ma Y. Förstl M. Chapman A.C. Verbič G. Energy management of small-scale PV-battery systems: A systematic review considering practical implementation, computational requirements, quality of input data and battery degradation Renew Sustain Energy Rev 112 2019 555 570 10.1016/J.RSER.2019.06.007 D. Azuatalam, K. Paridari, Y. Ma, M. Förstl, A. C. Chapman, G. Verbič, Energy management of small-scale PV-battery systems: A systematic review considering practical implementation, computational requirements, quality of input data and battery degradation, Renewable and Sustainable Energy Reviews 112 (2019) 555\u2013570. DOI: 10.1016/J.RSER.2019.06.007. [17] Iwafune Y. Ikegami T. Fonseca J.G.D.S. Oozeki T. Ogimoto K. Cooperative home energy management using batteries for a photovoltaic system considering the diversity of households Energy Convers Manage 96 2015 322 329 10.1016/j.enconman.2015.02.083 Y. Iwafune, T. Ikegami, J. G. D. S. Fonseca, T. Oozeki, K. Ogimoto, Cooperative home energy management using batteries for a photovoltaic system considering the diversity of households, Energy Conversion and Management 96 (2015) 322\u2013329. DOI: 10.1016/j.enconman.2015.02.083. [18] Ma Y. Matusko J. Borrelli F. Stochastic model predictive control for building HVAC systems: Complexity and conservatism IEEE Trans Control Syst Technol 23 1 2015 101 116 10.1109/TCST.2014.2313736 Y. Ma, J. Matusko, F. Borrelli, Stochastic model predictive control for building HVAC systems: Complexity and conservatism, IEEE Transactions on Control Systems Technology 23 (1) (2015) 101\u2013116. DOI: 10.1109/TCST.2014.2313736. [19] Zhang X. Grammatico S. Schildbach G. Goulart P. Lygeros J. On the sample size of randomized MPC for chance- constrained systems with application to building climate control 2014 European control conference, ECC 2014 2014 Institute of Electrical and Electronics Engineers Inc. 478 483 10.1109/ECC.2014.6862498 X. Zhang, S. Grammatico, G. Schildbach, P. Goulart, J. Lygeros, On the sample size of randomized MPC for chance- constrained systems with application to building climate control, in: 2014 European Control Conference, ECC 2014, Institute of Electrical and Electronics Engineers Inc., 2014, 478\u2013483. DOI: 10.1109/ECC.2014.6862498. [20] Maasoumy M. Razmara M. Shahbakhti M. Sangiovanni Vincentelli A. Selecting building predictive control based on model uncertainty Proceedings of the American control conference 2014 Institute of Electrical and Electronics Engineers Inc. 404 411 10.1109/ACC.2014.6858875 M. Maasoumy, M. Razmara, M. Shahbakhti, A. Sangiovanni Vincentelli, Selecting building predictive control based on model uncertainty, in: Proceedings of the American Control Conference, Institute of Electrical and Electronics Engineers Inc., 2014, 404\u2013411. DOI: 10.1109/ACC.2014.6858875. [21] Rahmani-Andebili M. Shen H. Energy scheduling for a smart home applying stochastic model predictive control 2016 25th international conference on computer communications and networks, ICCCN 2016 2016 Institute of Electrical and Electronics Engineers Inc. 10.1109/ICCCN.2016.7568516 M. Rahmani-Andebili, H. Shen, Energy scheduling for a smart home applying stochastic model predictive control, in: 2016 25th International Conference on Computer Communications and Networks, ICCCN 2016, Institute of Electrical and Electronics Engineers Inc., 2016. DOI: 10.1109/ICCCN.2016.7568516. [22] Hu M. Xiao F. Quantifying uncertainty in the aggregate energy flexibility of high-rise residential building clusters considering stochastic occupancy and occupant behavior Energy 194 2020 116838 10.1016/j.energy.2019.116838 M. Hu, F. Xiao, Quantifying uncertainty in the aggregate energy flexibility of high-rise residential building clusters considering stochastic occupancy and occupant behavior, Energy 194 (2020) 116838. DOI: 10.1016/j.energy.2019.116838. [23] Garifi K. Baker K. Touri B. Christensen D. Stochastic model predictive control for demand response in a home energy management system IEEE power and energy society general meeting, Vol. 2018-Augus 2018 IEEE Computer Society 10.1109/PESGM.2018.8586485 K. Garifi, K. Baker, B. Touri, D. Christensen, Stochastic Model Predictive Control for Demand Response in a Home Energy Management System, IEEE Power and Energy Society General Meeting 2018-Augus. DOI: 10.1109/PESGM.2018.8586485. [24] Blonsky M. Munankarmi P. Balamurugan S.P. Incorporating residential smart electric vehicle charging in home energy management systems IEEE green technologies conference, Vol. 2021-April 2021 IEEE Computer Society 187 194 10.1109/GREENTECH48523.2021.00039 M. Blonsky, P. Munankarmi, S. P. Balamurugan, Incorporating residential smart electric vehicle charging in home energy management systems, IEEE Green Technologies Conference 2021-(2021) 187\u2013194. DOI: 10.1109/GREENTECH48523.2021.00039. [25] Doubleday K. Van Scyoc Hernandez V. Hodge B.M. Benchmark probabilistic solar forecasts: Characteristics and recommendations Sol Energy 206 2020 52 67 10.1016/j.solener.2020.05.051 K. Doubleday, V. Van Scyoc Hernandez, B. M. Hodge, Benchmark probabilistic solar forecasts: Characteristics and recommendations, Solar Energy 206 (2020) 52\u201367. DOI: 10.1016/j.solener.2020.05.051. [26] Jung W. Jazizadeh F. Human-in-the-loop HVAC operations: A quantitative review on occupancy, comfort, and energy-efficiency dimensions Applied energy, Vol. 239 2019 Elsevier Ltd 1471 1508 10.1016/j.apenergy.2019.01.070 W. Jung, F. Jazizadeh, Human-in-the-loop HVAC operations: A quantitative review on occupancy, comfort, and energy-efficiency dimensions (apr 2019). DOI: 10.1016/j.apenergy.2019.01.070. [27] Serafini L. Principi E. Spinsante S. Squartini S. Multi-household energy management in a smart neighborhood in the presence of uncertainties and electric vehicles Electronics 2021, Vol. 10, Page 3186, Vol. 10 2021 Multidisciplinary Digital Publishing Institute 3186 10.3390/ELECTRONICS10243186 (24) L. Serafini, E. Principi, S. Spinsante, S. Squartini, Multi-Household Energy Management in a Smart Neighborhood in the Presence of Uncertainties and Electric Vehicles, Electronics 2021, 10, Page 3186 10 (24) (2021) 3186. DOI: 10.3390/ELECTRONICS10243186. [28] Afram A. Janabi-Sharifi F. Theory and applications of HVAC control systems - a review of model predictive control (MPC) Building and environment, Vol. 72 2014 Elsevier Ltd 343 355 10.1016/j.buildenv.2013.11.016 A. Afram, F. Janabi-Sharifi, Theory and applications of HVAC control systems - A review of model predictive control (MPC) (feb 2014). DOI: 10.1016/j.buildenv.2013.11.016. [29] Dong B. Lam K.P. A real-time model predictive control for building heating and cooling systems based on the occupancy behavior pattern detection and local weather forecasting Build Simul 7 1 2014 89 106 10.1007/s12273-013-0142-7 B. Dong, K. P. Lam, A real-time model predictive control for building heating and cooling systems based on the occupancy behavior pattern detection and local weather forecasting, Building Simulation 7 (1) (2014) 89\u2013106. DOI: 10.1007/s12273-013-0142-7. [30] Cominesi S.R. Farina M. Giulioni L. Picasso B. Scattolini R. A two-layer stochastic model predictive control scheme for microgrids IEEE Trans Control Syst Technol 26 1 2018 1 13 10.1109/TCST.2017.2657606 S. R. Cominesi, M. Farina, L. Giulioni, B. Picasso, R. Scattolini, A Two-Layer Stochastic Model Predictive Control Scheme for Microgrids, IEEE Transactions on Control Systems Technology 26 (1) (2018) 1\u201313. DOI: 10.1109/TCST.2017.2657606. [31] Blonsky M. McKenna K. Vincent T. Nagarajan A. Time-of-use and demand charge battery controller using stochastic model predictive control IEEE SmartGridComm (November) 2020 Institute of Electrical and Electronics Engineers Inc. 10.1109/SmartGridComm47815.2020.9302943 M. Blonsky, K. McKenna, T. Vincent, A. Nagarajan, Time-of-use and Demand Charge Battery Controller using Stochastic Model Predictive Control, IEEE SmartGridComm (November). DOI: 10.1109/SmartGridComm47815.2020.9302943. [32] Munankarmi P. Maguire J. Balamurugan S.P. Blonsky M. Roberts D. Jin X. Community-scale interaction of energy efficiency and demand flexibility in residential buildings Appl Energy 298 2021 117149 10.1016/j.apenergy.2021.117149 P. Munankarmi, J. Maguire, S. P. Balamurugan, M. Blonsky, D. Roberts, X. Jin, Community-scale interaction of energy efficiency and demand flexibility in residential buildings, Applied Energy 298 (2021) 117149. DOI: 10.1016/j.apenergy.2021.117149. [33] Roth A. Reyna J. Innovations in building energy modeling research and development opportunities report for emerging technologies disclaimer Tech. rep. 2016 US Department of Energy, Building Technologies Office A. Roth, J. Reyna, Innovations in Building Energy Modeling Research and Development Opportunities Report for Emerging Technologies Disclaimer, Tech. rep., US Department of Energy, Building Technologies Office (2016). [34] McKenna E. Thomson M. High-resolution stochastic integrated thermal-electrical domestic demand model Appl Energy 165 2016 445 461 10.1016/j.apenergy.2015.12.089 E. McKenna, M. Thomson, High-resolution stochastic integrated thermal-electrical domestic demand model, Applied Energy 165 (2016) 445\u2013461. DOI: 10.1016/j.apenergy.2015.12.089. [35] Blonsky M. Maguire J. McKenna K. Cutler D. Balamurugan S.P. Jin X. OCHRE: The object-oriented, controllable, high-resolution residential energy model for dynamic integration studies Appl Energy 290 2021 116732 10.1016/j.apenergy.2021.116732 M. Blonsky, J. Maguire, K. McKenna, D. Cutler, S. P. Balamurugan, X. Jin, OCHRE: The Object-oriented, Controllable, High-resolution Residential Energy Model for Dynamic Integration Studies, Applied Energy 290 (2021) 116732. DOI: 10.1016/j.apenergy.2021.116732. [36] Maasoumy M. Moridian B. Razmara M. Shahbakhti M. Sangiovanni-Vincentelli A. Online simultaneous state estimation and parameter adaptation for building predictive control ASME 2013 dynamic systems and control conference, DSCC 2013, Vol. 2 2013 American Society of Mechanical Engineers (ASME) 10.1115/DSCC2013-4064 M. Maasoumy, B. Moridian, M. Razmara, M. Shahbakhti, A. Sangiovanni-Vincentelli, Online simultaneous state estimation and parameter adaptation for building predictive control, in: ASME 2013 Dynamic Systems and Control Conference, DSCC 2013, 2, American Society of Mechanical Engineers (ASME), 2013. DOI: 10.1115/DSCC2013-4064. [37] Sofos M. Langevin J. Deru M. Gupta E. Benne K.S. Blum D. Bohn T. Fares R. Fernandez N. Fink G. Frank S. Gerbi J. Granderson J. Hoffmeyer D. Hong T. Jiron A. Johnson S. Katipamula S. Kuruganti T. Langevin J. Livingood W.C. Muehleisen R. Neukomm M. Nubbe V. Phelan P. Piette M. Reyna J. Roth A. Satre-Meloy A. Specian M. Vrabie D. Wetter M. Widergren S. Innovations in sensors and controls for building energy management: research and development opportunities report for emerging technologies Tech. rep. 2020 U.S. DOE EERE 10.2172/1601591 M. Sofos, J. Langevin, M. Deru, E. Gupta, K. S. Benne, D. Blum, T. Bohn, R. Fares, N. Fernandez, G. Fink, S. Frank, J. Gerbi, J. Granderson, D. Hoffmeyer, T. Hong, A. Jiron, S. Johnson, S. Katipamula, T. Kuruganti, J. Langevin, W. C. Livingood, R. Muehleisen, M. Neukomm, V. Nubbe, P. Phelan, M. Piette, J. Reyna, A. Roth, A. Satre-Meloy, M. Specian, D. Vrabie, M. Wetter, S. Widergren, http://www.osti.gov/servlets/purl/1601591/Innovations in Sensors and Controls for Building Energy Management: Research and Development Opportunities Report for Emerging Technologies, Tech. rep., U.S. DOE EERE (2020). DOI: 10.2172/1601591. http://www.osti.gov/servlets/purl/1601591/ [38] Laub A.J. Heath M.T. Paige C.C. Ward R.C. Computation of system balancing transformations and other applications of simultaneous diagonalization algorithms IEEE Trans Automat Control 32 2 1987 115 122 10.1109/TAC.1987.1104549 A. J. Laub, M. T. Heath, C. C. Paige, R. C. Ward, Computation of System Balancing Transformations and Other Applications of Simultaneous Diagonalization Algorithms, IEEE Transactions on Automatic Control 32 (2) (1987) 115\u2013122. DOI: 10.1109/TAC.1987.1104549. [39] Kalman R.E. A new approach to linear filtering and prediction problems J Fluids Eng Trans ASME 82 1 1960 35 45 10.1115/1.3662552 R. E. Kalman, A new approach to linear filtering and prediction problems, Journal of Fluids Engineering, Transactions of the ASME 82 (1) (1960) 35\u201345. DOI: 10.1115/1.3662552. [40] Mirakhorli A. Dong B. Model predictive control for building loads connected with a residential distribution grid Appl Energy 230 2018 627 642 10.1016/j.apenergy.2018.08.051 A. Mirakhorli, B. Dong, Model predictive control for building loads connected with a residential distribution grid, Applied Energy 230 (2018) 627\u2013642. DOI: 10.1016/j.apenergy.2018.08.051. [41] OpenWeatherMap one call API. URL https://openweathermap.org/api/one-call-api. [42] William F.H. Clifford W.H. Mark A.M. Pvlib python: a python package for modeling solar energy systems Journal of Open Source Software 3 29 2018 884 https://pvlib-python.readthedocs.io/en/stable/generated/pvlib.forecast.ForecastModel.cloudcovertoirradiance.htmlPVlib Documentation. https://pvlib-python.readthedocs.io/en/stable/generated/pvlib.forecast.ForecastModel.cloudcovertoirradiance.html [43] Larson D.P. Nonnenmacher L. Coimbra C.F. Day-ahead forecasting of solar power output from photovoltaic plants in the American southwest Renew Energy 91 2016 11 20 10.1016/J.RENENE.2016.01.039 D. P. Larson, L. Nonnenmacher, C. F. Coimbra, Day-ahead forecasting of solar power output from photovoltaic plants in the American Southwest, Renewable Energy 91 (2016) 11\u201320. DOI: 10.1016/J.RENENE.2016.01.039. [44] Chen J. Adhikari R. Wilson E. Robertson J. Fontanini A. Polly B. Olawale O. Stochastic simulation of residential building occupant-driven energy use in a bottom-up model of the U.S. housing stock 2021 Arxiv. URL https://arxiv.org/abs/2111.01881v2 J. Chen, R. Adhikari, E. Wilson, J. Robertson, A. Fontanini, B. Polly, O. Olawale, https://arxiv.org/abs/2111.01881v2Stochastic simulation of residential building occupant-driven energy use in a bottom-up model of the U.S. housing stock, Arxiv. https://arxiv.org/abs/2111.01881v2 [45] Alternative fuels data center: Electric vehicle infrastructure projection tool (EVI-pro) lite assumptions and methodology 2020 URL https://afdc.energy.gov/evi-pro-lite/load-profile/assumptions https://afdc.energy.gov/evi-pro-lite/load-profile/assumptionsAlternative Fuels Data Center: Electric Vehicle Infrastructure Projection Tool (EVI-Pro) Lite Assumptions and Methodology (2020). https://afdc.energy.gov/evi-pro-lite/load-profile/assumptions [46] Seabold S, Perktold J. statsmodels: Econometric and statistical modeling with python. In: 9th Python in Science Conference. 2010. S. Seabold, J. Perktold, http://statsmodels.sourceforge.net/Statsmodels: Econometric and Statistical Modeling with Python, in: Proc. of the 9th Python in Science Conf, no. Scipy, 2010, 92\u201396. http://statsmodels.sourceforge.net/ [47] Time of use \u2014 xcel energy 2022 URL https://co.my.xcelenergy.com/s/billing-payment/residential-rates/time-of-use-pricing https://co.my.xcelenergy.com/s/billing-payment/residential-rates/time-of-use-pricingTime of Use \u2014 Xcel Energy (2022). https://co.my.xcelenergy.com/s/billing-payment/residential-rates/time-of-use-pricing",
    "scopus-id": "85135981736",
    "coredata": {
        "eid": "1-s2.0-S0306261922010509",
        "dc:description": "Home energy management systems (HEMS) have been shown to reduce energy bills and to provide grid services including peak demand reduction and demand flexibility. However, uncertainty in residential energy systems is a significant issue and can reduce the benefits of a HEMS to the homeowner or grid operator. Sources of uncertainty include weather forecasts, predictions of energy-related occupant activities (e.g., hot water draws), and parameter estimation for the building envelope and energy-consuming equipment. This paper tackles the problem of uncertainty by developing a framework that simulates HEMS in uncertain conditions and evaluates the performance of multiple control strategies. A linear, reduced-order residential building model for model predictive control applications is derived and compared to a full-order model. Stochastic model predictive control is shown to perform better than deterministic and heuristic methods when considering realistic forecasts with uncertainty. The framework can evaluate the performance of HEMS in real-world applications, which can help de-risk HEMS deployment.",
        "openArchiveArticle": "false",
        "prism:coverDate": "2022-11-01",
        "openaccessUserLicense": null,
        "prism:aggregationType": "Journal",
        "prism:url": "https://api.elsevier.com/content/article/pii/S0306261922010509",
        "dc:creator": [
            {
                "@_fa": "true",
                "$": "Blonsky, Michael"
            },
            {
                "@_fa": "true",
                "$": "McKenna, Killian"
            },
            {
                "@_fa": "true",
                "$": "Maguire, Jeff"
            },
            {
                "@_fa": "true",
                "$": "Vincent, Tyrone"
            }
        ],
        "link": [
            {
                "@_fa": "true",
                "@rel": "self",
                "@href": "https://api.elsevier.com/content/article/pii/S0306261922010509"
            },
            {
                "@_fa": "true",
                "@rel": "scidir",
                "@href": "https://www.sciencedirect.com/science/article/pii/S0306261922010509"
            }
        ],
        "dc:format": "application/json",
        "openaccessType": null,
        "pii": "S0306-2619(22)01050-9",
        "prism:volume": "325",
        "articleNumber": "119770",
        "prism:publisher": "Elsevier Ltd.",
        "dc:title": "Home energy management under realistic and uncertain conditions: A comparison of heuristic, deterministic, and stochastic control methods",
        "prism:copyright": "© 2022 Elsevier Ltd. All rights reserved.",
        "openaccess": "0",
        "prism:issn": "03062619",
        "dcterms:subject": [
            {
                "@_fa": "true",
                "$": "Home energy management systems"
            },
            {
                "@_fa": "true",
                "$": "Stochastic controls"
            },
            {
                "@_fa": "true",
                "$": "Model predictive control"
            },
            {
                "@_fa": "true",
                "$": "Residential energy modeling"
            },
            {
                "@_fa": "true",
                "$": "Distributed energy resources"
            }
        ],
        "openaccessArticle": "false",
        "prism:publicationName": "Applied Energy",
        "openaccessSponsorType": null,
        "prism:pageRange": "119770",
        "pubType": "fla",
        "prism:coverDisplayDate": "1 November 2022",
        "prism:doi": "10.1016/j.apenergy.2022.119770",
        "prism:startingPage": "119770",
        "dc:identifier": "doi:10.1016/j.apenergy.2022.119770",
        "openaccessSponsorName": null
    },
    "objects": {"object": [
        {
            "@category": "standard",
            "@height": "181",
            "@width": "335",
            "@_fa": "true",
            "$": "https://api.elsevier.com/content/object/eid/1-s2.0-S0306261922010509-gr8.jpg?httpAccept=%2A%2F%2A",
            "@multimediatype": "JPEG image file",
            "@type": "IMAGE-DOWNSAMPLED",
            "@size": "86660",
            "@ref": "gr8",
            "@mimetype": "image/jpeg"
        },
        {
            "@category": "standard",
            "@height": "677",
            "@width": "344",
            "@_fa": "true",
            "$": "https://api.elsevier.com/content/object/eid/1-s2.0-S0306261922010509-gr9.jpg?httpAccept=%2A%2F%2A",
            "@multimediatype": "JPEG image file",
            "@type": "IMAGE-DOWNSAMPLED",
            "@size": "176748",
            "@ref": "gr9",
            "@mimetype": "image/jpeg"
        },
        {
            "@category": "standard",
            "@height": "267",
            "@width": "344",
            "@_fa": "true",
            "$": "https://api.elsevier.com/content/object/eid/1-s2.0-S0306261922010509-gr6.jpg?httpAccept=%2A%2F%2A",
            "@multimediatype": "JPEG image file",
            "@type": "IMAGE-DOWNSAMPLED",
            "@size": "95153",
            "@ref": "gr6",
            "@mimetype": "image/jpeg"
        },
        {
            "@category": "standard",
            "@height": "212",
            "@width": "331",
            "@_fa": "true",
            "$": "https://api.elsevier.com/content/object/eid/1-s2.0-S0306261922010509-gr7.jpg?httpAccept=%2A%2F%2A",
            "@multimediatype": "JPEG image file",
            "@type": "IMAGE-DOWNSAMPLED",
            "@size": "111799",
            "@ref": "gr7",
            "@mimetype": "image/jpeg"
        },
        {
            "@category": "standard",
            "@height": "241",
            "@width": "339",
            "@_fa": "true",
            "$": "https://api.elsevier.com/content/object/eid/1-s2.0-S0306261922010509-gr4.jpg?httpAccept=%2A%2F%2A",
            "@multimediatype": "JPEG image file",
            "@type": "IMAGE-DOWNSAMPLED",
            "@size": "93154",
            "@ref": "gr4",
            "@mimetype": "image/jpeg"
        },
        {
            "@category": "standard",
            "@height": "284",
            "@width": "343",
            "@_fa": "true",
            "$": "https://api.elsevier.com/content/object/eid/1-s2.0-S0306261922010509-gr10.jpg?httpAccept=%2A%2F%2A",
            "@multimediatype": "JPEG image file",
            "@type": "IMAGE-DOWNSAMPLED",
            "@size": "121416",
            "@ref": "gr10",
            "@mimetype": "image/jpeg"
        },
        {
            "@category": "standard",
            "@height": "254",
            "@width": "344",
            "@_fa": "true",
            "$": "https://api.elsevier.com/content/object/eid/1-s2.0-S0306261922010509-gr5.jpg?httpAccept=%2A%2F%2A",
            "@multimediatype": "JPEG image file",
            "@type": "IMAGE-DOWNSAMPLED",
            "@size": "96695",
            "@ref": "gr5",
            "@mimetype": "image/jpeg"
        },
        {
            "@category": "standard",
            "@height": "306",
            "@width": "696",
            "@_fa": "true",
            "$": "https://api.elsevier.com/content/object/eid/1-s2.0-S0306261922010509-gr2.jpg?httpAccept=%2A%2F%2A",
            "@multimediatype": "JPEG image file",
            "@type": "IMAGE-DOWNSAMPLED",
            "@size": "123301",
            "@ref": "gr2",
            "@mimetype": "image/jpeg"
        },
        {
            "@category": "standard",
            "@height": "298",
            "@width": "343",
            "@_fa": "true",
            "$": "https://api.elsevier.com/content/object/eid/1-s2.0-S0306261922010509-gr12.jpg?httpAccept=%2A%2F%2A",
            "@multimediatype": "JPEG image file",
            "@type": "IMAGE-DOWNSAMPLED",
            "@size": "119931",
            "@ref": "gr12",
            "@mimetype": "image/jpeg"
        },
        {
            "@category": "standard",
            "@height": "273",
            "@width": "696",
            "@_fa": "true",
            "$": "https://api.elsevier.com/content/object/eid/1-s2.0-S0306261922010509-gr3.jpg?httpAccept=%2A%2F%2A",
            "@multimediatype": "JPEG image file",
            "@type": "IMAGE-DOWNSAMPLED",
            "@size": "118608",
            "@ref": "gr3",
            "@mimetype": "image/jpeg"
        },
        {
            "@category": "standard",
            "@height": "187",
            "@width": "344",
            "@_fa": "true",
            "$": "https://api.elsevier.com/content/object/eid/1-s2.0-S0306261922010509-gr11.jpg?httpAccept=%2A%2F%2A",
            "@multimediatype": "JPEG image file",
            "@type": "IMAGE-DOWNSAMPLED",
            "@size": "95712",
            "@ref": "gr11",
            "@mimetype": "image/jpeg"
        },
        {
            "@category": "standard",
            "@height": "147",
            "@width": "339",
            "@_fa": "true",
            "$": "https://api.elsevier.com/content/object/eid/1-s2.0-S0306261922010509-gr1.jpg?httpAccept=%2A%2F%2A",
            "@multimediatype": "JPEG image file",
            "@type": "IMAGE-DOWNSAMPLED",
            "@size": "87954",
            "@ref": "gr1",
            "@mimetype": "image/jpeg"
        },
        {
            "@category": "standard",
            "@height": "342",
            "@width": "341",
            "@_fa": "true",
            "$": "https://api.elsevier.com/content/object/eid/1-s2.0-S0306261922010509-gr13.jpg?httpAccept=%2A%2F%2A",
            "@multimediatype": "JPEG image file",
            "@type": "IMAGE-DOWNSAMPLED",
            "@size": "127104",
            "@ref": "gr13",
            "@mimetype": "image/jpeg"
        },
        {
            "@category": "thumbnail",
            "@height": "118",
            "@width": "219",
            "@_fa": "true",
            "$": "https://api.elsevier.com/content/object/eid/1-s2.0-S0306261922010509-gr8.sml?httpAccept=%2A%2F%2A",
            "@multimediatype": "GIF image file",
            "@type": "IMAGE-THUMBNAIL",
            "@size": "71815",
            "@ref": "gr8",
            "@mimetype": "image/gif"
        },
        {
            "@category": "thumbnail",
            "@height": "163",
            "@width": "83",
            "@_fa": "true",
            "$": "https://api.elsevier.com/content/object/eid/1-s2.0-S0306261922010509-gr9.sml?httpAccept=%2A%2F%2A",
            "@multimediatype": "GIF image file",
            "@type": "IMAGE-THUMBNAIL",
            "@size": "78641",
            "@ref": "gr9",
            "@mimetype": "image/gif"
        },
        {
            "@category": "thumbnail",
            "@height": "164",
            "@width": "211",
            "@_fa": "true",
            "$": "https://api.elsevier.com/content/object/eid/1-s2.0-S0306261922010509-gr6.sml?httpAccept=%2A%2F%2A",
            "@multimediatype": "GIF image file",
            "@type": "IMAGE-THUMBNAIL",
            "@size": "76134",
            "@ref": "gr6",
            "@mimetype": "image/gif"
        },
        {
            "@category": "thumbnail",
            "@height": "140",
            "@width": "219",
            "@_fa": "true",
            "$": "https://api.elsevier.com/content/object/eid/1-s2.0-S0306261922010509-gr7.sml?httpAccept=%2A%2F%2A",
            "@multimediatype": "GIF image file",
            "@type": "IMAGE-THUMBNAIL",
            "@size": "84562",
            "@ref": "gr7",
            "@mimetype": "image/gif"
        },
        {
            "@category": "thumbnail",
            "@height": "156",
            "@width": "219",
            "@_fa": "true",
            "$": "https://api.elsevier.com/content/object/eid/1-s2.0-S0306261922010509-gr4.sml?httpAccept=%2A%2F%2A",
            "@multimediatype": "GIF image file",
            "@type": "IMAGE-THUMBNAIL",
            "@size": "75308",
            "@ref": "gr4",
            "@mimetype": "image/gif"
        },
        {
            "@category": "thumbnail",
            "@height": "164",
            "@width": "198",
            "@_fa": "true",
            "$": "https://api.elsevier.com/content/object/eid/1-s2.0-S0306261922010509-gr10.sml?httpAccept=%2A%2F%2A",
            "@multimediatype": "GIF image file",
            "@type": "IMAGE-THUMBNAIL",
            "@size": "86962",
            "@ref": "gr10",
            "@mimetype": "image/gif"
        },
        {
            "@category": "thumbnail",
            "@height": "162",
            "@width": "219",
            "@_fa": "true",
            "$": "https://api.elsevier.com/content/object/eid/1-s2.0-S0306261922010509-gr5.sml?httpAccept=%2A%2F%2A",
            "@multimediatype": "GIF image file",
            "@type": "IMAGE-THUMBNAIL",
            "@size": "77912",
            "@ref": "gr5",
            "@mimetype": "image/gif"
        },
        {
            "@category": "thumbnail",
            "@height": "96",
            "@width": "219",
            "@_fa": "true",
            "$": "https://api.elsevier.com/content/object/eid/1-s2.0-S0306261922010509-gr2.sml?httpAccept=%2A%2F%2A",
            "@multimediatype": "GIF image file",
            "@type": "IMAGE-THUMBNAIL",
            "@size": "72874",
            "@ref": "gr2",
            "@mimetype": "image/gif"
        },
        {
            "@category": "thumbnail",
            "@height": "163",
            "@width": "188",
            "@_fa": "true",
            "$": "https://api.elsevier.com/content/object/eid/1-s2.0-S0306261922010509-gr12.sml?httpAccept=%2A%2F%2A",
            "@multimediatype": "GIF image file",
            "@type": "IMAGE-THUMBNAIL",
            "@size": "85633",
            "@ref": "gr12",
            "@mimetype": "image/gif"
        },
        {
            "@category": "thumbnail",
            "@height": "86",
            "@width": "219",
            "@_fa": "true",
            "$": "https://api.elsevier.com/content/object/eid/1-s2.0-S0306261922010509-gr3.sml?httpAccept=%2A%2F%2A",
            "@multimediatype": "GIF image file",
            "@type": "IMAGE-THUMBNAIL",
            "@size": "71163",
            "@ref": "gr3",
            "@mimetype": "image/gif"
        },
        {
            "@category": "thumbnail",
            "@height": "119",
            "@width": "219",
            "@_fa": "true",
            "$": "https://api.elsevier.com/content/object/eid/1-s2.0-S0306261922010509-gr11.sml?httpAccept=%2A%2F%2A",
            "@multimediatype": "GIF image file",
            "@type": "IMAGE-THUMBNAIL",
            "@size": "79861",
            "@ref": "gr11",
            "@mimetype": "image/gif"
        },
        {
            "@category": "thumbnail",
            "@height": "95",
            "@width": "219",
            "@_fa": "true",
            "$": "https://api.elsevier.com/content/object/eid/1-s2.0-S0306261922010509-gr1.sml?httpAccept=%2A%2F%2A",
            "@multimediatype": "GIF image file",
            "@type": "IMAGE-THUMBNAIL",
            "@size": "76036",
            "@ref": "gr1",
            "@mimetype": "image/gif"
        },
        {
            "@category": "thumbnail",
            "@height": "164",
            "@width": "163",
            "@_fa": "true",
            "$": "https://api.elsevier.com/content/object/eid/1-s2.0-S0306261922010509-gr13.sml?httpAccept=%2A%2F%2A",
            "@multimediatype": "GIF image file",
            "@type": "IMAGE-THUMBNAIL",
            "@size": "83897",
            "@ref": "gr13",
            "@mimetype": "image/gif"
        },
        {
            "@category": "high",
            "@height": "801",
            "@width": "1483",
            "@_fa": "true",
            "$": "https://api.elsevier.com/content/object/eid/1-s2.0-S0306261922010509-gr8_lrg.jpg?httpAccept=%2A%2F%2A",
            "@multimediatype": "JPEG image file",
            "@type": "IMAGE-HIGH-RES",
            "@size": "161556",
            "@ref": "gr8",
            "@mimetype": "image/jpeg"
        },
        {
            "@category": "high",
            "@height": "3001",
            "@width": "1524",
            "@_fa": "true",
            "$": "https://api.elsevier.com/content/object/eid/1-s2.0-S0306261922010509-gr9_lrg.jpg?httpAccept=%2A%2F%2A",
            "@multimediatype": "JPEG image file",
            "@type": "IMAGE-HIGH-RES",
            "@size": "809260",
            "@ref": "gr9",
            "@mimetype": "image/jpeg"
        },
        {
            "@category": "high",
            "@height": "1182",
            "@width": "1523",
            "@_fa": "true",
            "$": "https://api.elsevier.com/content/object/eid/1-s2.0-S0306261922010509-gr6_lrg.jpg?httpAccept=%2A%2F%2A",
            "@multimediatype": "JPEG image file",
            "@type": "IMAGE-HIGH-RES",
            "@size": "219293",
            "@ref": "gr6",
            "@mimetype": "image/jpeg"
        },
        {
            "@category": "high",
            "@height": "939",
            "@width": "1468",
            "@_fa": "true",
            "$": "https://api.elsevier.com/content/object/eid/1-s2.0-S0306261922010509-gr7_lrg.jpg?httpAccept=%2A%2F%2A",
            "@multimediatype": "JPEG image file",
            "@type": "IMAGE-HIGH-RES",
            "@size": "340850",
            "@ref": "gr7",
            "@mimetype": "image/jpeg"
        },
        {
            "@category": "high",
            "@height": "1068",
            "@width": "1500",
            "@_fa": "true",
            "$": "https://api.elsevier.com/content/object/eid/1-s2.0-S0306261922010509-gr4_lrg.jpg?httpAccept=%2A%2F%2A",
            "@multimediatype": "JPEG image file",
            "@type": "IMAGE-HIGH-RES",
            "@size": "202950",
            "@ref": "gr4",
            "@mimetype": "image/jpeg"
        },
        {
            "@category": "high",
            "@height": "1256",
            "@width": "1519",
            "@_fa": "true",
            "$": "https://api.elsevier.com/content/object/eid/1-s2.0-S0306261922010509-gr10_lrg.jpg?httpAccept=%2A%2F%2A",
            "@multimediatype": "JPEG image file",
            "@type": "IMAGE-HIGH-RES",
            "@size": "402875",
            "@ref": "gr10",
            "@mimetype": "image/jpeg"
        },
        {
            "@category": "high",
            "@height": "1125",
            "@width": "1523",
            "@_fa": "true",
            "$": "https://api.elsevier.com/content/object/eid/1-s2.0-S0306261922010509-gr5_lrg.jpg?httpAccept=%2A%2F%2A",
            "@multimediatype": "JPEG image file",
            "@type": "IMAGE-HIGH-RES",
            "@size": "231969",
            "@ref": "gr5",
            "@mimetype": "image/jpeg"
        },
        {
            "@category": "high",
            "@height": "1354",
            "@width": "3083",
            "@_fa": "true",
            "$": "https://api.elsevier.com/content/object/eid/1-s2.0-S0306261922010509-gr2_lrg.jpg?httpAccept=%2A%2F%2A",
            "@multimediatype": "JPEG image file",
            "@type": "IMAGE-HIGH-RES",
            "@size": "478751",
            "@ref": "gr2",
            "@mimetype": "image/jpeg"
        },
        {
            "@category": "high",
            "@height": "1321",
            "@width": "1519",
            "@_fa": "true",
            "$": "https://api.elsevier.com/content/object/eid/1-s2.0-S0306261922010509-gr12_lrg.jpg?httpAccept=%2A%2F%2A",
            "@multimediatype": "JPEG image file",
            "@type": "IMAGE-HIGH-RES",
            "@size": "407872",
            "@ref": "gr12",
            "@mimetype": "image/jpeg"
        },
        {
            "@category": "high",
            "@height": "1211",
            "@width": "3083",
            "@_fa": "true",
            "$": "https://api.elsevier.com/content/object/eid/1-s2.0-S0306261922010509-gr3_lrg.jpg?httpAccept=%2A%2F%2A",
            "@multimediatype": "JPEG image file",
            "@type": "IMAGE-HIGH-RES",
            "@size": "375139",
            "@ref": "gr3",
            "@mimetype": "image/jpeg"
        },
        {
            "@category": "high",
            "@height": "829",
            "@width": "1524",
            "@_fa": "true",
            "$": "https://api.elsevier.com/content/object/eid/1-s2.0-S0306261922010509-gr11_lrg.jpg?httpAccept=%2A%2F%2A",
            "@multimediatype": "JPEG image file",
            "@type": "IMAGE-HIGH-RES",
            "@size": "246596",
            "@ref": "gr11",
            "@mimetype": "image/jpeg"
        },
        {
            "@category": "high",
            "@height": "651",
            "@width": "1504",
            "@_fa": "true",
            "$": "https://api.elsevier.com/content/object/eid/1-s2.0-S0306261922010509-gr1_lrg.jpg?httpAccept=%2A%2F%2A",
            "@multimediatype": "JPEG image file",
            "@type": "IMAGE-HIGH-RES",
            "@size": "209455",
            "@ref": "gr1",
            "@mimetype": "image/jpeg"
        },
        {
            "@category": "high",
            "@height": "1515",
            "@width": "1509",
            "@_fa": "true",
            "$": "https://api.elsevier.com/content/object/eid/1-s2.0-S0306261922010509-gr13_lrg.jpg?httpAccept=%2A%2F%2A",
            "@multimediatype": "JPEG image file",
            "@type": "IMAGE-HIGH-RES",
            "@size": "412379",
            "@ref": "gr13",
            "@mimetype": "image/jpeg"
        },
        {
            "@category": "thumbnail",
            "@_fa": "true",
            "$": "https://api.elsevier.com/content/object/eid/1-s2.0-S0306261922010509-si1.svg?httpAccept=%2A%2F%2A",
            "@multimediatype": "Scalable Vector Graphics file",
            "@type": "ALTIMG",
            "@size": "2726",
            "@ref": "si1",
            "@mimetype": "image/svg+xml"
        },
        {
            "@category": "thumbnail",
            "@_fa": "true",
            "$": "https://api.elsevier.com/content/object/eid/1-s2.0-S0306261922010509-si100.svg?httpAccept=%2A%2F%2A",
            "@multimediatype": "Scalable Vector Graphics file",
            "@type": "ALTIMG",
            "@size": "2102",
            "@ref": "si100",
            "@mimetype": "image/svg+xml"
        },
        {
            "@category": "thumbnail",
            "@_fa": "true",
            "$": "https://api.elsevier.com/content/object/eid/1-s2.0-S0306261922010509-si101.svg?httpAccept=%2A%2F%2A",
            "@multimediatype": "Scalable Vector Graphics file",
            "@type": "ALTIMG",
            "@size": "11743",
            "@ref": "si101",
            "@mimetype": "image/svg+xml"
        },
        {
            "@category": "thumbnail",
            "@_fa": "true",
            "$": "https://api.elsevier.com/content/object/eid/1-s2.0-S0306261922010509-si103.svg?httpAccept=%2A%2F%2A",
            "@multimediatype": "Scalable Vector Graphics file",
            "@type": "ALTIMG",
            "@size": "4073",
            "@ref": "si103",
            "@mimetype": "image/svg+xml"
        },
        {
            "@category": "thumbnail",
            "@_fa": "true",
            "$": "https://api.elsevier.com/content/object/eid/1-s2.0-S0306261922010509-si106.svg?httpAccept=%2A%2F%2A",
            "@multimediatype": "Scalable Vector Graphics file",
            "@type": "ALTIMG",
            "@size": "2158",
            "@ref": "si106",
            "@mimetype": "image/svg+xml"
        },
        {
            "@category": "thumbnail",
            "@_fa": "true",
            "$": "https://api.elsevier.com/content/object/eid/1-s2.0-S0306261922010509-si11.svg?httpAccept=%2A%2F%2A",
            "@multimediatype": "Scalable Vector Graphics file",
            "@type": "ALTIMG",
            "@size": "7509",
            "@ref": "si11",
            "@mimetype": "image/svg+xml"
        },
        {
            "@category": "thumbnail",
            "@_fa": "true",
            "$": "https://api.elsevier.com/content/object/eid/1-s2.0-S0306261922010509-si110.svg?httpAccept=%2A%2F%2A",
            "@multimediatype": "Scalable Vector Graphics file",
            "@type": "ALTIMG",
            "@size": "12873",
            "@ref": "si110",
            "@mimetype": "image/svg+xml"
        },
        {
            "@category": "thumbnail",
            "@_fa": "true",
            "$": "https://api.elsevier.com/content/object/eid/1-s2.0-S0306261922010509-si117.svg?httpAccept=%2A%2F%2A",
            "@multimediatype": "Scalable Vector Graphics file",
            "@type": "ALTIMG",
            "@size": "14957",
            "@ref": "si117",
            "@mimetype": "image/svg+xml"
        },
        {
            "@category": "thumbnail",
            "@_fa": "true",
            "$": "https://api.elsevier.com/content/object/eid/1-s2.0-S0306261922010509-si118.svg?httpAccept=%2A%2F%2A",
            "@multimediatype": "Scalable Vector Graphics file",
            "@type": "ALTIMG",
            "@size": "2297",
            "@ref": "si118",
            "@mimetype": "image/svg+xml"
        },
        {
            "@category": "thumbnail",
            "@_fa": "true",
            "$": "https://api.elsevier.com/content/object/eid/1-s2.0-S0306261922010509-si120.svg?httpAccept=%2A%2F%2A",
            "@multimediatype": "Scalable Vector Graphics file",
            "@type": "ALTIMG",
            "@size": "2641",
            "@ref": "si120",
            "@mimetype": "image/svg+xml"
        },
        {
            "@category": "thumbnail",
            "@_fa": "true",
            "$": "https://api.elsevier.com/content/object/eid/1-s2.0-S0306261922010509-si122.svg?httpAccept=%2A%2F%2A",
            "@multimediatype": "Scalable Vector Graphics file",
            "@type": "ALTIMG",
            "@size": "1019",
            "@ref": "si122",
            "@mimetype": "image/svg+xml"
        },
        {
            "@category": "thumbnail",
            "@_fa": "true",
            "$": "https://api.elsevier.com/content/object/eid/1-s2.0-S0306261922010509-si123.svg?httpAccept=%2A%2F%2A",
            "@multimediatype": "Scalable Vector Graphics file",
            "@type": "ALTIMG",
            "@size": "6487",
            "@ref": "si123",
            "@mimetype": "image/svg+xml"
        },
        {
            "@category": "thumbnail",
            "@_fa": "true",
            "$": "https://api.elsevier.com/content/object/eid/1-s2.0-S0306261922010509-si124.svg?httpAccept=%2A%2F%2A",
            "@multimediatype": "Scalable Vector Graphics file",
            "@type": "ALTIMG",
            "@size": "5810",
            "@ref": "si124",
            "@mimetype": "image/svg+xml"
        },
        {
            "@category": "thumbnail",
            "@_fa": "true",
            "$": "https://api.elsevier.com/content/object/eid/1-s2.0-S0306261922010509-si125.svg?httpAccept=%2A%2F%2A",
            "@multimediatype": "Scalable Vector Graphics file",
            "@type": "ALTIMG",
            "@size": "10596",
            "@ref": "si125",
            "@mimetype": "image/svg+xml"
        },
        {
            "@category": "thumbnail",
            "@_fa": "true",
            "$": "https://api.elsevier.com/content/object/eid/1-s2.0-S0306261922010509-si126.svg?httpAccept=%2A%2F%2A",
            "@multimediatype": "Scalable Vector Graphics file",
            "@type": "ALTIMG",
            "@size": "22370",
            "@ref": "si126",
            "@mimetype": "image/svg+xml"
        },
        {
            "@category": "thumbnail",
            "@_fa": "true",
            "$": "https://api.elsevier.com/content/object/eid/1-s2.0-S0306261922010509-si128.svg?httpAccept=%2A%2F%2A",
            "@multimediatype": "Scalable Vector Graphics file",
            "@type": "ALTIMG",
            "@size": "8564",
            "@ref": "si128",
            "@mimetype": "image/svg+xml"
        },
        {
            "@category": "thumbnail",
            "@_fa": "true",
            "$": "https://api.elsevier.com/content/object/eid/1-s2.0-S0306261922010509-si130.svg?httpAccept=%2A%2F%2A",
            "@multimediatype": "Scalable Vector Graphics file",
            "@type": "ALTIMG",
            "@size": "8321",
            "@ref": "si130",
            "@mimetype": "image/svg+xml"
        },
        {
            "@category": "thumbnail",
            "@_fa": "true",
            "$": "https://api.elsevier.com/content/object/eid/1-s2.0-S0306261922010509-si131.svg?httpAccept=%2A%2F%2A",
            "@multimediatype": "Scalable Vector Graphics file",
            "@type": "ALTIMG",
            "@size": "7609",
            "@ref": "si131",
            "@mimetype": "image/svg+xml"
        },
        {
            "@category": "thumbnail",
            "@_fa": "true",
            "$": "https://api.elsevier.com/content/object/eid/1-s2.0-S0306261922010509-si132.svg?httpAccept=%2A%2F%2A",
            "@multimediatype": "Scalable Vector Graphics file",
            "@type": "ALTIMG",
            "@size": "16381",
            "@ref": "si132",
            "@mimetype": "image/svg+xml"
        },
        {
            "@category": "thumbnail",
            "@_fa": "true",
            "$": "https://api.elsevier.com/content/object/eid/1-s2.0-S0306261922010509-si136.svg?httpAccept=%2A%2F%2A",
            "@multimediatype": "Scalable Vector Graphics file",
            "@type": "ALTIMG",
            "@size": "5747",
            "@ref": "si136",
            "@mimetype": "image/svg+xml"
        },
        {
            "@category": "thumbnail",
            "@_fa": "true",
            "$": "https://api.elsevier.com/content/object/eid/1-s2.0-S0306261922010509-si137.svg?httpAccept=%2A%2F%2A",
            "@multimediatype": "Scalable Vector Graphics file",
            "@type": "ALTIMG",
            "@size": "3376",
            "@ref": "si137",
            "@mimetype": "image/svg+xml"
        },
        {
            "@category": "thumbnail",
            "@_fa": "true",
            "$": "https://api.elsevier.com/content/object/eid/1-s2.0-S0306261922010509-si138.svg?httpAccept=%2A%2F%2A",
            "@multimediatype": "Scalable Vector Graphics file",
            "@type": "ALTIMG",
            "@size": "16840",
            "@ref": "si138",
            "@mimetype": "image/svg+xml"
        },
        {
            "@category": "thumbnail",
            "@_fa": "true",
            "$": "https://api.elsevier.com/content/object/eid/1-s2.0-S0306261922010509-si14.svg?httpAccept=%2A%2F%2A",
            "@multimediatype": "Scalable Vector Graphics file",
            "@type": "ALTIMG",
            "@size": "3508",
            "@ref": "si14",
            "@mimetype": "image/svg+xml"
        },
        {
            "@category": "thumbnail",
            "@_fa": "true",
            "$": "https://api.elsevier.com/content/object/eid/1-s2.0-S0306261922010509-si141.svg?httpAccept=%2A%2F%2A",
            "@multimediatype": "Scalable Vector Graphics file",
            "@type": "ALTIMG",
            "@size": "21221",
            "@ref": "si141",
            "@mimetype": "image/svg+xml"
        },
        {
            "@category": "thumbnail",
            "@_fa": "true",
            "$": "https://api.elsevier.com/content/object/eid/1-s2.0-S0306261922010509-si143.svg?httpAccept=%2A%2F%2A",
            "@multimediatype": "Scalable Vector Graphics file",
            "@type": "ALTIMG",
            "@size": "1859",
            "@ref": "si143",
            "@mimetype": "image/svg+xml"
        },
        {
            "@category": "thumbnail",
            "@_fa": "true",
            "$": "https://api.elsevier.com/content/object/eid/1-s2.0-S0306261922010509-si146.svg?httpAccept=%2A%2F%2A",
            "@multimediatype": "Scalable Vector Graphics file",
            "@type": "ALTIMG",
            "@size": "1100",
            "@ref": "si146",
            "@mimetype": "image/svg+xml"
        },
        {
            "@category": "thumbnail",
            "@_fa": "true",
            "$": "https://api.elsevier.com/content/object/eid/1-s2.0-S0306261922010509-si147.svg?httpAccept=%2A%2F%2A",
            "@multimediatype": "Scalable Vector Graphics file",
            "@type": "ALTIMG",
            "@size": "2350",
            "@ref": "si147",
            "@mimetype": "image/svg+xml"
        },
        {
            "@category": "thumbnail",
            "@_fa": "true",
            "$": "https://api.elsevier.com/content/object/eid/1-s2.0-S0306261922010509-si148.svg?httpAccept=%2A%2F%2A",
            "@multimediatype": "Scalable Vector Graphics file",
            "@type": "ALTIMG",
            "@size": "6227",
            "@ref": "si148",
            "@mimetype": "image/svg+xml"
        },
        {
            "@category": "thumbnail",
            "@_fa": "true",
            "$": "https://api.elsevier.com/content/object/eid/1-s2.0-S0306261922010509-si149.svg?httpAccept=%2A%2F%2A",
            "@multimediatype": "Scalable Vector Graphics file",
            "@type": "ALTIMG",
            "@size": "5976",
            "@ref": "si149",
            "@mimetype": "image/svg+xml"
        },
        {
            "@category": "thumbnail",
            "@_fa": "true",
            "$": "https://api.elsevier.com/content/object/eid/1-s2.0-S0306261922010509-si150.svg?httpAccept=%2A%2F%2A",
            "@multimediatype": "Scalable Vector Graphics file",
            "@type": "ALTIMG",
            "@size": "11691",
            "@ref": "si150",
            "@mimetype": "image/svg+xml"
        },
        {
            "@category": "thumbnail",
            "@_fa": "true",
            "$": "https://api.elsevier.com/content/object/eid/1-s2.0-S0306261922010509-si151.svg?httpAccept=%2A%2F%2A",
            "@multimediatype": "Scalable Vector Graphics file",
            "@type": "ALTIMG",
            "@size": "18796",
            "@ref": "si151",
            "@mimetype": "image/svg+xml"
        },
        {
            "@category": "thumbnail",
            "@_fa": "true",
            "$": "https://api.elsevier.com/content/object/eid/1-s2.0-S0306261922010509-si152.svg?httpAccept=%2A%2F%2A",
            "@multimediatype": "Scalable Vector Graphics file",
            "@type": "ALTIMG",
            "@size": "3224",
            "@ref": "si152",
            "@mimetype": "image/svg+xml"
        },
        {
            "@category": "thumbnail",
            "@_fa": "true",
            "$": "https://api.elsevier.com/content/object/eid/1-s2.0-S0306261922010509-si154.svg?httpAccept=%2A%2F%2A",
            "@multimediatype": "Scalable Vector Graphics file",
            "@type": "ALTIMG",
            "@size": "3415",
            "@ref": "si154",
            "@mimetype": "image/svg+xml"
        },
        {
            "@category": "thumbnail",
            "@_fa": "true",
            "$": "https://api.elsevier.com/content/object/eid/1-s2.0-S0306261922010509-si155.svg?httpAccept=%2A%2F%2A",
            "@multimediatype": "Scalable Vector Graphics file",
            "@type": "ALTIMG",
            "@size": "3350",
            "@ref": "si155",
            "@mimetype": "image/svg+xml"
        },
        {
            "@category": "thumbnail",
            "@_fa": "true",
            "$": "https://api.elsevier.com/content/object/eid/1-s2.0-S0306261922010509-si158.svg?httpAccept=%2A%2F%2A",
            "@multimediatype": "Scalable Vector Graphics file",
            "@type": "ALTIMG",
            "@size": "5158",
            "@ref": "si158",
            "@mimetype": "image/svg+xml"
        },
        {
            "@category": "thumbnail",
            "@_fa": "true",
            "$": "https://api.elsevier.com/content/object/eid/1-s2.0-S0306261922010509-si159.svg?httpAccept=%2A%2F%2A",
            "@multimediatype": "Scalable Vector Graphics file",
            "@type": "ALTIMG",
            "@size": "10325",
            "@ref": "si159",
            "@mimetype": "image/svg+xml"
        },
        {
            "@category": "thumbnail",
            "@_fa": "true",
            "$": "https://api.elsevier.com/content/object/eid/1-s2.0-S0306261922010509-si16.svg?httpAccept=%2A%2F%2A",
            "@multimediatype": "Scalable Vector Graphics file",
            "@type": "ALTIMG",
            "@size": "1319",
            "@ref": "si16",
            "@mimetype": "image/svg+xml"
        },
        {
            "@category": "thumbnail",
            "@_fa": "true",
            "$": "https://api.elsevier.com/content/object/eid/1-s2.0-S0306261922010509-si160.svg?httpAccept=%2A%2F%2A",
            "@multimediatype": "Scalable Vector Graphics file",
            "@type": "ALTIMG",
            "@size": "15234",
            "@ref": "si160",
            "@mimetype": "image/svg+xml"
        },
        {
            "@category": "thumbnail",
            "@_fa": "true",
            "$": "https://api.elsevier.com/content/object/eid/1-s2.0-S0306261922010509-si161.svg?httpAccept=%2A%2F%2A",
            "@multimediatype": "Scalable Vector Graphics file",
            "@type": "ALTIMG",
            "@size": "11989",
            "@ref": "si161",
            "@mimetype": "image/svg+xml"
        },
        {
            "@category": "thumbnail",
            "@_fa": "true",
            "$": "https://api.elsevier.com/content/object/eid/1-s2.0-S0306261922010509-si162.svg?httpAccept=%2A%2F%2A",
            "@multimediatype": "Scalable Vector Graphics file",
            "@type": "ALTIMG",
            "@size": "6285",
            "@ref": "si162",
            "@mimetype": "image/svg+xml"
        },
        {
            "@category": "thumbnail",
            "@_fa": "true",
            "$": "https://api.elsevier.com/content/object/eid/1-s2.0-S0306261922010509-si163.svg?httpAccept=%2A%2F%2A",
            "@multimediatype": "Scalable Vector Graphics file",
            "@type": "ALTIMG",
            "@size": "4173",
            "@ref": "si163",
            "@mimetype": "image/svg+xml"
        },
        {
            "@category": "thumbnail",
            "@_fa": "true",
            "$": "https://api.elsevier.com/content/object/eid/1-s2.0-S0306261922010509-si164.svg?httpAccept=%2A%2F%2A",
            "@multimediatype": "Scalable Vector Graphics file",
            "@type": "ALTIMG",
            "@size": "5121",
            "@ref": "si164",
            "@mimetype": "image/svg+xml"
        },
        {
            "@category": "thumbnail",
            "@_fa": "true",
            "$": "https://api.elsevier.com/content/object/eid/1-s2.0-S0306261922010509-si166.svg?httpAccept=%2A%2F%2A",
            "@multimediatype": "Scalable Vector Graphics file",
            "@type": "ALTIMG",
            "@size": "11719",
            "@ref": "si166",
            "@mimetype": "image/svg+xml"
        },
        {
            "@category": "thumbnail",
            "@_fa": "true",
            "$": "https://api.elsevier.com/content/object/eid/1-s2.0-S0306261922010509-si167.svg?httpAccept=%2A%2F%2A",
            "@multimediatype": "Scalable Vector Graphics file",
            "@type": "ALTIMG",
            "@size": "6292",
            "@ref": "si167",
            "@mimetype": "image/svg+xml"
        },
        {
            "@category": "thumbnail",
            "@_fa": "true",
            "$": "https://api.elsevier.com/content/object/eid/1-s2.0-S0306261922010509-si169.svg?httpAccept=%2A%2F%2A",
            "@multimediatype": "Scalable Vector Graphics file",
            "@type": "ALTIMG",
            "@size": "14303",
            "@ref": "si169",
            "@mimetype": "image/svg+xml"
        },
        {
            "@category": "thumbnail",
            "@_fa": "true",
            "$": "https://api.elsevier.com/content/object/eid/1-s2.0-S0306261922010509-si17.svg?httpAccept=%2A%2F%2A",
            "@multimediatype": "Scalable Vector Graphics file",
            "@type": "ALTIMG",
            "@size": "7125",
            "@ref": "si17",
            "@mimetype": "image/svg+xml"
        },
        {
            "@category": "thumbnail",
            "@_fa": "true",
            "$": "https://api.elsevier.com/content/object/eid/1-s2.0-S0306261922010509-si170.svg?httpAccept=%2A%2F%2A",
            "@multimediatype": "Scalable Vector Graphics file",
            "@type": "ALTIMG",
            "@size": "17664",
            "@ref": "si170",
            "@mimetype": "image/svg+xml"
        },
        {
            "@category": "thumbnail",
            "@_fa": "true",
            "$": "https://api.elsevier.com/content/object/eid/1-s2.0-S0306261922010509-si171.svg?httpAccept=%2A%2F%2A",
            "@multimediatype": "Scalable Vector Graphics file",
            "@type": "ALTIMG",
            "@size": "22156",
            "@ref": "si171",
            "@mimetype": "image/svg+xml"
        },
        {
            "@category": "thumbnail",
            "@_fa": "true",
            "$": "https://api.elsevier.com/content/object/eid/1-s2.0-S0306261922010509-si172.svg?httpAccept=%2A%2F%2A",
            "@multimediatype": "Scalable Vector Graphics file",
            "@type": "ALTIMG",
            "@size": "14148",
            "@ref": "si172",
            "@mimetype": "image/svg+xml"
        },
        {
            "@category": "thumbnail",
            "@_fa": "true",
            "$": "https://api.elsevier.com/content/object/eid/1-s2.0-S0306261922010509-si173.svg?httpAccept=%2A%2F%2A",
            "@multimediatype": "Scalable Vector Graphics file",
            "@type": "ALTIMG",
            "@size": "23895",
            "@ref": "si173",
            "@mimetype": "image/svg+xml"
        },
        {
            "@category": "thumbnail",
            "@_fa": "true",
            "$": "https://api.elsevier.com/content/object/eid/1-s2.0-S0306261922010509-si174.svg?httpAccept=%2A%2F%2A",
            "@multimediatype": "Scalable Vector Graphics file",
            "@type": "ALTIMG",
            "@size": "1163",
            "@ref": "si174",
            "@mimetype": "image/svg+xml"
        },
        {
            "@category": "thumbnail",
            "@_fa": "true",
            "$": "https://api.elsevier.com/content/object/eid/1-s2.0-S0306261922010509-si175.svg?httpAccept=%2A%2F%2A",
            "@multimediatype": "Scalable Vector Graphics file",
            "@type": "ALTIMG",
            "@size": "15518",
            "@ref": "si175",
            "@mimetype": "image/svg+xml"
        },
        {
            "@category": "thumbnail",
            "@_fa": "true",
            "$": "https://api.elsevier.com/content/object/eid/1-s2.0-S0306261922010509-si178.svg?httpAccept=%2A%2F%2A",
            "@multimediatype": "Scalable Vector Graphics file",
            "@type": "ALTIMG",
            "@size": "2011",
            "@ref": "si178",
            "@mimetype": "image/svg+xml"
        },
        {
            "@category": "thumbnail",
            "@_fa": "true",
            "$": "https://api.elsevier.com/content/object/eid/1-s2.0-S0306261922010509-si180.svg?httpAccept=%2A%2F%2A",
            "@multimediatype": "Scalable Vector Graphics file",
            "@type": "ALTIMG",
            "@size": "12678",
            "@ref": "si180",
            "@mimetype": "image/svg+xml"
        },
        {
            "@category": "thumbnail",
            "@_fa": "true",
            "$": "https://api.elsevier.com/content/object/eid/1-s2.0-S0306261922010509-si181.svg?httpAccept=%2A%2F%2A",
            "@multimediatype": "Scalable Vector Graphics file",
            "@type": "ALTIMG",
            "@size": "8634",
            "@ref": "si181",
            "@mimetype": "image/svg+xml"
        },
        {
            "@category": "thumbnail",
            "@_fa": "true",
            "$": "https://api.elsevier.com/content/object/eid/1-s2.0-S0306261922010509-si183.svg?httpAccept=%2A%2F%2A",
            "@multimediatype": "Scalable Vector Graphics file",
            "@type": "ALTIMG",
            "@size": "9874",
            "@ref": "si183",
            "@mimetype": "image/svg+xml"
        },
        {
            "@category": "thumbnail",
            "@_fa": "true",
            "$": "https://api.elsevier.com/content/object/eid/1-s2.0-S0306261922010509-si184.svg?httpAccept=%2A%2F%2A",
            "@multimediatype": "Scalable Vector Graphics file",
            "@type": "ALTIMG",
            "@size": "9151",
            "@ref": "si184",
            "@mimetype": "image/svg+xml"
        },
        {
            "@category": "thumbnail",
            "@_fa": "true",
            "$": "https://api.elsevier.com/content/object/eid/1-s2.0-S0306261922010509-si185.svg?httpAccept=%2A%2F%2A",
            "@multimediatype": "Scalable Vector Graphics file",
            "@type": "ALTIMG",
            "@size": "9256",
            "@ref": "si185",
            "@mimetype": "image/svg+xml"
        },
        {
            "@category": "thumbnail",
            "@_fa": "true",
            "$": "https://api.elsevier.com/content/object/eid/1-s2.0-S0306261922010509-si186.svg?httpAccept=%2A%2F%2A",
            "@multimediatype": "Scalable Vector Graphics file",
            "@type": "ALTIMG",
            "@size": "7650",
            "@ref": "si186",
            "@mimetype": "image/svg+xml"
        },
        {
            "@category": "thumbnail",
            "@_fa": "true",
            "$": "https://api.elsevier.com/content/object/eid/1-s2.0-S0306261922010509-si187.svg?httpAccept=%2A%2F%2A",
            "@multimediatype": "Scalable Vector Graphics file",
            "@type": "ALTIMG",
            "@size": "3977",
            "@ref": "si187",
            "@mimetype": "image/svg+xml"
        },
        {
            "@category": "thumbnail",
            "@_fa": "true",
            "$": "https://api.elsevier.com/content/object/eid/1-s2.0-S0306261922010509-si189.svg?httpAccept=%2A%2F%2A",
            "@multimediatype": "Scalable Vector Graphics file",
            "@type": "ALTIMG",
            "@size": "28056",
            "@ref": "si189",
            "@mimetype": "image/svg+xml"
        },
        {
            "@category": "thumbnail",
            "@_fa": "true",
            "$": "https://api.elsevier.com/content/object/eid/1-s2.0-S0306261922010509-si191.svg?httpAccept=%2A%2F%2A",
            "@multimediatype": "Scalable Vector Graphics file",
            "@type": "ALTIMG",
            "@size": "11593",
            "@ref": "si191",
            "@mimetype": "image/svg+xml"
        },
        {
            "@category": "thumbnail",
            "@_fa": "true",
            "$": "https://api.elsevier.com/content/object/eid/1-s2.0-S0306261922010509-si192.svg?httpAccept=%2A%2F%2A",
            "@multimediatype": "Scalable Vector Graphics file",
            "@type": "ALTIMG",
            "@size": "10003",
            "@ref": "si192",
            "@mimetype": "image/svg+xml"
        },
        {
            "@category": "thumbnail",
            "@_fa": "true",
            "$": "https://api.elsevier.com/content/object/eid/1-s2.0-S0306261922010509-si193.svg?httpAccept=%2A%2F%2A",
            "@multimediatype": "Scalable Vector Graphics file",
            "@type": "ALTIMG",
            "@size": "6752",
            "@ref": "si193",
            "@mimetype": "image/svg+xml"
        },
        {
            "@category": "thumbnail",
            "@_fa": "true",
            "$": "https://api.elsevier.com/content/object/eid/1-s2.0-S0306261922010509-si194.svg?httpAccept=%2A%2F%2A",
            "@multimediatype": "Scalable Vector Graphics file",
            "@type": "ALTIMG",
            "@size": "7966",
            "@ref": "si194",
            "@mimetype": "image/svg+xml"
        },
        {
            "@category": "thumbnail",
            "@_fa": "true",
            "$": "https://api.elsevier.com/content/object/eid/1-s2.0-S0306261922010509-si195.svg?httpAccept=%2A%2F%2A",
            "@multimediatype": "Scalable Vector Graphics file",
            "@type": "ALTIMG",
            "@size": "2531",
            "@ref": "si195",
            "@mimetype": "image/svg+xml"
        },
        {
            "@category": "thumbnail",
            "@_fa": "true",
            "$": "https://api.elsevier.com/content/object/eid/1-s2.0-S0306261922010509-si197.svg?httpAccept=%2A%2F%2A",
            "@multimediatype": "Scalable Vector Graphics file",
            "@type": "ALTIMG",
            "@size": "12456",
            "@ref": "si197",
            "@mimetype": "image/svg+xml"
        },
        {
            "@category": "thumbnail",
            "@_fa": "true",
            "$": "https://api.elsevier.com/content/object/eid/1-s2.0-S0306261922010509-si198.svg?httpAccept=%2A%2F%2A",
            "@multimediatype": "Scalable Vector Graphics file",
            "@type": "ALTIMG",
            "@size": "13540",
            "@ref": "si198",
            "@mimetype": "image/svg+xml"
        },
        {
            "@category": "thumbnail",
            "@_fa": "true",
            "$": "https://api.elsevier.com/content/object/eid/1-s2.0-S0306261922010509-si199.svg?httpAccept=%2A%2F%2A",
            "@multimediatype": "Scalable Vector Graphics file",
            "@type": "ALTIMG",
            "@size": "11937",
            "@ref": "si199",
            "@mimetype": "image/svg+xml"
        },
        {
            "@category": "thumbnail",
            "@_fa": "true",
            "$": "https://api.elsevier.com/content/object/eid/1-s2.0-S0306261922010509-si2.svg?httpAccept=%2A%2F%2A",
            "@multimediatype": "Scalable Vector Graphics file",
            "@type": "ALTIMG",
            "@size": "1343",
            "@ref": "si2",
            "@mimetype": "image/svg+xml"
        },
        {
            "@category": "thumbnail",
            "@_fa": "true",
            "$": "https://api.elsevier.com/content/object/eid/1-s2.0-S0306261922010509-si20.svg?httpAccept=%2A%2F%2A",
            "@multimediatype": "Scalable Vector Graphics file",
            "@type": "ALTIMG",
            "@size": "2361",
            "@ref": "si20",
            "@mimetype": "image/svg+xml"
        },
        {
            "@category": "thumbnail",
            "@_fa": "true",
            "$": "https://api.elsevier.com/content/object/eid/1-s2.0-S0306261922010509-si201.svg?httpAccept=%2A%2F%2A",
            "@multimediatype": "Scalable Vector Graphics file",
            "@type": "ALTIMG",
            "@size": "4565",
            "@ref": "si201",
            "@mimetype": "image/svg+xml"
        },
        {
            "@category": "thumbnail",
            "@_fa": "true",
            "$": "https://api.elsevier.com/content/object/eid/1-s2.0-S0306261922010509-si202.svg?httpAccept=%2A%2F%2A",
            "@multimediatype": "Scalable Vector Graphics file",
            "@type": "ALTIMG",
            "@size": "6129",
            "@ref": "si202",
            "@mimetype": "image/svg+xml"
        },
        {
            "@category": "thumbnail",
            "@_fa": "true",
            "$": "https://api.elsevier.com/content/object/eid/1-s2.0-S0306261922010509-si203.svg?httpAccept=%2A%2F%2A",
            "@multimediatype": "Scalable Vector Graphics file",
            "@type": "ALTIMG",
            "@size": "4346",
            "@ref": "si203",
            "@mimetype": "image/svg+xml"
        },
        {
            "@category": "thumbnail",
            "@_fa": "true",
            "$": "https://api.elsevier.com/content/object/eid/1-s2.0-S0306261922010509-si204.svg?httpAccept=%2A%2F%2A",
            "@multimediatype": "Scalable Vector Graphics file",
            "@type": "ALTIMG",
            "@size": "6516",
            "@ref": "si204",
            "@mimetype": "image/svg+xml"
        },
        {
            "@category": "thumbnail",
            "@_fa": "true",
            "$": "https://api.elsevier.com/content/object/eid/1-s2.0-S0306261922010509-si206.svg?httpAccept=%2A%2F%2A",
            "@multimediatype": "Scalable Vector Graphics file",
            "@type": "ALTIMG",
            "@size": "14345",
            "@ref": "si206",
            "@mimetype": "image/svg+xml"
        },
        {
            "@category": "thumbnail",
            "@_fa": "true",
            "$": "https://api.elsevier.com/content/object/eid/1-s2.0-S0306261922010509-si207.svg?httpAccept=%2A%2F%2A",
            "@multimediatype": "Scalable Vector Graphics file",
            "@type": "ALTIMG",
            "@size": "5059",
            "@ref": "si207",
            "@mimetype": "image/svg+xml"
        },
        {
            "@category": "thumbnail",
            "@_fa": "true",
            "$": "https://api.elsevier.com/content/object/eid/1-s2.0-S0306261922010509-si211.svg?httpAccept=%2A%2F%2A",
            "@multimediatype": "Scalable Vector Graphics file",
            "@type": "ALTIMG",
            "@size": "3839",
            "@ref": "si211",
            "@mimetype": "image/svg+xml"
        },
        {
            "@category": "thumbnail",
            "@_fa": "true",
            "$": "https://api.elsevier.com/content/object/eid/1-s2.0-S0306261922010509-si212.svg?httpAccept=%2A%2F%2A",
            "@multimediatype": "Scalable Vector Graphics file",
            "@type": "ALTIMG",
            "@size": "4812",
            "@ref": "si212",
            "@mimetype": "image/svg+xml"
        },
        {
            "@category": "thumbnail",
            "@_fa": "true",
            "$": "https://api.elsevier.com/content/object/eid/1-s2.0-S0306261922010509-si213.svg?httpAccept=%2A%2F%2A",
            "@multimediatype": "Scalable Vector Graphics file",
            "@type": "ALTIMG",
            "@size": "4326",
            "@ref": "si213",
            "@mimetype": "image/svg+xml"
        },
        {
            "@category": "thumbnail",
            "@_fa": "true",
            "$": "https://api.elsevier.com/content/object/eid/1-s2.0-S0306261922010509-si215.svg?httpAccept=%2A%2F%2A",
            "@multimediatype": "Scalable Vector Graphics file",
            "@type": "ALTIMG",
            "@size": "3652",
            "@ref": "si215",
            "@mimetype": "image/svg+xml"
        },
        {
            "@category": "thumbnail",
            "@_fa": "true",
            "$": "https://api.elsevier.com/content/object/eid/1-s2.0-S0306261922010509-si219.svg?httpAccept=%2A%2F%2A",
            "@multimediatype": "Scalable Vector Graphics file",
            "@type": "ALTIMG",
            "@size": "1252",
            "@ref": "si219",
            "@mimetype": "image/svg+xml"
        },
        {
            "@category": "thumbnail",
            "@_fa": "true",
            "$": "https://api.elsevier.com/content/object/eid/1-s2.0-S0306261922010509-si22.svg?httpAccept=%2A%2F%2A",
            "@multimediatype": "Scalable Vector Graphics file",
            "@type": "ALTIMG",
            "@size": "2617",
            "@ref": "si22",
            "@mimetype": "image/svg+xml"
        },
        {
            "@category": "thumbnail",
            "@_fa": "true",
            "$": "https://api.elsevier.com/content/object/eid/1-s2.0-S0306261922010509-si220.svg?httpAccept=%2A%2F%2A",
            "@multimediatype": "Scalable Vector Graphics file",
            "@type": "ALTIMG",
            "@size": "15725",
            "@ref": "si220",
            "@mimetype": "image/svg+xml"
        },
        {
            "@category": "thumbnail",
            "@_fa": "true",
            "$": "https://api.elsevier.com/content/object/eid/1-s2.0-S0306261922010509-si224.svg?httpAccept=%2A%2F%2A",
            "@multimediatype": "Scalable Vector Graphics file",
            "@type": "ALTIMG",
            "@size": "13488",
            "@ref": "si224",
            "@mimetype": "image/svg+xml"
        },
        {
            "@category": "thumbnail",
            "@_fa": "true",
            "$": "https://api.elsevier.com/content/object/eid/1-s2.0-S0306261922010509-si225.svg?httpAccept=%2A%2F%2A",
            "@multimediatype": "Scalable Vector Graphics file",
            "@type": "ALTIMG",
            "@size": "14930",
            "@ref": "si225",
            "@mimetype": "image/svg+xml"
        },
        {
            "@category": "thumbnail",
            "@_fa": "true",
            "$": "https://api.elsevier.com/content/object/eid/1-s2.0-S0306261922010509-si226.svg?httpAccept=%2A%2F%2A",
            "@multimediatype": "Scalable Vector Graphics file",
            "@type": "ALTIMG",
            "@size": "12720",
            "@ref": "si226",
            "@mimetype": "image/svg+xml"
        },
        {
            "@category": "thumbnail",
            "@_fa": "true",
            "$": "https://api.elsevier.com/content/object/eid/1-s2.0-S0306261922010509-si227.svg?httpAccept=%2A%2F%2A",
            "@multimediatype": "Scalable Vector Graphics file",
            "@type": "ALTIMG",
            "@size": "2117",
            "@ref": "si227",
            "@mimetype": "image/svg+xml"
        },
        {
            "@category": "thumbnail",
            "@_fa": "true",
            "$": "https://api.elsevier.com/content/object/eid/1-s2.0-S0306261922010509-si228.svg?httpAccept=%2A%2F%2A",
            "@multimediatype": "Scalable Vector Graphics file",
            "@type": "ALTIMG",
            "@size": "13112",
            "@ref": "si228",
            "@mimetype": "image/svg+xml"
        },
        {
            "@category": "thumbnail",
            "@_fa": "true",
            "$": "https://api.elsevier.com/content/object/eid/1-s2.0-S0306261922010509-si230.svg?httpAccept=%2A%2F%2A",
            "@multimediatype": "Scalable Vector Graphics file",
            "@type": "ALTIMG",
            "@size": "8677",
            "@ref": "si230",
            "@mimetype": "image/svg+xml"
        },
        {
            "@category": "thumbnail",
            "@_fa": "true",
            "$": "https://api.elsevier.com/content/object/eid/1-s2.0-S0306261922010509-si231.svg?httpAccept=%2A%2F%2A",
            "@multimediatype": "Scalable Vector Graphics file",
            "@type": "ALTIMG",
            "@size": "5367",
            "@ref": "si231",
            "@mimetype": "image/svg+xml"
        },
        {
            "@category": "thumbnail",
            "@_fa": "true",
            "$": "https://api.elsevier.com/content/object/eid/1-s2.0-S0306261922010509-si232.svg?httpAccept=%2A%2F%2A",
            "@multimediatype": "Scalable Vector Graphics file",
            "@type": "ALTIMG",
            "@size": "23780",
            "@ref": "si232",
            "@mimetype": "image/svg+xml"
        },
        {
            "@category": "thumbnail",
            "@_fa": "true",
            "$": "https://api.elsevier.com/content/object/eid/1-s2.0-S0306261922010509-si235.svg?httpAccept=%2A%2F%2A",
            "@multimediatype": "Scalable Vector Graphics file",
            "@type": "ALTIMG",
            "@size": "4867",
            "@ref": "si235",
            "@mimetype": "image/svg+xml"
        },
        {
            "@category": "thumbnail",
            "@_fa": "true",
            "$": "https://api.elsevier.com/content/object/eid/1-s2.0-S0306261922010509-si236.svg?httpAccept=%2A%2F%2A",
            "@multimediatype": "Scalable Vector Graphics file",
            "@type": "ALTIMG",
            "@size": "4367",
            "@ref": "si236",
            "@mimetype": "image/svg+xml"
        },
        {
            "@category": "thumbnail",
            "@_fa": "true",
            "$": "https://api.elsevier.com/content/object/eid/1-s2.0-S0306261922010509-si237.svg?httpAccept=%2A%2F%2A",
            "@multimediatype": "Scalable Vector Graphics file",
            "@type": "ALTIMG",
            "@size": "26094",
            "@ref": "si237",
            "@mimetype": "image/svg+xml"
        },
        {
            "@category": "thumbnail",
            "@_fa": "true",
            "$": "https://api.elsevier.com/content/object/eid/1-s2.0-S0306261922010509-si24.svg?httpAccept=%2A%2F%2A",
            "@multimediatype": "Scalable Vector Graphics file",
            "@type": "ALTIMG",
            "@size": "2759",
            "@ref": "si24",
            "@mimetype": "image/svg+xml"
        },
        {
            "@category": "thumbnail",
            "@_fa": "true",
            "$": "https://api.elsevier.com/content/object/eid/1-s2.0-S0306261922010509-si242.svg?httpAccept=%2A%2F%2A",
            "@multimediatype": "Scalable Vector Graphics file",
            "@type": "ALTIMG",
            "@size": "22132",
            "@ref": "si242",
            "@mimetype": "image/svg+xml"
        },
        {
            "@category": "thumbnail",
            "@_fa": "true",
            "$": "https://api.elsevier.com/content/object/eid/1-s2.0-S0306261922010509-si243.svg?httpAccept=%2A%2F%2A",
            "@multimediatype": "Scalable Vector Graphics file",
            "@type": "ALTIMG",
            "@size": "18655",
            "@ref": "si243",
            "@mimetype": "image/svg+xml"
        },
        {
            "@category": "thumbnail",
            "@_fa": "true",
            "$": "https://api.elsevier.com/content/object/eid/1-s2.0-S0306261922010509-si246.svg?httpAccept=%2A%2F%2A",
            "@multimediatype": "Scalable Vector Graphics file",
            "@type": "ALTIMG",
            "@size": "12560",
            "@ref": "si246",
            "@mimetype": "image/svg+xml"
        },
        {
            "@category": "thumbnail",
            "@_fa": "true",
            "$": "https://api.elsevier.com/content/object/eid/1-s2.0-S0306261922010509-si247.svg?httpAccept=%2A%2F%2A",
            "@multimediatype": "Scalable Vector Graphics file",
            "@type": "ALTIMG",
            "@size": "16896",
            "@ref": "si247",
            "@mimetype": "image/svg+xml"
        },
        {
            "@category": "thumbnail",
            "@_fa": "true",
            "$": "https://api.elsevier.com/content/object/eid/1-s2.0-S0306261922010509-si248.svg?httpAccept=%2A%2F%2A",
            "@multimediatype": "Scalable Vector Graphics file",
            "@type": "ALTIMG",
            "@size": "6480",
            "@ref": "si248",
            "@mimetype": "image/svg+xml"
        },
        {
            "@category": "thumbnail",
            "@_fa": "true",
            "$": "https://api.elsevier.com/content/object/eid/1-s2.0-S0306261922010509-si249.svg?httpAccept=%2A%2F%2A",
            "@multimediatype": "Scalable Vector Graphics file",
            "@type": "ALTIMG",
            "@size": "9330",
            "@ref": "si249",
            "@mimetype": "image/svg+xml"
        },
        {
            "@category": "thumbnail",
            "@_fa": "true",
            "$": "https://api.elsevier.com/content/object/eid/1-s2.0-S0306261922010509-si250.svg?httpAccept=%2A%2F%2A",
            "@multimediatype": "Scalable Vector Graphics file",
            "@type": "ALTIMG",
            "@size": "9281",
            "@ref": "si250",
            "@mimetype": "image/svg+xml"
        },
        {
            "@category": "thumbnail",
            "@_fa": "true",
            "$": "https://api.elsevier.com/content/object/eid/1-s2.0-S0306261922010509-si251.svg?httpAccept=%2A%2F%2A",
            "@multimediatype": "Scalable Vector Graphics file",
            "@type": "ALTIMG",
            "@size": "7021",
            "@ref": "si251",
            "@mimetype": "image/svg+xml"
        },
        {
            "@category": "thumbnail",
            "@_fa": "true",
            "$": "https://api.elsevier.com/content/object/eid/1-s2.0-S0306261922010509-si252.svg?httpAccept=%2A%2F%2A",
            "@multimediatype": "Scalable Vector Graphics file",
            "@type": "ALTIMG",
            "@size": "19848",
            "@ref": "si252",
            "@mimetype": "image/svg+xml"
        },
        {
            "@category": "thumbnail",
            "@_fa": "true",
            "$": "https://api.elsevier.com/content/object/eid/1-s2.0-S0306261922010509-si254.svg?httpAccept=%2A%2F%2A",
            "@multimediatype": "Scalable Vector Graphics file",
            "@type": "ALTIMG",
            "@size": "1011",
            "@ref": "si254",
            "@mimetype": "image/svg+xml"
        },
        {
            "@category": "thumbnail",
            "@_fa": "true",
            "$": "https://api.elsevier.com/content/object/eid/1-s2.0-S0306261922010509-si255.svg?httpAccept=%2A%2F%2A",
            "@multimediatype": "Scalable Vector Graphics file",
            "@type": "ALTIMG",
            "@size": "1007",
            "@ref": "si255",
            "@mimetype": "image/svg+xml"
        },
        {
            "@category": "thumbnail",
            "@_fa": "true",
            "$": "https://api.elsevier.com/content/object/eid/1-s2.0-S0306261922010509-si257.svg?httpAccept=%2A%2F%2A",
            "@multimediatype": "Scalable Vector Graphics file",
            "@type": "ALTIMG",
            "@size": "1904",
            "@ref": "si257",
            "@mimetype": "image/svg+xml"
        },
        {
            "@category": "thumbnail",
            "@_fa": "true",
            "$": "https://api.elsevier.com/content/object/eid/1-s2.0-S0306261922010509-si259.svg?httpAccept=%2A%2F%2A",
            "@multimediatype": "Scalable Vector Graphics file",
            "@type": "ALTIMG",
            "@size": "17430",
            "@ref": "si259",
            "@mimetype": "image/svg+xml"
        },
        {
            "@category": "thumbnail",
            "@_fa": "true",
            "$": "https://api.elsevier.com/content/object/eid/1-s2.0-S0306261922010509-si26.svg?httpAccept=%2A%2F%2A",
            "@multimediatype": "Scalable Vector Graphics file",
            "@type": "ALTIMG",
            "@size": "3602",
            "@ref": "si26",
            "@mimetype": "image/svg+xml"
        },
        {
            "@category": "thumbnail",
            "@_fa": "true",
            "$": "https://api.elsevier.com/content/object/eid/1-s2.0-S0306261922010509-si263.svg?httpAccept=%2A%2F%2A",
            "@multimediatype": "Scalable Vector Graphics file",
            "@type": "ALTIMG",
            "@size": "5022",
            "@ref": "si263",
            "@mimetype": "image/svg+xml"
        },
        {
            "@category": "thumbnail",
            "@_fa": "true",
            "$": "https://api.elsevier.com/content/object/eid/1-s2.0-S0306261922010509-si265.svg?httpAccept=%2A%2F%2A",
            "@multimediatype": "Scalable Vector Graphics file",
            "@type": "ALTIMG",
            "@size": "19326",
            "@ref": "si265",
            "@mimetype": "image/svg+xml"
        },
        {
            "@category": "thumbnail",
            "@_fa": "true",
            "$": "https://api.elsevier.com/content/object/eid/1-s2.0-S0306261922010509-si266.svg?httpAccept=%2A%2F%2A",
            "@multimediatype": "Scalable Vector Graphics file",
            "@type": "ALTIMG",
            "@size": "19618",
            "@ref": "si266",
            "@mimetype": "image/svg+xml"
        },
        {
            "@category": "thumbnail",
            "@_fa": "true",
            "$": "https://api.elsevier.com/content/object/eid/1-s2.0-S0306261922010509-si267.svg?httpAccept=%2A%2F%2A",
            "@multimediatype": "Scalable Vector Graphics file",
            "@type": "ALTIMG",
            "@size": "21582",
            "@ref": "si267",
            "@mimetype": "image/svg+xml"
        },
        {
            "@category": "thumbnail",
            "@_fa": "true",
            "$": "https://api.elsevier.com/content/object/eid/1-s2.0-S0306261922010509-si268.svg?httpAccept=%2A%2F%2A",
            "@multimediatype": "Scalable Vector Graphics file",
            "@type": "ALTIMG",
            "@size": "6107",
            "@ref": "si268",
            "@mimetype": "image/svg+xml"
        },
        {
            "@category": "thumbnail",
            "@_fa": "true",
            "$": "https://api.elsevier.com/content/object/eid/1-s2.0-S0306261922010509-si269.svg?httpAccept=%2A%2F%2A",
            "@multimediatype": "Scalable Vector Graphics file",
            "@type": "ALTIMG",
            "@size": "5994",
            "@ref": "si269",
            "@mimetype": "image/svg+xml"
        },
        {
            "@category": "thumbnail",
            "@_fa": "true",
            "$": "https://api.elsevier.com/content/object/eid/1-s2.0-S0306261922010509-si271.svg?httpAccept=%2A%2F%2A",
            "@multimediatype": "Scalable Vector Graphics file",
            "@type": "ALTIMG",
            "@size": "12471",
            "@ref": "si271",
            "@mimetype": "image/svg+xml"
        },
        {
            "@category": "thumbnail",
            "@_fa": "true",
            "$": "https://api.elsevier.com/content/object/eid/1-s2.0-S0306261922010509-si276.svg?httpAccept=%2A%2F%2A",
            "@multimediatype": "Scalable Vector Graphics file",
            "@type": "ALTIMG",
            "@size": "3734",
            "@ref": "si276",
            "@mimetype": "image/svg+xml"
        },
        {
            "@category": "thumbnail",
            "@_fa": "true",
            "$": "https://api.elsevier.com/content/object/eid/1-s2.0-S0306261922010509-si278.svg?httpAccept=%2A%2F%2A",
            "@multimediatype": "Scalable Vector Graphics file",
            "@type": "ALTIMG",
            "@size": "19704",
            "@ref": "si278",
            "@mimetype": "image/svg+xml"
        },
        {
            "@category": "thumbnail",
            "@_fa": "true",
            "$": "https://api.elsevier.com/content/object/eid/1-s2.0-S0306261922010509-si279.svg?httpAccept=%2A%2F%2A",
            "@multimediatype": "Scalable Vector Graphics file",
            "@type": "ALTIMG",
            "@size": "23879",
            "@ref": "si279",
            "@mimetype": "image/svg+xml"
        },
        {
            "@category": "thumbnail",
            "@_fa": "true",
            "$": "https://api.elsevier.com/content/object/eid/1-s2.0-S0306261922010509-si280.svg?httpAccept=%2A%2F%2A",
            "@multimediatype": "Scalable Vector Graphics file",
            "@type": "ALTIMG",
            "@size": "8435",
            "@ref": "si280",
            "@mimetype": "image/svg+xml"
        },
        {
            "@category": "thumbnail",
            "@_fa": "true",
            "$": "https://api.elsevier.com/content/object/eid/1-s2.0-S0306261922010509-si283.svg?httpAccept=%2A%2F%2A",
            "@multimediatype": "Scalable Vector Graphics file",
            "@type": "ALTIMG",
            "@size": "6643",
            "@ref": "si283",
            "@mimetype": "image/svg+xml"
        },
        {
            "@category": "thumbnail",
            "@_fa": "true",
            "$": "https://api.elsevier.com/content/object/eid/1-s2.0-S0306261922010509-si284.svg?httpAccept=%2A%2F%2A",
            "@multimediatype": "Scalable Vector Graphics file",
            "@type": "ALTIMG",
            "@size": "2649",
            "@ref": "si284",
            "@mimetype": "image/svg+xml"
        },
        {
            "@category": "thumbnail",
            "@_fa": "true",
            "$": "https://api.elsevier.com/content/object/eid/1-s2.0-S0306261922010509-si285.svg?httpAccept=%2A%2F%2A",
            "@multimediatype": "Scalable Vector Graphics file",
            "@type": "ALTIMG",
            "@size": "18771",
            "@ref": "si285",
            "@mimetype": "image/svg+xml"
        },
        {
            "@category": "thumbnail",
            "@_fa": "true",
            "$": "https://api.elsevier.com/content/object/eid/1-s2.0-S0306261922010509-si287.svg?httpAccept=%2A%2F%2A",
            "@multimediatype": "Scalable Vector Graphics file",
            "@type": "ALTIMG",
            "@size": "17696",
            "@ref": "si287",
            "@mimetype": "image/svg+xml"
        },
        {
            "@category": "thumbnail",
            "@_fa": "true",
            "$": "https://api.elsevier.com/content/object/eid/1-s2.0-S0306261922010509-si288.svg?httpAccept=%2A%2F%2A",
            "@multimediatype": "Scalable Vector Graphics file",
            "@type": "ALTIMG",
            "@size": "8791",
            "@ref": "si288",
            "@mimetype": "image/svg+xml"
        },
        {
            "@category": "thumbnail",
            "@_fa": "true",
            "$": "https://api.elsevier.com/content/object/eid/1-s2.0-S0306261922010509-si289.svg?httpAccept=%2A%2F%2A",
            "@multimediatype": "Scalable Vector Graphics file",
            "@type": "ALTIMG",
            "@size": "6988",
            "@ref": "si289",
            "@mimetype": "image/svg+xml"
        },
        {
            "@category": "thumbnail",
            "@_fa": "true",
            "$": "https://api.elsevier.com/content/object/eid/1-s2.0-S0306261922010509-si29.svg?httpAccept=%2A%2F%2A",
            "@multimediatype": "Scalable Vector Graphics file",
            "@type": "ALTIMG",
            "@size": "2374",
            "@ref": "si29",
            "@mimetype": "image/svg+xml"
        },
        {
            "@category": "thumbnail",
            "@_fa": "true",
            "$": "https://api.elsevier.com/content/object/eid/1-s2.0-S0306261922010509-si290.svg?httpAccept=%2A%2F%2A",
            "@multimediatype": "Scalable Vector Graphics file",
            "@type": "ALTIMG",
            "@size": "3975",
            "@ref": "si290",
            "@mimetype": "image/svg+xml"
        },
        {
            "@category": "thumbnail",
            "@_fa": "true",
            "$": "https://api.elsevier.com/content/object/eid/1-s2.0-S0306261922010509-si294.svg?httpAccept=%2A%2F%2A",
            "@multimediatype": "Scalable Vector Graphics file",
            "@type": "ALTIMG",
            "@size": "3213",
            "@ref": "si294",
            "@mimetype": "image/svg+xml"
        },
        {
            "@category": "thumbnail",
            "@_fa": "true",
            "$": "https://api.elsevier.com/content/object/eid/1-s2.0-S0306261922010509-si295.svg?httpAccept=%2A%2F%2A",
            "@multimediatype": "Scalable Vector Graphics file",
            "@type": "ALTIMG",
            "@size": "2884",
            "@ref": "si295",
            "@mimetype": "image/svg+xml"
        },
        {
            "@category": "thumbnail",
            "@_fa": "true",
            "$": "https://api.elsevier.com/content/object/eid/1-s2.0-S0306261922010509-si296.svg?httpAccept=%2A%2F%2A",
            "@multimediatype": "Scalable Vector Graphics file",
            "@type": "ALTIMG",
            "@size": "6520",
            "@ref": "si296",
            "@mimetype": "image/svg+xml"
        },
        {
            "@category": "thumbnail",
            "@_fa": "true",
            "$": "https://api.elsevier.com/content/object/eid/1-s2.0-S0306261922010509-si297.svg?httpAccept=%2A%2F%2A",
            "@multimediatype": "Scalable Vector Graphics file",
            "@type": "ALTIMG",
            "@size": "5846",
            "@ref": "si297",
            "@mimetype": "image/svg+xml"
        },
        {
            "@category": "thumbnail",
            "@_fa": "true",
            "$": "https://api.elsevier.com/content/object/eid/1-s2.0-S0306261922010509-si298.svg?httpAccept=%2A%2F%2A",
            "@multimediatype": "Scalable Vector Graphics file",
            "@type": "ALTIMG",
            "@size": "5611",
            "@ref": "si298",
            "@mimetype": "image/svg+xml"
        },
        {
            "@category": "thumbnail",
            "@_fa": "true",
            "$": "https://api.elsevier.com/content/object/eid/1-s2.0-S0306261922010509-si299.svg?httpAccept=%2A%2F%2A",
            "@multimediatype": "Scalable Vector Graphics file",
            "@type": "ALTIMG",
            "@size": "5351",
            "@ref": "si299",
            "@mimetype": "image/svg+xml"
        },
        {
            "@category": "thumbnail",
            "@_fa": "true",
            "$": "https://api.elsevier.com/content/object/eid/1-s2.0-S0306261922010509-si3.svg?httpAccept=%2A%2F%2A",
            "@multimediatype": "Scalable Vector Graphics file",
            "@type": "ALTIMG",
            "@size": "2654",
            "@ref": "si3",
            "@mimetype": "image/svg+xml"
        },
        {
            "@category": "thumbnail",
            "@_fa": "true",
            "$": "https://api.elsevier.com/content/object/eid/1-s2.0-S0306261922010509-si30.svg?httpAccept=%2A%2F%2A",
            "@multimediatype": "Scalable Vector Graphics file",
            "@type": "ALTIMG",
            "@size": "1083",
            "@ref": "si30",
            "@mimetype": "image/svg+xml"
        },
        {
            "@category": "thumbnail",
            "@_fa": "true",
            "$": "https://api.elsevier.com/content/object/eid/1-s2.0-S0306261922010509-si300.svg?httpAccept=%2A%2F%2A",
            "@multimediatype": "Scalable Vector Graphics file",
            "@type": "ALTIMG",
            "@size": "2128",
            "@ref": "si300",
            "@mimetype": "image/svg+xml"
        },
        {
            "@category": "thumbnail",
            "@_fa": "true",
            "$": "https://api.elsevier.com/content/object/eid/1-s2.0-S0306261922010509-si301.svg?httpAccept=%2A%2F%2A",
            "@multimediatype": "Scalable Vector Graphics file",
            "@type": "ALTIMG",
            "@size": "7892",
            "@ref": "si301",
            "@mimetype": "image/svg+xml"
        },
        {
            "@category": "thumbnail",
            "@_fa": "true",
            "$": "https://api.elsevier.com/content/object/eid/1-s2.0-S0306261922010509-si302.svg?httpAccept=%2A%2F%2A",
            "@multimediatype": "Scalable Vector Graphics file",
            "@type": "ALTIMG",
            "@size": "3877",
            "@ref": "si302",
            "@mimetype": "image/svg+xml"
        },
        {
            "@category": "thumbnail",
            "@_fa": "true",
            "$": "https://api.elsevier.com/content/object/eid/1-s2.0-S0306261922010509-si304.svg?httpAccept=%2A%2F%2A",
            "@multimediatype": "Scalable Vector Graphics file",
            "@type": "ALTIMG",
            "@size": "4139",
            "@ref": "si304",
            "@mimetype": "image/svg+xml"
        },
        {
            "@category": "thumbnail",
            "@_fa": "true",
            "$": "https://api.elsevier.com/content/object/eid/1-s2.0-S0306261922010509-si305.svg?httpAccept=%2A%2F%2A",
            "@multimediatype": "Scalable Vector Graphics file",
            "@type": "ALTIMG",
            "@size": "3126",
            "@ref": "si305",
            "@mimetype": "image/svg+xml"
        },
        {
            "@category": "thumbnail",
            "@_fa": "true",
            "$": "https://api.elsevier.com/content/object/eid/1-s2.0-S0306261922010509-si306.svg?httpAccept=%2A%2F%2A",
            "@multimediatype": "Scalable Vector Graphics file",
            "@type": "ALTIMG",
            "@size": "6296",
            "@ref": "si306",
            "@mimetype": "image/svg+xml"
        },
        {
            "@category": "thumbnail",
            "@_fa": "true",
            "$": "https://api.elsevier.com/content/object/eid/1-s2.0-S0306261922010509-si307.svg?httpAccept=%2A%2F%2A",
            "@multimediatype": "Scalable Vector Graphics file",
            "@type": "ALTIMG",
            "@size": "5223",
            "@ref": "si307",
            "@mimetype": "image/svg+xml"
        },
        {
            "@category": "thumbnail",
            "@_fa": "true",
            "$": "https://api.elsevier.com/content/object/eid/1-s2.0-S0306261922010509-si308.svg?httpAccept=%2A%2F%2A",
            "@multimediatype": "Scalable Vector Graphics file",
            "@type": "ALTIMG",
            "@size": "3332",
            "@ref": "si308",
            "@mimetype": "image/svg+xml"
        },
        {
            "@category": "thumbnail",
            "@_fa": "true",
            "$": "https://api.elsevier.com/content/object/eid/1-s2.0-S0306261922010509-si309.svg?httpAccept=%2A%2F%2A",
            "@multimediatype": "Scalable Vector Graphics file",
            "@type": "ALTIMG",
            "@size": "3005",
            "@ref": "si309",
            "@mimetype": "image/svg+xml"
        },
        {
            "@category": "thumbnail",
            "@_fa": "true",
            "$": "https://api.elsevier.com/content/object/eid/1-s2.0-S0306261922010509-si31.svg?httpAccept=%2A%2F%2A",
            "@multimediatype": "Scalable Vector Graphics file",
            "@type": "ALTIMG",
            "@size": "2273",
            "@ref": "si31",
            "@mimetype": "image/svg+xml"
        },
        {
            "@category": "thumbnail",
            "@_fa": "true",
            "$": "https://api.elsevier.com/content/object/eid/1-s2.0-S0306261922010509-si310.svg?httpAccept=%2A%2F%2A",
            "@multimediatype": "Scalable Vector Graphics file",
            "@type": "ALTIMG",
            "@size": "4264",
            "@ref": "si310",
            "@mimetype": "image/svg+xml"
        },
        {
            "@category": "thumbnail",
            "@_fa": "true",
            "$": "https://api.elsevier.com/content/object/eid/1-s2.0-S0306261922010509-si311.svg?httpAccept=%2A%2F%2A",
            "@multimediatype": "Scalable Vector Graphics file",
            "@type": "ALTIMG",
            "@size": "2085",
            "@ref": "si311",
            "@mimetype": "image/svg+xml"
        },
        {
            "@category": "thumbnail",
            "@_fa": "true",
            "$": "https://api.elsevier.com/content/object/eid/1-s2.0-S0306261922010509-si312.svg?httpAccept=%2A%2F%2A",
            "@multimediatype": "Scalable Vector Graphics file",
            "@type": "ALTIMG",
            "@size": "3620",
            "@ref": "si312",
            "@mimetype": "image/svg+xml"
        },
        {
            "@category": "thumbnail",
            "@_fa": "true",
            "$": "https://api.elsevier.com/content/object/eid/1-s2.0-S0306261922010509-si313.svg?httpAccept=%2A%2F%2A",
            "@multimediatype": "Scalable Vector Graphics file",
            "@type": "ALTIMG",
            "@size": "5851",
            "@ref": "si313",
            "@mimetype": "image/svg+xml"
        },
        {
            "@category": "thumbnail",
            "@_fa": "true",
            "$": "https://api.elsevier.com/content/object/eid/1-s2.0-S0306261922010509-si314.svg?httpAccept=%2A%2F%2A",
            "@multimediatype": "Scalable Vector Graphics file",
            "@type": "ALTIMG",
            "@size": "3882",
            "@ref": "si314",
            "@mimetype": "image/svg+xml"
        },
        {
            "@category": "thumbnail",
            "@_fa": "true",
            "$": "https://api.elsevier.com/content/object/eid/1-s2.0-S0306261922010509-si318.svg?httpAccept=%2A%2F%2A",
            "@multimediatype": "Scalable Vector Graphics file",
            "@type": "ALTIMG",
            "@size": "3147",
            "@ref": "si318",
            "@mimetype": "image/svg+xml"
        },
        {
            "@category": "thumbnail",
            "@_fa": "true",
            "$": "https://api.elsevier.com/content/object/eid/1-s2.0-S0306261922010509-si34.svg?httpAccept=%2A%2F%2A",
            "@multimediatype": "Scalable Vector Graphics file",
            "@type": "ALTIMG",
            "@size": "4179",
            "@ref": "si34",
            "@mimetype": "image/svg+xml"
        },
        {
            "@category": "thumbnail",
            "@_fa": "true",
            "$": "https://api.elsevier.com/content/object/eid/1-s2.0-S0306261922010509-si36.svg?httpAccept=%2A%2F%2A",
            "@multimediatype": "Scalable Vector Graphics file",
            "@type": "ALTIMG",
            "@size": "2317",
            "@ref": "si36",
            "@mimetype": "image/svg+xml"
        },
        {
            "@category": "thumbnail",
            "@_fa": "true",
            "$": "https://api.elsevier.com/content/object/eid/1-s2.0-S0306261922010509-si38.svg?httpAccept=%2A%2F%2A",
            "@multimediatype": "Scalable Vector Graphics file",
            "@type": "ALTIMG",
            "@size": "4302",
            "@ref": "si38",
            "@mimetype": "image/svg+xml"
        },
        {
            "@category": "thumbnail",
            "@_fa": "true",
            "$": "https://api.elsevier.com/content/object/eid/1-s2.0-S0306261922010509-si39.svg?httpAccept=%2A%2F%2A",
            "@multimediatype": "Scalable Vector Graphics file",
            "@type": "ALTIMG",
            "@size": "2310",
            "@ref": "si39",
            "@mimetype": "image/svg+xml"
        },
        {
            "@category": "thumbnail",
            "@_fa": "true",
            "$": "https://api.elsevier.com/content/object/eid/1-s2.0-S0306261922010509-si4.svg?httpAccept=%2A%2F%2A",
            "@multimediatype": "Scalable Vector Graphics file",
            "@type": "ALTIMG",
            "@size": "7629",
            "@ref": "si4",
            "@mimetype": "image/svg+xml"
        },
        {
            "@category": "thumbnail",
            "@_fa": "true",
            "$": "https://api.elsevier.com/content/object/eid/1-s2.0-S0306261922010509-si41.svg?httpAccept=%2A%2F%2A",
            "@multimediatype": "Scalable Vector Graphics file",
            "@type": "ALTIMG",
            "@size": "4860",
            "@ref": "si41",
            "@mimetype": "image/svg+xml"
        },
        {
            "@category": "thumbnail",
            "@_fa": "true",
            "$": "https://api.elsevier.com/content/object/eid/1-s2.0-S0306261922010509-si42.svg?httpAccept=%2A%2F%2A",
            "@multimediatype": "Scalable Vector Graphics file",
            "@type": "ALTIMG",
            "@size": "4680",
            "@ref": "si42",
            "@mimetype": "image/svg+xml"
        },
        {
            "@category": "thumbnail",
            "@_fa": "true",
            "$": "https://api.elsevier.com/content/object/eid/1-s2.0-S0306261922010509-si44.svg?httpAccept=%2A%2F%2A",
            "@multimediatype": "Scalable Vector Graphics file",
            "@type": "ALTIMG",
            "@size": "6309",
            "@ref": "si44",
            "@mimetype": "image/svg+xml"
        },
        {
            "@category": "thumbnail",
            "@_fa": "true",
            "$": "https://api.elsevier.com/content/object/eid/1-s2.0-S0306261922010509-si45.svg?httpAccept=%2A%2F%2A",
            "@multimediatype": "Scalable Vector Graphics file",
            "@type": "ALTIMG",
            "@size": "6230",
            "@ref": "si45",
            "@mimetype": "image/svg+xml"
        },
        {
            "@category": "thumbnail",
            "@_fa": "true",
            "$": "https://api.elsevier.com/content/object/eid/1-s2.0-S0306261922010509-si46.svg?httpAccept=%2A%2F%2A",
            "@multimediatype": "Scalable Vector Graphics file",
            "@type": "ALTIMG",
            "@size": "5280",
            "@ref": "si46",
            "@mimetype": "image/svg+xml"
        },
        {
            "@category": "thumbnail",
            "@_fa": "true",
            "$": "https://api.elsevier.com/content/object/eid/1-s2.0-S0306261922010509-si47.svg?httpAccept=%2A%2F%2A",
            "@multimediatype": "Scalable Vector Graphics file",
            "@type": "ALTIMG",
            "@size": "4767",
            "@ref": "si47",
            "@mimetype": "image/svg+xml"
        },
        {
            "@category": "thumbnail",
            "@_fa": "true",
            "$": "https://api.elsevier.com/content/object/eid/1-s2.0-S0306261922010509-si48.svg?httpAccept=%2A%2F%2A",
            "@multimediatype": "Scalable Vector Graphics file",
            "@type": "ALTIMG",
            "@size": "2149",
            "@ref": "si48",
            "@mimetype": "image/svg+xml"
        },
        {
            "@category": "thumbnail",
            "@_fa": "true",
            "$": "https://api.elsevier.com/content/object/eid/1-s2.0-S0306261922010509-si5.svg?httpAccept=%2A%2F%2A",
            "@multimediatype": "Scalable Vector Graphics file",
            "@type": "ALTIMG",
            "@size": "1511",
            "@ref": "si5",
            "@mimetype": "image/svg+xml"
        },
        {
            "@category": "thumbnail",
            "@_fa": "true",
            "$": "https://api.elsevier.com/content/object/eid/1-s2.0-S0306261922010509-si50.svg?httpAccept=%2A%2F%2A",
            "@multimediatype": "Scalable Vector Graphics file",
            "@type": "ALTIMG",
            "@size": "5646",
            "@ref": "si50",
            "@mimetype": "image/svg+xml"
        },
        {
            "@category": "thumbnail",
            "@_fa": "true",
            "$": "https://api.elsevier.com/content/object/eid/1-s2.0-S0306261922010509-si51.svg?httpAccept=%2A%2F%2A",
            "@multimediatype": "Scalable Vector Graphics file",
            "@type": "ALTIMG",
            "@size": "4298",
            "@ref": "si51",
            "@mimetype": "image/svg+xml"
        },
        {
            "@category": "thumbnail",
            "@_fa": "true",
            "$": "https://api.elsevier.com/content/object/eid/1-s2.0-S0306261922010509-si52.svg?httpAccept=%2A%2F%2A",
            "@multimediatype": "Scalable Vector Graphics file",
            "@type": "ALTIMG",
            "@size": "2700",
            "@ref": "si52",
            "@mimetype": "image/svg+xml"
        },
        {
            "@category": "thumbnail",
            "@_fa": "true",
            "$": "https://api.elsevier.com/content/object/eid/1-s2.0-S0306261922010509-si53.svg?httpAccept=%2A%2F%2A",
            "@multimediatype": "Scalable Vector Graphics file",
            "@type": "ALTIMG",
            "@size": "7902",
            "@ref": "si53",
            "@mimetype": "image/svg+xml"
        },
        {
            "@category": "thumbnail",
            "@_fa": "true",
            "$": "https://api.elsevier.com/content/object/eid/1-s2.0-S0306261922010509-si54.svg?httpAccept=%2A%2F%2A",
            "@multimediatype": "Scalable Vector Graphics file",
            "@type": "ALTIMG",
            "@size": "1626",
            "@ref": "si54",
            "@mimetype": "image/svg+xml"
        },
        {
            "@category": "thumbnail",
            "@_fa": "true",
            "$": "https://api.elsevier.com/content/object/eid/1-s2.0-S0306261922010509-si55.svg?httpAccept=%2A%2F%2A",
            "@multimediatype": "Scalable Vector Graphics file",
            "@type": "ALTIMG",
            "@size": "1958",
            "@ref": "si55",
            "@mimetype": "image/svg+xml"
        },
        {
            "@category": "thumbnail",
            "@_fa": "true",
            "$": "https://api.elsevier.com/content/object/eid/1-s2.0-S0306261922010509-si56.svg?httpAccept=%2A%2F%2A",
            "@multimediatype": "Scalable Vector Graphics file",
            "@type": "ALTIMG",
            "@size": "2256",
            "@ref": "si56",
            "@mimetype": "image/svg+xml"
        },
        {
            "@category": "thumbnail",
            "@_fa": "true",
            "$": "https://api.elsevier.com/content/object/eid/1-s2.0-S0306261922010509-si57.svg?httpAccept=%2A%2F%2A",
            "@multimediatype": "Scalable Vector Graphics file",
            "@type": "ALTIMG",
            "@size": "2286",
            "@ref": "si57",
            "@mimetype": "image/svg+xml"
        },
        {
            "@category": "thumbnail",
            "@_fa": "true",
            "$": "https://api.elsevier.com/content/object/eid/1-s2.0-S0306261922010509-si59.svg?httpAccept=%2A%2F%2A",
            "@multimediatype": "Scalable Vector Graphics file",
            "@type": "ALTIMG",
            "@size": "2565",
            "@ref": "si59",
            "@mimetype": "image/svg+xml"
        },
        {
            "@category": "thumbnail",
            "@_fa": "true",
            "$": "https://api.elsevier.com/content/object/eid/1-s2.0-S0306261922010509-si6.svg?httpAccept=%2A%2F%2A",
            "@multimediatype": "Scalable Vector Graphics file",
            "@type": "ALTIMG",
            "@size": "1286",
            "@ref": "si6",
            "@mimetype": "image/svg+xml"
        },
        {
            "@category": "thumbnail",
            "@_fa": "true",
            "$": "https://api.elsevier.com/content/object/eid/1-s2.0-S0306261922010509-si61.svg?httpAccept=%2A%2F%2A",
            "@multimediatype": "Scalable Vector Graphics file",
            "@type": "ALTIMG",
            "@size": "2308",
            "@ref": "si61",
            "@mimetype": "image/svg+xml"
        },
        {
            "@category": "thumbnail",
            "@_fa": "true",
            "$": "https://api.elsevier.com/content/object/eid/1-s2.0-S0306261922010509-si63.svg?httpAccept=%2A%2F%2A",
            "@multimediatype": "Scalable Vector Graphics file",
            "@type": "ALTIMG",
            "@size": "2536",
            "@ref": "si63",
            "@mimetype": "image/svg+xml"
        },
        {
            "@category": "thumbnail",
            "@_fa": "true",
            "$": "https://api.elsevier.com/content/object/eid/1-s2.0-S0306261922010509-si65.svg?httpAccept=%2A%2F%2A",
            "@multimediatype": "Scalable Vector Graphics file",
            "@type": "ALTIMG",
            "@size": "1624",
            "@ref": "si65",
            "@mimetype": "image/svg+xml"
        },
        {
            "@category": "thumbnail",
            "@_fa": "true",
            "$": "https://api.elsevier.com/content/object/eid/1-s2.0-S0306261922010509-si66.svg?httpAccept=%2A%2F%2A",
            "@multimediatype": "Scalable Vector Graphics file",
            "@type": "ALTIMG",
            "@size": "2721",
            "@ref": "si66",
            "@mimetype": "image/svg+xml"
        },
        {
            "@category": "thumbnail",
            "@_fa": "true",
            "$": "https://api.elsevier.com/content/object/eid/1-s2.0-S0306261922010509-si7.svg?httpAccept=%2A%2F%2A",
            "@multimediatype": "Scalable Vector Graphics file",
            "@type": "ALTIMG",
            "@size": "4646",
            "@ref": "si7",
            "@mimetype": "image/svg+xml"
        },
        {
            "@category": "thumbnail",
            "@_fa": "true",
            "$": "https://api.elsevier.com/content/object/eid/1-s2.0-S0306261922010509-si70.svg?httpAccept=%2A%2F%2A",
            "@multimediatype": "Scalable Vector Graphics file",
            "@type": "ALTIMG",
            "@size": "2395",
            "@ref": "si70",
            "@mimetype": "image/svg+xml"
        },
        {
            "@category": "thumbnail",
            "@_fa": "true",
            "$": "https://api.elsevier.com/content/object/eid/1-s2.0-S0306261922010509-si72.svg?httpAccept=%2A%2F%2A",
            "@multimediatype": "Scalable Vector Graphics file",
            "@type": "ALTIMG",
            "@size": "2358",
            "@ref": "si72",
            "@mimetype": "image/svg+xml"
        },
        {
            "@category": "thumbnail",
            "@_fa": "true",
            "$": "https://api.elsevier.com/content/object/eid/1-s2.0-S0306261922010509-si74.svg?httpAccept=%2A%2F%2A",
            "@multimediatype": "Scalable Vector Graphics file",
            "@type": "ALTIMG",
            "@size": "4133",
            "@ref": "si74",
            "@mimetype": "image/svg+xml"
        },
        {
            "@category": "thumbnail",
            "@_fa": "true",
            "$": "https://api.elsevier.com/content/object/eid/1-s2.0-S0306261922010509-si76.svg?httpAccept=%2A%2F%2A",
            "@multimediatype": "Scalable Vector Graphics file",
            "@type": "ALTIMG",
            "@size": "6197",
            "@ref": "si76",
            "@mimetype": "image/svg+xml"
        },
        {
            "@category": "thumbnail",
            "@_fa": "true",
            "$": "https://api.elsevier.com/content/object/eid/1-s2.0-S0306261922010509-si77.svg?httpAccept=%2A%2F%2A",
            "@multimediatype": "Scalable Vector Graphics file",
            "@type": "ALTIMG",
            "@size": "2300",
            "@ref": "si77",
            "@mimetype": "image/svg+xml"
        },
        {
            "@category": "thumbnail",
            "@_fa": "true",
            "$": "https://api.elsevier.com/content/object/eid/1-s2.0-S0306261922010509-si79.svg?httpAccept=%2A%2F%2A",
            "@multimediatype": "Scalable Vector Graphics file",
            "@type": "ALTIMG",
            "@size": "2768",
            "@ref": "si79",
            "@mimetype": "image/svg+xml"
        },
        {
            "@category": "thumbnail",
            "@_fa": "true",
            "$": "https://api.elsevier.com/content/object/eid/1-s2.0-S0306261922010509-si8.svg?httpAccept=%2A%2F%2A",
            "@multimediatype": "Scalable Vector Graphics file",
            "@type": "ALTIMG",
            "@size": "7245",
            "@ref": "si8",
            "@mimetype": "image/svg+xml"
        },
        {
            "@category": "thumbnail",
            "@_fa": "true",
            "$": "https://api.elsevier.com/content/object/eid/1-s2.0-S0306261922010509-si81.svg?httpAccept=%2A%2F%2A",
            "@multimediatype": "Scalable Vector Graphics file",
            "@type": "ALTIMG",
            "@size": "2430",
            "@ref": "si81",
            "@mimetype": "image/svg+xml"
        },
        {
            "@category": "thumbnail",
            "@_fa": "true",
            "$": "https://api.elsevier.com/content/object/eid/1-s2.0-S0306261922010509-si82.svg?httpAccept=%2A%2F%2A",
            "@multimediatype": "Scalable Vector Graphics file",
            "@type": "ALTIMG",
            "@size": "1553",
            "@ref": "si82",
            "@mimetype": "image/svg+xml"
        },
        {
            "@category": "thumbnail",
            "@_fa": "true",
            "$": "https://api.elsevier.com/content/object/eid/1-s2.0-S0306261922010509-si83.svg?httpAccept=%2A%2F%2A",
            "@multimediatype": "Scalable Vector Graphics file",
            "@type": "ALTIMG",
            "@size": "1069",
            "@ref": "si83",
            "@mimetype": "image/svg+xml"
        },
        {
            "@category": "thumbnail",
            "@_fa": "true",
            "$": "https://api.elsevier.com/content/object/eid/1-s2.0-S0306261922010509-si84.svg?httpAccept=%2A%2F%2A",
            "@multimediatype": "Scalable Vector Graphics file",
            "@type": "ALTIMG",
            "@size": "2305",
            "@ref": "si84",
            "@mimetype": "image/svg+xml"
        },
        {
            "@category": "thumbnail",
            "@_fa": "true",
            "$": "https://api.elsevier.com/content/object/eid/1-s2.0-S0306261922010509-si86.svg?httpAccept=%2A%2F%2A",
            "@multimediatype": "Scalable Vector Graphics file",
            "@type": "ALTIMG",
            "@size": "1348",
            "@ref": "si86",
            "@mimetype": "image/svg+xml"
        },
        {
            "@category": "thumbnail",
            "@_fa": "true",
            "$": "https://api.elsevier.com/content/object/eid/1-s2.0-S0306261922010509-si88.svg?httpAccept=%2A%2F%2A",
            "@multimediatype": "Scalable Vector Graphics file",
            "@type": "ALTIMG",
            "@size": "2095",
            "@ref": "si88",
            "@mimetype": "image/svg+xml"
        },
        {
            "@category": "thumbnail",
            "@_fa": "true",
            "$": "https://api.elsevier.com/content/object/eid/1-s2.0-S0306261922010509-si89.svg?httpAccept=%2A%2F%2A",
            "@multimediatype": "Scalable Vector Graphics file",
            "@type": "ALTIMG",
            "@size": "2882",
            "@ref": "si89",
            "@mimetype": "image/svg+xml"
        },
        {
            "@category": "thumbnail",
            "@_fa": "true",
            "$": "https://api.elsevier.com/content/object/eid/1-s2.0-S0306261922010509-si91.svg?httpAccept=%2A%2F%2A",
            "@multimediatype": "Scalable Vector Graphics file",
            "@type": "ALTIMG",
            "@size": "13264",
            "@ref": "si91",
            "@mimetype": "image/svg+xml"
        },
        {
            "@category": "thumbnail",
            "@_fa": "true",
            "$": "https://api.elsevier.com/content/object/eid/1-s2.0-S0306261922010509-si92.svg?httpAccept=%2A%2F%2A",
            "@multimediatype": "Scalable Vector Graphics file",
            "@type": "ALTIMG",
            "@size": "7363",
            "@ref": "si92",
            "@mimetype": "image/svg+xml"
        },
        {
            "@category": "thumbnail",
            "@_fa": "true",
            "$": "https://api.elsevier.com/content/object/eid/1-s2.0-S0306261922010509-si93.svg?httpAccept=%2A%2F%2A",
            "@multimediatype": "Scalable Vector Graphics file",
            "@type": "ALTIMG",
            "@size": "2494",
            "@ref": "si93",
            "@mimetype": "image/svg+xml"
        },
        {
            "@category": "thumbnail",
            "@_fa": "true",
            "$": "https://api.elsevier.com/content/object/eid/1-s2.0-S0306261922010509-si94.svg?httpAccept=%2A%2F%2A",
            "@multimediatype": "Scalable Vector Graphics file",
            "@type": "ALTIMG",
            "@size": "2485",
            "@ref": "si94",
            "@mimetype": "image/svg+xml"
        },
        {
            "@category": "thumbnail",
            "@_fa": "true",
            "$": "https://api.elsevier.com/content/object/eid/1-s2.0-S0306261922010509-si95.svg?httpAccept=%2A%2F%2A",
            "@multimediatype": "Scalable Vector Graphics file",
            "@type": "ALTIMG",
            "@size": "2126",
            "@ref": "si95",
            "@mimetype": "image/svg+xml"
        },
        {
            "@category": "thumbnail",
            "@_fa": "true",
            "$": "https://api.elsevier.com/content/object/eid/1-s2.0-S0306261922010509-si96.svg?httpAccept=%2A%2F%2A",
            "@multimediatype": "Scalable Vector Graphics file",
            "@type": "ALTIMG",
            "@size": "2195",
            "@ref": "si96",
            "@mimetype": "image/svg+xml"
        },
        {
            "@category": "thumbnail",
            "@_fa": "true",
            "$": "https://api.elsevier.com/content/object/eid/1-s2.0-S0306261922010509-si97.svg?httpAccept=%2A%2F%2A",
            "@multimediatype": "Scalable Vector Graphics file",
            "@type": "ALTIMG",
            "@size": "2026",
            "@ref": "si97",
            "@mimetype": "image/svg+xml"
        },
        {
            "@category": "thumbnail",
            "@_fa": "true",
            "$": "https://api.elsevier.com/content/object/eid/1-s2.0-S0306261922010509-si98.svg?httpAccept=%2A%2F%2A",
            "@multimediatype": "Scalable Vector Graphics file",
            "@type": "ALTIMG",
            "@size": "2440",
            "@ref": "si98",
            "@mimetype": "image/svg+xml"
        },
        {
            "@category": "thumbnail",
            "@_fa": "true",
            "$": "https://api.elsevier.com/content/object/eid/1-s2.0-S0306261922010509-si99.svg?httpAccept=%2A%2F%2A",
            "@multimediatype": "Scalable Vector Graphics file",
            "@type": "ALTIMG",
            "@size": "2316",
            "@ref": "si99",
            "@mimetype": "image/svg+xml"
        },
        {
            "@category": "standard",
            "@_fa": "true",
            "$": "https://api.elsevier.com/content/object/eid/1-s2.0-S0306261922010509-am.pdf?httpAccept=%2A%2F%2A",
            "@multimediatype": "Acrobat PDF file",
            "@type": "AAM-PDF",
            "@size": "1331259",
            "@ref": "am",
            "@mimetype": "application/pdf"
        }
    ]},
    "link": {
        "@rel": "abstract",
        "@href": "https://api.elsevier.com/content/abstract/scopus_id/85135981736"
    }
}}