{"full-text-retrieval-response": {
    "scopus-eid": "2-s2.0-85131653322",
    "originalText": "serial JL 271429 291210 291702 291731 291787 291877 291878 291881 31 90 Applied Energy APPLIEDENERGY 2022-06-01 2022-06-01 2022-06-01 2022-06-01 2022-10-12T10:06:32 1-s2.0-S0306261922005189 S0306-2619(22)00518-9 S0306261922005189 10.1016/j.apenergy.2022.119142 S300 S300.2 FULL-TEXT 1-s2.0-S0306261922X00123 2024-01-01T13:30:21.133674Z 0 0 20220815 2022 2022-06-01T10:08:03.15818Z articleinfo articlenumber articletitlenorm authfirstinitialnorm authfirstsurnamenorm cid cids contenttype copyright crossmark dateloaded dateloadedtxt datesearch datesort dateupdated dco docsubtype doctype doi eid ewtransactionid fundingbodyid hubeid indexeddate issn issnnorm itemstage itemtransactionid itemweight oauserlicense openaccess openarchive pg pgfirst pii piinorm pubdatestart pubdatetxt pubyr sectiontitle sortorder sponsoredaccesstype srctitle srctitlenorm srctype ssids alllist content oa subj subheadings suppl tomb volfirst volissue volumelist webpdf webpdfpagecount yearnav figure table body mmlmath acknowledge affil articletitle auth authfirstini authfull authkeywords authlast highlightsabst primabst ref 0306-2619 03062619 UNLIMITED FCTHYB22 true 320 320 C Volume 320 14 119142 119142 119142 20220815 15 August 2022 2022-08-15 2022 Research Papers article fla © 2022 The Authors. Published by Elsevier Ltd. ACOMPREHENSIVEMODULARSETAPPLIANCEOPERATIONMILPMODELSFORDEMANDRESPONSEOPTIMIZATION HENGGELERANTUNES C 1 Introduction 2 Materials and methods 3 Models for demand response optimization 3.1 Models for shiftable load operation 3.2 Model for electric water heater 3.3 Model for air conditioner 3.4 Model for static and electric vehicle battery 4 Overall model and case study 5 Conclusions CRediT authorship contribution statement Acknowledgments References SIANO 2014 461 478 P VARDAKAS 2015 152 178 J JORDEHI 2019 308 319 A BEAUDIN 2015 318 335 M HUSSAIN 2018 55 63 M MORALESESPANA 2022 122544 G ALTHAHER 2015 1874 1883 S MERDANOGLU 2020 106229 H SALGADO 2021 116985 M NAN 2018 1280 1289 S ADHIKARI 2018 166 177 R SHAFIEKHAH 2018 629 638 M ELKAZAZ 2020 115118 M JAVADI 2021 102792 M ZHANG 2021 117131 X MOHSENI 2017 315 328 A SOARES 2017 492 501 A DENG 2015 570 582 R NIROMANDFAM 2020 119317 A FENG 2020 2043 2054 C SOARES 2014 490 503 A HENGGELERANTUNES 2020 814 842 C ALVES 2016 459 474 M INAPPLICATIONSEVOLUTIONARYCOMPUTATION19THEUROPEANCONFERENCEEVOAPPLICATIONSLECTURENOTESINCOMPUTERSCIENCE9597 AHYBRIDGENETICALGORITHMFORINTERACTIONELECTRICITYRETAILERSDEMANDRESPONSE SOARES 2020 102027 I ANTUNES 2020 105 121 C ADVANCESINENERGYSYSTEMOPTIMIZATIONTRENDSINMATHEMATICS ADISCUSSIONMIXEDINTEGERLINEARPROGRAMMINGMODELSTHERMOSTATICLOADSINDEMANDRESPONSE TEJEROGOMEZ 2021 111012 J HENGGELERANTUNESX2022X119142 HENGGELERANTUNESX2022X119142XC Full 2022-10-11T21:59:44Z FundingBody Portugal institutions 2022: Hybrid journals http://creativecommons.org/licenses/by-nc-nd/4.0/ 2024-06-01T00:00:00.000Z 2024-06-01T00:00:00.000Z http://creativecommons.org/licenses/by-nc-nd/4.0/ This is an open access article under the CC BY-NC-ND license. © 2022 The Authors. Published by Elsevier Ltd. 2022-10-11T21:57:31.714Z http://vtw.elsevier.com/data/voc/AddOnTypes/50.7/aggregated-refined 0 item S0306-2619(22)00518-9 S0306261922005189 1-s2.0-S0306261922005189 10.1016/j.apenergy.2022.119142 271429 2024-01-01T13:30:21.133674Z 2022-08-15 UNLIMITED FCTHYB22 1-s2.0-S0306261922005189-main.pdf https://s3-eu-west-1.amazonaws.com/prod-ucs-content-store-eu-west/content/pii:S0306261922005189/MAIN/application/pdf/38585039ad169c9b8433def3a14edf42/main.pdf main.pdf pdf true 2489623 MAIN 12 1-s2.0-S0306261922005189-main_1.png https://s3-eu-west-1.amazonaws.com/prod-ucs-content-store-eu-west/content/pii:S0306261922005189/PREVIEW/image/png/06c836a24c45d0497dc652a5bc5e0b98/main_1.png main_1.png png 47082 849 656 IMAGE-WEB-PDF 1 1-s2.0-S0306261922005189-gr1.jpg https://s3-eu-west-1.amazonaws.com/prod-ucs-content-store-eu-west/content/pii:S0306261922005189/gr1/DOWNSAMPLED/image/jpeg/454933e8262099bd3aac3c64f3a023dd/gr1.jpg gr1 gr1.jpg jpg 20757 223 622 IMAGE-DOWNSAMPLED 1-s2.0-S0306261922005189-gr2.jpg https://s3-eu-west-1.amazonaws.com/prod-ucs-content-store-eu-west/content/pii:S0306261922005189/gr2/DOWNSAMPLED/image/jpeg/dfaab6f9293502dcaa367e8fe491b957/gr2.jpg gr2 gr2.jpg jpg 4943 74 372 IMAGE-DOWNSAMPLED 1-s2.0-S0306261922005189-gr3.jpg https://s3-eu-west-1.amazonaws.com/prod-ucs-content-store-eu-west/content/pii:S0306261922005189/gr3/DOWNSAMPLED/image/jpeg/027708eac33d743a288083a568994d68/gr3.jpg gr3 gr3.jpg jpg 6226 81 370 IMAGE-DOWNSAMPLED 1-s2.0-S0306261922005189-gr4.jpg https://s3-eu-west-1.amazonaws.com/prod-ucs-content-store-eu-west/content/pii:S0306261922005189/gr4/DOWNSAMPLED/image/jpeg/e7b12c02e8e6bb4aeda48ffd34f886d7/gr4.jpg gr4 gr4.jpg jpg 58995 345 756 IMAGE-DOWNSAMPLED 1-s2.0-S0306261922005189-gr5.jpg https://s3-eu-west-1.amazonaws.com/prod-ucs-content-store-eu-west/content/pii:S0306261922005189/gr5/DOWNSAMPLED/image/jpeg/6c0dd2ed55b0fe2f5abc366c0a5dba51/gr5.jpg gr5 gr5.jpg jpg 40612 337 723 IMAGE-DOWNSAMPLED 1-s2.0-S0306261922005189-gr6.jpg https://s3-eu-west-1.amazonaws.com/prod-ucs-content-store-eu-west/content/pii:S0306261922005189/gr6/DOWNSAMPLED/image/jpeg/9b1baeb05e3fc2de92300ffd4b40686b/gr6.jpg gr6 gr6.jpg jpg 43812 352 728 IMAGE-DOWNSAMPLED 1-s2.0-S0306261922005189-gr1.sml https://s3-eu-west-1.amazonaws.com/prod-ucs-content-store-eu-west/content/pii:S0306261922005189/gr1/THUMBNAIL/image/gif/1e513174b06f2ac12ff49feea771d206/gr1.sml gr1 gr1.sml sml 4850 79 219 IMAGE-THUMBNAIL 1-s2.0-S0306261922005189-gr2.sml https://s3-eu-west-1.amazonaws.com/prod-ucs-content-store-eu-west/content/pii:S0306261922005189/gr2/THUMBNAIL/image/gif/db87e6bafe78f0983493d13c1ce8d8fc/gr2.sml gr2 gr2.sml sml 2123 44 219 IMAGE-THUMBNAIL 1-s2.0-S0306261922005189-gr3.sml https://s3-eu-west-1.amazonaws.com/prod-ucs-content-store-eu-west/content/pii:S0306261922005189/gr3/THUMBNAIL/image/gif/1714fb2933bc43dc74a88c24da138e92/gr3.sml gr3 gr3.sml sml 2399 48 219 IMAGE-THUMBNAIL 1-s2.0-S0306261922005189-gr4.sml https://s3-eu-west-1.amazonaws.com/prod-ucs-content-store-eu-west/content/pii:S0306261922005189/gr4/THUMBNAIL/image/gif/80276f04bcfee47f76fd06169e3daa26/gr4.sml gr4 gr4.sml sml 8081 100 219 IMAGE-THUMBNAIL 1-s2.0-S0306261922005189-gr5.sml https://s3-eu-west-1.amazonaws.com/prod-ucs-content-store-eu-west/content/pii:S0306261922005189/gr5/THUMBNAIL/image/gif/5a6adae49840682f815c9182ab868aee/gr5.sml gr5 gr5.sml sml 3955 102 219 IMAGE-THUMBNAIL 1-s2.0-S0306261922005189-gr6.sml https://s3-eu-west-1.amazonaws.com/prod-ucs-content-store-eu-west/content/pii:S0306261922005189/gr6/THUMBNAIL/image/gif/3c09d2719d1fbaf571b3b4aa711c4094/gr6.sml gr6 gr6.sml sml 5205 106 219 IMAGE-THUMBNAIL 1-s2.0-S0306261922005189-gr1_lrg.jpg https://s3-eu-west-1.amazonaws.com/prod-ucs-content-store-eu-west/content/pii:S0306261922005189/HIGHRES/image/jpeg/f8b82d2f5fdf2043bd4beb537d84f67a/gr1_lrg.jpg gr1 gr1_lrg.jpg jpg 106682 988 2756 IMAGE-HIGH-RES 1-s2.0-S0306261922005189-gr2_lrg.jpg https://s3-eu-west-1.amazonaws.com/prod-ucs-content-store-eu-west/content/pii:S0306261922005189/HIGHRES/image/jpeg/b24531adb4f3a72f98cbacb810e64966/gr2_lrg.jpg gr2 gr2_lrg.jpg jpg 29885 328 1648 IMAGE-HIGH-RES 1-s2.0-S0306261922005189-gr3_lrg.jpg https://s3-eu-west-1.amazonaws.com/prod-ucs-content-store-eu-west/content/pii:S0306261922005189/HIGHRES/image/jpeg/16d234463157f921d4093ff4f10485dc/gr3_lrg.jpg gr3 gr3_lrg.jpg jpg 39904 360 1640 IMAGE-HIGH-RES 1-s2.0-S0306261922005189-gr4_lrg.jpg https://s3-eu-west-1.amazonaws.com/prod-ucs-content-store-eu-west/content/pii:S0306261922005189/HIGHRES/image/jpeg/5bd9bc1d15eca3a8db17134dcd36aba3/gr4_lrg.jpg gr4 gr4_lrg.jpg jpg 338646 1526 3346 IMAGE-HIGH-RES 1-s2.0-S0306261922005189-gr5_lrg.jpg https://s3-eu-west-1.amazonaws.com/prod-ucs-content-store-eu-west/content/pii:S0306261922005189/HIGHRES/image/jpeg/e03607c788012303424af57af86dd15c/gr5_lrg.jpg gr5 gr5_lrg.jpg jpg 202702 1493 3200 IMAGE-HIGH-RES 1-s2.0-S0306261922005189-gr6_lrg.jpg https://s3-eu-west-1.amazonaws.com/prod-ucs-content-store-eu-west/content/pii:S0306261922005189/HIGHRES/image/jpeg/4db474eb7cff606a798e5669ebd81f1d/gr6_lrg.jpg gr6 gr6_lrg.jpg jpg 219304 1557 3222 IMAGE-HIGH-RES 1-s2.0-S0306261922005189-si1.svg https://s3-eu-west-1.amazonaws.com/prod-ucs-content-store-eu-west/content/pii:S0306261922005189/image/svg+xml/ffca888546b77ed567161b97d4cac309/si1.svg si1 si1.svg svg 1669 ALTIMG 1-s2.0-S0306261922005189-si10.svg https://s3-eu-west-1.amazonaws.com/prod-ucs-content-store-eu-west/content/pii:S0306261922005189/image/svg+xml/f4af8e24dcd71db83bf412a418db23c8/si10.svg si10 si10.svg svg 2543 ALTIMG 1-s2.0-S0306261922005189-si100.svg https://s3-eu-west-1.amazonaws.com/prod-ucs-content-store-eu-west/content/pii:S0306261922005189/image/svg+xml/446c3f37074aca307feaf070876a0fd3/si100.svg si100 si100.svg svg 17651 ALTIMG 1-s2.0-S0306261922005189-si102.svg https://s3-eu-west-1.amazonaws.com/prod-ucs-content-store-eu-west/content/pii:S0306261922005189/image/svg+xml/bf06533f0c0e97fdc5982d0a8172ef35/si102.svg si102 si102.svg svg 18962 ALTIMG 1-s2.0-S0306261922005189-si103.svg https://s3-eu-west-1.amazonaws.com/prod-ucs-content-store-eu-west/content/pii:S0306261922005189/image/svg+xml/4c357529a10cd874746f41ef0e6715f4/si103.svg si103 si103.svg svg 3906 ALTIMG 1-s2.0-S0306261922005189-si104.svg https://s3-eu-west-1.amazonaws.com/prod-ucs-content-store-eu-west/content/pii:S0306261922005189/image/svg+xml/54b58ceb03df3bf8d389d9c4ce02e979/si104.svg si104 si104.svg svg 9013 ALTIMG 1-s2.0-S0306261922005189-si105.svg https://s3-eu-west-1.amazonaws.com/prod-ucs-content-store-eu-west/content/pii:S0306261922005189/image/svg+xml/1a101cf6ff4098eb480653b362f3c4db/si105.svg si105 si105.svg svg 17944 ALTIMG 1-s2.0-S0306261922005189-si106.svg https://s3-eu-west-1.amazonaws.com/prod-ucs-content-store-eu-west/content/pii:S0306261922005189/image/svg+xml/f7ebbbf266e664f39aa91e2401596867/si106.svg si106 si106.svg svg 37793 ALTIMG 1-s2.0-S0306261922005189-si107.svg https://s3-eu-west-1.amazonaws.com/prod-ucs-content-store-eu-west/content/pii:S0306261922005189/image/svg+xml/9f511f8309c6038bac96a4bf24a82cdb/si107.svg si107 si107.svg svg 16211 ALTIMG 1-s2.0-S0306261922005189-si108.svg https://s3-eu-west-1.amazonaws.com/prod-ucs-content-store-eu-west/content/pii:S0306261922005189/image/svg+xml/f23f33b4191087f33e1164a209fe7860/si108.svg si108 si108.svg svg 17610 ALTIMG 1-s2.0-S0306261922005189-si109.svg https://s3-eu-west-1.amazonaws.com/prod-ucs-content-store-eu-west/content/pii:S0306261922005189/image/svg+xml/c7e37190d6b200d19e564906a57e69fe/si109.svg si109 si109.svg svg 25712 ALTIMG 1-s2.0-S0306261922005189-si11.svg https://s3-eu-west-1.amazonaws.com/prod-ucs-content-store-eu-west/content/pii:S0306261922005189/image/svg+xml/5ed50591b41887826c53c1c6dbb9f938/si11.svg si11 si11.svg svg 5576 ALTIMG 1-s2.0-S0306261922005189-si110.svg https://s3-eu-west-1.amazonaws.com/prod-ucs-content-store-eu-west/content/pii:S0306261922005189/image/svg+xml/1091452e9a7214980e24fa6978f99292/si110.svg si110 si110.svg svg 5347 ALTIMG 1-s2.0-S0306261922005189-si111.svg https://s3-eu-west-1.amazonaws.com/prod-ucs-content-store-eu-west/content/pii:S0306261922005189/image/svg+xml/b82a2153d0bd46548aa733d16c005729/si111.svg si111 si111.svg svg 6620 ALTIMG 1-s2.0-S0306261922005189-si112.svg https://s3-eu-west-1.amazonaws.com/prod-ucs-content-store-eu-west/content/pii:S0306261922005189/image/svg+xml/7520c9aed6350b53b4ae06134739778d/si112.svg si112 si112.svg svg 2531 ALTIMG 1-s2.0-S0306261922005189-si113.svg https://s3-eu-west-1.amazonaws.com/prod-ucs-content-store-eu-west/content/pii:S0306261922005189/image/svg+xml/4041192f638ebe7f45df795eb282090f/si113.svg si113 si113.svg svg 6732 ALTIMG 1-s2.0-S0306261922005189-si114.svg https://s3-eu-west-1.amazonaws.com/prod-ucs-content-store-eu-west/content/pii:S0306261922005189/image/svg+xml/101002a7ee201b593bc33be38413a7b5/si114.svg si114 si114.svg svg 2636 ALTIMG 1-s2.0-S0306261922005189-si115.svg https://s3-eu-west-1.amazonaws.com/prod-ucs-content-store-eu-west/content/pii:S0306261922005189/image/svg+xml/622d4e3526c2511deaad8c469d7d89fb/si115.svg si115 si115.svg svg 7031 ALTIMG 1-s2.0-S0306261922005189-si116.svg https://s3-eu-west-1.amazonaws.com/prod-ucs-content-store-eu-west/content/pii:S0306261922005189/image/svg+xml/f5054947135fd189b286eca00a799fe5/si116.svg si116 si116.svg svg 3148 ALTIMG 1-s2.0-S0306261922005189-si117.svg https://s3-eu-west-1.amazonaws.com/prod-ucs-content-store-eu-west/content/pii:S0306261922005189/image/svg+xml/42b140774f7127942431674bb345eed1/si117.svg si117 si117.svg svg 3055 ALTIMG 1-s2.0-S0306261922005189-si118.svg https://s3-eu-west-1.amazonaws.com/prod-ucs-content-store-eu-west/content/pii:S0306261922005189/image/svg+xml/2ce962a2ac397fcdb3643474b18f58c9/si118.svg si118 si118.svg svg 6755 ALTIMG 1-s2.0-S0306261922005189-si119.svg https://s3-eu-west-1.amazonaws.com/prod-ucs-content-store-eu-west/content/pii:S0306261922005189/image/svg+xml/a048849cfc0ec513e82b489155bcc106/si119.svg si119 si119.svg svg 4657 ALTIMG 1-s2.0-S0306261922005189-si12.svg https://s3-eu-west-1.amazonaws.com/prod-ucs-content-store-eu-west/content/pii:S0306261922005189/image/svg+xml/b77b9af2e94cd6a08fb86dc8a74a3ff1/si12.svg si12 si12.svg svg 5561 ALTIMG 1-s2.0-S0306261922005189-si120.svg https://s3-eu-west-1.amazonaws.com/prod-ucs-content-store-eu-west/content/pii:S0306261922005189/image/svg+xml/dafa022b78dec0397993c4b7b18564b1/si120.svg si120 si120.svg svg 3411 ALTIMG 1-s2.0-S0306261922005189-si121.svg https://s3-eu-west-1.amazonaws.com/prod-ucs-content-store-eu-west/content/pii:S0306261922005189/image/svg+xml/b01468438a7a81d3eb8a830050a429d9/si121.svg si121 si121.svg svg 5480 ALTIMG 1-s2.0-S0306261922005189-si122.svg https://s3-eu-west-1.amazonaws.com/prod-ucs-content-store-eu-west/content/pii:S0306261922005189/image/svg+xml/5202e07d98e74fdda6512184a10b41f2/si122.svg si122 si122.svg svg 1636 ALTIMG 1-s2.0-S0306261922005189-si123.svg https://s3-eu-west-1.amazonaws.com/prod-ucs-content-store-eu-west/content/pii:S0306261922005189/image/svg+xml/796d6b6ecea39e1a14ac28ba5b481d47/si123.svg si123 si123.svg svg 1297 ALTIMG 1-s2.0-S0306261922005189-si124.svg https://s3-eu-west-1.amazonaws.com/prod-ucs-content-store-eu-west/content/pii:S0306261922005189/image/svg+xml/c68c2db82fc6f5804cab2ac7a71f11a1/si124.svg si124 si124.svg svg 1590 ALTIMG 1-s2.0-S0306261922005189-si125.svg https://s3-eu-west-1.amazonaws.com/prod-ucs-content-store-eu-west/content/pii:S0306261922005189/image/svg+xml/db1e31b65ff2b7508ecba0f6505bbc2e/si125.svg si125 si125.svg svg 3038 ALTIMG 1-s2.0-S0306261922005189-si126.svg https://s3-eu-west-1.amazonaws.com/prod-ucs-content-store-eu-west/content/pii:S0306261922005189/image/svg+xml/ea79c5dca45ee39a0584a756d7468bf1/si126.svg si126 si126.svg svg 9142 ALTIMG 1-s2.0-S0306261922005189-si127.svg https://s3-eu-west-1.amazonaws.com/prod-ucs-content-store-eu-west/content/pii:S0306261922005189/image/svg+xml/0c30c47cca15e086375ddee501b17202/si127.svg si127 si127.svg svg 4572 ALTIMG 1-s2.0-S0306261922005189-si128.svg https://s3-eu-west-1.amazonaws.com/prod-ucs-content-store-eu-west/content/pii:S0306261922005189/image/svg+xml/359bc848acfd529c171c1e8bd493c784/si128.svg si128 si128.svg svg 4404 ALTIMG 1-s2.0-S0306261922005189-si129.svg https://s3-eu-west-1.amazonaws.com/prod-ucs-content-store-eu-west/content/pii:S0306261922005189/image/svg+xml/fbb447d6adf7051a6edfdf02c6f8e1f6/si129.svg si129 si129.svg svg 3070 ALTIMG 1-s2.0-S0306261922005189-si13.svg https://s3-eu-west-1.amazonaws.com/prod-ucs-content-store-eu-west/content/pii:S0306261922005189/image/svg+xml/5b7cec4bf9408d71f994cf3e73f5c342/si13.svg si13 si13.svg svg 5709 ALTIMG 1-s2.0-S0306261922005189-si130.svg https://s3-eu-west-1.amazonaws.com/prod-ucs-content-store-eu-west/content/pii:S0306261922005189/image/svg+xml/1389a804985f0c184c3086fb1d3b6692/si130.svg si130 si130.svg svg 2834 ALTIMG 1-s2.0-S0306261922005189-si131.svg https://s3-eu-west-1.amazonaws.com/prod-ucs-content-store-eu-west/content/pii:S0306261922005189/image/svg+xml/d7c2ad1422c3f944ccfc16570e7e9f1b/si131.svg si131 si131.svg svg 2544 ALTIMG 1-s2.0-S0306261922005189-si132.svg https://s3-eu-west-1.amazonaws.com/prod-ucs-content-store-eu-west/content/pii:S0306261922005189/image/svg+xml/3d7af30ccb06de1e46928e45a539f032/si132.svg si132 si132.svg svg 2306 ALTIMG 1-s2.0-S0306261922005189-si133.svg https://s3-eu-west-1.amazonaws.com/prod-ucs-content-store-eu-west/content/pii:S0306261922005189/image/svg+xml/3de3ac4aa21c4a0f2f582455cc1c62d5/si133.svg si133 si133.svg svg 2857 ALTIMG 1-s2.0-S0306261922005189-si134.svg https://s3-eu-west-1.amazonaws.com/prod-ucs-content-store-eu-west/content/pii:S0306261922005189/image/svg+xml/96f9350f9a34e4c9b55349b45ae28d59/si134.svg si134 si134.svg svg 5896 ALTIMG 1-s2.0-S0306261922005189-si135.svg https://s3-eu-west-1.amazonaws.com/prod-ucs-content-store-eu-west/content/pii:S0306261922005189/image/svg+xml/9e07a494b2092ee98ce38ebbe87002b9/si135.svg si135 si135.svg svg 4448 ALTIMG 1-s2.0-S0306261922005189-si136.svg https://s3-eu-west-1.amazonaws.com/prod-ucs-content-store-eu-west/content/pii:S0306261922005189/image/svg+xml/68dba27d5d16f42bd2d5ecfe82fba96a/si136.svg si136 si136.svg svg 6721 ALTIMG 1-s2.0-S0306261922005189-si137.svg https://s3-eu-west-1.amazonaws.com/prod-ucs-content-store-eu-west/content/pii:S0306261922005189/image/svg+xml/91186d48f6fbfa532abb7300da44a76c/si137.svg si137 si137.svg svg 6485 ALTIMG 1-s2.0-S0306261922005189-si138.svg https://s3-eu-west-1.amazonaws.com/prod-ucs-content-store-eu-west/content/pii:S0306261922005189/image/svg+xml/616d5a7ec134ef9379bd05bfe0254f10/si138.svg si138 si138.svg svg 18836 ALTIMG 1-s2.0-S0306261922005189-si139.svg https://s3-eu-west-1.amazonaws.com/prod-ucs-content-store-eu-west/content/pii:S0306261922005189/image/svg+xml/c0702a9b280f447ac43152f922682cf0/si139.svg si139 si139.svg svg 20672 ALTIMG 1-s2.0-S0306261922005189-si14.svg https://s3-eu-west-1.amazonaws.com/prod-ucs-content-store-eu-west/content/pii:S0306261922005189/image/svg+xml/60813356002b7e3ee6909074fd46ae90/si14.svg si14 si14.svg svg 1123 ALTIMG 1-s2.0-S0306261922005189-si140.svg https://s3-eu-west-1.amazonaws.com/prod-ucs-content-store-eu-west/content/pii:S0306261922005189/image/svg+xml/687bceb75eaa4c540b186ea71109bd3f/si140.svg si140 si140.svg svg 29778 ALTIMG 1-s2.0-S0306261922005189-si141.svg https://s3-eu-west-1.amazonaws.com/prod-ucs-content-store-eu-west/content/pii:S0306261922005189/image/svg+xml/8c68decc39f8c3f5a9e8b7431e3bbd94/si141.svg si141 si141.svg svg 15730 ALTIMG 1-s2.0-S0306261922005189-si142.svg https://s3-eu-west-1.amazonaws.com/prod-ucs-content-store-eu-west/content/pii:S0306261922005189/image/svg+xml/3fca0d0460a5769f1f7634e4321f1b6c/si142.svg si142 si142.svg svg 17712 ALTIMG 1-s2.0-S0306261922005189-si143.svg https://s3-eu-west-1.amazonaws.com/prod-ucs-content-store-eu-west/content/pii:S0306261922005189/image/svg+xml/ddf4228f77035729469f8db60d1c4b20/si143.svg si143 si143.svg svg 11004 ALTIMG 1-s2.0-S0306261922005189-si144.svg https://s3-eu-west-1.amazonaws.com/prod-ucs-content-store-eu-west/content/pii:S0306261922005189/image/svg+xml/3e9519e83ba6585d8a2cb8a7b2aad853/si144.svg si144 si144.svg svg 20963 ALTIMG 1-s2.0-S0306261922005189-si145.svg https://s3-eu-west-1.amazonaws.com/prod-ucs-content-store-eu-west/content/pii:S0306261922005189/image/svg+xml/bf81d18b2546e81f329150f4f491b5bc/si145.svg si145 si145.svg svg 13875 ALTIMG 1-s2.0-S0306261922005189-si146.svg https://s3-eu-west-1.amazonaws.com/prod-ucs-content-store-eu-west/content/pii:S0306261922005189/image/svg+xml/1017521fd9acc5eeeca0107d46e1056a/si146.svg si146 si146.svg svg 13962 ALTIMG 1-s2.0-S0306261922005189-si147.svg https://s3-eu-west-1.amazonaws.com/prod-ucs-content-store-eu-west/content/pii:S0306261922005189/image/svg+xml/33a9a95f89c7f387428b33d1e7fe3ed0/si147.svg si147 si147.svg svg 4444 ALTIMG 1-s2.0-S0306261922005189-si148.svg https://s3-eu-west-1.amazonaws.com/prod-ucs-content-store-eu-west/content/pii:S0306261922005189/image/svg+xml/fc5061e376aa467fa3f8325393502688/si148.svg si148 si148.svg svg 8254 ALTIMG 1-s2.0-S0306261922005189-si149.svg https://s3-eu-west-1.amazonaws.com/prod-ucs-content-store-eu-west/content/pii:S0306261922005189/image/svg+xml/051b34dd7d9cbb35e80867e6e8d265b2/si149.svg si149 si149.svg svg 7694 ALTIMG 1-s2.0-S0306261922005189-si15.svg https://s3-eu-west-1.amazonaws.com/prod-ucs-content-store-eu-west/content/pii:S0306261922005189/image/svg+xml/1a82b7a5e1099713292244e6de1c1e0a/si15.svg si15 si15.svg svg 2152 ALTIMG 1-s2.0-S0306261922005189-si150.svg https://s3-eu-west-1.amazonaws.com/prod-ucs-content-store-eu-west/content/pii:S0306261922005189/image/svg+xml/5d5d5896a93c323a33d8a9a1023d9205/si150.svg si150 si150.svg svg 4582 ALTIMG 1-s2.0-S0306261922005189-si151.svg https://s3-eu-west-1.amazonaws.com/prod-ucs-content-store-eu-west/content/pii:S0306261922005189/image/svg+xml/3ef0d2a6f5e2dbec3b8942581505afa0/si151.svg si151 si151.svg svg 2269 ALTIMG 1-s2.0-S0306261922005189-si152.svg https://s3-eu-west-1.amazonaws.com/prod-ucs-content-store-eu-west/content/pii:S0306261922005189/image/svg+xml/7302545df257e802f0bc7ec5e6dc96f1/si152.svg si152 si152.svg svg 7304 ALTIMG 1-s2.0-S0306261922005189-si153.svg https://s3-eu-west-1.amazonaws.com/prod-ucs-content-store-eu-west/content/pii:S0306261922005189/image/svg+xml/bc951b72a59953934ddbd4eeb9b9329f/si153.svg si153 si153.svg svg 7829 ALTIMG 1-s2.0-S0306261922005189-si154.svg https://s3-eu-west-1.amazonaws.com/prod-ucs-content-store-eu-west/content/pii:S0306261922005189/image/svg+xml/344a227c0a6a93d085378fd51d20454f/si154.svg si154 si154.svg svg 14567 ALTIMG 1-s2.0-S0306261922005189-si155.svg https://s3-eu-west-1.amazonaws.com/prod-ucs-content-store-eu-west/content/pii:S0306261922005189/image/svg+xml/d8d22dbba636057ca04cbfef8979f87f/si155.svg si155 si155.svg svg 22828 ALTIMG 1-s2.0-S0306261922005189-si156.svg https://s3-eu-west-1.amazonaws.com/prod-ucs-content-store-eu-west/content/pii:S0306261922005189/image/svg+xml/b47f16091622940f55826b67c42df751/si156.svg si156 si156.svg svg 23331 ALTIMG 1-s2.0-S0306261922005189-si157.svg https://s3-eu-west-1.amazonaws.com/prod-ucs-content-store-eu-west/content/pii:S0306261922005189/image/svg+xml/5541ad108750e12463a576ce132b2b6b/si157.svg si157 si157.svg svg 11837 ALTIMG 1-s2.0-S0306261922005189-si158.svg https://s3-eu-west-1.amazonaws.com/prod-ucs-content-store-eu-west/content/pii:S0306261922005189/image/svg+xml/efb964cec39914c24b6dcbbf27cce988/si158.svg si158 si158.svg svg 5940 ALTIMG 1-s2.0-S0306261922005189-si159.svg https://s3-eu-west-1.amazonaws.com/prod-ucs-content-store-eu-west/content/pii:S0306261922005189/image/svg+xml/364fe657fec5ddd47c43bb1856cb91f1/si159.svg si159 si159.svg svg 9118 ALTIMG 1-s2.0-S0306261922005189-si16.svg https://s3-eu-west-1.amazonaws.com/prod-ucs-content-store-eu-west/content/pii:S0306261922005189/image/svg+xml/e993053d3754dc9c57daaffcc05337ba/si16.svg si16 si16.svg svg 5347 ALTIMG 1-s2.0-S0306261922005189-si160.svg https://s3-eu-west-1.amazonaws.com/prod-ucs-content-store-eu-west/content/pii:S0306261922005189/image/svg+xml/38fee955803608dbe8ed76e9976b4950/si160.svg si160 si160.svg svg 9626 ALTIMG 1-s2.0-S0306261922005189-si161.svg https://s3-eu-west-1.amazonaws.com/prod-ucs-content-store-eu-west/content/pii:S0306261922005189/image/svg+xml/62c12b18e9d82eb69dda60a9fdfbe11a/si161.svg si161 si161.svg svg 1427 ALTIMG 1-s2.0-S0306261922005189-si162.svg https://s3-eu-west-1.amazonaws.com/prod-ucs-content-store-eu-west/content/pii:S0306261922005189/image/svg+xml/a33a4c6f42cc0a4b7b5d14ea7b5c1a18/si162.svg si162 si162.svg svg 13063 ALTIMG 1-s2.0-S0306261922005189-si163.svg https://s3-eu-west-1.amazonaws.com/prod-ucs-content-store-eu-west/content/pii:S0306261922005189/image/svg+xml/def98d4c5f8306b60ebd794f03d03263/si163.svg si163 si163.svg svg 4694 ALTIMG 1-s2.0-S0306261922005189-si164.svg https://s3-eu-west-1.amazonaws.com/prod-ucs-content-store-eu-west/content/pii:S0306261922005189/image/svg+xml/95e56f6be64d863154066dac962f7d1f/si164.svg si164 si164.svg svg 6278 ALTIMG 1-s2.0-S0306261922005189-si165.svg https://s3-eu-west-1.amazonaws.com/prod-ucs-content-store-eu-west/content/pii:S0306261922005189/image/svg+xml/114bb12cb57e9bf5d8101379ed2f871e/si165.svg si165 si165.svg svg 9158 ALTIMG 1-s2.0-S0306261922005189-si166.svg https://s3-eu-west-1.amazonaws.com/prod-ucs-content-store-eu-west/content/pii:S0306261922005189/image/svg+xml/0f80a71f139336a7a956e9225de7101f/si166.svg si166 si166.svg svg 3545 ALTIMG 1-s2.0-S0306261922005189-si167.svg https://s3-eu-west-1.amazonaws.com/prod-ucs-content-store-eu-west/content/pii:S0306261922005189/image/svg+xml/bbc2049b4649e0105c69ac4af8d3d6a7/si167.svg si167 si167.svg svg 8878 ALTIMG 1-s2.0-S0306261922005189-si168.svg https://s3-eu-west-1.amazonaws.com/prod-ucs-content-store-eu-west/content/pii:S0306261922005189/image/svg+xml/ed73fb582dd47d9343685fab9aca4fc2/si168.svg si168 si168.svg svg 3359 ALTIMG 1-s2.0-S0306261922005189-si169.svg https://s3-eu-west-1.amazonaws.com/prod-ucs-content-store-eu-west/content/pii:S0306261922005189/image/svg+xml/8d5c2f302ed60bb6de2f09742a091172/si169.svg si169 si169.svg svg 6494 ALTIMG 1-s2.0-S0306261922005189-si17.svg https://s3-eu-west-1.amazonaws.com/prod-ucs-content-store-eu-west/content/pii:S0306261922005189/image/svg+xml/76568e1258961cb7186e753ec409937c/si17.svg si17 si17.svg svg 1569 ALTIMG 1-s2.0-S0306261922005189-si170.svg https://s3-eu-west-1.amazonaws.com/prod-ucs-content-store-eu-west/content/pii:S0306261922005189/image/svg+xml/2bdab17fa774a978c1029953823dbb44/si170.svg si170 si170.svg svg 1352 ALTIMG 1-s2.0-S0306261922005189-si171.svg https://s3-eu-west-1.amazonaws.com/prod-ucs-content-store-eu-west/content/pii:S0306261922005189/image/svg+xml/293888f2e7f41d871275fb0df76630e0/si171.svg si171 si171.svg svg 1812 ALTIMG 1-s2.0-S0306261922005189-si172.svg https://s3-eu-west-1.amazonaws.com/prod-ucs-content-store-eu-west/content/pii:S0306261922005189/image/svg+xml/63073ec834a4b2fdf1a7580c3f8213a2/si172.svg si172 si172.svg svg 1749 ALTIMG 1-s2.0-S0306261922005189-si173.svg https://s3-eu-west-1.amazonaws.com/prod-ucs-content-store-eu-west/content/pii:S0306261922005189/image/svg+xml/9ba58de3f604b19c01dcf3edd7796788/si173.svg si173 si173.svg svg 4454 ALTIMG 1-s2.0-S0306261922005189-si174.svg https://s3-eu-west-1.amazonaws.com/prod-ucs-content-store-eu-west/content/pii:S0306261922005189/image/svg+xml/7969bcc6b5929991f68238bebe631d7a/si174.svg si174 si174.svg svg 4675 ALTIMG 1-s2.0-S0306261922005189-si175.svg https://s3-eu-west-1.amazonaws.com/prod-ucs-content-store-eu-west/content/pii:S0306261922005189/image/svg+xml/4f15a3fe35f781202d8503ebb7c77964/si175.svg si175 si175.svg svg 4968 ALTIMG 1-s2.0-S0306261922005189-si176.svg https://s3-eu-west-1.amazonaws.com/prod-ucs-content-store-eu-west/content/pii:S0306261922005189/image/svg+xml/f8aa4fdff76190c3ffad7cf29bb24a78/si176.svg si176 si176.svg svg 18284 ALTIMG 1-s2.0-S0306261922005189-si177.svg https://s3-eu-west-1.amazonaws.com/prod-ucs-content-store-eu-west/content/pii:S0306261922005189/image/svg+xml/185b2ae47d417081fc5870e3ab590ed8/si177.svg si177 si177.svg svg 18329 ALTIMG 1-s2.0-S0306261922005189-si178.svg https://s3-eu-west-1.amazonaws.com/prod-ucs-content-store-eu-west/content/pii:S0306261922005189/image/svg+xml/c35e6ff22ea39948b968b3c503397382/si178.svg si178 si178.svg svg 25238 ALTIMG 1-s2.0-S0306261922005189-si179.svg https://s3-eu-west-1.amazonaws.com/prod-ucs-content-store-eu-west/content/pii:S0306261922005189/image/svg+xml/db3426618deff35e0edac1c0067fe669/si179.svg si179 si179.svg svg 17462 ALTIMG 1-s2.0-S0306261922005189-si18.svg https://s3-eu-west-1.amazonaws.com/prod-ucs-content-store-eu-west/content/pii:S0306261922005189/image/svg+xml/69a920966cc79223a15b7979d366fda8/si18.svg si18 si18.svg svg 2857 ALTIMG 1-s2.0-S0306261922005189-si180.svg https://s3-eu-west-1.amazonaws.com/prod-ucs-content-store-eu-west/content/pii:S0306261922005189/image/svg+xml/ed047c026f3c542ef0995b8f437573bd/si180.svg si180 si180.svg svg 15785 ALTIMG 1-s2.0-S0306261922005189-si181.svg https://s3-eu-west-1.amazonaws.com/prod-ucs-content-store-eu-west/content/pii:S0306261922005189/image/svg+xml/9ccd3944f4d225166b79cb87cec94bf7/si181.svg si181 si181.svg svg 18652 ALTIMG 1-s2.0-S0306261922005189-si182.svg https://s3-eu-west-1.amazonaws.com/prod-ucs-content-store-eu-west/content/pii:S0306261922005189/image/svg+xml/cef9dd1fde177c7806caf79f5edfdb5a/si182.svg si182 si182.svg svg 16193 ALTIMG 1-s2.0-S0306261922005189-si183.svg https://s3-eu-west-1.amazonaws.com/prod-ucs-content-store-eu-west/content/pii:S0306261922005189/image/svg+xml/9927b6bf4d84c072b04b31c85b22eaa1/si183.svg si183 si183.svg svg 16193 ALTIMG 1-s2.0-S0306261922005189-si184.svg https://s3-eu-west-1.amazonaws.com/prod-ucs-content-store-eu-west/content/pii:S0306261922005189/image/svg+xml/4c8f16ced08dc560fbd8f537ab6931b0/si184.svg si184 si184.svg svg 21520 ALTIMG 1-s2.0-S0306261922005189-si185.svg https://s3-eu-west-1.amazonaws.com/prod-ucs-content-store-eu-west/content/pii:S0306261922005189/image/svg+xml/e48da64f17a0591a9224903897335aad/si185.svg si185 si185.svg svg 15296 ALTIMG 1-s2.0-S0306261922005189-si186.svg https://s3-eu-west-1.amazonaws.com/prod-ucs-content-store-eu-west/content/pii:S0306261922005189/image/svg+xml/818a1d6bbd77a6dd83564fbf6b6c400c/si186.svg si186 si186.svg svg 6068 ALTIMG 1-s2.0-S0306261922005189-si187.svg https://s3-eu-west-1.amazonaws.com/prod-ucs-content-store-eu-west/content/pii:S0306261922005189/image/svg+xml/599b8132b19dbcca06a294c3569c6535/si187.svg si187 si187.svg svg 7199 ALTIMG 1-s2.0-S0306261922005189-si188.svg https://s3-eu-west-1.amazonaws.com/prod-ucs-content-store-eu-west/content/pii:S0306261922005189/image/svg+xml/1e94a02b083a8033eb5fa921339ad087/si188.svg si188 si188.svg svg 5848 ALTIMG 1-s2.0-S0306261922005189-si189.svg https://s3-eu-west-1.amazonaws.com/prod-ucs-content-store-eu-west/content/pii:S0306261922005189/image/svg+xml/17061059bf2e89fe9609f200d00efc40/si189.svg si189 si189.svg svg 4455 ALTIMG 1-s2.0-S0306261922005189-si19.svg https://s3-eu-west-1.amazonaws.com/prod-ucs-content-store-eu-west/content/pii:S0306261922005189/image/svg+xml/62d02cbfe4663d7a37712e444173eb2d/si19.svg si19 si19.svg svg 6789 ALTIMG 1-s2.0-S0306261922005189-si190.svg https://s3-eu-west-1.amazonaws.com/prod-ucs-content-store-eu-west/content/pii:S0306261922005189/image/svg+xml/233b7e52e4d6eefbb2e8d125e2f8efa2/si190.svg si190 si190.svg svg 4110 ALTIMG 1-s2.0-S0306261922005189-si191.svg https://s3-eu-west-1.amazonaws.com/prod-ucs-content-store-eu-west/content/pii:S0306261922005189/image/svg+xml/ef0c0b61ca7ec88f78f904c4a2baef95/si191.svg si191 si191.svg svg 20267 ALTIMG 1-s2.0-S0306261922005189-si192.svg https://s3-eu-west-1.amazonaws.com/prod-ucs-content-store-eu-west/content/pii:S0306261922005189/image/svg+xml/c3d768d1bebe101cbd75308073094fe7/si192.svg si192 si192.svg svg 14523 ALTIMG 1-s2.0-S0306261922005189-si193.svg https://s3-eu-west-1.amazonaws.com/prod-ucs-content-store-eu-west/content/pii:S0306261922005189/image/svg+xml/63b6433c503121ea4a69ddb281910f6f/si193.svg si193 si193.svg svg 14381 ALTIMG 1-s2.0-S0306261922005189-si194.svg https://s3-eu-west-1.amazonaws.com/prod-ucs-content-store-eu-west/content/pii:S0306261922005189/image/svg+xml/8297a284b580b39bbe16467ac1008583/si194.svg si194 si194.svg svg 3044 ALTIMG 1-s2.0-S0306261922005189-si195.svg https://s3-eu-west-1.amazonaws.com/prod-ucs-content-store-eu-west/content/pii:S0306261922005189/image/svg+xml/61923d2dc0fa1b04b56556761c2dd299/si195.svg si195 si195.svg svg 2597 ALTIMG 1-s2.0-S0306261922005189-si196.svg https://s3-eu-west-1.amazonaws.com/prod-ucs-content-store-eu-west/content/pii:S0306261922005189/image/svg+xml/11f2c0b97ad6a71db74cfb19aacac2a6/si196.svg si196 si196.svg svg 5578 ALTIMG 1-s2.0-S0306261922005189-si197.svg https://s3-eu-west-1.amazonaws.com/prod-ucs-content-store-eu-west/content/pii:S0306261922005189/image/svg+xml/b0689bf747b6bb476d0e900784048f6d/si197.svg si197 si197.svg svg 6726 ALTIMG 1-s2.0-S0306261922005189-si198.svg https://s3-eu-west-1.amazonaws.com/prod-ucs-content-store-eu-west/content/pii:S0306261922005189/image/svg+xml/f26f9dd266cced57fb6574962b8be64b/si198.svg si198 si198.svg svg 4647 ALTIMG 1-s2.0-S0306261922005189-si199.svg https://s3-eu-west-1.amazonaws.com/prod-ucs-content-store-eu-west/content/pii:S0306261922005189/image/svg+xml/18db8971b8b5e08067f4cd560d9334f8/si199.svg si199 si199.svg svg 6076 ALTIMG 1-s2.0-S0306261922005189-si2.svg https://s3-eu-west-1.amazonaws.com/prod-ucs-content-store-eu-west/content/pii:S0306261922005189/image/svg+xml/b74f3d9872ac00d62157ce83fe5416e7/si2.svg si2 si2.svg svg 3041 ALTIMG 1-s2.0-S0306261922005189-si20.svg https://s3-eu-west-1.amazonaws.com/prod-ucs-content-store-eu-west/content/pii:S0306261922005189/image/svg+xml/b01d373d37a017ec7be82e17cbeb70b9/si20.svg si20 si20.svg svg 6718 ALTIMG 1-s2.0-S0306261922005189-si200.svg https://s3-eu-west-1.amazonaws.com/prod-ucs-content-store-eu-west/content/pii:S0306261922005189/image/svg+xml/d743ea2e87f5a82a4da25dbbda6774c9/si200.svg si200 si200.svg svg 9509 ALTIMG 1-s2.0-S0306261922005189-si201.svg https://s3-eu-west-1.amazonaws.com/prod-ucs-content-store-eu-west/content/pii:S0306261922005189/image/svg+xml/4183f7b2166b8de602475e9080fbc554/si201.svg si201 si201.svg svg 3577 ALTIMG 1-s2.0-S0306261922005189-si202.svg https://s3-eu-west-1.amazonaws.com/prod-ucs-content-store-eu-west/content/pii:S0306261922005189/image/svg+xml/a0267e98e6d991d3e18ef859f477cf72/si202.svg si202 si202.svg svg 3435 ALTIMG 1-s2.0-S0306261922005189-si203.svg https://s3-eu-west-1.amazonaws.com/prod-ucs-content-store-eu-west/content/pii:S0306261922005189/image/svg+xml/037c081f417f4d19af0694ea49d606f4/si203.svg si203 si203.svg svg 17750 ALTIMG 1-s2.0-S0306261922005189-si204.svg https://s3-eu-west-1.amazonaws.com/prod-ucs-content-store-eu-west/content/pii:S0306261922005189/image/svg+xml/63c6b6a4a9da580c0ba75ee20e795e12/si204.svg si204 si204.svg svg 22867 ALTIMG 1-s2.0-S0306261922005189-si205.svg https://s3-eu-west-1.amazonaws.com/prod-ucs-content-store-eu-west/content/pii:S0306261922005189/image/svg+xml/3d24387ba67a30449459b295810acf07/si205.svg si205 si205.svg svg 10252 ALTIMG 1-s2.0-S0306261922005189-si206.svg https://s3-eu-west-1.amazonaws.com/prod-ucs-content-store-eu-west/content/pii:S0306261922005189/image/svg+xml/68b35f2865077a5bb52190aa6caf3ff2/si206.svg si206 si206.svg svg 12558 ALTIMG 1-s2.0-S0306261922005189-si207.svg https://s3-eu-west-1.amazonaws.com/prod-ucs-content-store-eu-west/content/pii:S0306261922005189/image/svg+xml/4276de88709d845b95762abffc67cb21/si207.svg si207 si207.svg svg 2076 ALTIMG 1-s2.0-S0306261922005189-si208.svg https://s3-eu-west-1.amazonaws.com/prod-ucs-content-store-eu-west/content/pii:S0306261922005189/image/svg+xml/a9053848a7b8c1e578cd5803bacfa66b/si208.svg si208 si208.svg svg 1932 ALTIMG 1-s2.0-S0306261922005189-si209.svg https://s3-eu-west-1.amazonaws.com/prod-ucs-content-store-eu-west/content/pii:S0306261922005189/image/svg+xml/bc5d2f18a69c2aa912853b8d2d9377b3/si209.svg si209 si209.svg svg 3232 ALTIMG 1-s2.0-S0306261922005189-si21.svg https://s3-eu-west-1.amazonaws.com/prod-ucs-content-store-eu-west/content/pii:S0306261922005189/image/svg+xml/56d04227adb0c70cf7f72d8f70845474/si21.svg si21 si21.svg svg 3899 ALTIMG 1-s2.0-S0306261922005189-si210.svg https://s3-eu-west-1.amazonaws.com/prod-ucs-content-store-eu-west/content/pii:S0306261922005189/image/svg+xml/677dd221dbb7f1f68d3a3be80a911377/si210.svg si210 si210.svg svg 1962 ALTIMG 1-s2.0-S0306261922005189-si211.svg https://s3-eu-west-1.amazonaws.com/prod-ucs-content-store-eu-west/content/pii:S0306261922005189/image/svg+xml/17282ecce5c487929ecbf028fa95cd9e/si211.svg si211 si211.svg svg 7221 ALTIMG 1-s2.0-S0306261922005189-si212.svg https://s3-eu-west-1.amazonaws.com/prod-ucs-content-store-eu-west/content/pii:S0306261922005189/image/svg+xml/32c0dc7d887eedc4a80caae564b02196/si212.svg si212 si212.svg svg 1691 ALTIMG 1-s2.0-S0306261922005189-si213.svg https://s3-eu-west-1.amazonaws.com/prod-ucs-content-store-eu-west/content/pii:S0306261922005189/image/svg+xml/9ea1291d893d04bbb26348c6d3ad67fe/si213.svg si213 si213.svg svg 1203 ALTIMG 1-s2.0-S0306261922005189-si214.svg https://s3-eu-west-1.amazonaws.com/prod-ucs-content-store-eu-west/content/pii:S0306261922005189/image/svg+xml/7913ef285015eb9440ea89de2edd3134/si214.svg si214 si214.svg svg 2950 ALTIMG 1-s2.0-S0306261922005189-si215.svg https://s3-eu-west-1.amazonaws.com/prod-ucs-content-store-eu-west/content/pii:S0306261922005189/image/svg+xml/9a46c7f339f9dc212081a56d7b31df17/si215.svg si215 si215.svg svg 3248 ALTIMG 1-s2.0-S0306261922005189-si216.svg https://s3-eu-west-1.amazonaws.com/prod-ucs-content-store-eu-west/content/pii:S0306261922005189/image/svg+xml/a3aeb1e2ad79d28ea995a6a9cfa1bc66/si216.svg si216 si216.svg svg 8358 ALTIMG 1-s2.0-S0306261922005189-si217.svg https://s3-eu-west-1.amazonaws.com/prod-ucs-content-store-eu-west/content/pii:S0306261922005189/image/svg+xml/bd14fa29a37555fc89364f3c28062393/si217.svg si217 si217.svg svg 2900 ALTIMG 1-s2.0-S0306261922005189-si218.svg https://s3-eu-west-1.amazonaws.com/prod-ucs-content-store-eu-west/content/pii:S0306261922005189/image/svg+xml/125f5b170f2a946295591a1fbd85d2aa/si218.svg si218 si218.svg svg 2953 ALTIMG 1-s2.0-S0306261922005189-si219.svg https://s3-eu-west-1.amazonaws.com/prod-ucs-content-store-eu-west/content/pii:S0306261922005189/image/svg+xml/c7f46246d7af19a1683f9c6974a5dc7b/si219.svg si219 si219.svg svg 8384 ALTIMG 1-s2.0-S0306261922005189-si22.svg https://s3-eu-west-1.amazonaws.com/prod-ucs-content-store-eu-west/content/pii:S0306261922005189/image/svg+xml/05124e3c2054a055fa6532849f56ad8b/si22.svg si22 si22.svg svg 6353 ALTIMG 1-s2.0-S0306261922005189-si220.svg https://s3-eu-west-1.amazonaws.com/prod-ucs-content-store-eu-west/content/pii:S0306261922005189/image/svg+xml/e0fd5706438c67f387e05bddb48fab06/si220.svg si220 si220.svg svg 11639 ALTIMG 1-s2.0-S0306261922005189-si221.svg https://s3-eu-west-1.amazonaws.com/prod-ucs-content-store-eu-west/content/pii:S0306261922005189/image/svg+xml/de738b4137733c67c890d2b8bf4249ce/si221.svg si221 si221.svg svg 4609 ALTIMG 1-s2.0-S0306261922005189-si222.svg https://s3-eu-west-1.amazonaws.com/prod-ucs-content-store-eu-west/content/pii:S0306261922005189/image/svg+xml/173ae2ec3ec3536863416580a25a73b3/si222.svg si222 si222.svg svg 3084 ALTIMG 1-s2.0-S0306261922005189-si223.svg https://s3-eu-west-1.amazonaws.com/prod-ucs-content-store-eu-west/content/pii:S0306261922005189/image/svg+xml/06ba79bb63b7e4bde6e714cfc0562206/si223.svg si223 si223.svg svg 4053 ALTIMG 1-s2.0-S0306261922005189-si224.svg https://s3-eu-west-1.amazonaws.com/prod-ucs-content-store-eu-west/content/pii:S0306261922005189/image/svg+xml/4b93357e8d000e41b81232bf6ef92cf2/si224.svg si224 si224.svg svg 4661 ALTIMG 1-s2.0-S0306261922005189-si225.svg https://s3-eu-west-1.amazonaws.com/prod-ucs-content-store-eu-west/content/pii:S0306261922005189/image/svg+xml/79e7b82f3fe6679f9a0124bc49286ff9/si225.svg si225 si225.svg svg 3582 ALTIMG 1-s2.0-S0306261922005189-si226.svg https://s3-eu-west-1.amazonaws.com/prod-ucs-content-store-eu-west/content/pii:S0306261922005189/image/svg+xml/46a4d9e4946d16a30c1647ef6245abf4/si226.svg si226 si226.svg svg 6556 ALTIMG 1-s2.0-S0306261922005189-si227.svg https://s3-eu-west-1.amazonaws.com/prod-ucs-content-store-eu-west/content/pii:S0306261922005189/image/svg+xml/151c90d6d10cfb99ab736d2ef47ddc93/si227.svg si227 si227.svg svg 2953 ALTIMG 1-s2.0-S0306261922005189-si228.svg https://s3-eu-west-1.amazonaws.com/prod-ucs-content-store-eu-west/content/pii:S0306261922005189/image/svg+xml/7c4b1a1552c63420feca4ca1dbccd9d2/si228.svg si228 si228.svg svg 7914 ALTIMG 1-s2.0-S0306261922005189-si229.svg https://s3-eu-west-1.amazonaws.com/prod-ucs-content-store-eu-west/content/pii:S0306261922005189/image/svg+xml/d8374de2cdd0ce8d0546c3933ef3f8b0/si229.svg si229 si229.svg svg 12172 ALTIMG 1-s2.0-S0306261922005189-si23.svg https://s3-eu-west-1.amazonaws.com/prod-ucs-content-store-eu-west/content/pii:S0306261922005189/image/svg+xml/e9dabae748bd1b1de359379bf545b006/si23.svg si23 si23.svg svg 7327 ALTIMG 1-s2.0-S0306261922005189-si230.svg https://s3-eu-west-1.amazonaws.com/prod-ucs-content-store-eu-west/content/pii:S0306261922005189/image/svg+xml/e62a84ff19476d97db7379d4372912f2/si230.svg si230 si230.svg svg 10940 ALTIMG 1-s2.0-S0306261922005189-si231.svg https://s3-eu-west-1.amazonaws.com/prod-ucs-content-store-eu-west/content/pii:S0306261922005189/image/svg+xml/b4add37c71429b42ffc0265bee672584/si231.svg si231 si231.svg svg 6534 ALTIMG 1-s2.0-S0306261922005189-si232.svg https://s3-eu-west-1.amazonaws.com/prod-ucs-content-store-eu-west/content/pii:S0306261922005189/image/svg+xml/083e0c597156a5cf6d842b7cf9ccbf9a/si232.svg si232 si232.svg svg 8038 ALTIMG 1-s2.0-S0306261922005189-si233.svg https://s3-eu-west-1.amazonaws.com/prod-ucs-content-store-eu-west/content/pii:S0306261922005189/image/svg+xml/6378902519d45866222049aa8dcc3f85/si233.svg si233 si233.svg svg 6532 ALTIMG 1-s2.0-S0306261922005189-si234.svg https://s3-eu-west-1.amazonaws.com/prod-ucs-content-store-eu-west/content/pii:S0306261922005189/image/svg+xml/d8e153275d3d2e46cd5ff3845aaa2384/si234.svg si234 si234.svg svg 8038 ALTIMG 1-s2.0-S0306261922005189-si235.svg https://s3-eu-west-1.amazonaws.com/prod-ucs-content-store-eu-west/content/pii:S0306261922005189/image/svg+xml/8619b0309635b39c4df25b193e44d3f5/si235.svg si235 si235.svg svg 5452 ALTIMG 1-s2.0-S0306261922005189-si236.svg https://s3-eu-west-1.amazonaws.com/prod-ucs-content-store-eu-west/content/pii:S0306261922005189/image/svg+xml/d76919a77afdd9b55498e2934fdec869/si236.svg si236 si236.svg svg 6092 ALTIMG 1-s2.0-S0306261922005189-si237.svg https://s3-eu-west-1.amazonaws.com/prod-ucs-content-store-eu-west/content/pii:S0306261922005189/image/svg+xml/f7da7be41be3f0e25beaa3bb4c94d7ed/si237.svg si237 si237.svg svg 6539 ALTIMG 1-s2.0-S0306261922005189-si238.svg https://s3-eu-west-1.amazonaws.com/prod-ucs-content-store-eu-west/content/pii:S0306261922005189/image/svg+xml/78146ff0a4bfd49c30162623038876e9/si238.svg si238 si238.svg svg 6537 ALTIMG 1-s2.0-S0306261922005189-si239.svg https://s3-eu-west-1.amazonaws.com/prod-ucs-content-store-eu-west/content/pii:S0306261922005189/image/svg+xml/cfd8c00d91c92633ba0bf87d66593fe0/si239.svg si239 si239.svg svg 30365 ALTIMG 1-s2.0-S0306261922005189-si24.svg https://s3-eu-west-1.amazonaws.com/prod-ucs-content-store-eu-west/content/pii:S0306261922005189/image/svg+xml/b019853780b4ffe7a4655beafa011c6c/si24.svg si24 si24.svg svg 6687 ALTIMG 1-s2.0-S0306261922005189-si240.svg https://s3-eu-west-1.amazonaws.com/prod-ucs-content-store-eu-west/content/pii:S0306261922005189/image/svg+xml/e2b62063c2731ace8037909ea3164de0/si240.svg si240 si240.svg svg 23177 ALTIMG 1-s2.0-S0306261922005189-si241.svg https://s3-eu-west-1.amazonaws.com/prod-ucs-content-store-eu-west/content/pii:S0306261922005189/image/svg+xml/f2a0726086951234c599ec170b2da030/si241.svg si241 si241.svg svg 25624 ALTIMG 1-s2.0-S0306261922005189-si242.svg https://s3-eu-west-1.amazonaws.com/prod-ucs-content-store-eu-west/content/pii:S0306261922005189/image/svg+xml/cf6018aa150f2b49ddbd7bc531ad7fd8/si242.svg si242 si242.svg svg 26941 ALTIMG 1-s2.0-S0306261922005189-si243.svg https://s3-eu-west-1.amazonaws.com/prod-ucs-content-store-eu-west/content/pii:S0306261922005189/image/svg+xml/60b873bb63a0bf1184596ca025b86f37/si243.svg si243 si243.svg svg 17907 ALTIMG 1-s2.0-S0306261922005189-si244.svg https://s3-eu-west-1.amazonaws.com/prod-ucs-content-store-eu-west/content/pii:S0306261922005189/image/svg+xml/812d98697be6173cbe58fc9522f573e0/si244.svg si244 si244.svg svg 14090 ALTIMG 1-s2.0-S0306261922005189-si245.svg https://s3-eu-west-1.amazonaws.com/prod-ucs-content-store-eu-west/content/pii:S0306261922005189/image/svg+xml/12ca046eda41d487a90fe85e793ca1cf/si245.svg si245 si245.svg svg 18954 ALTIMG 1-s2.0-S0306261922005189-si246.svg https://s3-eu-west-1.amazonaws.com/prod-ucs-content-store-eu-west/content/pii:S0306261922005189/image/svg+xml/ae3fb19e5c43972f77beeeda115162e9/si246.svg si246 si246.svg svg 7772 ALTIMG 1-s2.0-S0306261922005189-si247.svg https://s3-eu-west-1.amazonaws.com/prod-ucs-content-store-eu-west/content/pii:S0306261922005189/image/svg+xml/f0f989740aedfba8ed02e5f8a12c4a8f/si247.svg si247 si247.svg svg 7772 ALTIMG 1-s2.0-S0306261922005189-si248.svg https://s3-eu-west-1.amazonaws.com/prod-ucs-content-store-eu-west/content/pii:S0306261922005189/image/svg+xml/8415e0ab82f7c3127d6655a4536c93d6/si248.svg si248 si248.svg svg 4068 ALTIMG 1-s2.0-S0306261922005189-si249.svg https://s3-eu-west-1.amazonaws.com/prod-ucs-content-store-eu-west/content/pii:S0306261922005189/image/svg+xml/6b45a64125c0e25c83c359f0d84705d9/si249.svg si249 si249.svg svg 4831 ALTIMG 1-s2.0-S0306261922005189-si25.svg https://s3-eu-west-1.amazonaws.com/prod-ucs-content-store-eu-west/content/pii:S0306261922005189/image/svg+xml/c2c30d4fa9be5f3344469b9221adde49/si25.svg si25 si25.svg svg 6564 ALTIMG 1-s2.0-S0306261922005189-si250.svg https://s3-eu-west-1.amazonaws.com/prod-ucs-content-store-eu-west/content/pii:S0306261922005189/image/svg+xml/808908474744d7aab17c9c6fb2766b60/si250.svg si250 si250.svg svg 6336 ALTIMG 1-s2.0-S0306261922005189-si251.svg https://s3-eu-west-1.amazonaws.com/prod-ucs-content-store-eu-west/content/pii:S0306261922005189/image/svg+xml/b8beaf78fbbaf1cbef08e82ecd1ab66f/si251.svg si251 si251.svg svg 5685 ALTIMG 1-s2.0-S0306261922005189-si252.svg https://s3-eu-west-1.amazonaws.com/prod-ucs-content-store-eu-west/content/pii:S0306261922005189/image/svg+xml/ab5eabcf9b3838b4c6e925e5427110f5/si252.svg si252 si252.svg svg 9472 ALTIMG 1-s2.0-S0306261922005189-si253.svg https://s3-eu-west-1.amazonaws.com/prod-ucs-content-store-eu-west/content/pii:S0306261922005189/image/svg+xml/de61411a354540999682a8413ed04357/si253.svg si253 si253.svg svg 7775 ALTIMG 1-s2.0-S0306261922005189-si254.svg https://s3-eu-west-1.amazonaws.com/prod-ucs-content-store-eu-west/content/pii:S0306261922005189/image/svg+xml/b5b41626f79f627e75c0192993c78788/si254.svg si254 si254.svg svg 7775 ALTIMG 1-s2.0-S0306261922005189-si255.svg https://s3-eu-west-1.amazonaws.com/prod-ucs-content-store-eu-west/content/pii:S0306261922005189/image/svg+xml/e92e4d7c42b3c4c8fe4027af5c757a7c/si255.svg si255 si255.svg svg 6278 ALTIMG 1-s2.0-S0306261922005189-si256.svg https://s3-eu-west-1.amazonaws.com/prod-ucs-content-store-eu-west/content/pii:S0306261922005189/image/svg+xml/d0722309802fe2356bff22c1ab51bc0c/si256.svg si256 si256.svg svg 6278 ALTIMG 1-s2.0-S0306261922005189-si257.svg https://s3-eu-west-1.amazonaws.com/prod-ucs-content-store-eu-west/content/pii:S0306261922005189/image/svg+xml/b0cd91d3bfef92ee1074b0fe4d2e3c24/si257.svg si257 si257.svg svg 1301 ALTIMG 1-s2.0-S0306261922005189-si258.svg https://s3-eu-west-1.amazonaws.com/prod-ucs-content-store-eu-west/content/pii:S0306261922005189/image/svg+xml/8b0e90eb66cf795101479bb8c9870ec2/si258.svg si258 si258.svg svg 6375 ALTIMG 1-s2.0-S0306261922005189-si259.svg https://s3-eu-west-1.amazonaws.com/prod-ucs-content-store-eu-west/content/pii:S0306261922005189/image/svg+xml/b3bd6a9ea859b18a3210fdec30130409/si259.svg si259 si259.svg svg 5172 ALTIMG 1-s2.0-S0306261922005189-si26.svg https://s3-eu-west-1.amazonaws.com/prod-ucs-content-store-eu-west/content/pii:S0306261922005189/image/svg+xml/03ca60cc2209254c23180fc2265aaf91/si26.svg si26 si26.svg svg 2324 ALTIMG 1-s2.0-S0306261922005189-si260.svg https://s3-eu-west-1.amazonaws.com/prod-ucs-content-store-eu-west/content/pii:S0306261922005189/image/svg+xml/8d798fcda19abf528a81ac5f15cd896d/si260.svg si260 si260.svg svg 6610 ALTIMG 1-s2.0-S0306261922005189-si261.svg https://s3-eu-west-1.amazonaws.com/prod-ucs-content-store-eu-west/content/pii:S0306261922005189/image/svg+xml/4853c463c947f00a910686c94c222305/si261.svg si261 si261.svg svg 6703 ALTIMG 1-s2.0-S0306261922005189-si262.svg https://s3-eu-west-1.amazonaws.com/prod-ucs-content-store-eu-west/content/pii:S0306261922005189/image/svg+xml/f48ced9ab4a77300dc3ae2792918751b/si262.svg si262 si262.svg svg 21144 ALTIMG 1-s2.0-S0306261922005189-si263.svg https://s3-eu-west-1.amazonaws.com/prod-ucs-content-store-eu-west/content/pii:S0306261922005189/image/svg+xml/bada4b3b54dc7b186505dcd729fd2bf4/si263.svg si263 si263.svg svg 10867 ALTIMG 1-s2.0-S0306261922005189-si264.svg https://s3-eu-west-1.amazonaws.com/prod-ucs-content-store-eu-west/content/pii:S0306261922005189/image/svg+xml/e256841da03b92cfb6cccd13a02b2b74/si264.svg si264 si264.svg svg 14344 ALTIMG 1-s2.0-S0306261922005189-si265.svg https://s3-eu-west-1.amazonaws.com/prod-ucs-content-store-eu-west/content/pii:S0306261922005189/image/svg+xml/944abe7e5028e930c0ccc554638de2a4/si265.svg si265 si265.svg svg 41341 ALTIMG 1-s2.0-S0306261922005189-si266.svg https://s3-eu-west-1.amazonaws.com/prod-ucs-content-store-eu-west/content/pii:S0306261922005189/image/svg+xml/9bb5b47a1d1d7765d6de55007b3a6148/si266.svg si266 si266.svg svg 19087 ALTIMG 1-s2.0-S0306261922005189-si267.svg https://s3-eu-west-1.amazonaws.com/prod-ucs-content-store-eu-west/content/pii:S0306261922005189/image/svg+xml/d0e31cf2da4d57788acbd9f9037dc99a/si267.svg si267 si267.svg svg 19087 ALTIMG 1-s2.0-S0306261922005189-si268.svg https://s3-eu-west-1.amazonaws.com/prod-ucs-content-store-eu-west/content/pii:S0306261922005189/image/svg+xml/584c0385227d1d6b1147d6ab28150d70/si268.svg si268 si268.svg svg 12635 ALTIMG 1-s2.0-S0306261922005189-si269.svg https://s3-eu-west-1.amazonaws.com/prod-ucs-content-store-eu-west/content/pii:S0306261922005189/image/svg+xml/cd530be54c2cbf9a022d3669c3e3d33e/si269.svg si269 si269.svg svg 34286 ALTIMG 1-s2.0-S0306261922005189-si27.svg https://s3-eu-west-1.amazonaws.com/prod-ucs-content-store-eu-west/content/pii:S0306261922005189/image/svg+xml/e55d78e30d2c4e6a3ad6fc4d70473c30/si27.svg si27 si27.svg svg 6897 ALTIMG 1-s2.0-S0306261922005189-si270.svg https://s3-eu-west-1.amazonaws.com/prod-ucs-content-store-eu-west/content/pii:S0306261922005189/image/svg+xml/7a4d16e885577b286b8c12d580b3f51f/si270.svg si270 si270.svg svg 34801 ALTIMG 1-s2.0-S0306261922005189-si271.svg https://s3-eu-west-1.amazonaws.com/prod-ucs-content-store-eu-west/content/pii:S0306261922005189/image/svg+xml/25d1168004f6c8b0c7480f02b78997fb/si271.svg si271 si271.svg svg 14907 ALTIMG 1-s2.0-S0306261922005189-si272.svg https://s3-eu-west-1.amazonaws.com/prod-ucs-content-store-eu-west/content/pii:S0306261922005189/image/svg+xml/432a7dc5a71fd7639101cf4168db5aa6/si272.svg si272 si272.svg svg 12171 ALTIMG 1-s2.0-S0306261922005189-si273.svg https://s3-eu-west-1.amazonaws.com/prod-ucs-content-store-eu-west/content/pii:S0306261922005189/image/svg+xml/9e444e397f7089c036c5b8be2dd9529d/si273.svg si273 si273.svg svg 14455 ALTIMG 1-s2.0-S0306261922005189-si28.svg https://s3-eu-west-1.amazonaws.com/prod-ucs-content-store-eu-west/content/pii:S0306261922005189/image/svg+xml/0578dffd58f86251196af191a5d436a9/si28.svg si28 si28.svg svg 7040 ALTIMG 1-s2.0-S0306261922005189-si29.svg https://s3-eu-west-1.amazonaws.com/prod-ucs-content-store-eu-west/content/pii:S0306261922005189/image/svg+xml/e509c66ef0292b5dd44b20cde21dacac/si29.svg si29 si29.svg svg 6635 ALTIMG 1-s2.0-S0306261922005189-si3.svg https://s3-eu-west-1.amazonaws.com/prod-ucs-content-store-eu-west/content/pii:S0306261922005189/image/svg+xml/86f06c037cc78144e37037d030c2ab88/si3.svg si3 si3.svg svg 4430 ALTIMG 1-s2.0-S0306261922005189-si30.svg https://s3-eu-west-1.amazonaws.com/prod-ucs-content-store-eu-west/content/pii:S0306261922005189/image/svg+xml/d5f4d25bf0f129f0a70bf2d4a619182b/si30.svg si30 si30.svg svg 3138 ALTIMG 1-s2.0-S0306261922005189-si31.svg https://s3-eu-west-1.amazonaws.com/prod-ucs-content-store-eu-west/content/pii:S0306261922005189/image/svg+xml/6e6150e3d85da8327e88cf91b0855153/si31.svg si31 si31.svg svg 5446 ALTIMG 1-s2.0-S0306261922005189-si32.svg https://s3-eu-west-1.amazonaws.com/prod-ucs-content-store-eu-west/content/pii:S0306261922005189/image/svg+xml/818142fbd851b2160e3180a843c6f0e0/si32.svg si32 si32.svg svg 4427 ALTIMG 1-s2.0-S0306261922005189-si33.svg https://s3-eu-west-1.amazonaws.com/prod-ucs-content-store-eu-west/content/pii:S0306261922005189/image/svg+xml/97d794dbfb02ff5392cddaae01e3ba10/si33.svg si33 si33.svg svg 3022 ALTIMG 1-s2.0-S0306261922005189-si34.svg https://s3-eu-west-1.amazonaws.com/prod-ucs-content-store-eu-west/content/pii:S0306261922005189/image/svg+xml/1253dd5ff1efb5528df4561dc4ac0fa3/si34.svg si34 si34.svg svg 2892 ALTIMG 1-s2.0-S0306261922005189-si35.svg https://s3-eu-west-1.amazonaws.com/prod-ucs-content-store-eu-west/content/pii:S0306261922005189/image/svg+xml/0951f343ae142ed9974a0d0f9439169b/si35.svg si35 si35.svg svg 7209 ALTIMG 1-s2.0-S0306261922005189-si36.svg https://s3-eu-west-1.amazonaws.com/prod-ucs-content-store-eu-west/content/pii:S0306261922005189/image/svg+xml/9dd98124764a3247a6304d627cfc7dbe/si36.svg si36 si36.svg svg 8016 ALTIMG 1-s2.0-S0306261922005189-si37.svg https://s3-eu-west-1.amazonaws.com/prod-ucs-content-store-eu-west/content/pii:S0306261922005189/image/svg+xml/d29430ba3241187cf194e2bed0e01cff/si37.svg si37 si37.svg svg 3606 ALTIMG 1-s2.0-S0306261922005189-si38.svg https://s3-eu-west-1.amazonaws.com/prod-ucs-content-store-eu-west/content/pii:S0306261922005189/image/svg+xml/59bbd1dd213e7bd492c9f8c4fcd490fa/si38.svg si38 si38.svg svg 21620 ALTIMG 1-s2.0-S0306261922005189-si39.svg https://s3-eu-west-1.amazonaws.com/prod-ucs-content-store-eu-west/content/pii:S0306261922005189/image/svg+xml/18bc983f4e9126937a2dae8453fed8b3/si39.svg si39 si39.svg svg 21681 ALTIMG 1-s2.0-S0306261922005189-si4.svg https://s3-eu-west-1.amazonaws.com/prod-ucs-content-store-eu-west/content/pii:S0306261922005189/image/svg+xml/19a3b54e69923697be04fa7cb475373b/si4.svg si4 si4.svg svg 1276 ALTIMG 1-s2.0-S0306261922005189-si40.svg https://s3-eu-west-1.amazonaws.com/prod-ucs-content-store-eu-west/content/pii:S0306261922005189/image/svg+xml/e7a43d97b529df20ead404a64ed787b4/si40.svg si40 si40.svg svg 28797 ALTIMG 1-s2.0-S0306261922005189-si41.svg https://s3-eu-west-1.amazonaws.com/prod-ucs-content-store-eu-west/content/pii:S0306261922005189/image/svg+xml/57363024756c3a556abcc8d2fd7d60ef/si41.svg si41 si41.svg svg 18502 ALTIMG 1-s2.0-S0306261922005189-si42.svg https://s3-eu-west-1.amazonaws.com/prod-ucs-content-store-eu-west/content/pii:S0306261922005189/image/svg+xml/be2a3cd8088295647b1bc79fe5abe6e1/si42.svg si42 si42.svg svg 27140 ALTIMG 1-s2.0-S0306261922005189-si43.svg https://s3-eu-west-1.amazonaws.com/prod-ucs-content-store-eu-west/content/pii:S0306261922005189/image/svg+xml/8632f1ec1d4c1b0f77bd287f1a63b2b7/si43.svg si43 si43.svg svg 19215 ALTIMG 1-s2.0-S0306261922005189-si44.svg https://s3-eu-west-1.amazonaws.com/prod-ucs-content-store-eu-west/content/pii:S0306261922005189/image/svg+xml/b2e6e8c42840f536ec1c7fef538645d9/si44.svg si44 si44.svg svg 24220 ALTIMG 1-s2.0-S0306261922005189-si45.svg https://s3-eu-west-1.amazonaws.com/prod-ucs-content-store-eu-west/content/pii:S0306261922005189/image/svg+xml/a53d9bf20a13f1bc8634f0852aa831bc/si45.svg si45 si45.svg svg 10186 ALTIMG 1-s2.0-S0306261922005189-si46.svg https://s3-eu-west-1.amazonaws.com/prod-ucs-content-store-eu-west/content/pii:S0306261922005189/image/svg+xml/f50e36cde30463edbae07460a1a2b383/si46.svg si46 si46.svg svg 41567 ALTIMG 1-s2.0-S0306261922005189-si47.svg https://s3-eu-west-1.amazonaws.com/prod-ucs-content-store-eu-west/content/pii:S0306261922005189/image/svg+xml/6fdcb388394fbc8697befd50304780e8/si47.svg si47 si47.svg svg 3906 ALTIMG 1-s2.0-S0306261922005189-si48.svg https://s3-eu-west-1.amazonaws.com/prod-ucs-content-store-eu-west/content/pii:S0306261922005189/image/svg+xml/18bb7392fcc93e6745fd94d1a352235b/si48.svg si48 si48.svg svg 4776 ALTIMG 1-s2.0-S0306261922005189-si49.svg https://s3-eu-west-1.amazonaws.com/prod-ucs-content-store-eu-west/content/pii:S0306261922005189/image/svg+xml/1244fe21838be0d2a8fffdf3dbd8eafe/si49.svg si49 si49.svg svg 2217 ALTIMG 1-s2.0-S0306261922005189-si5.svg https://s3-eu-west-1.amazonaws.com/prod-ucs-content-store-eu-west/content/pii:S0306261922005189/image/svg+xml/3ffbac19cc00b3cae9a81271e13243f2/si5.svg si5 si5.svg svg 6273 ALTIMG 1-s2.0-S0306261922005189-si50.svg https://s3-eu-west-1.amazonaws.com/prod-ucs-content-store-eu-west/content/pii:S0306261922005189/image/svg+xml/74574be42a8c30deeaa9147a5932d6da/si50.svg si50 si50.svg svg 3959 ALTIMG 1-s2.0-S0306261922005189-si51.svg https://s3-eu-west-1.amazonaws.com/prod-ucs-content-store-eu-west/content/pii:S0306261922005189/image/svg+xml/122b836869c6171f5da3220e0a90f8c3/si51.svg si51 si51.svg svg 12110 ALTIMG 1-s2.0-S0306261922005189-si52.svg https://s3-eu-west-1.amazonaws.com/prod-ucs-content-store-eu-west/content/pii:S0306261922005189/image/svg+xml/fc4f5287bcd3161b350af220594177b5/si52.svg si52 si52.svg svg 8424 ALTIMG 1-s2.0-S0306261922005189-si53.svg https://s3-eu-west-1.amazonaws.com/prod-ucs-content-store-eu-west/content/pii:S0306261922005189/image/svg+xml/dab16104b4a8f22e7853a1fbe2eebe8d/si53.svg si53 si53.svg svg 31119 ALTIMG 1-s2.0-S0306261922005189-si54.svg https://s3-eu-west-1.amazonaws.com/prod-ucs-content-store-eu-west/content/pii:S0306261922005189/image/svg+xml/ff4ca1574b223ec1b636efcc90b437e5/si54.svg si54 si54.svg svg 18508 ALTIMG 1-s2.0-S0306261922005189-si55.svg https://s3-eu-west-1.amazonaws.com/prod-ucs-content-store-eu-west/content/pii:S0306261922005189/image/svg+xml/53ecd6db35e3a51cfc934e99b615dfe3/si55.svg si55 si55.svg svg 21751 ALTIMG 1-s2.0-S0306261922005189-si56.svg https://s3-eu-west-1.amazonaws.com/prod-ucs-content-store-eu-west/content/pii:S0306261922005189/image/svg+xml/7edfe96960079d542feeeb681a4b7ed8/si56.svg si56 si56.svg svg 3986 ALTIMG 1-s2.0-S0306261922005189-si57.svg https://s3-eu-west-1.amazonaws.com/prod-ucs-content-store-eu-west/content/pii:S0306261922005189/image/svg+xml/a6e73cb1d6c6fcd42b45a7bed76ad555/si57.svg si57 si57.svg svg 8124 ALTIMG 1-s2.0-S0306261922005189-si58.svg https://s3-eu-west-1.amazonaws.com/prod-ucs-content-store-eu-west/content/pii:S0306261922005189/image/svg+xml/8d733e3a12cc0ed59b25470e33f13871/si58.svg si58 si58.svg svg 4990 ALTIMG 1-s2.0-S0306261922005189-si59.svg https://s3-eu-west-1.amazonaws.com/prod-ucs-content-store-eu-west/content/pii:S0306261922005189/image/svg+xml/bcb36fa44f748428fa909a65ce2a78cc/si59.svg si59 si59.svg svg 2745 ALTIMG 1-s2.0-S0306261922005189-si6.svg https://s3-eu-west-1.amazonaws.com/prod-ucs-content-store-eu-west/content/pii:S0306261922005189/image/svg+xml/c95c22ee153211883bea166511adfb84/si6.svg si6 si6.svg svg 6273 ALTIMG 1-s2.0-S0306261922005189-si60.svg https://s3-eu-west-1.amazonaws.com/prod-ucs-content-store-eu-west/content/pii:S0306261922005189/image/svg+xml/9896917d43aa65cd788b984472ace9a4/si60.svg si60 si60.svg svg 10383 ALTIMG 1-s2.0-S0306261922005189-si61.svg https://s3-eu-west-1.amazonaws.com/prod-ucs-content-store-eu-west/content/pii:S0306261922005189/image/svg+xml/39e92711e30563efc61a72bfb4ea7cd2/si61.svg si61 si61.svg svg 7024 ALTIMG 1-s2.0-S0306261922005189-si62.svg https://s3-eu-west-1.amazonaws.com/prod-ucs-content-store-eu-west/content/pii:S0306261922005189/image/svg+xml/fa1377340afed95deece65cd80876788/si62.svg si62 si62.svg svg 7449 ALTIMG 1-s2.0-S0306261922005189-si63.svg https://s3-eu-west-1.amazonaws.com/prod-ucs-content-store-eu-west/content/pii:S0306261922005189/image/svg+xml/f7eaee56705c46ceff981ae3c18d03f7/si63.svg si63 si63.svg svg 7950 ALTIMG 1-s2.0-S0306261922005189-si64.svg https://s3-eu-west-1.amazonaws.com/prod-ucs-content-store-eu-west/content/pii:S0306261922005189/image/svg+xml/a38c8af6cec3628796946fe10ce7764c/si64.svg si64 si64.svg svg 3430 ALTIMG 1-s2.0-S0306261922005189-si65.svg https://s3-eu-west-1.amazonaws.com/prod-ucs-content-store-eu-west/content/pii:S0306261922005189/image/svg+xml/771c3d44b8bcbb983c9f5184ca980c69/si65.svg si65 si65.svg svg 9573 ALTIMG 1-s2.0-S0306261922005189-si66.svg https://s3-eu-west-1.amazonaws.com/prod-ucs-content-store-eu-west/content/pii:S0306261922005189/image/svg+xml/c23d06e829f6f3078ff20c8b933da0ad/si66.svg si66 si66.svg svg 17894 ALTIMG 1-s2.0-S0306261922005189-si67.svg https://s3-eu-west-1.amazonaws.com/prod-ucs-content-store-eu-west/content/pii:S0306261922005189/image/svg+xml/e3344112b8e4786fb579e4d6203260cb/si67.svg si67 si67.svg svg 3054 ALTIMG 1-s2.0-S0306261922005189-si68.svg https://s3-eu-west-1.amazonaws.com/prod-ucs-content-store-eu-west/content/pii:S0306261922005189/image/svg+xml/70ad86ab3fca233654e67e2639aa838c/si68.svg si68 si68.svg svg 6296 ALTIMG 1-s2.0-S0306261922005189-si69.svg https://s3-eu-west-1.amazonaws.com/prod-ucs-content-store-eu-west/content/pii:S0306261922005189/image/svg+xml/a96cf99e726c060879cfdcf3bdfe205d/si69.svg si69 si69.svg svg 4777 ALTIMG 1-s2.0-S0306261922005189-si7.svg https://s3-eu-west-1.amazonaws.com/prod-ucs-content-store-eu-west/content/pii:S0306261922005189/image/svg+xml/f0b30ddcd63a4a2aa1526b29d0fd002e/si7.svg si7 si7.svg svg 5202 ALTIMG 1-s2.0-S0306261922005189-si70.svg https://s3-eu-west-1.amazonaws.com/prod-ucs-content-store-eu-west/content/pii:S0306261922005189/image/svg+xml/882bd277d6afb899cb3e9e50a0268830/si70.svg si70 si70.svg svg 4880 ALTIMG 1-s2.0-S0306261922005189-si71.svg https://s3-eu-west-1.amazonaws.com/prod-ucs-content-store-eu-west/content/pii:S0306261922005189/image/svg+xml/21fc2e3d6f444504d6230be7107f603b/si71.svg si71 si71.svg svg 5882 ALTIMG 1-s2.0-S0306261922005189-si72.svg https://s3-eu-west-1.amazonaws.com/prod-ucs-content-store-eu-west/content/pii:S0306261922005189/image/svg+xml/a45e6d52e67ac4885fac6cbc8e546bd2/si72.svg si72 si72.svg svg 9912 ALTIMG 1-s2.0-S0306261922005189-si73.svg https://s3-eu-west-1.amazonaws.com/prod-ucs-content-store-eu-west/content/pii:S0306261922005189/image/svg+xml/39b1d98e3c36c4287ffe3061e36423f5/si73.svg si73 si73.svg svg 6139 ALTIMG 1-s2.0-S0306261922005189-si74.svg https://s3-eu-west-1.amazonaws.com/prod-ucs-content-store-eu-west/content/pii:S0306261922005189/image/svg+xml/0c8351fa109d04d561d56e9a6d6a4bdb/si74.svg si74 si74.svg svg 6141 ALTIMG 1-s2.0-S0306261922005189-si75.svg https://s3-eu-west-1.amazonaws.com/prod-ucs-content-store-eu-west/content/pii:S0306261922005189/image/svg+xml/d4554c8cb7ca9c43a3e968fb1abc73a9/si75.svg si75 si75.svg svg 2904 ALTIMG 1-s2.0-S0306261922005189-si76.svg https://s3-eu-west-1.amazonaws.com/prod-ucs-content-store-eu-west/content/pii:S0306261922005189/image/svg+xml/a9950b88151f4e3dfab29515b337de6b/si76.svg si76 si76.svg svg 10872 ALTIMG 1-s2.0-S0306261922005189-si77.svg https://s3-eu-west-1.amazonaws.com/prod-ucs-content-store-eu-west/content/pii:S0306261922005189/image/svg+xml/8eeb42bccb11064528f6b40617659a99/si77.svg si77 si77.svg svg 6541 ALTIMG 1-s2.0-S0306261922005189-si78.svg https://s3-eu-west-1.amazonaws.com/prod-ucs-content-store-eu-west/content/pii:S0306261922005189/image/svg+xml/1460b155dd79c8a73b8d30df7b37ff73/si78.svg si78 si78.svg svg 879 ALTIMG 1-s2.0-S0306261922005189-si79.svg https://s3-eu-west-1.amazonaws.com/prod-ucs-content-store-eu-west/content/pii:S0306261922005189/image/svg+xml/4325f296455991e5237955ca0e821743/si79.svg si79 si79.svg svg 11341 ALTIMG 1-s2.0-S0306261922005189-si8.svg https://s3-eu-west-1.amazonaws.com/prod-ucs-content-store-eu-west/content/pii:S0306261922005189/image/svg+xml/b9ad798c97da3e5b56c7b5070fa7d63b/si8.svg si8 si8.svg svg 4609 ALTIMG 1-s2.0-S0306261922005189-si80.svg https://s3-eu-west-1.amazonaws.com/prod-ucs-content-store-eu-west/content/pii:S0306261922005189/image/svg+xml/070c76ec5e6fb5bec1b641cff1e224c3/si80.svg si80 si80.svg svg 34752 ALTIMG 1-s2.0-S0306261922005189-si81.svg https://s3-eu-west-1.amazonaws.com/prod-ucs-content-store-eu-west/content/pii:S0306261922005189/image/svg+xml/eb789118882fc108404cdf8593703dd4/si81.svg si81 si81.svg svg 12772 ALTIMG 1-s2.0-S0306261922005189-si82.svg https://s3-eu-west-1.amazonaws.com/prod-ucs-content-store-eu-west/content/pii:S0306261922005189/image/svg+xml/ac8c68f10af95fc1a1a0abf4699cf0b9/si82.svg si82 si82.svg svg 5855 ALTIMG 1-s2.0-S0306261922005189-si83.svg https://s3-eu-west-1.amazonaws.com/prod-ucs-content-store-eu-west/content/pii:S0306261922005189/image/svg+xml/dfb3b4273140ee0361414f5fa355b404/si83.svg si83 si83.svg svg 8529 ALTIMG 1-s2.0-S0306261922005189-si84.svg https://s3-eu-west-1.amazonaws.com/prod-ucs-content-store-eu-west/content/pii:S0306261922005189/image/svg+xml/0497e26db57fb96168ce4cc726bf6d07/si84.svg si84 si84.svg svg 2855 ALTIMG 1-s2.0-S0306261922005189-si85.svg https://s3-eu-west-1.amazonaws.com/prod-ucs-content-store-eu-west/content/pii:S0306261922005189/image/svg+xml/94e6a9d4c546313d280fe3ff15d91240/si85.svg si85 si85.svg svg 7762 ALTIMG 1-s2.0-S0306261922005189-si86.svg https://s3-eu-west-1.amazonaws.com/prod-ucs-content-store-eu-west/content/pii:S0306261922005189/image/svg+xml/35052fb9506fcfbad1f013691a1889d0/si86.svg si86 si86.svg svg 2814 ALTIMG 1-s2.0-S0306261922005189-si87.svg https://s3-eu-west-1.amazonaws.com/prod-ucs-content-store-eu-west/content/pii:S0306261922005189/image/svg+xml/827e1975df9d1e01de59a73dbfeaf99e/si87.svg si87 si87.svg svg 4032 ALTIMG 1-s2.0-S0306261922005189-si88.svg https://s3-eu-west-1.amazonaws.com/prod-ucs-content-store-eu-west/content/pii:S0306261922005189/image/svg+xml/06ea6aeadc852fd7830a423e20047687/si88.svg si88 si88.svg svg 9751 ALTIMG 1-s2.0-S0306261922005189-si89.svg https://s3-eu-west-1.amazonaws.com/prod-ucs-content-store-eu-west/content/pii:S0306261922005189/image/svg+xml/20d5b9592e09b79f1ffd5357b7a2a598/si89.svg si89 si89.svg svg 2929 ALTIMG 1-s2.0-S0306261922005189-si9.svg https://s3-eu-west-1.amazonaws.com/prod-ucs-content-store-eu-west/content/pii:S0306261922005189/image/svg+xml/eafc88754165530bed3a6c2def1e718d/si9.svg si9 si9.svg svg 4907 ALTIMG 1-s2.0-S0306261922005189-si90.svg https://s3-eu-west-1.amazonaws.com/prod-ucs-content-store-eu-west/content/pii:S0306261922005189/image/svg+xml/cbbd92b803ea07be502bde737ed9eb43/si90.svg si90 si90.svg svg 9508 ALTIMG 1-s2.0-S0306261922005189-si91.svg https://s3-eu-west-1.amazonaws.com/prod-ucs-content-store-eu-west/content/pii:S0306261922005189/image/svg+xml/5c14148fe797fc2ee2e7b57f229d3ef5/si91.svg si91 si91.svg svg 5655 ALTIMG 1-s2.0-S0306261922005189-si92.svg https://s3-eu-west-1.amazonaws.com/prod-ucs-content-store-eu-west/content/pii:S0306261922005189/image/svg+xml/4895a9caf0f07ffe38f7cfaa50506b55/si92.svg si92 si92.svg svg 9566 ALTIMG 1-s2.0-S0306261922005189-si93.svg https://s3-eu-west-1.amazonaws.com/prod-ucs-content-store-eu-west/content/pii:S0306261922005189/image/svg+xml/eb8c12c2371b530c5081d449874c81ce/si93.svg si93 si93.svg svg 6028 ALTIMG 1-s2.0-S0306261922005189-si94.svg https://s3-eu-west-1.amazonaws.com/prod-ucs-content-store-eu-west/content/pii:S0306261922005189/image/svg+xml/f387ff9d752ca2227948eba414dec752/si94.svg si94 si94.svg svg 8086 ALTIMG 1-s2.0-S0306261922005189-si95.svg https://s3-eu-west-1.amazonaws.com/prod-ucs-content-store-eu-west/content/pii:S0306261922005189/image/svg+xml/b1b798d265532d27508ad87397899def/si95.svg si95 si95.svg svg 7746 ALTIMG 1-s2.0-S0306261922005189-si96.svg https://s3-eu-west-1.amazonaws.com/prod-ucs-content-store-eu-west/content/pii:S0306261922005189/image/svg+xml/6b79108cc6c737c3c970043e4f238675/si96.svg si96 si96.svg svg 4329 ALTIMG 1-s2.0-S0306261922005189-si97.svg https://s3-eu-west-1.amazonaws.com/prod-ucs-content-store-eu-west/content/pii:S0306261922005189/image/svg+xml/2ec8a46a75608c1a06b2b11ba1ac0d41/si97.svg si97 si97.svg svg 4658 ALTIMG 1-s2.0-S0306261922005189-si98.svg https://s3-eu-west-1.amazonaws.com/prod-ucs-content-store-eu-west/content/pii:S0306261922005189/image/svg+xml/8a84d929de7cd73ced6914a225603841/si98.svg si98 si98.svg svg 7637 ALTIMG 1-s2.0-S0306261922005189-si99.svg https://s3-eu-west-1.amazonaws.com/prod-ucs-content-store-eu-west/content/pii:S0306261922005189/image/svg+xml/4ab20dd12e0b2d2db76509496d570180/si99.svg si99 si99.svg svg 7972 ALTIMG 1-s2.0-S0306261922005189-am.pdf am am.pdf pdf 1220539 AAM-PDF https://s3-eu-west-1.amazonaws.com/prod-ucs-content-store-eu-west/content/egi:10VW0M5HSXM/MAIN/application/pdf/4f97bf50ae84aad4ee0e4a91f3eff9c8/am.pdf APEN 119142 119142 S0306-2619(22)00518-9 10.1016/j.apenergy.2022.119142 The Authors Fig. 1 Operation cycle of shiftable load j consisting of d j stages with power g jr required at each stage r . Fig. 2 AC thermostat hysteresis behavior (heating mode). Fig. 3 Control of the lower bound of the thermostat (heating mode) at each time t of T. Fig. 4 Grid to home power ( P t G 2 H ) and home to grid ( P t H 2 G ) power. Fig. 5 Evolution of static ( E B , t ) and EV ( E V , t ) battery charge. Fig. 6 Evolution of the indoor temperature ( θ t in ) and the EWH temperature ( τ t ). Table 1 Comparison of the shiftable load optimization models. M1 M2 M3 # Binary var 110,925 1008 1008 Runtime (s) 91.238 1.952 0.162 Table 2 Results for the overall model with different comfort parameterizations (5-minute runtime). MIP gap Cost Cost improvement Original model 0.0107 4.0714 --- θ min = 19 °C instead of 20 °C 0.0105 3.9451 3.1% τ min = 43 °C instead of 45 °C 0.0104 3.9945 1.9% E V req = 30 kWh instead of 32 kWh 0.0114 3.7571 7.7% θ min = 19 °C and τ min = 43 °C 0.0106 3.8699 4.9% θ min = 19 °C, τ min = 43 °C and E V req = 30 kWh 0.0114 3.5572 12.6% A comprehensive and modular set of appliance operation MILP models for demand response optimization Carlos Henggeler Antunes Writing \u2013 original draft Investigation Conceptualization Data curation a b \u204e Maria João Alves Writing \u2013 review & editing Investigation Conceptualization a c Inês Soares Writing \u2013 review & editing Investigation Software a a INESC Coimbra, DEEC, Rua Sílvio Lima, Pólo II, Coimbra 3030-290, Portugal INESC Coimbra DEEC Rua Sílvio Lima Pólo II Coimbra 3030-290 Portugal INESC Coimbra, DEEC, Rua Sílvio Lima, Pólo II, Coimbra 3030-290, Portugal b Department of Electrical and Computer Engineering, University of Coimbra, Rua Sílvio Lima, Pólo II, Coimbra 3030-290, Portugal Department of Electrical and Computer Engineering University of Coimbra Rua Sílvio Lima Pólo II Coimbra 3030-290 Portugal Department of Electrical and Computer Engineering, University of Coimbra, Rua Sílvio Lima, Pólo II, Coimbra 3030-290, Portugal c CeBER and Faculty of Economics, University of Coimbra, Av. Dias da Silva 165, Coimbra 3004-512, Portugal CeBER and Faculty of Economics University of Coimbra Av. Dias da Silva 165 Coimbra 3004-512 Portugal CeBER and Faculty of Economics, University of Coimbra, Av. Dias da Silva 165, Coimbra 3004-512, Portugal \u204e Corresponding author. Demand response programs are essential to enable accommodating larger shares of variable power generation based on renewable sources, the deployment of which is imperative for decarbonizing the economy and mitigating global warming. Consumers/prosumers are increasingly exposed to and may benefit from time-differentiated energy prices aimed to induce changes in regular consumption patterns. These changes are also beneficial for retailers and grid operators in face of the variability of wholesale market prices, renewable energy availability and grid conditions. The optimization models to be implemented in autonomous home energy management systems require a rigorous modeling of appliance operation to generate effective load scheduling solutions, respecting their physical operation principles and use patterns in everyday life. A balance should be sought between the detail level of optimization models and the computational requirements to generate usable solutions having in mind their implementation in low-cost processors. This paper presents a comprehensive and modular set of mixed-integer linear programming models aimed at enabling their seamless incorporation in home energy management systems, allowing for the integrated optimization of all energy resources (exchanges with the grid, load management, electric vehicle and stationary battery, local microgeneration). Detailed energy consumption optimization models for shiftable, interruptible and thermostatic loads are presented, also including the power cost component and ways of dealing with user's discomfort. The modular models are presented in a building block manner enhancing the flexibility of their utilization in overall models with different objective functions encompassing the economic and comfort dimensions. Computational results are presented for a case study using actual data, which considers a time-of-use tariff with six periods. In addition to comparing with a plain tariff scheme, different consumer profiles are simulated to assess the impact of comfort requirements on cost. These results show that whenever consumers have the flexibility to change their consumption patterns, they are able to lower the net electricity bill by having an energy management system endowed with the models herein proposed to make optimized decisions on their behalf. Keywords Demand-side management Load modeling Demand response Mixed-integer linear programming (MILP) models 1 Introduction The increasing deployment of distributed generation based on renewable sources is essential to decarbonize the economy, mitigate global warming and, in countries without endogenous fossil resources, reduce the energy external dependence. Distinct, and sometimes conflicting, trends contribute to shaping the energy transition underway. The electrification of the transportation sector, including private and fleet vehicles, requires the ubiquitous deployment of battery chargers, including fast and superfast ones. Comfort requirements in buildings lead to increasing climatization loads. Consumers have a more active role in managing their energy resources, becoming prosumers who should globally optimize exchanges with the grid, load management, local microgeneration (namely rooftop photovoltaics, PV) and storage assets (static and electric vehicle batteries). The traditional grid, based on the supply follows load paradigm, is steadily evolving to smart grids facilitating a load follows supply operation, with the widespread deployment of sensing and control equipment particularly in the distribution grid, including smart meters at the customer premises offering bidirectional communication with the grid. This technological infrastructure and the amount of data it enables to gather allow for a more efficient grid management. In this setting, all tariff components (energy, power, network use) can become time-differentiated according to the variability of wholesale market prices, renewable energy availability and grid conditions (e.g., congestion in distribution transformers), thus inducing adequate changes in consumption patterns. Therefore, in face of these pervasive trends, demand response programs play a key role in the energy transition, offering potential benefits to multiple players. Demand response programs may be broadly categorized as price-based and incentive-based. Price-based refers to time-differentiated rates that may display large variations leading consumers to modify load operation schedule to obtain bill savings without jeopardizing comfort. Incentive-based refers to schemes as direct load control, interruptible load contracts, peak time rebate, demand bidding/buy back emergency programs, capacity and ancillary service markets. Consumers can reduce the electricity bill adjusting consumption patterns by making the most of the integrated optimization of all energy resources according to their flexibility regarding the provision of the energy services required (laundry, hot water, electric mobility, etc.). Retailers can profit from offering a portfolio of time-differentiated tariffs to distinct consumer segments by making the most of the difference between wholesale and retail prices. Aggregators can develop new business models to provide demand response capability as a service to the grid. Grid operators can avoid power peaks, reducing losses and avoiding/postponing expensive network reinforcements. Generators can prevent operating expensive and less environmentally friendly peaking units. The literature on simulation and optimization models devoted to the implementation of demand response is abundant. We mention some pertinent review papers offering extensive perspectives in the field with distinct emphases, as well as selected references of recent works proposing optimization models with different scopes and depth regarding appliance physical modelling. Siano [1] presents a survey of demand response potentials and benefits in smart grids, encompassing enabling technologies and systems, energy controllers and communication systems, including reference to industrial case studies and research projects. A broad review of demand response in smart grids is made in [2], which can be categorized according to control mechanisms (centralized vs. decentralized), stimuli (price vs. incentive based) and decisions (task scheduling vs. energy management). A review mainly from the standpoint of the optimization models and methods is offered in [3]. Beaudin and Zareipour [4] offer a literature review of modelling optimal scheduling of residential energy resources, considering device heterogeneity, occupants\u2019 objectives, consumption uncertainty and infrastructure implications, including methods as mathematical optimization, model predictive control, and heuristic control. The authors recognize the need to create a baseline for Home Energy Management Systems (HEMS) evaluation, allowing for modelling household devices and comfort, as well as providing data as consumption and occupancy patterns, and PV generation. Hussain and Gao [5] offer a review of demand response programs and propose a communication and computation-based demand response program for future grid systems, considering an inclined-block tariff and the consumers\u2019 income and consumption profiles. Morales-España et al. [6] address demand response mainly from the power system perspective, including definitions and classifications of different types of demand response, the products and services it can provide for energy, capacity and ancillary services. The authors also present simple optimization models for aggregated flexible load management involving curtailment and/or shifting. Several authors proposed specific optimization models for demand response. Althaher et al. [7] consider that it is critical including in the models consumer satisfaction (e.g., volume of curtailed energy) in addition to minimizing electricity payments; however, the relation between the volume of curtailed energy and consumer\u2019s (dis)satisfaction is arguable since it should refer to the quality of the energy service being provided by loads (as proxied by hot water temperature, indoor comfort temperature, time of operation, etc.) and not to the volume of energy itself. The importance of reducing the computational complexity of the decision models embedded in energy management systems has been recognized in [8]. The aim is enabling the models to be solved on low-cost hardware to massify the implementation of HEMS. In [9], it is considered that a price-based model requires lower computational capabilities than an incentive-based model at the expense of less certainty of the response from the loads to the price signals. Nan et al. [10] propose a scheduling scheme for the dispatch of residential loads by an aggregator, considering the minimization of the electricity consumption cost, the peak load, the peak-valley difference and the users\u2019 discomfort, through which residential communities can participate in demand response programs. Adhikari et al. [11] present a direct load control approach for a set of heating, ventilation and air conditioning (HVAC) units to maximize the load reduction potential during a demand response period, considering indoor temperatures within individual consumers\u2019 preference bounds and transforming the control problem into a job scheduling problem. Shafie-Khah and Siano [12] present a stochastic model of a HEMS guaranteeing the users\u2019 satisfaction by means of a response fatigue index, also accounting for uncertainties of electric vehicles availability for charging/discharging and local renewable energy generation. Elkazaz et al. [13] present a hierarchical two-layer HEMS to minimize daily household energy costs by means of a model predictive controller using a mixed-integer linear programming (MILP) model to determine the operating schedule for shiftable domestic appliances and the profile for energy storage for the next 24 h, and maximize photovoltaic self-consumption using a rule-based real-time controller to determine the optimal settings of the battery storage system compensating for the effects of forecast uncertainties and sample time resolution. Javadi et al. [14] develop a self-scheduling model for a HEMS including a linear discomfort index encompassing the end-users\u2019 preferences in the daily operation of home appliances. The problem is modelled as a multi-objective MILP model, considering the minimization of the energy bill and the discomfort index to determine the optimal time slots for appliance operation. Zhang et al. [15] propose a conceptual architecture of a price-based demand response management controller implementing a multi-agent reinforcement learning-based algorithm to optimize the energy consumption of various devices. Mohseni et al. [16] develop an energy consumption model of home appliances based on the \u201cset of sequential uninterruptible energy phases\u201d approach, in a residential microgrid equipped with PV generation, battery storage systems and electric vehicles, to activate time-based demand response programs in day-ahead planning. Two fundamental dimensions are at stake for evaluating the merit of solutions to this type of models: minimizing cost and discomfort. The cost refers to energy and power costs and may also include a revenue component if selling back to the grid is allowed using some remuneration scheme. Energy costs (\u20ac/kWh) result from a time-of-use (ToU) tariff scheme contracted between the retailer and the consumer for a specified period (e.g., one year), which can be dynamic in the sense of being announced at short notice (for instance, 24 or 48-hour ahead). Power costs (\u20ac/kW per day) result from a contracted limit power or a scheme in which the consumer pays for the maximum power taken during a certain period (e.g., one hour or one day). The discomfort can be assessed by means of several axes associated with the quality of the energy service to be provided: time, regarding the most preferred periods for the operation of some appliances (e.g., washing machine); temperature, concerning the comfort ranges for indoor or water temperatures; state of charge of electric vehicle (or static) battery. The cost and discomfort dimensions can be incorporated in the models by means of objective functions to be minimized, as constraints or in a mixed way. The model can consider an objective function minimizing costs of energy and power subject to constraints expressing the comfort thresholds acceptable by the consumer, which would indicate a more economic-oriented consumer. The model can, instead, consider an objective function minimizing discomfort, in general representing deviations from a user-specified comfort setting or range, e.g., number of minutes of load operation postponement beyond the desired time, indoor/water temperature outside a desired range, or state of charge of the electric vehicle battery below the required value. The discomfort can also be monetized, i.e., the cost assigned by the consumer to a certain postponement in operation or temperature degree above/below the preferred setting, subject to a budget constraint. The monetization of discomfort allows for considering an overall cost objective function involving different components. Moreover, multiobjective models explicitly considering cost and discomfort objective functions can be developed, which enable deriving a Pareto optimal frontier of solutions displaying different tradeoffs between the competing objectives [17]. Some approaches consider a utility function to be maximized, which is a proxy for the level of satisfaction with the energy services delivered, in general directly associated with (the perceived benefit of) energy consumption, or a disutility cost associated with the load suppressed [18]. Quadratic utility functions are often used to model individual consumer\u2019s preferences, displaying linear decreasing marginal benefit related to energy consumption [19,20]. However, the elicitation of realistic utility functions characterizing the consumer\u2019s satisfaction, as a result of the energy consumed by each appliance providing an energy service, is problematic in practice and does not capture explicitly the decisions at appliance level. The use of functions penalizing the deviation to an expected \u201coptimal\u201d consumption value is also not representative of users\u2019 energy behaviors. Hence, demand response optimization models ought to incorporate the physical characteristics and type of control of each load, as well as typical operation patterns, time slots and comfort settings preferred for operation. A compromise should be established between the accurate load operation and control modeling and the computational effort to solve the models, particularly with fine-grain time discretization, due to the models\u2019 combinatorial nature. The integrated optimization of all energy resources (exchanges with the grid, loads, storage, microgeneration) requires the design of Autonomous Home Energy Management Systems (AHEMS) located behind the meter, which are endowed with optimization models and algorithms capable of making 24/7 decisions on the consumer\u2019s behalf. For this purpose, it is necessary to develop thorough load operation mathematical programming models to be tackled by optimization algorithms so that effective operational solutions are obtained. These models should respect the physical operation and control principles of the appliances as well as their habitual utilization patterns in everyday life. The accurate physical-based load operation modelling may require many binary variables and constraints, which makes more difficult to obtain an optimal solution (single objective models) or Pareto optimal solutions (multiple objective models) in an acceptable computation time. Therefore, a balance should be sought between the modeling detail level and the computational requirements to obtain practical solutions, having in mind their implementation in AHEMS running on low-cost processors. According to the type of control, residential loads can be categorized in shiftable (the operation cycle cannot be interrupted), interruptible (can be interrupted and resume operation at a later stage), and thermostatic (controlled by a state variable such as indoor temperature) loads [21]. Although the literature in optimization models for demand response is vast, many models presented in the literature consider a number of simplifications that deviate them from the reality. Thus, there is a lack of effective physical-based models. The models we present in this paper are the result of an in-depth study of the appliance operation, taking into account several parameters such as: operation cycles requiring different power at different stages, the behavior of a thermostat with hysteresis, main principles of heat transfer in buildings, etc. The main contributions of this paper are the following: - development of a comprehensive and modular set of MILP models of appliance operation that are aimed at being seamlessly incorporated in AHEMS allowing for the integrated optimization of all energy resources; - development of detailed energy consumption models for each load category; - consideration of different cost objective function components (energy and power costs, and monetized discomfort) as well as ways of dealing with the possible user\u2019s discomfort derived from operating appliances out of the habitual periods/settings and/or temperature ranges; - assessment of the computational efficiency in real settings considering a fine-grain time discretization (1 min); - for shiftable loads, alternative models have been developed and compared to determine the most efficient one; - the modular models are developed in a building block manner enhancing the flexibility of their utilization in overall models with different objectives encompassing the economic and comfort dimensions. To the best of our knowledge, such a consistent and complete set of models is for the first time presented in the literature, which includes the accurate modeling of a large diversity of energy resources and exchanges with the grid (buying and selling electricity) that can be used according to different needs. This work contributes for the development of reliable AHEMS that can be parameterized with the user\u2019s preferences to optimally manage all energy resources on behalf of consumers engaged in profiting from the benefits of demand response programs. Moreover, the detailed optimization models are key to retailers interested in offering time-of-use tariff schemes to anticipate the consumers\u2019 reaction, which is an essential step for tariff design (prices and time periods in which they apply) [22]. Section 2 presents the materials and methods, establishing a common framework for the modular models presented in the subsequent sections. Section 3 is devoted to specific models for: 1) shiftable loads, 2) electric water heater model including sanitary constraints, 3) air conditioner based on the indoor temperature dynamics, 4) static and electric vehicle batteries. An overall optimization model is presented in Section 4 encompassing exchanges (buying, selling) with the grid, shiftable loads, electric water heater, air conditioner, static and electric vehicle batteries, as well as microgeneration. The overall model was applied to a case study, including a comparison of a ToU tariff and a plain tariff equal to the average price of the ToU tariff. A sensitivity analysis is also carried out to assess the impacts on cost of consumers being more or less willing to tolerate some discomfort, e.g., changing the minimum allowable indoor temperature or the reference hot water temperature. The main conclusions are drawn in Section 5. 2 Materials and methods Specific accurate models are developed for shiftable loads, electric water heater (EWH), air conditioner system (AC), static battery and electric vehicle (EV) battery. The planning period (e.g., one day) is discretized in time intervals with equal length. Shiftable loads are characterized by an operation cycle associated with each program (energy service), which cannot be interrupted. Examples are laundry machines, dishwashers and cloth dryers. Models considering that an appliance is supplied with a given amount of energy for service completion (as if the power required was constant, instead of a load diagram with diversified stages) are rather simplistic and ultimately useless for optimization purposes. The consideration of the operation cycle (e.g., in a laundry machine, consisting of heating water, spinning and drying phases) is essential because this is the actual physical functioning and the power required at each phase is significantly different. Therefore, for each shiftable load, in the models proposed herein, \u2022 the technical inputs are the operation cycle duration and the power required at each operation stage; \u2022 the consumer should provide the comfort time slots for load operation according to his/her preferences, which may be disjoint in the planning period; \u2022 the optimization determines the starting operation time and guarantees that the cycle is entirely executed in the due sequence within any of the comfort time slots, correctly mapping the operation cycle onto the planning period. In our previous works, the model we developed to accurately representing the functioning of shiftable appliances requires a high number of binary variables and constraints (the model was first proposed in [23] and also used in other works, e.g. in [24]). We propose herein two alternative more efficient models, which will be compared with the former one. The EWH is an important load in most homes, accounting for a significant share of energy consumption. The appliance rated power may vary in a large range from 1500 W to 6000 W depending on the volume, which should be adapted to the number and habits of inhabitants. The EWH operation is controlled by a thermostat. In our previous works, the EWH has been dealt with in a more straightforward manner as an interruptible appliance, i.e., a certain amount of energy (a surrogate for the quality of service provided by hot water) should be supplied in a certain comfort time slot, so that the control was modeled using binary variables stating the on/off supply status [24]. The present model considers the water withdrawal and supply as well as sanitary constraints to avoid the formation of legionella bacteria, which requires heating the water to a safety temperature for a specified time. Therefore, in the EWH model proposed herein, \u2022 the technical inputs are the power of the heating element, the ambient and inlet water temperatures, the tank characteristics (capacity, thermal characteristics of the envelope), and the period during which the water should be heated up to a certain temperature to eliminate the bacteria; \u2022 the inputs provided by the consumer include the minimum and maximum allowed temperatures, and the water withdrawals (time and quantity); \u2022 the optimization determines the on/off status of the heating element, which defines the hot water temperature in the tank. HVAC systems contribute significantly to residential electrical energy consumption. The thermal inertia of indoor spaces makes these systems an appropriate target for control by making the most of time-differentiated tariffs and the flexibility of consumers to accept some deviation of the indoor temperature to the desired one for a limited period of time. The model developed in [25] is considered herein, which accounts for the behavior of the control thermostat with hysteresis of an AC system. In this model, \u2022 the technical inputs are the nominal power and the coefficient of performance of the AC, the outdoor temperature and the thermal characteristics of the building envelope; \u2022 the inputs provided by the consumer are the minimum and the maximum comfort indoor temperatures; \u2022 the optimization determines the on/off status of the AC, which defines the indoor temperature. The optimization of the operation of the static battery and the electric vehicle (EV) battery deals with the energy exchanges, to be integrated in the overall optimization of all energy resources. The static battery is, in principle, always available, whereas the EV battery is only available when the EV is at home and imposes further constraints in its utilization in vehicle to grid (V2G) mode considering the expected energy service (mobility) to be provided according to the consumer\u2019s needs. In the model proposed herein, \u2022 the technical inputs are the charging and discharging efficiencies, the minimum and maximum allowed battery charges, and the minimum and maximum charge and discharge powers; \u2022 the input set by the consumer is the battery charge requested at the departure time of the EV; \u2022 the optimization determines the charging and discharging patterns of the static and EV batteries. A base load not deemed for control and local PV generation are also considered in the overall model. From the optimization process of the overall model, it results the power required for the operation of the shiftable loads, the EWH and the AC, in each time interval, as well as the battery charge and discharge, and the exchanges between the grid and the home. We consider a planning period (e.g., one day) consisting of T time intervals each with a length Δ t , indexed by t = 1 , ⋯ , T . We denote as time t the interval from t - 1 to t . The length Δ t depends on the time discretization adopted (typical values are Δ t = 1 , 5 o r 15 min). In order to capture the actual operation of some appliances, namely the shiftable loads that have operation phases of short duration with a significant power required, a fine grain discretization (e.g., 1 min or 5 min) is advisable. In the analysis of the case study presented below, the planning period is discretized in intervals of 1 min, so Δ t = 1 / 60 h ; therefore, T = 1440 for a planning period of 24 h. A ToU tariff is used with 6 different pricing periods. These prices are input data, which are denoted in the models by C t buy . The objective function of the overall model applied to the case study in Section 4 consists of minimizing the net cost, also considering the power cost component associated with the peak power required from the grid. Models are of the MILP type due to the need of incorporating discrete variables to model on/off states, discrete operation power levels, and enforcing logical conditions to guarantee model consistency. Therefore, these models can be solved using a state-of-the-art MILP solver. In this work, the models were solved using the CPLEX solver. In this type of strongly combinatorial models with a large number of interdependent constraints but in which all the functions are linear, using a general MILP solver is advantageous over meta-heuristics because it can guarantee an optimal or near-optimal feasible solution. Experiments we have carried out using meta-heuristics customized for the modular models did not provide good results in terms of computational efficiency and solution quality. All the data necessary to reproduce the results of the case study presented in Section 4 are available at https://home.deec.uc.pt/~ch/data_DRmodels . All the results were obtained in a computer with an Intel Xeon Gold 6138 CPU@3.7 GHz processor. 3 Models for demand response optimization This section aims to present MILP models devoted to the different types of loads considering their physical operation principles and control modes: 1) shiftable loads, 2) electric water heater model including sanitary constraints, 3) air conditioner based on the indoor temperature dynamics, and 4) static and electric vehicle batteries. 3.1 Models for shiftable load operation Let us consider J shiftable loads indexed by j ∈ 1 , ⋯ , J , each one having a specific load diagram, as illustrated in Fig. 1 , for which the input data are: d j = duration of load j operation cycle; g jr = power requested by load j at stage (time) r of its operation cycle ( r = 1 , ⋯ , d j ). The actual operation cycle is, therefore, discretized according to the Δ t considered. Let [ T L j , ⋯ , T U j ] be the time slot allowed by the consumer for the operation of load j . In the first MILP model we proposed for shiftable appliances ([24,23]), the control is defined by binary variables with three indexes: w jrt = 1 if load j is on at stage r of its operation cycle in time t of the planning period (within the allowed time slot), and w jrt = 0 otherwise, i.e., it is off. The auxiliary variables P jt Sh (where the superscript Sh denotes \u201cshiftable\u201d) denote the power requested to the grid by shiftable load j in time t of the planning period (kW), j = 1 , ⋯ , J , t = 1 , ⋯ , T . The power P jt Sh is zero for t outside the allowed time slot [ T L j , ⋯ , T U j ]. The constraints modeling the load operation guarantee that: each load j operates exactly once at stage r and this should occur within its comfort time slot (1); at each time t of the planning period, each load j may be off or on only at one stage r of its operation cycle (2); if load j is on in time t and at stage r < d j of its operation cycle, then it must also be on in time t + 1 and stage r + 1 , for r = 1 , ⋯ , d j - 1 (3); load j should start its working cycle at most in time T U j - d j + 1 , thus assuring that it never finishes later than T U j (4). These constraints also ensure that load j will operate only once. Constraints (5) and (6) set the value of the power requested to the grid by each load j in each time t. This model (presented in [23]) is denoted as M1 below. (1) ∑ t = T L j T U j w jrt = 1 , j = 1 , ⋯ , J , r = 1 , ⋯ , d j (2) ∑ r = 1 d j w jrt ≤ 1 , j = 1 , ⋯ , J , t = T L j , ⋯ , T U j (3) w j r + 1 t + 1 ≥ w jrt , j = 1 , ⋯ , J , r = 1 , ⋯ , d j - 1 , t = T L j , ⋯ , T U j - 1 (4) ∑ t = T L j T U j - d j + 1 w j 1 t = 1 , j = 1 , ⋯ , J (5) P jt Sh = ∑ r = 1 d j g jr w jrt , j = 1 , ⋯ , J , t = T L j , ⋯ , T U j (6) P jt Sh = 0 , j = 1 , ⋯ , J , t < T L j ∨ t > T U j (7) w jrt ∈ 0 , 1 , j = 1 , ⋯ , J , r = 1 , ⋯ , d j , t = T L j , ⋯ , T U j Since model M1 requires a large number of binary variables for each load j, as many as ( T U j - T L j + 1 ) × d j , we propose herein and compare the performance of two other approaches for modeling the operation cycle of shiftable load. The idea is to define binary variables just to determine the starting time of each load j: s jt = 1 if load j begins its operation in time t 0 otherwise j = 1 , ⋯ , J ; t = T L j , ⋯ , T U j - d j + 1 In a first approach using variables s jt \u2013 denoted below as model M2 \u2013 the operation cycle is enforced by data organization in a matrix D t t \u2032 j : each element of D t t \u2032 j indicates the power (kW) requested by load j in time t \u2032 if the load starts operating in time t , for all pairs ( t , t \u2032 ) with t = T L j , ⋯ , T U j - d j + 1 , t \u2032 = T L j , ⋯ , T U j . Then, the power required is computed as in (8). Thus, model M2 is defined by constraints (8)\u2013(11). (8) P j t \u2032 Sh = ∑ t = T L j T U j - d j + 1 D t t \u2032 j . s jt , j = 1 , ⋯ , J , t \u2032 = T L j , ⋯ , T U j (9) ∑ t = T L j T U j - d j + 1 s jt = 1 , j = 1 , ⋯ J (10) P jt Sh = 0 , j = 1 , ⋯ , J , t < T L j ∨ t > T U j (11) s jt ∈ 0 , 1 , j = 1 , ⋯ , J , t = T L j , ⋯ , T U j - d j + 1 For the sake of illustration, let us suppose that load j has the allowed time slot [ T L j , T U j ] = 10 , 17 with d j = 3 (i.e., 45 min considering Δ t = 15 min), and g jr r = 1 , ⋯ , 3 given by g j 1 = 1.2 , g j 2 = 1.5 , g j 3 = 0.5 , in kW. Matrix D t t \u2032 j is defined for t in T L j = 10, \u2026, T U j - d j + 1 = 15 and t\u2032 = 10, \u2026, 17, as: (t,t\u2032) t\u2032 = 10 11 12 13 14 15 16 17 t = 10 1.2 1.5 0.5 0 0 0 0 0 11 0 1.2 1.5 0.5 0 0 0 0 12 0 0 1.2 1.5 0.5 0 0 0 13 0 0 0 1.2 1.5 0.5 0 0 14 0 0 0 0 1.2 1.5 0.5 0 15 0 0 0 0 0 1.2 1.5 0.5 This matrix can be built with the optimization solver programming language (e.g., in CPLEX or Gurobi) or read once just at the beginning of the run from a pre-prepared data file. It is straightforward to expand this data matrix accommodating multiple operation slots, i.e. considering that load j can operate in not just one but multiple slots, defined by the consumer according to his/her convenience: T ( j ) = T L j 1 , T U j 1 ∪ T L j 2 , T U j 2 ∪ ⋯ T L j a j , T U j a j ⊆ T defines the time slots in which each load j ∈ 1 , ⋯ , J can operate, where a j is the number of different disjoint periods allowed for the operation of load j. It is assumed that load j will operate only once, so it will operate within only one of these time slots in T = { 1 , ⋯ , T } . In this case, D t t \u2032 j is defined for the combinations (t,t\u2032) considering the lowest time ( T L j 1 ) for the beginning of rows and columns, the highest time of the union of the different slots for t\u2019 ( T U j a j ) and the highest possible starting time for t ( T U j a j - d j + 1 ). For instance, if load j has a cycle with d j = 2 and can operate in slots [3\u20137] or [9\u201312] in a planning period t = 1 , ⋯ , 20 , then matrix D t t \u2032 j is defined for t = 3, \u2026, 12\u20132 + 1 = 11 and t\u2032=3, \u2026,12. The elements D t t \u2032 j = 0 for t and t\u2032 in between the two allowed time slots. Model M2 has the advantage over M1 of requiring fewer binary variables. However, it is necessary to organize a priori the D j matrices from the g jr , r = 1 , ⋯ , d j , and the time slots data. Therefore, another model is proposed, which considers the same type of variables s jt as in model M2 but does not require the D j matrices. This model is denoted as M3. Let us firstly consider only one operation time slot T L j , T U j for each load j. The constraints impose that: load operation should start once, enabling the cycle to end within the allowed time slot - (9) and (11); map the power required by shiftable load j at each stage of the operation cycle onto the planning period (i.e., g jr → P jt Sh ), according to the starting time by defining the new constraints (12), which have the role of (8) in M2; P jt Sh = 0 for t outside the allowed time slot - (10). Let R j = 1 , ⋯ , d j . (12) P jt Sh = ∑ r ∈ R j : r ≤ t ∧ r ≤ t + 1 - T L j g jr . s j t - r + 1 , j = 1 , ⋯ , J , t = T L j , ⋯ , T U j Constraints (12) define the power P jt Sh required by load j in each time t of its allowed operation slot. Let us explain how these constraints ensure this purpose: suppose that load j starts to operate at t \u2032 ∈ T L j , T U j - d j + 1 , i.e., s j t \u2032 = 1 and s jt = 0 , ∀ t ≠ t \u2032 ; at t = t \u2032 , load j should operate at P j t \u2032 = g j 1 , because it is at stage r = 1 of its operation cycle; at t = t \u2032 + 1 , load j should operate at P j , t \u2032 + 1 = g j 2 , because r = 2 , and so forth; for t = t \u2032 , the only r in which s j t \u2032 - r + 1 = 1 is for t \u2032 - r + 1 = t \u2032 , i.e. r = 1 ; for t = t \u2032 + 1 , the only r in which s j t \u2032 + 1 - r + 1 = 1 is for t \u2032 + 1 - r + 1 = t \u2032 , i.e. r = 2 ; and so forth. In the summation in (12), r must satisfy r ≤ t ∧ r ≤ t + 1 - T L j to ensure that only existing variables are considered in s j t - r + 1 . Note that for r = t + 1 those variables become s j 0 , and for r = t - T L j + 2 the variables would be s j ( T L j - 1 ) which do not exist. Model M3 can also be extended considering that load j can operate in multiple slots T ( j ) = T L j 1 , T U j 1 ∪ T L j 2 , T U j 2 ∪ ⋯ T L j a j , T U j a j . The constraints should now account for the multiple slots a j . Let T s t a r t j = T L j 1 , T U j 1 - d j + 1 ∪ T L j 2 , T U j 2 - d j + 1 ∪ ⋯ ∪ T L j a j , T U j a j - d j + 1 , which defines the times in which load j can start to operate. The decision variables s jt are defined as above but t ∈ T s t a r t ( j ) . The constraints of M3 for multiple slots are (13)\u2013(16). (13) ∑ t ∈ T s t a r t j s jt = 1 , j = 1 ⋯ J (14) P jt Sh = ∑ r ∈ R j : r ≤ t ∧ r ≤ t + 1 - T L j a , a = 1 , ⋯ , a j g jr . s j t - r + 1 , j = 1 , ⋯ , J , t ∈ T j (15) P jt Sh = 0 , j = 1 , ⋯ , J , t ∉ T j (16) s jt ∈ 0 , 1 , j = 1 , ⋯ , J , t ∈ T s t a r t j In addition to the typical shiftable loads generally considered (laundry, drying, dishwasher), other shiftable loads can be considered, including the ones that do not have an operation cycle, have constant operation power and can be interrupted, but the consumer wants them to operate in continuous periods (e.g., ironing). These three models (M1-M3) of shiftable loads have been compared considering as objective function the minimization of the energy consumption cost: (17) m i n c o s t = ∑ t = 1 T ∑ j = 1 J C t buy P j t S h Δ t where C t buy are the energy prices (cents \u20ac/kWh), t = 1 , ⋯ , T . Three types of shiftable loads are considered: dishwasher (j = 1, T L 1 , T U 1 =[1,480], d 1 =90), laundry (j = 2, T L 2 , T U 2 =[406,870], d 2 =105), dryer (j = 3, T L 3 , T U 3 =[1126,1440], d 3 =220). The data used for the three loads in this experiment are the same as the data for the shiftable loads in the case study (Section 4). The comparison of the 3 models described above, considering just one comfort slot, is displayed in Table 1 , revealing the clear advantage of M3. All models have 4320 continuous variables. The optimal cost of 0.47013 \u20ac was obtained in all models, but with a significant difference in runtime, which is quite relevant for real-time optimization. 3.2 Model for electric water heater The on/off status of the resistive element of an EWH, typically with a constant power, should consider the simulation of water withdrawal according to a given consumption pattern, inlet water temperature and losses through the envelope. In addition to thermal exchanges, the optimization model considers sanitary constraints to avoid the formation of legionella bacteria, which requires heating the water to a safety temperature for a specified time. This is modeled imposing that the water temperature is above 60 °C for at least 11 consecutive minutes or above 75 °C for at least 3 consecutive minutes in each day [26]. The modeling of an EWH requires the following parameters and data: P R = power of the resistive heating element (kW). τ t amb = ambient temperature around the EWH in time t (°C), t = 1 , ⋯ , T . τ net = inlet water temperature (°C). m t = water withdrawal for consumption in time t (kg), t = 0 , ⋯ , T . M = hot water tank capacity (kg). A = area of the tank envelope (m2). U = heat transfer coefficient of the tank (W/m2.˚C). c p = specific heat of the water (J/kg.˚C). τ min , τ max = minimum and maximum allowed temperature (˚C). t req = time required to maintain a certain temperature to eliminate the bacteria (min.). τ req = temperature specified to be kept for t req to eliminate the bacteria (°C). Decision and auxiliary variables (all for t = 1 , ⋯ , T ): v t = binary variable defining the on/off control of the heating element in time t ( v 0 is a constant). τ t = hot water temperature inside the tank in time t (°C), ( τ 0 is a constant). n t = binary variable equal to 1 in the first t in which τ t > τ req for t req . P t losses = power losses through the envelope in time t (kW), ( P 0 losses is a constant). The EWH optimization model is: (18) min ∑ t = 1 T C t buy P R v t Δ t s.t. (19) P t losses = A . U τ t - τ t amb , t = 1 , ⋯ , T (20) τ t + 1 = M - m t M . τ t + m t M . τ net + P R v t - P t losses M c p . Δ t , t = 0 , ⋯ , T - 1 (21) τ t ≥ τ min - M v t , t = 1 , ⋯ , T (22) τ t ≤ τ max + M 1 - v t , t = 1 , ⋯ , T (23) ∑ t = 1 T - t req + 1 n t = 1 (24) τ t ≥ ∑ t \u2032 = 1 ( t \u2032 ≤ t ) t req τ req . n t - t \u2032 + 1 , t = 1 , ⋯ , T (25) v t ∈ 0 , 1 , n t ∈ 0 , 1 , t = 1 , ⋯ , T (26) P t losses ≥ 0 , τ t ≥ 0 , t = 1 , ⋯ , T Constraints (19) and (20) define the temperature inside the tank. Constraints (21) and (22) enable that the minimum temperature may not be respected when the water is being heated ( v t = 1 ), to account for cases in which the initial temperature τ 0 < τ t min or there is excessive withdrawal, as well as allowing for τ t > τ max when v t = 0 . M is a big positive number. These constraints become hard, i.e., τ t ≥ τ min and τ t ≤ τ max , if the EWH is off or on, respectively. Constraints (23) and (24) ensure that the temperature is τ req or above for at least t req consecutive times to avoid the legionella bacteria. If the consumer is willing to withstand some discomfort with respect to a range of hot water temperatures [ τ m i n _ c o m f , τ m a x _ c o m f ] , penalizing the corresponding deviation in the objective function, then the following constraints could be considered: (27) τ t dev ≥ τ m i n _ c o m f - τ t + τ t - 1 2 , t = 1 , ⋯ , T (28) τ t dev ≥ τ t + τ t - 1 2 - τ m a x _ c o m f , t = 1 , ⋯ , T (29) τ t dev ≥ 0 , t = 1 , ⋯ , T The temperature deviation variables τ t dev measure, in each time t , the degrees °C of the water temperature below τ m i n _ c o m f or above τ m a x _ c o m f , respectively in (27) and in (28). This discomfort can be monetized using a penalty coefficient ρ (\u20ac/°C deviation) as in (30) to be included in the cost minimizing objective function. (30) m i n ρ ∑ t = 1 T τ t dev In a real implementation setting, some information can be physically obtained and incorporated in the optimization process, e.g., a temperature sensor in the tank. 3.3 Model for air conditioner A simple yet comprehensive model considering the behavior of the control thermostat of an air conditioner (AC) system is developed according to [25], accounting for the thermostat hysteresis behavior as displayed in Fig. 2 for heating mode, where s t AC is the on/off control variable. The operation depends on the minimum/maximum indoor temperature allowed as well as the building envelope characteristics. The modeling of an AC requires the following parameters and data: θ t ext = outdoor temperature in time t (°C), t = 0 , ⋯ , T . θ min , θ max = minimum and maximum indoor temperature allowed (°C) (these could be indexed by t according to the user\u2019s preferences along the planning period). P AC = nominal power of the AC appliance (kW). β = ( U . A / C ) Δ t , where U is the (weighted average) overall heat transfer coefficient of the building unit envelope (kW/(m2·°C)), A is the surface area of the envelope [m2], so U . A is the overall thermal conductance of the unit envelope (kW/°C), and C is the overall thermal capacity (kJ/°C). γ = χ . Δ t / C , where χ is the coefficient of performance of the AC appliance. The parameters β and γ are computed in the thermal model as in [25]. Decision and auxiliary variables (all for t = 1 , ⋯ , T ): s t AC = binary on/off control variables ( s 0 AC is a constant). θ t in = indoor temperature (°C), ( θ 0 in is a constant). y t , z t = binary variables to enforce the logical conditions of thermostat switching: y t = 1 if θ t in < θ max ; z t = 1 if θ t in > θ min . The AC optimization model is: (31) min ∑ t = 1 T C t buy P AC s t AC Δ t s.t. (32) θ t in = 1 - β θ t - 1 in + β θ t - 1 ext + γ P AC s t - 1 AC , t = 1 , ⋯ , T (33) θ t in ≥ θ min - M s t AC , t = 1 , ⋯ , T (34) θ t in ≤ θ min + M z t , t = 1 , ⋯ , T (35) θ t in ≥ θ max - M y t , t = 1 , ⋯ , T (36) z t + y t - s t - 1 AC + s t AC ≤ 2 , t = 1 , ⋯ , T (37) z t + y t + s t - 1 AC - s t AC ≤ 2 , t = 1 , ⋯ , T (38) θ t in ≤ θ max + M 1 - s t AC , t = 1 , ⋯ , T (39) s t AC , z t , y t ∈ 0 , 1 , t = 1 , ⋯ , T Constraints (32) define the indoor temperature in each time t as a function of the indoor temperature, the external temperature and the AC operation in time t - 1 . Constraints (33) ensure that the AC is on when the indoor temperature is below the minimum temperature. Constraints (34)\u2013(37) guarantee that the system keeps the state on or off when the indoor temperature is between the lower and the upper bound of the thermostat dead-band. Constraints (38) force s t AC = 0 when the indoor temperature is above the maximum allowed temperature, turning the AC off. In this model, the AC is operated in an on/off mode. If the AC can operate in, e.g., 4 power levels of 25 or 50 or 75 or 100%, then P AC s t - 1 AC in (32) is replaced by P t - 1 AC (with P 0 AC being a constant), which is computed as in (40) using the auxiliary variables σ t k that establish the power level at which the AC operate. Constraints (42) guarantee that the AC functions at one of the specified power levels or it is off. (40) P t AC = 0.25 σ t 1 + 0.5 σ t 2 + 0.75 σ t 3 + σ t 4 P AC , t = 1 , ⋯ , T (41) σ t k ∈ 0 , 1 , k = 1 , ⋯ , 4 , t = 1 , ⋯ , T (42) s t AC = ∑ k = 1 4 σ t k , t = 1 , ⋯ , T A monetized discomfort term could also be implemented as we illustrated for the EWH. Other models for AC control are presented in [25], for instance, to impose a minimum time on or off. However, the model above is just the MILP implementation of a rule-based system to reflect the thermostat behavior using the auxiliary binary variables y t and z t , i.e., it does not allow for the exploitation of the consumer\u2019s willingness to trade-off some discomfort with lower price periods. For this purpose, the model can be reformulated as follows [24]. The minimum indoor temperature for which the system should turn on ( θ min or θ t min ) becomes a decision variable to be determined by the optimization model. The reference (desired target) temperature, θ ref , the maximum allowed for the indoor temperature, θ max , and the absolute minimum allowed indoor temperature, θ m i n _ A B S , are specified by the consumer. The variables δ t + and δ t - are the positive and negative deviations of the minimum temperature, θ t min , to be set by the optimization model, with respect to the reference temperature. These variables account for the discomfort felt by the consumer, which may be included in the consumer\u2019s overall cost objective function by monetizing those temperature deviations or considered as a separate objective function in a bi-objective model. Fig. 3 displays this type of control of the lower bound of the thermostat comfort band (AC in heating mode), at each time t of T, by considering θ t min a decision variable. The modeling of this additional degree of freedom, in which the optimal value of θ t min is determined by the model, is achieved by defining the discomfort variables δ t + and δ t - as in (43) and guaranteeing that the minimum temperature is within the bounds defined by the absolute minimum temperature and the maximum temperature allowed (44). (43) θ t min - θ ref = δ t + - δ t - , t = 1 , ⋯ , T (44) θ m i n _ A B S ≤ θ t min ≤ θ max , t = 1 , ⋯ , T (45) δ t - , δ t + ≥ 0 , t = 1 , ⋯ , T A monetary term penalizing the temperature deviation (46) is added to the cost objective function to be minimized. (46) m i n ∑ t ∈ T c + δ t + + c - δ t - The coefficients c + and c - are the costs (in \u20ac/°C.h) associated with the positive and negative temperature deviations, respectively (e.g., in heating mode it may be set c - > c + , i.e., negative deviations are more penalized). The computational complexity results from considering θ t min , t = 1 , ⋯ , T , as decision variables, thus allowing to profit from ToU prices while tolerating some discomfort. It may be beneficial to increase θ t min to heat the space in periods of low prices to have higher temperatures (comfort) in periods of high prices. This end-user flexibility enables the implementation of price-based demand response actions. 3.4 Model for static and electric vehicle battery Let x denote the type of battery: x ∈ { B , V } , where B refers to the static battery and V to the EV battery. Regarding the time domain T x of each battery, T B = T (the whole planning period) and T V = [ t a , t d ] where t a is the first time unit after arrival of the EV at home (enabling charging/discharging) and t d is the time of departure. In the model below, the battery status is given in energy (kWh) units. The modeling of the battery systems requires the following parameters and data: η x ch , η x dch = charging and discharging efficiency of the battery, x ∈ { B , V } . E x min , E x max = minimum and maximum allowed battery charge (kWh), x ∈ { B , V } . E x 0 = initial battery charge (kWh) at time t = 0 for x = B and t = t a - 1 for x = V . E x req = battery charge requested at the end of the planning period for x = B and at the time of departure t d for x = V (kWh); in the case of x = B , we consider that E B req = E B 0 . P x c h _ m a x , P x d c h _ m a x = maximum charge and maximum discharge power allowed for the battery (kW), x ∈ { B , V } . The decision and auxiliary variables necessary are (for t ∈ T x , x ∈ B , V ): P t x 2 H = power (kW) such that P t x 2 H Δ t is the energy transferred from the battery x to home (B2H or V2H) in time t (battery discharge). P t H 2 x = power (kW) such that P t H 2 x Δ t is the energy transferred from the home to the battery x (H2B or H2V) in time t (battery charge). E x , t = energy (kWh) in the battery x in time t ( E x , 0 = E x 0 is a constant as defined above). s t H 2 x = binary variables equal to 1 when the battery x is charging in time t . s t x 2 H = binary variables equal to 1 when the battery x is discharging in time t . The constraints modeling the operation of the static and the EV batteries are: (47) E x , t = E x , t - 1 + η x ch P t H 2 x Δ t - P t x 2 H Δ t η x dch , t ∈ T x , x ∈ B , V (48) E x min ≤ E x , t ≤ E x max , t ∈ T x , x ∈ B , V (49) 0 ≤ P t H 2 x ≤ P x c h _ m a x s t H 2 x , t ∈ T x , x ∈ B , V (50) 0 ≤ P t x 2 H ≤ P x d c h _ m a x s t x 2 H , t ∈ T x , x ∈ B , V (51) s t H 2 x + s t x 2 H ≤ 1 , t ∈ T x , x ∈ B , V (52) E B , T ≥ E B req ; E V , t d ≥ E V req (53) s t H 2 x , s t x 2 H ∈ 0 , 1 , t ∈ T x , x ∈ B , V Constraints (47) determine the energy in the batteries considering the charging/discharging process. Constraints (48) impose a minimum and maximum energy quantity in the batteries in each time unit. Constraints (49) and (50) limit the maximum charging ( s t H 2 x = 1 ) and discharging ( s t x 2 H = 1 ) rates, respectively. Constraints (51) establish that the batteries are operating in one mode only (charging or discharging) in each time unit. Constraints (52) enforce that the energy in the batteries cannot be lower than the required quantity at the end of the planning period (for the static battery) and at the time of departure (for the EV battery). 4 Overall model and case study The MILP modules presented in the previous sections can be combined in an overall model to make the integrated optimization of all energy resources (different load types, storage and local microgeneration, exchanges with the grid). These modules can be combined and adapted according to the resources available for control, the consumer\u2019s preferences and the aims of the study. In the following version of a comprehensive overall model, we consider also the possibility of selling back to the grid at a stipulated price, which in some countries is a fraction of the wholesale market price. The following additional parameters, data and decision variables (all for t = 1 , ⋯ , T ) are required to model all the exchanges. Additional parameters and data: B t = base load (non-controllable) (kW). P t PV = power (kW) such P t PV Δ t is the local PV energy generation in time t (kWh). C t sell = energy remuneration (selling to the grid) in time t (\u20ac/kWh). P G _ m a x = maximum power allowed for exchanges with the grid (kW). Decision and auxiliary variables: P t G 2 H = power (kW) such that P t G 2 H Δ t is the energy (kWh) transferred from grid to home (G2H) in time t at unit cost C t buy (\u20ac/kWh). P t H 2 G = power (kW) such that P t H 2 G Δ t is the energy (kWh) transferred from home to grid (H2G) in time t at unit cost C t sell (\u20ac/kWh). s t G 2 H = binary variables that are 1 when the energy is flowing from grid to home in time t . s t H 2 G = binary variables that are 1 when the energy is flowing from home to grid in time t . Also, in addition to the energy cost (\u20ac/kWh), the power cost may also be considered by establishing a power tariff structure (\u20ac/kW per day) consisting of L price levels and the consumer is charged by the peak power taken. For this purpose, the following additional parameters and decision variables are defined: C l Cont = power level prices (\u20ac/kW); the consumer is charged for the peak power taken, l = 1 , ⋯ , L . P l Cont = power levels (kW), l = 1 , ⋯ , L . u l Cont = binary variables defining the maximum power level l taken during the planning period, l = 1 , ⋯ , L . The constraints to determine the power level to be used are: (54) P t G 2 H ≤ ∑ l = 1 L P l Cont . u l Cont , t = 1 , ⋯ , T (55) ∑ l = 1 L u l Cont = 1 (56) u l Cont ∈ 0 , 1 , l = 1 , ⋯ , L The power cost could also be considered as a constant but imposing an upper bound on the power taken by means of a constraint as established in the contract with the retailer, which is usual in the tariff system of several countries. The overall model is (57)-(64): (57) min P G 2 H , P H 2 G f = ∑ t = 1 T C t buy P t G 2 H Δ t - C t sell P t H 2 G Δ t + ∑ l = 1 L C l Cont u l Cont s. t. (58) C o n s t r a i n t s o f m o d e l M 3 f o r s h i f t a b l e l o a d s : 9 - 12 f o r s i n g l e o r 13 - 16 f o r m u l t i p l e c o m f o r t t i m e s l o t s . C o n s t r a i n t s 19 - 26 f o r t h e E W H l o a d . C o n s t r a i n t s 32 - 39 f o r t h e A C l o a d . C o n s t r a i n t s 47 - 53 f o r t h e s t a t i c b a t t e r y a n d t h e E V b a t t e r y . C o n s t r a i n t s 54 - 56 f o r t h e p o w e r c o m p o n e n t . (59) 0 ≤ P t G 2 H ≤ P G _ m a x s t G 2 H , t = 1 , ⋯ , T (60) 0 ≤ P t H 2 G ≤ P G _ m a x s t H 2 G , t = 1 , ⋯ , T (61) s t G 2 H + s t H 2 G ≤ 1 , t = 1 , ⋯ , T (62) P t G 2 H - P t H 2 G + P t PV = B t + ∑ j = 1 J P j , t Sh + P AC s t AC + P R v t + P t H 2 B - P t B 2 H , ∀ t ∈ T \\ T V (63) P t G 2 H - P t H 2 G + P t PV = B t + ∑ j = 1 J P j , t Sh + P AC s t AC + P R v t + P t H 2 B - P t B 2 H + P t H 2 V - P t V 2 H , ∀ t ∈ T V (64) s t G 2 H , s t H 2 G ∈ 0 , 1 , t = 1 , ⋯ , T Constraints (59) \u2013 (61) limit the exchanges between the home and the grid to a maximum and impose that the flow occurs in only one direction (i.e., G2H or H2G). Constraints (62) and (63) model the power balance, just differing in the operation slot of the EV battery. Constraints (27)\u2013(29) could be included in the model to represent the discomfort the consumer would be willing to tolerate with respect to the hot water temperature comfort range, adding the corresponding penalty term (30) to the objective function. Constraints (43)\u2013(45) could be considered to exploit the consumer\u2019s willingness to endure some indoor temperature discomfort, which would be penalized in the objective function as in (46), profiting from lower price periods. This overall model was instantiated with the data available at https://home.deec.uc.pt/~ch/data_DRmodels , obtained in field audits and actual equipment technical specifications. The planning horizon discretization was Δ t = 1 / 60 h , to compute the case study results presented below (which can be entirely reproduced using the data file and the formulation (57)\u2013(64) above). The model has 16,847 binary variables, 21,600 continuous variables and 39,227 constraints. With 5 min runtime, the relative MIP gap was 0.0107, and with 1 hour runtime the gap was 0.0088. The corresponding cost objective function values were 4.0714\u20ac and 4.0697\u20ac, respectively. The evolution of grid to home ( P t G 2 H ) and home to grid ( P t H 2 G ) powers is displayed in Fig. 4 . Fig. 5 displays the evolution of the static ( E B , t ) and EV ( E V , t ) battery charge. Fig. 6 displays the indoor temperature ( θ t in ) and the EWH temperature ( τ t ) in the planning period. These results were obtained with 1 hour runtime, although they are very similar to the ones obtained with 5 min runtime. Purchase from the grid ( P t G 2 H ) is made in the lower price periods, selling to the grid ( P t H 2 G ) when the prices are higher using the PV generation and the energy stored in the battery. The static battery ( E B , t ) is charged in the lower price periods to supply loads operating in periods in which the energy cost is higher. The EV battery ( E V , t ) is used to supplement the supplying of some loads during high prices periods and is then charged from the grid in low price periods to reach the desired state of charge at the time required. The indoor temperature ( θ t in ) fluctuates in the comfort range, being the AC supplied by the grid in periods of low prices and by the battery in periods of high prices. The EWH is mostly supplied from the grid in low price periods considering water withdrawals. The EWH modeling is responsible for the major share of the computational effort. Without considering the EWH, the overall model would be solved to optimality in 1.36 s. Further computational experiments were carried out to assess the impact of consumer\u2019s comfort specifications on the cost objective function. For this purpose, relaxations of the minimum allowed indoor and hot water temperatures, and minimum battery charge requested at the time of departure of the EV were considered, thus simulating a consumer willing to trade-off comfort for cost. These results are presented in Table 2 , for 5-minute runtime, making of most of the model flexibility to assess the outcomes for distinct consumer profiles characterized by different comfort requirements. Accepting to lower the minimum comfort temperature in 1 °C for the indoor and 2 °C for the hot water temperature enables to achieve some gain in cost, with a more noticeable improvement resulting from lowering the requirements for the electric vehicle battery charge at the departure time. The cumulative effect of these three preference settings offer a significant saving of about 12.6% with respect to the original settings (please see the data file). Experiments were also made using a plain tariff with C ¯ buy = 1 T ∑ t = 1 T C t buy . Allowing for a running time of 5 min, the cost objective function was 7.1284\u20ac, which shows that ToU tariff schemes are favorable for consumers when they have the flexibility or the willingness to endure some discomfort associated with appliance operation shifting, indoor and hot water temperatures, or battery state of charge requirements. 5 Conclusions The integrated optimization of all energy resources (load management, electric vehicle and stationary battery, local microgeneration, exchanges with the grid) to be implemented in autonomous home energy management systems requires an accurate modeling of appliances\u2019 physical operation. However, a balance is necessary between the optimization model detail and the capability of obtaining practical solutions using mild computational requisites. For this purpose, a comprehensive and modular set of MILP models has been developed. The models have been designed to be used in a flexible building block manner, with objective functions involving the economic and comfort dimensions with different modeling approaches. These models can be easily adapted to specific circumstances, including appliance characteristics, comfort preferences (in the operation time, indoor and water temperature, and battery state of charge), time-differentiated tariff schemes, power cost structures, etc. Results of a case study with actual data are presented, with complete data sets provided. The results show that whenever consumers have the flexibility to change their consumption patterns, they are able to lower the net electricity bill by having an energy management system endowed with the models herein proposed to make optimized decisions on their behalf. Since combinatorial models impose a significant computational effort, a tradeoff is required between the computational resources available and the model accuracy, namely regarding the time interval discretization. The implementation of these models in a low-cost single board computer, such as Arduino or Raspberry Pi, is underway, including the communication with the appliances, thus offering practical and affordable solutions for consumers and prosumers to engage in demand response programs and play a more active role in the energy transition. CRediT authorship contribution statement Carlos Henggeler Antunes: Writing \u2013 original draft, Investigation, Conceptualization, Data curation. Maria João Alves: Writing \u2013 review & editing, Investigation, Conceptualization. Inês Soares: Writing \u2013 review & editing, Investigation, Software. Declaration of Competing Interest The authors declare that they have no known competing financial interests or personal relationships that could have appeared to influence the work reported in this paper. Acknowledgments This work was supported by the R&D Units Pluriannual Funding UIDB/00308/2020 and UIDB/05037/2020, and project grants MAnAGER (POCI-01- 0145-FEDER-028040) and RETROSIM (POCI-01-0145-FEDER-032503), through the European Social Fund, European Regional Development Fund and the COMPETE 2020 Programs, FCT- Portuguese Foundation for Science and Technology. References [1] P. Siano Demand response and smart grids\u2014A survey Renew Sustain Energy Rev 30 2014 461 478 10.1016/j.rser.2013.10.022 P. Siano, \u201cDemand response and smart grids\u2014A survey,\u201d Renew. Sustain. Energy Rev., vol. 30, pp. 461\u2013478, 2014, doi: 10.1016/j.rser.2013.10.022. [2] J.S. Vardakas N. Zorba C.V. Verikoukis A Survey on Demand Response Programs in Smart Grids: Pricing Methods and Optimization Algorithms IEEE Commun Surv Tutorials 17 1 2015 152 178 10.1109/COMST.2014.2341586 J. S. Vardakas, N. Zorba, and C. V Verikoukis, \u201cA Survey on Demand Response Programs in Smart Grids: Pricing Methods and Optimization Algorithms,\u201d IEEE Commun. Surv. Tutorials, vol. 17, no. 1, pp. 152\u2013178, 2015, doi: 10.1109/COMST.2014.2341586. [3] A.R. Jordehi Optimisation of demand response in electric power systems, a review Renew Sustain Energy Rev 103 2019 308 319 10.1016/j.rser.2018.12.054 A. R. Jordehi, \u201cOptimisation of demand response in electric power systems, a review,\u201d Renew. Sustain. Energy Rev., vol. 103, pp. 308\u2013319, 2019, doi: 10.1016/j.rser.2018.12.054. [4] M. Beaudin H. Zareipour Home energy management systems: A review of modelling and complexity Renew Sustain Energy Rev 45 2015 318 335 10.1016/j.rser.2015.01.046 M. Beaudin and H. Zareipour, \u201cHome energy management systems: A review of modelling and complexity,\u201d Renew. Sustain. Energy Rev., vol. 45, pp. 318\u2013335, 2015, doi: 10.1016/j.rser.2015.01.046. [5] M. Hussain Y. Gao A review of demand response in an efficient smart grid environment Electr J 31 5 2018 55 63 10.1016/j.tej.2018.06.003 M. Hussain and Y. Gao, \u201cA review of demand response in an efficient smart grid environment,\u201d Electr. J., vol. 31, no. 5, pp. 55\u201363, 2018, doi: 10.1016/j.tej.2018.06.003. [6] G. Morales-España R. Martínez-Gordón J. Sijm Classifying and modelling demand response in power systems Energy 242 2022 122544 10.1016/j.energy.2021.122544 G. Morales-España, R. Martínez-Gordón, and J. Sijm, \u201cClassifying and modelling demand response in power systems,\u201d Energy, vol. 242, p. 122544, 2022, doi: 10.1016/j.energy.2021.122544. [7] S. Althaher P. Mancarella J. Mutale Automated Demand Response From Home Energy Management System Under Dynamic Pricing and Power and Comfort Constraints IEEE Trans Smart Grid 6 4 2015 1874 1883 10.1109/TSG.2014.2388357 S. Althaher, P. Mancarella, and J. Mutale, \u201cAutomated Demand Response From Home Energy Management System Under Dynamic Pricing and Power and Comfort Constraints,\u201d IEEE Trans. Smart Grid, vol. 6, no. 4, pp. 1874\u20131883, 2015, doi: 10.1109/TSG.2014.2388357. [8] H. Merdanoğlu E. Yakıcı O.T. Doğan S. Duran M. Karatas Finding optimal schedules in a home energy management system Electr Power Syst Res 182 2020 106229 10.1016/j.epsr.2020.106229 H. Merdanoğlu, E. Yakıcı, O. T. Doğan, S. Duran, and M. Karatas, \u201cFinding optimal schedules in a home energy management system,\u201d Electr. Power Syst. Res., vol. 182, p. 106229, 2020, doi: 10.1016/j.epsr.2020.106229. [9] M. Salgado M. Negrete-Pincetic Á. Lorca D. Olivares A low-complexity decision model for home energy management systems Appl Energy 294 2021 116985 10.1016/j.apenergy.2021.116985 M. Salgado, M. Negrete-Pincetic, Á. Lorca, and D. Olivares, \u201cA low-complexity decision model for home energy management systems,\u201d Appl. Energy, vol. 294, p. 116985, 2021, doi: 10.1016/j.apenergy.2021.116985. [10] S. Nan M. Zhou G. Li Optimal residential community demand response scheduling in smart grid Appl Energy 210 2018 1280 1289 10.1016/j.apenergy.2017.06.066 S. Nan, M. Zhou, and G. Li, \u201cOptimal residential community demand response scheduling in smart grid,\u201d Appl. Energy, vol. 210, pp. 1280\u20131289, 2018, doi: 10.1016/j.apenergy.2017.06.066. [11] R. Adhikari M. Pipattanasomporn S. Rahman An algorithm for optimal management of aggregated HVAC power demand using smart thermostats Appl Energy 217 2018 166 177 10.1016/j.apenergy.2018.02.085 R. Adhikari, M. Pipattanasomporn, and S. Rahman, \u201cAn algorithm for optimal management of aggregated HVAC power demand using smart thermostats,\u201d Appl. Energy, vol. 217, pp. 166\u2013177, 2018, doi: 10.1016/j.apenergy.2018.02.085. [12] M. Shafie-Khah P. Siano A Stochastic Home Energy Management System Considering Satisfaction Cost and Response Fatigue IEEE Trans Ind Informatics 14 2 2018 629 638 10.1109/TII.2017.2728803 M. Shafie-Khah and P. Siano, \u201cA Stochastic Home Energy Management System Considering Satisfaction Cost and Response Fatigue,\u201d IEEE Trans. Ind. Informatics, vol. 14, no. 2, pp. 629\u2013638, 2018, doi: 10.1109/TII.2017.2728803. [13] M. Elkazaz M. Sumner E. Naghiyev S. Pholboon R. Davies D. Thomas A hierarchical two-stage energy management for a home microgrid using model predictive and real-time controllers Appl Energy 269 2020 115118 10.1016/j.apenergy.2020.115118 M. Elkazaz, M. Sumner, E. Naghiyev, S. Pholboon, R. Davies, and D. Thomas, \u201cA hierarchical two-stage energy management for a home microgrid using model predictive and real-time controllers,\u201d Appl. Energy, vol. 269, p. 115118, 2020, doi: 10.1016/j.apenergy.2020.115118. [14] M.S. Javadi A.E. Nezhad P.H.J. Nardelli M. Gough M. Lotfi S. Santos Self-scheduling model for home energy management systems considering the end-users discomfort index within price-based demand response programs Sustain Cities Soc 68 2021 102792 10.1016/j.scs.2021.102792 M. S. Javadi et al., \u201cSelf-scheduling model for home energy management systems considering the end-users discomfort index within price-based demand response programs,\u201d Sustain. Cities Soc., vol. 68, p. 102792, 2021, doi: 10.1016/j.scs.2021.102792. [15] X. Zhang R. Lu J. Jiang S.H. Hong W.S. Song Testbed implementation of reinforcement learning-based demand response energy management system Appl Energy 297 2021 117131 10.1016/j.apenergy.2021.117131 X. Zhang, R. Lu, J. Jiang, S. H. Hong, and W. S. Song, \u201cTestbed implementation of reinforcement learning-based demand response energy management system,\u201d Appl. Energy, vol. 297, p. 117131, 2021, doi: 10.1016/j.apenergy.2021.117131. [16] A. Mohseni S.S. Mortazavi A. Ghasemi A. Nahavandi M. Talaei abdi The application of household appliances\u2019 flexibility by set of sequential uninterruptible energy phases model in the day-ahead planning of a residential microgrid Energy 139 2017 315 328 10.1016/j.energy.2017.07.149 A. Mohseni, S. S. Mortazavi, A. Ghasemi, A. Nahavandi, and M. Talaei abdi, The application of household appliances\u2019 flexibility by set of sequential uninterruptible energy phases model in the day-ahead planning of a residential microgrid, Energy 139 (2017) 315\u2013328, doi: 10.1016/j.energy.2017.07.149. [17] A. Soares A. Gomes C.H. Antunes C. Oliveira A Customized Evolutionary Algorithm for Multi-Objective Management of Residential Energy Resources IEEE Trans Ind Informatics 13 2 2017 492 501 10.1109/TII.2016.2628961 A. Soares, A. Gomes, C. H. Antunes, and C. Oliveira, \u201cA Customized Evolutionary Algorithm for Multi-Objective Management of Residential Energy Resources,\u201d IEEE Trans. Ind. Informatics, vol. 13, no. 2, pp. 492\u2013501, 2017, doi: 10.1109/TII.2016.2628961. [18] R. Deng Z. Yang M.-Y. Chow J. Chen A Survey on Demand Response in Smart Grids: Mathematical Models and Approaches IEEE Trans Ind Informatics 11 3 2015 570 582 10.1109/TII.2015.2414719 R. Deng, Z. Yang, M.-Y. Chow, and J. Chen, \u201cA Survey on Demand Response in Smart Grids: Mathematical Models and Approaches,\u201d IEEE Trans. Ind. Informatics, vol. 11, no. 3, pp. 570\u2013582, 2015, doi: 10.1109/TII.2015.2414719. [19] A. Niromandfam A.S. Yazdankhah R. Kazemzadeh Modeling demand response based on utility function considering wind profit maximization in the day-ahead market J Clean Prod 251 2020 119317 10.1016/j.jclepro.2019.119317 A. Niromandfam, A. S. Yazdankhah, and R. Kazemzadeh, \u201cModeling demand response based on utility function considering wind profit maximization in the day-ahead market,\u201d J. Clean. Prod., vol. 251, p. 119317, 2020, doi: 10.1016/j.jclepro.2019.119317. [20] C. Feng Y. Wang K. Zheng Q. Chen Smart Meter Data-Driven Customizing Price Design for Retailers IEEE Trans Smart Grid 11 3 2020 2043 2054 10.1109/TSG.2019.2946341 C. Feng, Y. Wang, K. Zheng, and Q. Chen, \u201cSmart Meter Data-Driven Customizing Price Design for Retailers,\u201d IEEE Trans. Smart Grid, vol. 11, no. 3, pp. 2043\u20132054, 2020, doi: 10.1109/TSG.2019.2946341. [21] A. Soares Á. Gomes C.H. Antunes Categorization of residential electricity consumption as a basis for the assessment of the impacts of demand response actions Renew Sustain Energy Rev 30 2014 490 503 10.1016/j.rser.2013.10.019 A. Soares, Á. Gomes, and C. H. Antunes, \u201cCategorization of residential electricity consumption as a basis for the assessment of the impacts of demand response actions,\u201d Renew. Sustain. Energy Rev., vol. 30, pp. 490\u2013503, 2014, doi: 10.1016/j.rser.2013.10.019. [22] C. Henggeler Antunes M.J. Alves B. Ecer Bilevel optimization to deal with demand response in power grids: models, methods and challenges TOP 28 3 2020 814 842 10.1007/s11750-020-00573-y C. Henggeler Antunes, M. J. Alves, and B. Ecer, \u201cBilevel optimization to deal with demand response in power grids: models, methods and challenges,\u201d TOP, vol. 28, no. 3, pp. 814\u2013842, 2020, doi: 10.1007/s11750-020-00573-y. [23] M.J. Alves C.H. Antunes P. Carrasqueira A hybrid genetic algorithm for the interaction of electricity retailers with demand response in Applications of Evolutionary Computation, 19th European Conference (EvoApplications), Lecture Notes in Computer Science 9597 2016 459 474 M. J. Alves, C. H. Antunes, and P. Carrasqueira, \u201cA hybrid genetic algorithm for the interaction of electricity retailers with demand response,\u201d in Applications of Evolutionary Computation, 19th European Conference (EvoApplications), Lecture Notes in Computer Science 9597, Springer, 2016, pp. 459\u2013474. [24] I. Soares M.J. Alves C.H. Antunes Designing time-of-use tariffs in electricity retail markets using a bi-level model \u2013 Estimating bounds when the lower level problem cannot be exactly solved Omega 93 2020 102027 10.1016/J.OMEGA.2019.01.005 I. Soares, M. J. Alves, and C. H. Antunes, \u201cDesigning time-of-use tariffs in electricity retail markets using a bi-level model \u2013 Estimating bounds when the lower level problem cannot be exactly solved,\u201d Omega, vol. 93, p. 102027, 2020, doi: 10.1016/J.OMEGA.2019.01.005. [25] C.H. Antunes V. Rasouli M.J. Alves Á. Gomes J.J. Costa A. Gaspar A Discussion of Mixed Integer Linear Programming Models of Thermostatic Loads in Demand Response V. Bertsch Advances in Energy System Optimization, Trends in Mathematics 2020 Birkhäuser (Springer) Cham 105 121 C. H. Antunes, V. Rasouli, M. J. Alves, Á. Gomes, J. J. Costa, and A. Gaspar, \u201cA Discussion of Mixed Integer Linear Programming Models of Thermostatic Loads in Demand Response,\u201d in Advances in Energy System Optimization, Trends in Mathematics, V. Bertsch et al, Ed. Birkhäuser (Springer), Cham, 2020, pp. 105\u2013121. [26] J.A. Tejero-Gómez A.A. Bayod-Rújula Energy management system design oriented for energy cost optimization in electric water heaters Energy Build 243 2021 111012 10.1016/j.enbuild.2021.111012 J. A. Tejero-Gómez and A. A. Bayod-Rújula, \u201cEnergy management system design oriented for energy cost optimization in electric water heaters,\u201d Energy Build., vol. 243, p. 111012, 2021, doi: 10.1016/j.enbuild.2021.111012.",
    "scopus-id": "85131653322",
    "coredata": {
        "eid": "1-s2.0-S0306261922005189",
        "dc:description": "Demand response programs are essential to enable accommodating larger shares of variable power generation based on renewable sources, the deployment of which is imperative for decarbonizing the economy and mitigating global warming. Consumers/prosumers are increasingly exposed to and may benefit from time-differentiated energy prices aimed to induce changes in regular consumption patterns. These changes are also beneficial for retailers and grid operators in face of the variability of wholesale market prices, renewable energy availability and grid conditions. The optimization models to be implemented in autonomous home energy management systems require a rigorous modeling of appliance operation to generate effective load scheduling solutions, respecting their physical operation principles and use patterns in everyday life. A balance should be sought between the detail level of optimization models and the computational requirements to generate usable solutions having in mind their implementation in low-cost processors. This paper presents a comprehensive and modular set of mixed-integer linear programming models aimed at enabling their seamless incorporation in home energy management systems, allowing for the integrated optimization of all energy resources (exchanges with the grid, load management, electric vehicle and stationary battery, local microgeneration). Detailed energy consumption optimization models for shiftable, interruptible and thermostatic loads are presented, also including the power cost component and ways of dealing with user's discomfort. The modular models are presented in a building block manner enhancing the flexibility of their utilization in overall models with different objective functions encompassing the economic and comfort dimensions. Computational results are presented for a case study using actual data, which considers a time-of-use tariff with six periods. In addition to comparing with a plain tariff scheme, different consumer profiles are simulated to assess the impact of comfort requirements on cost. These results show that whenever consumers have the flexibility to change their consumption patterns, they are able to lower the net electricity bill by having an energy management system endowed with the models herein proposed to make optimized decisions on their behalf.",
        "openArchiveArticle": "false",
        "prism:coverDate": "2022-08-15",
        "openaccessUserLicense": "http://creativecommons.org/licenses/by-nc-nd/4.0/",
        "prism:aggregationType": "Journal",
        "prism:url": "https://api.elsevier.com/content/article/pii/S0306261922005189",
        "dc:creator": [
            {
                "@_fa": "true",
                "$": "Henggeler Antunes, Carlos"
            },
            {
                "@_fa": "true",
                "$": "Alves, Maria João"
            },
            {
                "@_fa": "true",
                "$": "Soares, Inês"
            }
        ],
        "link": [
            {
                "@_fa": "true",
                "@rel": "self",
                "@href": "https://api.elsevier.com/content/article/pii/S0306261922005189"
            },
            {
                "@_fa": "true",
                "@rel": "scidir",
                "@href": "https://www.sciencedirect.com/science/article/pii/S0306261922005189"
            }
        ],
        "dc:format": "application/json",
        "openaccessType": "Full",
        "pii": "S0306-2619(22)00518-9",
        "prism:volume": "320",
        "articleNumber": "119142",
        "prism:publisher": "The Authors. Published by Elsevier Ltd.",
        "dc:title": "A comprehensive and modular set of appliance operation MILP models for demand response optimization",
        "prism:copyright": "© 2022 The Authors. Published by Elsevier Ltd.",
        "openaccess": "1",
        "prism:issn": "03062619",
        "dcterms:subject": [
            {
                "@_fa": "true",
                "$": "Demand-side management"
            },
            {
                "@_fa": "true",
                "$": "Load modeling"
            },
            {
                "@_fa": "true",
                "$": "Demand response"
            },
            {
                "@_fa": "true",
                "$": "Mixed-integer linear programming (MILP) models"
            }
        ],
        "openaccessArticle": "true",
        "prism:publicationName": "Applied Energy",
        "openaccessSponsorType": "FundingBody",
        "prism:pageRange": "119142",
        "pubType": "fla",
        "prism:coverDisplayDate": "15 August 2022",
        "prism:doi": "10.1016/j.apenergy.2022.119142",
        "prism:startingPage": "119142",
        "dc:identifier": "doi:10.1016/j.apenergy.2022.119142",
        "openaccessSponsorName": "Portugal institutions 2022: Hybrid journals"
    },
    "objects": {"object": [
        {
            "@category": "standard",
            "@height": "223",
            "@width": "622",
            "@_fa": "true",
            "$": "https://api.elsevier.com/content/object/eid/1-s2.0-S0306261922005189-gr1.jpg?httpAccept=%2A%2F%2A",
            "@multimediatype": "JPEG image file",
            "@type": "IMAGE-DOWNSAMPLED",
            "@size": "20757",
            "@ref": "gr1",
            "@mimetype": "image/jpeg"
        },
        {
            "@category": "standard",
            "@height": "74",
            "@width": "372",
            "@_fa": "true",
            "$": "https://api.elsevier.com/content/object/eid/1-s2.0-S0306261922005189-gr2.jpg?httpAccept=%2A%2F%2A",
            "@multimediatype": "JPEG image file",
            "@type": "IMAGE-DOWNSAMPLED",
            "@size": "4943",
            "@ref": "gr2",
            "@mimetype": "image/jpeg"
        },
        {
            "@category": "standard",
            "@height": "81",
            "@width": "370",
            "@_fa": "true",
            "$": "https://api.elsevier.com/content/object/eid/1-s2.0-S0306261922005189-gr3.jpg?httpAccept=%2A%2F%2A",
            "@multimediatype": "JPEG image file",
            "@type": "IMAGE-DOWNSAMPLED",
            "@size": "6226",
            "@ref": "gr3",
            "@mimetype": "image/jpeg"
        },
        {
            "@category": "standard",
            "@height": "345",
            "@width": "756",
            "@_fa": "true",
            "$": "https://api.elsevier.com/content/object/eid/1-s2.0-S0306261922005189-gr4.jpg?httpAccept=%2A%2F%2A",
            "@multimediatype": "JPEG image file",
            "@type": "IMAGE-DOWNSAMPLED",
            "@size": "58995",
            "@ref": "gr4",
            "@mimetype": "image/jpeg"
        },
        {
            "@category": "standard",
            "@height": "337",
            "@width": "723",
            "@_fa": "true",
            "$": "https://api.elsevier.com/content/object/eid/1-s2.0-S0306261922005189-gr5.jpg?httpAccept=%2A%2F%2A",
            "@multimediatype": "JPEG image file",
            "@type": "IMAGE-DOWNSAMPLED",
            "@size": "40612",
            "@ref": "gr5",
            "@mimetype": "image/jpeg"
        },
        {
            "@category": "standard",
            "@height": "352",
            "@width": "728",
            "@_fa": "true",
            "$": "https://api.elsevier.com/content/object/eid/1-s2.0-S0306261922005189-gr6.jpg?httpAccept=%2A%2F%2A",
            "@multimediatype": "JPEG image file",
            "@type": "IMAGE-DOWNSAMPLED",
            "@size": "43812",
            "@ref": "gr6",
            "@mimetype": "image/jpeg"
        },
        {
            "@category": "thumbnail",
            "@height": "79",
            "@width": "219",
            "@_fa": "true",
            "$": "https://api.elsevier.com/content/object/eid/1-s2.0-S0306261922005189-gr1.sml?httpAccept=%2A%2F%2A",
            "@multimediatype": "GIF image file",
            "@type": "IMAGE-THUMBNAIL",
            "@size": "4850",
            "@ref": "gr1",
            "@mimetype": "image/gif"
        },
        {
            "@category": "thumbnail",
            "@height": "44",
            "@width": "219",
            "@_fa": "true",
            "$": "https://api.elsevier.com/content/object/eid/1-s2.0-S0306261922005189-gr2.sml?httpAccept=%2A%2F%2A",
            "@multimediatype": "GIF image file",
            "@type": "IMAGE-THUMBNAIL",
            "@size": "2123",
            "@ref": "gr2",
            "@mimetype": "image/gif"
        },
        {
            "@category": "thumbnail",
            "@height": "48",
            "@width": "219",
            "@_fa": "true",
            "$": "https://api.elsevier.com/content/object/eid/1-s2.0-S0306261922005189-gr3.sml?httpAccept=%2A%2F%2A",
            "@multimediatype": "GIF image file",
            "@type": "IMAGE-THUMBNAIL",
            "@size": "2399",
            "@ref": "gr3",
            "@mimetype": "image/gif"
        },
        {
            "@category": "thumbnail",
            "@height": "100",
            "@width": "219",
            "@_fa": "true",
            "$": "https://api.elsevier.com/content/object/eid/1-s2.0-S0306261922005189-gr4.sml?httpAccept=%2A%2F%2A",
            "@multimediatype": "GIF image file",
            "@type": "IMAGE-THUMBNAIL",
            "@size": "8081",
            "@ref": "gr4",
            "@mimetype": "image/gif"
        },
        {
            "@category": "thumbnail",
            "@height": "102",
            "@width": "219",
            "@_fa": "true",
            "$": "https://api.elsevier.com/content/object/eid/1-s2.0-S0306261922005189-gr5.sml?httpAccept=%2A%2F%2A",
            "@multimediatype": "GIF image file",
            "@type": "IMAGE-THUMBNAIL",
            "@size": "3955",
            "@ref": "gr5",
            "@mimetype": "image/gif"
        },
        {
            "@category": "thumbnail",
            "@height": "106",
            "@width": "219",
            "@_fa": "true",
            "$": "https://api.elsevier.com/content/object/eid/1-s2.0-S0306261922005189-gr6.sml?httpAccept=%2A%2F%2A",
            "@multimediatype": "GIF image file",
            "@type": "IMAGE-THUMBNAIL",
            "@size": "5205",
            "@ref": "gr6",
            "@mimetype": "image/gif"
        },
        {
            "@category": "high",
            "@height": "988",
            "@width": "2756",
            "@_fa": "true",
            "$": "https://api.elsevier.com/content/object/eid/1-s2.0-S0306261922005189-gr1_lrg.jpg?httpAccept=%2A%2F%2A",
            "@multimediatype": "JPEG image file",
            "@type": "IMAGE-HIGH-RES",
            "@size": "106682",
            "@ref": "gr1",
            "@mimetype": "image/jpeg"
        },
        {
            "@category": "high",
            "@height": "328",
            "@width": "1648",
            "@_fa": "true",
            "$": "https://api.elsevier.com/content/object/eid/1-s2.0-S0306261922005189-gr2_lrg.jpg?httpAccept=%2A%2F%2A",
            "@multimediatype": "JPEG image file",
            "@type": "IMAGE-HIGH-RES",
            "@size": "29885",
            "@ref": "gr2",
            "@mimetype": "image/jpeg"
        },
        {
            "@category": "high",
            "@height": "360",
            "@width": "1640",
            "@_fa": "true",
            "$": "https://api.elsevier.com/content/object/eid/1-s2.0-S0306261922005189-gr3_lrg.jpg?httpAccept=%2A%2F%2A",
            "@multimediatype": "JPEG image file",
            "@type": "IMAGE-HIGH-RES",
            "@size": "39904",
            "@ref": "gr3",
            "@mimetype": "image/jpeg"
        },
        {
            "@category": "high",
            "@height": "1526",
            "@width": "3346",
            "@_fa": "true",
            "$": "https://api.elsevier.com/content/object/eid/1-s2.0-S0306261922005189-gr4_lrg.jpg?httpAccept=%2A%2F%2A",
            "@multimediatype": "JPEG image file",
            "@type": "IMAGE-HIGH-RES",
            "@size": "338646",
            "@ref": "gr4",
            "@mimetype": "image/jpeg"
        },
        {
            "@category": "high",
            "@height": "1493",
            "@width": "3200",
            "@_fa": "true",
            "$": "https://api.elsevier.com/content/object/eid/1-s2.0-S0306261922005189-gr5_lrg.jpg?httpAccept=%2A%2F%2A",
            "@multimediatype": "JPEG image file",
            "@type": "IMAGE-HIGH-RES",
            "@size": "202702",
            "@ref": "gr5",
            "@mimetype": "image/jpeg"
        },
        {
            "@category": "high",
            "@height": "1557",
            "@width": "3222",
            "@_fa": "true",
            "$": "https://api.elsevier.com/content/object/eid/1-s2.0-S0306261922005189-gr6_lrg.jpg?httpAccept=%2A%2F%2A",
            "@multimediatype": "JPEG image file",
            "@type": "IMAGE-HIGH-RES",
            "@size": "219304",
            "@ref": "gr6",
            "@mimetype": "image/jpeg"
        },
        {
            "@category": "thumbnail",
            "@_fa": "true",
            "$": "https://api.elsevier.com/content/object/eid/1-s2.0-S0306261922005189-si1.svg?httpAccept=%2A%2F%2A",
            "@multimediatype": "Scalable Vector Graphics file",
            "@type": "ALTIMG",
            "@size": "1669",
            "@ref": "si1",
            "@mimetype": "image/svg+xml"
        },
        {
            "@category": "thumbnail",
            "@_fa": "true",
            "$": "https://api.elsevier.com/content/object/eid/1-s2.0-S0306261922005189-si10.svg?httpAccept=%2A%2F%2A",
            "@multimediatype": "Scalable Vector Graphics file",
            "@type": "ALTIMG",
            "@size": "2543",
            "@ref": "si10",
            "@mimetype": "image/svg+xml"
        },
        {
            "@category": "thumbnail",
            "@_fa": "true",
            "$": "https://api.elsevier.com/content/object/eid/1-s2.0-S0306261922005189-si100.svg?httpAccept=%2A%2F%2A",
            "@multimediatype": "Scalable Vector Graphics file",
            "@type": "ALTIMG",
            "@size": "17651",
            "@ref": "si100",
            "@mimetype": "image/svg+xml"
        },
        {
            "@category": "thumbnail",
            "@_fa": "true",
            "$": "https://api.elsevier.com/content/object/eid/1-s2.0-S0306261922005189-si102.svg?httpAccept=%2A%2F%2A",
            "@multimediatype": "Scalable Vector Graphics file",
            "@type": "ALTIMG",
            "@size": "18962",
            "@ref": "si102",
            "@mimetype": "image/svg+xml"
        },
        {
            "@category": "thumbnail",
            "@_fa": "true",
            "$": "https://api.elsevier.com/content/object/eid/1-s2.0-S0306261922005189-si103.svg?httpAccept=%2A%2F%2A",
            "@multimediatype": "Scalable Vector Graphics file",
            "@type": "ALTIMG",
            "@size": "3906",
            "@ref": "si103",
            "@mimetype": "image/svg+xml"
        },
        {
            "@category": "thumbnail",
            "@_fa": "true",
            "$": "https://api.elsevier.com/content/object/eid/1-s2.0-S0306261922005189-si104.svg?httpAccept=%2A%2F%2A",
            "@multimediatype": "Scalable Vector Graphics file",
            "@type": "ALTIMG",
            "@size": "9013",
            "@ref": "si104",
            "@mimetype": "image/svg+xml"
        },
        {
            "@category": "thumbnail",
            "@_fa": "true",
            "$": "https://api.elsevier.com/content/object/eid/1-s2.0-S0306261922005189-si105.svg?httpAccept=%2A%2F%2A",
            "@multimediatype": "Scalable Vector Graphics file",
            "@type": "ALTIMG",
            "@size": "17944",
            "@ref": "si105",
            "@mimetype": "image/svg+xml"
        },
        {
            "@category": "thumbnail",
            "@_fa": "true",
            "$": "https://api.elsevier.com/content/object/eid/1-s2.0-S0306261922005189-si106.svg?httpAccept=%2A%2F%2A",
            "@multimediatype": "Scalable Vector Graphics file",
            "@type": "ALTIMG",
            "@size": "37793",
            "@ref": "si106",
            "@mimetype": "image/svg+xml"
        },
        {
            "@category": "thumbnail",
            "@_fa": "true",
            "$": "https://api.elsevier.com/content/object/eid/1-s2.0-S0306261922005189-si107.svg?httpAccept=%2A%2F%2A",
            "@multimediatype": "Scalable Vector Graphics file",
            "@type": "ALTIMG",
            "@size": "16211",
            "@ref": "si107",
            "@mimetype": "image/svg+xml"
        },
        {
            "@category": "thumbnail",
            "@_fa": "true",
            "$": "https://api.elsevier.com/content/object/eid/1-s2.0-S0306261922005189-si108.svg?httpAccept=%2A%2F%2A",
            "@multimediatype": "Scalable Vector Graphics file",
            "@type": "ALTIMG",
            "@size": "17610",
            "@ref": "si108",
            "@mimetype": "image/svg+xml"
        },
        {
            "@category": "thumbnail",
            "@_fa": "true",
            "$": "https://api.elsevier.com/content/object/eid/1-s2.0-S0306261922005189-si109.svg?httpAccept=%2A%2F%2A",
            "@multimediatype": "Scalable Vector Graphics file",
            "@type": "ALTIMG",
            "@size": "25712",
            "@ref": "si109",
            "@mimetype": "image/svg+xml"
        },
        {
            "@category": "thumbnail",
            "@_fa": "true",
            "$": "https://api.elsevier.com/content/object/eid/1-s2.0-S0306261922005189-si11.svg?httpAccept=%2A%2F%2A",
            "@multimediatype": "Scalable Vector Graphics file",
            "@type": "ALTIMG",
            "@size": "5576",
            "@ref": "si11",
            "@mimetype": "image/svg+xml"
        },
        {
            "@category": "thumbnail",
            "@_fa": "true",
            "$": "https://api.elsevier.com/content/object/eid/1-s2.0-S0306261922005189-si110.svg?httpAccept=%2A%2F%2A",
            "@multimediatype": "Scalable Vector Graphics file",
            "@type": "ALTIMG",
            "@size": "5347",
            "@ref": "si110",
            "@mimetype": "image/svg+xml"
        },
        {
            "@category": "thumbnail",
            "@_fa": "true",
            "$": "https://api.elsevier.com/content/object/eid/1-s2.0-S0306261922005189-si111.svg?httpAccept=%2A%2F%2A",
            "@multimediatype": "Scalable Vector Graphics file",
            "@type": "ALTIMG",
            "@size": "6620",
            "@ref": "si111",
            "@mimetype": "image/svg+xml"
        },
        {
            "@category": "thumbnail",
            "@_fa": "true",
            "$": "https://api.elsevier.com/content/object/eid/1-s2.0-S0306261922005189-si112.svg?httpAccept=%2A%2F%2A",
            "@multimediatype": "Scalable Vector Graphics file",
            "@type": "ALTIMG",
            "@size": "2531",
            "@ref": "si112",
            "@mimetype": "image/svg+xml"
        },
        {
            "@category": "thumbnail",
            "@_fa": "true",
            "$": "https://api.elsevier.com/content/object/eid/1-s2.0-S0306261922005189-si113.svg?httpAccept=%2A%2F%2A",
            "@multimediatype": "Scalable Vector Graphics file",
            "@type": "ALTIMG",
            "@size": "6732",
            "@ref": "si113",
            "@mimetype": "image/svg+xml"
        },
        {
            "@category": "thumbnail",
            "@_fa": "true",
            "$": "https://api.elsevier.com/content/object/eid/1-s2.0-S0306261922005189-si114.svg?httpAccept=%2A%2F%2A",
            "@multimediatype": "Scalable Vector Graphics file",
            "@type": "ALTIMG",
            "@size": "2636",
            "@ref": "si114",
            "@mimetype": "image/svg+xml"
        },
        {
            "@category": "thumbnail",
            "@_fa": "true",
            "$": "https://api.elsevier.com/content/object/eid/1-s2.0-S0306261922005189-si115.svg?httpAccept=%2A%2F%2A",
            "@multimediatype": "Scalable Vector Graphics file",
            "@type": "ALTIMG",
            "@size": "7031",
            "@ref": "si115",
            "@mimetype": "image/svg+xml"
        },
        {
            "@category": "thumbnail",
            "@_fa": "true",
            "$": "https://api.elsevier.com/content/object/eid/1-s2.0-S0306261922005189-si116.svg?httpAccept=%2A%2F%2A",
            "@multimediatype": "Scalable Vector Graphics file",
            "@type": "ALTIMG",
            "@size": "3148",
            "@ref": "si116",
            "@mimetype": "image/svg+xml"
        },
        {
            "@category": "thumbnail",
            "@_fa": "true",
            "$": "https://api.elsevier.com/content/object/eid/1-s2.0-S0306261922005189-si117.svg?httpAccept=%2A%2F%2A",
            "@multimediatype": "Scalable Vector Graphics file",
            "@type": "ALTIMG",
            "@size": "3055",
            "@ref": "si117",
            "@mimetype": "image/svg+xml"
        },
        {
            "@category": "thumbnail",
            "@_fa": "true",
            "$": "https://api.elsevier.com/content/object/eid/1-s2.0-S0306261922005189-si118.svg?httpAccept=%2A%2F%2A",
            "@multimediatype": "Scalable Vector Graphics file",
            "@type": "ALTIMG",
            "@size": "6755",
            "@ref": "si118",
            "@mimetype": "image/svg+xml"
        },
        {
            "@category": "thumbnail",
            "@_fa": "true",
            "$": "https://api.elsevier.com/content/object/eid/1-s2.0-S0306261922005189-si119.svg?httpAccept=%2A%2F%2A",
            "@multimediatype": "Scalable Vector Graphics file",
            "@type": "ALTIMG",
            "@size": "4657",
            "@ref": "si119",
            "@mimetype": "image/svg+xml"
        },
        {
            "@category": "thumbnail",
            "@_fa": "true",
            "$": "https://api.elsevier.com/content/object/eid/1-s2.0-S0306261922005189-si12.svg?httpAccept=%2A%2F%2A",
            "@multimediatype": "Scalable Vector Graphics file",
            "@type": "ALTIMG",
            "@size": "5561",
            "@ref": "si12",
            "@mimetype": "image/svg+xml"
        },
        {
            "@category": "thumbnail",
            "@_fa": "true",
            "$": "https://api.elsevier.com/content/object/eid/1-s2.0-S0306261922005189-si120.svg?httpAccept=%2A%2F%2A",
            "@multimediatype": "Scalable Vector Graphics file",
            "@type": "ALTIMG",
            "@size": "3411",
            "@ref": "si120",
            "@mimetype": "image/svg+xml"
        },
        {
            "@category": "thumbnail",
            "@_fa": "true",
            "$": "https://api.elsevier.com/content/object/eid/1-s2.0-S0306261922005189-si121.svg?httpAccept=%2A%2F%2A",
            "@multimediatype": "Scalable Vector Graphics file",
            "@type": "ALTIMG",
            "@size": "5480",
            "@ref": "si121",
            "@mimetype": "image/svg+xml"
        },
        {
            "@category": "thumbnail",
            "@_fa": "true",
            "$": "https://api.elsevier.com/content/object/eid/1-s2.0-S0306261922005189-si122.svg?httpAccept=%2A%2F%2A",
            "@multimediatype": "Scalable Vector Graphics file",
            "@type": "ALTIMG",
            "@size": "1636",
            "@ref": "si122",
            "@mimetype": "image/svg+xml"
        },
        {
            "@category": "thumbnail",
            "@_fa": "true",
            "$": "https://api.elsevier.com/content/object/eid/1-s2.0-S0306261922005189-si123.svg?httpAccept=%2A%2F%2A",
            "@multimediatype": "Scalable Vector Graphics file",
            "@type": "ALTIMG",
            "@size": "1297",
            "@ref": "si123",
            "@mimetype": "image/svg+xml"
        },
        {
            "@category": "thumbnail",
            "@_fa": "true",
            "$": "https://api.elsevier.com/content/object/eid/1-s2.0-S0306261922005189-si124.svg?httpAccept=%2A%2F%2A",
            "@multimediatype": "Scalable Vector Graphics file",
            "@type": "ALTIMG",
            "@size": "1590",
            "@ref": "si124",
            "@mimetype": "image/svg+xml"
        },
        {
            "@category": "thumbnail",
            "@_fa": "true",
            "$": "https://api.elsevier.com/content/object/eid/1-s2.0-S0306261922005189-si125.svg?httpAccept=%2A%2F%2A",
            "@multimediatype": "Scalable Vector Graphics file",
            "@type": "ALTIMG",
            "@size": "3038",
            "@ref": "si125",
            "@mimetype": "image/svg+xml"
        },
        {
            "@category": "thumbnail",
            "@_fa": "true",
            "$": "https://api.elsevier.com/content/object/eid/1-s2.0-S0306261922005189-si126.svg?httpAccept=%2A%2F%2A",
            "@multimediatype": "Scalable Vector Graphics file",
            "@type": "ALTIMG",
            "@size": "9142",
            "@ref": "si126",
            "@mimetype": "image/svg+xml"
        },
        {
            "@category": "thumbnail",
            "@_fa": "true",
            "$": "https://api.elsevier.com/content/object/eid/1-s2.0-S0306261922005189-si127.svg?httpAccept=%2A%2F%2A",
            "@multimediatype": "Scalable Vector Graphics file",
            "@type": "ALTIMG",
            "@size": "4572",
            "@ref": "si127",
            "@mimetype": "image/svg+xml"
        },
        {
            "@category": "thumbnail",
            "@_fa": "true",
            "$": "https://api.elsevier.com/content/object/eid/1-s2.0-S0306261922005189-si128.svg?httpAccept=%2A%2F%2A",
            "@multimediatype": "Scalable Vector Graphics file",
            "@type": "ALTIMG",
            "@size": "4404",
            "@ref": "si128",
            "@mimetype": "image/svg+xml"
        },
        {
            "@category": "thumbnail",
            "@_fa": "true",
            "$": "https://api.elsevier.com/content/object/eid/1-s2.0-S0306261922005189-si129.svg?httpAccept=%2A%2F%2A",
            "@multimediatype": "Scalable Vector Graphics file",
            "@type": "ALTIMG",
            "@size": "3070",
            "@ref": "si129",
            "@mimetype": "image/svg+xml"
        },
        {
            "@category": "thumbnail",
            "@_fa": "true",
            "$": "https://api.elsevier.com/content/object/eid/1-s2.0-S0306261922005189-si13.svg?httpAccept=%2A%2F%2A",
            "@multimediatype": "Scalable Vector Graphics file",
            "@type": "ALTIMG",
            "@size": "5709",
            "@ref": "si13",
            "@mimetype": "image/svg+xml"
        },
        {
            "@category": "thumbnail",
            "@_fa": "true",
            "$": "https://api.elsevier.com/content/object/eid/1-s2.0-S0306261922005189-si130.svg?httpAccept=%2A%2F%2A",
            "@multimediatype": "Scalable Vector Graphics file",
            "@type": "ALTIMG",
            "@size": "2834",
            "@ref": "si130",
            "@mimetype": "image/svg+xml"
        },
        {
            "@category": "thumbnail",
            "@_fa": "true",
            "$": "https://api.elsevier.com/content/object/eid/1-s2.0-S0306261922005189-si131.svg?httpAccept=%2A%2F%2A",
            "@multimediatype": "Scalable Vector Graphics file",
            "@type": "ALTIMG",
            "@size": "2544",
            "@ref": "si131",
            "@mimetype": "image/svg+xml"
        },
        {
            "@category": "thumbnail",
            "@_fa": "true",
            "$": "https://api.elsevier.com/content/object/eid/1-s2.0-S0306261922005189-si132.svg?httpAccept=%2A%2F%2A",
            "@multimediatype": "Scalable Vector Graphics file",
            "@type": "ALTIMG",
            "@size": "2306",
            "@ref": "si132",
            "@mimetype": "image/svg+xml"
        },
        {
            "@category": "thumbnail",
            "@_fa": "true",
            "$": "https://api.elsevier.com/content/object/eid/1-s2.0-S0306261922005189-si133.svg?httpAccept=%2A%2F%2A",
            "@multimediatype": "Scalable Vector Graphics file",
            "@type": "ALTIMG",
            "@size": "2857",
            "@ref": "si133",
            "@mimetype": "image/svg+xml"
        },
        {
            "@category": "thumbnail",
            "@_fa": "true",
            "$": "https://api.elsevier.com/content/object/eid/1-s2.0-S0306261922005189-si134.svg?httpAccept=%2A%2F%2A",
            "@multimediatype": "Scalable Vector Graphics file",
            "@type": "ALTIMG",
            "@size": "5896",
            "@ref": "si134",
            "@mimetype": "image/svg+xml"
        },
        {
            "@category": "thumbnail",
            "@_fa": "true",
            "$": "https://api.elsevier.com/content/object/eid/1-s2.0-S0306261922005189-si135.svg?httpAccept=%2A%2F%2A",
            "@multimediatype": "Scalable Vector Graphics file",
            "@type": "ALTIMG",
            "@size": "4448",
            "@ref": "si135",
            "@mimetype": "image/svg+xml"
        },
        {
            "@category": "thumbnail",
            "@_fa": "true",
            "$": "https://api.elsevier.com/content/object/eid/1-s2.0-S0306261922005189-si136.svg?httpAccept=%2A%2F%2A",
            "@multimediatype": "Scalable Vector Graphics file",
            "@type": "ALTIMG",
            "@size": "6721",
            "@ref": "si136",
            "@mimetype": "image/svg+xml"
        },
        {
            "@category": "thumbnail",
            "@_fa": "true",
            "$": "https://api.elsevier.com/content/object/eid/1-s2.0-S0306261922005189-si137.svg?httpAccept=%2A%2F%2A",
            "@multimediatype": "Scalable Vector Graphics file",
            "@type": "ALTIMG",
            "@size": "6485",
            "@ref": "si137",
            "@mimetype": "image/svg+xml"
        },
        {
            "@category": "thumbnail",
            "@_fa": "true",
            "$": "https://api.elsevier.com/content/object/eid/1-s2.0-S0306261922005189-si138.svg?httpAccept=%2A%2F%2A",
            "@multimediatype": "Scalable Vector Graphics file",
            "@type": "ALTIMG",
            "@size": "18836",
            "@ref": "si138",
            "@mimetype": "image/svg+xml"
        },
        {
            "@category": "thumbnail",
            "@_fa": "true",
            "$": "https://api.elsevier.com/content/object/eid/1-s2.0-S0306261922005189-si139.svg?httpAccept=%2A%2F%2A",
            "@multimediatype": "Scalable Vector Graphics file",
            "@type": "ALTIMG",
            "@size": "20672",
            "@ref": "si139",
            "@mimetype": "image/svg+xml"
        },
        {
            "@category": "thumbnail",
            "@_fa": "true",
            "$": "https://api.elsevier.com/content/object/eid/1-s2.0-S0306261922005189-si14.svg?httpAccept=%2A%2F%2A",
            "@multimediatype": "Scalable Vector Graphics file",
            "@type": "ALTIMG",
            "@size": "1123",
            "@ref": "si14",
            "@mimetype": "image/svg+xml"
        },
        {
            "@category": "thumbnail",
            "@_fa": "true",
            "$": "https://api.elsevier.com/content/object/eid/1-s2.0-S0306261922005189-si140.svg?httpAccept=%2A%2F%2A",
            "@multimediatype": "Scalable Vector Graphics file",
            "@type": "ALTIMG",
            "@size": "29778",
            "@ref": "si140",
            "@mimetype": "image/svg+xml"
        },
        {
            "@category": "thumbnail",
            "@_fa": "true",
            "$": "https://api.elsevier.com/content/object/eid/1-s2.0-S0306261922005189-si141.svg?httpAccept=%2A%2F%2A",
            "@multimediatype": "Scalable Vector Graphics file",
            "@type": "ALTIMG",
            "@size": "15730",
            "@ref": "si141",
            "@mimetype": "image/svg+xml"
        },
        {
            "@category": "thumbnail",
            "@_fa": "true",
            "$": "https://api.elsevier.com/content/object/eid/1-s2.0-S0306261922005189-si142.svg?httpAccept=%2A%2F%2A",
            "@multimediatype": "Scalable Vector Graphics file",
            "@type": "ALTIMG",
            "@size": "17712",
            "@ref": "si142",
            "@mimetype": "image/svg+xml"
        },
        {
            "@category": "thumbnail",
            "@_fa": "true",
            "$": "https://api.elsevier.com/content/object/eid/1-s2.0-S0306261922005189-si143.svg?httpAccept=%2A%2F%2A",
            "@multimediatype": "Scalable Vector Graphics file",
            "@type": "ALTIMG",
            "@size": "11004",
            "@ref": "si143",
            "@mimetype": "image/svg+xml"
        },
        {
            "@category": "thumbnail",
            "@_fa": "true",
            "$": "https://api.elsevier.com/content/object/eid/1-s2.0-S0306261922005189-si144.svg?httpAccept=%2A%2F%2A",
            "@multimediatype": "Scalable Vector Graphics file",
            "@type": "ALTIMG",
            "@size": "20963",
            "@ref": "si144",
            "@mimetype": "image/svg+xml"
        },
        {
            "@category": "thumbnail",
            "@_fa": "true",
            "$": "https://api.elsevier.com/content/object/eid/1-s2.0-S0306261922005189-si145.svg?httpAccept=%2A%2F%2A",
            "@multimediatype": "Scalable Vector Graphics file",
            "@type": "ALTIMG",
            "@size": "13875",
            "@ref": "si145",
            "@mimetype": "image/svg+xml"
        },
        {
            "@category": "thumbnail",
            "@_fa": "true",
            "$": "https://api.elsevier.com/content/object/eid/1-s2.0-S0306261922005189-si146.svg?httpAccept=%2A%2F%2A",
            "@multimediatype": "Scalable Vector Graphics file",
            "@type": "ALTIMG",
            "@size": "13962",
            "@ref": "si146",
            "@mimetype": "image/svg+xml"
        },
        {
            "@category": "thumbnail",
            "@_fa": "true",
            "$": "https://api.elsevier.com/content/object/eid/1-s2.0-S0306261922005189-si147.svg?httpAccept=%2A%2F%2A",
            "@multimediatype": "Scalable Vector Graphics file",
            "@type": "ALTIMG",
            "@size": "4444",
            "@ref": "si147",
            "@mimetype": "image/svg+xml"
        },
        {
            "@category": "thumbnail",
            "@_fa": "true",
            "$": "https://api.elsevier.com/content/object/eid/1-s2.0-S0306261922005189-si148.svg?httpAccept=%2A%2F%2A",
            "@multimediatype": "Scalable Vector Graphics file",
            "@type": "ALTIMG",
            "@size": "8254",
            "@ref": "si148",
            "@mimetype": "image/svg+xml"
        },
        {
            "@category": "thumbnail",
            "@_fa": "true",
            "$": "https://api.elsevier.com/content/object/eid/1-s2.0-S0306261922005189-si149.svg?httpAccept=%2A%2F%2A",
            "@multimediatype": "Scalable Vector Graphics file",
            "@type": "ALTIMG",
            "@size": "7694",
            "@ref": "si149",
            "@mimetype": "image/svg+xml"
        },
        {
            "@category": "thumbnail",
            "@_fa": "true",
            "$": "https://api.elsevier.com/content/object/eid/1-s2.0-S0306261922005189-si15.svg?httpAccept=%2A%2F%2A",
            "@multimediatype": "Scalable Vector Graphics file",
            "@type": "ALTIMG",
            "@size": "2152",
            "@ref": "si15",
            "@mimetype": "image/svg+xml"
        },
        {
            "@category": "thumbnail",
            "@_fa": "true",
            "$": "https://api.elsevier.com/content/object/eid/1-s2.0-S0306261922005189-si150.svg?httpAccept=%2A%2F%2A",
            "@multimediatype": "Scalable Vector Graphics file",
            "@type": "ALTIMG",
            "@size": "4582",
            "@ref": "si150",
            "@mimetype": "image/svg+xml"
        },
        {
            "@category": "thumbnail",
            "@_fa": "true",
            "$": "https://api.elsevier.com/content/object/eid/1-s2.0-S0306261922005189-si151.svg?httpAccept=%2A%2F%2A",
            "@multimediatype": "Scalable Vector Graphics file",
            "@type": "ALTIMG",
            "@size": "2269",
            "@ref": "si151",
            "@mimetype": "image/svg+xml"
        },
        {
            "@category": "thumbnail",
            "@_fa": "true",
            "$": "https://api.elsevier.com/content/object/eid/1-s2.0-S0306261922005189-si152.svg?httpAccept=%2A%2F%2A",
            "@multimediatype": "Scalable Vector Graphics file",
            "@type": "ALTIMG",
            "@size": "7304",
            "@ref": "si152",
            "@mimetype": "image/svg+xml"
        },
        {
            "@category": "thumbnail",
            "@_fa": "true",
            "$": "https://api.elsevier.com/content/object/eid/1-s2.0-S0306261922005189-si153.svg?httpAccept=%2A%2F%2A",
            "@multimediatype": "Scalable Vector Graphics file",
            "@type": "ALTIMG",
            "@size": "7829",
            "@ref": "si153",
            "@mimetype": "image/svg+xml"
        },
        {
            "@category": "thumbnail",
            "@_fa": "true",
            "$": "https://api.elsevier.com/content/object/eid/1-s2.0-S0306261922005189-si154.svg?httpAccept=%2A%2F%2A",
            "@multimediatype": "Scalable Vector Graphics file",
            "@type": "ALTIMG",
            "@size": "14567",
            "@ref": "si154",
            "@mimetype": "image/svg+xml"
        },
        {
            "@category": "thumbnail",
            "@_fa": "true",
            "$": "https://api.elsevier.com/content/object/eid/1-s2.0-S0306261922005189-si155.svg?httpAccept=%2A%2F%2A",
            "@multimediatype": "Scalable Vector Graphics file",
            "@type": "ALTIMG",
            "@size": "22828",
            "@ref": "si155",
            "@mimetype": "image/svg+xml"
        },
        {
            "@category": "thumbnail",
            "@_fa": "true",
            "$": "https://api.elsevier.com/content/object/eid/1-s2.0-S0306261922005189-si156.svg?httpAccept=%2A%2F%2A",
            "@multimediatype": "Scalable Vector Graphics file",
            "@type": "ALTIMG",
            "@size": "23331",
            "@ref": "si156",
            "@mimetype": "image/svg+xml"
        },
        {
            "@category": "thumbnail",
            "@_fa": "true",
            "$": "https://api.elsevier.com/content/object/eid/1-s2.0-S0306261922005189-si157.svg?httpAccept=%2A%2F%2A",
            "@multimediatype": "Scalable Vector Graphics file",
            "@type": "ALTIMG",
            "@size": "11837",
            "@ref": "si157",
            "@mimetype": "image/svg+xml"
        },
        {
            "@category": "thumbnail",
            "@_fa": "true",
            "$": "https://api.elsevier.com/content/object/eid/1-s2.0-S0306261922005189-si158.svg?httpAccept=%2A%2F%2A",
            "@multimediatype": "Scalable Vector Graphics file",
            "@type": "ALTIMG",
            "@size": "5940",
            "@ref": "si158",
            "@mimetype": "image/svg+xml"
        },
        {
            "@category": "thumbnail",
            "@_fa": "true",
            "$": "https://api.elsevier.com/content/object/eid/1-s2.0-S0306261922005189-si159.svg?httpAccept=%2A%2F%2A",
            "@multimediatype": "Scalable Vector Graphics file",
            "@type": "ALTIMG",
            "@size": "9118",
            "@ref": "si159",
            "@mimetype": "image/svg+xml"
        },
        {
            "@category": "thumbnail",
            "@_fa": "true",
            "$": "https://api.elsevier.com/content/object/eid/1-s2.0-S0306261922005189-si16.svg?httpAccept=%2A%2F%2A",
            "@multimediatype": "Scalable Vector Graphics file",
            "@type": "ALTIMG",
            "@size": "5347",
            "@ref": "si16",
            "@mimetype": "image/svg+xml"
        },
        {
            "@category": "thumbnail",
            "@_fa": "true",
            "$": "https://api.elsevier.com/content/object/eid/1-s2.0-S0306261922005189-si160.svg?httpAccept=%2A%2F%2A",
            "@multimediatype": "Scalable Vector Graphics file",
            "@type": "ALTIMG",
            "@size": "9626",
            "@ref": "si160",
            "@mimetype": "image/svg+xml"
        },
        {
            "@category": "thumbnail",
            "@_fa": "true",
            "$": "https://api.elsevier.com/content/object/eid/1-s2.0-S0306261922005189-si161.svg?httpAccept=%2A%2F%2A",
            "@multimediatype": "Scalable Vector Graphics file",
            "@type": "ALTIMG",
            "@size": "1427",
            "@ref": "si161",
            "@mimetype": "image/svg+xml"
        },
        {
            "@category": "thumbnail",
            "@_fa": "true",
            "$": "https://api.elsevier.com/content/object/eid/1-s2.0-S0306261922005189-si162.svg?httpAccept=%2A%2F%2A",
            "@multimediatype": "Scalable Vector Graphics file",
            "@type": "ALTIMG",
            "@size": "13063",
            "@ref": "si162",
            "@mimetype": "image/svg+xml"
        },
        {
            "@category": "thumbnail",
            "@_fa": "true",
            "$": "https://api.elsevier.com/content/object/eid/1-s2.0-S0306261922005189-si163.svg?httpAccept=%2A%2F%2A",
            "@multimediatype": "Scalable Vector Graphics file",
            "@type": "ALTIMG",
            "@size": "4694",
            "@ref": "si163",
            "@mimetype": "image/svg+xml"
        },
        {
            "@category": "thumbnail",
            "@_fa": "true",
            "$": "https://api.elsevier.com/content/object/eid/1-s2.0-S0306261922005189-si164.svg?httpAccept=%2A%2F%2A",
            "@multimediatype": "Scalable Vector Graphics file",
            "@type": "ALTIMG",
            "@size": "6278",
            "@ref": "si164",
            "@mimetype": "image/svg+xml"
        },
        {
            "@category": "thumbnail",
            "@_fa": "true",
            "$": "https://api.elsevier.com/content/object/eid/1-s2.0-S0306261922005189-si165.svg?httpAccept=%2A%2F%2A",
            "@multimediatype": "Scalable Vector Graphics file",
            "@type": "ALTIMG",
            "@size": "9158",
            "@ref": "si165",
            "@mimetype": "image/svg+xml"
        },
        {
            "@category": "thumbnail",
            "@_fa": "true",
            "$": "https://api.elsevier.com/content/object/eid/1-s2.0-S0306261922005189-si166.svg?httpAccept=%2A%2F%2A",
            "@multimediatype": "Scalable Vector Graphics file",
            "@type": "ALTIMG",
            "@size": "3545",
            "@ref": "si166",
            "@mimetype": "image/svg+xml"
        },
        {
            "@category": "thumbnail",
            "@_fa": "true",
            "$": "https://api.elsevier.com/content/object/eid/1-s2.0-S0306261922005189-si167.svg?httpAccept=%2A%2F%2A",
            "@multimediatype": "Scalable Vector Graphics file",
            "@type": "ALTIMG",
            "@size": "8878",
            "@ref": "si167",
            "@mimetype": "image/svg+xml"
        },
        {
            "@category": "thumbnail",
            "@_fa": "true",
            "$": "https://api.elsevier.com/content/object/eid/1-s2.0-S0306261922005189-si168.svg?httpAccept=%2A%2F%2A",
            "@multimediatype": "Scalable Vector Graphics file",
            "@type": "ALTIMG",
            "@size": "3359",
            "@ref": "si168",
            "@mimetype": "image/svg+xml"
        },
        {
            "@category": "thumbnail",
            "@_fa": "true",
            "$": "https://api.elsevier.com/content/object/eid/1-s2.0-S0306261922005189-si169.svg?httpAccept=%2A%2F%2A",
            "@multimediatype": "Scalable Vector Graphics file",
            "@type": "ALTIMG",
            "@size": "6494",
            "@ref": "si169",
            "@mimetype": "image/svg+xml"
        },
        {
            "@category": "thumbnail",
            "@_fa": "true",
            "$": "https://api.elsevier.com/content/object/eid/1-s2.0-S0306261922005189-si17.svg?httpAccept=%2A%2F%2A",
            "@multimediatype": "Scalable Vector Graphics file",
            "@type": "ALTIMG",
            "@size": "1569",
            "@ref": "si17",
            "@mimetype": "image/svg+xml"
        },
        {
            "@category": "thumbnail",
            "@_fa": "true",
            "$": "https://api.elsevier.com/content/object/eid/1-s2.0-S0306261922005189-si170.svg?httpAccept=%2A%2F%2A",
            "@multimediatype": "Scalable Vector Graphics file",
            "@type": "ALTIMG",
            "@size": "1352",
            "@ref": "si170",
            "@mimetype": "image/svg+xml"
        },
        {
            "@category": "thumbnail",
            "@_fa": "true",
            "$": "https://api.elsevier.com/content/object/eid/1-s2.0-S0306261922005189-si171.svg?httpAccept=%2A%2F%2A",
            "@multimediatype": "Scalable Vector Graphics file",
            "@type": "ALTIMG",
            "@size": "1812",
            "@ref": "si171",
            "@mimetype": "image/svg+xml"
        },
        {
            "@category": "thumbnail",
            "@_fa": "true",
            "$": "https://api.elsevier.com/content/object/eid/1-s2.0-S0306261922005189-si172.svg?httpAccept=%2A%2F%2A",
            "@multimediatype": "Scalable Vector Graphics file",
            "@type": "ALTIMG",
            "@size": "1749",
            "@ref": "si172",
            "@mimetype": "image/svg+xml"
        },
        {
            "@category": "thumbnail",
            "@_fa": "true",
            "$": "https://api.elsevier.com/content/object/eid/1-s2.0-S0306261922005189-si173.svg?httpAccept=%2A%2F%2A",
            "@multimediatype": "Scalable Vector Graphics file",
            "@type": "ALTIMG",
            "@size": "4454",
            "@ref": "si173",
            "@mimetype": "image/svg+xml"
        },
        {
            "@category": "thumbnail",
            "@_fa": "true",
            "$": "https://api.elsevier.com/content/object/eid/1-s2.0-S0306261922005189-si174.svg?httpAccept=%2A%2F%2A",
            "@multimediatype": "Scalable Vector Graphics file",
            "@type": "ALTIMG",
            "@size": "4675",
            "@ref": "si174",
            "@mimetype": "image/svg+xml"
        },
        {
            "@category": "thumbnail",
            "@_fa": "true",
            "$": "https://api.elsevier.com/content/object/eid/1-s2.0-S0306261922005189-si175.svg?httpAccept=%2A%2F%2A",
            "@multimediatype": "Scalable Vector Graphics file",
            "@type": "ALTIMG",
            "@size": "4968",
            "@ref": "si175",
            "@mimetype": "image/svg+xml"
        },
        {
            "@category": "thumbnail",
            "@_fa": "true",
            "$": "https://api.elsevier.com/content/object/eid/1-s2.0-S0306261922005189-si176.svg?httpAccept=%2A%2F%2A",
            "@multimediatype": "Scalable Vector Graphics file",
            "@type": "ALTIMG",
            "@size": "18284",
            "@ref": "si176",
            "@mimetype": "image/svg+xml"
        },
        {
            "@category": "thumbnail",
            "@_fa": "true",
            "$": "https://api.elsevier.com/content/object/eid/1-s2.0-S0306261922005189-si177.svg?httpAccept=%2A%2F%2A",
            "@multimediatype": "Scalable Vector Graphics file",
            "@type": "ALTIMG",
            "@size": "18329",
            "@ref": "si177",
            "@mimetype": "image/svg+xml"
        },
        {
            "@category": "thumbnail",
            "@_fa": "true",
            "$": "https://api.elsevier.com/content/object/eid/1-s2.0-S0306261922005189-si178.svg?httpAccept=%2A%2F%2A",
            "@multimediatype": "Scalable Vector Graphics file",
            "@type": "ALTIMG",
            "@size": "25238",
            "@ref": "si178",
            "@mimetype": "image/svg+xml"
        },
        {
            "@category": "thumbnail",
            "@_fa": "true",
            "$": "https://api.elsevier.com/content/object/eid/1-s2.0-S0306261922005189-si179.svg?httpAccept=%2A%2F%2A",
            "@multimediatype": "Scalable Vector Graphics file",
            "@type": "ALTIMG",
            "@size": "17462",
            "@ref": "si179",
            "@mimetype": "image/svg+xml"
        },
        {
            "@category": "thumbnail",
            "@_fa": "true",
            "$": "https://api.elsevier.com/content/object/eid/1-s2.0-S0306261922005189-si18.svg?httpAccept=%2A%2F%2A",
            "@multimediatype": "Scalable Vector Graphics file",
            "@type": "ALTIMG",
            "@size": "2857",
            "@ref": "si18",
            "@mimetype": "image/svg+xml"
        },
        {
            "@category": "thumbnail",
            "@_fa": "true",
            "$": "https://api.elsevier.com/content/object/eid/1-s2.0-S0306261922005189-si180.svg?httpAccept=%2A%2F%2A",
            "@multimediatype": "Scalable Vector Graphics file",
            "@type": "ALTIMG",
            "@size": "15785",
            "@ref": "si180",
            "@mimetype": "image/svg+xml"
        },
        {
            "@category": "thumbnail",
            "@_fa": "true",
            "$": "https://api.elsevier.com/content/object/eid/1-s2.0-S0306261922005189-si181.svg?httpAccept=%2A%2F%2A",
            "@multimediatype": "Scalable Vector Graphics file",
            "@type": "ALTIMG",
            "@size": "18652",
            "@ref": "si181",
            "@mimetype": "image/svg+xml"
        },
        {
            "@category": "thumbnail",
            "@_fa": "true",
            "$": "https://api.elsevier.com/content/object/eid/1-s2.0-S0306261922005189-si182.svg?httpAccept=%2A%2F%2A",
            "@multimediatype": "Scalable Vector Graphics file",
            "@type": "ALTIMG",
            "@size": "16193",
            "@ref": "si182",
            "@mimetype": "image/svg+xml"
        },
        {
            "@category": "thumbnail",
            "@_fa": "true",
            "$": "https://api.elsevier.com/content/object/eid/1-s2.0-S0306261922005189-si183.svg?httpAccept=%2A%2F%2A",
            "@multimediatype": "Scalable Vector Graphics file",
            "@type": "ALTIMG",
            "@size": "16193",
            "@ref": "si183",
            "@mimetype": "image/svg+xml"
        },
        {
            "@category": "thumbnail",
            "@_fa": "true",
            "$": "https://api.elsevier.com/content/object/eid/1-s2.0-S0306261922005189-si184.svg?httpAccept=%2A%2F%2A",
            "@multimediatype": "Scalable Vector Graphics file",
            "@type": "ALTIMG",
            "@size": "21520",
            "@ref": "si184",
            "@mimetype": "image/svg+xml"
        },
        {
            "@category": "thumbnail",
            "@_fa": "true",
            "$": "https://api.elsevier.com/content/object/eid/1-s2.0-S0306261922005189-si185.svg?httpAccept=%2A%2F%2A",
            "@multimediatype": "Scalable Vector Graphics file",
            "@type": "ALTIMG",
            "@size": "15296",
            "@ref": "si185",
            "@mimetype": "image/svg+xml"
        },
        {
            "@category": "thumbnail",
            "@_fa": "true",
            "$": "https://api.elsevier.com/content/object/eid/1-s2.0-S0306261922005189-si186.svg?httpAccept=%2A%2F%2A",
            "@multimediatype": "Scalable Vector Graphics file",
            "@type": "ALTIMG",
            "@size": "6068",
            "@ref": "si186",
            "@mimetype": "image/svg+xml"
        },
        {
            "@category": "thumbnail",
            "@_fa": "true",
            "$": "https://api.elsevier.com/content/object/eid/1-s2.0-S0306261922005189-si187.svg?httpAccept=%2A%2F%2A",
            "@multimediatype": "Scalable Vector Graphics file",
            "@type": "ALTIMG",
            "@size": "7199",
            "@ref": "si187",
            "@mimetype": "image/svg+xml"
        },
        {
            "@category": "thumbnail",
            "@_fa": "true",
            "$": "https://api.elsevier.com/content/object/eid/1-s2.0-S0306261922005189-si188.svg?httpAccept=%2A%2F%2A",
            "@multimediatype": "Scalable Vector Graphics file",
            "@type": "ALTIMG",
            "@size": "5848",
            "@ref": "si188",
            "@mimetype": "image/svg+xml"
        },
        {
            "@category": "thumbnail",
            "@_fa": "true",
            "$": "https://api.elsevier.com/content/object/eid/1-s2.0-S0306261922005189-si189.svg?httpAccept=%2A%2F%2A",
            "@multimediatype": "Scalable Vector Graphics file",
            "@type": "ALTIMG",
            "@size": "4455",
            "@ref": "si189",
            "@mimetype": "image/svg+xml"
        },
        {
            "@category": "thumbnail",
            "@_fa": "true",
            "$": "https://api.elsevier.com/content/object/eid/1-s2.0-S0306261922005189-si19.svg?httpAccept=%2A%2F%2A",
            "@multimediatype": "Scalable Vector Graphics file",
            "@type": "ALTIMG",
            "@size": "6789",
            "@ref": "si19",
            "@mimetype": "image/svg+xml"
        },
        {
            "@category": "thumbnail",
            "@_fa": "true",
            "$": "https://api.elsevier.com/content/object/eid/1-s2.0-S0306261922005189-si190.svg?httpAccept=%2A%2F%2A",
            "@multimediatype": "Scalable Vector Graphics file",
            "@type": "ALTIMG",
            "@size": "4110",
            "@ref": "si190",
            "@mimetype": "image/svg+xml"
        },
        {
            "@category": "thumbnail",
            "@_fa": "true",
            "$": "https://api.elsevier.com/content/object/eid/1-s2.0-S0306261922005189-si191.svg?httpAccept=%2A%2F%2A",
            "@multimediatype": "Scalable Vector Graphics file",
            "@type": "ALTIMG",
            "@size": "20267",
            "@ref": "si191",
            "@mimetype": "image/svg+xml"
        },
        {
            "@category": "thumbnail",
            "@_fa": "true",
            "$": "https://api.elsevier.com/content/object/eid/1-s2.0-S0306261922005189-si192.svg?httpAccept=%2A%2F%2A",
            "@multimediatype": "Scalable Vector Graphics file",
            "@type": "ALTIMG",
            "@size": "14523",
            "@ref": "si192",
            "@mimetype": "image/svg+xml"
        },
        {
            "@category": "thumbnail",
            "@_fa": "true",
            "$": "https://api.elsevier.com/content/object/eid/1-s2.0-S0306261922005189-si193.svg?httpAccept=%2A%2F%2A",
            "@multimediatype": "Scalable Vector Graphics file",
            "@type": "ALTIMG",
            "@size": "14381",
            "@ref": "si193",
            "@mimetype": "image/svg+xml"
        },
        {
            "@category": "thumbnail",
            "@_fa": "true",
            "$": "https://api.elsevier.com/content/object/eid/1-s2.0-S0306261922005189-si194.svg?httpAccept=%2A%2F%2A",
            "@multimediatype": "Scalable Vector Graphics file",
            "@type": "ALTIMG",
            "@size": "3044",
            "@ref": "si194",
            "@mimetype": "image/svg+xml"
        },
        {
            "@category": "thumbnail",
            "@_fa": "true",
            "$": "https://api.elsevier.com/content/object/eid/1-s2.0-S0306261922005189-si195.svg?httpAccept=%2A%2F%2A",
            "@multimediatype": "Scalable Vector Graphics file",
            "@type": "ALTIMG",
            "@size": "2597",
            "@ref": "si195",
            "@mimetype": "image/svg+xml"
        },
        {
            "@category": "thumbnail",
            "@_fa": "true",
            "$": "https://api.elsevier.com/content/object/eid/1-s2.0-S0306261922005189-si196.svg?httpAccept=%2A%2F%2A",
            "@multimediatype": "Scalable Vector Graphics file",
            "@type": "ALTIMG",
            "@size": "5578",
            "@ref": "si196",
            "@mimetype": "image/svg+xml"
        },
        {
            "@category": "thumbnail",
            "@_fa": "true",
            "$": "https://api.elsevier.com/content/object/eid/1-s2.0-S0306261922005189-si197.svg?httpAccept=%2A%2F%2A",
            "@multimediatype": "Scalable Vector Graphics file",
            "@type": "ALTIMG",
            "@size": "6726",
            "@ref": "si197",
            "@mimetype": "image/svg+xml"
        },
        {
            "@category": "thumbnail",
            "@_fa": "true",
            "$": "https://api.elsevier.com/content/object/eid/1-s2.0-S0306261922005189-si198.svg?httpAccept=%2A%2F%2A",
            "@multimediatype": "Scalable Vector Graphics file",
            "@type": "ALTIMG",
            "@size": "4647",
            "@ref": "si198",
            "@mimetype": "image/svg+xml"
        },
        {
            "@category": "thumbnail",
            "@_fa": "true",
            "$": "https://api.elsevier.com/content/object/eid/1-s2.0-S0306261922005189-si199.svg?httpAccept=%2A%2F%2A",
            "@multimediatype": "Scalable Vector Graphics file",
            "@type": "ALTIMG",
            "@size": "6076",
            "@ref": "si199",
            "@mimetype": "image/svg+xml"
        },
        {
            "@category": "thumbnail",
            "@_fa": "true",
            "$": "https://api.elsevier.com/content/object/eid/1-s2.0-S0306261922005189-si2.svg?httpAccept=%2A%2F%2A",
            "@multimediatype": "Scalable Vector Graphics file",
            "@type": "ALTIMG",
            "@size": "3041",
            "@ref": "si2",
            "@mimetype": "image/svg+xml"
        },
        {
            "@category": "thumbnail",
            "@_fa": "true",
            "$": "https://api.elsevier.com/content/object/eid/1-s2.0-S0306261922005189-si20.svg?httpAccept=%2A%2F%2A",
            "@multimediatype": "Scalable Vector Graphics file",
            "@type": "ALTIMG",
            "@size": "6718",
            "@ref": "si20",
            "@mimetype": "image/svg+xml"
        },
        {
            "@category": "thumbnail",
            "@_fa": "true",
            "$": "https://api.elsevier.com/content/object/eid/1-s2.0-S0306261922005189-si200.svg?httpAccept=%2A%2F%2A",
            "@multimediatype": "Scalable Vector Graphics file",
            "@type": "ALTIMG",
            "@size": "9509",
            "@ref": "si200",
            "@mimetype": "image/svg+xml"
        },
        {
            "@category": "thumbnail",
            "@_fa": "true",
            "$": "https://api.elsevier.com/content/object/eid/1-s2.0-S0306261922005189-si201.svg?httpAccept=%2A%2F%2A",
            "@multimediatype": "Scalable Vector Graphics file",
            "@type": "ALTIMG",
            "@size": "3577",
            "@ref": "si201",
            "@mimetype": "image/svg+xml"
        },
        {
            "@category": "thumbnail",
            "@_fa": "true",
            "$": "https://api.elsevier.com/content/object/eid/1-s2.0-S0306261922005189-si202.svg?httpAccept=%2A%2F%2A",
            "@multimediatype": "Scalable Vector Graphics file",
            "@type": "ALTIMG",
            "@size": "3435",
            "@ref": "si202",
            "@mimetype": "image/svg+xml"
        },
        {
            "@category": "thumbnail",
            "@_fa": "true",
            "$": "https://api.elsevier.com/content/object/eid/1-s2.0-S0306261922005189-si203.svg?httpAccept=%2A%2F%2A",
            "@multimediatype": "Scalable Vector Graphics file",
            "@type": "ALTIMG",
            "@size": "17750",
            "@ref": "si203",
            "@mimetype": "image/svg+xml"
        },
        {
            "@category": "thumbnail",
            "@_fa": "true",
            "$": "https://api.elsevier.com/content/object/eid/1-s2.0-S0306261922005189-si204.svg?httpAccept=%2A%2F%2A",
            "@multimediatype": "Scalable Vector Graphics file",
            "@type": "ALTIMG",
            "@size": "22867",
            "@ref": "si204",
            "@mimetype": "image/svg+xml"
        },
        {
            "@category": "thumbnail",
            "@_fa": "true",
            "$": "https://api.elsevier.com/content/object/eid/1-s2.0-S0306261922005189-si205.svg?httpAccept=%2A%2F%2A",
            "@multimediatype": "Scalable Vector Graphics file",
            "@type": "ALTIMG",
            "@size": "10252",
            "@ref": "si205",
            "@mimetype": "image/svg+xml"
        },
        {
            "@category": "thumbnail",
            "@_fa": "true",
            "$": "https://api.elsevier.com/content/object/eid/1-s2.0-S0306261922005189-si206.svg?httpAccept=%2A%2F%2A",
            "@multimediatype": "Scalable Vector Graphics file",
            "@type": "ALTIMG",
            "@size": "12558",
            "@ref": "si206",
            "@mimetype": "image/svg+xml"
        },
        {
            "@category": "thumbnail",
            "@_fa": "true",
            "$": "https://api.elsevier.com/content/object/eid/1-s2.0-S0306261922005189-si207.svg?httpAccept=%2A%2F%2A",
            "@multimediatype": "Scalable Vector Graphics file",
            "@type": "ALTIMG",
            "@size": "2076",
            "@ref": "si207",
            "@mimetype": "image/svg+xml"
        },
        {
            "@category": "thumbnail",
            "@_fa": "true",
            "$": "https://api.elsevier.com/content/object/eid/1-s2.0-S0306261922005189-si208.svg?httpAccept=%2A%2F%2A",
            "@multimediatype": "Scalable Vector Graphics file",
            "@type": "ALTIMG",
            "@size": "1932",
            "@ref": "si208",
            "@mimetype": "image/svg+xml"
        },
        {
            "@category": "thumbnail",
            "@_fa": "true",
            "$": "https://api.elsevier.com/content/object/eid/1-s2.0-S0306261922005189-si209.svg?httpAccept=%2A%2F%2A",
            "@multimediatype": "Scalable Vector Graphics file",
            "@type": "ALTIMG",
            "@size": "3232",
            "@ref": "si209",
            "@mimetype": "image/svg+xml"
        },
        {
            "@category": "thumbnail",
            "@_fa": "true",
            "$": "https://api.elsevier.com/content/object/eid/1-s2.0-S0306261922005189-si21.svg?httpAccept=%2A%2F%2A",
            "@multimediatype": "Scalable Vector Graphics file",
            "@type": "ALTIMG",
            "@size": "3899",
            "@ref": "si21",
            "@mimetype": "image/svg+xml"
        },
        {
            "@category": "thumbnail",
            "@_fa": "true",
            "$": "https://api.elsevier.com/content/object/eid/1-s2.0-S0306261922005189-si210.svg?httpAccept=%2A%2F%2A",
            "@multimediatype": "Scalable Vector Graphics file",
            "@type": "ALTIMG",
            "@size": "1962",
            "@ref": "si210",
            "@mimetype": "image/svg+xml"
        },
        {
            "@category": "thumbnail",
            "@_fa": "true",
            "$": "https://api.elsevier.com/content/object/eid/1-s2.0-S0306261922005189-si211.svg?httpAccept=%2A%2F%2A",
            "@multimediatype": "Scalable Vector Graphics file",
            "@type": "ALTIMG",
            "@size": "7221",
            "@ref": "si211",
            "@mimetype": "image/svg+xml"
        },
        {
            "@category": "thumbnail",
            "@_fa": "true",
            "$": "https://api.elsevier.com/content/object/eid/1-s2.0-S0306261922005189-si212.svg?httpAccept=%2A%2F%2A",
            "@multimediatype": "Scalable Vector Graphics file",
            "@type": "ALTIMG",
            "@size": "1691",
            "@ref": "si212",
            "@mimetype": "image/svg+xml"
        },
        {
            "@category": "thumbnail",
            "@_fa": "true",
            "$": "https://api.elsevier.com/content/object/eid/1-s2.0-S0306261922005189-si213.svg?httpAccept=%2A%2F%2A",
            "@multimediatype": "Scalable Vector Graphics file",
            "@type": "ALTIMG",
            "@size": "1203",
            "@ref": "si213",
            "@mimetype": "image/svg+xml"
        },
        {
            "@category": "thumbnail",
            "@_fa": "true",
            "$": "https://api.elsevier.com/content/object/eid/1-s2.0-S0306261922005189-si214.svg?httpAccept=%2A%2F%2A",
            "@multimediatype": "Scalable Vector Graphics file",
            "@type": "ALTIMG",
            "@size": "2950",
            "@ref": "si214",
            "@mimetype": "image/svg+xml"
        },
        {
            "@category": "thumbnail",
            "@_fa": "true",
            "$": "https://api.elsevier.com/content/object/eid/1-s2.0-S0306261922005189-si215.svg?httpAccept=%2A%2F%2A",
            "@multimediatype": "Scalable Vector Graphics file",
            "@type": "ALTIMG",
            "@size": "3248",
            "@ref": "si215",
            "@mimetype": "image/svg+xml"
        },
        {
            "@category": "thumbnail",
            "@_fa": "true",
            "$": "https://api.elsevier.com/content/object/eid/1-s2.0-S0306261922005189-si216.svg?httpAccept=%2A%2F%2A",
            "@multimediatype": "Scalable Vector Graphics file",
            "@type": "ALTIMG",
            "@size": "8358",
            "@ref": "si216",
            "@mimetype": "image/svg+xml"
        },
        {
            "@category": "thumbnail",
            "@_fa": "true",
            "$": "https://api.elsevier.com/content/object/eid/1-s2.0-S0306261922005189-si217.svg?httpAccept=%2A%2F%2A",
            "@multimediatype": "Scalable Vector Graphics file",
            "@type": "ALTIMG",
            "@size": "2900",
            "@ref": "si217",
            "@mimetype": "image/svg+xml"
        },
        {
            "@category": "thumbnail",
            "@_fa": "true",
            "$": "https://api.elsevier.com/content/object/eid/1-s2.0-S0306261922005189-si218.svg?httpAccept=%2A%2F%2A",
            "@multimediatype": "Scalable Vector Graphics file",
            "@type": "ALTIMG",
            "@size": "2953",
            "@ref": "si218",
            "@mimetype": "image/svg+xml"
        },
        {
            "@category": "thumbnail",
            "@_fa": "true",
            "$": "https://api.elsevier.com/content/object/eid/1-s2.0-S0306261922005189-si219.svg?httpAccept=%2A%2F%2A",
            "@multimediatype": "Scalable Vector Graphics file",
            "@type": "ALTIMG",
            "@size": "8384",
            "@ref": "si219",
            "@mimetype": "image/svg+xml"
        },
        {
            "@category": "thumbnail",
            "@_fa": "true",
            "$": "https://api.elsevier.com/content/object/eid/1-s2.0-S0306261922005189-si22.svg?httpAccept=%2A%2F%2A",
            "@multimediatype": "Scalable Vector Graphics file",
            "@type": "ALTIMG",
            "@size": "6353",
            "@ref": "si22",
            "@mimetype": "image/svg+xml"
        },
        {
            "@category": "thumbnail",
            "@_fa": "true",
            "$": "https://api.elsevier.com/content/object/eid/1-s2.0-S0306261922005189-si220.svg?httpAccept=%2A%2F%2A",
            "@multimediatype": "Scalable Vector Graphics file",
            "@type": "ALTIMG",
            "@size": "11639",
            "@ref": "si220",
            "@mimetype": "image/svg+xml"
        },
        {
            "@category": "thumbnail",
            "@_fa": "true",
            "$": "https://api.elsevier.com/content/object/eid/1-s2.0-S0306261922005189-si221.svg?httpAccept=%2A%2F%2A",
            "@multimediatype": "Scalable Vector Graphics file",
            "@type": "ALTIMG",
            "@size": "4609",
            "@ref": "si221",
            "@mimetype": "image/svg+xml"
        },
        {
            "@category": "thumbnail",
            "@_fa": "true",
            "$": "https://api.elsevier.com/content/object/eid/1-s2.0-S0306261922005189-si222.svg?httpAccept=%2A%2F%2A",
            "@multimediatype": "Scalable Vector Graphics file",
            "@type": "ALTIMG",
            "@size": "3084",
            "@ref": "si222",
            "@mimetype": "image/svg+xml"
        },
        {
            "@category": "thumbnail",
            "@_fa": "true",
            "$": "https://api.elsevier.com/content/object/eid/1-s2.0-S0306261922005189-si223.svg?httpAccept=%2A%2F%2A",
            "@multimediatype": "Scalable Vector Graphics file",
            "@type": "ALTIMG",
            "@size": "4053",
            "@ref": "si223",
            "@mimetype": "image/svg+xml"
        },
        {
            "@category": "thumbnail",
            "@_fa": "true",
            "$": "https://api.elsevier.com/content/object/eid/1-s2.0-S0306261922005189-si224.svg?httpAccept=%2A%2F%2A",
            "@multimediatype": "Scalable Vector Graphics file",
            "@type": "ALTIMG",
            "@size": "4661",
            "@ref": "si224",
            "@mimetype": "image/svg+xml"
        },
        {
            "@category": "thumbnail",
            "@_fa": "true",
            "$": "https://api.elsevier.com/content/object/eid/1-s2.0-S0306261922005189-si225.svg?httpAccept=%2A%2F%2A",
            "@multimediatype": "Scalable Vector Graphics file",
            "@type": "ALTIMG",
            "@size": "3582",
            "@ref": "si225",
            "@mimetype": "image/svg+xml"
        },
        {
            "@category": "thumbnail",
            "@_fa": "true",
            "$": "https://api.elsevier.com/content/object/eid/1-s2.0-S0306261922005189-si226.svg?httpAccept=%2A%2F%2A",
            "@multimediatype": "Scalable Vector Graphics file",
            "@type": "ALTIMG",
            "@size": "6556",
            "@ref": "si226",
            "@mimetype": "image/svg+xml"
        },
        {
            "@category": "thumbnail",
            "@_fa": "true",
            "$": "https://api.elsevier.com/content/object/eid/1-s2.0-S0306261922005189-si227.svg?httpAccept=%2A%2F%2A",
            "@multimediatype": "Scalable Vector Graphics file",
            "@type": "ALTIMG",
            "@size": "2953",
            "@ref": "si227",
            "@mimetype": "image/svg+xml"
        },
        {
            "@category": "thumbnail",
            "@_fa": "true",
            "$": "https://api.elsevier.com/content/object/eid/1-s2.0-S0306261922005189-si228.svg?httpAccept=%2A%2F%2A",
            "@multimediatype": "Scalable Vector Graphics file",
            "@type": "ALTIMG",
            "@size": "7914",
            "@ref": "si228",
            "@mimetype": "image/svg+xml"
        },
        {
            "@category": "thumbnail",
            "@_fa": "true",
            "$": "https://api.elsevier.com/content/object/eid/1-s2.0-S0306261922005189-si229.svg?httpAccept=%2A%2F%2A",
            "@multimediatype": "Scalable Vector Graphics file",
            "@type": "ALTIMG",
            "@size": "12172",
            "@ref": "si229",
            "@mimetype": "image/svg+xml"
        },
        {
            "@category": "thumbnail",
            "@_fa": "true",
            "$": "https://api.elsevier.com/content/object/eid/1-s2.0-S0306261922005189-si23.svg?httpAccept=%2A%2F%2A",
            "@multimediatype": "Scalable Vector Graphics file",
            "@type": "ALTIMG",
            "@size": "7327",
            "@ref": "si23",
            "@mimetype": "image/svg+xml"
        },
        {
            "@category": "thumbnail",
            "@_fa": "true",
            "$": "https://api.elsevier.com/content/object/eid/1-s2.0-S0306261922005189-si230.svg?httpAccept=%2A%2F%2A",
            "@multimediatype": "Scalable Vector Graphics file",
            "@type": "ALTIMG",
            "@size": "10940",
            "@ref": "si230",
            "@mimetype": "image/svg+xml"
        },
        {
            "@category": "thumbnail",
            "@_fa": "true",
            "$": "https://api.elsevier.com/content/object/eid/1-s2.0-S0306261922005189-si231.svg?httpAccept=%2A%2F%2A",
            "@multimediatype": "Scalable Vector Graphics file",
            "@type": "ALTIMG",
            "@size": "6534",
            "@ref": "si231",
            "@mimetype": "image/svg+xml"
        },
        {
            "@category": "thumbnail",
            "@_fa": "true",
            "$": "https://api.elsevier.com/content/object/eid/1-s2.0-S0306261922005189-si232.svg?httpAccept=%2A%2F%2A",
            "@multimediatype": "Scalable Vector Graphics file",
            "@type": "ALTIMG",
            "@size": "8038",
            "@ref": "si232",
            "@mimetype": "image/svg+xml"
        },
        {
            "@category": "thumbnail",
            "@_fa": "true",
            "$": "https://api.elsevier.com/content/object/eid/1-s2.0-S0306261922005189-si233.svg?httpAccept=%2A%2F%2A",
            "@multimediatype": "Scalable Vector Graphics file",
            "@type": "ALTIMG",
            "@size": "6532",
            "@ref": "si233",
            "@mimetype": "image/svg+xml"
        },
        {
            "@category": "thumbnail",
            "@_fa": "true",
            "$": "https://api.elsevier.com/content/object/eid/1-s2.0-S0306261922005189-si234.svg?httpAccept=%2A%2F%2A",
            "@multimediatype": "Scalable Vector Graphics file",
            "@type": "ALTIMG",
            "@size": "8038",
            "@ref": "si234",
            "@mimetype": "image/svg+xml"
        },
        {
            "@category": "thumbnail",
            "@_fa": "true",
            "$": "https://api.elsevier.com/content/object/eid/1-s2.0-S0306261922005189-si235.svg?httpAccept=%2A%2F%2A",
            "@multimediatype": "Scalable Vector Graphics file",
            "@type": "ALTIMG",
            "@size": "5452",
            "@ref": "si235",
            "@mimetype": "image/svg+xml"
        },
        {
            "@category": "thumbnail",
            "@_fa": "true",
            "$": "https://api.elsevier.com/content/object/eid/1-s2.0-S0306261922005189-si236.svg?httpAccept=%2A%2F%2A",
            "@multimediatype": "Scalable Vector Graphics file",
            "@type": "ALTIMG",
            "@size": "6092",
            "@ref": "si236",
            "@mimetype": "image/svg+xml"
        },
        {
            "@category": "thumbnail",
            "@_fa": "true",
            "$": "https://api.elsevier.com/content/object/eid/1-s2.0-S0306261922005189-si237.svg?httpAccept=%2A%2F%2A",
            "@multimediatype": "Scalable Vector Graphics file",
            "@type": "ALTIMG",
            "@size": "6539",
            "@ref": "si237",
            "@mimetype": "image/svg+xml"
        },
        {
            "@category": "thumbnail",
            "@_fa": "true",
            "$": "https://api.elsevier.com/content/object/eid/1-s2.0-S0306261922005189-si238.svg?httpAccept=%2A%2F%2A",
            "@multimediatype": "Scalable Vector Graphics file",
            "@type": "ALTIMG",
            "@size": "6537",
            "@ref": "si238",
            "@mimetype": "image/svg+xml"
        },
        {
            "@category": "thumbnail",
            "@_fa": "true",
            "$": "https://api.elsevier.com/content/object/eid/1-s2.0-S0306261922005189-si239.svg?httpAccept=%2A%2F%2A",
            "@multimediatype": "Scalable Vector Graphics file",
            "@type": "ALTIMG",
            "@size": "30365",
            "@ref": "si239",
            "@mimetype": "image/svg+xml"
        },
        {
            "@category": "thumbnail",
            "@_fa": "true",
            "$": "https://api.elsevier.com/content/object/eid/1-s2.0-S0306261922005189-si24.svg?httpAccept=%2A%2F%2A",
            "@multimediatype": "Scalable Vector Graphics file",
            "@type": "ALTIMG",
            "@size": "6687",
            "@ref": "si24",
            "@mimetype": "image/svg+xml"
        },
        {
            "@category": "thumbnail",
            "@_fa": "true",
            "$": "https://api.elsevier.com/content/object/eid/1-s2.0-S0306261922005189-si240.svg?httpAccept=%2A%2F%2A",
            "@multimediatype": "Scalable Vector Graphics file",
            "@type": "ALTIMG",
            "@size": "23177",
            "@ref": "si240",
            "@mimetype": "image/svg+xml"
        },
        {
            "@category": "thumbnail",
            "@_fa": "true",
            "$": "https://api.elsevier.com/content/object/eid/1-s2.0-S0306261922005189-si241.svg?httpAccept=%2A%2F%2A",
            "@multimediatype": "Scalable Vector Graphics file",
            "@type": "ALTIMG",
            "@size": "25624",
            "@ref": "si241",
            "@mimetype": "image/svg+xml"
        },
        {
            "@category": "thumbnail",
            "@_fa": "true",
            "$": "https://api.elsevier.com/content/object/eid/1-s2.0-S0306261922005189-si242.svg?httpAccept=%2A%2F%2A",
            "@multimediatype": "Scalable Vector Graphics file",
            "@type": "ALTIMG",
            "@size": "26941",
            "@ref": "si242",
            "@mimetype": "image/svg+xml"
        },
        {
            "@category": "thumbnail",
            "@_fa": "true",
            "$": "https://api.elsevier.com/content/object/eid/1-s2.0-S0306261922005189-si243.svg?httpAccept=%2A%2F%2A",
            "@multimediatype": "Scalable Vector Graphics file",
            "@type": "ALTIMG",
            "@size": "17907",
            "@ref": "si243",
            "@mimetype": "image/svg+xml"
        },
        {
            "@category": "thumbnail",
            "@_fa": "true",
            "$": "https://api.elsevier.com/content/object/eid/1-s2.0-S0306261922005189-si244.svg?httpAccept=%2A%2F%2A",
            "@multimediatype": "Scalable Vector Graphics file",
            "@type": "ALTIMG",
            "@size": "14090",
            "@ref": "si244",
            "@mimetype": "image/svg+xml"
        },
        {
            "@category": "thumbnail",
            "@_fa": "true",
            "$": "https://api.elsevier.com/content/object/eid/1-s2.0-S0306261922005189-si245.svg?httpAccept=%2A%2F%2A",
            "@multimediatype": "Scalable Vector Graphics file",
            "@type": "ALTIMG",
            "@size": "18954",
            "@ref": "si245",
            "@mimetype": "image/svg+xml"
        },
        {
            "@category": "thumbnail",
            "@_fa": "true",
            "$": "https://api.elsevier.com/content/object/eid/1-s2.0-S0306261922005189-si246.svg?httpAccept=%2A%2F%2A",
            "@multimediatype": "Scalable Vector Graphics file",
            "@type": "ALTIMG",
            "@size": "7772",
            "@ref": "si246",
            "@mimetype": "image/svg+xml"
        },
        {
            "@category": "thumbnail",
            "@_fa": "true",
            "$": "https://api.elsevier.com/content/object/eid/1-s2.0-S0306261922005189-si247.svg?httpAccept=%2A%2F%2A",
            "@multimediatype": "Scalable Vector Graphics file",
            "@type": "ALTIMG",
            "@size": "7772",
            "@ref": "si247",
            "@mimetype": "image/svg+xml"
        },
        {
            "@category": "thumbnail",
            "@_fa": "true",
            "$": "https://api.elsevier.com/content/object/eid/1-s2.0-S0306261922005189-si248.svg?httpAccept=%2A%2F%2A",
            "@multimediatype": "Scalable Vector Graphics file",
            "@type": "ALTIMG",
            "@size": "4068",
            "@ref": "si248",
            "@mimetype": "image/svg+xml"
        },
        {
            "@category": "thumbnail",
            "@_fa": "true",
            "$": "https://api.elsevier.com/content/object/eid/1-s2.0-S0306261922005189-si249.svg?httpAccept=%2A%2F%2A",
            "@multimediatype": "Scalable Vector Graphics file",
            "@type": "ALTIMG",
            "@size": "4831",
            "@ref": "si249",
            "@mimetype": "image/svg+xml"
        },
        {
            "@category": "thumbnail",
            "@_fa": "true",
            "$": "https://api.elsevier.com/content/object/eid/1-s2.0-S0306261922005189-si25.svg?httpAccept=%2A%2F%2A",
            "@multimediatype": "Scalable Vector Graphics file",
            "@type": "ALTIMG",
            "@size": "6564",
            "@ref": "si25",
            "@mimetype": "image/svg+xml"
        },
        {
            "@category": "thumbnail",
            "@_fa": "true",
            "$": "https://api.elsevier.com/content/object/eid/1-s2.0-S0306261922005189-si250.svg?httpAccept=%2A%2F%2A",
            "@multimediatype": "Scalable Vector Graphics file",
            "@type": "ALTIMG",
            "@size": "6336",
            "@ref": "si250",
            "@mimetype": "image/svg+xml"
        },
        {
            "@category": "thumbnail",
            "@_fa": "true",
            "$": "https://api.elsevier.com/content/object/eid/1-s2.0-S0306261922005189-si251.svg?httpAccept=%2A%2F%2A",
            "@multimediatype": "Scalable Vector Graphics file",
            "@type": "ALTIMG",
            "@size": "5685",
            "@ref": "si251",
            "@mimetype": "image/svg+xml"
        },
        {
            "@category": "thumbnail",
            "@_fa": "true",
            "$": "https://api.elsevier.com/content/object/eid/1-s2.0-S0306261922005189-si252.svg?httpAccept=%2A%2F%2A",
            "@multimediatype": "Scalable Vector Graphics file",
            "@type": "ALTIMG",
            "@size": "9472",
            "@ref": "si252",
            "@mimetype": "image/svg+xml"
        },
        {
            "@category": "thumbnail",
            "@_fa": "true",
            "$": "https://api.elsevier.com/content/object/eid/1-s2.0-S0306261922005189-si253.svg?httpAccept=%2A%2F%2A",
            "@multimediatype": "Scalable Vector Graphics file",
            "@type": "ALTIMG",
            "@size": "7775",
            "@ref": "si253",
            "@mimetype": "image/svg+xml"
        },
        {
            "@category": "thumbnail",
            "@_fa": "true",
            "$": "https://api.elsevier.com/content/object/eid/1-s2.0-S0306261922005189-si254.svg?httpAccept=%2A%2F%2A",
            "@multimediatype": "Scalable Vector Graphics file",
            "@type": "ALTIMG",
            "@size": "7775",
            "@ref": "si254",
            "@mimetype": "image/svg+xml"
        },
        {
            "@category": "thumbnail",
            "@_fa": "true",
            "$": "https://api.elsevier.com/content/object/eid/1-s2.0-S0306261922005189-si255.svg?httpAccept=%2A%2F%2A",
            "@multimediatype": "Scalable Vector Graphics file",
            "@type": "ALTIMG",
            "@size": "6278",
            "@ref": "si255",
            "@mimetype": "image/svg+xml"
        },
        {
            "@category": "thumbnail",
            "@_fa": "true",
            "$": "https://api.elsevier.com/content/object/eid/1-s2.0-S0306261922005189-si256.svg?httpAccept=%2A%2F%2A",
            "@multimediatype": "Scalable Vector Graphics file",
            "@type": "ALTIMG",
            "@size": "6278",
            "@ref": "si256",
            "@mimetype": "image/svg+xml"
        },
        {
            "@category": "thumbnail",
            "@_fa": "true",
            "$": "https://api.elsevier.com/content/object/eid/1-s2.0-S0306261922005189-si257.svg?httpAccept=%2A%2F%2A",
            "@multimediatype": "Scalable Vector Graphics file",
            "@type": "ALTIMG",
            "@size": "1301",
            "@ref": "si257",
            "@mimetype": "image/svg+xml"
        },
        {
            "@category": "thumbnail",
            "@_fa": "true",
            "$": "https://api.elsevier.com/content/object/eid/1-s2.0-S0306261922005189-si258.svg?httpAccept=%2A%2F%2A",
            "@multimediatype": "Scalable Vector Graphics file",
            "@type": "ALTIMG",
            "@size": "6375",
            "@ref": "si258",
            "@mimetype": "image/svg+xml"
        },
        {
            "@category": "thumbnail",
            "@_fa": "true",
            "$": "https://api.elsevier.com/content/object/eid/1-s2.0-S0306261922005189-si259.svg?httpAccept=%2A%2F%2A",
            "@multimediatype": "Scalable Vector Graphics file",
            "@type": "ALTIMG",
            "@size": "5172",
            "@ref": "si259",
            "@mimetype": "image/svg+xml"
        },
        {
            "@category": "thumbnail",
            "@_fa": "true",
            "$": "https://api.elsevier.com/content/object/eid/1-s2.0-S0306261922005189-si26.svg?httpAccept=%2A%2F%2A",
            "@multimediatype": "Scalable Vector Graphics file",
            "@type": "ALTIMG",
            "@size": "2324",
            "@ref": "si26",
            "@mimetype": "image/svg+xml"
        },
        {
            "@category": "thumbnail",
            "@_fa": "true",
            "$": "https://api.elsevier.com/content/object/eid/1-s2.0-S0306261922005189-si260.svg?httpAccept=%2A%2F%2A",
            "@multimediatype": "Scalable Vector Graphics file",
            "@type": "ALTIMG",
            "@size": "6610",
            "@ref": "si260",
            "@mimetype": "image/svg+xml"
        },
        {
            "@category": "thumbnail",
            "@_fa": "true",
            "$": "https://api.elsevier.com/content/object/eid/1-s2.0-S0306261922005189-si261.svg?httpAccept=%2A%2F%2A",
            "@multimediatype": "Scalable Vector Graphics file",
            "@type": "ALTIMG",
            "@size": "6703",
            "@ref": "si261",
            "@mimetype": "image/svg+xml"
        },
        {
            "@category": "thumbnail",
            "@_fa": "true",
            "$": "https://api.elsevier.com/content/object/eid/1-s2.0-S0306261922005189-si262.svg?httpAccept=%2A%2F%2A",
            "@multimediatype": "Scalable Vector Graphics file",
            "@type": "ALTIMG",
            "@size": "21144",
            "@ref": "si262",
            "@mimetype": "image/svg+xml"
        },
        {
            "@category": "thumbnail",
            "@_fa": "true",
            "$": "https://api.elsevier.com/content/object/eid/1-s2.0-S0306261922005189-si263.svg?httpAccept=%2A%2F%2A",
            "@multimediatype": "Scalable Vector Graphics file",
            "@type": "ALTIMG",
            "@size": "10867",
            "@ref": "si263",
            "@mimetype": "image/svg+xml"
        },
        {
            "@category": "thumbnail",
            "@_fa": "true",
            "$": "https://api.elsevier.com/content/object/eid/1-s2.0-S0306261922005189-si264.svg?httpAccept=%2A%2F%2A",
            "@multimediatype": "Scalable Vector Graphics file",
            "@type": "ALTIMG",
            "@size": "14344",
            "@ref": "si264",
            "@mimetype": "image/svg+xml"
        },
        {
            "@category": "thumbnail",
            "@_fa": "true",
            "$": "https://api.elsevier.com/content/object/eid/1-s2.0-S0306261922005189-si265.svg?httpAccept=%2A%2F%2A",
            "@multimediatype": "Scalable Vector Graphics file",
            "@type": "ALTIMG",
            "@size": "41341",
            "@ref": "si265",
            "@mimetype": "image/svg+xml"
        },
        {
            "@category": "thumbnail",
            "@_fa": "true",
            "$": "https://api.elsevier.com/content/object/eid/1-s2.0-S0306261922005189-si266.svg?httpAccept=%2A%2F%2A",
            "@multimediatype": "Scalable Vector Graphics file",
            "@type": "ALTIMG",
            "@size": "19087",
            "@ref": "si266",
            "@mimetype": "image/svg+xml"
        },
        {
            "@category": "thumbnail",
            "@_fa": "true",
            "$": "https://api.elsevier.com/content/object/eid/1-s2.0-S0306261922005189-si267.svg?httpAccept=%2A%2F%2A",
            "@multimediatype": "Scalable Vector Graphics file",
            "@type": "ALTIMG",
            "@size": "19087",
            "@ref": "si267",
            "@mimetype": "image/svg+xml"
        },
        {
            "@category": "thumbnail",
            "@_fa": "true",
            "$": "https://api.elsevier.com/content/object/eid/1-s2.0-S0306261922005189-si268.svg?httpAccept=%2A%2F%2A",
            "@multimediatype": "Scalable Vector Graphics file",
            "@type": "ALTIMG",
            "@size": "12635",
            "@ref": "si268",
            "@mimetype": "image/svg+xml"
        },
        {
            "@category": "thumbnail",
            "@_fa": "true",
            "$": "https://api.elsevier.com/content/object/eid/1-s2.0-S0306261922005189-si269.svg?httpAccept=%2A%2F%2A",
            "@multimediatype": "Scalable Vector Graphics file",
            "@type": "ALTIMG",
            "@size": "34286",
            "@ref": "si269",
            "@mimetype": "image/svg+xml"
        },
        {
            "@category": "thumbnail",
            "@_fa": "true",
            "$": "https://api.elsevier.com/content/object/eid/1-s2.0-S0306261922005189-si27.svg?httpAccept=%2A%2F%2A",
            "@multimediatype": "Scalable Vector Graphics file",
            "@type": "ALTIMG",
            "@size": "6897",
            "@ref": "si27",
            "@mimetype": "image/svg+xml"
        },
        {
            "@category": "thumbnail",
            "@_fa": "true",
            "$": "https://api.elsevier.com/content/object/eid/1-s2.0-S0306261922005189-si270.svg?httpAccept=%2A%2F%2A",
            "@multimediatype": "Scalable Vector Graphics file",
            "@type": "ALTIMG",
            "@size": "34801",
            "@ref": "si270",
            "@mimetype": "image/svg+xml"
        },
        {
            "@category": "thumbnail",
            "@_fa": "true",
            "$": "https://api.elsevier.com/content/object/eid/1-s2.0-S0306261922005189-si271.svg?httpAccept=%2A%2F%2A",
            "@multimediatype": "Scalable Vector Graphics file",
            "@type": "ALTIMG",
            "@size": "14907",
            "@ref": "si271",
            "@mimetype": "image/svg+xml"
        },
        {
            "@category": "thumbnail",
            "@_fa": "true",
            "$": "https://api.elsevier.com/content/object/eid/1-s2.0-S0306261922005189-si272.svg?httpAccept=%2A%2F%2A",
            "@multimediatype": "Scalable Vector Graphics file",
            "@type": "ALTIMG",
            "@size": "12171",
            "@ref": "si272",
            "@mimetype": "image/svg+xml"
        },
        {
            "@category": "thumbnail",
            "@_fa": "true",
            "$": "https://api.elsevier.com/content/object/eid/1-s2.0-S0306261922005189-si273.svg?httpAccept=%2A%2F%2A",
            "@multimediatype": "Scalable Vector Graphics file",
            "@type": "ALTIMG",
            "@size": "14455",
            "@ref": "si273",
            "@mimetype": "image/svg+xml"
        },
        {
            "@category": "thumbnail",
            "@_fa": "true",
            "$": "https://api.elsevier.com/content/object/eid/1-s2.0-S0306261922005189-si28.svg?httpAccept=%2A%2F%2A",
            "@multimediatype": "Scalable Vector Graphics file",
            "@type": "ALTIMG",
            "@size": "7040",
            "@ref": "si28",
            "@mimetype": "image/svg+xml"
        },
        {
            "@category": "thumbnail",
            "@_fa": "true",
            "$": "https://api.elsevier.com/content/object/eid/1-s2.0-S0306261922005189-si29.svg?httpAccept=%2A%2F%2A",
            "@multimediatype": "Scalable Vector Graphics file",
            "@type": "ALTIMG",
            "@size": "6635",
            "@ref": "si29",
            "@mimetype": "image/svg+xml"
        },
        {
            "@category": "thumbnail",
            "@_fa": "true",
            "$": "https://api.elsevier.com/content/object/eid/1-s2.0-S0306261922005189-si3.svg?httpAccept=%2A%2F%2A",
            "@multimediatype": "Scalable Vector Graphics file",
            "@type": "ALTIMG",
            "@size": "4430",
            "@ref": "si3",
            "@mimetype": "image/svg+xml"
        },
        {
            "@category": "thumbnail",
            "@_fa": "true",
            "$": "https://api.elsevier.com/content/object/eid/1-s2.0-S0306261922005189-si30.svg?httpAccept=%2A%2F%2A",
            "@multimediatype": "Scalable Vector Graphics file",
            "@type": "ALTIMG",
            "@size": "3138",
            "@ref": "si30",
            "@mimetype": "image/svg+xml"
        },
        {
            "@category": "thumbnail",
            "@_fa": "true",
            "$": "https://api.elsevier.com/content/object/eid/1-s2.0-S0306261922005189-si31.svg?httpAccept=%2A%2F%2A",
            "@multimediatype": "Scalable Vector Graphics file",
            "@type": "ALTIMG",
            "@size": "5446",
            "@ref": "si31",
            "@mimetype": "image/svg+xml"
        },
        {
            "@category": "thumbnail",
            "@_fa": "true",
            "$": "https://api.elsevier.com/content/object/eid/1-s2.0-S0306261922005189-si32.svg?httpAccept=%2A%2F%2A",
            "@multimediatype": "Scalable Vector Graphics file",
            "@type": "ALTIMG",
            "@size": "4427",
            "@ref": "si32",
            "@mimetype": "image/svg+xml"
        },
        {
            "@category": "thumbnail",
            "@_fa": "true",
            "$": "https://api.elsevier.com/content/object/eid/1-s2.0-S0306261922005189-si33.svg?httpAccept=%2A%2F%2A",
            "@multimediatype": "Scalable Vector Graphics file",
            "@type": "ALTIMG",
            "@size": "3022",
            "@ref": "si33",
            "@mimetype": "image/svg+xml"
        },
        {
            "@category": "thumbnail",
            "@_fa": "true",
            "$": "https://api.elsevier.com/content/object/eid/1-s2.0-S0306261922005189-si34.svg?httpAccept=%2A%2F%2A",
            "@multimediatype": "Scalable Vector Graphics file",
            "@type": "ALTIMG",
            "@size": "2892",
            "@ref": "si34",
            "@mimetype": "image/svg+xml"
        },
        {
            "@category": "thumbnail",
            "@_fa": "true",
            "$": "https://api.elsevier.com/content/object/eid/1-s2.0-S0306261922005189-si35.svg?httpAccept=%2A%2F%2A",
            "@multimediatype": "Scalable Vector Graphics file",
            "@type": "ALTIMG",
            "@size": "7209",
            "@ref": "si35",
            "@mimetype": "image/svg+xml"
        },
        {
            "@category": "thumbnail",
            "@_fa": "true",
            "$": "https://api.elsevier.com/content/object/eid/1-s2.0-S0306261922005189-si36.svg?httpAccept=%2A%2F%2A",
            "@multimediatype": "Scalable Vector Graphics file",
            "@type": "ALTIMG",
            "@size": "8016",
            "@ref": "si36",
            "@mimetype": "image/svg+xml"
        },
        {
            "@category": "thumbnail",
            "@_fa": "true",
            "$": "https://api.elsevier.com/content/object/eid/1-s2.0-S0306261922005189-si37.svg?httpAccept=%2A%2F%2A",
            "@multimediatype": "Scalable Vector Graphics file",
            "@type": "ALTIMG",
            "@size": "3606",
            "@ref": "si37",
            "@mimetype": "image/svg+xml"
        },
        {
            "@category": "thumbnail",
            "@_fa": "true",
            "$": "https://api.elsevier.com/content/object/eid/1-s2.0-S0306261922005189-si38.svg?httpAccept=%2A%2F%2A",
            "@multimediatype": "Scalable Vector Graphics file",
            "@type": "ALTIMG",
            "@size": "21620",
            "@ref": "si38",
            "@mimetype": "image/svg+xml"
        },
        {
            "@category": "thumbnail",
            "@_fa": "true",
            "$": "https://api.elsevier.com/content/object/eid/1-s2.0-S0306261922005189-si39.svg?httpAccept=%2A%2F%2A",
            "@multimediatype": "Scalable Vector Graphics file",
            "@type": "ALTIMG",
            "@size": "21681",
            "@ref": "si39",
            "@mimetype": "image/svg+xml"
        },
        {
            "@category": "thumbnail",
            "@_fa": "true",
            "$": "https://api.elsevier.com/content/object/eid/1-s2.0-S0306261922005189-si4.svg?httpAccept=%2A%2F%2A",
            "@multimediatype": "Scalable Vector Graphics file",
            "@type": "ALTIMG",
            "@size": "1276",
            "@ref": "si4",
            "@mimetype": "image/svg+xml"
        },
        {
            "@category": "thumbnail",
            "@_fa": "true",
            "$": "https://api.elsevier.com/content/object/eid/1-s2.0-S0306261922005189-si40.svg?httpAccept=%2A%2F%2A",
            "@multimediatype": "Scalable Vector Graphics file",
            "@type": "ALTIMG",
            "@size": "28797",
            "@ref": "si40",
            "@mimetype": "image/svg+xml"
        },
        {
            "@category": "thumbnail",
            "@_fa": "true",
            "$": "https://api.elsevier.com/content/object/eid/1-s2.0-S0306261922005189-si41.svg?httpAccept=%2A%2F%2A",
            "@multimediatype": "Scalable Vector Graphics file",
            "@type": "ALTIMG",
            "@size": "18502",
            "@ref": "si41",
            "@mimetype": "image/svg+xml"
        },
        {
            "@category": "thumbnail",
            "@_fa": "true",
            "$": "https://api.elsevier.com/content/object/eid/1-s2.0-S0306261922005189-si42.svg?httpAccept=%2A%2F%2A",
            "@multimediatype": "Scalable Vector Graphics file",
            "@type": "ALTIMG",
            "@size": "27140",
            "@ref": "si42",
            "@mimetype": "image/svg+xml"
        },
        {
            "@category": "thumbnail",
            "@_fa": "true",
            "$": "https://api.elsevier.com/content/object/eid/1-s2.0-S0306261922005189-si43.svg?httpAccept=%2A%2F%2A",
            "@multimediatype": "Scalable Vector Graphics file",
            "@type": "ALTIMG",
            "@size": "19215",
            "@ref": "si43",
            "@mimetype": "image/svg+xml"
        },
        {
            "@category": "thumbnail",
            "@_fa": "true",
            "$": "https://api.elsevier.com/content/object/eid/1-s2.0-S0306261922005189-si44.svg?httpAccept=%2A%2F%2A",
            "@multimediatype": "Scalable Vector Graphics file",
            "@type": "ALTIMG",
            "@size": "24220",
            "@ref": "si44",
            "@mimetype": "image/svg+xml"
        },
        {
            "@category": "thumbnail",
            "@_fa": "true",
            "$": "https://api.elsevier.com/content/object/eid/1-s2.0-S0306261922005189-si45.svg?httpAccept=%2A%2F%2A",
            "@multimediatype": "Scalable Vector Graphics file",
            "@type": "ALTIMG",
            "@size": "10186",
            "@ref": "si45",
            "@mimetype": "image/svg+xml"
        },
        {
            "@category": "thumbnail",
            "@_fa": "true",
            "$": "https://api.elsevier.com/content/object/eid/1-s2.0-S0306261922005189-si46.svg?httpAccept=%2A%2F%2A",
            "@multimediatype": "Scalable Vector Graphics file",
            "@type": "ALTIMG",
            "@size": "41567",
            "@ref": "si46",
            "@mimetype": "image/svg+xml"
        },
        {
            "@category": "thumbnail",
            "@_fa": "true",
            "$": "https://api.elsevier.com/content/object/eid/1-s2.0-S0306261922005189-si47.svg?httpAccept=%2A%2F%2A",
            "@multimediatype": "Scalable Vector Graphics file",
            "@type": "ALTIMG",
            "@size": "3906",
            "@ref": "si47",
            "@mimetype": "image/svg+xml"
        },
        {
            "@category": "thumbnail",
            "@_fa": "true",
            "$": "https://api.elsevier.com/content/object/eid/1-s2.0-S0306261922005189-si48.svg?httpAccept=%2A%2F%2A",
            "@multimediatype": "Scalable Vector Graphics file",
            "@type": "ALTIMG",
            "@size": "4776",
            "@ref": "si48",
            "@mimetype": "image/svg+xml"
        },
        {
            "@category": "thumbnail",
            "@_fa": "true",
            "$": "https://api.elsevier.com/content/object/eid/1-s2.0-S0306261922005189-si49.svg?httpAccept=%2A%2F%2A",
            "@multimediatype": "Scalable Vector Graphics file",
            "@type": "ALTIMG",
            "@size": "2217",
            "@ref": "si49",
            "@mimetype": "image/svg+xml"
        },
        {
            "@category": "thumbnail",
            "@_fa": "true",
            "$": "https://api.elsevier.com/content/object/eid/1-s2.0-S0306261922005189-si5.svg?httpAccept=%2A%2F%2A",
            "@multimediatype": "Scalable Vector Graphics file",
            "@type": "ALTIMG",
            "@size": "6273",
            "@ref": "si5",
            "@mimetype": "image/svg+xml"
        },
        {
            "@category": "thumbnail",
            "@_fa": "true",
            "$": "https://api.elsevier.com/content/object/eid/1-s2.0-S0306261922005189-si50.svg?httpAccept=%2A%2F%2A",
            "@multimediatype": "Scalable Vector Graphics file",
            "@type": "ALTIMG",
            "@size": "3959",
            "@ref": "si50",
            "@mimetype": "image/svg+xml"
        },
        {
            "@category": "thumbnail",
            "@_fa": "true",
            "$": "https://api.elsevier.com/content/object/eid/1-s2.0-S0306261922005189-si51.svg?httpAccept=%2A%2F%2A",
            "@multimediatype": "Scalable Vector Graphics file",
            "@type": "ALTIMG",
            "@size": "12110",
            "@ref": "si51",
            "@mimetype": "image/svg+xml"
        },
        {
            "@category": "thumbnail",
            "@_fa": "true",
            "$": "https://api.elsevier.com/content/object/eid/1-s2.0-S0306261922005189-si52.svg?httpAccept=%2A%2F%2A",
            "@multimediatype": "Scalable Vector Graphics file",
            "@type": "ALTIMG",
            "@size": "8424",
            "@ref": "si52",
            "@mimetype": "image/svg+xml"
        },
        {
            "@category": "thumbnail",
            "@_fa": "true",
            "$": "https://api.elsevier.com/content/object/eid/1-s2.0-S0306261922005189-si53.svg?httpAccept=%2A%2F%2A",
            "@multimediatype": "Scalable Vector Graphics file",
            "@type": "ALTIMG",
            "@size": "31119",
            "@ref": "si53",
            "@mimetype": "image/svg+xml"
        },
        {
            "@category": "thumbnail",
            "@_fa": "true",
            "$": "https://api.elsevier.com/content/object/eid/1-s2.0-S0306261922005189-si54.svg?httpAccept=%2A%2F%2A",
            "@multimediatype": "Scalable Vector Graphics file",
            "@type": "ALTIMG",
            "@size": "18508",
            "@ref": "si54",
            "@mimetype": "image/svg+xml"
        },
        {
            "@category": "thumbnail",
            "@_fa": "true",
            "$": "https://api.elsevier.com/content/object/eid/1-s2.0-S0306261922005189-si55.svg?httpAccept=%2A%2F%2A",
            "@multimediatype": "Scalable Vector Graphics file",
            "@type": "ALTIMG",
            "@size": "21751",
            "@ref": "si55",
            "@mimetype": "image/svg+xml"
        },
        {
            "@category": "thumbnail",
            "@_fa": "true",
            "$": "https://api.elsevier.com/content/object/eid/1-s2.0-S0306261922005189-si56.svg?httpAccept=%2A%2F%2A",
            "@multimediatype": "Scalable Vector Graphics file",
            "@type": "ALTIMG",
            "@size": "3986",
            "@ref": "si56",
            "@mimetype": "image/svg+xml"
        },
        {
            "@category": "thumbnail",
            "@_fa": "true",
            "$": "https://api.elsevier.com/content/object/eid/1-s2.0-S0306261922005189-si57.svg?httpAccept=%2A%2F%2A",
            "@multimediatype": "Scalable Vector Graphics file",
            "@type": "ALTIMG",
            "@size": "8124",
            "@ref": "si57",
            "@mimetype": "image/svg+xml"
        },
        {
            "@category": "thumbnail",
            "@_fa": "true",
            "$": "https://api.elsevier.com/content/object/eid/1-s2.0-S0306261922005189-si58.svg?httpAccept=%2A%2F%2A",
            "@multimediatype": "Scalable Vector Graphics file",
            "@type": "ALTIMG",
            "@size": "4990",
            "@ref": "si58",
            "@mimetype": "image/svg+xml"
        },
        {
            "@category": "thumbnail",
            "@_fa": "true",
            "$": "https://api.elsevier.com/content/object/eid/1-s2.0-S0306261922005189-si59.svg?httpAccept=%2A%2F%2A",
            "@multimediatype": "Scalable Vector Graphics file",
            "@type": "ALTIMG",
            "@size": "2745",
            "@ref": "si59",
            "@mimetype": "image/svg+xml"
        },
        {
            "@category": "thumbnail",
            "@_fa": "true",
            "$": "https://api.elsevier.com/content/object/eid/1-s2.0-S0306261922005189-si6.svg?httpAccept=%2A%2F%2A",
            "@multimediatype": "Scalable Vector Graphics file",
            "@type": "ALTIMG",
            "@size": "6273",
            "@ref": "si6",
            "@mimetype": "image/svg+xml"
        },
        {
            "@category": "thumbnail",
            "@_fa": "true",
            "$": "https://api.elsevier.com/content/object/eid/1-s2.0-S0306261922005189-si60.svg?httpAccept=%2A%2F%2A",
            "@multimediatype": "Scalable Vector Graphics file",
            "@type": "ALTIMG",
            "@size": "10383",
            "@ref": "si60",
            "@mimetype": "image/svg+xml"
        },
        {
            "@category": "thumbnail",
            "@_fa": "true",
            "$": "https://api.elsevier.com/content/object/eid/1-s2.0-S0306261922005189-si61.svg?httpAccept=%2A%2F%2A",
            "@multimediatype": "Scalable Vector Graphics file",
            "@type": "ALTIMG",
            "@size": "7024",
            "@ref": "si61",
            "@mimetype": "image/svg+xml"
        },
        {
            "@category": "thumbnail",
            "@_fa": "true",
            "$": "https://api.elsevier.com/content/object/eid/1-s2.0-S0306261922005189-si62.svg?httpAccept=%2A%2F%2A",
            "@multimediatype": "Scalable Vector Graphics file",
            "@type": "ALTIMG",
            "@size": "7449",
            "@ref": "si62",
            "@mimetype": "image/svg+xml"
        },
        {
            "@category": "thumbnail",
            "@_fa": "true",
            "$": "https://api.elsevier.com/content/object/eid/1-s2.0-S0306261922005189-si63.svg?httpAccept=%2A%2F%2A",
            "@multimediatype": "Scalable Vector Graphics file",
            "@type": "ALTIMG",
            "@size": "7950",
            "@ref": "si63",
            "@mimetype": "image/svg+xml"
        },
        {
            "@category": "thumbnail",
            "@_fa": "true",
            "$": "https://api.elsevier.com/content/object/eid/1-s2.0-S0306261922005189-si64.svg?httpAccept=%2A%2F%2A",
            "@multimediatype": "Scalable Vector Graphics file",
            "@type": "ALTIMG",
            "@size": "3430",
            "@ref": "si64",
            "@mimetype": "image/svg+xml"
        },
        {
            "@category": "thumbnail",
            "@_fa": "true",
            "$": "https://api.elsevier.com/content/object/eid/1-s2.0-S0306261922005189-si65.svg?httpAccept=%2A%2F%2A",
            "@multimediatype": "Scalable Vector Graphics file",
            "@type": "ALTIMG",
            "@size": "9573",
            "@ref": "si65",
            "@mimetype": "image/svg+xml"
        },
        {
            "@category": "thumbnail",
            "@_fa": "true",
            "$": "https://api.elsevier.com/content/object/eid/1-s2.0-S0306261922005189-si66.svg?httpAccept=%2A%2F%2A",
            "@multimediatype": "Scalable Vector Graphics file",
            "@type": "ALTIMG",
            "@size": "17894",
            "@ref": "si66",
            "@mimetype": "image/svg+xml"
        },
        {
            "@category": "thumbnail",
            "@_fa": "true",
            "$": "https://api.elsevier.com/content/object/eid/1-s2.0-S0306261922005189-si67.svg?httpAccept=%2A%2F%2A",
            "@multimediatype": "Scalable Vector Graphics file",
            "@type": "ALTIMG",
            "@size": "3054",
            "@ref": "si67",
            "@mimetype": "image/svg+xml"
        },
        {
            "@category": "thumbnail",
            "@_fa": "true",
            "$": "https://api.elsevier.com/content/object/eid/1-s2.0-S0306261922005189-si68.svg?httpAccept=%2A%2F%2A",
            "@multimediatype": "Scalable Vector Graphics file",
            "@type": "ALTIMG",
            "@size": "6296",
            "@ref": "si68",
            "@mimetype": "image/svg+xml"
        },
        {
            "@category": "thumbnail",
            "@_fa": "true",
            "$": "https://api.elsevier.com/content/object/eid/1-s2.0-S0306261922005189-si69.svg?httpAccept=%2A%2F%2A",
            "@multimediatype": "Scalable Vector Graphics file",
            "@type": "ALTIMG",
            "@size": "4777",
            "@ref": "si69",
            "@mimetype": "image/svg+xml"
        },
        {
            "@category": "thumbnail",
            "@_fa": "true",
            "$": "https://api.elsevier.com/content/object/eid/1-s2.0-S0306261922005189-si7.svg?httpAccept=%2A%2F%2A",
            "@multimediatype": "Scalable Vector Graphics file",
            "@type": "ALTIMG",
            "@size": "5202",
            "@ref": "si7",
            "@mimetype": "image/svg+xml"
        },
        {
            "@category": "thumbnail",
            "@_fa": "true",
            "$": "https://api.elsevier.com/content/object/eid/1-s2.0-S0306261922005189-si70.svg?httpAccept=%2A%2F%2A",
            "@multimediatype": "Scalable Vector Graphics file",
            "@type": "ALTIMG",
            "@size": "4880",
            "@ref": "si70",
            "@mimetype": "image/svg+xml"
        },
        {
            "@category": "thumbnail",
            "@_fa": "true",
            "$": "https://api.elsevier.com/content/object/eid/1-s2.0-S0306261922005189-si71.svg?httpAccept=%2A%2F%2A",
            "@multimediatype": "Scalable Vector Graphics file",
            "@type": "ALTIMG",
            "@size": "5882",
            "@ref": "si71",
            "@mimetype": "image/svg+xml"
        },
        {
            "@category": "thumbnail",
            "@_fa": "true",
            "$": "https://api.elsevier.com/content/object/eid/1-s2.0-S0306261922005189-si72.svg?httpAccept=%2A%2F%2A",
            "@multimediatype": "Scalable Vector Graphics file",
            "@type": "ALTIMG",
            "@size": "9912",
            "@ref": "si72",
            "@mimetype": "image/svg+xml"
        },
        {
            "@category": "thumbnail",
            "@_fa": "true",
            "$": "https://api.elsevier.com/content/object/eid/1-s2.0-S0306261922005189-si73.svg?httpAccept=%2A%2F%2A",
            "@multimediatype": "Scalable Vector Graphics file",
            "@type": "ALTIMG",
            "@size": "6139",
            "@ref": "si73",
            "@mimetype": "image/svg+xml"
        },
        {
            "@category": "thumbnail",
            "@_fa": "true",
            "$": "https://api.elsevier.com/content/object/eid/1-s2.0-S0306261922005189-si74.svg?httpAccept=%2A%2F%2A",
            "@multimediatype": "Scalable Vector Graphics file",
            "@type": "ALTIMG",
            "@size": "6141",
            "@ref": "si74",
            "@mimetype": "image/svg+xml"
        },
        {
            "@category": "thumbnail",
            "@_fa": "true",
            "$": "https://api.elsevier.com/content/object/eid/1-s2.0-S0306261922005189-si75.svg?httpAccept=%2A%2F%2A",
            "@multimediatype": "Scalable Vector Graphics file",
            "@type": "ALTIMG",
            "@size": "2904",
            "@ref": "si75",
            "@mimetype": "image/svg+xml"
        },
        {
            "@category": "thumbnail",
            "@_fa": "true",
            "$": "https://api.elsevier.com/content/object/eid/1-s2.0-S0306261922005189-si76.svg?httpAccept=%2A%2F%2A",
            "@multimediatype": "Scalable Vector Graphics file",
            "@type": "ALTIMG",
            "@size": "10872",
            "@ref": "si76",
            "@mimetype": "image/svg+xml"
        },
        {
            "@category": "thumbnail",
            "@_fa": "true",
            "$": "https://api.elsevier.com/content/object/eid/1-s2.0-S0306261922005189-si77.svg?httpAccept=%2A%2F%2A",
            "@multimediatype": "Scalable Vector Graphics file",
            "@type": "ALTIMG",
            "@size": "6541",
            "@ref": "si77",
            "@mimetype": "image/svg+xml"
        },
        {
            "@category": "thumbnail",
            "@_fa": "true",
            "$": "https://api.elsevier.com/content/object/eid/1-s2.0-S0306261922005189-si78.svg?httpAccept=%2A%2F%2A",
            "@multimediatype": "Scalable Vector Graphics file",
            "@type": "ALTIMG",
            "@size": "879",
            "@ref": "si78",
            "@mimetype": "image/svg+xml"
        },
        {
            "@category": "thumbnail",
            "@_fa": "true",
            "$": "https://api.elsevier.com/content/object/eid/1-s2.0-S0306261922005189-si79.svg?httpAccept=%2A%2F%2A",
            "@multimediatype": "Scalable Vector Graphics file",
            "@type": "ALTIMG",
            "@size": "11341",
            "@ref": "si79",
            "@mimetype": "image/svg+xml"
        },
        {
            "@category": "thumbnail",
            "@_fa": "true",
            "$": "https://api.elsevier.com/content/object/eid/1-s2.0-S0306261922005189-si8.svg?httpAccept=%2A%2F%2A",
            "@multimediatype": "Scalable Vector Graphics file",
            "@type": "ALTIMG",
            "@size": "4609",
            "@ref": "si8",
            "@mimetype": "image/svg+xml"
        },
        {
            "@category": "thumbnail",
            "@_fa": "true",
            "$": "https://api.elsevier.com/content/object/eid/1-s2.0-S0306261922005189-si80.svg?httpAccept=%2A%2F%2A",
            "@multimediatype": "Scalable Vector Graphics file",
            "@type": "ALTIMG",
            "@size": "34752",
            "@ref": "si80",
            "@mimetype": "image/svg+xml"
        },
        {
            "@category": "thumbnail",
            "@_fa": "true",
            "$": "https://api.elsevier.com/content/object/eid/1-s2.0-S0306261922005189-si81.svg?httpAccept=%2A%2F%2A",
            "@multimediatype": "Scalable Vector Graphics file",
            "@type": "ALTIMG",
            "@size": "12772",
            "@ref": "si81",
            "@mimetype": "image/svg+xml"
        },
        {
            "@category": "thumbnail",
            "@_fa": "true",
            "$": "https://api.elsevier.com/content/object/eid/1-s2.0-S0306261922005189-si82.svg?httpAccept=%2A%2F%2A",
            "@multimediatype": "Scalable Vector Graphics file",
            "@type": "ALTIMG",
            "@size": "5855",
            "@ref": "si82",
            "@mimetype": "image/svg+xml"
        },
        {
            "@category": "thumbnail",
            "@_fa": "true",
            "$": "https://api.elsevier.com/content/object/eid/1-s2.0-S0306261922005189-si83.svg?httpAccept=%2A%2F%2A",
            "@multimediatype": "Scalable Vector Graphics file",
            "@type": "ALTIMG",
            "@size": "8529",
            "@ref": "si83",
            "@mimetype": "image/svg+xml"
        },
        {
            "@category": "thumbnail",
            "@_fa": "true",
            "$": "https://api.elsevier.com/content/object/eid/1-s2.0-S0306261922005189-si84.svg?httpAccept=%2A%2F%2A",
            "@multimediatype": "Scalable Vector Graphics file",
            "@type": "ALTIMG",
            "@size": "2855",
            "@ref": "si84",
            "@mimetype": "image/svg+xml"
        },
        {
            "@category": "thumbnail",
            "@_fa": "true",
            "$": "https://api.elsevier.com/content/object/eid/1-s2.0-S0306261922005189-si85.svg?httpAccept=%2A%2F%2A",
            "@multimediatype": "Scalable Vector Graphics file",
            "@type": "ALTIMG",
            "@size": "7762",
            "@ref": "si85",
            "@mimetype": "image/svg+xml"
        },
        {
            "@category": "thumbnail",
            "@_fa": "true",
            "$": "https://api.elsevier.com/content/object/eid/1-s2.0-S0306261922005189-si86.svg?httpAccept=%2A%2F%2A",
            "@multimediatype": "Scalable Vector Graphics file",
            "@type": "ALTIMG",
            "@size": "2814",
            "@ref": "si86",
            "@mimetype": "image/svg+xml"
        },
        {
            "@category": "thumbnail",
            "@_fa": "true",
            "$": "https://api.elsevier.com/content/object/eid/1-s2.0-S0306261922005189-si87.svg?httpAccept=%2A%2F%2A",
            "@multimediatype": "Scalable Vector Graphics file",
            "@type": "ALTIMG",
            "@size": "4032",
            "@ref": "si87",
            "@mimetype": "image/svg+xml"
        },
        {
            "@category": "thumbnail",
            "@_fa": "true",
            "$": "https://api.elsevier.com/content/object/eid/1-s2.0-S0306261922005189-si88.svg?httpAccept=%2A%2F%2A",
            "@multimediatype": "Scalable Vector Graphics file",
            "@type": "ALTIMG",
            "@size": "9751",
            "@ref": "si88",
            "@mimetype": "image/svg+xml"
        },
        {
            "@category": "thumbnail",
            "@_fa": "true",
            "$": "https://api.elsevier.com/content/object/eid/1-s2.0-S0306261922005189-si89.svg?httpAccept=%2A%2F%2A",
            "@multimediatype": "Scalable Vector Graphics file",
            "@type": "ALTIMG",
            "@size": "2929",
            "@ref": "si89",
            "@mimetype": "image/svg+xml"
        },
        {
            "@category": "thumbnail",
            "@_fa": "true",
            "$": "https://api.elsevier.com/content/object/eid/1-s2.0-S0306261922005189-si9.svg?httpAccept=%2A%2F%2A",
            "@multimediatype": "Scalable Vector Graphics file",
            "@type": "ALTIMG",
            "@size": "4907",
            "@ref": "si9",
            "@mimetype": "image/svg+xml"
        },
        {
            "@category": "thumbnail",
            "@_fa": "true",
            "$": "https://api.elsevier.com/content/object/eid/1-s2.0-S0306261922005189-si90.svg?httpAccept=%2A%2F%2A",
            "@multimediatype": "Scalable Vector Graphics file",
            "@type": "ALTIMG",
            "@size": "9508",
            "@ref": "si90",
            "@mimetype": "image/svg+xml"
        },
        {
            "@category": "thumbnail",
            "@_fa": "true",
            "$": "https://api.elsevier.com/content/object/eid/1-s2.0-S0306261922005189-si91.svg?httpAccept=%2A%2F%2A",
            "@multimediatype": "Scalable Vector Graphics file",
            "@type": "ALTIMG",
            "@size": "5655",
            "@ref": "si91",
            "@mimetype": "image/svg+xml"
        },
        {
            "@category": "thumbnail",
            "@_fa": "true",
            "$": "https://api.elsevier.com/content/object/eid/1-s2.0-S0306261922005189-si92.svg?httpAccept=%2A%2F%2A",
            "@multimediatype": "Scalable Vector Graphics file",
            "@type": "ALTIMG",
            "@size": "9566",
            "@ref": "si92",
            "@mimetype": "image/svg+xml"
        },
        {
            "@category": "thumbnail",
            "@_fa": "true",
            "$": "https://api.elsevier.com/content/object/eid/1-s2.0-S0306261922005189-si93.svg?httpAccept=%2A%2F%2A",
            "@multimediatype": "Scalable Vector Graphics file",
            "@type": "ALTIMG",
            "@size": "6028",
            "@ref": "si93",
            "@mimetype": "image/svg+xml"
        },
        {
            "@category": "thumbnail",
            "@_fa": "true",
            "$": "https://api.elsevier.com/content/object/eid/1-s2.0-S0306261922005189-si94.svg?httpAccept=%2A%2F%2A",
            "@multimediatype": "Scalable Vector Graphics file",
            "@type": "ALTIMG",
            "@size": "8086",
            "@ref": "si94",
            "@mimetype": "image/svg+xml"
        },
        {
            "@category": "thumbnail",
            "@_fa": "true",
            "$": "https://api.elsevier.com/content/object/eid/1-s2.0-S0306261922005189-si95.svg?httpAccept=%2A%2F%2A",
            "@multimediatype": "Scalable Vector Graphics file",
            "@type": "ALTIMG",
            "@size": "7746",
            "@ref": "si95",
            "@mimetype": "image/svg+xml"
        },
        {
            "@category": "thumbnail",
            "@_fa": "true",
            "$": "https://api.elsevier.com/content/object/eid/1-s2.0-S0306261922005189-si96.svg?httpAccept=%2A%2F%2A",
            "@multimediatype": "Scalable Vector Graphics file",
            "@type": "ALTIMG",
            "@size": "4329",
            "@ref": "si96",
            "@mimetype": "image/svg+xml"
        },
        {
            "@category": "thumbnail",
            "@_fa": "true",
            "$": "https://api.elsevier.com/content/object/eid/1-s2.0-S0306261922005189-si97.svg?httpAccept=%2A%2F%2A",
            "@multimediatype": "Scalable Vector Graphics file",
            "@type": "ALTIMG",
            "@size": "4658",
            "@ref": "si97",
            "@mimetype": "image/svg+xml"
        },
        {
            "@category": "thumbnail",
            "@_fa": "true",
            "$": "https://api.elsevier.com/content/object/eid/1-s2.0-S0306261922005189-si98.svg?httpAccept=%2A%2F%2A",
            "@multimediatype": "Scalable Vector Graphics file",
            "@type": "ALTIMG",
            "@size": "7637",
            "@ref": "si98",
            "@mimetype": "image/svg+xml"
        },
        {
            "@category": "thumbnail",
            "@_fa": "true",
            "$": "https://api.elsevier.com/content/object/eid/1-s2.0-S0306261922005189-si99.svg?httpAccept=%2A%2F%2A",
            "@multimediatype": "Scalable Vector Graphics file",
            "@type": "ALTIMG",
            "@size": "7972",
            "@ref": "si99",
            "@mimetype": "image/svg+xml"
        },
        {
            "@category": "standard",
            "@_fa": "true",
            "$": "https://api.elsevier.com/content/object/eid/1-s2.0-S0306261922005189-am.pdf?httpAccept=%2A%2F%2A",
            "@multimediatype": "Acrobat PDF file",
            "@type": "AAM-PDF",
            "@size": "1220539",
            "@ref": "am",
            "@mimetype": "application/pdf"
        }
    ]},
    "link": {
        "@rel": "abstract",
        "@href": "https://api.elsevier.com/content/abstract/scopus_id/85131653322"
    }
}}