{"full-text-retrieval-response": {
    "scopus-eid": "2-s2.0-85141509038",
    "originalText": "serial JL 271089 291210 291731 291800 291881 31 Energy and Buildings ENERGYBUILDINGS 2022-10-28 2022-10-28 2022-11-08 2022-11-08 2023-01-30T19:00:44 1-s2.0-S0378778822007654 S0378-7788(22)00765-4 S0378778822007654 10.1016/j.enbuild.2022.112594 S300 S300.1 FULL-TEXT 1-s2.0-S0378778822X00224 2024-04-16T11:25:12.843389Z 0 0 20230101 2023 2022-10-28T18:51:51.481885Z articleinfo articlenumber articletitlenorm authfirstinitialnorm authfirstsurnamenorm cid cids contenttype copyright crossmark dateloaded dateloadedtxt datesearch datesort dateupdated dco docsubtype doctype doi eid ewtransactionid hubeid indexeddate issn issnnorm itemstage itemtransactionid itemweight openaccess openarchive pg pgfirst pii piinorm pubdatestart pubdatetxt pubyr sectiontitle sortorder srctitle srctitlenorm srctype ssids alllist content subj subheadings suppl tomb volfirst volissue volumelist webpdf webpdfpagecount yearnav figure table body mmlmath acknowledge affil articletitle auth authfirstini authfull authkeywords authlast grantnumber grantsponsor grantsponsorid highlightsabst primabst ref 0378-7788 03787788 true 278 278 C Volume 278 6 112594 112594 112594 20230101 1 January 2023 2023-01-01 2023 Research Articles article fla © 2022 Elsevier B.V. All rights reserved. MODELFREEDYNAMICMANAGEMENTSTRATEGYFORLOWCARBONHOMEENERGYBASEDDEEPREINFORCEMENTLEARNINGACCOMMODATINGSTOCHASTICENVIRONMENTS HOU H 1 Introduction 2 Home energy management system 2.1 Framework of home energy management system 2.2 Load model 2.3 Carbon emissions and carbon trading model 3 Energy management strategy 3.1 Objective function 3.2 Constraint condition 3.3 Solution 4 Case study 4.1 Simulation parameters 4.2 Training process 4.3 Energy management results 4.4 Performance comparison 5 Discussion on hyperparameter 5.1 Robustness assessment 6 Conclusions Acknowledgment References LAI 2021 1925 1940 P YIN 2021 1178 1188 H WANG 2020 3145 3157 Y JIN 2021 3887 3897 J OLSEN 2018 5892 5901 D CHEN 2012 1822 1831 Z GONG 2020 4102 4113 H SACHS 2016 903 913 J HEDEGAARD 2019 181 204 R KEERTHISINGHE 2019 257 265 C BHAMIDI 2021 105 113 L YANG 2017 84 93 X SU 2020 115406 J MNIH 2015 529 533 V XU 2020 3201 3211 X WAN 2019 5246 5257 Z ZHOU 2019 1 10 S CHEN 2020 3794 3803 J JEDDI 2020 1427 1437 B LI 2021 2694 2705 Y LORK 2020 C LU 2019 6629 6639 R KANG 2015 2386 2394 C CHEN 2021 112510 X HOUX2023X112594 HOUX2023X112594XH 2024-11-08T00:00:00.000Z 2024-11-08T00:00:00.000Z http://creativecommons.org/licenses/by-nc-nd/4.0/ © 2022 Elsevier B.V. All rights reserved. 2022-11-12T02:51:47.476Z http://vtw.elsevier.com/data/voc/AddOnTypes/50.7/aggregated-refined National Natural Science Foundation of China 52177110 NSFC National Natural Science Foundation of China http://data.elsevier.com/vocabulary/SciValFunders/501100001809 http://sws.geonames.org/1814991/ Shenzhen Science and Technology Program Science, Technology and Innovation Commission of Shenzhen Municipality http://data.elsevier.com/vocabulary/SciValFunders/501100010877 http://sws.geonames.org/1814991/ State Grid Hubei Electric Power Co. Ltd. 2022 Science and Technology Projects 521538220005 State Grid Hubei Electric Power Co http://data.elsevier.com/vocabulary/SciValFunders/501100014174 http://sws.geonames.org/1814991 State Grid Hubei Electric Power Co., Ltd. 2022 Science and Technology Projects This work was supported in part by the National Natural Science Foundation of China under Grant 52177110, as well as the Shenzhen Science and Technology Program under Grant JCYJ20210324131409026. And also in part by State Grid Hubei Electric Power Co. Ltd. 2022 Science and Technology Projects 521538220005. This work was supported in part by the National Natural Science Foundation of China under Grant 52177110 , as well as the Shenzhen Science and Technology Program under Grant JCYJ20210324131409026 . And also in part by State Grid Hubei Electric Power Co., Ltd. 2022 Science and Technology Projects 521538220005. 0 https://doi.org/10.15223/policy-017 https://doi.org/10.15223/policy-037 https://doi.org/10.15223/policy-012 https://doi.org/10.15223/policy-029 https://doi.org/10.15223/policy-004 item S0378-7788(22)00765-4 S0378778822007654 1-s2.0-S0378778822007654 10.1016/j.enbuild.2022.112594 271089 2023-01-30T19:49:45.493784Z 2023-01-01 1-s2.0-S0378778822007654-main.pdf https://s3-eu-west-1.amazonaws.com/prod-ucs-content-store-eu-west/content/pii:S0378778822007654/MAIN/application/pdf/ae9548b8f97bc787f81c0ad343b1888b/main.pdf main.pdf pdf true 2023675 MAIN 11 1-s2.0-S0378778822007654-main_1.png https://s3-eu-west-1.amazonaws.com/prod-ucs-content-store-eu-west/content/pii:S0378778822007654/PREVIEW/image/png/11c6cbc2c8cf3136e65f661bdb27faab/main_1.png main_1.png png 59156 849 656 IMAGE-WEB-PDF 1 1-s2.0-S0378778822007654-gr3.jpg https://s3-eu-west-1.amazonaws.com/prod-ucs-content-store-eu-west/content/pii:S0378778822007654/gr3/DOWNSAMPLED/image/jpeg/c5bf84934a8d9155468cca931bc05d7a/gr3.jpg gr3 gr3.jpg jpg 102650 512 689 IMAGE-DOWNSAMPLED 1-s2.0-S0378778822007654-gr10.jpg https://s3-eu-west-1.amazonaws.com/prod-ucs-content-store-eu-west/content/pii:S0378778822007654/gr10/DOWNSAMPLED/image/jpeg/3e4b6ef7bf569a9feaef764c98d760f4/gr10.jpg gr10 gr10.jpg jpg 20655 179 378 IMAGE-DOWNSAMPLED 1-s2.0-S0378778822007654-gr11.jpg https://s3-eu-west-1.amazonaws.com/prod-ucs-content-store-eu-west/content/pii:S0378778822007654/gr11/THUMBNAIL/image/jpeg/53ae09c46fc26012cadeebc880103874/gr11.jpg gr11 gr11.jpg jpg 17096 168 378 IMAGE-DOWNSAMPLED 1-s2.0-S0378778822007654-gr12.jpg https://s3-eu-west-1.amazonaws.com/prod-ucs-content-store-eu-west/content/pii:S0378778822007654/gr12/DOWNSAMPLED/image/jpeg/9c3d83efa809ab00b076fd344ebf32e1/gr12.jpg gr12 gr12.jpg jpg 25061 179 340 IMAGE-DOWNSAMPLED 1-s2.0-S0378778822007654-gr13.jpg https://s3-eu-west-1.amazonaws.com/prod-ucs-content-store-eu-west/content/pii:S0378778822007654/gr13/DOWNSAMPLED/image/jpeg/17a385ca23f1622b91eeb78fb021866c/gr13.jpg gr13 gr13.jpg jpg 35621 210 378 IMAGE-DOWNSAMPLED 1-s2.0-S0378778822007654-gr2.jpg https://s3-eu-west-1.amazonaws.com/prod-ucs-content-store-eu-west/content/pii:S0378778822007654/gr2/DOWNSAMPLED/image/jpeg/3602782199864fa786c7b55a770989b1/gr2.jpg gr2 gr2.jpg jpg 25196 315 224 IMAGE-DOWNSAMPLED 1-s2.0-S0378778822007654-gr4.jpg https://s3-eu-west-1.amazonaws.com/prod-ucs-content-store-eu-west/content/pii:S0378778822007654/gr4/DOWNSAMPLED/image/jpeg/6369ed928ee40eb6b69d9b17252c3e82/gr4.jpg gr4 gr4.jpg jpg 20308 171 378 IMAGE-DOWNSAMPLED 1-s2.0-S0378778822007654-gr5.jpg https://s3-eu-west-1.amazonaws.com/prod-ucs-content-store-eu-west/content/pii:S0378778822007654/gr5/DOWNSAMPLED/image/jpeg/d5c8f44b527304391a007be96989f72d/gr5.jpg gr5 gr5.jpg jpg 40975 176 708 IMAGE-DOWNSAMPLED 1-s2.0-S0378778822007654-gr6.jpg https://s3-eu-west-1.amazonaws.com/prod-ucs-content-store-eu-west/content/pii:S0378778822007654/gr6/DOWNSAMPLED/image/jpeg/09cc4674277764f52fc2700c38c81bbd/gr6.jpg gr6 gr6.jpg jpg 21348 168 378 IMAGE-DOWNSAMPLED 1-s2.0-S0378778822007654-gr7.jpg https://s3-eu-west-1.amazonaws.com/prod-ucs-content-store-eu-west/content/pii:S0378778822007654/gr7/DOWNSAMPLED/image/jpeg/411f328f6735d68efac375d3bd0c6c96/gr7.jpg gr7 gr7.jpg jpg 21984 180 378 IMAGE-DOWNSAMPLED 1-s2.0-S0378778822007654-gr8.jpg https://s3-eu-west-1.amazonaws.com/prod-ucs-content-store-eu-west/content/pii:S0378778822007654/gr8/DOWNSAMPLED/image/jpeg/a5999df2bbcdc421be6af4bc34109766/gr8.jpg gr8 gr8.jpg jpg 23036 174 378 IMAGE-DOWNSAMPLED 1-s2.0-S0378778822007654-gr9.jpg https://s3-eu-west-1.amazonaws.com/prod-ucs-content-store-eu-west/content/pii:S0378778822007654/gr9/DOWNSAMPLED/image/jpeg/658a5fe40aa7c7a0f4d27d074cd854aa/gr9.jpg gr9 gr9.jpg jpg 26812 185 378 IMAGE-DOWNSAMPLED 1-s2.0-S0378778822007654-gr1.jpg https://s3-eu-west-1.amazonaws.com/prod-ucs-content-store-eu-west/content/pii:S0378778822007654/gr1/DOWNSAMPLED/image/jpeg/4dbc26bfe2594bca9989b1b1c1c70070/gr1.jpg gr1 gr1.jpg jpg 47608 309 378 IMAGE-DOWNSAMPLED 1-s2.0-S0378778822007654-gr3.sml https://s3-eu-west-1.amazonaws.com/prod-ucs-content-store-eu-west/content/pii:S0378778822007654/gr3/THUMBNAIL/image/gif/09f8415d206326e626f82ce2d4c224f2/gr3.sml gr3 gr3.sml sml 14074 163 219 IMAGE-THUMBNAIL 1-s2.0-S0378778822007654-gr10.sml https://s3-eu-west-1.amazonaws.com/prod-ucs-content-store-eu-west/content/pii:S0378778822007654/gr10/THUMBNAIL/image/gif/94f9630f9b92a7b866e33a3dd0f19f01/gr10.sml gr10 gr10.sml sml 7083 104 219 IMAGE-THUMBNAIL 1-s2.0-S0378778822007654-gr11.sml https://s3-eu-west-1.amazonaws.com/prod-ucs-content-store-eu-west/content/pii:S0378778822007654/gr11/THUMBNAIL/image/gif/79e858ff073b8fa8010ef39f7fe70ff6/gr11.sml gr11 gr11.sml sml 5554 97 219 IMAGE-THUMBNAIL 1-s2.0-S0378778822007654-gr12.sml https://s3-eu-west-1.amazonaws.com/prod-ucs-content-store-eu-west/content/pii:S0378778822007654/gr12/THUMBNAIL/image/gif/63b3ae071fbd25342183d6a70e4ede6a/gr12.sml gr12 gr12.sml sml 11708 116 219 IMAGE-THUMBNAIL 1-s2.0-S0378778822007654-gr13.sml https://s3-eu-west-1.amazonaws.com/prod-ucs-content-store-eu-west/content/pii:S0378778822007654/gr13/THUMBNAIL/image/gif/5a17257c1a32c64430e3ce2424c37bd3/gr13.sml gr13 gr13.sml sml 12615 122 219 IMAGE-THUMBNAIL 1-s2.0-S0378778822007654-gr2.sml https://s3-eu-west-1.amazonaws.com/prod-ucs-content-store-eu-west/content/pii:S0378778822007654/gr2/THUMBNAIL/image/gif/dfbac0c0ed433142bb9af7b639d25d42/gr2.sml gr2 gr2.sml sml 6992 163 116 IMAGE-THUMBNAIL 1-s2.0-S0378778822007654-gr4.sml https://s3-eu-west-1.amazonaws.com/prod-ucs-content-store-eu-west/content/pii:S0378778822007654/gr4/THUMBNAIL/image/gif/559096bae8805f2871d3f51bb0e5f739/gr4.sml gr4 gr4.sml sml 8362 99 219 IMAGE-THUMBNAIL 1-s2.0-S0378778822007654-gr5.sml https://s3-eu-west-1.amazonaws.com/prod-ucs-content-store-eu-west/content/pii:S0378778822007654/gr5/THUMBNAIL/image/gif/d2ab6d07bf87df19305eb42103fad61c/gr5.sml gr5 gr5.sml sml 6384 54 219 IMAGE-THUMBNAIL 1-s2.0-S0378778822007654-gr6.sml https://s3-eu-west-1.amazonaws.com/prod-ucs-content-store-eu-west/content/pii:S0378778822007654/gr6/THUMBNAIL/image/gif/a9d880bab5587c55437a968d1c40a3d9/gr6.sml gr6 gr6.sml sml 7369 98 219 IMAGE-THUMBNAIL 1-s2.0-S0378778822007654-gr7.sml https://s3-eu-west-1.amazonaws.com/prod-ucs-content-store-eu-west/content/pii:S0378778822007654/gr7/THUMBNAIL/image/gif/86b116e7ab078971bf5c95552fccb592/gr7.sml gr7 gr7.sml sml 8235 104 219 IMAGE-THUMBNAIL 1-s2.0-S0378778822007654-gr8.sml https://s3-eu-west-1.amazonaws.com/prod-ucs-content-store-eu-west/content/pii:S0378778822007654/gr8/THUMBNAIL/image/gif/a3a977ff0ad2a7702443f42137e60f1f/gr8.sml gr8 gr8.sml sml 8734 101 219 IMAGE-THUMBNAIL 1-s2.0-S0378778822007654-gr9.sml https://s3-eu-west-1.amazonaws.com/prod-ucs-content-store-eu-west/content/pii:S0378778822007654/gr9/THUMBNAIL/image/gif/baf9ffa6356467ae490e8bbd47a6005e/gr9.sml gr9 gr9.sml sml 8530 107 219 IMAGE-THUMBNAIL 1-s2.0-S0378778822007654-gr1.sml https://s3-eu-west-1.amazonaws.com/prod-ucs-content-store-eu-west/content/pii:S0378778822007654/gr1/THUMBNAIL/image/gif/dfdf3dbcccf36755f45705c21eb82530/gr1.sml gr1 gr1.sml sml 13626 164 201 IMAGE-THUMBNAIL 1-s2.0-S0378778822007654-gr3_lrg.jpg https://s3-eu-west-1.amazonaws.com/prod-ucs-content-store-eu-west/content/pii:S0378778822007654/HIGHRES/image/jpeg/6dafd3e2a54e591b19961d5866002568/gr3_lrg.jpg gr3 gr3_lrg.jpg jpg 679262 2268 3051 IMAGE-HIGH-RES 1-s2.0-S0378778822007654-gr10_lrg.jpg https://s3-eu-west-1.amazonaws.com/prod-ucs-content-store-eu-west/content/pii:S0378778822007654/HIGHRES/image/jpeg/a9f0253607221f073f5d613a90294014/gr10_lrg.jpg gr10 gr10_lrg.jpg jpg 149648 791 1673 IMAGE-HIGH-RES 1-s2.0-S0378778822007654-gr11_lrg.jpg https://s3-eu-west-1.amazonaws.com/prod-ucs-content-store-eu-west/content/pii:S0378778822007654/HIGHRES/image/jpeg/345bf00b22c0149004a7744435f84a0f/gr11_lrg.jpg gr11 gr11_lrg.jpg jpg 131268 744 1673 IMAGE-HIGH-RES 1-s2.0-S0378778822007654-gr12_lrg.jpg https://s3-eu-west-1.amazonaws.com/prod-ucs-content-store-eu-west/content/pii:S0378778822007654/HIGHRES/image/jpeg/3e7119c42eea6de76dac331122252cf8/gr12_lrg.jpg gr12 gr12_lrg.jpg jpg 197735 795 1506 IMAGE-HIGH-RES 1-s2.0-S0378778822007654-gr13_lrg.jpg https://s3-eu-west-1.amazonaws.com/prod-ucs-content-store-eu-west/content/pii:S0378778822007654/HIGHRES/image/jpeg/d6033f577310582a5e15aa3c17616529/gr13_lrg.jpg gr13 gr13_lrg.jpg jpg 334278 929 1673 IMAGE-HIGH-RES 1-s2.0-S0378778822007654-gr2_lrg.jpg https://s3-eu-west-1.amazonaws.com/prod-ucs-content-store-eu-west/content/pii:S0378778822007654/HIGHRES/image/jpeg/2963e13fdd32489d612e9186bf236ba5/gr2_lrg.jpg gr2 gr2_lrg.jpg jpg 217709 1399 995 IMAGE-HIGH-RES 1-s2.0-S0378778822007654-gr4_lrg.jpg https://s3-eu-west-1.amazonaws.com/prod-ucs-content-store-eu-west/content/pii:S0378778822007654/DOWNSAMPLED/image/jpeg/39ca02493999f39228d72631a4ed2d13/gr4_lrg.jpg gr4 gr4_lrg.jpg jpg 158425 756 1673 IMAGE-HIGH-RES 1-s2.0-S0378778822007654-gr5_lrg.jpg https://s3-eu-west-1.amazonaws.com/prod-ucs-content-store-eu-west/content/pii:S0378778822007654/MAIN/image/jpeg/7e9871551b3ab4840aecea9241e7247a/gr5_lrg.jpg gr5 gr5_lrg.jpg jpg 357817 779 3133 IMAGE-HIGH-RES 1-s2.0-S0378778822007654-gr6_lrg.jpg https://s3-eu-west-1.amazonaws.com/prod-ucs-content-store-eu-west/content/pii:S0378778822007654/HIGHRES/image/jpeg/1f92805df2f90c4529587d1c04d5094a/gr6_lrg.jpg gr6 gr6_lrg.jpg jpg 185042 745 1673 IMAGE-HIGH-RES 1-s2.0-S0378778822007654-gr7_lrg.jpg https://s3-eu-west-1.amazonaws.com/prod-ucs-content-store-eu-west/content/pii:S0378778822007654/HIGHRES/image/jpeg/196be6d223c8ff6673ae67d127299f22/gr7_lrg.jpg gr7 gr7_lrg.jpg jpg 182449 795 1673 IMAGE-HIGH-RES 1-s2.0-S0378778822007654-gr8_lrg.jpg https://s3-eu-west-1.amazonaws.com/prod-ucs-content-store-eu-west/content/pii:S0378778822007654/HIGHRES/image/jpeg/8f05158068993e4d688012019f70418a/gr8_lrg.jpg gr8 gr8_lrg.jpg jpg 224937 770 1673 IMAGE-HIGH-RES 1-s2.0-S0378778822007654-gr9_lrg.jpg https://s3-eu-west-1.amazonaws.com/prod-ucs-content-store-eu-west/content/pii:S0378778822007654/HIGHRES/image/jpeg/ac205480d33f6556c86d515d1aa2012d/gr9_lrg.jpg gr9 gr9_lrg.jpg jpg 185139 819 1673 IMAGE-HIGH-RES 1-s2.0-S0378778822007654-gr1_lrg.jpg https://s3-eu-west-1.amazonaws.com/prod-ucs-content-store-eu-west/content/pii:S0378778822007654/HIGHRES/image/jpeg/4303546ec37450b194117a4f6c8559e9/gr1_lrg.jpg gr1 gr1_lrg.jpg jpg 332262 1366 1673 IMAGE-HIGH-RES 1-s2.0-S0378778822007654-si1.svg https://s3-eu-west-1.amazonaws.com/prod-ucs-content-store-eu-west/content/pii:S0378778822007654/STRIPIN/image/svg+xml/da5b208f6a8e416c821bbf7bde3aea00/si1.svg si1 si1.svg svg 8499 ALTIMG 1-s2.0-S0378778822007654-si10.svg https://s3-eu-west-1.amazonaws.com/prod-ucs-content-store-eu-west/content/pii:S0378778822007654/STRIPIN/image/svg+xml/3dce54ac9b47965c45a8c151e5da77d5/si10.svg si10 si10.svg svg 4345 ALTIMG 1-s2.0-S0378778822007654-si100.svg https://s3-eu-west-1.amazonaws.com/prod-ucs-content-store-eu-west/content/pii:S0378778822007654/STRIPIN/image/svg+xml/f8d3b169324360b5b0a89fbb23f6ef2b/si100.svg si100 si100.svg svg 25057 ALTIMG 1-s2.0-S0378778822007654-si101.svg https://s3-eu-west-1.amazonaws.com/prod-ucs-content-store-eu-west/content/pii:S0378778822007654/STRIPIN/image/svg+xml/deb919bec2d97d4d30f1e39f566065ee/si101.svg si101 si101.svg svg 6954 ALTIMG 1-s2.0-S0378778822007654-si102.svg https://s3-eu-west-1.amazonaws.com/prod-ucs-content-store-eu-west/content/pii:S0378778822007654/STRIPIN/image/svg+xml/c92fc46fbc6721b97632187a9b5cb104/si102.svg si102 si102.svg svg 6728 ALTIMG 1-s2.0-S0378778822007654-si103.svg https://s3-eu-west-1.amazonaws.com/prod-ucs-content-store-eu-west/content/pii:S0378778822007654/STRIPIN/image/svg+xml/4257272fc31098638bbd669e787c32d9/si103.svg si103 si103.svg svg 6942 ALTIMG 1-s2.0-S0378778822007654-si104.svg https://s3-eu-west-1.amazonaws.com/prod-ucs-content-store-eu-west/content/pii:S0378778822007654/STRIPIN/image/svg+xml/4cc3440e20d5d864d85b1dcee8518931/si104.svg si104 si104.svg svg 6752 ALTIMG 1-s2.0-S0378778822007654-si105.svg https://s3-eu-west-1.amazonaws.com/prod-ucs-content-store-eu-west/content/pii:S0378778822007654/STRIPIN/image/svg+xml/fa813214354ee4ee6a021ab4e8f4bfa4/si105.svg si105 si105.svg svg 8450 ALTIMG 1-s2.0-S0378778822007654-si106.svg https://s3-eu-west-1.amazonaws.com/prod-ucs-content-store-eu-west/content/pii:S0378778822007654/STRIPIN/image/svg+xml/805f8bbb4e0f46cef53636f49ffcb0ff/si106.svg si106 si106.svg svg 21403 ALTIMG 1-s2.0-S0378778822007654-si107.svg https://s3-eu-west-1.amazonaws.com/prod-ucs-content-store-eu-west/content/pii:S0378778822007654/STRIPIN/image/svg+xml/5867852046cd87fc0be97f328484dd27/si107.svg si107 si107.svg svg 23530 ALTIMG 1-s2.0-S0378778822007654-si108.svg https://s3-eu-west-1.amazonaws.com/prod-ucs-content-store-eu-west/content/pii:S0378778822007654/STRIPIN/image/svg+xml/4f263436e447da107894e72e142c8633/si108.svg si108 si108.svg svg 28744 ALTIMG 1-s2.0-S0378778822007654-si109.svg https://s3-eu-west-1.amazonaws.com/prod-ucs-content-store-eu-west/content/pii:S0378778822007654/STRIPIN/image/svg+xml/75e352324f0091f1e90d05c519ca5a5d/si109.svg si109 si109.svg svg 7082 ALTIMG 1-s2.0-S0378778822007654-si11.svg https://s3-eu-west-1.amazonaws.com/prod-ucs-content-store-eu-west/content/pii:S0378778822007654/STRIPIN/image/svg+xml/525c36f9ec8cf0e0c7b8624528e91971/si11.svg si11 si11.svg svg 3777 ALTIMG 1-s2.0-S0378778822007654-si110.svg https://s3-eu-west-1.amazonaws.com/prod-ucs-content-store-eu-west/content/pii:S0378778822007654/STRIPIN/image/svg+xml/f1692783efc6bd7c95ff61a8e4ef8ee2/si110.svg si110 si110.svg svg 6854 ALTIMG 1-s2.0-S0378778822007654-si111.svg https://s3-eu-west-1.amazonaws.com/prod-ucs-content-store-eu-west/content/pii:S0378778822007654/STRIPIN/image/svg+xml/c93ee1f0f029e42383c57763d5271c47/si111.svg si111 si111.svg svg 6132 ALTIMG 1-s2.0-S0378778822007654-si112.svg https://s3-eu-west-1.amazonaws.com/prod-ucs-content-store-eu-west/content/pii:S0378778822007654/STRIPIN/image/svg+xml/f70e46526bf231b3359d908143ed58d7/si112.svg si112 si112.svg svg 6880 ALTIMG 1-s2.0-S0378778822007654-si113.svg https://s3-eu-west-1.amazonaws.com/prod-ucs-content-store-eu-west/content/pii:S0378778822007654/STRIPIN/image/svg+xml/33f16af199cc1da840aa206e6432830b/si113.svg si113 si113.svg svg 4552 ALTIMG 1-s2.0-S0378778822007654-si114.svg https://s3-eu-west-1.amazonaws.com/prod-ucs-content-store-eu-west/content/pii:S0378778822007654/STRIPIN/image/svg+xml/b4e3ca5f977849c17be275d8bbac8b18/si114.svg si114 si114.svg svg 6074 ALTIMG 1-s2.0-S0378778822007654-si115.svg https://s3-eu-west-1.amazonaws.com/prod-ucs-content-store-eu-west/content/pii:S0378778822007654/STRIPIN/image/svg+xml/769d237bc6ea6d93d37cefdae44b40e1/si115.svg si115 si115.svg svg 9767 ALTIMG 1-s2.0-S0378778822007654-si116.svg https://s3-eu-west-1.amazonaws.com/prod-ucs-content-store-eu-west/content/pii:S0378778822007654/STRIPIN/image/svg+xml/7c6392908b2cfbc794233c7c6941f766/si116.svg si116 si116.svg svg 5216 ALTIMG 1-s2.0-S0378778822007654-si117.svg https://s3-eu-west-1.amazonaws.com/prod-ucs-content-store-eu-west/content/pii:S0378778822007654/STRIPIN/image/svg+xml/ac9dd32009a6275b14668e61978efebb/si117.svg si117 si117.svg svg 4101 ALTIMG 1-s2.0-S0378778822007654-si118.svg https://s3-eu-west-1.amazonaws.com/prod-ucs-content-store-eu-west/content/pii:S0378778822007654/STRIPIN/image/svg+xml/ec7b7065c5181b10e73508f554c47919/si118.svg si118 si118.svg svg 30804 ALTIMG 1-s2.0-S0378778822007654-si119.svg https://s3-eu-west-1.amazonaws.com/prod-ucs-content-store-eu-west/content/pii:S0378778822007654/STRIPIN/image/svg+xml/7bfb1f0fb9b0c5ddf84cbb56e2eb13a7/si119.svg si119 si119.svg svg 33575 ALTIMG 1-s2.0-S0378778822007654-si12.svg https://s3-eu-west-1.amazonaws.com/prod-ucs-content-store-eu-west/content/pii:S0378778822007654/STRIPIN/image/svg+xml/e0e9fac8a2b9e529b1003faadb48a5c5/si12.svg si12 si12.svg svg 12855 ALTIMG 1-s2.0-S0378778822007654-si120.svg https://s3-eu-west-1.amazonaws.com/prod-ucs-content-store-eu-west/content/pii:S0378778822007654/STRIPIN/image/svg+xml/1291de2ef9e9a4e8907cd01c67986a36/si120.svg si120 si120.svg svg 17840 ALTIMG 1-s2.0-S0378778822007654-si121.svg https://s3-eu-west-1.amazonaws.com/prod-ucs-content-store-eu-west/content/pii:S0378778822007654/STRIPIN/image/svg+xml/7f8f7611753336a583a8a93e9afd28fb/si121.svg si121 si121.svg svg 10874 ALTIMG 1-s2.0-S0378778822007654-si122.svg https://s3-eu-west-1.amazonaws.com/prod-ucs-content-store-eu-west/content/pii:S0378778822007654/STRIPIN/image/svg+xml/9726e62d1dc062d477192fd51abb2b11/si122.svg si122 si122.svg svg 11388 ALTIMG 1-s2.0-S0378778822007654-si123.svg https://s3-eu-west-1.amazonaws.com/prod-ucs-content-store-eu-west/content/pii:S0378778822007654/STRIPIN/image/svg+xml/af69c3ff3ff893bc321dbb053b6c2f88/si123.svg si123 si123.svg svg 8322 ALTIMG 1-s2.0-S0378778822007654-si124.svg https://s3-eu-west-1.amazonaws.com/prod-ucs-content-store-eu-west/content/pii:S0378778822007654/STRIPIN/image/svg+xml/c93d1ff0fa286f105cf7882dc20f6932/si124.svg si124 si124.svg svg 6351 ALTIMG 1-s2.0-S0378778822007654-si125.svg https://s3-eu-west-1.amazonaws.com/prod-ucs-content-store-eu-west/content/pii:S0378778822007654/STRIPIN/image/svg+xml/5b9af20a6c368affb219848083ff68d5/si125.svg si125 si125.svg svg 6389 ALTIMG 1-s2.0-S0378778822007654-si126.svg https://s3-eu-west-1.amazonaws.com/prod-ucs-content-store-eu-west/content/pii:S0378778822007654/STRIPIN/image/svg+xml/c30550cdba990bbed85d5a7342cd5957/si126.svg si126 si126.svg svg 27971 ALTIMG 1-s2.0-S0378778822007654-si127.svg https://s3-eu-west-1.amazonaws.com/prod-ucs-content-store-eu-west/content/pii:S0378778822007654/STRIPIN/image/svg+xml/87d3a4aa4e6f2e2234e1c17ef98eb7d4/si127.svg si127 si127.svg svg 2839 ALTIMG 1-s2.0-S0378778822007654-si128.svg https://s3-eu-west-1.amazonaws.com/prod-ucs-content-store-eu-west/content/pii:S0378778822007654/STRIPIN/image/svg+xml/06d32fdcd002c0ca89249d6853c84f21/si128.svg si128 si128.svg svg 2603 ALTIMG 1-s2.0-S0378778822007654-si129.svg https://s3-eu-west-1.amazonaws.com/prod-ucs-content-store-eu-west/content/pii:S0378778822007654/STRIPIN/image/svg+xml/45ae3abf0c74d501993a39e1cbb8a9a6/si129.svg si129 si129.svg svg 3496 ALTIMG 1-s2.0-S0378778822007654-si13.svg https://s3-eu-west-1.amazonaws.com/prod-ucs-content-store-eu-west/content/pii:S0378778822007654/STRIPIN/image/svg+xml/5fb74925c2fce1dfa5eb4f3bbaa07e74/si13.svg si13 si13.svg svg 8718 ALTIMG 1-s2.0-S0378778822007654-si130.svg https://s3-eu-west-1.amazonaws.com/prod-ucs-content-store-eu-west/content/pii:S0378778822007654/STRIPIN/image/svg+xml/ee35072d65a267a158774bdbccb55d1e/si130.svg si130 si130.svg svg 22821 ALTIMG 1-s2.0-S0378778822007654-si131.svg https://s3-eu-west-1.amazonaws.com/prod-ucs-content-store-eu-west/content/pii:S0378778822007654/STRIPIN/image/svg+xml/bd7477c4bcc4b0f3a858ce457cd1e5e3/si131.svg si131 si131.svg svg 25924 ALTIMG 1-s2.0-S0378778822007654-si132.svg https://s3-eu-west-1.amazonaws.com/prod-ucs-content-store-eu-west/content/pii:S0378778822007654/STRIPIN/image/svg+xml/12e47207410136bdecdb005b70817b4a/si132.svg si132 si132.svg svg 2823 ALTIMG 1-s2.0-S0378778822007654-si133.svg https://s3-eu-west-1.amazonaws.com/prod-ucs-content-store-eu-west/content/pii:S0378778822007654/STRIPIN/image/svg+xml/0b76ec0610bcdc0cef6424570d219dce/si133.svg si133 si133.svg svg 2581 ALTIMG 1-s2.0-S0378778822007654-si134.svg https://s3-eu-west-1.amazonaws.com/prod-ucs-content-store-eu-west/content/pii:S0378778822007654/STRIPIN/image/svg+xml/7bbc19d8f5ff6c2222fcde3d86f6a317/si134.svg si134 si134.svg svg 8093 ALTIMG 1-s2.0-S0378778822007654-si135.svg https://s3-eu-west-1.amazonaws.com/prod-ucs-content-store-eu-west/content/pii:S0378778822007654/STRIPIN/image/svg+xml/13ca7e3cece971eb1e41808064733d94/si135.svg si135 si135.svg svg 7867 ALTIMG 1-s2.0-S0378778822007654-si136.svg https://s3-eu-west-1.amazonaws.com/prod-ucs-content-store-eu-west/content/pii:S0378778822007654/STRIPIN/image/svg+xml/d3366e6bc66d0ae38963a68d624f7a48/si136.svg si136 si136.svg svg 8084 ALTIMG 1-s2.0-S0378778822007654-si137.svg https://s3-eu-west-1.amazonaws.com/prod-ucs-content-store-eu-west/content/pii:S0378778822007654/STRIPIN/image/svg+xml/e4f2448ea5c2d6db8c8e1973c66ce3ce/si137.svg si137 si137.svg svg 7890 ALTIMG 1-s2.0-S0378778822007654-si138.svg https://s3-eu-west-1.amazonaws.com/prod-ucs-content-store-eu-west/content/pii:S0378778822007654/STRIPIN/image/svg+xml/e5b28e3198d6333abeebc86f35439827/si138.svg si138 si138.svg svg 6984 ALTIMG 1-s2.0-S0378778822007654-si139.svg https://s3-eu-west-1.amazonaws.com/prod-ucs-content-store-eu-west/content/pii:S0378778822007654/STRIPIN/image/svg+xml/088016dd8555570ebb693720877d0a80/si139.svg si139 si139.svg svg 6013 ALTIMG 1-s2.0-S0378778822007654-si14.svg https://s3-eu-west-1.amazonaws.com/prod-ucs-content-store-eu-west/content/pii:S0378778822007654/STRIPIN/image/svg+xml/91546503e9512828dfbd72efb86967da/si14.svg si14 si14.svg svg 9505 ALTIMG 1-s2.0-S0378778822007654-si140.svg https://s3-eu-west-1.amazonaws.com/prod-ucs-content-store-eu-west/content/pii:S0378778822007654/STRIPIN/image/svg+xml/6bd9ecff06064eecfb20fd81f9f74fca/si140.svg si140 si140.svg svg 6179 ALTIMG 1-s2.0-S0378778822007654-si141.svg https://s3-eu-west-1.amazonaws.com/prod-ucs-content-store-eu-west/content/pii:S0378778822007654/STRIPIN/image/svg+xml/ca065a7bdf74aebdf5893f4e3b299317/si141.svg si141 si141.svg svg 5451 ALTIMG 1-s2.0-S0378778822007654-si142.svg https://s3-eu-west-1.amazonaws.com/prod-ucs-content-store-eu-west/content/pii:S0378778822007654/STRIPIN/image/svg+xml/ed2e0aaa31bf1e5f1562e6e919399078/si142.svg si142 si142.svg svg 7840 ALTIMG 1-s2.0-S0378778822007654-si143.svg https://s3-eu-west-1.amazonaws.com/prod-ucs-content-store-eu-west/content/pii:S0378778822007654/STRIPIN/image/svg+xml/73b39961777fc553dffd2061b152d1ea/si143.svg si143 si143.svg svg 3360 ALTIMG 1-s2.0-S0378778822007654-si144.svg https://s3-eu-west-1.amazonaws.com/prod-ucs-content-store-eu-west/content/pii:S0378778822007654/STRIPIN/image/svg+xml/dafc93c82d8c8b29b84951a04fe9ba4b/si144.svg si144 si144.svg svg 35563 ALTIMG 1-s2.0-S0378778822007654-si145.svg https://s3-eu-west-1.amazonaws.com/prod-ucs-content-store-eu-west/content/pii:S0378778822007654/STRIPIN/image/svg+xml/48013024b7a8cc2f11b08eb7b163e8ec/si145.svg si145 si145.svg svg 3530 ALTIMG 1-s2.0-S0378778822007654-si146.svg https://s3-eu-west-1.amazonaws.com/prod-ucs-content-store-eu-west/content/pii:S0378778822007654/STRIPIN/image/svg+xml/440c59b7c22787f138d6308f1503a3e3/si146.svg si146 si146.svg svg 1712 ALTIMG 1-s2.0-S0378778822007654-si147.svg https://s3-eu-west-1.amazonaws.com/prod-ucs-content-store-eu-west/content/pii:S0378778822007654/STRIPIN/image/svg+xml/81bb4c9ae58ef58ff60cdf14878044a7/si147.svg si147 si147.svg svg 2998 ALTIMG 1-s2.0-S0378778822007654-si148.svg https://s3-eu-west-1.amazonaws.com/prod-ucs-content-store-eu-west/content/pii:S0378778822007654/STRIPIN/image/svg+xml/551e4ceb71fd08aeadc32e28700c3978/si148.svg si148 si148.svg svg 4387 ALTIMG 1-s2.0-S0378778822007654-si149.svg https://s3-eu-west-1.amazonaws.com/prod-ucs-content-store-eu-west/content/pii:S0378778822007654/STRIPIN/image/svg+xml/89eab3e13054c464342a961e8482a03d/si149.svg si149 si149.svg svg 31994 ALTIMG 1-s2.0-S0378778822007654-si15.svg https://s3-eu-west-1.amazonaws.com/prod-ucs-content-store-eu-west/content/pii:S0378778822007654/STRIPIN/image/svg+xml/91f72d2a3b347a10ddbb84ea9659c77c/si15.svg si15 si15.svg svg 6805 ALTIMG 1-s2.0-S0378778822007654-si150.svg https://s3-eu-west-1.amazonaws.com/prod-ucs-content-store-eu-west/content/pii:S0378778822007654/STRIPIN/image/svg+xml/b67d2e8e1638f1c5df2cd2e28a46fe41/si150.svg si150 si150.svg svg 10762 ALTIMG 1-s2.0-S0378778822007654-si151.svg https://s3-eu-west-1.amazonaws.com/prod-ucs-content-store-eu-west/content/pii:S0378778822007654/STRIPIN/image/svg+xml/ec2b91340ae8f9cbca5ab572ccca3920/si151.svg si151 si151.svg svg 10474 ALTIMG 1-s2.0-S0378778822007654-si152.svg https://s3-eu-west-1.amazonaws.com/prod-ucs-content-store-eu-west/content/pii:S0378778822007654/STRIPIN/image/svg+xml/fd8c8839e11f4e42950649e27b6899f3/si152.svg si152 si152.svg svg 3395 ALTIMG 1-s2.0-S0378778822007654-si153.svg https://s3-eu-west-1.amazonaws.com/prod-ucs-content-store-eu-west/content/pii:S0378778822007654/STRIPIN/image/svg+xml/e5cbd92574f3d193aefaeb32c59c56c8/si153.svg si153 si153.svg svg 17202 ALTIMG 1-s2.0-S0378778822007654-si154.svg https://s3-eu-west-1.amazonaws.com/prod-ucs-content-store-eu-west/content/pii:S0378778822007654/STRIPIN/image/svg+xml/87833ed951c85915b6d7b175c5be651d/si154.svg si154 si154.svg svg 1811 ALTIMG 1-s2.0-S0378778822007654-si155.svg https://s3-eu-west-1.amazonaws.com/prod-ucs-content-store-eu-west/content/pii:S0378778822007654/STRIPIN/image/svg+xml/326353e2563aa1cca9d96f33682bc3cc/si155.svg si155 si155.svg svg 1748 ALTIMG 1-s2.0-S0378778822007654-si156.svg https://s3-eu-west-1.amazonaws.com/prod-ucs-content-store-eu-west/content/pii:S0378778822007654/STRIPIN/image/svg+xml/25d22cc4fb6decc33c20310d6de49079/si156.svg si156 si156.svg svg 2987 ALTIMG 1-s2.0-S0378778822007654-si16.svg https://s3-eu-west-1.amazonaws.com/prod-ucs-content-store-eu-west/content/pii:S0378778822007654/STRIPIN/image/svg+xml/8152c01f97723416e2f5e08034512727/si16.svg si16 si16.svg svg 7747 ALTIMG 1-s2.0-S0378778822007654-si17.svg https://s3-eu-west-1.amazonaws.com/prod-ucs-content-store-eu-west/content/pii:S0378778822007654/STRIPIN/image/svg+xml/24f5c582dadc726b4c85173ead0a7cf6/si17.svg si17 si17.svg svg 8615 ALTIMG 1-s2.0-S0378778822007654-si18.svg https://s3-eu-west-1.amazonaws.com/prod-ucs-content-store-eu-west/content/pii:S0378778822007654/STRIPIN/image/svg+xml/4e7d6793af052192686c424e65ce8f17/si18.svg si18 si18.svg svg 11407 ALTIMG 1-s2.0-S0378778822007654-si19.svg https://s3-eu-west-1.amazonaws.com/prod-ucs-content-store-eu-west/content/pii:S0378778822007654/STRIPIN/image/svg+xml/a0ff13cc653a8061c79aeb3e97d58bc3/si19.svg si19 si19.svg svg 4125 ALTIMG 1-s2.0-S0378778822007654-si2.svg https://s3-eu-west-1.amazonaws.com/prod-ucs-content-store-eu-west/content/pii:S0378778822007654/STRIPIN/image/svg+xml/e318f5127858a3a0d0d4c0ac8d8dde8d/si2.svg si2 si2.svg svg 3879 ALTIMG 1-s2.0-S0378778822007654-si20.svg https://s3-eu-west-1.amazonaws.com/prod-ucs-content-store-eu-west/content/pii:S0378778822007654/STRIPIN/image/svg+xml/b0c6863d6c2ee6a77a1bff9518f40c89/si20.svg si20 si20.svg svg 3550 ALTIMG 1-s2.0-S0378778822007654-si21.svg https://s3-eu-west-1.amazonaws.com/prod-ucs-content-store-eu-west/content/pii:S0378778822007654/STRIPIN/image/svg+xml/8e7cdfb2f0c58f41ee38dcd21d7062b5/si21.svg si21 si21.svg svg 7154 ALTIMG 1-s2.0-S0378778822007654-si22.svg https://s3-eu-west-1.amazonaws.com/prod-ucs-content-store-eu-west/content/pii:S0378778822007654/STRIPIN/image/svg+xml/9fd76113af8cf2ea857602b1c154525e/si22.svg si22 si22.svg svg 8650 ALTIMG 1-s2.0-S0378778822007654-si23.svg https://s3-eu-west-1.amazonaws.com/prod-ucs-content-store-eu-west/content/pii:S0378778822007654/STRIPIN/image/svg+xml/23a47e1df4df3179e5bae9a9ef6fd3a4/si23.svg si23 si23.svg svg 10852 ALTIMG 1-s2.0-S0378778822007654-si24.svg https://s3-eu-west-1.amazonaws.com/prod-ucs-content-store-eu-west/content/pii:S0378778822007654/STRIPIN/image/svg+xml/18956284bfbecfc1066ce3c0ad256c37/si24.svg si24 si24.svg svg 10765 ALTIMG 1-s2.0-S0378778822007654-si25.svg https://s3-eu-west-1.amazonaws.com/prod-ucs-content-store-eu-west/content/pii:S0378778822007654/STRIPIN/image/svg+xml/2d7bd0aa06b2c2e0930eccd8ea95161b/si25.svg si25 si25.svg svg 6587 ALTIMG 1-s2.0-S0378778822007654-si26.svg https://s3-eu-west-1.amazonaws.com/prod-ucs-content-store-eu-west/content/pii:S0378778822007654/STRIPIN/image/svg+xml/3543c24919c685a04c22d03eba7b3820/si26.svg si26 si26.svg svg 7528 ALTIMG 1-s2.0-S0378778822007654-si27.svg https://s3-eu-west-1.amazonaws.com/prod-ucs-content-store-eu-west/content/pii:S0378778822007654/STRIPIN/image/svg+xml/b5004502488cc737278beb90b88a9643/si27.svg si27 si27.svg svg 14651 ALTIMG 1-s2.0-S0378778822007654-si28.svg https://s3-eu-west-1.amazonaws.com/prod-ucs-content-store-eu-west/content/pii:S0378778822007654/STRIPIN/image/svg+xml/d3eeb5974ff77614ed7c1c230a743ba8/si28.svg si28 si28.svg svg 4337 ALTIMG 1-s2.0-S0378778822007654-si29.svg https://s3-eu-west-1.amazonaws.com/prod-ucs-content-store-eu-west/content/pii:S0378778822007654/STRIPIN/image/svg+xml/151186a7c50091b98150bb1e80812b0e/si29.svg si29 si29.svg svg 3769 ALTIMG 1-s2.0-S0378778822007654-si3.svg https://s3-eu-west-1.amazonaws.com/prod-ucs-content-store-eu-west/content/pii:S0378778822007654/STRIPIN/image/svg+xml/88cdb927bba3f56b47c80a3240c16e3c/si3.svg si3 si3.svg svg 4091 ALTIMG 1-s2.0-S0378778822007654-si30.svg https://s3-eu-west-1.amazonaws.com/prod-ucs-content-store-eu-west/content/pii:S0378778822007654/STRIPIN/image/svg+xml/1b5d97d3da1ac9eee2a6c52e1a95f15b/si30.svg si30 si30.svg svg 10618 ALTIMG 1-s2.0-S0378778822007654-si31.svg https://s3-eu-west-1.amazonaws.com/prod-ucs-content-store-eu-west/content/pii:S0378778822007654/STRIPIN/image/svg+xml/89f5282658697ff32b0f9f25e3694505/si31.svg si31 si31.svg svg 8867 ALTIMG 1-s2.0-S0378778822007654-si32.svg https://s3-eu-west-1.amazonaws.com/prod-ucs-content-store-eu-west/content/pii:S0378778822007654/STRIPIN/image/svg+xml/5237285a6c43d7c9862ab0dbb288a5e8/si32.svg si32 si32.svg svg 6795 ALTIMG 1-s2.0-S0378778822007654-si33.svg https://s3-eu-west-1.amazonaws.com/prod-ucs-content-store-eu-west/content/pii:S0378778822007654/STRIPIN/image/svg+xml/e49d6bb4542472d87ca70a7b43e35ef1/si33.svg si33 si33.svg svg 9654 ALTIMG 1-s2.0-S0378778822007654-si34.svg https://s3-eu-west-1.amazonaws.com/prod-ucs-content-store-eu-west/content/pii:S0378778822007654/STRIPIN/image/svg+xml/3e175d20bf508200dafb43e4c994e1cb/si34.svg si34 si34.svg svg 7739 ALTIMG 1-s2.0-S0378778822007654-si35.svg https://s3-eu-west-1.amazonaws.com/prod-ucs-content-store-eu-west/content/pii:S0378778822007654/STRIPIN/image/svg+xml/6f6eec1c95786c090df2af9894c1cffb/si35.svg si35 si35.svg svg 14311 ALTIMG 1-s2.0-S0378778822007654-si36.svg https://s3-eu-west-1.amazonaws.com/prod-ucs-content-store-eu-west/content/pii:S0378778822007654/STRIPIN/image/svg+xml/2e76c8311db14d84242e7315b057e627/si36.svg si36 si36.svg svg 4146 ALTIMG 1-s2.0-S0378778822007654-si37.svg https://s3-eu-west-1.amazonaws.com/prod-ucs-content-store-eu-west/content/pii:S0378778822007654/STRIPIN/image/svg+xml/696cbef4fd6e75c86ef4155c11a6a628/si37.svg si37 si37.svg svg 3576 ALTIMG 1-s2.0-S0378778822007654-si38.svg https://s3-eu-west-1.amazonaws.com/prod-ucs-content-store-eu-west/content/pii:S0378778822007654/STRIPIN/image/svg+xml/83cfabd5e4fb6c92997992ad08c55489/si38.svg si38 si38.svg svg 32731 ALTIMG 1-s2.0-S0378778822007654-si39.svg https://s3-eu-west-1.amazonaws.com/prod-ucs-content-store-eu-west/content/pii:S0378778822007654/STRIPIN/image/svg+xml/df0eb179af47ddb092e13782f41ed331/si39.svg si39 si39.svg svg 8517 ALTIMG 1-s2.0-S0378778822007654-si4.svg https://s3-eu-west-1.amazonaws.com/prod-ucs-content-store-eu-west/content/pii:S0378778822007654/STRIPIN/image/svg+xml/879c20e0c143736da536d7bcc3702972/si4.svg si4 si4.svg svg 3902 ALTIMG 1-s2.0-S0378778822007654-si40.svg https://s3-eu-west-1.amazonaws.com/prod-ucs-content-store-eu-west/content/pii:S0378778822007654/STRIPIN/image/svg+xml/8053c94267c801a4b4dadd9c469a4b4e/si40.svg si40 si40.svg svg 7176 ALTIMG 1-s2.0-S0378778822007654-si41.svg https://s3-eu-west-1.amazonaws.com/prod-ucs-content-store-eu-west/content/pii:S0378778822007654/STRIPIN/image/svg+xml/a1200c1dfa0a3b4afd8d181c06f2b98b/si41.svg si41 si41.svg svg 6608 ALTIMG 1-s2.0-S0378778822007654-si42.svg https://s3-eu-west-1.amazonaws.com/prod-ucs-content-store-eu-west/content/pii:S0378778822007654/STRIPIN/image/svg+xml/de138faacfaab40f304a9343ccce99eb/si42.svg si42 si42.svg svg 5864 ALTIMG 1-s2.0-S0378778822007654-si43.svg https://s3-eu-west-1.amazonaws.com/prod-ucs-content-store-eu-west/content/pii:S0378778822007654/STRIPIN/image/svg+xml/45a2de413423d7d9cef0262f49d4ad5c/si43.svg si43 si43.svg svg 6687 ALTIMG 1-s2.0-S0378778822007654-si44.svg https://s3-eu-west-1.amazonaws.com/prod-ucs-content-store-eu-west/content/pii:S0378778822007654/STRIPIN/image/svg+xml/b36a61af840ff71773469a110e239802/si44.svg si44 si44.svg svg 5830 ALTIMG 1-s2.0-S0378778822007654-si45.svg https://s3-eu-west-1.amazonaws.com/prod-ucs-content-store-eu-west/content/pii:S0378778822007654/STRIPIN/image/svg+xml/1ebe0b0c9eecd783dfc636a1b228cee6/si45.svg si45 si45.svg svg 6923 ALTIMG 1-s2.0-S0378778822007654-si46.svg https://s3-eu-west-1.amazonaws.com/prod-ucs-content-store-eu-west/content/pii:S0378778822007654/STRIPIN/image/svg+xml/97ef00e7f8cdfeb0a4b1c1d26b997d8b/si46.svg si46 si46.svg svg 7135 ALTIMG 1-s2.0-S0378778822007654-si47.svg https://s3-eu-west-1.amazonaws.com/prod-ucs-content-store-eu-west/content/pii:S0378778822007654/STRIPIN/image/svg+xml/facbd582eff77ed40779f05431cd6ac6/si47.svg si47 si47.svg svg 11979 ALTIMG 1-s2.0-S0378778822007654-si48.svg https://s3-eu-west-1.amazonaws.com/prod-ucs-content-store-eu-west/content/pii:S0378778822007654/STRIPIN/image/svg+xml/b3735221c353d81fe18c8edb389a7732/si48.svg si48 si48.svg svg 2551 ALTIMG 1-s2.0-S0378778822007654-si49.svg https://s3-eu-west-1.amazonaws.com/prod-ucs-content-store-eu-west/content/pii:S0378778822007654/STRIPIN/image/svg+xml/68cafb9edd80b92f929f74a7a7800645/si49.svg si49 si49.svg svg 8086 ALTIMG 1-s2.0-S0378778822007654-si5.svg https://s3-eu-west-1.amazonaws.com/prod-ucs-content-store-eu-west/content/pii:S0378778822007654/STRIPIN/image/svg+xml/f34577483a3675bb7287058a698532bb/si5.svg si5 si5.svg svg 1757 ALTIMG 1-s2.0-S0378778822007654-si50.svg https://s3-eu-west-1.amazonaws.com/prod-ucs-content-store-eu-west/content/pii:S0378778822007654/STRIPIN/image/svg+xml/6532b7e93e149c2f95635a1b3178b9c4/si50.svg si50 si50.svg svg 2142 ALTIMG 1-s2.0-S0378778822007654-si51.svg https://s3-eu-west-1.amazonaws.com/prod-ucs-content-store-eu-west/content/pii:S0378778822007654/STRIPIN/image/svg+xml/7d49e076d7765659208f9ba609d96f44/si51.svg si51 si51.svg svg 1397 ALTIMG 1-s2.0-S0378778822007654-si52.svg https://s3-eu-west-1.amazonaws.com/prod-ucs-content-store-eu-west/content/pii:S0378778822007654/STRIPIN/image/svg+xml/4c54d4ce620980816d78bf007c4b0d7a/si52.svg si52 si52.svg svg 11952 ALTIMG 1-s2.0-S0378778822007654-si53.svg https://s3-eu-west-1.amazonaws.com/prod-ucs-content-store-eu-west/content/pii:S0378778822007654/STRIPIN/image/svg+xml/df99eccc13ab1fb3cb27ff24a24f6b8b/si53.svg si53 si53.svg svg 8248 ALTIMG 1-s2.0-S0378778822007654-si54.svg https://s3-eu-west-1.amazonaws.com/prod-ucs-content-store-eu-west/content/pii:S0378778822007654/STRIPIN/image/svg+xml/921dd587488badf9df461bdaddf99141/si54.svg si54 si54.svg svg 4747 ALTIMG 1-s2.0-S0378778822007654-si55.svg https://s3-eu-west-1.amazonaws.com/prod-ucs-content-store-eu-west/content/pii:S0378778822007654/STRIPIN/image/svg+xml/c595b90510a3e2141609e571e37327fe/si55.svg si55 si55.svg svg 43292 ALTIMG 1-s2.0-S0378778822007654-si56.svg https://s3-eu-west-1.amazonaws.com/prod-ucs-content-store-eu-west/content/pii:S0378778822007654/STRIPIN/image/svg+xml/9aca839236583f73cde08aaa5b86e8bd/si56.svg si56 si56.svg svg 10311 ALTIMG 1-s2.0-S0378778822007654-si57.svg https://s3-eu-west-1.amazonaws.com/prod-ucs-content-store-eu-west/content/pii:S0378778822007654/STRIPIN/image/svg+xml/f16e8b19b1fe08f0d8ebf41f8431964d/si57.svg si57 si57.svg svg 4626 ALTIMG 1-s2.0-S0378778822007654-si58.svg https://s3-eu-west-1.amazonaws.com/prod-ucs-content-store-eu-west/content/pii:S0378778822007654/STRIPIN/image/svg+xml/ff6f7271df0824167fcfbd1c5af5024d/si58.svg si58 si58.svg svg 4729 ALTIMG 1-s2.0-S0378778822007654-si59.svg https://s3-eu-west-1.amazonaws.com/prod-ucs-content-store-eu-west/content/pii:S0378778822007654/STRIPIN/image/svg+xml/4dc3a676367b810f21349070cbd4e03b/si59.svg si59 si59.svg svg 3269 ALTIMG 1-s2.0-S0378778822007654-si6.svg https://s3-eu-west-1.amazonaws.com/prod-ucs-content-store-eu-west/content/pii:S0378778822007654/STRIPIN/image/svg+xml/a7786a4ad1be534a2a10a9a19528a161/si6.svg si6 si6.svg svg 6057 ALTIMG 1-s2.0-S0378778822007654-si60.svg https://s3-eu-west-1.amazonaws.com/prod-ucs-content-store-eu-west/content/pii:S0378778822007654/STRIPIN/image/svg+xml/f6a9f15dda57a6cd7f56e452b998e97d/si60.svg si60 si60.svg svg 3097 ALTIMG 1-s2.0-S0378778822007654-si61.svg https://s3-eu-west-1.amazonaws.com/prod-ucs-content-store-eu-west/content/pii:S0378778822007654/STRIPIN/image/svg+xml/d049fcbcd01fd73f021fdee3c2455b5c/si61.svg si61 si61.svg svg 3202 ALTIMG 1-s2.0-S0378778822007654-si62.svg https://s3-eu-west-1.amazonaws.com/prod-ucs-content-store-eu-west/content/pii:S0378778822007654/STRIPIN/image/svg+xml/2be22eb700cb94385dd0a63880d7ec61/si62.svg si62 si62.svg svg 3724 ALTIMG 1-s2.0-S0378778822007654-si63.svg https://s3-eu-west-1.amazonaws.com/prod-ucs-content-store-eu-west/content/pii:S0378778822007654/STRIPIN/image/svg+xml/03092adaacde1d1735f81d5f9ef844e2/si63.svg si63 si63.svg svg 13698 ALTIMG 1-s2.0-S0378778822007654-si64.svg https://s3-eu-west-1.amazonaws.com/prod-ucs-content-store-eu-west/content/pii:S0378778822007654/STRIPIN/image/svg+xml/29b38cf630422ebca66bc2ca9a28d933/si64.svg si64 si64.svg svg 3024 ALTIMG 1-s2.0-S0378778822007654-si65.svg https://s3-eu-west-1.amazonaws.com/prod-ucs-content-store-eu-west/content/pii:S0378778822007654/STRIPIN/image/svg+xml/7df4b6971a3615bcd8bd8bc7fa198ff8/si65.svg si65 si65.svg svg 4744 ALTIMG 1-s2.0-S0378778822007654-si66.svg https://s3-eu-west-1.amazonaws.com/prod-ucs-content-store-eu-west/content/pii:S0378778822007654/STRIPIN/image/svg+xml/dadbc439c843ebf18ef7529a176741c9/si66.svg si66 si66.svg svg 4729 ALTIMG 1-s2.0-S0378778822007654-si67.svg https://s3-eu-west-1.amazonaws.com/prod-ucs-content-store-eu-west/content/pii:S0378778822007654/STRIPIN/image/svg+xml/e6aaa445eb5e95def8be65f5b85d5b88/si67.svg si67 si67.svg svg 5014 ALTIMG 1-s2.0-S0378778822007654-si68.svg https://s3-eu-west-1.amazonaws.com/prod-ucs-content-store-eu-west/content/pii:S0378778822007654/STRIPIN/image/svg+xml/a4ee48dbe5cfa48727d593f0dc983888/si68.svg si68 si68.svg svg 27429 ALTIMG 1-s2.0-S0378778822007654-si69.svg https://s3-eu-west-1.amazonaws.com/prod-ucs-content-store-eu-west/content/pii:S0378778822007654/STRIPIN/image/svg+xml/1369019bea08b1feb0bf6dcf9786d5c8/si69.svg si69 si69.svg svg 16359 ALTIMG 1-s2.0-S0378778822007654-si7.svg https://s3-eu-west-1.amazonaws.com/prod-ucs-content-store-eu-west/content/pii:S0378778822007654/STRIPIN/image/svg+xml/0d5313c075ddc69c40f472d53db01801/si7.svg si7 si7.svg svg 6856 ALTIMG 1-s2.0-S0378778822007654-si70.svg https://s3-eu-west-1.amazonaws.com/prod-ucs-content-store-eu-west/content/pii:S0378778822007654/STRIPIN/image/svg+xml/d5d9168988318fd8b2a6e54d9826c4f2/si70.svg si70 si70.svg svg 14780 ALTIMG 1-s2.0-S0378778822007654-si71.svg https://s3-eu-west-1.amazonaws.com/prod-ucs-content-store-eu-west/content/pii:S0378778822007654/STRIPIN/image/svg+xml/99b4ee6387ebd295ab048024e3c65e86/si71.svg si71 si71.svg svg 5284 ALTIMG 1-s2.0-S0378778822007654-si72.svg https://s3-eu-west-1.amazonaws.com/prod-ucs-content-store-eu-west/content/pii:S0378778822007654/STRIPIN/image/svg+xml/64f9910cd1044ec071ae7dd7659a602f/si72.svg si72 si72.svg svg 5349 ALTIMG 1-s2.0-S0378778822007654-si73.svg https://s3-eu-west-1.amazonaws.com/prod-ucs-content-store-eu-west/content/pii:S0378778822007654/STRIPIN/image/svg+xml/dcfd3089fd0be98bc4e3d2717d458819/si73.svg si73 si73.svg svg 7038 ALTIMG 1-s2.0-S0378778822007654-si74.svg https://s3-eu-west-1.amazonaws.com/prod-ucs-content-store-eu-west/content/pii:S0378778822007654/STRIPIN/image/svg+xml/7ed38aeab2209c2ee07c0b6605a84c33/si74.svg si74 si74.svg svg 5855 ALTIMG 1-s2.0-S0378778822007654-si75.svg https://s3-eu-west-1.amazonaws.com/prod-ucs-content-store-eu-west/content/pii:S0378778822007654/STRIPIN/image/svg+xml/0dd49f833385a7b8553500b4e6467d5a/si75.svg si75 si75.svg svg 5841 ALTIMG 1-s2.0-S0378778822007654-si76.svg https://s3-eu-west-1.amazonaws.com/prod-ucs-content-store-eu-west/content/pii:S0378778822007654/STRIPIN/image/svg+xml/6ce884f3e48739359632925f9e916b29/si76.svg si76 si76.svg svg 5971 ALTIMG 1-s2.0-S0378778822007654-si77.svg https://s3-eu-west-1.amazonaws.com/prod-ucs-content-store-eu-west/content/pii:S0378778822007654/STRIPIN/image/svg+xml/9c3a96c64d92018ab669db700ce38efa/si77.svg si77 si77.svg svg 27813 ALTIMG 1-s2.0-S0378778822007654-si78.svg https://s3-eu-west-1.amazonaws.com/prod-ucs-content-store-eu-west/content/pii:S0378778822007654/STRIPIN/image/svg+xml/a220d47a9d29b7dfc68643cd2a974c59/si78.svg si78 si78.svg svg 25502 ALTIMG 1-s2.0-S0378778822007654-si79.svg https://s3-eu-west-1.amazonaws.com/prod-ucs-content-store-eu-west/content/pii:S0378778822007654/STRIPIN/image/svg+xml/802a06ece39eed385036d77104926e03/si79.svg si79 si79.svg svg 25024 ALTIMG 1-s2.0-S0378778822007654-si8.svg https://s3-eu-west-1.amazonaws.com/prod-ucs-content-store-eu-west/content/pii:S0378778822007654/STRIPIN/image/svg+xml/eae73b971fc0e3de3b4157b648524508/si8.svg si8 si8.svg svg 7585 ALTIMG 1-s2.0-S0378778822007654-si80.svg https://s3-eu-west-1.amazonaws.com/prod-ucs-content-store-eu-west/content/pii:S0378778822007654/STRIPIN/image/svg+xml/57c7e32573bdecff50a13ee4597d6ccb/si80.svg si80 si80.svg svg 25020 ALTIMG 1-s2.0-S0378778822007654-si81.svg https://s3-eu-west-1.amazonaws.com/prod-ucs-content-store-eu-west/content/pii:S0378778822007654/STRIPIN/image/svg+xml/1f74a21e709bd6da3f418cdc1a41d274/si81.svg si81 si81.svg svg 6966 ALTIMG 1-s2.0-S0378778822007654-si82.svg https://s3-eu-west-1.amazonaws.com/prod-ucs-content-store-eu-west/content/pii:S0378778822007654/STRIPIN/image/svg+xml/ecc8edeb9a71c9d546239f4682b8b1b9/si82.svg si82 si82.svg svg 6740 ALTIMG 1-s2.0-S0378778822007654-si83.svg https://s3-eu-west-1.amazonaws.com/prod-ucs-content-store-eu-west/content/pii:S0378778822007654/STRIPIN/image/svg+xml/846c4ddc53d4f93f829d30a00299ed1a/si83.svg si83 si83.svg svg 6954 ALTIMG 1-s2.0-S0378778822007654-si84.svg https://s3-eu-west-1.amazonaws.com/prod-ucs-content-store-eu-west/content/pii:S0378778822007654/STRIPIN/image/svg+xml/73acfcf39b62c765d15cef4540ab0f0c/si84.svg si84 si84.svg svg 6764 ALTIMG 1-s2.0-S0378778822007654-si85.svg https://s3-eu-west-1.amazonaws.com/prod-ucs-content-store-eu-west/content/pii:S0378778822007654/STRIPIN/image/svg+xml/c5abb0672557649b74ca4f14c2937787/si85.svg si85 si85.svg svg 6062 ALTIMG 1-s2.0-S0378778822007654-si86.svg https://s3-eu-west-1.amazonaws.com/prod-ucs-content-store-eu-west/content/pii:S0378778822007654/STRIPIN/image/svg+xml/5425fbd05a706fbf140d92e4fb2fcd75/si86.svg si86 si86.svg svg 5843 ALTIMG 1-s2.0-S0378778822007654-si87.svg https://s3-eu-west-1.amazonaws.com/prod-ucs-content-store-eu-west/content/pii:S0378778822007654/STRIPIN/image/svg+xml/583e849746c52b91b7fe5a58aa19e299/si87.svg si87 si87.svg svg 6053 ALTIMG 1-s2.0-S0378778822007654-si88.svg https://s3-eu-west-1.amazonaws.com/prod-ucs-content-store-eu-west/content/pii:S0378778822007654/STRIPIN/image/svg+xml/b1c9e3a93778c62e75bda515f38e27e0/si88.svg si88 si88.svg svg 8299 ALTIMG 1-s2.0-S0378778822007654-si89.svg https://s3-eu-west-1.amazonaws.com/prod-ucs-content-store-eu-west/content/pii:S0378778822007654/STRIPIN/image/svg+xml/09dc7775b8f9fea7436761b2dc6129e5/si89.svg si89 si89.svg svg 8080 ALTIMG 1-s2.0-S0378778822007654-si9.svg https://s3-eu-west-1.amazonaws.com/prod-ucs-content-store-eu-west/content/pii:S0378778822007654/STRIPIN/image/svg+xml/d4f4aeb2eed0d0659de2fef8fb2392e0/si9.svg si9 si9.svg svg 9858 ALTIMG 1-s2.0-S0378778822007654-si90.svg https://s3-eu-west-1.amazonaws.com/prod-ucs-content-store-eu-west/content/pii:S0378778822007654/STRIPIN/image/svg+xml/7cfcdc71107c6620fcbfe6f5a7605a5e/si90.svg si90 si90.svg svg 7354 ALTIMG 1-s2.0-S0378778822007654-si91.svg https://s3-eu-west-1.amazonaws.com/prod-ucs-content-store-eu-west/content/pii:S0378778822007654/STRIPIN/image/svg+xml/19ed3f773a510eb52b183c70b1a49f8b/si91.svg si91 si91.svg svg 8095 ALTIMG 1-s2.0-S0378778822007654-si92.svg https://s3-eu-west-1.amazonaws.com/prod-ucs-content-store-eu-west/content/pii:S0378778822007654/STRIPIN/image/svg+xml/49afb62ec1b8bc4f70034e2dd88f8efa/si92.svg si92 si92.svg svg 3886 ALTIMG 1-s2.0-S0378778822007654-si93.svg https://s3-eu-west-1.amazonaws.com/prod-ucs-content-store-eu-west/content/pii:S0378778822007654/STRIPIN/image/svg+xml/5d2794624119246be2039e160a40de5e/si93.svg si93 si93.svg svg 3672 ALTIMG 1-s2.0-S0378778822007654-si94.svg https://s3-eu-west-1.amazonaws.com/prod-ucs-content-store-eu-west/content/pii:S0378778822007654/STRIPIN/image/svg+xml/64bd2e0c3290b804a5a33e14f80901cf/si94.svg si94 si94.svg svg 3877 ALTIMG 1-s2.0-S0378778822007654-si95.svg https://s3-eu-west-1.amazonaws.com/prod-ucs-content-store-eu-west/content/pii:S0378778822007654/STRIPIN/image/svg+xml/afe0f96b44c9b7a240d24849733599a1/si95.svg si95 si95.svg svg 3684 ALTIMG 1-s2.0-S0378778822007654-si96.svg https://s3-eu-west-1.amazonaws.com/prod-ucs-content-store-eu-west/content/pii:S0378778822007654/STRIPIN/image/svg+xml/00613d6510c9dc7f6006c09dcaf85fff/si96.svg si96 si96.svg svg 4299 ALTIMG 1-s2.0-S0378778822007654-si97.svg https://s3-eu-west-1.amazonaws.com/prod-ucs-content-store-eu-west/content/pii:S0378778822007654/STRIPIN/image/svg+xml/2d05384f8d6f026be1deed945c8b98e0/si97.svg si97 si97.svg svg 27766 ALTIMG 1-s2.0-S0378778822007654-si98.svg https://s3-eu-west-1.amazonaws.com/prod-ucs-content-store-eu-west/content/pii:S0378778822007654/STRIPIN/image/svg+xml/9f7185d3e888db23b7e34e138da05db8/si98.svg si98 si98.svg svg 26521 ALTIMG 1-s2.0-S0378778822007654-si99.svg https://s3-eu-west-1.amazonaws.com/prod-ucs-content-store-eu-west/content/pii:S0378778822007654/STRIPIN/image/svg+xml/759cae41c889b62c3d2bf93a6f925250/si99.svg si99 si99.svg svg 26043 ALTIMG 1-s2.0-S0378778822007654-am.pdf https://s3-eu-west-1.amazonaws.com/prod-ucs-content-store-eu-west/content/egi:10VMVDNL6DV/MAIN/application/pdf/5e10b829682bda3f693e148cc7ca8fda/am.pdf am am.pdf pdf false 757197 AAM-PDF ENB 112594 112594 S0378-7788(22)00765-4 10.1016/j.enbuild.2022.112594 Elsevier B.V. Fig. 1 Framework diagram of HEMS. Fig. 2 Flow chart of DQN. Fig. 3 Structure of the DQN training. Fig. 4 The training process of Agen t es . Fig. 5 (a) Load operation without energy management; (b) load operation with energy management. Fig. 6 Energy consumption cost, carbon trading cost before and after energy management. Fig. 7 Comprehensive cost comparison for each case over 20 cycles. Fig. 8 Time-shiftable loads start-up time under different α ts . Fig. 9 Power-shiftable loads power under different α ps . Fig. 10 State of charge of the electric vehicle under different α es . Fig. 11 Cost and satisfaction penalty distribution under different α es . Fig. 12 Charging/discharge pattern of a electric vehicle over 5 consecutive days. Fig. 13 Comprehensive cost distribution of each user in different scenarios. Table 1 Load operating parameters. Types Loads Power/kW Other parameters α Non-shiftable Refrigerator 1.0 Working hours/h 24 0 Lighting 0.15 / Time-shiftable Washing 0.2 Working hours/h 1 ∼ 2 0.1 Dishwasher 0.5 Working hours/h 2 ∼ 4 Power-shiftable Aircondition (1) 1.5 Working hours/h 24 10 Aircondition (2) 1.0 / Energy storage Battery storage device 5.0 Working hours/h 24 3.1 Start state of charge 0.5 Max state of charge 0.9 Min state of charge 0.1 Capacity /kWh 20 Electric vehicle 6.0 Arrive time /h N ( 18 , 1 2 ) Depart time /h N ( 32 , 1 2 ) Arrive state of charge N ( 0.3 , 0 . 1 2 ) Depart state of charge 0.85 Capacity /kWh 20 Table 2 Comparison of various indicators. Index Energy consumption cost/￠ Carbon tradingcost/￠ Satisfaction penalties/￠ PV consumption rate/% Loadpower/kW Load fluctuation variance Before energy management 663.8 84.8 3257.3 83.2 46.3 1.8 After energy management 400.6 53.6 1623.4 98.2 40.9 6.3 Model-free dynamic management strategy for low-carbon home energy based on deep reinforcement learning accommodating stochastic environments Hui Hou a b Xiangdi Ge a b Yue Chen a b \u204e Jinrui Tang a b Tingting Hou c Rengcun Fang c a School of Automation, Wuhan University of Technology, Wuhan 430070, China School of Automation Wuhan University of Technology Wuhan 430070 China School of Automation, Wuhan University of Technology, Wuhan 430070, China b Shenzhen Research Institute Wuhan University of Technology, Shenzhen 518000, Guangdong Province, China Shenzhen Research Institute Wuhan University of Technology Shenzhen 518000 Guangdong Province China Shenzhen Research Institute Wuhan University of Technology, Shenzhen 518000, Guangdong Province, China c Economics and Technology Research Institute, State Grid Hubei Electric Power Company, Wuhan 430077, China Economics and Technology Research Institute State Grid Hubei Electric Power Company Wuhan 430077 China Economics and Technology Research Institute, State Grid Hubei Electric Power Company, Wuhan 430077, China \u204e Corresponding author at: School of Automation, Wuhan University of Technology, Wuhan 430070, China. School of Automation Wuhan University of Technology Wuhan 430070 China This paper presents a model-free dynamic optimal management strategy for a low-carbon home energy management system (HEMS) based on deep reinforcement learning (DRL). The method can ideally handle the uncertainties and dynamics of renewable energy and demand-side load. Firstly, the load model is established by a deep Q network (DQN) algorithm with the advantage of ignoring traditional forecasting steps on stochastic environments such as renewable energy generation, load demand, price, etc. Then multi-agents are established for dynamic management based on the DRL. Through \u201cdynamic acquisition, dynamic decision\u201d mechanism, the proposed model-free strategy achieves real-time energy management that can adaptively respond to stochastic environments. Secondly, considering the constraints of system carbon emissions and carbon trading, the proposed strategy can minimize the energy consumption cost, carbon trading cost, and user satisfaction penalties. Ultimately, the effectiveness of the proposed strategy is verified through case studies. Experimental results demonstrate that the strategy can significantly reduce the overall cost, including a 36.7% reduction in carbon trading. At the same time, user satisfaction penalties are reduced by 50.2%. Further, the agent hyperparameter could also be adjusted to capture the trade-off between cost savings and satisfaction penalties. And compared with the traditional forecast-based management strategy, it overcomes the problem of uncertainties and avoids forecasting errors to better accommodate the stochastic environment. Keywords Home energy management system Dynamic optimal management Deep reinforcement learning Low-carbon Model-free Data availability I have cited the relevant references in the manuscript for my data. 1 Introduction Residential users of distribution networks consume large amounts of energy in a flexible and uncertain manner. Building home energy management systems (HEMS) for demand-side consumers has become one of the cores to unlock the potential of customer response [1]. In the \u201csource-load-storage\u201d model, it realizes residential energy-saving [2]. Meanwhile, with the low-carbon policies approaching [3], a large number of end-users are potential drivers of carbon emissions [4] and have great potential to reduce carbon emissions. Therefore it is necessary for the low-carbon operation not only from the generation side [5,6], but also from the demand side, especially the low-carbon operation of HEMS. At the same time, the stochastic and volatility of distributed generation and demand put forward higher requirements for demand-side management and HEMS. From the perspective of HEMS stochastic optimization management, most traditional models are deterministic approaches [7]. For instance, [8] and [9] adopted linear programming to manage residential loads in response to real-time prices. And it was used for residential typical load curves management. The specific model of the household load was established in [10] and [11], then the model predictive control (MPC) algorithm was applied to optimize the modeled load. In addition, there is some research on home energy management based on forecast scenarios. [12] and [13] forecasted load demand through the neural network before optimizing management. The fusion of various machine learning algorithms was used for photovoltaic (PV) and load forecasting in [14]. The above models are day-ahead management. Due to the forecast error in day-ahead forecast-based optimization, some scholars have also studied different time scales, such as intra-day and real-time. Through the physical model, the intra-day priority management method based on vehicle event driving was constructed in [15]. Similarly, [16] and [17] adopted the rolling horizon management of aggregated electric vehicles and flexible loads. But it could not effectively eradicate the problems caused by forecast errors. Comprehensive analysis shows that the above models mostly depend on the forecast information such as electricity price, and load demand. However, how to avoid the errors caused by forecast algorithms and uncertainty modeling is still an unresolved problem. Recently, reinforcement learning (RL) and its derived deep reinforcement learning (DRL) have emerged to facilitate such model-free control for coordinating user flexibility with the uncertainties [18]. Based on neural networks and RL, [19] and [20] realized the HEMS dynamic energy management through the interactive update strategy between RL and the environment. However, there was only one type of load in [19], while [20] did not consider electric vehicles, etc. Through RL, the household loads including electric vehicles were dispatched with obvious optimization results in [21]. However, the electric vehicle power was not continuously adjustable, and the effects of Vehicle to Grid (V2G) and Vehicle to Home (V2H) are not considered. On the basis of this, [22] established the energy management model of electric vehicle charging by using a deep Q network (DQN). And it realized the continuous adjustment of the load. Similarly, [23] and [24] established a system economic management strategy based on DRL, but the model only aims at economic optimization. In summary, compared with the traditional forecast-based management model, models based on RL have superiority in dynamic management. However, comprehensive costs such as user comfort and system carbon emissions have not been fully considered. To sum up, there is limited research on HEMS considering low-carbon operations while ensuring energy economy and user satisfaction currently. At the same time, the existing management strategy for HEMS mostly relies on the forecast accuracy of uncertain factors. To address the aforementioned difficulties and supplement the research gap, a model-free dynamic management strategy is proposed for low-carbon home energy. Based on the DQN algorithm, the dynamic management of low-carbon optimization is realized accommodating stochastic environments aiming at the energy economy of the system, low-carbon operation and user comfort. And the feasibility and effectiveness of the proposed model are verified by comparing with the traditional algorithm cases. Compared with the existing research, the major contributions of this paper can be summarized as: \u2022 We take carbon emission and carbon trading into the home energy management framework to release the massive users\u2019 carbon emission reduction potential. The strategy can achieve the unified effect of the energy economy, low-carbon operation, and user satisfaction. \u2022 The proposed model for HEMS based on DRL does not require any distribution knowledge or system information. It can overcome the problem of uncertainties and avoid forecasting errors to better accommodate the stochastic environment such as flexible renewable energy and demand-side load. \u2022 The proposed dynamic optimal strategy can meet the respective management requirements of different users by adjusting the model parameters. The rest of this paper is organized as follows. In Section 2, the structure of the HEMS is introduced, and the models of various types of loads and systematic carbon trading are built in detail. In Section 3, the home energy management strategy is described. In Section 4, the simulation and analysis of a case study are discussed. Then conclusions are drawn in Section 5. 2 Home energy management system 2.1 Framework of home energy management system A typical HEMS framework is shown in Fig. 1 . The system mainly consists of household loads, including, non-shiftable loads, time-shiftable loads, power-shiftable loads, and energy storage loads, and smart meter modules [25]. The smart meter externally connects with the power system to obtain the environmental conditions such as PV output, time of use price, and carbon price, while internally it connects with various household loads and house power generation units. Also, it collects the power demand of household loads and the power generation of PV. At the same time, the smart meter has the function of load triggering, and the built-in algorithm performs load switching and power control, etc. 2.2 Load model We mainly consider four types of loads, including non-shiftable loads, time-shiftable loads, power-shiftable loads, and energy storage loads [25]. According to the characteristics and requirements of the DQN algorithm [30], the action, state, as well as state transition of load are defined below. (1) Non-shiftable loads Non-shiftable loads operate at rated power for a specific period. And it cannot participate in demand response. Its action and state space can be defined by (1) [23]. (1) S ns = { 1 } A ns = { 1 } where S ns , A ns are the state and action spaces of non-shiftable loads respectively. They are uniquely determined values. Therefore, we use ''1\u2032' to represent state and action. The non-shiftable load state transition is defined by (2) (2) S t + 1 ns , j = A t ns , j δ t + 1 ns , j where S t + 1 ns , j is the state of jth non-shiftable load at time t + 1, S t + 1 ns , j ∈ S ns ; A t ns , j is the action of jth non-shiftable load at time t, A t ns , j ∈ A ns ; δ t + 1 ns , j is the inherent state of jth non-shiftable load at time t + 1. This means that non-shiftable load conforming power is determined by the inherent variable δ t + 1 ns , j . (2) Time-shiftable loads The operating period of time-shiftable loads can be adjusted. The action and state space of the load is defined as a binary variable characterizing operation and shutdown [23]. (3) S ts = { 0 , 1 } A ts = { 0 , 1 } where S ts , A ts are the state and action spaces of time-shiftable loads. \u201c0\u2033 and \u201c1\u201d indicate load operation and shutdown respectively. The time-shiftable loads\u2019 state transition from state S t ts , j to S t + 1 ts , j are expressed by (4) (4) S t + 1 ts , j = S t ts , j A t ts , j where S t + 1 ts , j and S t ts , j are the state of jth time-shiftable load at time t + 1 and t, S t ts , j , S t + 1 ts , j ∈ S ts ; A t ts , j is the action of jth time-shiftable load at time t, A t ts , j ∈ A ts . (3) Power-shiftable loads For power-shiftable loads, their operating power has a certain elastic range. And their power can be adjusted or even interrupted while ensuring the basic needs of users, but the working time is strictly fixed and cannot be adjusted. The action and state space of such loads is shown in (5) [25]. (5) S ps = { δ 0 ⩽ δ ⩽ 1 } A ps = { δ 0 ⩽ δ ⩽ 1 } where S ps , A ps are the state and action spaces of power-shiftable. This means that it is continuously adjustable between interrupted and rated states. The power-shiftable loads state transition is expressed by (6) (6) S t + 1 ps , j = A t ps , j where S t + 1 ps , j and A t ps , j are the state at time t + 1 and action at time t, respectively, S t + 1 ps , j ∈ S ps , A t ps , j ∈ A ps . (4) Energy storage loads Battery storage devices and electric vehicles are regarded as energy storage loads. We consider the charging and discharging effects of the electric vehicle. It can realize V2G and V2H. Furthermore, in order to improve the PV consumption and alleviate the PV output as well as load uncertainty, a battery storage device is added to our system. The action and state space of the energy storage loads can be found in (7) [26]. (7) S es = { δ 0 ⩽ δ ⩽ 1 A es = { δ - 1 ⩽ δ ⩽ 1 } where S es , A es are the state and action spaces of energy storage loads. The state S es is the state of charge of the energy storage of loads. (8) shows the variation of the state of charge with the charging/discharging process of the battery. (8) S t + 1 es , j = 1 - ∂ es , j S t es , j + P es , j A t es , j η c es , j / E es , j , A t es , j ⩾ 0 1 - ∂ es , j S t es , j + P es , j A t es , j / E es , j η d es , j , A t es , j < 0 where S t + 1 es , j is the state of jth energy storage load at time t + 1; S t es , j and A t es , j are the state and action of jth energy storage load at time t, respectively; P es , j and E es , j , are rated power and capacity of jth energy storage load; ∂ es , j is the self-dissipation coefficient; η c es , j and η d es , j are the charging and discharging efficiencies, respectively. 2.3 Carbon emissions and carbon trading model (1) Carbon emissions In the power system, fossil fuel consumed by power generators is one of the reasons contributing to carbon emissions [6]. But end-users are also the underlying driver of emissions. According to the carbon emission flow model and proportional sharing principle [31], we can linearize the relationship between power flow and the accompanying virtual emission flow. (9) e t = τ p t grid + where e t is the carbon emission of loads at time t, p t grid is the power exchanged between loads and power system at time t; · + denotes taking non-negative; τ is the carbon emission characteristic factor. It characterizes linear relationships between power flow and carbon emission. (2) Carbon trading Carbon trading is a mechanism to control carbon emissions by creating legal carbon emission quotas and allowing them to carry on transactions [32]. When there is a discrepancy between carbon emissions and the carbon emission quota, HEMS, as a carbon emissions source, needs to buy or sell carbon emission quotas in the carbon trading market to maintain its operation. (10) E t trade = e t - E t ∗ where E t trade is the emission quota for entering the carbon trading market; E t ∗ is carbon emission quota. To further control the total carbon emissions, we construct a ladder-type carbon trading model. Based on the allocated carbon emission quota, the number of emission intervals is specified. And higher emission interval is related to the higher carbon trading price. The carbon trading cost is expressed by (11) (11) c t E t trade = ξ 0 E t trade , E t trade < 0 ξ 1 E t trade - E 1 , t , 0 ⩽ E t trade < E 1 , t - E t ∗ ξ 1 E 1 , t - E t ∗ + ξ 2 E t trade - E 1 , t + E t ∗ , E 1 , t - E t ∗ ⩽ E t trade < E 2 , t - E 1 , t ∗ ξ 1 E 1 , t - E t ∗ + ξ 2 E 2 , t - E 1 , t + ξ 3 E t trade - E 2 , t + E t ∗ , E t trade ⩾ E 2 , t - E 1 , t ∗ where c t E t trade is carbon trading cost; E 1 , t and E 2 , t are ladder-type interval boundary of carbon emission at time t; ξ 0 , ξ 1 , ξ 2 and ξ 3 are the ladder-type carbon price. When the carbon trading cost is negative, it means the HEMS emission is lower than quota. HEMS can realize profits by selling quota. 3 Energy management strategy 3.1 Objective function The objective function considers the energy economy, low-carbon operation, and user satisfaction of the HEMS. (12) f t = min f b , t + f c , t + f p , t where f t is the comprehensive cost at time t; f b , t f c , t and f p , t are energy consumption cost, carbon trading cost, and user satisfaction penalties. The specific calculation process is shown in (13)\u2013(15). (13) f b , t = ∑ i ∈ { n s , s , s , p , b s } R b , t i - T O U t \u2032 p t pv - ∑ i ∈ { n s , s , s , p , b s } p t pv , i (14) f c , t = ∑ i ∈ { ns , ts , ps , bs } R c , t i (15) f p , t = ∑ i ∈ { ns , ss , p , bs } R p , t i where TO U t \u2032 is the price of HEMS selling electricity to the power system at time t; p t pv is the output power of PV at time t; p t pv , i is the power PV supplies for load i at time t; R b , t i R c , t i and R p , t i are the energy consumption cost, carbon emission cost, and satisfaction penalties of load i at time t, respectively. Since our strategy is a dynamic optimization model, time-phased optimization is carried out. The specific calculation processes of each load energy consumption cost are shown in (16)-(19). (16) R b , t ns = TOU t ∑ j = 1 N ns δ t ns , j P ns , j S t ns , j - p t pv , ns + (17) R b , t ts = TOU t ∑ j = 1 N ts P ts , j S t ts , j - p t pv , ts + (18) R b , t ps = TOU t ∑ j = 1 N ps P ps , j S t ps , j - p t pv , ps + (19) R b , t es = TOU t ∑ j = 1 N es P es , j A t es , j - p t pv , es + where R b , t ns , R b , t ts , R b , t ps and R b , t es are energy consumption cost of non-shiftable loads, time-shiftable loads, power-shiftable loads, and energy storage loads at time t, respectively; P ns , j , P ts , j , and P ps , j are the rated power of non-shiftable loads, time-shiftable loads and power-shiftable loads; p t pv , ns , p t pv , ts , p t pv , ps and p t pv , es are the power PV supplies to non-shiftable loads, time-shiftable loads, power-shiftable loads, and energy storage loads at time t, respectively; N ns , N ts , N ps , N es are the number of non-shiftable loads, time-shiftable loads, power-shiftable loads and energy storage loads in HEMS; TOU t is the time of use price of the power system at time t. The carbon trading cost of each load is as follows (20) R c , t ns = c t τ ∑ j = 1 N ns δ t ns , j P ns , j S t ns , j - p t pv , ns + (21) R c , t ts = c t τ ∑ j = 1 N ts P ts , j S t ts , j - p t pv , ts + (22) R c , t ps = c t τ ∑ j = 1 N ps P ps , j S t ps , j - p t pv , ps + (23) R c , t es = c t τ ∑ j = 1 N es P es , j A t es , j - p t pv , es + where R c , t ns , R c , t ts , R c , t ps and R c , t es are carbon trading costs of non-shiftable loads, time-shiftable loads, power-shiftable loads, and energy storage loads at time t, respectively. The satisfaction penalties specific calculation processes of each load are shown in (24)\u2013(27). (24) R p , t ns = 0 (25) R p , t ts = α ts ∑ j = 1 N ts T ini j - T sta j 2 (26) R p , t ps = α ps ∑ j = 1 N p P ps , j - P ps , j S t ps , j 2 + S t ps , j - A t ps , j + (27) R p , t es = α es ∑ j = 1 N s S dep soc , j - S t es , j 2 + ∑ j = 1 N es β es j P es , j A t es , j where R p , t ns , R p , t ts , R p , t ps and R p , t es are satisfaction penalties of non-shiftable loads, time-shiftable loads, power-shiftable loads and energy storage loads at time t, respectively; α ts , α ps and α es are the satisfaction penalty factors of time-shiftable loads, power-shiftable loads and energy storage loads; T ini j and T sta j are the scheduled turn-on time and actual turn-on time of jth time-shiftable loads; S dep soc , j planned end state; β es j is the operation cost coefficient of jth energy storage load. Since non-shiftable loads cannot participate in energy management, these loads have no impact on user satisfaction. For the sake of formal uniformity, we add a definition of satisfaction penalty factors of time-shiftable loads as α ns = 0. (25) calculates the satisfaction of time-shiftable loads based on the deviation operation time from the ideal situation. Similarly, in (26) we penalize the deviations from the rated condition of power-shiftable loads. Moreover, load drop during operation is also penalized. It characterizes the user's sensory preference for boosting the power-shiftable power. (27) characterizes the user satisfaction penalty before reaching the specified state of charge during the management process. At the same time, the loss cost of the charging/discharging process is attributed to (27). 3.2 Constraint condition The constraints of each part in the model are as follows. 1) Power Balance Equation: (28) p t grids + p t pv = ∑ t ∈ ns , t s , p s , e ∑ j = 1 N i P i , j S t i , j 2) Carbon Balance Equation: (29) E t trade + E t ∗ = τ ∑ i ∈ { ns , ts , ps , es } ∑ j = 1 N i P i , j S t i , j - p t pv , i 3) State of Charge Limitation of Energy Storage Loads: (30) S min soc , j ⩽ S t es , j ⩽ S max soc , j where S min soc , j and S max soc , j are, respectively, the lower and upper limits of the state of charge of energy storage loads. 4) Continuity of Battery Storage Device: Based on the lower and upper limits, we consider the continuity of the battery storage device management cycle. The state of the battery storage device should be consistent at the beginning and end of the management cycle [33]. (31) S 0 es , 1 = S T es , 1 where S 0 es , 1 and S T es , 1 the battery storage device state at the beginning and end of a management cycle. 5) Load Fluctuation Constraint: (32) μ t = 1 t ∑ k = 1 t p t ¯ - ∑ i ∈ { ns , s , ps , es } ∑ j N i p k i , j 2 ⩽ μ 0 where μ t is power variance before time t; μ 0 is the rated power variance; p t ¯ is the average power after management at time t. it is expressed by (33) (33) p t ¯ = 1 t ∑ k = 1 t ∑ i ∈ { ns , ts , ps , es } ∑ j N i p k i , j 6) PV Consumption Constraint: (34) ω t = ∑ k = 1 t p k pv / ∑ k = 1 t ∑ i ∈ { ns , ts , ps , es } ∑ j = 1 N i p k i , j ⩾ ω 0 where ω t is system PV consumption rate at time t; ω 0 rated consumption rate. 3.3 Solution For the proposed dynamic optimization problems, because the conventional data forecast and probability distribution-based optimization algorithm can not avoid the forecast errors, at the same time, considering the continuity of load states, we adopt the DQN algorithm to overcome this problem and achieve dynamic energy management. (1) Deep Q network The main features of DQN in our proposed model are as follows. \u2022 Multi-agents, including Agent ns , Agent ts , Agent ps , and Agent es are established to correspond to non-shiftable loads, time-shiftable loads, power-shiftable loads, and energy storage loads. They can manage different types of loads in a dynamic environment; \u2022 It is model-free, and it does not rely on any forecast information or distribution knowledge; \u2022 It adapts to users\u2019 customary requirements while guaranteeing convergence and robustness. The DQN flow chart is shown in Fig. 2 [21]. The specific process can be summarized as that in time t, Agent i calculates the integrated reward R t i , j based on the dynamic environment and the current load state S t i , j . And the action A t i , j can be decided through the network. Finally, decisions A t i , j are executed by the smart meter for energy management. At the same time, Agent i updates its network and moves to the next interval t + 1 through the state transition equation shown in (2) (4) (6) (8). The key processes such as decision making and network optimization are described in the following two sections. (2) Decision making The decision-making process is Agent i decides the action A t i , j through the ε - greddy policy and decision-making network Q i . This process is expressed by (35) [30]. (35) A t + 1 i , j = Random action , P = ε arg max Q i S t i , j , A t i , j , P = 1 - ε where P = ε means the Agent has a probability of ε to take the random action; Similarly, P = ε means the Agent has a probability of 1 - ε to take action the maximum reward, 0 < ε < 1 ； Q i is the network that Agent i uses for decision making. It can be defined by the Bellman Equation as Eq. (36) [31]. (36) Q i S t i , j , A t i , j = ( 1 - β ) Q i S t i , j , A t i , j + β R i S t i , j , A t i , j + γ max Q i S t + 1 i , j , A i where Q i S t i , j , A t i , j is the output of the network under the action, state of jth load i at time t; R i S t i , j , A t i , j is the comprehensive cost under the action, state of jth load i at time t. it is also the opposite of the objective function, - f t . max Q i S t + 1 i , j , A i is the network maximum output that can be obtained by taking all possible actions in the action space Ai at the next moment t + 1; \u201c=\u201d represents the assignment process in the iteration for updating the network Qi , instead of representing the equivalence relation. β and γ are the learning factor and discount factor. It lies between 0 and 1, respectively. They characterize the update efficiency of the network. (3) Network optimization The structure of the network training optimization relationship is shown in Fig. 3 . The labeled data required for the network training process is constructed by (36). To avoid the correlation and non-stationary distribution of datasets, we construct the memory pool as well as the experience replay mechanism. Meanwhile, since the data used for training are updated in real-time, this will cause network fluctuations. For this reason, in the optimization structure, the main network is required to generate the current output. And another target network is used to generate the target value. It is used to train the main network. By replicating the main network to the target network in a fixed step, the network fluctuations are mitigated with the proposed freeze parameter mechanism. 4 Case study 4.1 Simulation parameters Dynamic optimal management is adopted for the HEMS at fifteen-minute intervals. To consider the nighttime charging/discharging continuity of electric vehicles, we take 10:00 to 10:00 of the next day as a cycle for management. And we denote it as 10:00 to 34:00 [32]. The price and energy data used to train and test this model were obtained from the PJM [33]. Specifically, the data from June 1, 2021, to June 30, 2021, were used to train the model. We set the capacity of the memory pool to 4000. The replay units are set to 500. The exploration rate is 0.1. The discount factor is 0.9. The learning factor is 0.1. The exploration factor is between 1 and 0. The target network is updated every 20 steps. And the number of exploration steps is 20,000. As for the input and output dimensions of the Agent i decision network Qi , they are determined by the state action space of each type of load. The number of neurons in the hidden layer is selected as 400, 100, and 100, respectively. And three non-shiftable loads are considered, as well as time-shiftable loads represented by washing machine dishwasher, power-shiftable loads of two air conditioners with different working hours, and a battery storage device and an electric vehicle. The proposed HEMS, represented by the above typical loads, can be extended to more loads. The parameters of are shown in Table 1 . It should be pointed out that the proposed energy management strategy is model-free. The typical scenarios such as PV, load demand, and price are unknown before the management. Through \u201cdynamic acquisition, dynamic decision\u201d mechanisms, the proposed model achieves real-time energy management. 4.2 Training process Taking Agent es as an example, the model is trained for 4000 epochs to learn the optimal energy storage load charging/discharging management at a certain time t. The evolution of the reward and cost over 4000 epochs is illustrated in Fig. 4 . It shows that under the ε - greddy policy, the action is randomly selected from the space in the first 1000 epochs. Based on the previous exploration, the Agent es is able to converge quickly and stabilize at the optimal solution around the 3800th epoch. At the same time, the energy consumption cost and carbon trading cost of the energy storage loads at the specific time t is stabilized to the lowest. 4.3 Energy management results During the above iteration, when the Agents\u2019 output reaches its maximum and stabilizes, the energy management results of the current moment can be obtained. The results for a complete cycle are shown in Fig. 5 . The yellow shading is the period when the user is at home. Fig. 5(a) shows the load operation when the HEMS is not involved in energy management. Each load is executed according to the initial setting of the user without the demand response. Loads operate at rated power in the established interval and the battery storage device does not operate. With the inclusion of the time of use price scenario, the loads are optimized by the Agent to reduce the load from the peak price and shift to a lower price through dynamic optimal management. The specific results are shown in Fig. 5(b). Specifically, time-shiftable loads are scheduled to operate during off-peak price or PV output sufficiency hours. They reduce power at a high price and increase operating power at a low price. For example, the time of use price is higher from 14:00 to 18:00, and the actual power is 60 % of the rated power. The time of use price in 26:00 ∼ 29:00 is lower, and the power-shiftable loads operate with full power at this period to meet the uses\u2019 comfort demand. Under the management of Agent es , the electric vehicle is not charging with rated power until the maximum state of charge as soon as it arrives. Through the strategy of \u201clow charging and high discharging\u201d, the electric vehicle can transfer the electricity between different price zones, so as to realize profits, like 21:00 ∼ 27:00. In 27:00 ∼ 29:00, the price does not fluctuate much. For the reason of charging loss, the Agent es chooses not to operate and keep the charge state. For battery storage devices, in addition to profiting from low charge and high discharge, it also charges during peak PV periods. This process can improve the PV consumption rate. And it can also smooth the system load and reduce load fluctuations. Fig. 6 shows the change in energy consumption cost, carbon trading cost, and satisfaction penalties before and after energy management. It can be seen that the energy consumption cost before energy management reaches 663.8￠, the carbon trading cost is 84.8￠, and the satisfaction penalties is 3257.3￠. After energy management, energy consumption cost, carbon trading cost, and satisfaction penalties are reduced by 39.6 %, 36.7 %, and 50.2 % respectively. Other indicators are shown in Table 2 . The PV consumption rate has increased significantly. This is achieved by management of energy storage. Due to frequent switching, the load fluctuation has increased, which is still within an acceptable range. Under the guidance of the time of use price as well as the ladder-type carbon price, the energy consumption cost and carbon trading cost are significantly reduced. Under energy storage management, the PV utilization during the valley is improved, and the consumption rate is significantly increased. At the same time, load fluctuations are smoothed. 4.4 Performance comparison In this section, to further verify the decision-making capability of the proposed algorithm, five different energy management cases are presented for comparison. Case 1 is our proposed DQN based dynamic optimal strategy. In case 2, we evaluate the optimization problems with dynamic programming under an ideal situation where the prices are all known in advance. In case 3, loads orderly participate HEMS. Time-shiftable loads, and power-shiftable loads are not sensitive to the price. They operate with rated power during preset hours. The electric vehicle is charging immediately with the maximum charging rate when the electric vehicle arrives home. In case 4, under the model predictive control frame, a long short-term memory network is used to provide the dynamic forecasting price over a rolling horizon of 5 h. And dynamic programming is presented to solve the optimization problems in MPC. Similarly, for case 5, support vector regression is used to forecast. The model predictive control frame and optimization model in case 5 are the same as case 4. The 20 test days are used for performance comparison. The load demand for 20 cycles is randomly generated according to Table 1. And the environmental and load data in one cycle of different cases are uniform and known. Price information is taken from June 10, 2021, to June 30, 2021. The cumulative costs of different cases over the test days are presented in Fig. 7 . We can observe that due to the absence of optimal management, case 3 has the highest daily comprehensive cost as well as the highest cumulative comprehensive cost. It is much higher than in other cases. Case 2 uses real data for global optimization. The comprehensive cost of case 2 is the lowest among all cases. It is the ideal result. Analyzing and comparing the two rolling optimization cases 4 and case 5, we are able to find that the difference mainly comes from the accuracy of the forecasting model. Our proposed strategy in case 1 is better than case 4 and case 5, second only to the ideal state. Furthermore, we do not need a forecasting model before optimization. 5 Discussion on hyperparameter The trade-off between energy consumption-carbon emissions cost and comfort varies from user to user. This is reflected in the variation of hyperparameter, like the satisfaction penalty factors α i . For this purpose, we investigate the situation of various loads with different hyperparameters. For time-shiftable loads, the distribution of the start-up time is studied with five different α ts from 0 to 1. Fig. 8 shows that the time-shiftable load does not operate when α ts < 0.01. Therefore, it is not shown in Fig. 9 . Since the α ts is set too small, the satisfaction penalty can be negligible for the energy consumption-carbon emissions cost. Therefore, the Agent ts chooses not to turn it on for cost reasons. When α ts = 1, the penalty factor is too large, causing the time-shiftable load to turn on at the beginning of the cycle. When the coefficient is between the two, the most favorable decision can be made based on the coefficient and time of use price. For example, α ts =0.2 turn-ons later than α ts = 0.5, but the price is lower. At the price shown in Fig. 8, the time-shiftable load does not turn on after 24:00, since the lowest price occurs at 24:00. Similarly, for power-shiftable loads, energy management results with different α ps are shown in Fig. 9. It can be seen that the mean power of power-shiftable load increases continuously with increasing coefficients α ps . The different coefficients suggest the implication of cost expenditure and satisfaction penalty. The different coefficients show the implication of the energy consumption-carbon emissions cost and comfort penalty. The larger the coefficient, the more user prefers the comfort of the environment. At the same time, the power is also adjusted with the time of use price under a specific factor. Agent ps will reduce the power-shiftable load power during the peak hours, and tend to increase the power during the low hours in pursuit of comfort. For example, around 15:00 and 30:00, the price is relatively at the peak. So the load is reduced. While at 27:00, the price is relatively low and the load power is increased to operate at a relatively rated power. As for the electric vehicle, the results are shown in Fig. 10 . The result of the changing power is similar to the power-shiftable loads. Large α es will lead to the situation in case 3, while too small will result in no action. In addition, electric vehicles will discharge at peak prices. By converting and storing valley-price electricity to supply the demand during peak hours. Thus, the benefits of energy storage can be realized while satisfying the demand of HEMS. For example, at 19:00, the price is relatively high, and the state of charge decreases when 2 < α es < 3, that is, the V2G phenomenon occurs. In addition, we analyze the distribution of energy consumption-carbon emissions cost and satisfaction penalties when α es changes from 2.8 to 3.3, with a step size of 0.02. The results are shown in Fig. 11 . Combined with the analysis of Fig. 10 and Fig. 11, it can be seen that when the penalty coefficient is larger, the user's satisfaction demand is higher. And the electric vehicle state of charge needs to meet the expected value as soon as possible. It leads to a higher energy consumption-carbon emissions cost. When the penalty coefficient decreases, the charging/discharging switching is gradually frequent. And the expected value of the charge state is reached later due to the existence of delayed charging (no action) or discharging, the expected state is reached later. As a result, the user satisfaction penalty increases. But the cost of user fees is significantly lower. Therefore, the different satisfaction penalty coefficients reflect the trade-offs between the user's interests for time and cost. The various coefficients available to users are important to meet their different demand preferences. 5.1 Robustness assessment In order to consider the performance of HEMS under uncertain environmental scenarios and different user needs, this paper evaluates the generalization ability and robustness of the model from the load level and the individual level. In the load layer, in this paper, under the random electricity price scenario for 5 consecutive days, the energy management is carried out on the load charging and discharging of electric vehicles with different discharge depths and differentiated travel demands. The results are shown in Fig. 12 . In Fig. 12(a), the curve shows the time of use price for five consecutive days from June 4, 2021, to June 8, 2021. The period when electric vehicle stays at home is illustrated with grey shading. The electric vehicle is mainly managed during this period. The real-time power of the electric vehicle is represented by the yellow bar. It shows a high correlation between charging/discharging power and time of use price trends. One can observe that the Agent es choose to charge when the electricity price is on the valley and to discharge when the price is at the peak. In particular, the Agent es choice not to manage electric vehicles for charging/discharging at certain times when the price does not fluctuate much. This does not mean that it is insensitive to electricity prices. On the contrary, Agent es choose to maintain the state accordingly. Because the penalties and costs associated with the action are sometimes too high compared with the profit, like the time during the midway of the third management cycle, and the end of the fourth. The daily state of charge of an electric vehicle and energy consumption-carbon trading union cost are presented in Fig. 12(b). After energy management, the state of charge is close to the upper limit when it leaves home. This indicates that the electric vehicle is well charged. And the charging/discharging results meet the basic travel needs of the user. At the individual level, the robustness is verified by four users with different satisfaction penalty coefficients based on their individual behavioral habits and demand. 500 scenarios are sampled from the 70,000 scenarios formed according to Table 1. The cost distribution of each user under 500 scenarios for different users is shown in Fig. 13 . For different users, the comprehensive cost distribution under each scenario distribution is stable within a certain range. It indicates that the method is relatively stable in decision results for different environmental scenarios and random initial conditions. Therefore, it has good robustness without deviating or crashing in the training and optimization process. 6 Conclusions This paper proposed a model-free dynamic optimal strategy for low-carbon HEMS. As there is no demand for any forecast information or distribution knowledge of HEMS, the proposed dynamic strategy is model-free. Eventually, the dynamic optimal management strategy is solved by the DQN algorithm with the aim of minimizing the energy consumption cost, carbon trading cost, and user satisfaction penalties. Simulation results show that: 1) The model takes into account the energy economy, low-carbon operation, and user satisfaction of the HEMS. Compared with the day-ahead forecasting-based management model, the proposed strategy is more feasible. Based on the basic needs of users, it can ensure the low-carbon economic operation of the system. 2) The management strategy can be dynamically optimized and adaptive to stochastic environments. At the same time, through the adjustment of parameters, the model can provide users with a variety of feasible energy management strategies with different preferences for users to choose from, which is of great significance to meet the respective scheduling needs of different users. 3) The proposed energy management strategy does not depend on the probability distribution and prediction information of the system data. It has good performance in convergence ability and stability under the non-prediction mechanism, and the model has certain robustness. It should be pointed out that this study only addresses the interaction between the demand-side and the power system from the perspective of individual users. It has not yet considered the user groups and their impact on the power system. Therefore, further studies will focus on the joint dispatch from the perspective of aggregators or microgrids. Declaration of Competing Interest The authors declare that they have no known competing financial interests or personal relationships that could have appeared to influence the work reported in this paper. Acknowledgment This work was supported in part by the National Natural Science Foundation of China under Grant 52177110, as well as the Shenzhen Science and Technology Program under Grant JCYJ20210324131409026. And also in part by State Grid Hubei Electric Power Co., Ltd. 2022 Science and Technology Projects 521538220005. References [1] P. Lai L. Duan X. Lin Learning large electrical loads via flexible contracts with commitment IEEE Trans. Network Sci. Eng. 8 2 2021 1925 1940 P. Lai, L. Duan, and X. Lin, \u201cLearning Large Electrical Loads via Flexible Contracts With Commitment,\u201d IEEE Transactions on Network Science and Engineering, vol. 8, no. 2, pp. 1925-1940, 2021. [2] H. Yin A blockchain-based storage system with financial incentives for load-balancing IEEE Trans. Network Sci. Eng. 8 2 2021 1178 1188 H. Yin, \u201cA Blockchain-Based Storage System with Financial Incentives for Load-balancing,\u201d IEEE Transactions on Network Science and Engineering, vol. 8, no. 2, pp. 1178-1188, 2021. [3] P. Han, Decreasing emissions and increasing sink capacity to support China in achieving carbon neutrality before 2060, arXiv e-prints, p. arXiv:2102.10871, 2021. [4] Y. Wang J. Qiu Y. Tao Carbon-oriented operational planning in coupled electricity and emission trading markets IEEE Trans. Power Syst. 35 4 2020 3145 3157 Y. Wang, J. Qiu, Y. Tao, et al., \u201cCarbon-Oriented Operational Planning in Coupled Electricity and Emission Trading Markets,\u201d IEEE Transactions on Power Systems, vol. 35, no. 4, pp. 3145-3157, 2020. [5] J. Jin X. Zhang L. Xu Impacts of carbon trading and wind power integration on carbon emission in the power dispatching process Energy Rep. 7 2021 3887 3897 J. Jin, X. Zhang, L. Xu, et al., \u201cImpacts of Carbon Trading and Wind Power Integration on Carbon Emission in the Power Dispatching Process,\u201d Energy Reports, vol. 7, pp. 3887-3897, 2021/11/01/ 2021. [6] D.J. Olsen Y. Dvorkin R. Fernández-Blanco Optimal carbon taxes for emissions targets in the electricity sector IEEE Trans. Power Syst. 33 6 2018 5892 5901 D. J. Olsen, Y. Dvorkin, R. Fernández-Blanco, et al., \u201cOptimal Carbon Taxes for Emissions Targets in the Electricity Sector,\u201d IEEE Transactions on Power Systems, vol. 33, no. 6, pp. 5892-5901, 2018. [7] B. Nour, S. Cherkaoui, Z. Mlika, Federated learning and proactive computation reuse at the edge of smart homes, IEEE Trans. Network Sci. Eng., pp. 1-1, 2021. [8] Z. Chen L. Wu Y. Fu Real-time price-based demand response management for residential appliances via stochastic optimization and robust optimization IEEE Trans. Smart Grid 3 4 2012 1822 1831 Z. Chen, L. Wu, and Y. Fu, \u201cReal-Time Price-Based Demand Response Management for Residential Appliances via Stochastic Optimization and Robust Optimization,\u201d IEEE Transactions on Smart Grid, vol. 3, no. 4, pp. 1822-1831, 2012. [9] H. Gong V. Rallabandi D.M. Ionel Dynamic modeling and optimal design for net zero energy houses including hybrid electric and thermal energy storage IEEE Trans. Ind. Appl. 56 4 2020 4102 4113 H. Gong, V. Rallabandi, D. M. Ionel, et al., \u201cDynamic Modeling and Optimal Design for Net Zero Energy Houses Including Hybrid Electric and Thermal Energy Storage,\u201d IEEE Transactions on Industry Applications, vol. 56, no. 4, pp. 4102-4113, 2020. [10] J. Sachs O. Sawodny A two-stage model predictive control strategy for economic diesel-PV-battery island microgrid operation in rural areas IEEE Trans. Sustainable Energy 7 3 2016 903 913 J. Sachs and O. Sawodny, \u201cA Two-Stage Model Predictive Control Strategy for Economic Diesel-PV-Battery Island Microgrid Operation in Rural Areas,\u201d IEEE Transactions on Sustainable Energy, vol. 7, no. 3, pp. 903-913, 2016. [11] R.E. Hedegaard M.H. Kristensen T.H. Pedersen Bottom-up modelling methodology for urban-scale analysis of residential space heating demand response Appl. Energy 242 2019 181 204 R. E. Hedegaard, M. H. Kristensen, T. H. Pedersen, et al., \u201cBottom-up Modelling Methodology for Urban-scale Analysis of Residential Space Heating Demand Response,\u201d Applied Energy, vol. 242, pp. 181-204, May 15 2019. [12] Q. Zhang, Graph neural networks-driven traffic forecasting for connected internet of vehicles, IEEE Trans. Network Sci. Eng., pp. 1-1, 2021. [13] C. Keerthisinghe A.C. Chapman G. Verbič Energy management of PV-storage systems: policy approximations using machine learning IEEE Trans. Ind. Inf. 15 1 2019 257 265 C. Keerthisinghe, A. C. Chapman, and G. Verbič, \u201cEnergy Management of PV-Storage Systems: Policy Approximations Using Machine Learning,\u201d IEEE Transactions on Industrial Informatics, vol. 15, no. 1, pp. 257-265, 2019. [14] L. Bhamidi S. Sivasubramani Optimal sizing of smart home renewable energy resources and battery under prosumer-based energy management IEEE Syst. J. 15 1 2021 105 113 L. Bhamidi and S. Sivasubramani, \u201cOptimal Sizing of Smart Home Renewable Energy Resources and Battery Under Prosumer-Based Energy Management,\u201d IEEE Systems Journal, vol. 15, no. 1, pp. 105-113, 2021. [15] X. Yang S. Ren Y. Zhang Schedulable ability model and priority-based intraday scheduling strategy for electric vehicle Autom. Electric Power Syst. 41 02 2017 84 93 X. Yang, S. Ren, Y. Zhang, et al., \u201cSchedulable Ability Model and Priority-based Intraday Scheduling Strategy for Electric Vehicle,\u201d Automation of Electric Power Systems, vol. 41, no. 02, pp. 84-93, 2017. [16] J. Su T.T. Lie R. Zamora A Rolling horizon scheduling of aggregated electric vehicles charging under the electricity exchange market Appl. Energy 275 2020 115406 J. Su, T. T. Lie, and R. Zamora, \u201cA Rolling Horizon Scheduling of Aggregated Electric Vehicles Charging Under the Electricity Exchange Market,\u201d Applied Energy, vol. 275, p. 115406, 2020. [17] S. Yang, J. Liu, J. Yao, et al., Model and strategy for multi-time scale coordinated flexible load interactive scheduling, Proc. CSEE, 34(22) (2014) 3664-3673. [18] V. Mnih Human-level control through deep reinforcement learning Nature 518 7540 2015 529 533 V. Mnih., \u201cHuman-level Control Through Deep Reinforcement Learning,\u201d Nature, vol. 518, no. 7540, pp. 529-533, 2015. [19] T. Li, Y. Xiao, L. Song, Deep reinforcement learning based residential demand side management with edge computing, in: 2019 IEEE International Conference on Communications, Control, and Computing Technologies for Smart Grids (SmartGridComm), Beijing, China, 21-23 Oct. 2019, pp. 1-6. [20] C. Tai, J. Hong, L. Fu, A real-time demand-side management system considering user behavior using deep Q-learning in home area network, in: 2019 IEEE International Conference on Systems, Man and Cybernetics (SMC), Bari, Italy, 6-9 Oct. 2019, pp. 4050-4055. [21] X. Xu Y. Jia Y. Xu A multi-agent reinforcement learning-based data-driven method for home energy management IEEE Trans. Smart Grid 11 4 2020 3201 3211 X. Xu, Y. Jia, Y. Xu, et al., \u201cA Multi-Agent Reinforcement Learning-Based Data-Driven Method for Home Energy Management,\u201d IEEE Transactions on Smart Grid, vol. 11, no. 4, pp. 3201-3211, 2020. [22] Z. Wan H. Li H. He Model-free real-time EV charging scheduling based on deep reinforcement learning IEEE Trans. Smart Grid 10 5 2019 5246 5257 Z. Wan, H. Li, H. He, et al., \u201cModel-Free Real-Time EV Charging Scheduling Based on Deep Reinforcement Learning,\u201d IEEE Transactions on Smart Grid, vol. 10, no. 5, pp. 5246-5257, 2019. [23] S. Zhou Z. Hu W. Gu Artificial intelligence based smart energy community management: A reinforcement learning approach CSEE J. Power Energy Syst 5 1 2019 1 10 S. Zhou, Z. Hu, W. Gu, et al., \u201cArtificial Intelligence Based Smart Energy Community Management: A Reinforcement Learning Approach,\u201d CSEE Journal of Power and Energy Systems, vol. 5, no. 1, pp. 1-10, 2019. [24] J. Chen X. Wang J. Zeng Energy management and optimization of multi-energy grid based on deep reinforcement learning Power Syst. Technol. 44 10 2020 3794 3803 J. Chen, X. Wang, J. Zeng, et al., \u201cEnergy Management and Optimization of Multi-Energy Grid Based on Deep Reinforcement Learning,\u201d Power System Technology, vol. 44, no. 10, pp. 3794-3803, 2020. [25] B. Jeddi Y. Mishra G. Ledwich Differential dynamic programming based home energy management scheduler IEEE Trans. Sustainable Energy 11 3 2020 1427 1437 B. Jeddi, Y. Mishra, and G. Ledwich, \u201cDifferential Dynamic Programming Based Home Energy Management Scheduler,\u201d IEEE Transactions on Sustainable Energy, vol. 11, no. 3, pp. 1427-1437, 2020. [26] Y. Li Z. Tang Z. Lin Reinforcement learning power control algorithm based on graph signal processing for ultra-dense mobile networks IEEE Trans. Network Sci. Eng. 8 3 2021 2694 2705 Y. Li, Z. Tang, Z. Lin, et al., \u201cReinforcement Learning Power Control Algorithm Based on Graph Signal Processing for Ultra-Dense Mobile Networks,\u201d IEEE Transactions on Network Science and Engineering, vol. 8, no. 3, pp. 2694-2705, 2021. [30] C. Lork An uncertainty-aware deep reinforcement learning framework for residential air conditioning energy management Appl. Energy 276 2020 C. Lork, \u201cAn uncertainty-aware deep reinforcement learning framework for residential air conditioning energy management,\u201d Applied Energy, vol. 276, 2020. [31] R. Lu S.H. Hong M. Yu Demand response for home energy management using reinforcement learning and artificial neural network IEEE Trans. Smart Grid 10 6 2019 6629 6639 R. Lu, S. H. Hong, and M. Yu, \u201cDemand Response for Home Energy Management Using Reinforcement Learning and Artificial Neural Network,\u201d IEEE Transactions on Smart Grid, vol. 10, no. 6, pp. 6629-6639, 2019. [32] B. Guo. Optimal energy management of a residential local energy network based on model predictive control. Proc. CSEE, 35(14): 3656-3666, 2015. [33] PJM. (2021). Data Miner 2. Accessed: Jun. 2021. [Online]. Available: http://dataminer2.pjm.com/list. Further reading [27] C. Kang Carbon emission flow from generation to demand: a network-based model IEEE Trans. Smart Grid 6 5 2015 2386 2394 C. Kang, \u201cCarbon Emission Flow from Generation to Demand: A Network-Based Model,\u201d IEEE Transactions on Smart Grid, vol. 6, no. 5, pp. 2386-2394, 2015. [28] X. Chen B. Lin Towards carbon neutrality by implementing carbon emissions trading scheme: policy evaluation in China Energy Policy 157 2021 112510 X. Chen and B. Lin, \u201cTowards Carbon Neutrality by Implementing Carbon Emissions Trading Scheme: Policy Evaluation in China,\u201d Energy Policy, vol. 157, pp. 112510, 2021. [29] H. Hou, Y. Chen, P. Liu, et al., Multisource energy storage system optimal dispatch among electricity hydrogen and heat networks from the energy storage operator prospect, IEEE Trans. Ind. Appl., pp. 1-1, 2021.",
    "scopus-id": "85141509038",
    "coredata": {
        "eid": "1-s2.0-S0378778822007654",
        "dc:description": "This paper presents a model-free dynamic optimal management strategy for a low-carbon home energy management system (HEMS) based on deep reinforcement learning (DRL). The method can ideally handle the uncertainties and dynamics of renewable energy and demand-side load. Firstly, the load model is established by a deep Q network (DQN) algorithm with the advantage of ignoring traditional forecasting steps on stochastic environments such as renewable energy generation, load demand, price, etc. Then multi-agents are established for dynamic management based on the DRL. Through \u201cdynamic acquisition, dynamic decision\u201d mechanism, the proposed model-free strategy achieves real-time energy management that can adaptively respond to stochastic environments. Secondly, considering the constraints of system carbon emissions and carbon trading, the proposed strategy can minimize the energy consumption cost, carbon trading cost, and user satisfaction penalties. Ultimately, the effectiveness of the proposed strategy is verified through case studies. Experimental results demonstrate that the strategy can significantly reduce the overall cost, including a 36.7% reduction in carbon trading. At the same time, user satisfaction penalties are reduced by 50.2%. Further, the agent hyperparameter could also be adjusted to capture the trade-off between cost savings and satisfaction penalties. And compared with the traditional forecast-based management strategy, it overcomes the problem of uncertainties and avoids forecasting errors to better accommodate the stochastic environment.",
        "openArchiveArticle": "false",
        "prism:coverDate": "2023-01-01",
        "openaccessUserLicense": null,
        "prism:aggregationType": "Journal",
        "prism:url": "https://api.elsevier.com/content/article/pii/S0378778822007654",
        "dc:creator": [
            {
                "@_fa": "true",
                "$": "Hou, Hui"
            },
            {
                "@_fa": "true",
                "$": "Ge, Xiangdi"
            },
            {
                "@_fa": "true",
                "$": "Chen, Yue"
            },
            {
                "@_fa": "true",
                "$": "Tang, Jinrui"
            },
            {
                "@_fa": "true",
                "$": "Hou, Tingting"
            },
            {
                "@_fa": "true",
                "$": "Fang, Rengcun"
            }
        ],
        "link": [
            {
                "@_fa": "true",
                "@rel": "self",
                "@href": "https://api.elsevier.com/content/article/pii/S0378778822007654"
            },
            {
                "@_fa": "true",
                "@rel": "scidir",
                "@href": "https://www.sciencedirect.com/science/article/pii/S0378778822007654"
            }
        ],
        "dc:format": "application/json",
        "openaccessType": null,
        "pii": "S0378-7788(22)00765-4",
        "prism:volume": "278",
        "articleNumber": "112594",
        "prism:publisher": "Elsevier B.V.",
        "dc:title": "Model-free dynamic management strategy for low-carbon home energy based on deep reinforcement learning accommodating stochastic environments",
        "prism:copyright": "© 2022 Elsevier B.V. All rights reserved.",
        "openaccess": "0",
        "prism:issn": "03787788",
        "dcterms:subject": [
            {
                "@_fa": "true",
                "$": "Home energy management system"
            },
            {
                "@_fa": "true",
                "$": "Dynamic optimal management"
            },
            {
                "@_fa": "true",
                "$": "Deep reinforcement learning"
            },
            {
                "@_fa": "true",
                "$": "Low-carbon"
            },
            {
                "@_fa": "true",
                "$": "Model-free"
            }
        ],
        "openaccessArticle": "false",
        "prism:publicationName": "Energy and Buildings",
        "openaccessSponsorType": null,
        "prism:pageRange": "112594",
        "pubType": "fla",
        "prism:coverDisplayDate": "1 January 2023",
        "prism:doi": "10.1016/j.enbuild.2022.112594",
        "prism:startingPage": "112594",
        "dc:identifier": "doi:10.1016/j.enbuild.2022.112594",
        "openaccessSponsorName": null
    },
    "objects": {"object": [
        {
            "@category": "standard",
            "@height": "512",
            "@width": "689",
            "@_fa": "true",
            "$": "https://api.elsevier.com/content/object/eid/1-s2.0-S0378778822007654-gr3.jpg?httpAccept=%2A%2F%2A",
            "@multimediatype": "JPEG image file",
            "@type": "IMAGE-DOWNSAMPLED",
            "@size": "102650",
            "@ref": "gr3",
            "@mimetype": "image/jpeg"
        },
        {
            "@category": "standard",
            "@height": "179",
            "@width": "378",
            "@_fa": "true",
            "$": "https://api.elsevier.com/content/object/eid/1-s2.0-S0378778822007654-gr10.jpg?httpAccept=%2A%2F%2A",
            "@multimediatype": "JPEG image file",
            "@type": "IMAGE-DOWNSAMPLED",
            "@size": "20655",
            "@ref": "gr10",
            "@mimetype": "image/jpeg"
        },
        {
            "@category": "standard",
            "@height": "168",
            "@width": "378",
            "@_fa": "true",
            "$": "https://api.elsevier.com/content/object/eid/1-s2.0-S0378778822007654-gr11.jpg?httpAccept=%2A%2F%2A",
            "@multimediatype": "JPEG image file",
            "@type": "IMAGE-DOWNSAMPLED",
            "@size": "17096",
            "@ref": "gr11",
            "@mimetype": "image/jpeg"
        },
        {
            "@category": "standard",
            "@height": "179",
            "@width": "340",
            "@_fa": "true",
            "$": "https://api.elsevier.com/content/object/eid/1-s2.0-S0378778822007654-gr12.jpg?httpAccept=%2A%2F%2A",
            "@multimediatype": "JPEG image file",
            "@type": "IMAGE-DOWNSAMPLED",
            "@size": "25061",
            "@ref": "gr12",
            "@mimetype": "image/jpeg"
        },
        {
            "@category": "standard",
            "@height": "210",
            "@width": "378",
            "@_fa": "true",
            "$": "https://api.elsevier.com/content/object/eid/1-s2.0-S0378778822007654-gr13.jpg?httpAccept=%2A%2F%2A",
            "@multimediatype": "JPEG image file",
            "@type": "IMAGE-DOWNSAMPLED",
            "@size": "35621",
            "@ref": "gr13",
            "@mimetype": "image/jpeg"
        },
        {
            "@category": "standard",
            "@height": "315",
            "@width": "224",
            "@_fa": "true",
            "$": "https://api.elsevier.com/content/object/eid/1-s2.0-S0378778822007654-gr2.jpg?httpAccept=%2A%2F%2A",
            "@multimediatype": "JPEG image file",
            "@type": "IMAGE-DOWNSAMPLED",
            "@size": "25196",
            "@ref": "gr2",
            "@mimetype": "image/jpeg"
        },
        {
            "@category": "standard",
            "@height": "171",
            "@width": "378",
            "@_fa": "true",
            "$": "https://api.elsevier.com/content/object/eid/1-s2.0-S0378778822007654-gr4.jpg?httpAccept=%2A%2F%2A",
            "@multimediatype": "JPEG image file",
            "@type": "IMAGE-DOWNSAMPLED",
            "@size": "20308",
            "@ref": "gr4",
            "@mimetype": "image/jpeg"
        },
        {
            "@category": "standard",
            "@height": "176",
            "@width": "708",
            "@_fa": "true",
            "$": "https://api.elsevier.com/content/object/eid/1-s2.0-S0378778822007654-gr5.jpg?httpAccept=%2A%2F%2A",
            "@multimediatype": "JPEG image file",
            "@type": "IMAGE-DOWNSAMPLED",
            "@size": "40975",
            "@ref": "gr5",
            "@mimetype": "image/jpeg"
        },
        {
            "@category": "standard",
            "@height": "168",
            "@width": "378",
            "@_fa": "true",
            "$": "https://api.elsevier.com/content/object/eid/1-s2.0-S0378778822007654-gr6.jpg?httpAccept=%2A%2F%2A",
            "@multimediatype": "JPEG image file",
            "@type": "IMAGE-DOWNSAMPLED",
            "@size": "21348",
            "@ref": "gr6",
            "@mimetype": "image/jpeg"
        },
        {
            "@category": "standard",
            "@height": "180",
            "@width": "378",
            "@_fa": "true",
            "$": "https://api.elsevier.com/content/object/eid/1-s2.0-S0378778822007654-gr7.jpg?httpAccept=%2A%2F%2A",
            "@multimediatype": "JPEG image file",
            "@type": "IMAGE-DOWNSAMPLED",
            "@size": "21984",
            "@ref": "gr7",
            "@mimetype": "image/jpeg"
        },
        {
            "@category": "standard",
            "@height": "174",
            "@width": "378",
            "@_fa": "true",
            "$": "https://api.elsevier.com/content/object/eid/1-s2.0-S0378778822007654-gr8.jpg?httpAccept=%2A%2F%2A",
            "@multimediatype": "JPEG image file",
            "@type": "IMAGE-DOWNSAMPLED",
            "@size": "23036",
            "@ref": "gr8",
            "@mimetype": "image/jpeg"
        },
        {
            "@category": "standard",
            "@height": "185",
            "@width": "378",
            "@_fa": "true",
            "$": "https://api.elsevier.com/content/object/eid/1-s2.0-S0378778822007654-gr9.jpg?httpAccept=%2A%2F%2A",
            "@multimediatype": "JPEG image file",
            "@type": "IMAGE-DOWNSAMPLED",
            "@size": "26812",
            "@ref": "gr9",
            "@mimetype": "image/jpeg"
        },
        {
            "@category": "standard",
            "@height": "309",
            "@width": "378",
            "@_fa": "true",
            "$": "https://api.elsevier.com/content/object/eid/1-s2.0-S0378778822007654-gr1.jpg?httpAccept=%2A%2F%2A",
            "@multimediatype": "JPEG image file",
            "@type": "IMAGE-DOWNSAMPLED",
            "@size": "47608",
            "@ref": "gr1",
            "@mimetype": "image/jpeg"
        },
        {
            "@category": "thumbnail",
            "@height": "163",
            "@width": "219",
            "@_fa": "true",
            "$": "https://api.elsevier.com/content/object/eid/1-s2.0-S0378778822007654-gr3.sml?httpAccept=%2A%2F%2A",
            "@multimediatype": "GIF image file",
            "@type": "IMAGE-THUMBNAIL",
            "@size": "14074",
            "@ref": "gr3",
            "@mimetype": "image/gif"
        },
        {
            "@category": "thumbnail",
            "@height": "104",
            "@width": "219",
            "@_fa": "true",
            "$": "https://api.elsevier.com/content/object/eid/1-s2.0-S0378778822007654-gr10.sml?httpAccept=%2A%2F%2A",
            "@multimediatype": "GIF image file",
            "@type": "IMAGE-THUMBNAIL",
            "@size": "7083",
            "@ref": "gr10",
            "@mimetype": "image/gif"
        },
        {
            "@category": "thumbnail",
            "@height": "97",
            "@width": "219",
            "@_fa": "true",
            "$": "https://api.elsevier.com/content/object/eid/1-s2.0-S0378778822007654-gr11.sml?httpAccept=%2A%2F%2A",
            "@multimediatype": "GIF image file",
            "@type": "IMAGE-THUMBNAIL",
            "@size": "5554",
            "@ref": "gr11",
            "@mimetype": "image/gif"
        },
        {
            "@category": "thumbnail",
            "@height": "116",
            "@width": "219",
            "@_fa": "true",
            "$": "https://api.elsevier.com/content/object/eid/1-s2.0-S0378778822007654-gr12.sml?httpAccept=%2A%2F%2A",
            "@multimediatype": "GIF image file",
            "@type": "IMAGE-THUMBNAIL",
            "@size": "11708",
            "@ref": "gr12",
            "@mimetype": "image/gif"
        },
        {
            "@category": "thumbnail",
            "@height": "122",
            "@width": "219",
            "@_fa": "true",
            "$": "https://api.elsevier.com/content/object/eid/1-s2.0-S0378778822007654-gr13.sml?httpAccept=%2A%2F%2A",
            "@multimediatype": "GIF image file",
            "@type": "IMAGE-THUMBNAIL",
            "@size": "12615",
            "@ref": "gr13",
            "@mimetype": "image/gif"
        },
        {
            "@category": "thumbnail",
            "@height": "163",
            "@width": "116",
            "@_fa": "true",
            "$": "https://api.elsevier.com/content/object/eid/1-s2.0-S0378778822007654-gr2.sml?httpAccept=%2A%2F%2A",
            "@multimediatype": "GIF image file",
            "@type": "IMAGE-THUMBNAIL",
            "@size": "6992",
            "@ref": "gr2",
            "@mimetype": "image/gif"
        },
        {
            "@category": "thumbnail",
            "@height": "99",
            "@width": "219",
            "@_fa": "true",
            "$": "https://api.elsevier.com/content/object/eid/1-s2.0-S0378778822007654-gr4.sml?httpAccept=%2A%2F%2A",
            "@multimediatype": "GIF image file",
            "@type": "IMAGE-THUMBNAIL",
            "@size": "8362",
            "@ref": "gr4",
            "@mimetype": "image/gif"
        },
        {
            "@category": "thumbnail",
            "@height": "54",
            "@width": "219",
            "@_fa": "true",
            "$": "https://api.elsevier.com/content/object/eid/1-s2.0-S0378778822007654-gr5.sml?httpAccept=%2A%2F%2A",
            "@multimediatype": "GIF image file",
            "@type": "IMAGE-THUMBNAIL",
            "@size": "6384",
            "@ref": "gr5",
            "@mimetype": "image/gif"
        },
        {
            "@category": "thumbnail",
            "@height": "98",
            "@width": "219",
            "@_fa": "true",
            "$": "https://api.elsevier.com/content/object/eid/1-s2.0-S0378778822007654-gr6.sml?httpAccept=%2A%2F%2A",
            "@multimediatype": "GIF image file",
            "@type": "IMAGE-THUMBNAIL",
            "@size": "7369",
            "@ref": "gr6",
            "@mimetype": "image/gif"
        },
        {
            "@category": "thumbnail",
            "@height": "104",
            "@width": "219",
            "@_fa": "true",
            "$": "https://api.elsevier.com/content/object/eid/1-s2.0-S0378778822007654-gr7.sml?httpAccept=%2A%2F%2A",
            "@multimediatype": "GIF image file",
            "@type": "IMAGE-THUMBNAIL",
            "@size": "8235",
            "@ref": "gr7",
            "@mimetype": "image/gif"
        },
        {
            "@category": "thumbnail",
            "@height": "101",
            "@width": "219",
            "@_fa": "true",
            "$": "https://api.elsevier.com/content/object/eid/1-s2.0-S0378778822007654-gr8.sml?httpAccept=%2A%2F%2A",
            "@multimediatype": "GIF image file",
            "@type": "IMAGE-THUMBNAIL",
            "@size": "8734",
            "@ref": "gr8",
            "@mimetype": "image/gif"
        },
        {
            "@category": "thumbnail",
            "@height": "107",
            "@width": "219",
            "@_fa": "true",
            "$": "https://api.elsevier.com/content/object/eid/1-s2.0-S0378778822007654-gr9.sml?httpAccept=%2A%2F%2A",
            "@multimediatype": "GIF image file",
            "@type": "IMAGE-THUMBNAIL",
            "@size": "8530",
            "@ref": "gr9",
            "@mimetype": "image/gif"
        },
        {
            "@category": "thumbnail",
            "@height": "164",
            "@width": "201",
            "@_fa": "true",
            "$": "https://api.elsevier.com/content/object/eid/1-s2.0-S0378778822007654-gr1.sml?httpAccept=%2A%2F%2A",
            "@multimediatype": "GIF image file",
            "@type": "IMAGE-THUMBNAIL",
            "@size": "13626",
            "@ref": "gr1",
            "@mimetype": "image/gif"
        },
        {
            "@category": "high",
            "@height": "2268",
            "@width": "3051",
            "@_fa": "true",
            "$": "https://api.elsevier.com/content/object/eid/1-s2.0-S0378778822007654-gr3_lrg.jpg?httpAccept=%2A%2F%2A",
            "@multimediatype": "JPEG image file",
            "@type": "IMAGE-HIGH-RES",
            "@size": "679262",
            "@ref": "gr3",
            "@mimetype": "image/jpeg"
        },
        {
            "@category": "high",
            "@height": "791",
            "@width": "1673",
            "@_fa": "true",
            "$": "https://api.elsevier.com/content/object/eid/1-s2.0-S0378778822007654-gr10_lrg.jpg?httpAccept=%2A%2F%2A",
            "@multimediatype": "JPEG image file",
            "@type": "IMAGE-HIGH-RES",
            "@size": "149648",
            "@ref": "gr10",
            "@mimetype": "image/jpeg"
        },
        {
            "@category": "high",
            "@height": "744",
            "@width": "1673",
            "@_fa": "true",
            "$": "https://api.elsevier.com/content/object/eid/1-s2.0-S0378778822007654-gr11_lrg.jpg?httpAccept=%2A%2F%2A",
            "@multimediatype": "JPEG image file",
            "@type": "IMAGE-HIGH-RES",
            "@size": "131268",
            "@ref": "gr11",
            "@mimetype": "image/jpeg"
        },
        {
            "@category": "high",
            "@height": "795",
            "@width": "1506",
            "@_fa": "true",
            "$": "https://api.elsevier.com/content/object/eid/1-s2.0-S0378778822007654-gr12_lrg.jpg?httpAccept=%2A%2F%2A",
            "@multimediatype": "JPEG image file",
            "@type": "IMAGE-HIGH-RES",
            "@size": "197735",
            "@ref": "gr12",
            "@mimetype": "image/jpeg"
        },
        {
            "@category": "high",
            "@height": "929",
            "@width": "1673",
            "@_fa": "true",
            "$": "https://api.elsevier.com/content/object/eid/1-s2.0-S0378778822007654-gr13_lrg.jpg?httpAccept=%2A%2F%2A",
            "@multimediatype": "JPEG image file",
            "@type": "IMAGE-HIGH-RES",
            "@size": "334278",
            "@ref": "gr13",
            "@mimetype": "image/jpeg"
        },
        {
            "@category": "high",
            "@height": "1399",
            "@width": "995",
            "@_fa": "true",
            "$": "https://api.elsevier.com/content/object/eid/1-s2.0-S0378778822007654-gr2_lrg.jpg?httpAccept=%2A%2F%2A",
            "@multimediatype": "JPEG image file",
            "@type": "IMAGE-HIGH-RES",
            "@size": "217709",
            "@ref": "gr2",
            "@mimetype": "image/jpeg"
        },
        {
            "@category": "high",
            "@height": "756",
            "@width": "1673",
            "@_fa": "true",
            "$": "https://api.elsevier.com/content/object/eid/1-s2.0-S0378778822007654-gr4_lrg.jpg?httpAccept=%2A%2F%2A",
            "@multimediatype": "JPEG image file",
            "@type": "IMAGE-HIGH-RES",
            "@size": "158425",
            "@ref": "gr4",
            "@mimetype": "image/jpeg"
        },
        {
            "@category": "high",
            "@height": "779",
            "@width": "3133",
            "@_fa": "true",
            "$": "https://api.elsevier.com/content/object/eid/1-s2.0-S0378778822007654-gr5_lrg.jpg?httpAccept=%2A%2F%2A",
            "@multimediatype": "JPEG image file",
            "@type": "IMAGE-HIGH-RES",
            "@size": "357817",
            "@ref": "gr5",
            "@mimetype": "image/jpeg"
        },
        {
            "@category": "high",
            "@height": "745",
            "@width": "1673",
            "@_fa": "true",
            "$": "https://api.elsevier.com/content/object/eid/1-s2.0-S0378778822007654-gr6_lrg.jpg?httpAccept=%2A%2F%2A",
            "@multimediatype": "JPEG image file",
            "@type": "IMAGE-HIGH-RES",
            "@size": "185042",
            "@ref": "gr6",
            "@mimetype": "image/jpeg"
        },
        {
            "@category": "high",
            "@height": "795",
            "@width": "1673",
            "@_fa": "true",
            "$": "https://api.elsevier.com/content/object/eid/1-s2.0-S0378778822007654-gr7_lrg.jpg?httpAccept=%2A%2F%2A",
            "@multimediatype": "JPEG image file",
            "@type": "IMAGE-HIGH-RES",
            "@size": "182449",
            "@ref": "gr7",
            "@mimetype": "image/jpeg"
        },
        {
            "@category": "high",
            "@height": "770",
            "@width": "1673",
            "@_fa": "true",
            "$": "https://api.elsevier.com/content/object/eid/1-s2.0-S0378778822007654-gr8_lrg.jpg?httpAccept=%2A%2F%2A",
            "@multimediatype": "JPEG image file",
            "@type": "IMAGE-HIGH-RES",
            "@size": "224937",
            "@ref": "gr8",
            "@mimetype": "image/jpeg"
        },
        {
            "@category": "high",
            "@height": "819",
            "@width": "1673",
            "@_fa": "true",
            "$": "https://api.elsevier.com/content/object/eid/1-s2.0-S0378778822007654-gr9_lrg.jpg?httpAccept=%2A%2F%2A",
            "@multimediatype": "JPEG image file",
            "@type": "IMAGE-HIGH-RES",
            "@size": "185139",
            "@ref": "gr9",
            "@mimetype": "image/jpeg"
        },
        {
            "@category": "high",
            "@height": "1366",
            "@width": "1673",
            "@_fa": "true",
            "$": "https://api.elsevier.com/content/object/eid/1-s2.0-S0378778822007654-gr1_lrg.jpg?httpAccept=%2A%2F%2A",
            "@multimediatype": "JPEG image file",
            "@type": "IMAGE-HIGH-RES",
            "@size": "332262",
            "@ref": "gr1",
            "@mimetype": "image/jpeg"
        },
        {
            "@category": "thumbnail",
            "@_fa": "true",
            "$": "https://api.elsevier.com/content/object/eid/1-s2.0-S0378778822007654-si1.svg?httpAccept=%2A%2F%2A",
            "@multimediatype": "Scalable Vector Graphics file",
            "@type": "ALTIMG",
            "@size": "8499",
            "@ref": "si1",
            "@mimetype": "image/svg+xml"
        },
        {
            "@category": "thumbnail",
            "@_fa": "true",
            "$": "https://api.elsevier.com/content/object/eid/1-s2.0-S0378778822007654-si10.svg?httpAccept=%2A%2F%2A",
            "@multimediatype": "Scalable Vector Graphics file",
            "@type": "ALTIMG",
            "@size": "4345",
            "@ref": "si10",
            "@mimetype": "image/svg+xml"
        },
        {
            "@category": "thumbnail",
            "@_fa": "true",
            "$": "https://api.elsevier.com/content/object/eid/1-s2.0-S0378778822007654-si100.svg?httpAccept=%2A%2F%2A",
            "@multimediatype": "Scalable Vector Graphics file",
            "@type": "ALTIMG",
            "@size": "25057",
            "@ref": "si100",
            "@mimetype": "image/svg+xml"
        },
        {
            "@category": "thumbnail",
            "@_fa": "true",
            "$": "https://api.elsevier.com/content/object/eid/1-s2.0-S0378778822007654-si101.svg?httpAccept=%2A%2F%2A",
            "@multimediatype": "Scalable Vector Graphics file",
            "@type": "ALTIMG",
            "@size": "6954",
            "@ref": "si101",
            "@mimetype": "image/svg+xml"
        },
        {
            "@category": "thumbnail",
            "@_fa": "true",
            "$": "https://api.elsevier.com/content/object/eid/1-s2.0-S0378778822007654-si102.svg?httpAccept=%2A%2F%2A",
            "@multimediatype": "Scalable Vector Graphics file",
            "@type": "ALTIMG",
            "@size": "6728",
            "@ref": "si102",
            "@mimetype": "image/svg+xml"
        },
        {
            "@category": "thumbnail",
            "@_fa": "true",
            "$": "https://api.elsevier.com/content/object/eid/1-s2.0-S0378778822007654-si103.svg?httpAccept=%2A%2F%2A",
            "@multimediatype": "Scalable Vector Graphics file",
            "@type": "ALTIMG",
            "@size": "6942",
            "@ref": "si103",
            "@mimetype": "image/svg+xml"
        },
        {
            "@category": "thumbnail",
            "@_fa": "true",
            "$": "https://api.elsevier.com/content/object/eid/1-s2.0-S0378778822007654-si104.svg?httpAccept=%2A%2F%2A",
            "@multimediatype": "Scalable Vector Graphics file",
            "@type": "ALTIMG",
            "@size": "6752",
            "@ref": "si104",
            "@mimetype": "image/svg+xml"
        },
        {
            "@category": "thumbnail",
            "@_fa": "true",
            "$": "https://api.elsevier.com/content/object/eid/1-s2.0-S0378778822007654-si105.svg?httpAccept=%2A%2F%2A",
            "@multimediatype": "Scalable Vector Graphics file",
            "@type": "ALTIMG",
            "@size": "8450",
            "@ref": "si105",
            "@mimetype": "image/svg+xml"
        },
        {
            "@category": "thumbnail",
            "@_fa": "true",
            "$": "https://api.elsevier.com/content/object/eid/1-s2.0-S0378778822007654-si106.svg?httpAccept=%2A%2F%2A",
            "@multimediatype": "Scalable Vector Graphics file",
            "@type": "ALTIMG",
            "@size": "21403",
            "@ref": "si106",
            "@mimetype": "image/svg+xml"
        },
        {
            "@category": "thumbnail",
            "@_fa": "true",
            "$": "https://api.elsevier.com/content/object/eid/1-s2.0-S0378778822007654-si107.svg?httpAccept=%2A%2F%2A",
            "@multimediatype": "Scalable Vector Graphics file",
            "@type": "ALTIMG",
            "@size": "23530",
            "@ref": "si107",
            "@mimetype": "image/svg+xml"
        },
        {
            "@category": "thumbnail",
            "@_fa": "true",
            "$": "https://api.elsevier.com/content/object/eid/1-s2.0-S0378778822007654-si108.svg?httpAccept=%2A%2F%2A",
            "@multimediatype": "Scalable Vector Graphics file",
            "@type": "ALTIMG",
            "@size": "28744",
            "@ref": "si108",
            "@mimetype": "image/svg+xml"
        },
        {
            "@category": "thumbnail",
            "@_fa": "true",
            "$": "https://api.elsevier.com/content/object/eid/1-s2.0-S0378778822007654-si109.svg?httpAccept=%2A%2F%2A",
            "@multimediatype": "Scalable Vector Graphics file",
            "@type": "ALTIMG",
            "@size": "7082",
            "@ref": "si109",
            "@mimetype": "image/svg+xml"
        },
        {
            "@category": "thumbnail",
            "@_fa": "true",
            "$": "https://api.elsevier.com/content/object/eid/1-s2.0-S0378778822007654-si11.svg?httpAccept=%2A%2F%2A",
            "@multimediatype": "Scalable Vector Graphics file",
            "@type": "ALTIMG",
            "@size": "3777",
            "@ref": "si11",
            "@mimetype": "image/svg+xml"
        },
        {
            "@category": "thumbnail",
            "@_fa": "true",
            "$": "https://api.elsevier.com/content/object/eid/1-s2.0-S0378778822007654-si110.svg?httpAccept=%2A%2F%2A",
            "@multimediatype": "Scalable Vector Graphics file",
            "@type": "ALTIMG",
            "@size": "6854",
            "@ref": "si110",
            "@mimetype": "image/svg+xml"
        },
        {
            "@category": "thumbnail",
            "@_fa": "true",
            "$": "https://api.elsevier.com/content/object/eid/1-s2.0-S0378778822007654-si111.svg?httpAccept=%2A%2F%2A",
            "@multimediatype": "Scalable Vector Graphics file",
            "@type": "ALTIMG",
            "@size": "6132",
            "@ref": "si111",
            "@mimetype": "image/svg+xml"
        },
        {
            "@category": "thumbnail",
            "@_fa": "true",
            "$": "https://api.elsevier.com/content/object/eid/1-s2.0-S0378778822007654-si112.svg?httpAccept=%2A%2F%2A",
            "@multimediatype": "Scalable Vector Graphics file",
            "@type": "ALTIMG",
            "@size": "6880",
            "@ref": "si112",
            "@mimetype": "image/svg+xml"
        },
        {
            "@category": "thumbnail",
            "@_fa": "true",
            "$": "https://api.elsevier.com/content/object/eid/1-s2.0-S0378778822007654-si113.svg?httpAccept=%2A%2F%2A",
            "@multimediatype": "Scalable Vector Graphics file",
            "@type": "ALTIMG",
            "@size": "4552",
            "@ref": "si113",
            "@mimetype": "image/svg+xml"
        },
        {
            "@category": "thumbnail",
            "@_fa": "true",
            "$": "https://api.elsevier.com/content/object/eid/1-s2.0-S0378778822007654-si114.svg?httpAccept=%2A%2F%2A",
            "@multimediatype": "Scalable Vector Graphics file",
            "@type": "ALTIMG",
            "@size": "6074",
            "@ref": "si114",
            "@mimetype": "image/svg+xml"
        },
        {
            "@category": "thumbnail",
            "@_fa": "true",
            "$": "https://api.elsevier.com/content/object/eid/1-s2.0-S0378778822007654-si115.svg?httpAccept=%2A%2F%2A",
            "@multimediatype": "Scalable Vector Graphics file",
            "@type": "ALTIMG",
            "@size": "9767",
            "@ref": "si115",
            "@mimetype": "image/svg+xml"
        },
        {
            "@category": "thumbnail",
            "@_fa": "true",
            "$": "https://api.elsevier.com/content/object/eid/1-s2.0-S0378778822007654-si116.svg?httpAccept=%2A%2F%2A",
            "@multimediatype": "Scalable Vector Graphics file",
            "@type": "ALTIMG",
            "@size": "5216",
            "@ref": "si116",
            "@mimetype": "image/svg+xml"
        },
        {
            "@category": "thumbnail",
            "@_fa": "true",
            "$": "https://api.elsevier.com/content/object/eid/1-s2.0-S0378778822007654-si117.svg?httpAccept=%2A%2F%2A",
            "@multimediatype": "Scalable Vector Graphics file",
            "@type": "ALTIMG",
            "@size": "4101",
            "@ref": "si117",
            "@mimetype": "image/svg+xml"
        },
        {
            "@category": "thumbnail",
            "@_fa": "true",
            "$": "https://api.elsevier.com/content/object/eid/1-s2.0-S0378778822007654-si118.svg?httpAccept=%2A%2F%2A",
            "@multimediatype": "Scalable Vector Graphics file",
            "@type": "ALTIMG",
            "@size": "30804",
            "@ref": "si118",
            "@mimetype": "image/svg+xml"
        },
        {
            "@category": "thumbnail",
            "@_fa": "true",
            "$": "https://api.elsevier.com/content/object/eid/1-s2.0-S0378778822007654-si119.svg?httpAccept=%2A%2F%2A",
            "@multimediatype": "Scalable Vector Graphics file",
            "@type": "ALTIMG",
            "@size": "33575",
            "@ref": "si119",
            "@mimetype": "image/svg+xml"
        },
        {
            "@category": "thumbnail",
            "@_fa": "true",
            "$": "https://api.elsevier.com/content/object/eid/1-s2.0-S0378778822007654-si12.svg?httpAccept=%2A%2F%2A",
            "@multimediatype": "Scalable Vector Graphics file",
            "@type": "ALTIMG",
            "@size": "12855",
            "@ref": "si12",
            "@mimetype": "image/svg+xml"
        },
        {
            "@category": "thumbnail",
            "@_fa": "true",
            "$": "https://api.elsevier.com/content/object/eid/1-s2.0-S0378778822007654-si120.svg?httpAccept=%2A%2F%2A",
            "@multimediatype": "Scalable Vector Graphics file",
            "@type": "ALTIMG",
            "@size": "17840",
            "@ref": "si120",
            "@mimetype": "image/svg+xml"
        },
        {
            "@category": "thumbnail",
            "@_fa": "true",
            "$": "https://api.elsevier.com/content/object/eid/1-s2.0-S0378778822007654-si121.svg?httpAccept=%2A%2F%2A",
            "@multimediatype": "Scalable Vector Graphics file",
            "@type": "ALTIMG",
            "@size": "10874",
            "@ref": "si121",
            "@mimetype": "image/svg+xml"
        },
        {
            "@category": "thumbnail",
            "@_fa": "true",
            "$": "https://api.elsevier.com/content/object/eid/1-s2.0-S0378778822007654-si122.svg?httpAccept=%2A%2F%2A",
            "@multimediatype": "Scalable Vector Graphics file",
            "@type": "ALTIMG",
            "@size": "11388",
            "@ref": "si122",
            "@mimetype": "image/svg+xml"
        },
        {
            "@category": "thumbnail",
            "@_fa": "true",
            "$": "https://api.elsevier.com/content/object/eid/1-s2.0-S0378778822007654-si123.svg?httpAccept=%2A%2F%2A",
            "@multimediatype": "Scalable Vector Graphics file",
            "@type": "ALTIMG",
            "@size": "8322",
            "@ref": "si123",
            "@mimetype": "image/svg+xml"
        },
        {
            "@category": "thumbnail",
            "@_fa": "true",
            "$": "https://api.elsevier.com/content/object/eid/1-s2.0-S0378778822007654-si124.svg?httpAccept=%2A%2F%2A",
            "@multimediatype": "Scalable Vector Graphics file",
            "@type": "ALTIMG",
            "@size": "6351",
            "@ref": "si124",
            "@mimetype": "image/svg+xml"
        },
        {
            "@category": "thumbnail",
            "@_fa": "true",
            "$": "https://api.elsevier.com/content/object/eid/1-s2.0-S0378778822007654-si125.svg?httpAccept=%2A%2F%2A",
            "@multimediatype": "Scalable Vector Graphics file",
            "@type": "ALTIMG",
            "@size": "6389",
            "@ref": "si125",
            "@mimetype": "image/svg+xml"
        },
        {
            "@category": "thumbnail",
            "@_fa": "true",
            "$": "https://api.elsevier.com/content/object/eid/1-s2.0-S0378778822007654-si126.svg?httpAccept=%2A%2F%2A",
            "@multimediatype": "Scalable Vector Graphics file",
            "@type": "ALTIMG",
            "@size": "27971",
            "@ref": "si126",
            "@mimetype": "image/svg+xml"
        },
        {
            "@category": "thumbnail",
            "@_fa": "true",
            "$": "https://api.elsevier.com/content/object/eid/1-s2.0-S0378778822007654-si127.svg?httpAccept=%2A%2F%2A",
            "@multimediatype": "Scalable Vector Graphics file",
            "@type": "ALTIMG",
            "@size": "2839",
            "@ref": "si127",
            "@mimetype": "image/svg+xml"
        },
        {
            "@category": "thumbnail",
            "@_fa": "true",
            "$": "https://api.elsevier.com/content/object/eid/1-s2.0-S0378778822007654-si128.svg?httpAccept=%2A%2F%2A",
            "@multimediatype": "Scalable Vector Graphics file",
            "@type": "ALTIMG",
            "@size": "2603",
            "@ref": "si128",
            "@mimetype": "image/svg+xml"
        },
        {
            "@category": "thumbnail",
            "@_fa": "true",
            "$": "https://api.elsevier.com/content/object/eid/1-s2.0-S0378778822007654-si129.svg?httpAccept=%2A%2F%2A",
            "@multimediatype": "Scalable Vector Graphics file",
            "@type": "ALTIMG",
            "@size": "3496",
            "@ref": "si129",
            "@mimetype": "image/svg+xml"
        },
        {
            "@category": "thumbnail",
            "@_fa": "true",
            "$": "https://api.elsevier.com/content/object/eid/1-s2.0-S0378778822007654-si13.svg?httpAccept=%2A%2F%2A",
            "@multimediatype": "Scalable Vector Graphics file",
            "@type": "ALTIMG",
            "@size": "8718",
            "@ref": "si13",
            "@mimetype": "image/svg+xml"
        },
        {
            "@category": "thumbnail",
            "@_fa": "true",
            "$": "https://api.elsevier.com/content/object/eid/1-s2.0-S0378778822007654-si130.svg?httpAccept=%2A%2F%2A",
            "@multimediatype": "Scalable Vector Graphics file",
            "@type": "ALTIMG",
            "@size": "22821",
            "@ref": "si130",
            "@mimetype": "image/svg+xml"
        },
        {
            "@category": "thumbnail",
            "@_fa": "true",
            "$": "https://api.elsevier.com/content/object/eid/1-s2.0-S0378778822007654-si131.svg?httpAccept=%2A%2F%2A",
            "@multimediatype": "Scalable Vector Graphics file",
            "@type": "ALTIMG",
            "@size": "25924",
            "@ref": "si131",
            "@mimetype": "image/svg+xml"
        },
        {
            "@category": "thumbnail",
            "@_fa": "true",
            "$": "https://api.elsevier.com/content/object/eid/1-s2.0-S0378778822007654-si132.svg?httpAccept=%2A%2F%2A",
            "@multimediatype": "Scalable Vector Graphics file",
            "@type": "ALTIMG",
            "@size": "2823",
            "@ref": "si132",
            "@mimetype": "image/svg+xml"
        },
        {
            "@category": "thumbnail",
            "@_fa": "true",
            "$": "https://api.elsevier.com/content/object/eid/1-s2.0-S0378778822007654-si133.svg?httpAccept=%2A%2F%2A",
            "@multimediatype": "Scalable Vector Graphics file",
            "@type": "ALTIMG",
            "@size": "2581",
            "@ref": "si133",
            "@mimetype": "image/svg+xml"
        },
        {
            "@category": "thumbnail",
            "@_fa": "true",
            "$": "https://api.elsevier.com/content/object/eid/1-s2.0-S0378778822007654-si134.svg?httpAccept=%2A%2F%2A",
            "@multimediatype": "Scalable Vector Graphics file",
            "@type": "ALTIMG",
            "@size": "8093",
            "@ref": "si134",
            "@mimetype": "image/svg+xml"
        },
        {
            "@category": "thumbnail",
            "@_fa": "true",
            "$": "https://api.elsevier.com/content/object/eid/1-s2.0-S0378778822007654-si135.svg?httpAccept=%2A%2F%2A",
            "@multimediatype": "Scalable Vector Graphics file",
            "@type": "ALTIMG",
            "@size": "7867",
            "@ref": "si135",
            "@mimetype": "image/svg+xml"
        },
        {
            "@category": "thumbnail",
            "@_fa": "true",
            "$": "https://api.elsevier.com/content/object/eid/1-s2.0-S0378778822007654-si136.svg?httpAccept=%2A%2F%2A",
            "@multimediatype": "Scalable Vector Graphics file",
            "@type": "ALTIMG",
            "@size": "8084",
            "@ref": "si136",
            "@mimetype": "image/svg+xml"
        },
        {
            "@category": "thumbnail",
            "@_fa": "true",
            "$": "https://api.elsevier.com/content/object/eid/1-s2.0-S0378778822007654-si137.svg?httpAccept=%2A%2F%2A",
            "@multimediatype": "Scalable Vector Graphics file",
            "@type": "ALTIMG",
            "@size": "7890",
            "@ref": "si137",
            "@mimetype": "image/svg+xml"
        },
        {
            "@category": "thumbnail",
            "@_fa": "true",
            "$": "https://api.elsevier.com/content/object/eid/1-s2.0-S0378778822007654-si138.svg?httpAccept=%2A%2F%2A",
            "@multimediatype": "Scalable Vector Graphics file",
            "@type": "ALTIMG",
            "@size": "6984",
            "@ref": "si138",
            "@mimetype": "image/svg+xml"
        },
        {
            "@category": "thumbnail",
            "@_fa": "true",
            "$": "https://api.elsevier.com/content/object/eid/1-s2.0-S0378778822007654-si139.svg?httpAccept=%2A%2F%2A",
            "@multimediatype": "Scalable Vector Graphics file",
            "@type": "ALTIMG",
            "@size": "6013",
            "@ref": "si139",
            "@mimetype": "image/svg+xml"
        },
        {
            "@category": "thumbnail",
            "@_fa": "true",
            "$": "https://api.elsevier.com/content/object/eid/1-s2.0-S0378778822007654-si14.svg?httpAccept=%2A%2F%2A",
            "@multimediatype": "Scalable Vector Graphics file",
            "@type": "ALTIMG",
            "@size": "9505",
            "@ref": "si14",
            "@mimetype": "image/svg+xml"
        },
        {
            "@category": "thumbnail",
            "@_fa": "true",
            "$": "https://api.elsevier.com/content/object/eid/1-s2.0-S0378778822007654-si140.svg?httpAccept=%2A%2F%2A",
            "@multimediatype": "Scalable Vector Graphics file",
            "@type": "ALTIMG",
            "@size": "6179",
            "@ref": "si140",
            "@mimetype": "image/svg+xml"
        },
        {
            "@category": "thumbnail",
            "@_fa": "true",
            "$": "https://api.elsevier.com/content/object/eid/1-s2.0-S0378778822007654-si141.svg?httpAccept=%2A%2F%2A",
            "@multimediatype": "Scalable Vector Graphics file",
            "@type": "ALTIMG",
            "@size": "5451",
            "@ref": "si141",
            "@mimetype": "image/svg+xml"
        },
        {
            "@category": "thumbnail",
            "@_fa": "true",
            "$": "https://api.elsevier.com/content/object/eid/1-s2.0-S0378778822007654-si142.svg?httpAccept=%2A%2F%2A",
            "@multimediatype": "Scalable Vector Graphics file",
            "@type": "ALTIMG",
            "@size": "7840",
            "@ref": "si142",
            "@mimetype": "image/svg+xml"
        },
        {
            "@category": "thumbnail",
            "@_fa": "true",
            "$": "https://api.elsevier.com/content/object/eid/1-s2.0-S0378778822007654-si143.svg?httpAccept=%2A%2F%2A",
            "@multimediatype": "Scalable Vector Graphics file",
            "@type": "ALTIMG",
            "@size": "3360",
            "@ref": "si143",
            "@mimetype": "image/svg+xml"
        },
        {
            "@category": "thumbnail",
            "@_fa": "true",
            "$": "https://api.elsevier.com/content/object/eid/1-s2.0-S0378778822007654-si144.svg?httpAccept=%2A%2F%2A",
            "@multimediatype": "Scalable Vector Graphics file",
            "@type": "ALTIMG",
            "@size": "35563",
            "@ref": "si144",
            "@mimetype": "image/svg+xml"
        },
        {
            "@category": "thumbnail",
            "@_fa": "true",
            "$": "https://api.elsevier.com/content/object/eid/1-s2.0-S0378778822007654-si145.svg?httpAccept=%2A%2F%2A",
            "@multimediatype": "Scalable Vector Graphics file",
            "@type": "ALTIMG",
            "@size": "3530",
            "@ref": "si145",
            "@mimetype": "image/svg+xml"
        },
        {
            "@category": "thumbnail",
            "@_fa": "true",
            "$": "https://api.elsevier.com/content/object/eid/1-s2.0-S0378778822007654-si146.svg?httpAccept=%2A%2F%2A",
            "@multimediatype": "Scalable Vector Graphics file",
            "@type": "ALTIMG",
            "@size": "1712",
            "@ref": "si146",
            "@mimetype": "image/svg+xml"
        },
        {
            "@category": "thumbnail",
            "@_fa": "true",
            "$": "https://api.elsevier.com/content/object/eid/1-s2.0-S0378778822007654-si147.svg?httpAccept=%2A%2F%2A",
            "@multimediatype": "Scalable Vector Graphics file",
            "@type": "ALTIMG",
            "@size": "2998",
            "@ref": "si147",
            "@mimetype": "image/svg+xml"
        },
        {
            "@category": "thumbnail",
            "@_fa": "true",
            "$": "https://api.elsevier.com/content/object/eid/1-s2.0-S0378778822007654-si148.svg?httpAccept=%2A%2F%2A",
            "@multimediatype": "Scalable Vector Graphics file",
            "@type": "ALTIMG",
            "@size": "4387",
            "@ref": "si148",
            "@mimetype": "image/svg+xml"
        },
        {
            "@category": "thumbnail",
            "@_fa": "true",
            "$": "https://api.elsevier.com/content/object/eid/1-s2.0-S0378778822007654-si149.svg?httpAccept=%2A%2F%2A",
            "@multimediatype": "Scalable Vector Graphics file",
            "@type": "ALTIMG",
            "@size": "31994",
            "@ref": "si149",
            "@mimetype": "image/svg+xml"
        },
        {
            "@category": "thumbnail",
            "@_fa": "true",
            "$": "https://api.elsevier.com/content/object/eid/1-s2.0-S0378778822007654-si15.svg?httpAccept=%2A%2F%2A",
            "@multimediatype": "Scalable Vector Graphics file",
            "@type": "ALTIMG",
            "@size": "6805",
            "@ref": "si15",
            "@mimetype": "image/svg+xml"
        },
        {
            "@category": "thumbnail",
            "@_fa": "true",
            "$": "https://api.elsevier.com/content/object/eid/1-s2.0-S0378778822007654-si150.svg?httpAccept=%2A%2F%2A",
            "@multimediatype": "Scalable Vector Graphics file",
            "@type": "ALTIMG",
            "@size": "10762",
            "@ref": "si150",
            "@mimetype": "image/svg+xml"
        },
        {
            "@category": "thumbnail",
            "@_fa": "true",
            "$": "https://api.elsevier.com/content/object/eid/1-s2.0-S0378778822007654-si151.svg?httpAccept=%2A%2F%2A",
            "@multimediatype": "Scalable Vector Graphics file",
            "@type": "ALTIMG",
            "@size": "10474",
            "@ref": "si151",
            "@mimetype": "image/svg+xml"
        },
        {
            "@category": "thumbnail",
            "@_fa": "true",
            "$": "https://api.elsevier.com/content/object/eid/1-s2.0-S0378778822007654-si152.svg?httpAccept=%2A%2F%2A",
            "@multimediatype": "Scalable Vector Graphics file",
            "@type": "ALTIMG",
            "@size": "3395",
            "@ref": "si152",
            "@mimetype": "image/svg+xml"
        },
        {
            "@category": "thumbnail",
            "@_fa": "true",
            "$": "https://api.elsevier.com/content/object/eid/1-s2.0-S0378778822007654-si153.svg?httpAccept=%2A%2F%2A",
            "@multimediatype": "Scalable Vector Graphics file",
            "@type": "ALTIMG",
            "@size": "17202",
            "@ref": "si153",
            "@mimetype": "image/svg+xml"
        },
        {
            "@category": "thumbnail",
            "@_fa": "true",
            "$": "https://api.elsevier.com/content/object/eid/1-s2.0-S0378778822007654-si154.svg?httpAccept=%2A%2F%2A",
            "@multimediatype": "Scalable Vector Graphics file",
            "@type": "ALTIMG",
            "@size": "1811",
            "@ref": "si154",
            "@mimetype": "image/svg+xml"
        },
        {
            "@category": "thumbnail",
            "@_fa": "true",
            "$": "https://api.elsevier.com/content/object/eid/1-s2.0-S0378778822007654-si155.svg?httpAccept=%2A%2F%2A",
            "@multimediatype": "Scalable Vector Graphics file",
            "@type": "ALTIMG",
            "@size": "1748",
            "@ref": "si155",
            "@mimetype": "image/svg+xml"
        },
        {
            "@category": "thumbnail",
            "@_fa": "true",
            "$": "https://api.elsevier.com/content/object/eid/1-s2.0-S0378778822007654-si156.svg?httpAccept=%2A%2F%2A",
            "@multimediatype": "Scalable Vector Graphics file",
            "@type": "ALTIMG",
            "@size": "2987",
            "@ref": "si156",
            "@mimetype": "image/svg+xml"
        },
        {
            "@category": "thumbnail",
            "@_fa": "true",
            "$": "https://api.elsevier.com/content/object/eid/1-s2.0-S0378778822007654-si16.svg?httpAccept=%2A%2F%2A",
            "@multimediatype": "Scalable Vector Graphics file",
            "@type": "ALTIMG",
            "@size": "7747",
            "@ref": "si16",
            "@mimetype": "image/svg+xml"
        },
        {
            "@category": "thumbnail",
            "@_fa": "true",
            "$": "https://api.elsevier.com/content/object/eid/1-s2.0-S0378778822007654-si17.svg?httpAccept=%2A%2F%2A",
            "@multimediatype": "Scalable Vector Graphics file",
            "@type": "ALTIMG",
            "@size": "8615",
            "@ref": "si17",
            "@mimetype": "image/svg+xml"
        },
        {
            "@category": "thumbnail",
            "@_fa": "true",
            "$": "https://api.elsevier.com/content/object/eid/1-s2.0-S0378778822007654-si18.svg?httpAccept=%2A%2F%2A",
            "@multimediatype": "Scalable Vector Graphics file",
            "@type": "ALTIMG",
            "@size": "11407",
            "@ref": "si18",
            "@mimetype": "image/svg+xml"
        },
        {
            "@category": "thumbnail",
            "@_fa": "true",
            "$": "https://api.elsevier.com/content/object/eid/1-s2.0-S0378778822007654-si19.svg?httpAccept=%2A%2F%2A",
            "@multimediatype": "Scalable Vector Graphics file",
            "@type": "ALTIMG",
            "@size": "4125",
            "@ref": "si19",
            "@mimetype": "image/svg+xml"
        },
        {
            "@category": "thumbnail",
            "@_fa": "true",
            "$": "https://api.elsevier.com/content/object/eid/1-s2.0-S0378778822007654-si2.svg?httpAccept=%2A%2F%2A",
            "@multimediatype": "Scalable Vector Graphics file",
            "@type": "ALTIMG",
            "@size": "3879",
            "@ref": "si2",
            "@mimetype": "image/svg+xml"
        },
        {
            "@category": "thumbnail",
            "@_fa": "true",
            "$": "https://api.elsevier.com/content/object/eid/1-s2.0-S0378778822007654-si20.svg?httpAccept=%2A%2F%2A",
            "@multimediatype": "Scalable Vector Graphics file",
            "@type": "ALTIMG",
            "@size": "3550",
            "@ref": "si20",
            "@mimetype": "image/svg+xml"
        },
        {
            "@category": "thumbnail",
            "@_fa": "true",
            "$": "https://api.elsevier.com/content/object/eid/1-s2.0-S0378778822007654-si21.svg?httpAccept=%2A%2F%2A",
            "@multimediatype": "Scalable Vector Graphics file",
            "@type": "ALTIMG",
            "@size": "7154",
            "@ref": "si21",
            "@mimetype": "image/svg+xml"
        },
        {
            "@category": "thumbnail",
            "@_fa": "true",
            "$": "https://api.elsevier.com/content/object/eid/1-s2.0-S0378778822007654-si22.svg?httpAccept=%2A%2F%2A",
            "@multimediatype": "Scalable Vector Graphics file",
            "@type": "ALTIMG",
            "@size": "8650",
            "@ref": "si22",
            "@mimetype": "image/svg+xml"
        },
        {
            "@category": "thumbnail",
            "@_fa": "true",
            "$": "https://api.elsevier.com/content/object/eid/1-s2.0-S0378778822007654-si23.svg?httpAccept=%2A%2F%2A",
            "@multimediatype": "Scalable Vector Graphics file",
            "@type": "ALTIMG",
            "@size": "10852",
            "@ref": "si23",
            "@mimetype": "image/svg+xml"
        },
        {
            "@category": "thumbnail",
            "@_fa": "true",
            "$": "https://api.elsevier.com/content/object/eid/1-s2.0-S0378778822007654-si24.svg?httpAccept=%2A%2F%2A",
            "@multimediatype": "Scalable Vector Graphics file",
            "@type": "ALTIMG",
            "@size": "10765",
            "@ref": "si24",
            "@mimetype": "image/svg+xml"
        },
        {
            "@category": "thumbnail",
            "@_fa": "true",
            "$": "https://api.elsevier.com/content/object/eid/1-s2.0-S0378778822007654-si25.svg?httpAccept=%2A%2F%2A",
            "@multimediatype": "Scalable Vector Graphics file",
            "@type": "ALTIMG",
            "@size": "6587",
            "@ref": "si25",
            "@mimetype": "image/svg+xml"
        },
        {
            "@category": "thumbnail",
            "@_fa": "true",
            "$": "https://api.elsevier.com/content/object/eid/1-s2.0-S0378778822007654-si26.svg?httpAccept=%2A%2F%2A",
            "@multimediatype": "Scalable Vector Graphics file",
            "@type": "ALTIMG",
            "@size": "7528",
            "@ref": "si26",
            "@mimetype": "image/svg+xml"
        },
        {
            "@category": "thumbnail",
            "@_fa": "true",
            "$": "https://api.elsevier.com/content/object/eid/1-s2.0-S0378778822007654-si27.svg?httpAccept=%2A%2F%2A",
            "@multimediatype": "Scalable Vector Graphics file",
            "@type": "ALTIMG",
            "@size": "14651",
            "@ref": "si27",
            "@mimetype": "image/svg+xml"
        },
        {
            "@category": "thumbnail",
            "@_fa": "true",
            "$": "https://api.elsevier.com/content/object/eid/1-s2.0-S0378778822007654-si28.svg?httpAccept=%2A%2F%2A",
            "@multimediatype": "Scalable Vector Graphics file",
            "@type": "ALTIMG",
            "@size": "4337",
            "@ref": "si28",
            "@mimetype": "image/svg+xml"
        },
        {
            "@category": "thumbnail",
            "@_fa": "true",
            "$": "https://api.elsevier.com/content/object/eid/1-s2.0-S0378778822007654-si29.svg?httpAccept=%2A%2F%2A",
            "@multimediatype": "Scalable Vector Graphics file",
            "@type": "ALTIMG",
            "@size": "3769",
            "@ref": "si29",
            "@mimetype": "image/svg+xml"
        },
        {
            "@category": "thumbnail",
            "@_fa": "true",
            "$": "https://api.elsevier.com/content/object/eid/1-s2.0-S0378778822007654-si3.svg?httpAccept=%2A%2F%2A",
            "@multimediatype": "Scalable Vector Graphics file",
            "@type": "ALTIMG",
            "@size": "4091",
            "@ref": "si3",
            "@mimetype": "image/svg+xml"
        },
        {
            "@category": "thumbnail",
            "@_fa": "true",
            "$": "https://api.elsevier.com/content/object/eid/1-s2.0-S0378778822007654-si30.svg?httpAccept=%2A%2F%2A",
            "@multimediatype": "Scalable Vector Graphics file",
            "@type": "ALTIMG",
            "@size": "10618",
            "@ref": "si30",
            "@mimetype": "image/svg+xml"
        },
        {
            "@category": "thumbnail",
            "@_fa": "true",
            "$": "https://api.elsevier.com/content/object/eid/1-s2.0-S0378778822007654-si31.svg?httpAccept=%2A%2F%2A",
            "@multimediatype": "Scalable Vector Graphics file",
            "@type": "ALTIMG",
            "@size": "8867",
            "@ref": "si31",
            "@mimetype": "image/svg+xml"
        },
        {
            "@category": "thumbnail",
            "@_fa": "true",
            "$": "https://api.elsevier.com/content/object/eid/1-s2.0-S0378778822007654-si32.svg?httpAccept=%2A%2F%2A",
            "@multimediatype": "Scalable Vector Graphics file",
            "@type": "ALTIMG",
            "@size": "6795",
            "@ref": "si32",
            "@mimetype": "image/svg+xml"
        },
        {
            "@category": "thumbnail",
            "@_fa": "true",
            "$": "https://api.elsevier.com/content/object/eid/1-s2.0-S0378778822007654-si33.svg?httpAccept=%2A%2F%2A",
            "@multimediatype": "Scalable Vector Graphics file",
            "@type": "ALTIMG",
            "@size": "9654",
            "@ref": "si33",
            "@mimetype": "image/svg+xml"
        },
        {
            "@category": "thumbnail",
            "@_fa": "true",
            "$": "https://api.elsevier.com/content/object/eid/1-s2.0-S0378778822007654-si34.svg?httpAccept=%2A%2F%2A",
            "@multimediatype": "Scalable Vector Graphics file",
            "@type": "ALTIMG",
            "@size": "7739",
            "@ref": "si34",
            "@mimetype": "image/svg+xml"
        },
        {
            "@category": "thumbnail",
            "@_fa": "true",
            "$": "https://api.elsevier.com/content/object/eid/1-s2.0-S0378778822007654-si35.svg?httpAccept=%2A%2F%2A",
            "@multimediatype": "Scalable Vector Graphics file",
            "@type": "ALTIMG",
            "@size": "14311",
            "@ref": "si35",
            "@mimetype": "image/svg+xml"
        },
        {
            "@category": "thumbnail",
            "@_fa": "true",
            "$": "https://api.elsevier.com/content/object/eid/1-s2.0-S0378778822007654-si36.svg?httpAccept=%2A%2F%2A",
            "@multimediatype": "Scalable Vector Graphics file",
            "@type": "ALTIMG",
            "@size": "4146",
            "@ref": "si36",
            "@mimetype": "image/svg+xml"
        },
        {
            "@category": "thumbnail",
            "@_fa": "true",
            "$": "https://api.elsevier.com/content/object/eid/1-s2.0-S0378778822007654-si37.svg?httpAccept=%2A%2F%2A",
            "@multimediatype": "Scalable Vector Graphics file",
            "@type": "ALTIMG",
            "@size": "3576",
            "@ref": "si37",
            "@mimetype": "image/svg+xml"
        },
        {
            "@category": "thumbnail",
            "@_fa": "true",
            "$": "https://api.elsevier.com/content/object/eid/1-s2.0-S0378778822007654-si38.svg?httpAccept=%2A%2F%2A",
            "@multimediatype": "Scalable Vector Graphics file",
            "@type": "ALTIMG",
            "@size": "32731",
            "@ref": "si38",
            "@mimetype": "image/svg+xml"
        },
        {
            "@category": "thumbnail",
            "@_fa": "true",
            "$": "https://api.elsevier.com/content/object/eid/1-s2.0-S0378778822007654-si39.svg?httpAccept=%2A%2F%2A",
            "@multimediatype": "Scalable Vector Graphics file",
            "@type": "ALTIMG",
            "@size": "8517",
            "@ref": "si39",
            "@mimetype": "image/svg+xml"
        },
        {
            "@category": "thumbnail",
            "@_fa": "true",
            "$": "https://api.elsevier.com/content/object/eid/1-s2.0-S0378778822007654-si4.svg?httpAccept=%2A%2F%2A",
            "@multimediatype": "Scalable Vector Graphics file",
            "@type": "ALTIMG",
            "@size": "3902",
            "@ref": "si4",
            "@mimetype": "image/svg+xml"
        },
        {
            "@category": "thumbnail",
            "@_fa": "true",
            "$": "https://api.elsevier.com/content/object/eid/1-s2.0-S0378778822007654-si40.svg?httpAccept=%2A%2F%2A",
            "@multimediatype": "Scalable Vector Graphics file",
            "@type": "ALTIMG",
            "@size": "7176",
            "@ref": "si40",
            "@mimetype": "image/svg+xml"
        },
        {
            "@category": "thumbnail",
            "@_fa": "true",
            "$": "https://api.elsevier.com/content/object/eid/1-s2.0-S0378778822007654-si41.svg?httpAccept=%2A%2F%2A",
            "@multimediatype": "Scalable Vector Graphics file",
            "@type": "ALTIMG",
            "@size": "6608",
            "@ref": "si41",
            "@mimetype": "image/svg+xml"
        },
        {
            "@category": "thumbnail",
            "@_fa": "true",
            "$": "https://api.elsevier.com/content/object/eid/1-s2.0-S0378778822007654-si42.svg?httpAccept=%2A%2F%2A",
            "@multimediatype": "Scalable Vector Graphics file",
            "@type": "ALTIMG",
            "@size": "5864",
            "@ref": "si42",
            "@mimetype": "image/svg+xml"
        },
        {
            "@category": "thumbnail",
            "@_fa": "true",
            "$": "https://api.elsevier.com/content/object/eid/1-s2.0-S0378778822007654-si43.svg?httpAccept=%2A%2F%2A",
            "@multimediatype": "Scalable Vector Graphics file",
            "@type": "ALTIMG",
            "@size": "6687",
            "@ref": "si43",
            "@mimetype": "image/svg+xml"
        },
        {
            "@category": "thumbnail",
            "@_fa": "true",
            "$": "https://api.elsevier.com/content/object/eid/1-s2.0-S0378778822007654-si44.svg?httpAccept=%2A%2F%2A",
            "@multimediatype": "Scalable Vector Graphics file",
            "@type": "ALTIMG",
            "@size": "5830",
            "@ref": "si44",
            "@mimetype": "image/svg+xml"
        },
        {
            "@category": "thumbnail",
            "@_fa": "true",
            "$": "https://api.elsevier.com/content/object/eid/1-s2.0-S0378778822007654-si45.svg?httpAccept=%2A%2F%2A",
            "@multimediatype": "Scalable Vector Graphics file",
            "@type": "ALTIMG",
            "@size": "6923",
            "@ref": "si45",
            "@mimetype": "image/svg+xml"
        },
        {
            "@category": "thumbnail",
            "@_fa": "true",
            "$": "https://api.elsevier.com/content/object/eid/1-s2.0-S0378778822007654-si46.svg?httpAccept=%2A%2F%2A",
            "@multimediatype": "Scalable Vector Graphics file",
            "@type": "ALTIMG",
            "@size": "7135",
            "@ref": "si46",
            "@mimetype": "image/svg+xml"
        },
        {
            "@category": "thumbnail",
            "@_fa": "true",
            "$": "https://api.elsevier.com/content/object/eid/1-s2.0-S0378778822007654-si47.svg?httpAccept=%2A%2F%2A",
            "@multimediatype": "Scalable Vector Graphics file",
            "@type": "ALTIMG",
            "@size": "11979",
            "@ref": "si47",
            "@mimetype": "image/svg+xml"
        },
        {
            "@category": "thumbnail",
            "@_fa": "true",
            "$": "https://api.elsevier.com/content/object/eid/1-s2.0-S0378778822007654-si48.svg?httpAccept=%2A%2F%2A",
            "@multimediatype": "Scalable Vector Graphics file",
            "@type": "ALTIMG",
            "@size": "2551",
            "@ref": "si48",
            "@mimetype": "image/svg+xml"
        },
        {
            "@category": "thumbnail",
            "@_fa": "true",
            "$": "https://api.elsevier.com/content/object/eid/1-s2.0-S0378778822007654-si49.svg?httpAccept=%2A%2F%2A",
            "@multimediatype": "Scalable Vector Graphics file",
            "@type": "ALTIMG",
            "@size": "8086",
            "@ref": "si49",
            "@mimetype": "image/svg+xml"
        },
        {
            "@category": "thumbnail",
            "@_fa": "true",
            "$": "https://api.elsevier.com/content/object/eid/1-s2.0-S0378778822007654-si5.svg?httpAccept=%2A%2F%2A",
            "@multimediatype": "Scalable Vector Graphics file",
            "@type": "ALTIMG",
            "@size": "1757",
            "@ref": "si5",
            "@mimetype": "image/svg+xml"
        },
        {
            "@category": "thumbnail",
            "@_fa": "true",
            "$": "https://api.elsevier.com/content/object/eid/1-s2.0-S0378778822007654-si50.svg?httpAccept=%2A%2F%2A",
            "@multimediatype": "Scalable Vector Graphics file",
            "@type": "ALTIMG",
            "@size": "2142",
            "@ref": "si50",
            "@mimetype": "image/svg+xml"
        },
        {
            "@category": "thumbnail",
            "@_fa": "true",
            "$": "https://api.elsevier.com/content/object/eid/1-s2.0-S0378778822007654-si51.svg?httpAccept=%2A%2F%2A",
            "@multimediatype": "Scalable Vector Graphics file",
            "@type": "ALTIMG",
            "@size": "1397",
            "@ref": "si51",
            "@mimetype": "image/svg+xml"
        },
        {
            "@category": "thumbnail",
            "@_fa": "true",
            "$": "https://api.elsevier.com/content/object/eid/1-s2.0-S0378778822007654-si52.svg?httpAccept=%2A%2F%2A",
            "@multimediatype": "Scalable Vector Graphics file",
            "@type": "ALTIMG",
            "@size": "11952",
            "@ref": "si52",
            "@mimetype": "image/svg+xml"
        },
        {
            "@category": "thumbnail",
            "@_fa": "true",
            "$": "https://api.elsevier.com/content/object/eid/1-s2.0-S0378778822007654-si53.svg?httpAccept=%2A%2F%2A",
            "@multimediatype": "Scalable Vector Graphics file",
            "@type": "ALTIMG",
            "@size": "8248",
            "@ref": "si53",
            "@mimetype": "image/svg+xml"
        },
        {
            "@category": "thumbnail",
            "@_fa": "true",
            "$": "https://api.elsevier.com/content/object/eid/1-s2.0-S0378778822007654-si54.svg?httpAccept=%2A%2F%2A",
            "@multimediatype": "Scalable Vector Graphics file",
            "@type": "ALTIMG",
            "@size": "4747",
            "@ref": "si54",
            "@mimetype": "image/svg+xml"
        },
        {
            "@category": "thumbnail",
            "@_fa": "true",
            "$": "https://api.elsevier.com/content/object/eid/1-s2.0-S0378778822007654-si55.svg?httpAccept=%2A%2F%2A",
            "@multimediatype": "Scalable Vector Graphics file",
            "@type": "ALTIMG",
            "@size": "43292",
            "@ref": "si55",
            "@mimetype": "image/svg+xml"
        },
        {
            "@category": "thumbnail",
            "@_fa": "true",
            "$": "https://api.elsevier.com/content/object/eid/1-s2.0-S0378778822007654-si56.svg?httpAccept=%2A%2F%2A",
            "@multimediatype": "Scalable Vector Graphics file",
            "@type": "ALTIMG",
            "@size": "10311",
            "@ref": "si56",
            "@mimetype": "image/svg+xml"
        },
        {
            "@category": "thumbnail",
            "@_fa": "true",
            "$": "https://api.elsevier.com/content/object/eid/1-s2.0-S0378778822007654-si57.svg?httpAccept=%2A%2F%2A",
            "@multimediatype": "Scalable Vector Graphics file",
            "@type": "ALTIMG",
            "@size": "4626",
            "@ref": "si57",
            "@mimetype": "image/svg+xml"
        },
        {
            "@category": "thumbnail",
            "@_fa": "true",
            "$": "https://api.elsevier.com/content/object/eid/1-s2.0-S0378778822007654-si58.svg?httpAccept=%2A%2F%2A",
            "@multimediatype": "Scalable Vector Graphics file",
            "@type": "ALTIMG",
            "@size": "4729",
            "@ref": "si58",
            "@mimetype": "image/svg+xml"
        },
        {
            "@category": "thumbnail",
            "@_fa": "true",
            "$": "https://api.elsevier.com/content/object/eid/1-s2.0-S0378778822007654-si59.svg?httpAccept=%2A%2F%2A",
            "@multimediatype": "Scalable Vector Graphics file",
            "@type": "ALTIMG",
            "@size": "3269",
            "@ref": "si59",
            "@mimetype": "image/svg+xml"
        },
        {
            "@category": "thumbnail",
            "@_fa": "true",
            "$": "https://api.elsevier.com/content/object/eid/1-s2.0-S0378778822007654-si6.svg?httpAccept=%2A%2F%2A",
            "@multimediatype": "Scalable Vector Graphics file",
            "@type": "ALTIMG",
            "@size": "6057",
            "@ref": "si6",
            "@mimetype": "image/svg+xml"
        },
        {
            "@category": "thumbnail",
            "@_fa": "true",
            "$": "https://api.elsevier.com/content/object/eid/1-s2.0-S0378778822007654-si60.svg?httpAccept=%2A%2F%2A",
            "@multimediatype": "Scalable Vector Graphics file",
            "@type": "ALTIMG",
            "@size": "3097",
            "@ref": "si60",
            "@mimetype": "image/svg+xml"
        },
        {
            "@category": "thumbnail",
            "@_fa": "true",
            "$": "https://api.elsevier.com/content/object/eid/1-s2.0-S0378778822007654-si61.svg?httpAccept=%2A%2F%2A",
            "@multimediatype": "Scalable Vector Graphics file",
            "@type": "ALTIMG",
            "@size": "3202",
            "@ref": "si61",
            "@mimetype": "image/svg+xml"
        },
        {
            "@category": "thumbnail",
            "@_fa": "true",
            "$": "https://api.elsevier.com/content/object/eid/1-s2.0-S0378778822007654-si62.svg?httpAccept=%2A%2F%2A",
            "@multimediatype": "Scalable Vector Graphics file",
            "@type": "ALTIMG",
            "@size": "3724",
            "@ref": "si62",
            "@mimetype": "image/svg+xml"
        },
        {
            "@category": "thumbnail",
            "@_fa": "true",
            "$": "https://api.elsevier.com/content/object/eid/1-s2.0-S0378778822007654-si63.svg?httpAccept=%2A%2F%2A",
            "@multimediatype": "Scalable Vector Graphics file",
            "@type": "ALTIMG",
            "@size": "13698",
            "@ref": "si63",
            "@mimetype": "image/svg+xml"
        },
        {
            "@category": "thumbnail",
            "@_fa": "true",
            "$": "https://api.elsevier.com/content/object/eid/1-s2.0-S0378778822007654-si64.svg?httpAccept=%2A%2F%2A",
            "@multimediatype": "Scalable Vector Graphics file",
            "@type": "ALTIMG",
            "@size": "3024",
            "@ref": "si64",
            "@mimetype": "image/svg+xml"
        },
        {
            "@category": "thumbnail",
            "@_fa": "true",
            "$": "https://api.elsevier.com/content/object/eid/1-s2.0-S0378778822007654-si65.svg?httpAccept=%2A%2F%2A",
            "@multimediatype": "Scalable Vector Graphics file",
            "@type": "ALTIMG",
            "@size": "4744",
            "@ref": "si65",
            "@mimetype": "image/svg+xml"
        },
        {
            "@category": "thumbnail",
            "@_fa": "true",
            "$": "https://api.elsevier.com/content/object/eid/1-s2.0-S0378778822007654-si66.svg?httpAccept=%2A%2F%2A",
            "@multimediatype": "Scalable Vector Graphics file",
            "@type": "ALTIMG",
            "@size": "4729",
            "@ref": "si66",
            "@mimetype": "image/svg+xml"
        },
        {
            "@category": "thumbnail",
            "@_fa": "true",
            "$": "https://api.elsevier.com/content/object/eid/1-s2.0-S0378778822007654-si67.svg?httpAccept=%2A%2F%2A",
            "@multimediatype": "Scalable Vector Graphics file",
            "@type": "ALTIMG",
            "@size": "5014",
            "@ref": "si67",
            "@mimetype": "image/svg+xml"
        },
        {
            "@category": "thumbnail",
            "@_fa": "true",
            "$": "https://api.elsevier.com/content/object/eid/1-s2.0-S0378778822007654-si68.svg?httpAccept=%2A%2F%2A",
            "@multimediatype": "Scalable Vector Graphics file",
            "@type": "ALTIMG",
            "@size": "27429",
            "@ref": "si68",
            "@mimetype": "image/svg+xml"
        },
        {
            "@category": "thumbnail",
            "@_fa": "true",
            "$": "https://api.elsevier.com/content/object/eid/1-s2.0-S0378778822007654-si69.svg?httpAccept=%2A%2F%2A",
            "@multimediatype": "Scalable Vector Graphics file",
            "@type": "ALTIMG",
            "@size": "16359",
            "@ref": "si69",
            "@mimetype": "image/svg+xml"
        },
        {
            "@category": "thumbnail",
            "@_fa": "true",
            "$": "https://api.elsevier.com/content/object/eid/1-s2.0-S0378778822007654-si7.svg?httpAccept=%2A%2F%2A",
            "@multimediatype": "Scalable Vector Graphics file",
            "@type": "ALTIMG",
            "@size": "6856",
            "@ref": "si7",
            "@mimetype": "image/svg+xml"
        },
        {
            "@category": "thumbnail",
            "@_fa": "true",
            "$": "https://api.elsevier.com/content/object/eid/1-s2.0-S0378778822007654-si70.svg?httpAccept=%2A%2F%2A",
            "@multimediatype": "Scalable Vector Graphics file",
            "@type": "ALTIMG",
            "@size": "14780",
            "@ref": "si70",
            "@mimetype": "image/svg+xml"
        },
        {
            "@category": "thumbnail",
            "@_fa": "true",
            "$": "https://api.elsevier.com/content/object/eid/1-s2.0-S0378778822007654-si71.svg?httpAccept=%2A%2F%2A",
            "@multimediatype": "Scalable Vector Graphics file",
            "@type": "ALTIMG",
            "@size": "5284",
            "@ref": "si71",
            "@mimetype": "image/svg+xml"
        },
        {
            "@category": "thumbnail",
            "@_fa": "true",
            "$": "https://api.elsevier.com/content/object/eid/1-s2.0-S0378778822007654-si72.svg?httpAccept=%2A%2F%2A",
            "@multimediatype": "Scalable Vector Graphics file",
            "@type": "ALTIMG",
            "@size": "5349",
            "@ref": "si72",
            "@mimetype": "image/svg+xml"
        },
        {
            "@category": "thumbnail",
            "@_fa": "true",
            "$": "https://api.elsevier.com/content/object/eid/1-s2.0-S0378778822007654-si73.svg?httpAccept=%2A%2F%2A",
            "@multimediatype": "Scalable Vector Graphics file",
            "@type": "ALTIMG",
            "@size": "7038",
            "@ref": "si73",
            "@mimetype": "image/svg+xml"
        },
        {
            "@category": "thumbnail",
            "@_fa": "true",
            "$": "https://api.elsevier.com/content/object/eid/1-s2.0-S0378778822007654-si74.svg?httpAccept=%2A%2F%2A",
            "@multimediatype": "Scalable Vector Graphics file",
            "@type": "ALTIMG",
            "@size": "5855",
            "@ref": "si74",
            "@mimetype": "image/svg+xml"
        },
        {
            "@category": "thumbnail",
            "@_fa": "true",
            "$": "https://api.elsevier.com/content/object/eid/1-s2.0-S0378778822007654-si75.svg?httpAccept=%2A%2F%2A",
            "@multimediatype": "Scalable Vector Graphics file",
            "@type": "ALTIMG",
            "@size": "5841",
            "@ref": "si75",
            "@mimetype": "image/svg+xml"
        },
        {
            "@category": "thumbnail",
            "@_fa": "true",
            "$": "https://api.elsevier.com/content/object/eid/1-s2.0-S0378778822007654-si76.svg?httpAccept=%2A%2F%2A",
            "@multimediatype": "Scalable Vector Graphics file",
            "@type": "ALTIMG",
            "@size": "5971",
            "@ref": "si76",
            "@mimetype": "image/svg+xml"
        },
        {
            "@category": "thumbnail",
            "@_fa": "true",
            "$": "https://api.elsevier.com/content/object/eid/1-s2.0-S0378778822007654-si77.svg?httpAccept=%2A%2F%2A",
            "@multimediatype": "Scalable Vector Graphics file",
            "@type": "ALTIMG",
            "@size": "27813",
            "@ref": "si77",
            "@mimetype": "image/svg+xml"
        },
        {
            "@category": "thumbnail",
            "@_fa": "true",
            "$": "https://api.elsevier.com/content/object/eid/1-s2.0-S0378778822007654-si78.svg?httpAccept=%2A%2F%2A",
            "@multimediatype": "Scalable Vector Graphics file",
            "@type": "ALTIMG",
            "@size": "25502",
            "@ref": "si78",
            "@mimetype": "image/svg+xml"
        },
        {
            "@category": "thumbnail",
            "@_fa": "true",
            "$": "https://api.elsevier.com/content/object/eid/1-s2.0-S0378778822007654-si79.svg?httpAccept=%2A%2F%2A",
            "@multimediatype": "Scalable Vector Graphics file",
            "@type": "ALTIMG",
            "@size": "25024",
            "@ref": "si79",
            "@mimetype": "image/svg+xml"
        },
        {
            "@category": "thumbnail",
            "@_fa": "true",
            "$": "https://api.elsevier.com/content/object/eid/1-s2.0-S0378778822007654-si8.svg?httpAccept=%2A%2F%2A",
            "@multimediatype": "Scalable Vector Graphics file",
            "@type": "ALTIMG",
            "@size": "7585",
            "@ref": "si8",
            "@mimetype": "image/svg+xml"
        },
        {
            "@category": "thumbnail",
            "@_fa": "true",
            "$": "https://api.elsevier.com/content/object/eid/1-s2.0-S0378778822007654-si80.svg?httpAccept=%2A%2F%2A",
            "@multimediatype": "Scalable Vector Graphics file",
            "@type": "ALTIMG",
            "@size": "25020",
            "@ref": "si80",
            "@mimetype": "image/svg+xml"
        },
        {
            "@category": "thumbnail",
            "@_fa": "true",
            "$": "https://api.elsevier.com/content/object/eid/1-s2.0-S0378778822007654-si81.svg?httpAccept=%2A%2F%2A",
            "@multimediatype": "Scalable Vector Graphics file",
            "@type": "ALTIMG",
            "@size": "6966",
            "@ref": "si81",
            "@mimetype": "image/svg+xml"
        },
        {
            "@category": "thumbnail",
            "@_fa": "true",
            "$": "https://api.elsevier.com/content/object/eid/1-s2.0-S0378778822007654-si82.svg?httpAccept=%2A%2F%2A",
            "@multimediatype": "Scalable Vector Graphics file",
            "@type": "ALTIMG",
            "@size": "6740",
            "@ref": "si82",
            "@mimetype": "image/svg+xml"
        },
        {
            "@category": "thumbnail",
            "@_fa": "true",
            "$": "https://api.elsevier.com/content/object/eid/1-s2.0-S0378778822007654-si83.svg?httpAccept=%2A%2F%2A",
            "@multimediatype": "Scalable Vector Graphics file",
            "@type": "ALTIMG",
            "@size": "6954",
            "@ref": "si83",
            "@mimetype": "image/svg+xml"
        },
        {
            "@category": "thumbnail",
            "@_fa": "true",
            "$": "https://api.elsevier.com/content/object/eid/1-s2.0-S0378778822007654-si84.svg?httpAccept=%2A%2F%2A",
            "@multimediatype": "Scalable Vector Graphics file",
            "@type": "ALTIMG",
            "@size": "6764",
            "@ref": "si84",
            "@mimetype": "image/svg+xml"
        },
        {
            "@category": "thumbnail",
            "@_fa": "true",
            "$": "https://api.elsevier.com/content/object/eid/1-s2.0-S0378778822007654-si85.svg?httpAccept=%2A%2F%2A",
            "@multimediatype": "Scalable Vector Graphics file",
            "@type": "ALTIMG",
            "@size": "6062",
            "@ref": "si85",
            "@mimetype": "image/svg+xml"
        },
        {
            "@category": "thumbnail",
            "@_fa": "true",
            "$": "https://api.elsevier.com/content/object/eid/1-s2.0-S0378778822007654-si86.svg?httpAccept=%2A%2F%2A",
            "@multimediatype": "Scalable Vector Graphics file",
            "@type": "ALTIMG",
            "@size": "5843",
            "@ref": "si86",
            "@mimetype": "image/svg+xml"
        },
        {
            "@category": "thumbnail",
            "@_fa": "true",
            "$": "https://api.elsevier.com/content/object/eid/1-s2.0-S0378778822007654-si87.svg?httpAccept=%2A%2F%2A",
            "@multimediatype": "Scalable Vector Graphics file",
            "@type": "ALTIMG",
            "@size": "6053",
            "@ref": "si87",
            "@mimetype": "image/svg+xml"
        },
        {
            "@category": "thumbnail",
            "@_fa": "true",
            "$": "https://api.elsevier.com/content/object/eid/1-s2.0-S0378778822007654-si88.svg?httpAccept=%2A%2F%2A",
            "@multimediatype": "Scalable Vector Graphics file",
            "@type": "ALTIMG",
            "@size": "8299",
            "@ref": "si88",
            "@mimetype": "image/svg+xml"
        },
        {
            "@category": "thumbnail",
            "@_fa": "true",
            "$": "https://api.elsevier.com/content/object/eid/1-s2.0-S0378778822007654-si89.svg?httpAccept=%2A%2F%2A",
            "@multimediatype": "Scalable Vector Graphics file",
            "@type": "ALTIMG",
            "@size": "8080",
            "@ref": "si89",
            "@mimetype": "image/svg+xml"
        },
        {
            "@category": "thumbnail",
            "@_fa": "true",
            "$": "https://api.elsevier.com/content/object/eid/1-s2.0-S0378778822007654-si9.svg?httpAccept=%2A%2F%2A",
            "@multimediatype": "Scalable Vector Graphics file",
            "@type": "ALTIMG",
            "@size": "9858",
            "@ref": "si9",
            "@mimetype": "image/svg+xml"
        },
        {
            "@category": "thumbnail",
            "@_fa": "true",
            "$": "https://api.elsevier.com/content/object/eid/1-s2.0-S0378778822007654-si90.svg?httpAccept=%2A%2F%2A",
            "@multimediatype": "Scalable Vector Graphics file",
            "@type": "ALTIMG",
            "@size": "7354",
            "@ref": "si90",
            "@mimetype": "image/svg+xml"
        },
        {
            "@category": "thumbnail",
            "@_fa": "true",
            "$": "https://api.elsevier.com/content/object/eid/1-s2.0-S0378778822007654-si91.svg?httpAccept=%2A%2F%2A",
            "@multimediatype": "Scalable Vector Graphics file",
            "@type": "ALTIMG",
            "@size": "8095",
            "@ref": "si91",
            "@mimetype": "image/svg+xml"
        },
        {
            "@category": "thumbnail",
            "@_fa": "true",
            "$": "https://api.elsevier.com/content/object/eid/1-s2.0-S0378778822007654-si92.svg?httpAccept=%2A%2F%2A",
            "@multimediatype": "Scalable Vector Graphics file",
            "@type": "ALTIMG",
            "@size": "3886",
            "@ref": "si92",
            "@mimetype": "image/svg+xml"
        },
        {
            "@category": "thumbnail",
            "@_fa": "true",
            "$": "https://api.elsevier.com/content/object/eid/1-s2.0-S0378778822007654-si93.svg?httpAccept=%2A%2F%2A",
            "@multimediatype": "Scalable Vector Graphics file",
            "@type": "ALTIMG",
            "@size": "3672",
            "@ref": "si93",
            "@mimetype": "image/svg+xml"
        },
        {
            "@category": "thumbnail",
            "@_fa": "true",
            "$": "https://api.elsevier.com/content/object/eid/1-s2.0-S0378778822007654-si94.svg?httpAccept=%2A%2F%2A",
            "@multimediatype": "Scalable Vector Graphics file",
            "@type": "ALTIMG",
            "@size": "3877",
            "@ref": "si94",
            "@mimetype": "image/svg+xml"
        },
        {
            "@category": "thumbnail",
            "@_fa": "true",
            "$": "https://api.elsevier.com/content/object/eid/1-s2.0-S0378778822007654-si95.svg?httpAccept=%2A%2F%2A",
            "@multimediatype": "Scalable Vector Graphics file",
            "@type": "ALTIMG",
            "@size": "3684",
            "@ref": "si95",
            "@mimetype": "image/svg+xml"
        },
        {
            "@category": "thumbnail",
            "@_fa": "true",
            "$": "https://api.elsevier.com/content/object/eid/1-s2.0-S0378778822007654-si96.svg?httpAccept=%2A%2F%2A",
            "@multimediatype": "Scalable Vector Graphics file",
            "@type": "ALTIMG",
            "@size": "4299",
            "@ref": "si96",
            "@mimetype": "image/svg+xml"
        },
        {
            "@category": "thumbnail",
            "@_fa": "true",
            "$": "https://api.elsevier.com/content/object/eid/1-s2.0-S0378778822007654-si97.svg?httpAccept=%2A%2F%2A",
            "@multimediatype": "Scalable Vector Graphics file",
            "@type": "ALTIMG",
            "@size": "27766",
            "@ref": "si97",
            "@mimetype": "image/svg+xml"
        },
        {
            "@category": "thumbnail",
            "@_fa": "true",
            "$": "https://api.elsevier.com/content/object/eid/1-s2.0-S0378778822007654-si98.svg?httpAccept=%2A%2F%2A",
            "@multimediatype": "Scalable Vector Graphics file",
            "@type": "ALTIMG",
            "@size": "26521",
            "@ref": "si98",
            "@mimetype": "image/svg+xml"
        },
        {
            "@category": "thumbnail",
            "@_fa": "true",
            "$": "https://api.elsevier.com/content/object/eid/1-s2.0-S0378778822007654-si99.svg?httpAccept=%2A%2F%2A",
            "@multimediatype": "Scalable Vector Graphics file",
            "@type": "ALTIMG",
            "@size": "26043",
            "@ref": "si99",
            "@mimetype": "image/svg+xml"
        },
        {
            "@category": "standard",
            "@_fa": "true",
            "$": "https://api.elsevier.com/content/object/eid/1-s2.0-S0378778822007654-am.pdf?httpAccept=%2A%2F%2A",
            "@multimediatype": "Acrobat PDF file",
            "@type": "AAM-PDF",
            "@size": "757197",
            "@ref": "am",
            "@mimetype": "application/pdf"
        }
    ]},
    "link": {
        "@rel": "abstract",
        "@href": "https://api.elsevier.com/content/abstract/scopus_id/85141509038"
    }
}}