{"full-text-retrieval-response": {
    "scopus-eid": "2-s2.0-85076240515",
    "originalText": "serial JL 271429 291210 291702 291731 291787 291877 291878 291881 31 Applied Energy APPLIEDENERGY 2019-12-07 2019-12-07 2020-01-10 2020-01-10 2022-04-25T21:01:19 1-s2.0-S0306261919318616 S0306-2619(19)31861-6 S0306261919318616 10.1016/j.apenergy.2019.114174 S300 S300.8 FULL-TEXT 1-s2.0-S0306261919X00240 2024-01-01T13:21:55.590316Z 0 0 20200201 2020 2019-12-07T03:23:14.295994Z articleinfo articlenumber articletitlenorm authfirstinitialnorm authfirstsurnamenorm cid cids contenttype copyright crossmark dateloaded dateloadedtxt datesearch datesort dateupdated dco docsubtype doctype doi eid ewtransactionid hubeid indexeddate issn issnnorm itemstage itemtransactionid itemweight openaccess openarchive pg pgfirst pii piinorm pubdatestart pubdatetxt pubyr sortorder srctitle srctitlenorm srctype ssids alllist content subj subheadings suppl tomb volfirst volissue volumelist webpdf webpdfpagecount yearnav figure table body mmlmath acknowledge affil articletitle auth authfirstini authfull authkeywords authlast grantnumber grantsponsor grantsponsorid highlightsabst nomenclature orcid primabst ref 0306-2619 03062619 true 259 259 C Volume 259 48 114174 114174 114174 20200201 1 February 2020 2020-02-01 2020 article fla © 2019 Elsevier Ltd. All rights reserved. DYNAMICMODELINGECONOMICMODELPREDICTIVECONTROLALIQUIDDESICCANTAIRCONDITIONING JIANG Y Nomenclature 1 Introduction 2 Energy consumption model of the dehumidifier 3 ANFIS predictive model development for the dehumidifier 4 Model validation of ANFIS model 5 Prescription of control schemes 5.1 Objective function 5.2 Constraints 5.3 Genetic solver of the optimization function 6 Simulation analysis and discussions 6.1 Case study 6.2 Energy efficiency analysis 7 Conclusion Acknowledgments References QI 2019 96 106 R WANG 2019 1 12 X CUI 2016 303 312 X KIM 2015 717 726 M CHUA 2015 703 716 K WANG 2016 289 301 L ANGRISANI 2015 533 545 G DAS 2015 1 11 R GE 2011 4180 4190 G NAIK 2018 1 13 B PENG 2017 212 226 D XIE 2016 1270 1276 Y LANGROUDI 2014 2975 2983 L WANG 2013 449 455 X PARK 2016 447 454 J WANG 2017 410 423 X OU 2019 21 32 X TU 2017 767 781 M OU 2018 375 385 X PENG 2009 3599 3607 S NAMVAR 2013 757 771 R LI 2016 435 445 X WANG 2017 418 429 L MOHAMMAD 2016 250 258 A XIAO 2011 143 149 F SHI 2017 267 276 J RUANO 2016 371 376 A RAZMARA 2015 555 565 M BIANCHINI 2019 327 340 G YAO 2010 570 583 Y NADERLOO 2017 56 64 L MOSTAFAEI 2016 626 636 M ZENDEHBOUDI 2017 1023 1035 A PREGLEJ 2014 520 533 A WU 2016 215 226 Q JIANGX2020X114174 JIANGX2020X114174XY 2022-01-10T00:00:00.000Z 2022-01-10T00:00:00.000Z http://creativecommons.org/licenses/by-nc-nd/4.0/ © 2019 Elsevier Ltd. All rights reserved. 0 item S0306-2619(19)31861-6 S0306261919318616 1-s2.0-S0306261919318616 10.1016/j.apenergy.2019.114174 271429 2024-01-01T13:21:55.590316Z 2020-02-01 1-s2.0-S0306261919318616-main.pdf https://s3-eu-west-1.amazonaws.com/prod-ucs-content-store-eu-west/content/pii:S0306261919318616/MAIN/application/pdf/3ee1b009e07cbc036d1912617298030d/main.pdf main.pdf pdf true 8417551 MAIN 14 1-s2.0-S0306261919318616-main_1.png https://s3-eu-west-1.amazonaws.com/prod-ucs-content-store-eu-west/content/pii:S0306261919318616/PREVIEW/image/png/cfd5eb30eb1c7c65bf30a718b6180383/main_1.png main_1.png png 47359 849 656 IMAGE-WEB-PDF 1 1-s2.0-S0306261919318616-gr1.jpg https://s3-eu-west-1.amazonaws.com/prod-ucs-content-store-eu-west/content/pii:S0306261919318616/gr1/DOWNSAMPLED/image/jpeg/0b9d17e1a211e37ec33500f1b13b57a5/gr1.jpg gr1 gr1.jpg jpg 29057 215 622 IMAGE-DOWNSAMPLED 1-s2.0-S0306261919318616-gr10.jpg https://s3-eu-west-1.amazonaws.com/prod-ucs-content-store-eu-west/content/pii:S0306261919318616/gr10/DOWNSAMPLED/image/jpeg/3c0d43aca105e7c4ebcaca80e09911aa/gr10.jpg gr10 gr10.jpg jpg 32366 322 706 IMAGE-DOWNSAMPLED 1-s2.0-S0306261919318616-gr11.jpg https://s3-eu-west-1.amazonaws.com/prod-ucs-content-store-eu-west/content/pii:S0306261919318616/gr11/DOWNSAMPLED/image/jpeg/bd69c89133700df6db5cb4be69576e4d/gr11.jpg gr11 gr11.jpg jpg 34719 281 350 IMAGE-DOWNSAMPLED 1-s2.0-S0306261919318616-gr12.jpg https://s3-eu-west-1.amazonaws.com/prod-ucs-content-store-eu-west/content/pii:S0306261919318616/gr12/DOWNSAMPLED/image/jpeg/fc77a8c899b47b4dd2ad6feac6588f96/gr12.jpg gr12 gr12.jpg jpg 33676 406 574 IMAGE-DOWNSAMPLED 1-s2.0-S0306261919318616-gr13.jpg https://s3-eu-west-1.amazonaws.com/prod-ucs-content-store-eu-west/content/pii:S0306261919318616/gr13/DOWNSAMPLED/image/jpeg/a97db41df5b37487c54358a92bcf3de1/gr13.jpg gr13 gr13.jpg jpg 15998 226 575 IMAGE-DOWNSAMPLED 1-s2.0-S0306261919318616-gr14.jpg https://s3-eu-west-1.amazonaws.com/prod-ucs-content-store-eu-west/content/pii:S0306261919318616/gr14/DOWNSAMPLED/image/jpeg/c3c48a14d61676e953c743ea411bb555/gr14.jpg gr14 gr14.jpg jpg 44537 436 613 IMAGE-DOWNSAMPLED 1-s2.0-S0306261919318616-gr15.jpg https://s3-eu-west-1.amazonaws.com/prod-ucs-content-store-eu-west/content/pii:S0306261919318616/gr15/DOWNSAMPLED/image/jpeg/4c994b0e7406279761def97a611738d3/gr15.jpg gr15 gr15.jpg jpg 41467 454 615 IMAGE-DOWNSAMPLED 1-s2.0-S0306261919318616-gr2.jpg https://s3-eu-west-1.amazonaws.com/prod-ucs-content-store-eu-west/content/pii:S0306261919318616/gr2/DOWNSAMPLED/image/jpeg/8b94f8710a3756661af1b8d017d75e71/gr2.jpg gr2 gr2.jpg jpg 26998 336 556 IMAGE-DOWNSAMPLED 1-s2.0-S0306261919318616-gr3.jpg https://s3-eu-west-1.amazonaws.com/prod-ucs-content-store-eu-west/content/pii:S0306261919318616/gr3/DOWNSAMPLED/image/jpeg/e4367b43c48d9113ee9bb47fb6f802d1/gr3.jpg gr3 gr3.jpg jpg 67235 416 555 IMAGE-DOWNSAMPLED 1-s2.0-S0306261919318616-gr4.jpg https://s3-eu-west-1.amazonaws.com/prod-ucs-content-store-eu-west/content/pii:S0306261919318616/gr4/DOWNSAMPLED/image/jpeg/5f6f7548af7d6da2e17e653e5d55855a/gr4.jpg gr4 gr4.jpg jpg 34633 371 598 IMAGE-DOWNSAMPLED 1-s2.0-S0306261919318616-gr5.jpg https://s3-eu-west-1.amazonaws.com/prod-ucs-content-store-eu-west/content/pii:S0306261919318616/gr5/DOWNSAMPLED/image/jpeg/e84a01b485495032957209cb8a76ef49/gr5.jpg gr5 gr5.jpg jpg 40258 417 576 IMAGE-DOWNSAMPLED 1-s2.0-S0306261919318616-gr6.jpg https://s3-eu-west-1.amazonaws.com/prod-ucs-content-store-eu-west/content/pii:S0306261919318616/gr6/DOWNSAMPLED/image/jpeg/b0221dde8b55c924c73e04b0e545ddbe/gr6.jpg gr6 gr6.jpg jpg 57538 511 572 IMAGE-DOWNSAMPLED 1-s2.0-S0306261919318616-gr7.jpg https://s3-eu-west-1.amazonaws.com/prod-ucs-content-store-eu-west/content/pii:S0306261919318616/gr7/DOWNSAMPLED/image/jpeg/f94270027d56f183b20c9602d7f8992d/gr7.jpg gr7 gr7.jpg jpg 29167 295 616 IMAGE-DOWNSAMPLED 1-s2.0-S0306261919318616-gr8.jpg https://s3-eu-west-1.amazonaws.com/prod-ucs-content-store-eu-west/content/pii:S0306261919318616/gr8/DOWNSAMPLED/image/jpeg/706501b8b8abb6ba91839807843ecd4d/gr8.jpg gr8 gr8.jpg jpg 71920 559 666 IMAGE-DOWNSAMPLED 1-s2.0-S0306261919318616-gr9.jpg https://s3-eu-west-1.amazonaws.com/prod-ucs-content-store-eu-west/content/pii:S0306261919318616/gr9/DOWNSAMPLED/image/jpeg/f4c69e8159e93a79f22e0d33460bc67f/gr9.jpg gr9 gr9.jpg jpg 43281 446 616 IMAGE-DOWNSAMPLED 1-s2.0-S0306261919318616-gr1.sml https://s3-eu-west-1.amazonaws.com/prod-ucs-content-store-eu-west/content/pii:S0306261919318616/gr1/THUMBNAIL/image/gif/b834a359da60f7a9b4b3f200a8980ca1/gr1.sml gr1 gr1.sml sml 5356 76 219 IMAGE-THUMBNAIL 1-s2.0-S0306261919318616-gr10.sml https://s3-eu-west-1.amazonaws.com/prod-ucs-content-store-eu-west/content/pii:S0306261919318616/gr10/THUMBNAIL/image/gif/e8d19921a3038e1904b535ea3740a8db/gr10.sml gr10 gr10.sml sml 4364 100 219 IMAGE-THUMBNAIL 1-s2.0-S0306261919318616-gr11.sml https://s3-eu-west-1.amazonaws.com/prod-ucs-content-store-eu-west/content/pii:S0306261919318616/gr11/THUMBNAIL/image/gif/e361e5446f5b85a5d48ffea862610110/gr11.sml gr11 gr11.sml sml 17912 164 204 IMAGE-THUMBNAIL 1-s2.0-S0306261919318616-gr12.sml https://s3-eu-west-1.amazonaws.com/prod-ucs-content-store-eu-west/content/pii:S0306261919318616/gr12/THUMBNAIL/image/gif/a2f5091884998b01abd9f1cf23f4c180/gr12.sml gr12 gr12.sml sml 5974 155 219 IMAGE-THUMBNAIL 1-s2.0-S0306261919318616-gr13.sml https://s3-eu-west-1.amazonaws.com/prod-ucs-content-store-eu-west/content/pii:S0306261919318616/gr13/THUMBNAIL/image/gif/012326ea171101cac4cf1090d8064e89/gr13.sml gr13 gr13.sml sml 3142 86 219 IMAGE-THUMBNAIL 1-s2.0-S0306261919318616-gr14.sml https://s3-eu-west-1.amazonaws.com/prod-ucs-content-store-eu-west/content/pii:S0306261919318616/gr14/THUMBNAIL/image/gif/bb6f5d363644fa95c2b8e79f1cf10860/gr14.sml gr14 gr14.sml sml 6533 156 219 IMAGE-THUMBNAIL 1-s2.0-S0306261919318616-gr15.sml https://s3-eu-west-1.amazonaws.com/prod-ucs-content-store-eu-west/content/pii:S0306261919318616/gr15/THUMBNAIL/image/gif/f329580721fefc1dcd4ff948cdd2b266/gr15.sml gr15 gr15.sml sml 6584 162 219 IMAGE-THUMBNAIL 1-s2.0-S0306261919318616-gr2.sml https://s3-eu-west-1.amazonaws.com/prod-ucs-content-store-eu-west/content/pii:S0306261919318616/gr2/THUMBNAIL/image/gif/6d22a920a0c7dcaf0c05985957c0f0b2/gr2.sml gr2 gr2.sml sml 4911 132 219 IMAGE-THUMBNAIL 1-s2.0-S0306261919318616-gr3.sml https://s3-eu-west-1.amazonaws.com/prod-ucs-content-store-eu-west/content/pii:S0306261919318616/gr3/THUMBNAIL/image/gif/73bd5f934e709eac67121973a45af918/gr3.sml gr3 gr3.sml sml 31327 164 219 IMAGE-THUMBNAIL 1-s2.0-S0306261919318616-gr4.sml https://s3-eu-west-1.amazonaws.com/prod-ucs-content-store-eu-west/content/pii:S0306261919318616/gr4/THUMBNAIL/image/gif/b6122e67b2f6904cdecd79ada0e6f431/gr4.sml gr4 gr4.sml sml 5566 136 219 IMAGE-THUMBNAIL 1-s2.0-S0306261919318616-gr5.sml https://s3-eu-west-1.amazonaws.com/prod-ucs-content-store-eu-west/content/pii:S0306261919318616/gr5/THUMBNAIL/image/gif/2d2140f97f1e25d4ce05cb6fbff1d937/gr5.sml gr5 gr5.sml sml 7148 159 219 IMAGE-THUMBNAIL 1-s2.0-S0306261919318616-gr6.sml https://s3-eu-west-1.amazonaws.com/prod-ucs-content-store-eu-west/content/pii:S0306261919318616/gr6/THUMBNAIL/image/gif/afc3ed2d94f12f6fa225b0f74dbb7007/gr6.sml gr6 gr6.sml sml 9631 163 183 IMAGE-THUMBNAIL 1-s2.0-S0306261919318616-gr7.sml https://s3-eu-west-1.amazonaws.com/prod-ucs-content-store-eu-west/content/pii:S0306261919318616/gr7/THUMBNAIL/image/gif/d0eb49c08ec2818f12b54258c8fba9dd/gr7.sml gr7 gr7.sml sml 4754 105 219 IMAGE-THUMBNAIL 1-s2.0-S0306261919318616-gr8.sml https://s3-eu-west-1.amazonaws.com/prod-ucs-content-store-eu-west/content/pii:S0306261919318616/gr8/THUMBNAIL/image/gif/d70bcd3ba5d958906fc14b80ff40056d/gr8.sml gr8 gr8.sml sml 9910 164 195 IMAGE-THUMBNAIL 1-s2.0-S0306261919318616-gr9.sml https://s3-eu-west-1.amazonaws.com/prod-ucs-content-store-eu-west/content/pii:S0306261919318616/gr9/THUMBNAIL/image/gif/d2fdf8502bcc4392ea94d2e563e3737b/gr9.sml gr9 gr9.sml sml 6877 159 219 IMAGE-THUMBNAIL 1-s2.0-S0306261919318616-gr1_lrg.jpg https://s3-eu-west-1.amazonaws.com/prod-ucs-content-store-eu-west/content/pii:S0306261919318616/gr1/HIGHRES/image/jpeg/519fa5d5d3f68e2422aadfb90ec6841b/gr1_lrg.jpg gr1 gr1_lrg.jpg jpg 175318 954 2756 IMAGE-HIGH-RES 1-s2.0-S0306261919318616-gr10_lrg.jpg https://s3-eu-west-1.amazonaws.com/prod-ucs-content-store-eu-west/content/pii:S0306261919318616/gr10/HIGHRES/image/jpeg/95cd00ac7ceb03f8006be3eef6be4029/gr10_lrg.jpg gr10 gr10_lrg.jpg jpg 178177 1424 3126 IMAGE-HIGH-RES 1-s2.0-S0306261919318616-gr11_lrg.jpg https://s3-eu-west-1.amazonaws.com/prod-ucs-content-store-eu-west/content/pii:S0306261919318616/gr11/HIGHRES/image/jpeg/93e50cf4c9c2a4b3fbcef21eeb6fe469/gr11_lrg.jpg gr11 gr11_lrg.jpg jpg 306354 1247 1553 IMAGE-HIGH-RES 1-s2.0-S0306261919318616-gr12_lrg.jpg https://s3-eu-west-1.amazonaws.com/prod-ucs-content-store-eu-west/content/pii:S0306261919318616/gr12/HIGHRES/image/jpeg/6dc5335a81200c31b9796e5f3427022a/gr12_lrg.jpg gr12 gr12_lrg.jpg jpg 193247 1798 2542 IMAGE-HIGH-RES 1-s2.0-S0306261919318616-gr13_lrg.jpg https://s3-eu-west-1.amazonaws.com/prod-ucs-content-store-eu-west/content/pii:S0306261919318616/gr13/HIGHRES/image/jpeg/8c95f791c0cf62a70e6fc6cf0dc462c7/gr13_lrg.jpg gr13 gr13_lrg.jpg jpg 101163 1002 2545 IMAGE-HIGH-RES 1-s2.0-S0306261919318616-gr14_lrg.jpg https://s3-eu-west-1.amazonaws.com/prod-ucs-content-store-eu-west/content/pii:S0306261919318616/gr14/HIGHRES/image/jpeg/80638291261c20e8ab32c64c931c91ac/gr14_lrg.jpg gr14 gr14_lrg.jpg jpg 217614 1930 2713 IMAGE-HIGH-RES 1-s2.0-S0306261919318616-gr15_lrg.jpg https://s3-eu-west-1.amazonaws.com/prod-ucs-content-store-eu-west/content/pii:S0306261919318616/gr15/HIGHRES/image/jpeg/cc766a3366b245c0bddabe6b2e956a2f/gr15_lrg.jpg gr15 gr15_lrg.jpg jpg 213023 2013 2724 IMAGE-HIGH-RES 1-s2.0-S0306261919318616-gr2_lrg.jpg https://s3-eu-west-1.amazonaws.com/prod-ucs-content-store-eu-west/content/pii:S0306261919318616/gr2/HIGHRES/image/jpeg/63c02ad0f565120b865894a2cbc7686a/gr2_lrg.jpg gr2 gr2_lrg.jpg jpg 151631 1488 2461 IMAGE-HIGH-RES 1-s2.0-S0306261919318616-gr3_lrg.jpg https://s3-eu-west-1.amazonaws.com/prod-ucs-content-store-eu-west/content/pii:S0306261919318616/gr3/HIGHRES/image/jpeg/bd73b462d88ed410049418e4b94549e4/gr3_lrg.jpg gr3 gr3_lrg.jpg jpg 200444 1107 1476 IMAGE-HIGH-RES 1-s2.0-S0306261919318616-gr4_lrg.jpg https://s3-eu-west-1.amazonaws.com/prod-ucs-content-store-eu-west/content/pii:S0306261919318616/gr4/HIGHRES/image/jpeg/158c0d765527e266e30ff6a68ea44151/gr4_lrg.jpg gr4 gr4_lrg.jpg jpg 200094 1642 2650 IMAGE-HIGH-RES 1-s2.0-S0306261919318616-gr5_lrg.jpg https://s3-eu-west-1.amazonaws.com/prod-ucs-content-store-eu-west/content/pii:S0306261919318616/gr5/HIGHRES/image/jpeg/4c997a61695da31db995b6b4a9703f70/gr5_lrg.jpg gr5 gr5_lrg.jpg jpg 222774 1849 2552 IMAGE-HIGH-RES 1-s2.0-S0306261919318616-gr6_lrg.jpg https://s3-eu-west-1.amazonaws.com/prod-ucs-content-store-eu-west/content/pii:S0306261919318616/gr6/HIGHRES/image/jpeg/e974b9879034a64f901f36216de4aff2/gr6_lrg.jpg gr6 gr6_lrg.jpg jpg 362493 2261 2532 IMAGE-HIGH-RES 1-s2.0-S0306261919318616-gr7_lrg.jpg https://s3-eu-west-1.amazonaws.com/prod-ucs-content-store-eu-west/content/pii:S0306261919318616/gr7/HIGHRES/image/jpeg/f66e164b15e36a9a2acfac0f65e968ff/gr7_lrg.jpg gr7 gr7_lrg.jpg jpg 177588 1308 2728 IMAGE-HIGH-RES 1-s2.0-S0306261919318616-gr8_lrg.jpg https://s3-eu-west-1.amazonaws.com/prod-ucs-content-store-eu-west/content/pii:S0306261919318616/gr8/HIGHRES/image/jpeg/1ba70c47a14d35584270636cb2cba924/gr8_lrg.jpg gr8 gr8_lrg.jpg jpg 383269 2477 2949 IMAGE-HIGH-RES 1-s2.0-S0306261919318616-gr9_lrg.jpg https://s3-eu-west-1.amazonaws.com/prod-ucs-content-store-eu-west/content/pii:S0306261919318616/gr9/HIGHRES/image/jpeg/372a897cac4790158400920c7ad56fbc/gr9_lrg.jpg gr9 gr9_lrg.jpg jpg 227876 1976 2727 IMAGE-HIGH-RES 1-s2.0-S0306261919318616-si1.svg https://s3-eu-west-1.amazonaws.com/prod-ucs-content-store-eu-west/content/pii:S0306261919318616/STRIPIN/image/svg+xml/7a166bed916f780b8346cac4520daa8a/si1.svg si1 si1.svg svg 10956 ALTIMG 1-s2.0-S0306261919318616-si10.svg https://s3-eu-west-1.amazonaws.com/prod-ucs-content-store-eu-west/content/pii:S0306261919318616/STRIPIN/image/svg+xml/f61865dc1694c899c57de622b27bf76a/si10.svg si10 si10.svg svg 5396 ALTIMG 1-s2.0-S0306261919318616-si100.svg https://s3-eu-west-1.amazonaws.com/prod-ucs-content-store-eu-west/content/pii:S0306261919318616/STRIPIN/image/svg+xml/f47f012ba1ca8c161d151fe0961ea9fd/si100.svg si100 si100.svg svg 20156 ALTIMG 1-s2.0-S0306261919318616-si101.svg https://s3-eu-west-1.amazonaws.com/prod-ucs-content-store-eu-west/content/pii:S0306261919318616/STRIPIN/image/svg+xml/c03d7765d7acb0f44a989e55f8bbfeb3/si101.svg si101 si101.svg svg 18779 ALTIMG 1-s2.0-S0306261919318616-si102.svg https://s3-eu-west-1.amazonaws.com/prod-ucs-content-store-eu-west/content/pii:S0306261919318616/STRIPIN/image/svg+xml/2177b6bd753b45890e96ccb2cf486273/si102.svg si102 si102.svg svg 18141 ALTIMG 1-s2.0-S0306261919318616-si103.svg https://s3-eu-west-1.amazonaws.com/prod-ucs-content-store-eu-west/content/pii:S0306261919318616/STRIPIN/image/svg+xml/b61bb07d10430a1cbe169d5441ae42a6/si103.svg si103 si103.svg svg 16810 ALTIMG 1-s2.0-S0306261919318616-si104.svg https://s3-eu-west-1.amazonaws.com/prod-ucs-content-store-eu-west/content/pii:S0306261919318616/STRIPIN/image/svg+xml/2f628022d63332e5b478dfb5dafaaebc/si104.svg si104 si104.svg svg 17096 ALTIMG 1-s2.0-S0306261919318616-si105.svg https://s3-eu-west-1.amazonaws.com/prod-ucs-content-store-eu-west/content/pii:S0306261919318616/STRIPIN/image/svg+xml/77ce20fb3fe967cd6fcaee1a79dc1382/si105.svg si105 si105.svg svg 3880 ALTIMG 1-s2.0-S0306261919318616-si106.svg https://s3-eu-west-1.amazonaws.com/prod-ucs-content-store-eu-west/content/pii:S0306261919318616/STRIPIN/image/svg+xml/6639b9e62b9c31486ec9580e0962f7e6/si106.svg si106 si106.svg svg 1569 ALTIMG 1-s2.0-S0306261919318616-si107.svg https://s3-eu-west-1.amazonaws.com/prod-ucs-content-store-eu-west/content/pii:S0306261919318616/STRIPIN/image/svg+xml/4e50ac773e62e3223012b3b147b640e5/si107.svg si107 si107.svg svg 8112 ALTIMG 1-s2.0-S0306261919318616-si108.svg https://s3-eu-west-1.amazonaws.com/prod-ucs-content-store-eu-west/content/pii:S0306261919318616/STRIPIN/image/svg+xml/83f5192a28f0d8383e3037e87a65404c/si108.svg si108 si108.svg svg 1708 ALTIMG 1-s2.0-S0306261919318616-si109.svg https://s3-eu-west-1.amazonaws.com/prod-ucs-content-store-eu-west/content/pii:S0306261919318616/STRIPIN/image/svg+xml/4fb3c02c544f2a96f4ba458eec9a25e8/si109.svg si109 si109.svg svg 17883 ALTIMG 1-s2.0-S0306261919318616-si11.svg https://s3-eu-west-1.amazonaws.com/prod-ucs-content-store-eu-west/content/pii:S0306261919318616/STRIPIN/image/svg+xml/9b711be9d4c3e21c8c3cebcedbe8f9d8/si11.svg si11 si11.svg svg 8006 ALTIMG 1-s2.0-S0306261919318616-si110.svg https://s3-eu-west-1.amazonaws.com/prod-ucs-content-store-eu-west/content/pii:S0306261919318616/STRIPIN/image/svg+xml/04adba0da98365a5c2752a903657a73c/si110.svg si110 si110.svg svg 18237 ALTIMG 1-s2.0-S0306261919318616-si111.svg https://s3-eu-west-1.amazonaws.com/prod-ucs-content-store-eu-west/content/pii:S0306261919318616/STRIPIN/image/svg+xml/96503b1d6dfc30c4651ecde3e04b580f/si111.svg si111 si111.svg svg 18161 ALTIMG 1-s2.0-S0306261919318616-si112.svg https://s3-eu-west-1.amazonaws.com/prod-ucs-content-store-eu-west/content/pii:S0306261919318616/STRIPIN/image/svg+xml/cf57ca0a8d541b86624ba3dda59710bc/si112.svg si112 si112.svg svg 22324 ALTIMG 1-s2.0-S0306261919318616-si113.svg https://s3-eu-west-1.amazonaws.com/prod-ucs-content-store-eu-west/content/pii:S0306261919318616/STRIPIN/image/svg+xml/b2b3aea1845c518f68fe914242d06ecc/si113.svg si113 si113.svg svg 20294 ALTIMG 1-s2.0-S0306261919318616-si114.svg https://s3-eu-west-1.amazonaws.com/prod-ucs-content-store-eu-west/content/pii:S0306261919318616/STRIPIN/image/svg+xml/33d10e87104d1aa531279bbcfd413a64/si114.svg si114 si114.svg svg 20936 ALTIMG 1-s2.0-S0306261919318616-si115.svg https://s3-eu-west-1.amazonaws.com/prod-ucs-content-store-eu-west/content/pii:S0306261919318616/STRIPIN/image/svg+xml/727e7d36b0b396650142a23a91e6eb19/si115.svg si115 si115.svg svg 1377 ALTIMG 1-s2.0-S0306261919318616-si116.svg https://s3-eu-west-1.amazonaws.com/prod-ucs-content-store-eu-west/content/pii:S0306261919318616/STRIPIN/image/svg+xml/7d6c1ffe048f0d9d8f8d6a9680ce3971/si116.svg si116 si116.svg svg 56928 ALTIMG 1-s2.0-S0306261919318616-si117.svg https://s3-eu-west-1.amazonaws.com/prod-ucs-content-store-eu-west/content/pii:S0306261919318616/STRIPIN/image/svg+xml/55fc9e19abcef7f373bbfdeaa2a4bb4a/si117.svg si117 si117.svg svg 7477 ALTIMG 1-s2.0-S0306261919318616-si118.svg https://s3-eu-west-1.amazonaws.com/prod-ucs-content-store-eu-west/content/pii:S0306261919318616/STRIPIN/image/svg+xml/d1b1be33263606d0a63fddc1b5f8dea6/si118.svg si118 si118.svg svg 9642 ALTIMG 1-s2.0-S0306261919318616-si119.svg https://s3-eu-west-1.amazonaws.com/prod-ucs-content-store-eu-west/content/pii:S0306261919318616/STRIPIN/image/svg+xml/f7392303ab5291779fe8c0306adf109f/si119.svg si119 si119.svg svg 8844 ALTIMG 1-s2.0-S0306261919318616-si12.svg https://s3-eu-west-1.amazonaws.com/prod-ucs-content-store-eu-west/content/pii:S0306261919318616/STRIPIN/image/svg+xml/3302204ca262a60f14d88fc67a28e255/si12.svg si12 si12.svg svg 6576 ALTIMG 1-s2.0-S0306261919318616-si120.svg https://s3-eu-west-1.amazonaws.com/prod-ucs-content-store-eu-west/content/pii:S0306261919318616/STRIPIN/image/svg+xml/6ea2b66686fb4570a769a4f28bf99f74/si120.svg si120 si120.svg svg 5094 ALTIMG 1-s2.0-S0306261919318616-si13.svg https://s3-eu-west-1.amazonaws.com/prod-ucs-content-store-eu-west/content/pii:S0306261919318616/STRIPIN/image/svg+xml/5c1994b3b5220edbd72691dbe28ce287/si13.svg si13 si13.svg svg 4629 ALTIMG 1-s2.0-S0306261919318616-si14.svg https://s3-eu-west-1.amazonaws.com/prod-ucs-content-store-eu-west/content/pii:S0306261919318616/STRIPIN/image/svg+xml/84caea34528636b16c1ec7a9de398541/si14.svg si14 si14.svg svg 8024 ALTIMG 1-s2.0-S0306261919318616-si15.svg https://s3-eu-west-1.amazonaws.com/prod-ucs-content-store-eu-west/content/pii:S0306261919318616/STRIPIN/image/svg+xml/75a85ac69274d802eaa2b2e248a770ff/si15.svg si15 si15.svg svg 9677 ALTIMG 1-s2.0-S0306261919318616-si16.svg https://s3-eu-west-1.amazonaws.com/prod-ucs-content-store-eu-west/content/pii:S0306261919318616/STRIPIN/image/svg+xml/8d48288c72696b8e5df034de6e1f3697/si16.svg si16 si16.svg svg 5825 ALTIMG 1-s2.0-S0306261919318616-si17.svg https://s3-eu-west-1.amazonaws.com/prod-ucs-content-store-eu-west/content/pii:S0306261919318616/STRIPIN/image/svg+xml/745941f323b1bca1df2648d383e77f33/si17.svg si17 si17.svg svg 3111 ALTIMG 1-s2.0-S0306261919318616-si18.svg https://s3-eu-west-1.amazonaws.com/prod-ucs-content-store-eu-west/content/pii:S0306261919318616/STRIPIN/image/svg+xml/8c0212ad74f1de24d962470a3e909c74/si18.svg si18 si18.svg svg 4098 ALTIMG 1-s2.0-S0306261919318616-si19.svg https://s3-eu-west-1.amazonaws.com/prod-ucs-content-store-eu-west/content/pii:S0306261919318616/STRIPIN/image/svg+xml/0b8f47ffcd9c2b1dc5058846df51b939/si19.svg si19 si19.svg svg 4261 ALTIMG 1-s2.0-S0306261919318616-si2.svg https://s3-eu-west-1.amazonaws.com/prod-ucs-content-store-eu-west/content/pii:S0306261919318616/STRIPIN/image/svg+xml/360f421d12c222cb1842b2045dbd226b/si2.svg si2 si2.svg svg 21533 ALTIMG 1-s2.0-S0306261919318616-si20.svg https://s3-eu-west-1.amazonaws.com/prod-ucs-content-store-eu-west/content/pii:S0306261919318616/STRIPIN/image/svg+xml/926d636305d4e3e9c1b9a5b73680ca49/si20.svg si20 si20.svg svg 2538 ALTIMG 1-s2.0-S0306261919318616-si21.svg https://s3-eu-west-1.amazonaws.com/prod-ucs-content-store-eu-west/content/pii:S0306261919318616/STRIPIN/image/svg+xml/723173a42d71d006ad8c337e4180dce6/si21.svg si21 si21.svg svg 6273 ALTIMG 1-s2.0-S0306261919318616-si22.svg https://s3-eu-west-1.amazonaws.com/prod-ucs-content-store-eu-west/content/pii:S0306261919318616/STRIPIN/image/svg+xml/748051a136f9e38d70ddbe4693619aab/si22.svg si22 si22.svg svg 10665 ALTIMG 1-s2.0-S0306261919318616-si23.svg https://s3-eu-west-1.amazonaws.com/prod-ucs-content-store-eu-west/content/pii:S0306261919318616/STRIPIN/image/svg+xml/b4e3c8d9dab0a9b24751487b981d6d76/si23.svg si23 si23.svg svg 5691 ALTIMG 1-s2.0-S0306261919318616-si24.svg https://s3-eu-west-1.amazonaws.com/prod-ucs-content-store-eu-west/content/pii:S0306261919318616/STRIPIN/image/svg+xml/c105e9740de4f76e5325d5245f8d9d8c/si24.svg si24 si24.svg svg 1536 ALTIMG 1-s2.0-S0306261919318616-si25.svg https://s3-eu-west-1.amazonaws.com/prod-ucs-content-store-eu-west/content/pii:S0306261919318616/STRIPIN/image/svg+xml/4814ca416bdabbb6811fefeedfeb0d85/si25.svg si25 si25.svg svg 4677 ALTIMG 1-s2.0-S0306261919318616-si26.svg https://s3-eu-west-1.amazonaws.com/prod-ucs-content-store-eu-west/content/pii:S0306261919318616/STRIPIN/image/svg+xml/37e2245b854c6993e8726bb0686d6008/si26.svg si26 si26.svg svg 1754 ALTIMG 1-s2.0-S0306261919318616-si27.svg https://s3-eu-west-1.amazonaws.com/prod-ucs-content-store-eu-west/content/pii:S0306261919318616/STRIPIN/image/svg+xml/5dc662808febd8a54836aeb6fba63678/si27.svg si27 si27.svg svg 3419 ALTIMG 1-s2.0-S0306261919318616-si28.svg https://s3-eu-west-1.amazonaws.com/prod-ucs-content-store-eu-west/content/pii:S0306261919318616/STRIPIN/image/svg+xml/ef4d740b0487e7e5eb64cf65341d9d81/si28.svg si28 si28.svg svg 7742 ALTIMG 1-s2.0-S0306261919318616-si29.svg https://s3-eu-west-1.amazonaws.com/prod-ucs-content-store-eu-west/content/pii:S0306261919318616/STRIPIN/image/svg+xml/32ad7295106a4a0016e9fade7689d800/si29.svg si29 si29.svg svg 3400 ALTIMG 1-s2.0-S0306261919318616-si3.svg https://s3-eu-west-1.amazonaws.com/prod-ucs-content-store-eu-west/content/pii:S0306261919318616/STRIPIN/image/svg+xml/38d4cd4c4d93e938a827c93bd70e115c/si3.svg si3 si3.svg svg 20375 ALTIMG 1-s2.0-S0306261919318616-si30.svg https://s3-eu-west-1.amazonaws.com/prod-ucs-content-store-eu-west/content/pii:S0306261919318616/STRIPIN/image/svg+xml/1d958faf3978ad3efd644f23ce99ce8f/si30.svg si30 si30.svg svg 7723 ALTIMG 1-s2.0-S0306261919318616-si31.svg https://s3-eu-west-1.amazonaws.com/prod-ucs-content-store-eu-west/content/pii:S0306261919318616/STRIPIN/image/svg+xml/d445b2e84ccff1b824cdf20c36981b11/si31.svg si31 si31.svg svg 5161 ALTIMG 1-s2.0-S0306261919318616-si32.svg https://s3-eu-west-1.amazonaws.com/prod-ucs-content-store-eu-west/content/pii:S0306261919318616/STRIPIN/image/svg+xml/2d9212473f8cbe8f1c05da33cff7daa8/si32.svg si32 si32.svg svg 2511 ALTIMG 1-s2.0-S0306261919318616-si33.svg https://s3-eu-west-1.amazonaws.com/prod-ucs-content-store-eu-west/content/pii:S0306261919318616/STRIPIN/image/svg+xml/b86d939ab9fec7c8e7df14e777913091/si33.svg si33 si33.svg svg 10286 ALTIMG 1-s2.0-S0306261919318616-si34.svg https://s3-eu-west-1.amazonaws.com/prod-ucs-content-store-eu-west/content/pii:S0306261919318616/STRIPIN/image/svg+xml/9c5f7cfb21459a81e264139423c53f99/si34.svg si34 si34.svg svg 6340 ALTIMG 1-s2.0-S0306261919318616-si35.svg https://s3-eu-west-1.amazonaws.com/prod-ucs-content-store-eu-west/content/pii:S0306261919318616/STRIPIN/image/svg+xml/c01ce2801990d5e91c7eaa9787631303/si35.svg si35 si35.svg svg 5644 ALTIMG 1-s2.0-S0306261919318616-si36.svg https://s3-eu-west-1.amazonaws.com/prod-ucs-content-store-eu-west/content/pii:S0306261919318616/STRIPIN/image/svg+xml/9404fa226186a61ec2a227fdeed69e26/si36.svg si36 si36.svg svg 5157 ALTIMG 1-s2.0-S0306261919318616-si37.svg https://s3-eu-west-1.amazonaws.com/prod-ucs-content-store-eu-west/content/pii:S0306261919318616/STRIPIN/image/svg+xml/335e82c97e36bc8c5939feeec91c810e/si37.svg si37 si37.svg svg 1598 ALTIMG 1-s2.0-S0306261919318616-si38.svg https://s3-eu-west-1.amazonaws.com/prod-ucs-content-store-eu-west/content/pii:S0306261919318616/STRIPIN/image/svg+xml/55c092f09ac005da4f055aceabcd1d94/si38.svg si38 si38.svg svg 1840 ALTIMG 1-s2.0-S0306261919318616-si39.svg https://s3-eu-west-1.amazonaws.com/prod-ucs-content-store-eu-west/content/pii:S0306261919318616/STRIPIN/image/svg+xml/dccef3c46f342a0bb334b6ae1554de56/si39.svg si39 si39.svg svg 1799 ALTIMG 1-s2.0-S0306261919318616-si4.svg https://s3-eu-west-1.amazonaws.com/prod-ucs-content-store-eu-west/content/pii:S0306261919318616/STRIPIN/image/svg+xml/07c280cf7a0a7992fc3c092baa0ac4bc/si4.svg si4 si4.svg svg 8730 ALTIMG 1-s2.0-S0306261919318616-si40.svg https://s3-eu-west-1.amazonaws.com/prod-ucs-content-store-eu-west/content/pii:S0306261919318616/STRIPIN/image/svg+xml/b3ae1c344e3b7c6084a5a653140664e1/si40.svg si40 si40.svg svg 1526 ALTIMG 1-s2.0-S0306261919318616-si41.svg https://s3-eu-west-1.amazonaws.com/prod-ucs-content-store-eu-west/content/pii:S0306261919318616/STRIPIN/image/svg+xml/e892d4e98d6254def4a7ba3107709e06/si41.svg si41 si41.svg svg 1821 ALTIMG 1-s2.0-S0306261919318616-si42.svg https://s3-eu-west-1.amazonaws.com/prod-ucs-content-store-eu-west/content/pii:S0306261919318616/STRIPIN/image/svg+xml/0b44e7ac9d24a012c921b6004ddc83e6/si42.svg si42 si42.svg svg 1409 ALTIMG 1-s2.0-S0306261919318616-si43.svg https://s3-eu-west-1.amazonaws.com/prod-ucs-content-store-eu-west/content/pii:S0306261919318616/STRIPIN/image/svg+xml/dca4bb9923eb46e016f6c006c2d47ba3/si43.svg si43 si43.svg svg 1527 ALTIMG 1-s2.0-S0306261919318616-si44.svg https://s3-eu-west-1.amazonaws.com/prod-ucs-content-store-eu-west/content/pii:S0306261919318616/STRIPIN/image/svg+xml/651efcee3e8063fdbbb4ca813e4d6bdb/si44.svg si44 si44.svg svg 1853 ALTIMG 1-s2.0-S0306261919318616-si45.svg https://s3-eu-west-1.amazonaws.com/prod-ucs-content-store-eu-west/content/pii:S0306261919318616/STRIPIN/image/svg+xml/d0ea0d2961cde5dc3c517b31b854bcab/si45.svg si45 si45.svg svg 2403 ALTIMG 1-s2.0-S0306261919318616-si46.svg https://s3-eu-west-1.amazonaws.com/prod-ucs-content-store-eu-west/content/pii:S0306261919318616/STRIPIN/image/svg+xml/94e3041acbc380e96b06f6a82d39b884/si46.svg si46 si46.svg svg 13964 ALTIMG 1-s2.0-S0306261919318616-si47.svg https://s3-eu-west-1.amazonaws.com/prod-ucs-content-store-eu-west/content/pii:S0306261919318616/STRIPIN/image/svg+xml/256e8fdd7a1aeafb266122544b05b6dd/si47.svg si47 si47.svg svg 9346 ALTIMG 1-s2.0-S0306261919318616-si48.svg https://s3-eu-west-1.amazonaws.com/prod-ucs-content-store-eu-west/content/pii:S0306261919318616/STRIPIN/image/svg+xml/59fb88d82690a851e404af872f8657a5/si48.svg si48 si48.svg svg 22398 ALTIMG 1-s2.0-S0306261919318616-si49.svg https://s3-eu-west-1.amazonaws.com/prod-ucs-content-store-eu-west/content/pii:S0306261919318616/STRIPIN/image/svg+xml/9bce80b615a5674fb20a30eaac1aa5d6/si49.svg si49 si49.svg svg 7388 ALTIMG 1-s2.0-S0306261919318616-si5.svg https://s3-eu-west-1.amazonaws.com/prod-ucs-content-store-eu-west/content/pii:S0306261919318616/STRIPIN/image/svg+xml/1dd0838dfdf66260179795e89e41d0d5/si5.svg si5 si5.svg svg 14185 ALTIMG 1-s2.0-S0306261919318616-si50.svg https://s3-eu-west-1.amazonaws.com/prod-ucs-content-store-eu-west/content/pii:S0306261919318616/STRIPIN/image/svg+xml/5235ee7a926cdaccda481c899ed833c6/si50.svg si50 si50.svg svg 6846 ALTIMG 1-s2.0-S0306261919318616-si51.svg https://s3-eu-west-1.amazonaws.com/prod-ucs-content-store-eu-west/content/pii:S0306261919318616/STRIPIN/image/svg+xml/bbf8e0f97407f9c6dad9c556f773fdf8/si51.svg si51 si51.svg svg 5515 ALTIMG 1-s2.0-S0306261919318616-si52.svg https://s3-eu-west-1.amazonaws.com/prod-ucs-content-store-eu-west/content/pii:S0306261919318616/STRIPIN/image/svg+xml/424a208fd4b57ef5fc586d8d6cb22a13/si52.svg si52 si52.svg svg 2494 ALTIMG 1-s2.0-S0306261919318616-si53.svg https://s3-eu-west-1.amazonaws.com/prod-ucs-content-store-eu-west/content/pii:S0306261919318616/STRIPIN/image/svg+xml/f631a32b3e4c2135b58043e63198027b/si53.svg si53 si53.svg svg 2364 ALTIMG 1-s2.0-S0306261919318616-si54.svg https://s3-eu-west-1.amazonaws.com/prod-ucs-content-store-eu-west/content/pii:S0306261919318616/STRIPIN/image/svg+xml/2ec94271ce57373f646f3f40388ade79/si54.svg si54 si54.svg svg 2233 ALTIMG 1-s2.0-S0306261919318616-si55.svg https://s3-eu-west-1.amazonaws.com/prod-ucs-content-store-eu-west/content/pii:S0306261919318616/STRIPIN/image/svg+xml/3a71f0de413ac978bf1b25a62653f5f7/si55.svg si55 si55.svg svg 2406 ALTIMG 1-s2.0-S0306261919318616-si56.svg https://s3-eu-west-1.amazonaws.com/prod-ucs-content-store-eu-west/content/pii:S0306261919318616/STRIPIN/image/svg+xml/a858438235821afcb23c4cd15541749f/si56.svg si56 si56.svg svg 2732 ALTIMG 1-s2.0-S0306261919318616-si57.svg https://s3-eu-west-1.amazonaws.com/prod-ucs-content-store-eu-west/content/pii:S0306261919318616/STRIPIN/image/svg+xml/ce6ddfd3d668b141b8ef090ca8b898ee/si57.svg si57 si57.svg svg 11506 ALTIMG 1-s2.0-S0306261919318616-si58.svg https://s3-eu-west-1.amazonaws.com/prod-ucs-content-store-eu-west/content/pii:S0306261919318616/STRIPIN/image/svg+xml/fa50ff9f5f9e0bfc9e6c697724389e5e/si58.svg si58 si58.svg svg 18574 ALTIMG 1-s2.0-S0306261919318616-si59.svg https://s3-eu-west-1.amazonaws.com/prod-ucs-content-store-eu-west/content/pii:S0306261919318616/STRIPIN/image/svg+xml/a4dba02a595fbd4db52c67564c44c999/si59.svg si59 si59.svg svg 11373 ALTIMG 1-s2.0-S0306261919318616-si6.svg https://s3-eu-west-1.amazonaws.com/prod-ucs-content-store-eu-west/content/pii:S0306261919318616/STRIPIN/image/svg+xml/bb01873c61ad149d46859578d29c474a/si6.svg si6 si6.svg svg 14287 ALTIMG 1-s2.0-S0306261919318616-si60.svg https://s3-eu-west-1.amazonaws.com/prod-ucs-content-store-eu-west/content/pii:S0306261919318616/STRIPIN/image/svg+xml/0da17510c2d61ceaa4d386ce0f502b3b/si60.svg si60 si60.svg svg 18192 ALTIMG 1-s2.0-S0306261919318616-si61.svg https://s3-eu-west-1.amazonaws.com/prod-ucs-content-store-eu-west/content/pii:S0306261919318616/STRIPIN/image/svg+xml/7c724a26af87b288ca6f692cc52fb3fa/si61.svg si61 si61.svg svg 3010 ALTIMG 1-s2.0-S0306261919318616-si62.svg https://s3-eu-west-1.amazonaws.com/prod-ucs-content-store-eu-west/content/pii:S0306261919318616/STRIPIN/image/svg+xml/7f57be45083200f13717ffb10c3020bd/si62.svg si62 si62.svg svg 2854 ALTIMG 1-s2.0-S0306261919318616-si63.svg https://s3-eu-west-1.amazonaws.com/prod-ucs-content-store-eu-west/content/pii:S0306261919318616/STRIPIN/image/svg+xml/8a98cbd9ca10bb4972ee14b0a983422b/si63.svg si63 si63.svg svg 7479 ALTIMG 1-s2.0-S0306261919318616-si64.svg https://s3-eu-west-1.amazonaws.com/prod-ucs-content-store-eu-west/content/pii:S0306261919318616/STRIPIN/image/svg+xml/fa715a6a431004915f39d10b48c143a5/si64.svg si64 si64.svg svg 7335 ALTIMG 1-s2.0-S0306261919318616-si65.svg https://s3-eu-west-1.amazonaws.com/prod-ucs-content-store-eu-west/content/pii:S0306261919318616/STRIPIN/image/svg+xml/0e72940e4fec4f5b29a1c939982dc348/si65.svg si65 si65.svg svg 5471 ALTIMG 1-s2.0-S0306261919318616-si66.svg https://s3-eu-west-1.amazonaws.com/prod-ucs-content-store-eu-west/content/pii:S0306261919318616/STRIPIN/image/svg+xml/daca957dc420677952ae06dffe02c385/si66.svg si66 si66.svg svg 3075 ALTIMG 1-s2.0-S0306261919318616-si67.svg https://s3-eu-west-1.amazonaws.com/prod-ucs-content-store-eu-west/content/pii:S0306261919318616/STRIPIN/image/svg+xml/823025faab2b810ed5dd8e85a6cb19f1/si67.svg si67 si67.svg svg 2924 ALTIMG 1-s2.0-S0306261919318616-si68.svg https://s3-eu-west-1.amazonaws.com/prod-ucs-content-store-eu-west/content/pii:S0306261919318616/STRIPIN/image/svg+xml/cb1c406aa68810ab783e84e2a54abf7f/si68.svg si68 si68.svg svg 10426 ALTIMG 1-s2.0-S0306261919318616-si69.svg https://s3-eu-west-1.amazonaws.com/prod-ucs-content-store-eu-west/content/pii:S0306261919318616/STRIPIN/image/svg+xml/9d8f1a23579e3b3066ac86fe4df50916/si69.svg si69 si69.svg svg 3484 ALTIMG 1-s2.0-S0306261919318616-si7.svg https://s3-eu-west-1.amazonaws.com/prod-ucs-content-store-eu-west/content/pii:S0306261919318616/STRIPIN/image/svg+xml/8a805ae07152c3a28efa0b93af596765/si7.svg si7 si7.svg svg 3614 ALTIMG 1-s2.0-S0306261919318616-si70.svg https://s3-eu-west-1.amazonaws.com/prod-ucs-content-store-eu-west/content/pii:S0306261919318616/STRIPIN/image/svg+xml/6498ead764a51b21830b68b5e28d3592/si70.svg si70 si70.svg svg 4194 ALTIMG 1-s2.0-S0306261919318616-si71.svg https://s3-eu-west-1.amazonaws.com/prod-ucs-content-store-eu-west/content/pii:S0306261919318616/STRIPIN/image/svg+xml/898f0d9b280799f6b76174a0f64d2e7a/si71.svg si71 si71.svg svg 3110 ALTIMG 1-s2.0-S0306261919318616-si72.svg https://s3-eu-west-1.amazonaws.com/prod-ucs-content-store-eu-west/content/pii:S0306261919318616/STRIPIN/image/svg+xml/04780bea499dc956b6478779f9cd13a3/si72.svg si72 si72.svg svg 3112 ALTIMG 1-s2.0-S0306261919318616-si73.svg https://s3-eu-west-1.amazonaws.com/prod-ucs-content-store-eu-west/content/pii:S0306261919318616/STRIPIN/image/svg+xml/15d495da31e63d4664a546da44780387/si73.svg si73 si73.svg svg 3220 ALTIMG 1-s2.0-S0306261919318616-si74.svg https://s3-eu-west-1.amazonaws.com/prod-ucs-content-store-eu-west/content/pii:S0306261919318616/STRIPIN/image/svg+xml/62823084eaed11015d7020c751cb4cf4/si74.svg si74 si74.svg svg 1538 ALTIMG 1-s2.0-S0306261919318616-si75.svg https://s3-eu-west-1.amazonaws.com/prod-ucs-content-store-eu-west/content/pii:S0306261919318616/STRIPIN/image/svg+xml/d60b4d7421538980efba183445fbbb0c/si75.svg si75 si75.svg svg 27465 ALTIMG 1-s2.0-S0306261919318616-si76.svg https://s3-eu-west-1.amazonaws.com/prod-ucs-content-store-eu-west/content/pii:S0306261919318616/STRIPIN/image/svg+xml/53adec6ccc75f3c4c2049771e2ac3741/si76.svg si76 si76.svg svg 23459 ALTIMG 1-s2.0-S0306261919318616-si77.svg https://s3-eu-west-1.amazonaws.com/prod-ucs-content-store-eu-west/content/pii:S0306261919318616/STRIPIN/image/svg+xml/70297cab7c6f6b889244a63d4f8c2d28/si77.svg si77 si77.svg svg 16193 ALTIMG 1-s2.0-S0306261919318616-si78.svg https://s3-eu-west-1.amazonaws.com/prod-ucs-content-store-eu-west/content/pii:S0306261919318616/STRIPIN/image/svg+xml/35e6d11ace9e4fd2fcd8af4b9023d4b7/si78.svg si78 si78.svg svg 2733 ALTIMG 1-s2.0-S0306261919318616-si79.svg https://s3-eu-west-1.amazonaws.com/prod-ucs-content-store-eu-west/content/pii:S0306261919318616/STRIPIN/image/svg+xml/273199a432995be9acad50ae7774b79f/si79.svg si79 si79.svg svg 3051 ALTIMG 1-s2.0-S0306261919318616-si8.svg https://s3-eu-west-1.amazonaws.com/prod-ucs-content-store-eu-west/content/pii:S0306261919318616/STRIPIN/image/svg+xml/a084fe330d8b33e2ce580f930a6867c6/si8.svg si8 si8.svg svg 8143 ALTIMG 1-s2.0-S0306261919318616-si80.svg https://s3-eu-west-1.amazonaws.com/prod-ucs-content-store-eu-west/content/pii:S0306261919318616/STRIPIN/image/svg+xml/8c9862049a6db6b891276274402de054/si80.svg si80 si80.svg svg 2595 ALTIMG 1-s2.0-S0306261919318616-si81.svg https://s3-eu-west-1.amazonaws.com/prod-ucs-content-store-eu-west/content/pii:S0306261919318616/STRIPIN/image/svg+xml/5c14bc26266175edf8eb7eeb25cfd9c9/si81.svg si81 si81.svg svg 2917 ALTIMG 1-s2.0-S0306261919318616-si82.svg https://s3-eu-west-1.amazonaws.com/prod-ucs-content-store-eu-west/content/pii:S0306261919318616/STRIPIN/image/svg+xml/9214d4b86b34d539f48fdfcc3ed00cd0/si82.svg si82 si82.svg svg 5154 ALTIMG 1-s2.0-S0306261919318616-si83.svg https://s3-eu-west-1.amazonaws.com/prod-ucs-content-store-eu-west/content/pii:S0306261919318616/STRIPIN/image/svg+xml/415855ba08ca7f8f492cdd6dd2dd1a5a/si83.svg si83 si83.svg svg 2736 ALTIMG 1-s2.0-S0306261919318616-si84.svg https://s3-eu-west-1.amazonaws.com/prod-ucs-content-store-eu-west/content/pii:S0306261919318616/STRIPIN/image/svg+xml/c71b583a9b1bcd6aceeb59d9a422a46a/si84.svg si84 si84.svg svg 15323 ALTIMG 1-s2.0-S0306261919318616-si85.svg https://s3-eu-west-1.amazonaws.com/prod-ucs-content-store-eu-west/content/pii:S0306261919318616/STRIPIN/image/svg+xml/32a5b15ab4f4ccb3de7485c4bf3bd405/si85.svg si85 si85.svg svg 2798 ALTIMG 1-s2.0-S0306261919318616-si86.svg https://s3-eu-west-1.amazonaws.com/prod-ucs-content-store-eu-west/content/pii:S0306261919318616/STRIPIN/image/svg+xml/0484c10a961d92759890d05f79577249/si86.svg si86 si86.svg svg 25998 ALTIMG 1-s2.0-S0306261919318616-si87.svg https://s3-eu-west-1.amazonaws.com/prod-ucs-content-store-eu-west/content/pii:S0306261919318616/STRIPIN/image/svg+xml/58576997a0ea77ee40f71f98d1887d48/si87.svg si87 si87.svg svg 22556 ALTIMG 1-s2.0-S0306261919318616-si88.svg https://s3-eu-west-1.amazonaws.com/prod-ucs-content-store-eu-west/content/pii:S0306261919318616/STRIPIN/image/svg+xml/8cad25db108395147816b57bb52831c4/si88.svg si88 si88.svg svg 17336 ALTIMG 1-s2.0-S0306261919318616-si89.svg https://s3-eu-west-1.amazonaws.com/prod-ucs-content-store-eu-west/content/pii:S0306261919318616/STRIPIN/image/svg+xml/59b4da6ff3d3f135982f3bf7d855d1b6/si89.svg si89 si89.svg svg 26311 ALTIMG 1-s2.0-S0306261919318616-si9.svg https://s3-eu-west-1.amazonaws.com/prod-ucs-content-store-eu-west/content/pii:S0306261919318616/STRIPIN/image/svg+xml/51acaf1e920ddd2c43fe4635e6938394/si9.svg si9 si9.svg svg 7112 ALTIMG 1-s2.0-S0306261919318616-si90.svg https://s3-eu-west-1.amazonaws.com/prod-ucs-content-store-eu-west/content/pii:S0306261919318616/STRIPIN/image/svg+xml/9a360c0b06a796731895e6232289fcca/si90.svg si90 si90.svg svg 18514 ALTIMG 1-s2.0-S0306261919318616-si91.svg https://s3-eu-west-1.amazonaws.com/prod-ucs-content-store-eu-west/content/pii:S0306261919318616/STRIPIN/image/svg+xml/b8a663a11442914b4d250b629449def8/si91.svg si91 si91.svg svg 8159 ALTIMG 1-s2.0-S0306261919318616-si92.svg https://s3-eu-west-1.amazonaws.com/prod-ucs-content-store-eu-west/content/pii:S0306261919318616/STRIPIN/image/svg+xml/08fa6be92e97144d78800eb1559f4292/si92.svg si92 si92.svg svg 3356 ALTIMG 1-s2.0-S0306261919318616-si93.svg https://s3-eu-west-1.amazonaws.com/prod-ucs-content-store-eu-west/content/pii:S0306261919318616/STRIPIN/image/svg+xml/50cc7ca49044d8ecb3dd5eb4f2e66664/si93.svg si93 si93.svg svg 20498 ALTIMG 1-s2.0-S0306261919318616-si94.svg https://s3-eu-west-1.amazonaws.com/prod-ucs-content-store-eu-west/content/pii:S0306261919318616/STRIPIN/image/svg+xml/20fa6a79bbcbdb4f603afed7f92d808b/si94.svg si94 si94.svg svg 17534 ALTIMG 1-s2.0-S0306261919318616-si95.svg https://s3-eu-west-1.amazonaws.com/prod-ucs-content-store-eu-west/content/pii:S0306261919318616/STRIPIN/image/svg+xml/714d361310549c07665e71d8ea509d01/si95.svg si95 si95.svg svg 28334 ALTIMG 1-s2.0-S0306261919318616-si96.svg https://s3-eu-west-1.amazonaws.com/prod-ucs-content-store-eu-west/content/pii:S0306261919318616/STRIPIN/image/svg+xml/2e0c4ccd2e851ee829b71c5f2c51e26d/si96.svg si96 si96.svg svg 20837 ALTIMG 1-s2.0-S0306261919318616-si97.svg https://s3-eu-west-1.amazonaws.com/prod-ucs-content-store-eu-west/content/pii:S0306261919318616/STRIPIN/image/svg+xml/b44ba85cbfe2b0ae75219d9883a434bb/si97.svg si97 si97.svg svg 2773 ALTIMG 1-s2.0-S0306261919318616-si98.svg https://s3-eu-west-1.amazonaws.com/prod-ucs-content-store-eu-west/content/pii:S0306261919318616/STRIPIN/image/svg+xml/44deff8a70a2a1d409617e027752df9f/si98.svg si98 si98.svg svg 17226 ALTIMG 1-s2.0-S0306261919318616-si99.svg https://s3-eu-west-1.amazonaws.com/prod-ucs-content-store-eu-west/content/pii:S0306261919318616/STRIPIN/image/svg+xml/ddd0594b366511cca7af5f94178233f4/si99.svg si99 si99.svg svg 5384 ALTIMG APEN 114174 114174 S0306-2619(19)31861-6 10.1016/j.apenergy.2019.114174 Elsevier Ltd Fig. 1 The schematic diagram of the LDAC system. Fig. 2 The typical structure of an ANFIS model. Fig. 3 The LDAC platform for experiments. 1-fan; 2-heat exchangers from chiller; 3-data collection system; 4-control panel; 5-strong solution tank; 6- solution reservoir. Fig. 4 The change of control variables during the model verification process. Fig. 5 The outlet air temperature and humidity ratio of experimental data and ANFIS model outputs. Fig. 6 The relative errors of outlet air temperature and humidity ratio between experimental data and the ANFIS model outputs. Fig. 7 The EMPC control scheme of the liquid desiccant dehumidifier. Fig. 8 The step response of air temperature and humidity ratio from two control strategies. Fig. 9 The changes of two control variables generated by two control strategies. Fig. 10 The system energy consumption comparison between two control strategies. Fig. 11 Energy efficiency comparisons of different time segments. Fig. 12 The air temperature and humidity ratio comparison between two control strategies. Fig. 13 The system energy consumption comparison between two control strategies under trajectory changes of outlet air temperature and humidity. Fig. 14 The energy consumption of the chiller and pump in both operation strategies and COP of the chiller in scenario 1. Fig. 15 The energy consumption of the chiller and pump in both operation strategies and COP of the chiller in scenario 2. Table 1 Nominal values of equipment in liquid desiccant dehumidifier. Equipment Nominal value Chiller Q c , n o m = 6 kW Pump Q p , n o m = 113 kW m s , n o m = 0.32 kg / s Fan Q f , n o m = 113 kW m a , n o m = 0.11 kg / s Table 2 Fitted parameters for energy models in liquid desiccant dehumidifier. Equipment Fitted parameters Chiller a 1 = 0.06 a 2 = 0.09 Pump p 0 = 0.09 p 1 = 1.10 p 2 = - 1.12 p 3 = 0.92 Fan f 0 = 0.21 f 1 = 0.09 f 2 = 0.25 f 3 = 0.45 Table 3 Specifications of the LDAC equipment. Parameters Value Column height (m) 2.10 Packing height (m) 1.00 Internal diameter (m) 0.50 Solution reservoir ( m 3 ) 0.40 Solution tank volume ( m 3 ) 0.30 Packing corrugation angle (°) 45 Table 4 Parameter specifications of the equipped sensors. Sensors Accuracy Range Model Company (Country) Air temperature and humidity ± 0.1 ° C ± 0.5 % 0 - 60 ° C 0 - 100 % EE210 E + E (Austria) Air flow meter ± 0.5 % 0 - 600 m 3 / h CP300 KIMO (France) Solution temperature ± 0.15 ° C 0 - 100 ° C PT100 ENLAI (China) Solution flow meter ± 0.5 % 0 - 50 L / min SDLDB ShiDa (China) Table 5 Variable ranges of desiccant solution and air in the experiment. m s ( kg / s ) T s , i n °C ω a (g/kg) T a , o °C Lower bound 0.40 13.28 5.42 12.95 Upper bound 0.64 18.42 9.46 24.63 Table 6 The RMSE and MAE of outlet air state. RMSE MAE Outlet air temperature (°C) 0.10 0.07 Outlet air humidity ratio (g/kg) 0.06 0.05 Table 7 Energy efficiency improvement by EMPC strategy under different time segments. Time segments Energy efficiency improvement Low set point period 11.2% High set point period 5.4% Step down period 1.4% Step up period 8.6% Dynamic modeling and economic model predictive control of a liquid desiccant air conditioning Yuliang Jiang a Xinli Wang a \u204e Hongxia Zhao c Lei Wang a Xiaohong Yin b Lei Jia a a School of Control Science and Engineering, Shandong University, Jinan 250061, China School of Control Science and Engineering Shandong University Jinan 250061 China School of Control Science and Engineering, Shandong University, Jinan 250061, China b School of Automation & Electronic Engineering, Qingdao University of Science & Technology, Qingdao 266042, China School of Automation & Electronic Engineering Qingdao University of Science & Technology Qingdao 266042 China School of Automation & Electronic Engineering, Qingdao University of Science & Technology, Qingdao 266042, China c School of Energy and Power Engineering, Shandong University, Jinan 250061, China School of Energy and Power Engineering Shandong University Jinan 250061 China School of Energy and Power Engineering, Shandong University, Jinan 250061, China \u204e Corresponding author. As a good alternative to cooling-based air dehumidification, Liquid Desiccant Air Conditioning (LDAC) has drawn increasing attention for energy saving in large-scale public buildings. However, available investigations mostly pay attention to the dehumidification performance analysis and optimization based on steady-state models. Dynamic control issues for LDAC are rather important to the system performance and economic cost under the changing working conditions, such as the changing setting points of indoor air conditions and sensible/latent loads in occupied space. In this study, a dynamic model based on the Adaptive Neuro-Fuzzy Inference System (ANFIS) method is established to describe the system output air temperature and humidity ratio of LDAC dynamically with varied input conditions. The verification results show that a good agreement can be found between the prediction results from the proposed model and the experimental data with the relative errors less than 2% for outlet air temperature and less than 4% for outlet air humidity ratio, respectively. An EMPC strategy is designed based on the proposed dynamic model for LDAC by solving a receding optimization problem considering tracking error, control efforts rate, and energy consumption as the objective functions with Genetic Algorithm (GA) to get optimal dynamic response and improve the energy efficiency as well. The simulation analysis shows the proposed EMPC strategy outperforms Proportional\u2013Integral (PI) control with smaller tracking error, faster response, and higher energy efficiency. The average energy saving by the proposed EMPC strategy can reach up to 9.5%. Keywords Liquid desiccant EMPC Dynamic modeling Energy conversation ANFIS Genetic Algorithm Nomenclature c 0 - c 3 parameters in chiller energy consumption model (dimensionless) c s specific heat of desiccant solution (J/(kg °C)) E c / f / p energy consumption of chiller or fan or pump (W) E c / f / p , n o m nominal energy consumption of chiller or fan or pump (W) E Total total energy consumption of the system (W) F fuzzy set (dimensionless) f 0 - f 3 parameters in fan energy consumption model (dimensionless) k time sample (minute) m a mass flow rate of air (kg/s) m a , n o m nominal mass flow rate of air (kg/s) m s mass flow rate of desiccant solution (kg/s) m s , n o m nominal mass flow rate of desiccant solution (kg/s) p 0 - p 3 parameters in pump energy consumption model (dimensionless) Q c load of the chiller (W) Q c / f / p , n o m nominal load of the chiller or fan or pump (W) r c / f / p part load ratio of chiller or fan or pump (dimensionless) T a , o outlet air temperature of dehumidifier (°C) T s , i n temperature of inlet desiccant solution in dehumidifier (°C) T s , i , c desiccant solution temperature of inlet chiller (°C) T s , o , c desiccant solution temperature of outlet chiller (°C) U system control vector (dimensionless) u system control variable (dimensionless) X vector of the system premise (dimensionless) x input variable in ANFIS (dimensionless) Y vector of system output (dimensionless) y system output variable (dimensionless) Greek symbol α fitness of a rule (dimensionless) μ membership function value (dimensionless) ω a outlet air humidity (g/kg (dry air)) ω the excitation intensity of a rule in ANFIS (dimensionless) ω ¯ the normalized excitation intensity of a rule in ANFIS (dimensionless) 1 Introduction Recently, the increasing energy consumption of HVAC (Heating, Ventilation, and Air conditioning) systems in buildings due to the high-speed economic development, population growth and growing demands of indoor comfort makes its energy efficiency improvement the main issue to be addressed. Control of air temperature and humidity are the main tasks for providing indoor thermal comfort as the occupants\u2019 requirements. Generally, more cooling energy with low efficiency is consumed during the dehumidification process through cooling the air lower than its dew point though air dehumidification load accounts only for a small proportion of total air-conditioning load due to the coupling between the sensible and latent loads treatments. Over the past decades, Liquid Desiccant Air Conditioning (LDAC) which has been reported to be a potential technology to the conventional cooling-based dehumidification method is receiving more and more attention since its unique advantages of ingeniously solving the coupling of air temperature and humidity treatment, environmental friendliness, high energy efficiency by utilizing low grade energy, such as industrial waste heat, geothermal energy and solar energy [1,2]. Investigations of the LDAC with high energy efficiency shows great advantages over the cooling-based dehumidification air conditioning. Currently, relevant researches mostly focus on model development [3,4,5] of the coupled heat and mass transfer process in the dehumidifier, performance analysis [6,7] by simulations and experiments, and dehumidification system design and improvements [8,9]. The most common models can be classified into three types, the finite difference model, the effectiveness-Number of Transfer Units (NTU) model, and the empirical model. The finite difference model based on differential equations of coupled heat and mass transfer process is detailed and precise. Naik et al. [10] introduced a recursive algorithm to the finite difference model to describe air dehumidification process in a cross-flow type liquid desiccant dehumidifier/regenerator. Peng et al. [11] worked on performance analysis of outside evaporative cooling liquid desiccant dehumidifier by the finite difference model. It is a big challenge for the usage of finite difference model in system optimization and control of LDAC due to the computational burden and iteration procedure during the solving process of the governing differential equations. The NTU model lightens the computational burden by introducing the Le-NTU number to the differential equations. Xie et al. [12] evaluated the effectiveness-NTU model for a counter-flow humidifier by 141 groups of experimental data with acceptable accuracy. Langroudi et al. [13] investigated theoretically and assessed the LDAC system based on the effectiveness-NTU model by employing response surface methodology. The empirical model depending on experimental data is relatively flexible with a simple form. Wang et al. [14] proposed a hybrid empirical model by extracting important characteristic parameters for real-time performance assessment and optimization of the LDAC system. Joon-Young et al. [15] evaluated the dehumidification effectiveness of LDAC system by developing an empirical model. With the steady-state models, the system supervisory optimization strategy to achieve improved energy performance of LDAC has been developed. Wang et al. [16] proposed a global optimization operation strategy to achieve energy efficiency improvement of LDAC system by employing the self-adaptive differential evolutionary algorithm. Ou et al. [17] proposed an optimization strategy with energy consumption decreased by 12.49% compared with the conventional strategy in LDAC. Tu et al. [18] worked on analyzing and optimizing the operating parameters of the LDAC system. The investigation results of LDAC optimization can help in system operation schedule under steady conditions, but they contribute little under changing operating conditions in the actual operating process. Therefore, more efforts have been made on dynamic performance analysis and dynamic model development of LDAC [19,20]. R. Namvar et al. [21] developed a dynamic numerical model to study the transient behaviors of a liquid-to-air membrane energy exchanger (LAMEE) and compared the simulation results with the ones at steady state. Li et al. [22] proposed a simplified dynamic dehumidifier model which is expected to be used for dehumidification system controller design due to the excellent performance in system dynamic behaviors prediction. Wang et al. [23] reported a transient simulation of the dehumidification performance using a dynamic heat and mass transfer model with less computational work for the LDAC system. Dynamic models with low calculation burden and high accuracy for the LDAC system can contribute to a better understanding of the system dynamic performance and becomes the basis for further studying on the system dynamic control. Few efficient control strategies to achieve both system performance optimization and energy management are available, which restrict LDAC\u2019s application and energy-saving potential [24,25]. Therefore, it is indeed necessary to have the optimal dynamic control of supplied air temperature and humidity to cover the time-varying indoor sensible and latent loads with the minimized system energy consumption. However, researches on LDAC optimal dynamic control strategy developments are currently limited. Considerable studies on model-based and optimal control for the HVAC system [26,27] can be referred to from available publications. Razmara et al. [28] developed an exergy model for evaluating system energy efficiency and used Model Predictive Control (MPC) to reduce exergy destruction in the HVAC system. Bianchini et al. [29] devised an MPC method for efficient management of HVAC system in large-scale buildings. Similar control methods can also be employed for dynamic control and performance optimization of the LDAC system. Inherent nonlinearity and multi-variables characteristics in LDAC systems imply that the nonlinear control methods are urgently demanded. Among many advanced control methods, MPC has been regarded as an effective and powerful technique for the control of industrial process systems and considered to be very suitable for slow dynamic systems like HVAC and LDAC. Compared with standard MPC, Economic Model Predictive Control (EMPC) is a more preferred control strategy for the reason that the latter introduces the economic function to general optimization function and explores the potential to improve system profit in a practical operation process. Effective control strategy is necessary for the LDAC system to provide indoor thermal comfort as the occupants\u2019 requirements under the changing conditions, such as variations of outdoor weather conditions and indoor sensible/latent loads. Energy efficiency improvement of the LDAC system has been paid close attention to in this paper. The main contributions of this study are concluded as follows: (1) A fuzzy predictive model based on Adaptive Neuro-Fuzzy Inference System (ANFIS) method has been established to characterize dynamic dehumidification process in LDAC system; (2) To our knowledge, EMPC is applied in Liquid Desiccant Air Conditioning (LDAC) for the first time to develop system optimal operation strategy considering both system outputs and energy efficiency, simultaneously. EMPC is used as an effective control approach to obtain the optimal control sequence for adjusting supply air state to the required values and minimize the modified receding optimization function with Genetic Algorithm (GA); (3) Energy efficiency comparisons of the LDAC system under various working conditions show that EMPC strategy can improve energy efficiency and achieve dynamic control comparing with Proportional-Integral (PI) strategy; (4) Energy-saving effects by the two control strategies in different segments have also been investigated and concluded. The outline of the paper is listed as follows. The energy-consuming model of the dehumidifier is presented in Section 2. While in Section 3, the dynamic prediction model by the ANFIS method for a dehumidifier is developed. In Section 4, we have introduced the experimental facility to validate the performance of the prediction model. In Section 5, the EMPC and PI control strategies for the LDAC system have been depicted. In Section 6, the simulation studies have been implemented and the results have been discussed. Finally, the summary of this work is given in Section 7. 2 Energy consumption model of the dehumidifier The dehumidifier is the main component of the LDAC system that provides cooled and dehumidified air to occupied space as required conditions, thus only the liquid desiccant dehumidifier is investigated in this work. The liquid desiccant dehumidifier mainly consists of a counter-flow packed type column, a chiller supplying cooling energy, a solution pump, a fan, and a strong solution tank, as the sketch map shown in Fig. 1 . Outside warm and moist air with high temperature and humidity is blown up from the bottom of the dehumidifier, meanwhile, the strong desiccant solution driven by the solution pump from the strong solution tank is sprayed on the top of the packed column after cooled through the chiller. Coupled heat and mass transfer process occurs between the warm moist air and concentrated desiccant solutions by taking temperature and surface water vapor pressure as the driving forces. Cooled and dehumidified air is fed into the occupied space to regulate the indoor temperature and humidity while desiccant solutions are distilled and pumped back to the weak solution tank and charged into regenerator to be concentrated. Under varying indoor sensible/latent loads, air with different temperatures and humidity ratios are required from the LDAC. Assume that the strong desiccant solution with fixed concentration is supplied by stable operation of the regenerator. The desiccant solution flow rate and temperature are considered as the two control variables affecting outlet air conditions of the dehumidifier. Previous literature [10,11] have reported that by increasing flow rate or reducing temperature of inlet desiccant solution to the dehumidifier, cooler and drier air can be obtained. Local feedback control strategy such as on/off and Proportional\u2013Integral\u2013Derivative (PID) controllers can control the outlet air temperature and humidity dynamically to satisfy the requirements by regulating the two mentioned variables but fail to consider the system energy efficiency and changes of control variables, which are closely related to system operating cost and lifetime, respectively. Thus, to have the optimal dynamic control of liquid desiccant dehumidifier, an energy model to evaluate the energy efficiency of dehumidifier under different control actions is necessary while designing the optimal controller. Chiller, pump, and fan are the components which consume electric energy in the dehumidifier. In this study, a chiller based on the vapor compression refrigerant cycle is used to cool the desiccant solution down to the temperature as the controller desired. The chiller energy consumption can be calculated by the ratio between actual cooling load and coefficient of performance (COP) [30]. The energy consumption of a chiller is formulated as follows [16]. (1) Q c = c s m s ( T s , i , c - T s , i , o ) (2) r c = Q c Q c , n o m (3) COP = r c t c + 273.5 t e - 273.5 r c + a 1 t c + 273.5 t e - 273.5 + a 2 (4) E c = Q c COP where Q c and Q c , n o m denote the current cooling load and nominal cooling load capacity, respectively; T s , i , c and T s , i , o are the inlet and outlet desiccant solution temperatures for the evaporator of chiller, respectively; r c is the ratio of current cooling load Qc and nominal cooling load Qc,nom ; t e and t c are evaporating temperature and condensing temperature, respectively. Parameters, a 1 and a 2 can be determined by experimental data with regression approach. Ec denotes the energy consumption of a chiller. Similar modeling method can be applied to the pump and fan whose energy consumptions can be estimated by the following expressions. (5) r p = m s m s , n o m (6) E p = E p , n o m ( p 3 r p 3 + p 2 r p 2 + p 1 r p + p 0 ) (7) r f = m a m a , n o m (8) E f = E f , n o m ( f 3 r f 3 + f 2 r f 2 + f 1 r f + f 0 ) where E p , E f are the pump and fan energy consumptions, respectively; E p , n o m , E f , n o m shown in Table 1 are the nominal values at the nominal flow rates based on the equipment specification. p 0 ~ p 3 and f0 \u2013f3 are the parameters to be identified by collected operation data and the fitted values are presented in Table 2 . Similarly, the ratio of current desiccant solution flow rate m s and rated desiccant solution flow rate m s , n o m is defined as r p . The ratio between current air flow rate m a and nominal air flow rate ma,nom is defined as r f . The total energy consumption of dehumidifier can be described in Eq. (9). The validation of the energy models for the three energy consuming components has been analyzed and reported in the previous work [16]. (9) E total = E c + E p + E f 3 ANFIS predictive model development for the dehumidifier To develop an optimal control strategy considering system dynamic response and energy efficiency, it is crucial and essentialto develop a control-oriented model for predicting the system dynamic behaviors and characteristics between system input variables and output variables. However, due to the inherent nonlinear characteristics during the heat and mass transfer processes and the complex energy conversion among the components of a dehumidifier, it is quite a challenge to build mechanism model with constraints, complex model structure, and high computation cost to meet the real-time requirements. In present work, a dehumidifier model based on ANFIS is developed to predict system outputs (air temperature and humidity ratio) dynamically under varying control actions. Experimental input/output dynamic data sets collected from a wide operating range are employed to train the model parameters to improve the model prediction accuracy. As an intelligent modeling method integrating both neural networks and fuzzy logic principles, ANFIS [31,32] has advantages over other modeling methods with capabilities of self-adaptation, self-learning to approximate nonlinear functions and suitable application to dynamic control. The Adaptive Neuro-Fuzzy Inference System (ANFIS) based on Takagi-Sugeno model achieves fuzzification, fuzzy inference and defuzzification by neural networks. The mixed algorithms of back propagation algorithm and least square method are used to adjust premise parameters and conclusion parameters, and can automatically generate if-then rules. A typical ANFIS structure showed in Fig. 2 consists of five layers [33]. The first layer maps the input variables x i to the fuzzy set F j i and outputs the membership degree of the corresponding fuzzy set. The second layer outputs algebraic products of all input signals and each node M i represents the excitation intensity ω i of a rule. The incentive intensity of each rule is normalized in the third layer. In the next layer, the output y i related to each rule is calculated. The final output layer calculates the sum of all incoming signals as the total output Y . From the above-mentioned modeling method, a Takagi-Sugeno based fuzzy model with a set of if-then rules is presented to identify the relationship between input and output data adaptively, as described, R i : i f Y ( k - 1 ) i s F 1 i , Y ( k ) i s F 2 i , a n d U ( k - 1 ) i s F 3 i , a n d U ( k ) i s F 4 i then Y i ( k + 1 ) = λ 1 i Y ( k - 1 ) + λ 2 i Y ( k ) + λ 3 i U ( k - 1 ) + λ 4 i U ( k ) Y = y 1 y 2 , U = u 1 u 2 , λ i = λ 1 i λ 2 i λ 3 i λ 4 i where y 1 and y 2 are controlled variables which represent outlet air temperature and humidity ratio, respectively; u 1 and u 2 are manipulated variables which denote inlet desiccant solution flow rate and temperature, respectively; F 1 i - F 4 i are fuzzy sets of the ith Rule for different variables; λ i is a vector of the influence coefficients obtained from adaptive learning method; x T = y 1 k - 1 , y 1 k , y 2 k - 1 , y 2 k , u 1 k - 1 , u 1 k , u 2 k - 1 , u 2 k T is the vector of the system premise and each element corresponds to a membership value μ according to the membership function; k is the sample time. After training by several groups of experimental data under diverse running conditions, dozens of fuzzy rules can be acquired. Each rule corresponds to fitness α i which affects the final output related to the value of the membership function [34]. The outputs can be calculated by Eqs. (10) and (11). (10) α 1 ( 2 ) i = ∏ j = 1 8 μ j i ( x ( j ) ) ∑ i = 1 n 1 ( 2 ) f ∏ j = 1 8 μ j i ( x ( j ) ) (11) y 1 ( 2 ) ( k + 1 ) = ∑ i = 1 n 1 ( 2 ) f α 1 ( 2 ) i y 1 ( 2 ) ( k + 1 ) i 4 Model validation of ANFIS model To show the performance in predicting dynamic characteristics of the proposed ANFIS model for LDAC system, an existing LDAC testing platform reported by the previous study [35], as shown in Fig. 3 is employed with its specifications listed in Table 3 . In the experiment, some step changes are deliberately performed on control variables as inlet solution flow rate and temperature by regulating the solution pump and chiller to get the enough excitation and system dynamic responses of the LDAC system. The values of outlet air temperature and humidity ratio are collected by the equipped sensors and transmitters whose specifications are shown in Table 4 . Some lower and upper limitations of variables are shown in Table 5 . The inlet air flow rate is assumed unchanged and the change of desiccant solution concentration is neglected. The simulation cases are conducted to compare the outputs of the prediction model and experimental data to verify the accuracy of the proposed model for LDAC. Dynamic operating data collected from the platform with 1 minute sampling interval are used to train and verify the developed model. Experimental data are divided into two parts, one part is used for model training and the other for model validation. In this work, Relative Error (RE), Root Mean Square Error (RMSE) and Mean Absolute Error (MAE) as the evaluation indices of the model accuracy, are employed. (12) R E i = y real i - y calc i y real i × 100 % (13) RMSE = ∑ i = 1 N y real i - y calc i 2 N (14) MAE = ∑ i = 1 N y real i - y calc i N The comparisons of the predictive outlet air states using the proposed model and experimental measurements are shown in Fig. 5 , in which the red line with asterisk characters (*), represents the experimental data collected from actual experimental cases and the blue dotted line represents the outlet air state predicted by the proposed model. It can be found that the predictive outputs agree well with the experimental dynamic outputs. The accuracy of the proposed predictive model is summarized by using three evaluation indices RE, RMSE, and MAE, as listed in Table 6 . The relative errors of the outlet air state are shown in Fig. 6 where the outlet air temperature and humidity ratio are lower than 2% and 4%, respectively. The RMSE is 0.10 °C for outlet air temperature and 0.06 g/kg dry air for outlet air humidity ratio. Thus, the proposed model trained by ANFIS is capable of predicting the relationship accurately between the control signals and output results of the air state from LDAC. It can also be found in Fig. 4 that remarkable changes occur at around 60 minute. The relative errors of the outlet air temperature and humidity ratio are still small, which indicate that the developed ANFIS model can adapt the dynamic working conditions well. The variation trends of outlet air temperature and humidity ratio are nearly consistent over the time, which reveals that the heat and mass transfer are coupled in the dehumidification process. It can be observed that the solution temperature rises obviously at 155 minute while it takes a few minutes for the LDAC system to reach another new steady state. Thus, it reveals that the LDAC is a slow dynamic system. 5 Prescription of control schemes As analyzed from Section 4, the liquid desiccant dehumidifier is a slow dynamic Multiple Input Multiple Output (MIMO) system with nonlinear characteristic and constraints, making the MPC, a widely used technique in many fields, as the suitable control method to be applied. However, in conventional MPC, only tracking error and control efforts are considered with the system efficiency ignored. In this section, an EMPC strategy is developed to control the dehumidifier system outputs as the required tracking trajectory and to achieve the improved energy efficiency and economic performance by solving an optimization problem considering system energy consumption for each time interval of a receding horizon. Fig. 7 illustrates the proposed EMPC control block scheme for the liquid desiccant dehumidifier. 5.1 Objective function Three costs are considered when the objective function is formed, namely, tracking error cost, control efforts rate cost and energy consumption cost under finite time domain. In a given D ( k , H p ) representing the time horizon starting from k time instant with length of prediction horizon H p , let y ref ( k , H p ) = y ref ( k + i | k ) : i = 0 , ⋯ H p and y ( k , H p ) = y ( k + i | k ) : i = 0 , ⋯ H p to be the sets of tracking values and outlet air conditions of LDAC, respectively, where y ref ( k + i | k ) = [ y 1 , r e f ( k + i | k ) , y 2 , r e f ( k + i | k ) ] i = 0 , ⋯ H p and y ( k + i | k ) = [ y 1 ( k + i | k ) , y 2 ( k + i | k ) ] i = 0 , ⋯ H p denote the current and future tracking values and system outlet values for outlet air temperature y 1 and humidity ratio y 2 at the time instant k. The sequence of control actions with a length of control horizon H c is denoted by u ( k , H c ) = u ( k + j | k ) : j = 0 , ⋯ H c where H c ⩽ H p and u ( k + j | k ) = [ u 1 ( k + j | k ) , u 2 ( k + j | k ) ] j = 0 , ⋯ H c is the current and future control actions for solution temperature u 1 and mass flow rate u 2 at time instant k and the increment of control actions for each time instant k is Δ u ( k + j | k ) = [ u ( k + j | k ) - u ( k - 1 + j | k ) ] ( j = 0 , 1 ⋯ , H c ) . The three above costs in D ( k , H p ) can be described as, C 1 ( k , H p ) = y ( k , H p ) - y ref ( k , H p ) Q 2 , for tracking error cost, C 2 ( k , H c ) = Δ u ( k + j | k ) R 2 , for control efforts cost, and C 3 ( k , H p ) = P · E total ( k , H p ) , for energy consumption cost. Q , R denote the diagonal weighting matrices corresponding to output offset and control increment, respectively. They are all real numbers which are used to judge the importance of input and output in the optimization performance function. P is a positive real number to adjust the weighting of energy consumption. x Q 2 = x T Qx denotes the weighted norm with the positive weighting matrix Q . Therefore, the receding horizon optimization problem of LDAC over the interval D ( k , H p ) can be expressed as follows. (15) J ( k , H c , H p ) = C 1 ( k , H p ) + C 2 ( k , H c ) + C 3 ( k , H p ) 5.2 Constraints The constraints concern the system dynamic equations, limitations of outputs, control actions, and their change rate. (16) y 1 ( k ) = f ( u 1 ( k - 1 ) , u 1 ( k ) , u 2 ( k - 1 ) , u 2 ( k ) , y 1 ( k - 1 ) , y 2 ( k - 1 ) ) (17) y 2 ( k ) = h ( u 1 ( k - 1 ) , u 1 ( k ) , u 2 ( k - 1 ) , u 2 ( k ) , y 1 ( k - 1 ) , y 2 ( k - 1 ) ) (18) y min ⩽ y ( k + i ) ⩽ y max i = 0 , ⋯ H p (19) u min ⩽ u ( k + j ) ⩽ u max j = 0 , ⋯ H c (20) Δ u min ⩽ Δ u ( k + j ) ⩽ Δ u max j = 0 , ⋯ H c Then the constrained optimization problem Ω can be summarized as follows, (21) u opt ( k ) = arg min u 1 ( k ) , u 2 ( k ) J ( k , H c , H p ) s . t . y 1 ( k ) = f ( u ( k ) , u ( k - 1 ) , y ( k - 1 ) ) y 2 ( k ) = h ( u ( k ) , u ( k - 1 ) , y ( k - 1 ) ) y ∈ [ y min , y max ] u ∈ [ u min , u max ] Δ u ∈ [ Δ u min , Δ u max ] y ( 0 ) = y 0 u ( 0 ) = u 0 At each sample time, a series of optimal control behaviors u opt ( k ) are calculated by solving the above optimization problem, yet only the first control action is implemented on the plant. 5.3 Genetic solver of the optimization function To obtain the optimal solution of an above dynamic receding-horizon optimization problem with nonlinear constraints, GA is employed due to its benefits in gradient computation free, low risk of local optimum and strong ability to handle nonlinearity. At each time instant, GA is implemented to determine the optimal control sequence of the dynamic flow rate m s , i n ( k ) and temperature T s , i n ( k ) of the inlet desiccant solution by solving the problem Ω . After initialization population of candidate solutions, selection, crossover, and mutation are performed based on the evaluated individuals to evolve the next generation from the current generation during each iteration. Size of population, maximum generations, and termination tolerance are assigned as 100, 160 and 1 × 10 - 6 , respectively. The complete algorithm of the proposed method is presented in Algorithm 1. Algorithm 1: The specific genetic algorithm to search the optimal solutions 1. Generate the initial individuals randomly 2. Determine the selection probability equally for all individuals 3. While the termination condition is false do 4. Calculate the fitness value of each individual 5. Calculate the selected probability according to roulette wheel methods 6. Save the selected individuals 7. Calculate the probability of crossover and mutation from selected individuals 8. Perform the crossover and mutation operators 9. Obtain a new generation 10. End while 6 Simulation analysis and discussions 6.1 Case study In order to show the performance in dynamic control and energy efficiency improvement of the proposed EMPC strategy for the dehumidifier, two scenarios, such as step response scenario and trajectory-tracking scenario, are considered. In each scenario, the time intervals for sampling and control are simulated as 2 minutes. The prediction horizon, the receding control horizon for the EMPC strategy are set to 4 and 3, respectively. The scenario 1 costs more simulation time for the reason that it takes some time to observe a dynamic process reach to another desired steady state of the outlet air. When the dynamic process reaches the expected steady state, the next step change process can be started. Thus, the total time of the whole processes and states simulation costs 350 minutes. The scenario 2 merely simulates the trajectory-tracking performance, which contains the tendency of continuous changes of outlet air states. For saving the calculating time, we spend half an hour on trajectory-tracking simulation on the premise of meeting the demand. The classical PI control strategy under the same required outlet air conditions are simulated to compare the performance of trajectory tracking and energy savings of the LDAC system with different control strategies. Scenario 1. Step response performance The case aimed to study the step response performance and the energy consumption for LDAC. The air state of a room is set to a suitable value by occupants according to their requirements, represented by black solid lines w1 and w2 in Fig. 8 . In most situations, the set points of the air state will not be changed frequently once they are determined. From the step profiles, initially, the required air temperature and humidity ratio are 16.5 °C and 7.2 g/kg, respectively. Then the outlet air temperature was required to rise from 16.5 °C to 17.3 °C, simultaneously with the required outlet air humidity ratio increasing from 7.2 g/kg to 7.5 g/kg. After that, the conditions are set back to the initial state. Then, the outlet air temperature is reduced to 15 °C and the outlet air humidity ratio down to 6.3 g/kg. Thus, both rising and decreasing conditions are considered and simulated in this scenario. Two control strategies, the presented EMPC and PI control, are simulated to control the output air conditions of the liquid desiccant dehumidifier with required step profiles within the acceptable errors. The outlet air temperature and humidity responses by these two control strategies are presented in Fig. 8, as blue dashed lines for EMPC and red dotted dash lines for PI control strategy. As shown in the figure, both PI and EMPC strategies can stabilize the outlet air temperature and humidity with acceptable steady state error. For temperature control, EMPC is with less lag time and less overshoot. The maximal relative error of outlet air temperature is 3% for EMPC and 10% for PI control at the dynamic step segments at 84 minute and 248 minute. For humidity control, in addition to the above advantages, EMPC approach showed better control performance than PI with smaller offset. The maximum of EMPC offset from the reference humidity ratio is about 0.38 g/kg and that of PI is 0.97 g/kg. It seems from the step responses that the regulation speed of EMPC is faster than PI for control outlet air temperature and humidity. It can be found that regulation of air temperature and humidity works 2 minutes in advance, as shown the zoomed view in Fig. 8 while there are about 2 minutes time delay for PI control. That is because in EMPC, changes of required air conditions in finite horizon time are introduced in the receding optimization problem so that the changes can be handled in advanced before they actually happen. Also, there is less vibration near the steady-state values for the EMPC approach. That is because that the control actions and their changing rate are considered during receding optimization procedure of proposed EMPC strategy and some control attempts leading to outputs vibrations can be given up. Control actions in EMPC and PI strategies, the changes in the inlet solution temperature and flow rate for Scenario 1 are shown in Fig. 9 . Solution flow rate is almost unchanged during the small step before 162 minutes and remarkable adjust exists during the large step changes after 244 minutes. It concludes that the solution temperature has greater influence on the outlet air states than solution flow rate. For the PI controller, the solution flow rate is nearly unchanged (refer to the zoomed view in Fig. 9) and the solution temperature is regulated with different required outlet air conditions. Nevertheless, EMPC strategy will choose control actions with smaller solution rate and lower temperature to save energy from the chiller side. Moreover, from Fig. 9, adjustments of the solution flow rate and temperature are performed at around the 240th minute which are 4 minutes before required air conditions are changed. The energy consumptions of dehumidifier under the two control strategies have also been compared in Fig. 10 based on the developed energy consumption model. It can be concluded from the figure that there exists considerable energy savings by employing the EMPC strategy. Maximum 13.4% and average 6.8% energy savings can be obtained due to the consideration of energy consumption while developing the objective function in the receding optimization problem Ω . From Fig. 10, over 5% energy saving can be reached at the steady segments with higher air state set points and more than 10% energy saving with lower air state set points. Thus, the presented EMPC strategy can achieve higher energy efficiency improvement under lower air state set points. The detailed analysis is shown in Fig. 11 . To show the different energy saving potentials under different setting conditions, we compare the dynamic energy saving performance with four segment types. Fig. 10 displays the four representative segments, namely high set point period (from 130 to 142 minutes), low set point period (from 304 to 316 minutes), step down period (from 162 to 164 minutes), and step up period (from 80 to 82 minutes). Fig. 11 shows the energy saving percentages of different time segments. It can be observed that low set point segment obtains 11.2% energy saving which nearly twice higher than that of the high set point segment. The step direction also has significant influence on the energy efficiency. Fig. 11 shows that 8.6% energy saving in step up period is higher than that in the step down period. In the step down period, the energy consumptions of the two strategies are nearly the same for the reason that much more energy will be simultaneously consumed at this moment to try to reach lower air conditions as soon as possible. To sum up, the energy efficiency improvement for EMPC of liquid desiccant dehumidifier depends on the air state set points and step direction as shown in Table 7 . Scenario 2. Trajectory-tracking performance The second scenario illustrates the tracking and energy saving performance under trajectory changes of required outlet air temperature and humidity, as shown by black solid lines in Fig. 12 . The desired outlet air temperature is decreasing from 16.2 °C to 13.8 °C while the outlet air humidity ratio is decreasing from 6.6 g/kg to 5.7 g/kg during the first 15 minutes. Then, the outlet air temperature and humidity ratio are required to be unchanged for about 7 minutes. After that, the outlet air temperature and humidity ratio are desired to increase from 13.8 °C to 15 °C, and 5.7 g/kg to 6.3 g/kg, respectively. Both the proposed EMPC and PI strategies are performed under the trajectory changing conditions. Fig. 12 displays the tracking response profiles of outlet air temperature and humidity ratio with blue dotted line representing EMPC tracking profiles while PI tracking profiles represented by red dotted dash lines. It can be easily observed that the EMPC strategy shows better trajectory-tracking performance for outlet air temperature and humidity in smaller tracking errors compared with PI control strategy under the same trajectory changing. Energy consumptions by the two control strategies are compared in Fig. 13 . Conclusions can be drawn that the energy consumption by EMPC is lower than that by PI control strategy except for the initial period of time. From Fig. 13, there is hardly any difference upon the energy consumptions of the LDAC between the two control strategies in the first few minutes due to the same initial set air conditions. The average energy saving can reach up to 9.5%. It can be concluded that the energy-saving effect is also considered under the varying air conditions. 6.2 Energy efficiency analysis The energy consumptions of related energy-consuming components in the LDAC system, chiller and pump in both operation strategies are discussed in this section. It should be noted that the inlet air flow rate is assumed unchanged mentioned in model validation section, thus the energy consumption of the fan is not discussed. Figs. 14 and 15 show the COPs of the chiller and energy consumptions of the chiller and pump in respective scenarios. From Fig. 14, it can be easily found that the energy consumption of chiller accounts for a large proportion of the total system energy consumption. The energy consumptions of pump by both operation strategies keep nearly the same. The system energy efficiency improvement in scenario 1 can achieve total 50.98 kW energy reduction from the chiller throughout the simulation. Especially, the COP of the chiller can reach higher at low air set points (from 304 to 316 minutes) than that at high air set points (from 130 to 142 minutes). In Fig. 15, there is total 12.65 kW energy saving of the chiller by the EMPC strategy throughout the simulation. In the initial period of time (from 0 to 3 minutes), the COPs of the chiller by both operation strategies are nearly equal due to the same initial air states. In both scenarios, it is apparent that the proposed EMPC strategy can improve the COP of the chiller comparing with the conventional PI strategy whether under step changes of air states or dynamic variations of air states. From the two scenarios, the results show that EMPC strategy can achieve the air temperature and humidity as the occupants\u2019 requirements and improve energy efficiency under various working conditions comparing with PI strategy. The PI strategy mainly focuses on dynamic response characteristic like settling time, overshoot and steady state error instead of the system energy consumption. With the exception of dynamic response characteristic, the system energy consumption is also considered in the dynamic optimization objective of EMPC strategy. Especially, during the receding optimization process at each sample time, the optimization control actions achieving the requirements of air state and decreasing the system energy consumption as much as possible are calculated to control the solution pump and chiller. In addition, the energy efficiency improvement of the liquid desiccant dehumidifier by EMPC strategy depends on the air conditions like the air state set points and step direction. 7 Conclusion This paper proposed an EMPC strategy based on ANFIS dynamic model for the purpose of system dynamic operation and energy efficiency improvements of LDAC system. LDAC dynamic model and energy consumption models were established to predict the outputs and total energy consumption of the LDAC system, respectively. Then, a receding optimization problem based on EMPC strategy was developed by considering the tracking error, control efforts rate, and system energy efficiency as the objective functions. The proposed EMPC strategy and conventional PI strategy have been compared in two simulation scenarios with the energy efficiency analysis as well. From the simulation results, the conclusions can be summarized as follows: (1) The developed predictive model was validated by experimental data and the results show that ANFIS based modelling method for liquid desiccant dehumidifier is effective to predict system dynamic outputs with the relative errors lower than 2% and 4% for the outlet air temperature and humidity ratio, respectively, and with few computation efforts. This modeling method can be suitably applied to optimal operation strategy development of LDAC. (2) It can be concluded that EMPC strategy performs good outputs with smaller tracking error, faster response, and higher energy efficiency than the PI control strategy under different air state conditions. Meanwhile, thanks to the proposed EMPC strategy can achieve up to 9.5% energy savings by considering energy consumption during receding optimization. (3) The energy efficiency improvement for EMPC of liquid desiccant dehumidifier depends on the air state set points and step direction. Low set points can reach 11.2% energy saving which nearly twice higher than that of the high set points. The air states change in step up period can obtain 8.6% energy saving, which is higher than that in the step down period. (4) The COP of the chiller have a big impact on the system energy efficiency due to the large proportion of its energy consumption. EMPC tries to find the optimal control actions that with higher chiller COP, so that the overall system energy efficiency can be improved. Declaration of Competing Interest None. Acknowledgments The work was funded by the National Natural Science Foundation of China under the Grant No. 61703238, 61703223, 61773240 and 61773246, the Key Project of National Nature Science Foundation of China under the Grant No. 61733010, the Natural Science Foundation of Shandong Province of China under the Grant No. ZR2017MF017, ZR2017BF014 and ZR2016FM24, The Fundamental Research Funds of Shandong University under the Grant No. 2017JC037 and 2017TB007. References [1] R.H. Qi C.S. Dong L.Z. Zhang Wave-wise falling film in liquid desiccant dehumidification systems: model development and time-series parameter analysis Int J Heat Mass Transf 132 2019 96 106 R.H. Qi, C.S. Dong, L.Z. Zhang. Wave-wise falling film in liquid desiccant dehumidification systems: Model development and time-series parameter analysis. International Journal of Heat and Mass Transfer, 2019. 132: p. 96-106. [2] X.L. Wang L. Wang X.H. Yin Y.L. Jiang H.B. Liu L. Jia Modeling and performance analyses of a batch-wise liquid desiccant air conditioning system Build Environ 154 2019 1 12 X.L. Wang, L. Wang, X.H. Yin, Y.L. Jiang, H.B. Liu, L. Jia. Modeling and performance analyses of a batch-wise liquid desiccant air conditioning system. Building and Environment, 2019. 154: p. 1\u201312. [3] X. Cui M.R. Islam B. Mohan K.J. Chua Theoretical analysis of a liquid desiccant based indirect evaporative cooling system Energy 95 2016 303 312 Cui, X., Islam, M.R., Mohan, B., Chua, K.J.. Theoretical analysis of a liquid desiccant based indirect evaporative cooling system. Energy, 2016. 95: p. 303-312. [4] M.H. Kim J.Y. Park J.W. Jeong Simplified model for packed-bed tower regenerator in a liquid desiccant system Appl Therm Eng 89 2015 717 726 Kim, M.H., Park, J.Y., Jeong, J.W.. Simplified model for packed-bed tower regenerator in a liquid desiccant system. Applied Thermal Engineering, 2015. 89: p. 717-726. [5] K.J. Chua Heat and mass transfer of composite desiccants for energy efficient air dehumidification: Modelling and experiment Appl Therm Eng 89 2015 703 716 Chua, K.J. Heat and mass transfer of composite desiccants for energy efficient air dehumidification: Modelling and experiment. Applied Thermal Engineering, 2015. 89: p. 703-716. [6] L.S. Wang F. Xiao X.J. Zhang R. Kumar An experimental study on the dehumidification performance of a counter flow liquid desiccant dehumidifier Int J Refrig 70 2016 289 301 L.S. Wang, F. Xiao, X.J. Zhang, R. Kumar. An experimental study on the dehumidification performance of a counter flow liquid desiccant dehumidifier. International Journal of Refrigeration, 2016. 70: p. 289-301. [7] G. Angrisani C. Roselli M. Sasso Experimental assessment of the energy performance of a hybrid desiccant cooling system and comparison with other air-conditioning technologies Appl Energy 138 2015 533 545 Angrisani, G., Roselli, C., Sasso, M.. Experimental assessment of the energy performance of a hybrid desiccant cooling system and comparison with other air-conditioning technologies. Applied Energy, 2015. 138: p. 533-545. [8] R.S. Das S. Jain Performance characteristics of cross-flow membrane contactors for liquid desiccant systems Appl Energy 141 2015 1 11 Das, R.S., Jain, S.. Performance characteristics of cross-flow membrane contactors for liquid desiccant systems. Applied Energy, 2015. 141: p. 1-11. [9] G.M. Ge F. Xiao X.H. Xu Model-based optimal control of a dedicated outdoor air-chilled ceiling system using liquid desiccant and membrane-based total heat recovery Appl Energy 88 11 2011 4180 4190 G.M. Ge, F. Xiao, X.H. Xu. Model-based optimal control of a dedicated outdoor air-chilled ceiling system using liquid desiccant and membrane-based total heat recovery. Applied Energy, 2011. 88(11): p. 4180-4190. [10] B.K. Naik P. Muthukumar P.S. Kumar A novel finite difference model coupled with recursive algorithm for analyzing heat and mass transfer processes in a cross flow dehumidifier/regenerator Int J Therm Sci 131 2018 1 13 Naik, B.K., Muthukumar, P., Kumar, P.S.. A novel finite difference model coupled with recursive algorithm for analyzing heat and mass transfer processes in a cross flow dehumidifier/regenerator. International Journal of Thermal Sciences, 2018. 131: p. 1-13. [11] D.G. Peng X.S. Chen S.L. Li X.S. Zhang D.T. Luo Mathematical model and performance analysis of a novel outside evaporative cooling liquid desiccant dehumidifier Int J Refrig 82 2017 212 226 D.G. Peng, X.S. Chen, S.L. Li, X.S. Zhang, D.T. Luo. Mathematical model and performance analysis of a novel outside evaporative cooling liquid desiccant dehumidifier. International Journal of Refrigeration, 2017. 82: p. 212-226. [12] Y.C. Xie Z. Xu N. Mei Evaluation of the effectiveness-NTU method for countercurrent humidifier Appl Therm Eng 99 2016 1270 1276 Y.C. Xie, Z. Xu, N. Mei. Evaluation of the effectiveness-NTU method for countercurrent humidifier. Applied Thermal Engineering, 2016. 99: p. 1270-1276. [13] L. Omidvar Langroudi H. Pahlavanzadeh S.M. Mousavi Statistical evaluation of a liquid desiccant dehumidification system using RSM and theoretical study based on the effectiveness NTU model J Ind Eng Chem 20 2014 2975 2983 Langroudi, L.Omidvar, Pahlavanzadeh, H., Mousavi, S.M.. Statistical evaluation of a liquid desiccant dehumidification system using RSM and theoretical study based on the effectiveness NTU model. Journal of Industrial and Engineering Chemistry, 2014. 20: p. 2975\u20132983. [14] X.L. Wang W.J. Cai J.G. Lu Y.X. Sun X.D. Ding A hybrid dehumidifier model for real-time performance monitoring, control and optimization in liquid desiccant dehumidification system Appl Energy 111 2013 449 455 X.L. Wang, W.J. Cai, J.G. Lu, Y.X. Sun, X.D. Ding. A hybrid dehumidifier model for real-time performance monitoring, control and optimization in liquid desiccant dehumidification system. Applied Energy, 2013. 111: p. 449-455. [15] J.Y. Park D.S. Yoon S.J. Lee J.W. Jeong Empirical model for predicting the dehumidification effectiveness of a liquid desiccant system Energy Build 126 2016 447 454 Park, J.Y., Yoon, D.S., Lee, S.J., Jeong, J.W.. Empirical model for predicting the dehumidification effectiveness of a liquid desiccant system. Energy and Buildings, 2016. 126: p. 447-454. [16] X.L. Wang W.J. Cai X.H. Yin A global optimized operation strategy for energy savings in liquid desiccant air conditioning using self-adaptive differential evolutionary algorithm Appl Energy 187 2017 410 423 X.L. Wang, W.J. Cai, X.H. Yin. A global optimized operation strategy for energy savings in liquid desiccant air conditioning using self-adaptive differential evolutionary algorithm. Applied Energy, 2017. 187: p. 410-423. [17] X.H. Ou W.J. Cai X.X. He Model-based optimization strategy for a liquid desiccant cooling and dehumidification system Energy Build 194 2019 21 32 X.H. Ou, W.J. Cai, X.X. He. Model-based optimization strategy for a liquid desiccant cooling and dehumidification system. Energy and Buildings, 2019. 194: p. 21-32. [18] M. Tu H. Huang Z.H. Liu H.X. Chen Factor analysis and optimization of operational parameters in a liquid desiccant air-conditioning system Energy 139 2017 767 781 M. Tu, H. Huang, Z.H. Liu, H.X. Chen. Factor analysis and optimization of operational parameters in a liquid desiccant air-conditioning system. Energy, 2017. 139: p. 767-781. [19] X.H. Ou W.J. Cai X.X. He Y.M. Wu Dynamic model development of heat and mass transfer for a novel desiccant regeneration system in liquid desiccant dehumidification system Appl Therm Eng 145 2018 375 385 X.H. Ou, W.J. Cai, X.X. He, Y.M. Wu. Dynamic model development of heat and mass transfer for a novel desiccant regeneration system in liquid desiccant dehumidification system. Applied Thermal Engineering, 2018. 145: p. 375-385. [20] S.W. Peng Z.M. Pan Heat and mass transfer in liquid desiccant air-conditioning process at low flow conditions Commun Nonlinear Sci Numer Simul 14 2009 3599 3607 S.W. Peng, Z.M. Pan. Heat and mass transfer in liquid desiccant air-conditioning process at low flow conditions, Communications in Nonlinear Science and Numerical Simulation. 2009. 14: p. 3599\u20133607. [21] R. Namvar G.M. Ge C.J. Simonson R.W. Besant Transient heat and moisture transfer characteristics of a liquid-to-air membrane energy exchanger (LAMEE) model verification and extrapolation Int J Heat Mass Transf 66 2013 757 771 R. Namvar, G.M. Ge, C.J. Simonson, R.W. Besant. Transient heat and moisture transfer characteristics of a liquid-to-air membrane energy exchanger (LAMEE) model verification and extrapolation, International Journal of Heat and Mass Transfer, 2013. 66: p. 757\u2013771. [22] X. Li S. Liu K.K. Tan Q.G. Wang W.J. Cai L.H. Xie Dynamic modeling of a liquid desiccant dehumidifier Appl Energy 180 2016 435 445 X. Li, S. Liu, K.K. Tan, Q.G. Wang, W.J. Cai, L.H. Xie. Dynamic modeling of a liquid desiccant dehumidifier. Applied Energy, 2016. 180: p. 435-445. [23] L.S. Wang F. Xiao X.F. Niu D.C. Gao A dynamic dehumidifier model for simulations and control of liquid desiccant hybrid air conditioning systems Energy Build 140 2017 418 429 L.S. Wang, F. Xiao, X.F. Niu, D.C. Gao. A dynamic dehumidifier model for simulations and control of liquid desiccant hybrid air conditioning systems. Energy and Buildings, 2017. 140: p. 418-429. [24] A.T. Mohammad S. Bin Mat K. Sopian A.A. Al-abidi Review, Survey of the control strategy of liquid desiccant systems Renew Sustain Energy Rev 58 2016 250 258 AT. Mohammad, S. Bin Mat, K. Sopian, AA. Al-abidi. Review: Survey of the control strategy of liquid desiccant systems. Renewable and Sustainable Energy Reviews, 2016. 58: p. 250-258. [25] F. Xiao G.M. Ge X.F. Niu Control performance of a dedicated outdoor air system adopting liquid desiccant dehumidification Appl Energy 88 2011 143 149 F. Xiao, G.M. Ge, X.F. Niu. Control performance of a dedicated outdoor air system adopting liquid desiccant dehumidification. Applied Energy 2011. 88: p. 143\u2013149. [26] J. Shi N.P. Yu W.X. Yao Energy Efficient Building HVAC Control Algorithm with Real-time Occupancy Prediction Energy Procedia 111 2017 267 276 J. Shi, N.P. Yu, W.X. Yao. Energy Efficient Building HVAC Control Algorithm with Real-time Occupancy Prediction. Energy Procedia, 2017. 111: p. 267-276. [27] A. Ruano S. Pesteh S. Silva H. Duarte G. Mestre P.M. Ferreira PVM-based intelligent predictive control of HVAC systems IFAC-PapersOnLine 49 5 2016 371 376 A. Ruano, S. Pesteh, S. Silva, H. Duarte, G. Mestre, P.M. Ferreira, H. Khosravani, R. Horta. PVM-based intelligent predictive control of HVAC systems. IFAC-PapersOnLine, 2016. 49(5): p. 371-376. [28] M. Razmara M. Maasoumy M. Shahbakhti R.D. Robinett Optimal exergy control of building HVAC system Appl Energy 156 2015 555 565 M. Razmara, M. Maasoumy, M. Shahbakhti, R.D. Robinett. Optimal exergy control of building HVAC system. Applied Energy, 2015. 156: p. 555-565. [29] G. Bianchini M. Casini D. Pepe A. Vicino G.G. Zanvettor An integrated model predictive control approach for optimal HVAC and energy storage operation in large-scale buildings Appl Energy 240 2019 327 340 G. Bianchini, M. Casini, D. Pepe, A. Vicino, G.G. Zanvettor. An integrated model predictive control approach for optimal HVAC and energy storage operation in large-scale buildings. Applied Energy, 2019. 240: p. 327-340. [30] Y. Yao J. Chen Global optimization of a central air-conditioning system using decomposition-coordination method Energy Build 42 5 2010 570 583 Y. Yao, J. Chen. Global optimization of a central air-conditioning system using decomposition-coordination method. Energy and Buildings, 2010. 42(5): p. 570-583. [31] L. Naderloo H. Javadikia M. Mostafaei Modeling the energy ratio and productivity of biodiesel with different reactor dimensions and ultrasonic power using ANFIS Renew Sustain Energy Rev 70 2017 56 64 L.Naderloo,H.Javadikia,M. Mostafaei. Modeling the energy ratio and productivity of biodiesel with different reactor dimensions and ultrasonic power using ANFIS. Renewable and Sustainable Energy Reviews,2017. 70: p. 56-64 [32] M. Mostafaei H. Javadikia L. Naderloo Modeling the effects of ultrasound power and reactor dimension on the biodiesel production yield: comparison of prediction abilities between response surface methodology (RSM) and adaptive neuro-fuzzy inference system (ANFIS) Energy 115 2016 626 636 M.Mostafaei,H.Javadikia,L. Naderloo. Modeling the effects of ultrasound power and reactor dimension on the biodiesel production yield: comparison of prediction abilities between response surface methodology(RSM) and adaptive neuro-fuzzy inference system (ANFIS). Energy,2016. 115: p. 626-636 [33] A. Zendehboudi A. Tatar X.T. Li A comparative study and prediction of the liquid desiccant dehumidifiers using intelligent models Renew Energy 114 2017 1023 1035 A. Zendehboudi, A. Tatar, X.T. Li. A comparative study and prediction of the liquid desiccant dehumidifiers using intelligent models. Renewable Energy, 2017. 114: p. 1023-1035. [34] A. Preglej J. Pehrl D. Schwingshackl I. Steiner M. Horn I. Skrjanc Energy-efficient fuzzy model-based multivariable predictive control of a HVAC system Energy Build 82 2014 520 533 A. Preglej, J. Pehrl, D. Schwingshackl, I. Steiner, M. Horn, I. Skrjanc. Energy-efficient fuzzy model-based multivariable predictive control of a HVAC system. Energy and Buildings, 2014. 82: p. 520-533. [35] Q. Wu W.J. Cai X.L. Wang A. Chakraborty Dehumidifier desiccant concentration soft-sensor for a distributed operating Liquid Desiccant Dehumidification System Energy Build 129 2016 215 226 Q. Wu, W.J. Cai, X.L. Wang, A. Chakraborty. Dehumidifier desiccant concentration soft-sensor for a distributed operating Liquid Desiccant Dehumidification System. Energy and Buildings, 2016. 129: p. 215-226.",
    "scopus-id": "85076240515",
    "coredata": {
        "eid": "1-s2.0-S0306261919318616",
        "dc:description": "As a good alternative to cooling-based air dehumidification, Liquid Desiccant Air Conditioning (LDAC) has drawn increasing attention for energy saving in large-scale public buildings. However, available investigations mostly pay attention to the dehumidification performance analysis and optimization based on steady-state models. Dynamic control issues for LDAC are rather important to the system performance and economic cost under the changing working conditions, such as the changing setting points of indoor air conditions and sensible/latent loads in occupied space. In this study, a dynamic model based on the Adaptive Neuro-Fuzzy Inference System (ANFIS) method is established to describe the system output air temperature and humidity ratio of LDAC dynamically with varied input conditions. The verification results show that a good agreement can be found between the prediction results from the proposed model and the experimental data with the relative errors less than 2% for outlet air temperature and less than 4% for outlet air humidity ratio, respectively. An EMPC strategy is designed based on the proposed dynamic model for LDAC by solving a receding optimization problem considering tracking error, control efforts rate, and energy consumption as the objective functions with Genetic Algorithm (GA) to get optimal dynamic response and improve the energy efficiency as well. The simulation analysis shows the proposed EMPC strategy outperforms Proportional\u2013Integral (PI) control with smaller tracking error, faster response, and higher energy efficiency. The average energy saving by the proposed EMPC strategy can reach up to 9.5%.",
        "openArchiveArticle": "false",
        "prism:coverDate": "2020-02-01",
        "openaccessUserLicense": null,
        "prism:aggregationType": "Journal",
        "prism:url": "https://api.elsevier.com/content/article/pii/S0306261919318616",
        "dc:creator": [
            {
                "@_fa": "true",
                "$": "Jiang, Yuliang"
            },
            {
                "@_fa": "true",
                "$": "Wang, Xinli"
            },
            {
                "@_fa": "true",
                "$": "Zhao, Hongxia"
            },
            {
                "@_fa": "true",
                "$": "Wang, Lei"
            },
            {
                "@_fa": "true",
                "$": "Yin, Xiaohong"
            },
            {
                "@_fa": "true",
                "$": "Jia, Lei"
            }
        ],
        "link": [
            {
                "@_fa": "true",
                "@rel": "self",
                "@href": "https://api.elsevier.com/content/article/pii/S0306261919318616"
            },
            {
                "@_fa": "true",
                "@rel": "scidir",
                "@href": "https://www.sciencedirect.com/science/article/pii/S0306261919318616"
            }
        ],
        "dc:format": "application/json",
        "openaccessType": null,
        "pii": "S0306-2619(19)31861-6",
        "prism:volume": "259",
        "articleNumber": "114174",
        "prism:publisher": "Elsevier Ltd.",
        "dc:title": "Dynamic modeling and economic model predictive control of a liquid desiccant air conditioning",
        "prism:copyright": "© 2019 Elsevier Ltd. All rights reserved.",
        "openaccess": "0",
        "prism:issn": "03062619",
        "dcterms:subject": [
            {
                "@_fa": "true",
                "$": "Liquid desiccant"
            },
            {
                "@_fa": "true",
                "$": "EMPC"
            },
            {
                "@_fa": "true",
                "$": "Dynamic modeling"
            },
            {
                "@_fa": "true",
                "$": "Energy conversation"
            },
            {
                "@_fa": "true",
                "$": "ANFIS"
            },
            {
                "@_fa": "true",
                "$": "Genetic Algorithm"
            }
        ],
        "openaccessArticle": "false",
        "prism:publicationName": "Applied Energy",
        "openaccessSponsorType": null,
        "prism:pageRange": "114174",
        "pubType": "fla",
        "prism:coverDisplayDate": "1 February 2020",
        "prism:doi": "10.1016/j.apenergy.2019.114174",
        "prism:startingPage": "114174",
        "dc:identifier": "doi:10.1016/j.apenergy.2019.114174",
        "openaccessSponsorName": null
    },
    "objects": {"object": [
        {
            "@category": "standard",
            "@height": "215",
            "@width": "622",
            "@_fa": "true",
            "$": "https://api.elsevier.com/content/object/eid/1-s2.0-S0306261919318616-gr1.jpg?httpAccept=%2A%2F%2A",
            "@multimediatype": "JPEG image file",
            "@type": "IMAGE-DOWNSAMPLED",
            "@size": "29057",
            "@ref": "gr1",
            "@mimetype": "image/jpeg"
        },
        {
            "@category": "standard",
            "@height": "322",
            "@width": "706",
            "@_fa": "true",
            "$": "https://api.elsevier.com/content/object/eid/1-s2.0-S0306261919318616-gr10.jpg?httpAccept=%2A%2F%2A",
            "@multimediatype": "JPEG image file",
            "@type": "IMAGE-DOWNSAMPLED",
            "@size": "32366",
            "@ref": "gr10",
            "@mimetype": "image/jpeg"
        },
        {
            "@category": "standard",
            "@height": "281",
            "@width": "350",
            "@_fa": "true",
            "$": "https://api.elsevier.com/content/object/eid/1-s2.0-S0306261919318616-gr11.jpg?httpAccept=%2A%2F%2A",
            "@multimediatype": "JPEG image file",
            "@type": "IMAGE-DOWNSAMPLED",
            "@size": "34719",
            "@ref": "gr11",
            "@mimetype": "image/jpeg"
        },
        {
            "@category": "standard",
            "@height": "406",
            "@width": "574",
            "@_fa": "true",
            "$": "https://api.elsevier.com/content/object/eid/1-s2.0-S0306261919318616-gr12.jpg?httpAccept=%2A%2F%2A",
            "@multimediatype": "JPEG image file",
            "@type": "IMAGE-DOWNSAMPLED",
            "@size": "33676",
            "@ref": "gr12",
            "@mimetype": "image/jpeg"
        },
        {
            "@category": "standard",
            "@height": "226",
            "@width": "575",
            "@_fa": "true",
            "$": "https://api.elsevier.com/content/object/eid/1-s2.0-S0306261919318616-gr13.jpg?httpAccept=%2A%2F%2A",
            "@multimediatype": "JPEG image file",
            "@type": "IMAGE-DOWNSAMPLED",
            "@size": "15998",
            "@ref": "gr13",
            "@mimetype": "image/jpeg"
        },
        {
            "@category": "standard",
            "@height": "436",
            "@width": "613",
            "@_fa": "true",
            "$": "https://api.elsevier.com/content/object/eid/1-s2.0-S0306261919318616-gr14.jpg?httpAccept=%2A%2F%2A",
            "@multimediatype": "JPEG image file",
            "@type": "IMAGE-DOWNSAMPLED",
            "@size": "44537",
            "@ref": "gr14",
            "@mimetype": "image/jpeg"
        },
        {
            "@category": "standard",
            "@height": "454",
            "@width": "615",
            "@_fa": "true",
            "$": "https://api.elsevier.com/content/object/eid/1-s2.0-S0306261919318616-gr15.jpg?httpAccept=%2A%2F%2A",
            "@multimediatype": "JPEG image file",
            "@type": "IMAGE-DOWNSAMPLED",
            "@size": "41467",
            "@ref": "gr15",
            "@mimetype": "image/jpeg"
        },
        {
            "@category": "standard",
            "@height": "336",
            "@width": "556",
            "@_fa": "true",
            "$": "https://api.elsevier.com/content/object/eid/1-s2.0-S0306261919318616-gr2.jpg?httpAccept=%2A%2F%2A",
            "@multimediatype": "JPEG image file",
            "@type": "IMAGE-DOWNSAMPLED",
            "@size": "26998",
            "@ref": "gr2",
            "@mimetype": "image/jpeg"
        },
        {
            "@category": "standard",
            "@height": "416",
            "@width": "555",
            "@_fa": "true",
            "$": "https://api.elsevier.com/content/object/eid/1-s2.0-S0306261919318616-gr3.jpg?httpAccept=%2A%2F%2A",
            "@multimediatype": "JPEG image file",
            "@type": "IMAGE-DOWNSAMPLED",
            "@size": "67235",
            "@ref": "gr3",
            "@mimetype": "image/jpeg"
        },
        {
            "@category": "standard",
            "@height": "371",
            "@width": "598",
            "@_fa": "true",
            "$": "https://api.elsevier.com/content/object/eid/1-s2.0-S0306261919318616-gr4.jpg?httpAccept=%2A%2F%2A",
            "@multimediatype": "JPEG image file",
            "@type": "IMAGE-DOWNSAMPLED",
            "@size": "34633",
            "@ref": "gr4",
            "@mimetype": "image/jpeg"
        },
        {
            "@category": "standard",
            "@height": "417",
            "@width": "576",
            "@_fa": "true",
            "$": "https://api.elsevier.com/content/object/eid/1-s2.0-S0306261919318616-gr5.jpg?httpAccept=%2A%2F%2A",
            "@multimediatype": "JPEG image file",
            "@type": "IMAGE-DOWNSAMPLED",
            "@size": "40258",
            "@ref": "gr5",
            "@mimetype": "image/jpeg"
        },
        {
            "@category": "standard",
            "@height": "511",
            "@width": "572",
            "@_fa": "true",
            "$": "https://api.elsevier.com/content/object/eid/1-s2.0-S0306261919318616-gr6.jpg?httpAccept=%2A%2F%2A",
            "@multimediatype": "JPEG image file",
            "@type": "IMAGE-DOWNSAMPLED",
            "@size": "57538",
            "@ref": "gr6",
            "@mimetype": "image/jpeg"
        },
        {
            "@category": "standard",
            "@height": "295",
            "@width": "616",
            "@_fa": "true",
            "$": "https://api.elsevier.com/content/object/eid/1-s2.0-S0306261919318616-gr7.jpg?httpAccept=%2A%2F%2A",
            "@multimediatype": "JPEG image file",
            "@type": "IMAGE-DOWNSAMPLED",
            "@size": "29167",
            "@ref": "gr7",
            "@mimetype": "image/jpeg"
        },
        {
            "@category": "standard",
            "@height": "559",
            "@width": "666",
            "@_fa": "true",
            "$": "https://api.elsevier.com/content/object/eid/1-s2.0-S0306261919318616-gr8.jpg?httpAccept=%2A%2F%2A",
            "@multimediatype": "JPEG image file",
            "@type": "IMAGE-DOWNSAMPLED",
            "@size": "71920",
            "@ref": "gr8",
            "@mimetype": "image/jpeg"
        },
        {
            "@category": "standard",
            "@height": "446",
            "@width": "616",
            "@_fa": "true",
            "$": "https://api.elsevier.com/content/object/eid/1-s2.0-S0306261919318616-gr9.jpg?httpAccept=%2A%2F%2A",
            "@multimediatype": "JPEG image file",
            "@type": "IMAGE-DOWNSAMPLED",
            "@size": "43281",
            "@ref": "gr9",
            "@mimetype": "image/jpeg"
        },
        {
            "@category": "thumbnail",
            "@height": "76",
            "@width": "219",
            "@_fa": "true",
            "$": "https://api.elsevier.com/content/object/eid/1-s2.0-S0306261919318616-gr1.sml?httpAccept=%2A%2F%2A",
            "@multimediatype": "GIF image file",
            "@type": "IMAGE-THUMBNAIL",
            "@size": "5356",
            "@ref": "gr1",
            "@mimetype": "image/gif"
        },
        {
            "@category": "thumbnail",
            "@height": "100",
            "@width": "219",
            "@_fa": "true",
            "$": "https://api.elsevier.com/content/object/eid/1-s2.0-S0306261919318616-gr10.sml?httpAccept=%2A%2F%2A",
            "@multimediatype": "GIF image file",
            "@type": "IMAGE-THUMBNAIL",
            "@size": "4364",
            "@ref": "gr10",
            "@mimetype": "image/gif"
        },
        {
            "@category": "thumbnail",
            "@height": "164",
            "@width": "204",
            "@_fa": "true",
            "$": "https://api.elsevier.com/content/object/eid/1-s2.0-S0306261919318616-gr11.sml?httpAccept=%2A%2F%2A",
            "@multimediatype": "GIF image file",
            "@type": "IMAGE-THUMBNAIL",
            "@size": "17912",
            "@ref": "gr11",
            "@mimetype": "image/gif"
        },
        {
            "@category": "thumbnail",
            "@height": "155",
            "@width": "219",
            "@_fa": "true",
            "$": "https://api.elsevier.com/content/object/eid/1-s2.0-S0306261919318616-gr12.sml?httpAccept=%2A%2F%2A",
            "@multimediatype": "GIF image file",
            "@type": "IMAGE-THUMBNAIL",
            "@size": "5974",
            "@ref": "gr12",
            "@mimetype": "image/gif"
        },
        {
            "@category": "thumbnail",
            "@height": "86",
            "@width": "219",
            "@_fa": "true",
            "$": "https://api.elsevier.com/content/object/eid/1-s2.0-S0306261919318616-gr13.sml?httpAccept=%2A%2F%2A",
            "@multimediatype": "GIF image file",
            "@type": "IMAGE-THUMBNAIL",
            "@size": "3142",
            "@ref": "gr13",
            "@mimetype": "image/gif"
        },
        {
            "@category": "thumbnail",
            "@height": "156",
            "@width": "219",
            "@_fa": "true",
            "$": "https://api.elsevier.com/content/object/eid/1-s2.0-S0306261919318616-gr14.sml?httpAccept=%2A%2F%2A",
            "@multimediatype": "GIF image file",
            "@type": "IMAGE-THUMBNAIL",
            "@size": "6533",
            "@ref": "gr14",
            "@mimetype": "image/gif"
        },
        {
            "@category": "thumbnail",
            "@height": "162",
            "@width": "219",
            "@_fa": "true",
            "$": "https://api.elsevier.com/content/object/eid/1-s2.0-S0306261919318616-gr15.sml?httpAccept=%2A%2F%2A",
            "@multimediatype": "GIF image file",
            "@type": "IMAGE-THUMBNAIL",
            "@size": "6584",
            "@ref": "gr15",
            "@mimetype": "image/gif"
        },
        {
            "@category": "thumbnail",
            "@height": "132",
            "@width": "219",
            "@_fa": "true",
            "$": "https://api.elsevier.com/content/object/eid/1-s2.0-S0306261919318616-gr2.sml?httpAccept=%2A%2F%2A",
            "@multimediatype": "GIF image file",
            "@type": "IMAGE-THUMBNAIL",
            "@size": "4911",
            "@ref": "gr2",
            "@mimetype": "image/gif"
        },
        {
            "@category": "thumbnail",
            "@height": "164",
            "@width": "219",
            "@_fa": "true",
            "$": "https://api.elsevier.com/content/object/eid/1-s2.0-S0306261919318616-gr3.sml?httpAccept=%2A%2F%2A",
            "@multimediatype": "GIF image file",
            "@type": "IMAGE-THUMBNAIL",
            "@size": "31327",
            "@ref": "gr3",
            "@mimetype": "image/gif"
        },
        {
            "@category": "thumbnail",
            "@height": "136",
            "@width": "219",
            "@_fa": "true",
            "$": "https://api.elsevier.com/content/object/eid/1-s2.0-S0306261919318616-gr4.sml?httpAccept=%2A%2F%2A",
            "@multimediatype": "GIF image file",
            "@type": "IMAGE-THUMBNAIL",
            "@size": "5566",
            "@ref": "gr4",
            "@mimetype": "image/gif"
        },
        {
            "@category": "thumbnail",
            "@height": "159",
            "@width": "219",
            "@_fa": "true",
            "$": "https://api.elsevier.com/content/object/eid/1-s2.0-S0306261919318616-gr5.sml?httpAccept=%2A%2F%2A",
            "@multimediatype": "GIF image file",
            "@type": "IMAGE-THUMBNAIL",
            "@size": "7148",
            "@ref": "gr5",
            "@mimetype": "image/gif"
        },
        {
            "@category": "thumbnail",
            "@height": "163",
            "@width": "183",
            "@_fa": "true",
            "$": "https://api.elsevier.com/content/object/eid/1-s2.0-S0306261919318616-gr6.sml?httpAccept=%2A%2F%2A",
            "@multimediatype": "GIF image file",
            "@type": "IMAGE-THUMBNAIL",
            "@size": "9631",
            "@ref": "gr6",
            "@mimetype": "image/gif"
        },
        {
            "@category": "thumbnail",
            "@height": "105",
            "@width": "219",
            "@_fa": "true",
            "$": "https://api.elsevier.com/content/object/eid/1-s2.0-S0306261919318616-gr7.sml?httpAccept=%2A%2F%2A",
            "@multimediatype": "GIF image file",
            "@type": "IMAGE-THUMBNAIL",
            "@size": "4754",
            "@ref": "gr7",
            "@mimetype": "image/gif"
        },
        {
            "@category": "thumbnail",
            "@height": "164",
            "@width": "195",
            "@_fa": "true",
            "$": "https://api.elsevier.com/content/object/eid/1-s2.0-S0306261919318616-gr8.sml?httpAccept=%2A%2F%2A",
            "@multimediatype": "GIF image file",
            "@type": "IMAGE-THUMBNAIL",
            "@size": "9910",
            "@ref": "gr8",
            "@mimetype": "image/gif"
        },
        {
            "@category": "thumbnail",
            "@height": "159",
            "@width": "219",
            "@_fa": "true",
            "$": "https://api.elsevier.com/content/object/eid/1-s2.0-S0306261919318616-gr9.sml?httpAccept=%2A%2F%2A",
            "@multimediatype": "GIF image file",
            "@type": "IMAGE-THUMBNAIL",
            "@size": "6877",
            "@ref": "gr9",
            "@mimetype": "image/gif"
        },
        {
            "@category": "high",
            "@height": "954",
            "@width": "2756",
            "@_fa": "true",
            "$": "https://api.elsevier.com/content/object/eid/1-s2.0-S0306261919318616-gr1_lrg.jpg?httpAccept=%2A%2F%2A",
            "@multimediatype": "JPEG image file",
            "@type": "IMAGE-HIGH-RES",
            "@size": "175318",
            "@ref": "gr1",
            "@mimetype": "image/jpeg"
        },
        {
            "@category": "high",
            "@height": "1424",
            "@width": "3126",
            "@_fa": "true",
            "$": "https://api.elsevier.com/content/object/eid/1-s2.0-S0306261919318616-gr10_lrg.jpg?httpAccept=%2A%2F%2A",
            "@multimediatype": "JPEG image file",
            "@type": "IMAGE-HIGH-RES",
            "@size": "178177",
            "@ref": "gr10",
            "@mimetype": "image/jpeg"
        },
        {
            "@category": "high",
            "@height": "1247",
            "@width": "1553",
            "@_fa": "true",
            "$": "https://api.elsevier.com/content/object/eid/1-s2.0-S0306261919318616-gr11_lrg.jpg?httpAccept=%2A%2F%2A",
            "@multimediatype": "JPEG image file",
            "@type": "IMAGE-HIGH-RES",
            "@size": "306354",
            "@ref": "gr11",
            "@mimetype": "image/jpeg"
        },
        {
            "@category": "high",
            "@height": "1798",
            "@width": "2542",
            "@_fa": "true",
            "$": "https://api.elsevier.com/content/object/eid/1-s2.0-S0306261919318616-gr12_lrg.jpg?httpAccept=%2A%2F%2A",
            "@multimediatype": "JPEG image file",
            "@type": "IMAGE-HIGH-RES",
            "@size": "193247",
            "@ref": "gr12",
            "@mimetype": "image/jpeg"
        },
        {
            "@category": "high",
            "@height": "1002",
            "@width": "2545",
            "@_fa": "true",
            "$": "https://api.elsevier.com/content/object/eid/1-s2.0-S0306261919318616-gr13_lrg.jpg?httpAccept=%2A%2F%2A",
            "@multimediatype": "JPEG image file",
            "@type": "IMAGE-HIGH-RES",
            "@size": "101163",
            "@ref": "gr13",
            "@mimetype": "image/jpeg"
        },
        {
            "@category": "high",
            "@height": "1930",
            "@width": "2713",
            "@_fa": "true",
            "$": "https://api.elsevier.com/content/object/eid/1-s2.0-S0306261919318616-gr14_lrg.jpg?httpAccept=%2A%2F%2A",
            "@multimediatype": "JPEG image file",
            "@type": "IMAGE-HIGH-RES",
            "@size": "217614",
            "@ref": "gr14",
            "@mimetype": "image/jpeg"
        },
        {
            "@category": "high",
            "@height": "2013",
            "@width": "2724",
            "@_fa": "true",
            "$": "https://api.elsevier.com/content/object/eid/1-s2.0-S0306261919318616-gr15_lrg.jpg?httpAccept=%2A%2F%2A",
            "@multimediatype": "JPEG image file",
            "@type": "IMAGE-HIGH-RES",
            "@size": "213023",
            "@ref": "gr15",
            "@mimetype": "image/jpeg"
        },
        {
            "@category": "high",
            "@height": "1488",
            "@width": "2461",
            "@_fa": "true",
            "$": "https://api.elsevier.com/content/object/eid/1-s2.0-S0306261919318616-gr2_lrg.jpg?httpAccept=%2A%2F%2A",
            "@multimediatype": "JPEG image file",
            "@type": "IMAGE-HIGH-RES",
            "@size": "151631",
            "@ref": "gr2",
            "@mimetype": "image/jpeg"
        },
        {
            "@category": "high",
            "@height": "1107",
            "@width": "1476",
            "@_fa": "true",
            "$": "https://api.elsevier.com/content/object/eid/1-s2.0-S0306261919318616-gr3_lrg.jpg?httpAccept=%2A%2F%2A",
            "@multimediatype": "JPEG image file",
            "@type": "IMAGE-HIGH-RES",
            "@size": "200444",
            "@ref": "gr3",
            "@mimetype": "image/jpeg"
        },
        {
            "@category": "high",
            "@height": "1642",
            "@width": "2650",
            "@_fa": "true",
            "$": "https://api.elsevier.com/content/object/eid/1-s2.0-S0306261919318616-gr4_lrg.jpg?httpAccept=%2A%2F%2A",
            "@multimediatype": "JPEG image file",
            "@type": "IMAGE-HIGH-RES",
            "@size": "200094",
            "@ref": "gr4",
            "@mimetype": "image/jpeg"
        },
        {
            "@category": "high",
            "@height": "1849",
            "@width": "2552",
            "@_fa": "true",
            "$": "https://api.elsevier.com/content/object/eid/1-s2.0-S0306261919318616-gr5_lrg.jpg?httpAccept=%2A%2F%2A",
            "@multimediatype": "JPEG image file",
            "@type": "IMAGE-HIGH-RES",
            "@size": "222774",
            "@ref": "gr5",
            "@mimetype": "image/jpeg"
        },
        {
            "@category": "high",
            "@height": "2261",
            "@width": "2532",
            "@_fa": "true",
            "$": "https://api.elsevier.com/content/object/eid/1-s2.0-S0306261919318616-gr6_lrg.jpg?httpAccept=%2A%2F%2A",
            "@multimediatype": "JPEG image file",
            "@type": "IMAGE-HIGH-RES",
            "@size": "362493",
            "@ref": "gr6",
            "@mimetype": "image/jpeg"
        },
        {
            "@category": "high",
            "@height": "1308",
            "@width": "2728",
            "@_fa": "true",
            "$": "https://api.elsevier.com/content/object/eid/1-s2.0-S0306261919318616-gr7_lrg.jpg?httpAccept=%2A%2F%2A",
            "@multimediatype": "JPEG image file",
            "@type": "IMAGE-HIGH-RES",
            "@size": "177588",
            "@ref": "gr7",
            "@mimetype": "image/jpeg"
        },
        {
            "@category": "high",
            "@height": "2477",
            "@width": "2949",
            "@_fa": "true",
            "$": "https://api.elsevier.com/content/object/eid/1-s2.0-S0306261919318616-gr8_lrg.jpg?httpAccept=%2A%2F%2A",
            "@multimediatype": "JPEG image file",
            "@type": "IMAGE-HIGH-RES",
            "@size": "383269",
            "@ref": "gr8",
            "@mimetype": "image/jpeg"
        },
        {
            "@category": "high",
            "@height": "1976",
            "@width": "2727",
            "@_fa": "true",
            "$": "https://api.elsevier.com/content/object/eid/1-s2.0-S0306261919318616-gr9_lrg.jpg?httpAccept=%2A%2F%2A",
            "@multimediatype": "JPEG image file",
            "@type": "IMAGE-HIGH-RES",
            "@size": "227876",
            "@ref": "gr9",
            "@mimetype": "image/jpeg"
        },
        {
            "@category": "thumbnail",
            "@_fa": "true",
            "$": "https://api.elsevier.com/content/object/eid/1-s2.0-S0306261919318616-si1.svg?httpAccept=%2A%2F%2A",
            "@multimediatype": "Scalable Vector Graphics file",
            "@type": "ALTIMG",
            "@size": "10956",
            "@ref": "si1",
            "@mimetype": "image/svg+xml"
        },
        {
            "@category": "thumbnail",
            "@_fa": "true",
            "$": "https://api.elsevier.com/content/object/eid/1-s2.0-S0306261919318616-si10.svg?httpAccept=%2A%2F%2A",
            "@multimediatype": "Scalable Vector Graphics file",
            "@type": "ALTIMG",
            "@size": "5396",
            "@ref": "si10",
            "@mimetype": "image/svg+xml"
        },
        {
            "@category": "thumbnail",
            "@_fa": "true",
            "$": "https://api.elsevier.com/content/object/eid/1-s2.0-S0306261919318616-si100.svg?httpAccept=%2A%2F%2A",
            "@multimediatype": "Scalable Vector Graphics file",
            "@type": "ALTIMG",
            "@size": "20156",
            "@ref": "si100",
            "@mimetype": "image/svg+xml"
        },
        {
            "@category": "thumbnail",
            "@_fa": "true",
            "$": "https://api.elsevier.com/content/object/eid/1-s2.0-S0306261919318616-si101.svg?httpAccept=%2A%2F%2A",
            "@multimediatype": "Scalable Vector Graphics file",
            "@type": "ALTIMG",
            "@size": "18779",
            "@ref": "si101",
            "@mimetype": "image/svg+xml"
        },
        {
            "@category": "thumbnail",
            "@_fa": "true",
            "$": "https://api.elsevier.com/content/object/eid/1-s2.0-S0306261919318616-si102.svg?httpAccept=%2A%2F%2A",
            "@multimediatype": "Scalable Vector Graphics file",
            "@type": "ALTIMG",
            "@size": "18141",
            "@ref": "si102",
            "@mimetype": "image/svg+xml"
        },
        {
            "@category": "thumbnail",
            "@_fa": "true",
            "$": "https://api.elsevier.com/content/object/eid/1-s2.0-S0306261919318616-si103.svg?httpAccept=%2A%2F%2A",
            "@multimediatype": "Scalable Vector Graphics file",
            "@type": "ALTIMG",
            "@size": "16810",
            "@ref": "si103",
            "@mimetype": "image/svg+xml"
        },
        {
            "@category": "thumbnail",
            "@_fa": "true",
            "$": "https://api.elsevier.com/content/object/eid/1-s2.0-S0306261919318616-si104.svg?httpAccept=%2A%2F%2A",
            "@multimediatype": "Scalable Vector Graphics file",
            "@type": "ALTIMG",
            "@size": "17096",
            "@ref": "si104",
            "@mimetype": "image/svg+xml"
        },
        {
            "@category": "thumbnail",
            "@_fa": "true",
            "$": "https://api.elsevier.com/content/object/eid/1-s2.0-S0306261919318616-si105.svg?httpAccept=%2A%2F%2A",
            "@multimediatype": "Scalable Vector Graphics file",
            "@type": "ALTIMG",
            "@size": "3880",
            "@ref": "si105",
            "@mimetype": "image/svg+xml"
        },
        {
            "@category": "thumbnail",
            "@_fa": "true",
            "$": "https://api.elsevier.com/content/object/eid/1-s2.0-S0306261919318616-si106.svg?httpAccept=%2A%2F%2A",
            "@multimediatype": "Scalable Vector Graphics file",
            "@type": "ALTIMG",
            "@size": "1569",
            "@ref": "si106",
            "@mimetype": "image/svg+xml"
        },
        {
            "@category": "thumbnail",
            "@_fa": "true",
            "$": "https://api.elsevier.com/content/object/eid/1-s2.0-S0306261919318616-si107.svg?httpAccept=%2A%2F%2A",
            "@multimediatype": "Scalable Vector Graphics file",
            "@type": "ALTIMG",
            "@size": "8112",
            "@ref": "si107",
            "@mimetype": "image/svg+xml"
        },
        {
            "@category": "thumbnail",
            "@_fa": "true",
            "$": "https://api.elsevier.com/content/object/eid/1-s2.0-S0306261919318616-si108.svg?httpAccept=%2A%2F%2A",
            "@multimediatype": "Scalable Vector Graphics file",
            "@type": "ALTIMG",
            "@size": "1708",
            "@ref": "si108",
            "@mimetype": "image/svg+xml"
        },
        {
            "@category": "thumbnail",
            "@_fa": "true",
            "$": "https://api.elsevier.com/content/object/eid/1-s2.0-S0306261919318616-si109.svg?httpAccept=%2A%2F%2A",
            "@multimediatype": "Scalable Vector Graphics file",
            "@type": "ALTIMG",
            "@size": "17883",
            "@ref": "si109",
            "@mimetype": "image/svg+xml"
        },
        {
            "@category": "thumbnail",
            "@_fa": "true",
            "$": "https://api.elsevier.com/content/object/eid/1-s2.0-S0306261919318616-si11.svg?httpAccept=%2A%2F%2A",
            "@multimediatype": "Scalable Vector Graphics file",
            "@type": "ALTIMG",
            "@size": "8006",
            "@ref": "si11",
            "@mimetype": "image/svg+xml"
        },
        {
            "@category": "thumbnail",
            "@_fa": "true",
            "$": "https://api.elsevier.com/content/object/eid/1-s2.0-S0306261919318616-si110.svg?httpAccept=%2A%2F%2A",
            "@multimediatype": "Scalable Vector Graphics file",
            "@type": "ALTIMG",
            "@size": "18237",
            "@ref": "si110",
            "@mimetype": "image/svg+xml"
        },
        {
            "@category": "thumbnail",
            "@_fa": "true",
            "$": "https://api.elsevier.com/content/object/eid/1-s2.0-S0306261919318616-si111.svg?httpAccept=%2A%2F%2A",
            "@multimediatype": "Scalable Vector Graphics file",
            "@type": "ALTIMG",
            "@size": "18161",
            "@ref": "si111",
            "@mimetype": "image/svg+xml"
        },
        {
            "@category": "thumbnail",
            "@_fa": "true",
            "$": "https://api.elsevier.com/content/object/eid/1-s2.0-S0306261919318616-si112.svg?httpAccept=%2A%2F%2A",
            "@multimediatype": "Scalable Vector Graphics file",
            "@type": "ALTIMG",
            "@size": "22324",
            "@ref": "si112",
            "@mimetype": "image/svg+xml"
        },
        {
            "@category": "thumbnail",
            "@_fa": "true",
            "$": "https://api.elsevier.com/content/object/eid/1-s2.0-S0306261919318616-si113.svg?httpAccept=%2A%2F%2A",
            "@multimediatype": "Scalable Vector Graphics file",
            "@type": "ALTIMG",
            "@size": "20294",
            "@ref": "si113",
            "@mimetype": "image/svg+xml"
        },
        {
            "@category": "thumbnail",
            "@_fa": "true",
            "$": "https://api.elsevier.com/content/object/eid/1-s2.0-S0306261919318616-si114.svg?httpAccept=%2A%2F%2A",
            "@multimediatype": "Scalable Vector Graphics file",
            "@type": "ALTIMG",
            "@size": "20936",
            "@ref": "si114",
            "@mimetype": "image/svg+xml"
        },
        {
            "@category": "thumbnail",
            "@_fa": "true",
            "$": "https://api.elsevier.com/content/object/eid/1-s2.0-S0306261919318616-si115.svg?httpAccept=%2A%2F%2A",
            "@multimediatype": "Scalable Vector Graphics file",
            "@type": "ALTIMG",
            "@size": "1377",
            "@ref": "si115",
            "@mimetype": "image/svg+xml"
        },
        {
            "@category": "thumbnail",
            "@_fa": "true",
            "$": "https://api.elsevier.com/content/object/eid/1-s2.0-S0306261919318616-si116.svg?httpAccept=%2A%2F%2A",
            "@multimediatype": "Scalable Vector Graphics file",
            "@type": "ALTIMG",
            "@size": "56928",
            "@ref": "si116",
            "@mimetype": "image/svg+xml"
        },
        {
            "@category": "thumbnail",
            "@_fa": "true",
            "$": "https://api.elsevier.com/content/object/eid/1-s2.0-S0306261919318616-si117.svg?httpAccept=%2A%2F%2A",
            "@multimediatype": "Scalable Vector Graphics file",
            "@type": "ALTIMG",
            "@size": "7477",
            "@ref": "si117",
            "@mimetype": "image/svg+xml"
        },
        {
            "@category": "thumbnail",
            "@_fa": "true",
            "$": "https://api.elsevier.com/content/object/eid/1-s2.0-S0306261919318616-si118.svg?httpAccept=%2A%2F%2A",
            "@multimediatype": "Scalable Vector Graphics file",
            "@type": "ALTIMG",
            "@size": "9642",
            "@ref": "si118",
            "@mimetype": "image/svg+xml"
        },
        {
            "@category": "thumbnail",
            "@_fa": "true",
            "$": "https://api.elsevier.com/content/object/eid/1-s2.0-S0306261919318616-si119.svg?httpAccept=%2A%2F%2A",
            "@multimediatype": "Scalable Vector Graphics file",
            "@type": "ALTIMG",
            "@size": "8844",
            "@ref": "si119",
            "@mimetype": "image/svg+xml"
        },
        {
            "@category": "thumbnail",
            "@_fa": "true",
            "$": "https://api.elsevier.com/content/object/eid/1-s2.0-S0306261919318616-si12.svg?httpAccept=%2A%2F%2A",
            "@multimediatype": "Scalable Vector Graphics file",
            "@type": "ALTIMG",
            "@size": "6576",
            "@ref": "si12",
            "@mimetype": "image/svg+xml"
        },
        {
            "@category": "thumbnail",
            "@_fa": "true",
            "$": "https://api.elsevier.com/content/object/eid/1-s2.0-S0306261919318616-si120.svg?httpAccept=%2A%2F%2A",
            "@multimediatype": "Scalable Vector Graphics file",
            "@type": "ALTIMG",
            "@size": "5094",
            "@ref": "si120",
            "@mimetype": "image/svg+xml"
        },
        {
            "@category": "thumbnail",
            "@_fa": "true",
            "$": "https://api.elsevier.com/content/object/eid/1-s2.0-S0306261919318616-si13.svg?httpAccept=%2A%2F%2A",
            "@multimediatype": "Scalable Vector Graphics file",
            "@type": "ALTIMG",
            "@size": "4629",
            "@ref": "si13",
            "@mimetype": "image/svg+xml"
        },
        {
            "@category": "thumbnail",
            "@_fa": "true",
            "$": "https://api.elsevier.com/content/object/eid/1-s2.0-S0306261919318616-si14.svg?httpAccept=%2A%2F%2A",
            "@multimediatype": "Scalable Vector Graphics file",
            "@type": "ALTIMG",
            "@size": "8024",
            "@ref": "si14",
            "@mimetype": "image/svg+xml"
        },
        {
            "@category": "thumbnail",
            "@_fa": "true",
            "$": "https://api.elsevier.com/content/object/eid/1-s2.0-S0306261919318616-si15.svg?httpAccept=%2A%2F%2A",
            "@multimediatype": "Scalable Vector Graphics file",
            "@type": "ALTIMG",
            "@size": "9677",
            "@ref": "si15",
            "@mimetype": "image/svg+xml"
        },
        {
            "@category": "thumbnail",
            "@_fa": "true",
            "$": "https://api.elsevier.com/content/object/eid/1-s2.0-S0306261919318616-si16.svg?httpAccept=%2A%2F%2A",
            "@multimediatype": "Scalable Vector Graphics file",
            "@type": "ALTIMG",
            "@size": "5825",
            "@ref": "si16",
            "@mimetype": "image/svg+xml"
        },
        {
            "@category": "thumbnail",
            "@_fa": "true",
            "$": "https://api.elsevier.com/content/object/eid/1-s2.0-S0306261919318616-si17.svg?httpAccept=%2A%2F%2A",
            "@multimediatype": "Scalable Vector Graphics file",
            "@type": "ALTIMG",
            "@size": "3111",
            "@ref": "si17",
            "@mimetype": "image/svg+xml"
        },
        {
            "@category": "thumbnail",
            "@_fa": "true",
            "$": "https://api.elsevier.com/content/object/eid/1-s2.0-S0306261919318616-si18.svg?httpAccept=%2A%2F%2A",
            "@multimediatype": "Scalable Vector Graphics file",
            "@type": "ALTIMG",
            "@size": "4098",
            "@ref": "si18",
            "@mimetype": "image/svg+xml"
        },
        {
            "@category": "thumbnail",
            "@_fa": "true",
            "$": "https://api.elsevier.com/content/object/eid/1-s2.0-S0306261919318616-si19.svg?httpAccept=%2A%2F%2A",
            "@multimediatype": "Scalable Vector Graphics file",
            "@type": "ALTIMG",
            "@size": "4261",
            "@ref": "si19",
            "@mimetype": "image/svg+xml"
        },
        {
            "@category": "thumbnail",
            "@_fa": "true",
            "$": "https://api.elsevier.com/content/object/eid/1-s2.0-S0306261919318616-si2.svg?httpAccept=%2A%2F%2A",
            "@multimediatype": "Scalable Vector Graphics file",
            "@type": "ALTIMG",
            "@size": "21533",
            "@ref": "si2",
            "@mimetype": "image/svg+xml"
        },
        {
            "@category": "thumbnail",
            "@_fa": "true",
            "$": "https://api.elsevier.com/content/object/eid/1-s2.0-S0306261919318616-si20.svg?httpAccept=%2A%2F%2A",
            "@multimediatype": "Scalable Vector Graphics file",
            "@type": "ALTIMG",
            "@size": "2538",
            "@ref": "si20",
            "@mimetype": "image/svg+xml"
        },
        {
            "@category": "thumbnail",
            "@_fa": "true",
            "$": "https://api.elsevier.com/content/object/eid/1-s2.0-S0306261919318616-si21.svg?httpAccept=%2A%2F%2A",
            "@multimediatype": "Scalable Vector Graphics file",
            "@type": "ALTIMG",
            "@size": "6273",
            "@ref": "si21",
            "@mimetype": "image/svg+xml"
        },
        {
            "@category": "thumbnail",
            "@_fa": "true",
            "$": "https://api.elsevier.com/content/object/eid/1-s2.0-S0306261919318616-si22.svg?httpAccept=%2A%2F%2A",
            "@multimediatype": "Scalable Vector Graphics file",
            "@type": "ALTIMG",
            "@size": "10665",
            "@ref": "si22",
            "@mimetype": "image/svg+xml"
        },
        {
            "@category": "thumbnail",
            "@_fa": "true",
            "$": "https://api.elsevier.com/content/object/eid/1-s2.0-S0306261919318616-si23.svg?httpAccept=%2A%2F%2A",
            "@multimediatype": "Scalable Vector Graphics file",
            "@type": "ALTIMG",
            "@size": "5691",
            "@ref": "si23",
            "@mimetype": "image/svg+xml"
        },
        {
            "@category": "thumbnail",
            "@_fa": "true",
            "$": "https://api.elsevier.com/content/object/eid/1-s2.0-S0306261919318616-si24.svg?httpAccept=%2A%2F%2A",
            "@multimediatype": "Scalable Vector Graphics file",
            "@type": "ALTIMG",
            "@size": "1536",
            "@ref": "si24",
            "@mimetype": "image/svg+xml"
        },
        {
            "@category": "thumbnail",
            "@_fa": "true",
            "$": "https://api.elsevier.com/content/object/eid/1-s2.0-S0306261919318616-si25.svg?httpAccept=%2A%2F%2A",
            "@multimediatype": "Scalable Vector Graphics file",
            "@type": "ALTIMG",
            "@size": "4677",
            "@ref": "si25",
            "@mimetype": "image/svg+xml"
        },
        {
            "@category": "thumbnail",
            "@_fa": "true",
            "$": "https://api.elsevier.com/content/object/eid/1-s2.0-S0306261919318616-si26.svg?httpAccept=%2A%2F%2A",
            "@multimediatype": "Scalable Vector Graphics file",
            "@type": "ALTIMG",
            "@size": "1754",
            "@ref": "si26",
            "@mimetype": "image/svg+xml"
        },
        {
            "@category": "thumbnail",
            "@_fa": "true",
            "$": "https://api.elsevier.com/content/object/eid/1-s2.0-S0306261919318616-si27.svg?httpAccept=%2A%2F%2A",
            "@multimediatype": "Scalable Vector Graphics file",
            "@type": "ALTIMG",
            "@size": "3419",
            "@ref": "si27",
            "@mimetype": "image/svg+xml"
        },
        {
            "@category": "thumbnail",
            "@_fa": "true",
            "$": "https://api.elsevier.com/content/object/eid/1-s2.0-S0306261919318616-si28.svg?httpAccept=%2A%2F%2A",
            "@multimediatype": "Scalable Vector Graphics file",
            "@type": "ALTIMG",
            "@size": "7742",
            "@ref": "si28",
            "@mimetype": "image/svg+xml"
        },
        {
            "@category": "thumbnail",
            "@_fa": "true",
            "$": "https://api.elsevier.com/content/object/eid/1-s2.0-S0306261919318616-si29.svg?httpAccept=%2A%2F%2A",
            "@multimediatype": "Scalable Vector Graphics file",
            "@type": "ALTIMG",
            "@size": "3400",
            "@ref": "si29",
            "@mimetype": "image/svg+xml"
        },
        {
            "@category": "thumbnail",
            "@_fa": "true",
            "$": "https://api.elsevier.com/content/object/eid/1-s2.0-S0306261919318616-si3.svg?httpAccept=%2A%2F%2A",
            "@multimediatype": "Scalable Vector Graphics file",
            "@type": "ALTIMG",
            "@size": "20375",
            "@ref": "si3",
            "@mimetype": "image/svg+xml"
        },
        {
            "@category": "thumbnail",
            "@_fa": "true",
            "$": "https://api.elsevier.com/content/object/eid/1-s2.0-S0306261919318616-si30.svg?httpAccept=%2A%2F%2A",
            "@multimediatype": "Scalable Vector Graphics file",
            "@type": "ALTIMG",
            "@size": "7723",
            "@ref": "si30",
            "@mimetype": "image/svg+xml"
        },
        {
            "@category": "thumbnail",
            "@_fa": "true",
            "$": "https://api.elsevier.com/content/object/eid/1-s2.0-S0306261919318616-si31.svg?httpAccept=%2A%2F%2A",
            "@multimediatype": "Scalable Vector Graphics file",
            "@type": "ALTIMG",
            "@size": "5161",
            "@ref": "si31",
            "@mimetype": "image/svg+xml"
        },
        {
            "@category": "thumbnail",
            "@_fa": "true",
            "$": "https://api.elsevier.com/content/object/eid/1-s2.0-S0306261919318616-si32.svg?httpAccept=%2A%2F%2A",
            "@multimediatype": "Scalable Vector Graphics file",
            "@type": "ALTIMG",
            "@size": "2511",
            "@ref": "si32",
            "@mimetype": "image/svg+xml"
        },
        {
            "@category": "thumbnail",
            "@_fa": "true",
            "$": "https://api.elsevier.com/content/object/eid/1-s2.0-S0306261919318616-si33.svg?httpAccept=%2A%2F%2A",
            "@multimediatype": "Scalable Vector Graphics file",
            "@type": "ALTIMG",
            "@size": "10286",
            "@ref": "si33",
            "@mimetype": "image/svg+xml"
        },
        {
            "@category": "thumbnail",
            "@_fa": "true",
            "$": "https://api.elsevier.com/content/object/eid/1-s2.0-S0306261919318616-si34.svg?httpAccept=%2A%2F%2A",
            "@multimediatype": "Scalable Vector Graphics file",
            "@type": "ALTIMG",
            "@size": "6340",
            "@ref": "si34",
            "@mimetype": "image/svg+xml"
        },
        {
            "@category": "thumbnail",
            "@_fa": "true",
            "$": "https://api.elsevier.com/content/object/eid/1-s2.0-S0306261919318616-si35.svg?httpAccept=%2A%2F%2A",
            "@multimediatype": "Scalable Vector Graphics file",
            "@type": "ALTIMG",
            "@size": "5644",
            "@ref": "si35",
            "@mimetype": "image/svg+xml"
        },
        {
            "@category": "thumbnail",
            "@_fa": "true",
            "$": "https://api.elsevier.com/content/object/eid/1-s2.0-S0306261919318616-si36.svg?httpAccept=%2A%2F%2A",
            "@multimediatype": "Scalable Vector Graphics file",
            "@type": "ALTIMG",
            "@size": "5157",
            "@ref": "si36",
            "@mimetype": "image/svg+xml"
        },
        {
            "@category": "thumbnail",
            "@_fa": "true",
            "$": "https://api.elsevier.com/content/object/eid/1-s2.0-S0306261919318616-si37.svg?httpAccept=%2A%2F%2A",
            "@multimediatype": "Scalable Vector Graphics file",
            "@type": "ALTIMG",
            "@size": "1598",
            "@ref": "si37",
            "@mimetype": "image/svg+xml"
        },
        {
            "@category": "thumbnail",
            "@_fa": "true",
            "$": "https://api.elsevier.com/content/object/eid/1-s2.0-S0306261919318616-si38.svg?httpAccept=%2A%2F%2A",
            "@multimediatype": "Scalable Vector Graphics file",
            "@type": "ALTIMG",
            "@size": "1840",
            "@ref": "si38",
            "@mimetype": "image/svg+xml"
        },
        {
            "@category": "thumbnail",
            "@_fa": "true",
            "$": "https://api.elsevier.com/content/object/eid/1-s2.0-S0306261919318616-si39.svg?httpAccept=%2A%2F%2A",
            "@multimediatype": "Scalable Vector Graphics file",
            "@type": "ALTIMG",
            "@size": "1799",
            "@ref": "si39",
            "@mimetype": "image/svg+xml"
        },
        {
            "@category": "thumbnail",
            "@_fa": "true",
            "$": "https://api.elsevier.com/content/object/eid/1-s2.0-S0306261919318616-si4.svg?httpAccept=%2A%2F%2A",
            "@multimediatype": "Scalable Vector Graphics file",
            "@type": "ALTIMG",
            "@size": "8730",
            "@ref": "si4",
            "@mimetype": "image/svg+xml"
        },
        {
            "@category": "thumbnail",
            "@_fa": "true",
            "$": "https://api.elsevier.com/content/object/eid/1-s2.0-S0306261919318616-si40.svg?httpAccept=%2A%2F%2A",
            "@multimediatype": "Scalable Vector Graphics file",
            "@type": "ALTIMG",
            "@size": "1526",
            "@ref": "si40",
            "@mimetype": "image/svg+xml"
        },
        {
            "@category": "thumbnail",
            "@_fa": "true",
            "$": "https://api.elsevier.com/content/object/eid/1-s2.0-S0306261919318616-si41.svg?httpAccept=%2A%2F%2A",
            "@multimediatype": "Scalable Vector Graphics file",
            "@type": "ALTIMG",
            "@size": "1821",
            "@ref": "si41",
            "@mimetype": "image/svg+xml"
        },
        {
            "@category": "thumbnail",
            "@_fa": "true",
            "$": "https://api.elsevier.com/content/object/eid/1-s2.0-S0306261919318616-si42.svg?httpAccept=%2A%2F%2A",
            "@multimediatype": "Scalable Vector Graphics file",
            "@type": "ALTIMG",
            "@size": "1409",
            "@ref": "si42",
            "@mimetype": "image/svg+xml"
        },
        {
            "@category": "thumbnail",
            "@_fa": "true",
            "$": "https://api.elsevier.com/content/object/eid/1-s2.0-S0306261919318616-si43.svg?httpAccept=%2A%2F%2A",
            "@multimediatype": "Scalable Vector Graphics file",
            "@type": "ALTIMG",
            "@size": "1527",
            "@ref": "si43",
            "@mimetype": "image/svg+xml"
        },
        {
            "@category": "thumbnail",
            "@_fa": "true",
            "$": "https://api.elsevier.com/content/object/eid/1-s2.0-S0306261919318616-si44.svg?httpAccept=%2A%2F%2A",
            "@multimediatype": "Scalable Vector Graphics file",
            "@type": "ALTIMG",
            "@size": "1853",
            "@ref": "si44",
            "@mimetype": "image/svg+xml"
        },
        {
            "@category": "thumbnail",
            "@_fa": "true",
            "$": "https://api.elsevier.com/content/object/eid/1-s2.0-S0306261919318616-si45.svg?httpAccept=%2A%2F%2A",
            "@multimediatype": "Scalable Vector Graphics file",
            "@type": "ALTIMG",
            "@size": "2403",
            "@ref": "si45",
            "@mimetype": "image/svg+xml"
        },
        {
            "@category": "thumbnail",
            "@_fa": "true",
            "$": "https://api.elsevier.com/content/object/eid/1-s2.0-S0306261919318616-si46.svg?httpAccept=%2A%2F%2A",
            "@multimediatype": "Scalable Vector Graphics file",
            "@type": "ALTIMG",
            "@size": "13964",
            "@ref": "si46",
            "@mimetype": "image/svg+xml"
        },
        {
            "@category": "thumbnail",
            "@_fa": "true",
            "$": "https://api.elsevier.com/content/object/eid/1-s2.0-S0306261919318616-si47.svg?httpAccept=%2A%2F%2A",
            "@multimediatype": "Scalable Vector Graphics file",
            "@type": "ALTIMG",
            "@size": "9346",
            "@ref": "si47",
            "@mimetype": "image/svg+xml"
        },
        {
            "@category": "thumbnail",
            "@_fa": "true",
            "$": "https://api.elsevier.com/content/object/eid/1-s2.0-S0306261919318616-si48.svg?httpAccept=%2A%2F%2A",
            "@multimediatype": "Scalable Vector Graphics file",
            "@type": "ALTIMG",
            "@size": "22398",
            "@ref": "si48",
            "@mimetype": "image/svg+xml"
        },
        {
            "@category": "thumbnail",
            "@_fa": "true",
            "$": "https://api.elsevier.com/content/object/eid/1-s2.0-S0306261919318616-si49.svg?httpAccept=%2A%2F%2A",
            "@multimediatype": "Scalable Vector Graphics file",
            "@type": "ALTIMG",
            "@size": "7388",
            "@ref": "si49",
            "@mimetype": "image/svg+xml"
        },
        {
            "@category": "thumbnail",
            "@_fa": "true",
            "$": "https://api.elsevier.com/content/object/eid/1-s2.0-S0306261919318616-si5.svg?httpAccept=%2A%2F%2A",
            "@multimediatype": "Scalable Vector Graphics file",
            "@type": "ALTIMG",
            "@size": "14185",
            "@ref": "si5",
            "@mimetype": "image/svg+xml"
        },
        {
            "@category": "thumbnail",
            "@_fa": "true",
            "$": "https://api.elsevier.com/content/object/eid/1-s2.0-S0306261919318616-si50.svg?httpAccept=%2A%2F%2A",
            "@multimediatype": "Scalable Vector Graphics file",
            "@type": "ALTIMG",
            "@size": "6846",
            "@ref": "si50",
            "@mimetype": "image/svg+xml"
        },
        {
            "@category": "thumbnail",
            "@_fa": "true",
            "$": "https://api.elsevier.com/content/object/eid/1-s2.0-S0306261919318616-si51.svg?httpAccept=%2A%2F%2A",
            "@multimediatype": "Scalable Vector Graphics file",
            "@type": "ALTIMG",
            "@size": "5515",
            "@ref": "si51",
            "@mimetype": "image/svg+xml"
        },
        {
            "@category": "thumbnail",
            "@_fa": "true",
            "$": "https://api.elsevier.com/content/object/eid/1-s2.0-S0306261919318616-si52.svg?httpAccept=%2A%2F%2A",
            "@multimediatype": "Scalable Vector Graphics file",
            "@type": "ALTIMG",
            "@size": "2494",
            "@ref": "si52",
            "@mimetype": "image/svg+xml"
        },
        {
            "@category": "thumbnail",
            "@_fa": "true",
            "$": "https://api.elsevier.com/content/object/eid/1-s2.0-S0306261919318616-si53.svg?httpAccept=%2A%2F%2A",
            "@multimediatype": "Scalable Vector Graphics file",
            "@type": "ALTIMG",
            "@size": "2364",
            "@ref": "si53",
            "@mimetype": "image/svg+xml"
        },
        {
            "@category": "thumbnail",
            "@_fa": "true",
            "$": "https://api.elsevier.com/content/object/eid/1-s2.0-S0306261919318616-si54.svg?httpAccept=%2A%2F%2A",
            "@multimediatype": "Scalable Vector Graphics file",
            "@type": "ALTIMG",
            "@size": "2233",
            "@ref": "si54",
            "@mimetype": "image/svg+xml"
        },
        {
            "@category": "thumbnail",
            "@_fa": "true",
            "$": "https://api.elsevier.com/content/object/eid/1-s2.0-S0306261919318616-si55.svg?httpAccept=%2A%2F%2A",
            "@multimediatype": "Scalable Vector Graphics file",
            "@type": "ALTIMG",
            "@size": "2406",
            "@ref": "si55",
            "@mimetype": "image/svg+xml"
        },
        {
            "@category": "thumbnail",
            "@_fa": "true",
            "$": "https://api.elsevier.com/content/object/eid/1-s2.0-S0306261919318616-si56.svg?httpAccept=%2A%2F%2A",
            "@multimediatype": "Scalable Vector Graphics file",
            "@type": "ALTIMG",
            "@size": "2732",
            "@ref": "si56",
            "@mimetype": "image/svg+xml"
        },
        {
            "@category": "thumbnail",
            "@_fa": "true",
            "$": "https://api.elsevier.com/content/object/eid/1-s2.0-S0306261919318616-si57.svg?httpAccept=%2A%2F%2A",
            "@multimediatype": "Scalable Vector Graphics file",
            "@type": "ALTIMG",
            "@size": "11506",
            "@ref": "si57",
            "@mimetype": "image/svg+xml"
        },
        {
            "@category": "thumbnail",
            "@_fa": "true",
            "$": "https://api.elsevier.com/content/object/eid/1-s2.0-S0306261919318616-si58.svg?httpAccept=%2A%2F%2A",
            "@multimediatype": "Scalable Vector Graphics file",
            "@type": "ALTIMG",
            "@size": "18574",
            "@ref": "si58",
            "@mimetype": "image/svg+xml"
        },
        {
            "@category": "thumbnail",
            "@_fa": "true",
            "$": "https://api.elsevier.com/content/object/eid/1-s2.0-S0306261919318616-si59.svg?httpAccept=%2A%2F%2A",
            "@multimediatype": "Scalable Vector Graphics file",
            "@type": "ALTIMG",
            "@size": "11373",
            "@ref": "si59",
            "@mimetype": "image/svg+xml"
        },
        {
            "@category": "thumbnail",
            "@_fa": "true",
            "$": "https://api.elsevier.com/content/object/eid/1-s2.0-S0306261919318616-si6.svg?httpAccept=%2A%2F%2A",
            "@multimediatype": "Scalable Vector Graphics file",
            "@type": "ALTIMG",
            "@size": "14287",
            "@ref": "si6",
            "@mimetype": "image/svg+xml"
        },
        {
            "@category": "thumbnail",
            "@_fa": "true",
            "$": "https://api.elsevier.com/content/object/eid/1-s2.0-S0306261919318616-si60.svg?httpAccept=%2A%2F%2A",
            "@multimediatype": "Scalable Vector Graphics file",
            "@type": "ALTIMG",
            "@size": "18192",
            "@ref": "si60",
            "@mimetype": "image/svg+xml"
        },
        {
            "@category": "thumbnail",
            "@_fa": "true",
            "$": "https://api.elsevier.com/content/object/eid/1-s2.0-S0306261919318616-si61.svg?httpAccept=%2A%2F%2A",
            "@multimediatype": "Scalable Vector Graphics file",
            "@type": "ALTIMG",
            "@size": "3010",
            "@ref": "si61",
            "@mimetype": "image/svg+xml"
        },
        {
            "@category": "thumbnail",
            "@_fa": "true",
            "$": "https://api.elsevier.com/content/object/eid/1-s2.0-S0306261919318616-si62.svg?httpAccept=%2A%2F%2A",
            "@multimediatype": "Scalable Vector Graphics file",
            "@type": "ALTIMG",
            "@size": "2854",
            "@ref": "si62",
            "@mimetype": "image/svg+xml"
        },
        {
            "@category": "thumbnail",
            "@_fa": "true",
            "$": "https://api.elsevier.com/content/object/eid/1-s2.0-S0306261919318616-si63.svg?httpAccept=%2A%2F%2A",
            "@multimediatype": "Scalable Vector Graphics file",
            "@type": "ALTIMG",
            "@size": "7479",
            "@ref": "si63",
            "@mimetype": "image/svg+xml"
        },
        {
            "@category": "thumbnail",
            "@_fa": "true",
            "$": "https://api.elsevier.com/content/object/eid/1-s2.0-S0306261919318616-si64.svg?httpAccept=%2A%2F%2A",
            "@multimediatype": "Scalable Vector Graphics file",
            "@type": "ALTIMG",
            "@size": "7335",
            "@ref": "si64",
            "@mimetype": "image/svg+xml"
        },
        {
            "@category": "thumbnail",
            "@_fa": "true",
            "$": "https://api.elsevier.com/content/object/eid/1-s2.0-S0306261919318616-si65.svg?httpAccept=%2A%2F%2A",
            "@multimediatype": "Scalable Vector Graphics file",
            "@type": "ALTIMG",
            "@size": "5471",
            "@ref": "si65",
            "@mimetype": "image/svg+xml"
        },
        {
            "@category": "thumbnail",
            "@_fa": "true",
            "$": "https://api.elsevier.com/content/object/eid/1-s2.0-S0306261919318616-si66.svg?httpAccept=%2A%2F%2A",
            "@multimediatype": "Scalable Vector Graphics file",
            "@type": "ALTIMG",
            "@size": "3075",
            "@ref": "si66",
            "@mimetype": "image/svg+xml"
        },
        {
            "@category": "thumbnail",
            "@_fa": "true",
            "$": "https://api.elsevier.com/content/object/eid/1-s2.0-S0306261919318616-si67.svg?httpAccept=%2A%2F%2A",
            "@multimediatype": "Scalable Vector Graphics file",
            "@type": "ALTIMG",
            "@size": "2924",
            "@ref": "si67",
            "@mimetype": "image/svg+xml"
        },
        {
            "@category": "thumbnail",
            "@_fa": "true",
            "$": "https://api.elsevier.com/content/object/eid/1-s2.0-S0306261919318616-si68.svg?httpAccept=%2A%2F%2A",
            "@multimediatype": "Scalable Vector Graphics file",
            "@type": "ALTIMG",
            "@size": "10426",
            "@ref": "si68",
            "@mimetype": "image/svg+xml"
        },
        {
            "@category": "thumbnail",
            "@_fa": "true",
            "$": "https://api.elsevier.com/content/object/eid/1-s2.0-S0306261919318616-si69.svg?httpAccept=%2A%2F%2A",
            "@multimediatype": "Scalable Vector Graphics file",
            "@type": "ALTIMG",
            "@size": "3484",
            "@ref": "si69",
            "@mimetype": "image/svg+xml"
        },
        {
            "@category": "thumbnail",
            "@_fa": "true",
            "$": "https://api.elsevier.com/content/object/eid/1-s2.0-S0306261919318616-si7.svg?httpAccept=%2A%2F%2A",
            "@multimediatype": "Scalable Vector Graphics file",
            "@type": "ALTIMG",
            "@size": "3614",
            "@ref": "si7",
            "@mimetype": "image/svg+xml"
        },
        {
            "@category": "thumbnail",
            "@_fa": "true",
            "$": "https://api.elsevier.com/content/object/eid/1-s2.0-S0306261919318616-si70.svg?httpAccept=%2A%2F%2A",
            "@multimediatype": "Scalable Vector Graphics file",
            "@type": "ALTIMG",
            "@size": "4194",
            "@ref": "si70",
            "@mimetype": "image/svg+xml"
        },
        {
            "@category": "thumbnail",
            "@_fa": "true",
            "$": "https://api.elsevier.com/content/object/eid/1-s2.0-S0306261919318616-si71.svg?httpAccept=%2A%2F%2A",
            "@multimediatype": "Scalable Vector Graphics file",
            "@type": "ALTIMG",
            "@size": "3110",
            "@ref": "si71",
            "@mimetype": "image/svg+xml"
        },
        {
            "@category": "thumbnail",
            "@_fa": "true",
            "$": "https://api.elsevier.com/content/object/eid/1-s2.0-S0306261919318616-si72.svg?httpAccept=%2A%2F%2A",
            "@multimediatype": "Scalable Vector Graphics file",
            "@type": "ALTIMG",
            "@size": "3112",
            "@ref": "si72",
            "@mimetype": "image/svg+xml"
        },
        {
            "@category": "thumbnail",
            "@_fa": "true",
            "$": "https://api.elsevier.com/content/object/eid/1-s2.0-S0306261919318616-si73.svg?httpAccept=%2A%2F%2A",
            "@multimediatype": "Scalable Vector Graphics file",
            "@type": "ALTIMG",
            "@size": "3220",
            "@ref": "si73",
            "@mimetype": "image/svg+xml"
        },
        {
            "@category": "thumbnail",
            "@_fa": "true",
            "$": "https://api.elsevier.com/content/object/eid/1-s2.0-S0306261919318616-si74.svg?httpAccept=%2A%2F%2A",
            "@multimediatype": "Scalable Vector Graphics file",
            "@type": "ALTIMG",
            "@size": "1538",
            "@ref": "si74",
            "@mimetype": "image/svg+xml"
        },
        {
            "@category": "thumbnail",
            "@_fa": "true",
            "$": "https://api.elsevier.com/content/object/eid/1-s2.0-S0306261919318616-si75.svg?httpAccept=%2A%2F%2A",
            "@multimediatype": "Scalable Vector Graphics file",
            "@type": "ALTIMG",
            "@size": "27465",
            "@ref": "si75",
            "@mimetype": "image/svg+xml"
        },
        {
            "@category": "thumbnail",
            "@_fa": "true",
            "$": "https://api.elsevier.com/content/object/eid/1-s2.0-S0306261919318616-si76.svg?httpAccept=%2A%2F%2A",
            "@multimediatype": "Scalable Vector Graphics file",
            "@type": "ALTIMG",
            "@size": "23459",
            "@ref": "si76",
            "@mimetype": "image/svg+xml"
        },
        {
            "@category": "thumbnail",
            "@_fa": "true",
            "$": "https://api.elsevier.com/content/object/eid/1-s2.0-S0306261919318616-si77.svg?httpAccept=%2A%2F%2A",
            "@multimediatype": "Scalable Vector Graphics file",
            "@type": "ALTIMG",
            "@size": "16193",
            "@ref": "si77",
            "@mimetype": "image/svg+xml"
        },
        {
            "@category": "thumbnail",
            "@_fa": "true",
            "$": "https://api.elsevier.com/content/object/eid/1-s2.0-S0306261919318616-si78.svg?httpAccept=%2A%2F%2A",
            "@multimediatype": "Scalable Vector Graphics file",
            "@type": "ALTIMG",
            "@size": "2733",
            "@ref": "si78",
            "@mimetype": "image/svg+xml"
        },
        {
            "@category": "thumbnail",
            "@_fa": "true",
            "$": "https://api.elsevier.com/content/object/eid/1-s2.0-S0306261919318616-si79.svg?httpAccept=%2A%2F%2A",
            "@multimediatype": "Scalable Vector Graphics file",
            "@type": "ALTIMG",
            "@size": "3051",
            "@ref": "si79",
            "@mimetype": "image/svg+xml"
        },
        {
            "@category": "thumbnail",
            "@_fa": "true",
            "$": "https://api.elsevier.com/content/object/eid/1-s2.0-S0306261919318616-si8.svg?httpAccept=%2A%2F%2A",
            "@multimediatype": "Scalable Vector Graphics file",
            "@type": "ALTIMG",
            "@size": "8143",
            "@ref": "si8",
            "@mimetype": "image/svg+xml"
        },
        {
            "@category": "thumbnail",
            "@_fa": "true",
            "$": "https://api.elsevier.com/content/object/eid/1-s2.0-S0306261919318616-si80.svg?httpAccept=%2A%2F%2A",
            "@multimediatype": "Scalable Vector Graphics file",
            "@type": "ALTIMG",
            "@size": "2595",
            "@ref": "si80",
            "@mimetype": "image/svg+xml"
        },
        {
            "@category": "thumbnail",
            "@_fa": "true",
            "$": "https://api.elsevier.com/content/object/eid/1-s2.0-S0306261919318616-si81.svg?httpAccept=%2A%2F%2A",
            "@multimediatype": "Scalable Vector Graphics file",
            "@type": "ALTIMG",
            "@size": "2917",
            "@ref": "si81",
            "@mimetype": "image/svg+xml"
        },
        {
            "@category": "thumbnail",
            "@_fa": "true",
            "$": "https://api.elsevier.com/content/object/eid/1-s2.0-S0306261919318616-si82.svg?httpAccept=%2A%2F%2A",
            "@multimediatype": "Scalable Vector Graphics file",
            "@type": "ALTIMG",
            "@size": "5154",
            "@ref": "si82",
            "@mimetype": "image/svg+xml"
        },
        {
            "@category": "thumbnail",
            "@_fa": "true",
            "$": "https://api.elsevier.com/content/object/eid/1-s2.0-S0306261919318616-si83.svg?httpAccept=%2A%2F%2A",
            "@multimediatype": "Scalable Vector Graphics file",
            "@type": "ALTIMG",
            "@size": "2736",
            "@ref": "si83",
            "@mimetype": "image/svg+xml"
        },
        {
            "@category": "thumbnail",
            "@_fa": "true",
            "$": "https://api.elsevier.com/content/object/eid/1-s2.0-S0306261919318616-si84.svg?httpAccept=%2A%2F%2A",
            "@multimediatype": "Scalable Vector Graphics file",
            "@type": "ALTIMG",
            "@size": "15323",
            "@ref": "si84",
            "@mimetype": "image/svg+xml"
        },
        {
            "@category": "thumbnail",
            "@_fa": "true",
            "$": "https://api.elsevier.com/content/object/eid/1-s2.0-S0306261919318616-si85.svg?httpAccept=%2A%2F%2A",
            "@multimediatype": "Scalable Vector Graphics file",
            "@type": "ALTIMG",
            "@size": "2798",
            "@ref": "si85",
            "@mimetype": "image/svg+xml"
        },
        {
            "@category": "thumbnail",
            "@_fa": "true",
            "$": "https://api.elsevier.com/content/object/eid/1-s2.0-S0306261919318616-si86.svg?httpAccept=%2A%2F%2A",
            "@multimediatype": "Scalable Vector Graphics file",
            "@type": "ALTIMG",
            "@size": "25998",
            "@ref": "si86",
            "@mimetype": "image/svg+xml"
        },
        {
            "@category": "thumbnail",
            "@_fa": "true",
            "$": "https://api.elsevier.com/content/object/eid/1-s2.0-S0306261919318616-si87.svg?httpAccept=%2A%2F%2A",
            "@multimediatype": "Scalable Vector Graphics file",
            "@type": "ALTIMG",
            "@size": "22556",
            "@ref": "si87",
            "@mimetype": "image/svg+xml"
        },
        {
            "@category": "thumbnail",
            "@_fa": "true",
            "$": "https://api.elsevier.com/content/object/eid/1-s2.0-S0306261919318616-si88.svg?httpAccept=%2A%2F%2A",
            "@multimediatype": "Scalable Vector Graphics file",
            "@type": "ALTIMG",
            "@size": "17336",
            "@ref": "si88",
            "@mimetype": "image/svg+xml"
        },
        {
            "@category": "thumbnail",
            "@_fa": "true",
            "$": "https://api.elsevier.com/content/object/eid/1-s2.0-S0306261919318616-si89.svg?httpAccept=%2A%2F%2A",
            "@multimediatype": "Scalable Vector Graphics file",
            "@type": "ALTIMG",
            "@size": "26311",
            "@ref": "si89",
            "@mimetype": "image/svg+xml"
        },
        {
            "@category": "thumbnail",
            "@_fa": "true",
            "$": "https://api.elsevier.com/content/object/eid/1-s2.0-S0306261919318616-si9.svg?httpAccept=%2A%2F%2A",
            "@multimediatype": "Scalable Vector Graphics file",
            "@type": "ALTIMG",
            "@size": "7112",
            "@ref": "si9",
            "@mimetype": "image/svg+xml"
        },
        {
            "@category": "thumbnail",
            "@_fa": "true",
            "$": "https://api.elsevier.com/content/object/eid/1-s2.0-S0306261919318616-si90.svg?httpAccept=%2A%2F%2A",
            "@multimediatype": "Scalable Vector Graphics file",
            "@type": "ALTIMG",
            "@size": "18514",
            "@ref": "si90",
            "@mimetype": "image/svg+xml"
        },
        {
            "@category": "thumbnail",
            "@_fa": "true",
            "$": "https://api.elsevier.com/content/object/eid/1-s2.0-S0306261919318616-si91.svg?httpAccept=%2A%2F%2A",
            "@multimediatype": "Scalable Vector Graphics file",
            "@type": "ALTIMG",
            "@size": "8159",
            "@ref": "si91",
            "@mimetype": "image/svg+xml"
        },
        {
            "@category": "thumbnail",
            "@_fa": "true",
            "$": "https://api.elsevier.com/content/object/eid/1-s2.0-S0306261919318616-si92.svg?httpAccept=%2A%2F%2A",
            "@multimediatype": "Scalable Vector Graphics file",
            "@type": "ALTIMG",
            "@size": "3356",
            "@ref": "si92",
            "@mimetype": "image/svg+xml"
        },
        {
            "@category": "thumbnail",
            "@_fa": "true",
            "$": "https://api.elsevier.com/content/object/eid/1-s2.0-S0306261919318616-si93.svg?httpAccept=%2A%2F%2A",
            "@multimediatype": "Scalable Vector Graphics file",
            "@type": "ALTIMG",
            "@size": "20498",
            "@ref": "si93",
            "@mimetype": "image/svg+xml"
        },
        {
            "@category": "thumbnail",
            "@_fa": "true",
            "$": "https://api.elsevier.com/content/object/eid/1-s2.0-S0306261919318616-si94.svg?httpAccept=%2A%2F%2A",
            "@multimediatype": "Scalable Vector Graphics file",
            "@type": "ALTIMG",
            "@size": "17534",
            "@ref": "si94",
            "@mimetype": "image/svg+xml"
        },
        {
            "@category": "thumbnail",
            "@_fa": "true",
            "$": "https://api.elsevier.com/content/object/eid/1-s2.0-S0306261919318616-si95.svg?httpAccept=%2A%2F%2A",
            "@multimediatype": "Scalable Vector Graphics file",
            "@type": "ALTIMG",
            "@size": "28334",
            "@ref": "si95",
            "@mimetype": "image/svg+xml"
        },
        {
            "@category": "thumbnail",
            "@_fa": "true",
            "$": "https://api.elsevier.com/content/object/eid/1-s2.0-S0306261919318616-si96.svg?httpAccept=%2A%2F%2A",
            "@multimediatype": "Scalable Vector Graphics file",
            "@type": "ALTIMG",
            "@size": "20837",
            "@ref": "si96",
            "@mimetype": "image/svg+xml"
        },
        {
            "@category": "thumbnail",
            "@_fa": "true",
            "$": "https://api.elsevier.com/content/object/eid/1-s2.0-S0306261919318616-si97.svg?httpAccept=%2A%2F%2A",
            "@multimediatype": "Scalable Vector Graphics file",
            "@type": "ALTIMG",
            "@size": "2773",
            "@ref": "si97",
            "@mimetype": "image/svg+xml"
        },
        {
            "@category": "thumbnail",
            "@_fa": "true",
            "$": "https://api.elsevier.com/content/object/eid/1-s2.0-S0306261919318616-si98.svg?httpAccept=%2A%2F%2A",
            "@multimediatype": "Scalable Vector Graphics file",
            "@type": "ALTIMG",
            "@size": "17226",
            "@ref": "si98",
            "@mimetype": "image/svg+xml"
        },
        {
            "@category": "thumbnail",
            "@_fa": "true",
            "$": "https://api.elsevier.com/content/object/eid/1-s2.0-S0306261919318616-si99.svg?httpAccept=%2A%2F%2A",
            "@multimediatype": "Scalable Vector Graphics file",
            "@type": "ALTIMG",
            "@size": "5384",
            "@ref": "si99",
            "@mimetype": "image/svg+xml"
        }
    ]},
    "link": {
        "@rel": "abstract",
        "@href": "https://api.elsevier.com/content/abstract/scopus_id/85076240515"
    }
}}