{"full-text-retrieval-response": {
    "scopus-eid": "2-s2.0-85107128417",
    "originalText": "serial JL 271089 291210 291731 291800 291881 31 90 Energy and Buildings ENERGYBUILDINGS 2021-05-20 2021-05-20 2021-05-31 2021-05-31 2021-07-02T18:59:40 1-s2.0-S0378778821003923 S0378-7788(21)00392-3 S0378778821003923 10.1016/j.enbuild.2021.111108 S300 S300.1 FULL-TEXT 1-s2.0-S0378778821X0014X 2022-12-01T03:23:13.139129Z 0 0 20210915 2021 2021-05-20T15:05:41.998283Z articleinfo articlenumber articletitlenorm authfirstinitialnorm authfirstsurnamenorm cid cids contenttype copyright crossmark dateloaded dateloadedtxt datesearch datesort dateupdated dco docsubtype doctype doi eid ewtransactionid fundingbodyid hubeid indexeddate issn issnnorm itemstage itemtransactionid itemweight oauserlicense openaccess openarchive pg pgfirst pii piinorm pubdatestart pubdatetxt pubyr sectiontitle sortorder sponsoredaccesstype srctitle srctitlenorm srctype ssids alllist content oa subj subheadings suppl tomb volfirst volissue volumelist webpdf webpdfpagecount yearnav figure table body mmlmath acknowledge affil articletitle auth authfirstini authfull authkeywords authlast footnotes primabst ref 0378-7788 03787788 UNLIMITED VSNU2020 true 247 247 C Volume 247 4 111108 111108 111108 20210915 15 September 2021 2021-09-15 2021 Research Articles article fla © 2021 The Authors. Published by Elsevier B.V. SCENARIOBASEDNONLINEARMODELPREDICTIVECONTROLFORBUILDINGHEATINGSYSTEMS PIPPIA T 1 Introduction 1.1 Literature review 1.1.1 Modeling and control strategies for buildings 1.1.2 Scenario generation 1.2 Motivation and contributions of the paper 1.3 Outline 2 Model description 2.1 Buildings 2.2 Modelica 2.3 Model predictive control 2.4 Control loop and practical implementation 2.5 Linear model estimation 3 Control algorithms and models 3.1 Deterministic MPC 3.2 Scenario-based MPC 3.3 Linear MPC 4 Scenario generation method 4.1 Introduction 4.2 Scenario generation method 4.2.1 Deterministic forecast 4.2.2 Marginal distributions 4.2.3 Scenario generation 4.2.4 Properties 5 Case study 5.1 Setup 5.2 Results and discussion 5.2.1 Performance with different values of α 5.2.2 Comparison between the nonlinear Modelica model and the linear model 5.2.3 Comparison between SBMPC strategies and DetMPC strategies 5.2.4 Comparison between the SBMPC strategies with different number of scenarios 5.2.5 Representative simulation 5.3 Summary 6 Conclusions Acknowledgments References YANG 2014 164 173 L LI 2020 114288 G LAGO 2019 640 655 J BLOESS 2018 1611 1626 A AGHEMO 2013 147 161 C CAMACHO 2013 E MODELPREDICTIVECONTROLADVANCEDTEXTBOOKSINCONTROLSIGNALPROCESSING MACIEJOWSKI 2002 J PREDICTIVECONTROLCONSTRAINTS MAYNE 2014 2967 2986 D FARINA 2016 53 67 M DECONINCK 2016 290 298 R DRGONA 2018 199 216 J OLDEWURTEL 2012 15 27 F OSTADIJAFARI 2020 1 10 M PARISIO 2013 428 435 A PARISIO 2014 5201 5207 A 53RDIEEECONFERENCEDECISIONCONTROL CONTROLHVACSYSTEMSVIASCENARIOBASEDEXPLICITMPC TANG 2019 873 882 R KUBOTH 2019 372 385 S AOUN 2019 116042 N JORISSEN 2019 180 192 F PIPPIA 2019 1243 1248 T 2019IEEE15THINTERNATIONALCONFERENCEAUTOMATIONSCIENCEENGINEERINGCASE SCENARIOBASEDMODELPREDICTIVECONTROLAPPROACHFORHEATINGSYSTEMSINOFFICEBUILDING LI 2021 110627 Z YASSUDAYAMASHITA 2021 116420 D 2018 INTELLIGENTBUILDINGCONTROLSYSTEMS FRITZSON 2015 P PRINCIPLESOBJECTORIENTEDMODELINGSIMULATIONMODELICA33ACYBERPHYSICALAPPROACH PINSON 2008 51 62 P MA 2012 7559 7564 Y 2012IEEE51STIEEECONFERENCEDECISIONCONTROLCDCIEEE FASTSTOCHASTICMPCOPTIMALRISKALLOCATIONAPPLIEDBUILDINGCONTROLSYSTEMS PEDERSEN 2018 485 498 T DEORI 2014 4905 4910 L 53RDIEEECONFERENCEDECISIONCONTROLIEEE OPTIMALBUILDINGCLIMATECONTROLASOLUTIONBASEDNESTEDDYNAMICPROGRAMMINGRANDOMIZEDOPTIMIZATION MAIWORM 2015 50 56 M HEDEGAARD 2017 253 261 R SCHEFZIK 2013 616 640 R LABEODAN 2015 303 314 T SOLTANAGHAEI 2018 842 855 E DECONINCK 2016 288 303 R SHAIKH 2014 409 429 P ANDRIAMAMONJY 2018 166 181 A WETTER 2009 143 161 M PIPPIA 2019 1 13 T LIU 2017 306 320 S KORDESTANI 2016 1286 1294 M EREN 2017 1541 1566 U KORDESTANI 2021 1 14 M ANDERSSON 2018 1 36 J WACHTER 2006 25 57 A TIAN 2017 58 68 X TIAN 2019 3025 3040 X VELARDE 2016 1209 1214 P VELARDE 2017 6171 6176 P 2017IEEE56THANNUALCONFERENCEDECISIONCONTROLCDC SCENARIOBASEDDEFENSEMECHANISMFORDISTRIBUTEDMODELPREDICTIVECONTROL LAGO 2018 566 577 J BERGSTRA 2013 115 123 J PROCEEDINGS30THINTERNATIONALCONFERENCEMACHINELEARNING MAKINGASCIENCEMODELSEARCHHYPERPARAMETEROPTIMIZATIONINHUNDREDSDIMENSIONSFORVISIONARCHITECTURES KINGMA 2014 D ADAMAMETHODFORSTOCHASTICOPTIMIZATIONARXIVEPRINT14126980 PEREZ 2010 2161 2172 R NOWOTARSKI 2018 1548 1568 J PINSON 2009 51 62 P SKLAR 1959 229 231 A SKLAR 1973 449 460 A GOLESTANEH 2016 80 91 F PIPPIAX2021X111108 PIPPIAX2021X111108XT Full 2021-05-21T18:37:50Z FundingBody Dutch University VSNU 2020 http://creativecommons.org/licenses/by/4.0/ 2023-05-31T00:00:00.000Z 2023-05-31T00:00:00.000Z http://creativecommons.org/licenses/by-nc-nd/4.0/ This is an open access article under the CC BY license. © 2021 The Authors. Published by Elsevier B.V. 2022-06-11T08:39:55.921Z http://vtw.elsevier.com/data/voc/AddOnTypes/50.7/aggregated-refined Marie Skłodowska-Curie 675318 MSCA H2020 Marie Skłodowska-Curie Actions http://data.elsevier.com/vocabulary/SciValFunders/100010665 http://sws.geonames.org/6695072/ European Union&apos;s Horizon 2020 research and innovation program Horizon 2020 http://data.elsevier.com/vocabulary/SciValFunders/501100007601 http://sws.geonames.org/6695072/ European Union\u2019s Horizon 2020 research and innovation program H2020 Horizon 2020 Framework Programme http://data.elsevier.com/vocabulary/SciValFunders/100010661 http://sws.geonames.org/6695072/ This research has received funding from the European Union\u2019s Horizon 2020 research and innovation program under the Marie Skłodowska-Curie grant agreement No 675318 (INCITE). This research has received funding from the European Union&apos;s Horizon 2020 research and innovation program under the Marie Skłodowska-Curie grant agreement No 675318 (INCITE). item S0378-7788(21)00392-3 S0378778821003923 1-s2.0-S0378778821003923 10.1016/j.enbuild.2021.111108 271089 2022-12-01T03:23:13.139129Z 2021-09-15 UNLIMITED VSNU2020 1-s2.0-S0378778821003923-main.pdf https://s3-eu-west-1.amazonaws.com/prod-ucs-content-store-eu-west/content/pii:S0378778821003923/MAIN/application/pdf/8db7d85775c9e81b1c7ff5d74fe31b55/main.pdf main.pdf pdf true 967841 MAIN 14 1-s2.0-S0378778821003923-main_1.png https://s3-eu-west-1.amazonaws.com/prod-ucs-content-store-eu-west/content/pii:S0378778821003923/PREVIEW/image/png/7d21bb2df9ac822ab7e22c9db4de1d4d/main_1.png main_1.png png 57612 849 656 IMAGE-WEB-PDF 1 1-s2.0-S0378778821003923-gr2.jpg https://s3-eu-west-1.amazonaws.com/prod-ucs-content-store-eu-west/content/pii:S0378778821003923/gr2/DOWNSAMPLED/image/jpeg/21ff608edf761221dadb301d85d225db/gr2.jpg gr2 gr2.jpg jpg 29635 189 378 IMAGE-DOWNSAMPLED 1-s2.0-S0378778821003923-gr3.jpg https://s3-eu-west-1.amazonaws.com/prod-ucs-content-store-eu-west/content/pii:S0378778821003923/gr3/DOWNSAMPLED/image/jpeg/1ecfa3dd5c66a7a9d5b1813382d0bb04/gr3.jpg gr3 gr3.jpg jpg 20241 189 378 IMAGE-DOWNSAMPLED 1-s2.0-S0378778821003923-gr4.jpg https://s3-eu-west-1.amazonaws.com/prod-ucs-content-store-eu-west/content/pii:S0378778821003923/gr4/DOWNSAMPLED/image/jpeg/2840812a8b5a02ad79af0aff045840d7/gr4.jpg gr4 gr4.jpg jpg 121446 711 711 IMAGE-DOWNSAMPLED 1-s2.0-S0378778821003923-gr5.jpg https://s3-eu-west-1.amazonaws.com/prod-ucs-content-store-eu-west/content/pii:S0378778821003923/gr5/DOWNSAMPLED/image/jpeg/7605f739a4044a7e9050864228a31270/gr5.jpg gr5 gr5.jpg jpg 18201 189 378 IMAGE-DOWNSAMPLED 1-s2.0-S0378778821003923-gr6.jpg https://s3-eu-west-1.amazonaws.com/prod-ucs-content-store-eu-west/content/pii:S0378778821003923/gr6/DOWNSAMPLED/image/jpeg/ef0c0e23236da9a9598bfe048c4f84d4/gr6.jpg gr6 gr6.jpg jpg 29030 276 378 IMAGE-DOWNSAMPLED 1-s2.0-S0378778821003923-gr7.jpg https://s3-eu-west-1.amazonaws.com/prod-ucs-content-store-eu-west/content/pii:S0378778821003923/gr7/DOWNSAMPLED/image/jpeg/9d0a992452cd2469e125957d113b682b/gr7.jpg gr7 gr7.jpg jpg 32330 227 378 IMAGE-DOWNSAMPLED 1-s2.0-S0378778821003923-gr8.jpg https://s3-eu-west-1.amazonaws.com/prod-ucs-content-store-eu-west/content/pii:S0378778821003923/gr8/DOWNSAMPLED/image/jpeg/862571b3fcad3f5fba95993f1ed1703e/gr8.jpg gr8 gr8.jpg jpg 25934 227 378 IMAGE-DOWNSAMPLED 1-s2.0-S0378778821003923-gr9.jpg https://s3-eu-west-1.amazonaws.com/prod-ucs-content-store-eu-west/content/pii:S0378778821003923/gr9/DOWNSAMPLED/image/jpeg/639201297a5ea77b0d80119c0e5e0e78/gr9.jpg gr9 gr9.jpg jpg 26700 340 378 IMAGE-DOWNSAMPLED 1-s2.0-S0378778821003923-gr1.jpg https://s3-eu-west-1.amazonaws.com/prod-ucs-content-store-eu-west/content/pii:S0378778821003923/gr1/DOWNSAMPLED/image/jpeg/222b368abefb4c526f507b7ea1c306a5/gr1.jpg gr1 gr1.jpg jpg 18594 213 325 IMAGE-DOWNSAMPLED 1-s2.0-S0378778821003923-gr2.sml https://s3-eu-west-1.amazonaws.com/prod-ucs-content-store-eu-west/content/pii:S0378778821003923/gr2/THUMBNAIL/image/gif/365e1448239c56486953cbd867f3c2d9/gr2.sml gr2 gr2.sml sml 11130 110 219 IMAGE-THUMBNAIL 1-s2.0-S0378778821003923-gr3.sml https://s3-eu-west-1.amazonaws.com/prod-ucs-content-store-eu-west/content/pii:S0378778821003923/gr3/THUMBNAIL/image/gif/2d0d54611d673e950cd9a03224a5e56e/gr3.sml gr3 gr3.sml sml 8893 110 219 IMAGE-THUMBNAIL 1-s2.0-S0378778821003923-gr4.sml https://s3-eu-west-1.amazonaws.com/prod-ucs-content-store-eu-west/content/pii:S0378778821003923/gr4/THUMBNAIL/image/gif/526d043b5f8336350000aa9792a5af42/gr4.sml gr4 gr4.sml sml 9952 164 164 IMAGE-THUMBNAIL 1-s2.0-S0378778821003923-gr5.sml https://s3-eu-west-1.amazonaws.com/prod-ucs-content-store-eu-west/content/pii:S0378778821003923/gr5/THUMBNAIL/image/gif/8f3cfb62259efd77ad322ac6c077688a/gr5.sml gr5 gr5.sml sml 6275 110 219 IMAGE-THUMBNAIL 1-s2.0-S0378778821003923-gr6.sml https://s3-eu-west-1.amazonaws.com/prod-ucs-content-store-eu-west/content/pii:S0378778821003923/gr6/THUMBNAIL/image/gif/ce45d52ca3e73a8b767e33173f3a1ab2/gr6.sml gr6 gr6.sml sml 9796 160 219 IMAGE-THUMBNAIL 1-s2.0-S0378778821003923-gr7.sml https://s3-eu-west-1.amazonaws.com/prod-ucs-content-store-eu-west/content/pii:S0378778821003923/gr7/THUMBNAIL/image/gif/25d4c1cf7e88477dfbd27d78dc2ebf41/gr7.sml gr7 gr7.sml sml 11458 131 219 IMAGE-THUMBNAIL 1-s2.0-S0378778821003923-gr8.sml https://s3-eu-west-1.amazonaws.com/prod-ucs-content-store-eu-west/content/pii:S0378778821003923/gr8/THUMBNAIL/image/gif/de4c61b11b9e9e49565f7a61e17e61bf/gr8.sml gr8 gr8.sml sml 10508 131 219 IMAGE-THUMBNAIL 1-s2.0-S0378778821003923-gr9.sml https://s3-eu-west-1.amazonaws.com/prod-ucs-content-store-eu-west/content/pii:S0378778821003923/gr9/THUMBNAIL/image/gif/e5a05a55039803c970608b1b42d43d81/gr9.sml gr9 gr9.sml sml 5904 164 182 IMAGE-THUMBNAIL 1-s2.0-S0378778821003923-gr1.sml https://s3-eu-west-1.amazonaws.com/prod-ucs-content-store-eu-west/content/pii:S0378778821003923/gr1/THUMBNAIL/image/gif/daf7819822d9ae075e9166ad8089cb9c/gr1.sml gr1 gr1.sml sml 7681 144 219 IMAGE-THUMBNAIL 1-s2.0-S0378778821003923-gr2_lrg.jpg https://s3-eu-west-1.amazonaws.com/prod-ucs-content-store-eu-west/content/pii:S0378778821003923/gr2/HIGHRES/image/jpeg/deb536c74815a5d7e17d017498e7c35c/gr2_lrg.jpg gr2 gr2_lrg.jpg jpg 254276 837 1673 IMAGE-HIGH-RES 1-s2.0-S0378778821003923-gr3_lrg.jpg https://s3-eu-west-1.amazonaws.com/prod-ucs-content-store-eu-west/content/pii:S0378778821003923/gr3/HIGHRES/image/jpeg/1e13e953cff77cd30c3b0a01a9f62b30/gr3_lrg.jpg gr3 gr3_lrg.jpg jpg 188616 837 1673 IMAGE-HIGH-RES 1-s2.0-S0378778821003923-gr4_lrg.jpg https://s3-eu-west-1.amazonaws.com/prod-ucs-content-store-eu-west/content/pii:S0378778821003923/gr4/HIGHRES/image/jpeg/7ac1f6d5ca75c624a521c0f395496bb1/gr4_lrg.jpg gr4 gr4_lrg.jpg jpg 829473 3150 3150 IMAGE-HIGH-RES 1-s2.0-S0378778821003923-gr5_lrg.jpg https://s3-eu-west-1.amazonaws.com/prod-ucs-content-store-eu-west/content/pii:S0378778821003923/gr5/HIGHRES/image/jpeg/d5ef0371e60665aeca24427c551be8c0/gr5_lrg.jpg gr5 gr5_lrg.jpg jpg 126829 837 1673 IMAGE-HIGH-RES 1-s2.0-S0378778821003923-gr6_lrg.jpg https://s3-eu-west-1.amazonaws.com/prod-ucs-content-store-eu-west/content/pii:S0378778821003923/gr6/HIGHRES/image/jpeg/ab497c21843449590cbbbaa1536522c4/gr6_lrg.jpg gr6 gr6_lrg.jpg jpg 219403 1221 1675 IMAGE-HIGH-RES 1-s2.0-S0378778821003923-gr7_lrg.jpg https://s3-eu-west-1.amazonaws.com/prod-ucs-content-store-eu-west/content/pii:S0378778821003923/gr7/HIGHRES/image/jpeg/02488efeb5ab3e7bf3601aeedeb586e5/gr7_lrg.jpg gr7 gr7_lrg.jpg jpg 264684 1004 1673 IMAGE-HIGH-RES 1-s2.0-S0378778821003923-gr8_lrg.jpg https://s3-eu-west-1.amazonaws.com/prod-ucs-content-store-eu-west/content/pii:S0378778821003923/gr8/HIGHRES/image/jpeg/b3e0c5119c71b3783411a543868190c9/gr8_lrg.jpg gr8 gr8_lrg.jpg jpg 209876 1004 1673 IMAGE-HIGH-RES 1-s2.0-S0378778821003923-gr9_lrg.jpg https://s3-eu-west-1.amazonaws.com/prod-ucs-content-store-eu-west/content/pii:S0378778821003923/gr9/HIGHRES/image/jpeg/e0bb4b31728b8caf0f8974176ab26a4d/gr9_lrg.jpg gr9 gr9_lrg.jpg jpg 196586 1506 1673 IMAGE-HIGH-RES 1-s2.0-S0378778821003923-gr1_lrg.jpg https://s3-eu-west-1.amazonaws.com/prod-ucs-content-store-eu-west/content/pii:S0378778821003923/gr1/HIGHRES/image/jpeg/67ca48d642c749782759db7c3248e3f4/gr1_lrg.jpg gr1 gr1_lrg.jpg jpg 144127 944 1439 IMAGE-HIGH-RES 1-s2.0-S0378778821003923-si1.svg https://s3-eu-west-1.amazonaws.com/prod-ucs-content-store-eu-west/content/pii:S0378778821003923/STRIPIN/image/svg+xml/a59ab55d1a60a8f89af0eb0a0e093df5/si1.svg si1 si1.svg svg 2436 ALTIMG 1-s2.0-S0378778821003923-si10.svg https://s3-eu-west-1.amazonaws.com/prod-ucs-content-store-eu-west/content/pii:S0378778821003923/STRIPIN/image/svg+xml/4c6d2a43c1a96e03e38b0898a30a3766/si10.svg si10 si10.svg svg 3672 ALTIMG 1-s2.0-S0378778821003923-si100.svg https://s3-eu-west-1.amazonaws.com/prod-ucs-content-store-eu-west/content/pii:S0378778821003923/STRIPIN/image/svg+xml/71798aeba346e3e6c9c06af56130f8b9/si100.svg si100 si100.svg svg 803 ALTIMG 1-s2.0-S0378778821003923-si103.svg https://s3-eu-west-1.amazonaws.com/prod-ucs-content-store-eu-west/content/pii:S0378778821003923/STRIPIN/image/svg+xml/3f0cb93e801d7fee54609a35717d63d9/si103.svg si103 si103.svg svg 803 ALTIMG 1-s2.0-S0378778821003923-si106.svg https://s3-eu-west-1.amazonaws.com/prod-ucs-content-store-eu-west/content/pii:S0378778821003923/STRIPIN/image/svg+xml/144d9ab677c726d9df3ee437c9a59245/si106.svg si106 si106.svg svg 803 ALTIMG 1-s2.0-S0378778821003923-si109.svg https://s3-eu-west-1.amazonaws.com/prod-ucs-content-store-eu-west/content/pii:S0378778821003923/STRIPIN/image/svg+xml/b70cb263f4a7bdba7e0e2caf7658f98e/si109.svg si109 si109.svg svg 803 ALTIMG 1-s2.0-S0378778821003923-si11.svg https://s3-eu-west-1.amazonaws.com/prod-ucs-content-store-eu-west/content/pii:S0378778821003923/STRIPIN/image/svg+xml/1ae522a4f76cd117c077f2e3d4076612/si11.svg si11 si11.svg svg 5498 ALTIMG 1-s2.0-S0378778821003923-si112.svg https://s3-eu-west-1.amazonaws.com/prod-ucs-content-store-eu-west/content/pii:S0378778821003923/STRIPIN/image/svg+xml/d673c31bc2ef70682fa946348c4193de/si112.svg si112 si112.svg svg 803 ALTIMG 1-s2.0-S0378778821003923-si115.svg https://s3-eu-west-1.amazonaws.com/prod-ucs-content-store-eu-west/content/pii:S0378778821003923/STRIPIN/image/svg+xml/d1ffc6d77628f9259ed5394639e4b071/si115.svg si115 si115.svg svg 803 ALTIMG 1-s2.0-S0378778821003923-si118.svg https://s3-eu-west-1.amazonaws.com/prod-ucs-content-store-eu-west/content/pii:S0378778821003923/STRIPIN/image/svg+xml/ff5773486ffaf0a1c124eb67498abbf9/si118.svg si118 si118.svg svg 803 ALTIMG 1-s2.0-S0378778821003923-si12.svg https://s3-eu-west-1.amazonaws.com/prod-ucs-content-store-eu-west/content/pii:S0378778821003923/STRIPIN/image/svg+xml/d8760d66b211477211e47452446fe599/si12.svg si12 si12.svg svg 5154 ALTIMG 1-s2.0-S0378778821003923-si121.svg https://s3-eu-west-1.amazonaws.com/prod-ucs-content-store-eu-west/content/pii:S0378778821003923/STRIPIN/image/svg+xml/326e167cfd9ef223f289c2ac002b1d2e/si121.svg si121 si121.svg svg 803 ALTIMG 1-s2.0-S0378778821003923-si124.svg https://s3-eu-west-1.amazonaws.com/prod-ucs-content-store-eu-west/content/pii:S0378778821003923/STRIPIN/image/svg+xml/a500ec293fb0549d53d47d5f26a31b7e/si124.svg si124 si124.svg svg 803 ALTIMG 1-s2.0-S0378778821003923-si127.svg https://s3-eu-west-1.amazonaws.com/prod-ucs-content-store-eu-west/content/pii:S0378778821003923/STRIPIN/image/svg+xml/c1cd916b2330bb92c339e787e132c6bb/si127.svg si127 si127.svg svg 803 ALTIMG 1-s2.0-S0378778821003923-si13.svg https://s3-eu-west-1.amazonaws.com/prod-ucs-content-store-eu-west/content/pii:S0378778821003923/STRIPIN/image/svg+xml/3c015abde5f5680d666b3abb519e5084/si13.svg si13 si13.svg svg 2694 ALTIMG 1-s2.0-S0378778821003923-si130.svg https://s3-eu-west-1.amazonaws.com/prod-ucs-content-store-eu-west/content/pii:S0378778821003923/STRIPIN/image/svg+xml/7c1c881e9aa95e7bcba02ee30adbb077/si130.svg si130 si130.svg svg 803 ALTIMG 1-s2.0-S0378778821003923-si133.svg https://s3-eu-west-1.amazonaws.com/prod-ucs-content-store-eu-west/content/pii:S0378778821003923/STRIPIN/image/svg+xml/a2e76bcdc2d4a207fdd6c887ba13f55b/si133.svg si133 si133.svg svg 803 ALTIMG 1-s2.0-S0378778821003923-si136.svg https://s3-eu-west-1.amazonaws.com/prod-ucs-content-store-eu-west/content/pii:S0378778821003923/STRIPIN/image/svg+xml/2e139805d4cd9e987645a87951a4dc62/si136.svg si136 si136.svg svg 803 ALTIMG 1-s2.0-S0378778821003923-si139.svg https://s3-eu-west-1.amazonaws.com/prod-ucs-content-store-eu-west/content/pii:S0378778821003923/STRIPIN/image/svg+xml/69b22ec9f0c6b7601282e1716da1cd92/si139.svg si139 si139.svg svg 803 ALTIMG 1-s2.0-S0378778821003923-si14.svg https://s3-eu-west-1.amazonaws.com/prod-ucs-content-store-eu-west/content/pii:S0378778821003923/STRIPIN/image/svg+xml/43b85022878b422b2fdcf352f719d9ee/si14.svg si14 si14.svg svg 4230 ALTIMG 1-s2.0-S0378778821003923-si142.svg https://s3-eu-west-1.amazonaws.com/prod-ucs-content-store-eu-west/content/pii:S0378778821003923/STRIPIN/image/svg+xml/2eeb75067cd7b753ead9a5f0dc2fa057/si142.svg si142 si142.svg svg 804 ALTIMG 1-s2.0-S0378778821003923-si145.svg https://s3-eu-west-1.amazonaws.com/prod-ucs-content-store-eu-west/content/pii:S0378778821003923/STRIPIN/image/svg+xml/152df26aaaee852140e9760269672281/si145.svg si145 si145.svg svg 804 ALTIMG 1-s2.0-S0378778821003923-si148.svg https://s3-eu-west-1.amazonaws.com/prod-ucs-content-store-eu-west/content/pii:S0378778821003923/STRIPIN/image/svg+xml/4c7ff22e2e025dfcacdb117142edd465/si148.svg si148 si148.svg svg 804 ALTIMG 1-s2.0-S0378778821003923-si15.svg https://s3-eu-west-1.amazonaws.com/prod-ucs-content-store-eu-west/content/pii:S0378778821003923/STRIPIN/image/svg+xml/f62277fcedc96a7e8111d5204a7342b1/si15.svg si15 si15.svg svg 4054 ALTIMG 1-s2.0-S0378778821003923-si151.svg https://s3-eu-west-1.amazonaws.com/prod-ucs-content-store-eu-west/content/pii:S0378778821003923/STRIPIN/image/svg+xml/92672b4a1137990754b28272ced9d2dc/si151.svg si151 si151.svg svg 804 ALTIMG 1-s2.0-S0378778821003923-si154.svg https://s3-eu-west-1.amazonaws.com/prod-ucs-content-store-eu-west/content/pii:S0378778821003923/STRIPIN/image/svg+xml/80b3b26c9e4af7285cb1062ae21fc258/si154.svg si154 si154.svg svg 804 ALTIMG 1-s2.0-S0378778821003923-si157.svg https://s3-eu-west-1.amazonaws.com/prod-ucs-content-store-eu-west/content/pii:S0378778821003923/STRIPIN/image/svg+xml/5c901f928c41e5a95ecdb7610d6f4025/si157.svg si157 si157.svg svg 804 ALTIMG 1-s2.0-S0378778821003923-si159.svg https://s3-eu-west-1.amazonaws.com/prod-ucs-content-store-eu-west/content/pii:S0378778821003923/STRIPIN/image/svg+xml/7acee9a4cebca104608ffe68020ce61c/si159.svg si159 si159.svg svg 2629 ALTIMG 1-s2.0-S0378778821003923-si16.svg https://s3-eu-west-1.amazonaws.com/prod-ucs-content-store-eu-west/content/pii:S0378778821003923/STRIPIN/image/svg+xml/a29b20a61ede134a06dd7687e87f6fa8/si16.svg si16 si16.svg svg 4357 ALTIMG 1-s2.0-S0378778821003923-si160.svg https://s3-eu-west-1.amazonaws.com/prod-ucs-content-store-eu-west/content/pii:S0378778821003923/STRIPIN/image/svg+xml/8e7785340013c9580978d3187676185c/si160.svg si160 si160.svg svg 4231 ALTIMG 1-s2.0-S0378778821003923-si161.svg https://s3-eu-west-1.amazonaws.com/prod-ucs-content-store-eu-west/content/pii:S0378778821003923/STRIPIN/image/svg+xml/b76a5c7a411a312f55b2708f5312c1bc/si161.svg si161 si161.svg svg 4054 ALTIMG 1-s2.0-S0378778821003923-si162.svg https://s3-eu-west-1.amazonaws.com/prod-ucs-content-store-eu-west/content/pii:S0378778821003923/STRIPIN/image/svg+xml/67d6c2b9293aca5643847d313a68cec7/si162.svg si162 si162.svg svg 4357 ALTIMG 1-s2.0-S0378778821003923-si163.svg https://s3-eu-west-1.amazonaws.com/prod-ucs-content-store-eu-west/content/pii:S0378778821003923/STRIPIN/image/svg+xml/6c6908c5c23332ab03148dbc62609997/si163.svg si163 si163.svg svg 4287 ALTIMG 1-s2.0-S0378778821003923-si164.svg https://s3-eu-west-1.amazonaws.com/prod-ucs-content-store-eu-west/content/pii:S0378778821003923/STRIPIN/image/svg+xml/393376ed5f66de6153689a0f4db26e09/si164.svg si164 si164.svg svg 11574 ALTIMG 1-s2.0-S0378778821003923-si165.svg https://s3-eu-west-1.amazonaws.com/prod-ucs-content-store-eu-west/content/pii:S0378778821003923/STRIPIN/image/svg+xml/1d4014072b0059cb685c4deceeb8ec5b/si165.svg si165 si165.svg svg 5513 ALTIMG 1-s2.0-S0378778821003923-si166.svg https://s3-eu-west-1.amazonaws.com/prod-ucs-content-store-eu-west/content/pii:S0378778821003923/STRIPIN/image/svg+xml/d0f5b58b7c0984c16d50a25d4ffc1c5d/si166.svg si166 si166.svg svg 3715 ALTIMG 1-s2.0-S0378778821003923-si167.svg https://s3-eu-west-1.amazonaws.com/prod-ucs-content-store-eu-west/content/pii:S0378778821003923/STRIPIN/image/svg+xml/c1f38fda0301587b7327ba935e162411/si167.svg si167 si167.svg svg 4677 ALTIMG 1-s2.0-S0378778821003923-si168.svg https://s3-eu-west-1.amazonaws.com/prod-ucs-content-store-eu-west/content/pii:S0378778821003923/STRIPIN/image/svg+xml/67361fc4f38243ee4bff4cc864493cd3/si168.svg si168 si168.svg svg 4612 ALTIMG 1-s2.0-S0378778821003923-si169.svg https://s3-eu-west-1.amazonaws.com/prod-ucs-content-store-eu-west/content/pii:S0378778821003923/STRIPIN/image/svg+xml/9388aa5a0454b7e207f9d3541429ba9d/si169.svg si169 si169.svg svg 5297 ALTIMG 1-s2.0-S0378778821003923-si17.svg https://s3-eu-west-1.amazonaws.com/prod-ucs-content-store-eu-west/content/pii:S0378778821003923/STRIPIN/image/svg+xml/ae33e03195733df91c75891e66c9ae4e/si17.svg si17 si17.svg svg 4287 ALTIMG 1-s2.0-S0378778821003923-si170.svg https://s3-eu-west-1.amazonaws.com/prod-ucs-content-store-eu-west/content/pii:S0378778821003923/STRIPIN/image/svg+xml/93459a42b2eb341b75eb67c057f985d6/si170.svg si170 si170.svg svg 3153 ALTIMG 1-s2.0-S0378778821003923-si171.svg https://s3-eu-west-1.amazonaws.com/prod-ucs-content-store-eu-west/content/pii:S0378778821003923/STRIPIN/image/svg+xml/5b3ef2744da5895adbbe5427de9ed382/si171.svg si171 si171.svg svg 1626 ALTIMG 1-s2.0-S0378778821003923-si172.svg https://s3-eu-west-1.amazonaws.com/prod-ucs-content-store-eu-west/content/pii:S0378778821003923/STRIPIN/image/svg+xml/8527474e0f1438570fc90d401d34c51e/si172.svg si172 si172.svg svg 30188 ALTIMG 1-s2.0-S0378778821003923-si173.svg https://s3-eu-west-1.amazonaws.com/prod-ucs-content-store-eu-west/content/pii:S0378778821003923/STRIPIN/image/svg+xml/7fffcba7dc762351f0799d848e3d67f1/si173.svg si173 si173.svg svg 4104 ALTIMG 1-s2.0-S0378778821003923-si174.svg https://s3-eu-west-1.amazonaws.com/prod-ucs-content-store-eu-west/content/pii:S0378778821003923/STRIPIN/image/svg+xml/b21fd84fdf92ca061a307925c822143e/si174.svg si174 si174.svg svg 2754 ALTIMG 1-s2.0-S0378778821003923-si175.svg https://s3-eu-west-1.amazonaws.com/prod-ucs-content-store-eu-west/content/pii:S0378778821003923/STRIPIN/image/svg+xml/766b5f4f51b0103958014d885eb2b8ae/si175.svg si175 si175.svg svg 3639 ALTIMG 1-s2.0-S0378778821003923-si176.svg https://s3-eu-west-1.amazonaws.com/prod-ucs-content-store-eu-west/content/pii:S0378778821003923/STRIPIN/image/svg+xml/65403c3fa83d10f7c403e501c43e328e/si176.svg si176 si176.svg svg 23331 ALTIMG 1-s2.0-S0378778821003923-si177.svg https://s3-eu-west-1.amazonaws.com/prod-ucs-content-store-eu-west/content/pii:S0378778821003923/STRIPIN/image/svg+xml/cb7565f1124de051db2b9f8f2284ff16/si177.svg si177 si177.svg svg 10479 ALTIMG 1-s2.0-S0378778821003923-si178.svg https://s3-eu-west-1.amazonaws.com/prod-ucs-content-store-eu-west/content/pii:S0378778821003923/STRIPIN/image/svg+xml/ae64dcfe1062fefa99b1e2377fd05bcb/si178.svg si178 si178.svg svg 18696 ALTIMG 1-s2.0-S0378778821003923-si179.svg https://s3-eu-west-1.amazonaws.com/prod-ucs-content-store-eu-west/content/pii:S0378778821003923/STRIPIN/image/svg+xml/af50d186f0a21e907ff3136a24b377ab/si179.svg si179 si179.svg svg 21838 ALTIMG 1-s2.0-S0378778821003923-si18.svg https://s3-eu-west-1.amazonaws.com/prod-ucs-content-store-eu-west/content/pii:S0378778821003923/STRIPIN/image/svg+xml/5406dd87000562cb6eb5ea2ac6969ecb/si18.svg si18 si18.svg svg 2438 ALTIMG 1-s2.0-S0378778821003923-si180.svg https://s3-eu-west-1.amazonaws.com/prod-ucs-content-store-eu-west/content/pii:S0378778821003923/STRIPIN/image/svg+xml/d22a64131fc6636d1ccabcda065e34fc/si180.svg si180 si180.svg svg 21262 ALTIMG 1-s2.0-S0378778821003923-si181.svg https://s3-eu-west-1.amazonaws.com/prod-ucs-content-store-eu-west/content/pii:S0378778821003923/STRIPIN/image/svg+xml/dc875cd6e09b4ae1919c6912a6029234/si181.svg si181 si181.svg svg 11060 ALTIMG 1-s2.0-S0378778821003923-si182.svg https://s3-eu-west-1.amazonaws.com/prod-ucs-content-store-eu-west/content/pii:S0378778821003923/STRIPIN/image/svg+xml/d7da6d4c957c290e095f29280beb8e4f/si182.svg si182 si182.svg svg 5280 ALTIMG 1-s2.0-S0378778821003923-si183.svg https://s3-eu-west-1.amazonaws.com/prod-ucs-content-store-eu-west/content/pii:S0378778821003923/STRIPIN/image/svg+xml/aa659d7d343d21a1e34272839a2f1e8e/si183.svg si183 si183.svg svg 5913 ALTIMG 1-s2.0-S0378778821003923-si184.svg https://s3-eu-west-1.amazonaws.com/prod-ucs-content-store-eu-west/content/pii:S0378778821003923/STRIPIN/image/svg+xml/8e5237b3215b11f425f0d21bd722d76b/si184.svg si184 si184.svg svg 2306 ALTIMG 1-s2.0-S0378778821003923-si185.svg https://s3-eu-west-1.amazonaws.com/prod-ucs-content-store-eu-west/content/pii:S0378778821003923/STRIPIN/image/svg+xml/9f787c0753f3cf13ce5da1f339d09957/si185.svg si185 si185.svg svg 11830 ALTIMG 1-s2.0-S0378778821003923-si186.svg https://s3-eu-west-1.amazonaws.com/prod-ucs-content-store-eu-west/content/pii:S0378778821003923/STRIPIN/image/svg+xml/b19d653c231acb1c83dd2453e36d1d8b/si186.svg si186 si186.svg svg 6810 ALTIMG 1-s2.0-S0378778821003923-si187.svg https://s3-eu-west-1.amazonaws.com/prod-ucs-content-store-eu-west/content/pii:S0378778821003923/STRIPIN/image/svg+xml/cf44dda81a7c9196d0c958eb27dfd591/si187.svg si187 si187.svg svg 5012 ALTIMG 1-s2.0-S0378778821003923-si188.svg https://s3-eu-west-1.amazonaws.com/prod-ucs-content-store-eu-west/content/pii:S0378778821003923/STRIPIN/image/svg+xml/0a37f49b544527de413b395a2dc66645/si188.svg si188 si188.svg svg 3735 ALTIMG 1-s2.0-S0378778821003923-si189.svg https://s3-eu-west-1.amazonaws.com/prod-ucs-content-store-eu-west/content/pii:S0378778821003923/STRIPIN/image/svg+xml/da03a88bcec9d61ec9cc67034c878c21/si189.svg si189 si189.svg svg 3900 ALTIMG 1-s2.0-S0378778821003923-si19.svg https://s3-eu-west-1.amazonaws.com/prod-ucs-content-store-eu-west/content/pii:S0378778821003923/STRIPIN/image/svg+xml/c32f43e15c0a402a345b01d623bc7f74/si19.svg si19 si19.svg svg 3618 ALTIMG 1-s2.0-S0378778821003923-si190.svg https://s3-eu-west-1.amazonaws.com/prod-ucs-content-store-eu-west/content/pii:S0378778821003923/STRIPIN/image/svg+xml/75d40f30154b6f46db21ea9c18610552/si190.svg si190 si190.svg svg 28897 ALTIMG 1-s2.0-S0378778821003923-si191.svg https://s3-eu-west-1.amazonaws.com/prod-ucs-content-store-eu-west/content/pii:S0378778821003923/STRIPIN/image/svg+xml/7b7fcc1f89dc8c67c06932cdf400557f/si191.svg si191 si191.svg svg 18583 ALTIMG 1-s2.0-S0378778821003923-si192.svg https://s3-eu-west-1.amazonaws.com/prod-ucs-content-store-eu-west/content/pii:S0378778821003923/STRIPIN/image/svg+xml/4acc4a98bf929cb34a77d40ad7b70a9a/si192.svg si192 si192.svg svg 1409 ALTIMG 1-s2.0-S0378778821003923-si193.svg https://s3-eu-west-1.amazonaws.com/prod-ucs-content-store-eu-west/content/pii:S0378778821003923/STRIPIN/image/svg+xml/c192d79f6f8b69250ae184c62c846624/si193.svg si193 si193.svg svg 3883 ALTIMG 1-s2.0-S0378778821003923-si194.svg https://s3-eu-west-1.amazonaws.com/prod-ucs-content-store-eu-west/content/pii:S0378778821003923/STRIPIN/image/svg+xml/eb5fe91db8a7d2a1d835c0e9bfd5f176/si194.svg si194 si194.svg svg 13936 ALTIMG 1-s2.0-S0378778821003923-si195.svg https://s3-eu-west-1.amazonaws.com/prod-ucs-content-store-eu-west/content/pii:S0378778821003923/STRIPIN/image/svg+xml/c9a029eec0faf1def26eccc91e8ecdcd/si195.svg si195 si195.svg svg 6598 ALTIMG 1-s2.0-S0378778821003923-si196.svg https://s3-eu-west-1.amazonaws.com/prod-ucs-content-store-eu-west/content/pii:S0378778821003923/STRIPIN/image/svg+xml/0de44624256ce30d413654f34de65c57/si196.svg si196 si196.svg svg 2550 ALTIMG 1-s2.0-S0378778821003923-si197.svg https://s3-eu-west-1.amazonaws.com/prod-ucs-content-store-eu-west/content/pii:S0378778821003923/STRIPIN/image/svg+xml/185038753f2a08ca25a7f57ee44fcb6f/si197.svg si197 si197.svg svg 4456 ALTIMG 1-s2.0-S0378778821003923-si198.svg https://s3-eu-west-1.amazonaws.com/prod-ucs-content-store-eu-west/content/pii:S0378778821003923/STRIPIN/image/svg+xml/4c88650f5108caa6c8395b26716fc565/si198.svg si198 si198.svg svg 7104 ALTIMG 1-s2.0-S0378778821003923-si199.svg https://s3-eu-west-1.amazonaws.com/prod-ucs-content-store-eu-west/content/pii:S0378778821003923/STRIPIN/image/svg+xml/572ac8878ab9db832d720ec9e5f1bd63/si199.svg si199 si199.svg svg 6465 ALTIMG 1-s2.0-S0378778821003923-si2.svg https://s3-eu-west-1.amazonaws.com/prod-ucs-content-store-eu-west/content/pii:S0378778821003923/STRIPIN/image/svg+xml/50e990fab0d78e3f5e0f095a1a9ff801/si2.svg si2 si2.svg svg 2613 ALTIMG 1-s2.0-S0378778821003923-si20.svg https://s3-eu-west-1.amazonaws.com/prod-ucs-content-store-eu-west/content/pii:S0378778821003923/STRIPIN/image/svg+xml/1d318bf0b3ca2840eac0c4b2d5f62c2a/si20.svg si20 si20.svg svg 2438 ALTIMG 1-s2.0-S0378778821003923-si200.svg https://s3-eu-west-1.amazonaws.com/prod-ucs-content-store-eu-west/content/pii:S0378778821003923/STRIPIN/image/svg+xml/494b08b4151e07bf0d1a7604cc164fd8/si200.svg si200 si200.svg svg 17634 ALTIMG 1-s2.0-S0378778821003923-si201.svg https://s3-eu-west-1.amazonaws.com/prod-ucs-content-store-eu-west/content/pii:S0378778821003923/STRIPIN/image/svg+xml/186f0a2898497500a8f6fd03f04c7d74/si201.svg si201 si201.svg svg 2695 ALTIMG 1-s2.0-S0378778821003923-si202.svg https://s3-eu-west-1.amazonaws.com/prod-ucs-content-store-eu-west/content/pii:S0378778821003923/STRIPIN/image/svg+xml/4602c19a316e4dd04249e89bef5938d5/si202.svg si202 si202.svg svg 2613 ALTIMG 1-s2.0-S0378778821003923-si203.svg https://s3-eu-west-1.amazonaws.com/prod-ucs-content-store-eu-west/content/pii:S0378778821003923/STRIPIN/image/svg+xml/e65e25e77ea88325518a3b36d9b2a6b0/si203.svg si203 si203.svg svg 3540 ALTIMG 1-s2.0-S0378778821003923-si204.svg https://s3-eu-west-1.amazonaws.com/prod-ucs-content-store-eu-west/content/pii:S0378778821003923/STRIPIN/image/svg+xml/2cd5e773e1eb6b49b7b9ddf0c76fb8db/si204.svg si204 si204.svg svg 3885 ALTIMG 1-s2.0-S0378778821003923-si205.svg https://s3-eu-west-1.amazonaws.com/prod-ucs-content-store-eu-west/content/pii:S0378778821003923/STRIPIN/image/svg+xml/dd76412ae9c87204a853e31c3572ecb9/si205.svg si205 si205.svg svg 3841 ALTIMG 1-s2.0-S0378778821003923-si206.svg https://s3-eu-west-1.amazonaws.com/prod-ucs-content-store-eu-west/content/pii:S0378778821003923/STRIPIN/image/svg+xml/1513ac61048dbc4cad448fbc6d635558/si206.svg si206 si206.svg svg 4905 ALTIMG 1-s2.0-S0378778821003923-si207.svg https://s3-eu-west-1.amazonaws.com/prod-ucs-content-store-eu-west/content/pii:S0378778821003923/STRIPIN/image/svg+xml/60dcde95511578cea7be3429d15e82fe/si207.svg si207 si207.svg svg 4905 ALTIMG 1-s2.0-S0378778821003923-si208.svg https://s3-eu-west-1.amazonaws.com/prod-ucs-content-store-eu-west/content/pii:S0378778821003923/STRIPIN/image/svg+xml/1863a6f5403cc7977beacfb6b3c2b4cd/si208.svg si208 si208.svg svg 3885 ALTIMG 1-s2.0-S0378778821003923-si209.svg https://s3-eu-west-1.amazonaws.com/prod-ucs-content-store-eu-west/content/pii:S0378778821003923/STRIPIN/image/svg+xml/adfff418fedffed418b31ce63bdf9958/si209.svg si209 si209.svg svg 16117 ALTIMG 1-s2.0-S0378778821003923-si21.svg https://s3-eu-west-1.amazonaws.com/prod-ucs-content-store-eu-west/content/pii:S0378778821003923/STRIPIN/image/svg+xml/154377380283c72fb04a949b5c2073c5/si21.svg si21 si21.svg svg 1409 ALTIMG 1-s2.0-S0378778821003923-si210.svg https://s3-eu-west-1.amazonaws.com/prod-ucs-content-store-eu-west/content/pii:S0378778821003923/STRIPIN/image/svg+xml/587aa9c58e5eeb7d24375ff049dbb8c4/si210.svg si210 si210.svg svg 29496 ALTIMG 1-s2.0-S0378778821003923-si211.svg https://s3-eu-west-1.amazonaws.com/prod-ucs-content-store-eu-west/content/pii:S0378778821003923/STRIPIN/image/svg+xml/8b0df57219237203cfcb108d3f1eab01/si211.svg si211 si211.svg svg 19070 ALTIMG 1-s2.0-S0378778821003923-si212.svg https://s3-eu-west-1.amazonaws.com/prod-ucs-content-store-eu-west/content/pii:S0378778821003923/STRIPIN/image/svg+xml/f85cbbc0cdcee78c171bc9d219e30657/si212.svg si212 si212.svg svg 24632 ALTIMG 1-s2.0-S0378778821003923-si213.svg https://s3-eu-west-1.amazonaws.com/prod-ucs-content-store-eu-west/content/pii:S0378778821003923/STRIPIN/image/svg+xml/5cc8ddbd517a14293e76baaa5a792db5/si213.svg si213 si213.svg svg 21838 ALTIMG 1-s2.0-S0378778821003923-si214.svg https://s3-eu-west-1.amazonaws.com/prod-ucs-content-store-eu-west/content/pii:S0378778821003923/STRIPIN/image/svg+xml/3a7a5d1537441f695ff1c7ad81b15da4/si214.svg si214 si214.svg svg 21262 ALTIMG 1-s2.0-S0378778821003923-si215.svg https://s3-eu-west-1.amazonaws.com/prod-ucs-content-store-eu-west/content/pii:S0378778821003923/STRIPIN/image/svg+xml/196074996f4f427f0c332eca5925143f/si215.svg si215 si215.svg svg 16361 ALTIMG 1-s2.0-S0378778821003923-si216.svg https://s3-eu-west-1.amazonaws.com/prod-ucs-content-store-eu-west/content/pii:S0378778821003923/STRIPIN/image/svg+xml/1e11c6b44d7e3c47312664292a5e983d/si216.svg si216 si216.svg svg 16439 ALTIMG 1-s2.0-S0378778821003923-si217.svg https://s3-eu-west-1.amazonaws.com/prod-ucs-content-store-eu-west/content/pii:S0378778821003923/STRIPIN/image/svg+xml/1a0d0ba0663b264bde94d1b3036221ee/si217.svg si217 si217.svg svg 3762 ALTIMG 1-s2.0-S0378778821003923-si218.svg https://s3-eu-west-1.amazonaws.com/prod-ucs-content-store-eu-west/content/pii:S0378778821003923/STRIPIN/image/svg+xml/b93aeef9fc7ef2eb069f8a2a5610010b/si218.svg si218 si218.svg svg 3735 ALTIMG 1-s2.0-S0378778821003923-si219.svg https://s3-eu-west-1.amazonaws.com/prod-ucs-content-store-eu-west/content/pii:S0378778821003923/STRIPIN/image/svg+xml/0b0c1100ea973e97c93bd1879575fca3/si219.svg si219 si219.svg svg 3900 ALTIMG 1-s2.0-S0378778821003923-si22.svg https://s3-eu-west-1.amazonaws.com/prod-ucs-content-store-eu-west/content/pii:S0378778821003923/STRIPIN/image/svg+xml/388e2b5e35acf18ff52f31fe64ebd7d1/si22.svg si22 si22.svg svg 3618 ALTIMG 1-s2.0-S0378778821003923-si220.svg https://s3-eu-west-1.amazonaws.com/prod-ucs-content-store-eu-west/content/pii:S0378778821003923/STRIPIN/image/svg+xml/c6ee635f4e544d4f3657e2c83c4fd4d7/si220.svg si220 si220.svg svg 11830 ALTIMG 1-s2.0-S0378778821003923-si221.svg https://s3-eu-west-1.amazonaws.com/prod-ucs-content-store-eu-west/content/pii:S0378778821003923/STRIPIN/image/svg+xml/857dd2f3807e62b4132c84a2470b69e0/si221.svg si221 si221.svg svg 19959 ALTIMG 1-s2.0-S0378778821003923-si222.svg https://s3-eu-west-1.amazonaws.com/prod-ucs-content-store-eu-west/content/pii:S0378778821003923/STRIPIN/image/svg+xml/a6877721644d9818556ce6a3f76aed3c/si222.svg si222 si222.svg svg 25978 ALTIMG 1-s2.0-S0378778821003923-si223.svg https://s3-eu-west-1.amazonaws.com/prod-ucs-content-store-eu-west/content/pii:S0378778821003923/STRIPIN/image/svg+xml/645ba5a63a406573eb4827d8dd50cf42/si223.svg si223 si223.svg svg 1799 ALTIMG 1-s2.0-S0378778821003923-si224.svg https://s3-eu-west-1.amazonaws.com/prod-ucs-content-store-eu-west/content/pii:S0378778821003923/STRIPIN/image/svg+xml/82e8c13b4aba55fee81bf935084fad1c/si224.svg si224 si224.svg svg 9396 ALTIMG 1-s2.0-S0378778821003923-si225.svg https://s3-eu-west-1.amazonaws.com/prod-ucs-content-store-eu-west/content/pii:S0378778821003923/STRIPIN/image/svg+xml/6866728fb000222deb0ea553f7b5cfd0/si225.svg si225 si225.svg svg 1799 ALTIMG 1-s2.0-S0378778821003923-si226.svg https://s3-eu-west-1.amazonaws.com/prod-ucs-content-store-eu-west/content/pii:S0378778821003923/STRIPIN/image/svg+xml/d00abd427d43eccb219df9da7e8df06b/si226.svg si226 si226.svg svg 4684 ALTIMG 1-s2.0-S0378778821003923-si227.svg https://s3-eu-west-1.amazonaws.com/prod-ucs-content-store-eu-west/content/pii:S0378778821003923/STRIPIN/image/svg+xml/e36581b850bce0aba5fbb32e340d4b14/si227.svg si227 si227.svg svg 4684 ALTIMG 1-s2.0-S0378778821003923-si228.svg https://s3-eu-west-1.amazonaws.com/prod-ucs-content-store-eu-west/content/pii:S0378778821003923/STRIPIN/image/svg+xml/e1d5a31fa4b459365cef28365936c472/si228.svg si228 si228.svg svg 1799 ALTIMG 1-s2.0-S0378778821003923-si229.svg https://s3-eu-west-1.amazonaws.com/prod-ucs-content-store-eu-west/content/pii:S0378778821003923/STRIPIN/image/svg+xml/0ad10e8c82d5550e94d5a78557d77b84/si229.svg si229 si229.svg svg 5964 ALTIMG 1-s2.0-S0378778821003923-si23.svg https://s3-eu-west-1.amazonaws.com/prod-ucs-content-store-eu-west/content/pii:S0378778821003923/STRIPIN/image/svg+xml/21fe13d811e21447a53007c2046cbb8a/si23.svg si23 si23.svg svg 4231 ALTIMG 1-s2.0-S0378778821003923-si230.svg https://s3-eu-west-1.amazonaws.com/prod-ucs-content-store-eu-west/content/pii:S0378778821003923/STRIPIN/image/svg+xml/f494a32b09911f7ae423dbf7b9f0f515/si230.svg si230 si230.svg svg 4684 ALTIMG 1-s2.0-S0378778821003923-si231.svg https://s3-eu-west-1.amazonaws.com/prod-ucs-content-store-eu-west/content/pii:S0378778821003923/STRIPIN/image/svg+xml/560b3f2bcb9da41c74660a22b7045dff/si231.svg si231 si231.svg svg 4684 ALTIMG 1-s2.0-S0378778821003923-si232.svg https://s3-eu-west-1.amazonaws.com/prod-ucs-content-store-eu-west/content/pii:S0378778821003923/STRIPIN/image/svg+xml/9bf8efab30fffe45a5de384db2ba7ef4/si232.svg si232 si232.svg svg 9171 ALTIMG 1-s2.0-S0378778821003923-si233.svg https://s3-eu-west-1.amazonaws.com/prod-ucs-content-store-eu-west/content/pii:S0378778821003923/STRIPIN/image/svg+xml/476c8480c20fc58a4d64b45036270cc3/si233.svg si233 si233.svg svg 5902 ALTIMG 1-s2.0-S0378778821003923-si234.svg https://s3-eu-west-1.amazonaws.com/prod-ucs-content-store-eu-west/content/pii:S0378778821003923/STRIPIN/image/svg+xml/a13d4d98ed893a80febbdaabd4bf8329/si234.svg si234 si234.svg svg 5568 ALTIMG 1-s2.0-S0378778821003923-si235.svg https://s3-eu-west-1.amazonaws.com/prod-ucs-content-store-eu-west/content/pii:S0378778821003923/STRIPIN/image/svg+xml/57c5c5c25de05cdcf22eee91401bb54d/si235.svg si235 si235.svg svg 4684 ALTIMG 1-s2.0-S0378778821003923-si236.svg https://s3-eu-west-1.amazonaws.com/prod-ucs-content-store-eu-west/content/pii:S0378778821003923/STRIPIN/image/svg+xml/4a5c000b02eb4946220aaafdea8f5320/si236.svg si236 si236.svg svg 1799 ALTIMG 1-s2.0-S0378778821003923-si237.svg https://s3-eu-west-1.amazonaws.com/prod-ucs-content-store-eu-west/content/pii:S0378778821003923/STRIPIN/image/svg+xml/3eb4a237bdc74fd30b24bb12464f6f24/si237.svg si237 si237.svg svg 4684 ALTIMG 1-s2.0-S0378778821003923-si238.svg https://s3-eu-west-1.amazonaws.com/prod-ucs-content-store-eu-west/content/pii:S0378778821003923/STRIPIN/image/svg+xml/7f9a568063ae048d7c28e883f4bc04da/si238.svg si238 si238.svg svg 11636 ALTIMG 1-s2.0-S0378778821003923-si239.svg https://s3-eu-west-1.amazonaws.com/prod-ucs-content-store-eu-west/content/pii:S0378778821003923/STRIPIN/image/svg+xml/7cc65e55550c9c319162ae60675969cb/si239.svg si239 si239.svg svg 4684 ALTIMG 1-s2.0-S0378778821003923-si24.svg https://s3-eu-west-1.amazonaws.com/prod-ucs-content-store-eu-west/content/pii:S0378778821003923/STRIPIN/image/svg+xml/20c6c608808daca37de28f7f5fefca09/si24.svg si24 si24.svg svg 4054 ALTIMG 1-s2.0-S0378778821003923-si240.svg https://s3-eu-west-1.amazonaws.com/prod-ucs-content-store-eu-west/content/pii:S0378778821003923/STRIPIN/image/svg+xml/26483ec0e30c31cd61b1665edf72b284/si240.svg si240 si240.svg svg 1799 ALTIMG 1-s2.0-S0378778821003923-si241.svg https://s3-eu-west-1.amazonaws.com/prod-ucs-content-store-eu-west/content/pii:S0378778821003923/STRIPIN/image/svg+xml/611ca0e042f3b2b69eb8fc8c7c844660/si241.svg si241 si241.svg svg 1799 ALTIMG 1-s2.0-S0378778821003923-si242.svg https://s3-eu-west-1.amazonaws.com/prod-ucs-content-store-eu-west/content/pii:S0378778821003923/STRIPIN/image/svg+xml/42403be7614d0a66873eae4c4052821a/si242.svg si242 si242.svg svg 4684 ALTIMG 1-s2.0-S0378778821003923-si243.svg https://s3-eu-west-1.amazonaws.com/prod-ucs-content-store-eu-west/content/pii:S0378778821003923/STRIPIN/image/svg+xml/f274e995d3c568869acbfcad4ea30a02/si243.svg si243 si243.svg svg 10119 ALTIMG 1-s2.0-S0378778821003923-si244.svg https://s3-eu-west-1.amazonaws.com/prod-ucs-content-store-eu-west/content/pii:S0378778821003923/STRIPIN/image/svg+xml/dd1a4ac760192c28f9c98b64d97ab3e3/si244.svg si244 si244.svg svg 2214 ALTIMG 1-s2.0-S0378778821003923-si245.svg https://s3-eu-west-1.amazonaws.com/prod-ucs-content-store-eu-west/content/pii:S0378778821003923/STRIPIN/image/svg+xml/a5167e5eb1eac2f2b44cd2274d1fbf68/si245.svg si245 si245.svg svg 1799 ALTIMG 1-s2.0-S0378778821003923-si246.svg https://s3-eu-west-1.amazonaws.com/prod-ucs-content-store-eu-west/content/pii:S0378778821003923/STRIPIN/image/svg+xml/e964ea4b57c9897d0233ddc91337c031/si246.svg si246 si246.svg svg 9171 ALTIMG 1-s2.0-S0378778821003923-si247.svg https://s3-eu-west-1.amazonaws.com/prod-ucs-content-store-eu-west/content/pii:S0378778821003923/STRIPIN/image/svg+xml/dded9342f425b4a0969bae4eedc4bdca/si247.svg si247 si247.svg svg 4684 ALTIMG 1-s2.0-S0378778821003923-si248.svg https://s3-eu-west-1.amazonaws.com/prod-ucs-content-store-eu-west/content/pii:S0378778821003923/STRIPIN/image/svg+xml/d6c03691564fa3fe49dbfbe73594b569/si248.svg si248 si248.svg svg 9171 ALTIMG 1-s2.0-S0378778821003923-si249.svg https://s3-eu-west-1.amazonaws.com/prod-ucs-content-store-eu-west/content/pii:S0378778821003923/STRIPIN/image/svg+xml/8ea88f16845b3e880c03d7b0df508e70/si249.svg si249 si249.svg svg 4684 ALTIMG 1-s2.0-S0378778821003923-si25.svg https://s3-eu-west-1.amazonaws.com/prod-ucs-content-store-eu-west/content/pii:S0378778821003923/STRIPIN/image/svg+xml/9bcaf71ade60f429139d66645abcac6a/si25.svg si25 si25.svg svg 4357 ALTIMG 1-s2.0-S0378778821003923-si250.svg https://s3-eu-west-1.amazonaws.com/prod-ucs-content-store-eu-west/content/pii:S0378778821003923/STRIPIN/image/svg+xml/0e05baf7ce569a11020a08723090c8ed/si250.svg si250 si250.svg svg 4650 ALTIMG 1-s2.0-S0378778821003923-si251.svg https://s3-eu-west-1.amazonaws.com/prod-ucs-content-store-eu-west/content/pii:S0378778821003923/STRIPIN/image/svg+xml/28be04b8e8840fb907787cf59825997f/si251.svg si251 si251.svg svg 6874 ALTIMG 1-s2.0-S0378778821003923-si252.svg https://s3-eu-west-1.amazonaws.com/prod-ucs-content-store-eu-west/content/pii:S0378778821003923/STRIPIN/image/svg+xml/71cdaede2d6da4b7e506189998607f85/si252.svg si252 si252.svg svg 5828 ALTIMG 1-s2.0-S0378778821003923-si253.svg https://s3-eu-west-1.amazonaws.com/prod-ucs-content-store-eu-west/content/pii:S0378778821003923/STRIPIN/image/svg+xml/a7b5ad6836c25254acfb08c2a6b349ad/si253.svg si253 si253.svg svg 4234 ALTIMG 1-s2.0-S0378778821003923-si254.svg https://s3-eu-west-1.amazonaws.com/prod-ucs-content-store-eu-west/content/pii:S0378778821003923/STRIPIN/image/svg+xml/ad9e198ab5512cfeb8b135d6a9a5fef1/si254.svg si254 si254.svg svg 10506 ALTIMG 1-s2.0-S0378778821003923-si255.svg https://s3-eu-west-1.amazonaws.com/prod-ucs-content-store-eu-west/content/pii:S0378778821003923/STRIPIN/image/svg+xml/3f6346eb4fc3443565be9d9f6fed7e2e/si255.svg si255 si255.svg svg 6687 ALTIMG 1-s2.0-S0378778821003923-si256.svg https://s3-eu-west-1.amazonaws.com/prod-ucs-content-store-eu-west/content/pii:S0378778821003923/STRIPIN/image/svg+xml/324a38ee8606fde7714562d6a707478d/si256.svg si256 si256.svg svg 9299 ALTIMG 1-s2.0-S0378778821003923-si257.svg https://s3-eu-west-1.amazonaws.com/prod-ucs-content-store-eu-west/content/pii:S0378778821003923/STRIPIN/image/svg+xml/4d65575fd7c2b37a7111483e47b24acf/si257.svg si257 si257.svg svg 6186 ALTIMG 1-s2.0-S0378778821003923-si258.svg https://s3-eu-west-1.amazonaws.com/prod-ucs-content-store-eu-west/content/pii:S0378778821003923/STRIPIN/image/svg+xml/8e98149f8554e389bc3c0d971cbeca0b/si258.svg si258 si258.svg svg 9299 ALTIMG 1-s2.0-S0378778821003923-si259.svg https://s3-eu-west-1.amazonaws.com/prod-ucs-content-store-eu-west/content/pii:S0378778821003923/STRIPIN/image/svg+xml/33ae8f532a228ba3661b37e558bbfd90/si259.svg si259 si259.svg svg 16454 ALTIMG 1-s2.0-S0378778821003923-si26.svg https://s3-eu-west-1.amazonaws.com/prod-ucs-content-store-eu-west/content/pii:S0378778821003923/STRIPIN/image/svg+xml/698017c7b3361c5fd46fa39cd06398e8/si26.svg si26 si26.svg svg 4287 ALTIMG 1-s2.0-S0378778821003923-si260.svg https://s3-eu-west-1.amazonaws.com/prod-ucs-content-store-eu-west/content/pii:S0378778821003923/STRIPIN/image/svg+xml/0b8663120f15ad1cd8f0b7ccb04db606/si260.svg si260 si260.svg svg 8892 ALTIMG 1-s2.0-S0378778821003923-si261.svg https://s3-eu-west-1.amazonaws.com/prod-ucs-content-store-eu-west/content/pii:S0378778821003923/STRIPIN/image/svg+xml/caa07cce536259fb170fc0d6b3aa4fcc/si261.svg si261 si261.svg svg 8892 ALTIMG 1-s2.0-S0378778821003923-si262.svg https://s3-eu-west-1.amazonaws.com/prod-ucs-content-store-eu-west/content/pii:S0378778821003923/STRIPIN/image/svg+xml/8d5d5b86336028829b1f95f589f0a0fa/si262.svg si262 si262.svg svg 8892 ALTIMG 1-s2.0-S0378778821003923-si263.svg https://s3-eu-west-1.amazonaws.com/prod-ucs-content-store-eu-west/content/pii:S0378778821003923/STRIPIN/image/svg+xml/9581a25b39db1c7329cf70ce8ae6396a/si263.svg si263 si263.svg svg 14146 ALTIMG 1-s2.0-S0378778821003923-si264.svg https://s3-eu-west-1.amazonaws.com/prod-ucs-content-store-eu-west/content/pii:S0378778821003923/STRIPIN/image/svg+xml/145e66f65d303af1e8509eb151f6c9db/si264.svg si264 si264.svg svg 9396 ALTIMG 1-s2.0-S0378778821003923-si265.svg https://s3-eu-west-1.amazonaws.com/prod-ucs-content-store-eu-west/content/pii:S0378778821003923/STRIPIN/image/svg+xml/b5466920217ace57ad2869a72e1e3f42/si265.svg si265 si265.svg svg 9393 ALTIMG 1-s2.0-S0378778821003923-si266.svg https://s3-eu-west-1.amazonaws.com/prod-ucs-content-store-eu-west/content/pii:S0378778821003923/STRIPIN/image/svg+xml/76bb98c756fa9d956c41feb0c3be0fc6/si266.svg si266 si266.svg svg 8533 ALTIMG 1-s2.0-S0378778821003923-si267.svg https://s3-eu-west-1.amazonaws.com/prod-ucs-content-store-eu-west/content/pii:S0378778821003923/STRIPIN/image/svg+xml/08248f7860a08ab0ea9c25c92b9e47ac/si267.svg si267 si267.svg svg 9505 ALTIMG 1-s2.0-S0378778821003923-si268.svg https://s3-eu-west-1.amazonaws.com/prod-ucs-content-store-eu-west/content/pii:S0378778821003923/STRIPIN/image/svg+xml/5561ea075c193a06435babfc824d141a/si268.svg si268 si268.svg svg 14304 ALTIMG 1-s2.0-S0378778821003923-si269.svg https://s3-eu-west-1.amazonaws.com/prod-ucs-content-store-eu-west/content/pii:S0378778821003923/STRIPIN/image/svg+xml/891f4550e4a0194c483aa3d83982cf4c/si269.svg si269 si269.svg svg 6009 ALTIMG 1-s2.0-S0378778821003923-si270.svg https://s3-eu-west-1.amazonaws.com/prod-ucs-content-store-eu-west/content/pii:S0378778821003923/STRIPIN/image/svg+xml/d0dfa18b08ca24525cddcb372dbf4aa5/si270.svg si270 si270.svg svg 3110 ALTIMG 1-s2.0-S0378778821003923-si271.svg https://s3-eu-west-1.amazonaws.com/prod-ucs-content-store-eu-west/content/pii:S0378778821003923/STRIPIN/image/svg+xml/50e4ec6ca08dc93d8e677af74825eb60/si271.svg si271 si271.svg svg 7905 ALTIMG 1-s2.0-S0378778821003923-si272.svg https://s3-eu-west-1.amazonaws.com/prod-ucs-content-store-eu-west/content/pii:S0378778821003923/STRIPIN/image/svg+xml/eefb6cf51d3eb08cfb77689b43cc3d4b/si272.svg si272 si272.svg svg 6009 ALTIMG 1-s2.0-S0378778821003923-si273.svg https://s3-eu-west-1.amazonaws.com/prod-ucs-content-store-eu-west/content/pii:S0378778821003923/STRIPIN/image/svg+xml/c953e3001423f29b9547ea1225606ede/si273.svg si273 si273.svg svg 8970 ALTIMG 1-s2.0-S0378778821003923-si274.svg https://s3-eu-west-1.amazonaws.com/prod-ucs-content-store-eu-west/content/pii:S0378778821003923/STRIPIN/image/svg+xml/a3e31c87e794e9de454ab7fe2f31ec6a/si274.svg si274 si274.svg svg 8970 ALTIMG 1-s2.0-S0378778821003923-si275.svg https://s3-eu-west-1.amazonaws.com/prod-ucs-content-store-eu-west/content/pii:S0378778821003923/STRIPIN/image/svg+xml/743a10c070750a755483e792ccf979a1/si275.svg si275 si275.svg svg 12832 ALTIMG 1-s2.0-S0378778821003923-si276.svg https://s3-eu-west-1.amazonaws.com/prod-ucs-content-store-eu-west/content/pii:S0378778821003923/STRIPIN/image/svg+xml/78c0a3a92fac71963ed7841fea1d832e/si276.svg si276 si276.svg svg 1740 ALTIMG 1-s2.0-S0378778821003923-si277.svg https://s3-eu-west-1.amazonaws.com/prod-ucs-content-store-eu-west/content/pii:S0378778821003923/STRIPIN/image/svg+xml/b13fa11f9faedade52775654489c220a/si277.svg si277 si277.svg svg 1799 ALTIMG 1-s2.0-S0378778821003923-si278.svg https://s3-eu-west-1.amazonaws.com/prod-ucs-content-store-eu-west/content/pii:S0378778821003923/STRIPIN/image/svg+xml/517d0d901a704f15704d385ef5d630ee/si278.svg si278 si278.svg svg 19015 ALTIMG 1-s2.0-S0378778821003923-si279.svg https://s3-eu-west-1.amazonaws.com/prod-ucs-content-store-eu-west/content/pii:S0378778821003923/STRIPIN/image/svg+xml/f045f54c9f99ae0d66ae360fd4b2e059/si279.svg si279 si279.svg svg 8348 ALTIMG 1-s2.0-S0378778821003923-si28.svg https://s3-eu-west-1.amazonaws.com/prod-ucs-content-store-eu-west/content/pii:S0378778821003923/STRIPIN/image/svg+xml/450af410313ccf2b1c9aab55ab2f8df2/si28.svg si28 si28.svg svg 804 ALTIMG 1-s2.0-S0378778821003923-si280.svg https://s3-eu-west-1.amazonaws.com/prod-ucs-content-store-eu-west/content/pii:S0378778821003923/STRIPIN/image/svg+xml/10a32e3d7a5a3e2a327bfd7875ee33cd/si280.svg si280 si280.svg svg 1799 ALTIMG 1-s2.0-S0378778821003923-si281.svg https://s3-eu-west-1.amazonaws.com/prod-ucs-content-store-eu-west/content/pii:S0378778821003923/STRIPIN/image/svg+xml/1c5e439e79298242035d44abcbb76e17/si281.svg si281 si281.svg svg 9393 ALTIMG 1-s2.0-S0378778821003923-si282.svg https://s3-eu-west-1.amazonaws.com/prod-ucs-content-store-eu-west/content/pii:S0378778821003923/STRIPIN/image/svg+xml/b43308c3fe41ba88be1d757007bda736/si282.svg si282 si282.svg svg 12023 ALTIMG 1-s2.0-S0378778821003923-si283.svg https://s3-eu-west-1.amazonaws.com/prod-ucs-content-store-eu-west/content/pii:S0378778821003923/STRIPIN/image/svg+xml/27e3518923737815d2195fabcaf3d091/si283.svg si283 si283.svg svg 11115 ALTIMG 1-s2.0-S0378778821003923-si284.svg https://s3-eu-west-1.amazonaws.com/prod-ucs-content-store-eu-west/content/pii:S0378778821003923/STRIPIN/image/svg+xml/a292e88ca0576b9d8a4aa95f7421cb4a/si284.svg si284 si284.svg svg 10969 ALTIMG 1-s2.0-S0378778821003923-si285.svg https://s3-eu-west-1.amazonaws.com/prod-ucs-content-store-eu-west/content/pii:S0378778821003923/STRIPIN/image/svg+xml/71c2430fd19a154e9a5145befec52259/si285.svg si285 si285.svg svg 1112 ALTIMG 1-s2.0-S0378778821003923-si286.svg https://s3-eu-west-1.amazonaws.com/prod-ucs-content-store-eu-west/content/pii:S0378778821003923/STRIPIN/image/svg+xml/a6a073eda724fa6ddc9d8798e6bc720a/si286.svg si286 si286.svg svg 7639 ALTIMG 1-s2.0-S0378778821003923-si287.svg https://s3-eu-west-1.amazonaws.com/prod-ucs-content-store-eu-west/content/pii:S0378778821003923/STRIPIN/image/svg+xml/e3c67a9130649c818084792d2fbe2417/si287.svg si287 si287.svg svg 5662 ALTIMG 1-s2.0-S0378778821003923-si288.svg https://s3-eu-west-1.amazonaws.com/prod-ucs-content-store-eu-west/content/pii:S0378778821003923/STRIPIN/image/svg+xml/7f6567c858bb41540a1c51cd7fb7174e/si288.svg si288 si288.svg svg 6353 ALTIMG 1-s2.0-S0378778821003923-si289.svg https://s3-eu-west-1.amazonaws.com/prod-ucs-content-store-eu-west/content/pii:S0378778821003923/STRIPIN/image/svg+xml/8082982baed77e9a7720f3c1398d03a2/si289.svg si289 si289.svg svg 5662 ALTIMG 1-s2.0-S0378778821003923-si290.svg https://s3-eu-west-1.amazonaws.com/prod-ucs-content-store-eu-west/content/pii:S0378778821003923/STRIPIN/image/svg+xml/5d4b966a1d92a6fe8fdb3417bc1499ec/si290.svg si290 si290.svg svg 6365 ALTIMG 1-s2.0-S0378778821003923-si291.svg https://s3-eu-west-1.amazonaws.com/prod-ucs-content-store-eu-west/content/pii:S0378778821003923/STRIPIN/image/svg+xml/eabe74c54ecf6ec2c6616e02c24c6d9c/si291.svg si291 si291.svg svg 6365 ALTIMG 1-s2.0-S0378778821003923-si292.svg https://s3-eu-west-1.amazonaws.com/prod-ucs-content-store-eu-west/content/pii:S0378778821003923/STRIPIN/image/svg+xml/357c7ad35687b1e6a9838bacaba42987/si292.svg si292 si292.svg svg 19015 ALTIMG 1-s2.0-S0378778821003923-si293.svg https://s3-eu-west-1.amazonaws.com/prod-ucs-content-store-eu-west/content/pii:S0378778821003923/STRIPIN/image/svg+xml/1ab885590116528f39e577c24e254c7a/si293.svg si293 si293.svg svg 9393 ALTIMG 1-s2.0-S0378778821003923-si294.svg https://s3-eu-west-1.amazonaws.com/prod-ucs-content-store-eu-west/content/pii:S0378778821003923/STRIPIN/image/svg+xml/35e2274279d08175822f8ce3cd0dbf46/si294.svg si294 si294.svg svg 9396 ALTIMG 1-s2.0-S0378778821003923-si295.svg https://s3-eu-west-1.amazonaws.com/prod-ucs-content-store-eu-west/content/pii:S0378778821003923/STRIPIN/image/svg+xml/14a871c05a35e956d85804738420a25c/si295.svg si295 si295.svg svg 6687 ALTIMG 1-s2.0-S0378778821003923-si296.svg https://s3-eu-west-1.amazonaws.com/prod-ucs-content-store-eu-west/content/pii:S0378778821003923/STRIPIN/image/svg+xml/e02eae6a8a3b62337e28d65fb70fa8d8/si296.svg si296 si296.svg svg 8892 ALTIMG 1-s2.0-S0378778821003923-si297.svg https://s3-eu-west-1.amazonaws.com/prod-ucs-content-store-eu-west/content/pii:S0378778821003923/STRIPIN/image/svg+xml/c3a783770ef21fc913fe80cb8a17439a/si297.svg si297 si297.svg svg 2248 ALTIMG 1-s2.0-S0378778821003923-si298.svg https://s3-eu-west-1.amazonaws.com/prod-ucs-content-store-eu-west/content/pii:S0378778821003923/STRIPIN/image/svg+xml/8c58f98c2e84fed2baf680a0e3c5cb0e/si298.svg si298 si298.svg svg 6226 ALTIMG 1-s2.0-S0378778821003923-si299.svg https://s3-eu-west-1.amazonaws.com/prod-ucs-content-store-eu-west/content/pii:S0378778821003923/STRIPIN/image/svg+xml/ae9cde91bd0d8e29ce190e876ea3dd73/si299.svg si299 si299.svg svg 5390 ALTIMG 1-s2.0-S0378778821003923-si3.svg https://s3-eu-west-1.amazonaws.com/prod-ucs-content-store-eu-west/content/pii:S0378778821003923/STRIPIN/image/svg+xml/b62383ba8aac513eb2c515512f208e9a/si3.svg si3 si3.svg svg 1409 ALTIMG 1-s2.0-S0378778821003923-si300.svg https://s3-eu-west-1.amazonaws.com/prod-ucs-content-store-eu-west/content/pii:S0378778821003923/STRIPIN/image/svg+xml/7083eebe342e5483ad34a49ecb970e98/si300.svg si300 si300.svg svg 3440 ALTIMG 1-s2.0-S0378778821003923-si301.svg https://s3-eu-west-1.amazonaws.com/prod-ucs-content-store-eu-west/content/pii:S0378778821003923/STRIPIN/image/svg+xml/d2343fea6f8753cb120629a5ee90c877/si301.svg si301 si301.svg svg 1409 ALTIMG 1-s2.0-S0378778821003923-si302.svg https://s3-eu-west-1.amazonaws.com/prod-ucs-content-store-eu-west/content/pii:S0378778821003923/STRIPIN/image/svg+xml/bc33dd1e8389989006863610ae8b6671/si302.svg si302 si302.svg svg 8064 ALTIMG 1-s2.0-S0378778821003923-si303.svg https://s3-eu-west-1.amazonaws.com/prod-ucs-content-store-eu-west/content/pii:S0378778821003923/STRIPIN/image/svg+xml/afb92e29c1903264f0416d9bfbbbaacd/si303.svg si303 si303.svg svg 1409 ALTIMG 1-s2.0-S0378778821003923-si304.svg https://s3-eu-west-1.amazonaws.com/prod-ucs-content-store-eu-west/content/pii:S0378778821003923/STRIPIN/image/svg+xml/cf8bc4a15e2db0b7662b2472c1cce780/si304.svg si304 si304.svg svg 2898 ALTIMG 1-s2.0-S0378778821003923-si305.svg https://s3-eu-west-1.amazonaws.com/prod-ucs-content-store-eu-west/content/pii:S0378778821003923/STRIPIN/image/svg+xml/894e77d118d8b8f30834b39009d6f478/si305.svg si305 si305.svg svg 12586 ALTIMG 1-s2.0-S0378778821003923-si306.svg https://s3-eu-west-1.amazonaws.com/prod-ucs-content-store-eu-west/content/pii:S0378778821003923/STRIPIN/image/svg+xml/c1a668481c9f2ca1f1ad81fced7dae67/si306.svg si306 si306.svg svg 2898 ALTIMG 1-s2.0-S0378778821003923-si307.svg https://s3-eu-west-1.amazonaws.com/prod-ucs-content-store-eu-west/content/pii:S0378778821003923/STRIPIN/image/svg+xml/42023cf907c0a3c2bab648889a7d3e76/si307.svg si307 si307.svg svg 1409 ALTIMG 1-s2.0-S0378778821003923-si308.svg https://s3-eu-west-1.amazonaws.com/prod-ucs-content-store-eu-west/content/pii:S0378778821003923/STRIPIN/image/svg+xml/e1bbcbe96dd26cb90f8ad75c9e2ca3f5/si308.svg si308 si308.svg svg 1409 ALTIMG 1-s2.0-S0378778821003923-si309.svg https://s3-eu-west-1.amazonaws.com/prod-ucs-content-store-eu-west/content/pii:S0378778821003923/STRIPIN/image/svg+xml/cbab27c9728275c826ff9c913087a888/si309.svg si309 si309.svg svg 1409 ALTIMG 1-s2.0-S0378778821003923-si31.svg https://s3-eu-west-1.amazonaws.com/prod-ucs-content-store-eu-west/content/pii:S0378778821003923/STRIPIN/image/svg+xml/ab71088e7335275dbd4ee1e3c0c0668a/si31.svg si31 si31.svg svg 804 ALTIMG 1-s2.0-S0378778821003923-si310.svg https://s3-eu-west-1.amazonaws.com/prod-ucs-content-store-eu-west/content/pii:S0378778821003923/STRIPIN/image/svg+xml/d6da973e0c38ceb7e98257014ee6dd73/si310.svg si310 si310.svg svg 6203 ALTIMG 1-s2.0-S0378778821003923-si311.svg https://s3-eu-west-1.amazonaws.com/prod-ucs-content-store-eu-west/content/pii:S0378778821003923/STRIPIN/image/svg+xml/753d00326fe9b97774726ce53d5ecfbe/si311.svg si311 si311.svg svg 6305 ALTIMG 1-s2.0-S0378778821003923-si312.svg https://s3-eu-west-1.amazonaws.com/prod-ucs-content-store-eu-west/content/pii:S0378778821003923/STRIPIN/image/svg+xml/f3c6e7c50fc60e451e66190da2f4d9e5/si312.svg si312 si312.svg svg 3330 ALTIMG 1-s2.0-S0378778821003923-si313.svg https://s3-eu-west-1.amazonaws.com/prod-ucs-content-store-eu-west/content/pii:S0378778821003923/STRIPIN/image/svg+xml/f5021308ce9fd00594ebc66eb951ceea/si313.svg si313 si313.svg svg 1409 ALTIMG 1-s2.0-S0378778821003923-si314.svg https://s3-eu-west-1.amazonaws.com/prod-ucs-content-store-eu-west/content/pii:S0378778821003923/STRIPIN/image/svg+xml/bc5bb0b4f0ffc27cfc0321707625798c/si314.svg si314 si314.svg svg 1409 ALTIMG 1-s2.0-S0378778821003923-si315.svg https://s3-eu-west-1.amazonaws.com/prod-ucs-content-store-eu-west/content/pii:S0378778821003923/STRIPIN/image/svg+xml/764ba916866ad61b3744574a81b6ee4f/si315.svg si315 si315.svg svg 1409 ALTIMG 1-s2.0-S0378778821003923-si316.svg https://s3-eu-west-1.amazonaws.com/prod-ucs-content-store-eu-west/content/pii:S0378778821003923/STRIPIN/image/svg+xml/808d22eee252ff157b2126fb106162bd/si316.svg si316 si316.svg svg 1409 ALTIMG 1-s2.0-S0378778821003923-si317.svg https://s3-eu-west-1.amazonaws.com/prod-ucs-content-store-eu-west/content/pii:S0378778821003923/STRIPIN/image/svg+xml/489ea02ec9a69fa1fc119214152d916a/si317.svg si317 si317.svg svg 1409 ALTIMG 1-s2.0-S0378778821003923-si318.svg https://s3-eu-west-1.amazonaws.com/prod-ucs-content-store-eu-west/content/pii:S0378778821003923/STRIPIN/image/svg+xml/c6006f11e6481227c8057c686f7e900a/si318.svg si318 si318.svg svg 1409 ALTIMG 1-s2.0-S0378778821003923-si319.svg https://s3-eu-west-1.amazonaws.com/prod-ucs-content-store-eu-west/content/pii:S0378778821003923/STRIPIN/image/svg+xml/3ac1425e9620f059c35f30ea800f6ac3/si319.svg si319 si319.svg svg 1409 ALTIMG 1-s2.0-S0378778821003923-si320.svg https://s3-eu-west-1.amazonaws.com/prod-ucs-content-store-eu-west/content/pii:S0378778821003923/STRIPIN/image/svg+xml/052eccbf23c180a4cc12101c18af5e91/si320.svg si320 si320.svg svg 4285 ALTIMG 1-s2.0-S0378778821003923-si321.svg https://s3-eu-west-1.amazonaws.com/prod-ucs-content-store-eu-west/content/pii:S0378778821003923/STRIPIN/image/svg+xml/425d8b8a71069dd3d680aa1e61edd5f9/si321.svg si321 si321.svg svg 4231 ALTIMG 1-s2.0-S0378778821003923-si322.svg https://s3-eu-west-1.amazonaws.com/prod-ucs-content-store-eu-west/content/pii:S0378778821003923/STRIPIN/image/svg+xml/3ed8db6daedca08e40c4edcb6581e21c/si322.svg si322 si322.svg svg 1409 ALTIMG 1-s2.0-S0378778821003923-si323.svg https://s3-eu-west-1.amazonaws.com/prod-ucs-content-store-eu-west/content/pii:S0378778821003923/STRIPIN/image/svg+xml/1943208de4b5d146d560d34a5d1d8316/si323.svg si323 si323.svg svg 3731 ALTIMG 1-s2.0-S0378778821003923-si324.svg https://s3-eu-west-1.amazonaws.com/prod-ucs-content-store-eu-west/content/pii:S0378778821003923/STRIPIN/image/svg+xml/adb62985fcc390b75f512a18ff7ad1ce/si324.svg si324 si324.svg svg 4287 ALTIMG 1-s2.0-S0378778821003923-si325.svg https://s3-eu-west-1.amazonaws.com/prod-ucs-content-store-eu-west/content/pii:S0378778821003923/STRIPIN/image/svg+xml/e86fbbe8dbdecd558981f0d3b4d8d2ea/si325.svg si325 si325.svg svg 8205 ALTIMG 1-s2.0-S0378778821003923-si326.svg https://s3-eu-west-1.amazonaws.com/prod-ucs-content-store-eu-west/content/pii:S0378778821003923/STRIPIN/image/svg+xml/e2b73505b53f0e06d0d2fa148f0c95eb/si326.svg si326 si326.svg svg 4287 ALTIMG 1-s2.0-S0378778821003923-si327.svg https://s3-eu-west-1.amazonaws.com/prod-ucs-content-store-eu-west/content/pii:S0378778821003923/STRIPIN/image/svg+xml/5b38a3de93581ce3eb647c59211b3de8/si327.svg si327 si327.svg svg 1409 ALTIMG 1-s2.0-S0378778821003923-si328.svg https://s3-eu-west-1.amazonaws.com/prod-ucs-content-store-eu-west/content/pii:S0378778821003923/STRIPIN/image/svg+xml/f6a3ebe69aca40544716aa03dfb9737e/si328.svg si328 si328.svg svg 4971 ALTIMG 1-s2.0-S0378778821003923-si329.svg https://s3-eu-west-1.amazonaws.com/prod-ucs-content-store-eu-west/content/pii:S0378778821003923/STRIPIN/image/svg+xml/16013076f538782b70a0a06739ec5cf5/si329.svg si329 si329.svg svg 1409 ALTIMG 1-s2.0-S0378778821003923-si330.svg https://s3-eu-west-1.amazonaws.com/prod-ucs-content-store-eu-west/content/pii:S0378778821003923/STRIPIN/image/svg+xml/377203af5f9ebd02ef0982d352eb7602/si330.svg si330 si330.svg svg 3618 ALTIMG 1-s2.0-S0378778821003923-si331.svg https://s3-eu-west-1.amazonaws.com/prod-ucs-content-store-eu-west/content/pii:S0378778821003923/STRIPIN/image/svg+xml/67a417d4bdc51fa717db89b24ee94066/si331.svg si331 si331.svg svg 2438 ALTIMG 1-s2.0-S0378778821003923-si332.svg https://s3-eu-west-1.amazonaws.com/prod-ucs-content-store-eu-west/content/pii:S0378778821003923/STRIPIN/image/svg+xml/3acc861dd454e620a06764f3db59a266/si332.svg si332 si332.svg svg 1409 ALTIMG 1-s2.0-S0378778821003923-si333.svg https://s3-eu-west-1.amazonaws.com/prod-ucs-content-store-eu-west/content/pii:S0378778821003923/STRIPIN/image/svg+xml/7745cf49934954d0691e2bd765e1d999/si333.svg si333 si333.svg svg 1409 ALTIMG 1-s2.0-S0378778821003923-si334.svg https://s3-eu-west-1.amazonaws.com/prod-ucs-content-store-eu-west/content/pii:S0378778821003923/STRIPIN/image/svg+xml/1d8216c91c38b4623aac56622fd6e7c6/si334.svg si334 si334.svg svg 3731 ALTIMG 1-s2.0-S0378778821003923-si335.svg https://s3-eu-west-1.amazonaws.com/prod-ucs-content-store-eu-west/content/pii:S0378778821003923/STRIPIN/image/svg+xml/382d93a5036dcfd95de00ab8e857f413/si335.svg si335 si335.svg svg 4232 ALTIMG 1-s2.0-S0378778821003923-si336.svg https://s3-eu-west-1.amazonaws.com/prod-ucs-content-store-eu-west/content/pii:S0378778821003923/STRIPIN/image/svg+xml/d5d9ede48fbb844d7588656802bf4c30/si336.svg si336 si336.svg svg 1410 ALTIMG 1-s2.0-S0378778821003923-si337.svg https://s3-eu-west-1.amazonaws.com/prod-ucs-content-store-eu-west/content/pii:S0378778821003923/STRIPIN/image/svg+xml/f1f8715ccd8ca8f1338930df9b4e127b/si337.svg si337 si337.svg svg 1410 ALTIMG 1-s2.0-S0378778821003923-si338.svg https://s3-eu-west-1.amazonaws.com/prod-ucs-content-store-eu-west/content/pii:S0378778821003923/STRIPIN/image/svg+xml/a624d5dc4825d1c6915e0294c8967bdf/si338.svg si338 si338.svg svg 1410 ALTIMG 1-s2.0-S0378778821003923-si339.svg https://s3-eu-west-1.amazonaws.com/prod-ucs-content-store-eu-west/content/pii:S0378778821003923/STRIPIN/image/svg+xml/de4cb25f0eb844aed060de3c93b68801/si339.svg si339 si339.svg svg 3732 ALTIMG 1-s2.0-S0378778821003923-si34.svg https://s3-eu-west-1.amazonaws.com/prod-ucs-content-store-eu-west/content/pii:S0378778821003923/STRIPIN/image/svg+xml/112475f247f4bfbaf55e7e3c531f7e78/si34.svg si34 si34.svg svg 805 ALTIMG 1-s2.0-S0378778821003923-si340.svg https://s3-eu-west-1.amazonaws.com/prod-ucs-content-store-eu-west/content/pii:S0378778821003923/STRIPIN/image/svg+xml/a913dcb778fc5b7d30b7ba1d58ae796d/si340.svg si340 si340.svg svg 1410 ALTIMG 1-s2.0-S0378778821003923-si341.svg https://s3-eu-west-1.amazonaws.com/prod-ucs-content-store-eu-west/content/pii:S0378778821003923/STRIPIN/image/svg+xml/0cf54a40dc7f5309824798df165d9e24/si341.svg si341 si341.svg svg 1410 ALTIMG 1-s2.0-S0378778821003923-si342.svg https://s3-eu-west-1.amazonaws.com/prod-ucs-content-store-eu-west/content/pii:S0378778821003923/STRIPIN/image/svg+xml/31535c23007bc740fbfbb48ce5812f31/si342.svg si342 si342.svg svg 1410 ALTIMG 1-s2.0-S0378778821003923-si343.svg https://s3-eu-west-1.amazonaws.com/prod-ucs-content-store-eu-west/content/pii:S0378778821003923/STRIPIN/image/svg+xml/7bd3816f8e2352c10080e7de03aeb63b/si343.svg si343 si343.svg svg 6150 ALTIMG 1-s2.0-S0378778821003923-si344.svg https://s3-eu-west-1.amazonaws.com/prod-ucs-content-store-eu-west/content/pii:S0378778821003923/STRIPIN/image/svg+xml/c6f681603fe4622b22340affd179a818/si344.svg si344 si344.svg svg 6337 ALTIMG 1-s2.0-S0378778821003923-si345.svg https://s3-eu-west-1.amazonaws.com/prod-ucs-content-store-eu-west/content/pii:S0378778821003923/STRIPIN/image/svg+xml/2457b648f6aa2d96026fdc2583b26553/si345.svg si345 si345.svg svg 1410 ALTIMG 1-s2.0-S0378778821003923-si346.svg https://s3-eu-west-1.amazonaws.com/prod-ucs-content-store-eu-west/content/pii:S0378778821003923/STRIPIN/image/svg+xml/a9e7a70c03ace0284366a30f59316c84/si346.svg si346 si346.svg svg 1410 ALTIMG 1-s2.0-S0378778821003923-si347.svg https://s3-eu-west-1.amazonaws.com/prod-ucs-content-store-eu-west/content/pii:S0378778821003923/STRIPIN/image/svg+xml/16ccd1f100c21504c78800cf081de075/si347.svg si347 si347.svg svg 4055 ALTIMG 1-s2.0-S0378778821003923-si348.svg https://s3-eu-west-1.amazonaws.com/prod-ucs-content-store-eu-west/content/pii:S0378778821003923/STRIPIN/image/svg+xml/b54bff167f86ed67b5a6e33487498efd/si348.svg si348 si348.svg svg 1410 ALTIMG 1-s2.0-S0378778821003923-si349.svg https://s3-eu-west-1.amazonaws.com/prod-ucs-content-store-eu-west/content/pii:S0378778821003923/STRIPIN/image/svg+xml/30e3364b28e6a5ed068b2033a186f3aa/si349.svg si349 si349.svg svg 3992 ALTIMG 1-s2.0-S0378778821003923-si350.svg https://s3-eu-west-1.amazonaws.com/prod-ucs-content-store-eu-west/content/pii:S0378778821003923/STRIPIN/image/svg+xml/07321aa384b04d3cc36e34bb77cf43bf/si350.svg si350 si350.svg svg 1410 ALTIMG 1-s2.0-S0378778821003923-si351.svg https://s3-eu-west-1.amazonaws.com/prod-ucs-content-store-eu-west/content/pii:S0378778821003923/STRIPIN/image/svg+xml/24c9c94f2644b4bd56e50852e5ca0051/si351.svg si351 si351.svg svg 3965 ALTIMG 1-s2.0-S0378778821003923-si352.svg https://s3-eu-west-1.amazonaws.com/prod-ucs-content-store-eu-west/content/pii:S0378778821003923/STRIPIN/image/svg+xml/5e928d048b73d1c142e5bc33423a1be8/si352.svg si352 si352.svg svg 1410 ALTIMG 1-s2.0-S0378778821003923-si353.svg https://s3-eu-west-1.amazonaws.com/prod-ucs-content-store-eu-west/content/pii:S0378778821003923/STRIPIN/image/svg+xml/a959f276e89b6a9dfaa54cd50fe0123b/si353.svg si353 si353.svg svg 6827 ALTIMG 1-s2.0-S0378778821003923-si354.svg https://s3-eu-west-1.amazonaws.com/prod-ucs-content-store-eu-west/content/pii:S0378778821003923/STRIPIN/image/svg+xml/7a31d06f22abbc1979c82e174e968163/si354.svg si354 si354.svg svg 1410 ALTIMG 1-s2.0-S0378778821003923-si355.svg https://s3-eu-west-1.amazonaws.com/prod-ucs-content-store-eu-west/content/pii:S0378778821003923/STRIPIN/image/svg+xml/ba0feb3d423ec3541df3a1c8fa3112d9/si355.svg si355 si355.svg svg 1410 ALTIMG 1-s2.0-S0378778821003923-si356.svg https://s3-eu-west-1.amazonaws.com/prod-ucs-content-store-eu-west/content/pii:S0378778821003923/STRIPIN/image/svg+xml/e15ad0d8c8721c0bcaa0d3d2d69272e3/si356.svg si356 si356.svg svg 4321 ALTIMG 1-s2.0-S0378778821003923-si37.svg https://s3-eu-west-1.amazonaws.com/prod-ucs-content-store-eu-west/content/pii:S0378778821003923/STRIPIN/image/svg+xml/90cb6250619b1e9ce25961a1930a3c21/si37.svg si37 si37.svg svg 805 ALTIMG 1-s2.0-S0378778821003923-si4.svg https://s3-eu-west-1.amazonaws.com/prod-ucs-content-store-eu-west/content/pii:S0378778821003923/STRIPIN/image/svg+xml/432eec7c6978d23fc1808b0065db738c/si4.svg si4 si4.svg svg 1410 ALTIMG 1-s2.0-S0378778821003923-si40.svg https://s3-eu-west-1.amazonaws.com/prod-ucs-content-store-eu-west/content/pii:S0378778821003923/STRIPIN/image/svg+xml/15017eab95dcf0d224a1948ac8e52534/si40.svg si40 si40.svg svg 805 ALTIMG 1-s2.0-S0378778821003923-si43.svg https://s3-eu-west-1.amazonaws.com/prod-ucs-content-store-eu-west/content/pii:S0378778821003923/STRIPIN/image/svg+xml/e36e5b8d0f00c99097d10fa1ec36235a/si43.svg si43 si43.svg svg 805 ALTIMG 1-s2.0-S0378778821003923-si46.svg https://s3-eu-west-1.amazonaws.com/prod-ucs-content-store-eu-west/content/pii:S0378778821003923/STRIPIN/image/svg+xml/f8f360d3864780d3dfabc91bcb7828a5/si46.svg si46 si46.svg svg 805 ALTIMG 1-s2.0-S0378778821003923-si49.svg https://s3-eu-west-1.amazonaws.com/prod-ucs-content-store-eu-west/content/pii:S0378778821003923/STRIPIN/image/svg+xml/533d2d58afb0beb884ffd6134e6720bc/si49.svg si49 si49.svg svg 805 ALTIMG 1-s2.0-S0378778821003923-si5.svg https://s3-eu-west-1.amazonaws.com/prod-ucs-content-store-eu-west/content/pii:S0378778821003923/STRIPIN/image/svg+xml/8373653ed5bddf7217ea3ee94d14a450/si5.svg si5 si5.svg svg 4055 ALTIMG 1-s2.0-S0378778821003923-si52.svg https://s3-eu-west-1.amazonaws.com/prod-ucs-content-store-eu-west/content/pii:S0378778821003923/STRIPIN/image/svg+xml/dfb322099360eb7bc97b2eba1d405c56/si52.svg si52 si52.svg svg 805 ALTIMG 1-s2.0-S0378778821003923-si55.svg https://s3-eu-west-1.amazonaws.com/prod-ucs-content-store-eu-west/content/pii:S0378778821003923/STRIPIN/image/svg+xml/0005df51bddf050610f6108366cf2725/si55.svg si55 si55.svg svg 805 ALTIMG 1-s2.0-S0378778821003923-si58.svg https://s3-eu-west-1.amazonaws.com/prod-ucs-content-store-eu-west/content/pii:S0378778821003923/STRIPIN/image/svg+xml/924247bf9f9c436a863813d524ee1f73/si58.svg si58 si58.svg svg 805 ALTIMG 1-s2.0-S0378778821003923-si6.svg https://s3-eu-west-1.amazonaws.com/prod-ucs-content-store-eu-west/content/pii:S0378778821003923/STRIPIN/image/svg+xml/4578661921558c5a6809c5674ef71ee2/si6.svg si6 si6.svg svg 4055 ALTIMG 1-s2.0-S0378778821003923-si61.svg https://s3-eu-west-1.amazonaws.com/prod-ucs-content-store-eu-west/content/pii:S0378778821003923/STRIPIN/image/svg+xml/ea5277a9b84b8b60d2622868a11fe829/si61.svg si61 si61.svg svg 805 ALTIMG 1-s2.0-S0378778821003923-si64.svg https://s3-eu-west-1.amazonaws.com/prod-ucs-content-store-eu-west/content/pii:S0378778821003923/STRIPIN/image/svg+xml/43c9aff25f66993b3ecd45a15bd0da0a/si64.svg si64 si64.svg svg 805 ALTIMG 1-s2.0-S0378778821003923-si67.svg https://s3-eu-west-1.amazonaws.com/prod-ucs-content-store-eu-west/content/pii:S0378778821003923/STRIPIN/image/svg+xml/b47dc24d3f51288698058317835f716e/si67.svg si67 si67.svg svg 805 ALTIMG 1-s2.0-S0378778821003923-si7.svg https://s3-eu-west-1.amazonaws.com/prod-ucs-content-store-eu-west/content/pii:S0378778821003923/STRIPIN/image/svg+xml/504b03ebb5bdd06bd77b08559bfb726a/si7.svg si7 si7.svg svg 4055 ALTIMG 1-s2.0-S0378778821003923-si70.svg https://s3-eu-west-1.amazonaws.com/prod-ucs-content-store-eu-west/content/pii:S0378778821003923/STRIPIN/image/svg+xml/1a65cb0ad7d6e52195321601594138eb/si70.svg si70 si70.svg svg 805 ALTIMG 1-s2.0-S0378778821003923-si73.svg https://s3-eu-west-1.amazonaws.com/prod-ucs-content-store-eu-west/content/pii:S0378778821003923/STRIPIN/image/svg+xml/42627da78cfa1101b9d3ef2b8d3c2cbd/si73.svg si73 si73.svg svg 805 ALTIMG 1-s2.0-S0378778821003923-si76.svg https://s3-eu-west-1.amazonaws.com/prod-ucs-content-store-eu-west/content/pii:S0378778821003923/STRIPIN/image/svg+xml/7f25361dc7967ec26019e60bd204817c/si76.svg si76 si76.svg svg 805 ALTIMG 1-s2.0-S0378778821003923-si79.svg https://s3-eu-west-1.amazonaws.com/prod-ucs-content-store-eu-west/content/pii:S0378778821003923/STRIPIN/image/svg+xml/e0a4b99e30000cff08c06cedac2f4b5b/si79.svg si79 si79.svg svg 805 ALTIMG 1-s2.0-S0378778821003923-si8.svg https://s3-eu-west-1.amazonaws.com/prod-ucs-content-store-eu-west/content/pii:S0378778821003923/STRIPIN/image/svg+xml/2d06b25567e48975b718e0a16000937d/si8.svg si8 si8.svg svg 8863 ALTIMG 1-s2.0-S0378778821003923-si82.svg https://s3-eu-west-1.amazonaws.com/prod-ucs-content-store-eu-west/content/pii:S0378778821003923/STRIPIN/image/svg+xml/67d19876fdc2c89323916ce39b62976c/si82.svg si82 si82.svg svg 805 ALTIMG 1-s2.0-S0378778821003923-si85.svg https://s3-eu-west-1.amazonaws.com/prod-ucs-content-store-eu-west/content/pii:S0378778821003923/STRIPIN/image/svg+xml/72908ca5104be7b0783e3732c273df4c/si85.svg si85 si85.svg svg 805 ALTIMG 1-s2.0-S0378778821003923-si88.svg https://s3-eu-west-1.amazonaws.com/prod-ucs-content-store-eu-west/content/pii:S0378778821003923/STRIPIN/image/svg+xml/2ab6ba317877c8b4975e46029c29a4b8/si88.svg si88 si88.svg svg 805 ALTIMG 1-s2.0-S0378778821003923-si9.svg https://s3-eu-west-1.amazonaws.com/prod-ucs-content-store-eu-west/content/pii:S0378778821003923/STRIPIN/image/svg+xml/049914399e958f1cb8b88547190d2e41/si9.svg si9 si9.svg svg 8059 ALTIMG 1-s2.0-S0378778821003923-si91.svg https://s3-eu-west-1.amazonaws.com/prod-ucs-content-store-eu-west/content/pii:S0378778821003923/STRIPIN/image/svg+xml/f6bcbb56d4f862a9484374940bc5f7a8/si91.svg si91 si91.svg svg 805 ALTIMG 1-s2.0-S0378778821003923-si94.svg https://s3-eu-west-1.amazonaws.com/prod-ucs-content-store-eu-west/content/pii:S0378778821003923/STRIPIN/image/svg+xml/3dacec2cf99c55ea529f58fafa0aa1ce/si94.svg si94 si94.svg svg 805 ALTIMG 1-s2.0-S0378778821003923-si97.svg https://s3-eu-west-1.amazonaws.com/prod-ucs-content-store-eu-west/content/pii:S0378778821003923/STRIPIN/image/svg+xml/a45df3188e4287e2cd03898eb0d4b39f/si97.svg si97 si97.svg svg 805 ALTIMG 1-s2.0-S0378778821003923-am.pdf am am.pdf pdf 588587 AAM-PDF https://s3-eu-west-1.amazonaws.com/prod-ucs-content-store-eu-west/content/egi:10P9GVPVSFZ/MAIN/application/pdf/dea174bdfb4ce787f922c44b4569a299/am.pdf ENB 111108 111108 S0378-7788(21)00392-3 10.1016/j.enbuild.2021.111108 The Authors Fig. 1 Scheme of the MPC framework (adapted from [13]). Fig. 2 10 temperature scenarios obtained with the method presented in Section 4. A time step corresponds one hour. The actual measured value of the temperature is shown in black color. Fig. 3 10 solar irradiance scenarios obtained with the method presented in Section 4. A time step corresponds one hour. The actual measured value of the temperature is shown in black color. Fig. 4 Contribution of the subcosts J e and J d to the total closed-loop for all the controllers considered in the case study, for each different controller and value of α . The data used for this plot is shown in Table 4. Fig. 5 Comfort bound profiles. Fig. 6 Discomfort for the different controllers as a function of α . The x-axis is in log-scale. Fig. 7 Temperature evolution during one week of a representative simulation with α = 100 and 20 scenarios for the SBMPC controllers. Fig. 8 Heating power during 1 week of a representative simulation with α = 100 and 20 scenarios for the SBMPC controllers. Fig. 9 External temperature and solar irradiance during 1 week of a representative simulation with α = 100 and 20 scenarios for the SBMPC controllers. Table 1 Coverage of the temperature and irradiance scenarios. Coverage 90% 80% Temperature 95.59% 84.71% Irradiance 85.56% 75.85% Table 2 Parameters of the building considered in Section 5. Parameter Value Definition Q \u203e max heat [W] 500000 Maximum heating power Q \u203e max cool [W] 300000 Maximum cooling power η cool 2.5 Cooling efficiency η gas 0.9 Heating efficiency c gas [\u20ac/kWh] 0.041 Gas cost c ele [\u20ac/kWh] 0.15 Electricity cost Table 3 Total closed-loop costs for all the controllers considered in the case study. α = 50 α = 100 α = 200 α = 500 PIMPC 8104 9009 10573 14676 DetMPC-Lin 11770 17773 29722 65616 DetMPC-Mod 10462 12236 15308 23961 SBMPC-Mod-10 8994 10590 14032 20603 SBMPC-Mod-20 9909 10767 13778 21247 SBMPC-Mod-30 9417 11088 13204 21466 SBMPC-Mod-40 10517 11950 14014 20888 SBMPC-Lin-10 8519 15856 19203 48135 SBMPC-Lin-20 8810 13556 22498 51368 SBMPC-Lin-30 11477 11485 23472 49714 SBMPC-Lin-40 8485 12957 30431 33807 Table 4 Contribution of the subcosts J e and α J d to the total closed-loop for all the controllers considered in the case study. The first number represents the percentage of the energy cost J e in the total cost, while the second number represents the percentage of the discomfort cost multiplied by α , i.e. α J d . This table is also depicted as a stacked bar plot in Fig. 4. α = 50 α = 100 α = 200 α = 500 PIMPC 80.9% ∣ 19.1% 74.8% ∣ 25.2% 65.7% ∣ 35.3% 49.8% ∣ 50.2% DetMPC-Lin 31.0% ∣ 69.0% 20.0% ∣ 80.0% 11.7% ∣ 88.3% 05.2% ∣ 94.8% DetMPC-Mod 66.0% ∣ 34.0% 58.1% ∣ 41.9% 47.6% ∣ 52.4% 31.1% ∣ 68.9% SBMPC-Mod-10 72.1% ∣ 27.9% 66.0% ∣ 34.0% 51.3% ∣ 48.7% 35.5% ∣ 64.5% SBMPC-Mod-20 70.2% ∣ 29.8% 66.1% ∣ 33.9% 52.4% ∣ 47.6% 34.5% ∣ 65.5% SBMPC-Mod-30 71.2% ∣ 28.8% 62.7% ∣ 37.3% 53.9% ∣ 46.1% 34.7% ∣ 65.3% SBMPC-Mod-40 66.5% ∣ 33.5% 59.9% ∣ 40.1% 51.4% ∣ 48.6% 36.6% ∣ 63.4% SBMPC-Lin-10 36.4% ∣ 63.6% 22.3% ∣ 77.7% 15.2% ∣ 84.8% 06.8% ∣ 93.2% SBMPC-Lin-20 36.1% ∣ 63.9% 23.6% ∣ 76.4% 14.0% ∣ 86.0% 06.6% ∣ 93.4% SBMPC-Lin-30 31.9% ∣ 68.1% 26.0% ∣ 74.0% 13.9% ∣ 86.1% 06.7% ∣ 93.3% SBMPC-Lin-40 31.4% ∣ 68.6% 23.7% ∣ 76.3% 10.6% ∣ 89.4% 08.3% ∣ 91.7% Table 5 Total amount of discomfort measured in Kh . α = 50 α = 100 α = 200 α = 500 PIMPC 49.2 36.7 29.6 25.4 DetMPC-Lin 156.8 146.4 140.5 137.2 DetMPC-Mod 93.3 74.9 62.7 53.7 SBMPC-Mod-10 69.0 58.0 51.6 41.9 SBMPC-Mod-20 79.7 53.2 49.4 43.5 SBMPC-Mod-30 71.7 60.8 50.0 42.4 SBMPC-Mod-40 90.8 67.2 50.6 41.7 SBMPC-Lin-10 115.6 129.9 90.9 105.9 SBMPC-Lin-20 100.8 114.7 103.3 112.9 SBMPC-Lin-30 147.7 98.8 115.3 111.6 SBMPC-Lin-40 124.2 105.2 113.7 83.4 Scenario-based nonlinear model predictive control for building heating systems Tomas Pippia a \u204e 1 Jesus Lago a b 1 Roel De Coninck c Bart De Schutter a a Delft Center for Systems and Control, Delft University of Technology, Mekelweg 2, Delft, The Netherlands Delft Center for Systems and Control Delft University of Technology Mekelweg 2 Delft The Netherlands Delft Center for Systems and Control, Delft University of Technology, Mekelweg 2, Delft, The Netherlands b Algorithms, Modeling, and Optimization, VITO, Energyville, ThorPark, Genk, Belgium Algorithms, Modeling, and Optimization VITO, Energyville, ThorPark Genk Belgium Algorithms, Modeling, and Optimization, VITO, Energyville, ThorPark, Genk, Belgium c DeltaQ, Quai á la Chaux 6, Brussels, Belgium DeltaQ Quai á la Chaux 6 Brussels Belgium DeltaQ, Quai á la Chaux 6, Brussels, Belgium \u204e Corresponding author. 1 These authors contributed equally to this work State-of-the-art Model Predictive Control (MPC) applications for building heating adopt either a deterministic controller together with a nonlinear model or a linearized model with a stochastic MPC controller. However, deterministic MPC only considers one single realization of the disturbances and its performance strongly depends on the quality of the forecast of the disturbances, which can lead to low performance. In fact, inadequate building energy management can lead to high energy costs and CO2 emissions. On the other hand, a linearized model can fail to capture some dynamics and behavior of the building under control. In this article, we combine a stochastic scenario-based MPC (SBMPC) controller together with a nonlinear Modelica model that is able to provide a richer building description and to capture the dynamics of the building more accurately than linear models. The adopted SBMPC controller considers multiple realizations of the external disturbances obtained through a statistically accurate model, so as to consider different possible disturbance evolutions and to robustify the control action. To this purpose, we present a scenario generation method for building temperature control that can be applied to several exogenous perturbartions, e.g.solar irradiance, outside temperature, and that satisfies several important stastistical properties, in contrast with simpler and less accurate methods adopted in the literature. We show the benefits of our proposed approach through several simulations in which we compare our method against the standard ones from the literature, for several combinations of a trade-off parameter between comfort and energy cost. We show how our SBMPC controller approach outperforms the standard controllers available in the literature. Keywords Scenario-based model predictive control Control of buildings Model predictive control Modelica 1 Introduction Energy consumed in buildings for heating, ventilation, and air-conditioning (HVAC) purposes accounts for around half of total energy used in buildings [1\u20135]. For companies, especially if they are located in large buildings, it is therefore very important to limit the amount of energy wasted due to bad temperature control. Furthermore, it is also important to reduce as much as possible the energy waste in order to decrease emissions due to e.g.natural gas boilers [6]. Moreover, buildings have comfort temperature bounds that have to be respected during working hours, with few violations allowed [7]. The comfort violations should be limited while at the same time the energy cost has to be minimized. Simple solutions where heaters always run at maximum power are not acceptable due to the large costs and energy waste. On top of that, buildings are subject to many exogenous disturbances, e.g.outside temperature, solar irradiance, and endogenous ones, e.g.occupancy. The profile of these disturbances, if not properly considered when determining the control actions, can lead to poor performance, both in terms of energy cost and discomfort. Moreover, the model of the building considered, due to approximations, may lead to further errors. However, a too complex model is also not useful for control purposes due to the high computational burden that it entails. Therefore, the problem of controlling the room temperature in large buildings is a complex task. 1.1 Literature review In this section, we perform a brief literature review of the two main topics of this research: control for buildings and scenario generation. 1.1.1 Modeling and control strategies for buildings Many solutions have been proposed in the literature to control the room temperature in buildings using information available on the current temperature and forecasts of the disturbances. A simple solution involves a rule-based approach that is based on if-then-else rules and information about the current disturbances [8]. Although these controllers are simple to implement and may achieve a reasonable performance, they are not very efficient since they are based on user knowledge and rules-of-thumb and they do not actually perform an optimization. Model predictive control (MPC) [9\u201312] is a more advanced control strategy that is suitable for the room temperature control problem, since it can naturally include constraints in the control problem and since it can in general achieve a better performance [13\u201315]. Moreover, a building is subject to several disturbances, as mentioned before, and MPC can deal well with disturbances by using a robust or stochastic controller [11], which can achieve better performance than the deterministic counterpart. However, despite having a better constraint satisfaction, a robust MPC controller for buildings, e.g. [16], could be too conservative for the task of controlling the temperature of a room and it would result in a high amount of energy used as it would try to compensate every possible disturbance realization. Therefore, usually a stochastic MPC controller is preferred for building heating systems [12,17]. Indeed, by considering the stochastic properties of the disturbance or by considering several disturbance scenarios, stochastic MPC controllers can potentially achieve a better control performance compared to deterministic controllers, leading therefore to a reduced energy consumption while limiting the discomfort. In particular, scenario-based MPC (SBMPC) methods stand out as a useful tool in building heating systems, since they can use past data of the disturbances, which are available in the case of building heating systems, and they can successfully be applied to nonlinear models as well [12]. In this regard, several types of MPC algorithms have been applied to HVAC systems in the literature [13\u201315, 17\u201329]; see also [30,31] and the references therein. In particular, [15] presents two stochastic MPC algorithms, i.e.a disturbance-feedback approach and a chance-constraint one. The results show that the stochastic controllers achieve a better performance than deterministic MPC and rule-based control. Authors of [17] develop an SBMPC controller that uses previous data of building occupancy and external ambient conditions forecast errors to solve a scenario-based optimal control problem. The scenarios are built through copulas that can be learned online and the method is applied to a room in a university building. The results show that the proposed controller is able to achieve a good performance in terms of energy cost, while having a larger computational complexity than standard deterministic methods. However, the method is applied to a single room and the authors of [17] suggest that a study needs to be carried out to asses whether the method can be applied to a larger building. A similar approach is presented in [18], where the main differences are that 1) slack variables are introduced in the cost function to improve the feasibility of the optimization problem obtained and 2) that different copula families are tested and compared (see also Section 1.1.2). In both papers, the authors do not rely on Gaussian assumptions for what concerns the properties of the disturbances. Given that the two previous methods might result in a large computational complexity, the authors of [19] extend the concept to an explicit SBMPC controller, such that the control inputs are computed offline and applied online. Experiments were performed once again for a single university room, showing better performance with respect to the standard methods. In order to deal with a multi-room setting, a distributed MPC controller is presented in [20], where a Lagrangian dual decomposition relaxation method is used to reduce the computational burden arising from the several rooms considered. Simulation results obtained considering a network of 10 rooms show an increased performance with respect to a baseline PID controller. In all these articles it is shown how stochastic MPC strategies can achieve a better performance than deterministic MPC. The article [21] presents an MPC algorithm in which a linear model is used to control a building including an active cold thermal storage in order to implement a demand response program. All these works, i.e. [15,17\u201321], use a linearized model description and do not use a nonlinear model nor other more advanced modeling tools, e.g.Modelica [32,33], possibly leading to a decrease in the performance. Such tools and nonlinear models for building heating control usually include more features and components compared to a linear model and thus they can potentially provide a more accurate description of the building and of the influence of each disturbance, reducing therefore the modeling error and improving the overall performance. The article [22] adopts a nonlinear model arising from the heat pump and a battery inverter considered, but the considered MPC controller is a deterministic one. For what concerns nonlinear and more advanced models, while some works did consider their usage for HVAC systems, e.g. [13,14,23,24], all of them considered a deterministic setting instead of a stochastic one. To the best of our knowledge, no work has considered a nonlinear model description obtained through Modelica together with a stochastic controller, which would improve the performance by taking into account a more accurate model and the stochastic properties of the disturbances. 1.1.2 Scenario generation Besides improving the state-of-the-art by proposing a control approach for more realistic models, i.e.nonlinear Modelica models, our work also contributes to the existing literature of scenario generation for buildings by improving upon the current state-of-the-art. In particular, scenarios of random variables that represent a time series, e.g.the ambient temperature for the next 24 h with an hourly resolution, need to satisfy several important properties: 1. They should not be restricted to the standard assumption of Gaussian disturbances/forecasting errors as this assumption is quite restrictive when it comes to generating scenarios of heteroscedastic 2 2 A time series variable is heteroscedastic if the variance changes throughout time. processes, e.g.solar irradiance [19]. 2. They need to consider the multivariate distribution of the random variables: if the scenarios represent a random variable at different time steps in the future, these scenarios should model the time correlation of the random variable [34]. 3. Besides modeling the time correlation, they should explicitly take into account the different time dependencies and avoid modeling a stationary distribution; i.e.the distribution of the random variable might be different at different hours of the day/times of the year or might change with the prediction horizon. 4. The methods to generate scenarios should be flexible enough to explicitly model the dependencies of the random variables on exogenous variables. 5. The computational burden of the scenario generation method should be small enough for online implementation. In the context of building heating, while some scenario generation methods have been considered [15, 17\u201320, 25,35\u201340], they have several problems. In particular, some of the existing methods [35,36,15] rely on the standard Gaussian assumptions [19]. In addition, although several works have addressed the Gaussian assumption [17\u201320, 25,37, 39, 40], they still lack some of the required properties. More specifically, in [17], a method based on empirical copulas is proposed. While the method satisfies some properties, e.g.time correlation, it fails to satisfy the following two: 1) it does not model time dependencies but it assumes that the marginal distributions are stationary, i.e.it assumes that the n-hours ahead distribution of a variable is the same at any hour of the day, any day of the year; 2) the scenarios are generated based on historical data without considering other possible exogenous inputs. The analytical copula method proposed in [20] overcomes some of these issues as it explicitly models the time dependency during a day. However, the distributions are still stationary, i.e.they vary within a day but they do not change along a year, and they are just based on historical data. In [18,19], a more general approach is proposed where different copula families are tested, and the best one is selected to generate scenarios. While the method is very general and flexible, it requires to compare different copula functions and can easily become computationally infeasible for online MPC. In addition, the method has two other problems: the best copula is selected by comparison with the empirical copula of [17], hence it has the same problems as [17]; moreover, the time dependencies considered by the copulas are not specified. In [37], scenarios from a weather meteorological model are employed. Even though the goal of weather models is to provide an ensemble of scenarios, to capture the uncertainty in the prediction, the method displays systematic errors, e.g.biases, and requires the application of advanced post-processing techniques based on copulas, e.g.ensemble copula coupling [41]. In [25], a method based on sampling historical forecasting errors is considered. Despite the method attempts to capture time correlation using an auto-regressive error model, that model is only used for error correction. In particular, to generate scenarios, the method samples from past historical errors and fails to satisfy Properties 2\u20134. The recursive feasibility and stability of SBMPC is studied in [39]. To do so, it is assumed that disturbances can be represented by a scenario tree, and that the tree can be built using empirical samples from a discrete set of disturbances. This approach is clearly very limited as, it does not satisfy Properties 2\u20134, and in addition it could have scalability and computational issues when the number of random variables increases. In [40], scenarios are used for modeling electricity prices and independent optimization problems are solved for each scenario; however, the method cannot be used to model uncertainty in other variables, e.g.weather variables, and fails to satisfy Properties 2\u20134. In [38], two Poisson distributions are employed to model the occupancy in the building as a birth\u2013death process. While such a parametric distribution might work well for occupancy, it has the same issue as the Gaussian assumption: the method cannot be generalized to other random variables. 1.2 Motivation and contributions of the paper In this article, we focus on a scenario-based MPC (SBMPC) algorithm that includes both a nonlinear system description through Modelica, while using a scenario generation method based on probability distributions obtained empirically, making it a very suitable tool for a building heating control problem. The Modelica model description can lead to an improvement of the model accuracy; note that in the current literature of SBMPC for heating systems in buildings, a linearized model is always used. On top of that, by using a nonlinear Modelica model, we implement for the first time an SBMPC controller for HVAC systems in buildings that uses a nonlinear Modelica model description. In addition, we present a parametric Gaussian copula method to generate scenarios that it can satisfy the five required properties, whereas the methods used in the literature of HVAC systems for scenario generation suffer from some statistical problems, as mentioned earlier. We perform several simulations showing the benefits of the presented approach. Our contribution is therefore threefold: \u2022 We propose a control method for a building heating systems that considers a Modelica nonlinear model and an SBMPC controller. \u2022 We generate scenarios using a new approach that, unlike the existing methods, satisfies all the important properties of scenario generation methods for time series data. \u2022 We perform a comparison between several combinations of the couple model-controller: as models, we consider a Modelica and linear and as controller we consider a deterministic MPC and SBMPC. 1.3 Outline The outline of the article is as follows. In Section 2, we describe the problem under consideration. We present the control algorithms used throughout the article in Section 3. In Section 4, the adopted scenario generation method is presented. We present the simulation results on a case study in Section 5 and lastly we present some conclusions and suggestions for future work in Section 6. 2 Model description 2.1 Buildings In this paper, we focus our attention on buildings with local heat production units. The type of building considered can be controlled via two control inputs, i.e. u = q heat q cool ⊤ , where q heat is the amount of heating power transferred to the building and q cool is the cooling power provided to the building. We assume that the building can be modeled using an RC-model with two states [13]: T zone as the average temperature of the rooms and T wall as the average temperature of the walls. In addition, it is assumed that the building is affected by three disturbances: solar irradiance I, outdoor temperature T amb , and building occupancy θ occ . While past measurements of external disturbances, e.g.solar irradiance and outdoor temperature, are available, we do not have any measurement of the occupancy of the building. Note that, although this is an important disturbance to consider, it is also difficult to measure in practice [42,43]. Therefore, to estimate the models and to perform simulations, we assume that the occupancy profile is fixed for every day of the week, i.e.we assume that the building is fully occupied during working hours and empty outside of these hours. 2.2 Modelica We have modeled the buildings, comprising also the heating, cooling, and ventilation units, with Modelica [32,33], which is an object-oriented and equation-oriented language that is designed to model the behavior of physical systems. In particular, the building is modeled based on an RC-model, which has been identified through the Grey-Box Buildings toolbox [44]. The building has also been extensively validated using data collected from the building as in [44,13]. Such data has been gathered between 2016 and 2018 and includes e.g.internal temperature, domestic hot water usage, external temperature, and solar irradiance. The adoption of Modelica in our work provides the benefit that we can improve the amount of detail and accuracy of the model w.r.t.linear models. Note that e.g. some of the HVAC components modeled in Modelica result in nonlinear model components. Therefore, although many other works, e.g. [15,17\u201320], use indeed a linearization of a nonlinear model, in this work we directly use a nonlinear model and we obtain therefore a more meaningful representation of the real building. Readers interested in the modeling procedure of buildings in a Modelica environment are referred to [13,44]. Note that other high-fidelity simulation tools exist for buildings, e.g.TRNSYS, EnergyPlus, ESP-r, IDA ICE; see [45,46] for a complete review. However, compared to Modelica, these software tools lack in modularity and flexibility for prototyping and simulating new technologies [47]. Moreover, in our particular setting, we have data available from the buildings to be controlled that allows us to estimate the parameters of the building. However, the data is not comprehensive enough for satisfactory white-box modeling. Therefore, as highlighted in [44], we adopt a grey-box model due to necessity of estimating certain parameters of the model of the building that are not known a priori. Whereas in the aforementioned white-box modeling tools it could in theory be possible to calibrate the parameters of the model, the lack of a more detailed physical knowledge of the building makes the choice of a white-box model, for our specific setting, less desirable. Lastly, note that Modelica is an open-source tool, making it particularly appealing for commercial applications. For more advantages of using Modelica for HVAC systems we refer to [48]. Remark 1 Note that, as mentioned in [44], the actual difference between white-box and grey-box models does not depend on the complexity of the model. For instance, even a single-state model can be a white-box model if all its parameters can be determined based solely on physical knowledge. However, a white-box model becomes grey when one or more of its parameters are estimated based on a fitting of the model to measurement data, irrespectively of the complexity of the white-box model. Remark 2 The model of the building used in this paper has been extensively validated following the exact same procedure reported in [44]. Therefore, the validation process is omitted here as it is already explained in the aforementioned paper. Multiple-years data has been used to identify and validate the model. The interested readers might find the whole identification and validation procedure in [44,13]. 2.3 Model predictive control MPC is a control tool that has been extensively studied in the last forty years [10,9,11]. The main strength of MPC is to use a model of the system under control to find optimal inputs for that system with respect to a certain objective, which can be either stabilizing the system or minimizing an economical goal. Since in the MPC framework the problem of finding the optimal inputs for the system is an optimization problem, constraints can easily be included, as well as several performance criteria. Compared to simpler strategies e.g.rule-based control, MPC requires a larger computational effort and requires to solve an optimization problem online but it can provide an increase in performance. Due to its versatility and good performance achieved, MPC has been applied to various systems and fields, e.g.power systems [49,50], traffic networks [51], water networks [52], aerospace [53], among others. For a survey that includes also MPC applications for large-scale and industrial systems, we refer the reader to [54]. In recent years, several MPC strategies have been developed to cope with external disturbances, in particular, robust and stochastic MPC strategies. In this paper we focus on an SBMPC algorithm, which is presented in Section 3.2. 2.4 Control loop and practical implementation Many operations have to be carried out on the real building by the building energy management system; the overall control scheme is presented in Fig. 1 . The operations are [13]: 1. Monitoring: some measurements, e.g.water temperature, heat flux, are performed by the building energy control and management system. 2. Forecasting: weather forecasts are obtained as will be explained in Section 4. 3. State estimation: some states, e.g.internal wall temperatures, cannot be measured and therefore they have to be estimated. 4. Optimization of the control inputs: an optimization problem, explained in Section 3, is solved at every time step with a sampling time of 1 h . Only the first inputs of the optimal sequence are applied to the system. The real building is therefore controlled by all these steps, carried out in sequence. The optimization problem discussed in step 4 above is solved through JModelica.org [55]. The direct collocation method is used to discretize time so that the optimization problem is reduced to a nonlinear programming problem [56]. CasADi [57] is used to obtain the first-order and second-order derivatives of the expressions in the nonlinear programming problem with respect to the decision variables, which are required by the solvers used by JModelica.org. We use IPOPT [58] to solve the nonlinear programming problem, together with the sparse linear solver MA57 [59]. Remark 3 Note that in this section we consider simulations instead of experiments in the real building. This implies a small difference w.r.t. Fig. 1: instead of applying the inputs to the real building, we simulate its behavior through Modelica for one time step. In other words, the loop is \u201cclosed\u201d by applying the optimal inputs to a model of the building rather than to the building itself, using the actual values of the disturbances instead of the forecasts. The model used for simulating the building behavior is the same Modelica model used for the optimal control problem in the MPC framework. 2.5 Linear model estimation To compare the nonlinear MPC controller with the standard linear counterpart, a linear model of the building is needed. To obtain such a model, data from the building is considered and a linear model is estimated using linear least squares. In detail, considering the same inputs, state space, and disturbances as for the nonlinear model (see Section 2.1), we can assume that the building dynamics are of the form: (1) T k + 1 zon T k + 1 wall = A T k zon T k wall + B 1 q k heat q k cool + B 2 T k amb I k θ k occ . Then, using the same data as those used for estimating the Modelica nonlinear model, we solve a linear least square problem and estimate the values of the matrices A , B 1 , and B 2 , using the mean absolute error as key performance indicator. Remark 4 In this article, as highlighted in Remark 3, we use the nonlinear Modelica model to compute the next state for the closed-loop simulations. This can introduce some bias when comparing the performance of the controllers that use the linear model with respect to the ones that use the Modelica model, since there would be no model mismatch in the latter case. Nevertheless, we present here also a linearized model as a reference, to show how such model would behave in the considered scenario. Remark 5 Related to the previous remark, note also that this kind of nonlinear Modelica model has been already applied to a building heating system in [13]. Indeed, in that reference the same modeling procedure was applied to a similar building and experimental results were carried out. No large mismatch between the Modelica nonlinear model and the actual physical building nor other fundamental flaws were noticed. Therefore, we can argue that the nonlinear Modelica model is a very good approximation of the real building and can therefore be used in the closed-loop simulations to simulate the evolution of the system. 3 Control algorithms and models In this section we present the two considered control algorithms, i.e.MPC and SBMPC. 3.1 Deterministic MPC In Deterministic MPC, the external disturbances, e.g.temperature or solar irradiance, are predicted with a point forecasting technique and in which the predictions are then assumed to represent the expected value. In this context, at each time step, the MPC optimization problem is solved, yielding an optimal control input sequence u ∗ . Then the first element of the sequence is applied, the horizon is moved one time step forward, the system is sampled, and the optimization problem is solved again. Given the task of controlling the room temperature in a building while minimizing both the energy costs and the discomfort, the optimization problem solved at each time step by a deterministic MPC controller is given by: (2a) minimize T 1 , q 1 \u2026 , q N , T N + 1 ∑ k = 1 N α J k d + J k e + α J N + 1 d (2b) subject to T 1 = T \u203e 1 (2c) T k + 1 = f ( T k , q k , d k ) , for k = 1 , \u2026 , N (2d) 0 ⩽ q k heat ⩽ Q \u203e max heat , for k = 1 , \u2026 , N (2e) 0 ⩽ q k cool ⩽ Q \u203e max cool , for k = 1 , \u2026 , N where: \u2022 N is the prediction horizon. \u2022 The system state is defined by T k = [ T k zon , T k wall ] , with T k zon and T k wall as the room and wall temperatures. \u2022 T \u203e 1 is the current temperature. \u2022 The input control is defined by q k = [ q k heat , q k cool ] , with q k heat and q k cool as the input heating/cooling power. \u2022 The cost function represents the weighted average between the energy cost J k e and the discomfort cost J k d : (3) J k d = max ( T k zon - T k max , 0 ) + min ( T k zon - T k min , 0 ) 2 , (4) J k e = c k gas q k heat η k gas + c k ele q k cool η cool , and α is the weighting parameter that defines the relative importance of each cost. \u2022 The building dynamics are defined by (2c), where f ( · ) represents the Modelica model of the building. \u2022 The building is disturbed by some uncontrollable inputs d k = [ T k amb , I k , θ k occ ] , with T k amb the ambient temperature, I k the solar irradiance, and θ k occ the building occupancy. \u2022 The upper and lower comfort temperature bounds are respectively defined by T k max and T k min , and they vary in time depending on the hour of the day and day of the week. \u2022 Q \u203e max heat , Q \u203e max cool , η cool , η gas , c gas , and c ele are constant parameters and are, respectively, the maximum heating power, the maximum cooling power, the cooling efficiency, the heating efficiency, the gas cost, and the electricity cost. It is important to note that the role of the discomfort cost J d is to act as a soft constraint so that it penalizes the deviations of the temperature outside the comfort bounds, but remains 0 if the temperature is inside the bounds. The controller can therefore choose to implement a control action that leads to a violation of the comfort bounds if this can lead to a lower total cost. Lastly, note that in (2a) the final cost is related only to the states. This is standard in the MPC framework (see e.g. [11], Eq. 2.3), since the inputs are applied from k + 1 until k + N , thus the evolution of the system is considered from k + 2 until k + N + 1 . Therefore, there is no input cost considered for time-step k + N + 1 , but there is a state cost that is the one we obtain by applying the inputs at k + N . 3.2 Scenario-based MPC It is possible to improve the performance of the deterministic MPC of the previous subsection by considering several scenarios of the disturbances acting into the system. This approach, known as scenario-based MPC (SBMPC), considers multiple realizations/scenarios for the disturbances, different system states for each scenario, and a cost function that consists of the average of the original cost functions across all scenarios. For the control inputs, two possibilities exist: different control inputs for each scenario (as with the system state) and shared control inputs across all scenarios. While the former has the advantage of being less conservative, the latter is more computational friendly. For the case of building control, we consider shared control inputs across all scenarios as this reduces the computational complexity. Defining M different scenarios for the disturbances. i.e. d = { { d k , i } i = 1 M } k = 1 N , the SBMPC optimization problem solved at each time step can be defined as: (5a) minimize T 1 , q 1 \u2026 , q N , T N + 1 ∑ i = 1 M ∑ k = 1 N α J k , i d + J k , i e + α J N + 1 , i d (5b) subject to T 1 , i = T \u203e 1 for i = 1 , \u2026 , M (5c) T k + 1 , i = f ( T k , i , q k , d k , i ) , for i = 1 , \u2026 , M for k = 1 , \u2026 , N (5d) 0 ⩽ q k heat ⩽ Q \u203e max heat , for k = 1 , \u2026 , N (5e) 0 ⩽ q k cool ⩽ Q \u203e max cool , for k = 1 , \u2026 , N where: \u2022 T k = [ T k , 1 zon , T k , 1 wall , \u2026 , T k , M zon , T k , M wall ] represents the state at time step k for each of the M scenarios. \u2022 d k , i = [ T k , i amb , I k , i , θ k , i occ ] , represents the i th disturbance scenario at time step k. \u2022 The cost function is the average across all scenarios of the weighted average between the energy cost J k e and the discomfort cost J k d of each specific scenario. \u2022 The input control q k = [ q k heat , q k cool ] remains equal across all scenarios. \u2022 The building dynamics are represented independently for each scenario by (5c). \u2022 The constant parameters are the same as for deterministic MPC. Remark 6 Note that other stochastic formulations exist that can provide guarantees on the feasibility of the obtained solution, e.g. [19]. In this paper, we adopt the scenario-based formulation (also referred to as multi-scenario formulation) as in e.g.[60\u201363]. The implementation of other stochastic methods will be investigated as future work. 3.3 Linear MPC We will compare the SBMPC approach against two linear MPC approaches: deterministic linear MPC and linear SBMPC. In both cases, the optimization problems solved at each time step are the same as the ones defined by (2b) and (5a) but with a minor modification. Instead of using the nonlinear dynamics (2c) and (5c), the dynamics are given by the linear model defined in (1). In particular, for linear deterministic MPC, constraint (2c) is replaced by: (5f) T k + 1 = A T k + B 1 q k + B 2 d k , for k = 1 , \u2026 , N . Similarly, for linear SBMPC, constraint (5c) is replaced by: (5g) T k + 1 , i = A T k , i + B 1 q k + B 2 d k , i , for i = 1 , \u2026 , M for k = 1 , \u2026 , N . 4 Scenario generation method In this section, we describe the scenario generation method for modeling the uncertainty in the system disturbances. 4.1 Introduction Let us define a random variable X representing some time series process, e.g.external temperature, and the related multidimensional random variable X representing the distribution of X in a time grid of N time steps, i.e. X = [ X 1 , \u2026 , X N ] ⊤ . To generate scenarios, we will build the multivariate distribution of X , i.e. F ( X ) , so that by sampling from F ( X ) we can obtain M scenarios of X , i.e. x 1 , \u2026 , x M . When building F ( X ) , in order to satisfy the desired properties of scenario generation methods (see Section 1.1.2), several requirements need to be satisfied: \u2022 F ( X ) should not be substituted by the N marginal distributions F ( X 1 ) , \u2026 , F ( X N ) . In particular, F ( X i ) only represents the distribution of X at time step i but does not consider the correlation between X 1 , \u2026 , X N . \u2022 F ( X ) should not be built as a stationary distribution. Instead, the distribution should consider the properties of the underlying random variable X . For example, in the case of temperature or solar irradiance, it is clear that F ( X ) should vary with the day of the year d as well as the hour of the day h, i.e. F ( X ) ≔ g ( X , d , h ) . \u2022 The distribution F ( X ) should include any external dependency of X . For instance, if X represents the ambient temperature, F ( X ) needs to explicitly include the dependency w.r.t.factors like the solar irradiance I, i.e. F ( X ) ≔ g ( X , I ) . 4.2 Scenario generation method The proposed method consists of four steps: 1. generation of a deterministic forecast x ¯ of the random variable X . 2. Generation of the marginal probability distribution F ( X 1 ) , \u2026 , F ( X N ) along the horizon N. 3. Generation of the distribution F ( X ) using a parametric copula and the marginal distributions F ( X 1 ) , \u2026 , F ( X N ) . 4. Sampling of scenarios using F ( X ) . In this section, we explain the four steps in detail. 4.2.1 Deterministic forecast To build a deterministic/point forecast of the variable of interest we employ state-of-the-art methods for each variable of interest: \u2022 For the solar irradiance, we consider two forecasting models: the deep neural network proposed in [64] for the short-term predictions (anything below 6 h), and the ECMWF weather forecast [65] for long-term predictions (anything beyond 6 h). This distinction is made because, in the context of solar irradiance forecasting, machine learning techniques perform better for the short-term horizons, while numerical weather forecasts are more accurate for long-term horizons [64] (see also Remark 7). For what concerns the long-term prediction forecasts, note that weather-based models are highly complex models based on weather patterns; for practical applications, these forecasts are not produced by researcher but rather purchased from three main providers of weather forecasts worldwide and for our study we purchased them from ECMWF [65]. \u2022 For the ambient temperature, considering the recent success of deep learning methods for forecasting energy-related variables [66\u201372], we develop a deep neural network that uses as inputs the past values of the ambient temperature (hourly values over the last three days), the ECMWF weather forecast of the solar irradiance on hourly resolution over the forecasting horizon, and the hour of the day and day of the year when the prediction is made. For the deep neural network, we consider a two\u2013hidden layer architecture whose parameters are optimized using hyperopt [66], a Bayesian optimization algorithm. We optimize the number of neurons per layer and the activation function. As a result of the optimization we considered a deep neural network with 240 (first hidden layer) and 135 (second hidden layer) neurons. The network uses the rectifier linear unit as activation function and is optimized using the Adam [67] optimizer with early stopping. It is important to note that the other steps to generate scenarios are independent of the method employed to generate the deterministic forecast. As such, while we advocate for the use of state-of-the-art methods to obtain the most accurate scenarios, the proposed methodology would work as well with any deterministic forecast. Remark 7 The splits between horizon regarding the forecast of the irradiance are a well studied problem in the literature (see e.g. [68,64]). Note that the exact split (4, 5, 6 h) might be specific to the location. 4.2.2 Marginal distributions To generate the marginal distributions, considering its simplicity yet high accuracy, we employ the method of empirical quantiles [69]. In detail, to generate the marginal distribution F ( X ) of a variable X, the simplest version of this method consists of four steps: 1. Consider deterministic forecasts of the variable in the past, e.g. x ¯ 1 , \u2026 , x ¯ n . 2. Compute the associated historical forecasting errors of the deterministic forecast, e.g. ∊ ¯ 1 , \u2026 , ∊ ¯ n . 3. Compute the empirical quantiles of the errors and its associated empirical distribution F ( ∊ ) . 4. Model the marginal distributions as the point forecast plus the marginal distribution of the errors: (5h) F ( X ) = x ¯ + F ( ∊ ) . For the proposed approach, the method is modified in order to model non-stationary marginal distributions. In particular, defining X k , h , d as the random variable representing the value of X at time h of day d that is predicted k time steps ahead, the proposed approach estimates each distribution F ( X k , h , d ) independently. To do so, the distributions of the errors ∊ k , h , d are independently considered for each time step k, time h, and day d, and the distribution F ( X k , h , d ) is estimated accordingly: (5i) F ( X k , h , d ) = x ¯ k , h , d + F ( ∊ k , h , d ) . In addition, the following two considerations are made: \u2022 To obtain non-stationary marginal distributions that explicitly model the variability of the distribution along a year, F ( ∊ k , h , d ) is estimated using the historical errors of the last 60 days. \u2022 To explicitly model the variability of the distribution with the time step and time of the day, F ( ∊ k , h , d ) is estimated using past errors of the deterministic forecasts made for the same time step k and time of the day h. Particularly, F ( ∊ k , h , d ) is estimated using the historical errors ∊ ¯ k , h , d - 1 , ∊ ¯ k , h , d - 2 , \u2026 , ∊ ¯ k , h , d - n . 4.2.3 Scenario generation To generate scenarios, we consider the marginal distributions estimated in the previous step, a Gaussian copula function [70], and Sklar\u2019s Theorem [71,72]. In detail, let us define an N-dimensional random variable X = [ X 1 , \u2026 , X N ] ⊤ , its associated marginal distributions by F 1 ( X 1 ) , \u2026 , F N ( X N ) , and the multivariate cumulative distribution by F ( X 1 , \u2026 , X N ) . If the marginals are continuous, Sklar\u2019s theorem states that there is a copula function C : [ 0 , 1 ] N → [ 0 , 1 ] such that: (5j) F ( X 1 , \u2026 , X N ) = C F 1 ( X 1 ) , \u2026 , F N ( X N ) . In other words, assuming that the copula function is known, the multivariate cumulative distribution can be easily obtained if the marginal distributions are known. Using this theorem, to generate scenarios, we employ one of the copulas functions that requires fewer computational time: the Gaussian copula. This selection is done for three reasons: i) the method to generate scenarios should be fast for real time implementation; ii) empirically, we observed the Gaussian copula to be a good fit for the disturbances considered, i.e.ambient temperature and irradiance; iii) the Gaussian copula is a well established method that has been used to generate scenarios for different energy-based applications [70,73]. For the sake of simplicity, we refer to [70] for details on the estimation of the Gaussian copula. Here, we simply outline the main idea of the method, which relies on two random variables transformations: 1. Given a marginal distribution F i ( X i ) of a random variable X i , we can define a new random variable Y i = F i ( X i ) . Due to the properties of F i ( X i ) , it can be easily shown that Y i ~ U [ 0 , 1 ] , i.e.the new random variable follows an uniform distribution. 2. Given a random variable Y i ~ U [ 0 , 1 ] , we can obtain a random variable Z i = Φ ( Y i ) ~ N ( 0 , 1 ) that is normally distributed, where Φ is the probit function. Then, to generate M scenarios of X at time step k, i.e. { x ¯ k j = [ x ¯ k , 1 j , \u2026 , x ¯ k , N j ] ⊤ } j = 1 M , the method consist of 5 steps: 1. Consider historical realizations x k - 1 , \u2026 , x k - n of X . 2. Use the marginal distributions F 1 ( X 1 ) , \u2026 , F N ( X N ) to map each historical sample x i = [ x i , 1 , \u2026 , x i , N ] ⊤ to a transformed sample z i = [ z i , 1 , \u2026 , z i , N ] ⊤ , where Z i , j ~ N ( 0 , 1 ) . 3. Compute the covariance matrix Σ of the historical transformed samples z k - 1 , \u2026 , z k - n . 4. Draw M samples z ¯ 1 , \u2026 , z ¯ M from the normal distribution N ( 0 , Σ ) . 5. Use the inverse of the two transformations applied in the previous steps to map the samples z ¯ 1 , \u2026 , z ¯ M to a set of samples x ¯ 1 , \u2026 , x ¯ M . The samples x ¯ 1 , \u2026 , x ¯ M represent the M required scenarios { x ¯ k j = [ x ¯ k , 1 j , \u2026 , x ¯ k , N j ] ⊤ } j = 1 M . In particular, they follow the original marginal distributions F 1 ( X 1 ) , \u2026 , F N ( X N ) and they model the inter-correlation in X = [ X 1 , \u2026 , X N ] ⊤ . As it was done for the marginal distributions, the Gaussian copula method is modified in order to model non-stationary distributions. In particular, defining X k , h , d as the random variable representing the value of X at time h of day d and predicted with a time step k, the proposed approach estimates the copula function with the two following modifications: \u2022 To have non-stationary distributions that explicitly model the variability of the distribution along a year, the copula function is estimated using the historical data of the last 60 days. \u2022 To explicitly model the variability of the distribution with the time step and time of the day, the copulas are estimated using marginal distributions F ( ∊ k , h , d ) that explicitly model the distribution of X as a function of the time step ahead k, time of the day h, and day of the year d. We show 10 temperature scenarios and 10 solar irradiance scenarios in Figs. 2 and 3 , respectively. To evaluate the marginal distributions, we compute their 90% and 80% coverage. That is, we compute the percentage of historical elements that do indeed fall in the interval [5%, 95%] and [10%, 90%]. As can be seen from Table 1 , the coverage of the distributions is acceptable. As could be expected, the distribution of the irradiance is more far off, but overall the coverage is within expected errors. Remark 8 Let us explain here how we capture the correlation between the different variables. Since we generate scenarios using copula functions and given a set of individual variables with their marginal distribution, we can use a copula function to represent the full distribution of all the variables. For that, we use the individual marginal distributions and some map/inference process. The individual variables can be either the same variable at different time points, e.g.the temperature at different hours, or different variables altogether. From the perspective of the method it does not make any difference. In both cases we consider the marginal distributions of the individual variables (something that we can compute with historical data), and we map them to a copula function that captures the full distribution of the variables (including correlation). 4.2.4 Properties As a final remark, we outline how the proposed method satisfies each of the required properties mentioned in Section 1.1.2: 1. As the distribution of the disturbances are modelled with non-parametric quantile functions, the generated scenarios are not restricted to the standard assumption of Gaussian forecasting errors. 2. Since the scenarios are generated using a copula function, the multivariate distribution is explicitly considered and the scenarios include the time correlations. 3. As the marginal distributions are estimated for each hour of the day, time of the year, and time-step, the resulting multivariate distribution is non-stationary and captures all time dependencies. 4. As the point forecast considers external factors, the method is not limited to historical data of the variable of interest. 5. Since the Gaussian copula and the empirical quantile methods have low computational costs, the method is especially suitable for online optimization. Remark 9 In this section, we presented the properties that scenario generation methods should have and we adopt the method presented in Section 4.2.3, qualitatively comparing it against other scenario generation methods used in the literature for SBMPC. However, a comparative and quantitative study comprehending several scenario generation methods aimed at investigating which one provides the best control performance is out of scope for this work and is left as a suggestion for future work in Section 6. 5 Case study We present in this section the simulation results in which we compare 5 different controllers: \u2022 PIMPC: perfect-information MPC, obtained using the values of the measurements of the disturbances as if they were known in advance. It is of course not possible to have the real values of the actual measurements beforehand in practice, but this controller can be used as a benchmark for the ideal theoretical achievable performance. \u2022 DetMPC-Mod: deterministic MPC controller presented in Section 3.1 together with the nonlinear Modelica model. \u2022 SBMPC-Mod: SBMPC controller presented in Section 3.2 together with the nonlinear Modelica model. \u2022 DetMPC-Lin: deterministic MPC controller together with the linearized model presented in Section 2.5. \u2022 SBMPC-Lin: SBMPC controller together with the linearized model. First, the simulation setup is discussed, then the results and the discussions are presented. 5.1 Setup The closed-loop control is applied as explained in Section 2.4, i.e.the MPC problem is solved and the first input is applied to the system. Then, for all the controllers, the evolution of the real building between sampling times is simulated through Modelica. We perform simulations for one month in the winter season with 1 h sampling time, i.e.we solve 24 · 30 = 720 optimization problems for each controller. The prediction horizon is N p = 24 , i.e.corresponding to one day. We consider an office building in Brussels, Belgium, with 7 floors and a total surface of 10000 m 2 . A nonlinear model of the building is estimated using Modelica based on the considerations of Section 2.1 and using data from the real building. In addition, a linear counterpart is also estimated using regular linear least squares as explained in Section 2.5. The heating system consists of 2 gas boilers of 500 kW each and one chiller of 500 kW. We consider thermal comfort bounds that change throughout time, i.e.the lower and upper comfort bounds are set respectively to 21.5 °C and 24 °C during occupation hours and 18 °C and 26 °C during the non-occupation hours, as shown in Fig. 5. Furthermore, the building occupancy profile follows the temperature comfort bounds, i.e.the occupancy is set to 1 when the comfort bounds are tight and 0 when they are loose. The solver and software tools used to solve the optimization problem are as explained in Section 2.4. Lastly, the parameters of the building presented in Section 3 are shown in Table 2 . For what concerns the SBMPC controllers, we choose 4 different number of scenarios: 10, 20, 30, and 40. Moreover, we perform the same simulations varying the parameter α in Section 3, choosing the values in the set { 50 , 100 , 200 , 500 } ; recall that a higher α means a higher focus on the comfort of the occupants rather than on the economical cost. We indicate respectively by SBMPC-Mod- n s and by SBMPC-Lin- n s , n s ∈ { 10 , 20 , 30 , 40 } , the SBMPC controller with the Modelica model and the SBMPC controller with the linear model, considering n s scenarios. 5.2 Results and discussion We focus our attention on four different aspects: 1. an analysis for the performance of the controller with different values of α . 2. A comparison between the nonlinear Modelica model and the linear model. 3. A comparison between SBMPC strategies and DetMPC strategies. 4. A comparison between the SBMPC strategies with different numbers of scenarios. Lastly, we pick a single representative optimization result and discuss it in more detail. We show the results of the simulations in Figs. 4 , 6\u20139 and Tables 3\u20135 . In Table 3, we show the total closed-loop costs for each strategy and each different α . In Table 4, we show the percentage of each subcost with respect to the total closed-loop cost for each strategy and each different α , i.e.we show J e J e + α J d and α J d J e + α J d . In Table 5 we show the total amount of discomfort using the unit measure K · h , as standard in the literature [17,25,13,15], i.e.we show the integral of the comfort bounds violation. Fig. 4 reports the results presented in Table 4 in a graphic way; the same holds for Fig. 6 and Table 5. Lastly, Figs. 7,9 show respectively the temperature evolution, the heating power, and the temperature and irradiance profiles for the representative simulation. 5.2.1 Performance with different values of α In this section, we analyze how the different values of α alters the performance of the controllers in terms of energy cost and discomfort. This analysis should always be carried out when considering a case study as the one presented here, in order to understand which is the range of values for α that provide the best trade-off between comfort and energy cost reduction. From Tables 3\u20135 we can notice that the larger the α , the larger, in general, the total costs and the lower the discomfort. This is as expected, since the role of α is to penalize the discomfort and a larger value means that we aim for a lower discomfort. We have noticed through simulations that, for this specific case study, a value of α lower than 50 yields a very high and unacceptable discomfort cost, while for values larger than 500, the energy costs increase highly without yielding a high reduction in the discomfort costs. Therefore, we focus our analysis on α in the range 50 , 500 . We can observe that for α = 50 the discomfort cost is high and that the comfort could be improved by increasing α . For α ⩾ 100 , the discomfort reaches more acceptable levels and this happens by consuming a larger quantity of energy in heating and thus increasing the total costs. However, the small decrease in the discomfort between the case α = 500 and α ∈ { 100 , 200 } does not seem to justify the large increase in the total cost observed for α = 500 . Therefore, we can claim that, for this case study, the optimal values for α are in the range 100 , 200 . Note also that from Fig. 4 and Table 4 we can notice how the two costs, i.e.energy and comfort, compose the total cost. As α increases, we notice an increase in the α J d cost with respect to the J e , as a higher α penalizes more even the small deviations from the comfort bounds. Therefore, we should not wrongly conclude that less energy is consumed for higher values of α , but rather that small deviations are penalized more. 5.2.2 Comparison between the nonlinear Modelica model and the linear model Recalling Remarks 4,5, we present here a comparison between the controllers that use the Modelica model with respect to the ones that use the linear model. While using the Modelica model in the closed-loop for computing the evolution of the system results in a bias towards the nonlinear controllers, it is nevertheless of interest analyzing how good the linear controllers are compared to the ones using the Modelica model. From Table 3, we can see that all the controllers that use Modelica perform better than their linear counterparts for all the values of α ⩾ 100 . For α = 50 , instead, the linear model yields a lower total cost than the one of Modelica in 3 out of 5 cases. Nevertheless, the linear model might seem to work better, i.e.to have a lower total cost, for a lower value of α because it always allows a large discomfort cost and it cannot manage well to keep the temperature within or close to the comfort bounds. The total cost can therefore be lower than for the Modelica-based controllers, but this occurs because the energy cost is low and the discomfort cost, although high, does not have a large impact on the total cost for a small α . This also explains why for a large α , i.e. for α ⩾ 100 , the total cost of the linear model controllers can become much higher than the one of the controllers that use Modelica. Indeed, the discomfort cost is always high, but the larger penalization, i.e.the larger α , makes the total cost much higher. This fact can also be observed from Table 5, where we observe a much higher discomfort for all the controllers with the linear models. The same conclusions can be drawn by analyzing Fig. 6, which displays the results of Table 5. Moreover, from Fig. 4 we can notice how for all the values of α the controllers that use the linear model have a much higher comfort cost component than an energy cost component. The linear model does not employ more energy to reduce the comfort, which in turn results in high comfort violations. This concept will be discussed also in Section 5.2.5. We can therefore conclude that, independently of the bias mentioned in Remark 4, the linear model in this case fails to provide satisfactory performance in terms of comfort for the occupants of the building. 5.2.3 Comparison between SBMPC strategies and DetMPC strategies By checking again Table 3 we can compare the SBMPC strategies to the DetMPC ones. It can be noted from the table that, for all the values of α , the SBMPC controllers perform almost always better than their deterministic counterpart, both for the linear and the nonlinear Modelica model. Note that the reduction, although not very large, is still consistent and it ranges from a minimum of 1.98 % to a maximum of 14.03 % for the controllers that use the Modelica model. Furthermore, by checking Table 5 and Fig. 6, we can notice that the SBMPC strategies perform better than the DetMPC ones also in terms of comfort. Therefore, the SBMPC controllers can improve the overall performance, both in terms of total costs and discomfort, with respect to their DetMPC counterparts. 5.2.4 Comparison between the SBMPC strategies with different number of scenarios By analyzing the results of Table 3, there does not seem to be a value for the number of scenarios that outperforms the other values, i.e.the performance does not seem to increase by increasing the number of scenarios. In 2 out of 4 columns of Table 3, the SBMPC-Mod-20 achieves the best performance among the SBMPC-Mod controllers and in the other two cases, a number of scenarios equal to respectively 10 and 40 appear to be better than the other values. Therefore, increasing the number of scenarios does not seem to directly lead to a decrease in the total cost. This could be related to the fact that, while increasing the number of scenarios makes the system more robust to disturbances, it also makes the problem more complex to solve. Therefore, it might happen that, the larger the number of scenarios, more local minima exists, and the more likely it is that the solver converges to a suboptimal local minimum. Note that this issue does not affect the controllers with the linear model, as the problem solved in that case is a quadratic programming one; thus it is convex, and does not suffer from local minima issues. 5.2.5 Representative simulation In this section, we present a representative simulation, i.e.one week of simulation of the building, by showing the temperature evolution, heating power, and external disturbances for a specific value of α and of the number of scenarios. While the analysis of the results shown in this section are related to a specific case, the results can be generalized and the analysis of a case with a different α would be similar to what is here presented. We compare three different control strategies here, namely SBMPC-Mod, SBMPC-Lin and PIMPC. We show in Fig. 7 the temperature evolution inside the room, in Fig. 8 the heating power, and in Fig. 9 the temperature and irradiance profile, for one week of simulation with 20 scenarios and α = 100 . For Fig. 7, we also show the lower comfort bounds. By analyzing the Figs. 7 and 8, we can note that the PIMPC manages to keep the temperature within the comfort bounds by using properly the heating power, thanks to the knowledge of the actual values of the future disturbances. For what concerns SBMPC-Mod and SBMPC-Lin, we can notice in Fig. 7 what we have already underlined in Section 5.2.2, i.e.the fact that a controller that uses a linear model is not able to keep the temperature within the comfort bounds. We see indeed that, for most of the time, SBMPC-Lin yields the temperature profile that has the lowest value. This can also be observed from Fig. 8, where we can notice that SBMPC-Lin heats less than SBMPC-Mod and it also starts heating later. On the other hand, SBMPC-Mod is able to maintain a larger temperature in the room and to be closer to the temperature comfort bounds. It uses more heating power, as can be seen from Fig. 8, which leads to a higher energy cost compared to SBMPC-Lin, but also leads to an overall lower total cost and higher comfort from the user, as can be observed from Tables 3\u20135. In the first two days of simulation, which correspond to the weekend days, the heating power is turned off due to the low comfort bounds and to the prediction horizon of 24 h. However, it is possible to observe an increase in the room temperature, both for the day 16/12/2017 and 17/12/2017; for the latter, the rise in the temperature is even steeper. This can be explained by looking at Fig. 9, where we can observe that the day 17/02/2017 was a particularly sunny day. Hence, the steep increase in the temperature is due to large value of the solar irradiance in that particular day. This shows how important the influence of the external disturbances on the building can be, which once again underlines the importance of having good forecasts and it corroborates our choice of a scenario-based approach. Note also that, while a longer prediction horizon could have been more beneficial and could have led to a higher performance of the controllers, we chose to focus our analysis on a horizon of 24 h as it provides a good trade-off between performance and computation time of all the simulations. The analysis performed here is still valid even when considering other prediction horizons. Moreover, carrying out a study on which prediction horizon is more beneficial for the considered building is beyond the scope of this paper. 5.3 Summary We can summarize the observations obtained from the results of the simulations: \u2022 too low values of α , i.e. α < 100 , yield a high discomfort and too high values of α , i.e. α ⩾ 500 yield a very large total cost without leading to a large improvement of the comfort. A trade-off between the two costs seems to be well achieved by a value of α between these two extrema, i.e. α ∈ 100 , 200 . Moreover, tuning the parameter α is of great importance in order not to obtain a very large discomfort for the occupants of the building. \u2022 For all the values of α , the linear model shows a very large value of discomfort. In general, the linear model fails to capture many model dynamics, by heating much less and thus leading to temperatures that are well outside the comfort bounds. \u2022 SBMPC can improve the performance with respect to DetMPC strategies, for both the linear and the Modelica models. This is due to the fact that SBMPC strategies consider different external disturbances scenarios and they have a large impact on the temperature evolution of the room. \u2022 Increasing the number of scenarios does not seem to lead to a large decrease in the cost. This can be related to the fact that increasing the number of scenarios also increases the optimization complexity. Remark 10 Note that all the simulations performed in this work refer to a single, specific building. However, the controller designed can be applied to any building, as long as the model is adapted to the specific building under control. For instance, a similar controller, using a Modelica model and a deterministic MPC algorithm, has been applied to a different building with successful results in [13]. Moreover, the scenario generation method presented here can also be applied to several disturbances that affect buildings. Therefore, while the results presented in this section refer to a single building, the method can be applied to any building. The results presented in Tables 3\u20135 will change if another building is considered, but we expect in any case similar results when applying the presented method to other buildings. 6 Conclusions We have presented a stochastic SBMPC controller using a Modelica nonlinear model that can be applied to building heating in buildings and that overcomes the limitations of both deterministic and linear MPC approaches. The building under control is affected by several external disturbances, e.g.outside temperature, solar irradiance, and we have proposed a new approach for generating disturbance scenarios that, unlike the existing methods from the literature, satisfies all the important properties of scenario generation methods for time series data. This proposed scenario generation method can be used in the SBMPC controllers. To analyze and study the control approach, we considered a real building and performed several simulations to compare the controller that uses the linearized model against the controller that uses the Modelica model, different cost weights in the MPC cost function, deterministic MPC against SBMPC, and lastly different number of scenarios. Based on the results, we showed that SBMPC controllers outperform the deterministic MPC controllers both with and without the Modelica model. At the same time, the linear model has shown not to be able to capture many model dynamics and this leads to poor performance, justifying the usage of more advanced models, e.g.Modelica ones. As future work, we will develop a model with e.g.EnergyPlus to be used in the closed-loop simulations to improve the comparison performed between the linear and nonlinear model in Section 5. After such step, we will also perform experiments in the real building. Moreover, a quantitative study on different scenario generation methods can be considered, in order to assess how the performance of the controller varies with the different scenario generation methods, as well as other stochastic MPC algorithms. Furthermore, a thorough comparison could be performed between our proposed method and other ones present in the literature of building heating systems, e.g. H ∞ , fuzzy control, rule-based control. On top of that, a distributed or decentralized MPC controller can be developed to control independently each room, which might be more beneficial for very large buildings compared to controlling all the rooms with a single centralized controller. Lastly, it is known that occupancy can largely affect the energy performance of buildings. Occupancy data was not available in this study, but we suggest to carry out a characterization study of such disturbance, so that occupancy scenarios can be generated and the overall performance of the proposed SBMPC controllers can be further assessed. Declaration of Competing Interest The authors declare that they have no known competing financial interests or personal relationships that could have appeared to influence the work reported in this paper. Acknowledgments This research has received funding from the European Union\u2019s Horizon 2020 research and innovation program under the Marie Skłodowska-Curie grant agreement No 675318 (INCITE). References [1] L. Yang H. Yan J.C. Lam Thermal comfort and building energy consumption implications \u2013 a review Applied Energy 115 2014 164 173 10.1016/j.apenergy.2013.10.062 L. Yang, H. Yan, J.C. Lam, Thermal comfort and building energy consumption implications - a review, Applied Energy 115 (2014) 164\u2013173. doi: 10.1016/j.apenergy.2013.10.062. [2] G. Li Q. Xuan M. Akram Y.G. Akhlaghi H. Liu S. Shittu Building integrated solar concentrating systems: A review Applied Energy 260 2020 114288 10.1016/j.apenergy.2019.114288 G. Li, Q. Xuan, M. Akram, Y.G. Akhlaghi, H. Liu, S. Shittu, Building integrated solar concentrating systems: A review, Applied Energy 260 (2020) 114288. doi: 10.1016/j.apenergy.2019.114288. [3] European environment agency. Final energy consumption by sector and fuel, URL:https://www.eea.europa.eu/data-and-maps/indicators/final-energy-consumption-by-sector-9/assessment-1 (2016). European environment agency. Final energy consumption by sector and fuel, URL:https://www.eea.europa.eu/data-and-maps/indicators/final-energy-consumption-by-sector-9/assessment-1 (2016). [4] Energy consumption in households, in: Statistics Explained, Eurostat, 2018, URL:http://ec.europa.eu/eurostat/statistics-explained/index.php/Energy_consumption_in_households. Energy consumption in households, in: Statistics Explained, Eurostat, 2018, URL:http://ec.europa.eu/eurostat/statistics-explained/index.php/Energy_consumption_in_households. [5] J. Lago F. De Ridder W. Mazairac B. De Schutter A 1-dimensional continuous and smooth model for thermally stratified storage tanks including mixing and buoyancy Applied Energy 248 2019 640 655 10.1016/j.apenergy.2019.04.139 J. Lago, F. De Ridder, W. Mazairac, B. De Schutter, A 1-dimensional continuous and smooth model for thermally stratified storage tanks including mixing and buoyancy, Applied Energy 248 (2019) 640\u2013655. doi:10.1016/j.apenergy.2019.04.139. [6] A. Bloess W.-P. Schill A. Zerrahn Power-to-heat for renewable energy integration: A review of technologies, modeling approaches, and flexibility potentials Applied Energy 212 2018 1611 1626 10.1016/j.apenergy.2017.12.073 A. Bloess, W.-P. Schill, A. Zerrahn, Power-to-heat for renewable energy integration: A review of technologies, modeling approaches, and flexibility potentials, Applied Energy 212 (2018) 1611\u20131626. doi: 10.1016/j.apenergy.2017.12.073. [7] BSI, EN 15251:2007, Indoor environmental input parameters for design and assessment of energy performance of buildings addressing indoor air quality, thermal environment, lighting and acoustics. (2007). BSI, EN 15251:2007, Indoor environmental input parameters for design and assessment of energy performance of buildings addressing indoor air quality, thermal environment, lighting and acoustics. (2007). [8] C. Aghemo J. Virgone G. Fracastoro A. Pellegrino L. Blaso J. Savoyat K. Johannes Management and monitoring of public buildings through ICT based systems: Control rules for energy saving with lighting and HVAC services Frontiers of Architectural Research 2 2 2013 147 161 10.1016/j.foar.2012.11.001 C. Aghemo, J. Virgone, G. Fracastoro, A. Pellegrino, L. Blaso, J. Savoyat, K. Johannes, Management and monitoring of public buildings through ICT based systems: Control rules for energy saving with lighting and HVAC services, Frontiers of Architectural Research 2 (2) (2013) 147\u2013161. doi: 10.1016/j.foar.2012.11.001. [9] E.F. Camacho C.B. Alba Model Predictive Control, Advanced Textbooks in Control and Signal Processing 2013 Springer London 10.1007/978-0-85729-398-5 E.F. Camacho, C.B. Alba, Model Predictive Control, Advanced Textbooks in Control and Signal Processing, Springer London, 2013. doi:10.1007/978-0-85729-398-5. [10] J. Maciejowski Predictive Control with Constraints 2002 Prentice Hall England 10.1002/acs.736 J. Maciejowski, Predictive Control with Constraints., Prentice Hall, England., 2002. doi: 10.1002/acs.736. [11] D.Q. Mayne Model predictive control: Recent developments and future promise Automatica 50 12 2014 2967 2986 10.1016/j.automatica.2014.10.128 D.Q. Mayne, Model predictive control: Recent developments and future promise, Automatica 50 (12) (2014) 2967\u20132986. doi: 10.1016/j.automatica.2014.10.128. [12] M. Farina L. Giulioni R. Scattolini Stochastic linear model predictive control with chance constraints - a review Journal of Process Control 44 2016 53 67 10.1016/j.jprocont.2016.03.005 M. Farina, L. Giulioni, R. Scattolini, Stochastic linear model predictive control with chance constraints - a review, Journal of Process Control 44 (2016) 53\u201367. doi: 10.1016/j.jprocont.2016.03.005. [13] R. De Coninck L. Helsen Practical implementation and evaluation of model predictive control for an office building in Brussels Energy and Buildings 111 2016 290 298 10.1016/j.enbuild.2015.11.014 R. De Coninck, L. Helsen, Practical implementation and evaluation of model predictive control for an office building in Brussels, Energy and Buildings 111 (2016) 290\u2013298. doi: 10.1016/j.enbuild.2015.11.014. [14] J. Drgona D. Picard M. Kvasnica L. Helsen Approximate model predictive building control via machine learning Applied Energy 218 2018 199 216 10.1016/j.apenergy.2018.02.156 J. Drgona, D. Picard, M. Kvasnica, L. Helsen, Approximate model predictive building control via machine learning, Applied Energy 218 (2018) 199\u2013216. doi: 10.1016/j.apenergy.2018.02.156. [15] F. Oldewurtel A. Parisio C.N. Jones D. Gyalistras M. Gwerder V. Stauch B. Lehmann M. Morari Use of model predictive control and weather forecasts for energy efficient building climate control Energy and Buildings 45 2012 15 27 10.1016/j.enbuild.2011.09.022 F. Oldewurtel, A. Parisio, C.N. Jones, D. Gyalistras, M. Gwerder, V. Stauch, B. Lehmann, M. Morari, Use of model predictive control and weather forecasts for energy efficient building climate control, Energy and Buildings 45 (2012) 15\u201327. doi: 10.1016/j.enbuild.2011.09.022. [16] M. Ostadijafari A. Dubey Tube-based model predictive controller for building\u2019s heating ventilation and air conditioning (HVAC) system IEEE Systems Journal 2020 1 10 M. Ostadijafari, A. Dubey, Tube-based model predictive controller for building\u2019s heating ventilation and air conditioning (HVAC) system, IEEE Systems Journal (2020) 1\u201310. [17] A. Parisio M. Molinari D. Varagnolo K.H. Johansson A scenario-based predictive control approach to building HVAC management systems IEEE International Conference on Automation Science and Engineering (CASE) 2013 2013 428 435 10.1109/CoASE.2013.6654024 A. Parisio, M. Molinari, D. Varagnolo, K.H. Johansson, A scenario-based predictive control approach to building HVAC management systems, in: 2013 IEEE International Conference on Automation Science and Engineering (CASE), 2013, pp. 428\u2013435. doi:10.1109/CoASE.2013.6654024. [18] A. Parisio, D. Varagnolo, D. Risberg, G. Pattarello, M. Molinari, K.H. Johansson, Randomized model predictive control for HVAC systems, in: Proceedings of the 5th ACM Workshop on Embedded Systems For Energy-Efficient Buildings, BuildSys\u201913, ACM, 2013, pp. 19:1\u201319:8. doi: 10.1145/2528282.2528299. A. Parisio, D. Varagnolo, D. Risberg, G. Pattarello, M. Molinari, K.H. Johansson, Randomized model predictive control for HVAC systems, in: Proceedings of the 5th ACM Workshop on Embedded Systems For Energy-Efficient Buildings, BuildSys\u201913, ACM, 2013, pp. 19:1\u201319:8. doi: 10.1145/2528282.2528299. [19] A. Parisio L. Fabietti M. Molinari D. Varagnolo K.H. Johansson Control of HVAC systems via scenario-based explicit MPC 53rd IEEE Conference on Decision and Control 2014 5201 5207 10.1109/CDC.2014.7040202 A. Parisio, L. Fabietti, M. Molinari, D. Varagnolo, K.H. Johansson, Control of HVAC systems via scenario-based explicit MPC, in: 53rd IEEE Conference on Decision and Control, 2014, pp. 5201\u20135207. doi:10.1109/CDC.2014.7040202. [20] Y. Long, S. Liu, L.X. 1, K.H. Johansson, A scenario-based distributed stochastic MPC for building temperature regulation, in: 2014 IEEE International Conference on Automation Science and Engineering, 2014, pp. 1091\u20131096. doi:10.1109/CoASE.2014.6899461. Y. Long, S. Liu, L.X. 1, K.H. Johansson, A scenario-based distributed stochastic MPC for building temperature regulation, in: 2014 IEEE International Conference on Automation Science and Engineering, 2014, pp. 1091\u20131096. doi:10.1109/CoASE.2014.6899461. [21] R. Tang S. Wang Model predictive control for thermal energy storage and thermal comfort optimization of building demand response in smart grids Applied Energy 242 2019 873 882 10.1016/j.apenergy.2019.03.038 R. Tang, S. Wang, Model predictive control for thermal energy storage and thermal comfort optimization of building demand response in smart grids, Applied Energy 242 (2019) 873\u2013882. doi: 10.1016/j.apenergy.2019.03.038. [22] S. Kuboth F. Heberle A. König-Haagen D. Brüggemann Economic model predictive control of combined thermal and electric residential building energy systems Applied Energy 240 2019 372 385 10.1016/j.apenergy.2019.01.097 S. Kuboth, F. Heberle, A. König-Haagen, D. Brüggemann, Economic model predictive control of combined thermal and electric residential building energy systems, Applied Energy 240 (2019) 372\u2013385. doi: 10.1016/j.apenergy.2019.01.097. [23] N. Aoun R. Bavière M. Vallée A. Aurousseau G. Sandou Modelling and flexible predictive control of buildings space-heating demand in district heating systems Energy 188 2019 116042 10.1016/j.energy.2019.116042 N. Aoun, R. Bavière, M. Vallée, A. Aurousseau, G. Sandou, Modelling and flexible predictive control of buildings space-heating demand in district heating systems, Energy 188 (2019) 116042. doi: 10.1016/j.energy.2019.116042. [24] F. Jorissen W. Boydens L. Helsen TACO, an automated toolchain for model predictive control of building systems: implementation and verification Journal of Building Performance Simulation 12 2 2019 180 192 10.1080/19401493.2018.1498537 F. Jorissen, W. Boydens, L. Helsen, TACO, an automated toolchain for model predictive control of building systems: implementation and verification, Journal of Building Performance Simulation 12 (2) (2019) 180\u2013192. doi: 10.1080/19401493.2018.1498537. [25] X. Zhang, G. Schildbach, D. Sturzenegger, M. Morari, Scenario-based MPC for energy-efficient building climate control under weather and occupancy uncertainty, in: 2013 European Control Conference (ECC), IEEE, 2013, pp. 1029\u20131034. doi:10.23919/ECC.2013.6669664. X. Zhang, G. Schildbach, D. Sturzenegger, M. Morari, Scenario-based MPC for energy-efficient building climate control under weather and occupancy uncertainty, in: 2013 European Control Conference (ECC), IEEE, 2013, pp. 1029\u20131034. doi:10.23919/ECC.2013.6669664. [26] R. Carli, G. Cavone, S. Ben Othman, M. Dotoli, IoT based architecture for model predictive control of HVAC systems in smart buildings, Sensors 20 (3). doi:10.3390/s20030781. R. Carli, G. Cavone, S. Ben Othman, M. Dotoli, IoT based architecture for model predictive control of HVAC systems in smart buildings, Sensors 20 (3). doi:10.3390/s20030781. [27] T. Pippia J. Lago R. De Coninck J. Sijs B. De Schutter Scenario-based model predictive control approach for heating systems in an office building 2019 IEEE 15th International Conference on Automation Science and Engineering (CASE) 2019 1243 1248 10.1109/COASE.2019.8842846 T. Pippia, J. Lago, R. De Coninck, J. Sijs, B. De Schutter, Scenario-based model predictive control approach for heating systems in an office building, in: 2019 IEEE 15th International Conference on Automation Science and Engineering (CASE), 2019, pp. 1243\u20131248. doi:10.1109/COASE.2019.8842846. [28] Z. Li J. Zhang Study on the distributed model predictive control for multi-zone buildings in personalized heating Energy and Buildings 231 2021 110627 Z. Li, J. Zhang, Study on the distributed model predictive control for multi-zone buildings in personalized heating, Energy and Buildings 231 (2021) 110627. [29] D. Yassuda Yamashita I. Vechiu J.-P. Gaubert Two-level hierarchical model predictive control with an optimised cost function for energy management in building microgrids Applied Energy 285 2021 116420 D. Yassuda Yamashita, I. Vechiu, J.-P. Gaubert, Two-level hierarchical model predictive control with an optimised cost function for energy management in building microgrids, Applied Energy 285 (2021) 116420. [30] J.T. Wen S. Mishra Intelligent Building Control Systems 2018 Springer International Publishing J.T. Wen, S. Mishra (Eds.), Intelligent Building Control Systems, Springer International Publishing, 2018. [31] E.T. Maddalena, Y. Lian, C.N. Jones, Data-driven methods for building control \u2013 a review and promising future directions, Control Engineering Practice 95. E.T. Maddalena, Y. Lian, C.N. Jones, Data-driven methods for building control \u2013 a review and promising future directions, Control Engineering Practice 95. [32] The Modelica Association, URL:https://www.modelica.org. The Modelica Association, URL:https://www.modelica.org. [33] P. Fritzson Principles of Object-Oriented Modeling and Simulation with Modelica 3.3: A Cyber-Physical Approach 2nd Edition, 2015 IEEE Press Wiley 10.1002/9781118989166 P. Fritzson, Principles of Object-Oriented Modeling and Simulation with Modelica 3.3: A Cyber-Physical Approach, 2nd Edition, IEEE Press, Wiley, 2015. doi:10.1002/9781118989166. [34] P. Pinson H. Madsen H.A. Nielsen G. Papaefthymiou B. Klöckl From probabilistic forecasts to statistical scenarios of short-term wind power production Wind Energy 12 1 2008 51 62 10.1002/we.284 P. Pinson, H. Madsen, H.A. Nielsen, G. Papaefthymiou, B. Klöckl, From probabilistic forecasts to statistical scenarios of short-term wind power production, Wind Energy 12 (1) (2008) 51\u201362. doi: 10.1002/we.284. [35] Y. Ma, F. Borrelli, Fast stochastic predictive control for building temperature regulation, in: 2012 American Control Conference (ACC), IEEE, 2012, pp. 3075\u20133080. doi:10.1109/ACC.2012.6315347. Y. Ma, F. Borrelli, Fast stochastic predictive control for building temperature regulation, in: 2012 American Control Conference (ACC), IEEE, 2012, pp. 3075\u20133080. doi:10.1109/ACC.2012.6315347. [36] Y. Ma S. Vichik F. Borrelli Fast stochastic MPC with optimal risk allocation applied to building control systems 2012 IEEE 51st IEEE Conference on Decision and Control (CDC), IEEE 2012 7559 7564 10.1109/CDC.2012.6426251 Y. Ma, S. Vichik, F. Borrelli, Fast stochastic MPC with optimal risk allocation applied to building control systems, in: 2012 IEEE 51st IEEE Conference on Decision and Control (CDC), IEEE, 2012, pp. 7559\u20137564. doi:10.1109/CDC.2012.6426251. [37] T.H. Pedersen S. Petersen Investigating the performance of scenario-based model predictive control of space heating in residential buildings Journal of Building Performance Simulation 11 4 2018 485 498 10.1080/19401493.2017.1397196 T.H. Pedersen, S. Petersen, Investigating the performance of scenario-based model predictive control of space heating in residential buildings, Journal of Building Performance Simulation 11 (4) (2018) 485\u2013498. doi: 10.1080/19401493.2017.1397196. [38] L. Deori L. Giulioni M. Prandini Optimal building climate control: a solution based on nested dynamic programming and randomized optimization 53rd IEEE Conference on Decision and Control, IEEE 2014 4905 4910 10.1109/CDC.2014.7040155 L. Deori, L. Giulioni, M. Prandini, Optimal building climate control: a solution based on nested dynamic programming and randomized optimization, in: 53rd IEEE Conference on Decision and Control, IEEE, 2014, pp. 4905\u20134910. doi:10.1109/CDC.2014.7040155. [39] M. Maiworm T. Bäthge R. Findeisen Scenario-based model predictive control: Recursive feasibility and stability IFAC-PapersOnLine 48 8 2015 50 56 10.1016/j.ifacol.2015.08.156 M. Maiworm, T. Bäthge, R. Findeisen, Scenario-based model predictive control: Recursive feasibility and stability, IFAC-PapersOnLine 48 (8) (2015) 50\u201356. doi: 10.1016/j.ifacol.2015.08.156. [40] R.E. Hedegaard T.H. Pedersen S. Petersen Multi-market demand response using economic model predictive control of space heating in residential buildings Energy and Buildings 150 2017 253 261 10.1016/j.enbuild.2017.05.059 R.E. Hedegaard, T.H. Pedersen, S. Petersen, Multi-market demand response using economic model predictive control of space heating in residential buildings, Energy and Buildings 150 (2017) 253\u2013261. doi: 10.1016/j.enbuild.2017.05.059. [41] R. Schefzik T.L. Thorarinsdottir T. Gneiting Uncertainty quantification in complex simulation models using ensemble copula coupling Statistical Science 28 4 2013 616 640 10.1214/13-STS443 R. Schefzik, T.L. Thorarinsdottir, T. Gneiting, Uncertainty quantification in complex simulation models using ensemble copula coupling, Statistical science 28 (4) (2013) 616\u2013640. doi:10.1214/13-STS443. [42] T. Labeodan W. Zeiler G. Boxem Y. Zhao Occupancy measurement in commercial office buildings for demand-driven control applications\u2013a survey and detection system evaluation Energy and Buildings 93 2015 303 314 10.1016/j.enbuild.2015.02.028 T. Labeodan, W. Zeiler, G. Boxem, Y. Zhao, Occupancy measurement in commercial office buildings for demand-driven control applications\u2013a survey and detection system evaluation, Energy and Buildings 93 (2015) 303\u2013314. doi: 10.1016/j.enbuild.2015.02.028. [43] E. Soltanaghaei K. Whitehouse Practical occupancy detection for programmable and smart thermostats Applied Energy 220 2018 842 855 10.1016/j.apenergy.2017.11.024 E. Soltanaghaei, K. Whitehouse, Practical occupancy detection for programmable and smart thermostats, Applied Energy 220 (2018) 842\u2013855. doi: 10.1016/j.apenergy.2017.11.024. [44] R. De Coninck F. Magnusson J. Åkesson L. Helsen Toolbox for development and validation of grey-box building models for forecasting and control Journal of Building Performance Simulation 9 3 2016 288 303 10.1080/19401493.2015.1046933 R. De Coninck, F. Magnusson, J. Åkesson, L. Helsen, Toolbox for development and validation of grey-box building models for forecasting and control, Journal of Building Performance Simulation 9 (3) (2016) 288\u2013303. doi: 10.1080/19401493.2015.1046933. [45] D.B. Crawley, J.W. Hand, M. Kummert, B.T. Griffith, Contrasting the capabilities of building energy performance simulation programs, Building and Environment 43 (4) (2008) 661\u2013673, part Special: Building Performance Simulation. D.B. Crawley, J.W. Hand, M. Kummert, B.T. Griffith, Contrasting the capabilities of building energy performance simulation programs, Building and Environment 43 (4) (2008) 661\u2013673, part Special: Building Performance Simulation. [46] P.H. Shaikh N.B.M. Nor P. Nallagownden I. Elamvazuthi T. Ibrahim A review on optimized control systems for building energy and comfort management of smart sustainable buildings Renewable and Sustainable Energy Reviews 34 2014 409 429 P.H. Shaikh, N.B.M. Nor, P. Nallagownden, I. Elamvazuthi, T. Ibrahim, A review on optimized control systems for building energy and comfort management of smart sustainable buildings, Renewable and Sustainable Energy Reviews 34 (2014) 409\u2013429. [47] A. Andriamamonjy D. Saelens R. Klein An automated ifc-based workflow for building energy performance simulation with modelica Automation in Construction 91 2018 166 181 A. Andriamamonjy, D. Saelens, R. Klein, An automated ifc-based workflow for building energy performance simulation with modelica, Automation in Construction 91 (2018) 166\u2013181. [48] M. Wetter Modelica-based modelling and simulation to support research and development in building energy and control systems Journal of Building Performance Simulation 2 2 2009 143 161 M. Wetter, Modelica-based modelling and simulation to support research and development in building energy and control systems, Journal of Building Performance Simulation 2 (2) (2009) 143\u2013161. [49] T. Pippia J. Sijs B. De Schutter A single-level rule-based model predictive control approach for energy management of grid-connected microgrids IEEE Transactions on Control Systems Technology 2019 1 13 T. Pippia, J. Sijs, B. De Schutter, A single-level rule-based model predictive control approach for energy management of grid-connected microgrids, IEEE Transactions on Control Systems Technology (2019) 1\u201313. [50] M. Kordestani, M.S. Khoshro, A. Mirzaee, Predictive control of large steam turbines, in: 2013 9th Asian Control Conference (ASCC), IEEE, 2013, pp. 1\u20136. M. Kordestani, M.S. Khoshro, A. Mirzaee, Predictive control of large steam turbines, in: 2013 9th Asian Control Conference (ASCC), IEEE, 2013, pp. 1\u20136. [51] S. Liu H. Hellendoorn B. De Schutter Model predictive control for freeway networks based on multi-class traffic flow and emission models IEEE Transactions on Intelligent Transportation Systems 18 2 2017 306 320 S. Liu, H. Hellendoorn, B. De Schutter, Model predictive control for freeway networks based on multi-class traffic flow and emission models, IEEE Transactions on Intelligent Transportation Systems 18 (2) (2017) 306\u2013320. [52] M. Kordestani A.A. Safavi N. Sharafi M. Saif Novel multiagent model-predictive control performance indices for monitoring of a large-scale distributed water system IEEE Systems Journal 12 2 2016 1286 1294 M. Kordestani, A.A. Safavi, N. Sharafi, M. Saif, Novel multiagent model-predictive control performance indices for monitoring of a large-scale distributed water system, IEEE Systems Journal 12 (2) (2016) 1286\u20131294. [53] U. Eren A. Prach B.B. Koçer S.V. Raković E. Kayacan B. Açikmeşe Model predictive control in aerospace systems: Current state and opportunities Journal of Guidance, Control, and Dynamics 40 7 2017 1541 1566 U. Eren, A. Prach, B.B. Koçer, S.V. Raković, E. Kayacan, B. Açikmeşe, Model predictive control in aerospace systems: Current state and opportunities, Journal of Guidance, Control, and Dynamics 40 (7) (2017) 1541\u20131566. [54] M. Kordestani A.A. Safavi M. Saif Recent survey of large-scale systems: Architectures, controller strategies, and industrial applications IEEE Systems Journal 2021 1 14 M. Kordestani, A.A. Safavi, M. Saif, Recent survey of large-scale systems: Architectures, controller strategies, and industrial applications, IEEE Systems Journal (2021) 1\u201314. [55] J. Åkesson, K.-E. Årzén, M. Gäfvert, T. Bergdahl, H. Tummescheit, Modeling and optimization with Optimica and JModelica.org\u2013Languages and tools for solving large-scale dynamic optimization problems, Computers & Chemical Engineering 34 (11) (2010) 1737\u20131749. doi: 10.1016/j.compchemeng.2009.11.011. J. Åkesson, K.-E. Årzén, M. Gäfvert, T. Bergdahl, H. Tummescheit, Modeling and optimization with Optimica and JModelica.org\u2013Languages and tools for solving large-scale dynamic optimization problems, Computers & Chemical Engineering 34 (11) (2010) 1737\u20131749. doi: 10.1016/j.compchemeng.2009.11.011. [56] F. Magnusson, J. Åkesson, Collocation methods for optimization in a Modelica environment, in: Proceedings of the 9th International MODELICA Conference, no. 76, Linköping University Electronic Press; Linköpings Universitet, 2012, pp. 649\u2013658. doi:10.3384/ecp12076649. F. Magnusson, J. Åkesson, Collocation methods for optimization in a Modelica environment, in: Proceedings of the 9th International MODELICA Conference, no. 76, Linköping University Electronic Press; Linköpings Universitet, 2012, pp. 649\u2013658. doi:10.3384/ecp12076649. [57] J.A.E. Andersson J. Gillis G. Horn J.B. Rawlings M. Diehl CasADi \u2013 A software framework for nonlinear optimization and optimal control Mathematical Programming Computation 2018 1 36 10.1007/s12532-018-0139-4 J.A.E. Andersson, J. Gillis, G. Horn, J.B. Rawlings, M. Diehl, CasADi \u2013 A software framework for nonlinear optimization and optimal control, Mathematical Programming Computation (2018) 1\u201336 doi:10.1007/s12532-018-0139-4. [58] A. Wächter L. Biegler On the implementation of an interior-point filter line-search algorithm for large-scale nonlinear programming Mathematical Programming 106 1 2006 25 57 10.1007/s10107-004-0559-y A. Wächter, L. Biegler, On the implementation of an interior-point filter line-search algorithm for large-scale nonlinear programming, Mathematical Programming 106 (1) (2006) 25\u201357. doi:10.1007/s10107-004-0559-y. [59] HSL (2013). A collection of Fortran codes for large scale scientific computation, http://www.hsl.rl.ac.uk. HSL (2013). A collection of Fortran codes for large scale scientific computation., http://www.hsl.rl.ac.uk. [60] X. Tian R.R. Negenborn P.-J. van Overloop J.M. Maestre A. Sadowska N. van de Giesen Efficient multi-scenario model predictive control for water resources management with ensemble streamflow forecasts Advances in Water Resources 109 2017 58 68 X. Tian, R.R. Negenborn, P.-J. van Overloop, J.M. Maestre, A. Sadowska, N. van de Giesen, Efficient multi-scenario model predictive control for water resources management with ensemble streamflow forecasts, Advances in Water Resources 109 (2017) 58\u201368. [61] X. Tian Y. Guo R.R. Negenborn L. Wei N.M. Lin J.M. Maestre Multi-scenario model predictive control based on genetic algorithms for level regulation of open water systems under ensemble forecasts Water Resources Management 33 9 2019 3025 3040 X. Tian, Y. Guo, R.R. Negenborn, L. Wei, N.M. Lin, J.M. Maestre, Multi-scenario model predictive control based on genetic algorithms for level regulation of open water systems under ensemble forecasts, Water Resources Management 33 (9) (2019) 3025\u20133040. [62] P. Velarde J.M. Maestre C. Ocampo-Martinez C. Bordons Application of robust model predictive control to a renewable hydrogen-based microgrid, in European Control Conference (ECC) 2016 2016 1209 1214 P. Velarde, J.M. Maestre, C. Ocampo-Martinez, C. Bordons, Application of robust model predictive control to a renewable hydrogen-based microgrid, in: 2016 European Control Conference (ECC), 2016, pp. 1209\u20131214. [63] P. Velarde J.M. Maestre H. Ishii R.R. Negenborn Scenario-based defense mechanism for distributed model predictive control 2017 IEEE 56th Annual Conference on Decision and Control (CDC) 2017 6171 6176 P. Velarde, J.M. Maestre, H. Ishii, R.R. Negenborn, Scenario-based defense mechanism for distributed model predictive control, in: 2017 IEEE 56th Annual Conference on Decision and Control (CDC), 2017, pp. 6171\u20136176. [64] J. Lago K. De Brabandere F. De Ridder B. De Schutter Short-term forecasting of solar irradiance without local telemetry: A generalized model using satellite data Solar Energy 173 2018 566 577 10.1016/j.solener.2018.07.050 J. Lago, K. De Brabandere, F. De Ridder, B. De Schutter, Short-term forecasting of solar irradiance without local telemetry: A generalized model using satellite data, Solar Energy 173 (2018) 566\u2013577. doi: 10.1016/j.solener.2018.07.050. [65] European Centre for Medium-Range Weather Forecasts (ECMWF) website, URL:https://www.ecmwf.int/. European Centre for Medium-Range Weather Forecasts (ECMWF) website, URL:https://www.ecmwf.int/. [66] J. Bergstra D. Yamins D.D. Cox Making a science of model search: Hyperparameter optimization in hundreds of dimensions for vision architectures Proceedings of the 30th International Conference on Machine Learning 2013 115 123 J. Bergstra, D. Yamins, D.D. Cox, Making a science of model search: Hyperparameter optimization in hundreds of dimensions for vision architectures, in: Proceedings of the 30th International Conference on Machine Learning, 2013, pp. 115\u2013123. [67] D.P. Kingma J. Ba Adam: A method for stochastic optimization, arXiv eprint 1412.6980 2014 arXiv:1412.6980. D.P. Kingma, J. Ba, Adam: A method for stochastic optimization, arXiv eprint 1412.6980 (2014). arXiv:1412.6980. [68] R. Perez S. Kivalov J. Schlemmer K. Hemker D. Renné T.E. Hoff Validation of short and medium term operational solar radiation forecasts in the US Solar Energy 84 12 2010 2161 2172 10.1016/j.solener.2010.08.014 R. Perez, S. Kivalov, J. Schlemmer, K. Hemker, D. Renné, T.E. Hoff, Validation of short and medium term operational solar radiation forecasts in the US, Solar Energy 84 (12) (2010) 2161\u20132172. doi:10.1016/j.solener.2010.08.014. [69] J. Nowotarski R. Weron Recent advances in electricity price forecasting: A review of probabilistic forecasting Renewable and Sustainable Energy Reviews 81 2018 1548 1568 10.1016/j.rser.2017.05.234 J. Nowotarski, R. Weron, Recent advances in electricity price forecasting: A review of probabilistic forecasting, Renewable and Sustainable Energy Reviews 81 (2018) 1548 \u2013 1568. doi: 10.1016/j.rser.2017.05.234. [70] P. Pinson H. Madsen H.A. Nielsen G. Papaefthymiou B. Klöckl From probabilistic forecasts to statistical scenarios of short-term wind power production Wind Energy 12 2009 51 62 10.1002/we.284 P. Pinson, H. Madsen, H.A. Nielsen, G. Papaefthymiou, B. Klöckl, From probabilistic forecasts to statistical scenarios of short-term wind power production, Wind Energy 12 (2009) 51\u201362. doi:10.1002/we.284. [71] A. Sklar Fonctions de répartition à n dimensions et leurs marges Institut Statistique de l\u2019Université de Paris 8 1959 229 231 A. Sklar, Fonctions de répartition à n dimensions et leurs marges, Institut Statistique de l\u2019Université de Paris 8 (1959) 229\u2013231. [72] A. Sklar Random variables, joint distribution functions, and copulas Kybernetika 09 6 1973 449 460 A. Sklar, Random variables, joint distribution functions, and copulas, Kybernetika 09 (6) (1973) (449)\u2013460. [73] F. Golestaneh H.B. Gooi P. Pinson Generation and evaluation of space\u2013time trajectories of photovoltaic power Applied Energy 176 2016 80 91 10.1016/j.apenergy.2016.05.025 F. Golestaneh, H.B. Gooi, P. Pinson, Generation and evaluation of space\u2013time trajectories of photovoltaic power, Applied Energy 176 (2016) 80\u201391. doi:10.1016/j.apenergy.2016.05.025.",
    "scopus-id": "85107128417",
    "coredata": {
        "eid": "1-s2.0-S0378778821003923",
        "dc:description": "State-of-the-art Model Predictive Control (MPC) applications for building heating adopt either a deterministic controller together with a nonlinear model or a linearized model with a stochastic MPC controller. However, deterministic MPC only considers one single realization of the disturbances and its performance strongly depends on the quality of the forecast of the disturbances, which can lead to low performance. In fact, inadequate building energy management can lead to high energy costs and CO2 emissions. On the other hand, a linearized model can fail to capture some dynamics and behavior of the building under control. In this article, we combine a stochastic scenario-based MPC (SBMPC) controller together with a nonlinear Modelica model that is able to provide a richer building description and to capture the dynamics of the building more accurately than linear models. The adopted SBMPC controller considers multiple realizations of the external disturbances obtained through a statistically accurate model, so as to consider different possible disturbance evolutions and to robustify the control action. To this purpose, we present a scenario generation method for building temperature control that can be applied to several exogenous perturbartions, e.g.solar irradiance, outside temperature, and that satisfies several important stastistical properties, in contrast with simpler and less accurate methods adopted in the literature. We show the benefits of our proposed approach through several simulations in which we compare our method against the standard ones from the literature, for several combinations of a trade-off parameter between comfort and energy cost. We show how our SBMPC controller approach outperforms the standard controllers available in the literature.",
        "openArchiveArticle": "false",
        "prism:coverDate": "2021-09-15",
        "openaccessUserLicense": "http://creativecommons.org/licenses/by/4.0/",
        "prism:aggregationType": "Journal",
        "prism:url": "https://api.elsevier.com/content/article/pii/S0378778821003923",
        "dc:creator": [
            {
                "@_fa": "true",
                "$": "Pippia, Tomas"
            },
            {
                "@_fa": "true",
                "$": "Lago, Jesus"
            },
            {
                "@_fa": "true",
                "$": "De Coninck, Roel"
            },
            {
                "@_fa": "true",
                "$": "De Schutter, Bart"
            }
        ],
        "link": [
            {
                "@_fa": "true",
                "@rel": "self",
                "@href": "https://api.elsevier.com/content/article/pii/S0378778821003923"
            },
            {
                "@_fa": "true",
                "@rel": "scidir",
                "@href": "https://www.sciencedirect.com/science/article/pii/S0378778821003923"
            }
        ],
        "dc:format": "application/json",
        "openaccessType": "Full",
        "pii": "S0378-7788(21)00392-3",
        "prism:volume": "247",
        "articleNumber": "111108",
        "prism:publisher": "The Authors. Published by Elsevier B.V.",
        "dc:title": "Scenario-based nonlinear model predictive control for building heating systems",
        "prism:copyright": "© 2021 The Authors. Published by Elsevier B.V.",
        "openaccess": "1",
        "prism:issn": "03787788",
        "dcterms:subject": [
            {
                "@_fa": "true",
                "$": "Scenario-based model predictive control"
            },
            {
                "@_fa": "true",
                "$": "Control of buildings"
            },
            {
                "@_fa": "true",
                "$": "Model predictive control"
            },
            {
                "@_fa": "true",
                "$": "Modelica"
            }
        ],
        "openaccessArticle": "true",
        "prism:publicationName": "Energy and Buildings",
        "openaccessSponsorType": "FundingBody",
        "prism:pageRange": "111108",
        "pubType": "fla",
        "prism:coverDisplayDate": "15 September 2021",
        "prism:doi": "10.1016/j.enbuild.2021.111108",
        "prism:startingPage": "111108",
        "dc:identifier": "doi:10.1016/j.enbuild.2021.111108",
        "openaccessSponsorName": "Dutch University VSNU 2020"
    },
    "objects": {"object": [
        {
            "@category": "standard",
            "@height": "189",
            "@width": "378",
            "@_fa": "true",
            "$": "https://api.elsevier.com/content/object/eid/1-s2.0-S0378778821003923-gr2.jpg?httpAccept=%2A%2F%2A",
            "@multimediatype": "JPEG image file",
            "@type": "IMAGE-DOWNSAMPLED",
            "@size": "29635",
            "@ref": "gr2",
            "@mimetype": "image/jpeg"
        },
        {
            "@category": "standard",
            "@height": "189",
            "@width": "378",
            "@_fa": "true",
            "$": "https://api.elsevier.com/content/object/eid/1-s2.0-S0378778821003923-gr3.jpg?httpAccept=%2A%2F%2A",
            "@multimediatype": "JPEG image file",
            "@type": "IMAGE-DOWNSAMPLED",
            "@size": "20241",
            "@ref": "gr3",
            "@mimetype": "image/jpeg"
        },
        {
            "@category": "standard",
            "@height": "711",
            "@width": "711",
            "@_fa": "true",
            "$": "https://api.elsevier.com/content/object/eid/1-s2.0-S0378778821003923-gr4.jpg?httpAccept=%2A%2F%2A",
            "@multimediatype": "JPEG image file",
            "@type": "IMAGE-DOWNSAMPLED",
            "@size": "121446",
            "@ref": "gr4",
            "@mimetype": "image/jpeg"
        },
        {
            "@category": "standard",
            "@height": "189",
            "@width": "378",
            "@_fa": "true",
            "$": "https://api.elsevier.com/content/object/eid/1-s2.0-S0378778821003923-gr5.jpg?httpAccept=%2A%2F%2A",
            "@multimediatype": "JPEG image file",
            "@type": "IMAGE-DOWNSAMPLED",
            "@size": "18201",
            "@ref": "gr5",
            "@mimetype": "image/jpeg"
        },
        {
            "@category": "standard",
            "@height": "276",
            "@width": "378",
            "@_fa": "true",
            "$": "https://api.elsevier.com/content/object/eid/1-s2.0-S0378778821003923-gr6.jpg?httpAccept=%2A%2F%2A",
            "@multimediatype": "JPEG image file",
            "@type": "IMAGE-DOWNSAMPLED",
            "@size": "29030",
            "@ref": "gr6",
            "@mimetype": "image/jpeg"
        },
        {
            "@category": "standard",
            "@height": "227",
            "@width": "378",
            "@_fa": "true",
            "$": "https://api.elsevier.com/content/object/eid/1-s2.0-S0378778821003923-gr7.jpg?httpAccept=%2A%2F%2A",
            "@multimediatype": "JPEG image file",
            "@type": "IMAGE-DOWNSAMPLED",
            "@size": "32330",
            "@ref": "gr7",
            "@mimetype": "image/jpeg"
        },
        {
            "@category": "standard",
            "@height": "227",
            "@width": "378",
            "@_fa": "true",
            "$": "https://api.elsevier.com/content/object/eid/1-s2.0-S0378778821003923-gr8.jpg?httpAccept=%2A%2F%2A",
            "@multimediatype": "JPEG image file",
            "@type": "IMAGE-DOWNSAMPLED",
            "@size": "25934",
            "@ref": "gr8",
            "@mimetype": "image/jpeg"
        },
        {
            "@category": "standard",
            "@height": "340",
            "@width": "378",
            "@_fa": "true",
            "$": "https://api.elsevier.com/content/object/eid/1-s2.0-S0378778821003923-gr9.jpg?httpAccept=%2A%2F%2A",
            "@multimediatype": "JPEG image file",
            "@type": "IMAGE-DOWNSAMPLED",
            "@size": "26700",
            "@ref": "gr9",
            "@mimetype": "image/jpeg"
        },
        {
            "@category": "standard",
            "@height": "213",
            "@width": "325",
            "@_fa": "true",
            "$": "https://api.elsevier.com/content/object/eid/1-s2.0-S0378778821003923-gr1.jpg?httpAccept=%2A%2F%2A",
            "@multimediatype": "JPEG image file",
            "@type": "IMAGE-DOWNSAMPLED",
            "@size": "18594",
            "@ref": "gr1",
            "@mimetype": "image/jpeg"
        },
        {
            "@category": "thumbnail",
            "@height": "110",
            "@width": "219",
            "@_fa": "true",
            "$": "https://api.elsevier.com/content/object/eid/1-s2.0-S0378778821003923-gr2.sml?httpAccept=%2A%2F%2A",
            "@multimediatype": "GIF image file",
            "@type": "IMAGE-THUMBNAIL",
            "@size": "11130",
            "@ref": "gr2",
            "@mimetype": "image/gif"
        },
        {
            "@category": "thumbnail",
            "@height": "110",
            "@width": "219",
            "@_fa": "true",
            "$": "https://api.elsevier.com/content/object/eid/1-s2.0-S0378778821003923-gr3.sml?httpAccept=%2A%2F%2A",
            "@multimediatype": "GIF image file",
            "@type": "IMAGE-THUMBNAIL",
            "@size": "8893",
            "@ref": "gr3",
            "@mimetype": "image/gif"
        },
        {
            "@category": "thumbnail",
            "@height": "164",
            "@width": "164",
            "@_fa": "true",
            "$": "https://api.elsevier.com/content/object/eid/1-s2.0-S0378778821003923-gr4.sml?httpAccept=%2A%2F%2A",
            "@multimediatype": "GIF image file",
            "@type": "IMAGE-THUMBNAIL",
            "@size": "9952",
            "@ref": "gr4",
            "@mimetype": "image/gif"
        },
        {
            "@category": "thumbnail",
            "@height": "110",
            "@width": "219",
            "@_fa": "true",
            "$": "https://api.elsevier.com/content/object/eid/1-s2.0-S0378778821003923-gr5.sml?httpAccept=%2A%2F%2A",
            "@multimediatype": "GIF image file",
            "@type": "IMAGE-THUMBNAIL",
            "@size": "6275",
            "@ref": "gr5",
            "@mimetype": "image/gif"
        },
        {
            "@category": "thumbnail",
            "@height": "160",
            "@width": "219",
            "@_fa": "true",
            "$": "https://api.elsevier.com/content/object/eid/1-s2.0-S0378778821003923-gr6.sml?httpAccept=%2A%2F%2A",
            "@multimediatype": "GIF image file",
            "@type": "IMAGE-THUMBNAIL",
            "@size": "9796",
            "@ref": "gr6",
            "@mimetype": "image/gif"
        },
        {
            "@category": "thumbnail",
            "@height": "131",
            "@width": "219",
            "@_fa": "true",
            "$": "https://api.elsevier.com/content/object/eid/1-s2.0-S0378778821003923-gr7.sml?httpAccept=%2A%2F%2A",
            "@multimediatype": "GIF image file",
            "@type": "IMAGE-THUMBNAIL",
            "@size": "11458",
            "@ref": "gr7",
            "@mimetype": "image/gif"
        },
        {
            "@category": "thumbnail",
            "@height": "131",
            "@width": "219",
            "@_fa": "true",
            "$": "https://api.elsevier.com/content/object/eid/1-s2.0-S0378778821003923-gr8.sml?httpAccept=%2A%2F%2A",
            "@multimediatype": "GIF image file",
            "@type": "IMAGE-THUMBNAIL",
            "@size": "10508",
            "@ref": "gr8",
            "@mimetype": "image/gif"
        },
        {
            "@category": "thumbnail",
            "@height": "164",
            "@width": "182",
            "@_fa": "true",
            "$": "https://api.elsevier.com/content/object/eid/1-s2.0-S0378778821003923-gr9.sml?httpAccept=%2A%2F%2A",
            "@multimediatype": "GIF image file",
            "@type": "IMAGE-THUMBNAIL",
            "@size": "5904",
            "@ref": "gr9",
            "@mimetype": "image/gif"
        },
        {
            "@category": "thumbnail",
            "@height": "144",
            "@width": "219",
            "@_fa": "true",
            "$": "https://api.elsevier.com/content/object/eid/1-s2.0-S0378778821003923-gr1.sml?httpAccept=%2A%2F%2A",
            "@multimediatype": "GIF image file",
            "@type": "IMAGE-THUMBNAIL",
            "@size": "7681",
            "@ref": "gr1",
            "@mimetype": "image/gif"
        },
        {
            "@category": "high",
            "@height": "837",
            "@width": "1673",
            "@_fa": "true",
            "$": "https://api.elsevier.com/content/object/eid/1-s2.0-S0378778821003923-gr2_lrg.jpg?httpAccept=%2A%2F%2A",
            "@multimediatype": "JPEG image file",
            "@type": "IMAGE-HIGH-RES",
            "@size": "254276",
            "@ref": "gr2",
            "@mimetype": "image/jpeg"
        },
        {
            "@category": "high",
            "@height": "837",
            "@width": "1673",
            "@_fa": "true",
            "$": "https://api.elsevier.com/content/object/eid/1-s2.0-S0378778821003923-gr3_lrg.jpg?httpAccept=%2A%2F%2A",
            "@multimediatype": "JPEG image file",
            "@type": "IMAGE-HIGH-RES",
            "@size": "188616",
            "@ref": "gr3",
            "@mimetype": "image/jpeg"
        },
        {
            "@category": "high",
            "@height": "3150",
            "@width": "3150",
            "@_fa": "true",
            "$": "https://api.elsevier.com/content/object/eid/1-s2.0-S0378778821003923-gr4_lrg.jpg?httpAccept=%2A%2F%2A",
            "@multimediatype": "JPEG image file",
            "@type": "IMAGE-HIGH-RES",
            "@size": "829473",
            "@ref": "gr4",
            "@mimetype": "image/jpeg"
        },
        {
            "@category": "high",
            "@height": "837",
            "@width": "1673",
            "@_fa": "true",
            "$": "https://api.elsevier.com/content/object/eid/1-s2.0-S0378778821003923-gr5_lrg.jpg?httpAccept=%2A%2F%2A",
            "@multimediatype": "JPEG image file",
            "@type": "IMAGE-HIGH-RES",
            "@size": "126829",
            "@ref": "gr5",
            "@mimetype": "image/jpeg"
        },
        {
            "@category": "high",
            "@height": "1221",
            "@width": "1675",
            "@_fa": "true",
            "$": "https://api.elsevier.com/content/object/eid/1-s2.0-S0378778821003923-gr6_lrg.jpg?httpAccept=%2A%2F%2A",
            "@multimediatype": "JPEG image file",
            "@type": "IMAGE-HIGH-RES",
            "@size": "219403",
            "@ref": "gr6",
            "@mimetype": "image/jpeg"
        },
        {
            "@category": "high",
            "@height": "1004",
            "@width": "1673",
            "@_fa": "true",
            "$": "https://api.elsevier.com/content/object/eid/1-s2.0-S0378778821003923-gr7_lrg.jpg?httpAccept=%2A%2F%2A",
            "@multimediatype": "JPEG image file",
            "@type": "IMAGE-HIGH-RES",
            "@size": "264684",
            "@ref": "gr7",
            "@mimetype": "image/jpeg"
        },
        {
            "@category": "high",
            "@height": "1004",
            "@width": "1673",
            "@_fa": "true",
            "$": "https://api.elsevier.com/content/object/eid/1-s2.0-S0378778821003923-gr8_lrg.jpg?httpAccept=%2A%2F%2A",
            "@multimediatype": "JPEG image file",
            "@type": "IMAGE-HIGH-RES",
            "@size": "209876",
            "@ref": "gr8",
            "@mimetype": "image/jpeg"
        },
        {
            "@category": "high",
            "@height": "1506",
            "@width": "1673",
            "@_fa": "true",
            "$": "https://api.elsevier.com/content/object/eid/1-s2.0-S0378778821003923-gr9_lrg.jpg?httpAccept=%2A%2F%2A",
            "@multimediatype": "JPEG image file",
            "@type": "IMAGE-HIGH-RES",
            "@size": "196586",
            "@ref": "gr9",
            "@mimetype": "image/jpeg"
        },
        {
            "@category": "high",
            "@height": "944",
            "@width": "1439",
            "@_fa": "true",
            "$": "https://api.elsevier.com/content/object/eid/1-s2.0-S0378778821003923-gr1_lrg.jpg?httpAccept=%2A%2F%2A",
            "@multimediatype": "JPEG image file",
            "@type": "IMAGE-HIGH-RES",
            "@size": "144127",
            "@ref": "gr1",
            "@mimetype": "image/jpeg"
        },
        {
            "@category": "thumbnail",
            "@_fa": "true",
            "$": "https://api.elsevier.com/content/object/eid/1-s2.0-S0378778821003923-si1.svg?httpAccept=%2A%2F%2A",
            "@multimediatype": "Scalable Vector Graphics file",
            "@type": "ALTIMG",
            "@size": "2436",
            "@ref": "si1",
            "@mimetype": "image/svg+xml"
        },
        {
            "@category": "thumbnail",
            "@_fa": "true",
            "$": "https://api.elsevier.com/content/object/eid/1-s2.0-S0378778821003923-si10.svg?httpAccept=%2A%2F%2A",
            "@multimediatype": "Scalable Vector Graphics file",
            "@type": "ALTIMG",
            "@size": "3672",
            "@ref": "si10",
            "@mimetype": "image/svg+xml"
        },
        {
            "@category": "thumbnail",
            "@_fa": "true",
            "$": "https://api.elsevier.com/content/object/eid/1-s2.0-S0378778821003923-si100.svg?httpAccept=%2A%2F%2A",
            "@multimediatype": "Scalable Vector Graphics file",
            "@type": "ALTIMG",
            "@size": "803",
            "@ref": "si100",
            "@mimetype": "image/svg+xml"
        },
        {
            "@category": "thumbnail",
            "@_fa": "true",
            "$": "https://api.elsevier.com/content/object/eid/1-s2.0-S0378778821003923-si103.svg?httpAccept=%2A%2F%2A",
            "@multimediatype": "Scalable Vector Graphics file",
            "@type": "ALTIMG",
            "@size": "803",
            "@ref": "si103",
            "@mimetype": "image/svg+xml"
        },
        {
            "@category": "thumbnail",
            "@_fa": "true",
            "$": "https://api.elsevier.com/content/object/eid/1-s2.0-S0378778821003923-si106.svg?httpAccept=%2A%2F%2A",
            "@multimediatype": "Scalable Vector Graphics file",
            "@type": "ALTIMG",
            "@size": "803",
            "@ref": "si106",
            "@mimetype": "image/svg+xml"
        },
        {
            "@category": "thumbnail",
            "@_fa": "true",
            "$": "https://api.elsevier.com/content/object/eid/1-s2.0-S0378778821003923-si109.svg?httpAccept=%2A%2F%2A",
            "@multimediatype": "Scalable Vector Graphics file",
            "@type": "ALTIMG",
            "@size": "803",
            "@ref": "si109",
            "@mimetype": "image/svg+xml"
        },
        {
            "@category": "thumbnail",
            "@_fa": "true",
            "$": "https://api.elsevier.com/content/object/eid/1-s2.0-S0378778821003923-si11.svg?httpAccept=%2A%2F%2A",
            "@multimediatype": "Scalable Vector Graphics file",
            "@type": "ALTIMG",
            "@size": "5498",
            "@ref": "si11",
            "@mimetype": "image/svg+xml"
        },
        {
            "@category": "thumbnail",
            "@_fa": "true",
            "$": "https://api.elsevier.com/content/object/eid/1-s2.0-S0378778821003923-si112.svg?httpAccept=%2A%2F%2A",
            "@multimediatype": "Scalable Vector Graphics file",
            "@type": "ALTIMG",
            "@size": "803",
            "@ref": "si112",
            "@mimetype": "image/svg+xml"
        },
        {
            "@category": "thumbnail",
            "@_fa": "true",
            "$": "https://api.elsevier.com/content/object/eid/1-s2.0-S0378778821003923-si115.svg?httpAccept=%2A%2F%2A",
            "@multimediatype": "Scalable Vector Graphics file",
            "@type": "ALTIMG",
            "@size": "803",
            "@ref": "si115",
            "@mimetype": "image/svg+xml"
        },
        {
            "@category": "thumbnail",
            "@_fa": "true",
            "$": "https://api.elsevier.com/content/object/eid/1-s2.0-S0378778821003923-si118.svg?httpAccept=%2A%2F%2A",
            "@multimediatype": "Scalable Vector Graphics file",
            "@type": "ALTIMG",
            "@size": "803",
            "@ref": "si118",
            "@mimetype": "image/svg+xml"
        },
        {
            "@category": "thumbnail",
            "@_fa": "true",
            "$": "https://api.elsevier.com/content/object/eid/1-s2.0-S0378778821003923-si12.svg?httpAccept=%2A%2F%2A",
            "@multimediatype": "Scalable Vector Graphics file",
            "@type": "ALTIMG",
            "@size": "5154",
            "@ref": "si12",
            "@mimetype": "image/svg+xml"
        },
        {
            "@category": "thumbnail",
            "@_fa": "true",
            "$": "https://api.elsevier.com/content/object/eid/1-s2.0-S0378778821003923-si121.svg?httpAccept=%2A%2F%2A",
            "@multimediatype": "Scalable Vector Graphics file",
            "@type": "ALTIMG",
            "@size": "803",
            "@ref": "si121",
            "@mimetype": "image/svg+xml"
        },
        {
            "@category": "thumbnail",
            "@_fa": "true",
            "$": "https://api.elsevier.com/content/object/eid/1-s2.0-S0378778821003923-si124.svg?httpAccept=%2A%2F%2A",
            "@multimediatype": "Scalable Vector Graphics file",
            "@type": "ALTIMG",
            "@size": "803",
            "@ref": "si124",
            "@mimetype": "image/svg+xml"
        },
        {
            "@category": "thumbnail",
            "@_fa": "true",
            "$": "https://api.elsevier.com/content/object/eid/1-s2.0-S0378778821003923-si127.svg?httpAccept=%2A%2F%2A",
            "@multimediatype": "Scalable Vector Graphics file",
            "@type": "ALTIMG",
            "@size": "803",
            "@ref": "si127",
            "@mimetype": "image/svg+xml"
        },
        {
            "@category": "thumbnail",
            "@_fa": "true",
            "$": "https://api.elsevier.com/content/object/eid/1-s2.0-S0378778821003923-si13.svg?httpAccept=%2A%2F%2A",
            "@multimediatype": "Scalable Vector Graphics file",
            "@type": "ALTIMG",
            "@size": "2694",
            "@ref": "si13",
            "@mimetype": "image/svg+xml"
        },
        {
            "@category": "thumbnail",
            "@_fa": "true",
            "$": "https://api.elsevier.com/content/object/eid/1-s2.0-S0378778821003923-si130.svg?httpAccept=%2A%2F%2A",
            "@multimediatype": "Scalable Vector Graphics file",
            "@type": "ALTIMG",
            "@size": "803",
            "@ref": "si130",
            "@mimetype": "image/svg+xml"
        },
        {
            "@category": "thumbnail",
            "@_fa": "true",
            "$": "https://api.elsevier.com/content/object/eid/1-s2.0-S0378778821003923-si133.svg?httpAccept=%2A%2F%2A",
            "@multimediatype": "Scalable Vector Graphics file",
            "@type": "ALTIMG",
            "@size": "803",
            "@ref": "si133",
            "@mimetype": "image/svg+xml"
        },
        {
            "@category": "thumbnail",
            "@_fa": "true",
            "$": "https://api.elsevier.com/content/object/eid/1-s2.0-S0378778821003923-si136.svg?httpAccept=%2A%2F%2A",
            "@multimediatype": "Scalable Vector Graphics file",
            "@type": "ALTIMG",
            "@size": "803",
            "@ref": "si136",
            "@mimetype": "image/svg+xml"
        },
        {
            "@category": "thumbnail",
            "@_fa": "true",
            "$": "https://api.elsevier.com/content/object/eid/1-s2.0-S0378778821003923-si139.svg?httpAccept=%2A%2F%2A",
            "@multimediatype": "Scalable Vector Graphics file",
            "@type": "ALTIMG",
            "@size": "803",
            "@ref": "si139",
            "@mimetype": "image/svg+xml"
        },
        {
            "@category": "thumbnail",
            "@_fa": "true",
            "$": "https://api.elsevier.com/content/object/eid/1-s2.0-S0378778821003923-si14.svg?httpAccept=%2A%2F%2A",
            "@multimediatype": "Scalable Vector Graphics file",
            "@type": "ALTIMG",
            "@size": "4230",
            "@ref": "si14",
            "@mimetype": "image/svg+xml"
        },
        {
            "@category": "thumbnail",
            "@_fa": "true",
            "$": "https://api.elsevier.com/content/object/eid/1-s2.0-S0378778821003923-si142.svg?httpAccept=%2A%2F%2A",
            "@multimediatype": "Scalable Vector Graphics file",
            "@type": "ALTIMG",
            "@size": "804",
            "@ref": "si142",
            "@mimetype": "image/svg+xml"
        },
        {
            "@category": "thumbnail",
            "@_fa": "true",
            "$": "https://api.elsevier.com/content/object/eid/1-s2.0-S0378778821003923-si145.svg?httpAccept=%2A%2F%2A",
            "@multimediatype": "Scalable Vector Graphics file",
            "@type": "ALTIMG",
            "@size": "804",
            "@ref": "si145",
            "@mimetype": "image/svg+xml"
        },
        {
            "@category": "thumbnail",
            "@_fa": "true",
            "$": "https://api.elsevier.com/content/object/eid/1-s2.0-S0378778821003923-si148.svg?httpAccept=%2A%2F%2A",
            "@multimediatype": "Scalable Vector Graphics file",
            "@type": "ALTIMG",
            "@size": "804",
            "@ref": "si148",
            "@mimetype": "image/svg+xml"
        },
        {
            "@category": "thumbnail",
            "@_fa": "true",
            "$": "https://api.elsevier.com/content/object/eid/1-s2.0-S0378778821003923-si15.svg?httpAccept=%2A%2F%2A",
            "@multimediatype": "Scalable Vector Graphics file",
            "@type": "ALTIMG",
            "@size": "4054",
            "@ref": "si15",
            "@mimetype": "image/svg+xml"
        },
        {
            "@category": "thumbnail",
            "@_fa": "true",
            "$": "https://api.elsevier.com/content/object/eid/1-s2.0-S0378778821003923-si151.svg?httpAccept=%2A%2F%2A",
            "@multimediatype": "Scalable Vector Graphics file",
            "@type": "ALTIMG",
            "@size": "804",
            "@ref": "si151",
            "@mimetype": "image/svg+xml"
        },
        {
            "@category": "thumbnail",
            "@_fa": "true",
            "$": "https://api.elsevier.com/content/object/eid/1-s2.0-S0378778821003923-si154.svg?httpAccept=%2A%2F%2A",
            "@multimediatype": "Scalable Vector Graphics file",
            "@type": "ALTIMG",
            "@size": "804",
            "@ref": "si154",
            "@mimetype": "image/svg+xml"
        },
        {
            "@category": "thumbnail",
            "@_fa": "true",
            "$": "https://api.elsevier.com/content/object/eid/1-s2.0-S0378778821003923-si157.svg?httpAccept=%2A%2F%2A",
            "@multimediatype": "Scalable Vector Graphics file",
            "@type": "ALTIMG",
            "@size": "804",
            "@ref": "si157",
            "@mimetype": "image/svg+xml"
        },
        {
            "@category": "thumbnail",
            "@_fa": "true",
            "$": "https://api.elsevier.com/content/object/eid/1-s2.0-S0378778821003923-si159.svg?httpAccept=%2A%2F%2A",
            "@multimediatype": "Scalable Vector Graphics file",
            "@type": "ALTIMG",
            "@size": "2629",
            "@ref": "si159",
            "@mimetype": "image/svg+xml"
        },
        {
            "@category": "thumbnail",
            "@_fa": "true",
            "$": "https://api.elsevier.com/content/object/eid/1-s2.0-S0378778821003923-si16.svg?httpAccept=%2A%2F%2A",
            "@multimediatype": "Scalable Vector Graphics file",
            "@type": "ALTIMG",
            "@size": "4357",
            "@ref": "si16",
            "@mimetype": "image/svg+xml"
        },
        {
            "@category": "thumbnail",
            "@_fa": "true",
            "$": "https://api.elsevier.com/content/object/eid/1-s2.0-S0378778821003923-si160.svg?httpAccept=%2A%2F%2A",
            "@multimediatype": "Scalable Vector Graphics file",
            "@type": "ALTIMG",
            "@size": "4231",
            "@ref": "si160",
            "@mimetype": "image/svg+xml"
        },
        {
            "@category": "thumbnail",
            "@_fa": "true",
            "$": "https://api.elsevier.com/content/object/eid/1-s2.0-S0378778821003923-si161.svg?httpAccept=%2A%2F%2A",
            "@multimediatype": "Scalable Vector Graphics file",
            "@type": "ALTIMG",
            "@size": "4054",
            "@ref": "si161",
            "@mimetype": "image/svg+xml"
        },
        {
            "@category": "thumbnail",
            "@_fa": "true",
            "$": "https://api.elsevier.com/content/object/eid/1-s2.0-S0378778821003923-si162.svg?httpAccept=%2A%2F%2A",
            "@multimediatype": "Scalable Vector Graphics file",
            "@type": "ALTIMG",
            "@size": "4357",
            "@ref": "si162",
            "@mimetype": "image/svg+xml"
        },
        {
            "@category": "thumbnail",
            "@_fa": "true",
            "$": "https://api.elsevier.com/content/object/eid/1-s2.0-S0378778821003923-si163.svg?httpAccept=%2A%2F%2A",
            "@multimediatype": "Scalable Vector Graphics file",
            "@type": "ALTIMG",
            "@size": "4287",
            "@ref": "si163",
            "@mimetype": "image/svg+xml"
        },
        {
            "@category": "thumbnail",
            "@_fa": "true",
            "$": "https://api.elsevier.com/content/object/eid/1-s2.0-S0378778821003923-si164.svg?httpAccept=%2A%2F%2A",
            "@multimediatype": "Scalable Vector Graphics file",
            "@type": "ALTIMG",
            "@size": "11574",
            "@ref": "si164",
            "@mimetype": "image/svg+xml"
        },
        {
            "@category": "thumbnail",
            "@_fa": "true",
            "$": "https://api.elsevier.com/content/object/eid/1-s2.0-S0378778821003923-si165.svg?httpAccept=%2A%2F%2A",
            "@multimediatype": "Scalable Vector Graphics file",
            "@type": "ALTIMG",
            "@size": "5513",
            "@ref": "si165",
            "@mimetype": "image/svg+xml"
        },
        {
            "@category": "thumbnail",
            "@_fa": "true",
            "$": "https://api.elsevier.com/content/object/eid/1-s2.0-S0378778821003923-si166.svg?httpAccept=%2A%2F%2A",
            "@multimediatype": "Scalable Vector Graphics file",
            "@type": "ALTIMG",
            "@size": "3715",
            "@ref": "si166",
            "@mimetype": "image/svg+xml"
        },
        {
            "@category": "thumbnail",
            "@_fa": "true",
            "$": "https://api.elsevier.com/content/object/eid/1-s2.0-S0378778821003923-si167.svg?httpAccept=%2A%2F%2A",
            "@multimediatype": "Scalable Vector Graphics file",
            "@type": "ALTIMG",
            "@size": "4677",
            "@ref": "si167",
            "@mimetype": "image/svg+xml"
        },
        {
            "@category": "thumbnail",
            "@_fa": "true",
            "$": "https://api.elsevier.com/content/object/eid/1-s2.0-S0378778821003923-si168.svg?httpAccept=%2A%2F%2A",
            "@multimediatype": "Scalable Vector Graphics file",
            "@type": "ALTIMG",
            "@size": "4612",
            "@ref": "si168",
            "@mimetype": "image/svg+xml"
        },
        {
            "@category": "thumbnail",
            "@_fa": "true",
            "$": "https://api.elsevier.com/content/object/eid/1-s2.0-S0378778821003923-si169.svg?httpAccept=%2A%2F%2A",
            "@multimediatype": "Scalable Vector Graphics file",
            "@type": "ALTIMG",
            "@size": "5297",
            "@ref": "si169",
            "@mimetype": "image/svg+xml"
        },
        {
            "@category": "thumbnail",
            "@_fa": "true",
            "$": "https://api.elsevier.com/content/object/eid/1-s2.0-S0378778821003923-si17.svg?httpAccept=%2A%2F%2A",
            "@multimediatype": "Scalable Vector Graphics file",
            "@type": "ALTIMG",
            "@size": "4287",
            "@ref": "si17",
            "@mimetype": "image/svg+xml"
        },
        {
            "@category": "thumbnail",
            "@_fa": "true",
            "$": "https://api.elsevier.com/content/object/eid/1-s2.0-S0378778821003923-si170.svg?httpAccept=%2A%2F%2A",
            "@multimediatype": "Scalable Vector Graphics file",
            "@type": "ALTIMG",
            "@size": "3153",
            "@ref": "si170",
            "@mimetype": "image/svg+xml"
        },
        {
            "@category": "thumbnail",
            "@_fa": "true",
            "$": "https://api.elsevier.com/content/object/eid/1-s2.0-S0378778821003923-si171.svg?httpAccept=%2A%2F%2A",
            "@multimediatype": "Scalable Vector Graphics file",
            "@type": "ALTIMG",
            "@size": "1626",
            "@ref": "si171",
            "@mimetype": "image/svg+xml"
        },
        {
            "@category": "thumbnail",
            "@_fa": "true",
            "$": "https://api.elsevier.com/content/object/eid/1-s2.0-S0378778821003923-si172.svg?httpAccept=%2A%2F%2A",
            "@multimediatype": "Scalable Vector Graphics file",
            "@type": "ALTIMG",
            "@size": "30188",
            "@ref": "si172",
            "@mimetype": "image/svg+xml"
        },
        {
            "@category": "thumbnail",
            "@_fa": "true",
            "$": "https://api.elsevier.com/content/object/eid/1-s2.0-S0378778821003923-si173.svg?httpAccept=%2A%2F%2A",
            "@multimediatype": "Scalable Vector Graphics file",
            "@type": "ALTIMG",
            "@size": "4104",
            "@ref": "si173",
            "@mimetype": "image/svg+xml"
        },
        {
            "@category": "thumbnail",
            "@_fa": "true",
            "$": "https://api.elsevier.com/content/object/eid/1-s2.0-S0378778821003923-si174.svg?httpAccept=%2A%2F%2A",
            "@multimediatype": "Scalable Vector Graphics file",
            "@type": "ALTIMG",
            "@size": "2754",
            "@ref": "si174",
            "@mimetype": "image/svg+xml"
        },
        {
            "@category": "thumbnail",
            "@_fa": "true",
            "$": "https://api.elsevier.com/content/object/eid/1-s2.0-S0378778821003923-si175.svg?httpAccept=%2A%2F%2A",
            "@multimediatype": "Scalable Vector Graphics file",
            "@type": "ALTIMG",
            "@size": "3639",
            "@ref": "si175",
            "@mimetype": "image/svg+xml"
        },
        {
            "@category": "thumbnail",
            "@_fa": "true",
            "$": "https://api.elsevier.com/content/object/eid/1-s2.0-S0378778821003923-si176.svg?httpAccept=%2A%2F%2A",
            "@multimediatype": "Scalable Vector Graphics file",
            "@type": "ALTIMG",
            "@size": "23331",
            "@ref": "si176",
            "@mimetype": "image/svg+xml"
        },
        {
            "@category": "thumbnail",
            "@_fa": "true",
            "$": "https://api.elsevier.com/content/object/eid/1-s2.0-S0378778821003923-si177.svg?httpAccept=%2A%2F%2A",
            "@multimediatype": "Scalable Vector Graphics file",
            "@type": "ALTIMG",
            "@size": "10479",
            "@ref": "si177",
            "@mimetype": "image/svg+xml"
        },
        {
            "@category": "thumbnail",
            "@_fa": "true",
            "$": "https://api.elsevier.com/content/object/eid/1-s2.0-S0378778821003923-si178.svg?httpAccept=%2A%2F%2A",
            "@multimediatype": "Scalable Vector Graphics file",
            "@type": "ALTIMG",
            "@size": "18696",
            "@ref": "si178",
            "@mimetype": "image/svg+xml"
        },
        {
            "@category": "thumbnail",
            "@_fa": "true",
            "$": "https://api.elsevier.com/content/object/eid/1-s2.0-S0378778821003923-si179.svg?httpAccept=%2A%2F%2A",
            "@multimediatype": "Scalable Vector Graphics file",
            "@type": "ALTIMG",
            "@size": "21838",
            "@ref": "si179",
            "@mimetype": "image/svg+xml"
        },
        {
            "@category": "thumbnail",
            "@_fa": "true",
            "$": "https://api.elsevier.com/content/object/eid/1-s2.0-S0378778821003923-si18.svg?httpAccept=%2A%2F%2A",
            "@multimediatype": "Scalable Vector Graphics file",
            "@type": "ALTIMG",
            "@size": "2438",
            "@ref": "si18",
            "@mimetype": "image/svg+xml"
        },
        {
            "@category": "thumbnail",
            "@_fa": "true",
            "$": "https://api.elsevier.com/content/object/eid/1-s2.0-S0378778821003923-si180.svg?httpAccept=%2A%2F%2A",
            "@multimediatype": "Scalable Vector Graphics file",
            "@type": "ALTIMG",
            "@size": "21262",
            "@ref": "si180",
            "@mimetype": "image/svg+xml"
        },
        {
            "@category": "thumbnail",
            "@_fa": "true",
            "$": "https://api.elsevier.com/content/object/eid/1-s2.0-S0378778821003923-si181.svg?httpAccept=%2A%2F%2A",
            "@multimediatype": "Scalable Vector Graphics file",
            "@type": "ALTIMG",
            "@size": "11060",
            "@ref": "si181",
            "@mimetype": "image/svg+xml"
        },
        {
            "@category": "thumbnail",
            "@_fa": "true",
            "$": "https://api.elsevier.com/content/object/eid/1-s2.0-S0378778821003923-si182.svg?httpAccept=%2A%2F%2A",
            "@multimediatype": "Scalable Vector Graphics file",
            "@type": "ALTIMG",
            "@size": "5280",
            "@ref": "si182",
            "@mimetype": "image/svg+xml"
        },
        {
            "@category": "thumbnail",
            "@_fa": "true",
            "$": "https://api.elsevier.com/content/object/eid/1-s2.0-S0378778821003923-si183.svg?httpAccept=%2A%2F%2A",
            "@multimediatype": "Scalable Vector Graphics file",
            "@type": "ALTIMG",
            "@size": "5913",
            "@ref": "si183",
            "@mimetype": "image/svg+xml"
        },
        {
            "@category": "thumbnail",
            "@_fa": "true",
            "$": "https://api.elsevier.com/content/object/eid/1-s2.0-S0378778821003923-si184.svg?httpAccept=%2A%2F%2A",
            "@multimediatype": "Scalable Vector Graphics file",
            "@type": "ALTIMG",
            "@size": "2306",
            "@ref": "si184",
            "@mimetype": "image/svg+xml"
        },
        {
            "@category": "thumbnail",
            "@_fa": "true",
            "$": "https://api.elsevier.com/content/object/eid/1-s2.0-S0378778821003923-si185.svg?httpAccept=%2A%2F%2A",
            "@multimediatype": "Scalable Vector Graphics file",
            "@type": "ALTIMG",
            "@size": "11830",
            "@ref": "si185",
            "@mimetype": "image/svg+xml"
        },
        {
            "@category": "thumbnail",
            "@_fa": "true",
            "$": "https://api.elsevier.com/content/object/eid/1-s2.0-S0378778821003923-si186.svg?httpAccept=%2A%2F%2A",
            "@multimediatype": "Scalable Vector Graphics file",
            "@type": "ALTIMG",
            "@size": "6810",
            "@ref": "si186",
            "@mimetype": "image/svg+xml"
        },
        {
            "@category": "thumbnail",
            "@_fa": "true",
            "$": "https://api.elsevier.com/content/object/eid/1-s2.0-S0378778821003923-si187.svg?httpAccept=%2A%2F%2A",
            "@multimediatype": "Scalable Vector Graphics file",
            "@type": "ALTIMG",
            "@size": "5012",
            "@ref": "si187",
            "@mimetype": "image/svg+xml"
        },
        {
            "@category": "thumbnail",
            "@_fa": "true",
            "$": "https://api.elsevier.com/content/object/eid/1-s2.0-S0378778821003923-si188.svg?httpAccept=%2A%2F%2A",
            "@multimediatype": "Scalable Vector Graphics file",
            "@type": "ALTIMG",
            "@size": "3735",
            "@ref": "si188",
            "@mimetype": "image/svg+xml"
        },
        {
            "@category": "thumbnail",
            "@_fa": "true",
            "$": "https://api.elsevier.com/content/object/eid/1-s2.0-S0378778821003923-si189.svg?httpAccept=%2A%2F%2A",
            "@multimediatype": "Scalable Vector Graphics file",
            "@type": "ALTIMG",
            "@size": "3900",
            "@ref": "si189",
            "@mimetype": "image/svg+xml"
        },
        {
            "@category": "thumbnail",
            "@_fa": "true",
            "$": "https://api.elsevier.com/content/object/eid/1-s2.0-S0378778821003923-si19.svg?httpAccept=%2A%2F%2A",
            "@multimediatype": "Scalable Vector Graphics file",
            "@type": "ALTIMG",
            "@size": "3618",
            "@ref": "si19",
            "@mimetype": "image/svg+xml"
        },
        {
            "@category": "thumbnail",
            "@_fa": "true",
            "$": "https://api.elsevier.com/content/object/eid/1-s2.0-S0378778821003923-si190.svg?httpAccept=%2A%2F%2A",
            "@multimediatype": "Scalable Vector Graphics file",
            "@type": "ALTIMG",
            "@size": "28897",
            "@ref": "si190",
            "@mimetype": "image/svg+xml"
        },
        {
            "@category": "thumbnail",
            "@_fa": "true",
            "$": "https://api.elsevier.com/content/object/eid/1-s2.0-S0378778821003923-si191.svg?httpAccept=%2A%2F%2A",
            "@multimediatype": "Scalable Vector Graphics file",
            "@type": "ALTIMG",
            "@size": "18583",
            "@ref": "si191",
            "@mimetype": "image/svg+xml"
        },
        {
            "@category": "thumbnail",
            "@_fa": "true",
            "$": "https://api.elsevier.com/content/object/eid/1-s2.0-S0378778821003923-si192.svg?httpAccept=%2A%2F%2A",
            "@multimediatype": "Scalable Vector Graphics file",
            "@type": "ALTIMG",
            "@size": "1409",
            "@ref": "si192",
            "@mimetype": "image/svg+xml"
        },
        {
            "@category": "thumbnail",
            "@_fa": "true",
            "$": "https://api.elsevier.com/content/object/eid/1-s2.0-S0378778821003923-si193.svg?httpAccept=%2A%2F%2A",
            "@multimediatype": "Scalable Vector Graphics file",
            "@type": "ALTIMG",
            "@size": "3883",
            "@ref": "si193",
            "@mimetype": "image/svg+xml"
        },
        {
            "@category": "thumbnail",
            "@_fa": "true",
            "$": "https://api.elsevier.com/content/object/eid/1-s2.0-S0378778821003923-si194.svg?httpAccept=%2A%2F%2A",
            "@multimediatype": "Scalable Vector Graphics file",
            "@type": "ALTIMG",
            "@size": "13936",
            "@ref": "si194",
            "@mimetype": "image/svg+xml"
        },
        {
            "@category": "thumbnail",
            "@_fa": "true",
            "$": "https://api.elsevier.com/content/object/eid/1-s2.0-S0378778821003923-si195.svg?httpAccept=%2A%2F%2A",
            "@multimediatype": "Scalable Vector Graphics file",
            "@type": "ALTIMG",
            "@size": "6598",
            "@ref": "si195",
            "@mimetype": "image/svg+xml"
        },
        {
            "@category": "thumbnail",
            "@_fa": "true",
            "$": "https://api.elsevier.com/content/object/eid/1-s2.0-S0378778821003923-si196.svg?httpAccept=%2A%2F%2A",
            "@multimediatype": "Scalable Vector Graphics file",
            "@type": "ALTIMG",
            "@size": "2550",
            "@ref": "si196",
            "@mimetype": "image/svg+xml"
        },
        {
            "@category": "thumbnail",
            "@_fa": "true",
            "$": "https://api.elsevier.com/content/object/eid/1-s2.0-S0378778821003923-si197.svg?httpAccept=%2A%2F%2A",
            "@multimediatype": "Scalable Vector Graphics file",
            "@type": "ALTIMG",
            "@size": "4456",
            "@ref": "si197",
            "@mimetype": "image/svg+xml"
        },
        {
            "@category": "thumbnail",
            "@_fa": "true",
            "$": "https://api.elsevier.com/content/object/eid/1-s2.0-S0378778821003923-si198.svg?httpAccept=%2A%2F%2A",
            "@multimediatype": "Scalable Vector Graphics file",
            "@type": "ALTIMG",
            "@size": "7104",
            "@ref": "si198",
            "@mimetype": "image/svg+xml"
        },
        {
            "@category": "thumbnail",
            "@_fa": "true",
            "$": "https://api.elsevier.com/content/object/eid/1-s2.0-S0378778821003923-si199.svg?httpAccept=%2A%2F%2A",
            "@multimediatype": "Scalable Vector Graphics file",
            "@type": "ALTIMG",
            "@size": "6465",
            "@ref": "si199",
            "@mimetype": "image/svg+xml"
        },
        {
            "@category": "thumbnail",
            "@_fa": "true",
            "$": "https://api.elsevier.com/content/object/eid/1-s2.0-S0378778821003923-si2.svg?httpAccept=%2A%2F%2A",
            "@multimediatype": "Scalable Vector Graphics file",
            "@type": "ALTIMG",
            "@size": "2613",
            "@ref": "si2",
            "@mimetype": "image/svg+xml"
        },
        {
            "@category": "thumbnail",
            "@_fa": "true",
            "$": "https://api.elsevier.com/content/object/eid/1-s2.0-S0378778821003923-si20.svg?httpAccept=%2A%2F%2A",
            "@multimediatype": "Scalable Vector Graphics file",
            "@type": "ALTIMG",
            "@size": "2438",
            "@ref": "si20",
            "@mimetype": "image/svg+xml"
        },
        {
            "@category": "thumbnail",
            "@_fa": "true",
            "$": "https://api.elsevier.com/content/object/eid/1-s2.0-S0378778821003923-si200.svg?httpAccept=%2A%2F%2A",
            "@multimediatype": "Scalable Vector Graphics file",
            "@type": "ALTIMG",
            "@size": "17634",
            "@ref": "si200",
            "@mimetype": "image/svg+xml"
        },
        {
            "@category": "thumbnail",
            "@_fa": "true",
            "$": "https://api.elsevier.com/content/object/eid/1-s2.0-S0378778821003923-si201.svg?httpAccept=%2A%2F%2A",
            "@multimediatype": "Scalable Vector Graphics file",
            "@type": "ALTIMG",
            "@size": "2695",
            "@ref": "si201",
            "@mimetype": "image/svg+xml"
        },
        {
            "@category": "thumbnail",
            "@_fa": "true",
            "$": "https://api.elsevier.com/content/object/eid/1-s2.0-S0378778821003923-si202.svg?httpAccept=%2A%2F%2A",
            "@multimediatype": "Scalable Vector Graphics file",
            "@type": "ALTIMG",
            "@size": "2613",
            "@ref": "si202",
            "@mimetype": "image/svg+xml"
        },
        {
            "@category": "thumbnail",
            "@_fa": "true",
            "$": "https://api.elsevier.com/content/object/eid/1-s2.0-S0378778821003923-si203.svg?httpAccept=%2A%2F%2A",
            "@multimediatype": "Scalable Vector Graphics file",
            "@type": "ALTIMG",
            "@size": "3540",
            "@ref": "si203",
            "@mimetype": "image/svg+xml"
        },
        {
            "@category": "thumbnail",
            "@_fa": "true",
            "$": "https://api.elsevier.com/content/object/eid/1-s2.0-S0378778821003923-si204.svg?httpAccept=%2A%2F%2A",
            "@multimediatype": "Scalable Vector Graphics file",
            "@type": "ALTIMG",
            "@size": "3885",
            "@ref": "si204",
            "@mimetype": "image/svg+xml"
        },
        {
            "@category": "thumbnail",
            "@_fa": "true",
            "$": "https://api.elsevier.com/content/object/eid/1-s2.0-S0378778821003923-si205.svg?httpAccept=%2A%2F%2A",
            "@multimediatype": "Scalable Vector Graphics file",
            "@type": "ALTIMG",
            "@size": "3841",
            "@ref": "si205",
            "@mimetype": "image/svg+xml"
        },
        {
            "@category": "thumbnail",
            "@_fa": "true",
            "$": "https://api.elsevier.com/content/object/eid/1-s2.0-S0378778821003923-si206.svg?httpAccept=%2A%2F%2A",
            "@multimediatype": "Scalable Vector Graphics file",
            "@type": "ALTIMG",
            "@size": "4905",
            "@ref": "si206",
            "@mimetype": "image/svg+xml"
        },
        {
            "@category": "thumbnail",
            "@_fa": "true",
            "$": "https://api.elsevier.com/content/object/eid/1-s2.0-S0378778821003923-si207.svg?httpAccept=%2A%2F%2A",
            "@multimediatype": "Scalable Vector Graphics file",
            "@type": "ALTIMG",
            "@size": "4905",
            "@ref": "si207",
            "@mimetype": "image/svg+xml"
        },
        {
            "@category": "thumbnail",
            "@_fa": "true",
            "$": "https://api.elsevier.com/content/object/eid/1-s2.0-S0378778821003923-si208.svg?httpAccept=%2A%2F%2A",
            "@multimediatype": "Scalable Vector Graphics file",
            "@type": "ALTIMG",
            "@size": "3885",
            "@ref": "si208",
            "@mimetype": "image/svg+xml"
        },
        {
            "@category": "thumbnail",
            "@_fa": "true",
            "$": "https://api.elsevier.com/content/object/eid/1-s2.0-S0378778821003923-si209.svg?httpAccept=%2A%2F%2A",
            "@multimediatype": "Scalable Vector Graphics file",
            "@type": "ALTIMG",
            "@size": "16117",
            "@ref": "si209",
            "@mimetype": "image/svg+xml"
        },
        {
            "@category": "thumbnail",
            "@_fa": "true",
            "$": "https://api.elsevier.com/content/object/eid/1-s2.0-S0378778821003923-si21.svg?httpAccept=%2A%2F%2A",
            "@multimediatype": "Scalable Vector Graphics file",
            "@type": "ALTIMG",
            "@size": "1409",
            "@ref": "si21",
            "@mimetype": "image/svg+xml"
        },
        {
            "@category": "thumbnail",
            "@_fa": "true",
            "$": "https://api.elsevier.com/content/object/eid/1-s2.0-S0378778821003923-si210.svg?httpAccept=%2A%2F%2A",
            "@multimediatype": "Scalable Vector Graphics file",
            "@type": "ALTIMG",
            "@size": "29496",
            "@ref": "si210",
            "@mimetype": "image/svg+xml"
        },
        {
            "@category": "thumbnail",
            "@_fa": "true",
            "$": "https://api.elsevier.com/content/object/eid/1-s2.0-S0378778821003923-si211.svg?httpAccept=%2A%2F%2A",
            "@multimediatype": "Scalable Vector Graphics file",
            "@type": "ALTIMG",
            "@size": "19070",
            "@ref": "si211",
            "@mimetype": "image/svg+xml"
        },
        {
            "@category": "thumbnail",
            "@_fa": "true",
            "$": "https://api.elsevier.com/content/object/eid/1-s2.0-S0378778821003923-si212.svg?httpAccept=%2A%2F%2A",
            "@multimediatype": "Scalable Vector Graphics file",
            "@type": "ALTIMG",
            "@size": "24632",
            "@ref": "si212",
            "@mimetype": "image/svg+xml"
        },
        {
            "@category": "thumbnail",
            "@_fa": "true",
            "$": "https://api.elsevier.com/content/object/eid/1-s2.0-S0378778821003923-si213.svg?httpAccept=%2A%2F%2A",
            "@multimediatype": "Scalable Vector Graphics file",
            "@type": "ALTIMG",
            "@size": "21838",
            "@ref": "si213",
            "@mimetype": "image/svg+xml"
        },
        {
            "@category": "thumbnail",
            "@_fa": "true",
            "$": "https://api.elsevier.com/content/object/eid/1-s2.0-S0378778821003923-si214.svg?httpAccept=%2A%2F%2A",
            "@multimediatype": "Scalable Vector Graphics file",
            "@type": "ALTIMG",
            "@size": "21262",
            "@ref": "si214",
            "@mimetype": "image/svg+xml"
        },
        {
            "@category": "thumbnail",
            "@_fa": "true",
            "$": "https://api.elsevier.com/content/object/eid/1-s2.0-S0378778821003923-si215.svg?httpAccept=%2A%2F%2A",
            "@multimediatype": "Scalable Vector Graphics file",
            "@type": "ALTIMG",
            "@size": "16361",
            "@ref": "si215",
            "@mimetype": "image/svg+xml"
        },
        {
            "@category": "thumbnail",
            "@_fa": "true",
            "$": "https://api.elsevier.com/content/object/eid/1-s2.0-S0378778821003923-si216.svg?httpAccept=%2A%2F%2A",
            "@multimediatype": "Scalable Vector Graphics file",
            "@type": "ALTIMG",
            "@size": "16439",
            "@ref": "si216",
            "@mimetype": "image/svg+xml"
        },
        {
            "@category": "thumbnail",
            "@_fa": "true",
            "$": "https://api.elsevier.com/content/object/eid/1-s2.0-S0378778821003923-si217.svg?httpAccept=%2A%2F%2A",
            "@multimediatype": "Scalable Vector Graphics file",
            "@type": "ALTIMG",
            "@size": "3762",
            "@ref": "si217",
            "@mimetype": "image/svg+xml"
        },
        {
            "@category": "thumbnail",
            "@_fa": "true",
            "$": "https://api.elsevier.com/content/object/eid/1-s2.0-S0378778821003923-si218.svg?httpAccept=%2A%2F%2A",
            "@multimediatype": "Scalable Vector Graphics file",
            "@type": "ALTIMG",
            "@size": "3735",
            "@ref": "si218",
            "@mimetype": "image/svg+xml"
        },
        {
            "@category": "thumbnail",
            "@_fa": "true",
            "$": "https://api.elsevier.com/content/object/eid/1-s2.0-S0378778821003923-si219.svg?httpAccept=%2A%2F%2A",
            "@multimediatype": "Scalable Vector Graphics file",
            "@type": "ALTIMG",
            "@size": "3900",
            "@ref": "si219",
            "@mimetype": "image/svg+xml"
        },
        {
            "@category": "thumbnail",
            "@_fa": "true",
            "$": "https://api.elsevier.com/content/object/eid/1-s2.0-S0378778821003923-si22.svg?httpAccept=%2A%2F%2A",
            "@multimediatype": "Scalable Vector Graphics file",
            "@type": "ALTIMG",
            "@size": "3618",
            "@ref": "si22",
            "@mimetype": "image/svg+xml"
        },
        {
            "@category": "thumbnail",
            "@_fa": "true",
            "$": "https://api.elsevier.com/content/object/eid/1-s2.0-S0378778821003923-si220.svg?httpAccept=%2A%2F%2A",
            "@multimediatype": "Scalable Vector Graphics file",
            "@type": "ALTIMG",
            "@size": "11830",
            "@ref": "si220",
            "@mimetype": "image/svg+xml"
        },
        {
            "@category": "thumbnail",
            "@_fa": "true",
            "$": "https://api.elsevier.com/content/object/eid/1-s2.0-S0378778821003923-si221.svg?httpAccept=%2A%2F%2A",
            "@multimediatype": "Scalable Vector Graphics file",
            "@type": "ALTIMG",
            "@size": "19959",
            "@ref": "si221",
            "@mimetype": "image/svg+xml"
        },
        {
            "@category": "thumbnail",
            "@_fa": "true",
            "$": "https://api.elsevier.com/content/object/eid/1-s2.0-S0378778821003923-si222.svg?httpAccept=%2A%2F%2A",
            "@multimediatype": "Scalable Vector Graphics file",
            "@type": "ALTIMG",
            "@size": "25978",
            "@ref": "si222",
            "@mimetype": "image/svg+xml"
        },
        {
            "@category": "thumbnail",
            "@_fa": "true",
            "$": "https://api.elsevier.com/content/object/eid/1-s2.0-S0378778821003923-si223.svg?httpAccept=%2A%2F%2A",
            "@multimediatype": "Scalable Vector Graphics file",
            "@type": "ALTIMG",
            "@size": "1799",
            "@ref": "si223",
            "@mimetype": "image/svg+xml"
        },
        {
            "@category": "thumbnail",
            "@_fa": "true",
            "$": "https://api.elsevier.com/content/object/eid/1-s2.0-S0378778821003923-si224.svg?httpAccept=%2A%2F%2A",
            "@multimediatype": "Scalable Vector Graphics file",
            "@type": "ALTIMG",
            "@size": "9396",
            "@ref": "si224",
            "@mimetype": "image/svg+xml"
        },
        {
            "@category": "thumbnail",
            "@_fa": "true",
            "$": "https://api.elsevier.com/content/object/eid/1-s2.0-S0378778821003923-si225.svg?httpAccept=%2A%2F%2A",
            "@multimediatype": "Scalable Vector Graphics file",
            "@type": "ALTIMG",
            "@size": "1799",
            "@ref": "si225",
            "@mimetype": "image/svg+xml"
        },
        {
            "@category": "thumbnail",
            "@_fa": "true",
            "$": "https://api.elsevier.com/content/object/eid/1-s2.0-S0378778821003923-si226.svg?httpAccept=%2A%2F%2A",
            "@multimediatype": "Scalable Vector Graphics file",
            "@type": "ALTIMG",
            "@size": "4684",
            "@ref": "si226",
            "@mimetype": "image/svg+xml"
        },
        {
            "@category": "thumbnail",
            "@_fa": "true",
            "$": "https://api.elsevier.com/content/object/eid/1-s2.0-S0378778821003923-si227.svg?httpAccept=%2A%2F%2A",
            "@multimediatype": "Scalable Vector Graphics file",
            "@type": "ALTIMG",
            "@size": "4684",
            "@ref": "si227",
            "@mimetype": "image/svg+xml"
        },
        {
            "@category": "thumbnail",
            "@_fa": "true",
            "$": "https://api.elsevier.com/content/object/eid/1-s2.0-S0378778821003923-si228.svg?httpAccept=%2A%2F%2A",
            "@multimediatype": "Scalable Vector Graphics file",
            "@type": "ALTIMG",
            "@size": "1799",
            "@ref": "si228",
            "@mimetype": "image/svg+xml"
        },
        {
            "@category": "thumbnail",
            "@_fa": "true",
            "$": "https://api.elsevier.com/content/object/eid/1-s2.0-S0378778821003923-si229.svg?httpAccept=%2A%2F%2A",
            "@multimediatype": "Scalable Vector Graphics file",
            "@type": "ALTIMG",
            "@size": "5964",
            "@ref": "si229",
            "@mimetype": "image/svg+xml"
        },
        {
            "@category": "thumbnail",
            "@_fa": "true",
            "$": "https://api.elsevier.com/content/object/eid/1-s2.0-S0378778821003923-si23.svg?httpAccept=%2A%2F%2A",
            "@multimediatype": "Scalable Vector Graphics file",
            "@type": "ALTIMG",
            "@size": "4231",
            "@ref": "si23",
            "@mimetype": "image/svg+xml"
        },
        {
            "@category": "thumbnail",
            "@_fa": "true",
            "$": "https://api.elsevier.com/content/object/eid/1-s2.0-S0378778821003923-si230.svg?httpAccept=%2A%2F%2A",
            "@multimediatype": "Scalable Vector Graphics file",
            "@type": "ALTIMG",
            "@size": "4684",
            "@ref": "si230",
            "@mimetype": "image/svg+xml"
        },
        {
            "@category": "thumbnail",
            "@_fa": "true",
            "$": "https://api.elsevier.com/content/object/eid/1-s2.0-S0378778821003923-si231.svg?httpAccept=%2A%2F%2A",
            "@multimediatype": "Scalable Vector Graphics file",
            "@type": "ALTIMG",
            "@size": "4684",
            "@ref": "si231",
            "@mimetype": "image/svg+xml"
        },
        {
            "@category": "thumbnail",
            "@_fa": "true",
            "$": "https://api.elsevier.com/content/object/eid/1-s2.0-S0378778821003923-si232.svg?httpAccept=%2A%2F%2A",
            "@multimediatype": "Scalable Vector Graphics file",
            "@type": "ALTIMG",
            "@size": "9171",
            "@ref": "si232",
            "@mimetype": "image/svg+xml"
        },
        {
            "@category": "thumbnail",
            "@_fa": "true",
            "$": "https://api.elsevier.com/content/object/eid/1-s2.0-S0378778821003923-si233.svg?httpAccept=%2A%2F%2A",
            "@multimediatype": "Scalable Vector Graphics file",
            "@type": "ALTIMG",
            "@size": "5902",
            "@ref": "si233",
            "@mimetype": "image/svg+xml"
        },
        {
            "@category": "thumbnail",
            "@_fa": "true",
            "$": "https://api.elsevier.com/content/object/eid/1-s2.0-S0378778821003923-si234.svg?httpAccept=%2A%2F%2A",
            "@multimediatype": "Scalable Vector Graphics file",
            "@type": "ALTIMG",
            "@size": "5568",
            "@ref": "si234",
            "@mimetype": "image/svg+xml"
        },
        {
            "@category": "thumbnail",
            "@_fa": "true",
            "$": "https://api.elsevier.com/content/object/eid/1-s2.0-S0378778821003923-si235.svg?httpAccept=%2A%2F%2A",
            "@multimediatype": "Scalable Vector Graphics file",
            "@type": "ALTIMG",
            "@size": "4684",
            "@ref": "si235",
            "@mimetype": "image/svg+xml"
        },
        {
            "@category": "thumbnail",
            "@_fa": "true",
            "$": "https://api.elsevier.com/content/object/eid/1-s2.0-S0378778821003923-si236.svg?httpAccept=%2A%2F%2A",
            "@multimediatype": "Scalable Vector Graphics file",
            "@type": "ALTIMG",
            "@size": "1799",
            "@ref": "si236",
            "@mimetype": "image/svg+xml"
        },
        {
            "@category": "thumbnail",
            "@_fa": "true",
            "$": "https://api.elsevier.com/content/object/eid/1-s2.0-S0378778821003923-si237.svg?httpAccept=%2A%2F%2A",
            "@multimediatype": "Scalable Vector Graphics file",
            "@type": "ALTIMG",
            "@size": "4684",
            "@ref": "si237",
            "@mimetype": "image/svg+xml"
        },
        {
            "@category": "thumbnail",
            "@_fa": "true",
            "$": "https://api.elsevier.com/content/object/eid/1-s2.0-S0378778821003923-si238.svg?httpAccept=%2A%2F%2A",
            "@multimediatype": "Scalable Vector Graphics file",
            "@type": "ALTIMG",
            "@size": "11636",
            "@ref": "si238",
            "@mimetype": "image/svg+xml"
        },
        {
            "@category": "thumbnail",
            "@_fa": "true",
            "$": "https://api.elsevier.com/content/object/eid/1-s2.0-S0378778821003923-si239.svg?httpAccept=%2A%2F%2A",
            "@multimediatype": "Scalable Vector Graphics file",
            "@type": "ALTIMG",
            "@size": "4684",
            "@ref": "si239",
            "@mimetype": "image/svg+xml"
        },
        {
            "@category": "thumbnail",
            "@_fa": "true",
            "$": "https://api.elsevier.com/content/object/eid/1-s2.0-S0378778821003923-si24.svg?httpAccept=%2A%2F%2A",
            "@multimediatype": "Scalable Vector Graphics file",
            "@type": "ALTIMG",
            "@size": "4054",
            "@ref": "si24",
            "@mimetype": "image/svg+xml"
        },
        {
            "@category": "thumbnail",
            "@_fa": "true",
            "$": "https://api.elsevier.com/content/object/eid/1-s2.0-S0378778821003923-si240.svg?httpAccept=%2A%2F%2A",
            "@multimediatype": "Scalable Vector Graphics file",
            "@type": "ALTIMG",
            "@size": "1799",
            "@ref": "si240",
            "@mimetype": "image/svg+xml"
        },
        {
            "@category": "thumbnail",
            "@_fa": "true",
            "$": "https://api.elsevier.com/content/object/eid/1-s2.0-S0378778821003923-si241.svg?httpAccept=%2A%2F%2A",
            "@multimediatype": "Scalable Vector Graphics file",
            "@type": "ALTIMG",
            "@size": "1799",
            "@ref": "si241",
            "@mimetype": "image/svg+xml"
        },
        {
            "@category": "thumbnail",
            "@_fa": "true",
            "$": "https://api.elsevier.com/content/object/eid/1-s2.0-S0378778821003923-si242.svg?httpAccept=%2A%2F%2A",
            "@multimediatype": "Scalable Vector Graphics file",
            "@type": "ALTIMG",
            "@size": "4684",
            "@ref": "si242",
            "@mimetype": "image/svg+xml"
        },
        {
            "@category": "thumbnail",
            "@_fa": "true",
            "$": "https://api.elsevier.com/content/object/eid/1-s2.0-S0378778821003923-si243.svg?httpAccept=%2A%2F%2A",
            "@multimediatype": "Scalable Vector Graphics file",
            "@type": "ALTIMG",
            "@size": "10119",
            "@ref": "si243",
            "@mimetype": "image/svg+xml"
        },
        {
            "@category": "thumbnail",
            "@_fa": "true",
            "$": "https://api.elsevier.com/content/object/eid/1-s2.0-S0378778821003923-si244.svg?httpAccept=%2A%2F%2A",
            "@multimediatype": "Scalable Vector Graphics file",
            "@type": "ALTIMG",
            "@size": "2214",
            "@ref": "si244",
            "@mimetype": "image/svg+xml"
        },
        {
            "@category": "thumbnail",
            "@_fa": "true",
            "$": "https://api.elsevier.com/content/object/eid/1-s2.0-S0378778821003923-si245.svg?httpAccept=%2A%2F%2A",
            "@multimediatype": "Scalable Vector Graphics file",
            "@type": "ALTIMG",
            "@size": "1799",
            "@ref": "si245",
            "@mimetype": "image/svg+xml"
        },
        {
            "@category": "thumbnail",
            "@_fa": "true",
            "$": "https://api.elsevier.com/content/object/eid/1-s2.0-S0378778821003923-si246.svg?httpAccept=%2A%2F%2A",
            "@multimediatype": "Scalable Vector Graphics file",
            "@type": "ALTIMG",
            "@size": "9171",
            "@ref": "si246",
            "@mimetype": "image/svg+xml"
        },
        {
            "@category": "thumbnail",
            "@_fa": "true",
            "$": "https://api.elsevier.com/content/object/eid/1-s2.0-S0378778821003923-si247.svg?httpAccept=%2A%2F%2A",
            "@multimediatype": "Scalable Vector Graphics file",
            "@type": "ALTIMG",
            "@size": "4684",
            "@ref": "si247",
            "@mimetype": "image/svg+xml"
        },
        {
            "@category": "thumbnail",
            "@_fa": "true",
            "$": "https://api.elsevier.com/content/object/eid/1-s2.0-S0378778821003923-si248.svg?httpAccept=%2A%2F%2A",
            "@multimediatype": "Scalable Vector Graphics file",
            "@type": "ALTIMG",
            "@size": "9171",
            "@ref": "si248",
            "@mimetype": "image/svg+xml"
        },
        {
            "@category": "thumbnail",
            "@_fa": "true",
            "$": "https://api.elsevier.com/content/object/eid/1-s2.0-S0378778821003923-si249.svg?httpAccept=%2A%2F%2A",
            "@multimediatype": "Scalable Vector Graphics file",
            "@type": "ALTIMG",
            "@size": "4684",
            "@ref": "si249",
            "@mimetype": "image/svg+xml"
        },
        {
            "@category": "thumbnail",
            "@_fa": "true",
            "$": "https://api.elsevier.com/content/object/eid/1-s2.0-S0378778821003923-si25.svg?httpAccept=%2A%2F%2A",
            "@multimediatype": "Scalable Vector Graphics file",
            "@type": "ALTIMG",
            "@size": "4357",
            "@ref": "si25",
            "@mimetype": "image/svg+xml"
        },
        {
            "@category": "thumbnail",
            "@_fa": "true",
            "$": "https://api.elsevier.com/content/object/eid/1-s2.0-S0378778821003923-si250.svg?httpAccept=%2A%2F%2A",
            "@multimediatype": "Scalable Vector Graphics file",
            "@type": "ALTIMG",
            "@size": "4650",
            "@ref": "si250",
            "@mimetype": "image/svg+xml"
        },
        {
            "@category": "thumbnail",
            "@_fa": "true",
            "$": "https://api.elsevier.com/content/object/eid/1-s2.0-S0378778821003923-si251.svg?httpAccept=%2A%2F%2A",
            "@multimediatype": "Scalable Vector Graphics file",
            "@type": "ALTIMG",
            "@size": "6874",
            "@ref": "si251",
            "@mimetype": "image/svg+xml"
        },
        {
            "@category": "thumbnail",
            "@_fa": "true",
            "$": "https://api.elsevier.com/content/object/eid/1-s2.0-S0378778821003923-si252.svg?httpAccept=%2A%2F%2A",
            "@multimediatype": "Scalable Vector Graphics file",
            "@type": "ALTIMG",
            "@size": "5828",
            "@ref": "si252",
            "@mimetype": "image/svg+xml"
        },
        {
            "@category": "thumbnail",
            "@_fa": "true",
            "$": "https://api.elsevier.com/content/object/eid/1-s2.0-S0378778821003923-si253.svg?httpAccept=%2A%2F%2A",
            "@multimediatype": "Scalable Vector Graphics file",
            "@type": "ALTIMG",
            "@size": "4234",
            "@ref": "si253",
            "@mimetype": "image/svg+xml"
        },
        {
            "@category": "thumbnail",
            "@_fa": "true",
            "$": "https://api.elsevier.com/content/object/eid/1-s2.0-S0378778821003923-si254.svg?httpAccept=%2A%2F%2A",
            "@multimediatype": "Scalable Vector Graphics file",
            "@type": "ALTIMG",
            "@size": "10506",
            "@ref": "si254",
            "@mimetype": "image/svg+xml"
        },
        {
            "@category": "thumbnail",
            "@_fa": "true",
            "$": "https://api.elsevier.com/content/object/eid/1-s2.0-S0378778821003923-si255.svg?httpAccept=%2A%2F%2A",
            "@multimediatype": "Scalable Vector Graphics file",
            "@type": "ALTIMG",
            "@size": "6687",
            "@ref": "si255",
            "@mimetype": "image/svg+xml"
        },
        {
            "@category": "thumbnail",
            "@_fa": "true",
            "$": "https://api.elsevier.com/content/object/eid/1-s2.0-S0378778821003923-si256.svg?httpAccept=%2A%2F%2A",
            "@multimediatype": "Scalable Vector Graphics file",
            "@type": "ALTIMG",
            "@size": "9299",
            "@ref": "si256",
            "@mimetype": "image/svg+xml"
        },
        {
            "@category": "thumbnail",
            "@_fa": "true",
            "$": "https://api.elsevier.com/content/object/eid/1-s2.0-S0378778821003923-si257.svg?httpAccept=%2A%2F%2A",
            "@multimediatype": "Scalable Vector Graphics file",
            "@type": "ALTIMG",
            "@size": "6186",
            "@ref": "si257",
            "@mimetype": "image/svg+xml"
        },
        {
            "@category": "thumbnail",
            "@_fa": "true",
            "$": "https://api.elsevier.com/content/object/eid/1-s2.0-S0378778821003923-si258.svg?httpAccept=%2A%2F%2A",
            "@multimediatype": "Scalable Vector Graphics file",
            "@type": "ALTIMG",
            "@size": "9299",
            "@ref": "si258",
            "@mimetype": "image/svg+xml"
        },
        {
            "@category": "thumbnail",
            "@_fa": "true",
            "$": "https://api.elsevier.com/content/object/eid/1-s2.0-S0378778821003923-si259.svg?httpAccept=%2A%2F%2A",
            "@multimediatype": "Scalable Vector Graphics file",
            "@type": "ALTIMG",
            "@size": "16454",
            "@ref": "si259",
            "@mimetype": "image/svg+xml"
        },
        {
            "@category": "thumbnail",
            "@_fa": "true",
            "$": "https://api.elsevier.com/content/object/eid/1-s2.0-S0378778821003923-si26.svg?httpAccept=%2A%2F%2A",
            "@multimediatype": "Scalable Vector Graphics file",
            "@type": "ALTIMG",
            "@size": "4287",
            "@ref": "si26",
            "@mimetype": "image/svg+xml"
        },
        {
            "@category": "thumbnail",
            "@_fa": "true",
            "$": "https://api.elsevier.com/content/object/eid/1-s2.0-S0378778821003923-si260.svg?httpAccept=%2A%2F%2A",
            "@multimediatype": "Scalable Vector Graphics file",
            "@type": "ALTIMG",
            "@size": "8892",
            "@ref": "si260",
            "@mimetype": "image/svg+xml"
        },
        {
            "@category": "thumbnail",
            "@_fa": "true",
            "$": "https://api.elsevier.com/content/object/eid/1-s2.0-S0378778821003923-si261.svg?httpAccept=%2A%2F%2A",
            "@multimediatype": "Scalable Vector Graphics file",
            "@type": "ALTIMG",
            "@size": "8892",
            "@ref": "si261",
            "@mimetype": "image/svg+xml"
        },
        {
            "@category": "thumbnail",
            "@_fa": "true",
            "$": "https://api.elsevier.com/content/object/eid/1-s2.0-S0378778821003923-si262.svg?httpAccept=%2A%2F%2A",
            "@multimediatype": "Scalable Vector Graphics file",
            "@type": "ALTIMG",
            "@size": "8892",
            "@ref": "si262",
            "@mimetype": "image/svg+xml"
        },
        {
            "@category": "thumbnail",
            "@_fa": "true",
            "$": "https://api.elsevier.com/content/object/eid/1-s2.0-S0378778821003923-si263.svg?httpAccept=%2A%2F%2A",
            "@multimediatype": "Scalable Vector Graphics file",
            "@type": "ALTIMG",
            "@size": "14146",
            "@ref": "si263",
            "@mimetype": "image/svg+xml"
        },
        {
            "@category": "thumbnail",
            "@_fa": "true",
            "$": "https://api.elsevier.com/content/object/eid/1-s2.0-S0378778821003923-si264.svg?httpAccept=%2A%2F%2A",
            "@multimediatype": "Scalable Vector Graphics file",
            "@type": "ALTIMG",
            "@size": "9396",
            "@ref": "si264",
            "@mimetype": "image/svg+xml"
        },
        {
            "@category": "thumbnail",
            "@_fa": "true",
            "$": "https://api.elsevier.com/content/object/eid/1-s2.0-S0378778821003923-si265.svg?httpAccept=%2A%2F%2A",
            "@multimediatype": "Scalable Vector Graphics file",
            "@type": "ALTIMG",
            "@size": "9393",
            "@ref": "si265",
            "@mimetype": "image/svg+xml"
        },
        {
            "@category": "thumbnail",
            "@_fa": "true",
            "$": "https://api.elsevier.com/content/object/eid/1-s2.0-S0378778821003923-si266.svg?httpAccept=%2A%2F%2A",
            "@multimediatype": "Scalable Vector Graphics file",
            "@type": "ALTIMG",
            "@size": "8533",
            "@ref": "si266",
            "@mimetype": "image/svg+xml"
        },
        {
            "@category": "thumbnail",
            "@_fa": "true",
            "$": "https://api.elsevier.com/content/object/eid/1-s2.0-S0378778821003923-si267.svg?httpAccept=%2A%2F%2A",
            "@multimediatype": "Scalable Vector Graphics file",
            "@type": "ALTIMG",
            "@size": "9505",
            "@ref": "si267",
            "@mimetype": "image/svg+xml"
        },
        {
            "@category": "thumbnail",
            "@_fa": "true",
            "$": "https://api.elsevier.com/content/object/eid/1-s2.0-S0378778821003923-si268.svg?httpAccept=%2A%2F%2A",
            "@multimediatype": "Scalable Vector Graphics file",
            "@type": "ALTIMG",
            "@size": "14304",
            "@ref": "si268",
            "@mimetype": "image/svg+xml"
        },
        {
            "@category": "thumbnail",
            "@_fa": "true",
            "$": "https://api.elsevier.com/content/object/eid/1-s2.0-S0378778821003923-si269.svg?httpAccept=%2A%2F%2A",
            "@multimediatype": "Scalable Vector Graphics file",
            "@type": "ALTIMG",
            "@size": "6009",
            "@ref": "si269",
            "@mimetype": "image/svg+xml"
        },
        {
            "@category": "thumbnail",
            "@_fa": "true",
            "$": "https://api.elsevier.com/content/object/eid/1-s2.0-S0378778821003923-si270.svg?httpAccept=%2A%2F%2A",
            "@multimediatype": "Scalable Vector Graphics file",
            "@type": "ALTIMG",
            "@size": "3110",
            "@ref": "si270",
            "@mimetype": "image/svg+xml"
        },
        {
            "@category": "thumbnail",
            "@_fa": "true",
            "$": "https://api.elsevier.com/content/object/eid/1-s2.0-S0378778821003923-si271.svg?httpAccept=%2A%2F%2A",
            "@multimediatype": "Scalable Vector Graphics file",
            "@type": "ALTIMG",
            "@size": "7905",
            "@ref": "si271",
            "@mimetype": "image/svg+xml"
        },
        {
            "@category": "thumbnail",
            "@_fa": "true",
            "$": "https://api.elsevier.com/content/object/eid/1-s2.0-S0378778821003923-si272.svg?httpAccept=%2A%2F%2A",
            "@multimediatype": "Scalable Vector Graphics file",
            "@type": "ALTIMG",
            "@size": "6009",
            "@ref": "si272",
            "@mimetype": "image/svg+xml"
        },
        {
            "@category": "thumbnail",
            "@_fa": "true",
            "$": "https://api.elsevier.com/content/object/eid/1-s2.0-S0378778821003923-si273.svg?httpAccept=%2A%2F%2A",
            "@multimediatype": "Scalable Vector Graphics file",
            "@type": "ALTIMG",
            "@size": "8970",
            "@ref": "si273",
            "@mimetype": "image/svg+xml"
        },
        {
            "@category": "thumbnail",
            "@_fa": "true",
            "$": "https://api.elsevier.com/content/object/eid/1-s2.0-S0378778821003923-si274.svg?httpAccept=%2A%2F%2A",
            "@multimediatype": "Scalable Vector Graphics file",
            "@type": "ALTIMG",
            "@size": "8970",
            "@ref": "si274",
            "@mimetype": "image/svg+xml"
        },
        {
            "@category": "thumbnail",
            "@_fa": "true",
            "$": "https://api.elsevier.com/content/object/eid/1-s2.0-S0378778821003923-si275.svg?httpAccept=%2A%2F%2A",
            "@multimediatype": "Scalable Vector Graphics file",
            "@type": "ALTIMG",
            "@size": "12832",
            "@ref": "si275",
            "@mimetype": "image/svg+xml"
        },
        {
            "@category": "thumbnail",
            "@_fa": "true",
            "$": "https://api.elsevier.com/content/object/eid/1-s2.0-S0378778821003923-si276.svg?httpAccept=%2A%2F%2A",
            "@multimediatype": "Scalable Vector Graphics file",
            "@type": "ALTIMG",
            "@size": "1740",
            "@ref": "si276",
            "@mimetype": "image/svg+xml"
        },
        {
            "@category": "thumbnail",
            "@_fa": "true",
            "$": "https://api.elsevier.com/content/object/eid/1-s2.0-S0378778821003923-si277.svg?httpAccept=%2A%2F%2A",
            "@multimediatype": "Scalable Vector Graphics file",
            "@type": "ALTIMG",
            "@size": "1799",
            "@ref": "si277",
            "@mimetype": "image/svg+xml"
        },
        {
            "@category": "thumbnail",
            "@_fa": "true",
            "$": "https://api.elsevier.com/content/object/eid/1-s2.0-S0378778821003923-si278.svg?httpAccept=%2A%2F%2A",
            "@multimediatype": "Scalable Vector Graphics file",
            "@type": "ALTIMG",
            "@size": "19015",
            "@ref": "si278",
            "@mimetype": "image/svg+xml"
        },
        {
            "@category": "thumbnail",
            "@_fa": "true",
            "$": "https://api.elsevier.com/content/object/eid/1-s2.0-S0378778821003923-si279.svg?httpAccept=%2A%2F%2A",
            "@multimediatype": "Scalable Vector Graphics file",
            "@type": "ALTIMG",
            "@size": "8348",
            "@ref": "si279",
            "@mimetype": "image/svg+xml"
        },
        {
            "@category": "thumbnail",
            "@_fa": "true",
            "$": "https://api.elsevier.com/content/object/eid/1-s2.0-S0378778821003923-si28.svg?httpAccept=%2A%2F%2A",
            "@multimediatype": "Scalable Vector Graphics file",
            "@type": "ALTIMG",
            "@size": "804",
            "@ref": "si28",
            "@mimetype": "image/svg+xml"
        },
        {
            "@category": "thumbnail",
            "@_fa": "true",
            "$": "https://api.elsevier.com/content/object/eid/1-s2.0-S0378778821003923-si280.svg?httpAccept=%2A%2F%2A",
            "@multimediatype": "Scalable Vector Graphics file",
            "@type": "ALTIMG",
            "@size": "1799",
            "@ref": "si280",
            "@mimetype": "image/svg+xml"
        },
        {
            "@category": "thumbnail",
            "@_fa": "true",
            "$": "https://api.elsevier.com/content/object/eid/1-s2.0-S0378778821003923-si281.svg?httpAccept=%2A%2F%2A",
            "@multimediatype": "Scalable Vector Graphics file",
            "@type": "ALTIMG",
            "@size": "9393",
            "@ref": "si281",
            "@mimetype": "image/svg+xml"
        },
        {
            "@category": "thumbnail",
            "@_fa": "true",
            "$": "https://api.elsevier.com/content/object/eid/1-s2.0-S0378778821003923-si282.svg?httpAccept=%2A%2F%2A",
            "@multimediatype": "Scalable Vector Graphics file",
            "@type": "ALTIMG",
            "@size": "12023",
            "@ref": "si282",
            "@mimetype": "image/svg+xml"
        },
        {
            "@category": "thumbnail",
            "@_fa": "true",
            "$": "https://api.elsevier.com/content/object/eid/1-s2.0-S0378778821003923-si283.svg?httpAccept=%2A%2F%2A",
            "@multimediatype": "Scalable Vector Graphics file",
            "@type": "ALTIMG",
            "@size": "11115",
            "@ref": "si283",
            "@mimetype": "image/svg+xml"
        },
        {
            "@category": "thumbnail",
            "@_fa": "true",
            "$": "https://api.elsevier.com/content/object/eid/1-s2.0-S0378778821003923-si284.svg?httpAccept=%2A%2F%2A",
            "@multimediatype": "Scalable Vector Graphics file",
            "@type": "ALTIMG",
            "@size": "10969",
            "@ref": "si284",
            "@mimetype": "image/svg+xml"
        },
        {
            "@category": "thumbnail",
            "@_fa": "true",
            "$": "https://api.elsevier.com/content/object/eid/1-s2.0-S0378778821003923-si285.svg?httpAccept=%2A%2F%2A",
            "@multimediatype": "Scalable Vector Graphics file",
            "@type": "ALTIMG",
            "@size": "1112",
            "@ref": "si285",
            "@mimetype": "image/svg+xml"
        },
        {
            "@category": "thumbnail",
            "@_fa": "true",
            "$": "https://api.elsevier.com/content/object/eid/1-s2.0-S0378778821003923-si286.svg?httpAccept=%2A%2F%2A",
            "@multimediatype": "Scalable Vector Graphics file",
            "@type": "ALTIMG",
            "@size": "7639",
            "@ref": "si286",
            "@mimetype": "image/svg+xml"
        },
        {
            "@category": "thumbnail",
            "@_fa": "true",
            "$": "https://api.elsevier.com/content/object/eid/1-s2.0-S0378778821003923-si287.svg?httpAccept=%2A%2F%2A",
            "@multimediatype": "Scalable Vector Graphics file",
            "@type": "ALTIMG",
            "@size": "5662",
            "@ref": "si287",
            "@mimetype": "image/svg+xml"
        },
        {
            "@category": "thumbnail",
            "@_fa": "true",
            "$": "https://api.elsevier.com/content/object/eid/1-s2.0-S0378778821003923-si288.svg?httpAccept=%2A%2F%2A",
            "@multimediatype": "Scalable Vector Graphics file",
            "@type": "ALTIMG",
            "@size": "6353",
            "@ref": "si288",
            "@mimetype": "image/svg+xml"
        },
        {
            "@category": "thumbnail",
            "@_fa": "true",
            "$": "https://api.elsevier.com/content/object/eid/1-s2.0-S0378778821003923-si289.svg?httpAccept=%2A%2F%2A",
            "@multimediatype": "Scalable Vector Graphics file",
            "@type": "ALTIMG",
            "@size": "5662",
            "@ref": "si289",
            "@mimetype": "image/svg+xml"
        },
        {
            "@category": "thumbnail",
            "@_fa": "true",
            "$": "https://api.elsevier.com/content/object/eid/1-s2.0-S0378778821003923-si290.svg?httpAccept=%2A%2F%2A",
            "@multimediatype": "Scalable Vector Graphics file",
            "@type": "ALTIMG",
            "@size": "6365",
            "@ref": "si290",
            "@mimetype": "image/svg+xml"
        },
        {
            "@category": "thumbnail",
            "@_fa": "true",
            "$": "https://api.elsevier.com/content/object/eid/1-s2.0-S0378778821003923-si291.svg?httpAccept=%2A%2F%2A",
            "@multimediatype": "Scalable Vector Graphics file",
            "@type": "ALTIMG",
            "@size": "6365",
            "@ref": "si291",
            "@mimetype": "image/svg+xml"
        },
        {
            "@category": "thumbnail",
            "@_fa": "true",
            "$": "https://api.elsevier.com/content/object/eid/1-s2.0-S0378778821003923-si292.svg?httpAccept=%2A%2F%2A",
            "@multimediatype": "Scalable Vector Graphics file",
            "@type": "ALTIMG",
            "@size": "19015",
            "@ref": "si292",
            "@mimetype": "image/svg+xml"
        },
        {
            "@category": "thumbnail",
            "@_fa": "true",
            "$": "https://api.elsevier.com/content/object/eid/1-s2.0-S0378778821003923-si293.svg?httpAccept=%2A%2F%2A",
            "@multimediatype": "Scalable Vector Graphics file",
            "@type": "ALTIMG",
            "@size": "9393",
            "@ref": "si293",
            "@mimetype": "image/svg+xml"
        },
        {
            "@category": "thumbnail",
            "@_fa": "true",
            "$": "https://api.elsevier.com/content/object/eid/1-s2.0-S0378778821003923-si294.svg?httpAccept=%2A%2F%2A",
            "@multimediatype": "Scalable Vector Graphics file",
            "@type": "ALTIMG",
            "@size": "9396",
            "@ref": "si294",
            "@mimetype": "image/svg+xml"
        },
        {
            "@category": "thumbnail",
            "@_fa": "true",
            "$": "https://api.elsevier.com/content/object/eid/1-s2.0-S0378778821003923-si295.svg?httpAccept=%2A%2F%2A",
            "@multimediatype": "Scalable Vector Graphics file",
            "@type": "ALTIMG",
            "@size": "6687",
            "@ref": "si295",
            "@mimetype": "image/svg+xml"
        },
        {
            "@category": "thumbnail",
            "@_fa": "true",
            "$": "https://api.elsevier.com/content/object/eid/1-s2.0-S0378778821003923-si296.svg?httpAccept=%2A%2F%2A",
            "@multimediatype": "Scalable Vector Graphics file",
            "@type": "ALTIMG",
            "@size": "8892",
            "@ref": "si296",
            "@mimetype": "image/svg+xml"
        },
        {
            "@category": "thumbnail",
            "@_fa": "true",
            "$": "https://api.elsevier.com/content/object/eid/1-s2.0-S0378778821003923-si297.svg?httpAccept=%2A%2F%2A",
            "@multimediatype": "Scalable Vector Graphics file",
            "@type": "ALTIMG",
            "@size": "2248",
            "@ref": "si297",
            "@mimetype": "image/svg+xml"
        },
        {
            "@category": "thumbnail",
            "@_fa": "true",
            "$": "https://api.elsevier.com/content/object/eid/1-s2.0-S0378778821003923-si298.svg?httpAccept=%2A%2F%2A",
            "@multimediatype": "Scalable Vector Graphics file",
            "@type": "ALTIMG",
            "@size": "6226",
            "@ref": "si298",
            "@mimetype": "image/svg+xml"
        },
        {
            "@category": "thumbnail",
            "@_fa": "true",
            "$": "https://api.elsevier.com/content/object/eid/1-s2.0-S0378778821003923-si299.svg?httpAccept=%2A%2F%2A",
            "@multimediatype": "Scalable Vector Graphics file",
            "@type": "ALTIMG",
            "@size": "5390",
            "@ref": "si299",
            "@mimetype": "image/svg+xml"
        },
        {
            "@category": "thumbnail",
            "@_fa": "true",
            "$": "https://api.elsevier.com/content/object/eid/1-s2.0-S0378778821003923-si3.svg?httpAccept=%2A%2F%2A",
            "@multimediatype": "Scalable Vector Graphics file",
            "@type": "ALTIMG",
            "@size": "1409",
            "@ref": "si3",
            "@mimetype": "image/svg+xml"
        },
        {
            "@category": "thumbnail",
            "@_fa": "true",
            "$": "https://api.elsevier.com/content/object/eid/1-s2.0-S0378778821003923-si300.svg?httpAccept=%2A%2F%2A",
            "@multimediatype": "Scalable Vector Graphics file",
            "@type": "ALTIMG",
            "@size": "3440",
            "@ref": "si300",
            "@mimetype": "image/svg+xml"
        },
        {
            "@category": "thumbnail",
            "@_fa": "true",
            "$": "https://api.elsevier.com/content/object/eid/1-s2.0-S0378778821003923-si301.svg?httpAccept=%2A%2F%2A",
            "@multimediatype": "Scalable Vector Graphics file",
            "@type": "ALTIMG",
            "@size": "1409",
            "@ref": "si301",
            "@mimetype": "image/svg+xml"
        },
        {
            "@category": "thumbnail",
            "@_fa": "true",
            "$": "https://api.elsevier.com/content/object/eid/1-s2.0-S0378778821003923-si302.svg?httpAccept=%2A%2F%2A",
            "@multimediatype": "Scalable Vector Graphics file",
            "@type": "ALTIMG",
            "@size": "8064",
            "@ref": "si302",
            "@mimetype": "image/svg+xml"
        },
        {
            "@category": "thumbnail",
            "@_fa": "true",
            "$": "https://api.elsevier.com/content/object/eid/1-s2.0-S0378778821003923-si303.svg?httpAccept=%2A%2F%2A",
            "@multimediatype": "Scalable Vector Graphics file",
            "@type": "ALTIMG",
            "@size": "1409",
            "@ref": "si303",
            "@mimetype": "image/svg+xml"
        },
        {
            "@category": "thumbnail",
            "@_fa": "true",
            "$": "https://api.elsevier.com/content/object/eid/1-s2.0-S0378778821003923-si304.svg?httpAccept=%2A%2F%2A",
            "@multimediatype": "Scalable Vector Graphics file",
            "@type": "ALTIMG",
            "@size": "2898",
            "@ref": "si304",
            "@mimetype": "image/svg+xml"
        },
        {
            "@category": "thumbnail",
            "@_fa": "true",
            "$": "https://api.elsevier.com/content/object/eid/1-s2.0-S0378778821003923-si305.svg?httpAccept=%2A%2F%2A",
            "@multimediatype": "Scalable Vector Graphics file",
            "@type": "ALTIMG",
            "@size": "12586",
            "@ref": "si305",
            "@mimetype": "image/svg+xml"
        },
        {
            "@category": "thumbnail",
            "@_fa": "true",
            "$": "https://api.elsevier.com/content/object/eid/1-s2.0-S0378778821003923-si306.svg?httpAccept=%2A%2F%2A",
            "@multimediatype": "Scalable Vector Graphics file",
            "@type": "ALTIMG",
            "@size": "2898",
            "@ref": "si306",
            "@mimetype": "image/svg+xml"
        },
        {
            "@category": "thumbnail",
            "@_fa": "true",
            "$": "https://api.elsevier.com/content/object/eid/1-s2.0-S0378778821003923-si307.svg?httpAccept=%2A%2F%2A",
            "@multimediatype": "Scalable Vector Graphics file",
            "@type": "ALTIMG",
            "@size": "1409",
            "@ref": "si307",
            "@mimetype": "image/svg+xml"
        },
        {
            "@category": "thumbnail",
            "@_fa": "true",
            "$": "https://api.elsevier.com/content/object/eid/1-s2.0-S0378778821003923-si308.svg?httpAccept=%2A%2F%2A",
            "@multimediatype": "Scalable Vector Graphics file",
            "@type": "ALTIMG",
            "@size": "1409",
            "@ref": "si308",
            "@mimetype": "image/svg+xml"
        },
        {
            "@category": "thumbnail",
            "@_fa": "true",
            "$": "https://api.elsevier.com/content/object/eid/1-s2.0-S0378778821003923-si309.svg?httpAccept=%2A%2F%2A",
            "@multimediatype": "Scalable Vector Graphics file",
            "@type": "ALTIMG",
            "@size": "1409",
            "@ref": "si309",
            "@mimetype": "image/svg+xml"
        },
        {
            "@category": "thumbnail",
            "@_fa": "true",
            "$": "https://api.elsevier.com/content/object/eid/1-s2.0-S0378778821003923-si31.svg?httpAccept=%2A%2F%2A",
            "@multimediatype": "Scalable Vector Graphics file",
            "@type": "ALTIMG",
            "@size": "804",
            "@ref": "si31",
            "@mimetype": "image/svg+xml"
        },
        {
            "@category": "thumbnail",
            "@_fa": "true",
            "$": "https://api.elsevier.com/content/object/eid/1-s2.0-S0378778821003923-si310.svg?httpAccept=%2A%2F%2A",
            "@multimediatype": "Scalable Vector Graphics file",
            "@type": "ALTIMG",
            "@size": "6203",
            "@ref": "si310",
            "@mimetype": "image/svg+xml"
        },
        {
            "@category": "thumbnail",
            "@_fa": "true",
            "$": "https://api.elsevier.com/content/object/eid/1-s2.0-S0378778821003923-si311.svg?httpAccept=%2A%2F%2A",
            "@multimediatype": "Scalable Vector Graphics file",
            "@type": "ALTIMG",
            "@size": "6305",
            "@ref": "si311",
            "@mimetype": "image/svg+xml"
        },
        {
            "@category": "thumbnail",
            "@_fa": "true",
            "$": "https://api.elsevier.com/content/object/eid/1-s2.0-S0378778821003923-si312.svg?httpAccept=%2A%2F%2A",
            "@multimediatype": "Scalable Vector Graphics file",
            "@type": "ALTIMG",
            "@size": "3330",
            "@ref": "si312",
            "@mimetype": "image/svg+xml"
        },
        {
            "@category": "thumbnail",
            "@_fa": "true",
            "$": "https://api.elsevier.com/content/object/eid/1-s2.0-S0378778821003923-si313.svg?httpAccept=%2A%2F%2A",
            "@multimediatype": "Scalable Vector Graphics file",
            "@type": "ALTIMG",
            "@size": "1409",
            "@ref": "si313",
            "@mimetype": "image/svg+xml"
        },
        {
            "@category": "thumbnail",
            "@_fa": "true",
            "$": "https://api.elsevier.com/content/object/eid/1-s2.0-S0378778821003923-si314.svg?httpAccept=%2A%2F%2A",
            "@multimediatype": "Scalable Vector Graphics file",
            "@type": "ALTIMG",
            "@size": "1409",
            "@ref": "si314",
            "@mimetype": "image/svg+xml"
        },
        {
            "@category": "thumbnail",
            "@_fa": "true",
            "$": "https://api.elsevier.com/content/object/eid/1-s2.0-S0378778821003923-si315.svg?httpAccept=%2A%2F%2A",
            "@multimediatype": "Scalable Vector Graphics file",
            "@type": "ALTIMG",
            "@size": "1409",
            "@ref": "si315",
            "@mimetype": "image/svg+xml"
        },
        {
            "@category": "thumbnail",
            "@_fa": "true",
            "$": "https://api.elsevier.com/content/object/eid/1-s2.0-S0378778821003923-si316.svg?httpAccept=%2A%2F%2A",
            "@multimediatype": "Scalable Vector Graphics file",
            "@type": "ALTIMG",
            "@size": "1409",
            "@ref": "si316",
            "@mimetype": "image/svg+xml"
        },
        {
            "@category": "thumbnail",
            "@_fa": "true",
            "$": "https://api.elsevier.com/content/object/eid/1-s2.0-S0378778821003923-si317.svg?httpAccept=%2A%2F%2A",
            "@multimediatype": "Scalable Vector Graphics file",
            "@type": "ALTIMG",
            "@size": "1409",
            "@ref": "si317",
            "@mimetype": "image/svg+xml"
        },
        {
            "@category": "thumbnail",
            "@_fa": "true",
            "$": "https://api.elsevier.com/content/object/eid/1-s2.0-S0378778821003923-si318.svg?httpAccept=%2A%2F%2A",
            "@multimediatype": "Scalable Vector Graphics file",
            "@type": "ALTIMG",
            "@size": "1409",
            "@ref": "si318",
            "@mimetype": "image/svg+xml"
        },
        {
            "@category": "thumbnail",
            "@_fa": "true",
            "$": "https://api.elsevier.com/content/object/eid/1-s2.0-S0378778821003923-si319.svg?httpAccept=%2A%2F%2A",
            "@multimediatype": "Scalable Vector Graphics file",
            "@type": "ALTIMG",
            "@size": "1409",
            "@ref": "si319",
            "@mimetype": "image/svg+xml"
        },
        {
            "@category": "thumbnail",
            "@_fa": "true",
            "$": "https://api.elsevier.com/content/object/eid/1-s2.0-S0378778821003923-si320.svg?httpAccept=%2A%2F%2A",
            "@multimediatype": "Scalable Vector Graphics file",
            "@type": "ALTIMG",
            "@size": "4285",
            "@ref": "si320",
            "@mimetype": "image/svg+xml"
        },
        {
            "@category": "thumbnail",
            "@_fa": "true",
            "$": "https://api.elsevier.com/content/object/eid/1-s2.0-S0378778821003923-si321.svg?httpAccept=%2A%2F%2A",
            "@multimediatype": "Scalable Vector Graphics file",
            "@type": "ALTIMG",
            "@size": "4231",
            "@ref": "si321",
            "@mimetype": "image/svg+xml"
        },
        {
            "@category": "thumbnail",
            "@_fa": "true",
            "$": "https://api.elsevier.com/content/object/eid/1-s2.0-S0378778821003923-si322.svg?httpAccept=%2A%2F%2A",
            "@multimediatype": "Scalable Vector Graphics file",
            "@type": "ALTIMG",
            "@size": "1409",
            "@ref": "si322",
            "@mimetype": "image/svg+xml"
        },
        {
            "@category": "thumbnail",
            "@_fa": "true",
            "$": "https://api.elsevier.com/content/object/eid/1-s2.0-S0378778821003923-si323.svg?httpAccept=%2A%2F%2A",
            "@multimediatype": "Scalable Vector Graphics file",
            "@type": "ALTIMG",
            "@size": "3731",
            "@ref": "si323",
            "@mimetype": "image/svg+xml"
        },
        {
            "@category": "thumbnail",
            "@_fa": "true",
            "$": "https://api.elsevier.com/content/object/eid/1-s2.0-S0378778821003923-si324.svg?httpAccept=%2A%2F%2A",
            "@multimediatype": "Scalable Vector Graphics file",
            "@type": "ALTIMG",
            "@size": "4287",
            "@ref": "si324",
            "@mimetype": "image/svg+xml"
        },
        {
            "@category": "thumbnail",
            "@_fa": "true",
            "$": "https://api.elsevier.com/content/object/eid/1-s2.0-S0378778821003923-si325.svg?httpAccept=%2A%2F%2A",
            "@multimediatype": "Scalable Vector Graphics file",
            "@type": "ALTIMG",
            "@size": "8205",
            "@ref": "si325",
            "@mimetype": "image/svg+xml"
        },
        {
            "@category": "thumbnail",
            "@_fa": "true",
            "$": "https://api.elsevier.com/content/object/eid/1-s2.0-S0378778821003923-si326.svg?httpAccept=%2A%2F%2A",
            "@multimediatype": "Scalable Vector Graphics file",
            "@type": "ALTIMG",
            "@size": "4287",
            "@ref": "si326",
            "@mimetype": "image/svg+xml"
        },
        {
            "@category": "thumbnail",
            "@_fa": "true",
            "$": "https://api.elsevier.com/content/object/eid/1-s2.0-S0378778821003923-si327.svg?httpAccept=%2A%2F%2A",
            "@multimediatype": "Scalable Vector Graphics file",
            "@type": "ALTIMG",
            "@size": "1409",
            "@ref": "si327",
            "@mimetype": "image/svg+xml"
        },
        {
            "@category": "thumbnail",
            "@_fa": "true",
            "$": "https://api.elsevier.com/content/object/eid/1-s2.0-S0378778821003923-si328.svg?httpAccept=%2A%2F%2A",
            "@multimediatype": "Scalable Vector Graphics file",
            "@type": "ALTIMG",
            "@size": "4971",
            "@ref": "si328",
            "@mimetype": "image/svg+xml"
        },
        {
            "@category": "thumbnail",
            "@_fa": "true",
            "$": "https://api.elsevier.com/content/object/eid/1-s2.0-S0378778821003923-si329.svg?httpAccept=%2A%2F%2A",
            "@multimediatype": "Scalable Vector Graphics file",
            "@type": "ALTIMG",
            "@size": "1409",
            "@ref": "si329",
            "@mimetype": "image/svg+xml"
        },
        {
            "@category": "thumbnail",
            "@_fa": "true",
            "$": "https://api.elsevier.com/content/object/eid/1-s2.0-S0378778821003923-si330.svg?httpAccept=%2A%2F%2A",
            "@multimediatype": "Scalable Vector Graphics file",
            "@type": "ALTIMG",
            "@size": "3618",
            "@ref": "si330",
            "@mimetype": "image/svg+xml"
        },
        {
            "@category": "thumbnail",
            "@_fa": "true",
            "$": "https://api.elsevier.com/content/object/eid/1-s2.0-S0378778821003923-si331.svg?httpAccept=%2A%2F%2A",
            "@multimediatype": "Scalable Vector Graphics file",
            "@type": "ALTIMG",
            "@size": "2438",
            "@ref": "si331",
            "@mimetype": "image/svg+xml"
        },
        {
            "@category": "thumbnail",
            "@_fa": "true",
            "$": "https://api.elsevier.com/content/object/eid/1-s2.0-S0378778821003923-si332.svg?httpAccept=%2A%2F%2A",
            "@multimediatype": "Scalable Vector Graphics file",
            "@type": "ALTIMG",
            "@size": "1409",
            "@ref": "si332",
            "@mimetype": "image/svg+xml"
        },
        {
            "@category": "thumbnail",
            "@_fa": "true",
            "$": "https://api.elsevier.com/content/object/eid/1-s2.0-S0378778821003923-si333.svg?httpAccept=%2A%2F%2A",
            "@multimediatype": "Scalable Vector Graphics file",
            "@type": "ALTIMG",
            "@size": "1409",
            "@ref": "si333",
            "@mimetype": "image/svg+xml"
        },
        {
            "@category": "thumbnail",
            "@_fa": "true",
            "$": "https://api.elsevier.com/content/object/eid/1-s2.0-S0378778821003923-si334.svg?httpAccept=%2A%2F%2A",
            "@multimediatype": "Scalable Vector Graphics file",
            "@type": "ALTIMG",
            "@size": "3731",
            "@ref": "si334",
            "@mimetype": "image/svg+xml"
        },
        {
            "@category": "thumbnail",
            "@_fa": "true",
            "$": "https://api.elsevier.com/content/object/eid/1-s2.0-S0378778821003923-si335.svg?httpAccept=%2A%2F%2A",
            "@multimediatype": "Scalable Vector Graphics file",
            "@type": "ALTIMG",
            "@size": "4232",
            "@ref": "si335",
            "@mimetype": "image/svg+xml"
        },
        {
            "@category": "thumbnail",
            "@_fa": "true",
            "$": "https://api.elsevier.com/content/object/eid/1-s2.0-S0378778821003923-si336.svg?httpAccept=%2A%2F%2A",
            "@multimediatype": "Scalable Vector Graphics file",
            "@type": "ALTIMG",
            "@size": "1410",
            "@ref": "si336",
            "@mimetype": "image/svg+xml"
        },
        {
            "@category": "thumbnail",
            "@_fa": "true",
            "$": "https://api.elsevier.com/content/object/eid/1-s2.0-S0378778821003923-si337.svg?httpAccept=%2A%2F%2A",
            "@multimediatype": "Scalable Vector Graphics file",
            "@type": "ALTIMG",
            "@size": "1410",
            "@ref": "si337",
            "@mimetype": "image/svg+xml"
        },
        {
            "@category": "thumbnail",
            "@_fa": "true",
            "$": "https://api.elsevier.com/content/object/eid/1-s2.0-S0378778821003923-si338.svg?httpAccept=%2A%2F%2A",
            "@multimediatype": "Scalable Vector Graphics file",
            "@type": "ALTIMG",
            "@size": "1410",
            "@ref": "si338",
            "@mimetype": "image/svg+xml"
        },
        {
            "@category": "thumbnail",
            "@_fa": "true",
            "$": "https://api.elsevier.com/content/object/eid/1-s2.0-S0378778821003923-si339.svg?httpAccept=%2A%2F%2A",
            "@multimediatype": "Scalable Vector Graphics file",
            "@type": "ALTIMG",
            "@size": "3732",
            "@ref": "si339",
            "@mimetype": "image/svg+xml"
        },
        {
            "@category": "thumbnail",
            "@_fa": "true",
            "$": "https://api.elsevier.com/content/object/eid/1-s2.0-S0378778821003923-si34.svg?httpAccept=%2A%2F%2A",
            "@multimediatype": "Scalable Vector Graphics file",
            "@type": "ALTIMG",
            "@size": "805",
            "@ref": "si34",
            "@mimetype": "image/svg+xml"
        },
        {
            "@category": "thumbnail",
            "@_fa": "true",
            "$": "https://api.elsevier.com/content/object/eid/1-s2.0-S0378778821003923-si340.svg?httpAccept=%2A%2F%2A",
            "@multimediatype": "Scalable Vector Graphics file",
            "@type": "ALTIMG",
            "@size": "1410",
            "@ref": "si340",
            "@mimetype": "image/svg+xml"
        },
        {
            "@category": "thumbnail",
            "@_fa": "true",
            "$": "https://api.elsevier.com/content/object/eid/1-s2.0-S0378778821003923-si341.svg?httpAccept=%2A%2F%2A",
            "@multimediatype": "Scalable Vector Graphics file",
            "@type": "ALTIMG",
            "@size": "1410",
            "@ref": "si341",
            "@mimetype": "image/svg+xml"
        },
        {
            "@category": "thumbnail",
            "@_fa": "true",
            "$": "https://api.elsevier.com/content/object/eid/1-s2.0-S0378778821003923-si342.svg?httpAccept=%2A%2F%2A",
            "@multimediatype": "Scalable Vector Graphics file",
            "@type": "ALTIMG",
            "@size": "1410",
            "@ref": "si342",
            "@mimetype": "image/svg+xml"
        },
        {
            "@category": "thumbnail",
            "@_fa": "true",
            "$": "https://api.elsevier.com/content/object/eid/1-s2.0-S0378778821003923-si343.svg?httpAccept=%2A%2F%2A",
            "@multimediatype": "Scalable Vector Graphics file",
            "@type": "ALTIMG",
            "@size": "6150",
            "@ref": "si343",
            "@mimetype": "image/svg+xml"
        },
        {
            "@category": "thumbnail",
            "@_fa": "true",
            "$": "https://api.elsevier.com/content/object/eid/1-s2.0-S0378778821003923-si344.svg?httpAccept=%2A%2F%2A",
            "@multimediatype": "Scalable Vector Graphics file",
            "@type": "ALTIMG",
            "@size": "6337",
            "@ref": "si344",
            "@mimetype": "image/svg+xml"
        },
        {
            "@category": "thumbnail",
            "@_fa": "true",
            "$": "https://api.elsevier.com/content/object/eid/1-s2.0-S0378778821003923-si345.svg?httpAccept=%2A%2F%2A",
            "@multimediatype": "Scalable Vector Graphics file",
            "@type": "ALTIMG",
            "@size": "1410",
            "@ref": "si345",
            "@mimetype": "image/svg+xml"
        },
        {
            "@category": "thumbnail",
            "@_fa": "true",
            "$": "https://api.elsevier.com/content/object/eid/1-s2.0-S0378778821003923-si346.svg?httpAccept=%2A%2F%2A",
            "@multimediatype": "Scalable Vector Graphics file",
            "@type": "ALTIMG",
            "@size": "1410",
            "@ref": "si346",
            "@mimetype": "image/svg+xml"
        },
        {
            "@category": "thumbnail",
            "@_fa": "true",
            "$": "https://api.elsevier.com/content/object/eid/1-s2.0-S0378778821003923-si347.svg?httpAccept=%2A%2F%2A",
            "@multimediatype": "Scalable Vector Graphics file",
            "@type": "ALTIMG",
            "@size": "4055",
            "@ref": "si347",
            "@mimetype": "image/svg+xml"
        },
        {
            "@category": "thumbnail",
            "@_fa": "true",
            "$": "https://api.elsevier.com/content/object/eid/1-s2.0-S0378778821003923-si348.svg?httpAccept=%2A%2F%2A",
            "@multimediatype": "Scalable Vector Graphics file",
            "@type": "ALTIMG",
            "@size": "1410",
            "@ref": "si348",
            "@mimetype": "image/svg+xml"
        },
        {
            "@category": "thumbnail",
            "@_fa": "true",
            "$": "https://api.elsevier.com/content/object/eid/1-s2.0-S0378778821003923-si349.svg?httpAccept=%2A%2F%2A",
            "@multimediatype": "Scalable Vector Graphics file",
            "@type": "ALTIMG",
            "@size": "3992",
            "@ref": "si349",
            "@mimetype": "image/svg+xml"
        },
        {
            "@category": "thumbnail",
            "@_fa": "true",
            "$": "https://api.elsevier.com/content/object/eid/1-s2.0-S0378778821003923-si350.svg?httpAccept=%2A%2F%2A",
            "@multimediatype": "Scalable Vector Graphics file",
            "@type": "ALTIMG",
            "@size": "1410",
            "@ref": "si350",
            "@mimetype": "image/svg+xml"
        },
        {
            "@category": "thumbnail",
            "@_fa": "true",
            "$": "https://api.elsevier.com/content/object/eid/1-s2.0-S0378778821003923-si351.svg?httpAccept=%2A%2F%2A",
            "@multimediatype": "Scalable Vector Graphics file",
            "@type": "ALTIMG",
            "@size": "3965",
            "@ref": "si351",
            "@mimetype": "image/svg+xml"
        },
        {
            "@category": "thumbnail",
            "@_fa": "true",
            "$": "https://api.elsevier.com/content/object/eid/1-s2.0-S0378778821003923-si352.svg?httpAccept=%2A%2F%2A",
            "@multimediatype": "Scalable Vector Graphics file",
            "@type": "ALTIMG",
            "@size": "1410",
            "@ref": "si352",
            "@mimetype": "image/svg+xml"
        },
        {
            "@category": "thumbnail",
            "@_fa": "true",
            "$": "https://api.elsevier.com/content/object/eid/1-s2.0-S0378778821003923-si353.svg?httpAccept=%2A%2F%2A",
            "@multimediatype": "Scalable Vector Graphics file",
            "@type": "ALTIMG",
            "@size": "6827",
            "@ref": "si353",
            "@mimetype": "image/svg+xml"
        },
        {
            "@category": "thumbnail",
            "@_fa": "true",
            "$": "https://api.elsevier.com/content/object/eid/1-s2.0-S0378778821003923-si354.svg?httpAccept=%2A%2F%2A",
            "@multimediatype": "Scalable Vector Graphics file",
            "@type": "ALTIMG",
            "@size": "1410",
            "@ref": "si354",
            "@mimetype": "image/svg+xml"
        },
        {
            "@category": "thumbnail",
            "@_fa": "true",
            "$": "https://api.elsevier.com/content/object/eid/1-s2.0-S0378778821003923-si355.svg?httpAccept=%2A%2F%2A",
            "@multimediatype": "Scalable Vector Graphics file",
            "@type": "ALTIMG",
            "@size": "1410",
            "@ref": "si355",
            "@mimetype": "image/svg+xml"
        },
        {
            "@category": "thumbnail",
            "@_fa": "true",
            "$": "https://api.elsevier.com/content/object/eid/1-s2.0-S0378778821003923-si356.svg?httpAccept=%2A%2F%2A",
            "@multimediatype": "Scalable Vector Graphics file",
            "@type": "ALTIMG",
            "@size": "4321",
            "@ref": "si356",
            "@mimetype": "image/svg+xml"
        },
        {
            "@category": "thumbnail",
            "@_fa": "true",
            "$": "https://api.elsevier.com/content/object/eid/1-s2.0-S0378778821003923-si37.svg?httpAccept=%2A%2F%2A",
            "@multimediatype": "Scalable Vector Graphics file",
            "@type": "ALTIMG",
            "@size": "805",
            "@ref": "si37",
            "@mimetype": "image/svg+xml"
        },
        {
            "@category": "thumbnail",
            "@_fa": "true",
            "$": "https://api.elsevier.com/content/object/eid/1-s2.0-S0378778821003923-si4.svg?httpAccept=%2A%2F%2A",
            "@multimediatype": "Scalable Vector Graphics file",
            "@type": "ALTIMG",
            "@size": "1410",
            "@ref": "si4",
            "@mimetype": "image/svg+xml"
        },
        {
            "@category": "thumbnail",
            "@_fa": "true",
            "$": "https://api.elsevier.com/content/object/eid/1-s2.0-S0378778821003923-si40.svg?httpAccept=%2A%2F%2A",
            "@multimediatype": "Scalable Vector Graphics file",
            "@type": "ALTIMG",
            "@size": "805",
            "@ref": "si40",
            "@mimetype": "image/svg+xml"
        },
        {
            "@category": "thumbnail",
            "@_fa": "true",
            "$": "https://api.elsevier.com/content/object/eid/1-s2.0-S0378778821003923-si43.svg?httpAccept=%2A%2F%2A",
            "@multimediatype": "Scalable Vector Graphics file",
            "@type": "ALTIMG",
            "@size": "805",
            "@ref": "si43",
            "@mimetype": "image/svg+xml"
        },
        {
            "@category": "thumbnail",
            "@_fa": "true",
            "$": "https://api.elsevier.com/content/object/eid/1-s2.0-S0378778821003923-si46.svg?httpAccept=%2A%2F%2A",
            "@multimediatype": "Scalable Vector Graphics file",
            "@type": "ALTIMG",
            "@size": "805",
            "@ref": "si46",
            "@mimetype": "image/svg+xml"
        },
        {
            "@category": "thumbnail",
            "@_fa": "true",
            "$": "https://api.elsevier.com/content/object/eid/1-s2.0-S0378778821003923-si49.svg?httpAccept=%2A%2F%2A",
            "@multimediatype": "Scalable Vector Graphics file",
            "@type": "ALTIMG",
            "@size": "805",
            "@ref": "si49",
            "@mimetype": "image/svg+xml"
        },
        {
            "@category": "thumbnail",
            "@_fa": "true",
            "$": "https://api.elsevier.com/content/object/eid/1-s2.0-S0378778821003923-si5.svg?httpAccept=%2A%2F%2A",
            "@multimediatype": "Scalable Vector Graphics file",
            "@type": "ALTIMG",
            "@size": "4055",
            "@ref": "si5",
            "@mimetype": "image/svg+xml"
        },
        {
            "@category": "thumbnail",
            "@_fa": "true",
            "$": "https://api.elsevier.com/content/object/eid/1-s2.0-S0378778821003923-si52.svg?httpAccept=%2A%2F%2A",
            "@multimediatype": "Scalable Vector Graphics file",
            "@type": "ALTIMG",
            "@size": "805",
            "@ref": "si52",
            "@mimetype": "image/svg+xml"
        },
        {
            "@category": "thumbnail",
            "@_fa": "true",
            "$": "https://api.elsevier.com/content/object/eid/1-s2.0-S0378778821003923-si55.svg?httpAccept=%2A%2F%2A",
            "@multimediatype": "Scalable Vector Graphics file",
            "@type": "ALTIMG",
            "@size": "805",
            "@ref": "si55",
            "@mimetype": "image/svg+xml"
        },
        {
            "@category": "thumbnail",
            "@_fa": "true",
            "$": "https://api.elsevier.com/content/object/eid/1-s2.0-S0378778821003923-si58.svg?httpAccept=%2A%2F%2A",
            "@multimediatype": "Scalable Vector Graphics file",
            "@type": "ALTIMG",
            "@size": "805",
            "@ref": "si58",
            "@mimetype": "image/svg+xml"
        },
        {
            "@category": "thumbnail",
            "@_fa": "true",
            "$": "https://api.elsevier.com/content/object/eid/1-s2.0-S0378778821003923-si6.svg?httpAccept=%2A%2F%2A",
            "@multimediatype": "Scalable Vector Graphics file",
            "@type": "ALTIMG",
            "@size": "4055",
            "@ref": "si6",
            "@mimetype": "image/svg+xml"
        },
        {
            "@category": "thumbnail",
            "@_fa": "true",
            "$": "https://api.elsevier.com/content/object/eid/1-s2.0-S0378778821003923-si61.svg?httpAccept=%2A%2F%2A",
            "@multimediatype": "Scalable Vector Graphics file",
            "@type": "ALTIMG",
            "@size": "805",
            "@ref": "si61",
            "@mimetype": "image/svg+xml"
        },
        {
            "@category": "thumbnail",
            "@_fa": "true",
            "$": "https://api.elsevier.com/content/object/eid/1-s2.0-S0378778821003923-si64.svg?httpAccept=%2A%2F%2A",
            "@multimediatype": "Scalable Vector Graphics file",
            "@type": "ALTIMG",
            "@size": "805",
            "@ref": "si64",
            "@mimetype": "image/svg+xml"
        },
        {
            "@category": "thumbnail",
            "@_fa": "true",
            "$": "https://api.elsevier.com/content/object/eid/1-s2.0-S0378778821003923-si67.svg?httpAccept=%2A%2F%2A",
            "@multimediatype": "Scalable Vector Graphics file",
            "@type": "ALTIMG",
            "@size": "805",
            "@ref": "si67",
            "@mimetype": "image/svg+xml"
        },
        {
            "@category": "thumbnail",
            "@_fa": "true",
            "$": "https://api.elsevier.com/content/object/eid/1-s2.0-S0378778821003923-si7.svg?httpAccept=%2A%2F%2A",
            "@multimediatype": "Scalable Vector Graphics file",
            "@type": "ALTIMG",
            "@size": "4055",
            "@ref": "si7",
            "@mimetype": "image/svg+xml"
        },
        {
            "@category": "thumbnail",
            "@_fa": "true",
            "$": "https://api.elsevier.com/content/object/eid/1-s2.0-S0378778821003923-si70.svg?httpAccept=%2A%2F%2A",
            "@multimediatype": "Scalable Vector Graphics file",
            "@type": "ALTIMG",
            "@size": "805",
            "@ref": "si70",
            "@mimetype": "image/svg+xml"
        },
        {
            "@category": "thumbnail",
            "@_fa": "true",
            "$": "https://api.elsevier.com/content/object/eid/1-s2.0-S0378778821003923-si73.svg?httpAccept=%2A%2F%2A",
            "@multimediatype": "Scalable Vector Graphics file",
            "@type": "ALTIMG",
            "@size": "805",
            "@ref": "si73",
            "@mimetype": "image/svg+xml"
        },
        {
            "@category": "thumbnail",
            "@_fa": "true",
            "$": "https://api.elsevier.com/content/object/eid/1-s2.0-S0378778821003923-si76.svg?httpAccept=%2A%2F%2A",
            "@multimediatype": "Scalable Vector Graphics file",
            "@type": "ALTIMG",
            "@size": "805",
            "@ref": "si76",
            "@mimetype": "image/svg+xml"
        },
        {
            "@category": "thumbnail",
            "@_fa": "true",
            "$": "https://api.elsevier.com/content/object/eid/1-s2.0-S0378778821003923-si79.svg?httpAccept=%2A%2F%2A",
            "@multimediatype": "Scalable Vector Graphics file",
            "@type": "ALTIMG",
            "@size": "805",
            "@ref": "si79",
            "@mimetype": "image/svg+xml"
        },
        {
            "@category": "thumbnail",
            "@_fa": "true",
            "$": "https://api.elsevier.com/content/object/eid/1-s2.0-S0378778821003923-si8.svg?httpAccept=%2A%2F%2A",
            "@multimediatype": "Scalable Vector Graphics file",
            "@type": "ALTIMG",
            "@size": "8863",
            "@ref": "si8",
            "@mimetype": "image/svg+xml"
        },
        {
            "@category": "thumbnail",
            "@_fa": "true",
            "$": "https://api.elsevier.com/content/object/eid/1-s2.0-S0378778821003923-si82.svg?httpAccept=%2A%2F%2A",
            "@multimediatype": "Scalable Vector Graphics file",
            "@type": "ALTIMG",
            "@size": "805",
            "@ref": "si82",
            "@mimetype": "image/svg+xml"
        },
        {
            "@category": "thumbnail",
            "@_fa": "true",
            "$": "https://api.elsevier.com/content/object/eid/1-s2.0-S0378778821003923-si85.svg?httpAccept=%2A%2F%2A",
            "@multimediatype": "Scalable Vector Graphics file",
            "@type": "ALTIMG",
            "@size": "805",
            "@ref": "si85",
            "@mimetype": "image/svg+xml"
        },
        {
            "@category": "thumbnail",
            "@_fa": "true",
            "$": "https://api.elsevier.com/content/object/eid/1-s2.0-S0378778821003923-si88.svg?httpAccept=%2A%2F%2A",
            "@multimediatype": "Scalable Vector Graphics file",
            "@type": "ALTIMG",
            "@size": "805",
            "@ref": "si88",
            "@mimetype": "image/svg+xml"
        },
        {
            "@category": "thumbnail",
            "@_fa": "true",
            "$": "https://api.elsevier.com/content/object/eid/1-s2.0-S0378778821003923-si9.svg?httpAccept=%2A%2F%2A",
            "@multimediatype": "Scalable Vector Graphics file",
            "@type": "ALTIMG",
            "@size": "8059",
            "@ref": "si9",
            "@mimetype": "image/svg+xml"
        },
        {
            "@category": "thumbnail",
            "@_fa": "true",
            "$": "https://api.elsevier.com/content/object/eid/1-s2.0-S0378778821003923-si91.svg?httpAccept=%2A%2F%2A",
            "@multimediatype": "Scalable Vector Graphics file",
            "@type": "ALTIMG",
            "@size": "805",
            "@ref": "si91",
            "@mimetype": "image/svg+xml"
        },
        {
            "@category": "thumbnail",
            "@_fa": "true",
            "$": "https://api.elsevier.com/content/object/eid/1-s2.0-S0378778821003923-si94.svg?httpAccept=%2A%2F%2A",
            "@multimediatype": "Scalable Vector Graphics file",
            "@type": "ALTIMG",
            "@size": "805",
            "@ref": "si94",
            "@mimetype": "image/svg+xml"
        },
        {
            "@category": "thumbnail",
            "@_fa": "true",
            "$": "https://api.elsevier.com/content/object/eid/1-s2.0-S0378778821003923-si97.svg?httpAccept=%2A%2F%2A",
            "@multimediatype": "Scalable Vector Graphics file",
            "@type": "ALTIMG",
            "@size": "805",
            "@ref": "si97",
            "@mimetype": "image/svg+xml"
        },
        {
            "@category": "standard",
            "@_fa": "true",
            "$": "https://api.elsevier.com/content/object/eid/1-s2.0-S0378778821003923-am.pdf?httpAccept=%2A%2F%2A",
            "@multimediatype": "Acrobat PDF file",
            "@type": "AAM-PDF",
            "@size": "588587",
            "@ref": "am",
            "@mimetype": "application/pdf"
        }
    ]},
    "link": {
        "@rel": "abstract",
        "@href": "https://api.elsevier.com/content/abstract/scopus_id/85107128417"
    }
}}