{"full-text-retrieval-response": {
    "scopus-eid": "2-s2.0-85110627705",
    "originalText": "serial JL 271089 291210 291731 291800 291881 31 Energy and Buildings ENERGYBUILDINGS 2021-06-24 2021-06-24 2021-07-20 2021-07-20 2022-01-31T19:00:21 1-s2.0-S0378778821005028 S0378-7788(21)00502-8 S0378778821005028 10.1016/j.enbuild.2021.111218 S300 S300.2 FULL-TEXT 1-s2.0-S0378778821X00175 2022-12-12T16:32:22.442236Z 0 0 20211101 2021 2021-06-24T19:16:24.885244Z articleinfo articlenumber articletitlenorm authfirstinitialnorm authfirstsurnamenorm cid cids contenttype copyright crossmark dateloaded dateloadedtxt datesearch datesort dateupdated dco docsubtype doctype doi eid ewtransactionid hubeid indexeddate issn issnnorm itemstage itemtransactionid itemweight openaccess openarchive pg pgfirst pii piinorm pubdatestart pubdatetxt pubyr sectiontitle sortorder srctitle srctitlenorm srctype ssids alllist content subj subheadings suppl tomb volfirst volissue volumelist webpdf webpdfpagecount yearnav figure table body mmlmath affil appendices articletitle auth authfirstini authfull authkeywords authlast footnotes primabst ref 0378-7788 03787788 true 250 250 C Volume 250 14 111218 111218 111218 20211101 1 November 2021 2021-11-01 2021 Research Articles article fla © 2021 Elsevier B.V. All rights reserved. ENDTOENDDEEPMETAMODELLINGCALIBRATEOPTIMIZEENERGYCONSUMPTIONCOMFORT COHEN M 1 Introduction 2 Related works 2.1 Physical simulators 2.2 Metamodels 2.3 Calibration 2.4 Our approach 3 Meta modelling 3.1 Notations 3.2 Proposed benchmarks 3.3 Our proposed metamodel 3.4 Dataset sampling 3.5 Training 3.6 Validation 4 Energy optimization in real buildings 4.1 Calibration 4.2 Optimization 5 Conclusion Appendix A Additional illustrations Appendix B Ranges used to train the metamodel References SHABUNKO 2018 507 516 V ZHAO 2016 362 371 J MAGNIER 2010 739 746 L BRE 2016 853 866 F RECHT 2014 T IBPSA2014ARRASFRANCE ANALYSEDELAFIABILITEDECOMFIEPARCOMPARAISONADESMESURESAPPLICATIONAUNBATIMENTPASSIF BRE 2020 109576 F REYNOLDS 2018 729 739 J OHTA 2020 1 8 Y ROMAN 2020 N SENDRAARRANZ 2020 109952 R BENGIO 1994 157 166 Y HOCHREITER 1997 1735 1780 S CHO 2014 1724 1734 K PROCEEDINGS2014CONFERENCEEMPIRICALMETHODSINNATURALLANGUAGEPROCESSINGEMNLP LEARNINGPHRASEREPRESENTATIONSUSINGRNNENCODERDECODERFORSTATISTICALMACHINETRANSLATION KRIZHEVSKY 2012 A NIPS IMAGENETCLASSIFICATIONDEEPCONVOLUTIONALNEURALNETWORKS KIM 2016 Y AAAI CHARACTERAWARENEURALLANGUAGEMODELS COAKLEY 2014 123 141 D NAGPAL 2019 1 16 S IGEL 2007 1 28 C SEYEDZADEH 2020 115908 S HANSEN 2003 1 18 N FABRIZIO 2015 2548 2574 E COHENX2021X111218 COHENX2021X111218XM NR_HAL publishAcceptedManuscriptIndexable http://www.elsevier.com/open-access/userlicense/1.0/ 2023-07-20T00:00:00.000Z http://creativecommons.org/licenses/by-nc-nd/4.0/ © 2021 Elsevier B.V. All rights reserved. 2021-07-29T20:51:30.143Z http://vtw.elsevier.com/data/voc/AddOnTypes/50.7/aggregated-refined FSMP Fondation Sciences Mathématiques de Paris http://data.elsevier.com/vocabulary/SciValFunders/501100014086 http://sws.geonames.org/3017382 0 https://doi.org/10.15223/policy-017 https://doi.org/10.15223/policy-037 https://doi.org/10.15223/policy-012 https://doi.org/10.15223/policy-029 https://doi.org/10.15223/policy-004 item S0378-7788(21)00502-8 S0378778821005028 1-s2.0-S0378778821005028 10.1016/j.enbuild.2021.111218 271089 2022-01-31T20:25:36.27124Z 2021-11-01 1-s2.0-S0378778821005028-main.pdf https://s3-eu-west-1.amazonaws.com/prod-ucs-content-store-eu-west/content/pii:S0378778821005028/MAIN/application/pdf/0980f22fefa77aa2c6f3760084a7bea7/main.pdf main.pdf pdf true 3003389 MAIN 12 1-s2.0-S0378778821005028-main_1.png https://s3-eu-west-1.amazonaws.com/prod-ucs-content-store-eu-west/content/pii:S0378778821005028/PREVIEW/image/png/dc08d6d340bf7316bb19b44060f8df78/main_1.png main_1.png png 59885 849 656 IMAGE-WEB-PDF 1 1-s2.0-S0378778821005028-gr1.jpg https://s3-eu-west-1.amazonaws.com/prod-ucs-content-store-eu-west/content/pii:S0378778821005028/gr1/DOWNSAMPLED/image/jpeg/45f166f756187d7b1403db6ea83c81ea/gr1.jpg gr1 gr1.jpg jpg 31462 246 540 IMAGE-DOWNSAMPLED 1-s2.0-S0378778821005028-gr2.jpg https://s3-eu-west-1.amazonaws.com/prod-ucs-content-store-eu-west/content/pii:S0378778821005028/gr2/DOWNSAMPLED/image/jpeg/11166d98f884803d5b726776143c035e/gr2.jpg gr2 gr2.jpg jpg 12787 147 355 IMAGE-DOWNSAMPLED 1-s2.0-S0378778821005028-gr3.jpg https://s3-eu-west-1.amazonaws.com/prod-ucs-content-store-eu-west/content/pii:S0378778821005028/gr3/DOWNSAMPLED/image/jpeg/5acebd5b3c767810951157f0fde3cf78/gr3.jpg gr3 gr3.jpg jpg 60348 388 540 IMAGE-DOWNSAMPLED 1-s2.0-S0378778821005028-gr4.jpg https://s3-eu-west-1.amazonaws.com/prod-ucs-content-store-eu-west/content/pii:S0378778821005028/gr4/DOWNSAMPLED/image/jpeg/9e57b94b705c7740fddc87c311cea518/gr4.jpg gr4 gr4.jpg jpg 67689 388 540 IMAGE-DOWNSAMPLED 1-s2.0-S0378778821005028-gr5.jpg https://s3-eu-west-1.amazonaws.com/prod-ucs-content-store-eu-west/content/pii:S0378778821005028/gr5/DOWNSAMPLED/image/jpeg/d134b01682de70cdb17103ad3140c07b/gr5.jpg gr5 gr5.jpg jpg 117799 783 540 IMAGE-DOWNSAMPLED 1-s2.0-S0378778821005028-gr6.jpg https://s3-eu-west-1.amazonaws.com/prod-ucs-content-store-eu-west/content/pii:S0378778821005028/gr6/DOWNSAMPLED/image/jpeg/09ed19f9d0589cc6944b6713abb7cfd7/gr6.jpg gr6 gr6.jpg jpg 36040 375 540 IMAGE-DOWNSAMPLED 1-s2.0-S0378778821005028-gr7.jpg https://s3-eu-west-1.amazonaws.com/prod-ucs-content-store-eu-west/content/pii:S0378778821005028/gr7/DOWNSAMPLED/image/jpeg/5ab2cdee81ac984544cd4c57fc4d81e2/gr7.jpg gr7 gr7.jpg jpg 78507 390 540 IMAGE-DOWNSAMPLED 1-s2.0-S0378778821005028-gr8.jpg https://s3-eu-west-1.amazonaws.com/prod-ucs-content-store-eu-west/content/pii:S0378778821005028/gr8/DOWNSAMPLED/image/jpeg/cdcbce413f676a61047fd0df62309f78/gr8.jpg gr8 gr8.jpg jpg 81256 390 540 IMAGE-DOWNSAMPLED 1-s2.0-S0378778821005028-gr9.jpg https://s3-eu-west-1.amazonaws.com/prod-ucs-content-store-eu-west/content/pii:S0378778821005028/gr9/DOWNSAMPLED/image/jpeg/13d2203229e3fb007a3fb7e6f048a668/gr9.jpg gr9 gr9.jpg jpg 37469 489 366 IMAGE-DOWNSAMPLED 1-s2.0-S0378778821005028-gr1.sml https://s3-eu-west-1.amazonaws.com/prod-ucs-content-store-eu-west/content/pii:S0378778821005028/gr1/THUMBNAIL/image/gif/b79b75a3d7dbc17c9419709dfb1763e0/gr1.sml gr1 gr1.sml sml 6526 100 219 IMAGE-THUMBNAIL 1-s2.0-S0378778821005028-gr2.sml https://s3-eu-west-1.amazonaws.com/prod-ucs-content-store-eu-west/content/pii:S0378778821005028/gr2/THUMBNAIL/image/gif/3a80c701a329fe91348342bc11f8b505/gr2.sml gr2 gr2.sml sml 5959 91 219 IMAGE-THUMBNAIL 1-s2.0-S0378778821005028-gr3.sml https://s3-eu-west-1.amazonaws.com/prod-ucs-content-store-eu-west/content/pii:S0378778821005028/gr3/THUMBNAIL/image/gif/a4d6fe76ce1b13220f96ebb4391279e4/gr3.sml gr3 gr3.sml sml 13261 157 219 IMAGE-THUMBNAIL 1-s2.0-S0378778821005028-gr4.sml https://s3-eu-west-1.amazonaws.com/prod-ucs-content-store-eu-west/content/pii:S0378778821005028/gr4/THUMBNAIL/image/gif/16d02a9d55b06d9754522e607f694c93/gr4.sml gr4 gr4.sml sml 15062 157 219 IMAGE-THUMBNAIL 1-s2.0-S0378778821005028-gr5.sml https://s3-eu-west-1.amazonaws.com/prod-ucs-content-store-eu-west/content/pii:S0378778821005028/gr5/THUMBNAIL/image/gif/51aeedf3adb6cf64cdc661dbb4958a02/gr5.sml gr5 gr5.sml sml 11479 164 113 IMAGE-THUMBNAIL 1-s2.0-S0378778821005028-gr6.sml https://s3-eu-west-1.amazonaws.com/prod-ucs-content-store-eu-west/content/pii:S0378778821005028/gr6/THUMBNAIL/image/gif/e05f51023f4e95f32285da0e7a3fb5e0/gr6.sml gr6 gr6.sml sml 8124 152 219 IMAGE-THUMBNAIL 1-s2.0-S0378778821005028-gr7.sml https://s3-eu-west-1.amazonaws.com/prod-ucs-content-store-eu-west/content/pii:S0378778821005028/gr7/THUMBNAIL/image/gif/464f76c95120361fad293e21c1096de6/gr7.sml gr7 gr7.sml sml 23241 158 219 IMAGE-THUMBNAIL 1-s2.0-S0378778821005028-gr8.sml https://s3-eu-west-1.amazonaws.com/prod-ucs-content-store-eu-west/content/pii:S0378778821005028/gr8/THUMBNAIL/image/gif/fc9259415fcb7ac071dffb2f3e1b9859/gr8.sml gr8 gr8.sml sml 23900 158 219 IMAGE-THUMBNAIL 1-s2.0-S0378778821005028-gr9.sml https://s3-eu-west-1.amazonaws.com/prod-ucs-content-store-eu-west/content/pii:S0378778821005028/gr9/THUMBNAIL/image/gif/0f2de158a5df6435e9039a12c968cc79/gr9.sml gr9 gr9.sml sml 5018 164 123 IMAGE-THUMBNAIL 1-s2.0-S0378778821005028-gr1_lrg.jpg https://s3-eu-west-1.amazonaws.com/prod-ucs-content-store-eu-west/content/pii:S0378778821005028/gr1/HIGHRES/image/jpeg/702e81c6696311e08d3d3935cc1523dd/gr1_lrg.jpg gr1 gr1_lrg.jpg jpg 169306 1089 2390 IMAGE-HIGH-RES 1-s2.0-S0378778821005028-gr2_lrg.jpg https://s3-eu-west-1.amazonaws.com/prod-ucs-content-store-eu-west/content/pii:S0378778821005028/gr2/HIGHRES/image/jpeg/55c1952931c5b7f40f2a1de2247efd88/gr2_lrg.jpg gr2 gr2_lrg.jpg jpg 71277 652 1575 IMAGE-HIGH-RES 1-s2.0-S0378778821005028-gr3_lrg.jpg https://s3-eu-west-1.amazonaws.com/prod-ucs-content-store-eu-west/content/pii:S0378778821005028/gr3/HIGHRES/image/jpeg/9aba15574600344421852b1abecec143/gr3_lrg.jpg gr3 gr3_lrg.jpg jpg 450143 1717 2390 IMAGE-HIGH-RES 1-s2.0-S0378778821005028-gr4_lrg.jpg https://s3-eu-west-1.amazonaws.com/prod-ucs-content-store-eu-west/content/pii:S0378778821005028/gr4/HIGHRES/image/jpeg/8f16431a16f10b4809806abb01dd43f4/gr4_lrg.jpg gr4 gr4_lrg.jpg jpg 512381 1718 2390 IMAGE-HIGH-RES 1-s2.0-S0378778821005028-gr5_lrg.jpg https://s3-eu-west-1.amazonaws.com/prod-ucs-content-store-eu-west/content/pii:S0378778821005028/gr5/HIGHRES/image/jpeg/a511f9990bec1d9fb9d6ad95feb98d7e/gr5_lrg.jpg gr5 gr5_lrg.jpg jpg 693798 3467 2390 IMAGE-HIGH-RES 1-s2.0-S0378778821005028-gr6_lrg.jpg https://s3-eu-west-1.amazonaws.com/prod-ucs-content-store-eu-west/content/pii:S0378778821005028/gr6/HIGHRES/image/jpeg/2e5361475d91128f004fac3085cf73c4/gr6_lrg.jpg gr6 gr6_lrg.jpg jpg 194976 1661 2390 IMAGE-HIGH-RES 1-s2.0-S0378778821005028-gr7_lrg.jpg https://s3-eu-west-1.amazonaws.com/prod-ucs-content-store-eu-west/content/pii:S0378778821005028/gr7/HIGHRES/image/jpeg/3c956b31c0ee895d11d7585144b5f5ef/gr7_lrg.jpg gr7 gr7_lrg.jpg jpg 525712 1724 2390 IMAGE-HIGH-RES 1-s2.0-S0378778821005028-gr8_lrg.jpg https://s3-eu-west-1.amazonaws.com/prod-ucs-content-store-eu-west/content/pii:S0378778821005028/gr8/HIGHRES/image/jpeg/4fd7a91ce862215d6444f24b2a0f2e0f/gr8_lrg.jpg gr8 gr8_lrg.jpg jpg 547337 1726 2390 IMAGE-HIGH-RES 1-s2.0-S0378778821005028-gr9_lrg.jpg https://s3-eu-west-1.amazonaws.com/prod-ucs-content-store-eu-west/content/pii:S0378778821005028/gr9/HIGHRES/image/jpeg/0fb2c3c189f30e79dcbc3f0b9d2afacd/gr9_lrg.jpg gr9 gr9_lrg.jpg jpg 234971 2165 1622 IMAGE-HIGH-RES 1-s2.0-S0378778821005028-si1.svg https://s3-eu-west-1.amazonaws.com/prod-ucs-content-store-eu-west/content/pii:S0378778821005028/STRIPIN/image/svg+xml/d8cb7c71876759967e99113fa05eac23/si1.svg si1 si1.svg svg 2208 ALTIMG 1-s2.0-S0378778821005028-si10.svg https://s3-eu-west-1.amazonaws.com/prod-ucs-content-store-eu-west/content/pii:S0378778821005028/STRIPIN/image/svg+xml/5dd9aad596f3aa6855d7e17d7faffa9a/si10.svg si10 si10.svg svg 4276 ALTIMG 1-s2.0-S0378778821005028-si100.svg https://s3-eu-west-1.amazonaws.com/prod-ucs-content-store-eu-west/content/pii:S0378778821005028/STRIPIN/image/svg+xml/65ad5b9f01e31a2c8f202324d0b7595a/si100.svg si100 si100.svg svg 4293 ALTIMG 1-s2.0-S0378778821005028-si101.svg https://s3-eu-west-1.amazonaws.com/prod-ucs-content-store-eu-west/content/pii:S0378778821005028/STRIPIN/image/svg+xml/384716656518bf624b8fe582924a2152/si101.svg si101 si101.svg svg 4868 ALTIMG 1-s2.0-S0378778821005028-si102.svg https://s3-eu-west-1.amazonaws.com/prod-ucs-content-store-eu-west/content/pii:S0378778821005028/STRIPIN/image/svg+xml/5c29aae1e86457b33cb1f5f9f0284840/si102.svg si102 si102.svg svg 4877 ALTIMG 1-s2.0-S0378778821005028-si103.svg https://s3-eu-west-1.amazonaws.com/prod-ucs-content-store-eu-west/content/pii:S0378778821005028/STRIPIN/image/svg+xml/3a27c0b7b085bf9aebc742ca30b72051/si103.svg si103 si103.svg svg 7164 ALTIMG 1-s2.0-S0378778821005028-si104.svg https://s3-eu-west-1.amazonaws.com/prod-ucs-content-store-eu-west/content/pii:S0378778821005028/STRIPIN/image/svg+xml/907a1ed5e0efa74f3b836dbe786db5e3/si104.svg si104 si104.svg svg 6164 ALTIMG 1-s2.0-S0378778821005028-si105.svg https://s3-eu-west-1.amazonaws.com/prod-ucs-content-store-eu-west/content/pii:S0378778821005028/STRIPIN/image/svg+xml/2ae875feebe411cf8bd837ef67266f08/si105.svg si105 si105.svg svg 4877 ALTIMG 1-s2.0-S0378778821005028-si106.svg https://s3-eu-west-1.amazonaws.com/prod-ucs-content-store-eu-west/content/pii:S0378778821005028/STRIPIN/image/svg+xml/c15cdd609154382ca323d3bf8393a56e/si106.svg si106 si106.svg svg 21277 ALTIMG 1-s2.0-S0378778821005028-si107.svg https://s3-eu-west-1.amazonaws.com/prod-ucs-content-store-eu-west/content/pii:S0378778821005028/STRIPIN/image/svg+xml/d0b7c00bef17083abdc32b62e5c78777/si107.svg si107 si107.svg svg 5142 ALTIMG 1-s2.0-S0378778821005028-si108.svg https://s3-eu-west-1.amazonaws.com/prod-ucs-content-store-eu-west/content/pii:S0378778821005028/STRIPIN/image/svg+xml/a98afde66f52e3e75d7ed200de74da6b/si108.svg si108 si108.svg svg 2692 ALTIMG 1-s2.0-S0378778821005028-si109.svg https://s3-eu-west-1.amazonaws.com/prod-ucs-content-store-eu-west/content/pii:S0378778821005028/STRIPIN/image/svg+xml/da5bf74f72e5dc93a1ec6e7a450ef0cf/si109.svg si109 si109.svg svg 44555 ALTIMG 1-s2.0-S0378778821005028-si11.svg https://s3-eu-west-1.amazonaws.com/prod-ucs-content-store-eu-west/content/pii:S0378778821005028/STRIPIN/image/svg+xml/2c418749be63e0cb8d0406977709ff53/si11.svg si11 si11.svg svg 2924 ALTIMG 1-s2.0-S0378778821005028-si110.svg https://s3-eu-west-1.amazonaws.com/prod-ucs-content-store-eu-west/content/pii:S0378778821005028/STRIPIN/image/svg+xml/5df93402f338a7b381f09b4ff2ec38e6/si110.svg si110 si110.svg svg 14247 ALTIMG 1-s2.0-S0378778821005028-si111.svg https://s3-eu-west-1.amazonaws.com/prod-ucs-content-store-eu-west/content/pii:S0378778821005028/STRIPIN/image/svg+xml/2051bcc95702c20d29a1d9149097f73a/si111.svg si111 si111.svg svg 1331 ALTIMG 1-s2.0-S0378778821005028-si112.svg https://s3-eu-west-1.amazonaws.com/prod-ucs-content-store-eu-west/content/pii:S0378778821005028/STRIPIN/image/svg+xml/c9908fdd1a2b8022d92c07d9f2c937a1/si112.svg si112 si112.svg svg 12253 ALTIMG 1-s2.0-S0378778821005028-si113.svg https://s3-eu-west-1.amazonaws.com/prod-ucs-content-store-eu-west/content/pii:S0378778821005028/STRIPIN/image/svg+xml/02137fad1d4507c455dd99d06e9ab537/si113.svg si113 si113.svg svg 28268 ALTIMG 1-s2.0-S0378778821005028-si114.svg https://s3-eu-west-1.amazonaws.com/prod-ucs-content-store-eu-west/content/pii:S0378778821005028/STRIPIN/image/svg+xml/a4493bd696b566ef9a02c7372ac3bdd0/si114.svg si114 si114.svg svg 1344 ALTIMG 1-s2.0-S0378778821005028-si115.svg https://s3-eu-west-1.amazonaws.com/prod-ucs-content-store-eu-west/content/pii:S0378778821005028/STRIPIN/image/svg+xml/57adfc06e8e2cac67e969a61b61fdf30/si115.svg si115 si115.svg svg 6233 ALTIMG 1-s2.0-S0378778821005028-si116.svg https://s3-eu-west-1.amazonaws.com/prod-ucs-content-store-eu-west/content/pii:S0378778821005028/STRIPIN/image/svg+xml/654aa9a743e6babd307a1185a9f63199/si116.svg si116 si116.svg svg 6186 ALTIMG 1-s2.0-S0378778821005028-si117.svg https://s3-eu-west-1.amazonaws.com/prod-ucs-content-store-eu-west/content/pii:S0378778821005028/STRIPIN/image/svg+xml/542957ea9718043970b33716b9c17f30/si117.svg si117 si117.svg svg 3138 ALTIMG 1-s2.0-S0378778821005028-si118.svg https://s3-eu-west-1.amazonaws.com/prod-ucs-content-store-eu-west/content/pii:S0378778821005028/STRIPIN/image/svg+xml/fdb3380942ae07b0c07bc808a7c65f15/si118.svg si118 si118.svg svg 1344 ALTIMG 1-s2.0-S0378778821005028-si119.svg https://s3-eu-west-1.amazonaws.com/prod-ucs-content-store-eu-west/content/pii:S0378778821005028/STRIPIN/image/svg+xml/5eddf032b47840c58e9d0e18ac0f715b/si119.svg si119 si119.svg svg 3005 ALTIMG 1-s2.0-S0378778821005028-si12.svg https://s3-eu-west-1.amazonaws.com/prod-ucs-content-store-eu-west/content/pii:S0378778821005028/STRIPIN/image/svg+xml/a85651c4cb50fdb60c8dd0c920e9c586/si12.svg si12 si12.svg svg 4742 ALTIMG 1-s2.0-S0378778821005028-si120.svg https://s3-eu-west-1.amazonaws.com/prod-ucs-content-store-eu-west/content/pii:S0378778821005028/STRIPIN/image/svg+xml/87ff728a09380fd392cb68a684c1f468/si120.svg si120 si120.svg svg 2905 ALTIMG 1-s2.0-S0378778821005028-si121.svg https://s3-eu-west-1.amazonaws.com/prod-ucs-content-store-eu-west/content/pii:S0378778821005028/STRIPIN/image/svg+xml/fa71c29e1caea01eba8dd149ba4d12c5/si121.svg si121 si121.svg svg 1480 ALTIMG 1-s2.0-S0378778821005028-si122.svg https://s3-eu-west-1.amazonaws.com/prod-ucs-content-store-eu-west/content/pii:S0378778821005028/STRIPIN/image/svg+xml/3c488d3ac24bfe0be73638c3077b9ae9/si122.svg si122 si122.svg svg 8069 ALTIMG 1-s2.0-S0378778821005028-si123.svg https://s3-eu-west-1.amazonaws.com/prod-ucs-content-store-eu-west/content/pii:S0378778821005028/STRIPIN/image/svg+xml/2dab7a24c39e40db8cdce944160dd44e/si123.svg si123 si123.svg svg 3041 ALTIMG 1-s2.0-S0378778821005028-si124.svg https://s3-eu-west-1.amazonaws.com/prod-ucs-content-store-eu-west/content/pii:S0378778821005028/STRIPIN/image/svg+xml/7e142cae7d96a3cb9a5b3e69b76932b6/si124.svg si124 si124.svg svg 47201 ALTIMG 1-s2.0-S0378778821005028-si125.svg https://s3-eu-west-1.amazonaws.com/prod-ucs-content-store-eu-west/content/pii:S0378778821005028/STRIPIN/image/svg+xml/4733855d2b6d8d5b7e93265294c9c4c9/si125.svg si125 si125.svg svg 2672 ALTIMG 1-s2.0-S0378778821005028-si126.svg https://s3-eu-west-1.amazonaws.com/prod-ucs-content-store-eu-west/content/pii:S0378778821005028/STRIPIN/image/svg+xml/32014bad9432362b1a38cd4c74814693/si126.svg si126 si126.svg svg 2919 ALTIMG 1-s2.0-S0378778821005028-si127.svg https://s3-eu-west-1.amazonaws.com/prod-ucs-content-store-eu-west/content/pii:S0378778821005028/STRIPIN/image/svg+xml/096dc3f55516ab5f99d72836dedc61db/si127.svg si127 si127.svg svg 3088 ALTIMG 1-s2.0-S0378778821005028-si128.svg https://s3-eu-west-1.amazonaws.com/prod-ucs-content-store-eu-west/content/pii:S0378778821005028/STRIPIN/image/svg+xml/9e418693c583bf8b8ff7b559d56e9cf7/si128.svg si128 si128.svg svg 3481 ALTIMG 1-s2.0-S0378778821005028-si129.svg https://s3-eu-west-1.amazonaws.com/prod-ucs-content-store-eu-west/content/pii:S0378778821005028/STRIPIN/image/svg+xml/faee4aaa63f8d3cda16a6d460a404804/si129.svg si129 si129.svg svg 1480 ALTIMG 1-s2.0-S0378778821005028-si13.svg https://s3-eu-west-1.amazonaws.com/prod-ucs-content-store-eu-west/content/pii:S0378778821005028/STRIPIN/image/svg+xml/d49d446b712ea8e98f7388709e26f11b/si13.svg si13 si13.svg svg 7325 ALTIMG 1-s2.0-S0378778821005028-si130.svg https://s3-eu-west-1.amazonaws.com/prod-ucs-content-store-eu-west/content/pii:S0378778821005028/STRIPIN/image/svg+xml/71771b447d40baf679dcf4f3b03dd5af/si130.svg si130 si130.svg svg 5169 ALTIMG 1-s2.0-S0378778821005028-si131.svg https://s3-eu-west-1.amazonaws.com/prod-ucs-content-store-eu-west/content/pii:S0378778821005028/STRIPIN/image/svg+xml/c0209948597792e6722dbbabff3717cc/si131.svg si131 si131.svg svg 3220 ALTIMG 1-s2.0-S0378778821005028-si132.svg https://s3-eu-west-1.amazonaws.com/prod-ucs-content-store-eu-west/content/pii:S0378778821005028/STRIPIN/image/svg+xml/88ec90ac52d55f597dc7de3084e6ff19/si132.svg si132 si132.svg svg 3725 ALTIMG 1-s2.0-S0378778821005028-si133.svg https://s3-eu-west-1.amazonaws.com/prod-ucs-content-store-eu-west/content/pii:S0378778821005028/STRIPIN/image/svg+xml/b809f3f9ccf9dee271dd542da30d8b9a/si133.svg si133 si133.svg svg 4843 ALTIMG 1-s2.0-S0378778821005028-si134.svg https://s3-eu-west-1.amazonaws.com/prod-ucs-content-store-eu-west/content/pii:S0378778821005028/STRIPIN/image/svg+xml/fe64cc8c84f44b7b4514c634069e7cec/si134.svg si134 si134.svg svg 5139 ALTIMG 1-s2.0-S0378778821005028-si135.svg https://s3-eu-west-1.amazonaws.com/prod-ucs-content-store-eu-west/content/pii:S0378778821005028/STRIPIN/image/svg+xml/3a19999243003719c521dd370ee05bba/si135.svg si135 si135.svg svg 6428 ALTIMG 1-s2.0-S0378778821005028-si136.svg https://s3-eu-west-1.amazonaws.com/prod-ucs-content-store-eu-west/content/pii:S0378778821005028/STRIPIN/image/svg+xml/ed1e650748fa9b89c1c4d964e5f77145/si136.svg si136 si136.svg svg 6729 ALTIMG 1-s2.0-S0378778821005028-si137.svg https://s3-eu-west-1.amazonaws.com/prod-ucs-content-store-eu-west/content/pii:S0378778821005028/STRIPIN/image/svg+xml/22f5dd7c48983e9986622592d562f81e/si137.svg si137 si137.svg svg 4364 ALTIMG 1-s2.0-S0378778821005028-si138.svg https://s3-eu-west-1.amazonaws.com/prod-ucs-content-store-eu-west/content/pii:S0378778821005028/STRIPIN/image/svg+xml/69f9d3a24f40b4d4195e2e39196dc5f5/si138.svg si138 si138.svg svg 8020 ALTIMG 1-s2.0-S0378778821005028-si139.svg https://s3-eu-west-1.amazonaws.com/prod-ucs-content-store-eu-west/content/pii:S0378778821005028/STRIPIN/image/svg+xml/7cfd6205dcf33098975791973859371a/si139.svg si139 si139.svg svg 11091 ALTIMG 1-s2.0-S0378778821005028-si14.svg https://s3-eu-west-1.amazonaws.com/prod-ucs-content-store-eu-west/content/pii:S0378778821005028/STRIPIN/image/svg+xml/a2d9568894bb29477fdc3613aab93d34/si14.svg si14 si14.svg svg 5858 ALTIMG 1-s2.0-S0378778821005028-si140.svg https://s3-eu-west-1.amazonaws.com/prod-ucs-content-store-eu-west/content/pii:S0378778821005028/STRIPIN/image/svg+xml/16efa0384f455a0f9e3917391651928c/si140.svg si140 si140.svg svg 6998 ALTIMG 1-s2.0-S0378778821005028-si141.svg https://s3-eu-west-1.amazonaws.com/prod-ucs-content-store-eu-west/content/pii:S0378778821005028/STRIPIN/image/svg+xml/502dd5c39207c25a5d13c7396435e41e/si141.svg si141 si141.svg svg 7754 ALTIMG 1-s2.0-S0378778821005028-si142.svg https://s3-eu-west-1.amazonaws.com/prod-ucs-content-store-eu-west/content/pii:S0378778821005028/STRIPIN/image/svg+xml/fae576b7289b7f9e7e4d0bb8eb4a461f/si142.svg si142 si142.svg svg 4681 ALTIMG 1-s2.0-S0378778821005028-si143.svg https://s3-eu-west-1.amazonaws.com/prod-ucs-content-store-eu-west/content/pii:S0378778821005028/STRIPIN/image/svg+xml/bd8a745037bac4c23af0e3a6a91f9cae/si143.svg si143 si143.svg svg 8556 ALTIMG 1-s2.0-S0378778821005028-si144.svg https://s3-eu-west-1.amazonaws.com/prod-ucs-content-store-eu-west/content/pii:S0378778821005028/STRIPIN/image/svg+xml/cf2e69915b531ad395e4d7ba87ef124c/si144.svg si144 si144.svg svg 11188 ALTIMG 1-s2.0-S0378778821005028-si145.svg https://s3-eu-west-1.amazonaws.com/prod-ucs-content-store-eu-west/content/pii:S0378778821005028/STRIPIN/image/svg+xml/461f040e102b794f9a8086da438f8fd4/si145.svg si145 si145.svg svg 6679 ALTIMG 1-s2.0-S0378778821005028-si146.svg https://s3-eu-west-1.amazonaws.com/prod-ucs-content-store-eu-west/content/pii:S0378778821005028/STRIPIN/image/svg+xml/dfb884d3205216e46d51ba981d08fc3e/si146.svg si146 si146.svg svg 7806 ALTIMG 1-s2.0-S0378778821005028-si147.svg https://s3-eu-west-1.amazonaws.com/prod-ucs-content-store-eu-west/content/pii:S0378778821005028/STRIPIN/image/svg+xml/8f2e1c8cf261bf5dbd5102e1cf4457bf/si147.svg si147 si147.svg svg 8098 ALTIMG 1-s2.0-S0378778821005028-si148.svg https://s3-eu-west-1.amazonaws.com/prod-ucs-content-store-eu-west/content/pii:S0378778821005028/STRIPIN/image/svg+xml/98e11379f315790f9ac676718694ef2a/si148.svg si148 si148.svg svg 4532 ALTIMG 1-s2.0-S0378778821005028-si149.svg https://s3-eu-west-1.amazonaws.com/prod-ucs-content-store-eu-west/content/pii:S0378778821005028/STRIPIN/image/svg+xml/99e9e8c97ce7ac9c62eef9ad37fd527f/si149.svg si149 si149.svg svg 3430 ALTIMG 1-s2.0-S0378778821005028-si15.svg https://s3-eu-west-1.amazonaws.com/prod-ucs-content-store-eu-west/content/pii:S0378778821005028/STRIPIN/image/svg+xml/012b877022f7db2b39ee5ba396a043fe/si15.svg si15 si15.svg svg 6642 ALTIMG 1-s2.0-S0378778821005028-si150.svg https://s3-eu-west-1.amazonaws.com/prod-ucs-content-store-eu-west/content/pii:S0378778821005028/STRIPIN/image/svg+xml/0dc5fb787c90283c8a23a1fdf9d993ea/si150.svg si150 si150.svg svg 5220 ALTIMG 1-s2.0-S0378778821005028-si151.svg https://s3-eu-west-1.amazonaws.com/prod-ucs-content-store-eu-west/content/pii:S0378778821005028/STRIPIN/image/svg+xml/d7dc05db68e37fb910d486937e0179e8/si151.svg si151 si151.svg svg 1345 ALTIMG 1-s2.0-S0378778821005028-si152.svg https://s3-eu-west-1.amazonaws.com/prod-ucs-content-store-eu-west/content/pii:S0378778821005028/STRIPIN/image/svg+xml/9f48516c390fb3cb2e24d2b2fe742e8c/si152.svg si152 si152.svg svg 8137 ALTIMG 1-s2.0-S0378778821005028-si153.svg https://s3-eu-west-1.amazonaws.com/prod-ucs-content-store-eu-west/content/pii:S0378778821005028/STRIPIN/image/svg+xml/693a4632cdfc8314961be343d7528cf6/si153.svg si153 si153.svg svg 1345 ALTIMG 1-s2.0-S0378778821005028-si154.svg https://s3-eu-west-1.amazonaws.com/prod-ucs-content-store-eu-west/content/pii:S0378778821005028/STRIPIN/image/svg+xml/e269118ab4cd8fa299dd1749b3c53cba/si154.svg si154 si154.svg svg 1480 ALTIMG 1-s2.0-S0378778821005028-si155.svg https://s3-eu-west-1.amazonaws.com/prod-ucs-content-store-eu-west/content/pii:S0378778821005028/STRIPIN/image/svg+xml/125571ae1eb259e555dd4bc66c2bedc1/si155.svg si155 si155.svg svg 1345 ALTIMG 1-s2.0-S0378778821005028-si156.svg https://s3-eu-west-1.amazonaws.com/prod-ucs-content-store-eu-west/content/pii:S0378778821005028/STRIPIN/image/svg+xml/5566c8f59855290059c5dd420e229e64/si156.svg si156 si156.svg svg 8137 ALTIMG 1-s2.0-S0378778821005028-si157.svg https://s3-eu-west-1.amazonaws.com/prod-ucs-content-store-eu-west/content/pii:S0378778821005028/STRIPIN/image/svg+xml/485962cfc611aed92daab02aceef86e7/si157.svg si157 si157.svg svg 6108 ALTIMG 1-s2.0-S0378778821005028-si158.svg https://s3-eu-west-1.amazonaws.com/prod-ucs-content-store-eu-west/content/pii:S0378778821005028/STRIPIN/image/svg+xml/f782720b73b4c71f15574b0a28aef061/si158.svg si158 si158.svg svg 4141 ALTIMG 1-s2.0-S0378778821005028-si159.svg https://s3-eu-west-1.amazonaws.com/prod-ucs-content-store-eu-west/content/pii:S0378778821005028/STRIPIN/image/svg+xml/93e7346aa6372db711b9e2666de8b6f0/si159.svg si159 si159.svg svg 9029 ALTIMG 1-s2.0-S0378778821005028-si16.svg https://s3-eu-west-1.amazonaws.com/prod-ucs-content-store-eu-west/content/pii:S0378778821005028/STRIPIN/image/svg+xml/864ba17b2f383b94223c0ea90d8787d7/si16.svg si16 si16.svg svg 6558 ALTIMG 1-s2.0-S0378778821005028-si160.svg https://s3-eu-west-1.amazonaws.com/prod-ucs-content-store-eu-west/content/pii:S0378778821005028/STRIPIN/image/svg+xml/c9b47702ddebefe69bde8900e17a1589/si160.svg si160 si160.svg svg 8701 ALTIMG 1-s2.0-S0378778821005028-si161.svg https://s3-eu-west-1.amazonaws.com/prod-ucs-content-store-eu-west/content/pii:S0378778821005028/STRIPIN/image/svg+xml/f39f2dbc8d6ecab8131d919189a746f8/si161.svg si161 si161.svg svg 9156 ALTIMG 1-s2.0-S0378778821005028-si162.svg https://s3-eu-west-1.amazonaws.com/prod-ucs-content-store-eu-west/content/pii:S0378778821005028/STRIPIN/image/svg+xml/5e233c78f5791d343b07d475e790242f/si162.svg si162 si162.svg svg 37892 ALTIMG 1-s2.0-S0378778821005028-si163.svg https://s3-eu-west-1.amazonaws.com/prod-ucs-content-store-eu-west/content/pii:S0378778821005028/STRIPIN/image/svg+xml/f4025f7c4eaf3cf8f28acc2ba0662366/si163.svg si163 si163.svg svg 21961 ALTIMG 1-s2.0-S0378778821005028-si164.svg https://s3-eu-west-1.amazonaws.com/prod-ucs-content-store-eu-west/content/pii:S0378778821005028/STRIPIN/image/svg+xml/4e417d30a99db3e9dbf2bbc6e52d7894/si164.svg si164 si164.svg svg 9029 ALTIMG 1-s2.0-S0378778821005028-si165.svg https://s3-eu-west-1.amazonaws.com/prod-ucs-content-store-eu-west/content/pii:S0378778821005028/STRIPIN/image/svg+xml/caffcd2286a4f7a3537f89ebb9b72656/si165.svg si165 si165.svg svg 5335 ALTIMG 1-s2.0-S0378778821005028-si166.svg https://s3-eu-west-1.amazonaws.com/prod-ucs-content-store-eu-west/content/pii:S0378778821005028/STRIPIN/image/svg+xml/bcaea0847d391d1c0e41514714a93eda/si166.svg si166 si166.svg svg 8054 ALTIMG 1-s2.0-S0378778821005028-si167.svg https://s3-eu-west-1.amazonaws.com/prod-ucs-content-store-eu-west/content/pii:S0378778821005028/STRIPIN/image/svg+xml/f33c96a328be3f8ab99f24c1c0f7b9f8/si167.svg si167 si167.svg svg 9029 ALTIMG 1-s2.0-S0378778821005028-si168.svg https://s3-eu-west-1.amazonaws.com/prod-ucs-content-store-eu-west/content/pii:S0378778821005028/STRIPIN/image/svg+xml/313d2aa25a5a4f120a96737490012bb7/si168.svg si168 si168.svg svg 4141 ALTIMG 1-s2.0-S0378778821005028-si169.svg https://s3-eu-west-1.amazonaws.com/prod-ucs-content-store-eu-west/content/pii:S0378778821005028/STRIPIN/image/svg+xml/b1c9355bc6e670579d0984b62469478a/si169.svg si169 si169.svg svg 1345 ALTIMG 1-s2.0-S0378778821005028-si17.svg https://s3-eu-west-1.amazonaws.com/prod-ucs-content-store-eu-west/content/pii:S0378778821005028/STRIPIN/image/svg+xml/6a922fc5458e60bf2a31151ec4d6f3e1/si17.svg si17 si17.svg svg 7172 ALTIMG 1-s2.0-S0378778821005028-si170.svg https://s3-eu-west-1.amazonaws.com/prod-ucs-content-store-eu-west/content/pii:S0378778821005028/STRIPIN/image/svg+xml/12798d76d797466ecbcb964b6ed66fed/si170.svg si170 si170.svg svg 2905 ALTIMG 1-s2.0-S0378778821005028-si171.svg https://s3-eu-west-1.amazonaws.com/prod-ucs-content-store-eu-west/content/pii:S0378778821005028/STRIPIN/image/svg+xml/3455784b72be564a25b3995a32babc11/si171.svg si171 si171.svg svg 3006 ALTIMG 1-s2.0-S0378778821005028-si172.svg https://s3-eu-west-1.amazonaws.com/prod-ucs-content-store-eu-west/content/pii:S0378778821005028/STRIPIN/image/svg+xml/db44b0de93bb7c88ef8b413b8598d0d9/si172.svg si172 si172.svg svg 3094 ALTIMG 1-s2.0-S0378778821005028-si173.svg https://s3-eu-west-1.amazonaws.com/prod-ucs-content-store-eu-west/content/pii:S0378778821005028/STRIPIN/image/svg+xml/475c349c76afd8412a637d409bf7cc9e/si173.svg si173 si173.svg svg 34428 ALTIMG 1-s2.0-S0378778821005028-si174.svg https://s3-eu-west-1.amazonaws.com/prod-ucs-content-store-eu-west/content/pii:S0378778821005028/STRIPIN/image/svg+xml/c03e25c7117a11f40640047718869ee9/si174.svg si174 si174.svg svg 9580 ALTIMG 1-s2.0-S0378778821005028-si175.svg https://s3-eu-west-1.amazonaws.com/prod-ucs-content-store-eu-west/content/pii:S0378778821005028/STRIPIN/image/svg+xml/5b3763fc47d0e178b2575a489899d538/si175.svg si175 si175.svg svg 1972 ALTIMG 1-s2.0-S0378778821005028-si176.svg https://s3-eu-west-1.amazonaws.com/prod-ucs-content-store-eu-west/content/pii:S0378778821005028/STRIPIN/image/svg+xml/963472f030b79d37d7e78240d070007f/si176.svg si176 si176.svg svg 3050 ALTIMG 1-s2.0-S0378778821005028-si177.svg https://s3-eu-west-1.amazonaws.com/prod-ucs-content-store-eu-west/content/pii:S0378778821005028/STRIPIN/image/svg+xml/cf7370ee3522492871464157598f699b/si177.svg si177 si177.svg svg 3994 ALTIMG 1-s2.0-S0378778821005028-si178.svg https://s3-eu-west-1.amazonaws.com/prod-ucs-content-store-eu-west/content/pii:S0378778821005028/STRIPIN/image/svg+xml/c74f9d270f0ed60423fddc309244a02d/si178.svg si178 si178.svg svg 3421 ALTIMG 1-s2.0-S0378778821005028-si18.svg https://s3-eu-west-1.amazonaws.com/prod-ucs-content-store-eu-west/content/pii:S0378778821005028/STRIPIN/image/svg+xml/525a251cea3fe6bd0718832cfcd508d6/si18.svg si18 si18.svg svg 4843 ALTIMG 1-s2.0-S0378778821005028-si19.svg https://s3-eu-west-1.amazonaws.com/prod-ucs-content-store-eu-west/content/pii:S0378778821005028/STRIPIN/image/svg+xml/1114e7fc7c06b3b62b597f43524b0650/si19.svg si19 si19.svg svg 4925 ALTIMG 1-s2.0-S0378778821005028-si2.svg https://s3-eu-west-1.amazonaws.com/prod-ucs-content-store-eu-west/content/pii:S0378778821005028/STRIPIN/image/svg+xml/b9d59d4f4f4c470520e8624ad1d3f412/si2.svg si2 si2.svg svg 2593 ALTIMG 1-s2.0-S0378778821005028-si20.svg https://s3-eu-west-1.amazonaws.com/prod-ucs-content-store-eu-west/content/pii:S0378778821005028/STRIPIN/image/svg+xml/262a9338b408bb35cb260ab5db58360a/si20.svg si20 si20.svg svg 6600 ALTIMG 1-s2.0-S0378778821005028-si21.svg https://s3-eu-west-1.amazonaws.com/prod-ucs-content-store-eu-west/content/pii:S0378778821005028/STRIPIN/image/svg+xml/018a3191db70c5a22a6da6cdb378de56/si21.svg si21 si21.svg svg 7562 ALTIMG 1-s2.0-S0378778821005028-si22.svg https://s3-eu-west-1.amazonaws.com/prod-ucs-content-store-eu-west/content/pii:S0378778821005028/STRIPIN/image/svg+xml/d17e2c2fb887f6020455bdd6aca42113/si22.svg si22 si22.svg svg 7624 ALTIMG 1-s2.0-S0378778821005028-si23.svg https://s3-eu-west-1.amazonaws.com/prod-ucs-content-store-eu-west/content/pii:S0378778821005028/STRIPIN/image/svg+xml/ca53387f63c582420574a6aff97bbe65/si23.svg si23 si23.svg svg 6414 ALTIMG 1-s2.0-S0378778821005028-si24.svg https://s3-eu-west-1.amazonaws.com/prod-ucs-content-store-eu-west/content/pii:S0378778821005028/STRIPIN/image/svg+xml/281c07988f6ed37f5877f6c6896ea82b/si24.svg si24 si24.svg svg 6604 ALTIMG 1-s2.0-S0378778821005028-si25.svg https://s3-eu-west-1.amazonaws.com/prod-ucs-content-store-eu-west/content/pii:S0378778821005028/STRIPIN/image/svg+xml/7cb4680b7c9b14b4032bc8ac965e5e5c/si25.svg si25 si25.svg svg 5139 ALTIMG 1-s2.0-S0378778821005028-si26.svg https://s3-eu-west-1.amazonaws.com/prod-ucs-content-store-eu-west/content/pii:S0378778821005028/STRIPIN/image/svg+xml/8714752ff9707ea8e84b49b287e449d3/si26.svg si26 si26.svg svg 4742 ALTIMG 1-s2.0-S0378778821005028-si27.svg https://s3-eu-west-1.amazonaws.com/prod-ucs-content-store-eu-west/content/pii:S0378778821005028/STRIPIN/image/svg+xml/4bb7ecdbd261ed0674cd4585c18c20e6/si27.svg si27 si27.svg svg 8762 ALTIMG 1-s2.0-S0378778821005028-si28.svg https://s3-eu-west-1.amazonaws.com/prod-ucs-content-store-eu-west/content/pii:S0378778821005028/STRIPIN/image/svg+xml/6dc370b8c610b8a156fdb708ce93de9c/si28.svg si28 si28.svg svg 7258 ALTIMG 1-s2.0-S0378778821005028-si29.svg https://s3-eu-west-1.amazonaws.com/prod-ucs-content-store-eu-west/content/pii:S0378778821005028/STRIPIN/image/svg+xml/ebe28603d045137e5831d894cdea8b94/si29.svg si29 si29.svg svg 6016 ALTIMG 1-s2.0-S0378778821005028-si3.svg https://s3-eu-west-1.amazonaws.com/prod-ucs-content-store-eu-west/content/pii:S0378778821005028/STRIPIN/image/svg+xml/48e3935d6efb05dc4099c158c2d64b45/si3.svg si3 si3.svg svg 2661 ALTIMG 1-s2.0-S0378778821005028-si30.svg https://s3-eu-west-1.amazonaws.com/prod-ucs-content-store-eu-west/content/pii:S0378778821005028/STRIPIN/image/svg+xml/c6ea2af1acbdedb9210c17754ea704c2/si30.svg si30 si30.svg svg 6128 ALTIMG 1-s2.0-S0378778821005028-si31.svg https://s3-eu-west-1.amazonaws.com/prod-ucs-content-store-eu-west/content/pii:S0378778821005028/STRIPIN/image/svg+xml/72d9ed51d3f718340cb146eafa75c798/si31.svg si31 si31.svg svg 6692 ALTIMG 1-s2.0-S0378778821005028-si32.svg https://s3-eu-west-1.amazonaws.com/prod-ucs-content-store-eu-west/content/pii:S0378778821005028/STRIPIN/image/svg+xml/690fb4bd353b0dabe9e867bfc3e8a478/si32.svg si32 si32.svg svg 6428 ALTIMG 1-s2.0-S0378778821005028-si33.svg https://s3-eu-west-1.amazonaws.com/prod-ucs-content-store-eu-west/content/pii:S0378778821005028/STRIPIN/image/svg+xml/5ee03fcd5633f497e892f5ac85b71143/si33.svg si33 si33.svg svg 4925 ALTIMG 1-s2.0-S0378778821005028-si34.svg https://s3-eu-west-1.amazonaws.com/prod-ucs-content-store-eu-west/content/pii:S0378778821005028/STRIPIN/image/svg+xml/0cef4910a7623f2daf5836c78a899b14/si34.svg si34 si34.svg svg 6575 ALTIMG 1-s2.0-S0378778821005028-si35.svg https://s3-eu-west-1.amazonaws.com/prod-ucs-content-store-eu-west/content/pii:S0378778821005028/STRIPIN/image/svg+xml/09b389b1d2cc339fb93f825b315d80a0/si35.svg si35 si35.svg svg 6532 ALTIMG 1-s2.0-S0378778821005028-si36.svg https://s3-eu-west-1.amazonaws.com/prod-ucs-content-store-eu-west/content/pii:S0378778821005028/STRIPIN/image/svg+xml/19b57279695af2cefe5cc9004c092ee4/si36.svg si36 si36.svg svg 8377 ALTIMG 1-s2.0-S0378778821005028-si37.svg https://s3-eu-west-1.amazonaws.com/prod-ucs-content-store-eu-west/content/pii:S0378778821005028/STRIPIN/image/svg+xml/15abb3b28f7054902f3ee094bef14526/si37.svg si37 si37.svg svg 7064 ALTIMG 1-s2.0-S0378778821005028-si38.svg https://s3-eu-west-1.amazonaws.com/prod-ucs-content-store-eu-west/content/pii:S0378778821005028/STRIPIN/image/svg+xml/43fa9b338529e335f73348c17f23ea0a/si38.svg si38 si38.svg svg 6814 ALTIMG 1-s2.0-S0378778821005028-si39.svg https://s3-eu-west-1.amazonaws.com/prod-ucs-content-store-eu-west/content/pii:S0378778821005028/STRIPIN/image/svg+xml/dbf850fa5c7811f0877dd558c2c7fac2/si39.svg si39 si39.svg svg 6729 ALTIMG 1-s2.0-S0378778821005028-si4.svg https://s3-eu-west-1.amazonaws.com/prod-ucs-content-store-eu-west/content/pii:S0378778821005028/STRIPIN/image/svg+xml/7653370dde3de50cb3da0409084ea212/si4.svg si4 si4.svg svg 2101 ALTIMG 1-s2.0-S0378778821005028-si40.svg https://s3-eu-west-1.amazonaws.com/prod-ucs-content-store-eu-west/content/pii:S0378778821005028/STRIPIN/image/svg+xml/560cff0d7df4bd87f1ba42baf54c1975/si40.svg si40 si40.svg svg 4742 ALTIMG 1-s2.0-S0378778821005028-si41.svg https://s3-eu-west-1.amazonaws.com/prod-ucs-content-store-eu-west/content/pii:S0378778821005028/STRIPIN/image/svg+xml/2a4966f6a9c2251b160f103efe561fd2/si41.svg si41 si41.svg svg 6136 ALTIMG 1-s2.0-S0378778821005028-si42.svg https://s3-eu-west-1.amazonaws.com/prod-ucs-content-store-eu-west/content/pii:S0378778821005028/STRIPIN/image/svg+xml/0f9ac1a5585caacc6fa5ee3b472d6133/si42.svg si42 si42.svg svg 7210 ALTIMG 1-s2.0-S0378778821005028-si43.svg https://s3-eu-west-1.amazonaws.com/prod-ucs-content-store-eu-west/content/pii:S0378778821005028/STRIPIN/image/svg+xml/549b42be9b2e3065ff80935327eb89d9/si43.svg si43 si43.svg svg 7315 ALTIMG 1-s2.0-S0378778821005028-si44.svg https://s3-eu-west-1.amazonaws.com/prod-ucs-content-store-eu-west/content/pii:S0378778821005028/STRIPIN/image/svg+xml/6c3fa9c79694d5ea87c9a372429e2b15/si44.svg si44 si44.svg svg 7945 ALTIMG 1-s2.0-S0378778821005028-si45.svg https://s3-eu-west-1.amazonaws.com/prod-ucs-content-store-eu-west/content/pii:S0378778821005028/STRIPIN/image/svg+xml/94165afc8600b6f977fe5656f29e9aea/si45.svg si45 si45.svg svg 7714 ALTIMG 1-s2.0-S0378778821005028-si46.svg https://s3-eu-west-1.amazonaws.com/prod-ucs-content-store-eu-west/content/pii:S0378778821005028/STRIPIN/image/svg+xml/1e84ff996a48a00764a3d896513df358/si46.svg si46 si46.svg svg 4364 ALTIMG 1-s2.0-S0378778821005028-si47.svg https://s3-eu-west-1.amazonaws.com/prod-ucs-content-store-eu-west/content/pii:S0378778821005028/STRIPIN/image/svg+xml/7d2a4f7381f2239f3c4cc7c90cb8a631/si47.svg si47 si47.svg svg 5192 ALTIMG 1-s2.0-S0378778821005028-si48.svg https://s3-eu-west-1.amazonaws.com/prod-ucs-content-store-eu-west/content/pii:S0378778821005028/STRIPIN/image/svg+xml/e0cba5f34f9a297723f9e8974647c5a7/si48.svg si48 si48.svg svg 6713 ALTIMG 1-s2.0-S0378778821005028-si49.svg https://s3-eu-west-1.amazonaws.com/prod-ucs-content-store-eu-west/content/pii:S0378778821005028/STRIPIN/image/svg+xml/395d3a193fd7da922dcad242026da2e7/si49.svg si49 si49.svg svg 6206 ALTIMG 1-s2.0-S0378778821005028-si5.svg https://s3-eu-west-1.amazonaws.com/prod-ucs-content-store-eu-west/content/pii:S0378778821005028/STRIPIN/image/svg+xml/1b5394610b6b23d9961a4e6a3b8a8e45/si5.svg si5 si5.svg svg 2967 ALTIMG 1-s2.0-S0378778821005028-si50.svg https://s3-eu-west-1.amazonaws.com/prod-ucs-content-store-eu-west/content/pii:S0378778821005028/STRIPIN/image/svg+xml/79982f16e23c1848860f556ad3f0b26d/si50.svg si50 si50.svg svg 7342 ALTIMG 1-s2.0-S0378778821005028-si51.svg https://s3-eu-west-1.amazonaws.com/prod-ucs-content-store-eu-west/content/pii:S0378778821005028/STRIPIN/image/svg+xml/0768ea013fa60d33a68b2aaba7b949a0/si51.svg si51 si51.svg svg 7364 ALTIMG 1-s2.0-S0378778821005028-si52.svg https://s3-eu-west-1.amazonaws.com/prod-ucs-content-store-eu-west/content/pii:S0378778821005028/STRIPIN/image/svg+xml/500ee659afcdd5f3404989fbd29efbe9/si52.svg si52 si52.svg svg 7013 ALTIMG 1-s2.0-S0378778821005028-si53.svg https://s3-eu-west-1.amazonaws.com/prod-ucs-content-store-eu-west/content/pii:S0378778821005028/STRIPIN/image/svg+xml/bc025f4b46a79f5fc57bbdf7e99282ff/si53.svg si53 si53.svg svg 11915 ALTIMG 1-s2.0-S0378778821005028-si54.svg https://s3-eu-west-1.amazonaws.com/prod-ucs-content-store-eu-west/content/pii:S0378778821005028/STRIPIN/image/svg+xml/ac0f24007ec17459658da5f3eee714de/si54.svg si54 si54.svg svg 2572 ALTIMG 1-s2.0-S0378778821005028-si55.svg https://s3-eu-west-1.amazonaws.com/prod-ucs-content-store-eu-west/content/pii:S0378778821005028/STRIPIN/image/svg+xml/5c07ae7c447cc1279f49c1d865e0dacc/si55.svg si55 si55.svg svg 5354 ALTIMG 1-s2.0-S0378778821005028-si56.svg https://s3-eu-west-1.amazonaws.com/prod-ucs-content-store-eu-west/content/pii:S0378778821005028/STRIPIN/image/svg+xml/9bf07e4215157961aee84fbb48361328/si56.svg si56 si56.svg svg 10080 ALTIMG 1-s2.0-S0378778821005028-si57.svg https://s3-eu-west-1.amazonaws.com/prod-ucs-content-store-eu-west/content/pii:S0378778821005028/STRIPIN/image/svg+xml/c3b12625175f3f28f5332ff1ee02f955/si57.svg si57 si57.svg svg 5110 ALTIMG 1-s2.0-S0378778821005028-si58.svg https://s3-eu-west-1.amazonaws.com/prod-ucs-content-store-eu-west/content/pii:S0378778821005028/STRIPIN/image/svg+xml/c8b4bc15795a6df8ac97497328da4933/si58.svg si58 si58.svg svg 9838 ALTIMG 1-s2.0-S0378778821005028-si59.svg https://s3-eu-west-1.amazonaws.com/prod-ucs-content-store-eu-west/content/pii:S0378778821005028/STRIPIN/image/svg+xml/ab0d87b05008f7a6dfab0625d17cea70/si59.svg si59 si59.svg svg 3994 ALTIMG 1-s2.0-S0378778821005028-si6.svg https://s3-eu-west-1.amazonaws.com/prod-ucs-content-store-eu-west/content/pii:S0378778821005028/STRIPIN/image/svg+xml/b821e24ad334130b4f02bcc7fcb5cd6d/si6.svg si6 si6.svg svg 2600 ALTIMG 1-s2.0-S0378778821005028-si60.svg https://s3-eu-west-1.amazonaws.com/prod-ucs-content-store-eu-west/content/pii:S0378778821005028/STRIPIN/image/svg+xml/b268eb6a20f3d9aaf0cc6f16ed73cc5b/si60.svg si60 si60.svg svg 3994 ALTIMG 1-s2.0-S0378778821005028-si61.svg https://s3-eu-west-1.amazonaws.com/prod-ucs-content-store-eu-west/content/pii:S0378778821005028/STRIPIN/image/svg+xml/367c34ed3ffbd75ad6ebc6deef82bf14/si61.svg si61 si61.svg svg 3994 ALTIMG 1-s2.0-S0378778821005028-si62.svg https://s3-eu-west-1.amazonaws.com/prod-ucs-content-store-eu-west/content/pii:S0378778821005028/STRIPIN/image/svg+xml/db13569bed956d6e070cb1aff2b73485/si62.svg si62 si62.svg svg 1345 ALTIMG 1-s2.0-S0378778821005028-si63.svg https://s3-eu-west-1.amazonaws.com/prod-ucs-content-store-eu-west/content/pii:S0378778821005028/STRIPIN/image/svg+xml/4c4e1b0ee2fcebb68d432d2469f150f4/si63.svg si63 si63.svg svg 1240 ALTIMG 1-s2.0-S0378778821005028-si64.svg https://s3-eu-west-1.amazonaws.com/prod-ucs-content-store-eu-west/content/pii:S0378778821005028/STRIPIN/image/svg+xml/6690c88071267143222d7cd4f59bfeb9/si64.svg si64 si64.svg svg 1170 ALTIMG 1-s2.0-S0378778821005028-si65.svg https://s3-eu-west-1.amazonaws.com/prod-ucs-content-store-eu-west/content/pii:S0378778821005028/STRIPIN/image/svg+xml/07b65302d17dbaece3c0807bb5b2c5db/si65.svg si65 si65.svg svg 6122 ALTIMG 1-s2.0-S0378778821005028-si66.svg https://s3-eu-west-1.amazonaws.com/prod-ucs-content-store-eu-west/content/pii:S0378778821005028/STRIPIN/image/svg+xml/06f2d0fc789a1f4704d97e3c7e25df70/si66.svg si66 si66.svg svg 7754 ALTIMG 1-s2.0-S0378778821005028-si67.svg https://s3-eu-west-1.amazonaws.com/prod-ucs-content-store-eu-west/content/pii:S0378778821005028/STRIPIN/image/svg+xml/e97f581c36cce854b5595358128485de/si67.svg si67 si67.svg svg 2682 ALTIMG 1-s2.0-S0378778821005028-si68.svg https://s3-eu-west-1.amazonaws.com/prod-ucs-content-store-eu-west/content/pii:S0378778821005028/STRIPIN/image/svg+xml/561fcb3f84268ad2f283aed7092d9e55/si68.svg si68 si68.svg svg 2682 ALTIMG 1-s2.0-S0378778821005028-si69.svg https://s3-eu-west-1.amazonaws.com/prod-ucs-content-store-eu-west/content/pii:S0378778821005028/STRIPIN/image/svg+xml/1ae2de4b0fd132bea96354ffdd4a691d/si69.svg si69 si69.svg svg 2224 ALTIMG 1-s2.0-S0378778821005028-si7.svg https://s3-eu-west-1.amazonaws.com/prod-ucs-content-store-eu-west/content/pii:S0378778821005028/STRIPIN/image/svg+xml/a425039ee84ea09f3c32b6e3f0d08a44/si7.svg si7 si7.svg svg 6108 ALTIMG 1-s2.0-S0378778821005028-si70.svg https://s3-eu-west-1.amazonaws.com/prod-ucs-content-store-eu-west/content/pii:S0378778821005028/STRIPIN/image/svg+xml/221d2ad9850c4772d1c0e3e434a20219/si70.svg si70 si70.svg svg 2224 ALTIMG 1-s2.0-S0378778821005028-si71.svg https://s3-eu-west-1.amazonaws.com/prod-ucs-content-store-eu-west/content/pii:S0378778821005028/STRIPIN/image/svg+xml/c10d41597150225ff92a02c98d7cca4e/si71.svg si71 si71.svg svg 2224 ALTIMG 1-s2.0-S0378778821005028-si72.svg https://s3-eu-west-1.amazonaws.com/prod-ucs-content-store-eu-west/content/pii:S0378778821005028/STRIPIN/image/svg+xml/be2942bc99def267a44a6194dd806991/si72.svg si72 si72.svg svg 2224 ALTIMG 1-s2.0-S0378778821005028-si73.svg https://s3-eu-west-1.amazonaws.com/prod-ucs-content-store-eu-west/content/pii:S0378778821005028/STRIPIN/image/svg+xml/6fdaa1a571740c83a463dd3b6689e783/si73.svg si73 si73.svg svg 2224 ALTIMG 1-s2.0-S0378778821005028-si74.svg https://s3-eu-west-1.amazonaws.com/prod-ucs-content-store-eu-west/content/pii:S0378778821005028/STRIPIN/image/svg+xml/694b619801692ff565a82d6d4e731f27/si74.svg si74 si74.svg svg 2905 ALTIMG 1-s2.0-S0378778821005028-si75.svg https://s3-eu-west-1.amazonaws.com/prod-ucs-content-store-eu-west/content/pii:S0378778821005028/STRIPIN/image/svg+xml/7fbdae273d45ee999d0846d9ff7b3c3f/si75.svg si75 si75.svg svg 2081 ALTIMG 1-s2.0-S0378778821005028-si76.svg https://s3-eu-west-1.amazonaws.com/prod-ucs-content-store-eu-west/content/pii:S0378778821005028/STRIPIN/image/svg+xml/494016a2fef1c6b5a1c4b0f73335a6e4/si76.svg si76 si76.svg svg 2081 ALTIMG 1-s2.0-S0378778821005028-si77.svg https://s3-eu-west-1.amazonaws.com/prod-ucs-content-store-eu-west/content/pii:S0378778821005028/STRIPIN/image/svg+xml/7d1d5ef3df3325dd68ec0f1bde4ba78f/si77.svg si77 si77.svg svg 2081 ALTIMG 1-s2.0-S0378778821005028-si78.svg https://s3-eu-west-1.amazonaws.com/prod-ucs-content-store-eu-west/content/pii:S0378778821005028/STRIPIN/image/svg+xml/e644fbf5c0672a6d0ddacdd726d8cdfb/si78.svg si78 si78.svg svg 2081 ALTIMG 1-s2.0-S0378778821005028-si79.svg https://s3-eu-west-1.amazonaws.com/prod-ucs-content-store-eu-west/content/pii:S0378778821005028/STRIPIN/image/svg+xml/14a75c47645123dffdca31bbdd8d20c5/si79.svg si79 si79.svg svg 2081 ALTIMG 1-s2.0-S0378778821005028-si8.svg https://s3-eu-west-1.amazonaws.com/prod-ucs-content-store-eu-west/content/pii:S0378778821005028/STRIPIN/image/svg+xml/360a5425ed2c014113dc8d872070493b/si8.svg si8 si8.svg svg 1601 ALTIMG 1-s2.0-S0378778821005028-si80.svg https://s3-eu-west-1.amazonaws.com/prod-ucs-content-store-eu-west/content/pii:S0378778821005028/STRIPIN/image/svg+xml/3cc34a71b8965260b452b609ac1493b1/si80.svg si80 si80.svg svg 3006 ALTIMG 1-s2.0-S0378778821005028-si81.svg https://s3-eu-west-1.amazonaws.com/prod-ucs-content-store-eu-west/content/pii:S0378778821005028/STRIPIN/image/svg+xml/e9b38d89c0ca616399fd242248684717/si81.svg si81 si81.svg svg 2842 ALTIMG 1-s2.0-S0378778821005028-si82.svg https://s3-eu-west-1.amazonaws.com/prod-ucs-content-store-eu-west/content/pii:S0378778821005028/STRIPIN/image/svg+xml/f9d0ac82243745a118454264071e1df8/si82.svg si82 si82.svg svg 6098 ALTIMG 1-s2.0-S0378778821005028-si83.svg https://s3-eu-west-1.amazonaws.com/prod-ucs-content-store-eu-west/content/pii:S0378778821005028/STRIPIN/image/svg+xml/10dded4b5e873757dc8c8e614d6ab8a7/si83.svg si83 si83.svg svg 6171 ALTIMG 1-s2.0-S0378778821005028-si84.svg https://s3-eu-west-1.amazonaws.com/prod-ucs-content-store-eu-west/content/pii:S0378778821005028/STRIPIN/image/svg+xml/4ababfd063f9a4324840fec695947e07/si84.svg si84 si84.svg svg 6171 ALTIMG 1-s2.0-S0378778821005028-si85.svg https://s3-eu-west-1.amazonaws.com/prod-ucs-content-store-eu-west/content/pii:S0378778821005028/STRIPIN/image/svg+xml/e665986f286aafb33e57c76a2901ed37/si85.svg si85 si85.svg svg 8138 ALTIMG 1-s2.0-S0378778821005028-si86.svg https://s3-eu-west-1.amazonaws.com/prod-ucs-content-store-eu-west/content/pii:S0378778821005028/STRIPIN/image/svg+xml/4200c1fc0f6fb3c471a0b0a04b9b6d69/si86.svg si86 si86.svg svg 3006 ALTIMG 1-s2.0-S0378778821005028-si87.svg https://s3-eu-west-1.amazonaws.com/prod-ucs-content-store-eu-west/content/pii:S0378778821005028/STRIPIN/image/svg+xml/68c7a668ab71ba7981d0a55d5a59ac37/si87.svg si87 si87.svg svg 2905 ALTIMG 1-s2.0-S0378778821005028-si88.svg https://s3-eu-west-1.amazonaws.com/prod-ucs-content-store-eu-west/content/pii:S0378778821005028/STRIPIN/image/svg+xml/c32e64f2f996744688b577d4af9df656/si88.svg si88 si88.svg svg 1345 ALTIMG 1-s2.0-S0378778821005028-si89.svg https://s3-eu-west-1.amazonaws.com/prod-ucs-content-store-eu-west/content/pii:S0378778821005028/STRIPIN/image/svg+xml/3d566e46561192990ec0504ccb6b016b/si89.svg si89 si89.svg svg 7735 ALTIMG 1-s2.0-S0378778821005028-si9.svg https://s3-eu-west-1.amazonaws.com/prod-ucs-content-store-eu-west/content/pii:S0378778821005028/STRIPIN/image/svg+xml/dd4ff552afed8d2d9820d226833e96d6/si9.svg si9 si9.svg svg 1345 ALTIMG 1-s2.0-S0378778821005028-si90.svg https://s3-eu-west-1.amazonaws.com/prod-ucs-content-store-eu-west/content/pii:S0378778821005028/STRIPIN/image/svg+xml/b059fb8bbcae687c0a23df515c95fce0/si90.svg si90 si90.svg svg 6187 ALTIMG 1-s2.0-S0378778821005028-si91.svg https://s3-eu-west-1.amazonaws.com/prod-ucs-content-store-eu-west/content/pii:S0378778821005028/STRIPIN/image/svg+xml/e8999c1da37a228fe2571caa831f3f51/si91.svg si91 si91.svg svg 13617 ALTIMG 1-s2.0-S0378778821005028-si92.svg https://s3-eu-west-1.amazonaws.com/prod-ucs-content-store-eu-west/content/pii:S0378778821005028/STRIPIN/image/svg+xml/a398f61e19eaf199e34ff19012b30e82/si92.svg si92 si92.svg svg 1480 ALTIMG 1-s2.0-S0378778821005028-si93.svg https://s3-eu-west-1.amazonaws.com/prod-ucs-content-store-eu-west/content/pii:S0378778821005028/STRIPIN/image/svg+xml/8ae0e4d8713354cba9a75761dc5e0caa/si93.svg si93 si93.svg svg 10014 ALTIMG 1-s2.0-S0378778821005028-si94.svg https://s3-eu-west-1.amazonaws.com/prod-ucs-content-store-eu-west/content/pii:S0378778821005028/STRIPIN/image/svg+xml/09e522acdaf15109e92f99683c65e2e0/si94.svg si94 si94.svg svg 4435 ALTIMG 1-s2.0-S0378778821005028-si95.svg https://s3-eu-west-1.amazonaws.com/prod-ucs-content-store-eu-west/content/pii:S0378778821005028/STRIPIN/image/svg+xml/98edf912560b8391cf1398c13f3524ab/si95.svg si95 si95.svg svg 8242 ALTIMG 1-s2.0-S0378778821005028-si96.svg https://s3-eu-west-1.amazonaws.com/prod-ucs-content-store-eu-west/content/pii:S0378778821005028/STRIPIN/image/svg+xml/45a96c446d4b661af90efd2af8ae4346/si96.svg si96 si96.svg svg 3275 ALTIMG 1-s2.0-S0378778821005028-si97.svg https://s3-eu-west-1.amazonaws.com/prod-ucs-content-store-eu-west/content/pii:S0378778821005028/STRIPIN/image/svg+xml/1f3abc35ee94b7edaee95950fc99f920/si97.svg si97 si97.svg svg 1480 ALTIMG 1-s2.0-S0378778821005028-si98.svg https://s3-eu-west-1.amazonaws.com/prod-ucs-content-store-eu-west/content/pii:S0378778821005028/STRIPIN/image/svg+xml/364e8bfa2e4045f8d9d5c142b39ec215/si98.svg si98 si98.svg svg 3275 ALTIMG 1-s2.0-S0378778821005028-si99.svg https://s3-eu-west-1.amazonaws.com/prod-ucs-content-store-eu-west/content/pii:S0378778821005028/STRIPIN/image/svg+xml/e0618ce30db3927adf2341329ae82d32/si99.svg si99 si99.svg svg 2842 ALTIMG 1-s2.0-S0378778821005028-am.pdf https://s3-eu-west-1.amazonaws.com/prod-ucs-content-store-eu-west/content/egi:100FNDDKXDM/MAIN/application/pdf/cbfb7f859c07c4051c9a1617dc53ed5e/am.pdf am am.pdf pdf false 3979397 AAM-PDF ENB 111218 111218 S0378-7788(21)00502-8 10.1016/j.enbuild.2021.111218 Elsevier B.V. Fig. 1 Our metamodel architecture (left), and a detailed LSTM cell (right). The LSTM cell improves on the classic RNN by introducing a cell state c t supposed to carry long term memory, without additional alterations, throughout the sequence. The three input gate Γ i , forward gate Γ f and output gate Γ o determine whether information in both hidden state h k and cell state c k should be carried away or discarded. Fig. 2 Calibration cost evolution for the metamodel and TRNSYS ( Δ calib , see 2), on Livingstone and Stanley. Both models were calibrated for 300 epochs, which is enough to reach convergence for Stanley, but not Livingstone. Fig. 3 Consumption and temperature simulations after calibration, for both the metamodel and TRNSYS, for Stanley. Fig. 4 Consumption and temperature simulations after calibration, for both the metamodel and TRNSYS, for Livingstone. Fig. 5 Consumption and temperature simulations after calibration on two weeks (top), simulation on the two following weeks for the same parameters (bottom), for Stanley. Although curves for the validation weeks are not matched perfectly, the metamodel is able to capture most trends of both consumption and indoor temperature. The remaining difference can be explained by the absence of real building settings ψ for the calibration week. This experiment comforts our assumption that the calibration step leads to a correct estimation of building parameters λ . Fig. 6 Pareto front after optimization for the Stanley (left) and Livingstone (right) buildings. We select the point of closest equivalent comfort, corresponding to a 5.3% (Stanley) and 9.9% (Livingstone) reduction in consumption. Combinations of energy consumption and comfort are unreachable below the Pareto front, and suboptimal above; we always aim at sampling points at the intersection. Fig. 7 Consumption and temperature simulations after optimization (with the metamodel) for the Stanley building. Fig. A.8 Indoor temperature and consumption for Real data, Calibration and Optimization for Livingstone. Fig. A.9 A flowchart summarizing our end-to-end methodology. Table 1 Metrics (means and standard deviations) of the metamodels on the validation splits. The best mean values are displayed in bold (the lowest losses and mean squared errors). Time is the computation time to run a single simulation through the network, and was estimated by averaging 100 inferences. Our selected architecture is detailed in Section 3.3, and achieves the best performances on all metrics, while still being on par with most models in computation time. BiGRU Transformer Ours ConvGru FFN Loss ( × 10 - 4 ) 2.05 ( 1.61 ) 2.72 ( 2.88 ) 1 . 65 ( 1 . 47 ) 2.26 ( 2.04 ) 90.5 ( 41.1 ) MSE T ( × 10 - 5 ) 1.00 ( 1.53 ) 1.49 ( 2.75 ) 0 . 820 ( 1 . 44 ) 1.20 ( 2.05 ) 39.5 ( 39.7 ) MSE Q ( × 10 - 4 ) 3.84 ( 2.05 ) 4.12 ( 3.01 ) 2 . 75 ( 1 . 72 ) 3.53 ( 1.77 ) 172 ( 60.2 ) MSE T occ ( × 10 - 5 ) 4.60 ( 7.16 ) 6.56 ( 12.2 ) 3 . 79 ( 6 . 81 ) 5.89 ( 9.91 ) 176 ( 189 ) MSE Q occ ( × 10 - 4 ) 1.45 ( 1.00 ) 2.07 ( 1.80 ) 1 . 22 ( 0 . 878 ) 1.85 ( 1.23 ) 113 ( 50.8 ) Δ Q Tot ( × 10 - 3 ) 4.03 ( 11.7 ) 20.1 ( 12.4 ) 2 . 46 ( 12 . 0 ) 14.9 ( 16.2 ) 1.82 ( 68.8 ) Time ( × 10 - 2 s ) 6.46 4.52 6.51 6.77 0.341 Table 2 Calibration metrics for Stanley and Livingstone buildings, see 1. Convergence is reached for Stanley after 300 iterations, which is not enough for Livingstone, as displayed in Fig. 2. This table demonstrates that the metamodel and TRNSYS perform similarly when calibrated for the same number of iterations, although the metamodel is much faster. Additionally, only the metamodel is able to reach convergence for Livingstone in a reasonable time frame. MBE Q Cv ( RMSE ) Q MBE T Cv ( RMSE ) T Iterations Computational time Stanley Metamodel −0.627 11.0 0.134 1.20 300 2 mn TRNSYS −0.409 12.1 −0.264 1.24 300 3 h Livingstone Metamodel −0.690 14.2 −0.0551 1.29 10000 1 h Metamodel −0.574 14.2 −0.413 1.95 300 2 mn TRNSYS −1.08 15.8 0.156 1.96 300 3 h Table 3 Energy gain after optimization. Relative gain represents the energy load reduction between calibration and optimization steps, when maintaining the initial level of comfort. We then apply this coefficient to the real monthly consumption to obtain the reduction forecast in MWh. We also provide a more interesting reduction obtained by reducing the comfort criteria by 0.5 ° C. relative gain (%) prevision (MWh) relative gain/ 0.5 ° C (%) prevision/ 0.5 ° C (MWh) Stanley 5.32 8.05 10.5 15.9 Livingstone 9.92 9.96 17.3 17.3 Table B.4 List of parameters contained in λ , along with sampling and calibration ranges. During training of the metamodel, occupation values are converted in a one dimensional time serie, with value 0 or 1 based on the occupation state of the building. Variable Minimum Maximum Step airchange_infiltration_vol_per_h ( m 3 h - 1 ) 0.1 0.5 0.1 capacitance_kJ_perdegreK_perm3 ( kJK - 1 m - 3 ) 50 300 10 power_VCV_kW_heat ( kW ) 0 1000 100 power_VCV_kW_clim ( kW ) 0 1000 100 nb_occupants 1000 2000 200 nb_PCs 1000 2000 200 percent_light_night 0 70 10 percent_PCs_night 0 70 10 facade_1_thickness_2 ( m ) 0.05 0.15 0.05 facade_2_thickness_2 ( m ) 0.05 0.15 0.05 facade_3_thickness_2 ( m ) 0.05 0.15 0.05 facade_4_thickness_2 ( m ) 0.05 0.15 0.05 roof_1_thickness_3 ( m ) 0.05 0.15 0.05 facade_1_window_area_percent 40 50 5 facade_2_window_area_percent 40 50 5 facade_3_window_area_percent 40 50 5 facade_4_window_area_percent 40 50 5 start_occupation_monday (h) 7 9 1 start_occupation_tuesday (h) 7 9 1 start_occupation_wednesday (h) 7 9 1 start_occupation_thursday (h) 7 9 1 start_occupation_friday (h) 7 9 1 end_occupation_monday (h) 17 20 1 end_occupation_tuesday (h) 17 20 1 end_occupation_wednesday (h) 17 20 1 end_occupation_thursday (h) 17 20 1 end_occupation_friday (h) 17 20 1 Table B.5 List of variables contained in ψ k , along with their ranges. Each parameter can hold a different value for each day of the week. For ease of reading, we replaced them by a single line, as the ranges are the same for every day. Variable Minimum Maximum Step start_clim_day (h) 7 9 1 end_clim_day (h) 18 20 1 t_clim_red_day ( ° C ) 24 30 0.5 t_clim_conf_day ( ° C ) 20 24 0.5 start_heat_day (h) 6 8 1 end_heat_day (h) 17 19 1 t_heat_red_day ( ° C ) 17 22 0.5 t_heat_conf_day ( ° C ) 22 24 0.5 start_ventilation_day (h) 7 9 1 end_ventilation_day (h) 18 20 1 t_ventilation_day ( ° C ) 18 26 0.5 vol_ventilation_day 0.7 1.7 0.3 Table B.6 Weather data as contained in φ k . Variable Description DNI Direct Normal Irradiance IBEAM_H Direct Horizontal Irradiance IBEAM_N Direct Normal Irradiance IDIFF_H Diffuse Horizontal Irradiance IGLOB_H Global Horizontal Irradiance RHUM Outdoor Relative Humidity TAMB Outdoor temperature Table B.7 Output variables of the equivalent model designed by the energy managers, contained in Y k . Variable Description Q_AC_OFFICE AC consumption Q_HEAT_OFFICE Heat consumption Q_PEOPLE Heating power due to human activities in the building Q_EQP Consumption of equipment, such as computers, elevators, fridges Q_LIGHT Consumption of lights Q_AHU_C Consumption of AHU when cooling outside air Q_AHU_H Consumption of AHU when heating outside air T_INT_OFFICE Indoor temperature End-to-end deep meta modelling to calibrate and optimize energy consumption and comfort Max Cohen a \u204e 1 Sylvain Le Corff a Maurice Charbit b Alain Champagne b Gilles Nozière b Marius Preda c a Samovar, Télécom SudParis, CITI, TIPIC, Institut Polyechnique de Paris, France Samovar Télécom SudParis CITI TIPIC Institut Polyechnique de Paris France Samovar, Télécom SudParis, CITI, TIPIC, Institut Polyechnique de Paris b Oze-Energies, France Oze-Energies France Oze Énergies c Samovar, Télécom SudParis, ARTEMIS, ARMEDIA, Institut Polyechnique de Paris, France Samovar Télécom SudParis ARTEMIS ARMEDIA Institut Polyechnique de Paris France Samovar, Télécom SudParis, ARTEMIS, ARMEDIA, Institut Polyechnique de Paris \u204e Corresponding author. 1 This work was supported by grants from Région Ile-de-France In this paper, we propose a new end-to-end methodology to optimize energy performance and thermal comfort in office buildings, without any renovation work. The process is decomposed into three steps: metamodel training, model calibration and optimization. We introduce and train a metamodel on thousands of weather and building settings scenarios, using samples from a physical simulation model. Its much faster computation time allows for the calibration of two weakly instrumented buildings with a derivative free optimization procedure. Using historic data from these buildings, we estimate up to 60 unknown parameters defined by energy managers, such as heat capacity, window area or exposition. Energy consumptions are finally minimized while maintaining a target thermal comfort using the Pareto front provided by a multi-objective optimization algorithm. Our approach allows the computation of the entire calibration-optimization pipeline on several types of buildings. Moreover, the numerical experiments illustrate how it may ensure a significant gain in energy efficiency, up to almost 10%, while being computationally much more appealing than simulation programs. Keywords Recurrent neural networks Metamodel Building energy model Calibration Optimization 1 Introduction In 2009, the building stock accounted for over 40% of the total French energy consumption, as well as almost a quarter of greenhouse gas emissions (Loi Grenelle 2 2 Loi Grenelle I, Article 3 ). Improving its energy effiency is an important step in the ecological context where energy waste cannot be ignored. This translated in an objective of 38% reduction in the consumption of the building stock for 2020, through the renovation of 400,000 apartments per year, 3 3 Loi Grenelle I, Article 5 raised to 500,000 six years later. 4 4 Loi relative á la Transition Energétique pour la Croissance Verte, Article 3 However, despite increasingly ambitious objectives, the actions carried out to date still fall short in terms of results, as stated by the Ademe (Agency for the environnement and energy). 5 5 Hervé Lefebvre, head of the Climat departiement of the Ademe, 2019 According to the National Low-Carbon Strategy (SNBC), the average number of yearly renovations is expected to be around 370,000 for the period 2015\u20132030. 6 6 Stratégie Nationale Bas-Carbone (SNBC) This paper aims to optimize both energy consumption and thermal comfort, without costly, invasive or time consuming renovation works. Instead, we provide optimal building management settings governing Heating, Ventilation and Air-conditioning (HVAC), taking into account the use of the building, its geometry and weather data.. Global energy demand in commercial or public buildings has been increasing rapidly for the past few decades. This rising demand is at the root of the complex problem of simultaneously maintaining a satisfactory thermal comfort in buildings and reducing the environmental impact. This makes the analysis of building energy performance a challenging multi-criteria problem. The solution proposed in this paper is decomposed into three steps: (i) designing a model to predict future energy loads and indoor temperature based on the HVAC system and weather data, (ii) calibrating the unknown parameters of this model with real data obtained from sensors in each building and (iii) optimizing the HVAC settings to minimize the total energy consumption in future periods while maintaining a given thermal comfort. Step (i) can be achieved with simulators that describe heat transfers between the building and its environment such as EnergyPlus, TRNSYS or DOE-2. They predict the indoor temperatures and consumptions from the description of the building, HVAC settings and weather data. However, their accuracy relies heavily on the precision of the building description: window to wall ratio, exposition, thermal conductivity or heat capacity among others. Because our strategy does not involve renovation works, and use a simplified building description, we usually can only provide rough estimates of these input parameters. The calibration procedure in step (ii) aims at estimating the parameters of the model proposed in (i) to provide accurate indoor temperatures and consumptions predictions. We measure the discrepancy between model predictions and real data with a loss function that is minimized iteratively. Because this minimization requires tremendous number of calls to the model designed in step (i), the calibration step quickly becomes excessively time consuming. A very popular practice in the building optimization literature consists in using surrogate models. Metamodelling approaches substitute the physical simulator in step (i) with a much faster surrogate model to tackle calibration and optimization tasks. This surrogate model is trained on a dataset of simulations conducted by the simulator, that aims at exhaustively capturing building behaviors for various building geometries and management settings. The most recent statistical models make this step more and more relevant in our context, as their accuracy reaches new heights while their execution time is constantly reduced. Yet, most approaches only implement the most simple architectures for building optimization. In this paper, we first propose to train a metamodel based on Recurrent Neural Networks (RNN). We compare several approaches which illustrates that sequence to sequence models, such as RNN, can yield a significant increase in performances with respect to the alternatives previously considered in our framework. In addition, we benchmark such RNN to attention-based models, which are the go-to architectures in other fields when predicting sequences with complex dependencies. Our metamodel, which depends on a few physical parameters, is then calibrated using real data to provide accurate predictions for various buildings. Two real buildings were used to illustrate the flexibility of this approach. The final step of our end-to-end methodology consists in optimizing energy consumptions, while maintaining a given level of comfort. This multi-criteria optimization problem requires determining an optimal compromise between consumption and comfort, as improving one objective results in degrading the other. This optimization is achieved through an iterative algorithm, justifying once again our choice of replacing simulators with a faster surrogate model. Following this methodology, we were able to train and calibrate our metamodel and to reduce the hourly consumption of two buildings by 5% and 10%. 2 Related works 2.1 Physical simulators Physical simulators based on thermal propagation equations are traditionally used to describe buildings. The most common softwares available, EnergyPlus, TRNSYS or DOE-2, are used to simulate the system behavior based on a schematic view of the building. EnergyPlus was used for instance in [1] to build three types of typical designs and to benchmark the energy performance of 400 residential buildings. In [2], the authors proposed a predictive control framework based on Matlab and EnergyPlus in order to optimize energy consumption while meeting the individual thermal comfort preference. In [3], the authors highlighted the performances of TRNSYS as a physical simulator, as well as its limits in terms of computational speed: the authors claimed that a full optimization process would take as much as ten years, had they not replaced TRNSYS with a surrogate model during optimization. The authors of [4] studied the optimization of a single-family house using a combination of Energy-Plus and the NSGA-II optimization algorithm, and discussed sensitivity analysis using the Morris screening method. Likewise, the authors of [5] performed sensitivity and uncertainty analysis on another building simulator known as COMFIE, and displayed its modelling performances on a passive building. These papers demonstrate the capability of such approaches to optimize energy loads, given a building simulator. However, because they require numerous calls to the physical simulation function, they are very computationally intensive. Additionally, they do not leverage any data generated by a real building. 2.2 Metamodels The building optimization literature has seen an increasing number of surrogate approaches, as recent sophisticated statistical models provide appealing solutions to be used in this context. In [6,7], statistical models were trained on a dataset sampled from EnergyPlus, allowing significant computational savings during optimization. In [6], the authors proposed to combine NSGA-II with an artificial neural network metamodel, here a Feed Forward Network (FFN), in order to optimize the consumption of a 83 m 2 house. Optimization was also conducted with the original building simulator, EnergyPlus, in order to compare both results and ensure that the FFN could be used as a substitute during optimization. Similarly, [7] proposed a FFN based meta modelling approach to reduce up to 25% the energy consumption in a small office building. EnergyPlus was used to sample a dataset for various zones of the building. The metamodel was tested using a 4-week long EnergyPlus simulation with variable set point temperatures and using an alternative weather file. An example of recurrent neural architecture as a surrogate model can be found in [8], where the authors focused on an air-conditioning optimization problem using time series. If these articles justify the use of metamodels, they rarely justify their choice of statistical model. In an in-depth review, [9] compares standard statistical models, such as polynomial regression, multivariate adaptive regression splines, Gaussian processes or Decision Trees, in the context of building performance simulation. Artificial Neural Networks models stand out as a particularly relevant alternative, but are often presented in their most simple, time independent form, such as the FFN used in [6]. Although they may yield accurate predictions in some frameworks, these neural networks handle every time step independently, and are thus not adapted to time series problems. They are usually substituted for their sequential counterparts, such as recurrent or convolutional based approaches, as demonstrated by the authors of [10]. In their paper, they explored various architectures of Long Short Term Memory (LSTM) models, in order to predict HVAC consumption in buildings. Therefore, designing metamodels for building calibration and optimization is likely to benefit from such recurrent and attention-based models. RNN were first introduced as more suited architectures for dealing with time varying input patterns [11]. By replacing buffer based approaches with an updated context state, RNN are able to solve time series problems with short time dependencies, but are lackluster in problems requiring long term memory due to vanishing and exploding gradient [12]. The LSTM model proposed in [13] aims at bridging that gap by enforcing error flow throughout time in the network. The LSTM architecture was modified in [14] in order to simplify its implementation and improve computation times, resulting in a novel model called Gated Recurrent Unit (GRU). In parallel to these advances on recurrent architectures, Convolutional Neural Networks (CNN), rendered popular by [15] for image classification, have been adapted to time series problem. The approaches proposed in [16,17] outperformed traditional Natural Language Processing (NLP) models by replacing the embedding layer with a character-level convolutional layer. Recurrent and convolutional approaches coincide in that temporally close time steps data are matched together. In 2017, [18] proposed an attention based approach to solve NLP tasks that consider the entire input sequence in parallel. The Transformer model is based on a self-attention mechanism, that computes an attention value for every element of a sequence with respect to all others to model their dependency. This attention mechanism allows to understand, at each time step, which input elements are crucial to predict the new state. This makes these networks more interpretable than their most widely-used recurrent counterparts such as LSTM or GRU networks and motivates a keen interest for such approaches to predict complex time series. 2.3 Calibration Sampling inside temperatures and consumptions requires many unknown physical parameters. Instead of costly campaigns to measure these parameters, that would have to be reiterated for each new building, they may be estimated using an automatic calibration procedure. The aim is to minimize a cost function which associates, with each set of parameters, the discrepancy between the simulations and the true consumptions and temperatures, see [19,20]. As shown in [21], calibration yields sufficiently accurate results for a variety of different buildings. This ensures limited additional costs to fit a trained metamodel to new buildings. In many related works, this problem cannot be solved since no real data are used in the calibration step, see [6,7], i.e. the calibration is performed based only on simulated data. Optimization is thus conducted without justifying that the theoretical energy savings could be applied to any real building. The calibration task revolves around a non differentiable optimization problem, which is often tackled by using genetic optimization methods. In [22], the authors demonstrate the use of the Non-dominated Sorting Genetic Algorithm II (NSGA-II) to select a set of estimated parameters that jointly minimize the coefficient of variation of the root mean square error, and the normalized mean bias error. All criteria can instead be combined in a single calibration error, in order to turn to single objective differentiation free algorithms that offer a single best candidate, avoiding the need for further selection processes. In [20], the CMA-ES algorithm introduced in [23] was used to minimize a combination of heating and cooling errors. 2.4 Our approach In this paper, we propose an end-to-end methodology, from dataset sampling to metamodel calibration and optimization using data obtained from wireless sensors set in large buildings. We introduce a new metamodel to predict building behaviors after a comprehensive study of several approaches from traditional RNN to a model based on a Transformer architecture [18]. The performance of this metamodel are compared both in terms of accuracy and computational efficiency with TRNSYS. Once the metamodel is trained using a dataset sampled from TRNSYS, all the parameters of real buildings and of their Building Management System (BMS) are estimated using real measurements with the CMA-ES algorithm. A multi-objective methodology to improve energy efficiency and maintain thermal comfort is then implemented by acting only on the BMS. The NSGA-II approach is used to obtain a Pareto front, i.e. a set of optimal compromises between consumption and comfort, whereby improving one criteria leads to necessarily degrading the other. Our methodology is summarized in a flowchart in the appendix, see Fig. A.9. The paper is organized as follows: Section 3 details the deep learning framework, as well as the different architectures used in this paper. It also describes the data and variables used in our experiments. Section 4 illustrates the performance of our chosen metamodel in the calibration and optimization processes for two real buildings. The numerical experiments illustrate how the same metamodel ensures a significant gain in energy in various settings in comparison to the considered alternatives. 3 Meta modelling 3.1 Notations Let ( Y k ) k ⩾ 0 be a multivariate variable describing the state of the building at each hour, denoted by the index k. Based on the modeling of an equivalent building by experts in thermal diffusion and energy use, known as energy managers, this variable has 8 components, such as inside temperatures, heating, cooling and ventilation consumptions, see Table B.7 for a detailed list. The aim of the metamodel introduced in this paper is to provide a numerically efficient solution to predict ( Y k ) k ⩾ 0 from several sets of input variables. Input time series are divided in two variables: ( φ k , ψ k ) k ⩾ 0 . The input φ k contains weather data at time k, such as outdoor temperature, relative humidity or irradiance values, see Table B.6; ψ k stores the information relative to the building usage: activation hours of the AC and ventilation systems, comfort and reduced temperatures (thermal objectives when the building is occupied or empty), see Table B.5. The parameter λ represents all unknown parameters regarding the geometrical description of the buildings (windows area ratio, etc.), as well as parameters related to heat transfer (heat capacity, infiltration rate, etc.), and occupation schedules, see Table B.4. We assume in this study that this parameter set does not evolve with time. In this section, we describe how a simulator may be used to train the metamodel which aims at mimicking its outputs for various choices of λ , ( ψ k ) k ⩾ 0 , and of meteorological data ( φ k ) k ⩾ 0 . 3.2 Proposed benchmarks In most recent works, a great deal of research activities focused on FFN as surrogate models, see [3,6,7]. Although they may lead to interesting performance during the training phase, these fully connected architectures are not well suited for time series prediction, in particular for long time spans. We ceased this opportunity to explore other approaches that have proven to be more relevant for solving time series tasks in the past few years. Among these go-to architectures, we evaluated: a bidirectional LSTM, a bidirectional GRU (BiGRU), a hybrid model mixing both convolutional and GRU layers (ConvGru) and a Feed Forward Network (FFN) as used in previous works. In addition to those models, a Transformer model, which introduces an attention mechanism to model dependencies, is also considered. These models have been implemented using the deep learning framework PyTorch. 3.3 Our proposed metamodel Our metamodel is a function f θ : ( h k - 1 , u k ) ↦ y k with parameters θ that maps, at each time step k, the building state u k ≡ ( φ k , ψ k , λ ) and a hidden state h k - 1 depending on the past values ( u 1 , \u2026 , u k - 1 ) , to a prediction of its indoor temperature and consumptions y k . The model is trained to produce accurate predictions by tuning its parameters θ , usually referred to as weights, through an iterative back propagation algorithm, where predictions y k are compared to the ground truth Y k . We use as a backbone a many to many RNN architecture, and denote by h k ℓ and x k ℓ the hidden state and input of layer 1 ⩽ ℓ ⩽ L at time step k, in particular x k 0 ≡ u k . The hidden state is traditionally initialized as the zero vector, h 0 ℓ ≡ 0 for all 1 ⩽ ℓ ⩽ L . In the original and most simple definition of a RNN, the hidden state is computed recursively as h k ℓ = tanh ( W ih ℓ x k ℓ + W hh ℓ h k - 1 ℓ + b h ℓ ) , where W ih , W hh and b h are the weight matrices and bias learned during training, and initialized with random values. Our metamodel is based on a LSTM architecture and replaces the update of the hidden state by the following state equations: Γ i ℓ = σ ( W xi ℓ x k ℓ + W hi ℓ h k - 1 ℓ + b i ℓ ) , Γ f ℓ = σ ( W xf ℓ x k ℓ + W hf ℓ h k - 1 ℓ + b f ℓ ) , Γ o ℓ = σ ( W xo ℓ x k ℓ + W ho ℓ h k - 1 ℓ + b o ℓ ) , c ̃ k = tanh ( W xc ℓ x k ℓ + W hc ℓ h k - 1 ℓ + b c ℓ ) , c k ℓ = Γ f ℓ * c k - 1 ℓ + Γ i ℓ * c ̃ k . h k ℓ = Γ o ℓ * tanh c k ℓ . An additional fully connected layer is added on top of the RNN architecture, following results presented in [10]: y k = σ ( W y h k L + b y ) , where σ is the sigmoid activation function σ : x ↦ ( 1 + e - x ) - 1 . The architecture is represented in Fig. 1 . The parameters to be estimated during the training phase of the metamodel are θ = W xi ℓ , W hi ℓ , W xf ℓ , W hf ℓ , W xo ℓ , W ho ℓ , W xc ℓ , W hc ℓ , b i ℓ , b f ℓ , b o ℓ , b c ℓ 1 ⩽ ℓ ⩽ L , W y , b y . 3.4 Dataset sampling The training dataset is sampled by exploring the input space of the simulator. We chose TRNSYS in this paper but any simulator can be used to train the metamodel. We define ranges for each input variable in λ and ( ψ k ) k ⩾ 0 with the help of energy managers, such as highest and lowest scheduled temperature, or the most early and late hour of arrival of occupants, see the appendices for a complete list of these ranges. Because our dataset aims at capturing multiple buildings, these ranges cover all possible values across our cluster of buildings. In addition, real weather data ( φ k ) k ⩾ 0 acquired between June and August 2020 around the Parisian area where used to obtain a dataset consistent with the real buildings. In our numerical experiments, we chose a uniform sampling method over the ranges for each building and weather variable. This allows us to easily split the dataset uniformly into training and testing sets, which is crucial to validate the metamodel. The input vector u k contains 27 variables at each time step: 8 variables from λ , 7 from φ k and 12 from ψ k . A total of 15,000 training examples were sampled, an example being a month i.e. 672h. During the training phase, the parameters of each metamodel described in Section 3, and called θ in the detailed case of the LSTM approach, are estimated on this dataset. The metamodels compared in this section are defined with a latent dimension of d emb = 64 and a total of L = 4 layers. Hyper parameters, such as learning rate, dropout, number of epochs or batch size, were chosen empirically by interpreting the cost history of the model during the training, and the learning curve. 3.5 Training During training, for each example, we compute the Mean Squared Error (MSE) loss, and combine consumption and temperature errors: MSE T = ∑ k = 1 M ( T k - T ^ k ) 2 ∑ k = 1 M ( T k - T \u203e ) 2 and MSE Q = ∑ k = 1 M ( Q k - Q ^ k ) 2 ∑ k = 1 M ( Q k - Q \u203e ) 2 , T \u203e = 1 M ∑ k = 1 M T k and Q \u203e = 1 M ∑ k = 1 M Q k , loss = β MSE T + ( 1 - β ) MSE Q , where M is the number of data in each example, T k and Q k are the ground truth at time k for the temperature and total consumption respectively, and T ^ k and Q ^ k are the predictions given by the metamodel with the current value θ of the metamodel. In the experiments below, as the inside temperatures and all consumptions are normalized, we chose the non informative value β = 0.5 . We chose the Adam optimizer [24] and all simulations were computed on a single 1080TI GPU card. 3.6 Validation Validation is essential to identify any potential overfit of the model on the training dataset. In this study, we implement a traditional cross-validation, i.e. the dataset is split into k folds, and the model is trained on the k - 1 first folds and evaluated on the last. We average this validation score by iteratively changing the validation fold, as detailed by the authors of [25], with k = 5 . This method ensures that our model is always evaluated on unseen data, which demonstrates its generalization capability and avoids any potential bias of the validation split. Table 1 displays the mean value and standard deviation of the loss function of this cross validation at the end of the training procedure. The table also displays the mean squared error MSE T (resp. MSE Q ) on the temperatures (resp. consumptions) only, as well as these same metrics computed only during occupation time: MSE T occ and MSE Q occ . For a global consumption evaluation, we compute the absolute relative error on the cumulative consumptions Δ Q Tot . 4 Energy optimization in real buildings The experiments conducted in our paper to analyze the performance of the trained metamodel focused on the optimization of two buildings in the Parisian region. Each one is represented by a single thermal zone. \u2022 Stanley is a 18 , 512 m 2 building. It is delimited by four vertical walls of dimension 2 , 314 m 2 , 1 , 917 m 2 , 2 , 123 m 2 and 1 , 725 m 2 , as well as a roof and ground of dimension 2 , 304 m 2 . The main insulator is a 10 cm layer of polystyrene. It was built in 1983. \u2022 Livingstone is a 13 , 594 m 2 building, including 4 vertical walls with respective areas 1 , 678 m 2 , 1 , 274 m 2 , 1 , 281 m 2 and 1 , 252 m 2 , a horizontal roof and a horizontal ground of dimension 4 , 653 m 2 and 4 , 286 m 2 . The main insulator is a 8 cm layer of polyurethane. It was built in 2006. Based on a commonly used rule, it is assumed that 2 / 3 of the full area is occupied by people. Assuming that each occupant requires 12 m 2 , this allows to set the initial values for the number of occupants and the number of PCs (set to 1.2 times this value) in the building during occupancy hours. These values are assumed to be known, fixed and used to sample the training dataset. 4.1 Calibration During the training phase, metamodel parameters are estimated by minimizing the loss function on the simulated dataset which corresponds to various configurations associated with choices of λ and ( ψ k , φ k ) k ⩾ 0 . Because this dataset is sampled from a simulation model, we trained the metamodel ignoring real building noise and measurement errors. Additionally, both the BEM and our metamodel require λ that cannot be properly identified for each building, especially without renovation work. By comparing the metamodel predictions to real historic data during the calibration phase, we search for a set of building related parameters that best match reality. During this step, the weights θ of the metamodel are frozen, meaning that we no longer update each weight matrix of the neural network. We can compute, for each given set of input parameters λ and ( ψ k , φ k ) k ⩾ 0 , the difference between estimated and real historical data. Goodness of fit of the model is measured with a normalized Mean Square Error denoted Δ calib defined in (2), following the performance evaluation criteria in [26]. Because this is a non differentiable problem, the cost function cannot be minimized using a stochastic gradient descent algorithm as in the training step; instead we use the CMA-ES algorithm [27], an evolutionary algorithm designed to solve constrained non-convex optimisation problems. In our experiments, the variables are constrained by the same ranges defined in the data sampling section. The algorithm is implemented by the author of the paper in the pycma library. 7 7 https://github.com/CMA-ES/pycma Following a traditional methodology in building calibration, we measure the performances of the calibrated model with the Mean Bias Error ( MBE ) and Coefficient of variation of the Root Mean Square Error ( Cv ( RMSE ) ). For any sequence ( z k ) 1 ⩽ k ⩽ M associated with predictions ( z ^ k ) 1 ⩽ k ⩽ M , these quantities are defined as follows: (1) MBE % = 100 ∑ k = 1 M z k - z ^ k ∑ k = 1 M z k , Cv RMSE % = 100 RMSE z \u203e , RMSE = ∑ k = 1 M z k - z ^ k 2 M 1 / 2 , z \u203e = 1 M ∑ k = 1 M z k , (2) Δ calib = ∑ k = 1 M ( z k - z ^ k ) 2 ∑ k = 1 M ( z k - z \u203e ) 2 , where M is the number of data in each example. In a detailed review of calibration methods, the authors of [28] have gathered the international recommended ranges regarding these criteria, when validating a calibrated model. Regardless of the simulation program, the Cv ( RMSE ) should fall within ± 20 % , and the MBE ± 5 % when considering hourly calibrations. As shown in Table 2 , our results for both consumptions and indoor temperatures calibration are well within these guidelines. Calibration was run for both the metamodel and the original BEM (TRNSYS) for a maximum of 3h. As shown in Table 2, we can achieve satisfactory results for Stanley in this timespan, as both model converge to close values for both the Cv ( RMSE ) and MBE . Fig. 3 displays both models calibration results, compared to real data. On the other hand, TRNSYS calibration of Livingstone is sensibly below the results obtained with the metamodel, as calibration did not converge in the available time, see Fig. 2 . The calibration of the metamodel reached convergence but with a tremendous number of epochs, that would have required to run TRNSYS for about 10h in order to get similar performances. As a comparison, we calibrated the metamodel for the same number of epochs as TRNSYS, and obtained similar results. This experiment comforts the idea that TRNSYS and the metamodel behave similarly after the calibration step, but the much shorter computation time of the metamodel allows us to better calibrate complex buildings, such as Livingstone. See Fig. 4 for a visualization of the TRNSYS and metamodel calibration after one hour. Validation. The metamodel will assist the decision process for building management by simulating thermal behavior of future weeks. Because the calibration process requires real data, the metamodel is calibrated on several past weeks, in order to capture the real building behavior in a situation as close as possible to the future period we aim to match. We validate the calibration phase using two successive weeks, by applying the calibrated settings to the two following weeks, with fresh weather data, and compare the results to the true observed values. The results are displayed in Fig. 5 and are very encouraging, as the simulation of the metamodel on the two unseen weeks is able to match most trends is both consumption and indoor temperature. 4.2 Optimization After a successful calibration, the metamodel is supposed to have correctly estimated building parameters λ , so that it accurately reproduces the thermal exchanges of the real building, as confirmed by the validation step. The parameters ψ k associated with the HVAC system can then be optimized for a given set of weather data φ k . The optimization tasks consists in finding a set of BMS settings that reduce consumption while keeping the same level of comfort. Optimizing energy consumption requires minimizing two conflicting objectives, making it impossible to find a solution that optimizes both objectives simultaneously. Instead, we search for optimal compromises between energy consumption and comfort, and plot each proposition to form a Pareto front, see Fig. 6 . Combinations of energy consumption and comfort are unreachable below the Pareto front, and suboptimal above; we always aim at sampling points at the intersection. Indeed, for any such optimal compromise, we can always get a higher level of comfort, for the price of a higher consumption. The consumption criteria is the energy load during the month; the comfort criteria is the gap between indoor temperature and a constant reference temperature T ∗ : Comf = 1 N Occ ∑ k = 1 N Occ 1 k ∈ Occ T ^ k - T ∗ 2 1 / 2 and Q ¯ = 1 N ∑ k = 1 N Q ^ k , where T ∗ = 22.5 ° C , N is the number of hours to be considered in the optimization process and Occ is a subset of daytime hours specifying at which hours the target temperature has to be reached in the building. Following recent works in building energy optimization, we search for a set of optimal parameters using NSGA-II, see [29], another evolutionary algorithm, but adapted to multi-objective problems. An implementation can be found in the Pygmo 8 8 https://esa.github.io/pygmo2/ library. In the absence of a stopping condition, we simply run the optimization for 3000 iterations (2 h). Results can be viewed as a Pareto front which is given in Fig. 6 for the second month used in the calibration process. As observed during calibration, this process can take a colossal number of iterations before achieving satisfactory results, once again justifying the use of a much faster metamodel. The predicted time series associated with the BMS parameters selected in Fig. 6 are given in Fig. 7 . The relative gain, as well as the expected energy savings for both buildings are available in Table 3 . 5 Conclusion Optimizing building energy consumption is a challenging task which requires carefully integrated sensors to solve a multi-objective problem based on computationally very intensive calibration and optimization procedures. For this reason, most related works focus on a single aspect of the problem. In this paper, we proposed an end-to-end meta modelling methodology to tackle this problem in weakly instrumented buildings, with a small computational budget. Our methodology relies on samples from a simulation program, such as TRNSYS, wherein building behavior can be approximated by an equivalent model defined by energy managers. We experimented with various deep learning architectures to substitute the physical simulator, such as RNN and Transformer, and report sensible improvements over models described in the literature. Additionally, because these models allow the computation of multiple simulations in parallel, we were able to significantly cut the computation time of the calibration and optimization steps, by a factor of over 70. We implemented a calibration step in order to estimate specific features of a building, such as heat capacity, window to wall ratio, or air infiltration rates. Although the metamodel approximates a simplified equivalent model, we successfully calibrated two real buildings based on data gathered from only a few sensors. Convergence was reached for the first building after 300 iterations, and displayed encouraging results when we applied estimated parameters to predict fresh data from unseen weeks. Here, we demonstrated that calibration with TRNSYS achieved similar results, although requiring a much longer computation time. On the second building, it took about 10 , 000 iterations before the metamodel reached convergence, which would have represented 100 computation days with TRNSYS. This experiment showed that by reducing computation time, the metamodel is able to calibrate buildings which would have been impossible for physical simulators. We believe that the greater difficulty to calibrate some buildings can be explained by less informative data due to noisy sensors, change in the building use during the experiment, etc. Lastly, we were able to reduce energy consumption while preserving the same level of comfort in the building. We explored the space of possible BMS settings and reached a family of solutions offering equivalent compromises of both objectives. For the solution providing the closest level of comfort as the historical data, we obtained a consumption reduced by 5% and 10%. By depreciating the comfort objective of 0.5 ° C, we were able to further reduce consumption by up to 17 % . Our study highlights the potential for hourly optimization of multiple buildings, from a single metamodel training. Future works could focus on exploring a wider variety of buildings, in order to assess the reach of adaptability and applicability of such a metamodel. Because the training dataset was sampled based on a simplified equivalent model, calibration performances may drop when facing more complex buildings. An open question is the design of an automatic clustering procedure of many buildings from the equivalent description provided by energy managers. Such unsupervised clustering would allow the design of few metamodels trained only once and specifically built to target all buildings in each cluster. Integration of a metamodel in the end-to-end pipeline could also open the way for improving calibration performances. Indeed, we believe that one of the main obstacles in calibrating lies in the observation noise of sensors data. While physical simulators can only simulate well defined thermal diffusion equations, we can modify our metamodel to take into account this inherent noise. We believe that this leads the way to interesting future research works, for instance on the development of new finetuning procedures. Here, real data obtained in a building would be used to update some weights of the metamodel in order to capture specific behaviors that are not described by the physical simulator. Such approaches could benefit from statistical models such as general state space models to capture the complex statistical structure of the observations. Declaration of Competing Interest The authors declare that they have no known competing financial interests or personal relationships that could have appeared to influence the work reported in this paper. Appendix A Additional illustrations Fig. A.8 . Appendix B Ranges used to train the metamodel References [1] V. Shabunko C. Lim S. Mathew EnergyPlus models for the benchmarking of residential buildings in Brunei Darussalam Energy and Buildings 169 2018 507 516 V. Shabunko, C. Lim, S. Mathew, EnergyPlus models for the benchmarking of residential buildings in Brunei Darussalam, Energy and Buildings 169 (2018) 507\u2013516. [2] J. Zhao K.P. Lam B.E. Ydstie V. Loftness Occupant-oriented mixed-mode EnergyPlus predictive control simulation Energy and Buildings 117 2016 362 371 J. Zhao, K.P. Lam, B.E. Ydstie, V. Loftness, Occupant-oriented mixed-mode EnergyPlus predictive control simulation, Energy and Buildings 117 (2016) 362\u2013371. [3] L. Magnier F. Haghighat Multiobjective optimization of building design using trnsys simulations, genetic algorithm, and artificial neural network Building and Environment 45 2010 739 746 L. Magnier, F. Haghighat, Multiobjective optimization of building design using trnsys simulations, genetic algorithm, and artificial neural network, Building and Environment 45 (2010) 739\u2013746. [4] F. Bre A.S. Silva E. Ghisi V.D. Fachinotti Residential building design optimisation using sensitivity analysis and genetic algorithm Energy and Buildings 133 2016 853 866 F. Bre, A.S. Silva, E. Ghisi, V.D. Fachinotti, Residential building design optimisation using sensitivity analysis and genetic algorithm, Energy and Buildings 133 (2016) 853\u2013866. [5] T. Recht F. Munaretto P. Schalbart B. Peuportier Analyse de la fiabilité de COMFIE par comparaison à des mesures. Application à un bâtiment passif IBPSA 2014, Arras, France 2014 T. Recht, F. Munaretto, P. Schalbart, B. Peuportier, Analyse de la fiabilité de COMFIE par comparaison à des mesures. Application à un bâtiment passif, in: IBPSA 2014, Arras, France, 2014. [6] F. Bre N.D. Roman V.D. Fachinotti An efficient metamodel-based method to carry out multi-objective building performance optimizations Energy and Buildings 206 2020 109576 F. Bre, N.D. Roman, V.D. Fachinotti, An efficient metamodel-based method to carry out multi-objective building performance optimizations, Energy and Buildings 206 (2020) 109576. [7] J. Reynolds Y. Rezgui A. Kwan S. Piriou A zone-level, building energy optimisation combining an artificial neural network, a genetic algorithm, and model predictive control Energy 151 2018 729 739 J. Reynolds, Y. Rezgui, A. Kwan, S. Piriou, A zone-level, building energy optimisation combining an artificial neural network, a genetic algorithm, and model predictive control, Energy 151 (2018) 729\u2013739. [8] Y. Ohta T. Sasakawa H. Sato Evolutionary air-conditioning optimization using an lstm-based surrogate evaluator IEEE Congress on Evolutionary Computation (CEC) 2020 2020 1 8 10.1109/CEC48606.2020.9185769 Y. Ohta, T. Sasakawa, H. Sato, Evolutionary air-conditioning optimization using an lstm-based surrogate evaluator, in: 2020 IEEE Congress on Evolutionary Computation (CEC), 2020, pp. 1\u20138. doi:10.1109/CEC48606.2020.9185769. [9] N.D. Roman F. Bre V.D. Fachinotti R. Lamberts Application and characterization of metamodels based on artificial neural networks for building performance simulation: a systematic review Energy and Buildings 109972 2020 N.D. Roman, F. Bre, V.D. Fachinotti, R. Lamberts, Application and characterization of metamodels based on artificial neural networks for building performance simulation: a systematic review, Energy and Buildings (2020) 109972. [10] R. Sendra-Arranz Á. Gutiérrez A long short-term memory artificial neural network to predict daily hvac consumption in buildings Energy and Buildings 216 2020 109952 R. Sendra-Arranz, Á. Gutiérrez, A long short-term memory artificial neural network to predict daily hvac consumption in buildings, Energy and Buildings 216 (2020) 109952. [11] M.C. Mozer, A focused backpropagation algorithm for temporal pattern recognition, Complex Systems 3. M.C. Mozer, A focused backpropagation algorithm for temporal pattern recognition, Complex Systems 3. [12] Y. Bengio P.Y. Simard P. Frasconi Learning long-term dependencies with gradient descent is difficult IEEE Transactions on Neural Networks 5 2 1994 157 166 Y. Bengio, P.Y. Simard, P. Frasconi, Learning long-term dependencies with gradient descent is difficult, IEEE transactions on neural networks 5 2 (1994) 157\u201366. [13] S. Hochreiter J. Schmidhuber Long short-term memory Neural Computation 9 1997 1735 1780 S. Hochreiter, J. Schmidhuber, Long short-term memory, Neural Computation 9 (1997) 1735\u20131780. [14] K. Cho B. van Merriënboer C. Gulcehre D. Bahdanau F. Bougares H. Schwenk Y. Bengio Learning phrase representations using RNN encoder\u2013decoder for statistical machine translation Proceedings of the 2014 Conference on Empirical Methods in Natural Language Processing (EMNLP) 2014 Association for Computational Linguistics Doha, Qatar 1724 1734 10.3115/v1/D14-1179. URL:https://www.aclweb.org/anthology/D14-1179 K. Cho, B. van Merriënboer, C. Gulcehre, D. Bahdanau, F. Bougares, H. Schwenk, Y. Bengio, Learning phrase representations using RNN encoder\u2013decoder for statistical machine translation, in: Proceedings of the 2014 Conference on Empirical Methods in Natural Language Processing (EMNLP), Association for Computational Linguistics, Doha, Qatar, 2014, pp. 1724\u20131734. doi:10.3115/v1/D14-1179. URL:https://www.aclweb.org/anthology/D14-1179 [15] A. Krizhevsky I. Sutskever G.E. Hinton Imagenet classification with deep convolutional neural networks NIPS 2012 A. Krizhevsky, I. Sutskever, G.E. Hinton, Imagenet classification with deep convolutional neural networks, in: NIPS, 2012. [16] R. Józefowicz, O. Vinyals, M. Schuster, N. Shazeer, Y. Wu, Exploring the limits of language modeling, ArXiv abs/1602.02410. R. Józefowicz, O. Vinyals, M. Schuster, N. Shazeer, Y. Wu, Exploring the limits of language modeling, ArXiv abs/1602.02410. [17] Y. Kim Y. Jernite D.A. Sontag A.M. Rush Character-aware neural language models AAAI 2016 Y. Kim, Y. Jernite, D.A. Sontag, A.M. Rush, Character-aware neural language models, in: AAAI, 2016. [18] A. Vaswani, N. Shazeer, N. Parmar, J. Uszkoreit, L. Jones, A.N. Gomez, L. u. Kaiser, I. Polosukhin, Attention is all you need, in: Advances in Neural Information Processing Systems, vol. 30, 2017. A. Vaswani, N. Shazeer, N. Parmar, J. Uszkoreit, L. Jones, A.N. Gomez, L. u. Kaiser, I. Polosukhin, Attention is all you need, in: Advances in Neural Information Processing Systems, Vol. 30, 2017. [19] D. Coakley P. Raftery M. Keane A review of methods to match building energy simulation models to measured data Renewable & Sustainable Energy Reviews 37 2014 123 141 D. Coakley, P. Raftery, M. Keane, A review of methods to match building energy simulation models to measured data, Renewable & Sustainable Energy Reviews 37 (2014) 123\u2013141. [20] S. Le Corff, A. Champagne, M. Charbit, G. Noziere, E. Moulines, Optimizing thermal comfort and energy consumption in a large building without renovation works, 2018 IEEE Data Science Workshop (DSW) (2018) 41\u201345. S. Le Corff, A. Champagne, M. Charbit, G. Noziere, E. Moulines, Optimizing thermal comfort and energy consumption in a large building without renovation works, 2018 IEEE Data Science Workshop (DSW) (2018) 41\u201345. [21] S. Nagpal C. Mueller A. Aijazi C. Reinhart A methodology for auto-calibrating urban building energy models using surrogate modeling techniques Journal of Building Performance Simulation 12 2019 1 16 S. Nagpal, C. Mueller, A. Aijazi, C. Reinhart, A methodology for auto-calibrating urban building energy models using surrogate modeling techniques, Journal of Building Performance Simulation 12 (2019) 1 \u2013 16. [22] G. Aird, D. Coakley, R. Kerrigan, Application of an optimisation approach for the calibration 1 of high-fidelity building energy models to support model-2 predictive control (mpc) of hvac systems, 2016. G. Aird, D. Coakley, R. Kerrigan, Application of an optimisation approach for the calibration 1 of high-fidelity building energy models to support model-2 predictive control (mpc) of hvac systems, 2016. [23] C. Igel N. Hansen S. Roth Covariance matrix adaptation for multi-objective optimization Evolutionary Computation 11 2007 1 28 C. Igel, N. Hansen, S. Roth, Covariance matrix adaptation for multi-objective optimization, Evolutionary Computation 11 (2007) 1\u201328. [24] D.P. Kingma, J. Ba, Adam: A method for stochastic optimization, CoRR abs/1412.6980. D.P. Kingma, J. Ba, Adam: A method for stochastic optimization, CoRR abs/1412.6980. [25] S. Seyedzadeh F. Rahimian S. Oliver S. Rodriguez-Trejo I. Glesk Machine learning modelling for predicting non-domestic buildings energy performance: A model to support deep energy retrofit decision-making Applied Energy 279 2020 115908 S. Seyedzadeh, F. Rahimian, S. Oliver, S. Rodriguez-Trejo, I. Glesk, Machine learning modelling for predicting non-domestic buildings energy performance: A model to support deep energy retrofit decision-making, Applied Energy 279 (2020) 115908. [26] B. Ajib, Data-driven building thermal modeling using system identification for hybrid systems, 2018. B. Ajib, Data-driven building thermal modeling using system identification for hybrid systems, 2018. [27] N. Hansen S. Müller P. Koumoutsakos Reducing the time complexity of the derandomized evolution strategy with covariance matrix adaptation (cma-es) Evolutionary Computation 11 2003 1 18 10.1162/106365603321828970 N. Hansen, S. Müller, P. Koumoutsakos, Reducing the time complexity of the derandomized evolution strategy with covariance matrix adaptation (cma-es), Evolutionary computation 11 (2003) 1\u201318. doi:10.1162/106365603321828970. [28] E. Fabrizio V. Monetti Methodologies and advancements in the calibration of building energy models Energies 8 2015 2548 2574 E. Fabrizio, V. Monetti, Methodologies and advancements in the calibration of building energy models, Energies 8 (2015) 2548\u20132574. [29] K. Deb, S. Agrawal, A. Pratap, T. Meyarivan, A fast elitist non-dominated sorting genetic algorithm for multi-objective optimisation: Nsga-ii, in: PPSN, 2000. K. Deb, S. Agrawal, A. Pratap, T. Meyarivan, A fast elitist non-dominated sorting genetic algorithm for multi-objective optimisation: Nsga-ii, in: PPSN, 2000.",
    "scopus-id": "85110627705",
    "coredata": {
        "eid": "1-s2.0-S0378778821005028",
        "dc:description": "In this paper, we propose a new end-to-end methodology to optimize energy performance and thermal comfort in office buildings, without any renovation work. The process is decomposed into three steps: metamodel training, model calibration and optimization. We introduce and train a metamodel on thousands of weather and building settings scenarios, using samples from a physical simulation model. Its much faster computation time allows for the calibration of two weakly instrumented buildings with a derivative free optimization procedure. Using historic data from these buildings, we estimate up to 60 unknown parameters defined by energy managers, such as heat capacity, window area or exposition. Energy consumptions are finally minimized while maintaining a target thermal comfort using the Pareto front provided by a multi-objective optimization algorithm. Our approach allows the computation of the entire calibration-optimization pipeline on several types of buildings. Moreover, the numerical experiments illustrate how it may ensure a significant gain in energy efficiency, up to almost 10%, while being computationally much more appealing than simulation programs.",
        "openArchiveArticle": "false",
        "prism:coverDate": "2021-11-01",
        "openaccessUserLicense": null,
        "prism:aggregationType": "Journal",
        "prism:url": "https://api.elsevier.com/content/article/pii/S0378778821005028",
        "dc:creator": [
            {
                "@_fa": "true",
                "$": "Cohen, Max"
            },
            {
                "@_fa": "true",
                "$": "Le Corff, Sylvain"
            },
            {
                "@_fa": "true",
                "$": "Charbit, Maurice"
            },
            {
                "@_fa": "true",
                "$": "Champagne, Alain"
            },
            {
                "@_fa": "true",
                "$": "Nozière, Gilles"
            },
            {
                "@_fa": "true",
                "$": "Preda, Marius"
            }
        ],
        "link": [
            {
                "@_fa": "true",
                "@rel": "self",
                "@href": "https://api.elsevier.com/content/article/pii/S0378778821005028"
            },
            {
                "@_fa": "true",
                "@rel": "scidir",
                "@href": "https://www.sciencedirect.com/science/article/pii/S0378778821005028"
            }
        ],
        "dc:format": "application/json",
        "openaccessType": null,
        "pii": "S0378-7788(21)00502-8",
        "prism:volume": "250",
        "articleNumber": "111218",
        "prism:publisher": "Elsevier B.V.",
        "dc:title": "End-to-end deep meta modelling to calibrate and optimize energy consumption and comfort",
        "prism:copyright": "© 2021 Elsevier B.V. All rights reserved.",
        "openaccess": "0",
        "prism:issn": "03787788",
        "dcterms:subject": [
            {
                "@_fa": "true",
                "$": "Recurrent neural networks"
            },
            {
                "@_fa": "true",
                "$": "Metamodel"
            },
            {
                "@_fa": "true",
                "$": "Building energy model"
            },
            {
                "@_fa": "true",
                "$": "Calibration"
            },
            {
                "@_fa": "true",
                "$": "Optimization"
            }
        ],
        "openaccessArticle": "false",
        "prism:publicationName": "Energy and Buildings",
        "openaccessSponsorType": null,
        "prism:pageRange": "111218",
        "pubType": "fla",
        "prism:coverDisplayDate": "1 November 2021",
        "prism:doi": "10.1016/j.enbuild.2021.111218",
        "prism:startingPage": "111218",
        "dc:identifier": "doi:10.1016/j.enbuild.2021.111218",
        "openaccessSponsorName": null
    },
    "objects": {"object": [
        {
            "@category": "standard",
            "@height": "246",
            "@width": "540",
            "@_fa": "true",
            "$": "https://api.elsevier.com/content/object/eid/1-s2.0-S0378778821005028-gr1.jpg?httpAccept=%2A%2F%2A",
            "@multimediatype": "JPEG image file",
            "@type": "IMAGE-DOWNSAMPLED",
            "@size": "31462",
            "@ref": "gr1",
            "@mimetype": "image/jpeg"
        },
        {
            "@category": "standard",
            "@height": "147",
            "@width": "355",
            "@_fa": "true",
            "$": "https://api.elsevier.com/content/object/eid/1-s2.0-S0378778821005028-gr2.jpg?httpAccept=%2A%2F%2A",
            "@multimediatype": "JPEG image file",
            "@type": "IMAGE-DOWNSAMPLED",
            "@size": "12787",
            "@ref": "gr2",
            "@mimetype": "image/jpeg"
        },
        {
            "@category": "standard",
            "@height": "388",
            "@width": "540",
            "@_fa": "true",
            "$": "https://api.elsevier.com/content/object/eid/1-s2.0-S0378778821005028-gr3.jpg?httpAccept=%2A%2F%2A",
            "@multimediatype": "JPEG image file",
            "@type": "IMAGE-DOWNSAMPLED",
            "@size": "60348",
            "@ref": "gr3",
            "@mimetype": "image/jpeg"
        },
        {
            "@category": "standard",
            "@height": "388",
            "@width": "540",
            "@_fa": "true",
            "$": "https://api.elsevier.com/content/object/eid/1-s2.0-S0378778821005028-gr4.jpg?httpAccept=%2A%2F%2A",
            "@multimediatype": "JPEG image file",
            "@type": "IMAGE-DOWNSAMPLED",
            "@size": "67689",
            "@ref": "gr4",
            "@mimetype": "image/jpeg"
        },
        {
            "@category": "standard",
            "@height": "783",
            "@width": "540",
            "@_fa": "true",
            "$": "https://api.elsevier.com/content/object/eid/1-s2.0-S0378778821005028-gr5.jpg?httpAccept=%2A%2F%2A",
            "@multimediatype": "JPEG image file",
            "@type": "IMAGE-DOWNSAMPLED",
            "@size": "117799",
            "@ref": "gr5",
            "@mimetype": "image/jpeg"
        },
        {
            "@category": "standard",
            "@height": "375",
            "@width": "540",
            "@_fa": "true",
            "$": "https://api.elsevier.com/content/object/eid/1-s2.0-S0378778821005028-gr6.jpg?httpAccept=%2A%2F%2A",
            "@multimediatype": "JPEG image file",
            "@type": "IMAGE-DOWNSAMPLED",
            "@size": "36040",
            "@ref": "gr6",
            "@mimetype": "image/jpeg"
        },
        {
            "@category": "standard",
            "@height": "390",
            "@width": "540",
            "@_fa": "true",
            "$": "https://api.elsevier.com/content/object/eid/1-s2.0-S0378778821005028-gr7.jpg?httpAccept=%2A%2F%2A",
            "@multimediatype": "JPEG image file",
            "@type": "IMAGE-DOWNSAMPLED",
            "@size": "78507",
            "@ref": "gr7",
            "@mimetype": "image/jpeg"
        },
        {
            "@category": "standard",
            "@height": "390",
            "@width": "540",
            "@_fa": "true",
            "$": "https://api.elsevier.com/content/object/eid/1-s2.0-S0378778821005028-gr8.jpg?httpAccept=%2A%2F%2A",
            "@multimediatype": "JPEG image file",
            "@type": "IMAGE-DOWNSAMPLED",
            "@size": "81256",
            "@ref": "gr8",
            "@mimetype": "image/jpeg"
        },
        {
            "@category": "standard",
            "@height": "489",
            "@width": "366",
            "@_fa": "true",
            "$": "https://api.elsevier.com/content/object/eid/1-s2.0-S0378778821005028-gr9.jpg?httpAccept=%2A%2F%2A",
            "@multimediatype": "JPEG image file",
            "@type": "IMAGE-DOWNSAMPLED",
            "@size": "37469",
            "@ref": "gr9",
            "@mimetype": "image/jpeg"
        },
        {
            "@category": "thumbnail",
            "@height": "100",
            "@width": "219",
            "@_fa": "true",
            "$": "https://api.elsevier.com/content/object/eid/1-s2.0-S0378778821005028-gr1.sml?httpAccept=%2A%2F%2A",
            "@multimediatype": "GIF image file",
            "@type": "IMAGE-THUMBNAIL",
            "@size": "6526",
            "@ref": "gr1",
            "@mimetype": "image/gif"
        },
        {
            "@category": "thumbnail",
            "@height": "91",
            "@width": "219",
            "@_fa": "true",
            "$": "https://api.elsevier.com/content/object/eid/1-s2.0-S0378778821005028-gr2.sml?httpAccept=%2A%2F%2A",
            "@multimediatype": "GIF image file",
            "@type": "IMAGE-THUMBNAIL",
            "@size": "5959",
            "@ref": "gr2",
            "@mimetype": "image/gif"
        },
        {
            "@category": "thumbnail",
            "@height": "157",
            "@width": "219",
            "@_fa": "true",
            "$": "https://api.elsevier.com/content/object/eid/1-s2.0-S0378778821005028-gr3.sml?httpAccept=%2A%2F%2A",
            "@multimediatype": "GIF image file",
            "@type": "IMAGE-THUMBNAIL",
            "@size": "13261",
            "@ref": "gr3",
            "@mimetype": "image/gif"
        },
        {
            "@category": "thumbnail",
            "@height": "157",
            "@width": "219",
            "@_fa": "true",
            "$": "https://api.elsevier.com/content/object/eid/1-s2.0-S0378778821005028-gr4.sml?httpAccept=%2A%2F%2A",
            "@multimediatype": "GIF image file",
            "@type": "IMAGE-THUMBNAIL",
            "@size": "15062",
            "@ref": "gr4",
            "@mimetype": "image/gif"
        },
        {
            "@category": "thumbnail",
            "@height": "164",
            "@width": "113",
            "@_fa": "true",
            "$": "https://api.elsevier.com/content/object/eid/1-s2.0-S0378778821005028-gr5.sml?httpAccept=%2A%2F%2A",
            "@multimediatype": "GIF image file",
            "@type": "IMAGE-THUMBNAIL",
            "@size": "11479",
            "@ref": "gr5",
            "@mimetype": "image/gif"
        },
        {
            "@category": "thumbnail",
            "@height": "152",
            "@width": "219",
            "@_fa": "true",
            "$": "https://api.elsevier.com/content/object/eid/1-s2.0-S0378778821005028-gr6.sml?httpAccept=%2A%2F%2A",
            "@multimediatype": "GIF image file",
            "@type": "IMAGE-THUMBNAIL",
            "@size": "8124",
            "@ref": "gr6",
            "@mimetype": "image/gif"
        },
        {
            "@category": "thumbnail",
            "@height": "158",
            "@width": "219",
            "@_fa": "true",
            "$": "https://api.elsevier.com/content/object/eid/1-s2.0-S0378778821005028-gr7.sml?httpAccept=%2A%2F%2A",
            "@multimediatype": "GIF image file",
            "@type": "IMAGE-THUMBNAIL",
            "@size": "23241",
            "@ref": "gr7",
            "@mimetype": "image/gif"
        },
        {
            "@category": "thumbnail",
            "@height": "158",
            "@width": "219",
            "@_fa": "true",
            "$": "https://api.elsevier.com/content/object/eid/1-s2.0-S0378778821005028-gr8.sml?httpAccept=%2A%2F%2A",
            "@multimediatype": "GIF image file",
            "@type": "IMAGE-THUMBNAIL",
            "@size": "23900",
            "@ref": "gr8",
            "@mimetype": "image/gif"
        },
        {
            "@category": "thumbnail",
            "@height": "164",
            "@width": "123",
            "@_fa": "true",
            "$": "https://api.elsevier.com/content/object/eid/1-s2.0-S0378778821005028-gr9.sml?httpAccept=%2A%2F%2A",
            "@multimediatype": "GIF image file",
            "@type": "IMAGE-THUMBNAIL",
            "@size": "5018",
            "@ref": "gr9",
            "@mimetype": "image/gif"
        },
        {
            "@category": "high",
            "@height": "1089",
            "@width": "2390",
            "@_fa": "true",
            "$": "https://api.elsevier.com/content/object/eid/1-s2.0-S0378778821005028-gr1_lrg.jpg?httpAccept=%2A%2F%2A",
            "@multimediatype": "JPEG image file",
            "@type": "IMAGE-HIGH-RES",
            "@size": "169306",
            "@ref": "gr1",
            "@mimetype": "image/jpeg"
        },
        {
            "@category": "high",
            "@height": "652",
            "@width": "1575",
            "@_fa": "true",
            "$": "https://api.elsevier.com/content/object/eid/1-s2.0-S0378778821005028-gr2_lrg.jpg?httpAccept=%2A%2F%2A",
            "@multimediatype": "JPEG image file",
            "@type": "IMAGE-HIGH-RES",
            "@size": "71277",
            "@ref": "gr2",
            "@mimetype": "image/jpeg"
        },
        {
            "@category": "high",
            "@height": "1717",
            "@width": "2390",
            "@_fa": "true",
            "$": "https://api.elsevier.com/content/object/eid/1-s2.0-S0378778821005028-gr3_lrg.jpg?httpAccept=%2A%2F%2A",
            "@multimediatype": "JPEG image file",
            "@type": "IMAGE-HIGH-RES",
            "@size": "450143",
            "@ref": "gr3",
            "@mimetype": "image/jpeg"
        },
        {
            "@category": "high",
            "@height": "1718",
            "@width": "2390",
            "@_fa": "true",
            "$": "https://api.elsevier.com/content/object/eid/1-s2.0-S0378778821005028-gr4_lrg.jpg?httpAccept=%2A%2F%2A",
            "@multimediatype": "JPEG image file",
            "@type": "IMAGE-HIGH-RES",
            "@size": "512381",
            "@ref": "gr4",
            "@mimetype": "image/jpeg"
        },
        {
            "@category": "high",
            "@height": "3467",
            "@width": "2390",
            "@_fa": "true",
            "$": "https://api.elsevier.com/content/object/eid/1-s2.0-S0378778821005028-gr5_lrg.jpg?httpAccept=%2A%2F%2A",
            "@multimediatype": "JPEG image file",
            "@type": "IMAGE-HIGH-RES",
            "@size": "693798",
            "@ref": "gr5",
            "@mimetype": "image/jpeg"
        },
        {
            "@category": "high",
            "@height": "1661",
            "@width": "2390",
            "@_fa": "true",
            "$": "https://api.elsevier.com/content/object/eid/1-s2.0-S0378778821005028-gr6_lrg.jpg?httpAccept=%2A%2F%2A",
            "@multimediatype": "JPEG image file",
            "@type": "IMAGE-HIGH-RES",
            "@size": "194976",
            "@ref": "gr6",
            "@mimetype": "image/jpeg"
        },
        {
            "@category": "high",
            "@height": "1724",
            "@width": "2390",
            "@_fa": "true",
            "$": "https://api.elsevier.com/content/object/eid/1-s2.0-S0378778821005028-gr7_lrg.jpg?httpAccept=%2A%2F%2A",
            "@multimediatype": "JPEG image file",
            "@type": "IMAGE-HIGH-RES",
            "@size": "525712",
            "@ref": "gr7",
            "@mimetype": "image/jpeg"
        },
        {
            "@category": "high",
            "@height": "1726",
            "@width": "2390",
            "@_fa": "true",
            "$": "https://api.elsevier.com/content/object/eid/1-s2.0-S0378778821005028-gr8_lrg.jpg?httpAccept=%2A%2F%2A",
            "@multimediatype": "JPEG image file",
            "@type": "IMAGE-HIGH-RES",
            "@size": "547337",
            "@ref": "gr8",
            "@mimetype": "image/jpeg"
        },
        {
            "@category": "high",
            "@height": "2165",
            "@width": "1622",
            "@_fa": "true",
            "$": "https://api.elsevier.com/content/object/eid/1-s2.0-S0378778821005028-gr9_lrg.jpg?httpAccept=%2A%2F%2A",
            "@multimediatype": "JPEG image file",
            "@type": "IMAGE-HIGH-RES",
            "@size": "234971",
            "@ref": "gr9",
            "@mimetype": "image/jpeg"
        },
        {
            "@category": "thumbnail",
            "@_fa": "true",
            "$": "https://api.elsevier.com/content/object/eid/1-s2.0-S0378778821005028-si1.svg?httpAccept=%2A%2F%2A",
            "@multimediatype": "Scalable Vector Graphics file",
            "@type": "ALTIMG",
            "@size": "2208",
            "@ref": "si1",
            "@mimetype": "image/svg+xml"
        },
        {
            "@category": "thumbnail",
            "@_fa": "true",
            "$": "https://api.elsevier.com/content/object/eid/1-s2.0-S0378778821005028-si10.svg?httpAccept=%2A%2F%2A",
            "@multimediatype": "Scalable Vector Graphics file",
            "@type": "ALTIMG",
            "@size": "4276",
            "@ref": "si10",
            "@mimetype": "image/svg+xml"
        },
        {
            "@category": "thumbnail",
            "@_fa": "true",
            "$": "https://api.elsevier.com/content/object/eid/1-s2.0-S0378778821005028-si100.svg?httpAccept=%2A%2F%2A",
            "@multimediatype": "Scalable Vector Graphics file",
            "@type": "ALTIMG",
            "@size": "4293",
            "@ref": "si100",
            "@mimetype": "image/svg+xml"
        },
        {
            "@category": "thumbnail",
            "@_fa": "true",
            "$": "https://api.elsevier.com/content/object/eid/1-s2.0-S0378778821005028-si101.svg?httpAccept=%2A%2F%2A",
            "@multimediatype": "Scalable Vector Graphics file",
            "@type": "ALTIMG",
            "@size": "4868",
            "@ref": "si101",
            "@mimetype": "image/svg+xml"
        },
        {
            "@category": "thumbnail",
            "@_fa": "true",
            "$": "https://api.elsevier.com/content/object/eid/1-s2.0-S0378778821005028-si102.svg?httpAccept=%2A%2F%2A",
            "@multimediatype": "Scalable Vector Graphics file",
            "@type": "ALTIMG",
            "@size": "4877",
            "@ref": "si102",
            "@mimetype": "image/svg+xml"
        },
        {
            "@category": "thumbnail",
            "@_fa": "true",
            "$": "https://api.elsevier.com/content/object/eid/1-s2.0-S0378778821005028-si103.svg?httpAccept=%2A%2F%2A",
            "@multimediatype": "Scalable Vector Graphics file",
            "@type": "ALTIMG",
            "@size": "7164",
            "@ref": "si103",
            "@mimetype": "image/svg+xml"
        },
        {
            "@category": "thumbnail",
            "@_fa": "true",
            "$": "https://api.elsevier.com/content/object/eid/1-s2.0-S0378778821005028-si104.svg?httpAccept=%2A%2F%2A",
            "@multimediatype": "Scalable Vector Graphics file",
            "@type": "ALTIMG",
            "@size": "6164",
            "@ref": "si104",
            "@mimetype": "image/svg+xml"
        },
        {
            "@category": "thumbnail",
            "@_fa": "true",
            "$": "https://api.elsevier.com/content/object/eid/1-s2.0-S0378778821005028-si105.svg?httpAccept=%2A%2F%2A",
            "@multimediatype": "Scalable Vector Graphics file",
            "@type": "ALTIMG",
            "@size": "4877",
            "@ref": "si105",
            "@mimetype": "image/svg+xml"
        },
        {
            "@category": "thumbnail",
            "@_fa": "true",
            "$": "https://api.elsevier.com/content/object/eid/1-s2.0-S0378778821005028-si106.svg?httpAccept=%2A%2F%2A",
            "@multimediatype": "Scalable Vector Graphics file",
            "@type": "ALTIMG",
            "@size": "21277",
            "@ref": "si106",
            "@mimetype": "image/svg+xml"
        },
        {
            "@category": "thumbnail",
            "@_fa": "true",
            "$": "https://api.elsevier.com/content/object/eid/1-s2.0-S0378778821005028-si107.svg?httpAccept=%2A%2F%2A",
            "@multimediatype": "Scalable Vector Graphics file",
            "@type": "ALTIMG",
            "@size": "5142",
            "@ref": "si107",
            "@mimetype": "image/svg+xml"
        },
        {
            "@category": "thumbnail",
            "@_fa": "true",
            "$": "https://api.elsevier.com/content/object/eid/1-s2.0-S0378778821005028-si108.svg?httpAccept=%2A%2F%2A",
            "@multimediatype": "Scalable Vector Graphics file",
            "@type": "ALTIMG",
            "@size": "2692",
            "@ref": "si108",
            "@mimetype": "image/svg+xml"
        },
        {
            "@category": "thumbnail",
            "@_fa": "true",
            "$": "https://api.elsevier.com/content/object/eid/1-s2.0-S0378778821005028-si109.svg?httpAccept=%2A%2F%2A",
            "@multimediatype": "Scalable Vector Graphics file",
            "@type": "ALTIMG",
            "@size": "44555",
            "@ref": "si109",
            "@mimetype": "image/svg+xml"
        },
        {
            "@category": "thumbnail",
            "@_fa": "true",
            "$": "https://api.elsevier.com/content/object/eid/1-s2.0-S0378778821005028-si11.svg?httpAccept=%2A%2F%2A",
            "@multimediatype": "Scalable Vector Graphics file",
            "@type": "ALTIMG",
            "@size": "2924",
            "@ref": "si11",
            "@mimetype": "image/svg+xml"
        },
        {
            "@category": "thumbnail",
            "@_fa": "true",
            "$": "https://api.elsevier.com/content/object/eid/1-s2.0-S0378778821005028-si110.svg?httpAccept=%2A%2F%2A",
            "@multimediatype": "Scalable Vector Graphics file",
            "@type": "ALTIMG",
            "@size": "14247",
            "@ref": "si110",
            "@mimetype": "image/svg+xml"
        },
        {
            "@category": "thumbnail",
            "@_fa": "true",
            "$": "https://api.elsevier.com/content/object/eid/1-s2.0-S0378778821005028-si111.svg?httpAccept=%2A%2F%2A",
            "@multimediatype": "Scalable Vector Graphics file",
            "@type": "ALTIMG",
            "@size": "1331",
            "@ref": "si111",
            "@mimetype": "image/svg+xml"
        },
        {
            "@category": "thumbnail",
            "@_fa": "true",
            "$": "https://api.elsevier.com/content/object/eid/1-s2.0-S0378778821005028-si112.svg?httpAccept=%2A%2F%2A",
            "@multimediatype": "Scalable Vector Graphics file",
            "@type": "ALTIMG",
            "@size": "12253",
            "@ref": "si112",
            "@mimetype": "image/svg+xml"
        },
        {
            "@category": "thumbnail",
            "@_fa": "true",
            "$": "https://api.elsevier.com/content/object/eid/1-s2.0-S0378778821005028-si113.svg?httpAccept=%2A%2F%2A",
            "@multimediatype": "Scalable Vector Graphics file",
            "@type": "ALTIMG",
            "@size": "28268",
            "@ref": "si113",
            "@mimetype": "image/svg+xml"
        },
        {
            "@category": "thumbnail",
            "@_fa": "true",
            "$": "https://api.elsevier.com/content/object/eid/1-s2.0-S0378778821005028-si114.svg?httpAccept=%2A%2F%2A",
            "@multimediatype": "Scalable Vector Graphics file",
            "@type": "ALTIMG",
            "@size": "1344",
            "@ref": "si114",
            "@mimetype": "image/svg+xml"
        },
        {
            "@category": "thumbnail",
            "@_fa": "true",
            "$": "https://api.elsevier.com/content/object/eid/1-s2.0-S0378778821005028-si115.svg?httpAccept=%2A%2F%2A",
            "@multimediatype": "Scalable Vector Graphics file",
            "@type": "ALTIMG",
            "@size": "6233",
            "@ref": "si115",
            "@mimetype": "image/svg+xml"
        },
        {
            "@category": "thumbnail",
            "@_fa": "true",
            "$": "https://api.elsevier.com/content/object/eid/1-s2.0-S0378778821005028-si116.svg?httpAccept=%2A%2F%2A",
            "@multimediatype": "Scalable Vector Graphics file",
            "@type": "ALTIMG",
            "@size": "6186",
            "@ref": "si116",
            "@mimetype": "image/svg+xml"
        },
        {
            "@category": "thumbnail",
            "@_fa": "true",
            "$": "https://api.elsevier.com/content/object/eid/1-s2.0-S0378778821005028-si117.svg?httpAccept=%2A%2F%2A",
            "@multimediatype": "Scalable Vector Graphics file",
            "@type": "ALTIMG",
            "@size": "3138",
            "@ref": "si117",
            "@mimetype": "image/svg+xml"
        },
        {
            "@category": "thumbnail",
            "@_fa": "true",
            "$": "https://api.elsevier.com/content/object/eid/1-s2.0-S0378778821005028-si118.svg?httpAccept=%2A%2F%2A",
            "@multimediatype": "Scalable Vector Graphics file",
            "@type": "ALTIMG",
            "@size": "1344",
            "@ref": "si118",
            "@mimetype": "image/svg+xml"
        },
        {
            "@category": "thumbnail",
            "@_fa": "true",
            "$": "https://api.elsevier.com/content/object/eid/1-s2.0-S0378778821005028-si119.svg?httpAccept=%2A%2F%2A",
            "@multimediatype": "Scalable Vector Graphics file",
            "@type": "ALTIMG",
            "@size": "3005",
            "@ref": "si119",
            "@mimetype": "image/svg+xml"
        },
        {
            "@category": "thumbnail",
            "@_fa": "true",
            "$": "https://api.elsevier.com/content/object/eid/1-s2.0-S0378778821005028-si12.svg?httpAccept=%2A%2F%2A",
            "@multimediatype": "Scalable Vector Graphics file",
            "@type": "ALTIMG",
            "@size": "4742",
            "@ref": "si12",
            "@mimetype": "image/svg+xml"
        },
        {
            "@category": "thumbnail",
            "@_fa": "true",
            "$": "https://api.elsevier.com/content/object/eid/1-s2.0-S0378778821005028-si120.svg?httpAccept=%2A%2F%2A",
            "@multimediatype": "Scalable Vector Graphics file",
            "@type": "ALTIMG",
            "@size": "2905",
            "@ref": "si120",
            "@mimetype": "image/svg+xml"
        },
        {
            "@category": "thumbnail",
            "@_fa": "true",
            "$": "https://api.elsevier.com/content/object/eid/1-s2.0-S0378778821005028-si121.svg?httpAccept=%2A%2F%2A",
            "@multimediatype": "Scalable Vector Graphics file",
            "@type": "ALTIMG",
            "@size": "1480",
            "@ref": "si121",
            "@mimetype": "image/svg+xml"
        },
        {
            "@category": "thumbnail",
            "@_fa": "true",
            "$": "https://api.elsevier.com/content/object/eid/1-s2.0-S0378778821005028-si122.svg?httpAccept=%2A%2F%2A",
            "@multimediatype": "Scalable Vector Graphics file",
            "@type": "ALTIMG",
            "@size": "8069",
            "@ref": "si122",
            "@mimetype": "image/svg+xml"
        },
        {
            "@category": "thumbnail",
            "@_fa": "true",
            "$": "https://api.elsevier.com/content/object/eid/1-s2.0-S0378778821005028-si123.svg?httpAccept=%2A%2F%2A",
            "@multimediatype": "Scalable Vector Graphics file",
            "@type": "ALTIMG",
            "@size": "3041",
            "@ref": "si123",
            "@mimetype": "image/svg+xml"
        },
        {
            "@category": "thumbnail",
            "@_fa": "true",
            "$": "https://api.elsevier.com/content/object/eid/1-s2.0-S0378778821005028-si124.svg?httpAccept=%2A%2F%2A",
            "@multimediatype": "Scalable Vector Graphics file",
            "@type": "ALTIMG",
            "@size": "47201",
            "@ref": "si124",
            "@mimetype": "image/svg+xml"
        },
        {
            "@category": "thumbnail",
            "@_fa": "true",
            "$": "https://api.elsevier.com/content/object/eid/1-s2.0-S0378778821005028-si125.svg?httpAccept=%2A%2F%2A",
            "@multimediatype": "Scalable Vector Graphics file",
            "@type": "ALTIMG",
            "@size": "2672",
            "@ref": "si125",
            "@mimetype": "image/svg+xml"
        },
        {
            "@category": "thumbnail",
            "@_fa": "true",
            "$": "https://api.elsevier.com/content/object/eid/1-s2.0-S0378778821005028-si126.svg?httpAccept=%2A%2F%2A",
            "@multimediatype": "Scalable Vector Graphics file",
            "@type": "ALTIMG",
            "@size": "2919",
            "@ref": "si126",
            "@mimetype": "image/svg+xml"
        },
        {
            "@category": "thumbnail",
            "@_fa": "true",
            "$": "https://api.elsevier.com/content/object/eid/1-s2.0-S0378778821005028-si127.svg?httpAccept=%2A%2F%2A",
            "@multimediatype": "Scalable Vector Graphics file",
            "@type": "ALTIMG",
            "@size": "3088",
            "@ref": "si127",
            "@mimetype": "image/svg+xml"
        },
        {
            "@category": "thumbnail",
            "@_fa": "true",
            "$": "https://api.elsevier.com/content/object/eid/1-s2.0-S0378778821005028-si128.svg?httpAccept=%2A%2F%2A",
            "@multimediatype": "Scalable Vector Graphics file",
            "@type": "ALTIMG",
            "@size": "3481",
            "@ref": "si128",
            "@mimetype": "image/svg+xml"
        },
        {
            "@category": "thumbnail",
            "@_fa": "true",
            "$": "https://api.elsevier.com/content/object/eid/1-s2.0-S0378778821005028-si129.svg?httpAccept=%2A%2F%2A",
            "@multimediatype": "Scalable Vector Graphics file",
            "@type": "ALTIMG",
            "@size": "1480",
            "@ref": "si129",
            "@mimetype": "image/svg+xml"
        },
        {
            "@category": "thumbnail",
            "@_fa": "true",
            "$": "https://api.elsevier.com/content/object/eid/1-s2.0-S0378778821005028-si13.svg?httpAccept=%2A%2F%2A",
            "@multimediatype": "Scalable Vector Graphics file",
            "@type": "ALTIMG",
            "@size": "7325",
            "@ref": "si13",
            "@mimetype": "image/svg+xml"
        },
        {
            "@category": "thumbnail",
            "@_fa": "true",
            "$": "https://api.elsevier.com/content/object/eid/1-s2.0-S0378778821005028-si130.svg?httpAccept=%2A%2F%2A",
            "@multimediatype": "Scalable Vector Graphics file",
            "@type": "ALTIMG",
            "@size": "5169",
            "@ref": "si130",
            "@mimetype": "image/svg+xml"
        },
        {
            "@category": "thumbnail",
            "@_fa": "true",
            "$": "https://api.elsevier.com/content/object/eid/1-s2.0-S0378778821005028-si131.svg?httpAccept=%2A%2F%2A",
            "@multimediatype": "Scalable Vector Graphics file",
            "@type": "ALTIMG",
            "@size": "3220",
            "@ref": "si131",
            "@mimetype": "image/svg+xml"
        },
        {
            "@category": "thumbnail",
            "@_fa": "true",
            "$": "https://api.elsevier.com/content/object/eid/1-s2.0-S0378778821005028-si132.svg?httpAccept=%2A%2F%2A",
            "@multimediatype": "Scalable Vector Graphics file",
            "@type": "ALTIMG",
            "@size": "3725",
            "@ref": "si132",
            "@mimetype": "image/svg+xml"
        },
        {
            "@category": "thumbnail",
            "@_fa": "true",
            "$": "https://api.elsevier.com/content/object/eid/1-s2.0-S0378778821005028-si133.svg?httpAccept=%2A%2F%2A",
            "@multimediatype": "Scalable Vector Graphics file",
            "@type": "ALTIMG",
            "@size": "4843",
            "@ref": "si133",
            "@mimetype": "image/svg+xml"
        },
        {
            "@category": "thumbnail",
            "@_fa": "true",
            "$": "https://api.elsevier.com/content/object/eid/1-s2.0-S0378778821005028-si134.svg?httpAccept=%2A%2F%2A",
            "@multimediatype": "Scalable Vector Graphics file",
            "@type": "ALTIMG",
            "@size": "5139",
            "@ref": "si134",
            "@mimetype": "image/svg+xml"
        },
        {
            "@category": "thumbnail",
            "@_fa": "true",
            "$": "https://api.elsevier.com/content/object/eid/1-s2.0-S0378778821005028-si135.svg?httpAccept=%2A%2F%2A",
            "@multimediatype": "Scalable Vector Graphics file",
            "@type": "ALTIMG",
            "@size": "6428",
            "@ref": "si135",
            "@mimetype": "image/svg+xml"
        },
        {
            "@category": "thumbnail",
            "@_fa": "true",
            "$": "https://api.elsevier.com/content/object/eid/1-s2.0-S0378778821005028-si136.svg?httpAccept=%2A%2F%2A",
            "@multimediatype": "Scalable Vector Graphics file",
            "@type": "ALTIMG",
            "@size": "6729",
            "@ref": "si136",
            "@mimetype": "image/svg+xml"
        },
        {
            "@category": "thumbnail",
            "@_fa": "true",
            "$": "https://api.elsevier.com/content/object/eid/1-s2.0-S0378778821005028-si137.svg?httpAccept=%2A%2F%2A",
            "@multimediatype": "Scalable Vector Graphics file",
            "@type": "ALTIMG",
            "@size": "4364",
            "@ref": "si137",
            "@mimetype": "image/svg+xml"
        },
        {
            "@category": "thumbnail",
            "@_fa": "true",
            "$": "https://api.elsevier.com/content/object/eid/1-s2.0-S0378778821005028-si138.svg?httpAccept=%2A%2F%2A",
            "@multimediatype": "Scalable Vector Graphics file",
            "@type": "ALTIMG",
            "@size": "8020",
            "@ref": "si138",
            "@mimetype": "image/svg+xml"
        },
        {
            "@category": "thumbnail",
            "@_fa": "true",
            "$": "https://api.elsevier.com/content/object/eid/1-s2.0-S0378778821005028-si139.svg?httpAccept=%2A%2F%2A",
            "@multimediatype": "Scalable Vector Graphics file",
            "@type": "ALTIMG",
            "@size": "11091",
            "@ref": "si139",
            "@mimetype": "image/svg+xml"
        },
        {
            "@category": "thumbnail",
            "@_fa": "true",
            "$": "https://api.elsevier.com/content/object/eid/1-s2.0-S0378778821005028-si14.svg?httpAccept=%2A%2F%2A",
            "@multimediatype": "Scalable Vector Graphics file",
            "@type": "ALTIMG",
            "@size": "5858",
            "@ref": "si14",
            "@mimetype": "image/svg+xml"
        },
        {
            "@category": "thumbnail",
            "@_fa": "true",
            "$": "https://api.elsevier.com/content/object/eid/1-s2.0-S0378778821005028-si140.svg?httpAccept=%2A%2F%2A",
            "@multimediatype": "Scalable Vector Graphics file",
            "@type": "ALTIMG",
            "@size": "6998",
            "@ref": "si140",
            "@mimetype": "image/svg+xml"
        },
        {
            "@category": "thumbnail",
            "@_fa": "true",
            "$": "https://api.elsevier.com/content/object/eid/1-s2.0-S0378778821005028-si141.svg?httpAccept=%2A%2F%2A",
            "@multimediatype": "Scalable Vector Graphics file",
            "@type": "ALTIMG",
            "@size": "7754",
            "@ref": "si141",
            "@mimetype": "image/svg+xml"
        },
        {
            "@category": "thumbnail",
            "@_fa": "true",
            "$": "https://api.elsevier.com/content/object/eid/1-s2.0-S0378778821005028-si142.svg?httpAccept=%2A%2F%2A",
            "@multimediatype": "Scalable Vector Graphics file",
            "@type": "ALTIMG",
            "@size": "4681",
            "@ref": "si142",
            "@mimetype": "image/svg+xml"
        },
        {
            "@category": "thumbnail",
            "@_fa": "true",
            "$": "https://api.elsevier.com/content/object/eid/1-s2.0-S0378778821005028-si143.svg?httpAccept=%2A%2F%2A",
            "@multimediatype": "Scalable Vector Graphics file",
            "@type": "ALTIMG",
            "@size": "8556",
            "@ref": "si143",
            "@mimetype": "image/svg+xml"
        },
        {
            "@category": "thumbnail",
            "@_fa": "true",
            "$": "https://api.elsevier.com/content/object/eid/1-s2.0-S0378778821005028-si144.svg?httpAccept=%2A%2F%2A",
            "@multimediatype": "Scalable Vector Graphics file",
            "@type": "ALTIMG",
            "@size": "11188",
            "@ref": "si144",
            "@mimetype": "image/svg+xml"
        },
        {
            "@category": "thumbnail",
            "@_fa": "true",
            "$": "https://api.elsevier.com/content/object/eid/1-s2.0-S0378778821005028-si145.svg?httpAccept=%2A%2F%2A",
            "@multimediatype": "Scalable Vector Graphics file",
            "@type": "ALTIMG",
            "@size": "6679",
            "@ref": "si145",
            "@mimetype": "image/svg+xml"
        },
        {
            "@category": "thumbnail",
            "@_fa": "true",
            "$": "https://api.elsevier.com/content/object/eid/1-s2.0-S0378778821005028-si146.svg?httpAccept=%2A%2F%2A",
            "@multimediatype": "Scalable Vector Graphics file",
            "@type": "ALTIMG",
            "@size": "7806",
            "@ref": "si146",
            "@mimetype": "image/svg+xml"
        },
        {
            "@category": "thumbnail",
            "@_fa": "true",
            "$": "https://api.elsevier.com/content/object/eid/1-s2.0-S0378778821005028-si147.svg?httpAccept=%2A%2F%2A",
            "@multimediatype": "Scalable Vector Graphics file",
            "@type": "ALTIMG",
            "@size": "8098",
            "@ref": "si147",
            "@mimetype": "image/svg+xml"
        },
        {
            "@category": "thumbnail",
            "@_fa": "true",
            "$": "https://api.elsevier.com/content/object/eid/1-s2.0-S0378778821005028-si148.svg?httpAccept=%2A%2F%2A",
            "@multimediatype": "Scalable Vector Graphics file",
            "@type": "ALTIMG",
            "@size": "4532",
            "@ref": "si148",
            "@mimetype": "image/svg+xml"
        },
        {
            "@category": "thumbnail",
            "@_fa": "true",
            "$": "https://api.elsevier.com/content/object/eid/1-s2.0-S0378778821005028-si149.svg?httpAccept=%2A%2F%2A",
            "@multimediatype": "Scalable Vector Graphics file",
            "@type": "ALTIMG",
            "@size": "3430",
            "@ref": "si149",
            "@mimetype": "image/svg+xml"
        },
        {
            "@category": "thumbnail",
            "@_fa": "true",
            "$": "https://api.elsevier.com/content/object/eid/1-s2.0-S0378778821005028-si15.svg?httpAccept=%2A%2F%2A",
            "@multimediatype": "Scalable Vector Graphics file",
            "@type": "ALTIMG",
            "@size": "6642",
            "@ref": "si15",
            "@mimetype": "image/svg+xml"
        },
        {
            "@category": "thumbnail",
            "@_fa": "true",
            "$": "https://api.elsevier.com/content/object/eid/1-s2.0-S0378778821005028-si150.svg?httpAccept=%2A%2F%2A",
            "@multimediatype": "Scalable Vector Graphics file",
            "@type": "ALTIMG",
            "@size": "5220",
            "@ref": "si150",
            "@mimetype": "image/svg+xml"
        },
        {
            "@category": "thumbnail",
            "@_fa": "true",
            "$": "https://api.elsevier.com/content/object/eid/1-s2.0-S0378778821005028-si151.svg?httpAccept=%2A%2F%2A",
            "@multimediatype": "Scalable Vector Graphics file",
            "@type": "ALTIMG",
            "@size": "1345",
            "@ref": "si151",
            "@mimetype": "image/svg+xml"
        },
        {
            "@category": "thumbnail",
            "@_fa": "true",
            "$": "https://api.elsevier.com/content/object/eid/1-s2.0-S0378778821005028-si152.svg?httpAccept=%2A%2F%2A",
            "@multimediatype": "Scalable Vector Graphics file",
            "@type": "ALTIMG",
            "@size": "8137",
            "@ref": "si152",
            "@mimetype": "image/svg+xml"
        },
        {
            "@category": "thumbnail",
            "@_fa": "true",
            "$": "https://api.elsevier.com/content/object/eid/1-s2.0-S0378778821005028-si153.svg?httpAccept=%2A%2F%2A",
            "@multimediatype": "Scalable Vector Graphics file",
            "@type": "ALTIMG",
            "@size": "1345",
            "@ref": "si153",
            "@mimetype": "image/svg+xml"
        },
        {
            "@category": "thumbnail",
            "@_fa": "true",
            "$": "https://api.elsevier.com/content/object/eid/1-s2.0-S0378778821005028-si154.svg?httpAccept=%2A%2F%2A",
            "@multimediatype": "Scalable Vector Graphics file",
            "@type": "ALTIMG",
            "@size": "1480",
            "@ref": "si154",
            "@mimetype": "image/svg+xml"
        },
        {
            "@category": "thumbnail",
            "@_fa": "true",
            "$": "https://api.elsevier.com/content/object/eid/1-s2.0-S0378778821005028-si155.svg?httpAccept=%2A%2F%2A",
            "@multimediatype": "Scalable Vector Graphics file",
            "@type": "ALTIMG",
            "@size": "1345",
            "@ref": "si155",
            "@mimetype": "image/svg+xml"
        },
        {
            "@category": "thumbnail",
            "@_fa": "true",
            "$": "https://api.elsevier.com/content/object/eid/1-s2.0-S0378778821005028-si156.svg?httpAccept=%2A%2F%2A",
            "@multimediatype": "Scalable Vector Graphics file",
            "@type": "ALTIMG",
            "@size": "8137",
            "@ref": "si156",
            "@mimetype": "image/svg+xml"
        },
        {
            "@category": "thumbnail",
            "@_fa": "true",
            "$": "https://api.elsevier.com/content/object/eid/1-s2.0-S0378778821005028-si157.svg?httpAccept=%2A%2F%2A",
            "@multimediatype": "Scalable Vector Graphics file",
            "@type": "ALTIMG",
            "@size": "6108",
            "@ref": "si157",
            "@mimetype": "image/svg+xml"
        },
        {
            "@category": "thumbnail",
            "@_fa": "true",
            "$": "https://api.elsevier.com/content/object/eid/1-s2.0-S0378778821005028-si158.svg?httpAccept=%2A%2F%2A",
            "@multimediatype": "Scalable Vector Graphics file",
            "@type": "ALTIMG",
            "@size": "4141",
            "@ref": "si158",
            "@mimetype": "image/svg+xml"
        },
        {
            "@category": "thumbnail",
            "@_fa": "true",
            "$": "https://api.elsevier.com/content/object/eid/1-s2.0-S0378778821005028-si159.svg?httpAccept=%2A%2F%2A",
            "@multimediatype": "Scalable Vector Graphics file",
            "@type": "ALTIMG",
            "@size": "9029",
            "@ref": "si159",
            "@mimetype": "image/svg+xml"
        },
        {
            "@category": "thumbnail",
            "@_fa": "true",
            "$": "https://api.elsevier.com/content/object/eid/1-s2.0-S0378778821005028-si16.svg?httpAccept=%2A%2F%2A",
            "@multimediatype": "Scalable Vector Graphics file",
            "@type": "ALTIMG",
            "@size": "6558",
            "@ref": "si16",
            "@mimetype": "image/svg+xml"
        },
        {
            "@category": "thumbnail",
            "@_fa": "true",
            "$": "https://api.elsevier.com/content/object/eid/1-s2.0-S0378778821005028-si160.svg?httpAccept=%2A%2F%2A",
            "@multimediatype": "Scalable Vector Graphics file",
            "@type": "ALTIMG",
            "@size": "8701",
            "@ref": "si160",
            "@mimetype": "image/svg+xml"
        },
        {
            "@category": "thumbnail",
            "@_fa": "true",
            "$": "https://api.elsevier.com/content/object/eid/1-s2.0-S0378778821005028-si161.svg?httpAccept=%2A%2F%2A",
            "@multimediatype": "Scalable Vector Graphics file",
            "@type": "ALTIMG",
            "@size": "9156",
            "@ref": "si161",
            "@mimetype": "image/svg+xml"
        },
        {
            "@category": "thumbnail",
            "@_fa": "true",
            "$": "https://api.elsevier.com/content/object/eid/1-s2.0-S0378778821005028-si162.svg?httpAccept=%2A%2F%2A",
            "@multimediatype": "Scalable Vector Graphics file",
            "@type": "ALTIMG",
            "@size": "37892",
            "@ref": "si162",
            "@mimetype": "image/svg+xml"
        },
        {
            "@category": "thumbnail",
            "@_fa": "true",
            "$": "https://api.elsevier.com/content/object/eid/1-s2.0-S0378778821005028-si163.svg?httpAccept=%2A%2F%2A",
            "@multimediatype": "Scalable Vector Graphics file",
            "@type": "ALTIMG",
            "@size": "21961",
            "@ref": "si163",
            "@mimetype": "image/svg+xml"
        },
        {
            "@category": "thumbnail",
            "@_fa": "true",
            "$": "https://api.elsevier.com/content/object/eid/1-s2.0-S0378778821005028-si164.svg?httpAccept=%2A%2F%2A",
            "@multimediatype": "Scalable Vector Graphics file",
            "@type": "ALTIMG",
            "@size": "9029",
            "@ref": "si164",
            "@mimetype": "image/svg+xml"
        },
        {
            "@category": "thumbnail",
            "@_fa": "true",
            "$": "https://api.elsevier.com/content/object/eid/1-s2.0-S0378778821005028-si165.svg?httpAccept=%2A%2F%2A",
            "@multimediatype": "Scalable Vector Graphics file",
            "@type": "ALTIMG",
            "@size": "5335",
            "@ref": "si165",
            "@mimetype": "image/svg+xml"
        },
        {
            "@category": "thumbnail",
            "@_fa": "true",
            "$": "https://api.elsevier.com/content/object/eid/1-s2.0-S0378778821005028-si166.svg?httpAccept=%2A%2F%2A",
            "@multimediatype": "Scalable Vector Graphics file",
            "@type": "ALTIMG",
            "@size": "8054",
            "@ref": "si166",
            "@mimetype": "image/svg+xml"
        },
        {
            "@category": "thumbnail",
            "@_fa": "true",
            "$": "https://api.elsevier.com/content/object/eid/1-s2.0-S0378778821005028-si167.svg?httpAccept=%2A%2F%2A",
            "@multimediatype": "Scalable Vector Graphics file",
            "@type": "ALTIMG",
            "@size": "9029",
            "@ref": "si167",
            "@mimetype": "image/svg+xml"
        },
        {
            "@category": "thumbnail",
            "@_fa": "true",
            "$": "https://api.elsevier.com/content/object/eid/1-s2.0-S0378778821005028-si168.svg?httpAccept=%2A%2F%2A",
            "@multimediatype": "Scalable Vector Graphics file",
            "@type": "ALTIMG",
            "@size": "4141",
            "@ref": "si168",
            "@mimetype": "image/svg+xml"
        },
        {
            "@category": "thumbnail",
            "@_fa": "true",
            "$": "https://api.elsevier.com/content/object/eid/1-s2.0-S0378778821005028-si169.svg?httpAccept=%2A%2F%2A",
            "@multimediatype": "Scalable Vector Graphics file",
            "@type": "ALTIMG",
            "@size": "1345",
            "@ref": "si169",
            "@mimetype": "image/svg+xml"
        },
        {
            "@category": "thumbnail",
            "@_fa": "true",
            "$": "https://api.elsevier.com/content/object/eid/1-s2.0-S0378778821005028-si17.svg?httpAccept=%2A%2F%2A",
            "@multimediatype": "Scalable Vector Graphics file",
            "@type": "ALTIMG",
            "@size": "7172",
            "@ref": "si17",
            "@mimetype": "image/svg+xml"
        },
        {
            "@category": "thumbnail",
            "@_fa": "true",
            "$": "https://api.elsevier.com/content/object/eid/1-s2.0-S0378778821005028-si170.svg?httpAccept=%2A%2F%2A",
            "@multimediatype": "Scalable Vector Graphics file",
            "@type": "ALTIMG",
            "@size": "2905",
            "@ref": "si170",
            "@mimetype": "image/svg+xml"
        },
        {
            "@category": "thumbnail",
            "@_fa": "true",
            "$": "https://api.elsevier.com/content/object/eid/1-s2.0-S0378778821005028-si171.svg?httpAccept=%2A%2F%2A",
            "@multimediatype": "Scalable Vector Graphics file",
            "@type": "ALTIMG",
            "@size": "3006",
            "@ref": "si171",
            "@mimetype": "image/svg+xml"
        },
        {
            "@category": "thumbnail",
            "@_fa": "true",
            "$": "https://api.elsevier.com/content/object/eid/1-s2.0-S0378778821005028-si172.svg?httpAccept=%2A%2F%2A",
            "@multimediatype": "Scalable Vector Graphics file",
            "@type": "ALTIMG",
            "@size": "3094",
            "@ref": "si172",
            "@mimetype": "image/svg+xml"
        },
        {
            "@category": "thumbnail",
            "@_fa": "true",
            "$": "https://api.elsevier.com/content/object/eid/1-s2.0-S0378778821005028-si173.svg?httpAccept=%2A%2F%2A",
            "@multimediatype": "Scalable Vector Graphics file",
            "@type": "ALTIMG",
            "@size": "34428",
            "@ref": "si173",
            "@mimetype": "image/svg+xml"
        },
        {
            "@category": "thumbnail",
            "@_fa": "true",
            "$": "https://api.elsevier.com/content/object/eid/1-s2.0-S0378778821005028-si174.svg?httpAccept=%2A%2F%2A",
            "@multimediatype": "Scalable Vector Graphics file",
            "@type": "ALTIMG",
            "@size": "9580",
            "@ref": "si174",
            "@mimetype": "image/svg+xml"
        },
        {
            "@category": "thumbnail",
            "@_fa": "true",
            "$": "https://api.elsevier.com/content/object/eid/1-s2.0-S0378778821005028-si175.svg?httpAccept=%2A%2F%2A",
            "@multimediatype": "Scalable Vector Graphics file",
            "@type": "ALTIMG",
            "@size": "1972",
            "@ref": "si175",
            "@mimetype": "image/svg+xml"
        },
        {
            "@category": "thumbnail",
            "@_fa": "true",
            "$": "https://api.elsevier.com/content/object/eid/1-s2.0-S0378778821005028-si176.svg?httpAccept=%2A%2F%2A",
            "@multimediatype": "Scalable Vector Graphics file",
            "@type": "ALTIMG",
            "@size": "3050",
            "@ref": "si176",
            "@mimetype": "image/svg+xml"
        },
        {
            "@category": "thumbnail",
            "@_fa": "true",
            "$": "https://api.elsevier.com/content/object/eid/1-s2.0-S0378778821005028-si177.svg?httpAccept=%2A%2F%2A",
            "@multimediatype": "Scalable Vector Graphics file",
            "@type": "ALTIMG",
            "@size": "3994",
            "@ref": "si177",
            "@mimetype": "image/svg+xml"
        },
        {
            "@category": "thumbnail",
            "@_fa": "true",
            "$": "https://api.elsevier.com/content/object/eid/1-s2.0-S0378778821005028-si178.svg?httpAccept=%2A%2F%2A",
            "@multimediatype": "Scalable Vector Graphics file",
            "@type": "ALTIMG",
            "@size": "3421",
            "@ref": "si178",
            "@mimetype": "image/svg+xml"
        },
        {
            "@category": "thumbnail",
            "@_fa": "true",
            "$": "https://api.elsevier.com/content/object/eid/1-s2.0-S0378778821005028-si18.svg?httpAccept=%2A%2F%2A",
            "@multimediatype": "Scalable Vector Graphics file",
            "@type": "ALTIMG",
            "@size": "4843",
            "@ref": "si18",
            "@mimetype": "image/svg+xml"
        },
        {
            "@category": "thumbnail",
            "@_fa": "true",
            "$": "https://api.elsevier.com/content/object/eid/1-s2.0-S0378778821005028-si19.svg?httpAccept=%2A%2F%2A",
            "@multimediatype": "Scalable Vector Graphics file",
            "@type": "ALTIMG",
            "@size": "4925",
            "@ref": "si19",
            "@mimetype": "image/svg+xml"
        },
        {
            "@category": "thumbnail",
            "@_fa": "true",
            "$": "https://api.elsevier.com/content/object/eid/1-s2.0-S0378778821005028-si2.svg?httpAccept=%2A%2F%2A",
            "@multimediatype": "Scalable Vector Graphics file",
            "@type": "ALTIMG",
            "@size": "2593",
            "@ref": "si2",
            "@mimetype": "image/svg+xml"
        },
        {
            "@category": "thumbnail",
            "@_fa": "true",
            "$": "https://api.elsevier.com/content/object/eid/1-s2.0-S0378778821005028-si20.svg?httpAccept=%2A%2F%2A",
            "@multimediatype": "Scalable Vector Graphics file",
            "@type": "ALTIMG",
            "@size": "6600",
            "@ref": "si20",
            "@mimetype": "image/svg+xml"
        },
        {
            "@category": "thumbnail",
            "@_fa": "true",
            "$": "https://api.elsevier.com/content/object/eid/1-s2.0-S0378778821005028-si21.svg?httpAccept=%2A%2F%2A",
            "@multimediatype": "Scalable Vector Graphics file",
            "@type": "ALTIMG",
            "@size": "7562",
            "@ref": "si21",
            "@mimetype": "image/svg+xml"
        },
        {
            "@category": "thumbnail",
            "@_fa": "true",
            "$": "https://api.elsevier.com/content/object/eid/1-s2.0-S0378778821005028-si22.svg?httpAccept=%2A%2F%2A",
            "@multimediatype": "Scalable Vector Graphics file",
            "@type": "ALTIMG",
            "@size": "7624",
            "@ref": "si22",
            "@mimetype": "image/svg+xml"
        },
        {
            "@category": "thumbnail",
            "@_fa": "true",
            "$": "https://api.elsevier.com/content/object/eid/1-s2.0-S0378778821005028-si23.svg?httpAccept=%2A%2F%2A",
            "@multimediatype": "Scalable Vector Graphics file",
            "@type": "ALTIMG",
            "@size": "6414",
            "@ref": "si23",
            "@mimetype": "image/svg+xml"
        },
        {
            "@category": "thumbnail",
            "@_fa": "true",
            "$": "https://api.elsevier.com/content/object/eid/1-s2.0-S0378778821005028-si24.svg?httpAccept=%2A%2F%2A",
            "@multimediatype": "Scalable Vector Graphics file",
            "@type": "ALTIMG",
            "@size": "6604",
            "@ref": "si24",
            "@mimetype": "image/svg+xml"
        },
        {
            "@category": "thumbnail",
            "@_fa": "true",
            "$": "https://api.elsevier.com/content/object/eid/1-s2.0-S0378778821005028-si25.svg?httpAccept=%2A%2F%2A",
            "@multimediatype": "Scalable Vector Graphics file",
            "@type": "ALTIMG",
            "@size": "5139",
            "@ref": "si25",
            "@mimetype": "image/svg+xml"
        },
        {
            "@category": "thumbnail",
            "@_fa": "true",
            "$": "https://api.elsevier.com/content/object/eid/1-s2.0-S0378778821005028-si26.svg?httpAccept=%2A%2F%2A",
            "@multimediatype": "Scalable Vector Graphics file",
            "@type": "ALTIMG",
            "@size": "4742",
            "@ref": "si26",
            "@mimetype": "image/svg+xml"
        },
        {
            "@category": "thumbnail",
            "@_fa": "true",
            "$": "https://api.elsevier.com/content/object/eid/1-s2.0-S0378778821005028-si27.svg?httpAccept=%2A%2F%2A",
            "@multimediatype": "Scalable Vector Graphics file",
            "@type": "ALTIMG",
            "@size": "8762",
            "@ref": "si27",
            "@mimetype": "image/svg+xml"
        },
        {
            "@category": "thumbnail",
            "@_fa": "true",
            "$": "https://api.elsevier.com/content/object/eid/1-s2.0-S0378778821005028-si28.svg?httpAccept=%2A%2F%2A",
            "@multimediatype": "Scalable Vector Graphics file",
            "@type": "ALTIMG",
            "@size": "7258",
            "@ref": "si28",
            "@mimetype": "image/svg+xml"
        },
        {
            "@category": "thumbnail",
            "@_fa": "true",
            "$": "https://api.elsevier.com/content/object/eid/1-s2.0-S0378778821005028-si29.svg?httpAccept=%2A%2F%2A",
            "@multimediatype": "Scalable Vector Graphics file",
            "@type": "ALTIMG",
            "@size": "6016",
            "@ref": "si29",
            "@mimetype": "image/svg+xml"
        },
        {
            "@category": "thumbnail",
            "@_fa": "true",
            "$": "https://api.elsevier.com/content/object/eid/1-s2.0-S0378778821005028-si3.svg?httpAccept=%2A%2F%2A",
            "@multimediatype": "Scalable Vector Graphics file",
            "@type": "ALTIMG",
            "@size": "2661",
            "@ref": "si3",
            "@mimetype": "image/svg+xml"
        },
        {
            "@category": "thumbnail",
            "@_fa": "true",
            "$": "https://api.elsevier.com/content/object/eid/1-s2.0-S0378778821005028-si30.svg?httpAccept=%2A%2F%2A",
            "@multimediatype": "Scalable Vector Graphics file",
            "@type": "ALTIMG",
            "@size": "6128",
            "@ref": "si30",
            "@mimetype": "image/svg+xml"
        },
        {
            "@category": "thumbnail",
            "@_fa": "true",
            "$": "https://api.elsevier.com/content/object/eid/1-s2.0-S0378778821005028-si31.svg?httpAccept=%2A%2F%2A",
            "@multimediatype": "Scalable Vector Graphics file",
            "@type": "ALTIMG",
            "@size": "6692",
            "@ref": "si31",
            "@mimetype": "image/svg+xml"
        },
        {
            "@category": "thumbnail",
            "@_fa": "true",
            "$": "https://api.elsevier.com/content/object/eid/1-s2.0-S0378778821005028-si32.svg?httpAccept=%2A%2F%2A",
            "@multimediatype": "Scalable Vector Graphics file",
            "@type": "ALTIMG",
            "@size": "6428",
            "@ref": "si32",
            "@mimetype": "image/svg+xml"
        },
        {
            "@category": "thumbnail",
            "@_fa": "true",
            "$": "https://api.elsevier.com/content/object/eid/1-s2.0-S0378778821005028-si33.svg?httpAccept=%2A%2F%2A",
            "@multimediatype": "Scalable Vector Graphics file",
            "@type": "ALTIMG",
            "@size": "4925",
            "@ref": "si33",
            "@mimetype": "image/svg+xml"
        },
        {
            "@category": "thumbnail",
            "@_fa": "true",
            "$": "https://api.elsevier.com/content/object/eid/1-s2.0-S0378778821005028-si34.svg?httpAccept=%2A%2F%2A",
            "@multimediatype": "Scalable Vector Graphics file",
            "@type": "ALTIMG",
            "@size": "6575",
            "@ref": "si34",
            "@mimetype": "image/svg+xml"
        },
        {
            "@category": "thumbnail",
            "@_fa": "true",
            "$": "https://api.elsevier.com/content/object/eid/1-s2.0-S0378778821005028-si35.svg?httpAccept=%2A%2F%2A",
            "@multimediatype": "Scalable Vector Graphics file",
            "@type": "ALTIMG",
            "@size": "6532",
            "@ref": "si35",
            "@mimetype": "image/svg+xml"
        },
        {
            "@category": "thumbnail",
            "@_fa": "true",
            "$": "https://api.elsevier.com/content/object/eid/1-s2.0-S0378778821005028-si36.svg?httpAccept=%2A%2F%2A",
            "@multimediatype": "Scalable Vector Graphics file",
            "@type": "ALTIMG",
            "@size": "8377",
            "@ref": "si36",
            "@mimetype": "image/svg+xml"
        },
        {
            "@category": "thumbnail",
            "@_fa": "true",
            "$": "https://api.elsevier.com/content/object/eid/1-s2.0-S0378778821005028-si37.svg?httpAccept=%2A%2F%2A",
            "@multimediatype": "Scalable Vector Graphics file",
            "@type": "ALTIMG",
            "@size": "7064",
            "@ref": "si37",
            "@mimetype": "image/svg+xml"
        },
        {
            "@category": "thumbnail",
            "@_fa": "true",
            "$": "https://api.elsevier.com/content/object/eid/1-s2.0-S0378778821005028-si38.svg?httpAccept=%2A%2F%2A",
            "@multimediatype": "Scalable Vector Graphics file",
            "@type": "ALTIMG",
            "@size": "6814",
            "@ref": "si38",
            "@mimetype": "image/svg+xml"
        },
        {
            "@category": "thumbnail",
            "@_fa": "true",
            "$": "https://api.elsevier.com/content/object/eid/1-s2.0-S0378778821005028-si39.svg?httpAccept=%2A%2F%2A",
            "@multimediatype": "Scalable Vector Graphics file",
            "@type": "ALTIMG",
            "@size": "6729",
            "@ref": "si39",
            "@mimetype": "image/svg+xml"
        },
        {
            "@category": "thumbnail",
            "@_fa": "true",
            "$": "https://api.elsevier.com/content/object/eid/1-s2.0-S0378778821005028-si4.svg?httpAccept=%2A%2F%2A",
            "@multimediatype": "Scalable Vector Graphics file",
            "@type": "ALTIMG",
            "@size": "2101",
            "@ref": "si4",
            "@mimetype": "image/svg+xml"
        },
        {
            "@category": "thumbnail",
            "@_fa": "true",
            "$": "https://api.elsevier.com/content/object/eid/1-s2.0-S0378778821005028-si40.svg?httpAccept=%2A%2F%2A",
            "@multimediatype": "Scalable Vector Graphics file",
            "@type": "ALTIMG",
            "@size": "4742",
            "@ref": "si40",
            "@mimetype": "image/svg+xml"
        },
        {
            "@category": "thumbnail",
            "@_fa": "true",
            "$": "https://api.elsevier.com/content/object/eid/1-s2.0-S0378778821005028-si41.svg?httpAccept=%2A%2F%2A",
            "@multimediatype": "Scalable Vector Graphics file",
            "@type": "ALTIMG",
            "@size": "6136",
            "@ref": "si41",
            "@mimetype": "image/svg+xml"
        },
        {
            "@category": "thumbnail",
            "@_fa": "true",
            "$": "https://api.elsevier.com/content/object/eid/1-s2.0-S0378778821005028-si42.svg?httpAccept=%2A%2F%2A",
            "@multimediatype": "Scalable Vector Graphics file",
            "@type": "ALTIMG",
            "@size": "7210",
            "@ref": "si42",
            "@mimetype": "image/svg+xml"
        },
        {
            "@category": "thumbnail",
            "@_fa": "true",
            "$": "https://api.elsevier.com/content/object/eid/1-s2.0-S0378778821005028-si43.svg?httpAccept=%2A%2F%2A",
            "@multimediatype": "Scalable Vector Graphics file",
            "@type": "ALTIMG",
            "@size": "7315",
            "@ref": "si43",
            "@mimetype": "image/svg+xml"
        },
        {
            "@category": "thumbnail",
            "@_fa": "true",
            "$": "https://api.elsevier.com/content/object/eid/1-s2.0-S0378778821005028-si44.svg?httpAccept=%2A%2F%2A",
            "@multimediatype": "Scalable Vector Graphics file",
            "@type": "ALTIMG",
            "@size": "7945",
            "@ref": "si44",
            "@mimetype": "image/svg+xml"
        },
        {
            "@category": "thumbnail",
            "@_fa": "true",
            "$": "https://api.elsevier.com/content/object/eid/1-s2.0-S0378778821005028-si45.svg?httpAccept=%2A%2F%2A",
            "@multimediatype": "Scalable Vector Graphics file",
            "@type": "ALTIMG",
            "@size": "7714",
            "@ref": "si45",
            "@mimetype": "image/svg+xml"
        },
        {
            "@category": "thumbnail",
            "@_fa": "true",
            "$": "https://api.elsevier.com/content/object/eid/1-s2.0-S0378778821005028-si46.svg?httpAccept=%2A%2F%2A",
            "@multimediatype": "Scalable Vector Graphics file",
            "@type": "ALTIMG",
            "@size": "4364",
            "@ref": "si46",
            "@mimetype": "image/svg+xml"
        },
        {
            "@category": "thumbnail",
            "@_fa": "true",
            "$": "https://api.elsevier.com/content/object/eid/1-s2.0-S0378778821005028-si47.svg?httpAccept=%2A%2F%2A",
            "@multimediatype": "Scalable Vector Graphics file",
            "@type": "ALTIMG",
            "@size": "5192",
            "@ref": "si47",
            "@mimetype": "image/svg+xml"
        },
        {
            "@category": "thumbnail",
            "@_fa": "true",
            "$": "https://api.elsevier.com/content/object/eid/1-s2.0-S0378778821005028-si48.svg?httpAccept=%2A%2F%2A",
            "@multimediatype": "Scalable Vector Graphics file",
            "@type": "ALTIMG",
            "@size": "6713",
            "@ref": "si48",
            "@mimetype": "image/svg+xml"
        },
        {
            "@category": "thumbnail",
            "@_fa": "true",
            "$": "https://api.elsevier.com/content/object/eid/1-s2.0-S0378778821005028-si49.svg?httpAccept=%2A%2F%2A",
            "@multimediatype": "Scalable Vector Graphics file",
            "@type": "ALTIMG",
            "@size": "6206",
            "@ref": "si49",
            "@mimetype": "image/svg+xml"
        },
        {
            "@category": "thumbnail",
            "@_fa": "true",
            "$": "https://api.elsevier.com/content/object/eid/1-s2.0-S0378778821005028-si5.svg?httpAccept=%2A%2F%2A",
            "@multimediatype": "Scalable Vector Graphics file",
            "@type": "ALTIMG",
            "@size": "2967",
            "@ref": "si5",
            "@mimetype": "image/svg+xml"
        },
        {
            "@category": "thumbnail",
            "@_fa": "true",
            "$": "https://api.elsevier.com/content/object/eid/1-s2.0-S0378778821005028-si50.svg?httpAccept=%2A%2F%2A",
            "@multimediatype": "Scalable Vector Graphics file",
            "@type": "ALTIMG",
            "@size": "7342",
            "@ref": "si50",
            "@mimetype": "image/svg+xml"
        },
        {
            "@category": "thumbnail",
            "@_fa": "true",
            "$": "https://api.elsevier.com/content/object/eid/1-s2.0-S0378778821005028-si51.svg?httpAccept=%2A%2F%2A",
            "@multimediatype": "Scalable Vector Graphics file",
            "@type": "ALTIMG",
            "@size": "7364",
            "@ref": "si51",
            "@mimetype": "image/svg+xml"
        },
        {
            "@category": "thumbnail",
            "@_fa": "true",
            "$": "https://api.elsevier.com/content/object/eid/1-s2.0-S0378778821005028-si52.svg?httpAccept=%2A%2F%2A",
            "@multimediatype": "Scalable Vector Graphics file",
            "@type": "ALTIMG",
            "@size": "7013",
            "@ref": "si52",
            "@mimetype": "image/svg+xml"
        },
        {
            "@category": "thumbnail",
            "@_fa": "true",
            "$": "https://api.elsevier.com/content/object/eid/1-s2.0-S0378778821005028-si53.svg?httpAccept=%2A%2F%2A",
            "@multimediatype": "Scalable Vector Graphics file",
            "@type": "ALTIMG",
            "@size": "11915",
            "@ref": "si53",
            "@mimetype": "image/svg+xml"
        },
        {
            "@category": "thumbnail",
            "@_fa": "true",
            "$": "https://api.elsevier.com/content/object/eid/1-s2.0-S0378778821005028-si54.svg?httpAccept=%2A%2F%2A",
            "@multimediatype": "Scalable Vector Graphics file",
            "@type": "ALTIMG",
            "@size": "2572",
            "@ref": "si54",
            "@mimetype": "image/svg+xml"
        },
        {
            "@category": "thumbnail",
            "@_fa": "true",
            "$": "https://api.elsevier.com/content/object/eid/1-s2.0-S0378778821005028-si55.svg?httpAccept=%2A%2F%2A",
            "@multimediatype": "Scalable Vector Graphics file",
            "@type": "ALTIMG",
            "@size": "5354",
            "@ref": "si55",
            "@mimetype": "image/svg+xml"
        },
        {
            "@category": "thumbnail",
            "@_fa": "true",
            "$": "https://api.elsevier.com/content/object/eid/1-s2.0-S0378778821005028-si56.svg?httpAccept=%2A%2F%2A",
            "@multimediatype": "Scalable Vector Graphics file",
            "@type": "ALTIMG",
            "@size": "10080",
            "@ref": "si56",
            "@mimetype": "image/svg+xml"
        },
        {
            "@category": "thumbnail",
            "@_fa": "true",
            "$": "https://api.elsevier.com/content/object/eid/1-s2.0-S0378778821005028-si57.svg?httpAccept=%2A%2F%2A",
            "@multimediatype": "Scalable Vector Graphics file",
            "@type": "ALTIMG",
            "@size": "5110",
            "@ref": "si57",
            "@mimetype": "image/svg+xml"
        },
        {
            "@category": "thumbnail",
            "@_fa": "true",
            "$": "https://api.elsevier.com/content/object/eid/1-s2.0-S0378778821005028-si58.svg?httpAccept=%2A%2F%2A",
            "@multimediatype": "Scalable Vector Graphics file",
            "@type": "ALTIMG",
            "@size": "9838",
            "@ref": "si58",
            "@mimetype": "image/svg+xml"
        },
        {
            "@category": "thumbnail",
            "@_fa": "true",
            "$": "https://api.elsevier.com/content/object/eid/1-s2.0-S0378778821005028-si59.svg?httpAccept=%2A%2F%2A",
            "@multimediatype": "Scalable Vector Graphics file",
            "@type": "ALTIMG",
            "@size": "3994",
            "@ref": "si59",
            "@mimetype": "image/svg+xml"
        },
        {
            "@category": "thumbnail",
            "@_fa": "true",
            "$": "https://api.elsevier.com/content/object/eid/1-s2.0-S0378778821005028-si6.svg?httpAccept=%2A%2F%2A",
            "@multimediatype": "Scalable Vector Graphics file",
            "@type": "ALTIMG",
            "@size": "2600",
            "@ref": "si6",
            "@mimetype": "image/svg+xml"
        },
        {
            "@category": "thumbnail",
            "@_fa": "true",
            "$": "https://api.elsevier.com/content/object/eid/1-s2.0-S0378778821005028-si60.svg?httpAccept=%2A%2F%2A",
            "@multimediatype": "Scalable Vector Graphics file",
            "@type": "ALTIMG",
            "@size": "3994",
            "@ref": "si60",
            "@mimetype": "image/svg+xml"
        },
        {
            "@category": "thumbnail",
            "@_fa": "true",
            "$": "https://api.elsevier.com/content/object/eid/1-s2.0-S0378778821005028-si61.svg?httpAccept=%2A%2F%2A",
            "@multimediatype": "Scalable Vector Graphics file",
            "@type": "ALTIMG",
            "@size": "3994",
            "@ref": "si61",
            "@mimetype": "image/svg+xml"
        },
        {
            "@category": "thumbnail",
            "@_fa": "true",
            "$": "https://api.elsevier.com/content/object/eid/1-s2.0-S0378778821005028-si62.svg?httpAccept=%2A%2F%2A",
            "@multimediatype": "Scalable Vector Graphics file",
            "@type": "ALTIMG",
            "@size": "1345",
            "@ref": "si62",
            "@mimetype": "image/svg+xml"
        },
        {
            "@category": "thumbnail",
            "@_fa": "true",
            "$": "https://api.elsevier.com/content/object/eid/1-s2.0-S0378778821005028-si63.svg?httpAccept=%2A%2F%2A",
            "@multimediatype": "Scalable Vector Graphics file",
            "@type": "ALTIMG",
            "@size": "1240",
            "@ref": "si63",
            "@mimetype": "image/svg+xml"
        },
        {
            "@category": "thumbnail",
            "@_fa": "true",
            "$": "https://api.elsevier.com/content/object/eid/1-s2.0-S0378778821005028-si64.svg?httpAccept=%2A%2F%2A",
            "@multimediatype": "Scalable Vector Graphics file",
            "@type": "ALTIMG",
            "@size": "1170",
            "@ref": "si64",
            "@mimetype": "image/svg+xml"
        },
        {
            "@category": "thumbnail",
            "@_fa": "true",
            "$": "https://api.elsevier.com/content/object/eid/1-s2.0-S0378778821005028-si65.svg?httpAccept=%2A%2F%2A",
            "@multimediatype": "Scalable Vector Graphics file",
            "@type": "ALTIMG",
            "@size": "6122",
            "@ref": "si65",
            "@mimetype": "image/svg+xml"
        },
        {
            "@category": "thumbnail",
            "@_fa": "true",
            "$": "https://api.elsevier.com/content/object/eid/1-s2.0-S0378778821005028-si66.svg?httpAccept=%2A%2F%2A",
            "@multimediatype": "Scalable Vector Graphics file",
            "@type": "ALTIMG",
            "@size": "7754",
            "@ref": "si66",
            "@mimetype": "image/svg+xml"
        },
        {
            "@category": "thumbnail",
            "@_fa": "true",
            "$": "https://api.elsevier.com/content/object/eid/1-s2.0-S0378778821005028-si67.svg?httpAccept=%2A%2F%2A",
            "@multimediatype": "Scalable Vector Graphics file",
            "@type": "ALTIMG",
            "@size": "2682",
            "@ref": "si67",
            "@mimetype": "image/svg+xml"
        },
        {
            "@category": "thumbnail",
            "@_fa": "true",
            "$": "https://api.elsevier.com/content/object/eid/1-s2.0-S0378778821005028-si68.svg?httpAccept=%2A%2F%2A",
            "@multimediatype": "Scalable Vector Graphics file",
            "@type": "ALTIMG",
            "@size": "2682",
            "@ref": "si68",
            "@mimetype": "image/svg+xml"
        },
        {
            "@category": "thumbnail",
            "@_fa": "true",
            "$": "https://api.elsevier.com/content/object/eid/1-s2.0-S0378778821005028-si69.svg?httpAccept=%2A%2F%2A",
            "@multimediatype": "Scalable Vector Graphics file",
            "@type": "ALTIMG",
            "@size": "2224",
            "@ref": "si69",
            "@mimetype": "image/svg+xml"
        },
        {
            "@category": "thumbnail",
            "@_fa": "true",
            "$": "https://api.elsevier.com/content/object/eid/1-s2.0-S0378778821005028-si7.svg?httpAccept=%2A%2F%2A",
            "@multimediatype": "Scalable Vector Graphics file",
            "@type": "ALTIMG",
            "@size": "6108",
            "@ref": "si7",
            "@mimetype": "image/svg+xml"
        },
        {
            "@category": "thumbnail",
            "@_fa": "true",
            "$": "https://api.elsevier.com/content/object/eid/1-s2.0-S0378778821005028-si70.svg?httpAccept=%2A%2F%2A",
            "@multimediatype": "Scalable Vector Graphics file",
            "@type": "ALTIMG",
            "@size": "2224",
            "@ref": "si70",
            "@mimetype": "image/svg+xml"
        },
        {
            "@category": "thumbnail",
            "@_fa": "true",
            "$": "https://api.elsevier.com/content/object/eid/1-s2.0-S0378778821005028-si71.svg?httpAccept=%2A%2F%2A",
            "@multimediatype": "Scalable Vector Graphics file",
            "@type": "ALTIMG",
            "@size": "2224",
            "@ref": "si71",
            "@mimetype": "image/svg+xml"
        },
        {
            "@category": "thumbnail",
            "@_fa": "true",
            "$": "https://api.elsevier.com/content/object/eid/1-s2.0-S0378778821005028-si72.svg?httpAccept=%2A%2F%2A",
            "@multimediatype": "Scalable Vector Graphics file",
            "@type": "ALTIMG",
            "@size": "2224",
            "@ref": "si72",
            "@mimetype": "image/svg+xml"
        },
        {
            "@category": "thumbnail",
            "@_fa": "true",
            "$": "https://api.elsevier.com/content/object/eid/1-s2.0-S0378778821005028-si73.svg?httpAccept=%2A%2F%2A",
            "@multimediatype": "Scalable Vector Graphics file",
            "@type": "ALTIMG",
            "@size": "2224",
            "@ref": "si73",
            "@mimetype": "image/svg+xml"
        },
        {
            "@category": "thumbnail",
            "@_fa": "true",
            "$": "https://api.elsevier.com/content/object/eid/1-s2.0-S0378778821005028-si74.svg?httpAccept=%2A%2F%2A",
            "@multimediatype": "Scalable Vector Graphics file",
            "@type": "ALTIMG",
            "@size": "2905",
            "@ref": "si74",
            "@mimetype": "image/svg+xml"
        },
        {
            "@category": "thumbnail",
            "@_fa": "true",
            "$": "https://api.elsevier.com/content/object/eid/1-s2.0-S0378778821005028-si75.svg?httpAccept=%2A%2F%2A",
            "@multimediatype": "Scalable Vector Graphics file",
            "@type": "ALTIMG",
            "@size": "2081",
            "@ref": "si75",
            "@mimetype": "image/svg+xml"
        },
        {
            "@category": "thumbnail",
            "@_fa": "true",
            "$": "https://api.elsevier.com/content/object/eid/1-s2.0-S0378778821005028-si76.svg?httpAccept=%2A%2F%2A",
            "@multimediatype": "Scalable Vector Graphics file",
            "@type": "ALTIMG",
            "@size": "2081",
            "@ref": "si76",
            "@mimetype": "image/svg+xml"
        },
        {
            "@category": "thumbnail",
            "@_fa": "true",
            "$": "https://api.elsevier.com/content/object/eid/1-s2.0-S0378778821005028-si77.svg?httpAccept=%2A%2F%2A",
            "@multimediatype": "Scalable Vector Graphics file",
            "@type": "ALTIMG",
            "@size": "2081",
            "@ref": "si77",
            "@mimetype": "image/svg+xml"
        },
        {
            "@category": "thumbnail",
            "@_fa": "true",
            "$": "https://api.elsevier.com/content/object/eid/1-s2.0-S0378778821005028-si78.svg?httpAccept=%2A%2F%2A",
            "@multimediatype": "Scalable Vector Graphics file",
            "@type": "ALTIMG",
            "@size": "2081",
            "@ref": "si78",
            "@mimetype": "image/svg+xml"
        },
        {
            "@category": "thumbnail",
            "@_fa": "true",
            "$": "https://api.elsevier.com/content/object/eid/1-s2.0-S0378778821005028-si79.svg?httpAccept=%2A%2F%2A",
            "@multimediatype": "Scalable Vector Graphics file",
            "@type": "ALTIMG",
            "@size": "2081",
            "@ref": "si79",
            "@mimetype": "image/svg+xml"
        },
        {
            "@category": "thumbnail",
            "@_fa": "true",
            "$": "https://api.elsevier.com/content/object/eid/1-s2.0-S0378778821005028-si8.svg?httpAccept=%2A%2F%2A",
            "@multimediatype": "Scalable Vector Graphics file",
            "@type": "ALTIMG",
            "@size": "1601",
            "@ref": "si8",
            "@mimetype": "image/svg+xml"
        },
        {
            "@category": "thumbnail",
            "@_fa": "true",
            "$": "https://api.elsevier.com/content/object/eid/1-s2.0-S0378778821005028-si80.svg?httpAccept=%2A%2F%2A",
            "@multimediatype": "Scalable Vector Graphics file",
            "@type": "ALTIMG",
            "@size": "3006",
            "@ref": "si80",
            "@mimetype": "image/svg+xml"
        },
        {
            "@category": "thumbnail",
            "@_fa": "true",
            "$": "https://api.elsevier.com/content/object/eid/1-s2.0-S0378778821005028-si81.svg?httpAccept=%2A%2F%2A",
            "@multimediatype": "Scalable Vector Graphics file",
            "@type": "ALTIMG",
            "@size": "2842",
            "@ref": "si81",
            "@mimetype": "image/svg+xml"
        },
        {
            "@category": "thumbnail",
            "@_fa": "true",
            "$": "https://api.elsevier.com/content/object/eid/1-s2.0-S0378778821005028-si82.svg?httpAccept=%2A%2F%2A",
            "@multimediatype": "Scalable Vector Graphics file",
            "@type": "ALTIMG",
            "@size": "6098",
            "@ref": "si82",
            "@mimetype": "image/svg+xml"
        },
        {
            "@category": "thumbnail",
            "@_fa": "true",
            "$": "https://api.elsevier.com/content/object/eid/1-s2.0-S0378778821005028-si83.svg?httpAccept=%2A%2F%2A",
            "@multimediatype": "Scalable Vector Graphics file",
            "@type": "ALTIMG",
            "@size": "6171",
            "@ref": "si83",
            "@mimetype": "image/svg+xml"
        },
        {
            "@category": "thumbnail",
            "@_fa": "true",
            "$": "https://api.elsevier.com/content/object/eid/1-s2.0-S0378778821005028-si84.svg?httpAccept=%2A%2F%2A",
            "@multimediatype": "Scalable Vector Graphics file",
            "@type": "ALTIMG",
            "@size": "6171",
            "@ref": "si84",
            "@mimetype": "image/svg+xml"
        },
        {
            "@category": "thumbnail",
            "@_fa": "true",
            "$": "https://api.elsevier.com/content/object/eid/1-s2.0-S0378778821005028-si85.svg?httpAccept=%2A%2F%2A",
            "@multimediatype": "Scalable Vector Graphics file",
            "@type": "ALTIMG",
            "@size": "8138",
            "@ref": "si85",
            "@mimetype": "image/svg+xml"
        },
        {
            "@category": "thumbnail",
            "@_fa": "true",
            "$": "https://api.elsevier.com/content/object/eid/1-s2.0-S0378778821005028-si86.svg?httpAccept=%2A%2F%2A",
            "@multimediatype": "Scalable Vector Graphics file",
            "@type": "ALTIMG",
            "@size": "3006",
            "@ref": "si86",
            "@mimetype": "image/svg+xml"
        },
        {
            "@category": "thumbnail",
            "@_fa": "true",
            "$": "https://api.elsevier.com/content/object/eid/1-s2.0-S0378778821005028-si87.svg?httpAccept=%2A%2F%2A",
            "@multimediatype": "Scalable Vector Graphics file",
            "@type": "ALTIMG",
            "@size": "2905",
            "@ref": "si87",
            "@mimetype": "image/svg+xml"
        },
        {
            "@category": "thumbnail",
            "@_fa": "true",
            "$": "https://api.elsevier.com/content/object/eid/1-s2.0-S0378778821005028-si88.svg?httpAccept=%2A%2F%2A",
            "@multimediatype": "Scalable Vector Graphics file",
            "@type": "ALTIMG",
            "@size": "1345",
            "@ref": "si88",
            "@mimetype": "image/svg+xml"
        },
        {
            "@category": "thumbnail",
            "@_fa": "true",
            "$": "https://api.elsevier.com/content/object/eid/1-s2.0-S0378778821005028-si89.svg?httpAccept=%2A%2F%2A",
            "@multimediatype": "Scalable Vector Graphics file",
            "@type": "ALTIMG",
            "@size": "7735",
            "@ref": "si89",
            "@mimetype": "image/svg+xml"
        },
        {
            "@category": "thumbnail",
            "@_fa": "true",
            "$": "https://api.elsevier.com/content/object/eid/1-s2.0-S0378778821005028-si9.svg?httpAccept=%2A%2F%2A",
            "@multimediatype": "Scalable Vector Graphics file",
            "@type": "ALTIMG",
            "@size": "1345",
            "@ref": "si9",
            "@mimetype": "image/svg+xml"
        },
        {
            "@category": "thumbnail",
            "@_fa": "true",
            "$": "https://api.elsevier.com/content/object/eid/1-s2.0-S0378778821005028-si90.svg?httpAccept=%2A%2F%2A",
            "@multimediatype": "Scalable Vector Graphics file",
            "@type": "ALTIMG",
            "@size": "6187",
            "@ref": "si90",
            "@mimetype": "image/svg+xml"
        },
        {
            "@category": "thumbnail",
            "@_fa": "true",
            "$": "https://api.elsevier.com/content/object/eid/1-s2.0-S0378778821005028-si91.svg?httpAccept=%2A%2F%2A",
            "@multimediatype": "Scalable Vector Graphics file",
            "@type": "ALTIMG",
            "@size": "13617",
            "@ref": "si91",
            "@mimetype": "image/svg+xml"
        },
        {
            "@category": "thumbnail",
            "@_fa": "true",
            "$": "https://api.elsevier.com/content/object/eid/1-s2.0-S0378778821005028-si92.svg?httpAccept=%2A%2F%2A",
            "@multimediatype": "Scalable Vector Graphics file",
            "@type": "ALTIMG",
            "@size": "1480",
            "@ref": "si92",
            "@mimetype": "image/svg+xml"
        },
        {
            "@category": "thumbnail",
            "@_fa": "true",
            "$": "https://api.elsevier.com/content/object/eid/1-s2.0-S0378778821005028-si93.svg?httpAccept=%2A%2F%2A",
            "@multimediatype": "Scalable Vector Graphics file",
            "@type": "ALTIMG",
            "@size": "10014",
            "@ref": "si93",
            "@mimetype": "image/svg+xml"
        },
        {
            "@category": "thumbnail",
            "@_fa": "true",
            "$": "https://api.elsevier.com/content/object/eid/1-s2.0-S0378778821005028-si94.svg?httpAccept=%2A%2F%2A",
            "@multimediatype": "Scalable Vector Graphics file",
            "@type": "ALTIMG",
            "@size": "4435",
            "@ref": "si94",
            "@mimetype": "image/svg+xml"
        },
        {
            "@category": "thumbnail",
            "@_fa": "true",
            "$": "https://api.elsevier.com/content/object/eid/1-s2.0-S0378778821005028-si95.svg?httpAccept=%2A%2F%2A",
            "@multimediatype": "Scalable Vector Graphics file",
            "@type": "ALTIMG",
            "@size": "8242",
            "@ref": "si95",
            "@mimetype": "image/svg+xml"
        },
        {
            "@category": "thumbnail",
            "@_fa": "true",
            "$": "https://api.elsevier.com/content/object/eid/1-s2.0-S0378778821005028-si96.svg?httpAccept=%2A%2F%2A",
            "@multimediatype": "Scalable Vector Graphics file",
            "@type": "ALTIMG",
            "@size": "3275",
            "@ref": "si96",
            "@mimetype": "image/svg+xml"
        },
        {
            "@category": "thumbnail",
            "@_fa": "true",
            "$": "https://api.elsevier.com/content/object/eid/1-s2.0-S0378778821005028-si97.svg?httpAccept=%2A%2F%2A",
            "@multimediatype": "Scalable Vector Graphics file",
            "@type": "ALTIMG",
            "@size": "1480",
            "@ref": "si97",
            "@mimetype": "image/svg+xml"
        },
        {
            "@category": "thumbnail",
            "@_fa": "true",
            "$": "https://api.elsevier.com/content/object/eid/1-s2.0-S0378778821005028-si98.svg?httpAccept=%2A%2F%2A",
            "@multimediatype": "Scalable Vector Graphics file",
            "@type": "ALTIMG",
            "@size": "3275",
            "@ref": "si98",
            "@mimetype": "image/svg+xml"
        },
        {
            "@category": "thumbnail",
            "@_fa": "true",
            "$": "https://api.elsevier.com/content/object/eid/1-s2.0-S0378778821005028-si99.svg?httpAccept=%2A%2F%2A",
            "@multimediatype": "Scalable Vector Graphics file",
            "@type": "ALTIMG",
            "@size": "2842",
            "@ref": "si99",
            "@mimetype": "image/svg+xml"
        },
        {
            "@category": "standard",
            "@_fa": "true",
            "$": "https://api.elsevier.com/content/object/eid/1-s2.0-S0378778821005028-am.pdf?httpAccept=%2A%2F%2A",
            "@multimediatype": "Acrobat PDF file",
            "@type": "AAM-PDF",
            "@size": "3979397",
            "@ref": "am",
            "@mimetype": "application/pdf"
        }
    ]},
    "link": {
        "@rel": "abstract",
        "@href": "https://api.elsevier.com/content/abstract/scopus_id/85110627705"
    }
}}