{"full-text-retrieval-response": {
    "scopus-eid": "2-s2.0-85146918639",
    "originalText": "serial JL 271429 291210 291702 291731 291787 291877 291878 291881 31 Applied Energy APPLIEDENERGY 2023-01-19 2023-01-19 2023-01-19 2023-01-19 2024-01-11T22:59:15 1-s2.0-S0306261922018797 S0306-2619(22)01879-7 S0306261922018797 10.1016/j.apenergy.2022.120622 S300 S300.1 FULL-TEXT 1-s2.0-S0306261923X00026 2024-01-11T23:31:45.775766Z 0 0 20230315 2023 2023-01-19T18:07:51.061827Z articleinfo articlenumber articletitlenorm authfirstinitialnorm authfirstsurnamenorm cid cids contenttype copyright crossmark dateloaded dateloadedtxt datesearch datesort dateupdated dco docsubtype doctype doi eid ewtransactionid hubeid indexeddate issn issnnorm itemstage itemtransactionid itemweight openaccess openarchive pg pgfirst pii piinorm pubdatestart pubdatetxt pubyr sectiontitle sortorder srctitle srctitlenorm srctype ssids alllist content subj subheadings suppl tomb volfirst volissue volumelist webpdf webpdfpagecount yearnav figure table body mmlmath acknowledge affil appendices articletitle auth authfirstini authfull authkeywords authlast grantnumber grantsponsor highlightsabst orcid primabst ref 0306-2619 03062619 true 334 334 C Volume 334 41 120622 120622 120622 20230315 15 March 2023 2023-03-15 2023 Research Papers article fla © 2023 Elsevier Ltd. All rights reserved. HYBRIDMODELINGBASEDTEMPERATUREHUMIDITYADAPTIVECONTROLFORAMULTIZONEHVACSYSTEM JIANG Y 1 Introduction 2 System description and modeling 2.1 HVAC system description for the multi-zone building 2.2 Multi-zone building hygro-thermal dynamics modeling 2.3 Control of the multi-zone HVAC system 3 MFAC scheme for the multi-zone HVAC system 3.1 Discrete-time models for zone hygro-thermal dynamics 3.2 FFDL-based data modeling for MFAC scheme 3.3 MFAC scheme for multi-zone climate control 3.3.1 Control action calculation 3.3.2 PPJM estimation 3.3.3 Reset mechanism 4 Simulation results and discussion 4.1 Building description 4.2 Model validation for multi-zone HVAC system 4.3 Control performance simulation 4.3.1 Step response performance 4.3.2 Energy consumption comparison 4.3.3 Influence of hygro-thermal interaction on control performance 5 Conclusion CRediT authorship contribution statement Acknowledgment Appendix A Proof of Theorem 1 Appendix B Solution to the optimization objective References 2018 ANNUALENERGYREVIEWENERGYINFORMATIONADMINISTRATION YANG 2021 2586 2597 Y YANG 2020 1950 1960 Y 2017 ANSIASHRAESTANDARD552017THERMALENVIRONMENTALCONDITIONSFORHUMANOCCUPANCY RAMAN 2020 115765 N LI 2022 118408 W ESRAFILLIANNAJAFABADI 2021 107810 M BLUM 2022 119104 D SCHWINGSHACKL 2016 250 259 D MEI 2017 439 452 J MEI 2018 450 463 J HUANG 2015 203 216 H AFRAM 2017 96 113 A YAO 2021 631 Y YAO 2013 26 37 Y HUANG 2015 86 97 H JIANG 2020 114174 Y AFROZ 2022 108681 Z HJALMARSSON 1998 26 41 H GUARDABASSI 2000 954 959 G CHI 2018 5971 5980 R CHI 2017 10 29 R HOU 2017 4076 4090 Z CHI 2020 810 831 R VAZQUEZCANTELI 2019 1072 1089 J HAN 2019 101748 M LEI 2022 119742 Y SHEN 2022 118724 R YU 2021 407 419 L DU 2021 116117 Y KILLIAN 2016 403 412 M PLATT 2010 412 421 G GOYAL 2012 332 340 S RAMAN 2021 N MANTOVANI 2015 2651 2660 G COFFMAN 2018 153 160 A GUO 2021 110500 Z ZHUANG 2019 3202 3207 C ZHENG 2022 108432 P LYMPEROPOULOS 2020 109825 G HOU 2013 Z MODELFREEADAPTIVECONTROL JIANGX2023X120622 JIANGX2023X120622XY 2025-01-19T00:00:00.000Z 2025-01-19T00:00:00.000Z http://creativecommons.org/licenses/by-nc-nd/4.0/ © 2023 Elsevier Ltd. All rights reserved. 2023-02-01T04:19:51.013Z http://vtw.elsevier.com/data/voc/AddOnTypes/50.7/aggregated-refined National Natural Science Foundation of China 62103265 62103272 62173225 62273237 NSFC National Natural Science Foundation of China http://data.elsevier.com/vocabulary/SciValFunders/501100001809 http://sws.geonames.org/1814991/ This work is supported by the National Natural Science Foundation of China ( 62173225 , 62103272 , 62273237 , 62103265 ). https://doi.org/10.15223/policy-017 https://doi.org/10.15223/policy-037 https://doi.org/10.15223/policy-012 https://doi.org/10.15223/policy-029 https://doi.org/10.15223/policy-004 item S0306-2619(22)01879-7 S0306261922018797 1-s2.0-S0306261922018797 10.1016/j.apenergy.2022.120622 271429 2024-01-11T23:31:45.775766Z 2023-03-15 1-s2.0-S0306261922018797-main.pdf https://s3-eu-west-1.amazonaws.com/prod-ucs-content-store-eu-west/content/pii:S0306261922018797/MAIN/application/pdf/b77daa7282c671885199fed66b0519a1/main.pdf main.pdf pdf true 3338503 MAIN 14 1-s2.0-S0306261922018797-main_1.png https://s3-eu-west-1.amazonaws.com/prod-ucs-content-store-eu-west/content/pii:S0306261922018797/PREVIEW/image/png/b4ebf52cf487e466a3f31ba074f07ef2/main_1.png main_1.png png 59399 849 656 IMAGE-WEB-PDF 1 1-s2.0-S0306261922018797-gr2.jpg https://s3-eu-west-1.amazonaws.com/prod-ucs-content-store-eu-west/content/pii:S0306261922018797/gr2/DOWNSAMPLED/image/jpeg/92e069c4edce8819a212a6a12ae2c39d/gr2.jpg gr2 gr2.jpg jpg 140487 330 489 IMAGE-DOWNSAMPLED 1-s2.0-S0306261922018797-gr1.jpg https://s3-eu-west-1.amazonaws.com/prod-ucs-content-store-eu-west/content/pii:S0306261922018797/gr1/DOWNSAMPLED/image/jpeg/87878384acd86297ec41b79c81acf687/gr1.jpg gr1 gr1.jpg jpg 109967 339 489 IMAGE-DOWNSAMPLED 1-s2.0-S0306261922018797-gr4.jpg https://s3-eu-west-1.amazonaws.com/prod-ucs-content-store-eu-west/content/pii:S0306261922018797/gr4/DOWNSAMPLED/image/jpeg/764c5c543c13f3c8b34ced60ecfc777a/gr4.jpg gr4 gr4.jpg jpg 240508 829 706 IMAGE-DOWNSAMPLED 1-s2.0-S0306261922018797-fx1001.jpg https://s3-eu-west-1.amazonaws.com/prod-ucs-content-store-eu-west/content/pii:S0306261922018797/fx1001/DOWNSAMPLED/image/jpeg/92f59f8a3ce333a732e6a5ff0da8bc44/fx1001.jpg fx1001 fx1001.jpg jpg 101722 232 817 IMAGE-DOWNSAMPLED 1-s2.0-S0306261922018797-gr3.jpg https://s3-eu-west-1.amazonaws.com/prod-ucs-content-store-eu-west/content/pii:S0306261922018797/gr3/DOWNSAMPLED/image/jpeg/ee606f8f68f2a02a17b93e225bd0cf0b/gr3.jpg gr3 gr3.jpg jpg 103159 334 678 IMAGE-DOWNSAMPLED 1-s2.0-S0306261922018797-gr6.jpg https://s3-eu-west-1.amazonaws.com/prod-ucs-content-store-eu-west/content/pii:S0306261922018797/gr6/DOWNSAMPLED/image/jpeg/e5e34b01fc194928aa95c63aca15c874/gr6.jpg gr6 gr6.jpg jpg 142796 507 687 IMAGE-DOWNSAMPLED 1-s2.0-S0306261922018797-gr5.jpg https://s3-eu-west-1.amazonaws.com/prod-ucs-content-store-eu-west/content/pii:S0306261922018797/gr5/DOWNSAMPLED/image/jpeg/b9eab714f615a0d98964837baac7b2fd/gr5.jpg gr5 gr5.jpg jpg 183517 904 622 IMAGE-DOWNSAMPLED 1-s2.0-S0306261922018797-gr8.jpg https://s3-eu-west-1.amazonaws.com/prod-ucs-content-store-eu-west/content/pii:S0306261922018797/gr8/DOWNSAMPLED/image/jpeg/1304005c6a9c06fbd93592358398c7b4/gr8.jpg gr8 gr8.jpg jpg 134241 519 357 IMAGE-DOWNSAMPLED 1-s2.0-S0306261922018797-gr7.jpg https://s3-eu-west-1.amazonaws.com/prod-ucs-content-store-eu-west/content/pii:S0306261922018797/gr7/DOWNSAMPLED/image/jpeg/9d7a16242257d1c953963e07236f7b4b/gr7.jpg gr7 gr7.jpg jpg 104313 303 706 IMAGE-DOWNSAMPLED 1-s2.0-S0306261922018797-gr2.sml https://s3-eu-west-1.amazonaws.com/prod-ucs-content-store-eu-west/content/pii:S0306261922018797/gr2/THUMBNAIL/image/gif/ada03a1b41d321bba95db27c6fac0bdc/gr2.sml gr2 gr2.sml sml 83667 148 219 IMAGE-THUMBNAIL 1-s2.0-S0306261922018797-gr1.sml https://s3-eu-west-1.amazonaws.com/prod-ucs-content-store-eu-west/content/pii:S0306261922018797/gr1/THUMBNAIL/image/gif/1b72461a2c86f520f304e8f78c28ba75/gr1.sml gr1 gr1.sml sml 75968 152 219 IMAGE-THUMBNAIL 1-s2.0-S0306261922018797-gr4.sml https://s3-eu-west-1.amazonaws.com/prod-ucs-content-store-eu-west/content/pii:S0306261922018797/gr4/THUMBNAIL/image/gif/99e56608a552a6852106a482837491ce/gr4.sml gr4 gr4.sml sml 78384 163 139 IMAGE-THUMBNAIL 1-s2.0-S0306261922018797-fx1001.sml https://s3-eu-west-1.amazonaws.com/prod-ucs-content-store-eu-west/content/pii:S0306261922018797/fx1001/THUMBNAIL/image/gif/a2c4c21ebb3f7f3966d167f4e6e42f8f/fx1001.sml fx1001 fx1001.sml sml 68589 62 219 IMAGE-THUMBNAIL 1-s2.0-S0306261922018797-gr3.sml https://s3-eu-west-1.amazonaws.com/prod-ucs-content-store-eu-west/content/pii:S0306261922018797/gr3/THUMBNAIL/image/gif/14f96328f927e9609e5f2a69af79c14c/gr3.sml gr3 gr3.sml sml 71551 108 219 IMAGE-THUMBNAIL 1-s2.0-S0306261922018797-gr6.sml https://s3-eu-west-1.amazonaws.com/prod-ucs-content-store-eu-west/content/pii:S0306261922018797/gr6/THUMBNAIL/image/gif/2595a4a183170952003a3cd87648de9d/gr6.sml gr6 gr6.sml sml 74663 161 219 IMAGE-THUMBNAIL 1-s2.0-S0306261922018797-gr5.sml https://s3-eu-west-1.amazonaws.com/prod-ucs-content-store-eu-west/content/pii:S0306261922018797/gr5/THUMBNAIL/image/gif/6db5c5a050bdca010a08012fa2d81167/gr5.sml gr5 gr5.sml sml 73521 164 113 IMAGE-THUMBNAIL 1-s2.0-S0306261922018797-gr8.sml https://s3-eu-west-1.amazonaws.com/prod-ucs-content-store-eu-west/content/pii:S0306261922018797/gr8/THUMBNAIL/image/gif/e7f13ef8a11b67f9802b9e77d019a29f/gr8.sml gr8 gr8.sml sml 75387 163 112 IMAGE-THUMBNAIL 1-s2.0-S0306261922018797-gr7.sml https://s3-eu-west-1.amazonaws.com/prod-ucs-content-store-eu-west/content/pii:S0306261922018797/gr7/THUMBNAIL/image/gif/aaf40efcc48f825902a81a4e85544fc2/gr7.sml gr7 gr7.sml sml 72669 94 219 IMAGE-THUMBNAIL 1-s2.0-S0306261922018797-gr2_lrg.jpg https://s3-eu-west-1.amazonaws.com/prod-ucs-content-store-eu-west/content/pii:S0306261922018797/HIGHRES/image/jpeg/9d25e3df16e906787e0f1123c635be9a/gr2_lrg.jpg gr2 gr2_lrg.jpg jpg 552815 1463 2167 IMAGE-HIGH-RES 1-s2.0-S0306261922018797-gr1_lrg.jpg https://s3-eu-west-1.amazonaws.com/prod-ucs-content-store-eu-west/content/pii:S0306261922018797/HIGHRES/image/jpeg/664b98f9d3874db6374bdcde0dfefe00/gr1_lrg.jpg gr1 gr1_lrg.jpg jpg 344275 1503 2167 IMAGE-HIGH-RES 1-s2.0-S0306261922018797-gr4_lrg.jpg https://s3-eu-west-1.amazonaws.com/prod-ucs-content-store-eu-west/content/pii:S0306261922018797/HIGHRES/image/jpeg/6a94ae4c9f10b03eeaf83a445e5cf551/gr4_lrg.jpg gr4 gr4_lrg.jpg jpg 1451746 3673 3127 IMAGE-HIGH-RES 1-s2.0-S0306261922018797-fx1001_lrg.jpg https://s3-eu-west-1.amazonaws.com/prod-ucs-content-store-eu-west/content/pii:S0306261922018797/HIGHRES/image/jpeg/efbf22ea2c11bb5fa8f912a424f7ac02/fx1001_lrg.jpg fx1001 fx1001_lrg.jpg jpg 351966 1028 3618 IMAGE-HIGH-RES 1-s2.0-S0306261922018797-gr3_lrg.jpg https://s3-eu-west-1.amazonaws.com/prod-ucs-content-store-eu-west/content/pii:S0306261922018797/HIGHRES/image/jpeg/ae32a200090c553a8aa5285ff3250150/gr3_lrg.jpg gr3 gr3_lrg.jpg jpg 335282 1480 3000 IMAGE-HIGH-RES 1-s2.0-S0306261922018797-gr6_lrg.jpg https://s3-eu-west-1.amazonaws.com/prod-ucs-content-store-eu-west/content/pii:S0306261922018797/HIGHRES/image/jpeg/58ca11e3bc1accdcb899963078f94da6/gr6_lrg.jpg gr6 gr6_lrg.jpg jpg 601139 2243 3042 IMAGE-HIGH-RES 1-s2.0-S0306261922018797-gr5_lrg.jpg https://s3-eu-west-1.amazonaws.com/prod-ucs-content-store-eu-west/content/pii:S0306261922018797/HIGHRES/image/jpeg/ff40e9fb5979ae7d1058eb495bbab43f/gr5_lrg.jpg gr5 gr5_lrg.jpg jpg 1028678 4000 2753 IMAGE-HIGH-RES 1-s2.0-S0306261922018797-gr8_lrg.jpg https://s3-eu-west-1.amazonaws.com/prod-ucs-content-store-eu-west/content/pii:S0306261922018797/HIGHRES/image/jpeg/d6ea75d92f0baa3faf15cc05bb4ea74c/gr8_lrg.jpg gr8 gr8_lrg.jpg jpg 549287 2303 1584 IMAGE-HIGH-RES 1-s2.0-S0306261922018797-gr7_lrg.jpg https://s3-eu-west-1.amazonaws.com/prod-ucs-content-store-eu-west/content/pii:S0306261922018797/HIGHRES/image/jpeg/e902cb818c9c04befa4816ba216da4b5/gr7_lrg.jpg gr7 gr7_lrg.jpg jpg 328247 1342 3125 IMAGE-HIGH-RES 1-s2.0-S0306261922018797-si1.svg https://s3-eu-west-1.amazonaws.com/prod-ucs-content-store-eu-west/content/pii:S0306261922018797/image/svg+xml/6a83f6f18c79e8f802d8ab48fd678a96/si1.svg si1 si1.svg svg 3049 ALTIMG 1-s2.0-S0306261922018797-si10.svg https://s3-eu-west-1.amazonaws.com/prod-ucs-content-store-eu-west/content/pii:S0306261922018797/image/svg+xml/e31803886204a94bb528f14abb4beb91/si10.svg si10 si10.svg svg 6033 ALTIMG 1-s2.0-S0306261922018797-si101.svg https://s3-eu-west-1.amazonaws.com/prod-ucs-content-store-eu-west/content/pii:S0306261922018797/image/svg+xml/bf5169a440f641cba9c2b282b4d26d6f/si101.svg si101 si101.svg svg 1874 ALTIMG 1-s2.0-S0306261922018797-si103.svg https://s3-eu-west-1.amazonaws.com/prod-ucs-content-store-eu-west/content/pii:S0306261922018797/image/svg+xml/0fd4dbf0630289d346883e100976acc8/si103.svg si103 si103.svg svg 2308 ALTIMG 1-s2.0-S0306261922018797-si106.svg https://s3-eu-west-1.amazonaws.com/prod-ucs-content-store-eu-west/content/pii:S0306261922018797/image/svg+xml/be574c32acfd374f9bdea184d352d54e/si106.svg si106 si106.svg svg 4332 ALTIMG 1-s2.0-S0306261922018797-si109.svg https://s3-eu-west-1.amazonaws.com/prod-ucs-content-store-eu-west/content/pii:S0306261922018797/image/svg+xml/25b352d0d1d08dcd7a0eebeea440f2ab/si109.svg si109 si109.svg svg 4481 ALTIMG 1-s2.0-S0306261922018797-si113.svg https://s3-eu-west-1.amazonaws.com/prod-ucs-content-store-eu-west/content/pii:S0306261922018797/image/svg+xml/77912d74094114690b9956ec6720f2a4/si113.svg si113 si113.svg svg 2108 ALTIMG 1-s2.0-S0306261922018797-si115.svg https://s3-eu-west-1.amazonaws.com/prod-ucs-content-store-eu-west/content/pii:S0306261922018797/image/svg+xml/0bb68ab41b5746142ac74b4335ebb12f/si115.svg si115 si115.svg svg 3076 ALTIMG 1-s2.0-S0306261922018797-si116.svg https://s3-eu-west-1.amazonaws.com/prod-ucs-content-store-eu-west/content/pii:S0306261922018797/image/svg+xml/3fc895da5eef28436125fe80aa590db3/si116.svg si116 si116.svg svg 2454 ALTIMG 1-s2.0-S0306261922018797-si118.svg https://s3-eu-west-1.amazonaws.com/prod-ucs-content-store-eu-west/content/pii:S0306261922018797/image/svg+xml/6f1e10c36f279be1345b87c979793eaa/si118.svg si118 si118.svg svg 4580 ALTIMG 1-s2.0-S0306261922018797-si12.svg https://s3-eu-west-1.amazonaws.com/prod-ucs-content-store-eu-west/content/pii:S0306261922018797/image/svg+xml/701944509ac4aab1c894978a4fbbc227/si12.svg si12 si12.svg svg 22009 ALTIMG 1-s2.0-S0306261922018797-si120.svg https://s3-eu-west-1.amazonaws.com/prod-ucs-content-store-eu-west/content/pii:S0306261922018797/image/svg+xml/040b77e60d5ab812c9bab22c762e109a/si120.svg si120 si120.svg svg 2556 ALTIMG 1-s2.0-S0306261922018797-si122.svg https://s3-eu-west-1.amazonaws.com/prod-ucs-content-store-eu-west/content/pii:S0306261922018797/image/svg+xml/4e11e74d095ce2c5eac880b1f10dae40/si122.svg si122 si122.svg svg 2139 ALTIMG 1-s2.0-S0306261922018797-si124.svg https://s3-eu-west-1.amazonaws.com/prod-ucs-content-store-eu-west/content/pii:S0306261922018797/image/svg+xml/4f8cb5dcfa7fee585a80a845cf5fda16/si124.svg si124 si124.svg svg 23527 ALTIMG 1-s2.0-S0306261922018797-si125.svg https://s3-eu-west-1.amazonaws.com/prod-ucs-content-store-eu-west/content/pii:S0306261922018797/image/svg+xml/d014e7df2e0ecb704e67553d37e37976/si125.svg si125 si125.svg svg 24206 ALTIMG 1-s2.0-S0306261922018797-si127.svg https://s3-eu-west-1.amazonaws.com/prod-ucs-content-store-eu-west/content/pii:S0306261922018797/image/svg+xml/62522c458cf8a07d363d3ea380b7f57b/si127.svg si127 si127.svg svg 27093 ALTIMG 1-s2.0-S0306261922018797-si128.svg https://s3-eu-west-1.amazonaws.com/prod-ucs-content-store-eu-west/content/pii:S0306261922018797/image/svg+xml/bed6f6a1789cfc49720fd1136c51d2f0/si128.svg si128 si128.svg svg 27923 ALTIMG 1-s2.0-S0306261922018797-si129.svg https://s3-eu-west-1.amazonaws.com/prod-ucs-content-store-eu-west/content/pii:S0306261922018797/image/svg+xml/bd8faf77f5a428b7be4663f43012832a/si129.svg si129 si129.svg svg 17375 ALTIMG 1-s2.0-S0306261922018797-si13.svg https://s3-eu-west-1.amazonaws.com/prod-ucs-content-store-eu-west/content/pii:S0306261922018797/image/svg+xml/8152ebbbd7369474742e20379565f7e5/si13.svg si13 si13.svg svg 18268 ALTIMG 1-s2.0-S0306261922018797-si130.svg https://s3-eu-west-1.amazonaws.com/prod-ucs-content-store-eu-west/content/pii:S0306261922018797/image/svg+xml/bd4440343b5a6580262e6e6c3eac44c8/si130.svg si130 si130.svg svg 17692 ALTIMG 1-s2.0-S0306261922018797-si131.svg https://s3-eu-west-1.amazonaws.com/prod-ucs-content-store-eu-west/content/pii:S0306261922018797/image/svg+xml/097f525c9d977f7d068ae4ed7530db11/si131.svg si131 si131.svg svg 21791 ALTIMG 1-s2.0-S0306261922018797-si132.svg https://s3-eu-west-1.amazonaws.com/prod-ucs-content-store-eu-west/content/pii:S0306261922018797/image/svg+xml/c41c9e62124fcde6d090499215ece807/si132.svg si132 si132.svg svg 9447 ALTIMG 1-s2.0-S0306261922018797-si133.svg https://s3-eu-west-1.amazonaws.com/prod-ucs-content-store-eu-west/content/pii:S0306261922018797/image/svg+xml/744a0528a1eca0ad1070b6a87dc2e74b/si133.svg si133 si133.svg svg 7258 ALTIMG 1-s2.0-S0306261922018797-si134.svg https://s3-eu-west-1.amazonaws.com/prod-ucs-content-store-eu-west/content/pii:S0306261922018797/image/svg+xml/04d159fdb9df29d215d90f8acfed7396/si134.svg si134 si134.svg svg 6578 ALTIMG 1-s2.0-S0306261922018797-si135.svg https://s3-eu-west-1.amazonaws.com/prod-ucs-content-store-eu-west/content/pii:S0306261922018797/image/svg+xml/02ddb3afb42e0d3d14d3c207a5fda963/si135.svg si135 si135.svg svg 6951 ALTIMG 1-s2.0-S0306261922018797-si138.svg https://s3-eu-west-1.amazonaws.com/prod-ucs-content-store-eu-west/content/pii:S0306261922018797/image/svg+xml/ef6741aa12ee3699275f96f6fe4e3291/si138.svg si138 si138.svg svg 15606 ALTIMG 1-s2.0-S0306261922018797-si139.svg https://s3-eu-west-1.amazonaws.com/prod-ucs-content-store-eu-west/content/pii:S0306261922018797/image/svg+xml/f93aa3521e570be0ec548cadc21dd5a7/si139.svg si139 si139.svg svg 12329 ALTIMG 1-s2.0-S0306261922018797-si14.svg https://s3-eu-west-1.amazonaws.com/prod-ucs-content-store-eu-west/content/pii:S0306261922018797/image/svg+xml/888eee0cab4e03f71014790edd6d47c5/si14.svg si14 si14.svg svg 15409 ALTIMG 1-s2.0-S0306261922018797-si140.svg https://s3-eu-west-1.amazonaws.com/prod-ucs-content-store-eu-west/content/pii:S0306261922018797/image/svg+xml/4a02a2fd89bc9bb655110b0ebce667ac/si140.svg si140 si140.svg svg 12703 ALTIMG 1-s2.0-S0306261922018797-si141.svg https://s3-eu-west-1.amazonaws.com/prod-ucs-content-store-eu-west/content/pii:S0306261922018797/image/svg+xml/7ce5127cc4fd19824453b7aa6916492f/si141.svg si141 si141.svg svg 7629 ALTIMG 1-s2.0-S0306261922018797-si142.svg https://s3-eu-west-1.amazonaws.com/prod-ucs-content-store-eu-west/content/pii:S0306261922018797/image/svg+xml/96ecfe121d175fd3befd8a76c5389285/si142.svg si142 si142.svg svg 8002 ALTIMG 1-s2.0-S0306261922018797-si145.svg https://s3-eu-west-1.amazonaws.com/prod-ucs-content-store-eu-west/content/pii:S0306261922018797/image/svg+xml/7dcb9c955804646c2d388b62910e0b65/si145.svg si145 si145.svg svg 12023 ALTIMG 1-s2.0-S0306261922018797-si146.svg https://s3-eu-west-1.amazonaws.com/prod-ucs-content-store-eu-west/content/pii:S0306261922018797/image/svg+xml/690b9682c324f3566fc104f24b917cbc/si146.svg si146 si146.svg svg 13175 ALTIMG 1-s2.0-S0306261922018797-si147.svg https://s3-eu-west-1.amazonaws.com/prod-ucs-content-store-eu-west/content/pii:S0306261922018797/image/svg+xml/a309bf7f5a5062b45ef8708e9e7563e1/si147.svg si147 si147.svg svg 11906 ALTIMG 1-s2.0-S0306261922018797-si148.svg https://s3-eu-west-1.amazonaws.com/prod-ucs-content-store-eu-west/content/pii:S0306261922018797/image/svg+xml/c530445d86f29934b2de36f9e96275c4/si148.svg si148 si148.svg svg 13109 ALTIMG 1-s2.0-S0306261922018797-si149.svg https://s3-eu-west-1.amazonaws.com/prod-ucs-content-store-eu-west/content/pii:S0306261922018797/image/svg+xml/a8db0cf9869cb42f59e3a883f03402ae/si149.svg si149 si149.svg svg 5253 ALTIMG 1-s2.0-S0306261922018797-si150.svg https://s3-eu-west-1.amazonaws.com/prod-ucs-content-store-eu-west/content/pii:S0306261922018797/image/svg+xml/e7f7a6ac37c111703d4b58620708b6fe/si150.svg si150 si150.svg svg 3976 ALTIMG 1-s2.0-S0306261922018797-si152.svg https://s3-eu-west-1.amazonaws.com/prod-ucs-content-store-eu-west/content/pii:S0306261922018797/image/svg+xml/3ed2ab46df45c852743b190a98407d3b/si152.svg si152 si152.svg svg 3700 ALTIMG 1-s2.0-S0306261922018797-si153.svg https://s3-eu-west-1.amazonaws.com/prod-ucs-content-store-eu-west/content/pii:S0306261922018797/image/svg+xml/f370fcf8a46615f09d9abe87426b5f0e/si153.svg si153 si153.svg svg 5414 ALTIMG 1-s2.0-S0306261922018797-si155.svg https://s3-eu-west-1.amazonaws.com/prod-ucs-content-store-eu-west/content/pii:S0306261922018797/image/svg+xml/6528c06f2d5e9191d07573f5a73e7433/si155.svg si155 si155.svg svg 22952 ALTIMG 1-s2.0-S0306261922018797-si156.svg https://s3-eu-west-1.amazonaws.com/prod-ucs-content-store-eu-west/content/pii:S0306261922018797/image/svg+xml/5fd8242b69f53a708e083cadb07a18ad/si156.svg si156 si156.svg svg 10567 ALTIMG 1-s2.0-S0306261922018797-si159.svg https://s3-eu-west-1.amazonaws.com/prod-ucs-content-store-eu-west/content/pii:S0306261922018797/image/svg+xml/b3bff391859575f83cc405050165827c/si159.svg si159 si159.svg svg 3337 ALTIMG 1-s2.0-S0306261922018797-si16.svg https://s3-eu-west-1.amazonaws.com/prod-ucs-content-store-eu-west/content/pii:S0306261922018797/image/svg+xml/1167a70ee8c9afb3362655946aa3a834/si16.svg si16 si16.svg svg 18032 ALTIMG 1-s2.0-S0306261922018797-si160.svg https://s3-eu-west-1.amazonaws.com/prod-ucs-content-store-eu-west/content/pii:S0306261922018797/image/svg+xml/5f328ee037f094ec324c05bb2914af44/si160.svg si160 si160.svg svg 3612 ALTIMG 1-s2.0-S0306261922018797-si161.svg https://s3-eu-west-1.amazonaws.com/prod-ucs-content-store-eu-west/content/pii:S0306261922018797/image/svg+xml/e31d60bd6a9a4fb791ae3e404198ca5a/si161.svg si161 si161.svg svg 8770 ALTIMG 1-s2.0-S0306261922018797-si162.svg https://s3-eu-west-1.amazonaws.com/prod-ucs-content-store-eu-west/content/pii:S0306261922018797/image/svg+xml/7d660d31d2e1296746f96a2418a6a0a7/si162.svg si162 si162.svg svg 6836 ALTIMG 1-s2.0-S0306261922018797-si163.svg https://s3-eu-west-1.amazonaws.com/prod-ucs-content-store-eu-west/content/pii:S0306261922018797/image/svg+xml/e6cdf8300acc8aed7131736b6ac6ff61/si163.svg si163 si163.svg svg 20655 ALTIMG 1-s2.0-S0306261922018797-si164.svg https://s3-eu-west-1.amazonaws.com/prod-ucs-content-store-eu-west/content/pii:S0306261922018797/image/svg+xml/0858a78b29d10a5892a5a328a5efb910/si164.svg si164 si164.svg svg 7798 ALTIMG 1-s2.0-S0306261922018797-si165.svg https://s3-eu-west-1.amazonaws.com/prod-ucs-content-store-eu-west/content/pii:S0306261922018797/image/svg+xml/f76aa8f481a8921e43138a0d94315eb2/si165.svg si165 si165.svg svg 6049 ALTIMG 1-s2.0-S0306261922018797-si166.svg https://s3-eu-west-1.amazonaws.com/prod-ucs-content-store-eu-west/content/pii:S0306261922018797/image/svg+xml/8a1ba982f17e40d72941340cf390a62d/si166.svg si166 si166.svg svg 6326 ALTIMG 1-s2.0-S0306261922018797-si167.svg https://s3-eu-west-1.amazonaws.com/prod-ucs-content-store-eu-west/content/pii:S0306261922018797/image/svg+xml/cc38ae3b8ee6854df0158b8aee48b875/si167.svg si167 si167.svg svg 8198 ALTIMG 1-s2.0-S0306261922018797-si168.svg https://s3-eu-west-1.amazonaws.com/prod-ucs-content-store-eu-west/content/pii:S0306261922018797/image/svg+xml/be4cdfcbec93ef93085468f2bd7248be/si168.svg si168 si168.svg svg 13889 ALTIMG 1-s2.0-S0306261922018797-si169.svg https://s3-eu-west-1.amazonaws.com/prod-ucs-content-store-eu-west/content/pii:S0306261922018797/image/svg+xml/a5fbbfec51c101ca841cd78d1af0ef46/si169.svg si169 si169.svg svg 11959 ALTIMG 1-s2.0-S0306261922018797-si170.svg https://s3-eu-west-1.amazonaws.com/prod-ucs-content-store-eu-west/content/pii:S0306261922018797/image/svg+xml/821c335f87c35013707cea5dfa9ea13b/si170.svg si170 si170.svg svg 9608 ALTIMG 1-s2.0-S0306261922018797-si171.svg https://s3-eu-west-1.amazonaws.com/prod-ucs-content-store-eu-west/content/pii:S0306261922018797/image/svg+xml/c1f56de1b190c3978c9745fafae9bfb9/si171.svg si171 si171.svg svg 8845 ALTIMG 1-s2.0-S0306261922018797-si172.svg https://s3-eu-west-1.amazonaws.com/prod-ucs-content-store-eu-west/content/pii:S0306261922018797/image/svg+xml/fe87d9c979a7f2029293b4ea0d1e2b9c/si172.svg si172 si172.svg svg 15831 ALTIMG 1-s2.0-S0306261922018797-si173.svg https://s3-eu-west-1.amazonaws.com/prod-ucs-content-store-eu-west/content/pii:S0306261922018797/image/svg+xml/ceeceeb092ceebcbafaeeb57447f47ad/si173.svg si173 si173.svg svg 13510 ALTIMG 1-s2.0-S0306261922018797-si176.svg https://s3-eu-west-1.amazonaws.com/prod-ucs-content-store-eu-west/content/pii:S0306261922018797/image/svg+xml/7c30023d34b8c119243a2b2ecf79e3a3/si176.svg si176 si176.svg svg 9558 ALTIMG 1-s2.0-S0306261922018797-si177.svg https://s3-eu-west-1.amazonaws.com/prod-ucs-content-store-eu-west/content/pii:S0306261922018797/image/svg+xml/d61081bb828e61ae3e13a587cbb4e098/si177.svg si177 si177.svg svg 13233 ALTIMG 1-s2.0-S0306261922018797-si179.svg https://s3-eu-west-1.amazonaws.com/prod-ucs-content-store-eu-west/content/pii:S0306261922018797/image/svg+xml/a678413fef65556e8f2ae6ddbafbee93/si179.svg si179 si179.svg svg 27902 ALTIMG 1-s2.0-S0306261922018797-si18.svg https://s3-eu-west-1.amazonaws.com/prod-ucs-content-store-eu-west/content/pii:S0306261922018797/image/svg+xml/9d2b3b27994662d19e325c98dfdbdd65/si18.svg si18 si18.svg svg 18454 ALTIMG 1-s2.0-S0306261922018797-si180.svg https://s3-eu-west-1.amazonaws.com/prod-ucs-content-store-eu-west/content/pii:S0306261922018797/image/svg+xml/0a23f5d29553bf1ed04e8621158dd903/si180.svg si180 si180.svg svg 5906 ALTIMG 1-s2.0-S0306261922018797-si181.svg https://s3-eu-west-1.amazonaws.com/prod-ucs-content-store-eu-west/content/pii:S0306261922018797/image/svg+xml/9cce60b1660322f4b40d256f1b2e7e81/si181.svg si181 si181.svg svg 17104 ALTIMG 1-s2.0-S0306261922018797-si182.svg https://s3-eu-west-1.amazonaws.com/prod-ucs-content-store-eu-west/content/pii:S0306261922018797/image/svg+xml/6b1acd7e6e74494c1ab1fbb78f1f45f3/si182.svg si182 si182.svg svg 15003 ALTIMG 1-s2.0-S0306261922018797-si185.svg https://s3-eu-west-1.amazonaws.com/prod-ucs-content-store-eu-west/content/pii:S0306261922018797/image/svg+xml/542050fa45eae2bbbd00cfd24338bb6b/si185.svg si185 si185.svg svg 10477 ALTIMG 1-s2.0-S0306261922018797-si186.svg https://s3-eu-west-1.amazonaws.com/prod-ucs-content-store-eu-west/content/pii:S0306261922018797/image/svg+xml/fa5f32435c8f16e2ee56ab53cd78eb2c/si186.svg si186 si186.svg svg 9250 ALTIMG 1-s2.0-S0306261922018797-si187.svg https://s3-eu-west-1.amazonaws.com/prod-ucs-content-store-eu-west/content/pii:S0306261922018797/image/svg+xml/0d85c89a9e3678b512ea35ced9beec73/si187.svg si187 si187.svg svg 8191 ALTIMG 1-s2.0-S0306261922018797-si188.svg https://s3-eu-west-1.amazonaws.com/prod-ucs-content-store-eu-west/content/pii:S0306261922018797/image/svg+xml/f7868ad55cad1706219fb778180c9692/si188.svg si188 si188.svg svg 7139 ALTIMG 1-s2.0-S0306261922018797-si189.svg https://s3-eu-west-1.amazonaws.com/prod-ucs-content-store-eu-west/content/pii:S0306261922018797/image/svg+xml/b08145d3e3bde4c8916bb8ca0a7ffab6/si189.svg si189 si189.svg svg 8543 ALTIMG 1-s2.0-S0306261922018797-si190.svg https://s3-eu-west-1.amazonaws.com/prod-ucs-content-store-eu-west/content/pii:S0306261922018797/image/svg+xml/3df143f3307d5709c863fcf8457942ff/si190.svg si190 si190.svg svg 7492 ALTIMG 1-s2.0-S0306261922018797-si191.svg https://s3-eu-west-1.amazonaws.com/prod-ucs-content-store-eu-west/content/pii:S0306261922018797/image/svg+xml/f931991e4a5287f8251ccedb8ae1b62f/si191.svg si191 si191.svg svg 11404 ALTIMG 1-s2.0-S0306261922018797-si194.svg https://s3-eu-west-1.amazonaws.com/prod-ucs-content-store-eu-west/content/pii:S0306261922018797/image/svg+xml/56e0541af0283c0782dbd364f57c6b59/si194.svg si194 si194.svg svg 14568 ALTIMG 1-s2.0-S0306261922018797-si195.svg https://s3-eu-west-1.amazonaws.com/prod-ucs-content-store-eu-west/content/pii:S0306261922018797/image/svg+xml/2722d95f4ecdb70df54acf712b658f19/si195.svg si195 si195.svg svg 15235 ALTIMG 1-s2.0-S0306261922018797-si196.svg https://s3-eu-west-1.amazonaws.com/prod-ucs-content-store-eu-west/content/pii:S0306261922018797/image/svg+xml/b6b8568314c8b65c31f263d827728321/si196.svg si196 si196.svg svg 11851 ALTIMG 1-s2.0-S0306261922018797-si197.svg https://s3-eu-west-1.amazonaws.com/prod-ucs-content-store-eu-west/content/pii:S0306261922018797/image/svg+xml/7bf1c539afbb63245173fe0674155b41/si197.svg si197 si197.svg svg 12605 ALTIMG 1-s2.0-S0306261922018797-si198.svg https://s3-eu-west-1.amazonaws.com/prod-ucs-content-store-eu-west/content/pii:S0306261922018797/image/svg+xml/fa02864c6a3ad469d21bd4487adb29be/si198.svg si198 si198.svg svg 10353 ALTIMG 1-s2.0-S0306261922018797-si2.svg https://s3-eu-west-1.amazonaws.com/prod-ucs-content-store-eu-west/content/pii:S0306261922018797/image/svg+xml/e748f336eba4c9e6b12818a69d3aac92/si2.svg si2 si2.svg svg 3147 ALTIMG 1-s2.0-S0306261922018797-si200.svg https://s3-eu-west-1.amazonaws.com/prod-ucs-content-store-eu-west/content/pii:S0306261922018797/image/svg+xml/c5f30fbfe107c54da83daa2038c3e4a3/si200.svg si200 si200.svg svg 7616 ALTIMG 1-s2.0-S0306261922018797-si201.svg https://s3-eu-west-1.amazonaws.com/prod-ucs-content-store-eu-west/content/pii:S0306261922018797/image/svg+xml/f60b00be6b70165c925329f4b520313f/si201.svg si201 si201.svg svg 1352 ALTIMG 1-s2.0-S0306261922018797-si203.svg https://s3-eu-west-1.amazonaws.com/prod-ucs-content-store-eu-west/content/pii:S0306261922018797/image/svg+xml/ca242621984b93e76e57b3c6266bfd0c/si203.svg si203 si203.svg svg 2393 ALTIMG 1-s2.0-S0306261922018797-si205.svg https://s3-eu-west-1.amazonaws.com/prod-ucs-content-store-eu-west/content/pii:S0306261922018797/image/svg+xml/371ccf77bcd07259caaf825ff6f6019d/si205.svg si205 si205.svg svg 6138 ALTIMG 1-s2.0-S0306261922018797-si206.svg https://s3-eu-west-1.amazonaws.com/prod-ucs-content-store-eu-west/content/pii:S0306261922018797/image/svg+xml/a60084edc91bf074de45380dd2de80fd/si206.svg si206 si206.svg svg 19225 ALTIMG 1-s2.0-S0306261922018797-si207.svg https://s3-eu-west-1.amazonaws.com/prod-ucs-content-store-eu-west/content/pii:S0306261922018797/image/svg+xml/8a88cc8ac5e4e38a60f2f03392b6153d/si207.svg si207 si207.svg svg 25487 ALTIMG 1-s2.0-S0306261922018797-si208.svg https://s3-eu-west-1.amazonaws.com/prod-ucs-content-store-eu-west/content/pii:S0306261922018797/image/svg+xml/e140fd59095971a13884a796be4dd1f3/si208.svg si208 si208.svg svg 28301 ALTIMG 1-s2.0-S0306261922018797-si209.svg https://s3-eu-west-1.amazonaws.com/prod-ucs-content-store-eu-west/content/pii:S0306261922018797/image/svg+xml/01f60801a74c51cb9181532131e7068e/si209.svg si209 si209.svg svg 15231 ALTIMG 1-s2.0-S0306261922018797-si213.svg https://s3-eu-west-1.amazonaws.com/prod-ucs-content-store-eu-west/content/pii:S0306261922018797/image/svg+xml/7463522db085c73f129e91924cdffee1/si213.svg si213 si213.svg svg 7226 ALTIMG 1-s2.0-S0306261922018797-si214.svg https://s3-eu-west-1.amazonaws.com/prod-ucs-content-store-eu-west/content/pii:S0306261922018797/image/svg+xml/fddc68284703965de0b02b6e9646de79/si214.svg si214 si214.svg svg 6174 ALTIMG 1-s2.0-S0306261922018797-si215.svg https://s3-eu-west-1.amazonaws.com/prod-ucs-content-store-eu-west/content/pii:S0306261922018797/image/svg+xml/3a52a5ff59812cdd3402228502e0c758/si215.svg si215 si215.svg svg 9620 ALTIMG 1-s2.0-S0306261922018797-si216.svg https://s3-eu-west-1.amazonaws.com/prod-ucs-content-store-eu-west/content/pii:S0306261922018797/image/svg+xml/f3031adddf651fe8167b6e7175facd80/si216.svg si216 si216.svg svg 8569 ALTIMG 1-s2.0-S0306261922018797-si217.svg https://s3-eu-west-1.amazonaws.com/prod-ucs-content-store-eu-west/content/pii:S0306261922018797/image/svg+xml/13b5d020fd90efbc799825d23b8827be/si217.svg si217 si217.svg svg 9268 ALTIMG 1-s2.0-S0306261922018797-si218.svg https://s3-eu-west-1.amazonaws.com/prod-ucs-content-store-eu-west/content/pii:S0306261922018797/image/svg+xml/81b4ed59639bfb48ff0b6577e5e5e9a1/si218.svg si218 si218.svg svg 8216 ALTIMG 1-s2.0-S0306261922018797-si219.svg https://s3-eu-west-1.amazonaws.com/prod-ucs-content-store-eu-west/content/pii:S0306261922018797/image/svg+xml/fc423401643b64329b1a021236d87b25/si219.svg si219 si219.svg svg 6799 ALTIMG 1-s2.0-S0306261922018797-si220.svg https://s3-eu-west-1.amazonaws.com/prod-ucs-content-store-eu-west/content/pii:S0306261922018797/image/svg+xml/65052c26371d770850fb7e301d56552c/si220.svg si220 si220.svg svg 5216 ALTIMG 1-s2.0-S0306261922018797-si221.svg https://s3-eu-west-1.amazonaws.com/prod-ucs-content-store-eu-west/content/pii:S0306261922018797/image/svg+xml/b8c15a622287686bc4b6ebbaf2919fae/si221.svg si221 si221.svg svg 6432 ALTIMG 1-s2.0-S0306261922018797-si222.svg https://s3-eu-west-1.amazonaws.com/prod-ucs-content-store-eu-west/content/pii:S0306261922018797/image/svg+xml/d04769ba5b2b0e30186f98bf14be16bb/si222.svg si222 si222.svg svg 9297 ALTIMG 1-s2.0-S0306261922018797-si223.svg https://s3-eu-west-1.amazonaws.com/prod-ucs-content-store-eu-west/content/pii:S0306261922018797/image/svg+xml/0f27dbe0230d5f3f363d0d545a3e9ab6/si223.svg si223 si223.svg svg 7187 ALTIMG 1-s2.0-S0306261922018797-si224.svg https://s3-eu-west-1.amazonaws.com/prod-ucs-content-store-eu-west/content/pii:S0306261922018797/image/svg+xml/9c84a968566ff9a330c5928b0824ff28/si224.svg si224 si224.svg svg 6136 ALTIMG 1-s2.0-S0306261922018797-si225.svg https://s3-eu-west-1.amazonaws.com/prod-ucs-content-store-eu-west/content/pii:S0306261922018797/image/svg+xml/6c416e512fb351785f697b407cd98ceb/si225.svg si225 si225.svg svg 7114 ALTIMG 1-s2.0-S0306261922018797-si23.svg https://s3-eu-west-1.amazonaws.com/prod-ucs-content-store-eu-west/content/pii:S0306261922018797/image/svg+xml/979ebc10f5ad580eacc76137eb0c4902/si23.svg si23 si23.svg svg 2817 ALTIMG 1-s2.0-S0306261922018797-si232.svg https://s3-eu-west-1.amazonaws.com/prod-ucs-content-store-eu-west/content/pii:S0306261922018797/image/svg+xml/6d4406fdf64c68cc0c239789621db81c/si232.svg si232 si232.svg svg 15782 ALTIMG 1-s2.0-S0306261922018797-si233.svg https://s3-eu-west-1.amazonaws.com/prod-ucs-content-store-eu-west/content/pii:S0306261922018797/image/svg+xml/87f2ff14959dc72568179a52d38db579/si233.svg si233 si233.svg svg 13193 ALTIMG 1-s2.0-S0306261922018797-si235.svg https://s3-eu-west-1.amazonaws.com/prod-ucs-content-store-eu-west/content/pii:S0306261922018797/image/svg+xml/046069a427246d97b5dbbe68fbc405ee/si235.svg si235 si235.svg svg 14397 ALTIMG 1-s2.0-S0306261922018797-si236.svg https://s3-eu-west-1.amazonaws.com/prod-ucs-content-store-eu-west/content/pii:S0306261922018797/image/svg+xml/04f77929a2c783ef7ea96d0bae6bec30/si236.svg si236 si236.svg svg 11555 ALTIMG 1-s2.0-S0306261922018797-si237.svg https://s3-eu-west-1.amazonaws.com/prod-ucs-content-store-eu-west/content/pii:S0306261922018797/image/svg+xml/d8779b36d5adeab00fdce87b50cedb09/si237.svg si237 si237.svg svg 3165 ALTIMG 1-s2.0-S0306261922018797-si238.svg https://s3-eu-west-1.amazonaws.com/prod-ucs-content-store-eu-west/content/pii:S0306261922018797/image/svg+xml/95843f34d35379a9d6db84c286f79160/si238.svg si238 si238.svg svg 3270 ALTIMG 1-s2.0-S0306261922018797-si239.svg https://s3-eu-west-1.amazonaws.com/prod-ucs-content-store-eu-west/content/pii:S0306261922018797/image/svg+xml/90ca8ba4d0d536dfb2ff0a746d5a3af3/si239.svg si239 si239.svg svg 7539 ALTIMG 1-s2.0-S0306261922018797-si24.svg https://s3-eu-west-1.amazonaws.com/prod-ucs-content-store-eu-west/content/pii:S0306261922018797/image/svg+xml/0317ff5964090cbfa59167f85f1cf3c6/si24.svg si24 si24.svg svg 3190 ALTIMG 1-s2.0-S0306261922018797-si240.svg https://s3-eu-west-1.amazonaws.com/prod-ucs-content-store-eu-west/content/pii:S0306261922018797/image/svg+xml/2d909912c116b057393b6323677ee78b/si240.svg si240 si240.svg svg 6488 ALTIMG 1-s2.0-S0306261922018797-si244.svg https://s3-eu-west-1.amazonaws.com/prod-ucs-content-store-eu-west/content/pii:S0306261922018797/image/svg+xml/85f60ad2ab7828773ee676c05d4c87f0/si244.svg si244 si244.svg svg 19971 ALTIMG 1-s2.0-S0306261922018797-si245.svg https://s3-eu-west-1.amazonaws.com/prod-ucs-content-store-eu-west/content/pii:S0306261922018797/image/svg+xml/7ee231d5f3554588af96d0648e02e70f/si245.svg si245 si245.svg svg 17374 ALTIMG 1-s2.0-S0306261922018797-si247.svg https://s3-eu-west-1.amazonaws.com/prod-ucs-content-store-eu-west/content/pii:S0306261922018797/image/svg+xml/0562ffa676f45df708c51bd854c24f36/si247.svg si247 si247.svg svg 18006 ALTIMG 1-s2.0-S0306261922018797-si248.svg https://s3-eu-west-1.amazonaws.com/prod-ucs-content-store-eu-west/content/pii:S0306261922018797/image/svg+xml/f5e1e81ec97d1a55566cd14c1d6f9783/si248.svg si248 si248.svg svg 15623 ALTIMG 1-s2.0-S0306261922018797-si249.svg https://s3-eu-west-1.amazonaws.com/prod-ucs-content-store-eu-west/content/pii:S0306261922018797/image/svg+xml/510ea40e2a396eabef4bc3f3f2ea2db0/si249.svg si249 si249.svg svg 6635 ALTIMG 1-s2.0-S0306261922018797-si25.svg https://s3-eu-west-1.amazonaws.com/prod-ucs-content-store-eu-west/content/pii:S0306261922018797/image/svg+xml/6dc96552b153b92cc0bb09d9cc220ac7/si25.svg si25 si25.svg svg 1918 ALTIMG 1-s2.0-S0306261922018797-si254.svg https://s3-eu-west-1.amazonaws.com/prod-ucs-content-store-eu-west/content/pii:S0306261922018797/image/svg+xml/e5c946b165f8dcbe8e3b57d6bc2f4687/si254.svg si254 si254.svg svg 18557 ALTIMG 1-s2.0-S0306261922018797-si255.svg https://s3-eu-west-1.amazonaws.com/prod-ucs-content-store-eu-west/content/pii:S0306261922018797/image/svg+xml/56d62c3c6cf05ca52165852842f88133/si255.svg si255 si255.svg svg 25565 ALTIMG 1-s2.0-S0306261922018797-si258.svg https://s3-eu-west-1.amazonaws.com/prod-ucs-content-store-eu-west/content/pii:S0306261922018797/image/svg+xml/bae96f9997d80a6e62794dec0d29a972/si258.svg si258 si258.svg svg 17281 ALTIMG 1-s2.0-S0306261922018797-si259.svg https://s3-eu-west-1.amazonaws.com/prod-ucs-content-store-eu-west/content/pii:S0306261922018797/image/svg+xml/bcbd07409d17d9b6b3f9304793d49e9c/si259.svg si259 si259.svg svg 24063 ALTIMG 1-s2.0-S0306261922018797-si264.svg https://s3-eu-west-1.amazonaws.com/prod-ucs-content-store-eu-west/content/pii:S0306261922018797/image/svg+xml/4d2a93e546daff84b4d79ba720f9d3a4/si264.svg si264 si264.svg svg 4391 ALTIMG 1-s2.0-S0306261922018797-si267.svg https://s3-eu-west-1.amazonaws.com/prod-ucs-content-store-eu-west/content/pii:S0306261922018797/image/svg+xml/7a659295fa395c9d495b13e541cf1bea/si267.svg si267 si267.svg svg 57911 ALTIMG 1-s2.0-S0306261922018797-si277.svg https://s3-eu-west-1.amazonaws.com/prod-ucs-content-store-eu-west/content/pii:S0306261922018797/image/svg+xml/2391aad90fb5b6c8e36133495c5b5e96/si277.svg si277 si277.svg svg 10434 ALTIMG 1-s2.0-S0306261922018797-si278.svg https://s3-eu-west-1.amazonaws.com/prod-ucs-content-store-eu-west/content/pii:S0306261922018797/image/svg+xml/df11d9866d5614bc5e8dcc58922c9dd0/si278.svg si278 si278.svg svg 11496 ALTIMG 1-s2.0-S0306261922018797-si279.svg https://s3-eu-west-1.amazonaws.com/prod-ucs-content-store-eu-west/content/pii:S0306261922018797/image/svg+xml/4a9bf9c430b848cf30463c7ce26e7e13/si279.svg si279 si279.svg svg 6391 ALTIMG 1-s2.0-S0306261922018797-si28.svg https://s3-eu-west-1.amazonaws.com/prod-ucs-content-store-eu-west/content/pii:S0306261922018797/image/svg+xml/d4e4925e51c917bb58b3de578d5f2353/si28.svg si28 si28.svg svg 2470 ALTIMG 1-s2.0-S0306261922018797-si280.svg https://s3-eu-west-1.amazonaws.com/prod-ucs-content-store-eu-west/content/pii:S0306261922018797/image/svg+xml/012dc49dc2a916128038830c2e1b2e67/si280.svg si280 si280.svg svg 1885 ALTIMG 1-s2.0-S0306261922018797-si281.svg https://s3-eu-west-1.amazonaws.com/prod-ucs-content-store-eu-west/content/pii:S0306261922018797/image/svg+xml/4f989dd27709187e2bfe510c025e99ed/si281.svg si281 si281.svg svg 1990 ALTIMG 1-s2.0-S0306261922018797-si282.svg https://s3-eu-west-1.amazonaws.com/prod-ucs-content-store-eu-west/content/pii:S0306261922018797/image/svg+xml/776c57ea6e6783a581bcce5434ab2180/si282.svg si282 si282.svg svg 2354 ALTIMG 1-s2.0-S0306261922018797-si283.svg https://s3-eu-west-1.amazonaws.com/prod-ucs-content-store-eu-west/content/pii:S0306261922018797/image/svg+xml/c1927129b1de431db42d5449f5585afd/si283.svg si283 si283.svg svg 6539 ALTIMG 1-s2.0-S0306261922018797-si285.svg https://s3-eu-west-1.amazonaws.com/prod-ucs-content-store-eu-west/content/pii:S0306261922018797/image/svg+xml/b61f343eb03000431ebc5af317e63672/si285.svg si285 si285.svg svg 4245 ALTIMG 1-s2.0-S0306261922018797-si287.svg https://s3-eu-west-1.amazonaws.com/prod-ucs-content-store-eu-west/content/pii:S0306261922018797/image/svg+xml/16bfc3f1b6f220077e8364d1e6f0b268/si287.svg si287 si287.svg svg 17275 ALTIMG 1-s2.0-S0306261922018797-si288.svg https://s3-eu-west-1.amazonaws.com/prod-ucs-content-store-eu-west/content/pii:S0306261922018797/image/svg+xml/85ae51727e56c507964443aa207f3262/si288.svg si288 si288.svg svg 12983 ALTIMG 1-s2.0-S0306261922018797-si289.svg https://s3-eu-west-1.amazonaws.com/prod-ucs-content-store-eu-west/content/pii:S0306261922018797/image/svg+xml/3966d8d9f5e0949405e7fc5cfa69d33a/si289.svg si289 si289.svg svg 2381 ALTIMG 1-s2.0-S0306261922018797-si290.svg https://s3-eu-west-1.amazonaws.com/prod-ucs-content-store-eu-west/content/pii:S0306261922018797/image/svg+xml/9895191328210047a550c74f5d5a6483/si290.svg si290 si290.svg svg 3065 ALTIMG 1-s2.0-S0306261922018797-si293.svg https://s3-eu-west-1.amazonaws.com/prod-ucs-content-store-eu-west/content/pii:S0306261922018797/image/svg+xml/0c81caf7da85c7b6dd34108eb63fe399/si293.svg si293 si293.svg svg 14162 ALTIMG 1-s2.0-S0306261922018797-si294.svg https://s3-eu-west-1.amazonaws.com/prod-ucs-content-store-eu-west/content/pii:S0306261922018797/image/svg+xml/36beaca74cfc39bdb5c1ccccfb374c41/si294.svg si294 si294.svg svg 11715 ALTIMG 1-s2.0-S0306261922018797-si295.svg https://s3-eu-west-1.amazonaws.com/prod-ucs-content-store-eu-west/content/pii:S0306261922018797/image/svg+xml/333877ad5743bb84d32286f67a95268e/si295.svg si295 si295.svg svg 13198 ALTIMG 1-s2.0-S0306261922018797-si296.svg https://s3-eu-west-1.amazonaws.com/prod-ucs-content-store-eu-west/content/pii:S0306261922018797/image/svg+xml/44a2e21b941e491d0b25871ffdab795a/si296.svg si296 si296.svg svg 3381 ALTIMG 1-s2.0-S0306261922018797-si3.svg https://s3-eu-west-1.amazonaws.com/prod-ucs-content-store-eu-west/content/pii:S0306261922018797/image/svg+xml/85b307c0a0cc612b81e94d886ebd7a6b/si3.svg si3 si3.svg svg 3395 ALTIMG 1-s2.0-S0306261922018797-si302.svg https://s3-eu-west-1.amazonaws.com/prod-ucs-content-store-eu-west/content/pii:S0306261922018797/image/svg+xml/f4bae20c8cf71c09c4a52ecfaa368a3f/si302.svg si302 si302.svg svg 2331 ALTIMG 1-s2.0-S0306261922018797-si303.svg https://s3-eu-west-1.amazonaws.com/prod-ucs-content-store-eu-west/content/pii:S0306261922018797/image/svg+xml/d18233e9241ac7a5ad3f175974893061/si303.svg si303 si303.svg svg 2221 ALTIMG 1-s2.0-S0306261922018797-si304.svg https://s3-eu-west-1.amazonaws.com/prod-ucs-content-store-eu-west/content/pii:S0306261922018797/image/svg+xml/7fd0ac6cfd6c5b775da7f3ff7fd29445/si304.svg si304 si304.svg svg 2326 ALTIMG 1-s2.0-S0306261922018797-si307.svg https://s3-eu-west-1.amazonaws.com/prod-ucs-content-store-eu-west/content/pii:S0306261922018797/image/svg+xml/448a2541f36e61f89e8c81d77c372b86/si307.svg si307 si307.svg svg 38180 ALTIMG 1-s2.0-S0306261922018797-si312.svg https://s3-eu-west-1.amazonaws.com/prod-ucs-content-store-eu-west/content/pii:S0306261922018797/image/svg+xml/03798a2b3c5a35ffe5e21d3de3e86a3c/si312.svg si312 si312.svg svg 13610 ALTIMG 1-s2.0-S0306261922018797-si313.svg https://s3-eu-west-1.amazonaws.com/prod-ucs-content-store-eu-west/content/pii:S0306261922018797/image/svg+xml/5e9e4c8dd6e4ab2583c41b648bd223be/si313.svg si313 si313.svg svg 14728 ALTIMG 1-s2.0-S0306261922018797-si314.svg https://s3-eu-west-1.amazonaws.com/prod-ucs-content-store-eu-west/content/pii:S0306261922018797/image/svg+xml/74e2f7d9eac0269a3186a6f180ab4a93/si314.svg si314 si314.svg svg 16806 ALTIMG 1-s2.0-S0306261922018797-si317.svg https://s3-eu-west-1.amazonaws.com/prod-ucs-content-store-eu-west/content/pii:S0306261922018797/image/svg+xml/b2be4e31274fa1cd4d829bcddc2904ea/si317.svg si317 si317.svg svg 22679 ALTIMG 1-s2.0-S0306261922018797-si319.svg https://s3-eu-west-1.amazonaws.com/prod-ucs-content-store-eu-west/content/pii:S0306261922018797/image/svg+xml/4b371280ccecc80a46ed09b1db0bb070/si319.svg si319 si319.svg svg 21689 ALTIMG 1-s2.0-S0306261922018797-si32.svg https://s3-eu-west-1.amazonaws.com/prod-ucs-content-store-eu-west/content/pii:S0306261922018797/image/svg+xml/7807e64c8b64356dd90e6ed058d87a65/si32.svg si32 si32.svg svg 4633 ALTIMG 1-s2.0-S0306261922018797-si321.svg https://s3-eu-west-1.amazonaws.com/prod-ucs-content-store-eu-west/content/pii:S0306261922018797/image/svg+xml/b1c8cf6fe10895a315fc8d738f743a88/si321.svg si321 si321.svg svg 21887 ALTIMG 1-s2.0-S0306261922018797-si322.svg https://s3-eu-west-1.amazonaws.com/prod-ucs-content-store-eu-west/content/pii:S0306261922018797/image/svg+xml/135c3660d257cdf29fe0f9834d587419/si322.svg si322 si322.svg svg 19714 ALTIMG 1-s2.0-S0306261922018797-si324.svg https://s3-eu-west-1.amazonaws.com/prod-ucs-content-store-eu-west/content/pii:S0306261922018797/image/svg+xml/c069ec111b47698e6f81f7167550f0d3/si324.svg si324 si324.svg svg 22079 ALTIMG 1-s2.0-S0306261922018797-si328.svg https://s3-eu-west-1.amazonaws.com/prod-ucs-content-store-eu-west/content/pii:S0306261922018797/image/svg+xml/2355a8803aa9cd93b1be7ce45b821103/si328.svg si328 si328.svg svg 29455 ALTIMG 1-s2.0-S0306261922018797-si33.svg https://s3-eu-west-1.amazonaws.com/prod-ucs-content-store-eu-west/content/pii:S0306261922018797/image/svg+xml/793b7af477902d4b22f001bb8b6f5210/si33.svg si33 si33.svg svg 5006 ALTIMG 1-s2.0-S0306261922018797-si331.svg https://s3-eu-west-1.amazonaws.com/prod-ucs-content-store-eu-west/content/pii:S0306261922018797/image/svg+xml/5ce8e5e9cbaedb9ec456b685756baa08/si331.svg si331 si331.svg svg 9740 ALTIMG 1-s2.0-S0306261922018797-si332.svg https://s3-eu-west-1.amazonaws.com/prod-ucs-content-store-eu-west/content/pii:S0306261922018797/image/svg+xml/937b64287c542fc1eba5118769afc1a8/si332.svg si332 si332.svg svg 6411 ALTIMG 1-s2.0-S0306261922018797-si333.svg https://s3-eu-west-1.amazonaws.com/prod-ucs-content-store-eu-west/content/pii:S0306261922018797/image/svg+xml/73402041444f84d6f06a531ada4c558c/si333.svg si333 si333.svg svg 9342 ALTIMG 1-s2.0-S0306261922018797-si334.svg https://s3-eu-west-1.amazonaws.com/prod-ucs-content-store-eu-west/content/pii:S0306261922018797/image/svg+xml/5e6a8978fa3a163fc09a2231531ec9c4/si334.svg si334 si334.svg svg 6881 ALTIMG 1-s2.0-S0306261922018797-si336.svg https://s3-eu-west-1.amazonaws.com/prod-ucs-content-store-eu-west/content/pii:S0306261922018797/image/svg+xml/095498a4b8f342c2a54b550b2e5f89a4/si336.svg si336 si336.svg svg 18418 ALTIMG 1-s2.0-S0306261922018797-si337.svg https://s3-eu-west-1.amazonaws.com/prod-ucs-content-store-eu-west/content/pii:S0306261922018797/image/svg+xml/13a71d08b34de175dbbf204a943753d2/si337.svg si337 si337.svg svg 8269 ALTIMG 1-s2.0-S0306261922018797-si338.svg https://s3-eu-west-1.amazonaws.com/prod-ucs-content-store-eu-west/content/pii:S0306261922018797/image/svg+xml/c7ffb79e3210c4301faff7cd2670db57/si338.svg si338 si338.svg svg 15865 ALTIMG 1-s2.0-S0306261922018797-si340.svg https://s3-eu-west-1.amazonaws.com/prod-ucs-content-store-eu-west/content/pii:S0306261922018797/image/svg+xml/6402f3ba611a1d387a1be773e3eca5ab/si340.svg si340 si340.svg svg 4421 ALTIMG 1-s2.0-S0306261922018797-si342.svg https://s3-eu-west-1.amazonaws.com/prod-ucs-content-store-eu-west/content/pii:S0306261922018797/image/svg+xml/a52b4117aa145175d8ba701355494f9e/si342.svg si342 si342.svg svg 22101 ALTIMG 1-s2.0-S0306261922018797-si345.svg https://s3-eu-west-1.amazonaws.com/prod-ucs-content-store-eu-west/content/pii:S0306261922018797/image/svg+xml/d565e18f6ef551711dd1ea6dae9f0e43/si345.svg si345 si345.svg svg 5304 ALTIMG 1-s2.0-S0306261922018797-si347.svg https://s3-eu-west-1.amazonaws.com/prod-ucs-content-store-eu-west/content/pii:S0306261922018797/image/svg+xml/a099fefa2db74a2bb8b1e570e2c02185/si347.svg si347 si347.svg svg 27536 ALTIMG 1-s2.0-S0306261922018797-si349.svg https://s3-eu-west-1.amazonaws.com/prod-ucs-content-store-eu-west/content/pii:S0306261922018797/image/svg+xml/16598ec29e07087673791089744ce407/si349.svg si349 si349.svg svg 11832 ALTIMG 1-s2.0-S0306261922018797-si351.svg https://s3-eu-west-1.amazonaws.com/prod-ucs-content-store-eu-west/content/pii:S0306261922018797/image/svg+xml/171f10e250212ee7bd98b4f8c4223d48/si351.svg si351 si351.svg svg 58054 ALTIMG 1-s2.0-S0306261922018797-si361.svg https://s3-eu-west-1.amazonaws.com/prod-ucs-content-store-eu-west/content/pii:S0306261922018797/image/svg+xml/daa720f0c164e5bdc22a13b2499e8ec8/si361.svg si361 si361.svg svg 14989 ALTIMG 1-s2.0-S0306261922018797-si363.svg https://s3-eu-west-1.amazonaws.com/prod-ucs-content-store-eu-west/content/pii:S0306261922018797/image/svg+xml/e368dd4ba0974bda9e06b4c1ec91462f/si363.svg si363 si363.svg svg 87081 ALTIMG 1-s2.0-S0306261922018797-si38.svg https://s3-eu-west-1.amazonaws.com/prod-ucs-content-store-eu-west/content/pii:S0306261922018797/image/svg+xml/4a44a798612882772985356d99ee826b/si38.svg si38 si38.svg svg 5149 ALTIMG 1-s2.0-S0306261922018797-si382.svg https://s3-eu-west-1.amazonaws.com/prod-ucs-content-store-eu-west/content/pii:S0306261922018797/image/svg+xml/dae377a760b5e1a76d410e345a89f130/si382.svg si382 si382.svg svg 16360 ALTIMG 1-s2.0-S0306261922018797-si4.svg https://s3-eu-west-1.amazonaws.com/prod-ucs-content-store-eu-west/content/pii:S0306261922018797/image/svg+xml/45c76cd6639349bfb5cc035f6fa5e745/si4.svg si4 si4.svg svg 8337 ALTIMG 1-s2.0-S0306261922018797-si42.svg https://s3-eu-west-1.amazonaws.com/prod-ucs-content-store-eu-west/content/pii:S0306261922018797/image/svg+xml/8c9406e2ebe835e05446190ceaa08412/si42.svg si42 si42.svg svg 2689 ALTIMG 1-s2.0-S0306261922018797-si44.svg https://s3-eu-west-1.amazonaws.com/prod-ucs-content-store-eu-west/content/pii:S0306261922018797/image/svg+xml/848700f6785b2bce8dd22dd5c71b69a5/si44.svg si44 si44.svg svg 5017 ALTIMG 1-s2.0-S0306261922018797-si47.svg https://s3-eu-west-1.amazonaws.com/prod-ucs-content-store-eu-west/content/pii:S0306261922018797/image/svg+xml/09764f0f72ade710ad54f2756a150b75/si47.svg si47 si47.svg svg 29839 ALTIMG 1-s2.0-S0306261922018797-si48.svg https://s3-eu-west-1.amazonaws.com/prod-ucs-content-store-eu-west/content/pii:S0306261922018797/image/svg+xml/899c476cf60e85bec5299595e842bbf7/si48.svg si48 si48.svg svg 15718 ALTIMG 1-s2.0-S0306261922018797-si54.svg https://s3-eu-west-1.amazonaws.com/prod-ucs-content-store-eu-west/content/pii:S0306261922018797/image/svg+xml/b34cb4f3d5a40ed17bcc86dc280cd645/si54.svg si54 si54.svg svg 5327 ALTIMG 1-s2.0-S0306261922018797-si55.svg https://s3-eu-west-1.amazonaws.com/prod-ucs-content-store-eu-west/content/pii:S0306261922018797/image/svg+xml/b2fdbb05aa5696b4262605d7a11bbf26/si55.svg si55 si55.svg svg 2249 ALTIMG 1-s2.0-S0306261922018797-si56.svg https://s3-eu-west-1.amazonaws.com/prod-ucs-content-store-eu-west/content/pii:S0306261922018797/image/svg+xml/e6cf0cb884326794296eacfe56356af1/si56.svg si56 si56.svg svg 1317 ALTIMG 1-s2.0-S0306261922018797-si57.svg https://s3-eu-west-1.amazonaws.com/prod-ucs-content-store-eu-west/content/pii:S0306261922018797/image/svg+xml/70301d4b6b8fb81d442f5ddfb95791c9/si57.svg si57 si57.svg svg 2651 ALTIMG 1-s2.0-S0306261922018797-si58.svg https://s3-eu-west-1.amazonaws.com/prod-ucs-content-store-eu-west/content/pii:S0306261922018797/image/svg+xml/5de2d14cdd42d056ef16dce4adcffcc4/si58.svg si58 si58.svg svg 2462 ALTIMG 1-s2.0-S0306261922018797-si59.svg https://s3-eu-west-1.amazonaws.com/prod-ucs-content-store-eu-west/content/pii:S0306261922018797/image/svg+xml/12ae9a4e3acb1d26c9e08616b5a6aa01/si59.svg si59 si59.svg svg 6025 ALTIMG 1-s2.0-S0306261922018797-si60.svg https://s3-eu-west-1.amazonaws.com/prod-ucs-content-store-eu-west/content/pii:S0306261922018797/image/svg+xml/98c4e142ae54f541bb18e0835d5fb088/si60.svg si60 si60.svg svg 2307 ALTIMG 1-s2.0-S0306261922018797-si61.svg https://s3-eu-west-1.amazonaws.com/prod-ucs-content-store-eu-west/content/pii:S0306261922018797/image/svg+xml/b4fcd79f570701ec6a6bc8a6f5ce7294/si61.svg si61 si61.svg svg 1342 ALTIMG 1-s2.0-S0306261922018797-si62.svg https://s3-eu-west-1.amazonaws.com/prod-ucs-content-store-eu-west/content/pii:S0306261922018797/image/svg+xml/8812b23cd17a910cba8a8cd018dbd966/si62.svg si62 si62.svg svg 3095 ALTIMG 1-s2.0-S0306261922018797-si63.svg https://s3-eu-west-1.amazonaws.com/prod-ucs-content-store-eu-west/content/pii:S0306261922018797/image/svg+xml/d54df91daf6af96c90bed4db847ce375/si63.svg si63 si63.svg svg 2272 ALTIMG 1-s2.0-S0306261922018797-si67.svg https://s3-eu-west-1.amazonaws.com/prod-ucs-content-store-eu-west/content/pii:S0306261922018797/image/svg+xml/3996c8ba07ecbc642e703d5ce2ef3b05/si67.svg si67 si67.svg svg 4087 ALTIMG 1-s2.0-S0306261922018797-si68.svg https://s3-eu-west-1.amazonaws.com/prod-ucs-content-store-eu-west/content/pii:S0306261922018797/image/svg+xml/ab18d3b184ebbc1ff20574b21e3bb0a3/si68.svg si68 si68.svg svg 2624 ALTIMG 1-s2.0-S0306261922018797-si70.svg https://s3-eu-west-1.amazonaws.com/prod-ucs-content-store-eu-west/content/pii:S0306261922018797/image/svg+xml/5cf110033c4388ee5f99be422bec7b1a/si70.svg si70 si70.svg svg 1499 ALTIMG 1-s2.0-S0306261922018797-si71.svg https://s3-eu-west-1.amazonaws.com/prod-ucs-content-store-eu-west/content/pii:S0306261922018797/image/svg+xml/7a2fe62cd451fb5df0987de97fcc26b5/si71.svg si71 si71.svg svg 2661 ALTIMG 1-s2.0-S0306261922018797-si73.svg https://s3-eu-west-1.amazonaws.com/prod-ucs-content-store-eu-west/content/pii:S0306261922018797/image/svg+xml/b53251d5cd5f6699dd9954a65b15e36a/si73.svg si73 si73.svg svg 5821 ALTIMG 1-s2.0-S0306261922018797-si74.svg https://s3-eu-west-1.amazonaws.com/prod-ucs-content-store-eu-west/content/pii:S0306261922018797/image/svg+xml/7f33b1e021eaa85819a8a2f265655186/si74.svg si74 si74.svg svg 3471 ALTIMG 1-s2.0-S0306261922018797-si76.svg https://s3-eu-west-1.amazonaws.com/prod-ucs-content-store-eu-west/content/pii:S0306261922018797/image/svg+xml/b622793654bf7344d192fc45d31b5bc3/si76.svg si76 si76.svg svg 3540 ALTIMG 1-s2.0-S0306261922018797-si77.svg https://s3-eu-west-1.amazonaws.com/prod-ucs-content-store-eu-west/content/pii:S0306261922018797/image/svg+xml/aace38a594f3fe8082fbbf64e9dcb60f/si77.svg si77 si77.svg svg 3075 ALTIMG 1-s2.0-S0306261922018797-si79.svg https://s3-eu-west-1.amazonaws.com/prod-ucs-content-store-eu-west/content/pii:S0306261922018797/image/svg+xml/1ae301225ea88e31616da69224719ffc/si79.svg si79 si79.svg svg 1442 ALTIMG 1-s2.0-S0306261922018797-si8.svg https://s3-eu-west-1.amazonaws.com/prod-ucs-content-store-eu-west/content/pii:S0306261922018797/image/svg+xml/70707011a84de8952fdcbd3763844f6c/si8.svg si8 si8.svg svg 1587 ALTIMG 1-s2.0-S0306261922018797-si80.svg https://s3-eu-west-1.amazonaws.com/prod-ucs-content-store-eu-west/content/pii:S0306261922018797/image/svg+xml/15254718bc176972d2cda5cf6e4ac41f/si80.svg si80 si80.svg svg 3991 ALTIMG 1-s2.0-S0306261922018797-si82.svg https://s3-eu-west-1.amazonaws.com/prod-ucs-content-store-eu-west/content/pii:S0306261922018797/image/svg+xml/88c63b9730444d32f6d6782ff32e871e/si82.svg si82 si82.svg svg 3405 ALTIMG 1-s2.0-S0306261922018797-si83.svg https://s3-eu-west-1.amazonaws.com/prod-ucs-content-store-eu-west/content/pii:S0306261922018797/image/svg+xml/8885e90ca37a4f02fcb079b7d597b103/si83.svg si83 si83.svg svg 2656 ALTIMG 1-s2.0-S0306261922018797-si84.svg https://s3-eu-west-1.amazonaws.com/prod-ucs-content-store-eu-west/content/pii:S0306261922018797/image/svg+xml/77b338d55f8a94a442d0e04b61c69ed2/si84.svg si84 si84.svg svg 3839 ALTIMG 1-s2.0-S0306261922018797-si86.svg https://s3-eu-west-1.amazonaws.com/prod-ucs-content-store-eu-west/content/pii:S0306261922018797/image/svg+xml/7933ca829b7fb3b347b99e524041662c/si86.svg si86 si86.svg svg 4965 ALTIMG 1-s2.0-S0306261922018797-si87.svg https://s3-eu-west-1.amazonaws.com/prod-ucs-content-store-eu-west/content/pii:S0306261922018797/image/svg+xml/aa1792d9f63d4a1215c65322ea79eaa1/si87.svg si87 si87.svg svg 3987 ALTIMG 1-s2.0-S0306261922018797-si88.svg https://s3-eu-west-1.amazonaws.com/prod-ucs-content-store-eu-west/content/pii:S0306261922018797/image/svg+xml/50c4212342994c52dfe4da19d1dcb333/si88.svg si88 si88.svg svg 2570 ALTIMG 1-s2.0-S0306261922018797-si91.svg https://s3-eu-west-1.amazonaws.com/prod-ucs-content-store-eu-west/content/pii:S0306261922018797/image/svg+xml/09a0c2769cffc28782c8a3632df25186/si91.svg si91 si91.svg svg 3017 ALTIMG 1-s2.0-S0306261922018797-si92.svg https://s3-eu-west-1.amazonaws.com/prod-ucs-content-store-eu-west/content/pii:S0306261922018797/image/svg+xml/cd78943677efd892b71c1fcb75a9d16a/si92.svg si92 si92.svg svg 6205 ALTIMG 1-s2.0-S0306261922018797-si93.svg https://s3-eu-west-1.amazonaws.com/prod-ucs-content-store-eu-west/content/pii:S0306261922018797/image/svg+xml/b3be1c1f4e60707dc7b5aa148312fc2f/si93.svg si93 si93.svg svg 3111 ALTIMG 1-s2.0-S0306261922018797-si94.svg https://s3-eu-west-1.amazonaws.com/prod-ucs-content-store-eu-west/content/pii:S0306261922018797/image/svg+xml/f5367f43fe86ae4075c330801dc92380/si94.svg si94 si94.svg svg 2129 ALTIMG 1-s2.0-S0306261922018797-si95.svg https://s3-eu-west-1.amazonaws.com/prod-ucs-content-store-eu-west/content/pii:S0306261922018797/image/svg+xml/908d8a6374a36c7d125e958a96828a9c/si95.svg si95 si95.svg svg 2206 ALTIMG 1-s2.0-S0306261922018797-si98.svg https://s3-eu-west-1.amazonaws.com/prod-ucs-content-store-eu-west/content/pii:S0306261922018797/image/svg+xml/283c35f94bfa2cc06205bbd11be3c1b6/si98.svg si98 si98.svg svg 3862 ALTIMG 1-s2.0-S0306261922018797-am.pdf https://s3-eu-west-1.amazonaws.com/prod-ucs-content-store-eu-west/content/egi:1022G3MZ1DZ/MAIN/application/pdf/0fe63aebcbaffc4dc96793da5984ae82/am.pdf am am.pdf pdf false 1885649 AAM-PDF APEN 120622 120622 S0306-2619(22)01879-7 10.1016/j.apenergy.2022.120622 Elsevier Ltd Fig. 1 The schematic of a multi-zone building HVAC system. Fig. 2 Schematic of MFAC for the multi-zone climate dynamics. Fig. 3 The layout of the four zones in the check-in hall [16]. Fig. 4 Temperature and humidity prediction results in the four zones. Fig. 5 Temperature and Relative humidity step response in all zones. Fig. 6 Estimated cooling energy consumption in all zones. Fig. 7 Energy efficiency comparisons of different control strategy in the four zones. Fig. 8 Comparison of measured and control response time for zone temperature to reach upper objective temperature. Table 1 Nomenclature. A j Area of the j th surface in m 2 C a Specific heat of air in J/kg ° C C i Overall thermal capacity of the i th zone in J / ° C C j Overall thermal capacity of the j th surface surrounding zone i in J / ° C D o p i The opening degree of the outdoor air damper in % h i Moisture gain and loss of zone i in W K j Overall heat transfer coefficient of the j th surface in W/m 2 ° C K o i Heat transfer coefficient between the zone i and the outside in W / ° C m p Mass flow rate between zones i and p due to convection in kg/s m s a Mass flow rate of supply air of i th zone in kg/s P c i Energy consumption of the chiller in kW P f i Energy consumption of the fan in kW P i d a Partial pressure of air in atm q i Heat gain and loss of zone i in W R g Specific gas constant of dry air (287.04) in J/(kg K) T c i supply air temperature at the cooling coil in ° C T i Temperature of zone i in ° C T r e i Return air temperature of the zone i in ° C T o Outside temperature ° C T p Neighboring zone temperature of the zone p in ° C T s a i Supply air temperature of zone i in ° C T S i j Temperature of the j th surface that around zone i in ° C V i Volume of zone i in m 3 W i Relative humidity of zone i in % W s a i Supply air relative humidity of zone i in % W p Neighboring zone relative humidity of the zone i in % Table 2 RMSE and MAE of thermal dynamics prediction in the four zones. Zone-1 Zone-2 Zone-3 Zone-4 FP model Hybrid model FP model Hybrid model FP model Hybrid model FP model Hybrid model RMSE (°C) 0.43 0.29 0.29 0.13 0.37 0.09 0.39 0.15 MAE (°C) 0.32 0.15 0.26 0.08 0.33 0.06 0.35 0.10 1. FP is the abbreviation of \u201cfirst-principles\u201d. Table 3 RMSE and MAE of humidity dynamics prediction in the four zones. Zone-1 Zone-2 Zone-3 Zone-4 FP model Hybrid model FP model Hybrid model FP model Hybrid model FP model Hybrid model RMSE ( % ) 0.88 0.79 0.65 0.67 0.31 0.22 0.59 0.34 MAE ( % ) 0.60 0.22 0.32 0.20 0.13 0.04 0.50 0.06 1. FP is the abbreviation of \u201cfirst-principles\u201d. Hybrid modeling-based temperature and humidity adaptive control for a multi-zone HVAC system Yuliang Jiang Methodology Writing \u2013 original draft Shanying Zhu Conceptualization Methodology Supervision Writing \u2013 review & editing \u204e Qimin Xu Software Validation Bo Yang Writing \u2013 review & editing Project administration Xinping Guan Supervision Writing \u2013 review & editing Department of Automation, Shanghai Jiao Tong University, Shanghai 200240, China Department of Automation, Shanghai Jiao Tong University Shanghai 200240 China Department of Automation, Shanghai Jiao Tong University,Shanghai, 200240,China Key Laboratory of System Control and Information Processing, Ministry of Education of China, Shanghai 200240, China Key Laboratory of System Control and Information Processing, Ministry of Education of China Shanghai 200240 China Key Laboratory of System Control and Information Processing, Ministry of Education of China, Shanghai,200240,China Shanghai Engineering Research Center of Intelligent Control and Management, Shanghai 200240, China Shanghai Engineering Research Center of Intelligent Control and Management Shanghai 200240 China Shanghai Engineering Research Center of Intelligent Control and Management, Shanghai, 200240,China \u204e Corresponding author at: Department of Automation, Shanghai Jiao Tong University, Shanghai 200240, China. Department of Automation, Shanghai Jiao Tong University Shanghai 200240 China In this paper, we study multi-zone air environment comfort and building energy conversation for the heating, ventilation, and air conditioning (HVAC) system. Each zone is equipped with the air-handling unit (AHU) and fan coil unit to regulate the supply air state for comfortable zone climate. It is known that the multi-zone air environment appears spatial and temporal variation due to the hygro-thermal interaction which is an extremely complex nonlinear dynamic process. In this study, hybrid models incorporating the first-principles model with full form dynamic linearization (FFDL)-based data-driven model have been proposed to precisely describe the multi-zone climate dynamics including unknown nonlinearity and uncertainty. Then model-free adaptive control (MFAC) scheme is designed for multi-zone climate control, which contains controller design, parameter estimation and reset mechanism to ensure system control performance. Finally, different case studies are conducted to test the performance of model prediction and system control for the multi-zone climate environment. Model validation shows that the zone climate prediction of the proposed hybrid model shows better agreement with actual measured data. The step response results display that the hybrid model-based MFAC can realize multi-zone climate control performance improvement in faster convergence without stable bias. By comparing with prior work, the hybrid model-based MFAC has the potential to get closer to actual situation in cost-effective multi-zone climate control. Keywords Multi-zone HVAC system Hygro-thermal interaction Hybrid modeling Full form dynamic linearization Adaptive control Data availability Data is available online. 1 Introduction Building energy conservation has become one of highlighting social issues due to building energy consumption accounting for a large proportion of total energy consumption [1]. Heating, ventilation, and air conditioning (HVAC) systems in large multi-zone buildings like airports, which are responsible for the zone climate and indoor air quality (IAQ) regulation [2], is the main contributor of building energy consumption [3]. Different from single zone climate control, the multi-zone climate control can be regarded as adjusting the specified small zone temperature and humidity in a bigger one, where the small zones are open to each other. The inter-zone interaction including thermal interaction, moisture interaction and coupled hygro-thermal interaction is not completely negligible. The adjacent zone climate affects the objective zone climate increasing uncertainty of multi-zone climate dynamics and difficulty of multi-zone climate control. The goals of improving occupancy comfort and reducing energy consumption motivate a variety of research for highly-effective multi-zone HVAC system operating and controlling schemes. Indoor temperature and humidity considered as especially important measures of thermal comfort along with other factors like indoor air velocity, metabolic rate, etc., collectively affect occupancy comfort and occupant health [4]. Humidity regulation is usually ignored in building climate control, which makes occupancy comfort compromised and leads to poor humidity control [5]. For the purpose of energy-efficient building climate control, a wide variety of advanced control methods [6,7] have been investigated. Model predictive control (MPC) [8] has been one of the most widely applied control techniques for HVAC system. Applications of MPC in building climate control can be classified into two categories: the trajectory tracking MPC and the economic MPC. The trajectory tracking MPC aims to drive relevant temperature or humidity to the given set point by minimizing the tracking errors and control efforts [9\u201311]. In [10,11], Mei proposed an autonomous hierarchical control method consisting of two layers for direct expansion air conditioning systems. The upper layer was designed to use an open loop controller to achieve tradeoff steady states (indoor air temperature, moisture content and CO 2 concentration) by minimizing the system energy consumption. MPC controller was employed in the lower layer to track steady states at the required level. The optimization function of the economic MPC for building climate control involves total energy usage. In [12], Huang took into account both thermal comfort and energy cost into the optimization objective of MPC strategy. The results showed that the proposed MPC strategy saved a large amount energy without sacrificing much thermal comfort. Other problem formulation of MPC can refer to informative review papers [6,13,14]. The advantages of MPC for building climate control are that it can tradeoff conflicting indices such as maintaining thermal comfort while decreasing energy consumption, dealing with multiple-input and multiple-output (MIMO) problems and using numerical optimization. However, an accurate prediction model for building HVAC system is the indispensable prerequisite. In despite of various models proposed [15\u201318], unmodeled dynamics and unknown uncertainties still exist which adversely affect system control performance and energy efficiency. Data-driven control methods, free of accurate first-principles model and only relying on running data, provide a different solution to building climate control problem. The existing data-driven techniques such as iterative feedback tuning (IFT) [19], virtual reference feedback tuning (VRFT) [20], iterative learning control (ILC) [21,22], model free adaptive control (MFAC) [23,24], etc., have been discussed for controller design and analysis. In [25], Chi reformulated the HVAC system into a virtual linear incremental form by iterative dynamic linearization method for controller design only with I/O data information. The proposed distributed iterative learning temperature control (DILTC) method is suitable for repeatable disturbances. More recently, learning-based techniques such as reinforcement learning [26,27] and deep reinforcement learning (DRL) [28,29] have been applied to building climate control without any modeling knowledge. In [30], an energy optimization problem with the consideration of temperature regulation and stochastic zone occupancy for a multi-zone commercial building was reformulated as a Markov game. The proposed multi-agent DRL-based control method can minimize energy cost without requirement of any prior knowledge of system parameters and can be implemented in the absence of zone thermal dynamics. In [31], Du compared the deep deterministic policy gradient (DDPG) strategy and the deep Q network (DQN) in energy consumption and thermal comfort for the multi-zone residential HVAC climate control. Model-free deep reinforcement learning can exploit the interaction information between objective zone and ambient environment and without prior knowledge of zone thermal dynamics. This approach just achieves thermal comfort and indoor air quality within accepted range rather than a fixed set point. Moreover, DRL may cause unstable or large deviation when action-value function is represented by a nonlinear estimator [29]. The multi-zone building climate control is mainly attributed to regulation of both temperature and humidity, while humidity regulation is rarely considered in the researches mentioned above. Inappropriate humidity (too dry in winter or too wet in summer) can adversely affect occupancy comfort and occupant health for a long time. There are several issues to be addressed when incorporating humidity into multi-zone building climate control. Difficult modeling for multi-zone buildings has become one of challenging characteristics [32] in building climate control, especially considering humidity. It is worth noting that multi-zone building HVAC system is a slow heat and moisture transfer dynamic process with strong nonlinearity and thermodynamic inertia. A variety of modeling techniques [33,34] have been investigated and improved to obtain precise thermodynamic model as much as possible. In [35], a meta-zone aggregating multiple zones in real building was proposed to reduce the reliance on a high-resolution zone climate model of MPC. The strong nonlinear behavior is inevitable during the heat and moisture exchange between outdoor environment, ambient zones, and cannot be modeled appropriately [36]. Other uncertain or influential factors like random occupancy, outside weather and so on also impede precise mechanism modeling. Austin [37] built a thermal disturbance model induced by random occupancy and used the Kalman filter to estimate the unmodeled disturbance. Guo [38] suggested the aggregation idea to deal with the problem of simultaneously identifying an aggregate thermal dynamic model and unknown disturbances from input\u2013output data of multi-zone buildings. The thermal dynamics and related disturbance was considered to improve the accuracy of the building temperature model. The effects of unmodeled disturbances of coupling heat and moisture and hygro-thermal dynamics within and between zones have not been considered in these work. For a multi-zone building, the air environment of several zones is time-varying and interactional. The heat and moisture transfer process among zones becomes more complicated and harder to obtain satisfactory occupancy comfort control. Raman [35] summarized and compared with literature on multi-zone model predictive control which could be roughly categorized into zone-level commands only, AHU-level commands only and both AHU-level and zone-level commands. In that work, zone-level input was obtained by optimizing the energy consumption problem subject to constraints of zone thermal comfort with the consideration of both sensible and latent heat. The zone-level commands as the set points guided the AHU-level control. Motivated by the above analysis, effective zone-level control schemes for multi-zone HVAC system to achieve occupancy comfort improvement with consideration of unknown disturbances should be proposed. In this work, we study zone-level commands and present a hybrid modeling-based adaptive control method taking into account coupling heat and moisture effect, influence of multi-zone hygro-thermal interaction and unmodeled hygro-thermal dynamics (such as random occupancy, electronic devices use, occupant breath, etc.). The hybrid model for multi-zone building HVAC system consisting of the first-principles model and data-driven model is the key premise of effective controller design. In a summary, the main contributions of this work can be addressed as follows: \u2022 The first principles-based temperature and humidity models are developed which consider the coupling effect of heat and moisture, the known thermal interaction such as convection of neighboring zones. Unmodeled zone climate dynamics and unknown uncertainties are formulated as concise incremental data models by dynamic linearlization method. \u2022 A full-form dynamic linearization (FFDL) model-based MFAC scheme is proposed by solving a designed optimization problem to make control decisions for multi-zone building climate control. For convenience of the MFAC scheme, the first-principles model is conducted an equivalent reformulation by dynamic linearization method. Then the first-principles model and data-based residual model as hybrid models are integrated in a parallel fashion and controlled by same inputs in the proposed MFAC scheme. \u2022 The proposed MFAC scheme contains parameter estimation algorithm, controller design and reset mechanism to provide satisfactory control performance. Parameter estimation algorithm is necessary for exact values of the time-varying parameters which are hard to obtain for the proposed controller and hybrid model. The performance indices of air state tracking and model prediction are involved into the controller design for higher model accuracy and better comfort control performance. The reset mechanism is introduced to enhance the ability of time-varying parameter estimation. The remainder of this work is organized as follows: Section 2 gives the system description and develops models for multi-zone hygro-thermal dynamics. Section 3 presents the MFAC scheme for multi-zone climate control. Section 4 demonstrates the simulation results of model validation and control performance. Section 5 draws conclusions of this work. 2 System description and modeling The indoor air environment comfort and energy saving in large-scale multi-zone buildings is mainly attributed to the reasonable operation of HVAC system. In this section, the comprehensive hygro-thermal models are developed based upon the understanding of multi-zone HVAC climate dynamics. 2.1 HVAC system description for the multi-zone building The goal of the multi-zone building HVAC system is to provide suitable supply air to every zone with minimal building energy consumption to achieve occupancy comfort. Fig. 1 displays the common schematic of a multi-zone building HVAC system. Outside fresh air is first filtered through the filter and then blown through the cooling coil by the centrifugal fan to regulate the temperature close to the indoor air temperature. The pretreatment process is accomplished by selecting the appropriate ventilation strategy conducted by the make-up air-handling unit (MAU) [39]. Subsequently, the pretreated fresh air with indoor return air is mixed as original supply air. For hot-humid climate and the cooling mode is turned on, the original supply air is usually warm and humid and needs to be cooled and dehumidified. Then the mixed air is implemented secondary processing by the air-handling unit (AHU). The cooling coil reduces the mixed air temperature and humidity to be ready supply air temperature ( T c a ) and relative humidity ( W c a ) by tuning the flow of cold water. For cold-humid climate, it is difficult to achieve dehumidification process at the heating mode unless the dehumidification mode is turned on with cooling state. And the heating mode is turned on for temperature regulation. When the humidity of the ready supply air is regulated to meet the supply air scheme, the supply air can adjust the zone relative humidity to the comfortable value. But the supply air temperature is still low. Thus, it is reheated by the reheat coils of the fan coil unit up to supply air temperature where the reheat coils regulate temperature of ready supply air but not change supply air humidity, i.e., T s a i > T c a , W s a i = W c a ( T s a i and W s a i are the supplied air temperature and humidity of the zone i , respectively). The end of the fan coil is complicated and extra control for supply air volume needs to be designed. In this study, the multi-zone climate is mainly regulated by changing supply air temperature and humidity. The supply air volume flow rate to individual zone is determined in advance according to the pre-set value and remains basically unchanged for a period of time, which can be achieved with the aid of dampers. And there are several candidate air volume values which can be chosen for the supply air volume requirement. When the temperature and humidity requirements for supply air are met, the final supply air will be supplied to the conditioned zones. 2.2 Multi-zone building hygro-thermal dynamics modeling Considering the indoor climate for a certain zone of the multi-zone building, the supply air is the main contributor for the zone heat and humidity comfort regulation. Besides that, there are other factors which have exerted non-negligible influence on zone climate control. The air temperature and humidity of an open zone can be affected by nearby zones due to air convection. The surrounding surfaces inside the zone like walls, ceilings, floors and other mutual surfaces make an impact on hygro-thermal comfort through the way of conduction. Some other considerations like occupants activity [40], lights and electronic equipment, personal humidifier, outside weather, etc., should also be involved in zone climate dynamics [41]. In addition, spatially inhomogeneous distribution of supply air to the zone is easy to be neglected and that also deserves to be concerned in a large-scale zone. Based upon above analysis, temperature and humidity dynamics of an objective zone should be considered together for comprehensive zone climate dynamics of a multi-zone building. Here, let the number of zones in the multi-zone buildings be n . Thermal dynamics for a conditioned zone i ( i = 1 , 2 , \u2026 , n ) has been formulated as follows [41]: (1) d T i d t = m s a i C a ( T s a i − T i ) C i + ∑ j ∈ S i K j A j ( T S i j − T i ) C i + ∑ p ∈ N i m p C a ( T p − T i ) C i + K o i ( T o − T i ) C i + q i C i + f T i ( T s a i , W s a i , T m , W m , T f p i , W f p i ) , (2) d T S i j d t = K j A j C j ( T i − T S i j ) + K j A j C j ( T o − T S i j ) , (3) d T S i j d t = K j A j C j ( T i − T S i j ) + K j A j C j ( T p − T S i j ) , where Eq. (1) represents the dynamic change of zone temperature T i with consideration of the influencing factors mentioned earlier. Eqs. (2) and (3) are used to calculate the temperature of surrounding surface T S i j which can be affected by outside temperature or neighboring zone temperature. T s a i and W s a i denote supply air temperature and humidity, respectively, which are controlled by AHU; T m and W m represent measured air state of zone m , which also include the measured values of the objective zone i and the neighboring zone p ; And N i is the neighboring zone set of the objective zone; T o denotes outside temperature and its heat transfer coefficient is K o i ; q i is used to describe heat gain and loss generated from other thermal factors like lighting and occupant activity, etc; T f p i and W f p i are the temperature and humidity prediction output which can be clearly modeled based on prior knowledge; C i denotes the overall thermal capacity of the objective zone; C j is the overall thermal capacity of the j th surface surrounding zone i; C a denotes the specific heat of air; m s a i and m p are mass flow of supplied air and neighboring zone air, respectively; K j is the overall heat transfer coefficient of the surface j in surrounding surface set S i ; A j is corresponding surface contact area. Different from [41], the last item f T i ( ⋅ ) is added to depict the unmodeled dynamics and unknown uncertainty which cannot be explicitly formulated with known prior knowledge. The coupling thermal and wet effect should be considered into the comprehensive zone climate dynamics. Similarly, the humidity dynamics [34] for a conditioned zone i is as follows: (4) d W i d t = R g T i V i P i d a m s a i ( W s a i − W i ) 1 + W s a i + ∑ p ∈ N i m p ( W p − W i ) 1 + W p + R g T i V i P i d a h i + f W i ( T s a i , W s a i , T m , W m , T f p i , W f p i ) , where Eq. (4) represents dynamic change of zone humidity W i . Other factors affecting indoor humidity like occupant breath, indoor plants, personal humidifiers are considered into moisture gain and loss h i ; R g is the specific gas constant of dry air at the partial pressure P i d a ; V i is equal to the volume of the zone. There are many interacting elements that affect the indoor relative humidity \u2014 starting from various sources and different materials in building that absorb and release the humidity. It actually reflects the dynamic variation of the latent thermal load which also needs to be controlled for occupant comfort. It is not trivial to obtain a clear formulation for dynamic variation of the latent thermal load. In this paper, we model all these effects from interacting elements as uncertainty and unknown nonlinearity. Different from [34], the last item f W i ( ⋅ ) is used to depict unknown and uncertain humidity dynamics which cannot be depicted by the known prior knowledge. Overall nomenclature of (1)\u2013(4) are listed in Table 1. 2.3 Control of the multi-zone HVAC system For a multi-zone building, the models of temperature and humidity of each zone are modeled by considering the coupled hygro-thermal effects within and between zones. The temperature and humidity sensors are used to measure the zone temperature and humidity. Each AHU is mounted three sensors at the locations of supply air, return air and zone to measure the temperature and humidity. Assuming that supply air has evenly distributed in each controlled zone for a large full-scale building with multiple zones. And the location and number of temperature and humidity sensors are set reasonably for effective hygro-thermal information. This will guide the zone-level controller to obtain good supply air scheme. The obtained supply air temperature and humidity of each zone is the set point command of the AHU-level control. Taking cooling mode as an example, the heating mode of the system is similar. By comparing the measured values with the desired zone temperature and humidity (zone-level control goal) and tuning the corresponding electronic valves such as flow valves of hot and cold water, the supply air temperature and humidity will reach the supply air requirement (AHU-level control goal) by PI control approach. Then an electrical signal is emitted to the air volume control and suitable air volume is chosen before the supply air being sent to the zone. According the experience of the whole load, several candidate air volume values can be set to avoid the dead-bands of the supply air. For this complicated multi-zone hygro-thermal system, it is hard to design suitable controller directly based on above the first-principles models. Motivated by above analysis and with the consideration of many operational data, this paper pursues to design effective multi-zone supply air scheme based on accurate hygro-thermal models for the control objective of higher occupancy comfort in spite of unknown disturbances. 3 MFAC scheme for the multi-zone HVAC system For a multi-zone HVAC system, the indoor temperature and humidity is time-varying due to room load and occupant demand. In practical operation of the HVAC system, a simple but robust controller with less time-consuming is more required. To this end, an effective control scheme for multi-zone building climate regulation is proposed in this section. 3.1 Discrete-time models for zone hygro-thermal dynamics The discretization of the above temperature and humidity models is conducted first due to controller design for digital implementation at proper sampling time t s . The discrete-time zone temperature and humidity models are presented as follows: (5) T i ( k + 1 ) = e − α i t s T i ( k ) + 1 − e − α i t s α i m s a i C a T s a i ( k ) C i + K o i T o ( k ) C i + ∑ j ∈ S i K j A j T S i j ( k ) C i + ∑ p ∈ N i m p C a T p ( k ) C i + T d i ( k + 1 ) , (6) W i ( k + 1 ) = t s R g T i ( k ) V i P i d a 1 − m s a i W s a i \u2032 ( k ) − ∑ p ∈ N i m p W p \u2032 ( k ) W i ( k ) + t s R g T i ( k ) V i P i d a m s a i W s a i ( k ) W s a i \u2032 ( k ) + ∑ p ∈ N i m p W p ( k ) W p \u2032 ( k ) + W d i ( k + 1 ) , (7) T d i ( k + 1 ) = F T i T s a i ( k ) , W s a i ( k ) , D i ( k ) , (8) W d i ( k + 1 ) = F W i T s a i ( k ) , W s a i ( k ) , D i ( k ) , where α i = ( m s a i C a + ∑ p ∈ N i m p C p + ∑ j ∈ S i K S i j A S i j + K o i ) / C i ; W s a i \u2032 ( k ) = 1 + W s a i ( k ) ; W p \u2032 ( k ) = 1 + W p ( k ) . T d i ( k + 1 ) and W d i ( k + 1 ) denote unmodeled nonlinearity and uncertainty of the hygro-thermal dynamics, respectively. They can be presented by general nonlinear functions with respect to the supply air state ( T s a i and W s a i ) and relevant measured data D i ( k ) ≜ [ T m ( k ) , W m ( k ) , T f p i ( k ) , W f p i ( k ) ] in implicit forms. The above discrete-time temperature and humidity models can be rewritten in concise forms. (9) T i ( k + 1 ) = T f p i ( k + 1 ) + T d i ( k + 1 ) , (10) W i ( k + 1 ) = W f p i ( k + 1 ) + W d i ( k + 1 ) , where T f p i ( k + 1 ) and W f p i ( k + 1 ) are knowledge-based the first-principles models for the zone climate dynamics, respectively. The structures and parameters of the first-principles models can be assumed almost invariant for a short time and the computation load keeps constant. T d i ( k + 1 ) and W d i ( k + 1 ) are the unmodeled nonlinearity and uncertainty for the zone climate dynamics, respectively. 3.2 FFDL-based data modeling for MFAC scheme To depict the unknown nonlinearity and uncertainty of the zone hygro-thermal dynamics, data-based dynamic linearization method is employed for the reason that equivalent transformation of unknown nonlinear system can be achieved [23]. According to the actual measured data y m i ( k ) = [ T m i ( k ) , W m i ( k ) ] T and the data y f p i ( k ) = [ T f p i ( k ) , W f p i ( k ) ] T of the first-principles model, the model mismatch deviations can be obtained. These bias data y d i ( k ) = [ T d i ( k ) , W d i ( k ) ] T is used to predict system unmodeled dynamics with u i ( k ) = [ T s a i ( k ) , W s a i ( k ) ] T as the input. This can be viewed as a nonlinear system with unknown input and output orders n y m i and n u i . And n y m i is chosen as the same as n y i for obtain the unknown nonlinear and uncertain data. Without lost generality, the implicit formulations in Eqs. (7) and (8) can be represented by a general unknown MIMO nonlinear function F d i ( ⋅ ) . (11) y d i ( k + 1 ) = F d i ( y f p i ( k ) , \u2026 , y f p i ( k − n y i ) , y m i ( k ) , \u2026 , y m i ( k − n y m i ) , u i ( k ) , \u2026 , u i ( k − n u i ) ) , Since the orders n y i and n u i of above nonlinear system are unknown, pseudo orders L y i and L u i ( 1 ≤ L y i ≤ n y i , 1 ≤ L u i ≤ n u i ) are introduced, which decide the dynamic linearization length of the unknown nonlinear system. Specifically, the pseudo orders can be suitably selected (such as L y i = 2 , L u i = 2 ) for following dynamic linearization data modeling with lower dimensions and without characteristic information loss of the original system [42]. Define H d i ( k ) = [ y d i T ( k ) , \u2026 , y d i T ( k − L y i + 1 ) , u i T ( k ) , \u2026 , u i T ( k − L u i + 1 ) ] T ∈ R 2 L y i + 2 L u i consisting of current and historical input and output data within given dynamic linearization length. It is updated online to obtain latest input and output information for future output prediction of data model. Theorem 1 Given 1 ≤ L y i ≤ n y i and 1 ≤ L u i ≤ n u i , when \u2016 Δ H d i ( k ) \u2016 ≠ 0 holds, there must exist Φ d i ( k ) ∈ R 2 × ( 2 L y i + 2 L u i ) related to zone temperature and humidity prediction bias, such that (11) can be equivalently formulated as the following FFDL data model: (12) Δ y d i ( k + 1 ) = Φ d i ( k ) Δ H d i ( k ) , where Δ y d i ( k + 1 ) = y d i ( k + 1 ) − y d i ( k ) . Δ H d i ( k ) = H d i ( k ) − H d i ( k − 1 ) . Proof See Appendix A. In Theorem 1, Φ d i ( k ) = [ ϕ d i 1 ( k ) , \u2026 , ϕ d i L y i + L u i ( k ) ] is called pseudo partitioned Jacobian matrix (PPJM), where ϕ d i l ( k ) = ϕ d i , 11 l ( k ) ϕ d i , 12 l ( k ) ϕ d i , 21 l ( k ) ϕ d i , 22 l ( k ) ( l = 1 , 2 , \u2026 , L y i + L u i ). It is a time-varying parameter matrix, which can describe nonlinear characteristics of the unknown nonlinear system. An equivalent treatment to the first-principles model like above residual model can be achieved by dynamic linearization method using the I/O data generated by the first-principles model. (13) Δ y f p i ( k + 1 ) = Φ f p i ( k ) Δ H f p i ( k ) , where y f p i ( k ) = [ T f p i ( k ) , W f p i ( k ) ] T ; H f p i ( k ) = [ y f p i T ( k ) , \u2026 , y f p i T ( k − L y i + 1 ) , u i T ( k ) , \u2026 , u i T ( k − L u i ) ] T ∈ R 2 L y + 2 L u is defined like H d i ( k ) . Φ f p i ( k ) = [ ϕ f p i 1 ( k ) , \u2026 , ϕ f p i L y i + L u i ( k ) ] is the PPJM, where ϕ f p i l ( k ) = ϕ f p i , 11 l ( k ) ϕ f p i , 12 l ( k ) ϕ f p i , 21 l ( k ) ϕ f p i , 22 l ( k ) ( l = 1 , 2 , \u2026 , L y i + L u i ) . It can equivalently describe dynamic characteristics of the first-principles model when \u2016 Δ H f p i ( k ) \u2016 ≠ 0 holds. The influence of neighboring zone interaction and other factors has been considered in both the first-principles model y f p i ( k + 1 ) and data model y d i ( k + 1 ) . Based upon Eqs. (12) and (13), the proposed hybrid models composed of data-based residual model and knowledge-based first-principles model, have been equivalently reformulated as FFDL models with the similar structure. 3.3 MFAC scheme for multi-zone climate control Based on above FFDL increment models ( Δ y f p i ( k + 1 ) and Δ y d i ( k + 1 ) ), MFAC scheme is designed for multi-zone building climate control in terms of the goal of driving the zone climate to the required set point and minimizing the zone dynamics prediction error. The control schematic of the hybrid model-based MFAC enabled closed-loop multi-zone HVAC system is shown in Fig. 2. The first-principles model and the data-based FFDL model are integrated in parallel form for zone climate dynamics prediction. The hygro-thermal interaction of neighboring zones has been considered into the comprehensive models, which exerts nontrivial influence on conditioned zone climate control. 3.3.1 Control action calculation Given the reference profile y r i ( k ) = [ T r i ( k ) , W r i ( k ) ] T , the MFAC controller is designed by building an optimization function involved in the control performance of profile tracking, modeling prediction and control effort. The formulation of the optimization objective for zone i is presented as follows: (14) J ( u i ( k ) ) = \u2016 y r i ( k + 1 ) − y p r e i ( k + 1 ) \u2016 2 + \u2016 y i ( k ) − y p r e i ( k + 1 ) \u2016 2 + λ \u2016 Δ u i ( k ) \u2016 2 , where the first item C 1 ≜ y r i ( k + 1 ) − y p r e i ( k + 1 ) represents the tracking error between the predictive output of the proposed model and the reference profile; The second item C 2 ≜ y i ( k ) − y p r e i ( k + 1 ) represents the prediction error between the model predictive output and actual measured data; y i ( k ) = [ T i ( k ) , W i ( k ) ] T denotes the measured air state data of zone i ; The last item C 3 ≜ Δ u i ( k ) imposes a restriction on the change of input at the k th time instant; u i ( k ) = [ T s a i ( k ) , W s a i ( k ) ] T is system input as stated earlier; λ > 0 is a weighting factor. According to (12), (13) and solve (14), the MFAC controller is presented as follows: (15) u i ( k ) = u i ( k − 1 ) − [ y r i ( k + 1 ) + y i ( k ) − 2 y f p i ( k ) − 2 y d i ( k ) ] θ i ( k ) λ + 2 θ i ( k ) 2 − 2 ∑ l = 1 L y i [ ϕ f p i l ( k ) Δ y f p i ( k − l + 1 ) + ϕ d i l ( k ) Δ y d i ( k − l + 1 ) ] θ i ( k ) λ + 2 θ i ( k ) 2 − 2 ∑ l = L y i + 2 L u i + L y i [ ϕ f p i l ( k ) + ϕ d i l ( k ) ] Δ u i ( k + L y i − l + 1 ) θ i ( k ) λ + 2 θ i ( k ) 2 , where θ i ( k ) = ϕ f p i L y i + 1 ( k ) + ϕ d i L y i + 1 ( k ) . See Appendix B for the derivation process. The control action of zone i is calculated online by using I/O information of both the first-principles model and data model. Specifically, the first two items of the proposed controller indicate that the supply air of zone i in the present moment is determined by the system input at the last moment, the first-principles model output and the data model output in the present moment. The historical input and output information of both the first-principles models and data models is involved in the remaining items. The impact of neighboring zones on control action of zone i has been implicitly contained in the proposed comprehensive models ( y f p i ( k ) and y d i ( k ) ) and historical increments ( Δ y f p i ( k − l + 1 ) and Δ y d i ( k − l + 1 ) ). The proposed controller can properly adapt the fusion of both the first-principles model and data residual model, which can well achieve multi-zone building climate control with the consideration of unmodeled nonlinearity and unknown uncertainty. These historical output ( y f p i ( k − l + 1 ) , y d i ( k − l + 1 ) , l = 1 , \u2026 , L y i ) and input ( u i ( k − 1 ) , u i ( k − l + 1 ) , l = L y i + 2 , \u2026 , L y i + L u i ) can be known in advance during the running of the HVAC system. However, there exist extremely critical time-varying parameters Φ f p i ( k ) and Φ d i ( k ) undetermined which can reflect and adapt zone hygro-thermal variation caused by neighboring zones and other factors mentioned in previous section. The possible complexities of hygro-thermal dynamics in multi-zone buildings, such as nonlinearity, time-varying parameters, or time-varying structures, are involved in the time-varying parameter matrices Φ f p i ( k ) and Φ f p i ( k ) . Therefore, exact PPJM estimation algorithm should be designed. 3.3.2 PPJM estimation The PPJM Φ f p i ( k ) and Φ f p i ( k ) for model prediction and control implementation can be estimated by choosing suitable estimation criterion with obtained data. To avoid the estimation results being too sensitive to some inaccurate sampled data (due to interference or sensor failure), the recursive estimation is used which is adaptive and robust to time-varying parameters, time-varying structures, time-varying phases, etc [42]. The estimation criterion functions in this paper for Φ f p i ( k ) and Φ d i ( k ) are presented as follows: (16) J ( Φ f p i ( k ) ) = \u2016 Δ y f p i ( k ) − Φ f p i ( k ) Δ H f p i ( k − 1 ) \u2016 2 + μ 1 \u2016 Φ f p i ( k ) − Φ ̂ f p i ( k − 1 ) \u2016 2 , (17) J ( Φ d i ( k ) ) = \u2016 Δ y d i ( k ) − Φ d i ( k ) Δ H d i ( k − 1 ) \u2016 2 + μ 2 \u2016 Φ d i ( k ) − Φ ̂ d i ( k − 1 ) \u2016 2 , where μ 1 > 0 and μ 2 > 0 are weighting parameters; Φ ̂ f p i ( k ) and Φ ̂ d i ( k ) are the estimation of the corresponding to the truth value. Minimize above cost functions with respect to Φ f p i ( k ) and Φ d i ( k ) , then the estimation of PPJM can be obtained. (18) Φ ̂ f p i ( k ) = Φ ̂ f p i ( k − 1 ) + η 1 Δ y f p i ( k ) Δ H f p i ( k − 1 ) μ 1 + \u2016 Δ H f p i ( k − 1 ) \u2016 2 − η 1 Φ ̂ f p i ( k − 1 ) Δ H f p i ( k − 1 ) 2 μ 1 + \u2016 Δ H f p i ( k − 1 ) \u2016 2 , (19) Φ ̂ d i ( k ) = Φ ̂ d i ( k − 1 ) + η 2 Δ y d i ( k ) Δ H d i ( k − 1 ) μ 2 + \u2016 Δ H d i ( k − 1 ) \u2016 2 − η 2 Φ ̂ d i ( k − 1 ) Δ H d i ( k − 1 ) 2 μ 2 + \u2016 Δ H d i ( k − 1 ) \u2016 2 , where η 1 , η 2 ∈ ( 0 , 2 ] denote step size; Φ ̂ f p i ( k ) and Φ ̂ d i ( k ) are the estimated values of Φ f p i ( k ) and Φ d i ( k ) , respectively. Φ ̂ f p i ( k ) = [ ϕ ̂ f p i 1 ( k ) , \u2026 , ϕ ̂ f p i L y i + L u i ( k ) ] T , ϕ ̂ f p i l ( k ) = ϕ ̂ f p i , 11 l ( k ) ϕ ̂ f p i , 12 l ( k ) ϕ ̂ f p i , 21 l ( k ) ϕ ̂ f p i , 22 l ( k ) , l = 1 , 2 , \u2026 , L y i + L u i . Φ ̂ d i ( k ) = [ ϕ ̂ d i 1 ( k ) , \u2026 , ϕ ̂ d i L y i + L u i ( k ) ] T , ϕ ̂ d i l ( k ) = ϕ ̂ d i , 11 l ( k ) ϕ ̂ d i , 12 l ( k ) ϕ ̂ d i , 21 l ( k ) ϕ ̂ d i , 22 l ( k ) , l = 1 , 2 , \u2026 , L y i + L u i . Substituting the Φ ̂ f p i ( k ) and Φ ̂ d i ( k ) into Eq. (15), we finally obtain the controller u i ( k ) . 3.3.3 Reset mechanism The PPJM estimation is the key to hybrid model prediction and directly affects the control performance. It is not immune to the input and output data. Very small control increment or PPJM with different signs may make the updating ability of the estimate algorithm become worse. Thus necessary restrictions should be set to ensure an effective estimate. In order to enhance the tracking capacity of the proposed estimation algorithm on time-varying parameters, the estimation values need to be checked and meet some conditions according the control requirement. The PPJM can be reasonably assumed to be diagonally dominant and sign invariable [42]. The estimation results will be restarted by the initial value once these conditions are not met. To this end, necessary reset mechanism should be proposed to revive the estimation algorithm. The following reset mechanism for Φ ̂ f p i ( k ) is proposed as follows: (20) if s i g n ϕ ̂ f p i , p p L y i + 1 ( k ) ≠ s i g n ϕ ̂ f p i , p p L y i + 1 ( 1 ) , o r ∣ ϕ ̂ f p i , p p L y i + 1 ( k ) ∣ < b 2 , o r ∣ ϕ ̂ f p i , p p L y i + 1 ( k ) ∣ > ϵ b 2 , then ϕ ̂ f p i , p p L y i + 1 ( k ) = ϕ ̂ f p i , p p L y i + 1 ( 1 ) . if s i g n ϕ ̂ f p i , p q L y i + 1 ( k ) ≠ s i g n ϕ ̂ f p i , p q L y i + 1 ( 1 ) , o r ∣ ϕ ̂ f p i , p q L y i + 1 ( k ) ∣ > b 1 , then ϕ ̂ f p i , p q L y i + 1 ( k ) = ϕ ̂ f p i , p q L y i + 1 ( 1 ) . p ≠ q , p , q = 1 , 2 . ϕ ̂ f p i , p p L y i + 1 ( 1 ) , ϕ ̂ f p i , p q L y i + 1 ( 1 ) are the initial values of corresponding estimation values, respectively. s i g n ( ⋅ ) represents the signum function. b 1 and b 2 are given constants, which meets ϵ ≥ 1 and b 2 > b 1 ( 2 ϵ + 1 ) . The reset mechanism for Φ ̂ d i ( k ) is similar and omitted here. Remark 1 The diagonal dominance condition is the assumption of the input\u2013output relationship. For MIMO systems, this condition may be the only viable option to describe the coupled relationship between the variables of the system since the system model is unknown and only the I/O data of the system up to the current moment is known. The physical significance of sign invariance is that the corresponding controlled system output should not be reduced when the control input increases. This can be considered as a quasilinear property of the system. There are many actual system that meet this assumption such as temperature control system and pressure control system. The MFAC scheme including controller design, parameter estimation and reset mechanism to ensure the multi-zone climate control performance. The proposed controller only uses I/O information of both the first-principles model and data residual model without knowing the structure and parameter of the unmodeled dynamics. Remarkably, the control input is obtained through an online optimization without heavy computation burden. The implementation process of the MFAC scheme has been summarized in Algorithm 1. 4 Simulation results and discussion 4.1 Building description In order to test the model accuracy and control performance of the proposed MFAC scheme, we consider the check-in hall of an airport with four zones as shown in Fig. 3. These zones are separated by walls, windows and automatic doors whose area of these partitions can be known. All of the four zones are isolated from the outside environment by a large glass wall. The investigated zones have significant coupling relationship of the hygro-thermal interaction with neighboring zones and outside environment. Moreover, each zone with respective occupancy schedule generates different climate dynamics. The supply air to each zone provided by HVAC system can be obtained by the above control algorithm. In this study, three case studies have been carried on to investigate model prediction accuracy, control performance and energy consumption of the proposed MFAC scheme. 4.2 Model validation for multi-zone HVAC system The accuracy of the proposed hybrid model is validated in four different test zones. The measured temperature data is from the actual experiment in a check-in hall. The humidity data fails to collect in previous work [16] due to the lack of consideration for the humidity model. In order to verify the effectiveness and accuracy of the proposed humidity model, we assume that the set point for humidity plays the role of the measured humidity. For comparison, the Root Mean Square Error (RMSE) and Mean Absolute Error (MAE) are used to evaluate the relevant performance. (21) R M S E = 1 n ∑ i = 1 n ( z i − z ̂ i ) 2 , (22) M A E = 1 n ∑ i = 1 n | z i − z ̂ i | , where z i and z ̃ i denote the actual measured values and predictive values, respectively, corresponding to a set of simulation data. The temperature model and humidity model are applied to the above indicators to evaluate the accuracy, respectively. The model validation results are illustrated in Fig. 4. Both the first-principles model and the proposed hybrid model can capture zone hygro-thermal dynamics. By comparison, the prediction results of the hybrid model are in better agreement with the measured data. The first-principles model may generate obvious prediction bias since unmeasured or unmeasurable disturbances within and between zones are not considered. Tables 2 and 3 show the prediction accuracy of the proposed hybrid model and make a comparison with the first-principles model. Both RMSE and MAE of the hybrid model are less than that of the first-principles model. From the comparison results, the hybrid model is closer to the measured data since the online data information is involved for model parameter estimation and hygro-thermal dynamics prediction. 4.3 Control performance simulation 4.3.1 Step response performance The hygro-thermal step response performance of the proposed MFAC algorithm is examined in the aforementioned testing zones. PI control strategy is employed for performance comparison under the same setting conditions. The first-principles model-based PI control and hybrid model-based PI control have been compared to observe the influence of unmodeled dynamics or uncertainties on step response. Four zones are set to different situations to test step response performance. The initial values have been set as required by the actual condition. The black solid line represents the setting air state of each zone. The case of the zone-1 is to change air temperature while keeps air humidity constant. The case of the zone-2 is the reverse of that in the zone-1, which keeps the air temperature constant while changes the air relative humidity. Zone-3 considers the case that both temperature and humidity are changed with the same trend. Zone-4 takes into account the drop in temperature and humidity. All zone climate dynamics has influence on each other and strives to reach their respective set state. The hygro-thermal step response results of the four zones during simulation time are presented in Fig. 5. It can be observed that the proposed MFAC scheme has faster response time than PI control in driving zone temperature and humidity to respective set state. Although there exist some fluctuations during the dynamic response for MFAC scheme, it shows fast convergence rate and reaches the setpoints faster than PI control. From Fig. 5(a) and (b), it can be found that obvious fluctuations in the humidity response simultaneously occur when the air temperature changes in zone-1. The similar effect also occurs in zone-2 (see Fig. 5(c) and (d)) where the air temperature simultaneously fluctuates more obviously with zone humidity changing. The above phenomena reveals coupling relationship between temperature and humidity. From the response results of all zones and comparing with PI control, the proposed MFAC scheme reaches desired air state with less time and without tracking deviation during the stable period. Although oscillations may be generated during the dynamic response process by MFAC, the fast convergence speed is able to meet the slow dynamic process of the HVAC system. In addition, the dynamic response results of hybrid model-based control show better performance than that of the first-principles model-based control by comparing PI control based on different models. 4.3.2 Energy consumption comparison Different air supply schemes may lead to different energy consumption mainly related to the temperature T s a i and flow rate m s a i of the supply air. In general, when the same zone comfort is achieved by cooling or heating, the heating mode consumes more energy for the reason that the air conditioning is mainly for cooling function, and the heating mode is only its side item. In the view of energy saving and zone comfort, the cooling mode is set preferentially and the modes of both heating and cooling are avoided as much as possible. The cooling mode is set in the four zones. According to the proposed supply air scheme, it is necessary to calculate the energy consumption of each zone generated by AHUs. In this study, we calculate the cooling energy consumption directly affected by the air supply air scheme. The energy consumption of latent load affected by the flow and temperature of the desiccant solution is not considered. To calculate and evaluate the system energy efficiency, the simplified energy consuming models [12] are adopted. (23) Δ T c i = ( 1 − D o p i ) T r e i + D o p i T o − T s a i , (24) P c i = m s a i C a Δ T c i C O P , (25) P f i = f 0 + f 1 m s a i + f 2 m s a i 2 , where Δ T c i is the supply air temperature variation between the inlet and the outlet of the cooling coil; D o p i represents the opening degree of the outdoor air damper; P c i denotes the energy cost of the chiller; Coefficient of performance (COP) is a fixed value which reflects the ratio of energy conversion efficiency of the chiller. T r e i is the return air temperature of zone i ; P f i is the energy consumption of the fan, and the parameters f 0 , f 1 and f 2 are given constants [17]. The total energy consumption is the sum of P c i and P f i for each conditioned zone. Based upon above energy consumption formulations, we have compared the cooling energy consumption of the four zones generated by MFAC and PI control, respectively. Cooling energy consumption generated by different models-based PI control strategy has also been compared in this case. All the external conditions like outdoor temperature are set the same. Fig. 6 shows the energy consumption results of the respective conditioned zone over the simulation time. From the results, it can be found that the first-principles model-based PI control method consumes more cooling energy than that of the proposed hybrid model-based PI control method. The energy efficiency comparison in the four zones has been shown in Fig. 7. The average energy saving by the proposed hybrid model-based MFAC scheme can reach up to 25.5% compared with the first-principles model-based PI control. The additional cooling energy needs to be provided to depress the thermal effect of unmodeled factors. 4.3.3 Influence of hygro-thermal interaction on control performance This case is conducted to investigate zone thermal control performance with the consideration of influence of hygro-thermal interaction. The proposed MFAC scheme considered both thermal and wet interaction is employed for the zone-1. The previous results only considering the influence of thermal convection interaction in [16] are as the comparisons, which adopted MPC scheme to make prediction and control decision. Fig. 8(a) depicts the temperature variation when the AHU is turned on, which is controlled by MPC and MFAC, respectively. On the one hand, the results show that multi-zone model takes shorter time to drop the room temperature to the upper comfortable limit (23.5 °C) compared with single-zone model, and can afford zone comfort faster at the start of the occupancy. On the other hand, the hybrid model controlled by MFAC performs closer to the actual one than ANN-based multi-zone model controlled by MPC. Fig. 8(b) shows the temperature rising dynamics estimated by the prediction model in [16] and proposed hybrid model after the AHU is turned off. The results of proposed hybrid model can still predict better and closer to the actual situation than the ANN multi-zone model. From the above analysis, it can be concluded that the prediction model considering hygro-thermal interaction can perform better in multi-zone building climate control and energy saving in practice. 5 Conclusion With the consideration of unknown nonlinearity and uncertainty in the multi-zone HVAC system, we propose a hybrid modeling-based MFAC scheme to ensure both temperature and humidity setpoints tracking in spite of unknown disturbances. First, control-oriented hybrid model which integrates the first-principles model and FFDL-based data-driven model is developed for comprehensive multi-zone climate dynamics. Compared with the first-principles model existing unmodeled dynamics, the proposed hybrid model has considered unknown nonlinearity and uncertainty of the multi-zone hygro-thermal dynamics into the data model with the aid of online measured data. Then the MFAC scheme is designed including controller design, parameter estimation and reset mechanism to realize desired multi-zone climate control performance. The model validation shows that the proposed hybrid models have higher prediction accuracy compared with the first-principles models. PI as the baseline controller displays better set points tracking and less energy consumption based on the proposed hybrid models. Compared with PI control, it is an effective controller for multi-zone climate control that the proposed MFAC has improved system performance in faster convergence, without steady-state deviation. By considering influence of the hygro-thermal interaction, the proposed hybrid model controlled by MFAC shows potential to perform closer to the actual situation in multi-zone occupancy comfort. CRediT authorship contribution statement Yuliang Jiang: Methodology, Writing \u2013 original draft. Shanying Zhu: Conceptualization, Methodology, Supervision, Writing \u2013 review & editing. Qimin Xu: Software, Validation. Bo Yang: Writing \u2013 review & editing, Project administration. Xinping Guan: Supervision, Writing \u2013 review & editing. Declaration of Competing Interest The authors declare that they have no known competing financial interests or personal relationships that could have appeared to influence the work reported in this paper. Acknowledgment This work is supported by the National Natural Science Foundation of China (62173225, 62103272, 62273237, 62103265). Appendix A Proof of Theorem 1 Define some symbolic vectors for brevity: Y d i L y i ( k ) ≜ [ y d i ( k ) , \u2026 , y d i ( k − L y i + 1 ) ] , Y d i n y i − L y i ( k ) ≜ [ y d i ( k − L y i ) , \u2026 , y d i ( k − n y i ) ] , U d i L u i ( k ) ≜ [ u i ( k ) , \u2026 , u i ( k − L u i + 1 ) ] , U d i n u i − L u i ( k ) ≜ [ u i ( k − L u i ) , \u2026 , u i ( k − n u i ) ] . According to above definition, we can obtain Y d i n y i ( k ) ≜ [ Y d i L y i ( k ) , Y d i n y i − L y i ( k ) ] and U i n u i ( k ) ≜ [ U d i L u i ( k ) , U d i n u i − L u i ( k ) ] . And the MIMO nonlinear function (11) can be rewritten as the following form: (A.1) y d i ( k + 1 ) = F d i ( Y d i n y i ( k ) , U d i n u i ( k ) ) . From (A.1), we can obtain output increment Δ y d i ( k + 1 ) , (A.2) Δ y d i ( k + 1 ) = y d i ( k + 1 ) − y d i ( k ) = F d i ( Y d i n y i ( k ) , U i n u i ( k ) ) − F d i ( Y d i n y i ( k − 1 ) , U i n u i ( k − 1 ) ) . In order to get the input and output variation in the dynamic linearization interval, we introduces an auxiliary symbolic vector H ˜ d i n y i + n u i ( k − 1 ) ≜ [ Y d i L y i ( k − 1 ) , Y d i n y i − L y i ( k ) , U d i L u i ( k − 1 ) , U d i n u i − L u i ( k ) ] . For above purpose, (A.2) can also be written as follows: (A.3) Δ y d i ( k + 1 ) = F d i ( Y d i n y i ( k ) , U i n u i ( k ) ) − F d i ( H ˜ d i n y i + n u i ( k − 1 ) ) + F d i ( H ˜ d i n y i + n u i ( k − 1 ) ) − F d i ( Y d i n y i ( k − 1 ) , U i n u i ( k − 1 ) ) , where let that (A.4) Ψ d i ( k ) = F d i ( H ˜ d i n y i + n u i ( k − 1 ) ) − F d i ( Y d i n y i ( k − 1 ) , U i n u i ( k − 1 ) ) . For a nonlinear system in practice, it is feasible that bias function F d i ( ⋅ ) of zone climate exists continuous partial derivatives of y d i ( k ) with respect to all variables [42]. On the other hand, the change rates of output bias controlled by supplied air are bounded for the reason that both the first-principles model outputs and measured data are limited within certain range. According to above analysis and Cauchy mean value theorem, we can obtain (A.5) y d i ( k + 1 ) = + ∂ F d i ∂ y d i ( k ) Δ y d i ( k ) + ⋯ + ∂ F d i ∂ y d i ( k − L y i + 1 ) Δ y d i ( k − L y i + 1 ) + ∂ F d i ∂ u i ( k ) Δ u i ( k ) + ⋯ + ∂ F d i ∂ u i ( k − L u i + 1 ) Δ u i ( k − L u i + 1 ) + Ψ d i ( k ) , where ∂ F d i ∂ y d i ( k − r ) , 0 ≤ r ≤ L y i − 1 and ∂ F d i ∂ u i ( k − s ) , 0 ≤ s ≤ L u i − 1 , represent the partial derivative value of F d i ( ⋅ ) with respect to the corresponding variable at some point between the interval [ Y d i L y i ( k − 1 ) , Y d i n y i − L y i ( k ) , U d i L u i ( k − 1 ) , U d i n u i − L u i ( k ) ] T and [ Y d i L y i ( k ) , Y d i n y i − L y i ( k ) , U d i L u i ( k ) , U d i n u i − L u i ( k ) ] T . For each fixed k , we give the following data equation containing variable η T ( k ) [42]. (A.6) Ψ d i ( k ) = η T ( k ) [ Δ y d i ( k ) , \u2026 , Δ u i ( k − L u i + 1 ) ] T = η T ( k ) Δ H d i ( k ) , since \u2016 Δ H d i ( k ) \u2016 ≠ 0 holds, there must exist at least one solution η ∗ ( k ) for above equation. Let Φ d i ( k ) = [ ∂ F d i ∂ y d i ( k ) , \u2026 , ∂ F d i ∂ y d i ( k − L y i + 1 ) , ∂ F d i ∂ u i ( k ) , \u2026 , ∂ F d i ∂ u i ( k − L u i + 1 ) ] T + η ∗ ( k ) . Then we have (A.7) Δ y d i ( k + 1 ) = Φ d i ( k ) Δ H d i ( k ) . Appendix B Solution to the optimization objective The (14) can be rewrite as follows (B.1) min u i k J = \u2016 y r i k + 1 − y p r e i k + 1 \u2016 2 + \u2016 y i k − y p r e i k + 1 \u2016 2 + λ \u2016 Δ u i k \u2016 2 = \u2016 y r i k + 1 − y f p i k + 1 + y d i k + 1 \u2016 2 + \u2016 y i k − y f p i k + 1 + y d i k + 1 \u2016 2 + λ \u2016 Δ u i k \u2016 2 = \u2016 y r i k + 1 − y f p i k + Φ f p i k Δ H f p i k + y d i k + Φ d i k Δ H d i k \u2016 2 + \u2016 y i k − y f p i k + Φ f p i k Δ H f p i k + y d i k + Φ d i k Δ H d i k \u2016 2 + λ \u2016 Δ u i k \u2016 2 , Let θ i k = ϕ f p i L y i + 1 k − ϕ d i L y i + 1 k , the optimal control action can be solved by minimizing above optimization problem without considering constraints. (B.2) ∂ J u i k ∂ u i k = y r i k + 1 − y f p i k − y d i k − Φ f p i k Δ H f p i k − Φ d i k Δ H d i k θ i k + y i k − y f p i k + 1 − y d i k + 1 − Φ f p i k Δ H f p i k − Φ d i k Δ H d i k θ i k + λ u i k − u i k − 1 = y r i k + 1 − y f p i k − y d i k − ∑ l = 1 L y i ϕ f p i l Δ y f p i k − l + 1 + ϕ d i l Δ y d i k − l + 1 − ϕ f p i L y i + 1 u i k − u i k − 1 − ∑ l = L y i + 2 L y i + L u i ϕ f p i l + ϕ f p i l Δ u i k + L y i − l + 1 θ i k + y i k + 1 − y f p i k − y d i k − ∑ l = 1 L y i ϕ f p i l Δ y f p i k − l + 1 + ϕ d i l Δ y d i k − l + 1 − ϕ f p i L y i + 1 u i k − u i k − 1 − ∑ l = L y i + 2 L y i + L u i ϕ f p i l + ϕ f p i l Δ u i k + L y i − l + 1 θ i k + λ u i k − u i k − 1 , Let (B.2) = 0 , then we can obtain the optimal control action as shown in (15). References [1] U. EIA Annual energy review, energy information administration 2018 U. EIA, Annual Energy Review, Energy Information Administration. 2018. [2] Yang Y. Srinivasan S. Hu G. Spanos C.J. Distributed control of multizone HVAC systems considering indoor air quality IEEE Trans Control Syst Technol 29 6 2021 2586 2597 Y. Yang, S. Srinivasan, G. Hu, C.J. Spanos, Distributed Control of Multizone HVAC Systems Considering Indoor Air Quality, IEEE Transactions on Control Systems Technology. 29 (6) (2021) 2586-2597. [3] Yang Y. Hu G. Spanos C.J. HVAC energy cost optimization for a multizone building via a decentralized approach IEEE Trans Autom Sci Eng 17 4 2020 1950 1960 Y. Yang, G. Hu, C.J. Spanos, HVAC Energy Cost Optimization for a Multizone Building via a Decentralized Approach, IEEE Transactions on Automation Science and Engineering. 17 (4) (2020) 1950-1960. [4] Ansi/ASHRAE standard 55-2017: Thermal environmental conditions for human occupancy 2017 ANSI/ASHRAE standard 55-2017: Thermal environmental conditions for human occupancy. (2017). [5] Raman N.S. Devaprasad K. Chen B. Ingley H.A. Barooah P. Model predictive control for energy-efficient HVAC operation with humidity and latent heat considerations Appl Energy 279 2020 115765 N.S. Raman, K. Devaprasad, B. Chen, H.A. Ingley, P. Barooah. Model predictive control for energy-efficient HVAC operation with humidity and latent heat considerations, Applied Energy. 279 (2020) 115765. [6] Li W.Z. Wang S.W. A fully distributed optimal control approach for multi-zone dedicated outdoor air systems to be implemented in IoT-enabled building automation networks Appl Energy 308 2022 118408 W.Z. Li, S.W. Wang, A fully distributed optimal control approach for multi-zone dedicated outdoor air systems to be implemented in IoT-enabled building automation networks, Applied Energy. 308 (2022) 118408. [7] Esrafillian-Najafabadi M. Haghighat F. Occupancy-based HVAC control systems in buildings: A state-of-the-art review Build Environ 197 2021 107810 M. Esrafillian-Najafabadi, F. Haghighat, Occupancy-based HVAC control systems in buildings: A state-of-the-art review, Building and Environment. 197(2021) 107810. [8] Blum D. Wang Z. Weyandt C. Kim D.H. Wetter M. Hong T.Z. Field demonstration and implementation analysis of model predictive control in an office HVAC system Appl Energy 318 2022 119104 D. Blum, Z. Wang, C. Weyandt, D.H. Kim, M. Wetter, T.Z Hong, Field demonstration and implementation analysis of model predictive control in an office HVAC system, Applied Energy. 318(2022) 119104. [9] Schwingshackl D. Rehrl J. Horn M. LoLiMoT based MPC for air handling units in HVAC systems Build Environ 96 2016 250 259 D. Schwingshackl, J. Rehrl, M. Horn, LoLiMoT based MPC for air handling units in HVAC systems, Building and Environment. 96 (2016) 250-259. [10] Mei J. Xia X.H. Energy-efficient predictive control of indoor thermal comfort and air quality in a direct expansion air conditioning system Appl Energy 195 2017 439 452 J. Mei, X.H. Xia, Energy-efficient predictive control of indoor thermal comfort and air quality in a direct expansion air conditioning system, Applied Energy. 195 (2017) 439-452. [11] Mei J. Xia X.H. Song M.J. An autonomous hierarchical control for improving indoor comfort and energy efficiency of a direct expansion air conditioning system Appl Energy 221 2018 450 463 J. Mei, X.H. Xia, M.J. Song, An autonomous hierarchical control for improving indoor comfort and energy efficiency of a direct expansion air conditioning system, Applied Energy. 221 (2018) 450-463. [12] Huang H. Chen L. Hu E. A new model predictive control scheme for energy and cost savings in commercial buildings: An airport terminal building case study Build Environ 89 2015 203 216 H. Huang, L. Chen, E. Hu, A new model predictive control scheme for energy and cost savings in commercial buildings: An airport terminal building case study, Building and Environment. 89 (2015) 203-216. [13] Afram A. Janabi Sharifi F. Fung A.S. Raahemifar K. Artificial neural network (ANN) based model predictive control (MPC) and optimization of HVAC systems: A state of the art review and case study of a residential HVAC system Energy Build 141 2017 96 113 A. Afram, F. Janabi Sharifi, A.S. Fung, K. Raahemifar, Artificial neural network (ANN) based model predictive control (MPC) and optimization of HVAC systems: A state of the art review and case study of a residential HVAC system, Energy and Buildings. 141 (2017) 96-113. [14] Yao Y. Shekhar D.K. State of the art review on model predictive control (MPC) in heating ventilation and air-conditioning (HVAC) field Build Environ 200 2021 631 Y. Yao, D.K. Shekhar, State of the art review on model predictive control (MPC) in Heating Ventilation and Air-conditioning (HVAC) field, Building and Environment. 200 (2021) 631. [15] Yao Y. Yang K. Huang M.W. Wang L.Z. A state-space model for dynamic response of indoor air temperature and humidity Build Environ 64 2013 26 37 Y. Yao, K. Yang, M.W. Huang, L.Z. Wang, A state-space model for dynamic response of indoor air temperature and humidity, Building and Environment. 64 (2013) 26-37. [16] Huang H. Chen L. Hu E. A neural network-based multi-zone modelling approach for predictive control system design in commercial buildings Energy Build 97 2015 86 97 H. Huang, L. Chen, E. Hu, A neural network-based multi-zone modelling approach for predictive control system design in commercial buildings, Energy and Buildings. 97 (2015) 86-97. [17] Jiang Y.L. Wang X.L. Zhao H.X. Wang L. Yin X.H. Jia L. Dynamic modeling and economic model predictive control of a liquid desiccant air conditioning Appl Energy 259 2020 114174 Y.L. Jiang, X.L. Wang, H.X. Zhao, L. Wang, X.H. Yin, L. Jia, Dynamic modeling and economic model predictive control of a liquid desiccant air conditioning. Applied Energy. 259 (2020) 114174. [18] Afroz Z. Shafiullah G.M. Urmee T. Shoeb M.A. Higgins G. Predictive modelling and optimization of HVAC systems using neural network and particle swarm optimization algorithm Build Environ 209 2022 108681 Z. Afroz, G.M. Shafiullah, T. Urmee, M.A. Shoeb, G. Higgins, Predictive modelling and optimization of HVAC systems using neural network and particle swarm optimization algorithm, Building and Environment. 209(2022) 108681. [19] Hjalmarsson H. Gevers M. Iterative feedback tuning: Theory and applications IEEE Control Syst 18 1998 26 41 H. Hjalmarsson, M. Gevers. Iterative feedback tuning: Theory and Applications, IEEE Control Systems. 18(1998) 26-41. [20] Guardabassi G.O. Savaresi S.M. Virtual reference direct design method: An off-line approach to data-based control system design IEEE Trans Automat Control 45 2000 954 959 G.O. Guardabassi, S.M. Savaresi, Virtual reference direct design method: An off-line approach to data-based control system design, IEEE Transactions on Automatic Control. 45 (2000) 954-959. [21] Chi R.H. Hou Z. Jin S. Huang B. Computationally efficient data-driven higher order optimal iterative learning control IEEE Trans Neural Netw Learn Syst 29 12 2018 5971 5980 R.H. Chi, Z. Hou, S. Jin, B. Huang, Computationally Efficient Data-Driven Higher Order Optimal Iterative Learning Control. IEEE Transactions on Neural Networks and Learning Systems, 29 (12) (2018) 5971-5980. [22] Chi R.H. Hou Z. Jin S. Huang B. Constrained data-driven optimal iterative learning control J Process Control 55 2017 10 29 R.H. Chi, Z. Hou, S. Jin, B. Huang, Constrained data-driven optimal iterative learning control, Journal of Process Control. 55 (2017) 10-29. [23] Jiang YL, Zhu SY, Xu QM, Yang B, Guan XP. Building temperature and humidity adaptive control for a multi-zone HVAC system using hybrid modeling method. In: Proc. 23rd IEEE International Conference on Industrial Technology(ICIT), Shanghai, China, March, 2022, p. 28-31. [24] Hou Z.S. Chi R.H. Gao H.J. An overview of dynamic-linearization-based data-driven control and applications IEEE Trans Ind Electron 64 2017 4076 4090 Z.S. Hou, R.H. Chi, H.J. Gao, An Overview of Dynamic-Linearization-Based Data-Driven Control and Applications, IEEE Transactions on Industrial Electronics. 64 (2017) 4076-4090. [25] Chi R.H. Lv Y.K. Huang B. Distributed iterative learning temperature control for multi-zone HVAC system J Franklin Inst 357 2020 810 831 R.H. Chi, Y.K. Lv, B. Huang, Distributed iterative learning temperature control for multi-zone HVAC system, Journal of the Franklin Institute-Engineering and Applied Mathematics. 357 (2020) 810-831. [26] Vazquez-Canteli J.R. Nagy Z. Reinforcement learning for demand response: A review of algorithms and modeling techniques Appl Energy 235 2019 1072 1089 J.R. Vazquez-Canteli, Z. Nagy, Reinforcement learning for demand response: A review of algorithms and modeling techniques, Applied Energy. 235 (2019) 1072-1089. [27] Han M.J. May R. Zhang X. Wang X. Pan S. Yan D. A review of reinforcement learning methodologies for controlling occupant comfort in buildings Sustainable Cities Soc 51 2019 101748 M.J. Han, R. May, X. Zhang, X. Wang, S. Pan, D. Yan. A review of reinforcement learning methodologies for controlling occupant comfort in buildings, Sustainable Cities and Society. 51 (2019) 101748. [28] Lei Y. Zhan S.C. Ono E. Peng Y.Z. Zhang Z.A. A practical deep reinforcement learning framework for multivariate occupant-centric control in buildings Appl Energy 324 2022 119742 Y. Lei, S.C. Zhan, E. Ono, Y.Z. Peng, Z.A. Zhang, A practical deep reinforcement learning framework for multivariate occupant-centric control in buildings, Applied Energy. 324 (2022) 119742. [29] Shen R.D. Zhong S.Y. Wen X. An Q.S. Zheng R.F. Li Y. Multi-agent deep reinforcement learning optimization framework for building energy system with renewable energy Appl Energy 312 2022 118724 R.D. Shen, S.Y. Zhong, X. Wen, Q.S. An, R.F. Zheng, Y. Li, J. Zhao. Multi-agent deep reinforcement learning optimization framework for building energy system with renewable energy, Applied Energy. 312(2022) 118724. [30] Yu L. Sun Y. Xu Z. Shen C. Yue D. Multi-agent deep reinforcement learning for HVAC control in commercial buildings IEEE Trans Smart Grid 12 2021 407 419 L. Yu, Y. Sun, Z. Xu, C. Shen, D. Yue, Multi-Agent Deep Reinforcement Learning for HVAC Control in Commercial Buildings, IEEE Transactions on Smart Grid. 12 (2021) 407-419. [31] Du Y. Zandi H. Kotevska O. Kurte K. Munk J. Intelligent multi-zone residential HVAC control strategy based on deep reinforcement learning Appl Energy 281 2021 116117 Y. Du, H. Zandi, O. Kotevska, K. Kurte, J. Munk, Intelligent multi-zone residential HVAC control strategy based on deep reinforcement learning, Applied Energy. 281 (2021) 116117. [32] Killian M. Kozek M. Ten questions concerning model predictive control for energy efficient buildings Build Environ 105 2016 403 412 M. Killian, M. Kozek, Ten questions concerning model predictive control for energy efficient buildings, Building and Environment. 105 (2016) 403-412. [33] Platt G. Li J. Poulton G. James G. Wall J. Adaptive HVAC zone modeling for sustainable buildings Energy Build 4 2010 412 421 G. Platt, J. Li, G. Poulton, G. James, J. Wall, Adaptive HVAC zone modeling for sustainable buildings, Energy and Buildings. 4 (2010) 412-421. [34] Goyal S. Barooah P. A method for model-reduction of non-linear thermal dynamics of multi-zone buildings Energy Build 47 2012 332 340 S. Goyal, P. Barooah, A method for model-reduction of non-linear thermal dynamics of multi-zone buildings, Energy and Buildings. 47 (2012) 332-340. [35] Raman N.S. Chaturvedi R.U. Guo Z. Barooah P. Model predictive control-based hierarchical control of a multi-zone commercial HVAC system ASME J Eng Sustain Build Cities 2 2 2021 N.S. Raman, R.U. Chaturvedi, Z. Guo, P. Barooah. Model Predictive Control-Based Hierarchical Control of a Multi-Zone Commercial HVAC System, ASME journal of Engineering for Sustainable Buildings and Cities. 2(2) (2021). [36] Mantovani G. Ferrarini L. Temperature control of a commercial building with model predictive control techniques IEEE Trans Ind Electron 62 2015 2651 2660 G. Mantovani, L. Ferrarini, Temperature Control of a Commercial Building With Model Predictive Control Techniques, IEEE Transactions on Industrial Electronics. 62 (2015) 2651-2660. [37] Coffman A.R. Barooah P. Simultaneous identification of dynamic model and occupant-induced disturbance for commercial buildings Build Environ 128 2018 153 160 A.R. Coffman, P. Barooah, Simultaneous identification of dynamic model and occupant-induced disturbance for commercial buildings, Building and Environment. 128(2018) 153-160. [38] Guo Z. Coffman A.R. Munk J. Im P. Kuruganti T. Barooah P. Aggregation and data driven identification of building thermal dynamic model and unmeasured disturbance Energy Build 231 2021 110500 Z. Guo, A.R. Coffman, J. Munk, P. Im, T. Kuruganti, P Barooah, Aggregation and data driven identification of building thermal dynamic model and unmeasured disturbance, Energy and Buildings. 231(2021), 110500 [39] Zhuang C. Wang S. Tang R. Optimal design of multi-zone air-conditioning systems for buildings requiring strict humidity control Energy Procedia 158 2019 3202 3207 C. Zhuang, S. Wang, R. Tang, Optimal Design of Multi-zone Air-conditioning Systems for Buildings Requiring Strict Humidity Control, Energy Procedia. 158 (2019) 3202-3207. [40] Zheng P.P. Wang C.X. Liu Y.C. Lin B.R. Wu H.J. Zhou X.Q. Thermal adaptive behavior and thermal comfort for occupants in multi-person offices with air-conditioning systems Build Environ 207 2022 108432 P.P. Zheng, C.X. Wang, Y.C. Liu, B.R. Lin, H.J. Wu, X.Q. Zhou, Thermal adaptive behavior and thermal comfort for occupants in multi-person offices with air-conditioning systems, Building and Environment. 207(2022) 108432. [41] Lymperopoulos G. Ioannou P. Building temperature regulation in a multi-zone HVAC system using distributed adaptive control Energy Build 215 2020 109825 G. Lymperopoulos, P. Ioannou, Building temperature regulation in a multi-zone HVAC system using distributed adaptive control, Energy and Buildings. 215 (2020) 109825. [42] Hou Z.S. Jin S.T. Model free adaptive control 2013 CRC Press Boca Raton, FL Z.S. Hou, S.T. Jin. Model Free Adaptive Control. Boca Raton, FL: CRC Press. (2013).",
    "scopus-id": "85146918639",
    "coredata": {
        "eid": "1-s2.0-S0306261922018797",
        "dc:description": "In this paper, we study multi-zone air environment comfort and building energy conversation for the heating, ventilation, and air conditioning (HVAC) system. Each zone is equipped with the air-handling unit (AHU) and fan coil unit to regulate the supply air state for comfortable zone climate. It is known that the multi-zone air environment appears spatial and temporal variation due to the hygro-thermal interaction which is an extremely complex nonlinear dynamic process. In this study, hybrid models incorporating the first-principles model with full form dynamic linearization (FFDL)-based data-driven model have been proposed to precisely describe the multi-zone climate dynamics including unknown nonlinearity and uncertainty. Then model-free adaptive control (MFAC) scheme is designed for multi-zone climate control, which contains controller design, parameter estimation and reset mechanism to ensure system control performance. Finally, different case studies are conducted to test the performance of model prediction and system control for the multi-zone climate environment. Model validation shows that the zone climate prediction of the proposed hybrid model shows better agreement with actual measured data. The step response results display that the hybrid model-based MFAC can realize multi-zone climate control performance improvement in faster convergence without stable bias. By comparing with prior work, the hybrid model-based MFAC has the potential to get closer to actual situation in cost-effective multi-zone climate control.",
        "openArchiveArticle": "false",
        "prism:coverDate": "2023-03-15",
        "openaccessUserLicense": null,
        "prism:aggregationType": "Journal",
        "prism:url": "https://api.elsevier.com/content/article/pii/S0306261922018797",
        "dc:creator": [
            {
                "@_fa": "true",
                "$": "Jiang, Yuliang"
            },
            {
                "@_fa": "true",
                "$": "Zhu, Shanying"
            },
            {
                "@_fa": "true",
                "$": "Xu, Qimin"
            },
            {
                "@_fa": "true",
                "$": "Yang, Bo"
            },
            {
                "@_fa": "true",
                "$": "Guan, Xinping"
            }
        ],
        "link": [
            {
                "@_fa": "true",
                "@rel": "self",
                "@href": "https://api.elsevier.com/content/article/pii/S0306261922018797"
            },
            {
                "@_fa": "true",
                "@rel": "scidir",
                "@href": "https://www.sciencedirect.com/science/article/pii/S0306261922018797"
            }
        ],
        "dc:format": "application/json",
        "openaccessType": null,
        "pii": "S0306-2619(22)01879-7",
        "prism:volume": "334",
        "articleNumber": "120622",
        "prism:publisher": "Elsevier Ltd.",
        "dc:title": "Hybrid modeling-based temperature and humidity adaptive control for a multi-zone HVAC system",
        "prism:copyright": "© 2023 Elsevier Ltd. All rights reserved.",
        "openaccess": "0",
        "prism:issn": "03062619",
        "dcterms:subject": [
            {
                "@_fa": "true",
                "$": "Multi-zone HVAC system"
            },
            {
                "@_fa": "true",
                "$": "Hygro-thermal interaction"
            },
            {
                "@_fa": "true",
                "$": "Hybrid modeling"
            },
            {
                "@_fa": "true",
                "$": "Full form dynamic linearization"
            },
            {
                "@_fa": "true",
                "$": "Adaptive control"
            }
        ],
        "openaccessArticle": "false",
        "prism:publicationName": "Applied Energy",
        "openaccessSponsorType": null,
        "prism:pageRange": "120622",
        "pubType": "fla",
        "prism:coverDisplayDate": "15 March 2023",
        "prism:doi": "10.1016/j.apenergy.2022.120622",
        "prism:startingPage": "120622",
        "dc:identifier": "doi:10.1016/j.apenergy.2022.120622",
        "openaccessSponsorName": null
    },
    "objects": {"object": [
        {
            "@category": "standard",
            "@height": "330",
            "@width": "489",
            "@_fa": "true",
            "$": "https://api.elsevier.com/content/object/eid/1-s2.0-S0306261922018797-gr2.jpg?httpAccept=%2A%2F%2A",
            "@multimediatype": "JPEG image file",
            "@type": "IMAGE-DOWNSAMPLED",
            "@size": "140487",
            "@ref": "gr2",
            "@mimetype": "image/jpeg"
        },
        {
            "@category": "standard",
            "@height": "339",
            "@width": "489",
            "@_fa": "true",
            "$": "https://api.elsevier.com/content/object/eid/1-s2.0-S0306261922018797-gr1.jpg?httpAccept=%2A%2F%2A",
            "@multimediatype": "JPEG image file",
            "@type": "IMAGE-DOWNSAMPLED",
            "@size": "109967",
            "@ref": "gr1",
            "@mimetype": "image/jpeg"
        },
        {
            "@category": "standard",
            "@height": "829",
            "@width": "706",
            "@_fa": "true",
            "$": "https://api.elsevier.com/content/object/eid/1-s2.0-S0306261922018797-gr4.jpg?httpAccept=%2A%2F%2A",
            "@multimediatype": "JPEG image file",
            "@type": "IMAGE-DOWNSAMPLED",
            "@size": "240508",
            "@ref": "gr4",
            "@mimetype": "image/jpeg"
        },
        {
            "@category": "standard",
            "@height": "232",
            "@width": "817",
            "@_fa": "true",
            "$": "https://api.elsevier.com/content/object/eid/1-s2.0-S0306261922018797-fx1001.jpg?httpAccept=%2A%2F%2A",
            "@multimediatype": "JPEG image file",
            "@type": "IMAGE-DOWNSAMPLED",
            "@size": "101722",
            "@ref": "fx1001",
            "@mimetype": "image/jpeg"
        },
        {
            "@category": "standard",
            "@height": "334",
            "@width": "678",
            "@_fa": "true",
            "$": "https://api.elsevier.com/content/object/eid/1-s2.0-S0306261922018797-gr3.jpg?httpAccept=%2A%2F%2A",
            "@multimediatype": "JPEG image file",
            "@type": "IMAGE-DOWNSAMPLED",
            "@size": "103159",
            "@ref": "gr3",
            "@mimetype": "image/jpeg"
        },
        {
            "@category": "standard",
            "@height": "507",
            "@width": "687",
            "@_fa": "true",
            "$": "https://api.elsevier.com/content/object/eid/1-s2.0-S0306261922018797-gr6.jpg?httpAccept=%2A%2F%2A",
            "@multimediatype": "JPEG image file",
            "@type": "IMAGE-DOWNSAMPLED",
            "@size": "142796",
            "@ref": "gr6",
            "@mimetype": "image/jpeg"
        },
        {
            "@category": "standard",
            "@height": "904",
            "@width": "622",
            "@_fa": "true",
            "$": "https://api.elsevier.com/content/object/eid/1-s2.0-S0306261922018797-gr5.jpg?httpAccept=%2A%2F%2A",
            "@multimediatype": "JPEG image file",
            "@type": "IMAGE-DOWNSAMPLED",
            "@size": "183517",
            "@ref": "gr5",
            "@mimetype": "image/jpeg"
        },
        {
            "@category": "standard",
            "@height": "519",
            "@width": "357",
            "@_fa": "true",
            "$": "https://api.elsevier.com/content/object/eid/1-s2.0-S0306261922018797-gr8.jpg?httpAccept=%2A%2F%2A",
            "@multimediatype": "JPEG image file",
            "@type": "IMAGE-DOWNSAMPLED",
            "@size": "134241",
            "@ref": "gr8",
            "@mimetype": "image/jpeg"
        },
        {
            "@category": "standard",
            "@height": "303",
            "@width": "706",
            "@_fa": "true",
            "$": "https://api.elsevier.com/content/object/eid/1-s2.0-S0306261922018797-gr7.jpg?httpAccept=%2A%2F%2A",
            "@multimediatype": "JPEG image file",
            "@type": "IMAGE-DOWNSAMPLED",
            "@size": "104313",
            "@ref": "gr7",
            "@mimetype": "image/jpeg"
        },
        {
            "@category": "thumbnail",
            "@height": "148",
            "@width": "219",
            "@_fa": "true",
            "$": "https://api.elsevier.com/content/object/eid/1-s2.0-S0306261922018797-gr2.sml?httpAccept=%2A%2F%2A",
            "@multimediatype": "GIF image file",
            "@type": "IMAGE-THUMBNAIL",
            "@size": "83667",
            "@ref": "gr2",
            "@mimetype": "image/gif"
        },
        {
            "@category": "thumbnail",
            "@height": "152",
            "@width": "219",
            "@_fa": "true",
            "$": "https://api.elsevier.com/content/object/eid/1-s2.0-S0306261922018797-gr1.sml?httpAccept=%2A%2F%2A",
            "@multimediatype": "GIF image file",
            "@type": "IMAGE-THUMBNAIL",
            "@size": "75968",
            "@ref": "gr1",
            "@mimetype": "image/gif"
        },
        {
            "@category": "thumbnail",
            "@height": "163",
            "@width": "139",
            "@_fa": "true",
            "$": "https://api.elsevier.com/content/object/eid/1-s2.0-S0306261922018797-gr4.sml?httpAccept=%2A%2F%2A",
            "@multimediatype": "GIF image file",
            "@type": "IMAGE-THUMBNAIL",
            "@size": "78384",
            "@ref": "gr4",
            "@mimetype": "image/gif"
        },
        {
            "@category": "thumbnail",
            "@height": "62",
            "@width": "219",
            "@_fa": "true",
            "$": "https://api.elsevier.com/content/object/eid/1-s2.0-S0306261922018797-fx1001.sml?httpAccept=%2A%2F%2A",
            "@multimediatype": "GIF image file",
            "@type": "IMAGE-THUMBNAIL",
            "@size": "68589",
            "@ref": "fx1001",
            "@mimetype": "image/gif"
        },
        {
            "@category": "thumbnail",
            "@height": "108",
            "@width": "219",
            "@_fa": "true",
            "$": "https://api.elsevier.com/content/object/eid/1-s2.0-S0306261922018797-gr3.sml?httpAccept=%2A%2F%2A",
            "@multimediatype": "GIF image file",
            "@type": "IMAGE-THUMBNAIL",
            "@size": "71551",
            "@ref": "gr3",
            "@mimetype": "image/gif"
        },
        {
            "@category": "thumbnail",
            "@height": "161",
            "@width": "219",
            "@_fa": "true",
            "$": "https://api.elsevier.com/content/object/eid/1-s2.0-S0306261922018797-gr6.sml?httpAccept=%2A%2F%2A",
            "@multimediatype": "GIF image file",
            "@type": "IMAGE-THUMBNAIL",
            "@size": "74663",
            "@ref": "gr6",
            "@mimetype": "image/gif"
        },
        {
            "@category": "thumbnail",
            "@height": "164",
            "@width": "113",
            "@_fa": "true",
            "$": "https://api.elsevier.com/content/object/eid/1-s2.0-S0306261922018797-gr5.sml?httpAccept=%2A%2F%2A",
            "@multimediatype": "GIF image file",
            "@type": "IMAGE-THUMBNAIL",
            "@size": "73521",
            "@ref": "gr5",
            "@mimetype": "image/gif"
        },
        {
            "@category": "thumbnail",
            "@height": "163",
            "@width": "112",
            "@_fa": "true",
            "$": "https://api.elsevier.com/content/object/eid/1-s2.0-S0306261922018797-gr8.sml?httpAccept=%2A%2F%2A",
            "@multimediatype": "GIF image file",
            "@type": "IMAGE-THUMBNAIL",
            "@size": "75387",
            "@ref": "gr8",
            "@mimetype": "image/gif"
        },
        {
            "@category": "thumbnail",
            "@height": "94",
            "@width": "219",
            "@_fa": "true",
            "$": "https://api.elsevier.com/content/object/eid/1-s2.0-S0306261922018797-gr7.sml?httpAccept=%2A%2F%2A",
            "@multimediatype": "GIF image file",
            "@type": "IMAGE-THUMBNAIL",
            "@size": "72669",
            "@ref": "gr7",
            "@mimetype": "image/gif"
        },
        {
            "@category": "high",
            "@height": "1463",
            "@width": "2167",
            "@_fa": "true",
            "$": "https://api.elsevier.com/content/object/eid/1-s2.0-S0306261922018797-gr2_lrg.jpg?httpAccept=%2A%2F%2A",
            "@multimediatype": "JPEG image file",
            "@type": "IMAGE-HIGH-RES",
            "@size": "552815",
            "@ref": "gr2",
            "@mimetype": "image/jpeg"
        },
        {
            "@category": "high",
            "@height": "1503",
            "@width": "2167",
            "@_fa": "true",
            "$": "https://api.elsevier.com/content/object/eid/1-s2.0-S0306261922018797-gr1_lrg.jpg?httpAccept=%2A%2F%2A",
            "@multimediatype": "JPEG image file",
            "@type": "IMAGE-HIGH-RES",
            "@size": "344275",
            "@ref": "gr1",
            "@mimetype": "image/jpeg"
        },
        {
            "@category": "high",
            "@height": "3673",
            "@width": "3127",
            "@_fa": "true",
            "$": "https://api.elsevier.com/content/object/eid/1-s2.0-S0306261922018797-gr4_lrg.jpg?httpAccept=%2A%2F%2A",
            "@multimediatype": "JPEG image file",
            "@type": "IMAGE-HIGH-RES",
            "@size": "1451746",
            "@ref": "gr4",
            "@mimetype": "image/jpeg"
        },
        {
            "@category": "high",
            "@height": "1028",
            "@width": "3618",
            "@_fa": "true",
            "$": "https://api.elsevier.com/content/object/eid/1-s2.0-S0306261922018797-fx1001_lrg.jpg?httpAccept=%2A%2F%2A",
            "@multimediatype": "JPEG image file",
            "@type": "IMAGE-HIGH-RES",
            "@size": "351966",
            "@ref": "fx1001",
            "@mimetype": "image/jpeg"
        },
        {
            "@category": "high",
            "@height": "1480",
            "@width": "3000",
            "@_fa": "true",
            "$": "https://api.elsevier.com/content/object/eid/1-s2.0-S0306261922018797-gr3_lrg.jpg?httpAccept=%2A%2F%2A",
            "@multimediatype": "JPEG image file",
            "@type": "IMAGE-HIGH-RES",
            "@size": "335282",
            "@ref": "gr3",
            "@mimetype": "image/jpeg"
        },
        {
            "@category": "high",
            "@height": "2243",
            "@width": "3042",
            "@_fa": "true",
            "$": "https://api.elsevier.com/content/object/eid/1-s2.0-S0306261922018797-gr6_lrg.jpg?httpAccept=%2A%2F%2A",
            "@multimediatype": "JPEG image file",
            "@type": "IMAGE-HIGH-RES",
            "@size": "601139",
            "@ref": "gr6",
            "@mimetype": "image/jpeg"
        },
        {
            "@category": "high",
            "@height": "4000",
            "@width": "2753",
            "@_fa": "true",
            "$": "https://api.elsevier.com/content/object/eid/1-s2.0-S0306261922018797-gr5_lrg.jpg?httpAccept=%2A%2F%2A",
            "@multimediatype": "JPEG image file",
            "@type": "IMAGE-HIGH-RES",
            "@size": "1028678",
            "@ref": "gr5",
            "@mimetype": "image/jpeg"
        },
        {
            "@category": "high",
            "@height": "2303",
            "@width": "1584",
            "@_fa": "true",
            "$": "https://api.elsevier.com/content/object/eid/1-s2.0-S0306261922018797-gr8_lrg.jpg?httpAccept=%2A%2F%2A",
            "@multimediatype": "JPEG image file",
            "@type": "IMAGE-HIGH-RES",
            "@size": "549287",
            "@ref": "gr8",
            "@mimetype": "image/jpeg"
        },
        {
            "@category": "high",
            "@height": "1342",
            "@width": "3125",
            "@_fa": "true",
            "$": "https://api.elsevier.com/content/object/eid/1-s2.0-S0306261922018797-gr7_lrg.jpg?httpAccept=%2A%2F%2A",
            "@multimediatype": "JPEG image file",
            "@type": "IMAGE-HIGH-RES",
            "@size": "328247",
            "@ref": "gr7",
            "@mimetype": "image/jpeg"
        },
        {
            "@category": "thumbnail",
            "@_fa": "true",
            "$": "https://api.elsevier.com/content/object/eid/1-s2.0-S0306261922018797-si1.svg?httpAccept=%2A%2F%2A",
            "@multimediatype": "Scalable Vector Graphics file",
            "@type": "ALTIMG",
            "@size": "3049",
            "@ref": "si1",
            "@mimetype": "image/svg+xml"
        },
        {
            "@category": "thumbnail",
            "@_fa": "true",
            "$": "https://api.elsevier.com/content/object/eid/1-s2.0-S0306261922018797-si10.svg?httpAccept=%2A%2F%2A",
            "@multimediatype": "Scalable Vector Graphics file",
            "@type": "ALTIMG",
            "@size": "6033",
            "@ref": "si10",
            "@mimetype": "image/svg+xml"
        },
        {
            "@category": "thumbnail",
            "@_fa": "true",
            "$": "https://api.elsevier.com/content/object/eid/1-s2.0-S0306261922018797-si101.svg?httpAccept=%2A%2F%2A",
            "@multimediatype": "Scalable Vector Graphics file",
            "@type": "ALTIMG",
            "@size": "1874",
            "@ref": "si101",
            "@mimetype": "image/svg+xml"
        },
        {
            "@category": "thumbnail",
            "@_fa": "true",
            "$": "https://api.elsevier.com/content/object/eid/1-s2.0-S0306261922018797-si103.svg?httpAccept=%2A%2F%2A",
            "@multimediatype": "Scalable Vector Graphics file",
            "@type": "ALTIMG",
            "@size": "2308",
            "@ref": "si103",
            "@mimetype": "image/svg+xml"
        },
        {
            "@category": "thumbnail",
            "@_fa": "true",
            "$": "https://api.elsevier.com/content/object/eid/1-s2.0-S0306261922018797-si106.svg?httpAccept=%2A%2F%2A",
            "@multimediatype": "Scalable Vector Graphics file",
            "@type": "ALTIMG",
            "@size": "4332",
            "@ref": "si106",
            "@mimetype": "image/svg+xml"
        },
        {
            "@category": "thumbnail",
            "@_fa": "true",
            "$": "https://api.elsevier.com/content/object/eid/1-s2.0-S0306261922018797-si109.svg?httpAccept=%2A%2F%2A",
            "@multimediatype": "Scalable Vector Graphics file",
            "@type": "ALTIMG",
            "@size": "4481",
            "@ref": "si109",
            "@mimetype": "image/svg+xml"
        },
        {
            "@category": "thumbnail",
            "@_fa": "true",
            "$": "https://api.elsevier.com/content/object/eid/1-s2.0-S0306261922018797-si113.svg?httpAccept=%2A%2F%2A",
            "@multimediatype": "Scalable Vector Graphics file",
            "@type": "ALTIMG",
            "@size": "2108",
            "@ref": "si113",
            "@mimetype": "image/svg+xml"
        },
        {
            "@category": "thumbnail",
            "@_fa": "true",
            "$": "https://api.elsevier.com/content/object/eid/1-s2.0-S0306261922018797-si115.svg?httpAccept=%2A%2F%2A",
            "@multimediatype": "Scalable Vector Graphics file",
            "@type": "ALTIMG",
            "@size": "3076",
            "@ref": "si115",
            "@mimetype": "image/svg+xml"
        },
        {
            "@category": "thumbnail",
            "@_fa": "true",
            "$": "https://api.elsevier.com/content/object/eid/1-s2.0-S0306261922018797-si116.svg?httpAccept=%2A%2F%2A",
            "@multimediatype": "Scalable Vector Graphics file",
            "@type": "ALTIMG",
            "@size": "2454",
            "@ref": "si116",
            "@mimetype": "image/svg+xml"
        },
        {
            "@category": "thumbnail",
            "@_fa": "true",
            "$": "https://api.elsevier.com/content/object/eid/1-s2.0-S0306261922018797-si118.svg?httpAccept=%2A%2F%2A",
            "@multimediatype": "Scalable Vector Graphics file",
            "@type": "ALTIMG",
            "@size": "4580",
            "@ref": "si118",
            "@mimetype": "image/svg+xml"
        },
        {
            "@category": "thumbnail",
            "@_fa": "true",
            "$": "https://api.elsevier.com/content/object/eid/1-s2.0-S0306261922018797-si12.svg?httpAccept=%2A%2F%2A",
            "@multimediatype": "Scalable Vector Graphics file",
            "@type": "ALTIMG",
            "@size": "22009",
            "@ref": "si12",
            "@mimetype": "image/svg+xml"
        },
        {
            "@category": "thumbnail",
            "@_fa": "true",
            "$": "https://api.elsevier.com/content/object/eid/1-s2.0-S0306261922018797-si120.svg?httpAccept=%2A%2F%2A",
            "@multimediatype": "Scalable Vector Graphics file",
            "@type": "ALTIMG",
            "@size": "2556",
            "@ref": "si120",
            "@mimetype": "image/svg+xml"
        },
        {
            "@category": "thumbnail",
            "@_fa": "true",
            "$": "https://api.elsevier.com/content/object/eid/1-s2.0-S0306261922018797-si122.svg?httpAccept=%2A%2F%2A",
            "@multimediatype": "Scalable Vector Graphics file",
            "@type": "ALTIMG",
            "@size": "2139",
            "@ref": "si122",
            "@mimetype": "image/svg+xml"
        },
        {
            "@category": "thumbnail",
            "@_fa": "true",
            "$": "https://api.elsevier.com/content/object/eid/1-s2.0-S0306261922018797-si124.svg?httpAccept=%2A%2F%2A",
            "@multimediatype": "Scalable Vector Graphics file",
            "@type": "ALTIMG",
            "@size": "23527",
            "@ref": "si124",
            "@mimetype": "image/svg+xml"
        },
        {
            "@category": "thumbnail",
            "@_fa": "true",
            "$": "https://api.elsevier.com/content/object/eid/1-s2.0-S0306261922018797-si125.svg?httpAccept=%2A%2F%2A",
            "@multimediatype": "Scalable Vector Graphics file",
            "@type": "ALTIMG",
            "@size": "24206",
            "@ref": "si125",
            "@mimetype": "image/svg+xml"
        },
        {
            "@category": "thumbnail",
            "@_fa": "true",
            "$": "https://api.elsevier.com/content/object/eid/1-s2.0-S0306261922018797-si127.svg?httpAccept=%2A%2F%2A",
            "@multimediatype": "Scalable Vector Graphics file",
            "@type": "ALTIMG",
            "@size": "27093",
            "@ref": "si127",
            "@mimetype": "image/svg+xml"
        },
        {
            "@category": "thumbnail",
            "@_fa": "true",
            "$": "https://api.elsevier.com/content/object/eid/1-s2.0-S0306261922018797-si128.svg?httpAccept=%2A%2F%2A",
            "@multimediatype": "Scalable Vector Graphics file",
            "@type": "ALTIMG",
            "@size": "27923",
            "@ref": "si128",
            "@mimetype": "image/svg+xml"
        },
        {
            "@category": "thumbnail",
            "@_fa": "true",
            "$": "https://api.elsevier.com/content/object/eid/1-s2.0-S0306261922018797-si129.svg?httpAccept=%2A%2F%2A",
            "@multimediatype": "Scalable Vector Graphics file",
            "@type": "ALTIMG",
            "@size": "17375",
            "@ref": "si129",
            "@mimetype": "image/svg+xml"
        },
        {
            "@category": "thumbnail",
            "@_fa": "true",
            "$": "https://api.elsevier.com/content/object/eid/1-s2.0-S0306261922018797-si13.svg?httpAccept=%2A%2F%2A",
            "@multimediatype": "Scalable Vector Graphics file",
            "@type": "ALTIMG",
            "@size": "18268",
            "@ref": "si13",
            "@mimetype": "image/svg+xml"
        },
        {
            "@category": "thumbnail",
            "@_fa": "true",
            "$": "https://api.elsevier.com/content/object/eid/1-s2.0-S0306261922018797-si130.svg?httpAccept=%2A%2F%2A",
            "@multimediatype": "Scalable Vector Graphics file",
            "@type": "ALTIMG",
            "@size": "17692",
            "@ref": "si130",
            "@mimetype": "image/svg+xml"
        },
        {
            "@category": "thumbnail",
            "@_fa": "true",
            "$": "https://api.elsevier.com/content/object/eid/1-s2.0-S0306261922018797-si131.svg?httpAccept=%2A%2F%2A",
            "@multimediatype": "Scalable Vector Graphics file",
            "@type": "ALTIMG",
            "@size": "21791",
            "@ref": "si131",
            "@mimetype": "image/svg+xml"
        },
        {
            "@category": "thumbnail",
            "@_fa": "true",
            "$": "https://api.elsevier.com/content/object/eid/1-s2.0-S0306261922018797-si132.svg?httpAccept=%2A%2F%2A",
            "@multimediatype": "Scalable Vector Graphics file",
            "@type": "ALTIMG",
            "@size": "9447",
            "@ref": "si132",
            "@mimetype": "image/svg+xml"
        },
        {
            "@category": "thumbnail",
            "@_fa": "true",
            "$": "https://api.elsevier.com/content/object/eid/1-s2.0-S0306261922018797-si133.svg?httpAccept=%2A%2F%2A",
            "@multimediatype": "Scalable Vector Graphics file",
            "@type": "ALTIMG",
            "@size": "7258",
            "@ref": "si133",
            "@mimetype": "image/svg+xml"
        },
        {
            "@category": "thumbnail",
            "@_fa": "true",
            "$": "https://api.elsevier.com/content/object/eid/1-s2.0-S0306261922018797-si134.svg?httpAccept=%2A%2F%2A",
            "@multimediatype": "Scalable Vector Graphics file",
            "@type": "ALTIMG",
            "@size": "6578",
            "@ref": "si134",
            "@mimetype": "image/svg+xml"
        },
        {
            "@category": "thumbnail",
            "@_fa": "true",
            "$": "https://api.elsevier.com/content/object/eid/1-s2.0-S0306261922018797-si135.svg?httpAccept=%2A%2F%2A",
            "@multimediatype": "Scalable Vector Graphics file",
            "@type": "ALTIMG",
            "@size": "6951",
            "@ref": "si135",
            "@mimetype": "image/svg+xml"
        },
        {
            "@category": "thumbnail",
            "@_fa": "true",
            "$": "https://api.elsevier.com/content/object/eid/1-s2.0-S0306261922018797-si138.svg?httpAccept=%2A%2F%2A",
            "@multimediatype": "Scalable Vector Graphics file",
            "@type": "ALTIMG",
            "@size": "15606",
            "@ref": "si138",
            "@mimetype": "image/svg+xml"
        },
        {
            "@category": "thumbnail",
            "@_fa": "true",
            "$": "https://api.elsevier.com/content/object/eid/1-s2.0-S0306261922018797-si139.svg?httpAccept=%2A%2F%2A",
            "@multimediatype": "Scalable Vector Graphics file",
            "@type": "ALTIMG",
            "@size": "12329",
            "@ref": "si139",
            "@mimetype": "image/svg+xml"
        },
        {
            "@category": "thumbnail",
            "@_fa": "true",
            "$": "https://api.elsevier.com/content/object/eid/1-s2.0-S0306261922018797-si14.svg?httpAccept=%2A%2F%2A",
            "@multimediatype": "Scalable Vector Graphics file",
            "@type": "ALTIMG",
            "@size": "15409",
            "@ref": "si14",
            "@mimetype": "image/svg+xml"
        },
        {
            "@category": "thumbnail",
            "@_fa": "true",
            "$": "https://api.elsevier.com/content/object/eid/1-s2.0-S0306261922018797-si140.svg?httpAccept=%2A%2F%2A",
            "@multimediatype": "Scalable Vector Graphics file",
            "@type": "ALTIMG",
            "@size": "12703",
            "@ref": "si140",
            "@mimetype": "image/svg+xml"
        },
        {
            "@category": "thumbnail",
            "@_fa": "true",
            "$": "https://api.elsevier.com/content/object/eid/1-s2.0-S0306261922018797-si141.svg?httpAccept=%2A%2F%2A",
            "@multimediatype": "Scalable Vector Graphics file",
            "@type": "ALTIMG",
            "@size": "7629",
            "@ref": "si141",
            "@mimetype": "image/svg+xml"
        },
        {
            "@category": "thumbnail",
            "@_fa": "true",
            "$": "https://api.elsevier.com/content/object/eid/1-s2.0-S0306261922018797-si142.svg?httpAccept=%2A%2F%2A",
            "@multimediatype": "Scalable Vector Graphics file",
            "@type": "ALTIMG",
            "@size": "8002",
            "@ref": "si142",
            "@mimetype": "image/svg+xml"
        },
        {
            "@category": "thumbnail",
            "@_fa": "true",
            "$": "https://api.elsevier.com/content/object/eid/1-s2.0-S0306261922018797-si145.svg?httpAccept=%2A%2F%2A",
            "@multimediatype": "Scalable Vector Graphics file",
            "@type": "ALTIMG",
            "@size": "12023",
            "@ref": "si145",
            "@mimetype": "image/svg+xml"
        },
        {
            "@category": "thumbnail",
            "@_fa": "true",
            "$": "https://api.elsevier.com/content/object/eid/1-s2.0-S0306261922018797-si146.svg?httpAccept=%2A%2F%2A",
            "@multimediatype": "Scalable Vector Graphics file",
            "@type": "ALTIMG",
            "@size": "13175",
            "@ref": "si146",
            "@mimetype": "image/svg+xml"
        },
        {
            "@category": "thumbnail",
            "@_fa": "true",
            "$": "https://api.elsevier.com/content/object/eid/1-s2.0-S0306261922018797-si147.svg?httpAccept=%2A%2F%2A",
            "@multimediatype": "Scalable Vector Graphics file",
            "@type": "ALTIMG",
            "@size": "11906",
            "@ref": "si147",
            "@mimetype": "image/svg+xml"
        },
        {
            "@category": "thumbnail",
            "@_fa": "true",
            "$": "https://api.elsevier.com/content/object/eid/1-s2.0-S0306261922018797-si148.svg?httpAccept=%2A%2F%2A",
            "@multimediatype": "Scalable Vector Graphics file",
            "@type": "ALTIMG",
            "@size": "13109",
            "@ref": "si148",
            "@mimetype": "image/svg+xml"
        },
        {
            "@category": "thumbnail",
            "@_fa": "true",
            "$": "https://api.elsevier.com/content/object/eid/1-s2.0-S0306261922018797-si149.svg?httpAccept=%2A%2F%2A",
            "@multimediatype": "Scalable Vector Graphics file",
            "@type": "ALTIMG",
            "@size": "5253",
            "@ref": "si149",
            "@mimetype": "image/svg+xml"
        },
        {
            "@category": "thumbnail",
            "@_fa": "true",
            "$": "https://api.elsevier.com/content/object/eid/1-s2.0-S0306261922018797-si150.svg?httpAccept=%2A%2F%2A",
            "@multimediatype": "Scalable Vector Graphics file",
            "@type": "ALTIMG",
            "@size": "3976",
            "@ref": "si150",
            "@mimetype": "image/svg+xml"
        },
        {
            "@category": "thumbnail",
            "@_fa": "true",
            "$": "https://api.elsevier.com/content/object/eid/1-s2.0-S0306261922018797-si152.svg?httpAccept=%2A%2F%2A",
            "@multimediatype": "Scalable Vector Graphics file",
            "@type": "ALTIMG",
            "@size": "3700",
            "@ref": "si152",
            "@mimetype": "image/svg+xml"
        },
        {
            "@category": "thumbnail",
            "@_fa": "true",
            "$": "https://api.elsevier.com/content/object/eid/1-s2.0-S0306261922018797-si153.svg?httpAccept=%2A%2F%2A",
            "@multimediatype": "Scalable Vector Graphics file",
            "@type": "ALTIMG",
            "@size": "5414",
            "@ref": "si153",
            "@mimetype": "image/svg+xml"
        },
        {
            "@category": "thumbnail",
            "@_fa": "true",
            "$": "https://api.elsevier.com/content/object/eid/1-s2.0-S0306261922018797-si155.svg?httpAccept=%2A%2F%2A",
            "@multimediatype": "Scalable Vector Graphics file",
            "@type": "ALTIMG",
            "@size": "22952",
            "@ref": "si155",
            "@mimetype": "image/svg+xml"
        },
        {
            "@category": "thumbnail",
            "@_fa": "true",
            "$": "https://api.elsevier.com/content/object/eid/1-s2.0-S0306261922018797-si156.svg?httpAccept=%2A%2F%2A",
            "@multimediatype": "Scalable Vector Graphics file",
            "@type": "ALTIMG",
            "@size": "10567",
            "@ref": "si156",
            "@mimetype": "image/svg+xml"
        },
        {
            "@category": "thumbnail",
            "@_fa": "true",
            "$": "https://api.elsevier.com/content/object/eid/1-s2.0-S0306261922018797-si159.svg?httpAccept=%2A%2F%2A",
            "@multimediatype": "Scalable Vector Graphics file",
            "@type": "ALTIMG",
            "@size": "3337",
            "@ref": "si159",
            "@mimetype": "image/svg+xml"
        },
        {
            "@category": "thumbnail",
            "@_fa": "true",
            "$": "https://api.elsevier.com/content/object/eid/1-s2.0-S0306261922018797-si16.svg?httpAccept=%2A%2F%2A",
            "@multimediatype": "Scalable Vector Graphics file",
            "@type": "ALTIMG",
            "@size": "18032",
            "@ref": "si16",
            "@mimetype": "image/svg+xml"
        },
        {
            "@category": "thumbnail",
            "@_fa": "true",
            "$": "https://api.elsevier.com/content/object/eid/1-s2.0-S0306261922018797-si160.svg?httpAccept=%2A%2F%2A",
            "@multimediatype": "Scalable Vector Graphics file",
            "@type": "ALTIMG",
            "@size": "3612",
            "@ref": "si160",
            "@mimetype": "image/svg+xml"
        },
        {
            "@category": "thumbnail",
            "@_fa": "true",
            "$": "https://api.elsevier.com/content/object/eid/1-s2.0-S0306261922018797-si161.svg?httpAccept=%2A%2F%2A",
            "@multimediatype": "Scalable Vector Graphics file",
            "@type": "ALTIMG",
            "@size": "8770",
            "@ref": "si161",
            "@mimetype": "image/svg+xml"
        },
        {
            "@category": "thumbnail",
            "@_fa": "true",
            "$": "https://api.elsevier.com/content/object/eid/1-s2.0-S0306261922018797-si162.svg?httpAccept=%2A%2F%2A",
            "@multimediatype": "Scalable Vector Graphics file",
            "@type": "ALTIMG",
            "@size": "6836",
            "@ref": "si162",
            "@mimetype": "image/svg+xml"
        },
        {
            "@category": "thumbnail",
            "@_fa": "true",
            "$": "https://api.elsevier.com/content/object/eid/1-s2.0-S0306261922018797-si163.svg?httpAccept=%2A%2F%2A",
            "@multimediatype": "Scalable Vector Graphics file",
            "@type": "ALTIMG",
            "@size": "20655",
            "@ref": "si163",
            "@mimetype": "image/svg+xml"
        },
        {
            "@category": "thumbnail",
            "@_fa": "true",
            "$": "https://api.elsevier.com/content/object/eid/1-s2.0-S0306261922018797-si164.svg?httpAccept=%2A%2F%2A",
            "@multimediatype": "Scalable Vector Graphics file",
            "@type": "ALTIMG",
            "@size": "7798",
            "@ref": "si164",
            "@mimetype": "image/svg+xml"
        },
        {
            "@category": "thumbnail",
            "@_fa": "true",
            "$": "https://api.elsevier.com/content/object/eid/1-s2.0-S0306261922018797-si165.svg?httpAccept=%2A%2F%2A",
            "@multimediatype": "Scalable Vector Graphics file",
            "@type": "ALTIMG",
            "@size": "6049",
            "@ref": "si165",
            "@mimetype": "image/svg+xml"
        },
        {
            "@category": "thumbnail",
            "@_fa": "true",
            "$": "https://api.elsevier.com/content/object/eid/1-s2.0-S0306261922018797-si166.svg?httpAccept=%2A%2F%2A",
            "@multimediatype": "Scalable Vector Graphics file",
            "@type": "ALTIMG",
            "@size": "6326",
            "@ref": "si166",
            "@mimetype": "image/svg+xml"
        },
        {
            "@category": "thumbnail",
            "@_fa": "true",
            "$": "https://api.elsevier.com/content/object/eid/1-s2.0-S0306261922018797-si167.svg?httpAccept=%2A%2F%2A",
            "@multimediatype": "Scalable Vector Graphics file",
            "@type": "ALTIMG",
            "@size": "8198",
            "@ref": "si167",
            "@mimetype": "image/svg+xml"
        },
        {
            "@category": "thumbnail",
            "@_fa": "true",
            "$": "https://api.elsevier.com/content/object/eid/1-s2.0-S0306261922018797-si168.svg?httpAccept=%2A%2F%2A",
            "@multimediatype": "Scalable Vector Graphics file",
            "@type": "ALTIMG",
            "@size": "13889",
            "@ref": "si168",
            "@mimetype": "image/svg+xml"
        },
        {
            "@category": "thumbnail",
            "@_fa": "true",
            "$": "https://api.elsevier.com/content/object/eid/1-s2.0-S0306261922018797-si169.svg?httpAccept=%2A%2F%2A",
            "@multimediatype": "Scalable Vector Graphics file",
            "@type": "ALTIMG",
            "@size": "11959",
            "@ref": "si169",
            "@mimetype": "image/svg+xml"
        },
        {
            "@category": "thumbnail",
            "@_fa": "true",
            "$": "https://api.elsevier.com/content/object/eid/1-s2.0-S0306261922018797-si170.svg?httpAccept=%2A%2F%2A",
            "@multimediatype": "Scalable Vector Graphics file",
            "@type": "ALTIMG",
            "@size": "9608",
            "@ref": "si170",
            "@mimetype": "image/svg+xml"
        },
        {
            "@category": "thumbnail",
            "@_fa": "true",
            "$": "https://api.elsevier.com/content/object/eid/1-s2.0-S0306261922018797-si171.svg?httpAccept=%2A%2F%2A",
            "@multimediatype": "Scalable Vector Graphics file",
            "@type": "ALTIMG",
            "@size": "8845",
            "@ref": "si171",
            "@mimetype": "image/svg+xml"
        },
        {
            "@category": "thumbnail",
            "@_fa": "true",
            "$": "https://api.elsevier.com/content/object/eid/1-s2.0-S0306261922018797-si172.svg?httpAccept=%2A%2F%2A",
            "@multimediatype": "Scalable Vector Graphics file",
            "@type": "ALTIMG",
            "@size": "15831",
            "@ref": "si172",
            "@mimetype": "image/svg+xml"
        },
        {
            "@category": "thumbnail",
            "@_fa": "true",
            "$": "https://api.elsevier.com/content/object/eid/1-s2.0-S0306261922018797-si173.svg?httpAccept=%2A%2F%2A",
            "@multimediatype": "Scalable Vector Graphics file",
            "@type": "ALTIMG",
            "@size": "13510",
            "@ref": "si173",
            "@mimetype": "image/svg+xml"
        },
        {
            "@category": "thumbnail",
            "@_fa": "true",
            "$": "https://api.elsevier.com/content/object/eid/1-s2.0-S0306261922018797-si176.svg?httpAccept=%2A%2F%2A",
            "@multimediatype": "Scalable Vector Graphics file",
            "@type": "ALTIMG",
            "@size": "9558",
            "@ref": "si176",
            "@mimetype": "image/svg+xml"
        },
        {
            "@category": "thumbnail",
            "@_fa": "true",
            "$": "https://api.elsevier.com/content/object/eid/1-s2.0-S0306261922018797-si177.svg?httpAccept=%2A%2F%2A",
            "@multimediatype": "Scalable Vector Graphics file",
            "@type": "ALTIMG",
            "@size": "13233",
            "@ref": "si177",
            "@mimetype": "image/svg+xml"
        },
        {
            "@category": "thumbnail",
            "@_fa": "true",
            "$": "https://api.elsevier.com/content/object/eid/1-s2.0-S0306261922018797-si179.svg?httpAccept=%2A%2F%2A",
            "@multimediatype": "Scalable Vector Graphics file",
            "@type": "ALTIMG",
            "@size": "27902",
            "@ref": "si179",
            "@mimetype": "image/svg+xml"
        },
        {
            "@category": "thumbnail",
            "@_fa": "true",
            "$": "https://api.elsevier.com/content/object/eid/1-s2.0-S0306261922018797-si18.svg?httpAccept=%2A%2F%2A",
            "@multimediatype": "Scalable Vector Graphics file",
            "@type": "ALTIMG",
            "@size": "18454",
            "@ref": "si18",
            "@mimetype": "image/svg+xml"
        },
        {
            "@category": "thumbnail",
            "@_fa": "true",
            "$": "https://api.elsevier.com/content/object/eid/1-s2.0-S0306261922018797-si180.svg?httpAccept=%2A%2F%2A",
            "@multimediatype": "Scalable Vector Graphics file",
            "@type": "ALTIMG",
            "@size": "5906",
            "@ref": "si180",
            "@mimetype": "image/svg+xml"
        },
        {
            "@category": "thumbnail",
            "@_fa": "true",
            "$": "https://api.elsevier.com/content/object/eid/1-s2.0-S0306261922018797-si181.svg?httpAccept=%2A%2F%2A",
            "@multimediatype": "Scalable Vector Graphics file",
            "@type": "ALTIMG",
            "@size": "17104",
            "@ref": "si181",
            "@mimetype": "image/svg+xml"
        },
        {
            "@category": "thumbnail",
            "@_fa": "true",
            "$": "https://api.elsevier.com/content/object/eid/1-s2.0-S0306261922018797-si182.svg?httpAccept=%2A%2F%2A",
            "@multimediatype": "Scalable Vector Graphics file",
            "@type": "ALTIMG",
            "@size": "15003",
            "@ref": "si182",
            "@mimetype": "image/svg+xml"
        },
        {
            "@category": "thumbnail",
            "@_fa": "true",
            "$": "https://api.elsevier.com/content/object/eid/1-s2.0-S0306261922018797-si185.svg?httpAccept=%2A%2F%2A",
            "@multimediatype": "Scalable Vector Graphics file",
            "@type": "ALTIMG",
            "@size": "10477",
            "@ref": "si185",
            "@mimetype": "image/svg+xml"
        },
        {
            "@category": "thumbnail",
            "@_fa": "true",
            "$": "https://api.elsevier.com/content/object/eid/1-s2.0-S0306261922018797-si186.svg?httpAccept=%2A%2F%2A",
            "@multimediatype": "Scalable Vector Graphics file",
            "@type": "ALTIMG",
            "@size": "9250",
            "@ref": "si186",
            "@mimetype": "image/svg+xml"
        },
        {
            "@category": "thumbnail",
            "@_fa": "true",
            "$": "https://api.elsevier.com/content/object/eid/1-s2.0-S0306261922018797-si187.svg?httpAccept=%2A%2F%2A",
            "@multimediatype": "Scalable Vector Graphics file",
            "@type": "ALTIMG",
            "@size": "8191",
            "@ref": "si187",
            "@mimetype": "image/svg+xml"
        },
        {
            "@category": "thumbnail",
            "@_fa": "true",
            "$": "https://api.elsevier.com/content/object/eid/1-s2.0-S0306261922018797-si188.svg?httpAccept=%2A%2F%2A",
            "@multimediatype": "Scalable Vector Graphics file",
            "@type": "ALTIMG",
            "@size": "7139",
            "@ref": "si188",
            "@mimetype": "image/svg+xml"
        },
        {
            "@category": "thumbnail",
            "@_fa": "true",
            "$": "https://api.elsevier.com/content/object/eid/1-s2.0-S0306261922018797-si189.svg?httpAccept=%2A%2F%2A",
            "@multimediatype": "Scalable Vector Graphics file",
            "@type": "ALTIMG",
            "@size": "8543",
            "@ref": "si189",
            "@mimetype": "image/svg+xml"
        },
        {
            "@category": "thumbnail",
            "@_fa": "true",
            "$": "https://api.elsevier.com/content/object/eid/1-s2.0-S0306261922018797-si190.svg?httpAccept=%2A%2F%2A",
            "@multimediatype": "Scalable Vector Graphics file",
            "@type": "ALTIMG",
            "@size": "7492",
            "@ref": "si190",
            "@mimetype": "image/svg+xml"
        },
        {
            "@category": "thumbnail",
            "@_fa": "true",
            "$": "https://api.elsevier.com/content/object/eid/1-s2.0-S0306261922018797-si191.svg?httpAccept=%2A%2F%2A",
            "@multimediatype": "Scalable Vector Graphics file",
            "@type": "ALTIMG",
            "@size": "11404",
            "@ref": "si191",
            "@mimetype": "image/svg+xml"
        },
        {
            "@category": "thumbnail",
            "@_fa": "true",
            "$": "https://api.elsevier.com/content/object/eid/1-s2.0-S0306261922018797-si194.svg?httpAccept=%2A%2F%2A",
            "@multimediatype": "Scalable Vector Graphics file",
            "@type": "ALTIMG",
            "@size": "14568",
            "@ref": "si194",
            "@mimetype": "image/svg+xml"
        },
        {
            "@category": "thumbnail",
            "@_fa": "true",
            "$": "https://api.elsevier.com/content/object/eid/1-s2.0-S0306261922018797-si195.svg?httpAccept=%2A%2F%2A",
            "@multimediatype": "Scalable Vector Graphics file",
            "@type": "ALTIMG",
            "@size": "15235",
            "@ref": "si195",
            "@mimetype": "image/svg+xml"
        },
        {
            "@category": "thumbnail",
            "@_fa": "true",
            "$": "https://api.elsevier.com/content/object/eid/1-s2.0-S0306261922018797-si196.svg?httpAccept=%2A%2F%2A",
            "@multimediatype": "Scalable Vector Graphics file",
            "@type": "ALTIMG",
            "@size": "11851",
            "@ref": "si196",
            "@mimetype": "image/svg+xml"
        },
        {
            "@category": "thumbnail",
            "@_fa": "true",
            "$": "https://api.elsevier.com/content/object/eid/1-s2.0-S0306261922018797-si197.svg?httpAccept=%2A%2F%2A",
            "@multimediatype": "Scalable Vector Graphics file",
            "@type": "ALTIMG",
            "@size": "12605",
            "@ref": "si197",
            "@mimetype": "image/svg+xml"
        },
        {
            "@category": "thumbnail",
            "@_fa": "true",
            "$": "https://api.elsevier.com/content/object/eid/1-s2.0-S0306261922018797-si198.svg?httpAccept=%2A%2F%2A",
            "@multimediatype": "Scalable Vector Graphics file",
            "@type": "ALTIMG",
            "@size": "10353",
            "@ref": "si198",
            "@mimetype": "image/svg+xml"
        },
        {
            "@category": "thumbnail",
            "@_fa": "true",
            "$": "https://api.elsevier.com/content/object/eid/1-s2.0-S0306261922018797-si2.svg?httpAccept=%2A%2F%2A",
            "@multimediatype": "Scalable Vector Graphics file",
            "@type": "ALTIMG",
            "@size": "3147",
            "@ref": "si2",
            "@mimetype": "image/svg+xml"
        },
        {
            "@category": "thumbnail",
            "@_fa": "true",
            "$": "https://api.elsevier.com/content/object/eid/1-s2.0-S0306261922018797-si200.svg?httpAccept=%2A%2F%2A",
            "@multimediatype": "Scalable Vector Graphics file",
            "@type": "ALTIMG",
            "@size": "7616",
            "@ref": "si200",
            "@mimetype": "image/svg+xml"
        },
        {
            "@category": "thumbnail",
            "@_fa": "true",
            "$": "https://api.elsevier.com/content/object/eid/1-s2.0-S0306261922018797-si201.svg?httpAccept=%2A%2F%2A",
            "@multimediatype": "Scalable Vector Graphics file",
            "@type": "ALTIMG",
            "@size": "1352",
            "@ref": "si201",
            "@mimetype": "image/svg+xml"
        },
        {
            "@category": "thumbnail",
            "@_fa": "true",
            "$": "https://api.elsevier.com/content/object/eid/1-s2.0-S0306261922018797-si203.svg?httpAccept=%2A%2F%2A",
            "@multimediatype": "Scalable Vector Graphics file",
            "@type": "ALTIMG",
            "@size": "2393",
            "@ref": "si203",
            "@mimetype": "image/svg+xml"
        },
        {
            "@category": "thumbnail",
            "@_fa": "true",
            "$": "https://api.elsevier.com/content/object/eid/1-s2.0-S0306261922018797-si205.svg?httpAccept=%2A%2F%2A",
            "@multimediatype": "Scalable Vector Graphics file",
            "@type": "ALTIMG",
            "@size": "6138",
            "@ref": "si205",
            "@mimetype": "image/svg+xml"
        },
        {
            "@category": "thumbnail",
            "@_fa": "true",
            "$": "https://api.elsevier.com/content/object/eid/1-s2.0-S0306261922018797-si206.svg?httpAccept=%2A%2F%2A",
            "@multimediatype": "Scalable Vector Graphics file",
            "@type": "ALTIMG",
            "@size": "19225",
            "@ref": "si206",
            "@mimetype": "image/svg+xml"
        },
        {
            "@category": "thumbnail",
            "@_fa": "true",
            "$": "https://api.elsevier.com/content/object/eid/1-s2.0-S0306261922018797-si207.svg?httpAccept=%2A%2F%2A",
            "@multimediatype": "Scalable Vector Graphics file",
            "@type": "ALTIMG",
            "@size": "25487",
            "@ref": "si207",
            "@mimetype": "image/svg+xml"
        },
        {
            "@category": "thumbnail",
            "@_fa": "true",
            "$": "https://api.elsevier.com/content/object/eid/1-s2.0-S0306261922018797-si208.svg?httpAccept=%2A%2F%2A",
            "@multimediatype": "Scalable Vector Graphics file",
            "@type": "ALTIMG",
            "@size": "28301",
            "@ref": "si208",
            "@mimetype": "image/svg+xml"
        },
        {
            "@category": "thumbnail",
            "@_fa": "true",
            "$": "https://api.elsevier.com/content/object/eid/1-s2.0-S0306261922018797-si209.svg?httpAccept=%2A%2F%2A",
            "@multimediatype": "Scalable Vector Graphics file",
            "@type": "ALTIMG",
            "@size": "15231",
            "@ref": "si209",
            "@mimetype": "image/svg+xml"
        },
        {
            "@category": "thumbnail",
            "@_fa": "true",
            "$": "https://api.elsevier.com/content/object/eid/1-s2.0-S0306261922018797-si213.svg?httpAccept=%2A%2F%2A",
            "@multimediatype": "Scalable Vector Graphics file",
            "@type": "ALTIMG",
            "@size": "7226",
            "@ref": "si213",
            "@mimetype": "image/svg+xml"
        },
        {
            "@category": "thumbnail",
            "@_fa": "true",
            "$": "https://api.elsevier.com/content/object/eid/1-s2.0-S0306261922018797-si214.svg?httpAccept=%2A%2F%2A",
            "@multimediatype": "Scalable Vector Graphics file",
            "@type": "ALTIMG",
            "@size": "6174",
            "@ref": "si214",
            "@mimetype": "image/svg+xml"
        },
        {
            "@category": "thumbnail",
            "@_fa": "true",
            "$": "https://api.elsevier.com/content/object/eid/1-s2.0-S0306261922018797-si215.svg?httpAccept=%2A%2F%2A",
            "@multimediatype": "Scalable Vector Graphics file",
            "@type": "ALTIMG",
            "@size": "9620",
            "@ref": "si215",
            "@mimetype": "image/svg+xml"
        },
        {
            "@category": "thumbnail",
            "@_fa": "true",
            "$": "https://api.elsevier.com/content/object/eid/1-s2.0-S0306261922018797-si216.svg?httpAccept=%2A%2F%2A",
            "@multimediatype": "Scalable Vector Graphics file",
            "@type": "ALTIMG",
            "@size": "8569",
            "@ref": "si216",
            "@mimetype": "image/svg+xml"
        },
        {
            "@category": "thumbnail",
            "@_fa": "true",
            "$": "https://api.elsevier.com/content/object/eid/1-s2.0-S0306261922018797-si217.svg?httpAccept=%2A%2F%2A",
            "@multimediatype": "Scalable Vector Graphics file",
            "@type": "ALTIMG",
            "@size": "9268",
            "@ref": "si217",
            "@mimetype": "image/svg+xml"
        },
        {
            "@category": "thumbnail",
            "@_fa": "true",
            "$": "https://api.elsevier.com/content/object/eid/1-s2.0-S0306261922018797-si218.svg?httpAccept=%2A%2F%2A",
            "@multimediatype": "Scalable Vector Graphics file",
            "@type": "ALTIMG",
            "@size": "8216",
            "@ref": "si218",
            "@mimetype": "image/svg+xml"
        },
        {
            "@category": "thumbnail",
            "@_fa": "true",
            "$": "https://api.elsevier.com/content/object/eid/1-s2.0-S0306261922018797-si219.svg?httpAccept=%2A%2F%2A",
            "@multimediatype": "Scalable Vector Graphics file",
            "@type": "ALTIMG",
            "@size": "6799",
            "@ref": "si219",
            "@mimetype": "image/svg+xml"
        },
        {
            "@category": "thumbnail",
            "@_fa": "true",
            "$": "https://api.elsevier.com/content/object/eid/1-s2.0-S0306261922018797-si220.svg?httpAccept=%2A%2F%2A",
            "@multimediatype": "Scalable Vector Graphics file",
            "@type": "ALTIMG",
            "@size": "5216",
            "@ref": "si220",
            "@mimetype": "image/svg+xml"
        },
        {
            "@category": "thumbnail",
            "@_fa": "true",
            "$": "https://api.elsevier.com/content/object/eid/1-s2.0-S0306261922018797-si221.svg?httpAccept=%2A%2F%2A",
            "@multimediatype": "Scalable Vector Graphics file",
            "@type": "ALTIMG",
            "@size": "6432",
            "@ref": "si221",
            "@mimetype": "image/svg+xml"
        },
        {
            "@category": "thumbnail",
            "@_fa": "true",
            "$": "https://api.elsevier.com/content/object/eid/1-s2.0-S0306261922018797-si222.svg?httpAccept=%2A%2F%2A",
            "@multimediatype": "Scalable Vector Graphics file",
            "@type": "ALTIMG",
            "@size": "9297",
            "@ref": "si222",
            "@mimetype": "image/svg+xml"
        },
        {
            "@category": "thumbnail",
            "@_fa": "true",
            "$": "https://api.elsevier.com/content/object/eid/1-s2.0-S0306261922018797-si223.svg?httpAccept=%2A%2F%2A",
            "@multimediatype": "Scalable Vector Graphics file",
            "@type": "ALTIMG",
            "@size": "7187",
            "@ref": "si223",
            "@mimetype": "image/svg+xml"
        },
        {
            "@category": "thumbnail",
            "@_fa": "true",
            "$": "https://api.elsevier.com/content/object/eid/1-s2.0-S0306261922018797-si224.svg?httpAccept=%2A%2F%2A",
            "@multimediatype": "Scalable Vector Graphics file",
            "@type": "ALTIMG",
            "@size": "6136",
            "@ref": "si224",
            "@mimetype": "image/svg+xml"
        },
        {
            "@category": "thumbnail",
            "@_fa": "true",
            "$": "https://api.elsevier.com/content/object/eid/1-s2.0-S0306261922018797-si225.svg?httpAccept=%2A%2F%2A",
            "@multimediatype": "Scalable Vector Graphics file",
            "@type": "ALTIMG",
            "@size": "7114",
            "@ref": "si225",
            "@mimetype": "image/svg+xml"
        },
        {
            "@category": "thumbnail",
            "@_fa": "true",
            "$": "https://api.elsevier.com/content/object/eid/1-s2.0-S0306261922018797-si23.svg?httpAccept=%2A%2F%2A",
            "@multimediatype": "Scalable Vector Graphics file",
            "@type": "ALTIMG",
            "@size": "2817",
            "@ref": "si23",
            "@mimetype": "image/svg+xml"
        },
        {
            "@category": "thumbnail",
            "@_fa": "true",
            "$": "https://api.elsevier.com/content/object/eid/1-s2.0-S0306261922018797-si232.svg?httpAccept=%2A%2F%2A",
            "@multimediatype": "Scalable Vector Graphics file",
            "@type": "ALTIMG",
            "@size": "15782",
            "@ref": "si232",
            "@mimetype": "image/svg+xml"
        },
        {
            "@category": "thumbnail",
            "@_fa": "true",
            "$": "https://api.elsevier.com/content/object/eid/1-s2.0-S0306261922018797-si233.svg?httpAccept=%2A%2F%2A",
            "@multimediatype": "Scalable Vector Graphics file",
            "@type": "ALTIMG",
            "@size": "13193",
            "@ref": "si233",
            "@mimetype": "image/svg+xml"
        },
        {
            "@category": "thumbnail",
            "@_fa": "true",
            "$": "https://api.elsevier.com/content/object/eid/1-s2.0-S0306261922018797-si235.svg?httpAccept=%2A%2F%2A",
            "@multimediatype": "Scalable Vector Graphics file",
            "@type": "ALTIMG",
            "@size": "14397",
            "@ref": "si235",
            "@mimetype": "image/svg+xml"
        },
        {
            "@category": "thumbnail",
            "@_fa": "true",
            "$": "https://api.elsevier.com/content/object/eid/1-s2.0-S0306261922018797-si236.svg?httpAccept=%2A%2F%2A",
            "@multimediatype": "Scalable Vector Graphics file",
            "@type": "ALTIMG",
            "@size": "11555",
            "@ref": "si236",
            "@mimetype": "image/svg+xml"
        },
        {
            "@category": "thumbnail",
            "@_fa": "true",
            "$": "https://api.elsevier.com/content/object/eid/1-s2.0-S0306261922018797-si237.svg?httpAccept=%2A%2F%2A",
            "@multimediatype": "Scalable Vector Graphics file",
            "@type": "ALTIMG",
            "@size": "3165",
            "@ref": "si237",
            "@mimetype": "image/svg+xml"
        },
        {
            "@category": "thumbnail",
            "@_fa": "true",
            "$": "https://api.elsevier.com/content/object/eid/1-s2.0-S0306261922018797-si238.svg?httpAccept=%2A%2F%2A",
            "@multimediatype": "Scalable Vector Graphics file",
            "@type": "ALTIMG",
            "@size": "3270",
            "@ref": "si238",
            "@mimetype": "image/svg+xml"
        },
        {
            "@category": "thumbnail",
            "@_fa": "true",
            "$": "https://api.elsevier.com/content/object/eid/1-s2.0-S0306261922018797-si239.svg?httpAccept=%2A%2F%2A",
            "@multimediatype": "Scalable Vector Graphics file",
            "@type": "ALTIMG",
            "@size": "7539",
            "@ref": "si239",
            "@mimetype": "image/svg+xml"
        },
        {
            "@category": "thumbnail",
            "@_fa": "true",
            "$": "https://api.elsevier.com/content/object/eid/1-s2.0-S0306261922018797-si24.svg?httpAccept=%2A%2F%2A",
            "@multimediatype": "Scalable Vector Graphics file",
            "@type": "ALTIMG",
            "@size": "3190",
            "@ref": "si24",
            "@mimetype": "image/svg+xml"
        },
        {
            "@category": "thumbnail",
            "@_fa": "true",
            "$": "https://api.elsevier.com/content/object/eid/1-s2.0-S0306261922018797-si240.svg?httpAccept=%2A%2F%2A",
            "@multimediatype": "Scalable Vector Graphics file",
            "@type": "ALTIMG",
            "@size": "6488",
            "@ref": "si240",
            "@mimetype": "image/svg+xml"
        },
        {
            "@category": "thumbnail",
            "@_fa": "true",
            "$": "https://api.elsevier.com/content/object/eid/1-s2.0-S0306261922018797-si244.svg?httpAccept=%2A%2F%2A",
            "@multimediatype": "Scalable Vector Graphics file",
            "@type": "ALTIMG",
            "@size": "19971",
            "@ref": "si244",
            "@mimetype": "image/svg+xml"
        },
        {
            "@category": "thumbnail",
            "@_fa": "true",
            "$": "https://api.elsevier.com/content/object/eid/1-s2.0-S0306261922018797-si245.svg?httpAccept=%2A%2F%2A",
            "@multimediatype": "Scalable Vector Graphics file",
            "@type": "ALTIMG",
            "@size": "17374",
            "@ref": "si245",
            "@mimetype": "image/svg+xml"
        },
        {
            "@category": "thumbnail",
            "@_fa": "true",
            "$": "https://api.elsevier.com/content/object/eid/1-s2.0-S0306261922018797-si247.svg?httpAccept=%2A%2F%2A",
            "@multimediatype": "Scalable Vector Graphics file",
            "@type": "ALTIMG",
            "@size": "18006",
            "@ref": "si247",
            "@mimetype": "image/svg+xml"
        },
        {
            "@category": "thumbnail",
            "@_fa": "true",
            "$": "https://api.elsevier.com/content/object/eid/1-s2.0-S0306261922018797-si248.svg?httpAccept=%2A%2F%2A",
            "@multimediatype": "Scalable Vector Graphics file",
            "@type": "ALTIMG",
            "@size": "15623",
            "@ref": "si248",
            "@mimetype": "image/svg+xml"
        },
        {
            "@category": "thumbnail",
            "@_fa": "true",
            "$": "https://api.elsevier.com/content/object/eid/1-s2.0-S0306261922018797-si249.svg?httpAccept=%2A%2F%2A",
            "@multimediatype": "Scalable Vector Graphics file",
            "@type": "ALTIMG",
            "@size": "6635",
            "@ref": "si249",
            "@mimetype": "image/svg+xml"
        },
        {
            "@category": "thumbnail",
            "@_fa": "true",
            "$": "https://api.elsevier.com/content/object/eid/1-s2.0-S0306261922018797-si25.svg?httpAccept=%2A%2F%2A",
            "@multimediatype": "Scalable Vector Graphics file",
            "@type": "ALTIMG",
            "@size": "1918",
            "@ref": "si25",
            "@mimetype": "image/svg+xml"
        },
        {
            "@category": "thumbnail",
            "@_fa": "true",
            "$": "https://api.elsevier.com/content/object/eid/1-s2.0-S0306261922018797-si254.svg?httpAccept=%2A%2F%2A",
            "@multimediatype": "Scalable Vector Graphics file",
            "@type": "ALTIMG",
            "@size": "18557",
            "@ref": "si254",
            "@mimetype": "image/svg+xml"
        },
        {
            "@category": "thumbnail",
            "@_fa": "true",
            "$": "https://api.elsevier.com/content/object/eid/1-s2.0-S0306261922018797-si255.svg?httpAccept=%2A%2F%2A",
            "@multimediatype": "Scalable Vector Graphics file",
            "@type": "ALTIMG",
            "@size": "25565",
            "@ref": "si255",
            "@mimetype": "image/svg+xml"
        },
        {
            "@category": "thumbnail",
            "@_fa": "true",
            "$": "https://api.elsevier.com/content/object/eid/1-s2.0-S0306261922018797-si258.svg?httpAccept=%2A%2F%2A",
            "@multimediatype": "Scalable Vector Graphics file",
            "@type": "ALTIMG",
            "@size": "17281",
            "@ref": "si258",
            "@mimetype": "image/svg+xml"
        },
        {
            "@category": "thumbnail",
            "@_fa": "true",
            "$": "https://api.elsevier.com/content/object/eid/1-s2.0-S0306261922018797-si259.svg?httpAccept=%2A%2F%2A",
            "@multimediatype": "Scalable Vector Graphics file",
            "@type": "ALTIMG",
            "@size": "24063",
            "@ref": "si259",
            "@mimetype": "image/svg+xml"
        },
        {
            "@category": "thumbnail",
            "@_fa": "true",
            "$": "https://api.elsevier.com/content/object/eid/1-s2.0-S0306261922018797-si264.svg?httpAccept=%2A%2F%2A",
            "@multimediatype": "Scalable Vector Graphics file",
            "@type": "ALTIMG",
            "@size": "4391",
            "@ref": "si264",
            "@mimetype": "image/svg+xml"
        },
        {
            "@category": "thumbnail",
            "@_fa": "true",
            "$": "https://api.elsevier.com/content/object/eid/1-s2.0-S0306261922018797-si267.svg?httpAccept=%2A%2F%2A",
            "@multimediatype": "Scalable Vector Graphics file",
            "@type": "ALTIMG",
            "@size": "57911",
            "@ref": "si267",
            "@mimetype": "image/svg+xml"
        },
        {
            "@category": "thumbnail",
            "@_fa": "true",
            "$": "https://api.elsevier.com/content/object/eid/1-s2.0-S0306261922018797-si277.svg?httpAccept=%2A%2F%2A",
            "@multimediatype": "Scalable Vector Graphics file",
            "@type": "ALTIMG",
            "@size": "10434",
            "@ref": "si277",
            "@mimetype": "image/svg+xml"
        },
        {
            "@category": "thumbnail",
            "@_fa": "true",
            "$": "https://api.elsevier.com/content/object/eid/1-s2.0-S0306261922018797-si278.svg?httpAccept=%2A%2F%2A",
            "@multimediatype": "Scalable Vector Graphics file",
            "@type": "ALTIMG",
            "@size": "11496",
            "@ref": "si278",
            "@mimetype": "image/svg+xml"
        },
        {
            "@category": "thumbnail",
            "@_fa": "true",
            "$": "https://api.elsevier.com/content/object/eid/1-s2.0-S0306261922018797-si279.svg?httpAccept=%2A%2F%2A",
            "@multimediatype": "Scalable Vector Graphics file",
            "@type": "ALTIMG",
            "@size": "6391",
            "@ref": "si279",
            "@mimetype": "image/svg+xml"
        },
        {
            "@category": "thumbnail",
            "@_fa": "true",
            "$": "https://api.elsevier.com/content/object/eid/1-s2.0-S0306261922018797-si28.svg?httpAccept=%2A%2F%2A",
            "@multimediatype": "Scalable Vector Graphics file",
            "@type": "ALTIMG",
            "@size": "2470",
            "@ref": "si28",
            "@mimetype": "image/svg+xml"
        },
        {
            "@category": "thumbnail",
            "@_fa": "true",
            "$": "https://api.elsevier.com/content/object/eid/1-s2.0-S0306261922018797-si280.svg?httpAccept=%2A%2F%2A",
            "@multimediatype": "Scalable Vector Graphics file",
            "@type": "ALTIMG",
            "@size": "1885",
            "@ref": "si280",
            "@mimetype": "image/svg+xml"
        },
        {
            "@category": "thumbnail",
            "@_fa": "true",
            "$": "https://api.elsevier.com/content/object/eid/1-s2.0-S0306261922018797-si281.svg?httpAccept=%2A%2F%2A",
            "@multimediatype": "Scalable Vector Graphics file",
            "@type": "ALTIMG",
            "@size": "1990",
            "@ref": "si281",
            "@mimetype": "image/svg+xml"
        },
        {
            "@category": "thumbnail",
            "@_fa": "true",
            "$": "https://api.elsevier.com/content/object/eid/1-s2.0-S0306261922018797-si282.svg?httpAccept=%2A%2F%2A",
            "@multimediatype": "Scalable Vector Graphics file",
            "@type": "ALTIMG",
            "@size": "2354",
            "@ref": "si282",
            "@mimetype": "image/svg+xml"
        },
        {
            "@category": "thumbnail",
            "@_fa": "true",
            "$": "https://api.elsevier.com/content/object/eid/1-s2.0-S0306261922018797-si283.svg?httpAccept=%2A%2F%2A",
            "@multimediatype": "Scalable Vector Graphics file",
            "@type": "ALTIMG",
            "@size": "6539",
            "@ref": "si283",
            "@mimetype": "image/svg+xml"
        },
        {
            "@category": "thumbnail",
            "@_fa": "true",
            "$": "https://api.elsevier.com/content/object/eid/1-s2.0-S0306261922018797-si285.svg?httpAccept=%2A%2F%2A",
            "@multimediatype": "Scalable Vector Graphics file",
            "@type": "ALTIMG",
            "@size": "4245",
            "@ref": "si285",
            "@mimetype": "image/svg+xml"
        },
        {
            "@category": "thumbnail",
            "@_fa": "true",
            "$": "https://api.elsevier.com/content/object/eid/1-s2.0-S0306261922018797-si287.svg?httpAccept=%2A%2F%2A",
            "@multimediatype": "Scalable Vector Graphics file",
            "@type": "ALTIMG",
            "@size": "17275",
            "@ref": "si287",
            "@mimetype": "image/svg+xml"
        },
        {
            "@category": "thumbnail",
            "@_fa": "true",
            "$": "https://api.elsevier.com/content/object/eid/1-s2.0-S0306261922018797-si288.svg?httpAccept=%2A%2F%2A",
            "@multimediatype": "Scalable Vector Graphics file",
            "@type": "ALTIMG",
            "@size": "12983",
            "@ref": "si288",
            "@mimetype": "image/svg+xml"
        },
        {
            "@category": "thumbnail",
            "@_fa": "true",
            "$": "https://api.elsevier.com/content/object/eid/1-s2.0-S0306261922018797-si289.svg?httpAccept=%2A%2F%2A",
            "@multimediatype": "Scalable Vector Graphics file",
            "@type": "ALTIMG",
            "@size": "2381",
            "@ref": "si289",
            "@mimetype": "image/svg+xml"
        },
        {
            "@category": "thumbnail",
            "@_fa": "true",
            "$": "https://api.elsevier.com/content/object/eid/1-s2.0-S0306261922018797-si290.svg?httpAccept=%2A%2F%2A",
            "@multimediatype": "Scalable Vector Graphics file",
            "@type": "ALTIMG",
            "@size": "3065",
            "@ref": "si290",
            "@mimetype": "image/svg+xml"
        },
        {
            "@category": "thumbnail",
            "@_fa": "true",
            "$": "https://api.elsevier.com/content/object/eid/1-s2.0-S0306261922018797-si293.svg?httpAccept=%2A%2F%2A",
            "@multimediatype": "Scalable Vector Graphics file",
            "@type": "ALTIMG",
            "@size": "14162",
            "@ref": "si293",
            "@mimetype": "image/svg+xml"
        },
        {
            "@category": "thumbnail",
            "@_fa": "true",
            "$": "https://api.elsevier.com/content/object/eid/1-s2.0-S0306261922018797-si294.svg?httpAccept=%2A%2F%2A",
            "@multimediatype": "Scalable Vector Graphics file",
            "@type": "ALTIMG",
            "@size": "11715",
            "@ref": "si294",
            "@mimetype": "image/svg+xml"
        },
        {
            "@category": "thumbnail",
            "@_fa": "true",
            "$": "https://api.elsevier.com/content/object/eid/1-s2.0-S0306261922018797-si295.svg?httpAccept=%2A%2F%2A",
            "@multimediatype": "Scalable Vector Graphics file",
            "@type": "ALTIMG",
            "@size": "13198",
            "@ref": "si295",
            "@mimetype": "image/svg+xml"
        },
        {
            "@category": "thumbnail",
            "@_fa": "true",
            "$": "https://api.elsevier.com/content/object/eid/1-s2.0-S0306261922018797-si296.svg?httpAccept=%2A%2F%2A",
            "@multimediatype": "Scalable Vector Graphics file",
            "@type": "ALTIMG",
            "@size": "3381",
            "@ref": "si296",
            "@mimetype": "image/svg+xml"
        },
        {
            "@category": "thumbnail",
            "@_fa": "true",
            "$": "https://api.elsevier.com/content/object/eid/1-s2.0-S0306261922018797-si3.svg?httpAccept=%2A%2F%2A",
            "@multimediatype": "Scalable Vector Graphics file",
            "@type": "ALTIMG",
            "@size": "3395",
            "@ref": "si3",
            "@mimetype": "image/svg+xml"
        },
        {
            "@category": "thumbnail",
            "@_fa": "true",
            "$": "https://api.elsevier.com/content/object/eid/1-s2.0-S0306261922018797-si302.svg?httpAccept=%2A%2F%2A",
            "@multimediatype": "Scalable Vector Graphics file",
            "@type": "ALTIMG",
            "@size": "2331",
            "@ref": "si302",
            "@mimetype": "image/svg+xml"
        },
        {
            "@category": "thumbnail",
            "@_fa": "true",
            "$": "https://api.elsevier.com/content/object/eid/1-s2.0-S0306261922018797-si303.svg?httpAccept=%2A%2F%2A",
            "@multimediatype": "Scalable Vector Graphics file",
            "@type": "ALTIMG",
            "@size": "2221",
            "@ref": "si303",
            "@mimetype": "image/svg+xml"
        },
        {
            "@category": "thumbnail",
            "@_fa": "true",
            "$": "https://api.elsevier.com/content/object/eid/1-s2.0-S0306261922018797-si304.svg?httpAccept=%2A%2F%2A",
            "@multimediatype": "Scalable Vector Graphics file",
            "@type": "ALTIMG",
            "@size": "2326",
            "@ref": "si304",
            "@mimetype": "image/svg+xml"
        },
        {
            "@category": "thumbnail",
            "@_fa": "true",
            "$": "https://api.elsevier.com/content/object/eid/1-s2.0-S0306261922018797-si307.svg?httpAccept=%2A%2F%2A",
            "@multimediatype": "Scalable Vector Graphics file",
            "@type": "ALTIMG",
            "@size": "38180",
            "@ref": "si307",
            "@mimetype": "image/svg+xml"
        },
        {
            "@category": "thumbnail",
            "@_fa": "true",
            "$": "https://api.elsevier.com/content/object/eid/1-s2.0-S0306261922018797-si312.svg?httpAccept=%2A%2F%2A",
            "@multimediatype": "Scalable Vector Graphics file",
            "@type": "ALTIMG",
            "@size": "13610",
            "@ref": "si312",
            "@mimetype": "image/svg+xml"
        },
        {
            "@category": "thumbnail",
            "@_fa": "true",
            "$": "https://api.elsevier.com/content/object/eid/1-s2.0-S0306261922018797-si313.svg?httpAccept=%2A%2F%2A",
            "@multimediatype": "Scalable Vector Graphics file",
            "@type": "ALTIMG",
            "@size": "14728",
            "@ref": "si313",
            "@mimetype": "image/svg+xml"
        },
        {
            "@category": "thumbnail",
            "@_fa": "true",
            "$": "https://api.elsevier.com/content/object/eid/1-s2.0-S0306261922018797-si314.svg?httpAccept=%2A%2F%2A",
            "@multimediatype": "Scalable Vector Graphics file",
            "@type": "ALTIMG",
            "@size": "16806",
            "@ref": "si314",
            "@mimetype": "image/svg+xml"
        },
        {
            "@category": "thumbnail",
            "@_fa": "true",
            "$": "https://api.elsevier.com/content/object/eid/1-s2.0-S0306261922018797-si317.svg?httpAccept=%2A%2F%2A",
            "@multimediatype": "Scalable Vector Graphics file",
            "@type": "ALTIMG",
            "@size": "22679",
            "@ref": "si317",
            "@mimetype": "image/svg+xml"
        },
        {
            "@category": "thumbnail",
            "@_fa": "true",
            "$": "https://api.elsevier.com/content/object/eid/1-s2.0-S0306261922018797-si319.svg?httpAccept=%2A%2F%2A",
            "@multimediatype": "Scalable Vector Graphics file",
            "@type": "ALTIMG",
            "@size": "21689",
            "@ref": "si319",
            "@mimetype": "image/svg+xml"
        },
        {
            "@category": "thumbnail",
            "@_fa": "true",
            "$": "https://api.elsevier.com/content/object/eid/1-s2.0-S0306261922018797-si32.svg?httpAccept=%2A%2F%2A",
            "@multimediatype": "Scalable Vector Graphics file",
            "@type": "ALTIMG",
            "@size": "4633",
            "@ref": "si32",
            "@mimetype": "image/svg+xml"
        },
        {
            "@category": "thumbnail",
            "@_fa": "true",
            "$": "https://api.elsevier.com/content/object/eid/1-s2.0-S0306261922018797-si321.svg?httpAccept=%2A%2F%2A",
            "@multimediatype": "Scalable Vector Graphics file",
            "@type": "ALTIMG",
            "@size": "21887",
            "@ref": "si321",
            "@mimetype": "image/svg+xml"
        },
        {
            "@category": "thumbnail",
            "@_fa": "true",
            "$": "https://api.elsevier.com/content/object/eid/1-s2.0-S0306261922018797-si322.svg?httpAccept=%2A%2F%2A",
            "@multimediatype": "Scalable Vector Graphics file",
            "@type": "ALTIMG",
            "@size": "19714",
            "@ref": "si322",
            "@mimetype": "image/svg+xml"
        },
        {
            "@category": "thumbnail",
            "@_fa": "true",
            "$": "https://api.elsevier.com/content/object/eid/1-s2.0-S0306261922018797-si324.svg?httpAccept=%2A%2F%2A",
            "@multimediatype": "Scalable Vector Graphics file",
            "@type": "ALTIMG",
            "@size": "22079",
            "@ref": "si324",
            "@mimetype": "image/svg+xml"
        },
        {
            "@category": "thumbnail",
            "@_fa": "true",
            "$": "https://api.elsevier.com/content/object/eid/1-s2.0-S0306261922018797-si328.svg?httpAccept=%2A%2F%2A",
            "@multimediatype": "Scalable Vector Graphics file",
            "@type": "ALTIMG",
            "@size": "29455",
            "@ref": "si328",
            "@mimetype": "image/svg+xml"
        },
        {
            "@category": "thumbnail",
            "@_fa": "true",
            "$": "https://api.elsevier.com/content/object/eid/1-s2.0-S0306261922018797-si33.svg?httpAccept=%2A%2F%2A",
            "@multimediatype": "Scalable Vector Graphics file",
            "@type": "ALTIMG",
            "@size": "5006",
            "@ref": "si33",
            "@mimetype": "image/svg+xml"
        },
        {
            "@category": "thumbnail",
            "@_fa": "true",
            "$": "https://api.elsevier.com/content/object/eid/1-s2.0-S0306261922018797-si331.svg?httpAccept=%2A%2F%2A",
            "@multimediatype": "Scalable Vector Graphics file",
            "@type": "ALTIMG",
            "@size": "9740",
            "@ref": "si331",
            "@mimetype": "image/svg+xml"
        },
        {
            "@category": "thumbnail",
            "@_fa": "true",
            "$": "https://api.elsevier.com/content/object/eid/1-s2.0-S0306261922018797-si332.svg?httpAccept=%2A%2F%2A",
            "@multimediatype": "Scalable Vector Graphics file",
            "@type": "ALTIMG",
            "@size": "6411",
            "@ref": "si332",
            "@mimetype": "image/svg+xml"
        },
        {
            "@category": "thumbnail",
            "@_fa": "true",
            "$": "https://api.elsevier.com/content/object/eid/1-s2.0-S0306261922018797-si333.svg?httpAccept=%2A%2F%2A",
            "@multimediatype": "Scalable Vector Graphics file",
            "@type": "ALTIMG",
            "@size": "9342",
            "@ref": "si333",
            "@mimetype": "image/svg+xml"
        },
        {
            "@category": "thumbnail",
            "@_fa": "true",
            "$": "https://api.elsevier.com/content/object/eid/1-s2.0-S0306261922018797-si334.svg?httpAccept=%2A%2F%2A",
            "@multimediatype": "Scalable Vector Graphics file",
            "@type": "ALTIMG",
            "@size": "6881",
            "@ref": "si334",
            "@mimetype": "image/svg+xml"
        },
        {
            "@category": "thumbnail",
            "@_fa": "true",
            "$": "https://api.elsevier.com/content/object/eid/1-s2.0-S0306261922018797-si336.svg?httpAccept=%2A%2F%2A",
            "@multimediatype": "Scalable Vector Graphics file",
            "@type": "ALTIMG",
            "@size": "18418",
            "@ref": "si336",
            "@mimetype": "image/svg+xml"
        },
        {
            "@category": "thumbnail",
            "@_fa": "true",
            "$": "https://api.elsevier.com/content/object/eid/1-s2.0-S0306261922018797-si337.svg?httpAccept=%2A%2F%2A",
            "@multimediatype": "Scalable Vector Graphics file",
            "@type": "ALTIMG",
            "@size": "8269",
            "@ref": "si337",
            "@mimetype": "image/svg+xml"
        },
        {
            "@category": "thumbnail",
            "@_fa": "true",
            "$": "https://api.elsevier.com/content/object/eid/1-s2.0-S0306261922018797-si338.svg?httpAccept=%2A%2F%2A",
            "@multimediatype": "Scalable Vector Graphics file",
            "@type": "ALTIMG",
            "@size": "15865",
            "@ref": "si338",
            "@mimetype": "image/svg+xml"
        },
        {
            "@category": "thumbnail",
            "@_fa": "true",
            "$": "https://api.elsevier.com/content/object/eid/1-s2.0-S0306261922018797-si340.svg?httpAccept=%2A%2F%2A",
            "@multimediatype": "Scalable Vector Graphics file",
            "@type": "ALTIMG",
            "@size": "4421",
            "@ref": "si340",
            "@mimetype": "image/svg+xml"
        },
        {
            "@category": "thumbnail",
            "@_fa": "true",
            "$": "https://api.elsevier.com/content/object/eid/1-s2.0-S0306261922018797-si342.svg?httpAccept=%2A%2F%2A",
            "@multimediatype": "Scalable Vector Graphics file",
            "@type": "ALTIMG",
            "@size": "22101",
            "@ref": "si342",
            "@mimetype": "image/svg+xml"
        },
        {
            "@category": "thumbnail",
            "@_fa": "true",
            "$": "https://api.elsevier.com/content/object/eid/1-s2.0-S0306261922018797-si345.svg?httpAccept=%2A%2F%2A",
            "@multimediatype": "Scalable Vector Graphics file",
            "@type": "ALTIMG",
            "@size": "5304",
            "@ref": "si345",
            "@mimetype": "image/svg+xml"
        },
        {
            "@category": "thumbnail",
            "@_fa": "true",
            "$": "https://api.elsevier.com/content/object/eid/1-s2.0-S0306261922018797-si347.svg?httpAccept=%2A%2F%2A",
            "@multimediatype": "Scalable Vector Graphics file",
            "@type": "ALTIMG",
            "@size": "27536",
            "@ref": "si347",
            "@mimetype": "image/svg+xml"
        },
        {
            "@category": "thumbnail",
            "@_fa": "true",
            "$": "https://api.elsevier.com/content/object/eid/1-s2.0-S0306261922018797-si349.svg?httpAccept=%2A%2F%2A",
            "@multimediatype": "Scalable Vector Graphics file",
            "@type": "ALTIMG",
            "@size": "11832",
            "@ref": "si349",
            "@mimetype": "image/svg+xml"
        },
        {
            "@category": "thumbnail",
            "@_fa": "true",
            "$": "https://api.elsevier.com/content/object/eid/1-s2.0-S0306261922018797-si351.svg?httpAccept=%2A%2F%2A",
            "@multimediatype": "Scalable Vector Graphics file",
            "@type": "ALTIMG",
            "@size": "58054",
            "@ref": "si351",
            "@mimetype": "image/svg+xml"
        },
        {
            "@category": "thumbnail",
            "@_fa": "true",
            "$": "https://api.elsevier.com/content/object/eid/1-s2.0-S0306261922018797-si361.svg?httpAccept=%2A%2F%2A",
            "@multimediatype": "Scalable Vector Graphics file",
            "@type": "ALTIMG",
            "@size": "14989",
            "@ref": "si361",
            "@mimetype": "image/svg+xml"
        },
        {
            "@category": "thumbnail",
            "@_fa": "true",
            "$": "https://api.elsevier.com/content/object/eid/1-s2.0-S0306261922018797-si363.svg?httpAccept=%2A%2F%2A",
            "@multimediatype": "Scalable Vector Graphics file",
            "@type": "ALTIMG",
            "@size": "87081",
            "@ref": "si363",
            "@mimetype": "image/svg+xml"
        },
        {
            "@category": "thumbnail",
            "@_fa": "true",
            "$": "https://api.elsevier.com/content/object/eid/1-s2.0-S0306261922018797-si38.svg?httpAccept=%2A%2F%2A",
            "@multimediatype": "Scalable Vector Graphics file",
            "@type": "ALTIMG",
            "@size": "5149",
            "@ref": "si38",
            "@mimetype": "image/svg+xml"
        },
        {
            "@category": "thumbnail",
            "@_fa": "true",
            "$": "https://api.elsevier.com/content/object/eid/1-s2.0-S0306261922018797-si382.svg?httpAccept=%2A%2F%2A",
            "@multimediatype": "Scalable Vector Graphics file",
            "@type": "ALTIMG",
            "@size": "16360",
            "@ref": "si382",
            "@mimetype": "image/svg+xml"
        },
        {
            "@category": "thumbnail",
            "@_fa": "true",
            "$": "https://api.elsevier.com/content/object/eid/1-s2.0-S0306261922018797-si4.svg?httpAccept=%2A%2F%2A",
            "@multimediatype": "Scalable Vector Graphics file",
            "@type": "ALTIMG",
            "@size": "8337",
            "@ref": "si4",
            "@mimetype": "image/svg+xml"
        },
        {
            "@category": "thumbnail",
            "@_fa": "true",
            "$": "https://api.elsevier.com/content/object/eid/1-s2.0-S0306261922018797-si42.svg?httpAccept=%2A%2F%2A",
            "@multimediatype": "Scalable Vector Graphics file",
            "@type": "ALTIMG",
            "@size": "2689",
            "@ref": "si42",
            "@mimetype": "image/svg+xml"
        },
        {
            "@category": "thumbnail",
            "@_fa": "true",
            "$": "https://api.elsevier.com/content/object/eid/1-s2.0-S0306261922018797-si44.svg?httpAccept=%2A%2F%2A",
            "@multimediatype": "Scalable Vector Graphics file",
            "@type": "ALTIMG",
            "@size": "5017",
            "@ref": "si44",
            "@mimetype": "image/svg+xml"
        },
        {
            "@category": "thumbnail",
            "@_fa": "true",
            "$": "https://api.elsevier.com/content/object/eid/1-s2.0-S0306261922018797-si47.svg?httpAccept=%2A%2F%2A",
            "@multimediatype": "Scalable Vector Graphics file",
            "@type": "ALTIMG",
            "@size": "29839",
            "@ref": "si47",
            "@mimetype": "image/svg+xml"
        },
        {
            "@category": "thumbnail",
            "@_fa": "true",
            "$": "https://api.elsevier.com/content/object/eid/1-s2.0-S0306261922018797-si48.svg?httpAccept=%2A%2F%2A",
            "@multimediatype": "Scalable Vector Graphics file",
            "@type": "ALTIMG",
            "@size": "15718",
            "@ref": "si48",
            "@mimetype": "image/svg+xml"
        },
        {
            "@category": "thumbnail",
            "@_fa": "true",
            "$": "https://api.elsevier.com/content/object/eid/1-s2.0-S0306261922018797-si54.svg?httpAccept=%2A%2F%2A",
            "@multimediatype": "Scalable Vector Graphics file",
            "@type": "ALTIMG",
            "@size": "5327",
            "@ref": "si54",
            "@mimetype": "image/svg+xml"
        },
        {
            "@category": "thumbnail",
            "@_fa": "true",
            "$": "https://api.elsevier.com/content/object/eid/1-s2.0-S0306261922018797-si55.svg?httpAccept=%2A%2F%2A",
            "@multimediatype": "Scalable Vector Graphics file",
            "@type": "ALTIMG",
            "@size": "2249",
            "@ref": "si55",
            "@mimetype": "image/svg+xml"
        },
        {
            "@category": "thumbnail",
            "@_fa": "true",
            "$": "https://api.elsevier.com/content/object/eid/1-s2.0-S0306261922018797-si56.svg?httpAccept=%2A%2F%2A",
            "@multimediatype": "Scalable Vector Graphics file",
            "@type": "ALTIMG",
            "@size": "1317",
            "@ref": "si56",
            "@mimetype": "image/svg+xml"
        },
        {
            "@category": "thumbnail",
            "@_fa": "true",
            "$": "https://api.elsevier.com/content/object/eid/1-s2.0-S0306261922018797-si57.svg?httpAccept=%2A%2F%2A",
            "@multimediatype": "Scalable Vector Graphics file",
            "@type": "ALTIMG",
            "@size": "2651",
            "@ref": "si57",
            "@mimetype": "image/svg+xml"
        },
        {
            "@category": "thumbnail",
            "@_fa": "true",
            "$": "https://api.elsevier.com/content/object/eid/1-s2.0-S0306261922018797-si58.svg?httpAccept=%2A%2F%2A",
            "@multimediatype": "Scalable Vector Graphics file",
            "@type": "ALTIMG",
            "@size": "2462",
            "@ref": "si58",
            "@mimetype": "image/svg+xml"
        },
        {
            "@category": "thumbnail",
            "@_fa": "true",
            "$": "https://api.elsevier.com/content/object/eid/1-s2.0-S0306261922018797-si59.svg?httpAccept=%2A%2F%2A",
            "@multimediatype": "Scalable Vector Graphics file",
            "@type": "ALTIMG",
            "@size": "6025",
            "@ref": "si59",
            "@mimetype": "image/svg+xml"
        },
        {
            "@category": "thumbnail",
            "@_fa": "true",
            "$": "https://api.elsevier.com/content/object/eid/1-s2.0-S0306261922018797-si60.svg?httpAccept=%2A%2F%2A",
            "@multimediatype": "Scalable Vector Graphics file",
            "@type": "ALTIMG",
            "@size": "2307",
            "@ref": "si60",
            "@mimetype": "image/svg+xml"
        },
        {
            "@category": "thumbnail",
            "@_fa": "true",
            "$": "https://api.elsevier.com/content/object/eid/1-s2.0-S0306261922018797-si61.svg?httpAccept=%2A%2F%2A",
            "@multimediatype": "Scalable Vector Graphics file",
            "@type": "ALTIMG",
            "@size": "1342",
            "@ref": "si61",
            "@mimetype": "image/svg+xml"
        },
        {
            "@category": "thumbnail",
            "@_fa": "true",
            "$": "https://api.elsevier.com/content/object/eid/1-s2.0-S0306261922018797-si62.svg?httpAccept=%2A%2F%2A",
            "@multimediatype": "Scalable Vector Graphics file",
            "@type": "ALTIMG",
            "@size": "3095",
            "@ref": "si62",
            "@mimetype": "image/svg+xml"
        },
        {
            "@category": "thumbnail",
            "@_fa": "true",
            "$": "https://api.elsevier.com/content/object/eid/1-s2.0-S0306261922018797-si63.svg?httpAccept=%2A%2F%2A",
            "@multimediatype": "Scalable Vector Graphics file",
            "@type": "ALTIMG",
            "@size": "2272",
            "@ref": "si63",
            "@mimetype": "image/svg+xml"
        },
        {
            "@category": "thumbnail",
            "@_fa": "true",
            "$": "https://api.elsevier.com/content/object/eid/1-s2.0-S0306261922018797-si67.svg?httpAccept=%2A%2F%2A",
            "@multimediatype": "Scalable Vector Graphics file",
            "@type": "ALTIMG",
            "@size": "4087",
            "@ref": "si67",
            "@mimetype": "image/svg+xml"
        },
        {
            "@category": "thumbnail",
            "@_fa": "true",
            "$": "https://api.elsevier.com/content/object/eid/1-s2.0-S0306261922018797-si68.svg?httpAccept=%2A%2F%2A",
            "@multimediatype": "Scalable Vector Graphics file",
            "@type": "ALTIMG",
            "@size": "2624",
            "@ref": "si68",
            "@mimetype": "image/svg+xml"
        },
        {
            "@category": "thumbnail",
            "@_fa": "true",
            "$": "https://api.elsevier.com/content/object/eid/1-s2.0-S0306261922018797-si70.svg?httpAccept=%2A%2F%2A",
            "@multimediatype": "Scalable Vector Graphics file",
            "@type": "ALTIMG",
            "@size": "1499",
            "@ref": "si70",
            "@mimetype": "image/svg+xml"
        },
        {
            "@category": "thumbnail",
            "@_fa": "true",
            "$": "https://api.elsevier.com/content/object/eid/1-s2.0-S0306261922018797-si71.svg?httpAccept=%2A%2F%2A",
            "@multimediatype": "Scalable Vector Graphics file",
            "@type": "ALTIMG",
            "@size": "2661",
            "@ref": "si71",
            "@mimetype": "image/svg+xml"
        },
        {
            "@category": "thumbnail",
            "@_fa": "true",
            "$": "https://api.elsevier.com/content/object/eid/1-s2.0-S0306261922018797-si73.svg?httpAccept=%2A%2F%2A",
            "@multimediatype": "Scalable Vector Graphics file",
            "@type": "ALTIMG",
            "@size": "5821",
            "@ref": "si73",
            "@mimetype": "image/svg+xml"
        },
        {
            "@category": "thumbnail",
            "@_fa": "true",
            "$": "https://api.elsevier.com/content/object/eid/1-s2.0-S0306261922018797-si74.svg?httpAccept=%2A%2F%2A",
            "@multimediatype": "Scalable Vector Graphics file",
            "@type": "ALTIMG",
            "@size": "3471",
            "@ref": "si74",
            "@mimetype": "image/svg+xml"
        },
        {
            "@category": "thumbnail",
            "@_fa": "true",
            "$": "https://api.elsevier.com/content/object/eid/1-s2.0-S0306261922018797-si76.svg?httpAccept=%2A%2F%2A",
            "@multimediatype": "Scalable Vector Graphics file",
            "@type": "ALTIMG",
            "@size": "3540",
            "@ref": "si76",
            "@mimetype": "image/svg+xml"
        },
        {
            "@category": "thumbnail",
            "@_fa": "true",
            "$": "https://api.elsevier.com/content/object/eid/1-s2.0-S0306261922018797-si77.svg?httpAccept=%2A%2F%2A",
            "@multimediatype": "Scalable Vector Graphics file",
            "@type": "ALTIMG",
            "@size": "3075",
            "@ref": "si77",
            "@mimetype": "image/svg+xml"
        },
        {
            "@category": "thumbnail",
            "@_fa": "true",
            "$": "https://api.elsevier.com/content/object/eid/1-s2.0-S0306261922018797-si79.svg?httpAccept=%2A%2F%2A",
            "@multimediatype": "Scalable Vector Graphics file",
            "@type": "ALTIMG",
            "@size": "1442",
            "@ref": "si79",
            "@mimetype": "image/svg+xml"
        },
        {
            "@category": "thumbnail",
            "@_fa": "true",
            "$": "https://api.elsevier.com/content/object/eid/1-s2.0-S0306261922018797-si8.svg?httpAccept=%2A%2F%2A",
            "@multimediatype": "Scalable Vector Graphics file",
            "@type": "ALTIMG",
            "@size": "1587",
            "@ref": "si8",
            "@mimetype": "image/svg+xml"
        },
        {
            "@category": "thumbnail",
            "@_fa": "true",
            "$": "https://api.elsevier.com/content/object/eid/1-s2.0-S0306261922018797-si80.svg?httpAccept=%2A%2F%2A",
            "@multimediatype": "Scalable Vector Graphics file",
            "@type": "ALTIMG",
            "@size": "3991",
            "@ref": "si80",
            "@mimetype": "image/svg+xml"
        },
        {
            "@category": "thumbnail",
            "@_fa": "true",
            "$": "https://api.elsevier.com/content/object/eid/1-s2.0-S0306261922018797-si82.svg?httpAccept=%2A%2F%2A",
            "@multimediatype": "Scalable Vector Graphics file",
            "@type": "ALTIMG",
            "@size": "3405",
            "@ref": "si82",
            "@mimetype": "image/svg+xml"
        },
        {
            "@category": "thumbnail",
            "@_fa": "true",
            "$": "https://api.elsevier.com/content/object/eid/1-s2.0-S0306261922018797-si83.svg?httpAccept=%2A%2F%2A",
            "@multimediatype": "Scalable Vector Graphics file",
            "@type": "ALTIMG",
            "@size": "2656",
            "@ref": "si83",
            "@mimetype": "image/svg+xml"
        },
        {
            "@category": "thumbnail",
            "@_fa": "true",
            "$": "https://api.elsevier.com/content/object/eid/1-s2.0-S0306261922018797-si84.svg?httpAccept=%2A%2F%2A",
            "@multimediatype": "Scalable Vector Graphics file",
            "@type": "ALTIMG",
            "@size": "3839",
            "@ref": "si84",
            "@mimetype": "image/svg+xml"
        },
        {
            "@category": "thumbnail",
            "@_fa": "true",
            "$": "https://api.elsevier.com/content/object/eid/1-s2.0-S0306261922018797-si86.svg?httpAccept=%2A%2F%2A",
            "@multimediatype": "Scalable Vector Graphics file",
            "@type": "ALTIMG",
            "@size": "4965",
            "@ref": "si86",
            "@mimetype": "image/svg+xml"
        },
        {
            "@category": "thumbnail",
            "@_fa": "true",
            "$": "https://api.elsevier.com/content/object/eid/1-s2.0-S0306261922018797-si87.svg?httpAccept=%2A%2F%2A",
            "@multimediatype": "Scalable Vector Graphics file",
            "@type": "ALTIMG",
            "@size": "3987",
            "@ref": "si87",
            "@mimetype": "image/svg+xml"
        },
        {
            "@category": "thumbnail",
            "@_fa": "true",
            "$": "https://api.elsevier.com/content/object/eid/1-s2.0-S0306261922018797-si88.svg?httpAccept=%2A%2F%2A",
            "@multimediatype": "Scalable Vector Graphics file",
            "@type": "ALTIMG",
            "@size": "2570",
            "@ref": "si88",
            "@mimetype": "image/svg+xml"
        },
        {
            "@category": "thumbnail",
            "@_fa": "true",
            "$": "https://api.elsevier.com/content/object/eid/1-s2.0-S0306261922018797-si91.svg?httpAccept=%2A%2F%2A",
            "@multimediatype": "Scalable Vector Graphics file",
            "@type": "ALTIMG",
            "@size": "3017",
            "@ref": "si91",
            "@mimetype": "image/svg+xml"
        },
        {
            "@category": "thumbnail",
            "@_fa": "true",
            "$": "https://api.elsevier.com/content/object/eid/1-s2.0-S0306261922018797-si92.svg?httpAccept=%2A%2F%2A",
            "@multimediatype": "Scalable Vector Graphics file",
            "@type": "ALTIMG",
            "@size": "6205",
            "@ref": "si92",
            "@mimetype": "image/svg+xml"
        },
        {
            "@category": "thumbnail",
            "@_fa": "true",
            "$": "https://api.elsevier.com/content/object/eid/1-s2.0-S0306261922018797-si93.svg?httpAccept=%2A%2F%2A",
            "@multimediatype": "Scalable Vector Graphics file",
            "@type": "ALTIMG",
            "@size": "3111",
            "@ref": "si93",
            "@mimetype": "image/svg+xml"
        },
        {
            "@category": "thumbnail",
            "@_fa": "true",
            "$": "https://api.elsevier.com/content/object/eid/1-s2.0-S0306261922018797-si94.svg?httpAccept=%2A%2F%2A",
            "@multimediatype": "Scalable Vector Graphics file",
            "@type": "ALTIMG",
            "@size": "2129",
            "@ref": "si94",
            "@mimetype": "image/svg+xml"
        },
        {
            "@category": "thumbnail",
            "@_fa": "true",
            "$": "https://api.elsevier.com/content/object/eid/1-s2.0-S0306261922018797-si95.svg?httpAccept=%2A%2F%2A",
            "@multimediatype": "Scalable Vector Graphics file",
            "@type": "ALTIMG",
            "@size": "2206",
            "@ref": "si95",
            "@mimetype": "image/svg+xml"
        },
        {
            "@category": "thumbnail",
            "@_fa": "true",
            "$": "https://api.elsevier.com/content/object/eid/1-s2.0-S0306261922018797-si98.svg?httpAccept=%2A%2F%2A",
            "@multimediatype": "Scalable Vector Graphics file",
            "@type": "ALTIMG",
            "@size": "3862",
            "@ref": "si98",
            "@mimetype": "image/svg+xml"
        },
        {
            "@category": "standard",
            "@_fa": "true",
            "$": "https://api.elsevier.com/content/object/eid/1-s2.0-S0306261922018797-am.pdf?httpAccept=%2A%2F%2A",
            "@multimediatype": "Acrobat PDF file",
            "@type": "AAM-PDF",
            "@size": "1885649",
            "@ref": "am",
            "@mimetype": "application/pdf"
        }
    ]},
    "link": {
        "@rel": "abstract",
        "@href": "https://api.elsevier.com/content/abstract/scopus_id/85146918639"
    }
}}