{"full-text-retrieval-response": {
    "scopus-eid": "2-s2.0-85081129562",
    "originalText": "serial JL 271089 291210 291731 291800 291881 31 Energy and Buildings ENERGYBUILDINGS 2020-01-29 2020-01-29 2020-03-11 2020-03-11 2020-11-27T18:55:47 1-s2.0-S037877881931686X S0378-7788(19)31686-X S037877881931686X 10.1016/j.enbuild.2020.109825 S300 S300.1 FULL-TEXT 1-s2.0-S0378778820X00077 2020-11-27T21:36:36.575946Z 0 0 20200515 2020 2020-01-29T07:58:02.591166Z articleinfo articlenumber articletitlenorm authfirstinitialnorm authfirstsurnamenorm cid cids contenttype copyright crossmark dateloaded dateloadedtxt datesearch datesort dateupdated dco docsubtype doctype doi eid ewtransactionid hubeid indexeddate issn issnnorm itemstage itemtransactionid itemweight openaccess openarchive pg pgfirst pii piinorm pubdatestart pubdatetxt pubyr sectiontitle sortorder srctitle srctitlenorm srctype ssids alllist content subj subheadings suppl tomb volfirst volissue volumelist webpdf webpdfpagecount yearnav figure table body mmlmath affil appendices articletitle auth authfirstini authfull authkeywords authlast highlightsabst primabst ref 0378-7788 03787788 true 215 215 C Volume 215 15 109825 109825 109825 20200515 15 May 2020 2020-05-15 2020 Research Articles article fla © 2020 Elsevier B.V. All rights reserved. BUILDINGTEMPERATUREREGULATIONINAMULTIZONEHVACSYSTEMUSINGDISTRIBUTEDADAPTIVECONTROL LYMPEROPOULOS G 1 Introduction 2 Notation and nomenclature 3 HVAC zone modeling and control objectives 4 Distributed control scheme for multi-zone HVAC systems 4.1 Structure of control scheme 4.2 Estimation of controller gains 5 Simulation results and discussion 5.1 Case study I: Building with six interconnected thermal zones 5.1.1 Building description 5.1.2 Simulation results 5.2 Case study II: primary school building 5.2.1 Building description 5.2.2 Simulation results 6 Conclusions CRediT authorship contribution statement Appendix Proof of Theorem 1 References PEREZLOMBARD 2008 394 398 L RAHMAN 2010 2994 3004 M TASHTOUSH 2005 1729 1745 B AFROZ 2018 64 84 Z PLATT 2010 412 421 G LYMPEROPOULOS 2016 G 2016IEEE55THCONFERENCEDECISIONCONTROLCDC ADAPTIVECONTROLNETWORKEDDISTRIBUTEDSYSTEMSUNKNOWNINTERCONNECTIONS LYMPEROPOULOS 2018 38 68 G BARAKAT 1987 71 S LIDWELL 1977 141 154 O LYMPEROPOULOS 2019 G 201927THMEDITERRANEANCONFERENCECONTROLAUTOMATIONMED DISTRIBUTEDADAPTIVECONTROLMULTIZONEHVACSYSTEMS LYMPEROPOULOS 2019 G 2019IEEE58THCONFERENCEDECISIONCONTROLCDC DISTRIBUTEDADAPTIVEHVACCONTROLFORMULTIZONEBUILDINGS ELNOUR 2017 M 20175THINTERNATIONALCONFERENCECONTROLINSTRUMENTATIONAUTOMATIONICCIA MULTIZONEHVACCONTROLSYSTEMDESIGNUSINGFEEDBACKLINEARIZATION AFRAM 2014 343 355 A WANG 2017 Z 201711THASIANCONTROLCONFERENCEASCC DISTRIBUTEDMODELPREDICTIVECONTROLBILINEARHVACSYSTEMSUSINGACONVEXIFICATIONMETHOD MA 2011 Y PROCEEDINGS2011AMERICANCONTROLCONFERENCE ADISTRIBUTEDPREDICTIVECONTROLAPPROACHBUILDINGTEMPERATUREREGULATION MOROSAN 2011 729 737 P LONG 2016 Y 2016AMERICANCONTROLCONFERENCEACC AHIERARCHICALDISTRIBUTEDMPCFORHVACSYSTEMS RAZMARA 2015 555 565 M ALVAREZ 2013 361 372 J FIELSCH 2017 4216 4221 S MA 2015 101 116 Y PARISIO 2018 A 2018EUROPEANCONTROLCONFERENCEECC DISTRIBUTEDMODELPREDICTIVECONTROLFORBUILDINGDEMANDSIDEMANAGEMENT PATEL 2016 N 2016AMERICANCONTROLCONFERENCEACC DISTRIBUTEDECONOMICMODELPREDICTIVECONTROLFORLARGESCALEBUILDINGTEMPERATUREREGULATION KOEHLER 2013 S 2013EUROPEANCONTROLCONFERENCEECC BUILDINGTEMPERATUREDISTRIBUTEDCONTROLVIAEXPLICITMPCTRIMRESPONDMETHODS BARANSKI 2019 840 851 M KOEHLER 2017 167 189 S INTELLIGENTBUILDINGCONTROLSYSTEMS DISTRIBUTEDMODELPREDICTIVECONTROLFORFORCEDAIRSYSTEMS BEHROOZ 2018 495 F BALDI 2014 56 71 S YANG 2012 R PESTD2012 OPTIMALCONTROLSTRATEGYFORHVACSYSTEMINBUILDINGENERGYMANAGEMENT PRICE 2017 1190 1202 C ZHUANG 2019 012021 J IOPCONFERENCESERIESEARTHENVIRONMENTALSCIENCE CASCADECONTROLFORSUPPLYAIRTEMPERATUREINAVARIABLEAIRVOLUMESYSTEM JAIN 2018 A 2018ACMIEEE9THINTERNATIONALCONFERENCECYBERPHYSICALSYSTEMSICCPS LEARNINGCONTROLUSINGGAUSSIANPROCESSES HATANAKA 2017 T 2017IEEE56THANNUALCONFERENCEDECISIONCONTROLCDC PHYSICSINTEGRATEDHIERARCHICALDISTRIBUTEDHVACOPTIMIZATIONFORMULTIPLEBUILDINGSROBUSTNESSAGAINSTTIMEDELAYS JAIN 2018 1 21 A COSTANZO 2016 81 90 G GARNIER 2014 12080 12085 A ATTARAN 2016 613 624 S IVANOVA 2019 01064 D MATECWEBCONFERENCES APPLICATIONGENETICALGORITHMFORCASCADECONTROLAHVACSYSTEM BARANSKI 2018 131 140 M GOYAL 2012 S 2012IEEE51STIEEECONFERENCEDECISIONCONTROLCDC EFFECTVARIOUSUNCERTAINTIESPERFORMANCEOCCUPANCYBASEDOPTIMALCONTROLHVACZONES CHIANG 2006 M 2006IEEEINTERNATIONALCONFERENCESYSTEMSMANCYBERNETICS ADAPTIVEROBUSTCONTROLFORNONLINEARHVACSYSTEM BUONOMANO 2017 263 285 A HUAGUANG 2002 493 498 Z WEN 2013 J 52NDIEEECONFERENCEDECISIONCONTROL BUILDINGTEMPERATURECONTROLADAPTIVEFEEDFORWARD DHAR 2018 178 188 N GHAHRAMANI 2017 149 161 A YUAN 2018 417 422 S RADHAKRISHNAN 2018 1892 1900 N HUANG 2013 H 201310THIEEEINTERNATIONALCONFERENCECONTROLAUTOMATIONICCA MULTIZONETEMPERATUREPREDICTIONINACOMMERCIALBUILDINGUSINGARTIFICIALNEURALNETWORKMODEL ELBACCOUCHE 2016 N 201614THINTERNATIONALCONFERENCECONTROLAUTOMATIONROBOTICSVISIONICARCV HIERARCHICALPREDICTIVECONTROLFORMULTIZONEBUILDING ELEFTHERIADIS 2017 321 326 G PETERSEN 2018 J 2018IEEECONFERENCECONTROLTECHNOLOGYAPPLICATIONSCCTA MULTIZONEMODELINGENERGYEFFICIENTCONTROLSHOPPINGCENTERCOOLING OGATA 1995 K DISCRETETIMECONTROLSYSTEMS2NDEDITION IOANNOU 2006 P ADAPTIVECONTROLTUTORIALADVANCESINDESIGNCONTROL TSAKALIS 1992 K LINEARTIMEVARYINGSYSTEMSCONTROLADAPTATION PUTEH 2012 1834 1838 M BALDI 2019 113478 S LYMPEROPOULOSX2020X109825 LYMPEROPOULOSX2020X109825XG 2022-03-11T00:00:00.000Z 2022-03-11T00:00:00.000Z http://creativecommons.org/licenses/by-nc-nd/4.0/ © 2020 Elsevier B.V. All rights reserved. 2020-03-14T22:50:13.487Z http://vtw.elsevier.com/data/voc/AddOnTypes/50.7/nlp-car This research did not receive any specific grant from funding agencies in the public, commercial, or not-for-profit sectors. item S0378-7788(19)31686-X S037877881931686X 1-s2.0-S037877881931686X 10.1016/j.enbuild.2020.109825 271089 2020-11-27T21:36:36.575946Z 2020-05-15 1-s2.0-S037877881931686X-main.pdf https://s3-eu-west-1.amazonaws.com/prod-ucs-content-store-eu-west/content/pii:S037877881931686X/MAIN/application/pdf/0dd8d9254646c44931efa654b5d4005a/main.pdf main.pdf pdf true 4033947 MAIN 15 1-s2.0-S037877881931686X-main_1.png https://s3-eu-west-1.amazonaws.com/prod-ucs-content-store-eu-west/content/pii:S037877881931686X/PREVIEW/image/png/ccbac3beeb90b65d853cdb26c708f9f5/main_1.png main_1.png png 55648 849 656 IMAGE-WEB-PDF 1 1-s2.0-S037877881931686X-gr1.jpg https://s3-eu-west-1.amazonaws.com/prod-ucs-content-store-eu-west/content/pii:S037877881931686X/gr1/DOWNSAMPLED/image/jpeg/ba74f69145105d97af612af6e66c7eaf/gr1.jpg gr1 gr1.jpg jpg 54472 375 389 IMAGE-DOWNSAMPLED 1-s2.0-S037877881931686X-gr10.jpg https://s3-eu-west-1.amazonaws.com/prod-ucs-content-store-eu-west/content/pii:S037877881931686X/gr10/DOWNSAMPLED/image/jpeg/1b5923610d29b28960c9ed430ad3909c/gr10.jpg gr10 gr10.jpg jpg 69820 336 753 IMAGE-DOWNSAMPLED 1-s2.0-S037877881931686X-gr2.jpg https://s3-eu-west-1.amazonaws.com/prod-ucs-content-store-eu-west/content/pii:S037877881931686X/gr2/DOWNSAMPLED/image/jpeg/0e411a6e8ecfbc5d9b167c144a96830b/gr2.jpg gr2 gr2.jpg jpg 17565 308 376 IMAGE-DOWNSAMPLED 1-s2.0-S037877881931686X-gr3.jpg https://s3-eu-west-1.amazonaws.com/prod-ucs-content-store-eu-west/content/pii:S037877881931686X/gr3/DOWNSAMPLED/image/jpeg/a2f72f7e2ac8cce40ab1c9d698ea1f35/gr3.jpg gr3 gr3.jpg jpg 108556 728 753 IMAGE-DOWNSAMPLED 1-s2.0-S037877881931686X-gr4.jpg https://s3-eu-west-1.amazonaws.com/prod-ucs-content-store-eu-west/content/pii:S037877881931686X/gr4/DOWNSAMPLED/image/jpeg/cfcc459a5dd59954075b26e419b4f71c/gr4.jpg gr4 gr4.jpg jpg 36402 229 753 IMAGE-DOWNSAMPLED 1-s2.0-S037877881931686X-gr5.jpg https://s3-eu-west-1.amazonaws.com/prod-ucs-content-store-eu-west/content/pii:S037877881931686X/gr5/DOWNSAMPLED/image/jpeg/8aed787171e72ee91a7885605f1c1540/gr5.jpg gr5 gr5.jpg jpg 43233 292 753 IMAGE-DOWNSAMPLED 1-s2.0-S037877881931686X-gr6.jpg https://s3-eu-west-1.amazonaws.com/prod-ucs-content-store-eu-west/content/pii:S037877881931686X/gr6/DOWNSAMPLED/image/jpeg/5484e8226a47380aeadc46d35a9199d9/gr6.jpg gr6 gr6.jpg jpg 26288 234 386 IMAGE-DOWNSAMPLED 1-s2.0-S037877881931686X-gr7.jpg https://s3-eu-west-1.amazonaws.com/prod-ucs-content-store-eu-west/content/pii:S037877881931686X/gr7/DOWNSAMPLED/image/jpeg/15551b1772677313ce344b3b71dd27a6/gr7.jpg gr7 gr7.jpg jpg 221878 980 734 IMAGE-DOWNSAMPLED 1-s2.0-S037877881931686X-gr8.jpg https://s3-eu-west-1.amazonaws.com/prod-ucs-content-store-eu-west/content/pii:S037877881931686X/gr8/DOWNSAMPLED/image/jpeg/ccf9857338f859a10602b5538efaa93e/gr8.jpg gr8 gr8.jpg jpg 205725 993 734 IMAGE-DOWNSAMPLED 1-s2.0-S037877881931686X-gr9.jpg https://s3-eu-west-1.amazonaws.com/prod-ucs-content-store-eu-west/content/pii:S037877881931686X/gr9/DOWNSAMPLED/image/jpeg/e067e97ad8b93a03f29eab8c3ab7b902/gr9.jpg gr9 gr9.jpg jpg 70939 313 751 IMAGE-DOWNSAMPLED 1-s2.0-S037877881931686X-gr1.sml https://s3-eu-west-1.amazonaws.com/prod-ucs-content-store-eu-west/content/pii:S037877881931686X/gr1/THUMBNAIL/image/gif/d37d69114aae14d9f047713d9011394d/gr1.sml gr1 gr1.sml sml 10878 164 170 IMAGE-THUMBNAIL 1-s2.0-S037877881931686X-gr10.sml https://s3-eu-west-1.amazonaws.com/prod-ucs-content-store-eu-west/content/pii:S037877881931686X/gr10/THUMBNAIL/image/gif/6c7d7cbafeecfe799aa68404eac71e1e/gr10.sml gr10 gr10.sml sml 8258 98 219 IMAGE-THUMBNAIL 1-s2.0-S037877881931686X-gr2.sml https://s3-eu-west-1.amazonaws.com/prod-ucs-content-store-eu-west/content/pii:S037877881931686X/gr2/THUMBNAIL/image/gif/c997af1746877d6541c7fd1c512bdfe4/gr2.sml gr2 gr2.sml sml 9794 164 200 IMAGE-THUMBNAIL 1-s2.0-S037877881931686X-gr3.sml https://s3-eu-west-1.amazonaws.com/prod-ucs-content-store-eu-west/content/pii:S037877881931686X/gr3/THUMBNAIL/image/gif/4b4ee51f3c9fc822d95e126383f02be9/gr3.sml gr3 gr3.sml sml 5953 163 169 IMAGE-THUMBNAIL 1-s2.0-S037877881931686X-gr4.sml https://s3-eu-west-1.amazonaws.com/prod-ucs-content-store-eu-west/content/pii:S037877881931686X/gr4/THUMBNAIL/image/gif/f0153f6b430971e870b110e387623c6d/gr4.sml gr4 gr4.sml sml 3302 67 219 IMAGE-THUMBNAIL 1-s2.0-S037877881931686X-gr5.sml https://s3-eu-west-1.amazonaws.com/prod-ucs-content-store-eu-west/content/pii:S037877881931686X/gr5/THUMBNAIL/image/gif/7d16376ce3e73f2efb3cf8443215299e/gr5.sml gr5 gr5.sml sml 4233 85 219 IMAGE-THUMBNAIL 1-s2.0-S037877881931686X-gr6.sml https://s3-eu-west-1.amazonaws.com/prod-ucs-content-store-eu-west/content/pii:S037877881931686X/gr6/THUMBNAIL/image/gif/d60bd7c6dd9ad69f878248122bbf09f3/gr6.sml gr6 gr6.sml sml 11937 133 219 IMAGE-THUMBNAIL 1-s2.0-S037877881931686X-gr7.sml https://s3-eu-west-1.amazonaws.com/prod-ucs-content-store-eu-west/content/pii:S037877881931686X/gr7/THUMBNAIL/image/gif/de50e6a83315a2c3dbecc04c2f5ee40d/gr7.sml gr7 gr7.sml sml 7955 163 122 IMAGE-THUMBNAIL 1-s2.0-S037877881931686X-gr8.sml https://s3-eu-west-1.amazonaws.com/prod-ucs-content-store-eu-west/content/pii:S037877881931686X/gr8/THUMBNAIL/image/gif/a9384982a81c278af008061c606c74ff/gr8.sml gr8 gr8.sml sml 7498 164 121 IMAGE-THUMBNAIL 1-s2.0-S037877881931686X-gr9.sml https://s3-eu-west-1.amazonaws.com/prod-ucs-content-store-eu-west/content/pii:S037877881931686X/gr9/THUMBNAIL/image/gif/68e30f811e6f483fec89dfd2d1a3c6b1/gr9.sml gr9 gr9.sml sml 5763 91 219 IMAGE-THUMBNAIL 1-s2.0-S037877881931686X-gr1_lrg.jpg https://s3-eu-west-1.amazonaws.com/prod-ucs-content-store-eu-west/content/pii:S037877881931686X/gr1/HIGHRES/image/jpeg/cde6e3091918863b249b87d5c419eaf0/gr1_lrg.jpg gr1 gr1_lrg.jpg jpg 435117 1664 1725 IMAGE-HIGH-RES 1-s2.0-S037877881931686X-gr10_lrg.jpg https://s3-eu-west-1.amazonaws.com/prod-ucs-content-store-eu-west/content/pii:S037877881931686X/gr10/HIGHRES/image/jpeg/e9b5487006e0edaf65d315ccce9a72e6/gr10_lrg.jpg gr10 gr10_lrg.jpg jpg 942572 1787 4000 IMAGE-HIGH-RES 1-s2.0-S037877881931686X-gr2_lrg.jpg https://s3-eu-west-1.amazonaws.com/prod-ucs-content-store-eu-west/content/pii:S037877881931686X/gr2/HIGHRES/image/jpeg/09a4573ff9e3a725cb6293806be4c10b/gr2_lrg.jpg gr2 gr2_lrg.jpg jpg 137007 1365 1667 IMAGE-HIGH-RES 1-s2.0-S037877881931686X-gr3_lrg.jpg https://s3-eu-west-1.amazonaws.com/prod-ucs-content-store-eu-west/content/pii:S037877881931686X/gr3/HIGHRES/image/jpeg/5751ad8b54ea6da94b38124a39c5c3ea/gr3_lrg.jpg gr3 gr3_lrg.jpg jpg 1158529 3867 4000 IMAGE-HIGH-RES 1-s2.0-S037877881931686X-gr4_lrg.jpg https://s3-eu-west-1.amazonaws.com/prod-ucs-content-store-eu-west/content/pii:S037877881931686X/gr4/HIGHRES/image/jpeg/2ba42341c53aa76b5b4c40fcdc2e27a8/gr4_lrg.jpg gr4 gr4_lrg.jpg jpg 362004 1219 4000 IMAGE-HIGH-RES 1-s2.0-S037877881931686X-gr5_lrg.jpg https://s3-eu-west-1.amazonaws.com/prod-ucs-content-store-eu-west/content/pii:S037877881931686X/gr5/HIGHRES/image/jpeg/96d293a2e14bfdec55aa3e7c7c2fa553/gr5_lrg.jpg gr5 gr5_lrg.jpg jpg 482075 1550 4001 IMAGE-HIGH-RES 1-s2.0-S037877881931686X-gr6_lrg.jpg https://s3-eu-west-1.amazonaws.com/prod-ucs-content-store-eu-west/content/pii:S037877881931686X/gr6/HIGHRES/image/jpeg/380c7c142a8da42e196c88ede12f442d/gr6_lrg.jpg gr6 gr6_lrg.jpg jpg 256039 1037 1708 IMAGE-HIGH-RES 1-s2.0-S037877881931686X-gr7_lrg.jpg https://s3-eu-west-1.amazonaws.com/prod-ucs-content-store-eu-west/content/pii:S037877881931686X/gr7/HIGHRES/image/jpeg/7f86417e31b8805ae07a25a72e86f74b/gr7_lrg.jpg gr7 gr7_lrg.jpg jpg 1842655 4341 3250 IMAGE-HIGH-RES 1-s2.0-S037877881931686X-gr8_lrg.jpg https://s3-eu-west-1.amazonaws.com/prod-ucs-content-store-eu-west/content/pii:S037877881931686X/gr8/HIGHRES/image/jpeg/99555b0e393cf4b712d23a0d97a017b7/gr8_lrg.jpg gr8 gr8_lrg.jpg jpg 2275759 5275 3900 IMAGE-HIGH-RES 1-s2.0-S037877881931686X-gr9_lrg.jpg https://s3-eu-west-1.amazonaws.com/prod-ucs-content-store-eu-west/content/pii:S037877881931686X/gr9/HIGHRES/image/jpeg/942d1cd02c630b287bfea681d7a2ff88/gr9_lrg.jpg gr9 gr9_lrg.jpg jpg 606918 1666 3992 IMAGE-HIGH-RES 1-s2.0-S037877881931686X-si83.svg https://s3-eu-west-1.amazonaws.com/prod-ucs-content-store-eu-west/content/pii:S037877881931686X/STRIPIN/image/svg+xml/c7a3f1fc65e757c41afb13f78fc59ec8/si83.svg si83 si83.svg svg 2924 ALTIMG 1-s2.0-S037877881931686X-si21.svg https://s3-eu-west-1.amazonaws.com/prod-ucs-content-store-eu-west/content/pii:S037877881931686X/STRIPIN/image/svg+xml/22249ce133d01c5bb6f1d115890c23cf/si21.svg si21 si21.svg svg 2638 ALTIMG 1-s2.0-S037877881931686X-si50.svg https://s3-eu-west-1.amazonaws.com/prod-ucs-content-store-eu-west/content/pii:S037877881931686X/STRIPIN/image/svg+xml/b53bbb1d4f0f52a5f2257c3b3b6cdaa6/si50.svg si50 si50.svg svg 3503 ALTIMG 1-s2.0-S037877881931686X-si60.svg https://s3-eu-west-1.amazonaws.com/prod-ucs-content-store-eu-west/content/pii:S037877881931686X/STRIPIN/image/svg+xml/7081b7d7d6d34c50ac4ec2205315c3ff/si60.svg si60 si60.svg svg 3349 ALTIMG 1-s2.0-S037877881931686X-si70.svg https://s3-eu-west-1.amazonaws.com/prod-ucs-content-store-eu-west/content/pii:S037877881931686X/STRIPIN/image/svg+xml/215235c29b11095e7c9af868ae9beb55/si70.svg si70 si70.svg svg 4129 ALTIMG 1-s2.0-S037877881931686X-si80.svg https://s3-eu-west-1.amazonaws.com/prod-ucs-content-store-eu-west/content/pii:S037877881931686X/STRIPIN/image/svg+xml/5d725c884b7ac71631f30c08aa0bc6c4/si80.svg si80 si80.svg svg 5135 ALTIMG 1-s2.0-S037877881931686X-si90.svg https://s3-eu-west-1.amazonaws.com/prod-ucs-content-store-eu-west/content/pii:S037877881931686X/STRIPIN/image/svg+xml/2588ac742b8960e9c277193c26aa38e8/si90.svg si90 si90.svg svg 6045 ALTIMG 1-s2.0-S037877881931686X-si100.svg https://s3-eu-west-1.amazonaws.com/prod-ucs-content-store-eu-west/content/pii:S037877881931686X/STRIPIN/image/svg+xml/9c2bc20f4fade4222de5e4f782d6272a/si100.svg si100 si100.svg svg 18166 ALTIMG 1-s2.0-S037877881931686X-si110.svg https://s3-eu-west-1.amazonaws.com/prod-ucs-content-store-eu-west/content/pii:S037877881931686X/STRIPIN/image/svg+xml/c6863145d0d326f502c321ba3477f6eb/si110.svg si110 si110.svg svg 7112 ALTIMG 1-s2.0-S037877881931686X-si82.svg https://s3-eu-west-1.amazonaws.com/prod-ucs-content-store-eu-west/content/pii:S037877881931686X/STRIPIN/image/svg+xml/955de4fefd47b33beb0f6bb90d76e1ac/si82.svg si82 si82.svg svg 6031 ALTIMG 1-s2.0-S037877881931686X-si130.svg https://s3-eu-west-1.amazonaws.com/prod-ucs-content-store-eu-west/content/pii:S037877881931686X/STRIPIN/image/svg+xml/927999c74d3ee33eabe52d7bdba76894/si130.svg si130 si130.svg svg 21957 ALTIMG 1-s2.0-S037877881931686X-si15.svg https://s3-eu-west-1.amazonaws.com/prod-ucs-content-store-eu-west/content/pii:S037877881931686X/STRIPIN/image/svg+xml/8d8650c38bc5a6e1734bd931f2bc813d/si15.svg si15 si15.svg svg 9554 ALTIMG 1-s2.0-S037877881931686X-si102.svg https://s3-eu-west-1.amazonaws.com/prod-ucs-content-store-eu-west/content/pii:S037877881931686X/STRIPIN/image/svg+xml/e38474ebd3c8e6eb95f68e20cc608a48/si102.svg si102 si102.svg svg 9709 ALTIMG 1-s2.0-S037877881931686X-si118.svg https://s3-eu-west-1.amazonaws.com/prod-ucs-content-store-eu-west/content/pii:S037877881931686X/STRIPIN/image/svg+xml/d0e4d3f1c1214357d2892b60b4e3c5dd/si118.svg si118 si118.svg svg 6163 ALTIMG 1-s2.0-S037877881931686X-si18.svg https://s3-eu-west-1.amazonaws.com/prod-ucs-content-store-eu-west/content/pii:S037877881931686X/STRIPIN/image/svg+xml/7abe590cf4da5a1852d99fb8a45b662f/si18.svg si18 si18.svg svg 13029 ALTIMG 1-s2.0-S037877881931686X-si19.svg https://s3-eu-west-1.amazonaws.com/prod-ucs-content-store-eu-west/content/pii:S037877881931686X/STRIPIN/image/svg+xml/b33098355325a5db22628454d4ae185b/si19.svg si19 si19.svg svg 15761 ALTIMG 1-s2.0-S037877881931686X-si137.svg https://s3-eu-west-1.amazonaws.com/prod-ucs-content-store-eu-west/content/pii:S037877881931686X/STRIPIN/image/svg+xml/46a598895c138f20e74d98700c6e4484/si137.svg si137 si137.svg svg 9714 ALTIMG 1-s2.0-S037877881931686X-si22.svg https://s3-eu-west-1.amazonaws.com/prod-ucs-content-store-eu-west/content/pii:S037877881931686X/STRIPIN/image/svg+xml/22595e55a50ef31e99b5960d3bf8344a/si22.svg si22 si22.svg svg 5987 ALTIMG 1-s2.0-S037877881931686X-si23.svg https://s3-eu-west-1.amazonaws.com/prod-ucs-content-store-eu-west/content/pii:S037877881931686X/STRIPIN/image/svg+xml/2d796536c14db2f965146231580baf09/si23.svg si23 si23.svg svg 4695 ALTIMG 1-s2.0-S037877881931686X-si24.svg https://s3-eu-west-1.amazonaws.com/prod-ucs-content-store-eu-west/content/pii:S037877881931686X/STRIPIN/image/svg+xml/32c1951bdcf873921bae99f104de78c9/si24.svg si24 si24.svg svg 3437 ALTIMG 1-s2.0-S037877881931686X-si25.svg https://s3-eu-west-1.amazonaws.com/prod-ucs-content-store-eu-west/content/pii:S037877881931686X/STRIPIN/image/svg+xml/a3ba2a07b7cb012c96fa59631c38ba4e/si25.svg si25 si25.svg svg 4604 ALTIMG 1-s2.0-S037877881931686X-si26.svg https://s3-eu-west-1.amazonaws.com/prod-ucs-content-store-eu-west/content/pii:S037877881931686X/STRIPIN/image/svg+xml/42208e85892e903cee38396e1f12059b/si26.svg si26 si26.svg svg 3468 ALTIMG 1-s2.0-S037877881931686X-si27.svg https://s3-eu-west-1.amazonaws.com/prod-ucs-content-store-eu-west/content/pii:S037877881931686X/STRIPIN/image/svg+xml/bd4266b61b057984be4f74dddfba4c19/si27.svg si27 si27.svg svg 27821 ALTIMG 1-s2.0-S037877881931686X-si28.svg https://s3-eu-west-1.amazonaws.com/prod-ucs-content-store-eu-west/content/pii:S037877881931686X/STRIPIN/image/svg+xml/1be51e2d799dab6ccee2fa42868bbda1/si28.svg si28 si28.svg svg 21145 ALTIMG 1-s2.0-S037877881931686X-si29.svg https://s3-eu-west-1.amazonaws.com/prod-ucs-content-store-eu-west/content/pii:S037877881931686X/STRIPIN/image/svg+xml/9dd725eed52cf39819e9f1c2f28dc363/si29.svg si29 si29.svg svg 33459 ALTIMG 1-s2.0-S037877881931686X-si3.svg https://s3-eu-west-1.amazonaws.com/prod-ucs-content-store-eu-west/content/pii:S037877881931686X/STRIPIN/image/svg+xml/8e22714f84def415bd8e90852c9af55b/si3.svg si3 si3.svg svg 2154 ALTIMG 1-s2.0-S037877881931686X-si31.svg https://s3-eu-west-1.amazonaws.com/prod-ucs-content-store-eu-west/content/pii:S037877881931686X/STRIPIN/image/svg+xml/fa444d659f01147977d511e4d62d2658/si31.svg si31 si31.svg svg 6050 ALTIMG 1-s2.0-S037877881931686X-si32.svg https://s3-eu-west-1.amazonaws.com/prod-ucs-content-store-eu-west/content/pii:S037877881931686X/STRIPIN/image/svg+xml/ed9dcb74da639c1345b6574ce7da91a8/si32.svg si32 si32.svg svg 15758 ALTIMG 1-s2.0-S037877881931686X-si33.svg https://s3-eu-west-1.amazonaws.com/prod-ucs-content-store-eu-west/content/pii:S037877881931686X/STRIPIN/image/svg+xml/fa99282bccbec1368376b1590e4b7987/si33.svg si33 si33.svg svg 24438 ALTIMG 1-s2.0-S037877881931686X-si34.svg https://s3-eu-west-1.amazonaws.com/prod-ucs-content-store-eu-west/content/pii:S037877881931686X/STRIPIN/image/svg+xml/80b6c8731bace9b0b983aa38e8fc8888/si34.svg si34 si34.svg svg 5827 ALTIMG 1-s2.0-S037877881931686X-si35.svg https://s3-eu-west-1.amazonaws.com/prod-ucs-content-store-eu-west/content/pii:S037877881931686X/STRIPIN/image/svg+xml/7fa19000c3f0be8ab9b3591ab6809826/si35.svg si35 si35.svg svg 4641 ALTIMG 1-s2.0-S037877881931686X-si36.svg https://s3-eu-west-1.amazonaws.com/prod-ucs-content-store-eu-west/content/pii:S037877881931686X/STRIPIN/image/svg+xml/23e7870d80ecc2e589ea678a647b5a18/si36.svg si36 si36.svg svg 6049 ALTIMG 1-s2.0-S037877881931686X-si37.svg https://s3-eu-west-1.amazonaws.com/prod-ucs-content-store-eu-west/content/pii:S037877881931686X/STRIPIN/image/svg+xml/be25929b3cd614bbd9aae73d2479d8d6/si37.svg si37 si37.svg svg 5220 ALTIMG 1-s2.0-S037877881931686X-si38.svg https://s3-eu-west-1.amazonaws.com/prod-ucs-content-store-eu-west/content/pii:S037877881931686X/STRIPIN/image/svg+xml/0e1b8a89192f9f4ff1e3154f9539ac02/si38.svg si38 si38.svg svg 5078 ALTIMG 1-s2.0-S037877881931686X-si39.svg https://s3-eu-west-1.amazonaws.com/prod-ucs-content-store-eu-west/content/pii:S037877881931686X/STRIPIN/image/svg+xml/b96a92d015d20f52e1314bd98c4aaf27/si39.svg si39 si39.svg svg 5377 ALTIMG 1-s2.0-S037877881931686X-si4.svg https://s3-eu-west-1.amazonaws.com/prod-ucs-content-store-eu-west/content/pii:S037877881931686X/STRIPIN/image/svg+xml/d6d5a0848ad6108b75dce833d1498f2f/si4.svg si4 si4.svg svg 4193 ALTIMG 1-s2.0-S037877881931686X-si41.svg https://s3-eu-west-1.amazonaws.com/prod-ucs-content-store-eu-west/content/pii:S037877881931686X/STRIPIN/image/svg+xml/c265711e9c87803ff4ea4f7cbd3d2d51/si41.svg si41 si41.svg svg 3474 ALTIMG 1-s2.0-S037877881931686X-si42.svg https://s3-eu-west-1.amazonaws.com/prod-ucs-content-store-eu-west/content/pii:S037877881931686X/STRIPIN/image/svg+xml/00f563108961009a129c7266877119c1/si42.svg si42 si42.svg svg 20193 ALTIMG 1-s2.0-S037877881931686X-si43.svg https://s3-eu-west-1.amazonaws.com/prod-ucs-content-store-eu-west/content/pii:S037877881931686X/STRIPIN/image/svg+xml/b9e9476f814d3f4b1c6efbd68388487d/si43.svg si43 si43.svg svg 19427 ALTIMG 1-s2.0-S037877881931686X-si44.svg https://s3-eu-west-1.amazonaws.com/prod-ucs-content-store-eu-west/content/pii:S037877881931686X/STRIPIN/image/svg+xml/94c88e99e260452ea2487d5dffe445ab/si44.svg si44 si44.svg svg 4341 ALTIMG 1-s2.0-S037877881931686X-si45.svg https://s3-eu-west-1.amazonaws.com/prod-ucs-content-store-eu-west/content/pii:S037877881931686X/STRIPIN/image/svg+xml/20b3e95df2222ee99ad4b2b1741d3ad2/si45.svg si45 si45.svg svg 3305 ALTIMG 1-s2.0-S037877881931686X-si46.svg https://s3-eu-west-1.amazonaws.com/prod-ucs-content-store-eu-west/content/pii:S037877881931686X/STRIPIN/image/svg+xml/4b57f013771e1c73d2d35dece5ef03d6/si46.svg si46 si46.svg svg 21796 ALTIMG 1-s2.0-S037877881931686X-si47.svg https://s3-eu-west-1.amazonaws.com/prod-ucs-content-store-eu-west/content/pii:S037877881931686X/STRIPIN/image/svg+xml/3206e2e02784a4cd63e0ff6e207c0e6e/si47.svg si47 si47.svg svg 15213 ALTIMG 1-s2.0-S037877881931686X-si48.svg https://s3-eu-west-1.amazonaws.com/prod-ucs-content-store-eu-west/content/pii:S037877881931686X/STRIPIN/image/svg+xml/d1887f45c6ac13cdbabccd30e9ed6c6e/si48.svg si48 si48.svg svg 5199 ALTIMG 1-s2.0-S037877881931686X-si49.svg https://s3-eu-west-1.amazonaws.com/prod-ucs-content-store-eu-west/content/pii:S037877881931686X/STRIPIN/image/svg+xml/6748abc36012fc563e0dc0da8ecd4bdc/si49.svg si49 si49.svg svg 5935 ALTIMG 1-s2.0-S037877881931686X-si5.svg https://s3-eu-west-1.amazonaws.com/prod-ucs-content-store-eu-west/content/pii:S037877881931686X/STRIPIN/image/svg+xml/615ab200143df74e4fa3e0a016a67209/si5.svg si5 si5.svg svg 2695 ALTIMG 1-s2.0-S037877881931686X-si51.svg https://s3-eu-west-1.amazonaws.com/prod-ucs-content-store-eu-west/content/pii:S037877881931686X/STRIPIN/image/svg+xml/b104432a11cc05bb0830548b91226106/si51.svg si51 si51.svg svg 4991 ALTIMG 1-s2.0-S037877881931686X-si52.svg https://s3-eu-west-1.amazonaws.com/prod-ucs-content-store-eu-west/content/pii:S037877881931686X/STRIPIN/image/svg+xml/15cacb706cbde558d52efa7c078eea54/si52.svg si52 si52.svg svg 6398 ALTIMG 1-s2.0-S037877881931686X-si53.svg https://s3-eu-west-1.amazonaws.com/prod-ucs-content-store-eu-west/content/pii:S037877881931686X/STRIPIN/image/svg+xml/57cfd15055331416204ff30ecf6160c7/si53.svg si53 si53.svg svg 5571 ALTIMG 1-s2.0-S037877881931686X-si54.svg https://s3-eu-west-1.amazonaws.com/prod-ucs-content-store-eu-west/content/pii:S037877881931686X/STRIPIN/image/svg+xml/dbe5018df09476d293f679f5eaa0d121/si54.svg si54 si54.svg svg 5731 ALTIMG 1-s2.0-S037877881931686X-si55.svg https://s3-eu-west-1.amazonaws.com/prod-ucs-content-store-eu-west/content/pii:S037877881931686X/STRIPIN/image/svg+xml/d4ae25d7abd8222ad92c6c5a5b1d63ae/si55.svg si55 si55.svg svg 27403 ALTIMG 1-s2.0-S037877881931686X-si56.svg https://s3-eu-west-1.amazonaws.com/prod-ucs-content-store-eu-west/content/pii:S037877881931686X/STRIPIN/image/svg+xml/31a692946cb7b2982150abcb14ea9e67/si56.svg si56 si56.svg svg 7485 ALTIMG 1-s2.0-S037877881931686X-si57.svg https://s3-eu-west-1.amazonaws.com/prod-ucs-content-store-eu-west/content/pii:S037877881931686X/STRIPIN/image/svg+xml/1418c076ba1b30a4710e4ae7e06dd898/si57.svg si57 si57.svg svg 8205 ALTIMG 1-s2.0-S037877881931686X-si58.svg https://s3-eu-west-1.amazonaws.com/prod-ucs-content-store-eu-west/content/pii:S037877881931686X/STRIPIN/image/svg+xml/79800bcd71dc4e57f48354ac962abfe5/si58.svg si58 si58.svg svg 27735 ALTIMG 1-s2.0-S037877881931686X-si59.svg https://s3-eu-west-1.amazonaws.com/prod-ucs-content-store-eu-west/content/pii:S037877881931686X/STRIPIN/image/svg+xml/49171bd753594591d77377c4fe78eedb/si59.svg si59 si59.svg svg 19562 ALTIMG 1-s2.0-S037877881931686X-si6.svg https://s3-eu-west-1.amazonaws.com/prod-ucs-content-store-eu-west/content/pii:S037877881931686X/STRIPIN/image/svg+xml/1b5a27aed79495af2e22600191891f2a/si6.svg si6 si6.svg svg 2881 ALTIMG 1-s2.0-S037877881931686X-si61.svg https://s3-eu-west-1.amazonaws.com/prod-ucs-content-store-eu-west/content/pii:S037877881931686X/STRIPIN/image/svg+xml/33543bf92c7995a37d4a29225f29fdee/si61.svg si61 si61.svg svg 17610 ALTIMG 1-s2.0-S037877881931686X-si62.svg https://s3-eu-west-1.amazonaws.com/prod-ucs-content-store-eu-west/content/pii:S037877881931686X/STRIPIN/image/svg+xml/3d938ea1aff4af0904d1d9e07f639e83/si62.svg si62 si62.svg svg 3523 ALTIMG 1-s2.0-S037877881931686X-si63.svg https://s3-eu-west-1.amazonaws.com/prod-ucs-content-store-eu-west/content/pii:S037877881931686X/STRIPIN/image/svg+xml/56d018a84958ed1918cffdcd2946ee42/si63.svg si63 si63.svg svg 22077 ALTIMG 1-s2.0-S037877881931686X-si64.svg https://s3-eu-west-1.amazonaws.com/prod-ucs-content-store-eu-west/content/pii:S037877881931686X/STRIPIN/image/svg+xml/276f2d2b2ee58499cf102ddede3d9ba5/si64.svg si64 si64.svg svg 9449 ALTIMG 1-s2.0-S037877881931686X-si65.svg https://s3-eu-west-1.amazonaws.com/prod-ucs-content-store-eu-west/content/pii:S037877881931686X/STRIPIN/image/svg+xml/eda564a2872af12ad57cfc4fb0436540/si65.svg si65 si65.svg svg 18386 ALTIMG 1-s2.0-S037877881931686X-si66.svg https://s3-eu-west-1.amazonaws.com/prod-ucs-content-store-eu-west/content/pii:S037877881931686X/STRIPIN/image/svg+xml/6a7fb58f0a05b0cbe5bea0d42a55c82c/si66.svg si66 si66.svg svg 11737 ALTIMG 1-s2.0-S037877881931686X-si67.svg https://s3-eu-west-1.amazonaws.com/prod-ucs-content-store-eu-west/content/pii:S037877881931686X/STRIPIN/image/svg+xml/2ec45419c02cf25266cab06fad905987/si67.svg si67 si67.svg svg 9132 ALTIMG 1-s2.0-S037877881931686X-si68.svg https://s3-eu-west-1.amazonaws.com/prod-ucs-content-store-eu-west/content/pii:S037877881931686X/STRIPIN/image/svg+xml/b466219619dc96508df9ea62d9816ee9/si68.svg si68 si68.svg svg 20152 ALTIMG 1-s2.0-S037877881931686X-si69.svg https://s3-eu-west-1.amazonaws.com/prod-ucs-content-store-eu-west/content/pii:S037877881931686X/STRIPIN/image/svg+xml/5faf1fdeedcfefad36dbdcff1e26a40e/si69.svg si69 si69.svg svg 14826 ALTIMG 1-s2.0-S037877881931686X-si7.svg https://s3-eu-west-1.amazonaws.com/prod-ucs-content-store-eu-west/content/pii:S037877881931686X/STRIPIN/image/svg+xml/03ea667bbc55a83887b90c064d850559/si7.svg si7 si7.svg svg 3807 ALTIMG 1-s2.0-S037877881931686X-si71.svg https://s3-eu-west-1.amazonaws.com/prod-ucs-content-store-eu-west/content/pii:S037877881931686X/STRIPIN/image/svg+xml/625b84d3590a016120e30c493c7fdbc0/si71.svg si71 si71.svg svg 6365 ALTIMG 1-s2.0-S037877881931686X-si72.svg https://s3-eu-west-1.amazonaws.com/prod-ucs-content-store-eu-west/content/pii:S037877881931686X/STRIPIN/image/svg+xml/22f17acf7f8e8548dbb8551392869d01/si72.svg si72 si72.svg svg 1825 ALTIMG 1-s2.0-S037877881931686X-si73.svg https://s3-eu-west-1.amazonaws.com/prod-ucs-content-store-eu-west/content/pii:S037877881931686X/STRIPIN/image/svg+xml/06848668fd2207baccb45e4eacd210af/si73.svg si73 si73.svg svg 6213 ALTIMG 1-s2.0-S037877881931686X-si74.svg https://s3-eu-west-1.amazonaws.com/prod-ucs-content-store-eu-west/content/pii:S037877881931686X/STRIPIN/image/svg+xml/9b765b475b2930169ceb8ae57710aa19/si74.svg si74 si74.svg svg 4174 ALTIMG 1-s2.0-S037877881931686X-si75.svg https://s3-eu-west-1.amazonaws.com/prod-ucs-content-store-eu-west/content/pii:S037877881931686X/STRIPIN/image/svg+xml/6be87df4f564ac802c8d160d443c3c3f/si75.svg si75 si75.svg svg 9933 ALTIMG 1-s2.0-S037877881931686X-si76.svg https://s3-eu-west-1.amazonaws.com/prod-ucs-content-store-eu-west/content/pii:S037877881931686X/STRIPIN/image/svg+xml/bae40c9447413ff20a4c021b9c244caa/si76.svg si76 si76.svg svg 7896 ALTIMG 1-s2.0-S037877881931686X-si77.svg https://s3-eu-west-1.amazonaws.com/prod-ucs-content-store-eu-west/content/pii:S037877881931686X/STRIPIN/image/svg+xml/f65af8487c475e2bc9599e311886c1c8/si77.svg si77 si77.svg svg 2120 ALTIMG 1-s2.0-S037877881931686X-si78.svg https://s3-eu-west-1.amazonaws.com/prod-ucs-content-store-eu-west/content/pii:S037877881931686X/STRIPIN/image/svg+xml/f61d099fe48361bf774146dae6d806ee/si78.svg si78 si78.svg svg 4510 ALTIMG 1-s2.0-S037877881931686X-si79.svg https://s3-eu-west-1.amazonaws.com/prod-ucs-content-store-eu-west/content/pii:S037877881931686X/STRIPIN/image/svg+xml/280111e72f06f52cf647ea947e4dc748/si79.svg si79 si79.svg svg 2715 ALTIMG 1-s2.0-S037877881931686X-si8.svg https://s3-eu-west-1.amazonaws.com/prod-ucs-content-store-eu-west/content/pii:S037877881931686X/STRIPIN/image/svg+xml/af8b60b2e5cd4bbdb3dcc9fa5dd95096/si8.svg si8 si8.svg svg 4154 ALTIMG 1-s2.0-S037877881931686X-si81.svg https://s3-eu-west-1.amazonaws.com/prod-ucs-content-store-eu-west/content/pii:S037877881931686X/STRIPIN/image/svg+xml/1ea4f044bb0b7997357c0e04c5883393/si81.svg si81 si81.svg svg 3305 ALTIMG 1-s2.0-S037877881931686X-si84.svg https://s3-eu-west-1.amazonaws.com/prod-ucs-content-store-eu-west/content/pii:S037877881931686X/STRIPIN/image/svg+xml/6ece4d1e55575bca0c3ccfd5bcc3422d/si84.svg si84 si84.svg svg 12644 ALTIMG 1-s2.0-S037877881931686X-si85.svg https://s3-eu-west-1.amazonaws.com/prod-ucs-content-store-eu-west/content/pii:S037877881931686X/STRIPIN/image/svg+xml/b75dbca1f26bfa671f687ae5e97a5678/si85.svg si85 si85.svg svg 10905 ALTIMG 1-s2.0-S037877881931686X-si86.svg https://s3-eu-west-1.amazonaws.com/prod-ucs-content-store-eu-west/content/pii:S037877881931686X/STRIPIN/image/svg+xml/8dbfcceef42f19610b98cda94115cb4f/si86.svg si86 si86.svg svg 11853 ALTIMG 1-s2.0-S037877881931686X-si87.svg https://s3-eu-west-1.amazonaws.com/prod-ucs-content-store-eu-west/content/pii:S037877881931686X/STRIPIN/image/svg+xml/627da07631d5d9859da2769f249f0dad/si87.svg si87 si87.svg svg 5744 ALTIMG 1-s2.0-S037877881931686X-si88.svg https://s3-eu-west-1.amazonaws.com/prod-ucs-content-store-eu-west/content/pii:S037877881931686X/STRIPIN/image/svg+xml/cd8618badae0ec402439e8f324febdfe/si88.svg si88 si88.svg svg 9777 ALTIMG 1-s2.0-S037877881931686X-si89.svg https://s3-eu-west-1.amazonaws.com/prod-ucs-content-store-eu-west/content/pii:S037877881931686X/STRIPIN/image/svg+xml/72529641f021e50349b5278cb1616128/si89.svg si89 si89.svg svg 11022 ALTIMG 1-s2.0-S037877881931686X-si9.svg https://s3-eu-west-1.amazonaws.com/prod-ucs-content-store-eu-west/content/pii:S037877881931686X/STRIPIN/image/svg+xml/58c239a407068425bb8710463eacfbf5/si9.svg si9 si9.svg svg 2081 ALTIMG 1-s2.0-S037877881931686X-si91.svg https://s3-eu-west-1.amazonaws.com/prod-ucs-content-store-eu-west/content/pii:S037877881931686X/STRIPIN/image/svg+xml/3963a061f8f6996948a1c5b4b6332448/si91.svg si91 si91.svg svg 10530 ALTIMG 1-s2.0-S037877881931686X-si92.svg https://s3-eu-west-1.amazonaws.com/prod-ucs-content-store-eu-west/content/pii:S037877881931686X/STRIPIN/image/svg+xml/3af06b32c9df3a77a8e5ff08795eacbc/si92.svg si92 si92.svg svg 17066 ALTIMG 1-s2.0-S037877881931686X-si93.svg https://s3-eu-west-1.amazonaws.com/prod-ucs-content-store-eu-west/content/pii:S037877881931686X/STRIPIN/image/svg+xml/f34368447770017f1e2c4964ae6ac8bb/si93.svg si93 si93.svg svg 9452 ALTIMG 1-s2.0-S037877881931686X-si94.svg https://s3-eu-west-1.amazonaws.com/prod-ucs-content-store-eu-west/content/pii:S037877881931686X/STRIPIN/image/svg+xml/072abe1d144951ee4e2bf4d191c22ea3/si94.svg si94 si94.svg svg 3943 ALTIMG 1-s2.0-S037877881931686X-si95.svg https://s3-eu-west-1.amazonaws.com/prod-ucs-content-store-eu-west/content/pii:S037877881931686X/STRIPIN/image/svg+xml/1b6e1d15b60dab86732ce59b1f3764e8/si95.svg si95 si95.svg svg 4320 ALTIMG 1-s2.0-S037877881931686X-si96.svg https://s3-eu-west-1.amazonaws.com/prod-ucs-content-store-eu-west/content/pii:S037877881931686X/STRIPIN/image/svg+xml/a44d4ea5961d3f4547672836cdd46b7b/si96.svg si96 si96.svg svg 6412 ALTIMG 1-s2.0-S037877881931686X-si10.svg https://s3-eu-west-1.amazonaws.com/prod-ucs-content-store-eu-west/content/pii:S037877881931686X/STRIPIN/image/svg+xml/f3b144534563b59daa5c00a95942f1f3/si10.svg si10 si10.svg svg 4336 ALTIMG 1-s2.0-S037877881931686X-si97.svg https://s3-eu-west-1.amazonaws.com/prod-ucs-content-store-eu-west/content/pii:S037877881931686X/STRIPIN/image/svg+xml/113dd29b6ba7072d33da14d2ad8965cf/si97.svg si97 si97.svg svg 18461 ALTIMG 1-s2.0-S037877881931686X-si98.svg https://s3-eu-west-1.amazonaws.com/prod-ucs-content-store-eu-west/content/pii:S037877881931686X/STRIPIN/image/svg+xml/ec3e990dde4e2dba861cdd1ae87ca35d/si98.svg si98 si98.svg svg 28226 ALTIMG 1-s2.0-S037877881931686X-si99.svg https://s3-eu-west-1.amazonaws.com/prod-ucs-content-store-eu-west/content/pii:S037877881931686X/STRIPIN/image/svg+xml/604b848edfdc9ace8fc292c0af8ecde0/si99.svg si99 si99.svg svg 6687 ALTIMG 1-s2.0-S037877881931686X-si20.svg https://s3-eu-west-1.amazonaws.com/prod-ucs-content-store-eu-west/content/pii:S037877881931686X/STRIPIN/image/svg+xml/48d4cb0e5c3d5d3a2e1ac15888ae359e/si20.svg si20 si20.svg svg 2372 ALTIMG 1-s2.0-S037877881931686X-si30.svg https://s3-eu-west-1.amazonaws.com/prod-ucs-content-store-eu-west/content/pii:S037877881931686X/STRIPIN/image/svg+xml/e5818e2f13f248963ded73ed68a3168c/si30.svg si30 si30.svg svg 3854 ALTIMG 1-s2.0-S037877881931686X-si40.svg https://s3-eu-west-1.amazonaws.com/prod-ucs-content-store-eu-west/content/pii:S037877881931686X/STRIPIN/image/svg+xml/471b5a81960cd8c0a288b05a56173e73/si40.svg si40 si40.svg svg 25901 ALTIMG 1-s2.0-S037877881931686X-si120.svg https://s3-eu-west-1.amazonaws.com/prod-ucs-content-store-eu-west/content/pii:S037877881931686X/STRIPIN/image/svg+xml/6266725f1c467a7f882e5a8d19b118e2/si120.svg si120 si120.svg svg 3771 ALTIMG 1-s2.0-S037877881931686X-si16.svg https://s3-eu-west-1.amazonaws.com/prod-ucs-content-store-eu-west/content/pii:S037877881931686X/STRIPIN/image/svg+xml/45e6eaffc57258b5a2b1f4c56502c120/si16.svg si16 si16.svg svg 8708 ALTIMG 1-s2.0-S037877881931686X-si17.svg https://s3-eu-west-1.amazonaws.com/prod-ucs-content-store-eu-west/content/pii:S037877881931686X/STRIPIN/image/svg+xml/6dca27b3c218f2580c0cbe693a9026a4/si17.svg si17 si17.svg svg 26195 ALTIMG 1-s2.0-S037877881931686X-si101.svg https://s3-eu-west-1.amazonaws.com/prod-ucs-content-store-eu-west/content/pii:S037877881931686X/STRIPIN/image/svg+xml/aa2cdd68bc85cab2b40abf1dd9105b0c/si101.svg si101 si101.svg svg 9549 ALTIMG 1-s2.0-S037877881931686X-si2.svg https://s3-eu-west-1.amazonaws.com/prod-ucs-content-store-eu-west/content/pii:S037877881931686X/STRIPIN/image/svg+xml/bbf8f12ab8601baffa85e93e9461b6d7/si2.svg si2 si2.svg svg 4226 ALTIMG 1-s2.0-S037877881931686X-si103.svg https://s3-eu-west-1.amazonaws.com/prod-ucs-content-store-eu-west/content/pii:S037877881931686X/STRIPIN/image/svg+xml/45cf9089f0c61f108357c27305265daf/si103.svg si103 si103.svg svg 10350 ALTIMG 1-s2.0-S037877881931686X-si104.svg https://s3-eu-west-1.amazonaws.com/prod-ucs-content-store-eu-west/content/pii:S037877881931686X/STRIPIN/image/svg+xml/a6a100c38559b0138271b8b8aa04eae4/si104.svg si104 si104.svg svg 10562 ALTIMG 1-s2.0-S037877881931686X-si105.svg https://s3-eu-west-1.amazonaws.com/prod-ucs-content-store-eu-west/content/pii:S037877881931686X/STRIPIN/image/svg+xml/f5b3820120e7e44869990ef0655b937d/si105.svg si105 si105.svg svg 6368 ALTIMG 1-s2.0-S037877881931686X-si106.svg https://s3-eu-west-1.amazonaws.com/prod-ucs-content-store-eu-west/content/pii:S037877881931686X/STRIPIN/image/svg+xml/11ce042d002a9f679daa0348b560c458/si106.svg si106 si106.svg svg 5550 ALTIMG 1-s2.0-S037877881931686X-si107.svg https://s3-eu-west-1.amazonaws.com/prod-ucs-content-store-eu-west/content/pii:S037877881931686X/STRIPIN/image/svg+xml/1e42008d9d0f66f7f839af8c03fff9c6/si107.svg si107 si107.svg svg 9420 ALTIMG 1-s2.0-S037877881931686X-si108.svg https://s3-eu-west-1.amazonaws.com/prod-ucs-content-store-eu-west/content/pii:S037877881931686X/STRIPIN/image/svg+xml/aaccedbd0bcce026a6f5700ab2b50bca/si108.svg si108 si108.svg svg 8654 ALTIMG 1-s2.0-S037877881931686X-si109.svg https://s3-eu-west-1.amazonaws.com/prod-ucs-content-store-eu-west/content/pii:S037877881931686X/STRIPIN/image/svg+xml/095f4586a1fe8e051b29dfffa66f545c/si109.svg si109 si109.svg svg 11508 ALTIMG 1-s2.0-S037877881931686X-si11.svg https://s3-eu-west-1.amazonaws.com/prod-ucs-content-store-eu-west/content/pii:S037877881931686X/STRIPIN/image/svg+xml/1fc25e3fd05740e8492924591d4a836f/si11.svg si11 si11.svg svg 4422 ALTIMG 1-s2.0-S037877881931686X-si111.svg https://s3-eu-west-1.amazonaws.com/prod-ucs-content-store-eu-west/content/pii:S037877881931686X/STRIPIN/image/svg+xml/e7ec284971bb3a3839036ae99c11958f/si111.svg si111 si111.svg svg 5084 ALTIMG 1-s2.0-S037877881931686X-si112.svg https://s3-eu-west-1.amazonaws.com/prod-ucs-content-store-eu-west/content/pii:S037877881931686X/STRIPIN/image/svg+xml/061310152ccf3614aff29b22a3a189f9/si112.svg si112 si112.svg svg 12718 ALTIMG 1-s2.0-S037877881931686X-si113.svg https://s3-eu-west-1.amazonaws.com/prod-ucs-content-store-eu-west/content/pii:S037877881931686X/STRIPIN/image/svg+xml/f5d0b3d892b17805c5df5e88d1089b2c/si113.svg si113 si113.svg svg 10561 ALTIMG 1-s2.0-S037877881931686X-si114.svg https://s3-eu-west-1.amazonaws.com/prod-ucs-content-store-eu-west/content/pii:S037877881931686X/STRIPIN/image/svg+xml/827f9ebf319b49b349ea3ed45c6b99a0/si114.svg si114 si114.svg svg 8872 ALTIMG 1-s2.0-S037877881931686X-si115.svg https://s3-eu-west-1.amazonaws.com/prod-ucs-content-store-eu-west/content/pii:S037877881931686X/STRIPIN/image/svg+xml/20191935671dd980ee492d6a5a41cada/si115.svg si115 si115.svg svg 12097 ALTIMG 1-s2.0-S037877881931686X-si116.svg https://s3-eu-west-1.amazonaws.com/prod-ucs-content-store-eu-west/content/pii:S037877881931686X/STRIPIN/image/svg+xml/c547737e7a1a978cf806278efb04b703/si116.svg si116 si116.svg svg 13211 ALTIMG 1-s2.0-S037877881931686X-si117.svg https://s3-eu-west-1.amazonaws.com/prod-ucs-content-store-eu-west/content/pii:S037877881931686X/STRIPIN/image/svg+xml/07a32afa45a03321a356166c41506af5/si117.svg si117 si117.svg svg 7627 ALTIMG 1-s2.0-S037877881931686X-si119.svg https://s3-eu-west-1.amazonaws.com/prod-ucs-content-store-eu-west/content/pii:S037877881931686X/STRIPIN/image/svg+xml/8720be5cb563d9f9142f70a1b2ae651c/si119.svg si119 si119.svg svg 15162 ALTIMG 1-s2.0-S037877881931686X-si12.svg https://s3-eu-west-1.amazonaws.com/prod-ucs-content-store-eu-west/content/pii:S037877881931686X/STRIPIN/image/svg+xml/df3ae29540a5ffc267833b6dc9fd2b72/si12.svg si12 si12.svg svg 2147 ALTIMG 1-s2.0-S037877881931686X-si121.svg https://s3-eu-west-1.amazonaws.com/prod-ucs-content-store-eu-west/content/pii:S037877881931686X/STRIPIN/image/svg+xml/77c7439f86827791d1bd6040062b68c7/si121.svg si121 si121.svg svg 6285 ALTIMG 1-s2.0-S037877881931686X-si122.svg https://s3-eu-west-1.amazonaws.com/prod-ucs-content-store-eu-west/content/pii:S037877881931686X/STRIPIN/image/svg+xml/628879136b859b65bd5498b1bfc7f31c/si122.svg si122 si122.svg svg 10461 ALTIMG 1-s2.0-S037877881931686X-si123.svg https://s3-eu-west-1.amazonaws.com/prod-ucs-content-store-eu-west/content/pii:S037877881931686X/STRIPIN/image/svg+xml/86936c58e09fea6e6cda7a9f94690479/si123.svg si123 si123.svg svg 4411 ALTIMG 1-s2.0-S037877881931686X-si124.svg https://s3-eu-west-1.amazonaws.com/prod-ucs-content-store-eu-west/content/pii:S037877881931686X/STRIPIN/image/svg+xml/5a8ca7195c129dd46e178ff988c35b1b/si124.svg si124 si124.svg svg 4388 ALTIMG 1-s2.0-S037877881931686X-si125.svg https://s3-eu-west-1.amazonaws.com/prod-ucs-content-store-eu-west/content/pii:S037877881931686X/STRIPIN/image/svg+xml/e4be070024d5a3eb63ebb7ba5dea1bd6/si125.svg si125 si125.svg svg 3333 ALTIMG 1-s2.0-S037877881931686X-si126.svg https://s3-eu-west-1.amazonaws.com/prod-ucs-content-store-eu-west/content/pii:S037877881931686X/STRIPIN/image/svg+xml/71c06d574d52fffe2065b811ba02c502/si126.svg si126 si126.svg svg 8265 ALTIMG 1-s2.0-S037877881931686X-si127.svg https://s3-eu-west-1.amazonaws.com/prod-ucs-content-store-eu-west/content/pii:S037877881931686X/STRIPIN/image/svg+xml/bc116453dd19cdb4a9db1920c233d3fe/si127.svg si127 si127.svg svg 9270 ALTIMG 1-s2.0-S037877881931686X-si128.svg https://s3-eu-west-1.amazonaws.com/prod-ucs-content-store-eu-west/content/pii:S037877881931686X/STRIPIN/image/svg+xml/a7f892881187d677ee89d1ae79a28cb4/si128.svg si128 si128.svg svg 10931 ALTIMG 1-s2.0-S037877881931686X-si129.svg https://s3-eu-west-1.amazonaws.com/prod-ucs-content-store-eu-west/content/pii:S037877881931686X/STRIPIN/image/svg+xml/291da64383303d3a13297af3314f0bc5/si129.svg si129 si129.svg svg 7823 ALTIMG 1-s2.0-S037877881931686X-si13.svg https://s3-eu-west-1.amazonaws.com/prod-ucs-content-store-eu-west/content/pii:S037877881931686X/STRIPIN/image/svg+xml/9749a69c3d8efb4809d8e39a1806271d/si13.svg si13 si13.svg svg 5284 ALTIMG 1-s2.0-S037877881931686X-si131.svg https://s3-eu-west-1.amazonaws.com/prod-ucs-content-store-eu-west/content/pii:S037877881931686X/STRIPIN/image/svg+xml/3198ee070f1a3ae9a63f4f6d5db5a376/si131.svg si131 si131.svg svg 2292 ALTIMG 1-s2.0-S037877881931686X-si132.svg https://s3-eu-west-1.amazonaws.com/prod-ucs-content-store-eu-west/content/pii:S037877881931686X/STRIPIN/image/svg+xml/37f52ea24a3046b21bbfb6e2aa66073d/si132.svg si132 si132.svg svg 3795 ALTIMG 1-s2.0-S037877881931686X-si133.svg https://s3-eu-west-1.amazonaws.com/prod-ucs-content-store-eu-west/content/pii:S037877881931686X/STRIPIN/image/svg+xml/c814f051e3477ce410f0c8109fa3d602/si133.svg si133 si133.svg svg 16847 ALTIMG 1-s2.0-S037877881931686X-si134.svg https://s3-eu-west-1.amazonaws.com/prod-ucs-content-store-eu-west/content/pii:S037877881931686X/STRIPIN/image/svg+xml/0490552f92dd2b42f24ae692cb660fff/si134.svg si134 si134.svg svg 5258 ALTIMG 1-s2.0-S037877881931686X-si135.svg https://s3-eu-west-1.amazonaws.com/prod-ucs-content-store-eu-west/content/pii:S037877881931686X/STRIPIN/image/svg+xml/c3062a7e39b7a916ac2da1caf540443c/si135.svg si135 si135.svg svg 6188 ALTIMG 1-s2.0-S037877881931686X-si136.svg https://s3-eu-west-1.amazonaws.com/prod-ucs-content-store-eu-west/content/pii:S037877881931686X/STRIPIN/image/svg+xml/022f56e126f953632de91109c8b82ed7/si136.svg si136 si136.svg svg 5439 ALTIMG 1-s2.0-S037877881931686X-si14.svg https://s3-eu-west-1.amazonaws.com/prod-ucs-content-store-eu-west/content/pii:S037877881931686X/STRIPIN/image/svg+xml/e3be90b6853175604008852578967485/si14.svg si14 si14.svg svg 3058 ALTIMG 1-s2.0-S037877881931686X-si1.svg https://s3-eu-west-1.amazonaws.com/prod-ucs-content-store-eu-west/content/pii:S037877881931686X/STRIPIN/image/svg+xml/0017ce81b0594cfbe34b03ab3d0bdeb3/si1.svg si1 si1.svg svg 4235 ALTIMG 1-s2.0-S037877881931686X-am.pdf https://s3-eu-west-1.amazonaws.com/prod-ucs-content-store-eu-west/content/egi:104PDDWV66T/MAIN/application/pdf/f92de6b0b461c88a11e379fa29391aed/am.pdf am am.pdf pdf false 1850132 AAM-PDF ENB 109825 109825 S0378-7788(19)31686-X 10.1016/j.enbuild.2020.109825 Fig. 1 Zone Control Diagram with Adaptation. Fig. 1 Fig. 2 Case study I: Model of six-zone building. Fig. 2 Fig. 3 Case study I: Temperature tracking in all zones. Fig. 3 Fig. 4 Case study I: Supply air temperature and gain adaptation for East Zone, 2nd floor. Fig. 4 Fig. 5 Case study I: East Zone Temperature, 2nd floor. Fig. 5 Fig. 6 Case study II: Model of primary school building. Fig. 6 Fig. 7 Case study II: Temperature tracking in 10 different zones. Fig. 7 Fig. 8 Case study II: Supply air temperature of 10 zones. Fig. 8 Fig. 9 Case study II: Improved temperature tracking and energy consumption based on the choice of Γ i . Fig. 9 Fig. 10 Case study II: Adaptation of controller gains of CornerClass1Pod1 during 1 year. Fig. 10 Table 1 Nomenclature. Table 1 Symbol Definition ρa Air density in kg/m3 A w i , j Area of jth surface that surrounds zone i in m 2 Cpa Specific heat of air in J/kg∘C C w i , j Overall thermal capacity of jth surface that surrounds zone i in J/∘C C z i Overall thermal capacity of ith zone in J/∘C f sa i Volume flow rate of supply air of ith zone in m 3/s f i,p Volume flow rate between zones i and p due to convection in m3/s K o i Thermal transfer coefficient between zone i and the outside in W/∘C Mi Set of surfaces that surround zone i N Total number of zones Ni Set of direct neighboring zones of ith zone qi Internal heat gain of zone i in W T m i Target temperature for zone i in oC To Outside temperature in oC Ts Sampling time in s T sa i Supply air temperature in oC T w i , j Temperature of jth surface that surrounds zone i in oC T z i Temperature of ith zone in oC U w i , j Overall heat transfer coefficient of jth surface that surrounds zone i in W / m 2 ° C Table 2 Performance improvement when learning is introduced. Table 2 Tracking error improvemnt Energy consumption improvement January 36.80% 13.68% February 36.52% 14.03% March 35.65% 11.79% April 35.35% 12.39% May 35.54% 6.54% June 37.35% 5.19% July 37.90% 7.28% August 36.55% 7.04% September 34.22% 4.52% October 31.77% 9.01% November 30.63% 10.18% December 30.62% 12.81% Full Year 34.57% 9.51% ☆ This research did not receive any specific grant from funding agencies in the public, commercial, or not-for-profit sectors. Building temperature regulation in a multi-zone HVAC system using distributed adaptive control Building temperature regulation in a multi-zone HVAC system using distributed adaptive control Georgios Lymperopoulos Conceptualization Methodology Software Formal analysis Investigation Data curation Writing - original draft Writing - review & editing Visualization \u204e Petros Ioannou Conceptualization Methodology Writing - review & editing Supervision Department of Electrical Engineering, University of Southern California, 3740 McClintock Avenue, Los Angeles, CA 90089-2560, United States Department of Electrical Engineering University of Southern California 3740 McClintock Avenue Los Angeles CA 90089-2560 United States Department of Electrical Engineering, University of Southern California, 3740 McClintock Avenue, Los Angeles, CA 90089-2560, United States \u204e Corresponding author. During recent years there have been considerable research efforts on improving energy efficiency of buildings. Since Heating, Ventilation and Air-Conditioning (HVAC) systems are responsible for a big part of energy consumption, developing efficient HVAC control systems is crucial. In most of the developed approaches, precise knowledge of system parameters and/or adequate historical data is required. However, these approaches may not perform as well in the presence of dynamic parameter changes due to human activity, material degradation, and wear and tear, or disturbances and other operational uncertainties due to occupancy, solar gains, electrical equipment, and weather conditions. In this paper, we consider buildings with several climate zones and propose a distributed adaptive control scheme for a multi-zone HVAC system which can effectively regulate zone temperature by applying on-line learning and assuming exchange of information between neighboring zones. The controller of each zone achieves the local objective of controlling zone temperature by compensating for the effects of neighboring zones as well as for possible changes in the parameters of the system. Despite the exchange of information, each local controller does not know how the control actions and temperature of a neighboring zone affect the temperature of its own zone. For this reason, each local controller is estimating the parameters of the interconnections in real time and uses them together with the exchanged information to provide a more accurate local zone temperature control. The proposed method is illustrated using an example of temperature control in a six-zone building as well as a large school building, which are implemented in a Building Controls Virtual Test Bed (BCVTB) environment using EnergyPlus and MATLAB/Simulink. Keywords Temperature regulation HVAC systems Smart buildings Distributed control Adaptive control 1 Introduction Research has shown that buildings are one of the major energy consumers reaching up to 40% of final energy consumption in developed countries. Heating, Ventilation and Air-Conditioning systems (HVAC) are the largest contributors in building energy consumption, since they are responsible for 50% of final building energy needs [1]. Such systems are important for improving the quality of life in buildings, since they are necessary for providing comfortable temperature and air quality indoor conditions. Enhancing their efficiency can lead to reduced energy needs as well as improved climate conditions for occupants, while it can be a more cost-effective solution than replacing equipment with more modern technology [2]. Recent advances in sensors, electronics, and communications have motivated a lot of research for designing and optimizing HVAC control systems for buildings, often referred to as smart buildings. Developing appropriate mechanisms for operating and controlling HVAC systems is a challenging task for engineers and there have been several approaches on the subject. An accurate model of the building is crucial for the design of sophisticated HVAC systems. The zone model represents the heat dynamics of a space, the climate of which is controlled by an air-handling unit (AHU) or an air-terminal device [3,4]. Such a space is referred to as a thermal zone [5]. Air units are used to add or remove heat in order to modify zone temperature and overcome internal and external heat gains and losses. Although a building is usually divided into several zones, there exist centralized approaches that consider the whole building as an individual system. However, such schemes suffer from the disadvantages of centralized schemes, such as higher susceptibility to faults that affect temperature control, and higher computational demands. On the other hand, dividing a large building into multiple thermal zones and designing controllers for each zone leads to decentralized control schemes. Such control schemes are more robust to faults, since, if one zone fails locally, the fault does not affect the performance of the other zones. However, treating each zone as an isolated subsystem by ignoring the effects of neighboring zones may negatively affect performance. Strong interconnections may affect system performance if their impact cannot be attenuated, as analyzed in [6,7]. Air flow due to convection between thermal zones through internal openings is significant and can have a direct impact on zone temperature, since it results in heat transfer between zones, as explained in [8\u201310]. Neighboring zones also affect each other indirectly due to heat transfer by conduction through separating surfaces, as shown in [11] and in [12], where a feedback linearization scheme that reduces the heat transfer impact due to conduction is proposed. Therefore, a distributed approach that assigns to each thermal zone a local controller which takes into account the climate conditions of neighboring zones can combine tolerance to faults, which is a characteristic of a decentralized approach, with the high performance of a centralized scheme. Various research efforts have suggested a plethora of different approaches in order to overcome the several challenges of designing a satisfactory HVAC control mechanism. One of the principal approaches is the use of Model Predictive Control (MPC) techniques. Model predictive control consists of optimizing a cost function that expresses system performance based on some metric, while satisfying constraints on the feasible control actions. A comprehensive report of the characteristics and advantages of MPC can be found in [13], where distributed approaches with zone climate controllers that consider the neighboring zones effect, such as in [14], are preferred. In [15] the authors used sequential quadratic programming and dual decomposition to develop a distributed MPC scheme, while in [16] the authors designed a distributed MPC control scheme based on Benders\u2019 decomposition. The authors in [17] present a two-level hierarchical MPC scheme. More MPC approaches are presented in [18\u201326]. Other applied control techniques include classical control and advanced nonlinear and fuzzy control [27], such as the application of a fuzzy cognitive map. A novel approach that combines optimization techniques and simulation has been introduced in [28], in order to create a \u201dplug and play\u201d scheme. Optimal control strategies have been proposed [29], as well as LQ and cascade control [30,31], optimization [32,33], data-driven [34\u201338] and simulation approaches [39]. Such schemes have the advantage to be robust with respect to disturbances or parameter changes, but most of them require accurate knowledge of system parameters. Choosing the appropriate structure and strategy for HVAC control is a challenge that engineers are faced with. Many control approaches require knowledge of system parameters and dynamics, such as surfaces and thermal capacity of materials. However, dynamics change due to several factors, such as human activity or wear and tear. For example, the opening and closing of doors and windows changes drastically the surfaces that separate thermal zones and open doors create internal openings which lead to exchange of heat between zones due to convection. In addition, leakage in insulation may result in erroneous measurement of thermal capacity. Thus, a control scheme that needs exact and correct measurement of such parameters may prove to be problematic. Besides, there is often the case that surface temperature is uncontrolled, although it affects air temperature, which, in addition to disturbances such as outside weather conditions, heat gains from light or indoor human activity, can deteriorate system efficiency. The impact of the aforementioned uncertainties has been examined in [40]. Adaptive control does not require knowledge of system parameters, as it uses a parameter estimator in real time to estimate the unknown parameters and update the controller parameters accordingly. In [41] the authors proposed an adaptive and robust control scheme for nonlinear HVAC systems, which provides a solution in the case of one thermal zone. However, large buildings are usually divided into multiple zones. In this direction, several adaptive control schemes have been proposed including decentralized schemes, such as in [42] where the authors consider zones that are enclosed in other zones and in [43] where interactions between zones are considered to be bounded disturbances, and, thus, their impact is ignored. In addition, centralized approaches include adaptive feed-forward control schemes, such as in [44], and adaptive event-triggered control, as proposed in [45]. In [46] the authors use machine learning and propose an adaptive hybrid metaheuristic. Adaptive and learning-based approaches have also been proposed in [47,48]. Based on adaptive control and learning techniques for HVAC systems, combining the benefits of distributed control and at the same time removing the need for precise and up-to-date information on system parameters is of high practical importance. In this paper, we focus on controlling an HVAC system with multiple zones using a distributed adaptive control approach which assumes exchange of state information between zones but does not require accurate knowledge of system parameters. First, we examine the ideal case when the control designer has exact knowledge of system dynamics and parameters and zone temperature, surrounding surfaces temperature, supply air temperature, and outside air temperature are available for measurement for each zone. Given these assumptions, we show how a distributed control scheme can effectively achieve satisfactory performance and temperature regulation, even when unknown heat gains from human activity or other sources are included in the system. The consideration of the ideal case indicates what is achievable in a perfect world where all parameters are known exactly and forms the reference for comparing with, under non-ideal conditions. In the case where the system parameters are unknown we use the same controller structure as in the ideal case and replace all the unknown parameters with their on-line estimates generated by an adaptive law or parameter estimator. The proposed distributed adaptive control scheme guarantees performance and robustness with respect to all aforementioned uncertainties without requiring knowledge of system parameters. We demonstrate the performance of the proposed scheme by applying it to a two-story building as well as to a large school building for temperature regulation. The buildings are modeled using EnergyPlus software and the control scheme is implemented in MATLAB/Simulink. The overall system is co-simulated using Building Controls Virtual Test Bed (BCVTB) environment. Simulations under several scenarios and different conditions have been conducted in order to show the performance of the proposed scheme. The paper is organized as follows: Section 2 includes the notation and nomenclature regarding HVAC systems, while Section 3 presents the model of a multi-zone HVAC system and the control objectives. Section 4 presents the proposed control scheme and is divided into two subsections. The analysis for the case when the system parameters are known exactly is presented in Section 4.1. Section 4.2 presents the distributed adaptive control scheme for the case of unknown system parameters. Two case studies that demonstrate the application of the proposed control scheme to a two-story building and a large school building are presented in Section 5. Finally, the conclusion is presented in Section 6, while the Appendix includes the proofs of stability and robustness of the proposed control scheme. 2 Notation and nomenclature The field of real numbers is denoted by R . For any vector x ∈ R n , |x(k)| represents the Euclidean (l 2) vector norm in R n at each time k and for discrete time signals ∥ x k ∥ 2 δ ≜ ( ∑ i = 0 k δ k − i x ⊤ ( i ) x ( i ) ) 1 / 2 defines the exponentially weighted l 2 norm of a vector function x(k), where δ is a non-negative constant and k represents time. x ∈ l ∞ means that ∥ x ∥ ∞ = sup k ≥ 0 | x ( k ) | exists. λ max(A) and λ min(A) represent the maximum and minimum eigenvalue of a matrix A, respectively. 3 HVAC zone modeling and control objectives We consider the dynamical model of heat transfer associated with the HVAC system in a typical building consisting of N thermal zones, as follows [3,49,50]: (1a) d T z i d t = f sa i ρ a C p a C z i ( T sa i − T z i ) + ∑ j ∈ M i U w i , j A w i , j C z i ( T w i , j − T z i ) + ∑ p ∈ N i f i , p ρ a C p a C z i ( T z p − T z i ) + K o i C z i ( T o − T z i ) + q i C z i (1b) d T w i , j d t = U w i , j A w i , j C w i , j ( T z i − T w i , j ) + U w i , j A w i , j C w i , j ( T o − T w i , j ) (1c) d T w i , j d t = U w i , j A w i , j C w i , j ( T z i − T w i , j ) + U w i , j A w i , j C w i , j ( T z p − T w i , j ) ∀ i = 1 , ⋯ , N Eq. (1a) states that the rate of change of the zone temperature T z i is affected by the supply air temperature, the temperature of surrounding surfaces, the temperature of neighboring zones, weather conditions and internal and external heat gains. The various terms in Eqs. (1a)\u2013(1c) are listed in Table 1 and explained as follows: The temperature T z i in zone i is expressed in oC. C z i is the overall thermal capacity of the zone in J/∘C. f sa i denotes the volume flow rate of the supply air in m3/s, while T sa i represents the supply air temperature in oC. Cpa represents the specific heat of air in J/kg∘C and ρa denotes air density in kg/m3. The effect of surrounding surfaces temperature T w i , j on zone temperature is shown with U w i , j being the overall heat transfer coefficient of the jth surface that surrounds zone i in W/m2∘C and A w i , j denoting the respective surface area in m2. Mi is the set of surfaces that surround zone i. T z p denotes the zone temperature for a neighboring zone p and f i,p represents volume flow rate in m3/s between zones i and p ∈ Ni due to convection. Ni is the set of neighboring zones of zone i. In addition, outside temperature is represented by To , with K o i denoting the respective thermal transfer coefficient in W/∘C. Finally, qi is used to model heat gains and loses, which may emerge due to human activity in the room, lights, electrical equipment, as well as plant and model mismatch, such as wall leakage. qi is considered to be an unknown bounded disturbance that is either constant or slowly varying and is measured in Watt (W). It is assumed that the air in each zone i is fully mixed, zone distribution is uniform, air density is constant, there are no pressure losses across the zone and in the mixing section and Air Handling Units (AHUs) are ideal. The temperature T w i , j of the jth surface that surrounds zone i is affected by the temperature of the two spaces that it separates. One of the two spaces is the zone, while the other one is either another zone p or the outside. In the case of a surface separating a zone and the outside space, surface temperature satisfies the differential Eq. (1b), where To represents the outside temperature. For a surface that separates two zones, namely i and p, surface temperature satisfies the differential Eq. (1c). In (1b) and (1c), C w i , j denotes the overall thermal capacity of the corresponding surface, U w i , j is the overall heat transfer coefficient of the respective surface and is A w i , j is the surface area in m 2. In (1c) T z p represents the temperature of the neighboring zone p that is separated by the surface. The supply air from the air unit has a direct impact on zone temperature, while the temperature of the surfaces that surround a thermal zone is also a crucial factor due to heat transfer between air and the walls due to conduction. In addition, open surfaces between zones, such as open doors or windows, let heat transfer between zones due to convection and affect zone climate conditions significantly. Zone temperature is also affected by heat gains caused by human activity, lights, equipment, and weather conditions. In the heat transfer model (1a)\u2013(1c) it is assumed that all temperatures are measured. For a given building, identification techniques may be used to calculate the various constants that appear in (1a)\u2013(1c). These parameters may change with time due to various effects described below which could make the initially estimated parameters invalid. For example, the opening of a door due to human activity leads to air flow, and thus, heat transfer between zones due to convection, as analyzed in [8], and may significantly change the parameters f i,p and Aij in Eqs. (1a),(1c). In addition to that, leakages, material degradation and normal wear and tear may alter slowly but steadily thermal capacities, while such changes are not easily measured. The performance of insulation materials may degrade with time sometimes during the first 2\u20133 years after installation [51], which may lead to some parameter changes of up to 20%. Air density as well as zone temperature is considered to be uniformly distributed. However, depending on the air temperature, both the air density and the specific heat of air may slightly vary. A control system that is based on some initial estimate of the model parameters may considerably degrade in performance due to large parameter changes over time. In this paper, we design a controller that does not rely on the exact values of the parameters and has the capability to adapt to parameter changes. The structure of the model (1a) to (1c) motivates the use of a distributed controller structure where a controller is designed for each zone by taking into account possible interactions with neighboring zones in order to meet the objectives of each zone. This distributed structure has better robustness properties than a centralized one where a single central controller controls all zones. In the distributed case, a failure in a particular zone may be easily isolated, whereas in the centralized case it may affect all zones. Supply air is used as the control input to regulate zone temperature. HVAC systems can be divided into two major categories according to the way the adjust supply air. A large part of HVAC systems design focuses on appropriately adjusting supply air volume flow rate, while keeping supply air temperature constant to some predefined value. Such systems are known as Variable Air Volume (VAV) systems. On the other hand, there exist systems that keep supply air volume flow rate constant and adjust supply air temperature to meet the zone temperature objective. Such systems are known as Constant Air Volume (CAV) systems. Fan Coil Units (FCUs) are a widely applied type of HVAC equipment that often use constant air volume, or a small set of predefined values for supply air volume flow rate, and they operate by properly adjusting supply air temperature [47]. FCUs may often serve as the final air distribution units that adjust supply air temperature in multi-zone HVAC systems [52]. Control objective: Given the measurements T z i , T w i , j ∀ j ∈ M i , T z p ∀ p ∈ N i and To design the supply air temperature T sa i for each zone i, so that zone temperature T z i reaches a desired constant temperature target T m i , specified by the users of the system. In our formulation, we assume constant supply air volume flow rate, as in [49], and the control input is supply air temperature. 4 Distributed control scheme for multi-zone HVAC systems 4.1 Structure of control scheme Let\u2019s start by defining the zone temperature tracking error e i = T z i − T m i ∀ i = 1 , ⋯ , N which denotes how far the zone temperature deviates from the desired one. The control objective is to drive this error to zero or as close to zero as possible for all zones. Based on (1a), the tracking error satisfies the following differential equation: (2) e ˙ i = − α i e i + f sa i ρ a C p a C z i T sa i + ∑ j ∈ M i U w i , j A w i , j C z i T w i , j − α i T m i + ∑ p ∈ N i f i , p ρ a C p a C z i T z p + K o i C z i T o + q i C z i ∀ i = 1 , ⋯ , N where the parameter: (3) α i = f sa i ρ a C p a + ∑ p ∈ N i f i , p ρ a C p a + ∑ j ∈ M i U w i , j A w i , j + K o i C z i , ∀ i = 1 , ⋯ , N indicates how heat flows in the zone as a result of all contributing factors, such as zone dynamics, neighboring zones and surrounding surfaces. The discrete-time version of (2), which will be used to design the control input for digital implementation with sampling period Ts , is given as: (4) e i ( k + 1 ) = α d i e i ( k ) + b d i [ T sa i ( k ) + ∑ j ∈ M i U w i , j A w i , j f sa i ρ a C p a T w i , j ( k ) − α i C z i f sa i ρ a C p a T m i + ∑ p ∈ N i f i , p f sa i T z p ( k ) + K o i f sa i ρ a C p a T o ( k ) + 1 f sa i ρ a C p a q i ( k ) ] ∀ i = 1 , ⋯ , N where e(k) is the value of e(t) at time t = k T s and ∀ i = 1 , ⋯ , N : (5a) α d i = e − α i T s (5b) b d i = 1 α i ( 1 − e − α i T s ) f sa i ρ a C p a C z i The control input T sa i ∀ i = 1 , ⋯ , N should be chosen, so that error ei ∀ i = 1 , ⋯ , N converges to zero or close to zero despite the effects of neighboring zones, surrounding surfaces, outside weather conditions, etc. This reasoning suggests the following structure for the controller of each zone ∀ i = 1 , ⋯ , N : (6a) T sa i ( k ) = − K e i * e i ( k ) − ∑ j ∈ M i K w i , j * T w i , j ( k ) − K m i * T m i − ∑ p ∈ N i K i , p * T z p ( k ) − K out i * T o ( k ) − h i G i ( k ) (6b) G i ( k ) = G i ( k − 1 ) + e ( k ) where hi is the gain of the accumulator in (6b) and the gains K e i * , K w i , j * , K m i * , K i , p * and K out i * are calculated as follows: (7) K e i * = α m i − α d i b d i , K w i , j * = U w i , j A w i , j f sa i ρ a C p a , K m i * = − α i C z i f sa i ρ a C p a , K i , p * = f i , p f sa i , K out i * = K o i f sa i ρ a C p a where α m i is a design parameter which, together with gain hi , will be selected to achieve certain stability properties for the zone temperature. By applying the proposed control input (6a) on zone i, (4), the temperature tracking error of each zone satisfies the following error equation: (8) e i ( k + 1 ) = α m i e i ( k ) + b d i ( − h i G i ( k ) + 1 f sa i ρ a C p a q i ( k ) ) ∀ i = 1 , ⋯ , N . From (8), we derive that the temperature tracking error is given by the following transfer function: (9) e i ( z ) = z − 1 z 2 + ( h i b d i − 1 − α m i ) z + α m i b d i f sa i ρ a C p a q i ( z ) where z is the z-transform. The desired characteristic equation for (9) that guarantees stability and a certain desired rise time, overshoot and settling time [53] is of the form z 2 + c 1 z + c 0 = 0 , which can be used to choose the parameters hi and a m i . Given the stability of the characteristic equation of (9), the zone temperature tracking error converges to zero exponentially fast for constant heat gains q i . The controller described by (6a), (6b) and (7) assumes that the parameters of the model are known exactly which, as we argued before, is not a realistic assumption. Therefore, the significance of the controller (6a)\u2013(7) which drives the errors to zero is to serve as a reference when we consider the case of unknown model parameters in the following section. 4.2 Estimation of controller gains Since the parameters K e i * , K w i , j * , K m i * , K i , p * and K out i * are unknown, the controller (6a)\u2013(7) cannot be implemented. In this case, we use the following control input: (10) T sa i ( k ) = − K e i ( k ) e i ( k ) − ∑ j ∈ M i K w i , j ( k ) T w i , j ( k ) − K m i ( k ) T m i − ∑ p ∈ N i K i , p ( k ) T z p ( k ) − K out i ( k ) T o ( k ) − K i ( k ) where the gains K e i ( k ) , K w i , j ( k ) ∀ j ∈ M i , K m i ( k ) , K i , p ( k ) ∀ p ∈ N i , K out i ( k ) are replacing the gains K e i * , K w i , j * , K m i * , K i , p * , K out i * , respectively. The accumulator hiGi (k) has been replaced with Ki (k), with K i * being the unknown desired value of Ki (k). The updating rules of the gains K e i ( k ) , K w i , j ( k ) , K m i ( k ) , K i,p (k), K out i ( k ) and Ki (k) in (10) are developed according to the following process. First, the zone temperature tracking error Eq. (4) is re-written as: (11) e i ( k + 1 ) = α m i e i ( k ) + b d i * ( T sa i ( k ) + K e i * e i ( k ) + ∑ j ∈ M i K w i , j * T w i , j ( k ) + K m i * T m i + ∑ p ∈ N i K i , p * T z p ( k ) + K out i * T o ( k ) + K i * ) which is expressed in the form of the following linear parametric model [54]: (12) z i ( k ) = Θ i * ⊤ Φ i ( k ) where (13a) z i ( k ) = e i ( k ) − α m i e i ( k − 1 ) (13b) Θ i * = [ b d i * , b d i * K e i * , b d i * [ K w i , j * ] j ∈ M i , b d i * K m i * , b d i * [ K i , p * ] p ∈ N i , × b d i * K out i * , b d i * K i * ] ⊤ = [ θ 0 i * , θ 1 i * , [ θ 2 i , j * ] j ∈ M i , θ 3 i * , [ θ 4 i , p * ] p ∈ N i , θ 5 i * , θ 6 i * ] ⊤ (13c) Φ i ( k ) = [ T sa i ( k − 1 ) , e i ( k − 1 ) , [ T w i , j ( k − 1 ) ] j ∈ M i , T m i , × [ T z p ( k − 1 ) ] p ∈ N i , T o ( k − 1 ) , 1 ] ⊤ The linear in the parameters model (12) is used to estimate Θ i * . Let (14) Θ i ( k ) = [ θ 0 i ( k ) , θ 1 i ( k ) , [ θ 2 i , j ( k ) ] j ∈ M i , θ 3 i ( k ) , [ θ 4 i , p ( k ) ] p ∈ N i , × θ 5 i ( k ) , θ 6 i ( k ) ] ⊤ be the estimate of Θ i * at instant k. Then, the estimates of the controller gains are generated as follows ∀ i = 1 , ⋯ , N , ∀j ∈ Mi and ∀p ∈ Ni : (15) K e i ( k ) = θ 1 i ( k ) θ 0 i ( k ) , K w i , j ( k ) = θ 2 i , j ( k ) θ 0 i ( k ) , K m i ( k ) = θ 3 i ( k ) θ 0 i ( k ) , K i , p ( k ) = θ 4 i , p ( k ) θ 0 i ( k ) , K out i ( k ) = θ 5 i ( k ) θ 0 i ( k ) , K i ( k ) = θ 6 i ( k ) θ 0 i ( k ) where (16a) Θ ˜ i ( k ) = Θ i ( k − 1 ) + T s Γ i ϵ i ( k ) Φ i ( k ) (16b) [ Θ i ( k ) ] s = { [ Θ ˜ i ( k ) ] s if [ L i ] s ≤ [ Θ ˜ i ( k ) ] s ≤ [ U i ] s [ L i ] s if [ Θ ˜ i ( k ) ] s < [ L i ] s [ U i ] s if [ Θ ˜ i ( k ) ] s > [ U i ] s ∀ s = 0 , ⋯ , 4 + | M i | + | N i | (16c) ϵ i ( k ) = z i ( k ) m i 2 ( k ) = e i ( k ) − α m i e i ( k − 1 ) m i 2 ( k ) (16d) m i 2 ( k ) = 1 + T s Φ i ⊤ ( k ) Γ i Φ i ( k ) where [Θ i (k)] s denotes the sth element of Θ i (k) and the diagonal matrix Γ i = d i a g ( γ b d i , γ e i , [ γ w i , j ] j ∈ M i , γ m i , [ γ z p ] p ∈ N i , γ o i , γ i ) consists of the positive design constants γ b d i , γ e i , [ γ w i , j ] j ∈ M i , γ m i , [ γ z p ] p ∈ N i , γ o i , γ i , referred to as adaptive gains, that affect the speed of adaptation. Ui, Li are upper and lower bounds for the values of the elements of Θ i (k) and [Li ]0 > 0. The lower bound [Li ]0 of θ 0 i ( k ) has to be strictly positive to guarantee boundedness of the estimated gains. However, this is not constricting, since the real value of θ 0 i ( k ) is strictly positive due to system structure. The rest of the bounds [Ui ]0 and [Ui ] s , [Li ] s ∀ s = 1 , ⋯ , 4 + | M i | + | N i | serve as conservative bounds for the gain estimates to guarantee the boundedness of the gains in Eq. (15). Signals ϵ i and mi are auxiliary signals to be calculated inside the control mechanism. The controller (10) with the adaptation law (15)\u2013(16d) form the adaptive control system which does not require the knowledge of the model parameters. The following Theorem describes the stability properties of the closed loop system. Theorem 1 Consider the overall closed-loop system composed of the N subsystems (4) using the control scheme (10) , (15) . Then, ∀i ei ∈ l ∞ and ei converges to zero as k → ∞. Proof The proof of Theorem 1 is presented in the Appendix.□ Theorem 1 guarantees that all signals in the closed loop system of each zone are bounded and zone temperature tracking errors converge to zero with time. Thus, the scheme is able to completely cancel the impact of neighboring zones, surrounding surfaces, outside temperature and internal and external heat gains qi on zone temperature, making zones reach their temperature objectives satisfactorily. The result holds for unknown constant system parameters and disturbances, but can also be extended to slowly varying parameters or parameters with infrequent finite changes [55]. The proposed control scheme is scalable, since it distributes computational burden and its stability and convergence properties do not depend on the building and HVAC size. It should be noted that the closed loop poles α m i ∈ ( 0 , 1 ) should be chosen according to the individual thermal zone\u2019s requirements to achieve fast temperature regulation, without exhibiting unwanted oscillations or overshoot. Fig. 1 shows the closed loop configuration of one zone and interaction with other zones. In the next section, we use simulations to demonstrate the results of Theorem 1 and evaluate the properties and performance of the proposed control scheme. 5 Simulation results and discussion In this section, we present two case studies to show the effectiveness of the proposed control scheme. In the first case study, we apply the proposed scheme to regulate temperature in a two-story building with six interconnected thermal zones and we demonstrate the effect on temperature tracking, focusing on the impact of abrupt parameter changes. In the next study, we apply the proposed scheme to a large primary school building model and we examine the performance of the proposed control scheme under different scenarios. Since one of the basic characteristics of the proposed scheme is the utilization of learning, in both cases we compared its performance to the performance of a distributed control scheme that does not include adaptive learning. Both systems are simulated using EnergyPlus for the building and HVAC model and Matlab/Simulink for the control scheme, co-simulated using the Buildings Control Virtual Test Bed (BCVTB). 5.1 Case study I: Building with six interconnected thermal zones 5.1.1 Building description For our first study, we consider a building with two stories, each of which is divided into three thermal zones, as shown in Fig. 2 . The building includes zones that may be separated by walls but also zones that have no wall separation, to show how the proposed algorithm can handle both types of interconnections between zones. Each story has a large zone on the north side with dimensions 12.092 × 6.096 × 3.048 m3 and two smaller zones, one on the west side and one on the east side that have the same size and dimensions 6.096 × 6.096 × 3.048 m3. Any given zone is connected with a neighboring zone via a door of dimension 1 × 2 m2. The north zone has a window of dimensions 3 × 1.333 m2, while the west zone has a window of dimension 4 × 1.5 m2. In addition, there is a permanent horizontal opening of dimensions 10.192 × 4.096 m2 which connects the north zones of the two stories. The HVAC equipment is considered to be ideal, thus able to provide supply air with the desired temperature and volume flow rate. Supply air temperature is going to be calculated by the control scheme, while supply air volume flow rates are predefined. The north zones have supply air volume flow rate 0.260m3/s and the west and east ones have supply air volume flow rate 0.220m3/s. Heat gains in each zone consist of heat gains from occupants, lights and electronic equipment and they are scheduled to vary during the day. The control system is implemented using sampling time T s = 60 s . 5.1.2 Simulation results For the purpose of this demonstration, we consider a scenario where the HVAC system is operating, when at 8:00 am doors open and heat gain increases as people start using the building. Open doors result in direct interactions between zones. Several other weather, internal gains and parameter changes occur during the day. The proposed distributed adaptive control scheme regulates the temperature in all zones and its performance is compared to a distributed constant-gain control scheme which assumes exact knowledge of the parameters initially without being aware of any parameter changes. In order to quantify the impact of the proposed scheme, we propose the following metrics, which correspond to the change in the overall tracking error of the system and the overall change in energy consumption when compared to the baseline controller: (17) ϵ z = ∑ i = 1 N [ ∑ k | e z i ( k ) | − ∑ k | e ˜ z i ( k ) | ∑ k | e z i ( k ) | ] (18) ϵ E = | E HVAC N | − | E ˜ HVAC N | | E HVAC N | for total operating time where e z i and E HVAC N denote the zone temperature tracking error of zone i and the HVAC energy consumption in all N zones, respectively, for the baseline controller, while e ˜ z i and E ˜ HVAC N denote the performance and energy consumption, respectively, of the proposed distributed adaptive control scheme. For the current selection of design constants, the proposed control scheme achieves 28.35% improvement in overall temperature tracking performance over a one-month period. Based on the EnergyPlus energy consumption reporting, such improvement may be achieved with 2.05% reduction in total energy consumption. Fig. 3 shows the behavior of each zone at 8:00am when each control scheme is applied. The proposed adaptive scheme is able to react faster to the changes in the system and compensate faster for the heat transfer in most of the zones, even though both schemes eventually reach the temperature goal. As shown in Fig. 3 and reflected in the reduction of the overall tracking error, in most thermal zones the temperature may reach the desired one, within a 2% error margin, several minutes faster when the adaptive scheme is applied, compared to the constant-gain scheme. The fast reaction of the proposed control scheme is due to the adaptation of the controller gains to the new dynamics. For instance, Fig. 4 shows how the gain K m i changes to accommodate for the different dynamics due to a door opening and introduction of heat gains due to human activity. As shown in Eq. (7), the ideal value of K m i depends on the parameter αi , which is defined in Eq. (3) and depends on inter-zone air flow due to convection and separating surface area. Thus, when a change occurs, the gain estimate of K m i adapts to capture the new dynamics and the gain adaptation results in more accurate supply air temperature to be applied to the zone. In the same figure, it is also shown how capturing parameter changes by the adaptive control scheme is reflected on the applied control input T sa i . The proposed learning-based scheme adjusts supply air temperature faster to the appropriate value. In several cases fast and accurate temperature regulation is crucial, such as in intensive care units in hospitals or in museums with sensitive exhibits [42]. Satisfactory temperature regulation may also have an impact on learning ability in school [56]. Fig. 5 shows the performance of the proposed scheme compared to a non-learning one for one full day of operation, and how the scheme adapts to several heat gain and parameter changes. 5.2 Case study II: primary school building 5.2.1 Building description The second case study refers to the application of the proposed scheme to a large building with multiple thermal zones and varying heat loads, in order to further demonstrate its performance. The algorithm is implemented and regulates temperature in a prototype primary school building model, which is the ANSI/ASHRAE/IES Standard 90.1-2016 Primary School model, located in Denver, from the ASHRAE Standard 90.1 prototype buildings suite, as developed by Pacific Northwest National Laboratory [57]. The school building has 25 thermal zones, which vary in size and use. According to their use, the zones have different heat load patterns, which is a result of different occupancy levels and human activity, lighting or equipment, as well as weather impact. Naturally, neighboring zones are physically interconnected via walls and doors. The 3D building model of the school building is presented in Fig. 6 . The HVAC equipment of the building is ideal and is designed so supply air temperature may be controlled, while a constant value for the supply air volume flow rate is passed. Supply air volume flow rates are chosen based on zone dimensions. The modified EnergyPlus input data file (.idf) that describes the building and HVAC system is presented in the following Github link [58]. All schedules for occupancy levels, electrical equipment operation, lighting, door opening as well as weather conditions are included in the .idf file. 5.2.2 Simulation results The HVAC system of the school building is operating only on weekdays from 7am to 5pm. All zones have their individual occupancy schedule that corresponds to their use and corresponding schedules for their equipment and lighting. Doors are scheduled to open and close at several times to capture changes in the ways neighboring zones are connected. We have selected the temperature target for all zones to be T m i = 23 o C . The control system is implemented using sampling time T s = 60 s . The design constants correspond to the desired closed loop poles for each zone and the learning rates of the adaptive laws. The closed loop poles are chosen so that stability is preserved and the system achieves temperature regulation fast and unwanted oscillations or overshoot are avoided. Learning rates reflect the system disturbances and possible parameter changes. The projection bounds of the adaptive laws are conservative bounds for the controller gains that are estimated on-line. For comparison, we have implemented the distributed control scheme with adaptive learning and a distributed control scheme that does not include adaptation. The performance of the proposed algorithm is examined under different scenarios. First, we show the temperature tracking for the school\u2019s thermal zones during one day of operation during January. During one normal day of operation, the system has to deal with varying internal heat loads as well as interconnection changes due to doors. The tracking performance of ten different thermal zones during one day of operation is presented in Fig. 7 . By simulating and evaluating the performance for the full month of January, we measured 36.80% improvement in temperature tracking and 13.68% improvement in overall energy consumption, as reported by EnergyPlus software, using metrics in Eq. (17) and Eq. (18). The corresponding input signals for the same day of operation are presented in Fig. 8 , and they are all well-behaved. As shown in the figures, the system reacts whenever changes occur, with the proposed scheme being able to adapt to the changes faster, due to the existence of learning. Through on-line learning and improved heat allocation between zones, the proposed control methodology has shown to improve both temperature tracking and energy consumption. According to design priorities, the system moderator may choose to give priority to improved temperature tracking or improved energy consumption, by changing the learning rate of the controller. We have chosen learning rates Γ i by considering the nominal values of the building parameters to adapt the estimated parameters according to their scale. In order to illustrate how the choice of learning rate affects the trade-off between improved energy consumption and temperature tracking, we have simulated the system during the month of January, adjusting the value of Γ i . Fig. 9 shows how temperature tracking and energy consumption change depending on the learning rate, considering the original choice of Γ i from the previous simulation as the baseline and denoting it as Γ i * . Aligning with adaptive control theory, learning rate Γ i should be chosen adequately large to be able to respond fast enough to changes and the varying load demand, but also not too large, in order to avoid undesired oscillations, which may deteriorate system performance and negatively affect HVAC equipment. This implies that learning rates should be selected at the neighborhood where temperature tracking and energy consumption become less sensitive to changes in the value of Γ i . It should be noted that the performance recorded in Fig. 9 corresponds to the same one-month period and, thus, same weather conditions and heat load patterns, and may change for different time periods. Therefore, for the choice of Γ i , the controller should be able to learn adequately fast the varying load demand, to provide improved performance throughout the year. Every month of the year corresponds to different weather conditions and, thus, different loads to be satisfied by the HVAC system. Therefore, we test the system\u2019s performance during different periods of the year to capture the response of the control scheme during different weather conditions. The overall system is simulated during an one-year period. During one year, the average improvement is 34.57% in temperature tracking and 9.51% in overall energy consumption. Table 2 shows the results for each month and it can be shown that performance is improved, yet different for different weather conditions. The proposed control scheme is learning the needs of the building for different system changes and weather conditions, and is also able to continuously adapt to new conditions, since its learning ability is dynamic. Fig. 10 presents the controller gains for the Corner Class 1, Pod 1, during a one-year simulation, where it is shown how controller gains adjust for the different needs of each time period. Some parameter changes may happen gradually in a building\u2019s life. Thermal and insulation properties of materials and equipment may degrade significantly after a few years [51]. Therefore, we simulate system performance during January, but after a few years, considering insulation degradation of 15%, according to [51]. Since the impact of material degradation is hard to measure and quantify, the gains of the baseline controller without adaptation are calculated using the nominal values of the material properties. If insulation properties degrade, we measured 22.76% improvement in temperature tracking and 7.79% improvement in overall energy consumption when using the proposed distributed adaptive control scheme compared to a scheme that calculates control gains based on the nominal values of the materials. This result implies that not only performance is improved using the proposed scheme, but also the need for maintenance and recalibration of the control mechanism is reduced. Finally, we examined the importance of considering interconnections in the control design. In this case, we simulated the system performance during one full month of operation keeping the learning properties of the algorithm, but removing the controller terms that correspond to the direct and indirect heat transfer from neighboring zones. We measured that taking into account the physical interconnections of neighboring zones into the control design results in 30.14% improvement in temperature tracking and 10.61% improvement in overall energy consumption. While information on the indirect and direct impact of neighboring zones is not necessary for stability, heat is allocated through all thermal zones more efficiently when local controllers utilize such information. 6 Conclusions In this paper we propose a distributed adaptive control scheme for temperature regulation in multi-zone HVAC systems. The proposed scheme allocates energy between thermal zones efficiently and does not require accurate knowledge of model parameters, thus adjusting to parameter changes and unknown disturbances. We showed that the proposed scheme guarantees bounded signals and convergence of zone temperature to the desired one for all building zones, while convergence properties do not depend on the size of the system, thus making the control scheme scalable. Performance is evaluated by simulating the behavior of two different buildings in EnergyPlus. The introduction of adaptive learning and exchange of information between zones is shown to provide faster response to changes and more accurate temperature control while consuming less energy in realistic scenarios, when human activity, lighting, electrical equipment, door opening and closing, and varying weather conditions are considered. The scheme has also been shown to retain better performance when material degradation is considered. Understanding the dynamic nature of buildings and uncertainty in HVAC system, as also noted in [59], and considering natural heat exchange between neighboring thermal zones in the control design has been shown to be an important step in more efficient and cost-effective temperature control. CRediT authorship contribution statement Georgios Lymperopoulos: Conceptualization, Methodology, Software, Formal analysis, Investigation, Data curation, Writing - original draft, Writing - review & editing, Visualization. Petros Ioannou: Conceptualization, Methodology, Writing - review & editing, Supervision. Declaration of Competing Interest We wish to confirm that there are no known conflicts of interest associated with this publication and there has been no significant financial support for this work that could have influenced its outcome. Appendix Proof of Theorem 1 Proof Θ i (k) is generated by Eqs. (16a),(16b), which can be written in the following compact form: (A.19) Θ i ( k ) = P r o j [ Θ i ( k − 1 ) + T s Γ i ϵ i ( k ) Φ i ( k ) ] where we use the projection operator for discrete systems, as described in [54], with box constraints for each element of Θ i . The projection operator restricts adaptation between predefined bounds, within which the unknown desired gains are assumed to lie. First, we establish the properties of mi . From the definition of mi , Eq. (16d), we derive the following inequality: (A.20) m i 2 ( k ) ≥ 1 + T s λ m i n ( Γ i ) | Φ i ( k ) | 2 which implies: (A.21) | Φ i ( k ) | 2 m i 2 ( k ) ≤ | Φ i ( k ) | 2 1 + T s λ m i n ( Γ i ) | Φ i ( k ) | 2 which in turn implies that the normalized Φ i vector signal is bounded, i.e., | Φ i | m i ∈ l ∞ . Therefore, the normalized estimation error ϵ i is also bounded, i.e., ϵ i ∈ l ∞, since it can be written as follows: (A.22) ϵ i ( k ) = − Θ i * ⊤ Φ i ( k ) m i 2 ( k ) Using Eq. (A.22) we can derive that the quantity ϵ i mi ∈ l ∞ is also bounded, since we can write: (A.23) ϵ i ( k ) m i ( k ) = − Θ i * ⊤ Φ i ( k ) m i ( k ) = − Θ ¯ i ⊤ ( k − 1 ) Φ i ( k ) m i ( k ) where Θ ¯ i ( k ) = Θ i ( k ) − Θ i * is the estimation error of the gain. The projection operator in Eq. (A.19) confines the estimate Θ i inside the convex set Si , which is a hyperbox that is created by all the lower and upper bound constraints [Li ] s , [Ui ] s . Then, Eq. (A.19) can be rewritten as follows: (A.24) Θ i ( k ) = Θ i ( k − 1 ) + T s Γ i ϵ i ( k ) Φ i ( k ) + g ( k ) where (A.25) g ( k ) = { 0 if Θ i ( k − 1 ) + T s Γ i ϵ i ( k ) Φ i ( k ) ∈ S i Θ ^ i ( k ) − Θ ˜ i ( k ) if Θ i ( k − 1 ) + T s Γ i ϵ i ( k ) Φ i ( k ) ∉ S i where Θ ˜ i ( k ) = Θ i ( k − 1 ) + T s Γ i ϵ i ( k ) Φ i ( k ) and Θ ^ i ( k ) is the orthogonal projection of Θ ˜ i ( k ) to Si . The projection operator guarantees that Θ i ∈ l ∞. Next, we consider the following Lyapunov-like function: (A.26) V i ( k ) = Θ ¯ i ⊤ ( k ) Γ i − 1 Θ ¯ i ( k ) Then, using Eq. (A.26), we define the following difference: (A.27) V i ( k ) − V i ( k − 1 ) = Θ ¯ i ⊤ ( k − 1 ) Γ i − 1 Θ ¯ i ( k − 1 ) + T s 2 ϵ i 2 ( k ) Φ i ⊤ ( k ) Γ i Φ i ( k ) + g i ⊤ ( k ) Γ i − 1 g i ( k ) + 2 Θ ¯ i ⊤ ( k − 1 ) T s ϵ i ( k ) Φ i ( k ) + 2 g i ⊤ ( k ) T s ϵ i ( k ) Φ i ( k ) + 2 g i ⊤ ( k ) Θ ¯ i ( k − 1 ) − Θ ¯ i ⊤ ( k − 1 ) Γ i − 1 Θ ¯ i ( k − 1 ) The following three terms from (A.27) satisfy: (A.28) g i ⊤ ( k ) Γ i − 1 g i ( k ) + 2 g i ⊤ ( k ) ( Θ ¯ i ( k − 1 ) + T s ϵ i ( k ) Φ i ( k ) ) ≤ λ m a x ( Γ i − 1 ) ( Θ ^ i ( k ) − Θ ˜ i ( k ) ) ⊤ ( Θ ^ i ( k ) − Θ ˜ i ( k ) ) + 2 ( Θ ^ i ( k ) − Θ ˜ i ( k ) ) ⊤ ( Θ ˜ i ( k ) − Θ i * ( k ) ) ≤ c ( − 2 ( Θ ^ i ( k ) − Θ i * ( k ) ) ⊤ ( Θ ˜ i ( k ) − Θ ^ i ( k ) ) − | Θ ^ i ( k ) − Θ ˜ i ( k ) | 2 ) ≤ 0 where the last inequality is obtained by using ( Θ ^ i − Θ i * ) ⊤ ( Θ ˜ i − Θ ^ i ) ≥ 0 because of the projection property. Using (A.28) in (A.27) we obtain: (A.29) V i ( k ) − V i ( k − 1 ) = T s 2 ϵ i 2 ( k ) Φ i ⊤ ( k ) Γ i Φ i ( k ) + 2 Θ ¯ i ⊤ ( k − 1 ) T s ϵ i ( k ) Φ i ( k ) = T s 2 ϵ i 2 ( k ) Φ i ⊤ ( k ) Γ i Φ i ( k ) − 2 T s ϵ i 2 ( k ) m i 2 ( k ) = − 2 T s ϵ i 2 ( k ) m i 2 ( k ) ( 1 − T s Φ i ⊤ ( k ) Γ i Φ i ( k ) 2 m i 2 ( k ) ) Since for the chosen mi we have that T s Φ i ⊤ ( k ) Γ i Φ i ( k ) m i 2 ( k ) < 1 , it follows that: (A.30) V i ( k ) − V i ( k − 1 ) ≤ − T s ϵ i 2 ( k ) m i 2 ( k ) ≤ 0 Using the last inequality, we derive the following one: (A.31) ∑ k = 1 M ϵ i 2 ( k ) m i 2 ( k ) ≤ c ( V i ( 0 ) − V i ( M ) ) for some positive finite constant c > 0 and any positive integer M > 0. In addition, since the gain estimate is bounded, i.e. Θ i ∈ l ∞, it follows that the Lyapunov-like function Eqn A.26 is bounded too, i.e. Vi ∈ l ∞. Therefore, it follows from (A.31) that ϵ i (k)mi (k) ∈ l 2 which implies that ϵ i (k)mi (k) → 0 as k → ∞. Finally, because of the adaptive law (A.19), we have the following relation: (A.32) Θ i ( k ) − Θ i ( k − 1 ) ≤ T s Γ i ϵ i ( k ) m i ( k ) Φ i ( k ) m i ( k ) which implies that | Θ i ( k ) − Θ i ( k − 1 ) | ∈ l 2 and, thus, | Θ i ( k ) − Θ i ( k − 1 ) | → 0 as k → ∞. To summarize, the estimation scheme (16) has the following properties: (i) Θ i (k), ϵ i (k), ϵ i (k)mi (k) ∈ l ∞ (ii) ϵ i ( k ) m i ( k ) , | Θ i ( k ) − Θ i ( k − 1 ) | ∈ l 2 (iii) ϵ i ( k ) m i ( k ) , | Θ i ( k ) − Θ i ( k − 1 ) | → 0 , as k → ∞ In order to prove that temperature tracking is guaranteed even without prior knowledge of system parameters, we define the following signal: (A.33) m f 2 ( k ) ≜ 1 + ∑ i = 1 N ∥ e i k − 1 ∥ 2 δ 2 where \u2016( · ) k \u20162δ is the l 2δ norm, as defined in [54], for some δ ∈ ( A d 2 , 1 ] ∀ i , so that 1 δ z + A d has stable poles ∀i, where A d = max ∀ i , ∀ j ∈ N i ( a m i , a w i , j ) and a w i , j = e − 2 U w i , j A w i , j C w i , j T s . We can rewrite the zone temperature tracking error dynamics as follows: (A.34) e i = z z − a m i [ ϵ i m i 2 ] In addition, from the definition of mi , we derive the following inequality: (A.35) m i 2 ( k ) ≤ 1 + T s λ m a x ( Γ ) | Φ i ( k ) | 2 and for the elements of Φ i , we have that for some finite c > 0, | T w i , j ( k − 1 ) | ≤ c ∥ ( T z i ) k − 1 ∥ 2 δ + c ∥ ( T z p ) k − 1 ∥ 2 δ + c from (1b), (1c), | T z i ( k − 1 ) | ≤ | e i ( k − 1 ) | + c , T m i , T o ∈ l ∞ and, thus, | T sa i ( k − 1 ) | ≤ c | e i ( k − 1 ) | + c ∑ p ∈ N i ∥ e p k − 1 ∥ 2 δ + c ∑ p ∈ N i | e p ( k − 1 ) | + c , using Lemma A.12.33.ii of [54]. In addition, using Lemma A.12.33.ii of [54] and considering H ( z ) = 1 , we have that | e i ( k ) | ≤ ∥ e i k ∥ 2 δ . Therefore, | Φ i ( k ) | ≤ c ∑ i = 1 N ∥ e i k − 1 ∥ 2 δ 2 + c . That means that the signal mi is bounded by the signal mf : (A.36) m i ≤ c m f for some finite c > 0. Applying Lemma A.12.33 from [54] and since z z − a m i is analytic in | z | ≥ δ , Eq. (A.34) gives the following inequality for some finite c > 0: (A.37) ∥ e i k ∥ 2 δ ≤ c ∥ ϵ i m i k 2 ∥ 2 δ which, combined with inequality (A.36), produces the following inequality: (A.38) ∥ e i k ∥ 2 δ ≤ c ∥ ϵ i m i m f k ∥ 2 δ Combining relations (A.33) and (A.38), we derive the following inequality: (A.39) m f 2 ( k ) ≤ 1 + c ∥ g ˜ k − 1 m f k − 1 ∥ 2 δ 2 where (A.40) g ˜ 2 = ∑ i = 1 N | ϵ i m i | 2 By applying Lemma A.12.31 from [54] to inequality (A.39) and using the fact that the geometric mean of a series is less than the arithmetic mean, for some finite c > 0 we obtain the following inequality: (A.41) m f 2 ( k ) ≤ 1 + c ∑ p = 0 k − 1 δ k − p g ˜ 2 ( p ) m f 2 ( p ) ≤ 1 + c ∑ p = 0 k − 1 [ δ k − p g ˜ 2 ( p ) ∏ p < q < k ( 1 + δ k − q g ˜ 2 ( q ) ) ] ≤ 1 + c ∑ p = 0 k − 1 [ δ k − p g ˜ 2 ( p ) ( 1 + 1 k − p − 1 × ∑ q = p + 1 k − 1 ( δ k − q g ˜ 2 ( q ) ) ) k − p − 1 ] From the structure of g ˜ it follows that g ˜ ∈ l 2 . In addition, since δ < 1 we derive the following relation: (A.42) m f 2 ( k ) ≤ 1 + c ∑ p = 0 k − 1 [ δ k − p g ˜ 2 ( p ) ( 1 + c k − p − 1 ) k − p − 1 ] ≤ 1 + c ∑ p = 0 k − 1 [ δ k − p g ˜ 2 ( p ) e c ] for some finite c > 0. Therefore, again since g ˜ ∈ l 2 , for δ < 1, we conclude that the signal mf is bounded, i.e., mf ∈ l ∞, since the series in the last inequality converges. Hence, all temperature tracking errors ei ∈ l ∞ ∀i are bounded too, due to the definition of mf (A.33). Hence, signals Φ i , mi ∈ l ∞ are also bounded. In addition, from (16c) we have that z i = ϵ i m i 2 = ϵ i m i m i . Since ϵ i mi ∈ l 2 and mi ∈ l ∞, then zi ∈ l 2. This means that Θ i * ⊤ Φ i ∈ l 2 and Θ i * ⊤ Φ i → 0 . Thus, from: (A.43) e i = z z − a m i [ Θ i * ⊤ Φ i ] we have that for all zones the temperature tracking error is in l 2. This implies that ∀i ei → 0 as k→ ∞.□ References [1] L. Pérez-Lombard J. Ortiz C. Pout A review on buildings energy consumption information Energy Build. 40 3 2008 394 398 10.1016/j.enbuild.2007.03.007 L. Pérez-Lombard, J. Ortiz, C. Pout, A review on buildings energy consumption information, Energy and Buildings 40(3) (2008) 394\u2013398. 10.1016/j.enbuild.2007.03.007 [2] M. Rahman M. Rasul M. Khan Energy conservation measures in an institutional building in sub-tropical climate in Australia Appl. Energy 87 10 2010 2994 3004 10.1016/j.apenergy.2010.04.005 M. Rahman, M. Rasul, M. Khan, Energy conservation measures in an institutional building in sub-tropical climate in Australia, Applied Energy 87(10) (2010) 2994\u20133004. 10.1016/j.apenergy.2010.04.005 [3] B. Tashtoush M. Molhim M. Al-Rousan Dynamic model of an HVAC system for control analysis Energy 30 10 2005 1729 1745 10.1016/j.energy.2004.10.004 B. Tashtoush, M. Molhim, M. Al-Rousan, Dynamic model of an HVAC system for control analysis, Energy 30(10) (2005) 1729\u20131745. 10.1016/j.energy.2004.10.004 [4] Z. Afroz G. Shafiullah T. Urmee G. Higgins Modeling techniques used in building HVAC control systems: a review Renew. Sustain. Energy Rev. 83 2018 64 84 10.1016/j.rser.2017.10.044 Z. Afroz, G. Shafiullah, T. Urmee, G. Higgins, Modeling techniques used in building HVAC control systems: A review, Renewable and Sustainable Energy Reviews 83 (2018) 64\u201384. 10.1016/j.rser.2017.10.044 [5] G. Platt J. Li R. Li G. Poulton G. James J. Wall Adaptive HVAC zone modeling for sustainable buildings Energy Build. 42 4 2010 412 421 10.1016/j.enbuild.2009.10.009 G. Platt, J. Li, R. Li, G. Poulton, G. James, J. Wall, Adaptive HVAC zone modeling for sustainable buildings, Energy and Buildings 42(4) (2010) 412\u2013421. 10.1016/j.enbuild.2009.10.009 [6] G. Lymperopoulos P. Ioannou Adaptive control of networked distributed systems with unknown interconnections 2016 IEEE 55th Conference on Decision and Control (CDC) 2016 IEEE 10.1109/cdc.2016.7798787 G. Lymperopoulos, P. Ioannou, Adaptive control of networked distributed systems with unknown interconnections, in: 2016 IEEE 55th Conference on Decision and Control (CDC), IEEE, 2016. 10.1109/cdc.2016.7798787 [7] G. Lymperopoulos P. Ioannou Model reference adaptive control for networked distributed systems with strong interconnections and communication delays J. Syst. Sci. Complex. 31 1 2018 38 68 10.1007/s11424-018-7172-2 G. Lymperopoulos, P. Ioannou, Model reference adaptive control for networked distributed systems with strong interconnections and communication delays, Journal of Systems Science and Complexity 31(1) (2018) 38\u201368. 10.1007/s11424-018-7172-2 [8] S.A. Barakat Inter-zone convective heat transfer in buildings: areview J. Sol. Energy Eng. 109 2 1987 71 10.1115/1.3268195 S. A. Barakat, Inter-zone convective heat transfer in buildings: A review, Journal of Solar Energy Engineering 109(2) (1987) 71. 10.1115/1.3268195 [9] O.M. Lidwell Air exchange through doorways. the effect of temperature difference, turbulence and ventilation flow. J. Hyg. (Lond.) 79 1977 141 154 O. M. Lidwell, Air exchange through doorways. the effect of temperature difference, turbulence and ventilation flow., The Journal of hygiene 79 (1977) 141\u2013154. [10] G. Lymperopoulos P. Ioannou Distributed adaptive control of multi-zone HVAC systems 2019 27th Mediterranean Conference on Control and Automation (MED) 2019 IEEE 10.1109/med.2019.8798509 G. Lymperopoulos, P. Ioannou, Distributed adaptive control of multi-zone HVAC systems, in: 2019 27th Mediterranean Conference on Control and Automation (MED), IEEE, 2019a. 10.1109/med.2019.8798509 [11] G. Lymperopoulos P. Ioannou Distributed adaptive HVAC control for multi-zone buildings 2019 IEEE 58th Conference on Decision and Control (CDC) 2019 IEEE G. Lymperopoulos, P. Ioannou, Distributed adaptive HVAC control for multi-zone buildings, in: 2019 IEEE 58th Conference on Decision and Control (CDC), IEEE, 2019b. [12] M. Elnour N. Meskin Multi-zone HVAC control system design using feedback linearization 2017 5th International Conference on Control, Instrumentation, and Automation (ICCIA) 2017 IEEE 10.1109/icciautom.2017.8258687 M. Elnour, N. Meskin, Multi-zone HVAC control system design using feedback linearization, in: 2017 5th International Conference on Control, Instrumentation, and Automation (ICCIA), IEEE, 2017. 10.1109/icciautom.2017.8258687 [13] A. Afram F. Janabi-Sharifi Theory and applications of HVAC control systems \u2013 a review of model predictive control (MPC) Build. Environ. 72 2014 343 355 10.1016/j.buildenv.2013.11.016 A. Afram, F. Janabi-Sharifi, Theory and applications of HVAC control systems \u2013 a review of model predictive control (MPC), Building and Environment 72 (2014) 343\u2013355. 10.1016/j.buildenv.2013.11.016 [14] Z. Wang G. Hu C.J. Spanos Distributed model predictive control of bilinear HVAC systems using a convexification method 2017 11th Asian Control Conference (ASCC) 2017 IEEE 10.1109/ascc.2017.8287414 Z. Wang, G. Hu, C. J. Spanos, Distributed model predictive control of bilinear HVAC systems using a convexification method, in: 2017 11th Asian Control Conference (ASCC), IEEE, 2017. 10.1109/ascc.2017.8287414 [15] Y. Ma G. Anderson F. Borrelli A distributed predictive control approach to building temperature regulation Proceedings of the 2011 American Control Conference 2011 IEEE 10.1109/acc.2011.5991549 Y. Ma, G. Anderson, F. Borrelli, A distributed predictive control approach to building temperature regulation, in: Proceedings of the 2011 American Control Conference, IEEE, 2011. 10.1109/acc.2011.5991549 [16] P.-D. Moroşan R. Bourdais D. Dumur J. Buisson A distributed MPC strategy based on benders\u2019 decomposition applied to multi-source multi-zone temperature regulation J. Process Control 21 5 2011 729 737 10.1016/j.jprocont.2010.12.002 P.-D. Moroşan, R. Bourdais, D. Dumur, J. Buisson, A distributed MPC strategy based on benders\u2019 decomposition applied to multi-source multi-zone temperature regulation, Journal of Process Control 21(5) (2011) 729\u2013737. 10.1016/j.jprocont.2010.12.002 [17] Y. Long S. Liu L. Xie K.H. Johansson A hierarchical distributed MPC for HVAC systems 2016 American Control Conference (ACC) 2016 IEEE 10.1109/acc.2016.7525274 Y. Long, S. Liu, L. Xie, K. H. Johansson, A hierarchical distributed MPC for HVAC systems, in: 2016 American Control Conference (ACC), IEEE, 2016. 10.1109/acc.2016.7525274 [18] M. Razmara M. Maasoumy M. Shahbakhti R. Robinett Optimal exergy control of building HVAC system Appl. Energy 156 2015 555 565 10.1016/j.apenergy.2015.07.051 M. Razmara, M. Maasoumy, M. Shahbakhti, R. Robinett, Optimal exergy control of building HVAC system, Applied Energy 156 (2015) 555\u2013565. 10.1016/j.apenergy.2015.07.051 [19] J. Álvarez J. Redondo E. Camponogara J. Normey-Rico M. Berenguel P. Ortigosa Optimizing building comfort temperature regulation via model predictive control Energy Build. 57 2013 361 372 10.1016/j.enbuild.2012.10.044 J. Álvarez, J. Redondo, E. Camponogara, J. Normey-Rico, M. Berenguel, P. Ortigosa, Optimizing building comfort temperature regulation via model predictive control, Energy and Buildings 57 (2013) 361\u2013372. 10.1016/j.enbuild.2012.10.044 [20] S. Fielsch T. Grunert M. Stursberg A. Kummert Model predictive control for hydronic heating systems in residential buildings IFAC-PapersOnLine 50 1 2017 4216 4221 10.1016/j.ifacol.2017.08.817 S. Fielsch, T. Grunert, M. Stursberg, A. Kummert, Model predictive control for hydronic heating systems in residential buildings, IFAC-PapersOnLine 50(1) (2017) 4216\u20134221. 10.1016/j.ifacol.2017.08.817 [21] Y. Ma J. Matusko F. Borrelli Stochastic model predictive control for building HVAC systems: complexity and conservatism IEEE Trans. Control Syst. Technol. 23 1 2015 101 116 10.1109/tcst.2014.2313736 Y. Ma, J. Matusko, F. Borrelli, Stochastic model predictive control for building HVAC systems: Complexity and conservatism, IEEE Transactions on Control Systems Technology 23(1) (2015) 101\u2013116. 10.1109/tcst.2014.2313736 [22] A. Parisio S.P. Gutierrez Distributed model predictive control for building demand-side management 2018 European Control Conference (ECC) 2018 IEEE 10.23919/ecc.2018.8550233 A. Parisio, S. P. Gutierrez, Distributed model predictive control for building demand-side management, in: 2018 European Control Conference (ECC), IEEE, 2018. 10.23919/ecc.2018.8550233 [23] N.R. Patel M.J. Risbeck J.B. Rawlings M.J. Wenzel R.D. Turney Distributed economic model predictive control for large-scale building temperature regulation 2016 American Control Conference (ACC) 2016 IEEE 10.1109/acc.2016.7525028 N. R. Patel, M. J. Risbeck, J. B. Rawlings, M. J. Wenzel, R. D. Turney, Distributed economic model predictive control for large-scale building temperature regulation, in: 2016 American Control Conference (ACC), IEEE, 2016. 10.1109/acc.2016.7525028 [24] S. Koehler F. Borrelli Building temperature distributed control via explicit MPC and \u201ctrim and respond\u201d methods 2013 European Control Conference (ECC) 2013 IEEE 10.23919/ecc.2013.6669781 S. Koehler, F. Borrelli, Building temperature distributed control via explicit MPC and \u201ctrim and respond\u201d methods, in: 2013 European Control Conference (ECC), IEEE, 2013. 10.23919/ecc.2013.6669781 [25] M. Baranski L. Meyer J. Ftterer D. Mller Comparative study of neighbor communication approaches for distributed model predictive control in building energy systems Energy 182 2019 840 851 10.1016/j.energy.2019.06.037 M. Baranski, L. Meyer, J. Ftterer, D. Mller, Comparative study of neighbor communication approaches for distributed model predictive control in building energy systems, Energy 182 (2019) 840\u2013851. 10.1016/j.energy.2019.06.037 [26] S.M. Koehler F. Chuang Y. Ma A. Daly F. Borrelli Distributed model predictive control for forced-air systems Intelligent Building Control Systems 2017 Springer International Publishing 167 189 10.1007/978-3-319-68462-8_7 S. M. Koehler, F. Chuang, Y. Ma, A. Daly, F. Borrelli, Distributed model predictive control for forced-air systems, in: Intelligent Building Control Systems, Springer International Publishing, 2017, pp. 167\u2013189. 10.1007/978-3-319-68462-8_7 [27] F. Behrooz N. Mariun M. Marhaban M.M. Radzi A. Ramli Review of control techniques for HVAC systems\u2014nonlinearity approaches based on fuzzy cognitive maps Energies 11 3 2018 495 10.3390/en11030495 F. Behrooz, N. Mariun, M. Marhaban, M. M. Radzi, A. Ramli, Review of Control Techniques for HVAC Systems\u2014Nonlinearity Approaches Based on Fuzzy Cognitive Maps, Energies 11(3) (2018) 495. 10.3390/en11030495 [28] S. Baldi I. Michailidis E.B. Kosmatopoulos P.A. Ioannou A \u201dplug and play\u201d computationally efficient approach for control design of large-scale nonlinear systems using cosimulation: a combination of two \u201dingredients\u201d IEEE Control Syst. 34 5 2014 56 71 10.1109/mcs.2014.2333272 S. Baldi, I. Michailidis, E. B. Kosmatopoulos, P. A. Ioannou, A \"plug and play\" computationally efficient approach for control design of large-scale nonlinear systems using cosimulation: a combination of two \"ingredients\", IEEE Control Systems 34(5) (2014) 56\u201371. 10.1109/mcs.2014.2333272 [29] R. Yang L. Wang Optimal control strategy for HVAC system in building energy management PES T&D 2012 2012 IEEE 10.1109/tdc.2012.6281687 R. Yang, L. Wang, Optimal control strategy for HVAC system in building energy management, in: PES T&D 2012, IEEE, 2012. 10.1109/tdc.2012.6281687 [30] C. Price B.P. Rasmussen Optimal tuning of cascaded control architectures for nonlinear HVAC systems Sci. Technol. Built Environ. 23 8 2017 1190 1202 10.1080/23744731.2016.1262663 C. Price, B. P. Rasmussen, Optimal tuning of cascaded control architectures for nonlinear HVAC systems, Science and Technology for the Built Environment 23(8) (2017) 1190\u20131202. 10.1080/23744731.2016.1262663 [31] J. Zhuang Y. Chen J. Wu Cascade control for supply air temperature in a variable air volume system IOP Conference Series: Earth and Environmental Science 238 2019 012021 10.1088/1755-1315/238/1/012021 J. Zhuang, Y. Chen, J. Wu, Cascade control for supply air temperature in a variable air volume system, IOP Conference Series: Earth and Environmental Science 238 (2019) 012021. 10.1088/1755-1315/238/1/012021 [32] A. Jain T. Nghiem M. Morari R. Mangharam Learning and control using Gaussian processes 2018 ACM/IEEE 9th International Conference on Cyber-Physical Systems (ICCPS) 2018 IEEE 10.1109/iccps.2018.00022 A. Jain, T. Nghiem, M. Morari, R. Mangharam, Learning and control using gaussian processes, in: 2018 ACM/IEEE 9th International Conference on Cyber-Physical Systems (ICCPS), IEEE, 2018. 10.1109/iccps.2018.00022 [33] T. Hatanaka X. Zhang W. Shi M. Zhu N. Li Physics-integrated hierarchical/distributed HVAC optimization for multiple buildings with robustness against time delays 2017 IEEE 56th Annual Conference on Decision and Control (CDC) 2017 IEEE 10.1109/cdc.2017.8264650 T. Hatanaka, X. Zhang, W. Shi, M. Zhu, N. Li, Physics-integrated hierarchical/distributed HVAC optimization for multiple buildings with robustness against time delays, in: 2017 IEEE 56th Annual Conference on Decision and Control (CDC), IEEE, 2017. 10.1109/cdc.2017.8264650 [34] A. Jain F. Smarra M. Behl R. Mangharam Data-driven model predictive control with regression trees\u2014an application to building energy management ACM Trans. Cyber-Phys. Syst. 2 1 2018 1 21 10.1145/3127023 A. Jain, F. Smarra, M. Behl, R. Mangharam, Data-driven model predictive control with regression trees\u2014an application to building energy management, ACM Transactions on Cyber-Physical Systems 2(1) (2018) 1\u201321. 10.1145/3127023 [35] G. Costanzo S. Iacovella F. Ruelens T. Leurs B. Claessens Experimental analysis of data-driven control for a building heating system Sustain. Energy Grids Netw. 6 2016 81 90 10.1016/j.segan.2016.02.002 G. Costanzo, S. Iacovella, F. Ruelens, T. Leurs, B. Claessens, Experimental analysis of data-driven control for a building heating system, Sustainable Energy, Grids and Networks 6 (2016) 81\u201390. 10.1016/j.segan.2016.02.002 [36] A. Garnier J. Eynard M. Caussanel S. Grieu Predictive control of multizone HVAC systems in non-residential buildings IFAC Proc. 47 3 2014 12080 12085 10.3182/20140824-6-za-1003.01826 A. Garnier, J. Eynard, M. Caussanel, S. Grieu, Predictive control of multizone HVAC systems in non-residential buildings, IFAC Proceedings Volumes 47(3) (2014) 12080\u201312085. 10.3182/20140824-6-za-1003.01826 [37] S.M. Attaran R. Yusof H. Selamat A novel optimization algorithm based on epsilon constraint-RBF neural network for tuning PID controller in decoupled HVAC system Appl. Therm. Eng. 99 2016 613 624 10.1016/j.applthermaleng.2016.01.025 S. M. Attaran, R. Yusof, H. Selamat, A novel optimization algorithm based on epsilon constraint-RBF neural network for tuning PID controller in decoupled HVAC system, Applied Thermal Engineering 99 (2016) 613\u2013624. 10.1016/j.applthermaleng.2016.01.025 [38] D. Ivanova N. Valov M. Deyanov Application of the genetic algorithm for cascade control of a HVAC system MATEC Web of Conferences 292 2019 01064 10.1051/matecconf/201929201064 D. Ivanova, N. Valov, M. Deyanov, Application of the genetic algorithm for cascade control of a HVAC system, MATEC Web of Conferences 292 (2019) 01064. 10.1051/matecconf/201929201064 [39] M. Baranski J. Ftterer D. Mller Distributed exergy-based simulation-assisted control of HVAC supply chains Energy Build. 175 2018 131 140 10.1016/j.enbuild.2018.07.006 M. Baranski, J. Ftterer, D. Mller, Distributed exergy-based simulation-assisted control of HVAC supply chains, Energy and Buildings 175 (2018) 131\u2013140. 10.1016/j.enbuild.2018.07.006 [40] S. Goyal H.A. Ingley P. Barooah Effect of various uncertainties on the performance of occupancy-based optimal control of HVAC zones 2012 IEEE 51st IEEE Conference on Decision and Control (CDC) 2012 IEEE 10.1109/cdc.2012.6426111 S. Goyal, H. A. Ingley, P. Barooah, Effect of various uncertainties on the performance of occupancy-based optimal control of HVAC zones, in: 2012 IEEE 51st IEEE Conference on Decision and Control (CDC), IEEE, 2012. 10.1109/cdc.2012.6426111 [41] M.-L. Chiang L.-C. Fu Adaptive and robust control for nonlinear HVAC system 2006 IEEE International Conference on Systems, Man and Cybernetics 2006 IEEE 10.1109/icsmc.2006.385096 M.-L. Chiang, L.-C. Fu, Adaptive and robust control for nonlinear HVAC system, in: 2006 IEEE International Conference on Systems, Man and Cybernetics, IEEE, 2006. 10.1109/icsmc.2006.385096 [42] A. Buonomano U. Montanaro A. Palombo S. Santini Temperature and humidity adaptive control in multi-enclosed thermal zones under unexpected external disturbances Energy Build. 135 2017 263 285 10.1016/j.enbuild.2016.11.015 A. Buonomano, U. Montanaro, A. Palombo, S. Santini, Temperature and humidity adaptive control in multi-enclosed thermal zones under unexpected external disturbances, Energy and Buildings 135 (2017) 263\u2013285. 10.1016/j.enbuild.2016.11.015 [43] Z. Huaguang L. Cai Decentralized nonlinear adaptive control of an HVAC system IEEE Trans. Syst. Man Cybern. Part C (Appl. Rev.) 32 4 2002 493 498 10.1109/tsmcc.2002.807271 Z. Huaguang, L. Cai, Decentralized nonlinear adaptive control of an HVAC system, IEEE Transactions on Systems, Man and Cybernetics, Part C (Applications and Reviews) 32(4) (2002) 493\u2013498. 10.1109/tsmcc.2002.807271 [44] J.T. Wen S. Mishra S. Mukherjee N. Tantisujjatham M. Minakais Building temperature control with adaptive feedforward 52nd IEEE Conference on Decision and Control 2013 IEEE 10.1109/cdc.2013.6760646 J. T. Wen, S. Mishra, S. Mukherjee, N. Tantisujjatham, M. Minakais, Building temperature control with adaptive feedforward, in: 52nd IEEE Conference on Decision and Control, IEEE, 2013. 10.1109/cdc.2013.6760646 [45] N.K. Dhar N.K. Verma L. Behera Adaptive critic-based event-triggered control for HVAC system IEEE Trans. Ind. Inform. 14 1 2018 178 188 10.1109/tii.2017.2725899 N. K. Dhar, N. K. Verma, L. Behera, Adaptive critic-based event-triggered control for HVAC system, IEEE Transactions on Industrial Informatics 14(1) (2018) 178\u2013188. 10.1109/tii.2017.2725899 [46] A. Ghahramani S.A. Karvigh B. Becerik-Gerber HVAC System energy optimization using an adaptive hybrid metaheuristic Energy Build. 152 2017 149 161 10.1016/j.enbuild.2017.07.053 A. Ghahramani, S. A. Karvigh, B. Becerik-Gerber, HVAC system energy optimization using an adaptive hybrid metaheuristic, Energy and Buildings 152 (2017) 149\u2013161. 10.1016/j.enbuild.2017.07.053 [47] S. Yuan L. Zhang O. Holub S. Baldi Switched adaptive control of air handling units with discrete and saturated actuators IEEE Control Syst. Lett. 2 3 2018 417 422 10.1109/lcsys.2018.2840041 S. Yuan, L. Zhang, O. Holub, S. Baldi, Switched adaptive control of air handling units with discrete and saturated actuators, IEEE Control Systems Letters 2(3) (2018) 417\u2013422. 10.1109/lcsys.2018.2840041 [48] N. Radhakrishnan S. Srinivasan R. Su K. Poolla Learning-based hierarchical distributed HVAC scheduling with operational constraints IEEE Trans. Control Syst. Technol. 26 5 2018 1892 1900 10.1109/tcst.2017.2728004 N. Radhakrishnan, S. Srinivasan, R. Su, K. Poolla, Learning-based hierarchical distributed HVAC scheduling with operational constraints, IEEE Transactions on Control Systems Technology 26(5) (2018) 1892\u20131900. 10.1109/tcst.2017.2728004 [49] H. Huang L. Chen M. Mohammadzaheri E. Hu M. Chen Multi-zone temperature prediction in a commercial building using artificial neural network model 2013 10th IEEE International Conference on Control and Automation (ICCA) 2013 IEEE 10.1109/ICCA.2013.6565010 H. Huang, L. Chen, M. Mohammadzaheri, E. Hu, M. Chen, Multi-zone temperature prediction in a commercial building using artificial neural network model, in: 2013 10th IEEE International Conference on Control and Automation (ICCA), IEEE, 2013. 10.1109/ICCA.2013.6565010 [50] N. Elbaccouche B. Boussaid N. Abdelkrim C. Aubrun Hierarchical predictive control for multizone building 2016 14th International Conference on Control, Automation, Robotics and Vision (ICARCV) 2016 IEEE 10.1109/icarcv.2016.7838702 N. Elbaccouche, B. Boussaid, N. Abdelkrim, C. Aubrun, Hierarchical predictive control for multizone building, in: 2016 14th International Conference on Control, Automation, Robotics and Vision (ICARCV), IEEE, 2016. 10.1109/icarcv.2016.7838702 [51] G. Eleftheriadis M. Hamdy Impact of building envelope and mechanical component degradation on the whole building performance: a review paper Energy Procedia 132 2017 321 326 10.1016/j.egypro.2017.09.739 G. Eleftheriadis, M. Hamdy, Impact of building envelope and mechanical component degradation on the whole building performance: a review paper, Energy Procedia 132 (2017) 321\u2013326. 10.1016/j.egypro.2017.09.739 [52] J.B. Petersen J.D. Bendtsen J. Stoustrup Multi-zone modeling and energy efficient control of shopping center cooling 2018 IEEE Conference on Control Technology and Applications (CCTA) 2018 IEEE 10.1109/ccta.2018.8511559 J. B. Petersen, J. D. Bendtsen, J. Stoustrup, Multi-zone modeling and energy efficient control of shopping center cooling, in: 2018 IEEE Conference on Control Technology and Applications (CCTA), IEEE, 2018. 10.1109/ccta.2018.8511559 [53] K. Ogata Discrete-Time Control Systems (2nd Edition) 1995 Pearson K. Ogata, Discrete-Time Control Systems (2nd Edition), Pearson, 1995. [54] P. Ioannou B. Fidan Adaptive Control Tutorial (Advances in Design and Control) 2006 SIAM, Society for Industrial and Applied Mathematics P. Ioannou, B. Fidan, Adaptive Control Tutorial (Advances in Design and Control), SIAM, Society for Industrial and Applied Mathematics, 2006. [55] K.S. Tsakalis P.A. Ioannou Linear Time-Varying Systems: Control and Adaptation 1992 Prentice Hall K. S. Tsakalis, P. A. Ioannou, Linear Time-Varying Systems: Control and Adaptation, Prentice Hall, 1992. [56] M. Puteh M.H. Ibrahim M. Adnan C.N. Che\u2019Ahmad N.M. Noh Thermal comfort in classroom: constraints and issues Procedia - Soc. Behav. Sci. 46 2012 1834 1838 10.1016/j.sbspro.2012.05.388 M. Puteh, M. H. Ibrahim, M. Adnan, C. N. Che\u2019Ahmad, N. M. Noh, Thermal comfort in classroom: Constraints and issues, Procedia - Social and Behavioral Sciences 46 (2012) 1834\u20131838. 10.1016/j.sbspro.2012.05.388 [57] Pacific Northwest National Laboratory, 90.1 Prototype Building Models Primary School, Available in https://www.energycodes.gov/901-prototype-building-models-primary-school. [58] Github link for the Input Data Files (IDF), Available in https://github.com/lymperop/Primary_School_Building. [59] S. Baldi F. Zhang T.L. Quang P. Endel O. Holub Passive versus active learning in operation and adaptive maintenance of heating, ventilation, and air conditioning Appl. Energy 252 2019 113478 10.1016/j.apenergy.2019.113478 S. Baldi, F. Zhang, T. L. Quang, P. Endel, O. Holub, Passive versus active learning in operation and adaptive maintenance of heating, ventilation, and air conditioning, Applied Energy 252 (2019) 113478. 10.1016/j.apenergy.2019.113478",
    "scopus-id": "85081129562",
    "coredata": {
        "eid": "1-s2.0-S037877881931686X",
        "dc:description": "During recent years there have been considerable research efforts on improving energy efficiency of buildings. Since Heating, Ventilation and Air-Conditioning (HVAC) systems are responsible for a big part of energy consumption, developing efficient HVAC control systems is crucial. In most of the developed approaches, precise knowledge of system parameters and/or adequate historical data is required. However, these approaches may not perform as well in the presence of dynamic parameter changes due to human activity, material degradation, and wear and tear, or disturbances and other operational uncertainties due to occupancy, solar gains, electrical equipment, and weather conditions. In this paper, we consider buildings with several climate zones and propose a distributed adaptive control scheme for a multi-zone HVAC system which can effectively regulate zone temperature by applying on-line learning and assuming exchange of information between neighboring zones. The controller of each zone achieves the local objective of controlling zone temperature by compensating for the effects of neighboring zones as well as for possible changes in the parameters of the system. Despite the exchange of information, each local controller does not know how the control actions and temperature of a neighboring zone affect the temperature of its own zone. For this reason, each local controller is estimating the parameters of the interconnections in real time and uses them together with the exchanged information to provide a more accurate local zone temperature control. The proposed method is illustrated using an example of temperature control in a six-zone building as well as a large school building, which are implemented in a Building Controls Virtual Test Bed (BCVTB) environment using EnergyPlus and MATLAB/Simulink.",
        "openArchiveArticle": "false",
        "prism:coverDate": "2020-05-15",
        "openaccessUserLicense": null,
        "prism:aggregationType": "Journal",
        "prism:url": "https://api.elsevier.com/content/article/pii/S037877881931686X",
        "dc:creator": [
            {
                "@_fa": "true",
                "$": "Lymperopoulos, Georgios"
            },
            {
                "@_fa": "true",
                "$": "Ioannou, Petros"
            }
        ],
        "link": [
            {
                "@_fa": "true",
                "@rel": "self",
                "@href": "https://api.elsevier.com/content/article/pii/S037877881931686X"
            },
            {
                "@_fa": "true",
                "@rel": "scidir",
                "@href": "https://www.sciencedirect.com/science/article/pii/S037877881931686X"
            }
        ],
        "dc:format": "application/json",
        "openaccessType": null,
        "pii": "S0378-7788(19)31686-X",
        "prism:volume": "215",
        "articleNumber": "109825",
        "prism:publisher": "Elsevier B.V.",
        "dc:title": "Building temperature regulation in a multi-zone HVAC system using distributed adaptive control",
        "prism:copyright": "© 2020 Elsevier B.V. All rights reserved.",
        "openaccess": "0",
        "prism:issn": "03787788",
        "dcterms:subject": [
            {
                "@_fa": "true",
                "$": "Temperature regulation"
            },
            {
                "@_fa": "true",
                "$": "HVAC systems"
            },
            {
                "@_fa": "true",
                "$": "Smart buildings"
            },
            {
                "@_fa": "true",
                "$": "Distributed control"
            },
            {
                "@_fa": "true",
                "$": "Adaptive control"
            }
        ],
        "openaccessArticle": "false",
        "prism:publicationName": "Energy and Buildings",
        "openaccessSponsorType": null,
        "prism:pageRange": "109825",
        "pubType": "fla",
        "prism:coverDisplayDate": "15 May 2020",
        "prism:doi": "10.1016/j.enbuild.2020.109825",
        "prism:startingPage": "109825",
        "dc:identifier": "doi:10.1016/j.enbuild.2020.109825",
        "openaccessSponsorName": null
    },
    "objects": {"object": [
        {
            "@category": "standard",
            "@height": "375",
            "@width": "389",
            "@_fa": "true",
            "$": "https://api.elsevier.com/content/object/eid/1-s2.0-S037877881931686X-gr1.jpg?httpAccept=%2A%2F%2A",
            "@multimediatype": "JPEG image file",
            "@type": "IMAGE-DOWNSAMPLED",
            "@size": "54472",
            "@ref": "gr1",
            "@mimetype": "image/jpeg"
        },
        {
            "@category": "standard",
            "@height": "336",
            "@width": "753",
            "@_fa": "true",
            "$": "https://api.elsevier.com/content/object/eid/1-s2.0-S037877881931686X-gr10.jpg?httpAccept=%2A%2F%2A",
            "@multimediatype": "JPEG image file",
            "@type": "IMAGE-DOWNSAMPLED",
            "@size": "69820",
            "@ref": "gr10",
            "@mimetype": "image/jpeg"
        },
        {
            "@category": "standard",
            "@height": "308",
            "@width": "376",
            "@_fa": "true",
            "$": "https://api.elsevier.com/content/object/eid/1-s2.0-S037877881931686X-gr2.jpg?httpAccept=%2A%2F%2A",
            "@multimediatype": "JPEG image file",
            "@type": "IMAGE-DOWNSAMPLED",
            "@size": "17565",
            "@ref": "gr2",
            "@mimetype": "image/jpeg"
        },
        {
            "@category": "standard",
            "@height": "728",
            "@width": "753",
            "@_fa": "true",
            "$": "https://api.elsevier.com/content/object/eid/1-s2.0-S037877881931686X-gr3.jpg?httpAccept=%2A%2F%2A",
            "@multimediatype": "JPEG image file",
            "@type": "IMAGE-DOWNSAMPLED",
            "@size": "108556",
            "@ref": "gr3",
            "@mimetype": "image/jpeg"
        },
        {
            "@category": "standard",
            "@height": "229",
            "@width": "753",
            "@_fa": "true",
            "$": "https://api.elsevier.com/content/object/eid/1-s2.0-S037877881931686X-gr4.jpg?httpAccept=%2A%2F%2A",
            "@multimediatype": "JPEG image file",
            "@type": "IMAGE-DOWNSAMPLED",
            "@size": "36402",
            "@ref": "gr4",
            "@mimetype": "image/jpeg"
        },
        {
            "@category": "standard",
            "@height": "292",
            "@width": "753",
            "@_fa": "true",
            "$": "https://api.elsevier.com/content/object/eid/1-s2.0-S037877881931686X-gr5.jpg?httpAccept=%2A%2F%2A",
            "@multimediatype": "JPEG image file",
            "@type": "IMAGE-DOWNSAMPLED",
            "@size": "43233",
            "@ref": "gr5",
            "@mimetype": "image/jpeg"
        },
        {
            "@category": "standard",
            "@height": "234",
            "@width": "386",
            "@_fa": "true",
            "$": "https://api.elsevier.com/content/object/eid/1-s2.0-S037877881931686X-gr6.jpg?httpAccept=%2A%2F%2A",
            "@multimediatype": "JPEG image file",
            "@type": "IMAGE-DOWNSAMPLED",
            "@size": "26288",
            "@ref": "gr6",
            "@mimetype": "image/jpeg"
        },
        {
            "@category": "standard",
            "@height": "980",
            "@width": "734",
            "@_fa": "true",
            "$": "https://api.elsevier.com/content/object/eid/1-s2.0-S037877881931686X-gr7.jpg?httpAccept=%2A%2F%2A",
            "@multimediatype": "JPEG image file",
            "@type": "IMAGE-DOWNSAMPLED",
            "@size": "221878",
            "@ref": "gr7",
            "@mimetype": "image/jpeg"
        },
        {
            "@category": "standard",
            "@height": "993",
            "@width": "734",
            "@_fa": "true",
            "$": "https://api.elsevier.com/content/object/eid/1-s2.0-S037877881931686X-gr8.jpg?httpAccept=%2A%2F%2A",
            "@multimediatype": "JPEG image file",
            "@type": "IMAGE-DOWNSAMPLED",
            "@size": "205725",
            "@ref": "gr8",
            "@mimetype": "image/jpeg"
        },
        {
            "@category": "standard",
            "@height": "313",
            "@width": "751",
            "@_fa": "true",
            "$": "https://api.elsevier.com/content/object/eid/1-s2.0-S037877881931686X-gr9.jpg?httpAccept=%2A%2F%2A",
            "@multimediatype": "JPEG image file",
            "@type": "IMAGE-DOWNSAMPLED",
            "@size": "70939",
            "@ref": "gr9",
            "@mimetype": "image/jpeg"
        },
        {
            "@category": "thumbnail",
            "@height": "164",
            "@width": "170",
            "@_fa": "true",
            "$": "https://api.elsevier.com/content/object/eid/1-s2.0-S037877881931686X-gr1.sml?httpAccept=%2A%2F%2A",
            "@multimediatype": "GIF image file",
            "@type": "IMAGE-THUMBNAIL",
            "@size": "10878",
            "@ref": "gr1",
            "@mimetype": "image/gif"
        },
        {
            "@category": "thumbnail",
            "@height": "98",
            "@width": "219",
            "@_fa": "true",
            "$": "https://api.elsevier.com/content/object/eid/1-s2.0-S037877881931686X-gr10.sml?httpAccept=%2A%2F%2A",
            "@multimediatype": "GIF image file",
            "@type": "IMAGE-THUMBNAIL",
            "@size": "8258",
            "@ref": "gr10",
            "@mimetype": "image/gif"
        },
        {
            "@category": "thumbnail",
            "@height": "164",
            "@width": "200",
            "@_fa": "true",
            "$": "https://api.elsevier.com/content/object/eid/1-s2.0-S037877881931686X-gr2.sml?httpAccept=%2A%2F%2A",
            "@multimediatype": "GIF image file",
            "@type": "IMAGE-THUMBNAIL",
            "@size": "9794",
            "@ref": "gr2",
            "@mimetype": "image/gif"
        },
        {
            "@category": "thumbnail",
            "@height": "163",
            "@width": "169",
            "@_fa": "true",
            "$": "https://api.elsevier.com/content/object/eid/1-s2.0-S037877881931686X-gr3.sml?httpAccept=%2A%2F%2A",
            "@multimediatype": "GIF image file",
            "@type": "IMAGE-THUMBNAIL",
            "@size": "5953",
            "@ref": "gr3",
            "@mimetype": "image/gif"
        },
        {
            "@category": "thumbnail",
            "@height": "67",
            "@width": "219",
            "@_fa": "true",
            "$": "https://api.elsevier.com/content/object/eid/1-s2.0-S037877881931686X-gr4.sml?httpAccept=%2A%2F%2A",
            "@multimediatype": "GIF image file",
            "@type": "IMAGE-THUMBNAIL",
            "@size": "3302",
            "@ref": "gr4",
            "@mimetype": "image/gif"
        },
        {
            "@category": "thumbnail",
            "@height": "85",
            "@width": "219",
            "@_fa": "true",
            "$": "https://api.elsevier.com/content/object/eid/1-s2.0-S037877881931686X-gr5.sml?httpAccept=%2A%2F%2A",
            "@multimediatype": "GIF image file",
            "@type": "IMAGE-THUMBNAIL",
            "@size": "4233",
            "@ref": "gr5",
            "@mimetype": "image/gif"
        },
        {
            "@category": "thumbnail",
            "@height": "133",
            "@width": "219",
            "@_fa": "true",
            "$": "https://api.elsevier.com/content/object/eid/1-s2.0-S037877881931686X-gr6.sml?httpAccept=%2A%2F%2A",
            "@multimediatype": "GIF image file",
            "@type": "IMAGE-THUMBNAIL",
            "@size": "11937",
            "@ref": "gr6",
            "@mimetype": "image/gif"
        },
        {
            "@category": "thumbnail",
            "@height": "163",
            "@width": "122",
            "@_fa": "true",
            "$": "https://api.elsevier.com/content/object/eid/1-s2.0-S037877881931686X-gr7.sml?httpAccept=%2A%2F%2A",
            "@multimediatype": "GIF image file",
            "@type": "IMAGE-THUMBNAIL",
            "@size": "7955",
            "@ref": "gr7",
            "@mimetype": "image/gif"
        },
        {
            "@category": "thumbnail",
            "@height": "164",
            "@width": "121",
            "@_fa": "true",
            "$": "https://api.elsevier.com/content/object/eid/1-s2.0-S037877881931686X-gr8.sml?httpAccept=%2A%2F%2A",
            "@multimediatype": "GIF image file",
            "@type": "IMAGE-THUMBNAIL",
            "@size": "7498",
            "@ref": "gr8",
            "@mimetype": "image/gif"
        },
        {
            "@category": "thumbnail",
            "@height": "91",
            "@width": "219",
            "@_fa": "true",
            "$": "https://api.elsevier.com/content/object/eid/1-s2.0-S037877881931686X-gr9.sml?httpAccept=%2A%2F%2A",
            "@multimediatype": "GIF image file",
            "@type": "IMAGE-THUMBNAIL",
            "@size": "5763",
            "@ref": "gr9",
            "@mimetype": "image/gif"
        },
        {
            "@category": "high",
            "@height": "1664",
            "@width": "1725",
            "@_fa": "true",
            "$": "https://api.elsevier.com/content/object/eid/1-s2.0-S037877881931686X-gr1_lrg.jpg?httpAccept=%2A%2F%2A",
            "@multimediatype": "JPEG image file",
            "@type": "IMAGE-HIGH-RES",
            "@size": "435117",
            "@ref": "gr1",
            "@mimetype": "image/jpeg"
        },
        {
            "@category": "high",
            "@height": "1787",
            "@width": "4000",
            "@_fa": "true",
            "$": "https://api.elsevier.com/content/object/eid/1-s2.0-S037877881931686X-gr10_lrg.jpg?httpAccept=%2A%2F%2A",
            "@multimediatype": "JPEG image file",
            "@type": "IMAGE-HIGH-RES",
            "@size": "942572",
            "@ref": "gr10",
            "@mimetype": "image/jpeg"
        },
        {
            "@category": "high",
            "@height": "1365",
            "@width": "1667",
            "@_fa": "true",
            "$": "https://api.elsevier.com/content/object/eid/1-s2.0-S037877881931686X-gr2_lrg.jpg?httpAccept=%2A%2F%2A",
            "@multimediatype": "JPEG image file",
            "@type": "IMAGE-HIGH-RES",
            "@size": "137007",
            "@ref": "gr2",
            "@mimetype": "image/jpeg"
        },
        {
            "@category": "high",
            "@height": "3867",
            "@width": "4000",
            "@_fa": "true",
            "$": "https://api.elsevier.com/content/object/eid/1-s2.0-S037877881931686X-gr3_lrg.jpg?httpAccept=%2A%2F%2A",
            "@multimediatype": "JPEG image file",
            "@type": "IMAGE-HIGH-RES",
            "@size": "1158529",
            "@ref": "gr3",
            "@mimetype": "image/jpeg"
        },
        {
            "@category": "high",
            "@height": "1219",
            "@width": "4000",
            "@_fa": "true",
            "$": "https://api.elsevier.com/content/object/eid/1-s2.0-S037877881931686X-gr4_lrg.jpg?httpAccept=%2A%2F%2A",
            "@multimediatype": "JPEG image file",
            "@type": "IMAGE-HIGH-RES",
            "@size": "362004",
            "@ref": "gr4",
            "@mimetype": "image/jpeg"
        },
        {
            "@category": "high",
            "@height": "1550",
            "@width": "4001",
            "@_fa": "true",
            "$": "https://api.elsevier.com/content/object/eid/1-s2.0-S037877881931686X-gr5_lrg.jpg?httpAccept=%2A%2F%2A",
            "@multimediatype": "JPEG image file",
            "@type": "IMAGE-HIGH-RES",
            "@size": "482075",
            "@ref": "gr5",
            "@mimetype": "image/jpeg"
        },
        {
            "@category": "high",
            "@height": "1037",
            "@width": "1708",
            "@_fa": "true",
            "$": "https://api.elsevier.com/content/object/eid/1-s2.0-S037877881931686X-gr6_lrg.jpg?httpAccept=%2A%2F%2A",
            "@multimediatype": "JPEG image file",
            "@type": "IMAGE-HIGH-RES",
            "@size": "256039",
            "@ref": "gr6",
            "@mimetype": "image/jpeg"
        },
        {
            "@category": "high",
            "@height": "4341",
            "@width": "3250",
            "@_fa": "true",
            "$": "https://api.elsevier.com/content/object/eid/1-s2.0-S037877881931686X-gr7_lrg.jpg?httpAccept=%2A%2F%2A",
            "@multimediatype": "JPEG image file",
            "@type": "IMAGE-HIGH-RES",
            "@size": "1842655",
            "@ref": "gr7",
            "@mimetype": "image/jpeg"
        },
        {
            "@category": "high",
            "@height": "5275",
            "@width": "3900",
            "@_fa": "true",
            "$": "https://api.elsevier.com/content/object/eid/1-s2.0-S037877881931686X-gr8_lrg.jpg?httpAccept=%2A%2F%2A",
            "@multimediatype": "JPEG image file",
            "@type": "IMAGE-HIGH-RES",
            "@size": "2275759",
            "@ref": "gr8",
            "@mimetype": "image/jpeg"
        },
        {
            "@category": "high",
            "@height": "1666",
            "@width": "3992",
            "@_fa": "true",
            "$": "https://api.elsevier.com/content/object/eid/1-s2.0-S037877881931686X-gr9_lrg.jpg?httpAccept=%2A%2F%2A",
            "@multimediatype": "JPEG image file",
            "@type": "IMAGE-HIGH-RES",
            "@size": "606918",
            "@ref": "gr9",
            "@mimetype": "image/jpeg"
        },
        {
            "@category": "thumbnail",
            "@_fa": "true",
            "$": "https://api.elsevier.com/content/object/eid/1-s2.0-S037877881931686X-si83.svg?httpAccept=%2A%2F%2A",
            "@multimediatype": "Scalable Vector Graphics file",
            "@type": "ALTIMG",
            "@size": "2924",
            "@ref": "si83",
            "@mimetype": "image/svg+xml"
        },
        {
            "@category": "thumbnail",
            "@_fa": "true",
            "$": "https://api.elsevier.com/content/object/eid/1-s2.0-S037877881931686X-si21.svg?httpAccept=%2A%2F%2A",
            "@multimediatype": "Scalable Vector Graphics file",
            "@type": "ALTIMG",
            "@size": "2638",
            "@ref": "si21",
            "@mimetype": "image/svg+xml"
        },
        {
            "@category": "thumbnail",
            "@_fa": "true",
            "$": "https://api.elsevier.com/content/object/eid/1-s2.0-S037877881931686X-si50.svg?httpAccept=%2A%2F%2A",
            "@multimediatype": "Scalable Vector Graphics file",
            "@type": "ALTIMG",
            "@size": "3503",
            "@ref": "si50",
            "@mimetype": "image/svg+xml"
        },
        {
            "@category": "thumbnail",
            "@_fa": "true",
            "$": "https://api.elsevier.com/content/object/eid/1-s2.0-S037877881931686X-si60.svg?httpAccept=%2A%2F%2A",
            "@multimediatype": "Scalable Vector Graphics file",
            "@type": "ALTIMG",
            "@size": "3349",
            "@ref": "si60",
            "@mimetype": "image/svg+xml"
        },
        {
            "@category": "thumbnail",
            "@_fa": "true",
            "$": "https://api.elsevier.com/content/object/eid/1-s2.0-S037877881931686X-si70.svg?httpAccept=%2A%2F%2A",
            "@multimediatype": "Scalable Vector Graphics file",
            "@type": "ALTIMG",
            "@size": "4129",
            "@ref": "si70",
            "@mimetype": "image/svg+xml"
        },
        {
            "@category": "thumbnail",
            "@_fa": "true",
            "$": "https://api.elsevier.com/content/object/eid/1-s2.0-S037877881931686X-si80.svg?httpAccept=%2A%2F%2A",
            "@multimediatype": "Scalable Vector Graphics file",
            "@type": "ALTIMG",
            "@size": "5135",
            "@ref": "si80",
            "@mimetype": "image/svg+xml"
        },
        {
            "@category": "thumbnail",
            "@_fa": "true",
            "$": "https://api.elsevier.com/content/object/eid/1-s2.0-S037877881931686X-si90.svg?httpAccept=%2A%2F%2A",
            "@multimediatype": "Scalable Vector Graphics file",
            "@type": "ALTIMG",
            "@size": "6045",
            "@ref": "si90",
            "@mimetype": "image/svg+xml"
        },
        {
            "@category": "thumbnail",
            "@_fa": "true",
            "$": "https://api.elsevier.com/content/object/eid/1-s2.0-S037877881931686X-si100.svg?httpAccept=%2A%2F%2A",
            "@multimediatype": "Scalable Vector Graphics file",
            "@type": "ALTIMG",
            "@size": "18166",
            "@ref": "si100",
            "@mimetype": "image/svg+xml"
        },
        {
            "@category": "thumbnail",
            "@_fa": "true",
            "$": "https://api.elsevier.com/content/object/eid/1-s2.0-S037877881931686X-si110.svg?httpAccept=%2A%2F%2A",
            "@multimediatype": "Scalable Vector Graphics file",
            "@type": "ALTIMG",
            "@size": "7112",
            "@ref": "si110",
            "@mimetype": "image/svg+xml"
        },
        {
            "@category": "thumbnail",
            "@_fa": "true",
            "$": "https://api.elsevier.com/content/object/eid/1-s2.0-S037877881931686X-si82.svg?httpAccept=%2A%2F%2A",
            "@multimediatype": "Scalable Vector Graphics file",
            "@type": "ALTIMG",
            "@size": "6031",
            "@ref": "si82",
            "@mimetype": "image/svg+xml"
        },
        {
            "@category": "thumbnail",
            "@_fa": "true",
            "$": "https://api.elsevier.com/content/object/eid/1-s2.0-S037877881931686X-si130.svg?httpAccept=%2A%2F%2A",
            "@multimediatype": "Scalable Vector Graphics file",
            "@type": "ALTIMG",
            "@size": "21957",
            "@ref": "si130",
            "@mimetype": "image/svg+xml"
        },
        {
            "@category": "thumbnail",
            "@_fa": "true",
            "$": "https://api.elsevier.com/content/object/eid/1-s2.0-S037877881931686X-si15.svg?httpAccept=%2A%2F%2A",
            "@multimediatype": "Scalable Vector Graphics file",
            "@type": "ALTIMG",
            "@size": "9554",
            "@ref": "si15",
            "@mimetype": "image/svg+xml"
        },
        {
            "@category": "thumbnail",
            "@_fa": "true",
            "$": "https://api.elsevier.com/content/object/eid/1-s2.0-S037877881931686X-si102.svg?httpAccept=%2A%2F%2A",
            "@multimediatype": "Scalable Vector Graphics file",
            "@type": "ALTIMG",
            "@size": "9709",
            "@ref": "si102",
            "@mimetype": "image/svg+xml"
        },
        {
            "@category": "thumbnail",
            "@_fa": "true",
            "$": "https://api.elsevier.com/content/object/eid/1-s2.0-S037877881931686X-si118.svg?httpAccept=%2A%2F%2A",
            "@multimediatype": "Scalable Vector Graphics file",
            "@type": "ALTIMG",
            "@size": "6163",
            "@ref": "si118",
            "@mimetype": "image/svg+xml"
        },
        {
            "@category": "thumbnail",
            "@_fa": "true",
            "$": "https://api.elsevier.com/content/object/eid/1-s2.0-S037877881931686X-si18.svg?httpAccept=%2A%2F%2A",
            "@multimediatype": "Scalable Vector Graphics file",
            "@type": "ALTIMG",
            "@size": "13029",
            "@ref": "si18",
            "@mimetype": "image/svg+xml"
        },
        {
            "@category": "thumbnail",
            "@_fa": "true",
            "$": "https://api.elsevier.com/content/object/eid/1-s2.0-S037877881931686X-si19.svg?httpAccept=%2A%2F%2A",
            "@multimediatype": "Scalable Vector Graphics file",
            "@type": "ALTIMG",
            "@size": "15761",
            "@ref": "si19",
            "@mimetype": "image/svg+xml"
        },
        {
            "@category": "thumbnail",
            "@_fa": "true",
            "$": "https://api.elsevier.com/content/object/eid/1-s2.0-S037877881931686X-si137.svg?httpAccept=%2A%2F%2A",
            "@multimediatype": "Scalable Vector Graphics file",
            "@type": "ALTIMG",
            "@size": "9714",
            "@ref": "si137",
            "@mimetype": "image/svg+xml"
        },
        {
            "@category": "thumbnail",
            "@_fa": "true",
            "$": "https://api.elsevier.com/content/object/eid/1-s2.0-S037877881931686X-si22.svg?httpAccept=%2A%2F%2A",
            "@multimediatype": "Scalable Vector Graphics file",
            "@type": "ALTIMG",
            "@size": "5987",
            "@ref": "si22",
            "@mimetype": "image/svg+xml"
        },
        {
            "@category": "thumbnail",
            "@_fa": "true",
            "$": "https://api.elsevier.com/content/object/eid/1-s2.0-S037877881931686X-si23.svg?httpAccept=%2A%2F%2A",
            "@multimediatype": "Scalable Vector Graphics file",
            "@type": "ALTIMG",
            "@size": "4695",
            "@ref": "si23",
            "@mimetype": "image/svg+xml"
        },
        {
            "@category": "thumbnail",
            "@_fa": "true",
            "$": "https://api.elsevier.com/content/object/eid/1-s2.0-S037877881931686X-si24.svg?httpAccept=%2A%2F%2A",
            "@multimediatype": "Scalable Vector Graphics file",
            "@type": "ALTIMG",
            "@size": "3437",
            "@ref": "si24",
            "@mimetype": "image/svg+xml"
        },
        {
            "@category": "thumbnail",
            "@_fa": "true",
            "$": "https://api.elsevier.com/content/object/eid/1-s2.0-S037877881931686X-si25.svg?httpAccept=%2A%2F%2A",
            "@multimediatype": "Scalable Vector Graphics file",
            "@type": "ALTIMG",
            "@size": "4604",
            "@ref": "si25",
            "@mimetype": "image/svg+xml"
        },
        {
            "@category": "thumbnail",
            "@_fa": "true",
            "$": "https://api.elsevier.com/content/object/eid/1-s2.0-S037877881931686X-si26.svg?httpAccept=%2A%2F%2A",
            "@multimediatype": "Scalable Vector Graphics file",
            "@type": "ALTIMG",
            "@size": "3468",
            "@ref": "si26",
            "@mimetype": "image/svg+xml"
        },
        {
            "@category": "thumbnail",
            "@_fa": "true",
            "$": "https://api.elsevier.com/content/object/eid/1-s2.0-S037877881931686X-si27.svg?httpAccept=%2A%2F%2A",
            "@multimediatype": "Scalable Vector Graphics file",
            "@type": "ALTIMG",
            "@size": "27821",
            "@ref": "si27",
            "@mimetype": "image/svg+xml"
        },
        {
            "@category": "thumbnail",
            "@_fa": "true",
            "$": "https://api.elsevier.com/content/object/eid/1-s2.0-S037877881931686X-si28.svg?httpAccept=%2A%2F%2A",
            "@multimediatype": "Scalable Vector Graphics file",
            "@type": "ALTIMG",
            "@size": "21145",
            "@ref": "si28",
            "@mimetype": "image/svg+xml"
        },
        {
            "@category": "thumbnail",
            "@_fa": "true",
            "$": "https://api.elsevier.com/content/object/eid/1-s2.0-S037877881931686X-si29.svg?httpAccept=%2A%2F%2A",
            "@multimediatype": "Scalable Vector Graphics file",
            "@type": "ALTIMG",
            "@size": "33459",
            "@ref": "si29",
            "@mimetype": "image/svg+xml"
        },
        {
            "@category": "thumbnail",
            "@_fa": "true",
            "$": "https://api.elsevier.com/content/object/eid/1-s2.0-S037877881931686X-si3.svg?httpAccept=%2A%2F%2A",
            "@multimediatype": "Scalable Vector Graphics file",
            "@type": "ALTIMG",
            "@size": "2154",
            "@ref": "si3",
            "@mimetype": "image/svg+xml"
        },
        {
            "@category": "thumbnail",
            "@_fa": "true",
            "$": "https://api.elsevier.com/content/object/eid/1-s2.0-S037877881931686X-si31.svg?httpAccept=%2A%2F%2A",
            "@multimediatype": "Scalable Vector Graphics file",
            "@type": "ALTIMG",
            "@size": "6050",
            "@ref": "si31",
            "@mimetype": "image/svg+xml"
        },
        {
            "@category": "thumbnail",
            "@_fa": "true",
            "$": "https://api.elsevier.com/content/object/eid/1-s2.0-S037877881931686X-si32.svg?httpAccept=%2A%2F%2A",
            "@multimediatype": "Scalable Vector Graphics file",
            "@type": "ALTIMG",
            "@size": "15758",
            "@ref": "si32",
            "@mimetype": "image/svg+xml"
        },
        {
            "@category": "thumbnail",
            "@_fa": "true",
            "$": "https://api.elsevier.com/content/object/eid/1-s2.0-S037877881931686X-si33.svg?httpAccept=%2A%2F%2A",
            "@multimediatype": "Scalable Vector Graphics file",
            "@type": "ALTIMG",
            "@size": "24438",
            "@ref": "si33",
            "@mimetype": "image/svg+xml"
        },
        {
            "@category": "thumbnail",
            "@_fa": "true",
            "$": "https://api.elsevier.com/content/object/eid/1-s2.0-S037877881931686X-si34.svg?httpAccept=%2A%2F%2A",
            "@multimediatype": "Scalable Vector Graphics file",
            "@type": "ALTIMG",
            "@size": "5827",
            "@ref": "si34",
            "@mimetype": "image/svg+xml"
        },
        {
            "@category": "thumbnail",
            "@_fa": "true",
            "$": "https://api.elsevier.com/content/object/eid/1-s2.0-S037877881931686X-si35.svg?httpAccept=%2A%2F%2A",
            "@multimediatype": "Scalable Vector Graphics file",
            "@type": "ALTIMG",
            "@size": "4641",
            "@ref": "si35",
            "@mimetype": "image/svg+xml"
        },
        {
            "@category": "thumbnail",
            "@_fa": "true",
            "$": "https://api.elsevier.com/content/object/eid/1-s2.0-S037877881931686X-si36.svg?httpAccept=%2A%2F%2A",
            "@multimediatype": "Scalable Vector Graphics file",
            "@type": "ALTIMG",
            "@size": "6049",
            "@ref": "si36",
            "@mimetype": "image/svg+xml"
        },
        {
            "@category": "thumbnail",
            "@_fa": "true",
            "$": "https://api.elsevier.com/content/object/eid/1-s2.0-S037877881931686X-si37.svg?httpAccept=%2A%2F%2A",
            "@multimediatype": "Scalable Vector Graphics file",
            "@type": "ALTIMG",
            "@size": "5220",
            "@ref": "si37",
            "@mimetype": "image/svg+xml"
        },
        {
            "@category": "thumbnail",
            "@_fa": "true",
            "$": "https://api.elsevier.com/content/object/eid/1-s2.0-S037877881931686X-si38.svg?httpAccept=%2A%2F%2A",
            "@multimediatype": "Scalable Vector Graphics file",
            "@type": "ALTIMG",
            "@size": "5078",
            "@ref": "si38",
            "@mimetype": "image/svg+xml"
        },
        {
            "@category": "thumbnail",
            "@_fa": "true",
            "$": "https://api.elsevier.com/content/object/eid/1-s2.0-S037877881931686X-si39.svg?httpAccept=%2A%2F%2A",
            "@multimediatype": "Scalable Vector Graphics file",
            "@type": "ALTIMG",
            "@size": "5377",
            "@ref": "si39",
            "@mimetype": "image/svg+xml"
        },
        {
            "@category": "thumbnail",
            "@_fa": "true",
            "$": "https://api.elsevier.com/content/object/eid/1-s2.0-S037877881931686X-si4.svg?httpAccept=%2A%2F%2A",
            "@multimediatype": "Scalable Vector Graphics file",
            "@type": "ALTIMG",
            "@size": "4193",
            "@ref": "si4",
            "@mimetype": "image/svg+xml"
        },
        {
            "@category": "thumbnail",
            "@_fa": "true",
            "$": "https://api.elsevier.com/content/object/eid/1-s2.0-S037877881931686X-si41.svg?httpAccept=%2A%2F%2A",
            "@multimediatype": "Scalable Vector Graphics file",
            "@type": "ALTIMG",
            "@size": "3474",
            "@ref": "si41",
            "@mimetype": "image/svg+xml"
        },
        {
            "@category": "thumbnail",
            "@_fa": "true",
            "$": "https://api.elsevier.com/content/object/eid/1-s2.0-S037877881931686X-si42.svg?httpAccept=%2A%2F%2A",
            "@multimediatype": "Scalable Vector Graphics file",
            "@type": "ALTIMG",
            "@size": "20193",
            "@ref": "si42",
            "@mimetype": "image/svg+xml"
        },
        {
            "@category": "thumbnail",
            "@_fa": "true",
            "$": "https://api.elsevier.com/content/object/eid/1-s2.0-S037877881931686X-si43.svg?httpAccept=%2A%2F%2A",
            "@multimediatype": "Scalable Vector Graphics file",
            "@type": "ALTIMG",
            "@size": "19427",
            "@ref": "si43",
            "@mimetype": "image/svg+xml"
        },
        {
            "@category": "thumbnail",
            "@_fa": "true",
            "$": "https://api.elsevier.com/content/object/eid/1-s2.0-S037877881931686X-si44.svg?httpAccept=%2A%2F%2A",
            "@multimediatype": "Scalable Vector Graphics file",
            "@type": "ALTIMG",
            "@size": "4341",
            "@ref": "si44",
            "@mimetype": "image/svg+xml"
        },
        {
            "@category": "thumbnail",
            "@_fa": "true",
            "$": "https://api.elsevier.com/content/object/eid/1-s2.0-S037877881931686X-si45.svg?httpAccept=%2A%2F%2A",
            "@multimediatype": "Scalable Vector Graphics file",
            "@type": "ALTIMG",
            "@size": "3305",
            "@ref": "si45",
            "@mimetype": "image/svg+xml"
        },
        {
            "@category": "thumbnail",
            "@_fa": "true",
            "$": "https://api.elsevier.com/content/object/eid/1-s2.0-S037877881931686X-si46.svg?httpAccept=%2A%2F%2A",
            "@multimediatype": "Scalable Vector Graphics file",
            "@type": "ALTIMG",
            "@size": "21796",
            "@ref": "si46",
            "@mimetype": "image/svg+xml"
        },
        {
            "@category": "thumbnail",
            "@_fa": "true",
            "$": "https://api.elsevier.com/content/object/eid/1-s2.0-S037877881931686X-si47.svg?httpAccept=%2A%2F%2A",
            "@multimediatype": "Scalable Vector Graphics file",
            "@type": "ALTIMG",
            "@size": "15213",
            "@ref": "si47",
            "@mimetype": "image/svg+xml"
        },
        {
            "@category": "thumbnail",
            "@_fa": "true",
            "$": "https://api.elsevier.com/content/object/eid/1-s2.0-S037877881931686X-si48.svg?httpAccept=%2A%2F%2A",
            "@multimediatype": "Scalable Vector Graphics file",
            "@type": "ALTIMG",
            "@size": "5199",
            "@ref": "si48",
            "@mimetype": "image/svg+xml"
        },
        {
            "@category": "thumbnail",
            "@_fa": "true",
            "$": "https://api.elsevier.com/content/object/eid/1-s2.0-S037877881931686X-si49.svg?httpAccept=%2A%2F%2A",
            "@multimediatype": "Scalable Vector Graphics file",
            "@type": "ALTIMG",
            "@size": "5935",
            "@ref": "si49",
            "@mimetype": "image/svg+xml"
        },
        {
            "@category": "thumbnail",
            "@_fa": "true",
            "$": "https://api.elsevier.com/content/object/eid/1-s2.0-S037877881931686X-si5.svg?httpAccept=%2A%2F%2A",
            "@multimediatype": "Scalable Vector Graphics file",
            "@type": "ALTIMG",
            "@size": "2695",
            "@ref": "si5",
            "@mimetype": "image/svg+xml"
        },
        {
            "@category": "thumbnail",
            "@_fa": "true",
            "$": "https://api.elsevier.com/content/object/eid/1-s2.0-S037877881931686X-si51.svg?httpAccept=%2A%2F%2A",
            "@multimediatype": "Scalable Vector Graphics file",
            "@type": "ALTIMG",
            "@size": "4991",
            "@ref": "si51",
            "@mimetype": "image/svg+xml"
        },
        {
            "@category": "thumbnail",
            "@_fa": "true",
            "$": "https://api.elsevier.com/content/object/eid/1-s2.0-S037877881931686X-si52.svg?httpAccept=%2A%2F%2A",
            "@multimediatype": "Scalable Vector Graphics file",
            "@type": "ALTIMG",
            "@size": "6398",
            "@ref": "si52",
            "@mimetype": "image/svg+xml"
        },
        {
            "@category": "thumbnail",
            "@_fa": "true",
            "$": "https://api.elsevier.com/content/object/eid/1-s2.0-S037877881931686X-si53.svg?httpAccept=%2A%2F%2A",
            "@multimediatype": "Scalable Vector Graphics file",
            "@type": "ALTIMG",
            "@size": "5571",
            "@ref": "si53",
            "@mimetype": "image/svg+xml"
        },
        {
            "@category": "thumbnail",
            "@_fa": "true",
            "$": "https://api.elsevier.com/content/object/eid/1-s2.0-S037877881931686X-si54.svg?httpAccept=%2A%2F%2A",
            "@multimediatype": "Scalable Vector Graphics file",
            "@type": "ALTIMG",
            "@size": "5731",
            "@ref": "si54",
            "@mimetype": "image/svg+xml"
        },
        {
            "@category": "thumbnail",
            "@_fa": "true",
            "$": "https://api.elsevier.com/content/object/eid/1-s2.0-S037877881931686X-si55.svg?httpAccept=%2A%2F%2A",
            "@multimediatype": "Scalable Vector Graphics file",
            "@type": "ALTIMG",
            "@size": "27403",
            "@ref": "si55",
            "@mimetype": "image/svg+xml"
        },
        {
            "@category": "thumbnail",
            "@_fa": "true",
            "$": "https://api.elsevier.com/content/object/eid/1-s2.0-S037877881931686X-si56.svg?httpAccept=%2A%2F%2A",
            "@multimediatype": "Scalable Vector Graphics file",
            "@type": "ALTIMG",
            "@size": "7485",
            "@ref": "si56",
            "@mimetype": "image/svg+xml"
        },
        {
            "@category": "thumbnail",
            "@_fa": "true",
            "$": "https://api.elsevier.com/content/object/eid/1-s2.0-S037877881931686X-si57.svg?httpAccept=%2A%2F%2A",
            "@multimediatype": "Scalable Vector Graphics file",
            "@type": "ALTIMG",
            "@size": "8205",
            "@ref": "si57",
            "@mimetype": "image/svg+xml"
        },
        {
            "@category": "thumbnail",
            "@_fa": "true",
            "$": "https://api.elsevier.com/content/object/eid/1-s2.0-S037877881931686X-si58.svg?httpAccept=%2A%2F%2A",
            "@multimediatype": "Scalable Vector Graphics file",
            "@type": "ALTIMG",
            "@size": "27735",
            "@ref": "si58",
            "@mimetype": "image/svg+xml"
        },
        {
            "@category": "thumbnail",
            "@_fa": "true",
            "$": "https://api.elsevier.com/content/object/eid/1-s2.0-S037877881931686X-si59.svg?httpAccept=%2A%2F%2A",
            "@multimediatype": "Scalable Vector Graphics file",
            "@type": "ALTIMG",
            "@size": "19562",
            "@ref": "si59",
            "@mimetype": "image/svg+xml"
        },
        {
            "@category": "thumbnail",
            "@_fa": "true",
            "$": "https://api.elsevier.com/content/object/eid/1-s2.0-S037877881931686X-si6.svg?httpAccept=%2A%2F%2A",
            "@multimediatype": "Scalable Vector Graphics file",
            "@type": "ALTIMG",
            "@size": "2881",
            "@ref": "si6",
            "@mimetype": "image/svg+xml"
        },
        {
            "@category": "thumbnail",
            "@_fa": "true",
            "$": "https://api.elsevier.com/content/object/eid/1-s2.0-S037877881931686X-si61.svg?httpAccept=%2A%2F%2A",
            "@multimediatype": "Scalable Vector Graphics file",
            "@type": "ALTIMG",
            "@size": "17610",
            "@ref": "si61",
            "@mimetype": "image/svg+xml"
        },
        {
            "@category": "thumbnail",
            "@_fa": "true",
            "$": "https://api.elsevier.com/content/object/eid/1-s2.0-S037877881931686X-si62.svg?httpAccept=%2A%2F%2A",
            "@multimediatype": "Scalable Vector Graphics file",
            "@type": "ALTIMG",
            "@size": "3523",
            "@ref": "si62",
            "@mimetype": "image/svg+xml"
        },
        {
            "@category": "thumbnail",
            "@_fa": "true",
            "$": "https://api.elsevier.com/content/object/eid/1-s2.0-S037877881931686X-si63.svg?httpAccept=%2A%2F%2A",
            "@multimediatype": "Scalable Vector Graphics file",
            "@type": "ALTIMG",
            "@size": "22077",
            "@ref": "si63",
            "@mimetype": "image/svg+xml"
        },
        {
            "@category": "thumbnail",
            "@_fa": "true",
            "$": "https://api.elsevier.com/content/object/eid/1-s2.0-S037877881931686X-si64.svg?httpAccept=%2A%2F%2A",
            "@multimediatype": "Scalable Vector Graphics file",
            "@type": "ALTIMG",
            "@size": "9449",
            "@ref": "si64",
            "@mimetype": "image/svg+xml"
        },
        {
            "@category": "thumbnail",
            "@_fa": "true",
            "$": "https://api.elsevier.com/content/object/eid/1-s2.0-S037877881931686X-si65.svg?httpAccept=%2A%2F%2A",
            "@multimediatype": "Scalable Vector Graphics file",
            "@type": "ALTIMG",
            "@size": "18386",
            "@ref": "si65",
            "@mimetype": "image/svg+xml"
        },
        {
            "@category": "thumbnail",
            "@_fa": "true",
            "$": "https://api.elsevier.com/content/object/eid/1-s2.0-S037877881931686X-si66.svg?httpAccept=%2A%2F%2A",
            "@multimediatype": "Scalable Vector Graphics file",
            "@type": "ALTIMG",
            "@size": "11737",
            "@ref": "si66",
            "@mimetype": "image/svg+xml"
        },
        {
            "@category": "thumbnail",
            "@_fa": "true",
            "$": "https://api.elsevier.com/content/object/eid/1-s2.0-S037877881931686X-si67.svg?httpAccept=%2A%2F%2A",
            "@multimediatype": "Scalable Vector Graphics file",
            "@type": "ALTIMG",
            "@size": "9132",
            "@ref": "si67",
            "@mimetype": "image/svg+xml"
        },
        {
            "@category": "thumbnail",
            "@_fa": "true",
            "$": "https://api.elsevier.com/content/object/eid/1-s2.0-S037877881931686X-si68.svg?httpAccept=%2A%2F%2A",
            "@multimediatype": "Scalable Vector Graphics file",
            "@type": "ALTIMG",
            "@size": "20152",
            "@ref": "si68",
            "@mimetype": "image/svg+xml"
        },
        {
            "@category": "thumbnail",
            "@_fa": "true",
            "$": "https://api.elsevier.com/content/object/eid/1-s2.0-S037877881931686X-si69.svg?httpAccept=%2A%2F%2A",
            "@multimediatype": "Scalable Vector Graphics file",
            "@type": "ALTIMG",
            "@size": "14826",
            "@ref": "si69",
            "@mimetype": "image/svg+xml"
        },
        {
            "@category": "thumbnail",
            "@_fa": "true",
            "$": "https://api.elsevier.com/content/object/eid/1-s2.0-S037877881931686X-si7.svg?httpAccept=%2A%2F%2A",
            "@multimediatype": "Scalable Vector Graphics file",
            "@type": "ALTIMG",
            "@size": "3807",
            "@ref": "si7",
            "@mimetype": "image/svg+xml"
        },
        {
            "@category": "thumbnail",
            "@_fa": "true",
            "$": "https://api.elsevier.com/content/object/eid/1-s2.0-S037877881931686X-si71.svg?httpAccept=%2A%2F%2A",
            "@multimediatype": "Scalable Vector Graphics file",
            "@type": "ALTIMG",
            "@size": "6365",
            "@ref": "si71",
            "@mimetype": "image/svg+xml"
        },
        {
            "@category": "thumbnail",
            "@_fa": "true",
            "$": "https://api.elsevier.com/content/object/eid/1-s2.0-S037877881931686X-si72.svg?httpAccept=%2A%2F%2A",
            "@multimediatype": "Scalable Vector Graphics file",
            "@type": "ALTIMG",
            "@size": "1825",
            "@ref": "si72",
            "@mimetype": "image/svg+xml"
        },
        {
            "@category": "thumbnail",
            "@_fa": "true",
            "$": "https://api.elsevier.com/content/object/eid/1-s2.0-S037877881931686X-si73.svg?httpAccept=%2A%2F%2A",
            "@multimediatype": "Scalable Vector Graphics file",
            "@type": "ALTIMG",
            "@size": "6213",
            "@ref": "si73",
            "@mimetype": "image/svg+xml"
        },
        {
            "@category": "thumbnail",
            "@_fa": "true",
            "$": "https://api.elsevier.com/content/object/eid/1-s2.0-S037877881931686X-si74.svg?httpAccept=%2A%2F%2A",
            "@multimediatype": "Scalable Vector Graphics file",
            "@type": "ALTIMG",
            "@size": "4174",
            "@ref": "si74",
            "@mimetype": "image/svg+xml"
        },
        {
            "@category": "thumbnail",
            "@_fa": "true",
            "$": "https://api.elsevier.com/content/object/eid/1-s2.0-S037877881931686X-si75.svg?httpAccept=%2A%2F%2A",
            "@multimediatype": "Scalable Vector Graphics file",
            "@type": "ALTIMG",
            "@size": "9933",
            "@ref": "si75",
            "@mimetype": "image/svg+xml"
        },
        {
            "@category": "thumbnail",
            "@_fa": "true",
            "$": "https://api.elsevier.com/content/object/eid/1-s2.0-S037877881931686X-si76.svg?httpAccept=%2A%2F%2A",
            "@multimediatype": "Scalable Vector Graphics file",
            "@type": "ALTIMG",
            "@size": "7896",
            "@ref": "si76",
            "@mimetype": "image/svg+xml"
        },
        {
            "@category": "thumbnail",
            "@_fa": "true",
            "$": "https://api.elsevier.com/content/object/eid/1-s2.0-S037877881931686X-si77.svg?httpAccept=%2A%2F%2A",
            "@multimediatype": "Scalable Vector Graphics file",
            "@type": "ALTIMG",
            "@size": "2120",
            "@ref": "si77",
            "@mimetype": "image/svg+xml"
        },
        {
            "@category": "thumbnail",
            "@_fa": "true",
            "$": "https://api.elsevier.com/content/object/eid/1-s2.0-S037877881931686X-si78.svg?httpAccept=%2A%2F%2A",
            "@multimediatype": "Scalable Vector Graphics file",
            "@type": "ALTIMG",
            "@size": "4510",
            "@ref": "si78",
            "@mimetype": "image/svg+xml"
        },
        {
            "@category": "thumbnail",
            "@_fa": "true",
            "$": "https://api.elsevier.com/content/object/eid/1-s2.0-S037877881931686X-si79.svg?httpAccept=%2A%2F%2A",
            "@multimediatype": "Scalable Vector Graphics file",
            "@type": "ALTIMG",
            "@size": "2715",
            "@ref": "si79",
            "@mimetype": "image/svg+xml"
        },
        {
            "@category": "thumbnail",
            "@_fa": "true",
            "$": "https://api.elsevier.com/content/object/eid/1-s2.0-S037877881931686X-si8.svg?httpAccept=%2A%2F%2A",
            "@multimediatype": "Scalable Vector Graphics file",
            "@type": "ALTIMG",
            "@size": "4154",
            "@ref": "si8",
            "@mimetype": "image/svg+xml"
        },
        {
            "@category": "thumbnail",
            "@_fa": "true",
            "$": "https://api.elsevier.com/content/object/eid/1-s2.0-S037877881931686X-si81.svg?httpAccept=%2A%2F%2A",
            "@multimediatype": "Scalable Vector Graphics file",
            "@type": "ALTIMG",
            "@size": "3305",
            "@ref": "si81",
            "@mimetype": "image/svg+xml"
        },
        {
            "@category": "thumbnail",
            "@_fa": "true",
            "$": "https://api.elsevier.com/content/object/eid/1-s2.0-S037877881931686X-si84.svg?httpAccept=%2A%2F%2A",
            "@multimediatype": "Scalable Vector Graphics file",
            "@type": "ALTIMG",
            "@size": "12644",
            "@ref": "si84",
            "@mimetype": "image/svg+xml"
        },
        {
            "@category": "thumbnail",
            "@_fa": "true",
            "$": "https://api.elsevier.com/content/object/eid/1-s2.0-S037877881931686X-si85.svg?httpAccept=%2A%2F%2A",
            "@multimediatype": "Scalable Vector Graphics file",
            "@type": "ALTIMG",
            "@size": "10905",
            "@ref": "si85",
            "@mimetype": "image/svg+xml"
        },
        {
            "@category": "thumbnail",
            "@_fa": "true",
            "$": "https://api.elsevier.com/content/object/eid/1-s2.0-S037877881931686X-si86.svg?httpAccept=%2A%2F%2A",
            "@multimediatype": "Scalable Vector Graphics file",
            "@type": "ALTIMG",
            "@size": "11853",
            "@ref": "si86",
            "@mimetype": "image/svg+xml"
        },
        {
            "@category": "thumbnail",
            "@_fa": "true",
            "$": "https://api.elsevier.com/content/object/eid/1-s2.0-S037877881931686X-si87.svg?httpAccept=%2A%2F%2A",
            "@multimediatype": "Scalable Vector Graphics file",
            "@type": "ALTIMG",
            "@size": "5744",
            "@ref": "si87",
            "@mimetype": "image/svg+xml"
        },
        {
            "@category": "thumbnail",
            "@_fa": "true",
            "$": "https://api.elsevier.com/content/object/eid/1-s2.0-S037877881931686X-si88.svg?httpAccept=%2A%2F%2A",
            "@multimediatype": "Scalable Vector Graphics file",
            "@type": "ALTIMG",
            "@size": "9777",
            "@ref": "si88",
            "@mimetype": "image/svg+xml"
        },
        {
            "@category": "thumbnail",
            "@_fa": "true",
            "$": "https://api.elsevier.com/content/object/eid/1-s2.0-S037877881931686X-si89.svg?httpAccept=%2A%2F%2A",
            "@multimediatype": "Scalable Vector Graphics file",
            "@type": "ALTIMG",
            "@size": "11022",
            "@ref": "si89",
            "@mimetype": "image/svg+xml"
        },
        {
            "@category": "thumbnail",
            "@_fa": "true",
            "$": "https://api.elsevier.com/content/object/eid/1-s2.0-S037877881931686X-si9.svg?httpAccept=%2A%2F%2A",
            "@multimediatype": "Scalable Vector Graphics file",
            "@type": "ALTIMG",
            "@size": "2081",
            "@ref": "si9",
            "@mimetype": "image/svg+xml"
        },
        {
            "@category": "thumbnail",
            "@_fa": "true",
            "$": "https://api.elsevier.com/content/object/eid/1-s2.0-S037877881931686X-si91.svg?httpAccept=%2A%2F%2A",
            "@multimediatype": "Scalable Vector Graphics file",
            "@type": "ALTIMG",
            "@size": "10530",
            "@ref": "si91",
            "@mimetype": "image/svg+xml"
        },
        {
            "@category": "thumbnail",
            "@_fa": "true",
            "$": "https://api.elsevier.com/content/object/eid/1-s2.0-S037877881931686X-si92.svg?httpAccept=%2A%2F%2A",
            "@multimediatype": "Scalable Vector Graphics file",
            "@type": "ALTIMG",
            "@size": "17066",
            "@ref": "si92",
            "@mimetype": "image/svg+xml"
        },
        {
            "@category": "thumbnail",
            "@_fa": "true",
            "$": "https://api.elsevier.com/content/object/eid/1-s2.0-S037877881931686X-si93.svg?httpAccept=%2A%2F%2A",
            "@multimediatype": "Scalable Vector Graphics file",
            "@type": "ALTIMG",
            "@size": "9452",
            "@ref": "si93",
            "@mimetype": "image/svg+xml"
        },
        {
            "@category": "thumbnail",
            "@_fa": "true",
            "$": "https://api.elsevier.com/content/object/eid/1-s2.0-S037877881931686X-si94.svg?httpAccept=%2A%2F%2A",
            "@multimediatype": "Scalable Vector Graphics file",
            "@type": "ALTIMG",
            "@size": "3943",
            "@ref": "si94",
            "@mimetype": "image/svg+xml"
        },
        {
            "@category": "thumbnail",
            "@_fa": "true",
            "$": "https://api.elsevier.com/content/object/eid/1-s2.0-S037877881931686X-si95.svg?httpAccept=%2A%2F%2A",
            "@multimediatype": "Scalable Vector Graphics file",
            "@type": "ALTIMG",
            "@size": "4320",
            "@ref": "si95",
            "@mimetype": "image/svg+xml"
        },
        {
            "@category": "thumbnail",
            "@_fa": "true",
            "$": "https://api.elsevier.com/content/object/eid/1-s2.0-S037877881931686X-si96.svg?httpAccept=%2A%2F%2A",
            "@multimediatype": "Scalable Vector Graphics file",
            "@type": "ALTIMG",
            "@size": "6412",
            "@ref": "si96",
            "@mimetype": "image/svg+xml"
        },
        {
            "@category": "thumbnail",
            "@_fa": "true",
            "$": "https://api.elsevier.com/content/object/eid/1-s2.0-S037877881931686X-si10.svg?httpAccept=%2A%2F%2A",
            "@multimediatype": "Scalable Vector Graphics file",
            "@type": "ALTIMG",
            "@size": "4336",
            "@ref": "si10",
            "@mimetype": "image/svg+xml"
        },
        {
            "@category": "thumbnail",
            "@_fa": "true",
            "$": "https://api.elsevier.com/content/object/eid/1-s2.0-S037877881931686X-si97.svg?httpAccept=%2A%2F%2A",
            "@multimediatype": "Scalable Vector Graphics file",
            "@type": "ALTIMG",
            "@size": "18461",
            "@ref": "si97",
            "@mimetype": "image/svg+xml"
        },
        {
            "@category": "thumbnail",
            "@_fa": "true",
            "$": "https://api.elsevier.com/content/object/eid/1-s2.0-S037877881931686X-si98.svg?httpAccept=%2A%2F%2A",
            "@multimediatype": "Scalable Vector Graphics file",
            "@type": "ALTIMG",
            "@size": "28226",
            "@ref": "si98",
            "@mimetype": "image/svg+xml"
        },
        {
            "@category": "thumbnail",
            "@_fa": "true",
            "$": "https://api.elsevier.com/content/object/eid/1-s2.0-S037877881931686X-si99.svg?httpAccept=%2A%2F%2A",
            "@multimediatype": "Scalable Vector Graphics file",
            "@type": "ALTIMG",
            "@size": "6687",
            "@ref": "si99",
            "@mimetype": "image/svg+xml"
        },
        {
            "@category": "thumbnail",
            "@_fa": "true",
            "$": "https://api.elsevier.com/content/object/eid/1-s2.0-S037877881931686X-si20.svg?httpAccept=%2A%2F%2A",
            "@multimediatype": "Scalable Vector Graphics file",
            "@type": "ALTIMG",
            "@size": "2372",
            "@ref": "si20",
            "@mimetype": "image/svg+xml"
        },
        {
            "@category": "thumbnail",
            "@_fa": "true",
            "$": "https://api.elsevier.com/content/object/eid/1-s2.0-S037877881931686X-si30.svg?httpAccept=%2A%2F%2A",
            "@multimediatype": "Scalable Vector Graphics file",
            "@type": "ALTIMG",
            "@size": "3854",
            "@ref": "si30",
            "@mimetype": "image/svg+xml"
        },
        {
            "@category": "thumbnail",
            "@_fa": "true",
            "$": "https://api.elsevier.com/content/object/eid/1-s2.0-S037877881931686X-si40.svg?httpAccept=%2A%2F%2A",
            "@multimediatype": "Scalable Vector Graphics file",
            "@type": "ALTIMG",
            "@size": "25901",
            "@ref": "si40",
            "@mimetype": "image/svg+xml"
        },
        {
            "@category": "thumbnail",
            "@_fa": "true",
            "$": "https://api.elsevier.com/content/object/eid/1-s2.0-S037877881931686X-si120.svg?httpAccept=%2A%2F%2A",
            "@multimediatype": "Scalable Vector Graphics file",
            "@type": "ALTIMG",
            "@size": "3771",
            "@ref": "si120",
            "@mimetype": "image/svg+xml"
        },
        {
            "@category": "thumbnail",
            "@_fa": "true",
            "$": "https://api.elsevier.com/content/object/eid/1-s2.0-S037877881931686X-si16.svg?httpAccept=%2A%2F%2A",
            "@multimediatype": "Scalable Vector Graphics file",
            "@type": "ALTIMG",
            "@size": "8708",
            "@ref": "si16",
            "@mimetype": "image/svg+xml"
        },
        {
            "@category": "thumbnail",
            "@_fa": "true",
            "$": "https://api.elsevier.com/content/object/eid/1-s2.0-S037877881931686X-si17.svg?httpAccept=%2A%2F%2A",
            "@multimediatype": "Scalable Vector Graphics file",
            "@type": "ALTIMG",
            "@size": "26195",
            "@ref": "si17",
            "@mimetype": "image/svg+xml"
        },
        {
            "@category": "thumbnail",
            "@_fa": "true",
            "$": "https://api.elsevier.com/content/object/eid/1-s2.0-S037877881931686X-si101.svg?httpAccept=%2A%2F%2A",
            "@multimediatype": "Scalable Vector Graphics file",
            "@type": "ALTIMG",
            "@size": "9549",
            "@ref": "si101",
            "@mimetype": "image/svg+xml"
        },
        {
            "@category": "thumbnail",
            "@_fa": "true",
            "$": "https://api.elsevier.com/content/object/eid/1-s2.0-S037877881931686X-si2.svg?httpAccept=%2A%2F%2A",
            "@multimediatype": "Scalable Vector Graphics file",
            "@type": "ALTIMG",
            "@size": "4226",
            "@ref": "si2",
            "@mimetype": "image/svg+xml"
        },
        {
            "@category": "thumbnail",
            "@_fa": "true",
            "$": "https://api.elsevier.com/content/object/eid/1-s2.0-S037877881931686X-si103.svg?httpAccept=%2A%2F%2A",
            "@multimediatype": "Scalable Vector Graphics file",
            "@type": "ALTIMG",
            "@size": "10350",
            "@ref": "si103",
            "@mimetype": "image/svg+xml"
        },
        {
            "@category": "thumbnail",
            "@_fa": "true",
            "$": "https://api.elsevier.com/content/object/eid/1-s2.0-S037877881931686X-si104.svg?httpAccept=%2A%2F%2A",
            "@multimediatype": "Scalable Vector Graphics file",
            "@type": "ALTIMG",
            "@size": "10562",
            "@ref": "si104",
            "@mimetype": "image/svg+xml"
        },
        {
            "@category": "thumbnail",
            "@_fa": "true",
            "$": "https://api.elsevier.com/content/object/eid/1-s2.0-S037877881931686X-si105.svg?httpAccept=%2A%2F%2A",
            "@multimediatype": "Scalable Vector Graphics file",
            "@type": "ALTIMG",
            "@size": "6368",
            "@ref": "si105",
            "@mimetype": "image/svg+xml"
        },
        {
            "@category": "thumbnail",
            "@_fa": "true",
            "$": "https://api.elsevier.com/content/object/eid/1-s2.0-S037877881931686X-si106.svg?httpAccept=%2A%2F%2A",
            "@multimediatype": "Scalable Vector Graphics file",
            "@type": "ALTIMG",
            "@size": "5550",
            "@ref": "si106",
            "@mimetype": "image/svg+xml"
        },
        {
            "@category": "thumbnail",
            "@_fa": "true",
            "$": "https://api.elsevier.com/content/object/eid/1-s2.0-S037877881931686X-si107.svg?httpAccept=%2A%2F%2A",
            "@multimediatype": "Scalable Vector Graphics file",
            "@type": "ALTIMG",
            "@size": "9420",
            "@ref": "si107",
            "@mimetype": "image/svg+xml"
        },
        {
            "@category": "thumbnail",
            "@_fa": "true",
            "$": "https://api.elsevier.com/content/object/eid/1-s2.0-S037877881931686X-si108.svg?httpAccept=%2A%2F%2A",
            "@multimediatype": "Scalable Vector Graphics file",
            "@type": "ALTIMG",
            "@size": "8654",
            "@ref": "si108",
            "@mimetype": "image/svg+xml"
        },
        {
            "@category": "thumbnail",
            "@_fa": "true",
            "$": "https://api.elsevier.com/content/object/eid/1-s2.0-S037877881931686X-si109.svg?httpAccept=%2A%2F%2A",
            "@multimediatype": "Scalable Vector Graphics file",
            "@type": "ALTIMG",
            "@size": "11508",
            "@ref": "si109",
            "@mimetype": "image/svg+xml"
        },
        {
            "@category": "thumbnail",
            "@_fa": "true",
            "$": "https://api.elsevier.com/content/object/eid/1-s2.0-S037877881931686X-si11.svg?httpAccept=%2A%2F%2A",
            "@multimediatype": "Scalable Vector Graphics file",
            "@type": "ALTIMG",
            "@size": "4422",
            "@ref": "si11",
            "@mimetype": "image/svg+xml"
        },
        {
            "@category": "thumbnail",
            "@_fa": "true",
            "$": "https://api.elsevier.com/content/object/eid/1-s2.0-S037877881931686X-si111.svg?httpAccept=%2A%2F%2A",
            "@multimediatype": "Scalable Vector Graphics file",
            "@type": "ALTIMG",
            "@size": "5084",
            "@ref": "si111",
            "@mimetype": "image/svg+xml"
        },
        {
            "@category": "thumbnail",
            "@_fa": "true",
            "$": "https://api.elsevier.com/content/object/eid/1-s2.0-S037877881931686X-si112.svg?httpAccept=%2A%2F%2A",
            "@multimediatype": "Scalable Vector Graphics file",
            "@type": "ALTIMG",
            "@size": "12718",
            "@ref": "si112",
            "@mimetype": "image/svg+xml"
        },
        {
            "@category": "thumbnail",
            "@_fa": "true",
            "$": "https://api.elsevier.com/content/object/eid/1-s2.0-S037877881931686X-si113.svg?httpAccept=%2A%2F%2A",
            "@multimediatype": "Scalable Vector Graphics file",
            "@type": "ALTIMG",
            "@size": "10561",
            "@ref": "si113",
            "@mimetype": "image/svg+xml"
        },
        {
            "@category": "thumbnail",
            "@_fa": "true",
            "$": "https://api.elsevier.com/content/object/eid/1-s2.0-S037877881931686X-si114.svg?httpAccept=%2A%2F%2A",
            "@multimediatype": "Scalable Vector Graphics file",
            "@type": "ALTIMG",
            "@size": "8872",
            "@ref": "si114",
            "@mimetype": "image/svg+xml"
        },
        {
            "@category": "thumbnail",
            "@_fa": "true",
            "$": "https://api.elsevier.com/content/object/eid/1-s2.0-S037877881931686X-si115.svg?httpAccept=%2A%2F%2A",
            "@multimediatype": "Scalable Vector Graphics file",
            "@type": "ALTIMG",
            "@size": "12097",
            "@ref": "si115",
            "@mimetype": "image/svg+xml"
        },
        {
            "@category": "thumbnail",
            "@_fa": "true",
            "$": "https://api.elsevier.com/content/object/eid/1-s2.0-S037877881931686X-si116.svg?httpAccept=%2A%2F%2A",
            "@multimediatype": "Scalable Vector Graphics file",
            "@type": "ALTIMG",
            "@size": "13211",
            "@ref": "si116",
            "@mimetype": "image/svg+xml"
        },
        {
            "@category": "thumbnail",
            "@_fa": "true",
            "$": "https://api.elsevier.com/content/object/eid/1-s2.0-S037877881931686X-si117.svg?httpAccept=%2A%2F%2A",
            "@multimediatype": "Scalable Vector Graphics file",
            "@type": "ALTIMG",
            "@size": "7627",
            "@ref": "si117",
            "@mimetype": "image/svg+xml"
        },
        {
            "@category": "thumbnail",
            "@_fa": "true",
            "$": "https://api.elsevier.com/content/object/eid/1-s2.0-S037877881931686X-si119.svg?httpAccept=%2A%2F%2A",
            "@multimediatype": "Scalable Vector Graphics file",
            "@type": "ALTIMG",
            "@size": "15162",
            "@ref": "si119",
            "@mimetype": "image/svg+xml"
        },
        {
            "@category": "thumbnail",
            "@_fa": "true",
            "$": "https://api.elsevier.com/content/object/eid/1-s2.0-S037877881931686X-si12.svg?httpAccept=%2A%2F%2A",
            "@multimediatype": "Scalable Vector Graphics file",
            "@type": "ALTIMG",
            "@size": "2147",
            "@ref": "si12",
            "@mimetype": "image/svg+xml"
        },
        {
            "@category": "thumbnail",
            "@_fa": "true",
            "$": "https://api.elsevier.com/content/object/eid/1-s2.0-S037877881931686X-si121.svg?httpAccept=%2A%2F%2A",
            "@multimediatype": "Scalable Vector Graphics file",
            "@type": "ALTIMG",
            "@size": "6285",
            "@ref": "si121",
            "@mimetype": "image/svg+xml"
        },
        {
            "@category": "thumbnail",
            "@_fa": "true",
            "$": "https://api.elsevier.com/content/object/eid/1-s2.0-S037877881931686X-si122.svg?httpAccept=%2A%2F%2A",
            "@multimediatype": "Scalable Vector Graphics file",
            "@type": "ALTIMG",
            "@size": "10461",
            "@ref": "si122",
            "@mimetype": "image/svg+xml"
        },
        {
            "@category": "thumbnail",
            "@_fa": "true",
            "$": "https://api.elsevier.com/content/object/eid/1-s2.0-S037877881931686X-si123.svg?httpAccept=%2A%2F%2A",
            "@multimediatype": "Scalable Vector Graphics file",
            "@type": "ALTIMG",
            "@size": "4411",
            "@ref": "si123",
            "@mimetype": "image/svg+xml"
        },
        {
            "@category": "thumbnail",
            "@_fa": "true",
            "$": "https://api.elsevier.com/content/object/eid/1-s2.0-S037877881931686X-si124.svg?httpAccept=%2A%2F%2A",
            "@multimediatype": "Scalable Vector Graphics file",
            "@type": "ALTIMG",
            "@size": "4388",
            "@ref": "si124",
            "@mimetype": "image/svg+xml"
        },
        {
            "@category": "thumbnail",
            "@_fa": "true",
            "$": "https://api.elsevier.com/content/object/eid/1-s2.0-S037877881931686X-si125.svg?httpAccept=%2A%2F%2A",
            "@multimediatype": "Scalable Vector Graphics file",
            "@type": "ALTIMG",
            "@size": "3333",
            "@ref": "si125",
            "@mimetype": "image/svg+xml"
        },
        {
            "@category": "thumbnail",
            "@_fa": "true",
            "$": "https://api.elsevier.com/content/object/eid/1-s2.0-S037877881931686X-si126.svg?httpAccept=%2A%2F%2A",
            "@multimediatype": "Scalable Vector Graphics file",
            "@type": "ALTIMG",
            "@size": "8265",
            "@ref": "si126",
            "@mimetype": "image/svg+xml"
        },
        {
            "@category": "thumbnail",
            "@_fa": "true",
            "$": "https://api.elsevier.com/content/object/eid/1-s2.0-S037877881931686X-si127.svg?httpAccept=%2A%2F%2A",
            "@multimediatype": "Scalable Vector Graphics file",
            "@type": "ALTIMG",
            "@size": "9270",
            "@ref": "si127",
            "@mimetype": "image/svg+xml"
        },
        {
            "@category": "thumbnail",
            "@_fa": "true",
            "$": "https://api.elsevier.com/content/object/eid/1-s2.0-S037877881931686X-si128.svg?httpAccept=%2A%2F%2A",
            "@multimediatype": "Scalable Vector Graphics file",
            "@type": "ALTIMG",
            "@size": "10931",
            "@ref": "si128",
            "@mimetype": "image/svg+xml"
        },
        {
            "@category": "thumbnail",
            "@_fa": "true",
            "$": "https://api.elsevier.com/content/object/eid/1-s2.0-S037877881931686X-si129.svg?httpAccept=%2A%2F%2A",
            "@multimediatype": "Scalable Vector Graphics file",
            "@type": "ALTIMG",
            "@size": "7823",
            "@ref": "si129",
            "@mimetype": "image/svg+xml"
        },
        {
            "@category": "thumbnail",
            "@_fa": "true",
            "$": "https://api.elsevier.com/content/object/eid/1-s2.0-S037877881931686X-si13.svg?httpAccept=%2A%2F%2A",
            "@multimediatype": "Scalable Vector Graphics file",
            "@type": "ALTIMG",
            "@size": "5284",
            "@ref": "si13",
            "@mimetype": "image/svg+xml"
        },
        {
            "@category": "thumbnail",
            "@_fa": "true",
            "$": "https://api.elsevier.com/content/object/eid/1-s2.0-S037877881931686X-si131.svg?httpAccept=%2A%2F%2A",
            "@multimediatype": "Scalable Vector Graphics file",
            "@type": "ALTIMG",
            "@size": "2292",
            "@ref": "si131",
            "@mimetype": "image/svg+xml"
        },
        {
            "@category": "thumbnail",
            "@_fa": "true",
            "$": "https://api.elsevier.com/content/object/eid/1-s2.0-S037877881931686X-si132.svg?httpAccept=%2A%2F%2A",
            "@multimediatype": "Scalable Vector Graphics file",
            "@type": "ALTIMG",
            "@size": "3795",
            "@ref": "si132",
            "@mimetype": "image/svg+xml"
        },
        {
            "@category": "thumbnail",
            "@_fa": "true",
            "$": "https://api.elsevier.com/content/object/eid/1-s2.0-S037877881931686X-si133.svg?httpAccept=%2A%2F%2A",
            "@multimediatype": "Scalable Vector Graphics file",
            "@type": "ALTIMG",
            "@size": "16847",
            "@ref": "si133",
            "@mimetype": "image/svg+xml"
        },
        {
            "@category": "thumbnail",
            "@_fa": "true",
            "$": "https://api.elsevier.com/content/object/eid/1-s2.0-S037877881931686X-si134.svg?httpAccept=%2A%2F%2A",
            "@multimediatype": "Scalable Vector Graphics file",
            "@type": "ALTIMG",
            "@size": "5258",
            "@ref": "si134",
            "@mimetype": "image/svg+xml"
        },
        {
            "@category": "thumbnail",
            "@_fa": "true",
            "$": "https://api.elsevier.com/content/object/eid/1-s2.0-S037877881931686X-si135.svg?httpAccept=%2A%2F%2A",
            "@multimediatype": "Scalable Vector Graphics file",
            "@type": "ALTIMG",
            "@size": "6188",
            "@ref": "si135",
            "@mimetype": "image/svg+xml"
        },
        {
            "@category": "thumbnail",
            "@_fa": "true",
            "$": "https://api.elsevier.com/content/object/eid/1-s2.0-S037877881931686X-si136.svg?httpAccept=%2A%2F%2A",
            "@multimediatype": "Scalable Vector Graphics file",
            "@type": "ALTIMG",
            "@size": "5439",
            "@ref": "si136",
            "@mimetype": "image/svg+xml"
        },
        {
            "@category": "thumbnail",
            "@_fa": "true",
            "$": "https://api.elsevier.com/content/object/eid/1-s2.0-S037877881931686X-si14.svg?httpAccept=%2A%2F%2A",
            "@multimediatype": "Scalable Vector Graphics file",
            "@type": "ALTIMG",
            "@size": "3058",
            "@ref": "si14",
            "@mimetype": "image/svg+xml"
        },
        {
            "@category": "thumbnail",
            "@_fa": "true",
            "$": "https://api.elsevier.com/content/object/eid/1-s2.0-S037877881931686X-si1.svg?httpAccept=%2A%2F%2A",
            "@multimediatype": "Scalable Vector Graphics file",
            "@type": "ALTIMG",
            "@size": "4235",
            "@ref": "si1",
            "@mimetype": "image/svg+xml"
        },
        {
            "@category": "standard",
            "@_fa": "true",
            "$": "https://api.elsevier.com/content/object/eid/1-s2.0-S037877881931686X-am.pdf?httpAccept=%2A%2F%2A",
            "@multimediatype": "Acrobat PDF file",
            "@type": "AAM-PDF",
            "@size": "1850132",
            "@ref": "am",
            "@mimetype": "application/pdf"
        }
    ]},
    "link": {
        "@rel": "abstract",
        "@href": "https://api.elsevier.com/content/abstract/scopus_id/85081129562"
    }
}}