{"full-text-retrieval-response": {
    "scopus-eid": "2-s2.0-85087006762",
    "originalText": "serial JL 271429 291210 291702 291731 291787 291877 291878 291881 31 Applied Energy APPLIEDENERGY 2020-06-30 2020-06-30 2020-06-30 2020-06-30 2020-12-11T18:55:53 1-s2.0-S0306261920308369 S0306-2619(20)30836-9 S0306261920308369 10.1016/j.apenergy.2020.115324 S300 S300.1 FULL-TEXT 1-s2.0-S0306261920X00158 2024-01-01T13:23:58.349315Z 0 0 20201001 2020 2020-06-30T03:44:07.716347Z articleinfo articlenumber articletitlenorm authfirstinitialnorm authfirstsurnamenorm cid cids contenttype copyright crossmark dateloaded dateloadedtxt datesearch datesort dateupdated dco docsubtype doctype doi eid ewtransactionid hubeid indexeddate issn issnnorm itemstage itemtransactionid itemweight openaccess openarchive pg pgfirst pii piinorm pubdatestart pubdatetxt pubyr sectiontitle sortorder srctitle srctitlenorm srctype ssids alllist content subj subheadings suppl tomb volfirst volissue volumelist webpdf webpdfpagecount yearnav figure table body mmlmath acknowledge affil articletitle auth authfirstini authfull authkeywords authlast footnotes highlightsabst nomenclature primabst ref 0306-2619 03062619 true 275 275 C Volume 275 40 115324 115324 115324 20201001 1 October 2020 2020-10-01 2020 Research Papers article fla © 2020 Elsevier Ltd. All rights reserved. MODELPREDICTIVECONTROLFORSUPERVISINGMULTIPLEROOFTOPUNITECONOMIZERSFULLYLEVERAGEFREECOOLINGENERGYRESOURCE KIM D Nomenclature 1 Introduction 2 Investigation of rooftop unit economizer logic 2.1 Thermostat controls 2.2 Review of rooftop unit economizer controls 2.3 Development of economizer control logic for simulation tests 3 Model predictive control design accounting for economizers 3.1 General formulation 3.2 Further description 3.3 Control oriented modeling 3.4 Dealing with uncertainties during control phase 4 Description of simulation platform 5 Demonstration cases for energy savings 5.1 Case 1: all units have economizers 5.2 Case 2: half of units have economizers 6 Assessment of model predictive control energy savings potential in multiple climate zones 7 Conclusions Declaration of Competing Interest Acknowledgments References ZMEUREANU 1989 537 544 R OLSEN 2003 560 571 E BUDAIWI 2001 83 94 I BULUT 2011 680 689 H WACKER 1989 47 51 P TAYLOR 2010 12 23 S SEEM 2010 910 924 J WANG 2015 344 351 W HILLIARD 2015 172 190 T KILLIAN 2016 403 412 M KIM 2018 49 60 D BIYIK 2015 1683 1688 E AMERICANCONTROLCONFERENCEACC2015 CLOUDBASEDMODELPREDICTIVEBUILDINGTHERMOSTATICCONTROLSCOMMERCIALBUILDINGSALGORITHMIMPLEMENTATION ZHANG 2017 1034 1049 X KIM 2015 D DEVELOPMENTAPPLICATIONSMODELSALGORITHMSFORMODELPREDICTIVECONTROLINBUILDINGS KIM 2018 359 369 D KIM 2016 169 180 D RAWLINGS 2017 J MODELPREDICTIVECONTROLTHEORYCOMPUTATIONDESIGN PANNOCCHIA 2003 426 437 G KIM 2015 279 293 D CRAWLEY 2000 49 56 D KIM 2015 97 111 D KIM 2015 435 448 D KIMX2020X115324 KIMX2020X115324XD 2022-06-30T00:00:00.000Z 2022-06-30T00:00:00.000Z http://creativecommons.org/licenses/by-nc-nd/4.0/ © 2020 Elsevier Ltd. All rights reserved. 2020-07-07T20:48:45.323Z http://vtw.elsevier.com/data/voc/AddOnTypes/50.7/eoas Purdue University http://data.elsevier.com/vocabulary/SciValFunders/100006377 http://sws.geonames.org/6252001 item S0306-2619(20)30836-9 S0306261920308369 1-s2.0-S0306261920308369 10.1016/j.apenergy.2020.115324 271429 2024-01-01T13:23:58.349315Z 2020-10-01 1-s2.0-S0306261920308369-main.pdf https://s3-eu-west-1.amazonaws.com/prod-ucs-content-store-eu-west/content/pii:S0306261920308369/MAIN/application/pdf/459646f6da71c1a49252ed56d910d5df/main.pdf main.pdf pdf true 5364463 MAIN 12 1-s2.0-S0306261920308369-main_1.png https://s3-eu-west-1.amazonaws.com/prod-ucs-content-store-eu-west/content/pii:S0306261920308369/PREVIEW/image/png/b302a5b1d4b55ff923430ba8a72adda0/main_1.png main_1.png png 50882 849 656 IMAGE-WEB-PDF 1 1-s2.0-S0306261920308369-gr13.jpg https://s3-eu-west-1.amazonaws.com/prod-ucs-content-store-eu-west/content/pii:S0306261920308369/gr13/DOWNSAMPLED/image/jpeg/50cbe88473ca23336793e98e87936838/gr13.jpg gr13 gr13.jpg jpg 104251 430 711 IMAGE-DOWNSAMPLED 1-s2.0-S0306261920308369-gr14.jpg https://s3-eu-west-1.amazonaws.com/prod-ucs-content-store-eu-west/content/pii:S0306261920308369/gr14/DOWNSAMPLED/image/jpeg/8ce7b3804fc565758da260fd10c556e9/gr14.jpg gr14 gr14.jpg jpg 41657 581 364 IMAGE-DOWNSAMPLED 1-s2.0-S0306261920308369-gr11.jpg https://s3-eu-west-1.amazonaws.com/prod-ucs-content-store-eu-west/content/pii:S0306261920308369/gr11/DOWNSAMPLED/image/jpeg/c149ad180fdc768e1e5afb4891e10934/gr11.jpg gr11 gr11.jpg jpg 95778 405 778 IMAGE-DOWNSAMPLED 1-s2.0-S0306261920308369-gr12.jpg https://s3-eu-west-1.amazonaws.com/prod-ucs-content-store-eu-west/content/pii:S0306261920308369/gr12/DOWNSAMPLED/image/jpeg/84fac2019215884b9d2c941aee0cbadf/gr12.jpg gr12 gr12.jpg jpg 99442 382 778 IMAGE-DOWNSAMPLED 1-s2.0-S0306261920308369-gr2.jpg https://s3-eu-west-1.amazonaws.com/prod-ucs-content-store-eu-west/content/pii:S0306261920308369/gr2/DOWNSAMPLED/image/jpeg/d5c6bd3937d772a6f0cb4d36302460b0/gr2.jpg gr2 gr2.jpg jpg 52234 289 631 IMAGE-DOWNSAMPLED 1-s2.0-S0306261920308369-gr3.jpg https://s3-eu-west-1.amazonaws.com/prod-ucs-content-store-eu-west/content/pii:S0306261920308369/gr3/DOWNSAMPLED/image/jpeg/57cf7c3f4c2177ec58946fa456194d50/gr3.jpg gr3 gr3.jpg jpg 28215 204 364 IMAGE-DOWNSAMPLED 1-s2.0-S0306261920308369-gr10.jpg https://s3-eu-west-1.amazonaws.com/prod-ucs-content-store-eu-west/content/pii:S0306261920308369/gr10/DOWNSAMPLED/image/jpeg/bca208ebac16487b0978cb9f266ccc48/gr10.jpg gr10 gr10.jpg jpg 133295 665 667 IMAGE-DOWNSAMPLED 1-s2.0-S0306261920308369-gr1.jpg https://s3-eu-west-1.amazonaws.com/prod-ucs-content-store-eu-west/content/pii:S0306261920308369/gr1/DOWNSAMPLED/image/jpeg/3e62488d31c65a136999349eed0ae345/gr1.jpg gr1 gr1.jpg jpg 14200 365 200 IMAGE-DOWNSAMPLED 1-s2.0-S0306261920308369-gr6.jpg https://s3-eu-west-1.amazonaws.com/prod-ucs-content-store-eu-west/content/pii:S0306261920308369/gr6/DOWNSAMPLED/image/jpeg/225b206e35c44c3d81ee009d6efe3b20/gr6.jpg gr6 gr6.jpg jpg 71090 349 689 IMAGE-DOWNSAMPLED 1-s2.0-S0306261920308369-gr7.jpg https://s3-eu-west-1.amazonaws.com/prod-ucs-content-store-eu-west/content/pii:S0306261920308369/gr7/DOWNSAMPLED/image/jpeg/91ed59671ab3f5fa8684b4a2bc2ce838/gr7.jpg gr7 gr7.jpg jpg 18126 199 689 IMAGE-DOWNSAMPLED 1-s2.0-S0306261920308369-gr4.jpg https://s3-eu-west-1.amazonaws.com/prod-ucs-content-store-eu-west/content/pii:S0306261920308369/gr4/DOWNSAMPLED/image/jpeg/906a8b17b690e576abf6eb5d39270a26/gr4.jpg gr4 gr4.jpg jpg 73923 338 687 IMAGE-DOWNSAMPLED 1-s2.0-S0306261920308369-gr5.jpg https://s3-eu-west-1.amazonaws.com/prod-ucs-content-store-eu-west/content/pii:S0306261920308369/gr5/DOWNSAMPLED/image/jpeg/ef0c7533890a97ff72a2f102b8b9c072/gr5.jpg gr5 gr5.jpg jpg 31850 215 364 IMAGE-DOWNSAMPLED 1-s2.0-S0306261920308369-gr8.jpg https://s3-eu-west-1.amazonaws.com/prod-ucs-content-store-eu-west/content/pii:S0306261920308369/gr8/DOWNSAMPLED/image/jpeg/b6646e8b85fdff00ff1e4189b0e7ea9f/gr8.jpg gr8 gr8.jpg jpg 92416 382 778 IMAGE-DOWNSAMPLED 1-s2.0-S0306261920308369-gr9.jpg https://s3-eu-west-1.amazonaws.com/prod-ucs-content-store-eu-west/content/pii:S0306261920308369/gr9/DOWNSAMPLED/image/jpeg/7b3a07ca071d56102eff0f375db90cc5/gr9.jpg gr9 gr9.jpg jpg 91958 382 778 IMAGE-DOWNSAMPLED 1-s2.0-S0306261920308369-gr13.sml https://s3-eu-west-1.amazonaws.com/prod-ucs-content-store-eu-west/content/pii:S0306261920308369/gr13/THUMBNAIL/image/gif/431ca80cdbc515cc3a4d80d2f1361a68/gr13.sml gr13 gr13.sml sml 16918 132 219 IMAGE-THUMBNAIL 1-s2.0-S0306261920308369-gr14.sml https://s3-eu-west-1.amazonaws.com/prod-ucs-content-store-eu-west/content/pii:S0306261920308369/gr14/THUMBNAIL/image/gif/b5aab441805b2b0ff7432da782698d02/gr14.sml gr14 gr14.sml sml 5281 163 102 IMAGE-THUMBNAIL 1-s2.0-S0306261920308369-gr11.sml https://s3-eu-west-1.amazonaws.com/prod-ucs-content-store-eu-west/content/pii:S0306261920308369/gr11/THUMBNAIL/image/gif/45de7216d8dd5842e64b313d2b78b52d/gr11.sml gr11 gr11.sml sml 11190 114 219 IMAGE-THUMBNAIL 1-s2.0-S0306261920308369-gr12.sml https://s3-eu-west-1.amazonaws.com/prod-ucs-content-store-eu-west/content/pii:S0306261920308369/gr12/THUMBNAIL/image/gif/8f00d9e3ce3cb28cda0b537ed217d541/gr12.sml gr12 gr12.sml sml 11827 107 219 IMAGE-THUMBNAIL 1-s2.0-S0306261920308369-gr2.sml https://s3-eu-west-1.amazonaws.com/prod-ucs-content-store-eu-west/content/pii:S0306261920308369/gr2/THUMBNAIL/image/gif/bea8bb9bdafb8eb118b18911938eb8bf/gr2.sml gr2 gr2.sml sml 18238 100 219 IMAGE-THUMBNAIL 1-s2.0-S0306261920308369-gr3.sml https://s3-eu-west-1.amazonaws.com/prod-ucs-content-store-eu-west/content/pii:S0306261920308369/gr3/THUMBNAIL/image/gif/7fa88b4f7c80aa63b415c2246f14bea7/gr3.sml gr3 gr3.sml sml 10896 123 219 IMAGE-THUMBNAIL 1-s2.0-S0306261920308369-gr10.sml https://s3-eu-west-1.amazonaws.com/prod-ucs-content-store-eu-west/content/pii:S0306261920308369/gr10/THUMBNAIL/image/gif/8e94ffcef68aef132c7e9d6c9a57023d/gr10.sml gr10 gr10.sml sml 10691 163 164 IMAGE-THUMBNAIL 1-s2.0-S0306261920308369-gr1.sml https://s3-eu-west-1.amazonaws.com/prod-ucs-content-store-eu-west/content/pii:S0306261920308369/gr1/THUMBNAIL/image/gif/abd65f6fa3fcc5e5cafe8c76adc3e354/gr1.sml gr1 gr1.sml sml 3425 164 90 IMAGE-THUMBNAIL 1-s2.0-S0306261920308369-gr6.sml https://s3-eu-west-1.amazonaws.com/prod-ucs-content-store-eu-west/content/pii:S0306261920308369/gr6/THUMBNAIL/image/gif/54c6b7225065c6200f5fb874640d7bfd/gr6.sml gr6 gr6.sml sml 8588 111 219 IMAGE-THUMBNAIL 1-s2.0-S0306261920308369-gr7.sml https://s3-eu-west-1.amazonaws.com/prod-ucs-content-store-eu-west/content/pii:S0306261920308369/gr7/THUMBNAIL/image/gif/a6b1e83986dfd6b90a148ea61409512e/gr7.sml gr7 gr7.sml sml 2691 63 219 IMAGE-THUMBNAIL 1-s2.0-S0306261920308369-gr4.sml https://s3-eu-west-1.amazonaws.com/prod-ucs-content-store-eu-west/content/pii:S0306261920308369/gr4/THUMBNAIL/image/gif/12c0f42a8c5a287194a3e159e0d85382/gr4.sml gr4 gr4.sml sml 9143 108 219 IMAGE-THUMBNAIL 1-s2.0-S0306261920308369-gr5.sml https://s3-eu-west-1.amazonaws.com/prod-ucs-content-store-eu-west/content/pii:S0306261920308369/gr5/THUMBNAIL/image/gif/507a06a737de6bc4e4ef9bb730972752/gr5.sml gr5 gr5.sml sml 12268 129 219 IMAGE-THUMBNAIL 1-s2.0-S0306261920308369-gr8.sml https://s3-eu-west-1.amazonaws.com/prod-ucs-content-store-eu-west/content/pii:S0306261920308369/gr8/THUMBNAIL/image/gif/7c00e4288b1eb73e2f5e165cb0867eea/gr8.sml gr8 gr8.sml sml 10853 108 219 IMAGE-THUMBNAIL 1-s2.0-S0306261920308369-gr9.sml https://s3-eu-west-1.amazonaws.com/prod-ucs-content-store-eu-west/content/pii:S0306261920308369/gr9/THUMBNAIL/image/gif/a17e3134015b99e352561d022258701f/gr9.sml gr9 gr9.sml sml 10952 108 219 IMAGE-THUMBNAIL 1-s2.0-S0306261920308369-gr13_lrg.jpg https://s3-eu-west-1.amazonaws.com/prod-ucs-content-store-eu-west/content/pii:S0306261920308369/gr13/HIGHRES/image/jpeg/36fff3cabbb7d03aeed1bf3e3fecc81c/gr13_lrg.jpg gr13 gr13_lrg.jpg jpg 671917 1904 3150 IMAGE-HIGH-RES 1-s2.0-S0306261920308369-gr14_lrg.jpg https://s3-eu-west-1.amazonaws.com/prod-ucs-content-store-eu-west/content/pii:S0306261920308369/gr14/HIGHRES/image/jpeg/9bb38393ebe9a7beef5ce446996814ed/gr14_lrg.jpg gr14 gr14_lrg.jpg jpg 236569 2574 1614 IMAGE-HIGH-RES 1-s2.0-S0306261920308369-gr11_lrg.jpg https://s3-eu-west-1.amazonaws.com/prod-ucs-content-store-eu-west/content/pii:S0306261920308369/gr11/HIGHRES/image/jpeg/60ccc7c3ea6eaf95f965eb0cfd356b33/gr11_lrg.jpg gr11 gr11_lrg.jpg jpg 521646 1791 3443 IMAGE-HIGH-RES 1-s2.0-S0306261920308369-gr12_lrg.jpg https://s3-eu-west-1.amazonaws.com/prod-ucs-content-store-eu-west/content/pii:S0306261920308369/gr12/HIGHRES/image/jpeg/e4bb7834416306c6b88d4b4ce5bbe5e7/gr12_lrg.jpg gr12 gr12_lrg.jpg jpg 543477 1691 3445 IMAGE-HIGH-RES 1-s2.0-S0306261920308369-gr2_lrg.jpg https://s3-eu-west-1.amazonaws.com/prod-ucs-content-store-eu-west/content/pii:S0306261920308369/gr2/HIGHRES/image/jpeg/da0a863e6ba541d41e01cfed24babfa4/gr2_lrg.jpg gr2 gr2_lrg.jpg jpg 377206 1279 2794 IMAGE-HIGH-RES 1-s2.0-S0306261920308369-gr3_lrg.jpg https://s3-eu-west-1.amazonaws.com/prod-ucs-content-store-eu-west/content/pii:S0306261920308369/gr3/HIGHRES/image/jpeg/73936b28873ead7d5f5db8ac6e6d96c8/gr3_lrg.jpg gr3 gr3_lrg.jpg jpg 181729 903 1614 IMAGE-HIGH-RES 1-s2.0-S0306261920308369-gr10_lrg.jpg https://s3-eu-west-1.amazonaws.com/prod-ucs-content-store-eu-west/content/pii:S0306261920308369/gr10/HIGHRES/image/jpeg/d30450bbf871efc66b52d119bf7b4da8/gr10_lrg.jpg gr10 gr10_lrg.jpg jpg 865415 2943 2953 IMAGE-HIGH-RES 1-s2.0-S0306261920308369-gr1_lrg.jpg https://s3-eu-west-1.amazonaws.com/prod-ucs-content-store-eu-west/content/pii:S0306261920308369/gr1/HIGHRES/image/jpeg/13e33b4a31fa6753857f8c501bc67995/gr1_lrg.jpg gr1 gr1_lrg.jpg jpg 69733 1616 886 IMAGE-HIGH-RES 1-s2.0-S0306261920308369-gr6_lrg.jpg https://s3-eu-west-1.amazonaws.com/prod-ucs-content-store-eu-west/content/pii:S0306261920308369/gr6/HIGHRES/image/jpeg/f52153ca017c5f036f180356f51b46d1/gr6_lrg.jpg gr6 gr6_lrg.jpg jpg 443610 1544 3051 IMAGE-HIGH-RES 1-s2.0-S0306261920308369-gr7_lrg.jpg https://s3-eu-west-1.amazonaws.com/prod-ucs-content-store-eu-west/content/pii:S0306261920308369/gr7/HIGHRES/image/jpeg/9e894ce660f121b3977687488b1ed4b6/gr7_lrg.jpg gr7 gr7_lrg.jpg jpg 96220 883 3051 IMAGE-HIGH-RES 1-s2.0-S0306261920308369-gr4_lrg.jpg https://s3-eu-west-1.amazonaws.com/prod-ucs-content-store-eu-west/content/pii:S0306261920308369/gr4/HIGHRES/image/jpeg/289941fd0deb0b18dd258ab0c1e0a04f/gr4_lrg.jpg gr4 gr4_lrg.jpg jpg 480550 1499 3043 IMAGE-HIGH-RES 1-s2.0-S0306261920308369-gr5_lrg.jpg https://s3-eu-west-1.amazonaws.com/prod-ucs-content-store-eu-west/content/pii:S0306261920308369/gr5/HIGHRES/image/jpeg/32e80dd0ed6976213f0b872bced9bf79/gr5_lrg.jpg gr5 gr5_lrg.jpg jpg 196721 953 1614 IMAGE-HIGH-RES 1-s2.0-S0306261920308369-gr8_lrg.jpg https://s3-eu-west-1.amazonaws.com/prod-ucs-content-store-eu-west/content/pii:S0306261920308369/gr8/HIGHRES/image/jpeg/36cb9d89b8caf6fa75eba59297d79bb2/gr8_lrg.jpg gr8 gr8_lrg.jpg jpg 492933 1691 3443 IMAGE-HIGH-RES 1-s2.0-S0306261920308369-gr9_lrg.jpg https://s3-eu-west-1.amazonaws.com/prod-ucs-content-store-eu-west/content/pii:S0306261920308369/gr9/HIGHRES/image/jpeg/b262018e00e96aa337bc9869396a7223/gr9_lrg.jpg gr9 gr9_lrg.jpg jpg 496594 1691 3443 IMAGE-HIGH-RES 1-s2.0-S0306261920308369-si1.svg https://s3-eu-west-1.amazonaws.com/prod-ucs-content-store-eu-west/content/pii:S0306261920308369/STRIPIN/image/svg+xml/fcd57ffc63479e9d71dd9d69362db0c7/si1.svg si1 si1.svg svg 4557 ALTIMG 1-s2.0-S0306261920308369-si10.svg https://s3-eu-west-1.amazonaws.com/prod-ucs-content-store-eu-west/content/pii:S0306261920308369/STRIPIN/image/svg+xml/cd89a677ee4a1e31abbbfb4a7e6da789/si10.svg si10 si10.svg svg 2187 ALTIMG 1-s2.0-S0306261920308369-si100.svg https://s3-eu-west-1.amazonaws.com/prod-ucs-content-store-eu-west/content/pii:S0306261920308369/STRIPIN/image/svg+xml/872837acc1b2bc7f70a5e210176262b1/si100.svg si100 si100.svg svg 3586 ALTIMG 1-s2.0-S0306261920308369-si101.svg https://s3-eu-west-1.amazonaws.com/prod-ucs-content-store-eu-west/content/pii:S0306261920308369/STRIPIN/image/svg+xml/c8cd06e2567506a4503d4597373f05a2/si101.svg si101 si101.svg svg 3586 ALTIMG 1-s2.0-S0306261920308369-si102.svg https://s3-eu-west-1.amazonaws.com/prod-ucs-content-store-eu-west/content/pii:S0306261920308369/STRIPIN/image/svg+xml/cc0e61908bbd90666ef35c0b6f88a623/si102.svg si102 si102.svg svg 3586 ALTIMG 1-s2.0-S0306261920308369-si103.svg https://s3-eu-west-1.amazonaws.com/prod-ucs-content-store-eu-west/content/pii:S0306261920308369/STRIPIN/image/svg+xml/3011f1e269985d643fa4e041a2035dc9/si103.svg si103 si103.svg svg 2726 ALTIMG 1-s2.0-S0306261920308369-si104.svg https://s3-eu-west-1.amazonaws.com/prod-ucs-content-store-eu-west/content/pii:S0306261920308369/STRIPIN/image/svg+xml/73a57693e949ecdf29acdc3e377a1832/si104.svg si104 si104.svg svg 4958 ALTIMG 1-s2.0-S0306261920308369-si105.svg https://s3-eu-west-1.amazonaws.com/prod-ucs-content-store-eu-west/content/pii:S0306261920308369/STRIPIN/image/svg+xml/a06c64dd6baff7dfc9819df24566b8d7/si105.svg si105 si105.svg svg 4193 ALTIMG 1-s2.0-S0306261920308369-si106.svg https://s3-eu-west-1.amazonaws.com/prod-ucs-content-store-eu-west/content/pii:S0306261920308369/STRIPIN/image/svg+xml/b6a2e97a1fcbb1ecc14138d24bc4bb20/si106.svg si106 si106.svg svg 4858 ALTIMG 1-s2.0-S0306261920308369-si107.svg https://s3-eu-west-1.amazonaws.com/prod-ucs-content-store-eu-west/content/pii:S0306261920308369/STRIPIN/image/svg+xml/c73d0fb0753f16aebf5d94829d2e34a1/si107.svg si107 si107.svg svg 4182 ALTIMG 1-s2.0-S0306261920308369-si108.svg https://s3-eu-west-1.amazonaws.com/prod-ucs-content-store-eu-west/content/pii:S0306261920308369/STRIPIN/image/svg+xml/ebfb96b263c72669e719325a52487c22/si108.svg si108 si108.svg svg 4193 ALTIMG 1-s2.0-S0306261920308369-si109.svg https://s3-eu-west-1.amazonaws.com/prod-ucs-content-store-eu-west/content/pii:S0306261920308369/STRIPIN/image/svg+xml/8507e1c08c33d0329b231ecb42b3a059/si109.svg si109 si109.svg svg 4451 ALTIMG 1-s2.0-S0306261920308369-si11.svg https://s3-eu-west-1.amazonaws.com/prod-ucs-content-store-eu-west/content/pii:S0306261920308369/STRIPIN/image/svg+xml/83da294b5e3b08222b01e7345c421f77/si11.svg si11 si11.svg svg 2330 ALTIMG 1-s2.0-S0306261920308369-si110.svg https://s3-eu-west-1.amazonaws.com/prod-ucs-content-store-eu-west/content/pii:S0306261920308369/STRIPIN/image/svg+xml/e475e0624b3fc71f28f2579330049e7f/si110.svg si110 si110.svg svg 3586 ALTIMG 1-s2.0-S0306261920308369-si111.svg https://s3-eu-west-1.amazonaws.com/prod-ucs-content-store-eu-west/content/pii:S0306261920308369/STRIPIN/image/svg+xml/86e65270dec1d0208018da5f9beb65c2/si111.svg si111 si111.svg svg 4193 ALTIMG 1-s2.0-S0306261920308369-si112.svg https://s3-eu-west-1.amazonaws.com/prod-ucs-content-store-eu-west/content/pii:S0306261920308369/STRIPIN/image/svg+xml/f7281380256bb61d14d47a6d8ce92434/si112.svg si112 si112.svg svg 48046 ALTIMG 1-s2.0-S0306261920308369-si113.svg https://s3-eu-west-1.amazonaws.com/prod-ucs-content-store-eu-west/content/pii:S0306261920308369/STRIPIN/image/svg+xml/046709a14488382f4bf66389cdc7d2eb/si113.svg si113 si113.svg svg 28843 ALTIMG 1-s2.0-S0306261920308369-si114.svg https://s3-eu-west-1.amazonaws.com/prod-ucs-content-store-eu-west/content/pii:S0306261920308369/STRIPIN/image/svg+xml/de7c8c9c65e962faed85be1b9d14c300/si114.svg si114 si114.svg svg 20692 ALTIMG 1-s2.0-S0306261920308369-si115.svg https://s3-eu-west-1.amazonaws.com/prod-ucs-content-store-eu-west/content/pii:S0306261920308369/STRIPIN/image/svg+xml/b9dde46cb43388aef860b839136c8d7c/si115.svg si115 si115.svg svg 19631 ALTIMG 1-s2.0-S0306261920308369-si116.svg https://s3-eu-west-1.amazonaws.com/prod-ucs-content-store-eu-west/content/pii:S0306261920308369/STRIPIN/image/svg+xml/b79820616827ec80cc112579a9113170/si116.svg si116 si116.svg svg 9005 ALTIMG 1-s2.0-S0306261920308369-si117.svg https://s3-eu-west-1.amazonaws.com/prod-ucs-content-store-eu-west/content/pii:S0306261920308369/STRIPIN/image/svg+xml/1e720293ddfed6eac85a163bce809f0e/si117.svg si117 si117.svg svg 5748 ALTIMG 1-s2.0-S0306261920308369-si118.svg https://s3-eu-west-1.amazonaws.com/prod-ucs-content-store-eu-west/content/pii:S0306261920308369/STRIPIN/image/svg+xml/f664442bc2717cff0e87882d9cbaaea6/si118.svg si118 si118.svg svg 4193 ALTIMG 1-s2.0-S0306261920308369-si119.svg https://s3-eu-west-1.amazonaws.com/prod-ucs-content-store-eu-west/content/pii:S0306261920308369/STRIPIN/image/svg+xml/bf88640313235c8408b12d73084e827f/si119.svg si119 si119.svg svg 4230 ALTIMG 1-s2.0-S0306261920308369-si12.svg https://s3-eu-west-1.amazonaws.com/prod-ucs-content-store-eu-west/content/pii:S0306261920308369/STRIPIN/image/svg+xml/636da74cb4aaa41800daa22f3b065ccc/si12.svg si12 si12.svg svg 2187 ALTIMG 1-s2.0-S0306261920308369-si120.svg https://s3-eu-west-1.amazonaws.com/prod-ucs-content-store-eu-west/content/pii:S0306261920308369/STRIPIN/image/svg+xml/77b1d9226a9958e91bcfb1cac9d18891/si120.svg si120 si120.svg svg 11514 ALTIMG 1-s2.0-S0306261920308369-si121.svg https://s3-eu-west-1.amazonaws.com/prod-ucs-content-store-eu-west/content/pii:S0306261920308369/STRIPIN/image/svg+xml/b8e0bc5d062df7ce7c28cd2ed211be0e/si121.svg si121 si121.svg svg 4182 ALTIMG 1-s2.0-S0306261920308369-si122.svg https://s3-eu-west-1.amazonaws.com/prod-ucs-content-store-eu-west/content/pii:S0306261920308369/STRIPIN/image/svg+xml/714dfb6af89e6ea2359e027273943234/si122.svg si122 si122.svg svg 4193 ALTIMG 1-s2.0-S0306261920308369-si123.svg https://s3-eu-west-1.amazonaws.com/prod-ucs-content-store-eu-west/content/pii:S0306261920308369/STRIPIN/image/svg+xml/2c7ef43f8a6a3b37f6b775d39b738cf8/si123.svg si123 si123.svg svg 4230 ALTIMG 1-s2.0-S0306261920308369-si124.svg https://s3-eu-west-1.amazonaws.com/prod-ucs-content-store-eu-west/content/pii:S0306261920308369/STRIPIN/image/svg+xml/aa4643240cb04964617cca40d4967106/si124.svg si124 si124.svg svg 4940 ALTIMG 1-s2.0-S0306261920308369-si125.svg https://s3-eu-west-1.amazonaws.com/prod-ucs-content-store-eu-west/content/pii:S0306261920308369/STRIPIN/image/svg+xml/16db34619cf05014c87d9de8d7f847bc/si125.svg si125 si125.svg svg 5993 ALTIMG 1-s2.0-S0306261920308369-si126.svg https://s3-eu-west-1.amazonaws.com/prod-ucs-content-store-eu-west/content/pii:S0306261920308369/STRIPIN/image/svg+xml/8346ee0aa1783ec03f41d4458da0143d/si126.svg si126 si126.svg svg 5991 ALTIMG 1-s2.0-S0306261920308369-si127.svg https://s3-eu-west-1.amazonaws.com/prod-ucs-content-store-eu-west/content/pii:S0306261920308369/STRIPIN/image/svg+xml/9f7db66514696cf63dfa35ac68ece342/si127.svg si127 si127.svg svg 7974 ALTIMG 1-s2.0-S0306261920308369-si128.svg https://s3-eu-west-1.amazonaws.com/prod-ucs-content-store-eu-west/content/pii:S0306261920308369/STRIPIN/image/svg+xml/13c79ac2e85f603acc93076ff0a266c6/si128.svg si128 si128.svg svg 6263 ALTIMG 1-s2.0-S0306261920308369-si129.svg https://s3-eu-west-1.amazonaws.com/prod-ucs-content-store-eu-west/content/pii:S0306261920308369/STRIPIN/image/svg+xml/87f93e33720fc0e283bc994919a1cc8d/si129.svg si129 si129.svg svg 4857 ALTIMG 1-s2.0-S0306261920308369-si13.svg https://s3-eu-west-1.amazonaws.com/prod-ucs-content-store-eu-west/content/pii:S0306261920308369/STRIPIN/image/svg+xml/18405329be0bbc2599d1e643fe6d81db/si13.svg si13 si13.svg svg 2330 ALTIMG 1-s2.0-S0306261920308369-si130.svg https://s3-eu-west-1.amazonaws.com/prod-ucs-content-store-eu-west/content/pii:S0306261920308369/STRIPIN/image/svg+xml/deb206b4abc272383fc6a20c1b8dc225/si130.svg si130 si130.svg svg 2981 ALTIMG 1-s2.0-S0306261920308369-si131.svg https://s3-eu-west-1.amazonaws.com/prod-ucs-content-store-eu-west/content/pii:S0306261920308369/STRIPIN/image/svg+xml/b3fee6e3104a5a9327f7e30649e8ac06/si131.svg si131 si131.svg svg 2905 ALTIMG 1-s2.0-S0306261920308369-si132.svg https://s3-eu-west-1.amazonaws.com/prod-ucs-content-store-eu-west/content/pii:S0306261920308369/STRIPIN/image/svg+xml/054ec3fb9cc6c9432c641516ad82d3fa/si132.svg si132 si132.svg svg 1769 ALTIMG 1-s2.0-S0306261920308369-si133.svg https://s3-eu-west-1.amazonaws.com/prod-ucs-content-store-eu-west/content/pii:S0306261920308369/STRIPIN/image/svg+xml/8d352414610c172cdf3f6e2ff1446bb6/si133.svg si133 si133.svg svg 2905 ALTIMG 1-s2.0-S0306261920308369-si134.svg https://s3-eu-west-1.amazonaws.com/prod-ucs-content-store-eu-west/content/pii:S0306261920308369/STRIPIN/image/svg+xml/4224cff4c83c004ebd1cd1ac2168cae5/si134.svg si134 si134.svg svg 4404 ALTIMG 1-s2.0-S0306261920308369-si135.svg https://s3-eu-west-1.amazonaws.com/prod-ucs-content-store-eu-west/content/pii:S0306261920308369/STRIPIN/image/svg+xml/ce2c44cdf0853337959e087d4d0c4bec/si135.svg si135 si135.svg svg 3586 ALTIMG 1-s2.0-S0306261920308369-si136.svg https://s3-eu-west-1.amazonaws.com/prod-ucs-content-store-eu-west/content/pii:S0306261920308369/STRIPIN/image/svg+xml/10075cbcfe7d2fe2ee5d9acbe6661f4c/si136.svg si136 si136.svg svg 7113 ALTIMG 1-s2.0-S0306261920308369-si137.svg https://s3-eu-west-1.amazonaws.com/prod-ucs-content-store-eu-west/content/pii:S0306261920308369/STRIPIN/image/svg+xml/05780405cdab65b2296099f101a163e5/si137.svg si137 si137.svg svg 5256 ALTIMG 1-s2.0-S0306261920308369-si138.svg https://s3-eu-west-1.amazonaws.com/prod-ucs-content-store-eu-west/content/pii:S0306261920308369/STRIPIN/image/svg+xml/0268ad419bc5a99e7284f5420b26f544/si138.svg si138 si138.svg svg 5935 ALTIMG 1-s2.0-S0306261920308369-si139.svg https://s3-eu-west-1.amazonaws.com/prod-ucs-content-store-eu-west/content/pii:S0306261920308369/STRIPIN/image/svg+xml/fba522772056d03963855d420a7c4acb/si139.svg si139 si139.svg svg 4858 ALTIMG 1-s2.0-S0306261920308369-si14.svg https://s3-eu-west-1.amazonaws.com/prod-ucs-content-store-eu-west/content/pii:S0306261920308369/STRIPIN/image/svg+xml/3a3879d3dad83c5648dba479265f6e78/si14.svg si14 si14.svg svg 2187 ALTIMG 1-s2.0-S0306261920308369-si140.svg https://s3-eu-west-1.amazonaws.com/prod-ucs-content-store-eu-west/content/pii:S0306261920308369/STRIPIN/image/svg+xml/fd9a15ff67e8e2141f6af62df60304cc/si140.svg si140 si140.svg svg 10060 ALTIMG 1-s2.0-S0306261920308369-si141.svg https://s3-eu-west-1.amazonaws.com/prod-ucs-content-store-eu-west/content/pii:S0306261920308369/STRIPIN/image/svg+xml/c38ba8306a804f6075a4a04810511eff/si141.svg si141 si141.svg svg 9346 ALTIMG 1-s2.0-S0306261920308369-si142.svg https://s3-eu-west-1.amazonaws.com/prod-ucs-content-store-eu-west/content/pii:S0306261920308369/STRIPIN/image/svg+xml/e0ed116465a0e8ebc91e92ae9cdcd056/si142.svg si142 si142.svg svg 9346 ALTIMG 1-s2.0-S0306261920308369-si143.svg https://s3-eu-west-1.amazonaws.com/prod-ucs-content-store-eu-west/content/pii:S0306261920308369/STRIPIN/image/svg+xml/197b7f71a51d30a986f352a02373ab11/si143.svg si143 si143.svg svg 9346 ALTIMG 1-s2.0-S0306261920308369-si144.svg https://s3-eu-west-1.amazonaws.com/prod-ucs-content-store-eu-west/content/pii:S0306261920308369/STRIPIN/image/svg+xml/4aa24818ba60ff8654735efaa9cfdace/si144.svg si144 si144.svg svg 3880 ALTIMG 1-s2.0-S0306261920308369-si145.svg https://s3-eu-west-1.amazonaws.com/prod-ucs-content-store-eu-west/content/pii:S0306261920308369/STRIPIN/image/svg+xml/dfaaf95b56589d02487ca99641edff49/si145.svg si145 si145.svg svg 2848 ALTIMG 1-s2.0-S0306261920308369-si146.svg https://s3-eu-west-1.amazonaws.com/prod-ucs-content-store-eu-west/content/pii:S0306261920308369/STRIPIN/image/svg+xml/5ffff0c4e0fbed0bc9ee81d66c6c5696/si146.svg si146 si146.svg svg 4193 ALTIMG 1-s2.0-S0306261920308369-si147.svg https://s3-eu-west-1.amazonaws.com/prod-ucs-content-store-eu-west/content/pii:S0306261920308369/STRIPIN/image/svg+xml/4c34b751e8a03570a5dc62da4306d3ad/si147.svg si147 si147.svg svg 41435 ALTIMG 1-s2.0-S0306261920308369-si148.svg https://s3-eu-west-1.amazonaws.com/prod-ucs-content-store-eu-west/content/pii:S0306261920308369/STRIPIN/image/svg+xml/0cdd45322103ce7a7ef166807200bf8a/si148.svg si148 si148.svg svg 4502 ALTIMG 1-s2.0-S0306261920308369-si149.svg https://s3-eu-west-1.amazonaws.com/prod-ucs-content-store-eu-west/content/pii:S0306261920308369/STRIPIN/image/svg+xml/0f7d7634b9562f4ce5b808b0eac87482/si149.svg si149 si149.svg svg 5213 ALTIMG 1-s2.0-S0306261920308369-si15.svg https://s3-eu-west-1.amazonaws.com/prod-ucs-content-store-eu-west/content/pii:S0306261920308369/STRIPIN/image/svg+xml/101e8c158e400f3c41258ba49b5aa160/si15.svg si15 si15.svg svg 2330 ALTIMG 1-s2.0-S0306261920308369-si150.svg https://s3-eu-west-1.amazonaws.com/prod-ucs-content-store-eu-west/content/pii:S0306261920308369/STRIPIN/image/svg+xml/5f2b8c5ba18bc2c822cedcf14d69a707/si150.svg si150 si150.svg svg 6180 ALTIMG 1-s2.0-S0306261920308369-si151.svg https://s3-eu-west-1.amazonaws.com/prod-ucs-content-store-eu-west/content/pii:S0306261920308369/STRIPIN/image/svg+xml/5241eaf2f3ba8d9dd0b2fb8af4ba00b5/si151.svg si151 si151.svg svg 4193 ALTIMG 1-s2.0-S0306261920308369-si152.svg https://s3-eu-west-1.amazonaws.com/prod-ucs-content-store-eu-west/content/pii:S0306261920308369/STRIPIN/image/svg+xml/df33b2ef9607b8cecb065fa45ab2b0c0/si152.svg si152 si152.svg svg 5226 ALTIMG 1-s2.0-S0306261920308369-si153.svg https://s3-eu-west-1.amazonaws.com/prod-ucs-content-store-eu-west/content/pii:S0306261920308369/STRIPIN/image/svg+xml/130edeca2bf0a7b99057493cdb1f1371/si153.svg si153 si153.svg svg 10980 ALTIMG 1-s2.0-S0306261920308369-si154.svg https://s3-eu-west-1.amazonaws.com/prod-ucs-content-store-eu-west/content/pii:S0306261920308369/STRIPIN/image/svg+xml/14d522f82285733746cf59a9b1fea1d2/si154.svg si154 si154.svg svg 7961 ALTIMG 1-s2.0-S0306261920308369-si155.svg https://s3-eu-west-1.amazonaws.com/prod-ucs-content-store-eu-west/content/pii:S0306261920308369/STRIPIN/image/svg+xml/ab6cbef87cf0eb8c78481bc7865669db/si155.svg si155 si155.svg svg 3961 ALTIMG 1-s2.0-S0306261920308369-si156.svg https://s3-eu-west-1.amazonaws.com/prod-ucs-content-store-eu-west/content/pii:S0306261920308369/STRIPIN/image/svg+xml/aee4dbc41ee1a87538eb42678f9a7414/si156.svg si156 si156.svg svg 8677 ALTIMG 1-s2.0-S0306261920308369-si157.svg https://s3-eu-west-1.amazonaws.com/prod-ucs-content-store-eu-west/content/pii:S0306261920308369/STRIPIN/image/svg+xml/322734b5f5e6aca161de0a06b637b489/si157.svg si157 si157.svg svg 3846 ALTIMG 1-s2.0-S0306261920308369-si158.svg https://s3-eu-west-1.amazonaws.com/prod-ucs-content-store-eu-west/content/pii:S0306261920308369/STRIPIN/image/svg+xml/9db0f0f5254dde45bbb0a5365180e8fa/si158.svg si158 si158.svg svg 4460 ALTIMG 1-s2.0-S0306261920308369-si159.svg https://s3-eu-west-1.amazonaws.com/prod-ucs-content-store-eu-west/content/pii:S0306261920308369/STRIPIN/image/svg+xml/f47ddf7f07da9d45f2a80d30df6a8c54/si159.svg si159 si159.svg svg 5320 ALTIMG 1-s2.0-S0306261920308369-si16.svg https://s3-eu-west-1.amazonaws.com/prod-ucs-content-store-eu-west/content/pii:S0306261920308369/STRIPIN/image/svg+xml/5bd3a3798964827404b78809c6b4d5e2/si16.svg si16 si16.svg svg 2187 ALTIMG 1-s2.0-S0306261920308369-si160.svg https://s3-eu-west-1.amazonaws.com/prod-ucs-content-store-eu-west/content/pii:S0306261920308369/STRIPIN/image/svg+xml/6deb3059ba917773e424d113184ec871/si160.svg si160 si160.svg svg 6394 ALTIMG 1-s2.0-S0306261920308369-si161.svg https://s3-eu-west-1.amazonaws.com/prod-ucs-content-store-eu-west/content/pii:S0306261920308369/STRIPIN/image/svg+xml/b2f729ada428687385e973d7d3f4343b/si161.svg si161 si161.svg svg 6205 ALTIMG 1-s2.0-S0306261920308369-si162.svg https://s3-eu-west-1.amazonaws.com/prod-ucs-content-store-eu-west/content/pii:S0306261920308369/STRIPIN/image/svg+xml/46b6820ab605e74286e8659a69cdf7d4/si162.svg si162 si162.svg svg 7442 ALTIMG 1-s2.0-S0306261920308369-si163.svg https://s3-eu-west-1.amazonaws.com/prod-ucs-content-store-eu-west/content/pii:S0306261920308369/STRIPIN/image/svg+xml/4b09e86a51686f6a07b03a1ea07195ba/si163.svg si163 si163.svg svg 4301 ALTIMG 1-s2.0-S0306261920308369-si164.svg https://s3-eu-west-1.amazonaws.com/prod-ucs-content-store-eu-west/content/pii:S0306261920308369/STRIPIN/image/svg+xml/06f08014d63aa4a039994d89cabd7825/si164.svg si164 si164.svg svg 4193 ALTIMG 1-s2.0-S0306261920308369-si165.svg https://s3-eu-west-1.amazonaws.com/prod-ucs-content-store-eu-west/content/pii:S0306261920308369/STRIPIN/image/svg+xml/aa395db03385dd6153c181357febf3e1/si165.svg si165 si165.svg svg 2726 ALTIMG 1-s2.0-S0306261920308369-si166.svg https://s3-eu-west-1.amazonaws.com/prod-ucs-content-store-eu-west/content/pii:S0306261920308369/STRIPIN/image/svg+xml/ed3caac8a37e0e4b2b57f21914ad2829/si166.svg si166 si166.svg svg 6845 ALTIMG 1-s2.0-S0306261920308369-si167.svg https://s3-eu-west-1.amazonaws.com/prod-ucs-content-store-eu-west/content/pii:S0306261920308369/STRIPIN/image/svg+xml/33096b418f36d1e327607e7b70a48186/si167.svg si167 si167.svg svg 6494 ALTIMG 1-s2.0-S0306261920308369-si168.svg https://s3-eu-west-1.amazonaws.com/prod-ucs-content-store-eu-west/content/pii:S0306261920308369/STRIPIN/image/svg+xml/4deec8edd081eb221e4a9e6d20d13631/si168.svg si168 si168.svg svg 1412 ALTIMG 1-s2.0-S0306261920308369-si169.svg https://s3-eu-west-1.amazonaws.com/prod-ucs-content-store-eu-west/content/pii:S0306261920308369/STRIPIN/image/svg+xml/dedfc0ae49eccbd17bfe209e899b7a0a/si169.svg si169 si169.svg svg 15393 ALTIMG 1-s2.0-S0306261920308369-si17.svg https://s3-eu-west-1.amazonaws.com/prod-ucs-content-store-eu-west/content/pii:S0306261920308369/STRIPIN/image/svg+xml/d9da27b9bd385034ab042d91579853ba/si17.svg si17 si17.svg svg 2330 ALTIMG 1-s2.0-S0306261920308369-si170.svg https://s3-eu-west-1.amazonaws.com/prod-ucs-content-store-eu-west/content/pii:S0306261920308369/STRIPIN/image/svg+xml/b2470d570b492723f9ea54794bfe5d27/si170.svg si170 si170.svg svg 15637 ALTIMG 1-s2.0-S0306261920308369-si171.svg https://s3-eu-west-1.amazonaws.com/prod-ucs-content-store-eu-west/content/pii:S0306261920308369/STRIPIN/image/svg+xml/d63668362ed56b932c557e8a09741fea/si171.svg si171 si171.svg svg 1412 ALTIMG 1-s2.0-S0306261920308369-si172.svg https://s3-eu-west-1.amazonaws.com/prod-ucs-content-store-eu-west/content/pii:S0306261920308369/STRIPIN/image/svg+xml/1bfe66892ad39859c6bac45d1adff33b/si172.svg si172 si172.svg svg 9245 ALTIMG 1-s2.0-S0306261920308369-si173.svg https://s3-eu-west-1.amazonaws.com/prod-ucs-content-store-eu-west/content/pii:S0306261920308369/STRIPIN/image/svg+xml/29b1bfe5e50545a4688b30b5c4b412fb/si173.svg si173 si173.svg svg 1412 ALTIMG 1-s2.0-S0306261920308369-si174.svg https://s3-eu-west-1.amazonaws.com/prod-ucs-content-store-eu-west/content/pii:S0306261920308369/STRIPIN/image/svg+xml/199d26f60dd83841b4d58e9ecc089209/si174.svg si174 si174.svg svg 3269 ALTIMG 1-s2.0-S0306261920308369-si175.svg https://s3-eu-west-1.amazonaws.com/prod-ucs-content-store-eu-west/content/pii:S0306261920308369/STRIPIN/image/svg+xml/073142fd242c782138ecaad87fa43790/si175.svg si175 si175.svg svg 4940 ALTIMG 1-s2.0-S0306261920308369-si176.svg https://s3-eu-west-1.amazonaws.com/prod-ucs-content-store-eu-west/content/pii:S0306261920308369/STRIPIN/image/svg+xml/b515082de4d412c676e7f3cae0ea8abb/si176.svg si176 si176.svg svg 6494 ALTIMG 1-s2.0-S0306261920308369-si177.svg https://s3-eu-west-1.amazonaws.com/prod-ucs-content-store-eu-west/content/pii:S0306261920308369/STRIPIN/image/svg+xml/845d57d28ea736bbb2b2a1cead835963/si177.svg si177 si177.svg svg 10924 ALTIMG 1-s2.0-S0306261920308369-si178.svg https://s3-eu-west-1.amazonaws.com/prod-ucs-content-store-eu-west/content/pii:S0306261920308369/STRIPIN/image/svg+xml/a5c7de2b15a3496f434461ef95782588/si178.svg si178 si178.svg svg 6429 ALTIMG 1-s2.0-S0306261920308369-si179.svg https://s3-eu-west-1.amazonaws.com/prod-ucs-content-store-eu-west/content/pii:S0306261920308369/STRIPIN/image/svg+xml/057ec965a7ccde43d3f23d4d74f0c3ff/si179.svg si179 si179.svg svg 30007 ALTIMG 1-s2.0-S0306261920308369-si18.svg https://s3-eu-west-1.amazonaws.com/prod-ucs-content-store-eu-west/content/pii:S0306261920308369/STRIPIN/image/svg+xml/10afc5a2cae3d2b1fa0966b20d9b0994/si18.svg si18 si18.svg svg 2187 ALTIMG 1-s2.0-S0306261920308369-si180.svg https://s3-eu-west-1.amazonaws.com/prod-ucs-content-store-eu-west/content/pii:S0306261920308369/STRIPIN/image/svg+xml/5db6888446c663ebd4ae3573a48caae2/si180.svg si180 si180.svg svg 14424 ALTIMG 1-s2.0-S0306261920308369-si181.svg https://s3-eu-west-1.amazonaws.com/prod-ucs-content-store-eu-west/content/pii:S0306261920308369/STRIPIN/image/svg+xml/b7d8bd69730d8bba8d62215389c58100/si181.svg si181 si181.svg svg 1706 ALTIMG 1-s2.0-S0306261920308369-si182.svg https://s3-eu-west-1.amazonaws.com/prod-ucs-content-store-eu-west/content/pii:S0306261920308369/STRIPIN/image/svg+xml/98ed828c098a229ebe1a2dcf4b0d08f2/si182.svg si182 si182.svg svg 1706 ALTIMG 1-s2.0-S0306261920308369-si183.svg https://s3-eu-west-1.amazonaws.com/prod-ucs-content-store-eu-west/content/pii:S0306261920308369/STRIPIN/image/svg+xml/0f8999a3de8f64c74cc388f75cfabf70/si183.svg si183 si183.svg svg 6004 ALTIMG 1-s2.0-S0306261920308369-si184.svg https://s3-eu-west-1.amazonaws.com/prod-ucs-content-store-eu-west/content/pii:S0306261920308369/STRIPIN/image/svg+xml/bea23fd171e43c0a96aa265272271f51/si184.svg si184 si184.svg svg 3269 ALTIMG 1-s2.0-S0306261920308369-si185.svg https://s3-eu-west-1.amazonaws.com/prod-ucs-content-store-eu-west/content/pii:S0306261920308369/STRIPIN/image/svg+xml/2acf3854bc91d13446492e6d9f5cc1ba/si185.svg si185 si185.svg svg 11158 ALTIMG 1-s2.0-S0306261920308369-si186.svg https://s3-eu-west-1.amazonaws.com/prod-ucs-content-store-eu-west/content/pii:S0306261920308369/STRIPIN/image/svg+xml/4c3bfe6ffe7b946d0d057c76c1695c5e/si186.svg si186 si186.svg svg 5066 ALTIMG 1-s2.0-S0306261920308369-si187.svg https://s3-eu-west-1.amazonaws.com/prod-ucs-content-store-eu-west/content/pii:S0306261920308369/STRIPIN/image/svg+xml/826188fe1a5da8a0184b06a45059beaf/si187.svg si187 si187.svg svg 4260 ALTIMG 1-s2.0-S0306261920308369-si188.svg https://s3-eu-west-1.amazonaws.com/prod-ucs-content-store-eu-west/content/pii:S0306261920308369/STRIPIN/image/svg+xml/d1c117a989d00bd4930f7a2eae37f339/si188.svg si188 si188.svg svg 2331 ALTIMG 1-s2.0-S0306261920308369-si189.svg https://s3-eu-west-1.amazonaws.com/prod-ucs-content-store-eu-west/content/pii:S0306261920308369/STRIPIN/image/svg+xml/df9d3c4c0e67bb0b120da277cf265947/si189.svg si189 si189.svg svg 2331 ALTIMG 1-s2.0-S0306261920308369-si19.svg https://s3-eu-west-1.amazonaws.com/prod-ucs-content-store-eu-west/content/pii:S0306261920308369/STRIPIN/image/svg+xml/78bcbec52f1e22ce9cdd38c68fb7fc5b/si19.svg si19 si19.svg svg 2330 ALTIMG 1-s2.0-S0306261920308369-si190.svg https://s3-eu-west-1.amazonaws.com/prod-ucs-content-store-eu-west/content/pii:S0306261920308369/STRIPIN/image/svg+xml/418946277954fa91fe00735cdfc4e9d0/si190.svg si190 si190.svg svg 2188 ALTIMG 1-s2.0-S0306261920308369-si191.svg https://s3-eu-west-1.amazonaws.com/prod-ucs-content-store-eu-west/content/pii:S0306261920308369/STRIPIN/image/svg+xml/c31f38260661b5767fcd306a4e8b6e1d/si191.svg si191 si191.svg svg 6888 ALTIMG 1-s2.0-S0306261920308369-si192.svg https://s3-eu-west-1.amazonaws.com/prod-ucs-content-store-eu-west/content/pii:S0306261920308369/STRIPIN/image/svg+xml/6675b25f4ae2f5968289a76fa04ada9b/si192.svg si192 si192.svg svg 3848 ALTIMG 1-s2.0-S0306261920308369-si193.svg https://s3-eu-west-1.amazonaws.com/prod-ucs-content-store-eu-west/content/pii:S0306261920308369/STRIPIN/image/svg+xml/2bed88fdc5e4eb24c3a182c85dd9fcc6/si193.svg si193 si193.svg svg 6888 ALTIMG 1-s2.0-S0306261920308369-si194.svg https://s3-eu-west-1.amazonaws.com/prod-ucs-content-store-eu-west/content/pii:S0306261920308369/STRIPIN/image/svg+xml/c2d5342bd1b407e120272e7ce5c52bcf/si194.svg si194 si194.svg svg 5251 ALTIMG 1-s2.0-S0306261920308369-si2.svg https://s3-eu-west-1.amazonaws.com/prod-ucs-content-store-eu-west/content/pii:S0306261920308369/STRIPIN/image/svg+xml/381b0a27b0f1eba7a59a44ac9ec1db1d/si2.svg si2 si2.svg svg 2186 ALTIMG 1-s2.0-S0306261920308369-si20.svg https://s3-eu-west-1.amazonaws.com/prod-ucs-content-store-eu-west/content/pii:S0306261920308369/STRIPIN/image/svg+xml/e0bbf60562d8e0c3b8f4d2b74e63584f/si20.svg si20 si20.svg svg 2187 ALTIMG 1-s2.0-S0306261920308369-si21.svg https://s3-eu-west-1.amazonaws.com/prod-ucs-content-store-eu-west/content/pii:S0306261920308369/STRIPIN/image/svg+xml/c4e187b683bf97eff9dfffd91ec2ba0b/si21.svg si21 si21.svg svg 2331 ALTIMG 1-s2.0-S0306261920308369-si22.svg https://s3-eu-west-1.amazonaws.com/prod-ucs-content-store-eu-west/content/pii:S0306261920308369/STRIPIN/image/svg+xml/c608c7d61d702a49577a333be1ba4e2c/si22.svg si22 si22.svg svg 2188 ALTIMG 1-s2.0-S0306261920308369-si23.svg https://s3-eu-west-1.amazonaws.com/prod-ucs-content-store-eu-west/content/pii:S0306261920308369/STRIPIN/image/svg+xml/0116bf9a5c83d86ff9542d0480a7a62b/si23.svg si23 si23.svg svg 2331 ALTIMG 1-s2.0-S0306261920308369-si24.svg https://s3-eu-west-1.amazonaws.com/prod-ucs-content-store-eu-west/content/pii:S0306261920308369/STRIPIN/image/svg+xml/8a72ea99275bfcd252e34fd432f96b10/si24.svg si24 si24.svg svg 4404 ALTIMG 1-s2.0-S0306261920308369-si25.svg https://s3-eu-west-1.amazonaws.com/prod-ucs-content-store-eu-west/content/pii:S0306261920308369/STRIPIN/image/svg+xml/f2ec6d06567540d832a7cf0112c2967e/si25.svg si25 si25.svg svg 3074 ALTIMG 1-s2.0-S0306261920308369-si26.svg https://s3-eu-west-1.amazonaws.com/prod-ucs-content-store-eu-west/content/pii:S0306261920308369/STRIPIN/image/svg+xml/0c8101f546921cc86cb3daca18f9326c/si26.svg si26 si26.svg svg 3607 ALTIMG 1-s2.0-S0306261920308369-si27.svg https://s3-eu-west-1.amazonaws.com/prod-ucs-content-store-eu-west/content/pii:S0306261920308369/STRIPIN/image/svg+xml/e39be53a68452ced195653d966ede6e3/si27.svg si27 si27.svg svg 5402 ALTIMG 1-s2.0-S0306261920308369-si28.svg https://s3-eu-west-1.amazonaws.com/prod-ucs-content-store-eu-west/content/pii:S0306261920308369/STRIPIN/image/svg+xml/6f647eb972698645840a25b987073178/si28.svg si28 si28.svg svg 2615 ALTIMG 1-s2.0-S0306261920308369-si29.svg https://s3-eu-west-1.amazonaws.com/prod-ucs-content-store-eu-west/content/pii:S0306261920308369/STRIPIN/image/svg+xml/c79f5b51ef39111e28c2571b49e5fc23/si29.svg si29 si29.svg svg 2726 ALTIMG 1-s2.0-S0306261920308369-si3.svg https://s3-eu-west-1.amazonaws.com/prod-ucs-content-store-eu-west/content/pii:S0306261920308369/STRIPIN/image/svg+xml/3d496321155d7be302e39a9cf581675e/si3.svg si3 si3.svg svg 2330 ALTIMG 1-s2.0-S0306261920308369-si30.svg https://s3-eu-west-1.amazonaws.com/prod-ucs-content-store-eu-west/content/pii:S0306261920308369/STRIPIN/image/svg+xml/884745aea830bc4def081724a02ebf3a/si30.svg si30 si30.svg svg 2905 ALTIMG 1-s2.0-S0306261920308369-si31.svg https://s3-eu-west-1.amazonaws.com/prod-ucs-content-store-eu-west/content/pii:S0306261920308369/STRIPIN/image/svg+xml/e477f7be13ee25edbab34b15c67c6c9d/si31.svg si31 si31.svg svg 4958 ALTIMG 1-s2.0-S0306261920308369-si32.svg https://s3-eu-west-1.amazonaws.com/prod-ucs-content-store-eu-west/content/pii:S0306261920308369/STRIPIN/image/svg+xml/90ce1e9e2beafd82d91b2788cd76ef04/si32.svg si32 si32.svg svg 4193 ALTIMG 1-s2.0-S0306261920308369-si33.svg https://s3-eu-west-1.amazonaws.com/prod-ucs-content-store-eu-west/content/pii:S0306261920308369/STRIPIN/image/svg+xml/db0bf6ee20fff3f54a83c0d3399431a7/si33.svg si33 si33.svg svg 4858 ALTIMG 1-s2.0-S0306261920308369-si34.svg https://s3-eu-west-1.amazonaws.com/prod-ucs-content-store-eu-west/content/pii:S0306261920308369/STRIPIN/image/svg+xml/41448aa5f641bd5e573751743c88bc4d/si34.svg si34 si34.svg svg 4182 ALTIMG 1-s2.0-S0306261920308369-si35.svg https://s3-eu-west-1.amazonaws.com/prod-ucs-content-store-eu-west/content/pii:S0306261920308369/STRIPIN/image/svg+xml/dff114e074b24dda2e0f752e5b235c19/si35.svg si35 si35.svg svg 4193 ALTIMG 1-s2.0-S0306261920308369-si36.svg https://s3-eu-west-1.amazonaws.com/prod-ucs-content-store-eu-west/content/pii:S0306261920308369/STRIPIN/image/svg+xml/db1633027d89af95dda269c4b07fabc5/si36.svg si36 si36.svg svg 4627 ALTIMG 1-s2.0-S0306261920308369-si37.svg https://s3-eu-west-1.amazonaws.com/prod-ucs-content-store-eu-west/content/pii:S0306261920308369/STRIPIN/image/svg+xml/ecc67e524063006d12123bc73ee7268a/si37.svg si37 si37.svg svg 3132 ALTIMG 1-s2.0-S0306261920308369-si38.svg https://s3-eu-west-1.amazonaws.com/prod-ucs-content-store-eu-west/content/pii:S0306261920308369/STRIPIN/image/svg+xml/19d6d523a11f939e25e7ec018e0d6a5a/si38.svg si38 si38.svg svg 3459 ALTIMG 1-s2.0-S0306261920308369-si39.svg https://s3-eu-west-1.amazonaws.com/prod-ucs-content-store-eu-west/content/pii:S0306261920308369/STRIPIN/image/svg+xml/bdac0753764c35b5140fac0ab5912f06/si39.svg si39 si39.svg svg 5496 ALTIMG 1-s2.0-S0306261920308369-si4.svg https://s3-eu-west-1.amazonaws.com/prod-ucs-content-store-eu-west/content/pii:S0306261920308369/STRIPIN/image/svg+xml/add061c4cf72df160eb760ffc6611421/si4.svg si4 si4.svg svg 2187 ALTIMG 1-s2.0-S0306261920308369-si40.svg https://s3-eu-west-1.amazonaws.com/prod-ucs-content-store-eu-west/content/pii:S0306261920308369/STRIPIN/image/svg+xml/93e753fe801020eef07f8fd698adcbdc/si40.svg si40 si40.svg svg 4559 ALTIMG 1-s2.0-S0306261920308369-si41.svg https://s3-eu-west-1.amazonaws.com/prod-ucs-content-store-eu-west/content/pii:S0306261920308369/STRIPIN/image/svg+xml/3532e96dd7cd2698f08fce5dd5c43adf/si41.svg si41 si41.svg svg 2620 ALTIMG 1-s2.0-S0306261920308369-si42.svg https://s3-eu-west-1.amazonaws.com/prod-ucs-content-store-eu-west/content/pii:S0306261920308369/STRIPIN/image/svg+xml/ea5b741a8d62b1da79ef09b6879e1c70/si42.svg si42 si42.svg svg 2733 ALTIMG 1-s2.0-S0306261920308369-si43.svg https://s3-eu-west-1.amazonaws.com/prod-ucs-content-store-eu-west/content/pii:S0306261920308369/STRIPIN/image/svg+xml/bc7c14791e4f380c93bea23e52a31842/si43.svg si43 si43.svg svg 1769 ALTIMG 1-s2.0-S0306261920308369-si44.svg https://s3-eu-west-1.amazonaws.com/prod-ucs-content-store-eu-west/content/pii:S0306261920308369/STRIPIN/image/svg+xml/e67c3a913b70bd65c82711507bc8a6b1/si44.svg si44 si44.svg svg 6452 ALTIMG 1-s2.0-S0306261920308369-si45.svg https://s3-eu-west-1.amazonaws.com/prod-ucs-content-store-eu-west/content/pii:S0306261920308369/STRIPIN/image/svg+xml/4743b664736efa4fcd99554198f20495/si45.svg si45 si45.svg svg 7113 ALTIMG 1-s2.0-S0306261920308369-si46.svg https://s3-eu-west-1.amazonaws.com/prod-ucs-content-store-eu-west/content/pii:S0306261920308369/STRIPIN/image/svg+xml/aae6701dec3031ee9158ab264ee8ef02/si46.svg si46 si46.svg svg 4182 ALTIMG 1-s2.0-S0306261920308369-si47.svg https://s3-eu-west-1.amazonaws.com/prod-ucs-content-store-eu-west/content/pii:S0306261920308369/STRIPIN/image/svg+xml/1cbaa076ede214ee75b60f9f83102ea4/si47.svg si47 si47.svg svg 4193 ALTIMG 1-s2.0-S0306261920308369-si48.svg https://s3-eu-west-1.amazonaws.com/prod-ucs-content-store-eu-west/content/pii:S0306261920308369/STRIPIN/image/svg+xml/80804971f914053f96f37508be9aeaf1/si48.svg si48 si48.svg svg 4230 ALTIMG 1-s2.0-S0306261920308369-si49.svg https://s3-eu-west-1.amazonaws.com/prod-ucs-content-store-eu-west/content/pii:S0306261920308369/STRIPIN/image/svg+xml/76d579f094252694f016dfb572ca192c/si49.svg si49 si49.svg svg 2577 ALTIMG 1-s2.0-S0306261920308369-si5.svg https://s3-eu-west-1.amazonaws.com/prod-ucs-content-store-eu-west/content/pii:S0306261920308369/STRIPIN/image/svg+xml/40c44cad13206623b4880d42f10bde62/si5.svg si5 si5.svg svg 2330 ALTIMG 1-s2.0-S0306261920308369-si50.svg https://s3-eu-west-1.amazonaws.com/prod-ucs-content-store-eu-west/content/pii:S0306261920308369/STRIPIN/image/svg+xml/a0c4bfe93cc7dcec562087b3b33bc02d/si50.svg si50 si50.svg svg 2173 ALTIMG 1-s2.0-S0306261920308369-si51.svg https://s3-eu-west-1.amazonaws.com/prod-ucs-content-store-eu-west/content/pii:S0306261920308369/STRIPIN/image/svg+xml/ed79a6376f44fbd857a128df766b2c1e/si51.svg si51 si51.svg svg 5748 ALTIMG 1-s2.0-S0306261920308369-si52.svg https://s3-eu-west-1.amazonaws.com/prod-ucs-content-store-eu-west/content/pii:S0306261920308369/STRIPIN/image/svg+xml/a05e0eff1ad806b78a5f9b70d1c8f631/si52.svg si52 si52.svg svg 4193 ALTIMG 1-s2.0-S0306261920308369-si53.svg https://s3-eu-west-1.amazonaws.com/prod-ucs-content-store-eu-west/content/pii:S0306261920308369/STRIPIN/image/svg+xml/0b2fc2b9fe973176fd5b9b06aa15a4e3/si53.svg si53 si53.svg svg 4230 ALTIMG 1-s2.0-S0306261920308369-si54.svg https://s3-eu-west-1.amazonaws.com/prod-ucs-content-store-eu-west/content/pii:S0306261920308369/STRIPIN/image/svg+xml/db3d4520ec1cd549f584191093eda2ed/si54.svg si54 si54.svg svg 2983 ALTIMG 1-s2.0-S0306261920308369-si55.svg https://s3-eu-west-1.amazonaws.com/prod-ucs-content-store-eu-west/content/pii:S0306261920308369/STRIPIN/image/svg+xml/1ee9576ed26563adeb0b521405b5e117/si55.svg si55 si55.svg svg 6128 ALTIMG 1-s2.0-S0306261920308369-si56.svg https://s3-eu-west-1.amazonaws.com/prod-ucs-content-store-eu-west/content/pii:S0306261920308369/STRIPIN/image/svg+xml/61b282acf00e951654cba8fbc41c8670/si56.svg si56 si56.svg svg 2188 ALTIMG 1-s2.0-S0306261920308369-si57.svg https://s3-eu-west-1.amazonaws.com/prod-ucs-content-store-eu-west/content/pii:S0306261920308369/STRIPIN/image/svg+xml/8539879ff0cc331df80ab6e8043dcbec/si57.svg si57 si57.svg svg 2331 ALTIMG 1-s2.0-S0306261920308369-si58.svg https://s3-eu-west-1.amazonaws.com/prod-ucs-content-store-eu-west/content/pii:S0306261920308369/STRIPIN/image/svg+xml/e9d9d7cc64b1cbefc20ace63808dc63b/si58.svg si58 si58.svg svg 2188 ALTIMG 1-s2.0-S0306261920308369-si59.svg https://s3-eu-west-1.amazonaws.com/prod-ucs-content-store-eu-west/content/pii:S0306261920308369/STRIPIN/image/svg+xml/2c2dcd8231b5f876cb8b6335842ec35a/si59.svg si59 si59.svg svg 2188 ALTIMG 1-s2.0-S0306261920308369-si6.svg https://s3-eu-west-1.amazonaws.com/prod-ucs-content-store-eu-west/content/pii:S0306261920308369/STRIPIN/image/svg+xml/2d73d893772df71433b2111d645bb01e/si6.svg si6 si6.svg svg 2187 ALTIMG 1-s2.0-S0306261920308369-si60.svg https://s3-eu-west-1.amazonaws.com/prod-ucs-content-store-eu-west/content/pii:S0306261920308369/STRIPIN/image/svg+xml/0d8005644f1aa698813e62df8d038fab/si60.svg si60 si60.svg svg 2331 ALTIMG 1-s2.0-S0306261920308369-si61.svg https://s3-eu-west-1.amazonaws.com/prod-ucs-content-store-eu-west/content/pii:S0306261920308369/STRIPIN/image/svg+xml/f1dbd52c44ed0e21b2cedb9c6bee183f/si61.svg si61 si61.svg svg 2188 ALTIMG 1-s2.0-S0306261920308369-si62.svg https://s3-eu-west-1.amazonaws.com/prod-ucs-content-store-eu-west/content/pii:S0306261920308369/STRIPIN/image/svg+xml/5fc332bba38c1203ca535c753e21f578/si62.svg si62 si62.svg svg 2331 ALTIMG 1-s2.0-S0306261920308369-si63.svg https://s3-eu-west-1.amazonaws.com/prod-ucs-content-store-eu-west/content/pii:S0306261920308369/STRIPIN/image/svg+xml/ef77d68be49fe8e24a9cd5e93e35b18a/si63.svg si63 si63.svg svg 2188 ALTIMG 1-s2.0-S0306261920308369-si64.svg https://s3-eu-west-1.amazonaws.com/prod-ucs-content-store-eu-west/content/pii:S0306261920308369/STRIPIN/image/svg+xml/a1c1cef99d0d47b9515d8b87602dfa5a/si64.svg si64 si64.svg svg 2188 ALTIMG 1-s2.0-S0306261920308369-si65.svg https://s3-eu-west-1.amazonaws.com/prod-ucs-content-store-eu-west/content/pii:S0306261920308369/STRIPIN/image/svg+xml/4797169b1a28143706a196607bb3c4db/si65.svg si65 si65.svg svg 5496 ALTIMG 1-s2.0-S0306261920308369-si66.svg https://s3-eu-west-1.amazonaws.com/prod-ucs-content-store-eu-west/content/pii:S0306261920308369/STRIPIN/image/svg+xml/7cd4f46a4ebeb7e220d821bd4761376f/si66.svg si66 si66.svg svg 2551 ALTIMG 1-s2.0-S0306261920308369-si67.svg https://s3-eu-west-1.amazonaws.com/prod-ucs-content-store-eu-west/content/pii:S0306261920308369/STRIPIN/image/svg+xml/e7a3d04c45a473b0a054b44fd92d725f/si67.svg si67 si67.svg svg 4559 ALTIMG 1-s2.0-S0306261920308369-si68.svg https://s3-eu-west-1.amazonaws.com/prod-ucs-content-store-eu-west/content/pii:S0306261920308369/STRIPIN/image/svg+xml/d2b157d87be82e92cc6f00724c4ea50d/si68.svg si68 si68.svg svg 5496 ALTIMG 1-s2.0-S0306261920308369-si69.svg https://s3-eu-west-1.amazonaws.com/prod-ucs-content-store-eu-west/content/pii:S0306261920308369/STRIPIN/image/svg+xml/a1542a2e8fc225ba9dc2e47f8f476dc3/si69.svg si69 si69.svg svg 2173 ALTIMG 1-s2.0-S0306261920308369-si7.svg https://s3-eu-west-1.amazonaws.com/prod-ucs-content-store-eu-west/content/pii:S0306261920308369/STRIPIN/image/svg+xml/1ec891fe8424bbf1ad75cbabcb4057f6/si7.svg si7 si7.svg svg 2330 ALTIMG 1-s2.0-S0306261920308369-si70.svg https://s3-eu-west-1.amazonaws.com/prod-ucs-content-store-eu-west/content/pii:S0306261920308369/STRIPIN/image/svg+xml/14a3da66d432f5121069f23fded7609a/si70.svg si70 si70.svg svg 3288 ALTIMG 1-s2.0-S0306261920308369-si71.svg https://s3-eu-west-1.amazonaws.com/prod-ucs-content-store-eu-west/content/pii:S0306261920308369/STRIPIN/image/svg+xml/c3f6d2f813017a79181db1643dc0633a/si71.svg si71 si71.svg svg 3039 ALTIMG 1-s2.0-S0306261920308369-si72.svg https://s3-eu-west-1.amazonaws.com/prod-ucs-content-store-eu-west/content/pii:S0306261920308369/STRIPIN/image/svg+xml/f8a4c5934c3a13394baef9732418d9c3/si72.svg si72 si72.svg svg 3132 ALTIMG 1-s2.0-S0306261920308369-si73.svg https://s3-eu-west-1.amazonaws.com/prod-ucs-content-store-eu-west/content/pii:S0306261920308369/STRIPIN/image/svg+xml/81d590abcfb12f5a9b9348e84c9255a0/si73.svg si73 si73.svg svg 3459 ALTIMG 1-s2.0-S0306261920308369-si74.svg https://s3-eu-west-1.amazonaws.com/prod-ucs-content-store-eu-west/content/pii:S0306261920308369/STRIPIN/image/svg+xml/ec5d3c3a34ef13c65b20b1be060fda29/si74.svg si74 si74.svg svg 2975 ALTIMG 1-s2.0-S0306261920308369-si75.svg https://s3-eu-west-1.amazonaws.com/prod-ucs-content-store-eu-west/content/pii:S0306261920308369/STRIPIN/image/svg+xml/741a3e791ba7fa5017b914694376c593/si75.svg si75 si75.svg svg 1923 ALTIMG 1-s2.0-S0306261920308369-si76.svg https://s3-eu-west-1.amazonaws.com/prod-ucs-content-store-eu-west/content/pii:S0306261920308369/STRIPIN/image/svg+xml/e6437fe0fa484132dbc8b1af6f96427c/si76.svg si76 si76.svg svg 2975 ALTIMG 1-s2.0-S0306261920308369-si77.svg https://s3-eu-west-1.amazonaws.com/prod-ucs-content-store-eu-west/content/pii:S0306261920308369/STRIPIN/image/svg+xml/3894eb663f74306f8530c6e453dc6a8b/si77.svg si77 si77.svg svg 3074 ALTIMG 1-s2.0-S0306261920308369-si78.svg https://s3-eu-west-1.amazonaws.com/prod-ucs-content-store-eu-west/content/pii:S0306261920308369/STRIPIN/image/svg+xml/46191dd2163093b81cefb44ddf440448/si78.svg si78 si78.svg svg 8113 ALTIMG 1-s2.0-S0306261920308369-si79.svg https://s3-eu-west-1.amazonaws.com/prod-ucs-content-store-eu-west/content/pii:S0306261920308369/STRIPIN/image/svg+xml/257e3db804ae1ed3d1bed15776b360c2/si79.svg si79 si79.svg svg 1823 ALTIMG 1-s2.0-S0306261920308369-si8.svg https://s3-eu-west-1.amazonaws.com/prod-ucs-content-store-eu-west/content/pii:S0306261920308369/STRIPIN/image/svg+xml/1ee9814d84e540714d8177d1b564bc2d/si8.svg si8 si8.svg svg 2187 ALTIMG 1-s2.0-S0306261920308369-si80.svg https://s3-eu-west-1.amazonaws.com/prod-ucs-content-store-eu-west/content/pii:S0306261920308369/STRIPIN/image/svg+xml/5746011823e50955f01ea9aba136d887/si80.svg si80 si80.svg svg 4289 ALTIMG 1-s2.0-S0306261920308369-si81.svg https://s3-eu-west-1.amazonaws.com/prod-ucs-content-store-eu-west/content/pii:S0306261920308369/STRIPIN/image/svg+xml/4e3678dcd7ac89753da5ec581fc149bd/si81.svg si81 si81.svg svg 4180 ALTIMG 1-s2.0-S0306261920308369-si82.svg https://s3-eu-west-1.amazonaws.com/prod-ucs-content-store-eu-west/content/pii:S0306261920308369/STRIPIN/image/svg+xml/23474780be2fa2287582c9ee452dd33a/si82.svg si82 si82.svg svg 3694 ALTIMG 1-s2.0-S0306261920308369-si83.svg https://s3-eu-west-1.amazonaws.com/prod-ucs-content-store-eu-west/content/pii:S0306261920308369/STRIPIN/image/svg+xml/0d28fc52605aa7b77d15690b68083566/si83.svg si83 si83.svg svg 5548 ALTIMG 1-s2.0-S0306261920308369-si84.svg https://s3-eu-west-1.amazonaws.com/prod-ucs-content-store-eu-west/content/pii:S0306261920308369/STRIPIN/image/svg+xml/5e7787c727b842800093f6ae7eaec74d/si84.svg si84 si84.svg svg 4752 ALTIMG 1-s2.0-S0306261920308369-si85.svg https://s3-eu-west-1.amazonaws.com/prod-ucs-content-store-eu-west/content/pii:S0306261920308369/STRIPIN/image/svg+xml/9607a1b3476a28d091a03c7ec9f8f98c/si85.svg si85 si85.svg svg 4115 ALTIMG 1-s2.0-S0306261920308369-si86.svg https://s3-eu-west-1.amazonaws.com/prod-ucs-content-store-eu-west/content/pii:S0306261920308369/STRIPIN/image/svg+xml/e2961159df82ef6ffd9cd5fb81dc0034/si86.svg si86 si86.svg svg 3694 ALTIMG 1-s2.0-S0306261920308369-si87.svg https://s3-eu-west-1.amazonaws.com/prod-ucs-content-store-eu-west/content/pii:S0306261920308369/STRIPIN/image/svg+xml/ac2d115acb39cb5328d9a8aa19142b8b/si87.svg si87 si87.svg svg 8600 ALTIMG 1-s2.0-S0306261920308369-si88.svg https://s3-eu-west-1.amazonaws.com/prod-ucs-content-store-eu-west/content/pii:S0306261920308369/STRIPIN/image/svg+xml/8b289e8f82cb802bc1c31f8ec270a0e9/si88.svg si88 si88.svg svg 7090 ALTIMG 1-s2.0-S0306261920308369-si89.svg https://s3-eu-west-1.amazonaws.com/prod-ucs-content-store-eu-west/content/pii:S0306261920308369/STRIPIN/image/svg+xml/ff074232ef70fda861ad07ada2c35d88/si89.svg si89 si89.svg svg 12981 ALTIMG 1-s2.0-S0306261920308369-si9.svg https://s3-eu-west-1.amazonaws.com/prod-ucs-content-store-eu-west/content/pii:S0306261920308369/STRIPIN/image/svg+xml/0fc74312296dc9cbff3d804ca3f9f3b9/si9.svg si9 si9.svg svg 2330 ALTIMG 1-s2.0-S0306261920308369-si90.svg https://s3-eu-west-1.amazonaws.com/prod-ucs-content-store-eu-west/content/pii:S0306261920308369/STRIPIN/image/svg+xml/603362058ff4501863a949d8f5b7662b/si90.svg si90 si90.svg svg 4286 ALTIMG 1-s2.0-S0306261920308369-si91.svg https://s3-eu-west-1.amazonaws.com/prod-ucs-content-store-eu-west/content/pii:S0306261920308369/STRIPIN/image/svg+xml/4f16f64b5aee64103ce8194260de4b42/si91.svg si91 si91.svg svg 2921 ALTIMG 1-s2.0-S0306261920308369-si92.svg https://s3-eu-west-1.amazonaws.com/prod-ucs-content-store-eu-west/content/pii:S0306261920308369/STRIPIN/image/svg+xml/3a0b944899540a027ab2e44dbe164610/si92.svg si92 si92.svg svg 3074 ALTIMG 1-s2.0-S0306261920308369-si93.svg https://s3-eu-west-1.amazonaws.com/prod-ucs-content-store-eu-west/content/pii:S0306261920308369/STRIPIN/image/svg+xml/62d279020994c7ce12449193166af46f/si93.svg si93 si93.svg svg 4492 ALTIMG 1-s2.0-S0306261920308369-si94.svg https://s3-eu-west-1.amazonaws.com/prod-ucs-content-store-eu-west/content/pii:S0306261920308369/STRIPIN/image/svg+xml/f91b5ee977b76ffbcad7e1cbcf06c2e4/si94.svg si94 si94.svg svg 3479 ALTIMG 1-s2.0-S0306261920308369-si95.svg https://s3-eu-west-1.amazonaws.com/prod-ucs-content-store-eu-west/content/pii:S0306261920308369/STRIPIN/image/svg+xml/62e20655f4066018efc8d43732ecc18d/si95.svg si95 si95.svg svg 3074 ALTIMG 1-s2.0-S0306261920308369-si96.svg https://s3-eu-west-1.amazonaws.com/prod-ucs-content-store-eu-west/content/pii:S0306261920308369/STRIPIN/image/svg+xml/6306e6797b1f9dacf1cfed8f41ff18e5/si96.svg si96 si96.svg svg 7036 ALTIMG 1-s2.0-S0306261920308369-si97.svg https://s3-eu-west-1.amazonaws.com/prod-ucs-content-store-eu-west/content/pii:S0306261920308369/STRIPIN/image/svg+xml/ebe6ad43e13c2844051e895bb4083a9a/si97.svg si97 si97.svg svg 4230 ALTIMG 1-s2.0-S0306261920308369-si98.svg https://s3-eu-west-1.amazonaws.com/prod-ucs-content-store-eu-west/content/pii:S0306261920308369/STRIPIN/image/svg+xml/104198c99a390f13f6e3a8abec028aa0/si98.svg si98 si98.svg svg 4085 ALTIMG 1-s2.0-S0306261920308369-si99.svg https://s3-eu-west-1.amazonaws.com/prod-ucs-content-store-eu-west/content/pii:S0306261920308369/STRIPIN/image/svg+xml/128a21685008670d15d3c3e2bbeebb0e/si99.svg si99 si99.svg svg 6843 ALTIMG 1-s2.0-S0306261920308369-am.pdf am am.pdf pdf 2769743 AAM-PDF https://s3-eu-west-1.amazonaws.com/prod-ucs-content-store-eu-west/content/egi:10BPSRX7GT9/MAIN/application/pdf/07d33a68d188fc47b5476177ff752d7e/am.pdf APEN 115324 115324 S0306-2619(20)30836-9 10.1016/j.apenergy.2020.115324 Fig. 1 RC network structure for a two-zone building [21]. Fig. 2 RTUs and sample supply diffusers at a gymnasium: (a) external view; (b) internal view. Fig. 3 Input data for the validation of a reduced-order CFD coupled model for gymnasium in TN, USA (case 1). Fig. 4 Output comparisons for a reduced-order CFD coupled for gymnasium in TN, USA (case 1). Fig. 5 Input data for the validation of a reduced-order CFD coupled model for gymnasium in TN, USA (case 2). Fig. 6 Output comparisons for a reduced-order CFD coupled for gymnasium in TN, USA (case 2). Fig. 7 Outdoor air temperature profile for initial simulation stud (July, LA). Fig. 8 Profiles of thermostat temperatures, RTU cycling and total HVAC power for the conventional control applied to gymnasium with all units having economizers (x-axis: hour of a day). Fig. 9 Profiles of thermostat temperatures, RTU cycling and total HVAC power for the MPC applied to gymnasium with all units having economizers. Fig. 10 Sample responses of the conventional thermostat controller for two different days (experiments). Fig. 11 Profiles of thermostat temperatures, RTU cycling and total HVAC power for the conventional control applied to gymnasium with two units having economizers. Fig. 12 Profiles of thermostat temperatures, RTU cycling and total HVAC power for the MPC applied to gymnasium with two units having economizers. Fig. 13 Locations simulated. Fig. 14 MPC energy savings for different scenarios (a) Case 1: all 4 units with economizers (b) Case 2: 2 out for 4 units with economizers. Table 1 Threshold dry-bulb temperatures. 1A 2A 2B 3A 3B 3C 4A 4C 5A 5B 6A City Miami Houston Phoenix Atlanta LA San Francisco Baltimore Seattle Chicago Denver Minneapolis T thr 65 ° F 18.3 ° C 65 ° F 18.3 ° C 75 ° F 23.8 ° C 65 ° F 18.3 ° C 75 ° F 23.8 ° C 75 ° F 23.8 ° C 65 ° F 18.3 ° C 75 ° F 23.8 ° C 70 ° F 21.1 ° C 75 ° F 23.8 ° C 70 ° F 21.1 ° C Model predictive control for supervising multiple rooftop unit economizers to fully leverage free cooling energy resource Donghun Kim Conceptualization Methodology Writing - original draft Validation Visualization Investigation Funding acquisition Project administration a b \u204e James E. Braun Supervision Writing - review & editing a a School of Mechanical Engineering, Purdue University, West Lafayette, IN, USA School of Mechanical Engineering Purdue University West Lafayette IN USA School of Mechanical Engineering, Purdue University, West Lafayette, IN, USA b Energy Technologies Area, Building Technology & Urban Systems Division, Lawrence Berkeley National Laboratory, CA, USA Energy Technologies Area, Building Technology & Urban Systems Division Lawrence National Berkeley Laboratory CA USA Building Technology and Urban Systems Division, Lawrence National Berkeley Laboratory CA, USA \u204e Corresponding author at: Energy Technologies Area, Building Technology & Urban Systems Division, Lawrence Berkeley National Laboratory, CA, USA Energy Technologies Area, Building Technology & Urban Systems Division Lawrence National Berkeley Laboratory CA USA \u201cFree cooling\u201d with cool outside air can meet or reduce a building\u2019s cooling loads in an energy efficient manner when conditions are favorable. For rooftop air conditioning units (RTUs), this is achieved with air-side economizers that are integrated with the packaged RTU. However, current RTU economizers are independently controlled at the unit level and may not fully leverage the free resource for economic benefit especially when multiple units serve a common zone of a building, such as in retail stores. That is, the independent control of multiple RTUs could lead to some units operating with mechanical cooling even when the outdoor air temperature or enthalpy is low enough to meet the load with economizer cooling. This paper presents a model-predictive control (MPC) approach to optimally supervise multiple RTUs in order to fully utilize the free cooling resource. The algorithm is applied to the evaluation of the energy savings potential for a case study building served by four identical RTUs under various climate zones over a cooling season. Keywords Model predictive control MPC Economizer Rooftop unit Nomenclature ( Γ l , Γ u ) temperature violations from lower and upper temperature bounds I err integrated setpoint tracking errors I err \u2032 integrated tracking error before an integral reset K p , K i proportional and integral gains M e economizer mode (0:OFF, 1:ON) N u a number of packaged units N p prediction horizon N s ( i ) the total number of stages for the i th unit P i , s the rated power for the s th stage of the i th unit ( T l , T u ) lower and upper temperature bounds T OA outdoor air temperature T SA supply air temperature T SA , SP supply air temperature setpoint T thr temperature threshold (high limit shut off) Y 1 thermostat signal, first call for cooling Y 2 thermostat signal, second call for cooling δ an upper bound of instantaneous power ω d , ω l , ω u weights on peak power and comfort violations err setpoint tracking error i a unit number j prediction time step k current time step u i , s ( j ) on/off status for the s th stage of the i th unit at the j th time step v outdoor air damper position v \u2032 anticipated control action for outdoor air damper position before an integral reset v ̲ minimum outdoor air damper position y i ( j ) thermostat temperature for the i th unit at the j th time step 1 Introduction Buildings account for the majority of total electricity use in most countries, e.g. over 70% in the U.S., and a significant portion of building energy consumption is associated with heating, ventilating and air conditioning (HVAC) systems. Because economizers are able to reduce the usage of vapor-compression mechanical cooling by utilizing the \u201cfree\u201d cooling resource of the outdoor air when outdoor air conditions permit, a considerable amount of HVAC energy consumption can be saved through economizers. Therefore, many studies can be found in the literature (1) to assess energy savings potential of economizers for various climate zones for many countries, (2) to establish appropriate high limit economizer shut off criteria, and (3) to develop advanced economizer control algorithms for fully exploiting the free cooling resource. Zmeureanu [1] evaluated energy savings of an economizer for a cooling system operating in a Canadian climate (Montréal) using hourly weather data over ten years. The estimated reduction of the cooling-coil load and energy savings were about 50%. Olsen et al. [2] investigated several different HVAC systems under UK climate conditions including chilled ceilings, displacement ventilation, natural ventilation, night cooling, and a traditional VAV system, and concluded the systems that maximize free cooling from outside air have the best energy performance. Budaiwi [3] studied the potential for energy savings when the economizer cycle is employed under three climatic conditions in Saudi Arabia: hot-humid summer and mild winter; moderate summer and winter; and hot-dry summer and cold winter. Buluta and Aktacira [4] evaluated free cooling potential in Turkey. Wacker [5] studied energy savings potential and indoor comfort implications of economizer controls for packaged rooftop HVAC equipment under weather conditions in Asheville, North Carolina, U.S. Tayler and Cheng [6] performed comprehensive studies to establish appropriate economizer mode switch controls and the corresponding setpoints for various U.S. climate zones. Seem and House [7] developed model-based and optimization-based economizer control strategies and compared them with traditional economizer controls, i.e. differential dry-bulb temperature and differential enthalpy controls, for multiple climates. Wang et al. [8] developed an advanced rooftop unit control (ARC) that integrates an enhanced economizer control and provided site evaluation results. For rooftop air conditioning units (RTUs), air-side economizers are (optionally) integrated with the packaged RTU. Despite a long history of economizers, current equipment-level RTU economizer controls may not fully leverage the free resource especially when multiple units serve a common open space of a building, e.g. retail stores. In other words, the controls may turn on compressors although the outdoor air temperature or enthalpy is low enough to meet building\u2019s cooling loads. The goal of this paper is to demonstrate such cases, to develop a model predictive control (MPC) for those open space buildings to overcome this issue, and to evaluate the energy savings potential of the MPC using simulations. For several decades, vast research activities of applying MPC to buildings have been carried out. In [9], authors discussed opportunities of implementing MPC for commercial buildings. Reviews [10,11] addressed challenges, aspects and future trends of MPC for commercial buildings. The need for future research on the automated creation and model updates for MPC was emphasized. Similarly, authors in [12] raised ten questions of applying MPC to buildings and provide challenges, future trends, and potential of MPC for the general building market. The identified challenges include high modeling effort, shortage of modeling and optimal control experts active in the building automation domain, and lack of commercial tools for expert-free building modeling. Technical aspects of MPC for building applications, from selecting a building response model, simulation timestep, prediction horizon, forecast resolution, to optimization algorithm, can be found in for example [10]. We refer to [13] for a more recent and comprehensive review on MPC for buildings. Despite the large number of studies, the vast majority of MPCs have been focused on large sized commercial buildings (which are served by individual air handling units), and therefore only a few studies can be found in the literature for open-space building applications (which are served by multiple RTUs). Nutaro et. al. [14] developed a MPC for a gymnasium having four identical units. This controller is to limit electric peak power demand and about 15% of demand reduction with respect to a conventional thermostat control was achieved. Kim et. al. [15] developed a MPC for minimizing energy consumption and peak demand for open space buildings. The control design was focused to minimize sensor and configuration requirements in order to enable a cost effective control implementation for small and medium sized commercial buildings. About 10% building HVAC energy savings and about 30% peak demand reduction were reported for a building. Biyik et. al. [16] developed a RTU coordinator aiming at minimizing peak power and reported that the peak power reduction with the MPC was about 20\u201340% for existing buildings. Putta et. al. [17] utilized dynamic programming to solve an optimization problem for minimizing energy consumption and penalizing compressor cycling. In a simulation study, about 10% energy savings were achived for a building served by 4 RTUs. Zhange et. al. [18] developed a MPC for RTUs for load shedding during demand response events while minimizing comfort impacts. Despite these MPC developments for coordinating multiple RTUs, none of them considered economizers in MPCs and therefore their performance is limited. Note that, in the U.S., RTUs are used in about 50% (2.1 million) of all commercial buildings, serving over 60% (3.6 billion m 2 ) of the commercial building floor space and consuming about 2.4 × 10 8 GJ annually [8]. Consequently, even a small improvement in economizer operation could lead to a significant reduction of national energy use. Section 2 provides a review of economizer logic for commercial RTUs to develop a realistic economizer control sequence that will be used in the simulation study. A MPC which aims at improving energy performance is introduced in Section 3. Section 4 describes a simulation testbed for a case study building where the MPC and a conventional economizer control are compared. With the simulation platform, cases where the conventional control lead to poor energy performance are shown in Section 5. Behaviors of the MPC under the same simulation conditions are also included. Finally, energy savings analysis for the case study building for U.S. climate zones are provided in Section 6. 2 Investigation of rooftop unit economizer logic This section provides a summary of the sequence of operations for economizers in commercial rooftop units. Seven different economizers were reviewed (Lennox LGH/LCH RTUs, TRANE ReliaTelTM, Carrier 48HJD/HJE/HJF RTUs, Johnson controls J**ZH/ZJ/ZR RTUs, Honeywell economizer, PREMIERLINKTM Retrofit Rooftop). This review was used to provide a realistic simulation testbed for evaluating the MPC. 2.1 Thermostat controls It is important to describe a typical thermostat control for the packaged units, since RTU economizer controls are associated with thermostat signals. In general, a thermostat is dedicated to an RTU and turns one or more compressor stages on and off to maintain a local zone air temperature near a setpoint. The first stage, or the first call for cooling (Y1), is typically energized when the thermostat temperature rises above the setpoint by a deadband, say 1 ° F (0.55 ° C ). The Y1 signal is maintained until the thermostat temperature goes below the setpoint. If the temperature continues to increase and rises above the setpoint by a 2nd stage deadband, then the 2nd stage, or the 2nd call for cooling (Y2), is energized. The Y2 signal is maintained until the temperature goes below the setpoint. Many thermostats have internal anti-cycling clocks to protect compressors from short cycling. That is, once the call for cooling switches to ON, the status is maintained for say 5 min regardless of the thermostat temperature. For some thermostat controls, the reverse action is true. That is, once the call for cooling switches to OFF, the status holds for a time period although the thermostat temperature could rise above the deadband during the period, again for the safety issue. The supply fan is typically on continuously during the occupied period and can cycle with the compressor during unoccupied times. Most RTUs in the field do not have variable-speed compressors or fans controlled by variable frequency drives. The economizer control sequence relies on the thermostat control with the interface variable of the call for cooling. 2.2 Review of rooftop unit economizer controls There are a number of ways of enabling and disabling the economizer mode, or the free cooling mode, depending on available sensors and economizer controllers. Typical types are fixed dry-bulb temperature, differential dry-bulb temperature, fixed enthalpy, differential enthalpy and combinations of those, e.g. fixed enthalpy with fixed dry-bulb temperature. Once an outdoor air sensor measurement, e.g. dry-bulb temperature, exceeds a pre-specified high-limit shutoff control setting, the economizer mode is disabled. The economizer shutoff control setting could be configured as a fixed value or with a curve (if an enthalpy sensor is available). For the former, ASHRAE standard 90.1 [19] provides guidelines for the settings depending on U.S. climate zones and sensor types. For the latter case, the economizer mode is enabled once the point of the outdoor air condition in the psychrometric chart is located on the left hand side of a predefined curve (denoted as A,B,C,D) in the chart. For some units, the control logic for the economizer mode has a dead-band, e.g. 5°C for the dry-bulb temperature case, such that the mode is maintained until the outdoor air condition changes sufficiently. Once the economizer mode is disabled, the signals of first call (Y1) and second call (Y2) for cooling bypass the economizer logic module such that the RTU operates based on thermostats as usual: Y1 and Y2 correspond to the 1st and 2nd compressor stage respectively. In this case, the outdoor air (OA) damper is at a minimum position which can be specified by users. Once the economizer mode is enabled and the first call for cooling is received from a thermostat, outside and return air dampers begin to modulate in order to maintain the supply air temperature at around 55 ° F while disabling mechanical cooling. The controlled variable could be the mixed air temperature upstream of the evaporator rather than the supply air temperature. Depending on the sensor position, unit performance would be different for the case when the mechanical cooling is integrated with the economizer damper control. However, most economizers regulate the supply air temperature. ON\u2013OFF control with a deadband or a PI controller are used for the supply air temperature regulation. An example of the on/off control algorithm is: When the supply air temperature goes below 50 ° F (10 ° C ), the OA damper is modulated to minimum position, and when it goes above 56 ° F (13 ° C ) the damper is modulated to fully open. When the supply air temperature is in the 50 ° F and 56 ° F range, the damper position is held constant. When the economizer mode is activated, the economizer action for the on\u2013off control approach can result in cycling behavior like for single-stage mechanical cooling. When free cooling cannot satisfy the first call for cooling, it leads to a 2nd call for cooling. When Y2 is energized, an economizer engages the first stage compressor, while the outside and return air dampers continue to modulate to maintain a suitable supply air temperature. More precisely, the economizer damper control loop is independent of the Y2-signal. Optionally, if the integrated economizer action is not enough to eliminate a 2nd call for a period of time, then economizers can turn on a 2nd stage compressor. The time delay is adjustable by users but a default setting is typically long, for example, a 2-h delay. 2.3 Development of economizer control logic for simulation tests To evaluate a model predictive control algorithm for economizer equipped RTUs within a simulation testbed, economizer control logic was implemented on the review of commercial RTU economizers. The logic is for a two-stage unit where (1) the economizer mode is triggered by a fixed OA dry bulb, (2) an analog economizer damper is controlled with a PI controller and (3) the 2nd stage mechanical cooling is not available during the economizer mode, e.g. due to a long delay setting. It is shown in the algorithm. Lines from 10 to 26 describe the following: \u201dOnce the economizer mode is enabled (see line 10) and the first call for cooling is received from a thermostat (see line 13), outside and return air dampers begin to modulate in order to maintain the supply air temperature (see lines from 14 to 25) while disabling mechanical cooling (see line 26)\u201d. Lines from 14 to 25 are the control action for a PI controller with an anti-windup (or integral reset) strategy which tends to modulate the OA damper position v to maintain the supply air temperature at a setpoint T SA , SP with proportional and integral gains as shown in lines from 14 to 16. When the calculated control decision v \u2032 is saturated, the integral error and damper position reset in order to avoid the integral windup. The aforementioned control sequence of \u201dWhen Y2 is energized, an economizer engages the first stage compressor\u201d is shown in lines from 28 and 30. Algorithm 1 A two-stage RTU economizer algorithm Parameters: T thr , T SA , SP , v ̲ , K p , K i ▷See Nomenclature Inputs: Y1, Y2, T OA , T SA ▷ Yi : signals from thermostat Outputs: Y1, Y2, v ▷ Yi : revised signals from economizer controller Dynamic state: I err ▷integral of the setpoint tracking error 1: if T oa ⩽ T thr ▷if outdoor air temp is sufficiently cool then 2: quad ← 1 ▷enable economizer mode 3: else 4: quad M e ← 0 ▷disable economizer mode 5: end if 6: if M e = = 0 ▷when economizer is disabled then 7: quad v ← v ̲ , 8: quad Y 1 ← Y 1 , Y 2 ← Y 2 , ▷bypass economizer controller (no action is made) 9: quad I err ← 0 ▷reset integrated errors 10: quadelse ▷when economizer is enabled 11: quadif Y 1 = = 0 ▷when there is no calls for cooling then 12: quad v ← v ̲ , ▷put damper position at minimum 13: quadelse ▷when there is the first call for cooling 14: err ← T SA - T SA , SP ▷implement a PI control with an integral reset strategy 15: quad I err \u2032 ← I err + err 16: v \u2032 ← K p × err + K i × I err \u2032 17: 18: quad%% integral reset 19: quadif v \u2032 ⩽ v ̲ then ▷when a calculated control decision is lower than the minimum damper position▷when saturated 20: v ← v ̲ % no updates on I err 21: else if v \u2032 ⩾ 1 then ▷when a calculated control decision is higher than 100% damper position 22: quad v ← 1 % no updates on I err 23: quadelse ▷when not saturated 24: quad v ← v \u2032 , I err ← I err \u2032 25: quadend if 26: quad Y 1 ← 0 ▷disable mechanical cooling 27: quad end if 28: quadif Y 2 = = 1 ▷when there is the second call for cooling then 29: Y 1 ← 1 , Y 2 ← 0 ▷enable the first stage mechanical cooling 30: end if 31: end if 3 Model predictive control design accounting for economizers This section describes a MPC that was developed for economizer control with multiple RTUs. It is an extension of a previously developed MPC, namely the Unit Coordinator [20]. For detailed descriptions and performance evaluations of the original unit coordinator for multiple field sites, refer to [15]. Some modifications of the MPC were made in this paper to consider economizers. 3.1 General formulation Remember that when an RTU is integrated with an economizer, the 1 st stage could mean either the economizer only mode or 1 st stage mechanical cooling depending on the status of economizer mode. Likewise, the 2nd stage means either the integrated mode between the economizer and 1 st stage mechanical cooling or the 2nd stage mechanical cooling (see the previous section). Consider a building equipped with N u number of packaged air conditioning units. Let N s ( i ) be the total number of stages for the i th unit. Let P i , s be the rated power for the s th stage of the i th unit. Note that P i , 1 could mean the fan power associated with the economizer only mode or the unit power (compressor and fan) associated with the 1 st stage mechanical cooling, depending on the activation status and availability of the economizer for the i th unit. That information can be found in manufacturer\u2019s data. The control problem at a current time step k is to find optimal stage trajectories to minimize energy consumption, demand upper bound and comfort violations. That is: (1) min ( ∑ j = 0 N p - 1 ( ∑ i = 1 N u ( ∑ s = 1 N s ( i ) P i , s u i , s ( k + j ) ) ) + ω d δ + ω l Γ l + ω u Γ u s . t . T l - Γ l ⩽ y i ( k + j + 1 ) ⩽ T u + Γ u ( ∀ i ∈ { 1 , ⋯ , N u } ) (2) ∑ i = 1 N u ( ∑ s = 1 N s ( i ) P i , s u i , s ( k + j ) ) ⩽ δ ( ∀ j ∈ { 0 , ⋯ , N p - 1 } ) (3) u i , N s ( i ) ⩽ ⋯ ⩽ u i , 2 ⩽ u i , 1 ( ∀ i ∈ { 1 , ⋯ , N u } ) (4) u i , s ( j ) ∈ { 0 , 1 } ( ∀ i ∈ { 1 , ⋯ , N u } , ∀ s ∈ { 1 , ⋯ , N s ( i ) } ) (5) δ ⩾ 0 , Γ l ⩾ 0 , Γ u ⩾ 0 where y i ( j ) is the thermostat temperature for the i th unit at the j th time step. u i , s ( j ) ∈ { 0 , 1 } represents on/off mode for the s th stage of the i th unit at the j th time step. u i , s are strictly binary (either 0 or 1) rather than integers and are variables to be decided. For example, consider two units where the first is a two-stage unit while the second is a single-stage unit. In this case, N s ( 1 ) = 2 and N s ( 2 ) = 1 and, at a given time j , u 1 , 1 ( j ) , u 1 , 2 ( j ) and u 2 , 1 ( j ) are the decision variables. The optimization problem is to minimize a weighted sum of the multiple objectives of energy consumption, peak power and comfort violations with some weights 1 1 In this paper, values of 10, 100 and 100 were used for ω d , ω l and ω u . The first term in the objective function indicates the sum of powers for all stages for all units over the prediction horizon of N p . δ in the second term indicates an upper bound of the sequence of the instantaneous HVAC powers over N p , as shown in the second constraint. Γ l , Γ u in the last two terms represent comfort (temperature) violations from user-specified upper and lower bounds for thermostat temperatures as shown in the first constraint. The third inequality constraint is to ensure that the 2nd stage should be activated after the 1 st stage is on, for example. The optimization variables are u i , s ( j ) ∀ i , s , j and δ , Γ l , Γ u . The optimization problem is mixed integer linear programming (MILP) and hence can be solved numerically efficiently and reliably. It should be noted that the MPC is designed to coordinate units for a relatively short prediction horizon, e.g. 30 min. 3.2 Further description Because of the aforementioned anti-cycling clocks (typically a 5-min interval) to protect compressors from a very short cycling, the proposed MPC has been implemented for every 5 min in this study. At each sampling time, it is assumed that the information of the status of the economizer mode for each unit is available, e.g. through BACNET. Then, the powers of P i , s are adjusted accordingly. Once they are specified, the MILP problem is solved. For example, consider two two-stage units where only one unit has an economizer. When the outdoor air temperature is cold enough such that the economizer mode for the first unit is enabled, the MILP with ( P 1 , 1 , P 1 , 2 ) = ( 0.2 , 1.2 ) (kW) and ( P 2 , 1 , P 2 , 2 ) = ( 1.2 , 2.2 ) (kW) is solved where 0.2, 1.2 and 2.2 represent the (rated) fan power for the economizer only mode, the unit power for the 1st stage mechanical cooling, and that for the 2nd stage mechanical cooling, respectively. On the other hand, when the outdoor air temperature is warm enough, the optimization problem with ( P 1 , 1 , P 1 , 2 ) = ( 1.2 , 2.2 ) (kW) and ( P 2 , 1 , P 2 , 2 ) = ( 1.2 , 2.2 ) is solved. First, note that the MPC considers the overall building\u2019s behaviors, i.e. energy consumption, electric peak demand and temperature violations. Therefore, it is a centralized control. Second, when the outside temperature is cold enough, stage powers for the economizer-equipped unit are lowered so that the optimal point could move towards the utilization of that unit. This means the optimization tends to distribute overall building load towards the energy efficient units. Last, note that the MPC only adjusts the thermostat signals of the call for cooling and therefore no modification or interruption for internal economizer controllers is required. This feature is practically important for deploying the MPC in real applications. For implementing the control in practice, methodologies to reject unmeasured disturbances during both modeling and control phases should be addressed. Our proposed approaches for the disturbance rejection are explained in the following two sections. 3.3 Control oriented modeling The MPC requires a model that maps a sequence of unit stages into that of thermostat temperatures. In this paper, we adopted the approach introduced in [21] which was developed for modeling open space areas served by multiple RTUs for small and medium sized commercial buildings. It assumes a simple model structure in an attempt to capture major dynamics of the complex system. An example RC network for a two-zone (i.e., two thermostat) system is depicted in Fig. 1 . Each zone is composed of two thermal capacitances and two thermal resistances, and is served by its own unit having capacity of Q ̇ i . Zone air nodes are connected by a resistance denoted as R zz in the figure. Corresponding differential equations for the i th zone are; (6) C z , i T ̇ z , i = 1 R zw , i ( T w , i - T z , i ) + ∑ k = 1 , k ≠ i n 1 R zz , ki ( T z , k - T z , i ) + 1 R zo , i ( T o - T z , i ) + Q ̇ g , i + Q ̇ i u i C w , i T ̇ w , i = 1 R zw , i ( T z , i - T w , i ) . T z , i is the local zone air (thermostat) temperature and T w , i is a local wall temperature representing averaged behaviors of the building enclosure. T o , Q ̇ i are the outdoor air temperature, and mechanical heat rate for the i th zone. u i ∈ Z represents a RTU stage and is expressed as u i = ∑ s = 1 N s ( i ) u i , s 2 2 For example, for a two-stage unit, when the first and second stages are both ON (that is, u i , 1 = 1 , u i , 2 = 1 ), u 1 = 2 . On the other hand, when only the first stage is ON (that is, u i , 1 = 1 , u i , 2 = 0 ), u 1 = 1 . . C z , i and C w , i represent thermal capacitances of the zone and wall. R zw , i and R za , i are thermal resistances between the zone air and wall, and between the zone air and ambient air, respectively. R zz , ki = R zz , ik is the effective thermal resistances between the k th and i th zone. The total number of interzonal resistances is the number of 2-combinations from the total number of units N u , and hence is N u ! / ( ( N u - 2 ) ! 2 ! ). Q ̇ g , i represents unmeasured input disturbances, e.g. occupancy gains, lighting loads and transmitted solar radiation. The parameters to be estimated are denoted as θ which consists of C w , i , C z , i , R zw , i , R zo , i , Q ̇ i and R zz , ki , ∀ i , k ∈ { 1 , ⋯ , N u } . The dimension of θ is 5 N u + N u ! / ( ( N u - 2 ) ! 2 ! ) . After a matrix manipulation of (6), a linear time invariant (LTI) state space model structure was derived, θ was identified with an input and output dataset, and the estimated LTI model was used for the MPC to predict y i in response to a control action of u i , s . The lumped output disturbance modeling approach introduced in [21,22] that was developed to alleviate impacts of unknown disturbances, i.e. Q ̇ g , i , on the estimated dynamic model has been applied for the identification process. It should be mentioned that 1) the modeling approach (from a design of experiments to an identification algorithm) was fully automated for a large scale MPC deployment in the past, and 2) what we are interested in this paper is performance of the integrated control approach, i.e. the modeling + MPC, rather than that of an individual model. Therefore the performance assessment of the integrated control approach was focused in this paper. However, we refer to [21] for comprehensive theoretical and experimental analysis of the modeling approach itself, and [15] for its practical MPC application for multiple sites. 3.4 Dealing with uncertainties during control phase The practical implementation of a MPC suffers from uncertainties of a model mismatch and inaccurate or corrupted measurements. The issue is important for the proposed small and medium sized commercial building applications, because they do not have a sufficient number of sensors for various heat gain sources, such as occupancy gains, lighting loads and transmitted solar radiation. To mitigate this concern, a strategy, namely the offset-free MPC, was utilized in this paper and is described as follows. The dynamic model (6) can be expressed as (7) x k + 1 = Ax k + Bu k y k = Cx k where x represents the local zone air and wall temperatures, u is the RTU stage and y is the local zone air temperatures. In the offset-free MPC strategy, the model (7) is augmented with a disturbance model. In this work, the so-called output disturbance model was utilized which leads to the following Kalman filter form. (8) x k + 1 p k + 1 ︸ x k + 1 = A 0 0 I ︸ A x k p k ︸ x k + B 0 ︸ B u k + K e k , y k = C I ︸ C x k p k , where e is the innovation term that is the difference between the measurement and model prediction, p is an internal dynamic state to model unmeasured disturbances, and K indicates the Kalman gain. By comparing (8) with (7), it can be seen that the model prediction y of the augmented model is corrected with p that is the integration of the prediction errors (see the first equation of (8)): this allows compensating the model mismatch and unmeasured disturbances with the real time feedback. K was obtained by solving the Discrete-time Algebraic Riccati Equation, and the augmented model described by ( A , B , C , K ) in (8) was utilized to estimate dynamic states of x and p and predict y i in the MPC problem (1). The overall procedure is standard for the off-set free MPC strategy which can be found, for example, in a graduate textbook [23]. Although the method is not yet popular in the field of building controls, it has been well developed and widely used in other control fields, the chemical process engineering in particular. We refer to [24,25] for other industrial applications and theoretical investigations, and [26] for a building MPC application. 4 Description of simulation platform Recall that we are interested in buildings that utilize multiple RTUs serving open spaces, which are very common in the U.S. Unfortunately, popular building energy simulation tools, e.g., EnergyPlus [27] and TRNSYS [28], that are based on the fully-mixed indoor air assumption are not appropriate for our purposes in these open-space buildings. In the absence of considering spatial temperature variations: (1) all RTUs would be simultaneously activated or be deactivated since their thermostats would always see the same temperatures for a fully-mixed model; (2) simultaneous on/off actuation of all RTUs would lead to very unrealistic responses of thermostat temperatures to feedback control signals compared to reality; (3) the assumption that all RTUs operate with the same on/off cycling would lead to significant errors in prediction of part-load performance and peak electrical demand. These issues are less important for estimation of monthly or annual energy consumption assuming that time-average zone air temperatures track set-points, but are critical for testing the proposed MPC [29]. Therefore, we utilized an advanced building model that is able to capture spatial temperature and humidity variations. The model couples a reduced-order computational fluid dynamics (CFD) model for the interior air with a reduced-order building envelope model and HVAC models in order to provide realistic dynamic response to feedback control by the thermostats. Since describing the advanced modeling approach is not the purpose of this paper, we refer to [29] for detailed descriptions of the modeling approach. However, in this paper, we present a summary of the methodology and model validation results against field measurements. It starts with developing two linear time invariant (LTI) models for indoor air and building envelope systems. Computational fluid dynamic (CFD) simulations were performed using a commercial CFD software, and simulation results were used to tune parameters for a state space description for the indoor air system to obtain a reduced-order CFD model. For the building envelope system, based on building geometry information and wall/window properties, a LTI envelope model was developed using the formula described in [30] which has been validated through comparisons with existing Building Energy Simulation tools such as TRNSYS [28]) for several buildings. The two LTI models for building envelope and indoor air were integrated to eliminate the coupling variables of (1) inner wall temperatures and (2) convective heat fluxes between the inner wall and zone air (the Dirichlet-to-Neumann map). Then, the aggregated model is integrated with detailed HVAC equipment models to complete the reduced-order CFD-coupled building model. For a thorough description including mathematical details, we refer to [20,29]. The case study building is a gymnasium ( 100 ft × 100 ft , 30.5 m × 30.5 ) served by four identical single-speed fan, two-stage RTUs. Fig. 2 shows the RTU layout and interior of the case study building. The four RTUs serve different quadrants of this rectangular open space. Four thermostats are located on wall surfaces in quadrants. Based on geometrical and physical information of the building, e.g. types of wall/window and shapes and locations of supply diffusers/return vents, a reduced-order CFD coupled building model was developed. For experimental validation, measured input data was fed to the integrated reduced-order CFD model. Corresponding model outputs were recorded for comparison with measured outputs. As measured inputs, the supply air temperature ( T sup ) for each RTU and the outdoor air temperature were selected. Due to technical issues (e.g. low sampling rate and time delay of thermostats), the return air temperatures ( T r , i ) to the RTUs were selected as outputs instead of thermostat temperatures. The return air temperature sensors are located at the upstream inlets of the RTUs. Supply air temperature sensors were located downstream of the units. In order to eliminate uncertain disturbances due to occupants and solar loads, the experiments were performed during night time hours. A sample input data set for model validation is shown in Fig. 3 . Corresponding output comparisons associated with the input data are shown in Fig. 4 (See Fig. 2 for the RTU numbering associated with the different plots). For each plot (i.e., each RTU), the blue line represents the output response for return air temperature of the coupled model, whereas the red line is the measured output. The model properly captures the dynamics due to RTU cycling with the standard deviation of output errors with respect to measurements are less than 0.5 ° C , which is very satisfactory. Fig. 5 shows the input data for a different day and the output comparisons for the input data are shown in Fig. 6 . Again, the responses of the model match well with the measured outputs with less than 0.5 ° C standard deviations. Overall, the reduced-order CFD coupled building model captures the important dynamics of the indoor air. 5 Demonstration cases for energy savings The load distribution problem is to decide how to distribute loads over multiple units: It is the reverse of the resource allocation problem [31] which seeks to find a way of allocating a fixed amount of resources to different entities in an economic manner. Since a conventional thermostat control (Conv) is totally decentralized and does not consider overall building performance, it could distribute building loads poorly such that inefficient units or modes take a large portion of cooling loads. On the other hand, as mentioned, the MPC can be viewed as an algorithm to solve the optimal load distribution problem, since it tends to utilize economizer enabled units, which are the most efficient units or modes, as much as possible, when free cooling is available. Therefore, the energy savings potential of the MPC depends on how the Conv behaves. In this paper, we show two different cases where the Conv distributes building loads poorly to conversely demonstrate that there is significant energy savings potential of the MPC. For the simulations, it was assumed that a unit must stay ON for a 5-min interval(anti-cycling clock) once it turns on. In addition, we assumed that there is no anti-cycling clock for the thermostat to switch to the OFF mode. 5.1 Case 1: all units have economizers In this simulation study, we considered the case where all four units for the gymnasium are equipped with economizers. It is assumed that the gymnasium is located at Los Angeles, U.S. (3C climate zone). The economizer mode is determined by a dry-bulb outdoor air temperature and the economizer shut off temperature was set to 75 ° F ( 23.89 ° C ) based on ASHRAE 90.1. Fig. 7 shows the outdoor air temperature for a sample period. Note that it is below the high limit temperature setting, i.e. 75 ° F ( 23.89 ° C ) for all times, which means economizers were always enabled for the simulation period. Fig. 8 shows responses of thermostat temperatures, RTU staging and total HVAC power associated with the conventional control (Conv). In the first subfigure, the black solid line represents thermostat setpoint schedule and the others indicate profiles of the four thermostat temperatures. The blue solid and red dashed lines in the 2nd to 5th subfigures indicate the thermostat call for cooling and compressor stage, respectively. The first stage (Y1) and second stage (Y2) correspond to the economizer only mode and integrated mode (economizer and mechanical cooling), respectively, in the sample period. Note that mechanical cooling occurred for the RTU1 and RTU3, while the RTU2 and RTU4 were off for most of times. To explain why this happens, look at the temperature profiles for the RTU2 and RTU4 in the 1st subfigure. At the beginning of the simulation, say until 5:00 AM, the temperatures are lower than that of the RTU1 and RTU3. At 7:00 AM the RTU1 starts to cycle. Because it is an open-space building, the cooling influences all other thermostats which reduces the chances of distributing the building load evenly. As the building loads increase, say during afternoon, a majority of building loads went to the RTU1 and RTU3 causing unnecessary mechanical cooling for those units. Note that the mechanical cooling could be removed by utilizing free cooling resources for the RTU2 and RTU4. The simulation results demonstrate a poor load distribution performance for the Conv. Fig. 9 shows responses of the MPC. In the 2nd to 5th subfigures, it can be seen that mechanical cooling has not been used for all times of this simulation period and thermostat temperatures were maintained within a similar range. Note that free cooling resources of the RTU2 and RTU4 were utilized through the MPC, even though their temperatures were below the setpoint. This desired behavior is because the MPC solves an optimal building load distribution problem and thereby it allocates the building load heavily to the most efficient stage, i.e. the economizer only mode. The HVAC power in the last subfigure is only due to operation of the RTU fans for this simulation period. In comparison to Fig. 8, these results show substantial savings potential for both energy and electric peak demand costs associated with coordinating economizers. The simulation results demonstrated that the non-uniform spatial distribution of thermostat temperatures is one of the main reasons causing a poor load distribution for the conventional control. To demonstrate this can happen in practice, experimental test results for the same building are shown in Fig. 10 . The upper and lower figures show building behaviors for different days during mild weather of September in Tennessee (US). For the upper figure, it can be confirmed that the thermostat temperatures for the RTU2 and RTU3 were relatively lower (about 0.5 ° C ) than the others. Although this gap seems not very significant, it results in significantly biased unit operations: cooling for the RTU2 and RTU3 were not used for most of times while building loads were met by RTU3 and RTU4 with 2nd stage cooling. Similar behavior can be observed in the second subfigure. From available measurements for other sites that include retail stores and restraints, the same pattern has been confirmed. Since non-uniform thermostat temperature distributions are unavoidable in practice and it is not likely that the decentralized control evenly distributes building load, it is expected that the poor performance of distributing loads for conventional control is usual. 5.2 Case 2: half of units have economizers In this case, it is assumed that two units, the RTU1 and RTU2, are equipped with economizers. That is, only mechanical cooling modes are available for the other two units of the RTU3 and RTU4. All other simulation parameters were the same as those for Case 1. Figs. 11 and 12 show system responses under the Conv and MPC, respectively. Like Case 1, the Conv is not able to fully exploit free cooling resources: free cooling resources for the RTU2 were not used (see the 3rd subfigure of Fig. 11). This is simply because the Conv does not know which modes are efficient and leads to an operation of units in an inefficient way. On the other hand, from 2nd and 3rd subfigures of Fig. 12, the MPC has enabled the efficient economizer mode for the RTU2 for many times which shows that the MPC is able to leverage available free cooling resources. By comparing the last subfigures, around one third of the HVAC energy was saved through the MPC for this time period. 6 Assessment of model predictive control energy savings potential in multiple climate zones As discussed, the MPC optimally distributes building loads toward efficient economizer operations when free cooling is available. Therefore, the energy savings potential of the MPC significantly depends on the availability of free cooling resources. Simulation studies have been performed for multiple climate zones, indicated by circles in Fig. 13 , to investigate the variation of the savings potential. The shut-off limits for enabling and disabling economizers used in this simulation study are summarized in Table 1 , which are based on ASHRAE 90.1. Recall that a fixed-dry bulb economizer is used in this simulation study. Due to a high computation time, only 4-month simulations were performed from April to July using TMY3 data for the locations. Fig. 14 summarizes MPC energy savings for the different locations. The left and right figures correspond to Case 1 (four economizers) and Case 2 (two economizers), respectively. For climate zones 1A, 2A, 3A and 2B, energy savings are small at around 5%. This makes sense because free cooling resources are not available most of the time for these zones. On the other hand, substantial energy savings of up to 30% occur for climate zones 3B, 3C, 4C, 5B, 5C zones. Note that economizer installation is required for these climate zones by the ASHRAE Standard 90.1. The savings results for Case 1 show that the unnecessary energy use of the Conv due to its poor load distribution caused by a non-uniform spatial temperature distribution is substantial. Intuitively, the large energy savings of around 15\u201330% for climate zones where economizers are required make senses since (1) the conventional control does not consider which operational modes are efficient, (2) efficiencies for the economizer mode and mechanical cooling modes are substantially different, and (3) free cooling resources are largely available for these zones. 7 Conclusions This paper presented a MPC algorithm, which can be used for real applications, and evaluated energy savings potential of optimally supervising multiple RTU economizer operations. Comprehensive simulation studies for an open space served by four two-stage rooftop units were performed to evaluate energy savings potential for a model predictive control algorithm over a 4-month cooling season in different climate zones. Very significant energy savings of 15% to 30% were achieved through the controller for most of the climate zones where economizer installations are mandatory. It was found that conventional thermostat control poorly distributes building loads towards inefficient mechanical cooling modes even when all units have economizers. This is attributed to a nonuniform thermostat temperature distribution and a strong coupling between units. In contrast, the model predictive controller favors economizer operation when appropriate and generally operates the most efficient modes while maintaining local temperatures close to the setpoints. Declaration of Competing Interest None. Acknowledgments The work was supported by Center for High Performance Building (CHPB) at Purdue University (CHPB-2018\u201317). References [1] R. Zmeureanu A case study of energy savings due to the economizer system in montreal Energy 14 9 1989 537 544 R. Zmeureanu, A case study of energy savings due to the economizer system in montreal, Energy 14 (9) (1989) 537\u2013544. [2] E.L. Olsen Q.Y. Chen Energy consumption and comfort analysis for different low-energy cooling systems in a mild climate Energy Build 35 6 2003 560 571 E.L. Olsen, Q.Y. Chen, Energy consumption and comfort analysis for different low-energy cooling systems in a mild climate, Energy and Buildings 35 (6) (2003) 560\u2013571. [3] I. Budaiwi Energy performance of the economizer cycle under three climatic conditions in Saudi Arabia Int J Ambient Energy 22 2 2001 83 94 I. Budaiwi, Energy performance of the economizer cycle under three climatic conditions in saudi arabia, International journal of ambient energy 22 (2) (2001) 83\u201394. [4] H. Bulut M.A. Aktacir Determination of free cooling potential: a case study for Istanbul, Turkey Appl Energy 88 3 2011 680 689 H. Bulut, M.A. Aktacir, Determination of free cooling potential: A case study for istanbul, turkey, Applied Energy 88 (3) (2011) 680\u2013689. [5] P. Wacker Economizer savings study ASHRAE Trans 95 1989 47 51 P. Wacker, Economizer savings study, ASHRAE transactions 95 (1989) 47\u201351. [6] S.T. Taylor C.H. Cheng Economizer high limit controls and why enthalpy economizers don\u2019t work ASHRAE J 52 11 2010 12 23 S.T. Taylor, C.H. Cheng, Economizer high limit controls and why enthalpy economizers don\u2019t work, ASHRAE Journal 52 (11) (2010) 12\u201323. [7] J. Seem J. House Development and evaluation of optimization-based air economizer strategies Appl Energy 87 3 2010 910 924 J. Seem, J. House, Development and evaluation of optimization-based air economizer strategies, Applied Energy 87 (3) (2010) 910\u2013924. [8] W. Wang S. Katipamula H. Ngo R. Underhill D. Taasevigen R. Lutes Field evaluation of advanced controls for the retrofit of packaged air conditioners and heat pumps Appl Energy 154 2015 344 351 W. Wang, S. Katipamula, H. Ngo, R. Underhill, D. Taasevigen, R. Lutes, Field evaluation of advanced controls for the retrofit of packaged air conditioners and heat pumps, Applied energy 154 (2015) 344\u2013351. [9] Kavgic M, Hilliard T, Swan L. Opportunities for Implementation of MPC in Commercial Buildings. Energy Proc 2015;78: 2148\u201353, 6th International Building Physics Conference, IBPC 2015, Torino, Italy. doi:https://doi.org/10.1016/j.egypro.2015.11.300. URL <http://www.sciencedirect.com/science/article/pii/S1876610215020329>. [10] T. Hilliard M. Kavgic L. Swan Model predictive control for commercial buildings: trends and opportunities Adv Build Energy Res 2 2015 172 190 T. Hilliard, M. Kavgic, L. Swan, Model predictive control for commercial buildings: trends and opportunities, Advances in Building Energy Research 2 (2015) 172\u2013190. [11] Rockett P, Hathway EA. Model-predictive control for non-domestic buildings: a critical review and prospects. Build Res Inform 2017;45: 556\u201371. arXiv:https://doi.org/10.1080/09613218.2016.1139885, doi:10.1080/09613218.2016.1139885. URL <https://doi.org/10.1080/09613218.2016.1139885>. [12] M. Killian M. Kozek Ten questions concerning model predictive control for energy efficient buildings Build Environ 105 2016 403 412 10.1016/j.buildenv.2016.05.034 http://www.sciencedirect.com/science/article/pii/S0360132316301925 M. Killian, M. Kozek, Ten questions concerning model predictive control for energy efficient buildings, Building and Environment 105 (2016) 403 \u2013 412. doi:https://doi.org/10.1016/j.buildenv.2016.05.034. URL http://www.sciencedirect.com/science/article/pii/S0360132316301925 [13] Dragona J, Arroyo J, Figueroa IC, Blum D, Arendt K, Kim D, et al. All you need to know about model predictive control for buildings. Annu Rev Control (in preparation). [14] Nutaro J, Kuruganti T, Fugate D, Starke M. An inexpensive retrofit technology for reducing peak power demand in small and medium commercial buildings. [15] D. Kim J.E. Braun Development, implementation and performance of a model predictive controller for packaged air conditioners in small and medium-sized commercial building applications Energy Build 178 2018 49 60 D. Kim, J.E. Braun, Development, implementation and performance of a model predictive controller for packaged air conditioners in small and medium-sized commercial building applications, Energy and Buildings 178 (2018) 49\u201360. [16] E. Biyik J.D. Brooks H. Sehgal J. Shah S. Gency Cloud-based model predictive building thermostatic controls of commercial buildings: Algorithm and implementation American Control Conference (ACC), 2015 2015 IEEE 1683 1688 E. Biyik, J.D. Brooks, H. Sehgal, J. Shah, S. Gency, Cloud-based model predictive building thermostatic controls of commercial buildings: Algorithm and implementation, in: American Control Conference (ACC), 2015, IEEE, 2015, pp. 1683\u20131688. [17] Putta V, Kim D, Cai J, Hu J, Braun JE. A switched dynamic programming approach towards optimal control of multiple rooftop units. In: American Control Conference (ACC), 2015, IEEE; 2015. p. 281\u20137. [18] X. Zhang M. Pipattanasomporn S. Rahman A self-learning algorithm for coordinated control of rooftop units in small-and medium-sized commercial buildings Appl Energy 205 2017 1034 1049 X. Zhang, M. Pipattanasomporn, S. Rahman, A self-learning algorithm for coordinated control of rooftop units in small-and medium-sized commercial buildings, Applied Energy 205 (2017) 1034\u20131049. [19] A.S. ASHRAE, Standard 90.1-2013, energy standard for buildings except low rise residential buildings, American Society of Heating, Refrigerating and Air-Conditioning Engineers Inc. [20] D. Kim Development and applications of models and algorithms for model-predictive control in buildings Ph.D. thesis 2015 Purdue University D. Kim, Development and applications of models and algorithms for model-predictive control in buildings, Ph.D. thesis, Purdue University (2015). [21] D. Kim J. Cai J.E. Braun K.B. Ariyur System identification for building thermal systems under the presence of unmeasured disturbances in closed loop operation: Theoretical analysis and application Energy Build 167 2018 359 369 D. Kim, J. Cai, J.E. Braun, K.B. Ariyur, System identification for building thermal systems under the presence of unmeasured disturbances in closed loop operation: Theoretical analysis and application, Energy and Buildings 167 (2018) 359 \u2013 369. [22] D. Kim J. Cai K.B. Ariyur J.E. Braun System identification for building thermal systems under the presence of unmeasured disturbances in closed loop operation: Lumped disturbance modeling approach Build Environ 107 2016 169 180 D. Kim, J. Cai, K.B. Ariyur, J.E. Braun, System identification for building thermal systems under the presence of unmeasured disturbances in closed loop operation: Lumped disturbance modeling approach, Building and Environment 107 (2016) 169\u2013180. [23] J.B. Rawlings D.Q. Mayne M. Diehl Model predictive control: theory, computation, and design Vol. 2 2017 Nob Hill Publishing Madison WI J.B. Rawlings, D.Q. Mayne, M. Diehl, Model predictive control: theory, computation, and design, Vol. 2, Nob Hill Publishing Madison, WI, 2017. [24] Bageshwar VL, Borrelli F. Observer pole placement limitations for a class of offset-free model predictive controllers. In: American Control Conference, 2008, IEEE; 2008. p. 447\u201352. URL <http://ieeexplore.ieee.org/xpls/abs_all.jsp?arnumber=4586532>. [25] G. Pannocchia J.B. Rawlings Disturbance models for offset-free model-predictive control AIChE J 49 2 2003 426 437 http://onlinelibrary.wiley.com/doi/10.1002/aic.690490213/abstract G. Pannocchia, J.B. Rawlings, Disturbance models for offset-free model-predictive control, AIChE Journal 49 (2) (2003) 426\u2013437. URL http://onlinelibrary.wiley.com/doi/10.1002/aic.690490213/abstract [26] D. Kim J. Braun J. Cai D. Fugate Development and experimental demonstration of a plug-and-play multiple rtu coordination control algorithm for small/medium commercial buildings Energy Build 107 2015 279 293 D. Kim, J. Braun, J. Cai, D. Fugate, Development and experimental demonstration of a plug-and-play multiple rtu coordination control algorithm for small/medium commercial buildings, Energy and Buildings 107 (2015) 279\u2013293. [27] D. Crawley L. Lawrie C. Pedersen F. Winkelmann Energy plus: energy simulation program ASHRAE J 42 4 2000 49 56 http://apps1.eere.energy.gov/buildings/energyplus/ D. Crawley, L. Lawrie, C. Pedersen, F. Winkelmann, Energy plus: energy simulation program, ASHRAE journal 42 (4) (2000) 49\u201356. URL http://apps1.eere.energy.gov/buildings/energyplus/ [28] Klein S, Beckman W, Mitchell J, Duffie J, Duffie N, Freeman T, et al. Trnsys 16\u2013a transient system simulation program, user manual, Solar Energy Laboratory. Madison: University of Wisconsin-Madison. [29] D. Kim J.E. Braun E.M. Cliff J. Borggaard Development, validation and application of a coupled reduced-order cfd model for building control applications Build Environ 93 2015 97 111 D. Kim, J.E. Braun, E.M. Cliff, J. Borggaard, Development, validation and application of a coupled reduced-order cfd model for building control applications, Building and Environment 93 (2015) 97\u2013111. [30] D. Kim J.E. Braun A general approach for generating reduced-order models for large multi-zone buildings J Build Perform Simul 8 6 2015 435 448 D. Kim, J.E. Braun, A general approach for generating reduced-order models for large multi-zone buildings, Journal of Building Performance Simulation 8 (6) (2015) 435\u2013448. [31] Ibaraki T, Katoh N. Resource allocation problems: algorithmic approaches; 1988.",
    "scopus-id": "85087006762",
    "coredata": {
        "eid": "1-s2.0-S0306261920308369",
        "dc:description": "\u201cFree cooling\u201d with cool outside air can meet or reduce a building\u2019s cooling loads in an energy efficient manner when conditions are favorable. For rooftop air conditioning units (RTUs), this is achieved with air-side economizers that are integrated with the packaged RTU. However, current RTU economizers are independently controlled at the unit level and may not fully leverage the free resource for economic benefit especially when multiple units serve a common zone of a building, such as in retail stores. That is, the independent control of multiple RTUs could lead to some units operating with mechanical cooling even when the outdoor air temperature or enthalpy is low enough to meet the load with economizer cooling. This paper presents a model-predictive control (MPC) approach to optimally supervise multiple RTUs in order to fully utilize the free cooling resource. The algorithm is applied to the evaluation of the energy savings potential for a case study building served by four identical RTUs under various climate zones over a cooling season.",
        "openArchiveArticle": "false",
        "prism:coverDate": "2020-10-01",
        "openaccessUserLicense": null,
        "prism:aggregationType": "Journal",
        "prism:url": "https://api.elsevier.com/content/article/pii/S0306261920308369",
        "dc:creator": [
            {
                "@_fa": "true",
                "$": "Kim, Donghun"
            },
            {
                "@_fa": "true",
                "$": "Braun, James E."
            }
        ],
        "link": [
            {
                "@_fa": "true",
                "@rel": "self",
                "@href": "https://api.elsevier.com/content/article/pii/S0306261920308369"
            },
            {
                "@_fa": "true",
                "@rel": "scidir",
                "@href": "https://www.sciencedirect.com/science/article/pii/S0306261920308369"
            }
        ],
        "dc:format": "application/json",
        "openaccessType": null,
        "pii": "S0306-2619(20)30836-9",
        "prism:volume": "275",
        "articleNumber": "115324",
        "prism:publisher": "Elsevier Ltd.",
        "dc:title": "Model predictive control for supervising multiple rooftop unit economizers to fully leverage free cooling energy resource",
        "prism:copyright": "© 2020 Elsevier Ltd. All rights reserved.",
        "openaccess": "0",
        "prism:issn": "03062619",
        "dcterms:subject": [
            {
                "@_fa": "true",
                "$": "Model predictive control"
            },
            {
                "@_fa": "true",
                "$": "MPC"
            },
            {
                "@_fa": "true",
                "$": "Economizer"
            },
            {
                "@_fa": "true",
                "$": "Rooftop unit"
            }
        ],
        "openaccessArticle": "false",
        "prism:publicationName": "Applied Energy",
        "openaccessSponsorType": null,
        "prism:pageRange": "115324",
        "pubType": "fla",
        "prism:coverDisplayDate": "1 October 2020",
        "prism:doi": "10.1016/j.apenergy.2020.115324",
        "prism:startingPage": "115324",
        "dc:identifier": "doi:10.1016/j.apenergy.2020.115324",
        "openaccessSponsorName": null
    },
    "objects": {"object": [
        {
            "@category": "standard",
            "@height": "430",
            "@width": "711",
            "@_fa": "true",
            "$": "https://api.elsevier.com/content/object/eid/1-s2.0-S0306261920308369-gr13.jpg?httpAccept=%2A%2F%2A",
            "@multimediatype": "JPEG image file",
            "@type": "IMAGE-DOWNSAMPLED",
            "@size": "104251",
            "@ref": "gr13",
            "@mimetype": "image/jpeg"
        },
        {
            "@category": "standard",
            "@height": "581",
            "@width": "364",
            "@_fa": "true",
            "$": "https://api.elsevier.com/content/object/eid/1-s2.0-S0306261920308369-gr14.jpg?httpAccept=%2A%2F%2A",
            "@multimediatype": "JPEG image file",
            "@type": "IMAGE-DOWNSAMPLED",
            "@size": "41657",
            "@ref": "gr14",
            "@mimetype": "image/jpeg"
        },
        {
            "@category": "standard",
            "@height": "405",
            "@width": "778",
            "@_fa": "true",
            "$": "https://api.elsevier.com/content/object/eid/1-s2.0-S0306261920308369-gr11.jpg?httpAccept=%2A%2F%2A",
            "@multimediatype": "JPEG image file",
            "@type": "IMAGE-DOWNSAMPLED",
            "@size": "95778",
            "@ref": "gr11",
            "@mimetype": "image/jpeg"
        },
        {
            "@category": "standard",
            "@height": "382",
            "@width": "778",
            "@_fa": "true",
            "$": "https://api.elsevier.com/content/object/eid/1-s2.0-S0306261920308369-gr12.jpg?httpAccept=%2A%2F%2A",
            "@multimediatype": "JPEG image file",
            "@type": "IMAGE-DOWNSAMPLED",
            "@size": "99442",
            "@ref": "gr12",
            "@mimetype": "image/jpeg"
        },
        {
            "@category": "standard",
            "@height": "289",
            "@width": "631",
            "@_fa": "true",
            "$": "https://api.elsevier.com/content/object/eid/1-s2.0-S0306261920308369-gr2.jpg?httpAccept=%2A%2F%2A",
            "@multimediatype": "JPEG image file",
            "@type": "IMAGE-DOWNSAMPLED",
            "@size": "52234",
            "@ref": "gr2",
            "@mimetype": "image/jpeg"
        },
        {
            "@category": "standard",
            "@height": "204",
            "@width": "364",
            "@_fa": "true",
            "$": "https://api.elsevier.com/content/object/eid/1-s2.0-S0306261920308369-gr3.jpg?httpAccept=%2A%2F%2A",
            "@multimediatype": "JPEG image file",
            "@type": "IMAGE-DOWNSAMPLED",
            "@size": "28215",
            "@ref": "gr3",
            "@mimetype": "image/jpeg"
        },
        {
            "@category": "standard",
            "@height": "665",
            "@width": "667",
            "@_fa": "true",
            "$": "https://api.elsevier.com/content/object/eid/1-s2.0-S0306261920308369-gr10.jpg?httpAccept=%2A%2F%2A",
            "@multimediatype": "JPEG image file",
            "@type": "IMAGE-DOWNSAMPLED",
            "@size": "133295",
            "@ref": "gr10",
            "@mimetype": "image/jpeg"
        },
        {
            "@category": "standard",
            "@height": "365",
            "@width": "200",
            "@_fa": "true",
            "$": "https://api.elsevier.com/content/object/eid/1-s2.0-S0306261920308369-gr1.jpg?httpAccept=%2A%2F%2A",
            "@multimediatype": "JPEG image file",
            "@type": "IMAGE-DOWNSAMPLED",
            "@size": "14200",
            "@ref": "gr1",
            "@mimetype": "image/jpeg"
        },
        {
            "@category": "standard",
            "@height": "349",
            "@width": "689",
            "@_fa": "true",
            "$": "https://api.elsevier.com/content/object/eid/1-s2.0-S0306261920308369-gr6.jpg?httpAccept=%2A%2F%2A",
            "@multimediatype": "JPEG image file",
            "@type": "IMAGE-DOWNSAMPLED",
            "@size": "71090",
            "@ref": "gr6",
            "@mimetype": "image/jpeg"
        },
        {
            "@category": "standard",
            "@height": "199",
            "@width": "689",
            "@_fa": "true",
            "$": "https://api.elsevier.com/content/object/eid/1-s2.0-S0306261920308369-gr7.jpg?httpAccept=%2A%2F%2A",
            "@multimediatype": "JPEG image file",
            "@type": "IMAGE-DOWNSAMPLED",
            "@size": "18126",
            "@ref": "gr7",
            "@mimetype": "image/jpeg"
        },
        {
            "@category": "standard",
            "@height": "338",
            "@width": "687",
            "@_fa": "true",
            "$": "https://api.elsevier.com/content/object/eid/1-s2.0-S0306261920308369-gr4.jpg?httpAccept=%2A%2F%2A",
            "@multimediatype": "JPEG image file",
            "@type": "IMAGE-DOWNSAMPLED",
            "@size": "73923",
            "@ref": "gr4",
            "@mimetype": "image/jpeg"
        },
        {
            "@category": "standard",
            "@height": "215",
            "@width": "364",
            "@_fa": "true",
            "$": "https://api.elsevier.com/content/object/eid/1-s2.0-S0306261920308369-gr5.jpg?httpAccept=%2A%2F%2A",
            "@multimediatype": "JPEG image file",
            "@type": "IMAGE-DOWNSAMPLED",
            "@size": "31850",
            "@ref": "gr5",
            "@mimetype": "image/jpeg"
        },
        {
            "@category": "standard",
            "@height": "382",
            "@width": "778",
            "@_fa": "true",
            "$": "https://api.elsevier.com/content/object/eid/1-s2.0-S0306261920308369-gr8.jpg?httpAccept=%2A%2F%2A",
            "@multimediatype": "JPEG image file",
            "@type": "IMAGE-DOWNSAMPLED",
            "@size": "92416",
            "@ref": "gr8",
            "@mimetype": "image/jpeg"
        },
        {
            "@category": "standard",
            "@height": "382",
            "@width": "778",
            "@_fa": "true",
            "$": "https://api.elsevier.com/content/object/eid/1-s2.0-S0306261920308369-gr9.jpg?httpAccept=%2A%2F%2A",
            "@multimediatype": "JPEG image file",
            "@type": "IMAGE-DOWNSAMPLED",
            "@size": "91958",
            "@ref": "gr9",
            "@mimetype": "image/jpeg"
        },
        {
            "@category": "thumbnail",
            "@height": "132",
            "@width": "219",
            "@_fa": "true",
            "$": "https://api.elsevier.com/content/object/eid/1-s2.0-S0306261920308369-gr13.sml?httpAccept=%2A%2F%2A",
            "@multimediatype": "GIF image file",
            "@type": "IMAGE-THUMBNAIL",
            "@size": "16918",
            "@ref": "gr13",
            "@mimetype": "image/gif"
        },
        {
            "@category": "thumbnail",
            "@height": "163",
            "@width": "102",
            "@_fa": "true",
            "$": "https://api.elsevier.com/content/object/eid/1-s2.0-S0306261920308369-gr14.sml?httpAccept=%2A%2F%2A",
            "@multimediatype": "GIF image file",
            "@type": "IMAGE-THUMBNAIL",
            "@size": "5281",
            "@ref": "gr14",
            "@mimetype": "image/gif"
        },
        {
            "@category": "thumbnail",
            "@height": "114",
            "@width": "219",
            "@_fa": "true",
            "$": "https://api.elsevier.com/content/object/eid/1-s2.0-S0306261920308369-gr11.sml?httpAccept=%2A%2F%2A",
            "@multimediatype": "GIF image file",
            "@type": "IMAGE-THUMBNAIL",
            "@size": "11190",
            "@ref": "gr11",
            "@mimetype": "image/gif"
        },
        {
            "@category": "thumbnail",
            "@height": "107",
            "@width": "219",
            "@_fa": "true",
            "$": "https://api.elsevier.com/content/object/eid/1-s2.0-S0306261920308369-gr12.sml?httpAccept=%2A%2F%2A",
            "@multimediatype": "GIF image file",
            "@type": "IMAGE-THUMBNAIL",
            "@size": "11827",
            "@ref": "gr12",
            "@mimetype": "image/gif"
        },
        {
            "@category": "thumbnail",
            "@height": "100",
            "@width": "219",
            "@_fa": "true",
            "$": "https://api.elsevier.com/content/object/eid/1-s2.0-S0306261920308369-gr2.sml?httpAccept=%2A%2F%2A",
            "@multimediatype": "GIF image file",
            "@type": "IMAGE-THUMBNAIL",
            "@size": "18238",
            "@ref": "gr2",
            "@mimetype": "image/gif"
        },
        {
            "@category": "thumbnail",
            "@height": "123",
            "@width": "219",
            "@_fa": "true",
            "$": "https://api.elsevier.com/content/object/eid/1-s2.0-S0306261920308369-gr3.sml?httpAccept=%2A%2F%2A",
            "@multimediatype": "GIF image file",
            "@type": "IMAGE-THUMBNAIL",
            "@size": "10896",
            "@ref": "gr3",
            "@mimetype": "image/gif"
        },
        {
            "@category": "thumbnail",
            "@height": "163",
            "@width": "164",
            "@_fa": "true",
            "$": "https://api.elsevier.com/content/object/eid/1-s2.0-S0306261920308369-gr10.sml?httpAccept=%2A%2F%2A",
            "@multimediatype": "GIF image file",
            "@type": "IMAGE-THUMBNAIL",
            "@size": "10691",
            "@ref": "gr10",
            "@mimetype": "image/gif"
        },
        {
            "@category": "thumbnail",
            "@height": "164",
            "@width": "90",
            "@_fa": "true",
            "$": "https://api.elsevier.com/content/object/eid/1-s2.0-S0306261920308369-gr1.sml?httpAccept=%2A%2F%2A",
            "@multimediatype": "GIF image file",
            "@type": "IMAGE-THUMBNAIL",
            "@size": "3425",
            "@ref": "gr1",
            "@mimetype": "image/gif"
        },
        {
            "@category": "thumbnail",
            "@height": "111",
            "@width": "219",
            "@_fa": "true",
            "$": "https://api.elsevier.com/content/object/eid/1-s2.0-S0306261920308369-gr6.sml?httpAccept=%2A%2F%2A",
            "@multimediatype": "GIF image file",
            "@type": "IMAGE-THUMBNAIL",
            "@size": "8588",
            "@ref": "gr6",
            "@mimetype": "image/gif"
        },
        {
            "@category": "thumbnail",
            "@height": "63",
            "@width": "219",
            "@_fa": "true",
            "$": "https://api.elsevier.com/content/object/eid/1-s2.0-S0306261920308369-gr7.sml?httpAccept=%2A%2F%2A",
            "@multimediatype": "GIF image file",
            "@type": "IMAGE-THUMBNAIL",
            "@size": "2691",
            "@ref": "gr7",
            "@mimetype": "image/gif"
        },
        {
            "@category": "thumbnail",
            "@height": "108",
            "@width": "219",
            "@_fa": "true",
            "$": "https://api.elsevier.com/content/object/eid/1-s2.0-S0306261920308369-gr4.sml?httpAccept=%2A%2F%2A",
            "@multimediatype": "GIF image file",
            "@type": "IMAGE-THUMBNAIL",
            "@size": "9143",
            "@ref": "gr4",
            "@mimetype": "image/gif"
        },
        {
            "@category": "thumbnail",
            "@height": "129",
            "@width": "219",
            "@_fa": "true",
            "$": "https://api.elsevier.com/content/object/eid/1-s2.0-S0306261920308369-gr5.sml?httpAccept=%2A%2F%2A",
            "@multimediatype": "GIF image file",
            "@type": "IMAGE-THUMBNAIL",
            "@size": "12268",
            "@ref": "gr5",
            "@mimetype": "image/gif"
        },
        {
            "@category": "thumbnail",
            "@height": "108",
            "@width": "219",
            "@_fa": "true",
            "$": "https://api.elsevier.com/content/object/eid/1-s2.0-S0306261920308369-gr8.sml?httpAccept=%2A%2F%2A",
            "@multimediatype": "GIF image file",
            "@type": "IMAGE-THUMBNAIL",
            "@size": "10853",
            "@ref": "gr8",
            "@mimetype": "image/gif"
        },
        {
            "@category": "thumbnail",
            "@height": "108",
            "@width": "219",
            "@_fa": "true",
            "$": "https://api.elsevier.com/content/object/eid/1-s2.0-S0306261920308369-gr9.sml?httpAccept=%2A%2F%2A",
            "@multimediatype": "GIF image file",
            "@type": "IMAGE-THUMBNAIL",
            "@size": "10952",
            "@ref": "gr9",
            "@mimetype": "image/gif"
        },
        {
            "@category": "high",
            "@height": "1904",
            "@width": "3150",
            "@_fa": "true",
            "$": "https://api.elsevier.com/content/object/eid/1-s2.0-S0306261920308369-gr13_lrg.jpg?httpAccept=%2A%2F%2A",
            "@multimediatype": "JPEG image file",
            "@type": "IMAGE-HIGH-RES",
            "@size": "671917",
            "@ref": "gr13",
            "@mimetype": "image/jpeg"
        },
        {
            "@category": "high",
            "@height": "2574",
            "@width": "1614",
            "@_fa": "true",
            "$": "https://api.elsevier.com/content/object/eid/1-s2.0-S0306261920308369-gr14_lrg.jpg?httpAccept=%2A%2F%2A",
            "@multimediatype": "JPEG image file",
            "@type": "IMAGE-HIGH-RES",
            "@size": "236569",
            "@ref": "gr14",
            "@mimetype": "image/jpeg"
        },
        {
            "@category": "high",
            "@height": "1791",
            "@width": "3443",
            "@_fa": "true",
            "$": "https://api.elsevier.com/content/object/eid/1-s2.0-S0306261920308369-gr11_lrg.jpg?httpAccept=%2A%2F%2A",
            "@multimediatype": "JPEG image file",
            "@type": "IMAGE-HIGH-RES",
            "@size": "521646",
            "@ref": "gr11",
            "@mimetype": "image/jpeg"
        },
        {
            "@category": "high",
            "@height": "1691",
            "@width": "3445",
            "@_fa": "true",
            "$": "https://api.elsevier.com/content/object/eid/1-s2.0-S0306261920308369-gr12_lrg.jpg?httpAccept=%2A%2F%2A",
            "@multimediatype": "JPEG image file",
            "@type": "IMAGE-HIGH-RES",
            "@size": "543477",
            "@ref": "gr12",
            "@mimetype": "image/jpeg"
        },
        {
            "@category": "high",
            "@height": "1279",
            "@width": "2794",
            "@_fa": "true",
            "$": "https://api.elsevier.com/content/object/eid/1-s2.0-S0306261920308369-gr2_lrg.jpg?httpAccept=%2A%2F%2A",
            "@multimediatype": "JPEG image file",
            "@type": "IMAGE-HIGH-RES",
            "@size": "377206",
            "@ref": "gr2",
            "@mimetype": "image/jpeg"
        },
        {
            "@category": "high",
            "@height": "903",
            "@width": "1614",
            "@_fa": "true",
            "$": "https://api.elsevier.com/content/object/eid/1-s2.0-S0306261920308369-gr3_lrg.jpg?httpAccept=%2A%2F%2A",
            "@multimediatype": "JPEG image file",
            "@type": "IMAGE-HIGH-RES",
            "@size": "181729",
            "@ref": "gr3",
            "@mimetype": "image/jpeg"
        },
        {
            "@category": "high",
            "@height": "2943",
            "@width": "2953",
            "@_fa": "true",
            "$": "https://api.elsevier.com/content/object/eid/1-s2.0-S0306261920308369-gr10_lrg.jpg?httpAccept=%2A%2F%2A",
            "@multimediatype": "JPEG image file",
            "@type": "IMAGE-HIGH-RES",
            "@size": "865415",
            "@ref": "gr10",
            "@mimetype": "image/jpeg"
        },
        {
            "@category": "high",
            "@height": "1616",
            "@width": "886",
            "@_fa": "true",
            "$": "https://api.elsevier.com/content/object/eid/1-s2.0-S0306261920308369-gr1_lrg.jpg?httpAccept=%2A%2F%2A",
            "@multimediatype": "JPEG image file",
            "@type": "IMAGE-HIGH-RES",
            "@size": "69733",
            "@ref": "gr1",
            "@mimetype": "image/jpeg"
        },
        {
            "@category": "high",
            "@height": "1544",
            "@width": "3051",
            "@_fa": "true",
            "$": "https://api.elsevier.com/content/object/eid/1-s2.0-S0306261920308369-gr6_lrg.jpg?httpAccept=%2A%2F%2A",
            "@multimediatype": "JPEG image file",
            "@type": "IMAGE-HIGH-RES",
            "@size": "443610",
            "@ref": "gr6",
            "@mimetype": "image/jpeg"
        },
        {
            "@category": "high",
            "@height": "883",
            "@width": "3051",
            "@_fa": "true",
            "$": "https://api.elsevier.com/content/object/eid/1-s2.0-S0306261920308369-gr7_lrg.jpg?httpAccept=%2A%2F%2A",
            "@multimediatype": "JPEG image file",
            "@type": "IMAGE-HIGH-RES",
            "@size": "96220",
            "@ref": "gr7",
            "@mimetype": "image/jpeg"
        },
        {
            "@category": "high",
            "@height": "1499",
            "@width": "3043",
            "@_fa": "true",
            "$": "https://api.elsevier.com/content/object/eid/1-s2.0-S0306261920308369-gr4_lrg.jpg?httpAccept=%2A%2F%2A",
            "@multimediatype": "JPEG image file",
            "@type": "IMAGE-HIGH-RES",
            "@size": "480550",
            "@ref": "gr4",
            "@mimetype": "image/jpeg"
        },
        {
            "@category": "high",
            "@height": "953",
            "@width": "1614",
            "@_fa": "true",
            "$": "https://api.elsevier.com/content/object/eid/1-s2.0-S0306261920308369-gr5_lrg.jpg?httpAccept=%2A%2F%2A",
            "@multimediatype": "JPEG image file",
            "@type": "IMAGE-HIGH-RES",
            "@size": "196721",
            "@ref": "gr5",
            "@mimetype": "image/jpeg"
        },
        {
            "@category": "high",
            "@height": "1691",
            "@width": "3443",
            "@_fa": "true",
            "$": "https://api.elsevier.com/content/object/eid/1-s2.0-S0306261920308369-gr8_lrg.jpg?httpAccept=%2A%2F%2A",
            "@multimediatype": "JPEG image file",
            "@type": "IMAGE-HIGH-RES",
            "@size": "492933",
            "@ref": "gr8",
            "@mimetype": "image/jpeg"
        },
        {
            "@category": "high",
            "@height": "1691",
            "@width": "3443",
            "@_fa": "true",
            "$": "https://api.elsevier.com/content/object/eid/1-s2.0-S0306261920308369-gr9_lrg.jpg?httpAccept=%2A%2F%2A",
            "@multimediatype": "JPEG image file",
            "@type": "IMAGE-HIGH-RES",
            "@size": "496594",
            "@ref": "gr9",
            "@mimetype": "image/jpeg"
        },
        {
            "@category": "thumbnail",
            "@_fa": "true",
            "$": "https://api.elsevier.com/content/object/eid/1-s2.0-S0306261920308369-si1.svg?httpAccept=%2A%2F%2A",
            "@multimediatype": "Scalable Vector Graphics file",
            "@type": "ALTIMG",
            "@size": "4557",
            "@ref": "si1",
            "@mimetype": "image/svg+xml"
        },
        {
            "@category": "thumbnail",
            "@_fa": "true",
            "$": "https://api.elsevier.com/content/object/eid/1-s2.0-S0306261920308369-si10.svg?httpAccept=%2A%2F%2A",
            "@multimediatype": "Scalable Vector Graphics file",
            "@type": "ALTIMG",
            "@size": "2187",
            "@ref": "si10",
            "@mimetype": "image/svg+xml"
        },
        {
            "@category": "thumbnail",
            "@_fa": "true",
            "$": "https://api.elsevier.com/content/object/eid/1-s2.0-S0306261920308369-si100.svg?httpAccept=%2A%2F%2A",
            "@multimediatype": "Scalable Vector Graphics file",
            "@type": "ALTIMG",
            "@size": "3586",
            "@ref": "si100",
            "@mimetype": "image/svg+xml"
        },
        {
            "@category": "thumbnail",
            "@_fa": "true",
            "$": "https://api.elsevier.com/content/object/eid/1-s2.0-S0306261920308369-si101.svg?httpAccept=%2A%2F%2A",
            "@multimediatype": "Scalable Vector Graphics file",
            "@type": "ALTIMG",
            "@size": "3586",
            "@ref": "si101",
            "@mimetype": "image/svg+xml"
        },
        {
            "@category": "thumbnail",
            "@_fa": "true",
            "$": "https://api.elsevier.com/content/object/eid/1-s2.0-S0306261920308369-si102.svg?httpAccept=%2A%2F%2A",
            "@multimediatype": "Scalable Vector Graphics file",
            "@type": "ALTIMG",
            "@size": "3586",
            "@ref": "si102",
            "@mimetype": "image/svg+xml"
        },
        {
            "@category": "thumbnail",
            "@_fa": "true",
            "$": "https://api.elsevier.com/content/object/eid/1-s2.0-S0306261920308369-si103.svg?httpAccept=%2A%2F%2A",
            "@multimediatype": "Scalable Vector Graphics file",
            "@type": "ALTIMG",
            "@size": "2726",
            "@ref": "si103",
            "@mimetype": "image/svg+xml"
        },
        {
            "@category": "thumbnail",
            "@_fa": "true",
            "$": "https://api.elsevier.com/content/object/eid/1-s2.0-S0306261920308369-si104.svg?httpAccept=%2A%2F%2A",
            "@multimediatype": "Scalable Vector Graphics file",
            "@type": "ALTIMG",
            "@size": "4958",
            "@ref": "si104",
            "@mimetype": "image/svg+xml"
        },
        {
            "@category": "thumbnail",
            "@_fa": "true",
            "$": "https://api.elsevier.com/content/object/eid/1-s2.0-S0306261920308369-si105.svg?httpAccept=%2A%2F%2A",
            "@multimediatype": "Scalable Vector Graphics file",
            "@type": "ALTIMG",
            "@size": "4193",
            "@ref": "si105",
            "@mimetype": "image/svg+xml"
        },
        {
            "@category": "thumbnail",
            "@_fa": "true",
            "$": "https://api.elsevier.com/content/object/eid/1-s2.0-S0306261920308369-si106.svg?httpAccept=%2A%2F%2A",
            "@multimediatype": "Scalable Vector Graphics file",
            "@type": "ALTIMG",
            "@size": "4858",
            "@ref": "si106",
            "@mimetype": "image/svg+xml"
        },
        {
            "@category": "thumbnail",
            "@_fa": "true",
            "$": "https://api.elsevier.com/content/object/eid/1-s2.0-S0306261920308369-si107.svg?httpAccept=%2A%2F%2A",
            "@multimediatype": "Scalable Vector Graphics file",
            "@type": "ALTIMG",
            "@size": "4182",
            "@ref": "si107",
            "@mimetype": "image/svg+xml"
        },
        {
            "@category": "thumbnail",
            "@_fa": "true",
            "$": "https://api.elsevier.com/content/object/eid/1-s2.0-S0306261920308369-si108.svg?httpAccept=%2A%2F%2A",
            "@multimediatype": "Scalable Vector Graphics file",
            "@type": "ALTIMG",
            "@size": "4193",
            "@ref": "si108",
            "@mimetype": "image/svg+xml"
        },
        {
            "@category": "thumbnail",
            "@_fa": "true",
            "$": "https://api.elsevier.com/content/object/eid/1-s2.0-S0306261920308369-si109.svg?httpAccept=%2A%2F%2A",
            "@multimediatype": "Scalable Vector Graphics file",
            "@type": "ALTIMG",
            "@size": "4451",
            "@ref": "si109",
            "@mimetype": "image/svg+xml"
        },
        {
            "@category": "thumbnail",
            "@_fa": "true",
            "$": "https://api.elsevier.com/content/object/eid/1-s2.0-S0306261920308369-si11.svg?httpAccept=%2A%2F%2A",
            "@multimediatype": "Scalable Vector Graphics file",
            "@type": "ALTIMG",
            "@size": "2330",
            "@ref": "si11",
            "@mimetype": "image/svg+xml"
        },
        {
            "@category": "thumbnail",
            "@_fa": "true",
            "$": "https://api.elsevier.com/content/object/eid/1-s2.0-S0306261920308369-si110.svg?httpAccept=%2A%2F%2A",
            "@multimediatype": "Scalable Vector Graphics file",
            "@type": "ALTIMG",
            "@size": "3586",
            "@ref": "si110",
            "@mimetype": "image/svg+xml"
        },
        {
            "@category": "thumbnail",
            "@_fa": "true",
            "$": "https://api.elsevier.com/content/object/eid/1-s2.0-S0306261920308369-si111.svg?httpAccept=%2A%2F%2A",
            "@multimediatype": "Scalable Vector Graphics file",
            "@type": "ALTIMG",
            "@size": "4193",
            "@ref": "si111",
            "@mimetype": "image/svg+xml"
        },
        {
            "@category": "thumbnail",
            "@_fa": "true",
            "$": "https://api.elsevier.com/content/object/eid/1-s2.0-S0306261920308369-si112.svg?httpAccept=%2A%2F%2A",
            "@multimediatype": "Scalable Vector Graphics file",
            "@type": "ALTIMG",
            "@size": "48046",
            "@ref": "si112",
            "@mimetype": "image/svg+xml"
        },
        {
            "@category": "thumbnail",
            "@_fa": "true",
            "$": "https://api.elsevier.com/content/object/eid/1-s2.0-S0306261920308369-si113.svg?httpAccept=%2A%2F%2A",
            "@multimediatype": "Scalable Vector Graphics file",
            "@type": "ALTIMG",
            "@size": "28843",
            "@ref": "si113",
            "@mimetype": "image/svg+xml"
        },
        {
            "@category": "thumbnail",
            "@_fa": "true",
            "$": "https://api.elsevier.com/content/object/eid/1-s2.0-S0306261920308369-si114.svg?httpAccept=%2A%2F%2A",
            "@multimediatype": "Scalable Vector Graphics file",
            "@type": "ALTIMG",
            "@size": "20692",
            "@ref": "si114",
            "@mimetype": "image/svg+xml"
        },
        {
            "@category": "thumbnail",
            "@_fa": "true",
            "$": "https://api.elsevier.com/content/object/eid/1-s2.0-S0306261920308369-si115.svg?httpAccept=%2A%2F%2A",
            "@multimediatype": "Scalable Vector Graphics file",
            "@type": "ALTIMG",
            "@size": "19631",
            "@ref": "si115",
            "@mimetype": "image/svg+xml"
        },
        {
            "@category": "thumbnail",
            "@_fa": "true",
            "$": "https://api.elsevier.com/content/object/eid/1-s2.0-S0306261920308369-si116.svg?httpAccept=%2A%2F%2A",
            "@multimediatype": "Scalable Vector Graphics file",
            "@type": "ALTIMG",
            "@size": "9005",
            "@ref": "si116",
            "@mimetype": "image/svg+xml"
        },
        {
            "@category": "thumbnail",
            "@_fa": "true",
            "$": "https://api.elsevier.com/content/object/eid/1-s2.0-S0306261920308369-si117.svg?httpAccept=%2A%2F%2A",
            "@multimediatype": "Scalable Vector Graphics file",
            "@type": "ALTIMG",
            "@size": "5748",
            "@ref": "si117",
            "@mimetype": "image/svg+xml"
        },
        {
            "@category": "thumbnail",
            "@_fa": "true",
            "$": "https://api.elsevier.com/content/object/eid/1-s2.0-S0306261920308369-si118.svg?httpAccept=%2A%2F%2A",
            "@multimediatype": "Scalable Vector Graphics file",
            "@type": "ALTIMG",
            "@size": "4193",
            "@ref": "si118",
            "@mimetype": "image/svg+xml"
        },
        {
            "@category": "thumbnail",
            "@_fa": "true",
            "$": "https://api.elsevier.com/content/object/eid/1-s2.0-S0306261920308369-si119.svg?httpAccept=%2A%2F%2A",
            "@multimediatype": "Scalable Vector Graphics file",
            "@type": "ALTIMG",
            "@size": "4230",
            "@ref": "si119",
            "@mimetype": "image/svg+xml"
        },
        {
            "@category": "thumbnail",
            "@_fa": "true",
            "$": "https://api.elsevier.com/content/object/eid/1-s2.0-S0306261920308369-si12.svg?httpAccept=%2A%2F%2A",
            "@multimediatype": "Scalable Vector Graphics file",
            "@type": "ALTIMG",
            "@size": "2187",
            "@ref": "si12",
            "@mimetype": "image/svg+xml"
        },
        {
            "@category": "thumbnail",
            "@_fa": "true",
            "$": "https://api.elsevier.com/content/object/eid/1-s2.0-S0306261920308369-si120.svg?httpAccept=%2A%2F%2A",
            "@multimediatype": "Scalable Vector Graphics file",
            "@type": "ALTIMG",
            "@size": "11514",
            "@ref": "si120",
            "@mimetype": "image/svg+xml"
        },
        {
            "@category": "thumbnail",
            "@_fa": "true",
            "$": "https://api.elsevier.com/content/object/eid/1-s2.0-S0306261920308369-si121.svg?httpAccept=%2A%2F%2A",
            "@multimediatype": "Scalable Vector Graphics file",
            "@type": "ALTIMG",
            "@size": "4182",
            "@ref": "si121",
            "@mimetype": "image/svg+xml"
        },
        {
            "@category": "thumbnail",
            "@_fa": "true",
            "$": "https://api.elsevier.com/content/object/eid/1-s2.0-S0306261920308369-si122.svg?httpAccept=%2A%2F%2A",
            "@multimediatype": "Scalable Vector Graphics file",
            "@type": "ALTIMG",
            "@size": "4193",
            "@ref": "si122",
            "@mimetype": "image/svg+xml"
        },
        {
            "@category": "thumbnail",
            "@_fa": "true",
            "$": "https://api.elsevier.com/content/object/eid/1-s2.0-S0306261920308369-si123.svg?httpAccept=%2A%2F%2A",
            "@multimediatype": "Scalable Vector Graphics file",
            "@type": "ALTIMG",
            "@size": "4230",
            "@ref": "si123",
            "@mimetype": "image/svg+xml"
        },
        {
            "@category": "thumbnail",
            "@_fa": "true",
            "$": "https://api.elsevier.com/content/object/eid/1-s2.0-S0306261920308369-si124.svg?httpAccept=%2A%2F%2A",
            "@multimediatype": "Scalable Vector Graphics file",
            "@type": "ALTIMG",
            "@size": "4940",
            "@ref": "si124",
            "@mimetype": "image/svg+xml"
        },
        {
            "@category": "thumbnail",
            "@_fa": "true",
            "$": "https://api.elsevier.com/content/object/eid/1-s2.0-S0306261920308369-si125.svg?httpAccept=%2A%2F%2A",
            "@multimediatype": "Scalable Vector Graphics file",
            "@type": "ALTIMG",
            "@size": "5993",
            "@ref": "si125",
            "@mimetype": "image/svg+xml"
        },
        {
            "@category": "thumbnail",
            "@_fa": "true",
            "$": "https://api.elsevier.com/content/object/eid/1-s2.0-S0306261920308369-si126.svg?httpAccept=%2A%2F%2A",
            "@multimediatype": "Scalable Vector Graphics file",
            "@type": "ALTIMG",
            "@size": "5991",
            "@ref": "si126",
            "@mimetype": "image/svg+xml"
        },
        {
            "@category": "thumbnail",
            "@_fa": "true",
            "$": "https://api.elsevier.com/content/object/eid/1-s2.0-S0306261920308369-si127.svg?httpAccept=%2A%2F%2A",
            "@multimediatype": "Scalable Vector Graphics file",
            "@type": "ALTIMG",
            "@size": "7974",
            "@ref": "si127",
            "@mimetype": "image/svg+xml"
        },
        {
            "@category": "thumbnail",
            "@_fa": "true",
            "$": "https://api.elsevier.com/content/object/eid/1-s2.0-S0306261920308369-si128.svg?httpAccept=%2A%2F%2A",
            "@multimediatype": "Scalable Vector Graphics file",
            "@type": "ALTIMG",
            "@size": "6263",
            "@ref": "si128",
            "@mimetype": "image/svg+xml"
        },
        {
            "@category": "thumbnail",
            "@_fa": "true",
            "$": "https://api.elsevier.com/content/object/eid/1-s2.0-S0306261920308369-si129.svg?httpAccept=%2A%2F%2A",
            "@multimediatype": "Scalable Vector Graphics file",
            "@type": "ALTIMG",
            "@size": "4857",
            "@ref": "si129",
            "@mimetype": "image/svg+xml"
        },
        {
            "@category": "thumbnail",
            "@_fa": "true",
            "$": "https://api.elsevier.com/content/object/eid/1-s2.0-S0306261920308369-si13.svg?httpAccept=%2A%2F%2A",
            "@multimediatype": "Scalable Vector Graphics file",
            "@type": "ALTIMG",
            "@size": "2330",
            "@ref": "si13",
            "@mimetype": "image/svg+xml"
        },
        {
            "@category": "thumbnail",
            "@_fa": "true",
            "$": "https://api.elsevier.com/content/object/eid/1-s2.0-S0306261920308369-si130.svg?httpAccept=%2A%2F%2A",
            "@multimediatype": "Scalable Vector Graphics file",
            "@type": "ALTIMG",
            "@size": "2981",
            "@ref": "si130",
            "@mimetype": "image/svg+xml"
        },
        {
            "@category": "thumbnail",
            "@_fa": "true",
            "$": "https://api.elsevier.com/content/object/eid/1-s2.0-S0306261920308369-si131.svg?httpAccept=%2A%2F%2A",
            "@multimediatype": "Scalable Vector Graphics file",
            "@type": "ALTIMG",
            "@size": "2905",
            "@ref": "si131",
            "@mimetype": "image/svg+xml"
        },
        {
            "@category": "thumbnail",
            "@_fa": "true",
            "$": "https://api.elsevier.com/content/object/eid/1-s2.0-S0306261920308369-si132.svg?httpAccept=%2A%2F%2A",
            "@multimediatype": "Scalable Vector Graphics file",
            "@type": "ALTIMG",
            "@size": "1769",
            "@ref": "si132",
            "@mimetype": "image/svg+xml"
        },
        {
            "@category": "thumbnail",
            "@_fa": "true",
            "$": "https://api.elsevier.com/content/object/eid/1-s2.0-S0306261920308369-si133.svg?httpAccept=%2A%2F%2A",
            "@multimediatype": "Scalable Vector Graphics file",
            "@type": "ALTIMG",
            "@size": "2905",
            "@ref": "si133",
            "@mimetype": "image/svg+xml"
        },
        {
            "@category": "thumbnail",
            "@_fa": "true",
            "$": "https://api.elsevier.com/content/object/eid/1-s2.0-S0306261920308369-si134.svg?httpAccept=%2A%2F%2A",
            "@multimediatype": "Scalable Vector Graphics file",
            "@type": "ALTIMG",
            "@size": "4404",
            "@ref": "si134",
            "@mimetype": "image/svg+xml"
        },
        {
            "@category": "thumbnail",
            "@_fa": "true",
            "$": "https://api.elsevier.com/content/object/eid/1-s2.0-S0306261920308369-si135.svg?httpAccept=%2A%2F%2A",
            "@multimediatype": "Scalable Vector Graphics file",
            "@type": "ALTIMG",
            "@size": "3586",
            "@ref": "si135",
            "@mimetype": "image/svg+xml"
        },
        {
            "@category": "thumbnail",
            "@_fa": "true",
            "$": "https://api.elsevier.com/content/object/eid/1-s2.0-S0306261920308369-si136.svg?httpAccept=%2A%2F%2A",
            "@multimediatype": "Scalable Vector Graphics file",
            "@type": "ALTIMG",
            "@size": "7113",
            "@ref": "si136",
            "@mimetype": "image/svg+xml"
        },
        {
            "@category": "thumbnail",
            "@_fa": "true",
            "$": "https://api.elsevier.com/content/object/eid/1-s2.0-S0306261920308369-si137.svg?httpAccept=%2A%2F%2A",
            "@multimediatype": "Scalable Vector Graphics file",
            "@type": "ALTIMG",
            "@size": "5256",
            "@ref": "si137",
            "@mimetype": "image/svg+xml"
        },
        {
            "@category": "thumbnail",
            "@_fa": "true",
            "$": "https://api.elsevier.com/content/object/eid/1-s2.0-S0306261920308369-si138.svg?httpAccept=%2A%2F%2A",
            "@multimediatype": "Scalable Vector Graphics file",
            "@type": "ALTIMG",
            "@size": "5935",
            "@ref": "si138",
            "@mimetype": "image/svg+xml"
        },
        {
            "@category": "thumbnail",
            "@_fa": "true",
            "$": "https://api.elsevier.com/content/object/eid/1-s2.0-S0306261920308369-si139.svg?httpAccept=%2A%2F%2A",
            "@multimediatype": "Scalable Vector Graphics file",
            "@type": "ALTIMG",
            "@size": "4858",
            "@ref": "si139",
            "@mimetype": "image/svg+xml"
        },
        {
            "@category": "thumbnail",
            "@_fa": "true",
            "$": "https://api.elsevier.com/content/object/eid/1-s2.0-S0306261920308369-si14.svg?httpAccept=%2A%2F%2A",
            "@multimediatype": "Scalable Vector Graphics file",
            "@type": "ALTIMG",
            "@size": "2187",
            "@ref": "si14",
            "@mimetype": "image/svg+xml"
        },
        {
            "@category": "thumbnail",
            "@_fa": "true",
            "$": "https://api.elsevier.com/content/object/eid/1-s2.0-S0306261920308369-si140.svg?httpAccept=%2A%2F%2A",
            "@multimediatype": "Scalable Vector Graphics file",
            "@type": "ALTIMG",
            "@size": "10060",
            "@ref": "si140",
            "@mimetype": "image/svg+xml"
        },
        {
            "@category": "thumbnail",
            "@_fa": "true",
            "$": "https://api.elsevier.com/content/object/eid/1-s2.0-S0306261920308369-si141.svg?httpAccept=%2A%2F%2A",
            "@multimediatype": "Scalable Vector Graphics file",
            "@type": "ALTIMG",
            "@size": "9346",
            "@ref": "si141",
            "@mimetype": "image/svg+xml"
        },
        {
            "@category": "thumbnail",
            "@_fa": "true",
            "$": "https://api.elsevier.com/content/object/eid/1-s2.0-S0306261920308369-si142.svg?httpAccept=%2A%2F%2A",
            "@multimediatype": "Scalable Vector Graphics file",
            "@type": "ALTIMG",
            "@size": "9346",
            "@ref": "si142",
            "@mimetype": "image/svg+xml"
        },
        {
            "@category": "thumbnail",
            "@_fa": "true",
            "$": "https://api.elsevier.com/content/object/eid/1-s2.0-S0306261920308369-si143.svg?httpAccept=%2A%2F%2A",
            "@multimediatype": "Scalable Vector Graphics file",
            "@type": "ALTIMG",
            "@size": "9346",
            "@ref": "si143",
            "@mimetype": "image/svg+xml"
        },
        {
            "@category": "thumbnail",
            "@_fa": "true",
            "$": "https://api.elsevier.com/content/object/eid/1-s2.0-S0306261920308369-si144.svg?httpAccept=%2A%2F%2A",
            "@multimediatype": "Scalable Vector Graphics file",
            "@type": "ALTIMG",
            "@size": "3880",
            "@ref": "si144",
            "@mimetype": "image/svg+xml"
        },
        {
            "@category": "thumbnail",
            "@_fa": "true",
            "$": "https://api.elsevier.com/content/object/eid/1-s2.0-S0306261920308369-si145.svg?httpAccept=%2A%2F%2A",
            "@multimediatype": "Scalable Vector Graphics file",
            "@type": "ALTIMG",
            "@size": "2848",
            "@ref": "si145",
            "@mimetype": "image/svg+xml"
        },
        {
            "@category": "thumbnail",
            "@_fa": "true",
            "$": "https://api.elsevier.com/content/object/eid/1-s2.0-S0306261920308369-si146.svg?httpAccept=%2A%2F%2A",
            "@multimediatype": "Scalable Vector Graphics file",
            "@type": "ALTIMG",
            "@size": "4193",
            "@ref": "si146",
            "@mimetype": "image/svg+xml"
        },
        {
            "@category": "thumbnail",
            "@_fa": "true",
            "$": "https://api.elsevier.com/content/object/eid/1-s2.0-S0306261920308369-si147.svg?httpAccept=%2A%2F%2A",
            "@multimediatype": "Scalable Vector Graphics file",
            "@type": "ALTIMG",
            "@size": "41435",
            "@ref": "si147",
            "@mimetype": "image/svg+xml"
        },
        {
            "@category": "thumbnail",
            "@_fa": "true",
            "$": "https://api.elsevier.com/content/object/eid/1-s2.0-S0306261920308369-si148.svg?httpAccept=%2A%2F%2A",
            "@multimediatype": "Scalable Vector Graphics file",
            "@type": "ALTIMG",
            "@size": "4502",
            "@ref": "si148",
            "@mimetype": "image/svg+xml"
        },
        {
            "@category": "thumbnail",
            "@_fa": "true",
            "$": "https://api.elsevier.com/content/object/eid/1-s2.0-S0306261920308369-si149.svg?httpAccept=%2A%2F%2A",
            "@multimediatype": "Scalable Vector Graphics file",
            "@type": "ALTIMG",
            "@size": "5213",
            "@ref": "si149",
            "@mimetype": "image/svg+xml"
        },
        {
            "@category": "thumbnail",
            "@_fa": "true",
            "$": "https://api.elsevier.com/content/object/eid/1-s2.0-S0306261920308369-si15.svg?httpAccept=%2A%2F%2A",
            "@multimediatype": "Scalable Vector Graphics file",
            "@type": "ALTIMG",
            "@size": "2330",
            "@ref": "si15",
            "@mimetype": "image/svg+xml"
        },
        {
            "@category": "thumbnail",
            "@_fa": "true",
            "$": "https://api.elsevier.com/content/object/eid/1-s2.0-S0306261920308369-si150.svg?httpAccept=%2A%2F%2A",
            "@multimediatype": "Scalable Vector Graphics file",
            "@type": "ALTIMG",
            "@size": "6180",
            "@ref": "si150",
            "@mimetype": "image/svg+xml"
        },
        {
            "@category": "thumbnail",
            "@_fa": "true",
            "$": "https://api.elsevier.com/content/object/eid/1-s2.0-S0306261920308369-si151.svg?httpAccept=%2A%2F%2A",
            "@multimediatype": "Scalable Vector Graphics file",
            "@type": "ALTIMG",
            "@size": "4193",
            "@ref": "si151",
            "@mimetype": "image/svg+xml"
        },
        {
            "@category": "thumbnail",
            "@_fa": "true",
            "$": "https://api.elsevier.com/content/object/eid/1-s2.0-S0306261920308369-si152.svg?httpAccept=%2A%2F%2A",
            "@multimediatype": "Scalable Vector Graphics file",
            "@type": "ALTIMG",
            "@size": "5226",
            "@ref": "si152",
            "@mimetype": "image/svg+xml"
        },
        {
            "@category": "thumbnail",
            "@_fa": "true",
            "$": "https://api.elsevier.com/content/object/eid/1-s2.0-S0306261920308369-si153.svg?httpAccept=%2A%2F%2A",
            "@multimediatype": "Scalable Vector Graphics file",
            "@type": "ALTIMG",
            "@size": "10980",
            "@ref": "si153",
            "@mimetype": "image/svg+xml"
        },
        {
            "@category": "thumbnail",
            "@_fa": "true",
            "$": "https://api.elsevier.com/content/object/eid/1-s2.0-S0306261920308369-si154.svg?httpAccept=%2A%2F%2A",
            "@multimediatype": "Scalable Vector Graphics file",
            "@type": "ALTIMG",
            "@size": "7961",
            "@ref": "si154",
            "@mimetype": "image/svg+xml"
        },
        {
            "@category": "thumbnail",
            "@_fa": "true",
            "$": "https://api.elsevier.com/content/object/eid/1-s2.0-S0306261920308369-si155.svg?httpAccept=%2A%2F%2A",
            "@multimediatype": "Scalable Vector Graphics file",
            "@type": "ALTIMG",
            "@size": "3961",
            "@ref": "si155",
            "@mimetype": "image/svg+xml"
        },
        {
            "@category": "thumbnail",
            "@_fa": "true",
            "$": "https://api.elsevier.com/content/object/eid/1-s2.0-S0306261920308369-si156.svg?httpAccept=%2A%2F%2A",
            "@multimediatype": "Scalable Vector Graphics file",
            "@type": "ALTIMG",
            "@size": "8677",
            "@ref": "si156",
            "@mimetype": "image/svg+xml"
        },
        {
            "@category": "thumbnail",
            "@_fa": "true",
            "$": "https://api.elsevier.com/content/object/eid/1-s2.0-S0306261920308369-si157.svg?httpAccept=%2A%2F%2A",
            "@multimediatype": "Scalable Vector Graphics file",
            "@type": "ALTIMG",
            "@size": "3846",
            "@ref": "si157",
            "@mimetype": "image/svg+xml"
        },
        {
            "@category": "thumbnail",
            "@_fa": "true",
            "$": "https://api.elsevier.com/content/object/eid/1-s2.0-S0306261920308369-si158.svg?httpAccept=%2A%2F%2A",
            "@multimediatype": "Scalable Vector Graphics file",
            "@type": "ALTIMG",
            "@size": "4460",
            "@ref": "si158",
            "@mimetype": "image/svg+xml"
        },
        {
            "@category": "thumbnail",
            "@_fa": "true",
            "$": "https://api.elsevier.com/content/object/eid/1-s2.0-S0306261920308369-si159.svg?httpAccept=%2A%2F%2A",
            "@multimediatype": "Scalable Vector Graphics file",
            "@type": "ALTIMG",
            "@size": "5320",
            "@ref": "si159",
            "@mimetype": "image/svg+xml"
        },
        {
            "@category": "thumbnail",
            "@_fa": "true",
            "$": "https://api.elsevier.com/content/object/eid/1-s2.0-S0306261920308369-si16.svg?httpAccept=%2A%2F%2A",
            "@multimediatype": "Scalable Vector Graphics file",
            "@type": "ALTIMG",
            "@size": "2187",
            "@ref": "si16",
            "@mimetype": "image/svg+xml"
        },
        {
            "@category": "thumbnail",
            "@_fa": "true",
            "$": "https://api.elsevier.com/content/object/eid/1-s2.0-S0306261920308369-si160.svg?httpAccept=%2A%2F%2A",
            "@multimediatype": "Scalable Vector Graphics file",
            "@type": "ALTIMG",
            "@size": "6394",
            "@ref": "si160",
            "@mimetype": "image/svg+xml"
        },
        {
            "@category": "thumbnail",
            "@_fa": "true",
            "$": "https://api.elsevier.com/content/object/eid/1-s2.0-S0306261920308369-si161.svg?httpAccept=%2A%2F%2A",
            "@multimediatype": "Scalable Vector Graphics file",
            "@type": "ALTIMG",
            "@size": "6205",
            "@ref": "si161",
            "@mimetype": "image/svg+xml"
        },
        {
            "@category": "thumbnail",
            "@_fa": "true",
            "$": "https://api.elsevier.com/content/object/eid/1-s2.0-S0306261920308369-si162.svg?httpAccept=%2A%2F%2A",
            "@multimediatype": "Scalable Vector Graphics file",
            "@type": "ALTIMG",
            "@size": "7442",
            "@ref": "si162",
            "@mimetype": "image/svg+xml"
        },
        {
            "@category": "thumbnail",
            "@_fa": "true",
            "$": "https://api.elsevier.com/content/object/eid/1-s2.0-S0306261920308369-si163.svg?httpAccept=%2A%2F%2A",
            "@multimediatype": "Scalable Vector Graphics file",
            "@type": "ALTIMG",
            "@size": "4301",
            "@ref": "si163",
            "@mimetype": "image/svg+xml"
        },
        {
            "@category": "thumbnail",
            "@_fa": "true",
            "$": "https://api.elsevier.com/content/object/eid/1-s2.0-S0306261920308369-si164.svg?httpAccept=%2A%2F%2A",
            "@multimediatype": "Scalable Vector Graphics file",
            "@type": "ALTIMG",
            "@size": "4193",
            "@ref": "si164",
            "@mimetype": "image/svg+xml"
        },
        {
            "@category": "thumbnail",
            "@_fa": "true",
            "$": "https://api.elsevier.com/content/object/eid/1-s2.0-S0306261920308369-si165.svg?httpAccept=%2A%2F%2A",
            "@multimediatype": "Scalable Vector Graphics file",
            "@type": "ALTIMG",
            "@size": "2726",
            "@ref": "si165",
            "@mimetype": "image/svg+xml"
        },
        {
            "@category": "thumbnail",
            "@_fa": "true",
            "$": "https://api.elsevier.com/content/object/eid/1-s2.0-S0306261920308369-si166.svg?httpAccept=%2A%2F%2A",
            "@multimediatype": "Scalable Vector Graphics file",
            "@type": "ALTIMG",
            "@size": "6845",
            "@ref": "si166",
            "@mimetype": "image/svg+xml"
        },
        {
            "@category": "thumbnail",
            "@_fa": "true",
            "$": "https://api.elsevier.com/content/object/eid/1-s2.0-S0306261920308369-si167.svg?httpAccept=%2A%2F%2A",
            "@multimediatype": "Scalable Vector Graphics file",
            "@type": "ALTIMG",
            "@size": "6494",
            "@ref": "si167",
            "@mimetype": "image/svg+xml"
        },
        {
            "@category": "thumbnail",
            "@_fa": "true",
            "$": "https://api.elsevier.com/content/object/eid/1-s2.0-S0306261920308369-si168.svg?httpAccept=%2A%2F%2A",
            "@multimediatype": "Scalable Vector Graphics file",
            "@type": "ALTIMG",
            "@size": "1412",
            "@ref": "si168",
            "@mimetype": "image/svg+xml"
        },
        {
            "@category": "thumbnail",
            "@_fa": "true",
            "$": "https://api.elsevier.com/content/object/eid/1-s2.0-S0306261920308369-si169.svg?httpAccept=%2A%2F%2A",
            "@multimediatype": "Scalable Vector Graphics file",
            "@type": "ALTIMG",
            "@size": "15393",
            "@ref": "si169",
            "@mimetype": "image/svg+xml"
        },
        {
            "@category": "thumbnail",
            "@_fa": "true",
            "$": "https://api.elsevier.com/content/object/eid/1-s2.0-S0306261920308369-si17.svg?httpAccept=%2A%2F%2A",
            "@multimediatype": "Scalable Vector Graphics file",
            "@type": "ALTIMG",
            "@size": "2330",
            "@ref": "si17",
            "@mimetype": "image/svg+xml"
        },
        {
            "@category": "thumbnail",
            "@_fa": "true",
            "$": "https://api.elsevier.com/content/object/eid/1-s2.0-S0306261920308369-si170.svg?httpAccept=%2A%2F%2A",
            "@multimediatype": "Scalable Vector Graphics file",
            "@type": "ALTIMG",
            "@size": "15637",
            "@ref": "si170",
            "@mimetype": "image/svg+xml"
        },
        {
            "@category": "thumbnail",
            "@_fa": "true",
            "$": "https://api.elsevier.com/content/object/eid/1-s2.0-S0306261920308369-si171.svg?httpAccept=%2A%2F%2A",
            "@multimediatype": "Scalable Vector Graphics file",
            "@type": "ALTIMG",
            "@size": "1412",
            "@ref": "si171",
            "@mimetype": "image/svg+xml"
        },
        {
            "@category": "thumbnail",
            "@_fa": "true",
            "$": "https://api.elsevier.com/content/object/eid/1-s2.0-S0306261920308369-si172.svg?httpAccept=%2A%2F%2A",
            "@multimediatype": "Scalable Vector Graphics file",
            "@type": "ALTIMG",
            "@size": "9245",
            "@ref": "si172",
            "@mimetype": "image/svg+xml"
        },
        {
            "@category": "thumbnail",
            "@_fa": "true",
            "$": "https://api.elsevier.com/content/object/eid/1-s2.0-S0306261920308369-si173.svg?httpAccept=%2A%2F%2A",
            "@multimediatype": "Scalable Vector Graphics file",
            "@type": "ALTIMG",
            "@size": "1412",
            "@ref": "si173",
            "@mimetype": "image/svg+xml"
        },
        {
            "@category": "thumbnail",
            "@_fa": "true",
            "$": "https://api.elsevier.com/content/object/eid/1-s2.0-S0306261920308369-si174.svg?httpAccept=%2A%2F%2A",
            "@multimediatype": "Scalable Vector Graphics file",
            "@type": "ALTIMG",
            "@size": "3269",
            "@ref": "si174",
            "@mimetype": "image/svg+xml"
        },
        {
            "@category": "thumbnail",
            "@_fa": "true",
            "$": "https://api.elsevier.com/content/object/eid/1-s2.0-S0306261920308369-si175.svg?httpAccept=%2A%2F%2A",
            "@multimediatype": "Scalable Vector Graphics file",
            "@type": "ALTIMG",
            "@size": "4940",
            "@ref": "si175",
            "@mimetype": "image/svg+xml"
        },
        {
            "@category": "thumbnail",
            "@_fa": "true",
            "$": "https://api.elsevier.com/content/object/eid/1-s2.0-S0306261920308369-si176.svg?httpAccept=%2A%2F%2A",
            "@multimediatype": "Scalable Vector Graphics file",
            "@type": "ALTIMG",
            "@size": "6494",
            "@ref": "si176",
            "@mimetype": "image/svg+xml"
        },
        {
            "@category": "thumbnail",
            "@_fa": "true",
            "$": "https://api.elsevier.com/content/object/eid/1-s2.0-S0306261920308369-si177.svg?httpAccept=%2A%2F%2A",
            "@multimediatype": "Scalable Vector Graphics file",
            "@type": "ALTIMG",
            "@size": "10924",
            "@ref": "si177",
            "@mimetype": "image/svg+xml"
        },
        {
            "@category": "thumbnail",
            "@_fa": "true",
            "$": "https://api.elsevier.com/content/object/eid/1-s2.0-S0306261920308369-si178.svg?httpAccept=%2A%2F%2A",
            "@multimediatype": "Scalable Vector Graphics file",
            "@type": "ALTIMG",
            "@size": "6429",
            "@ref": "si178",
            "@mimetype": "image/svg+xml"
        },
        {
            "@category": "thumbnail",
            "@_fa": "true",
            "$": "https://api.elsevier.com/content/object/eid/1-s2.0-S0306261920308369-si179.svg?httpAccept=%2A%2F%2A",
            "@multimediatype": "Scalable Vector Graphics file",
            "@type": "ALTIMG",
            "@size": "30007",
            "@ref": "si179",
            "@mimetype": "image/svg+xml"
        },
        {
            "@category": "thumbnail",
            "@_fa": "true",
            "$": "https://api.elsevier.com/content/object/eid/1-s2.0-S0306261920308369-si18.svg?httpAccept=%2A%2F%2A",
            "@multimediatype": "Scalable Vector Graphics file",
            "@type": "ALTIMG",
            "@size": "2187",
            "@ref": "si18",
            "@mimetype": "image/svg+xml"
        },
        {
            "@category": "thumbnail",
            "@_fa": "true",
            "$": "https://api.elsevier.com/content/object/eid/1-s2.0-S0306261920308369-si180.svg?httpAccept=%2A%2F%2A",
            "@multimediatype": "Scalable Vector Graphics file",
            "@type": "ALTIMG",
            "@size": "14424",
            "@ref": "si180",
            "@mimetype": "image/svg+xml"
        },
        {
            "@category": "thumbnail",
            "@_fa": "true",
            "$": "https://api.elsevier.com/content/object/eid/1-s2.0-S0306261920308369-si181.svg?httpAccept=%2A%2F%2A",
            "@multimediatype": "Scalable Vector Graphics file",
            "@type": "ALTIMG",
            "@size": "1706",
            "@ref": "si181",
            "@mimetype": "image/svg+xml"
        },
        {
            "@category": "thumbnail",
            "@_fa": "true",
            "$": "https://api.elsevier.com/content/object/eid/1-s2.0-S0306261920308369-si182.svg?httpAccept=%2A%2F%2A",
            "@multimediatype": "Scalable Vector Graphics file",
            "@type": "ALTIMG",
            "@size": "1706",
            "@ref": "si182",
            "@mimetype": "image/svg+xml"
        },
        {
            "@category": "thumbnail",
            "@_fa": "true",
            "$": "https://api.elsevier.com/content/object/eid/1-s2.0-S0306261920308369-si183.svg?httpAccept=%2A%2F%2A",
            "@multimediatype": "Scalable Vector Graphics file",
            "@type": "ALTIMG",
            "@size": "6004",
            "@ref": "si183",
            "@mimetype": "image/svg+xml"
        },
        {
            "@category": "thumbnail",
            "@_fa": "true",
            "$": "https://api.elsevier.com/content/object/eid/1-s2.0-S0306261920308369-si184.svg?httpAccept=%2A%2F%2A",
            "@multimediatype": "Scalable Vector Graphics file",
            "@type": "ALTIMG",
            "@size": "3269",
            "@ref": "si184",
            "@mimetype": "image/svg+xml"
        },
        {
            "@category": "thumbnail",
            "@_fa": "true",
            "$": "https://api.elsevier.com/content/object/eid/1-s2.0-S0306261920308369-si185.svg?httpAccept=%2A%2F%2A",
            "@multimediatype": "Scalable Vector Graphics file",
            "@type": "ALTIMG",
            "@size": "11158",
            "@ref": "si185",
            "@mimetype": "image/svg+xml"
        },
        {
            "@category": "thumbnail",
            "@_fa": "true",
            "$": "https://api.elsevier.com/content/object/eid/1-s2.0-S0306261920308369-si186.svg?httpAccept=%2A%2F%2A",
            "@multimediatype": "Scalable Vector Graphics file",
            "@type": "ALTIMG",
            "@size": "5066",
            "@ref": "si186",
            "@mimetype": "image/svg+xml"
        },
        {
            "@category": "thumbnail",
            "@_fa": "true",
            "$": "https://api.elsevier.com/content/object/eid/1-s2.0-S0306261920308369-si187.svg?httpAccept=%2A%2F%2A",
            "@multimediatype": "Scalable Vector Graphics file",
            "@type": "ALTIMG",
            "@size": "4260",
            "@ref": "si187",
            "@mimetype": "image/svg+xml"
        },
        {
            "@category": "thumbnail",
            "@_fa": "true",
            "$": "https://api.elsevier.com/content/object/eid/1-s2.0-S0306261920308369-si188.svg?httpAccept=%2A%2F%2A",
            "@multimediatype": "Scalable Vector Graphics file",
            "@type": "ALTIMG",
            "@size": "2331",
            "@ref": "si188",
            "@mimetype": "image/svg+xml"
        },
        {
            "@category": "thumbnail",
            "@_fa": "true",
            "$": "https://api.elsevier.com/content/object/eid/1-s2.0-S0306261920308369-si189.svg?httpAccept=%2A%2F%2A",
            "@multimediatype": "Scalable Vector Graphics file",
            "@type": "ALTIMG",
            "@size": "2331",
            "@ref": "si189",
            "@mimetype": "image/svg+xml"
        },
        {
            "@category": "thumbnail",
            "@_fa": "true",
            "$": "https://api.elsevier.com/content/object/eid/1-s2.0-S0306261920308369-si19.svg?httpAccept=%2A%2F%2A",
            "@multimediatype": "Scalable Vector Graphics file",
            "@type": "ALTIMG",
            "@size": "2330",
            "@ref": "si19",
            "@mimetype": "image/svg+xml"
        },
        {
            "@category": "thumbnail",
            "@_fa": "true",
            "$": "https://api.elsevier.com/content/object/eid/1-s2.0-S0306261920308369-si190.svg?httpAccept=%2A%2F%2A",
            "@multimediatype": "Scalable Vector Graphics file",
            "@type": "ALTIMG",
            "@size": "2188",
            "@ref": "si190",
            "@mimetype": "image/svg+xml"
        },
        {
            "@category": "thumbnail",
            "@_fa": "true",
            "$": "https://api.elsevier.com/content/object/eid/1-s2.0-S0306261920308369-si191.svg?httpAccept=%2A%2F%2A",
            "@multimediatype": "Scalable Vector Graphics file",
            "@type": "ALTIMG",
            "@size": "6888",
            "@ref": "si191",
            "@mimetype": "image/svg+xml"
        },
        {
            "@category": "thumbnail",
            "@_fa": "true",
            "$": "https://api.elsevier.com/content/object/eid/1-s2.0-S0306261920308369-si192.svg?httpAccept=%2A%2F%2A",
            "@multimediatype": "Scalable Vector Graphics file",
            "@type": "ALTIMG",
            "@size": "3848",
            "@ref": "si192",
            "@mimetype": "image/svg+xml"
        },
        {
            "@category": "thumbnail",
            "@_fa": "true",
            "$": "https://api.elsevier.com/content/object/eid/1-s2.0-S0306261920308369-si193.svg?httpAccept=%2A%2F%2A",
            "@multimediatype": "Scalable Vector Graphics file",
            "@type": "ALTIMG",
            "@size": "6888",
            "@ref": "si193",
            "@mimetype": "image/svg+xml"
        },
        {
            "@category": "thumbnail",
            "@_fa": "true",
            "$": "https://api.elsevier.com/content/object/eid/1-s2.0-S0306261920308369-si194.svg?httpAccept=%2A%2F%2A",
            "@multimediatype": "Scalable Vector Graphics file",
            "@type": "ALTIMG",
            "@size": "5251",
            "@ref": "si194",
            "@mimetype": "image/svg+xml"
        },
        {
            "@category": "thumbnail",
            "@_fa": "true",
            "$": "https://api.elsevier.com/content/object/eid/1-s2.0-S0306261920308369-si2.svg?httpAccept=%2A%2F%2A",
            "@multimediatype": "Scalable Vector Graphics file",
            "@type": "ALTIMG",
            "@size": "2186",
            "@ref": "si2",
            "@mimetype": "image/svg+xml"
        },
        {
            "@category": "thumbnail",
            "@_fa": "true",
            "$": "https://api.elsevier.com/content/object/eid/1-s2.0-S0306261920308369-si20.svg?httpAccept=%2A%2F%2A",
            "@multimediatype": "Scalable Vector Graphics file",
            "@type": "ALTIMG",
            "@size": "2187",
            "@ref": "si20",
            "@mimetype": "image/svg+xml"
        },
        {
            "@category": "thumbnail",
            "@_fa": "true",
            "$": "https://api.elsevier.com/content/object/eid/1-s2.0-S0306261920308369-si21.svg?httpAccept=%2A%2F%2A",
            "@multimediatype": "Scalable Vector Graphics file",
            "@type": "ALTIMG",
            "@size": "2331",
            "@ref": "si21",
            "@mimetype": "image/svg+xml"
        },
        {
            "@category": "thumbnail",
            "@_fa": "true",
            "$": "https://api.elsevier.com/content/object/eid/1-s2.0-S0306261920308369-si22.svg?httpAccept=%2A%2F%2A",
            "@multimediatype": "Scalable Vector Graphics file",
            "@type": "ALTIMG",
            "@size": "2188",
            "@ref": "si22",
            "@mimetype": "image/svg+xml"
        },
        {
            "@category": "thumbnail",
            "@_fa": "true",
            "$": "https://api.elsevier.com/content/object/eid/1-s2.0-S0306261920308369-si23.svg?httpAccept=%2A%2F%2A",
            "@multimediatype": "Scalable Vector Graphics file",
            "@type": "ALTIMG",
            "@size": "2331",
            "@ref": "si23",
            "@mimetype": "image/svg+xml"
        },
        {
            "@category": "thumbnail",
            "@_fa": "true",
            "$": "https://api.elsevier.com/content/object/eid/1-s2.0-S0306261920308369-si24.svg?httpAccept=%2A%2F%2A",
            "@multimediatype": "Scalable Vector Graphics file",
            "@type": "ALTIMG",
            "@size": "4404",
            "@ref": "si24",
            "@mimetype": "image/svg+xml"
        },
        {
            "@category": "thumbnail",
            "@_fa": "true",
            "$": "https://api.elsevier.com/content/object/eid/1-s2.0-S0306261920308369-si25.svg?httpAccept=%2A%2F%2A",
            "@multimediatype": "Scalable Vector Graphics file",
            "@type": "ALTIMG",
            "@size": "3074",
            "@ref": "si25",
            "@mimetype": "image/svg+xml"
        },
        {
            "@category": "thumbnail",
            "@_fa": "true",
            "$": "https://api.elsevier.com/content/object/eid/1-s2.0-S0306261920308369-si26.svg?httpAccept=%2A%2F%2A",
            "@multimediatype": "Scalable Vector Graphics file",
            "@type": "ALTIMG",
            "@size": "3607",
            "@ref": "si26",
            "@mimetype": "image/svg+xml"
        },
        {
            "@category": "thumbnail",
            "@_fa": "true",
            "$": "https://api.elsevier.com/content/object/eid/1-s2.0-S0306261920308369-si27.svg?httpAccept=%2A%2F%2A",
            "@multimediatype": "Scalable Vector Graphics file",
            "@type": "ALTIMG",
            "@size": "5402",
            "@ref": "si27",
            "@mimetype": "image/svg+xml"
        },
        {
            "@category": "thumbnail",
            "@_fa": "true",
            "$": "https://api.elsevier.com/content/object/eid/1-s2.0-S0306261920308369-si28.svg?httpAccept=%2A%2F%2A",
            "@multimediatype": "Scalable Vector Graphics file",
            "@type": "ALTIMG",
            "@size": "2615",
            "@ref": "si28",
            "@mimetype": "image/svg+xml"
        },
        {
            "@category": "thumbnail",
            "@_fa": "true",
            "$": "https://api.elsevier.com/content/object/eid/1-s2.0-S0306261920308369-si29.svg?httpAccept=%2A%2F%2A",
            "@multimediatype": "Scalable Vector Graphics file",
            "@type": "ALTIMG",
            "@size": "2726",
            "@ref": "si29",
            "@mimetype": "image/svg+xml"
        },
        {
            "@category": "thumbnail",
            "@_fa": "true",
            "$": "https://api.elsevier.com/content/object/eid/1-s2.0-S0306261920308369-si3.svg?httpAccept=%2A%2F%2A",
            "@multimediatype": "Scalable Vector Graphics file",
            "@type": "ALTIMG",
            "@size": "2330",
            "@ref": "si3",
            "@mimetype": "image/svg+xml"
        },
        {
            "@category": "thumbnail",
            "@_fa": "true",
            "$": "https://api.elsevier.com/content/object/eid/1-s2.0-S0306261920308369-si30.svg?httpAccept=%2A%2F%2A",
            "@multimediatype": "Scalable Vector Graphics file",
            "@type": "ALTIMG",
            "@size": "2905",
            "@ref": "si30",
            "@mimetype": "image/svg+xml"
        },
        {
            "@category": "thumbnail",
            "@_fa": "true",
            "$": "https://api.elsevier.com/content/object/eid/1-s2.0-S0306261920308369-si31.svg?httpAccept=%2A%2F%2A",
            "@multimediatype": "Scalable Vector Graphics file",
            "@type": "ALTIMG",
            "@size": "4958",
            "@ref": "si31",
            "@mimetype": "image/svg+xml"
        },
        {
            "@category": "thumbnail",
            "@_fa": "true",
            "$": "https://api.elsevier.com/content/object/eid/1-s2.0-S0306261920308369-si32.svg?httpAccept=%2A%2F%2A",
            "@multimediatype": "Scalable Vector Graphics file",
            "@type": "ALTIMG",
            "@size": "4193",
            "@ref": "si32",
            "@mimetype": "image/svg+xml"
        },
        {
            "@category": "thumbnail",
            "@_fa": "true",
            "$": "https://api.elsevier.com/content/object/eid/1-s2.0-S0306261920308369-si33.svg?httpAccept=%2A%2F%2A",
            "@multimediatype": "Scalable Vector Graphics file",
            "@type": "ALTIMG",
            "@size": "4858",
            "@ref": "si33",
            "@mimetype": "image/svg+xml"
        },
        {
            "@category": "thumbnail",
            "@_fa": "true",
            "$": "https://api.elsevier.com/content/object/eid/1-s2.0-S0306261920308369-si34.svg?httpAccept=%2A%2F%2A",
            "@multimediatype": "Scalable Vector Graphics file",
            "@type": "ALTIMG",
            "@size": "4182",
            "@ref": "si34",
            "@mimetype": "image/svg+xml"
        },
        {
            "@category": "thumbnail",
            "@_fa": "true",
            "$": "https://api.elsevier.com/content/object/eid/1-s2.0-S0306261920308369-si35.svg?httpAccept=%2A%2F%2A",
            "@multimediatype": "Scalable Vector Graphics file",
            "@type": "ALTIMG",
            "@size": "4193",
            "@ref": "si35",
            "@mimetype": "image/svg+xml"
        },
        {
            "@category": "thumbnail",
            "@_fa": "true",
            "$": "https://api.elsevier.com/content/object/eid/1-s2.0-S0306261920308369-si36.svg?httpAccept=%2A%2F%2A",
            "@multimediatype": "Scalable Vector Graphics file",
            "@type": "ALTIMG",
            "@size": "4627",
            "@ref": "si36",
            "@mimetype": "image/svg+xml"
        },
        {
            "@category": "thumbnail",
            "@_fa": "true",
            "$": "https://api.elsevier.com/content/object/eid/1-s2.0-S0306261920308369-si37.svg?httpAccept=%2A%2F%2A",
            "@multimediatype": "Scalable Vector Graphics file",
            "@type": "ALTIMG",
            "@size": "3132",
            "@ref": "si37",
            "@mimetype": "image/svg+xml"
        },
        {
            "@category": "thumbnail",
            "@_fa": "true",
            "$": "https://api.elsevier.com/content/object/eid/1-s2.0-S0306261920308369-si38.svg?httpAccept=%2A%2F%2A",
            "@multimediatype": "Scalable Vector Graphics file",
            "@type": "ALTIMG",
            "@size": "3459",
            "@ref": "si38",
            "@mimetype": "image/svg+xml"
        },
        {
            "@category": "thumbnail",
            "@_fa": "true",
            "$": "https://api.elsevier.com/content/object/eid/1-s2.0-S0306261920308369-si39.svg?httpAccept=%2A%2F%2A",
            "@multimediatype": "Scalable Vector Graphics file",
            "@type": "ALTIMG",
            "@size": "5496",
            "@ref": "si39",
            "@mimetype": "image/svg+xml"
        },
        {
            "@category": "thumbnail",
            "@_fa": "true",
            "$": "https://api.elsevier.com/content/object/eid/1-s2.0-S0306261920308369-si4.svg?httpAccept=%2A%2F%2A",
            "@multimediatype": "Scalable Vector Graphics file",
            "@type": "ALTIMG",
            "@size": "2187",
            "@ref": "si4",
            "@mimetype": "image/svg+xml"
        },
        {
            "@category": "thumbnail",
            "@_fa": "true",
            "$": "https://api.elsevier.com/content/object/eid/1-s2.0-S0306261920308369-si40.svg?httpAccept=%2A%2F%2A",
            "@multimediatype": "Scalable Vector Graphics file",
            "@type": "ALTIMG",
            "@size": "4559",
            "@ref": "si40",
            "@mimetype": "image/svg+xml"
        },
        {
            "@category": "thumbnail",
            "@_fa": "true",
            "$": "https://api.elsevier.com/content/object/eid/1-s2.0-S0306261920308369-si41.svg?httpAccept=%2A%2F%2A",
            "@multimediatype": "Scalable Vector Graphics file",
            "@type": "ALTIMG",
            "@size": "2620",
            "@ref": "si41",
            "@mimetype": "image/svg+xml"
        },
        {
            "@category": "thumbnail",
            "@_fa": "true",
            "$": "https://api.elsevier.com/content/object/eid/1-s2.0-S0306261920308369-si42.svg?httpAccept=%2A%2F%2A",
            "@multimediatype": "Scalable Vector Graphics file",
            "@type": "ALTIMG",
            "@size": "2733",
            "@ref": "si42",
            "@mimetype": "image/svg+xml"
        },
        {
            "@category": "thumbnail",
            "@_fa": "true",
            "$": "https://api.elsevier.com/content/object/eid/1-s2.0-S0306261920308369-si43.svg?httpAccept=%2A%2F%2A",
            "@multimediatype": "Scalable Vector Graphics file",
            "@type": "ALTIMG",
            "@size": "1769",
            "@ref": "si43",
            "@mimetype": "image/svg+xml"
        },
        {
            "@category": "thumbnail",
            "@_fa": "true",
            "$": "https://api.elsevier.com/content/object/eid/1-s2.0-S0306261920308369-si44.svg?httpAccept=%2A%2F%2A",
            "@multimediatype": "Scalable Vector Graphics file",
            "@type": "ALTIMG",
            "@size": "6452",
            "@ref": "si44",
            "@mimetype": "image/svg+xml"
        },
        {
            "@category": "thumbnail",
            "@_fa": "true",
            "$": "https://api.elsevier.com/content/object/eid/1-s2.0-S0306261920308369-si45.svg?httpAccept=%2A%2F%2A",
            "@multimediatype": "Scalable Vector Graphics file",
            "@type": "ALTIMG",
            "@size": "7113",
            "@ref": "si45",
            "@mimetype": "image/svg+xml"
        },
        {
            "@category": "thumbnail",
            "@_fa": "true",
            "$": "https://api.elsevier.com/content/object/eid/1-s2.0-S0306261920308369-si46.svg?httpAccept=%2A%2F%2A",
            "@multimediatype": "Scalable Vector Graphics file",
            "@type": "ALTIMG",
            "@size": "4182",
            "@ref": "si46",
            "@mimetype": "image/svg+xml"
        },
        {
            "@category": "thumbnail",
            "@_fa": "true",
            "$": "https://api.elsevier.com/content/object/eid/1-s2.0-S0306261920308369-si47.svg?httpAccept=%2A%2F%2A",
            "@multimediatype": "Scalable Vector Graphics file",
            "@type": "ALTIMG",
            "@size": "4193",
            "@ref": "si47",
            "@mimetype": "image/svg+xml"
        },
        {
            "@category": "thumbnail",
            "@_fa": "true",
            "$": "https://api.elsevier.com/content/object/eid/1-s2.0-S0306261920308369-si48.svg?httpAccept=%2A%2F%2A",
            "@multimediatype": "Scalable Vector Graphics file",
            "@type": "ALTIMG",
            "@size": "4230",
            "@ref": "si48",
            "@mimetype": "image/svg+xml"
        },
        {
            "@category": "thumbnail",
            "@_fa": "true",
            "$": "https://api.elsevier.com/content/object/eid/1-s2.0-S0306261920308369-si49.svg?httpAccept=%2A%2F%2A",
            "@multimediatype": "Scalable Vector Graphics file",
            "@type": "ALTIMG",
            "@size": "2577",
            "@ref": "si49",
            "@mimetype": "image/svg+xml"
        },
        {
            "@category": "thumbnail",
            "@_fa": "true",
            "$": "https://api.elsevier.com/content/object/eid/1-s2.0-S0306261920308369-si5.svg?httpAccept=%2A%2F%2A",
            "@multimediatype": "Scalable Vector Graphics file",
            "@type": "ALTIMG",
            "@size": "2330",
            "@ref": "si5",
            "@mimetype": "image/svg+xml"
        },
        {
            "@category": "thumbnail",
            "@_fa": "true",
            "$": "https://api.elsevier.com/content/object/eid/1-s2.0-S0306261920308369-si50.svg?httpAccept=%2A%2F%2A",
            "@multimediatype": "Scalable Vector Graphics file",
            "@type": "ALTIMG",
            "@size": "2173",
            "@ref": "si50",
            "@mimetype": "image/svg+xml"
        },
        {
            "@category": "thumbnail",
            "@_fa": "true",
            "$": "https://api.elsevier.com/content/object/eid/1-s2.0-S0306261920308369-si51.svg?httpAccept=%2A%2F%2A",
            "@multimediatype": "Scalable Vector Graphics file",
            "@type": "ALTIMG",
            "@size": "5748",
            "@ref": "si51",
            "@mimetype": "image/svg+xml"
        },
        {
            "@category": "thumbnail",
            "@_fa": "true",
            "$": "https://api.elsevier.com/content/object/eid/1-s2.0-S0306261920308369-si52.svg?httpAccept=%2A%2F%2A",
            "@multimediatype": "Scalable Vector Graphics file",
            "@type": "ALTIMG",
            "@size": "4193",
            "@ref": "si52",
            "@mimetype": "image/svg+xml"
        },
        {
            "@category": "thumbnail",
            "@_fa": "true",
            "$": "https://api.elsevier.com/content/object/eid/1-s2.0-S0306261920308369-si53.svg?httpAccept=%2A%2F%2A",
            "@multimediatype": "Scalable Vector Graphics file",
            "@type": "ALTIMG",
            "@size": "4230",
            "@ref": "si53",
            "@mimetype": "image/svg+xml"
        },
        {
            "@category": "thumbnail",
            "@_fa": "true",
            "$": "https://api.elsevier.com/content/object/eid/1-s2.0-S0306261920308369-si54.svg?httpAccept=%2A%2F%2A",
            "@multimediatype": "Scalable Vector Graphics file",
            "@type": "ALTIMG",
            "@size": "2983",
            "@ref": "si54",
            "@mimetype": "image/svg+xml"
        },
        {
            "@category": "thumbnail",
            "@_fa": "true",
            "$": "https://api.elsevier.com/content/object/eid/1-s2.0-S0306261920308369-si55.svg?httpAccept=%2A%2F%2A",
            "@multimediatype": "Scalable Vector Graphics file",
            "@type": "ALTIMG",
            "@size": "6128",
            "@ref": "si55",
            "@mimetype": "image/svg+xml"
        },
        {
            "@category": "thumbnail",
            "@_fa": "true",
            "$": "https://api.elsevier.com/content/object/eid/1-s2.0-S0306261920308369-si56.svg?httpAccept=%2A%2F%2A",
            "@multimediatype": "Scalable Vector Graphics file",
            "@type": "ALTIMG",
            "@size": "2188",
            "@ref": "si56",
            "@mimetype": "image/svg+xml"
        },
        {
            "@category": "thumbnail",
            "@_fa": "true",
            "$": "https://api.elsevier.com/content/object/eid/1-s2.0-S0306261920308369-si57.svg?httpAccept=%2A%2F%2A",
            "@multimediatype": "Scalable Vector Graphics file",
            "@type": "ALTIMG",
            "@size": "2331",
            "@ref": "si57",
            "@mimetype": "image/svg+xml"
        },
        {
            "@category": "thumbnail",
            "@_fa": "true",
            "$": "https://api.elsevier.com/content/object/eid/1-s2.0-S0306261920308369-si58.svg?httpAccept=%2A%2F%2A",
            "@multimediatype": "Scalable Vector Graphics file",
            "@type": "ALTIMG",
            "@size": "2188",
            "@ref": "si58",
            "@mimetype": "image/svg+xml"
        },
        {
            "@category": "thumbnail",
            "@_fa": "true",
            "$": "https://api.elsevier.com/content/object/eid/1-s2.0-S0306261920308369-si59.svg?httpAccept=%2A%2F%2A",
            "@multimediatype": "Scalable Vector Graphics file",
            "@type": "ALTIMG",
            "@size": "2188",
            "@ref": "si59",
            "@mimetype": "image/svg+xml"
        },
        {
            "@category": "thumbnail",
            "@_fa": "true",
            "$": "https://api.elsevier.com/content/object/eid/1-s2.0-S0306261920308369-si6.svg?httpAccept=%2A%2F%2A",
            "@multimediatype": "Scalable Vector Graphics file",
            "@type": "ALTIMG",
            "@size": "2187",
            "@ref": "si6",
            "@mimetype": "image/svg+xml"
        },
        {
            "@category": "thumbnail",
            "@_fa": "true",
            "$": "https://api.elsevier.com/content/object/eid/1-s2.0-S0306261920308369-si60.svg?httpAccept=%2A%2F%2A",
            "@multimediatype": "Scalable Vector Graphics file",
            "@type": "ALTIMG",
            "@size": "2331",
            "@ref": "si60",
            "@mimetype": "image/svg+xml"
        },
        {
            "@category": "thumbnail",
            "@_fa": "true",
            "$": "https://api.elsevier.com/content/object/eid/1-s2.0-S0306261920308369-si61.svg?httpAccept=%2A%2F%2A",
            "@multimediatype": "Scalable Vector Graphics file",
            "@type": "ALTIMG",
            "@size": "2188",
            "@ref": "si61",
            "@mimetype": "image/svg+xml"
        },
        {
            "@category": "thumbnail",
            "@_fa": "true",
            "$": "https://api.elsevier.com/content/object/eid/1-s2.0-S0306261920308369-si62.svg?httpAccept=%2A%2F%2A",
            "@multimediatype": "Scalable Vector Graphics file",
            "@type": "ALTIMG",
            "@size": "2331",
            "@ref": "si62",
            "@mimetype": "image/svg+xml"
        },
        {
            "@category": "thumbnail",
            "@_fa": "true",
            "$": "https://api.elsevier.com/content/object/eid/1-s2.0-S0306261920308369-si63.svg?httpAccept=%2A%2F%2A",
            "@multimediatype": "Scalable Vector Graphics file",
            "@type": "ALTIMG",
            "@size": "2188",
            "@ref": "si63",
            "@mimetype": "image/svg+xml"
        },
        {
            "@category": "thumbnail",
            "@_fa": "true",
            "$": "https://api.elsevier.com/content/object/eid/1-s2.0-S0306261920308369-si64.svg?httpAccept=%2A%2F%2A",
            "@multimediatype": "Scalable Vector Graphics file",
            "@type": "ALTIMG",
            "@size": "2188",
            "@ref": "si64",
            "@mimetype": "image/svg+xml"
        },
        {
            "@category": "thumbnail",
            "@_fa": "true",
            "$": "https://api.elsevier.com/content/object/eid/1-s2.0-S0306261920308369-si65.svg?httpAccept=%2A%2F%2A",
            "@multimediatype": "Scalable Vector Graphics file",
            "@type": "ALTIMG",
            "@size": "5496",
            "@ref": "si65",
            "@mimetype": "image/svg+xml"
        },
        {
            "@category": "thumbnail",
            "@_fa": "true",
            "$": "https://api.elsevier.com/content/object/eid/1-s2.0-S0306261920308369-si66.svg?httpAccept=%2A%2F%2A",
            "@multimediatype": "Scalable Vector Graphics file",
            "@type": "ALTIMG",
            "@size": "2551",
            "@ref": "si66",
            "@mimetype": "image/svg+xml"
        },
        {
            "@category": "thumbnail",
            "@_fa": "true",
            "$": "https://api.elsevier.com/content/object/eid/1-s2.0-S0306261920308369-si67.svg?httpAccept=%2A%2F%2A",
            "@multimediatype": "Scalable Vector Graphics file",
            "@type": "ALTIMG",
            "@size": "4559",
            "@ref": "si67",
            "@mimetype": "image/svg+xml"
        },
        {
            "@category": "thumbnail",
            "@_fa": "true",
            "$": "https://api.elsevier.com/content/object/eid/1-s2.0-S0306261920308369-si68.svg?httpAccept=%2A%2F%2A",
            "@multimediatype": "Scalable Vector Graphics file",
            "@type": "ALTIMG",
            "@size": "5496",
            "@ref": "si68",
            "@mimetype": "image/svg+xml"
        },
        {
            "@category": "thumbnail",
            "@_fa": "true",
            "$": "https://api.elsevier.com/content/object/eid/1-s2.0-S0306261920308369-si69.svg?httpAccept=%2A%2F%2A",
            "@multimediatype": "Scalable Vector Graphics file",
            "@type": "ALTIMG",
            "@size": "2173",
            "@ref": "si69",
            "@mimetype": "image/svg+xml"
        },
        {
            "@category": "thumbnail",
            "@_fa": "true",
            "$": "https://api.elsevier.com/content/object/eid/1-s2.0-S0306261920308369-si7.svg?httpAccept=%2A%2F%2A",
            "@multimediatype": "Scalable Vector Graphics file",
            "@type": "ALTIMG",
            "@size": "2330",
            "@ref": "si7",
            "@mimetype": "image/svg+xml"
        },
        {
            "@category": "thumbnail",
            "@_fa": "true",
            "$": "https://api.elsevier.com/content/object/eid/1-s2.0-S0306261920308369-si70.svg?httpAccept=%2A%2F%2A",
            "@multimediatype": "Scalable Vector Graphics file",
            "@type": "ALTIMG",
            "@size": "3288",
            "@ref": "si70",
            "@mimetype": "image/svg+xml"
        },
        {
            "@category": "thumbnail",
            "@_fa": "true",
            "$": "https://api.elsevier.com/content/object/eid/1-s2.0-S0306261920308369-si71.svg?httpAccept=%2A%2F%2A",
            "@multimediatype": "Scalable Vector Graphics file",
            "@type": "ALTIMG",
            "@size": "3039",
            "@ref": "si71",
            "@mimetype": "image/svg+xml"
        },
        {
            "@category": "thumbnail",
            "@_fa": "true",
            "$": "https://api.elsevier.com/content/object/eid/1-s2.0-S0306261920308369-si72.svg?httpAccept=%2A%2F%2A",
            "@multimediatype": "Scalable Vector Graphics file",
            "@type": "ALTIMG",
            "@size": "3132",
            "@ref": "si72",
            "@mimetype": "image/svg+xml"
        },
        {
            "@category": "thumbnail",
            "@_fa": "true",
            "$": "https://api.elsevier.com/content/object/eid/1-s2.0-S0306261920308369-si73.svg?httpAccept=%2A%2F%2A",
            "@multimediatype": "Scalable Vector Graphics file",
            "@type": "ALTIMG",
            "@size": "3459",
            "@ref": "si73",
            "@mimetype": "image/svg+xml"
        },
        {
            "@category": "thumbnail",
            "@_fa": "true",
            "$": "https://api.elsevier.com/content/object/eid/1-s2.0-S0306261920308369-si74.svg?httpAccept=%2A%2F%2A",
            "@multimediatype": "Scalable Vector Graphics file",
            "@type": "ALTIMG",
            "@size": "2975",
            "@ref": "si74",
            "@mimetype": "image/svg+xml"
        },
        {
            "@category": "thumbnail",
            "@_fa": "true",
            "$": "https://api.elsevier.com/content/object/eid/1-s2.0-S0306261920308369-si75.svg?httpAccept=%2A%2F%2A",
            "@multimediatype": "Scalable Vector Graphics file",
            "@type": "ALTIMG",
            "@size": "1923",
            "@ref": "si75",
            "@mimetype": "image/svg+xml"
        },
        {
            "@category": "thumbnail",
            "@_fa": "true",
            "$": "https://api.elsevier.com/content/object/eid/1-s2.0-S0306261920308369-si76.svg?httpAccept=%2A%2F%2A",
            "@multimediatype": "Scalable Vector Graphics file",
            "@type": "ALTIMG",
            "@size": "2975",
            "@ref": "si76",
            "@mimetype": "image/svg+xml"
        },
        {
            "@category": "thumbnail",
            "@_fa": "true",
            "$": "https://api.elsevier.com/content/object/eid/1-s2.0-S0306261920308369-si77.svg?httpAccept=%2A%2F%2A",
            "@multimediatype": "Scalable Vector Graphics file",
            "@type": "ALTIMG",
            "@size": "3074",
            "@ref": "si77",
            "@mimetype": "image/svg+xml"
        },
        {
            "@category": "thumbnail",
            "@_fa": "true",
            "$": "https://api.elsevier.com/content/object/eid/1-s2.0-S0306261920308369-si78.svg?httpAccept=%2A%2F%2A",
            "@multimediatype": "Scalable Vector Graphics file",
            "@type": "ALTIMG",
            "@size": "8113",
            "@ref": "si78",
            "@mimetype": "image/svg+xml"
        },
        {
            "@category": "thumbnail",
            "@_fa": "true",
            "$": "https://api.elsevier.com/content/object/eid/1-s2.0-S0306261920308369-si79.svg?httpAccept=%2A%2F%2A",
            "@multimediatype": "Scalable Vector Graphics file",
            "@type": "ALTIMG",
            "@size": "1823",
            "@ref": "si79",
            "@mimetype": "image/svg+xml"
        },
        {
            "@category": "thumbnail",
            "@_fa": "true",
            "$": "https://api.elsevier.com/content/object/eid/1-s2.0-S0306261920308369-si8.svg?httpAccept=%2A%2F%2A",
            "@multimediatype": "Scalable Vector Graphics file",
            "@type": "ALTIMG",
            "@size": "2187",
            "@ref": "si8",
            "@mimetype": "image/svg+xml"
        },
        {
            "@category": "thumbnail",
            "@_fa": "true",
            "$": "https://api.elsevier.com/content/object/eid/1-s2.0-S0306261920308369-si80.svg?httpAccept=%2A%2F%2A",
            "@multimediatype": "Scalable Vector Graphics file",
            "@type": "ALTIMG",
            "@size": "4289",
            "@ref": "si80",
            "@mimetype": "image/svg+xml"
        },
        {
            "@category": "thumbnail",
            "@_fa": "true",
            "$": "https://api.elsevier.com/content/object/eid/1-s2.0-S0306261920308369-si81.svg?httpAccept=%2A%2F%2A",
            "@multimediatype": "Scalable Vector Graphics file",
            "@type": "ALTIMG",
            "@size": "4180",
            "@ref": "si81",
            "@mimetype": "image/svg+xml"
        },
        {
            "@category": "thumbnail",
            "@_fa": "true",
            "$": "https://api.elsevier.com/content/object/eid/1-s2.0-S0306261920308369-si82.svg?httpAccept=%2A%2F%2A",
            "@multimediatype": "Scalable Vector Graphics file",
            "@type": "ALTIMG",
            "@size": "3694",
            "@ref": "si82",
            "@mimetype": "image/svg+xml"
        },
        {
            "@category": "thumbnail",
            "@_fa": "true",
            "$": "https://api.elsevier.com/content/object/eid/1-s2.0-S0306261920308369-si83.svg?httpAccept=%2A%2F%2A",
            "@multimediatype": "Scalable Vector Graphics file",
            "@type": "ALTIMG",
            "@size": "5548",
            "@ref": "si83",
            "@mimetype": "image/svg+xml"
        },
        {
            "@category": "thumbnail",
            "@_fa": "true",
            "$": "https://api.elsevier.com/content/object/eid/1-s2.0-S0306261920308369-si84.svg?httpAccept=%2A%2F%2A",
            "@multimediatype": "Scalable Vector Graphics file",
            "@type": "ALTIMG",
            "@size": "4752",
            "@ref": "si84",
            "@mimetype": "image/svg+xml"
        },
        {
            "@category": "thumbnail",
            "@_fa": "true",
            "$": "https://api.elsevier.com/content/object/eid/1-s2.0-S0306261920308369-si85.svg?httpAccept=%2A%2F%2A",
            "@multimediatype": "Scalable Vector Graphics file",
            "@type": "ALTIMG",
            "@size": "4115",
            "@ref": "si85",
            "@mimetype": "image/svg+xml"
        },
        {
            "@category": "thumbnail",
            "@_fa": "true",
            "$": "https://api.elsevier.com/content/object/eid/1-s2.0-S0306261920308369-si86.svg?httpAccept=%2A%2F%2A",
            "@multimediatype": "Scalable Vector Graphics file",
            "@type": "ALTIMG",
            "@size": "3694",
            "@ref": "si86",
            "@mimetype": "image/svg+xml"
        },
        {
            "@category": "thumbnail",
            "@_fa": "true",
            "$": "https://api.elsevier.com/content/object/eid/1-s2.0-S0306261920308369-si87.svg?httpAccept=%2A%2F%2A",
            "@multimediatype": "Scalable Vector Graphics file",
            "@type": "ALTIMG",
            "@size": "8600",
            "@ref": "si87",
            "@mimetype": "image/svg+xml"
        },
        {
            "@category": "thumbnail",
            "@_fa": "true",
            "$": "https://api.elsevier.com/content/object/eid/1-s2.0-S0306261920308369-si88.svg?httpAccept=%2A%2F%2A",
            "@multimediatype": "Scalable Vector Graphics file",
            "@type": "ALTIMG",
            "@size": "7090",
            "@ref": "si88",
            "@mimetype": "image/svg+xml"
        },
        {
            "@category": "thumbnail",
            "@_fa": "true",
            "$": "https://api.elsevier.com/content/object/eid/1-s2.0-S0306261920308369-si89.svg?httpAccept=%2A%2F%2A",
            "@multimediatype": "Scalable Vector Graphics file",
            "@type": "ALTIMG",
            "@size": "12981",
            "@ref": "si89",
            "@mimetype": "image/svg+xml"
        },
        {
            "@category": "thumbnail",
            "@_fa": "true",
            "$": "https://api.elsevier.com/content/object/eid/1-s2.0-S0306261920308369-si9.svg?httpAccept=%2A%2F%2A",
            "@multimediatype": "Scalable Vector Graphics file",
            "@type": "ALTIMG",
            "@size": "2330",
            "@ref": "si9",
            "@mimetype": "image/svg+xml"
        },
        {
            "@category": "thumbnail",
            "@_fa": "true",
            "$": "https://api.elsevier.com/content/object/eid/1-s2.0-S0306261920308369-si90.svg?httpAccept=%2A%2F%2A",
            "@multimediatype": "Scalable Vector Graphics file",
            "@type": "ALTIMG",
            "@size": "4286",
            "@ref": "si90",
            "@mimetype": "image/svg+xml"
        },
        {
            "@category": "thumbnail",
            "@_fa": "true",
            "$": "https://api.elsevier.com/content/object/eid/1-s2.0-S0306261920308369-si91.svg?httpAccept=%2A%2F%2A",
            "@multimediatype": "Scalable Vector Graphics file",
            "@type": "ALTIMG",
            "@size": "2921",
            "@ref": "si91",
            "@mimetype": "image/svg+xml"
        },
        {
            "@category": "thumbnail",
            "@_fa": "true",
            "$": "https://api.elsevier.com/content/object/eid/1-s2.0-S0306261920308369-si92.svg?httpAccept=%2A%2F%2A",
            "@multimediatype": "Scalable Vector Graphics file",
            "@type": "ALTIMG",
            "@size": "3074",
            "@ref": "si92",
            "@mimetype": "image/svg+xml"
        },
        {
            "@category": "thumbnail",
            "@_fa": "true",
            "$": "https://api.elsevier.com/content/object/eid/1-s2.0-S0306261920308369-si93.svg?httpAccept=%2A%2F%2A",
            "@multimediatype": "Scalable Vector Graphics file",
            "@type": "ALTIMG",
            "@size": "4492",
            "@ref": "si93",
            "@mimetype": "image/svg+xml"
        },
        {
            "@category": "thumbnail",
            "@_fa": "true",
            "$": "https://api.elsevier.com/content/object/eid/1-s2.0-S0306261920308369-si94.svg?httpAccept=%2A%2F%2A",
            "@multimediatype": "Scalable Vector Graphics file",
            "@type": "ALTIMG",
            "@size": "3479",
            "@ref": "si94",
            "@mimetype": "image/svg+xml"
        },
        {
            "@category": "thumbnail",
            "@_fa": "true",
            "$": "https://api.elsevier.com/content/object/eid/1-s2.0-S0306261920308369-si95.svg?httpAccept=%2A%2F%2A",
            "@multimediatype": "Scalable Vector Graphics file",
            "@type": "ALTIMG",
            "@size": "3074",
            "@ref": "si95",
            "@mimetype": "image/svg+xml"
        },
        {
            "@category": "thumbnail",
            "@_fa": "true",
            "$": "https://api.elsevier.com/content/object/eid/1-s2.0-S0306261920308369-si96.svg?httpAccept=%2A%2F%2A",
            "@multimediatype": "Scalable Vector Graphics file",
            "@type": "ALTIMG",
            "@size": "7036",
            "@ref": "si96",
            "@mimetype": "image/svg+xml"
        },
        {
            "@category": "thumbnail",
            "@_fa": "true",
            "$": "https://api.elsevier.com/content/object/eid/1-s2.0-S0306261920308369-si97.svg?httpAccept=%2A%2F%2A",
            "@multimediatype": "Scalable Vector Graphics file",
            "@type": "ALTIMG",
            "@size": "4230",
            "@ref": "si97",
            "@mimetype": "image/svg+xml"
        },
        {
            "@category": "thumbnail",
            "@_fa": "true",
            "$": "https://api.elsevier.com/content/object/eid/1-s2.0-S0306261920308369-si98.svg?httpAccept=%2A%2F%2A",
            "@multimediatype": "Scalable Vector Graphics file",
            "@type": "ALTIMG",
            "@size": "4085",
            "@ref": "si98",
            "@mimetype": "image/svg+xml"
        },
        {
            "@category": "thumbnail",
            "@_fa": "true",
            "$": "https://api.elsevier.com/content/object/eid/1-s2.0-S0306261920308369-si99.svg?httpAccept=%2A%2F%2A",
            "@multimediatype": "Scalable Vector Graphics file",
            "@type": "ALTIMG",
            "@size": "6843",
            "@ref": "si99",
            "@mimetype": "image/svg+xml"
        },
        {
            "@category": "standard",
            "@_fa": "true",
            "$": "https://api.elsevier.com/content/object/eid/1-s2.0-S0306261920308369-am.pdf?httpAccept=%2A%2F%2A",
            "@multimediatype": "Acrobat PDF file",
            "@type": "AAM-PDF",
            "@size": "2769743",
            "@ref": "am",
            "@mimetype": "application/pdf"
        }
    ]},
    "link": {
        "@rel": "abstract",
        "@href": "https://api.elsevier.com/content/abstract/scopus_id/85087006762"
    }
}}