{"full-text-retrieval-response": {
    "scopus-eid": "2-s2.0-85175200661",
    "originalText": "serial JL 271429 291210 291702 291731 291787 291877 291878 291881 31 90 Applied Energy APPLIEDENERGY 2023-10-17 2023-10-17 2023-10-17 2023-10-17 2023-11-23T15:04:25 1-s2.0-S0306261923014654 S0306-2619(23)01465-4 S0306261923014654 10.1016/j.apenergy.2023.122101 S300 S300.1 FULL-TEXT 1-s2.0-S0306261923X0021X 2024-01-01T13:34:45.38262Z 0 0 20240101 2024 2023-10-17T04:17:34.315935Z articleinfo articlenumber articletitlenorm authfirstinitialnorm authfirstsurnamenorm cid cids contenttype copyright crossmark dateloaded dateloadedtxt datesearch datesort dateupdated dco docsubtype doctype doi eid ewtransactionid fundingbodyid hubeid indexeddate issn issnnorm itemstage itemtransactionid itemweight oauserlicense openaccess openarchive pg pgfirst pii piinorm pubdatestart pubdatetxt pubyr sectiontitle sortorder sponsoredaccesstype srctitle srctitlenorm srctype ssids alllist content oa subj subheadings suppl tomb volfirst volissue volumelist webpdf webpdfpagecount yearnav figure table body mmlmath acknowledge affil appendices articletitle auth authfirstini authfull authkeywords authlast footnotes grantnumber grantsponsor grantsponsorid highlightsabst nomenclature orcid primabst ref 0306-2619 03062619 UNLIMITED SWISS2021 true 353 353 PA Volume 353, Part A 72 122101 122101 122101 20240101 1 January 2024 2024-01-01 2024 Research Papers article fla © 2023 The Author(s). Published by Elsevier Ltd. DATADRIVENPREDICTIVECONTROLFORDEMANDSIDEMANAGEMENTTHEORETICALEXPERIMENTALRESULTS YIN M Nomenclature 1 Introduction 1.1 Critical literature review 1.2 Unique contribution and paper organization 2 Methodology 2.1 Data-driven predictive control 2.2 Extensions under noise and uncertainties 2.3 Signal matrix model 2.4 Stochastic indirect data-driven predictive control 3 Case studies 3.1 Controlled systems and tasks 3.1.1 Space heating 3.1.2 Domestic hot water heating 3.1.3 Stationary electric battery 3.2 Simulation and experimental configurations 3.2.1 Simulation 3.2.2 Experiment 4 Simulation results 5 Experimental results 5.1 Space heating 5.2 Domestic hot water heating 5.3 Stationary electric battery 5.4 Discussion 6 Conclusion CRediT authorship contribution statement Acknowledgments Appendix Proof of Proposition 1 References INTERNATIONALENERGYAGENCY 2017 DIGITALIZATIONENERGY KOUVARITAKIS 2016 B MODELPREDICTIVECONTROLCLASSICALROBUSTSTOCHASTIC PALENSKY 2011 381 388 P CAI 2020 114403 H LEFEBURE 2022 111806 N HJALMARSSON 2005 393 438 H STURZENEGGER 2015 1 12 D MADDALENA 2020 104211 E KAZMI 2019 1022 1035 H BUNNING 2020 109792 F LIAN 2023 Y ELOKDA 2021 8916 8936 E BUNNING 2022 118491 F PAPERNOT 2016 N TRANSFERABILITYINMACHINELEARNINGPHENOMENABLACKBOXATTACKSUSINGADVERSARIALSAMPLES MARKOVSKY 2021 42 64 I VANA 2010 1017 1022 Z 2010IEEEINTERNATIONALCONFERENCECONTROLAPPLICATIONS NOTESFINDINGBLACKBOXMODELALARGEBUILDING VANOVERSCHEE 2012 P SUBSPACEIDENTIFICATIONFORLINEARSYSTEMSTHEORYIMPLEMENTATIONAPPLICATIONS PRIVARA 2011 564 572 S FAVOREEL 1999 4004 4009 W YIN 2023 317 328 M YIN 2021 1004 1014 M PROCEEDINGS3RDCONFERENCELEARNINGFORDYNAMICSCONTROL MAXIMUMLIKELIHOODSIGNALMATRIXMODELFORDATADRIVENPREDICTIVECONTROL YIN 2022 853 858 M EUROPEANCONTROLCONFERENCEECC DATADRIVENPREDICTIONSTOCHASTICDATACONFIDENCEREGIONSMINIMUMMEANSQUAREDERRORESTIMATES MESBAH 2016 30 44 A OLDEWURTEL 2014 1198 1205 F WILLEMS 2005 325 329 J MARKOVSKY 2008 1946 1959 I MARKOVSKY 2013 1422 1436 I VANOVERSCHEE 1994 75 93 P DORFLER 2023 883 897 F ELOKDA 2021 8916 8936 E EMPA 2023 E NESTWIKI RICHNER 2018 222 P SWISSGRID 2023 P PREQUALIFICATION BLUM 2021 586 610 D BOJARSKI 2023 A NESTLINEIGHBORHOODENERGYSYSTEMTESTINGTOWARDSLARGESCALEINTEGRATION THEDANISHTRANSPORTANDCONSTRUCTIONAGENCY 2015 A DANISHBUILDINGREGULATIONS2015BR15 CAI 2018 938 949 H OLDEWURTEL 2012 15 27 F 2023 FEDERALOFFICEMETEOROLOGYCLIMATOLOGY YINX2024X122101 YINX2024X122101XM Full 2023-10-10T05:19:58Z FundingBody Swiss institutions 2021 http://creativecommons.org/licenses/by/4.0/ 2025-10-17T00:00:00.000Z 2025-10-17T00:00:00.000Z http://creativecommons.org/licenses/by-nc-nd/4.0/ This is an open access article under the CC BY license. © 2023 The Author(s). Published by Elsevier Ltd. 2023-11-02T17:23:38.723Z http://vtw.elsevier.com/data/voc/AddOnTypes/50.7/aggregated-refined Swiss National Science Foundation 200021_178890 SNF Schweizerischer Nationalfonds zur Förderung der Wissenschaftlichen Forschung http://data.elsevier.com/vocabulary/SciValFunders/501100001711 http://sws.geonames.org/2658434/ Swiss Federal Office of Energy SFOE UFE Bundesamt für Energie http://data.elsevier.com/vocabulary/SciValFunders/501100005380 http://sws.geonames.org/2658434/ The work of Hanmin Cai and Philipp Heer has been conducted within the S-DSM project funded by the Swiss Federal Office of Energy SFOE (grant Nr. SI/502165-01 ). The work of Mingzhou Yin and Roy S. Smith was supported by the Swiss National Science Foundation under Grant 200021_178890 . This work is part of the research activities of the International Energy Agency Energy in Buildings and Communities Program Annex 82, Energy Flexible Buildings Towards Resilient Low Carbon Energy Systems. item S0306-2619(23)01465-4 S0306261923014654 1-s2.0-S0306261923014654 10.1016/j.apenergy.2023.122101 271429 2024-01-01T13:34:45.38262Z 2024-01-01 UNLIMITED SWISS2021 1-s2.0-S0306261923014654-main.pdf https://s3-eu-west-1.amazonaws.com/prod-ucs-content-store-eu-west/content/pii:S0306261923014654/MAIN/application/pdf/fd565bfe74eeeecee9aafc4c10220bcc/main.pdf main.pdf pdf true 1948558 MAIN 12 1-s2.0-S0306261923014654-main_1.png https://s3-eu-west-1.amazonaws.com/prod-ucs-content-store-eu-west/content/pii:S0306261923014654/PREVIEW/image/png/00d3d06805516090bb995c13a9bf297f/main_1.png main_1.png png 59550 849 656 IMAGE-WEB-PDF 1 1-s2.0-S0306261923014654-gr14.jpg https://s3-eu-west-1.amazonaws.com/prod-ucs-content-store-eu-west/content/pii:S0306261923014654/gr14/DOWNSAMPLED/image/jpeg/966823d9eab1eef7b6400d4bf1507137/gr14.jpg gr14 gr14.jpg jpg 58755 286 533 IMAGE-DOWNSAMPLED 1-s2.0-S0306261923014654-gr13.jpg https://s3-eu-west-1.amazonaws.com/prod-ucs-content-store-eu-west/content/pii:S0306261923014654/gr13/DOWNSAMPLED/image/jpeg/45d2737accc559899e022211597c6ed2/gr13.jpg gr13 gr13.jpg jpg 74677 291 527 IMAGE-DOWNSAMPLED 1-s2.0-S0306261923014654-gr12.jpg https://s3-eu-west-1.amazonaws.com/prod-ucs-content-store-eu-west/content/pii:S0306261923014654/gr12/DOWNSAMPLED/image/jpeg/f23727c98258f5ab448109a4bf52a1b9/gr12.jpg gr12 gr12.jpg jpg 143444 647 525 IMAGE-DOWNSAMPLED 1-s2.0-S0306261923014654-gr1.jpg https://s3-eu-west-1.amazonaws.com/prod-ucs-content-store-eu-west/content/pii:S0306261923014654/gr1/DOWNSAMPLED/image/jpeg/6c6639241fd5a85cd7e978a89dfe9f3d/gr1.jpg gr1 gr1.jpg jpg 65610 296 375 IMAGE-DOWNSAMPLED 1-s2.0-S0306261923014654-gr11.jpg https://s3-eu-west-1.amazonaws.com/prod-ucs-content-store-eu-west/content/pii:S0306261923014654/gr11/DOWNSAMPLED/image/jpeg/1996397f66650881be6859ca204fa5e8/gr11.jpg gr11 gr11.jpg jpg 48080 205 374 IMAGE-DOWNSAMPLED 1-s2.0-S0306261923014654-fx1001.jpg https://s3-eu-west-1.amazonaws.com/prod-ucs-content-store-eu-west/content/pii:S0306261923014654/fx1001/DOWNSAMPLED/image/jpeg/620886aa7457cfacf125c5b1159cc3fa/fx1001.jpg fx1001 fx1001.jpg jpg 102410 237 791 IMAGE-DOWNSAMPLED 1-s2.0-S0306261923014654-gr5.jpg https://s3-eu-west-1.amazonaws.com/prod-ucs-content-store-eu-west/content/pii:S0306261923014654/gr5/DOWNSAMPLED/image/jpeg/f4d361134335278376fc53f6ed706331/gr5.jpg gr5 gr5.jpg jpg 42619 275 183 IMAGE-DOWNSAMPLED 1-s2.0-S0306261923014654-gr2.jpg https://s3-eu-west-1.amazonaws.com/prod-ucs-content-store-eu-west/content/pii:S0306261923014654/gr2/DOWNSAMPLED/image/jpeg/724bd1f9466f76944ab819ee3e207a7c/gr2.jpg gr2 gr2.jpg jpg 47929 193 308 IMAGE-DOWNSAMPLED 1-s2.0-S0306261923014654-gr3.jpg https://s3-eu-west-1.amazonaws.com/prod-ucs-content-store-eu-west/content/pii:S0306261923014654/gr3/DOWNSAMPLED/image/jpeg/ef40cacf88f42916076b483c42929f34/gr3.jpg gr3 gr3.jpg jpg 42572 195 346 IMAGE-DOWNSAMPLED 1-s2.0-S0306261923014654-gr8.jpg https://s3-eu-west-1.amazonaws.com/prod-ucs-content-store-eu-west/content/pii:S0306261923014654/gr8/DOWNSAMPLED/image/jpeg/c5ed2e77db5ff9c4b7417d8159f06a31/gr8.jpg gr8 gr8.jpg jpg 207221 921 371 IMAGE-DOWNSAMPLED 1-s2.0-S0306261923014654-gr6.jpg https://s3-eu-west-1.amazonaws.com/prod-ucs-content-store-eu-west/content/pii:S0306261923014654/gr6/DOWNSAMPLED/image/jpeg/a052e565c1c024db32cfe51fe5b07164/gr6.jpg gr6 gr6.jpg jpg 37637 195 535 IMAGE-DOWNSAMPLED 1-s2.0-S0306261923014654-gr7.jpg https://s3-eu-west-1.amazonaws.com/prod-ucs-content-store-eu-west/content/pii:S0306261923014654/gr7/DOWNSAMPLED/image/jpeg/4f95031252210984c3e3ec1ab82ce350/gr7.jpg gr7 gr7.jpg jpg 84420 667 373 IMAGE-DOWNSAMPLED 1-s2.0-S0306261923014654-gr9.jpg https://s3-eu-west-1.amazonaws.com/prod-ucs-content-store-eu-west/content/pii:S0306261923014654/gr9/DOWNSAMPLED/image/jpeg/2c246380a85ca2462140b0e36af59e00/gr9.jpg gr9 gr9.jpg jpg 59635 205 374 IMAGE-DOWNSAMPLED 1-s2.0-S0306261923014654-gr10.jpg https://s3-eu-west-1.amazonaws.com/prod-ucs-content-store-eu-west/content/pii:S0306261923014654/gr10/DOWNSAMPLED/image/jpeg/93629bc71442b42a45b6fb009a7dd473/gr10.jpg gr10 gr10.jpg jpg 57516 205 374 IMAGE-DOWNSAMPLED 1-s2.0-S0306261923014654-gr4.jpg https://s3-eu-west-1.amazonaws.com/prod-ucs-content-store-eu-west/content/pii:S0306261923014654/gr4/DOWNSAMPLED/image/jpeg/84e9c9cef8d6a26dae502dd64fcf52e6/gr4.jpg gr4 gr4.jpg jpg 34819 216 162 IMAGE-DOWNSAMPLED 1-s2.0-S0306261923014654-gr14.sml https://s3-eu-west-1.amazonaws.com/prod-ucs-content-store-eu-west/content/pii:S0306261923014654/gr14/THUMBNAIL/image/gif/3fe69861c7eba6df3330147199e1b912/gr14.sml gr14 gr14.sml sml 17752 118 219 IMAGE-THUMBNAIL 1-s2.0-S0306261923014654-gr13.sml https://s3-eu-west-1.amazonaws.com/prod-ucs-content-store-eu-west/content/pii:S0306261923014654/gr13/THUMBNAIL/image/gif/68b615dd50dba05a516ce80e0d2681b9/gr13.sml gr13 gr13.sml sml 20761 121 219 IMAGE-THUMBNAIL 1-s2.0-S0306261923014654-gr12.sml https://s3-eu-west-1.amazonaws.com/prod-ucs-content-store-eu-west/content/pii:S0306261923014654/gr12/THUMBNAIL/image/gif/b12be5fe444b121733bebd7b7e6efd32/gr12.sml gr12 gr12.sml sml 24053 164 133 IMAGE-THUMBNAIL 1-s2.0-S0306261923014654-gr1.sml https://s3-eu-west-1.amazonaws.com/prod-ucs-content-store-eu-west/content/pii:S0306261923014654/gr1/THUMBNAIL/image/gif/2cebd04ec32ffb991ef02c2c46072caf/gr1.sml gr1 gr1.sml sml 28949 164 208 IMAGE-THUMBNAIL 1-s2.0-S0306261923014654-gr11.sml https://s3-eu-west-1.amazonaws.com/prod-ucs-content-store-eu-west/content/pii:S0306261923014654/gr11/THUMBNAIL/image/gif/368ac2a562e7655573fb8be5cea95cb3/gr11.sml gr11 gr11.sml sml 18159 120 219 IMAGE-THUMBNAIL 1-s2.0-S0306261923014654-fx1001.sml https://s3-eu-west-1.amazonaws.com/prod-ucs-content-store-eu-west/content/pii:S0306261923014654/fx1001/THUMBNAIL/image/gif/005bd67563e9723642bd72b69c3c9673/fx1001.sml fx1001 fx1001.sml sml 68932 66 219 IMAGE-THUMBNAIL 1-s2.0-S0306261923014654-gr5.sml https://s3-eu-west-1.amazonaws.com/prod-ucs-content-store-eu-west/content/pii:S0306261923014654/gr5/THUMBNAIL/image/gif/9bd79b92a91610cb0f26af7c983bc0cc/gr5.sml gr5 gr5.sml sml 27965 164 109 IMAGE-THUMBNAIL 1-s2.0-S0306261923014654-gr2.sml https://s3-eu-west-1.amazonaws.com/prod-ucs-content-store-eu-west/content/pii:S0306261923014654/gr2/THUMBNAIL/image/gif/2ac41eb92ae143bb1a5626967b00c003/gr2.sml gr2 gr2.sml sml 37369 138 219 IMAGE-THUMBNAIL 1-s2.0-S0306261923014654-gr3.sml https://s3-eu-west-1.amazonaws.com/prod-ucs-content-store-eu-west/content/pii:S0306261923014654/gr3/THUMBNAIL/image/gif/38db03a1fa1e727159e0b5529a6fae3a/gr3.sml gr3 gr3.sml sml 28912 124 219 IMAGE-THUMBNAIL 1-s2.0-S0306261923014654-gr8.sml https://s3-eu-west-1.amazonaws.com/prod-ucs-content-store-eu-west/content/pii:S0306261923014654/gr8/THUMBNAIL/image/gif/f187bbc2f30bb624327682247e071fc2/gr8.sml gr8 gr8.sml sml 17686 164 66 IMAGE-THUMBNAIL 1-s2.0-S0306261923014654-gr6.sml https://s3-eu-west-1.amazonaws.com/prod-ucs-content-store-eu-west/content/pii:S0306261923014654/gr6/THUMBNAIL/image/gif/a9e11d0fe50d5472386b19de5a2bf15c/gr6.sml gr6 gr6.sml sml 14014 80 219 IMAGE-THUMBNAIL 1-s2.0-S0306261923014654-gr7.sml https://s3-eu-west-1.amazonaws.com/prod-ucs-content-store-eu-west/content/pii:S0306261923014654/gr7/THUMBNAIL/image/gif/0229cf294e36a9f2ba25b0d69f2b369c/gr7.sml gr7 gr7.sml sml 14538 163 91 IMAGE-THUMBNAIL 1-s2.0-S0306261923014654-gr9.sml https://s3-eu-west-1.amazonaws.com/prod-ucs-content-store-eu-west/content/pii:S0306261923014654/gr9/THUMBNAIL/image/gif/55aa93546746c9d8d0e45a95778ad4e4/gr9.sml gr9 gr9.sml sml 22179 120 219 IMAGE-THUMBNAIL 1-s2.0-S0306261923014654-gr10.sml https://s3-eu-west-1.amazonaws.com/prod-ucs-content-store-eu-west/content/pii:S0306261923014654/gr10/THUMBNAIL/image/gif/90fbbc71e7507d9a69b967249bdf030d/gr10.sml gr10 gr10.sml sml 22438 120 219 IMAGE-THUMBNAIL 1-s2.0-S0306261923014654-gr4.sml https://s3-eu-west-1.amazonaws.com/prod-ucs-content-store-eu-west/content/pii:S0306261923014654/gr4/THUMBNAIL/image/gif/a91ec082d5e1bd8865f32a1b0a4b2eaf/gr4.sml gr4 gr4.sml sml 33016 164 123 IMAGE-THUMBNAIL 1-s2.0-S0306261923014654-gr14_lrg.jpg https://s3-eu-west-1.amazonaws.com/prod-ucs-content-store-eu-west/content/pii:S0306261923014654/HIGHRES/image/jpeg/cc675fcb240645186c60f0cd58f7963f/gr14_lrg.jpg gr14 gr14_lrg.jpg jpg 309179 1267 2359 IMAGE-HIGH-RES 1-s2.0-S0306261923014654-gr13_lrg.jpg https://s3-eu-west-1.amazonaws.com/prod-ucs-content-store-eu-west/content/pii:S0306261923014654/HIGHRES/image/jpeg/e391b874cea3b4ef60f8cd9065e8c1bd/gr13_lrg.jpg gr13 gr13_lrg.jpg jpg 396131 1289 2333 IMAGE-HIGH-RES 1-s2.0-S0306261923014654-gr12_lrg.jpg https://s3-eu-west-1.amazonaws.com/prod-ucs-content-store-eu-west/content/pii:S0306261923014654/HIGHRES/image/jpeg/14cf93f5ac9ad7ef8bb8f3d075a8be5b/gr12_lrg.jpg gr12 gr12_lrg.jpg jpg 865628 2866 2325 IMAGE-HIGH-RES 1-s2.0-S0306261923014654-gr1_lrg.jpg https://s3-eu-west-1.amazonaws.com/prod-ucs-content-store-eu-west/content/pii:S0306261923014654/HIGHRES/image/jpeg/fd783a5d6de309bf2b24f8534b78661a/gr1_lrg.jpg gr1 gr1_lrg.jpg jpg 383648 1313 1663 IMAGE-HIGH-RES 1-s2.0-S0306261923014654-gr11_lrg.jpg https://s3-eu-west-1.amazonaws.com/prod-ucs-content-store-eu-west/content/pii:S0306261923014654/HIGHRES/image/jpeg/95439c1be02a685cd198daac1df4ffba/gr11_lrg.jpg gr11 gr11_lrg.jpg jpg 251077 911 1658 IMAGE-HIGH-RES 1-s2.0-S0306261923014654-fx1001_lrg.jpg https://s3-eu-west-1.amazonaws.com/prod-ucs-content-store-eu-west/content/pii:S0306261923014654/HIGHRES/image/jpeg/783564a6fd6f51cd43f9d2562f2292c0/fx1001_lrg.jpg fx1001 fx1001_lrg.jpg jpg 352347 1048 3500 IMAGE-HIGH-RES 1-s2.0-S0306261923014654-gr5_lrg.jpg https://s3-eu-west-1.amazonaws.com/prod-ucs-content-store-eu-west/content/pii:S0306261923014654/HIGHRES/image/jpeg/2f156435e7a73701c70f8dadc8ebcf90/gr5_lrg.jpg gr5 gr5_lrg.jpg jpg 303793 1215 810 IMAGE-HIGH-RES 1-s2.0-S0306261923014654-gr2_lrg.jpg https://s3-eu-west-1.amazonaws.com/prod-ucs-content-store-eu-west/content/pii:S0306261923014654/HIGHRES/image/jpeg/4d88af29beabdd20b1c8d5b23fd1f14f/gr2_lrg.jpg gr2 gr2_lrg.jpg jpg 309596 856 1363 IMAGE-HIGH-RES 1-s2.0-S0306261923014654-gr3_lrg.jpg https://s3-eu-west-1.amazonaws.com/prod-ucs-content-store-eu-west/content/pii:S0306261923014654/HIGHRES/image/jpeg/6138e9d59cef398381b1e93eb9c9c39e/gr3_lrg.jpg gr3 gr3_lrg.jpg jpg 260981 865 1531 IMAGE-HIGH-RES 1-s2.0-S0306261923014654-gr8_lrg.jpg https://s3-eu-west-1.amazonaws.com/prod-ucs-content-store-eu-west/content/pii:S0306261923014654/HIGHRES/image/jpeg/d2dc41a7e2f3ad7ea8f0a53bbe8bce7e/gr8_lrg.jpg gr8 gr8_lrg.jpg jpg 1752543 4085 1645 IMAGE-HIGH-RES 1-s2.0-S0306261923014654-gr6_lrg.jpg https://s3-eu-west-1.amazonaws.com/prod-ucs-content-store-eu-west/content/pii:S0306261923014654/HIGHRES/image/jpeg/05a8c8121d6d3751e196dc920f5e5fb7/gr6_lrg.jpg gr6 gr6_lrg.jpg jpg 218296 862 2368 IMAGE-HIGH-RES 1-s2.0-S0306261923014654-gr7_lrg.jpg https://s3-eu-west-1.amazonaws.com/prod-ucs-content-store-eu-west/content/pii:S0306261923014654/HIGHRES/image/jpeg/7dc89c27dc589f384a438a0cc51105b3/gr7_lrg.jpg gr7 gr7_lrg.jpg jpg 494514 2958 1653 IMAGE-HIGH-RES 1-s2.0-S0306261923014654-gr9_lrg.jpg https://s3-eu-west-1.amazonaws.com/prod-ucs-content-store-eu-west/content/pii:S0306261923014654/HIGHRES/image/jpeg/c7e5ab745735e627dc48e2b3d00cf5d4/gr9_lrg.jpg gr9 gr9_lrg.jpg jpg 321448 909 1658 IMAGE-HIGH-RES 1-s2.0-S0306261923014654-gr10_lrg.jpg https://s3-eu-west-1.amazonaws.com/prod-ucs-content-store-eu-west/content/pii:S0306261923014654/HIGHRES/image/jpeg/9e477a8f674c287af0da825412c7ceef/gr10_lrg.jpg gr10 gr10_lrg.jpg jpg 328768 909 1658 IMAGE-HIGH-RES 1-s2.0-S0306261923014654-gr4_lrg.jpg https://s3-eu-west-1.amazonaws.com/prod-ucs-content-store-eu-west/content/pii:S0306261923014654/HIGHRES/image/jpeg/55a3a1dac87c154c675ece660de29cef/gr4_lrg.jpg gr4 gr4_lrg.jpg jpg 165698 960 720 IMAGE-HIGH-RES 1-s2.0-S0306261923014654-si10.svg https://s3-eu-west-1.amazonaws.com/prod-ucs-content-store-eu-west/content/pii:S0306261923014654/image/svg+xml/92a4aec30c8467edcfa29efd292768d4/si10.svg si10 si10.svg svg 1347 ALTIMG 1-s2.0-S0306261923014654-si100.svg https://s3-eu-west-1.amazonaws.com/prod-ucs-content-store-eu-west/content/pii:S0306261923014654/image/svg+xml/e4fccf3b635745752edc8a2e12184221/si100.svg si100 si100.svg svg 29720 ALTIMG 1-s2.0-S0306261923014654-si101.svg https://s3-eu-west-1.amazonaws.com/prod-ucs-content-store-eu-west/content/pii:S0306261923014654/image/svg+xml/4a1cc84b10e75f5da0b1b9ef75916fd8/si101.svg si101 si101.svg svg 23224 ALTIMG 1-s2.0-S0306261923014654-si102.svg https://s3-eu-west-1.amazonaws.com/prod-ucs-content-store-eu-west/content/pii:S0306261923014654/image/svg+xml/42090d4fccf5b4ab4943ca1a8199493c/si102.svg si102 si102.svg svg 16138 ALTIMG 1-s2.0-S0306261923014654-si103.svg https://s3-eu-west-1.amazonaws.com/prod-ucs-content-store-eu-west/content/pii:S0306261923014654/image/svg+xml/6e8ed873d7ce11e6761714f534bc2f45/si103.svg si103 si103.svg svg 2792 ALTIMG 1-s2.0-S0306261923014654-si104.svg https://s3-eu-west-1.amazonaws.com/prod-ucs-content-store-eu-west/content/pii:S0306261923014654/image/svg+xml/b35a0ad29ad26f5fd6d0400131ec36c2/si104.svg si104 si104.svg svg 2340 ALTIMG 1-s2.0-S0306261923014654-si105.svg https://s3-eu-west-1.amazonaws.com/prod-ucs-content-store-eu-west/content/pii:S0306261923014654/image/svg+xml/441d35a3b33cee69de527d8254148c33/si105.svg si105 si105.svg svg 1383 ALTIMG 1-s2.0-S0306261923014654-si109.svg https://s3-eu-west-1.amazonaws.com/prod-ucs-content-store-eu-west/content/pii:S0306261923014654/image/svg+xml/7dcb31836ae02a3762737ffa40ec05e6/si109.svg si109 si109.svg svg 11958 ALTIMG 1-s2.0-S0306261923014654-si11.svg https://s3-eu-west-1.amazonaws.com/prod-ucs-content-store-eu-west/content/pii:S0306261923014654/image/svg+xml/2bf3c5b2686fcdaca0698eedc4c0ef19/si11.svg si11 si11.svg svg 3695 ALTIMG 1-s2.0-S0306261923014654-si110.svg https://s3-eu-west-1.amazonaws.com/prod-ucs-content-store-eu-west/content/pii:S0306261923014654/image/svg+xml/adb6c0da3b4730a4bb51d552cabf2d51/si110.svg si110 si110.svg svg 13549 ALTIMG 1-s2.0-S0306261923014654-si111.svg https://s3-eu-west-1.amazonaws.com/prod-ucs-content-store-eu-west/content/pii:S0306261923014654/image/svg+xml/f5573b692c2da5df105c2fc699d1149d/si111.svg si111 si111.svg svg 11798 ALTIMG 1-s2.0-S0306261923014654-si112.svg https://s3-eu-west-1.amazonaws.com/prod-ucs-content-store-eu-west/content/pii:S0306261923014654/image/svg+xml/6a873a7af1010f948a75c0de124f4b66/si112.svg si112 si112.svg svg 16654 ALTIMG 1-s2.0-S0306261923014654-si113.svg https://s3-eu-west-1.amazonaws.com/prod-ucs-content-store-eu-west/content/pii:S0306261923014654/image/svg+xml/62ec995d9bc7968bc410f6b754483e64/si113.svg si113 si113.svg svg 14110 ALTIMG 1-s2.0-S0306261923014654-si114.svg https://s3-eu-west-1.amazonaws.com/prod-ucs-content-store-eu-west/content/pii:S0306261923014654/image/svg+xml/f67f7342eb98b045f7c71208c125fb4e/si114.svg si114 si114.svg svg 4420 ALTIMG 1-s2.0-S0306261923014654-si115.svg https://s3-eu-west-1.amazonaws.com/prod-ucs-content-store-eu-west/content/pii:S0306261923014654/image/svg+xml/8dea8c1f2ff7d8691ab29cb7a57153d3/si115.svg si115 si115.svg svg 2476 ALTIMG 1-s2.0-S0306261923014654-si116.svg https://s3-eu-west-1.amazonaws.com/prod-ucs-content-store-eu-west/content/pii:S0306261923014654/image/svg+xml/765cba5bd4401977fb040903db536ae9/si116.svg si116 si116.svg svg 5340 ALTIMG 1-s2.0-S0306261923014654-si117.svg https://s3-eu-west-1.amazonaws.com/prod-ucs-content-store-eu-west/content/pii:S0306261923014654/image/svg+xml/a9c3ae08612817534471a0d628329483/si117.svg si117 si117.svg svg 3629 ALTIMG 1-s2.0-S0306261923014654-si118.svg https://s3-eu-west-1.amazonaws.com/prod-ucs-content-store-eu-west/content/pii:S0306261923014654/image/svg+xml/08aa65b8316f08b61100014a927c9612/si118.svg si118 si118.svg svg 1157 ALTIMG 1-s2.0-S0306261923014654-si12.svg https://s3-eu-west-1.amazonaws.com/prod-ucs-content-store-eu-west/content/pii:S0306261923014654/image/svg+xml/6c454fcfd2e4b87f1c30bf1227dfb31e/si12.svg si12 si12.svg svg 15171 ALTIMG 1-s2.0-S0306261923014654-si120.svg https://s3-eu-west-1.amazonaws.com/prod-ucs-content-store-eu-west/content/pii:S0306261923014654/image/svg+xml/14a2ac899b257610ac0c35001c4dbc35/si120.svg si120 si120.svg svg 6068 ALTIMG 1-s2.0-S0306261923014654-si121.svg https://s3-eu-west-1.amazonaws.com/prod-ucs-content-store-eu-west/content/pii:S0306261923014654/image/svg+xml/03e9ec111dd34c2db0119077e9c90a42/si121.svg si121 si121.svg svg 13180 ALTIMG 1-s2.0-S0306261923014654-si122.svg https://s3-eu-west-1.amazonaws.com/prod-ucs-content-store-eu-west/content/pii:S0306261923014654/image/svg+xml/28d9c544562f38525d5350dadde624b0/si122.svg si122 si122.svg svg 19005 ALTIMG 1-s2.0-S0306261923014654-si123.svg https://s3-eu-west-1.amazonaws.com/prod-ucs-content-store-eu-west/content/pii:S0306261923014654/image/svg+xml/134a7dbf8e07a34c0c30e949291c4d76/si123.svg si123 si123.svg svg 20336 ALTIMG 1-s2.0-S0306261923014654-si124.svg https://s3-eu-west-1.amazonaws.com/prod-ucs-content-store-eu-west/content/pii:S0306261923014654/image/svg+xml/73bd3e336c0d30c7dbeba4c4011d7cb7/si124.svg si124 si124.svg svg 2858 ALTIMG 1-s2.0-S0306261923014654-si125.svg https://s3-eu-west-1.amazonaws.com/prod-ucs-content-store-eu-west/content/pii:S0306261923014654/image/svg+xml/5f55ba50b65f730069e2eb25916aff23/si125.svg si125 si125.svg svg 1456 ALTIMG 1-s2.0-S0306261923014654-si126.svg https://s3-eu-west-1.amazonaws.com/prod-ucs-content-store-eu-west/content/pii:S0306261923014654/image/svg+xml/ea28f50c9a6da6211d8e350d26b98c9e/si126.svg si126 si126.svg svg 20712 ALTIMG 1-s2.0-S0306261923014654-si127.svg https://s3-eu-west-1.amazonaws.com/prod-ucs-content-store-eu-west/content/pii:S0306261923014654/image/svg+xml/93ecc0c34e15eeb87c37e152781d98df/si127.svg si127 si127.svg svg 13774 ALTIMG 1-s2.0-S0306261923014654-si128.svg https://s3-eu-west-1.amazonaws.com/prod-ucs-content-store-eu-west/content/pii:S0306261923014654/image/svg+xml/c0e97327ff027ffba707c07dfcb53d28/si128.svg si128 si128.svg svg 14456 ALTIMG 1-s2.0-S0306261923014654-si129.svg https://s3-eu-west-1.amazonaws.com/prod-ucs-content-store-eu-west/content/pii:S0306261923014654/image/svg+xml/b28637637cdf7abce504002ac6dc4872/si129.svg si129 si129.svg svg 2607 ALTIMG 1-s2.0-S0306261923014654-si13.svg https://s3-eu-west-1.amazonaws.com/prod-ucs-content-store-eu-west/content/pii:S0306261923014654/image/svg+xml/87f476283cc5f8bf6a93f00d28509af7/si13.svg si13 si13.svg svg 1625 ALTIMG 1-s2.0-S0306261923014654-si130.svg https://s3-eu-west-1.amazonaws.com/prod-ucs-content-store-eu-west/content/pii:S0306261923014654/image/svg+xml/58b0773085c6f7d8d93feb2fb21cb39c/si130.svg si130 si130.svg svg 2539 ALTIMG 1-s2.0-S0306261923014654-si135.svg https://s3-eu-west-1.amazonaws.com/prod-ucs-content-store-eu-west/content/pii:S0306261923014654/image/svg+xml/6611c8eb847346d50829dd5014de5c87/si135.svg si135 si135.svg svg 6988 ALTIMG 1-s2.0-S0306261923014654-si136.svg https://s3-eu-west-1.amazonaws.com/prod-ucs-content-store-eu-west/content/pii:S0306261923014654/image/svg+xml/05c975b6e8d08c902ce76d2af3d9a755/si136.svg si136 si136.svg svg 4972 ALTIMG 1-s2.0-S0306261923014654-si137.svg https://s3-eu-west-1.amazonaws.com/prod-ucs-content-store-eu-west/content/pii:S0306261923014654/image/svg+xml/d59734cdcf5487e4785268b9b10725d6/si137.svg si137 si137.svg svg 12986 ALTIMG 1-s2.0-S0306261923014654-si138.svg https://s3-eu-west-1.amazonaws.com/prod-ucs-content-store-eu-west/content/pii:S0306261923014654/image/svg+xml/d8b889c216627f2341a08bb2dbe1a942/si138.svg si138 si138.svg svg 13198 ALTIMG 1-s2.0-S0306261923014654-si139.svg https://s3-eu-west-1.amazonaws.com/prod-ucs-content-store-eu-west/content/pii:S0306261923014654/image/svg+xml/75a80e6a500b8fea7a40b84a35436c5d/si139.svg si139 si139.svg svg 2041 ALTIMG 1-s2.0-S0306261923014654-si14.svg https://s3-eu-west-1.amazonaws.com/prod-ucs-content-store-eu-west/content/pii:S0306261923014654/image/svg+xml/30eabd828eb9c66498dea15d382fd19c/si14.svg si14 si14.svg svg 3364 ALTIMG 1-s2.0-S0306261923014654-si141.svg https://s3-eu-west-1.amazonaws.com/prod-ucs-content-store-eu-west/content/pii:S0306261923014654/image/svg+xml/1a8f86e2118743d20e6c4e856f92ff53/si141.svg si141 si141.svg svg 30425 ALTIMG 1-s2.0-S0306261923014654-si144.svg https://s3-eu-west-1.amazonaws.com/prod-ucs-content-store-eu-west/content/pii:S0306261923014654/image/svg+xml/ef85a04ece95d7067c7b893cce3c505b/si144.svg si144 si144.svg svg 2010 ALTIMG 1-s2.0-S0306261923014654-si145.svg https://s3-eu-west-1.amazonaws.com/prod-ucs-content-store-eu-west/content/pii:S0306261923014654/image/svg+xml/e6791a511878f73e8986cbac8735ec43/si145.svg si145 si145.svg svg 4254 ALTIMG 1-s2.0-S0306261923014654-si15.svg https://s3-eu-west-1.amazonaws.com/prod-ucs-content-store-eu-west/content/pii:S0306261923014654/image/svg+xml/41b13980e4c5aa7caa16a37d73bef0ec/si15.svg si15 si15.svg svg 1900 ALTIMG 1-s2.0-S0306261923014654-si152.svg https://s3-eu-west-1.amazonaws.com/prod-ucs-content-store-eu-west/content/pii:S0306261923014654/image/svg+xml/ce56013aa667d46a77267fabea1e02e9/si152.svg si152 si152.svg svg 2495 ALTIMG 1-s2.0-S0306261923014654-si155.svg https://s3-eu-west-1.amazonaws.com/prod-ucs-content-store-eu-west/content/pii:S0306261923014654/image/svg+xml/4f3bc76d689c12eb9b7bbbd0af75b958/si155.svg si155 si155.svg svg 2205 ALTIMG 1-s2.0-S0306261923014654-si157.svg https://s3-eu-west-1.amazonaws.com/prod-ucs-content-store-eu-west/content/pii:S0306261923014654/image/svg+xml/72bbbd70d0b706ced737fbeb5701c8ac/si157.svg si157 si157.svg svg 1008 ALTIMG 1-s2.0-S0306261923014654-si159.svg https://s3-eu-west-1.amazonaws.com/prod-ucs-content-store-eu-west/content/pii:S0306261923014654/image/svg+xml/909af58a632aed9790a757a2f58c794a/si159.svg si159 si159.svg svg 7341 ALTIMG 1-s2.0-S0306261923014654-si16.svg https://s3-eu-west-1.amazonaws.com/prod-ucs-content-store-eu-west/content/pii:S0306261923014654/image/svg+xml/2fcef0b98f79f9836df6442d85531f6e/si16.svg si16 si16.svg svg 5863 ALTIMG 1-s2.0-S0306261923014654-si160.svg https://s3-eu-west-1.amazonaws.com/prod-ucs-content-store-eu-west/content/pii:S0306261923014654/image/svg+xml/d8a8959c0e7a32ea05a654901ec0d03f/si160.svg si160 si160.svg svg 3795 ALTIMG 1-s2.0-S0306261923014654-si161.svg https://s3-eu-west-1.amazonaws.com/prod-ucs-content-store-eu-west/content/pii:S0306261923014654/image/svg+xml/d728eb1893403e37aa2a5ca1366930f9/si161.svg si161 si161.svg svg 10944 ALTIMG 1-s2.0-S0306261923014654-si162.svg https://s3-eu-west-1.amazonaws.com/prod-ucs-content-store-eu-west/content/pii:S0306261923014654/image/svg+xml/67e3480281f1144ad3ad10ff665e8114/si162.svg si162 si162.svg svg 1428 ALTIMG 1-s2.0-S0306261923014654-si163.svg https://s3-eu-west-1.amazonaws.com/prod-ucs-content-store-eu-west/content/pii:S0306261923014654/image/svg+xml/18df94c7a8ec0f40b9679990c4c5381c/si163.svg si163 si163.svg svg 3506 ALTIMG 1-s2.0-S0306261923014654-si164.svg https://s3-eu-west-1.amazonaws.com/prod-ucs-content-store-eu-west/content/pii:S0306261923014654/image/svg+xml/c99552f27da300799a7954465cffeaab/si164.svg si164 si164.svg svg 10825 ALTIMG 1-s2.0-S0306261923014654-si165.svg https://s3-eu-west-1.amazonaws.com/prod-ucs-content-store-eu-west/content/pii:S0306261923014654/image/svg+xml/6f034632ba238ca0453ff6179c4d529d/si165.svg si165 si165.svg svg 5047 ALTIMG 1-s2.0-S0306261923014654-si166.svg https://s3-eu-west-1.amazonaws.com/prod-ucs-content-store-eu-west/content/pii:S0306261923014654/image/svg+xml/9bab3b93f185305be3b916cda14c39e0/si166.svg si166 si166.svg svg 19444 ALTIMG 1-s2.0-S0306261923014654-si169.svg https://s3-eu-west-1.amazonaws.com/prod-ucs-content-store-eu-west/content/pii:S0306261923014654/image/svg+xml/7f84f842c754732706220244642b7a9b/si169.svg si169 si169.svg svg 1510 ALTIMG 1-s2.0-S0306261923014654-si17.svg https://s3-eu-west-1.amazonaws.com/prod-ucs-content-store-eu-west/content/pii:S0306261923014654/image/svg+xml/bcf6546e41230b89c6e452606f115ed8/si17.svg si17 si17.svg svg 8252 ALTIMG 1-s2.0-S0306261923014654-si170.svg https://s3-eu-west-1.amazonaws.com/prod-ucs-content-store-eu-west/content/pii:S0306261923014654/image/svg+xml/7ee116f6b8bca252dcdb6348b30df24d/si170.svg si170 si170.svg svg 1924 ALTIMG 1-s2.0-S0306261923014654-si171.svg https://s3-eu-west-1.amazonaws.com/prod-ucs-content-store-eu-west/content/pii:S0306261923014654/image/svg+xml/f92e12040a9fb117490a17bbfbf7bf89/si171.svg si171 si171.svg svg 1586 ALTIMG 1-s2.0-S0306261923014654-si172.svg https://s3-eu-west-1.amazonaws.com/prod-ucs-content-store-eu-west/content/pii:S0306261923014654/image/svg+xml/d8ee990f6b7d7b3a5151296787450fb8/si172.svg si172 si172.svg svg 1547 ALTIMG 1-s2.0-S0306261923014654-si173.svg https://s3-eu-west-1.amazonaws.com/prod-ucs-content-store-eu-west/content/pii:S0306261923014654/image/svg+xml/88cf6525b981dc218f5730f980729023/si173.svg si173 si173.svg svg 1832 ALTIMG 1-s2.0-S0306261923014654-si174.svg https://s3-eu-west-1.amazonaws.com/prod-ucs-content-store-eu-west/content/pii:S0306261923014654/image/svg+xml/da58d1ed4f02295b65df6ed03f98bb79/si174.svg si174 si174.svg svg 1537 ALTIMG 1-s2.0-S0306261923014654-si175.svg https://s3-eu-west-1.amazonaws.com/prod-ucs-content-store-eu-west/content/pii:S0306261923014654/image/svg+xml/89cee2433523923b5d17f158964aa4ac/si175.svg si175 si175.svg svg 2853 ALTIMG 1-s2.0-S0306261923014654-si176.svg https://s3-eu-west-1.amazonaws.com/prod-ucs-content-store-eu-west/content/pii:S0306261923014654/image/svg+xml/ee85c48b1c03f3c2e606451df953c9ef/si176.svg si176 si176.svg svg 2056 ALTIMG 1-s2.0-S0306261923014654-si179.svg https://s3-eu-west-1.amazonaws.com/prod-ucs-content-store-eu-west/content/pii:S0306261923014654/image/svg+xml/b3c2c8db06b4a11eccba93e319f46397/si179.svg si179 si179.svg svg 13209 ALTIMG 1-s2.0-S0306261923014654-si18.svg https://s3-eu-west-1.amazonaws.com/prod-ucs-content-store-eu-west/content/pii:S0306261923014654/image/svg+xml/95d35d9868bd5accc6e3e66c7db0c7e7/si18.svg si18 si18.svg svg 4334 ALTIMG 1-s2.0-S0306261923014654-si180.svg https://s3-eu-west-1.amazonaws.com/prod-ucs-content-store-eu-west/content/pii:S0306261923014654/image/svg+xml/5f7d09d3bd18f78b00a02278d9229815/si180.svg si180 si180.svg svg 2659 ALTIMG 1-s2.0-S0306261923014654-si181.svg https://s3-eu-west-1.amazonaws.com/prod-ucs-content-store-eu-west/content/pii:S0306261923014654/image/svg+xml/0a845398db1047163467ebd7810632b9/si181.svg si181 si181.svg svg 13323 ALTIMG 1-s2.0-S0306261923014654-si183.svg https://s3-eu-west-1.amazonaws.com/prod-ucs-content-store-eu-west/content/pii:S0306261923014654/image/svg+xml/1a41f84884afa3fa633512aaa9338bae/si183.svg si183 si183.svg svg 3668 ALTIMG 1-s2.0-S0306261923014654-si184.svg https://s3-eu-west-1.amazonaws.com/prod-ucs-content-store-eu-west/content/pii:S0306261923014654/image/svg+xml/514c2b160c8df80fbe7b6d40be916e4b/si184.svg si184 si184.svg svg 3909 ALTIMG 1-s2.0-S0306261923014654-si185.svg https://s3-eu-west-1.amazonaws.com/prod-ucs-content-store-eu-west/content/pii:S0306261923014654/image/svg+xml/4de383cfde0cc264ebc7c5b251a19122/si185.svg si185 si185.svg svg 3500 ALTIMG 1-s2.0-S0306261923014654-si186.svg https://s3-eu-west-1.amazonaws.com/prod-ucs-content-store-eu-west/content/pii:S0306261923014654/image/svg+xml/9bca2ce7467894fd3872eaaaec2d55d3/si186.svg si186 si186.svg svg 1434 ALTIMG 1-s2.0-S0306261923014654-si188.svg https://s3-eu-west-1.amazonaws.com/prod-ucs-content-store-eu-west/content/pii:S0306261923014654/image/svg+xml/6899b470c4f93f25f737cd84225785b9/si188.svg si188 si188.svg svg 4577 ALTIMG 1-s2.0-S0306261923014654-si19.svg https://s3-eu-west-1.amazonaws.com/prod-ucs-content-store-eu-west/content/pii:S0306261923014654/image/svg+xml/6fdf9d3eded56acb97ed89f5a5a995c3/si19.svg si19 si19.svg svg 17272 ALTIMG 1-s2.0-S0306261923014654-si190.svg https://s3-eu-west-1.amazonaws.com/prod-ucs-content-store-eu-west/content/pii:S0306261923014654/image/svg+xml/eefe38cccd00f618566d4735129a1787/si190.svg si190 si190.svg svg 5022 ALTIMG 1-s2.0-S0306261923014654-si191.svg https://s3-eu-west-1.amazonaws.com/prod-ucs-content-store-eu-west/content/pii:S0306261923014654/image/svg+xml/8f2ec165b9da75f7a5a5f0e8ac9c7888/si191.svg si191 si191.svg svg 5524 ALTIMG 1-s2.0-S0306261923014654-si192.svg https://s3-eu-west-1.amazonaws.com/prod-ucs-content-store-eu-west/content/pii:S0306261923014654/image/svg+xml/2f2cd550c1b1cc56fb6bd08a0497cc3d/si192.svg si192 si192.svg svg 7139 ALTIMG 1-s2.0-S0306261923014654-si196.svg https://s3-eu-west-1.amazonaws.com/prod-ucs-content-store-eu-west/content/pii:S0306261923014654/image/svg+xml/96dd181cb506951e04e4f09ef4a6fd93/si196.svg si196 si196.svg svg 5265 ALTIMG 1-s2.0-S0306261923014654-si197.svg https://s3-eu-west-1.amazonaws.com/prod-ucs-content-store-eu-west/content/pii:S0306261923014654/image/svg+xml/915496e016a987a0c2aa0a23b2a3094a/si197.svg si197 si197.svg svg 4396 ALTIMG 1-s2.0-S0306261923014654-si198.svg https://s3-eu-west-1.amazonaws.com/prod-ucs-content-store-eu-west/content/pii:S0306261923014654/image/svg+xml/0277eef2938b533183097ab45dc23cae/si198.svg si198 si198.svg svg 2127 ALTIMG 1-s2.0-S0306261923014654-si200.svg https://s3-eu-west-1.amazonaws.com/prod-ucs-content-store-eu-west/content/pii:S0306261923014654/image/svg+xml/98933fe882d4628a44d387538dcfc44f/si200.svg si200 si200.svg svg 1986 ALTIMG 1-s2.0-S0306261923014654-si205.svg https://s3-eu-west-1.amazonaws.com/prod-ucs-content-store-eu-west/content/pii:S0306261923014654/image/svg+xml/64d651dc20355d6ae6d4a2213f9e046f/si205.svg si205 si205.svg svg 5377 ALTIMG 1-s2.0-S0306261923014654-si206.svg https://s3-eu-west-1.amazonaws.com/prod-ucs-content-store-eu-west/content/pii:S0306261923014654/image/svg+xml/884b88793be594d3e4c18a02a45c7a2e/si206.svg si206 si206.svg svg 22062 ALTIMG 1-s2.0-S0306261923014654-si207.svg https://s3-eu-west-1.amazonaws.com/prod-ucs-content-store-eu-west/content/pii:S0306261923014654/image/svg+xml/665dd9bb104906aa81abdeb25ddb865d/si207.svg si207 si207.svg svg 15871 ALTIMG 1-s2.0-S0306261923014654-si208.svg https://s3-eu-west-1.amazonaws.com/prod-ucs-content-store-eu-west/content/pii:S0306261923014654/image/svg+xml/8eaf5cbff9b81ad2ba4d254b16231d9f/si208.svg si208 si208.svg svg 21156 ALTIMG 1-s2.0-S0306261923014654-si209.svg https://s3-eu-west-1.amazonaws.com/prod-ucs-content-store-eu-west/content/pii:S0306261923014654/image/svg+xml/ddeff157a051f657a533420a93f96901/si209.svg si209 si209.svg svg 19169 ALTIMG 1-s2.0-S0306261923014654-si22.svg https://s3-eu-west-1.amazonaws.com/prod-ucs-content-store-eu-west/content/pii:S0306261923014654/image/svg+xml/44610509b5df4de2f65125e5f1af17b7/si22.svg si22 si22.svg svg 7962 ALTIMG 1-s2.0-S0306261923014654-si23.svg https://s3-eu-west-1.amazonaws.com/prod-ucs-content-store-eu-west/content/pii:S0306261923014654/image/svg+xml/2f05c862eaba86fb2b6b9f216805c652/si23.svg si23 si23.svg svg 7955 ALTIMG 1-s2.0-S0306261923014654-si24.svg https://s3-eu-west-1.amazonaws.com/prod-ucs-content-store-eu-west/content/pii:S0306261923014654/image/svg+xml/583449e98cbd80202334d9d4d86fd201/si24.svg si24 si24.svg svg 7365 ALTIMG 1-s2.0-S0306261923014654-si25.svg https://s3-eu-west-1.amazonaws.com/prod-ucs-content-store-eu-west/content/pii:S0306261923014654/image/svg+xml/1a46eb2f3f314f7bc10bc6c9e504082b/si25.svg si25 si25.svg svg 8042 ALTIMG 1-s2.0-S0306261923014654-si26.svg https://s3-eu-west-1.amazonaws.com/prod-ucs-content-store-eu-west/content/pii:S0306261923014654/image/svg+xml/614f5cf893e3054975a0988688013408/si26.svg si26 si26.svg svg 7360 ALTIMG 1-s2.0-S0306261923014654-si27.svg https://s3-eu-west-1.amazonaws.com/prod-ucs-content-store-eu-west/content/pii:S0306261923014654/image/svg+xml/5e50d2bdd298ad7774d0782e323bf1d8/si27.svg si27 si27.svg svg 2200 ALTIMG 1-s2.0-S0306261923014654-si28.svg https://s3-eu-west-1.amazonaws.com/prod-ucs-content-store-eu-west/content/pii:S0306261923014654/image/svg+xml/eeb931339e22f6cce828f13667b2e6f0/si28.svg si28 si28.svg svg 1796 ALTIMG 1-s2.0-S0306261923014654-si29.svg https://s3-eu-west-1.amazonaws.com/prod-ucs-content-store-eu-west/content/pii:S0306261923014654/image/svg+xml/371bc55177f4d5233039f945c473f8bf/si29.svg si29 si29.svg svg 2983 ALTIMG 1-s2.0-S0306261923014654-si3.svg https://s3-eu-west-1.amazonaws.com/prod-ucs-content-store-eu-west/content/pii:S0306261923014654/image/svg+xml/fd0c67e354ebd87285acf4ac64805b5b/si3.svg si3 si3.svg svg 4166 ALTIMG 1-s2.0-S0306261923014654-si30.svg https://s3-eu-west-1.amazonaws.com/prod-ucs-content-store-eu-west/content/pii:S0306261923014654/image/svg+xml/938e80c9ae679fcb607e1a475d7399ee/si30.svg si30 si30.svg svg 7246 ALTIMG 1-s2.0-S0306261923014654-si31.svg https://s3-eu-west-1.amazonaws.com/prod-ucs-content-store-eu-west/content/pii:S0306261923014654/image/svg+xml/6328def9efe1e0bd7be3805936e5c282/si31.svg si31 si31.svg svg 8442 ALTIMG 1-s2.0-S0306261923014654-si33.svg https://s3-eu-west-1.amazonaws.com/prod-ucs-content-store-eu-west/content/pii:S0306261923014654/image/svg+xml/5d4a03e48c8e21da9f42ff7670b89f4d/si33.svg si33 si33.svg svg 22933 ALTIMG 1-s2.0-S0306261923014654-si34.svg https://s3-eu-west-1.amazonaws.com/prod-ucs-content-store-eu-west/content/pii:S0306261923014654/image/svg+xml/6c431374241312024868131c7adcac7d/si34.svg si34 si34.svg svg 1190 ALTIMG 1-s2.0-S0306261923014654-si35.svg https://s3-eu-west-1.amazonaws.com/prod-ucs-content-store-eu-west/content/pii:S0306261923014654/image/svg+xml/af2c85b53ea9f889c4e05f9267614cc2/si35.svg si35 si35.svg svg 831 ALTIMG 1-s2.0-S0306261923014654-si36.svg https://s3-eu-west-1.amazonaws.com/prod-ucs-content-store-eu-west/content/pii:S0306261923014654/image/svg+xml/2345c5c3c85a44e6a515344656c2ffaa/si36.svg si36 si36.svg svg 3367 ALTIMG 1-s2.0-S0306261923014654-si38.svg https://s3-eu-west-1.amazonaws.com/prod-ucs-content-store-eu-west/content/pii:S0306261923014654/image/svg+xml/a447708504b6606f3379a502986632f7/si38.svg si38 si38.svg svg 3579 ALTIMG 1-s2.0-S0306261923014654-si39.svg https://s3-eu-west-1.amazonaws.com/prod-ucs-content-store-eu-west/content/pii:S0306261923014654/image/svg+xml/26a8bbf2b54dd98b846f89159c40d995/si39.svg si39 si39.svg svg 1970 ALTIMG 1-s2.0-S0306261923014654-si4.svg https://s3-eu-west-1.amazonaws.com/prod-ucs-content-store-eu-west/content/pii:S0306261923014654/image/svg+xml/2161f9463a3a699d25672683588c0f75/si4.svg si4 si4.svg svg 6505 ALTIMG 1-s2.0-S0306261923014654-si41.svg https://s3-eu-west-1.amazonaws.com/prod-ucs-content-store-eu-west/content/pii:S0306261923014654/image/svg+xml/887f86a92eeca6804702a806c6f1b189/si41.svg si41 si41.svg svg 14057 ALTIMG 1-s2.0-S0306261923014654-si42.svg https://s3-eu-west-1.amazonaws.com/prod-ucs-content-store-eu-west/content/pii:S0306261923014654/image/svg+xml/d5eeec2a6b456241de31deaa420d3af4/si42.svg si42 si42.svg svg 9555 ALTIMG 1-s2.0-S0306261923014654-si43.svg https://s3-eu-west-1.amazonaws.com/prod-ucs-content-store-eu-west/content/pii:S0306261923014654/image/svg+xml/05d886a0aa434ea813a0da1a94060bc4/si43.svg si43 si43.svg svg 9626 ALTIMG 1-s2.0-S0306261923014654-si44.svg https://s3-eu-west-1.amazonaws.com/prod-ucs-content-store-eu-west/content/pii:S0306261923014654/image/svg+xml/58459045830d5b579a5e3eb65db53ea9/si44.svg si44 si44.svg svg 11057 ALTIMG 1-s2.0-S0306261923014654-si45.svg https://s3-eu-west-1.amazonaws.com/prod-ucs-content-store-eu-west/content/pii:S0306261923014654/image/svg+xml/bd194f14fa2391c9ac5d62961d1985e3/si45.svg si45 si45.svg svg 10982 ALTIMG 1-s2.0-S0306261923014654-si46.svg https://s3-eu-west-1.amazonaws.com/prod-ucs-content-store-eu-west/content/pii:S0306261923014654/image/svg+xml/9b9d780da179541f9643c990b7f9d20d/si46.svg si46 si46.svg svg 12784 ALTIMG 1-s2.0-S0306261923014654-si47.svg https://s3-eu-west-1.amazonaws.com/prod-ucs-content-store-eu-west/content/pii:S0306261923014654/image/svg+xml/60f176d3f071124187bce99202d5dccd/si47.svg si47 si47.svg svg 24478 ALTIMG 1-s2.0-S0306261923014654-si48.svg https://s3-eu-west-1.amazonaws.com/prod-ucs-content-store-eu-west/content/pii:S0306261923014654/image/svg+xml/fd140c529cbbc38f9e6eb421cac2e580/si48.svg si48 si48.svg svg 1775 ALTIMG 1-s2.0-S0306261923014654-si49.svg https://s3-eu-west-1.amazonaws.com/prod-ucs-content-store-eu-west/content/pii:S0306261923014654/image/svg+xml/a0fc5ed8f250b38d252aaa4a603c499f/si49.svg si49 si49.svg svg 9430 ALTIMG 1-s2.0-S0306261923014654-si5.svg https://s3-eu-west-1.amazonaws.com/prod-ucs-content-store-eu-west/content/pii:S0306261923014654/image/svg+xml/f94f31bccc79986878dd0a3854989284/si5.svg si5 si5.svg svg 3469 ALTIMG 1-s2.0-S0306261923014654-si50.svg https://s3-eu-west-1.amazonaws.com/prod-ucs-content-store-eu-west/content/pii:S0306261923014654/image/svg+xml/452303aa475a8330ca0756c90ac84919/si50.svg si50 si50.svg svg 1086 ALTIMG 1-s2.0-S0306261923014654-si51.svg https://s3-eu-west-1.amazonaws.com/prod-ucs-content-store-eu-west/content/pii:S0306261923014654/image/svg+xml/41f892a8801eb0f61b66926018d51185/si51.svg si51 si51.svg svg 12390 ALTIMG 1-s2.0-S0306261923014654-si52.svg https://s3-eu-west-1.amazonaws.com/prod-ucs-content-store-eu-west/content/pii:S0306261923014654/image/svg+xml/a8b5a7dd0babe51d9edca48fc27fd393/si52.svg si52 si52.svg svg 9278 ALTIMG 1-s2.0-S0306261923014654-si53.svg https://s3-eu-west-1.amazonaws.com/prod-ucs-content-store-eu-west/content/pii:S0306261923014654/image/svg+xml/96b7fa8594a6d2be1febcb205cd928a0/si53.svg si53 si53.svg svg 10543 ALTIMG 1-s2.0-S0306261923014654-si54.svg https://s3-eu-west-1.amazonaws.com/prod-ucs-content-store-eu-west/content/pii:S0306261923014654/image/svg+xml/3acc258187689e0483e2e5d23425f4f8/si54.svg si54 si54.svg svg 12544 ALTIMG 1-s2.0-S0306261923014654-si55.svg https://s3-eu-west-1.amazonaws.com/prod-ucs-content-store-eu-west/content/pii:S0306261923014654/image/svg+xml/996e5a5c7288cb6401e1e93efb4a8772/si55.svg si55 si55.svg svg 18876 ALTIMG 1-s2.0-S0306261923014654-si58.svg https://s3-eu-west-1.amazonaws.com/prod-ucs-content-store-eu-west/content/pii:S0306261923014654/image/svg+xml/3af19b2ff289013093fdb25fbaa1c78d/si58.svg si58 si58.svg svg 5819 ALTIMG 1-s2.0-S0306261923014654-si59.svg https://s3-eu-west-1.amazonaws.com/prod-ucs-content-store-eu-west/content/pii:S0306261923014654/image/svg+xml/7ba8524db1c7a1f85ffb89a373320773/si59.svg si59 si59.svg svg 7173 ALTIMG 1-s2.0-S0306261923014654-si6.svg https://s3-eu-west-1.amazonaws.com/prod-ucs-content-store-eu-west/content/pii:S0306261923014654/image/svg+xml/4d7d013884368e7903a89758f7caa33b/si6.svg si6 si6.svg svg 5409 ALTIMG 1-s2.0-S0306261923014654-si60.svg https://s3-eu-west-1.amazonaws.com/prod-ucs-content-store-eu-west/content/pii:S0306261923014654/image/svg+xml/fd63c71903978825db0f977cb265119c/si60.svg si60 si60.svg svg 16403 ALTIMG 1-s2.0-S0306261923014654-si61.svg https://s3-eu-west-1.amazonaws.com/prod-ucs-content-store-eu-west/content/pii:S0306261923014654/image/svg+xml/afffd670d2d51f584ffd658392c0cde4/si61.svg si61 si61.svg svg 5318 ALTIMG 1-s2.0-S0306261923014654-si62.svg https://s3-eu-west-1.amazonaws.com/prod-ucs-content-store-eu-west/content/pii:S0306261923014654/image/svg+xml/1fda96343199817b007b4190ed54bb31/si62.svg si62 si62.svg svg 4206 ALTIMG 1-s2.0-S0306261923014654-si63.svg https://s3-eu-west-1.amazonaws.com/prod-ucs-content-store-eu-west/content/pii:S0306261923014654/image/svg+xml/301dd84b718ca12faf2b2cc1dba5dc06/si63.svg si63 si63.svg svg 4470 ALTIMG 1-s2.0-S0306261923014654-si65.svg https://s3-eu-west-1.amazonaws.com/prod-ucs-content-store-eu-west/content/pii:S0306261923014654/image/svg+xml/a9166ee9e9703f0654aec90deac018ba/si65.svg si65 si65.svg svg 16308 ALTIMG 1-s2.0-S0306261923014654-si67.svg https://s3-eu-west-1.amazonaws.com/prod-ucs-content-store-eu-west/content/pii:S0306261923014654/image/svg+xml/f86005b9109bb3cb5be70dbe587de073/si67.svg si67 si67.svg svg 13180 ALTIMG 1-s2.0-S0306261923014654-si68.svg https://s3-eu-west-1.amazonaws.com/prod-ucs-content-store-eu-west/content/pii:S0306261923014654/image/svg+xml/6728595671f5caf3f56e47d812fc14f5/si68.svg si68 si68.svg svg 35071 ALTIMG 1-s2.0-S0306261923014654-si69.svg https://s3-eu-west-1.amazonaws.com/prod-ucs-content-store-eu-west/content/pii:S0306261923014654/image/svg+xml/a704351263f348a71bf6d2813761d053/si69.svg si69 si69.svg svg 2578 ALTIMG 1-s2.0-S0306261923014654-si7.svg https://s3-eu-west-1.amazonaws.com/prod-ucs-content-store-eu-west/content/pii:S0306261923014654/image/svg+xml/03de723a0f5e8006f8556904d5076453/si7.svg si7 si7.svg svg 6144 ALTIMG 1-s2.0-S0306261923014654-si70.svg https://s3-eu-west-1.amazonaws.com/prod-ucs-content-store-eu-west/content/pii:S0306261923014654/image/svg+xml/d238f3cd4da673024227075dfca819a3/si70.svg si70 si70.svg svg 2698 ALTIMG 1-s2.0-S0306261923014654-si71.svg https://s3-eu-west-1.amazonaws.com/prod-ucs-content-store-eu-west/content/pii:S0306261923014654/image/svg+xml/0bd9f638171d62f7b3bc1b9eddda3c27/si71.svg si71 si71.svg svg 5725 ALTIMG 1-s2.0-S0306261923014654-si72.svg https://s3-eu-west-1.amazonaws.com/prod-ucs-content-store-eu-west/content/pii:S0306261923014654/image/svg+xml/3fede1dba197e59e082a2f17e26d216a/si72.svg si72 si72.svg svg 10275 ALTIMG 1-s2.0-S0306261923014654-si73.svg https://s3-eu-west-1.amazonaws.com/prod-ucs-content-store-eu-west/content/pii:S0306261923014654/image/svg+xml/35325df13421b5fa88d16b6df73fec65/si73.svg si73 si73.svg svg 11398 ALTIMG 1-s2.0-S0306261923014654-si74.svg https://s3-eu-west-1.amazonaws.com/prod-ucs-content-store-eu-west/content/pii:S0306261923014654/image/svg+xml/87640008ba8250d2ec1341dceedf6bed/si74.svg si74 si74.svg svg 2343 ALTIMG 1-s2.0-S0306261923014654-si75.svg https://s3-eu-west-1.amazonaws.com/prod-ucs-content-store-eu-west/content/pii:S0306261923014654/image/svg+xml/077143e2cd668e47d85a2911498d8f9d/si75.svg si75 si75.svg svg 6668 ALTIMG 1-s2.0-S0306261923014654-si76.svg https://s3-eu-west-1.amazonaws.com/prod-ucs-content-store-eu-west/content/pii:S0306261923014654/image/svg+xml/aafe9912bb3a4a03ebfa7f0f6280cea0/si76.svg si76 si76.svg svg 8389 ALTIMG 1-s2.0-S0306261923014654-si78.svg https://s3-eu-west-1.amazonaws.com/prod-ucs-content-store-eu-west/content/pii:S0306261923014654/image/svg+xml/75afa8b7e3f3ff5c426ccd46c1216284/si78.svg si78 si78.svg svg 1732 ALTIMG 1-s2.0-S0306261923014654-si8.svg https://s3-eu-west-1.amazonaws.com/prod-ucs-content-store-eu-west/content/pii:S0306261923014654/image/svg+xml/297ae3aee4b604f2300166a80eedce48/si8.svg si8 si8.svg svg 11136 ALTIMG 1-s2.0-S0306261923014654-si81.svg https://s3-eu-west-1.amazonaws.com/prod-ucs-content-store-eu-west/content/pii:S0306261923014654/image/svg+xml/452927e5244d7327fed6cc686645a7a1/si81.svg si81 si81.svg svg 13180 ALTIMG 1-s2.0-S0306261923014654-si82.svg https://s3-eu-west-1.amazonaws.com/prod-ucs-content-store-eu-west/content/pii:S0306261923014654/image/svg+xml/05ebcba2badb5d52ed8be62c3b83bdce/si82.svg si82 si82.svg svg 25251 ALTIMG 1-s2.0-S0306261923014654-si83.svg https://s3-eu-west-1.amazonaws.com/prod-ucs-content-store-eu-west/content/pii:S0306261923014654/image/svg+xml/a308e9631bbb73f4271f3f51d4e13519/si83.svg si83 si83.svg svg 44895 ALTIMG 1-s2.0-S0306261923014654-si86.svg https://s3-eu-west-1.amazonaws.com/prod-ucs-content-store-eu-west/content/pii:S0306261923014654/image/svg+xml/669e04cf2d8d53b64e5878b70ad92fde/si86.svg si86 si86.svg svg 1252 ALTIMG 1-s2.0-S0306261923014654-si87.svg https://s3-eu-west-1.amazonaws.com/prod-ucs-content-store-eu-west/content/pii:S0306261923014654/image/svg+xml/1438c47b780c79ac3b6e672ba4c77aa6/si87.svg si87 si87.svg svg 1571 ALTIMG 1-s2.0-S0306261923014654-si88.svg https://s3-eu-west-1.amazonaws.com/prod-ucs-content-store-eu-west/content/pii:S0306261923014654/image/svg+xml/6e06fd230a68f5e6dbbd7a590c9f4b51/si88.svg si88 si88.svg svg 13028 ALTIMG 1-s2.0-S0306261923014654-si89.svg https://s3-eu-west-1.amazonaws.com/prod-ucs-content-store-eu-west/content/pii:S0306261923014654/image/svg+xml/1f813b06f6020ca3061d3f09f3c8c5f1/si89.svg si89 si89.svg svg 3161 ALTIMG 1-s2.0-S0306261923014654-si9.svg https://s3-eu-west-1.amazonaws.com/prod-ucs-content-store-eu-west/content/pii:S0306261923014654/image/svg+xml/e5a366f7e9c40448b5c8a017b3c727a1/si9.svg si9 si9.svg svg 8108 ALTIMG 1-s2.0-S0306261923014654-si92.svg https://s3-eu-west-1.amazonaws.com/prod-ucs-content-store-eu-west/content/pii:S0306261923014654/image/svg+xml/6701198b3a47a3cedc8bd51c229d1387/si92.svg si92 si92.svg svg 20175 ALTIMG 1-s2.0-S0306261923014654-si94.svg https://s3-eu-west-1.amazonaws.com/prod-ucs-content-store-eu-west/content/pii:S0306261923014654/image/svg+xml/cd19926319e8bfd4d043892b4ef2cec9/si94.svg si94 si94.svg svg 11288 ALTIMG 1-s2.0-S0306261923014654-si96.svg https://s3-eu-west-1.amazonaws.com/prod-ucs-content-store-eu-west/content/pii:S0306261923014654/image/svg+xml/cf4f69473f5460177cdc3cafab59fc84/si96.svg si96 si96.svg svg 14146 ALTIMG 1-s2.0-S0306261923014654-si97.svg https://s3-eu-west-1.amazonaws.com/prod-ucs-content-store-eu-west/content/pii:S0306261923014654/image/svg+xml/53176f271769de5adbb33057a8fb11d3/si97.svg si97 si97.svg svg 9000 ALTIMG 1-s2.0-S0306261923014654-si98.svg https://s3-eu-west-1.amazonaws.com/prod-ucs-content-store-eu-west/content/pii:S0306261923014654/image/svg+xml/b988db7987506021236a8742692bf591/si98.svg si98 si98.svg svg 3271 ALTIMG 1-s2.0-S0306261923014654-si99.svg https://s3-eu-west-1.amazonaws.com/prod-ucs-content-store-eu-west/content/pii:S0306261923014654/image/svg+xml/3f0821342e43f011a26ae5a838b109ba/si99.svg si99 si99.svg svg 2888 ALTIMG 1-s2.0-S0306261923014654-am.pdf https://s3-eu-west-1.amazonaws.com/prod-ucs-content-store-eu-west/content/egi:10WWP0SLBRM/MAIN/application/pdf/67c1aecdc72360b3d3082c503015230b/am.pdf am am.pdf pdf false 11943703 AAM-PDF APEN 122101 122101 S0306-2619(23)01465-4 10.1016/j.apenergy.2023.122101 The Author(s) Fig. 1 Summary of the investigated case studies. The images of the facilities are sourced from [34]. Fig. 2 The NEST building in Dübendorf, Switzerland. Fig. 3 Layout of the UMAR unit in the NEST building with the controlled rooms marked. ©Werner Sobek. Fig. 4 Domestic hot water heating of the residential unit with a buffer tank. Fig. 5 Stationary Lithium-ion electric battery. Fig. 6 Information exchange among the controller, the external numerical weather forecast provider (i.e., MeteoSwiss), and the hardware in the experiments. Fig. 7 Boxplots of energy consumption and constraint violation for different data-driven predictive control algorithms. Fig. 8 Representative input\u2013output trajectories for different data-driven predictive control algorithms. Fig. 9 Prediction accuracy and constraint tightening of SMM-PC in Room 272. Fig. 10 Prediction accuracy and constraint tightening of BiLevel in Room 272. Fig. 11 Malfunctioning of DeePC with λ g = 100 in Room 273. Fig. 12 Experimental results of space heating control. Top plot: results for Room 272. Middle plot: results for Room 273. Bottom plot: results for Room 274. The dashed black curves show temperature limits. The solid blue curves show temperature trajectories. The dashed purple curves show controller decisions (scale at left). The solid olive curves show realized thermal power inputs into the rooms in relative terms by normalizing using thermal power capacities (scale at right). Fig. 13 Experimental results of controlling domestic hot water heating. Top plot: the solid blue curve shows the average tank temperature trajectory and the dashed black lines indicate temperature limits (scale at left). The solid green curve shows the actual water draw profile (scale at right). Bottom plot: the solid blue curve shows the measured thermal power into the tank and the dashed black lines indicate expected thermal power limits. The maximum power varies depending on supply temperature. Fig. 14 Experimental results for the control of an electric battery. Top plot: resource planning task. Bottom plot: reference tracking task. The solid blue curves show the actual SOC. The dashed black lines indicate temperature limits for the top plot and the reference trajectory for the bottom plot. Table 1 Energy consumption and constraint violation results of different data-driven algorithms under high uncertainties. Scenario 1: high output noise, Scenario 2: high disturbance prediction errors. Values in brackets indicate changes with respect to the nominal results. (a) Scenario 1: average energy consumption [kWh] Room 272 Room 273 Room 274 SMM-PC 58.1 (＋1.1) 112.4 (＋1.4) 52.4 (−0.5) N4SID 63.3 (＋2.2) 132.0 (＋5.3) 57.0 (＋3.6) Bilevel 61.5 (＋2.0) 127.5 (＋8.9) 55.8 (−0.7) DeePC 59.4 (＋0.0) 120.2 (＋5.8) 54.4 (−2.8) (a) Scenario 2: average energy consumption [kWh] Room 272 Room 273 Room 274 SMM-PC 59.6 (＋2.6) 107.1 (−4.0) 53.2 (＋0.4) N4SID 61.1 (＋0.0) 129.7 (＋3.0) 53.5 (＋0.1) Bilevel 60.0 (＋0.5) 126.1 (＋7.5) 57.0 (＋0.5) DeePC 59.5 (＋0.1) 117.7 (＋3.2) 57.2 (−0.1) (b) Scenario 1: average constraint violation [ ° C h] Room 272 Room 273 Room 274 SMM-PC 0.25 (−0.16) 1.69 (＋0.29) 0.06 (＋0.03) N4SID 0.25 (−0.73) 1.62 (−0.58) 0.47 (−0.83) Bilevel 3.46 (＋0.25) 10.45 (＋6.10) 3.82 (＋3.15) DeePC 3.06 (−1.15) 5.62 (−2.36) 1.79 (＋1.12) (b) Scenario 2: average constraint violation [ ° C h] Room 272 Room 273 Room 274 SMM-PC 0.04 (−0.37) 1.49 (＋0.08) 0.04 (＋0.00) N4SID 1.05 (＋0.07) 2.02 (−0.17) 1.28 (−0.02) Bilevel 2.49 (−0.71) 3.33 (−1.02) 0.46 (−0.21) DeePC 4.00 (−0.21) 7.54 (−0.44) 0.67 (＋0.00) Data-driven predictive control for demand side management: Theoretical and experimental results Mingzhou Yin Writing \u2013 review & editing Writing \u2013 original draft Visualization Validation Software Resources Project administration Methodology Investigation Formal analysis Data curation Conceptualization a 1 Hanmin Cai Writing \u2013 review & editing Writing \u2013 original draft Visualization Validation Software Resources Project administration Methodology Investigation Formal analysis Data curation Conceptualization b \u204e 1 Andrea Gattiglio Writing \u2013 review & editing Visualization Validation Software Investigation Formal analysis b Fazel Khayatian Writing \u2013 review & editing Software b Roy S. Smith Writing \u2013 review & editing a Philipp Heer Writing \u2013 review & editing b a Automatic Control Laboratory, Swiss Federal Institute of Technology in Zürich, Zürich, Switzerland Automatic Control Laboratory, Swiss Federal Institute of Technology in Zürich Zürich Switzerland Automatic Control Laboratory, Swiss Federal Institute of Technology in Zürich, Zürich, Switzerland b Urban Energy Systems Laboratory, Swiss Federal Laboratories for Material Science and Technology (Empa), Dübendorf, Switzerland Urban Energy Systems Laboratory, Swiss Federal Laboratories for Material Science and Technology (Empa) Dübendorf Switzerland Urban Energy Systems Laboratory, Swiss Federal Laboratories for Material Science and Technology (Empa), Dübendorf, Switzerland \u204e Corresponding author. 1 These authors contributed equally to this work. Demand side management is perceived as a tool to support a secure and reliable energy system operation amid growing integration of renewable energy resources. However, the lack of scalable modeling and control procedures hinders the practical implementation. To address this challenge, this paper proposes a novel signal matrix model predictive control algorithm. Compared to existing data-driven methods, this approach explicitly provides stochastic predictions considering both disturbance and measurement errors with few tuning parameters, ensuring reliability by high-probability constraint satisfaction. The performance is extensively compared with three state-of-the-art algorithms in a space heating case study using a high-fidelity simulator. The results are further validated with physical experiments using the same system that the simulator is based on. To assess transferability, the algorithm is further implemented on diverse controlled systems, including a domestic hot water heating system and a stationary electric battery. The simulation results show that, compared to existing data-driven methods, the proposed approach improves constraint satisfaction and energy savings by up to 90 % and 8 %, respectively. The experimental results further confirm that the algorithm is applicable to multiple tasks of demand side management, with reasonable control performance observed in all case studies. Keywords Data-driven control Building energy management Signal matrix model predictive control Demand side management Space heating Domestic hot water heating Data availability Data will be made available on request. Nomenclature DeePC Data-Enabled Predictive Control DHW Domestic Hot Water DSM Demand Side Management MPC Model Predictive Control OCP Optimal Control Problem OPC Open Platform Communications PLC Programmable Logic Controller SH Space Heating SMM-PC Signal Matrix Model Predictive Control SOC State of Charge SPC Subspace Predictive Control 1 Introduction While the increasing penetration of renewable energy resources contributes to mitigating climate change, the intermittency in their production is expected to significantly challenge the energy system operation. Meanwhile, the International Energy Agency estimates that one billion households and eleven billion smart appliances could actively participate in demand response programs globally by 2040 [1, p. 83], which can be seen as a subcategory of demand side management (DSM). This opens up the possibility of applying active DSM on a large scale to cope with the surge of renewable energy, as well as facilitating energy conservation and improving the occupants\u2019 comfort. In the existing literature, model predictive control (MPC) [2] has been viewed as a promising control strategy to enable DSM [3]. For example, MPC is used to provide distributed coordination of buildings to support flexible energy infrastructure operation, as shown in Refs. [4,5]. However, due to the large number of heterogeneous controlled systems, first-principles modeling approaches cannot ensure timely and cost-effective implementation. In fact, modeling often takes up the majority of the budget in applying model-based control, in terms of both time and cost [6,7]. Therefore, data-driven control methods have recently received considerable attention [8]. This work addresses this challenge by developing a novel data-driven control algorithm and systematically assessing its performance across heterogeneous components in simulation and experimental studies. 1.1 Critical literature review Experimentally validated data-driven controllers in the literature can be broadly classified into three categories: model-free approaches based on reinforcement learning [9], machine-learning-based modeling of physical systems [10], and data-driven predictive control based on the behavioral system theory [11,12]. A qualitative comparison between these methods is reported in [13]. Additionally, Kazmi et al. [9] report poor generalization capability of reinforcement learning for the same type of loads in a large-scale experimental study. Bünning et al. [14] conclude with a comprehensive comparison that machine-learning-based modeling performs worse than the classical approach based on linear regression and has poor sample efficiency. Despite many machine learning techniques being known to be susceptible to small perturbations [15], both works do not consider measurement noise explicitly, which is unrealistic in the residential building sector. Additionally, most studies only focus on one type of controlled system without evaluating the controller\u2019s transferability, which is insufficient given our task of controlling different types of heterogeneous systems on the demand side. This work focuses on data-driven predictive control methods based on the behavioral system theory [16]. Compared with techniques based on machine learning, such methods are known to have excellent data efficiency with minimum training and tuning effort but are not inherently adapted to nonlinearities [13]. The methods along this line include MPC based on subspace identification [17\u201319], indirect methods such as subspace predictive control (SPC) [20], and direct methods such as data-enabled predictive control (DeePC) [21]. However, the subspace-identification-based approach requires additional model order selection and state observer design procedures. While DeePC provides a simple implementation pipeline, tuning the hyperparameters can be extremely time-intensive. DeePC is also not easily interpretable since the input\u2013output mapping is not well-defined. More specifically, the characteristics and mathematical details of these methods are reviewed and distinguished in Section 2.2. More importantly, reliable frameworks to obtain uncertainty models for robust constraint satisfaction are not available yet, which is crucial for building-related applications. In this work, a novel indirect data-driven predictive control framework, dubbed signal matrix model predictive control (SMM-PC), is presented. SMM-PC is first proposed in [22,23] with maximum likelihood prediction. Reliable stochastic prediction under noise is later provided in [24], which is very difficult to obtain in other data-driven methods. On the other hand, stochastic MPC approaches have been widely studied in the literature [25] and applied in the building sector [26], and guarantee high-probability constraint satisfaction by enforcing chance constraints. Similar techniques can be applied to stochastic data-driven predictors. 1.2 Unique contribution and paper organization The contributions of this work are threefold. Firstly, the existing SMM-PC algorithm is extended to explicitly account for disturbances and measurement noise by incorporating the stochastic control framework with chance constraints. This algorithm provides a disciplined yet easy-to-implement approach to achieve reliable operation with data-driven methods under various uncertainties. Secondly, the performance is extensively analyzed by comparing multiple state-of-the-art data-driven algorithms using a high-fidelity simulator for space heating (SH) control. Results demonstrate that the proposed stochastic SMM-PC algorithm not only satisfies operating constraints more reliably than competing methods, but it also reduces energy consumption at the same time. In addition, experiments have been carried out to validate the controller\u2019s performance on the same facility on which the simulator has been built. Lastly, the transferability is experimentally evaluated across different types of controlled systems, including a domestic hot water (DHW) heating system and a stationary electric battery. It is demonstrated that the SMM-PC algorithm is easily transferable to different types of controlled systems with satisfactory performance since there are very few tuning parameters involved. The rest of this paper is structured as follows. The next section briefly revisits the theoretical background of data-driven predictive control and introduces the stochastic SMM-PC algorithm. Section 3 describes simulation and experimental case studies to evaluate the performance and transferability of the proposed algorithm. Multiple algorithms are then benchmarked using a high-fidelity simulator, and the results are summarized in Section 4. Experimental validation and transferability results are summarized in Section 5. Finally, Section 6 concludes the work and outlines future work. 2 Methodology In this section, the theoretical background of data-driven predictive control is briefly revisited, and various extensions to account for noise and uncertainties are discussed. The prediction accuracy using the indirect approach with the signal matrix model is then quantified. Finally, a stochastic indirect data-driven predictive control scheme with constraint tightening is presented to ensure that constraints are satisfied with a predefined probability. Notation. The expected value and covariance of a random variable are denoted by E [ ⋅ ] and cov ( ⋅ ) , respectively. The symbol P ( ⋅ ) indicates the probability of a random event. For a sequence of matrices X 1 , \u2026 , X n , we denote [ X 1 ⊤ \u2026 X n ⊤ ] ⊤ by col X 1 , \u2026 , X n . Given a signal x : Z → R n , its trajectory from k to k + N − 1 is indicated by ( x i ) i = k k + N − 1 = col ( x k , \u2026 , x k + N − 1 ) . For a vector x , \u2016 x \u2016 P denotes the weighted l 2 -norm ( x ⊤ P x ) 1 2 . The rank and trace of a matrix are indicated by rank ( ⋅ ) and tr ( ⋅ ) , respectively. 2.1 Data-driven predictive control Consider a discrete-time linear time-invariant (LTI) dynamical system with disturbance and output noise, given by (1) x t + 1 = A x t + B u t + E w t , y t = C x t + D u t + v t , where x t ∈ R n x , u t ∈ R n u , y t ∈ R n y , w t ∈ R n w , and v t ∈ R n y are the states, inputs, outputs, disturbance, and output noise, respectively. The noise v t is considered to be zero-mean, independent, and identically distributed with a variance of σ 2 . The noise-free output is denoted by y t 0 . In conventional MPC algorithms, the output is predicted and controlled by iteratively propagating the state-space model (1), assuming the knowledge of the model parameters ( A , B , C , D , E ) is available. In data-driven predictive control, however, no prior knowledge about the parameters is required, but a matrix of input-disturbance-output trajectory data (2) Z = z 0 d ⋯ z M − 1 d has to be collected from historical data or high-fidelity simulation, where each column (3) z i d = col u t i d , \u2026 , u t i + L − 1 d , w t i d , \u2026 , w t i + L − 1 d , y t i d , \u2026 , y t i + L − 1 d is a length- L trajectory of the system. This matrix is referred to as the signal matrix [22]. Using Willems\u2019 fundamental lemma [27] in the behavioral system theory, a nonparametric input\u2013output mapping can be directly obtained from the signal matrix Z when no noise is present, i.e., v t = 0 [28]. The method is summarized as follows. With sufficiently persistently exciting inputs, the range space of Z contains all possible trajectories of the system. Let L = L 0 + L \u2032 , and L 0 be no smaller than the observability index of the system. Define a partition of Z as (4) Z = col U , W , Y p , Y f = col Ψ , Y p , Y f , where U ∈ R n u L × M , W ∈ R n w L × M , Y p ∈ R n y L 0 × M , Y f ∈ R n y L \u2032 × M , and Ψ ∈ R ( n u + n w ) L × M . The noise-free signal matrix satisfies the rank condition (5) rank ( Z ) = rank col Ψ , Y p = ( n u + n w ) L + n x . Then, the L \u2032 -step-ahead output predictor y t = ( y k ) k = t t + L \u2032 − 1 at time t can be constructed from the past input sequence u ini t = ( u k ) k = t − L 0 t − 1 , the future input sequence u t = ( u k ) k = t t + L \u2032 − 1 , the disturbance sequence w t = ( w k ) k = t − L 0 t + L \u2032 − 1 , and the past output sequence y ini t = ( y k ) k = t − L 0 t − 1 by solving the linear equations (6) Ψ Y p g = col u ini t , u t , w t , y ini t , where g ∈ R M is an intermediate vector. The output prediction is then given by (7) y t = Y f g . Although (6) is generally underdetermined with sufficient data such that M > rank col Ψ , Y p , the output prediction is unique for all solutions to (6) due to the rank condition (5). In this work, optimal controllers are designed to minimize given control objectives J u u t , e.g., energy consumption, subject to input and output constraints u t ∈ U t , y t ∈ Y t at time t . In particular, we consider polytopic output constraints Y t = y t h i t y t ≤ q i t , i = 1 , \u2026 , n c . Similar to standard MPC, the scheme is applied in a receding horizon fashion. In detail, replacing the state-space model (1) with predictor (6), (7), the following finite-horizon optimal control problem (OCP) is solved at each time step t : (8a) min u t J u u t (8b) s.t. (6), (7) , u t ∈ U t , h i t y t ≤ q i t , ∀ i = 1 , \u2026 , n c . Then, the first element in the optimal control sequence is applied. 2.2 Extensions under noise and uncertainties In practice, however, when there exist noise and uncertainties, the above algorithm cannot be directly applied. This is because the predictor, defined in (6) and (7), is not well-defined when the rank condition (5) no longer holds in the presence of noise. In this work, two sources of uncertainties are considered. (1) Noise in output measurements. This leads to noise in the output part of the signal matrix Y p , Y f , and the past output sequence y ini t with E y ini t = y ̄ ini t , cov y ini t = Σ y . (2) Uncertainties in online disturbance measurements and predictions w t with E w t = w ̄ t , cov w t = Σ w . Three types of modifications to the algorithm have been proposed in the literature. Subspace identification This method aims to recover the rank condition (5) to retain the uniqueness of the predictor, usually via singular value decomposition or QR decomposition [29]. This problem is extensively studied in the subspace identification literature [18]. Although a state-space realization is not required for prediction, the resulting algorithm is equivalent to applying the standard MPC algorithm with state-space models identified by subspace identification [30]. Standard subspace identification algorithms such as N4SID can be directly applied to the signal matrix Z [31]. Indirect data-driven predictive control This method aims to obtain a unique predictor by finding a unique solution g to the underdetermined problem (6). This typically involves solving optimization problems that find the optimal g with respect to some statistical or empirical objectives, i.e., the constraint (6) is replaced by a lower-level optimization problem over g . The control problem then becomes a bi-level OCP, whose usual form is shown below. (9a) min u t J u u t (9b) s.t. y t = Y f g , u t ∈ U t , h i t y t ≤ q i t , ∀ i = 1 , \u2026 , n c , (9c) g t = arg min g \u2016 Y p g − y ̄ ini t \u2016 S 2 + λ \u2016 g \u2016 2 2 s.t. Ψ g = col u ini t , u t , w ̄ t , where λ and S are design parameters. The term \u2016 Y p g − y ̄ ini t \u2016 S 2 penalizes the error in the past output sequence, whereas the term \u2016 g \u2016 2 2 is associated with the prediction error [24]. See [24] for a summary on selecting λ and S . Note that the lower-level problem (9c) admits linear closed-form solutions (10) g t = R 1 R 2 R 3 R 4 col u ini t , u t , w ̄ t , y ̄ ini t , where (11) R 1 R 2 R 3 = F − 1 Ψ ⊤ ( Ψ F − 1 Ψ ⊤ ) − 1 , (12) R 4 = F − 1 − F − 1 Ψ ⊤ ( Ψ F − 1 Ψ ⊤ ) − 1 Ψ F − 1 Y p ⊤ S , (13) F = λ I + Y p ⊤ S Y p . So (9c) can be implemented as linear equality constraints. When S = I and λ → 0 , this algorithm is also known as SPC [20]. Direct data-driven predictive control This method allows ill-defined predictors and applies regularization to penalize unreliable predictions. The term \u2018direct\u2019 comes from the fact that there is no intermediate input\u2013output mapping derived explicitly. The OCP, in its standard form, becomes: (14a) min u t J u u t + λ g \u2016 Π g \u2016 p p + λ y \u2016 Y p g − y ̄ ini t \u2016 2 2 (14b) s.t. Ψ g = col u ini t , u t , w t , y t = Y f g , (14c) u t ∈ U t , h i t y t ≤ q i t , ∀ i = 1 , \u2026 , n c , where the two regularization terms are similar to the objective in the lower-level problem (9c), and λ g , λ y , and Π are design parameters. This type of algorithm is also known as DeePC [21]. However, no systematic approaches have been proposed to tune λ g and λ y . Exhaustive parameter tuning can be extremely time-intensive for systems with large time constants, such as buildings. 2.3 Signal matrix model All three types of algorithms can obtain reasonable performance under noise and uncertainties. However, these predictors only provide nominal predictions and are applied via certainty equivalence. The lack of error quantification makes them problematic to apply in energy systems where safety and reliability are prioritized. Therefore, a stochastic predictor is used to provide high-probability constraint satisfaction, based on the indirect data-driven predictive control paradigm. The prediction error in indirect data-driven predictive control is analyzed in [24] and the results are summarized in Theorem 1. Theorem 1 Signal Matrix Model The L \u2032 -step-ahead output predictor is given by (15) E y t = y ̄ t , cov y t = Σ t , where (16) y ̄ t = Y f g t − Γ ( Y p g t − y ̄ ini t ) , (17) Σ t = Γ Σ y Γ ⊤ + Γ w Σ w Γ w ⊤ + \u2016 g t \u2016 2 2 T , (18) T = σ 2 Γ Γ ⊤ + I , Γ w = ( Y f − Γ Y p ) R 3 , (19) Γ = col C A L 0 , \u2026 , C A L − 1 col C , \u2026 , C A L 0 − 1 \u2020 , is the autonomous transformation matrix from y ini t to y t . Theorem 1 comes directly from the proof of Theorem 1 in [24] by considering augmented inputs u t ⊤ w t ⊤ ⊤ . The predictor (15) is named the signal matrix model. Since the model parameters ( A , C ) are unknown, Γ is not known exactly. In common with [24], it is estimated from Z as (20) Γ ˆ = Y f R 4 in what follows. 2.4 Stochastic indirect data-driven predictive control Theorem 1 quantifies the stochastic prediction error in indirect data-driven predictors. Therefore, indirect data-driven predictive control can be extended to provide stochastic control, using similar techniques to those in stochastic MPC. This leads to the following stochastic control problem. (21a) min u t J u u t (21b) s.t. y t ∼ F u ini t , u t , w ̄ t , y ̄ ini t ; Z , (21c) u t ∈ U t , P h i t y t ≤ q i t ≥ p , ∀ i = 1 , \u2026 , n c , where F ( ⋅ ) is the stochastic data-driven predictor, whose mean and covariance are given in Theorem 1. Due to the potentially unbounded noise, the output constraints cannot be satisfied robustly, but only with a high probability p as chance constraints. Unfortunately, the chance constraints (21c) are non-convex. The following proposition provides convex surrogates that guarantee the satisfaction of (21c). Proposition 1 Constraints (21c) are guaranteed by the second-order cone constraints (22) h i t y ̄ t ≤ q i t − μ c 1 + c 2 \u2016 g t \u2016 2 , ∀ i = 1 , \u2026 , n c , where (23) c 1 = h i t Γ Σ y Γ ⊤ + Γ w Σ w Γ w ⊤ h i t ⊤ , (24) c 2 = h i t T h i t ⊤ , μ = 1 1 − p − 1 . Proof See Appendix.□ Then, we are ready to present the indirect data-driven stochastic predictive control scheme with the signal matrix model. The nominal prediction is given by (16) using the intermediate vector g t given in (10) and the chance constraints are guaranteed by (22). The procedure is summarized in Algorithm 1. Compared with the SMM-PC algorithm proposed in [22,23], Algorithm 1 guarantees chance constraint satisfaction by replacing the nominal constraints with the tightened constraints (22) based on prediction error quantification. It also considers disturbances w t to the system with uncertainties in online disturbance measurement and prediction. The following remarks discuss some modifications to the algorithm. Remark 1 If the distributions of v t , y ini t , and w t are assumed to be Gaussian, the stochastic predictor F ( ⋅ ) is also Gaussian. Constraints (22) can be relaxed by choosing μ = F N − 1 ( p ) , where F N − 1 ( ⋅ ) is the inverse of the cumulative distribution function of a Gaussian distribution. Remark 2 If tracking control is desired, the control objective can be augmented to J ctr u t , y t = J u u t + J y y t , where J y y t = E \u2016 y t − r t \u2016 Q 2 is the expected output tracking cost and r t is the reference trajectory. The expected output cost is calculated as (26) E \u2016 y t − r t \u2016 Q 2 = \u2016 y ̄ t − r t \u2016 Q 2 + E e t ⊤ Q e t = \u2016 y ̄ t − r t \u2016 Q 2 + tr Q Σ t = \u2016 y ̄ t − r t \u2016 Q 2 + tr Q T \u2016 g t \u2016 2 2 + const , where e t is the prediction error. It includes an additional \u2016 g t \u2016 2 2 -penalty term on top of the nominal output cost. Remark 3 The algorithm is rigorously applicable only to linear systems. However, it has been demonstrated numerically [32] and experimentally [33] that such data-driven predictive control algorithms can be effectively applied to nonlinear systems as well. Nonlinearities can be considered as additional output errors in the signal matrix Z . To estimate the magnitude of the combined output error of both the output noise and the nonlinearities, linear system identification is conducted using the n4sid command in Matlab, and the noise level σ 2 is set to the mean squared error of the prediction with the linear model. 3 Case studies A series of numerical and experimental case studies have been carried out to evaluate the performance and transferability of the stochastic SMM-PC algorithm. The studies, summarized in Fig. 1, consider transferability across heterogeneous controlled systems, transferability from simulation to experiment, and the impacts of certain control tasks. The rest of the section elaborates on each case study. 3.1 Controlled systems and tasks Three controlled systems were investigated: a space heating system, a DHW heating system, and a stationary Lithium-ion electric battery, representing typical demand-side resources. All the system configurations and data presented in the rest of the paper are based on the NEST building located at Empa in Switzerland [35], shown in Fig. 2. Typical control tasks include constrained resource planning and trajectory tracking. In the building sector, constrained resource planning is prevalent and aims to minimize total energy consumption while ensuring constraint satisfaction. Reference tracking tasks can also be formulated for the stationary electric battery, as it is considered to be a promising candidate for ancillary service provision through tracking reference signals set by system operators [36]. 3.1.1 Space heating The system considered in this study is a three-room apartment, shown in Fig. 3, hereafter referred to as the UMAR unit. Each room was treated as one thermal zone and heating power was dissipated into the zones through constant volume radiant ceiling panels. The continuous power setpoint, determined by the controller, was realized by regulating the valve opening, which was converted into discrete opening and closing sequences using power-width modulation logic. Additionally, the control of space heating was subject to constraints imposed by occupants\u2019 perception of comfort. Although other indoor conditions also influence occupants\u2019 comfort, temperature sensors are the most commonly available for assessment, so thermal comfort bounds were expressed as temperature limits in this study. As the unit is residential, the thermal comfort bounds were predefined, considering the unit to be unoccupied during the day and occupied during the night. The definition led to relaxed temperature constraints during unoccupied hours. Specifically, the constraints were set to be between 20 ° C and 26 ° C from 08:00 to 16:59 and between 22 ° C and 24 ° C from 17:00 to 07:59 of the second day. Various approaches have been proposed in the literature to compare control algorithms for space heating, ranging from a simulation-only approach using a hypothetical physics-based model [37] to an experiment-only approach with a placebo comparison [10]. The latter requires two identical physical systems running different control algorithms in identical conditions, which is rarely possible in reality. Other studies employ a degree-day metric [7], in which average boundary condition (e.g., ambient temperature) is considered neglecting other factors such as heat gains. In this work, we first benchmarked control algorithms on a high-fidelity white-box model of the physical system shown in Fig. 3 [38]. The model was based on detailed knowledge of the system layout and the heat storage and transfer characteristics of the construction materials. Additionally, the model was calibrated with three-year field measurements at a 1-min temporal resolution, capturing both the dynamics of the physical system and the heat gains due to occupants. Due to the high model fidelity, a high level of confidence in the expected control performance can be ensured. The transparency and reproducibility of the results are ensured by providing the model in an open repository [39]. An experimental study was then conducted to evaluate constraint satisfaction with Algorithm 1 using the signal matrix model. 3.1.2 Domestic hot water heating Energy consumption of DHW is taking an increasing share of the total energy consumption, especially for newly-constructed and renovated buildings with better-insulated envelopes [40]. DHW is often equipped with a water buffer tank as shown in Fig. 4, for hydraulic decoupling and reducing the load diversity factor. Energy scheduling needs to guarantee sufficient hot water storage within the tank and a minimum temperature constraint of 45 °C was considered. Additional periodic temperature boosting to the level of 60 °C is necessary to avoid Legionella contamination [41]. In this work, temperature boosting once per week was considered by introducing a step change in the lower temperature limit, the time series of which can be found in Section 5. The water tank has three temperature sensors vertically distributed along the tank wall, and the measurements differ due to stratification. In the experiment, the average measurement was considered. Lastly, due to high uncertainties associated with individual occupants\u2019 water draw activities, a persistence forecast of water draw was implemented using the most recent weekly water draw patterns. 3.1.3 Stationary electric battery Stationary electric batteries (see Fig. 5) are increasingly popular in the residential sector due to the large mismatch between rooftop solar production and the residential load pattern. Such electricity storage can be used for arbitrage in the electricity market through constrained energy scheduling and for stabilizing power system frequency through reference tracking. Since no standard evaluation metric and use case can be found in the literature, two simple artificial case studies were considered. In the first case study, the amplitudes of battery charging and discharging power were minimized while guaranteeing that the state-of-charge (SOC) was maintained within the predefined dynamic limits. Since the limits varied over time, knowledge of the future system response was necessary. In the second case study, the battery\u2019s charging and discharging powers were controlled such that its SOC followed a reference signal. Although classical PID control schemes also excel at reference tracking and the future system response is not crucial to consider, this case study was carried out to cover all possible applications. Detailed time-series views of the dynamic limits and reference signal are provided in Section 5. 3.2 Simulation and experimental configurations Both simulation and experimental studies were conducted to evaluate the proposed algorithm. The simulation study was mainly used to benchmark multiple data-driven control algorithms under the same boundary conditions and the experimental study validated the performance and the transferability in real configurations. 3.2.1 Simulation The performance of multiple data-driven control algorithms was benchmarked in a space heating example using the high-fidelity testbed nestli [38]. Its core uses an EnergyPlus model of the UMAR unit in the NEST building, the layout of which is shown in Fig. 3. To actively override variables during the simulation, the EnergyPlus model was wrapped into a functional mock-up unit (FMU) and integrated into a Simulink simulation model. This provides a digital twin for accurate benchmarking of different control algorithms. Matlab & Simulink simulations were conducted to implement space heating control of the three main rooms (Rooms 272, 273, and 274 in Fig. 3) in UMAR using the Matlab version of [38]. The three rooms were separately controlled. The control sample time was 15 min. For each room, the controller was implemented as follows. Input: The heating power [kW] was considered as the input u t and was constrained to be positive and upper-bounded by the maximum heating power. The maximum heating power depends on the difference between the supply and the return temperatures [ ° C ]. Since the heating system was not modeled in this case study, constant temperature differences were considered throughout the control horizon. The input command was implemented by pulse-width modulation of binary valve position with a 1-min resolution. Output: The room temperature [ ° C ] was considered as the output y t . Output noise with a variance of 0.01 was added to all measurements. Disturbance: The ambient temperature [ ° C ] and the global horizontal irradiance [W/m 2 ] were considered as the disturbances w t . The variances of the ambient temperature and the irradiance predictions were assumed to be 0.04 and 25 respectively. Objective: The control objective was to minimize the total energy consumption within the control horizon, i.e., J u u t = \u2016 u t \u2016 1 . The following data-driven algorithms were compared in simulation. SMM-PC Algorithm 1 was applied using the minimum mean-squared error predictor described in [24] with S = Γ ̄ ⊤ Γ ̄ , λ = n y L σ 2 + tr S σ 2 , where Γ ̄ is the last n y L columns of Y f col Ψ , Y p \u2020 . This design shows a good prediction accuracy in [24]. N4SID A state-space model of order n x = L 0 was identified by subspace identification in the innovation form: (27) x ˆ t + 1 = A ˆ x ˆ t + B ˆ u t + E ˆ w t + L ˆ e t , y t = C ˆ x ˆ t + D ˆ u t + e t using the Matlab command n4sid, where A ˆ , B ˆ , C ˆ , D ˆ , E ˆ , and L ˆ are the estimated model parameters, x ˆ t is the state estimate, and e t quantifies the model error whose variance was estimated by n4sid. The stochastic MPC with chance constraints described in [42] was implemented by considering both the stochastic model error e t and the disturbance uncertainty in w t . BiLevel The robust bi-level data-driven control algorithm presented in [11] was implemented. The algorithm augments the standard indirect data-driven predictive control (9c) with robustness to bounded disturbance uncertainties and an affine disturbance feedback term [43]. Since stochastic disturbance uncertainties were considered in this work, a high-probability disturbance set described with w t ∈ w t w t − w ̄ t ⊤ Σ w − 1 w t − w ̄ t ≤ μ was used. Note that the online adaptation in [11] was not implemented for a fair comparison against other algorithms. DeePC The direct data-driven predictive control algorithm described in [32] (specifically its Eq. (16)) was implemented by choosing p = 2 , Π = I − col Ψ , Y p \u2020 col Ψ , Y p , and a sufficiently large λ y value. Nominal output constraints were enforced since this approach cannot quantify the prediction error due to its implicit predictor structure. The three competing algorithms (N4SID, BiLevel, and DeePC) were selected to represent the state-of-the-art practices for the three types of data-driven predictive control algorithms described in Section 2.2, respectively. The following parameters were used in the controllers: L 0 = 10 (2.5 h), L \u2032 = 15 (3.75 h), and p = 0 . 7 . All the OCPs were solved by Gurobi. In addition, a hysteresis controller was considered as the baseline. 3.2.2 Experiment The experimental work concerns cases with space heating, DHW, and a stationary Lithium-ion electric battery. The information exchange schematic is depicted in Fig. 6, which includes querying historical measurements, weather forecasts, and forwarding setpoints to actuators. Numerical weather forecasts for the next 72 h were provided by MeteoSwiss [44] twice a day at an hourly resolution and measurements at a 1-min resolution were collected using programmable logic controllers (PLCs) equipped for each controlled system and stored in the NEST database. This database was accessed via REST API [45] over HTTPS and an open platform communications (OPC) server was used to forward real-time control decisions to the actuators, such as the valves and the DC/AC power inverter. 4 Simulation results This section presents the simulation results from the case study described in Section 3.2. Historical weather data from November 7 to December 7 of 2020 were used to run the simulations. The learning data used to construct the signal matrix Z were collected from November 7 to November 30 of 2020 by running the default hysteresis controller. This corresponds to 2 \u2032 305 data points. The data-driven controllers were applied from December 1 to December 7 of 2020, after an initialization phase of 2.5 h corresponding to the length of L 0 . Monte Carlo simulations of 20 runs were conducted for each algorithm with different measurement noise and disturbance uncertainties realizations. All the considered predictive control algorithms performed significantly better than the baseline hysteresis control, with a 20%\u201327% reduction in energy consumption and a 30%\u201393% reduction in constraint violation. So in what follows, we focus on benchmarking different data-driven predictive control algorithms. Results of energy consumption and temperature constraint violation for the three controlled rooms are shown in Fig. 7. It can be seen that the SMM-PC algorithm outperformed the other algorithms in terms of both energy consumption and constraint satisfaction for all three rooms. Specifically, compared to N4SID, BiLevel, and DeePC, SMM-PC reduced the constraint violation by 59%, 77%, and 90% with an average energy saving of 8%, 6%, and 4%, respectively. A comparison of input\u2013output trajectories in one representative simulation is shown in Fig. 8. One can observe that SMM-PC was more conservative in regulating the room temperature to avoid constraint violation. It is worth mentioning that the control decisions of SMM-PC were also smoother than other algorithms which implied reduced hardware wear in practice. This empirical observation can be further explored in future studies. The SMM-PC algorithm is analyzed more closely in Fig. 9, where the one-step-ahead prediction and the tightened bounds of SMM-PC are also plotted for Room 272 as an example. The tightened bounds for N4SID, which were calculated offline based on an estimate of the model error, are also shown for comparison. The predicted room temperature was very close to the true room temperature, and the tightened bounds provided in Proposition 1 were more conservative than N4SID leading to fewer constraint violations. The same plot for BiLevel is shown in Fig. 10. Although the prediction accuracy was also acceptable, it underestimated the prediction error, leading to more constraint violations. This is expected since BiLevel is only robust to errors in disturbance prediction but not to measurement errors. In the results presented above, we selected λ g = 1 0 4 for DeePC, which was the best-performing one in our tests with λ g = 1 0 i , i = 2 , 3 , 4 , 5 , 6 . For this λ g choice, the behaviors of BiLevel and DeePC were similar as shown in Fig. 8, except that there was no constraint tightening for DeePC. This validates the statement in [32] that direct and indirect methods are equivalent for sufficiently large λ g with nominal predictions. However, the DeePC algorithm may fail for small λ g values. Fig. 11 illustrates one scenario where DeePC was incapable of providing reasonable temperature control for Room 273 with λ g = 1 0 2 . Finally, to further evaluate the reliability of the algorithms, two scenarios with deteriorated uncertainties were considered: (1) the temperature measurements are less accurate with a 10 times larger variance of the output noise, and (2) the disturbance prediction is less accurate with 10 times larger variances for both the ambient temperature and the irradiance. The Monte Carlo simulations were repeated for these two scenarios and the results are shown in Table 1. It can be observed that SMM-PC remained the best in terms of both energy consumption and constraint violation in both scenarios. In addition, the performance of SMM-PC in these two scenarios was very consistent compared to the nominal case despite increased uncertainties, whereas an increase in energy consumption in Room 273 was observed for the other algorithms. The performance of the BiLevel algorithm deteriorated particularly in Scenario 1 as the algorithm cannot handle large output noise. All of these simulation results indicate that the SMM-PC algorithm is more effective than the other algorithms in terms of energy consumption, constraint satisfaction, and consistent performance. In practical terms, this suggests that SMM-PC is an efficient and reliable choice for practical deployment, especially in scenarios where measurement errors often vary across different buildings. 5 Experimental results In this section, we first validate controller performance on the physical space heating system on which the high-fidelity model in the previous section has been built. Then the transferability of the algorithm to other controlled systems is assessed. 5.1 Space heating The experiment was carried out between February 7 and February 11 of 2023. During the experiment, the prediction horizon and the confidence level of constraint satisfaction were set to be 15 (3.75 h) and 0.7, respectively. They were the same as the values used in the simulation study. The experimental results summarized in Fig. 12 include temperature measurements, control decisions, and realized power inputs into each temperature zone. Different from the numerical study in the previous section, the actuation of control decisions is subject to errors in practice, leading to mismatches between control decisions and realized power inputs in Fig. 12. It can be observed that the temperature in each room was maintained within the predefined comfort zone most of the time. The accumulated constraint violations in Rooms 272, 273, and 274 are 0.025 ° C h, 2.159 ° C h, and 1.518 ° C h, respectively. Additionally, in all rooms, preheating decisions can be observed once the step increase of the lower temperature limits was within the horizon of the controller. The results validated the hypothesis that SMM-PC is able to ensure constraint satisfaction within the technical capability of the underlying physical system. 5.2 Domestic hot water heating The experimental results of DHW heating control are summarized in Fig. 13, where both water draw and average tank temperature time series are shown together with predefined temperature limits. It can be observed that average tank temperatures were mostly maintained within the predefined limits. The accumulated constraint violation over one week was observed to be 3.9 ° C h. Since the control task was to minimize energy consumption, the tank temperature was kept close to the lower limit leaving only necessary hot water, which contributed to reducing heat loss through the tank wall. Large constraint violation was observed when the step change of the lower temperature limit occurred due to decontamination. This was due to the large uncertainty level in the water draw activities and the narrow feasible bound during decontamination, which result in the infeasibility of the tightened constraints. In other words, the data-driven algorithm was not able to guarantee high-probability constraint satisfaction with the available data. In this case, it is recommended to relax the output constraints and/or to include more data on the water draw activities to provide data-driven load forecasts. 5.3 Stationary electric battery The experimental results of the electric battery control are shown in Fig. 14 for both the resource planning task and the reference tracking task. The resource planning results show that the SOC of the battery was maintained within the limits verifying the constraint satisfaction hypothesis. The accumulated constraint violation was 15.95% h. Since the SOC limits were artificially designed, the accumulated constraint satisfaction value was not a crucial performance indicator. In this experiment, a high confidence level of 0.95 was used, so the actual SOC profile appeared to be conservative and the trajectory stayed in the middle of the predefined zone to actively avoid constraint violation. The results of the reference tracking experiment show remarkable precision; in fact, the root mean square error between the reference signal and the actual SOC is only 0.79%. To put it in context, the measurement quantization error is 0.5%. Both experiments confirm the applicability of SMM-PC to typical control tasks for electric batteries. 5.4 Discussion The experimental results revealed that the SMM-PC algorithm performed well in terms of constraint satisfaction and its performance can be transferred to different types of systems with minimal tuning effort. Therefore, the SMM-PC algorithm has the potential to enable large-scale deployment of DSM across heterogeneous systems timely. The optimal selection of historical measurements as the input-disturbance-output trajectory data is a nuanced task and beyond the scope of this study. Nonetheless, a potential solution involves combining long datasets including relevant periods with preconditioning of data matrices, as suggested in [22]. Expert knowledge can assist in identifying periods with sufficient system excitation. In the example of room heating, including periods with variable thermal power input and temperature fluctuations is crucial. Lastly, even though the methodology is only rigorously proven for linear systems, the numerical and experimental studies in this work show that it can be effectively applied to nonlinear systems by considering nonlinearity as an additional source of error, with better performance than conventional algorithms based on linear system identification. 6 Conclusion Scalable modeling and control frameworks can facilitate demand side management, a critical tool for the reliable and efficient operation of future energy systems. To address current limitations, this work proposes a novel data-driven predictive control algorithm using the signal matrix model. By using a stochastic control framework, this algorithm is designed to be reliable against noise and disturbances. The performance of the methodology is comprehensively evaluated in high-fidelity simulations by comparing it against other data-driven predictive control approaches, and its transferability is validated in multiple experimental studies. Two main conclusions can be drawn from the quantitative results. Firstly, compared to the state-of-the-art data-driven predictive control algorithms, the proposed algorithm can improve occupants\u2019 thermal comfort and energy saving by up to 90% and 8%, respectively. Secondly, the algorithm effectively ensures constraint satisfaction, and its performance can be transferred to other systems with minimal tuning effort. Therefore, the proposed algorithm can facilitate large-scale deployment of demand side management to support energy system operation. To conclude, several limitations must be noted. First, while data-driven approaches provide scalability, the interpretability of the decisions still needs to be assessed. Poor interpretability could potentially compromise the security of a system comprising many automated and distributed devices, which are aggregated to support a secure grid operation in the first place. Second, while the transferability across different controlled systems was evaluated, it remains to be assessed for the same type of controlled systems with different characteristics. For example, the proposed algorithm needs to be tested on a large group of heterogeneous buildings with different heating input systems. CRediT authorship contribution statement Mingzhou Yin: Writing \u2013 review & editing, Writing \u2013 original draft, Visualization, Validation, Software, Resources, Project administration, Methodology, Investigation, Formal analysis, Data curation, Conceptualization. Hanmin Cai: Writing \u2013 review & editing, Writing \u2013 original draft, Visualization, Validation, Software, Resources, Project administration, Methodology, Investigation, Formal analysis, Data curation, Conceptualization. Andrea Gattiglio: Writing \u2013 review & editing, Visualization, Validation, Software, Investigation, Formal analysis. Fazel Khayatian: Writing \u2013 review & editing, Software. Roy S. Smith: Writing \u2013 review & editing. Philipp Heer: Writing \u2013 review & editing. Declaration of competing interest The authors declare that they have no known competing financial interests or personal relationships that could have appeared to influence the work reported in this paper. Acknowledgments The work of Hanmin Cai and Philipp Heer has been conducted within the S-DSM project funded by the Swiss Federal Office of Energy SFOE (grant Nr. SI/502165-01). The work of Mingzhou Yin and Roy S. Smith was supported by the Swiss National Science Foundation under Grant 200021_178890. This work is part of the research activities of the International Energy Agency Energy in Buildings and Communities Program Annex 82, Energy Flexible Buildings Towards Resilient Low Carbon Energy Systems. Appendix Proof of Proposition 1 Since ∑ i a i ≤ ∑ i a i , we have c 1 + c 2 \u2016 g t \u2016 2 ≥ c 1 2 + c 2 2 \u2016 g t \u2016 2 2 = h i t Σ t h i t ⊤ = var h i t y t . So (22) implies (A.1) h i t y ̄ t ≤ q i t − μ ⋅ var h i t y t . Applying the one-sided Chebyshev inequality P x − E x ≤ 1 1 − p − 1 ⋅ var ( x ) ≥ p , we have (A.2) P h i t y t − h i t y ̄ t ≤ μ ⋅ var ( h i t y t ) ≥ p . Combining (A.1) and (A.2) directly leads to (21c). References [1] International Energy Agency Digitalization and energy 2017 https://www.iea.org/reports/digitalisation-and-energy [Online; accessed 25-April-2023] International Energy Agency, \u201cDigitalization and energy.\u201d https://www.iea.org/reports/digitalisation-and-energy, 2017. [Online accessed 25-April-2023]. [2] Kouvaritakis B. Cannon M. Model predictive control: classical, robust and stochastic 2016 Springer Cham, Switzerland B. Kouvaritakis and M. Cannon, Model Predictive Control: Classical, Robust and Stochastic. Cham, Switzerland: Springer, 2016. [3] Palensky P. Dietrich D. Demand side management: Demand response, intelligent energy systems, and smart loads IEEE Trans Ind Inform 7 3 2011 381 388 P. Palensky and D. Dietrich, \u201cDemand side management: Demand response, intelligent energy systems, and smart loads,\u201d IEEE transactions on industrial informatics, vol. 7, no. 3, pp. 381\u2013388, 2011. [4] Cai H. You S. Wu J. Agent-based distributed demand response in district heating systems Appl Energy 262 2020 114403 H. Cai, S. You, and J. Wu, \u201cAgent-based distributed demand response in district heating systems,\u201d Applied Energy, vol. 262, p. 114403, 2020. [5] Lefebure N. Khosravi M. Badyn M.H. Bünning F. Lygeros J. Jones C. Smith R.S. Distributed model predictive control of buildings and energy hubs Energy Build 259 2022 111806 N. Lefebure, M. Khosravi, M. H. Badyn, F. Bünning, J. Lygeros, C. Jones, and R. S. Smith, \u201cDistributed model predictive control of buildings and energy hubs,\u201d Energy and Buildings, vol. 259, p. 111806, 2022. [6] Hjalmarsson H. From experiment design to closed-loop control Automatica 41 3 2005 393 438 H. Hjalmarsson, \u201cFrom experiment design to closed-loop control,\u201d Automatica, vol. 41, no. 3, pp. 393\u2013438, 2005. [7] Sturzenegger D. Gyalistras D. Morari M. Smith R.S. Model predictive climate control of a Swiss office building: Implementation, results, and cost\u2013benefit analysis IEEE Trans Control Syst Technol 24 1 2015 1 12 D. Sturzenegger, D. Gyalistras, M. Morari, and R. S. Smith, \u201cModel predictive climate control of a Swiss office building: Implementation, results, and cost\u2013benefit analysis,\u201d IEEE Transactions on Control Systems Technology, vol. 24, no. 1, pp. 1\u201312, 2015. [8] Maddalena E.T. Lian Y. Jones C.N. Data-driven methods for building control\u2014A review and promising future directions Control Eng Pract 95 2020 104211 E. T. Maddalena, Y. Lian, and C. N. Jones, \u201cData-driven methods for building control\u2014a review and promising future directions,\u201d Control Engineering Practice, vol. 95, p. 104211, 2020. [9] Kazmi H. Suykens J. Balint A. Driesen J. Multi-agent reinforcement learning for modeling and control of thermostatically controlled loads Appl Energy 238 2019 1022 1035 H. Kazmi, J. Suykens, A. Balint, and J. Driesen, \u201cMulti-agent reinforcement learning for modeling and control of thermostatically controlled loads,\u201d Applied energy, vol. 238, pp. 1022\u20131035, 2019. [10] Bünning F. Huber B. Heer P. Aboudonia A. Lygeros J. Experimental demonstration of data predictive control for energy optimization and thermal comfort in buildings Energy Build 211 2020 109792 F. Bünning, B. Huber, P. Heer, A. Aboudonia, and J. Lygeros, \u201cExperimental demonstration of data predictive control for energy optimization and thermal comfort in buildings,\u201d Energy and Buildings, vol. 211, p. 109792, 2020. [11] Lian Y. Shi J. Koch M. Jones C.N. Adaptive robust data-driven building control via bilevel reformulation: An experimental result IEEE Trans Control Syst Technol 2023 Y. Lian, J. Shi, M. Koch, and C. N. Jones, \u201cAdaptive robust data-driven building control via bilevel reformulation: An experimental result,\u201d IEEE Transactions on Control Systems Technology, 2023. [12] Elokda E. Coulson J. Beuchat P.N. Lygeros J. Dörfler F. Data-enabled predictive control for quadcopters Internat J Robust Nonlinear Control 31 18 2021 8916 8936 E. Elokda, J. Coulson, P. N. Beuchat, J. Lygeros, and F. Dörfler, \u201cData-enabled predictive control for quadcopters,\u201d International Journal of Robust and Nonlinear Control, vol. 31, no. 18, pp. 8916\u20138936, 2021. [13] Di Natale L, Lian Y, Maddalena ET, Shi J, Jones CN. Lessons Learned from Data-Driven Building Control Experiments: Contrasting Gaussian Process-based MPC, Bilevel DeePC, and Deep Reinforcement Learning. In: IEEE 61st conference on decision and control (CDC). 2022, p. 1111\u20137. L. Di Natale, Y. Lian, E. T. Maddalena, J. Shi, and C. N. Jones, \u201cLessons learned from data-driven building control experiments: Contrasting Gaussian process-based MPC, bilevel DeePC, and deep reinforcement learning,\u201d in IEEE 61st Conference on Decision and Control (CDC), pp. 1111\u20131117, 2022. [14] Bünning F. Huber B. Schalbetter A. Aboudonia A. de Badyn M.H. Heer P. Smith R.S. Lygeros J. Physics-informed linear regression is competitive with two machine learning methods in residential building MPC Appl Energy 310 2022 118491 F. Bünning, B. Huber, A. Schalbetter, A. Aboudonia, M. H. de Badyn, P. Heer, R. S. Smith, and J. Lygeros, \u201cPhysics-informed linear regression is competitive with two machine learning methods in residential building MPC,\u201d Applied Energy, vol. 310, p. 118491, 2022. [15] Papernot N. McDaniel P. Goodfellow I. Transferability in machine learning: from phenomena to black-box attacks using adversarial samples 2016 arXiv preprint arXiv:1605.07277 N. Papernot, P. McDaniel, and I. Goodfellow, \u201cTransferability in machine learning: from phenomena to black-box attacks using adversarial samples,\u201d arXiv preprint arXiv:1605.07277, 2016. [16] Markovsky I. Dörfler F. Behavioral systems theory in data-driven analysis, signal processing, and control Annu Rev Control 52 2021 42 64 I. Markovsky and F. Dörfler, \u201cBehavioral systems theory in data-driven analysis, signal processing, and control,\u201d Annual Reviews in Control, vol. 52, pp. 42\u201364, 2021. [17] Vánă Z. Kubecĕk J. Ferkl L. Notes on finding black-box model of a large building 2010 IEEE international conference on control applications 2010 IEEE 1017 1022 Z. Vánă, J. Kubecĕk, and L. Ferkl, \u201cNotes on finding black-box model of a large building,\u201d in 2010 IEEE International Conference on Control Applications, pp. 1017\u20131022, IEEE, 2010. [18] Van Overschee P. Subspace identification for linear systems: theory\u2014implementation\u2014applications 2012 Springer New York, NY P. Van Overschee, Subspace identification for linear systems: Theory\u2014Implementation\u2014Applications. New York, NY: Springer, 2012. [19] Prívara S. Široký J. Ferkl L. Cigler J. Model predictive control of a building heating system: The first experience Energy Build 43 2 2011 564 572 S. Prívara, J. Siroký, L. Ferkl, and J. Cigler, \u201cModel predictive control of a building heating system: The first experience,\u201d Energy and Buildings, vol. 43, no. 2, pp. 564\u2013572, 2011. [20] Favoreel W. Moor B.D. Gevers M. SPC: Subspace predictive control IFAC Proc Vol 32 2 1999 4004 4009 W. Favoreel, B. D. Moor, and M. Gevers, \u201cSPC: Subspace predictive control,\u201d IFAC Proceedings Volumes, vol. 32, no. 2, pp. 4004\u20134009, 1999. [21] Coulson J, Lygeros J, Dorfler F. Data-Enabled Predictive Control: In the Shallows of the DeePC. In: European control conference (ECC). 2019, p. 307\u201312. J. Coulson, J. Lygeros, and F. Dorfler, \u201cData-enabled predictive control: In the shallows of the DeePC,\u201d in European Control Conference (ECC), 2019. [22] Yin M. Iannelli A. Smith R.S. Maximum likelihood estimation in data-driven modeling and control IEEE Trans Automat Control 68 1 2023 317 328 M. Yin, A. Iannelli, and R. S. Smith, \u201cMaximum likelihood estimation in data-driven modeling and control,\u201d IEEE Transactions on Automatic Control, vol. 68, no. 1, pp. 317\u2013328, 2023. [23] Yin M. Iannelli A. Smith R.S. Maximum likelihood signal matrix model for data-driven predictive control Proceedings of the 3rd conference on learning for dynamics and control Proceedings of machine learning research Vol. 144 2021 1004 1014 M. Yin, A. Iannelli, and R. S. Smith, \u201cMaximum likelihood signal matrix model for data-driven predictive control,\u201d in Proceedings of the 3rd Conference on Learning for Dynamics and Control, vol. 144 of Proceedings of Machine Learning Research, pp. 1004\u20131014, 2021. [24] Yin M. Iannelli A. Smith R.S. Data-driven prediction with stochastic data: Confidence regions and minimum mean-squared error estimates European control conference (ECC) 2022 853 858 M. Yin, A. Iannelli, and R. S. Smith, \u201cData-driven prediction with stochastic data: Confidence regions and minimum mean-squared error estimates,\u201d in European Control Conference (ECC), pp. 853\u2013858, 2022. [25] Mesbah A. Stochastic model predictive control: An overview and perspectives for future research IEEE Control Syst Mag 36 6 2016 30 44 A. Mesbah, \u201cStochastic model predictive control: An overview and perspectives for future research,\u201d IEEE Control Systems Magazine, vol. 36, no. 6, pp. 30\u201344, 2016. [26] Oldewurtel F. Jones C.N. Parisio A. Morari M. Stochastic model predictive control for building climate control IEEE Trans Control Syst Technol 22 3 2014 1198 1205 F. Oldewurtel, C. N. Jones, A. Parisio, and M. Morari, \u201cStochastic model predictive control for building climate control,\u201d IEEE Transactions on Control Systems Technology, vol. 22, no. 3, pp. 1198\u20131205, 2014. [27] Willems J.C. Rapisarda P. Markovsky I. De Moor B.L.M. A note on persistency of excitation Systems Control Lett 54 4 2005 325 329 J. C. Willems, P. Rapisarda, I. Markovsky, and B. L. M. De Moor, \u201cA note on persistency of excitation,\u201d Systems & Control Letters, vol. 54, no. 4, pp. 325\u2013329, 2005. [28] Markovsky I. Rapisarda P. Data-driven simulation and control Internat J Control 81 12 2008 1946 1959 I. Markovsky and P. Rapisarda, \u201cData-driven simulation and control,\u201d International Journal of Control, vol. 81, no. 12, pp. 1946\u20131959, 2008. [29] Markovsky I. A software package for system identification in the behavioral setting Control Eng Pract 21 10 2013 1422 1436 I. Markovsky, \u201cA software package for system identification in the behavioral setting,\u201d Control Engineering Practice, vol. 21, no. 10, pp. 1422\u20131436, 2013. [30] Fiedler F, Lucia S. On the relationship between data-enabled predictive control and subspace predictive control. In: European control conference (ECC). 2021, p. 222\u20139. F. Fiedler and S. Lucia, \u201cOn the relationship between data-enabled predictive control and subspace predictive control,\u201d in European Control Conference (ECC), pp. 222\u2013229, 2021. [31] Van Overschee P. De Moor B. N4SID: Subspace algorithms for the identification of combined deterministic-stochastic systems Automatica 30 1 1994 75 93 P. Van Overschee and B. De Moor, \u201cN4SID: Subspace algorithms for the identification of combined deterministic-stochastic systems,\u201d Automatica, vol. 30, no. 1, pp. 75\u201393, 1994. [32] Dorfler F. Coulson J. Markovsky I. Bridging direct & indirect data-driven control formulations via regularizations and relaxations IEEE Trans Automat Control 68 2 2023 883 897 F. Dorfler, J. Coulson, and I. Markovsky, \u201cBridging direct & indirect data-driven control formulations via regularizations and relaxations,\u201d IEEE Transactions on Automatic Control, vol. 68, no. 2, pp. 883\u2013897, 2023. [33] Elokda E. Coulson J. Beuchat P.N. Lygeros J. Dörfler F. Data-enabled predictive control for quadcopters Internat J Robust Nonlinear Control 31 18 2021 8916 8936 E. Elokda, J. Coulson, P. N. Beuchat, J. Lygeros, and F. Dörfler, \u201cData-enabled predictive control for quadcopters,\u201d International Journal of Robust and Nonlinear Control, vol. 31, no. 18, pp. 8916\u20138936, 2021. [34] Empa E. NEST wiki 2023 https://info.nestcollaboration.ch/wikipediapublic [Online; accessed: 24.04.2023] Empa, \u201cNest wiki.\u201d https://info.nestcollaboration.ch/wikipediapublic. [Online; accessed: 24.04.2023]. [35] Richner P. Heer P. Largo R. Marchesi E. Zimmermann M. NEST\u2013una plataforma para acelerar la innovación en edificios Inform Constr 69 548 2018 222 P. Richner, P. Heer, R. Largo, E. Marchesi, and M. Zimmermann, \u201cNest\u2013una plataforma para acelerar la innovación en edificios,\u201d Informes de la Construcción, vol. 69, no. 548, p. 222, 2018. [36] Swissgrid P. Prequalification 2023 https://www.swissgrid.ch/en/home/customers/topics/ancillary-services/prequalification.html [Online; accessed 17-April-2023] Swissgrid, \u201cPrequalification.\u201d https://www.swissgrid.ch/en/home/customers/topics/ancillary-services/prequalification.html, 2023. [Online; accessed 17-April-2023]. [37] Blum D. Arroyo J. Huang S. Drgoňa J. Jorissen F. Walnum H.T. Chen Y. Benne K. Vrabie D. Wetter M. Building optimization testing framework (BOPTEST) for simulation-based benchmarking of control strategies in buildings J Build Perform Simul 14 5 2021 586 610 D. Blum, J. Arroyo, S. Huang, J. Drgoňa, F. Jorissen, H. T. Walnum, Y. Chen, K. Benne, D. Vrabie, M. Wetter, et al., \u201cBuilding optimization testing framework (BOPTEST) for simulation-based benchmarking of control strategies in buildings,\u201d Journal of Building Performance Simulation, vol. 14, no. 5, pp. 586\u2013610, 2021. [38] Khayatian F, Cai H, Bojarski A, Heer P, Bollinger A. Benchmarking HVAC controller performance with a digital twin. In: Applied energy symposium 2022: clean energy towards carbon neutrality (CEN2022). 2022. F. Khayatian, H. Cai, A. Bojarski, P. Heer, and A. Bollinger, \u201cBenchmarking HVAC controller performance with a digital twin,\u201d in Applied Energy Symposium 2022: Clean Energy towards Carbon Neutrality (CEN2022), 2022. [39] Bojarski A. Khayatian F. Cai H. nestli: Neighborhood Energy System Testing towards Large-scale Integration 2023 https://doi.org/10.5281/zenodo.7635812 [Online; accessed: 25.04.2023] A. Bojarski, F. Khayatian, and H. Cai, \u201cnestli: Neighborhood Energy System Testing towards Large-scale Integration.\u201d https://doi.org/10.5281/zenodo.7635812, 2023. [Online; accessed: 25.04.2023]. [40] The Danish Transport and Construction Agency A. Danish Building Regulations 2015 (BR15) 2015 https://www.iea.org/policies/7637-danish-building-regulations-2015-br15 [Online; accessed 25-April-2023] The Danish Transport and Construction Agency, \u201cDanish Building Regulations 2015 (BR15).\u201d https://www.iea.org/policies/7637-danish-building-regulations-2015-br15, 2015. [Online; accessed 25-April-2023]. [41] Cai H. You S. Wang J. Bindner H.W. Klyapovskiy S. Technical assessment of electric heat boosters in low-temperature district heating based on combined heat and power analysis Energy 150 2018 938 949 H. Cai, S. You, J. Wang, H. W. Bindner, and S. Klyapovskiy, \u201cTechnical assessment of electric heat boosters in low-temperature district heating based on combined heat and power analysis,\u201d Energy, vol. 150, pp. 938\u2013949, 2018. [42] Oldewurtel F. Parisio A. Jones C.N. Gyalistras D. Gwerder M. Stauch V. Lehmann B. Morari M. Use of model predictive control and weather forecasts for energy efficient building climate control Energy Build 45 2012 15 27 F. Oldewurtel, A. Parisio, C. N. Jones, D. Gyalistras, M. Gwerder, V. Stauch, B. Lehmann, and M. Morari, \u201cUse of model predictive control and weather forecasts for energy efficient building climate control,\u201d Energy and Buildings, vol. 45, pp. 15\u201327, 2012. [43] Oldewurtel F, Jones CN, Morari M. A tractable approximation of chance constrained stochastic MPC based on affine disturbance feedback. In: IEEE conference on decision and control. 2008, p. 4731\u20136. F. Oldewurtel, C. N. Jones, and M. Morari, \u201cA tractable approximation of chance constrained stochastic MPC based on affine disturbance feedback,\u201d in IEEE Conference on Decision and Control, 2008. [44] Federal office of meteorology and climatology 2023 https://www.meteoswiss.admin.ch [Online; accessed 20-April-2023] \u201cFederal Office of Meteorology and Climatology.\u201d https://www.meteoswiss.admin.ch, 2023. [Online; accessed 20-April-2023]. [45] Pautasso C, Wilde E. RESTful web services: principles, patterns, emerging technologies. In: Proceedings of the 19th international conference on world wide web. 2010, p. 1359\u201360. C. Pautasso and E. Wilde, \u201cRestful web services: principles, patterns, emerging technologies,\u201d in Proceedings of the 19th international conference on World wide web, pp. 1359\u20131360, 2010.",
    "scopus-id": "85175200661",
    "coredata": {
        "eid": "1-s2.0-S0306261923014654",
        "dc:description": "Demand side management is perceived as a tool to support a secure and reliable energy system operation amid growing integration of renewable energy resources. However, the lack of scalable modeling and control procedures hinders the practical implementation. To address this challenge, this paper proposes a novel signal matrix model predictive control algorithm. Compared to existing data-driven methods, this approach explicitly provides stochastic predictions considering both disturbance and measurement errors with few tuning parameters, ensuring reliability by high-probability constraint satisfaction. The performance is extensively compared with three state-of-the-art algorithms in a space heating case study using a high-fidelity simulator. The results are further validated with physical experiments using the same system that the simulator is based on. To assess transferability, the algorithm is further implemented on diverse controlled systems, including a domestic hot water heating system and a stationary electric battery. The simulation results show that, compared to existing data-driven methods, the proposed approach improves constraint satisfaction and energy savings by up to 90 % and 8 %, respectively. The experimental results further confirm that the algorithm is applicable to multiple tasks of demand side management, with reasonable control performance observed in all case studies.",
        "openArchiveArticle": "false",
        "prism:coverDate": "2024-01-01",
        "openaccessUserLicense": "http://creativecommons.org/licenses/by/4.0/",
        "prism:aggregationType": "Journal",
        "prism:url": "https://api.elsevier.com/content/article/pii/S0306261923014654",
        "dc:creator": [
            {
                "@_fa": "true",
                "$": "Yin, Mingzhou"
            },
            {
                "@_fa": "true",
                "$": "Cai, Hanmin"
            },
            {
                "@_fa": "true",
                "$": "Gattiglio, Andrea"
            },
            {
                "@_fa": "true",
                "$": "Khayatian, Fazel"
            },
            {
                "@_fa": "true",
                "$": "Smith, Roy S."
            },
            {
                "@_fa": "true",
                "$": "Heer, Philipp"
            }
        ],
        "link": [
            {
                "@_fa": "true",
                "@rel": "self",
                "@href": "https://api.elsevier.com/content/article/pii/S0306261923014654"
            },
            {
                "@_fa": "true",
                "@rel": "scidir",
                "@href": "https://www.sciencedirect.com/science/article/pii/S0306261923014654"
            }
        ],
        "dc:format": "application/json",
        "openaccessType": "Full",
        "pii": "S0306-2619(23)01465-4",
        "prism:volume": "353",
        "articleNumber": "122101",
        "prism:publisher": "The Author(s). Published by Elsevier Ltd.",
        "dc:title": "Data-driven predictive control for demand side management: Theoretical and experimental results",
        "prism:copyright": "© 2023 The Author(s). Published by Elsevier Ltd.",
        "openaccess": "1",
        "prism:issn": "03062619",
        "dcterms:subject": [
            {
                "@_fa": "true",
                "$": "Data-driven control"
            },
            {
                "@_fa": "true",
                "$": "Building energy management"
            },
            {
                "@_fa": "true",
                "$": "Signal matrix model predictive control"
            },
            {
                "@_fa": "true",
                "$": "Demand side management"
            },
            {
                "@_fa": "true",
                "$": "Space heating"
            },
            {
                "@_fa": "true",
                "$": "Domestic hot water heating"
            }
        ],
        "openaccessArticle": "true",
        "prism:publicationName": "Applied Energy",
        "openaccessSponsorType": "FundingBody",
        "prism:pageRange": "122101",
        "pubType": "fla",
        "prism:coverDisplayDate": "1 January 2024",
        "prism:doi": "10.1016/j.apenergy.2023.122101",
        "prism:startingPage": "122101",
        "dc:identifier": "doi:10.1016/j.apenergy.2023.122101",
        "openaccessSponsorName": "Swiss institutions 2021"
    },
    "objects": {"object": [
        {
            "@category": "standard",
            "@height": "286",
            "@width": "533",
            "@_fa": "true",
            "$": "https://api.elsevier.com/content/object/eid/1-s2.0-S0306261923014654-gr14.jpg?httpAccept=%2A%2F%2A",
            "@multimediatype": "JPEG image file",
            "@type": "IMAGE-DOWNSAMPLED",
            "@size": "58755",
            "@ref": "gr14",
            "@mimetype": "image/jpeg"
        },
        {
            "@category": "standard",
            "@height": "291",
            "@width": "527",
            "@_fa": "true",
            "$": "https://api.elsevier.com/content/object/eid/1-s2.0-S0306261923014654-gr13.jpg?httpAccept=%2A%2F%2A",
            "@multimediatype": "JPEG image file",
            "@type": "IMAGE-DOWNSAMPLED",
            "@size": "74677",
            "@ref": "gr13",
            "@mimetype": "image/jpeg"
        },
        {
            "@category": "standard",
            "@height": "647",
            "@width": "525",
            "@_fa": "true",
            "$": "https://api.elsevier.com/content/object/eid/1-s2.0-S0306261923014654-gr12.jpg?httpAccept=%2A%2F%2A",
            "@multimediatype": "JPEG image file",
            "@type": "IMAGE-DOWNSAMPLED",
            "@size": "143444",
            "@ref": "gr12",
            "@mimetype": "image/jpeg"
        },
        {
            "@category": "standard",
            "@height": "296",
            "@width": "375",
            "@_fa": "true",
            "$": "https://api.elsevier.com/content/object/eid/1-s2.0-S0306261923014654-gr1.jpg?httpAccept=%2A%2F%2A",
            "@multimediatype": "JPEG image file",
            "@type": "IMAGE-DOWNSAMPLED",
            "@size": "65610",
            "@ref": "gr1",
            "@mimetype": "image/jpeg"
        },
        {
            "@category": "standard",
            "@height": "205",
            "@width": "374",
            "@_fa": "true",
            "$": "https://api.elsevier.com/content/object/eid/1-s2.0-S0306261923014654-gr11.jpg?httpAccept=%2A%2F%2A",
            "@multimediatype": "JPEG image file",
            "@type": "IMAGE-DOWNSAMPLED",
            "@size": "48080",
            "@ref": "gr11",
            "@mimetype": "image/jpeg"
        },
        {
            "@category": "standard",
            "@height": "237",
            "@width": "791",
            "@_fa": "true",
            "$": "https://api.elsevier.com/content/object/eid/1-s2.0-S0306261923014654-fx1001.jpg?httpAccept=%2A%2F%2A",
            "@multimediatype": "JPEG image file",
            "@type": "IMAGE-DOWNSAMPLED",
            "@size": "102410",
            "@ref": "fx1001",
            "@mimetype": "image/jpeg"
        },
        {
            "@category": "standard",
            "@height": "275",
            "@width": "183",
            "@_fa": "true",
            "$": "https://api.elsevier.com/content/object/eid/1-s2.0-S0306261923014654-gr5.jpg?httpAccept=%2A%2F%2A",
            "@multimediatype": "JPEG image file",
            "@type": "IMAGE-DOWNSAMPLED",
            "@size": "42619",
            "@ref": "gr5",
            "@mimetype": "image/jpeg"
        },
        {
            "@category": "standard",
            "@height": "193",
            "@width": "308",
            "@_fa": "true",
            "$": "https://api.elsevier.com/content/object/eid/1-s2.0-S0306261923014654-gr2.jpg?httpAccept=%2A%2F%2A",
            "@multimediatype": "JPEG image file",
            "@type": "IMAGE-DOWNSAMPLED",
            "@size": "47929",
            "@ref": "gr2",
            "@mimetype": "image/jpeg"
        },
        {
            "@category": "standard",
            "@height": "195",
            "@width": "346",
            "@_fa": "true",
            "$": "https://api.elsevier.com/content/object/eid/1-s2.0-S0306261923014654-gr3.jpg?httpAccept=%2A%2F%2A",
            "@multimediatype": "JPEG image file",
            "@type": "IMAGE-DOWNSAMPLED",
            "@size": "42572",
            "@ref": "gr3",
            "@mimetype": "image/jpeg"
        },
        {
            "@category": "standard",
            "@height": "921",
            "@width": "371",
            "@_fa": "true",
            "$": "https://api.elsevier.com/content/object/eid/1-s2.0-S0306261923014654-gr8.jpg?httpAccept=%2A%2F%2A",
            "@multimediatype": "JPEG image file",
            "@type": "IMAGE-DOWNSAMPLED",
            "@size": "207221",
            "@ref": "gr8",
            "@mimetype": "image/jpeg"
        },
        {
            "@category": "standard",
            "@height": "195",
            "@width": "535",
            "@_fa": "true",
            "$": "https://api.elsevier.com/content/object/eid/1-s2.0-S0306261923014654-gr6.jpg?httpAccept=%2A%2F%2A",
            "@multimediatype": "JPEG image file",
            "@type": "IMAGE-DOWNSAMPLED",
            "@size": "37637",
            "@ref": "gr6",
            "@mimetype": "image/jpeg"
        },
        {
            "@category": "standard",
            "@height": "667",
            "@width": "373",
            "@_fa": "true",
            "$": "https://api.elsevier.com/content/object/eid/1-s2.0-S0306261923014654-gr7.jpg?httpAccept=%2A%2F%2A",
            "@multimediatype": "JPEG image file",
            "@type": "IMAGE-DOWNSAMPLED",
            "@size": "84420",
            "@ref": "gr7",
            "@mimetype": "image/jpeg"
        },
        {
            "@category": "standard",
            "@height": "205",
            "@width": "374",
            "@_fa": "true",
            "$": "https://api.elsevier.com/content/object/eid/1-s2.0-S0306261923014654-gr9.jpg?httpAccept=%2A%2F%2A",
            "@multimediatype": "JPEG image file",
            "@type": "IMAGE-DOWNSAMPLED",
            "@size": "59635",
            "@ref": "gr9",
            "@mimetype": "image/jpeg"
        },
        {
            "@category": "standard",
            "@height": "205",
            "@width": "374",
            "@_fa": "true",
            "$": "https://api.elsevier.com/content/object/eid/1-s2.0-S0306261923014654-gr10.jpg?httpAccept=%2A%2F%2A",
            "@multimediatype": "JPEG image file",
            "@type": "IMAGE-DOWNSAMPLED",
            "@size": "57516",
            "@ref": "gr10",
            "@mimetype": "image/jpeg"
        },
        {
            "@category": "standard",
            "@height": "216",
            "@width": "162",
            "@_fa": "true",
            "$": "https://api.elsevier.com/content/object/eid/1-s2.0-S0306261923014654-gr4.jpg?httpAccept=%2A%2F%2A",
            "@multimediatype": "JPEG image file",
            "@type": "IMAGE-DOWNSAMPLED",
            "@size": "34819",
            "@ref": "gr4",
            "@mimetype": "image/jpeg"
        },
        {
            "@category": "thumbnail",
            "@height": "118",
            "@width": "219",
            "@_fa": "true",
            "$": "https://api.elsevier.com/content/object/eid/1-s2.0-S0306261923014654-gr14.sml?httpAccept=%2A%2F%2A",
            "@multimediatype": "GIF image file",
            "@type": "IMAGE-THUMBNAIL",
            "@size": "17752",
            "@ref": "gr14",
            "@mimetype": "image/gif"
        },
        {
            "@category": "thumbnail",
            "@height": "121",
            "@width": "219",
            "@_fa": "true",
            "$": "https://api.elsevier.com/content/object/eid/1-s2.0-S0306261923014654-gr13.sml?httpAccept=%2A%2F%2A",
            "@multimediatype": "GIF image file",
            "@type": "IMAGE-THUMBNAIL",
            "@size": "20761",
            "@ref": "gr13",
            "@mimetype": "image/gif"
        },
        {
            "@category": "thumbnail",
            "@height": "164",
            "@width": "133",
            "@_fa": "true",
            "$": "https://api.elsevier.com/content/object/eid/1-s2.0-S0306261923014654-gr12.sml?httpAccept=%2A%2F%2A",
            "@multimediatype": "GIF image file",
            "@type": "IMAGE-THUMBNAIL",
            "@size": "24053",
            "@ref": "gr12",
            "@mimetype": "image/gif"
        },
        {
            "@category": "thumbnail",
            "@height": "164",
            "@width": "208",
            "@_fa": "true",
            "$": "https://api.elsevier.com/content/object/eid/1-s2.0-S0306261923014654-gr1.sml?httpAccept=%2A%2F%2A",
            "@multimediatype": "GIF image file",
            "@type": "IMAGE-THUMBNAIL",
            "@size": "28949",
            "@ref": "gr1",
            "@mimetype": "image/gif"
        },
        {
            "@category": "thumbnail",
            "@height": "120",
            "@width": "219",
            "@_fa": "true",
            "$": "https://api.elsevier.com/content/object/eid/1-s2.0-S0306261923014654-gr11.sml?httpAccept=%2A%2F%2A",
            "@multimediatype": "GIF image file",
            "@type": "IMAGE-THUMBNAIL",
            "@size": "18159",
            "@ref": "gr11",
            "@mimetype": "image/gif"
        },
        {
            "@category": "thumbnail",
            "@height": "66",
            "@width": "219",
            "@_fa": "true",
            "$": "https://api.elsevier.com/content/object/eid/1-s2.0-S0306261923014654-fx1001.sml?httpAccept=%2A%2F%2A",
            "@multimediatype": "GIF image file",
            "@type": "IMAGE-THUMBNAIL",
            "@size": "68932",
            "@ref": "fx1001",
            "@mimetype": "image/gif"
        },
        {
            "@category": "thumbnail",
            "@height": "164",
            "@width": "109",
            "@_fa": "true",
            "$": "https://api.elsevier.com/content/object/eid/1-s2.0-S0306261923014654-gr5.sml?httpAccept=%2A%2F%2A",
            "@multimediatype": "GIF image file",
            "@type": "IMAGE-THUMBNAIL",
            "@size": "27965",
            "@ref": "gr5",
            "@mimetype": "image/gif"
        },
        {
            "@category": "thumbnail",
            "@height": "138",
            "@width": "219",
            "@_fa": "true",
            "$": "https://api.elsevier.com/content/object/eid/1-s2.0-S0306261923014654-gr2.sml?httpAccept=%2A%2F%2A",
            "@multimediatype": "GIF image file",
            "@type": "IMAGE-THUMBNAIL",
            "@size": "37369",
            "@ref": "gr2",
            "@mimetype": "image/gif"
        },
        {
            "@category": "thumbnail",
            "@height": "124",
            "@width": "219",
            "@_fa": "true",
            "$": "https://api.elsevier.com/content/object/eid/1-s2.0-S0306261923014654-gr3.sml?httpAccept=%2A%2F%2A",
            "@multimediatype": "GIF image file",
            "@type": "IMAGE-THUMBNAIL",
            "@size": "28912",
            "@ref": "gr3",
            "@mimetype": "image/gif"
        },
        {
            "@category": "thumbnail",
            "@height": "164",
            "@width": "66",
            "@_fa": "true",
            "$": "https://api.elsevier.com/content/object/eid/1-s2.0-S0306261923014654-gr8.sml?httpAccept=%2A%2F%2A",
            "@multimediatype": "GIF image file",
            "@type": "IMAGE-THUMBNAIL",
            "@size": "17686",
            "@ref": "gr8",
            "@mimetype": "image/gif"
        },
        {
            "@category": "thumbnail",
            "@height": "80",
            "@width": "219",
            "@_fa": "true",
            "$": "https://api.elsevier.com/content/object/eid/1-s2.0-S0306261923014654-gr6.sml?httpAccept=%2A%2F%2A",
            "@multimediatype": "GIF image file",
            "@type": "IMAGE-THUMBNAIL",
            "@size": "14014",
            "@ref": "gr6",
            "@mimetype": "image/gif"
        },
        {
            "@category": "thumbnail",
            "@height": "163",
            "@width": "91",
            "@_fa": "true",
            "$": "https://api.elsevier.com/content/object/eid/1-s2.0-S0306261923014654-gr7.sml?httpAccept=%2A%2F%2A",
            "@multimediatype": "GIF image file",
            "@type": "IMAGE-THUMBNAIL",
            "@size": "14538",
            "@ref": "gr7",
            "@mimetype": "image/gif"
        },
        {
            "@category": "thumbnail",
            "@height": "120",
            "@width": "219",
            "@_fa": "true",
            "$": "https://api.elsevier.com/content/object/eid/1-s2.0-S0306261923014654-gr9.sml?httpAccept=%2A%2F%2A",
            "@multimediatype": "GIF image file",
            "@type": "IMAGE-THUMBNAIL",
            "@size": "22179",
            "@ref": "gr9",
            "@mimetype": "image/gif"
        },
        {
            "@category": "thumbnail",
            "@height": "120",
            "@width": "219",
            "@_fa": "true",
            "$": "https://api.elsevier.com/content/object/eid/1-s2.0-S0306261923014654-gr10.sml?httpAccept=%2A%2F%2A",
            "@multimediatype": "GIF image file",
            "@type": "IMAGE-THUMBNAIL",
            "@size": "22438",
            "@ref": "gr10",
            "@mimetype": "image/gif"
        },
        {
            "@category": "thumbnail",
            "@height": "164",
            "@width": "123",
            "@_fa": "true",
            "$": "https://api.elsevier.com/content/object/eid/1-s2.0-S0306261923014654-gr4.sml?httpAccept=%2A%2F%2A",
            "@multimediatype": "GIF image file",
            "@type": "IMAGE-THUMBNAIL",
            "@size": "33016",
            "@ref": "gr4",
            "@mimetype": "image/gif"
        },
        {
            "@category": "high",
            "@height": "1267",
            "@width": "2359",
            "@_fa": "true",
            "$": "https://api.elsevier.com/content/object/eid/1-s2.0-S0306261923014654-gr14_lrg.jpg?httpAccept=%2A%2F%2A",
            "@multimediatype": "JPEG image file",
            "@type": "IMAGE-HIGH-RES",
            "@size": "309179",
            "@ref": "gr14",
            "@mimetype": "image/jpeg"
        },
        {
            "@category": "high",
            "@height": "1289",
            "@width": "2333",
            "@_fa": "true",
            "$": "https://api.elsevier.com/content/object/eid/1-s2.0-S0306261923014654-gr13_lrg.jpg?httpAccept=%2A%2F%2A",
            "@multimediatype": "JPEG image file",
            "@type": "IMAGE-HIGH-RES",
            "@size": "396131",
            "@ref": "gr13",
            "@mimetype": "image/jpeg"
        },
        {
            "@category": "high",
            "@height": "2866",
            "@width": "2325",
            "@_fa": "true",
            "$": "https://api.elsevier.com/content/object/eid/1-s2.0-S0306261923014654-gr12_lrg.jpg?httpAccept=%2A%2F%2A",
            "@multimediatype": "JPEG image file",
            "@type": "IMAGE-HIGH-RES",
            "@size": "865628",
            "@ref": "gr12",
            "@mimetype": "image/jpeg"
        },
        {
            "@category": "high",
            "@height": "1313",
            "@width": "1663",
            "@_fa": "true",
            "$": "https://api.elsevier.com/content/object/eid/1-s2.0-S0306261923014654-gr1_lrg.jpg?httpAccept=%2A%2F%2A",
            "@multimediatype": "JPEG image file",
            "@type": "IMAGE-HIGH-RES",
            "@size": "383648",
            "@ref": "gr1",
            "@mimetype": "image/jpeg"
        },
        {
            "@category": "high",
            "@height": "911",
            "@width": "1658",
            "@_fa": "true",
            "$": "https://api.elsevier.com/content/object/eid/1-s2.0-S0306261923014654-gr11_lrg.jpg?httpAccept=%2A%2F%2A",
            "@multimediatype": "JPEG image file",
            "@type": "IMAGE-HIGH-RES",
            "@size": "251077",
            "@ref": "gr11",
            "@mimetype": "image/jpeg"
        },
        {
            "@category": "high",
            "@height": "1048",
            "@width": "3500",
            "@_fa": "true",
            "$": "https://api.elsevier.com/content/object/eid/1-s2.0-S0306261923014654-fx1001_lrg.jpg?httpAccept=%2A%2F%2A",
            "@multimediatype": "JPEG image file",
            "@type": "IMAGE-HIGH-RES",
            "@size": "352347",
            "@ref": "fx1001",
            "@mimetype": "image/jpeg"
        },
        {
            "@category": "high",
            "@height": "1215",
            "@width": "810",
            "@_fa": "true",
            "$": "https://api.elsevier.com/content/object/eid/1-s2.0-S0306261923014654-gr5_lrg.jpg?httpAccept=%2A%2F%2A",
            "@multimediatype": "JPEG image file",
            "@type": "IMAGE-HIGH-RES",
            "@size": "303793",
            "@ref": "gr5",
            "@mimetype": "image/jpeg"
        },
        {
            "@category": "high",
            "@height": "856",
            "@width": "1363",
            "@_fa": "true",
            "$": "https://api.elsevier.com/content/object/eid/1-s2.0-S0306261923014654-gr2_lrg.jpg?httpAccept=%2A%2F%2A",
            "@multimediatype": "JPEG image file",
            "@type": "IMAGE-HIGH-RES",
            "@size": "309596",
            "@ref": "gr2",
            "@mimetype": "image/jpeg"
        },
        {
            "@category": "high",
            "@height": "865",
            "@width": "1531",
            "@_fa": "true",
            "$": "https://api.elsevier.com/content/object/eid/1-s2.0-S0306261923014654-gr3_lrg.jpg?httpAccept=%2A%2F%2A",
            "@multimediatype": "JPEG image file",
            "@type": "IMAGE-HIGH-RES",
            "@size": "260981",
            "@ref": "gr3",
            "@mimetype": "image/jpeg"
        },
        {
            "@category": "high",
            "@height": "4085",
            "@width": "1645",
            "@_fa": "true",
            "$": "https://api.elsevier.com/content/object/eid/1-s2.0-S0306261923014654-gr8_lrg.jpg?httpAccept=%2A%2F%2A",
            "@multimediatype": "JPEG image file",
            "@type": "IMAGE-HIGH-RES",
            "@size": "1752543",
            "@ref": "gr8",
            "@mimetype": "image/jpeg"
        },
        {
            "@category": "high",
            "@height": "862",
            "@width": "2368",
            "@_fa": "true",
            "$": "https://api.elsevier.com/content/object/eid/1-s2.0-S0306261923014654-gr6_lrg.jpg?httpAccept=%2A%2F%2A",
            "@multimediatype": "JPEG image file",
            "@type": "IMAGE-HIGH-RES",
            "@size": "218296",
            "@ref": "gr6",
            "@mimetype": "image/jpeg"
        },
        {
            "@category": "high",
            "@height": "2958",
            "@width": "1653",
            "@_fa": "true",
            "$": "https://api.elsevier.com/content/object/eid/1-s2.0-S0306261923014654-gr7_lrg.jpg?httpAccept=%2A%2F%2A",
            "@multimediatype": "JPEG image file",
            "@type": "IMAGE-HIGH-RES",
            "@size": "494514",
            "@ref": "gr7",
            "@mimetype": "image/jpeg"
        },
        {
            "@category": "high",
            "@height": "909",
            "@width": "1658",
            "@_fa": "true",
            "$": "https://api.elsevier.com/content/object/eid/1-s2.0-S0306261923014654-gr9_lrg.jpg?httpAccept=%2A%2F%2A",
            "@multimediatype": "JPEG image file",
            "@type": "IMAGE-HIGH-RES",
            "@size": "321448",
            "@ref": "gr9",
            "@mimetype": "image/jpeg"
        },
        {
            "@category": "high",
            "@height": "909",
            "@width": "1658",
            "@_fa": "true",
            "$": "https://api.elsevier.com/content/object/eid/1-s2.0-S0306261923014654-gr10_lrg.jpg?httpAccept=%2A%2F%2A",
            "@multimediatype": "JPEG image file",
            "@type": "IMAGE-HIGH-RES",
            "@size": "328768",
            "@ref": "gr10",
            "@mimetype": "image/jpeg"
        },
        {
            "@category": "high",
            "@height": "960",
            "@width": "720",
            "@_fa": "true",
            "$": "https://api.elsevier.com/content/object/eid/1-s2.0-S0306261923014654-gr4_lrg.jpg?httpAccept=%2A%2F%2A",
            "@multimediatype": "JPEG image file",
            "@type": "IMAGE-HIGH-RES",
            "@size": "165698",
            "@ref": "gr4",
            "@mimetype": "image/jpeg"
        },
        {
            "@category": "thumbnail",
            "@_fa": "true",
            "$": "https://api.elsevier.com/content/object/eid/1-s2.0-S0306261923014654-si10.svg?httpAccept=%2A%2F%2A",
            "@multimediatype": "Scalable Vector Graphics file",
            "@type": "ALTIMG",
            "@size": "1347",
            "@ref": "si10",
            "@mimetype": "image/svg+xml"
        },
        {
            "@category": "thumbnail",
            "@_fa": "true",
            "$": "https://api.elsevier.com/content/object/eid/1-s2.0-S0306261923014654-si100.svg?httpAccept=%2A%2F%2A",
            "@multimediatype": "Scalable Vector Graphics file",
            "@type": "ALTIMG",
            "@size": "29720",
            "@ref": "si100",
            "@mimetype": "image/svg+xml"
        },
        {
            "@category": "thumbnail",
            "@_fa": "true",
            "$": "https://api.elsevier.com/content/object/eid/1-s2.0-S0306261923014654-si101.svg?httpAccept=%2A%2F%2A",
            "@multimediatype": "Scalable Vector Graphics file",
            "@type": "ALTIMG",
            "@size": "23224",
            "@ref": "si101",
            "@mimetype": "image/svg+xml"
        },
        {
            "@category": "thumbnail",
            "@_fa": "true",
            "$": "https://api.elsevier.com/content/object/eid/1-s2.0-S0306261923014654-si102.svg?httpAccept=%2A%2F%2A",
            "@multimediatype": "Scalable Vector Graphics file",
            "@type": "ALTIMG",
            "@size": "16138",
            "@ref": "si102",
            "@mimetype": "image/svg+xml"
        },
        {
            "@category": "thumbnail",
            "@_fa": "true",
            "$": "https://api.elsevier.com/content/object/eid/1-s2.0-S0306261923014654-si103.svg?httpAccept=%2A%2F%2A",
            "@multimediatype": "Scalable Vector Graphics file",
            "@type": "ALTIMG",
            "@size": "2792",
            "@ref": "si103",
            "@mimetype": "image/svg+xml"
        },
        {
            "@category": "thumbnail",
            "@_fa": "true",
            "$": "https://api.elsevier.com/content/object/eid/1-s2.0-S0306261923014654-si104.svg?httpAccept=%2A%2F%2A",
            "@multimediatype": "Scalable Vector Graphics file",
            "@type": "ALTIMG",
            "@size": "2340",
            "@ref": "si104",
            "@mimetype": "image/svg+xml"
        },
        {
            "@category": "thumbnail",
            "@_fa": "true",
            "$": "https://api.elsevier.com/content/object/eid/1-s2.0-S0306261923014654-si105.svg?httpAccept=%2A%2F%2A",
            "@multimediatype": "Scalable Vector Graphics file",
            "@type": "ALTIMG",
            "@size": "1383",
            "@ref": "si105",
            "@mimetype": "image/svg+xml"
        },
        {
            "@category": "thumbnail",
            "@_fa": "true",
            "$": "https://api.elsevier.com/content/object/eid/1-s2.0-S0306261923014654-si109.svg?httpAccept=%2A%2F%2A",
            "@multimediatype": "Scalable Vector Graphics file",
            "@type": "ALTIMG",
            "@size": "11958",
            "@ref": "si109",
            "@mimetype": "image/svg+xml"
        },
        {
            "@category": "thumbnail",
            "@_fa": "true",
            "$": "https://api.elsevier.com/content/object/eid/1-s2.0-S0306261923014654-si11.svg?httpAccept=%2A%2F%2A",
            "@multimediatype": "Scalable Vector Graphics file",
            "@type": "ALTIMG",
            "@size": "3695",
            "@ref": "si11",
            "@mimetype": "image/svg+xml"
        },
        {
            "@category": "thumbnail",
            "@_fa": "true",
            "$": "https://api.elsevier.com/content/object/eid/1-s2.0-S0306261923014654-si110.svg?httpAccept=%2A%2F%2A",
            "@multimediatype": "Scalable Vector Graphics file",
            "@type": "ALTIMG",
            "@size": "13549",
            "@ref": "si110",
            "@mimetype": "image/svg+xml"
        },
        {
            "@category": "thumbnail",
            "@_fa": "true",
            "$": "https://api.elsevier.com/content/object/eid/1-s2.0-S0306261923014654-si111.svg?httpAccept=%2A%2F%2A",
            "@multimediatype": "Scalable Vector Graphics file",
            "@type": "ALTIMG",
            "@size": "11798",
            "@ref": "si111",
            "@mimetype": "image/svg+xml"
        },
        {
            "@category": "thumbnail",
            "@_fa": "true",
            "$": "https://api.elsevier.com/content/object/eid/1-s2.0-S0306261923014654-si112.svg?httpAccept=%2A%2F%2A",
            "@multimediatype": "Scalable Vector Graphics file",
            "@type": "ALTIMG",
            "@size": "16654",
            "@ref": "si112",
            "@mimetype": "image/svg+xml"
        },
        {
            "@category": "thumbnail",
            "@_fa": "true",
            "$": "https://api.elsevier.com/content/object/eid/1-s2.0-S0306261923014654-si113.svg?httpAccept=%2A%2F%2A",
            "@multimediatype": "Scalable Vector Graphics file",
            "@type": "ALTIMG",
            "@size": "14110",
            "@ref": "si113",
            "@mimetype": "image/svg+xml"
        },
        {
            "@category": "thumbnail",
            "@_fa": "true",
            "$": "https://api.elsevier.com/content/object/eid/1-s2.0-S0306261923014654-si114.svg?httpAccept=%2A%2F%2A",
            "@multimediatype": "Scalable Vector Graphics file",
            "@type": "ALTIMG",
            "@size": "4420",
            "@ref": "si114",
            "@mimetype": "image/svg+xml"
        },
        {
            "@category": "thumbnail",
            "@_fa": "true",
            "$": "https://api.elsevier.com/content/object/eid/1-s2.0-S0306261923014654-si115.svg?httpAccept=%2A%2F%2A",
            "@multimediatype": "Scalable Vector Graphics file",
            "@type": "ALTIMG",
            "@size": "2476",
            "@ref": "si115",
            "@mimetype": "image/svg+xml"
        },
        {
            "@category": "thumbnail",
            "@_fa": "true",
            "$": "https://api.elsevier.com/content/object/eid/1-s2.0-S0306261923014654-si116.svg?httpAccept=%2A%2F%2A",
            "@multimediatype": "Scalable Vector Graphics file",
            "@type": "ALTIMG",
            "@size": "5340",
            "@ref": "si116",
            "@mimetype": "image/svg+xml"
        },
        {
            "@category": "thumbnail",
            "@_fa": "true",
            "$": "https://api.elsevier.com/content/object/eid/1-s2.0-S0306261923014654-si117.svg?httpAccept=%2A%2F%2A",
            "@multimediatype": "Scalable Vector Graphics file",
            "@type": "ALTIMG",
            "@size": "3629",
            "@ref": "si117",
            "@mimetype": "image/svg+xml"
        },
        {
            "@category": "thumbnail",
            "@_fa": "true",
            "$": "https://api.elsevier.com/content/object/eid/1-s2.0-S0306261923014654-si118.svg?httpAccept=%2A%2F%2A",
            "@multimediatype": "Scalable Vector Graphics file",
            "@type": "ALTIMG",
            "@size": "1157",
            "@ref": "si118",
            "@mimetype": "image/svg+xml"
        },
        {
            "@category": "thumbnail",
            "@_fa": "true",
            "$": "https://api.elsevier.com/content/object/eid/1-s2.0-S0306261923014654-si12.svg?httpAccept=%2A%2F%2A",
            "@multimediatype": "Scalable Vector Graphics file",
            "@type": "ALTIMG",
            "@size": "15171",
            "@ref": "si12",
            "@mimetype": "image/svg+xml"
        },
        {
            "@category": "thumbnail",
            "@_fa": "true",
            "$": "https://api.elsevier.com/content/object/eid/1-s2.0-S0306261923014654-si120.svg?httpAccept=%2A%2F%2A",
            "@multimediatype": "Scalable Vector Graphics file",
            "@type": "ALTIMG",
            "@size": "6068",
            "@ref": "si120",
            "@mimetype": "image/svg+xml"
        },
        {
            "@category": "thumbnail",
            "@_fa": "true",
            "$": "https://api.elsevier.com/content/object/eid/1-s2.0-S0306261923014654-si121.svg?httpAccept=%2A%2F%2A",
            "@multimediatype": "Scalable Vector Graphics file",
            "@type": "ALTIMG",
            "@size": "13180",
            "@ref": "si121",
            "@mimetype": "image/svg+xml"
        },
        {
            "@category": "thumbnail",
            "@_fa": "true",
            "$": "https://api.elsevier.com/content/object/eid/1-s2.0-S0306261923014654-si122.svg?httpAccept=%2A%2F%2A",
            "@multimediatype": "Scalable Vector Graphics file",
            "@type": "ALTIMG",
            "@size": "19005",
            "@ref": "si122",
            "@mimetype": "image/svg+xml"
        },
        {
            "@category": "thumbnail",
            "@_fa": "true",
            "$": "https://api.elsevier.com/content/object/eid/1-s2.0-S0306261923014654-si123.svg?httpAccept=%2A%2F%2A",
            "@multimediatype": "Scalable Vector Graphics file",
            "@type": "ALTIMG",
            "@size": "20336",
            "@ref": "si123",
            "@mimetype": "image/svg+xml"
        },
        {
            "@category": "thumbnail",
            "@_fa": "true",
            "$": "https://api.elsevier.com/content/object/eid/1-s2.0-S0306261923014654-si124.svg?httpAccept=%2A%2F%2A",
            "@multimediatype": "Scalable Vector Graphics file",
            "@type": "ALTIMG",
            "@size": "2858",
            "@ref": "si124",
            "@mimetype": "image/svg+xml"
        },
        {
            "@category": "thumbnail",
            "@_fa": "true",
            "$": "https://api.elsevier.com/content/object/eid/1-s2.0-S0306261923014654-si125.svg?httpAccept=%2A%2F%2A",
            "@multimediatype": "Scalable Vector Graphics file",
            "@type": "ALTIMG",
            "@size": "1456",
            "@ref": "si125",
            "@mimetype": "image/svg+xml"
        },
        {
            "@category": "thumbnail",
            "@_fa": "true",
            "$": "https://api.elsevier.com/content/object/eid/1-s2.0-S0306261923014654-si126.svg?httpAccept=%2A%2F%2A",
            "@multimediatype": "Scalable Vector Graphics file",
            "@type": "ALTIMG",
            "@size": "20712",
            "@ref": "si126",
            "@mimetype": "image/svg+xml"
        },
        {
            "@category": "thumbnail",
            "@_fa": "true",
            "$": "https://api.elsevier.com/content/object/eid/1-s2.0-S0306261923014654-si127.svg?httpAccept=%2A%2F%2A",
            "@multimediatype": "Scalable Vector Graphics file",
            "@type": "ALTIMG",
            "@size": "13774",
            "@ref": "si127",
            "@mimetype": "image/svg+xml"
        },
        {
            "@category": "thumbnail",
            "@_fa": "true",
            "$": "https://api.elsevier.com/content/object/eid/1-s2.0-S0306261923014654-si128.svg?httpAccept=%2A%2F%2A",
            "@multimediatype": "Scalable Vector Graphics file",
            "@type": "ALTIMG",
            "@size": "14456",
            "@ref": "si128",
            "@mimetype": "image/svg+xml"
        },
        {
            "@category": "thumbnail",
            "@_fa": "true",
            "$": "https://api.elsevier.com/content/object/eid/1-s2.0-S0306261923014654-si129.svg?httpAccept=%2A%2F%2A",
            "@multimediatype": "Scalable Vector Graphics file",
            "@type": "ALTIMG",
            "@size": "2607",
            "@ref": "si129",
            "@mimetype": "image/svg+xml"
        },
        {
            "@category": "thumbnail",
            "@_fa": "true",
            "$": "https://api.elsevier.com/content/object/eid/1-s2.0-S0306261923014654-si13.svg?httpAccept=%2A%2F%2A",
            "@multimediatype": "Scalable Vector Graphics file",
            "@type": "ALTIMG",
            "@size": "1625",
            "@ref": "si13",
            "@mimetype": "image/svg+xml"
        },
        {
            "@category": "thumbnail",
            "@_fa": "true",
            "$": "https://api.elsevier.com/content/object/eid/1-s2.0-S0306261923014654-si130.svg?httpAccept=%2A%2F%2A",
            "@multimediatype": "Scalable Vector Graphics file",
            "@type": "ALTIMG",
            "@size": "2539",
            "@ref": "si130",
            "@mimetype": "image/svg+xml"
        },
        {
            "@category": "thumbnail",
            "@_fa": "true",
            "$": "https://api.elsevier.com/content/object/eid/1-s2.0-S0306261923014654-si135.svg?httpAccept=%2A%2F%2A",
            "@multimediatype": "Scalable Vector Graphics file",
            "@type": "ALTIMG",
            "@size": "6988",
            "@ref": "si135",
            "@mimetype": "image/svg+xml"
        },
        {
            "@category": "thumbnail",
            "@_fa": "true",
            "$": "https://api.elsevier.com/content/object/eid/1-s2.0-S0306261923014654-si136.svg?httpAccept=%2A%2F%2A",
            "@multimediatype": "Scalable Vector Graphics file",
            "@type": "ALTIMG",
            "@size": "4972",
            "@ref": "si136",
            "@mimetype": "image/svg+xml"
        },
        {
            "@category": "thumbnail",
            "@_fa": "true",
            "$": "https://api.elsevier.com/content/object/eid/1-s2.0-S0306261923014654-si137.svg?httpAccept=%2A%2F%2A",
            "@multimediatype": "Scalable Vector Graphics file",
            "@type": "ALTIMG",
            "@size": "12986",
            "@ref": "si137",
            "@mimetype": "image/svg+xml"
        },
        {
            "@category": "thumbnail",
            "@_fa": "true",
            "$": "https://api.elsevier.com/content/object/eid/1-s2.0-S0306261923014654-si138.svg?httpAccept=%2A%2F%2A",
            "@multimediatype": "Scalable Vector Graphics file",
            "@type": "ALTIMG",
            "@size": "13198",
            "@ref": "si138",
            "@mimetype": "image/svg+xml"
        },
        {
            "@category": "thumbnail",
            "@_fa": "true",
            "$": "https://api.elsevier.com/content/object/eid/1-s2.0-S0306261923014654-si139.svg?httpAccept=%2A%2F%2A",
            "@multimediatype": "Scalable Vector Graphics file",
            "@type": "ALTIMG",
            "@size": "2041",
            "@ref": "si139",
            "@mimetype": "image/svg+xml"
        },
        {
            "@category": "thumbnail",
            "@_fa": "true",
            "$": "https://api.elsevier.com/content/object/eid/1-s2.0-S0306261923014654-si14.svg?httpAccept=%2A%2F%2A",
            "@multimediatype": "Scalable Vector Graphics file",
            "@type": "ALTIMG",
            "@size": "3364",
            "@ref": "si14",
            "@mimetype": "image/svg+xml"
        },
        {
            "@category": "thumbnail",
            "@_fa": "true",
            "$": "https://api.elsevier.com/content/object/eid/1-s2.0-S0306261923014654-si141.svg?httpAccept=%2A%2F%2A",
            "@multimediatype": "Scalable Vector Graphics file",
            "@type": "ALTIMG",
            "@size": "30425",
            "@ref": "si141",
            "@mimetype": "image/svg+xml"
        },
        {
            "@category": "thumbnail",
            "@_fa": "true",
            "$": "https://api.elsevier.com/content/object/eid/1-s2.0-S0306261923014654-si144.svg?httpAccept=%2A%2F%2A",
            "@multimediatype": "Scalable Vector Graphics file",
            "@type": "ALTIMG",
            "@size": "2010",
            "@ref": "si144",
            "@mimetype": "image/svg+xml"
        },
        {
            "@category": "thumbnail",
            "@_fa": "true",
            "$": "https://api.elsevier.com/content/object/eid/1-s2.0-S0306261923014654-si145.svg?httpAccept=%2A%2F%2A",
            "@multimediatype": "Scalable Vector Graphics file",
            "@type": "ALTIMG",
            "@size": "4254",
            "@ref": "si145",
            "@mimetype": "image/svg+xml"
        },
        {
            "@category": "thumbnail",
            "@_fa": "true",
            "$": "https://api.elsevier.com/content/object/eid/1-s2.0-S0306261923014654-si15.svg?httpAccept=%2A%2F%2A",
            "@multimediatype": "Scalable Vector Graphics file",
            "@type": "ALTIMG",
            "@size": "1900",
            "@ref": "si15",
            "@mimetype": "image/svg+xml"
        },
        {
            "@category": "thumbnail",
            "@_fa": "true",
            "$": "https://api.elsevier.com/content/object/eid/1-s2.0-S0306261923014654-si152.svg?httpAccept=%2A%2F%2A",
            "@multimediatype": "Scalable Vector Graphics file",
            "@type": "ALTIMG",
            "@size": "2495",
            "@ref": "si152",
            "@mimetype": "image/svg+xml"
        },
        {
            "@category": "thumbnail",
            "@_fa": "true",
            "$": "https://api.elsevier.com/content/object/eid/1-s2.0-S0306261923014654-si155.svg?httpAccept=%2A%2F%2A",
            "@multimediatype": "Scalable Vector Graphics file",
            "@type": "ALTIMG",
            "@size": "2205",
            "@ref": "si155",
            "@mimetype": "image/svg+xml"
        },
        {
            "@category": "thumbnail",
            "@_fa": "true",
            "$": "https://api.elsevier.com/content/object/eid/1-s2.0-S0306261923014654-si157.svg?httpAccept=%2A%2F%2A",
            "@multimediatype": "Scalable Vector Graphics file",
            "@type": "ALTIMG",
            "@size": "1008",
            "@ref": "si157",
            "@mimetype": "image/svg+xml"
        },
        {
            "@category": "thumbnail",
            "@_fa": "true",
            "$": "https://api.elsevier.com/content/object/eid/1-s2.0-S0306261923014654-si159.svg?httpAccept=%2A%2F%2A",
            "@multimediatype": "Scalable Vector Graphics file",
            "@type": "ALTIMG",
            "@size": "7341",
            "@ref": "si159",
            "@mimetype": "image/svg+xml"
        },
        {
            "@category": "thumbnail",
            "@_fa": "true",
            "$": "https://api.elsevier.com/content/object/eid/1-s2.0-S0306261923014654-si16.svg?httpAccept=%2A%2F%2A",
            "@multimediatype": "Scalable Vector Graphics file",
            "@type": "ALTIMG",
            "@size": "5863",
            "@ref": "si16",
            "@mimetype": "image/svg+xml"
        },
        {
            "@category": "thumbnail",
            "@_fa": "true",
            "$": "https://api.elsevier.com/content/object/eid/1-s2.0-S0306261923014654-si160.svg?httpAccept=%2A%2F%2A",
            "@multimediatype": "Scalable Vector Graphics file",
            "@type": "ALTIMG",
            "@size": "3795",
            "@ref": "si160",
            "@mimetype": "image/svg+xml"
        },
        {
            "@category": "thumbnail",
            "@_fa": "true",
            "$": "https://api.elsevier.com/content/object/eid/1-s2.0-S0306261923014654-si161.svg?httpAccept=%2A%2F%2A",
            "@multimediatype": "Scalable Vector Graphics file",
            "@type": "ALTIMG",
            "@size": "10944",
            "@ref": "si161",
            "@mimetype": "image/svg+xml"
        },
        {
            "@category": "thumbnail",
            "@_fa": "true",
            "$": "https://api.elsevier.com/content/object/eid/1-s2.0-S0306261923014654-si162.svg?httpAccept=%2A%2F%2A",
            "@multimediatype": "Scalable Vector Graphics file",
            "@type": "ALTIMG",
            "@size": "1428",
            "@ref": "si162",
            "@mimetype": "image/svg+xml"
        },
        {
            "@category": "thumbnail",
            "@_fa": "true",
            "$": "https://api.elsevier.com/content/object/eid/1-s2.0-S0306261923014654-si163.svg?httpAccept=%2A%2F%2A",
            "@multimediatype": "Scalable Vector Graphics file",
            "@type": "ALTIMG",
            "@size": "3506",
            "@ref": "si163",
            "@mimetype": "image/svg+xml"
        },
        {
            "@category": "thumbnail",
            "@_fa": "true",
            "$": "https://api.elsevier.com/content/object/eid/1-s2.0-S0306261923014654-si164.svg?httpAccept=%2A%2F%2A",
            "@multimediatype": "Scalable Vector Graphics file",
            "@type": "ALTIMG",
            "@size": "10825",
            "@ref": "si164",
            "@mimetype": "image/svg+xml"
        },
        {
            "@category": "thumbnail",
            "@_fa": "true",
            "$": "https://api.elsevier.com/content/object/eid/1-s2.0-S0306261923014654-si165.svg?httpAccept=%2A%2F%2A",
            "@multimediatype": "Scalable Vector Graphics file",
            "@type": "ALTIMG",
            "@size": "5047",
            "@ref": "si165",
            "@mimetype": "image/svg+xml"
        },
        {
            "@category": "thumbnail",
            "@_fa": "true",
            "$": "https://api.elsevier.com/content/object/eid/1-s2.0-S0306261923014654-si166.svg?httpAccept=%2A%2F%2A",
            "@multimediatype": "Scalable Vector Graphics file",
            "@type": "ALTIMG",
            "@size": "19444",
            "@ref": "si166",
            "@mimetype": "image/svg+xml"
        },
        {
            "@category": "thumbnail",
            "@_fa": "true",
            "$": "https://api.elsevier.com/content/object/eid/1-s2.0-S0306261923014654-si169.svg?httpAccept=%2A%2F%2A",
            "@multimediatype": "Scalable Vector Graphics file",
            "@type": "ALTIMG",
            "@size": "1510",
            "@ref": "si169",
            "@mimetype": "image/svg+xml"
        },
        {
            "@category": "thumbnail",
            "@_fa": "true",
            "$": "https://api.elsevier.com/content/object/eid/1-s2.0-S0306261923014654-si17.svg?httpAccept=%2A%2F%2A",
            "@multimediatype": "Scalable Vector Graphics file",
            "@type": "ALTIMG",
            "@size": "8252",
            "@ref": "si17",
            "@mimetype": "image/svg+xml"
        },
        {
            "@category": "thumbnail",
            "@_fa": "true",
            "$": "https://api.elsevier.com/content/object/eid/1-s2.0-S0306261923014654-si170.svg?httpAccept=%2A%2F%2A",
            "@multimediatype": "Scalable Vector Graphics file",
            "@type": "ALTIMG",
            "@size": "1924",
            "@ref": "si170",
            "@mimetype": "image/svg+xml"
        },
        {
            "@category": "thumbnail",
            "@_fa": "true",
            "$": "https://api.elsevier.com/content/object/eid/1-s2.0-S0306261923014654-si171.svg?httpAccept=%2A%2F%2A",
            "@multimediatype": "Scalable Vector Graphics file",
            "@type": "ALTIMG",
            "@size": "1586",
            "@ref": "si171",
            "@mimetype": "image/svg+xml"
        },
        {
            "@category": "thumbnail",
            "@_fa": "true",
            "$": "https://api.elsevier.com/content/object/eid/1-s2.0-S0306261923014654-si172.svg?httpAccept=%2A%2F%2A",
            "@multimediatype": "Scalable Vector Graphics file",
            "@type": "ALTIMG",
            "@size": "1547",
            "@ref": "si172",
            "@mimetype": "image/svg+xml"
        },
        {
            "@category": "thumbnail",
            "@_fa": "true",
            "$": "https://api.elsevier.com/content/object/eid/1-s2.0-S0306261923014654-si173.svg?httpAccept=%2A%2F%2A",
            "@multimediatype": "Scalable Vector Graphics file",
            "@type": "ALTIMG",
            "@size": "1832",
            "@ref": "si173",
            "@mimetype": "image/svg+xml"
        },
        {
            "@category": "thumbnail",
            "@_fa": "true",
            "$": "https://api.elsevier.com/content/object/eid/1-s2.0-S0306261923014654-si174.svg?httpAccept=%2A%2F%2A",
            "@multimediatype": "Scalable Vector Graphics file",
            "@type": "ALTIMG",
            "@size": "1537",
            "@ref": "si174",
            "@mimetype": "image/svg+xml"
        },
        {
            "@category": "thumbnail",
            "@_fa": "true",
            "$": "https://api.elsevier.com/content/object/eid/1-s2.0-S0306261923014654-si175.svg?httpAccept=%2A%2F%2A",
            "@multimediatype": "Scalable Vector Graphics file",
            "@type": "ALTIMG",
            "@size": "2853",
            "@ref": "si175",
            "@mimetype": "image/svg+xml"
        },
        {
            "@category": "thumbnail",
            "@_fa": "true",
            "$": "https://api.elsevier.com/content/object/eid/1-s2.0-S0306261923014654-si176.svg?httpAccept=%2A%2F%2A",
            "@multimediatype": "Scalable Vector Graphics file",
            "@type": "ALTIMG",
            "@size": "2056",
            "@ref": "si176",
            "@mimetype": "image/svg+xml"
        },
        {
            "@category": "thumbnail",
            "@_fa": "true",
            "$": "https://api.elsevier.com/content/object/eid/1-s2.0-S0306261923014654-si179.svg?httpAccept=%2A%2F%2A",
            "@multimediatype": "Scalable Vector Graphics file",
            "@type": "ALTIMG",
            "@size": "13209",
            "@ref": "si179",
            "@mimetype": "image/svg+xml"
        },
        {
            "@category": "thumbnail",
            "@_fa": "true",
            "$": "https://api.elsevier.com/content/object/eid/1-s2.0-S0306261923014654-si18.svg?httpAccept=%2A%2F%2A",
            "@multimediatype": "Scalable Vector Graphics file",
            "@type": "ALTIMG",
            "@size": "4334",
            "@ref": "si18",
            "@mimetype": "image/svg+xml"
        },
        {
            "@category": "thumbnail",
            "@_fa": "true",
            "$": "https://api.elsevier.com/content/object/eid/1-s2.0-S0306261923014654-si180.svg?httpAccept=%2A%2F%2A",
            "@multimediatype": "Scalable Vector Graphics file",
            "@type": "ALTIMG",
            "@size": "2659",
            "@ref": "si180",
            "@mimetype": "image/svg+xml"
        },
        {
            "@category": "thumbnail",
            "@_fa": "true",
            "$": "https://api.elsevier.com/content/object/eid/1-s2.0-S0306261923014654-si181.svg?httpAccept=%2A%2F%2A",
            "@multimediatype": "Scalable Vector Graphics file",
            "@type": "ALTIMG",
            "@size": "13323",
            "@ref": "si181",
            "@mimetype": "image/svg+xml"
        },
        {
            "@category": "thumbnail",
            "@_fa": "true",
            "$": "https://api.elsevier.com/content/object/eid/1-s2.0-S0306261923014654-si183.svg?httpAccept=%2A%2F%2A",
            "@multimediatype": "Scalable Vector Graphics file",
            "@type": "ALTIMG",
            "@size": "3668",
            "@ref": "si183",
            "@mimetype": "image/svg+xml"
        },
        {
            "@category": "thumbnail",
            "@_fa": "true",
            "$": "https://api.elsevier.com/content/object/eid/1-s2.0-S0306261923014654-si184.svg?httpAccept=%2A%2F%2A",
            "@multimediatype": "Scalable Vector Graphics file",
            "@type": "ALTIMG",
            "@size": "3909",
            "@ref": "si184",
            "@mimetype": "image/svg+xml"
        },
        {
            "@category": "thumbnail",
            "@_fa": "true",
            "$": "https://api.elsevier.com/content/object/eid/1-s2.0-S0306261923014654-si185.svg?httpAccept=%2A%2F%2A",
            "@multimediatype": "Scalable Vector Graphics file",
            "@type": "ALTIMG",
            "@size": "3500",
            "@ref": "si185",
            "@mimetype": "image/svg+xml"
        },
        {
            "@category": "thumbnail",
            "@_fa": "true",
            "$": "https://api.elsevier.com/content/object/eid/1-s2.0-S0306261923014654-si186.svg?httpAccept=%2A%2F%2A",
            "@multimediatype": "Scalable Vector Graphics file",
            "@type": "ALTIMG",
            "@size": "1434",
            "@ref": "si186",
            "@mimetype": "image/svg+xml"
        },
        {
            "@category": "thumbnail",
            "@_fa": "true",
            "$": "https://api.elsevier.com/content/object/eid/1-s2.0-S0306261923014654-si188.svg?httpAccept=%2A%2F%2A",
            "@multimediatype": "Scalable Vector Graphics file",
            "@type": "ALTIMG",
            "@size": "4577",
            "@ref": "si188",
            "@mimetype": "image/svg+xml"
        },
        {
            "@category": "thumbnail",
            "@_fa": "true",
            "$": "https://api.elsevier.com/content/object/eid/1-s2.0-S0306261923014654-si19.svg?httpAccept=%2A%2F%2A",
            "@multimediatype": "Scalable Vector Graphics file",
            "@type": "ALTIMG",
            "@size": "17272",
            "@ref": "si19",
            "@mimetype": "image/svg+xml"
        },
        {
            "@category": "thumbnail",
            "@_fa": "true",
            "$": "https://api.elsevier.com/content/object/eid/1-s2.0-S0306261923014654-si190.svg?httpAccept=%2A%2F%2A",
            "@multimediatype": "Scalable Vector Graphics file",
            "@type": "ALTIMG",
            "@size": "5022",
            "@ref": "si190",
            "@mimetype": "image/svg+xml"
        },
        {
            "@category": "thumbnail",
            "@_fa": "true",
            "$": "https://api.elsevier.com/content/object/eid/1-s2.0-S0306261923014654-si191.svg?httpAccept=%2A%2F%2A",
            "@multimediatype": "Scalable Vector Graphics file",
            "@type": "ALTIMG",
            "@size": "5524",
            "@ref": "si191",
            "@mimetype": "image/svg+xml"
        },
        {
            "@category": "thumbnail",
            "@_fa": "true",
            "$": "https://api.elsevier.com/content/object/eid/1-s2.0-S0306261923014654-si192.svg?httpAccept=%2A%2F%2A",
            "@multimediatype": "Scalable Vector Graphics file",
            "@type": "ALTIMG",
            "@size": "7139",
            "@ref": "si192",
            "@mimetype": "image/svg+xml"
        },
        {
            "@category": "thumbnail",
            "@_fa": "true",
            "$": "https://api.elsevier.com/content/object/eid/1-s2.0-S0306261923014654-si196.svg?httpAccept=%2A%2F%2A",
            "@multimediatype": "Scalable Vector Graphics file",
            "@type": "ALTIMG",
            "@size": "5265",
            "@ref": "si196",
            "@mimetype": "image/svg+xml"
        },
        {
            "@category": "thumbnail",
            "@_fa": "true",
            "$": "https://api.elsevier.com/content/object/eid/1-s2.0-S0306261923014654-si197.svg?httpAccept=%2A%2F%2A",
            "@multimediatype": "Scalable Vector Graphics file",
            "@type": "ALTIMG",
            "@size": "4396",
            "@ref": "si197",
            "@mimetype": "image/svg+xml"
        },
        {
            "@category": "thumbnail",
            "@_fa": "true",
            "$": "https://api.elsevier.com/content/object/eid/1-s2.0-S0306261923014654-si198.svg?httpAccept=%2A%2F%2A",
            "@multimediatype": "Scalable Vector Graphics file",
            "@type": "ALTIMG",
            "@size": "2127",
            "@ref": "si198",
            "@mimetype": "image/svg+xml"
        },
        {
            "@category": "thumbnail",
            "@_fa": "true",
            "$": "https://api.elsevier.com/content/object/eid/1-s2.0-S0306261923014654-si200.svg?httpAccept=%2A%2F%2A",
            "@multimediatype": "Scalable Vector Graphics file",
            "@type": "ALTIMG",
            "@size": "1986",
            "@ref": "si200",
            "@mimetype": "image/svg+xml"
        },
        {
            "@category": "thumbnail",
            "@_fa": "true",
            "$": "https://api.elsevier.com/content/object/eid/1-s2.0-S0306261923014654-si205.svg?httpAccept=%2A%2F%2A",
            "@multimediatype": "Scalable Vector Graphics file",
            "@type": "ALTIMG",
            "@size": "5377",
            "@ref": "si205",
            "@mimetype": "image/svg+xml"
        },
        {
            "@category": "thumbnail",
            "@_fa": "true",
            "$": "https://api.elsevier.com/content/object/eid/1-s2.0-S0306261923014654-si206.svg?httpAccept=%2A%2F%2A",
            "@multimediatype": "Scalable Vector Graphics file",
            "@type": "ALTIMG",
            "@size": "22062",
            "@ref": "si206",
            "@mimetype": "image/svg+xml"
        },
        {
            "@category": "thumbnail",
            "@_fa": "true",
            "$": "https://api.elsevier.com/content/object/eid/1-s2.0-S0306261923014654-si207.svg?httpAccept=%2A%2F%2A",
            "@multimediatype": "Scalable Vector Graphics file",
            "@type": "ALTIMG",
            "@size": "15871",
            "@ref": "si207",
            "@mimetype": "image/svg+xml"
        },
        {
            "@category": "thumbnail",
            "@_fa": "true",
            "$": "https://api.elsevier.com/content/object/eid/1-s2.0-S0306261923014654-si208.svg?httpAccept=%2A%2F%2A",
            "@multimediatype": "Scalable Vector Graphics file",
            "@type": "ALTIMG",
            "@size": "21156",
            "@ref": "si208",
            "@mimetype": "image/svg+xml"
        },
        {
            "@category": "thumbnail",
            "@_fa": "true",
            "$": "https://api.elsevier.com/content/object/eid/1-s2.0-S0306261923014654-si209.svg?httpAccept=%2A%2F%2A",
            "@multimediatype": "Scalable Vector Graphics file",
            "@type": "ALTIMG",
            "@size": "19169",
            "@ref": "si209",
            "@mimetype": "image/svg+xml"
        },
        {
            "@category": "thumbnail",
            "@_fa": "true",
            "$": "https://api.elsevier.com/content/object/eid/1-s2.0-S0306261923014654-si22.svg?httpAccept=%2A%2F%2A",
            "@multimediatype": "Scalable Vector Graphics file",
            "@type": "ALTIMG",
            "@size": "7962",
            "@ref": "si22",
            "@mimetype": "image/svg+xml"
        },
        {
            "@category": "thumbnail",
            "@_fa": "true",
            "$": "https://api.elsevier.com/content/object/eid/1-s2.0-S0306261923014654-si23.svg?httpAccept=%2A%2F%2A",
            "@multimediatype": "Scalable Vector Graphics file",
            "@type": "ALTIMG",
            "@size": "7955",
            "@ref": "si23",
            "@mimetype": "image/svg+xml"
        },
        {
            "@category": "thumbnail",
            "@_fa": "true",
            "$": "https://api.elsevier.com/content/object/eid/1-s2.0-S0306261923014654-si24.svg?httpAccept=%2A%2F%2A",
            "@multimediatype": "Scalable Vector Graphics file",
            "@type": "ALTIMG",
            "@size": "7365",
            "@ref": "si24",
            "@mimetype": "image/svg+xml"
        },
        {
            "@category": "thumbnail",
            "@_fa": "true",
            "$": "https://api.elsevier.com/content/object/eid/1-s2.0-S0306261923014654-si25.svg?httpAccept=%2A%2F%2A",
            "@multimediatype": "Scalable Vector Graphics file",
            "@type": "ALTIMG",
            "@size": "8042",
            "@ref": "si25",
            "@mimetype": "image/svg+xml"
        },
        {
            "@category": "thumbnail",
            "@_fa": "true",
            "$": "https://api.elsevier.com/content/object/eid/1-s2.0-S0306261923014654-si26.svg?httpAccept=%2A%2F%2A",
            "@multimediatype": "Scalable Vector Graphics file",
            "@type": "ALTIMG",
            "@size": "7360",
            "@ref": "si26",
            "@mimetype": "image/svg+xml"
        },
        {
            "@category": "thumbnail",
            "@_fa": "true",
            "$": "https://api.elsevier.com/content/object/eid/1-s2.0-S0306261923014654-si27.svg?httpAccept=%2A%2F%2A",
            "@multimediatype": "Scalable Vector Graphics file",
            "@type": "ALTIMG",
            "@size": "2200",
            "@ref": "si27",
            "@mimetype": "image/svg+xml"
        },
        {
            "@category": "thumbnail",
            "@_fa": "true",
            "$": "https://api.elsevier.com/content/object/eid/1-s2.0-S0306261923014654-si28.svg?httpAccept=%2A%2F%2A",
            "@multimediatype": "Scalable Vector Graphics file",
            "@type": "ALTIMG",
            "@size": "1796",
            "@ref": "si28",
            "@mimetype": "image/svg+xml"
        },
        {
            "@category": "thumbnail",
            "@_fa": "true",
            "$": "https://api.elsevier.com/content/object/eid/1-s2.0-S0306261923014654-si29.svg?httpAccept=%2A%2F%2A",
            "@multimediatype": "Scalable Vector Graphics file",
            "@type": "ALTIMG",
            "@size": "2983",
            "@ref": "si29",
            "@mimetype": "image/svg+xml"
        },
        {
            "@category": "thumbnail",
            "@_fa": "true",
            "$": "https://api.elsevier.com/content/object/eid/1-s2.0-S0306261923014654-si3.svg?httpAccept=%2A%2F%2A",
            "@multimediatype": "Scalable Vector Graphics file",
            "@type": "ALTIMG",
            "@size": "4166",
            "@ref": "si3",
            "@mimetype": "image/svg+xml"
        },
        {
            "@category": "thumbnail",
            "@_fa": "true",
            "$": "https://api.elsevier.com/content/object/eid/1-s2.0-S0306261923014654-si30.svg?httpAccept=%2A%2F%2A",
            "@multimediatype": "Scalable Vector Graphics file",
            "@type": "ALTIMG",
            "@size": "7246",
            "@ref": "si30",
            "@mimetype": "image/svg+xml"
        },
        {
            "@category": "thumbnail",
            "@_fa": "true",
            "$": "https://api.elsevier.com/content/object/eid/1-s2.0-S0306261923014654-si31.svg?httpAccept=%2A%2F%2A",
            "@multimediatype": "Scalable Vector Graphics file",
            "@type": "ALTIMG",
            "@size": "8442",
            "@ref": "si31",
            "@mimetype": "image/svg+xml"
        },
        {
            "@category": "thumbnail",
            "@_fa": "true",
            "$": "https://api.elsevier.com/content/object/eid/1-s2.0-S0306261923014654-si33.svg?httpAccept=%2A%2F%2A",
            "@multimediatype": "Scalable Vector Graphics file",
            "@type": "ALTIMG",
            "@size": "22933",
            "@ref": "si33",
            "@mimetype": "image/svg+xml"
        },
        {
            "@category": "thumbnail",
            "@_fa": "true",
            "$": "https://api.elsevier.com/content/object/eid/1-s2.0-S0306261923014654-si34.svg?httpAccept=%2A%2F%2A",
            "@multimediatype": "Scalable Vector Graphics file",
            "@type": "ALTIMG",
            "@size": "1190",
            "@ref": "si34",
            "@mimetype": "image/svg+xml"
        },
        {
            "@category": "thumbnail",
            "@_fa": "true",
            "$": "https://api.elsevier.com/content/object/eid/1-s2.0-S0306261923014654-si35.svg?httpAccept=%2A%2F%2A",
            "@multimediatype": "Scalable Vector Graphics file",
            "@type": "ALTIMG",
            "@size": "831",
            "@ref": "si35",
            "@mimetype": "image/svg+xml"
        },
        {
            "@category": "thumbnail",
            "@_fa": "true",
            "$": "https://api.elsevier.com/content/object/eid/1-s2.0-S0306261923014654-si36.svg?httpAccept=%2A%2F%2A",
            "@multimediatype": "Scalable Vector Graphics file",
            "@type": "ALTIMG",
            "@size": "3367",
            "@ref": "si36",
            "@mimetype": "image/svg+xml"
        },
        {
            "@category": "thumbnail",
            "@_fa": "true",
            "$": "https://api.elsevier.com/content/object/eid/1-s2.0-S0306261923014654-si38.svg?httpAccept=%2A%2F%2A",
            "@multimediatype": "Scalable Vector Graphics file",
            "@type": "ALTIMG",
            "@size": "3579",
            "@ref": "si38",
            "@mimetype": "image/svg+xml"
        },
        {
            "@category": "thumbnail",
            "@_fa": "true",
            "$": "https://api.elsevier.com/content/object/eid/1-s2.0-S0306261923014654-si39.svg?httpAccept=%2A%2F%2A",
            "@multimediatype": "Scalable Vector Graphics file",
            "@type": "ALTIMG",
            "@size": "1970",
            "@ref": "si39",
            "@mimetype": "image/svg+xml"
        },
        {
            "@category": "thumbnail",
            "@_fa": "true",
            "$": "https://api.elsevier.com/content/object/eid/1-s2.0-S0306261923014654-si4.svg?httpAccept=%2A%2F%2A",
            "@multimediatype": "Scalable Vector Graphics file",
            "@type": "ALTIMG",
            "@size": "6505",
            "@ref": "si4",
            "@mimetype": "image/svg+xml"
        },
        {
            "@category": "thumbnail",
            "@_fa": "true",
            "$": "https://api.elsevier.com/content/object/eid/1-s2.0-S0306261923014654-si41.svg?httpAccept=%2A%2F%2A",
            "@multimediatype": "Scalable Vector Graphics file",
            "@type": "ALTIMG",
            "@size": "14057",
            "@ref": "si41",
            "@mimetype": "image/svg+xml"
        },
        {
            "@category": "thumbnail",
            "@_fa": "true",
            "$": "https://api.elsevier.com/content/object/eid/1-s2.0-S0306261923014654-si42.svg?httpAccept=%2A%2F%2A",
            "@multimediatype": "Scalable Vector Graphics file",
            "@type": "ALTIMG",
            "@size": "9555",
            "@ref": "si42",
            "@mimetype": "image/svg+xml"
        },
        {
            "@category": "thumbnail",
            "@_fa": "true",
            "$": "https://api.elsevier.com/content/object/eid/1-s2.0-S0306261923014654-si43.svg?httpAccept=%2A%2F%2A",
            "@multimediatype": "Scalable Vector Graphics file",
            "@type": "ALTIMG",
            "@size": "9626",
            "@ref": "si43",
            "@mimetype": "image/svg+xml"
        },
        {
            "@category": "thumbnail",
            "@_fa": "true",
            "$": "https://api.elsevier.com/content/object/eid/1-s2.0-S0306261923014654-si44.svg?httpAccept=%2A%2F%2A",
            "@multimediatype": "Scalable Vector Graphics file",
            "@type": "ALTIMG",
            "@size": "11057",
            "@ref": "si44",
            "@mimetype": "image/svg+xml"
        },
        {
            "@category": "thumbnail",
            "@_fa": "true",
            "$": "https://api.elsevier.com/content/object/eid/1-s2.0-S0306261923014654-si45.svg?httpAccept=%2A%2F%2A",
            "@multimediatype": "Scalable Vector Graphics file",
            "@type": "ALTIMG",
            "@size": "10982",
            "@ref": "si45",
            "@mimetype": "image/svg+xml"
        },
        {
            "@category": "thumbnail",
            "@_fa": "true",
            "$": "https://api.elsevier.com/content/object/eid/1-s2.0-S0306261923014654-si46.svg?httpAccept=%2A%2F%2A",
            "@multimediatype": "Scalable Vector Graphics file",
            "@type": "ALTIMG",
            "@size": "12784",
            "@ref": "si46",
            "@mimetype": "image/svg+xml"
        },
        {
            "@category": "thumbnail",
            "@_fa": "true",
            "$": "https://api.elsevier.com/content/object/eid/1-s2.0-S0306261923014654-si47.svg?httpAccept=%2A%2F%2A",
            "@multimediatype": "Scalable Vector Graphics file",
            "@type": "ALTIMG",
            "@size": "24478",
            "@ref": "si47",
            "@mimetype": "image/svg+xml"
        },
        {
            "@category": "thumbnail",
            "@_fa": "true",
            "$": "https://api.elsevier.com/content/object/eid/1-s2.0-S0306261923014654-si48.svg?httpAccept=%2A%2F%2A",
            "@multimediatype": "Scalable Vector Graphics file",
            "@type": "ALTIMG",
            "@size": "1775",
            "@ref": "si48",
            "@mimetype": "image/svg+xml"
        },
        {
            "@category": "thumbnail",
            "@_fa": "true",
            "$": "https://api.elsevier.com/content/object/eid/1-s2.0-S0306261923014654-si49.svg?httpAccept=%2A%2F%2A",
            "@multimediatype": "Scalable Vector Graphics file",
            "@type": "ALTIMG",
            "@size": "9430",
            "@ref": "si49",
            "@mimetype": "image/svg+xml"
        },
        {
            "@category": "thumbnail",
            "@_fa": "true",
            "$": "https://api.elsevier.com/content/object/eid/1-s2.0-S0306261923014654-si5.svg?httpAccept=%2A%2F%2A",
            "@multimediatype": "Scalable Vector Graphics file",
            "@type": "ALTIMG",
            "@size": "3469",
            "@ref": "si5",
            "@mimetype": "image/svg+xml"
        },
        {
            "@category": "thumbnail",
            "@_fa": "true",
            "$": "https://api.elsevier.com/content/object/eid/1-s2.0-S0306261923014654-si50.svg?httpAccept=%2A%2F%2A",
            "@multimediatype": "Scalable Vector Graphics file",
            "@type": "ALTIMG",
            "@size": "1086",
            "@ref": "si50",
            "@mimetype": "image/svg+xml"
        },
        {
            "@category": "thumbnail",
            "@_fa": "true",
            "$": "https://api.elsevier.com/content/object/eid/1-s2.0-S0306261923014654-si51.svg?httpAccept=%2A%2F%2A",
            "@multimediatype": "Scalable Vector Graphics file",
            "@type": "ALTIMG",
            "@size": "12390",
            "@ref": "si51",
            "@mimetype": "image/svg+xml"
        },
        {
            "@category": "thumbnail",
            "@_fa": "true",
            "$": "https://api.elsevier.com/content/object/eid/1-s2.0-S0306261923014654-si52.svg?httpAccept=%2A%2F%2A",
            "@multimediatype": "Scalable Vector Graphics file",
            "@type": "ALTIMG",
            "@size": "9278",
            "@ref": "si52",
            "@mimetype": "image/svg+xml"
        },
        {
            "@category": "thumbnail",
            "@_fa": "true",
            "$": "https://api.elsevier.com/content/object/eid/1-s2.0-S0306261923014654-si53.svg?httpAccept=%2A%2F%2A",
            "@multimediatype": "Scalable Vector Graphics file",
            "@type": "ALTIMG",
            "@size": "10543",
            "@ref": "si53",
            "@mimetype": "image/svg+xml"
        },
        {
            "@category": "thumbnail",
            "@_fa": "true",
            "$": "https://api.elsevier.com/content/object/eid/1-s2.0-S0306261923014654-si54.svg?httpAccept=%2A%2F%2A",
            "@multimediatype": "Scalable Vector Graphics file",
            "@type": "ALTIMG",
            "@size": "12544",
            "@ref": "si54",
            "@mimetype": "image/svg+xml"
        },
        {
            "@category": "thumbnail",
            "@_fa": "true",
            "$": "https://api.elsevier.com/content/object/eid/1-s2.0-S0306261923014654-si55.svg?httpAccept=%2A%2F%2A",
            "@multimediatype": "Scalable Vector Graphics file",
            "@type": "ALTIMG",
            "@size": "18876",
            "@ref": "si55",
            "@mimetype": "image/svg+xml"
        },
        {
            "@category": "thumbnail",
            "@_fa": "true",
            "$": "https://api.elsevier.com/content/object/eid/1-s2.0-S0306261923014654-si58.svg?httpAccept=%2A%2F%2A",
            "@multimediatype": "Scalable Vector Graphics file",
            "@type": "ALTIMG",
            "@size": "5819",
            "@ref": "si58",
            "@mimetype": "image/svg+xml"
        },
        {
            "@category": "thumbnail",
            "@_fa": "true",
            "$": "https://api.elsevier.com/content/object/eid/1-s2.0-S0306261923014654-si59.svg?httpAccept=%2A%2F%2A",
            "@multimediatype": "Scalable Vector Graphics file",
            "@type": "ALTIMG",
            "@size": "7173",
            "@ref": "si59",
            "@mimetype": "image/svg+xml"
        },
        {
            "@category": "thumbnail",
            "@_fa": "true",
            "$": "https://api.elsevier.com/content/object/eid/1-s2.0-S0306261923014654-si6.svg?httpAccept=%2A%2F%2A",
            "@multimediatype": "Scalable Vector Graphics file",
            "@type": "ALTIMG",
            "@size": "5409",
            "@ref": "si6",
            "@mimetype": "image/svg+xml"
        },
        {
            "@category": "thumbnail",
            "@_fa": "true",
            "$": "https://api.elsevier.com/content/object/eid/1-s2.0-S0306261923014654-si60.svg?httpAccept=%2A%2F%2A",
            "@multimediatype": "Scalable Vector Graphics file",
            "@type": "ALTIMG",
            "@size": "16403",
            "@ref": "si60",
            "@mimetype": "image/svg+xml"
        },
        {
            "@category": "thumbnail",
            "@_fa": "true",
            "$": "https://api.elsevier.com/content/object/eid/1-s2.0-S0306261923014654-si61.svg?httpAccept=%2A%2F%2A",
            "@multimediatype": "Scalable Vector Graphics file",
            "@type": "ALTIMG",
            "@size": "5318",
            "@ref": "si61",
            "@mimetype": "image/svg+xml"
        },
        {
            "@category": "thumbnail",
            "@_fa": "true",
            "$": "https://api.elsevier.com/content/object/eid/1-s2.0-S0306261923014654-si62.svg?httpAccept=%2A%2F%2A",
            "@multimediatype": "Scalable Vector Graphics file",
            "@type": "ALTIMG",
            "@size": "4206",
            "@ref": "si62",
            "@mimetype": "image/svg+xml"
        },
        {
            "@category": "thumbnail",
            "@_fa": "true",
            "$": "https://api.elsevier.com/content/object/eid/1-s2.0-S0306261923014654-si63.svg?httpAccept=%2A%2F%2A",
            "@multimediatype": "Scalable Vector Graphics file",
            "@type": "ALTIMG",
            "@size": "4470",
            "@ref": "si63",
            "@mimetype": "image/svg+xml"
        },
        {
            "@category": "thumbnail",
            "@_fa": "true",
            "$": "https://api.elsevier.com/content/object/eid/1-s2.0-S0306261923014654-si65.svg?httpAccept=%2A%2F%2A",
            "@multimediatype": "Scalable Vector Graphics file",
            "@type": "ALTIMG",
            "@size": "16308",
            "@ref": "si65",
            "@mimetype": "image/svg+xml"
        },
        {
            "@category": "thumbnail",
            "@_fa": "true",
            "$": "https://api.elsevier.com/content/object/eid/1-s2.0-S0306261923014654-si67.svg?httpAccept=%2A%2F%2A",
            "@multimediatype": "Scalable Vector Graphics file",
            "@type": "ALTIMG",
            "@size": "13180",
            "@ref": "si67",
            "@mimetype": "image/svg+xml"
        },
        {
            "@category": "thumbnail",
            "@_fa": "true",
            "$": "https://api.elsevier.com/content/object/eid/1-s2.0-S0306261923014654-si68.svg?httpAccept=%2A%2F%2A",
            "@multimediatype": "Scalable Vector Graphics file",
            "@type": "ALTIMG",
            "@size": "35071",
            "@ref": "si68",
            "@mimetype": "image/svg+xml"
        },
        {
            "@category": "thumbnail",
            "@_fa": "true",
            "$": "https://api.elsevier.com/content/object/eid/1-s2.0-S0306261923014654-si69.svg?httpAccept=%2A%2F%2A",
            "@multimediatype": "Scalable Vector Graphics file",
            "@type": "ALTIMG",
            "@size": "2578",
            "@ref": "si69",
            "@mimetype": "image/svg+xml"
        },
        {
            "@category": "thumbnail",
            "@_fa": "true",
            "$": "https://api.elsevier.com/content/object/eid/1-s2.0-S0306261923014654-si7.svg?httpAccept=%2A%2F%2A",
            "@multimediatype": "Scalable Vector Graphics file",
            "@type": "ALTIMG",
            "@size": "6144",
            "@ref": "si7",
            "@mimetype": "image/svg+xml"
        },
        {
            "@category": "thumbnail",
            "@_fa": "true",
            "$": "https://api.elsevier.com/content/object/eid/1-s2.0-S0306261923014654-si70.svg?httpAccept=%2A%2F%2A",
            "@multimediatype": "Scalable Vector Graphics file",
            "@type": "ALTIMG",
            "@size": "2698",
            "@ref": "si70",
            "@mimetype": "image/svg+xml"
        },
        {
            "@category": "thumbnail",
            "@_fa": "true",
            "$": "https://api.elsevier.com/content/object/eid/1-s2.0-S0306261923014654-si71.svg?httpAccept=%2A%2F%2A",
            "@multimediatype": "Scalable Vector Graphics file",
            "@type": "ALTIMG",
            "@size": "5725",
            "@ref": "si71",
            "@mimetype": "image/svg+xml"
        },
        {
            "@category": "thumbnail",
            "@_fa": "true",
            "$": "https://api.elsevier.com/content/object/eid/1-s2.0-S0306261923014654-si72.svg?httpAccept=%2A%2F%2A",
            "@multimediatype": "Scalable Vector Graphics file",
            "@type": "ALTIMG",
            "@size": "10275",
            "@ref": "si72",
            "@mimetype": "image/svg+xml"
        },
        {
            "@category": "thumbnail",
            "@_fa": "true",
            "$": "https://api.elsevier.com/content/object/eid/1-s2.0-S0306261923014654-si73.svg?httpAccept=%2A%2F%2A",
            "@multimediatype": "Scalable Vector Graphics file",
            "@type": "ALTIMG",
            "@size": "11398",
            "@ref": "si73",
            "@mimetype": "image/svg+xml"
        },
        {
            "@category": "thumbnail",
            "@_fa": "true",
            "$": "https://api.elsevier.com/content/object/eid/1-s2.0-S0306261923014654-si74.svg?httpAccept=%2A%2F%2A",
            "@multimediatype": "Scalable Vector Graphics file",
            "@type": "ALTIMG",
            "@size": "2343",
            "@ref": "si74",
            "@mimetype": "image/svg+xml"
        },
        {
            "@category": "thumbnail",
            "@_fa": "true",
            "$": "https://api.elsevier.com/content/object/eid/1-s2.0-S0306261923014654-si75.svg?httpAccept=%2A%2F%2A",
            "@multimediatype": "Scalable Vector Graphics file",
            "@type": "ALTIMG",
            "@size": "6668",
            "@ref": "si75",
            "@mimetype": "image/svg+xml"
        },
        {
            "@category": "thumbnail",
            "@_fa": "true",
            "$": "https://api.elsevier.com/content/object/eid/1-s2.0-S0306261923014654-si76.svg?httpAccept=%2A%2F%2A",
            "@multimediatype": "Scalable Vector Graphics file",
            "@type": "ALTIMG",
            "@size": "8389",
            "@ref": "si76",
            "@mimetype": "image/svg+xml"
        },
        {
            "@category": "thumbnail",
            "@_fa": "true",
            "$": "https://api.elsevier.com/content/object/eid/1-s2.0-S0306261923014654-si78.svg?httpAccept=%2A%2F%2A",
            "@multimediatype": "Scalable Vector Graphics file",
            "@type": "ALTIMG",
            "@size": "1732",
            "@ref": "si78",
            "@mimetype": "image/svg+xml"
        },
        {
            "@category": "thumbnail",
            "@_fa": "true",
            "$": "https://api.elsevier.com/content/object/eid/1-s2.0-S0306261923014654-si8.svg?httpAccept=%2A%2F%2A",
            "@multimediatype": "Scalable Vector Graphics file",
            "@type": "ALTIMG",
            "@size": "11136",
            "@ref": "si8",
            "@mimetype": "image/svg+xml"
        },
        {
            "@category": "thumbnail",
            "@_fa": "true",
            "$": "https://api.elsevier.com/content/object/eid/1-s2.0-S0306261923014654-si81.svg?httpAccept=%2A%2F%2A",
            "@multimediatype": "Scalable Vector Graphics file",
            "@type": "ALTIMG",
            "@size": "13180",
            "@ref": "si81",
            "@mimetype": "image/svg+xml"
        },
        {
            "@category": "thumbnail",
            "@_fa": "true",
            "$": "https://api.elsevier.com/content/object/eid/1-s2.0-S0306261923014654-si82.svg?httpAccept=%2A%2F%2A",
            "@multimediatype": "Scalable Vector Graphics file",
            "@type": "ALTIMG",
            "@size": "25251",
            "@ref": "si82",
            "@mimetype": "image/svg+xml"
        },
        {
            "@category": "thumbnail",
            "@_fa": "true",
            "$": "https://api.elsevier.com/content/object/eid/1-s2.0-S0306261923014654-si83.svg?httpAccept=%2A%2F%2A",
            "@multimediatype": "Scalable Vector Graphics file",
            "@type": "ALTIMG",
            "@size": "44895",
            "@ref": "si83",
            "@mimetype": "image/svg+xml"
        },
        {
            "@category": "thumbnail",
            "@_fa": "true",
            "$": "https://api.elsevier.com/content/object/eid/1-s2.0-S0306261923014654-si86.svg?httpAccept=%2A%2F%2A",
            "@multimediatype": "Scalable Vector Graphics file",
            "@type": "ALTIMG",
            "@size": "1252",
            "@ref": "si86",
            "@mimetype": "image/svg+xml"
        },
        {
            "@category": "thumbnail",
            "@_fa": "true",
            "$": "https://api.elsevier.com/content/object/eid/1-s2.0-S0306261923014654-si87.svg?httpAccept=%2A%2F%2A",
            "@multimediatype": "Scalable Vector Graphics file",
            "@type": "ALTIMG",
            "@size": "1571",
            "@ref": "si87",
            "@mimetype": "image/svg+xml"
        },
        {
            "@category": "thumbnail",
            "@_fa": "true",
            "$": "https://api.elsevier.com/content/object/eid/1-s2.0-S0306261923014654-si88.svg?httpAccept=%2A%2F%2A",
            "@multimediatype": "Scalable Vector Graphics file",
            "@type": "ALTIMG",
            "@size": "13028",
            "@ref": "si88",
            "@mimetype": "image/svg+xml"
        },
        {
            "@category": "thumbnail",
            "@_fa": "true",
            "$": "https://api.elsevier.com/content/object/eid/1-s2.0-S0306261923014654-si89.svg?httpAccept=%2A%2F%2A",
            "@multimediatype": "Scalable Vector Graphics file",
            "@type": "ALTIMG",
            "@size": "3161",
            "@ref": "si89",
            "@mimetype": "image/svg+xml"
        },
        {
            "@category": "thumbnail",
            "@_fa": "true",
            "$": "https://api.elsevier.com/content/object/eid/1-s2.0-S0306261923014654-si9.svg?httpAccept=%2A%2F%2A",
            "@multimediatype": "Scalable Vector Graphics file",
            "@type": "ALTIMG",
            "@size": "8108",
            "@ref": "si9",
            "@mimetype": "image/svg+xml"
        },
        {
            "@category": "thumbnail",
            "@_fa": "true",
            "$": "https://api.elsevier.com/content/object/eid/1-s2.0-S0306261923014654-si92.svg?httpAccept=%2A%2F%2A",
            "@multimediatype": "Scalable Vector Graphics file",
            "@type": "ALTIMG",
            "@size": "20175",
            "@ref": "si92",
            "@mimetype": "image/svg+xml"
        },
        {
            "@category": "thumbnail",
            "@_fa": "true",
            "$": "https://api.elsevier.com/content/object/eid/1-s2.0-S0306261923014654-si94.svg?httpAccept=%2A%2F%2A",
            "@multimediatype": "Scalable Vector Graphics file",
            "@type": "ALTIMG",
            "@size": "11288",
            "@ref": "si94",
            "@mimetype": "image/svg+xml"
        },
        {
            "@category": "thumbnail",
            "@_fa": "true",
            "$": "https://api.elsevier.com/content/object/eid/1-s2.0-S0306261923014654-si96.svg?httpAccept=%2A%2F%2A",
            "@multimediatype": "Scalable Vector Graphics file",
            "@type": "ALTIMG",
            "@size": "14146",
            "@ref": "si96",
            "@mimetype": "image/svg+xml"
        },
        {
            "@category": "thumbnail",
            "@_fa": "true",
            "$": "https://api.elsevier.com/content/object/eid/1-s2.0-S0306261923014654-si97.svg?httpAccept=%2A%2F%2A",
            "@multimediatype": "Scalable Vector Graphics file",
            "@type": "ALTIMG",
            "@size": "9000",
            "@ref": "si97",
            "@mimetype": "image/svg+xml"
        },
        {
            "@category": "thumbnail",
            "@_fa": "true",
            "$": "https://api.elsevier.com/content/object/eid/1-s2.0-S0306261923014654-si98.svg?httpAccept=%2A%2F%2A",
            "@multimediatype": "Scalable Vector Graphics file",
            "@type": "ALTIMG",
            "@size": "3271",
            "@ref": "si98",
            "@mimetype": "image/svg+xml"
        },
        {
            "@category": "thumbnail",
            "@_fa": "true",
            "$": "https://api.elsevier.com/content/object/eid/1-s2.0-S0306261923014654-si99.svg?httpAccept=%2A%2F%2A",
            "@multimediatype": "Scalable Vector Graphics file",
            "@type": "ALTIMG",
            "@size": "2888",
            "@ref": "si99",
            "@mimetype": "image/svg+xml"
        },
        {
            "@category": "standard",
            "@_fa": "true",
            "$": "https://api.elsevier.com/content/object/eid/1-s2.0-S0306261923014654-am.pdf?httpAccept=%2A%2F%2A",
            "@multimediatype": "Acrobat PDF file",
            "@type": "AAM-PDF",
            "@size": "11943703",
            "@ref": "am",
            "@mimetype": "application/pdf"
        }
    ]},
    "link": {
        "@rel": "abstract",
        "@href": "https://api.elsevier.com/content/abstract/scopus_id/85175200661"
    }
}}